created virtual environment CPython3.12.4.final.0-64 in 779ms
  creator CPython3Posix(dest=/localscratch/aneumann.46806153.0/env, clear=False, no_vcs_ignore=False, global=False)
  seeder FromAppData(download=False, pip=bundle, via=copy, app_data_dir=/home/aneumann/.local/share/virtualenv)
    added seed packages: pip==24.2+computecanada
  activators BashActivator,CShellActivator,FishActivator,NushellActivator,PowerShellActivator,PythonActivator
Looking in links: /cvmfs/soft.computecanada.ca/custom/python/wheelhouse/gentoo2023/x86-64-v3, /cvmfs/soft.computecanada.ca/custom/python/wheelhouse/gentoo2023/generic, /cvmfs/soft.computecanada.ca/custom/python/wheelhouse/generic
Requirement already satisfied: pip in /localscratch/aneumann.46806153.0/env/lib/python3.12/site-packages (24.2+computecanada)
Processing /cvmfs/soft.computecanada.ca/custom/python/wheelhouse/generic/pip-25.0+computecanada-py3-none-any.whl
Installing collected packages: pip
  Attempting uninstall: pip
    Found existing installation: pip 24.2+computecanada
    Uninstalling pip-24.2+computecanada:
      Successfully uninstalled pip-24.2+computecanada
Successfully installed pip-24.2+computecanada
Looking in links: /cvmfs/soft.computecanada.ca/custom/python/wheelhouse/gentoo2023/x86-64-v3, /cvmfs/soft.computecanada.ca/custom/python/wheelhouse/gentoo2023/generic, /cvmfs/soft.computecanada.ca/custom/python/wheelhouse/generic
ERROR: protobuf-5.28.3-cp38-abi3-manylinux2014_x86_64.whl is not a supported wheel on this platform.
Looking in links: /cvmfs/soft.computecanada.ca/custom/python/wheelhouse/gentoo2023/x86-64-v3, /cvmfs/soft.computecanada.ca/custom/python/wheelhouse/gentoo2023/generic, /cvmfs/soft.computecanada.ca/custom/python/wheelhouse/generic
Processing /home/aneumann/projects/def-adhaj/aneumann/GNRS/wheels/immutabledict-4.2.0-py3-none-any.whl
Installing collected packages: immutabledict
Successfully installed immutabledict-4.2.0
Looking in links: /cvmfs/soft.computecanada.ca/custom/python/wheelhouse/gentoo2023/x86-64-v3, /cvmfs/soft.computecanada.ca/custom/python/wheelhouse/gentoo2023/generic, /cvmfs/soft.computecanada.ca/custom/python/wheelhouse/generic
Processing /cvmfs/soft.computecanada.ca/custom/python/wheelhouse/generic/ortools-9.10.4067+computecanada-cp312-cp312-linux_x86_64.whl (from -r /home/aneumann/projects/def-adhaj/aneumann/GNRS/requirements/or.txt (line 1))
Processing /cvmfs/soft.computecanada.ca/custom/python/wheelhouse/gentoo2023/x86-64-v3/matplotlib-3.10.0+computecanada-cp312-cp312-linux_x86_64.whl (from -r /home/aneumann/projects/def-adhaj/aneumann/GNRS/requirements/or.txt (line 2))
Processing /cvmfs/soft.computecanada.ca/custom/python/wheelhouse/gentoo2023/x86-64-v3/pandas-2.2.3+computecanada-cp312-cp312-linux_x86_64.whl (from -r /home/aneumann/projects/def-adhaj/aneumann/GNRS/requirements/or.txt (line 3))
Processing /cvmfs/soft.computecanada.ca/custom/python/wheelhouse/generic/absl_py-2.3.0+computecanada-py3-none-any.whl (from ortools<9.11,>=9.10->-r /home/aneumann/projects/def-adhaj/aneumann/GNRS/requirements/or.txt (line 1))
Processing /cvmfs/soft.computecanada.ca/custom/python/wheelhouse/gentoo2023/generic/numpy-2.2.2+computecanada-cp312-cp312-linux_x86_64.whl (from ortools<9.11,>=9.10->-r /home/aneumann/projects/def-adhaj/aneumann/GNRS/requirements/or.txt (line 1))
Processing /cvmfs/soft.computecanada.ca/custom/python/wheelhouse/gentoo2023/x86-64-v3/protobuf-6.31.1+computecanada-cp312-cp312-linux_x86_64.whl (from ortools<9.11,>=9.10->-r /home/aneumann/projects/def-adhaj/aneumann/GNRS/requirements/or.txt (line 1))
Requirement already satisfied: immutabledict>=3.0.0 in /localscratch/aneumann.46806153.0/env/lib/python3.12/site-packages (from ortools<9.11,>=9.10->-r /home/aneumann/projects/def-adhaj/aneumann/GNRS/requirements/or.txt (line 1)) (4.2.0)
Processing /cvmfs/soft.computecanada.ca/custom/python/wheelhouse/gentoo2023/generic/contourpy-1.3.1+computecanada-cp312-cp312-linux_x86_64.whl (from matplotlib->-r /home/aneumann/projects/def-adhaj/aneumann/GNRS/requirements/or.txt (line 2))
Processing /cvmfs/soft.computecanada.ca/custom/python/wheelhouse/generic/cycler-0.12.1+computecanada-py3-none-any.whl (from matplotlib->-r /home/aneumann/projects/def-adhaj/aneumann/GNRS/requirements/or.txt (line 2))
Processing /cvmfs/soft.computecanada.ca/custom/python/wheelhouse/generic/fonttools-4.59.0+computecanada-cp312-cp312-linux_x86_64.whl (from matplotlib->-r /home/aneumann/projects/def-adhaj/aneumann/GNRS/requirements/or.txt (line 2))
Processing /cvmfs/soft.computecanada.ca/custom/python/wheelhouse/gentoo2023/x86-64-v3/kiwisolver-1.4.8+computecanada-cp312-cp312-linux_x86_64.whl (from matplotlib->-r /home/aneumann/projects/def-adhaj/aneumann/GNRS/requirements/or.txt (line 2))
Processing /cvmfs/soft.computecanada.ca/custom/python/wheelhouse/generic/packaging-25.0+computecanada-py3-none-any.whl (from matplotlib->-r /home/aneumann/projects/def-adhaj/aneumann/GNRS/requirements/or.txt (line 2))
Processing /cvmfs/soft.computecanada.ca/custom/python/wheelhouse/gentoo2023/x86-64-v3/pillow-11.1.0+computecanada-cp312-cp312-linux_x86_64.whl (from matplotlib->-r /home/aneumann/projects/def-adhaj/aneumann/GNRS/requirements/or.txt (line 2))
Processing /cvmfs/soft.computecanada.ca/custom/python/wheelhouse/generic/pyparsing-3.2.3+computecanada-py3-none-any.whl (from matplotlib->-r /home/aneumann/projects/def-adhaj/aneumann/GNRS/requirements/or.txt (line 2))
Processing /cvmfs/soft.computecanada.ca/custom/python/wheelhouse/generic/python_dateutil-2.9.0.post0+computecanada-py2.py3-none-any.whl (from matplotlib->-r /home/aneumann/projects/def-adhaj/aneumann/GNRS/requirements/or.txt (line 2))
Processing /cvmfs/soft.computecanada.ca/custom/python/wheelhouse/generic/pytz-2025.2+computecanada-py2.py3-none-any.whl (from pandas->-r /home/aneumann/projects/def-adhaj/aneumann/GNRS/requirements/or.txt (line 3))
Processing /cvmfs/soft.computecanada.ca/custom/python/wheelhouse/generic/tzdata-2025.2+computecanada-py2.py3-none-any.whl (from pandas->-r /home/aneumann/projects/def-adhaj/aneumann/GNRS/requirements/or.txt (line 3))
Processing /cvmfs/soft.computecanada.ca/custom/python/wheelhouse/generic/six-1.17.0+computecanada-py2.py3-none-any.whl (from python-dateutil>=2.7->matplotlib->-r /home/aneumann/projects/def-adhaj/aneumann/GNRS/requirements/or.txt (line 2))
Installing collected packages: pytz, tzdata, six, pyparsing, protobuf, pillow, packaging, numpy, kiwisolver, fonttools, cycler, absl-py, python-dateutil, contourpy, pandas, matplotlib, ortools
Successfully installed absl-py-2.3.0+computecanada contourpy-1.3.1+computecanada cycler-0.12.1+computecanada fonttools-4.59.0+computecanada kiwisolver-1.4.8+computecanada matplotlib-3.10.0+computecanada numpy-2.2.2+computecanada ortools-9.10.4067+computecanada packaging-25.0+computecanada pandas-2.2.3+computecanada pillow-11.1.0+computecanada protobuf-6.31.1+computecanada pyparsing-3.2.3+computecanada python-dateutil-2.9.0.post0+computecanada pytz-2025.2+computecanada six-1.17.0+computecanada tzdata-2025.2+computecanada

Starting CP-SAT solver v9.10.4067
Parameters: max_time_in_seconds: 86400 max_memory_in_mb: 185000 log_search_progress: true enumerate_all_solutions: false num_search_workers: 32 absolute_gap_limit: 0 relative_gap_limit: 0

Initial optimization model '': (model_fingerprint: 0x3fa86efd8bd80ff0)
#Variables: 231 (#ints: 8 in objective)
  - 159 Booleans in [0,1]
  - 72 in [0,488]
#kLinear1: 34
#kLinear2: 302
#kLinear3: 151
#kLinearN: 1'999 (#terms: 27'196)

Starting presolve at 0.00s
  1.11e-03s  0.00e+00d  [DetectDominanceRelations] 
  2.28e-02s  0.00e+00d  [PresolveToFixPoint] #num_loops=8 #num_dual_strengthening=3 
  2.60e-05s  0.00e+00d  [ExtractEncodingFromLinear] #potential_supersets=3 
[Symmetry] Graph for symmetry has 2'390 nodes and 19'953 arcs.
[Symmetry] Symmetry computation done. time: 0.0011215 dtime: 0.00159538
[Symmetry] #generators: 1, average support size: 20
[Symmetry] The model contains 120 duplicate constraints !
[Symmetry] 10 orbits with sizes: 2,2,2,2,2,2,2,2,2,2
[Symmetry] Num fixable by intersecting at_most_one with orbits: 1 largest_orbit: 2
  5.47e-03s  8.85e-04d  [Probe] #probed=206 #new_bounds=9 #equiv=1 
  7.80e-05s  0.00e+00d  [MaxClique] Merged 41(82 literals) into 12(24 literals) at_most_ones. 
  1.02e-03s  0.00e+00d  [DetectDominanceRelations] 
  9.90e-03s  0.00e+00d  [PresolveToFixPoint] #num_loops=5 #num_dual_strengthening=3 
  4.20e-03s  0.00e+00d  [ProcessAtMostOneAndLinear] 
  1.84e-03s  0.00e+00d  [DetectDuplicateConstraints] #duplicates=158 #without_enforcements=111 
  1.36e-03s  9.67e-05d  [DetectDominatedLinearConstraints] #relevant_constraints=1'580 #num_inclusions=1'454 
  2.31e-04s  0.00e+00d  [DetectDifferentVariables] #different=13 #cliques=1 #size=4 
  3.18e-04s  2.36e-05d  [ProcessSetPPC] #relevant_constraints=1'235 
  1.47e-05s  0.00e+00d  [FindAlmostIdenticalLinearConstraints] 
  7.94e-05s  7.52e-05d  [FindBigAtMostOneAndLinearOverlap] 
  3.38e-03s  1.53e-03d  [FindBigVerticalLinearOverlap] #blocks=34 #saved_nz=3'357 
  1.70e-04s  5.43e-05d  [FindBigHorizontalLinearOverlap] #linears=1'198 
  1.25e-05s  0.00e+00d  [MergeClauses] 
  1.10e-03s  0.00e+00d  [DetectDominanceRelations] 
  1.71e-02s  0.00e+00d  [PresolveToFixPoint] #num_loops=2 #num_dual_strengthening=1 
  1.10e-03s  0.00e+00d  [DetectDominanceRelations] 
  9.26e-03s  0.00e+00d  [PresolveToFixPoint] #num_loops=1 #num_dual_strengthening=1 
[Symmetry] Graph for symmetry has 2'288 nodes and 15'655 arcs.
[Symmetry] Symmetry computation done. time: 0.000510281 dtime: 0.00082935
  5.03e-03s  8.24e-04d  [Probe] #probed=206 #new_bounds=21 
  8.39e-06s  0.00e+00d  [MaxClique] 
  1.08e-03s  0.00e+00d  [DetectDominanceRelations] 
  1.44e-02s  0.00e+00d  [PresolveToFixPoint] #num_loops=2 #num_dual_strengthening=1 
  3.56e-03s  0.00e+00d  [ProcessAtMostOneAndLinear] 
  1.66e-03s  0.00e+00d  [DetectDuplicateConstraints] #without_enforcements=148 
  6.55e-04s  4.17e-05d  [DetectDominatedLinearConstraints] #relevant_constraints=1'283 #num_inclusions=264 
  1.45e-04s  0.00e+00d  [DetectDifferentVariables] 
  2.62e-04s  1.52e-05d  [ProcessSetPPC] #relevant_constraints=1'059 
  1.80e-05s  4.50e-08d  [FindAlmostIdenticalLinearConstraints] #num_tested_pairs=3 
  3.84e-05s  3.27e-05d  [FindBigAtMostOneAndLinearOverlap] 
  1.65e-03s  1.01e-03d  [FindBigVerticalLinearOverlap] #blocks=17 #saved_nz=1'145 
  1.47e-04s  4.20e-05d  [FindBigHorizontalLinearOverlap] #linears=1'014 
  8.57e-06s  0.00e+00d  [MergeClauses] 
  1.02e-03s  0.00e+00d  [DetectDominanceRelations] 
  1.23e-02s  0.00e+00d  [PresolveToFixPoint] #num_loops=2 #num_dual_strengthening=1 
  1.07e-03s  0.00e+00d  [DetectDominanceRelations] 
  9.27e-03s  0.00e+00d  [PresolveToFixPoint] #num_loops=1 #num_dual_strengthening=1 
[Symmetry] Graph for symmetry has 2'330 nodes and 14'518 arcs.
[Symmetry] Symmetry computation done. time: 0.000443546 dtime: 0.00078572
  4.76e-03s  8.07e-04d  [Probe] #probed=206 #new_bounds=15 
  8.39e-06s  0.00e+00d  [MaxClique] 
  1.06e-03s  0.00e+00d  [DetectDominanceRelations] 
  1.16e-02s  0.00e+00d  [PresolveToFixPoint] #num_loops=2 #num_dual_strengthening=1 
  3.25e-03s  0.00e+00d  [ProcessAtMostOneAndLinear] 
  1.63e-03s  0.00e+00d  [DetectDuplicateConstraints] #without_enforcements=161 
  4.89e-04s  3.01e-05d  [DetectDominatedLinearConstraints] #relevant_constraints=1'200 #num_inclusions=34 
  1.17e-04s  0.00e+00d  [DetectDifferentVariables] 
  2.65e-04s  1.21e-05d  [ProcessSetPPC] #relevant_constraints=962 
  2.90e-05s  2.85e-07d  [FindAlmostIdenticalLinearConstraints] #num_tested_pairs=18 
  3.47e-05s  2.70e-05d  [FindBigAtMostOneAndLinearOverlap] 
  1.04e-03s  8.24e-04d  [FindBigVerticalLinearOverlap] #blocks=4 #saved_nz=123 
  1.34e-04s  3.92e-05d  [FindBigHorizontalLinearOverlap] #linears=960 
  8.55e-06s  0.00e+00d  [MergeClauses] 
  1.05e-03s  0.00e+00d  [DetectDominanceRelations] 
  9.89e-03s  0.00e+00d  [PresolveToFixPoint] #num_loops=2 #num_dual_strengthening=1 
  5.25e-05s  0.00e+00d  [ExpandObjective] #entries=178 #tight_variables=80 #tight_constraints=46 

Presolve summary:
  - 49 affine relations were detected.
  - rule 'TODO dual: only one blocking constraint?' was applied 492 times.
  - rule 'TODO dual: only one blocking enforced constraint?' was applied 52 times.
  - rule 'TODO dual: only one unspecified blocking constraint?' was applied 25 times.
  - rule 'TODO duplicate: identical constraint with different enforcements' was applied 420 times.
  - rule 'affine: new relation' was applied 49 times.
  - rule 'at_most_one: removed literals' was applied 12 times.
  - rule 'at_most_one: size one' was applied 12 times.
  - rule 'at_most_one: transformed into max clique.' was applied 1 time.
  - rule 'deductions: 137 stored' was applied 1 time.
  - rule 'dual: fix variable' was applied 21 times.
  - rule 'dual: reduced domain' was applied 32 times.
  - rule 'duplicate: merged rhs of linear constraint' was applied 30 times.
  - rule 'duplicate: removed constraint' was applied 158 times.
  - rule 'enforcement: false literal' was applied 8 times.
  - rule 'exactly_one: x and not(x)' was applied 1 time.
  - rule 'incompatible linear: add implication' was applied 18 times.
  - rule 'linear matrix: common vertical rectangle' was applied 55 times.
  - rule 'linear: always true' was applied 488 times.
  - rule 'linear: doubleton free' was applied 9 times.
  - rule 'linear: empty' was applied 26 times.
  - rule 'linear: extracted enforcement literal' was applied 4'900 times.
  - rule 'linear: fixed or dup variables' was applied 2'045 times.
  - rule 'linear: positive equal one' was applied 3 times.
  - rule 'linear: reduced variable domains' was applied 135 times.
  - rule 'linear: remapped using affine relations' was applied 2'138 times.
  - rule 'linear: simplified rhs' was applied 5'689 times.
  - rule 'linear: tightened into equality' was applied 7 times.
  - rule 'linear: variable substitution 1' was applied 9 times.
  - rule 'no_overlap: inferred from x != y constraints' was applied 1 time.
  - rule 'presolve: 74 unused variables removed.' was applied 1 time.
  - rule 'presolve: iteration' was applied 3 times.
  - rule 'probing: reduced enforced constraint to implication.' was applied 41 times.
  - rule 'symmetry: fixed to false in general orbit' was applied 1 time.

Presolved optimization model '': (model_fingerprint: 0x21b3ea8831d06165)
#Variables: 154 (#ints: 8 in objective)
  - 52 Booleans in [0,1]
  - 1 in [-2321,-1979][-1949,-1491][-1461,-1003][- ... 1,949][979,1437][1467,1925][1955,2413][2443,2803]
  - 1 in [-2288,-1968][-1949,-1480][-1461,-992][-9 ... 4][-485,-16][3,472][491,960][979,1448][1467,1866]
  - 1 in [-2273,-1979][-1949,-1491][-1461,-1003][- ... ][3,461][491,949][979,1437][1467,1925][1955,2347]
  - 1 in [-1398,-1031][-978,-543][-490,-55][-2,335]
  - 1 in [-1395,-1003][-973,-515][-485,-27][3,461][491,851]
  - 1 in [-1395,-1003][-973,-515][-485,-27][3,461][491,949][979,1339]
  - 1 in [-1395,-1003][-973,-515][-485,-27][3,461][491,949][979,1437][1467,1859]
  - 1 in [-1391,-992][-973,-504][-485,-16][3,472][491,960][979,1350]
  - 1 in [-928,-543][-490,-55][-2,335]
  - 1 in [-914,-529][-477,-41][11,349]
  - 1 in [-912,-590][-490,-102][-2,386][486,874][974,1362][1462,1850][1950,2320]
  - 1 in [-907,-537][-485,-49][3,439][491,927][979,1383]
  - 1 in [-907,-515][-485,-27][3,461][491,883]
  - 1 in [-907,-515][-485,-27][3,461][491,949][979,1371]
  - 1 in [-907,-515][-485,-27][3,461][491,949][979,1437][1467,1859]
  - 1 in [-903,-504][-485,-16][3,472][491,960][979,1378]
  - 1 in [-490,-55][-2,363]
  - 2 in [-488,-52][0,436]
  - 3 in [-488,-30][0,458]
  - 1 in [-485,-16][3,472][491,960]
  - 1 in [-440,-55][-2,396]
  - 1 in [-440,-41][11,349]
  - 1 in [-438,-50][50,438][538,862]
  - 1 in [-438,-50][50,438][538,926][1026,1350]
  - 1 in [-438,-50][50,438][538,926][1026,1414][1514,1836]
  - 1 in [-438,-50][50,438][538,926][1026,1414][1514,1838]
  - 1 in [-438,-50][50,438][538,926][1026,1414][1514,1902][2002,2324]
  - 1 in [-422,-70][-2,350]
  - 1 in [-422,-70][-2,418][486,838]
  - 1 in [-422,-70][-2,418][486,906][974,1326]
  - 1 in [-419,-49][3,439][491,895]
  - 1 in [-419,-49][3,439][491,927][979,1383]
  - 1 in [-419,-27][3,461][491,883]
  - 1 in [-415,-16][3,472][491,960][979,1378]
  - 1 in [-2,386]
  - 1 in [-2,418]
  - 1 in [-2,420]
  - 1 in [-2,433]
  - 4 in [0,352]
  - 1 in [0,357]
  - 2 in [0,365]
  - 1 in [0,383]
  - 3 in [0,388]
  - 1 in [0,388][488,876]
  - 1 in [0,394]
  - 3 in [0,399]
  - 1 in [0,406]
  - 1 in [0,420]
  - 1 in [0,422]
  - 1 in [0,432]
  - 1 in [0,435]
  - 3 in [0,436]
  - 3 in [0,458]
  - 1 in [0,469]
  - 1 in [3,391]
  - 1 in [3,423]
  - 1 in [3,425]
  - 1 in [3,438]
  - 1 in [3,439]
  - 1 in [3,439][491,918]
  - 1 in [3,461]
  - 1 in [3,461][491,949]
  - 1 in [3,472]
  - 1 in [3,472][491,960]
  - 1 in [5,425]
  - 1 in [11,447]
  - 1 in [16,452]
  - 1 in [45,477]
  - 1 in [49,386][486,871]
  - 1 in [50,438]
  - 1 in [50,438][538,926]
  - 1 in [50,438][538,926][1026,1377]
  - 1 in [50,438][538,926][1026,1414][1514,1836]
  - 1 in [53,420][486,853]
  - 1 in [57,477]
  - 1 in [58,472][491,960][979,1393]
  - 1 in [64,386][486,874][974,1344]
  - 1 in [68,420][486,908][974,1326]
  - 1 in [68,420][486,908][974,1396][1462,1786]
  - 1 in [71,477]
  - 1 in [78,477]
  - 1 in [83,477]
  - 2 in [94,477]
  - 2 in [120,477]
  - 1 in [136,488]
#kExactlyOne: 2 (#literals: 6)
#kInterval: 4
#kLinear2: 605 (#enforced: 570 #multi: 513)
#kLinear3: 145 (#enforced: 73)
#kLinearN: 1'010 (#enforced: 949 #multi: 84) (#terms: 7'971)
#kNoOverlap: 1 (#intervals: 4)

Preloading model.
#Bound   0.17s best:inf   next:[141,3284] initial_domain
[Symmetry] Graph for symmetry has 2'207 nodes and 14'396 arcs.
[Symmetry] Symmetry computation done. time: 0.000400324 dtime: 0.00077121
#Model   0.18s var:154/154 constraints:1767/1767

Starting search at 0.18s with 32 workers.
17 full problem subsolvers: [core, default_lp, fixed, lb_tree_search, max_lp, no_lp, objective_lb_search, objective_lb_search_max_lp, objective_lb_search_no_lp, objective_shaving_search_max_lp, objective_shaving_search_no_lp, probing, probing_max_lp, pseudo_costs, quick_restart, quick_restart_no_lp, reduced_costs]
13 first solution subsolvers: [fj_long_default, fj_long_lin_default, fj_long_random, fj_short_default, fj_short_lin_default, fj_short_lin_random, fj_short_random, fs_random(2), fs_random_no_lp, fs_random_quick_restart(2), fs_random_quick_restart_no_lp]
13 incomplete subsolvers: [feasibility_pump, graph_arc_lns, graph_cst_lns, graph_dec_lns, graph_var_lns, rins/rens, rnd_cst_lns, rnd_var_lns, scheduling_intervals_lns, scheduling_precedences_lns, scheduling_time_window_lns, violation_ls(2)]
3 helper subsolvers: [neighborhood_helper, synchronization_agent, update_gap_integral]
#Bound   0.22s best:inf   next:[191,3284] fixed
#Bound   0.23s best:inf   next:[209,3284] fixed
#Bound   0.24s best:inf   next:[225,3284] fixed
#Bound   0.26s best:inf   next:[235,3284] fixed
#Bound   0.34s best:inf   next:[248,3284] default_lp
#1       0.36s best:1304  next:[248,1303] fixed (fixed_bools=0/170)
#2       0.41s best:1276  next:[248,1275] no_lp (fixed_bools=0/84)
#3       0.42s best:1006  next:[248,1005] no_lp (fixed_bools=0/96)
#4       0.42s best:941   next:[248,940]  no_lp (fixed_bools=0/103)
#5       0.42s best:869   next:[248,868]  no_lp (fixed_bools=0/105)
#Bound   0.43s best:869   next:[287,868]  objective_lb_search_no_lp
#Bound   0.43s best:869   next:[288,868]  objective_lb_search_no_lp
#Bound   0.43s best:869   next:[322,868]  objective_lb_search_no_lp
#Bound   0.44s best:869   next:[323,868]  objective_lb_search_no_lp
#6       0.46s best:841   next:[323,840]  no_lp (fixed_bools=0/119)
#7       0.48s best:836   next:[323,835]  no_lp (fixed_bools=0/130)
#8       0.57s best:832   next:[323,831]  no_lp (fixed_bools=0/165)
#9       0.58s best:805   next:[323,804]  no_lp (fixed_bools=0/183)
#10      0.58s best:804   next:[323,803]  no_lp (fixed_bools=0/183)
#11      0.59s best:802   next:[323,801]  no_lp (fixed_bools=0/184)
#12      0.59s best:801   next:[323,800]  no_lp (fixed_bools=0/184)
#Bound   0.61s best:801   next:[346,800]  objective_lb_search_no_lp
#Bound   0.61s best:801   next:[384,800]  objective_lb_search_no_lp
#Bound   0.61s best:801   next:[385,800]  objective_lb_search_no_lp
#Bound   0.62s best:801   next:[396,800]  objective_lb_search_no_lp
#Bound   0.85s best:801   next:[421,800]  objective_lb_search_max_lp
#Bound   0.86s best:801   next:[423,800]  objective_lb_search_no_lp
#Bound   0.87s best:801   next:[424,800]  objective_lb_search_no_lp
#Bound   0.87s best:801   next:[426,800]  objective_lb_search_no_lp
#Bound   0.88s best:801   next:[506,800]  objective_lb_search_no_lp
#Bound   0.88s best:801   next:[509,800]  objective_lb_search_no_lp
#13      0.90s best:788   next:[509,787]  no_lp (fixed_bools=0/255)
#Bound   0.90s best:788   next:[533,787]  objective_lb_search_no_lp
#Bound   0.99s best:788   next:[549,787]  objective_lb_search_no_lp [skipped_logs=3]
#Bound   1.93s best:788   next:[616,787]  objective_lb_search_no_lp [skipped_logs=12]
#14      2.94s best:781   next:[624,780]  pseudo_costs (fixed_bools=0/81)
#Bound   2.62s best:788   next:[624,787]  objective_lb_search_no_lp [skipped_logs=4]
#Bound   3.98s best:781   next:[644,780]  lb_tree_search (nodes=256/256 rc=1 decisions=1835 @root=6 restarts=1)  [skipped_logs=6]
#Model   4.83s var:153/154 constraints:1599/1767
#Bound   4.88s best:781   next:[668,780]  objective_lb_search_no_lp [skipped_logs=7]
#Model   5.01s var:151/154 constraints:1375/1767
#Model   5.24s var:150/154 constraints:1367/1767
#Model   5.35s var:146/154 constraints:1093/1767
#Model   5.36s var:145/154 constraints:1069/1767
#Done    5.38s no_lp
#Done    5.38s objective_lb_search_no_lp
#Model   5.38s var:136/154 constraints:756/1767
#Done    5.38s objective_lb_search_max_lp
#Done    5.38s core
#Model   5.38s var:135/154 constraints:709/1767
#Bound   5.38s best:781   next:[748,780]  objective_lb_search_no_lp [skipped_logs=9]

Task timing                                  n [     min,      max]      avg      dev     time         n [     min,      max]      avg      dev    dtime
                             'core':         1 [   5.20s,    5.20s]    5.20s   0.00ns    5.20s         1 [   3.89s,    3.89s]    3.89s   0.00ns    3.89s
                       'default_lp':         1 [   5.20s,    5.20s]    5.20s   0.00ns    5.20s         1 [   1.12s,    1.12s]    1.12s   0.00ns    1.12s
                 'feasibility_pump':        17 [ 27.47ms, 181.55ms]  53.40ms  35.40ms 907.77ms        16 [  6.98ms,  10.79ms]   7.24ms 918.68us 115.78ms
                            'fixed':         1 [   5.20s,    5.20s]    5.20s   0.00ns    5.20s         1 [   1.00s,    1.00s]    1.00s   0.00ns    1.00s
                  'fj_long_default':         1 [315.65ms, 315.65ms] 315.65ms   0.00ns 315.65ms         1 [ 78.13ms,  78.13ms]  78.13ms   0.00ns  78.13ms
              'fj_long_lin_default':         1 [279.23ms, 279.23ms] 279.23ms   0.00ns 279.23ms         1 [ 67.37ms,  67.37ms]  67.37ms   0.00ns  67.37ms
                   'fj_long_random':         1 [627.42ms, 627.42ms] 627.42ms   0.00ns 627.42ms         1 [ 73.31ms,  73.31ms]  73.31ms   0.00ns  73.31ms
                 'fj_short_default':         1 [187.27ms, 187.27ms] 187.27ms   0.00ns 187.27ms         1 [ 66.01ms,  66.01ms]  66.01ms   0.00ns  66.01ms
             'fj_short_lin_default':         1 [345.97ms, 345.97ms] 345.97ms   0.00ns 345.97ms         1 [ 67.98ms,  67.98ms]  67.98ms   0.00ns  67.98ms
              'fj_short_lin_random':         1 [416.24ms, 416.24ms] 416.24ms   0.00ns 416.24ms         1 [ 67.96ms,  67.96ms]  67.96ms   0.00ns  67.96ms
                  'fj_short_random':         1 [150.45ms, 150.45ms] 150.45ms   0.00ns 150.45ms         1 [ 69.62ms,  69.62ms]  69.62ms   0.00ns  69.62ms
                        'fs_random':         1 [194.85ms, 194.85ms] 194.85ms   0.00ns 194.85ms         1 [ 20.00ns,  20.00ns]  20.00ns   0.00ns  20.00ns
                        'fs_random':         1 [213.00ms, 213.00ms] 213.00ms   0.00ns 213.00ms         1 [387.36us, 387.36us] 387.36us   0.00ns 387.36us
                  'fs_random_no_lp':         1 [310.63ms, 310.63ms] 310.63ms   0.00ns 310.63ms         0 [  0.00ns,   0.00ns]   0.00ns   0.00ns   0.00ns
          'fs_random_quick_restart':         1 [222.87ms, 222.87ms] 222.87ms   0.00ns 222.87ms         1 [ 20.00ns,  20.00ns]  20.00ns   0.00ns  20.00ns
          'fs_random_quick_restart':         1 [401.55ms, 401.55ms] 401.55ms   0.00ns 401.55ms         1 [ 20.00ns,  20.00ns]  20.00ns   0.00ns  20.00ns
    'fs_random_quick_restart_no_lp':         1 [172.35ms, 172.35ms] 172.35ms   0.00ns 172.35ms         0 [  0.00ns,   0.00ns]   0.00ns   0.00ns   0.00ns
                    'graph_arc_lns':        17 [  3.37ms, 809.97ms] 259.17ms 255.98ms    4.41s        16 [ 10.00ns, 100.02ms]  23.78ms  39.21ms 380.45ms
                    'graph_cst_lns':        17 [  1.15ms, 169.51ms]  13.34ms  39.89ms 226.81ms         0 [  0.00ns,   0.00ns]   0.00ns   0.00ns   0.00ns
                    'graph_dec_lns':        17 [  4.72ms, 671.15ms] 264.26ms 207.97ms    4.49s        17 [ 10.00ns, 100.18ms]  26.59ms  34.10ms 452.11ms
                    'graph_var_lns':        17 [  3.32ms, 912.97ms] 280.63ms 284.26ms    4.77s        16 [ 10.00ns, 100.11ms]  26.85ms  39.08ms 429.56ms
                   'lb_tree_search':         1 [   5.19s,    5.19s]    5.19s   0.00ns    5.19s         1 [   1.30s,    1.30s]    1.30s   0.00ns    1.30s
                           'max_lp':         1 [   5.20s,    5.20s]    5.20s   0.00ns    5.20s         1 [   1.11s,    1.11s]    1.11s   0.00ns    1.11s
                            'no_lp':         1 [   5.20s,    5.20s]    5.20s   0.00ns    5.20s         1 [970.45ms, 970.45ms] 970.45ms   0.00ns 970.45ms
              'objective_lb_search':         1 [   5.19s,    5.19s]    5.19s   0.00ns    5.19s         1 [785.17ms, 785.17ms] 785.17ms   0.00ns 785.17ms
       'objective_lb_search_max_lp':         1 [   5.18s,    5.18s]    5.18s   0.00ns    5.18s         1 [   1.53s,    1.53s]    1.53s   0.00ns    1.53s
        'objective_lb_search_no_lp':         1 [   5.18s,    5.18s]    5.18s   0.00ns    5.18s         1 [702.52ms, 702.52ms] 702.52ms   0.00ns 702.52ms
  'objective_shaving_search_max_lp':        17 [  3.29ms, 473.06ms] 174.18ms 132.47ms    2.96s        12 [801.96us,  84.23ms]  23.48ms  26.23ms 281.73ms
   'objective_shaving_search_no_lp':        18 [ 18.18ms, 485.06ms] 169.09ms 139.29ms    3.04s        11 [839.45us,  52.75ms]  16.67ms  18.25ms 183.39ms
                          'probing':         1 [   5.20s,    5.20s]    5.20s   0.00ns    5.20s         1 [364.33ms, 364.33ms] 364.33ms   0.00ns 364.33ms
                   'probing_max_lp':         1 [   5.19s,    5.19s]    5.19s   0.00ns    5.19s         1 [392.50ms, 392.50ms] 392.50ms   0.00ns 392.50ms
                     'pseudo_costs':         1 [   5.19s,    5.19s]    5.19s   0.00ns    5.19s         1 [   1.13s,    1.13s]    1.13s   0.00ns    1.13s
                    'quick_restart':         1 [   5.20s,    5.20s]    5.20s   0.00ns    5.20s         1 [940.80ms, 940.80ms] 940.80ms   0.00ns 940.80ms
              'quick_restart_no_lp':         1 [   5.19s,    5.19s]    5.19s   0.00ns    5.19s         1 [840.71ms, 840.71ms] 840.71ms   0.00ns 840.71ms
                    'reduced_costs':         1 [   5.19s,    5.19s]    5.19s   0.00ns    5.19s         1 [   1.08s,    1.08s]    1.08s   0.00ns    1.08s
                        'rins/rens':        17 [  1.90ms,    1.23s] 414.43ms 343.35ms    7.05s        17 [ 10.00ns, 100.14ms]  52.48ms  43.70ms 892.15ms
                      'rnd_cst_lns':        17 [  1.59ms, 693.88ms] 213.53ms 234.68ms    3.63s        13 [ 10.00ns, 100.03ms]  31.43ms  39.51ms 408.64ms
                      'rnd_var_lns':        17 [  2.03ms, 943.03ms] 287.95ms 281.13ms    4.90s        17 [ 10.00ns, 100.20ms]  28.90ms  40.02ms 491.30ms
         'scheduling_intervals_lns':        17 [124.15ms,    1.91s] 915.91ms 472.32ms   15.57s        16 [ 62.99ms, 100.35ms]  97.80ms   8.99ms    1.56s
       'scheduling_precedences_lns':        17 [ 33.85ms,    1.04s] 706.37ms 244.26ms   12.01s        15 [100.01ms, 116.39ms] 101.18ms   4.07ms    1.52s
       'scheduling_time_window_lns':        17 [112.87ms,    2.54s] 910.23ms 567.53ms   15.47s        16 [ 46.04ms, 100.24ms]  96.71ms  13.08ms    1.55s
                     'violation_ls':        17 [ 35.92ms, 125.53ms]  87.36ms  25.65ms    1.49s        17 [  8.18ms,  71.27ms]  59.72ms  18.29ms    1.02s
                     'violation_ls':        17 [ 38.16ms, 183.15ms]  98.37ms  28.54ms    1.67s        17 [ 31.92ms,  89.58ms]  66.34ms  10.95ms    1.13s

Search stats                        Bools  Conflicts  Branches  Restarts  BoolPropag  IntegerPropag
                           'core':  3'501      3'164    19'711     5'940   5'888'375      1'814'241
                     'default_lp':     87      2'884    14'636     2'955      80'487      1'396'241
                          'fixed':    536     11'153    25'556       585   1'821'663      2'104'895
                      'fs_random':     52          0         0         0           0              0
                      'fs_random':     52          0       104       104          12          1'346
                'fs_random_no_lp':     52          0         0         0           0              0
        'fs_random_quick_restart':     52          0         0         0           0              0
        'fs_random_quick_restart':     52          0         2         2           0              4
  'fs_random_quick_restart_no_lp':     52          0        74        74          12          1'020
                 'lb_tree_search':     58         65    10'088     3'276       9'760        337'743
                         'max_lp':     52      1'508    12'140     2'440      42'945      1'044'301
                          'no_lp':    593      7'918    24'645     3'451   1'411'643      3'252'002
            'objective_lb_search':     78      1'916    13'139     3'280      48'721      1'113'918
     'objective_lb_search_max_lp':     78      1'399     7'986     2'773      28'883        591'797
      'objective_lb_search_no_lp':    160      8'290    17'616     2'364     139'167      2'715'834
                        'probing':    220         93       347       347       3'151         17'947
                 'probing_max_lp':    140         40       240       240         819          6'821
                   'pseudo_costs':     83      1'383    14'381     3'113      53'551      1'084'066
                  'quick_restart':    204      1'486    16'733     2'906     224'259      1'148'660
            'quick_restart_no_lp':    807      6'543    29'506     3'526   1'037'259      2'353'677
                  'reduced_costs':    606      2'479    19'433     2'611     662'450      1'245'161

SAT stats                           ClassicMinim  LitRemoved  LitLearned  LitForgotten  Subsumed  MClauses  MDecisions  MLitTrue  MSubsumed  MLitRemoved  MReused
                           'core':         2'533      11'923      11'045             0        26     2'691      13'376         0        235          746       70
                     'default_lp':         1'293       2'840      24'320             0       284     1'025       9'307         0        294        1'893      193
                          'fixed':         4'408       9'015     138'264             0        48       145       2'113         0         22          137       91
                      'fs_random':             0           0           0             0         0         0           0         0          0            0        0
                      'fs_random':             0           0           0             0         0         0           0         0          0            0        0
                'fs_random_no_lp':             0           0           0             0         0         0           0         0          0            0        0
        'fs_random_quick_restart':             0           0           0             0         0         0           0         0          0            0        0
        'fs_random_quick_restart':             0           0           0             0         0         0           0         0          0            0        0
  'fs_random_quick_restart_no_lp':             0           0           0             0         0         0           0         0          0            0        0
                 'lb_tree_search':             0           0         266             0         1       932       5'113         0         19           83        8
                         'max_lp':           655       1'252      12'706             0       174     1'169       9'803         0        231        1'530      296
                          'no_lp':         5'780      19'333      62'713             0       263     1'774      12'454         2        951        5'792      191
            'objective_lb_search':         1'091       2'212      13'229             0       177       911       8'470         0        137          796      291
     'objective_lb_search_max_lp':           708       1'271      10'511             0       130       442       3'555         0         52          322       99
      'objective_lb_search_no_lp':         6'165      16'544      53'924             0       370       998       6'952         0        452        2'559      233
                        'probing':             0           0          93             0         0         0           0         0          0            0        0
                 'probing_max_lp':             0           0          40             0         0         0           0         0          0            0        0
                   'pseudo_costs':           743       1'763      10'374             0       141     1'269      11'472         0        225        1'367      277
                  'quick_restart':           735       1'768      11'585             0       127     1'496      13'322         0        452        3'043      316
            'quick_restart_no_lp':         3'342       9'084      52'868             0       298     2'004      16'192         2      1'389       10'146      194
                  'reduced_costs':         1'528       4'465      24'348             0       105       994       8'446         0        295        1'959      187

Lp stats                         Component  Iterations  AddedCuts  OPTIMAL  DUAL_F.  DUAL_U.
                  'default_lp':          1      31'742      2'654    3'987        0        0
                       'fixed':          1       6'616      1'011    9'571        0        0
                   'fs_random':          1           0          0        0        0        0
                   'fs_random':          1         121        356        7        0        0
     'fs_random_quick_restart':          1           0          0        0        0        0
     'fs_random_quick_restart':          1           0          0        0        0        0
              'lb_tree_search':          1      32'866      2'632    1'669      702        0
                      'max_lp':          1      24'990      2'665    1'860      622        1
         'objective_lb_search':          1      23'980      2'548    2'877        0        0
  'objective_lb_search_max_lp':          1      41'181      2'545    2'150      775        1
                     'probing':          1       3'887      2'089    1'020        0        1
              'probing_max_lp':          1       1'890      2'297      447       11        0
                'pseudo_costs':          1      29'519      2'293    1'839      642        0
               'quick_restart':          1      20'651      3'143    2'380        0        0
               'reduced_costs':          1      25'893      3'607    3'607      586        1

Lp dimension                                                                     Final dimension of first component
                  'default_lp':  318 rows, 149 columns, 1461 entries with magnitude in [1.579146e-03, 1.000000e+00]
                       'fixed':    83 rows, 149 columns, 266 entries with magnitude in [3.620304e-02, 1.000000e+00]
                   'fs_random':       0 rows, 149 columns, 0 entries with magnitude in [0.000000e+00, 0.000000e+00]
                   'fs_random':   183 rows, 149 columns, 634 entries with magnitude in [1.078822e-02, 1.000000e+00]
     'fs_random_quick_restart':       0 rows, 149 columns, 0 entries with magnitude in [0.000000e+00, 0.000000e+00]
     'fs_random_quick_restart':       0 rows, 149 columns, 0 entries with magnitude in [0.000000e+00, 0.000000e+00]
              'lb_tree_search':  550 rows, 154 columns, 1387 entries with magnitude in [7.427389e-03, 1.000000e+00]
                      'max_lp':  564 rows, 154 columns, 2527 entries with magnitude in [2.626708e-03, 1.000000e+00]
         'objective_lb_search':  319 rows, 149 columns, 1073 entries with magnitude in [3.063525e-03, 1.000000e+00]
  'objective_lb_search_max_lp':  649 rows, 154 columns, 2881 entries with magnitude in [1.311882e-03, 1.000000e+00]
                     'probing':  287 rows, 149 columns, 1935 entries with magnitude in [7.930350e-03, 1.000000e+00]
              'probing_max_lp':  309 rows, 154 columns, 1893 entries with magnitude in [7.055589e-03, 1.000000e+00]
                'pseudo_costs':  357 rows, 154 columns, 1386 entries with magnitude in [1.152513e-02, 1.000000e+00]
               'quick_restart':  558 rows, 149 columns, 2668 entries with magnitude in [9.106777e-04, 1.000000e+00]
               'reduced_costs':  553 rows, 154 columns, 2263 entries with magnitude in [1.844872e-03, 1.000000e+00]

Lp debug                         CutPropag  CutEqPropag  Adjust  Overflow      Bad  BadScaling
                  'default_lp':          3            7   2'566         0   29'347           0
                       'fixed':          0            2     138         0    2'075           0
                   'fs_random':          0            0       0         0        0           0
                   'fs_random':          0            2       2         0      349           0
     'fs_random_quick_restart':          0            0       0         0        0           0
     'fs_random_quick_restart':          0            0       0         0        0           0
              'lb_tree_search':         15            1   1'417         0   19'932           0
                      'max_lp':          8            1   1'441         0   14'848           0
         'objective_lb_search':         21           13   2'023         0   32'974           0
  'objective_lb_search_max_lp':         15            2   1'768         0   27'745           0
                     'probing':          9           16     911         0  338'082           0
              'probing_max_lp':          9            0     450         0  200'094           0
                'pseudo_costs':         19            0   1'323         0   17'286           0
               'quick_restart':          8            8   1'566         0   50'917           0
               'reduced_costs':         25            0   2'308         0   21'412           0

Lp pool                          Constraints  Updates  Simplif  Merged  Shortened  Split  Strenghtened    Cuts/Call
                  'default_lp':        2'810      293    2'859      14        167    999         1'897  2'654/6'093
                       'fixed':        1'181       23       11       0          0     31           137  1'011/1'985
                   'fs_random':          170        0        0       0          0      0             0          0/0
                   'fs_random':          526        8        0       0          0      3            23      356/532
     'fs_random_quick_restart':          170        0        0       0          0      0             0          0/0
     'fs_random_quick_restart':          170        0        0       0          0      0             0          0/0
              'lb_tree_search':        4'346      236   16'351      48      4'301    178        18'787  2'632/5'485
                      'max_lp':        4'411      273   17'069      16      2'036    249        19'951  2'665/5'295
         'objective_lb_search':        2'688      431    8'558      30      2'744  1'021         3'334  2'548/5'644
  'objective_lb_search_max_lp':        4'302      333   19'958       5      1'659    577        23'186  2'545/5'270
                     'probing':        2'255      442      849       4          0  1'474           830  2'089/4'134
              'probing_max_lp':        4'058      183    4'507       1          0    588         5'495  2'297/4'061
                'pseudo_costs':        4'039      242   11'446      16          0    363        17'763  2'293/4'671
               'quick_restart':        3'297      621    9'707      16      2'518  3'060         3'918  3'143/6'414
               'reduced_costs':        5'282      270   19'055      87      2'347    499        22'651  3'607/7'753

Lp Cut                                         fs_ran  defaul  fixed  max_lp  quick_  reduce  pseudo  lb_tre  probin  object  probin  object
                                       CG_FF:      27     133     56     138     149     198      90     111      79      99     125      73
                                        CG_K:      13      45     26      60      63     122      53      75      38      31      70      36
                                        CG_R:      20      78     55      86     109     124      44      83      52      71      73      40
                                       CG_RB:      28     388    194     557     649     511     299     414     291     575     524     377
                                      CG_RBP:       9      42     35      60      66      86      37      36      47      49      45      55
                                      Clique:       -       -      -      16       -      16      13      15       -       -       4      17
                                          IB:     137     393    248     212     353     419     296     253     296     394     111     311
                                    MIR_1_FF:      21     118     45     202     152     205     126     207      85     127     178     150
                                     MIR_1_K:       4      40      6      58      56      65      24      48      18      39      27      25
                                    MIR_1_KL:       -       3      -       -       -       -       -       -       -       1       -       -
                                     MIR_1_R:       5      21     12       8      29      17      10      17      14      22       8      12
                                    MIR_1_RB:      17     254     88     254     250     370     240     282     177     216     230     287
                                   MIR_1_RBP:       1      14      6      29      15      63      29      29       5      13      26      24
                                   MIR_1_RLT:       -       -      -       3       -       1       -       1       -       -       1       -
                                    MIR_2_FF:      10      79     23      91     104     119      84      97      62      72      64      77
                                     MIR_2_K:       3      27      5      25      18      38      24      21      15      23      16      11
                                    MIR_2_KL:       -       1      1       1       1       -       -       -       3       -       -       -
                                     MIR_2_R:       3      16      5      35      27      43      31      29      24      25      21      51
                                    MIR_2_RB:       8     138     35     128     166     169     121     143     101     109     100     133
                                   MIR_2_RBP:       1      14      4      18      13      43      29      11      14      17      12      12
                                    MIR_3_FF:       6      42     15      59      52      74      51      68      22      42      32      47
                                     MIR_3_K:       1      15      3       7      14      22      13      13       7      17       3       6
                                    MIR_3_KL:       -       1      -       -       -       1       -       1       -       -       -       -
                                     MIR_3_R:       3      21      5      25      20      29      26      25      23      23      14      24
                                    MIR_3_RB:       4      89     17      77      97      88      63      81      68      89      66      76
                                   MIR_3_RBP:       -      13      -      19      12      18      13       6       4       6       8       9
                                    MIR_4_FF:       2      31      4      26      28      39      24      30      17      23      21      20
                                     MIR_4_K:       1      14      3       5      11      16       7      11       7      13       3      10
                                    MIR_4_KL:       -       1      -       -       2       2       1       1       1       -       -       -
                                     MIR_4_R:       2      24      2      11      17      18      13      11      15      14      13       8
                                    MIR_4_RB:       3      86     14      39      81      61      36      36      39      65      30      38
                                   MIR_4_RBP:       1      11      -       8       5      10       9       5       6       4       3       2
                                    MIR_5_FF:       1      14      3      12      21      18      10      11      11      17       5      12
                                     MIR_5_K:       1       9      1       3       3       7       2       6       4       8       1       3
                                    MIR_5_KL:       -       3      -       1       2       -       -       -       3       4       -       -
                                     MIR_5_R:       2       5      -       4      13      14       9       4       5       8       5       2
                                    MIR_5_RB:       1      38      6      15      44      26      20      10      32      33      13      21
                                   MIR_5_RBP:       -       8      1       7       7       9       3       2       5       6       3       2
                                    MIR_6_FF:       -      13      1       3      14       7       4       9       8       8       2       5
                                     MIR_6_K:       -       6      1       1       6       3       4       5       4       -       1       3
                                    MIR_6_KL:       -       2      -       -       3       -       1       1       1       2       -       2
                                     MIR_6_R:       -       5      -       4       9       7      10       5       2       3       5       4
                                    MIR_6_RB:       -      26      3       9      31      18      18       8      15      15      10      11
                                   MIR_6_RBP:       -       3      1       4       4       1       5       -       -       3       1       3
  NoOverlapCompletionTimeExhaustive_weighted:       -       -      -       2       -       2       2       2       -       -       2       2
                 NoOverlapDisjunctionOnStart:       -       -      -       3       -       2       -       3       -       -       3       1
                                ZERO_HALF_FF:       4      39     21      46      41      68      26      39      28      18      42      33
                                 ZERO_HALF_K:       1      21      2       9      15      12       9      14       3       7       9       8
                                 ZERO_HALF_R:       9     208     33     198     279     287     274     238     379     166     257     396
                                ZERO_HALF_RB:       4      82     26      78      71     115      76      97      50      65     100      96
                               ZERO_HALF_RBP:       3      20      5       9      21      24      14      18       9       6      10      10

LNS stats                        Improv/Calls  Closed  Difficulty  TimeLimit
               'graph_arc_lns':          0/17     71%        0.97       0.10
               'graph_cst_lns':           0/0      0%        0.50       0.10
               'graph_dec_lns':          0/17     82%        0.99       0.10
               'graph_var_lns':          0/17     71%        0.97       0.10
                   'rins/rens':          0/17     53%        0.85       0.10
                 'rnd_cst_lns':          0/14     71%        0.96       0.10
                 'rnd_var_lns':          0/17     76%        0.98       0.10
    'scheduling_intervals_lns':          3/17      0%        0.00       0.10
  'scheduling_precedences_lns':          3/16      0%        0.00       0.10
  'scheduling_time_window_lns':          3/17      0%        0.00       0.10

LS stats                   Batches  Restarts  LinMoves  GenMoves  CompoundMoves  WeightUpdates
       'fj_long_default':        1         1     9'604         0              0            396
   'fj_long_lin_default':        1         1         0     2'484            369              2
        'fj_long_random':        1         1     9'610         0              0            390
      'fj_short_default':        1         1         0     2'653            301              4
  'fj_short_lin_default':        1         1         0     2'543            258              2
   'fj_short_lin_random':        1         1         0     2'319            282              1
       'fj_short_random':        1         1         0     2'294            285              1
          'violation_ls':       17         0    11'477   115'569          2'685         11'075
          'violation_ls':       17         0    81'063    68'445          1'787          9'422

Solutions (14)     Num     Rank
         'fixed':    1    [1,1]
         'no_lp':   12   [2,13]
  'pseudo_costs':    1  [14,14]

Objective bounds                     Num
                      'default_lp':    1
                           'fixed':    4
                  'initial_domain':    1
                  'lb_tree_search':    6
             'objective_lb_search':    2
      'objective_lb_search_max_lp':    1
       'objective_lb_search_no_lp':   52
  'objective_shaving_search_no_lp':    1

Solution repositories    Added  Queried  Ignored  Synchro
  'feasible solutions':    128      387        8      114
        'lp solutions':     96        4        0       62
                'pump':    334       13

Improving bounds shared            Num
                        'core':      8
                  'default_lp':     20
              'lb_tree_search':     19
                      'max_lp':      5
                       'no_lp':    286
         'objective_lb_search':     34
  'objective_lb_search_max_lp':     17
                     'probing':     98
              'probing_max_lp':     22
                'pseudo_costs':     32
               'quick_restart':     53
         'quick_restart_no_lp':  1'592
               'reduced_costs':     33

Clauses shared                   Num
                  'default_lp':   14
              'lb_tree_search':   14
                      'max_lp':    4
                       'no_lp':   56
         'objective_lb_search':    5
  'objective_lb_search_max_lp':    2
   'objective_lb_search_no_lp':    1
                'pseudo_costs':    5
               'quick_restart':    1
         'quick_restart_no_lp':    3
               'reduced_costs':    1

CpSolverResponse summary:
status: OPTIMAL
objective: 781
best_bound: 781
integers: 153
booleans: 52
conflicts: 0
branches: 74
propagations: 12
integer_propagations: 1020
restarts: 74
lp_iterations: 0
walltime: 5.42546
usertime: 5.42546
deterministic_time: 28.0698
gap_integral: 58.5013
solution_fingerprint: 0xeeac071084b225f


--- Simulation Gantt  partir du modle mathmatique ---
