created virtual environment CPython3.12.4.final.0-64 in 576ms
  creator CPython3Posix(dest=/localscratch/aneumann.46806175.0/env, clear=False, no_vcs_ignore=False, global=False)
  seeder FromAppData(download=False, pip=bundle, via=copy, app_data_dir=/home/aneumann/.local/share/virtualenv)
    added seed packages: pip==24.2+computecanada
  activators BashActivator,CShellActivator,FishActivator,NushellActivator,PowerShellActivator,PythonActivator
Looking in links: /cvmfs/soft.computecanada.ca/custom/python/wheelhouse/gentoo2023/x86-64-v3, /cvmfs/soft.computecanada.ca/custom/python/wheelhouse/gentoo2023/generic, /cvmfs/soft.computecanada.ca/custom/python/wheelhouse/generic
Requirement already satisfied: pip in /localscratch/aneumann.46806175.0/env/lib/python3.12/site-packages (24.2+computecanada)
Processing /cvmfs/soft.computecanada.ca/custom/python/wheelhouse/generic/pip-25.0+computecanada-py3-none-any.whl
Installing collected packages: pip
  Attempting uninstall: pip
    Found existing installation: pip 24.2+computecanada
    Uninstalling pip-24.2+computecanada:
      Successfully uninstalled pip-24.2+computecanada
Successfully installed pip-24.2+computecanada
Looking in links: /cvmfs/soft.computecanada.ca/custom/python/wheelhouse/gentoo2023/x86-64-v3, /cvmfs/soft.computecanada.ca/custom/python/wheelhouse/gentoo2023/generic, /cvmfs/soft.computecanada.ca/custom/python/wheelhouse/generic
ERROR: protobuf-5.28.3-cp38-abi3-manylinux2014_x86_64.whl is not a supported wheel on this platform.
Looking in links: /cvmfs/soft.computecanada.ca/custom/python/wheelhouse/gentoo2023/x86-64-v3, /cvmfs/soft.computecanada.ca/custom/python/wheelhouse/gentoo2023/generic, /cvmfs/soft.computecanada.ca/custom/python/wheelhouse/generic
Processing /home/aneumann/projects/def-adhaj/aneumann/GNRS/wheels/immutabledict-4.2.0-py3-none-any.whl
Installing collected packages: immutabledict
Successfully installed immutabledict-4.2.0
Looking in links: /cvmfs/soft.computecanada.ca/custom/python/wheelhouse/gentoo2023/x86-64-v3, /cvmfs/soft.computecanada.ca/custom/python/wheelhouse/gentoo2023/generic, /cvmfs/soft.computecanada.ca/custom/python/wheelhouse/generic
Processing /cvmfs/soft.computecanada.ca/custom/python/wheelhouse/generic/ortools-9.10.4067+computecanada-cp312-cp312-linux_x86_64.whl (from -r /home/aneumann/projects/def-adhaj/aneumann/GNRS/requirements/or.txt (line 1))
Processing /cvmfs/soft.computecanada.ca/custom/python/wheelhouse/gentoo2023/x86-64-v3/matplotlib-3.10.0+computecanada-cp312-cp312-linux_x86_64.whl (from -r /home/aneumann/projects/def-adhaj/aneumann/GNRS/requirements/or.txt (line 2))
Processing /cvmfs/soft.computecanada.ca/custom/python/wheelhouse/gentoo2023/x86-64-v3/pandas-2.2.3+computecanada-cp312-cp312-linux_x86_64.whl (from -r /home/aneumann/projects/def-adhaj/aneumann/GNRS/requirements/or.txt (line 3))
Processing /cvmfs/soft.computecanada.ca/custom/python/wheelhouse/generic/absl_py-2.3.0+computecanada-py3-none-any.whl (from ortools<9.11,>=9.10->-r /home/aneumann/projects/def-adhaj/aneumann/GNRS/requirements/or.txt (line 1))
Processing /cvmfs/soft.computecanada.ca/custom/python/wheelhouse/gentoo2023/generic/numpy-2.2.2+computecanada-cp312-cp312-linux_x86_64.whl (from ortools<9.11,>=9.10->-r /home/aneumann/projects/def-adhaj/aneumann/GNRS/requirements/or.txt (line 1))
Processing /cvmfs/soft.computecanada.ca/custom/python/wheelhouse/gentoo2023/x86-64-v3/protobuf-6.31.1+computecanada-cp312-cp312-linux_x86_64.whl (from ortools<9.11,>=9.10->-r /home/aneumann/projects/def-adhaj/aneumann/GNRS/requirements/or.txt (line 1))
Requirement already satisfied: immutabledict>=3.0.0 in /localscratch/aneumann.46806175.0/env/lib/python3.12/site-packages (from ortools<9.11,>=9.10->-r /home/aneumann/projects/def-adhaj/aneumann/GNRS/requirements/or.txt (line 1)) (4.2.0)
Processing /cvmfs/soft.computecanada.ca/custom/python/wheelhouse/gentoo2023/generic/contourpy-1.3.1+computecanada-cp312-cp312-linux_x86_64.whl (from matplotlib->-r /home/aneumann/projects/def-adhaj/aneumann/GNRS/requirements/or.txt (line 2))
Processing /cvmfs/soft.computecanada.ca/custom/python/wheelhouse/generic/cycler-0.12.1+computecanada-py3-none-any.whl (from matplotlib->-r /home/aneumann/projects/def-adhaj/aneumann/GNRS/requirements/or.txt (line 2))
Processing /cvmfs/soft.computecanada.ca/custom/python/wheelhouse/generic/fonttools-4.59.0+computecanada-cp312-cp312-linux_x86_64.whl (from matplotlib->-r /home/aneumann/projects/def-adhaj/aneumann/GNRS/requirements/or.txt (line 2))
Processing /cvmfs/soft.computecanada.ca/custom/python/wheelhouse/gentoo2023/x86-64-v3/kiwisolver-1.4.8+computecanada-cp312-cp312-linux_x86_64.whl (from matplotlib->-r /home/aneumann/projects/def-adhaj/aneumann/GNRS/requirements/or.txt (line 2))
Processing /cvmfs/soft.computecanada.ca/custom/python/wheelhouse/generic/packaging-25.0+computecanada-py3-none-any.whl (from matplotlib->-r /home/aneumann/projects/def-adhaj/aneumann/GNRS/requirements/or.txt (line 2))
Processing /cvmfs/soft.computecanada.ca/custom/python/wheelhouse/gentoo2023/x86-64-v3/pillow-11.1.0+computecanada-cp312-cp312-linux_x86_64.whl (from matplotlib->-r /home/aneumann/projects/def-adhaj/aneumann/GNRS/requirements/or.txt (line 2))
Processing /cvmfs/soft.computecanada.ca/custom/python/wheelhouse/generic/pyparsing-3.2.3+computecanada-py3-none-any.whl (from matplotlib->-r /home/aneumann/projects/def-adhaj/aneumann/GNRS/requirements/or.txt (line 2))
Processing /cvmfs/soft.computecanada.ca/custom/python/wheelhouse/generic/python_dateutil-2.9.0.post0+computecanada-py2.py3-none-any.whl (from matplotlib->-r /home/aneumann/projects/def-adhaj/aneumann/GNRS/requirements/or.txt (line 2))
Processing /cvmfs/soft.computecanada.ca/custom/python/wheelhouse/generic/pytz-2025.2+computecanada-py2.py3-none-any.whl (from pandas->-r /home/aneumann/projects/def-adhaj/aneumann/GNRS/requirements/or.txt (line 3))
Processing /cvmfs/soft.computecanada.ca/custom/python/wheelhouse/generic/tzdata-2025.2+computecanada-py2.py3-none-any.whl (from pandas->-r /home/aneumann/projects/def-adhaj/aneumann/GNRS/requirements/or.txt (line 3))
Processing /cvmfs/soft.computecanada.ca/custom/python/wheelhouse/generic/six-1.17.0+computecanada-py2.py3-none-any.whl (from python-dateutil>=2.7->matplotlib->-r /home/aneumann/projects/def-adhaj/aneumann/GNRS/requirements/or.txt (line 2))
Installing collected packages: pytz, tzdata, six, pyparsing, protobuf, pillow, packaging, numpy, kiwisolver, fonttools, cycler, absl-py, python-dateutil, contourpy, pandas, matplotlib, ortools
Successfully installed absl-py-2.3.0+computecanada contourpy-1.3.1+computecanada cycler-0.12.1+computecanada fonttools-4.59.0+computecanada kiwisolver-1.4.8+computecanada matplotlib-3.10.0+computecanada numpy-2.2.2+computecanada ortools-9.10.4067+computecanada packaging-25.0+computecanada pandas-2.2.3+computecanada pillow-11.1.0+computecanada protobuf-6.31.1+computecanada pyparsing-3.2.3+computecanada python-dateutil-2.9.0.post0+computecanada pytz-2025.2+computecanada six-1.17.0+computecanada tzdata-2025.2+computecanada

Starting CP-SAT solver v9.10.4067
Parameters: max_time_in_seconds: 86400 max_memory_in_mb: 185000 log_search_progress: true enumerate_all_solutions: false num_search_workers: 32 absolute_gap_limit: 0 relative_gap_limit: 0

Initial optimization model '': (model_fingerprint: 0xbbe000c75962cc93)
#Variables: 258 (#ints: 8 in objective)
  - 182 Booleans in [0,1]
  - 76 in [0,530]
#kLinear1: 37
#kLinear2: 340
#kLinear3: 153
#kLinearN: 2'507 (#terms: 37'294)

Starting presolve at 0.00s
  1.21e-03s  0.00e+00d  [DetectDominanceRelations] 
  1.79e-02s  0.00e+00d  [PresolveToFixPoint] #num_loops=8 #num_dual_strengthening=3 
  2.78e-05s  0.00e+00d  [ExtractEncodingFromLinear] #potential_supersets=6 
[Symmetry] Graph for symmetry has 3'109 nodes and 30'577 arcs.
[Symmetry] Symmetry computation done. time: 0.00118891 dtime: 0.00263426
[Symmetry] #generators: 1, average support size: 26
[Symmetry] The model contains 157 duplicate constraints !
[Symmetry] 13 orbits with sizes: 2,2,2,2,2,2,2,2,2,2,...
[Symmetry] Num fixable by intersecting at_most_one with orbits: 1 largest_orbit: 2
  6.47e-03s  1.41e-03d  [Probe] #probed=266 #new_bounds=1 #equiv=1 
  8.80e-05s  0.00e+00d  [MaxClique] Merged 17(34 literals) into 8(16 literals) at_most_ones. 
  1.11e-03s  0.00e+00d  [DetectDominanceRelations] 
  7.30e-03s  0.00e+00d  [PresolveToFixPoint] #num_loops=5 #num_dual_strengthening=3 
  3.69e-03s  0.00e+00d  [ProcessAtMostOneAndLinear] 
  1.40e-03s  0.00e+00d  [DetectDuplicateConstraints] #duplicates=195 #without_enforcements=27 
  1.43e-03s  1.43e-04d  [DetectDominatedLinearConstraints] #relevant_constraints=2'229 #num_inclusions=1'554 
  2.76e-04s  0.00e+00d  [DetectDifferentVariables] #different=15 #cliques=1 #size=4 
  3.57e-04s  4.36e-05d  [ProcessSetPPC] #relevant_constraints=1'975 
  1.14e-05s  0.00e+00d  [FindAlmostIdenticalLinearConstraints] 
  1.76e-04s  2.63e-04d  [FindBigAtMostOneAndLinearOverlap] 
  3.37e-03s  2.66e-03d  [FindBigVerticalLinearOverlap] #blocks=45 #saved_nz=5'051 
  2.04e-04s  1.01e-04d  [FindBigHorizontalLinearOverlap] #linears=1'867 
  1.46e-05s  0.00e+00d  [MergeClauses] 
  1.17e-03s  0.00e+00d  [DetectDominanceRelations] 
  1.15e-02s  0.00e+00d  [PresolveToFixPoint] #num_loops=2 #num_dual_strengthening=1 
  1.17e-03s  0.00e+00d  [DetectDominanceRelations] 
  6.52e-03s  0.00e+00d  [PresolveToFixPoint] #num_loops=1 #num_dual_strengthening=1 
[Symmetry] Graph for symmetry has 3'062 nodes and 24'775 arcs.
[Symmetry] Symmetry computation done. time: 0.000486412 dtime: 0.0013071
  5.83e-03s  1.35e-03d  [Probe] #probed=266 #new_bounds=21 
  6.69e-06s  0.00e+00d  [MaxClique] 
  1.18e-03s  0.00e+00d  [DetectDominanceRelations] 
  9.32e-03s  0.00e+00d  [PresolveToFixPoint] #num_loops=2 #num_dual_strengthening=1 
  3.33e-03s  0.00e+00d  [ProcessAtMostOneAndLinear] 
  1.19e-03s  0.00e+00d  [DetectDuplicateConstraints] #without_enforcements=58 
  8.34e-04s  8.09e-05d  [DetectDominatedLinearConstraints] #relevant_constraints=2'054 #num_inclusions=140 
  1.49e-04s  0.00e+00d  [DetectDifferentVariables] 
  3.23e-04s  3.18e-05d  [ProcessSetPPC] #relevant_constraints=1'777 
  1.86e-05s  1.05e-07d  [FindAlmostIdenticalLinearConstraints] #num_tested_pairs=7 
  7.91e-05s  1.08e-04d  [FindBigAtMostOneAndLinearOverlap] 
  2.30e-03s  1.96e-03d  [FindBigVerticalLinearOverlap] #blocks=36 #saved_nz=2'585 
  1.89e-04s  8.27e-05d  [FindBigHorizontalLinearOverlap] #linears=1'717 
  7.05e-06s  0.00e+00d  [MergeClauses] 
  1.09e-03s  0.00e+00d  [DetectDominanceRelations] 
  1.07e-02s  0.00e+00d  [PresolveToFixPoint] #num_loops=2 #num_dual_strengthening=1 
  1.09e-03s  0.00e+00d  [DetectDominanceRelations] 
  7.45e-03s  0.00e+00d  [PresolveToFixPoint] #num_loops=1 #num_dual_strengthening=1 
[Symmetry] Graph for symmetry has 3'166 nodes and 22'222 arcs.
[Symmetry] Symmetry computation done. time: 0.000443142 dtime: 0.00123147
  5.25e-03s  1.25e-03d  [Probe] #probed=266 #new_bounds=34 
  7.38e-06s  0.00e+00d  [MaxClique] 
  1.09e-03s  0.00e+00d  [DetectDominanceRelations] 
  1.05e-02s  0.00e+00d  [PresolveToFixPoint] #num_loops=2 #num_dual_strengthening=1 
  3.14e-03s  0.00e+00d  [ProcessAtMostOneAndLinear] 
  1.15e-03s  0.00e+00d  [DetectDuplicateConstraints] #without_enforcements=69 
  7.16e-04s  6.59e-05d  [DetectDominatedLinearConstraints] #relevant_constraints=2'043 #num_inclusions=112 
  1.42e-04s  0.00e+00d  [DetectDifferentVariables] 
  2.82e-04s  2.56e-05d  [ProcessSetPPC] #relevant_constraints=1'685 
  2.20e-05s  3.60e-07d  [FindAlmostIdenticalLinearConstraints] #num_tested_pairs=24 
  7.18e-05s  8.91e-05d  [FindBigAtMostOneAndLinearOverlap] 
  1.56e-03s  1.48e-03d  [FindBigVerticalLinearOverlap] #blocks=18 #saved_nz=1'156 
  1.67e-04s  7.38e-05d  [FindBigHorizontalLinearOverlap] #linears=1'628 
  7.65e-06s  0.00e+00d  [MergeClauses] 
  1.03e-03s  0.00e+00d  [DetectDominanceRelations] 
  9.01e-03s  0.00e+00d  [PresolveToFixPoint] #num_loops=2 #num_dual_strengthening=1 
  6.45e-05s  0.00e+00d  [ExpandObjective] #entries=395 #tight_variables=169 #tight_constraints=91 

Presolve summary:
  - 58 affine relations were detected.
  - rule 'TODO dual: only one blocking constraint?' was applied 568 times.
  - rule 'TODO dual: only one blocking enforced constraint?' was applied 78 times.
  - rule 'TODO dual: only one unspecified blocking constraint?' was applied 35 times.
  - rule 'TODO duplicate: identical constraint with different enforcements' was applied 154 times.
  - rule 'affine: new relation' was applied 58 times.
  - rule 'at_most_one: removed literals' was applied 8 times.
  - rule 'at_most_one: size one' was applied 8 times.
  - rule 'at_most_one: transformed into max clique.' was applied 1 time.
  - rule 'deductions: 165 stored' was applied 1 time.
  - rule 'dual: fix variable' was applied 21 times.
  - rule 'dual: reduced domain' was applied 37 times.
  - rule 'duplicate: merged rhs of linear constraint' was applied 33 times.
  - rule 'duplicate: removed constraint' was applied 195 times.
  - rule 'enforcement: false literal' was applied 2 times.
  - rule 'exactly_one: x and not(x)' was applied 1 time.
  - rule 'incompatible linear: add implication' was applied 18 times.
  - rule 'linear matrix: common vertical rectangle' was applied 99 times.
  - rule 'linear: always true' was applied 392 times.
  - rule 'linear: doubleton free' was applied 10 times.
  - rule 'linear: empty' was applied 22 times.
  - rule 'linear: extracted enforcement literal' was applied 3'964 times.
  - rule 'linear: fixed or dup variables' was applied 2'515 times.
  - rule 'linear: positive equal one' was applied 6 times.
  - rule 'linear: reduced variable domains' was applied 175 times.
  - rule 'linear: remapped using affine relations' was applied 2'635 times.
  - rule 'linear: simplified rhs' was applied 7'191 times.
  - rule 'linear: tightened into equality' was applied 6 times.
  - rule 'linear: variable substitution 1' was applied 10 times.
  - rule 'no_overlap: inferred from x != y constraints' was applied 1 time.
  - rule 'presolve: 69 unused variables removed.' was applied 1 time.
  - rule 'presolve: iteration' was applied 3 times.
  - rule 'probing: reduced enforced constraint to implication.' was applied 17 times.
  - rule 'symmetry: fixed to false in general orbit' was applied 1 time.

Presolved optimization model '': (model_fingerprint: 0x26b5051c87b95948)
#Variables: 220 (#ints: 8 in objective)
  - 71 Booleans in [0,1]
  - 116 different domains in [-4703,4152] with a largest complexity of 13.
#kExactlyOne: 5 (#literals: 15)
#kInterval: 4
#kLinear2: 434 (#enforced: 400 #multi: 315)
#kLinear3: 215 (#enforced: 114)
#kLinearN: 1'786 (#enforced: 1'671 #multi: 52) (#terms: 15'394)
#kNoOverlap: 1 (#intervals: 4)

Preloading model.
#Bound   0.15s best:inf   next:[128,3565] initial_domain
[Symmetry] Graph for symmetry has 3'073 nodes and 21'074 arcs.
[Symmetry] Symmetry computation done. time: 0.000398652 dtime: 0.00116962
#Model   0.16s var:220/220 constraints:2445/2445

Starting search at 0.16s with 32 workers.
17 full problem subsolvers: [core, default_lp, fixed, lb_tree_search, max_lp, no_lp, objective_lb_search, objective_lb_search_max_lp, objective_lb_search_no_lp, objective_shaving_search_max_lp, objective_shaving_search_no_lp, probing, probing_max_lp, pseudo_costs, quick_restart, quick_restart_no_lp, reduced_costs]
13 first solution subsolvers: [fj_long_default, fj_long_lin_default, fj_long_random, fj_short_default, fj_short_lin_default, fj_short_lin_random, fj_short_random, fs_random(2), fs_random_no_lp, fs_random_quick_restart(2), fs_random_quick_restart_no_lp]
13 incomplete subsolvers: [feasibility_pump, graph_arc_lns, graph_cst_lns, graph_dec_lns, graph_var_lns, rins/rens, rnd_cst_lns, rnd_var_lns, scheduling_intervals_lns, scheduling_precedences_lns, scheduling_time_window_lns, violation_ls(2)]
3 helper subsolvers: [neighborhood_helper, synchronization_agent, update_gap_integral]
#Bound   0.18s best:inf   next:[137,3565] objective_lb_search_no_lp
#1       0.18s best:1558  next:[137,1557] quick_restart_no_lp (fixed_bools=0/109)
#Bound   0.18s best:1558  next:[176,1557] objective_lb_search_no_lp
#2       0.18s best:1396  next:[176,1395] no_lp (fixed_bools=0/94)
#3       0.19s best:1380  next:[176,1379] no_lp (fixed_bools=0/102)
#4       0.21s best:1198  next:[176,1197] no_lp (fixed_bools=0/107)
#5       0.24s best:1181  next:[176,1180] no_lp (fixed_bools=0/120)
#6       0.25s best:1180  next:[176,1179] violation_ls(batch:2 #solutions_imported:2 #lin_moves:1'385 #lin_evals:6'687 #gen_moves:930 #gen_evals:197 #comp_moves:110 #backtracks:410 #weight_updates:182)
#7       0.26s best:1103  next:[176,1102] no_lp (fixed_bools=0/128)
#Bound   0.26s best:1103  next:[177,1102] objective_shaving_search_no_lp (vars=220 csts=2446)
#8       0.27s best:1059  next:[177,1058] no_lp (fixed_bools=0/132)
#9       0.27s best:1001  next:[177,1000] no_lp (fixed_bools=0/138)
#Bound   0.27s best:1001  next:[178,1000] bool_core (num_cores=4 [cover] a=5 d=2 fixed=46/242 clauses=849)
#Bound   0.28s best:1001  next:[179,1000] bool_core (num_cores=4 [cover] a=5 d=2 fixed=47/247 clauses=870)
#Bound   0.28s best:1001  next:[180,1000] bool_core (num_cores=4 [cover] a=5 d=2 fixed=48/252 clauses=893)
#Bound   0.28s best:1001  next:[181,1000] bool_core (num_cores=4 [cover] a=5 d=2 fixed=49/257 clauses=918)
#Bound   0.28s best:1001  next:[182,1000] bool_core (num_cores=4 [cover] a=5 d=2 fixed=50/262 clauses=945)
#Bound   0.28s best:1001  next:[183,1000] bool_core (num_cores=4 [cover] a=5 d=2 fixed=51/267 clauses=974)
#Bound   0.28s best:1001  next:[184,1000] bool_core (num_cores=4 [cover] a=5 d=2 fixed=52/272 clauses=1'005)
#10      0.28s best:996   next:[184,995]  no_lp (fixed_bools=0/144)
#Bound   0.29s best:996   next:[185,995]  bool_core (num_cores=4 [cover] a=5 d=2 fixed=53/277 clauses=1'038)
#Bound   0.29s best:996   next:[186,995]  bool_core (num_cores=4 [cover] a=5 d=2 fixed=54/282 clauses=1'073)
#Bound   0.29s best:996   next:[187,995]  bool_core (num_cores=4 [cover] a=5 d=2 fixed=55/287 clauses=1'110)
#Bound   0.29s best:996   next:[188,995]  bool_core (num_cores=4 [cover] a=5 d=2 fixed=56/292 clauses=1'149)
#11      0.29s best:965   next:[188,964]  no_lp (fixed_bools=0/146)
#Bound   0.29s best:965   next:[189,964]  bool_core (num_cores=4 [cover] a=5 d=2 fixed=57/297 clauses=1'190)
#Bound   0.29s best:965   next:[190,964]  bool_core (num_cores=4 [cover] a=5 d=2 fixed=58/302 clauses=1'234)
#Bound   0.29s best:965   next:[191,964]  bool_core (num_cores=4 [cover] a=5 d=2 fixed=59/307 clauses=1'279)
#Bound   0.29s best:965   next:[192,964]  bool_core (num_cores=4 [cover] a=5 d=2 fixed=60/312 clauses=1'327)
#Bound   0.29s best:965   next:[193,964]  bool_core (num_cores=4 [cover] a=5 d=2 fixed=61/317 clauses=1'376)
#Bound   0.29s best:965   next:[194,964]  bool_core (num_cores=4 [cover] a=5 d=2 fixed=62/322 clauses=1'429)
#12      0.30s best:964   next:[196,963]  violation_ls(batch:4 #solutions_imported:4 #lin_moves:1'826 #lin_evals:12'551 #gen_moves:2'589 #gen_evals:460 #comp_moves:287 #backtracks:1'151 #weight_updates:337)
#13      0.30s best:963   next:[197,962]  violation_ls(batch:4 #solutions_imported:4 #lin_moves:559 #lin_evals:18'304 #gen_moves:6'403 #gen_evals:1'104 #comp_moves:497 #backtracks:2'953 #weight_updates:269)
#14      0.31s best:950   next:[198,949]  no_lp (fixed_bools=0/153)
#15      0.34s best:946   next:[198,945]  no_lp (fixed_bools=0/173)
#16      0.38s best:942   next:[404,941]  quick_restart_no_lp (fixed_bools=0/215)
#17      0.39s best:937   next:[404,936]  quick_restart_no_lp (fixed_bools=0/234)
#18      0.40s best:934   next:[404,933]  quick_restart_no_lp (fixed_bools=0/260)
#19      0.41s best:831   next:[411,830]  no_lp (fixed_bools=0/218)
#20      0.45s best:826   next:[411,825]  quick_restart_no_lp (fixed_bools=0/292)
#21      0.46s best:824   next:[411,823]  quick_restart_no_lp (fixed_bools=1/319)
#22      0.47s best:820   next:[411,819]  quick_restart_no_lp (fixed_bools=1/321)
#23      0.47s best:817   next:[411,816]  quick_restart_no_lp (fixed_bools=1/322)
#24      0.48s best:816   next:[416,815]  quick_restart_no_lp (fixed_bools=1/328)
#25      0.50s best:815   next:[416,814]  quick_restart_no_lp (fixed_bools=1/345)
#26      0.51s best:811   next:[416,810]  no_lp (fixed_bools=0/242)
#27      0.51s best:806   next:[416,805]  rins_pump_lns (d=0.71 s=79 t=0.10 p=1.00 stall=1 h=auto_l0)
#28      0.70s best:786   next:[441,785]  no_lp (fixed_bools=0/257)
#29      0.75s best:760   next:[441,759]  rins_pump_lns (d=0.81 s=83 t=0.10 p=1.00 stall=2 h=auto_l0)
#30      0.77s best:750   next:[441,749]  graph_dec_lns (d=0.91 s=99 t=0.10 p=1.00 stall=2 h=auto_l0)
#Bound   1.00s best:750   next:[450,749]  objective_lb_search_no_lp [skipped_logs=13]
#31      1.03s best:730   next:[450,729]  scheduling_precedences_lns (d=0.50 s=55 t=0.10 p=0.00 stall=0 h=auto_l0)
#32      1.63s best:725   next:[481,724]  scheduling_time_window_lns (d=0.50 s=101 t=0.10 p=0.00 stall=0 h=auto_l0)
#Bound   1.79s best:725   next:[491,724]  objective_lb_search_max_lp [skipped_logs=12]
#Bound   2.92s best:725   next:[520,724]  objective_lb_search_no_lp [skipped_logs=6]
#Bound   4.01s best:725   next:[543,724]  objective_lb_search_no_lp [skipped_logs=7]
#Bound   4.99s best:725   next:[548,724]  objective_shaving_search_no_lp (vars=237 csts=2409) [skipped_logs=2]
#Bound   5.96s best:725   next:[579,724]  objective_lb_search_no_lp [skipped_logs=7]
#Bound   6.90s best:725   next:[588,724]  objective_lb_search_no_lp [skipped_logs=1]
#Bound   7.27s best:725   next:[589,724]  objective_lb_search_no_lp [skipped_logs=0]
#Model   8.63s var:219/220 constraints:2382/2445
#Model   8.83s var:218/220 constraints:2374/2445
#Bound   8.96s best:725   next:[607,724]  objective_lb_search_no_lp [skipped_logs=3]
#Model   9.33s var:216/220 constraints:2339/2445
#Model   9.55s var:213/220 constraints:2197/2445
#Model   9.62s var:212/220 constraints:2165/2445
#Model   9.67s var:210/220 constraints:2107/2445
#Done    9.68s no_lp
#Done    9.68s quick_restart_no_lp
#Done    9.68s objective_lb_search_no_lp
#Done    9.69s core
#Model   9.69s var:205/220 constraints:1650/2445
#Model   9.69s var:194/220 constraints:1126/2445
#Bound   9.65s best:725   next:[676,724]  objective_lb_search_no_lp [skipped_logs=8]

Task timing                                  n [     min,      max]      avg      dev     time         n [     min,      max]      avg      dev    dtime
                             'core':         1 [   9.53s,    9.53s]    9.53s   0.00ns    9.53s         1 [  13.19s,   13.19s]   13.19s   0.00ns   13.19s
                       'default_lp':         1 [   9.53s,    9.53s]    9.53s   0.00ns    9.53s         1 [   3.30s,    3.30s]    3.30s   0.00ns    3.30s
                 'feasibility_pump':        44 [ 10.07ms, 273.67ms]  51.84ms  34.76ms    2.28s        43 [ 12.57ms,  20.01ms]  12.96ms   1.12ms 557.28ms
                            'fixed':         1 [   9.53s,    9.53s]    9.53s   0.00ns    9.53s         1 [   3.22s,    3.22s]    3.22s   0.00ns    3.22s
                  'fj_long_default':         1 [ 98.13ms,  98.13ms]  98.13ms   0.00ns  98.13ms         1 [ 32.98ms,  32.98ms]  32.98ms   0.00ns  32.98ms
              'fj_long_lin_default':         1 [106.43ms, 106.43ms] 106.43ms   0.00ns 106.43ms         1 [ 73.10ms,  73.10ms]  73.10ms   0.00ns  73.10ms
                   'fj_long_random':         1 [117.70ms, 117.70ms] 117.70ms   0.00ns 117.70ms         1 [ 59.18ms,  59.18ms]  59.18ms   0.00ns  59.18ms
                 'fj_short_default':         1 [ 53.56ms,  53.56ms]  53.56ms   0.00ns  53.56ms         1 [ 73.15ms,  73.15ms]  73.15ms   0.00ns  73.15ms
             'fj_short_lin_default':         1 [ 63.68ms,  63.68ms]  63.68ms   0.00ns  63.68ms         1 [ 71.29ms,  71.29ms]  71.29ms   0.00ns  71.29ms
              'fj_short_lin_random':         1 [ 91.80ms,  91.80ms]  91.80ms   0.00ns  91.80ms         1 [ 73.78ms,  73.78ms]  73.78ms   0.00ns  73.78ms
                  'fj_short_random':         1 [ 68.47ms,  68.47ms]  68.47ms   0.00ns  68.47ms         1 [ 71.85ms,  71.85ms]  71.85ms   0.00ns  71.85ms
                        'fs_random':         1 [ 18.93ms,  18.93ms]  18.93ms   0.00ns  18.93ms         1 [ 20.00ns,  20.00ns]  20.00ns   0.00ns  20.00ns
                        'fs_random':         1 [ 19.63ms,  19.63ms]  19.63ms   0.00ns  19.63ms         1 [ 20.00ns,  20.00ns]  20.00ns   0.00ns  20.00ns
                  'fs_random_no_lp':         1 [ 19.32ms,  19.32ms]  19.32ms   0.00ns  19.32ms         1 [153.83us, 153.83us] 153.83us   0.00ns 153.83us
          'fs_random_quick_restart':         1 [ 18.81ms,  18.81ms]  18.81ms   0.00ns  18.81ms         1 [ 20.00ns,  20.00ns]  20.00ns   0.00ns  20.00ns
          'fs_random_quick_restart':         1 [ 19.51ms,  19.51ms]  19.51ms   0.00ns  19.51ms         1 [ 20.00ns,  20.00ns]  20.00ns   0.00ns  20.00ns
    'fs_random_quick_restart_no_lp':         1 [ 17.60ms,  17.60ms]  17.60ms   0.00ns  17.60ms         1 [167.82us, 167.82us] 167.82us   0.00ns 167.82us
                    'graph_arc_lns':        43 [ 25.42ms, 540.88ms] 296.02ms 189.27ms   12.73s        43 [ 10.00ns, 100.62ms]  53.76ms  44.22ms    2.31s
                    'graph_cst_lns':        43 [921.40us,  19.37ms]   1.54ms   2.81ms  66.31ms         0 [  0.00ns,   0.00ns]   0.00ns   0.00ns   0.00ns
                    'graph_dec_lns':        43 [  9.29ms, 554.49ms] 267.26ms 187.36ms   11.49s        42 [ 10.00ns, 136.28ms]  49.22ms  44.64ms    2.07s
                    'graph_var_lns':        43 [ 26.64ms, 519.69ms] 292.89ms 185.98ms   12.59s        43 [ 10.00ns, 101.03ms]  50.54ms  43.63ms    2.17s
                   'lb_tree_search':         1 [   9.52s,    9.52s]    9.52s   0.00ns    9.52s         1 [   5.74s,    5.74s]    5.74s   0.00ns    5.74s
                           'max_lp':         1 [   9.53s,    9.53s]    9.53s   0.00ns    9.53s         1 [   4.03s,    4.03s]    4.03s   0.00ns    4.03s
                            'no_lp':         1 [   9.52s,    9.52s]    9.52s   0.00ns    9.52s         1 [   2.82s,    2.82s]    2.82s   0.00ns    2.82s
              'objective_lb_search':         1 [   9.53s,    9.53s]    9.53s   0.00ns    9.53s         1 [   3.52s,    3.52s]    3.52s   0.00ns    3.52s
       'objective_lb_search_max_lp':         1 [   9.53s,    9.53s]    9.53s   0.00ns    9.53s         1 [   5.47s,    5.47s]    5.47s   0.00ns    5.47s
        'objective_lb_search_no_lp':         1 [   9.52s,    9.52s]    9.52s   0.00ns    9.52s         1 [   2.27s,    2.27s]    2.27s   0.00ns    2.27s
  'objective_shaving_search_max_lp':        42 [ 15.43ms,    1.12s] 181.95ms 200.92ms    7.64s        36 [ 52.90us, 354.02ms]  41.74ms  69.41ms    1.50s
   'objective_shaving_search_no_lp':        42 [  9.50ms,    1.12s] 166.76ms 201.54ms    7.00s        36 [ 52.90us, 237.29ms]  28.38ms  46.76ms    1.02s
                          'probing':         1 [   9.54s,    9.54s]    9.54s   0.00ns    9.54s         1 [   1.84s,    1.84s]    1.84s   0.00ns    1.84s
                   'probing_max_lp':         1 [   9.53s,    9.53s]    9.53s   0.00ns    9.53s         1 [   1.84s,    1.84s]    1.84s   0.00ns    1.84s
                     'pseudo_costs':         1 [   9.53s,    9.53s]    9.53s   0.00ns    9.53s         1 [   4.06s,    4.06s]    4.06s   0.00ns    4.06s
                    'quick_restart':         1 [   9.53s,    9.53s]    9.53s   0.00ns    9.53s         1 [   3.80s,    3.80s]    3.80s   0.00ns    3.80s
              'quick_restart_no_lp':         1 [   9.52s,    9.52s]    9.52s   0.00ns    9.52s         1 [   3.12s,    3.12s]    3.12s   0.00ns    3.12s
                    'reduced_costs':         1 [   9.53s,    9.53s]    9.53s   0.00ns    9.53s         1 [   3.80s,    3.80s]    3.80s   0.00ns    3.80s
                        'rins/rens':        44 [ 79.40us,    1.19s] 283.20ms 240.45ms   12.46s        36 [ 10.00ns, 100.68ms]  67.75ms  39.64ms    2.44s
                      'rnd_cst_lns':        44 [977.91us, 560.25ms] 261.39ms 192.92ms   11.50s        40 [ 10.00ns, 100.33ms]  51.12ms  42.79ms    2.04s
                      'rnd_var_lns':        44 [  2.57ms, 529.11ms] 229.56ms 181.98ms   10.10s        42 [ 10.00ns, 100.13ms]  41.43ms  42.20ms    1.74s
         'scheduling_intervals_lns':        43 [180.09ms,    1.27s] 528.57ms 181.97ms   22.73s        42 [ 91.14ms, 100.81ms]  99.91ms   1.38ms    4.20s
       'scheduling_precedences_lns':        43 [128.85ms,    1.07s] 522.56ms 154.44ms   22.47s        41 [ 71.50ms, 200.07ms] 101.92ms  16.14ms    4.18s
       'scheduling_time_window_lns':        43 [139.58ms,    1.13s] 521.96ms 167.69ms   22.44s        42 [ 88.71ms, 100.98ms]  99.89ms   1.76ms    4.20s
                     'violation_ls':        44 [  2.71ms, 117.63ms]  48.35ms  18.90ms    2.13s        44 [  2.14ms,  83.06ms]  67.38ms  22.93ms    2.96s
                     'violation_ls':        44 [726.18us,  59.25ms]  36.04ms  14.43ms    1.59s        44 [503.78us, 130.90ms]  59.77ms  34.21ms    2.63s

Search stats                        Bools  Conflicts  Branches  Restarts  BoolPropag  IntegerPropag
                           'core':  2'829     12'414    20'723     2'681  12'368'503      5'835'619
                     'default_lp':     71      6'545    26'651     4'180     137'301      4'389'224
                          'fixed':    719     28'575    52'029       411   3'767'254      5'561'956
                      'fs_random':     71          0       142       142          30          2'433
                      'fs_random':     71          0       142       142          30          2'433
                'fs_random_no_lp':     75          0       151       142          70          3'048
        'fs_random_quick_restart':     71          0       142       142          30          2'433
        'fs_random_quick_restart':     71          0       142       142          30          2'433
  'fs_random_quick_restart_no_lp':     71          0       180       142          35          3'000
                 'lb_tree_search':     77        103    23'883     5'478      29'067      1'141'476
                         'max_lp':     71      2'683    30'894     6'388     105'774      3'407'485
                          'no_lp':    778     15'919    42'870     5'599   3'496'781      8'980'072
            'objective_lb_search':    129      4'576    32'807     7'647     158'699      4'177'933
     'objective_lb_search_max_lp':    110      2'433    28'042     8'078     104'377      2'835'312
      'objective_lb_search_no_lp':    213     15'550    35'680     3'957     356'900      8'054'804
                        'probing':    279        110       448       448       3'981         28'919
                 'probing_max_lp':    199         55       343       343       1'369         13'017
                   'pseudo_costs':     71      2'988    33'341     8'346     116'305      3'528'752
                  'quick_restart':    366      2'333    43'239    11'144     673'264      3'290'763
            'quick_restart_no_lp':  1'209     15'376    59'466     5'773   4'734'388      7'767'058
                  'reduced_costs':    468      3'686    37'931     7'014   1'304'746      3'672'936

SAT stats                           ClassicMinim  LitRemoved  LitLearned  LitForgotten  Subsumed  MClauses  MDecisions  MLitTrue  MSubsumed  MLitRemoved  MReused
                           'core':        11'060      59'872      72'924             0       105       950       4'818         0         28          103       13
                     'default_lp':         4'213       9'741      60'022             0       446     2'135      17'734         0        738        4'696      328
                          'fixed':        26'956     109'098     481'434       208'930         0        20         100         0          0            0        0
                      'fs_random':             0           0           0             0         0         0           0         0          0            0        0
                      'fs_random':             0           0           0             0         0         0           0         0          0            0        0
                'fs_random_no_lp':             0           0           0             0         0         0           0         0          0            0        0
        'fs_random_quick_restart':             0           0           0             0         0         0           0         0          0            0        0
        'fs_random_quick_restart':             0           0           0             0         0         0           0         0          0            0        0
  'fs_random_quick_restart_no_lp':             0           0           0             0         0         0           0         0          0            0        0
                 'lb_tree_search':             2           2         404             0         4     1'684       8'507         0         10           39       81
                         'max_lp':         1'478       3'136      24'797             0       211     2'740      25'041         0        367        2'333      700
                          'no_lp':        12'808      47'997     171'412        23'969       243     2'361      16'025         1        862        5'399      203
            'objective_lb_search':         3'300       7'808      34'181             0       307     2'781      22'258         0        552        3'285      837
     'objective_lb_search_max_lp':         1'757       3'863      17'760             0       145     2'527      19'379         0        339        1'911      508
      'objective_lb_search_no_lp':        12'191      36'708     106'080             0       622     2'076      15'749        36        977        5'899      450
                        'probing':             0           0         110             0         0         0           0         0          0            0        0
                 'probing_max_lp':             0           0          55             0         0         0           0         0          0            0        0
                   'pseudo_costs':         1'772       3'835      27'993             0       223     3'226      25'553         0        296        1'880      744
                  'quick_restart':         1'468       4'025      18'110             0       140     3'654      28'233         4        824        5'418      663
            'quick_restart_no_lp':        11'530      48'097     150'893             0       238     3'138      27'067         9      2'385       21'086      279
                  'reduced_costs':         2'186       5'279      36'660             0       205     2'981      22'420         0        566        3'419      497

Lp stats                         Component  Iterations  AddedCuts  OPTIMAL  DUAL_F.  DUAL_U.
                  'default_lp':          1      62'299      5'688    8'852        0        0
                       'fixed':          1      12'976      1'741   26'708        0        0
                   'fs_random':          1           1          0        1        1        0
                   'fs_random':          1           1          0        1        1        0
     'fs_random_quick_restart':          1           1          0        1        1        0
     'fs_random_quick_restart':          1           1          0        1        1        0
              'lb_tree_search':          1     140'233      4'567    7'577    2'409        0
                      'max_lp':          1      71'145      4'618    3'992    1'037        1
         'objective_lb_search':          1      63'852      5'600    6'569        0        0
  'objective_lb_search_max_lp':          1     101'916      4'120    3'494    1'333        4
                     'probing':          1      11'560      8'034    1'518        0        0
              'probing_max_lp':          1       8'198      5'313      987       31        0
                'pseudo_costs':          1      81'024      5'192    4'667    1'354        1
               'quick_restart':          1      44'775      5'970    3'846        0        0
               'reduced_costs':          1      72'173      6'043    5'252    1'204        2

Lp dimension                                                                      Final dimension of first component
                  'default_lp':   528 rows, 216 columns, 2433 entries with magnitude in [2.192949e-03, 1.000000e+00]
                       'fixed':    123 rows, 216 columns, 404 entries with magnitude in [4.343722e-02, 1.000000e+00]
                   'fs_random':     62 rows, 216 columns, 214 entries with magnitude in [9.712859e-02, 1.000000e+00]
                   'fs_random':     62 rows, 216 columns, 214 entries with magnitude in [9.712859e-02, 1.000000e+00]
     'fs_random_quick_restart':     62 rows, 216 columns, 214 entries with magnitude in [9.712859e-02, 1.000000e+00]
     'fs_random_quick_restart':     62 rows, 216 columns, 214 entries with magnitude in [9.712859e-02, 1.000000e+00]
              'lb_tree_search':   636 rows, 220 columns, 2575 entries with magnitude in [9.110188e-03, 1.000000e+00]
                      'max_lp':   792 rows, 220 columns, 2885 entries with magnitude in [4.250512e-03, 1.000000e+00]
         'objective_lb_search':   491 rows, 216 columns, 2466 entries with magnitude in [6.977342e-04, 1.000000e+00]
  'objective_lb_search_max_lp':   916 rows, 220 columns, 3932 entries with magnitude in [1.748426e-03, 1.000000e+00]
                     'probing':   551 rows, 216 columns, 4092 entries with magnitude in [3.301343e-05, 1.000000e+00]
              'probing_max_lp':  1114 rows, 220 columns, 8309 entries with magnitude in [1.822262e-03, 1.000000e+00]
                'pseudo_costs':  1182 rows, 220 columns, 4081 entries with magnitude in [1.419130e-03, 1.000000e+00]
               'quick_restart':   734 rows, 216 columns, 3961 entries with magnitude in [4.173847e-04, 1.000000e+00]
               'reduced_costs':   412 rows, 220 columns, 1835 entries with magnitude in [1.592032e-03, 1.000000e+00]

Lp debug                         CutPropag  CutEqPropag  Adjust  Overflow      Bad  BadScaling
                  'default_lp':          5           58   4'657         0   46'110           0
                       'fixed':          0            2      18         0    5'481           0
                   'fs_random':          0            0       0         0        0           0
                   'fs_random':          0            0       0         0        0           0
     'fs_random_quick_restart':          0            0       0         0        0           0
     'fs_random_quick_restart':          0            0       0         0        0           0
              'lb_tree_search':         29            2   6'674         0   40'119           0
                      'max_lp':          8            1   2'730         0   44'778           0
         'objective_lb_search':          6            8   4'669         0   83'190           0
  'objective_lb_search_max_lp':         36            5   2'791         0   74'579           0
                     'probing':          0           54   1'436         0  695'573           0
              'probing_max_lp':         17           20     956         0  588'456           0
                'pseudo_costs':         40            8   2'981         0   71'126           0
               'quick_restart':          9           20   2'562         0  151'086           0
               'reduced_costs':         28            4   4'130         0   62'722           0

Lp pool                          Constraints  Updates  Simplif  Merged  Shortened   Split  Strenghtened     Cuts/Call
                  'default_lp':        5'900      869   17'992      43      2'622   4'334         6'438  5'688/12'217
                       'fixed':        1'996       64      156       0          0      78           157   1'741/3'073
                   'fs_random':          255        0        0       0          0       0             6           0/0
                   'fs_random':          255        0        0       0          0       0             6           0/0
     'fs_random_quick_restart':          255        0        0       0          0       0             6           0/0
     'fs_random_quick_restart':          255        0        0       0          0       0             6           0/0
              'lb_tree_search':        6'971      458   16'910      36          0     516        21'318  4'567/10'880
                      'max_lp':        7'028      509   24'661      30      3'884     826        27'891  4'618/10'036
         'objective_lb_search':        5'840    1'147   21'933      15      4'378   5'686         4'973  5'600/10'640
  'objective_lb_search_max_lp':        6'544      745   36'391      16      4'536   1'829        34'827   4'120/9'103
                     'probing':        8'282    1'516   12'136       7          0   8'527         1'968  8'034/13'453
              'probing_max_lp':        7'747      702   10'128       6      1'561   3'620        11'565  5'313/11'140
                'pseudo_costs':        7'586      640   38'952      46      7'276   1'704        38'116  5'192/11'578
               'quick_restart':        6'214    1'346   34'521      11      6'018  15'110        10'099  5'970/11'043
               'reduced_costs':        8'378      552   27'113     105      1'230   1'348        28'305  6'043/13'280

Lp Cut                                         defaul  fixed  max_lp  quick_  reduce  pseudo  lb_tre  probin  object  probin  object
                                       CG_FF:     326    162     223     174     227     166     227     189     200     242     136
                                        CG_K:     144     42     102      75     142     110      88     105     103      76      74
                                        CG_R:     155     46     160     149     202     115     155     243     153     155      90
                                       CG_RB:   1'651    516     790   2'078     859     709     766   3'755   1'910     672     444
                                      CG_RBP:     269     84      90     248     147      82     100     550     261      71      76
                                      Clique:       -      -      34       -      25      34      26       -       -      17      35
                                          IB:     634    301     315     575     554     540     376     418     608     128     456
                                    MIR_1_FF:     187     68     326     183     348     325     322     232     156     329     240
                                     MIR_1_K:      32     14      74      32      85      77      68      37      25      42      46
                                    MIR_1_KL:       -      -       -       -       -       1       -       -       -       -       -
                                     MIR_1_R:      32     13      28      39      53      29      20      40      30      47      24
                                    MIR_1_RB:     333     96     489     391     652     520     465     440     322     538     416
                                   MIR_1_RBP:      14      2      64      24      79      48      67      15      22      48      38
                                   MIR_1_RLT:       -      -       5       -       4       4       2       -       -       2       5
                                    MIR_2_FF:     166     50     155     133     216     163     146     172     108     160     156
                                     MIR_2_K:      35     10      45      26      42      42      40      22      15      40      38
                                    MIR_2_KL:       -      -       -       -       2       -       -       -       -       -       -
                                     MIR_2_R:      50     17      54      53      84      67      59      73      38      87      62
                                    MIR_2_RB:     289     61     228     343     384     269     208     314     278     261     211
                                   MIR_2_RBP:      29      2      33      41      51      35      28      16      26      31      32
                                    MIR_3_FF:      97     24     107      95     137     140     120     106      74     101      76
                                     MIR_3_K:      21      5      34      18      35      43      38      33      23      26      27
                                    MIR_3_KL:       -      -       -       -       -       -       -       -       -       -       1
                                     MIR_3_R:      45     10      61      51      74      53      57      60      42      81      37
                                    MIR_3_RB:     195     46     168     262     238     208     161     239     211     163     134
                                   MIR_3_RBP:      17      4      19      33      39      17      21      20      20      23      14
                                    MIR_4_FF:      64     17      54      54      57      60      51      54      58      34      42
                                     MIR_4_K:      13      4      20       9      27      27      17      26      20      14      20
                                    MIR_4_KL:       -      -       1       1       -       -       1       1       -       1       -
                                     MIR_4_R:      38     11      33      34      43      45      30      32      24      31      31
                                    MIR_4_RB:     112     20      86     143     122     107      95     134     124      81      73
                                   MIR_4_RBP:       9      3       9      15      20      22      15      14      13       7       7
                                    MIR_5_FF:      52      6      26      35      34      31      40      39      36      23      37
                                     MIR_5_K:      13      -       8      12      21      18      12       9      11       8      15
                                    MIR_5_KL:       1      -       -       -       -       -       -       -       -       -       -
                                     MIR_5_R:      27      4      19      20      35      27      19      26      19      28      27
                                    MIR_5_RB:      92     15      49      93      74      73      37      92      91      50      56
                                   MIR_5_RBP:      11      1       7       9      11      15      10      10      10       4       8
                                    MIR_6_FF:      22      3      14      19      23      25      15      20      21       8      17
                                     MIR_6_K:       4      -       2       1       9       9       6       4       5       1       5
                                     MIR_6_R:      14      1       9      17      12      15      11      13      12      11      17
                                    MIR_6_RB:      54      6      29      49      41      43      20      45      61      16      40
                                   MIR_6_RBP:       7      -       -       4      12       8       4       2       4       1       5
  NoOverlapCompletionTimeExhaustive_weighted:       -      -       2       -       4       3       2       -       -       2       2
                 NoOverlapDisjunctionOnStart:       -      -       3       -       4       4       3       -       -       3       3
                                ZERO_HALF_FF:      58      9      61      51      60      76      50      41      31      49      44
                                 ZERO_HALF_K:      15      3      23       6      22      23      12      11      10       7       9
                                 ZERO_HALF_R:     223     37     375     226     531     550     359     267     279   1'385     636
                                ZERO_HALF_RB:     115     27     150     125     170     184     146     104     114     146     129
                               ZERO_HALF_RBP:      23      1      34      24      32      30      52      11      32      63      29

LNS stats                        Improv/Calls  Closed  Difficulty  TimeLimit
               'graph_arc_lns':          1/43     53%        0.95       0.10
               'graph_cst_lns':           0/0      0%        0.50       0.10
               'graph_dec_lns':          2/43     60%        0.98       0.10
               'graph_var_lns':          1/43     60%        0.98       0.10
                   'rins/rens':          9/41     54%        0.90       0.10
                 'rnd_cst_lns':          0/40     60%        0.98       0.10
                 'rnd_var_lns':          2/43     67%        0.99       0.10
    'scheduling_intervals_lns':          4/43      0%        0.00       0.10
  'scheduling_precedences_lns':          4/43      0%        0.00       0.10
  'scheduling_time_window_lns':          5/43      0%        0.00       0.10

LS stats                   Batches  Restarts  LinMoves  GenMoves  CompoundMoves  WeightUpdates
       'fj_long_default':        1         1     5'408         0              0            219
   'fj_long_lin_default':        1         1         0     2'485            330              1
        'fj_long_random':        1         1     9'610         0              0            390
      'fj_short_default':        1         1         0     2'764            315              1
  'fj_short_lin_default':        1         1         0     2'622            363              1
   'fj_short_lin_random':        1         1         0     2'904            359              1
       'fj_short_random':        1         1         0     2'706            503              2
          'violation_ls':       44         0    16'661   188'140          7'144         16'151
          'violation_ls':       44         0   256'377     6'403            497        144'451

Solutions (32)                   Num     Rank
               'graph_dec_lns':    1  [30,30]
                       'no_lp':   14   [2,28]
         'quick_restart_no_lp':   10   [1,25]
               'rins_pump_lns':    2  [27,29]
  'scheduling_precedences_lns':    1  [31,31]
  'scheduling_time_window_lns':    1  [32,32]
                'violation_ls':    3   [6,13]

Objective bounds                     Num
                       'bool_core':   21
                  'initial_domain':    1
             'objective_lb_search':    2
      'objective_lb_search_max_lp':    1
       'objective_lb_search_no_lp':   63
  'objective_shaving_search_no_lp':    2

Solution repositories    Added  Queried  Ignored  Synchro
  'feasible solutions':    353      986        6      325
        'lp solutions':    141       12        0      114
                'pump':    901       32

Improving bounds shared            Num
                        'core':     31
                  'default_lp':     46
                       'fixed':     13
              'lb_tree_search':     35
                      'max_lp':     19
                       'no_lp':    149
         'objective_lb_search':      9
  'objective_lb_search_max_lp':     82
   'objective_lb_search_no_lp':     19
                     'probing':     98
              'probing_max_lp':     22
                'pseudo_costs':    203
               'quick_restart':    507
         'quick_restart_no_lp':  1'001
               'reduced_costs':     37

Clauses shared                   Num
                  'default_lp':   10
              'lb_tree_search':    1
                      'max_lp':    1
                       'no_lp':   24
         'objective_lb_search':   10
  'objective_lb_search_max_lp':    8
   'objective_lb_search_no_lp':    1
                'pseudo_costs':   50
               'quick_restart':    2
         'quick_restart_no_lp':    8
               'reduced_costs':    1

CpSolverResponse summary:
status: OPTIMAL
objective: 725
best_bound: 725
integers: 218
booleans: 71
conflicts: 0
branches: 180
propagations: 35
integer_propagations: 3000
restarts: 142
lp_iterations: 0
walltime: 9.73153
usertime: 9.73153
deterministic_time: 96.49
gap_integral: 381.414
solution_fingerprint: 0xf0a684c320e3ad5


--- Simulation Gantt  partir du modle mathmatique ---
