created virtual environment CPython3.12.4.final.0-64 in 10493ms
  creator CPython3Posix(dest=/localscratch/aneumann.63390699.0/env, clear=False, no_vcs_ignore=False, global=False)
  seeder FromAppData(download=False, pip=bundle, via=copy, app_data_dir=/home/aneumann/.local/share/virtualenv)
    added seed packages: pip==25.1.1
  activators BashActivator,CShellActivator,FishActivator,NushellActivator,PowerShellActivator,PythonActivator
Looking in links: /cvmfs/soft.computecanada.ca/custom/python/wheelhouse/gentoo2023/x86-64-v3, /cvmfs/soft.computecanada.ca/custom/python/wheelhouse/gentoo2023/generic, /cvmfs/soft.computecanada.ca/custom/python/wheelhouse/generic
Requirement already satisfied: pip in /localscratch/aneumann.63390699.0/env/lib/python3.12/site-packages (25.1.1)
Looking in links: /cvmfs/soft.computecanada.ca/custom/python/wheelhouse/gentoo2023/x86-64-v3, /cvmfs/soft.computecanada.ca/custom/python/wheelhouse/gentoo2023/generic, /cvmfs/soft.computecanada.ca/custom/python/wheelhouse/generic
ERROR: protobuf-5.28.3-cp38-abi3-manylinux2014_x86_64.whl is not a supported wheel on this platform.
Looking in links: /cvmfs/soft.computecanada.ca/custom/python/wheelhouse/gentoo2023/x86-64-v3, /cvmfs/soft.computecanada.ca/custom/python/wheelhouse/gentoo2023/generic, /cvmfs/soft.computecanada.ca/custom/python/wheelhouse/generic
Processing /home/aneumann/projects/def-adhaj/aneumann/GNRS/wheels/immutabledict-4.2.0-py3-none-any.whl
Installing collected packages: immutabledict
Successfully installed immutabledict-4.2.0
Looking in links: /cvmfs/soft.computecanada.ca/custom/python/wheelhouse/gentoo2023/x86-64-v3, /cvmfs/soft.computecanada.ca/custom/python/wheelhouse/gentoo2023/generic, /cvmfs/soft.computecanada.ca/custom/python/wheelhouse/generic
Processing /cvmfs/soft.computecanada.ca/custom/python/wheelhouse/generic/ortools-9.10.4067+computecanada-cp312-cp312-linux_x86_64.whl (from -r /home/aneumann/projects/def-adhaj/aneumann/GNRS/requirements/or.txt (line 1))
Processing /cvmfs/soft.computecanada.ca/custom/python/wheelhouse/gentoo2023/x86-64-v3/matplotlib-3.10.0+computecanada-cp312-cp312-linux_x86_64.whl (from -r /home/aneumann/projects/def-adhaj/aneumann/GNRS/requirements/or.txt (line 2))
Processing /cvmfs/soft.computecanada.ca/custom/python/wheelhouse/gentoo2023/x86-64-v3/pandas-2.2.3+computecanada-cp312-cp312-linux_x86_64.whl (from -r /home/aneumann/projects/def-adhaj/aneumann/GNRS/requirements/or.txt (line 3))
Processing /cvmfs/soft.computecanada.ca/custom/python/wheelhouse/generic/absl_py-2.2.2+computecanada-py3-none-any.whl (from ortools<9.11,>=9.10->-r /home/aneumann/projects/def-adhaj/aneumann/GNRS/requirements/or.txt (line 1))
Processing /cvmfs/soft.computecanada.ca/custom/python/wheelhouse/gentoo2023/generic/numpy-2.2.2+computecanada-cp312-cp312-linux_x86_64.whl (from ortools<9.11,>=9.10->-r /home/aneumann/projects/def-adhaj/aneumann/GNRS/requirements/or.txt (line 1))
Processing /cvmfs/soft.computecanada.ca/custom/python/wheelhouse/gentoo2023/x86-64-v3/protobuf-6.30.2+computecanada-cp312-cp312-linux_x86_64.whl (from ortools<9.11,>=9.10->-r /home/aneumann/projects/def-adhaj/aneumann/GNRS/requirements/or.txt (line 1))
Requirement already satisfied: immutabledict>=3.0.0 in /localscratch/aneumann.63390699.0/env/lib/python3.12/site-packages (from ortools<9.11,>=9.10->-r /home/aneumann/projects/def-adhaj/aneumann/GNRS/requirements/or.txt (line 1)) (4.2.0)
Processing /cvmfs/soft.computecanada.ca/custom/python/wheelhouse/gentoo2023/generic/contourpy-1.3.1+computecanada-cp312-cp312-linux_x86_64.whl (from matplotlib->-r /home/aneumann/projects/def-adhaj/aneumann/GNRS/requirements/or.txt (line 2))
Processing /cvmfs/soft.computecanada.ca/custom/python/wheelhouse/generic/cycler-0.12.1+computecanada-py3-none-any.whl (from matplotlib->-r /home/aneumann/projects/def-adhaj/aneumann/GNRS/requirements/or.txt (line 2))
Processing /cvmfs/soft.computecanada.ca/custom/python/wheelhouse/generic/fonttools-4.58.2+computecanada-cp312-cp312-linux_x86_64.whl (from matplotlib->-r /home/aneumann/projects/def-adhaj/aneumann/GNRS/requirements/or.txt (line 2))
Processing /cvmfs/soft.computecanada.ca/custom/python/wheelhouse/gentoo2023/x86-64-v3/kiwisolver-1.4.8+computecanada-cp312-cp312-linux_x86_64.whl (from matplotlib->-r /home/aneumann/projects/def-adhaj/aneumann/GNRS/requirements/or.txt (line 2))
Processing /cvmfs/soft.computecanada.ca/custom/python/wheelhouse/generic/packaging-25.0+computecanada-py3-none-any.whl (from matplotlib->-r /home/aneumann/projects/def-adhaj/aneumann/GNRS/requirements/or.txt (line 2))
Processing /cvmfs/soft.computecanada.ca/custom/python/wheelhouse/gentoo2023/x86-64-v3/pillow-11.1.0+computecanada-cp312-cp312-linux_x86_64.whl (from matplotlib->-r /home/aneumann/projects/def-adhaj/aneumann/GNRS/requirements/or.txt (line 2))
Processing /cvmfs/soft.computecanada.ca/custom/python/wheelhouse/generic/pyparsing-3.2.1+computecanada-py3-none-any.whl (from matplotlib->-r /home/aneumann/projects/def-adhaj/aneumann/GNRS/requirements/or.txt (line 2))
Processing /cvmfs/soft.computecanada.ca/custom/python/wheelhouse/generic/python_dateutil-2.9.0.post0+computecanada-py2.py3-none-any.whl (from matplotlib->-r /home/aneumann/projects/def-adhaj/aneumann/GNRS/requirements/or.txt (line 2))
Processing /cvmfs/soft.computecanada.ca/custom/python/wheelhouse/generic/pytz-2025.2+computecanada-py2.py3-none-any.whl (from pandas->-r /home/aneumann/projects/def-adhaj/aneumann/GNRS/requirements/or.txt (line 3))
Processing /cvmfs/soft.computecanada.ca/custom/python/wheelhouse/generic/tzdata-2025.2+computecanada-py2.py3-none-any.whl (from pandas->-r /home/aneumann/projects/def-adhaj/aneumann/GNRS/requirements/or.txt (line 3))
Processing /cvmfs/soft.computecanada.ca/custom/python/wheelhouse/generic/six-1.17.0+computecanada-py2.py3-none-any.whl (from python-dateutil>=2.7->matplotlib->-r /home/aneumann/projects/def-adhaj/aneumann/GNRS/requirements/or.txt (line 2))
Installing collected packages: pytz, tzdata, six, pyparsing, protobuf, pillow, packaging, numpy, kiwisolver, fonttools, cycler, absl-py, python-dateutil, contourpy, pandas, matplotlib, ortools

Successfully installed absl-py-2.2.2+computecanada contourpy-1.3.1+computecanada cycler-0.12.1+computecanada fonttools-4.58.2+computecanada kiwisolver-1.4.8+computecanada matplotlib-3.10.0+computecanada numpy-2.2.2+computecanada ortools-9.10.4067+computecanada packaging-25.0+computecanada pandas-2.2.3+computecanada pillow-11.1.0+computecanada protobuf-6.30.2+computecanada pyparsing-3.2.1+computecanada python-dateutil-2.9.0.post0+computecanada pytz-2025.2+computecanada six-1.17.0+computecanada tzdata-2025.2+computecanada

Starting CP-SAT solver v9.10.4067
Parameters: max_time_in_seconds: 3600 max_memory_in_mb: 12000 log_search_progress: true enumerate_all_solutions: false absolute_gap_limit: 0 relative_gap_limit: 0
Setting number of workers to 48

Initial optimization model '': (model_fingerprint: 0x54656c408d3a6cd5)
#Variables: 166 (#ints: 6 in objective)
  - 107 Booleans in [0,1]
  - 59 in [0,373]
#kLinear1: 19
#kLinear2: 215
#kLinear3: 106
#kLinearN: 651 (#terms: 6'590)

Starting presolve at 0.00s
  3.49e-04s  0.00e+00d  [DetectDominanceRelations] 
  8.90e-03s  0.00e+00d  [PresolveToFixPoint] #num_loops=6 #num_dual_strengthening=3 
  1.66e-05s  0.00e+00d  [ExtractEncodingFromLinear] #potential_supersets=1 
[Symmetry] Graph for symmetry has 884 nodes and 3'727 arcs.
[Symmetry] Symmetry computation done. time: 0.000461907 dtime: 0.00032917
[SAT presolve] num removable Booleans: 0 / 34
[SAT presolve] num trivial clauses: 0
[SAT presolve] [0s] clauses:3 literals:9 vars:8 one_side_vars:8 simple_definition:0 singleton_clauses:0
[SAT presolve] [3.9223e-05s] clauses:3 literals:9 vars:8 one_side_vars:8 simple_definition:0 singleton_clauses:0
[SAT presolve] [5.1258e-05s] clauses:3 literals:9 vars:8 one_side_vars:8 simple_definition:0 singleton_clauses:0
  2.24e-03s  2.35e-04d  [Probe] #probed=142 #fixed_bools=2 #new_bounds=18 #new_binary_clauses=9 
  6.09e-06s  0.00e+00d  [MaxClique] 
  3.34e-04s  0.00e+00d  [DetectDominanceRelations] 
  4.06e-03s  0.00e+00d  [PresolveToFixPoint] #num_loops=4 #num_dual_strengthening=3 
  7.75e-04s  0.00e+00d  [ProcessAtMostOneAndLinear] 
  6.21e-04s  0.00e+00d  [DetectDuplicateConstraints] #duplicates=137 #without_enforcements=41 
  2.67e-04s  6.79e-06d  [DetectDominatedLinearConstraints] #relevant_constraints=298 #num_inclusions=89 #num_redundant=7 
  1.58e-04s  0.00e+00d  [DetectDifferentVariables] #different=31 #cliques=1 #size=6 
  8.10e-05s  2.36e-06d  [ProcessSetPPC] #relevant_constraints=164 
  1.04e-05s  0.00e+00d  [FindAlmostIdenticalLinearConstraints] 
  2.72e-05s  1.07e-05d  [FindBigAtMostOneAndLinearOverlap] 
  5.67e-04s  1.83e-04d  [FindBigVerticalLinearOverlap] #blocks=4 #saved_nz=174 
  3.88e-05s  6.56e-06d  [FindBigHorizontalLinearOverlap] #linears=149 
  1.70e-05s  4.50e-08d  [MergeClauses] 
  3.20e-04s  0.00e+00d  [DetectDominanceRelations] 
  2.73e-03s  0.00e+00d  [PresolveToFixPoint] #num_loops=2 #num_dual_strengthening=1 
  3.15e-04s  0.00e+00d  [DetectDominanceRelations] 
  2.00e-03s  0.00e+00d  [PresolveToFixPoint] #num_loops=1 #num_dual_strengthening=1 
[Symmetry] Graph for symmetry has 756 nodes and 3'168 arcs.
[Symmetry] Symmetry computation done. time: 0.000184127 dtime: 0.00022949
[SAT presolve] num removable Booleans: 0 / 32
[SAT presolve] num trivial clauses: 0
[SAT presolve] [0s] clauses:3 literals:9 vars:8 one_side_vars:8 simple_definition:0 singleton_clauses:0
[SAT presolve] [3.1596e-05s] clauses:3 literals:9 vars:8 one_side_vars:8 simple_definition:0 singleton_clauses:0
[SAT presolve] [4.3408e-05s] clauses:3 literals:9 vars:8 one_side_vars:8 simple_definition:0 singleton_clauses:0
  2.16e-03s  2.20e-04d  [Probe] #probed=138 #new_bounds=3 #new_binary_clauses=9 
  5.72e-06s  0.00e+00d  [MaxClique] 
  3.17e-04s  0.00e+00d  [DetectDominanceRelations] 
  2.36e-03s  0.00e+00d  [PresolveToFixPoint] #num_loops=2 #num_dual_strengthening=1 
  6.13e-04s  0.00e+00d  [ProcessAtMostOneAndLinear] 
  4.75e-04s  0.00e+00d  [DetectDuplicateConstraints] #without_enforcements=45 
  1.45e-04s  4.72e-06d  [DetectDominatedLinearConstraints] #relevant_constraints=238 #num_inclusions=10 
  5.85e-05s  0.00e+00d  [DetectDifferentVariables] 
  7.28e-05s  1.98e-06d  [ProcessSetPPC] #relevant_constraints=147 
  1.29e-05s  1.50e-08d  [FindAlmostIdenticalLinearConstraints] #num_tested_pairs=1 
  2.28e-05s  9.61e-06d  [FindBigAtMostOneAndLinearOverlap] 
  3.61e-04s  1.60e-04d  [FindBigVerticalLinearOverlap] 
  3.57e-05s  6.25e-06d  [FindBigHorizontalLinearOverlap] #linears=141 
  1.58e-05s  4.50e-08d  [MergeClauses] 
  3.16e-04s  0.00e+00d  [DetectDominanceRelations] 
  1.98e-03s  0.00e+00d  [PresolveToFixPoint] #num_loops=1 #num_dual_strengthening=1 
  3.12e-04s  0.00e+00d  [DetectDominanceRelations] 
  1.96e-03s  0.00e+00d  [PresolveToFixPoint] #num_loops=1 #num_dual_strengthening=1 
[Symmetry] Graph for symmetry has 753 nodes and 3'165 arcs.
[Symmetry] Symmetry computation done. time: 0.000178927 dtime: 0.0002229
[SAT presolve] num removable Booleans: 0 / 32
[SAT presolve] num trivial clauses: 0
[SAT presolve] [0s] clauses:3 literals:9 vars:8 one_side_vars:8 simple_definition:0 singleton_clauses:0
[SAT presolve] [3.0093e-05s] clauses:3 literals:9 vars:8 one_side_vars:8 simple_definition:0 singleton_clauses:0
[SAT presolve] [4.2442e-05s] clauses:3 literals:9 vars:8 one_side_vars:8 simple_definition:0 singleton_clauses:0
  2.11e-03s  2.19e-04d  [Probe] #probed=138 #new_binary_clauses=9 
  5.47e-06s  0.00e+00d  [MaxClique] 
  3.17e-04s  0.00e+00d  [DetectDominanceRelations] 
  2.00e-03s  0.00e+00d  [PresolveToFixPoint] #num_loops=1 #num_dual_strengthening=1 
  6.19e-04s  0.00e+00d  [ProcessAtMostOneAndLinear] 
  4.69e-04s  0.00e+00d  [DetectDuplicateConstraints] #without_enforcements=45 
  1.50e-04s  4.72e-06d  [DetectDominatedLinearConstraints] #relevant_constraints=238 #num_inclusions=10 
  5.85e-05s  0.00e+00d  [DetectDifferentVariables] 
  7.30e-05s  1.98e-06d  [ProcessSetPPC] #relevant_constraints=147 
  1.27e-05s  1.50e-08d  [FindAlmostIdenticalLinearConstraints] #num_tested_pairs=1 
  2.33e-05s  9.61e-06d  [FindBigAtMostOneAndLinearOverlap] 
  3.59e-04s  1.60e-04d  [FindBigVerticalLinearOverlap] 
  3.54e-05s  6.25e-06d  [FindBigHorizontalLinearOverlap] #linears=141 
  1.62e-05s  4.50e-08d  [MergeClauses] 
  3.16e-04s  0.00e+00d  [DetectDominanceRelations] 
  1.97e-03s  0.00e+00d  [PresolveToFixPoint] #num_loops=1 #num_dual_strengthening=1 
  2.62e-05s  0.00e+00d  [ExpandObjective] #entries=18 #tight_variables=9 #tight_constraints=4 

Presolve summary:
  - 29 affine relations were detected.
  - rule 'TODO dual: only one blocking constraint?' was applied 396 times.
  - rule 'TODO dual: only one unspecified blocking constraint?' was applied 78 times.
  - rule 'TODO duplicate: identical constraint with different enforcements' was applied 131 times.
  - rule 'affine: new relation' was applied 29 times.
  - rule 'deductions: 82 stored' was applied 1 time.
  - rule 'dual: fix variable' was applied 12 times.
  - rule 'dual: reduced domain' was applied 32 times.
  - rule 'duplicate: merged rhs of linear constraint' was applied 27 times.
  - rule 'duplicate: removed constraint' was applied 137 times.
  - rule 'enforcement: false literal' was applied 20 times.
  - rule 'enforcement: true literal' was applied 8 times.
  - rule 'incompatible linear: add implication' was applied 42 times.
  - rule 'linear inclusion: redundant containing constraint' was applied 3 times.
  - rule 'linear inclusion: redundant included constraint' was applied 4 times.
  - rule 'linear matrix: common vertical rectangle' was applied 4 times.
  - rule 'linear2: contains a Boolean.' was applied 19 times.
  - rule 'linear: always true' was applied 336 times.
  - rule 'linear: doubleton free' was applied 3 times.
  - rule 'linear: empty' was applied 22 times.
  - rule 'linear: extracted enforcement literal' was applied 1'147 times.
  - rule 'linear: fixed or dup variables' was applied 676 times.
  - rule 'linear: negative clause' was applied 3 times.
  - rule 'linear: positive equal one' was applied 1 time.
  - rule 'linear: reduced variable domains' was applied 74 times.
  - rule 'linear: remapped using affine relations' was applied 580 times.
  - rule 'linear: simplified rhs' was applied 1'768 times.
  - rule 'linear: variable substitution 1' was applied 3 times.
  - rule 'no_overlap: inferred from x != y constraints' was applied 1 time.
  - rule 'presolve: 57 unused variables removed.' was applied 1 time.
  - rule 'presolve: iteration' was applied 3 times.
  - rule 'probing: simplified enforcement list.' was applied 2 times.

Presolved optimization model '': (model_fingerprint: 0xf001ce966893bcea)
#Variables: 81 (#ints: 6 in objective)
  - 32 Booleans in [0,1]
  - 1 in [-303,-65][0,308][373,657]
  - 1 in [0,208]
  - 4 in [0,238]
  - 2 in [0,248]
  - 1 in [0,272]
  - 2 in [0,285]
  - 5 in [0,292]
  - 1 in [0,295]
  - 2 in [0,305]
  - 2 in [0,308]
  - 1 in [0,308][373,681]
  - 2 in [0,318]
  - 2 in [0,355]
  - 1 in [3,308]
  - 1 in [40,345]
  - 1 in [45,350]
  - 1 in [53,345]
  - 2 in [57,362]
  - 1 in [58,350]
  - 1 in [63,368]
  - 2 in [67,362]
  - 2 in [70,362]
  - 1 in [73,368]
  - 1 in [76,368]
  - 3 in [90,362]
  - 1 in [96,368]
  - 3 in [124,362]
  - 1 in [130,368]
  - 1 in [135,373]
#kBoolOr: 3 (#literals: 9)
#kExactlyOne: 1 (#literals: 3)
#kInterval: 6
#kLinear1: 5 (#enforced: 5)
#kLinear2: 231 (#enforced: 194 #multi: 151)
#kLinear3: 35 (#enforced: 6)
#kLinearN: 166 (#enforced: 135) (#terms: 1'350)
#kNoOverlap: 1 (#intervals: 6)

Preloading model.
#Bound   0.05s best:inf   next:[135,1745] initial_domain
[Symmetry] Graph for symmetry has 664 nodes and 3'165 arcs.
[Symmetry] Symmetry computation done. time: 0.000181521 dtime: 0.00021756
#Model   0.05s var:81/81 constraints:448/448

Starting search at 0.05s with 48 workers.
17 full problem subsolvers: [core, default_lp, fixed, lb_tree_search, max_lp, no_lp, objective_lb_search, objective_lb_search_max_lp, objective_lb_search_no_lp, objective_shaving_search_max_lp, objective_shaving_search_no_lp, probing, probing_max_lp, pseudo_costs, quick_restart, quick_restart_no_lp, reduced_costs]
29 first solution subsolvers: [fj_long_default(2), fj_long_lin_default, fj_long_lin_perturb, fj_long_lin_random, fj_long_perturb, fj_long_random, fj_short_default(2), fj_short_lin_default(2), fj_short_lin_perturb, fj_short_lin_random, fj_short_perturb, fj_short_random, fs_random(4), fs_random_no_lp(3), fs_random_quick_restart(4), fs_random_quick_restart_no_lp(3)]
15 incomplete subsolvers: [feasibility_pump, graph_arc_lns, graph_cst_lns, graph_dec_lns, graph_var_lns, rins/rens, rnd_cst_lns, rnd_var_lns, scheduling_intervals_lns, scheduling_precedences_lns, scheduling_time_window_lns, violation_ls(4)]
3 helper subsolvers: [neighborhood_helper, synchronization_agent, update_gap_integral]
#Bound   0.05s best:inf   next:[136,1745] bool_core (num_cores=1 [size:1 mw:1] a=6 d=0 fixed=0/43 clauses=4)
#1       0.05s best:657   next:[136,656]  no_lp (fixed_bools=0/53)
#Bound   0.06s best:657   next:[137,656]  quick_restart_no_lp
#Bound   0.06s best:657   next:[142,656]  objective_lb_search_no_lp
#2       0.06s best:625   next:[142,624]  no_lp (fixed_bools=0/61)
#Bound   0.06s best:625   next:[143,624]  bool_core (num_cores=3 [cover] a=5 d=1 fixed=6/60 clauses=19)
#Bound   0.06s best:625   next:[144,624]  bool_core (num_cores=3 [cover] a=5 d=1 fixed=7/63 clauses=25)
#Bound   0.06s best:625   next:[145,624]  bool_core (num_cores=3 [cover] a=5 d=1 fixed=8/66 clauses=32)
#Bound   0.06s best:625   next:[146,624]  bool_core (num_cores=3 [cover] a=5 d=1 fixed=9/69 clauses=40)
#Bound   0.06s best:625   next:[147,624]  bool_core (num_cores=3 [cover] a=5 d=1 fixed=10/72 clauses=49)
#Bound   0.06s best:625   next:[148,624]  bool_core (num_cores=3 [cover] a=5 d=1 fixed=11/75 clauses=59)
#Bound   0.06s best:625   next:[161,624]  objective_lb_search_no_lp
#3       0.06s best:542   next:[161,541]  no_lp (fixed_bools=0/66)
#Bound   0.06s best:542   next:[226,541]  objective_lb_search_no_lp
#Bound   0.06s best:542   next:[231,541]  objective_lb_search_no_lp
#Bound   0.06s best:542   next:[232,541]  objective_lb_search_no_lp
#Bound   0.06s best:542   next:[248,541]  objective_lb_search_no_lp
#4       0.06s best:517   next:[248,516]  no_lp (fixed_bools=0/78)
#Bound   0.06s best:517   next:[339,516]  objective_lb_search_no_lp
#5       0.06s best:502   next:[339,501]  no_lp (fixed_bools=0/82)
#6       0.07s best:501   next:[339,500]  no_lp (fixed_bools=0/87)
#Bound   0.07s best:501   next:[347,500]  objective_lb_search_no_lp
#7       0.07s best:494   next:[347,493]  quick_restart_no_lp (fixed_bools=1/125)
#8       0.07s best:493   next:[347,492]  graph_dec_lns (d=0.71 s=66 t=0.10 p=1.00 stall=1 h=auto_l0) [presolve]
#Bound   0.07s best:493   next:[349,492]  objective_lb_search_no_lp
#Bound   0.08s best:493   next:[354,492]  objective_lb_search_no_lp
#9       0.08s best:492   next:[354,491]  graph_var_lns (d=0.88 s=74 t=0.10 p=1.00 stall=3 h=auto_l0) [presolve]
#10      0.08s best:490   next:[354,489]  graph_dec_lns (d=0.81 s=77 t=0.10 p=1.00 stall=0 h=auto_l0) [presolve]
#Bound   0.08s best:490   next:[357,489]  objective_lb_search_no_lp
#Bound   0.08s best:490   next:[362,489]  objective_lb_search_no_lp
#11      0.08s best:459   next:[362,458]  no_lp (fixed_bools=0/93)
#12      0.09s best:444   next:[363,443]  no_lp (fixed_bools=0/98)
#Model   0.10s var:77/81 constraints:315/448
#Model   0.10s var:74/81 constraints:254/448
#Done    0.10s no_lp
#Done    0.10s objective_lb_search_no_lp
#Model   0.11s var:65/81 constraints:135/448
#Model   0.11s var:64/81 constraints:122/448
#Bound   0.10s best:444   next:[409,443]  objective_lb_search_no_lp [skipped_logs=4]

Task timing                                  n [     min,      max]      avg      dev     time         n [     min,      max]      avg      dev    dtime
                             'core':         1 [ 55.26ms,  55.26ms]  55.26ms   0.00ns  55.26ms         1 [  2.00ms,   2.00ms]   2.00ms   0.00ns   2.00ms
                       'default_lp':         1 [ 56.17ms,  56.17ms]  56.17ms   0.00ns  56.17ms         1 [671.18us, 671.18us] 671.18us   0.00ns 671.18us
                 'feasibility_pump':         6 [  3.48ms,  11.25ms]   5.38ms   2.72ms  32.27ms         5 [585.84us, 602.72us] 596.28us   5.70us   2.98ms
                            'fixed':         1 [ 55.47ms,  55.47ms]  55.47ms   0.00ns  55.47ms         1 [665.64us, 665.64us] 665.64us   0.00ns 665.64us
                  'fj_long_default':         0 [  0.00ns,   0.00ns]   0.00ns   0.00ns   0.00ns         0 [  0.00ns,   0.00ns]   0.00ns   0.00ns   0.00ns
                  'fj_long_default':         0 [  0.00ns,   0.00ns]   0.00ns   0.00ns   0.00ns         0 [  0.00ns,   0.00ns]   0.00ns   0.00ns   0.00ns
              'fj_long_lin_default':         0 [  0.00ns,   0.00ns]   0.00ns   0.00ns   0.00ns         0 [  0.00ns,   0.00ns]   0.00ns   0.00ns   0.00ns
              'fj_long_lin_perturb':         0 [  0.00ns,   0.00ns]   0.00ns   0.00ns   0.00ns         0 [  0.00ns,   0.00ns]   0.00ns   0.00ns   0.00ns
               'fj_long_lin_random':         0 [  0.00ns,   0.00ns]   0.00ns   0.00ns   0.00ns         0 [  0.00ns,   0.00ns]   0.00ns   0.00ns   0.00ns
                  'fj_long_perturb':         0 [  0.00ns,   0.00ns]   0.00ns   0.00ns   0.00ns         0 [  0.00ns,   0.00ns]   0.00ns   0.00ns   0.00ns
                   'fj_long_random':         0 [  0.00ns,   0.00ns]   0.00ns   0.00ns   0.00ns         0 [  0.00ns,   0.00ns]   0.00ns   0.00ns   0.00ns
                 'fj_short_default':         0 [  0.00ns,   0.00ns]   0.00ns   0.00ns   0.00ns         0 [  0.00ns,   0.00ns]   0.00ns   0.00ns   0.00ns
                 'fj_short_default':         0 [  0.00ns,   0.00ns]   0.00ns   0.00ns   0.00ns         0 [  0.00ns,   0.00ns]   0.00ns   0.00ns   0.00ns
             'fj_short_lin_default':         0 [  0.00ns,   0.00ns]   0.00ns   0.00ns   0.00ns         0 [  0.00ns,   0.00ns]   0.00ns   0.00ns   0.00ns
             'fj_short_lin_default':         0 [  0.00ns,   0.00ns]   0.00ns   0.00ns   0.00ns         0 [  0.00ns,   0.00ns]   0.00ns   0.00ns   0.00ns
             'fj_short_lin_perturb':         0 [  0.00ns,   0.00ns]   0.00ns   0.00ns   0.00ns         0 [  0.00ns,   0.00ns]   0.00ns   0.00ns   0.00ns
              'fj_short_lin_random':         0 [  0.00ns,   0.00ns]   0.00ns   0.00ns   0.00ns         0 [  0.00ns,   0.00ns]   0.00ns   0.00ns   0.00ns
                 'fj_short_perturb':         0 [  0.00ns,   0.00ns]   0.00ns   0.00ns   0.00ns         0 [  0.00ns,   0.00ns]   0.00ns   0.00ns   0.00ns
                  'fj_short_random':         0 [  0.00ns,   0.00ns]   0.00ns   0.00ns   0.00ns         0 [  0.00ns,   0.00ns]   0.00ns   0.00ns   0.00ns
                        'fs_random':         0 [  0.00ns,   0.00ns]   0.00ns   0.00ns   0.00ns         0 [  0.00ns,   0.00ns]   0.00ns   0.00ns   0.00ns
                        'fs_random':         1 [  3.33ms,   3.33ms]   3.33ms   0.00ns   3.33ms         0 [  0.00ns,   0.00ns]   0.00ns   0.00ns   0.00ns
                        'fs_random':         1 [  3.64ms,   3.64ms]   3.64ms   0.00ns   3.64ms         0 [  0.00ns,   0.00ns]   0.00ns   0.00ns   0.00ns
                        'fs_random':         1 [  4.66ms,   4.66ms]   4.66ms   0.00ns   4.66ms         0 [  0.00ns,   0.00ns]   0.00ns   0.00ns   0.00ns
                  'fs_random_no_lp':         1 [  3.52ms,   3.52ms]   3.52ms   0.00ns   3.52ms         0 [  0.00ns,   0.00ns]   0.00ns   0.00ns   0.00ns
                  'fs_random_no_lp':         1 [  3.87ms,   3.87ms]   3.87ms   0.00ns   3.87ms         0 [  0.00ns,   0.00ns]   0.00ns   0.00ns   0.00ns
                  'fs_random_no_lp':         1 [  4.28ms,   4.28ms]   4.28ms   0.00ns   4.28ms         0 [  0.00ns,   0.00ns]   0.00ns   0.00ns   0.00ns
          'fs_random_quick_restart':         0 [  0.00ns,   0.00ns]   0.00ns   0.00ns   0.00ns         0 [  0.00ns,   0.00ns]   0.00ns   0.00ns   0.00ns
          'fs_random_quick_restart':         1 [  4.67ms,   4.67ms]   4.67ms   0.00ns   4.67ms         0 [  0.00ns,   0.00ns]   0.00ns   0.00ns   0.00ns
          'fs_random_quick_restart':         1 [  4.70ms,   4.70ms]   4.70ms   0.00ns   4.70ms         0 [  0.00ns,   0.00ns]   0.00ns   0.00ns   0.00ns
          'fs_random_quick_restart':         1 [  4.73ms,   4.73ms]   4.73ms   0.00ns   4.73ms         1 [ 20.00ns,  20.00ns]  20.00ns   0.00ns  20.00ns
    'fs_random_quick_restart_no_lp':         1 [  3.45ms,   3.45ms]   3.45ms   0.00ns   3.45ms         0 [  0.00ns,   0.00ns]   0.00ns   0.00ns   0.00ns
    'fs_random_quick_restart_no_lp':         1 [  3.66ms,   3.66ms]   3.66ms   0.00ns   3.66ms         0 [  0.00ns,   0.00ns]   0.00ns   0.00ns   0.00ns
    'fs_random_quick_restart_no_lp':         1 [  4.30ms,   4.30ms]   4.30ms   0.00ns   4.30ms         0 [  0.00ns,   0.00ns]   0.00ns   0.00ns   0.00ns
                    'graph_arc_lns':         6 [  3.04ms,  33.96ms]  16.17ms  11.51ms  97.01ms         3 [ 10.00ns,  10.18us]   6.43us   4.56us  19.28us
                    'graph_cst_lns':         6 [466.37us,  24.28ms]   4.51ms   8.84ms  27.08ms         0 [  0.00ns,   0.00ns]   0.00ns   0.00ns   0.00ns
                    'graph_dec_lns':         6 [  1.67ms,  21.32ms]   6.55ms   6.83ms  39.29ms         5 [ 10.00ns,  68.40us]  13.69us  27.35us  68.45us
                    'graph_var_lns':         6 [  1.74ms,  11.53ms]   5.09ms   3.26ms  30.54ms         5 [ 10.00ns,  16.15us]   4.85us   6.13us  24.25us
                   'lb_tree_search':         1 [ 54.84ms,  54.84ms]  54.84ms   0.00ns  54.84ms         1 [ 34.13us,  34.13us]  34.13us   0.00ns  34.13us
                           'max_lp':         1 [ 55.40ms,  55.40ms]  55.40ms   0.00ns  55.40ms         1 [948.87us, 948.87us] 948.87us   0.00ns 948.87us
                            'no_lp':         1 [ 54.21ms,  54.21ms]  54.21ms   0.00ns  54.21ms         1 [  5.66ms,   5.66ms]   5.66ms   0.00ns   5.66ms
              'objective_lb_search':         1 [ 53.79ms,  53.79ms]  53.79ms   0.00ns  53.79ms         1 [521.19us, 521.19us] 521.19us   0.00ns 521.19us
       'objective_lb_search_max_lp':         1 [ 53.60ms,  53.60ms]  53.60ms   0.00ns  53.60ms         1 [293.92us, 293.92us] 293.92us   0.00ns 293.92us
        'objective_lb_search_no_lp':         1 [ 52.86ms,  52.86ms]  52.86ms   0.00ns  52.86ms         1 [  5.20ms,   5.20ms]   5.20ms   0.00ns   5.20ms
  'objective_shaving_search_max_lp':         3 [984.49us,  37.80ms]  14.75ms  16.40ms  44.24ms         0 [  0.00ns,   0.00ns]   0.00ns   0.00ns   0.00ns
   'objective_shaving_search_no_lp':         5 [  1.69ms,  23.66ms]   7.43ms   8.27ms  37.14ms         0 [  0.00ns,   0.00ns]   0.00ns   0.00ns   0.00ns
                          'probing':         1 [ 54.48ms,  54.48ms]  54.48ms   0.00ns  54.48ms         1 [700.40us, 700.40us] 700.40us   0.00ns 700.40us
                   'probing_max_lp':         1 [ 53.65ms,  53.65ms]  53.65ms   0.00ns  53.65ms         1 [825.53us, 825.53us] 825.53us   0.00ns 825.53us
                     'pseudo_costs':         1 [ 54.76ms,  54.76ms]  54.76ms   0.00ns  54.76ms         1 [693.64us, 693.64us] 693.64us   0.00ns 693.64us
                    'quick_restart':         1 [ 54.79ms,  54.79ms]  54.79ms   0.00ns  54.79ms         1 [841.00us, 841.00us] 841.00us   0.00ns 841.00us
              'quick_restart_no_lp':         1 [ 54.89ms,  54.89ms]  54.89ms   0.00ns  54.89ms         1 [  6.56ms,   6.56ms]   6.56ms   0.00ns   6.56ms
                    'reduced_costs':         1 [ 54.95ms,  54.95ms]  54.95ms   0.00ns  54.95ms         1 [317.01us, 317.01us] 317.01us   0.00ns 317.01us
                        'rins/rens':         6 [ 11.05ms,  33.84ms]  23.10ms   8.27ms 138.60ms         4 [ 14.98us, 808.29us] 270.60us 313.95us   1.08ms
                      'rnd_cst_lns':         6 [518.30us,  36.90ms]  13.90ms  13.19ms  83.37ms         2 [ 10.00ns,   4.78us]   2.40us   2.39us   4.79us
                      'rnd_var_lns':         6 [  1.34ms,  24.24ms]   9.66ms   8.30ms  57.98ms         5 [ 10.00ns, 491.89us] 115.24us 191.13us 576.20us
         'scheduling_intervals_lns':         6 [  4.32ms,  43.78ms]  29.34ms  13.42ms 176.07ms         1 [504.16us, 504.16us] 504.16us   0.00ns 504.16us
       'scheduling_precedences_lns':         5 [ 18.68ms,  36.83ms]  31.01ms   6.52ms 155.07ms         2 [784.03us, 793.67us] 788.85us   4.82us   1.58ms
       'scheduling_time_window_lns':         6 [822.58us,  38.72ms]  26.17ms  13.21ms 157.02ms         3 [198.84us, 395.55us] 323.57us  88.54us 970.71us
                     'violation_ls':         1 [ 45.94ms,  45.94ms]  45.94ms   0.00ns  45.94ms         1 [ 24.33ms,  24.33ms]  24.33ms   0.00ns  24.33ms
                     'violation_ls':         1 [ 46.12ms,  46.12ms]  46.12ms   0.00ns  46.12ms         1 [ 27.71ms,  27.71ms]  27.71ms   0.00ns  27.71ms
                     'violation_ls':         1 [ 46.21ms,  46.21ms]  46.21ms   0.00ns  46.21ms         1 [ 28.10ms,  28.10ms]  28.10ms   0.00ns  28.10ms
                     'violation_ls':         1 [ 46.38ms,  46.38ms]  46.38ms   0.00ns  46.38ms         1 [ 28.05ms,  28.05ms]  28.05ms   0.00ns  28.05ms

Search stats                        Bools  Conflicts  Branches  Restarts  BoolPropag  IntegerPropag
                           'core':    417         92       339       249       6'469         11'461
                     'default_lp':     37          0        74        74          59            599
                          'fixed':     37          0        74        74          40            529
                      'fs_random':      0          0         0         0           0              0
                      'fs_random':     37          0         0         0           0              0
                      'fs_random':     37          0         0         0           0              0
                      'fs_random':     37          0         0         0           0              0
                'fs_random_no_lp':     37          0         0         0           0              0
                'fs_random_no_lp':     37          0         0         0           0              0
                'fs_random_no_lp':     37          0         0         0           0              0
        'fs_random_quick_restart':      0          0         0         0           0              0
        'fs_random_quick_restart':     37          0         0         0           0              0
        'fs_random_quick_restart':     37          0         0         0           0              0
        'fs_random_quick_restart':     37          0         0         0           0              0
  'fs_random_quick_restart_no_lp':     37          0         0         0           0              0
  'fs_random_quick_restart_no_lp':     37          0         0         0           0              0
  'fs_random_quick_restart_no_lp':     37          0         0         0           0              0
                 'lb_tree_search':     52          1       104       104          41            624
                         'max_lp':     37          0        74        74          40            508
                          'no_lp':    100        109       962       333       4'738         32'356
            'objective_lb_search':     37          0        74        74          59            626
     'objective_lb_search_max_lp':     52          1       104       104          41            624
      'objective_lb_search_no_lp':     55        157       745       383       2'598         29'434
                        'probing':     54          1       108       108          69            698
                 'probing_max_lp':     52          1       104       104          41            625
                   'pseudo_costs':     37          0        74        74          40            508
                  'quick_restart':     37          0        74        74          59            626
            'quick_restart_no_lp':    125        113     1'036       351      10'343         33'726
                  'reduced_costs':     52          1       104       104          41            624

SAT stats                           ClassicMinim  LitRemoved  LitLearned  LitForgotten  Subsumed  MClauses  MDecisions  MLitTrue  MSubsumed  MLitRemoved  MReused
                           'core':             0           0           2             0         0         8          38         0          0            0        2
                     'default_lp':             0           0           0             0         0         0           0         0          0            0        0
                          'fixed':             0           0           0             0         0         0           0         0          0            0        0
                      'fs_random':             0           0           0             0         0         0           0         0          0            0        0
                      'fs_random':             0           0           0             0         0         0           0         0          0            0        0
                      'fs_random':             0           0           0             0         0         0           0         0          0            0        0
                      'fs_random':             0           0           0             0         0         0           0         0          0            0        0
                'fs_random_no_lp':             0           0           0             0         0         0           0         0          0            0        0
                'fs_random_no_lp':             0           0           0             0         0         0           0         0          0            0        0
                'fs_random_no_lp':             0           0           0             0         0         0           0         0          0            0        0
        'fs_random_quick_restart':             0           0           0             0         0         0           0         0          0            0        0
        'fs_random_quick_restart':             0           0           0             0         0         0           0         0          0            0        0
        'fs_random_quick_restart':             0           0           0             0         0         0           0         0          0            0        0
        'fs_random_quick_restart':             0           0           0             0         0         0           0         0          0            0        0
  'fs_random_quick_restart_no_lp':             0           0           0             0         0         0           0         0          0            0        0
  'fs_random_quick_restart_no_lp':             0           0           0             0         0         0           0         0          0            0        0
  'fs_random_quick_restart_no_lp':             0           0           0             0         0         0           0         0          0            0        0
                 'lb_tree_search':             0           0           1             0         0         0           0         0          0            0        0
                         'max_lp':             0           0           0             0         0         0           0         0          0            0        0
                          'no_lp':            33          71         509             0        18        53         257         0         13           66        9
            'objective_lb_search':             0           0           0             0         0         0           0         0          0            0        0
     'objective_lb_search_max_lp':             0           0           1             0         0         0           0         0          0            0        0
      'objective_lb_search_no_lp':            79         162         474             0        18        33         155         0          1            3        8
                        'probing':             0           0           1             0         0         0           0         0          0            0        0
                 'probing_max_lp':             0           0           1             0         0         0           0         0          0            0        0
                   'pseudo_costs':             0           0           0             0         0         0           0         0          0            0        0
                  'quick_restart':             0           0           0             0         0         0           0         0          0            0        0
            'quick_restart_no_lp':            42          77         550             0        12        85         415         0         53          300        5
                  'reduced_costs':             0           0           1             0         0         0           0         0          0            0        0

Lp stats                         Component  Iterations  AddedCuts  OPTIMAL  DUAL_F.  DUAL_U.
                  'default_lp':          1         112        305       11        0        0
                       'fixed':          1         115        334       13        0        0
                   'fs_random':          1           0          0        0        0        0
                   'fs_random':          1           0          0        0        0        0
                   'fs_random':          1           0          0        0        0        0
     'fs_random_quick_restart':          1           0          0        0        0        0
     'fs_random_quick_restart':          1           0          0        0        0        0
     'fs_random_quick_restart':          1           0          0        0        0        0
              'lb_tree_search':          1          66        221        3        0        0
                      'max_lp':          1          92        267        5        0        0
         'objective_lb_search':          1          99        287       11        0        0
  'objective_lb_search_max_lp':          1          69        294        7        0        0
                     'probing':          1         126        282       13        0        0
              'probing_max_lp':          1          91        328        5        0        0
                'pseudo_costs':          1         106        297        7        1        0
               'quick_restart':          1         125        300       12        0        0
               'reduced_costs':          1          70        276        7        1        0

Lp dimension                                                                    Final dimension of first component
                  'default_lp':   167 rows, 80 columns, 649 entries with magnitude in [3.378798e-03, 1.000000e+00]
                       'fixed':   168 rows, 80 columns, 655 entries with magnitude in [1.951710e-03, 1.000000e+00]
                   'fs_random':       0 rows, 80 columns, 0 entries with magnitude in [0.000000e+00, 0.000000e+00]
                   'fs_random':       0 rows, 80 columns, 0 entries with magnitude in [0.000000e+00, 0.000000e+00]
                   'fs_random':       0 rows, 80 columns, 0 entries with magnitude in [0.000000e+00, 0.000000e+00]
     'fs_random_quick_restart':       0 rows, 80 columns, 0 entries with magnitude in [0.000000e+00, 0.000000e+00]
     'fs_random_quick_restart':       0 rows, 80 columns, 0 entries with magnitude in [0.000000e+00, 0.000000e+00]
     'fs_random_quick_restart':       0 rows, 80 columns, 0 entries with magnitude in [0.000000e+00, 0.000000e+00]
              'lb_tree_search':  483 rows, 81 columns, 3151 entries with magnitude in [6.158351e-03, 1.000000e+00]
                      'max_lp':  524 rows, 81 columns, 3307 entries with magnitude in [6.158351e-03, 1.000000e+00]
         'objective_lb_search':   167 rows, 80 columns, 655 entries with magnitude in [1.964425e-03, 1.000000e+00]
  'objective_lb_search_max_lp':   162 rows, 81 columns, 640 entries with magnitude in [1.494703e-03, 1.000000e+00]
                     'probing':   145 rows, 80 columns, 539 entries with magnitude in [4.777710e-03, 1.000000e+00]
              'probing_max_lp':  523 rows, 81 columns, 3293 entries with magnitude in [6.158351e-03, 1.000000e+00]
                'pseudo_costs':   163 rows, 81 columns, 647 entries with magnitude in [1.494703e-03, 1.000000e+00]
               'quick_restart':   177 rows, 80 columns, 738 entries with magnitude in [2.153011e-03, 1.000000e+00]
               'reduced_costs':   164 rows, 81 columns, 631 entries with magnitude in [1.420314e-03, 1.000000e+00]

Lp debug                         CutPropag  CutEqPropag  Adjust  Overflow  Bad  BadScaling
                  'default_lp':          0            0       2         0  208           0
                       'fixed':          0            0       4         0  334           0
                   'fs_random':          0            0       0         0    0           0
                   'fs_random':          0            0       0         0    0           0
                   'fs_random':          0            0       0         0    0           0
     'fs_random_quick_restart':          0            0       0         0    0           0
     'fs_random_quick_restart':          0            0       0         0    0           0
     'fs_random_quick_restart':          0            0       0         0    0           0
              'lb_tree_search':          0            0       2         0   37           0
                      'max_lp':          0            0       4         0   62           0
         'objective_lb_search':          0            0       2         0  194           0
  'objective_lb_search_max_lp':          0            0       2         0  125           0
                     'probing':          0            0       2         0  178           0
              'probing_max_lp':          0            0       4         0  116           0
                'pseudo_costs':          0            0       3         0  123           0
               'quick_restart':          0            0       1         0  207           0
               'reduced_costs':          0            0       3         0  113           0

Lp pool                          Constraints  Updates  Simplif  Merged  Shortened  Split  Strenghtened  Cuts/Call
                  'default_lp':          403        9        8       0          0      7            42    305/535
                       'fixed':          430       22       17       2          0      8            41    334/634
                   'fs_random':           98        0        0       0          0      0             0        0/0
                   'fs_random':           98        0        0       0          0      0             0        0/0
                   'fs_random':           98        0        0       0          0      0             0        0/0
     'fs_random_quick_restart':           98        0        0       0          0      0             0        0/0
     'fs_random_quick_restart':           98        0        0       0          0      0             0        0/0
     'fs_random_quick_restart':           98        0        0       0          0      0             0        0/0
              'lb_tree_search':          662        1        0       0          0      1            38    221/376
                      'max_lp':          708        2        0       0          0      3            53    267/477
         'objective_lb_search':          385        8        8       0          0      7            20    287/510
  'objective_lb_search_max_lp':          735        0        0       0          0      0            22    294/484
                     'probing':          380        3        0       0          0      6            10    282/485
              'probing_max_lp':          769        4        0       0          0      4            67    328/574
                'pseudo_costs':          738        0        0       0          0      0            26    297/488
               'quick_restart':          398        8        8       0          0      7            35    300/511
               'reduced_costs':          717        0        0       0          0      0            19    276/461

Lp Cut                                                defaul  fixed  max_lp  quick_  reduce  pseudo  lb_tre  probin  object  probin  object
                                              CG_FF:      14     15      19      14      24      23      11      18      15      27      23
                                               CG_K:       6      6      12       6      15      14       6       6       6      17      14
                                               CG_R:       6      6       9       6       8       8       6       7       6      12       8
                                              CG_RB:      67     85      13      59      38      49       9      48      65      23      49
                                             CG_RBP:      20     11       1       8       5       9       1       6      11       2       9
                                                 IB:      94     96      67      94      85      85      66      94      94      66      85
                                           MIR_1_FF:      24     29      28      26      27      27      23      23      23      32      28
                                            MIR_1_K:       -      -       7       -       1       1       7       1       -       9       1
                                            MIR_1_R:       -      1       2       -       1       1       2       -       -       2       1
                                           MIR_1_RB:      18     21      20      21      15      18      13      20      17      26      19
                                          MIR_1_RBP:       1      -       8       1       3       3       7       1       -      10       3
                                          MIR_1_RLT:       -      -       1       -       3       4       -       -       -       -       4
                                           MIR_2_FF:       4      9       7       6       5       6       9       4       6      11       2
                                            MIR_2_K:       -      -       2       -       -       -       2       -       -       3       1
                                            MIR_2_R:       -      -       1       1       2       2       3       -       1       2       -
                                           MIR_2_RB:       6     15       5       7       6       7       4       5       8      10       4
                                          MIR_2_RBP:       -      -       4       -       2       3       4       -       -       3       1
                                           MIR_3_FF:       1      -       4       -       1       2       3       1       1       8       3
                                            MIR_3_K:       1      -       1       -       -       -       1       -       -       2       -
                                            MIR_3_R:       -      2       1       -       -       1       -       4       1       3       1
                                           MIR_3_RB:       1      1       1       3       2       -       -       7       1       3       -
                                          MIR_3_RBP:       -      1       2       2       1       2       1       -       -       4       2
                                           MIR_4_FF:       -      2       2       1       2       2       2       1       1       2       2
                                            MIR_4_K:       -      -       1       -       -       -       -       -       -       -       -
                                            MIR_4_R:       1      -       -       2       2       2       1       1       1       -       2
                                           MIR_4_RB:       1      -       -       3       1       1       -       4       -       2       1
                                          MIR_4_RBP:       1      -       -       1       2       1       1       1       -       -       1
                                           MIR_5_FF:       1      -       1       -       -       -       2       -       -       2       1
                                            MIR_5_K:       -      -       1       -       -       -       1       -       -       3       -
                                            MIR_5_R:       2      1       -       -       -       -       -       1       -       2       1
                                           MIR_5_RB:       1      2       2       1       -       -       2       1       -       2       1
                                          MIR_5_RBP:       -      -       -       -       -       -       -       -       -       2       -
                                           MIR_6_FF:       -      -       1       -       -       -       -       -       -       1       -
                                            MIR_6_K:       -      -       1       -       -       -       -       -       -       -       -
                                            MIR_6_R:       -      1       1       -       -       -       -       -       -       -       -
                                           MIR_6_RB:       -      -       1       -       -       -       -       -       -       1       -
                                          MIR_6_RBP:       -      -       1       -       -       -       -       -       -       -       -
         NoOverlapCompletionTimeExhaustive_weighted:       -      -       4       -       6       6       4       -       -       4       6
  NoOverlapCompletionTimeExhaustive_weighted_lifted:       -      -       1       -       1       1       1       -       -       1       1
                        NoOverlapDisjunctionOnStart:       -      -       4       -       6       6       4       -       -       4       6
                                       ZERO_HALF_FF:       6      5       8       6       3       2       6       5       5       7       3
                                        ZERO_HALF_K:       -      -       5       -       -       -       4       -       -       4       -
                                        ZERO_HALF_R:      16     12       8      17       5       5       5      11      12       8       5
                                       ZERO_HALF_RB:       9     11       6      13       4       4       6      11      11       5       5
                                      ZERO_HALF_RBP:       4      2       4       2       -       2       4       1       2       3       1

LNS stats                        Improv/Calls  Closed  Difficulty  TimeLimit
               'graph_arc_lns':           1/3    100%        0.88       0.10
               'graph_cst_lns':           0/0      0%        0.50       0.10
               'graph_dec_lns':           2/5    100%        0.94       0.10
               'graph_var_lns':           1/5    100%        0.94       0.10
                   'rins/rens':           1/5     60%        0.75       0.10
                 'rnd_cst_lns':           0/2    100%        0.81       0.10
                 'rnd_var_lns':           3/5    100%        0.94       0.10
    'scheduling_intervals_lns':           1/2      0%        0.19       0.10
  'scheduling_precedences_lns':           1/2    100%        0.81       0.10
  'scheduling_time_window_lns':           3/4    100%        0.91       0.10

LS stats                   Batches  Restarts  LinMoves  GenMoves  CompoundMoves  WeightUpdates
       'fj_long_default':        0         0         0         0              0              0
       'fj_long_default':        0         0         0         0              0              0
   'fj_long_lin_default':        0         0         0         0              0              0
   'fj_long_lin_perturb':        0         0         0         0              0              0
    'fj_long_lin_random':        0         0         0         0              0              0
       'fj_long_perturb':        0         0         0         0              0              0
        'fj_long_random':        0         0         0         0              0              0
      'fj_short_default':        0         0         0         0              0              0
      'fj_short_default':        0         0         0         0              0              0
  'fj_short_lin_default':        0         0         0         0              0              0
  'fj_short_lin_default':        0         0         0         0              0              0
  'fj_short_lin_perturb':        0         0         0         0              0              0
   'fj_short_lin_random':        0         0         0         0              0              0
      'fj_short_perturb':        0         0         0         0              0              0
       'fj_short_random':        0         0         0         0              0              0
          'violation_ls':        1         0         0     3'559             65             25
          'violation_ls':        1         0         0     3'564             56             27
          'violation_ls':        1         0         0     3'628             74             25
          'violation_ls':        1         0     4'609         0              0            510

Solutions (12)            Num    Rank
        'graph_dec_lns':    2  [8,10]
        'graph_var_lns':    1   [9,9]
                'no_lp':    8  [1,12]
  'quick_restart_no_lp':    1   [7,7]

Objective bounds                Num
                  'bool_core':    7
             'initial_domain':    1
  'objective_lb_search_no_lp':   17
        'quick_restart_no_lp':    1

Solution repositories    Added  Queried  Ignored  Synchro
  'feasible solutions':     35      126        2       31
        'lp solutions':      0        0        0        0
                'pump':     35        6

Improving bounds shared         Num
                       'core':    2
                      'fixed':    6
                      'no_lp':  115
  'objective_lb_search_no_lp':  112
              'quick_restart':   20
        'quick_restart_no_lp':   11

Clauses shared                  Num
                      'no_lp':    6
  'objective_lb_search_no_lp':   14
        'quick_restart_no_lp':    2

CpSolverResponse summary:
status: OPTIMAL
objective: 444
best_bound: 444
integers: 0
booleans: 0
conflicts: 0
branches: 0
propagations: 0
integer_propagations: 0
restarts: 0
lp_iterations: 0
walltime: 0.113684
usertime: 0.113684
deterministic_time: 0.143174
gap_integral: 0.0659672
solution_fingerprint: 0x313704e4045d0199


--- Simulation Gantt  partir du modle mathmatique ---
{'big':0, 'due_date':165, 'pos_time':5, 'status':3, 'blocked':0, 'operations':["{'type':1, 'processing_time':52}", "{'type':0, 'processing_time':18}"]}
{'big':1, 'due_date':68, 'pos_time':5, 'status':3, 'blocked':2, 'operations':["{'type':0, 'processing_time':50}"]}
{'big':1, 'due_date':101, 'pos_time':5, 'status':0, 'blocked':0, 'operations':["{'type':1, 'processing_time':36}", "{'type':0, 'processing_time':18}"]}
{'big':1, 'due_date':81, 'pos_time':5, 'status':3, 'blocked':0, 'operations':["{'type':0, 'processing_time':13}"]}
{'big':1, 'due_date':78, 'pos_time':5, 'status':3, 'blocked':0, 'operations':["{'type':1, 'processing_time':60}"]}
