created virtual environment CPython3.12.4.final.0-64 in 2457ms
  creator CPython3Posix(dest=/localscratch/aneumann.47038274.0/env, clear=False, no_vcs_ignore=False, global=False)
  seeder FromAppData(download=False, pip=bundle, via=copy, app_data_dir=/home/aneumann/.local/share/virtualenv)
    added seed packages: pip==24.2+computecanada
  activators BashActivator,CShellActivator,FishActivator,NushellActivator,PowerShellActivator,PythonActivator
Looking in links: /cvmfs/soft.computecanada.ca/custom/python/wheelhouse/gentoo2023/x86-64-v3, /cvmfs/soft.computecanada.ca/custom/python/wheelhouse/gentoo2023/generic, /cvmfs/soft.computecanada.ca/custom/python/wheelhouse/generic
Requirement already satisfied: pip in /localscratch/aneumann.47038274.0/env/lib/python3.12/site-packages (24.2+computecanada)
Processing /cvmfs/soft.computecanada.ca/custom/python/wheelhouse/generic/pip-25.0+computecanada-py3-none-any.whl
Installing collected packages: pip
  Attempting uninstall: pip
    Found existing installation: pip 24.2+computecanada
    Uninstalling pip-24.2+computecanada:
      Successfully uninstalled pip-24.2+computecanada
Successfully installed pip-24.2+computecanada
Looking in links: /cvmfs/soft.computecanada.ca/custom/python/wheelhouse/gentoo2023/x86-64-v3, /cvmfs/soft.computecanada.ca/custom/python/wheelhouse/gentoo2023/generic, /cvmfs/soft.computecanada.ca/custom/python/wheelhouse/generic
ERROR: protobuf-5.28.3-cp38-abi3-manylinux2014_x86_64.whl is not a supported wheel on this platform.
Looking in links: /cvmfs/soft.computecanada.ca/custom/python/wheelhouse/gentoo2023/x86-64-v3, /cvmfs/soft.computecanada.ca/custom/python/wheelhouse/gentoo2023/generic, /cvmfs/soft.computecanada.ca/custom/python/wheelhouse/generic
Processing /home/aneumann/projects/def-adhaj/aneumann/GNRS/wheels/immutabledict-4.2.0-py3-none-any.whl
Installing collected packages: immutabledict
Successfully installed immutabledict-4.2.0
Looking in links: /cvmfs/soft.computecanada.ca/custom/python/wheelhouse/gentoo2023/x86-64-v3, /cvmfs/soft.computecanada.ca/custom/python/wheelhouse/gentoo2023/generic, /cvmfs/soft.computecanada.ca/custom/python/wheelhouse/generic
Processing /cvmfs/soft.computecanada.ca/custom/python/wheelhouse/generic/ortools-9.10.4067+computecanada-cp312-cp312-linux_x86_64.whl (from -r /home/aneumann/projects/def-adhaj/aneumann/GNRS/requirements/or.txt (line 1))
Processing /cvmfs/soft.computecanada.ca/custom/python/wheelhouse/gentoo2023/x86-64-v3/matplotlib-3.10.0+computecanada-cp312-cp312-linux_x86_64.whl (from -r /home/aneumann/projects/def-adhaj/aneumann/GNRS/requirements/or.txt (line 2))
Processing /cvmfs/soft.computecanada.ca/custom/python/wheelhouse/gentoo2023/x86-64-v3/pandas-2.2.3+computecanada-cp312-cp312-linux_x86_64.whl (from -r /home/aneumann/projects/def-adhaj/aneumann/GNRS/requirements/or.txt (line 3))
Processing /cvmfs/soft.computecanada.ca/custom/python/wheelhouse/generic/absl_py-2.3.0+computecanada-py3-none-any.whl (from ortools<9.11,>=9.10->-r /home/aneumann/projects/def-adhaj/aneumann/GNRS/requirements/or.txt (line 1))
Processing /cvmfs/soft.computecanada.ca/custom/python/wheelhouse/gentoo2023/generic/numpy-2.2.2+computecanada-cp312-cp312-linux_x86_64.whl (from ortools<9.11,>=9.10->-r /home/aneumann/projects/def-adhaj/aneumann/GNRS/requirements/or.txt (line 1))
Processing /cvmfs/soft.computecanada.ca/custom/python/wheelhouse/gentoo2023/x86-64-v3/protobuf-6.31.1+computecanada-cp312-cp312-linux_x86_64.whl (from ortools<9.11,>=9.10->-r /home/aneumann/projects/def-adhaj/aneumann/GNRS/requirements/or.txt (line 1))
Requirement already satisfied: immutabledict>=3.0.0 in /localscratch/aneumann.47038274.0/env/lib/python3.12/site-packages (from ortools<9.11,>=9.10->-r /home/aneumann/projects/def-adhaj/aneumann/GNRS/requirements/or.txt (line 1)) (4.2.0)
Processing /cvmfs/soft.computecanada.ca/custom/python/wheelhouse/gentoo2023/generic/contourpy-1.3.1+computecanada-cp312-cp312-linux_x86_64.whl (from matplotlib->-r /home/aneumann/projects/def-adhaj/aneumann/GNRS/requirements/or.txt (line 2))
Processing /cvmfs/soft.computecanada.ca/custom/python/wheelhouse/generic/cycler-0.12.1+computecanada-py3-none-any.whl (from matplotlib->-r /home/aneumann/projects/def-adhaj/aneumann/GNRS/requirements/or.txt (line 2))
Processing /cvmfs/soft.computecanada.ca/custom/python/wheelhouse/generic/fonttools-4.59.0+computecanada-cp312-cp312-linux_x86_64.whl (from matplotlib->-r /home/aneumann/projects/def-adhaj/aneumann/GNRS/requirements/or.txt (line 2))
Processing /cvmfs/soft.computecanada.ca/custom/python/wheelhouse/gentoo2023/x86-64-v3/kiwisolver-1.4.8+computecanada-cp312-cp312-linux_x86_64.whl (from matplotlib->-r /home/aneumann/projects/def-adhaj/aneumann/GNRS/requirements/or.txt (line 2))
Processing /cvmfs/soft.computecanada.ca/custom/python/wheelhouse/generic/packaging-25.0+computecanada-py3-none-any.whl (from matplotlib->-r /home/aneumann/projects/def-adhaj/aneumann/GNRS/requirements/or.txt (line 2))
Processing /cvmfs/soft.computecanada.ca/custom/python/wheelhouse/gentoo2023/x86-64-v3/pillow-11.1.0+computecanada-cp312-cp312-linux_x86_64.whl (from matplotlib->-r /home/aneumann/projects/def-adhaj/aneumann/GNRS/requirements/or.txt (line 2))
Processing /cvmfs/soft.computecanada.ca/custom/python/wheelhouse/generic/pyparsing-3.2.3+computecanada-py3-none-any.whl (from matplotlib->-r /home/aneumann/projects/def-adhaj/aneumann/GNRS/requirements/or.txt (line 2))
Processing /cvmfs/soft.computecanada.ca/custom/python/wheelhouse/generic/python_dateutil-2.9.0.post0+computecanada-py2.py3-none-any.whl (from matplotlib->-r /home/aneumann/projects/def-adhaj/aneumann/GNRS/requirements/or.txt (line 2))
Processing /cvmfs/soft.computecanada.ca/custom/python/wheelhouse/generic/pytz-2025.2+computecanada-py2.py3-none-any.whl (from pandas->-r /home/aneumann/projects/def-adhaj/aneumann/GNRS/requirements/or.txt (line 3))
Processing /cvmfs/soft.computecanada.ca/custom/python/wheelhouse/generic/tzdata-2025.2+computecanada-py2.py3-none-any.whl (from pandas->-r /home/aneumann/projects/def-adhaj/aneumann/GNRS/requirements/or.txt (line 3))
Processing /cvmfs/soft.computecanada.ca/custom/python/wheelhouse/generic/six-1.17.0+computecanada-py2.py3-none-any.whl (from python-dateutil>=2.7->matplotlib->-r /home/aneumann/projects/def-adhaj/aneumann/GNRS/requirements/or.txt (line 2))
Installing collected packages: pytz, tzdata, six, pyparsing, protobuf, pillow, packaging, numpy, kiwisolver, fonttools, cycler, absl-py, python-dateutil, contourpy, pandas, matplotlib, ortools
Successfully installed absl-py-2.3.0+computecanada contourpy-1.3.1+computecanada cycler-0.12.1+computecanada fonttools-4.59.0+computecanada kiwisolver-1.4.8+computecanada matplotlib-3.10.0+computecanada numpy-2.2.2+computecanada ortools-9.10.4067+computecanada packaging-25.0+computecanada pandas-2.2.3+computecanada pillow-11.1.0+computecanada protobuf-6.31.1+computecanada pyparsing-3.2.3+computecanada python-dateutil-2.9.0.post0+computecanada pytz-2025.2+computecanada six-1.17.0+computecanada tzdata-2025.2+computecanada

Starting CP-SAT solver v9.10.4067
Parameters: max_time_in_seconds: 86400 max_memory_in_mb: 185000 log_search_progress: true enumerate_all_solutions: false num_search_workers: 32 absolute_gap_limit: 0 relative_gap_limit: 0

Initial optimization model '': (model_fingerprint: 0xa1bfb83035bbb378)
#Variables: 1'144 (#ints: 19 in objective)
  - 945 Booleans in [0,1]
  - 199 in [0,1547]
#kLinear1: 99
#kLinear2: 2'412
#kLinear3: 990
#kLinearN: 54'180 (#terms: 1'628'733)

Starting presolve at 0.03s
  7.45e-02s  0.00e+00d  [DetectDominanceRelations] 
  1.19e+00s  0.00e+00d  [PresolveToFixPoint] #num_loops=8 #num_dual_strengthening=3 
  6.81e-04s  0.00e+00d  [ExtractEncodingFromLinear] #potential_supersets=13 
[Symmetry] Graph for symmetry has 57'278 nodes and 1'454'083 arcs.
[Symmetry] Symmetry computation done. time: 0.0525422 dtime: 0.10595
[Symmetry] #generators: 1, average support size: 62
[Symmetry] The model contains 1159 duplicate constraints !
[Symmetry] 31 orbits with sizes: 2,2,2,2,2,2,2,2,2,2,...
[Symmetry] Num fixable by intersecting at_most_one with orbits: 1 largest_orbit: 2
  5.84e-01s  1.45e-01d  [Probe] #probed=1'614 #new_bounds=11 #equiv=1 
  5.22e-04s  0.00e+00d  [MaxClique] Merged 17(34 literals) into 12(24 literals) at_most_ones. 
  7.42e-02s  0.00e+00d  [DetectDominanceRelations] 
  5.52e-01s  0.00e+00d  [PresolveToFixPoint] #num_loops=5 #num_dual_strengthening=3 
  3.07e-01s  0.00e+00d  [ProcessAtMostOneAndLinear] 
  7.01e-02s  0.00e+00d  [DetectDuplicateConstraints] #duplicates=1'559 #without_enforcements=182 
  1.80e-01s  1.42e-02d  [DetectDominatedLinearConstraints] #relevant_constraints=51'728 #num_inclusions=26'614 
  7.42e-03s  0.00e+00d  [DetectDifferentVariables] #different=119 #cliques=1 #size=14 
  2.89e-02s  2.59e-03d  [ProcessSetPPC] #relevant_constraints=50'539 
  8.72e-04s  0.00e+00d  [FindAlmostIdenticalLinearConstraints] 
  9.00e-03s  1.26e-02d  [FindBigAtMostOneAndLinearOverlap] 
  4.88e-01s  2.74e-01d  [FindBigVerticalLinearOverlap] #blocks=557 #saved_nz=285'293 
  1.38e-02s  5.51e-03d  [FindBigHorizontalLinearOverlap] #linears=49'328 
  5.27e-04s  0.00e+00d  [MergeClauses] 
  8.21e-02s  0.00e+00d  [DetectDominanceRelations] 
  6.57e-01s  0.00e+00d  [PresolveToFixPoint] #num_loops=3 #num_dual_strengthening=1 
  8.18e-02s  0.00e+00d  [DetectDominanceRelations] 
  4.06e-01s  0.00e+00d  [PresolveToFixPoint] #num_loops=1 #num_dual_strengthening=1 
[Symmetry] Graph for symmetry has 57'415 nodes and 1'163'790 arcs.
[Symmetry] Symmetry computation done. time: 0.027911 dtime: 0.0571407
  5.20e-01s  1.18e-01d  [Probe] #probed=1'616 #new_bounds=364 
  4.26e-04s  0.00e+00d  [MaxClique] 
  8.19e-02s  0.00e+00d  [DetectDominanceRelations] 
  5.84e-01s  0.00e+00d  [PresolveToFixPoint] #num_loops=2 #num_dual_strengthening=1 
  2.90e-01s  0.00e+00d  [ProcessAtMostOneAndLinear] 
  6.41e-02s  0.00e+00d  [DetectDuplicateConstraints] #without_enforcements=182 
  1.33e-01s  1.05e-02d  [DetectDominatedLinearConstraints] #relevant_constraints=51'838 #num_inclusions=5'874 
  6.88e-03s  0.00e+00d  [DetectDifferentVariables] 
  2.62e-02s  2.00e-03d  [ProcessSetPPC] #relevant_constraints=49'357 
  9.28e-04s  4.20e-06d  [FindAlmostIdenticalLinearConstraints] #num_tested_pairs=270 
  4.78e-03s  5.01e-03d  [FindBigAtMostOneAndLinearOverlap] 
  4.63e-01s  2.05e-01d  [FindBigVerticalLinearOverlap] #blocks=2'432 #saved_nz=321'598 
  1.16e-02s  3.73e-03d  [FindBigHorizontalLinearOverlap] #linears=42'147 
  5.24e-04s  0.00e+00d  [MergeClauses] 
  6.10e-02s  0.00e+00d  [DetectDominanceRelations] 
  6.09e-01s  0.00e+00d  [PresolveToFixPoint] #num_loops=3 #num_dual_strengthening=1 
  6.19e-02s  0.00e+00d  [DetectDominanceRelations] 
  3.93e-01s  0.00e+00d  [PresolveToFixPoint] #num_loops=1 #num_dual_strengthening=1 
[Symmetry] Graph for symmetry has 63'913 nodes and 844'040 arcs.
[Symmetry] Symmetry computation done. time: 0.0210219 dtime: 0.0426394
  4.58e-01s  9.23e-02d  [Probe] #probed=1'616 #new_bounds=1'585 
  4.79e-04s  0.00e+00d  [MaxClique] 
  6.13e-02s  0.00e+00d  [DetectDominanceRelations] 
  5.90e-01s  0.00e+00d  [PresolveToFixPoint] #num_loops=2 #num_dual_strengthening=1 
  2.70e-01s  0.00e+00d  [ProcessAtMostOneAndLinear] 
  5.90e-02s  0.00e+00d  [DetectDuplicateConstraints] #without_enforcements=182 
  9.22e-02s  6.98e-03d  [DetectDominatedLinearConstraints] #relevant_constraints=53'169 #num_inclusions=1'474 
  6.93e-03s  0.00e+00d  [DetectDifferentVariables] 
  2.04e-02s  1.32e-03d  [ProcessSetPPC] #relevant_constraints=42'293 
  1.63e-03s  1.33e-04d  [FindAlmostIdenticalLinearConstraints] #num_tested_pairs=8'009 
  4.11e-03s  3.22e-03d  [FindBigAtMostOneAndLinearOverlap] 
  2.96e-01s  1.18e-01d  [FindBigVerticalLinearOverlap] #blocks=2'586 #saved_nz=232'074 
  8.95e-03s  2.35e-03d  [FindBigHorizontalLinearOverlap] #linears=31'520 
  5.41e-04s  0.00e+00d  [MergeClauses] 
  4.73e-02s  0.00e+00d  [DetectDominanceRelations] 
  6.02e-01s  0.00e+00d  [PresolveToFixPoint] #num_loops=3 #num_dual_strengthening=1 
  3.68e-03s  0.00e+00d  [ExpandObjective] #entries=22'681 #tight_variables=8'719 #tight_constraints=4'604 

Presolve summary:
  - 377 affine relations were detected.
  - rule 'TODO dual: only one blocking constraint?' was applied 2'754 times.
  - rule 'TODO dual: only one blocking enforced constraint?' was applied 234 times.
  - rule 'TODO dual: only one unspecified blocking constraint?' was applied 127 times.
  - rule 'TODO duplicate: identical constraint with different enforcements' was applied 546 times.
  - rule 'affine: new relation' was applied 377 times.
  - rule 'at_most_one: removed literals' was applied 12 times.
  - rule 'at_most_one: size one' was applied 12 times.
  - rule 'at_most_one: transformed into max clique.' was applied 1 time.
  - rule 'deductions: 3603 stored' was applied 1 time.
  - rule 'dual: fix variable' was applied 54 times.
  - rule 'dual: reduced domain' was applied 123 times.
  - rule 'duplicate: merged rhs of linear constraint' was applied 355 times.
  - rule 'duplicate: removed constraint' was applied 1'559 times.
  - rule 'enforcement: false literal' was applied 10 times.
  - rule 'exactly_one: x and not(x)' was applied 1 time.
  - rule 'incompatible linear: add implication' was applied 273 times.
  - rule 'linear matrix: common vertical rectangle' was applied 5'575 times.
  - rule 'linear2: contains a Boolean.' was applied 1 time.
  - rule 'linear: always true' was applied 2'811 times.
  - rule 'linear: doubleton free' was applied 27 times.
  - rule 'linear: empty' was applied 64 times.
  - rule 'linear: extracted enforcement literal' was applied 53'504 times.
  - rule 'linear: fixed or dup variables' was applied 54'881 times.
  - rule 'linear: positive equal one' was applied 13 times.
  - rule 'linear: reduced variable domains' was applied 4'708 times.
  - rule 'linear: remapped using affine relations' was applied 55'290 times.
  - rule 'linear: simplified rhs' was applied 173'151 times.
  - rule 'linear: tightened into equality' was applied 12 times.
  - rule 'linear: variable substitution 1' was applied 27 times.
  - rule 'linear: variable substitution 2' was applied 543 times.
  - rule 'linear: variable substitution 3' was applied 354 times.
  - rule 'no_overlap: inferred from x != y constraints' was applied 1 time.
  - rule 'presolve: 192 unused variables removed.' was applied 1 time.
  - rule 'presolve: iteration' was applied 3 times.
  - rule 'probing: reduced enforced constraint to implication.' was applied 17 times.
  - rule 'symmetry: fixed to false in general orbit' was applied 1 time.

Presolved optimization model '': (model_fingerprint: 0xa9c915720a0cda)
#Variables: 5'226 (#ints: 19 in objective)
  - 415 Booleans in [0,1]
  - 3'621 different domains in [-35575,38510] with a largest complexity of 28.
#kExactlyOne: 12 (#literals: 36)
#kInterval: 14
#kLinear1: 1 (#enforced: 1)
#kLinear2: 3'575 (#enforced: 3'459 #multi: 1'072)
#kLinear3: 12'510 (#enforced: 9'016 #multi: 30)
#kLinearN: 41'396 (#enforced: 38'829) (#terms: 510'020)
#kNoOverlap: 1 (#intervals: 14)

Preloading model.
#Bound  10.50s best:inf   next:[211,26494] initial_domain
[Symmetry] Graph for symmetry has 69'062 nodes and 613'726 arcs.
[Symmetry] Symmetry computation done. time: 0.0176257 dtime: 0.0316507
#Model  10.62s var:5226/5226 constraints:57509/57509

Starting search at 10.65s with 32 workers.
17 full problem subsolvers: [core, default_lp, fixed, lb_tree_search, max_lp, no_lp, objective_lb_search, objective_lb_search_max_lp, objective_lb_search_no_lp, objective_shaving_search_max_lp, objective_shaving_search_no_lp, probing, probing_max_lp, pseudo_costs, quick_restart, quick_restart_no_lp, reduced_costs]
13 first solution subsolvers: [fj_long_default, fj_long_lin_default, fj_long_random, fj_short_default, fj_short_lin_default, fj_short_lin_random, fj_short_random, fs_random(2), fs_random_no_lp, fs_random_quick_restart(2), fs_random_quick_restart_no_lp]
13 incomplete subsolvers: [feasibility_pump, graph_arc_lns, graph_cst_lns, graph_dec_lns, graph_var_lns, rins/rens, rnd_cst_lns, rnd_var_lns, scheduling_intervals_lns, scheduling_precedences_lns, scheduling_time_window_lns, violation_ls(2)]
3 helper subsolvers: [neighborhood_helper, synchronization_agent, update_gap_integral]
#Bound  11.92s best:inf   next:[212,26494] objective_shaving_search_no_lp (vars=5226 csts=57513)
#Bound  12.56s best:inf   next:[213,26494] objective_shaving_search_no_lp (vars=5227 csts=57549)
#Bound  12.92s best:inf   next:[310,26494] quick_restart_no_lp (initial_propagation)
#Bound  14.66s best:inf   next:[327,26494] objective_lb_search_no_lp
#1      15.04s best:11175 next:[327,11174] quick_restart_no_lp (fixed_bools=0/505)
#Bound  15.24s best:11175 next:[340,11174] objective_lb_search
#Bound  15.33s best:11175 next:[542,11174] objective_lb_search_max_lp
#2      15.75s best:11174 next:[542,11173] violation_ls(batch:3 #solutions_imported:1 #lin_moves:0 #lin_evals:43'147 #gen_moves:17'021 #gen_evals:2'400 #comp_moves:3'715 #backtracks:6'652 #weight_updates:130)
#Bound  15.90s best:11174 next:[548,11173] objective_lb_search_max_lp
#Bound  15.99s best:11174 next:[1428,11173] objective_lb_search_max_lp
#Bound  16.00s best:11174 next:[1429,11173] reduced_costs
#Bound  16.07s best:11174 next:[2600,11173] objective_lb_search_max_lp
#Bound  16.12s best:11174 next:[2636,11173] reduced_costs
#3      16.20s best:11173 next:[2636,11172] violation_ls(batch:5 #solutions_imported:2 #lin_moves:39'866 #lin_evals:138'980 #weight_updates:453)
#4      16.47s best:11172 next:[2636,11171] quick_restart_no_lp (fixed_bools=0/538)
#5      17.02s best:11145 next:[2636,11144] quick_restart_no_lp (fixed_bools=0/612)
#Bound  17.67s best:11145 next:[2646,11144] max_lp
#6      17.75s best:11144 next:[2646,11143] violation_ls(batch:6 #solutions_imported:3 #lin_moves:1 #lin_evals:78'625 #gen_moves:29'824 #gen_evals:4'154 #comp_moves:7'481 #backtracks:11'167 #weight_updates:210)
#7      17.76s best:11142 next:[2646,11141] violation_ls(batch:6 #solutions_imported:3 #lin_moves:39'866 #lin_evals:138'983 #gen_moves:1 #gen_evals:0 #comp_moves:1 #backtracks:0 #weight_updates:453)
#8      17.95s best:10678 next:[2646,10677] rins_lp_lns (d=0.91 s=176 t=0.10 p=1.00 stall=4 h=auto_l0)
#9      19.05s best:10673 next:[2646,10672] graph_var_lns (d=0.94 s=181 t=0.10 p=1.00 stall=0 h=auto_l0) [hint]
#10     19.26s best:10664 next:[2646,10663] quick_restart_no_lp (fixed_bools=0/704)
#11     20.03s best:10642 next:[2646,10641] graph_dec_lns (d=0.94 s=184 t=0.10 p=1.00 stall=0 h=auto_l0) [hint]
#12     20.53s best:10612 next:[2646,10611] quick_restart_no_lp (fixed_bools=0/725)
#13     20.59s best:10611 next:[2646,10610] violation_ls(batch:7 #solutions_imported:4 #lin_moves:1 #lin_evals:78'676 #gen_moves:29'848 #gen_evals:4'158 #comp_moves:7'483 #backtracks:11'178 #weight_updates:210)
#14     20.60s best:10610 next:[2646,10609] violation_ls(batch:7 #solutions_imported:4 #lin_moves:39'866 #lin_evals:139'155 #gen_moves:73 #gen_evals:10 #comp_moves:3 #backtracks:35 #weight_updates:453)
#Bound  20.72s best:10610 next:[2648,10609] max_lp
#Bound  20.75s best:10610 next:[2649,10609] lb_tree_search
#15     21.35s best:10581 next:[2649,10580] rnd_var_lns (d=0.96 s=193 t=0.10 p=1.00 stall=0 h=auto_l0) [presolve]
#16     22.05s best:10580 next:[2649,10579] violation_ls(batch:8 #solutions_imported:5 #lin_moves:1 #lin_evals:88'659 #gen_moves:34'090 #gen_evals:4'676 #comp_moves:7'843 #backtracks:13'119 #weight_updates:274)
#Bound  22.21s best:10580 next:[2698,10579] lb_tree_search
#17     22.23s best:10577 next:[2698,10576] graph_var_lns (d=0.96 s=195 t=0.10 p=1.00 stall=0 h=auto_l0)
#18     22.51s best:9975  next:[2698,9974] rins_lp_lns (d=0.94 s=190 t=0.10 p=1.00 stall=0 h=auto_l0)
#Bound  23.68s best:9975  next:[2705,9974] lb_tree_search
#Bound  25.27s best:9975  next:[2710,9974] lb_tree_search
#19     25.57s best:9954  next:[2710,9953] graph_arc_lns (d=0.97 s=226 t=0.10 p=1.00 stall=0 h=auto_l0)
#Bound  27.02s best:9954  next:[2724,9953] lb_tree_search
#20     27.86s best:9953  next:[2724,9952] violation_ls(batch:11 #solutions_imported:7 #lin_moves:55'385 #lin_evals:249'001 #gen_moves:18'704 #gen_evals:1'734 #comp_moves:723 #backtracks:8'987 #weight_updates:1'585)
#21     27.88s best:9877  next:[2724,9876] rins_pump_lns (d=0.89 s=248 t=0.10 p=0.67 stall=3 h=auto_l0)
#Bound  28.49s best:9877  next:[2725,9876] lb_tree_search
#Bound  29.91s best:9877  next:[2727,9876] lb_tree_search
#22     31.19s best:9842  next:[2727,9841] rins_lp_lns (d=0.91 s=262 t=0.10 p=0.70 stall=0 h=auto_l0)
#Bound  33.82s best:9842  next:[2728,9841] lb_tree_search
#23     35.37s best:9838  next:[2728,9837] rnd_var_lns (d=0.99 s=279 t=0.10 p=1.00 stall=5 h=auto_l0)
#24     35.53s best:9357  next:[2728,9356] rins_pump_lns (d=0.91 s=290 t=0.10 p=0.67 stall=1 h=auto_l0)
#Bound  37.65s best:9357  next:[2729,9356] lb_tree_search (nodes=1/1 rc=0 decisions=7 @root=8 restarts=0) 
#25     38.99s best:9353  next:[2729,9352] rnd_cst_lns (d=0.99 s=294 t=0.10 p=1.00 stall=5 h=auto_l0)
#26     39.52s best:8791  next:[2729,8790] graph_var_lns (d=0.99 s=295 t=0.10 p=1.00 stall=3 h=auto_l0)
#27     44.03s best:8790  next:[2729,8789] violation_ls(batch:17 #solutions_imported:12 #lin_moves:19'283 #lin_evals:278'811 #gen_moves:84'305 #gen_evals:9'586 #comp_moves:13'012 #backtracks:35'616 #weight_updates:2'112)
#28     44.04s best:8789  next:[2729,8788] violation_ls(batch:17 #solutions_imported:12 #lin_moves:72'425 #lin_evals:376'404 #gen_moves:48'054 #gen_evals:3'950 #comp_moves:2'195 #backtracks:22'920 #weight_updates:4'795)
#Bound  44.78s best:8789  next:[2730,8788] objective_shaving_search_max_lp (vars=7135 csts=59419)
#29     45.22s best:8787  next:[2730,8786] graph_cst_lns (d=0.99 s=323 t=0.10 p=1.00 stall=1 h=auto_l0)
#30     45.54s best:8107  next:[2730,8106] rnd_var_lns (d=0.99 s=319 t=0.10 p=1.00 stall=1 h=auto_l0)
#31     46.91s best:7793  next:[2730,7792] rins_lp_lns (d=0.91 s=342 t=0.10 p=0.64 stall=1 h=auto_l0)
#Bound  47.08s best:7793  next:[2733,7792] objective_lb_search_max_lp
#32     47.39s best:7792  next:[2733,7791] violation_ls(batch:18 #solutions_imported:13 #lin_moves:72'425 #lin_evals:394'007 #gen_moves:56'228 #gen_evals:4'404 #comp_moves:2'657 #backtracks:26'776 #weight_updates:4'889)
#Bound  50.30s best:7792  next:[2735,7791] objective_lb_search_max_lp
#33     51.19s best:7791  next:[2735,7790] violation_ls(batch:19 #solutions_imported:14 #lin_moves:33'622 #lin_evals:354'141 #gen_moves:84'305 #gen_evals:9'586 #comp_moves:13'012 #backtracks:35'616 #weight_updates:3'081)
#34     51.20s best:7790  next:[2735,7789] violation_ls(batch:19 #solutions_imported:14 #lin_moves:72'425 #lin_evals:394'011 #gen_moves:56'229 #gen_evals:4'404 #comp_moves:2'658 #backtracks:26'776 #weight_updates:4'889)
#35     52.07s best:7766  next:[2735,7765] rnd_var_lns (d=1.00 s=347 t=0.10 p=1.00 stall=0 h=auto_l0)
#Bound  52.44s best:7766  next:[2752,7765] objective_lb_search_max_lp
#36     52.56s best:7744  next:[2752,7743] graph_var_lns (d=0.99 s=349 t=0.10 p=0.94 stall=0 h=auto_l0)
#Bound  53.84s best:7744  next:[2753,7743] objective_lb_search_max_lp
#37     54.00s best:7596  next:[2753,7595] graph_cst_lns (d=1.00 s=351 t=0.10 p=1.00 stall=0 h=auto_l0)
#38     54.04s best:7595  next:[2753,7594] violation_ls(batch:20 #solutions_imported:15 #lin_moves:35'807 #lin_evals:363'192 #gen_moves:84'305 #gen_evals:9'586 #comp_moves:13'012 #backtracks:35'616 #weight_updates:3'503)
#39     54.23s best:7594  next:[2753,7593] violation_ls(batch:20 #solutions_imported:15 #lin_moves:72'425 #lin_evals:412'416 #gen_moves:65'181 #gen_evals:4'810 #comp_moves:3'116 #backtracks:31'023 #weight_updates:4'990)
#Bound  54.40s best:7594  next:[2754,7593] objective_lb_search_max_lp
#40     55.77s best:7551  next:[2754,7550] graph_cst_lns (d=0.99 s=365 t=0.10 p=0.94 stall=0 h=auto_l0)
#41     59.55s best:7546  next:[2754,7545] graph_dec_lns (d=1.00 s=382 t=0.10 p=0.94 stall=3 h=auto_l0)
#42     60.32s best:7367  next:[2754,7366] rins_lp_lns (d=0.91 s=400 t=0.10 p=0.61 stall=1 h=auto_l0)
#43     70.08s best:7361  next:[2754,7360] quick_restart_no_lp (fixed_bools=0/1209)
#Bound  73.79s best:7361  next:[2755,7360] reduced_costs
#44     74.91s best:7341  next:[2755,7340] graph_arc_lns (d=0.99 s=430 t=0.10 p=0.77 stall=0 h=auto_l0)
#Bound  77.31s best:7341  next:[2756,7340] objective_lb_search_max_lp
#45     79.75s best:7272  next:[2756,7271] rins_lp_lns (d=0.93 s=464 t=0.10 p=0.61 stall=1 h=auto_l0)
#46     83.37s best:7252  next:[2756,7251] graph_var_lns (d=0.99 s=469 t=0.10 p=0.76 stall=0 h=auto_l0)
#Bound  86.64s best:7252  next:[2757,7251] objective_shaving_search_max_lp (vars=7135 csts=59419)
#47     86.79s best:7251  next:[2757,7250] quick_restart_no_lp (fixed_bools=0/1453)
#48     87.13s best:7248  next:[2757,7247] graph_cst_lns (d=1.00 s=483 t=0.10 p=0.80 stall=1 h=auto_l0)
#49     87.40s best:7227  next:[2757,7226] quick_restart_no_lp (fixed_bools=0/1462)
#50     88.08s best:7095  next:[2757,7094] graph_arc_lns (d=0.99 s=482 t=0.10 p=0.77 stall=2 h=auto_l0)
#51     90.71s best:6872  next:[2757,6871] rins_lp_lns (d=0.93 s=502 t=0.10 p=0.60 stall=1 h=auto_l0)
#Bound  93.07s best:6872  next:[2824,6871] objective_lb_search_max_lp
#52     98.10s best:6780  next:[2824,6779] rins_lp_lns (d=0.93 s=528 t=0.10 p=0.59 stall=0 h=auto_l0)
#53    102.93s best:6762  next:[2824,6761] rnd_cst_lns (d=0.99 s=532 t=0.10 p=0.73 stall=0 h=auto_l0)
#54    105.17s best:6746  next:[2824,6745] rins_lp_lns (d=0.93 s=552 t=0.10 p=0.59 stall=0 h=auto_l0)
#55    108.24s best:6743  next:[2824,6742] rnd_cst_lns (d=0.99 s=556 t=0.10 p=0.72 stall=0 h=auto_l0)
#56    109.30s best:6742  next:[2824,6741] graph_dec_lns (d=1.00 s=548 t=0.10 p=0.75 stall=1 h=auto_l0)
#57    112.71s best:6741  next:[2824,6740] graph_arc_lns (d=1.00 s=570 t=0.10 p=0.73 stall=0 h=auto_l0)
#58    116.10s best:6740  next:[2824,6739] violation_ls(batch:37 #solutions_imported:28 #lin_moves:143'609 #lin_evals:874'774 #gen_moves:141'881 #gen_evals:10'488 #comp_moves:7'104 #backtracks:67'369 #weight_updates:15'383)
#59    116.93s best:6676  next:[2824,6675] rins_lp_lns (d=0.94 s=588 t=0.10 p=0.59 stall=0 h=auto_l0)
#60    118.78s best:6675  next:[2824,6674] quick_restart_no_lp (fixed_bools=0/1861)
#61    120.55s best:6674  next:[2824,6673] violation_ls(batch:38 #solutions_imported:29 #lin_moves:158'504 #lin_evals:931'415 #gen_moves:120'212 #gen_evals:12'418 #comp_moves:16'024 #backtracks:52'060 #weight_updates:14'310)
#62    123.85s best:6673  next:[2824,6672] violation_ls(batch:39 #solutions_imported:30 #lin_moves:158'504 #lin_evals:931'427 #gen_moves:120'218 #gen_evals:12'419 #comp_moves:16'026 #backtracks:52'062 #weight_updates:14'310)
#63    123.90s best:6672  next:[2824,6671] violation_ls(batch:39 #solutions_imported:30 #lin_moves:147'352 #lin_evals:907'524 #gen_moves:150'754 #gen_evals:11'320 #comp_moves:7'491 #backtracks:71'611 #weight_updates:15'748)
#64    124.48s best:6669  next:[2824,6668] graph_dec_lns (d=1.00 s=608 t=0.10 p=0.69 stall=3 h=auto_l0)
#65    127.09s best:6668  next:[2824,6667] violation_ls(batch:40 #solutions_imported:31 #lin_moves:151'144 #lin_evals:922'713 #gen_moves:150'754 #gen_evals:11'320 #comp_moves:7'491 #backtracks:71'611 #weight_updates:16'431)
#66    130.56s best:6667  next:[2824,6666] quick_restart_no_lp (fixed_bools=0/1968)
#67    131.13s best:6666  next:[2824,6665] violation_ls(batch:41 #solutions_imported:32 #lin_moves:168'225 #lin_evals:978'122 #gen_moves:120'248 #gen_evals:12'422 #comp_moves:16'030 #backtracks:52'075 #weight_updates:14'589)
#68    131.13s best:6665  next:[2824,6664] violation_ls(batch:41 #solutions_imported:32 #lin_moves:151'144 #lin_evals:922'805 #gen_moves:150'798 #gen_evals:11'323 #comp_moves:7'493 #backtracks:71'632 #weight_updates:16'431)
#69    131.24s best:6461  next:[2824,6460] rins_lp_lns (d=0.92 s=636 t=0.10 p=0.56 stall=1 h=auto_l0)
#Bound 164.43s best:6461  next:[2830,6460] objective_lb_search_max_lp
#70    169.12s best:6453  next:[2830,6452] graph_cst_lns (d=1.00 s=751 t=0.10 p=0.68 stall=4 h=auto_l0)
#71    174.54s best:6427  next:[2830,6426] rins_lp_lns (d=0.92 s=782 t=0.10 p=0.54 stall=1 h=auto_l0)
#72    213.10s best:6419  next:[2830,6418] rnd_var_lns (d=1.00 s=893 t=0.10 p=0.62 stall=0 h=auto_l0)
#73    231.79s best:6400  next:[2830,6399] quick_restart_no_lp (fixed_bools=0/2636)
#74    233.03s best:6398  next:[2830,6397] quick_restart_no_lp (fixed_bools=0/2646)
#75    237.46s best:6382  next:[2830,6381] graph_dec_lns (d=1.00 s=970 t=0.10 p=0.62 stall=1 h=auto_l0)
#76    252.83s best:6380  next:[2830,6379] graph_cst_lns (d=1.00 s=1017 t=0.10 p=0.60 stall=2 h=auto_l0)
#77    253.38s best:6378  next:[2830,6377] violation_ls(batch:74 #solutions_imported:39 #lin_moves:311'897 #lin_evals:1'790'340 #gen_moves:171'236 #gen_evals:20'429 #comp_moves:24'896 #backtracks:73'131 #weight_updates:81'204)
#78    253.39s best:6376  next:[2830,6375] violation_ls(batch:74 #solutions_imported:39 #lin_moves:316'625 #lin_evals:1'768'377 #gen_moves:219'559 #gen_evals:15'729 #comp_moves:11'862 #backtracks:103'821 #weight_updates:101'526)
#79    256.72s best:6364  next:[2830,6363] rnd_var_lns (d=1.00 s=1037 t=0.10 p=0.60 stall=4 h=auto_l0)
#80    288.69s best:6336  next:[2830,6335] rins_lp_lns (d=0.93 s=1144 t=0.10 p=0.53 stall=2 h=auto_l0)
#81    293.19s best:6334  next:[2830,6333] rnd_var_lns (d=1.00 s=1147 t=0.10 p=0.60 stall=3 h=auto_l0)
#82    295.57s best:6332  next:[2830,6331] graph_arc_lns (d=1.00 s=1150 t=0.10 p=0.60 stall=3 h=auto_l0)
#83    297.13s best:6330  next:[2830,6329] graph_dec_lns (d=1.00 s=1164 t=0.10 p=0.59 stall=0 h=auto_l0)
#84    300.84s best:6328  next:[2830,6327] rnd_var_lns (d=1.00 s=1171 t=0.10 p=0.60 stall=0 h=auto_l0)
#85    301.26s best:6326  next:[2830,6325] graph_dec_lns (d=1.00 s=1176 t=0.10 p=0.58 stall=0 h=auto_l0)
#86    302.53s best:6312  next:[2830,6311] rins_lp_lns (d=0.92 s=1192 t=0.10 p=0.53 stall=0 h=auto_l0)
#87    307.61s best:6310  next:[2830,6309] graph_cst_lns (d=1.00 s=1199 t=0.10 p=0.58 stall=0 h=auto_l0)
#88    308.82s best:6274  next:[2830,6273] rins_lp_lns (d=0.92 s=1216 t=0.10 p=0.53 stall=1 h=auto_l0)
#89    337.72s best:6162  next:[2830,6161] graph_cst_lns (d=1.00 s=1295 t=0.10 p=0.59 stall=3 h=auto_l0)
#90    341.67s best:6124  next:[2830,6123] quick_restart (fixed_bools=2/1371)
#91    348.38s best:6065  next:[2830,6064] graph_arc_lns (d=1.00 s=1330 t=0.10 p=0.58 stall=6 h=auto_l0)
#92    366.59s best:5966  next:[2830,5965] graph_var_lns (d=0.99 s=1389 t=0.10 p=0.56 stall=0 h=auto_l0)
#93    380.91s best:5944  next:[2830,5943] rnd_var_lns (d=1.00 s=1435 t=0.10 p=0.58 stall=0 h=auto_l0)
#94    385.92s best:5928  next:[2830,5927] graph_dec_lns (d=1.00 s=1452 t=0.10 p=0.57 stall=0 h=auto_l0)
#95    410.00s best:5818  next:[2830,5817] graph_dec_lns (d=1.00 s=1524 t=0.10 p=0.56 stall=1 h=auto_l0)
#96    488.59s best:5760  next:[2830,5759] rnd_cst_lns (d=1.00 s=1776 t=0.10 p=0.55 stall=1 h=auto_l0)
#97    501.33s best:5739  next:[2830,5738] graph_cst_lns (d=1.00 s=1816 t=0.10 p=0.56 stall=3 h=auto_l0)
#98    501.69s best:5738  next:[2830,5737] violation_ls(batch:140 #solutions_imported:55 #lin_moves:592'791 #lin_evals:3'612'101 #gen_moves:422'486 #gen_evals:46'803 #comp_moves:43'007 #backtracks:189'661 #weight_updates:92'095)
#99    501.72s best:5737  next:[2830,5736] violation_ls(batch:140 #solutions_imported:54 #lin_moves:674'088 #lin_evals:3'616'895 #gen_moves:384'508 #gen_evals:26'725 #comp_moves:21'104 #backtracks:181'656 #weight_updates:225'680)
#100   505.51s best:5736  next:[2830,5735] violation_ls(batch:141 #solutions_imported:56 #lin_moves:592'791 #lin_evals:3'612'235 #gen_moves:422'557 #gen_evals:46'805 #comp_moves:43'010 #backtracks:189'695 #weight_updates:92'095)
#101   505.52s best:5735  next:[2830,5734] violation_ls(batch:141 #solutions_imported:55 #lin_moves:674'088 #lin_evals:3'617'146 #gen_moves:384'619 #gen_evals:26'730 #comp_moves:21'107 #backtracks:181'710 #weight_updates:225'680)
#102   506.37s best:5671  next:[2830,5670] rnd_var_lns (d=1.00 s=1836 t=0.10 p=0.56 stall=0 h=auto_l0)
#103   508.02s best:5665  next:[2830,5664] graph_var_lns (d=1.00 s=1838 t=0.10 p=0.55 stall=0 h=auto_l0)
#104   515.39s best:5661  next:[2830,5660] rnd_cst_lns (d=1.00 s=1862 t=0.10 p=0.55 stall=0 h=auto_l0)
#Bound 516.45s best:5661  next:[2831,5660] objective_lb_search_max_lp
#105   524.00s best:5656  next:[2831,5655] rnd_cst_lns (d=1.00 s=1888 t=0.10 p=0.55 stall=1 h=auto_l0)
#Bound 544.44s best:5656  next:[2853,5655] objective_lb_search_max_lp
#106   558.28s best:5651  next:[2853,5650] graph_dec_lns (d=1.00 s=2005 t=0.10 p=0.56 stall=1 h=auto_l0)
#Bound 575.00s best:5651  next:[2860,5650] objective_lb_search_max_lp
#107   613.37s best:5633  next:[2860,5632] rins_pump_lns (d=0.93 s=2196 t=0.10 p=0.51 stall=1 h=auto_l0)
#108   624.41s best:5598  next:[2860,5597] graph_cst_lns (d=1.00 s=2215 t=0.10 p=0.54 stall=0 h=auto_l0)
#109   630.12s best:5582  next:[2860,5581] graph_arc_lns (d=1.00 s=2239 t=0.10 p=0.55 stall=4 h=auto_l0)
#110   653.13s best:5561  next:[2860,5560] rnd_cst_lns (d=1.00 s=2310 t=0.10 p=0.55 stall=1 h=auto_l0)
#Bound 717.57s best:5561  next:[2861,5560] objective_lb_search_max_lp
#Bound 826.23s best:5561  next:[2862,5560] objective_lb_search_max_lp
#Bound 884.64s best:5561  next:[2865,5560] objective_lb_search_max_lp
#Bound 1021.04s best:5561  next:[2899,5560] objective_lb_search_max_lp
#111   1027.39s best:5531  next:[2899,5530] rins_lp_lns (d=0.93 s=3471 t=0.10 p=0.51 stall=2 h=auto_l0)
#Bound 1199.59s best:5531  next:[2900,5530] objective_lb_search_max_lp
#Bound 1534.86s best:5531  next:[2902,5530] objective_lb_search_max_lp
#Bound 1930.23s best:5531  next:[2906,5530] objective_lb_search_max_lp
#Bound 2397.16s best:5531  next:[2907,5530] objective_lb_search_max_lp
#Bound 2440.99s best:5531  next:[2908,5530] objective_lb_search_max_lp
#Bound 2692.76s best:5531  next:[2909,5530] objective_lb_search_max_lp
#Bound 2720.14s best:5531  next:[2912,5530] objective_lb_search_max_lp
#Bound 3548.02s best:5531  next:[2914,5530] objective_lb_search_max_lp
#Bound 3688.49s best:5531  next:[2916,5530] objective_lb_search_max_lp
#Bound 4399.97s best:5531  next:[2918,5530] objective_lb_search_max_lp
#Bound 5023.46s best:5531  next:[2919,5530] objective_lb_search_max_lp
#Bound 5208.42s best:5531  next:[2921,5530] objective_lb_search_max_lp
#Bound 6099.87s best:5531  next:[2922,5530] objective_lb_search_max_lp
#Bound 7535.35s best:5531  next:[2923,5530] objective_lb_search_max_lp
#112   9000.47s best:5530  next:[2923,5529] quick_restart_no_lp (fixed_bools=1/9018)
#113   9001.51s best:5526  next:[2923,5525] quick_restart_no_lp (fixed_bools=1/9039)
#114   9002.24s best:5525  next:[2923,5524] quick_restart_no_lp (fixed_bools=1/9042)
#115   9002.41s best:5523  next:[2923,5522] violation_ls(batch:2317 #solutions_imported:66 #perturbations:20 #lin_moves:8'775'259 #lin_evals:72'025'887 #gen_moves:1'840'802 #gen_evals:1'683'376 #comp_moves:127'741 #backtracks:856'200 #weight_updates:150'946)
#116   9002.43s best:5522  next:[2923,5521] violation_ls(batch:2317 #solutions_imported:65 #perturbations:20 #lin_moves:6'801'504 #lin_evals:56'448'191 #gen_moves:2'909'300 #gen_evals:1'906'588 #comp_moves:133'183 #backtracks:1'387'719 #weight_updates:264'491)
#117   9002.87s best:5472  next:[2923,5471] rins_lp_lns (d=0.93 s=28654 t=0.10 p=0.50 stall=0 h=auto_l0)
#118   9004.98s best:5469  next:[2923,5468] quick_restart_no_lp (fixed_bools=1/9135)
#119   9006.55s best:5467  next:[2923,5466] violation_ls(batch:2318 #solutions_imported:67 #perturbations:20 #lin_moves:8'775'260 #lin_evals:72'025'906 #gen_moves:1'840'802 #gen_evals:1'683'376 #comp_moves:127'741 #backtracks:856'200 #weight_updates:150'946)
#120   9006.57s best:5466  next:[2923,5465] violation_ls(batch:2318 #solutions_imported:66 #perturbations:20 #lin_moves:6'801'505 #lin_evals:56'448'210 #gen_moves:2'909'300 #gen_evals:1'906'588 #comp_moves:133'183 #backtracks:1'387'719 #weight_updates:264'491)
#121   9011.38s best:5455  next:[2923,5454] rnd_var_lns (d=1.00 s=28670 t=0.10 p=0.50 stall=1 h=auto_l0)
#122   9086.88s best:5454  next:[2923,5453] quick_restart_no_lp (fixed_bools=1/9279)
#123   9087.73s best:5453  next:[2923,5452] violation_ls(batch:2339 #solutions_imported:70 #perturbations:20 #lin_moves:8'775'260 #lin_evals:72'358'787 #gen_moves:1'901'145 #gen_evals:1'698'446 #comp_moves:134'542 #backtracks:882'966 #weight_updates:151'185)
#124   9087.74s best:5452  next:[2923,5451] violation_ls(batch:2339 #solutions_imported:69 #perturbations:20 #lin_moves:6'810'437 #lin_evals:56'804'936 #gen_moves:2'964'900 #gen_evals:1'916'107 #comp_moves:137'228 #backtracks:1'413'494 #weight_updates:266'233)
#Bound 9090.37s best:5452  next:[2924,5451] objective_lb_search_max_lp
#125   9092.04s best:5449  next:[2924,5448] rnd_var_lns (d=1.00 s=28928 t=0.10 p=0.50 stall=0 h=auto_l0)
#126   9092.36s best:5448  next:[2924,5447] violation_ls(batch:2340 #solutions_imported:70 #perturbations:20 #lin_moves:6'811'694 #lin_evals:56'810'317 #gen_moves:2'964'900 #gen_evals:1'916'107 #comp_moves:137'228 #backtracks:1'413'494 #weight_updates:266'677)
#127   9094.00s best:5426  next:[2924,5425] rins_lp_lns (d=0.93 s=28938 t=0.10 p=0.50 stall=6 h=auto_l0)
#Bound 10421.95s best:5426  next:[2927,5425] objective_lb_search_max_lp
#Bound 11148.30s best:5426  next:[2928,5425] objective_lb_search_max_lp
#Bound 11658.79s best:5426  next:[2929,5425] objective_lb_search_max_lp
#Bound 14089.65s best:5426  next:[2932,5425] objective_lb_search_max_lp
#Bound 16825.77s best:5426  next:[2933,5425] objective_lb_search_max_lp
#Bound 17338.90s best:5426  next:[2934,5425] objective_lb_search_max_lp
#Bound 18613.87s best:5426  next:[2936,5425] objective_lb_search_max_lp
#Bound 19579.93s best:5426  next:[2937,5425] objective_lb_search_max_lp
#Bound 19849.27s best:5426  next:[2938,5425] objective_lb_search_max_lp
#Bound 28946.45s best:5426  next:[2940,5425] objective_lb_search_max_lp
#Bound 30743.69s best:5426  next:[2941,5425] objective_lb_search_max_lp
#Bound 33897.30s best:5426  next:[2942,5425] objective_lb_search_max_lp
#Bound 35600.42s best:5426  next:[2943,5425] objective_lb_search_max_lp
#128   37371.40s best:5423  next:[2943,5422] rins_lp_lns (d=0.93 s=121039 t=0.10 p=0.50 stall=9 h=auto_l0)
#129   37374.20s best:5407  next:[2943,5406] rins_pump_lns (d=0.93 s=121052 t=0.10 p=0.50 stall=0 h=auto_l0)
#130   37393.30s best:5363  next:[2943,5362] rnd_cst_lns (d=1.00 s=121105 t=0.10 p=0.50 stall=0 h=auto_l0)
#131   37465.51s best:5359  next:[2943,5358] rnd_var_lns (d=1.00 s=121325 t=0.10 p=0.50 stall=3 h=auto_l0)
#132   37619.54s best:5321  next:[2943,5320] rnd_var_lns (d=1.00 s=121828 t=0.10 p=0.50 stall=3 h=auto_l0)
#133   42802.64s best:5317  next:[2943,5316] quick_restart_no_lp (fixed_bools=18/19142)
#134   42803.38s best:5316  next:[2943,5315] violation_ls(batch:11232 #solutions_imported:77 #perturbations:107 #lin_moves:49'418'704 #lin_evals:375'993'167 #gen_moves:9'301'057 #gen_evals:7'510'920 #comp_moves:391'675 #backtracks:4'453'843 #weight_updates:1'437'953)
#135   42803.39s best:5314  next:[2943,5313] violation_ls(batch:11232 #solutions_imported:76 #perturbations:107 #lin_moves:55'898'977 #lin_evals:413'322'833 #gen_moves:6'780'138 #gen_evals:7'034'837 #comp_moves:264'488 #backtracks:3'257'181 #weight_updates:603'467)
#136   42806.08s best:5313  next:[2943,5312] quick_restart_no_lp (fixed_bools=18/19151)
#137   42806.80s best:5275  next:[2943,5274] rnd_var_lns (d=1.00 s=138284 t=0.10 p=0.50 stall=1 h=auto_l0)
#Bound 43371.89s best:5275  next:[2944,5274] objective_lb_search_max_lp
#Bound 46607.47s best:5275  next:[2945,5274] objective_lb_search_max_lp
#Bound 50086.42s best:5275  next:[2946,5274] objective_lb_search_max_lp
#Bound 52955.92s best:5275  next:[2949,5274] objective_lb_search_max_lp
#Bound 60177.07s best:5275  next:[2950,5274] objective_lb_search_max_lp
#Bound 62341.72s best:5275  next:[2951,5274] objective_lb_search_max_lp
#Bound 69391.04s best:5275  next:[2953,5274] objective_lb_search_max_lp
#Bound 72731.60s best:5275  next:[2954,5274] objective_lb_search_max_lp
#Bound 72985.70s best:5275  next:[2955,5274] objective_lb_search_max_lp
#Bound 76513.52s best:5275  next:[2956,5274] objective_lb_search_max_lp
#Bound 78238.23s best:5275  next:[2957,5274] objective_lb_search_max_lp
#Bound 78514.78s best:5275  next:[2959,5274] objective_lb_search_max_lp
#Bound 80170.47s best:5275  next:[2960,5274] objective_lb_search_max_lp
#Bound 83964.10s best:5275  next:[2961,5274] objective_lb_search_max_lp
#Bound 85310.59s best:5275  next:[2962,5274] objective_lb_search_max_lp
#Bound 85594.53s best:5275  next:[2963,5274] objective_lb_search_max_lp

Task timing                                  n [     min,      max]      avg      dev     time         n [     min,      max]      avg      dev    dtime
                             'core':         1 [  24.00h,   24.00h]   24.00h   0.00ns   24.00h         1 [  17.95h,   17.95h]   17.95h   0.00ns   17.95h
                       'default_lp':         1 [  24.00h,   24.00h]   24.00h   0.00ns   24.00h         1 [   1.58h,    1.58h]    1.58h   0.00ns    1.58h
                 'feasibility_pump':      6823 [210.85us,    3.88m]   12.66s    3.83s   23.99h      6709 [540.15ms,   35.87s]    1.29s 497.10ms    2.39h
                            'fixed':         1 [  24.00h,   24.00h]   24.00h   0.00ns   24.00h         1 [   1.84h,    1.84h]    1.84h   0.00ns    1.84h
                  'fj_long_default':        12 [166.08ms,    1.78s] 316.74ms 439.89ms    3.80s        12 [177.95ms, 251.48ms] 209.72ms  19.30ms    2.52s
              'fj_long_lin_default':         9 [192.47ms,    2.13s] 419.44ms 605.74ms    3.77s         9 [224.34ms, 281.81ms] 258.88ms  17.64ms    2.33s
                   'fj_long_random':        12 [155.51ms,    1.76s] 311.65ms 436.25ms    3.74s        12 [165.32ms, 245.63ms] 199.30ms  19.36ms    2.39s
                 'fj_short_default':        17 [189.09ms,    1.03s] 257.81ms 193.26ms    4.38s        17 [226.62ms, 346.22ms] 270.41ms  32.97ms    4.60s
             'fj_short_lin_default':        13 [195.94ms,    1.39s] 297.14ms 314.22ms    3.86s        13 [220.81ms, 279.81ms] 252.82ms  14.79ms    3.29s
              'fj_short_lin_random':         8 [193.53ms,    2.39s] 479.61ms 721.85ms    3.84s         8 [220.24ms, 274.07ms] 254.31ms  17.23ms    2.03s
                  'fj_short_random':         5 [194.13ms,    2.99s] 757.83ms    1.12s    3.79s         5 [224.16ms, 253.84ms] 241.88ms   9.90ms    1.21s
                        'fs_random':         1 [   4.35s,    4.35s]    4.35s   0.00ns    4.35s         1 [ 52.84ms,  52.84ms]  52.84ms   0.00ns  52.84ms
                        'fs_random':         1 [   4.37s,    4.37s]    4.37s   0.00ns    4.37s         1 [ 34.60ms,  34.60ms]  34.60ms   0.00ns  34.60ms
                  'fs_random_no_lp':         1 [   4.54s,    4.54s]    4.54s   0.00ns    4.54s         1 [ 17.61ms,  17.61ms]  17.61ms   0.00ns  17.61ms
          'fs_random_quick_restart':         1 [   4.35s,    4.35s]    4.35s   0.00ns    4.35s         1 [165.32ms, 165.32ms] 165.32ms   0.00ns 165.32ms
          'fs_random_quick_restart':         1 [   4.36s,    4.36s]    4.36s   0.00ns    4.36s         1 [ 11.14ms,  11.14ms]  11.14ms   0.00ns  11.14ms
    'fs_random_quick_restart_no_lp':         1 [   4.40s,    4.40s]    4.40s   0.00ns    4.40s         1 [150.47ms, 150.47ms] 150.47ms   0.00ns 150.47ms
                    'graph_arc_lns':     22996 [160.47ms,    8.77s]    4.86s 962.42ms   31.04h     22989 [ 40.00ns, 130.09ms]  79.55ms  27.01ms   30.48m
                    'graph_cst_lns':     22996 [ 82.78ms,   10.49s]    5.43s    1.08s   34.67h     22989 [ 10.00ns, 140.56ms]  75.05ms  31.88ms   28.75m
                    'graph_dec_lns':     22996 [234.68ms,    9.69s]    5.35s    1.02s   34.20h     22992 [ 10.00ns, 197.47ms]  77.27ms  29.58ms   29.61m
                    'graph_var_lns':     22996 [169.21ms,    9.53s]    4.89s    1.16s   31.25h     22981 [ 10.00ns, 201.56ms]  75.89ms  31.27ms   29.07m
                   'lb_tree_search':         1 [  24.00h,   24.00h]   24.00h   0.00ns   24.00h         1 [   6.92h,    6.92h]    6.92h   0.00ns    6.92h
                           'max_lp':         1 [  24.00h,   24.00h]   24.00h   0.00ns   24.00h         1 [   2.22h,    2.22h]    2.22h   0.00ns    2.22h
                            'no_lp':         1 [  24.00h,   24.00h]   24.00h   0.00ns   24.00h         1 [  58.62m,   58.62m]   58.62m   0.00ns   58.62m
              'objective_lb_search':         1 [  24.00h,   24.00h]   24.00h   0.00ns   24.00h         1 [   2.34h,    2.34h]    2.34h   0.00ns    2.34h
       'objective_lb_search_max_lp':         1 [  24.00h,   24.00h]   24.00h   0.00ns   24.00h         1 [   2.77h,    2.77h]    2.77h   0.00ns    2.77h
        'objective_lb_search_no_lp':         1 [  24.00h,   24.00h]   24.00h   0.00ns   24.00h         1 [   1.02h,    1.02h]    1.02h   0.00ns    1.02h
  'objective_shaving_search_max_lp':        78 [123.36ms,    2.53h]   18.46m   31.23m   23.99h        63 [ 71.37ms,   13.06m]    1.79m    2.80m    1.88h
   'objective_shaving_search_no_lp':        78 [112.96ms,    2.53h]   18.46m   31.23m   23.99h        62 [  3.40ms,    3.00m]   26.44s   39.71s   27.32m
                          'probing':         1 [  24.00h,   24.00h]   24.00h   0.00ns   24.00h         1 [   2.83h,    2.83h]    2.83h   0.00ns    2.83h
                   'probing_max_lp':         1 [  24.00h,   24.00h]   24.00h   0.00ns   24.00h         1 [   2.96h,    2.96h]    2.96h   0.00ns    2.96h
                     'pseudo_costs':         1 [  24.00h,   24.00h]   24.00h   0.00ns   24.00h         1 [   2.16h,    2.16h]    2.16h   0.00ns    2.16h
                    'quick_restart':         1 [  24.00h,   24.00h]   24.00h   0.00ns   24.00h         1 [   3.34h,    3.34h]    3.34h   0.00ns    3.34h
              'quick_restart_no_lp':         1 [  24.00h,   24.00h]   24.00h   0.00ns   24.00h         1 [   1.29h,    1.29h]    1.29h   0.00ns    1.29h
                    'reduced_costs':         1 [  24.00h,   24.00h]   24.00h   0.00ns   24.00h         1 [   2.75h,    2.75h]    2.75h   0.00ns    2.75h
                        'rins/rens':     22996 [  1.25ms,    4.61s]    1.39s 878.96ms    8.87h     20185 [ 10.00ns, 141.07ms]  74.51ms  46.62ms   25.07m
                      'rnd_cst_lns':     22996 [262.71ms,    9.50s]    5.37s    1.06s   34.32h     22985 [ 10.00ns, 163.10ms]  75.77ms  31.09ms   29.03m
                      'rnd_var_lns':     22996 [118.13ms,   11.13s]    5.28s    1.03s   33.75h     22983 [ 10.00ns, 201.78ms]  76.42ms  30.51ms   29.27m
         'scheduling_intervals_lns':     22996 [209.44ms,    9.58s]    6.42s 323.20ms   41.02h     22993 [100.03ms, 102.12ms] 100.53ms 442.87us   38.53m
       'scheduling_precedences_lns':     22995 [923.18ms,    9.45s]    6.60s 359.63ms   42.14h     22994 [  5.30ms, 102.12ms] 100.53ms 768.39us   38.53m
       'scheduling_time_window_lns':     22995 [   1.00s,    9.63s]    6.43s 321.26ms   41.05h     22993 [100.04ms, 102.12ms] 100.53ms 442.86us   38.53m
                     'violation_ls':     22996 [  7.59ms, 988.93ms] 281.18ms  72.50ms    1.80h     22996 [530.00ns, 660.96ms] 289.82ms  79.08ms    1.85h
                     'violation_ls':     22996 [  8.00ms, 920.62ms] 269.34ms  65.67ms    1.72h     22996 [870.00ns, 565.38ms] 273.93ms  63.89ms    1.75h

Search stats                         Bools  Conflicts    Branches   Restarts      BoolPropag   IntegerPropag
                           'core':  34'896  2'628'005   3'939'519     36'893  22'771'517'864  21'191'999'636
                     'default_lp':  31'999    939'766   6'598'984    396'025   2'921'612'915  14'221'887'434
                          'fixed':   4'074  5'506'775  14'868'206      2'008   3'215'513'297  25'078'901'965
                      'fs_random':     416          0         848        832              74         245'926
                      'fs_random':     416          1         844        832             124         248'374
                'fs_random_no_lp':     433          1         853        832             527         320'835
        'fs_random_quick_restart':     416          0         836        832              74         245'092
        'fs_random_quick_restart':     416          0         880        832              79         264'428
  'fs_random_quick_restart_no_lp':     448         20       2'147      1'696           1'280         798'343
                 'lb_tree_search':     507      3'326  15'612'368  3'402'049      60'344'954  21'883'124'022
                         'max_lp':   4'306    604'146   8'643'983  1'164'617     499'482'634  16'400'973'748
                          'no_lp':   8'812    854'518   6'635'661    574'474   1'137'022'146  15'554'542'354
            'objective_lb_search':   1'855    374'372   9'882'867  3'142'075     105'910'370  14'372'195'608
     'objective_lb_search_max_lp':   1'512    511'049   9'958'409  1'966'023     277'396'166  16'633'521'014
      'objective_lb_search_no_lp':   1'204    570'204   4'765'811  1'393'758      68'603'026  14'443'164'373
                        'probing':  10'129      8'742      70'676     41'571       5'629'785      90'423'307
                 'probing_max_lp':  10'129      8'735      51'693     32'079       4'990'894      83'909'947
                   'pseudo_costs':   7'219    656'683  16'928'281  1'522'764     640'357'955  16'279'942'729
                  'quick_restart':  21'373    280'178  16'276'558    338'650   2'253'469'540  12'203'090'010
            'quick_restart_no_lp':  26'997    902'218   9'947'891    177'936   3'789'241'413  17'175'561'183
                  'reduced_costs':  78'441    804'113   9'238'561    314'662   9'771'565'658  16'395'827'209

SAT stats                           ClassicMinim  LitRemoved   LitLearned  LitForgotten  Subsumed   MClauses  MDecisions  MLitTrue  MSubsumed  MLitRemoved  MReused
                           'core':     2'540'383  64'722'992   63'576'210    42'199'017     2'410     11'726      59'176         0        450        1'798      277
                     'default_lp':       809'018   8'779'187   35'419'117    30'231'234     2'266    139'441   1'149'600         0     14'479      115'637   23'554
                          'fixed':     5'264'370  24'100'365  283'470'960   282'879'106     1'125        254       2'255         0        169        1'530       13
                      'fs_random':             0           0            0             0         0          0           0         0          0            0        0
                      'fs_random':             0           0            2             0         0          0           0         0          0            0        0
                'fs_random_no_lp':             0           0            7             0         0          0           0         0          0            0        0
        'fs_random_quick_restart':             0           0            0             0         0          0           0         0          0            0        0
        'fs_random_quick_restart':             0           0            0             0         0          0           0         0          0            0        0
  'fs_random_quick_restart_no_lp':             0           0          126             0         0         36         184         0          0            0        2
                 'lb_tree_search':            30         117       11'489             0         0  1'389'295   7'131'687         0        538        2'166   89'053
                         'max_lp':       520'904   4'545'389   15'999'058    14'018'667     4'691    358'235   2'697'796         0      7'579       47'608   51'299
                          'no_lp':       783'870   7'929'612   29'588'100    27'497'729     3'999    110'716     860'426         0      8'409       56'656   21'563
            'objective_lb_search':       359'171   8'444'178   10'204'334     5'258'118     2'042  1'285'398   6'678'440         0        625        3'361  120'322
     'objective_lb_search_max_lp':       456'390   2'826'407    7'135'719     2'955'919     6'848    493'323   5'750'114         0      6'236       46'189  135'612
      'objective_lb_search_no_lp':       549'853  12'535'029   16'726'476    10'779'080     2'889    571'462   2'913'348         0        336        1'671   62'902
                        'probing':             0           0        8'742             0         0          0           0         0          0            0        0
                 'probing_max_lp':             0           0        8'735             0         0          0           0         0          0            0        0
                   'pseudo_costs':       579'408   4'692'648   20'664'027    18'929'731     2'436    472'561   3'291'165         0      2'905       15'183   66'687
                  'quick_restart':       209'015   2'142'470    8'893'855     7'167'327     4'198    127'789   1'649'367         4     32'394      321'618   26'496
            'quick_restart_no_lp':       708'246   8'844'144   32'429'541    28'381'949     5'201     48'831     558'834         1     28'753      296'426    5'273
                  'reduced_costs':       654'363   6'471'024   21'706'725    19'620'742     6'658    159'624   1'374'796         3     23'107      142'886   53'749

Lp stats                         Component  Iterations  AddedCuts    OPTIMAL    DUAL_F.  DUAL_U.
                  'default_lp':          1  10'856'558    512'979  1'915'062        136      115
                       'fixed':          1   2'406'653      3'384  4'587'597          0        0
                   'fs_random':          1       2'943        634         29          0        0
                   'fs_random':          1       3'685        590         39          0        0
     'fs_random_quick_restart':          1       2'046        569         17          0        0
     'fs_random_quick_restart':          1       6'611      1'115         85          1        0
              'lb_tree_search':          1  93'773'819    685'986    416'556  8'849'296        0
                      'max_lp':          1  21'922'804    468'036    336'811  1'994'199        7
         'objective_lb_search':          1  28'399'163    986'973  1'541'568      1'194        0
  'objective_lb_search_max_lp':          1  21'218'617     88'185     30'512  1'857'746        0
                     'probing':          1  13'426'224  1'655'898    194'861      3'872        1
              'probing_max_lp':          1   4'294'738    432'225    108'707     26'802        0
                'pseudo_costs':          1  20'118'857    966'290    965'297  1'585'730       18
               'quick_restart':          1  45'689'120  4'409'486  1'897'510     16'031       17
               'reduced_costs':          1  23'678'758    875'068    669'877  2'044'526       24

Lp dimension                                                                        Final dimension of first component
                  'default_lp':  4769 rows, 5189 columns, 17206 entries with magnitude in [3.232062e-03, 1.000000e+00]
                       'fixed':  4651 rows, 5189 columns, 16725 entries with magnitude in [3.232062e-03, 1.000000e+00]
                   'fs_random':   1576 rows, 5189 columns, 6425 entries with magnitude in [3.232062e-03, 1.000000e+00]
                   'fs_random':   1876 rows, 5189 columns, 7499 entries with magnitude in [3.232062e-03, 1.000000e+00]
     'fs_random_quick_restart':   1276 rows, 5189 columns, 5404 entries with magnitude in [3.232062e-03, 1.000000e+00]
     'fs_random_quick_restart':  3026 rows, 5189 columns, 11482 entries with magnitude in [3.232062e-03, 1.000000e+00]
              'lb_tree_search':  7657 rows, 5226 columns, 33575 entries with magnitude in [2.582638e-04, 1.000000e+00]
                      'max_lp':  6164 rows, 5226 columns, 25232 entries with magnitude in [4.866377e-04, 1.000000e+00]
         'objective_lb_search':  5244 rows, 5189 columns, 19421 entries with magnitude in [7.026363e-03, 1.000000e+00]
  'objective_lb_search_max_lp':  7809 rows, 5226 columns, 35105 entries with magnitude in [4.293217e-04, 1.000000e+00]
                     'probing':  7086 rows, 5189 columns, 39154 entries with magnitude in [4.752323e-05, 1.000000e+00]
              'probing_max_lp':  6586 rows, 5226 columns, 35358 entries with magnitude in [1.068446e-03, 1.000000e+00]
                'pseudo_costs':  4923 rows, 5226 columns, 17732 entries with magnitude in [3.232062e-03, 1.000000e+00]
               'quick_restart':  5846 rows, 5189 columns, 23056 entries with magnitude in [1.016933e-03, 1.000000e+00]
               'reduced_costs':  5225 rows, 5226 columns, 19890 entries with magnitude in [1.867139e-03, 1.000000e+00]

Lp debug                         CutPropag  CutEqPropag     Adjust  Overflow            Bad  BadScaling
                  'default_lp':         33           47     91'414         0     13'361'921           0
                       'fixed':          0            0          0         0         59'915           0
                   'fs_random':          0            0          0         0          4'064           0
                   'fs_random':          0            0          0         0          4'065           0
     'fs_random_quick_restart':          0            0          0         0          3'095           0
     'fs_random_quick_restart':          0            0          0         0          4'064           0
              'lb_tree_search':         26          252  9'240'753         0     74'232'856           0
                      'max_lp':         47          104  1'164'559         0     21'799'658           0
         'objective_lb_search':         12          378    732'826         0     33'020'998           0
  'objective_lb_search_max_lp':         10           37  1'870'496         0     17'516'901           0
                     'probing':      1'063        5'864    197'110         0  2'741'199'682           0
              'probing_max_lp':        135        1'747    135'508         0  1'846'375'026           0
                'pseudo_costs':        259          224  1'267'517         0     45'779'820           0
               'quick_restart':        214        1'098    958'349         0    242'660'661           0
               'reduced_costs':        215          178  2'014'495         0     47'664'425           0

Lp pool                          Constraints  Updates  Simplif  Merged  Shortened      Split  Strenghtened            Cuts/Call
                  'default_lp':       16'104    2'219   10'011      64          0     36'028        44'890    512'979/1'650'039
                       'fixed':        9'573        5        0       0          0          4           709         3'384/14'976
                   'fs_random':        6'779        0        0       0          0          0           625            590/2'249
                   'fs_random':        6'823        0        0       0          0          0           623            634/1'996
     'fs_random_quick_restart':        6'758        0        0       0          0          0           623            569/1'716
     'fs_random_quick_restart':        7'304        0        0       0          0          0           621          1'115/3'156
              'lb_tree_search':       67'457    6'373  441'012      23          0    439'686       565'344    685'986/1'420'617
                      'max_lp':       66'501    2'471  284'585      29          0    159'428       353'337      468'036/940'670
         'objective_lb_search':       16'138    6'436   17'640      24          0    174'607        79'232    986'973/3'111'483
  'objective_lb_search_max_lp':       66'656    1'921  442'118      23          0    205'765       456'059       88'185/179'071
                     'probing':       16'083  168'323   21'911       4          0  4'418'847       256'068  1'655'898/2'894'787
              'probing_max_lp':       66'705   63'444  376'856      14          0    722'628       439'198      432'225/997'242
                'pseudo_costs':       66'749    5'137  404'857      35          0    365'980       550'096    966'290/1'940'630
               'quick_restart':       15'619   24'772   15'123      56          0  2'293'445       282'353  4'409'486/9'655'970
               'reduced_costs':       66'524    5'421  391'361      38          0    574'772       517'059    875'068/1'748'115

Lp Cut                                                      fs_ran  fs_ran  fs_ran  fs_ran   defaul  fixed   max_lp     quick_   reduce   pseudo   lb_tre   probin   object   probin  object
                                                    CG_FF:      45      35      45      45   27'338    167   24'559     84'236   50'877   59'879   25'110   33'013   27'821    2'949   3'012
                                                     CG_K:      29      27      29      29   20'027    155   24'786     55'173   54'722   64'957   25'071   16'805   19'448    1'919   2'866
                                                    CG_KL:       -       -       -       -      130      -       18        278       91      106       11      175      122        -       3
                                                     CG_R:      30      25      30      30   12'431     82   11'610     46'517   22'482   29'528   10'554   25'507   13'732    1'606   1'212
                                                    CG_RB:      13       9      13      13   57'952    288   76'624    186'887  128'478  158'752  123'486  164'117  138'834    5'792   8'936
                                                   CG_RBP:       6       3       6       6    5'455     22    7'476     18'569   15'131   18'842   10'907    8'316   10'992      547   1'041
                                                   Clique:       -       -       -       -        -      -    7'389          -   14'928   18'622    4'620        -        -    1'567     537
                                                       IB:     156     726     128     187  216'920  1'722  133'201  2'882'089  215'663  225'521  142'433  410'160  548'851   66'824  23'173
                                                 MIR_1_FF:     107      98     107     107   20'360    218   20'067    127'116   42'885   45'340   28'503   91'596   26'579   18'905   4'358
                                                  MIR_1_K:      31      28      31      30    2'480     38    2'287     20'679    5'131    5'058    5'006    9'548    3'276    2'081     568
                                                 MIR_1_KL:       -       -       -       -      630      -      507      3'507      751      454      529    4'246      716    2'304      48
                                                  MIR_1_R:      35      33      35      35    3'905     67    2'333     25'508    5'910    6'378    3'103   35'247    4'028    2'878     398
                                                 MIR_1_RB:      31      29      31      31   30'928    151   43'114    198'173   86'368   83'326   85'529  147'665   37'841   48'152  10'937
                                                MIR_1_RBP:       -       -       -       -    1'800      7   12'322     13'340   23'623   21'271   21'052    8'511    3'109    3'849   2'400
                                                MIR_1_RLT:       -       -       -       -        -      -      507          -      987    1'212      477        -        -      626      77
                                                 MIR_2_FF:      17      17      19      23   13'833     74    9'681     75'644   21'260   25'851   13'974   41'607   16'218   11'286   2'233
                                                  MIR_2_K:      19      15      22      17    2'327     20    1'636     12'512    3'536    3'801    2'963    5'287    2'578    1'722     348
                                                 MIR_2_KL:       -       -       -       -      383      -      371      3'326      578      318      493    3'964      593    1'924      40
                                                  MIR_2_R:       4       4       3       4    2'936     15    1'836     13'883    4'309    4'570    3'108   26'251    3'214    6'039     580
                                                 MIR_2_RB:      35      30      40      44   20'189    103   15'725    127'876   32'616   36'207   31'703  103'059   24'509   22'686   3'726
                                                MIR_2_RBP:       1       -       -       -    1'541      2    2'930     10'497    5'773    6'616    5'377    8'090    2'533    2'443     613
                                                 MIR_3_FF:       2       2       2       -    8'931     29    5'857     50'485   12'980   16'096    8'728   26'375   10'667    5'344   1'188
                                                  MIR_3_K:       2       5       5       4    1'758     10    1'283      9'408    2'924    3'118    2'859    3'944    1'991    1'385     258
                                                 MIR_3_KL:       -       -       -       -      360      -      249      3'355      558      244      479    3'445      617    1'555      53
                                                  MIR_3_R:       1       -       -       -    1'784      7    1'187      9'555    2'545    2'791    2'201   17'798    2'106    3'442     422
                                                 MIR_3_RB:       9       9       8      10   11'889     53    8'920     77'969   17'956   20'317   18'695   72'915   15'173   13'144   2'082
                                                MIR_3_RBP:       -       -       -       -      890      1    1'377      6'901    2'878    3'089    2'831    5'401    1'819    1'204     308
                                                 MIR_4_FF:       -       1       -       -    5'360     21    3'160     34'545    7'065    9'146    4'836   19'424    7'103    2'771     636
                                                  MIR_4_K:       2       1       -       1    1'196      5      768      6'814    1'587    1'786    1'489    3'505    1'569      878     128
                                                 MIR_4_KL:       -       -       -       -      251      -      207      3'176      398      238      424    3'601      483    1'306      39
                                                  MIR_4_R:       -       -       -       -      963      5      564      6'209    1'105    1'166    1'312   12'388    1'490    1'220     213
                                                 MIR_4_RB:       1       2       -       2    7'517     30    4'810     50'343    9'605   10'768    9'639   53'081    9'915    6'956   1'071
                                                MIR_4_RBP:       -       -       -       -      465      -      673      4'811    1'379    1'400    1'537    3'849    1'107      986     167
                                                 MIR_5_FF:       1       1       1       1    3'404      9    1'830     22'918    4'006    5'052    3'019   13'685    4'776    1'710     313
                                                  MIR_5_K:       -       -       -       -      859      1      469      5'074      917    1'021      901    2'398    1'171      684      75
                                                 MIR_5_KL:       -       -       -       -      253      -      185      3'269      485      264      503    4'386      489    1'337      77
                                                  MIR_5_R:       -       -       -       -      629      -      320      4'304      623      561      857    7'430    1'190      677     107
                                                 MIR_5_RB:       2       3       3       2    4'868     18    2'807     32'802    5'277    5'935    5'515   38'314    6'766    3'936     521
                                                MIR_5_RBP:       -       -       -       -      310      3      385      3'544      823      772    1'065    3'365      793      548      95
                                                 MIR_6_FF:       -       -       -       -    2'158      3    1'034     15'530    2'426    2'884    1'852   10'977    3'071    1'173     219
                                                  MIR_6_K:       -       1       1       -      511      5      284      4'574      593      566      651    2'845      835      657      63
                                                 MIR_6_KL:       -       -       -       -      273      -      251      4'336      576      325      682    8'193      661    1'652     104
                                                  MIR_6_R:       -       -       -       -      406      1      176      3'183      371      336      507    5'166      737      436      62
                                                 MIR_6_RB:       1       2       3       1    3'117     14    1'691     23'296    3'287    3'498    3'336   32'630    4'674    2'793     326
                                                MIR_6_RBP:       -       -       -       -      236      -      244      3'896      570      424      908    3'846      749      533      92
         NoOverlapCompletionTimeExhaustiveMirror_weighted:       -       -       -       -        -      -        1          -        8        6        -        -        -        -       -
  NoOverlapCompletionTimeExhaustiveMirror_weighted_lifted:       -       -       -       -        -      -        -          -        -        2        -        -        -        -       -
               NoOverlapCompletionTimeExhaustive_weighted:       -       -       -       -        -      -      126          -      332      226      186        -        -        4      25
        NoOverlapCompletionTimeExhaustive_weighted_lifted:       -       -       -       -        -      -      703          -    1'697    2'401      351        -        -        5      74
                          NoOverlapCompletionTimeQueyrane:       -       -       -       -        -      -      152          -      384      346       60        -        -        8      29
                   NoOverlapCompletionTimeQueyrane_lifted:       -       -       -       -        -      -      590          -    1'494    1'549      279        -        -        5      64
                                NoOverlapDisjunctionOnEnd:       -       -       -       -        -      -       22          -       75       39        2        -        -        -       4
                              NoOverlapDisjunctionOnStart:       -       -       -       -        -      -      493          -    1'139    2'154        5        -        -        5      20
                                             ZERO_HALF_FF:       4       5       4       5    3'754     13    3'907     17'219    8'155    9'433    4'144    9'179    4'170      890     544
                                              ZERO_HALF_K:       2       1       1       3    1'013      2    1'991      4'527    4'933    5'105    3'468    1'793    1'161      355     325
                                             ZERO_HALF_KL:       -       -       -       -       29      -        3         57        5        1        2        8       24        2       -
                                              ZERO_HALF_R:       3       3       2       4    3'489      6    9'922     54'477   17'312   13'667   33'922   96'199    7'549  146'982   8'496
                                             ZERO_HALF_RB:       1       -       -       -    4'023     16    9'446     28'306   17'356   16'921   19'422   32'028    7'475   11'497   2'115
                                            ZERO_HALF_RBP:       -       -       -       -      718      1    2'970      8'793    5'145    6'034    5'310   14'566    1'648   10'046     764

LNS stats                        Improv/Calls  Closed  Difficulty  TimeLimit
               'graph_arc_lns':    8670/22994     50%        1.00       0.10
               'graph_cst_lns':    9418/22993     50%        1.00       0.10
               'graph_dec_lns':    8915/22994     50%        1.00       0.10
               'graph_var_lns':    9708/22994     50%        1.00       0.10
                   'rins/rens':    2353/21564     50%        0.93       0.14
                 'rnd_cst_lns':    9261/22994     50%        1.00       0.10
                 'rnd_var_lns':    8894/22994     50%        1.00       0.10
    'scheduling_intervals_lns':   22993/22993      0%        0.00       0.10
  'scheduling_precedences_lns':   22994/22994      0%        0.00       0.10
  'scheduling_time_window_lns':   22993/22993      0%        0.00       0.10

LS stats                   Batches  Restarts     LinMoves    GenMoves  CompoundMoves  WeightUpdates
       'fj_long_default':       12         1      119'785           0              0            215
   'fj_long_lin_default':        9         1            0      13'835          2'064              1
        'fj_long_random':       12         1      119'781           0              0            219
      'fj_short_default':       17         1            0      22'854          3'751              0
  'fj_short_lin_default':       13         1            0      20'846          2'252              1
   'fj_short_lin_random':        8         1            0      10'292          1'784              0
       'fj_short_random':        5         1            0       8'403          1'329              0
          'violation_ls':   22'996         0  107'994'780  14'362'477        559'929      1'862'035
          'violation_ls':   22'996         0  113'176'546  13'557'553        510'241      1'976'228

Solutions (137)           Num      Rank
        'graph_arc_lns':    7  [19,109]
        'graph_cst_lns':   10  [29,108]
        'graph_dec_lns':   10  [11,106]
        'graph_var_lns':    7   [9,103]
        'quick_restart':    1   [90,90]
  'quick_restart_no_lp':   19   [1,136]
          'rins_lp_lns':   19   [8,128]
        'rins_pump_lns':    4  [21,129]
          'rnd_cst_lns':    8  [25,130]
          'rnd_var_lns':   15  [15,137]
         'violation_ls':   37   [2,135]

Objective bounds                      Num
                   'initial_domain':    1
                   'lb_tree_search':    9
                           'max_lp':    2
              'objective_lb_search':    1
       'objective_lb_search_max_lp':   63
        'objective_lb_search_no_lp':    1
  'objective_shaving_search_max_lp':    2
   'objective_shaving_search_no_lp':    2
              'quick_restart_no_lp':    1
                    'reduced_costs':    3

Solution repositories      Added  Queried  Ignored  Synchro
  'feasible solutions':  102'529  523'193        0  101'181
        'lp solutions':   42'718   11'497        0   41'967
                'pump':  138'125   11'499

Improving bounds shared             Num
                  'default_lp':     411
              'lb_tree_search':     241
                      'max_lp':     115
                       'no_lp':      11
         'objective_lb_search':      14
  'objective_lb_search_max_lp':       8
                     'probing':  63'533
              'probing_max_lp':  14'207
                'pseudo_costs':     302
               'quick_restart':     671
         'quick_restart_no_lp':   1'829
               'reduced_costs':   1'016

Clauses shared                      Num
                           'core':    2
                     'default_lp':   26
  'fs_random_quick_restart_no_lp':    1
                 'lb_tree_search':   14
                         'max_lp':   23
                          'no_lp':    7
            'objective_lb_search':    7
     'objective_lb_search_max_lp':    6
      'objective_lb_search_no_lp':    6
                   'pseudo_costs':   54
                  'quick_restart':   30
            'quick_restart_no_lp':   60
                  'reduced_costs':    9

CpSolverResponse summary:
status: FEASIBLE
objective: 5275
best_bound: 2963
integers: 5218
booleans: 416
conflicts: 0
branches: 848
propagations: 74
integer_propagations: 245926
restarts: 832
lp_iterations: 3685
walltime: 86402.3
usertime: 86402.3
deterministic_time: 239647
gap_integral: 1.85836e+06
solution_fingerprint: 0x571f01de38a1b090


--- Simulation Gantt  partir du modle mathmatique ---
