created virtual environment CPython3.12.4.final.0-64 in 5994ms
  creator CPython3Posix(dest=/localscratch/aneumann.63393191.0/env, clear=False, no_vcs_ignore=False, global=False)
  seeder FromAppData(download=False, pip=bundle, via=copy, app_data_dir=/home/aneumann/.local/share/virtualenv)
    added seed packages: pip==25.1.1
  activators BashActivator,CShellActivator,FishActivator,NushellActivator,PowerShellActivator,PythonActivator
Looking in links: /cvmfs/soft.computecanada.ca/custom/python/wheelhouse/gentoo2023/x86-64-v3, /cvmfs/soft.computecanada.ca/custom/python/wheelhouse/gentoo2023/generic, /cvmfs/soft.computecanada.ca/custom/python/wheelhouse/generic
Requirement already satisfied: pip in /localscratch/aneumann.63393191.0/env/lib/python3.12/site-packages (25.1.1)
Looking in links: /cvmfs/soft.computecanada.ca/custom/python/wheelhouse/gentoo2023/x86-64-v3, /cvmfs/soft.computecanada.ca/custom/python/wheelhouse/gentoo2023/generic, /cvmfs/soft.computecanada.ca/custom/python/wheelhouse/generic
ERROR: protobuf-5.28.3-cp38-abi3-manylinux2014_x86_64.whl is not a supported wheel on this platform.
Looking in links: /cvmfs/soft.computecanada.ca/custom/python/wheelhouse/gentoo2023/x86-64-v3, /cvmfs/soft.computecanada.ca/custom/python/wheelhouse/gentoo2023/generic, /cvmfs/soft.computecanada.ca/custom/python/wheelhouse/generic
Processing /home/aneumann/projects/def-adhaj/aneumann/GNRS/wheels/immutabledict-4.2.0-py3-none-any.whl
Installing collected packages: immutabledict
Successfully installed immutabledict-4.2.0
Looking in links: /cvmfs/soft.computecanada.ca/custom/python/wheelhouse/gentoo2023/x86-64-v3, /cvmfs/soft.computecanada.ca/custom/python/wheelhouse/gentoo2023/generic, /cvmfs/soft.computecanada.ca/custom/python/wheelhouse/generic
Processing /cvmfs/soft.computecanada.ca/custom/python/wheelhouse/generic/ortools-9.10.4067+computecanada-cp312-cp312-linux_x86_64.whl (from -r /home/aneumann/projects/def-adhaj/aneumann/GNRS/requirements/or.txt (line 1))
Processing /cvmfs/soft.computecanada.ca/custom/python/wheelhouse/gentoo2023/x86-64-v3/matplotlib-3.10.0+computecanada-cp312-cp312-linux_x86_64.whl (from -r /home/aneumann/projects/def-adhaj/aneumann/GNRS/requirements/or.txt (line 2))
Processing /cvmfs/soft.computecanada.ca/custom/python/wheelhouse/gentoo2023/x86-64-v3/pandas-2.2.3+computecanada-cp312-cp312-linux_x86_64.whl (from -r /home/aneumann/projects/def-adhaj/aneumann/GNRS/requirements/or.txt (line 3))
Processing /cvmfs/soft.computecanada.ca/custom/python/wheelhouse/generic/absl_py-2.2.2+computecanada-py3-none-any.whl (from ortools<9.11,>=9.10->-r /home/aneumann/projects/def-adhaj/aneumann/GNRS/requirements/or.txt (line 1))
Processing /cvmfs/soft.computecanada.ca/custom/python/wheelhouse/gentoo2023/generic/numpy-2.2.2+computecanada-cp312-cp312-linux_x86_64.whl (from ortools<9.11,>=9.10->-r /home/aneumann/projects/def-adhaj/aneumann/GNRS/requirements/or.txt (line 1))
Processing /cvmfs/soft.computecanada.ca/custom/python/wheelhouse/gentoo2023/x86-64-v3/protobuf-6.30.2+computecanada-cp312-cp312-linux_x86_64.whl (from ortools<9.11,>=9.10->-r /home/aneumann/projects/def-adhaj/aneumann/GNRS/requirements/or.txt (line 1))
Requirement already satisfied: immutabledict>=3.0.0 in /localscratch/aneumann.63393191.0/env/lib/python3.12/site-packages (from ortools<9.11,>=9.10->-r /home/aneumann/projects/def-adhaj/aneumann/GNRS/requirements/or.txt (line 1)) (4.2.0)
Processing /cvmfs/soft.computecanada.ca/custom/python/wheelhouse/gentoo2023/generic/contourpy-1.3.1+computecanada-cp312-cp312-linux_x86_64.whl (from matplotlib->-r /home/aneumann/projects/def-adhaj/aneumann/GNRS/requirements/or.txt (line 2))
Processing /cvmfs/soft.computecanada.ca/custom/python/wheelhouse/generic/cycler-0.12.1+computecanada-py3-none-any.whl (from matplotlib->-r /home/aneumann/projects/def-adhaj/aneumann/GNRS/requirements/or.txt (line 2))
Processing /cvmfs/soft.computecanada.ca/custom/python/wheelhouse/generic/fonttools-4.58.2+computecanada-cp312-cp312-linux_x86_64.whl (from matplotlib->-r /home/aneumann/projects/def-adhaj/aneumann/GNRS/requirements/or.txt (line 2))
Processing /cvmfs/soft.computecanada.ca/custom/python/wheelhouse/gentoo2023/x86-64-v3/kiwisolver-1.4.8+computecanada-cp312-cp312-linux_x86_64.whl (from matplotlib->-r /home/aneumann/projects/def-adhaj/aneumann/GNRS/requirements/or.txt (line 2))
Processing /cvmfs/soft.computecanada.ca/custom/python/wheelhouse/generic/packaging-25.0+computecanada-py3-none-any.whl (from matplotlib->-r /home/aneumann/projects/def-adhaj/aneumann/GNRS/requirements/or.txt (line 2))
Processing /cvmfs/soft.computecanada.ca/custom/python/wheelhouse/gentoo2023/x86-64-v3/pillow-11.1.0+computecanada-cp312-cp312-linux_x86_64.whl (from matplotlib->-r /home/aneumann/projects/def-adhaj/aneumann/GNRS/requirements/or.txt (line 2))
Processing /cvmfs/soft.computecanada.ca/custom/python/wheelhouse/generic/pyparsing-3.2.1+computecanada-py3-none-any.whl (from matplotlib->-r /home/aneumann/projects/def-adhaj/aneumann/GNRS/requirements/or.txt (line 2))
Processing /cvmfs/soft.computecanada.ca/custom/python/wheelhouse/generic/python_dateutil-2.9.0.post0+computecanada-py2.py3-none-any.whl (from matplotlib->-r /home/aneumann/projects/def-adhaj/aneumann/GNRS/requirements/or.txt (line 2))
Processing /cvmfs/soft.computecanada.ca/custom/python/wheelhouse/generic/pytz-2025.2+computecanada-py2.py3-none-any.whl (from pandas->-r /home/aneumann/projects/def-adhaj/aneumann/GNRS/requirements/or.txt (line 3))
Processing /cvmfs/soft.computecanada.ca/custom/python/wheelhouse/generic/tzdata-2025.2+computecanada-py2.py3-none-any.whl (from pandas->-r /home/aneumann/projects/def-adhaj/aneumann/GNRS/requirements/or.txt (line 3))
Processing /cvmfs/soft.computecanada.ca/custom/python/wheelhouse/generic/six-1.17.0+computecanada-py2.py3-none-any.whl (from python-dateutil>=2.7->matplotlib->-r /home/aneumann/projects/def-adhaj/aneumann/GNRS/requirements/or.txt (line 2))
Installing collected packages: pytz, tzdata, six, pyparsing, protobuf, pillow, packaging, numpy, kiwisolver, fonttools, cycler, absl-py, python-dateutil, contourpy, pandas, matplotlib, ortools

Successfully installed absl-py-2.2.2+computecanada contourpy-1.3.1+computecanada cycler-0.12.1+computecanada fonttools-4.58.2+computecanada kiwisolver-1.4.8+computecanada matplotlib-3.10.0+computecanada numpy-2.2.2+computecanada ortools-9.10.4067+computecanada packaging-25.0+computecanada pandas-2.2.3+computecanada pillow-11.1.0+computecanada protobuf-6.30.2+computecanada pyparsing-3.2.1+computecanada python-dateutil-2.9.0.post0+computecanada pytz-2025.2+computecanada six-1.17.0+computecanada tzdata-2025.2+computecanada

Starting CP-SAT solver v9.10.4067
Parameters: max_time_in_seconds: 3600 max_memory_in_mb: 12000 log_search_progress: true enumerate_all_solutions: false absolute_gap_limit: 0 relative_gap_limit: 0
Setting number of workers to 48

Initial optimization model '': (model_fingerprint: 0xf0eae743375166d9)
#Variables: 294 (#ints: 8 in objective)
  - 207 Booleans in [0,1]
  - 87 in [0,579]
#kLinear1: 40
#kLinear2: 491
#kLinear3: 155
#kLinearN: 2'357 (#terms: 33'589)

Starting presolve at 0.00s
  1.82e-03s  0.00e+00d  [DetectDominanceRelations] 
  3.92e-02s  0.00e+00d  [PresolveToFixPoint] #num_loops=6 #num_dual_strengthening=3 
  2.70e-05s  0.00e+00d  [ExtractEncodingFromLinear] #potential_supersets=2 
[Symmetry] Graph for symmetry has 3'017 nodes and 26'090 arcs.
[Symmetry] Symmetry computation done. time: 0.00242279 dtime: 0.00247037
[Symmetry] #generators: 1, average support size: 18
[Symmetry] The model contains 295 duplicate constraints !
[Symmetry] 9 orbits with sizes: 2,2,2,2,2,2,2,2,2
[Symmetry] Num fixable by intersecting at_most_one with orbits: 1 largest_orbit: 2
  1.03e-02s  1.41e-03d  [Probe] #probed=286 #fixed_bools=4 #new_bounds=28 #equiv=1 
  4.16e-05s  0.00e+00d  [MaxClique] Merged 13(26 literals) into 6(12 literals) at_most_ones. 
  1.77e-03s  0.00e+00d  [DetectDominanceRelations] 
  2.20e-02s  0.00e+00d  [PresolveToFixPoint] #num_loops=4 #num_dual_strengthening=3 
  6.38e-03s  0.00e+00d  [ProcessAtMostOneAndLinear] 
  2.78e-03s  0.00e+00d  [DetectDuplicateConstraints] #duplicates=345 #without_enforcements=97 
  2.30e-03s  1.17e-04d  [DetectDominatedLinearConstraints] #relevant_constraints=1'895 #num_inclusions=1'127 
  3.36e-04s  0.00e+00d  [DetectDifferentVariables] #different=33 
  5.88e-04s  3.35e-05d  [ProcessSetPPC] #relevant_constraints=1'533 
  2.16e-05s  0.00e+00d  [FindAlmostIdenticalLinearConstraints] 
  8.72e-05s  7.05e-05d  [FindBigAtMostOneAndLinearOverlap] 
  8.75e-03s  2.37e-03d  [FindBigVerticalLinearOverlap] #blocks=67 #saved_nz=6'008 
  2.83e-04s  6.69e-05d  [FindBigHorizontalLinearOverlap] #linears=1'416 
  1.36e-05s  0.00e+00d  [MergeClauses] 
  1.68e-03s  0.00e+00d  [DetectDominanceRelations] 
  2.68e-02s  0.00e+00d  [PresolveToFixPoint] #num_loops=2 #num_dual_strengthening=1 
  1.68e-03s  0.00e+00d  [DetectDominanceRelations] 
  1.41e-02s  0.00e+00d  [PresolveToFixPoint] #num_loops=1 #num_dual_strengthening=1 
[Symmetry] Graph for symmetry has 2'820 nodes and 18'833 arcs.
[Symmetry] Symmetry computation done. time: 0.000849532 dtime: 0.00122097
  9.99e-03s  1.39e-03d  [Probe] #probed=278 #new_bounds=63 
  1.29e-05s  0.00e+00d  [MaxClique] 
  1.67e-03s  0.00e+00d  [DetectDominanceRelations] 
  2.43e-02s  0.00e+00d  [PresolveToFixPoint] #num_loops=2 #num_dual_strengthening=1 
  4.82e-03s  0.00e+00d  [ProcessAtMostOneAndLinear] 
  2.32e-03s  0.00e+00d  [DetectDuplicateConstraints] #without_enforcements=133 
  9.36e-04s  4.43e-05d  [DetectDominatedLinearConstraints] #relevant_constraints=1'500 #num_inclusions=41 
  3.27e-04s  0.00e+00d  [DetectDifferentVariables] #different=45 
  4.20e-04s  1.76e-05d  [ProcessSetPPC] #relevant_constraints=1'166 
  4.05e-05s  3.35e-07d  [FindAlmostIdenticalLinearConstraints] #num_tested_pairs=21 
  4.82e-05s  2.26e-05d  [FindBigAtMostOneAndLinearOverlap] 
  2.96e-03s  1.19e-03d  [FindBigVerticalLinearOverlap] #blocks=25 #saved_nz=1'770 
  2.15e-04s  4.32e-05d  [FindBigHorizontalLinearOverlap] #linears=990 
  1.27e-05s  0.00e+00d  [MergeClauses] 
  1.54e-03s  0.00e+00d  [DetectDominanceRelations] 
  1.71e-02s  0.00e+00d  [PresolveToFixPoint] #num_loops=2 #num_dual_strengthening=1 
  1.53e-03s  0.00e+00d  [DetectDominanceRelations] 
  1.37e-02s  0.00e+00d  [PresolveToFixPoint] #num_loops=1 #num_dual_strengthening=1 
[Symmetry] Graph for symmetry has 2'878 nodes and 17'072 arcs.
[Symmetry] Symmetry computation done. time: 0.000817527 dtime: 0.00111552
  9.32e-03s  1.28e-03d  [Probe] #probed=278 #new_bounds=21 
  1.34e-05s  0.00e+00d  [MaxClique] 
  1.53e-03s  0.00e+00d  [DetectDominanceRelations] 
  1.76e-02s  0.00e+00d  [PresolveToFixPoint] #num_loops=2 #num_dual_strengthening=1 
  4.42e-03s  0.00e+00d  [ProcessAtMostOneAndLinear] 
  2.29e-03s  0.00e+00d  [DetectDuplicateConstraints] #without_enforcements=133 
  8.62e-04s  3.68e-05d  [DetectDominatedLinearConstraints] #relevant_constraints=1'498 #num_inclusions=40 
  3.31e-04s  0.00e+00d  [DetectDifferentVariables] #different=45 
  3.63e-04s  1.34e-05d  [ProcessSetPPC] #relevant_constraints=995 
  4.61e-05s  7.40e-07d  [FindAlmostIdenticalLinearConstraints] #num_tested_pairs=31 
  4.71e-05s  1.91e-05d  [FindBigAtMostOneAndLinearOverlap] 
  2.62e-03s  9.98e-04d  [FindBigVerticalLinearOverlap] #blocks=18 #saved_nz=1'402 
  1.86e-04s  3.37e-05d  [FindBigHorizontalLinearOverlap] #linears=848 
  1.28e-05s  0.00e+00d  [MergeClauses] 
  1.41e-03s  0.00e+00d  [DetectDominanceRelations] 
  1.53e-02s  0.00e+00d  [PresolveToFixPoint] #num_loops=3 #num_dual_strengthening=1 
  9.10e-05s  0.00e+00d  [ExpandObjective] #entries=522 #tight_variables=134 #tight_constraints=84 

Presolve summary:
  - 62 affine relations were detected.
  - rule 'TODO dual: only one blocking constraint?' was applied 611 times.
  - rule 'TODO dual: only one unspecified blocking constraint?' was applied 104 times.
  - rule 'TODO duplicate: identical constraint with different enforcements' was applied 363 times.
  - rule 'affine: new relation' was applied 62 times.
  - rule 'at_most_one: removed literals' was applied 6 times.
  - rule 'at_most_one: size one' was applied 6 times.
  - rule 'at_most_one: transformed into max clique.' was applied 1 time.
  - rule 'deductions: 284 stored' was applied 1 time.
  - rule 'dual: fix variable' was applied 21 times.
  - rule 'dual: reduced domain' was applied 45 times.
  - rule 'duplicate: merged rhs of linear constraint' was applied 50 times.
  - rule 'duplicate: removed constraint' was applied 345 times.
  - rule 'enforcement: false literal' was applied 26 times.
  - rule 'enforcement: true literal' was applied 20 times.
  - rule 'exactly_one: x and not(x)' was applied 1 time.
  - rule 'incompatible linear: add implication' was applied 30 times.
  - rule 'linear matrix: common vertical rectangle' was applied 110 times.
  - rule 'linear: always true' was applied 487 times.
  - rule 'linear: doubleton free' was applied 11 times.
  - rule 'linear: empty' was applied 32 times.
  - rule 'linear: extracted enforcement literal' was applied 5'418 times.
  - rule 'linear: fixed or dup variables' was applied 2'433 times.
  - rule 'linear: positive equal one' was applied 2 times.
  - rule 'linear: reduced variable domains' was applied 214 times.
  - rule 'linear: remapped using affine relations' was applied 2'373 times.
  - rule 'linear: simplified rhs' was applied 9'689 times.
  - rule 'linear: variable substitution 1' was applied 11 times.
  - rule 'linear: variable substitution 2' was applied 5 times.
  - rule 'presolve: 90 unused variables removed.' was applied 1 time.
  - rule 'presolve: iteration' was applied 3 times.
  - rule 'probing: reduced enforced constraint to implication.' was applied 13 times.
  - rule 'symmetry: fixed to false in general orbit' was applied 1 time.

Presolved optimization model '': (model_fingerprint: 0x291ca1b801545cee)
#Variables: 236 (#ints: 8 in objective)
  - 66 Booleans in [0,1]
  - 132 different domains in [-5122,5100] with a largest complexity of 13.
#kExactlyOne: 1 (#literals: 3)
#kLinear2: 731 (#enforced: 667 #multi: 528)
#kLinear3: 355 (#enforced: 268)
#kLinearN: 1'085 (#enforced: 1'005) (#terms: 7'683)

Preloading model.
#Bound   0.28s best:inf   next:[188,3791] initial_domain
[Symmetry] Graph for symmetry has 2'764 nodes and 15'688 arcs.
[Symmetry] Symmetry computation done. time: 0.000736696 dtime: 0.00103811
#Model   0.29s var:236/236 constraints:2172/2172

Starting search at 0.29s with 48 workers.
16 full problem subsolvers: [core, default_lp, lb_tree_search, max_lp, no_lp, objective_lb_search, objective_lb_search_max_lp, objective_lb_search_no_lp, objective_shaving_search_max_lp, objective_shaving_search_no_lp, probing, probing_max_lp, pseudo_costs, quick_restart, quick_restart_no_lp, reduced_costs]
30 first solution subsolvers: [fj_long_default(2), fj_long_lin_default, fj_long_lin_perturb, fj_long_lin_random, fj_long_perturb, fj_long_random, fj_short_default(2), fj_short_lin_default(2), fj_short_lin_perturb, fj_short_lin_random, fj_short_perturb, fj_short_random, fs_random(4), fs_random_no_lp(4), fs_random_quick_restart(4), fs_random_quick_restart_no_lp(3)]
13 incomplete subsolvers: [feasibility_pump, graph_arc_lns, graph_cst_lns, graph_dec_lns, graph_var_lns, rins/rens, rnd_cst_lns, rnd_var_lns, violation_ls(5)]
3 helper subsolvers: [neighborhood_helper, synchronization_agent, update_gap_integral]
#Bound   0.33s best:inf   next:[213,3791] objective_lb_search_no_lp
#Bound   0.34s best:inf   next:[216,3791] objective_lb_search_no_lp
#1       0.34s best:1777  next:[216,1776] no_lp (fixed_bools=0/88)
#2       0.34s best:1720  next:[216,1719] quick_restart_no_lp (fixed_bools=0/92)
#3       0.35s best:1637  next:[216,1636] no_lp (fixed_bools=0/95)
#4       0.36s best:1616  next:[216,1615] no_lp (fixed_bools=1/102)
#5       0.36s best:1585  next:[216,1584] no_lp (fixed_bools=1/104)
#6       0.37s best:1527  next:[216,1526] no_lp (fixed_bools=1/107)
#Bound   0.37s best:1527  next:[217,1526] objective_shaving_search_max_lp (vars=236 csts=2173)
#7       0.37s best:1155  next:[217,1154] objective_lb_search_no_lp (fixed_bools=2/98)
#Bound   0.37s best:1155  next:[222,1154] objective_lb_search_no_lp
#Bound   0.40s best:1155  next:[223,1154] objective_shaving_search_max_lp (vars=236 csts=2173)
#8       0.40s best:1145  next:[223,1144] rnd_cst_lns (d=0.91 s=95 t=0.10 p=1.00 stall=4 h=auto_l0) [hint]
#Bound   0.41s best:1145  next:[472,1144] objective_lb_search_no_lp
#9       0.41s best:1140  next:[472,1139] rnd_var_lns (d=0.94 s=94 t=0.10 p=1.00 stall=5 h=auto_l0) [presolve]
#Bound   0.45s best:1140  next:[476,1139] objective_lb_search_no_lp
#Bound   0.45s best:1140  next:[501,1139] objective_lb_search_no_lp
#10      0.45s best:1139  next:[501,1138] violation_ls(batch:2 #solutions_imported:2 #lin_moves:9'607 #lin_evals:37'732 #gen_moves:1'553 #gen_evals:0 #comp_moves:101 #backtracks:726 #weight_updates:419)
#11      0.45s best:1138  next:[501,1137] violation_ls(batch:3 #solutions_imported:3 #lin_moves:9'607 #lin_evals:37'737 #gen_moves:1'554 #gen_evals:0 #comp_moves:102 #backtracks:726 #weight_updates:419)
#12      0.46s best:1137  next:[501,1136] violation_ls(batch:4 #solutions_imported:4 #lin_moves:9'778 #lin_evals:38'515 #gen_moves:1'554 #gen_evals:0 #comp_moves:102 #backtracks:726 #weight_updates:559)
#13      0.46s best:1130  next:[501,1129] graph_var_lns (d=0.94 s=103 t=0.10 p=1.00 stall=5 h=auto_l0)
#14      0.46s best:1128  next:[501,1127] violation_ls(batch:3 #solutions_imported:3 #lin_moves:1 #lin_evals:28'044 #gen_moves:10'730 #gen_evals:0 #comp_moves:1'040 #backtracks:4'840 #weight_updates:107)
#15      0.47s best:1126  next:[501,1125] violation_ls(batch:4 #solutions_imported:4 #lin_moves:1 #lin_evals:31'381 #gen_moves:12'703 #gen_evals:0 #comp_moves:1'265 #backtracks:5'717 #weight_updates:128)
#16      0.48s best:1124  next:[501,1123] violation_ls(batch:3 #solutions_imported:3 #lin_moves:2 #lin_evals:28'029 #gen_moves:12'445 #gen_evals:0 #comp_moves:431 #backtracks:6'004 #weight_updates:145)
#17      0.48s best:1122  next:[501,1121] violation_ls(batch:4 #solutions_imported:4 #lin_moves:2 #lin_evals:28'032 #gen_moves:12'446 #gen_evals:0 #comp_moves:432 #backtracks:6'004 #weight_updates:145)
#18      0.48s best:1120  next:[501,1119] violation_ls(batch:5 #solutions_imported:5 #lin_moves:2 #lin_evals:28'069 #gen_moves:12'463 #gen_evals:0 #comp_moves:433 #backtracks:6'012 #weight_updates:145)
#19      0.48s best:1119  next:[501,1118] violation_ls(batch:8 #solutions_imported:8 #lin_moves:9'816 #lin_evals:38'698 #gen_moves:1'556 #gen_evals:0 #comp_moves:104 #backtracks:726 #weight_updates:577)
#20      0.48s best:1118  next:[501,1117] violation_ls(batch:7 #solutions_imported:7 #lin_moves:3 #lin_evals:27'769 #gen_moves:11'215 #gen_evals:0 #comp_moves:1'206 #backtracks:5'004 #weight_updates:114)
#21      0.48s best:1117  next:[501,1116] violation_ls(batch:7 #solutions_imported:7 #lin_moves:2 #lin_evals:28'170 #gen_moves:12'507 #gen_evals:0 #comp_moves:437 #backtracks:6'032 #weight_updates:145)
#22      0.48s best:1116  next:[501,1115] violation_ls(batch:8 #solutions_imported:8 #lin_moves:4 #lin_evals:27'777 #gen_moves:11'215 #gen_evals:0 #comp_moves:1'206 #backtracks:5'004 #weight_updates:114)
#23      0.49s best:1115  next:[501,1114] violation_ls(batch:9 #solutions_imported:9 #lin_moves:14 #lin_evals:27'829 #gen_moves:11'215 #gen_evals:0 #comp_moves:1'206 #backtracks:5'004 #weight_updates:119)
#24      0.49s best:1114  next:[501,1113] violation_ls(batch:10 #solutions_imported:10 #lin_moves:15 #lin_evals:27'837 #gen_moves:11'215 #gen_evals:0 #comp_moves:1'206 #backtracks:5'004 #weight_updates:119)
#25      0.49s best:1113  next:[501,1112] violation_ls(batch:12 #solutions_imported:12 #lin_moves:14 #lin_evals:31'510 #gen_moves:12'727 #gen_evals:0 #comp_moves:1'271 #backtracks:5'726 #weight_updates:134)
#26      0.49s best:1112  next:[501,1111] violation_ls(batch:12 #solutions_imported:12 #lin_moves:16 #lin_evals:28'276 #gen_moves:12'523 #gen_evals:0 #comp_moves:443 #backtracks:6'037 #weight_updates:151)
#27      0.49s best:1111  next:[501,1110] violation_ls(batch:13 #solutions_imported:13 #lin_moves:7 #lin_evals:28'157 #gen_moves:10'763 #gen_evals:0 #comp_moves:1'047 #backtracks:4'853 #weight_updates:108)
#28      0.49s best:1110  next:[501,1109] violation_ls(batch:14 #solutions_imported:14 #lin_moves:15 #lin_evals:31'521 #gen_moves:12'728 #gen_evals:0 #comp_moves:1'272 #backtracks:5'726 #weight_updates:134)
#29      0.50s best:1109  next:[501,1108] violation_ls(batch:14 #solutions_imported:14 #lin_moves:55 #lin_evals:28'092 #gen_moves:11'244 #gen_evals:0 #comp_moves:1'209 #backtracks:5'017 #weight_updates:139)
#30      0.50s best:1108  next:[501,1107] violation_ls(batch:14 #solutions_imported:14 #lin_moves:36 #lin_evals:28'430 #gen_moves:12'549 #gen_evals:0 #comp_moves:445 #backtracks:6'049 #weight_updates:161)
#31      0.50s best:1102  next:[501,1101] no_lp (fixed_bools=1/135)
#32      0.52s best:1095  next:[501,1094] no_lp (fixed_bools=1/137)
#33      0.55s best:1094  next:[501,1093] violation_ls(batch:15 #solutions_imported:15 #lin_moves:9'829 #lin_evals:43'772 #gen_moves:3'387 #gen_evals:0 #comp_moves:293 #backtracks:1'547 #weight_updates:619)
#34      0.58s best:1090  next:[501,1089] quick_restart_no_lp (fixed_bools=0/218)
#35      0.59s best:1089  next:[501,1088] quick_restart_no_lp (fixed_bools=0/233)
#36      0.60s best:1088  next:[501,1087] violation_ls(batch:16 #solutions_imported:16 #lin_moves:15 #lin_evals:45'921 #gen_moves:18'414 #gen_evals:0 #comp_moves:1'908 #backtracks:8'251 #weight_updates:197)
#37      0.60s best:1087  next:[501,1086] violation_ls(batch:16 #solutions_imported:16 #lin_moves:9'829 #lin_evals:43'828 #gen_moves:3'411 #gen_evals:0 #comp_moves:295 #backtracks:1'558 #weight_updates:619)
#38      0.61s best:1085  next:[501,1084] quick_restart_no_lp (fixed_bools=0/248)
#39      0.61s best:1078  next:[501,1077] rins_pump_lns (d=0.50 s=227 t=0.10 p=0.00 stall=0 h=auto_l0) [presolve]
#40      0.62s best:1076  next:[501,1075] graph_dec_lns (d=0.97 s=116 t=0.10 p=1.00 stall=0 h=auto_l0)
#41      0.65s best:1064  next:[501,1063] graph_dec_lns (d=0.98 s=224 t=0.10 p=1.00 stall=0 h=auto_l0)
#42      0.65s best:1063  next:[501,1062] violation_ls(batch:16 #solutions_imported:16 #lin_moves:9'935 #lin_evals:70'538 #gen_moves:12'549 #gen_evals:0 #comp_moves:445 #backtracks:6'049 #weight_updates:786)
#43      0.65s best:1062  next:[501,1061] violation_ls(batch:17 #solutions_imported:17 #lin_moves:9'935 #lin_evals:70'541 #gen_moves:12'550 #gen_evals:0 #comp_moves:446 #backtracks:6'049 #weight_updates:786)
#Bound   0.66s best:1062  next:[635,1061] objective_lb_search_no_lp
#44      0.66s best:1013  next:[635,1012] rnd_cst_lns (d=0.97 s=132 t=0.10 p=1.00 stall=1 h=auto_l0)
#45      0.85s best:963   next:[635,962]  graph_var_lns (d=0.99 s=230 t=0.10 p=1.00 stall=2 h=auto_l0)
#46      0.87s best:962   next:[635,961]  violation_ls(batch:18 #solutions_imported:18 #lin_moves:378 #lin_evals:76'207 #gen_moves:30'466 #gen_evals:0 #comp_moves:2'314 #backtracks:14'073 #weight_updates:583)
#Bound   0.88s best:962   next:[637,961]  objective_lb_search_no_lp
#Bound   0.89s best:962   next:[641,961]  objective_lb_search_no_lp
#47      0.89s best:961   next:[641,960]  quick_restart_no_lp (fixed_bools=7/294)
#48      0.90s best:960   next:[641,959]  violation_ls(batch:19 #solutions_imported:19 #lin_moves:379 #lin_evals:76'215 #gen_moves:30'466 #gen_evals:0 #comp_moves:2'314 #backtracks:14'073 #weight_updates:583)
#49      0.90s best:959   next:[641,958]  violation_ls(batch:19 #solutions_imported:19 #lin_moves:24'498 #lin_evals:106'172 #gen_moves:3'411 #gen_evals:0 #comp_moves:295 #backtracks:1'558 #weight_updates:5'954)
#50      0.90s best:958   next:[641,957]  violation_ls(batch:19 #solutions_imported:19 #lin_moves:9'935 #lin_evals:100'063 #gen_moves:23'614 #gen_evals:0 #comp_moves:860 #backtracks:11'372 #weight_updates:926)
#51      0.92s best:957   next:[641,956]  quick_restart_no_lp (fixed_bools=7/306)
#52      0.94s best:956   next:[641,955]  violation_ls(batch:19 #solutions_imported:19 #lin_moves:72 #lin_evals:106'964 #gen_moves:41'717 #gen_evals:0 #comp_moves:2'660 #backtracks:19'522 #weight_updates:540)
#Bound   0.96s best:956   next:[678,955]  objective_lb_search_no_lp
#53      0.98s best:955   next:[678,954]  quick_restart_no_lp (fixed_bools=7/320)
#54      1.00s best:954   next:[678,953]  quick_restart_no_lp (fixed_bools=7/321)
#55      1.00s best:953   next:[678,952]  quick_restart_no_lp (fixed_bools=7/321)
#56      1.27s best:927   next:[678,926]  rnd_cst_lns (d=0.99 s=240 t=0.10 p=1.00 stall=2 h=auto_l0)
#Bound   1.27s best:927   next:[680,926]  objective_lb_search_no_lp
#Bound   1.28s best:927   next:[682,926]  objective_lb_search_no_lp
#Bound   1.30s best:927   next:[686,926]  objective_lb_search_no_lp
#Bound   1.31s best:927   next:[713,926]  objective_lb_search_no_lp
#57      1.33s best:917   next:[713,916]  graph_dec_lns (d=1.00 s=277 t=0.10 p=1.00 stall=0 h=auto_l0)
#Bound   1.33s best:917   next:[715,916]  objective_lb_search_no_lp
#58      1.37s best:913   next:[715,912]  quick_restart_no_lp (fixed_bools=9/359)
#59      1.39s best:912   next:[715,911]  quick_restart_no_lp (fixed_bools=9/363)
#60      1.41s best:907   next:[715,906]  quick_restart_no_lp (fixed_bools=9/366)
#61      1.42s best:902   next:[715,901]  quick_restart_no_lp (fixed_bools=9/367)
#62      1.47s best:897   next:[715,896]  quick_restart_no_lp (fixed_bools=9/371)
#63      1.50s best:896   next:[715,895]  violation_ls(batch:21 #solutions_imported:21 #lin_moves:10'036 #lin_evals:116'327 #gen_moves:30'466 #gen_evals:0 #comp_moves:2'314 #backtracks:14'073 #weight_updates:1'037)
#Bound   1.52s best:896   next:[723,895]  objective_lb_search_no_lp
#64      1.52s best:895   next:[723,894]  violation_ls(batch:21 #solutions_imported:21 #lin_moves:29'517 #lin_evals:130'366 #gen_moves:3'411 #gen_evals:0 #comp_moves:295 #backtracks:1'558 #weight_updates:10'936)
#65      1.54s best:894   next:[723,893]  violation_ls(batch:21 #solutions_imported:21 #lin_moves:72 #lin_evals:137'303 #gen_moves:53'149 #gen_evals:0 #comp_moves:3'762 #backtracks:24'683 #weight_updates:647)
#66      1.54s best:893   next:[723,892]  violation_ls(batch:21 #solutions_imported:21 #lin_moves:9'935 #lin_evals:127'428 #gen_moves:33'496 #gen_evals:0 #comp_moves:1'300 #backtracks:16'092 #weight_updates:1'046)
#67      1.57s best:890   next:[723,889]  quick_restart_no_lp (fixed_bools=10/385)
#68      1.59s best:887   next:[723,886]  quick_restart_no_lp (fixed_bools=10/386)
#Bound   1.95s best:887   next:[737,886]  objective_lb_search_no_lp
#Bound   2.43s best:887   next:[754,886]  objective_lb_search_no_lp
#Bound   2.70s best:887   next:[755,886]  objective_lb_search_no_lp
#Bound   3.14s best:887   next:[757,886]  objective_lb_search_no_lp
#Bound   4.22s best:887   next:[758,886]  objective_lb_search_no_lp
#Bound   4.43s best:887   next:[770,886]  objective_lb_search
#Bound   4.99s best:887   next:[771,886]  objective_lb_search_no_lp [skipped_logs=0]
#Model   5.14s var:235/236 constraints:2108/2172
#Model   5.32s var:233/236 constraints:2043/2172
#Model   5.53s var:231/236 constraints:1979/2172
#Model   5.78s var:229/236 constraints:1913/2172
#Model   5.90s var:228/236 constraints:1893/2172
#Model   5.93s var:227/236 constraints:1881/2172
#Model   5.96s var:226/236 constraints:1817/2172
#Done    5.96s no_lp
#Done    5.96s core
#Model   5.97s var:220/236 constraints:1508/2172
#Bound   5.89s best:887   next:[814,886]  objective_lb_search_no_lp [skipped_logs=5]

Task timing                                  n [     min,      max]      avg      dev     time         n [     min,      max]      avg      dev    dtime
                             'core':         1 [   5.67s,    5.67s]    5.67s   0.00ns    5.67s         1 [   1.15s,    1.15s]    1.15s   0.00ns    1.15s
                       'default_lp':         1 [   5.67s,    5.67s]    5.67s   0.00ns    5.67s         1 [423.88ms, 423.88ms] 423.88ms   0.00ns 423.88ms
                 'feasibility_pump':        39 [ 22.60ms, 440.87ms] 134.52ms  66.38ms    5.25s        38 [ 12.49ms,  30.03ms]  13.01ms   2.80ms 494.36ms
                  'fj_long_default':         1 [136.03ms, 136.03ms] 136.03ms   0.00ns 136.03ms         1 [ 50.21ms,  50.21ms]  50.21ms   0.00ns  50.21ms
                  'fj_long_default':         1 [152.73ms, 152.73ms] 152.73ms   0.00ns 152.73ms         1 [ 54.38ms,  54.38ms]  54.38ms   0.00ns  54.38ms
              'fj_long_lin_default':         1 [126.75ms, 126.75ms] 126.75ms   0.00ns 126.75ms         1 [ 57.38ms,  57.38ms]  57.38ms   0.00ns  57.38ms
              'fj_long_lin_perturb':         1 [195.57ms, 195.57ms] 195.57ms   0.00ns 195.57ms         1 [ 83.09ms,  83.09ms]  83.09ms   0.00ns  83.09ms
               'fj_long_lin_random':         1 [158.33ms, 158.33ms] 158.33ms   0.00ns 158.33ms         1 [ 75.97ms,  75.97ms]  75.97ms   0.00ns  75.97ms
                  'fj_long_perturb':         1 [138.92ms, 138.92ms] 138.92ms   0.00ns 138.92ms         1 [ 55.49ms,  55.49ms]  55.49ms   0.00ns  55.49ms
                   'fj_long_random':         1 [130.44ms, 130.44ms] 130.44ms   0.00ns 130.44ms         1 [ 47.10ms,  47.10ms]  47.10ms   0.00ns  47.10ms
                 'fj_short_default':         1 [119.71ms, 119.71ms] 119.71ms   0.00ns 119.71ms         1 [ 55.44ms,  55.44ms]  55.44ms   0.00ns  55.44ms
                 'fj_short_default':         1 [157.64ms, 157.64ms] 157.64ms   0.00ns 157.64ms         1 [ 76.42ms,  76.42ms]  76.42ms   0.00ns  76.42ms
             'fj_short_lin_default':         1 [127.79ms, 127.79ms] 127.79ms   0.00ns 127.79ms         1 [ 55.04ms,  55.04ms]  55.04ms   0.00ns  55.04ms
             'fj_short_lin_default':         1 [206.11ms, 206.11ms] 206.11ms   0.00ns 206.11ms         1 [ 56.57ms,  56.57ms]  56.57ms   0.00ns  56.57ms
             'fj_short_lin_perturb':         1 [125.43ms, 125.43ms] 125.43ms   0.00ns 125.43ms         1 [ 44.70ms,  44.70ms]  44.70ms   0.00ns  44.70ms
              'fj_short_lin_random':         1 [126.65ms, 126.65ms] 126.65ms   0.00ns 126.65ms         1 [ 56.39ms,  56.39ms]  56.39ms   0.00ns  56.39ms
                 'fj_short_perturb':         1 [148.28ms, 148.28ms] 148.28ms   0.00ns 148.28ms         1 [ 50.87ms,  50.87ms]  50.87ms   0.00ns  50.87ms
                  'fj_short_random':         1 [138.09ms, 138.09ms] 138.09ms   0.00ns 138.09ms         1 [ 56.37ms,  56.37ms]  56.37ms   0.00ns  56.37ms
                        'fs_random':         1 [ 48.12ms,  48.12ms]  48.12ms   0.00ns  48.12ms         1 [ 20.00ns,  20.00ns]  20.00ns   0.00ns  20.00ns
                        'fs_random':         1 [ 48.95ms,  48.95ms]  48.95ms   0.00ns  48.95ms         1 [ 20.00ns,  20.00ns]  20.00ns   0.00ns  20.00ns
                        'fs_random':         1 [ 49.39ms,  49.39ms]  49.39ms   0.00ns  49.39ms         1 [ 20.00ns,  20.00ns]  20.00ns   0.00ns  20.00ns
                        'fs_random':         1 [ 49.43ms,  49.43ms]  49.43ms   0.00ns  49.43ms         1 [ 20.00ns,  20.00ns]  20.00ns   0.00ns  20.00ns
                  'fs_random_no_lp':         1 [ 46.58ms,  46.58ms]  46.58ms   0.00ns  46.58ms         1 [265.95us, 265.95us] 265.95us   0.00ns 265.95us
                  'fs_random_no_lp':         1 [ 48.91ms,  48.91ms]  48.91ms   0.00ns  48.91ms         1 [180.54us, 180.54us] 180.54us   0.00ns 180.54us
                  'fs_random_no_lp':         1 [ 50.83ms,  50.83ms]  50.83ms   0.00ns  50.83ms         1 [349.15us, 349.15us] 349.15us   0.00ns 349.15us
                  'fs_random_no_lp':         1 [ 51.97ms,  51.97ms]  51.97ms   0.00ns  51.97ms         1 [417.33us, 417.33us] 417.33us   0.00ns 417.33us
          'fs_random_quick_restart':         1 [ 49.97ms,  49.97ms]  49.97ms   0.00ns  49.97ms         1 [ 20.00ns,  20.00ns]  20.00ns   0.00ns  20.00ns
          'fs_random_quick_restart':         1 [ 50.55ms,  50.55ms]  50.55ms   0.00ns  50.55ms         1 [ 20.00ns,  20.00ns]  20.00ns   0.00ns  20.00ns
          'fs_random_quick_restart':         1 [ 50.86ms,  50.86ms]  50.86ms   0.00ns  50.86ms         1 [ 20.00ns,  20.00ns]  20.00ns   0.00ns  20.00ns
          'fs_random_quick_restart':         1 [ 52.20ms,  52.20ms]  52.20ms   0.00ns  52.20ms         1 [ 20.00ns,  20.00ns]  20.00ns   0.00ns  20.00ns
    'fs_random_quick_restart_no_lp':         1 [ 46.91ms,  46.91ms]  46.91ms   0.00ns  46.91ms         1 [258.62us, 258.62us] 258.62us   0.00ns 258.62us
    'fs_random_quick_restart_no_lp':         1 [ 47.34ms,  47.34ms]  47.34ms   0.00ns  47.34ms         1 [132.24us, 132.24us] 132.24us   0.00ns 132.24us
    'fs_random_quick_restart_no_lp':         1 [ 48.85ms,  48.85ms]  48.85ms   0.00ns  48.85ms         1 [298.80us, 298.80us] 298.80us   0.00ns 298.80us
                    'graph_arc_lns':        38 [  4.53ms,    3.12s] 829.81ms 793.99ms   31.53s        33 [ 10.00ns, 152.61ms]  49.56ms  48.05ms    1.64s
                    'graph_cst_lns':        38 [  1.65ms,  62.68ms]   4.58ms  10.03ms 174.01ms         0 [  0.00ns,   0.00ns]   0.00ns   0.00ns   0.00ns
                    'graph_dec_lns':        38 [  5.62ms,    2.03s] 586.55ms 599.66ms   22.29s        36 [ 10.00ns, 100.25ms]  35.36ms  44.43ms    1.27s
                    'graph_var_lns':        38 [  3.57ms,    2.03s] 651.29ms 605.16ms   24.75s        33 [ 10.00ns, 286.41ms]  44.57ms  60.87ms    1.47s
                   'lb_tree_search':         1 [   5.67s,    5.67s]    5.67s   0.00ns    5.67s         1 [659.55ms, 659.55ms] 659.55ms   0.00ns 659.55ms
                           'max_lp':         1 [   5.67s,    5.67s]    5.67s   0.00ns    5.67s         1 [766.16ms, 766.16ms] 766.16ms   0.00ns 766.16ms
                            'no_lp':         1 [   5.67s,    5.67s]    5.67s   0.00ns    5.67s         1 [606.50ms, 606.50ms] 606.50ms   0.00ns 606.50ms
              'objective_lb_search':         1 [   5.67s,    5.67s]    5.67s   0.00ns    5.67s         1 [445.39ms, 445.39ms] 445.39ms   0.00ns 445.39ms
       'objective_lb_search_max_lp':         1 [   5.67s,    5.67s]    5.67s   0.00ns    5.67s         1 [447.09ms, 447.09ms] 447.09ms   0.00ns 447.09ms
        'objective_lb_search_no_lp':         1 [   5.67s,    5.67s]    5.67s   0.00ns    5.67s         1 [514.69ms, 514.69ms] 514.69ms   0.00ns 514.69ms
  'objective_shaving_search_max_lp':        28 [  3.72ms,    1.09s] 200.42ms 236.74ms    5.61s        14 [ 27.45us, 116.08ms]  15.20ms  28.97ms 212.87ms
   'objective_shaving_search_no_lp':        25 [  9.58ms,    1.09s] 223.71ms 235.18ms    5.59s        16 [ 28.16us,  61.14ms]  13.78ms  16.60ms 220.40ms
                          'probing':         1 [   5.67s,    5.67s]    5.67s   0.00ns    5.67s         1 [131.02ms, 131.02ms] 131.02ms   0.00ns 131.02ms
                   'probing_max_lp':         1 [   5.68s,    5.68s]    5.68s   0.00ns    5.68s         1 [375.96ms, 375.96ms] 375.96ms   0.00ns 375.96ms
                     'pseudo_costs':         1 [   5.67s,    5.67s]    5.67s   0.00ns    5.67s         1 [463.98ms, 463.98ms] 463.98ms   0.00ns 463.98ms
                    'quick_restart':         1 [   5.67s,    5.67s]    5.67s   0.00ns    5.67s         1 [514.17ms, 514.17ms] 514.17ms   0.00ns 514.17ms
              'quick_restart_no_lp':         1 [   5.67s,    5.67s]    5.67s   0.00ns    5.67s         1 [455.61ms, 455.61ms] 455.61ms   0.00ns 455.61ms
                    'reduced_costs':         1 [   5.67s,    5.67s]    5.67s   0.00ns    5.67s         1 [523.08ms, 523.08ms] 523.08ms   0.00ns 523.08ms
                        'rins/rens':        39 [  7.27ms,    1.94s] 697.81ms 635.00ms   27.21s        34 [ 10.00ns, 200.13ms]  55.31ms  61.13ms    1.88s
                      'rnd_cst_lns':        38 [  6.78ms,    2.16s] 673.46ms 608.74ms   25.59s        34 [ 10.00ns, 148.27ms]  43.88ms  47.23ms    1.49s
                      'rnd_var_lns':        39 [  4.01ms,    2.14s] 675.03ms 642.83ms   26.33s        33 [ 10.00ns, 380.41ms]  48.10ms  72.45ms    1.59s
                     'violation_ls':        39 [230.60us, 196.69ms]  73.65ms  67.43ms    2.87s        39 [390.00ns,  56.05ms]  28.43ms  25.15ms    1.11s
                     'violation_ls':        39 [257.76us, 212.96ms]  74.44ms  73.18ms    2.90s        39 [710.00ns,  58.38ms]  25.83ms  23.94ms    1.01s
                     'violation_ls':        39 [259.50us, 109.52ms]  34.83ms  32.46ms    1.36s        39 [450.00ns,  49.40ms]  12.05ms  12.75ms 469.97ms
                     'violation_ls':        39 [282.13us, 277.38ms]  89.97ms  89.95ms    3.51s        39 [420.00ns,  56.13ms]  27.07ms  25.03ms    1.06s
                     'violation_ls':        39 [338.91us, 368.85ms]  77.45ms  77.65ms    3.02s        39 [810.00ns,  54.42ms]  28.85ms  24.07ms    1.13s

Search stats                        Bools  Conflicts  Branches  Restarts  BoolPropag  IntegerPropag
                           'core':    858        771    25'282     9'291   1'976'082      2'176'879
                     'default_lp':     66        937     4'714     1'019      30'883        982'139
                      'fs_random':     66          0       132       132           6          3'732
                      'fs_random':     66          0       132       132           6          3'732
                      'fs_random':     66          0       132       132           6          3'732
                      'fs_random':     66          0       132       132           6          3'732
                'fs_random_no_lp':     66          0       172       132          11          5'516
                'fs_random_no_lp':     66          3       167       132          10          4'988
                'fs_random_no_lp':     66          4       156       132          11          4'610
                'fs_random_no_lp':     66          4       172       132          38          5'807
        'fs_random_quick_restart':     66          0       132       132           6          3'732
        'fs_random_quick_restart':     66          0       132       132           6          3'732
        'fs_random_quick_restart':     66          0       132       132           6          3'732
        'fs_random_quick_restart':     66          0       132       132           6          3'732
  'fs_random_quick_restart_no_lp':     66          0       144       132           6          4'365
  'fs_random_quick_restart_no_lp':     66          0       168       132           7          4'944
  'fs_random_quick_restart_no_lp':     66          0       182       132           8          5'165
                 'lb_tree_search':     66         21     2'442       316       4'417        195'688
                         'max_lp':     66        800     3'766       825      26'207        817'437
                          'no_lp':    278      3'708    11'369     2'092     232'553      2'923'885
            'objective_lb_search':     76        688     4'560     1'256      26'275        807'228
     'objective_lb_search_max_lp':     72        406     3'499       961      18'302        576'161
      'objective_lb_search_no_lp':    163      3'147     8'732     1'712     112'448      2'499'525
                        'probing':    108         20       196       196         507          9'145
                 'probing_max_lp':    108         20       196       196         518          9'464
                   'pseudo_costs':     66        520     3'385     1'066      17'575        572'393
                  'quick_restart':    173        375     9'917     3'280      44'075        705'376
            'quick_restart_no_lp':    441      2'668    13'686     1'694     329'471      2'083'673
                  'reduced_costs':    389      1'463     9'748     2'476     137'737      1'056'804

SAT stats                           ClassicMinim  LitRemoved  LitLearned  LitForgotten  Subsumed  MClauses  MDecisions  MLitTrue  MSubsumed  MLitRemoved  MReused
                           'core':           475       1'742       3'353             0         2     4'368      21'832         0         12           64       37
                     'default_lp':           428         643       7'291             0        90       452       3'249         0        221        1'244       72
                      'fs_random':             0           0           0             0         0         0           0         0          0            0        0
                      'fs_random':             0           0           0             0         0         0           0         0          0            0        0
                      'fs_random':             0           0           0             0         0         0           0         0          0            0        0
                      'fs_random':             0           0           0             0         0         0           0         0          0            0        0
                'fs_random_no_lp':             0           0           0             0         0         0           0         0          0            0        0
                'fs_random_no_lp':             0           0          10             0         0         0           0         0          0            0        0
                'fs_random_no_lp':             0           0          12             0         0         0           0         0          0            0        0
                'fs_random_no_lp':             0           0          23             0         0         0           0         0          0            0        0
        'fs_random_quick_restart':             0           0           0             0         0         0           0         0          0            0        0
        'fs_random_quick_restart':             0           0           0             0         0         0           0         0          0            0        0
        'fs_random_quick_restart':             0           0           0             0         0         0           0         0          0            0        0
        'fs_random_quick_restart':             0           0           0             0         0         0           0         0          0            0        0
  'fs_random_quick_restart_no_lp':             0           0           0             0         0         0           0         0          0            0        0
  'fs_random_quick_restart_no_lp':             0           0           0             0         0         0           0         0          0            0        0
  'fs_random_quick_restart_no_lp':             0           0           0             0         0         0           0         0          0            0        0
                 'lb_tree_search':             1           1          90             0         0        15          85         0          1            5        4
                         'max_lp':           357         595       6'265             0        69       331       2'396         0        147          887       47
                          'no_lp':         2'499       6'295      29'223             0       161       598       4'125         0        260        1'547       84
            'objective_lb_search':           389         795       4'484             0        85       261       2'590         0         23          137      130
     'objective_lb_search_max_lp':           188         383       2'890             0        42       248       2'238         0         56          336       77
      'objective_lb_search_no_lp':         2'198       5'172      18'529             0       145       502       3'443         8        201        1'098      128
                        'probing':             0           0          20             0         0         0           0         0          0            0        0
                 'probing_max_lp':             0           0          20             0         0         0           0         0          0            0        0
                   'pseudo_costs':           265         426       3'896             0        49       289       1'916         0         82          427       69
                  'quick_restart':           209         593       3'527             0        11       513       3'221         0         30          159      136
            'quick_restart_no_lp':         1'679       5'205      27'653             0        82       437       3'434         1        173        1'053       64
                  'reduced_costs':           362         629       8'529             0        99       787       2'954       105        391        2'099       60

Lp stats                         Component  Iterations  AddedCuts  OPTIMAL  DUAL_F.  DUAL_U.
                  'default_lp':          1      10'448      2'341    1'207        0        0
                   'fs_random':          1           0          0        0        0        0
                   'fs_random':          1           0          0        0        0        0
                   'fs_random':          1           0          0        0        0        0
                   'fs_random':          1          28          0        1        1        0
     'fs_random_quick_restart':          1           0          0        0        0        0
     'fs_random_quick_restart':          1           0          0        0        0        0
     'fs_random_quick_restart':          1           0          0        1        0        0
     'fs_random_quick_restart':          1           0          0        1        0        0
              'lb_tree_search':          1      14'056      2'540    1'047      352        0
                      'max_lp':          1      14'503      2'653      867      312        1
         'objective_lb_search':          1      11'775      2'169    1'148        0        0
  'objective_lb_search_max_lp':          1      10'820      2'384      569      178        0
                     'probing':          1       1'125      1'657      239        0        0
              'probing_max_lp':          1       1'860      2'829      147        3        0
                'pseudo_costs':          1      11'688      2'464      683      191        0
               'quick_restart':          1      10'544      2'739    1'096        0        0
               'reduced_costs':          1       7'606      3'005    1'244      271        0

Lp dimension                                                                       Final dimension of first component
                  'default_lp':    433 rows, 236 columns, 1812 entries with magnitude in [2.101462e-03, 1.000000e+00]
                   'fs_random':         0 rows, 236 columns, 0 entries with magnitude in [0.000000e+00, 0.000000e+00]
                   'fs_random':         0 rows, 236 columns, 0 entries with magnitude in [0.000000e+00, 0.000000e+00]
                   'fs_random':         0 rows, 236 columns, 0 entries with magnitude in [0.000000e+00, 0.000000e+00]
                   'fs_random':      95 rows, 236 columns, 467 entries with magnitude in [9.292781e-02, 1.000000e+00]
     'fs_random_quick_restart':         0 rows, 236 columns, 0 entries with magnitude in [0.000000e+00, 0.000000e+00]
     'fs_random_quick_restart':         0 rows, 236 columns, 0 entries with magnitude in [0.000000e+00, 0.000000e+00]
     'fs_random_quick_restart':      95 rows, 236 columns, 467 entries with magnitude in [9.292781e-02, 1.000000e+00]
     'fs_random_quick_restart':      95 rows, 236 columns, 467 entries with magnitude in [9.292781e-02, 1.000000e+00]
              'lb_tree_search':    386 rows, 236 columns, 1535 entries with magnitude in [8.043851e-03, 1.000000e+00]
                      'max_lp':    658 rows, 236 columns, 2216 entries with magnitude in [3.865085e-03, 1.000000e+00]
         'objective_lb_search':    573 rows, 236 columns, 2364 entries with magnitude in [8.280030e-04, 1.000000e+00]
  'objective_lb_search_max_lp':    539 rows, 236 columns, 2110 entries with magnitude in [9.466901e-03, 1.000000e+00]
                     'probing':    371 rows, 236 columns, 1951 entries with magnitude in [3.108618e-03, 1.000000e+00]
              'probing_max_lp':  3152 rows, 236 columns, 21291 entries with magnitude in [2.755747e-04, 1.000000e+00]
                'pseudo_costs':    640 rows, 236 columns, 2128 entries with magnitude in [3.701340e-03, 1.000000e+00]
               'quick_restart':    565 rows, 236 columns, 2433 entries with magnitude in [5.338659e-04, 1.000000e+00]
               'reduced_costs':    720 rows, 236 columns, 3101 entries with magnitude in [6.168828e-04, 1.000000e+00]

Lp debug                         CutPropag  CutEqPropag  Adjust  Overflow      Bad  BadScaling
                  'default_lp':          1            1     485         0   20'004           0
                   'fs_random':          0            0       0         0        0           0
                   'fs_random':          0            0       0         0        0           0
                   'fs_random':          0            0       0         0        0           0
                   'fs_random':          0            0       0         0        0           0
     'fs_random_quick_restart':          0            0       0         0        0           0
     'fs_random_quick_restart':          0            0       0         0        0           0
     'fs_random_quick_restart':          0            0       0         0        0           0
     'fs_random_quick_restart':          0            0       0         0        0           0
              'lb_tree_search':          0            0     442         0    6'846           0
                      'max_lp':          7            0     524         0   11'181           0
         'objective_lb_search':          2            0     560         0   23'122           0
  'objective_lb_search_max_lp':          4            3     417         0   11'910           0
                     'probing':          0            7     211         0  147'541           0
              'probing_max_lp':          0           11     140         0   60'499           0
                'pseudo_costs':          6            2     380         0   20'584           0
               'quick_restart':         19           12     599         0   53'703           0
               'reduced_costs':          5            0     936         0   33'734           0

Lp pool                          Constraints  Updates  Simplif  Merged  Shortened  Split  Strenghtened    Cuts/Call
                  'default_lp':        2'559      102    1'179      14        567    181           763  2'341/4'519
                   'fs_random':          232        0        0       0          0      0             5          0/0
                   'fs_random':          232        0        0       0          0      0             5          0/0
                   'fs_random':          232        0        0       0          0      0             5          0/0
                   'fs_random':          232        0        0       0          0      0             5          0/0
     'fs_random_quick_restart':          232        0        0       0          0      0             5          0/0
     'fs_random_quick_restart':          232        0        0       0          0      0             5          0/0
     'fs_random_quick_restart':          232        0        0       0          0      0             5          0/0
     'fs_random_quick_restart':          232        0        0       0          0      0             5          0/0
              'lb_tree_search':        4'697       56    1'374      15          0     87         3'171  2'540/4'689
                      'max_lp':        4'816      158    4'739       9      1'870    135         7'396  2'653/4'834
         'objective_lb_search':        2'383      165    1'765      18        763    329           931  2'169/4'013
  'objective_lb_search_max_lp':        4'553       72    1'015       3          0    114         2'319  2'384/3'808
                     'probing':        1'889       90       56       0          0    136           272  1'657/2'815
              'probing_max_lp':        5'000      107      760       1          0    107         2'057  2'829/4'978
                'pseudo_costs':        4'630      163    7'091       6      1'934    148         9'201  2'464/4'285
               'quick_restart':        2'966      332    4'308       5      1'074  1'371         1'384  2'739/4'859
               'reduced_costs':        5'159      176    6'338      18      1'670    516         8'950  3'005/5'296

Lp Cut            defaul  max_lp  quick_  reduce  pseudo  lb_tre  probin  object  probin  object
          CG_FF:     122     196     159     181      99     248     107      91     197     136
           CG_K:      35      94      41      43      30     112      38      33      84      44
           CG_R:      41     110      83      76      49      90      41      63     104      63
          CG_RB:     453     595     594     477     433     647     314     427     572     485
         CG_RBP:      61      78      73      62      17      71      53      24      57      66
         Clique:       -      42       -      39      45      44       -       -      26      40
             IB:     571     365     517     448     507     330     291     548     158     447
       MIR_1_FF:     100     147     153     173     109     153     109     107     170      90
        MIR_1_K:      14      16       8      13      10      13       4       2      12       7
       MIR_1_KL:       2       -       1       -       -       -       1       1       -       -
        MIR_1_R:      14      13      14      17      12      16      16      13      14      12
       MIR_1_RB:     202     224     219     265     204     181     146     191     273     213
      MIR_1_RBP:      19      35       8      33      32      34      11      12      43      41
       MIR_2_FF:      43      53      60      61      59      60      32      35      71      43
        MIR_2_K:      13       6       8       7       9      10       7       4      10       4
       MIR_2_KL:       1       -       4       -       -       -       1       -       -       -
        MIR_2_R:       9      14      19      29      25      12      10      13      25      21
       MIR_2_RB:     103      93     113     162     136      79      68      96     136     115
      MIR_2_RBP:      11      15      10      24      35      14       7      14      26      18
       MIR_3_FF:      28      37      33      45      37      36      21      32      51      27
        MIR_3_K:       7       5       7      10       6       6       7       8      15       9
       MIR_3_KL:       3       -       3       -       1       -       1       -       -       -
        MIR_3_R:      17      23      14      27      21      13       7      15      28      18
       MIR_3_RB:      81      63      70     103      74      55      45      74      89      69
      MIR_3_RBP:       8       9       6      13      13      16       8       9      16      10
       MIR_4_FF:      20      20      20      37      26      17      12      16      23      21
        MIR_4_K:       4       7       5      15       5       6       2       7       7       5
       MIR_4_KL:       5       -       2       1       1       -       -       1       -       1
        MIR_4_R:      11      16      15      27      17       5       7      10      18      10
       MIR_4_RB:      34      33      61      71      50      25      29      47      47      36
      MIR_4_RBP:       4       3       3       9       7       7       4       4       4       6
       MIR_5_FF:      10      13      16      12      10       9      10      13      15       8
        MIR_5_K:       6       4       4       5       6       4       3       4      10       1
       MIR_5_KL:       1       -       -       -       -       -       -       -       -       -
        MIR_5_R:       5      10       9       9       9       6       2      11       6       5
       MIR_5_RB:      32      26      44      35      22      16      18      32      28      24
      MIR_5_RBP:       1       2       2       1       1       -       2       3       1       -
       MIR_6_FF:       4       9       8      12       5       8       2       5      11       8
        MIR_6_K:       5       3       -       6       1       3       4       2       5       2
        MIR_6_R:       4       7       5      15       4       4       3       6       4       6
       MIR_6_RB:      18      10      19      20       7      12      13      20      15      20
      MIR_6_RBP:       -       1       3       -       -       -       -       -       -       2
   ZERO_HALF_FF:      24      32      30      32      33      28      20      25      38      29
    ZERO_HALF_K:       1       1       2       7       1       2       1       2       -       1
    ZERO_HALF_R:     132     137     212     268     198      89     133     104     299     132
   ZERO_HALF_RB:      52      79      54      83      77      51      42      43      75      80
  ZERO_HALF_RBP:      10       7       8      32      21       8       5       2      46       9

LNS stats           Improv/Calls  Closed  Difficulty  TimeLimit
  'graph_arc_lns':         12/38     61%        0.99       0.10
  'graph_cst_lns':           0/0      0%        0.50       0.10
  'graph_dec_lns':         12/38     66%        0.99       0.10
  'graph_var_lns':         10/38     58%        0.98       0.10
      'rins/rens':         13/39     59%        0.95       0.10
    'rnd_cst_lns':         11/38     61%        0.99       0.10
    'rnd_var_lns':         14/38     61%        0.99       0.10

LS stats                   Batches  Restarts  LinMoves  GenMoves  CompoundMoves  WeightUpdates
       'fj_long_default':        1         1     9'743         0              0            257
       'fj_long_default':        1         1     9'758         0              0            242
   'fj_long_lin_default':        1         1         0     4'041            351              2
   'fj_long_lin_perturb':        1         1     8'408         0              0          1'592
    'fj_long_lin_random':        1         1     8'893         0              0          1'107
       'fj_long_perturb':        1         1         0     4'224            438              1
        'fj_long_random':        1         1     9'755         0              0            245
      'fj_short_default':        1         1         0     4'230            531              2
      'fj_short_default':        1         1     8'316         0              0          1'684
  'fj_short_lin_default':        1         1         0     4'234            553              2
  'fj_short_lin_default':        1         1         0     4'795            672              4
  'fj_short_lin_perturb':        1         1     9'655         0              0            345
   'fj_short_lin_random':        1         1         0     3'973            460              2
      'fj_short_perturb':        1         1     9'781         0              0            219
       'fj_short_random':        1         1         0     4'148            497              2
          'violation_ls':       39         0    10'036   129'344         12'368          1'166
          'violation_ls':       39         0   198'114     3'411            295         14'631
          'violation_ls':       39         0        72   160'905         15'904            775
          'violation_ls':       39         0     9'935   212'377          5'176          1'977
          'violation_ls':       39         0    99'449    26'620          2'474         91'461

Solutions (68)                  Num     Rank
              'graph_dec_lns':    3  [40,57]
              'graph_var_lns':    2  [13,45]
                      'no_lp':    7   [1,32]
  'objective_lb_search_no_lp':    1    [7,7]
        'quick_restart_no_lp':   16   [2,68]
              'rins_pump_lns':    1  [39,39]
                'rnd_cst_lns':    3   [8,56]
                'rnd_var_lns':    1    [9,9]
               'violation_ls':   34  [10,66]

Objective bounds                      Num
                   'initial_domain':    1
              'objective_lb_search':    1
        'objective_lb_search_no_lp':   28
  'objective_shaving_search_max_lp':    2

Solution repositories    Added  Queried  Ignored  Synchro
  'feasible solutions':    278      758        7      242
        'lp solutions':     41        7        0       37
                'pump':    794       32

Improving bounds shared          Num
                        'core':   16
                  'default_lp':   25
                      'max_lp':  156
                       'no_lp':  160
         'objective_lb_search':    4
  'objective_lb_search_max_lp':    3
                     'probing':   14
              'probing_max_lp':    8
                'pseudo_costs':   52
               'quick_restart':   92
         'quick_restart_no_lp':  190
               'reduced_costs':   52

Clauses shared                   Num
                        'core':    2
                  'default_lp':   22
             'fs_random_no_lp':    3
              'lb_tree_search':    4
                      'max_lp':    5
                       'no_lp':   42
  'objective_lb_search_max_lp':    2
   'objective_lb_search_no_lp':    5
                'pseudo_costs':   15
               'quick_restart':    6
         'quick_restart_no_lp':   14
               'reduced_costs':    8

CpSolverResponse summary:
status: OPTIMAL
objective: 887
best_bound: 887
integers: 237
booleans: 66
conflicts: 0
branches: 132
propagations: 6
integer_propagations: 3732
restarts: 132
lp_iterations: 28
walltime: 5.99866
usertime: 5.99866
deterministic_time: 23.3989
gap_integral: 77.0832
solution_fingerprint: 0xa029b1874f7d3ac6


--- Simulation Gantt  partir du modle mathmatique ---
{'big':0, 'due_date':76, 'pos_time':5, 'status':0, 'blocked':0, 'operations':["{'type':0, 'processing_time':15}"]}
{'big':1, 'due_date':82, 'pos_time':5, 'status':0, 'blocked':0, 'operations':["{'type':1, 'processing_time':16}", "{'type':0, 'processing_time':46}"]}
{'big':1, 'due_date':119, 'pos_time':5, 'status':0, 'blocked':0, 'operations':["{'type':1, 'processing_time':54}"]}
{'big':0, 'due_date':171, 'pos_time':5, 'status':0, 'blocked':0, 'operations':["{'type':1, 'processing_time':42}", "{'type':0, 'processing_time':35}"]}
{'big':1, 'due_date':162, 'pos_time':5, 'status':0, 'blocked':0, 'operations':["{'type':1, 'processing_time':60}", "{'type':0, 'processing_time':19}"]}
{'big':1, 'due_date':177, 'pos_time':5, 'status':0, 'blocked':0, 'operations':["{'type':1, 'processing_time':33}", "{'type':0, 'processing_time':46}"]}
{'big':1, 'due_date':54, 'pos_time':5, 'status':0, 'blocked':0, 'operations':["{'type':0, 'processing_time':15}"]}
