created virtual environment CPython3.12.4.final.0-64 in 10573ms
  creator CPython3Posix(dest=/localscratch/aneumann.63390847.0/env, clear=False, no_vcs_ignore=False, global=False)
  seeder FromAppData(download=False, pip=bundle, via=copy, app_data_dir=/home/aneumann/.local/share/virtualenv)
    added seed packages: pip==25.1.1
  activators BashActivator,CShellActivator,FishActivator,NushellActivator,PowerShellActivator,PythonActivator
Looking in links: /cvmfs/soft.computecanada.ca/custom/python/wheelhouse/gentoo2023/x86-64-v3, /cvmfs/soft.computecanada.ca/custom/python/wheelhouse/gentoo2023/generic, /cvmfs/soft.computecanada.ca/custom/python/wheelhouse/generic
Requirement already satisfied: pip in /localscratch/aneumann.63390847.0/env/lib/python3.12/site-packages (25.1.1)
Looking in links: /cvmfs/soft.computecanada.ca/custom/python/wheelhouse/gentoo2023/x86-64-v3, /cvmfs/soft.computecanada.ca/custom/python/wheelhouse/gentoo2023/generic, /cvmfs/soft.computecanada.ca/custom/python/wheelhouse/generic
ERROR: protobuf-5.28.3-cp38-abi3-manylinux2014_x86_64.whl is not a supported wheel on this platform.
Looking in links: /cvmfs/soft.computecanada.ca/custom/python/wheelhouse/gentoo2023/x86-64-v3, /cvmfs/soft.computecanada.ca/custom/python/wheelhouse/gentoo2023/generic, /cvmfs/soft.computecanada.ca/custom/python/wheelhouse/generic
Processing /home/aneumann/projects/def-adhaj/aneumann/GNRS/wheels/immutabledict-4.2.0-py3-none-any.whl
Installing collected packages: immutabledict
Successfully installed immutabledict-4.2.0
Looking in links: /cvmfs/soft.computecanada.ca/custom/python/wheelhouse/gentoo2023/x86-64-v3, /cvmfs/soft.computecanada.ca/custom/python/wheelhouse/gentoo2023/generic, /cvmfs/soft.computecanada.ca/custom/python/wheelhouse/generic
Processing /cvmfs/soft.computecanada.ca/custom/python/wheelhouse/generic/ortools-9.10.4067+computecanada-cp312-cp312-linux_x86_64.whl (from -r /home/aneumann/projects/def-adhaj/aneumann/GNRS/requirements/or.txt (line 1))
Processing /cvmfs/soft.computecanada.ca/custom/python/wheelhouse/gentoo2023/x86-64-v3/matplotlib-3.10.0+computecanada-cp312-cp312-linux_x86_64.whl (from -r /home/aneumann/projects/def-adhaj/aneumann/GNRS/requirements/or.txt (line 2))
Processing /cvmfs/soft.computecanada.ca/custom/python/wheelhouse/gentoo2023/x86-64-v3/pandas-2.2.3+computecanada-cp312-cp312-linux_x86_64.whl (from -r /home/aneumann/projects/def-adhaj/aneumann/GNRS/requirements/or.txt (line 3))
Processing /cvmfs/soft.computecanada.ca/custom/python/wheelhouse/generic/absl_py-2.2.2+computecanada-py3-none-any.whl (from ortools<9.11,>=9.10->-r /home/aneumann/projects/def-adhaj/aneumann/GNRS/requirements/or.txt (line 1))
Processing /cvmfs/soft.computecanada.ca/custom/python/wheelhouse/gentoo2023/generic/numpy-2.2.2+computecanada-cp312-cp312-linux_x86_64.whl (from ortools<9.11,>=9.10->-r /home/aneumann/projects/def-adhaj/aneumann/GNRS/requirements/or.txt (line 1))
Processing /cvmfs/soft.computecanada.ca/custom/python/wheelhouse/gentoo2023/x86-64-v3/protobuf-6.30.2+computecanada-cp312-cp312-linux_x86_64.whl (from ortools<9.11,>=9.10->-r /home/aneumann/projects/def-adhaj/aneumann/GNRS/requirements/or.txt (line 1))
Requirement already satisfied: immutabledict>=3.0.0 in /localscratch/aneumann.63390847.0/env/lib/python3.12/site-packages (from ortools<9.11,>=9.10->-r /home/aneumann/projects/def-adhaj/aneumann/GNRS/requirements/or.txt (line 1)) (4.2.0)
Processing /cvmfs/soft.computecanada.ca/custom/python/wheelhouse/gentoo2023/generic/contourpy-1.3.1+computecanada-cp312-cp312-linux_x86_64.whl (from matplotlib->-r /home/aneumann/projects/def-adhaj/aneumann/GNRS/requirements/or.txt (line 2))
Processing /cvmfs/soft.computecanada.ca/custom/python/wheelhouse/generic/cycler-0.12.1+computecanada-py3-none-any.whl (from matplotlib->-r /home/aneumann/projects/def-adhaj/aneumann/GNRS/requirements/or.txt (line 2))
Processing /cvmfs/soft.computecanada.ca/custom/python/wheelhouse/generic/fonttools-4.58.2+computecanada-cp312-cp312-linux_x86_64.whl (from matplotlib->-r /home/aneumann/projects/def-adhaj/aneumann/GNRS/requirements/or.txt (line 2))
Processing /cvmfs/soft.computecanada.ca/custom/python/wheelhouse/gentoo2023/x86-64-v3/kiwisolver-1.4.8+computecanada-cp312-cp312-linux_x86_64.whl (from matplotlib->-r /home/aneumann/projects/def-adhaj/aneumann/GNRS/requirements/or.txt (line 2))
Processing /cvmfs/soft.computecanada.ca/custom/python/wheelhouse/generic/packaging-25.0+computecanada-py3-none-any.whl (from matplotlib->-r /home/aneumann/projects/def-adhaj/aneumann/GNRS/requirements/or.txt (line 2))
Processing /cvmfs/soft.computecanada.ca/custom/python/wheelhouse/gentoo2023/x86-64-v3/pillow-11.1.0+computecanada-cp312-cp312-linux_x86_64.whl (from matplotlib->-r /home/aneumann/projects/def-adhaj/aneumann/GNRS/requirements/or.txt (line 2))
Processing /cvmfs/soft.computecanada.ca/custom/python/wheelhouse/generic/pyparsing-3.2.1+computecanada-py3-none-any.whl (from matplotlib->-r /home/aneumann/projects/def-adhaj/aneumann/GNRS/requirements/or.txt (line 2))
Processing /cvmfs/soft.computecanada.ca/custom/python/wheelhouse/generic/python_dateutil-2.9.0.post0+computecanada-py2.py3-none-any.whl (from matplotlib->-r /home/aneumann/projects/def-adhaj/aneumann/GNRS/requirements/or.txt (line 2))
Processing /cvmfs/soft.computecanada.ca/custom/python/wheelhouse/generic/pytz-2025.2+computecanada-py2.py3-none-any.whl (from pandas->-r /home/aneumann/projects/def-adhaj/aneumann/GNRS/requirements/or.txt (line 3))
Processing /cvmfs/soft.computecanada.ca/custom/python/wheelhouse/generic/tzdata-2025.2+computecanada-py2.py3-none-any.whl (from pandas->-r /home/aneumann/projects/def-adhaj/aneumann/GNRS/requirements/or.txt (line 3))
Processing /cvmfs/soft.computecanada.ca/custom/python/wheelhouse/generic/six-1.17.0+computecanada-py2.py3-none-any.whl (from python-dateutil>=2.7->matplotlib->-r /home/aneumann/projects/def-adhaj/aneumann/GNRS/requirements/or.txt (line 2))
Installing collected packages: pytz, tzdata, six, pyparsing, protobuf, pillow, packaging, numpy, kiwisolver, fonttools, cycler, absl-py, python-dateutil, contourpy, pandas, matplotlib, ortools

Successfully installed absl-py-2.2.2+computecanada contourpy-1.3.1+computecanada cycler-0.12.1+computecanada fonttools-4.58.2+computecanada kiwisolver-1.4.8+computecanada matplotlib-3.10.0+computecanada numpy-2.2.2+computecanada ortools-9.10.4067+computecanada packaging-25.0+computecanada pandas-2.2.3+computecanada pillow-11.1.0+computecanada protobuf-6.30.2+computecanada pyparsing-3.2.1+computecanada python-dateutil-2.9.0.post0+computecanada pytz-2025.2+computecanada six-1.17.0+computecanada tzdata-2025.2+computecanada

Starting CP-SAT solver v9.10.4067
Parameters: max_time_in_seconds: 3600 max_memory_in_mb: 12000 log_search_progress: true enumerate_all_solutions: false absolute_gap_limit: 0 relative_gap_limit: 0
Setting number of workers to 48

Initial optimization model '': (model_fingerprint: 0x6f1d2417e2f524aa)
#Variables: 133 (#ints: 5 in objective)
  - 84 Booleans in [0,1]
  - 49 in [0,288]
#kLinear1: 16
#kLinear2: 147
#kLinear3: 62
#kLinearN: 387 (#terms: 3'454)

Starting presolve at 0.00s
  1.59e-04s  0.00e+00d  [DetectDominanceRelations] 
  5.29e-03s  0.00e+00d  [PresolveToFixPoint] #num_loops=6 #num_dual_strengthening=3 
  1.31e-05s  0.00e+00d  [ExtractEncodingFromLinear] #potential_supersets=2 
[Symmetry] Graph for symmetry has 591 nodes and 1'896 arcs.
[Symmetry] Symmetry computation done. time: 0.000304602 dtime: 0.00018287
[SAT presolve] num removable Booleans: 0 / 29
[SAT presolve] num trivial clauses: 0
[SAT presolve] [0s] clauses:4 literals:10 vars:7 one_side_vars:6 simple_definition:1 singleton_clauses:0
[SAT presolve] [3.7568e-05s] clauses:4 literals:10 vars:7 one_side_vars:6 simple_definition:1 singleton_clauses:0
[SAT presolve] [4.8663e-05s] clauses:4 literals:10 vars:7 one_side_vars:6 simple_definition:1 singleton_clauses:0
  1.43e-03s  1.26e-04d  [Probe] #probed=136 #fixed_bools=2 #new_bounds=8 #new_binary_clauses=17 
  2.95e-05s  0.00e+00d  [MaxClique] 
  1.47e-04s  0.00e+00d  [DetectDominanceRelations] 
  1.65e-03s  0.00e+00d  [PresolveToFixPoint] #num_loops=4 #num_dual_strengthening=3 
  3.97e-04s  0.00e+00d  [ProcessAtMostOneAndLinear] 
  3.87e-04s  0.00e+00d  [DetectDuplicateConstraints] #duplicates=91 #without_enforcements=25 
  1.15e-04s  3.10e-06d  [DetectDominatedLinearConstraints] #relevant_constraints=176 #num_inclusions=63 #num_redundant=3 
  1.02e-04s  0.00e+00d  [DetectDifferentVariables] #different=14 #cliques=1 #size=3 
  5.03e-05s  7.86e-07d  [ProcessSetPPC] #relevant_constraints=68 
  7.95e-06s  0.00e+00d  [FindAlmostIdenticalLinearConstraints] 
  3.09e-05s  1.32e-05d  [FindBigAtMostOneAndLinearOverlap] 
  1.86e-04s  7.00e-05d  [FindBigVerticalLinearOverlap] 
  1.84e-05s  2.49e-06d  [FindBigHorizontalLinearOverlap] #linears=63 
  1.45e-05s  3.00e-08d  [MergeClauses] 
  1.37e-04s  0.00e+00d  [DetectDominanceRelations] 
  1.00e-03s  0.00e+00d  [PresolveToFixPoint] #num_loops=1 #num_dual_strengthening=1 
  1.32e-04s  0.00e+00d  [DetectDominanceRelations] 
  9.71e-04s  0.00e+00d  [PresolveToFixPoint] #num_loops=1 #num_dual_strengthening=1 
[SAT presolve] num removable Booleans: 0 / 27
[SAT presolve] num trivial clauses: 0
[SAT presolve] [0s] clauses:4 literals:10 vars:7 one_side_vars:6 simple_definition:1 singleton_clauses:0
[SAT presolve] [3.0413e-05s] clauses:4 literals:10 vars:7 one_side_vars:6 simple_definition:1 singleton_clauses:0
[SAT presolve] [4.2759e-05s] clauses:4 literals:10 vars:7 one_side_vars:6 simple_definition:1 singleton_clauses:0
  1.20e-03s  1.16e-04d  [Probe] #probed=132 #new_bounds=5 #new_binary_clauses=17 
  1.67e-05s  0.00e+00d  [MaxClique] 
  1.42e-04s  0.00e+00d  [DetectDominanceRelations] 
  1.40e-03s  0.00e+00d  [PresolveToFixPoint] #num_loops=2 #num_dual_strengthening=1 
  3.36e-04s  0.00e+00d  [ProcessAtMostOneAndLinear] 
  2.80e-04s  0.00e+00d  [DetectDuplicateConstraints] #without_enforcements=25 
  1.07e-04s  3.01e-06d  [DetectDominatedLinearConstraints] #relevant_constraints=173 #num_inclusions=57 
  3.12e-05s  0.00e+00d  [DetectDifferentVariables] 
  4.18e-05s  7.86e-07d  [ProcessSetPPC] #relevant_constraints=68 
  6.78e-06s  0.00e+00d  [FindAlmostIdenticalLinearConstraints] 
  3.34e-05s  1.32e-05d  [FindBigAtMostOneAndLinearOverlap] 
  1.78e-04s  7.00e-05d  [FindBigVerticalLinearOverlap] 
  1.84e-05s  2.49e-06d  [FindBigHorizontalLinearOverlap] #linears=63 
  1.18e-05s  3.00e-08d  [MergeClauses] 
  1.36e-04s  0.00e+00d  [DetectDominanceRelations] 
  9.90e-04s  0.00e+00d  [PresolveToFixPoint] #num_loops=1 #num_dual_strengthening=1 
  1.32e-04s  0.00e+00d  [DetectDominanceRelations] 
  9.72e-04s  0.00e+00d  [PresolveToFixPoint] #num_loops=1 #num_dual_strengthening=1 
[SAT presolve] num removable Booleans: 0 / 27
[SAT presolve] num trivial clauses: 0
[SAT presolve] [0s] clauses:4 literals:10 vars:7 one_side_vars:6 simple_definition:1 singleton_clauses:0
[SAT presolve] [3.0275e-05s] clauses:4 literals:10 vars:7 one_side_vars:6 simple_definition:1 singleton_clauses:0
[SAT presolve] [4.0528e-05s] clauses:4 literals:10 vars:7 one_side_vars:6 simple_definition:1 singleton_clauses:0
  1.17e-03s  1.14e-04d  [Probe] #probed=132 #new_binary_clauses=17 
  1.73e-05s  0.00e+00d  [MaxClique] 
  1.36e-04s  0.00e+00d  [DetectDominanceRelations] 
  1.01e-03s  0.00e+00d  [PresolveToFixPoint] #num_loops=1 #num_dual_strengthening=1 
  3.48e-04s  0.00e+00d  [ProcessAtMostOneAndLinear] 
  2.77e-04s  0.00e+00d  [DetectDuplicateConstraints] #without_enforcements=25 
  1.07e-04s  3.01e-06d  [DetectDominatedLinearConstraints] #relevant_constraints=173 #num_inclusions=57 
  3.09e-05s  0.00e+00d  [DetectDifferentVariables] 
  4.28e-05s  7.86e-07d  [ProcessSetPPC] #relevant_constraints=68 
  7.39e-06s  0.00e+00d  [FindAlmostIdenticalLinearConstraints] 
  2.75e-05s  1.32e-05d  [FindBigAtMostOneAndLinearOverlap] 
  1.91e-04s  7.00e-05d  [FindBigVerticalLinearOverlap] 
  1.86e-05s  2.49e-06d  [FindBigHorizontalLinearOverlap] #linears=63 
  1.37e-05s  3.00e-08d  [MergeClauses] 
  1.36e-04s  0.00e+00d  [DetectDominanceRelations] 
  9.93e-04s  0.00e+00d  [PresolveToFixPoint] #num_loops=1 #num_dual_strengthening=1 
  1.74e-05s  0.00e+00d  [ExpandObjective] #entries=12 #tight_variables=6 #tight_constraints=2 

Presolve summary:
  - 20 affine relations were detected.
  - rule 'TODO dual: add implied bound' was applied 20 times.
  - rule 'TODO dual: only one blocking constraint?' was applied 329 times.
  - rule 'TODO dual: only one blocking enforced constraint?' was applied 20 times.
  - rule 'TODO dual: only one unspecified blocking constraint?' was applied 65 times.
  - rule 'TODO duplicate: identical constraint with different enforcements' was applied 75 times.
  - rule 'TODO linear2: contains a Boolean.' was applied 18 times.
  - rule 'TODO no_overlap: with task always last' was applied 1 time.
  - rule 'affine: new relation' was applied 20 times.
  - rule 'all_diff: inferred from x != y constraints' was applied 1 time.
  - rule 'at_most_one: removed literals' was applied 1 time.
  - rule 'at_most_one: size one' was applied 1 time.
  - rule 'bool_or: always true' was applied 2 times.
  - rule 'bool_or: implications' was applied 3 times.
  - rule 'deductions: 61 stored' was applied 1 time.
  - rule 'dual: fix variable' was applied 5 times.
  - rule 'dual: reduced domain' was applied 21 times.
  - rule 'duplicate: merged rhs of linear constraint' was applied 15 times.
  - rule 'duplicate: removed constraint' was applied 91 times.
  - rule 'enforcement: false literal' was applied 10 times.
  - rule 'enforcement: literal not used' was applied 2 times.
  - rule 'enforcement: true literal' was applied 8 times.
  - rule 'incompatible linear: add implication' was applied 6 times.
  - rule 'linear inclusion: redundant containing constraint' was applied 1 time.
  - rule 'linear inclusion: redundant included constraint' was applied 2 times.
  - rule 'linear1: always true' was applied 2 times.
  - rule 'linear2: contains a Boolean.' was applied 8 times.
  - rule 'linear: always true' was applied 200 times.
  - rule 'linear: doubleton free' was applied 5 times.
  - rule 'linear: empty' was applied 16 times.
  - rule 'linear: extracted enforcement literal' was applied 627 times.
  - rule 'linear: fixed or dup variables' was applied 383 times.
  - rule 'linear: negative clause' was applied 5 times.
  - rule 'linear: positive clause' was applied 2 times.
  - rule 'linear: positive equal one' was applied 2 times.
  - rule 'linear: reduced variable domains' was applied 55 times.
  - rule 'linear: remapped using affine relations' was applied 342 times.
  - rule 'linear: simplified rhs' was applied 984 times.
  - rule 'linear: variable substitution 1' was applied 5 times.
  - rule 'presolve: 44 unused variables removed.' was applied 1 time.
  - rule 'presolve: iteration' was applied 3 times.
  - rule 'probing: reduced enforced constraint to implication.' was applied 1 time.

Presolved optimization model '': (model_fingerprint: 0xd85abd16477e6eff)
#Variables: 64 (#ints: 5 in objective)
  - 27 Booleans in [0,1]
  - 1 in [0,131]
  - 2 in [0,173]
  - 2 in [0,176]
  - 2 in [0,206]
  - 1 in [0,217]
  - 3 in [0,223]
  - 1 in [0,226]
  - 3 in [0,235]
  - 1 in [3,238]
  - 1 in [10,204]
  - 1 in [10,269]
  - 1 in [13,207]
  - 1 in [13,272]
  - 1 in [42,268]
  - 1 in [46,240]
  - 3 in [60,277]
  - 1 in [66,283]
  - 4 in [71,277]
  - 2 in [77,283]
  - 3 in [101,277]
  - 1 in [107,283]
  - 1 in [112,288]
#kAllDiff: 1
#kBoolAnd: 1 (#enforced: 1) (#literals: 3)
#kBoolOr: 2 (#literals: 6)
#kExactlyOne: 2 (#literals: 6)
#kLinear1: 11 (#enforced: 11 #multi: 6)
#kLinear2: 95 (#enforced: 69 #multi: 53)
#kLinear3: 76 (#enforced: 71 #multi: 47)
#kLinearN: 71 (#enforced: 52) (#terms: 530)

Preloading model.
#Bound   0.03s best:inf   next:[112,1048] initial_domain
#Model   0.03s var:64/64 constraints:259/259

Starting search at 0.03s with 48 workers.
16 full problem subsolvers: [core, default_lp, lb_tree_search, max_lp, no_lp, objective_lb_search, objective_lb_search_max_lp, objective_lb_search_no_lp, objective_shaving_search_max_lp, objective_shaving_search_no_lp, probing, probing_max_lp, pseudo_costs, quick_restart, quick_restart_no_lp, reduced_costs]
30 first solution subsolvers: [fj_long_default(2), fj_long_lin_default, fj_long_lin_perturb, fj_long_lin_random, fj_long_perturb, fj_long_random, fj_short_default(2), fj_short_lin_default(2), fj_short_lin_perturb, fj_short_lin_random, fj_short_perturb, fj_short_random, fs_random(4), fs_random_no_lp(4), fs_random_quick_restart(4), fs_random_quick_restart_no_lp(3)]
13 incomplete subsolvers: [feasibility_pump, graph_arc_lns, graph_cst_lns, graph_dec_lns, graph_var_lns, rins/rens, rnd_cst_lns, rnd_var_lns, violation_ls(5)]
3 helper subsolvers: [neighborhood_helper, synchronization_agent, update_gap_integral]
#1       0.03s best:582   next:[112,581]  no_lp (fixed_bools=0/58)
#Bound   0.03s best:582   next:[113,581]  bool_core (num_cores=1 [size:2 mw:1 d:1] a=4 d=1 fixed=0/43 clauses=12)
#Bound   0.03s best:582   next:[114,581]  bool_core (num_cores=1 [cover] a=4 d=1 fixed=0/46 clauses=13)
#Bound   0.03s best:582   next:[115,581]  bool_core (num_cores=1 [cover] a=4 d=1 fixed=1/49 clauses=15)
#Bound   0.03s best:582   next:[116,581]  bool_core (num_cores=1 [cover] a=4 d=1 fixed=2/52 clauses=18)
#2       0.03s best:543   next:[116,542]  quick_restart_no_lp (fixed_bools=0/56)
#Bound   0.03s best:543   next:[136,542]  default_lp
#3       0.03s best:517   next:[136,516]  no_lp (fixed_bools=0/66)
#4       0.03s best:487   next:[136,486]  no_lp (fixed_bools=0/71)
#5       0.03s best:471   next:[136,470]  no_lp (fixed_bools=0/75)
#6       0.03s best:396   next:[136,395]  no_lp (fixed_bools=0/77)
#7       0.03s best:394   next:[136,393]  quick_restart_no_lp (fixed_bools=0/92)
#8       0.03s best:363   next:[136,362]  no_lp (fixed_bools=0/82)
#Bound   0.03s best:363   next:[137,362]  probing
#Bound   0.03s best:363   next:[149,362]  objective_lb_search_no_lp
#9       0.03s best:362   next:[149,361]  violation_ls(batch:1 #solutions_imported:1 #lin_moves:0 #lin_evals:21 #gen_moves:20 #gen_evals:3 #comp_moves:4 #backtracks:8 #weight_updates:0)
#Bound   0.03s best:362   next:[161,361]  objective_lb_search_no_lp
#Bound   0.04s best:362   next:[162,361]  objective_lb_search_no_lp
#Bound   0.04s best:362   next:[174,361]  objective_lb_search_no_lp
#10      0.04s best:361   next:[174,360]  quick_restart_no_lp (fixed_bools=0/111)
#11      0.04s best:353   next:[174,352]  rnd_var_lns (d=0.50 s=24 t=0.10 p=0.00 stall=0 h=auto_l0) [presolve]
#Bound   0.04s best:353   next:[181,352]  objective_lb_search_no_lp
#Bound   0.04s best:353   next:[183,352]  objective_lb_search_no_lp
#12      0.04s best:338   next:[183,337]  no_lp (fixed_bools=0/97)
#13      0.04s best:334   next:[183,333]  no_lp (fixed_bools=0/101)
#14      0.04s best:322   next:[183,321]  graph_arc_lns (d=0.50 s=27 t=0.10 p=0.00 stall=0 h=auto_l0) [presolve]
#15      0.04s best:321   next:[183,320]  violation_ls(batch:2 #solutions_imported:2 #lin_moves:2 #lin_evals:123 #gen_moves:80 #gen_evals:17 #comp_moves:6 #backtracks:37 #weight_updates:1)
#16      0.04s best:320   next:[183,319]  violation_ls(batch:2 #solutions_imported:2 #lin_moves:18 #lin_evals:70 #gen_moves:2 #gen_evals:0 #comp_moves:2 #backtracks:0 #weight_updates:10)
#Bound   0.04s best:320   next:[257,319]  objective_lb_search_no_lp
#17      0.04s best:319   next:[257,318]  violation_ls(batch:2 #solutions_imported:2 #lin_moves:0 #lin_evals:25 #gen_moves:21 #gen_evals:3 #comp_moves:5 #backtracks:8 #weight_updates:0)
#18      0.04s best:318   next:[257,317]  violation_ls(batch:2 #solutions_imported:2 #lin_moves:0 #lin_evals:24 #gen_moves:22 #gen_evals:3 #comp_moves:6 #backtracks:8 #weight_updates:0)
#19      0.04s best:317   next:[257,316]  violation_ls(batch:2 #solutions_imported:2 #lin_moves:10 #lin_evals:56 #gen_moves:4 #gen_evals:0 #comp_moves:4 #backtracks:0 #weight_updates:7)
#20      0.04s best:316   next:[257,315]  rnd_var_lns (d=0.71 s=38 t=0.10 p=1.00 stall=0 h=auto_l0) [presolve]
#21      0.04s best:315   next:[257,314]  violation_ls(batch:3 #solutions_imported:3 #lin_moves:3 #lin_evals:128 #gen_moves:80 #gen_evals:17 #comp_moves:6 #backtracks:37 #weight_updates:1)
#Bound   0.04s best:315   next:[261,314]  objective_lb_search_no_lp
#22      0.05s best:313   next:[261,312]  violation_ls(batch:3 #solutions_imported:3 #lin_moves:809 #lin_evals:4'687 #gen_moves:21 #gen_evals:3 #comp_moves:5 #backtracks:8 #weight_updates:998)
#Bound   0.05s best:313   next:[263,312]  objective_lb_search_no_lp
#23      0.05s best:301   next:[263,300]  quick_restart_no_lp (fixed_bools=9/138)
#24      0.06s best:300   next:[263,299]  quick_restart_no_lp (fixed_bools=9/139)
#Model   0.06s var:63/64 constraints:202/259
#25      0.06s best:299   next:[263,298]  violation_ls(batch:4 #solutions_imported:4 #lin_moves:6 #lin_evals:143 #gen_moves:80 #gen_evals:17 #comp_moves:6 #backtracks:37 #weight_updates:3)
#26      0.06s best:298   next:[263,297]  violation_ls(batch:4 #solutions_imported:4 #lin_moves:810 #lin_evals:4'692 #gen_moves:21 #gen_evals:3 #comp_moves:5 #backtracks:8 #weight_updates:998)
#27      0.06s best:288   next:[263,287]  no_lp (fixed_bools=5/113)
#Bound   0.06s best:288   next:[267,287]  objective_lb_search_no_lp
#Done    0.07s no_lp
#Done    0.07s quick_restart_no_lp
#Model   0.07s var:60/64 constraints:173/259
#Done    0.07s objective_lb_search_max_lp
#Done    0.07s pseudo_costs
#Done    0.07s reduced_costs

Task timing                                  n [     min,      max]      avg      dev     time         n [     min,      max]      avg      dev    dtime
                             'core':         1 [ 38.64ms,  38.64ms]  38.64ms   0.00ns  38.64ms         1 [ 14.26ms,  14.26ms]  14.26ms   0.00ns  14.26ms
                       'default_lp':         1 [ 38.66ms,  38.66ms]  38.66ms   0.00ns  38.66ms         1 [  3.72ms,   3.72ms]   3.72ms   0.00ns   3.72ms
                 'feasibility_pump':         4 [616.21us,   7.28ms]   5.17ms   2.65ms  20.67ms         3 [878.71us, 954.55us] 904.69us  35.27us   2.71ms
                  'fj_long_default':         0 [  0.00ns,   0.00ns]   0.00ns   0.00ns   0.00ns         0 [  0.00ns,   0.00ns]   0.00ns   0.00ns   0.00ns
                  'fj_long_default':         0 [  0.00ns,   0.00ns]   0.00ns   0.00ns   0.00ns         0 [  0.00ns,   0.00ns]   0.00ns   0.00ns   0.00ns
              'fj_long_lin_default':         0 [  0.00ns,   0.00ns]   0.00ns   0.00ns   0.00ns         0 [  0.00ns,   0.00ns]   0.00ns   0.00ns   0.00ns
              'fj_long_lin_perturb':         0 [  0.00ns,   0.00ns]   0.00ns   0.00ns   0.00ns         0 [  0.00ns,   0.00ns]   0.00ns   0.00ns   0.00ns
               'fj_long_lin_random':         0 [  0.00ns,   0.00ns]   0.00ns   0.00ns   0.00ns         0 [  0.00ns,   0.00ns]   0.00ns   0.00ns   0.00ns
                  'fj_long_perturb':         0 [  0.00ns,   0.00ns]   0.00ns   0.00ns   0.00ns         0 [  0.00ns,   0.00ns]   0.00ns   0.00ns   0.00ns
                   'fj_long_random':         0 [  0.00ns,   0.00ns]   0.00ns   0.00ns   0.00ns         0 [  0.00ns,   0.00ns]   0.00ns   0.00ns   0.00ns
                 'fj_short_default':         0 [  0.00ns,   0.00ns]   0.00ns   0.00ns   0.00ns         0 [  0.00ns,   0.00ns]   0.00ns   0.00ns   0.00ns
                 'fj_short_default':         0 [  0.00ns,   0.00ns]   0.00ns   0.00ns   0.00ns         0 [  0.00ns,   0.00ns]   0.00ns   0.00ns   0.00ns
             'fj_short_lin_default':         0 [  0.00ns,   0.00ns]   0.00ns   0.00ns   0.00ns         0 [  0.00ns,   0.00ns]   0.00ns   0.00ns   0.00ns
             'fj_short_lin_default':         0 [  0.00ns,   0.00ns]   0.00ns   0.00ns   0.00ns         0 [  0.00ns,   0.00ns]   0.00ns   0.00ns   0.00ns
             'fj_short_lin_perturb':         0 [  0.00ns,   0.00ns]   0.00ns   0.00ns   0.00ns         0 [  0.00ns,   0.00ns]   0.00ns   0.00ns   0.00ns
              'fj_short_lin_random':         0 [  0.00ns,   0.00ns]   0.00ns   0.00ns   0.00ns         0 [  0.00ns,   0.00ns]   0.00ns   0.00ns   0.00ns
                 'fj_short_perturb':         0 [  0.00ns,   0.00ns]   0.00ns   0.00ns   0.00ns         0 [  0.00ns,   0.00ns]   0.00ns   0.00ns   0.00ns
                  'fj_short_random':         0 [  0.00ns,   0.00ns]   0.00ns   0.00ns   0.00ns         0 [  0.00ns,   0.00ns]   0.00ns   0.00ns   0.00ns
                        'fs_random':         0 [  0.00ns,   0.00ns]   0.00ns   0.00ns   0.00ns         0 [  0.00ns,   0.00ns]   0.00ns   0.00ns   0.00ns
                        'fs_random':         0 [  0.00ns,   0.00ns]   0.00ns   0.00ns   0.00ns         0 [  0.00ns,   0.00ns]   0.00ns   0.00ns   0.00ns
                        'fs_random':         0 [  0.00ns,   0.00ns]   0.00ns   0.00ns   0.00ns         0 [  0.00ns,   0.00ns]   0.00ns   0.00ns   0.00ns
                        'fs_random':         1 [  3.55ms,   3.55ms]   3.55ms   0.00ns   3.55ms         1 [ 20.00ns,  20.00ns]  20.00ns   0.00ns  20.00ns
                  'fs_random_no_lp':         0 [  0.00ns,   0.00ns]   0.00ns   0.00ns   0.00ns         0 [  0.00ns,   0.00ns]   0.00ns   0.00ns   0.00ns
                  'fs_random_no_lp':         0 [  0.00ns,   0.00ns]   0.00ns   0.00ns   0.00ns         0 [  0.00ns,   0.00ns]   0.00ns   0.00ns   0.00ns
                  'fs_random_no_lp':         0 [  0.00ns,   0.00ns]   0.00ns   0.00ns   0.00ns         0 [  0.00ns,   0.00ns]   0.00ns   0.00ns   0.00ns
                  'fs_random_no_lp':         0 [  0.00ns,   0.00ns]   0.00ns   0.00ns   0.00ns         0 [  0.00ns,   0.00ns]   0.00ns   0.00ns   0.00ns
          'fs_random_quick_restart':         0 [  0.00ns,   0.00ns]   0.00ns   0.00ns   0.00ns         0 [  0.00ns,   0.00ns]   0.00ns   0.00ns   0.00ns
          'fs_random_quick_restart':         0 [  0.00ns,   0.00ns]   0.00ns   0.00ns   0.00ns         0 [  0.00ns,   0.00ns]   0.00ns   0.00ns   0.00ns
          'fs_random_quick_restart':         0 [  0.00ns,   0.00ns]   0.00ns   0.00ns   0.00ns         0 [  0.00ns,   0.00ns]   0.00ns   0.00ns   0.00ns
          'fs_random_quick_restart':         1 [  3.33ms,   3.33ms]   3.33ms   0.00ns   3.33ms         1 [ 20.00ns,  20.00ns]  20.00ns   0.00ns  20.00ns
    'fs_random_quick_restart_no_lp':         0 [  0.00ns,   0.00ns]   0.00ns   0.00ns   0.00ns         0 [  0.00ns,   0.00ns]   0.00ns   0.00ns   0.00ns
    'fs_random_quick_restart_no_lp':         0 [  0.00ns,   0.00ns]   0.00ns   0.00ns   0.00ns         0 [  0.00ns,   0.00ns]   0.00ns   0.00ns   0.00ns
    'fs_random_quick_restart_no_lp':         0 [  0.00ns,   0.00ns]   0.00ns   0.00ns   0.00ns         0 [  0.00ns,   0.00ns]   0.00ns   0.00ns   0.00ns
                    'graph_arc_lns':         4 [  1.61ms,   8.35ms]   4.27ms   2.59ms  17.07ms         4 [ 64.00ns, 254.37us]  76.38us 103.69us 305.50us
                    'graph_cst_lns':         3 [338.05us, 383.58us] 357.12us  19.31us   1.07ms         0 [  0.00ns,   0.00ns]   0.00ns   0.00ns   0.00ns
                    'graph_dec_lns':         3 [993.06us,  10.44ms]   5.07ms   3.96ms  15.20ms         3 [ 10.00ns, 523.94us] 191.00us 236.27us 573.01us
                    'graph_var_lns':         4 [  1.87ms,   4.77ms]   2.91ms   1.11ms  11.64ms         4 [ 10.00ns,  60.79us]  18.75us  24.94us  75.01us
                   'lb_tree_search':         1 [ 37.67ms,  37.67ms]  37.67ms   0.00ns  37.67ms         1 [ 22.98us,  22.98us]  22.98us   0.00ns  22.98us
                           'max_lp':         1 [ 38.33ms,  38.33ms]  38.33ms   0.00ns  38.33ms         1 [407.64us, 407.64us] 407.64us   0.00ns 407.64us
                            'no_lp':         1 [ 37.86ms,  37.86ms]  37.86ms   0.00ns  37.86ms         1 [  5.37ms,   5.37ms]   5.37ms   0.00ns   5.37ms
              'objective_lb_search':         1 [ 37.70ms,  37.70ms]  37.70ms   0.00ns  37.70ms         1 [  3.20ms,   3.20ms]   3.20ms   0.00ns   3.20ms
       'objective_lb_search_max_lp':         1 [ 36.87ms,  36.87ms]  36.87ms   0.00ns  36.87ms         1 [703.67us, 703.67us] 703.67us   0.00ns 703.67us
        'objective_lb_search_no_lp':         1 [ 36.66ms,  36.66ms]  36.66ms   0.00ns  36.66ms         1 [  4.34ms,   4.34ms]   4.34ms   0.00ns   4.34ms
  'objective_shaving_search_max_lp':         4 [  1.85ms,   9.57ms]   4.58ms   3.00ms  18.31ms         1 [171.53us, 171.53us] 171.53us   0.00ns 171.53us
   'objective_shaving_search_no_lp':         4 [  2.72ms,  10.84ms]   5.31ms   3.25ms  21.23ms         1 [415.75us, 415.75us] 415.75us   0.00ns 415.75us
                          'probing':         1 [ 39.12ms,  39.12ms]  39.12ms   0.00ns  39.12ms         1 [  1.00ms,   1.00ms]   1.00ms   0.00ns   1.00ms
                   'probing_max_lp':         1 [ 37.03ms,  37.03ms]  37.03ms   0.00ns  37.03ms         1 [ 22.69us,  22.69us]  22.69us   0.00ns  22.69us
                     'pseudo_costs':         1 [ 38.06ms,  38.06ms]  38.06ms   0.00ns  38.06ms         1 [732.02us, 732.02us] 732.02us   0.00ns 732.02us
                    'quick_restart':         1 [ 38.09ms,  38.09ms]  38.09ms   0.00ns  38.09ms         1 [  3.60ms,   3.60ms]   3.60ms   0.00ns   3.60ms
              'quick_restart_no_lp':         1 [ 37.66ms,  37.66ms]  37.66ms   0.00ns  37.66ms         1 [  5.09ms,   5.09ms]   5.09ms   0.00ns   5.09ms
                    'reduced_costs':         1 [ 38.59ms,  38.59ms]  38.59ms   0.00ns  38.59ms         1 [812.76us, 812.76us] 812.76us   0.00ns 812.76us
                        'rins/rens':         4 [ 73.61us,   4.67ms]   2.18ms   1.97ms   8.70ms         2 [ 75.07us, 130.59us] 102.83us  27.76us 205.67us
                      'rnd_cst_lns':         4 [371.71us,   5.11ms]   2.27ms   1.80ms   9.08ms         3 [ 10.00ns, 116.96us]  39.02us  55.11us 117.07us
                      'rnd_var_lns':         4 [  1.11ms,   2.65ms]   1.87ms 588.71us   7.48ms         4 [ 10.00ns,   3.66us] 925.50ns   1.58us   3.70us
                     'violation_ls':         3 [ 66.22us,  23.03ms]   7.89ms  10.71ms  23.67ms         3 [850.00ns,  12.49ms]   4.18ms   5.87ms  12.54ms
                     'violation_ls':         3 [203.17us,  22.48ms]   7.68ms  10.47ms  23.04ms         3 [  8.05us,   9.61ms]   3.22ms   4.52ms   9.65ms
                     'violation_ls':         4 [ 65.82us,   7.03ms]   1.89ms   2.97ms   7.57ms         4 [510.00ns,   4.07ms]   1.03ms   1.76ms   4.12ms
                     'violation_ls':         4 [ 99.73us, 911.89us] 324.04us 339.86us   1.30ms         4 [450.00ns, 294.40us]  74.45us 126.99us 297.81us
                     'violation_ls':         4 [116.69us,   6.10ms]   1.72ms   2.54ms   6.87ms         4 [510.00ns,   3.51ms] 890.03us   1.51ms   3.56ms

Search stats                        Bools  Conflicts  Branches  Restarts  BoolPropag  IntegerPropag
                           'core':    246        113     1'706       599      54'395         28'172
                     'default_lp':     59        103       761       306       2'627         15'545
                      'fs_random':      0          0         0         0           0              0
                      'fs_random':      0          0         0         0           0              0
                      'fs_random':      0          0         0         0           0              0
                      'fs_random':     38          0         0         0           0              0
                'fs_random_no_lp':      0          0         0         0           0              0
                'fs_random_no_lp':      0          0         0         0           0              0
                'fs_random_no_lp':      0          0         0         0           0              0
                'fs_random_no_lp':      0          0         0         0           0              0
        'fs_random_quick_restart':      0          0         0         0           0              0
        'fs_random_quick_restart':      0          0         0         0           0              0
        'fs_random_quick_restart':      0          0         0         0           0              0
        'fs_random_quick_restart':     38          0         0         0           0              0
  'fs_random_quick_restart_no_lp':      0          0         0         0           0              0
  'fs_random_quick_restart_no_lp':      0          0         0         0           0              0
  'fs_random_quick_restart_no_lp':      0          0         0         0           0              0
                 'lb_tree_search':     38          0        76        76          77            392
                         'max_lp':     38          0        76        76          77            393
                          'no_lp':    115        167     1'413       367       7'328         32'543
            'objective_lb_search':     42         57       600       296       1'226         10'823
     'objective_lb_search_max_lp':     38          0        76        76          96            566
      'objective_lb_search_no_lp':     53        201       954       358       3'138         28'311
                        'probing':     80         21       139       139         460          1'794
                 'probing_max_lp':     38          0        76        76          77            392
                   'pseudo_costs':     38          0        76        76          96            566
                  'quick_restart':     56         46       660       296       1'363         11'240
            'quick_restart_no_lp':    149        167     1'459       356       8'832         30'423
                  'reduced_costs':     38          0        76        76          96            566

SAT stats                           ClassicMinim  LitRemoved  LitLearned  LitForgotten  Subsumed  MClauses  MDecisions  MLitTrue  MSubsumed  MLitRemoved  MReused
                           'core':            38          43         133             0         1       195         883         0         51          155        6
                     'default_lp':            23          28         552             0        15        83         365         1         41          215        5
                      'fs_random':             0           0           0             0         0         0           0         0          0            0        0
                      'fs_random':             0           0           0             0         0         0           0         0          0            0        0
                      'fs_random':             0           0           0             0         0         0           0         0          0            0        0
                      'fs_random':             0           0           0             0         0         0           0         0          0            0        0
                'fs_random_no_lp':             0           0           0             0         0         0           0         0          0            0        0
                'fs_random_no_lp':             0           0           0             0         0         0           0         0          0            0        0
                'fs_random_no_lp':             0           0           0             0         0         0           0         0          0            0        0
                'fs_random_no_lp':             0           0           0             0         0         0           0         0          0            0        0
        'fs_random_quick_restart':             0           0           0             0         0         0           0         0          0            0        0
        'fs_random_quick_restart':             0           0           0             0         0         0           0         0          0            0        0
        'fs_random_quick_restart':             0           0           0             0         0         0           0         0          0            0        0
        'fs_random_quick_restart':             0           0           0             0         0         0           0         0          0            0        0
  'fs_random_quick_restart_no_lp':             0           0           0             0         0         0           0         0          0            0        0
  'fs_random_quick_restart_no_lp':             0           0           0             0         0         0           0         0          0            0        0
  'fs_random_quick_restart_no_lp':             0           0           0             0         0         0           0         0          0            0        0
                 'lb_tree_search':             0           0           0             0         0         0           0         0          0            0        0
                         'max_lp':             0           0           0             0         0         0           0         0          0            0        0
                          'no_lp':            84         167         859             0        15        81         443         0         21          113       18
            'objective_lb_search':            33          69         220             0         9        51         240         0          1            3       12
     'objective_lb_search_max_lp':             0           0           0             0         0         0           0         0          0            0        0
      'objective_lb_search_no_lp':           131         277         752             0        15        82         418         0         16           82       18
                        'probing':             0           0          21             0         0         0           0         0          0            0        0
                 'probing_max_lp':             0           0           0             0         0         0           0         0          0            0        0
                   'pseudo_costs':             0           0           0             0         0         0           0         0          0            0        0
                  'quick_restart':            16          20         297             0         9        54         268         0          9           45        8
            'quick_restart_no_lp':            80         135         980             0        10        67         341         0         17           88       11
                  'reduced_costs':             0           0           0             0         0         0           0         0          0            0        0

Lp stats                         Component  Iterations  AddedCuts  OPTIMAL  DUAL_F.  DUAL_U.
                  'default_lp':          1         275        123       87        0        0
                   'fs_random':          1           0          0        0        0        0
     'fs_random_quick_restart':          1           0          0        0        0        0
              'lb_tree_search':          1          68        323        3        0        0
                      'max_lp':          1          76        322        3        1        0
         'objective_lb_search':          1         353        143       80        0        0
  'objective_lb_search_max_lp':          1         102        320       12        0        0
                     'probing':          1          55        164      102        0        0
              'probing_max_lp':          1          65        318        3        0        0
                'pseudo_costs':          1         105        321       12        0        0
               'quick_restart':          1         385        112       96        0        0
               'reduced_costs':          1         112        308       13        0        0

Lp dimension                                                                    Final dimension of first component
                  'default_lp':    80 rows, 62 columns, 206 entries with magnitude in [9.305407e-03, 1.000000e+00]
                   'fs_random':       0 rows, 62 columns, 0 entries with magnitude in [0.000000e+00, 0.000000e+00]
     'fs_random_quick_restart':       0 rows, 62 columns, 0 entries with magnitude in [0.000000e+00, 0.000000e+00]
              'lb_tree_search':  325 rows, 64 columns, 1771 entries with magnitude in [3.131663e-03, 1.000000e+00]
                      'max_lp':  343 rows, 64 columns, 1885 entries with magnitude in [2.220595e-03, 1.000000e+00]
         'objective_lb_search':    94 rows, 62 columns, 259 entries with magnitude in [2.475057e-03, 1.000000e+00]
  'objective_lb_search_max_lp':   188 rows, 64 columns, 830 entries with magnitude in [8.594778e-04, 1.000000e+00]
                     'probing':    90 rows, 62 columns, 337 entries with magnitude in [2.524972e-03, 1.000000e+00]
              'probing_max_lp':  336 rows, 64 columns, 1843 entries with magnitude in [2.892007e-03, 1.000000e+00]
                'pseudo_costs':   189 rows, 64 columns, 852 entries with magnitude in [2.745965e-04, 1.000000e+00]
               'quick_restart':    96 rows, 62 columns, 265 entries with magnitude in [4.428074e-03, 1.000000e+00]
               'reduced_costs':   181 rows, 64 columns, 773 entries with magnitude in [2.123062e-03, 1.000000e+00]

Lp debug                         CutPropag  CutEqPropag  Adjust  Overflow  Bad  BadScaling
                  'default_lp':          0            0      23         0   37           0
                   'fs_random':          0            0       0         0    0           0
     'fs_random_quick_restart':          0            0       0         0    0           0
              'lb_tree_search':          1            0       2         0  124           0
                      'max_lp':          1            0       3         0  125           0
         'objective_lb_search':          0            0      29         0   72           0
  'objective_lb_search_max_lp':          0            0       6         0  119           0
                     'probing':          0            0      93         0   50           0
              'probing_max_lp':          1            0       2         0  120           0
                'pseudo_costs':          0            0       7         0  140           0
               'quick_restart':          0            0      42         0   37           0
               'reduced_costs':          0            0       4         0  139           0

Lp pool                          Constraints  Updates  Simplif  Merged  Shortened  Split  Strenghtened  Cuts/Call
                  'default_lp':          175       65       92       0         34      0            73    123/213
                   'fs_random':           52        0        0       0          0      0             0        0/0
     'fs_random_quick_restart':           52        0        0       0          0      0             0        0/0
              'lb_tree_search':          582        0       22       0          0      0            95    323/475
                      'max_lp':          581        0       22       0          0      0            96    322/467
         'objective_lb_search':          195      115      144       0         28      0           120    143/265
  'objective_lb_search_max_lp':          573       26      195       6          0      2           481    320/534
                     'probing':          216       36       41       0          0      0            55    164/288
              'probing_max_lp':          577        0       22       0          0      0            98    318/465
                'pseudo_costs':          573       28      195       7          0      5           478    321/533
               'quick_restart':          164      141      167       0         25      0           125    112/199
               'reduced_costs':          561       29      254       6          0      7           536    308/523

Lp Cut            defaul  max_lp  quick_  reduce  pseudo  lb_tre  probin  object  probin  object
          CG_FF:       5      32       4      30      29      32      13       8      32      34
           CG_K:       1      19       1      10      11      19       1       1      19      10
           CG_R:       5      18       1      19      22      18       1       1      18      20
          CG_RB:      16      47      10      53      58      47      28      20      47      51
         CG_RBP:       1      17       -       9      12      17       4       -      15      10
             IB:      58      55      67      66      69      54      58      61      54      68
       MIR_1_FF:       7      19       5      19      17      18      13      10      20      19
        MIR_1_K:       -       5       -       -       -       5       -       -       5       -
        MIR_1_R:       3       4       2       8       8       3       2       4       4       9
       MIR_1_RB:       9      18       6      24      25      18       8      14      18      24
      MIR_1_RBP:       -      12       -       2       1      12       -       -      12       3
      MIR_1_RLT:       -       -       -       2       2       -       -       -       -       2
       MIR_2_FF:       1       6       1       6       8       8       1       1       6       6
        MIR_2_K:       -       5       -       3       2       4       -       -       3       1
        MIR_2_R:       1       3       2       5       5       2       3       2       3       5
       MIR_2_RB:       -       5       -       3       2       4       3       3       3       2
      MIR_2_RBP:       -       5       -       1       2       2       -       -       3       -
       MIR_3_FF:       -       2       -       1       2       6       -       -       4       4
        MIR_3_K:       -       -       -       1       2       1       -       -       -       3
        MIR_3_R:       -       2       -       3       2       4       -       -       2       2
       MIR_3_RB:       1       3       -       2       1       6       1       1       3       2
      MIR_3_RBP:       -       1       -       1       1       2       -       -       -       -
       MIR_4_FF:       -       3       -       1       -       2       -       -       2       2
        MIR_4_K:       -       -       -       -       -       1       -       -       -       -
        MIR_4_R:       -       1       -       -       -       2       -       -       2       2
       MIR_4_RB:       -       3       -       1       1       2       -       -       3       3
      MIR_4_RBP:       -       -       -       -       -       1       -       -       1       -
       MIR_5_FF:       -       1       -       -       -       -       -       -       1       -
       MIR_6_FF:       -       -       -       -       -       1       -       -       1       -
   ZERO_HALF_FF:       5       9       2       9       9      10       9       5      11      10
    ZERO_HALF_K:       -       2       -       -       -       1       -       -       1       -
    ZERO_HALF_R:       7       9       8      15      17       9      11       9      11      16
   ZERO_HALF_RB:       3       9       3      10      10       7       8       3       8       9
  ZERO_HALF_RBP:       -       7       -       4       3       5       -       -       6       3

LNS stats           Improv/Calls  Closed  Difficulty  TimeLimit
  'graph_arc_lns':           3/4     75%        0.82       0.10
  'graph_cst_lns':           0/0      0%        0.50       0.10
  'graph_dec_lns':           2/3    100%        0.88       0.10
  'graph_var_lns':           2/4    100%        0.91       0.10
      'rins/rens':           3/3    100%        0.88       0.10
    'rnd_cst_lns':           0/3    100%        0.88       0.10
    'rnd_var_lns':           2/4    100%        0.91       0.10

LS stats                   Batches  Restarts  LinMoves  GenMoves  CompoundMoves  WeightUpdates
       'fj_long_default':        0         0         0         0              0              0
       'fj_long_default':        0         0         0         0              0              0
   'fj_long_lin_default':        0         0         0         0              0              0
   'fj_long_lin_perturb':        0         0         0         0              0              0
    'fj_long_lin_random':        0         0         0         0              0              0
       'fj_long_perturb':        0         0         0         0              0              0
        'fj_long_random':        0         0         0         0              0              0
      'fj_short_default':        0         0         0         0              0              0
      'fj_short_default':        0         0         0         0              0              0
  'fj_short_lin_default':        0         0         0         0              0              0
  'fj_short_lin_default':        0         0         0         0              0              0
  'fj_short_lin_perturb':        0         0         0         0              0              0
   'fj_short_lin_random':        0         0         0         0              0              0
      'fj_short_perturb':        0         0         0         0              0              0
       'fj_short_random':        0         0         0         0              0              0
          'violation_ls':        3         0        10     3'309            119             39
          'violation_ls':        3         0     2'139         2              2          1'920
          'violation_ls':        4         0         6        80              6              3
          'violation_ls':        4         0       810        21              5            998
          'violation_ls':        4         0       964        22              6          1'109

Solutions (27)            Num     Rank
        'graph_arc_lns':    1  [14,14]
                'no_lp':    9   [1,27]
  'quick_restart_no_lp':    5   [2,24]
          'rnd_var_lns':    2  [11,20]
         'violation_ls':   10   [9,26]

Objective bounds                Num
                  'bool_core':    4
                 'default_lp':    1
             'initial_domain':    1
  'objective_lb_search_no_lp':   10
                    'probing':    1

Solution repositories    Added  Queried  Ignored  Synchro
  'feasible solutions':     55       72        0       37
        'lp solutions':      0        0        0        0
                'pump':     62        3

Improving bounds shared         Num
                       'core':   10
                 'default_lp':   10
                      'no_lp':   44
        'objective_lb_search':   14
  'objective_lb_search_no_lp':   33
                    'probing':   16
              'quick_restart':   23
        'quick_restart_no_lp':   71

Clauses shared                  Num
                 'default_lp':   11
                      'no_lp':   14
        'objective_lb_search':    3
  'objective_lb_search_no_lp':    4
              'quick_restart':    3
        'quick_restart_no_lp':    1

CpSolverResponse summary:
status: OPTIMAL
objective: 288
best_bound: 288
integers: 0
booleans: 0
conflicts: 0
branches: 0
propagations: 0
integer_propagations: 0
restarts: 0
lp_iterations: 0
walltime: 0.0738253
usertime: 0.0738254
deterministic_time: 0.07867
gap_integral: 0.0860632
solution_fingerprint: 0xdb83e67483675788


--- Simulation Gantt  partir du modle mathmatique ---
{'big':0, 'due_date':71, 'pos_time':5, 'status':3, 'blocked':1, 'operations':["{'type':0, 'processing_time':39}", "{'type':1, 'processing_time':15}"]}
{'big':1, 'due_date':82, 'pos_time':5, 'status':0, 'blocked':1, 'operations':["{'type':0, 'processing_time':11}"]}
{'big':0, 'due_date':82, 'pos_time':5, 'status':1, 'blocked':2, 'operations':["{'type':0, 'processing_time':45}"]}
{'big':1, 'due_date':157, 'pos_time':5, 'status':1, 'blocked':1, 'operations':["{'type':0, 'processing_time':27}", "{'type':1, 'processing_time':43}"]}
