created virtual environment CPython3.12.4.final.0-64 in 9543ms
  creator CPython3Posix(dest=/localscratch/aneumann.63390696.0/env, clear=False, no_vcs_ignore=False, global=False)
  seeder FromAppData(download=False, pip=bundle, via=copy, app_data_dir=/home/aneumann/.local/share/virtualenv)
    added seed packages: pip==25.1.1
  activators BashActivator,CShellActivator,FishActivator,NushellActivator,PowerShellActivator,PythonActivator
Looking in links: /cvmfs/soft.computecanada.ca/custom/python/wheelhouse/gentoo2023/x86-64-v3, /cvmfs/soft.computecanada.ca/custom/python/wheelhouse/gentoo2023/generic, /cvmfs/soft.computecanada.ca/custom/python/wheelhouse/generic
Requirement already satisfied: pip in /localscratch/aneumann.63390696.0/env/lib/python3.12/site-packages (25.1.1)
Looking in links: /cvmfs/soft.computecanada.ca/custom/python/wheelhouse/gentoo2023/x86-64-v3, /cvmfs/soft.computecanada.ca/custom/python/wheelhouse/gentoo2023/generic, /cvmfs/soft.computecanada.ca/custom/python/wheelhouse/generic
ERROR: protobuf-5.28.3-cp38-abi3-manylinux2014_x86_64.whl is not a supported wheel on this platform.
Looking in links: /cvmfs/soft.computecanada.ca/custom/python/wheelhouse/gentoo2023/x86-64-v3, /cvmfs/soft.computecanada.ca/custom/python/wheelhouse/gentoo2023/generic, /cvmfs/soft.computecanada.ca/custom/python/wheelhouse/generic
Processing /home/aneumann/projects/def-adhaj/aneumann/GNRS/wheels/immutabledict-4.2.0-py3-none-any.whl
Installing collected packages: immutabledict
Successfully installed immutabledict-4.2.0
Looking in links: /cvmfs/soft.computecanada.ca/custom/python/wheelhouse/gentoo2023/x86-64-v3, /cvmfs/soft.computecanada.ca/custom/python/wheelhouse/gentoo2023/generic, /cvmfs/soft.computecanada.ca/custom/python/wheelhouse/generic
Processing /cvmfs/soft.computecanada.ca/custom/python/wheelhouse/generic/ortools-9.10.4067+computecanada-cp312-cp312-linux_x86_64.whl (from -r /home/aneumann/projects/def-adhaj/aneumann/GNRS/requirements/or.txt (line 1))
Processing /cvmfs/soft.computecanada.ca/custom/python/wheelhouse/gentoo2023/x86-64-v3/matplotlib-3.10.0+computecanada-cp312-cp312-linux_x86_64.whl (from -r /home/aneumann/projects/def-adhaj/aneumann/GNRS/requirements/or.txt (line 2))
Processing /cvmfs/soft.computecanada.ca/custom/python/wheelhouse/gentoo2023/x86-64-v3/pandas-2.2.3+computecanada-cp312-cp312-linux_x86_64.whl (from -r /home/aneumann/projects/def-adhaj/aneumann/GNRS/requirements/or.txt (line 3))
Processing /cvmfs/soft.computecanada.ca/custom/python/wheelhouse/generic/absl_py-2.2.2+computecanada-py3-none-any.whl (from ortools<9.11,>=9.10->-r /home/aneumann/projects/def-adhaj/aneumann/GNRS/requirements/or.txt (line 1))
Processing /cvmfs/soft.computecanada.ca/custom/python/wheelhouse/gentoo2023/generic/numpy-2.2.2+computecanada-cp312-cp312-linux_x86_64.whl (from ortools<9.11,>=9.10->-r /home/aneumann/projects/def-adhaj/aneumann/GNRS/requirements/or.txt (line 1))
Processing /cvmfs/soft.computecanada.ca/custom/python/wheelhouse/gentoo2023/x86-64-v3/protobuf-6.30.2+computecanada-cp312-cp312-linux_x86_64.whl (from ortools<9.11,>=9.10->-r /home/aneumann/projects/def-adhaj/aneumann/GNRS/requirements/or.txt (line 1))
Requirement already satisfied: immutabledict>=3.0.0 in /localscratch/aneumann.63390696.0/env/lib/python3.12/site-packages (from ortools<9.11,>=9.10->-r /home/aneumann/projects/def-adhaj/aneumann/GNRS/requirements/or.txt (line 1)) (4.2.0)
Processing /cvmfs/soft.computecanada.ca/custom/python/wheelhouse/gentoo2023/generic/contourpy-1.3.1+computecanada-cp312-cp312-linux_x86_64.whl (from matplotlib->-r /home/aneumann/projects/def-adhaj/aneumann/GNRS/requirements/or.txt (line 2))
Processing /cvmfs/soft.computecanada.ca/custom/python/wheelhouse/generic/cycler-0.12.1+computecanada-py3-none-any.whl (from matplotlib->-r /home/aneumann/projects/def-adhaj/aneumann/GNRS/requirements/or.txt (line 2))
Processing /cvmfs/soft.computecanada.ca/custom/python/wheelhouse/generic/fonttools-4.58.2+computecanada-cp312-cp312-linux_x86_64.whl (from matplotlib->-r /home/aneumann/projects/def-adhaj/aneumann/GNRS/requirements/or.txt (line 2))
Processing /cvmfs/soft.computecanada.ca/custom/python/wheelhouse/gentoo2023/x86-64-v3/kiwisolver-1.4.8+computecanada-cp312-cp312-linux_x86_64.whl (from matplotlib->-r /home/aneumann/projects/def-adhaj/aneumann/GNRS/requirements/or.txt (line 2))
Processing /cvmfs/soft.computecanada.ca/custom/python/wheelhouse/generic/packaging-25.0+computecanada-py3-none-any.whl (from matplotlib->-r /home/aneumann/projects/def-adhaj/aneumann/GNRS/requirements/or.txt (line 2))
Processing /cvmfs/soft.computecanada.ca/custom/python/wheelhouse/gentoo2023/x86-64-v3/pillow-11.1.0+computecanada-cp312-cp312-linux_x86_64.whl (from matplotlib->-r /home/aneumann/projects/def-adhaj/aneumann/GNRS/requirements/or.txt (line 2))
Processing /cvmfs/soft.computecanada.ca/custom/python/wheelhouse/generic/pyparsing-3.2.1+computecanada-py3-none-any.whl (from matplotlib->-r /home/aneumann/projects/def-adhaj/aneumann/GNRS/requirements/or.txt (line 2))
Processing /cvmfs/soft.computecanada.ca/custom/python/wheelhouse/generic/python_dateutil-2.9.0.post0+computecanada-py2.py3-none-any.whl (from matplotlib->-r /home/aneumann/projects/def-adhaj/aneumann/GNRS/requirements/or.txt (line 2))
Processing /cvmfs/soft.computecanada.ca/custom/python/wheelhouse/generic/pytz-2025.2+computecanada-py2.py3-none-any.whl (from pandas->-r /home/aneumann/projects/def-adhaj/aneumann/GNRS/requirements/or.txt (line 3))
Processing /cvmfs/soft.computecanada.ca/custom/python/wheelhouse/generic/tzdata-2025.2+computecanada-py2.py3-none-any.whl (from pandas->-r /home/aneumann/projects/def-adhaj/aneumann/GNRS/requirements/or.txt (line 3))
Processing /cvmfs/soft.computecanada.ca/custom/python/wheelhouse/generic/six-1.17.0+computecanada-py2.py3-none-any.whl (from python-dateutil>=2.7->matplotlib->-r /home/aneumann/projects/def-adhaj/aneumann/GNRS/requirements/or.txt (line 2))
Installing collected packages: pytz, tzdata, six, pyparsing, protobuf, pillow, packaging, numpy, kiwisolver, fonttools, cycler, absl-py, python-dateutil, contourpy, pandas, matplotlib, ortools

Successfully installed absl-py-2.2.2+computecanada contourpy-1.3.1+computecanada cycler-0.12.1+computecanada fonttools-4.58.2+computecanada kiwisolver-1.4.8+computecanada matplotlib-3.10.0+computecanada numpy-2.2.2+computecanada ortools-9.10.4067+computecanada packaging-25.0+computecanada pandas-2.2.3+computecanada pillow-11.1.0+computecanada protobuf-6.30.2+computecanada pyparsing-3.2.1+computecanada python-dateutil-2.9.0.post0+computecanada pytz-2025.2+computecanada six-1.17.0+computecanada tzdata-2025.2+computecanada

Starting CP-SAT solver v9.10.4067
Parameters: max_time_in_seconds: 3600 max_memory_in_mb: 12000 log_search_progress: true enumerate_all_solutions: false absolute_gap_limit: 0 relative_gap_limit: 0
Setting number of workers to 48

Initial optimization model '': (model_fingerprint: 0xf905dafefc52dc44)
#Variables: 133 (#ints: 5 in objective)
  - 84 Booleans in [0,1]
  - 49 in [0,355]
#kLinear1: 16
#kLinear2: 147
#kLinear3: 56
#kLinearN: 393 (#terms: 3'527)

Starting presolve at 0.00s
  2.00e-04s  0.00e+00d  [DetectDominanceRelations] 
  5.95e-03s  0.00e+00d  [PresolveToFixPoint] #num_loops=6 #num_dual_strengthening=3 
  1.55e-05s  0.00e+00d  [ExtractEncodingFromLinear] #potential_supersets=3 
[Symmetry] Graph for symmetry has 673 nodes and 2'485 arcs.
[Symmetry] Symmetry computation done. time: 0.000406564 dtime: 0.00023338
[SAT presolve] num removable Booleans: 0 / 34
[SAT presolve] num trivial clauses: 0
[SAT presolve] [0s] clauses:9 literals:27 vars:18 one_side_vars:15 simple_definition:3 singleton_clauses:0
[SAT presolve] [3.8671e-05s] clauses:9 literals:27 vars:18 one_side_vars:15 simple_definition:3 singleton_clauses:0
[SAT presolve] [5.1452e-05s] clauses:9 literals:27 vars:18 one_side_vars:15 simple_definition:3 singleton_clauses:0
  1.76e-03s  1.81e-04d  [Probe] #probed=156 #fixed_bools=2 #new_bounds=8 #new_binary_clauses=13 
  2.37e-05s  0.00e+00d  [MaxClique] 
  1.82e-04s  0.00e+00d  [DetectDominanceRelations] 
  2.41e-03s  0.00e+00d  [PresolveToFixPoint] #num_loops=4 #num_dual_strengthening=3 
  5.22e-04s  0.00e+00d  [ProcessAtMostOneAndLinear] 
  4.35e-04s  0.00e+00d  [DetectDuplicateConstraints] #duplicates=90 #without_enforcements=23 
  1.74e-04s  4.85e-06d  [DetectDominatedLinearConstraints] #relevant_constraints=233 #num_inclusions=111 #num_redundant=4 
  1.03e-04s  0.00e+00d  [DetectDifferentVariables] #different=13 
  6.10e-05s  1.29e-06d  [ProcessSetPPC] #relevant_constraints=105 
  8.20e-06s  0.00e+00d  [FindAlmostIdenticalLinearConstraints] 
  3.69e-05s  1.83e-05d  [FindBigAtMostOneAndLinearOverlap] 
  3.26e-04s  1.05e-04d  [FindBigVerticalLinearOverlap] #blocks=2 #saved_nz=72 
  2.44e-05s  3.64e-06d  [FindBigHorizontalLinearOverlap] #linears=88 
  2.19e-05s  1.35e-07d  [MergeClauses] 
  1.76e-04s  0.00e+00d  [DetectDominanceRelations] 
  1.37e-03s  0.00e+00d  [PresolveToFixPoint] #num_loops=2 #num_dual_strengthening=1 
  1.64e-04s  0.00e+00d  [DetectDominanceRelations] 
  1.14e-03s  0.00e+00d  [PresolveToFixPoint] #num_loops=1 #num_dual_strengthening=1 
[Symmetry] Graph for symmetry has 573 nodes and 2'121 arcs.
[Symmetry] Symmetry computation done. time: 0.000147746 dtime: 0.00016969
[SAT presolve] num removable Booleans: 0 / 32
[SAT presolve] num trivial clauses: 0
[SAT presolve] [0s] clauses:9 literals:27 vars:18 one_side_vars:15 simple_definition:3 singleton_clauses:0
[SAT presolve] [2.9725e-05s] clauses:9 literals:27 vars:18 one_side_vars:15 simple_definition:3 singleton_clauses:0
[SAT presolve] [4.0901e-05s] clauses:9 literals:27 vars:18 one_side_vars:15 simple_definition:3 singleton_clauses:0
  1.50e-03s  1.69e-04d  [Probe] #probed=150 #new_bounds=6 #new_binary_clauses=13 
  8.93e-06s  0.00e+00d  [MaxClique] 
  1.72e-04s  0.00e+00d  [DetectDominanceRelations] 
  1.88e-03s  0.00e+00d  [PresolveToFixPoint] #num_loops=4 #num_dual_strengthening=3 
  4.02e-04s  0.00e+00d  [ProcessAtMostOneAndLinear] 
  3.38e-04s  0.00e+00d  [DetectDuplicateConstraints] #without_enforcements=23 
  1.06e-04s  3.19e-06d  [DetectDominatedLinearConstraints] #relevant_constraints=179 #num_inclusions=22 
  9.68e-05s  0.00e+00d  [DetectDifferentVariables] #different=15 
  5.72e-05s  1.22e-06d  [ProcessSetPPC] #relevant_constraints=100 
  9.73e-06s  0.00e+00d  [FindAlmostIdenticalLinearConstraints] 
  3.28e-05s  1.74e-05d  [FindBigAtMostOneAndLinearOverlap] 
  2.44e-04s  9.94e-05d  [FindBigVerticalLinearOverlap] 
  2.30e-05s  3.64e-06d  [FindBigHorizontalLinearOverlap] #linears=88 
  1.76e-05s  1.35e-07d  [MergeClauses] 
  1.71e-04s  0.00e+00d  [DetectDominanceRelations] 
  1.16e-03s  0.00e+00d  [PresolveToFixPoint] #num_loops=1 #num_dual_strengthening=1 
  1.69e-04s  0.00e+00d  [DetectDominanceRelations] 
  1.15e-03s  0.00e+00d  [PresolveToFixPoint] #num_loops=1 #num_dual_strengthening=1 
[Symmetry] Graph for symmetry has 573 nodes and 2'121 arcs.
[Symmetry] Symmetry computation done. time: 0.000147258 dtime: 0.00016981
[SAT presolve] num removable Booleans: 0 / 32
[SAT presolve] num trivial clauses: 0
[SAT presolve] [0s] clauses:9 literals:27 vars:18 one_side_vars:15 simple_definition:3 singleton_clauses:0
[SAT presolve] [2.9266e-05s] clauses:9 literals:27 vars:18 one_side_vars:15 simple_definition:3 singleton_clauses:0
[SAT presolve] [4.0623e-05s] clauses:9 literals:27 vars:18 one_side_vars:15 simple_definition:3 singleton_clauses:0
  1.47e-03s  1.67e-04d  [Probe] #probed=150 #new_binary_clauses=13 
  4.66e-06s  0.00e+00d  [MaxClique] 
  1.71e-04s  0.00e+00d  [DetectDominanceRelations] 
  1.18e-03s  0.00e+00d  [PresolveToFixPoint] #num_loops=1 #num_dual_strengthening=1 
  4.01e-04s  0.00e+00d  [ProcessAtMostOneAndLinear] 
  3.39e-04s  0.00e+00d  [DetectDuplicateConstraints] #without_enforcements=23 
  1.06e-04s  3.19e-06d  [DetectDominatedLinearConstraints] #relevant_constraints=179 #num_inclusions=22 
  9.57e-05s  0.00e+00d  [DetectDifferentVariables] #different=15 
  5.68e-05s  1.22e-06d  [ProcessSetPPC] #relevant_constraints=100 
  9.52e-06s  0.00e+00d  [FindAlmostIdenticalLinearConstraints] 
  3.34e-05s  1.74e-05d  [FindBigAtMostOneAndLinearOverlap] 
  2.49e-04s  9.94e-05d  [FindBigVerticalLinearOverlap] 
  2.28e-05s  3.64e-06d  [FindBigHorizontalLinearOverlap] #linears=88 
  1.75e-05s  1.35e-07d  [MergeClauses] 
  1.70e-04s  0.00e+00d  [DetectDominanceRelations] 
  1.16e-03s  0.00e+00d  [PresolveToFixPoint] #num_loops=1 #num_dual_strengthening=1 
  2.26e-05s  0.00e+00d  [ExpandObjective] #entries=26 #tight_variables=13 #tight_constraints=5 

Presolve summary:
  - 20 affine relations were detected.
  - rule 'TODO dual: add implied bound' was applied 12 times.
  - rule 'TODO dual: only one blocking constraint?' was applied 435 times.
  - rule 'TODO dual: only one blocking enforced constraint?' was applied 12 times.
  - rule 'TODO dual: only one unspecified blocking constraint?' was applied 75 times.
  - rule 'TODO duplicate: identical constraint with different enforcements' was applied 69 times.
  - rule 'TODO linear2: contains a Boolean.' was applied 18 times.
  - rule 'affine: new relation' was applied 20 times.
  - rule 'at_most_one: removed literals' was applied 1 time.
  - rule 'at_most_one: size one' was applied 1 time.
  - rule 'deductions: 64 stored' was applied 1 time.
  - rule 'dual: fix variable' was applied 8 times.
  - rule 'dual: reduced domain' was applied 24 times.
  - rule 'duplicate: merged rhs of linear constraint' was applied 12 times.
  - rule 'duplicate: removed constraint' was applied 90 times.
  - rule 'enforcement: false literal' was applied 10 times.
  - rule 'enforcement: true literal' was applied 9 times.
  - rule 'incompatible linear: add implication' was applied 9 times.
  - rule 'linear inclusion: redundant containing constraint' was applied 3 times.
  - rule 'linear inclusion: redundant included constraint' was applied 1 time.
  - rule 'linear matrix: common vertical rectangle' was applied 2 times.
  - rule 'linear2: contains a Boolean.' was applied 14 times.
  - rule 'linear: always true' was applied 144 times.
  - rule 'linear: doubleton free' was applied 5 times.
  - rule 'linear: empty' was applied 14 times.
  - rule 'linear: extracted enforcement literal' was applied 792 times.
  - rule 'linear: fixed or dup variables' was applied 371 times.
  - rule 'linear: negative clause' was applied 9 times.
  - rule 'linear: positive equal one' was applied 3 times.
  - rule 'linear: reduced variable domains' was applied 54 times.
  - rule 'linear: remapped using affine relations' was applied 361 times.
  - rule 'linear: simplified rhs' was applied 1'212 times.
  - rule 'linear: variable substitution 1' was applied 5 times.
  - rule 'presolve: 39 unused variables removed.' was applied 1 time.
  - rule 'presolve: iteration' was applied 3 times.
  - rule 'probing: reduced enforced constraint to implication.' was applied 1 time.

Presolved optimization model '': (model_fingerprint: 0x7509b0d87ea26c2f)
#Variables: 71 (#ints: 5 in objective)
  - 32 Booleans in [0,1]
  - 1 in [-5,293]
  - 1 in [0,188]
  - 4 in [0,239]
  - 1 in [0,243]
  - 1 in [0,274]
  - 1 in [0,276]
  - 3 in [0,280]
  - 4 in [0,298]
  - 3 in [0,321]
  - 1 in [3,283]
  - 1 in [4,321]
  - 1 in [27,307]
  - 1 in [58,297]
  - 1 in [63,302]
  - 2 in [68,344]
  - 2 in [70,344]
  - 1 in [74,350]
  - 1 in [76,350]
  - 3 in [101,344]
  - 1 in [107,350]
  - 3 in [108,344]
  - 1 in [114,350]
  - 1 in [119,355]
#kBoolOr: 9 (#literals: 27)
#kExactlyOne: 3 (#literals: 9)
#kLinear1: 19 (#enforced: 19 #multi: 9)
#kLinear2: 144 (#enforced: 116 #multi: 94)
#kLinear3: 49 (#enforced: 40 #multi: 19)
#kLinearN: 102 (#enforced: 58) (#terms: 784)

Preloading model.
#Bound   0.03s best:inf   next:[119,1336] initial_domain
[Symmetry] Graph for symmetry has 509 nodes and 2'121 arcs.
[Symmetry] Symmetry computation done. time: 0.000146894 dtime: 0.00016597
#Model   0.03s var:71/71 constraints:326/326

Starting search at 0.03s with 48 workers.
16 full problem subsolvers: [core, default_lp, lb_tree_search, max_lp, no_lp, objective_lb_search, objective_lb_search_max_lp, objective_lb_search_no_lp, objective_shaving_search_max_lp, objective_shaving_search_no_lp, probing, probing_max_lp, pseudo_costs, quick_restart, quick_restart_no_lp, reduced_costs]
30 first solution subsolvers: [fj_long_default(2), fj_long_lin_default, fj_long_lin_perturb, fj_long_lin_random, fj_long_perturb, fj_long_random, fj_short_default(2), fj_short_lin_default(2), fj_short_lin_perturb, fj_short_lin_random, fj_short_perturb, fj_short_random, fs_random(4), fs_random_no_lp(4), fs_random_quick_restart(4), fs_random_quick_restart_no_lp(3)]
13 incomplete subsolvers: [feasibility_pump, graph_arc_lns, graph_cst_lns, graph_dec_lns, graph_var_lns, rins/rens, rnd_cst_lns, rnd_var_lns, violation_ls(5)]
3 helper subsolvers: [neighborhood_helper, synchronization_agent, update_gap_integral]
#Bound   0.04s best:inf   next:[120,1336] bool_core (num_cores=1 [size:1 mw:1] a=5 d=0 fixed=0/55 clauses=22)
#1       0.04s best:708   next:[120,707]  no_lp (fixed_bools=0/70)
#Bound   0.04s best:708   next:[121,707]  no_lp
#Bound   0.04s best:708   next:[135,707]  default_lp
#Bound   0.04s best:708   next:[144,707]  objective_lb_search_no_lp
#2       0.04s best:703   next:[144,702]  quick_restart_no_lp (fixed_bools=0/85)
#3       0.04s best:406   next:[144,405]  no_lp (fixed_bools=0/79)
#Bound   0.04s best:406   next:[145,405]  bool_core (num_cores=4 [cover] a=3 d=1 fixed=23/126 clauses=162)
#Bound   0.04s best:406   next:[146,405]  bool_core (num_cores=4 [cover] a=3 d=1 fixed=24/129 clauses=173)
#4       0.04s best:396   next:[146,395]  no_lp (fixed_bools=0/83)
#Bound   0.04s best:396   next:[147,395]  bool_core (num_cores=4 [cover] a=3 d=1 fixed=25/132 clauses=185)
#Bound   0.04s best:396   next:[148,395]  bool_core (num_cores=4 [cover] a=3 d=1 fixed=26/135 clauses=198)
#5       0.04s best:395   next:[148,394]  violation_ls(batch:1 #solutions_imported:1 #lin_moves:0 #lin_evals:7 #gen_moves:4 #gen_evals:0 #comp_moves:4 #backtracks:0 #weight_updates:0)
#6       0.04s best:394   next:[148,393]  violation_ls(batch:1 #solutions_imported:1 #lin_moves:0 #lin_evals:22 #gen_moves:18 #gen_evals:0 #comp_moves:4 #backtracks:7 #weight_updates:0)
#Bound   0.04s best:394   next:[149,393]  bool_core (num_cores=4 [cover] a=3 d=1 fixed=27/138 clauses=212)
#7       0.04s best:393   next:[149,392]  violation_ls(batch:1 #solutions_imported:1 #lin_moves:0 #lin_evals:6 #gen_moves:3 #gen_evals:0 #comp_moves:3 #backtracks:0 #weight_updates:0)
#Bound   0.04s best:393   next:[150,392]  bool_core (num_cores=4 [cover] a=3 d=1 fixed=28/141 clauses=227)
#Bound   0.04s best:393   next:[151,392]  bool_core (num_cores=4 [cover] a=3 d=1 fixed=29/144 clauses=243)
#Bound   0.04s best:393   next:[152,392]  bool_core (num_cores=4 [cover] a=3 d=1 fixed=30/147 clauses=260)
#Bound   0.04s best:393   next:[153,392]  bool_core (num_cores=4 [cover] a=3 d=1 fixed=31/150 clauses=278)
#Bound   0.05s best:393   next:[154,392]  bool_core (num_cores=4 [cover] a=3 d=1 fixed=32/153 clauses=297)
#Bound   0.05s best:393   next:[155,392]  bool_core (num_cores=4 [cover] a=3 d=1 fixed=33/156 clauses=319)
#8       0.05s best:390   next:[155,389]  rnd_var_lns (d=0.50 s=32 t=0.10 p=0.00 stall=0 h=auto_l0) [presolve]
#Bound   0.05s best:390   next:[156,389]  bool_core (num_cores=4 [cover] a=3 d=1 fixed=34/159 clauses=340)
#Bound   0.05s best:390   next:[157,389]  bool_core (num_cores=4 [cover] a=3 d=1 fixed=35/162 clauses=362)
#Bound   0.05s best:390   next:[158,389]  bool_core (num_cores=4 [cover] a=3 d=1 fixed=36/165 clauses=385)
#Bound   0.05s best:390   next:[159,389]  bool_core (num_cores=4 [cover] a=3 d=1 fixed=37/168 clauses=410)
#Bound   0.05s best:390   next:[160,389]  bool_core (num_cores=4 [cover] a=3 d=1 fixed=38/171 clauses=437)
#9       0.05s best:386   next:[160,385]  quick_restart_no_lp (fixed_bools=0/126)
#10      0.05s best:378   next:[165,377]  no_lp (fixed_bools=0/94)
#11      0.05s best:358   next:[268,357]  no_lp (fixed_bools=0/101)
#12      0.06s best:346   next:[268,345]  no_lp (fixed_bools=1/112)
#13      0.07s best:345   next:[282,344]  violation_ls(batch:2 #solutions_imported:2 #lin_moves:701 #lin_evals:2'651 #gen_moves:3 #gen_evals:0 #comp_moves:3 #backtracks:0 #weight_updates:166)
#14      0.08s best:344   next:[314,343]  violation_ls(batch:3 #solutions_imported:3 #lin_moves:0 #lin_evals:2'154 #gen_moves:1'314 #gen_evals:0 #comp_moves:22 #backtracks:646 #weight_updates:8)
#15      0.08s best:343   next:[314,342]  violation_ls(batch:3 #solutions_imported:3 #lin_moves:1 #lin_evals:2'386 #gen_moves:1'385 #gen_evals:0 #comp_moves:17 #backtracks:684 #weight_updates:8)
#16      0.08s best:342   next:[314,341]  violation_ls(batch:3 #solutions_imported:3 #lin_moves:1 #lin_evals:3'220 #gen_moves:1'919 #gen_evals:0 #comp_moves:31 #backtracks:944 #weight_updates:12)
#17      0.08s best:340   next:[314,339]  violation_ls(batch:3 #solutions_imported:3 #lin_moves:702 #lin_evals:2'656 #gen_moves:3 #gen_evals:0 #comp_moves:3 #backtracks:0 #weight_updates:166)
#18      0.08s best:326   next:[314,325]  objective_lb_search_no_lp (fixed_bools=8/81)
#Model   0.10s var:65/71 constraints:192/326
#Model   0.10s var:64/71 constraints:185/326
#Done    0.10s no_lp
#Done    0.10s quick_restart_no_lp
#Done    0.10s objective_lb_search_no_lp
#Done    0.10s core
#Bound   0.10s best:326   next:[325,325]  objective_lb_search_no_lp [skipped_logs=18]

Task timing                                  n [     min,      max]      avg      dev     time         n [     min,      max]      avg      dev    dtime
                             'core':         1 [ 63.94ms,  63.94ms]  63.94ms   0.00ns  63.94ms         1 [ 17.80ms,  17.80ms]  17.80ms   0.00ns  17.80ms
                       'default_lp':         1 [ 64.39ms,  64.39ms]  64.39ms   0.00ns  64.39ms         1 [  4.44ms,   4.44ms]   4.44ms   0.00ns   4.44ms
                 'feasibility_pump':         4 [729.44us,   3.31ms]   2.25ms 946.80us   9.02ms         3 [414.82us, 482.95us] 439.25us  30.97us   1.32ms
                  'fj_long_default':         0 [  0.00ns,   0.00ns]   0.00ns   0.00ns   0.00ns         0 [  0.00ns,   0.00ns]   0.00ns   0.00ns   0.00ns
                  'fj_long_default':         0 [  0.00ns,   0.00ns]   0.00ns   0.00ns   0.00ns         0 [  0.00ns,   0.00ns]   0.00ns   0.00ns   0.00ns
              'fj_long_lin_default':         0 [  0.00ns,   0.00ns]   0.00ns   0.00ns   0.00ns         0 [  0.00ns,   0.00ns]   0.00ns   0.00ns   0.00ns
              'fj_long_lin_perturb':         0 [  0.00ns,   0.00ns]   0.00ns   0.00ns   0.00ns         0 [  0.00ns,   0.00ns]   0.00ns   0.00ns   0.00ns
               'fj_long_lin_random':         0 [  0.00ns,   0.00ns]   0.00ns   0.00ns   0.00ns         0 [  0.00ns,   0.00ns]   0.00ns   0.00ns   0.00ns
                  'fj_long_perturb':         0 [  0.00ns,   0.00ns]   0.00ns   0.00ns   0.00ns         0 [  0.00ns,   0.00ns]   0.00ns   0.00ns   0.00ns
                   'fj_long_random':         0 [  0.00ns,   0.00ns]   0.00ns   0.00ns   0.00ns         0 [  0.00ns,   0.00ns]   0.00ns   0.00ns   0.00ns
                 'fj_short_default':         0 [  0.00ns,   0.00ns]   0.00ns   0.00ns   0.00ns         0 [  0.00ns,   0.00ns]   0.00ns   0.00ns   0.00ns
                 'fj_short_default':         0 [  0.00ns,   0.00ns]   0.00ns   0.00ns   0.00ns         0 [  0.00ns,   0.00ns]   0.00ns   0.00ns   0.00ns
             'fj_short_lin_default':         0 [  0.00ns,   0.00ns]   0.00ns   0.00ns   0.00ns         0 [  0.00ns,   0.00ns]   0.00ns   0.00ns   0.00ns
             'fj_short_lin_default':         0 [  0.00ns,   0.00ns]   0.00ns   0.00ns   0.00ns         0 [  0.00ns,   0.00ns]   0.00ns   0.00ns   0.00ns
             'fj_short_lin_perturb':         0 [  0.00ns,   0.00ns]   0.00ns   0.00ns   0.00ns         0 [  0.00ns,   0.00ns]   0.00ns   0.00ns   0.00ns
              'fj_short_lin_random':         0 [  0.00ns,   0.00ns]   0.00ns   0.00ns   0.00ns         0 [  0.00ns,   0.00ns]   0.00ns   0.00ns   0.00ns
                 'fj_short_perturb':         0 [  0.00ns,   0.00ns]   0.00ns   0.00ns   0.00ns         0 [  0.00ns,   0.00ns]   0.00ns   0.00ns   0.00ns
                  'fj_short_random':         0 [  0.00ns,   0.00ns]   0.00ns   0.00ns   0.00ns         0 [  0.00ns,   0.00ns]   0.00ns   0.00ns   0.00ns
                        'fs_random':         0 [  0.00ns,   0.00ns]   0.00ns   0.00ns   0.00ns         0 [  0.00ns,   0.00ns]   0.00ns   0.00ns   0.00ns
                        'fs_random':         1 [  1.61ms,   1.61ms]   1.61ms   0.00ns   1.61ms         1 [ 20.00ns,  20.00ns]  20.00ns   0.00ns  20.00ns
                        'fs_random':         1 [  2.37ms,   2.37ms]   2.37ms   0.00ns   2.37ms         1 [ 20.00ns,  20.00ns]  20.00ns   0.00ns  20.00ns
                        'fs_random':         1 [  2.73ms,   2.73ms]   2.73ms   0.00ns   2.73ms         1 [ 20.00ns,  20.00ns]  20.00ns   0.00ns  20.00ns
                  'fs_random_no_lp':         0 [  0.00ns,   0.00ns]   0.00ns   0.00ns   0.00ns         0 [  0.00ns,   0.00ns]   0.00ns   0.00ns   0.00ns
                  'fs_random_no_lp':         0 [  0.00ns,   0.00ns]   0.00ns   0.00ns   0.00ns         0 [  0.00ns,   0.00ns]   0.00ns   0.00ns   0.00ns
                  'fs_random_no_lp':         1 [  1.77ms,   1.77ms]   1.77ms   0.00ns   1.77ms         0 [  0.00ns,   0.00ns]   0.00ns   0.00ns   0.00ns
                  'fs_random_no_lp':         1 [  2.66ms,   2.66ms]   2.66ms   0.00ns   2.66ms         0 [  0.00ns,   0.00ns]   0.00ns   0.00ns   0.00ns
          'fs_random_quick_restart':         0 [  0.00ns,   0.00ns]   0.00ns   0.00ns   0.00ns         0 [  0.00ns,   0.00ns]   0.00ns   0.00ns   0.00ns
          'fs_random_quick_restart':         1 [  1.57ms,   1.57ms]   1.57ms   0.00ns   1.57ms         1 [ 20.00ns,  20.00ns]  20.00ns   0.00ns  20.00ns
          'fs_random_quick_restart':         1 [  2.28ms,   2.28ms]   2.28ms   0.00ns   2.28ms         1 [ 20.00ns,  20.00ns]  20.00ns   0.00ns  20.00ns
          'fs_random_quick_restart':         1 [  2.92ms,   2.92ms]   2.92ms   0.00ns   2.92ms         1 [ 20.00ns,  20.00ns]  20.00ns   0.00ns  20.00ns
    'fs_random_quick_restart_no_lp':         0 [  0.00ns,   0.00ns]   0.00ns   0.00ns   0.00ns         0 [  0.00ns,   0.00ns]   0.00ns   0.00ns   0.00ns
    'fs_random_quick_restart_no_lp':         1 [  1.48ms,   1.48ms]   1.48ms   0.00ns   1.48ms         0 [  0.00ns,   0.00ns]   0.00ns   0.00ns   0.00ns
    'fs_random_quick_restart_no_lp':         1 [  2.00ms,   2.00ms]   2.00ms   0.00ns   2.00ms         0 [  0.00ns,   0.00ns]   0.00ns   0.00ns   0.00ns
                    'graph_arc_lns':         3 [  1.13ms,   6.06ms]   3.85ms   2.05ms  11.56ms         3 [ 10.00ns,  63.14us]  40.68us  28.81us 122.03us
                    'graph_cst_lns':         3 [378.38us,   2.09ms] 958.06us 802.34us   2.87ms         1 [ 14.79us,  14.79us]  14.79us   0.00ns  14.79us
                    'graph_dec_lns':         3 [  1.28ms,   4.36ms]   2.95ms   1.27ms   8.85ms         3 [ 10.00ns,  73.21us]  39.57us  30.18us 118.72us
                    'graph_var_lns':         3 [  1.31ms,   9.56ms]   4.13ms   3.84ms  12.38ms         3 [ 10.00ns, 218.51us]  72.94us 102.94us 218.81us
                   'lb_tree_search':         1 [ 63.17ms,  63.17ms]  63.17ms   0.00ns  63.17ms         1 [ 30.84us,  30.84us]  30.84us   0.00ns  30.84us
                           'max_lp':         1 [ 63.60ms,  63.60ms]  63.60ms   0.00ns  63.60ms         1 [ 29.57us,  29.57us]  29.57us   0.00ns  29.57us
                            'no_lp':         1 [ 63.49ms,  63.49ms]  63.49ms   0.00ns  63.49ms         1 [  8.88ms,   8.88ms]   8.88ms   0.00ns   8.88ms
              'objective_lb_search':         1 [ 62.59ms,  62.59ms]  62.59ms   0.00ns  62.59ms         1 [  4.53ms,   4.53ms]   4.53ms   0.00ns   4.53ms
       'objective_lb_search_max_lp':         1 [ 61.94ms,  61.94ms]  61.94ms   0.00ns  61.94ms         1 [  1.92ms,   1.92ms]   1.92ms   0.00ns   1.92ms
        'objective_lb_search_no_lp':         1 [ 62.19ms,  62.19ms]  62.19ms   0.00ns  62.19ms         1 [  7.56ms,   7.56ms]   7.56ms   0.00ns   7.56ms
  'objective_shaving_search_max_lp':         4 [551.67us,  13.27ms]   6.86ms   5.42ms  27.45ms         2 [269.78us, 282.32us] 276.05us   6.27us 552.11us
   'objective_shaving_search_no_lp':         4 [  1.46ms,  13.32ms]   7.39ms   5.41ms  29.54ms         2 [270.92us, 554.40us] 412.66us 141.74us 825.32us
                          'probing':         1 [ 63.14ms,  63.14ms]  63.14ms   0.00ns  63.14ms         1 [  1.14ms,   1.14ms]   1.14ms   0.00ns   1.14ms
                   'probing_max_lp':         1 [ 62.76ms,  62.76ms]  62.76ms   0.00ns  62.76ms         1 [ 29.67us,  29.67us]  29.67us   0.00ns  29.67us
                     'pseudo_costs':         1 [ 62.86ms,  62.86ms]  62.86ms   0.00ns  62.86ms         1 [  2.55ms,   2.55ms]   2.55ms   0.00ns   2.55ms
                    'quick_restart':         1 [ 63.57ms,  63.57ms]  63.57ms   0.00ns  63.57ms         1 [  1.71ms,   1.71ms]   1.71ms   0.00ns   1.71ms
              'quick_restart_no_lp':         1 [ 62.88ms,  62.88ms]  62.88ms   0.00ns  62.88ms         1 [  8.81ms,   8.81ms]   8.81ms   0.00ns   8.81ms
                    'reduced_costs':         1 [ 63.21ms,  63.21ms]  63.21ms   0.00ns  63.21ms         1 [  1.27ms,   1.27ms]   1.27ms   0.00ns   1.27ms
                        'rins/rens':         4 [112.61us,   4.85ms]   2.46ms   1.78ms   9.86ms         3 [ 10.00ns,  24.13us]  12.40us   9.86us  37.19us
                      'rnd_cst_lns':         3 [355.61us,   1.38ms] 704.89us 479.20us   2.11ms         1 [ 10.00ns,  10.00ns]  10.00ns   0.00ns  10.00ns
                      'rnd_var_lns':         4 [793.62us,   2.32ms]   1.37ms 584.62us   5.49ms         3 [ 10.00ns,  34.00ns]  18.00ns  11.31ns  54.00ns
                     'violation_ls':         2 [359.95us,  36.45ms]  18.41ms  18.05ms  36.81ms         2 [  5.84us,  12.68ms]   6.34ms   6.33ms  12.68ms
                     'violation_ls':         4 [ 96.36us,  13.77ms]   7.01ms   6.71ms  28.02ms         4 [720.00ns,   4.67ms]   2.28ms   2.26ms   9.10ms
                     'violation_ls':         4 [115.19us,   5.92ms]   2.09ms   2.33ms   8.34ms         4 [510.00ns,   2.46ms] 828.09us   1.00ms   3.31ms
                     'violation_ls':         4 [133.67us,  14.99ms]   6.19ms   6.26ms  24.77ms         4 [690.00ns,   5.01ms]   1.99ms   2.12ms   7.95ms
                     'violation_ls':         4 [180.56us,  14.88ms]   6.48ms   6.20ms  25.94ms         4 [450.00ns,   8.86ms]   3.03ms   3.61ms  12.11ms

Search stats                        Bools  Conflicts  Branches  Restarts  BoolPropag  IntegerPropag
                           'core':    487        366     1'937       541      54'394         44'680
                     'default_lp':     62         52       175       101         512          5'210
                      'fs_random':      0          0         0         0           0              0
                      'fs_random':     50          0         0         0           0              0
                      'fs_random':     50          0         0         0           0              0
                      'fs_random':     50          0         0         0           0              0
                'fs_random_no_lp':      0          0         0         0           0              0
                'fs_random_no_lp':      0          0         0         0           0              0
                'fs_random_no_lp':     50          0         0         0           0              0
                'fs_random_no_lp':     50          0         0         0           0              0
        'fs_random_quick_restart':      0          0         0         0           0              0
        'fs_random_quick_restart':     50          0         0         0           0              0
        'fs_random_quick_restart':     50          0         0         0           0              0
        'fs_random_quick_restart':     50          0         0         0           0              0
  'fs_random_quick_restart_no_lp':      0          0         0         0           0              0
  'fs_random_quick_restart_no_lp':     50          0         0         0           0              0
  'fs_random_quick_restart_no_lp':     50          0         0         0           0              0
                 'lb_tree_search':     50          0       100       100          89            518
                         'max_lp':     50          0       100       100          89            518
                          'no_lp':    114        248     1'598       461       8'778         52'550
            'objective_lb_search':     62         54       168       101         960          6'196
     'objective_lb_search_max_lp':     51          0       102       100          90            652
      'objective_lb_search_no_lp':     88        285     1'393       509       5'004         46'284
                        'probing':     52          0       104       104         111            563
                 'probing_max_lp':     50          0       100       100          89            518
                   'pseudo_costs':     58          1       111       100         130            748
                  'quick_restart':     79          0       142       101         126            985
            'quick_restart_no_lp':    162        194     1'913       538      13'182         51'273
                  'reduced_costs':     50          0       100       100          90            600

SAT stats                           ClassicMinim  LitRemoved  LitLearned  LitForgotten  Subsumed  MClauses  MDecisions  MLitTrue  MSubsumed  MLitRemoved  MReused
                           'core':           202         607         886             0         0       109         523         0         31          136       13
                     'default_lp':            35          76         309             0         0         0           0         0          0            0        0
                      'fs_random':             0           0           0             0         0         0           0         0          0            0        0
                      'fs_random':             0           0           0             0         0         0           0         0          0            0        0
                      'fs_random':             0           0           0             0         0         0           0         0          0            0        0
                      'fs_random':             0           0           0             0         0         0           0         0          0            0        0
                'fs_random_no_lp':             0           0           0             0         0         0           0         0          0            0        0
                'fs_random_no_lp':             0           0           0             0         0         0           0         0          0            0        0
                'fs_random_no_lp':             0           0           0             0         0         0           0         0          0            0        0
                'fs_random_no_lp':             0           0           0             0         0         0           0         0          0            0        0
        'fs_random_quick_restart':             0           0           0             0         0         0           0         0          0            0        0
        'fs_random_quick_restart':             0           0           0             0         0         0           0         0          0            0        0
        'fs_random_quick_restart':             0           0           0             0         0         0           0         0          0            0        0
        'fs_random_quick_restart':             0           0           0             0         0         0           0         0          0            0        0
  'fs_random_quick_restart_no_lp':             0           0           0             0         0         0           0         0          0            0        0
  'fs_random_quick_restart_no_lp':             0           0           0             0         0         0           0         0          0            0        0
  'fs_random_quick_restart_no_lp':             0           0           0             0         0         0           0         0          0            0        0
                 'lb_tree_search':             0           0           0             0         0         0           0         0          0            0        0
                         'max_lp':             0           0           0             0         0         0           0         0          0            0        0
                          'no_lp':           149         344       1'348             0        27       119         607         0         26          124       16
            'objective_lb_search':            34          55         279             0         5         0           0         0          0            0        0
     'objective_lb_search_max_lp':             0           0           0             0         0         0           0         0          0            0        0
      'objective_lb_search_no_lp':           196         442       1'235             0        27       124         579         0         18           77       14
                        'probing':             0           0           0             0         0         0           0         0          0            0        0
                 'probing_max_lp':             0           0           0             0         0         0           0         0          0            0        0
                   'pseudo_costs':             1           1           5             0         0         0           0         0          0            0        0
                  'quick_restart':             0           0           0             0         0         0           0         0          0            0        0
            'quick_restart_no_lp':           111         218       1'054             0        11       154         816         0         47          243       17
                  'reduced_costs':             0           0           0             0         0         0           0         0          0            0        0

Lp stats                         Component  Iterations  AddedCuts  OPTIMAL  DUAL_F.  DUAL_U.
                  'default_lp':          1         411        508       85        0        0
                   'fs_random':          1           0          0        0        0        0
                   'fs_random':          1           0          0        0        0        0
                   'fs_random':          1           0          0        0        0        0
     'fs_random_quick_restart':          1           0          0        0        0        0
     'fs_random_quick_restart':          1           0          0        0        0        0
     'fs_random_quick_restart':          1           0          0        0        0        0
              'lb_tree_search':          1          94        457        3        0        0
                      'max_lp':          1          87        457        3        0        0
         'objective_lb_search':          1         441        468       72        0        0
  'objective_lb_search_max_lp':          1         199        642       13        1        0
                     'probing':          1         123        551       17        0        0
              'probing_max_lp':          1          94        449        3        0        0
                'pseudo_costs':          1         229        603       17        2        0
               'quick_restart':          1         202        578       38        0        0
               'reduced_costs':          1         154        611       11        1        0

Lp dimension                                                                    Final dimension of first component
                  'default_lp':   198 rows, 70 columns, 644 entries with magnitude in [2.827807e-03, 1.000000e+00]
                   'fs_random':       0 rows, 70 columns, 0 entries with magnitude in [0.000000e+00, 0.000000e+00]
                   'fs_random':       0 rows, 70 columns, 0 entries with magnitude in [0.000000e+00, 0.000000e+00]
                   'fs_random':       0 rows, 70 columns, 0 entries with magnitude in [0.000000e+00, 0.000000e+00]
     'fs_random_quick_restart':       0 rows, 70 columns, 0 entries with magnitude in [0.000000e+00, 0.000000e+00]
     'fs_random_quick_restart':       0 rows, 70 columns, 0 entries with magnitude in [0.000000e+00, 0.000000e+00]
     'fs_random_quick_restart':       0 rows, 70 columns, 0 entries with magnitude in [0.000000e+00, 0.000000e+00]
              'lb_tree_search':  376 rows, 71 columns, 2233 entries with magnitude in [9.348505e-03, 1.000000e+00]
                      'max_lp':  376 rows, 71 columns, 2244 entries with magnitude in [8.939981e-03, 1.000000e+00]
         'objective_lb_search':   172 rows, 70 columns, 474 entries with magnitude in [4.743075e-03, 1.000000e+00]
  'objective_lb_search_max_lp':   260 rows, 71 columns, 832 entries with magnitude in [4.555914e-03, 1.000000e+00]
                     'probing':  218 rows, 70 columns, 1115 entries with magnitude in [3.573811e-04, 1.000000e+00]
              'probing_max_lp':  376 rows, 71 columns, 2240 entries with magnitude in [1.125177e-02, 1.000000e+00]
                'pseudo_costs':   269 rows, 71 columns, 914 entries with magnitude in [2.204195e-03, 1.000000e+00]
               'quick_restart':   193 rows, 70 columns, 628 entries with magnitude in [3.983763e-03, 1.000000e+00]
               'reduced_costs':   238 rows, 71 columns, 805 entries with magnitude in [9.961307e-03, 1.000000e+00]

Lp debug                         CutPropag  CutEqPropag  Adjust  Overflow  Bad  BadScaling
                  'default_lp':          4            0      69         0  238           0
                   'fs_random':          0            0       0         0    0           0
                   'fs_random':          0            0       0         0    0           0
                   'fs_random':          0            0       0         0    0           0
     'fs_random_quick_restart':          0            0       0         0    0           0
     'fs_random_quick_restart':          0            0       0         0    0           0
     'fs_random_quick_restart':          0            0       0         0    0           0
              'lb_tree_search':          0            0       2         0  230           0
                      'max_lp':          0            0       2         0  239           0
         'objective_lb_search':          0            0      56         0  158           0
  'objective_lb_search_max_lp':          0            0       8         0  204           0
                     'probing':          0            0      12         0  350           0
              'probing_max_lp':          0            0       2         0  212           0
                'pseudo_costs':          0            0      13         0  222           0
               'quick_restart':          4            0      13         0  237           0
               'reduced_costs':          0            0       7         0  213           0

Lp pool                          Constraints  Updates  Simplif  Merged  Shortened  Split  Strenghtened  Cuts/Call
                  'default_lp':          581      102      584      11          0      0           262    508/757
                   'fs_random':           84        0        0       0          0      0             0        0/0
                   'fs_random':           84        0        0       0          0      0             0        0/0
                   'fs_random':           84        0        0       0          0      0             0        0/0
     'fs_random_quick_restart':           84        0        0       0          0      0             0        0/0
     'fs_random_quick_restart':           84        0        0       0          0      0             0        0/0
     'fs_random_quick_restart':           84        0        0       0          0      0             0        0/0
              'lb_tree_search':          783        0        0       0          0      0            92    457/635
                      'max_lp':          783        0        0       0          0      0           102    457/623
         'objective_lb_search':          540       60      347      12          0      0           199    468/740
  'objective_lb_search_max_lp':          960       84      748       8         68      0         1'351    642/978
                     'probing':          635        0        0       0          0      0             4    551/856
              'probing_max_lp':          775        2        0       0          0      0           110    449/636
                'pseudo_costs':          921       93      719       8         67      1         1'403    603/940
               'quick_restart':          651       94      579      11          0      0           262    578/919
               'reduced_costs':          927       91      738      10         72      1         1'379    611/962

Lp Cut            defaul  max_lp  quick_  reduce  pseudo  lb_tre  probin  object  probin  object
          CG_FF:      85      50      93      99      97      48     104      84      52     106
           CG_K:      67      10      67      70      72       6      46      46       4      82
           CG_R:      11      30      14      20      17      31       6      12      29      21
          CG_RB:     106     109     128     136     130      99     156     103      92     134
         CG_RBP:      15      22      34      10       9      19      25      11      16       7
         Clique:       -       -       -       -       6       -       -       -       -       3
             IB:     110      58     110      88      86      57      98     110      58      93
       MIR_1_FF:      33      28      36      45      48      27      43      28      24      46
        MIR_1_K:       2      16       2       4       5      14       3       1      13       5
        MIR_1_R:       1       2       -       3       3       1       1       -       2       4
       MIR_1_RB:      16      25      16      26      29      25      21      12      24      24
      MIR_1_RBP:       1       4       1       2       3       4       1       1       3       2
      MIR_1_RLT:       -       1       -      19      20       1       -       -       -      20
       MIR_2_FF:       6       4      10      13       8       6       4       6      14      10
        MIR_2_K:       3       1       3       3       3       4       1       3       4       2
        MIR_2_R:       3       1       4       5       2       3       1       3       1       6
       MIR_2_RB:       8       3       8      10       7       4       8       6      10       6
      MIR_2_RBP:       4       -       3       -       1       -       -       2       2       -
       MIR_3_FF:       3       6       5       4       6       7       1       2       7       9
        MIR_3_K:       2       3       2       2       1       5       -       1       5       3
        MIR_3_R:       1       2       3       4       2       2       1       2       4       2
       MIR_3_RB:       4       6       5       5       3       6       2       -       9       6
      MIR_3_RBP:       2       2       1       1       -       4       -       -       2       -
       MIR_4_FF:       2       3       3       -       -       5       -       2       4       1
        MIR_4_K:       -       3       1       -       -       4       -       -       1       1
        MIR_4_R:       1       2       -       -       -       3       -       -       4       -
       MIR_4_RB:       2       1       1       1       1       6       2       1       3       -
      MIR_4_RBP:       -       2       -       -       -       3       -       -       2       -
       MIR_5_FF:       1       1       1       1       1       4       -       2       1       -
        MIR_5_K:       -       -       -       -       -       3       -       -       -       -
        MIR_5_R:       -       -       -       -       -       1       -       1       -       -
       MIR_5_RB:       1       -       1       1       1       3       -       1       -       -
      MIR_5_RBP:       -       -       -       -       -       1       -       -       -       -
       MIR_6_FF:       -       3       -       -       -       1       -       -       1       -
        MIR_6_K:       -       1       -       -       -       -       -       -       -       -
        MIR_6_R:       -       -       -       -       -       1       -       -       2       -
       MIR_6_RB:       -       -       -       -       -       1       -       -       -       -
      MIR_6_RBP:       -       -       -       -       -       -       -       -       1       -
   ZERO_HALF_FF:       5      12       6      11      12      10       8       9      11      11
    ZERO_HALF_K:       2       7       1       -       -       6       1       1       6       1
    ZERO_HALF_R:       7      14      11      15      16      11      10      10      13      18
   ZERO_HALF_RB:       3      13       7      12      13      10       7       7      13      15
  ZERO_HALF_RBP:       1      12       1       1       1      11       1       1      12       4

LNS stats           Improv/Calls  Closed  Difficulty  TimeLimit
  'graph_arc_lns':           1/3    100%        0.88       0.10
  'graph_cst_lns':           0/1    100%        0.71       0.10
  'graph_dec_lns':           1/3    100%        0.88       0.10
  'graph_var_lns':           2/3    100%        0.88       0.10
      'rins/rens':           1/3    100%        0.88       0.10
    'rnd_cst_lns':           0/1    100%        0.71       0.10
    'rnd_var_lns':           2/3    100%        0.88       0.10

LS stats                   Batches  Restarts  LinMoves  GenMoves  CompoundMoves  WeightUpdates
       'fj_long_default':        0         0         0         0              0              0
       'fj_long_default':        0         0         0         0              0              0
   'fj_long_lin_default':        0         0         0         0              0              0
   'fj_long_lin_perturb':        0         0         0         0              0              0
    'fj_long_lin_random':        0         0         0         0              0              0
       'fj_long_perturb':        0         0         0         0              0              0
        'fj_long_random':        0         0         0         0              0              0
      'fj_short_default':        0         0         0         0              0              0
      'fj_short_default':        0         0         0         0              0              0
  'fj_short_lin_default':        0         0         0         0              0              0
  'fj_short_lin_default':        0         0         0         0              0              0
  'fj_short_lin_perturb':        0         0         0         0              0              0
   'fj_short_lin_random':        0         0         0         0              0              0
      'fj_short_perturb':        0         0         0         0              0              0
       'fj_short_random':        0         0         0         0              0              0
          'violation_ls':        2         0         0     4'752             58             32
          'violation_ls':        4         0         0     3'230             74             24
          'violation_ls':        4         0         1     3'661             69             27
          'violation_ls':        4         0     1'816     1'385             17          1'627
          'violation_ls':        4         0       897         3              3            256

Solutions (18)                  Num     Rank
                      'no_lp':    6   [1,12]
  'objective_lb_search_no_lp':    1  [18,18]
        'quick_restart_no_lp':    2    [2,9]
                'rnd_var_lns':    1    [8,8]
               'violation_ls':    8   [5,17]

Objective bounds                Num
                  'bool_core':   23
                 'default_lp':    1
             'initial_domain':    1
                      'no_lp':    1
  'objective_lb_search_no_lp':   14

Solution repositories    Added  Queried  Ignored  Synchro
  'feasible solutions':     42       66        0       30
        'lp solutions':      0        0        0        0
                'pump':     21        4

Improving bounds shared         Num
                       'core':    4
                 'default_lp':    1
                      'no_lp':  233
  'objective_lb_search_no_lp':   53
        'quick_restart_no_lp':  164

Clauses shared                  Num
                       'core':    1
                      'no_lp':   17
  'objective_lb_search_no_lp':   14
        'quick_restart_no_lp':   13

CpSolverResponse summary:
status: OPTIMAL
objective: 326
best_bound: 326
integers: 71
booleans: 50
conflicts: 0
branches: 0
propagations: 0
integer_propagations: 0
restarts: 0
lp_iterations: 0
walltime: 0.10451
usertime: 0.10451
deterministic_time: 0.109942
gap_integral: 0.0730463
solution_fingerprint: 0x7864e89bfa4fc2a7


--- Simulation Gantt  partir du modle mathmatique ---
{'big':0, 'due_date':79, 'pos_time':5, 'status':3, 'blocked':2, 'operations':["{'type':0, 'processing_time':29}"]}
{'big':1, 'due_date':81, 'pos_time':5, 'status':2, 'blocked':1, 'operations':["{'type':0, 'processing_time':52}"]}
{'big':0, 'due_date':112, 'pos_time':5, 'status':1, 'blocked':2, 'operations':["{'type':0, 'processing_time':18}", "{'type':1, 'processing_time':43}"]}
{'big':0, 'due_date':167, 'pos_time':5, 'status':2, 'blocked':0, 'operations':["{'type':1, 'processing_time':57}", "{'type':0, 'processing_time':48}"]}
