created virtual environment CPython3.12.4.final.0-64 in 366ms
  creator CPython3Posix(dest=/localscratch/aneumann.46806146.0/env, clear=False, no_vcs_ignore=False, global=False)
  seeder FromAppData(download=False, pip=bundle, via=copy, app_data_dir=/home/aneumann/.local/share/virtualenv)
    added seed packages: pip==24.2+computecanada
  activators BashActivator,CShellActivator,FishActivator,NushellActivator,PowerShellActivator,PythonActivator
Looking in links: /cvmfs/soft.computecanada.ca/custom/python/wheelhouse/gentoo2023/x86-64-v3, /cvmfs/soft.computecanada.ca/custom/python/wheelhouse/gentoo2023/generic, /cvmfs/soft.computecanada.ca/custom/python/wheelhouse/generic
Requirement already satisfied: pip in /localscratch/aneumann.46806146.0/env/lib/python3.12/site-packages (24.2+computecanada)
Processing /cvmfs/soft.computecanada.ca/custom/python/wheelhouse/generic/pip-25.0+computecanada-py3-none-any.whl
Installing collected packages: pip
  Attempting uninstall: pip
    Found existing installation: pip 24.2+computecanada
    Uninstalling pip-24.2+computecanada:
      Successfully uninstalled pip-24.2+computecanada
Successfully installed pip-25.0+computecanada
Looking in links: /cvmfs/soft.computecanada.ca/custom/python/wheelhouse/gentoo2023/x86-64-v3, /cvmfs/soft.computecanada.ca/custom/python/wheelhouse/gentoo2023/generic, /cvmfs/soft.computecanada.ca/custom/python/wheelhouse/generic
ERROR: protobuf-5.28.3-cp38-abi3-manylinux2014_x86_64.whl is not a supported wheel on this platform.
Looking in links: /cvmfs/soft.computecanada.ca/custom/python/wheelhouse/gentoo2023/x86-64-v3, /cvmfs/soft.computecanada.ca/custom/python/wheelhouse/gentoo2023/generic, /cvmfs/soft.computecanada.ca/custom/python/wheelhouse/generic
Processing /home/aneumann/projects/def-adhaj/aneumann/GNRS/wheels/immutabledict-4.2.0-py3-none-any.whl
Installing collected packages: immutabledict
Successfully installed immutabledict-4.2.0
Looking in links: /cvmfs/soft.computecanada.ca/custom/python/wheelhouse/gentoo2023/x86-64-v3, /cvmfs/soft.computecanada.ca/custom/python/wheelhouse/gentoo2023/generic, /cvmfs/soft.computecanada.ca/custom/python/wheelhouse/generic
Processing /cvmfs/soft.computecanada.ca/custom/python/wheelhouse/generic/ortools-9.10.4067+computecanada-cp312-cp312-linux_x86_64.whl (from -r /home/aneumann/projects/def-adhaj/aneumann/GNRS/requirements/or.txt (line 1))
Processing /cvmfs/soft.computecanada.ca/custom/python/wheelhouse/gentoo2023/x86-64-v3/matplotlib-3.10.0+computecanada-cp312-cp312-linux_x86_64.whl (from -r /home/aneumann/projects/def-adhaj/aneumann/GNRS/requirements/or.txt (line 2))
Processing /cvmfs/soft.computecanada.ca/custom/python/wheelhouse/gentoo2023/x86-64-v3/pandas-2.2.3+computecanada-cp312-cp312-linux_x86_64.whl (from -r /home/aneumann/projects/def-adhaj/aneumann/GNRS/requirements/or.txt (line 3))
Processing /cvmfs/soft.computecanada.ca/custom/python/wheelhouse/generic/absl_py-2.3.0+computecanada-py3-none-any.whl (from ortools<9.11,>=9.10->-r /home/aneumann/projects/def-adhaj/aneumann/GNRS/requirements/or.txt (line 1))
Processing /cvmfs/soft.computecanada.ca/custom/python/wheelhouse/gentoo2023/generic/numpy-2.2.2+computecanada-cp312-cp312-linux_x86_64.whl (from ortools<9.11,>=9.10->-r /home/aneumann/projects/def-adhaj/aneumann/GNRS/requirements/or.txt (line 1))
Processing /cvmfs/soft.computecanada.ca/custom/python/wheelhouse/gentoo2023/x86-64-v3/protobuf-6.31.1+computecanada-cp312-cp312-linux_x86_64.whl (from ortools<9.11,>=9.10->-r /home/aneumann/projects/def-adhaj/aneumann/GNRS/requirements/or.txt (line 1))
Requirement already satisfied: immutabledict>=3.0.0 in /localscratch/aneumann.46806146.0/env/lib/python3.12/site-packages (from ortools<9.11,>=9.10->-r /home/aneumann/projects/def-adhaj/aneumann/GNRS/requirements/or.txt (line 1)) (4.2.0)
Processing /cvmfs/soft.computecanada.ca/custom/python/wheelhouse/gentoo2023/generic/contourpy-1.3.1+computecanada-cp312-cp312-linux_x86_64.whl (from matplotlib->-r /home/aneumann/projects/def-adhaj/aneumann/GNRS/requirements/or.txt (line 2))
Processing /cvmfs/soft.computecanada.ca/custom/python/wheelhouse/generic/cycler-0.12.1+computecanada-py3-none-any.whl (from matplotlib->-r /home/aneumann/projects/def-adhaj/aneumann/GNRS/requirements/or.txt (line 2))
Processing /cvmfs/soft.computecanada.ca/custom/python/wheelhouse/generic/fonttools-4.59.0+computecanada-cp312-cp312-linux_x86_64.whl (from matplotlib->-r /home/aneumann/projects/def-adhaj/aneumann/GNRS/requirements/or.txt (line 2))
Processing /cvmfs/soft.computecanada.ca/custom/python/wheelhouse/gentoo2023/x86-64-v3/kiwisolver-1.4.8+computecanada-cp312-cp312-linux_x86_64.whl (from matplotlib->-r /home/aneumann/projects/def-adhaj/aneumann/GNRS/requirements/or.txt (line 2))
Processing /cvmfs/soft.computecanada.ca/custom/python/wheelhouse/generic/packaging-25.0+computecanada-py3-none-any.whl (from matplotlib->-r /home/aneumann/projects/def-adhaj/aneumann/GNRS/requirements/or.txt (line 2))
Processing /cvmfs/soft.computecanada.ca/custom/python/wheelhouse/gentoo2023/x86-64-v3/pillow-11.1.0+computecanada-cp312-cp312-linux_x86_64.whl (from matplotlib->-r /home/aneumann/projects/def-adhaj/aneumann/GNRS/requirements/or.txt (line 2))
Processing /cvmfs/soft.computecanada.ca/custom/python/wheelhouse/generic/pyparsing-3.2.3+computecanada-py3-none-any.whl (from matplotlib->-r /home/aneumann/projects/def-adhaj/aneumann/GNRS/requirements/or.txt (line 2))
Processing /cvmfs/soft.computecanada.ca/custom/python/wheelhouse/generic/python_dateutil-2.9.0.post0+computecanada-py2.py3-none-any.whl (from matplotlib->-r /home/aneumann/projects/def-adhaj/aneumann/GNRS/requirements/or.txt (line 2))
Processing /cvmfs/soft.computecanada.ca/custom/python/wheelhouse/generic/pytz-2025.2+computecanada-py2.py3-none-any.whl (from pandas->-r /home/aneumann/projects/def-adhaj/aneumann/GNRS/requirements/or.txt (line 3))
Processing /cvmfs/soft.computecanada.ca/custom/python/wheelhouse/generic/tzdata-2025.2+computecanada-py2.py3-none-any.whl (from pandas->-r /home/aneumann/projects/def-adhaj/aneumann/GNRS/requirements/or.txt (line 3))
Processing /cvmfs/soft.computecanada.ca/custom/python/wheelhouse/generic/six-1.17.0+computecanada-py2.py3-none-any.whl (from python-dateutil>=2.7->matplotlib->-r /home/aneumann/projects/def-adhaj/aneumann/GNRS/requirements/or.txt (line 2))
Installing collected packages: pytz, tzdata, six, pyparsing, protobuf, pillow, packaging, numpy, kiwisolver, fonttools, cycler, absl-py, python-dateutil, contourpy, pandas, matplotlib, ortools
Successfully installed absl-py-2.3.0+computecanada contourpy-1.3.1+computecanada cycler-0.12.1+computecanada fonttools-4.59.0+computecanada kiwisolver-1.4.8+computecanada matplotlib-3.10.0+computecanada numpy-2.2.2+computecanada ortools-9.10.4067+computecanada packaging-25.0+computecanada pandas-2.2.3+computecanada pillow-11.1.0+computecanada protobuf-6.31.1+computecanada pyparsing-3.2.3+computecanada python-dateutil-2.9.0.post0+computecanada pytz-2025.2+computecanada six-1.17.0+computecanada tzdata-2025.2+computecanada

Starting CP-SAT solver v9.10.4067
Parameters: max_time_in_seconds: 86400 max_memory_in_mb: 185000 log_search_progress: true enumerate_all_solutions: false num_search_workers: 32 absolute_gap_limit: 0 relative_gap_limit: 0

Initial optimization model '': (model_fingerprint: 0x2d56ec0901ac765)
#Variables: 280 (#ints: 10 in objective)
  - 194 Booleans in [0,1]
  - 86 in [0,515]
#kLinear1: 39
#kLinear2: 434
#kLinear3: 245
#kLinearN: 3'257 (#terms: 47'813)

Starting presolve at 0.00s
  1.30e-03s  0.00e+00d  [DetectDominanceRelations] 
  1.91e-02s  0.00e+00d  [PresolveToFixPoint] #num_loops=8 #num_dual_strengthening=3 
  3.09e-05s  0.00e+00d  [ExtractEncodingFromLinear] #potential_supersets=2 
[Symmetry] Graph for symmetry has 3'647 nodes and 34'351 arcs.
[Symmetry] Symmetry computation done. time: 0.00127758 dtime: 0.00257489
[Symmetry] #generators: 1, average support size: 22
[Symmetry] The model contains 142 duplicate constraints !
[Symmetry] 11 orbits with sizes: 2,2,2,2,2,2,2,2,2,2,...
[Symmetry] Num fixable by intersecting at_most_one with orbits: 1 largest_orbit: 2
  6.88e-03s  1.64e-03d  [Probe] #probed=240 #new_bounds=15 #equiv=1 
  8.58e-05s  0.00e+00d  [MaxClique] Merged 30(60 literals) into 12(24 literals) at_most_ones. 
  1.19e-03s  0.00e+00d  [DetectDominanceRelations] 
  9.12e-03s  0.00e+00d  [PresolveToFixPoint] #num_loops=5 #num_dual_strengthening=3 
  3.81e-03s  0.00e+00d  [ProcessAtMostOneAndLinear] 
  1.61e-03s  0.00e+00d  [DetectDuplicateConstraints] #duplicates=202 #without_enforcements=273 
  1.74e-03s  1.69e-04d  [DetectDominatedLinearConstraints] #relevant_constraints=2'654 #num_inclusions=2'472 
  2.91e-04s  0.00e+00d  [DetectDifferentVariables] #different=19 #cliques=1 #size=5 
  3.68e-04s  4.27e-05d  [ProcessSetPPC] #relevant_constraints=2'117 
  1.46e-05s  0.00e+00d  [FindAlmostIdenticalLinearConstraints] 
  7.08e-05s  5.49e-05d  [FindBigAtMostOneAndLinearOverlap] 
  3.67e-03s  2.78e-03d  [FindBigVerticalLinearOverlap] #blocks=31 #saved_nz=5'113 
  2.22e-04s  1.03e-04d  [FindBigHorizontalLinearOverlap] #linears=2'075 
  1.52e-05s  0.00e+00d  [MergeClauses] 
  1.28e-03s  0.00e+00d  [DetectDominanceRelations] 
  1.41e-02s  0.00e+00d  [PresolveToFixPoint] #num_loops=2 #num_dual_strengthening=1 
  1.27e-03s  0.00e+00d  [DetectDominanceRelations] 
  8.12e-03s  0.00e+00d  [PresolveToFixPoint] #num_loops=1 #num_dual_strengthening=1 
[Symmetry] Graph for symmetry has 3'491 nodes and 28'229 arcs.
[Symmetry] Symmetry computation done. time: 0.000562894 dtime: 0.00157356
  6.25e-03s  1.49e-03d  [Probe] #probed=240 #new_bounds=20 
  9.29e-06s  0.00e+00d  [MaxClique] 
  1.28e-03s  0.00e+00d  [DetectDominanceRelations] 
  1.19e-02s  0.00e+00d  [PresolveToFixPoint] #num_loops=2 #num_dual_strengthening=1 
  3.34e-03s  0.00e+00d  [ProcessAtMostOneAndLinear] 
  1.43e-03s  0.00e+00d  [DetectDuplicateConstraints] #without_enforcements=290 
  9.77e-04s  8.56e-05d  [DetectDominatedLinearConstraints] #relevant_constraints=2'316 #num_inclusions=537 
  1.64e-04s  0.00e+00d  [DetectDifferentVariables] 
  3.30e-04s  3.19e-05d  [ProcessSetPPC] #relevant_constraints=2'006 
  2.06e-05s  9.00e-08d  [FindAlmostIdenticalLinearConstraints] #num_tested_pairs=6 
  2.67e-05s  2.10e-05d  [FindBigAtMostOneAndLinearOverlap] 
  2.46e-03s  2.04e-03d  [FindBigVerticalLinearOverlap] #blocks=23 #saved_nz=2'389 
  2.13e-04s  8.77e-05d  [FindBigHorizontalLinearOverlap] #linears=1'996 
  9.13e-06s  0.00e+00d  [MergeClauses] 
  1.22e-03s  0.00e+00d  [DetectDominanceRelations] 
  1.25e-02s  0.00e+00d  [PresolveToFixPoint] #num_loops=2 #num_dual_strengthening=1 
  1.21e-03s  0.00e+00d  [DetectDominanceRelations] 
  8.65e-03s  0.00e+00d  [PresolveToFixPoint] #num_loops=1 #num_dual_strengthening=1 
[Symmetry] Graph for symmetry has 3'551 nodes and 25'854 arcs.
[Symmetry] Symmetry computation done. time: 0.000557954 dtime: 0.00148034
  5.56e-03s  1.41e-03d  [Probe] #probed=240 #new_bounds=17 
  9.64e-06s  0.00e+00d  [MaxClique] 
  1.22e-03s  0.00e+00d  [DetectDominanceRelations] 
  1.09e-02s  0.00e+00d  [PresolveToFixPoint] #num_loops=2 #num_dual_strengthening=1 
  2.99e-03s  0.00e+00d  [ProcessAtMostOneAndLinear] 
  1.40e-03s  0.00e+00d  [DetectDuplicateConstraints] #without_enforcements=336 
  7.04e-04s  6.14e-05d  [DetectDominatedLinearConstraints] #relevant_constraints=2'114 #num_inclusions=63 
  1.52e-04s  0.00e+00d  [DetectDifferentVariables] 
  2.95e-04s  2.55e-05d  [ProcessSetPPC] #relevant_constraints=1'851 
  2.27e-05s  3.60e-07d  [FindAlmostIdenticalLinearConstraints] #num_tested_pairs=24 
  2.41e-05s  1.61e-05d  [FindBigAtMostOneAndLinearOverlap] 
  1.98e-03s  1.71e-03d  [FindBigVerticalLinearOverlap] #blocks=20 #saved_nz=1'527 
  1.86e-04s  7.35e-05d  [FindBigHorizontalLinearOverlap] #linears=1'803 
  9.28e-06s  0.00e+00d  [MergeClauses] 
  1.16e-03s  0.00e+00d  [DetectDominanceRelations] 
  1.16e-02s  0.00e+00d  [PresolveToFixPoint] #num_loops=2 #num_dual_strengthening=1 
  6.18e-05s  0.00e+00d  [ExpandObjective] #entries=244 #tight_variables=110 #tight_constraints=57 

Presolve summary:
  - 60 affine relations were detected.
  - rule 'TODO dual: only one blocking constraint?' was applied 565 times.
  - rule 'TODO dual: only one blocking enforced constraint?' was applied 26 times.
  - rule 'TODO dual: only one unspecified blocking constraint?' was applied 27 times.
  - rule 'TODO duplicate: identical constraint with different enforcements' was applied 899 times.
  - rule 'affine: new relation' was applied 60 times.
  - rule 'at_most_one: removed literals' was applied 12 times.
  - rule 'at_most_one: size one' was applied 12 times.
  - rule 'at_most_one: transformed into max clique.' was applied 1 time.
  - rule 'deductions: 194 stored' was applied 1 time.
  - rule 'dual: fix variable' was applied 27 times.
  - rule 'dual: reduced domain' was applied 38 times.
  - rule 'duplicate: merged rhs of linear constraint' was applied 44 times.
  - rule 'duplicate: removed constraint' was applied 202 times.
  - rule 'enforcement: false literal' was applied 14 times.
  - rule 'exactly_one: x and not(x)' was applied 1 time.
  - rule 'incompatible linear: add implication' was applied 30 times.
  - rule 'linear matrix: common vertical rectangle' was applied 74 times.
  - rule 'linear: always true' was applied 807 times.
  - rule 'linear: doubleton free' was applied 10 times.
  - rule 'linear: empty' was applied 34 times.
  - rule 'linear: extracted enforcement literal' was applied 7'120 times.
  - rule 'linear: fixed or dup variables' was applied 3'343 times.
  - rule 'linear: positive equal one' was applied 2 times.
  - rule 'linear: reduced variable domains' was applied 163 times.
  - rule 'linear: remapped using affine relations' was applied 3'345 times.
  - rule 'linear: simplified rhs' was applied 9'553 times.
  - rule 'linear: tightened into equality' was applied 9 times.
  - rule 'linear: variable substitution 1' was applied 10 times.
  - rule 'no_overlap: inferred from x != y constraints' was applied 1 time.
  - rule 'presolve: 94 unused variables removed.' was applied 1 time.
  - rule 'presolve: iteration' was applied 3 times.
  - rule 'probing: reduced enforced constraint to implication.' was applied 30 times.
  - rule 'symmetry: fixed to false in general orbit' was applied 1 time.

Presolved optimization model '': (model_fingerprint: 0x31cd74641f70ae5a)
#Variables: 190 (#ints: 10 in objective)
  - 59 Booleans in [0,1]
  - 108 different domains in [-4030,3522] with a largest complexity of 10.
#kExactlyOne: 1 (#literals: 3)
#kInterval: 5
#kLinear2: 800 (#enforced: 762 #multi: 673)
#kLinear3: 222 (#enforced: 99)
#kLinearN: 1'869 (#enforced: 1'759 #multi: 88) (#terms: 14'961)
#kNoOverlap: 1 (#intervals: 5)

Preloading model.
#Bound   0.17s best:inf   next:[160,4467] initial_domain
[Symmetry] Graph for symmetry has 3'441 nodes and 24'341 arcs.
[Symmetry] Symmetry computation done. time: 0.000508354 dtime: 0.00139015
#Model   0.18s var:190/190 constraints:2898/2898

Starting search at 0.18s with 32 workers.
17 full problem subsolvers: [core, default_lp, fixed, lb_tree_search, max_lp, no_lp, objective_lb_search, objective_lb_search_max_lp, objective_lb_search_no_lp, objective_shaving_search_max_lp, objective_shaving_search_no_lp, probing, probing_max_lp, pseudo_costs, quick_restart, quick_restart_no_lp, reduced_costs]
13 first solution subsolvers: [fj_long_default, fj_long_lin_default, fj_long_random, fj_short_default, fj_short_lin_default, fj_short_lin_random, fj_short_random, fs_random(2), fs_random_no_lp, fs_random_quick_restart(2), fs_random_quick_restart_no_lp]
13 incomplete subsolvers: [feasibility_pump, graph_arc_lns, graph_cst_lns, graph_dec_lns, graph_var_lns, rins/rens, rnd_cst_lns, rnd_var_lns, scheduling_intervals_lns, scheduling_precedences_lns, scheduling_time_window_lns, violation_ls(2)]
3 helper subsolvers: [neighborhood_helper, synchronization_agent, update_gap_integral]
#Bound   0.22s best:inf   next:[169,4467] objective_lb_search_no_lp
#1       0.23s best:1915  next:[169,1914] no_lp (fixed_bools=0/88)
#2       0.25s best:1815  next:[169,1814] no_lp (fixed_bools=0/99)
#3       0.25s best:1790  next:[169,1789] no_lp (fixed_bools=0/103)
#4       0.26s best:1775  next:[169,1774] no_lp (fixed_bools=0/105)
#5       0.26s best:1763  next:[169,1762] no_lp (fixed_bools=0/106)
#6       0.26s best:1708  next:[169,1707] no_lp (fixed_bools=0/113)
#7       0.27s best:1684  next:[169,1683] no_lp (fixed_bools=0/116)
#8       0.27s best:1623  next:[169,1622] no_lp (fixed_bools=0/123)
#Bound   0.29s best:1623  next:[170,1622] bool_core (num_cores=3 [cover] a=7 d=2 fixed=7/105 clauses=36)
#Bound   0.29s best:1623  next:[171,1622] bool_core (num_cores=3 [cover] a=7 d=2 fixed=8/108 clauses=40)
#Bound   0.29s best:1623  next:[172,1622] bool_core (num_cores=3 [cover] a=7 d=2 fixed=9/111 clauses=45)
#9       0.29s best:1596  next:[172,1595] no_lp (fixed_bools=0/126)
#Bound   0.29s best:1596  next:[173,1595] bool_core (num_cores=3 [cover] a=7 d=2 fixed=10/114 clauses=51)
#Bound   0.29s best:1596  next:[174,1595] bool_core (num_cores=3 [cover] a=7 d=2 fixed=11/117 clauses=58)
#10      0.29s best:1593  next:[174,1592] no_lp (fixed_bools=0/130)
#Bound   0.29s best:1593  next:[175,1592] bool_core (num_cores=3 [cover] a=7 d=2 fixed=12/120 clauses=66)
#Bound   0.30s best:1593  next:[176,1592] bool_core (num_cores=3 [cover] a=7 d=2 fixed=13/123 clauses=75)
#Bound   0.30s best:1593  next:[177,1592] bool_core (num_cores=3 [cover] a=7 d=2 fixed=14/126 clauses=85)
#11      0.30s best:1584  next:[177,1583] no_lp (fixed_bools=0/133)
#12      0.30s best:1581  next:[177,1580] no_lp (fixed_bools=0/136)
#Bound   0.30s best:1581  next:[218,1580] default_lp
#13      0.31s best:1576  next:[218,1575] quick_restart_no_lp (fixed_bools=0/173)
#Bound   0.32s best:1576  next:[228,1575] objective_lb_search_no_lp
#Bound   0.32s best:1576  next:[274,1575] objective_lb_search_no_lp
#14      0.32s best:1556  next:[274,1555] no_lp (fixed_bools=0/140)
#15      0.32s best:1545  next:[274,1544] no_lp (fixed_bools=0/143)
#16      0.32s best:1537  next:[274,1536] no_lp (fixed_bools=0/145)
#Bound   0.32s best:1537  next:[376,1536] objective_lb_search_no_lp
#Bound   0.32s best:1537  next:[377,1536] objective_lb_search_no_lp
#Bound   0.33s best:1537  next:[378,1536] objective_lb_search_no_lp
#Bound   0.33s best:1537  next:[397,1536] objective_lb_search_no_lp
#17      0.39s best:1528  next:[397,1527] no_lp (fixed_bools=0/174)
#Bound   0.40s best:1528  next:[654,1527] objective_lb_search_no_lp
#18      0.41s best:1527  next:[654,1526] no_lp (fixed_bools=0/174)
#19      0.42s best:1526  next:[654,1525] no_lp (fixed_bools=0/174)
#20      0.43s best:1522  next:[654,1521] no_lp (fixed_bools=0/175)
#21      0.43s best:1480  next:[654,1479] no_lp (fixed_bools=0/176)
#22      0.43s best:1458  next:[654,1457] no_lp (fixed_bools=0/183)
#23      0.47s best:1453  next:[654,1452] no_lp (fixed_bools=0/218)
#24      0.50s best:1452  next:[654,1451] no_lp (fixed_bools=0/241)
#25      0.50s best:1404  next:[654,1403] no_lp (fixed_bools=0/246)
#26      0.53s best:1399  next:[654,1398] quick_restart_no_lp (fixed_bools=0/231)
#27      0.53s best:1382  next:[654,1381] no_lp (fixed_bools=0/256)
#28      0.56s best:1377  next:[654,1376] quick_restart_no_lp (fixed_bools=0/240)
#29      0.58s best:1376  next:[654,1375] violation_ls(batch:2 #solutions_imported:2 #lin_moves:0 #lin_evals:15'962 #gen_moves:7'032 #gen_evals:1'555 #comp_moves:598 #backtracks:3'215 #weight_updates:73)
#Bound   0.58s best:1376  next:[662,1375] objective_lb_search_no_lp
#30      0.59s best:1374  next:[662,1373] quick_restart_no_lp (fixed_bools=0/243)
#31      0.59s best:1373  next:[662,1372] violation_ls(batch:3 #solutions_imported:3 #lin_moves:105 #lin_evals:16'388 #gen_moves:7'032 #gen_evals:1'555 #comp_moves:598 #backtracks:3'215 #weight_updates:123)
#32      0.59s best:1360  next:[662,1359] quick_restart_no_lp (fixed_bools=0/245)
#33      0.69s best:1359  next:[662,1358] violation_ls(batch:4 #solutions_imported:4 #lin_moves:238 #lin_evals:16'927 #gen_moves:7'032 #gen_evals:1'555 #comp_moves:598 #backtracks:3'215 #weight_updates:182)
#34      0.72s best:1358  next:[662,1357] violation_ls(batch:4 #solutions_imported:4 #lin_moves:1'915 #lin_evals:36'409 #gen_moves:13'927 #gen_evals:3'149 #comp_moves:888 #backtracks:6'516 #weight_updates:492)
#35      0.77s best:1260  next:[662,1259] no_lp (fixed_bools=4/299)
#36      0.82s best:1255  next:[662,1254] quick_restart_no_lp (fixed_bools=0/389)
#37      0.85s best:1254  next:[662,1253] quick_restart_no_lp (fixed_bools=0/391)
#38      0.86s best:1253  next:[662,1252] quick_restart_no_lp (fixed_bools=0/393)
#Bound   0.86s best:1253  next:[667,1252] objective_lb_search_no_lp
#39      0.86s best:1250  next:[667,1249] quick_restart_no_lp (fixed_bools=0/395)
#40      0.87s best:1245  next:[667,1244] quick_restart_no_lp (fixed_bools=0/401)
#41      0.92s best:1240  next:[667,1239] quick_restart_no_lp (fixed_bools=0/405)
#42      0.99s best:1235  next:[667,1234] quick_restart_no_lp (fixed_bools=0/425)
#43      1.03s best:1225  next:[667,1224] quick_restart_no_lp (fixed_bools=0/429)
#44      1.06s best:1221  next:[667,1220] quick_restart_no_lp (fixed_bools=0/434)
#45      1.13s best:1208  next:[667,1207] quick_restart_no_lp (fixed_bools=0/458)
#Bound   1.13s best:1208  next:[672,1207] objective_lb_search_no_lp
#46      1.16s best:1191  next:[672,1190] quick_restart_no_lp (fixed_bools=0/464)
#Bound   1.37s best:1191  next:[677,1190] objective_lb_search_no_lp
#47      1.51s best:1188  next:[677,1187] quick_restart_no_lp (fixed_bools=0/504)
#Bound   1.99s best:1188  next:[679,1187] objective_lb_search_no_lp [skipped_logs=1]
#Bound   2.79s best:1188  next:[706,1187] objective_lb_search_no_lp [skipped_logs=4]
#Bound   3.72s best:1188  next:[717,1187] objective_lb_search_no_lp [skipped_logs=1]
#Bound   4.76s best:1188  next:[741,1187] objective_lb_search_no_lp [skipped_logs=6]
#Bound   5.55s best:1188  next:[744,1187] objective_lb_search_no_lp [skipped_logs=1]
#Bound   6.97s best:1188  next:[753,1187] objective_lb_search_no_lp [skipped_logs=5]
#Bound   7.94s best:1188  next:[761,1187] objective_lb_search_no_lp [skipped_logs=2]
#Bound   8.84s best:1188  next:[773,1187] objective_lb_search_no_lp [skipped_logs=3]
#Bound   9.66s best:1188  next:[795,1187] objective_lb_search_no_lp [skipped_logs=5]
#Bound  11.12s best:1188  next:[797,1187] objective_lb_search_no_lp
#Bound  11.69s best:1188  next:[801,1187] objective_lb_search_no_lp [skipped_logs=0]
#Bound  12.85s best:1188  next:[807,1187] objective_lb_search_no_lp [skipped_logs=2]
#Bound  13.65s best:1188  next:[809,1187] objective_lb_search_no_lp [skipped_logs=0]
#Bound  14.54s best:1188  next:[816,1187] objective_lb_search_no_lp [skipped_logs=2]
#Bound  15.33s best:1188  next:[817,1187] objective_lb_search_no_lp [skipped_logs=0]
#Bound  16.43s best:1188  next:[823,1187] objective_lb_search_no_lp [skipped_logs=1]
#Bound  17.27s best:1188  next:[824,1187] objective_lb_search_no_lp [skipped_logs=0]
#Bound  18.99s best:1188  next:[827,1187] lb_tree_search (nodes=2734/2737 rc=14 decisions=24770 @root=27 restarts=10)  [skipped_logs=2]
#Bound  19.99s best:1188  next:[833,1187] objective_lb_search_no_lp [skipped_logs=3]
#Bound  20.35s best:1188  next:[835,1187] objective_lb_search_no_lp [skipped_logs=1]
#Bound  21.63s best:1188  next:[836,1187] lb_tree_search (nodes=3011/3014 rc=17 decisions=27799 @root=29 restarts=10)  [skipped_logs=0]
#Bound  22.87s best:1188  next:[841,1187] objective_lb_search_no_lp [skipped_logs=2]
#Bound  23.29s best:1188  next:[842,1187] objective_lb_search_no_lp [skipped_logs=0]
#Bound  24.76s best:1188  next:[844,1187] lb_tree_search (nodes=3249/3252 rc=19 decisions=30816 @root=34 restarts=10)  [skipped_logs=1]
#Bound  25.44s best:1188  next:[852,1187] objective_lb_search_no_lp [skipped_logs=1]
#Bound  26.85s best:1188  next:[854,1187] objective_lb_search_no_lp [skipped_logs=0]
#Bound  27.88s best:1188  next:[856,1187] objective_lb_search_no_lp [skipped_logs=0]
#Bound  28.74s best:1188  next:[858,1187] objective_lb_search_no_lp [skipped_logs=1]
#Bound  29.32s best:1188  next:[860,1187] objective_lb_search_no_lp [skipped_logs=0]
#Bound  30.41s best:1188  next:[861,1187] lb_tree_search (nodes=3838/3841 rc=34 decisions=37329 @root=39 restarts=10)  [skipped_logs=0]
#Bound  31.87s best:1188  next:[863,1187] lb_tree_search (nodes=3910/3913 rc=37 decisions=38514 @root=41 restarts=10)  [skipped_logs=1]
#Bound  32.65s best:1188  next:[864,1187] lb_tree_search (nodes=3945/3948 rc=38 decisions=39199 @root=42 restarts=10)  [skipped_logs=0]
#Bound  33.53s best:1188  next:[866,1187] objective_lb_search_no_lp [skipped_logs=1]
#Bound  34.72s best:1188  next:[869,1187] objective_lb_search_no_lp [skipped_logs=1]
#Bound  35.90s best:1188  next:[872,1187] objective_lb_search_no_lp [skipped_logs=1]
#Bound  36.59s best:1188  next:[873,1187] objective_lb_search_no_lp [skipped_logs=0]
#Bound  37.90s best:1188  next:[903,1187] objective_lb_search_no_lp [skipped_logs=1]
#Model  39.41s var:188/190 constraints:2716/2898
#Bound  39.90s best:1188  next:[906,1187] objective_lb_search_no_lp
#Bound  40.15s best:1188  next:[908,1187] objective_lb_search_no_lp
#Bound  40.76s best:1188  next:[921,1187] objective_lb_search_no_lp [skipped_logs=1]
#Bound  41.95s best:1188  next:[940,1187] objective_lb_search_no_lp [skipped_logs=5]
#Bound  42.94s best:1188  next:[951,1187] objective_lb_search_no_lp [skipped_logs=5]
#Bound  43.73s best:1188  next:[971,1187] objective_lb_search_no_lp [skipped_logs=4]
#Model  44.67s var:186/190 constraints:2657/2898
#Bound  44.74s best:1188  next:[990,1187] objective_lb_search_no_lp [skipped_logs=7]
#Bound  46.25s best:1188  next:[991,1187] objective_lb_search_no_lp
#Bound  46.73s best:1188  next:[992,1187] objective_lb_search_no_lp [skipped_logs=0]
#Model  47.16s var:185/190 constraints:2441/2898
#Model  47.60s var:183/190 constraints:2153/2898
#Bound  47.88s best:1188  next:[997,1187] objective_lb_search_no_lp [skipped_logs=3]
#Model  48.04s var:182/190 constraints:2073/2898
#Model  48.16s var:181/190 constraints:2064/2898
#Model  48.17s var:180/190 constraints:1974/2898
#Model  48.25s var:176/190 constraints:1806/2898
#Model  48.26s var:175/190 constraints:1799/2898
#Model  48.27s var:174/190 constraints:1730/2898
#Done   48.28s no_lp
#Done   48.28s objective_lb_search_no_lp
#Done   48.28s quick_restart_no_lp
#Model  48.28s var:150/190 constraints:344/2898
#Done   48.29s core
#Model  48.29s var:147/190 constraints:247/2898
#Done   48.29s probing_max_lp
#Bound  48.25s best:1188  next:[1090,1187] objective_lb_search_no_lp [skipped_logs=11]

Task timing                                  n [     min,      max]      avg      dev     time         n [     min,      max]      avg      dev    dtime
                             'core':         1 [  48.11s,   48.11s]   48.11s   0.00ns   48.11s         1 [   1.71m,    1.71m]    1.71m   0.00ns    1.71m
                       'default_lp':         1 [  48.11s,   48.11s]   48.11s   0.00ns   48.11s         1 [  21.46s,   21.46s]   21.46s   0.00ns   21.46s
                 'feasibility_pump':       191 [ 36.30ms, 835.64ms]  53.37ms  56.77ms   10.19s       190 [ 13.17ms,  23.94ms]  14.91ms 681.92us    2.83s
                            'fixed':         1 [  48.11s,   48.11s]   48.11s   0.00ns   48.11s         1 [  28.69s,   28.69s]   28.69s   0.00ns   28.69s
                  'fj_long_default':         1 [451.97ms, 451.97ms] 451.97ms   0.00ns 451.97ms         1 [120.61ms, 120.61ms] 120.61ms   0.00ns 120.61ms
              'fj_long_lin_default':         1 [328.44ms, 328.44ms] 328.44ms   0.00ns 328.44ms         1 [ 79.56ms,  79.56ms]  79.56ms   0.00ns  79.56ms
                   'fj_long_random':         1 [381.73ms, 381.73ms] 381.73ms   0.00ns 381.73ms         1 [113.95ms, 113.95ms] 113.95ms   0.00ns 113.95ms
                 'fj_short_default':         1 [ 93.08ms,  93.08ms]  93.08ms   0.00ns  93.08ms         1 [ 80.85ms,  80.85ms]  80.85ms   0.00ns  80.85ms
             'fj_short_lin_default':         1 [560.60ms, 560.60ms] 560.60ms   0.00ns 560.60ms         1 [ 84.92ms,  84.92ms]  84.92ms   0.00ns  84.92ms
              'fj_short_lin_random':         1 [468.22ms, 468.22ms] 468.22ms   0.00ns 468.22ms         1 [ 80.69ms,  80.69ms]  80.69ms   0.00ns  80.69ms
                  'fj_short_random':         1 [163.97ms, 163.97ms] 163.97ms   0.00ns 163.97ms         1 [ 78.76ms,  78.76ms]  78.76ms   0.00ns  78.76ms
                        'fs_random':         1 [ 72.64ms,  72.64ms]  72.64ms   0.00ns  72.64ms         1 [  2.05us,   2.05us]   2.05us   0.00ns   2.05us
                        'fs_random':         1 [ 74.41ms,  74.41ms]  74.41ms   0.00ns  74.41ms         1 [  2.05us,   2.05us]   2.05us   0.00ns   2.05us
                  'fs_random_no_lp':         1 [ 74.29ms,  74.29ms]  74.29ms   0.00ns  74.29ms         1 [313.13us, 313.13us] 313.13us   0.00ns 313.13us
          'fs_random_quick_restart':         1 [ 56.93ms,  56.93ms]  56.93ms   0.00ns  56.93ms         1 [ 20.00ns,  20.00ns]  20.00ns   0.00ns  20.00ns
          'fs_random_quick_restart':         1 [ 72.77ms,  72.77ms]  72.77ms   0.00ns  72.77ms         1 [  2.05us,   2.05us]   2.05us   0.00ns   2.05us
    'fs_random_quick_restart_no_lp':         1 [ 74.20ms,  74.20ms]  74.20ms   0.00ns  74.20ms         1 [204.48us, 204.48us] 204.48us   0.00ns 204.48us
                    'graph_arc_lns':       190 [ 14.37ms, 571.21ms] 324.76ms 189.49ms    1.03m       188 [ 10.00ns, 128.69ms]  61.91ms  43.97ms   11.64s
                    'graph_cst_lns':       190 [952.77us, 555.62ms] 226.14ms 216.23ms   42.97s       131 [ 10.00ns, 100.58ms]  60.62ms  41.76ms    7.94s
                    'graph_dec_lns':       190 [  4.88ms, 551.68ms] 331.89ms 170.49ms    1.05m       189 [ 10.00ns, 106.29ms]  64.03ms  41.44ms   12.10s
                    'graph_var_lns':       190 [  8.64ms, 562.99ms] 312.82ms 201.99ms   59.44s       187 [ 10.00ns, 106.32ms]  59.81ms  46.16ms   11.19s
                   'lb_tree_search':         1 [  48.10s,   48.10s]   48.10s   0.00ns   48.10s         1 [  34.51s,   34.51s]   34.51s   0.00ns   34.51s
                           'max_lp':         1 [  48.11s,   48.11s]   48.11s   0.00ns   48.11s         1 [  21.62s,   21.62s]   21.62s   0.00ns   21.62s
                            'no_lp':         1 [  48.10s,   48.10s]   48.10s   0.00ns   48.10s         1 [  18.74s,   18.74s]   18.74s   0.00ns   18.74s
              'objective_lb_search':         1 [  48.10s,   48.10s]   48.10s   0.00ns   48.10s         1 [  22.76s,   22.76s]   22.76s   0.00ns   22.76s
       'objective_lb_search_max_lp':         1 [  48.11s,   48.11s]   48.11s   0.00ns   48.11s         1 [  24.43s,   24.43s]   24.43s   0.00ns   24.43s
        'objective_lb_search_no_lp':         1 [  48.10s,   48.10s]   48.10s   0.00ns   48.10s         1 [  12.40s,   12.40s]   12.40s   0.00ns   12.40s
  'objective_shaving_search_max_lp':       127 [ 13.27ms,    2.01s] 371.30ms 351.55ms   47.15s       123 [691.77us, 600.37ms]  93.09ms 112.42ms   11.45s
   'objective_shaving_search_no_lp':       127 [ 13.34ms,    2.01s] 373.81ms 351.68ms   47.47s       124 [ 54.45us, 427.34ms]  67.72ms  77.18ms    8.40s
                          'probing':         1 [  48.11s,   48.11s]   48.11s   0.00ns   48.11s         1 [  19.30s,   19.30s]   19.30s   0.00ns   19.30s
                   'probing_max_lp':         1 [  48.11s,   48.11s]   48.11s   0.00ns   48.11s         1 [  26.90s,   26.90s]   26.90s   0.00ns   26.90s
                     'pseudo_costs':         1 [  48.11s,   48.11s]   48.11s   0.00ns   48.11s         1 [  21.24s,   21.24s]   21.24s   0.00ns   21.24s
                    'quick_restart':         1 [  48.11s,   48.11s]   48.11s   0.00ns   48.11s         1 [  27.02s,   27.02s]   27.02s   0.00ns   27.02s
              'quick_restart_no_lp':         1 [  48.10s,   48.10s]   48.10s   0.00ns   48.10s         1 [  26.96s,   26.96s]   26.96s   0.00ns   26.96s
                    'reduced_costs':         1 [  48.11s,   48.11s]   48.11s   0.00ns   48.11s         1 [  22.26s,   22.26s]   22.26s   0.00ns   22.26s
                        'rins/rens':       191 [ 59.92us, 496.68ms] 249.75ms 176.07ms   47.70s       169 [ 10.00ns, 100.37ms]  67.43ms  41.04ms   11.40s
                      'rnd_cst_lns':       190 [985.01us, 566.41ms] 319.77ms 194.89ms    1.01m       178 [ 10.00ns, 148.86ms]  64.99ms  42.78ms   11.57s
                      'rnd_var_lns':       190 [ 10.79ms, 545.39ms] 322.79ms 177.78ms    1.02m       190 [ 10.00ns, 106.76ms]  62.35ms  42.68ms   11.85s
         'scheduling_intervals_lns':       190 [ 73.82ms,    1.54s] 521.10ms 121.45ms    1.65m       190 [  4.30ms, 106.40ms] 101.72ms   8.66ms   19.33s
       'scheduling_precedences_lns':       190 [ 73.73ms,    2.02s] 526.32ms 148.90ms    1.67m       189 [ 31.25ms, 108.04ms] 101.93ms   6.75ms   19.26s
       'scheduling_time_window_lns':       190 [ 73.62ms,    1.47s] 519.57ms 118.34ms    1.65m       189 [ 53.31ms, 106.38ms] 102.11ms   5.15ms   19.30s
                     'violation_ls':       191 [  2.38ms, 312.70ms]  27.17ms  21.95ms    5.19s       191 [567.37us, 187.66ms]  37.64ms  21.57ms    7.19s
                     'violation_ls':       191 [ 10.68ms,  76.92ms]  26.20ms   8.82ms    5.00s       191 [ 81.31us, 193.42ms]  38.30ms  22.73ms    7.31s

Search stats                        Bools  Conflicts  Branches  Restarts  BoolPropag  IntegerPropag
                           'core':  5'847     42'241    70'844     9'012  79'016'534     26'647'335
                     'default_lp':     59     28'863   136'659    14'726     592'107     21'360'182
                          'fixed':  1'256    140'847   341'542       118  16'572'388     30'165'476
                      'fs_random':     59          0       118       118           6          2'028
                      'fs_random':     59          0       118       118           6          2'028
                'fs_random_no_lp':     69          6       133       118          81          3'160
        'fs_random_quick_restart':     59          0       118       118           6          2'028
        'fs_random_quick_restart':     59          0       118       118           6          2'028
  'fs_random_quick_restart_no_lp':     59          0       153       118           7          2'708
                 'lb_tree_search':     69        172   106'451    19'944     156'532      5'580'776
                         'max_lp':     59     23'042   140'049    15'995     573'268     18'928'669
                          'no_lp':  1'423     86'975   176'841    11'763  30'131'940     45'903'784
            'objective_lb_search':    210     15'379   211'304    51'555     933'404     21'042'105
     'objective_lb_search_max_lp':    175     11'739   218'622    47'581     992'985     19'252'387
      'objective_lb_search_no_lp':    348     67'710   146'262    11'970   1'942'508     39'156'502
                        'probing':    331        116     2'922     1'798      25'403        113'725
                 'probing_max_lp':    331        127     1'760     1'211      17'404         85'424
                   'pseudo_costs':     59     25'797   141'470    17'303     566'978     18'717'247
                  'quick_restart':  1'107     22'740   170'723    17'982  12'750'091     15'683'534
            'quick_restart_no_lp':  2'468     80'554   251'132    17'001  44'664'021     33'440'075
                  'reduced_costs':    862     28'173   153'869    16'469  12'080'592     19'408'156

SAT stats                           ClassicMinim  LitRemoved  LitLearned  LitForgotten  Subsumed  MClauses  MDecisions  MLitTrue  MSubsumed  MLitRemoved  MReused
                           'core':        39'399     329'105     351'063         7'052       118     4'068      20'298         0          6           24       66
                     'default_lp':        16'076      40'633     324'603       113'822     1'241     7'611      99'619         0      1'666       13'284    1'691
                          'fixed':        68'625     189'242   2'443'328       371'707        32         0           0         0          0            0        0
                      'fs_random':             0           0           0             0         0         0           0         0          0            0        0
                      'fs_random':             0           0           0             0         0         0           0         0          0            0        0
                'fs_random_no_lp':             0           0          39             0         0         0           0         0          0            0        0
        'fs_random_quick_restart':             0           0           0             0         0         0           0         0          0            0        0
        'fs_random_quick_restart':             0           0           0             0         0         0           0         0          0            0        0
  'fs_random_quick_restart_no_lp':             0           0           0             0         0         0           0         0          0            0        0
                 'lb_tree_search':             9          11         579             0         0     7'212      36'650         0         14           53      292
                         'max_lp':        12'320      29'934     253'791        78'412     1'084     8'097     110'095         0      1'211        9'438    2'088
                          'no_lp':        72'997     351'219   1'080'944       673'508     1'066     6'243      55'378         0      3'002       23'090      921
            'objective_lb_search':        10'107      25'288     140'683         2'508       823    22'004     174'470         0      1'774       11'479    4'474
     'objective_lb_search_max_lp':         7'476      19'330     107'106             0       643    19'293     185'890         0        892        5'834    5'901
      'objective_lb_search_no_lp':        54'426     204'995     561'070       106'746     1'687     6'915      66'147        20      3'487       24'056    1'428
                        'probing':             0           0         116             0         0         0           0         0          0            0        0
                 'probing_max_lp':             0           0         127             0         0         0           0         0          0            0        0
                   'pseudo_costs':        12'699      25'411     268'521        88'550     1'444     9'045     107'058         0      2'629       19'645    2'168
                  'quick_restart':        14'573      54'482     206'412        27'889       637    11'599     133'033        27      6'782       57'827    2'517
            'quick_restart_no_lp':        63'619     363'470   1'003'681       323'043       505     6'638      71'530        27      4'750       45'167      670
                  'reduced_costs':        18'571      56'890     311'129       111'644       671     8'568      95'556         1      2'578       19'495    1'438

Lp stats                         Component  Iterations  AddedCuts  OPTIMAL  DUAL_F.  DUAL_U.
                  'default_lp':          1     410'122     12'621   49'718        0        1
                       'fixed':          1     221'665      1'181  149'800        0        0
                   'fs_random':          1          52         50        3        0        0
                   'fs_random':          1          52         51        3        0        0
     'fs_random_quick_restart':          1          52          0        2        0        0
     'fs_random_quick_restart':          1          52         50        3        0        0
              'lb_tree_search':          1     923'490      7'373   49'462   17'064        0
                      'max_lp':          1     433'455     14'790   38'766    9'610       27
         'objective_lb_search':          1     445'454      8'306   32'875        0        4
  'objective_lb_search_max_lp':          1     459'691      8'610   21'663    7'496       11
                     'probing':          1     247'994      6'076    8'489        0        4
              'probing_max_lp':          1     116'416     17'230    5'411      768        0
                'pseudo_costs':          1     433'509     15'883   37'674    9'992       25
               'quick_restart':          1     454'151      6'664   33'223        0        1
               'reduced_costs':          1     410'520     16'115   40'084    9'552       13

Lp dimension                                                                     Final dimension of first component
                  'default_lp':  582 rows, 189 columns, 1644 entries with magnitude in [2.035415e-03, 1.000000e+00]
                       'fixed':   100 rows, 189 columns, 307 entries with magnitude in [5.812441e-02, 1.000000e+00]
                   'fs_random':    58 rows, 189 columns, 184 entries with magnitude in [9.853293e-02, 1.000000e+00]
                   'fs_random':    58 rows, 189 columns, 184 entries with magnitude in [9.853293e-02, 1.000000e+00]
     'fs_random_quick_restart':    58 rows, 189 columns, 184 entries with magnitude in [9.853293e-02, 1.000000e+00]
     'fs_random_quick_restart':    58 rows, 189 columns, 184 entries with magnitude in [9.853293e-02, 1.000000e+00]
              'lb_tree_search':   269 rows, 190 columns, 930 entries with magnitude in [1.240064e-02, 1.000000e+00]
                      'max_lp':  416 rows, 190 columns, 1566 entries with magnitude in [7.238410e-03, 1.000000e+00]
         'objective_lb_search':  489 rows, 189 columns, 1733 entries with magnitude in [1.351859e-03, 1.000000e+00]
  'objective_lb_search_max_lp':  580 rows, 190 columns, 1228 entries with magnitude in [2.262572e-03, 1.000000e+00]
                     'probing':  415 rows, 189 columns, 1665 entries with magnitude in [1.591422e-03, 1.000000e+00]
              'probing_max_lp':  645 rows, 190 columns, 5333 entries with magnitude in [5.418747e-03, 1.000000e+00]
                'pseudo_costs':  635 rows, 190 columns, 1974 entries with magnitude in [3.309345e-03, 1.000000e+00]
               'quick_restart':   575 rows, 189 columns, 792 entries with magnitude in [2.302351e-03, 1.000000e+00]
               'reduced_costs':  343 rows, 190 columns, 1290 entries with magnitude in [7.742678e-03, 1.000000e+00]

Lp debug                         CutPropag  CutEqPropag  Adjust  Overflow        Bad  BadScaling
                  'default_lp':         12            9  23'147         0    132'381           0
                       'fixed':          0            0   6'161         0      1'595           0
                   'fs_random':          0            0       0         0          0           0
                   'fs_random':          0            0       0         0          2           0
     'fs_random_quick_restart':          0            0       0         0          0           0
     'fs_random_quick_restart':          0            0       0         0          0           0
              'lb_tree_search':          0            2  39'168         0     64'121           0
                      'max_lp':          2            0  21'723         0    112'109           0
         'objective_lb_search':          1            4  18'914         0    159'315           0
  'objective_lb_search_max_lp':         12            2  17'399         0    132'011           0
                     'probing':          2           52   7'684         0  2'647'893           0
              'probing_max_lp':         13           49   4'836         0  1'832'523           0
                'pseudo_costs':          8            1  21'435         0    127'243           0
               'quick_restart':         39           13  22'189         0    306'534           0
               'reduced_costs':          4           13  23'120         0     97'982           0

Lp pool                          Constraints  Updates  Simplif  Merged  Shortened   Split  Strenghtened      Cuts/Call
                  'default_lp':        9'761      673   80'303     132      9'146  13'100        26'856  12'621/44'925
                       'fixed':        1'453        8        1       0          0      11           143    1'181/3'266
                   'fs_random':          322        0        0       0          0       0            44          50/50
                   'fs_random':          323        0        0       0          0       0            44          51/51
     'fs_random_quick_restart':          272        0        0       0          0       0            44            0/0
     'fs_random_quick_restart':          322        0        0       0          0       0            44          50/50
              'lb_tree_search':       10'232      411   21'559      33      1'058   1'315        28'643   7'373/30'426
                      'max_lp':       12'482      681  101'834     200      8'366   6'376        55'759  14'790/42'876
         'objective_lb_search':        8'520      738   74'083      58      6'448  11'414        35'836   8'306/28'536
  'objective_lb_search_max_lp':       11'442      850   88'835      60     10'623   7'800        62'024   8'610/25'110
                     'probing':        6'333    1'502   23'433      15      3'595  23'019         7'442   6'076/14'399
              'probing_max_lp':       12'110    2'848   29'162      12      2'971  19'470        26'943  17'230/44'963
                'pseudo_costs':       12'576      693  133'772     199     11'109   6'141        76'415  15'883/45'386
               'quick_restart':        6'904      836  144'745      32      9'760  27'895        33'045   6'664/25'427
               'reduced_costs':       11'830      583   44'234     177      1'466   6'294        49'215  16'115/46'045

Lp Cut                                                fs_ran  fs_ran  fs_ran  defaul  fixed  max_lp  quick_  reduce  pseudo  lb_tre  probin  object  probin  object
                                              CG_FF:       -       -       -     659     83   1'042     207   1'057     797     406     164     278     186     470
                                               CG_K:       -       -       -     417     37     568      71     582     488     171      55     150     124     149
                                               CG_R:       -       -       -     522     54     740      88     783     546     214      76     194     178     224
                                              CG_RB:       -       -       -   1'694    250   2'985     889   3'065   2'693   1'822     661   1'001   1'013   1'493
                                             CG_RBP:       -       -       -     222     27     349     140     407     274     211      60     104      82     137
                                             Clique:       -       -       -       -      -      55       -      40      55      27       -       -      26      53
                                                 IB:      50      50      50   1'100    241   1'161     836   1'391   1'315     622     805     819     537     703
                                           MIR_1_FF:       -       -       -     777     78     671     378     708     797     302     283     527     409     440
                                            MIR_1_K:       -       -       -     113      9      96      39     112     141      37      29      84      46      53
                                           MIR_1_KL:       -       -       -       5      -       1       5       3       2       -       5       -       1       -
                                            MIR_1_R:       -       -       -     119     16     117      50     104     123      36      32      87      45      38
                                           MIR_1_RB:       -       1       -   1'432     97   1'300     689   1'478   1'609     737     520     954     994     907
                                          MIR_1_RBP:       -       -       -     102     10     187      43     223     186      88      28      69      60     112
                                          MIR_1_RLT:       -       -       -       -      -       -       -       -       -       -       -       -       2       -
                                           MIR_2_FF:       -       -       -     471     37     502     218     555     578     211     153     314     287     323
                                            MIR_2_K:       -       -       -      92      5      78      32      95      88      29      17      62      25      46
                                           MIR_2_KL:       -       -       -       3      -       1       4       2       1       -       5       -       2       -
                                            MIR_2_R:       -       -       -     184     11     114      66     144     145      42      59     123      76      46
                                           MIR_2_RB:       -       -       -     831     44     738     419     845     960     353     313     603     408     463
                                          MIR_2_RBP:       -       -       -      96      4     108      43     148     139      39      27      90      32      59
                                           MIR_3_FF:       -       -       -     303     12     385     123     403     459     155     102     193     168     204
                                            MIR_3_K:       -       -       -      68      5      85      20     107      99      30      18      52      44      48
                                           MIR_3_KL:       -       -       -       2      -       2       1       3       3       -       3       -       1       -
                                            MIR_3_R:       -       -       -     152     11     111      89     134     185      23      56     109      64      61
                                           MIR_3_RB:       -       -       -     456     25     475     287     517     629     227     200     381     264     335
                                          MIR_3_RBP:       -       -       -      65      1      61      29     103      96      20      19      47      23      45
                                           MIR_4_FF:       -       -       -     230     11     221      87     258     261      88      57     133      94     123
                                            MIR_4_K:       -       -       -      73      -      52      16      77      59      12      11      40       9      25
                                           MIR_4_KL:       -       -       -       1      -       -       -       -       -       -       1       1       2       -
                                            MIR_4_R:       -       -       -     139      5      83      61      99     121      34      36      83      54      44
                                           MIR_4_RB:       -       -       -     357     16     285     157     337     326     124     126     235     151     170
                                          MIR_4_RBP:       -       -       -      35      3      37      14      48      46      14       9      29      18      17
                                           MIR_5_FF:       -       -       -     108      1     119      34     129     128      41      22      63      29      67
                                            MIR_5_K:       -       -       -      23      -      21       5      30      29       7       3      23       6      14
                                           MIR_5_KL:       -       -       -       1      -       -       -       -       1       -       1       1       -       -
                                            MIR_5_R:       -       -       -      71      3      54      47      82      70      22      21      47      27      29
                                           MIR_5_RB:       -       -       -     176      6     144      80     168     181      65      61     138      72      92
                                          MIR_5_RBP:       -       -       -      21      1      17       3      33      38      10       4      15       6      19
                                           MIR_6_FF:       -       -       -      60      1      66      19      55      59      24       9      34      24      28
                                            MIR_6_K:       -       -       -      23      -      20       2      15      17       7       2      12       7       7
                                           MIR_6_KL:       -       -       -       -      -       -       1       -       -       -       -       -       -       -
                                            MIR_6_R:       -       -       -      44      1      26      20      33      30      10      14      30      16      15
                                           MIR_6_RB:       -       -       -     111      2      82      41      93     116      38      30      65      38      47
                                          MIR_6_RBP:       -       -       -      11      -      17       1      16      21       4       1      11       6       9
         NoOverlapCompletionTimeExhaustive_weighted:       -       -       -       -      -      25       -      29      30       6       -       -       6      17
  NoOverlapCompletionTimeExhaustive_weighted_lifted:       -       -       -       -      -       -       -       -       -       -       -       -       -       1
                        NoOverlapDisjunctionOnStart:       -       -       -       -      -      20       -      46      20       5       -       -       5      11
                                       ZERO_HALF_FF:       -       -       -     126     16     120      56     154     151      46      24      57      19      51
                                        ZERO_HALF_K:       -       -       -      30      2      50       6      36      35       6       7      21       7      15
                                        ZERO_HALF_R:       -       -       -     792     28   1'051   1'060     982   1'283     815   1'587     816  11'008   1'209
                                       ZERO_HALF_RB:       -       -       -     256     23     296     154     309     374     169     175     159     405     160
                                      ZERO_HALF_RBP:       -       -       -      48      5      52      34      77      79      24     185      52     124      31

LNS stats                        Improv/Calls  Closed  Difficulty  TimeLimit
               'graph_arc_lns':         2/190     52%        0.97       0.11
               'graph_cst_lns':         7/132     52%        0.97       0.10
               'graph_dec_lns':         0/190     53%        0.98       0.11
               'graph_var_lns':         3/190     51%        0.96       0.11
                   'rins/rens':        18/184     50%        0.74       0.10
                 'rnd_cst_lns':         3/182     53%        0.98       0.11
                 'rnd_var_lns':         1/190     54%        0.99       0.11
    'scheduling_intervals_lns':         4/190      1%        0.00       0.11
  'scheduling_precedences_lns':         4/190      2%        0.00       0.11
  'scheduling_time_window_lns':         4/190      1%        0.00       0.11

LS stats                   Batches  Restarts  LinMoves  GenMoves  CompoundMoves  WeightUpdates
       'fj_long_default':        1         1     9'710         0              0            290
   'fj_long_lin_default':        1         1         0     1'874            425              0
        'fj_long_random':        1         1     9'687         0              0            313
      'fj_short_default':        1         1         0     1'982            260              0
  'fj_short_lin_default':        1         1         0     2'012            359              1
   'fj_short_lin_random':        1         1         0     1'899            348              1
       'fj_short_random':        1         1         0     1'855            224              0
          'violation_ls':      191         0   884'401    20'680          1'182        969'659
          'violation_ls':      191         0   893'499     7'032            598        970'494

Solutions (47)            Num     Rank
                'no_lp':   26   [1,35]
  'quick_restart_no_lp':   17  [13,47]
         'violation_ls':    4  [29,34]

Objective bounds                     Num
                       'bool_core':    8
                      'default_lp':    1
                  'initial_domain':    1
                  'lb_tree_search':   14
             'objective_lb_search':    2
      'objective_lb_search_max_lp':    1
       'objective_lb_search_no_lp':  125
  'objective_shaving_search_no_lp':    3

Solution repositories    Added  Queried  Ignored  Synchro
  'feasible solutions':  1'806    4'331        5    1'689
        'lp solutions':  1'103       98        0      822
                'pump':  3'985       93

Improving bounds shared            Num
                        'core':      1
                  'default_lp':     58
              'lb_tree_search':     10
                      'max_lp':     18
                       'no_lp':    362
         'objective_lb_search':     16
  'objective_lb_search_max_lp':     10
                     'probing':    284
              'probing_max_lp':    194
                'pseudo_costs':    220
               'quick_restart':    234
         'quick_restart_no_lp':  1'376
               'reduced_costs':     28

Clauses shared                   Num
                  'default_lp':   15
              'lb_tree_search':    1
                      'max_lp':    6
                       'no_lp':   37
         'objective_lb_search':   62
  'objective_lb_search_max_lp':   28
   'objective_lb_search_no_lp':   14
                'pseudo_costs':   18
               'quick_restart':    2
         'quick_restart_no_lp':    6
               'reduced_costs':    4

CpSolverResponse summary:
status: OPTIMAL
objective: 1188
best_bound: 1188
integers: 190
booleans: 59
conflicts: 0
branches: 118
propagations: 6
integer_propagations: 2028
restarts: 118
lp_iterations: 52
walltime: 48.3532
usertime: 48.3532
deterministic_time: 604.205
gap_integral: 1427.98
solution_fingerprint: 0x697b6e8ffe6612e8


--- Simulation Gantt  partir du modle mathmatique ---
