created virtual environment CPython3.12.4.final.0-64 in 4457ms
  creator CPython3Posix(dest=/localscratch/aneumann.63447102.0/env, clear=False, no_vcs_ignore=False, global=False)
  seeder FromAppData(download=False, pip=bundle, via=copy, app_data_dir=/home/aneumann/.local/share/virtualenv)
    added seed packages: pip==25.1.1
  activators BashActivator,CShellActivator,FishActivator,NushellActivator,PowerShellActivator,PythonActivator
Looking in links: /cvmfs/soft.computecanada.ca/custom/python/wheelhouse/gentoo2023/x86-64-v3, /cvmfs/soft.computecanada.ca/custom/python/wheelhouse/gentoo2023/generic, /cvmfs/soft.computecanada.ca/custom/python/wheelhouse/generic
Requirement already satisfied: pip in /localscratch/aneumann.63447102.0/env/lib/python3.12/site-packages (25.1.1)
Looking in links: /cvmfs/soft.computecanada.ca/custom/python/wheelhouse/gentoo2023/x86-64-v3, /cvmfs/soft.computecanada.ca/custom/python/wheelhouse/gentoo2023/generic, /cvmfs/soft.computecanada.ca/custom/python/wheelhouse/generic
ERROR: protobuf-5.28.3-cp38-abi3-manylinux2014_x86_64.whl is not a supported wheel on this platform.
Looking in links: /cvmfs/soft.computecanada.ca/custom/python/wheelhouse/gentoo2023/x86-64-v3, /cvmfs/soft.computecanada.ca/custom/python/wheelhouse/gentoo2023/generic, /cvmfs/soft.computecanada.ca/custom/python/wheelhouse/generic
Processing /home/aneumann/projects/def-adhaj/aneumann/GNRS/wheels/immutabledict-4.2.0-py3-none-any.whl
Installing collected packages: immutabledict
Successfully installed immutabledict-4.2.0
Looking in links: /cvmfs/soft.computecanada.ca/custom/python/wheelhouse/gentoo2023/x86-64-v3, /cvmfs/soft.computecanada.ca/custom/python/wheelhouse/gentoo2023/generic, /cvmfs/soft.computecanada.ca/custom/python/wheelhouse/generic
Processing /cvmfs/soft.computecanada.ca/custom/python/wheelhouse/generic/ortools-9.10.4067+computecanada-cp312-cp312-linux_x86_64.whl (from -r /home/aneumann/projects/def-adhaj/aneumann/GNRS/requirements/or.txt (line 1))
Processing /cvmfs/soft.computecanada.ca/custom/python/wheelhouse/gentoo2023/x86-64-v3/matplotlib-3.10.0+computecanada-cp312-cp312-linux_x86_64.whl (from -r /home/aneumann/projects/def-adhaj/aneumann/GNRS/requirements/or.txt (line 2))
Processing /cvmfs/soft.computecanada.ca/custom/python/wheelhouse/gentoo2023/x86-64-v3/pandas-2.2.3+computecanada-cp312-cp312-linux_x86_64.whl (from -r /home/aneumann/projects/def-adhaj/aneumann/GNRS/requirements/or.txt (line 3))
Processing /cvmfs/soft.computecanada.ca/custom/python/wheelhouse/generic/absl_py-2.2.2+computecanada-py3-none-any.whl (from ortools<9.11,>=9.10->-r /home/aneumann/projects/def-adhaj/aneumann/GNRS/requirements/or.txt (line 1))
Processing /cvmfs/soft.computecanada.ca/custom/python/wheelhouse/gentoo2023/generic/numpy-2.2.2+computecanada-cp312-cp312-linux_x86_64.whl (from ortools<9.11,>=9.10->-r /home/aneumann/projects/def-adhaj/aneumann/GNRS/requirements/or.txt (line 1))
Processing /cvmfs/soft.computecanada.ca/custom/python/wheelhouse/gentoo2023/x86-64-v3/protobuf-6.30.2+computecanada-cp312-cp312-linux_x86_64.whl (from ortools<9.11,>=9.10->-r /home/aneumann/projects/def-adhaj/aneumann/GNRS/requirements/or.txt (line 1))
Requirement already satisfied: immutabledict>=3.0.0 in /localscratch/aneumann.63447102.0/env/lib/python3.12/site-packages (from ortools<9.11,>=9.10->-r /home/aneumann/projects/def-adhaj/aneumann/GNRS/requirements/or.txt (line 1)) (4.2.0)
Processing /cvmfs/soft.computecanada.ca/custom/python/wheelhouse/gentoo2023/generic/contourpy-1.3.1+computecanada-cp312-cp312-linux_x86_64.whl (from matplotlib->-r /home/aneumann/projects/def-adhaj/aneumann/GNRS/requirements/or.txt (line 2))
Processing /cvmfs/soft.computecanada.ca/custom/python/wheelhouse/generic/cycler-0.12.1+computecanada-py3-none-any.whl (from matplotlib->-r /home/aneumann/projects/def-adhaj/aneumann/GNRS/requirements/or.txt (line 2))
Processing /cvmfs/soft.computecanada.ca/custom/python/wheelhouse/generic/fonttools-4.58.2+computecanada-cp312-cp312-linux_x86_64.whl (from matplotlib->-r /home/aneumann/projects/def-adhaj/aneumann/GNRS/requirements/or.txt (line 2))
Processing /cvmfs/soft.computecanada.ca/custom/python/wheelhouse/gentoo2023/x86-64-v3/kiwisolver-1.4.8+computecanada-cp312-cp312-linux_x86_64.whl (from matplotlib->-r /home/aneumann/projects/def-adhaj/aneumann/GNRS/requirements/or.txt (line 2))
Processing /cvmfs/soft.computecanada.ca/custom/python/wheelhouse/generic/packaging-25.0+computecanada-py3-none-any.whl (from matplotlib->-r /home/aneumann/projects/def-adhaj/aneumann/GNRS/requirements/or.txt (line 2))
Processing /cvmfs/soft.computecanada.ca/custom/python/wheelhouse/gentoo2023/x86-64-v3/pillow-11.1.0+computecanada-cp312-cp312-linux_x86_64.whl (from matplotlib->-r /home/aneumann/projects/def-adhaj/aneumann/GNRS/requirements/or.txt (line 2))
Processing /cvmfs/soft.computecanada.ca/custom/python/wheelhouse/generic/pyparsing-3.2.1+computecanada-py3-none-any.whl (from matplotlib->-r /home/aneumann/projects/def-adhaj/aneumann/GNRS/requirements/or.txt (line 2))
Processing /cvmfs/soft.computecanada.ca/custom/python/wheelhouse/generic/python_dateutil-2.9.0.post0+computecanada-py2.py3-none-any.whl (from matplotlib->-r /home/aneumann/projects/def-adhaj/aneumann/GNRS/requirements/or.txt (line 2))
Processing /cvmfs/soft.computecanada.ca/custom/python/wheelhouse/generic/pytz-2025.2+computecanada-py2.py3-none-any.whl (from pandas->-r /home/aneumann/projects/def-adhaj/aneumann/GNRS/requirements/or.txt (line 3))
Processing /cvmfs/soft.computecanada.ca/custom/python/wheelhouse/generic/tzdata-2025.2+computecanada-py2.py3-none-any.whl (from pandas->-r /home/aneumann/projects/def-adhaj/aneumann/GNRS/requirements/or.txt (line 3))
Processing /cvmfs/soft.computecanada.ca/custom/python/wheelhouse/generic/six-1.17.0+computecanada-py2.py3-none-any.whl (from python-dateutil>=2.7->matplotlib->-r /home/aneumann/projects/def-adhaj/aneumann/GNRS/requirements/or.txt (line 2))
Installing collected packages: pytz, tzdata, six, pyparsing, protobuf, pillow, packaging, numpy, kiwisolver, fonttools, cycler, absl-py, python-dateutil, contourpy, pandas, matplotlib, ortools

Successfully installed absl-py-2.2.2+computecanada contourpy-1.3.1+computecanada cycler-0.12.1+computecanada fonttools-4.58.2+computecanada kiwisolver-1.4.8+computecanada matplotlib-3.10.0+computecanada numpy-2.2.2+computecanada ortools-9.10.4067+computecanada packaging-25.0+computecanada pandas-2.2.3+computecanada pillow-11.1.0+computecanada protobuf-6.30.2+computecanada pyparsing-3.2.1+computecanada python-dateutil-2.9.0.post0+computecanada pytz-2025.2+computecanada six-1.17.0+computecanada tzdata-2025.2+computecanada

Starting CP-SAT solver v9.10.4067
Parameters: max_time_in_seconds: 3600 max_memory_in_mb: 12000 log_search_progress: true enumerate_all_solutions: false absolute_gap_limit: 0 relative_gap_limit: 0
Setting number of workers to 32

Initial optimization model '': (model_fingerprint: 0x43faaf212f0ac291)
#Variables: 1'594 (#ints: 21 in objective)
  - 1'341 Booleans in [0,1]
  - 253 in [0,1666]
#kLinear1: 119
#kLinear2: 4'408
#kLinear3: 1'226
#kLinearN: 63'310 (#terms: 2'207'961)

Starting presolve at 0.05s
  1.31e-01s  0.00e+00d  [DetectDominanceRelations] 
  2.27e+00s  0.00e+00d  [PresolveToFixPoint] #num_loops=6 #num_dual_strengthening=3 
  5.92e-04s  0.00e+00d  [ExtractEncodingFromLinear] #potential_supersets=9 
[Symmetry] Graph for symmetry has 67'782 nodes and 1'977'503 arcs.
[Symmetry] Symmetry computation done. time: 0.112134 dtime: 0.163436
[Symmetry] #generators: 1, average support size: 58
[Symmetry] The model contains 2850 duplicate constraints !
[Symmetry] 29 orbits with sizes: 2,2,2,2,2,2,2,2,2,2,...
[Symmetry] Num fixable by intersecting at_most_one with orbits: 1 largest_orbit: 2
  1.33e+00s  2.31e-01d  [Probe] #probed=2'328 #fixed_bools=13 #new_bounds=47 #equiv=1 
  5.36e-04s  0.00e+00d  [MaxClique] Merged 11(22 literals) into 8(16 literals) at_most_ones. 
  1.26e-01s  0.00e+00d  [DetectDominanceRelations] 
  1.21e+00s  0.00e+00d  [PresolveToFixPoint] #num_loops=4 #num_dual_strengthening=3 
  4.34e-01s  0.00e+00d  [ProcessAtMostOneAndLinear] 
  1.11e-01s  0.00e+00d  [DetectDuplicateConstraints] #duplicates=3'373 #without_enforcements=272 
  3.28e-01s  1.70e-02d  [DetectDominatedLinearConstraints] #relevant_constraints=59'278 #num_inclusions=11'774 #num_redundant=7 
  1.26e-02s  0.00e+00d  [DetectDifferentVariables] #different=199 
  4.23e-02s  3.58e-03d  [ProcessSetPPC] #relevant_constraints=57'447 
  1.00e-03s  0.00e+00d  [FindAlmostIdenticalLinearConstraints] 
  1.63e-02s  1.45e-02d  [FindBigAtMostOneAndLinearOverlap] 
  1.37e+00s  4.83e-01d  [FindBigVerticalLinearOverlap] #blocks=757 #saved_nz=540'740 
  1.74e-02s  6.76e-03d  [FindBigHorizontalLinearOverlap] #linears=56'836 
  5.46e-04s  0.00e+00d  [MergeClauses] 
  1.28e-01s  0.00e+00d  [DetectDominanceRelations] 
  1.01e+00s  0.00e+00d  [PresolveToFixPoint] #num_loops=3 #num_dual_strengthening=1 
  1.28e-01s  0.00e+00d  [DetectDominanceRelations] 
  6.01e-01s  0.00e+00d  [PresolveToFixPoint] #num_loops=1 #num_dual_strengthening=1 
[Symmetry] Graph for symmetry has 66'604 nodes and 1'426'396 arcs.
[Symmetry] Symmetry computation done. time: 0.0513626 dtime: 0.0803757
  1.02e+00s  1.60e-01d  [Probe] #probed=2'302 #new_bounds=700 
  4.58e-04s  0.00e+00d  [MaxClique] 
  1.26e-01s  0.00e+00d  [DetectDominanceRelations] 
  1.14e+00s  0.00e+00d  [PresolveToFixPoint] #num_loops=5 #num_dual_strengthening=3 
  3.98e-01s  0.00e+00d  [ProcessAtMostOneAndLinear] 
  9.59e-02s  0.00e+00d  [DetectDuplicateConstraints] #without_enforcements=272 
  2.11e-01s  1.24e-02d  [DetectDominatedLinearConstraints] #relevant_constraints=59'271 #num_inclusions=816 
  1.19e-02s  0.00e+00d  [DetectDifferentVariables] #different=225 #cliques=5 #size=15 
  3.71e-02s  2.48e-03d  [ProcessSetPPC] #relevant_constraints=56'848 
  1.11e-03s  6.26e-06d  [FindAlmostIdenticalLinearConstraints] #num_tested_pairs=367 
  5.89e-03s  4.54e-03d  [FindBigAtMostOneAndLinearOverlap] 
  6.27e-01s  2.39e-01d  [FindBigVerticalLinearOverlap] #blocks=3'533 #saved_nz=578'428 
  1.39e-02s  3.66e-03d  [FindBigHorizontalLinearOverlap] #linears=47'796 
  5.89e-04s  0.00e+00d  [MergeClauses] 
  7.81e-02s  0.00e+00d  [DetectDominanceRelations] 
  9.11e-01s  0.00e+00d  [PresolveToFixPoint] #num_loops=3 #num_dual_strengthening=1 
  7.88e-02s  0.00e+00d  [DetectDominanceRelations] 
  5.70e-01s  0.00e+00d  [PresolveToFixPoint] #num_loops=1 #num_dual_strengthening=1 
  7.79e-01s  1.05e-01d  [Probe] #probed=2'302 #new_bounds=1'769 
  5.09e-04s  0.00e+00d  [MaxClique] 
  7.54e-02s  0.00e+00d  [DetectDominanceRelations] 
  8.09e-01s  0.00e+00d  [PresolveToFixPoint] #num_loops=2 #num_dual_strengthening=1 
  3.31e-01s  0.00e+00d  [ProcessAtMostOneAndLinear] 
  8.35e-02s  0.00e+00d  [DetectDuplicateConstraints] #without_enforcements=272 
  1.16e-01s  6.32e-03d  [DetectDominatedLinearConstraints] #relevant_constraints=61'459 #num_inclusions=190 
  1.05e-02s  0.00e+00d  [DetectDifferentVariables] 
  2.38e-02s  1.28e-03d  [ProcessSetPPC] #relevant_constraints=48'175 
  2.48e-03s  2.64e-04d  [FindAlmostIdenticalLinearConstraints] #num_tested_pairs=10'976 
  4.07e-03s  2.70e-03d  [FindBigAtMostOneAndLinearOverlap] 
  3.32e-01s  1.01e-01d  [FindBigVerticalLinearOverlap] #blocks=2'746 #saved_nz=291'958 
  1.12e-02s  1.99e-03d  [FindBigHorizontalLinearOverlap] #linears=37'196 
  6.22e-04s  0.00e+00d  [MergeClauses] 
  5.91e-02s  0.00e+00d  [DetectDominanceRelations] 
  8.60e-01s  0.00e+00d  [PresolveToFixPoint] #num_loops=3 #num_dual_strengthening=1 
  5.05e-03s  0.00e+00d  [ExpandObjective] #entries=37'073 #tight_variables=9'908 #tight_constraints=5'135 

Presolve summary:
  - 545 affine relations were detected.
  - rule 'TODO dual: only one blocking constraint?' was applied 4'348 times.
  - rule 'TODO dual: only one unspecified blocking constraint?' was applied 315 times.
  - rule 'TODO duplicate: identical constraint with different enforcements' was applied 816 times.
  - rule 'TODO no_overlap: with task always last' was applied 5 times.
  - rule 'affine: new relation' was applied 545 times.
  - rule 'all_diff: inferred from x != y constraints' was applied 5 times.
  - rule 'at_most_one: removed literals' was applied 8 times.
  - rule 'at_most_one: size one' was applied 8 times.
  - rule 'at_most_one: transformed into max clique.' was applied 1 time.
  - rule 'deductions: 6260 stored' was applied 1 time.
  - rule 'dual: fix variable' was applied 60 times.
  - rule 'dual: reduced domain' was applied 205 times.
  - rule 'duplicate: merged rhs of linear constraint' was applied 537 times.
  - rule 'duplicate: removed constraint' was applied 3'373 times.
  - rule 'enforcement: false literal' was applied 81 times.
  - rule 'enforcement: true literal' was applied 58 times.
  - rule 'exactly_one: x and not(x)' was applied 1 time.
  - rule 'incompatible linear: add implication' was applied 408 times.
  - rule 'linear inclusion: redundant containing constraint' was applied 7 times.
  - rule 'linear matrix: common vertical rectangle' was applied 7'036 times.
  - rule 'linear: always true' was applied 4'064 times.
  - rule 'linear: doubleton free' was applied 33 times.
  - rule 'linear: empty' was applied 88 times.
  - rule 'linear: extracted enforcement literal' was applied 63'213 times.
  - rule 'linear: fixed or dup variables' was applied 64'582 times.
  - rule 'linear: positive equal one' was applied 9 times.
  - rule 'linear: reduced variable domains' was applied 3'896 times.
  - rule 'linear: remapped using affine relations' was applied 64'308 times.
  - rule 'linear: simplified rhs' was applied 266'730 times.
  - rule 'linear: variable substitution 1' was applied 33 times.
  - rule 'linear: variable substitution 2' was applied 1'113 times.
  - rule 'linear: variable substitution 3' was applied 568 times.
  - rule 'presolve: 256 unused variables removed.' was applied 1 time.
  - rule 'presolve: iteration' was applied 3 times.
  - rule 'probing: reduced enforced constraint to implication.' was applied 11 times.
  - rule 'symmetry: fixed to false in general orbit' was applied 1 time.

Presolved optimization model '': (model_fingerprint: 0x625a77481839cf6f)
#Variables: 6'115 (#ints: 21 in objective)
  - 573 Booleans in [0,1]
  - 4'234 different domains in [-48243,49843] with a largest complexity of 33.
#kAllDiff: 5
#kExactlyOne: 8 (#literals: 24)
#kLinear2: 3'734 (#enforced: 3'541 #multi: 1'465)
#kLinear3: 17'301 (#enforced: 14'346)
#kLinearN: 45'173 (#enforced: 42'241) (#terms: 431'552)

Preloading model.
#Bound  18.22s best:inf   next:[200,31011] initial_domain
#Model  18.34s var:6115/6115 constraints:66221/66221

Starting search at 18.39s with 32 workers.
16 full problem subsolvers: [core, default_lp, lb_tree_search, max_lp, no_lp, objective_lb_search, objective_lb_search_max_lp, objective_lb_search_no_lp, objective_shaving_search_max_lp, objective_shaving_search_no_lp, probing, probing_max_lp, pseudo_costs, quick_restart, quick_restart_no_lp, reduced_costs]
14 first solution subsolvers: [fj_long_default, fj_long_lin_default, fj_long_random, fj_short_default, fj_short_lin_default, fj_short_lin_random, fj_short_random, fs_random(2), fs_random_no_lp(2), fs_random_quick_restart(2), fs_random_quick_restart_no_lp]
11 incomplete subsolvers: [feasibility_pump, graph_arc_lns, graph_cst_lns, graph_dec_lns, graph_var_lns, rins/rens, rnd_cst_lns, rnd_var_lns, violation_ls(3)]
3 helper subsolvers: [neighborhood_helper, synchronization_agent, update_gap_integral]
#Bound  20.01s best:inf   next:[201,31011] objective_shaving_search_max_lp (vars=6115 csts=66234)
#Bound  20.07s best:inf   next:[305,31011] objective_lb_search_no_lp
#1      20.84s best:11835 next:[305,11834] fs_random_quick_restart_no_lp (fixed_bools=0/646)
#Bound  21.08s best:11835 next:[328,11834] objective_lb_search_no_lp
#2      21.37s best:11834 next:[328,11833] violation_ls(batch:2 #solutions_imported:1 #lin_moves:0 #lin_evals:27'991 #gen_moves:7'349 #gen_evals:897 #comp_moves:873 #backtracks:3'238 #weight_updates:67)
#3      21.40s best:11833 next:[328,11832] violation_ls(batch:3 #solutions_imported:2 #lin_moves:1'195 #lin_evals:32'438 #gen_moves:7'349 #gen_evals:897 #comp_moves:873 #backtracks:3'238 #weight_updates:191)
#4      21.74s best:11640 next:[328,11639] graph_var_lns (d=0.50 s=99 t=0.10 p=0.00 stall=0 h=auto_l0)
#5      22.03s best:11639 next:[328,11638] violation_ls(batch:6 #solutions_imported:4 #lin_moves:47'955 #lin_evals:192'039 #gen_moves:5'104 #gen_evals:650 #comp_moves:1'140 #backtracks:1'982 #weight_updates:2'109)
#6      22.11s best:11638 next:[328,11637] violation_ls(batch:7 #solutions_imported:4 #lin_moves:15'686 #lin_evals:177'203 #gen_moves:25'300 #gen_evals:3'520 #comp_moves:5'089 #backtracks:10'100 #weight_updates:4'225)
#7      22.20s best:11637 next:[328,11636] violation_ls(batch:7 #solutions_imported:5 #lin_moves:5'592 #lin_evals:127'647 #gen_moves:29'280 #gen_evals:3'748 #comp_moves:1'984 #backtracks:13'643 #weight_updates:705)
#8      22.45s best:11636 next:[328,11635] violation_ls(batch:8 #solutions_imported:6 #lin_moves:47'955 #lin_evals:206'083 #gen_moves:8'604 #gen_evals:1'161 #comp_moves:1'570 #backtracks:3'517 #weight_updates:2'158)
#9      22.47s best:11635 next:[328,11634] violation_ls(batch:8 #solutions_imported:6 #lin_moves:5'592 #lin_evals:127'877 #gen_moves:29'354 #gen_evals:3'752 #comp_moves:1'986 #backtracks:13'679 #weight_updates:705)
#10     22.90s best:11634 next:[328,11633] violation_ls(batch:9 #solutions_imported:7 #lin_moves:48'750 #lin_evals:209'857 #gen_moves:8'604 #gen_evals:1'161 #comp_moves:1'570 #backtracks:3'517 #weight_updates:2'401)
#11     22.91s best:11633 next:[328,11632] violation_ls(batch:9 #solutions_imported:7 #lin_moves:5'592 #lin_evals:127'939 #gen_moves:29'376 #gen_evals:3'756 #comp_moves:1'988 #backtracks:13'689 #weight_updates:705)
#12     23.63s best:11632 next:[328,11631] violation_ls(batch:10 #solutions_imported:8 #lin_moves:49'871 #lin_evals:214'945 #gen_moves:8'604 #gen_evals:1'161 #comp_moves:1'570 #backtracks:3'517 #weight_updates:2'593)
#13     23.64s best:11631 next:[328,11630] violation_ls(batch:10 #solutions_imported:8 #lin_moves:5'592 #lin_evals:127'956 #gen_moves:29'386 #gen_evals:3'756 #comp_moves:1'990 #backtracks:13'693 #weight_updates:705)
#14     24.07s best:11630 next:[328,11629] graph_arc_lns (d=0.94 s=176 t=0.10 p=1.00 stall=5 h=auto_l0) [hint]
#15     24.15s best:11629 next:[328,11628] violation_ls(batch:11 #solutions_imported:8 #lin_moves:25'822 #lin_evals:281'234 #gen_moves:40'208 #gen_evals:5'215 #comp_moves:5'978 #backtracks:17'106 #weight_updates:4'654)
#16     24.17s best:11628 next:[328,11627] violation_ls(batch:11 #solutions_imported:9 #lin_moves:50'124 #lin_evals:216'131 #gen_moves:8'604 #gen_evals:1'161 #comp_moves:1'570 #backtracks:3'517 #weight_updates:2'656)
#17     24.32s best:11627 next:[328,11626] violation_ls(batch:11 #solutions_imported:9 #lin_moves:5'592 #lin_evals:144'284 #gen_moves:33'754 #gen_evals:4'223 #comp_moves:2'490 #backtracks:15'627 #weight_updates:766)
#18     24.36s best:10724 next:[328,10723] rins_lp_lns (d=0.91 s=168 t=0.10 p=1.00 stall=4 h=auto_l0)
#19     24.85s best:10312 next:[328,10311] rins_lp_lns (d=0.91 s=179 t=0.10 p=1.00 stall=4 h=auto_l0)
#20     26.16s best:10311 next:[328,10310] violation_ls(batch:13 #solutions_imported:10 #lin_moves:21'684 #lin_evals:190'590 #gen_moves:33'754 #gen_evals:4'223 #comp_moves:2'490 #backtracks:15'627 #weight_updates:1'173)
#21     26.69s best:10310 next:[328,10309] violation_ls(batch:14 #solutions_imported:10 #lin_moves:42'129 #lin_evals:350'810 #gen_moves:40'208 #gen_evals:5'215 #comp_moves:5'978 #backtracks:17'106 #weight_updates:8'374)
#22     26.71s best:10309 next:[328,10308] violation_ls(batch:14 #solutions_imported:11 #lin_moves:50'124 #lin_evals:272'415 #gen_moves:22'376 #gen_evals:2'734 #comp_moves:3'450 #backtracks:9'463 #weight_updates:2'780)
#23     26.74s best:10308 next:[328,10307] violation_ls(batch:14 #solutions_imported:11 #lin_moves:21'684 #lin_evals:190'594 #gen_moves:33'756 #gen_evals:4'223 #comp_moves:2'492 #backtracks:15'627 #weight_updates:1'173)
#24     27.20s best:10248 next:[328,10247] graph_var_lns (d=0.99 s=219 t=0.10 p=1.00 stall=3 h=auto_l0)
#25     28.30s best:10246 next:[328,10245] violation_ls(batch:15 #solutions_imported:11 #lin_moves:42'130 #lin_evals:350'831 #gen_moves:40'208 #gen_evals:5'215 #comp_moves:5'978 #backtracks:17'106 #weight_updates:8'374)
#26     28.31s best:10244 next:[328,10243] violation_ls(batch:15 #solutions_imported:12 #lin_moves:50'125 #lin_evals:272'435 #gen_moves:22'376 #gen_evals:2'734 #comp_moves:3'450 #backtracks:9'463 #weight_updates:2'780)
#27     28.33s best:10242 next:[328,10241] violation_ls(batch:15 #solutions_imported:12 #lin_moves:21'684 #lin_evals:190'748 #gen_moves:33'805 #gen_evals:4'228 #comp_moves:2'493 #backtracks:15'651 #weight_updates:1'173)
#28     28.42s best:10239 next:[328,10238] rins_lp_lns (d=0.83 s=244 t=0.10 p=0.60 stall=1 h=auto_l0)
#29     29.31s best:10237 next:[328,10236] violation_ls(batch:16 #solutions_imported:12 #lin_moves:42'130 #lin_evals:350'855 #gen_moves:40'221 #gen_evals:5'215 #comp_moves:5'979 #backtracks:17'112 #weight_updates:8'374)
#30     29.32s best:10235 next:[328,10234] violation_ls(batch:16 #solutions_imported:13 #lin_moves:50'125 #lin_evals:272'477 #gen_moves:22'391 #gen_evals:2'734 #comp_moves:3'451 #backtracks:9'470 #weight_updates:2'780)
#31     29.34s best:10233 next:[328,10232] violation_ls(batch:16 #solutions_imported:13 #lin_moves:21'684 #lin_evals:190'956 #gen_moves:33'870 #gen_evals:4'233 #comp_moves:2'494 #backtracks:15'683 #weight_updates:1'173)
#32     30.01s best:10104 next:[328,10103] graph_cst_lns (d=0.99 s=242 t=0.10 p=1.00 stall=10 h=auto_l0) [hint]
#33     30.61s best:9959  next:[328,9958] graph_var_lns (d=0.99 s=240 t=0.10 p=1.00 stall=0 h=auto_l0)
#34     30.77s best:9847  next:[328,9846] rins_lp_lns (d=0.87 s=265 t=0.10 p=0.64 stall=0 h=auto_l0)
#35     30.81s best:9846  next:[328,9845] violation_ls(batch:17 #solutions_imported:13 #lin_moves:42'612 #lin_evals:352'976 #gen_moves:40'221 #gen_evals:5'215 #comp_moves:5'979 #backtracks:17'112 #weight_updates:8'473)
#36     30.98s best:9845  next:[328,9844] violation_ls(batch:17 #solutions_imported:14 #lin_moves:30'649 #lin_evals:217'906 #gen_moves:33'870 #gen_evals:4'233 #comp_moves:2'494 #backtracks:15'683 #weight_updates:1'580)
#37     32.90s best:9245  next:[328,9244] rins_lp_lns (d=0.90 s=276 t=0.10 p=0.67 stall=0 h=auto_l0)
#Bound  33.50s best:9245  next:[329,9244] objective_shaving_search_no_lp (vars=7190 csts=66817)
#Bound  37.09s best:9245  next:[594,9244] objective_lb_search
#38     37.24s best:9237  next:[594,9236] rnd_cst_lns (d=1.00 s=281 t=0.10 p=1.00 stall=0 h=auto_l0)
#39     38.02s best:9171  next:[594,9170] graph_dec_lns (d=1.00 s=285 t=0.10 p=1.00 stall=0 h=auto_l0)
#40     39.06s best:9165  next:[594,9164] rins_lp_lns (d=0.87 s=310 t=0.10 p=0.60 stall=0 h=auto_l0)
#41     41.56s best:9129  next:[594,9128] graph_arc_lns (d=1.00 s=295 t=0.10 p=1.00 stall=0 h=auto_l0)
#42     41.77s best:8927  next:[594,8926] rnd_cst_lns (d=1.00 s=293 t=0.10 p=1.00 stall=0 h=auto_l0)
#43     43.10s best:8926  next:[594,8925] violation_ls(batch:22 #solutions_imported:17 #lin_moves:43'832 #lin_evals:461'509 #gen_moves:69'458 #gen_evals:8'000 #comp_moves:8'189 #backtracks:30'621 #weight_updates:9'067)
#44     43.11s best:8925  next:[594,8924] violation_ls(batch:22 #solutions_imported:17 #lin_moves:83'285 #lin_evals:434'293 #gen_moves:30'276 #gen_evals:3'548 #comp_moves:3'962 #backtracks:13'155 #weight_updates:9'692)
#45     43.13s best:8924  next:[594,8923] violation_ls(batch:22 #solutions_imported:17 #lin_moves:60'402 #lin_evals:376'241 #gen_moves:41'123 #gen_evals:5'147 #comp_moves:3'122 #backtracks:18'993 #weight_updates:1'992)
#46     44.20s best:8735  next:[594,8734] rins_pump_lns (d=0.90 s=320 t=0.10 p=0.62 stall=0 h=auto_l0)
#47     51.77s best:8634  next:[594,8633] graph_var_lns (d=1.00 s=326 t=0.10 p=0.89 stall=0 h=auto_l0)
#48     52.17s best:8628  next:[594,8627] graph_var_lns (d=0.99 s=336 t=0.10 p=0.81 stall=0 h=auto_l0)
#Bound  52.59s best:8628  next:[598,8627] objective_lb_search_max_lp
#49     53.66s best:8569  next:[598,8568] rins_lp_lns (d=0.87 s=351 t=0.10 p=0.58 stall=2 h=auto_l0)
#50     57.83s best:8433  next:[598,8432] graph_var_lns (d=0.99 s=346 t=0.10 p=0.82 stall=0 h=auto_l0)
#Bound  57.91s best:8433  next:[692,8432] objective_lb_search_max_lp
#51     59.01s best:8429  next:[692,8428] rins_lp_lns (d=0.87 s=374 t=0.10 p=0.57 stall=1 h=auto_l0)
#52     59.21s best:8428  next:[692,8427] violation_ls(batch:27 #solutions_imported:20 #lin_moves:84'057 #lin_evals:553'454 #gen_moves:64'605 #gen_evals:6'574 #comp_moves:5'081 #backtracks:29'753 #weight_updates:10'226)
#53     59.23s best:8427  next:[692,8426] violation_ls(batch:27 #solutions_imported:20 #lin_moves:76'095 #lin_evals:505'404 #gen_moves:56'235 #gen_evals:6'384 #comp_moves:5'577 #backtracks:25'319 #weight_updates:7'168)
#54     61.98s best:8235  next:[692,8234] rins_lp_lns (d=0.90 s=384 t=0.10 p=0.59 stall=0 h=auto_l0)
#55     68.69s best:8178  next:[692,8177] graph_var_lns (d=1.00 s=390 t=0.10 p=0.81 stall=0 h=auto_l0)
#Bound  70.44s best:8178  next:[706,8177] objective_lb_search_max_lp
#56     71.91s best:8082  next:[706,8081] rins_lp_lns (d=0.91 s=414 t=0.10 p=0.60 stall=2 h=auto_l0)
#Bound  72.70s best:8082  next:[840,8081] objective_lb_search_no_lp
#57     81.47s best:8024  next:[840,8023] graph_var_lns (d=0.99 s=434 t=0.10 p=0.73 stall=0 h=auto_l0)
#Bound  93.38s best:8024  next:[847,8023] objective_lb_search_max_lp
#58     95.81s best:7993  next:[847,7992] rnd_cst_lns (d=1.00 s=483 t=0.10 p=0.74 stall=0 h=auto_l0)
#59    112.88s best:7979  next:[847,7978] rins_lp_lns (d=0.91 s=550 t=0.10 p=0.57 stall=3 h=auto_l0)
#60    118.39s best:7973  next:[847,7972] rnd_cst_lns (d=1.00 s=555 t=0.10 p=0.68 stall=1 h=auto_l0)
#61    118.85s best:7971  next:[847,7970] violation_ls(batch:46 #solutions_imported:27 #lin_moves:71'863 #lin_evals:1'051'162 #gen_moves:178'649 #gen_evals:22'218 #comp_moves:24'851 #backtracks:76'833 #weight_updates:11'781)
#62    118.86s best:7970  next:[847,7969] violation_ls(batch:46 #solutions_imported:27 #lin_moves:116'742 #lin_evals:1'076'997 #gen_moves:157'458 #gen_evals:14'209 #comp_moves:24'605 #backtracks:66'398 #weight_updates:18'235)
#63    123.10s best:7931  next:[847,7930] rnd_var_lns (d=1.00 s=564 t=0.10 p=0.69 stall=0 h=auto_l0)
#64    126.81s best:7930  next:[847,7929] violation_ls(batch:48 #solutions_imported:29 #lin_moves:117'812 #lin_evals:1'110'553 #gen_moves:166'196 #gen_evals:14'949 #comp_moves:24'910 #backtracks:70'613 #weight_updates:18'806)
#65    126.89s best:7929  next:[847,7928] violation_ls(batch:48 #solutions_imported:28 #lin_moves:181'581 #lin_evals:1'119'949 #gen_moves:90'571 #gen_evals:11'417 #comp_moves:11'016 #backtracks:39'764 #weight_updates:38'605)
#66    128.51s best:7901  next:[847,7900] rins_lp_lns (d=0.90 s=600 t=0.10 p=0.55 stall=4 h=auto_l0)
#Bound 130.84s best:7901  next:[882,7900] objective_lb_search_max_lp
#67    133.14s best:7892  next:[882,7891] rins_lp_lns (d=0.91 s=612 t=0.10 p=0.56 stall=0 h=auto_l0)
#68    141.85s best:7883  next:[882,7882] graph_arc_lns (d=0.99 s=629 t=0.10 p=0.63 stall=0 h=auto_l0)
#69    150.83s best:7828  next:[882,7827] graph_arc_lns (d=1.00 s=649 t=0.10 p=0.65 stall=0 h=auto_l0)
#70    152.93s best:7674  next:[882,7673] rins_lp_lns (d=0.90 s=682 t=0.10 p=0.54 stall=0 h=auto_l0)
#71    175.50s best:7572  next:[882,7571] graph_arc_lns (d=1.00 s=729 t=0.10 p=0.64 stall=0 h=auto_l0)
#72    176.51s best:7571  next:[882,7570] violation_ls(batch:64 #solutions_imported:33 #lin_moves:231'244 #lin_evals:1'566'199 #gen_moves:144'948 #gen_evals:16'259 #comp_moves:21'525 #backtracks:61'683 #weight_updates:51'030)
#73    179.46s best:7570  next:[882,7569] violation_ls(batch:65 #solutions_imported:36 #lin_moves:189'392 #lin_evals:1'642'459 #gen_moves:202'094 #gen_evals:24'665 #comp_moves:26'670 #backtracks:87'641 #weight_updates:44'517)
#74    179.50s best:7537  next:[882,7536] rins_lp_lns (d=0.91 s=762 t=0.10 p=0.55 stall=0 h=auto_l0)
#75    181.85s best:7536  next:[882,7535] violation_ls(batch:66 #solutions_imported:36 #lin_moves:234'382 #lin_evals:1'775'382 #gen_moves:199'108 #gen_evals:17'461 #comp_moves:36'472 #backtracks:81'284 #weight_updates:20'441)
#76    185.92s best:7535  next:[882,7534] violation_ls(batch:67 #solutions_imported:38 #lin_moves:189'392 #lin_evals:1'671'199 #gen_moves:210'148 #gen_evals:25'475 #comp_moves:27'137 #backtracks:91'434 #weight_updates:44'585)
#77    186.16s best:7534  next:[882,7533] violation_ls(batch:67 #solutions_imported:36 #lin_moves:242'314 #lin_evals:1'633'438 #gen_moves:144'948 #gen_evals:16'259 #comp_moves:21'525 #backtracks:61'683 #weight_updates:51'822)
#78    188.74s best:7512  next:[882,7511] rins_lp_lns (d=0.92 s=782 t=0.10 p=0.55 stall=0 h=auto_l0)
#79    189.12s best:7439  next:[882,7438] graph_arc_lns (d=1.00 s=779 t=0.10 p=0.62 stall=0 h=auto_l0)
#80    189.14s best:7438  next:[882,7437] violation_ls(batch:68 #solutions_imported:37 #lin_moves:242'314 #lin_evals:1'633'472 #gen_moves:144'957 #gen_evals:16'259 #comp_moves:21'528 #backtracks:61'686 #weight_updates:51'822)
#81    192.70s best:7437  next:[882,7436] violation_ls(batch:69 #solutions_imported:40 #lin_moves:199'167 #lin_evals:1'705'029 #gen_moves:210'148 #gen_evals:25'475 #comp_moves:27'137 #backtracks:91'434 #weight_updates:44'821)
#82    192.71s best:7436  next:[882,7435] violation_ls(batch:69 #solutions_imported:39 #lin_moves:234'431 #lin_evals:1'832'191 #gen_moves:215'517 #gen_evals:19'102 #comp_moves:36'911 #backtracks:89'267 #weight_updates:20'687)
#83    192.72s best:7435  next:[882,7434] violation_ls(batch:69 #solutions_imported:38 #lin_moves:242'363 #lin_evals:1'633'741 #gen_moves:144'957 #gen_evals:16'259 #comp_moves:21'528 #backtracks:61'686 #weight_updates:51'847)
#84    204.53s best:7416  next:[882,7415] rnd_var_lns (d=1.00 s=816 t=0.10 p=0.61 stall=0 h=auto_l0)
#85    207.79s best:7415  next:[882,7414] violation_ls(batch:73 #solutions_imported:41 #lin_moves:240'381 #lin_evals:1'948'440 #gen_moves:239'509 #gen_evals:21'147 #comp_moves:38'151 #backtracks:100'640 #weight_updates:22'193)
#86    207.85s best:7414  next:[882,7413] violation_ls(batch:73 #solutions_imported:40 #lin_moves:247'698 #lin_evals:1'739'087 #gen_moves:168'304 #gen_evals:18'620 #comp_moves:22'446 #backtracks:72'899 #weight_updates:52'403)
#87    210.36s best:7413  next:[882,7412] violation_ls(batch:74 #solutions_imported:43 #lin_moves:221'737 #lin_evals:1'832'328 #gen_moves:217'560 #gen_evals:26'017 #comp_moves:28'776 #backtracks:94'317 #weight_updates:52'496)
#88    210.44s best:7412  next:[882,7411] violation_ls(batch:74 #solutions_imported:42 #lin_moves:247'115 #lin_evals:1'976'192 #gen_moves:239'509 #gen_evals:21'147 #comp_moves:38'151 #backtracks:100'640 #weight_updates:23'481)
#89    212.25s best:7405  next:[882,7404] graph_arc_lns (d=1.00 s=839 t=0.10 p=0.62 stall=0 h=auto_l0)
#Bound 212.45s best:7405  next:[890,7404] objective_lb_search
#90    214.49s best:7404  next:[890,7403] violation_ls(batch:75 #solutions_imported:44 #lin_moves:222'426 #lin_evals:1'835'518 #gen_moves:217'560 #gen_evals:26'017 #comp_moves:28'776 #backtracks:94'317 #weight_updates:52'650)
#91    214.50s best:7403  next:[890,7402] violation_ls(batch:75 #solutions_imported:43 #lin_moves:247'116 #lin_evals:1'976'211 #gen_moves:239'509 #gen_evals:21'147 #comp_moves:38'151 #backtracks:100'640 #weight_updates:23'481)
#92    214.51s best:7402  next:[890,7401] violation_ls(batch:75 #solutions_imported:42 #lin_moves:247'842 #lin_evals:1'767'632 #gen_moves:176'704 #gen_evals:19'456 #comp_moves:22'757 #backtracks:76'942 #weight_updates:52'551)
#93    214.57s best:7395  next:[890,7394] graph_var_lns (d=1.00 s=848 t=0.10 p=0.60 stall=0 h=auto_l0)
#94    218.19s best:7390  next:[890,7389] graph_arc_lns (d=1.00 s=859 t=0.10 p=0.62 stall=0 h=auto_l0)
#95    218.62s best:7387  next:[890,7386] graph_var_lns (d=0.99 s=870 t=0.10 p=0.58 stall=0 h=auto_l0)
#96    221.85s best:7386  next:[890,7385] graph_dec_lns (d=1.00 s=873 t=0.10 p=0.60 stall=0 h=auto_l0)
#97    223.19s best:7385  next:[890,7384] violation_ls(batch:78 #solutions_imported:47 #lin_moves:233'108 #lin_evals:1'899'897 #gen_moves:226'123 #gen_evals:26'765 #comp_moves:29'224 #backtracks:98'373 #weight_updates:53'197)
#98    223.20s best:7384  next:[890,7383] violation_ls(batch:78 #solutions_imported:46 #lin_moves:256'827 #lin_evals:2'047'179 #gen_moves:247'961 #gen_evals:21'982 #comp_moves:38'484 #backtracks:104'698 #weight_updates:23'872)
#99    223.33s best:7383  next:[890,7382] violation_ls(batch:78 #solutions_imported:45 #lin_moves:257'445 #lin_evals:1'840'036 #gen_moves:189'075 #gen_evals:20'802 #comp_moves:23'501 #backtracks:82'753 #weight_updates:53'103)
#100   225.62s best:7378  next:[890,7377] graph_dec_lns (d=1.00 s=883 t=0.10 p=0.61 stall=0 h=auto_l0)
#101   227.18s best:7342  next:[890,7341] rins_lp_lns (d=0.90 s=904 t=0.10 p=0.53 stall=1 h=auto_l0)
#Bound 242.29s best:7342  next:[920,7341] objective_lb_search_max_lp
#102   265.26s best:7292  next:[920,7291] graph_var_lns (d=0.99 s=1012 t=0.10 p=0.57 stall=2 h=auto_l0)
#103   265.32s best:7291  next:[920,7290] violation_ls(batch:91 #solutions_imported:50 #lin_moves:343'233 #lin_evals:2'355'757 #gen_moves:234'932 #gen_evals:27'428 #comp_moves:29'652 #backtracks:102'561 #weight_updates:54'468)
#104   265.41s best:7290  next:[920,7289] violation_ls(batch:91 #solutions_imported:49 #lin_moves:324'904 #lin_evals:2'398'993 #gen_moves:258'288 #gen_evals:22'734 #comp_moves:40'433 #backtracks:108'886 #weight_updates:65'916)
#105   265.42s best:7289  next:[920,7288] violation_ls(batch:91 #solutions_imported:47 #lin_moves:330'643 #lin_evals:2'182'372 #gen_moves:189'076 #gen_evals:20'802 #comp_moves:23'502 #backtracks:82'753 #weight_updates:99'906)
#106   268.38s best:7288  next:[920,7287] violation_ls(batch:92 #solutions_imported:48 #lin_moves:332'059 #lin_evals:2'188'443 #gen_moves:189'076 #gen_evals:20'802 #comp_moves:23'502 #backtracks:82'753 #weight_updates:100'295)
#107   272.71s best:7287  next:[920,7286] violation_ls(batch:93 #solutions_imported:52 #lin_moves:343'233 #lin_evals:2'383'753 #gen_moves:242'151 #gen_evals:28'355 #comp_moves:30'192 #backtracks:105'900 #weight_updates:54'531)
#108   272.81s best:7286  next:[920,7285] violation_ls(batch:93 #solutions_imported:51 #lin_moves:332'256 #lin_evals:2'457'470 #gen_moves:265'910 #gen_evals:23'582 #comp_moves:40'966 #backtracks:112'429 #weight_updates:67'587)
#109   272.87s best:7205  next:[920,7204] rnd_cst_lns (d=1.00 s=1031 t=0.10 p=0.60 stall=8 h=auto_l0)
#110   275.45s best:7204  next:[920,7203] violation_ls(batch:94 #solutions_imported:52 #lin_moves:332'256 #lin_evals:2'482'456 #gen_moves:273'551 #gen_evals:24'101 #comp_moves:41'295 #backtracks:116'085 #weight_updates:67'678)
#111   275.46s best:7203  next:[920,7202] violation_ls(batch:94 #solutions_imported:50 #lin_moves:332'059 #lin_evals:2'216'132 #gen_moves:197'235 #gen_evals:21'692 #comp_moves:23'819 #backtracks:86'670 #weight_updates:100'391)
#112   279.52s best:7200  next:[920,7199] graph_cst_lns (d=1.00 s=1054 t=0.10 p=0.59 stall=2 h=auto_l0)
#113   279.55s best:7198  next:[920,7197] violation_ls(batch:95 #solutions_imported:54 #lin_moves:343'233 #lin_evals:2'413'037 #gen_moves:250'260 #gen_evals:29'096 #comp_moves:30'820 #backtracks:109'640 #weight_updates:54'608)
#114   279.56s best:7196  next:[920,7195] violation_ls(batch:95 #solutions_imported:53 #lin_moves:332'257 #lin_evals:2'482'477 #gen_moves:273'551 #gen_evals:24'101 #comp_moves:41'295 #backtracks:116'085 #weight_updates:67'678)
#115   279.57s best:7195  next:[920,7194] violation_ls(batch:95 #solutions_imported:51 #lin_moves:332'059 #lin_evals:2'216'283 #gen_moves:197'294 #gen_evals:21'693 #comp_moves:23'820 #backtracks:86'699 #weight_updates:100'391)
#116   290.32s best:7140  next:[920,7139] graph_dec_lns (d=1.00 s=1076 t=0.10 p=0.59 stall=0 h=auto_l0)
#117   331.67s best:7132  next:[920,7131] graph_arc_lns (d=1.00 s=1194 t=0.10 p=0.58 stall=1 h=auto_l0)
#118   332.50s best:7131  next:[920,7130] violation_ls(batch:110 #solutions_imported:57 #lin_moves:459'645 #lin_evals:2'963'753 #gen_moves:271'500 #gen_evals:31'090 #comp_moves:35'357 #backtracks:117'990 #weight_updates:56'298)
#119   332.52s best:7130  next:[920,7129] violation_ls(batch:110 #solutions_imported:56 #lin_moves:332'257 #lin_evals:2'883'391 #gen_moves:365'914 #gen_evals:30'886 #comp_moves:68'089 #backtracks:148'865 #weight_updates:68'102)
#120   332.53s best:7129  next:[920,7128] violation_ls(batch:110 #solutions_imported:54 #lin_moves:351'707 #lin_evals:2'653'542 #gen_moves:274'072 #gen_evals:25'951 #comp_moves:49'937 #backtracks:111'992 #weight_updates:101'088)
#121   332.74s best:7042  next:[920,7041] rins_lp_lns (d=0.90 s=1217 t=0.10 p=0.52 stall=15 h=folio_rnd)
#Bound 455.00s best:7042  next:[921,7041] objective_lb_search_no_lp
#Bound 500.57s best:7042  next:[922,7041] objective_lb_search_max_lp
#122   548.22s best:6903  next:[922,6902] rnd_var_lns (d=1.00 s=1845 t=0.10 p=0.55 stall=0 h=auto_l0)
#Bound 583.22s best:6903  next:[951,6902] objective_lb_search
#123   626.94s best:6867  next:[951,6866] graph_cst_lns (d=1.00 s=2081 t=0.10 p=0.55 stall=2 h=auto_l0)
#124   683.39s best:6824  next:[951,6823] graph_arc_lns (d=1.00 s=2250 t=0.10 p=0.53 stall=1 h=auto_l0)
#125   685.52s best:6823  next:[951,6822] violation_ls(batch:215 #solutions_imported:61 #lin_moves:1'027'428 #lin_evals:5'657'371 #gen_moves:271'500 #gen_evals:31'090 #comp_moves:35'357 #backtracks:117'990 #weight_updates:531'268)
#126   685.53s best:6822  next:[951,6821] violation_ls(batch:215 #solutions_imported:60 #lin_moves:961'179 #lin_evals:5'952'032 #gen_moves:490'732 #gen_evals:56'290 #comp_moves:92'681 #backtracks:198'939 #weight_updates:69'648)
#127   690.17s best:6821  next:[951,6820] violation_ls(batch:216 #solutions_imported:62 #lin_moves:1'030'424 #lin_evals:5'667'720 #gen_moves:271'500 #gen_evals:31'090 #comp_moves:35'357 #backtracks:117'990 #weight_updates:531'543)
#128   690.18s best:6820  next:[951,6819] violation_ls(batch:216 #solutions_imported:59 #lin_moves:585'957 #lin_evals:5'909'412 #gen_moves:834'210 #gen_evals:51'424 #comp_moves:67'088 #backtracks:383'478 #weight_updates:280'024)
#129   691.90s best:6818  next:[951,6817] graph_arc_lns (d=1.00 s=2280 t=0.10 p=0.54 stall=1 h=auto_l0)
#130   697.92s best:6817  next:[951,6816] rnd_var_lns (d=1.00 s=2287 t=0.10 p=0.54 stall=0 h=auto_l0)
#Bound 700.67s best:6817  next:[953,6816] objective_lb_search
#131   703.17s best:6816  next:[953,6815] violation_ls(batch:220 #solutions_imported:61 #lin_moves:596'704 #lin_evals:6'014'665 #gen_moves:849'164 #gen_evals:52'711 #comp_moves:70'318 #backtracks:389'340 #weight_updates:282'507)
#132   704.56s best:6810  next:[953,6809] graph_cst_lns (d=1.00 s=2311 t=0.10 p=0.54 stall=0 h=auto_l0)
#133   705.87s best:6787  next:[953,6786] rins_lp_lns (d=0.90 s=2335 t=0.10 p=0.51 stall=1 h=auto_l0)
#134   707.73s best:6773  next:[953,6772] graph_arc_lns (d=1.00 s=2320 t=0.10 p=0.54 stall=0 h=auto_l0)
#135   713.42s best:6752  next:[953,6751] rins_lp_lns (d=0.90 s=2365 t=0.10 p=0.51 stall=1 h=auto_l0)
#Bound 783.56s best:6752  next:[958,6751] objective_lb_search_no_lp
#136   792.63s best:6700  next:[958,6699] graph_var_lns (d=1.00 s=2584 t=0.10 p=0.53 stall=1 h=auto_l0)
#Bound 811.16s best:6700  next:[964,6699] objective_lb_search
#Bound 910.86s best:6700  next:[992,6699] objective_lb_search
#137   968.53s best:6688  next:[992,6687] graph_arc_lns (d=1.00 s=3120 t=0.10 p=0.53 stall=5 h=auto_l0)
#138   971.53s best:6687  next:[992,6686] violation_ls(batch:301 #solutions_imported:69 #lin_moves:1'356'003 #lin_evals:8'078'481 #gen_moves:481'503 #gen_evals:47'547 #comp_moves:45'599 #backtracks:217'862 #weight_updates:787'735)
#139   971.55s best:6686  next:[992,6685] violation_ls(batch:301 #solutions_imported:68 #lin_moves:1'548'120 #lin_evals:8'797'078 #gen_moves:699'351 #gen_evals:68'228 #comp_moves:106'086 #backtracks:296'533 #weight_updates:74'600)
#140   971.56s best:6685  next:[992,6684] violation_ls(batch:301 #solutions_imported:66 #lin_moves:596'908 #lin_evals:8'060'810 #gen_moves:1'186'658 #gen_evals:90'571 #comp_moves:113'253 #backtracks:536'569 #weight_updates:284'732)
#141   971.57s best:6599  next:[992,6598] rins_lp_lns (d=0.91 s=3143 t=0.10 p=0.51 stall=12 h=folio_rnd)
#142   1003.49s best:6559  next:[992,6558] graph_dec_lns (d=1.00 s=3222 t=0.10 p=0.53 stall=1 h=auto_l0)
#143   1009.60s best:6545  next:[992,6544] rnd_cst_lns (d=1.00 s=3248 t=0.10 p=0.53 stall=0 h=auto_l0)
#144   1009.73s best:6544  next:[992,6543] violation_ls(batch:312 #solutions_imported:71 #lin_moves:1'623'792 #lin_evals:9'114'227 #gen_moves:699'351 #gen_evals:68'228 #comp_moves:106'086 #backtracks:296'533 #weight_updates:108'180)
#145   1009.75s best:6543  next:[992,6542] violation_ls(batch:312 #solutions_imported:69 #lin_moves:696'241 #lin_evals:8'457'992 #gen_moves:1'186'758 #gen_evals:90'578 #comp_moves:113'255 #backtracks:536'618 #weight_updates:285'399)
#146   1011.15s best:6542  next:[992,6541] violation_ls(batch:313 #solutions_imported:72 #lin_moves:1'625'180 #lin_evals:9'120'184 #gen_moves:699'351 #gen_evals:68'228 #comp_moves:106'086 #backtracks:296'533 #weight_updates:108'537)
#147   1013.55s best:6533  next:[992,6532] rins_lp_lns (d=0.91 s=3263 t=0.10 p=0.51 stall=2 h=auto_l0)
#Bound 1021.85s best:6533  next:[995,6532] objective_lb_search
#148   1050.68s best:6490  next:[995,6489] graph_var_lns (d=1.00 s=3361 t=0.10 p=0.52 stall=0 h=auto_l0)
#149   1050.99s best:6489  next:[995,6488] violation_ls(batch:324 #solutions_imported:72 #lin_moves:796'666 #lin_evals:8'737'271 #gen_moves:1'195'078 #gen_evals:91'103 #comp_moves:114'075 #backtracks:540'368 #weight_updates:286'361)
#150   1054.81s best:6484  next:[995,6483] rins_lp_lns (d=0.91 s=3386 t=0.10 p=0.51 stall=7 h=auto_l0)
#151   1056.86s best:6483  next:[995,6482] graph_var_lns (d=1.00 s=3382 t=0.10 p=0.52 stall=0 h=auto_l0)
#152   1057.26s best:6482  next:[995,6481] violation_ls(batch:326 #solutions_imported:76 #lin_moves:1'695'695 #lin_evals:9'491'611 #gen_moves:717'135 #gen_evals:69'566 #comp_moves:106'835 #backtracks:305'047 #weight_updates:147'335)
#153   1058.58s best:6469  next:[995,6468] rnd_var_lns (d=1.00 s=3380 t=0.10 p=0.53 stall=1 h=auto_l0)
#Bound 1138.71s best:6469  next:[1001,6468] objective_lb_search
#Bound 1536.87s best:6469  next:[1004,6468] objective_lb_search_max_lp
#Bound 1707.87s best:6469  next:[1026,6468] objective_lb_search
#Bound 1876.86s best:6469  next:[1027,6468] objective_lb_search
#Bound 2148.53s best:6469  next:[1028,6468] objective_lb_search
#Bound 2316.89s best:6469  next:[1030,6468] objective_lb_search
#Bound 2450.93s best:6469  next:[1043,6468] objective_lb_search
#154   2786.89s best:6402  next:[1043,6401] graph_var_lns (d=1.00 s=8446 t=0.10 p=0.51 stall=1 h=auto_l0)
#155   2790.76s best:6401  next:[1043,6400] violation_ls(batch:828 #solutions_imported:76 #perturbations:4 #lin_moves:4'812'564 #lin_evals:30'502'229 #gen_moves:1'332'675 #gen_evals:196'614 #comp_moves:120'288 #backtracks:606'051 #weight_updates:304'665)
#156   2795.50s best:6361  next:[1043,6360] rnd_cst_lns (d=1.00 s=8475 t=0.10 p=0.51 stall=4 h=auto_l0)
#157   2795.61s best:6360  next:[1043,6359] violation_ls(batch:829 #solutions_imported:80 #perturbations:4 #lin_moves:3'477'393 #lin_evals:20'935'318 #gen_moves:951'716 #gen_evals:422'495 #comp_moves:70'691 #backtracks:440'360 #weight_updates:796'323)
#158   2796.01s best:6350  next:[1043,6349] graph_dec_lns (d=1.00 s=8479 t=0.10 p=0.51 stall=3 h=auto_l0)
#159   2796.06s best:6304  next:[1043,6303] rins_pump_lns (d=0.92 s=8490 t=0.10 p=0.50 stall=0 h=auto_l0)
#160   2819.07s best:6259  next:[1043,6258] graph_var_lns (d=1.00 s=8547 t=0.10 p=0.51 stall=0 h=auto_l0)
#161   2819.12s best:6258  next:[1043,6257] violation_ls(batch:836 #solutions_imported:82 #perturbations:4 #lin_moves:3'537'361 #lin_evals:21'124'851 #gen_moves:951'716 #gen_evals:422'495 #comp_moves:70'691 #backtracks:440'360 #weight_updates:797'296)
#162   2819.15s best:6257  next:[1043,6256] violation_ls(batch:836 #solutions_imported:81 #perturbations:4 #lin_moves:3'758'018 #lin_evals:22'443'743 #gen_moves:1'177'697 #gen_evals:342'310 #comp_moves:154'307 #backtracks:511'510 #weight_updates:149'950)
#163   2821.28s best:6256  next:[1043,6255] violation_ls(batch:837 #solutions_imported:83 #perturbations:4 #lin_moves:3'537'362 #lin_evals:21'124'872 #gen_moves:951'716 #gen_evals:422'495 #comp_moves:70'691 #backtracks:440'360 #weight_updates:797'296)
#164   2821.29s best:6255  next:[1043,6254] violation_ls(batch:837 #solutions_imported:82 #perturbations:4 #lin_moves:3'758'018 #lin_evals:22'443'747 #gen_moves:1'177'699 #gen_evals:342'311 #comp_moves:154'309 #backtracks:511'510 #weight_updates:149'950)
#165   2821.30s best:6254  next:[1043,6253] violation_ls(batch:837 #solutions_imported:80 #perturbations:4 #lin_moves:4'812'567 #lin_evals:30'712'381 #gen_moves:1'378'770 #gen_evals:201'006 #comp_moves:128'636 #backtracks:624'921 #weight_updates:304'962)
#166   2824.31s best:6241  next:[1043,6240] graph_var_lns (d=1.00 s=8567 t=0.10 p=0.51 stall=0 h=auto_l0)
#167   2825.10s best:6235  next:[1043,6234] graph_arc_lns (d=1.00 s=8568 t=0.10 p=0.51 stall=3 h=auto_l0)
#168   2825.23s best:6181  next:[1043,6180] rins_pump_lns (d=0.92 s=8581 t=0.10 p=0.50 stall=1 h=auto_l0)
#169   2833.36s best:6178  next:[1043,6177] graph_arc_lns (d=1.00 s=8588 t=0.10 p=0.51 stall=0 h=auto_l0)
#170   2931.03s best:6171  next:[1043,6170] rnd_var_lns (d=1.00 s=8878 t=0.10 p=0.51 stall=0 h=auto_l0)
#171   2936.61s best:6165  next:[1043,6164] graph_var_lns (d=1.00 s=8900 t=0.10 p=0.51 stall=0 h=auto_l0)
#172   2937.62s best:6164  next:[1043,6163] violation_ls(batch:871 #solutions_imported:88 #perturbations:4 #lin_moves:3'833'676 #lin_evals:22'261'978 #gen_moves:985'382 #gen_evals:425'520 #comp_moves:72'043 #backtracks:456'509 #weight_updates:799'612)
#173   2937.70s best:6163  next:[1043,6162] violation_ls(batch:871 #solutions_imported:87 #perturbations:4 #lin_moves:3'763'499 #lin_evals:23'460'235 #gen_moves:1'424'423 #gen_evals:363'172 #comp_moves:170'347 #backtracks:626'845 #weight_updates:153'584)
#174   2938.07s best:6147  next:[1043,6146] rins_pump_lns (d=0.92 s=8915 t=0.10 p=0.50 stall=5 h=auto_l0)
#175   3211.02s best:6107  next:[1043,6106] rnd_var_lns (d=1.00 s=9707 t=0.10 p=0.51 stall=0 h=auto_l0)
#Bound 3220.19s best:6107  next:[1081,6106] objective_lb_search
#Bound 3551.11s best:6107  next:[1082,6106] objective_lb_search

Task timing                                  n [     min,      max]      avg      dev     time         n [     min,      max]      avg      dev    dtime
                             'core':         1 [  59.68m,   59.68m]   59.68m   0.00ns   59.68m         1 [   2.22m,    2.22m]    2.22m   0.00ns    2.22m
                       'default_lp':         1 [  59.71m,   59.71m]   59.71m   0.00ns   59.71m         1 [   1.23m,    1.23m]    1.23m   0.00ns    1.23m
                 'feasibility_pump':       730 [282.15us,    8.48m]    4.91s   24.65s   59.69m        91 [586.84ms,   37.10s]    2.32s    4.75s    3.52m
                  'fj_long_default':         8 [214.39ms, 501.57ms] 287.11ms  86.27ms    2.30s         8 [155.67ms, 227.50ms] 187.21ms  23.20ms    1.50s
              'fj_long_lin_default':         9 [221.83ms, 387.25ms] 253.80ms  49.01ms    2.28s         9 [205.56ms, 229.09ms] 214.70ms   7.58ms    1.93s
                   'fj_long_random':         8 [220.01ms, 473.36ms] 285.07ms  76.19ms    2.28s         8 [144.88ms, 228.32ms] 189.48ms  22.73ms    1.52s
                 'fj_short_default':        11 [203.31ms, 436.45ms] 239.44ms  63.11ms    2.63s        11 [201.99ms, 233.26ms] 213.99ms  10.95ms    2.35s
             'fj_short_lin_default':        10 [206.10ms, 408.91ms] 240.26ms  57.11ms    2.40s        10 [199.49ms, 239.45ms] 215.03ms  10.55ms    2.15s
              'fj_short_lin_random':         9 [216.49ms, 377.68ms] 258.34ms  44.36ms    2.33s         9 [197.64ms, 232.91ms] 216.26ms  11.08ms    1.95s
                  'fj_short_random':        10 [191.60ms, 406.40ms] 233.26ms  58.63ms    2.33s        10 [191.88ms, 232.65ms] 207.95ms  11.05ms    2.08s
                        'fs_random':         1 [   2.45s,    2.45s]    2.45s   0.00ns    2.45s         1 [ 94.72ms,  94.72ms]  94.72ms   0.00ns  94.72ms
                        'fs_random':         1 [   2.48s,    2.48s]    2.48s   0.00ns    2.48s         1 [ 84.17ms,  84.17ms]  84.17ms   0.00ns  84.17ms
                  'fs_random_no_lp':         1 [   2.51s,    2.51s]    2.51s   0.00ns    2.51s         1 [ 72.06ms,  72.06ms]  72.06ms   0.00ns  72.06ms
                  'fs_random_no_lp':         1 [   2.54s,    2.54s]    2.54s   0.00ns    2.54s         1 [ 43.50ms,  43.50ms]  43.50ms   0.00ns  43.50ms
          'fs_random_quick_restart':         1 [   2.45s,    2.45s]    2.45s   0.00ns    2.45s         1 [100.15ms, 100.15ms] 100.15ms   0.00ns 100.15ms
          'fs_random_quick_restart':         1 [   2.48s,    2.48s]    2.48s   0.00ns    2.48s         1 [101.88ms, 101.88ms] 101.88ms   0.00ns 101.88ms
    'fs_random_quick_restart_no_lp':         1 [   2.51s,    2.51s]    2.51s   0.00ns    2.51s         1 [ 61.40ms,  61.40ms]  61.40ms   0.00ns  61.40ms
                    'graph_arc_lns':      1063 [397.65ms,   16.53s]    8.14s    2.06s    2.40h      1059 [  7.17us, 109.17ms]  72.68ms  33.75ms    1.28m
                    'graph_cst_lns':      1063 [112.66ms,   19.35s]    8.14s    2.32s    2.40h      1055 [ 10.00ns, 202.50ms]  68.74ms  37.56ms    1.21m
                    'graph_dec_lns':      1063 [369.56ms,   16.34s]    8.51s    2.08s    2.51h      1055 [ 10.00ns, 152.50ms]  72.05ms  35.26ms    1.27m
                    'graph_var_lns':      1063 [425.04ms,   17.00s]    6.81s    1.84s    2.01h      1060 [ 10.00ns, 175.84ms]  71.26ms  34.33ms    1.26m
                   'lb_tree_search':         1 [  59.69m,   59.69m]   59.69m   0.00ns   59.69m         1 [  24.86m,   24.86m]   24.86m   0.00ns   24.86m
                           'max_lp':         1 [  59.70m,   59.70m]   59.70m   0.00ns   59.70m         1 [   3.00m,    3.00m]    3.00m   0.00ns    3.00m
                            'no_lp':         1 [  59.70m,   59.70m]   59.70m   0.00ns   59.70m         1 [  42.53s,   42.53s]   42.53s   0.00ns   42.53s
              'objective_lb_search':         1 [  59.69m,   59.69m]   59.69m   0.00ns   59.69m         1 [   4.53m,    4.53m]    4.53m   0.00ns    4.53m
       'objective_lb_search_max_lp':         1 [  59.70m,   59.70m]   59.70m   0.00ns   59.70m         1 [   2.02m,    2.02m]    2.02m   0.00ns    2.02m
        'objective_lb_search_no_lp':         1 [  59.68m,   59.68m]   59.68m   0.00ns   59.68m         1 [  46.88s,   46.88s]   46.88s   0.00ns   46.88s
  'objective_shaving_search_max_lp':        32 [221.34ms,   12.82m]    1.87m    2.57m   59.69m        27 [  2.72ms,   21.29s]    2.24s    3.95s    1.01m
   'objective_shaving_search_no_lp':        31 [   1.18s,   12.81m]    1.93m    2.59m   59.70m        27 [ 52.70ms,    6.80s]    1.42s    1.43s   38.35s
                          'probing':         1 [  59.69m,   59.69m]   59.69m   0.00ns   59.69m         1 [   7.08m,    7.08m]    7.08m   0.00ns    7.08m
                   'probing_max_lp':         1 [  59.70m,   59.70m]   59.70m   0.00ns   59.70m         1 [  17.10m,   17.10m]   17.10m   0.00ns   17.10m
                     'pseudo_costs':         1 [  59.70m,   59.70m]   59.70m   0.00ns   59.70m         1 [   2.13m,    2.13m]    2.13m   0.00ns    2.13m
                    'quick_restart':         1 [  59.69m,   59.69m]   59.69m   0.00ns   59.69m         1 [   4.75m,    4.75m]    4.75m   0.00ns    4.75m
              'quick_restart_no_lp':         1 [  59.69m,   59.69m]   59.69m   0.00ns   59.69m         1 [   1.31m,    1.31m]    1.31m   0.00ns    1.31m
                    'reduced_costs':         1 [  59.69m,   59.69m]   59.69m   0.00ns   59.69m         1 [   3.91m,    3.91m]    3.91m   0.00ns    3.91m
                        'rins/rens':      1064 [  2.28ms,    5.78s]    1.63s    1.35s   28.87m       866 [ 10.00ns, 114.34ms]  63.44ms  44.14ms   54.94s
                      'rnd_cst_lns':      1064 [231.36ms,   19.50s]    8.16s    2.23s    2.41h      1058 [ 10.00ns, 114.30ms]  70.59ms  35.75ms    1.24m
                      'rnd_var_lns':      1064 [213.90ms,   16.79s]    8.35s    2.12s    2.47h      1055 [ 10.00ns, 200.73ms]  70.78ms  36.13ms    1.24m
                     'violation_ls':      1064 [ 10.65ms, 490.35ms] 259.13ms  74.66ms    4.60m      1064 [  2.00us, 404.42ms] 202.33ms  70.65ms    3.59m
                     'violation_ls':      1064 [ 10.70ms, 537.70ms] 222.81ms  89.49ms    3.95m      1064 [  2.15us, 420.30ms] 172.95ms  80.75ms    3.07m
                     'violation_ls':      1064 [ 10.85ms, 703.53ms] 269.53ms 114.69ms    4.78m      1064 [550.00ns, 555.88ms] 208.27ms 104.15ms    3.69m

Search stats                        Bools  Conflicts  Branches  Restarts  BoolPropag  IntegerPropag
                           'core':  3'522     27'462   114'456     9'726  27'438'173    415'914'354
                     'default_lp':    755      5'384    70'434    24'238     843'294    182'066'555
                      'fs_random':    573          0     1'159     1'146          48        349'708
                      'fs_random':    573          0     1'162     1'146          48        348'368
                'fs_random_no_lp':    573          0     1'398     1'146          87        537'461
                'fs_random_no_lp':    573         21     1'399     1'146         162        645'647
        'fs_random_quick_restart':    573          0     1'161     1'146          48        348'225
        'fs_random_quick_restart':    573          0     1'162     1'146          48        348'391
  'fs_random_quick_restart_no_lp':    646          1     1'784     1'147          57        656'882
                 'lb_tree_search':    573        522   228'393    48'808     497'861    275'420'562
                         'max_lp':    591      7'067   206'211    72'994   1'018'351    314'950'387
                          'no_lp':    971      5'737    73'115    29'056   1'215'385    182'468'475
            'objective_lb_search':    615      4'508    79'813    34'337     893'718    224'016'822
     'objective_lb_search_max_lp':    632      5'720    60'244    25'784     979'554    195'296'899
      'objective_lb_search_no_lp':    660      8'159    33'646    11'621   1'226'256    174'109'451
                        'probing':    735         12     1'458     1'458       4'000        753'583
                 'probing_max_lp':    655          6     1'304     1'304       2'538        634'981
                   'pseudo_costs':    621      8'780   122'861    43'248     928'754    297'441'043
                  'quick_restart':    657      3'360   339'057   113'299     964'806    335'360'482
            'quick_restart_no_lp':  4'119     11'820   237'930    19'711   5'929'388    349'584'291
                  'reduced_costs':  5'191     20'586   264'023    35'342  16'499'384    408'263'583

SAT stats                           ClassicMinim  LitRemoved  LitLearned  LitForgotten  Subsumed  MClauses  MDecisions  MLitTrue  MSubsumed  MLitRemoved  MReused
                           'core':        22'968     120'479     191'818        16'899       101       846       4'420         0         13           56       96
                     'default_lp':         3'005       6'780     159'758             0        74     5'423      32'301         0        129          549      613
                      'fs_random':             0           0           0             0         0         0           0         0          0            0        0
                      'fs_random':             0           0           0             0         0         0           0         0          0            0        0
                'fs_random_no_lp':             0           0           0             0         0         0           0         0          0            0        0
                'fs_random_no_lp':             0           0         115             0         0         0           0         0          0            0        0
        'fs_random_quick_restart':             0           0           0             0         0         0           0         0          0            0        0
        'fs_random_quick_restart':             0           0           0             0         0         0           0         0          0            0        0
  'fs_random_quick_restart_no_lp':             0           0           2             0         0         0           0         0          0            0        0
                 'lb_tree_search':             0           0       1'844             0         0    12'288      68'148         0        101          422      678
                         'max_lp':         4'253      11'881     216'940             0        92    23'728     140'635         0        234        1'002    2'277
                          'no_lp':         3'707       8'722     189'063             0       118     3'317      18'763         0         65          276      214
            'objective_lb_search':         3'665      10'015      31'521             0       144     3'829      30'374         0        333        1'852      964
     'objective_lb_search_max_lp':         4'037       9'842      44'492             0       194     2'585      19'572         0        469        2'839      520
      'objective_lb_search_no_lp':         5'856      14'611      65'020             0       291     1'239       8'470         0        466        2'792      173
                        'probing':             0           0          12             0         0         0           0         0          0            0        0
                 'probing_max_lp':             0           0           6             0         0         0           0         0          0            0        0
                   'pseudo_costs':         5'959      22'648     292'856             0        84    11'705      69'991         0        278        1'180    1'473
                  'quick_restart':         1'064       2'554      59'869             0        19    33'180     206'831         0        314        1'349    4'171
            'quick_restart_no_lp':         6'604      27'978     287'150             0       197     3'657      26'845         7        634        3'350      484
                  'reduced_costs':        14'092      46'992     457'937        62'914       155     4'882      44'001         0        642        4'267    1'751

Lp stats                         Component  Iterations  AddedCuts  OPTIMAL  DUAL_F.  DUAL_U.
                  'default_lp':          1     199'039     17'111   15'020        6        1
                   'fs_random':          1       4'263        347       35        0        0
                   'fs_random':          1       4'629        368       39        0        0
     'fs_random_quick_restart':          1       4'837        324       39        1        0
     'fs_random_quick_restart':          1       4'840        360       41        1        0
              'lb_tree_search':          1   1'682'809     34'514      360   89'765        0
                      'max_lp':          1     313'512     37'984    2'302   21'763        0
         'objective_lb_search':          1     878'438     36'872   13'962      602        2
  'objective_lb_search_max_lp':          1     143'459     19'507      274    8'630        0
                     'probing':          1     202'243     67'656    2'381       58        2
              'probing_max_lp':          1     215'793     58'835      900       36        0
                'pseudo_costs':          1     292'627     31'178    5'244   24'149        1
               'quick_restart':          1     937'912     92'815   53'989      150        0
               'reduced_costs':          1     392'341     61'438   16'405   26'090        0

Lp dimension                                                                         Final dimension of first component
                  'default_lp':   5946 rows, 6024 columns, 28939 entries with magnitude in [2.730773e-03, 1.000000e+00]
                   'fs_random':   1850 rows, 6024 columns, 10354 entries with magnitude in [3.663574e-02, 1.000000e+00]
                   'fs_random':   1900 rows, 6024 columns, 10648 entries with magnitude in [3.663574e-02, 1.000000e+00]
     'fs_random_quick_restart':   1950 rows, 6024 columns, 10711 entries with magnitude in [3.663574e-02, 1.000000e+00]
     'fs_random_quick_restart':   2000 rows, 6024 columns, 10976 entries with magnitude in [3.663574e-02, 1.000000e+00]
              'lb_tree_search':  12313 rows, 6115 columns, 61493 entries with magnitude in [5.339327e-04, 1.000000e+00]
                      'max_lp':   8617 rows, 6115 columns, 40081 entries with magnitude in [2.499484e-03, 1.000000e+00]
         'objective_lb_search':   6916 rows, 6024 columns, 32606 entries with magnitude in [7.571088e-04, 1.000000e+00]
  'objective_lb_search_max_lp':  10021 rows, 6115 columns, 48304 entries with magnitude in [2.896179e-04, 1.000000e+00]
                     'probing':   8368 rows, 6024 columns, 53984 entries with magnitude in [4.166875e-05, 1.000000e+00]
              'probing_max_lp':   9689 rows, 6115 columns, 68990 entries with magnitude in [8.123242e-04, 1.000000e+00]
                'pseudo_costs':   6054 rows, 6115 columns, 29328 entries with magnitude in [2.813796e-03, 1.000000e+00]
               'quick_restart':   6448 rows, 6024 columns, 30888 entries with magnitude in [4.614374e-04, 1.000000e+00]
               'reduced_costs':   6629 rows, 6115 columns, 32009 entries with magnitude in [1.444366e-03, 1.000000e+00]

Lp debug                         CutPropag  CutEqPropag  Adjust  Overflow         Bad  BadScaling
                  'default_lp':          1           40   1'194         0   1'304'023           0
                   'fs_random':          0            0       0         0       1'540           0
                   'fs_random':          0            0       0         0       1'562           0
     'fs_random_quick_restart':          0            0       0         0       1'588           0
     'fs_random_quick_restart':          0            0       0         0       1'607           0
              'lb_tree_search':        112            1  64'798         0   3'421'038           0
                      'max_lp':         53            4   7'223         0   2'048'657           0
         'objective_lb_search':         25           24   3'907         0   2'947'595           0
  'objective_lb_search_max_lp':          3            7   4'117         0   2'793'749           0
                     'probing':         45          173   1'808         0  45'334'299           0
              'probing_max_lp':        341           23     900         0  16'803'025           0
                'pseudo_costs':         34            0   5'803         0   1'872'347           0
               'quick_restart':          9           17  20'274         0   8'739'841           0
               'reduced_costs':        151            5  13'663         0   4'739'131           0

Lp pool                          Constraints  Updates  Simplif  Merged  Shortened   Split  Strenghtened       Cuts/Call
                  'default_lp':       15'197      114    3'141       2          0     543         4'396   17'111/45'857
                   'fs_random':        6'435        0        0       0          0       0             7       347/1'313
                   'fs_random':        6'456        0        0       0          0       0             7       368/1'415
     'fs_random_quick_restart':        6'412        0        0       0          0       0             7       324/1'405
     'fs_random_quick_restart':        6'448        0        0       0          0       0             7       360/1'455
              'lb_tree_search':       75'722      226   27'269       8          0   2'550        39'999   34'514/61'464
                      'max_lp':       76'183      126   24'083      17          0   1'463        36'357   37'984/63'529
         'objective_lb_search':       15'955      387    3'169       5          0   4'247         8'747   36'872/98'434
  'objective_lb_search_max_lp':       75'712      153   27'617      11          0   1'310        30'695   19'507/42'068
                     'probing':       15'741    5'668    1'825       3          0  12'938        20'285  67'656/137'013
              'probing_max_lp':       76'043    1'366    9'347       8          0  11'947        29'392  58'835/120'525
                'pseudo_costs':       75'369      111   23'869      25          0     980        31'894   31'178/58'252
               'quick_restart':       15'890      853    3'479      13          0  16'111        18'623  92'815/229'840
               'reduced_costs':       75'596      293   30'663      58          0   3'912        46'099  61'438/120'115

Lp Cut            fs_ran  fs_ran  fs_ran  fs_ran  defaul  max_lp  quick_  reduce  pseudo  lb_tre  probin  object  probin  object
          CG_FF:      12      12      12      12   1'028   2'029   3'790   3'368   1'360   1'011   1'999   1'088   1'001     577
           CG_K:      14      14      14      14     613   1'188   2'284   2'971   1'330     607   1'498     657     732     526
          CG_KL:       -       -       -       -      17       -      42      14       -       -      29      25       -       5
           CG_R:      12      12      12      12     351     813   1'583   1'361     605     515   1'275     302     584     243
          CG_RB:       5       5       5       5   2'438   6'742   8'493   7'922   5'157   3'628   9'302   4'072   3'843   2'545
         CG_RBP:       1       1       1       1     165     487     700     611     469     219     546     237     177      92
         Clique:       -       -       -       -       -     547       -   1'022     597     446       -       -     382     413
             IB:     231     197     226     209   7'308   5'001  48'177  10'820   7'173   1'527   7'351  19'604   1'149   3'998
       MIR_1_FF:      23      23      23      23     432   1'337   2'151   2'540     819   1'224   3'547     769   1'926     701
        MIR_1_K:       5       5       5       5      74      70     284     431     103      52     373      86     117     141
       MIR_1_KL:       -       -       -       -       3       5      27       7       1       1      12       5       6       9
        MIR_1_R:       9       9       9       9     109     121     505     456     126     163   1'240     125     400     164
       MIR_1_RB:      10      10      10      10     992   4'560   5'543   6'443   2'724   4'487   7'484   2'148   7'997   1'809
      MIR_1_RBP:       -       -       -       -     152   2'152     712   2'281   1'157   2'108     741     334   2'942     537
      MIR_1_RLT:       -       -       -       -       -      15       -      34      13       9       -       -       9      23
       MIR_2_FF:       5       6       4       4     295     613   1'257   1'288     541     685   1'630     456   1'107     474
        MIR_2_K:       8       5       7       7      57      72     196     287      95      70     233      65     133      89
       MIR_2_KL:       -       -       -       -       7      19      38      48       8      21      55      14      36      27
        MIR_2_R:       3       1       2       1      82     278     335     462     195     710   1'069      92   1'629     242
       MIR_2_RB:      10       8      11       9     639   1'910   3'188   3'178   1'566   2'180   4'572   1'221   3'889   1'044
      MIR_2_RBP:       -       -       -       -      82     859     453   1'091     669     959     435     137   1'548     271
       MIR_3_FF:       -       -       -       -     120     354     617     721     304     372     799     252     754     307
        MIR_3_K:       -       -       -       2      34      66     156     211      81     101     171      55     178      89
       MIR_3_KL:       -       -       -       -       7      28      90      98      19      23     134      39      49      40
        MIR_3_R:       -       -       -       -      43     185     249     354     166     556     557      78   1'216     184
       MIR_3_RB:       4       3       1       2     284     869   1'713   1'629     770   1'192   2'713     692   2'260     620
      MIR_3_RBP:       -       -       -       -      31     350     253     559     309     471     280     104     794     154
       MIR_4_FF:       -       -       -       -      56     166     371     435     158     190     513     151     414     150
        MIR_4_K:       -       -       -       -      24      48     179     167      59      68     217      71     116      78
       MIR_4_KL:       -       -       -       -      13      42     153     142      19      24     251      67      45      43
        MIR_4_R:       -       -       -       -      30      90     161     195      78     248     387      46     498     113
       MIR_4_RB:       -       -       -       -     187     364   1'088     886     366     655   1'682     494   1'041     373
      MIR_4_RBP:       -       -       -       -      26     140     180     298     132     250     219      74     358     108
       MIR_5_FF:       -       -       -       -      49      95     279     260      82     105     419     163     247      94
        MIR_5_K:       -       -       -       -      28      39     222     161      32      45     302     111      81      67
       MIR_5_KL:       -       -       -       -      11      47     184     140      26      21     414     104      46      54
        MIR_5_R:       -       -       -       -      30      39     115     103      35     121     298      53     223      61
       MIR_5_RB:       -       -       -       -     118     217     822     537     159     346   1'394     399     558     244
      MIR_5_RBP:       -       -       -       -      11      59     111     147      47      99     208      52     191      57
       MIR_6_FF:       -       -       -       -      36      38     208     153      54      63     299     111     159      57
        MIR_6_K:       -       -       -       -      39      35     181     135      35      46     267     122      45      31
       MIR_6_KL:       -       -       -       -      33      36     236     108      33      24     571     118      55      43
        MIR_6_R:       -       -       -       -      13      22      79      65      31      57     124      32     112      28
       MIR_6_RB:       -       -       -       -      98     129     675     384     100     198   1'261     346     294     119
      MIR_6_RBP:       -       -       -       -       5      23      65     109      34      56     214      33     130      23
   ZERO_HALF_FF:       6       5       8       8     150     678     700     785     428     525     525     215     521     184
    ZERO_HALF_K:       3       3       3       6      51     109     159     184      97      68     114      36      96      40
   ZERO_HALF_KL:       -       -       -       -       -       -       2       6       2       1       3       -       2       2
    ZERO_HALF_R:       3       2       3       4     282   2'255   1'969   2'721   1'059   5'639   7'269     743  15'603   1'489
   ZERO_HALF_RB:       4       3       4       4     379   2'023   1'508   2'464   1'315   1'665   1'823     557   2'296     584
  ZERO_HALF_RBP:       -       -       -       -      79     620     332     646     440     663     837     117     846     141

LNS stats           Improv/Calls  Closed  Difficulty  TimeLimit
  'graph_arc_lns':      481/1060     51%        1.00       0.10
  'graph_cst_lns':      488/1058     51%        1.00       0.10
  'graph_dec_lns':      469/1060     51%        1.00       0.10
  'graph_var_lns':      392/1061     51%        1.00       0.10
      'rins/rens':       190/901     50%        0.93       0.10
    'rnd_cst_lns':      477/1060     51%        1.00       0.10
    'rnd_var_lns':      480/1060     51%        1.00       0.10

LS stats                   Batches  Restarts   LinMoves   GenMoves  CompoundMoves  WeightUpdates
       'fj_long_default':        8         1     79'860          0              0            140
   'fj_long_lin_default':        9         1          0     12'483          1'858              1
        'fj_long_random':        8         1     79'861          0              0            139
      'fj_short_default':       11         1          0     15'397          2'239              1
  'fj_short_lin_default':       10         1          0     14'474          2'262              1
   'fj_short_lin_random':        9         1          0     14'006          2'669              1
       'fj_short_random':       10         1          0     14'555          2'367              1
          'violation_ls':    1'064         0  3'898'167  1'817'109        239'824        154'681
          'violation_ls':    1'064         0  4'622'554  1'192'162        103'787        800'868
          'violation_ls':    1'064         0  4'983'935  2'295'366        179'888        438'629

Solutions (175)                     Num      Rank
  'fs_random_quick_restart_no_lp':    1     [1,1]
                  'graph_arc_lns':   15  [14,169]
                  'graph_cst_lns':    4  [32,132]
                  'graph_dec_lns':    6  [39,158]
                  'graph_var_lns':   18   [4,171]
                    'rins_lp_lns':   23  [18,150]
                  'rins_pump_lns':    4  [46,174]
                    'rnd_cst_lns':    7  [38,156]
                    'rnd_var_lns':    7  [63,175]
                   'violation_ls':   90   [2,173]

Objective bounds                      Num
                   'initial_domain':    1
              'objective_lb_search':   15
       'objective_lb_search_max_lp':    8
        'objective_lb_search_no_lp':    5
  'objective_shaving_search_max_lp':    1
   'objective_shaving_search_no_lp':    1

Solution repositories    Added  Queried  Ignored  Synchro
  'feasible solutions':  4'587   18'866        0    4'483
        'lp solutions':  1'045      701        0    1'036
                'pump':  1'996      363

Improving bounds shared            Num
                        'core':     63
                  'default_lp':    353
              'lb_tree_search':    636
                      'max_lp':    382
                       'no_lp':    845
         'objective_lb_search':     31
  'objective_lb_search_max_lp':      3
                     'probing':     90
              'probing_max_lp':    204
                'pseudo_costs':    349
               'quick_restart':    585
         'quick_restart_no_lp':    898
               'reduced_costs':  1'086

Clauses shared                      Num
                           'core':   16
                     'default_lp':   42
                'fs_random_no_lp':    1
  'fs_random_quick_restart_no_lp':    1
                 'lb_tree_search':    5
                         'max_lp':   52
                          'no_lp':    8
            'objective_lb_search':   11
     'objective_lb_search_max_lp':   15
      'objective_lb_search_no_lp':    5
                   'pseudo_costs':   81
                  'quick_restart':   79
            'quick_restart_no_lp':  149
                  'reduced_costs':    2

CpSolverResponse summary:
status: FEASIBLE
objective: 6107
best_bound: 1082
integers: 6025
booleans: 573
conflicts: 0
branches: 1162
propagations: 48
integer_propagations: 348368
restarts: 1146
lp_iterations: 4629
walltime: 3601.81
usertime: 3601.81
deterministic_time: 5989.06
gap_integral: 51194.3
solution_fingerprint: 0xe378afb6cc2f5246


--- Simulation Gantt  partir du modle mathmatique ---
{'big':0, 'due_date':125, 'pos_time':5, 'status':0, 'blocked':0, 'operations':["{'type':1, 'processing_time':35}", "{'type':0, 'processing_time':17}"]}
{'big':1, 'due_date':309, 'pos_time':5, 'status':0, 'blocked':0, 'operations':["{'type':1, 'processing_time':17}", "{'type':0, 'processing_time':54}"]}
{'big':1, 'due_date':231, 'pos_time':5, 'status':0, 'blocked':0, 'operations':["{'type':0, 'processing_time':58}"]}
{'big':1, 'due_date':217, 'pos_time':5, 'status':0, 'blocked':0, 'operations':["{'type':0, 'processing_time':14}", "{'type':1, 'processing_time':16}"]}
{'big':0, 'due_date':229, 'pos_time':5, 'status':0, 'blocked':0, 'operations':["{'type':0, 'processing_time':44}"]}
{'big':0, 'due_date':203, 'pos_time':5, 'status':0, 'blocked':0, 'operations':["{'type':0, 'processing_time':32}", "{'type':1, 'processing_time':51}"]}
{'big':1, 'due_date':118, 'pos_time':5, 'status':0, 'blocked':0, 'operations':["{'type':1, 'processing_time':49}", "{'type':0, 'processing_time':36}"]}
{'big':1, 'due_date':250, 'pos_time':5, 'status':0, 'blocked':0, 'operations':["{'type':0, 'processing_time':26}", "{'type':1, 'processing_time':14}"]}
{'big':0, 'due_date':212, 'pos_time':5, 'status':0, 'blocked':0, 'operations':["{'type':1, 'processing_time':20}", "{'type':0, 'processing_time':54}"]}
{'big':0, 'due_date':157, 'pos_time':5, 'status':0, 'blocked':0, 'operations':["{'type':1, 'processing_time':29}"]}
{'big':1, 'due_date':300, 'pos_time':5, 'status':0, 'blocked':0, 'operations':["{'type':0, 'processing_time':12}", "{'type':1, 'processing_time':34}"]}
{'big':1, 'due_date':151, 'pos_time':5, 'status':0, 'blocked':0, 'operations':["{'type':1, 'processing_time':34}", "{'type':0, 'processing_time':51}"]}
{'big':0, 'due_date':93, 'pos_time':5, 'status':0, 'blocked':0, 'operations':["{'type':1, 'processing_time':38}"]}
{'big':0, 'due_date':144, 'pos_time':5, 'status':0, 'blocked':0, 'operations':["{'type':0, 'processing_time':10}"]}
{'big':1, 'due_date':213, 'pos_time':5, 'status':0, 'blocked':0, 'operations':["{'type':1, 'processing_time':59}", "{'type':0, 'processing_time':23}"]}
{'big':1, 'due_date':119, 'pos_time':5, 'status':0, 'blocked':0, 'operations':["{'type':1, 'processing_time':24}"]}
{'big':0, 'due_date':210, 'pos_time':5, 'status':0, 'blocked':0, 'operations':["{'type':1, 'processing_time':47}"]}
{'big':1, 'due_date':278, 'pos_time':5, 'status':0, 'blocked':0, 'operations':["{'type':0, 'processing_time':25}", "{'type':1, 'processing_time':13}"]}
{'big':1, 'due_date':142, 'pos_time':5, 'status':0, 'blocked':0, 'operations':["{'type':0, 'processing_time':26}", "{'type':1, 'processing_time':59}"]}
{'big':0, 'due_date':274, 'pos_time':5, 'status':0, 'blocked':0, 'operations':["{'type':0, 'processing_time':36}", "{'type':1, 'processing_time':15}"]}
