created virtual environment CPython3.12.4.final.0-64 in 604ms
  creator CPython3Posix(dest=/localscratch/aneumann.46806165.0/env, clear=False, no_vcs_ignore=False, global=False)
  seeder FromAppData(download=False, pip=bundle, via=copy, app_data_dir=/home/aneumann/.local/share/virtualenv)
    added seed packages: pip==24.2+computecanada
  activators BashActivator,CShellActivator,FishActivator,NushellActivator,PowerShellActivator,PythonActivator
Looking in links: /cvmfs/soft.computecanada.ca/custom/python/wheelhouse/gentoo2023/x86-64-v3, /cvmfs/soft.computecanada.ca/custom/python/wheelhouse/gentoo2023/generic, /cvmfs/soft.computecanada.ca/custom/python/wheelhouse/generic
Requirement already satisfied: pip in /localscratch/aneumann.46806165.0/env/lib/python3.12/site-packages (24.2+computecanada)
Processing /cvmfs/soft.computecanada.ca/custom/python/wheelhouse/generic/pip-25.0+computecanada-py3-none-any.whl
Installing collected packages: pip
  Attempting uninstall: pip
    Found existing installation: pip 24.2+computecanada
    Uninstalling pip-24.2+computecanada:
      Successfully uninstalled pip-24.2+computecanada
Successfully installed pip-24.2+computecanada
Looking in links: /cvmfs/soft.computecanada.ca/custom/python/wheelhouse/gentoo2023/x86-64-v3, /cvmfs/soft.computecanada.ca/custom/python/wheelhouse/gentoo2023/generic, /cvmfs/soft.computecanada.ca/custom/python/wheelhouse/generic
ERROR: protobuf-5.28.3-cp38-abi3-manylinux2014_x86_64.whl is not a supported wheel on this platform.
Looking in links: /cvmfs/soft.computecanada.ca/custom/python/wheelhouse/gentoo2023/x86-64-v3, /cvmfs/soft.computecanada.ca/custom/python/wheelhouse/gentoo2023/generic, /cvmfs/soft.computecanada.ca/custom/python/wheelhouse/generic
Processing /home/aneumann/projects/def-adhaj/aneumann/GNRS/wheels/immutabledict-4.2.0-py3-none-any.whl
Installing collected packages: immutabledict
Successfully installed immutabledict-4.2.0
Looking in links: /cvmfs/soft.computecanada.ca/custom/python/wheelhouse/gentoo2023/x86-64-v3, /cvmfs/soft.computecanada.ca/custom/python/wheelhouse/gentoo2023/generic, /cvmfs/soft.computecanada.ca/custom/python/wheelhouse/generic
Processing /cvmfs/soft.computecanada.ca/custom/python/wheelhouse/generic/ortools-9.10.4067+computecanada-cp312-cp312-linux_x86_64.whl (from -r /home/aneumann/projects/def-adhaj/aneumann/GNRS/requirements/or.txt (line 1))
Processing /cvmfs/soft.computecanada.ca/custom/python/wheelhouse/gentoo2023/x86-64-v3/matplotlib-3.10.0+computecanada-cp312-cp312-linux_x86_64.whl (from -r /home/aneumann/projects/def-adhaj/aneumann/GNRS/requirements/or.txt (line 2))
Processing /cvmfs/soft.computecanada.ca/custom/python/wheelhouse/gentoo2023/x86-64-v3/pandas-2.2.3+computecanada-cp312-cp312-linux_x86_64.whl (from -r /home/aneumann/projects/def-adhaj/aneumann/GNRS/requirements/or.txt (line 3))
Processing /cvmfs/soft.computecanada.ca/custom/python/wheelhouse/generic/absl_py-2.3.0+computecanada-py3-none-any.whl (from ortools<9.11,>=9.10->-r /home/aneumann/projects/def-adhaj/aneumann/GNRS/requirements/or.txt (line 1))
Processing /cvmfs/soft.computecanada.ca/custom/python/wheelhouse/gentoo2023/generic/numpy-2.2.2+computecanada-cp312-cp312-linux_x86_64.whl (from ortools<9.11,>=9.10->-r /home/aneumann/projects/def-adhaj/aneumann/GNRS/requirements/or.txt (line 1))
Processing /cvmfs/soft.computecanada.ca/custom/python/wheelhouse/gentoo2023/x86-64-v3/protobuf-6.31.1+computecanada-cp312-cp312-linux_x86_64.whl (from ortools<9.11,>=9.10->-r /home/aneumann/projects/def-adhaj/aneumann/GNRS/requirements/or.txt (line 1))
Requirement already satisfied: immutabledict>=3.0.0 in /localscratch/aneumann.46806165.0/env/lib/python3.12/site-packages (from ortools<9.11,>=9.10->-r /home/aneumann/projects/def-adhaj/aneumann/GNRS/requirements/or.txt (line 1)) (4.2.0)
Processing /cvmfs/soft.computecanada.ca/custom/python/wheelhouse/gentoo2023/generic/contourpy-1.3.1+computecanada-cp312-cp312-linux_x86_64.whl (from matplotlib->-r /home/aneumann/projects/def-adhaj/aneumann/GNRS/requirements/or.txt (line 2))
Processing /cvmfs/soft.computecanada.ca/custom/python/wheelhouse/generic/cycler-0.12.1+computecanada-py3-none-any.whl (from matplotlib->-r /home/aneumann/projects/def-adhaj/aneumann/GNRS/requirements/or.txt (line 2))
Processing /cvmfs/soft.computecanada.ca/custom/python/wheelhouse/generic/fonttools-4.59.0+computecanada-cp312-cp312-linux_x86_64.whl (from matplotlib->-r /home/aneumann/projects/def-adhaj/aneumann/GNRS/requirements/or.txt (line 2))
Processing /cvmfs/soft.computecanada.ca/custom/python/wheelhouse/gentoo2023/x86-64-v3/kiwisolver-1.4.8+computecanada-cp312-cp312-linux_x86_64.whl (from matplotlib->-r /home/aneumann/projects/def-adhaj/aneumann/GNRS/requirements/or.txt (line 2))
Processing /cvmfs/soft.computecanada.ca/custom/python/wheelhouse/generic/packaging-25.0+computecanada-py3-none-any.whl (from matplotlib->-r /home/aneumann/projects/def-adhaj/aneumann/GNRS/requirements/or.txt (line 2))
Processing /cvmfs/soft.computecanada.ca/custom/python/wheelhouse/gentoo2023/x86-64-v3/pillow-11.1.0+computecanada-cp312-cp312-linux_x86_64.whl (from matplotlib->-r /home/aneumann/projects/def-adhaj/aneumann/GNRS/requirements/or.txt (line 2))
Processing /cvmfs/soft.computecanada.ca/custom/python/wheelhouse/generic/pyparsing-3.2.3+computecanada-py3-none-any.whl (from matplotlib->-r /home/aneumann/projects/def-adhaj/aneumann/GNRS/requirements/or.txt (line 2))
Processing /cvmfs/soft.computecanada.ca/custom/python/wheelhouse/generic/python_dateutil-2.9.0.post0+computecanada-py2.py3-none-any.whl (from matplotlib->-r /home/aneumann/projects/def-adhaj/aneumann/GNRS/requirements/or.txt (line 2))
Processing /cvmfs/soft.computecanada.ca/custom/python/wheelhouse/generic/pytz-2025.2+computecanada-py2.py3-none-any.whl (from pandas->-r /home/aneumann/projects/def-adhaj/aneumann/GNRS/requirements/or.txt (line 3))
Processing /cvmfs/soft.computecanada.ca/custom/python/wheelhouse/generic/tzdata-2025.2+computecanada-py2.py3-none-any.whl (from pandas->-r /home/aneumann/projects/def-adhaj/aneumann/GNRS/requirements/or.txt (line 3))
Processing /cvmfs/soft.computecanada.ca/custom/python/wheelhouse/generic/six-1.17.0+computecanada-py2.py3-none-any.whl (from python-dateutil>=2.7->matplotlib->-r /home/aneumann/projects/def-adhaj/aneumann/GNRS/requirements/or.txt (line 2))
Installing collected packages: pytz, tzdata, six, pyparsing, protobuf, pillow, packaging, numpy, kiwisolver, fonttools, cycler, absl-py, python-dateutil, contourpy, pandas, matplotlib, ortools
Successfully installed absl-py-2.3.0+computecanada contourpy-1.3.1+computecanada cycler-0.12.1+computecanada fonttools-4.59.0+computecanada kiwisolver-1.4.8+computecanada matplotlib-3.10.0+computecanada numpy-2.2.2+computecanada ortools-9.10.4067+computecanada packaging-25.0+computecanada pandas-2.2.3+computecanada pillow-11.1.0+computecanada protobuf-6.31.1+computecanada pyparsing-3.2.3+computecanada python-dateutil-2.9.0.post0+computecanada pytz-2025.2+computecanada six-1.17.0+computecanada tzdata-2025.2+computecanada

Starting CP-SAT solver v9.10.4067
Parameters: max_time_in_seconds: 86400 max_memory_in_mb: 185000 log_search_progress: true enumerate_all_solutions: false num_search_workers: 32 absolute_gap_limit: 0 relative_gap_limit: 0

Initial optimization model '': (model_fingerprint: 0x731d5e04cac6db88)
#Variables: 269 (#ints: 9 in objective)
  - 188 Booleans in [0,1]
  - 81 in [0,541]
#kLinear1: 38
#kLinear2: 384
#kLinear3: 196
#kLinearN: 2'876 (#terms: 40'878)

Starting presolve at 0.00s
  1.18e-03s  0.00e+00d  [DetectDominanceRelations] 
  1.78e-02s  0.00e+00d  [PresolveToFixPoint] #num_loops=8 #num_dual_strengthening=3 
  2.94e-05s  0.00e+00d  [ExtractEncodingFromLinear] #potential_supersets=4 
[Symmetry] Graph for symmetry has 3'364 nodes and 30'874 arcs.
[Symmetry] Symmetry computation done. time: 0.00123454 dtime: 0.00254276
[Symmetry] #generators: 1, average support size: 24
[Symmetry] The model contains 144 duplicate constraints !
[Symmetry] 12 orbits with sizes: 2,2,2,2,2,2,2,2,2,2,...
[Symmetry] Num fixable by intersecting at_most_one with orbits: 1 largest_orbit: 2
  6.22e-03s  1.47e-03d  [Probe] #probed=252 #new_bounds=8 #equiv=1 
  7.67e-05s  0.00e+00d  [MaxClique] Merged 21(42 literals) into 9(18 literals) at_most_ones. 
  1.10e-03s  0.00e+00d  [DetectDominanceRelations] 
  7.00e-03s  0.00e+00d  [PresolveToFixPoint] #num_loops=2 #num_dual_strengthening=1 
  3.50e-03s  0.00e+00d  [ProcessAtMostOneAndLinear] 
  1.44e-03s  0.00e+00d  [DetectDuplicateConstraints] #duplicates=199 #without_enforcements=188 
  1.61e-03s  1.61e-04d  [DetectDominatedLinearConstraints] #relevant_constraints=2'419 #num_inclusions=2'292 
  2.82e-04s  0.00e+00d  [DetectDifferentVariables] #different=22 #cliques=1 #size=5 
  3.52e-04s  3.90e-05d  [ProcessSetPPC] #relevant_constraints=1'953 
  1.38e-05s  0.00e+00d  [FindAlmostIdenticalLinearConstraints] 
  1.25e-04s  1.63e-04d  [FindBigAtMostOneAndLinearOverlap] 
  3.10e-03s  2.46e-03d  [FindBigVerticalLinearOverlap] #blocks=33 #saved_nz=4'182 
  2.12e-04s  9.55e-05d  [FindBigHorizontalLinearOverlap] #linears=1'883 
  1.44e-05s  0.00e+00d  [MergeClauses] 
  1.23e-03s  0.00e+00d  [DetectDominanceRelations] 
  1.23e-02s  0.00e+00d  [PresolveToFixPoint] #num_loops=2 #num_dual_strengthening=1 
  1.23e-03s  0.00e+00d  [DetectDominanceRelations] 
  7.38e-03s  0.00e+00d  [PresolveToFixPoint] #num_loops=1 #num_dual_strengthening=1 
[Symmetry] Graph for symmetry has 3'254 nodes and 25'857 arcs.
[Symmetry] Symmetry computation done. time: 0.000549162 dtime: 0.00139931
  5.80e-03s  1.39e-03d  [Probe] #probed=252 #new_bounds=20 
  8.21e-06s  0.00e+00d  [MaxClique] 
  1.23e-03s  0.00e+00d  [DetectDominanceRelations] 
  1.01e-02s  0.00e+00d  [PresolveToFixPoint] #num_loops=2 #num_dual_strengthening=1 
  3.14e-03s  0.00e+00d  [ProcessAtMostOneAndLinear] 
  1.32e-03s  0.00e+00d  [DetectDuplicateConstraints] #without_enforcements=214 
  9.45e-04s  8.62e-05d  [DetectDominatedLinearConstraints] #relevant_constraints=2'098 #num_inclusions=458 
  1.51e-04s  0.00e+00d  [DetectDifferentVariables] 
  3.27e-04s  2.98e-05d  [ProcessSetPPC] #relevant_constraints=1'819 
  1.98e-05s  9.00e-08d  [FindAlmostIdenticalLinearConstraints] #num_tested_pairs=6 
  7.62e-05s  1.04e-04d  [FindBigAtMostOneAndLinearOverlap] 
  2.52e-03s  1.90e-03d  [FindBigVerticalLinearOverlap] #blocks=26 #saved_nz=2'939 
  1.89e-04s  7.73e-05d  [FindBigHorizontalLinearOverlap] #linears=1'792 
  7.57e-06s  0.00e+00d  [MergeClauses] 
  1.14e-03s  0.00e+00d  [DetectDominanceRelations] 
  1.19e-02s  0.00e+00d  [PresolveToFixPoint] #num_loops=2 #num_dual_strengthening=1 
  1.13e-03s  0.00e+00d  [DetectDominanceRelations] 
  8.05e-03s  0.00e+00d  [PresolveToFixPoint] #num_loops=1 #num_dual_strengthening=1 
[Symmetry] Graph for symmetry has 3'317 nodes and 22'929 arcs.
[Symmetry] Symmetry computation done. time: 0.000507492 dtime: 0.00129208
  5.13e-03s  1.29e-03d  [Probe] #probed=252 #new_bounds=19 
  7.56e-06s  0.00e+00d  [MaxClique] 
  1.13e-03s  0.00e+00d  [DetectDominanceRelations] 
  1.09e-02s  0.00e+00d  [PresolveToFixPoint] #num_loops=2 #num_dual_strengthening=1 
  2.77e-03s  0.00e+00d  [ProcessAtMostOneAndLinear] 
  1.28e-03s  0.00e+00d  [DetectDuplicateConstraints] #without_enforcements=242 
  6.41e-04s  5.50e-05d  [DetectDominatedLinearConstraints] #relevant_constraints=1'937 #num_inclusions=44 
  1.39e-04s  0.00e+00d  [DetectDifferentVariables] 
  2.69e-04s  2.23e-05d  [ProcessSetPPC] #relevant_constraints=1'672 
  2.23e-05s  1.95e-07d  [FindAlmostIdenticalLinearConstraints] #num_tested_pairs=13 
  6.01e-05s  7.08e-05d  [FindBigAtMostOneAndLinearOverlap] 
  1.53e-03s  1.41e-03d  [FindBigVerticalLinearOverlap] #blocks=15 #saved_nz=902 
  1.68e-04s  6.67e-05d  [FindBigHorizontalLinearOverlap] #linears=1'623 
  9.90e-06s  0.00e+00d  [MergeClauses] 
  1.08e-03s  0.00e+00d  [DetectDominanceRelations] 
  9.63e-03s  0.00e+00d  [PresolveToFixPoint] #num_loops=2 #num_dual_strengthening=1 
  6.05e-05s  0.00e+00d  [ExpandObjective] #entries=274 #tight_variables=122 #tight_constraints=64 

Presolve summary:
  - 56 affine relations were detected.
  - rule 'TODO dual: only one blocking constraint?' was applied 527 times.
  - rule 'TODO dual: only one blocking enforced constraint?' was applied 44 times.
  - rule 'TODO dual: only one unspecified blocking constraint?' was applied 49 times.
  - rule 'TODO duplicate: identical constraint with different enforcements' was applied 644 times.
  - rule 'affine: new relation' was applied 56 times.
  - rule 'at_most_one: removed literals' was applied 9 times.
  - rule 'at_most_one: size one' was applied 9 times.
  - rule 'at_most_one: transformed into max clique.' was applied 1 time.
  - rule 'deductions: 177 stored' was applied 1 time.
  - rule 'dual: fix variable' was applied 24 times.
  - rule 'dual: reduced domain' was applied 33 times.
  - rule 'duplicate: merged rhs of linear constraint' was applied 43 times.
  - rule 'duplicate: removed constraint' was applied 199 times.
  - rule 'enforcement: false literal' was applied 8 times.
  - rule 'exactly_one: x and not(x)' was applied 1 time.
  - rule 'incompatible linear: add implication' was applied 30 times.
  - rule 'linear matrix: common vertical rectangle' was applied 74 times.
  - rule 'linear: always true' was applied 595 times.
  - rule 'linear: doubleton free' was applied 10 times.
  - rule 'linear: empty' was applied 28 times.
  - rule 'linear: extracted enforcement literal' was applied 6'161 times.
  - rule 'linear: fixed or dup variables' was applied 2'930 times.
  - rule 'linear: positive equal one' was applied 4 times.
  - rule 'linear: reduced variable domains' was applied 156 times.
  - rule 'linear: remapped using affine relations' was applied 2'997 times.
  - rule 'linear: simplified rhs' was applied 7'993 times.
  - rule 'linear: tightened into equality' was applied 5 times.
  - rule 'linear: variable substitution 1' was applied 10 times.
  - rule 'no_overlap: inferred from x != y constraints' was applied 1 time.
  - rule 'presolve: 82 unused variables removed.' was applied 1 time.
  - rule 'presolve: iteration' was applied 3 times.
  - rule 'probing: reduced enforced constraint to implication.' was applied 21 times.
  - rule 'symmetry: fixed to false in general orbit' was applied 1 time.

Presolved optimization model '': (model_fingerprint: 0x4b5cb5aef5748c0c)
#Variables: 195 (#ints: 9 in objective)
  - 65 Booleans in [0,1]
  - 101 different domains in [-3197,3622] with a largest complexity of 11.
#kExactlyOne: 3 (#literals: 9)
#kInterval: 5
#kLinear2: 737 (#enforced: 699 #multi: 623)
#kLinear3: 185 (#enforced: 90)
#kLinearN: 1'726 (#enforced: 1'618 #multi: 83) (#terms: 13'755)
#kNoOverlap: 1 (#intervals: 5)

Preloading model.
#Bound   0.16s best:inf   next:[119,4018] initial_domain
[Symmetry] Graph for symmetry has 3'209 nodes and 22'037 arcs.
[Symmetry] Symmetry computation done. time: 0.000491722 dtime: 0.00127886
#Model   0.16s var:195/195 constraints:2657/2657

Starting search at 0.16s with 32 workers.
17 full problem subsolvers: [core, default_lp, fixed, lb_tree_search, max_lp, no_lp, objective_lb_search, objective_lb_search_max_lp, objective_lb_search_no_lp, objective_shaving_search_max_lp, objective_shaving_search_no_lp, probing, probing_max_lp, pseudo_costs, quick_restart, quick_restart_no_lp, reduced_costs]
13 first solution subsolvers: [fj_long_default, fj_long_lin_default, fj_long_random, fj_short_default, fj_short_lin_default, fj_short_lin_random, fj_short_random, fs_random(2), fs_random_no_lp, fs_random_quick_restart(2), fs_random_quick_restart_no_lp]
13 incomplete subsolvers: [feasibility_pump, graph_arc_lns, graph_cst_lns, graph_dec_lns, graph_var_lns, rins/rens, rnd_cst_lns, rnd_var_lns, scheduling_intervals_lns, scheduling_precedences_lns, scheduling_time_window_lns, violation_ls(2)]
3 helper subsolvers: [neighborhood_helper, synchronization_agent, update_gap_integral]
#Bound   0.19s best:inf   next:[126,4018] default_lp
#Bound   0.19s best:inf   next:[170,4018] default_lp
#Bound   0.21s best:inf   next:[171,4018] default_lp
#Bound   0.21s best:inf   next:[180,4018] objective_lb_search_no_lp
#Bound   0.22s best:inf   next:[181,4018] objective_lb_search_no_lp
#1       0.22s best:1725  next:[181,1724] quick_restart_no_lp (fixed_bools=0/109)
#Bound   0.22s best:1725  next:[279,1724] objective_lb_search_no_lp
#2       0.22s best:1661  next:[279,1660] no_lp (fixed_bools=0/108)
#Bound   0.23s best:1661  next:[280,1660] objective_lb_search_no_lp
#3       0.24s best:1651  next:[280,1650] no_lp (fixed_bools=0/111)
#Bound   0.24s best:1651  next:[290,1650] objective_lb_search_no_lp
#4       0.24s best:1636  next:[290,1635] no_lp (fixed_bools=0/113)
#5       0.24s best:1280  next:[290,1279] default_lp (fixed_bools=0/99)
#6       0.25s best:1253  next:[290,1252] violation_ls(batch:1 #solutions_imported:1 #lin_moves:1'737 #lin_evals:6'300 #weight_updates:230)
#Bound   0.27s best:1253  next:[336,1252] objective_lb_search_no_lp
#7       0.27s best:1251  next:[336,1250] violation_ls(batch:2 #solutions_imported:2 #lin_moves:1'737 #lin_evals:6'317 #gen_moves:13 #gen_evals:2 #comp_moves:1 #backtracks:6 #weight_updates:230)
#8       0.27s best:1250  next:[336,1249] violation_ls(batch:2 #solutions_imported:2 #lin_moves:0 #lin_evals:14'583 #gen_moves:7'206 #gen_evals:1'650 #comp_moves:650 #backtracks:3'276 #weight_updates:72)
#9       0.29s best:1232  next:[336,1231] graph_arc_lns (d=0.71 s=50 t=0.10 p=1.00 stall=1 h=auto_l0) [presolve]
#Bound   0.29s best:1232  next:[355,1231] objective_lb_search_no_lp
#10      0.30s best:1231  next:[355,1230] violation_ls(batch:3 #solutions_imported:3 #lin_moves:0 #lin_evals:15'183 #gen_moves:7'522 #gen_evals:1'690 #comp_moves:664 #backtracks:3'427 #weight_updates:77)
#11      0.31s best:1218  next:[355,1217] no_lp (fixed_bools=0/128)
#12      0.32s best:1215  next:[355,1214] rnd_var_lns (d=0.71 s=58 t=0.10 p=1.00 stall=0 h=auto_l0) [presolve]
#13      0.34s best:1214  next:[355,1213] violation_ls(batch:4 #solutions_imported:4 #lin_moves:1 #lin_evals:15'192 #gen_moves:7'522 #gen_evals:1'690 #comp_moves:664 #backtracks:3'427 #weight_updates:77)
#14      0.35s best:1208  next:[355,1207] no_lp (fixed_bools=0/141)
#Bound   0.37s best:1208  next:[362,1207] objective_lb_search_no_lp
#15      0.39s best:1205  next:[362,1204] no_lp (fixed_bools=0/156)
#16      0.40s best:1178  next:[362,1177] no_lp (fixed_bools=0/170)
#Bound   0.40s best:1178  next:[363,1177] objective_lb_search_no_lp
#Bound   0.41s best:1178  next:[364,1177] objective_lb_search_no_lp
#17      0.41s best:1177  next:[364,1176] no_lp (fixed_bools=0/172)
#18      0.41s best:1176  next:[364,1175] no_lp (fixed_bools=0/172)
#19      0.41s best:1175  next:[364,1174] no_lp (fixed_bools=0/172)
#20      0.41s best:1174  next:[364,1173] no_lp (fixed_bools=0/172)
#21      0.42s best:1173  next:[364,1172] graph_dec_lns (d=0.81 s=78 t=0.10 p=1.00 stall=2 h=auto_l0) [presolve]
#Bound   0.43s best:1173  next:[391,1172] objective_lb_search_no_lp
#22      0.44s best:1113  next:[391,1112] no_lp (fixed_bools=0/192)
#Bound   0.45s best:1113  next:[393,1112] objective_lb_search_no_lp
#23      0.45s best:1112  next:[393,1111] no_lp (fixed_bools=0/192)
#Bound   0.47s best:1112  next:[394,1111] objective_lb_search_no_lp
#Bound   0.49s best:1112  next:[398,1111] objective_lb_search_no_lp
#24      0.53s best:1105  next:[398,1104] no_lp (fixed_bools=0/214)
#Bound   0.55s best:1105  next:[401,1104] objective_lb_search_no_lp
#25      0.55s best:1100  next:[401,1099] no_lp (fixed_bools=0/221)
#26      0.56s best:1080  next:[401,1079] no_lp (fixed_bools=0/227)
#27      0.56s best:1076  next:[401,1075] no_lp (fixed_bools=0/228)
#28      0.57s best:1075  next:[401,1074] no_lp (fixed_bools=0/228)
#Bound   0.58s best:1075  next:[402,1074] objective_lb_search_no_lp
#Bound   0.64s best:1075  next:[411,1074] objective_lb_search_no_lp
#29      0.66s best:1057  next:[422,1056] quick_restart_no_lp (fixed_bools=0/285)
#30      0.67s best:988   next:[423,987]  default_lp (fixed_bools=0/181)
#31      0.72s best:983   next:[423,982]  quick_restart_no_lp (fixed_bools=0/350)
#32      0.75s best:978   next:[447,977]  quick_restart_no_lp (fixed_bools=0/356)
#33      0.81s best:811   next:[447,810]  graph_var_lns (d=0.91 s=96 t=0.10 p=1.00 stall=0 h=auto_l0)
#34      0.83s best:806   next:[447,805]  quick_restart_no_lp (fixed_bools=0/525)
#35      0.86s best:799   next:[450,798]  quick_restart_no_lp (fixed_bools=0/539)
#36      0.87s best:798   next:[450,797]  quick_restart_no_lp (fixed_bools=0/543)
#37      0.96s best:789   next:[458,788]  quick_restart (fixed_bools=0/122)
#38      0.97s best:749   next:[458,748]  scheduling_time_window_lns (d=0.50 s=41 t=0.10 p=0.00 stall=0 h=auto_l0)
#39      0.99s best:712   next:[458,711]  scheduling_precedences_lns (d=0.50 s=42 t=0.10 p=0.00 stall=0 h=auto_l0)
#Bound   0.88s best:798   next:[458,797]  objective_lb_search_no_lp [skipped_logs=6]
#Bound   1.71s best:712   next:[471,711]  objective_lb_search_max_lp [skipped_logs=3]
#Bound   2.94s best:712   next:[503,711]  objective_lb_search_no_lp [skipped_logs=6]
#Model   3.87s var:194/195 constraints:2451/2657
#Model   3.98s var:193/195 constraints:2442/2657
#Bound   3.91s best:712   next:[528,711]  objective_lb_search_no_lp [skipped_logs=7]
#Model   4.83s var:192/195 constraints:2366/2657
#Model   4.92s var:191/195 constraints:2357/2657
#Bound   4.95s best:712   next:[566,711]  objective_lb_search_no_lp [skipped_logs=8]
#Model   5.01s var:190/195 constraints:2248/2657
#Model   5.09s var:189/195 constraints:2220/2657
#Model   5.16s var:185/195 constraints:1776/2657
#Model   5.17s var:182/195 constraints:1714/2657
#Done    5.19s quick_restart_no_lp
#Done    5.19s no_lp
#Model   5.20s var:177/195 constraints:1411/2657
#Done    5.20s core
#Model   5.20s var:175/195 constraints:1299/2657
#Bound   5.19s best:712   next:[646,711]  objective_lb_search_no_lp [skipped_logs=4]

Task timing                                  n [     min,      max]      avg      dev     time         n [     min,      max]      avg      dev    dtime
                             'core':         1 [   5.00s,    5.00s]    5.00s   0.00ns    5.00s         1 [   5.54s,    5.54s]    5.54s   0.00ns    5.54s
                       'default_lp':         1 [   5.03s,    5.03s]    5.03s   0.00ns    5.03s         1 [   1.53s,    1.53s]    1.53s   0.00ns    1.53s
                 'feasibility_pump':        25 [ 10.97ms, 247.12ms]  54.10ms  45.35ms    1.35s        24 [  6.16ms,  21.65ms]  11.87ms   2.32ms 284.82ms
                            'fixed':         1 [   5.02s,    5.02s]    5.02s   0.00ns    5.02s         1 [   1.85s,    1.85s]    1.85s   0.00ns    1.85s
                  'fj_long_default':         1 [ 28.90ms,  28.90ms]  28.90ms   0.00ns  28.90ms         1 [ 21.64ms,  21.64ms]  21.64ms   0.00ns  21.64ms
              'fj_long_lin_default':         1 [ 69.24ms,  69.24ms]  69.24ms   0.00ns  69.24ms         1 [ 82.08ms,  82.08ms]  82.08ms   0.00ns  82.08ms
                   'fj_long_random':         1 [ 85.09ms,  85.09ms]  85.09ms   0.00ns  85.09ms         1 [ 70.31ms,  70.31ms]  70.31ms   0.00ns  70.31ms
                 'fj_short_default':         1 [ 55.08ms,  55.08ms]  55.08ms   0.00ns  55.08ms         1 [ 80.08ms,  80.08ms]  80.08ms   0.00ns  80.08ms
             'fj_short_lin_default':         1 [ 91.13ms,  91.13ms]  91.13ms   0.00ns  91.13ms         1 [ 79.72ms,  79.72ms]  79.72ms   0.00ns  79.72ms
              'fj_short_lin_random':         1 [ 76.92ms,  76.92ms]  76.92ms   0.00ns  76.92ms         1 [ 83.29ms,  83.29ms]  83.29ms   0.00ns  83.29ms
                  'fj_short_random':         1 [ 75.93ms,  75.93ms]  75.93ms   0.00ns  75.93ms         1 [ 80.68ms,  80.68ms]  80.68ms   0.00ns  80.68ms
                        'fs_random':         1 [ 19.05ms,  19.05ms]  19.05ms   0.00ns  19.05ms         1 [  1.81us,   1.81us]   1.81us   0.00ns   1.81us
                        'fs_random':         1 [ 22.26ms,  22.26ms]  22.26ms   0.00ns  22.26ms         1 [ 20.00ns,  20.00ns]  20.00ns   0.00ns  20.00ns
                  'fs_random_no_lp':         1 [ 20.06ms,  20.06ms]  20.06ms   0.00ns  20.06ms         1 [281.55us, 281.55us] 281.55us   0.00ns 281.55us
          'fs_random_quick_restart':         1 [ 19.83ms,  19.83ms]  19.83ms   0.00ns  19.83ms         1 [ 20.00ns,  20.00ns]  20.00ns   0.00ns  20.00ns
          'fs_random_quick_restart':         1 [ 21.69ms,  21.69ms]  21.69ms   0.00ns  21.69ms         1 [ 20.00ns,  20.00ns]  20.00ns   0.00ns  20.00ns
    'fs_random_quick_restart_no_lp':         1 [ 21.92ms,  21.92ms]  21.92ms   0.00ns  21.92ms         1 [142.66us, 142.66us] 142.66us   0.00ns 142.66us
                    'graph_arc_lns':        24 [  9.40ms, 538.72ms] 269.27ms 189.05ms    6.46s        23 [ 10.00ns, 100.13ms]  48.88ms  42.85ms    1.12s
                    'graph_cst_lns':        24 [891.29us,  17.25ms]   4.66ms   5.41ms 111.72ms         5 [ 10.00ns,  30.36us]   6.93us  11.83us  34.67us
                    'graph_dec_lns':        24 [  6.96ms, 504.61ms] 220.43ms 168.56ms    5.29s        23 [ 10.00ns, 100.20ms]  37.24ms  40.48ms 856.42ms
                    'graph_var_lns':        24 [ 22.07ms, 542.24ms] 269.75ms 181.11ms    6.47s        24 [ 10.00ns, 100.15ms]  43.85ms  42.15ms    1.05s
                   'lb_tree_search':         1 [   5.00s,    5.00s]    5.00s   0.00ns    5.00s         1 [   2.74s,    2.74s]    2.74s   0.00ns    2.74s
                           'max_lp':         1 [   5.00s,    5.00s]    5.00s   0.00ns    5.00s         1 [   2.02s,    2.02s]    2.02s   0.00ns    2.02s
                            'no_lp':         1 [   5.00s,    5.00s]    5.00s   0.00ns    5.00s         1 [   1.32s,    1.32s]    1.32s   0.00ns    1.32s
              'objective_lb_search':         1 [   5.00s,    5.00s]    5.00s   0.00ns    5.00s         1 [   1.73s,    1.73s]    1.73s   0.00ns    1.73s
       'objective_lb_search_max_lp':         1 [   5.00s,    5.00s]    5.00s   0.00ns    5.00s         1 [   2.71s,    2.71s]    2.71s   0.00ns    2.71s
        'objective_lb_search_no_lp':         1 [   5.00s,    5.00s]    5.00s   0.00ns    5.00s         1 [   1.15s,    1.15s]    1.15s   0.00ns    1.15s
  'objective_shaving_search_max_lp':        25 [  3.98ms, 337.03ms] 118.52ms 100.32ms    2.96s        18 [718.84us,  78.96ms]  20.06ms  23.62ms 360.99ms
   'objective_shaving_search_no_lp':        25 [ 30.81ms, 346.90ms] 115.63ms  94.50ms    2.89s        22 [  1.14ms,  62.54ms]  14.07ms  19.95ms 309.47ms
                          'probing':         1 [   5.01s,    5.01s]    5.01s   0.00ns    5.01s         1 [593.96ms, 593.96ms] 593.96ms   0.00ns 593.96ms
                   'probing_max_lp':         1 [   5.00s,    5.00s]    5.00s   0.00ns    5.00s         1 [   1.29s,    1.29s]    1.29s   0.00ns    1.29s
                     'pseudo_costs':         1 [   5.00s,    5.00s]    5.00s   0.00ns    5.00s         1 [   1.91s,    1.91s]    1.91s   0.00ns    1.91s
                    'quick_restart':         1 [   5.00s,    5.00s]    5.00s   0.00ns    5.00s         1 [   1.68s,    1.68s]    1.68s   0.00ns    1.68s
              'quick_restart_no_lp':         1 [   4.99s,    4.99s]    4.99s   0.00ns    4.99s         1 [   1.35s,    1.35s]    1.35s   0.00ns    1.35s
                    'reduced_costs':         1 [   5.00s,    5.00s]    5.00s   0.00ns    5.00s         1 [   1.80s,    1.80s]    1.80s   0.00ns    1.80s
                        'rins/rens':        25 [ 61.84us, 507.13ms] 237.36ms 182.41ms    5.93s        21 [ 10.00ns, 102.28ms]  60.40ms  38.81ms    1.27s
                      'rnd_cst_lns':        24 [  6.29ms, 525.48ms] 257.02ms 191.30ms    6.17s        22 [ 10.00ns, 100.15ms]  48.50ms  41.82ms    1.07s
                      'rnd_var_lns':        24 [ 10.78ms, 491.68ms] 223.50ms 158.58ms    5.36s        23 [ 10.00ns, 100.18ms]  41.87ms  40.79ms 962.94ms
         'scheduling_intervals_lns':        24 [ 94.87ms, 860.64ms] 528.97ms 165.41ms   12.70s        23 [ 55.71ms, 100.22ms]  95.88ms  11.94ms    2.21s
       'scheduling_precedences_lns':        24 [ 91.56ms,    1.01s] 545.28ms 195.51ms   13.09s        23 [ 41.31ms, 102.15ms]  97.28ms  12.08ms    2.24s
       'scheduling_time_window_lns':        24 [ 94.10ms, 886.76ms] 514.75ms 154.17ms   12.35s        23 [ 55.28ms, 100.23ms]  96.97ms  10.12ms    2.23s
                     'violation_ls':        25 [  1.24ms, 139.26ms]  61.37ms  27.54ms    1.53s        25 [770.00ns, 102.35ms]  79.67ms  32.34ms    1.99s
                     'violation_ls':        25 [459.64us,  67.75ms]  28.42ms  15.68ms 710.47ms        25 [ 61.93us, 159.22ms]  41.82ms  32.81ms    1.05s

Search stats                        Bools  Conflicts  Branches  Restarts  BoolPropag  IntegerPropag
                           'core':  3'089      4'981    10'157     1'841   6'309'558      2'441'792
                     'default_lp':    468      4'235    21'656     4'492     786'229      2'486'914
                          'fixed':    854     21'897    62'858       347   2'664'935      4'144'361
                      'fs_random':     65          0       130       130          18          2'022
                      'fs_random':     65          0       130       130          18          2'022
                'fs_random_no_lp':     77          8       142       130         159          2'957
        'fs_random_quick_restart':     65          0       130       130          18          2'022
        'fs_random_quick_restart':     65          0       130       130          18          2'022
  'fs_random_quick_restart_no_lp':     65          0       156       130          21          2'452
                 'lb_tree_search':     75         73    14'447     4'159      21'229        573'405
                         'max_lp':     65      2'197    11'561     2'673      54'746      1'395'064
                          'no_lp':    712      8'509    24'142     3'083   1'677'543      4'256'124
            'objective_lb_search':     91      2'742    17'121     4'835      76'747      2'090'454
     'objective_lb_search_max_lp':     94      1'620    10'273     3'386      50'877      1'127'556
      'objective_lb_search_no_lp':    171      8'182    17'911     2'557     175'149      3'925'188
                        'probing':    237         90       384       384       3'870         27'898
                 'probing_max_lp':    157         37       277       277         918          9'936
                   'pseudo_costs':    226      2'173    18'113     4'381     199'319      1'764'768
                  'quick_restart':    467      1'976    21'844     4'769     409'143      1'660'166
            'quick_restart_no_lp':  1'367      4'595    36'317     5'363   2'606'222      3'671'553
                  'reduced_costs':    305      2'120    21'112     3'566     575'369      1'840'043

SAT stats                           ClassicMinim  LitRemoved  LitLearned  LitForgotten  Subsumed  MClauses  MDecisions  MLitTrue  MSubsumed  MLitRemoved  MReused
                           'core':         4'421      23'514      22'638             0        21       558       2'716         0        105          327       18
                     'default_lp':         2'647       7'479      36'968             0       173     1'842      11'816         1        997        6'412      155
                          'fixed':        13'692      24'604     320'151       170'204        16         8          46         0          0            0        0
                      'fs_random':             0           0           0             0         0         0           0         0          0            0        0
                      'fs_random':             0           0           0             0         0         0           0         0          0            0        0
                'fs_random_no_lp':             0           0          47             0         0         0           0         0          0            0        0
        'fs_random_quick_restart':             0           0           0             0         0         0           0         0          0            0        0
        'fs_random_quick_restart':             0           0           0             0         0         0           0         0          0            0        0
  'fs_random_quick_restart_no_lp':             0           0           0             0         0         0           0         0          0            0        0
                 'lb_tree_search':             7           9         307             0         0     1'122       5'725         0          5           20       82
                         'max_lp':         1'415       3'864      16'669             0       165     1'174       8'212         0        300        1'770      184
                          'no_lp':         5'945      18'323      81'141             0       193     1'256       9'412         0        610        4'225      123
            'objective_lb_search':         2'075       5'581      18'808             0       133     1'401      10'406         0        198        1'121      483
     'objective_lb_search_max_lp':         1'162       3'121      10'556             0       112       646       5'065         0        111          627      201
      'objective_lb_search_no_lp':         6'397      20'119      53'137             0       292     1'107       7'315         0        546        3'062      199
                        'probing':             0           0          90             0         0         0           0         0          0            0        0
                 'probing_max_lp':             0           0          37             0         0         0           0         0          0            0        0
                   'pseudo_costs':         1'272       3'099      20'126             0       137     1'431      11'266         0        331        1'976      274
                  'quick_restart':         1'094       3'023      16'585             0        97     1'447      13'019         5        464        3'165      324
            'quick_restart_no_lp':         2'303       6'011      32'822             0       165     3'074      27'680         0      1'710       12'332      699
                  'reduced_costs':         1'207       3'168      17'205             0       183     1'803      15'402         0        550        3'497      415

Lp stats                         Component  Iterations  AddedCuts  OPTIMAL  DUAL_F.  DUAL_U.
                  'default_lp':          1      36'424      2'719    5'357        0        0
                       'fixed':          1       4'005      1'024   20'800        0        0
                   'fs_random':          1           0          0        0        0        0
                   'fs_random':          1          56         63        3        0        0
     'fs_random_quick_restart':          1           0          0        0        0        0
     'fs_random_quick_restart':          1          33          0        1        1        0
              'lb_tree_search':          1      64'097      3'365    4'063    1'251        0
                      'max_lp':          1      46'094      3'123    2'991    1'055        1
         'objective_lb_search':          1      52'685      2'513    4'865        0        0
  'objective_lb_search_max_lp':          1      65'481      3'026    2'862    1'078        4
                     'probing':          1       4'858      3'124    1'022        0        1
              'probing_max_lp':          1       4'225      3'169      525       15        0
                'pseudo_costs':          1      45'139      3'570    3'236      870        0
               'quick_restart':          1      36'542      3'723    4'104        0        0
               'reduced_costs':          1      37'430      3'871    2'513      692        0

Lp dimension                                                                     Final dimension of first component
                  'default_lp':  368 rows, 192 columns, 1482 entries with magnitude in [8.139648e-03, 1.000000e+00]
                       'fixed':    89 rows, 192 columns, 276 entries with magnitude in [6.429007e-02, 1.000000e+00]
                   'fs_random':       0 rows, 192 columns, 0 entries with magnitude in [0.000000e+00, 0.000000e+00]
                   'fs_random':    57 rows, 192 columns, 195 entries with magnitude in [4.299336e-02, 1.000000e+00]
     'fs_random_quick_restart':       0 rows, 192 columns, 0 entries with magnitude in [0.000000e+00, 0.000000e+00]
     'fs_random_quick_restart':    56 rows, 192 columns, 191 entries with magnitude in [6.835267e-02, 1.000000e+00]
              'lb_tree_search':  583 rows, 195 columns, 2324 entries with magnitude in [8.648363e-04, 1.000000e+00]
                      'max_lp':  972 rows, 195 columns, 3738 entries with magnitude in [1.363620e-03, 1.000000e+00]
         'objective_lb_search':  280 rows, 192 columns, 1058 entries with magnitude in [2.368897e-04, 1.000000e+00]
  'objective_lb_search_max_lp':  608 rows, 195 columns, 2430 entries with magnitude in [6.467019e-03, 1.000000e+00]
                     'probing':  309 rows, 192 columns, 1406 entries with magnitude in [9.870195e-04, 1.000000e+00]
              'probing_max_lp':  591 rows, 195 columns, 7508 entries with magnitude in [4.871117e-04, 1.000000e+00]
                'pseudo_costs':  502 rows, 195 columns, 1001 entries with magnitude in [9.221318e-03, 1.000000e+00]
               'quick_restart':  449 rows, 192 columns, 1975 entries with magnitude in [2.588721e-04, 1.000000e+00]
               'reduced_costs':  854 rows, 195 columns, 2082 entries with magnitude in [4.688794e-04, 1.000000e+00]

Lp debug                         CutPropag  CutEqPropag  Adjust  Overflow      Bad  BadScaling
                  'default_lp':          1            0   2'807         0   32'716           0
                       'fixed':          0            0       6         0    1'865           0
                   'fs_random':          0            0       0         0        0           0
                   'fs_random':          0            0       0         0        4           0
     'fs_random_quick_restart':          0            0       0         0        0           0
     'fs_random_quick_restart':          0            0       0         0        0           0
              'lb_tree_search':          3            0   3'203         0   30'661           0
                      'max_lp':         24            1   1'817         0   23'191           0
         'objective_lb_search':          1           10   2'883         0   44'775           0
  'objective_lb_search_max_lp':         12           19   2'300         0   36'679           0
                     'probing':          2           22     879         0  583'229           0
              'probing_max_lp':         12            0     522         0  282'908           0
                'pseudo_costs':         29            4   1'760         0   32'223           0
               'quick_restart':         11           11   2'636         0   93'126           0
               'reduced_costs':         24            4   2'007         0   38'821           0

Lp pool                          Constraints  Updates  Simplif  Merged  Shortened  Split  Strenghtened    Cuts/Call
                  'default_lp':        2'939      221    5'288      24        162    672         2'235  2'719/6'253
                       'fixed':        1'268       13       30       0          0     13           126  1'024/1'622
                   'fs_random':          244        0        0       0          0      0            14          0/0
                   'fs_random':          307        0        0       0          0      0            16        63/80
     'fs_random_quick_restart':          244        0        0       0          0      0            14          0/0
     'fs_random_quick_restart':          244        0        0       0          0      0            14          0/0
              'lb_tree_search':        5'998      352   23'136      18      4'572    420        24'358  3'365/7'850
                      'max_lp':        5'757      344   25'826      17      5'319    229        25'093  3'123/6'873
         'objective_lb_search':        2'757      295    5'315       0        733    686         2'474  2'513/5'766
  'objective_lb_search_max_lp':        5'672      292   23'331       5      2'465    460        20'929  3'026/6'797
                     'probing':        3'364      411    3'945       4        264  1'879         1'442  3'124/5'523
              'probing_max_lp':        5'817      284    6'168       3          0    841         8'177  3'169/6'612
                'pseudo_costs':        6'182      335   32'473      39      6'370    494        29'392  3'570/7'996
               'quick_restart':        3'962      476   18'392       5      1'198  4'833         4'601  3'723/7'683
               'reduced_costs':        6'508      354   37'875      14      6'260    484        30'848  3'871/8'713

Lp Cut                                         fs_ran  defaul  fixed  max_lp  quick_  reduce  pseudo  lb_tre  probin  object  probin  object
                                       CG_FF:       -     169     97     179     226     152     170     148     114     166     133     135
                                        CG_K:       -      68     53      99      87     100      99      94      59      96      78      56
                                        CG_R:       -      49     60     109     128     113     106     116      69      78     103      72
                                       CG_RB:       -     586    179     521     648     459     435     549     771     470     401     358
                                      CG_RBP:       -      58     18      65      87      62      53      44     123      63      49      52
                                      Clique:       -       -      -      39       -      31      33      31       -       -       8      33
                                          IB:      50     513    256     285     510     384     416     282     380     437      92     382
                                    MIR_1_FF:       8     132     64     227     178     196     192     191     116     123     159     172
                                     MIR_1_K:       -      12      9      45      29      36      29      39      10      12      19      17
                                    MIR_1_KL:       -       -      -       -       1       -       2       -       -       -       -       -
                                     MIR_1_R:       2      16     18      14      25      21      27      13      22      18       7      20
                                    MIR_1_RB:       1     210     66     261     278     365     331     321     213     158     275     268
                                   MIR_1_RBP:       -       8      4      31      12      36      41      46       9      10      28      24
                                   MIR_1_RLT:       -       -      -       -       -       4       2       2       -       -       2       3
                                    MIR_2_FF:       1      76     16     136      92     158     136     112      73      53      90     120
                                     MIR_2_K:       1      15      7      27      20      41      34      21      10      14      14      22
                                    MIR_2_KL:       -       -      -       1       1       1       -       -       -       -       -       -
                                     MIR_2_R:       -      21      4      27      31      57      64      36      30      17      45      45
                                    MIR_2_RB:       -     156     41     121     186     185     192     163     162      99     141     143
                                   MIR_2_RBP:       -       9      2      12      30      19      21      24      19      15      18      12
                                    MIR_3_FF:       -      47     10      72      84     111     116      88      56      35      53      81
                                     MIR_3_K:       -       9      1      26      19      39      27      20      14      13      13      14
                                    MIR_3_KL:       -       -      1       -       1       -       -       -       1       -       -       -
                                     MIR_3_R:       -      20      2      24      46      53      47      50      45      23      38      38
                                    MIR_3_RB:       -      83     16      77     133     146     119     120     107      69     105      91
                                   MIR_3_RBP:       -       7      1       9      18      21      23       7      10       7       5      12
                                    MIR_4_FF:       -      20      9      36      47      58      41      40      25      25      26      39
                                     MIR_4_K:       -      14      5      14      17      31      22      12      13      13      13      16
                                     MIR_4_R:       -      11      4      17      32      28      22      22      25      27      18      18
                                    MIR_4_RB:       -      47     10      45      83      87      56      56      86      48      56      56
                                   MIR_4_RBP:       -       2      1       6       6       8       5       8       7       6       4       6
                                    MIR_5_FF:       -      14      2      34      37      34      22      23      27      18      12      17
                                     MIR_5_K:       -       5      1       8       9      12      13      12       6       7       5       8
                                    MIR_5_KL:       -       -      -       1       -       1       -       -       -       -       -       -
                                     MIR_5_R:       -       7      3      16      25      25      23      12      20      14      12       8
                                    MIR_5_RB:       -      26     10      31      50      52      40      32      36      32      30      28
                                   MIR_5_RBP:       -       2      -       6       8       9       9       7       4       6       2       5
                                    MIR_6_FF:       -       2      1      14      11      16      17      22       8       6       4      11
                                     MIR_6_K:       -       6      1       6       6       9       5       9       6       7       2       5
                                     MIR_6_R:       -       2      1       7       8      14      16      13      10       3       6       6
                                    MIR_6_RB:       -      16      2      16      20      30      35      21      24      12      14      17
                                   MIR_6_RBP:       -       1      -       3       1       3       -       5       -       4       3       1
  NoOverlapCompletionTimeExhaustive_weighted:       -       -      -       6       -       7      10       4       -       -       4       6
                 NoOverlapDisjunctionOnStart:       -       -      -       6       -       5       6       5       -       -       5       4
                                ZERO_HALF_FF:       -      25     11      31      40      48      31      22      29      28      13      49
                                 ZERO_HALF_K:       -       4      1      12       4      23      11      14       1       9       6      12
                                ZERO_HALF_KL:       -       -      1       -       -       -       -       -       -       -       -       -
                                 ZERO_HALF_R:       -     172     17     309     307     451     364     382     252     170     957     445
                                ZERO_HALF_RB:       -      69     15      82     107     126      96     115     117      75      85      94
                               ZERO_HALF_RBP:       -      10      4      10      35       4      11      12      15      27      16       5

LNS stats                        Improv/Calls  Closed  Difficulty  TimeLimit
               'graph_arc_lns':          4/24     67%        0.98       0.10
               'graph_cst_lns':           3/7    100%        0.97       0.10
               'graph_dec_lns':          3/24     71%        0.99       0.10
               'graph_var_lns':          3/24     67%        0.98       0.10
                   'rins/rens':          4/23     61%        0.92       0.10
                 'rnd_cst_lns':          1/23     65%        0.97       0.10
                 'rnd_var_lns':          2/24     67%        0.98       0.10
    'scheduling_intervals_lns':          5/24      8%        0.00       0.10
  'scheduling_precedences_lns':          5/24      8%        0.00       0.10
  'scheduling_time_window_lns':          5/24      8%        0.00       0.10

LS stats                   Batches  Restarts  LinMoves  GenMoves  CompoundMoves  WeightUpdates
       'fj_long_default':        1         1     2'288         0              0            104
   'fj_long_lin_default':        1         1         0     2'327            203              0
        'fj_long_random':        1         1     9'367         0              0            405
      'fj_short_default':        1         1         0     2'139            240              0
  'fj_short_lin_default':        1         1         0     2'407            335              1
   'fj_short_lin_random':        1         1         0     2'350            218              1
       'fj_short_random':        1         1         0     2'368            288              2
          'violation_ls':       25         0   196'789     7'522            664          6'377
          'violation_ls':       25         0    98'426    15'206            869         95'725

Solutions (39)                   Num     Rank
                  'default_lp':    2   [5,30]
               'graph_arc_lns':    1    [9,9]
               'graph_dec_lns':    1  [21,21]
               'graph_var_lns':    1  [33,33]
                       'no_lp':   18   [2,28]
               'quick_restart':    1  [37,37]
         'quick_restart_no_lp':    7   [1,36]
                 'rnd_var_lns':    1  [12,12]
  'scheduling_precedences_lns':    1  [39,39]
  'scheduling_time_window_lns':    1  [38,38]
                'violation_ls':    5   [6,13]

Objective bounds                     Num
                      'default_lp':    3
                  'initial_domain':    1
             'objective_lb_search':    4
      'objective_lb_search_max_lp':    1
       'objective_lb_search_no_lp':   51
  'objective_shaving_search_no_lp':    1

Solution repositories    Added  Queried  Ignored  Synchro
  'feasible solutions':    215      552        4      194
        'lp solutions':     87       10        0       67
                'pump':    490       15

Improving bounds shared            Num
                        'core':     27
                  'default_lp':     66
              'lb_tree_search':     19
                      'max_lp':     17
                       'no_lp':    310
         'objective_lb_search':    140
  'objective_lb_search_max_lp':     11
                     'probing':    113
              'probing_max_lp':     23
                'pseudo_costs':    115
               'quick_restart':    179
         'quick_restart_no_lp':  3'360
               'reduced_costs':     58

Clauses shared                   Num
                        'core':    2
                  'default_lp':   26
              'lb_tree_search':    9
                      'max_lp':   46
                       'no_lp':   35
         'objective_lb_search':    7
  'objective_lb_search_max_lp':   17
   'objective_lb_search_no_lp':    3
                'pseudo_costs':   23
               'quick_restart':    7
         'quick_restart_no_lp':    3
               'reduced_costs':    3

CpSolverResponse summary:
status: OPTIMAL
objective: 712
best_bound: 712
integers: 194
booleans: 65
conflicts: 0
branches: 130
propagations: 18
integer_propagations: 2022
restarts: 130
lp_iterations: 33
walltime: 5.23608
usertime: 5.23608
deterministic_time: 46.7272
gap_integral: 103.219
solution_fingerprint: 0xaa11bbb134e65794


--- Simulation Gantt  partir du modle mathmatique ---
