created virtual environment CPython3.12.4.final.0-64 in 11136ms
  creator CPython3Posix(dest=/localscratch/aneumann.63393122.0/env, clear=False, no_vcs_ignore=False, global=False)
  seeder FromAppData(download=False, pip=bundle, via=copy, app_data_dir=/home/aneumann/.local/share/virtualenv)
    added seed packages: pip==25.1.1
  activators BashActivator,CShellActivator,FishActivator,NushellActivator,PowerShellActivator,PythonActivator
Looking in links: /cvmfs/soft.computecanada.ca/custom/python/wheelhouse/gentoo2023/x86-64-v3, /cvmfs/soft.computecanada.ca/custom/python/wheelhouse/gentoo2023/generic, /cvmfs/soft.computecanada.ca/custom/python/wheelhouse/generic
Requirement already satisfied: pip in /localscratch/aneumann.63393122.0/env/lib/python3.12/site-packages (25.1.1)
Looking in links: /cvmfs/soft.computecanada.ca/custom/python/wheelhouse/gentoo2023/x86-64-v3, /cvmfs/soft.computecanada.ca/custom/python/wheelhouse/gentoo2023/generic, /cvmfs/soft.computecanada.ca/custom/python/wheelhouse/generic
ERROR: protobuf-5.28.3-cp38-abi3-manylinux2014_x86_64.whl is not a supported wheel on this platform.
Looking in links: /cvmfs/soft.computecanada.ca/custom/python/wheelhouse/gentoo2023/x86-64-v3, /cvmfs/soft.computecanada.ca/custom/python/wheelhouse/gentoo2023/generic, /cvmfs/soft.computecanada.ca/custom/python/wheelhouse/generic
Processing /home/aneumann/projects/def-adhaj/aneumann/GNRS/wheels/immutabledict-4.2.0-py3-none-any.whl
Installing collected packages: immutabledict
Successfully installed immutabledict-4.2.0
Looking in links: /cvmfs/soft.computecanada.ca/custom/python/wheelhouse/gentoo2023/x86-64-v3, /cvmfs/soft.computecanada.ca/custom/python/wheelhouse/gentoo2023/generic, /cvmfs/soft.computecanada.ca/custom/python/wheelhouse/generic
Processing /cvmfs/soft.computecanada.ca/custom/python/wheelhouse/generic/ortools-9.10.4067+computecanada-cp312-cp312-linux_x86_64.whl (from -r /home/aneumann/projects/def-adhaj/aneumann/GNRS/requirements/or.txt (line 1))
Processing /cvmfs/soft.computecanada.ca/custom/python/wheelhouse/gentoo2023/x86-64-v3/matplotlib-3.10.0+computecanada-cp312-cp312-linux_x86_64.whl (from -r /home/aneumann/projects/def-adhaj/aneumann/GNRS/requirements/or.txt (line 2))
Processing /cvmfs/soft.computecanada.ca/custom/python/wheelhouse/gentoo2023/x86-64-v3/pandas-2.2.3+computecanada-cp312-cp312-linux_x86_64.whl (from -r /home/aneumann/projects/def-adhaj/aneumann/GNRS/requirements/or.txt (line 3))
Processing /cvmfs/soft.computecanada.ca/custom/python/wheelhouse/generic/absl_py-2.2.2+computecanada-py3-none-any.whl (from ortools<9.11,>=9.10->-r /home/aneumann/projects/def-adhaj/aneumann/GNRS/requirements/or.txt (line 1))
Processing /cvmfs/soft.computecanada.ca/custom/python/wheelhouse/gentoo2023/generic/numpy-2.2.2+computecanada-cp312-cp312-linux_x86_64.whl (from ortools<9.11,>=9.10->-r /home/aneumann/projects/def-adhaj/aneumann/GNRS/requirements/or.txt (line 1))
Processing /cvmfs/soft.computecanada.ca/custom/python/wheelhouse/gentoo2023/x86-64-v3/protobuf-6.30.2+computecanada-cp312-cp312-linux_x86_64.whl (from ortools<9.11,>=9.10->-r /home/aneumann/projects/def-adhaj/aneumann/GNRS/requirements/or.txt (line 1))
Requirement already satisfied: immutabledict>=3.0.0 in /localscratch/aneumann.63393122.0/env/lib/python3.12/site-packages (from ortools<9.11,>=9.10->-r /home/aneumann/projects/def-adhaj/aneumann/GNRS/requirements/or.txt (line 1)) (4.2.0)
Processing /cvmfs/soft.computecanada.ca/custom/python/wheelhouse/gentoo2023/generic/contourpy-1.3.1+computecanada-cp312-cp312-linux_x86_64.whl (from matplotlib->-r /home/aneumann/projects/def-adhaj/aneumann/GNRS/requirements/or.txt (line 2))
Processing /cvmfs/soft.computecanada.ca/custom/python/wheelhouse/generic/cycler-0.12.1+computecanada-py3-none-any.whl (from matplotlib->-r /home/aneumann/projects/def-adhaj/aneumann/GNRS/requirements/or.txt (line 2))
Processing /cvmfs/soft.computecanada.ca/custom/python/wheelhouse/generic/fonttools-4.58.2+computecanada-cp312-cp312-linux_x86_64.whl (from matplotlib->-r /home/aneumann/projects/def-adhaj/aneumann/GNRS/requirements/or.txt (line 2))
Processing /cvmfs/soft.computecanada.ca/custom/python/wheelhouse/gentoo2023/x86-64-v3/kiwisolver-1.4.8+computecanada-cp312-cp312-linux_x86_64.whl (from matplotlib->-r /home/aneumann/projects/def-adhaj/aneumann/GNRS/requirements/or.txt (line 2))
Processing /cvmfs/soft.computecanada.ca/custom/python/wheelhouse/generic/packaging-25.0+computecanada-py3-none-any.whl (from matplotlib->-r /home/aneumann/projects/def-adhaj/aneumann/GNRS/requirements/or.txt (line 2))
Processing /cvmfs/soft.computecanada.ca/custom/python/wheelhouse/gentoo2023/x86-64-v3/pillow-11.1.0+computecanada-cp312-cp312-linux_x86_64.whl (from matplotlib->-r /home/aneumann/projects/def-adhaj/aneumann/GNRS/requirements/or.txt (line 2))
Processing /cvmfs/soft.computecanada.ca/custom/python/wheelhouse/generic/pyparsing-3.2.1+computecanada-py3-none-any.whl (from matplotlib->-r /home/aneumann/projects/def-adhaj/aneumann/GNRS/requirements/or.txt (line 2))
Processing /cvmfs/soft.computecanada.ca/custom/python/wheelhouse/generic/python_dateutil-2.9.0.post0+computecanada-py2.py3-none-any.whl (from matplotlib->-r /home/aneumann/projects/def-adhaj/aneumann/GNRS/requirements/or.txt (line 2))
Processing /cvmfs/soft.computecanada.ca/custom/python/wheelhouse/generic/pytz-2025.2+computecanada-py2.py3-none-any.whl (from pandas->-r /home/aneumann/projects/def-adhaj/aneumann/GNRS/requirements/or.txt (line 3))
Processing /cvmfs/soft.computecanada.ca/custom/python/wheelhouse/generic/tzdata-2025.2+computecanada-py2.py3-none-any.whl (from pandas->-r /home/aneumann/projects/def-adhaj/aneumann/GNRS/requirements/or.txt (line 3))
Processing /cvmfs/soft.computecanada.ca/custom/python/wheelhouse/generic/six-1.17.0+computecanada-py2.py3-none-any.whl (from python-dateutil>=2.7->matplotlib->-r /home/aneumann/projects/def-adhaj/aneumann/GNRS/requirements/or.txt (line 2))
Installing collected packages: pytz, tzdata, six, pyparsing, protobuf, pillow, packaging, numpy, kiwisolver, fonttools, cycler, absl-py, python-dateutil, contourpy, pandas, matplotlib, ortools

Successfully installed absl-py-2.2.2+computecanada contourpy-1.3.1+computecanada cycler-0.12.1+computecanada fonttools-4.58.2+computecanada kiwisolver-1.4.8+computecanada matplotlib-3.10.0+computecanada numpy-2.2.2+computecanada ortools-9.10.4067+computecanada packaging-25.0+computecanada pandas-2.2.3+computecanada pillow-11.1.0+computecanada protobuf-6.30.2+computecanada pyparsing-3.2.1+computecanada python-dateutil-2.9.0.post0+computecanada pytz-2025.2+computecanada six-1.17.0+computecanada tzdata-2025.2+computecanada

Starting CP-SAT solver v9.10.4067
Parameters: max_time_in_seconds: 3600 max_memory_in_mb: 12000 log_search_progress: true enumerate_all_solutions: false absolute_gap_limit: 0 relative_gap_limit: 0
Setting number of workers to 48

Initial optimization model '': (model_fingerprint: 0x1af742cfec34ef6f)
#Variables: 189 (#ints: 6 in objective)
  - 126 Booleans in [0,1]
  - 63 in [0,361]
#kLinear1: 29
#kLinear2: 253
#kLinear3: 81
#kLinearN: 875 (#terms: 8'371)

Starting presolve at 0.00s
  2.84e-04s  0.00e+00d  [DetectDominanceRelations] 
  1.03e-02s  0.00e+00d  [PresolveToFixPoint] #num_loops=6 #num_dual_strengthening=3 
  1.82e-05s  0.00e+00d  [ExtractEncodingFromLinear] #potential_supersets=1 
[Symmetry] Graph for symmetry has 1'012 nodes and 3'918 arcs.
[Symmetry] Symmetry computation done. time: 0.000580763 dtime: 0.00038581
[Symmetry] #generators: 1, average support size: 12
[Symmetry] The model contains 137 duplicate constraints !
[Symmetry] 6 orbits with sizes: 2,2,2,2,2,2
[Symmetry] Num fixable by intersecting at_most_one with orbits: 1 largest_orbit: 2
  2.05e-03s  1.82e-04d  [Probe] #probed=154 #fixed_bools=3 #new_bounds=17 #equiv=1 
  3.45e-05s  0.00e+00d  [MaxClique] Merged 12(24 literals) into 7(14 literals) at_most_ones. 
  2.53e-04s  0.00e+00d  [DetectDominanceRelations] 
  4.29e-03s  0.00e+00d  [PresolveToFixPoint] #num_loops=4 #num_dual_strengthening=3 
  7.35e-04s  0.00e+00d  [ProcessAtMostOneAndLinear] 
  6.98e-04s  0.00e+00d  [DetectDuplicateConstraints] #duplicates=169 #without_enforcements=66 
  2.27e-04s  6.65e-06d  [DetectDominatedLinearConstraints] #relevant_constraints=305 #num_inclusions=87 #num_redundant=1 
  1.47e-04s  0.00e+00d  [DetectDifferentVariables] #different=27 
  5.27e-05s  0.00e+00d  [ProcessSetPPC] #relevant_constraints=175 
  1.19e-05s  0.00e+00d  [FindAlmostIdenticalLinearConstraints] 
  8.79e-06s  0.00e+00d  [FindBigAtMostOneAndLinearOverlap] 
  4.99e-04s  1.63e-04d  [FindBigVerticalLinearOverlap] #blocks=2 #saved_nz=96 
  4.39e-05s  6.74e-06d  [FindBigHorizontalLinearOverlap] #linears=173 
  5.35e-06s  0.00e+00d  [MergeClauses] 
  2.37e-04s  0.00e+00d  [DetectDominanceRelations] 
  2.73e-03s  0.00e+00d  [PresolveToFixPoint] #num_loops=2 #num_dual_strengthening=1 
  2.34e-04s  0.00e+00d  [DetectDominanceRelations] 
  2.17e-03s  0.00e+00d  [PresolveToFixPoint] #num_loops=1 #num_dual_strengthening=1 
[Symmetry] Graph for symmetry has 810 nodes and 3'183 arcs.
[Symmetry] Symmetry computation done. time: 0.000167456 dtime: 0.00020079
  1.65e-03s  1.66e-04d  [Probe] #probed=148 #new_bounds=13 
  6.16e-06s  0.00e+00d  [MaxClique] 
  2.42e-04s  0.00e+00d  [DetectDominanceRelations] 
  3.20e-03s  0.00e+00d  [PresolveToFixPoint] #num_loops=2 #num_dual_strengthening=1 
  6.36e-04s  0.00e+00d  [ProcessAtMostOneAndLinear] 
  5.28e-04s  0.00e+00d  [DetectDuplicateConstraints] #without_enforcements=74 
  1.98e-04s  5.72e-06d  [DetectDominatedLinearConstraints] #relevant_constraints=289 #num_inclusions=76 
  1.23e-04s  0.00e+00d  [DetectDifferentVariables] #different=27 
  5.01e-05s  0.00e+00d  [ProcessSetPPC] #relevant_constraints=156 
  1.33e-05s  0.00e+00d  [FindAlmostIdenticalLinearConstraints] 
  8.67e-06s  0.00e+00d  [FindBigAtMostOneAndLinearOverlap] 
  3.93e-04s  1.48e-04d  [FindBigVerticalLinearOverlap] 
  3.87e-05s  6.11e-06d  [FindBigHorizontalLinearOverlap] #linears=156 
  4.85e-06s  0.00e+00d  [MergeClauses] 
  2.35e-04s  0.00e+00d  [DetectDominanceRelations] 
  2.03e-03s  0.00e+00d  [PresolveToFixPoint] #num_loops=1 #num_dual_strengthening=1 
  2.32e-04s  0.00e+00d  [DetectDominanceRelations] 
  2.02e-03s  0.00e+00d  [PresolveToFixPoint] #num_loops=1 #num_dual_strengthening=1 
[Symmetry] Graph for symmetry has 808 nodes and 3'181 arcs.
[Symmetry] Symmetry computation done. time: 0.00016525 dtime: 0.00019896
  1.60e-03s  1.64e-04d  [Probe] #probed=148 
  6.02e-06s  0.00e+00d  [MaxClique] 
  2.36e-04s  0.00e+00d  [DetectDominanceRelations] 
  2.04e-03s  0.00e+00d  [PresolveToFixPoint] #num_loops=1 #num_dual_strengthening=1 
  6.46e-04s  0.00e+00d  [ProcessAtMostOneAndLinear] 
  5.24e-04s  0.00e+00d  [DetectDuplicateConstraints] #without_enforcements=74 
  2.01e-04s  5.72e-06d  [DetectDominatedLinearConstraints] #relevant_constraints=289 #num_inclusions=76 
  1.23e-04s  0.00e+00d  [DetectDifferentVariables] #different=27 
  4.83e-05s  0.00e+00d  [ProcessSetPPC] #relevant_constraints=156 
  1.33e-05s  1.50e-08d  [FindAlmostIdenticalLinearConstraints] #num_tested_pairs=1 
  8.53e-06s  0.00e+00d  [FindBigAtMostOneAndLinearOverlap] 
  4.38e-04s  1.49e-04d  [FindBigVerticalLinearOverlap] #blocks=1 #saved_nz=56 
  3.83e-05s  5.77e-06d  [FindBigHorizontalLinearOverlap] #linears=154 
  5.22e-06s  0.00e+00d  [MergeClauses] 
  2.35e-04s  0.00e+00d  [DetectDominanceRelations] 
  2.72e-03s  0.00e+00d  [PresolveToFixPoint] #num_loops=2 #num_dual_strengthening=1 
  2.41e-05s  0.00e+00d  [ExpandObjective] #entries=8 #tight_variables=4 #tight_constraints=2 

Presolve summary:
  - 32 affine relations were detected.
  - rule 'TODO dual: only one blocking constraint?' was applied 300 times.
  - rule 'TODO dual: only one unspecified blocking constraint?' was applied 78 times.
  - rule 'TODO duplicate: identical constraint with different enforcements' was applied 214 times.
  - rule 'affine: new relation' was applied 32 times.
  - rule 'at_most_one: removed literals' was applied 7 times.
  - rule 'at_most_one: size one' was applied 7 times.
  - rule 'at_most_one: transformed into max clique.' was applied 1 time.
  - rule 'deductions: 98 stored' was applied 1 time.
  - rule 'dual: fix variable' was applied 15 times.
  - rule 'dual: reduced domain' was applied 36 times.
  - rule 'duplicate: merged rhs of linear constraint' was applied 34 times.
  - rule 'duplicate: removed constraint' was applied 169 times.
  - rule 'enforcement: false literal' was applied 20 times.
  - rule 'enforcement: true literal' was applied 12 times.
  - rule 'exactly_one: x and not(x)' was applied 1 time.
  - rule 'incompatible linear: add implication' was applied 30 times.
  - rule 'linear inclusion: redundant containing constraint' was applied 1 time.
  - rule 'linear matrix: common vertical rectangle' was applied 3 times.
  - rule 'linear: always true' was applied 499 times.
  - rule 'linear: doubleton free' was applied 8 times.
  - rule 'linear: empty' was applied 24 times.
  - rule 'linear: extracted enforcement literal' was applied 1'312 times.
  - rule 'linear: fixed or dup variables' was applied 906 times.
  - rule 'linear: positive equal one' was applied 1 time.
  - rule 'linear: reduced variable domains' was applied 78 times.
  - rule 'linear: remapped using affine relations' was applied 784 times.
  - rule 'linear: simplified rhs' was applied 2'184 times.
  - rule 'linear: variable substitution 1' was applied 8 times.
  - rule 'presolve: 68 unused variables removed.' was applied 1 time.
  - rule 'presolve: iteration' was applied 3 times.
  - rule 'probing: reduced enforced constraint to implication.' was applied 12 times.
  - rule 'symmetry: fixed to false in general orbit' was applied 1 time.

Presolved optimization model '': (model_fingerprint: 0x40535c39b7a51d05)
#Variables: 84 (#ints: 6 in objective)
  - 34 Booleans in [0,1]
  - 1 in [-257,-17][3,344][364,658]
  - 4 in [0,199]
  - 2 in [0,236]
  - 2 in [0,240]
  - 1 in [0,243]
  - 1 in [0,252]
  - 1 in [0,256]
  - 1 in [0,262]
  - 1 in [0,274]
  - 3 in [0,290]
  - 1 in [0,300]
  - 1 in [0,337]
  - 1 in [0,341]
  - 1 in [3,265]
  - 1 in [3,293]
  - 1 in [3,303]
  - 1 in [3,340]
  - 1 in [3,340][364,701]
  - 1 in [3,344]
  - 1 in [3,344][364,705]
  - 1 in [20,320]
  - 1 in [29,319]
  - 1 in [30,292]
  - 1 in [53,315]
  - 2 in [76,350]
  - 1 in [82,356]
  - 3 in [88,350]
  - 3 in [94,350]
  - 1 in [94,356]
  - 2 in [98,350]
  - 1 in [100,356]
  - 1 in [104,356]
  - 3 in [107,350]
  - 1 in [113,356]
  - 1 in [162,361]
#kLinear2: 221 (#enforced: 186 #multi: 147)
#kLinear3: 79 (#enforced: 63 #multi: 32)
#kLinearN: 176 (#enforced: 131) (#terms: 1'243)

Preloading model.
#Bound   0.05s best:inf   next:[192,1678] initial_domain
[Symmetry] Graph for symmetry has 702 nodes and 3'125 arcs.
[Symmetry] Symmetry computation done. time: 0.000173425 dtime: 0.00019032
#Model   0.05s var:84/84 constraints:476/476

Starting search at 0.05s with 48 workers.
16 full problem subsolvers: [core, default_lp, lb_tree_search, max_lp, no_lp, objective_lb_search, objective_lb_search_max_lp, objective_lb_search_no_lp, objective_shaving_search_max_lp, objective_shaving_search_no_lp, probing, probing_max_lp, pseudo_costs, quick_restart, quick_restart_no_lp, reduced_costs]
30 first solution subsolvers: [fj_long_default(2), fj_long_lin_default, fj_long_lin_perturb, fj_long_lin_random, fj_long_perturb, fj_long_random, fj_short_default(2), fj_short_lin_default(2), fj_short_lin_perturb, fj_short_lin_random, fj_short_perturb, fj_short_random, fs_random(4), fs_random_no_lp(4), fs_random_quick_restart(4), fs_random_quick_restart_no_lp(3)]
13 incomplete subsolvers: [feasibility_pump, graph_arc_lns, graph_cst_lns, graph_dec_lns, graph_var_lns, rins/rens, rnd_cst_lns, rnd_var_lns, violation_ls(5)]
3 helper subsolvers: [neighborhood_helper, synchronization_agent, update_gap_integral]
#1       0.06s best:760   next:[192,759]  no_lp (fixed_bools=0/46)
#Bound   0.06s best:760   next:[193,759]  bool_core (num_cores=1 [size:2 mw:1 d:1] a=5 d=1 fixed=0/40 clauses=1)
#Bound   0.06s best:760   next:[194,759]  bool_core (num_cores=1 [cover] a=5 d=1 fixed=0/43 clauses=2)
#Bound   0.06s best:760   next:[195,759]  bool_core (num_cores=1 [cover] a=5 d=1 fixed=1/46 clauses=4)
#Bound   0.06s best:760   next:[196,759]  bool_core (num_cores=1 [cover] a=5 d=1 fixed=2/49 clauses=7)
#Bound   0.06s best:760   next:[197,759]  bool_core (num_cores=1 [cover] a=5 d=1 fixed=3/52 clauses=11)
#Bound   0.06s best:760   next:[198,759]  bool_core (num_cores=1 [cover] a=5 d=1 fixed=4/55 clauses=16)
#Bound   0.06s best:760   next:[199,759]  bool_core (num_cores=1 [cover] a=5 d=1 fixed=5/58 clauses=22)
#Bound   0.06s best:760   next:[200,759]  bool_core (num_cores=1 [cover] a=5 d=1 fixed=6/61 clauses=29)
#2       0.06s best:626   next:[200,625]  no_lp (fixed_bools=0/53)
#Bound   0.06s best:626   next:[208,625]  objective_lb_search_no_lp
#Bound   0.06s best:626   next:[210,625]  objective_lb_search_no_lp
#Bound   0.06s best:626   next:[235,625]  objective_lb_search_no_lp
#3       0.06s best:616   next:[235,615]  no_lp (fixed_bools=0/55)
#Bound   0.06s best:616   next:[318,615]  objective_lb_search_no_lp
#4       0.06s best:601   next:[318,600]  no_lp (fixed_bools=0/58)
#Bound   0.06s best:601   next:[320,600]  objective_lb_search_no_lp
#5       0.06s best:600   next:[320,599]  violation_ls(batch:1 #solutions_imported:1 #lin_moves:12 #lin_evals:68 #weight_updates:10)
#6       0.06s best:589   next:[320,588]  no_lp (fixed_bools=0/65)
#7       0.06s best:588   next:[320,587]  violation_ls(batch:2 #solutions_imported:2 #lin_moves:4 #lin_evals:475 #gen_moves:226 #gen_evals:0 #comp_moves:6 #backtracks:110 #weight_updates:5)
#8       0.06s best:587   next:[320,586]  violation_ls(batch:2 #solutions_imported:2 #lin_moves:21 #lin_evals:123 #weight_updates:18)
#9       0.06s best:586   next:[320,585]  violation_ls(batch:2 #solutions_imported:2 #lin_moves:1 #lin_evals:298 #gen_moves:143 #gen_evals:0 #comp_moves:9 #backtracks:67 #weight_updates:1)
#10      0.06s best:585   next:[320,584]  violation_ls(batch:2 #solutions_imported:2 #lin_moves:0 #lin_evals:617 #gen_moves:313 #gen_evals:0 #comp_moves:9 #backtracks:152 #weight_updates:3)
#11      0.07s best:584   next:[320,583]  violation_ls(batch:2 #solutions_imported:2 #lin_moves:0 #lin_evals:38 #gen_moves:32 #gen_evals:0 #comp_moves:4 #backtracks:14 #weight_updates:0)
#12      0.07s best:583   next:[320,582]  violation_ls(batch:3 #solutions_imported:3 #lin_moves:4 #lin_evals:493 #gen_moves:234 #gen_evals:0 #comp_moves:14 #backtracks:110 #weight_updates:5)
#13      0.07s best:582   next:[320,581]  violation_ls(batch:3 #solutions_imported:3 #lin_moves:22 #lin_evals:129 #weight_updates:18)
#14      0.07s best:575   next:[320,574]  no_lp (fixed_bools=1/70)
#15      0.07s best:574   next:[320,573]  violation_ls(batch:3 #solutions_imported:3 #lin_moves:6 #lin_evals:652 #gen_moves:313 #gen_evals:0 #comp_moves:9 #backtracks:152 #weight_updates:8)
#16      0.07s best:573   next:[320,572]  violation_ls(batch:3 #solutions_imported:3 #lin_moves:0 #lin_evals:42 #gen_moves:33 #gen_evals:0 #comp_moves:5 #backtracks:14 #weight_updates:0)
#17      0.07s best:571   next:[320,570]  no_lp (fixed_bools=1/72)
#18      0.07s best:570   next:[320,569]  violation_ls(batch:4 #solutions_imported:4 #lin_moves:4 #lin_evals:511 #gen_moves:248 #gen_evals:0 #comp_moves:16 #backtracks:116 #weight_updates:5)
#19      0.07s best:569   next:[320,568]  violation_ls(batch:4 #solutions_imported:4 #lin_moves:26 #lin_evals:150 #weight_updates:21)
#20      0.07s best:567   next:[320,566]  rnd_var_lns (d=0.81 s=55 t=0.10 p=1.00 stall=2 h=auto_l0)
#21      0.07s best:566   next:[320,565]  violation_ls(batch:4 #solutions_imported:4 #lin_moves:6 #lin_evals:343 #gen_moves:152 #gen_evals:0 #comp_moves:18 #backtracks:67 #weight_updates:5)
#22      0.07s best:565   next:[320,564]  violation_ls(batch:4 #solutions_imported:4 #lin_moves:1 #lin_evals:48 #gen_moves:33 #gen_evals:0 #comp_moves:5 #backtracks:14 #weight_updates:0)
#23      0.08s best:527   next:[320,526]  graph_var_lns (d=0.88 s=69 t=0.10 p=1.00 stall=1 h=auto_l0)
#24      0.08s best:489   next:[320,488]  rins_pump_lns (d=0.50 s=49 t=0.10 p=0.00 stall=0 h=auto_l0)
#Bound   0.08s best:489   next:[334,488]  objective_lb_search_no_lp
#Bound   0.08s best:489   next:[347,488]  objective_lb_search_no_lp
#Bound   0.09s best:489   next:[351,488]  objective_lb_search_no_lp
#Model   0.09s var:83/84 constraints:433/476
#25      0.09s best:440   next:[351,439]  graph_arc_lns (d=0.81 s=71 t=0.10 p=1.00 stall=0 h=auto_l0)
#Bound   0.09s best:440   next:[352,439]  objective_lb_search_no_lp
#Bound   0.09s best:440   next:[354,439]  objective_lb_search_no_lp
#Bound   0.10s best:440   next:[358,439]  objective_lb_search_no_lp
#Bound   0.10s best:440   next:[360,439]  objective_lb_search_no_lp
#Model   0.14s var:82/84 constraints:353/476
#Model   0.15s var:81/84 constraints:350/476
#Model   0.15s var:79/84 constraints:341/476
#Model   0.15s var:76/84 constraints:300/476
#Done    0.15s no_lp
#Done    0.15s objective_lb_search_no_lp
#Model   0.15s var:71/84 constraints:248/476
#Done    0.15s quick_restart
#Bound   0.15s best:440   next:[424,439]  objective_lb_search_no_lp [skipped_logs=6]

Task timing                                  n [     min,      max]      avg      dev     time         n [     min,      max]      avg      dev    dtime
                             'core':         1 [100.67ms, 100.67ms] 100.67ms   0.00ns 100.67ms         1 [ 60.62ms,  60.62ms]  60.62ms   0.00ns  60.62ms
                       'default_lp':         1 [ 99.67ms,  99.67ms]  99.67ms   0.00ns  99.67ms         1 [  9.67ms,   9.67ms]   9.67ms   0.00ns   9.67ms
                 'feasibility_pump':         7 [861.71us,  13.85ms]   9.78ms   5.07ms  68.45ms         6 [436.43us,   1.99ms]   1.63ms 536.63us   9.78ms
                  'fj_long_default':         0 [  0.00ns,   0.00ns]   0.00ns   0.00ns   0.00ns         0 [  0.00ns,   0.00ns]   0.00ns   0.00ns   0.00ns
                  'fj_long_default':         0 [  0.00ns,   0.00ns]   0.00ns   0.00ns   0.00ns         0 [  0.00ns,   0.00ns]   0.00ns   0.00ns   0.00ns
              'fj_long_lin_default':         0 [  0.00ns,   0.00ns]   0.00ns   0.00ns   0.00ns         0 [  0.00ns,   0.00ns]   0.00ns   0.00ns   0.00ns
              'fj_long_lin_perturb':         0 [  0.00ns,   0.00ns]   0.00ns   0.00ns   0.00ns         0 [  0.00ns,   0.00ns]   0.00ns   0.00ns   0.00ns
               'fj_long_lin_random':         0 [  0.00ns,   0.00ns]   0.00ns   0.00ns   0.00ns         0 [  0.00ns,   0.00ns]   0.00ns   0.00ns   0.00ns
                  'fj_long_perturb':         0 [  0.00ns,   0.00ns]   0.00ns   0.00ns   0.00ns         0 [  0.00ns,   0.00ns]   0.00ns   0.00ns   0.00ns
                   'fj_long_random':         0 [  0.00ns,   0.00ns]   0.00ns   0.00ns   0.00ns         0 [  0.00ns,   0.00ns]   0.00ns   0.00ns   0.00ns
                 'fj_short_default':         0 [  0.00ns,   0.00ns]   0.00ns   0.00ns   0.00ns         0 [  0.00ns,   0.00ns]   0.00ns   0.00ns   0.00ns
                 'fj_short_default':         0 [  0.00ns,   0.00ns]   0.00ns   0.00ns   0.00ns         0 [  0.00ns,   0.00ns]   0.00ns   0.00ns   0.00ns
             'fj_short_lin_default':         0 [  0.00ns,   0.00ns]   0.00ns   0.00ns   0.00ns         0 [  0.00ns,   0.00ns]   0.00ns   0.00ns   0.00ns
             'fj_short_lin_default':         0 [  0.00ns,   0.00ns]   0.00ns   0.00ns   0.00ns         0 [  0.00ns,   0.00ns]   0.00ns   0.00ns   0.00ns
             'fj_short_lin_perturb':         0 [  0.00ns,   0.00ns]   0.00ns   0.00ns   0.00ns         0 [  0.00ns,   0.00ns]   0.00ns   0.00ns   0.00ns
              'fj_short_lin_random':         0 [  0.00ns,   0.00ns]   0.00ns   0.00ns   0.00ns         0 [  0.00ns,   0.00ns]   0.00ns   0.00ns   0.00ns
                 'fj_short_perturb':         0 [  0.00ns,   0.00ns]   0.00ns   0.00ns   0.00ns         0 [  0.00ns,   0.00ns]   0.00ns   0.00ns   0.00ns
                  'fj_short_random':         0 [  0.00ns,   0.00ns]   0.00ns   0.00ns   0.00ns         0 [  0.00ns,   0.00ns]   0.00ns   0.00ns   0.00ns
                        'fs_random':         0 [  0.00ns,   0.00ns]   0.00ns   0.00ns   0.00ns         0 [  0.00ns,   0.00ns]   0.00ns   0.00ns   0.00ns
                        'fs_random':         0 [  0.00ns,   0.00ns]   0.00ns   0.00ns   0.00ns         0 [  0.00ns,   0.00ns]   0.00ns   0.00ns   0.00ns
                        'fs_random':         1 [  3.64ms,   3.64ms]   3.64ms   0.00ns   3.64ms         1 [ 20.00ns,  20.00ns]  20.00ns   0.00ns  20.00ns
                        'fs_random':         1 [  4.64ms,   4.64ms]   4.64ms   0.00ns   4.64ms         1 [ 20.00ns,  20.00ns]  20.00ns   0.00ns  20.00ns
                  'fs_random_no_lp':         0 [  0.00ns,   0.00ns]   0.00ns   0.00ns   0.00ns         0 [  0.00ns,   0.00ns]   0.00ns   0.00ns   0.00ns
                  'fs_random_no_lp':         0 [  0.00ns,   0.00ns]   0.00ns   0.00ns   0.00ns         0 [  0.00ns,   0.00ns]   0.00ns   0.00ns   0.00ns
                  'fs_random_no_lp':         0 [  0.00ns,   0.00ns]   0.00ns   0.00ns   0.00ns         0 [  0.00ns,   0.00ns]   0.00ns   0.00ns   0.00ns
                  'fs_random_no_lp':         1 [  4.39ms,   4.39ms]   4.39ms   0.00ns   4.39ms         0 [  0.00ns,   0.00ns]   0.00ns   0.00ns   0.00ns
          'fs_random_quick_restart':         0 [  0.00ns,   0.00ns]   0.00ns   0.00ns   0.00ns         0 [  0.00ns,   0.00ns]   0.00ns   0.00ns   0.00ns
          'fs_random_quick_restart':         0 [  0.00ns,   0.00ns]   0.00ns   0.00ns   0.00ns         0 [  0.00ns,   0.00ns]   0.00ns   0.00ns   0.00ns
          'fs_random_quick_restart':         0 [  0.00ns,   0.00ns]   0.00ns   0.00ns   0.00ns         0 [  0.00ns,   0.00ns]   0.00ns   0.00ns   0.00ns
          'fs_random_quick_restart':         1 [  4.45ms,   4.45ms]   4.45ms   0.00ns   4.45ms         1 [ 20.00ns,  20.00ns]  20.00ns   0.00ns  20.00ns
    'fs_random_quick_restart_no_lp':         0 [  0.00ns,   0.00ns]   0.00ns   0.00ns   0.00ns         0 [  0.00ns,   0.00ns]   0.00ns   0.00ns   0.00ns
    'fs_random_quick_restart_no_lp':         0 [  0.00ns,   0.00ns]   0.00ns   0.00ns   0.00ns         0 [  0.00ns,   0.00ns]   0.00ns   0.00ns   0.00ns
    'fs_random_quick_restart_no_lp':         1 [  3.92ms,   3.92ms]   3.92ms   0.00ns   3.92ms         0 [  0.00ns,   0.00ns]   0.00ns   0.00ns   0.00ns
                    'graph_arc_lns':         7 [  1.79ms,  42.81ms]  14.00ms  12.57ms  97.97ms         6 [ 10.00ns,   3.52ms] 730.17us   1.26ms   4.38ms
                    'graph_cst_lns':         6 [536.38us,   1.56ms] 766.47us 363.36us   4.60ms         1 [ 10.00ns,  10.00ns]  10.00ns   0.00ns  10.00ns
                    'graph_dec_lns':         6 [  1.72ms,  32.19ms]   9.46ms  10.65ms  56.74ms         6 [ 10.00ns,   2.05ms] 392.60us 745.20us   2.36ms
                    'graph_var_lns':         7 [  1.81ms,  25.15ms]   9.18ms   8.11ms  64.25ms         7 [ 10.00ns,   2.11ms] 368.42us 716.42us   2.58ms
                   'lb_tree_search':         1 [ 98.54ms,  98.54ms]  98.54ms   0.00ns  98.54ms         1 [  8.19ms,   8.19ms]   8.19ms   0.00ns   8.19ms
                           'max_lp':         1 [ 99.51ms,  99.51ms]  99.51ms   0.00ns  99.51ms         1 [  6.99ms,   6.99ms]   6.99ms   0.00ns   6.99ms
                            'no_lp':         1 [ 98.86ms,  98.86ms]  98.86ms   0.00ns  98.86ms         1 [ 12.44ms,  12.44ms]  12.44ms   0.00ns  12.44ms
              'objective_lb_search':         1 [ 98.13ms,  98.13ms]  98.13ms   0.00ns  98.13ms         1 [  9.94ms,   9.94ms]   9.94ms   0.00ns   9.94ms
       'objective_lb_search_max_lp':         1 [ 96.84ms,  96.84ms]  96.84ms   0.00ns  96.84ms         1 [ 10.19ms,  10.19ms]  10.19ms   0.00ns  10.19ms
        'objective_lb_search_no_lp':         1 [ 97.05ms,  97.05ms]  97.05ms   0.00ns  97.05ms         1 [ 11.44ms,  11.44ms]  11.44ms   0.00ns  11.44ms
  'objective_shaving_search_max_lp':         7 [672.62us,  22.69ms]   9.71ms   8.14ms  67.97ms         2 [313.58us, 338.52us] 326.05us  12.47us 652.10us
   'objective_shaving_search_no_lp':         7 [699.05us,  25.91ms]  12.52ms   9.60ms  87.66ms         4 [ 98.64us,   1.29ms] 455.21us 489.00us   1.82ms
                          'probing':         1 [ 98.07ms,  98.07ms]  98.07ms   0.00ns  98.07ms         1 [  4.70ms,   4.70ms]   4.70ms   0.00ns   4.70ms
                   'probing_max_lp':         1 [ 97.53ms,  97.53ms]  97.53ms   0.00ns  97.53ms         1 [  5.34ms,   5.34ms]   5.34ms   0.00ns   5.34ms
                     'pseudo_costs':         1 [ 98.24ms,  98.24ms]  98.24ms   0.00ns  98.24ms         1 [ 11.58ms,  11.58ms]  11.58ms   0.00ns  11.58ms
                    'quick_restart':         1 [ 99.14ms,  99.14ms]  99.14ms   0.00ns  99.14ms         1 [  5.33ms,   5.33ms]   5.33ms   0.00ns   5.33ms
              'quick_restart_no_lp':         1 [ 98.48ms,  98.48ms]  98.48ms   0.00ns  98.48ms         1 [ 12.74ms,  12.74ms]  12.74ms   0.00ns  12.74ms
                    'reduced_costs':         1 [ 98.97ms,  98.97ms]  98.97ms   0.00ns  98.97ms         1 [  6.65ms,   6.65ms]   6.65ms   0.00ns   6.65ms
                        'rins/rens':         7 [ 77.84us,  40.82ms]  15.27ms  12.37ms 106.91ms         6 [191.48us,   2.93ms]   1.06ms 970.45us   6.37ms
                      'rnd_cst_lns':         7 [  2.60ms,  17.24ms]  10.06ms   5.94ms  70.39ms         7 [  1.03us, 476.36us] 194.63us 192.88us   1.36ms
                      'rnd_var_lns':         7 [  1.43ms,  22.53ms]   9.38ms   7.70ms  65.69ms         7 [ 10.00ns, 911.49us] 200.94us 308.62us   1.41ms
                     'violation_ls':         5 [136.11us,  66.53ms]  13.61ms  26.46ms  68.04ms         5 [590.00ns,  34.76ms]   6.98ms  13.89ms  34.88ms
                     'violation_ls':         5 [143.38us,  64.92ms]  13.71ms  25.63ms  68.53ms         5 [  1.03us,  22.82ms]   4.74ms   9.04ms  23.69ms
                     'violation_ls':         5 [186.09us,  65.04ms]  13.45ms  25.80ms  67.24ms         5 [830.00ns,  23.14ms]   4.71ms   9.21ms  23.56ms
                     'violation_ls':         6 [ 86.96us,  40.63ms]   7.52ms  14.85ms  45.13ms         6 [560.00ns,  11.87ms]   2.23ms   4.34ms  13.36ms
                     'violation_ls':         6 [160.78us,  64.75ms]  11.47ms  23.84ms  68.81ms         6 [  7.80us,  45.69ms]   7.81ms  16.94ms  46.86ms

Search stats                        Bools  Conflicts  Branches  Restarts  BoolPropag  IntegerPropag
                           'core':    562        309     1'885       536     101'862         55'379
                     'default_lp':     55         22       265       150         428          5'763
                      'fs_random':      0          0         0         0           0              0
                      'fs_random':      0          0         0         0           0              0
                      'fs_random':     34          0         0         0           0              0
                      'fs_random':     34          0         0         0           0              0
                'fs_random_no_lp':      0          0         0         0           0              0
                'fs_random_no_lp':      0          0         0         0           0              0
                'fs_random_no_lp':      0          0         0         0           0              0
                'fs_random_no_lp':     34          0         0         0           0              0
        'fs_random_quick_restart':      0          0         0         0           0              0
        'fs_random_quick_restart':      0          0         0         0           0              0
        'fs_random_quick_restart':      0          0         0         0           0              0
        'fs_random_quick_restart':     34          0         0         0           0              0
  'fs_random_quick_restart_no_lp':      0          0         0         0           0              0
  'fs_random_quick_restart_no_lp':      0          0         0         0           0              0
  'fs_random_quick_restart_no_lp':     34          0         0         0           0              0
                 'lb_tree_search':     34          0        68        68           3            422
                         'max_lp':     34          0        68        68          13            477
                          'no_lp':     75        302     1'501       506       9'547         70'055
            'objective_lb_search':     36         38       185       109         521          6'271
     'objective_lb_search_max_lp':     35         10        91        68         162          2'021
      'objective_lb_search_no_lp':     58        400     1'029       372       5'587         65'654
                        'probing':     36          1        71        71           2            374
                 'probing_max_lp':     36          0        72        72           1            379
                   'pseudo_costs':     34         12        98        68         148          2'432
                  'quick_restart':     61          4       349       219         225          4'237
            'quick_restart_no_lp':    105        370     1'802       540      10'710         68'725
                  'reduced_costs':     63         50       120        69       1'161          5'224

SAT stats                           ClassicMinim  LitRemoved  LitLearned  LitForgotten  Subsumed  MClauses  MDecisions  MLitTrue  MSubsumed  MLitRemoved  MReused
                           'core':           113         269         482             0         3       151         414         0        135          412        0
                     'default_lp':            10          17         108             0         1         2          10         0          0            2        0
                      'fs_random':             0           0           0             0         0         0           0         0          0            0        0
                      'fs_random':             0           0           0             0         0         0           0         0          0            0        0
                      'fs_random':             0           0           0             0         0         0           0         0          0            0        0
                      'fs_random':             0           0           0             0         0         0           0         0          0            0        0
                'fs_random_no_lp':             0           0           0             0         0         0           0         0          0            0        0
                'fs_random_no_lp':             0           0           0             0         0         0           0         0          0            0        0
                'fs_random_no_lp':             0           0           0             0         0         0           0         0          0            0        0
                'fs_random_no_lp':             0           0           0             0         0         0           0         0          0            0        0
        'fs_random_quick_restart':             0           0           0             0         0         0           0         0          0            0        0
        'fs_random_quick_restart':             0           0           0             0         0         0           0         0          0            0        0
        'fs_random_quick_restart':             0           0           0             0         0         0           0         0          0            0        0
        'fs_random_quick_restart':             0           0           0             0         0         0           0         0          0            0        0
  'fs_random_quick_restart_no_lp':             0           0           0             0         0         0           0         0          0            0        0
  'fs_random_quick_restart_no_lp':             0           0           0             0         0         0           0         0          0            0        0
  'fs_random_quick_restart_no_lp':             0           0           0             0         0         0           0         0          0            0        0
                 'lb_tree_search':             0           0           0             0         0         0           0         0          0            0        0
                         'max_lp':             0           0           0             0         0         0           0         0          0            0        0
                          'no_lp':           152         250       1'359             0        34       122         472        20         63          398        8
            'objective_lb_search':            10          17         163             0         7         0           0         0          0            0        0
     'objective_lb_search_max_lp':             3           8          70             0         0         0           0         0          0            0        0
      'objective_lb_search_no_lp':           255         505       1'740             0        31        39         210         0         13           67       13
                        'probing':             0           0           1             0         0         0           0         0          0            0        0
                 'probing_max_lp':             0           0           0             0         0         0           0         0          0            0        0
                   'pseudo_costs':             3           3          97             0         2         0           0         0          0            0        0
                  'quick_restart':             0           0          11             0         1         2           6         0          1            5        0
            'quick_restart_no_lp':           184         344       2'040             0        26       113         550         0         78          408       17
                  'reduced_costs':             0           0         164             0        14         0           0         0          0            0        0

Lp stats                         Component  Iterations  AddedCuts  OPTIMAL  DUAL_F.  DUAL_U.
                  'default_lp':          1         640        476       74        0        0
                   'fs_random':          1           0          0        0        0        0
                   'fs_random':          1           0          0        0        0        0
     'fs_random_quick_restart':          1           0          0        0        0        0
              'lb_tree_search':          1         274        756        9        0        0
                      'max_lp':          1         261        711        9        0        0
         'objective_lb_search':          1         670        410       81        0        0
  'objective_lb_search_max_lp':          1         530        565       36        7        0
                     'probing':          1         290        496       27        0        1
              'probing_max_lp':          1         225        741        7        1        0
                'pseudo_costs':          1         592        560       40       11        0
               'quick_restart':          1         328        518       55        0        0
               'reduced_costs':          1         310        562       46        2        0

Lp dimension                                                                    Final dimension of first component
                  'default_lp':  281 rows, 80 columns, 1206 entries with magnitude in [5.164130e-04, 1.000000e+00]
                   'fs_random':       0 rows, 80 columns, 0 entries with magnitude in [0.000000e+00, 0.000000e+00]
                   'fs_random':       0 rows, 80 columns, 0 entries with magnitude in [0.000000e+00, 0.000000e+00]
     'fs_random_quick_restart':       0 rows, 80 columns, 0 entries with magnitude in [0.000000e+00, 0.000000e+00]
              'lb_tree_search':  677 rows, 84 columns, 2655 entries with magnitude in [2.781209e-03, 1.000000e+00]
                      'max_lp':  674 rows, 84 columns, 3297 entries with magnitude in [3.096800e-03, 1.000000e+00]
         'objective_lb_search':  257 rows, 80 columns, 1075 entries with magnitude in [1.024162e-03, 1.000000e+00]
  'objective_lb_search_max_lp':  383 rows, 84 columns, 1736 entries with magnitude in [4.486642e-04, 1.000000e+00]
                     'probing':  274 rows, 80 columns, 1610 entries with magnitude in [1.015498e-03, 1.000000e+00]
              'probing_max_lp':  672 rows, 84 columns, 3728 entries with magnitude in [1.668192e-03, 1.000000e+00]
                'pseudo_costs':  372 rows, 84 columns, 1580 entries with magnitude in [1.032441e-03, 1.000000e+00]
               'quick_restart':  287 rows, 80 columns, 1289 entries with magnitude in [1.330084e-03, 1.000000e+00]
               'reduced_costs':  356 rows, 84 columns, 1600 entries with magnitude in [7.062055e-04, 1.000000e+00]

Lp debug                         CutPropag  CutEqPropag  Adjust  Overflow    Bad  BadScaling
                  'default_lp':          0            0      47         0  1'287           0
                   'fs_random':          0            0       0         0      0           0
                   'fs_random':          0            0       0         0      0           0
     'fs_random_quick_restart':          0            0       0         0      0           0
              'lb_tree_search':          0            0       7         0    360           0
                      'max_lp':          0            0       8         0    378           0
         'objective_lb_search':          1            0      39         0  1'024           0
  'objective_lb_search_max_lp':          2            0      31         0    630           0
                     'probing':          0            0      13         0  1'064           0
              'probing_max_lp':          0            0       7         0    316           0
                'pseudo_costs':          0            0      41         0    544           0
               'quick_restart':          0            0      36         0  1'319           0
               'reduced_costs':          0            0      34         0    481           0

Lp pool                          Constraints  Updates  Simplif  Merged  Shortened  Split  Strenghtened  Cuts/Call
                  'default_lp':          572      111      381       0        101     29           255    476/759
                   'fs_random':           96        0        0       0          0      0             0        0/0
                   'fs_random':           96        0        0       0          0      0             0        0/0
     'fs_random_quick_restart':           96        0        0       0          0      0             0        0/0
              'lb_tree_search':        1'226       22      694       6        369     12           952  756/1'259
                      'max_lp':        1'182       36      303       5          0     12           743  711/1'229
         'objective_lb_search':          505       97      275       1         84     13           209    410/718
  'objective_lb_search_max_lp':        1'035       62      780       6        156      5         1'108    565/873
                     'probing':          592       12        0       0          0     11            86    496/865
              'probing_max_lp':        1'215        7        0       2          0      9           149  741/1'254
                'pseudo_costs':        1'021       58      666      15        178      7         1'106    560/855
               'quick_restart':          613      117      384       1        100     24           268    518/865
               'reduced_costs':        1'034       56      726       4        170      4           979    562/894

Lp Cut            defaul  max_lp  quick_  reduce  pseudo  lb_tre  probin  object  probin  object
          CG_FF:      34      89      49      35      42     100      29      29      90      39
           CG_K:       4      58       5      11      13      68       5       5      59      11
           CG_R:      23      48      19      19      23      46      27      16      49      32
          CG_RB:     130     142     138     106      88     151     154     108     147     126
         CG_RBP:       9      16      12      10      10      20       9       7      19      11
         Clique:       -       -       -       7      11       -       -       -       -       9
             IB:      84      73      79      83      95      82      75      82      73      87
       MIR_1_FF:      24      63      22      45      43      63      27      24      62      47
        MIR_1_K:       1       -       1       5       5       6       -       -       1       5
        MIR_1_R:       2      13       3       2       2      12       3       1      12       4
       MIR_1_RB:      44      42      48      57      59      42      45      36      36      54
      MIR_1_RBP:       3      13       2      13      12      10       2       1      11      11
       MIR_2_FF:       7      13       9      11      15      17       5       5      15      12
        MIR_2_K:       1       3       1       -       1       3       -       1       5       1
        MIR_2_R:       7       4       8       4       7       3       7       6       6       3
       MIR_2_RB:      20      16      17      15      18      19      12      15      20      21
      MIR_2_RBP:       2       6       6       3       3       7       2       1       6       6
       MIR_3_FF:       4      10       3       8       5       7       8       2      10       4
        MIR_3_K:       -       4       1       1       -       1       1       -       2       -
        MIR_3_R:       7       3       5       7       4       3       7       4       2       1
       MIR_3_RB:       9       9      13      14       9       4      12      11       6       6
      MIR_3_RBP:       -       2       2       3       2       2       7       2       3       1
       MIR_4_FF:       5       5       1       7       3       6       2       1       6       -
        MIR_4_K:       -       -       -       1       1       1       -       -       1       -
        MIR_4_R:       3       3       4       6       3       3       4       1       2       1
       MIR_4_RB:       3       4       7       8       7       6       5       6       5       2
      MIR_4_RBP:       -       -       1       -       1       1       4       -       -       -
       MIR_5_FF:       -       1       -       6       1       3       1       -       3       1
        MIR_5_K:       -       -       -       -       -       1       -       -       1       -
        MIR_5_R:       -       1       -       5       1       2       2       -       2       2
       MIR_5_RB:       1       1       2       5       1       1       2       3       2       1
      MIR_5_RBP:       -       1       -       -       -       2       2       -       1       -
       MIR_6_FF:       -       1       -       1       -       -       -       -       1       -
        MIR_6_R:       -       1       -       1       -       -       -       -       1       1
       MIR_6_RB:       -       1       -       1       -       -       -       1       1       2
   ZERO_HALF_FF:       8      16       9      15      16      20       6       5      22      14
    ZERO_HALF_K:       -       6       -       -       2       3       -       -       4       1
    ZERO_HALF_R:      24      24      30      27      29      24      18      24      31      25
   ZERO_HALF_RB:      14      14      18      14      21      14      11      11      14      16
  ZERO_HALF_RBP:       3       5       3       6       7       3       2       2      10       8

LNS stats           Improv/Calls  Closed  Difficulty  TimeLimit
  'graph_arc_lns':           4/7     71%        0.89       0.10
  'graph_cst_lns':           0/1    100%        0.71       0.10
  'graph_dec_lns':           1/6    100%        0.96       0.10
  'graph_var_lns':           3/7     86%        0.94       0.10
      'rins/rens':           3/6     83%        0.92       0.10
    'rnd_cst_lns':           3/7     86%        0.94       0.10
    'rnd_var_lns':           2/7    100%        0.97       0.10

LS stats                   Batches  Restarts  LinMoves  GenMoves  CompoundMoves  WeightUpdates
       'fj_long_default':        0         0         0         0              0              0
       'fj_long_default':        0         0         0         0              0              0
   'fj_long_lin_default':        0         0         0         0              0              0
   'fj_long_lin_perturb':        0         0         0         0              0              0
    'fj_long_lin_random':        0         0         0         0              0              0
       'fj_long_perturb':        0         0         0         0              0              0
        'fj_long_random':        0         0         0         0              0              0
      'fj_short_default':        0         0         0         0              0              0
      'fj_short_default':        0         0         0         0              0              0
  'fj_short_lin_default':        0         0         0         0              0              0
  'fj_short_lin_default':        0         0         0         0              0              0
  'fj_short_lin_perturb':        0         0         0         0              0              0
   'fj_short_lin_random':        0         0         0         0              0              0
      'fj_short_perturb':        0         0         0         0              0              0
       'fj_short_random':        0         0         0         0              0              0
          'violation_ls':        5         0        17     6'472             76             63
          'violation_ls':        5         0     5'164         0              0            597
          'violation_ls':        5         0         6     6'272            116             51
          'violation_ls':        6         0       293     3'194             56            132
          'violation_ls':        6         0     6'038       330             18          3'971

Solutions (25)      Num     Rank
  'graph_arc_lns':    1  [25,25]
  'graph_var_lns':    1  [23,23]
          'no_lp':    7   [1,17]
  'rins_pump_lns':    1  [24,24]
    'rnd_var_lns':    1  [20,20]
   'violation_ls':   14   [5,22]

Objective bounds                Num
                  'bool_core':    8
             'initial_domain':    1
  'objective_lb_search_no_lp':   19

Solution repositories    Added  Queried  Ignored  Synchro
  'feasible solutions':     67      126        0       47
        'lp solutions':      0        0        0        0
                'pump':    109        6

Improving bounds shared          Num
                        'core':    6
                  'default_lp':   34
                      'max_lp':    4
                       'no_lp':   86
         'objective_lb_search':   10
  'objective_lb_search_max_lp':   20
   'objective_lb_search_no_lp':   60
               'quick_restart':   18
         'quick_restart_no_lp':  105
               'reduced_costs':    7

Clauses shared                  Num
                      'no_lp':   30
  'objective_lb_search_no_lp':    7
              'quick_restart':    2
        'quick_restart_no_lp':   11

CpSolverResponse summary:
status: OPTIMAL
objective: 440
best_bound: 440
integers: 0
booleans: 0
conflicts: 0
branches: 0
propagations: 0
integer_propagations: 0
restarts: 0
lp_iterations: 0
walltime: 0.160538
usertime: 0.160538
deterministic_time: 0.349898
gap_integral: 0.310209
solution_fingerprint: 0x7d2cbf3bc3702661


--- Simulation Gantt  partir du modle mathmatique ---
{'big':1, 'due_date':87, 'pos_time':5, 'status':0, 'blocked':0, 'operations':["{'type':1, 'processing_time':16}"]}
{'big':1, 'due_date':69, 'pos_time':5, 'status':0, 'blocked':0, 'operations':["{'type':1, 'processing_time':44}", "{'type':0, 'processing_time':41}"]}
{'big':1, 'due_date':118, 'pos_time':5, 'status':0, 'blocked':0, 'operations':["{'type':1, 'processing_time':11}", "{'type':0, 'processing_time':36}"]}
{'big':0, 'due_date':105, 'pos_time':5, 'status':0, 'blocked':0, 'operations':["{'type':0, 'processing_time':20}", "{'type':1, 'processing_time':37}"]}
{'big':1, 'due_date':109, 'pos_time':5, 'status':0, 'blocked':0, 'operations':["{'type':1, 'processing_time':12}"]}
