created virtual environment CPython3.12.4.final.0-64 in 1087ms
  creator CPython3Posix(dest=/localscratch/aneumann.47038314.0/env, clear=False, no_vcs_ignore=False, global=False)
  seeder FromAppData(download=False, pip=bundle, via=copy, app_data_dir=/home/aneumann/.local/share/virtualenv)
    added seed packages: pip==24.2+computecanada
  activators BashActivator,CShellActivator,FishActivator,NushellActivator,PowerShellActivator,PythonActivator
Looking in links: /cvmfs/soft.computecanada.ca/custom/python/wheelhouse/gentoo2023/x86-64-v3, /cvmfs/soft.computecanada.ca/custom/python/wheelhouse/gentoo2023/generic, /cvmfs/soft.computecanada.ca/custom/python/wheelhouse/generic
Requirement already satisfied: pip in /localscratch/aneumann.47038314.0/env/lib/python3.12/site-packages (24.2+computecanada)
Processing /cvmfs/soft.computecanada.ca/custom/python/wheelhouse/generic/pip-25.0+computecanada-py3-none-any.whl
Installing collected packages: pip
  Attempting uninstall: pip
    Found existing installation: pip 24.2+computecanada
    Uninstalling pip-24.2+computecanada:
      Successfully uninstalled pip-24.2+computecanada
Successfully installed pip-25.0+computecanada
Looking in links: /cvmfs/soft.computecanada.ca/custom/python/wheelhouse/gentoo2023/x86-64-v3, /cvmfs/soft.computecanada.ca/custom/python/wheelhouse/gentoo2023/generic, /cvmfs/soft.computecanada.ca/custom/python/wheelhouse/generic
ERROR: protobuf-5.28.3-cp38-abi3-manylinux2014_x86_64.whl is not a supported wheel on this platform.
Looking in links: /cvmfs/soft.computecanada.ca/custom/python/wheelhouse/gentoo2023/x86-64-v3, /cvmfs/soft.computecanada.ca/custom/python/wheelhouse/gentoo2023/generic, /cvmfs/soft.computecanada.ca/custom/python/wheelhouse/generic
Processing /home/aneumann/projects/def-adhaj/aneumann/GNRS/wheels/immutabledict-4.2.0-py3-none-any.whl
Installing collected packages: immutabledict
Successfully installed immutabledict-4.2.0
Looking in links: /cvmfs/soft.computecanada.ca/custom/python/wheelhouse/gentoo2023/x86-64-v3, /cvmfs/soft.computecanada.ca/custom/python/wheelhouse/gentoo2023/generic, /cvmfs/soft.computecanada.ca/custom/python/wheelhouse/generic
Processing /cvmfs/soft.computecanada.ca/custom/python/wheelhouse/generic/ortools-9.10.4067+computecanada-cp312-cp312-linux_x86_64.whl (from -r /home/aneumann/projects/def-adhaj/aneumann/GNRS/requirements/or.txt (line 1))
Processing /cvmfs/soft.computecanada.ca/custom/python/wheelhouse/gentoo2023/x86-64-v3/matplotlib-3.10.0+computecanada-cp312-cp312-linux_x86_64.whl (from -r /home/aneumann/projects/def-adhaj/aneumann/GNRS/requirements/or.txt (line 2))
Processing /cvmfs/soft.computecanada.ca/custom/python/wheelhouse/gentoo2023/x86-64-v3/pandas-2.2.3+computecanada-cp312-cp312-linux_x86_64.whl (from -r /home/aneumann/projects/def-adhaj/aneumann/GNRS/requirements/or.txt (line 3))
Processing /cvmfs/soft.computecanada.ca/custom/python/wheelhouse/generic/absl_py-2.3.0+computecanada-py3-none-any.whl (from ortools<9.11,>=9.10->-r /home/aneumann/projects/def-adhaj/aneumann/GNRS/requirements/or.txt (line 1))
Processing /cvmfs/soft.computecanada.ca/custom/python/wheelhouse/gentoo2023/generic/numpy-2.2.2+computecanada-cp312-cp312-linux_x86_64.whl (from ortools<9.11,>=9.10->-r /home/aneumann/projects/def-adhaj/aneumann/GNRS/requirements/or.txt (line 1))
Processing /cvmfs/soft.computecanada.ca/custom/python/wheelhouse/gentoo2023/x86-64-v3/protobuf-6.31.1+computecanada-cp312-cp312-linux_x86_64.whl (from ortools<9.11,>=9.10->-r /home/aneumann/projects/def-adhaj/aneumann/GNRS/requirements/or.txt (line 1))
Requirement already satisfied: immutabledict>=3.0.0 in /localscratch/aneumann.47038314.0/env/lib/python3.12/site-packages (from ortools<9.11,>=9.10->-r /home/aneumann/projects/def-adhaj/aneumann/GNRS/requirements/or.txt (line 1)) (4.2.0)
Processing /cvmfs/soft.computecanada.ca/custom/python/wheelhouse/gentoo2023/generic/contourpy-1.3.1+computecanada-cp312-cp312-linux_x86_64.whl (from matplotlib->-r /home/aneumann/projects/def-adhaj/aneumann/GNRS/requirements/or.txt (line 2))
Processing /cvmfs/soft.computecanada.ca/custom/python/wheelhouse/generic/cycler-0.12.1+computecanada-py3-none-any.whl (from matplotlib->-r /home/aneumann/projects/def-adhaj/aneumann/GNRS/requirements/or.txt (line 2))
Processing /cvmfs/soft.computecanada.ca/custom/python/wheelhouse/generic/fonttools-4.59.0+computecanada-cp312-cp312-linux_x86_64.whl (from matplotlib->-r /home/aneumann/projects/def-adhaj/aneumann/GNRS/requirements/or.txt (line 2))
Processing /cvmfs/soft.computecanada.ca/custom/python/wheelhouse/gentoo2023/x86-64-v3/kiwisolver-1.4.8+computecanada-cp312-cp312-linux_x86_64.whl (from matplotlib->-r /home/aneumann/projects/def-adhaj/aneumann/GNRS/requirements/or.txt (line 2))
Processing /cvmfs/soft.computecanada.ca/custom/python/wheelhouse/generic/packaging-25.0+computecanada-py3-none-any.whl (from matplotlib->-r /home/aneumann/projects/def-adhaj/aneumann/GNRS/requirements/or.txt (line 2))
Processing /cvmfs/soft.computecanada.ca/custom/python/wheelhouse/gentoo2023/x86-64-v3/pillow-11.1.0+computecanada-cp312-cp312-linux_x86_64.whl (from matplotlib->-r /home/aneumann/projects/def-adhaj/aneumann/GNRS/requirements/or.txt (line 2))
Processing /cvmfs/soft.computecanada.ca/custom/python/wheelhouse/generic/pyparsing-3.2.3+computecanada-py3-none-any.whl (from matplotlib->-r /home/aneumann/projects/def-adhaj/aneumann/GNRS/requirements/or.txt (line 2))
Processing /cvmfs/soft.computecanada.ca/custom/python/wheelhouse/generic/python_dateutil-2.9.0.post0+computecanada-py2.py3-none-any.whl (from matplotlib->-r /home/aneumann/projects/def-adhaj/aneumann/GNRS/requirements/or.txt (line 2))
Processing /cvmfs/soft.computecanada.ca/custom/python/wheelhouse/generic/pytz-2025.2+computecanada-py2.py3-none-any.whl (from pandas->-r /home/aneumann/projects/def-adhaj/aneumann/GNRS/requirements/or.txt (line 3))
Processing /cvmfs/soft.computecanada.ca/custom/python/wheelhouse/generic/tzdata-2025.2+computecanada-py2.py3-none-any.whl (from pandas->-r /home/aneumann/projects/def-adhaj/aneumann/GNRS/requirements/or.txt (line 3))
Processing /cvmfs/soft.computecanada.ca/custom/python/wheelhouse/generic/six-1.17.0+computecanada-py2.py3-none-any.whl (from python-dateutil>=2.7->matplotlib->-r /home/aneumann/projects/def-adhaj/aneumann/GNRS/requirements/or.txt (line 2))
Installing collected packages: pytz, tzdata, six, pyparsing, protobuf, pillow, packaging, numpy, kiwisolver, fonttools, cycler, absl-py, python-dateutil, contourpy, pandas, matplotlib, ortools
Successfully installed absl-py-2.3.0+computecanada contourpy-1.3.1+computecanada cycler-0.12.1+computecanada fonttools-4.59.0+computecanada kiwisolver-1.4.8+computecanada matplotlib-3.10.0+computecanada numpy-2.2.2+computecanada ortools-9.10.4067+computecanada packaging-25.0+computecanada pandas-2.2.3+computecanada pillow-11.1.0+computecanada protobuf-6.31.1+computecanada pyparsing-3.2.3+computecanada python-dateutil-2.9.0.post0+computecanada pytz-2025.2+computecanada six-1.17.0+computecanada tzdata-2025.2+computecanada

Starting CP-SAT solver v9.10.4067
Parameters: max_time_in_seconds: 86400 max_memory_in_mb: 185000 log_search_progress: true enumerate_all_solutions: false num_search_workers: 32 absolute_gap_limit: 0 relative_gap_limit: 0

Initial optimization model '': (model_fingerprint: 0xaf78e2c6562780a3)
#Variables: 934 (#ints: 16 in objective)
  - 762 Booleans in [0,1]
  - 172 in [0,1264]
#kLinear1: 87
#kLinear2: 1'812
#kLinear3: 693
#kLinearN: 35'769 (#terms: 991'134)

Starting presolve at 0.02s
  4.46e-02s  0.00e+00d  [DetectDominanceRelations] 
  7.53e-01s  0.00e+00d  [PresolveToFixPoint] #num_loops=8 #num_dual_strengthening=3 
  3.94e-04s  0.00e+00d  [ExtractEncodingFromLinear] #potential_supersets=10 
[Symmetry] Graph for symmetry has 38'234 nodes and 876'973 arcs.
[Symmetry] Symmetry computation done. time: 0.0331413 dtime: 0.0630311
[Symmetry] #generators: 1, average support size: 50
[Symmetry] The model contains 936 duplicate constraints !
[Symmetry] 25 orbits with sizes: 2,2,2,2,2,2,2,2,2,2,...
[Symmetry] Num fixable by intersecting at_most_one with orbits: 1 largest_orbit: 2
  3.31e-01s  8.03e-02d  [Probe] #probed=1'282 #new_bounds=11 #equiv=1 
  3.90e-04s  0.00e+00d  [MaxClique] 
  4.46e-02s  0.00e+00d  [DetectDominanceRelations] 
  3.48e-01s  0.00e+00d  [PresolveToFixPoint] #num_loops=5 #num_dual_strengthening=3 
  1.83e-01s  0.00e+00d  [ProcessAtMostOneAndLinear] 
  4.55e-02s  0.00e+00d  [DetectDuplicateConstraints] #duplicates=1'221 #without_enforcements=132 
  9.70e-02s  7.86e-03d  [DetectDominatedLinearConstraints] #relevant_constraints=33'850 #num_inclusions=18'541 
  4.96e-03s  0.00e+00d  [DetectDifferentVariables] #different=91 #cliques=1 #size=12 
  1.67e-02s  1.54e-03d  [ProcessSetPPC] #relevant_constraints=32'923 
  5.63e-04s  0.00e+00d  [FindAlmostIdenticalLinearConstraints] 
  5.14e-03s  6.96e-03d  [FindBigAtMostOneAndLinearOverlap] 
  2.96e-01s  1.57e-01d  [FindBigVerticalLinearOverlap] #blocks=446 #saved_nz=197'545 
  8.81e-03s  3.16e-03d  [FindBigHorizontalLinearOverlap] #linears=31'909 
  3.00e-04s  0.00e+00d  [MergeClauses] 
  4.77e-02s  0.00e+00d  [DetectDominanceRelations] 
  4.08e-01s  0.00e+00d  [PresolveToFixPoint] #num_loops=3 #num_dual_strengthening=1 
  4.78e-02s  0.00e+00d  [DetectDominanceRelations] 
  2.44e-01s  0.00e+00d  [PresolveToFixPoint] #num_loops=1 #num_dual_strengthening=1 
[Symmetry] Graph for symmetry has 38'395 nodes and 675'855 arcs.
[Symmetry] Symmetry computation done. time: 0.0160085 dtime: 0.0332054
  3.06e-01s  6.67e-02d  [Probe] #probed=1'282 #new_bounds=304 
  3.19e-04s  0.00e+00d  [MaxClique] 
  4.70e-02s  0.00e+00d  [DetectDominanceRelations] 
  3.76e-01s  0.00e+00d  [PresolveToFixPoint] #num_loops=2 #num_dual_strengthening=1 
  1.74e-01s  0.00e+00d  [ProcessAtMostOneAndLinear] 
  4.14e-02s  0.00e+00d  [DetectDuplicateConstraints] #without_enforcements=132 
  6.28e-02s  4.49e-03d  [DetectDominatedLinearConstraints] #relevant_constraints=33'887 #num_inclusions=2'017 
  4.46e-03s  0.00e+00d  [DetectDifferentVariables] 
  1.50e-02s  1.14e-03d  [ProcessSetPPC] #relevant_constraints=31'917 
  5.80e-04s  2.93e-06d  [FindAlmostIdenticalLinearConstraints] #num_tested_pairs=175 
  2.48e-03s  2.68e-03d  [FindBigAtMostOneAndLinearOverlap] 
  2.55e-01s  1.07e-01d  [FindBigVerticalLinearOverlap] #blocks=2'038 #saved_nz=203'628 
  7.40e-03s  2.00e-03d  [FindBigHorizontalLinearOverlap] #linears=25'806 
  3.16e-04s  0.00e+00d  [MergeClauses] 
  3.43e-02s  0.00e+00d  [DetectDominanceRelations] 
  3.93e-01s  0.00e+00d  [PresolveToFixPoint] #num_loops=3 #num_dual_strengthening=1 
  3.44e-02s  0.00e+00d  [DetectDominanceRelations] 
  2.48e-01s  0.00e+00d  [PresolveToFixPoint] #num_loops=1 #num_dual_strengthening=1 
[Symmetry] Graph for symmetry has 43'837 nodes and 473'767 arcs.
[Symmetry] Symmetry computation done. time: 0.0117653 dtime: 0.0233915
  2.71e-01s  5.24e-02d  [Probe] #probed=1'282 #new_bounds=1'253 
  3.45e-04s  0.00e+00d  [MaxClique] 
  3.45e-02s  0.00e+00d  [DetectDominanceRelations] 
  3.71e-01s  0.00e+00d  [PresolveToFixPoint] #num_loops=2 #num_dual_strengthening=1 
  1.65e-01s  0.00e+00d  [ProcessAtMostOneAndLinear] 
  3.82e-02s  0.00e+00d  [DetectDuplicateConstraints] #without_enforcements=132 
  4.17e-02s  2.56e-03d  [DetectDominatedLinearConstraints] #relevant_constraints=35'013 #num_inclusions=130 
  4.47e-03s  0.00e+00d  [DetectDifferentVariables] 
  1.17e-02s  6.99e-04d  [ProcessSetPPC] #relevant_constraints=25'920 
  1.24e-03s  1.06e-04d  [FindAlmostIdenticalLinearConstraints] #num_tested_pairs=6'320 
  2.19e-03s  1.71e-03d  [FindBigAtMostOneAndLinearOverlap] 
  1.32e-01s  5.54e-02d  [FindBigVerticalLinearOverlap] #blocks=1'466 #saved_nz=129'118 
  5.44e-03s  1.20e-03d  [FindBigHorizontalLinearOverlap] #linears=18'130 
  3.30e-04s  0.00e+00d  [MergeClauses] 
  2.78e-02s  0.00e+00d  [DetectDominanceRelations] 
  3.77e-01s  0.00e+00d  [PresolveToFixPoint] #num_loops=3 #num_dual_strengthening=1 
  2.71e-03s  0.00e+00d  [ExpandObjective] #entries=17'139 #tight_variables=6'110 #tight_constraints=3'292 

Presolve summary:
  - 299 affine relations were detected.
  - rule 'TODO dual: only one blocking constraint?' was applied 2'391 times.
  - rule 'TODO dual: only one blocking enforced constraint?' was applied 234 times.
  - rule 'TODO dual: only one unspecified blocking constraint?' was applied 112 times.
  - rule 'TODO duplicate: identical constraint with different enforcements' was applied 396 times.
  - rule 'affine: new relation' was applied 299 times.
  - rule 'at_most_one: removed literals' was applied 6 times.
  - rule 'at_most_one: size one' was applied 6 times.
  - rule 'deductions: 2681 stored' was applied 1 time.
  - rule 'dual: fix variable' was applied 45 times.
  - rule 'dual: reduced domain' was applied 110 times.
  - rule 'duplicate: merged rhs of linear constraint' was applied 267 times.
  - rule 'duplicate: removed constraint' was applied 1'221 times.
  - rule 'enforcement: false literal' was applied 10 times.
  - rule 'exactly_one: x and not(x)' was applied 1 time.
  - rule 'incompatible linear: add implication' was applied 198 times.
  - rule 'linear matrix: common vertical rectangle' was applied 3'950 times.
  - rule 'linear: always true' was applied 2'027 times.
  - rule 'linear: doubleton free' was applied 24 times.
  - rule 'linear: empty' was applied 58 times.
  - rule 'linear: extracted enforcement literal' was applied 35'467 times.
  - rule 'linear: fixed or dup variables' was applied 36'027 times.
  - rule 'linear: positive equal one' was applied 10 times.
  - rule 'linear: reduced variable domains' was applied 3'473 times.
  - rule 'linear: remapped using affine relations' was applied 36'462 times.
  - rule 'linear: simplified rhs' was applied 123'850 times.
  - rule 'linear: tightened into equality' was applied 10 times.
  - rule 'linear: variable substitution 1' was applied 24 times.
  - rule 'linear: variable substitution 2' was applied 379 times.
  - rule 'linear: variable substitution 3' was applied 218 times.
  - rule 'no_overlap: inferred from x != y constraints' was applied 1 time.
  - rule 'presolve: 169 unused variables removed.' was applied 1 time.
  - rule 'presolve: iteration' was applied 3 times.
  - rule 'probing: reduced enforced constraint to implication.' was applied 6 times.
  - rule 'symmetry: fixed to false in general orbit' was applied 1 time.

Presolved optimization model '': (model_fingerprint: 0x7ccf189735045841)
#Variables: 3'795 (#ints: 16 in objective)
  - 328 Booleans in [0,1]
  - 2'681 different domains in [-27703,27694] with a largest complexity of 25.
#kExactlyOne: 9 (#literals: 27)
#kInterval: 12
#kLinear2: 2'931 (#enforced: 2'827 #multi: 839)
#kLinear3: 9'083 (#enforced: 6'662)
#kLinearN: 26'046 (#enforced: 24'297) (#terms: 273'022)
#kNoOverlap: 1 (#intervals: 12)

Preloading model.
#Bound   6.36s best:inf   next:[171,17864] initial_domain
[Symmetry] Graph for symmetry has 46'580 nodes and 345'692 arcs.
[Symmetry] Symmetry computation done. time: 0.00974195 dtime: 0.0176859
#Model   6.43s var:3795/3795 constraints:38082/38082

Starting search at 6.45s with 32 workers.
17 full problem subsolvers: [core, default_lp, fixed, lb_tree_search, max_lp, no_lp, objective_lb_search, objective_lb_search_max_lp, objective_lb_search_no_lp, objective_shaving_search_max_lp, objective_shaving_search_no_lp, probing, probing_max_lp, pseudo_costs, quick_restart, quick_restart_no_lp, reduced_costs]
13 first solution subsolvers: [fj_long_default, fj_long_lin_default, fj_long_random, fj_short_default, fj_short_lin_default, fj_short_lin_random, fj_short_random, fs_random(2), fs_random_no_lp, fs_random_quick_restart(2), fs_random_quick_restart_no_lp]
13 incomplete subsolvers: [feasibility_pump, graph_arc_lns, graph_cst_lns, graph_dec_lns, graph_var_lns, rins/rens, rnd_cst_lns, rnd_var_lns, scheduling_intervals_lns, scheduling_precedences_lns, scheduling_time_window_lns, violation_ls(2)]
3 helper subsolvers: [neighborhood_helper, synchronization_agent, update_gap_integral]
#Bound   7.95s best:inf   next:[172,17864] objective_shaving_search_no_lp (vars=3801 csts=38096)
#Bound   8.41s best:inf   next:[174,17864] core (initial_propagation)
#Bound   9.55s best:inf   next:[175,17864] objective_shaving_search_no_lp (vars=3798 csts=38096)
#Bound  10.19s best:inf   next:[183,17864] objective_lb_search_max_lp
#Bound  10.58s best:inf   next:[191,17864] objective_lb_search_max_lp
#Bound  10.71s best:inf   next:[259,17864] objective_lb_search_max_lp
#Bound  10.72s best:inf   next:[261,17864] objective_lb_search_max_lp
#Bound  10.82s best:inf   next:[997,17864] objective_lb_search_max_lp
#1      10.88s best:7574  next:[997,7573] fs_random_quick_restart_no_lp (fixed_bools=0/395)
#Bound  10.90s best:7574  next:[1066,7573] objective_lb_search_max_lp
#Bound  11.00s best:7574  next:[1162,7573] objective_lb_search_max_lp
#Bound  11.10s best:7574  next:[1343,7573] objective_lb_search_max_lp
#2      11.48s best:7573  next:[1343,7572] violation_ls(batch:2 #solutions_imported:1 #lin_moves:0 #lin_evals:36'517 #gen_moves:14'542 #gen_evals:1'700 #comp_moves:3'049 #backtracks:5'744 #weight_updates:140)
#3      11.64s best:7572  next:[1343,7571] violation_ls(batch:3 #solutions_imported:2 #lin_moves:0 #lin_evals:52'292 #gen_moves:21'320 #gen_evals:2'371 #comp_moves:3'631 #backtracks:8'842 #weight_updates:243)
#4      12.58s best:7571  next:[1343,7570] violation_ls(batch:5 #solutions_imported:3 #lin_moves:9'272 #lin_evals:89'625 #gen_moves:21'320 #gen_evals:2'371 #comp_moves:3'631 #backtracks:8'842 #weight_updates:2'103)
#5      12.64s best:7570  next:[1343,7569] violation_ls(batch:5 #solutions_imported:3 #lin_moves:36'515 #lin_evals:162'562 #gen_moves:7'968 #gen_evals:857 #comp_moves:895 #backtracks:3'536 #weight_updates:1'100)
#6      12.68s best:6969  next:[1343,6968] quick_restart_no_lp (fixed_bools=0/531)
#7      12.88s best:6964  next:[1343,6963] quick_restart_no_lp (fixed_bools=0/544)
#8      13.04s best:6417  next:[1343,6416] no_lp (fixed_bools=0/435)
#9      13.59s best:6247  next:[1343,6246] no_lp (fixed_bools=0/461)
#10     14.18s best:6021  next:[1343,6020] no_lp (fixed_bools=0/484)
#Bound  14.93s best:6021  next:[1347,6020] objective_lb_search_max_lp
#11     15.51s best:5969  next:[1347,5968] no_lp (fixed_bools=0/514)
#12     16.59s best:5744  next:[1347,5743] rins_lp_lns (d=0.94 s=206 t=0.10 p=1.00 stall=0 h=auto_l0)
#Bound  16.95s best:5744  next:[1406,5743] reduced_costs
#Bound  17.63s best:5744  next:[1410,5743] reduced_costs
#13     20.26s best:5727  next:[1410,5726] no_lp (fixed_bools=3/540)
#14     21.05s best:5695  next:[1410,5694] no_lp (fixed_bools=3/546)
#Bound  21.51s best:5695  next:[1424,5694] objective_lb_search_max_lp
#15     23.22s best:5690  next:[1424,5689] no_lp (fixed_bools=3/551)
#16     24.09s best:5682  next:[1424,5681] quick_restart_no_lp (fixed_bools=0/729)
#17     24.42s best:5678  next:[1424,5677] no_lp (fixed_bools=3/557)
#18     24.46s best:5673  next:[1424,5672] quick_restart_no_lp (fixed_bools=0/742)
#19     24.85s best:5591  next:[1424,5590] quick_restart_no_lp (fixed_bools=0/750)
#20     25.18s best:5589  next:[1424,5588] violation_ls(batch:13 #solutions_imported:9 #lin_moves:19'071 #lin_evals:237'067 #gen_moves:67'683 #gen_evals:7'931 #comp_moves:8'452 #backtracks:29'606 #weight_updates:2'826)
#21     25.19s best:5587  next:[1424,5586] violation_ls(batch:13 #solutions_imported:10 #lin_moves:62'863 #lin_evals:345'022 #gen_moves:37'767 #gen_evals:4'426 #comp_moves:5'647 #backtracks:16'051 #weight_updates:5'044)
#22     26.58s best:5514  next:[1424,5513] rnd_var_lns (d=0.99 s=300 t=0.10 p=1.00 stall=11 h=auto_l0) [hint]
#23     26.71s best:5074  next:[1424,5073] rins_pump_lns (d=0.89 s=309 t=0.10 p=0.64 stall=3 h=auto_l0)
#24     28.53s best:5062  next:[1424,5061] rnd_cst_lns (d=0.99 s=313 t=0.10 p=1.00 stall=12 h=folio_rnd)
#25     28.76s best:5045  next:[1424,5044] rins_lp_lns (d=0.92 s=321 t=0.10 p=0.67 stall=0 h=auto_l0)
#26     30.00s best:5042  next:[1424,5041] quick_restart_no_lp (fixed_bools=0/820)
#27     30.34s best:5041  next:[1424,5040] violation_ls(batch:16 #solutions_imported:13 #lin_moves:74'372 #lin_evals:421'621 #gen_moves:45'374 #gen_evals:4'981 #comp_moves:6'234 #backtracks:19'561 #weight_updates:5'508)
#28     31.24s best:5028  next:[1424,5027] graph_cst_lns (d=0.99 s=328 t=0.10 p=1.00 stall=0 h=auto_l0)
#29     31.67s best:5023  next:[1424,5022] rnd_var_lns (d=0.99 s=324 t=0.10 p=1.00 stall=0 h=auto_l0)
#30     32.54s best:4957  next:[1424,4956] rins_lp_lns (d=0.92 s=345 t=0.10 p=0.64 stall=1 h=auto_l0)
#31     35.95s best:4881  next:[1424,4880] graph_cst_lns (d=0.99 s=352 t=0.10 p=1.00 stall=0 h=auto_l0)
#Bound  36.41s best:4881  next:[1434,4880] objective_lb_search_max_lp
#32     38.20s best:4876  next:[1434,4875] quick_restart_no_lp (fixed_bools=0/967)
#33     38.37s best:4875  next:[1434,4874] violation_ls(batch:19 #solutions_imported:16 #lin_moves:87'580 #lin_evals:487'391 #gen_moves:53'001 #gen_evals:5'734 #comp_moves:7'936 #backtracks:22'523 #weight_updates:6'450)
#Bound  39.75s best:4875  next:[1438,4874] objective_lb_search_max_lp
#34     39.88s best:4717  next:[1438,4716] graph_arc_lns (d=1.00 s=363 t=0.10 p=1.00 stall=0 h=auto_l0)
#35     40.44s best:4716  next:[1438,4715] violation_ls(batch:20 #solutions_imported:16 #lin_moves:28'040 #lin_evals:369'161 #gen_moves:108'497 #gen_evals:12'274 #comp_moves:13'533 #backtracks:47'445 #weight_updates:4'273)
#36     40.45s best:4715  next:[1438,4714] violation_ls(batch:20 #solutions_imported:17 #lin_moves:87'581 #lin_evals:487'405 #gen_moves:53'001 #gen_evals:5'734 #comp_moves:7'936 #backtracks:22'523 #weight_updates:6'450)
#37     42.91s best:4680  next:[1438,4679] rnd_var_lns (d=1.00 s=388 t=0.10 p=0.94 stall=0 h=auto_l0)
#38     43.20s best:4518  next:[1438,4517] rins_lp_lns (d=0.92 s=397 t=0.10 p=0.61 stall=0 h=auto_l0)
#39     45.33s best:4429  next:[1438,4428] rnd_cst_lns (d=1.00 s=401 t=0.10 p=0.89 stall=0 h=auto_l0)
#40     47.47s best:4408  next:[1438,4407] graph_cst_lns (d=0.99 s=416 t=0.10 p=0.84 stall=0 h=auto_l0)
#41     48.67s best:4405  next:[1438,4404] graph_dec_lns (d=1.00 s=417 t=0.10 p=0.90 stall=0 h=auto_l0)
#42     50.72s best:4404  next:[1438,4403] violation_ls(batch:24 #solutions_imported:20 #lin_moves:38'411 #lin_evals:452'204 #gen_moves:125'557 #gen_evals:13'824 #comp_moves:15'082 #backtracks:55'199 #weight_updates:4'856)
#43     50.74s best:4403  next:[1438,4402] violation_ls(batch:24 #solutions_imported:21 #lin_moves:106'923 #lin_evals:570'602 #gen_moves:61'626 #gen_evals:6'623 #comp_moves:8'378 #backtracks:26'614 #weight_updates:7'295)
#44     51.78s best:4393  next:[1438,4392] graph_cst_lns (d=1.00 s=428 t=0.10 p=0.86 stall=0 h=auto_l0)
#45     55.45s best:4369  next:[1438,4368] rnd_var_lns (d=1.00 s=436 t=0.10 p=0.86 stall=2 h=auto_l0)
#46     56.45s best:4367  next:[1438,4366] violation_ls(batch:26 #solutions_imported:22 #lin_moves:47'404 #lin_evals:487'583 #gen_moves:125'557 #gen_evals:13'824 #comp_moves:15'082 #backtracks:55'199 #weight_updates:6'788)
#47     56.54s best:4366  next:[1438,4365] violation_ls(batch:26 #solutions_imported:23 #lin_moves:106'923 #lin_evals:604'078 #gen_moves:74'349 #gen_evals:7'503 #comp_moves:9'985 #backtracks:32'172 #weight_updates:7'454)
#Bound  57.55s best:4366  next:[1454,4365] objective_lb_search_max_lp
#48     58.62s best:4361  next:[1454,4360] rnd_cst_lns (d=0.99 s=461 t=0.10 p=0.79 stall=1 h=auto_l0)
#49     59.57s best:4347  next:[1454,4346] rins_lp_lns (d=0.92 s=471 t=0.10 p=0.58 stall=0 h=auto_l0)
#50     59.63s best:4346  next:[1454,4345] violation_ls(batch:27 #solutions_imported:23 #lin_moves:53'715 #lin_evals:512'584 #gen_moves:125'557 #gen_evals:13'824 #comp_moves:15'082 #backtracks:55'199 #weight_updates:7'524)
#51     61.32s best:4344  next:[1454,4343] graph_var_lns (d=0.99 s=476 t=0.10 p=0.76 stall=0 h=auto_l0) [hint]
#52     63.26s best:4343  next:[1454,4342] quick_restart_no_lp (fixed_bools=0/1167)
#53     64.81s best:4342  next:[1454,4341] violation_ls(batch:29 #solutions_imported:25 #lin_moves:53'715 #lin_evals:536'702 #gen_moves:134'971 #gen_evals:14'368 #comp_moves:15'612 #backtracks:59'638 #weight_updates:7'658)
#54     65.52s best:4338  next:[1454,4337] graph_arc_lns (d=0.99 s=489 t=0.10 p=0.77 stall=0 h=auto_l0)
#55     67.50s best:4326  next:[1454,4325] rins_lp_lns (d=0.92 s=507 t=0.10 p=0.58 stall=0 h=auto_l0)
#56     74.05s best:4226  next:[1454,4225] graph_var_lns (d=1.00 s=524 t=0.10 p=0.76 stall=1 h=auto_l0)
#57     77.91s best:4218  next:[1454,4217] rnd_var_lns (d=1.00 s=546 t=0.10 p=0.75 stall=3 h=auto_l0)
#58     82.48s best:4214  next:[1454,4213] graph_dec_lns (d=1.00 s=563 t=0.10 p=0.76 stall=0 h=auto_l0)
#Bound  84.22s best:4214  next:[1455,4213] objective_lb_search_max_lp
#59     88.92s best:4198  next:[1455,4197] rins_lp_lns (d=0.91 s=605 t=0.10 p=0.55 stall=6 h=auto_l0)
#60     93.00s best:4174  next:[1455,4173] rnd_cst_lns (d=1.00 s=609 t=0.10 p=0.72 stall=2 h=auto_l0)
#61     93.10s best:4173  next:[1455,4172] violation_ls(batch:39 #solutions_imported:31 #lin_moves:127'966 #lin_evals:909'652 #gen_moves:149'465 #gen_evals:15'200 #comp_moves:16'516 #backtracks:66'431 #weight_updates:13'630)
#62     93.16s best:4172  next:[1455,4171] violation_ls(batch:39 #solutions_imported:32 #lin_moves:173'491 #lin_evals:970'482 #gen_moves:122'946 #gen_evals:11'181 #comp_moves:13'390 #backtracks:54'757 #weight_updates:9'553)
#63     95.19s best:4171  next:[1455,4170] graph_var_lns (d=0.99 s=622 t=0.10 p=0.68 stall=0 h=auto_l0)
#64     95.24s best:4103  next:[1455,4102] rins_lp_lns (d=0.91 s=629 t=0.10 p=0.54 stall=1 h=auto_l0)
#65    104.33s best:4050  next:[1455,4049] graph_var_lns (d=1.00 s=658 t=0.10 p=0.70 stall=1 h=auto_l0)
#Bound 107.23s best:4050  next:[1457,4049] objective_lb_search_max_lp
#66    110.28s best:4049  next:[1457,4048] quick_restart_no_lp (fixed_bools=0/1607)
#67    113.91s best:4026  next:[1457,4025] rnd_var_lns (d=1.00 s=694 t=0.10 p=0.67 stall=0 h=auto_l0)
#Bound 118.26s best:4026  next:[1458,4025] objective_lb_search_max_lp
#68    120.14s best:3984  next:[1458,3983] rins_lp_lns (d=0.92 s=729 t=0.10 p=0.55 stall=1 h=auto_l0)
#69    121.91s best:3972  next:[1458,3971] rnd_var_lns (d=1.00 s=718 t=0.10 p=0.69 stall=0 h=auto_l0)
#70    125.53s best:3951  next:[1458,3950] graph_dec_lns (d=1.00 s=737 t=0.10 p=0.67 stall=0 h=auto_l0)
#71    126.12s best:3936  next:[1458,3935] rins_lp_lns (d=0.92 s=753 t=0.10 p=0.55 stall=1 h=auto_l0)
#72    132.14s best:3912  next:[1458,3911] rnd_cst_lns (d=1.00 s=769 t=0.10 p=0.66 stall=0 h=auto_l0)
#73    137.25s best:3871  next:[1458,3870] graph_cst_lns (d=1.00 s=784 t=0.10 p=0.65 stall=0 h=auto_l0)
#74    139.86s best:3862  next:[1458,3861] rins_lp_lns (d=0.91 s=813 t=0.10 p=0.53 stall=0 h=auto_l0)
#75    154.20s best:3736  next:[1458,3735] rnd_var_lns (d=1.00 s=852 t=0.10 p=0.63 stall=2 h=auto_l0)
#Bound 169.62s best:3736  next:[1459,3735] lb_tree_search (nodes=1119/1119 rc=2 decisions=13523 @root=17 restarts=10) 
#76    174.89s best:3714  next:[1459,3713] graph_dec_lns (d=1.00 s=943 t=0.10 p=0.62 stall=1 h=auto_l0)
#77    177.25s best:3712  next:[1459,3711] quick_restart_no_lp (fixed_bools=0/2037)
#78    178.56s best:3710  next:[1459,3709] quick_restart_no_lp (fixed_bools=0/2049)
#Bound 179.29s best:3710  next:[1460,3709] lb_tree_search (nodes=1238/1239 rc=2 decisions=14291 @root=18 restarts=10) 
#79    179.80s best:3709  next:[1460,3708] violation_ls(batch:68 #solutions_imported:45 #lin_moves:265'218 #lin_evals:1'821'597 #gen_moves:287'657 #gen_evals:23'757 #comp_moves:24'572 #backtracks:131'472 #weight_updates:17'853)
#80    179.81s best:3708  next:[1460,3707] violation_ls(batch:68 #solutions_imported:45 #lin_moves:322'256 #lin_evals:1'844'675 #gen_moves:227'430 #gen_evals:18'282 #comp_moves:27'613 #backtracks:99'851 #weight_updates:21'808)
#81    179.95s best:3674  next:[1460,3673] rins_lp_lns (d=0.91 s=974 t=0.10 p=0.52 stall=6 h=auto_l0)
#82    184.04s best:3670  next:[1460,3669] graph_arc_lns (d=1.00 s=980 t=0.10 p=0.61 stall=0 h=auto_l0)
#Bound 190.46s best:3670  next:[1461,3669] lb_tree_search (nodes=1434/1436 rc=2 decisions=15327 @root=19 restarts=10) 
#Bound 200.43s best:3670  next:[1462,3669] lb_tree_search (nodes=1552/1554 rc=2 decisions=16246 @root=20 restarts=10) 
#Bound 209.64s best:3670  next:[1463,3669] lb_tree_search (nodes=1734/1736 rc=3 decisions=17350 @root=21 restarts=10) 
#Bound 219.59s best:3670  next:[1464,3669] lb_tree_search (nodes=1850/1852 rc=3 decisions=18173 @root=22 restarts=10) 
#Bound 231.59s best:3670  next:[1471,3669] objective_lb_search_max_lp
#Bound 246.38s best:3670  next:[1475,3669] objective_lb_search_max_lp
#83    313.77s best:3574  next:[1475,3573] rins_lp_lns (d=0.91 s=1525 t=0.10 p=0.51 stall=1 h=auto_l0)
#84    318.94s best:3562  next:[1475,3561] graph_var_lns (d=1.00 s=1542 t=0.10 p=0.56 stall=1 h=auto_l0)
#Bound 383.09s best:3562  next:[1476,3561] lb_tree_search (nodes=7061/7070 rc=41 decisions=36513 @root=26 restarts=10) 
#Bound 408.69s best:3562  next:[1477,3561] objective_lb_search_max_lp
#Bound 455.54s best:3562  next:[1481,3561] objective_lb_search_max_lp
#Bound 511.35s best:3562  next:[1491,3561] objective_lb_search_max_lp
#85    593.64s best:3532  next:[1491,3531] rnd_var_lns (d=1.00 s=2427 t=0.10 p=0.55 stall=4 h=auto_l0)
#86    685.73s best:3483  next:[1491,3482] rnd_var_lns (d=1.00 s=2686 t=0.10 p=0.54 stall=0 h=auto_l0)
#87    721.20s best:3444  next:[1491,3443] rnd_var_lns (d=1.00 s=2809 t=0.10 p=0.54 stall=0 h=auto_l0)
#88    727.21s best:3372  next:[1491,3371] rnd_var_lns (d=1.00 s=2834 t=0.10 p=0.53 stall=0 h=auto_l0)
#89    734.75s best:3346  next:[1491,3345] rins_pump_lns (d=0.93 s=2868 t=0.10 p=0.51 stall=20 h=auto_l0)
#Bound 737.36s best:3346  next:[1494,3345] objective_lb_search_max_lp
#90    792.33s best:3342  next:[1494,3341] rnd_cst_lns (d=1.00 s=3071 t=0.10 p=0.53 stall=1 h=auto_l0)
#Bound 1068.58s best:3342  next:[1495,3341] objective_lb_search_max_lp
#91    1262.70s best:3341  next:[1495,3340] quick_restart_no_lp (fixed_bools=0/4182)
#92    1264.53s best:3340  next:[1495,3339] quick_restart_no_lp (fixed_bools=0/4188)
#93    1265.18s best:3339  next:[1495,3338] violation_ls(batch:383 #solutions_imported:56 #perturbations:1 #lin_moves:1'415'217 #lin_evals:9'292'731 #gen_moves:1'218'595 #gen_evals:109'302 #comp_moves:65'641 #backtracks:576'384 #weight_updates:722'806)
#94    1265.44s best:3338  next:[1495,3337] violation_ls(batch:383 #solutions_imported:56 #perturbations:1 #lin_moves:1'239'503 #lin_evals:9'298'003 #gen_moves:771'045 #gen_evals:214'677 #comp_moves:97'910 #backtracks:336'403 #weight_updates:26'766)
#Bound 1520.26s best:3338  next:[1496,3337] lb_tree_search (nodes=32136/32138 rc=63 decisions=146220 @root=49 restarts=11) 
#Bound 1543.18s best:3338  next:[1497,3337] objective_lb_search_max_lp
#95    1714.30s best:3326  next:[1497,3325] rnd_var_lns (d=1.00 s=6777 t=0.10 p=0.51 stall=0 h=auto_l0)
#96    1716.35s best:3317  next:[1497,3316] rins_lp_lns (d=0.93 s=6798 t=0.10 p=0.50 stall=6 h=auto_l0)
#Bound 1817.29s best:3317  next:[1498,3316] lb_tree_search (nodes=38822/38831 rc=65 decisions=177745 @root=54 restarts=11) 
#Bound 1990.71s best:3317  next:[1500,3316] objective_lb_search_max_lp
#Bound 2409.90s best:3317  next:[1501,3316] objective_lb_search_max_lp
#Bound 2687.14s best:3317  next:[1502,3316] lb_tree_search (nodes=57442/57454 rc=76 decisions=262602 @root=70 restarts=11) 
#Bound 2843.95s best:3317  next:[1503,3316] objective_lb_search_max_lp
#Bound 3137.37s best:3317  next:[1504,3316] objective_lb_search_max_lp
#Bound 3307.22s best:3317  next:[1505,3316] objective_lb_search_max_lp
#Bound 3519.86s best:3317  next:[1506,3316] objective_lb_search_max_lp
#97    4014.79s best:3313  next:[1506,3312] rnd_var_lns (d=1.00 s=16184 t=0.10 p=0.51 stall=0 h=auto_l0)
#98    4040.23s best:3308  next:[1506,3307] graph_arc_lns (d=1.00 s=16286 t=0.10 p=0.51 stall=2 h=auto_l0)
#99    4057.07s best:3306  next:[1506,3305] rnd_cst_lns (d=1.00 s=16346 t=0.10 p=0.51 stall=1 h=auto_l0)
#100   4070.51s best:3302  next:[1506,3301] graph_dec_lns (d=1.00 s=16400 t=0.10 p=0.51 stall=3 h=auto_l0)
#101   4103.89s best:3300  next:[1506,3299] rnd_cst_lns (d=1.00 s=16531 t=0.10 p=0.51 stall=2 h=auto_l0)
#Bound 4114.67s best:3300  next:[1508,3299] objective_lb_search_max_lp
#Bound 4383.04s best:3300  next:[1509,3299] objective_lb_search_max_lp
#Bound 4984.63s best:3300  next:[1510,3299] objective_lb_search_max_lp
#Bound 5589.75s best:3300  next:[1511,3299] objective_lb_search_max_lp
#Bound 5847.09s best:3300  next:[1512,3299] objective_lb_search_max_lp
#102   5959.66s best:3293  next:[1512,3292] rins_pump_lns (d=0.93 s=23554 t=0.10 p=0.50 stall=0 h=auto_l0)
#Bound 6344.02s best:3293  next:[1513,3292] objective_lb_search_max_lp
#Bound 6568.03s best:3293  next:[1514,3292] objective_lb_search_max_lp
#103   6572.16s best:3287  next:[1514,3286] graph_dec_lns (d=1.00 s=25872 t=0.10 p=0.50 stall=0 h=auto_l0)
#104   6662.60s best:3281  next:[1514,3280] quick_restart_no_lp (fixed_bools=7/9259)
#105   6664.69s best:3268  next:[1514,3267] graph_cst_lns (d=1.00 s=26218 t=0.10 p=0.50 stall=0 h=auto_l0)
#106   6664.87s best:3267  next:[1514,3266] violation_ls(batch:2109 #solutions_imported:67 #perturbations:15 #lin_moves:10'748'797 #lin_evals:79'636'293 #gen_moves:2'415'564 #gen_evals:799'442 #comp_moves:221'035 #backtracks:1'097'021 #weight_updates:1'310'559)
#107   6664.88s best:3266  next:[1514,3265] violation_ls(batch:2109 #solutions_imported:67 #perturbations:15 #lin_moves:10'022'619 #lin_evals:65'186'782 #gen_moves:2'661'323 #gen_evals:921'224 #comp_moves:226'475 #backtracks:1'217'048 #weight_updates:1'540'208)
#108   6665.28s best:3249  next:[1514,3248] rins_pump_lns (d=0.93 s=26235 t=0.10 p=0.50 stall=0 h=auto_l0)
#Bound 6971.15s best:3249  next:[1515,3248] objective_lb_search_max_lp
#Bound 7287.02s best:3249  next:[1516,3248] objective_lb_search_max_lp
#Bound 7444.84s best:3249  next:[1517,3248] objective_lb_search_max_lp
#Bound 8187.63s best:3249  next:[1518,3248] objective_lb_search_max_lp
#109   8724.62s best:3232  next:[1518,3231] rnd_var_lns (d=1.00 s=34198 t=0.10 p=0.50 stall=2 h=auto_l0)
#Bound 8946.37s best:3232  next:[1519,3231] objective_lb_search_max_lp
#Bound 9831.31s best:3232  next:[1520,3231] lb_tree_search (nodes=165828/165864 rc=191 decisions=793556 @root=177 restarts=11) 
#110   10185.60s best:3228  next:[1520,3227] rnd_cst_lns (d=1.00 s=39966 t=0.10 p=0.50 stall=3 h=auto_l0)
#111   10189.16s best:3216  next:[1520,3215] rins_pump_lns (d=0.93 s=39987 t=0.10 p=0.50 stall=4 h=auto_l0)
#Bound 10238.19s best:3216  next:[1522,3215] objective_lb_search_max_lp
#Bound 10913.87s best:3216  next:[1523,3215] objective_lb_search_max_lp
#Bound 11162.90s best:3216  next:[1524,3215] objective_lb_search_max_lp
#Bound 12584.31s best:3216  next:[1525,3215] lb_tree_search (nodes=194765/194807 rc=240 decisions=963549 @root=210 restarts=11) 
#Bound 12762.02s best:3216  next:[1526,3215] objective_lb_search_max_lp
#Bound 13298.50s best:3216  next:[1527,3215] objective_lb_search_max_lp
#112   13739.20s best:3214  next:[1527,3213] rnd_var_lns (d=1.00 s=52500 t=0.10 p=0.50 stall=2 h=auto_l0)
#Bound 13749.71s best:3214  next:[1531,3213] objective_lb_search_max_lp
#Bound 15824.90s best:3214  next:[1532,3213] objective_lb_search_max_lp
#Bound 16282.03s best:3214  next:[1533,3213] objective_lb_search_max_lp
#Bound 16976.71s best:3214  next:[1534,3213] lb_tree_search (nodes=84361/84361 rc=363 decisions=1279736 @root=274 restarts=12) 
#Bound 17551.72s best:3214  next:[1535,3213] lb_tree_search (nodes=91273/91273 rc=386 decisions=1313830 @root=281 restarts=12) 
#Bound 18102.54s best:3214  next:[1536,3213] lb_tree_search (nodes=97551/97551 rc=398 decisions=1347326 @root=286 restarts=12) 
#Bound 18663.06s best:3214  next:[1537,3213] lb_tree_search (nodes=104689/104689 rc=403 decisions=1385637 @root=293 restarts=12) 
#Bound 19361.63s best:3214  next:[1538,3213] lb_tree_search (nodes=112944/112945 rc=411 decisions=1428234 @root=304 restarts=12) 
#Bound 19547.32s best:3214  next:[1541,3213] objective_lb_search_max_lp
#Bound 20858.86s best:3214  next:[1542,3213] lb_tree_search (nodes=134585/134589 rc=455 decisions=1537301 @root=325 restarts=12) 
#Bound 21462.66s best:3214  next:[1543,3213] lb_tree_search (nodes=140766/140771 rc=465 decisions=1577476 @root=334 restarts=12) 
#Bound 22059.89s best:3214  next:[1544,3213] lb_tree_search (nodes=146907/146915 rc=491 decisions=1618316 @root=343 restarts=12) 
#Bound 22744.97s best:3214  next:[1545,3213] lb_tree_search (nodes=154532/154542 rc=511 decisions=1665908 @root=352 restarts=12) 
#Bound 23316.81s best:3214  next:[1546,3213] objective_lb_search_max_lp
#Bound 23772.43s best:3214  next:[1547,3213] objective_lb_search_max_lp
#Bound 24072.01s best:3214  next:[1549,3213] objective_lb_search_max_lp
#Bound 24351.30s best:3214  next:[1552,3213] objective_lb_search_max_lp
#Bound 24764.28s best:3214  next:[1553,3213] objective_lb_search_max_lp
#Bound 25136.09s best:3214  next:[1554,3213] objective_lb_search_max_lp
#Bound 26046.12s best:3214  next:[1555,3213] objective_lb_search_max_lp
#Bound 26382.73s best:3214  next:[1557,3213] objective_lb_search_max_lp
#Bound 30508.73s best:3214  next:[1558,3213] objective_lb_search_max_lp
#Bound 31375.78s best:3214  next:[1559,3213] objective_lb_search_max_lp
#Bound 32561.79s best:3214  next:[1561,3213] objective_lb_search_max_lp
#Bound 32775.87s best:3214  next:[1562,3213] objective_lb_search_max_lp
#Bound 34460.04s best:3214  next:[1563,3213] objective_lb_search_max_lp
#Bound 34649.92s best:3214  next:[1564,3213] objective_lb_search_max_lp
#Bound 36809.20s best:3214  next:[1566,3213] objective_lb_search_max_lp
#Bound 37338.93s best:3214  next:[1567,3213] objective_lb_search_max_lp
#Bound 37736.42s best:3214  next:[1568,3213] objective_lb_search_max_lp
#Bound 37799.52s best:3214  next:[1570,3213] objective_lb_search_max_lp
#Bound 38777.48s best:3214  next:[1572,3213] objective_lb_search_max_lp
#Bound 38926.63s best:3214  next:[1574,3213] objective_lb_search_max_lp
#Bound 40848.24s best:3214  next:[1576,3213] objective_lb_search_max_lp
#Bound 42233.01s best:3214  next:[1577,3213] objective_lb_search_max_lp
#Bound 42734.77s best:3214  next:[1578,3213] objective_lb_search_max_lp
#Bound 43187.37s best:3214  next:[1580,3213] objective_lb_search_max_lp
#Bound 44597.05s best:3214  next:[1581,3213] objective_lb_search_max_lp
#Bound 46183.64s best:3214  next:[1584,3213] objective_lb_search_max_lp
#Bound 46767.99s best:3214  next:[1585,3213] objective_lb_search_max_lp
#Bound 46897.84s best:3214  next:[1586,3213] objective_lb_search_max_lp
#Bound 47063.27s best:3214  next:[1587,3213] objective_lb_search_max_lp
#Bound 47225.87s best:3214  next:[1588,3213] objective_lb_search_max_lp
#Bound 50573.89s best:3214  next:[1589,3213] objective_lb_search_max_lp
#Bound 51417.45s best:3214  next:[1590,3213] objective_lb_search_max_lp
#Bound 52279.83s best:3214  next:[1591,3213] objective_lb_search_max_lp
#Bound 52660.99s best:3214  next:[1592,3213] objective_lb_search_max_lp
#Bound 54501.48s best:3214  next:[1596,3213] objective_lb_search_max_lp
#Bound 55034.39s best:3214  next:[1597,3213] objective_lb_search_max_lp
#Bound 56302.45s best:3214  next:[1599,3213] objective_lb_search_max_lp
#Bound 58258.13s best:3214  next:[1600,3213] objective_lb_search_max_lp
#Bound 61004.90s best:3214  next:[1601,3213] objective_lb_search_max_lp
#Bound 61063.52s best:3214  next:[1603,3213] objective_lb_search_max_lp
#Bound 63334.68s best:3214  next:[1604,3213] objective_lb_search_max_lp
#Bound 63909.39s best:3214  next:[1605,3213] objective_lb_search_max_lp
#Bound 64605.35s best:3214  next:[1607,3213] objective_lb_search_max_lp
#Bound 67884.55s best:3214  next:[1609,3213] objective_lb_search_max_lp
#Bound 80218.92s best:3214  next:[1610,3213] objective_lb_search_max_lp
#Bound 80925.21s best:3214  next:[1611,3213] objective_lb_search_max_lp
#Bound 84008.29s best:3214  next:[1612,3213] objective_lb_search_max_lp
#Bound 84599.43s best:3214  next:[1613,3213] objective_lb_search_max_lp

Task timing                                  n [     min,      max]      avg      dev     time         n [     min,      max]      avg      dev    dtime
                             'core':         1 [  24.00h,   24.00h]   24.00h   0.00ns   24.00h         1 [  10.31h,   10.31h]   10.31h   0.00ns   10.31h
                       'default_lp':         1 [  24.00h,   24.00h]   24.00h   0.00ns   24.00h         1 [   1.98h,    1.98h]    1.98h   0.00ns    1.98h
                 'feasibility_pump':     10848 [189.92us,    2.67m]    7.96s    2.04s   23.99h     10844 [469.27ms,   24.53s] 698.24ms 234.02ms    2.10h
                            'fixed':         1 [  24.00h,   24.00h]   24.00h   0.00ns   24.00h         1 [   2.29h,    2.29h]    2.29h   0.00ns    2.29h
                  'fj_long_default':        11 [120.21ms,    2.08s] 318.82ms 557.65ms    3.51s        11 [126.11ms, 197.66ms] 150.98ms  18.10ms    1.66s
              'fj_long_lin_default':        16 [144.84ms,    1.00s] 219.56ms 203.09ms    3.51s        16 [196.46ms, 219.42ms] 207.35ms   6.95ms    3.32s
                   'fj_long_random':         6 [135.26ms,    2.72s] 575.45ms 959.86ms    3.45s         6 [123.45ms, 198.06ms] 159.02ms  22.15ms 954.11ms
                 'fj_short_default':        22 [146.78ms, 418.08ms] 174.82ms  54.16ms    3.85s        22 [191.80ms, 224.08ms] 204.57ms   8.37ms    4.50s
             'fj_short_lin_default':        16 [148.83ms,    1.08s] 218.89ms 224.00ms    3.50s        16 [190.13ms, 216.91ms] 203.35ms   7.14ms    3.25s
              'fj_short_lin_random':        18 [105.78ms, 694.70ms] 187.29ms 124.30ms    3.37s        18 [158.51ms, 219.36ms] 204.35ms  13.66ms    3.68s
                  'fj_short_random':        20 [140.12ms, 522.73ms] 176.84ms  81.21ms    3.54s        20 [190.84ms, 220.83ms] 200.21ms   8.28ms    4.00s
                        'fs_random':         1 [   4.45s,    4.45s]    4.45s   0.00ns    4.45s         1 [ 96.08ms,  96.08ms]  96.08ms   0.00ns  96.08ms
                        'fs_random':         1 [   4.57s,    4.57s]    4.57s   0.00ns    4.57s         1 [ 20.00ns,  20.00ns]  20.00ns   0.00ns  20.00ns
                  'fs_random_no_lp':         1 [   4.37s,    4.37s]    4.37s   0.00ns    4.37s         1 [  7.08ms,   7.08ms]   7.08ms   0.00ns   7.08ms
          'fs_random_quick_restart':         1 [   4.38s,    4.38s]    4.38s   0.00ns    4.38s         1 [ 58.94ms,  58.94ms]  58.94ms   0.00ns  58.94ms
          'fs_random_quick_restart':         1 [   4.57s,    4.57s]    4.57s   0.00ns    4.57s         1 [ 29.22us,  29.22us]  29.22us   0.00ns  29.22us
    'fs_random_quick_restart_no_lp':         1 [   4.45s,    4.45s]    4.45s   0.00ns    4.45s         1 [ 23.63ms,  23.63ms]  23.63ms   0.00ns  23.63ms
                    'graph_arc_lns':     28181 [127.63ms,   12.92s]    4.02s    1.04s   31.48h     28160 [ 10.00ns, 200.65ms]  72.87ms  33.43ms   34.20m
                    'graph_cst_lns':     28181 [119.51ms,   11.61s]    4.23s    1.10s   33.10h     28149 [ 10.00ns, 201.63ms]  73.37ms  33.13ms   34.42m
                    'graph_dec_lns':     28181 [142.43ms,   12.42s]    4.19s    1.08s   32.82h     28140 [ 10.00ns, 200.66ms]  73.78ms  32.61ms   34.60m
                    'graph_var_lns':     28181 [131.27ms,   14.12s]    3.97s    1.18s   31.09h     28144 [ 10.00ns, 201.64ms]  70.42ms  35.50ms   33.03m
                   'lb_tree_search':         1 [  24.00h,   24.00h]   24.00h   0.00ns   24.00h         1 [  12.17h,   12.17h]   12.17h   0.00ns   12.17h
                           'max_lp':         1 [  24.00h,   24.00h]   24.00h   0.00ns   24.00h         1 [   2.58h,    2.58h]    2.58h   0.00ns    2.58h
                            'no_lp':         1 [  24.00h,   24.00h]   24.00h   0.00ns   24.00h         1 [   1.43h,    1.43h]    1.43h   0.00ns    1.43h
              'objective_lb_search':         1 [  24.00h,   24.00h]   24.00h   0.00ns   24.00h         1 [   1.89h,    1.89h]    1.89h   0.00ns    1.89h
       'objective_lb_search_max_lp':         1 [  24.00h,   24.00h]   24.00h   0.00ns   24.00h         1 [   3.00h,    3.00h]    3.00h   0.00ns    3.00h
        'objective_lb_search_no_lp':         1 [  24.00h,   24.00h]   24.00h   0.00ns   24.00h         1 [  58.93m,   58.93m]   58.93m   0.00ns   58.93m
  'objective_shaving_search_max_lp':       118 [160.00ms,    3.43h]   12.20m   22.08m   24.00h       114 [ 33.76ms,   14.74m]   59.29s    1.68m    1.88h
   'objective_shaving_search_no_lp':       120 [582.99ms,    3.43h]   12.00m   21.95m   24.00h       114 [ 33.89ms,    4.96m]   16.85s   31.49s   32.01m
                          'probing':         1 [  24.00h,   24.00h]   24.00h   0.00ns   24.00h         1 [   3.69h,    3.69h]    3.69h   0.00ns    3.69h
                   'probing_max_lp':         1 [  24.00h,   24.00h]   24.00h   0.00ns   24.00h         1 [   4.85h,    4.85h]    4.85h   0.00ns    4.85h
                     'pseudo_costs':         1 [  24.00h,   24.00h]   24.00h   0.00ns   24.00h         1 [   2.12h,    2.12h]    2.12h   0.00ns    2.12h
                    'quick_restart':         1 [  24.00h,   24.00h]   24.00h   0.00ns   24.00h         1 [   3.38h,    3.38h]    3.38h   0.00ns    3.38h
              'quick_restart_no_lp':         1 [  24.00h,   24.00h]   24.00h   0.00ns   24.00h         1 [   1.61h,    1.61h]    1.61h   0.00ns    1.61h
                    'reduced_costs':         1 [  24.00h,   24.00h]   24.00h   0.00ns   24.00h         1 [   2.89h,    2.89h]    2.89h   0.00ns    2.89h
                        'rins/rens':     28181 [921.93us,    7.15s]    1.38s 911.66ms   10.77h     24711 [ 10.00ns, 200.80ms]  70.87ms  42.01ms   29.19m
                      'rnd_cst_lns':     28181 [125.96ms,   12.06s]    4.20s    1.09s   32.87h     28149 [ 10.00ns, 200.27ms]  73.59ms  33.06ms   34.53m
                      'rnd_var_lns':     28181 [ 78.93ms,   12.32s]    4.11s    1.07s   32.15h     28156 [ 10.00ns, 201.05ms]  72.82ms  33.40ms   34.17m
         'scheduling_intervals_lns':     28181 [101.92ms,   14.81s]    5.45s 831.45ms   42.64h     28161 [ 91.77ms, 201.83ms] 100.44ms   2.55ms   47.14m
       'scheduling_precedences_lns':     28180 [   1.85s,   13.14s]    5.39s 850.37ms   42.20h     28169 [  6.59ms, 201.16ms] 100.41ms   1.99ms   47.14m
       'scheduling_time_window_lns':     28181 [ 90.04ms,   14.25s]    5.46s 849.20ms   42.77h     28160 [100.01ms, 201.72ms] 100.44ms   2.55ms   47.14m
                     'violation_ls':     28181 [  6.67ms,    2.00s] 247.83ms  94.75ms    1.94h     28181 [  1.48us, 727.62ms] 213.70ms  59.12ms    1.67h
                     'violation_ls':     28181 [  6.79ms,    1.50s] 238.34ms  88.68ms    1.87h     28181 [  1.40us, 445.75ms] 205.93ms  53.58ms    1.61h

Search stats                          Bools  Conflicts    Branches   Restarts      BoolPropag   IntegerPropag
                           'core':   20'567  3'504'518   5'016'101     95'179  17'110'364'619  21'399'787'119
                     'default_lp':   30'033  1'635'106  11'509'509    261'193   6'220'905'101  15'942'850'585
                          'fixed':   11'019  9'121'835  23'465'236      1'276   5'713'930'793  20'143'029'356
                      'fs_random':      328          0         348        348              54          84'055
                      'fs_random':      328          0         691        656              72         165'018
                'fs_random_no_lp':      343          1         672        656             287         192'534
        'fs_random_quick_restart':      328          0         656        656              54         159'490
        'fs_random_quick_restart':      328          0         688        656              54         167'922
  'fs_random_quick_restart_no_lp':      395          1       1'042        657              64         281'265
                 'lb_tree_search':      394      1'831  16'412'413  3'764'922      53'824'663  12'554'904'488
                         'max_lp':    2'759  1'063'328  10'433'867  1'405'986     658'713'139  17'847'907'615
                          'no_lp':   10'096  1'982'896  10'663'335    539'364   2'910'267'800  22'224'017'089
            'objective_lb_search':    9'067    506'760   8'780'227  1'000'261     787'415'589  13'179'133'021
     'objective_lb_search_max_lp':    1'654    589'186   7'672'631  1'381'153     243'076'807  16'891'896'620
      'objective_lb_search_no_lp':    1'201    798'282   3'774'907    714'109     104'557'219  15'025'570'160
                        'probing':    7'328      6'338      56'274     32'690       2'858'517      53'907'020
                 'probing_max_lp':    7'328      6'350      71'956     40'535       3'159'952      58'642'944
                   'pseudo_costs':      961    946'382   7'011'640  1'200'900     179'044'605  17'524'613'931
                  'quick_restart':   20'170    461'222  18'404'153    248'660   3'107'230'492  12'500'949'645
            'quick_restart_no_lp':   27'888  1'523'978  12'084'112    226'878   7'505'516'804  19'930'634'114
                  'reduced_costs':  149'911  1'877'627   9'844'669    294'355  27'596'870'719  17'513'687'643

SAT stats                           ClassicMinim  LitRemoved   LitLearned  LitForgotten  Subsumed   MClauses  MDecisions  MLitTrue  MSubsumed  MLitRemoved  MReused
                           'core':     3'377'199  81'397'947   58'763'282    39'201'832     2'903     43'193     223'697         0      3'761       26'195      728
                     'default_lp':     1'391'419  14'945'200   46'915'569    36'684'230     3'050     96'211   1'188'140         0     38'482      400'832   15'320
                          'fixed':     8'107'745  44'573'051  147'173'806   141'893'176    13'235        199       1'253         0        164        1'034       23
                      'fs_random':             0           0            0             0         0          0           0         0          0            0        0
                      'fs_random':             0           0            0             0         0          0           0         0          0            0        0
                'fs_random_no_lp':             0           0            7             0         0          0           0         0          0            0        0
        'fs_random_quick_restart':             0           0            0             0         0          0           0         0          0            0        0
        'fs_random_quick_restart':             0           0            0             0         0          0           0         0          0            0        0
  'fs_random_quick_restart_no_lp':             0           0            2             0         0          0           0         0          0            0        0
                 'lb_tree_search':             0           0        5'867             0         0  1'686'216   8'948'519         0        379        1'488  108'625
                         'max_lp':       900'014   7'243'744   21'466'324    17'710'881    10'570    522'724   4'765'199         0     34'011      268'427   63'970
                          'no_lp':     1'718'186  14'336'539   45'831'434    41'291'129    12'777     97'206   1'130'699         0     32'216      265'207   20'530
            'objective_lb_search':       457'226   4'152'808    9'655'860     5'175'482     3'446    279'583   2'171'159         0     14'688      113'726   56'953
     'objective_lb_search_max_lp':       544'890   5'348'412    8'553'402     3'661'532     4'939    257'927   3'148'694         0     17'205      144'274   63'645
      'objective_lb_search_no_lp':       750'712   8'762'689   17'672'742    10'553'850     5'926    253'420   1'677'198         0      1'605       14'754   29'241
                        'probing':             0           0        6'338             0         0          0           0         0          0            0        0
                 'probing_max_lp':             0           0        6'350             0         0          0           0         0          0            0        0
                   'pseudo_costs':       790'319   4'417'936   23'640'097    21'125'381     8'180    407'571   4'002'467         0      5'091       34'363   75'972
                  'quick_restart':       381'308   3'175'169   11'765'434     9'323'549     3'710     69'941   1'682'957         0     37'780      595'629   12'843
            'quick_restart_no_lp':     1'337'536  14'720'032   46'968'839    40'357'340     4'115     45'488     702'341         0     28'030      313'397    4'605
                  'reduced_costs':     1'609'234  18'654'430   65'777'291    62'441'053    10'283    163'435   1'530'870        63     42'372      268'117   50'478

Lp stats                         Component   Iterations  AddedCuts    OPTIMAL    DUAL_F.  DUAL_U.
                  'default_lp':          1   17'502'117    803'915  2'938'576        287       57
                       'fixed':          1    2'043'698      3'591  9'101'525          0        0
                   'fs_random':          1            0          0          0          0        0
                   'fs_random':          1        5'301        889         71          0        0
     'fs_random_quick_restart':          1        4'048        806         54          0        0
     'fs_random_quick_restart':          1          945        213          3          0        0
              'lb_tree_search':          1  117'156'229     40'967     29'401  8'311'983        0
                      'max_lp':          1   27'987'800    296'766    347'177  2'562'549        5
         'objective_lb_search':          1   27'660'647    791'584  1'834'195        325       16
  'objective_lb_search_max_lp':          1   28'793'054     54'581     31'387  2'552'161        0
                     'probing':          1   15'808'388  2'069'777    163'378      4'762        8
              'probing_max_lp':          1   11'378'702    218'017    131'059     47'160        0
                'pseudo_costs':          1   27'136'037    550'846  1'206'095  2'127'494       21
               'quick_restart':          1   54'455'960  3'507'159  2'329'377      9'337        3
               'reduced_costs':          1   19'429'105    483'434  1'904'548  1'489'014       68

Lp dimension                                                                        Final dimension of first component
                  'default_lp':  3859 rows, 3774 columns, 14936 entries with magnitude in [1.451492e-03, 1.000000e+00]
                       'fixed':  3418 rows, 3774 columns, 12871 entries with magnitude in [3.955696e-03, 1.000000e+00]
                   'fs_random':         0 rows, 3774 columns, 0 entries with magnitude in [0.000000e+00, 0.000000e+00]
                   'fs_random':   2421 rows, 3774 columns, 9506 entries with magnitude in [3.955696e-03, 1.000000e+00]
     'fs_random_quick_restart':   2021 rows, 3774 columns, 8104 entries with magnitude in [3.955696e-03, 1.000000e+00]
     'fs_random_quick_restart':    721 rows, 3774 columns, 3512 entries with magnitude in [3.955696e-03, 1.000000e+00]
              'lb_tree_search':  7442 rows, 3795 columns, 43081 entries with magnitude in [3.087340e-04, 1.000000e+00]
                      'max_lp':  4373 rows, 3795 columns, 18195 entries with magnitude in [3.921511e-04, 1.000000e+00]
         'objective_lb_search':  3893 rows, 3774 columns, 15143 entries with magnitude in [2.292403e-03, 1.000000e+00]
  'objective_lb_search_max_lp':  6320 rows, 3795 columns, 30645 entries with magnitude in [2.627842e-04, 1.000000e+00]
                     'probing':  6330 rows, 3774 columns, 35603 entries with magnitude in [1.047506e-04, 1.000000e+00]
              'probing_max_lp':  5350 rows, 3795 columns, 44923 entries with magnitude in [1.299699e-04, 1.000000e+00]
                'pseudo_costs':  3745 rows, 3795 columns, 14415 entries with magnitude in [7.176774e-04, 1.000000e+00]
               'quick_restart':  4506 rows, 3774 columns, 17725 entries with magnitude in [6.620165e-04, 1.000000e+00]
               'reduced_costs':  3912 rows, 3795 columns, 15873 entries with magnitude in [1.786830e-04, 1.000000e+00]

Lp debug                         CutPropag  CutEqPropag     Adjust  Overflow            Bad  BadScaling
                  'default_lp':         95          288    424'310         0     20'415'076           0
                       'fixed':          0            0     17'622         0         38'312           0
                   'fs_random':          0            0          0         0              0           0
                   'fs_random':          0            0          0         0          3'120           0
     'fs_random_quick_restart':          0            0          0         0          3'117           0
     'fs_random_quick_restart':          0            0          0         0            925           0
              'lb_tree_search':         31           95  8'116'306         0     46'518'777           0
                      'max_lp':         28          146  1'894'278         0     18'737'151           0
         'objective_lb_search':         17          278    640'190         0     24'836'373           0
  'objective_lb_search_max_lp':         37           68  2'523'618         0     13'046'969           0
                     'probing':        896        8'025    129'186         0  1'553'271'589           0
              'probing_max_lp':        999        3'822    178'218         0  1'795'848'168           0
                'pseudo_costs':        165          201    806'101         0     37'818'839           0
               'quick_restart':        301          871  1'001'550         0    150'047'686           0
               'reduced_costs':        160          220  1'283'685         0     30'625'351           0

Lp pool                          Constraints  Updates  Simplif  Merged  Shortened      Split  Strenghtened            Cuts/Call
                  'default_lp':       14'128    4'317   17'573      70          0     98'339        56'467    803'915/3'102'290
                       'fixed':        7'874       32    2'028       0          0          1         2'234         3'591/70'433
                   'fs_random':        4'283        0        0       0          0          0           369                  0/0
                   'fs_random':        5'172        0        0       0          0          0           371            889/2'815
     'fs_random_quick_restart':        4'496        0        0       0          0          0           371              213/319
     'fs_random_quick_restart':        5'089        0        0       0          0          0           372            806/2'352
              'lb_tree_search':       48'028    4'361  417'269       8          0    298'584       421'387       40'967/105'720
                      'max_lp':       47'786    3'728  242'740      49          0    212'830       288'699      296'766/672'542
         'objective_lb_search':       13'813    5'296   15'662      54          0    141'379        59'788    791'584/3'079'490
  'objective_lb_search_max_lp':       47'643    1'721  426'697       7          0    244'458       431'196       54'581/127'373
                     'probing':       14'038  238'915   13'113      22          0  2'251'502       451'105  2'069'777/3'668'425
              'probing_max_lp':       47'073   75'413  420'120      13          0  3'518'523       438'141      218'017/593'407
                'pseudo_costs':       47'848    5'865  410'385      67          0    449'361       498'722    550'846/1'390'098
               'quick_restart':       13'310   19'748   17'250     132          0  1'846'211       157'550  3'507'159/9'144'505
               'reduced_costs':       47'451    5'697  382'962      52          0    382'553       452'179    483'434/1'264'424

Lp Cut                                                      fs_ran  fs_ran  fs_ran   defaul  fixed   max_lp     quick_   reduce   pseudo  lb_tre   probin   object  probin  object
                                                    CG_FF:      41      41      14   30'063     95   13'114     29'219   27'541   28'690     663   33'068   22'380   1'272   3'743
                                                     CG_K:      43      43      13   21'129     85   16'902     19'573   33'636   33'742     741   18'126   15'533   1'087   2'021
                                                    CG_KL:       -       -       -      210      -       17        214      116       57       -      252      277       -       -
                                                     CG_R:      33      33      12   14'283     58    7'603     20'353   13'532   15'167     698   29'047   12'101   2'631   1'118
                                                    CG_RB:      12      12       5   63'508    126   29'786     99'770   49'920   63'456   1'878  148'862   66'126   3'030   4'331
                                                   CG_RBP:       1       1       -    7'012     12    6'008     10'752   10'187   11'539     312    9'795    6'344     566     935
                                                   Clique:       -       -       -        -      -    3'057          -    7'687    8'340     218        -        -     818     254
                                                       IB:     419     501      50  520'470  2'577  108'397  2'758'561  152'855  164'726   7'000  402'223  527'460  39'418  13'686
                                                 MIR_1_FF:      78      78      51   17'690    124    8'742     56'084   17'928   18'414   1'748   87'019   15'355   6'493   2'267
                                                  MIR_1_K:      22      23      14    1'898     32    1'414      7'617    2'764    3'035     139    6'976    1'703   1'392     266
                                                 MIR_1_KL:       -       -       -      515      -      433      2'640      583      368      45    7'148      343   1'393      41
                                                  MIR_1_R:      25      25      16    3'712     36    1'250     10'711    2'825    3'075     346   19'783    2'640   3'414     523
                                                 MIR_1_RB:      31      30      14   24'478     92   24'511    108'610   38'564   46'136   3'299  204'933   24'338  11'276   4'789
                                                MIR_1_RBP:       -       -       -    1'800      4    7'987      7'618   11'338   12'985     616   10'169    2'231   1'355   1'037
                                                MIR_1_RLT:       -       -       -        -      -      231          -      652      555      32        -        -     418      39
                                                 MIR_2_FF:      10      10       3   11'445     38    4'551     27'089    9'653   11'075     898   46'838    9'112   4'345   1'227
                                                  MIR_2_K:       8       7       1    1'837     14    1'006      4'220    1'916    2'142     139    5'625    1'399   1'269     287
                                                 MIR_2_KL:       -       -       -      383      -      394      1'975      491      396      35    7'083      256   1'068      47
                                                  MIR_2_R:       4       4       -    2'534     11      978      6'862    2'164    2'616     410   30'882    2'228   2'939     388
                                                 MIR_2_RB:      19      26       9   15'710     56    9'061     63'641   15'672   20'669   1'258  151'433   15'716   6'994   1'813
                                                MIR_2_RBP:       -       -       1    1'578      7    2'512      6'536    4'011    5'194     205    9'370    1'801   1'007     337
                                                 MIR_3_FF:       5       5       1    6'608     27    2'583     17'143    5'480    6'662     444   33'142    5'407   2'199     645
                                                  MIR_3_K:       3       3       2    1'365     13      931      3'100    1'771    1'837     118    4'240      921     862     232
                                                 MIR_3_KL:       -       -       -      362      -      279      1'865      373      336      38    5'854      256     693      32
                                                  MIR_3_R:       1       2       1    1'393      7      622      4'693    1'204    1'563     286   23'126    1'293   1'602     302
                                                 MIR_3_RB:       9      12       3    9'295     27    5'059     40'740    8'369   11'584     807  110'287    9'778   4'120   1'079
                                                MIR_3_RBP:       -       -       -      947      2    1'487      4'295    2'168    2'910     172    7'810    1'302     528     238
                                                 MIR_4_FF:       4       1       -    4'122     18    1'449     11'066    3'096    3'813     287   22'202    3'509   1'078     364
                                                  MIR_4_K:       3       1       1      945      9      609      2'143    1'106    1'236      87    3'299      656     698     181
                                                 MIR_4_KL:       -       -       -      323      -      216      1'605      347      283      58    5'463      187     557      52
                                                  MIR_4_R:       1       1       -      814      3      359      3'313      583      885     138   14'335    1'050     744     156
                                                 MIR_4_RB:       7       6       1    6'091     23    2'825     26'000    4'643    6'386     495   75'601    6'300   2'258     656
                                                MIR_4_RBP:       2       -       -      541      1      686      2'303      992    1'342     115    4'878      730     365     158
                                                 MIR_5_FF:       3       4       -    2'539      9      858      7'325    1'689    2'321     221   16'630    2'324     630     298
                                                  MIR_5_K:       4       3       -      670      3      532      1'762      779    1'002     100    2'825      571     497     151
                                                 MIR_5_KL:       -       -       -      233      -      214      1'775      324      328      54    6'084      150     565      52
                                                  MIR_5_R:       -       -       -      517      -      216      2'296      330      521     107   10'026      913     416     108
                                                 MIR_5_RB:       2       3       -    3'790      6    1'683     17'380    2'653    3'878     402   56'149    4'309   1'590     505
                                                MIR_5_RBP:       -       -       -      273      -      343      1'385      505      688      85    3'351      368     250      95
                                                 MIR_6_FF:       -       -       -    1'612      6      574      4'905    1'037    1'491     178   12'900    1'598     535     217
                                                  MIR_6_K:       1       2       -      362      2      355      1'393      499      631      86    2'956      396     319     115
                                                 MIR_6_KL:       -       -       -      249      -      263      2'189      385      397      64    8'041      228     589      72
                                                  MIR_6_R:       -       -       -      301      -      148      1'147      190      304      63    6'349      542     289      66
                                                 MIR_6_RB:       1       2       1    2'581      9    1'078     12'877    1'659    2'485     281   46'877    3'215   1'284     324
                                                MIR_6_RBP:       -       -       -      150      -      213        938      346      375      77    2'741      240     272      69
         NoOverlapCompletionTimeExhaustiveMirror_weighted:       -       -       -        -      -        2          -        3        1       -        -        -       -       -
  NoOverlapCompletionTimeExhaustiveMirror_weighted_lifted:       -       -       -        -      -        -          -        3        3       -        -        -       -       -
               NoOverlapCompletionTimeExhaustive_weighted:       -       -       -        -      -       68          -      177      269       1        -        -       -       5
        NoOverlapCompletionTimeExhaustive_weighted_lifted:       -       -       -        -      -      448          -    1'284    1'516       3        -        -       3      27
                          NoOverlapCompletionTimeQueyrane:       -       -       -        -      -      124          -      310      251       7        -        -       8      17
                   NoOverlapCompletionTimeQueyrane_lifted:       -       -       -        -      -      148          -      350      364       3        -        -       1      15
                                NoOverlapDisjunctionOnEnd:       -       -       -        -      -        7          -       28       17       -        -        -       -       1
                              NoOverlapDisjunctionOnStart:       -       -       -        -      -      429          -    1'048    1'292       5        -        -       5      20
                                             ZERO_HALF_FF:       5       4       -    4'285     16    2'818      8'081    6'032    6'133     177   10'064    3'343     452     327
                                              ZERO_HALF_K:       3       1       -    1'193      6    1'621      2'205    3'440    3'350      97    1'904      963     303     226
                                             ZERO_HALF_KL:       -       -       -       37      -        9        148       21       15       3      110       63       -       4
                                              ZERO_HALF_R:       3       2       -    4'835     12   10'795     51'412   12'005   15'478  13'639  271'546    6'083  89'196   7'137
                                             ZERO_HALF_RB:       3       3       -    5'869     21    6'669     23'538   11'038   12'639   1'012   50'008    5'976   8'051   1'067
                                            ZERO_HALF_RBP:       -       -       -    1'358      4    2'092      6'092    3'132    3'883     577   22'347    1'570   4'873     419

LNS stats                        Improv/Calls  Closed  Difficulty  TimeLimit
               'graph_arc_lns':    8573/28180     50%        1.00       0.10
               'graph_cst_lns':   10109/28178     50%        1.00       0.10
               'graph_dec_lns':    9319/28179     50%        1.00       0.10
               'graph_var_lns':   11397/28181     50%        1.00       0.10
                   'rins/rens':    4626/26668     50%        0.93       0.11
                 'rnd_cst_lns':    9822/28180     50%        1.00       0.10
                 'rnd_var_lns':    9545/28180     50%        1.00       0.10
    'scheduling_intervals_lns':   28179/28179      0%        0.00       0.10
  'scheduling_precedences_lns':   28180/28180      0%        0.00       0.10
  'scheduling_time_window_lns':   28178/28178      0%        0.00       0.10

LS stats                   Batches  Restarts     LinMoves    GenMoves  CompoundMoves  WeightUpdates
       'fj_long_default':       11         1      109'778           0              0            222
   'fj_long_lin_default':       16         1            0      19'370          1'582              1
        'fj_long_random':        6         1       59'836           0              0            164
      'fj_short_default':       22         1            0      31'692          3'193              2
  'fj_short_lin_default':       16         1            0      21'665          2'286              1
   'fj_short_lin_random':       18         1            0      19'795          2'326              1
       'fj_short_random':       20         1            0      21'929          1'829              1
          'violation_ls':   28'181         0  138'197'438  17'299'621        869'611      3'146'409
          'violation_ls':   28'181         0  138'777'304  16'267'768        726'233      2'883'580

Solutions (112)                     Num      Rank
  'fs_random_quick_restart_no_lp':    1     [1,1]
                  'graph_arc_lns':    4   [34,98]
                  'graph_cst_lns':    6  [28,105]
                  'graph_dec_lns':    6  [41,103]
                  'graph_var_lns':    5   [51,84]
                          'no_lp':    8    [8,17]
            'quick_restart_no_lp':   14   [6,104]
                    'rins_lp_lns':   14   [12,96]
                  'rins_pump_lns':    5  [23,111]
                    'rnd_cst_lns':    9  [24,110]
                    'rnd_var_lns':   16  [22,112]
                   'violation_ls':   24   [2,107]

Objective bounds                     Num
                            'core':    1
                  'initial_domain':    1
                  'lb_tree_search':   21
      'objective_lb_search_max_lp':   99
  'objective_shaving_search_no_lp':    2
                   'reduced_costs':    2

Solution repositories      Added  Queried  Ignored  Synchro
  'feasible solutions':  132'550  641'191        0  130'289
        'lp solutions':   64'978   14'069        0   63'364
                'pump':  224'858   14'112

Improving bounds shared             Num
                        'core':     548
                  'default_lp':     901
              'lb_tree_search':      42
                      'max_lp':      69
                       'no_lp':     173
         'objective_lb_search':      25
  'objective_lb_search_max_lp':      26
                     'probing':  27'433
              'probing_max_lp':  29'367
                'pseudo_costs':     508
               'quick_restart':   1'325
         'quick_restart_no_lp':   9'839
               'reduced_costs':   1'285

Clauses shared                      Num
                     'default_lp':   10
  'fs_random_quick_restart_no_lp':    1
                 'lb_tree_search':    7
                         'max_lp':   25
                          'no_lp':   14
            'objective_lb_search':   13
     'objective_lb_search_max_lp':   14
      'objective_lb_search_no_lp':   12
                   'pseudo_costs':   35
                  'quick_restart':   31
            'quick_restart_no_lp':   47
                  'reduced_costs':    3

CpSolverResponse summary:
status: FEASIBLE
objective: 3214
best_bound: 1613
integers: 3787
booleans: 343
conflicts: 1
branches: 672
propagations: 287
integer_propagations: 192534
restarts: 656
lp_iterations: 0
walltime: 86401.8
usertime: 86401.8
deterministic_time: 249230
gap_integral: 1.84051e+06
solution_fingerprint: 0x15d3d7ded819a78f


--- Simulation Gantt  partir du modle mathmatique ---
