created virtual environment CPython3.12.4.final.0-64 in 7207ms
  creator CPython3Posix(dest=/localscratch/aneumann.63393209.0/env, clear=False, no_vcs_ignore=False, global=False)
  seeder FromAppData(download=False, pip=bundle, via=copy, app_data_dir=/home/aneumann/.local/share/virtualenv)
    added seed packages: pip==25.1.1
  activators BashActivator,CShellActivator,FishActivator,NushellActivator,PowerShellActivator,PythonActivator
Looking in links: /cvmfs/soft.computecanada.ca/custom/python/wheelhouse/gentoo2023/x86-64-v3, /cvmfs/soft.computecanada.ca/custom/python/wheelhouse/gentoo2023/generic, /cvmfs/soft.computecanada.ca/custom/python/wheelhouse/generic
Requirement already satisfied: pip in /localscratch/aneumann.63393209.0/env/lib/python3.12/site-packages (25.1.1)
Looking in links: /cvmfs/soft.computecanada.ca/custom/python/wheelhouse/gentoo2023/x86-64-v3, /cvmfs/soft.computecanada.ca/custom/python/wheelhouse/gentoo2023/generic, /cvmfs/soft.computecanada.ca/custom/python/wheelhouse/generic
ERROR: protobuf-5.28.3-cp38-abi3-manylinux2014_x86_64.whl is not a supported wheel on this platform.
Looking in links: /cvmfs/soft.computecanada.ca/custom/python/wheelhouse/gentoo2023/x86-64-v3, /cvmfs/soft.computecanada.ca/custom/python/wheelhouse/gentoo2023/generic, /cvmfs/soft.computecanada.ca/custom/python/wheelhouse/generic
Processing /home/aneumann/projects/def-adhaj/aneumann/GNRS/wheels/immutabledict-4.2.0-py3-none-any.whl
Installing collected packages: immutabledict
Successfully installed immutabledict-4.2.0
Looking in links: /cvmfs/soft.computecanada.ca/custom/python/wheelhouse/gentoo2023/x86-64-v3, /cvmfs/soft.computecanada.ca/custom/python/wheelhouse/gentoo2023/generic, /cvmfs/soft.computecanada.ca/custom/python/wheelhouse/generic
Processing /cvmfs/soft.computecanada.ca/custom/python/wheelhouse/generic/ortools-9.10.4067+computecanada-cp312-cp312-linux_x86_64.whl (from -r /home/aneumann/projects/def-adhaj/aneumann/GNRS/requirements/or.txt (line 1))
Processing /cvmfs/soft.computecanada.ca/custom/python/wheelhouse/gentoo2023/x86-64-v3/matplotlib-3.10.0+computecanada-cp312-cp312-linux_x86_64.whl (from -r /home/aneumann/projects/def-adhaj/aneumann/GNRS/requirements/or.txt (line 2))
Processing /cvmfs/soft.computecanada.ca/custom/python/wheelhouse/gentoo2023/x86-64-v3/pandas-2.2.3+computecanada-cp312-cp312-linux_x86_64.whl (from -r /home/aneumann/projects/def-adhaj/aneumann/GNRS/requirements/or.txt (line 3))
Processing /cvmfs/soft.computecanada.ca/custom/python/wheelhouse/generic/absl_py-2.2.2+computecanada-py3-none-any.whl (from ortools<9.11,>=9.10->-r /home/aneumann/projects/def-adhaj/aneumann/GNRS/requirements/or.txt (line 1))
Processing /cvmfs/soft.computecanada.ca/custom/python/wheelhouse/gentoo2023/generic/numpy-2.2.2+computecanada-cp312-cp312-linux_x86_64.whl (from ortools<9.11,>=9.10->-r /home/aneumann/projects/def-adhaj/aneumann/GNRS/requirements/or.txt (line 1))
Processing /cvmfs/soft.computecanada.ca/custom/python/wheelhouse/gentoo2023/x86-64-v3/protobuf-6.30.2+computecanada-cp312-cp312-linux_x86_64.whl (from ortools<9.11,>=9.10->-r /home/aneumann/projects/def-adhaj/aneumann/GNRS/requirements/or.txt (line 1))
Requirement already satisfied: immutabledict>=3.0.0 in /localscratch/aneumann.63393209.0/env/lib/python3.12/site-packages (from ortools<9.11,>=9.10->-r /home/aneumann/projects/def-adhaj/aneumann/GNRS/requirements/or.txt (line 1)) (4.2.0)
Processing /cvmfs/soft.computecanada.ca/custom/python/wheelhouse/gentoo2023/generic/contourpy-1.3.1+computecanada-cp312-cp312-linux_x86_64.whl (from matplotlib->-r /home/aneumann/projects/def-adhaj/aneumann/GNRS/requirements/or.txt (line 2))
Processing /cvmfs/soft.computecanada.ca/custom/python/wheelhouse/generic/cycler-0.12.1+computecanada-py3-none-any.whl (from matplotlib->-r /home/aneumann/projects/def-adhaj/aneumann/GNRS/requirements/or.txt (line 2))
Processing /cvmfs/soft.computecanada.ca/custom/python/wheelhouse/generic/fonttools-4.58.2+computecanada-cp312-cp312-linux_x86_64.whl (from matplotlib->-r /home/aneumann/projects/def-adhaj/aneumann/GNRS/requirements/or.txt (line 2))
Processing /cvmfs/soft.computecanada.ca/custom/python/wheelhouse/gentoo2023/x86-64-v3/kiwisolver-1.4.8+computecanada-cp312-cp312-linux_x86_64.whl (from matplotlib->-r /home/aneumann/projects/def-adhaj/aneumann/GNRS/requirements/or.txt (line 2))
Processing /cvmfs/soft.computecanada.ca/custom/python/wheelhouse/generic/packaging-25.0+computecanada-py3-none-any.whl (from matplotlib->-r /home/aneumann/projects/def-adhaj/aneumann/GNRS/requirements/or.txt (line 2))
Processing /cvmfs/soft.computecanada.ca/custom/python/wheelhouse/gentoo2023/x86-64-v3/pillow-11.1.0+computecanada-cp312-cp312-linux_x86_64.whl (from matplotlib->-r /home/aneumann/projects/def-adhaj/aneumann/GNRS/requirements/or.txt (line 2))
Processing /cvmfs/soft.computecanada.ca/custom/python/wheelhouse/generic/pyparsing-3.2.1+computecanada-py3-none-any.whl (from matplotlib->-r /home/aneumann/projects/def-adhaj/aneumann/GNRS/requirements/or.txt (line 2))
Processing /cvmfs/soft.computecanada.ca/custom/python/wheelhouse/generic/python_dateutil-2.9.0.post0+computecanada-py2.py3-none-any.whl (from matplotlib->-r /home/aneumann/projects/def-adhaj/aneumann/GNRS/requirements/or.txt (line 2))
Processing /cvmfs/soft.computecanada.ca/custom/python/wheelhouse/generic/pytz-2025.2+computecanada-py2.py3-none-any.whl (from pandas->-r /home/aneumann/projects/def-adhaj/aneumann/GNRS/requirements/or.txt (line 3))
Processing /cvmfs/soft.computecanada.ca/custom/python/wheelhouse/generic/tzdata-2025.2+computecanada-py2.py3-none-any.whl (from pandas->-r /home/aneumann/projects/def-adhaj/aneumann/GNRS/requirements/or.txt (line 3))
Processing /cvmfs/soft.computecanada.ca/custom/python/wheelhouse/generic/six-1.17.0+computecanada-py2.py3-none-any.whl (from python-dateutil>=2.7->matplotlib->-r /home/aneumann/projects/def-adhaj/aneumann/GNRS/requirements/or.txt (line 2))
Installing collected packages: pytz, tzdata, six, pyparsing, protobuf, pillow, packaging, numpy, kiwisolver, fonttools, cycler, absl-py, python-dateutil, contourpy, pandas, matplotlib, ortools

Successfully installed absl-py-2.2.2+computecanada contourpy-1.3.1+computecanada cycler-0.12.1+computecanada fonttools-4.58.2+computecanada kiwisolver-1.4.8+computecanada matplotlib-3.10.0+computecanada numpy-2.2.2+computecanada ortools-9.10.4067+computecanada packaging-25.0+computecanada pandas-2.2.3+computecanada pillow-11.1.0+computecanada protobuf-6.30.2+computecanada pyparsing-3.2.1+computecanada python-dateutil-2.9.0.post0+computecanada pytz-2025.2+computecanada six-1.17.0+computecanada tzdata-2025.2+computecanada

Starting CP-SAT solver v9.10.4067
Parameters: max_time_in_seconds: 3600 max_memory_in_mb: 12000 log_search_progress: true enumerate_all_solutions: false absolute_gap_limit: 0 relative_gap_limit: 0
Setting number of workers to 48

Initial optimization model '': (model_fingerprint: 0x841053c00d33b6f4)
#Variables: 337 (#ints: 9 in objective)
  - 240 Booleans in [0,1]
  - 97 in [0,624]
#kLinear1: 44
#kLinear2: 604
#kLinear3: 200
#kLinearN: 3'232 (#terms: 43'988)

Starting presolve at 0.00s
  1.94e-03s  0.00e+00d  [DetectDominanceRelations] 
  4.44e-02s  0.00e+00d  [PresolveToFixPoint] #num_loops=6 #num_dual_strengthening=3 
  4.03e-05s  0.00e+00d  [ExtractEncodingFromLinear] #potential_supersets=1 
[Symmetry] Graph for symmetry has 3'468 nodes and 27'023 arcs.
[Symmetry] Symmetry computation done. time: 0.00255612 dtime: 0.00239405
[Symmetry] #generators: 1, average support size: 18
[Symmetry] The model contains 338 duplicate constraints !
[Symmetry] 9 orbits with sizes: 2,2,2,2,2,2,2,2,2
[Symmetry] Num fixable by intersecting at_most_one with orbits: 1 largest_orbit: 2
  1.09e-02s  1.46e-03d  [Probe] #probed=326 #fixed_bools=4 #new_bounds=20 #equiv=1 
  9.58e-05s  0.00e+00d  [MaxClique] Merged 42(84 literals) into 12(24 literals) at_most_ones. 
  1.87e-03s  0.00e+00d  [DetectDominanceRelations] 
  2.04e-02s  0.00e+00d  [PresolveToFixPoint] #num_loops=4 #num_dual_strengthening=3 
  6.16e-03s  0.00e+00d  [ProcessAtMostOneAndLinear] 
  3.25e-03s  0.00e+00d  [DetectDuplicateConstraints] #duplicates=406 #without_enforcements=263 
  2.11e-03s  8.48e-05d  [DetectDominatedLinearConstraints] #relevant_constraints=2'094 #num_inclusions=1'196 #num_redundant=3 
  4.06e-04s  0.00e+00d  [DetectDifferentVariables] #different=45 
  3.82e-04s  0.00e+00d  [ProcessSetPPC] #relevant_constraints=1'600 
  3.20e-05s  0.00e+00d  [FindAlmostIdenticalLinearConstraints] 
  1.46e-05s  0.00e+00d  [FindBigAtMostOneAndLinearOverlap] 
  7.75e-03s  2.07e-03d  [FindBigVerticalLinearOverlap] #blocks=40 #saved_nz=4'674 
  3.45e-04s  6.71e-05d  [FindBigHorizontalLinearOverlap] #linears=1'560 
  2.09e-05s  0.00e+00d  [MergeClauses] 
  1.93e-03s  0.00e+00d  [DetectDominanceRelations] 
  2.97e-02s  0.00e+00d  [PresolveToFixPoint] #num_loops=2 #num_dual_strengthening=1 
  1.92e-03s  0.00e+00d  [DetectDominanceRelations] 
  1.70e-02s  0.00e+00d  [PresolveToFixPoint] #num_loops=1 #num_dual_strengthening=1 
[Symmetry] Graph for symmetry has 3'093 nodes and 20'517 arcs.
[Symmetry] Symmetry computation done. time: 0.000988139 dtime: 0.00127543
  1.01e-02s  1.32e-03d  [Probe] #probed=318 #new_bounds=59 
  3.55e-05s  0.00e+00d  [MaxClique] 
  1.89e-03s  0.00e+00d  [DetectDominanceRelations] 
  3.13e-02s  0.00e+00d  [PresolveToFixPoint] #num_loops=4 #num_dual_strengthening=3 
  5.06e-03s  0.00e+00d  [ProcessAtMostOneAndLinear] 
  2.72e-03s  0.00e+00d  [DetectDuplicateConstraints] #without_enforcements=342 
  1.24e-03s  5.01e-05d  [DetectDominatedLinearConstraints] #relevant_constraints=1'752 #num_inclusions=432 
  4.08e-04s  0.00e+00d  [DetectDifferentVariables] #different=52 #cliques=2 #size=6 
  3.17e-04s  0.00e+00d  [ProcessSetPPC] #relevant_constraints=1'368 
  4.48e-05s  1.05e-07d  [FindAlmostIdenticalLinearConstraints] #num_tested_pairs=7 
  1.60e-05s  0.00e+00d  [FindBigAtMostOneAndLinearOverlap] 
  4.13e-03s  1.29e-03d  [FindBigVerticalLinearOverlap] #blocks=36 #saved_nz=2'520 
  2.59e-04s  4.46e-05d  [FindBigHorizontalLinearOverlap] #linears=1'191 
  1.78e-05s  0.00e+00d  [MergeClauses] 
  1.72e-03s  0.00e+00d  [DetectDominanceRelations] 
  2.18e-02s  0.00e+00d  [PresolveToFixPoint] #num_loops=3 #num_dual_strengthening=1 
  1.71e-03s  0.00e+00d  [DetectDominanceRelations] 
  1.57e-02s  0.00e+00d  [PresolveToFixPoint] #num_loops=1 #num_dual_strengthening=1 
  9.60e-03s  1.21e-03d  [Probe] #probed=318 #new_bounds=30 
  2.22e-05s  0.00e+00d  [MaxClique] 
  1.68e-03s  0.00e+00d  [DetectDominanceRelations] 
  2.03e-02s  0.00e+00d  [PresolveToFixPoint] #num_loops=2 #num_dual_strengthening=1 
  4.46e-03s  0.00e+00d  [ProcessAtMostOneAndLinear] 
  2.62e-03s  0.00e+00d  [DetectDuplicateConstraints] #without_enforcements=342 
  9.88e-04s  3.80e-05d  [DetectDominatedLinearConstraints] #relevant_constraints=1'682 #num_inclusions=213 
  2.57e-04s  0.00e+00d  [DetectDifferentVariables] 
  2.55e-04s  0.00e+00d  [ProcessSetPPC] #relevant_constraints=1'158 
  5.50e-05s  5.50e-07d  [FindAlmostIdenticalLinearConstraints] #num_tested_pairs=24 
  1.74e-05s  0.00e+00d  [FindBigAtMostOneAndLinearOverlap] 
  2.78e-03s  9.61e-04d  [FindBigVerticalLinearOverlap] #blocks=11 #saved_nz=738 
  2.34e-04s  3.83e-05d  [FindBigHorizontalLinearOverlap] #linears=1'051 
  1.73e-05s  0.00e+00d  [MergeClauses] 
  1.65e-03s  0.00e+00d  [DetectDominanceRelations] 
  1.69e-02s  0.00e+00d  [PresolveToFixPoint] #num_loops=2 #num_dual_strengthening=1 
  8.95e-05s  0.00e+00d  [ExpandObjective] #entries=292 #tight_variables=85 #tight_constraints=54 

Presolve summary:
  - 72 affine relations were detected.
  - rule 'TODO dual: only one blocking constraint?' was applied 752 times.
  - rule 'TODO dual: only one unspecified blocking constraint?' was applied 135 times.
  - rule 'TODO duplicate: identical constraint with different enforcements' was applied 947 times.
  - rule 'TODO no_overlap: with task always last' was applied 2 times.
  - rule 'affine: new relation' was applied 72 times.
  - rule 'all_diff: inferred from x != y constraints' was applied 2 times.
  - rule 'at_most_one: removed literals' was applied 12 times.
  - rule 'at_most_one: size one' was applied 12 times.
  - rule 'at_most_one: transformed into max clique.' was applied 1 time.
  - rule 'deductions: 286 stored' was applied 1 time.
  - rule 'dual: fix variable' was applied 24 times.
  - rule 'dual: reduced domain' was applied 44 times.
  - rule 'duplicate: merged rhs of linear constraint' was applied 74 times.
  - rule 'duplicate: removed constraint' was applied 406 times.
  - rule 'enforcement: false literal' was applied 33 times.
  - rule 'enforcement: true literal' was applied 17 times.
  - rule 'exactly_one: x and not(x)' was applied 1 time.
  - rule 'incompatible linear: add implication' was applied 63 times.
  - rule 'linear inclusion: redundant containing constraint' was applied 3 times.
  - rule 'linear matrix: common vertical rectangle' was applied 87 times.
  - rule 'linear: always true' was applied 1'114 times.
  - rule 'linear: doubleton free' was applied 12 times.
  - rule 'linear: empty' was applied 38 times.
  - rule 'linear: extracted enforcement literal' was applied 6'461 times.
  - rule 'linear: fixed or dup variables' was applied 3'352 times.
  - rule 'linear: positive equal one' was applied 1 time.
  - rule 'linear: reduced variable domains' was applied 215 times.
  - rule 'linear: remapped using affine relations' was applied 3'217 times.
  - rule 'linear: simplified rhs' was applied 10'604 times.
  - rule 'linear: variable substitution 1' was applied 12 times.
  - rule 'linear: variable substitution 2' was applied 5 times.
  - rule 'linear: variable substitution 3' was applied 3 times.
  - rule 'presolve: 105 unused variables removed.' was applied 1 time.
  - rule 'presolve: iteration' was applied 3 times.
  - rule 'probing: reduced enforced constraint to implication.' was applied 42 times.
  - rule 'symmetry: fixed to false in general orbit' was applied 1 time.

Presolved optimization model '': (model_fingerprint: 0x38b15d885bc5de19)
#Variables: 227 (#ints: 9 in objective)
  - 75 Booleans in [0,1]
  - 116 different domains in [-4866,4866] with a largest complexity of 11.
#kAllDiff: 2
#kLinear2: 882 (#enforced: 817 #multi: 688)
#kLinear3: 326 (#enforced: 241)
#kLinearN: 1'231 (#enforced: 1'168) (#terms: 8'396)

Preloading model.
#Bound   0.32s best:inf   next:[261,4833] initial_domain
#Model   0.32s var:227/227 constraints:2441/2441

Starting search at 0.32s with 48 workers.
16 full problem subsolvers: [core, default_lp, lb_tree_search, max_lp, no_lp, objective_lb_search, objective_lb_search_max_lp, objective_lb_search_no_lp, objective_shaving_search_max_lp, objective_shaving_search_no_lp, probing, probing_max_lp, pseudo_costs, quick_restart, quick_restart_no_lp, reduced_costs]
30 first solution subsolvers: [fj_long_default(2), fj_long_lin_default, fj_long_lin_perturb, fj_long_lin_random, fj_long_perturb, fj_long_random, fj_short_default(2), fj_short_lin_default(2), fj_short_lin_perturb, fj_short_lin_random, fj_short_perturb, fj_short_random, fs_random(4), fs_random_no_lp(4), fs_random_quick_restart(4), fs_random_quick_restart_no_lp(3)]
13 incomplete subsolvers: [feasibility_pump, graph_arc_lns, graph_cst_lns, graph_dec_lns, graph_var_lns, rins/rens, rnd_cst_lns, rnd_var_lns, violation_ls(5)]
3 helper subsolvers: [neighborhood_helper, synchronization_agent, update_gap_integral]
#Bound   0.37s best:inf   next:[302,4833] objective_lb_search_no_lp
#1       0.39s best:2347  next:[302,2346] no_lp (fixed_bools=0/94)
#2       0.41s best:1913  next:[302,1912] no_lp (fixed_bools=0/107)
#Bound   0.41s best:1913  next:[303,1912] objective_shaving_search_no_lp (vars=227 csts=2442)
#3       0.42s best:1885  next:[303,1884] no_lp (fixed_bools=0/119)
#4       0.42s best:1705  next:[303,1704] no_lp (fixed_bools=0/125)
#5       0.44s best:1688  next:[303,1687] no_lp (fixed_bools=1/133)
#Bound   0.45s best:1688  next:[304,1687] bool_core (num_cores=4 [cover] a=6 d=1 fixed=39/208 clauses=152)
#Bound   0.45s best:1688  next:[305,1687] bool_core (num_cores=4 [cover] a=6 d=1 fixed=40/211 clauses=169)
#Bound   0.45s best:1688  next:[306,1687] bool_core (num_cores=4 [cover] a=6 d=1 fixed=41/214 clauses=187)
#Bound   0.45s best:1688  next:[307,1687] bool_core (num_cores=4 [cover] a=6 d=1 fixed=42/217 clauses=206)
#Bound   0.46s best:1688  next:[308,1687] bool_core (num_cores=4 [cover] a=6 d=1 fixed=43/220 clauses=226)
#Bound   0.46s best:1688  next:[309,1687] bool_core (num_cores=4 [cover] a=6 d=1 fixed=44/223 clauses=247)
#Bound   0.46s best:1688  next:[310,1687] bool_core (num_cores=4 [cover] a=6 d=1 fixed=45/226 clauses=269)
#Bound   0.47s best:1688  next:[311,1687] bool_core (num_cores=4 [cover] a=6 d=1 fixed=46/229 clauses=292)
#Bound   0.47s best:1688  next:[312,1687] bool_core (num_cores=4 [cover] a=6 d=1 fixed=47/232 clauses=316)
#Bound   0.47s best:1688  next:[313,1687] bool_core (num_cores=4 [cover] a=6 d=1 fixed=48/235 clauses=341)
#Bound   0.47s best:1688  next:[314,1687] bool_core (num_cores=4 [cover] a=6 d=1 fixed=49/238 clauses=367)
#Bound   0.47s best:1688  next:[315,1687] bool_core (num_cores=4 [cover] a=6 d=1 fixed=50/241 clauses=394)
#Bound   0.47s best:1688  next:[316,1687] bool_core (num_cores=4 [cover] a=6 d=1 fixed=51/244 clauses=422)
#Bound   0.47s best:1688  next:[317,1687] bool_core (num_cores=4 [cover] a=6 d=1 fixed=52/247 clauses=451)
#Bound   0.48s best:1688  next:[318,1687] bool_core (num_cores=4 [cover] a=6 d=1 fixed=53/250 clauses=481)
#Bound   0.48s best:1688  next:[319,1687] bool_core (num_cores=4 [cover] a=6 d=1 fixed=54/253 clauses=512)
#Bound   0.48s best:1688  next:[320,1687] bool_core (num_cores=4 [cover] a=6 d=1 fixed=55/256 clauses=544)
#Bound   0.48s best:1688  next:[321,1687] bool_core (num_cores=4 [cover] a=6 d=1 fixed=56/259 clauses=577)
#6       0.55s best:1677  next:[388,1676] no_lp (fixed_bools=1/137)
#7       0.58s best:1638  next:[388,1637] no_lp (fixed_bools=1/142)
#8       0.61s best:1587  next:[412,1586] no_lp (fixed_bools=1/146)
#9       0.62s best:1585  next:[412,1584] no_lp (fixed_bools=1/149)
#10      0.64s best:1575  next:[429,1574] no_lp (fixed_bools=1/158)
#11      0.64s best:1534  next:[429,1533] no_lp (fixed_bools=1/161)
#12      0.65s best:1487  next:[429,1486] no_lp (fixed_bools=1/166)
#13      0.65s best:1485  next:[429,1484] violation_ls(batch:4 #solutions_imported:4 #lin_moves:0 #lin_evals:39'948 #gen_moves:17'713 #gen_evals:2'566 #comp_moves:1'306 #backtracks:8'200 #weight_updates:175)
#14      0.66s best:1483  next:[429,1482] violation_ls(batch:5 #solutions_imported:5 #lin_moves:1 #lin_evals:39'957 #gen_moves:17'713 #gen_evals:2'566 #comp_moves:1'306 #backtracks:8'200 #weight_updates:175)
#15      0.66s best:1481  next:[429,1480] violation_ls(batch:6 #solutions_imported:6 #lin_moves:2 #lin_evals:39'966 #gen_moves:17'713 #gen_evals:2'566 #comp_moves:1'306 #backtracks:8'200 #weight_updates:175)
#16      0.66s best:1462  next:[429,1461] no_lp (fixed_bools=1/167)
#17      0.78s best:1461  next:[444,1460] violation_ls(batch:4 #solutions_imported:4 #lin_moves:14'457 #lin_evals:99'924 #gen_moves:13'002 #gen_evals:2'053 #comp_moves:477 #backtracks:6'260 #weight_updates:5'727)
#18      0.78s best:1460  next:[444,1459] violation_ls(batch:5 #solutions_imported:5 #lin_moves:14'468 #lin_evals:99'978 #gen_moves:13'002 #gen_evals:2'053 #comp_moves:477 #backtracks:6'260 #weight_updates:5'733)
#19      0.78s best:1459  next:[444,1458] violation_ls(batch:6 #solutions_imported:6 #lin_moves:14'489 #lin_evals:100'078 #gen_moves:13'002 #gen_evals:2'053 #comp_moves:477 #backtracks:6'260 #weight_updates:5'744)
#20      0.78s best:1458  next:[444,1457] violation_ls(batch:7 #solutions_imported:7 #lin_moves:14'489 #lin_evals:100'113 #gen_moves:13'019 #gen_evals:2'053 #comp_moves:480 #backtracks:6'267 #weight_updates:5'744)
#21      0.78s best:1457  next:[444,1456] violation_ls(batch:8 #solutions_imported:8 #lin_moves:14'492 #lin_evals:100'134 #gen_moves:13'019 #gen_evals:2'053 #comp_moves:480 #backtracks:6'267 #weight_updates:5'746)
#22      0.78s best:1456  next:[444,1455] violation_ls(batch:9 #solutions_imported:9 #lin_moves:14'503 #lin_evals:100'187 #gen_moves:13'019 #gen_evals:2'053 #comp_moves:480 #backtracks:6'267 #weight_updates:5'752)
#23      0.79s best:1455  next:[444,1454] violation_ls(batch:9 #solutions_imported:8 #lin_moves:9'995 #lin_evals:94'242 #gen_moves:18'835 #gen_evals:2'678 #comp_moves:1'346 #backtracks:8'741 #weight_updates:10'199)
#24      0.79s best:1454  next:[444,1453] violation_ls(batch:10 #solutions_imported:10 #lin_moves:14'725 #lin_evals:101'024 #gen_moves:13'019 #gen_evals:2'053 #comp_moves:480 #backtracks:6'267 #weight_updates:5'819)
#25      0.80s best:1453  next:[444,1452] violation_ls(batch:10 #solutions_imported:9 #lin_moves:10'270 #lin_evals:95'653 #gen_moves:18'835 #gen_evals:2'678 #comp_moves:1'346 #backtracks:8'741 #weight_updates:10'408)
#26      0.80s best:1452  next:[444,1451] violation_ls(batch:7 #solutions_imported:6 #lin_moves:19'993 #lin_evals:127'123 #gen_moves:12'066 #gen_evals:1'938 #comp_moves:1'077 #backtracks:5'494 #weight_updates:10'705)
#27      0.80s best:1451  next:[444,1450] violation_ls(batch:6 #solutions_imported:6 #lin_moves:34'118 #lin_evals:165'497 #weight_updates:15'967)
#28      0.81s best:1450  next:[444,1449] violation_ls(batch:7 #solutions_imported:7 #lin_moves:34'118 #lin_evals:165'508 #gen_moves:7 #gen_evals:0 #comp_moves:1 #backtracks:3 #weight_updates:15'967)
#29      0.82s best:1442  next:[444,1441] rnd_var_lns (d=0.99 s=189 t=0.10 p=1.00 stall=0 h=auto_l0)
#30      0.82s best:1441  next:[444,1440] violation_ls(batch:11 #solutions_imported:11 #lin_moves:14'725 #lin_evals:102'235 #gen_moves:13'495 #gen_evals:2'160 #comp_moves:518 #backtracks:6'486 #weight_updates:5'829)
#31      0.82s best:1440  next:[444,1439] violation_ls(batch:11 #solutions_imported:10 #lin_moves:10'270 #lin_evals:95'654 #gen_moves:18'836 #gen_evals:2'678 #comp_moves:1'347 #backtracks:8'741 #weight_updates:10'408)
#32      0.84s best:1439  next:[444,1438] violation_ls(batch:12 #solutions_imported:12 #lin_moves:14'725 #lin_evals:103'236 #gen_moves:13'886 #gen_evals:2'258 #comp_moves:547 #backtracks:6'667 #weight_updates:5'838)
#33      0.84s best:1438  next:[444,1437] violation_ls(batch:12 #solutions_imported:11 #lin_moves:10'271 #lin_evals:95'662 #gen_moves:18'836 #gen_evals:2'678 #comp_moves:1'347 #backtracks:8'741 #weight_updates:10'408)
#34      0.85s best:1437  next:[444,1436] violation_ls(batch:6 #solutions_imported:6 #lin_moves:29'062 #lin_evals:150'651 #gen_moves:5'757 #gen_evals:946 #comp_moves:375 #backtracks:2'691 #weight_updates:1'588)
#35      0.85s best:1436  next:[444,1435] violation_ls(batch:7 #solutions_imported:7 #lin_moves:29'063 #lin_evals:150'660 #gen_moves:5'757 #gen_evals:946 #comp_moves:375 #backtracks:2'691 #weight_updates:1'588)
#36      0.86s best:1435  next:[444,1434] violation_ls(batch:8 #solutions_imported:8 #lin_moves:29'226 #lin_evals:151'344 #gen_moves:5'757 #gen_evals:946 #comp_moves:375 #backtracks:2'691 #weight_updates:1'648)
#37      0.86s best:1434  next:[444,1433] violation_ls(batch:9 #solutions_imported:9 #lin_moves:29'227 #lin_evals:151'353 #gen_moves:5'757 #gen_evals:946 #comp_moves:375 #backtracks:2'691 #weight_updates:1'648)
#38      0.87s best:1433  next:[444,1432] violation_ls(batch:10 #solutions_imported:10 #lin_moves:29'603 #lin_evals:153'356 #gen_moves:5'757 #gen_evals:946 #comp_moves:375 #backtracks:2'691 #weight_updates:1'952)
#39      0.87s best:1432  next:[444,1431] violation_ls(batch:11 #solutions_imported:11 #lin_moves:29'604 #lin_evals:153'365 #gen_moves:5'757 #gen_evals:946 #comp_moves:375 #backtracks:2'691 #weight_updates:1'952)
#40      0.87s best:1431  next:[444,1430] violation_ls(batch:12 #solutions_imported:12 #lin_moves:29'732 #lin_evals:154'080 #gen_moves:5'757 #gen_evals:946 #comp_moves:375 #backtracks:2'691 #weight_updates:2'061)
#41      0.87s best:1430  next:[444,1429] violation_ls(batch:13 #solutions_imported:13 #lin_moves:29'732 #lin_evals:154'084 #gen_moves:5'758 #gen_evals:946 #comp_moves:376 #backtracks:2'691 #weight_updates:2'061)
#42      0.90s best:1429  next:[444,1428] violation_ls(batch:13 #solutions_imported:12 #lin_moves:10'568 #lin_evals:97'262 #gen_moves:18'836 #gen_evals:2'678 #comp_moves:1'347 #backtracks:8'741 #weight_updates:10'634)
#43      0.91s best:1428  next:[444,1427] violation_ls(batch:14 #solutions_imported:14 #lin_moves:29'732 #lin_evals:154'103 #gen_moves:5'767 #gen_evals:946 #comp_moves:377 #backtracks:2'695 #weight_updates:2'061)
#44      0.96s best:1371  next:[444,1370] graph_dec_lns (d=0.98 s=171 t=0.10 p=1.00 stall=0 h=auto_l0)
#Bound   0.78s best:1462  next:[444,1461] default_lp [skipped_logs=18]
#45      1.19s best:1370  next:[572,1369] quick_restart_no_lp (fixed_bools=0/183)
#46      1.20s best:1369  next:[572,1368] violation_ls(batch:17 #solutions_imported:16 #lin_moves:30'026 #lin_evals:189'831 #gen_moves:20'896 #gen_evals:3'486 #comp_moves:772 #backtracks:10'054 #weight_updates:2'291)
#47      1.24s best:1368  next:[572,1367] violation_ls(batch:18 #solutions_imported:17 #lin_moves:30'027 #lin_evals:189'840 #gen_moves:20'896 #gen_evals:3'486 #comp_moves:772 #backtracks:10'054 #weight_updates:2'291)
#48      1.26s best:1367  next:[574,1366] violation_ls(batch:14 #solutions_imported:11 #lin_moves:63'826 #lin_evals:333'141 #gen_moves:8'080 #gen_evals:1'225 #comp_moves:310 #backtracks:3'885 #weight_updates:36'407)
#49      1.26s best:1366  next:[574,1365] violation_ls(batch:15 #solutions_imported:12 #lin_moves:63'894 #lin_evals:333'531 #gen_moves:8'080 #gen_evals:1'225 #comp_moves:310 #backtracks:3'885 #weight_updates:36'466)
#50      1.26s best:1365  next:[574,1364] violation_ls(batch:16 #solutions_imported:13 #lin_moves:63'894 #lin_evals:333'533 #gen_moves:8'082 #gen_evals:1'226 #comp_moves:312 #backtracks:3'885 #weight_updates:36'466)
#51      1.26s best:1364  next:[574,1363] violation_ls(batch:17 #solutions_imported:14 #lin_moves:63'895 #lin_evals:333'541 #gen_moves:8'082 #gen_evals:1'226 #comp_moves:312 #backtracks:3'885 #weight_updates:36'466)
#52      1.29s best:1363  next:[574,1362] violation_ls(batch:18 #solutions_imported:15 #lin_moves:64'187 #lin_evals:335'048 #gen_moves:8'082 #gen_evals:1'226 #comp_moves:312 #backtracks:3'885 #weight_updates:36'687)
#53      1.33s best:1362  next:[641,1361] violation_ls(batch:13 #solutions_imported:11 #lin_moves:29'632 #lin_evals:236'390 #gen_moves:37'701 #gen_evals:6'032 #comp_moves:1'913 #backtracks:17'891 #weight_updates:11'380)
#54      1.33s best:1361  next:[641,1360] violation_ls(batch:14 #solutions_imported:12 #lin_moves:29'632 #lin_evals:236'468 #gen_moves:37'735 #gen_evals:6'037 #comp_moves:1'915 #backtracks:17'907 #weight_updates:11'380)
#55      1.33s best:1360  next:[641,1359] violation_ls(batch:15 #solutions_imported:13 #lin_moves:29'720 #lin_evals:236'959 #gen_moves:37'735 #gen_evals:6'037 #comp_moves:1'915 #backtracks:17'907 #weight_updates:11'460)
#56      1.33s best:1359  next:[641,1358] violation_ls(batch:16 #solutions_imported:14 #lin_moves:29'721 #lin_evals:236'968 #gen_moves:37'735 #gen_evals:6'037 #comp_moves:1'915 #backtracks:17'907 #weight_updates:11'460)
#57      1.33s best:1358  next:[641,1357] violation_ls(batch:17 #solutions_imported:15 #lin_moves:29'721 #lin_evals:236'973 #gen_moves:37'737 #gen_evals:6'038 #comp_moves:1'917 #backtracks:17'907 #weight_updates:11'460)
#58      1.34s best:1357  next:[641,1356] violation_ls(batch:18 #solutions_imported:16 #lin_moves:30'253 #lin_evals:239'741 #gen_moves:37'737 #gen_evals:6'038 #comp_moves:1'917 #backtracks:17'907 #weight_updates:11'859)
#59      1.36s best:1356  next:[641,1355] violation_ls(batch:17 #solutions_imported:15 #lin_moves:35'044 #lin_evals:219'611 #gen_moves:18'836 #gen_evals:2'678 #comp_moves:1'347 #backtracks:8'741 #weight_updates:16'239)
#60      1.37s best:1355  next:[641,1354] violation_ls(batch:18 #solutions_imported:16 #lin_moves:35'044 #lin_evals:219'616 #gen_moves:18'837 #gen_evals:2'678 #comp_moves:1'348 #backtracks:8'741 #weight_updates:16'239)
#61      1.39s best:1354  next:[641,1353] violation_ls(batch:19 #solutions_imported:17 #lin_moves:30'413 #lin_evals:240'589 #gen_moves:37'737 #gen_evals:6'038 #comp_moves:1'917 #backtracks:17'907 #weight_updates:11'972)
#62      1.39s best:1353  next:[641,1352] violation_ls(batch:19 #solutions_imported:16 #lin_moves:64'187 #lin_evals:335'052 #gen_moves:8'083 #gen_evals:1'226 #comp_moves:313 #backtracks:3'885 #weight_updates:36'687)
#63      1.39s best:1352  next:[641,1351] violation_ls(batch:19 #solutions_imported:18 #lin_moves:30'027 #lin_evals:189'871 #gen_moves:20'914 #gen_evals:3'487 #comp_moves:774 #backtracks:10'062 #weight_updates:2'291)
#64      1.39s best:1351  next:[641,1350] violation_ls(batch:19 #solutions_imported:17 #lin_moves:35'106 #lin_evals:219'956 #gen_moves:18'837 #gen_evals:2'678 #comp_moves:1'348 #backtracks:8'741 #weight_updates:16'298)
#65      1.41s best:1350  next:[641,1349] quick_restart_no_lp (fixed_bools=0/221)
#66      1.57s best:1349  next:[641,1348] violation_ls(batch:19 #solutions_imported:18 #lin_moves:24'342 #lin_evals:221'609 #gen_moves:43'277 #gen_evals:6'064 #comp_moves:1'834 #backtracks:20'715 #weight_updates:6'587)
#67      1.58s best:1345  next:[641,1344] quick_restart_no_lp (fixed_bools=1/229)
#68      1.80s best:1341  next:[641,1340] quick_restart_no_lp (fixed_bools=1/237)
#69      1.86s best:1339  next:[854,1338] violation_ls(batch:20 #solutions_imported:18 #lin_moves:30'413 #lin_evals:240'666 #gen_moves:37'772 #gen_evals:6'044 #comp_moves:1'918 #backtracks:17'924 #weight_updates:11'972)
#70      1.92s best:1337  next:[854,1336] violation_ls(batch:20 #solutions_imported:19 #lin_moves:24'343 #lin_evals:221'618 #gen_moves:43'277 #gen_evals:6'064 #comp_moves:1'834 #backtracks:20'715 #weight_updates:6'587)
#Bound   1.84s best:1341  next:[854,1340] objective_lb_search_no_lp [skipped_logs=10]
#71      2.11s best:1336  next:[854,1335] violation_ls(batch:21 #solutions_imported:18 #lin_moves:65'874 #lin_evals:341'185 #gen_moves:8'084 #gen_evals:1'226 #comp_moves:314 #backtracks:3'885 #weight_updates:36'905)
#72      2.12s best:1335  next:[854,1334] violation_ls(batch:21 #solutions_imported:20 #lin_moves:24'343 #lin_evals:221'636 #gen_moves:43'284 #gen_evals:6'064 #comp_moves:1'835 #backtracks:20'718 #weight_updates:6'587)
#73      2.31s best:1334  next:[854,1333] quick_restart (fixed_bools=1/169)
#74      2.34s best:1333  next:[854,1332] violation_ls(batch:22 #solutions_imported:21 #lin_moves:39'676 #lin_evals:241'898 #gen_moves:20'930 #gen_evals:3'491 #comp_moves:776 #backtracks:10'069 #weight_updates:2'643)
#75      2.34s best:1332  next:[854,1331] violation_ls(batch:22 #solutions_imported:21 #lin_moves:24'344 #lin_evals:221'641 #gen_moves:43'284 #gen_evals:6'064 #comp_moves:1'835 #backtracks:20'718 #weight_updates:6'587)
#Bound   2.85s best:1332  next:[857,1331] objective_lb_search_no_lp [skipped_logs=1]
#Bound   3.82s best:1332  next:[858,1331] objective_shaving_search_no_lp (vars=236 csts=2451) [skipped_logs=0]
#Bound   4.80s best:1332  next:[859,1331] objective_shaving_search_no_lp (vars=236 csts=2451) [skipped_logs=0]
#Bound   5.80s best:1332  next:[861,1331] objective_lb_search [skipped_logs=1]
#Bound   6.86s best:1332  next:[864,1331] objective_lb_search_no_lp [skipped_logs=0]
#Bound   7.84s best:1332  next:[880,1331] objective_lb_search_no_lp [skipped_logs=1]
#Bound   8.69s best:1332  next:[882,1331] objective_lb_search_no_lp [skipped_logs=0]
#Bound   9.85s best:1332  next:[883,1331] objective_lb_search [skipped_logs=0]
#Bound  11.15s best:1332  next:[885,1331] objective_lb_search
#Bound  11.73s best:1332  next:[889,1331] objective_lb_search_no_lp [skipped_logs=0]
#Bound  12.72s best:1332  next:[907,1331] objective_lb_search_no_lp [skipped_logs=2]
#Bound  13.85s best:1332  next:[915,1331] objective_lb_search_no_lp [skipped_logs=0]
#Bound  16.34s best:1332  next:[917,1331] objective_lb_search_no_lp
#Bound  18.61s best:1332  next:[918,1331] objective_lb_search_no_lp
#Bound  19.39s best:1332  next:[920,1331] objective_lb_search_no_lp
#Bound  20.64s best:1332  next:[921,1331] objective_lb_search_no_lp
#Bound  21.22s best:1332  next:[922,1331] objective_lb_search_no_lp
#Bound  22.47s best:1332  next:[923,1331] objective_lb_search_no_lp
#Bound  22.74s best:1332  next:[924,1331] objective_lb_search
#Bound  23.82s best:1332  next:[927,1331] objective_lb_search_no_lp
#Bound  25.80s best:1332  next:[930,1331] objective_lb_search_no_lp
#Bound  26.20s best:1332  next:[931,1331] objective_lb_search_no_lp
#Bound  26.74s best:1332  next:[933,1331] objective_lb_search_no_lp
#Bound  27.94s best:1332  next:[934,1331] objective_lb_search_no_lp
#Bound  28.74s best:1332  next:[936,1331] objective_lb_search_no_lp
#Bound  28.97s best:1332  next:[937,1331] objective_lb_search_no_lp
#Bound  29.35s best:1332  next:[938,1331] objective_lb_search_no_lp
#Bound  31.17s best:1332  next:[939,1331] objective_lb_search_no_lp
#Bound  31.72s best:1332  next:[940,1331] objective_lb_search_no_lp
#Bound  32.00s best:1332  next:[942,1331] objective_lb_search_no_lp
#Bound  33.85s best:1332  next:[943,1331] objective_lb_search_no_lp
#Bound  35.34s best:1332  next:[951,1331] objective_lb_search_no_lp
#Bound  36.81s best:1332  next:[954,1331] objective_lb_search_no_lp
#Bound  39.82s best:1332  next:[965,1331] objective_lb_search_no_lp
#Bound  42.30s best:1332  next:[966,1331] objective_lb_search_no_lp
#Model  42.49s var:223/227 constraints:2153/2441
#Bound  43.93s best:1332  next:[968,1331] objective_lb_search_no_lp
#Bound  44.72s best:1332  next:[970,1331] objective_lb_search_no_lp
#Bound  44.97s best:1332  next:[971,1331] objective_lb_search_no_lp
#Bound  45.55s best:1332  next:[986,1331] objective_lb_search_no_lp
#Bound  47.03s best:1332  next:[991,1331] objective_lb_search_no_lp
#Bound  48.25s best:1332  next:[992,1331] objective_shaving_search_no_lp (vars=226 csts=2119)
#Bound  48.80s best:1332  next:[995,1331] objective_lb_search_no_lp
#Bound  49.38s best:1332  next:[997,1331] objective_lb_search_no_lp
#Bound  51.09s best:1332  next:[998,1331] objective_lb_search_no_lp
#Bound  51.11s best:1332  next:[1000,1331] objective_lb_search
#Model  51.36s var:219/227 constraints:1887/2441
#Bound  51.83s best:1332  next:[1002,1331] objective_lb_search_no_lp
#Bound  52.79s best:1332  next:[1013,1331] objective_lb_search_no_lp
#Bound  53.54s best:1332  next:[1019,1331] objective_lb_search_no_lp
#Model  53.59s var:217/227 constraints:1763/2441
#Model  54.14s var:216/227 constraints:1710/2441
#Bound  54.21s best:1332  next:[1020,1331] objective_lb_search_no_lp
#Bound  54.30s best:1332  next:[1025,1331] objective_lb_search_no_lp
#Bound  54.72s best:1332  next:[1026,1331] objective_shaving_search_no_lp (vars=211 csts=1700)
#Bound  54.89s best:1332  next:[1048,1331] objective_lb_search_no_lp
#Model  54.89s var:213/227 constraints:1561/2441
#Bound  55.21s best:1332  next:[1060,1331] objective_lb_search_no_lp
#Model  55.28s var:210/227 constraints:1429/2441
#Model  55.61s var:208/227 constraints:1347/2441
#Bound  56.00s best:1332  next:[1122,1331] objective_lb_search_no_lp [skipped_logs=6]
#Done   56.03s quick_restart_no_lp
#Done   56.03s objective_lb_search_no_lp
#Model  56.03s var:188/227 constraints:714/2441
#Done   56.03s core
#Model  56.04s var:183/227 constraints:566/2441
#Done   56.04s reduced_costs
#Done   56.04s max_lp
#Model  56.04s var:173/227 constraints:338/2441
#Bound  56.03s best:1332  next:[1155,1331] objective_lb_search_no_lp [skipped_logs=4]

Task timing                                  n [     min,      max]      avg      dev     time         n [     min,      max]      avg      dev    dtime
                             'core':         1 [  55.71s,   55.71s]   55.71s   0.00ns   55.71s         1 [  21.67s,   21.67s]   21.67s   0.00ns   21.67s
                       'default_lp':         1 [  55.71s,   55.71s]   55.71s   0.00ns   55.71s         1 [   4.34s,    4.34s]    4.34s   0.00ns    4.34s
                 'feasibility_pump':       223 [ 31.87ms, 398.61ms] 182.42ms  81.21ms   40.68s       222 [ 12.42ms,  25.50ms]  12.90ms 848.62us    2.86s
                  'fj_long_default':         1 [117.68ms, 117.68ms] 117.68ms   0.00ns 117.68ms         1 [ 51.29ms,  51.29ms]  51.29ms   0.00ns  51.29ms
                  'fj_long_default':         1 [200.16ms, 200.16ms] 200.16ms   0.00ns 200.16ms         1 [ 89.15ms,  89.15ms]  89.15ms   0.00ns  89.15ms
              'fj_long_lin_default':         1 [134.75ms, 134.75ms] 134.75ms   0.00ns 134.75ms         1 [ 78.96ms,  78.96ms]  78.96ms   0.00ns  78.96ms
              'fj_long_lin_perturb':         1 [192.58ms, 192.58ms] 192.58ms   0.00ns 192.58ms         1 [107.65ms, 107.65ms] 107.65ms   0.00ns 107.65ms
               'fj_long_lin_random':         1 [195.49ms, 195.49ms] 195.49ms   0.00ns 195.49ms         1 [116.63ms, 116.63ms] 116.63ms   0.00ns 116.63ms
                  'fj_long_perturb':         1 [131.32ms, 131.32ms] 131.32ms   0.00ns 131.32ms         1 [ 78.23ms,  78.23ms]  78.23ms   0.00ns  78.23ms
                   'fj_long_random':         1 [195.90ms, 195.90ms] 195.90ms   0.00ns 195.90ms         1 [ 90.11ms,  90.11ms]  90.11ms   0.00ns  90.11ms
                 'fj_short_default':         1 [123.46ms, 123.46ms] 123.46ms   0.00ns 123.46ms         1 [ 77.19ms,  77.19ms]  77.19ms   0.00ns  77.19ms
                 'fj_short_default':         1 [219.78ms, 219.78ms] 219.78ms   0.00ns 219.78ms         1 [123.24ms, 123.24ms] 123.24ms   0.00ns 123.24ms
             'fj_short_lin_default':         1 [127.45ms, 127.45ms] 127.45ms   0.00ns 127.45ms         1 [ 76.63ms,  76.63ms]  76.63ms   0.00ns  76.63ms
             'fj_short_lin_default':         1 [182.72ms, 182.72ms] 182.72ms   0.00ns 182.72ms         1 [ 79.24ms,  79.24ms]  79.24ms   0.00ns  79.24ms
             'fj_short_lin_perturb':         1 [261.37ms, 261.37ms] 261.37ms   0.00ns 261.37ms         1 [ 94.79ms,  94.79ms]  94.79ms   0.00ns  94.79ms
              'fj_short_lin_random':         1 [140.76ms, 140.76ms] 140.76ms   0.00ns 140.76ms         1 [ 77.49ms,  77.49ms]  77.49ms   0.00ns  77.49ms
                 'fj_short_perturb':         1 [200.73ms, 200.73ms] 200.73ms   0.00ns 200.73ms         1 [ 92.88ms,  92.88ms]  92.88ms   0.00ns  92.88ms
                  'fj_short_random':         1 [155.40ms, 155.40ms] 155.40ms   0.00ns 155.40ms         1 [ 77.24ms,  77.24ms]  77.24ms   0.00ns  77.24ms
                        'fs_random':         1 [ 67.60ms,  67.60ms]  67.60ms   0.00ns  67.60ms         1 [  3.01us,   3.01us]   3.01us   0.00ns   3.01us
                        'fs_random':         1 [ 68.86ms,  68.86ms]  68.86ms   0.00ns  68.86ms         1 [  3.01us,   3.01us]   3.01us   0.00ns   3.01us
                        'fs_random':         1 [ 72.10ms,  72.10ms]  72.10ms   0.00ns  72.10ms         1 [  3.01us,   3.01us]   3.01us   0.00ns   3.01us
                        'fs_random':         1 [ 73.46ms,  73.46ms]  73.46ms   0.00ns  73.46ms         1 [  3.01us,   3.01us]   3.01us   0.00ns   3.01us
                  'fs_random_no_lp':         1 [ 72.26ms,  72.26ms]  72.26ms   0.00ns  72.26ms         1 [465.14us, 465.14us] 465.14us   0.00ns 465.14us
                  'fs_random_no_lp':         1 [ 72.38ms,  72.38ms]  72.38ms   0.00ns  72.38ms         1 [357.49us, 357.49us] 357.49us   0.00ns 357.49us
                  'fs_random_no_lp':         1 [ 74.24ms,  74.24ms]  74.24ms   0.00ns  74.24ms         1 [317.29us, 317.29us] 317.29us   0.00ns 317.29us
                  'fs_random_no_lp':         1 [ 75.03ms,  75.03ms]  75.03ms   0.00ns  75.03ms         1 [992.41us, 992.41us] 992.41us   0.00ns 992.41us
          'fs_random_quick_restart':         1 [ 69.74ms,  69.74ms]  69.74ms   0.00ns  69.74ms         1 [ 21.43us,  21.43us]  21.43us   0.00ns  21.43us
          'fs_random_quick_restart':         1 [ 70.25ms,  70.25ms]  70.25ms   0.00ns  70.25ms         1 [ 20.00ns,  20.00ns]  20.00ns   0.00ns  20.00ns
          'fs_random_quick_restart':         1 [ 74.07ms,  74.07ms]  74.07ms   0.00ns  74.07ms         1 [  3.01us,   3.01us]   3.01us   0.00ns   3.01us
          'fs_random_quick_restart':         1 [ 74.35ms,  74.35ms]  74.35ms   0.00ns  74.35ms         1 [ 20.00ns,  20.00ns]  20.00ns   0.00ns  20.00ns
    'fs_random_quick_restart_no_lp':         1 [ 73.53ms,  73.53ms]  73.53ms   0.00ns  73.53ms         1 [307.09us, 307.09us] 307.09us   0.00ns 307.09us
    'fs_random_quick_restart_no_lp':         1 [ 74.42ms,  74.42ms]  74.42ms   0.00ns  74.42ms         1 [324.93us, 324.93us] 324.93us   0.00ns 324.93us
    'fs_random_quick_restart_no_lp':         1 [ 76.08ms,  76.08ms]  76.08ms   0.00ns  76.08ms         1 [311.89us, 311.89us] 311.89us   0.00ns 311.89us
                    'graph_arc_lns':       224 [  3.83ms,    4.11s]    1.02s 849.82ms    3.81m       209 [ 10.00ns, 295.29ms]  65.90ms  46.35ms   13.77s
                    'graph_cst_lns':       224 [  1.89ms,    4.31s] 760.47ms 913.87ms    2.84m       149 [ 10.00ns, 128.71ms]  62.08ms  42.82ms    9.25s
                    'graph_dec_lns':       223 [  4.13ms,    4.04s]    1.15s 876.35ms    4.27m       211 [ 10.00ns, 106.35ms]  65.87ms  41.05ms   13.90s
                    'graph_var_lns':       224 [  2.68ms,    3.60s] 925.66ms 746.61ms    3.46m       216 [ 10.00ns, 106.28ms]  64.36ms  41.17ms   13.90s
                   'lb_tree_search':         1 [  55.71s,   55.71s]   55.71s   0.00ns   55.71s         1 [   8.44s,    8.44s]    8.44s   0.00ns    8.44s
                           'max_lp':         1 [  55.71s,   55.71s]   55.71s   0.00ns   55.71s         1 [   4.69s,    4.69s]    4.69s   0.00ns    4.69s
                            'no_lp':         1 [  55.71s,   55.71s]   55.71s   0.00ns   55.71s         1 [   6.88s,    6.88s]    6.88s   0.00ns    6.88s
              'objective_lb_search':         1 [  55.71s,   55.71s]   55.71s   0.00ns   55.71s         1 [   9.60s,    9.60s]    9.60s   0.00ns    9.60s
       'objective_lb_search_max_lp':         1 [  55.71s,   55.71s]   55.71s   0.00ns   55.71s         1 [   7.57s,    7.57s]    7.57s   0.00ns    7.57s
        'objective_lb_search_no_lp':         1 [  55.71s,   55.71s]   55.71s   0.00ns   55.71s         1 [   5.67s,    5.67s]    5.67s   0.00ns    5.67s
  'objective_shaving_search_max_lp':        77 [ 12.46ms,    3.03s] 720.38ms 673.23ms   55.47s        60 [465.53us, 217.65ms]  42.52ms  51.16ms    2.55s
   'objective_shaving_search_no_lp':        79 [  7.89ms,    3.02s] 700.88ms 674.49ms   55.37s        58 [910.11us, 325.13ms]  37.84ms  49.95ms    2.19s
                          'probing':         1 [  55.71s,   55.71s]   55.71s   0.00ns   55.71s         1 [   2.70s,    2.70s]    2.70s   0.00ns    2.70s
                   'probing_max_lp':         1 [  55.72s,   55.72s]   55.72s   0.00ns   55.72s         1 [   2.76s,    2.76s]    2.76s   0.00ns    2.76s
                     'pseudo_costs':         1 [  55.71s,   55.71s]   55.71s   0.00ns   55.71s         1 [   9.49s,    9.49s]    9.49s   0.00ns    9.49s
                    'quick_restart':         1 [  55.71s,   55.71s]   55.71s   0.00ns   55.71s         1 [   9.82s,    9.82s]    9.82s   0.00ns    9.82s
              'quick_restart_no_lp':         1 [  55.71s,   55.71s]   55.71s   0.00ns   55.71s         1 [   9.65s,    9.65s]    9.65s   0.00ns    9.65s
                    'reduced_costs':         1 [  55.71s,   55.71s]   55.71s   0.00ns   55.71s         1 [  10.48s,   10.48s]   10.48s   0.00ns   10.48s
                        'rins/rens':       224 [153.32us,    3.04s] 945.36ms 792.71ms    3.53m       184 [ 10.00ns, 201.10ms]  74.79ms  37.93ms   13.76s
                      'rnd_cst_lns':       224 [  1.83ms,    3.63s]    1.01s 834.13ms    3.79m       206 [ 10.00ns, 176.40ms]  65.91ms  41.46ms   13.58s
                      'rnd_var_lns':       224 [  3.61ms,    4.13s]    1.04s 795.67ms    3.87m       215 [ 10.00ns, 287.33ms]  64.01ms  45.50ms   13.76s
                     'violation_ls':       221 [327.12us, 671.40ms] 200.66ms 125.35ms   44.34s       221 [430.00ns, 182.42ms]  81.30ms  36.00ms   17.97s
                     'violation_ls':       223 [330.76us, 428.30ms] 149.76ms  86.77ms   33.40s       223 [280.00ns,  79.62ms]  63.42ms  16.55ms   14.14s
                     'violation_ls':       224 [288.20us, 368.95ms] 164.78ms  80.94ms   36.91s       224 [890.00ns,  79.05ms]  63.04ms  15.50ms   14.12s
                     'violation_ls':       224 [307.59us, 461.14ms] 173.36ms  96.07ms   38.83s       224 [860.00ns,  78.34ms]  61.34ms  17.47ms   13.74s
                     'violation_ls':       224 [310.76us, 492.24ms] 180.32ms 101.16ms   40.39s       224 [520.00ns,  97.65ms]  68.30ms  19.76ms   15.30s

Search stats                        Bools  Conflicts  Branches  Restarts  BoolPropag  IntegerPropag
                           'core':  5'161     10'168    28'863     5'864  18'036'254      6'610'714
                     'default_lp':     75      7'311    43'100     9'845     237'343      6'628'622
                      'fs_random':     75          0       150       150           0          2'525
                      'fs_random':     75          0       150       150           0          2'525
                      'fs_random':     75          0       150       150           0          2'525
                      'fs_random':     75          0       150       150           0          2'525
                'fs_random_no_lp':     75          0       189       150          20          4'071
                'fs_random_no_lp':     75          0       352       297           2          6'413
                'fs_random_no_lp':     75         10       191       150          67          4'640
                'fs_random_no_lp':     75          5       185       150          41          4'000
        'fs_random_quick_restart':     75          0       150       150           0          2'525
        'fs_random_quick_restart':     75          0       150       150           0          2'525
        'fs_random_quick_restart':     75          0       150       150           0          2'525
        'fs_random_quick_restart':     75          0       150       150           0          2'525
  'fs_random_quick_restart_no_lp':     75          0       188       150          13          3'907
  'fs_random_quick_restart_no_lp':     75          0       199       150           2          3'823
  'fs_random_quick_restart_no_lp':     75          0       201       150           1          3'848
                 'lb_tree_search':     75        155    26'034     4'779      57'038      1'645'735
                         'max_lp':     75      5'042    39'371     8'083     199'220      5'434'580
                          'no_lp':    642     36'058    88'997     9'191   4'399'530     25'020'086
            'objective_lb_search':    145      7'347    77'544    16'322     499'063     11'055'762
     'objective_lb_search_max_lp':    120      4'352    24'389     6'902     165'994      3'668'257
      'objective_lb_search_no_lp':    289     35'761    79'668     7'287   1'186'485     24'425'118
                        'probing':    379        183       633       633       9'909         61'394
                 'probing_max_lp':    317        119       515       515       7'877         49'344
                   'pseudo_costs':    538      9'180    93'928    21'379   1'646'223     10'047'865
                  'quick_restart':    723      5'427    92'828    16'633   2'227'174      9'800'235
            'quick_restart_no_lp':  2'210     40'694   156'682    13'877  20'228'822     24'557'806
                  'reduced_costs':  1'615     16'130    88'513     9'942   7'444'429     11'803'493

SAT stats                           ClassicMinim  LitRemoved  LitLearned  LitForgotten  Subsumed  MClauses  MDecisions  MLitTrue  MSubsumed  MLitRemoved  MReused
                           'core':         8'773      49'912      55'582             0        35     2'405      11'769         0         71          213       43
                     'default_lp':         3'807       7'093      84'473             0       313     3'878      30'049         0        235        1'467      588
                      'fs_random':             0           0           0             0         0         0           0         0          0            0        0
                      'fs_random':             0           0           0             0         0         0           0         0          0            0        0
                      'fs_random':             0           0           0             0         0         0           0         0          0            0        0
                      'fs_random':             0           0           0             0         0         0           0         0          0            0        0
                'fs_random_no_lp':             0           0           0             0         0         0           0         0          0            0        0
                'fs_random_no_lp':             0           0           0             0         0         0           0         0          0            0        0
                'fs_random_no_lp':             0           0          25             0         0         0           0         0          0            0        0
                'fs_random_no_lp':             0           0          26             0         0         0           0         0          0            0        0
        'fs_random_quick_restart':             0           0           0             0         0         0           0         0          0            0        0
        'fs_random_quick_restart':             0           0           0             0         0         0           0         0          0            0        0
        'fs_random_quick_restart':             0           0           0             0         0         0           0         0          0            0        0
        'fs_random_quick_restart':             0           0           0             0         0         0           0         0          0            0        0
  'fs_random_quick_restart_no_lp':             0           0           0             0         0         0           0         0          0            0        0
  'fs_random_quick_restart_no_lp':             0           0           0             0         0         0           0         0          0            0        0
  'fs_random_quick_restart_no_lp':             0           0           0             0         0         0           0         0          0            0        0
                 'lb_tree_search':            32          54         736             0         0     1'503       7'619         0         28          113       95
                         'max_lp':         2'888       6'839      61'607             0       207     2'904      28'993         0        103          686      614
                          'no_lp':        31'266     136'611     458'083       197'538       442     3'858      33'499         0        562        4'134      694
            'objective_lb_search':         6'097      18'776      52'318             0       239     5'729      58'314         0        552        3'214    1'879
     'objective_lb_search_max_lp':         3'157       8'008      34'475             0       210     1'543      12'455         0        189        1'186      304
      'objective_lb_search_no_lp':        31'643     118'596     278'054        17'173       591     3'566      33'634         0      1'279        8'750      912
                        'probing':             0           0         183             0         0         0           0         0          0            0        0
                 'probing_max_lp':             0           0         119             0         0         0           0         0          0            0        0
                   'pseudo_costs':         5'593      12'306     105'455             0       326     7'947      54'707         7        278        1'584    1'446
                  'quick_restart':         3'399       8'763      50'459             0       229     6'853      64'100        11      1'092        6'847    1'576
            'quick_restart_no_lp':        31'222     125'260     425'904       142'555       596     6'730      46'776       144      3'923       25'497      584
                  'reduced_costs':         8'774      25'621     155'047        42'087       320     5'783      47'921         2      2'543       15'943    1'195

Lp stats                         Component  Iterations  AddedCuts  OPTIMAL  DUAL_F.  DUAL_U.
                  'default_lp':          1      99'321      6'989   11'244        0        1
                   'fs_random':          1          75        123        3        0        0
                   'fs_random':          1          75        135        3        0        0
                   'fs_random':          1          75        139        3        0        0
                   'fs_random':          1          75         62        3        0        0
     'fs_random_quick_restart':          1           0          0        1        1        0
     'fs_random_quick_restart':          1          65          0        1        1        0
     'fs_random_quick_restart':          1          75        145        3        1        0
     'fs_random_quick_restart':          1          75         81        3        0        0
              'lb_tree_search':          1     245'589      4'032    9'911    4'156        0
                      'max_lp':          1      98'428      6'138    7'245    1'989       12
         'objective_lb_search':          1     227'069      4'329   12'298        1        2
  'objective_lb_search_max_lp':          1     182'161      4'156    6'089    2'845        1
                     'probing':          1      21'787      4'976    2'573        0        0
              'probing_max_lp':          1      10'229      5'084    1'690       93        0
                'pseudo_costs':          1     180'279      8'962   13'656    3'047       13
               'quick_restart':          1     182'778      5'718   12'774        0        2
               'reduced_costs':          1     194'239     15'485   22'442    4'248        5

Lp dimension                                                                      Final dimension of first component
                  'default_lp':    255 rows, 212 columns, 952 entries with magnitude in [9.631667e-03, 1.000000e+00]
                   'fs_random':     75 rows, 212 columns, 306 entries with magnitude in [8.951436e-02, 1.000000e+00]
                   'fs_random':     75 rows, 212 columns, 306 entries with magnitude in [8.951436e-02, 1.000000e+00]
                   'fs_random':     75 rows, 212 columns, 306 entries with magnitude in [8.951436e-02, 1.000000e+00]
                   'fs_random':     76 rows, 212 columns, 308 entries with magnitude in [5.986186e-02, 1.000000e+00]
     'fs_random_quick_restart':    125 rows, 212 columns, 442 entries with magnitude in [5.136695e-02, 1.000000e+00]
     'fs_random_quick_restart':     75 rows, 212 columns, 306 entries with magnitude in [8.951436e-02, 1.000000e+00]
     'fs_random_quick_restart':     75 rows, 212 columns, 306 entries with magnitude in [8.951436e-02, 1.000000e+00]
     'fs_random_quick_restart':     75 rows, 212 columns, 306 entries with magnitude in [8.951436e-02, 1.000000e+00]
              'lb_tree_search':   320 rows, 227 columns, 1116 entries with magnitude in [1.174422e-02, 1.000000e+00]
                      'max_lp':   529 rows, 227 columns, 2024 entries with magnitude in [1.716890e-03, 1.000000e+00]
         'objective_lb_search':   472 rows, 212 columns, 1853 entries with magnitude in [3.272711e-04, 1.000000e+00]
  'objective_lb_search_max_lp':   569 rows, 227 columns, 2071 entries with magnitude in [4.773332e-03, 1.000000e+00]
                     'probing':   585 rows, 212 columns, 3428 entries with magnitude in [3.733603e-04, 1.000000e+00]
              'probing_max_lp':  1009 rows, 227 columns, 9822 entries with magnitude in [4.221400e-04, 1.000000e+00]
                'pseudo_costs':   468 rows, 227 columns, 1774 entries with magnitude in [1.612973e-03, 1.000000e+00]
               'quick_restart':   557 rows, 212 columns, 2282 entries with magnitude in [3.492943e-03, 1.000000e+00]
               'reduced_costs':   577 rows, 227 columns, 2019 entries with magnitude in [9.029365e-04, 1.000000e+00]

Lp debug                         CutPropag  CutEqPropag  Adjust  Overflow        Bad  BadScaling
                  'default_lp':         23           37   3'911         0     76'562           0
                   'fs_random':          0            0       0         0        126           0
                   'fs_random':          0            0       0         0        130           0
                   'fs_random':          0            0       0         0        131           0
                   'fs_random':          0            0       0         0         24           0
     'fs_random_quick_restart':          0            0       0         0          0           0
     'fs_random_quick_restart':          0            0       0         0          0           0
     'fs_random_quick_restart':          0            0       0         0        136           0
     'fs_random_quick_restart':          0            0       0         0         76           0
              'lb_tree_search':         12            1   6'007         0     32'901           0
                      'max_lp':         47           11   2'929         0     55'787           0
         'objective_lb_search':         52            2   4'911         0     93'609           0
  'objective_lb_search_max_lp':         23            6   4'328         0     67'085           0
                     'probing':         25           46   2'307         0  1'229'684           0
              'probing_max_lp':         25           28   1'747         0    870'776           0
                'pseudo_costs':         42            3   6'884         0     92'414           0
               'quick_restart':         94           17   5'908         0    181'084           0
               'reduced_costs':        127           28  11'820         0    121'217           0

Lp pool                          Constraints  Updates  Simplif  Merged  Shortened  Split  Strenghtened      Cuts/Call
                  'default_lp':        7'115      686   49'814      87      3'655  3'405        18'037   6'989/19'028
                   'fs_random':          275        0        0       0          0      0             0          62/79
                   'fs_random':          336        0        0       0          0      0             0        123/187
                   'fs_random':          348        0        0       0          0      0             0        135/222
                   'fs_random':          352        0        0       0          0      0             0        139/228
     'fs_random_quick_restart':          213        0        0       0          0      0             0            0/0
     'fs_random_quick_restart':          213        0        0       0          0      0             0            0/0
     'fs_random_quick_restart':          294        0        0       0          0      0             0         81/119
     'fs_random_quick_restart':          358        0        0       0          0      0             0        145/231
              'lb_tree_search':        6'453      215    5'351      18          0    395        12'729   4'032/11'853
                      'max_lp':        8'517      472   41'796      60      2'314  1'051        32'950   6'138/14'517
         'objective_lb_search':        4'523      516   24'574      19      3'535  2'102         8'913   4'329/14'300
  'objective_lb_search_max_lp':        6'588      546   36'743       7      3'410  1'314        35'860   4'156/10'286
                     'probing':        5'171      725   25'037      18      1'232  4'136         4'129   4'976/10'329
              'probing_max_lp':        7'504      949   16'410      19      2'445  2'008        18'522   5'084/11'182
                'pseudo_costs':       11'356      458   33'443      45      2'513  3'350        31'265   8'962/24'721
               'quick_restart':        5'908      952  107'700      23      5'309  7'967        28'027   5'718/18'398
               'reduced_costs':       11'730      844  171'867     194     11'808  4'268        72'541  15'485/42'048

Lp Cut            fs_ran  fs_ran  fs_ran  fs_ran  fs_ran  fs_ran  defaul  max_lp  quick_  reduce  pseudo  lb_tre  probin  object  probin  object
          CG_FF:       7      11      11      11       -       -     296     284     105     970     400     157     157     160     149     161
           CG_K:       7      11      11      11       -       -     185     174      77     619     249      82      47      97      87      47
           CG_R:       5       7       7       7       -       -     220     191     129     674     257      60     103      94     112      61
          CG_RB:       -       -       -       -       -       -     813     842     461   2'300   1'069     517     480     436     542     452
         CG_RBP:       -       -       -       -       -       -      92      55      27     268      95      24      25      32      63      35
         Clique:       -       -       -       -       -       -       -      73       -     117      70      62       -       -      50      70
             IB:      50      50      50      50      50      50     788     534     758   1'057     742     575     567     645     273     663
       MIR_1_FF:      24      25      25      25       7      14     427     382     344     776     504     277     218     307     287     242
        MIR_1_K:       2       1       1       2       1       1      73      46      38     209      87      24      12      46      24      21
       MIR_1_KL:       -       -       -       -       -       -       3       -       1       3       -       -       1       -       -       -
        MIR_1_R:       3       3       3       3       1       3      79      31      51     121      72      15      30      47      14      17
       MIR_1_RB:      14      14      15      15       3       7     663     573     520   1'271     893     396     427     368     406     354
      MIR_1_RBP:       -       -       -       -       -       -      63      86      32     182     136      66      31      27      48      57
       MIR_2_FF:       3       2       2       3       -       1     268     156     199     537     293      98      96     138     113     126
        MIR_2_K:       2       2       2       1       -       2      38      31      44     130      53      16      17      32      19      15
       MIR_2_KL:       -       -       -       -       -       -       8       2       5       6       5       -       2       3       1       2
        MIR_2_R:       1       -       -       -       -       -      62      54      68     161     109      35      43      35      41      31
       MIR_2_RB:       4       4       4       4       -       3     420     279     332     800     541     204     225     243     183     175
      MIR_2_RBP:       -       -       -       -       -       -      38      32      13     128     105      33      17      14      24      24
       MIR_3_FF:       1       2       -       1       -       -     195     115     123     379     184      72      69      99      65      74
        MIR_3_K:       -       1       -       1       -       -      42      31      20      90      52      19      16      26      22      13
       MIR_3_KL:       -       -       -       -       -       -       4       1       3       8       5       1       5       1       -       3
        MIR_3_R:       -       2       -       1       -       -      95      86      44     155     104      42      43      31      40      40
       MIR_3_RB:       -       -       -       1       -       -     234     238     213     510     284     146     138     172     124     102
      MIR_3_RBP:       -       -       -       -       -       -      37      35      13      99      56      20      19      14      10      16
       MIR_4_FF:       -       -       -       -       -       -     124      85      99     245     141      31      39      74      42      54
        MIR_4_K:       -       -       -       -       -       -      27      22       7      77      20      13       8      10       5      14
       MIR_4_KL:       -       -       -       -       -       -       3       1       3       4       1       -       4       -       1       1
        MIR_4_R:       -       -       -       -       -       -      54      58      29     163     106      33      25      24      30      37
       MIR_4_RB:       -       -       -       -       -       -     162     143     135     345     222      85      98     103      68      70
      MIR_4_RBP:       -       -       -       -       -       -      19      16       9      62      40       6       5       4       3      17
       MIR_5_FF:       -       -       -       -       -       -      88      49      69     150      70      20      39      55      16      29
        MIR_5_K:       -       1       -       -       -       -      26      17      12      38      20       7      11      14      13      12
       MIR_5_KL:       -       -       -       -       -       -       6       1       2       6       1       -       4       -       -       -
        MIR_5_R:       -       -       -       -       -       -      43      21      37      85      46      18      32      29      22      19
       MIR_5_RB:       -       1       -       -       -       -     113      88     115     227     142      52      71      67      42      39
      MIR_5_RBP:       -       -       -       -       -       -      15       6       3      54      23       2       7       9       1       9
       MIR_6_FF:       -       -       -       -       -       -      67      29      37      97      40      19      25      43      12      17
        MIR_6_K:       -       -       -       -       -       -      19      12       6      25      12       6       7      13       8       8
       MIR_6_KL:       -       -       -       -       -       -       2       -       -       -       -       -       -       -       -       -
        MIR_6_R:       -       -       -       -       -       -      29      16      22      67      39      11      15      21       6       9
       MIR_6_RB:       -       -       -       -       -       -      83      49      68     121      72      28      40      42      15      25
      MIR_6_RBP:       -       -       -       -       -       -      12      10       1      23      10       2       2       6       3       3
   ZERO_HALF_FF:       -       3       2       2       -       -     101     104      57     250     130      52      40      46      46      47
    ZERO_HALF_K:       -       1       -       -       -       -      18      14       7      68      33       5       7      11       2       3
    ZERO_HALF_R:       -       1       -       -       -       -     590     822   1'231   1'244   1'026     528   1'436     558   1'905     790
   ZERO_HALF_RB:       -       3       2       1       -       -     172     214     116     463     335     146     237      97     132     119
  ZERO_HALF_RBP:       -       -       -       -       -       -      73      30      33     101      68      27      36      36      15      33

LNS stats           Improv/Calls  Closed  Difficulty  TimeLimit
  'graph_arc_lns':        25/224     52%        0.98       0.11
  'graph_cst_lns':         9/160     54%        0.99       0.10
  'graph_dec_lns':        18/223     53%        0.99       0.11
  'graph_var_lns':        20/224     54%        0.99       0.11
      'rins/rens':        32/213     50%        0.82       0.10
    'rnd_cst_lns':        13/217     54%        0.99       0.11
    'rnd_var_lns':        17/224     52%        0.99       0.11

LS stats                   Batches  Restarts   LinMoves   GenMoves  CompoundMoves  WeightUpdates
       'fj_long_default':        1         1      5'197          0              0             91
       'fj_long_default':        1         1      9'721          0              0            279
   'fj_long_lin_default':        1         1          0      2'684            541              2
   'fj_long_lin_perturb':        1         1      8'969          0              0          1'031
    'fj_long_lin_random':        1         1      9'208          0              0            792
       'fj_long_perturb':        1         1          0      2'744            239              1
        'fj_long_random':        1         1      9'784          0              0            216
      'fj_short_default':        1         1          0      2'637            439              1
      'fj_short_default':        1         1      9'166          0              0            834
  'fj_short_lin_default':        1         1          0      2'700            324              1
  'fj_short_lin_default':        1         1          0      2'751            423              1
  'fj_short_lin_perturb':        1         1      9'777          0              0            223
   'fj_short_lin_random':        1         1          0      2'646            325              1
      'fj_short_perturb':        1         1      9'759          0              0            241
       'fj_short_random':        1         1          0      2'849            414              1
          'violation_ls':      221         0  1'774'123      9'000            372        309'073
          'violation_ls':      223         0     35'106    844'809         72'740         16'964
          'violation_ls':      224         0  1'001'909    497'697         37'951         29'299
          'violation_ls':      224         0     30'413  1'117'841         52'127         14'953
          'violation_ls':      224         0     39'676  1'227'068         27'670          6'379

Solutions (75)            Num     Rank
        'graph_dec_lns':    1  [44,44]
                'no_lp':   13   [1,16]
        'quick_restart':    1  [73,73]
  'quick_restart_no_lp':    4  [45,68]
          'rnd_var_lns':    1  [29,29]
         'violation_ls':   55  [13,75]

Objective bounds                     Num
                       'bool_core':   27
                      'default_lp':    4
                  'initial_domain':    1
             'objective_lb_search':   10
       'objective_lb_search_no_lp':   70
  'objective_shaving_search_no_lp':    9

Solution repositories    Added  Queried  Ignored  Synchro
  'feasible solutions':  1'460    4'422       11    1'390
        'lp solutions':    557      122        0      489
                'pump':  4'658      101

Improving bounds shared            Num
                        'core':     29
                  'default_lp':     29
             'fs_random_no_lp':      1
              'lb_tree_search':     10
                      'max_lp':     62
                       'no_lp':     19
         'objective_lb_search':     31
  'objective_lb_search_max_lp':     14
   'objective_lb_search_no_lp':     62
                     'probing':    185
              'probing_max_lp':     81
                'pseudo_costs':     84
               'quick_restart':    163
         'quick_restart_no_lp':  1'304
               'reduced_costs':    393

Clauses shared                   Num
                        'core':    4
                  'default_lp':   25
             'fs_random_no_lp':    1
              'lb_tree_search':    1
                      'max_lp':    2
                       'no_lp':    7
         'objective_lb_search':   43
  'objective_lb_search_max_lp':   23
   'objective_lb_search_no_lp':    6
                'pseudo_costs':   12
               'quick_restart':    4
         'quick_restart_no_lp':   81
               'reduced_costs':   23

CpSolverResponse summary:
status: OPTIMAL
objective: 1332
best_bound: 1332
integers: 213
booleans: 75
conflicts: 0
branches: 150
propagations: 0
integer_propagations: 2525
restarts: 150
lp_iterations: 75
walltime: 56.1147
usertime: 56.1147
deterministic_time: 289.885
gap_integral: 1130.65
solution_fingerprint: 0x6214eefa0530d886


--- Simulation Gantt  partir du modle mathmatique ---
{'big':1, 'due_date':91, 'pos_time':5, 'status':0, 'blocked':0, 'operations':["{'type':0, 'processing_time':50}", "{'type':1, 'processing_time':32}"]}
{'big':1, 'due_date':79, 'pos_time':5, 'status':0, 'blocked':0, 'operations':["{'type':0, 'processing_time':12}"]}
{'big':1, 'due_date':77, 'pos_time':5, 'status':0, 'blocked':0, 'operations':["{'type':1, 'processing_time':23}"]}
{'big':1, 'due_date':112, 'pos_time':5, 'status':0, 'blocked':0, 'operations':["{'type':1, 'processing_time':33}"]}
{'big':0, 'due_date':102, 'pos_time':5, 'status':0, 'blocked':0, 'operations':["{'type':1, 'processing_time':39}", "{'type':0, 'processing_time':23}"]}
{'big':1, 'due_date':124, 'pos_time':5, 'status':0, 'blocked':0, 'operations':["{'type':0, 'processing_time':21}", "{'type':1, 'processing_time':45}"]}
{'big':1, 'due_date':81, 'pos_time':5, 'status':0, 'blocked':0, 'operations':["{'type':0, 'processing_time':50}", "{'type':1, 'processing_time':57}"]}
{'big':1, 'due_date':117, 'pos_time':5, 'status':0, 'blocked':0, 'operations':["{'type':1, 'processing_time':23}"]}
