created virtual environment CPython3.12.4.final.0-64 in 26060ms
  creator CPython3Posix(dest=/localscratch/aneumann.63393211.0/env, clear=False, no_vcs_ignore=False, global=False)
  seeder FromAppData(download=False, pip=bundle, via=copy, app_data_dir=/home/aneumann/.local/share/virtualenv)
    added seed packages: pip==25.1.1
  activators BashActivator,CShellActivator,FishActivator,NushellActivator,PowerShellActivator,PythonActivator
Looking in links: /cvmfs/soft.computecanada.ca/custom/python/wheelhouse/gentoo2023/x86-64-v3, /cvmfs/soft.computecanada.ca/custom/python/wheelhouse/gentoo2023/generic, /cvmfs/soft.computecanada.ca/custom/python/wheelhouse/generic
Requirement already satisfied: pip in /localscratch/aneumann.63393211.0/env/lib/python3.12/site-packages (25.1.1)
Looking in links: /cvmfs/soft.computecanada.ca/custom/python/wheelhouse/gentoo2023/x86-64-v3, /cvmfs/soft.computecanada.ca/custom/python/wheelhouse/gentoo2023/generic, /cvmfs/soft.computecanada.ca/custom/python/wheelhouse/generic
ERROR: protobuf-5.28.3-cp38-abi3-manylinux2014_x86_64.whl is not a supported wheel on this platform.
Looking in links: /cvmfs/soft.computecanada.ca/custom/python/wheelhouse/gentoo2023/x86-64-v3, /cvmfs/soft.computecanada.ca/custom/python/wheelhouse/gentoo2023/generic, /cvmfs/soft.computecanada.ca/custom/python/wheelhouse/generic
Processing /home/aneumann/projects/def-adhaj/aneumann/GNRS/wheels/immutabledict-4.2.0-py3-none-any.whl
Installing collected packages: immutabledict
Successfully installed immutabledict-4.2.0
Looking in links: /cvmfs/soft.computecanada.ca/custom/python/wheelhouse/gentoo2023/x86-64-v3, /cvmfs/soft.computecanada.ca/custom/python/wheelhouse/gentoo2023/generic, /cvmfs/soft.computecanada.ca/custom/python/wheelhouse/generic
Processing /cvmfs/soft.computecanada.ca/custom/python/wheelhouse/generic/ortools-9.10.4067+computecanada-cp312-cp312-linux_x86_64.whl (from -r /home/aneumann/projects/def-adhaj/aneumann/GNRS/requirements/or.txt (line 1))
Processing /cvmfs/soft.computecanada.ca/custom/python/wheelhouse/gentoo2023/x86-64-v3/matplotlib-3.10.0+computecanada-cp312-cp312-linux_x86_64.whl (from -r /home/aneumann/projects/def-adhaj/aneumann/GNRS/requirements/or.txt (line 2))
Processing /cvmfs/soft.computecanada.ca/custom/python/wheelhouse/gentoo2023/x86-64-v3/pandas-2.2.3+computecanada-cp312-cp312-linux_x86_64.whl (from -r /home/aneumann/projects/def-adhaj/aneumann/GNRS/requirements/or.txt (line 3))
Processing /cvmfs/soft.computecanada.ca/custom/python/wheelhouse/generic/absl_py-2.2.2+computecanada-py3-none-any.whl (from ortools<9.11,>=9.10->-r /home/aneumann/projects/def-adhaj/aneumann/GNRS/requirements/or.txt (line 1))
Processing /cvmfs/soft.computecanada.ca/custom/python/wheelhouse/gentoo2023/generic/numpy-2.2.2+computecanada-cp312-cp312-linux_x86_64.whl (from ortools<9.11,>=9.10->-r /home/aneumann/projects/def-adhaj/aneumann/GNRS/requirements/or.txt (line 1))
Processing /cvmfs/soft.computecanada.ca/custom/python/wheelhouse/gentoo2023/x86-64-v3/protobuf-6.30.2+computecanada-cp312-cp312-linux_x86_64.whl (from ortools<9.11,>=9.10->-r /home/aneumann/projects/def-adhaj/aneumann/GNRS/requirements/or.txt (line 1))
Requirement already satisfied: immutabledict>=3.0.0 in /localscratch/aneumann.63393211.0/env/lib/python3.12/site-packages (from ortools<9.11,>=9.10->-r /home/aneumann/projects/def-adhaj/aneumann/GNRS/requirements/or.txt (line 1)) (4.2.0)
Processing /cvmfs/soft.computecanada.ca/custom/python/wheelhouse/gentoo2023/generic/contourpy-1.3.1+computecanada-cp312-cp312-linux_x86_64.whl (from matplotlib->-r /home/aneumann/projects/def-adhaj/aneumann/GNRS/requirements/or.txt (line 2))
Processing /cvmfs/soft.computecanada.ca/custom/python/wheelhouse/generic/cycler-0.12.1+computecanada-py3-none-any.whl (from matplotlib->-r /home/aneumann/projects/def-adhaj/aneumann/GNRS/requirements/or.txt (line 2))
Processing /cvmfs/soft.computecanada.ca/custom/python/wheelhouse/generic/fonttools-4.58.2+computecanada-cp312-cp312-linux_x86_64.whl (from matplotlib->-r /home/aneumann/projects/def-adhaj/aneumann/GNRS/requirements/or.txt (line 2))
Processing /cvmfs/soft.computecanada.ca/custom/python/wheelhouse/gentoo2023/x86-64-v3/kiwisolver-1.4.8+computecanada-cp312-cp312-linux_x86_64.whl (from matplotlib->-r /home/aneumann/projects/def-adhaj/aneumann/GNRS/requirements/or.txt (line 2))
Processing /cvmfs/soft.computecanada.ca/custom/python/wheelhouse/generic/packaging-25.0+computecanada-py3-none-any.whl (from matplotlib->-r /home/aneumann/projects/def-adhaj/aneumann/GNRS/requirements/or.txt (line 2))
Processing /cvmfs/soft.computecanada.ca/custom/python/wheelhouse/gentoo2023/x86-64-v3/pillow-11.1.0+computecanada-cp312-cp312-linux_x86_64.whl (from matplotlib->-r /home/aneumann/projects/def-adhaj/aneumann/GNRS/requirements/or.txt (line 2))
Processing /cvmfs/soft.computecanada.ca/custom/python/wheelhouse/generic/pyparsing-3.2.1+computecanada-py3-none-any.whl (from matplotlib->-r /home/aneumann/projects/def-adhaj/aneumann/GNRS/requirements/or.txt (line 2))
Processing /cvmfs/soft.computecanada.ca/custom/python/wheelhouse/generic/python_dateutil-2.9.0.post0+computecanada-py2.py3-none-any.whl (from matplotlib->-r /home/aneumann/projects/def-adhaj/aneumann/GNRS/requirements/or.txt (line 2))
Processing /cvmfs/soft.computecanada.ca/custom/python/wheelhouse/generic/pytz-2025.2+computecanada-py2.py3-none-any.whl (from pandas->-r /home/aneumann/projects/def-adhaj/aneumann/GNRS/requirements/or.txt (line 3))
Processing /cvmfs/soft.computecanada.ca/custom/python/wheelhouse/generic/tzdata-2025.2+computecanada-py2.py3-none-any.whl (from pandas->-r /home/aneumann/projects/def-adhaj/aneumann/GNRS/requirements/or.txt (line 3))
Processing /cvmfs/soft.computecanada.ca/custom/python/wheelhouse/generic/six-1.17.0+computecanada-py2.py3-none-any.whl (from python-dateutil>=2.7->matplotlib->-r /home/aneumann/projects/def-adhaj/aneumann/GNRS/requirements/or.txt (line 2))
Installing collected packages: pytz, tzdata, six, pyparsing, protobuf, pillow, packaging, numpy, kiwisolver, fonttools, cycler, absl-py, python-dateutil, contourpy, pandas, matplotlib, ortools

Successfully installed absl-py-2.2.2+computecanada contourpy-1.3.1+computecanada cycler-0.12.1+computecanada fonttools-4.58.2+computecanada kiwisolver-1.4.8+computecanada matplotlib-3.10.0+computecanada numpy-2.2.2+computecanada ortools-9.10.4067+computecanada packaging-25.0+computecanada pandas-2.2.3+computecanada pillow-11.1.0+computecanada protobuf-6.30.2+computecanada pyparsing-3.2.1+computecanada python-dateutil-2.9.0.post0+computecanada pytz-2025.2+computecanada six-1.17.0+computecanada tzdata-2025.2+computecanada

Starting CP-SAT solver v9.10.4067
Parameters: max_time_in_seconds: 3600 max_memory_in_mb: 12000 log_search_progress: true enumerate_all_solutions: false absolute_gap_limit: 0 relative_gap_limit: 0
Setting number of workers to 48

Initial optimization model '': (model_fingerprint: 0x300bac09c03017b9)
#Variables: 306 (#ints: 9 in objective)
  - 213 Booleans in [0,1]
  - 93 in [0,593]
#kLinear1: 41
#kLinear2: 538
#kLinear3: 198
#kLinearN: 2'726 (#terms: 37'211)

Starting presolve at 0.00s
  1.97e-03s  0.00e+00d  [DetectDominanceRelations] 
  4.32e-02s  0.00e+00d  [PresolveToFixPoint] #num_loops=6 #num_dual_strengthening=3 
  3.57e-05s  0.00e+00d  [ExtractEncodingFromLinear] #potential_supersets=4 
[Symmetry] Graph for symmetry has 3'318 nodes and 27'756 arcs.
[Symmetry] Symmetry computation done. time: 0.00265976 dtime: 0.00270831
[Symmetry] #generators: 1, average support size: 24
[Symmetry] The model contains 286 duplicate constraints !
[Symmetry] 12 orbits with sizes: 2,2,2,2,2,2,2,2,2,2,...
[Symmetry] Num fixable by intersecting at_most_one with orbits: 1 largest_orbit: 2
  1.07e-02s  1.48e-03d  [Probe] #probed=296 #fixed_bools=3 #new_bounds=19 #equiv=1 
  5.53e-05s  0.00e+00d  [MaxClique] Merged 26(52 literals) into 11(22 literals) at_most_ones. 
  1.93e-03s  0.00e+00d  [DetectDominanceRelations] 
  2.12e-02s  0.00e+00d  [PresolveToFixPoint] #num_loops=4 #num_dual_strengthening=3 
  6.59e-03s  0.00e+00d  [ProcessAtMostOneAndLinear] 
  3.06e-03s  0.00e+00d  [DetectDuplicateConstraints] #duplicates=343 #without_enforcements=221 
  2.37e-03s  1.01e-04d  [DetectDominatedLinearConstraints] #relevant_constraints=2'128 #num_inclusions=1'555 #num_redundant=1 
  3.65e-04s  0.00e+00d  [DetectDifferentVariables] #different=39 
  6.13e-04s  3.24e-05d  [ProcessSetPPC] #relevant_constraints=1'611 
  3.09e-05s  0.00e+00d  [FindAlmostIdenticalLinearConstraints] 
  2.16e-04s  1.78e-04d  [FindBigAtMostOneAndLinearOverlap] 
  7.74e-03s  2.15e-03d  [FindBigVerticalLinearOverlap] #blocks=38 #saved_nz=3'726 
  3.29e-04s  7.81e-05d  [FindBigHorizontalLinearOverlap] #linears=1'553 
  1.57e-05s  0.00e+00d  [MergeClauses] 
  2.06e-03s  0.00e+00d  [DetectDominanceRelations] 
  2.42e-02s  0.00e+00d  [PresolveToFixPoint] #num_loops=2 #num_dual_strengthening=1 
  2.05e-03s  0.00e+00d  [DetectDominanceRelations] 
  1.44e-02s  0.00e+00d  [PresolveToFixPoint] #num_loops=1 #num_dual_strengthening=1 
[Symmetry] Graph for symmetry has 3'057 nodes and 22'696 arcs.
[Symmetry] Symmetry computation done. time: 0.000889675 dtime: 0.00131671
  1.00e-02s  1.38e-03d  [Probe] #probed=290 #new_bounds=30 
  1.50e-05s  0.00e+00d  [MaxClique] 
  2.03e-03s  0.00e+00d  [DetectDominanceRelations] 
  2.18e-02s  0.00e+00d  [PresolveToFixPoint] #num_loops=2 #num_dual_strengthening=1 
  5.84e-03s  0.00e+00d  [ProcessAtMostOneAndLinear] 
  2.70e-03s  0.00e+00d  [DetectDuplicateConstraints] #without_enforcements=243 
  1.30e-03s  5.57e-05d  [DetectDominatedLinearConstraints] #relevant_constraints=1'761 #num_inclusions=237 
  3.78e-04s  0.00e+00d  [DetectDifferentVariables] #different=45 #cliques=1 #size=3 
  5.43e-04s  2.38e-05d  [ProcessSetPPC] #relevant_constraints=1'446 
  3.89e-05s  6.00e-08d  [FindAlmostIdenticalLinearConstraints] #num_tested_pairs=4 
  1.40e-04s  9.51e-05d  [FindBigAtMostOneAndLinearOverlap] 
  4.71e-03s  1.59e-03d  [FindBigVerticalLinearOverlap] #blocks=31 #saved_nz=2'557 
  2.83e-04s  5.88e-05d  [FindBigHorizontalLinearOverlap] #linears=1'323 
  1.56e-05s  0.00e+00d  [MergeClauses] 
  1.89e-03s  0.00e+00d  [DetectDominanceRelations] 
  2.23e-02s  0.00e+00d  [PresolveToFixPoint] #num_loops=2 #num_dual_strengthening=1 
  1.89e-03s  0.00e+00d  [DetectDominanceRelations] 
  1.53e-02s  0.00e+00d  [PresolveToFixPoint] #num_loops=1 #num_dual_strengthening=1 
  9.77e-03s  1.30e-03d  [Probe] #probed=290 #new_bounds=26 
  1.51e-05s  0.00e+00d  [MaxClique] 
  1.87e-03s  0.00e+00d  [DetectDominanceRelations] 
  2.03e-02s  0.00e+00d  [PresolveToFixPoint] #num_loops=2 #num_dual_strengthening=1 
  5.21e-03s  0.00e+00d  [ProcessAtMostOneAndLinear] 
  2.62e-03s  0.00e+00d  [DetectDuplicateConstraints] #without_enforcements=252 
  1.01e-03s  4.19e-05d  [DetectDominatedLinearConstraints] #relevant_constraints=1'645 #num_inclusions=30 
  2.55e-04s  0.00e+00d  [DetectDifferentVariables] 
  4.50e-04s  1.73e-05d  [ProcessSetPPC] #relevant_constraints=1'244 
  4.60e-05s  3.15e-07d  [FindAlmostIdenticalLinearConstraints] #num_tested_pairs=14 
  1.10e-04s  6.43e-05d  [FindBigAtMostOneAndLinearOverlap] 
  4.22e-03s  1.30e-03d  [FindBigVerticalLinearOverlap] #blocks=28 #saved_nz=2'148 
  2.42e-04s  4.27e-05d  [FindBigHorizontalLinearOverlap] #linears=1'134 
  1.56e-05s  0.00e+00d  [MergeClauses] 
  1.70e-03s  0.00e+00d  [DetectDominanceRelations] 
  2.17e-02s  0.00e+00d  [PresolveToFixPoint] #num_loops=2 #num_dual_strengthening=1 
  9.17e-05s  0.00e+00d  [ExpandObjective] #entries=379 #tight_variables=134 #tight_constraints=76 

Presolve summary:
  - 61 affine relations were detected.
  - rule 'TODO dual: only one blocking constraint?' was applied 697 times.
  - rule 'TODO dual: only one unspecified blocking constraint?' was applied 117 times.
  - rule 'TODO duplicate: identical constraint with different enforcements' was applied 716 times.
  - rule 'TODO no_overlap: with task always last' was applied 1 time.
  - rule 'affine: new relation' was applied 61 times.
  - rule 'all_diff: inferred from x != y constraints' was applied 1 time.
  - rule 'at_most_one: removed literals' was applied 11 times.
  - rule 'at_most_one: size one' was applied 11 times.
  - rule 'at_most_one: transformed into max clique.' was applied 1 time.
  - rule 'deductions: 257 stored' was applied 1 time.
  - rule 'dual: fix variable' was applied 24 times.
  - rule 'dual: reduced domain' was applied 57 times.
  - rule 'duplicate: merged rhs of linear constraint' was applied 59 times.
  - rule 'duplicate: removed constraint' was applied 343 times.
  - rule 'enforcement: false literal' was applied 21 times.
  - rule 'enforcement: true literal' was applied 14 times.
  - rule 'exactly_one: x and not(x)' was applied 1 time.
  - rule 'incompatible linear: add implication' was applied 45 times.
  - rule 'linear inclusion: redundant containing constraint' was applied 1 time.
  - rule 'linear matrix: common vertical rectangle' was applied 97 times.
  - rule 'linear: always true' was applied 665 times.
  - rule 'linear: doubleton free' was applied 11 times.
  - rule 'linear: empty' was applied 30 times.
  - rule 'linear: extracted enforcement literal' was applied 6'258 times.
  - rule 'linear: fixed or dup variables' was applied 2'792 times.
  - rule 'linear: positive equal one' was applied 4 times.
  - rule 'linear: reduced variable domains' was applied 200 times.
  - rule 'linear: remapped using affine relations' was applied 2'706 times.
  - rule 'linear: simplified rhs' was applied 9'463 times.
  - rule 'linear: variable substitution 1' was applied 11 times.
  - rule 'linear: variable substitution 2' was applied 3 times.
  - rule 'linear: variable substitution 3' was applied 2 times.
  - rule 'presolve: 90 unused variables removed.' was applied 1 time.
  - rule 'presolve: iteration' was applied 3 times.
  - rule 'probing: reduced enforced constraint to implication.' was applied 26 times.
  - rule 'symmetry: fixed to false in general orbit' was applied 1 time.

Presolved optimization model '': (model_fingerprint: 0x934016403f9e6be4)
#Variables: 236 (#ints: 9 in objective)
  - 73 Booleans in [0,1]
  - 128 different domains in [-4606,4631] with a largest complexity of 11.
#kAllDiff: 1
#kExactlyOne: 3 (#literals: 9)
#kLinear2: 830 (#enforced: 768 #multi: 666)
#kLinear3: 277 (#enforced: 190)
#kLinearN: 1'327 (#enforced: 1'196) (#terms: 9'319)

Preloading model.
#Bound   0.31s best:inf   next:[158,4377] initial_domain
#Model   0.31s var:236/236 constraints:2438/2438

Starting search at 0.31s with 48 workers.
16 full problem subsolvers: [core, default_lp, lb_tree_search, max_lp, no_lp, objective_lb_search, objective_lb_search_max_lp, objective_lb_search_no_lp, objective_shaving_search_max_lp, objective_shaving_search_no_lp, probing, probing_max_lp, pseudo_costs, quick_restart, quick_restart_no_lp, reduced_costs]
30 first solution subsolvers: [fj_long_default(2), fj_long_lin_default, fj_long_lin_perturb, fj_long_lin_random, fj_long_perturb, fj_long_random, fj_short_default(2), fj_short_lin_default(2), fj_short_lin_perturb, fj_short_lin_random, fj_short_perturb, fj_short_random, fs_random(4), fs_random_no_lp(4), fs_random_quick_restart(4), fs_random_quick_restart_no_lp(3)]
13 incomplete subsolvers: [feasibility_pump, graph_arc_lns, graph_cst_lns, graph_dec_lns, graph_var_lns, rins/rens, rnd_cst_lns, rnd_var_lns, violation_ls(5)]
3 helper subsolvers: [neighborhood_helper, synchronization_agent, update_gap_integral]
#Bound   0.35s best:inf   next:[199,4377] objective_lb_search_no_lp
#1       0.35s best:1870  next:[199,1869] no_lp (fixed_bools=0/110)
#2       0.36s best:1766  next:[199,1765] no_lp (fixed_bools=0/125)
#Bound   0.36s best:1766  next:[254,1765] objective_lb_search_no_lp
#3       0.37s best:1746  next:[254,1745] no_lp (fixed_bools=0/132)
#Bound   0.37s best:1746  next:[255,1745] objective_lb_search_no_lp
#Bound   0.38s best:1746  next:[261,1745] objective_lb_search_no_lp
#Bound   0.38s best:1746  next:[265,1745] objective_lb_search_no_lp
#4       0.39s best:1730  next:[265,1729] no_lp (fixed_bools=0/140)
#5       0.41s best:1714  next:[265,1713] no_lp (fixed_bools=0/145)
#6       0.42s best:1645  next:[265,1644] no_lp (fixed_bools=0/153)
#7       0.42s best:1625  next:[265,1624] no_lp (fixed_bools=0/158)
#8       0.43s best:1595  next:[265,1594] no_lp (fixed_bools=0/170)
#9       0.43s best:1507  next:[265,1506] no_lp (fixed_bools=0/175)
#Bound   0.46s best:1507  next:[288,1506] objective_lb_search_no_lp
#10      0.47s best:1491  next:[288,1490] no_lp (fixed_bools=0/187)
#11      0.49s best:1490  next:[288,1489] violation_ls(batch:2 #solutions_imported:2 #lin_moves:0 #lin_evals:28'548 #gen_moves:13'354 #gen_evals:735 #comp_moves:1'015 #backtracks:6'162 #weight_updates:131)
#12      0.50s best:1489  next:[288,1488] violation_ls(batch:3 #solutions_imported:3 #lin_moves:303 #lin_evals:30'029 #gen_moves:13'354 #gen_evals:735 #comp_moves:1'015 #backtracks:6'162 #weight_updates:365)
#13      0.50s best:1488  next:[288,1487] violation_ls(batch:4 #solutions_imported:4 #lin_moves:304 #lin_evals:30'038 #gen_moves:13'354 #gen_evals:735 #comp_moves:1'015 #backtracks:6'162 #weight_updates:365)
#14      0.51s best:1479  next:[288,1478] no_lp (fixed_bools=0/194)
#15      0.51s best:1435  next:[288,1434] rnd_var_lns (d=0.96 s=105 t=0.10 p=1.00 stall=0 h=auto_l0)
#16      0.53s best:1359  next:[288,1358] quick_restart_no_lp (fixed_bools=0/211)
#17      0.53s best:1354  next:[288,1353] quick_restart_no_lp (fixed_bools=0/216)
#18      0.54s best:1352  next:[288,1351] quick_restart_no_lp (fixed_bools=0/225)
#19      0.55s best:1350  next:[288,1349] violation_ls(batch:4 #solutions_imported:4 #lin_moves:19'521 #lin_evals:85'225 #gen_moves:7 #gen_evals:0 #comp_moves:1 #backtracks:3 #weight_updates:10'479)
#20      0.55s best:1348  next:[288,1347] violation_ls(batch:5 #solutions_imported:5 #lin_moves:19'522 #lin_evals:85'234 #gen_moves:7 #gen_evals:0 #comp_moves:1 #backtracks:3 #weight_updates:10'479)
#21      0.55s best:1347  next:[288,1346] violation_ls(batch:6 #solutions_imported:6 #lin_moves:19'522 #lin_evals:85'238 #gen_moves:9 #gen_evals:0 #comp_moves:3 #backtracks:3 #weight_updates:10'479)
#22      0.55s best:1346  next:[288,1345] violation_ls(batch:8 #solutions_imported:8 #lin_moves:5'325 #lin_evals:54'698 #gen_moves:13'354 #gen_evals:735 #comp_moves:1'015 #backtracks:6'162 #weight_updates:5'347)
#23      0.55s best:1345  next:[288,1344] violation_ls(batch:7 #solutions_imported:7 #lin_moves:19'522 #lin_evals:85'242 #gen_moves:10 #gen_evals:0 #comp_moves:4 #backtracks:3 #weight_updates:10'479)
#24      0.55s best:1344  next:[288,1343] violation_ls(batch:8 #solutions_imported:8 #lin_moves:19'523 #lin_evals:85'251 #gen_moves:10 #gen_evals:0 #comp_moves:4 #backtracks:3 #weight_updates:10'479)
#25      0.55s best:1343  next:[288,1342] violation_ls(batch:9 #solutions_imported:9 #lin_moves:19'523 #lin_evals:85'256 #gen_moves:12 #gen_evals:0 #comp_moves:6 #backtracks:3 #weight_updates:10'479)
#26      0.55s best:1342  next:[288,1341] violation_ls(batch:10 #solutions_imported:10 #lin_moves:19'523 #lin_evals:85'298 #gen_moves:30 #gen_evals:0 #comp_moves:8 #backtracks:11 #weight_updates:10'479)
#27      0.55s best:1341  next:[288,1340] violation_ls(batch:11 #solutions_imported:11 #lin_moves:19'523 #lin_evals:85'303 #gen_moves:32 #gen_evals:0 #comp_moves:10 #backtracks:11 #weight_updates:10'479)
#28      0.55s best:1340  next:[288,1339] violation_ls(batch:12 #solutions_imported:12 #lin_moves:19'532 #lin_evals:85'351 #gen_moves:32 #gen_evals:0 #comp_moves:10 #backtracks:11 #weight_updates:10'484)
#29      0.55s best:1339  next:[288,1338] violation_ls(batch:13 #solutions_imported:13 #lin_moves:5'334 #lin_evals:54'774 #gen_moves:13'354 #gen_evals:735 #comp_moves:1'015 #backtracks:6'162 #weight_updates:5'351)
#30      0.56s best:1338  next:[288,1337] violation_ls(batch:13 #solutions_imported:13 #lin_moves:19'532 #lin_evals:85'395 #gen_moves:51 #gen_evals:0 #comp_moves:13 #backtracks:19 #weight_updates:10'484)
#Bound   0.56s best:1338  next:[317,1337] objective_lb_search_no_lp
#31      0.56s best:1337  next:[317,1336] violation_ls(batch:14 #solutions_imported:14 #lin_moves:5'334 #lin_evals:55'203 #gen_moves:13'528 #gen_evals:740 #comp_moves:1'023 #backtracks:6'245 #weight_updates:5'353)
#Bound   0.56s best:1337  next:[323,1336] objective_lb_search_no_lp
#Bound   0.57s best:1337  next:[337,1336] objective_lb_search_no_lp
#32      0.58s best:1319  next:[337,1318] quick_restart_no_lp (fixed_bools=0/258)
#33      0.59s best:1277  next:[337,1276] quick_restart_no_lp (fixed_bools=0/262)
#Bound   0.59s best:1277  next:[341,1276] objective_lb_search_no_lp
#34      0.60s best:1276  next:[341,1275] quick_restart_no_lp (fixed_bools=0/264)
#Bound   0.61s best:1276  next:[370,1275] objective_lb_search_no_lp
#35      0.61s best:1255  next:[370,1254] quick_restart_no_lp (fixed_bools=0/272)
#36      0.61s best:1254  next:[370,1253] violation_ls(batch:4 #solutions_imported:4 #lin_moves:5'013 #lin_evals:66'443 #gen_moves:18'835 #gen_evals:1'594 #comp_moves:1'552 #backtracks:8'638 #weight_updates:5'171)
#37      0.61s best:1253  next:[370,1252] violation_ls(batch:5 #solutions_imported:5 #lin_moves:5'014 #lin_evals:66'452 #gen_moves:18'835 #gen_evals:1'594 #comp_moves:1'552 #backtracks:8'638 #weight_updates:5'171)
#38      0.61s best:1252  next:[370,1251] violation_ls(batch:6 #solutions_imported:6 #lin_moves:5'014 #lin_evals:66'528 #gen_moves:18'874 #gen_evals:1'596 #comp_moves:1'553 #backtracks:8'657 #weight_updates:5'171)
#39      0.61s best:1251  next:[370,1250] violation_ls(batch:7 #solutions_imported:7 #lin_moves:5'015 #lin_evals:66'534 #gen_moves:18'874 #gen_evals:1'596 #comp_moves:1'553 #backtracks:8'657 #weight_updates:5'171)
#Bound   0.63s best:1251  next:[374,1250] objective_lb_search_no_lp
#40      0.67s best:1250  next:[374,1249] violation_ls(batch:8 #solutions_imported:8 #lin_moves:5'016 #lin_evals:66'540 #gen_moves:18'874 #gen_evals:1'596 #comp_moves:1'553 #backtracks:8'657 #weight_updates:5'171)
#41      0.68s best:1249  next:[374,1248] violation_ls(batch:4 #solutions_imported:4 #lin_moves:9'536 #lin_evals:79'725 #gen_moves:16'616 #gen_evals:1'583 #comp_moves:1'682 #backtracks:7'466 #weight_updates:615)
#42      0.68s best:1248  next:[374,1247] violation_ls(batch:5 #solutions_imported:5 #lin_moves:1 #lin_evals:63'688 #gen_moves:29'073 #gen_evals:1'881 #comp_moves:1'540 #backtracks:13'761 #weight_updates:311)
#43      0.68s best:1247  next:[374,1246] violation_ls(batch:6 #solutions_imported:6 #lin_moves:1 #lin_evals:63'691 #gen_moves:29'074 #gen_evals:1'881 #comp_moves:1'541 #backtracks:13'761 #weight_updates:311)
#44      0.68s best:1246  next:[374,1245] violation_ls(batch:6 #solutions_imported:6 #lin_moves:9'537 #lin_evals:79'752 #gen_moves:16'623 #gen_evals:1'583 #comp_moves:1'683 #backtracks:7'469 #weight_updates:615)
#45      0.68s best:1245  next:[374,1244] violation_ls(batch:7 #solutions_imported:7 #lin_moves:2 #lin_evals:63'700 #gen_moves:29'074 #gen_evals:1'881 #comp_moves:1'541 #backtracks:13'761 #weight_updates:311)
#46      0.68s best:1145  next:[374,1144] violation_ls(batch:9 #solutions_imported:9 #lin_moves:5'017 #lin_evals:66'549 #gen_moves:18'874 #gen_evals:1'596 #comp_moves:1'553 #backtracks:8'657 #weight_updates:5'171)
#47      0.69s best:1144  next:[374,1143] violation_ls(batch:7 #solutions_imported:7 #lin_moves:9'537 #lin_evals:79'801 #gen_moves:16'650 #gen_evals:1'585 #comp_moves:1'686 #backtracks:7'481 #weight_updates:615)
#48      0.69s best:1143  next:[374,1142] violation_ls(batch:8 #solutions_imported:8 #lin_moves:9'537 #lin_evals:79'821 #gen_moves:16'658 #gen_evals:1'585 #comp_moves:1'688 #backtracks:7'484 #weight_updates:615)
#49      0.69s best:1142  next:[374,1141] violation_ls(batch:10 #solutions_imported:10 #lin_moves:5'017 #lin_evals:66'592 #gen_moves:18'895 #gen_evals:1'596 #comp_moves:1'556 #backtracks:8'666 #weight_updates:5'171)
#50      0.69s best:1141  next:[374,1140] violation_ls(batch:10 #solutions_imported:10 #lin_moves:110 #lin_evals:64'143 #gen_moves:29'074 #gen_evals:1'881 #comp_moves:1'541 #backtracks:13'761 #weight_updates:353)
#51      0.69s best:1140  next:[374,1139] violation_ls(batch:11 #solutions_imported:11 #lin_moves:110 #lin_evals:64'218 #gen_moves:29'115 #gen_evals:1'883 #comp_moves:1'544 #backtracks:13'780 #weight_updates:353)
#52      0.70s best:1139  next:[374,1138] violation_ls(batch:11 #solutions_imported:11 #lin_moves:9'596 #lin_evals:80'158 #gen_moves:16'698 #gen_evals:1'587 #comp_moves:1'690 #backtracks:7'503 #weight_updates:645)
#53      0.70s best:1138  next:[374,1137] violation_ls(batch:12 #solutions_imported:12 #lin_moves:9'596 #lin_evals:80'164 #gen_moves:16'701 #gen_evals:1'587 #comp_moves:1'693 #backtracks:7'503 #weight_updates:645)
#54      0.70s best:1137  next:[374,1136] violation_ls(batch:13 #solutions_imported:13 #lin_moves:5'095 #lin_evals:66'934 #gen_moves:18'903 #gen_evals:1'596 #comp_moves:1'558 #backtracks:8'669 #weight_updates:5'201)
#55      0.70s best:1136  next:[374,1135] violation_ls(batch:13 #solutions_imported:13 #lin_moves:119 #lin_evals:64'311 #gen_moves:29'142 #gen_evals:1'885 #comp_moves:1'547 #backtracks:13'792 #weight_updates:360)
#56      0.71s best:1135  next:[374,1134] violation_ls(batch:14 #solutions_imported:14 #lin_moves:9'596 #lin_evals:80'238 #gen_moves:16'737 #gen_evals:1'587 #comp_moves:1'697 #backtracks:7'519 #weight_updates:645)
#57      0.71s best:1134  next:[374,1133] violation_ls(batch:14 #solutions_imported:14 #lin_moves:132 #lin_evals:64'381 #gen_moves:29'142 #gen_evals:1'885 #comp_moves:1'547 #backtracks:13'792 #weight_updates:371)
#58      0.71s best:1133  next:[374,1132] violation_ls(batch:15 #solutions_imported:15 #lin_moves:9'614 #lin_evals:80'314 #gen_moves:16'737 #gen_evals:1'587 #comp_moves:1'697 #backtracks:7'519 #weight_updates:654)
#59      0.71s best:1132  next:[374,1131] violation_ls(batch:15 #solutions_imported:15 #lin_moves:19'591 #lin_evals:108'311 #gen_moves:10'457 #gen_evals:653 #comp_moves:359 #backtracks:5'046 #weight_updates:10'630)
#60      0.71s best:1131  next:[374,1130] violation_ls(batch:15 #solutions_imported:15 #lin_moves:5'095 #lin_evals:66'955 #gen_moves:18'913 #gen_evals:1'596 #comp_moves:1'562 #backtracks:8'672 #weight_updates:5'201)
#61      0.71s best:1130  next:[374,1129] violation_ls(batch:15 #solutions_imported:15 #lin_moves:163 #lin_evals:64'526 #gen_moves:29'142 #gen_evals:1'885 #comp_moves:1'547 #backtracks:13'792 #weight_updates:387)
#62      0.72s best:1129  next:[374,1128] violation_ls(batch:16 #solutions_imported:16 #lin_moves:9'646 #lin_evals:80'488 #gen_moves:16'737 #gen_evals:1'587 #comp_moves:1'697 #backtracks:7'519 #weight_updates:685)
#63      0.72s best:1128  next:[374,1127] violation_ls(batch:16 #solutions_imported:16 #lin_moves:19'591 #lin_evals:108'339 #gen_moves:10'472 #gen_evals:653 #comp_moves:362 #backtracks:5'052 #weight_updates:10'630)
#64      0.72s best:1127  next:[374,1126] violation_ls(batch:16 #solutions_imported:16 #lin_moves:5'109 #lin_evals:67'023 #gen_moves:18'913 #gen_evals:1'596 #comp_moves:1'562 #backtracks:8'672 #weight_updates:5'208)
#65      0.72s best:1126  next:[374,1125] violation_ls(batch:16 #solutions_imported:16 #lin_moves:424 #lin_evals:65'416 #gen_moves:29'142 #gen_evals:1'885 #comp_moves:1'547 #backtracks:13'792 #weight_updates:455)
#66      0.73s best:1125  next:[374,1124] violation_ls(batch:16 #solutions_imported:16 #lin_moves:14'904 #lin_evals:94'795 #gen_moves:13'528 #gen_evals:740 #comp_moves:1'023 #backtracks:6'245 #weight_updates:5'784)
#67      0.75s best:1120  next:[374,1119] quick_restart_no_lp (fixed_bools=1/290)
#68      0.75s best:1115  next:[374,1114] quick_restart_no_lp (fixed_bools=1/291)
#69      0.77s best:1064  next:[374,1063] quick_restart_no_lp (fixed_bools=1/293)
#Bound   0.86s best:1064  next:[429,1063] objective_lb_search_no_lp
#Bound   1.02s best:1064  next:[457,1063] objective_lb_search_no_lp
#Bound   1.24s best:1064  next:[461,1063] objective_lb_search_no_lp
#70      1.44s best:1063  next:[461,1062] rnd_cst_lns (d=0.97 s=283 t=0.10 p=1.00 stall=2 h=auto_l0)
#71      1.44s best:1062  next:[461,1061] violation_ls(batch:19 #solutions_imported:18 #lin_moves:9'646 #lin_evals:120'435 #gen_moves:32'722 #gen_evals:3'224 #comp_moves:2'899 #backtracks:14'906 #weight_updates:776)
#72      1.44s best:1061  next:[461,1060] violation_ls(batch:19 #solutions_imported:18 #lin_moves:30'725 #lin_evals:165'119 #gen_moves:10'472 #gen_evals:653 #comp_moves:362 #backtracks:5'052 #weight_updates:19'527)
#73      1.44s best:1060  next:[461,1059] violation_ls(batch:19 #solutions_imported:18 #lin_moves:24'526 #lin_evals:159'160 #gen_moves:18'916 #gen_evals:1'596 #comp_moves:1'565 #backtracks:8'672 #weight_updates:5'791)
#74      1.44s best:1059  next:[461,1058] violation_ls(batch:19 #solutions_imported:18 #lin_moves:19'740 #lin_evals:167'550 #gen_moves:29'142 #gen_evals:1'885 #comp_moves:1'547 #backtracks:13'792 #weight_updates:1'142)
#75      1.44s best:1058  next:[461,1057] violation_ls(batch:19 #solutions_imported:18 #lin_moves:14'913 #lin_evals:139'282 #gen_moves:34'060 #gen_evals:1'815 #comp_moves:1'509 #backtracks:16'262 #weight_updates:5'967)
#Bound   1.46s best:1058  next:[478,1057] objective_lb_search
#76      1.46s best:957   next:[478,956]  quick_restart_no_lp (fixed_bools=3/339)
#77      1.51s best:918   next:[478,917]  quick_restart_no_lp (fixed_bools=3/355)
#78      1.61s best:917   next:[478,916]  quick_restart_no_lp (fixed_bools=3/355)
#Bound   1.77s best:917   next:[480,916]  objective_lb_search_no_lp
#79      1.88s best:912   next:[480,911]  quick_restart_no_lp (fixed_bools=3/372)
#80      1.91s best:909   next:[480,908]  quick_restart_no_lp (fixed_bools=4/376)
#81      1.91s best:908   next:[480,907]  violation_ls(batch:20 #solutions_imported:19 #lin_moves:9'648 #lin_evals:120'452 #gen_moves:32'722 #gen_evals:3'224 #comp_moves:2'899 #backtracks:14'906 #weight_updates:777)
#82      1.91s best:907   next:[480,906]  violation_ls(batch:20 #solutions_imported:19 #lin_moves:30'725 #lin_evals:165'123 #gen_moves:10'473 #gen_evals:653 #comp_moves:363 #backtracks:5'052 #weight_updates:19'527)
#83      1.91s best:906   next:[480,905]  violation_ls(batch:20 #solutions_imported:19 #lin_moves:24'528 #lin_evals:159'178 #gen_moves:18'916 #gen_evals:1'596 #comp_moves:1'565 #backtracks:8'672 #weight_updates:5'792)
#84      1.91s best:905   next:[480,904]  violation_ls(batch:20 #solutions_imported:19 #lin_moves:19'740 #lin_evals:167'555 #gen_moves:29'144 #gen_evals:1'885 #comp_moves:1'549 #backtracks:13'792 #weight_updates:1'142)
#85      1.91s best:904   next:[480,903]  violation_ls(batch:20 #solutions_imported:19 #lin_moves:14'913 #lin_evals:139'286 #gen_moves:34'061 #gen_evals:1'815 #comp_moves:1'510 #backtracks:16'262 #weight_updates:5'967)
#Bound   1.92s best:904   next:[481,903]  objective_lb_search_no_lp
#86      1.95s best:903   next:[481,902]  quick_restart_no_lp (fixed_bools=5/384)
#87      1.97s best:901   next:[481,900]  quick_restart_no_lp (fixed_bools=5/387)
#88      1.97s best:898   next:[481,897]  quick_restart_no_lp (fixed_bools=5/388)
#89      1.99s best:888   next:[481,887]  quick_restart_no_lp (fixed_bools=5/390)
#90      2.05s best:886   next:[481,885]  violation_ls(batch:21 #solutions_imported:20 #lin_moves:9'649 #lin_evals:120'461 #gen_moves:32'722 #gen_evals:3'224 #comp_moves:2'899 #backtracks:14'906 #weight_updates:777)
#91      2.05s best:885   next:[481,884]  violation_ls(batch:21 #solutions_imported:20 #lin_moves:30'726 #lin_evals:165'132 #gen_moves:10'473 #gen_evals:653 #comp_moves:363 #backtracks:5'052 #weight_updates:19'527)
#Bound   2.09s best:885   next:[510,884]  objective_lb_search
#Bound   2.76s best:885   next:[511,884]  objective_shaving_search_no_lp (vars=253 csts=2175)
#Bound   3.50s best:885   next:[571,884]  objective_lb_search
#92      4.36s best:879   next:[571,878]  rnd_var_lns (d=1.00 s=401 t=0.10 p=0.89 stall=1 h=auto_l0)
#Bound   5.59s best:879   next:[572,878]  objective_shaving_search_no_lp (vars=253 csts=2175)
#Bound   7.31s best:879   next:[573,878]  objective_shaving_search_no_lp (vars=253 csts=2175)
#Bound   7.48s best:879   next:[574,878]  objective_lb_search_no_lp
#Bound   7.48s best:879   next:[575,878]  objective_lb_search_no_lp
#Bound   9.72s best:879   next:[577,878]  objective_lb_search
#Bound  10.11s best:879   next:[579,878]  objective_lb_search_no_lp
#Bound  10.42s best:879   next:[585,878]  objective_lb_search_no_lp
#Bound  10.79s best:879   next:[588,878]  objective_lb_search_no_lp
#Bound  11.93s best:879   next:[589,878]  objective_lb_search_no_lp
#Bound  13.21s best:879   next:[590,878]  objective_lb_search_no_lp
#Bound  14.79s best:879   next:[591,878]  objective_lb_search_no_lp
#Bound  16.16s best:879   next:[592,878]  objective_lb_search
#Model  17.33s var:235/236 constraints:2198/2438
#Bound  17.93s best:879   next:[596,878]  objective_lb_search
#Bound  18.18s best:879   next:[600,878]  objective_lb_search
#Bound  18.36s best:879   next:[601,878]  objective_lb_search
#Bound  18.56s best:879   next:[603,878]  objective_lb_search
#Bound  19.11s best:879   next:[604,878]  objective_lb_search
#Bound  19.90s best:879   next:[605,878]  objective_lb_search
#Bound  21.08s best:879   next:[607,878]  objective_lb_search
#Bound  21.37s best:879   next:[612,878]  objective_lb_search_no_lp
#Bound  22.73s best:879   next:[613,878]  objective_lb_search
#Bound  23.86s best:879   next:[614,878]  objective_lb_search_no_lp
#Bound  24.02s best:879   next:[620,878]  objective_lb_search_max_lp
#Bound  24.56s best:879   next:[624,878]  objective_lb_search_no_lp [skipped_logs=1]
#Bound  25.68s best:879   next:[632,878]  objective_lb_search_max_lp [skipped_logs=0]
#Bound  28.32s best:879   next:[633,878]  objective_shaving_search_no_lp (vars=249 csts=2159)
#Bound  29.52s best:879   next:[634,878]  objective_lb_search
#Bound  29.65s best:879   next:[635,878]  objective_lb_search_no_lp
#Bound  30.35s best:879   next:[637,878]  objective_lb_search_no_lp
#Bound  31.42s best:879   next:[638,878]  objective_lb_search_no_lp
#Bound  32.88s best:879   next:[639,878]  objective_lb_search_no_lp
#Bound  34.41s best:879   next:[641,878]  objective_lb_search
#Bound  35.21s best:879   next:[642,878]  objective_lb_search_no_lp
#Model  35.23s var:234/236 constraints:2138/2438
#Bound  36.31s best:879   next:[644,878]  objective_lb_search_no_lp
#Bound  36.95s best:879   next:[646,878]  objective_lb_search_no_lp
#Bound  37.15s best:879   next:[647,878]  objective_lb_search_no_lp
#Bound  37.71s best:879   next:[654,878]  objective_lb_search_no_lp [skipped_logs=0]
#Bound  38.98s best:879   next:[657,878]  objective_lb_search_no_lp [skipped_logs=1]
#Bound  39.54s best:879   next:[659,878]  objective_lb_search_no_lp [skipped_logs=0]
#Bound  40.23s best:879   next:[663,878]  objective_lb_search_no_lp [skipped_logs=0]
#Bound  41.78s best:879   next:[669,878]  objective_lb_search_no_lp [skipped_logs=1]
#Bound  43.45s best:879   next:[670,878]  objective_lb_search_no_lp
#Bound  43.67s best:879   next:[676,878]  objective_lb_search_no_lp [skipped_logs=1]
#Bound  45.28s best:879   next:[677,878]  objective_lb_search_no_lp
#Bound  45.89s best:879   next:[679,878]  objective_lb_search_no_lp [skipped_logs=1]
#Bound  47.81s best:879   next:[680,878]  objective_lb_search_no_lp
#Bound  48.24s best:879   next:[681,878]  objective_lb_search
#Bound  49.50s best:879   next:[685,878]  objective_lb_search_no_lp
#Bound  51.11s best:879   next:[689,878]  objective_lb_search_no_lp
#Bound  51.63s best:879   next:[692,878]  objective_lb_search_no_lp
#Bound  52.87s best:879   next:[693,878]  objective_lb_search_no_lp
#Bound  55.27s best:879   next:[694,878]  lb_tree_search (nodes=2081/3003 rc=28 decisions=25803 @root=33 restarts=10) 
#Bound  55.98s best:879   next:[695,878]  objective_lb_search_no_lp
#Bound  56.78s best:879   next:[696,878]  lb_tree_search (nodes=2061/3039 rc=29 decisions=26286 @root=35 restarts=10) 
#Bound  57.02s best:879   next:[697,878]  objective_lb_search_no_lp
#Model  57.10s var:233/236 constraints:2116/2438
#Bound  58.24s best:879   next:[698,878]  objective_lb_search_max_lp
#Bound  58.69s best:879   next:[699,878]  objective_lb_search_no_lp
#Bound  59.04s best:879   next:[703,878]  objective_lb_search_max_lp
#Bound  60.45s best:879   next:[711,878]  objective_lb_search_no_lp
#Model  60.90s var:231/236 constraints:2078/2438
#Bound  61.48s best:879   next:[714,878]  objective_lb_search_no_lp
#Bound  62.23s best:879   next:[727,878]  objective_lb_search_no_lp
#Model  63.62s var:230/236 constraints:2024/2438
#Model  63.70s var:226/236 constraints:1835/2438
#Bound  63.76s best:879   next:[728,878]  lb_tree_search (nodes=1200/3424 rc=41 decisions=29645 @root=40 restarts=10) 
#Model  64.06s var:225/236 constraints:1795/2438
#Model  64.23s var:224/236 constraints:1745/2438
#Bound  64.60s best:879   next:[730,878]  objective_lb_search_max_lp
#Model  64.68s var:222/236 constraints:1692/2438
#Model  64.87s var:221/236 constraints:1600/2438
#Bound  64.79s best:879   next:[777,878]  objective_lb_search [skipped_logs=0]
#Model  65.02s var:219/236 constraints:1547/2438
#Model  65.02s var:217/236 constraints:1412/2438
#Model  65.03s var:214/236 constraints:1340/2438
#Model  65.03s var:212/236 constraints:1264/2438
#Model  65.06s var:206/236 constraints:1015/2438
#Model  65.07s var:203/236 constraints:892/2438
#Done   65.07s no_lp
#Done   65.07s core

Task timing                                  n [     min,      max]      avg      dev     time         n [     min,      max]      avg      dev    dtime
                             'core':         1 [   1.08m,    1.08m]    1.08m   0.00ns    1.08m         1 [  51.88s,   51.88s]   51.88s   0.00ns   51.88s
                       'default_lp':         1 [   1.08m,    1.08m]    1.08m   0.00ns    1.08m         1 [  10.78s,   10.78s]   10.78s   0.00ns   10.78s
                 'feasibility_pump':       266 [ 19.81ms, 584.98ms] 172.09ms  72.50ms   45.78s       265 [  4.00ms,  27.64ms]  13.56ms   1.08ms    3.59s
                  'fj_long_default':         1 [ 73.28ms,  73.28ms]  73.28ms   0.00ns  73.28ms         1 [ 23.42ms,  23.42ms]  23.42ms   0.00ns  23.42ms
                  'fj_long_default':         1 [208.50ms, 208.50ms] 208.50ms   0.00ns 208.50ms         1 [ 54.62ms,  54.62ms]  54.62ms   0.00ns  54.62ms
              'fj_long_lin_default':         1 [124.69ms, 124.69ms] 124.69ms   0.00ns 124.69ms         1 [ 74.49ms,  74.49ms]  74.49ms   0.00ns  74.49ms
              'fj_long_lin_perturb':         1 [ 90.75ms,  90.75ms]  90.75ms   0.00ns  90.75ms         1 [ 39.50ms,  39.50ms]  39.50ms   0.00ns  39.50ms
               'fj_long_lin_random':         1 [132.08ms, 132.08ms] 132.08ms   0.00ns 132.08ms         1 [ 69.69ms,  69.69ms]  69.69ms   0.00ns  69.69ms
                  'fj_long_perturb':         1 [144.01ms, 144.01ms] 144.01ms   0.00ns 144.01ms         1 [ 72.25ms,  72.25ms]  72.25ms   0.00ns  72.25ms
                   'fj_long_random':         1 [ 96.63ms,  96.63ms]  96.63ms   0.00ns  96.63ms         1 [ 34.86ms,  34.86ms]  34.86ms   0.00ns  34.86ms
                 'fj_short_default':         1 [114.51ms, 114.51ms] 114.51ms   0.00ns 114.51ms         1 [ 71.95ms,  71.95ms]  71.95ms   0.00ns  71.95ms
                 'fj_short_default':         1 [210.69ms, 210.69ms] 210.69ms   0.00ns 210.69ms         1 [ 83.91ms,  83.91ms]  83.91ms   0.00ns  83.91ms
             'fj_short_lin_default':         1 [130.73ms, 130.73ms] 130.73ms   0.00ns 130.73ms         1 [ 71.69ms,  71.69ms]  71.69ms   0.00ns  71.69ms
             'fj_short_lin_default':         1 [143.41ms, 143.41ms] 143.41ms   0.00ns 143.41ms         1 [ 73.21ms,  73.21ms]  73.21ms   0.00ns  73.21ms
             'fj_short_lin_perturb':         1 [155.85ms, 155.85ms] 155.85ms   0.00ns 155.85ms         1 [ 54.51ms,  54.51ms]  54.51ms   0.00ns  54.51ms
              'fj_short_lin_random':         1 [117.64ms, 117.64ms] 117.64ms   0.00ns 117.64ms         1 [ 71.68ms,  71.68ms]  71.68ms   0.00ns  71.68ms
                 'fj_short_perturb':         1 [173.63ms, 173.63ms] 173.63ms   0.00ns 173.63ms         1 [ 70.57ms,  70.57ms]  70.57ms   0.00ns  70.57ms
                  'fj_short_random':         1 [129.33ms, 129.33ms] 129.33ms   0.00ns 129.33ms         1 [ 72.74ms,  72.74ms]  72.74ms   0.00ns  72.74ms
                        'fs_random':         1 [ 39.29ms,  39.29ms]  39.29ms   0.00ns  39.29ms         1 [ 20.00ns,  20.00ns]  20.00ns   0.00ns  20.00ns
                        'fs_random':         1 [ 43.91ms,  43.91ms]  43.91ms   0.00ns  43.91ms         1 [ 20.00ns,  20.00ns]  20.00ns   0.00ns  20.00ns
                        'fs_random':         1 [ 45.22ms,  45.22ms]  45.22ms   0.00ns  45.22ms         1 [ 20.00ns,  20.00ns]  20.00ns   0.00ns  20.00ns
                        'fs_random':         1 [ 46.08ms,  46.08ms]  46.08ms   0.00ns  46.08ms         1 [ 20.00ns,  20.00ns]  20.00ns   0.00ns  20.00ns
                  'fs_random_no_lp':         1 [ 37.08ms,  37.08ms]  37.08ms   0.00ns  37.08ms         1 [111.63us, 111.63us] 111.63us   0.00ns 111.63us
                  'fs_random_no_lp':         1 [ 39.74ms,  39.74ms]  39.74ms   0.00ns  39.74ms         1 [286.42us, 286.42us] 286.42us   0.00ns 286.42us
                  'fs_random_no_lp':         1 [ 40.81ms,  40.81ms]  40.81ms   0.00ns  40.81ms         1 [107.65us, 107.65us] 107.65us   0.00ns 107.65us
                  'fs_random_no_lp':         1 [ 44.78ms,  44.78ms]  44.78ms   0.00ns  44.78ms         1 [308.21us, 308.21us] 308.21us   0.00ns 308.21us
          'fs_random_quick_restart':         1 [ 40.27ms,  40.27ms]  40.27ms   0.00ns  40.27ms         1 [ 20.00ns,  20.00ns]  20.00ns   0.00ns  20.00ns
          'fs_random_quick_restart':         1 [ 42.59ms,  42.59ms]  42.59ms   0.00ns  42.59ms         1 [ 20.00ns,  20.00ns]  20.00ns   0.00ns  20.00ns
          'fs_random_quick_restart':         1 [ 43.63ms,  43.63ms]  43.63ms   0.00ns  43.63ms         1 [ 20.00ns,  20.00ns]  20.00ns   0.00ns  20.00ns
          'fs_random_quick_restart':         1 [ 43.75ms,  43.75ms]  43.75ms   0.00ns  43.75ms         1 [ 20.00ns,  20.00ns]  20.00ns   0.00ns  20.00ns
    'fs_random_quick_restart_no_lp':         1 [ 38.11ms,  38.11ms]  38.11ms   0.00ns  38.11ms         1 [202.68us, 202.68us] 202.68us   0.00ns 202.68us
    'fs_random_quick_restart_no_lp':         1 [ 38.98ms,  38.98ms]  38.98ms   0.00ns  38.98ms         1 [118.76us, 118.76us] 118.76us   0.00ns 118.76us
    'fs_random_quick_restart_no_lp':         1 [ 39.44ms,  39.44ms]  39.44ms   0.00ns  39.44ms         1 [135.06us, 135.06us] 135.06us   0.00ns 135.06us
                    'graph_arc_lns':       265 [  4.28ms,    3.58s]    1.08s 759.29ms    4.76m       261 [ 10.00ns, 108.47ms]  65.18ms  41.12ms   17.01s
                    'graph_cst_lns':       265 [  1.86ms,    3.83s] 795.82ms 793.53ms    3.51m       196 [ 10.00ns, 106.28ms]  64.18ms  40.78ms   12.58s
                    'graph_dec_lns':       265 [  4.80ms,    3.79s]    1.05s 785.39ms    4.66m       257 [ 10.00ns, 181.72ms]  63.03ms  44.45ms   16.20s
                    'graph_var_lns':       265 [  3.37ms,    3.08s] 975.33ms 644.49ms    4.31m       260 [ 10.00ns, 147.23ms]  64.27ms  42.43ms   16.71s
                   'lb_tree_search':         1 [   1.08m,    1.08m]    1.08m   0.00ns    1.08m         1 [  18.54s,   18.54s]   18.54s   0.00ns   18.54s
                           'max_lp':         1 [   1.08m,    1.08m]    1.08m   0.00ns    1.08m         1 [  12.22s,   12.22s]   12.22s   0.00ns   12.22s
                            'no_lp':         1 [   1.08m,    1.08m]    1.08m   0.00ns    1.08m         1 [   8.56s,    8.56s]    8.56s   0.00ns    8.56s
              'objective_lb_search':         1 [   1.08m,    1.08m]    1.08m   0.00ns    1.08m         1 [  10.52s,   10.52s]   10.52s   0.00ns   10.52s
       'objective_lb_search_max_lp':         1 [   1.08m,    1.08m]    1.08m   0.00ns    1.08m         1 [  14.37s,   14.37s]   14.37s   0.00ns   14.37s
        'objective_lb_search_no_lp':         1 [   1.08m,    1.08m]    1.08m   0.00ns    1.08m         1 [   5.11s,    5.11s]    5.11s   0.00ns    5.11s
  'objective_shaving_search_max_lp':        85 [  7.14ms,    2.63s] 757.29ms 624.61ms    1.07m        72 [902.67us, 369.96ms]  66.71ms  77.61ms    4.80s
   'objective_shaving_search_no_lp':        81 [ 13.44ms,    2.63s] 796.64ms 616.61ms    1.08m        73 [923.78us, 235.58ms]  45.50ms  51.22ms    3.32s
                          'probing':         1 [   1.08m,    1.08m]    1.08m   0.00ns    1.08m         1 [   3.45s,    3.45s]    3.45s   0.00ns    3.45s
                   'probing_max_lp':         1 [   1.08m,    1.08m]    1.08m   0.00ns    1.08m         1 [   3.64s,    3.64s]    3.64s   0.00ns    3.64s
                     'pseudo_costs':         1 [   1.08m,    1.08m]    1.08m   0.00ns    1.08m         1 [  10.82s,   10.82s]   10.82s   0.00ns   10.82s
                    'quick_restart':         1 [   1.08m,    1.08m]    1.08m   0.00ns    1.08m         1 [  11.11s,   11.11s]   11.11s   0.00ns   11.11s
              'quick_restart_no_lp':         1 [   1.08m,    1.08m]    1.08m   0.00ns    1.08m         1 [   7.56s,    7.56s]    7.56s   0.00ns    7.56s
                    'reduced_costs':         1 [   1.08m,    1.08m]    1.08m   0.00ns    1.08m         1 [  11.91s,   11.91s]   11.91s   0.00ns   11.91s
                        'rins/rens':       266 [163.25us,    2.93s] 897.71ms 745.02ms    3.98m       225 [ 10.00ns, 200.04ms]  70.30ms  40.92ms   15.82s
                      'rnd_cst_lns':       265 [  1.88ms,    3.98s]    1.01s 759.80ms    4.46m       247 [ 10.00ns, 159.41ms]  66.38ms  42.24ms   16.40s
                      'rnd_var_lns':       266 [584.00ns,    4.02s] 941.67ms 718.63ms    4.17m       255 [ 10.00ns, 216.54ms]  64.16ms  44.28ms   16.36s
                     'violation_ls':       263 [348.68us, 527.50ms] 149.76ms  76.60ms   39.39s       263 [430.00ns,  72.78ms]  57.27ms  14.80ms   15.06s
                     'violation_ls':       264 [275.46us, 728.86ms] 154.59ms  97.64ms   40.81s       264 [430.00ns, 104.10ms]  54.57ms  22.08ms   14.41s
                     'violation_ls':       265 [281.26us, 831.87ms] 169.46ms 104.27ms   44.91s       265 [520.00ns,  92.21ms]  58.96ms  15.80ms   15.62s
                     'violation_ls':       265 [313.10us, 799.68ms] 192.58ms 114.01ms   51.03s       265 [430.00ns,  77.05ms]  59.22ms  15.16ms   15.69s
                     'violation_ls':       266 [370.34us, 672.63ms] 162.00ms  96.97ms   43.09s       266 [860.00ns,  77.85ms]  58.02ms  15.61ms   15.43s

Search stats                        Bools  Conflicts  Branches  Restarts  BoolPropag  IntegerPropag
                           'core':  3'776     30'029    66'199     8'809  40'286'152     18'352'897
                     'default_lp':    482     16'902   102'091    16'706   3'205'658     16'833'510
                      'fs_random':     73          0       146       146          18          2'774
                      'fs_random':     73          0       146       146          18          2'774
                      'fs_random':     73          0       146       146          18          2'774
                      'fs_random':     73          0       146       146          18          2'774
                'fs_random_no_lp':     73          0       168       146          21          3'216
                'fs_random_no_lp':     73          0       168       146          21          3'224
                'fs_random_no_lp':     73          0       180       146          24          4'043
                'fs_random_no_lp':     73          3       195       146          30          4'060
        'fs_random_quick_restart':     73          0       146       146          18          2'774
        'fs_random_quick_restart':     73          0       146       146          18          2'774
        'fs_random_quick_restart':     73          0       146       146          18          2'774
        'fs_random_quick_restart':     73          0       146       146          18          2'774
  'fs_random_quick_restart_no_lp':     73          0       167       146          20          3'304
  'fs_random_quick_restart_no_lp':     73          0       175       146          21          3'252
  'fs_random_quick_restart_no_lp':     73          0       180       146          19          3'622
                 'lb_tree_search':     73        168    83'249    22'063     138'059      4'396'159
                         'max_lp':     73      8'515    96'170    16'541     414'835     12'585'971
                          'no_lp':    951     44'804   101'919     9'769  10'004'167     31'290'702
            'objective_lb_search':    176     12'046    92'266    19'212     644'699     15'187'315
     'objective_lb_search_max_lp':    150      6'707   110'576    23'918     616'372     15'160'845
      'objective_lb_search_no_lp':    254     31'944    73'567     7'635     947'107     22'689'396
                        'probing':    399        215     1'329     1'039      13'143         78'061
                 'probing_max_lp':    399        212       622       622       9'675         54'955
                   'pseudo_costs':     73      7'920    88'933    18'400     373'250     11'357'237
                  'quick_restart':    434      6'602   101'065    19'858   1'865'902     11'309'532
            'quick_restart_no_lp':  2'090     29'441   131'927    11'280  12'453'507     19'036'271
                  'reduced_costs':  1'203     13'761    91'752    10'387   7'916'682     12'814'198

SAT stats                           ClassicMinim  LitRemoved  LitLearned  LitForgotten  Subsumed  MClauses  MDecisions  MLitTrue  MSubsumed  MLitRemoved  MReused
                           'core':        26'940     183'254     205'205         7'402       110     3'710      18'190         0        266          824       68
                     'default_lp':        11'028      27'837     161'317        12'752       671     8'324      73'374         0      2'396       15'668    1'466
                      'fs_random':             0           0           0             0         0         0           0         0          0            0        0
                      'fs_random':             0           0           0             0         0         0           0         0          0            0        0
                      'fs_random':             0           0           0             0         0         0           0         0          0            0        0
                      'fs_random':             0           0           0             0         0         0           0         0          0            0        0
                'fs_random_no_lp':             0           0           0             0         0         0           0         0          0            0        0
                'fs_random_no_lp':             0           0           0             0         0         0           0         0          0            0        0
                'fs_random_no_lp':             0           0           0             0         0         0           0         0          0            0        0
                'fs_random_no_lp':             0           0           8             0         0         0           0         0          0            0        0
        'fs_random_quick_restart':             0           0           0             0         0         0           0         0          0            0        0
        'fs_random_quick_restart':             0           0           0             0         0         0           0         0          0            0        0
        'fs_random_quick_restart':             0           0           0             0         0         0           0         0          0            0        0
        'fs_random_quick_restart':             0           0           0             0         0         0           0         0          0            0        0
  'fs_random_quick_restart_no_lp':             0           0           0             0         0         0           0         0          0            0        0
  'fs_random_quick_restart_no_lp':             0           0           0             0         0         0           0         0          0            0        0
  'fs_random_quick_restart_no_lp':             0           0           0             0         0         0           0         0          0            0        0
                 'lb_tree_search':             8          12         660             0         0     9'167      46'168         0         46          189    1'102
                         'max_lp':         5'162      11'981      80'822             0       484     8'240      82'468         0      1'203        7'808    2'018
                          'no_lp':        36'692     163'634     470'850       159'965       639     5'255      41'517         3      2'710       18'460      645
            'objective_lb_search':         8'964      22'513      88'433             0       463     8'883      70'531         4      1'688       10'101    2'018
     'objective_lb_search_max_lp':         4'996      12'437      47'960             0       297    10'721      93'523         5      1'407        8'063    2'626
      'objective_lb_search_no_lp':        24'594      67'784     240'653        22'069       840     4'030      32'801         9      1'661       10'410      827
                        'probing':             0           0         215             0         0         0           0         0          0            0        0
                 'probing_max_lp':             0           0         212             0         0         0           0         0          0            0        0
                   'pseudo_costs':         5'032      12'185      85'231             0       296     8'073      73'127         0        461        2'915    1'595
                  'quick_restart':         4'336      12'684      69'553             0       309     8'518      75'041         0      1'242        8'219    1'637
            'quick_restart_no_lp':        22'624     102'291     330'051       129'177       445     5'212      44'864        24      2'758       19'370      570
                  'reduced_costs':         9'309      28'746     145'828        29'588       321     5'868      56'640         0      1'776       12'429    1'295

Lp stats                         Component  Iterations  AddedCuts  OPTIMAL  DUAL_F.  DUAL_U.
                  'default_lp':          1     179'060      8'659   21'978        0        0
                   'fs_random':          1           0          0        0        0        0
                   'fs_random':          1           0          0        0        0        0
                   'fs_random':          1           1          0        1        1        0
                   'fs_random':          1          46          0        1        1        0
     'fs_random_quick_restart':          1           0          0        0        0        0
     'fs_random_quick_restart':          1           0          0        0        0        0
     'fs_random_quick_restart':          1           0          0        0        0        0
     'fs_random_quick_restart':          1          65          0        1        1        0
              'lb_tree_search':          1     471'779      7'973   22'169    7'203        0
                      'max_lp':          1     225'688      9'068   13'012    2'914        4
         'objective_lb_search':          1     210'366      6'112   18'353        0        0
  'objective_lb_search_max_lp':          1     245'799      6'409    9'708    2'970        3
                     'probing':          1      36'894      5'820    4'125        0        0
              'probing_max_lp':          1      11'840      6'927    2'192       70        0
                'pseudo_costs':          1     218'372      9'208   13'239    2'985        5
               'quick_restart':          1     193'188      6'418   16'024        1        1
               'reduced_costs':          1     228'138     10'582   19'278    4'660        3

Lp dimension                                                                      Final dimension of first component
                  'default_lp':   562 rows, 231 columns, 2723 entries with magnitude in [2.924463e-04, 1.000000e+00]
                   'fs_random':        0 rows, 231 columns, 0 entries with magnitude in [0.000000e+00, 0.000000e+00]
                   'fs_random':        0 rows, 231 columns, 0 entries with magnitude in [0.000000e+00, 0.000000e+00]
                   'fs_random':     78 rows, 231 columns, 323 entries with magnitude in [9.182431e-02, 1.000000e+00]
                   'fs_random':     78 rows, 231 columns, 323 entries with magnitude in [9.182431e-02, 1.000000e+00]
     'fs_random_quick_restart':        0 rows, 231 columns, 0 entries with magnitude in [0.000000e+00, 0.000000e+00]
     'fs_random_quick_restart':        0 rows, 231 columns, 0 entries with magnitude in [0.000000e+00, 0.000000e+00]
     'fs_random_quick_restart':        0 rows, 231 columns, 0 entries with magnitude in [0.000000e+00, 0.000000e+00]
     'fs_random_quick_restart':     78 rows, 231 columns, 323 entries with magnitude in [9.182431e-02, 1.000000e+00]
              'lb_tree_search':  1062 rows, 236 columns, 3302 entries with magnitude in [2.961008e-03, 1.000000e+00]
                      'max_lp':   801 rows, 236 columns, 3343 entries with magnitude in [1.602296e-03, 1.000000e+00]
         'objective_lb_search':   364 rows, 231 columns, 1645 entries with magnitude in [1.629777e-03, 1.000000e+00]
  'objective_lb_search_max_lp':   798 rows, 236 columns, 2045 entries with magnitude in [3.198431e-03, 1.000000e+00]
                     'probing':   684 rows, 231 columns, 4192 entries with magnitude in [5.880510e-03, 1.000000e+00]
              'probing_max_lp':   428 rows, 236 columns, 2199 entries with magnitude in [7.287996e-04, 1.000000e+00]
                'pseudo_costs':   701 rows, 236 columns, 2722 entries with magnitude in [3.744365e-04, 1.000000e+00]
               'quick_restart':   737 rows, 231 columns, 3353 entries with magnitude in [3.069089e-03, 1.000000e+00]
               'reduced_costs':   506 rows, 236 columns, 2117 entries with magnitude in [2.221546e-03, 1.000000e+00]

Lp debug                         CutPropag  CutEqPropag  Adjust  Overflow        Bad  BadScaling
                  'default_lp':         43          117  13'491         0    170'930           0
                   'fs_random':          0            0       0         0          0           0
                   'fs_random':          0            0       0         0          0           0
                   'fs_random':          0            0       0         0          0           0
                   'fs_random':          0            0       0         0          0           0
     'fs_random_quick_restart':          0            0       0         0          0           0
     'fs_random_quick_restart':          0            0       0         0          0           0
     'fs_random_quick_restart':          0            0       0         0          0           0
     'fs_random_quick_restart':          0            0       0         0          0           0
              'lb_tree_search':         61           20  14'826         0     98'212           0
                      'max_lp':         56           33   6'275         0    119'527           0
         'objective_lb_search':         41           24  10'746         0    172'705           0
  'objective_lb_search_max_lp':         63            9   6'488         0    133'682           0
                     'probing':         39           68   3'874         0  2'243'754           0
              'probing_max_lp':         51           57   2'221         0  1'447'534           0
                'pseudo_costs':         50           44   6'547         0    117'796           0
               'quick_restart':         82           70   9'865         0    369'247           0
               'reduced_costs':         52            8   9'907         0    114'293           0

Lp pool                          Constraints  Updates  Simplif  Merged  Shortened   Split  Strenghtened      Cuts/Call
                  'default_lp':        8'755    1'007  102'123     187      3'557  11'163        12'085   8'659/27'055
                   'fs_random':          283        0        0       0          0       0            35            0/0
                   'fs_random':          283        0        0       0          0       0            35            0/0
                   'fs_random':          283        0        0       0          0       0            35            0/0
                   'fs_random':          283        0        0       0          0       0            35            0/0
     'fs_random_quick_restart':          283        0        0       0          0       0            35            0/0
     'fs_random_quick_restart':          283        0        0       0          0       0            35            0/0
     'fs_random_quick_restart':          283        0        0       0          0       0            35            0/0
     'fs_random_quick_restart':          283        0        0       0          0       0            35            0/0
              'lb_tree_search':       10'328      890  106'777      82      9'548   2'660        57'212   7'973/23'306
                      'max_lp':       11'445      795   84'867      60      3'538   4'014        47'010   9'068/22'819
         'objective_lb_search':        6'361      940   77'434      34      4'939   7'418        11'901   6'112/19'392
  'objective_lb_search_max_lp':        8'826      807  110'831      20     10'475   3'274        61'346   6'409/16'434
                     'probing':        6'091      943   49'575      12        849  14'253         5'037   5'820/12'344
              'probing_max_lp':        9'342      949   48'846      22      4'094   9'728        28'334   6'927/15'505
                'pseudo_costs':       11'545      826   85'338     100      1'801   4'559        45'789   9'208/23'733
               'quick_restart':        6'681    1'322   99'577      20      5'813  30'190        16'221   6'418/20'297
               'reduced_costs':       11'833      684   71'085     186      5'775   4'423        46'617  10'582/26'932

Lp Cut            defaul  max_lp  quick_  reduce  pseudo  lb_tre  probin  object  probin  object
          CG_FF:     555     366     229     651     478     378     239     439     280     224
           CG_K:     270     223      99     369     211     189      82     136     139      85
           CG_R:     314     241     149     546     329     244      82     171     168      95
          CG_RB:   1'368   1'495   1'048   2'016   1'267   1'571     753   1'233     893     911
         CG_RBP:     153     153      79     279     141     200      72     142      74      66
         Clique:       -      54       -      58      66      65       -       -      39      67
             IB:     918     476     738     734     640     567     790     635     251     510
       MIR_1_FF:     509     475     349     497     461     377     343     446     258     305
        MIR_1_K:      64      53      26     106      84      51      26      46      28      39
       MIR_1_KL:       7       1       4       1       -       4       8       -       -       -
        MIR_1_R:      83      42      74      80      46      34      34      72      35      39
       MIR_1_RB:     684   1'083     540     917     960     806     411     438     437     739
      MIR_1_RBP:      35     152      27     160     141     119      21      26      75      97
      MIR_1_RLT:       -       2       -       3       8       3       -       -       2       1
       MIR_2_FF:     271     285     209     301     306     249     180     215     138     186
        MIR_2_K:      58      71      26      72      64      51      24      32      19      37
       MIR_2_KL:       8       3       8       3       2       1      10       4       -       1
        MIR_2_R:     100     141      69     112     104      90      66      78      65     102
       MIR_2_RB:     470     554     437     595     579     385     329     283     203     364
      MIR_2_RBP:      35      79      26      83      83      46      32      24      40      45
       MIR_3_FF:     151     168     121     183     176     186     106     104      82     117
        MIR_3_K:      42      42      28      58      58      58      18      16      25      45
       MIR_3_KL:       7       1       1       1       2       2       4       2       -       2
        MIR_3_R:      70     106      78      91      94      77      59      59      50      72
       MIR_3_RB:     273     311     271     303     340     264     244     183     140     200
      MIR_3_RBP:      15      42      16      45      34      39      17      10      22      29
       MIR_4_FF:     112      76      66     130     100      92      70      63      35      74
        MIR_4_K:      39      31      14      41      29      40      11      17      20      16
       MIR_4_KL:       6       -       4       1       2       -       2       2       -       1
        MIR_4_R:      59      66      48      73      82      51      35      46      30      50
       MIR_4_RB:     189     166     164     195     181     125     163     112      62     111
      MIR_4_RBP:      17      28       9      39      14      16      17       6       7      17
       MIR_5_FF:      64      45      46      69      51      48      33      63      12      27
        MIR_5_K:      25      24       7      24      19      23      12      13       9      15
       MIR_5_KL:       2       -       4       1       1       -       1       3       -       1
        MIR_5_R:      49      28      53      47      41      42      29      43      22      24
       MIR_5_RB:     130      76     114     132     105      88     100      94      34      46
      MIR_5_RBP:      14      22      11      24       8      14       7       9       3       4
       MIR_6_FF:      49      30      36      49      31      39      17      49      11      28
        MIR_6_K:      22      20       8      25      14      18      12      16       6      11
       MIR_6_KL:       4       1       -       1       2       -       -       2       -       -
        MIR_6_R:      37      13      24      31      14      24      23      25       6      16
       MIR_6_RB:      76      46      62      70      51      60      41      51      13      30
      MIR_6_RBP:       5       8       7      12       3      10       5       3       1       2
   ZERO_HALF_FF:      98     110      59     134     113     103      36      52      74      56
    ZERO_HALF_K:      21      23       8      52      26      14      16      14      14      17
    ZERO_HALF_R:     936   1'307     706     819   1'280     816     937     480   2'092   1'142
   ZERO_HALF_RB:     225     287     280     292     318     256     231     136     947     315
  ZERO_HALF_RBP:      20      42      36      57      49      38      72      19      66      28

LNS stats           Improv/Calls  Closed  Difficulty  TimeLimit
  'graph_arc_lns':        15/265     53%        0.99       0.11
  'graph_cst_lns':         3/200     54%        0.99       0.11
  'graph_dec_lns':        18/264     52%        0.99       0.11
  'graph_var_lns':        14/265     52%        0.99       0.11
      'rins/rens':        49/263     51%        0.89       0.10
    'rnd_cst_lns':        11/255     53%        0.99       0.11
    'rnd_var_lns':        23/265     53%        0.99       0.11

LS stats                   Batches  Restarts   LinMoves   GenMoves  CompoundMoves  WeightUpdates
       'fj_long_default':        1         1      3'595          0              0            129
       'fj_long_default':        1         1      9'708          0              0            292
   'fj_long_lin_default':        1         1          0      3'431            465              2
   'fj_long_lin_perturb':        1         1      4'999          0              0            700
    'fj_long_lin_random':        1         1      7'977          0              0          2'023
       'fj_long_perturb':        1         1          0      3'360            455              2
        'fj_long_random':        1         1      5'500          0              0            213
      'fj_short_default':        1         1          0      3'265            344              1
      'fj_short_default':        1         1      8'242          0              0          1'758
  'fj_short_lin_default':        1         1          0      3'391            423              2
  'fj_short_lin_default':        1         1          0      3'620            753              3
  'fj_short_lin_perturb':        1         1      9'655          0              0            345
   'fj_short_lin_random':        1         1          0      3'451            526              2
      'fj_short_perturb':        1         1      9'764          0              0            236
       'fj_short_random':        1         1          0      3'174            303              0
          'violation_ls':      263         0    333'994  1'305'445         68'074         15'594
          'violation_ls':      264         0  1'030'271    683'460         48'659        333'165
          'violation_ls':      265         0  1'072'933    803'550         68'744         58'463
          'violation_ls':      265         0    995'888  1'121'418         23'661         28'932
          'violation_ls':      266         0    986'116    840'334         72'943         24'883

Solutions (92)            Num     Rank
                'no_lp':   11   [1,14]
  'quick_restart_no_lp':   19  [16,89]
          'rnd_cst_lns':    1  [70,70]
          'rnd_var_lns':    2  [15,92]
         'violation_ls':   59  [11,91]

Objective bounds                     Num
                  'initial_domain':    1
                  'lb_tree_search':    3
             'objective_lb_search':   17
      'objective_lb_search_max_lp':    5
       'objective_lb_search_no_lp':   61
  'objective_shaving_search_no_lp':    4

Solution repositories    Added  Queried  Ignored  Synchro
  'feasible solutions':  1'775    5'229        9    1'676
        'lp solutions':    502      120        0      437
                'pump':  5'525      146

Improving bounds shared            Num
                        'core':     96
                  'default_lp':    131
              'lb_tree_search':    150
                      'max_lp':     80
                       'no_lp':     70
         'objective_lb_search':     65
  'objective_lb_search_max_lp':    123
                     'probing':    432
              'probing_max_lp':    176
                'pseudo_costs':     66
               'quick_restart':    127
         'quick_restart_no_lp':  1'603
               'reduced_costs':     85

Clauses shared                   Num
                        'core':    4
                  'default_lp':   27
             'fs_random_no_lp':    1
              'lb_tree_search':   34
                      'max_lp':   18
                       'no_lp':   61
         'objective_lb_search':   22
  'objective_lb_search_max_lp':   55
   'objective_lb_search_no_lp':    4
                'pseudo_costs':    3
               'quick_restart':    4
         'quick_restart_no_lp':   15
               'reduced_costs':    2

CpSolverResponse summary:
status: OPTIMAL
objective: 879
best_bound: 879
integers: 232
booleans: 73
conflicts: 0
branches: 175
propagations: 21
integer_propagations: 3252
restarts: 146
lp_iterations: 0
walltime: 65.14
usertime: 65.14
deterministic_time: 380.442
gap_integral: 1128.07
solution_fingerprint: 0x3f8ef5ceaf68ddaa


--- Simulation Gantt  partir du modle mathmatique ---
{'big':0, 'due_date':83, 'pos_time':5, 'status':0, 'blocked':0, 'operations':["{'type':0, 'processing_time':57}"]}
{'big':1, 'due_date':121, 'pos_time':5, 'status':0, 'blocked':0, 'operations':["{'type':1, 'processing_time':25}"]}
{'big':0, 'due_date':80, 'pos_time':5, 'status':0, 'blocked':0, 'operations':["{'type':1, 'processing_time':45}"]}
{'big':1, 'due_date':159, 'pos_time':5, 'status':0, 'blocked':0, 'operations':["{'type':1, 'processing_time':44}", "{'type':0, 'processing_time':21}"]}
{'big':0, 'due_date':74, 'pos_time':5, 'status':0, 'blocked':0, 'operations':["{'type':1, 'processing_time':18}", "{'type':0, 'processing_time':52}"]}
{'big':1, 'due_date':192, 'pos_time':5, 'status':0, 'blocked':0, 'operations':["{'type':0, 'processing_time':13}", "{'type':1, 'processing_time':43}"]}
{'big':0, 'due_date':130, 'pos_time':5, 'status':0, 'blocked':0, 'operations':["{'type':0, 'processing_time':21}"]}
{'big':1, 'due_date':121, 'pos_time':5, 'status':0, 'blocked':0, 'operations':["{'type':1, 'processing_time':56}"]}
