created virtual environment CPython3.12.4.final.0-64 in 6901ms
  creator CPython3Posix(dest=/localscratch/aneumann.63390906.0/env, clear=False, no_vcs_ignore=False, global=False)
  seeder FromAppData(download=False, pip=bundle, via=copy, app_data_dir=/home/aneumann/.local/share/virtualenv)
    added seed packages: pip==25.1.1
  activators BashActivator,CShellActivator,FishActivator,NushellActivator,PowerShellActivator,PythonActivator
Looking in links: /cvmfs/soft.computecanada.ca/custom/python/wheelhouse/gentoo2023/x86-64-v3, /cvmfs/soft.computecanada.ca/custom/python/wheelhouse/gentoo2023/generic, /cvmfs/soft.computecanada.ca/custom/python/wheelhouse/generic
Requirement already satisfied: pip in /localscratch/aneumann.63390906.0/env/lib/python3.12/site-packages (25.1.1)
Looking in links: /cvmfs/soft.computecanada.ca/custom/python/wheelhouse/gentoo2023/x86-64-v3, /cvmfs/soft.computecanada.ca/custom/python/wheelhouse/gentoo2023/generic, /cvmfs/soft.computecanada.ca/custom/python/wheelhouse/generic
ERROR: protobuf-5.28.3-cp38-abi3-manylinux2014_x86_64.whl is not a supported wheel on this platform.
Looking in links: /cvmfs/soft.computecanada.ca/custom/python/wheelhouse/gentoo2023/x86-64-v3, /cvmfs/soft.computecanada.ca/custom/python/wheelhouse/gentoo2023/generic, /cvmfs/soft.computecanada.ca/custom/python/wheelhouse/generic
Processing /home/aneumann/projects/def-adhaj/aneumann/GNRS/wheels/immutabledict-4.2.0-py3-none-any.whl
Installing collected packages: immutabledict
Successfully installed immutabledict-4.2.0
Looking in links: /cvmfs/soft.computecanada.ca/custom/python/wheelhouse/gentoo2023/x86-64-v3, /cvmfs/soft.computecanada.ca/custom/python/wheelhouse/gentoo2023/generic, /cvmfs/soft.computecanada.ca/custom/python/wheelhouse/generic
Processing /cvmfs/soft.computecanada.ca/custom/python/wheelhouse/generic/ortools-9.10.4067+computecanada-cp312-cp312-linux_x86_64.whl (from -r /home/aneumann/projects/def-adhaj/aneumann/GNRS/requirements/or.txt (line 1))
Processing /cvmfs/soft.computecanada.ca/custom/python/wheelhouse/gentoo2023/x86-64-v3/matplotlib-3.10.0+computecanada-cp312-cp312-linux_x86_64.whl (from -r /home/aneumann/projects/def-adhaj/aneumann/GNRS/requirements/or.txt (line 2))
Processing /cvmfs/soft.computecanada.ca/custom/python/wheelhouse/gentoo2023/x86-64-v3/pandas-2.2.3+computecanada-cp312-cp312-linux_x86_64.whl (from -r /home/aneumann/projects/def-adhaj/aneumann/GNRS/requirements/or.txt (line 3))
Processing /cvmfs/soft.computecanada.ca/custom/python/wheelhouse/generic/absl_py-2.2.2+computecanada-py3-none-any.whl (from ortools<9.11,>=9.10->-r /home/aneumann/projects/def-adhaj/aneumann/GNRS/requirements/or.txt (line 1))
Processing /cvmfs/soft.computecanada.ca/custom/python/wheelhouse/gentoo2023/generic/numpy-2.2.2+computecanada-cp312-cp312-linux_x86_64.whl (from ortools<9.11,>=9.10->-r /home/aneumann/projects/def-adhaj/aneumann/GNRS/requirements/or.txt (line 1))
Processing /cvmfs/soft.computecanada.ca/custom/python/wheelhouse/gentoo2023/x86-64-v3/protobuf-6.30.2+computecanada-cp312-cp312-linux_x86_64.whl (from ortools<9.11,>=9.10->-r /home/aneumann/projects/def-adhaj/aneumann/GNRS/requirements/or.txt (line 1))
Requirement already satisfied: immutabledict>=3.0.0 in /localscratch/aneumann.63390906.0/env/lib/python3.12/site-packages (from ortools<9.11,>=9.10->-r /home/aneumann/projects/def-adhaj/aneumann/GNRS/requirements/or.txt (line 1)) (4.2.0)
Processing /cvmfs/soft.computecanada.ca/custom/python/wheelhouse/gentoo2023/generic/contourpy-1.3.1+computecanada-cp312-cp312-linux_x86_64.whl (from matplotlib->-r /home/aneumann/projects/def-adhaj/aneumann/GNRS/requirements/or.txt (line 2))
Processing /cvmfs/soft.computecanada.ca/custom/python/wheelhouse/generic/cycler-0.12.1+computecanada-py3-none-any.whl (from matplotlib->-r /home/aneumann/projects/def-adhaj/aneumann/GNRS/requirements/or.txt (line 2))
Processing /cvmfs/soft.computecanada.ca/custom/python/wheelhouse/generic/fonttools-4.58.2+computecanada-cp312-cp312-linux_x86_64.whl (from matplotlib->-r /home/aneumann/projects/def-adhaj/aneumann/GNRS/requirements/or.txt (line 2))
Processing /cvmfs/soft.computecanada.ca/custom/python/wheelhouse/gentoo2023/x86-64-v3/kiwisolver-1.4.8+computecanada-cp312-cp312-linux_x86_64.whl (from matplotlib->-r /home/aneumann/projects/def-adhaj/aneumann/GNRS/requirements/or.txt (line 2))
Processing /cvmfs/soft.computecanada.ca/custom/python/wheelhouse/generic/packaging-25.0+computecanada-py3-none-any.whl (from matplotlib->-r /home/aneumann/projects/def-adhaj/aneumann/GNRS/requirements/or.txt (line 2))
Processing /cvmfs/soft.computecanada.ca/custom/python/wheelhouse/gentoo2023/x86-64-v3/pillow-11.1.0+computecanada-cp312-cp312-linux_x86_64.whl (from matplotlib->-r /home/aneumann/projects/def-adhaj/aneumann/GNRS/requirements/or.txt (line 2))
Processing /cvmfs/soft.computecanada.ca/custom/python/wheelhouse/generic/pyparsing-3.2.1+computecanada-py3-none-any.whl (from matplotlib->-r /home/aneumann/projects/def-adhaj/aneumann/GNRS/requirements/or.txt (line 2))
Processing /cvmfs/soft.computecanada.ca/custom/python/wheelhouse/generic/python_dateutil-2.9.0.post0+computecanada-py2.py3-none-any.whl (from matplotlib->-r /home/aneumann/projects/def-adhaj/aneumann/GNRS/requirements/or.txt (line 2))
Processing /cvmfs/soft.computecanada.ca/custom/python/wheelhouse/generic/pytz-2025.2+computecanada-py2.py3-none-any.whl (from pandas->-r /home/aneumann/projects/def-adhaj/aneumann/GNRS/requirements/or.txt (line 3))
Processing /cvmfs/soft.computecanada.ca/custom/python/wheelhouse/generic/tzdata-2025.2+computecanada-py2.py3-none-any.whl (from pandas->-r /home/aneumann/projects/def-adhaj/aneumann/GNRS/requirements/or.txt (line 3))
Processing /cvmfs/soft.computecanada.ca/custom/python/wheelhouse/generic/six-1.17.0+computecanada-py2.py3-none-any.whl (from python-dateutil>=2.7->matplotlib->-r /home/aneumann/projects/def-adhaj/aneumann/GNRS/requirements/or.txt (line 2))
Installing collected packages: pytz, tzdata, six, pyparsing, protobuf, pillow, packaging, numpy, kiwisolver, fonttools, cycler, absl-py, python-dateutil, contourpy, pandas, matplotlib, ortools

Successfully installed absl-py-2.2.2+computecanada contourpy-1.3.1+computecanada cycler-0.12.1+computecanada fonttools-4.58.2+computecanada kiwisolver-1.4.8+computecanada matplotlib-3.10.0+computecanada numpy-2.2.2+computecanada ortools-9.10.4067+computecanada packaging-25.0+computecanada pandas-2.2.3+computecanada pillow-11.1.0+computecanada protobuf-6.30.2+computecanada pyparsing-3.2.1+computecanada python-dateutil-2.9.0.post0+computecanada pytz-2025.2+computecanada six-1.17.0+computecanada tzdata-2025.2+computecanada

Starting CP-SAT solver v9.10.4067
Parameters: max_time_in_seconds: 3600 max_memory_in_mb: 12000 log_search_progress: true enumerate_all_solutions: false absolute_gap_limit: 0 relative_gap_limit: 0
Setting number of workers to 48

Initial optimization model '': (model_fingerprint: 0x71cd58178c4b2792)
#Variables: 166 (#ints: 6 in objective)
  - 107 Booleans in [0,1]
  - 59 in [0,403]
#kLinear1: 19
#kLinear2: 211
#kLinear3: 79
#kLinearN: 682 (#terms: 6'937)

Starting presolve at 0.00s
  2.48e-04s  0.00e+00d  [DetectDominanceRelations] 
  8.74e-03s  0.00e+00d  [PresolveToFixPoint] #num_loops=7 #num_dual_strengthening=3 
  1.49e-05s  0.00e+00d  [ExtractEncodingFromLinear] #potential_supersets=1 
[Symmetry] Graph for symmetry has 863 nodes and 3'613 arcs.
[Symmetry] Symmetry computation done. time: 0.000429117 dtime: 0.00029867
[SAT presolve] num removable Booleans: 0 / 32
[SAT presolve] num trivial clauses: 0
[SAT presolve] [0s] clauses:4 literals:9 vars:6 one_side_vars:6 simple_definition:0 singleton_clauses:0
[SAT presolve] [3.8276e-05s] clauses:4 literals:9 vars:6 one_side_vars:6 simple_definition:0 singleton_clauses:0
[SAT presolve] [4.9611e-05s] clauses:4 literals:9 vars:6 one_side_vars:6 simple_definition:0 singleton_clauses:0
  2.01e-03s  2.08e-04d  [Probe] #probed=136 #fixed_bools=2 #new_bounds=13 
  2.94e-05s  0.00e+00d  [MaxClique] 
  2.36e-04s  0.00e+00d  [DetectDominanceRelations] 
  3.43e-03s  0.00e+00d  [PresolveToFixPoint] #num_loops=4 #num_dual_strengthening=3 
  8.13e-04s  0.00e+00d  [ProcessAtMostOneAndLinear] 
  5.96e-04s  0.00e+00d  [DetectDuplicateConstraints] #duplicates=128 #without_enforcements=38 
  2.58e-04s  9.23e-06d  [DetectDominatedLinearConstraints] #relevant_constraints=340 #num_inclusions=185 #num_redundant=1 
  1.21e-04s  0.00e+00d  [DetectDifferentVariables] #different=17 
  8.16e-05s  2.24e-06d  [ProcessSetPPC] #relevant_constraints=157 
  1.02e-05s  0.00e+00d  [FindAlmostIdenticalLinearConstraints] 
  5.14e-05s  2.97e-05d  [FindBigAtMostOneAndLinearOverlap] 
  4.94e-04s  1.70e-04d  [FindBigVerticalLinearOverlap] #blocks=3 #saved_nz=114 
  4.00e-05s  6.81e-06d  [FindBigHorizontalLinearOverlap] #linears=147 
  1.53e-05s  1.50e-08d  [MergeClauses] 
  2.26e-04s  0.00e+00d  [DetectDominanceRelations] 
  2.11e-03s  0.00e+00d  [PresolveToFixPoint] #num_loops=2 #num_dual_strengthening=1 
  2.26e-04s  0.00e+00d  [DetectDominanceRelations] 
  1.73e-03s  0.00e+00d  [PresolveToFixPoint] #num_loops=1 #num_dual_strengthening=1 
[Symmetry] Graph for symmetry has 730 nodes and 3'124 arcs.
[Symmetry] Symmetry computation done. time: 0.000176384 dtime: 0.0002145
[SAT presolve] num removable Booleans: 0 / 30
[SAT presolve] num trivial clauses: 0
[SAT presolve] [0s] clauses:4 literals:9 vars:6 one_side_vars:6 simple_definition:0 singleton_clauses:0
[SAT presolve] [3.092e-05s] clauses:4 literals:9 vars:6 one_side_vars:6 simple_definition:0 singleton_clauses:0
[SAT presolve] [4.1553e-05s] clauses:4 literals:9 vars:6 one_side_vars:6 simple_definition:0 singleton_clauses:0
  1.70e-03s  1.85e-04d  [Probe] #probed=130 #new_bounds=13 
  2.08e-05s  0.00e+00d  [MaxClique] 
  2.27e-04s  0.00e+00d  [DetectDominanceRelations] 
  2.83e-03s  0.00e+00d  [PresolveToFixPoint] #num_loops=4 #num_dual_strengthening=3 
  6.35e-04s  0.00e+00d  [ProcessAtMostOneAndLinear] 
  4.59e-04s  0.00e+00d  [DetectDuplicateConstraints] #without_enforcements=38 
  1.52e-04s  5.59e-06d  [DetectDominatedLinearConstraints] #relevant_constraints=244 #num_inclusions=26 
  1.32e-04s  0.00e+00d  [DetectDifferentVariables] #different=20 
  7.80e-05s  2.16e-06d  [ProcessSetPPC] #relevant_constraints=151 
  1.15e-05s  0.00e+00d  [FindAlmostIdenticalLinearConstraints] 
  4.72e-05s  2.78e-05d  [FindBigAtMostOneAndLinearOverlap] 
  3.68e-04s  1.61e-04d  [FindBigVerticalLinearOverlap] 
  3.70e-05s  6.81e-06d  [FindBigHorizontalLinearOverlap] #linears=147 
  1.46e-05s  1.50e-08d  [MergeClauses] 
  2.31e-04s  0.00e+00d  [DetectDominanceRelations] 
  1.75e-03s  0.00e+00d  [PresolveToFixPoint] #num_loops=1 #num_dual_strengthening=1 
  2.21e-04s  0.00e+00d  [DetectDominanceRelations] 
  1.72e-03s  0.00e+00d  [PresolveToFixPoint] #num_loops=1 #num_dual_strengthening=1 
[Symmetry] Graph for symmetry has 730 nodes and 3'124 arcs.
[Symmetry] Symmetry computation done. time: 0.00017459 dtime: 0.00021454
[SAT presolve] num removable Booleans: 0 / 30
[SAT presolve] num trivial clauses: 0
[SAT presolve] [0s] clauses:4 literals:9 vars:6 one_side_vars:6 simple_definition:0 singleton_clauses:0
[SAT presolve] [2.8651e-05s] clauses:4 literals:9 vars:6 one_side_vars:6 simple_definition:0 singleton_clauses:0
[SAT presolve] [4.0684e-05s] clauses:4 literals:9 vars:6 one_side_vars:6 simple_definition:0 singleton_clauses:0
  1.66e-03s  1.80e-04d  [Probe] #probed=130 
  2.06e-05s  0.00e+00d  [MaxClique] 
  2.27e-04s  0.00e+00d  [DetectDominanceRelations] 
  1.76e-03s  0.00e+00d  [PresolveToFixPoint] #num_loops=1 #num_dual_strengthening=1 
  6.37e-04s  0.00e+00d  [ProcessAtMostOneAndLinear] 
  4.60e-04s  0.00e+00d  [DetectDuplicateConstraints] #without_enforcements=38 
  1.52e-04s  5.59e-06d  [DetectDominatedLinearConstraints] #relevant_constraints=244 #num_inclusions=26 
  1.15e-04s  0.00e+00d  [DetectDifferentVariables] #different=20 
  7.65e-05s  2.16e-06d  [ProcessSetPPC] #relevant_constraints=151 
  1.10e-05s  0.00e+00d  [FindAlmostIdenticalLinearConstraints] 
  4.75e-05s  2.78e-05d  [FindBigAtMostOneAndLinearOverlap] 
  5.04e-04s  1.68e-04d  [FindBigVerticalLinearOverlap] #blocks=3 #saved_nz=129 
  3.78e-05s  6.11e-06d  [FindBigHorizontalLinearOverlap] #linears=147 
  1.44e-05s  1.50e-08d  [MergeClauses] 
  2.32e-04s  0.00e+00d  [DetectDominanceRelations] 
  2.55e-03s  0.00e+00d  [PresolveToFixPoint] #num_loops=2 #num_dual_strengthening=1 
  2.68e-05s  0.00e+00d  [ExpandObjective] #entries=30 #tight_variables=15 #tight_constraints=7 

Presolve summary:
  - 25 affine relations were detected.
  - rule 'TODO dual: only one blocking constraint?' was applied 438 times.
  - rule 'TODO dual: only one unspecified blocking constraint?' was applied 90 times.
  - rule 'TODO duplicate: identical constraint with different enforcements' was applied 114 times.
  - rule 'TODO linear2: contains a Boolean.' was applied 12 times.
  - rule 'affine: new relation' was applied 25 times.
  - rule 'at_most_one: removed literals' was applied 1 time.
  - rule 'at_most_one: size one' was applied 1 time.
  - rule 'bool_or: always true' was applied 1 time.
  - rule 'bool_or: implications' was applied 6 times.
  - rule 'bool_or: singleton' was applied 2 times.
  - rule 'deductions: 113 stored' was applied 1 time.
  - rule 'dual: fix variable' was applied 12 times.
  - rule 'dual: reduced domain' was applied 31 times.
  - rule 'duplicate: merged rhs of linear constraint' was applied 18 times.
  - rule 'duplicate: removed constraint' was applied 128 times.
  - rule 'enforcement: false literal' was applied 14 times.
  - rule 'enforcement: true literal' was applied 8 times.
  - rule 'incompatible linear: add implication' was applied 9 times.
  - rule 'linear inclusion: redundant containing constraint' was applied 1 time.
  - rule 'linear matrix: common vertical rectangle' was applied 6 times.
  - rule 'linear1: always true' was applied 6 times.
  - rule 'linear2: contains a Boolean.' was applied 11 times.
  - rule 'linear: always true' was applied 352 times.
  - rule 'linear: doubleton free' was applied 7 times.
  - rule 'linear: empty' was applied 22 times.
  - rule 'linear: extracted enforcement literal' was applied 1'100 times.
  - rule 'linear: fixed or dup variables' was applied 691 times.
  - rule 'linear: negative clause' was applied 7 times.
  - rule 'linear: positive clause' was applied 3 times.
  - rule 'linear: positive equal one' was applied 1 time.
  - rule 'linear: reduced variable domains' was applied 79 times.
  - rule 'linear: remapped using affine relations' was applied 620 times.
  - rule 'linear: simplified rhs' was applied 1'722 times.
  - rule 'linear: variable substitution 1' was applied 7 times.
  - rule 'presolve: 59 unused variables removed.' was applied 1 time.
  - rule 'presolve: iteration' was applied 3 times.
  - rule 'probing: reduced enforced constraint to implication.' was applied 1 time.
  - rule 'probing: simplified enforcement list.' was applied 1 time.

Presolved optimization model '': (model_fingerprint: 0x4515fe85f812623b)
#Variables: 81 (#ints: 6 in objective)
  - 30 Booleans in [0,1]
  - 1 in [-1,334]
  - 1 in [0,239]
  - 6 in [0,251]
  - 2 in [0,258]
  - 1 in [0,292]
  - 1 in [0,318]
  - 1 in [0,334]
  - 3 in [0,338]
  - 1 in [3,341]
  - 1 in [3,341][406,744]
  - 1 in [3,341][406,744][809,1147]
  - 1 in [3,341][406,744][809,1147][1212,1550]
  - 1 in [4,336]
  - 1 in [4,339]
  - 1 in [5,347]
  - 1 in [7,321]
  - 1 in [7,342]
  - 1 in [7,349]
  - 1 in [10,324]
  - 1 in [10,345]
  - 1 in [10,352]
  - 1 in [18,332]
  - 1 in [35,349]
  - 1 in [38,373]
  - 1 in [43,378]
  - 2 in [58,392]
  - 1 in [64,398]
  - 2 in [74,392]
  - 3 in [78,392]
  - 1 in [80,398]
  - 1 in [84,398]
  - 2 in [100,392]
  - 1 in [106,398]
  - 3 in [138,392]
  - 1 in [144,398]
  - 1 in [149,403]
#kBoolAnd: 1 (#enforced: 1) (#literals: 4)
#kBoolOr: 1 (#literals: 3)
#kExactlyOne: 1 (#literals: 3)
#kLinear1: 3 (#enforced: 3)
#kLinear2: 214 (#enforced: 180 #multi: 139)
#kLinear3: 58 (#enforced: 49 #multi: 15)
#kLinearN: 155 (#enforced: 132) (#terms: 1'255)

Preloading model.
#Bound   0.04s best:inf   next:[167,1918] initial_domain
[Symmetry] Graph for symmetry has 646 nodes and 2'996 arcs.
[Symmetry] Symmetry computation done. time: 0.000174893 dtime: 0.00020217
#Model   0.05s var:81/81 constraints:433/433

Starting search at 0.05s with 48 workers.
16 full problem subsolvers: [core, default_lp, lb_tree_search, max_lp, no_lp, objective_lb_search, objective_lb_search_max_lp, objective_lb_search_no_lp, objective_shaving_search_max_lp, objective_shaving_search_no_lp, probing, probing_max_lp, pseudo_costs, quick_restart, quick_restart_no_lp, reduced_costs]
30 first solution subsolvers: [fj_long_default(2), fj_long_lin_default, fj_long_lin_perturb, fj_long_lin_random, fj_long_perturb, fj_long_random, fj_short_default(2), fj_short_lin_default(2), fj_short_lin_perturb, fj_short_lin_random, fj_short_perturb, fj_short_random, fs_random(4), fs_random_no_lp(4), fs_random_quick_restart(4), fs_random_quick_restart_no_lp(3)]
13 incomplete subsolvers: [feasibility_pump, graph_arc_lns, graph_cst_lns, graph_dec_lns, graph_var_lns, rins/rens, rnd_cst_lns, rnd_var_lns, violation_ls(5)]
3 helper subsolvers: [neighborhood_helper, synchronization_agent, update_gap_integral]
#Bound   0.05s best:inf   next:[168,1918] bool_core (num_cores=1 [size:2 mw:1 d:1] a=5 d=1 fixed=0/39 clauses=2)
#1       0.05s best:976   next:[168,975]  no_lp (fixed_bools=0/49)
#Bound   0.05s best:976   next:[169,975]  bool_core (num_cores=1 [cover] a=5 d=1 fixed=0/42 clauses=3)
#Bound   0.05s best:976   next:[170,975]  bool_core (num_cores=1 [cover] a=5 d=1 fixed=1/45 clauses=5)
#Bound   0.05s best:976   next:[171,975]  bool_core (num_cores=1 [cover] a=5 d=1 fixed=2/48 clauses=8)
#Bound   0.05s best:976   next:[172,975]  bool_core (num_cores=1 [cover] a=5 d=1 fixed=3/51 clauses=12)
#Bound   0.05s best:976   next:[173,975]  bool_core (num_cores=1 [cover] a=5 d=1 fixed=4/54 clauses=17)
#Bound   0.05s best:976   next:[174,975]  bool_core (num_cores=1 [cover] a=5 d=1 fixed=5/57 clauses=23)
#Bound   0.05s best:976   next:[175,975]  bool_core (num_cores=1 [cover] a=5 d=1 fixed=6/60 clauses=30)
#2       0.05s best:905   next:[175,904]  quick_restart_no_lp (fixed_bools=0/49)
#3       0.05s best:856   next:[175,855]  no_lp (fixed_bools=0/59)
#4       0.05s best:847   next:[175,846]  no_lp (fixed_bools=0/66)
#Bound   0.06s best:847   next:[210,846]  objective_lb_search
#Bound   0.06s best:847   next:[219,846]  objective_lb_search_no_lp
#Bound   0.06s best:847   next:[240,846]  objective_lb_search
#5       0.06s best:807   next:[240,806]  no_lp (fixed_bools=0/68)
#Bound   0.06s best:807   next:[282,806]  objective_lb_search_no_lp
#Bound   0.06s best:807   next:[310,806]  objective_lb_search_no_lp
#Bound   0.06s best:807   next:[314,806]  objective_lb_search_no_lp
#Bound   0.06s best:807   next:[380,806]  objective_lb_search_no_lp
#6       0.06s best:697   next:[380,696]  no_lp (fixed_bools=0/78)
#7       0.06s best:696   next:[380,695]  violation_ls(batch:1 #solutions_imported:1 #lin_moves:0 #lin_evals:6 #gen_moves:4 #gen_evals:0 #comp_moves:4 #backtracks:0 #weight_updates:0)
#Bound   0.06s best:696   next:[381,695]  objective_lb_search_no_lp
#8       0.06s best:695   next:[381,694]  rnd_var_lns (d=0.50 s=34 t=0.10 p=0.00 stall=0 h=auto_l0) [presolve]
#Bound   0.06s best:695   next:[415,694]  objective_lb_search_no_lp
#9       0.07s best:687   next:[415,686]  graph_var_lns (d=0.50 s=36 t=0.10 p=0.00 stall=0 h=auto_l0)
#10      0.07s best:608   next:[415,607]  quick_restart_no_lp (fixed_bools=0/87)
#11      0.07s best:607   next:[415,606]  quick_restart_no_lp (fixed_bools=0/91)
#12      0.07s best:604   next:[415,603]  graph_var_lns (d=0.71 s=56 t=0.10 p=1.00 stall=0 h=auto_l0)
#Bound   0.08s best:604   next:[428,603]  objective_lb_search_no_lp
#13      0.08s best:596   next:[428,595]  rins_pump_lns (d=0.71 s=53 t=0.10 p=1.00 stall=1 h=auto_l0)
#14      0.08s best:585   next:[428,584]  no_lp (fixed_bools=1/104)
#15      0.08s best:584   next:[428,583]  violation_ls(batch:3 #solutions_imported:3 #lin_moves:1'636 #lin_evals:7'352 #gen_moves:4 #gen_evals:0 #comp_moves:4 #backtracks:0 #weight_updates:349)
#16      0.09s best:583   next:[428,582]  violation_ls(batch:4 #solutions_imported:4 #lin_moves:1'637 #lin_evals:7'358 #gen_moves:4 #gen_evals:0 #comp_moves:4 #backtracks:0 #weight_updates:349)
#Bound   0.09s best:583   next:[432,582]  objective_lb_search
#17      0.09s best:582   next:[432,581]  quick_restart_no_lp (fixed_bools=0/115)
#18      0.09s best:580   next:[432,579]  violation_ls(batch:5 #solutions_imported:5 #lin_moves:1'638 #lin_evals:7'363 #gen_moves:4 #gen_evals:0 #comp_moves:4 #backtracks:0 #weight_updates:349)
#19      0.09s best:575   next:[432,574]  rnd_var_lns (d=0.88 s=66 t=0.10 p=1.00 stall=2 h=auto_l0)
#Bound   0.09s best:575   next:[444,574]  objective_lb_search_no_lp
#Model   0.12s var:75/81 constraints:305/433
#Model   0.12s var:71/81 constraints:222/433
#Done    0.12s no_lp
#Done    0.12s default_lp
#Model   0.12s var:69/81 constraints:186/433
#Bound   0.12s best:575   next:[482,574]  objective_lb_search_no_lp [skipped_logs=10]

Task timing                                  n [     min,      max]      avg      dev     time         n [     min,      max]      avg      dev    dtime
                             'core':         1 [ 75.89ms,  75.89ms]  75.89ms   0.00ns  75.89ms         1 [ 26.29ms,  26.29ms]  26.29ms   0.00ns  26.29ms
                       'default_lp':         1 [ 76.06ms,  76.06ms]  76.06ms   0.00ns  76.06ms         1 [  5.51ms,   5.51ms]   5.51ms   0.00ns   5.51ms
                 'feasibility_pump':         6 [846.69us,  14.12ms]   8.95ms   5.71ms  53.68ms         5 [165.10us,   2.10ms]   1.48ms 675.35us   7.41ms
                  'fj_long_default':         0 [  0.00ns,   0.00ns]   0.00ns   0.00ns   0.00ns         0 [  0.00ns,   0.00ns]   0.00ns   0.00ns   0.00ns
                  'fj_long_default':         0 [  0.00ns,   0.00ns]   0.00ns   0.00ns   0.00ns         0 [  0.00ns,   0.00ns]   0.00ns   0.00ns   0.00ns
              'fj_long_lin_default':         0 [  0.00ns,   0.00ns]   0.00ns   0.00ns   0.00ns         0 [  0.00ns,   0.00ns]   0.00ns   0.00ns   0.00ns
              'fj_long_lin_perturb':         0 [  0.00ns,   0.00ns]   0.00ns   0.00ns   0.00ns         0 [  0.00ns,   0.00ns]   0.00ns   0.00ns   0.00ns
               'fj_long_lin_random':         0 [  0.00ns,   0.00ns]   0.00ns   0.00ns   0.00ns         0 [  0.00ns,   0.00ns]   0.00ns   0.00ns   0.00ns
                  'fj_long_perturb':         0 [  0.00ns,   0.00ns]   0.00ns   0.00ns   0.00ns         0 [  0.00ns,   0.00ns]   0.00ns   0.00ns   0.00ns
                   'fj_long_random':         0 [  0.00ns,   0.00ns]   0.00ns   0.00ns   0.00ns         0 [  0.00ns,   0.00ns]   0.00ns   0.00ns   0.00ns
                 'fj_short_default':         0 [  0.00ns,   0.00ns]   0.00ns   0.00ns   0.00ns         0 [  0.00ns,   0.00ns]   0.00ns   0.00ns   0.00ns
                 'fj_short_default':         0 [  0.00ns,   0.00ns]   0.00ns   0.00ns   0.00ns         0 [  0.00ns,   0.00ns]   0.00ns   0.00ns   0.00ns
             'fj_short_lin_default':         0 [  0.00ns,   0.00ns]   0.00ns   0.00ns   0.00ns         0 [  0.00ns,   0.00ns]   0.00ns   0.00ns   0.00ns
             'fj_short_lin_default':         0 [  0.00ns,   0.00ns]   0.00ns   0.00ns   0.00ns         0 [  0.00ns,   0.00ns]   0.00ns   0.00ns   0.00ns
             'fj_short_lin_perturb':         0 [  0.00ns,   0.00ns]   0.00ns   0.00ns   0.00ns         0 [  0.00ns,   0.00ns]   0.00ns   0.00ns   0.00ns
              'fj_short_lin_random':         0 [  0.00ns,   0.00ns]   0.00ns   0.00ns   0.00ns         0 [  0.00ns,   0.00ns]   0.00ns   0.00ns   0.00ns
                 'fj_short_perturb':         0 [  0.00ns,   0.00ns]   0.00ns   0.00ns   0.00ns         0 [  0.00ns,   0.00ns]   0.00ns   0.00ns   0.00ns
                  'fj_short_random':         0 [  0.00ns,   0.00ns]   0.00ns   0.00ns   0.00ns         0 [  0.00ns,   0.00ns]   0.00ns   0.00ns   0.00ns
                        'fs_random':         0 [  0.00ns,   0.00ns]   0.00ns   0.00ns   0.00ns         0 [  0.00ns,   0.00ns]   0.00ns   0.00ns   0.00ns
                        'fs_random':         1 [  2.70ms,   2.70ms]   2.70ms   0.00ns   2.70ms         1 [ 20.00ns,  20.00ns]  20.00ns   0.00ns  20.00ns
                        'fs_random':         1 [  3.11ms,   3.11ms]   3.11ms   0.00ns   3.11ms         1 [ 20.00ns,  20.00ns]  20.00ns   0.00ns  20.00ns
                        'fs_random':         1 [  3.48ms,   3.48ms]   3.48ms   0.00ns   3.48ms         1 [ 20.00ns,  20.00ns]  20.00ns   0.00ns  20.00ns
                  'fs_random_no_lp':         0 [  0.00ns,   0.00ns]   0.00ns   0.00ns   0.00ns         0 [  0.00ns,   0.00ns]   0.00ns   0.00ns   0.00ns
                  'fs_random_no_lp':         1 [  2.43ms,   2.43ms]   2.43ms   0.00ns   2.43ms         0 [  0.00ns,   0.00ns]   0.00ns   0.00ns   0.00ns
                  'fs_random_no_lp':         1 [  2.62ms,   2.62ms]   2.62ms   0.00ns   2.62ms         0 [  0.00ns,   0.00ns]   0.00ns   0.00ns   0.00ns
                  'fs_random_no_lp':         1 [  6.10ms,   6.10ms]   6.10ms   0.00ns   6.10ms         0 [  0.00ns,   0.00ns]   0.00ns   0.00ns   0.00ns
          'fs_random_quick_restart':         0 [  0.00ns,   0.00ns]   0.00ns   0.00ns   0.00ns         0 [  0.00ns,   0.00ns]   0.00ns   0.00ns   0.00ns
          'fs_random_quick_restart':         1 [  2.74ms,   2.74ms]   2.74ms   0.00ns   2.74ms         1 [ 20.00ns,  20.00ns]  20.00ns   0.00ns  20.00ns
          'fs_random_quick_restart':         1 [  3.07ms,   3.07ms]   3.07ms   0.00ns   3.07ms         1 [ 20.00ns,  20.00ns]  20.00ns   0.00ns  20.00ns
          'fs_random_quick_restart':         1 [  3.46ms,   3.46ms]   3.46ms   0.00ns   3.46ms         1 [ 20.00ns,  20.00ns]  20.00ns   0.00ns  20.00ns
    'fs_random_quick_restart_no_lp':         1 [  2.26ms,   2.26ms]   2.26ms   0.00ns   2.26ms         0 [  0.00ns,   0.00ns]   0.00ns   0.00ns   0.00ns
    'fs_random_quick_restart_no_lp':         1 [  2.62ms,   2.62ms]   2.62ms   0.00ns   2.62ms         0 [  0.00ns,   0.00ns]   0.00ns   0.00ns   0.00ns
    'fs_random_quick_restart_no_lp':         1 [  2.96ms,   2.96ms]   2.96ms   0.00ns   2.96ms         0 [  0.00ns,   0.00ns]   0.00ns   0.00ns   0.00ns
                    'graph_arc_lns':        10 [  1.58ms,  38.34ms]  15.40ms  11.15ms 154.01ms         4 [ 10.00ns, 116.56us]  61.51us  41.47us 246.03us
                    'graph_cst_lns':        10 [470.75us,   1.46ms] 636.18us 283.38us   6.36ms         0 [  0.00ns,   0.00ns]   0.00ns   0.00ns   0.00ns
                    'graph_dec_lns':        10 [  1.44ms,  28.85ms]  10.76ms   8.52ms 107.58ms         6 [ 10.00ns,  79.10us]  20.11us  28.99us 120.64us
                    'graph_var_lns':        10 [  1.99ms,  33.55ms]  11.14ms  10.20ms 111.35ms         5 [ 10.00ns,  38.48us]  14.86us  14.46us  74.31us
                   'lb_tree_search':         1 [ 74.81ms,  74.81ms]  74.81ms   0.00ns  74.81ms         1 [  1.21ms,   1.21ms]   1.21ms   0.00ns   1.21ms
                           'max_lp':         1 [ 75.85ms,  75.85ms]  75.85ms   0.00ns  75.85ms         1 [  1.94ms,   1.94ms]   1.94ms   0.00ns   1.94ms
                            'no_lp':         1 [ 75.35ms,  75.35ms]  75.35ms   0.00ns  75.35ms         1 [  8.15ms,   8.15ms]   8.15ms   0.00ns   8.15ms
              'objective_lb_search':         1 [ 74.16ms,  74.16ms]  74.16ms   0.00ns  74.16ms         1 [  5.41ms,   5.41ms]   5.41ms   0.00ns   5.41ms
       'objective_lb_search_max_lp':         1 [ 74.48ms,  74.48ms]  74.48ms   0.00ns  74.48ms         1 [  1.40ms,   1.40ms]   1.40ms   0.00ns   1.40ms
        'objective_lb_search_no_lp':         1 [ 73.95ms,  73.95ms]  73.95ms   0.00ns  73.95ms         1 [  6.74ms,   6.74ms]   6.74ms   0.00ns   6.74ms
  'objective_shaving_search_max_lp':         8 [  2.05ms,  17.29ms]   6.91ms   5.37ms  55.30ms         2 [287.59us, 316.53us] 302.06us  14.47us 604.13us
   'objective_shaving_search_no_lp':         6 [  3.71ms,  17.39ms]   9.62ms   5.56ms  57.73ms         1 [291.02us, 291.02us] 291.02us   0.00ns 291.02us
                          'probing':         1 [ 76.72ms,  76.72ms]  76.72ms   0.00ns  76.72ms         1 [  1.35ms,   1.35ms]   1.35ms   0.00ns   1.35ms
                   'probing_max_lp':         1 [ 74.34ms,  74.34ms]  74.34ms   0.00ns  74.34ms         1 [  1.38ms,   1.38ms]   1.38ms   0.00ns   1.38ms
                     'pseudo_costs':         1 [ 74.69ms,  74.69ms]  74.69ms   0.00ns  74.69ms         1 [  1.83ms,   1.83ms]   1.83ms   0.00ns   1.83ms
                    'quick_restart':         1 [ 75.04ms,  75.04ms]  75.04ms   0.00ns  75.04ms         1 [  4.96ms,   4.96ms]   4.96ms   0.00ns   4.96ms
              'quick_restart_no_lp':         1 [ 75.03ms,  75.03ms]  75.03ms   0.00ns  75.03ms         1 [  9.19ms,   9.19ms]   9.19ms   0.00ns   9.19ms
                    'reduced_costs':         1 [ 75.80ms,  75.80ms]  75.80ms   0.00ns  75.80ms         1 [  1.64ms,   1.64ms]   1.64ms   0.00ns   1.64ms
                        'rins/rens':        10 [ 78.71us,  35.10ms]  16.16ms  11.87ms 161.59ms         5 [ 13.02us,   2.86ms] 879.30us   1.07ms   4.40ms
                      'rnd_cst_lns':        10 [449.99us,  30.60ms]   8.29ms  10.60ms  82.92ms         4 [ 10.00ns, 140.01us]  43.02us  57.50us 172.09us
                      'rnd_var_lns':        10 [  1.11ms,  34.80ms]  12.31ms  10.45ms 123.06ms         7 [ 10.00ns, 151.44us]  48.72us  50.46us 341.02us
                     'violation_ls':         1 [ 65.36ms,  65.36ms]  65.36ms   0.00ns  65.36ms         1 [ 22.73ms,  22.73ms]  22.73ms   0.00ns  22.73ms
                     'violation_ls':         1 [ 65.52ms,  65.52ms]  65.52ms   0.00ns  65.52ms         1 [ 23.68ms,  23.68ms]  23.68ms   0.00ns  23.68ms
                     'violation_ls':         1 [ 66.26ms,  66.26ms]  66.26ms   0.00ns  66.26ms         1 [ 23.66ms,  23.66ms]  23.66ms   0.00ns  23.66ms
                     'violation_ls':         2 [387.27us,  57.89ms]  29.14ms  28.75ms  58.27ms         2 [ 10.65us,  21.20ms]  10.60ms  10.59ms  21.21ms
                     'violation_ls':         6 [110.08us,  33.33ms]   8.15ms  11.87ms  48.88ms         6 [830.00ns,  14.43ms]   3.51ms   5.17ms  21.07ms

Search stats                        Bools  Conflicts  Branches  Restarts  BoolPropag  IntegerPropag
                           'core':    419        193     1'858       547      89'700         44'230
                     'default_lp':     54         76       604       187       1'154         20'332
                      'fs_random':      0          0         0         0           0              0
                      'fs_random':     33          0         0         0           0              0
                      'fs_random':     33          0         0         0           0              0
                      'fs_random':     33          0         0         0           0              0
                'fs_random_no_lp':      0          0         0         0           0              0
                'fs_random_no_lp':     33          0         0         0           0              0
                'fs_random_no_lp':     33          0         0         0           0              0
                'fs_random_no_lp':     33          0         0         0           0              0
        'fs_random_quick_restart':      0          0         0         0           0              0
        'fs_random_quick_restart':     33          0         0         0           0              0
        'fs_random_quick_restart':     33          0         0         0           0              0
        'fs_random_quick_restart':     33          0         0         0           0              0
  'fs_random_quick_restart_no_lp':     33          0         0         0           0              0
  'fs_random_quick_restart_no_lp':     33          0         0         0           0              0
  'fs_random_quick_restart_no_lp':     33          0         0         0           0              0
                 'lb_tree_search':     33          0        66        66          24            475
                         'max_lp':     33          0        66        66          24            475
                          'no_lp':    106        219     1'055       297       7'097         46'719
            'objective_lb_search':     39         50       464       272         961         11'922
     'objective_lb_search_max_lp':     35          1        69        66          46            760
      'objective_lb_search_no_lp':     58        215       683       297       3'220         39'645
                        'probing':     75         14       136       136         370          2'003
                 'probing_max_lp':     33          0        66        66          24            475
                   'pseudo_costs':     36          0        71        66          39            591
                  'quick_restart':     69         30       692       357       1'043         11'467
            'quick_restart_no_lp':    119        220     1'612       423       7'220         50'072
                  'reduced_costs':     34          1        69        66          39            569

SAT stats                           ClassicMinim  LitRemoved  LitLearned  LitForgotten  Subsumed  MClauses  MDecisions  MLitTrue  MSubsumed  MLitRemoved  MReused
                           'core':            68          89         198             0         0       181         674         0        135          408        3
                     'default_lp':            20          27         497             0        13        49         349         0         16           87        5
                      'fs_random':             0           0           0             0         0         0           0         0          0            0        0
                      'fs_random':             0           0           0             0         0         0           0         0          0            0        0
                      'fs_random':             0           0           0             0         0         0           0         0          0            0        0
                      'fs_random':             0           0           0             0         0         0           0         0          0            0        0
                'fs_random_no_lp':             0           0           0             0         0         0           0         0          0            0        0
                'fs_random_no_lp':             0           0           0             0         0         0           0         0          0            0        0
                'fs_random_no_lp':             0           0           0             0         0         0           0         0          0            0        0
                'fs_random_no_lp':             0           0           0             0         0         0           0         0          0            0        0
        'fs_random_quick_restart':             0           0           0             0         0         0           0         0          0            0        0
        'fs_random_quick_restart':             0           0           0             0         0         0           0         0          0            0        0
        'fs_random_quick_restart':             0           0           0             0         0         0           0         0          0            0        0
        'fs_random_quick_restart':             0           0           0             0         0         0           0         0          0            0        0
  'fs_random_quick_restart_no_lp':             0           0           0             0         0         0           0         0          0            0        0
  'fs_random_quick_restart_no_lp':             0           0           0             0         0         0           0         0          0            0        0
  'fs_random_quick_restart_no_lp':             0           0           0             0         0         0           0         0          0            0        0
                 'lb_tree_search':             0           0           0             0         0         0           0         0          0            0        0
                         'max_lp':             0           0           0             0         0         0           0         0          0            0        0
                          'no_lp':           136         325       1'182             0        16        32         234         0          8           43        0
            'objective_lb_search':            35          77         152             0         1        13          60         0          1            3        2
     'objective_lb_search_max_lp':             0           0           2             0         0         0           0         0          0            0        0
      'objective_lb_search_no_lp':           155         341         819             0         9        41         189         0         19           86        4
                        'probing':             0           0          14             0         0         0           0         0          0            0        0
                 'probing_max_lp':             0           0           0             0         0         0           0         0          0            0        0
                   'pseudo_costs':             0           0           0             0         0         0           0         0          0            0        0
                  'quick_restart':            10          13         169             0         1        16          74         0          2            7        0
            'quick_restart_no_lp':            98         164       1'498             0        13        67         395         0         35          185        3
                  'reduced_costs':             0           0           3             0         0         0           0         0          0            0        0

Lp stats                         Component  Iterations  AddedCuts  OPTIMAL  DUAL_F.  DUAL_U.
                  'default_lp':          1         345        238       92        0        0
                   'fs_random':          1           0          0        0        0        0
                   'fs_random':          1           0          0        0        0        0
                   'fs_random':          1           0          0        0        0        0
     'fs_random_quick_restart':          1           0          0        0        0        0
     'fs_random_quick_restart':          1           0          0        0        0        0
     'fs_random_quick_restart':          1           0          0        0        0        0
              'lb_tree_search':          1         112        436        5        0        0
                      'max_lp':          1         124        483        5        1        0
         'objective_lb_search':          1         481        259       86        0        0
  'objective_lb_search_max_lp':          1         167        544       12        0        0
                     'probing':          1         151        232       69        0        0
              'probing_max_lp':          1         118        452        5        0        0
                'pseudo_costs':          1         199        524       14        1        0
               'quick_restart':          1         429        256       96        0        0
               'reduced_costs':          1         183        592       13        0        0

Lp dimension                                                                    Final dimension of first component
                  'default_lp':   140 rows, 79 columns, 485 entries with magnitude in [3.279041e-03, 1.000000e+00]
                   'fs_random':       0 rows, 79 columns, 0 entries with magnitude in [0.000000e+00, 0.000000e+00]
                   'fs_random':       0 rows, 79 columns, 0 entries with magnitude in [0.000000e+00, 0.000000e+00]
                   'fs_random':       0 rows, 79 columns, 0 entries with magnitude in [0.000000e+00, 0.000000e+00]
     'fs_random_quick_restart':       0 rows, 79 columns, 0 entries with magnitude in [0.000000e+00, 0.000000e+00]
     'fs_random_quick_restart':       0 rows, 79 columns, 0 entries with magnitude in [0.000000e+00, 0.000000e+00]
     'fs_random_quick_restart':       0 rows, 79 columns, 0 entries with magnitude in [0.000000e+00, 0.000000e+00]
              'lb_tree_search':  535 rows, 81 columns, 3230 entries with magnitude in [2.460060e-03, 1.000000e+00]
                      'max_lp':  584 rows, 81 columns, 3543 entries with magnitude in [1.789360e-03, 1.000000e+00]
         'objective_lb_search':   164 rows, 79 columns, 444 entries with magnitude in [2.302070e-03, 1.000000e+00]
  'objective_lb_search_max_lp':   239 rows, 81 columns, 969 entries with magnitude in [5.604628e-04, 1.000000e+00]
                     'probing':   142 rows, 79 columns, 464 entries with magnitude in [7.942999e-03, 1.000000e+00]
              'probing_max_lp':  534 rows, 81 columns, 3244 entries with magnitude in [1.643344e-03, 1.000000e+00]
                'pseudo_costs':  252 rows, 81 columns, 1023 entries with magnitude in [1.739651e-03, 1.000000e+00]
               'quick_restart':   166 rows, 79 columns, 432 entries with magnitude in [1.005563e-02, 1.000000e+00]
               'reduced_costs':   251 rows, 81 columns, 965 entries with magnitude in [6.596673e-04, 1.000000e+00]

Lp debug                         CutPropag  CutEqPropag  Adjust  Overflow  Bad  BadScaling
                  'default_lp':          0            0      20         0  114           0
                   'fs_random':          0            0       0         0    0           0
                   'fs_random':          0            0       0         0    0           0
                   'fs_random':          0            0       0         0    0           0
     'fs_random_quick_restart':          0            0       0         0    0           0
     'fs_random_quick_restart':          0            0       0         0    0           0
     'fs_random_quick_restart':          0            0       0         0    0           0
              'lb_tree_search':          0            0       4         0  243           0
                      'max_lp':          0            0       5         0  279           0
         'objective_lb_search':          0            0      60         0  194           0
  'objective_lb_search_max_lp':          0            0       4         0  232           0
                     'probing':          0            0      51         0  146           0
              'probing_max_lp':          0            0       4         0  259           0
                'pseudo_costs':          0            0       5         0  217           0
               'quick_restart':          0            0      36         0  148           0
               'reduced_costs':          0            0       4         0  215           0

Lp pool                          Constraints  Updates  Simplif  Merged  Shortened  Split  Strenghtened  Cuts/Call
                  'default_lp':          305       18        6       0          0      0             7    238/376
                   'fs_random':           67        0        0       0          0      0             0        0/0
                   'fs_random':           67        0        0       0          0      0             0        0/0
                   'fs_random':           67        0        0       0          0      0             0        0/0
     'fs_random_quick_restart':           67        0        0       0          0      0             0        0/0
     'fs_random_quick_restart':           67        0        0       0          0      0             0        0/0
     'fs_random_quick_restart':           67        0        0       0          0      0             0        0/0
              'lb_tree_search':          871        9        0       0          0     10           120    436/795
                      'max_lp':          918       11        0       0          0     12           122    483/838
         'objective_lb_search':          325       46      155       1         64      0            54    259/455
  'objective_lb_search_max_lp':          979       10       40       0          0      0           190    544/843
                     'probing':          299        2        2       0          0      0             8    232/389
              'probing_max_lp':          887       12        0       0          0     11           127    452/814
                'pseudo_costs':          959        0        4       0          0      0           117    524/827
               'quick_restart':          321        9      124       2         92      0            22    256/419
               'reduced_costs':        1'027        1        5       0          0      0           147    592/892

Lp Cut            defaul  max_lp  quick_  reduce  pseudo  lb_tre  probin  object  probin  object
          CG_FF:       7      51       8      66      66      46       8       8      47      70
           CG_K:       6      21       7      32      25      21       8       8      21      26
           CG_R:       1      21       3      22      15      21       1       3      21      15
          CG_RB:      29     107      33     111      91      79      33      38      90      93
         CG_RBP:       8      12       9      16      21      10       3       7      13      23
         Clique:       -       -       -       9       2       -       -       -       -       -
             IB:     137      79     132     123     119      78     125     129      78     119
       MIR_1_FF:       9      44       9      34      34      41       8      10      41      33
        MIR_1_K:       -       5       -       4       4       5       1       -       5       4
        MIR_1_R:       1       3       1       1       1       3       1       1       2       1
       MIR_1_RB:      10      25      11      45      45      31      14      13      26      43
      MIR_1_RBP:       -       7       -       9       7       6       -       -       6       5
       MIR_2_FF:       -       8       3       7       5       7       1       2      11       9
        MIR_2_K:       -       1       1       5       2       3       -       2       2       4
        MIR_2_R:       -       4       -       6       4       4       -       -       5       4
       MIR_2_RB:       4      11       7      13       6      11       2       7       8      10
      MIR_2_RBP:       -       3       -       6       3       1       -       -       1       2
       MIR_3_FF:       1       9       1       4       2       7       -       -      11       3
        MIR_3_K:       -       4       -       -       -       3       1       -       7       1
        MIR_3_R:       -       3       -       1       4       1       1       -       5       2
       MIR_3_RB:       3      11       1       2       5       4       4       1       7       6
      MIR_3_RBP:       -       -       -       1       -       3       -       -       3       1
       MIR_4_FF:       -       1       -       3       3       5       -       2       1       4
        MIR_4_K:       -       -       -       1       1       1       -       -       -       -
        MIR_4_R:       -       3       2       3       3       4       -       1       3       4
       MIR_4_RB:       3       3       5       3       7       4       1       3       3       5
      MIR_4_RBP:       -       1       -       1       -       1       -       -       -       -
       MIR_5_FF:       -       3       -       -       -       2       -       -       -       -
        MIR_5_K:       -       1       -       -       -       1       -       1       -       -
        MIR_5_R:       -       3       -       -       2       3       -       1       1       1
       MIR_5_RB:       1       1       1       -       2       2       1       1       1       1
      MIR_5_RBP:       1       -       1       -       -       -       1       1       -       -
       MIR_6_FF:       -       2       -       -       -       1       -       -       2       -
        MIR_6_R:       -       1       -       -       1       1       -       -       2       -
       MIR_6_RB:       -       -       -       -       -       -       -       -       1       -
      MIR_6_RBP:       -       1       -       -       -       -       -       -       -       -
   ZERO_HALF_FF:       4      11       6      16      11      10       6       3      11      14
    ZERO_HALF_K:       -       -       -       3       1       1       -       -       -       3
    ZERO_HALF_R:       8      13       9      23      18       9       8       9       8      18
   ZERO_HALF_RB:       5       8       6      16      11       6       4       8       7      16
  ZERO_HALF_RBP:       -       2       -       6       3       -       -       -       2       4

LNS stats           Improv/Calls  Closed  Difficulty  TimeLimit
  'graph_arc_lns':           1/5    100%        0.94       0.10
  'graph_cst_lns':           0/0      0%        0.50       0.10
  'graph_dec_lns':           3/7     86%        0.94       0.10
  'graph_var_lns':           3/6    100%        0.96       0.10
      'rins/rens':           2/7     71%        0.88       0.10
    'rnd_cst_lns':           1/4     75%        0.82       0.10
    'rnd_var_lns':           4/7     86%        0.94       0.10

LS stats                   Batches  Restarts  LinMoves  GenMoves  CompoundMoves  WeightUpdates
       'fj_long_default':        0         0         0         0              0              0
       'fj_long_default':        0         0         0         0              0              0
   'fj_long_lin_default':        0         0         0         0              0              0
   'fj_long_lin_perturb':        0         0         0         0              0              0
    'fj_long_lin_random':        0         0         0         0              0              0
       'fj_long_perturb':        0         0         0         0              0              0
        'fj_long_random':        0         0         0         0              0              0
      'fj_short_default':        0         0         0         0              0              0
      'fj_short_default':        0         0         0         0              0              0
  'fj_short_lin_default':        0         0         0         0              0              0
  'fj_short_lin_default':        0         0         0         0              0              0
  'fj_short_lin_perturb':        0         0         0         0              0              0
   'fj_short_lin_random':        0         0         0         0              0              0
      'fj_short_perturb':        0         0         0         0              0              0
       'fj_short_random':        0         0         0         0              0              0
          'violation_ls':        1         0         0     7'032            114             47
          'violation_ls':        1         0         0     7'183            167             44
          'violation_ls':        1         0         0     7'452            222             48
          'violation_ls':        2         0         0     6'524             98             44
          'violation_ls':        6         0     6'558         4              4          5'429

Solutions (19)            Num     Rank
        'graph_var_lns':    2   [9,12]
                'no_lp':    6   [1,14]
  'quick_restart_no_lp':    4   [2,17]
        'rins_pump_lns':    1  [13,13]
          'rnd_var_lns':    2   [8,19]
         'violation_ls':    4   [7,18]

Objective bounds                Num
                  'bool_core':    8
             'initial_domain':    1
        'objective_lb_search':    3
  'objective_lb_search_no_lp':   20

Solution repositories    Added  Queried  Ignored  Synchro
  'feasible solutions':     53      158        0       40
        'lp solutions':      0        0        0        0
                'pump':     85        9

Improving bounds shared         Num
                       'core':    2
                      'no_lp':   84
  'objective_lb_search_no_lp':   83
                    'probing':    2
              'quick_restart':   44

Clauses shared            Num
           'default_lp':    1
                'no_lp':   15
  'objective_lb_search':    2
        'quick_restart':    6
  'quick_restart_no_lp':    8

CpSolverResponse summary:
status: OPTIMAL
objective: 575
best_bound: 575
integers: 80
booleans: 33
conflicts: 0
branches: 0
propagations: 0
integer_propagations: 0
restarts: 0
lp_iterations: 0
walltime: 0.131934
usertime: 0.131934
deterministic_time: 0.204227
gap_integral: 0.926963
solution_fingerprint: 0xfd0798c5107b471e


--- Simulation Gantt  partir du modle mathmatique ---
{'big':0, 'due_date':69, 'pos_time':5, 'status':0, 'blocked':0, 'operations':["{'type':1, 'processing_time':57}"]}
{'big':1, 'due_date':111, 'pos_time':5, 'status':1, 'blocked':1, 'operations':["{'type':0, 'processing_time':46}"]}
{'big':1, 'due_date':164, 'pos_time':5, 'status':1, 'blocked':0, 'operations':["{'type':1, 'processing_time':27}", "{'type':0, 'processing_time':20}"]}
{'big':1, 'due_date':71, 'pos_time':5, 'status':1, 'blocked':0, 'operations':["{'type':0, 'processing_time':19}", "{'type':1, 'processing_time':49}"]}
{'big':1, 'due_date':85, 'pos_time':5, 'status':2, 'blocked':1, 'operations':["{'type':0, 'processing_time':59}"]}
