created virtual environment CPython3.12.4.final.0-64 in 7486ms
  creator CPython3Posix(dest=/localscratch/aneumann.63390711.0/env, clear=False, no_vcs_ignore=False, global=False)
  seeder FromAppData(download=False, pip=bundle, via=copy, app_data_dir=/home/aneumann/.local/share/virtualenv)
    added seed packages: pip==25.1.1
  activators BashActivator,CShellActivator,FishActivator,NushellActivator,PowerShellActivator,PythonActivator
Looking in links: /cvmfs/soft.computecanada.ca/custom/python/wheelhouse/gentoo2023/x86-64-v3, /cvmfs/soft.computecanada.ca/custom/python/wheelhouse/gentoo2023/generic, /cvmfs/soft.computecanada.ca/custom/python/wheelhouse/generic
Requirement already satisfied: pip in /localscratch/aneumann.63390711.0/env/lib/python3.12/site-packages (25.1.1)
Looking in links: /cvmfs/soft.computecanada.ca/custom/python/wheelhouse/gentoo2023/x86-64-v3, /cvmfs/soft.computecanada.ca/custom/python/wheelhouse/gentoo2023/generic, /cvmfs/soft.computecanada.ca/custom/python/wheelhouse/generic
ERROR: protobuf-5.28.3-cp38-abi3-manylinux2014_x86_64.whl is not a supported wheel on this platform.
Looking in links: /cvmfs/soft.computecanada.ca/custom/python/wheelhouse/gentoo2023/x86-64-v3, /cvmfs/soft.computecanada.ca/custom/python/wheelhouse/gentoo2023/generic, /cvmfs/soft.computecanada.ca/custom/python/wheelhouse/generic
Processing /home/aneumann/projects/def-adhaj/aneumann/GNRS/wheels/immutabledict-4.2.0-py3-none-any.whl
Installing collected packages: immutabledict
Successfully installed immutabledict-4.2.0
Looking in links: /cvmfs/soft.computecanada.ca/custom/python/wheelhouse/gentoo2023/x86-64-v3, /cvmfs/soft.computecanada.ca/custom/python/wheelhouse/gentoo2023/generic, /cvmfs/soft.computecanada.ca/custom/python/wheelhouse/generic
Processing /cvmfs/soft.computecanada.ca/custom/python/wheelhouse/generic/ortools-9.10.4067+computecanada-cp312-cp312-linux_x86_64.whl (from -r /home/aneumann/projects/def-adhaj/aneumann/GNRS/requirements/or.txt (line 1))
Processing /cvmfs/soft.computecanada.ca/custom/python/wheelhouse/gentoo2023/x86-64-v3/matplotlib-3.10.0+computecanada-cp312-cp312-linux_x86_64.whl (from -r /home/aneumann/projects/def-adhaj/aneumann/GNRS/requirements/or.txt (line 2))
Processing /cvmfs/soft.computecanada.ca/custom/python/wheelhouse/gentoo2023/x86-64-v3/pandas-2.2.3+computecanada-cp312-cp312-linux_x86_64.whl (from -r /home/aneumann/projects/def-adhaj/aneumann/GNRS/requirements/or.txt (line 3))
Processing /cvmfs/soft.computecanada.ca/custom/python/wheelhouse/generic/absl_py-2.2.2+computecanada-py3-none-any.whl (from ortools<9.11,>=9.10->-r /home/aneumann/projects/def-adhaj/aneumann/GNRS/requirements/or.txt (line 1))
Processing /cvmfs/soft.computecanada.ca/custom/python/wheelhouse/gentoo2023/generic/numpy-2.2.2+computecanada-cp312-cp312-linux_x86_64.whl (from ortools<9.11,>=9.10->-r /home/aneumann/projects/def-adhaj/aneumann/GNRS/requirements/or.txt (line 1))
Processing /cvmfs/soft.computecanada.ca/custom/python/wheelhouse/gentoo2023/x86-64-v3/protobuf-6.30.2+computecanada-cp312-cp312-linux_x86_64.whl (from ortools<9.11,>=9.10->-r /home/aneumann/projects/def-adhaj/aneumann/GNRS/requirements/or.txt (line 1))
Requirement already satisfied: immutabledict>=3.0.0 in /localscratch/aneumann.63390711.0/env/lib/python3.12/site-packages (from ortools<9.11,>=9.10->-r /home/aneumann/projects/def-adhaj/aneumann/GNRS/requirements/or.txt (line 1)) (4.2.0)
Processing /cvmfs/soft.computecanada.ca/custom/python/wheelhouse/gentoo2023/generic/contourpy-1.3.1+computecanada-cp312-cp312-linux_x86_64.whl (from matplotlib->-r /home/aneumann/projects/def-adhaj/aneumann/GNRS/requirements/or.txt (line 2))
Processing /cvmfs/soft.computecanada.ca/custom/python/wheelhouse/generic/cycler-0.12.1+computecanada-py3-none-any.whl (from matplotlib->-r /home/aneumann/projects/def-adhaj/aneumann/GNRS/requirements/or.txt (line 2))
Processing /cvmfs/soft.computecanada.ca/custom/python/wheelhouse/generic/fonttools-4.58.2+computecanada-cp312-cp312-linux_x86_64.whl (from matplotlib->-r /home/aneumann/projects/def-adhaj/aneumann/GNRS/requirements/or.txt (line 2))
Processing /cvmfs/soft.computecanada.ca/custom/python/wheelhouse/gentoo2023/x86-64-v3/kiwisolver-1.4.8+computecanada-cp312-cp312-linux_x86_64.whl (from matplotlib->-r /home/aneumann/projects/def-adhaj/aneumann/GNRS/requirements/or.txt (line 2))
Processing /cvmfs/soft.computecanada.ca/custom/python/wheelhouse/generic/packaging-25.0+computecanada-py3-none-any.whl (from matplotlib->-r /home/aneumann/projects/def-adhaj/aneumann/GNRS/requirements/or.txt (line 2))
Processing /cvmfs/soft.computecanada.ca/custom/python/wheelhouse/gentoo2023/x86-64-v3/pillow-11.1.0+computecanada-cp312-cp312-linux_x86_64.whl (from matplotlib->-r /home/aneumann/projects/def-adhaj/aneumann/GNRS/requirements/or.txt (line 2))
Processing /cvmfs/soft.computecanada.ca/custom/python/wheelhouse/generic/pyparsing-3.2.1+computecanada-py3-none-any.whl (from matplotlib->-r /home/aneumann/projects/def-adhaj/aneumann/GNRS/requirements/or.txt (line 2))
Processing /cvmfs/soft.computecanada.ca/custom/python/wheelhouse/generic/python_dateutil-2.9.0.post0+computecanada-py2.py3-none-any.whl (from matplotlib->-r /home/aneumann/projects/def-adhaj/aneumann/GNRS/requirements/or.txt (line 2))
Processing /cvmfs/soft.computecanada.ca/custom/python/wheelhouse/generic/pytz-2025.2+computecanada-py2.py3-none-any.whl (from pandas->-r /home/aneumann/projects/def-adhaj/aneumann/GNRS/requirements/or.txt (line 3))
Processing /cvmfs/soft.computecanada.ca/custom/python/wheelhouse/generic/tzdata-2025.2+computecanada-py2.py3-none-any.whl (from pandas->-r /home/aneumann/projects/def-adhaj/aneumann/GNRS/requirements/or.txt (line 3))
Processing /cvmfs/soft.computecanada.ca/custom/python/wheelhouse/generic/six-1.17.0+computecanada-py2.py3-none-any.whl (from python-dateutil>=2.7->matplotlib->-r /home/aneumann/projects/def-adhaj/aneumann/GNRS/requirements/or.txt (line 2))
Installing collected packages: pytz, tzdata, six, pyparsing, protobuf, pillow, packaging, numpy, kiwisolver, fonttools, cycler, absl-py, python-dateutil, contourpy, pandas, matplotlib, ortools

Successfully installed absl-py-2.2.2+computecanada contourpy-1.3.1+computecanada cycler-0.12.1+computecanada fonttools-4.58.2+computecanada kiwisolver-1.4.8+computecanada matplotlib-3.10.0+computecanada numpy-2.2.2+computecanada ortools-9.10.4067+computecanada packaging-25.0+computecanada pandas-2.2.3+computecanada pillow-11.1.0+computecanada protobuf-6.30.2+computecanada pyparsing-3.2.1+computecanada python-dateutil-2.9.0.post0+computecanada pytz-2025.2+computecanada six-1.17.0+computecanada tzdata-2025.2+computecanada

Starting CP-SAT solver v9.10.4067
Parameters: max_time_in_seconds: 3600 max_memory_in_mb: 12000 log_search_progress: true enumerate_all_solutions: false absolute_gap_limit: 0 relative_gap_limit: 0
Setting number of workers to 48

Initial optimization model '': (model_fingerprint: 0x5d19110e92dfe75a)
#Variables: 133 (#ints: 5 in objective)
  - 84 Booleans in [0,1]
  - 49 in [0,335]
#kLinear1: 16
#kLinear2: 146
#kLinear3: 52
#kLinearN: 398 (#terms: 3'380)

Starting presolve at 0.00s
  1.71e-04s  0.00e+00d  [DetectDominanceRelations] 
  5.57e-03s  0.00e+00d  [PresolveToFixPoint] #num_loops=6 #num_dual_strengthening=3 
  1.41e-05s  0.00e+00d  [ExtractEncodingFromLinear] #potential_supersets=3 
[Symmetry] Graph for symmetry has 622 nodes and 1'917 arcs.
[Symmetry] Symmetry computation done. time: 0.000699347 dtime: 0.00019786
[SAT presolve] num removable Booleans: 0 / 34
[SAT presolve] num trivial clauses: 0
[SAT presolve] [0s] clauses:10 literals:29 vars:15 one_side_vars:11 simple_definition:4 singleton_clauses:0
[SAT presolve] [4.7432e-05s] clauses:10 literals:29 vars:15 one_side_vars:11 simple_definition:4 singleton_clauses:0
[SAT presolve] [6.0859e-05s] clauses:10 literals:29 vars:15 one_side_vars:11 simple_definition:4 singleton_clauses:0
  1.40e-03s  1.15e-04d  [Probe] #probed=134 #fixed_bools=2 #new_bounds=4 #new_binary_clauses=3 
  1.71e-05s  0.00e+00d  [MaxClique] 
  1.60e-04s  0.00e+00d  [DetectDominanceRelations] 
  1.54e-03s  0.00e+00d  [PresolveToFixPoint] #num_loops=2 #num_dual_strengthening=1 
  4.62e-04s  0.00e+00d  [ProcessAtMostOneAndLinear] 
  3.86e-04s  0.00e+00d  [DetectDuplicateConstraints] #duplicates=86 #without_enforcements=14 
  1.29e-04s  3.66e-06d  [DetectDominatedLinearConstraints] #relevant_constraints=204 #num_inclusions=37 #num_redundant=5 
  1.01e-04s  0.00e+00d  [DetectDifferentVariables] #different=12 
  5.86e-05s  1.33e-06d  [ProcessSetPPC] #relevant_constraints=121 
  7.80e-06s  0.00e+00d  [FindAlmostIdenticalLinearConstraints] 
  3.91e-05s  1.81e-05d  [FindBigAtMostOneAndLinearOverlap] 
  1.90e-04s  7.00e-05d  [FindBigVerticalLinearOverlap] 
  2.67e-05s  4.16e-06d  [FindBigHorizontalLinearOverlap] #linears=112 
  2.19e-05s  1.35e-07d  [MergeClauses] 
  1.40e-04s  0.00e+00d  [DetectDominanceRelations] 
  1.17e-03s  0.00e+00d  [PresolveToFixPoint] #num_loops=1 #num_dual_strengthening=1 
  1.40e-04s  0.00e+00d  [DetectDominanceRelations] 
  1.16e-03s  0.00e+00d  [PresolveToFixPoint] #num_loops=1 #num_dual_strengthening=1 
[Symmetry] Graph for symmetry has 522 nodes and 1'663 arcs.
[Symmetry] Symmetry computation done. time: 0.000132473 dtime: 0.00014545
[SAT presolve] num removable Booleans: 0 / 32
[SAT presolve] num trivial clauses: 0
[SAT presolve] [0s] clauses:10 literals:29 vars:15 one_side_vars:11 simple_definition:4 singleton_clauses:0
[SAT presolve] [3.2051e-05s] clauses:10 literals:29 vars:15 one_side_vars:11 simple_definition:4 singleton_clauses:0
[SAT presolve] [4.387e-05s] clauses:10 literals:29 vars:15 one_side_vars:11 simple_definition:4 singleton_clauses:0
  1.17e-03s  1.08e-04d  [Probe] #probed=130 #new_bounds=12 #new_binary_clauses=3 
  1.47e-05s  0.00e+00d  [MaxClique] 
  1.40e-04s  0.00e+00d  [DetectDominanceRelations] 
  2.12e-03s  0.00e+00d  [PresolveToFixPoint] #num_loops=4 #num_dual_strengthening=3 
  4.15e-04s  0.00e+00d  [ProcessAtMostOneAndLinear] 
  2.83e-04s  0.00e+00d  [DetectDuplicateConstraints] #without_enforcements=14 
  1.17e-04s  3.55e-06d  [DetectDominatedLinearConstraints] #relevant_constraints=199 #num_inclusions=29 
  8.93e-05s  0.00e+00d  [DetectDifferentVariables] #different=12 
  5.82e-05s  1.33e-06d  [ProcessSetPPC] #relevant_constraints=121 
  7.52e-06s  0.00e+00d  [FindAlmostIdenticalLinearConstraints] 
  4.02e-05s  1.81e-05d  [FindBigAtMostOneAndLinearOverlap] 
  1.96e-04s  7.00e-05d  [FindBigVerticalLinearOverlap] 
  2.67e-05s  4.16e-06d  [FindBigHorizontalLinearOverlap] #linears=112 
  1.72e-05s  1.35e-07d  [MergeClauses] 
  1.39e-04s  0.00e+00d  [DetectDominanceRelations] 
  1.16e-03s  0.00e+00d  [PresolveToFixPoint] #num_loops=1 #num_dual_strengthening=1 
  1.35e-04s  0.00e+00d  [DetectDominanceRelations] 
  1.15e-03s  0.00e+00d  [PresolveToFixPoint] #num_loops=1 #num_dual_strengthening=1 
[Symmetry] Graph for symmetry has 522 nodes and 1'663 arcs.
[Symmetry] Symmetry computation done. time: 0.000137228 dtime: 0.00014545
[SAT presolve] num removable Booleans: 0 / 32
[SAT presolve] num trivial clauses: 0
[SAT presolve] [0s] clauses:10 literals:29 vars:15 one_side_vars:11 simple_definition:4 singleton_clauses:0
[SAT presolve] [3.0114e-05s] clauses:10 literals:29 vars:15 one_side_vars:11 simple_definition:4 singleton_clauses:0
[SAT presolve] [4.1672e-05s] clauses:10 literals:29 vars:15 one_side_vars:11 simple_definition:4 singleton_clauses:0
  1.14e-03s  1.04e-04d  [Probe] #probed=130 #new_binary_clauses=3 
  1.45e-05s  0.00e+00d  [MaxClique] 
  1.40e-04s  0.00e+00d  [DetectDominanceRelations] 
  1.18e-03s  0.00e+00d  [PresolveToFixPoint] #num_loops=1 #num_dual_strengthening=1 
  4.11e-04s  0.00e+00d  [ProcessAtMostOneAndLinear] 
  2.88e-04s  0.00e+00d  [DetectDuplicateConstraints] #without_enforcements=14 
  1.16e-04s  3.55e-06d  [DetectDominatedLinearConstraints] #relevant_constraints=199 #num_inclusions=29 
  8.83e-05s  0.00e+00d  [DetectDifferentVariables] #different=12 
  5.80e-05s  1.33e-06d  [ProcessSetPPC] #relevant_constraints=121 
  7.88e-06s  0.00e+00d  [FindAlmostIdenticalLinearConstraints] 
  3.72e-05s  1.81e-05d  [FindBigAtMostOneAndLinearOverlap] 
  1.93e-04s  7.00e-05d  [FindBigVerticalLinearOverlap] 
  2.70e-05s  4.16e-06d  [FindBigHorizontalLinearOverlap] #linears=112 
  1.76e-05s  1.35e-07d  [MergeClauses] 
  1.44e-04s  0.00e+00d  [DetectDominanceRelations] 
  1.17e-03s  0.00e+00d  [PresolveToFixPoint] #num_loops=1 #num_dual_strengthening=1 
  2.01e-05s  0.00e+00d  [ExpandObjective] #entries=18 #tight_variables=9 #tight_constraints=3 

Presolve summary:
  - 18 affine relations were detected.
  - rule 'TODO dual: only one blocking constraint?' was applied 371 times.
  - rule 'TODO dual: only one unspecified blocking constraint?' was applied 65 times.
  - rule 'TODO duplicate: identical constraint with different enforcements' was applied 42 times.
  - rule 'TODO linear2: contains a Boolean.' was applied 20 times.
  - rule 'affine: new relation' was applied 18 times.
  - rule 'bool_or: implications' was applied 1 time.
  - rule 'deductions: 48 stored' was applied 1 time.
  - rule 'dual: fix variable' was applied 8 times.
  - rule 'dual: reduced domain' was applied 20 times.
  - rule 'duplicate: merged rhs of linear constraint' was applied 8 times.
  - rule 'duplicate: removed constraint' was applied 86 times.
  - rule 'enforcement: false literal' was applied 8 times.
  - rule 'enforcement: true literal' was applied 8 times.
  - rule 'incompatible linear: add implication' was applied 9 times.
  - rule 'linear inclusion: redundant containing constraint' was applied 4 times.
  - rule 'linear inclusion: redundant included constraint' was applied 1 time.
  - rule 'linear1: always true' was applied 1 time.
  - rule 'linear2: contains a Boolean.' was applied 11 times.
  - rule 'linear: always true' was applied 194 times.
  - rule 'linear: doubleton free' was applied 6 times.
  - rule 'linear: empty' was applied 14 times.
  - rule 'linear: extracted enforcement literal' was applied 374 times.
  - rule 'linear: fixed or dup variables' was applied 388 times.
  - rule 'linear: negative clause' was applied 10 times.
  - rule 'linear: positive equal one' was applied 3 times.
  - rule 'linear: reduced variable domains' was applied 52 times.
  - rule 'linear: remapped using affine relations' was applied 354 times.
  - rule 'linear: simplified rhs' was applied 1'018 times.
  - rule 'linear: variable substitution 1' was applied 6 times.
  - rule 'presolve: 40 unused variables removed.' was applied 1 time.
  - rule 'presolve: iteration' was applied 3 times.

Presolved optimization model '': (model_fingerprint: 0x11059c38b0df9e6c)
#Variables: 69 (#ints: 5 in objective)
  - 32 Booleans in [0,1]
  - 2 in [0,210]
  - 1 in [0,215]
  - 1 in [0,234]
  - 3 in [0,268]
  - 1 in [0,271]
  - 1 in [0,280]
  - 4 in [0,281]
  - 4 in [0,312]
  - 2 in [7,217]
  - 1 in [37,308]
  - 2 in [44,324]
  - 1 in [49,259]
  - 1 in [50,330]
  - 1 in [70,280]
  - 2 in [90,324]
  - 1 in [96,330]
  - 3 in [109,324]
  - 3 in [114,324]
  - 1 in [115,330]
  - 1 in [120,330]
  - 1 in [131,335]
#kBoolAnd: 1 (#enforced: 1) (#literals: 2)
#kBoolOr: 9 (#literals: 27)
#kExactlyOne: 3 (#literals: 9)
#kLinear1: 14 (#enforced: 14 #multi: 9)
#kLinear2: 80 (#enforced: 54 #multi: 39)
#kLinear3: 56 (#enforced: 44 #multi: 23)
#kLinearN: 117 (#enforced: 73) (#terms: 852)

Preloading model.
#Bound   0.03s best:inf   next:[180,1323] initial_domain
[Symmetry] Graph for symmetry has 458 nodes and 1'663 arcs.
[Symmetry] Symmetry computation done. time: 0.000134755 dtime: 0.00014161
#Model   0.03s var:69/69 constraints:280/280

Starting search at 0.03s with 48 workers.
16 full problem subsolvers: [core, default_lp, lb_tree_search, max_lp, no_lp, objective_lb_search, objective_lb_search_max_lp, objective_lb_search_no_lp, objective_shaving_search_max_lp, objective_shaving_search_no_lp, probing, probing_max_lp, pseudo_costs, quick_restart, quick_restart_no_lp, reduced_costs]
30 first solution subsolvers: [fj_long_default(2), fj_long_lin_default, fj_long_lin_perturb, fj_long_lin_random, fj_long_perturb, fj_long_random, fj_short_default(2), fj_short_lin_default(2), fj_short_lin_perturb, fj_short_lin_random, fj_short_perturb, fj_short_random, fs_random(4), fs_random_no_lp(4), fs_random_quick_restart(4), fs_random_quick_restart_no_lp(3)]
13 incomplete subsolvers: [feasibility_pump, graph_arc_lns, graph_cst_lns, graph_dec_lns, graph_var_lns, rins/rens, rnd_cst_lns, rnd_var_lns, violation_ls(5)]
3 helper subsolvers: [neighborhood_helper, synchronization_agent, update_gap_integral]
#Bound   0.03s best:inf   next:[181,1323] bool_core (num_cores=1 [size:1 mw:1] a=5 d=0 fixed=0/46 clauses=21)
#1       0.04s best:568   next:[181,567]  no_lp (fixed_bools=0/55)
#Bound   0.04s best:568   next:[182,567]  quick_restart_no_lp
#2       0.04s best:567   next:[182,566]  violation_ls(batch:1 #solutions_imported:1 #lin_moves:0 #lin_evals:7 #gen_moves:4 #gen_evals:0 #comp_moves:4 #backtracks:0 #weight_updates:0)
#Bound   0.04s best:567   next:[193,566]  quick_restart
#Bound   0.04s best:567   next:[202,566]  objective_lb_search_no_lp
#3       0.04s best:566   next:[202,565]  quick_restart_no_lp (fixed_bools=0/82)
#4       0.04s best:565   next:[202,564]  violation_ls(batch:1 #solutions_imported:1 #lin_moves:8 #lin_evals:39 #weight_updates:4)
#5       0.04s best:558   next:[202,557]  no_lp (fixed_bools=0/57)
#6       0.04s best:538   next:[202,537]  no_lp (fixed_bools=0/61)
#Bound   0.04s best:538   next:[203,537]  bool_core (num_cores=3 [cover] a=4 d=1 fixed=21/108 clauses=227)
#Bound   0.04s best:538   next:[204,537]  bool_core (num_cores=3 [cover] a=4 d=1 fixed=22/111 clauses=248)
#Bound   0.04s best:538   next:[205,537]  bool_core (num_cores=3 [cover] a=4 d=1 fixed=23/114 clauses=270)
#Bound   0.04s best:538   next:[206,537]  bool_core (num_cores=3 [cover] a=4 d=1 fixed=24/117 clauses=293)
#Bound   0.04s best:538   next:[207,537]  bool_core (num_cores=3 [cover] a=4 d=1 fixed=25/120 clauses=317)
#Bound   0.04s best:538   next:[208,537]  bool_core (num_cores=3 [cover] a=4 d=1 fixed=26/123 clauses=342)
#Bound   0.04s best:538   next:[209,537]  bool_core (num_cores=3 [cover] a=4 d=1 fixed=27/126 clauses=368)
#7       0.04s best:480   next:[209,479]  quick_restart_no_lp (fixed_bools=0/87)
#Bound   0.04s best:480   next:[210,479]  bool_core (num_cores=3 [cover] a=4 d=1 fixed=28/129 clauses=395)
#Bound   0.04s best:480   next:[211,479]  bool_core (num_cores=3 [cover] a=4 d=1 fixed=29/132 clauses=423)
#8       0.04s best:465   next:[211,464]  no_lp (fixed_bools=0/67)
#Bound   0.04s best:465   next:[212,464]  bool_core (num_cores=3 [cover] a=4 d=1 fixed=30/135 clauses=452)
#Bound   0.04s best:465   next:[213,464]  bool_core (num_cores=3 [cover] a=4 d=1 fixed=31/138 clauses=482)
#Bound   0.04s best:465   next:[214,464]  bool_core (num_cores=3 [cover] a=4 d=1 fixed=32/141 clauses=513)
#Bound   0.04s best:465   next:[215,464]  bool_core (num_cores=3 [cover] a=4 d=1 fixed=33/144 clauses=545)
#9       0.04s best:460   next:[215,459]  quick_restart_no_lp (fixed_bools=0/111)
#Bound   0.04s best:460   next:[216,459]  bool_core (num_cores=3 [cover] a=4 d=1 fixed=34/147 clauses=580)
#Bound   0.04s best:460   next:[233,459]  objective_lb_search_no_lp
#10      0.04s best:459   next:[233,458]  quick_restart_no_lp (fixed_bools=0/116)
#11      0.04s best:450   next:[233,449]  no_lp (fixed_bools=0/71)
#12      0.04s best:449   next:[233,448]  violation_ls(batch:2 #solutions_imported:2 #lin_moves:0 #lin_evals:82 #gen_moves:44 #gen_evals:0 #comp_moves:14 #backtracks:15 #weight_updates:0)
#13      0.04s best:434   next:[233,433]  no_lp (fixed_bools=0/78)
#14      0.04s best:429   next:[233,428]  quick_restart_no_lp (fixed_bools=1/138)
#15      0.04s best:424   next:[233,423]  no_lp (fixed_bools=0/80)
#Bound   0.04s best:424   next:[312,423]  objective_lb_search_no_lp
#16      0.05s best:421   next:[312,420]  no_lp (fixed_bools=0/89)
#17      0.05s best:399   next:[312,398]  no_lp (fixed_bools=0/92)
#18      0.05s best:385   next:[312,384]  no_lp (fixed_bools=0/95)
#19      0.05s best:380   next:[319,379]  no_lp (fixed_bools=0/105)
#20      0.05s best:373   next:[319,372]  no_lp (fixed_bools=1/105)
#21      0.06s best:359   next:[319,358]  no_lp (fixed_bools=3/109)
#Model   0.06s var:67/69 constraints:238/280
#Model   0.06s var:65/69 constraints:223/280
#Model   0.07s var:59/69 constraints:161/280
#Done    0.07s no_lp
#Model   0.07s var:58/69 constraints:153/280
#Model   0.07s var:53/69 constraints:100/280
#Bound   0.06s best:359   next:[343,358]  objective_lb_search_no_lp [skipped_logs=3]

Task timing                                  n [     min,      max]      avg      dev     time         n [     min,      max]      avg      dev    dtime
                             'core':         1 [ 37.21ms,  37.21ms]  37.21ms   0.00ns  37.21ms         1 [ 13.27ms,  13.27ms]  13.27ms   0.00ns  13.27ms
                       'default_lp':         1 [ 37.22ms,  37.22ms]  37.22ms   0.00ns  37.22ms         1 [  2.19ms,   2.19ms]   2.19ms   0.00ns   2.19ms
                 'feasibility_pump':         3 [893.47us,  10.09ms]   6.06ms   3.84ms  18.18ms         2 [  1.20ms,   1.63ms]   1.41ms 216.01us   2.83ms
                  'fj_long_default':         0 [  0.00ns,   0.00ns]   0.00ns   0.00ns   0.00ns         0 [  0.00ns,   0.00ns]   0.00ns   0.00ns   0.00ns
                  'fj_long_default':         0 [  0.00ns,   0.00ns]   0.00ns   0.00ns   0.00ns         0 [  0.00ns,   0.00ns]   0.00ns   0.00ns   0.00ns
              'fj_long_lin_default':         0 [  0.00ns,   0.00ns]   0.00ns   0.00ns   0.00ns         0 [  0.00ns,   0.00ns]   0.00ns   0.00ns   0.00ns
              'fj_long_lin_perturb':         0 [  0.00ns,   0.00ns]   0.00ns   0.00ns   0.00ns         0 [  0.00ns,   0.00ns]   0.00ns   0.00ns   0.00ns
               'fj_long_lin_random':         0 [  0.00ns,   0.00ns]   0.00ns   0.00ns   0.00ns         0 [  0.00ns,   0.00ns]   0.00ns   0.00ns   0.00ns
                  'fj_long_perturb':         0 [  0.00ns,   0.00ns]   0.00ns   0.00ns   0.00ns         0 [  0.00ns,   0.00ns]   0.00ns   0.00ns   0.00ns
                   'fj_long_random':         0 [  0.00ns,   0.00ns]   0.00ns   0.00ns   0.00ns         0 [  0.00ns,   0.00ns]   0.00ns   0.00ns   0.00ns
                 'fj_short_default':         0 [  0.00ns,   0.00ns]   0.00ns   0.00ns   0.00ns         0 [  0.00ns,   0.00ns]   0.00ns   0.00ns   0.00ns
                 'fj_short_default':         0 [  0.00ns,   0.00ns]   0.00ns   0.00ns   0.00ns         0 [  0.00ns,   0.00ns]   0.00ns   0.00ns   0.00ns
             'fj_short_lin_default':         0 [  0.00ns,   0.00ns]   0.00ns   0.00ns   0.00ns         0 [  0.00ns,   0.00ns]   0.00ns   0.00ns   0.00ns
             'fj_short_lin_default':         0 [  0.00ns,   0.00ns]   0.00ns   0.00ns   0.00ns         0 [  0.00ns,   0.00ns]   0.00ns   0.00ns   0.00ns
             'fj_short_lin_perturb':         0 [  0.00ns,   0.00ns]   0.00ns   0.00ns   0.00ns         0 [  0.00ns,   0.00ns]   0.00ns   0.00ns   0.00ns
              'fj_short_lin_random':         0 [  0.00ns,   0.00ns]   0.00ns   0.00ns   0.00ns         0 [  0.00ns,   0.00ns]   0.00ns   0.00ns   0.00ns
                 'fj_short_perturb':         0 [  0.00ns,   0.00ns]   0.00ns   0.00ns   0.00ns         0 [  0.00ns,   0.00ns]   0.00ns   0.00ns   0.00ns
                  'fj_short_random':         0 [  0.00ns,   0.00ns]   0.00ns   0.00ns   0.00ns         0 [  0.00ns,   0.00ns]   0.00ns   0.00ns   0.00ns
                        'fs_random':         0 [  0.00ns,   0.00ns]   0.00ns   0.00ns   0.00ns         0 [  0.00ns,   0.00ns]   0.00ns   0.00ns   0.00ns
                        'fs_random':         0 [  0.00ns,   0.00ns]   0.00ns   0.00ns   0.00ns         0 [  0.00ns,   0.00ns]   0.00ns   0.00ns   0.00ns
                        'fs_random':         0 [  0.00ns,   0.00ns]   0.00ns   0.00ns   0.00ns         0 [  0.00ns,   0.00ns]   0.00ns   0.00ns   0.00ns
                        'fs_random':         1 [  1.36ms,   1.36ms]   1.36ms   0.00ns   1.36ms         0 [  0.00ns,   0.00ns]   0.00ns   0.00ns   0.00ns
                  'fs_random_no_lp':         0 [  0.00ns,   0.00ns]   0.00ns   0.00ns   0.00ns         0 [  0.00ns,   0.00ns]   0.00ns   0.00ns   0.00ns
                  'fs_random_no_lp':         0 [  0.00ns,   0.00ns]   0.00ns   0.00ns   0.00ns         0 [  0.00ns,   0.00ns]   0.00ns   0.00ns   0.00ns
                  'fs_random_no_lp':         0 [  0.00ns,   0.00ns]   0.00ns   0.00ns   0.00ns         0 [  0.00ns,   0.00ns]   0.00ns   0.00ns   0.00ns
                  'fs_random_no_lp':         1 [  1.08ms,   1.08ms]   1.08ms   0.00ns   1.08ms         0 [  0.00ns,   0.00ns]   0.00ns   0.00ns   0.00ns
          'fs_random_quick_restart':         0 [  0.00ns,   0.00ns]   0.00ns   0.00ns   0.00ns         0 [  0.00ns,   0.00ns]   0.00ns   0.00ns   0.00ns
          'fs_random_quick_restart':         0 [  0.00ns,   0.00ns]   0.00ns   0.00ns   0.00ns         0 [  0.00ns,   0.00ns]   0.00ns   0.00ns   0.00ns
          'fs_random_quick_restart':         0 [  0.00ns,   0.00ns]   0.00ns   0.00ns   0.00ns         0 [  0.00ns,   0.00ns]   0.00ns   0.00ns   0.00ns
          'fs_random_quick_restart':         1 [  1.36ms,   1.36ms]   1.36ms   0.00ns   1.36ms         0 [  0.00ns,   0.00ns]   0.00ns   0.00ns   0.00ns
    'fs_random_quick_restart_no_lp':         0 [  0.00ns,   0.00ns]   0.00ns   0.00ns   0.00ns         0 [  0.00ns,   0.00ns]   0.00ns   0.00ns   0.00ns
    'fs_random_quick_restart_no_lp':         0 [  0.00ns,   0.00ns]   0.00ns   0.00ns   0.00ns         0 [  0.00ns,   0.00ns]   0.00ns   0.00ns   0.00ns
    'fs_random_quick_restart_no_lp':         0 [  0.00ns,   0.00ns]   0.00ns   0.00ns   0.00ns         0 [  0.00ns,   0.00ns]   0.00ns   0.00ns   0.00ns
                    'graph_arc_lns':         3 [  1.51ms,   7.19ms]   4.05ms   2.36ms  12.15ms         2 [ 10.00ns, 132.38us]  66.19us  66.18us 132.39us
                    'graph_cst_lns':         3 [314.62us,   1.50ms] 716.15us 551.69us   2.15ms         1 [ 10.00ns,  10.00ns]  10.00ns   0.00ns  10.00ns
                    'graph_dec_lns':         3 [  1.45ms,   2.24ms]   1.96ms 355.90us   5.87ms         3 [ 10.00ns,   5.49us]   2.42us   2.28us   7.27us
                    'graph_var_lns':         3 [  1.50ms,   3.71ms]   2.23ms   1.04ms   6.70ms         3 [ 10.00ns,  57.07us]  19.03us  26.90us  57.09us
                   'lb_tree_search':         1 [ 34.92ms,  34.92ms]  34.92ms   0.00ns  34.92ms         1 [ 23.48us,  23.48us]  23.48us   0.00ns  23.48us
                           'max_lp':         1 [ 37.22ms,  37.22ms]  37.22ms   0.00ns  37.22ms         1 [ 23.51us,  23.51us]  23.51us   0.00ns  23.51us
                            'no_lp':         1 [ 36.91ms,  36.91ms]  36.91ms   0.00ns  36.91ms         1 [  4.81ms,   4.81ms]   4.81ms   0.00ns   4.81ms
              'objective_lb_search':         1 [ 34.86ms,  34.86ms]  34.86ms   0.00ns  34.86ms         1 [843.49us, 843.49us] 843.49us   0.00ns 843.49us
       'objective_lb_search_max_lp':         1 [ 34.00ms,  34.00ms]  34.00ms   0.00ns  34.00ms         1 [820.26us, 820.26us] 820.26us   0.00ns 820.26us
        'objective_lb_search_no_lp':         1 [ 34.00ms,  34.00ms]  34.00ms   0.00ns  34.00ms         1 [  4.00ms,   4.00ms]   4.00ms   0.00ns   4.00ms
  'objective_shaving_search_max_lp':         4 [430.86us,   9.35ms]   3.74ms   3.65ms  14.96ms         1 [143.94us, 143.94us] 143.94us   0.00ns 143.94us
   'objective_shaving_search_no_lp':         4 [764.78us,  10.31ms]   4.70ms   3.53ms  18.82ms         1 [215.91us, 215.91us] 215.91us   0.00ns 215.91us
                          'probing':         1 [ 34.83ms,  34.83ms]  34.83ms   0.00ns  34.83ms         1 [  1.05ms,   1.05ms]   1.05ms   0.00ns   1.05ms
                   'probing_max_lp':         1 [ 34.48ms,  34.48ms]  34.48ms   0.00ns  34.48ms         1 [ 22.41us,  22.41us]  22.41us   0.00ns  22.41us
                     'pseudo_costs':         1 [ 35.42ms,  35.42ms]  35.42ms   0.00ns  35.42ms         1 [720.52us, 720.52us] 720.52us   0.00ns 720.52us
                    'quick_restart':         1 [ 37.14ms,  37.14ms]  37.14ms   0.00ns  37.14ms         1 [  1.49ms,   1.49ms]   1.49ms   0.00ns   1.49ms
              'quick_restart_no_lp':         1 [ 34.95ms,  34.95ms]  34.95ms   0.00ns  34.95ms         1 [  4.93ms,   4.93ms]   4.93ms   0.00ns   4.93ms
                    'reduced_costs':         1 [ 35.49ms,  35.49ms]  35.49ms   0.00ns  35.49ms         1 [787.96us, 787.96us] 787.96us   0.00ns 787.96us
                        'rins/rens':         3 [ 76.08us,   5.73ms]   3.71ms   2.58ms  11.14ms         2 [168.05us, 251.78us] 209.92us  41.86us 419.83us
                      'rnd_cst_lns':         3 [363.26us,   1.16ms] 659.09us 357.37us   1.98ms         1 [ 10.00ns,  10.00ns]  10.00ns   0.00ns  10.00ns
                      'rnd_var_lns':         3 [  1.01ms,   1.57ms]   1.34ms 238.00us   4.01ms         3 [ 10.00ns,  10.00ns]  10.00ns   0.00ns  30.00ns
                     'violation_ls':         3 [  1.04ms,   4.21ms]   2.16ms   1.45ms   6.48ms         3 [187.70us,   1.57ms] 709.56us 612.04us   2.13ms
                     'violation_ls':         3 [389.67us,   5.19ms]   3.10ms   2.01ms   9.29ms         3 [ 21.53us,   1.92ms]   1.13ms 806.37us   3.38ms
                     'violation_ls':         3 [410.35us,  11.07ms]   3.97ms   5.02ms  11.92ms         3 [  8.41us,   4.67ms]   1.58ms   2.18ms   4.74ms
                     'violation_ls':         3 [588.48us,   4.15ms]   2.02ms   1.54ms   6.06ms         3 [ 42.94us,   1.65ms] 694.43us 693.33us   2.08ms
                     'violation_ls':         3 [778.57us,   3.98ms]   1.94ms   1.45ms   5.81ms         3 [205.66us,   1.27ms] 567.79us 493.35us   1.70ms

Search stats                        Bools  Conflicts  Branches  Restarts  BoolPropag  IntegerPropag
                           'core':    278        113     1'591       594      48'970         26'304
                     'default_lp':     67         25       158        83         287          3'052
                      'fs_random':      0          0         0         0           0              0
                      'fs_random':      0          0         0         0           0              0
                      'fs_random':      0          0         0         0           0              0
                      'fs_random':     41          0         0         0           0              0
                'fs_random_no_lp':      0          0         0         0           0              0
                'fs_random_no_lp':      0          0         0         0           0              0
                'fs_random_no_lp':      0          0         0         0           0              0
                'fs_random_no_lp':     41          0         0         0           0              0
        'fs_random_quick_restart':      0          0         0         0           0              0
        'fs_random_quick_restart':      0          0         0         0           0              0
        'fs_random_quick_restart':      0          0         0         0           0              0
        'fs_random_quick_restart':     41          0         0         0           0              0
  'fs_random_quick_restart_no_lp':      0          0         0         0           0              0
  'fs_random_quick_restart_no_lp':      0          0         0         0           0              0
  'fs_random_quick_restart_no_lp':      0          0         0         0           0              0
                 'lb_tree_search':     41          0        82        82          37            382
                         'max_lp':     41          0        82        82          37            382
                          'no_lp':    111        134     1'476       432       5'515         28'195
            'objective_lb_search':     45          3        87        83          86            734
     'objective_lb_search_max_lp':     41          0        82        82          53            516
      'objective_lb_search_no_lp':     52        194       789       331       2'595         24'509
                        'probing':     43          0        86        86          53            438
                 'probing_max_lp':     41          0        82        82          37            382
                   'pseudo_costs':     41          0        82        82          53            516
                  'quick_restart':     64          2       142        83          81          1'232
            'quick_restart_no_lp':    145        120     1'534       423       6'808         28'122
                  'reduced_costs':     41          0        82        82          53            516

SAT stats                           ClassicMinim  LitRemoved  LitLearned  LitForgotten  Subsumed  MClauses  MDecisions  MLitTrue  MSubsumed  MLitRemoved  MReused
                           'core':            40          99         157             0         0       190         794         0         39          119        4
                     'default_lp':            18          28         204             0         0         0           0         0          0            0        0
                      'fs_random':             0           0           0             0         0         0           0         0          0            0        0
                      'fs_random':             0           0           0             0         0         0           0         0          0            0        0
                      'fs_random':             0           0           0             0         0         0           0         0          0            0        0
                      'fs_random':             0           0           0             0         0         0           0         0          0            0        0
                'fs_random_no_lp':             0           0           0             0         0         0           0         0          0            0        0
                'fs_random_no_lp':             0           0           0             0         0         0           0         0          0            0        0
                'fs_random_no_lp':             0           0           0             0         0         0           0         0          0            0        0
                'fs_random_no_lp':             0           0           0             0         0         0           0         0          0            0        0
        'fs_random_quick_restart':             0           0           0             0         0         0           0         0          0            0        0
        'fs_random_quick_restart':             0           0           0             0         0         0           0         0          0            0        0
        'fs_random_quick_restart':             0           0           0             0         0         0           0         0          0            0        0
        'fs_random_quick_restart':             0           0           0             0         0         0           0         0          0            0        0
  'fs_random_quick_restart_no_lp':             0           0           0             0         0         0           0         0          0            0        0
  'fs_random_quick_restart_no_lp':             0           0           0             0         0         0           0         0          0            0        0
  'fs_random_quick_restart_no_lp':             0           0           0             0         0         0           0         0          0            0        0
                 'lb_tree_search':             0           0           0             0         0         0           0         0          0            0        0
                         'max_lp':             0           0           0             0         0         0           0         0          0            0        0
                          'no_lp':            60         122         665             0        19        94         483         0         14           60       14
            'objective_lb_search':             2           4           6             0         0         0           0         0          0            0        0
     'objective_lb_search_max_lp':             0           0           0             0         0         0           0         0          0            0        0
      'objective_lb_search_no_lp':           150         364         707             0        15        66         326         0          0            1        6
                        'probing':             0           0           0             0         0         0           0         0          0            0        0
                 'probing_max_lp':             0           0           0             0         0         0           0         0          0            0        0
                   'pseudo_costs':             0           0           0             0         0         0           0         0          0            0        0
                  'quick_restart':             1           1          14             0         0         0           0         0          0            0        0
            'quick_restart_no_lp':            66         171         771             0         8        84         452         1         20          113        6
                  'reduced_costs':             0           0           0             0         0         0           0         0          0            0        0

Lp stats                         Component  Iterations  AddedCuts  OPTIMAL  DUAL_F.  DUAL_U.
                  'default_lp':          1         216        251       64        1        0
                   'fs_random':          1           0          0        0        0        0
     'fs_random_quick_restart':          1           0          0        0        0        0
              'lb_tree_search':          1          76        273        3        0        0
                      'max_lp':          1          74        301        3        0        0
         'objective_lb_search':          1         102        331       23        0        0
  'objective_lb_search_max_lp':          1         119        306       11        0        0
                     'probing':          1         117        297       33        0        0
              'probing_max_lp':          1          61        294        3        0        0
                'pseudo_costs':          1         111        300       11        0        0
               'quick_restart':          1         146        295       49        0        0
               'reduced_costs':          1         116        325       11        0        0

Lp dimension                                                                    Final dimension of first component
                  'default_lp':   141 rows, 68 columns, 631 entries with magnitude in [8.061090e-04, 1.000000e+00]
                   'fs_random':       0 rows, 68 columns, 0 entries with magnitude in [0.000000e+00, 0.000000e+00]
     'fs_random_quick_restart':       0 rows, 68 columns, 0 entries with magnitude in [0.000000e+00, 0.000000e+00]
              'lb_tree_search':  330 rows, 69 columns, 1813 entries with magnitude in [5.055545e-03, 1.000000e+00]
                      'max_lp':  330 rows, 69 columns, 1814 entries with magnitude in [5.055545e-03, 1.000000e+00]
         'objective_lb_search':   142 rows, 68 columns, 734 entries with magnitude in [1.153926e-03, 1.000000e+00]
  'objective_lb_search_max_lp':   155 rows, 69 columns, 639 entries with magnitude in [3.227929e-03, 1.000000e+00]
                     'probing':   144 rows, 68 columns, 722 entries with magnitude in [5.590105e-04, 1.000000e+00]
              'probing_max_lp':  330 rows, 69 columns, 1818 entries with magnitude in [4.618758e-03, 1.000000e+00]
                'pseudo_costs':   163 rows, 69 columns, 681 entries with magnitude in [3.274530e-03, 1.000000e+00]
               'quick_restart':   171 rows, 68 columns, 886 entries with magnitude in [9.697515e-05, 1.000000e+00]
               'reduced_costs':   166 rows, 69 columns, 717 entries with magnitude in [3.227929e-03, 1.000000e+00]

Lp debug                         CutPropag  CutEqPropag  Adjust  Overflow  Bad  BadScaling
                  'default_lp':          0            0      35         0  140           0
                   'fs_random':          0            0       0         0    0           0
     'fs_random_quick_restart':          0            0       0         0    0           0
              'lb_tree_search':          0            0       2         0  113           0
                      'max_lp':          0            0       2         0  122           0
         'objective_lb_search':          0            0      13         0  221           0
  'objective_lb_search_max_lp':          0            0       6         0  225           0
                     'probing':          0            0      18         0  206           0
              'probing_max_lp':          0            0       0         0  105           0
                'pseudo_costs':          0            0       6         0  197           0
               'quick_restart':          2            0      21         0  173           0
               'reduced_costs':          0            0       6         0  163           0

Lp pool                          Constraints  Updates  Simplif  Merged  Shortened  Split  Strenghtened  Cuts/Call
                  'default_lp':          335      105      106       1          0      1           210    251/385
                   'fs_random':           85        0        0       0          0      0             0        0/0
     'fs_random_quick_restart':           85        0        0       0          0      0             0        0/0
              'lb_tree_search':          553        1        0       0          0      1            61    273/459
                      'max_lp':          581        1        0       0          0      0            60    301/464
         'objective_lb_search':          410       85      199       6         46      3           320    331/519
  'objective_lb_search_max_lp':          582       45      377       4          0      0           964    306/486
                     'probing':          382        5        0       0          0      0            48    297/441
              'probing_max_lp':          574        0        0       0          0      0            69    294/456
                'pseudo_costs':          575       46      379       5          0      1           953    300/471
               'quick_restart':          379      132      117       1          0      8           251    295/494
               'reduced_costs':          600       50      377       5          0      0           959    325/512

Lp Cut            defaul  max_lp  quick_  reduce  pseudo  lb_tre  probin  object  probin  object
          CG_FF:      24      51      21      28      24      43      29      30      54      32
           CG_K:      14      16      13      10       7      14      21      23      13      10
           CG_R:      14      36      12       9       9      34      23      19      41      14
          CG_RB:      34      37      41      53      38      31      30      42      42      42
         CG_RBP:      12      16       6       7       3      12       9      10      13       3
             IB:      65      52      62      55      54      52      58      79      52      54
       MIR_1_FF:      10      20      13      18      17      20      10      13      17      19
        MIR_1_K:       4       5       4       4       4       5       2      10       4       4
        MIR_1_R:       5       4       5       3       4       3       2      11       4       4
       MIR_1_RB:      15      17      27      11      13      16      15      15      14      15
      MIR_1_RBP:       2       4       1       1       1       3       1       2       4       1
      MIR_1_RLT:       -       2       -       3       3       2       -       -       2       3
       MIR_2_FF:       4       4      13      13      10       1      13       8       7       9
        MIR_2_K:       2       3       9       1       1       3       5       3       2       1
        MIR_2_R:       3       2      10      11       9       1       8       6       5       8
       MIR_2_RB:       6       3      16      15      10       5      12       8       7       8
      MIR_2_RBP:       1       -       1       5       3       3       1       2       2       3
       MIR_3_FF:       2       2       3       3       6       3       6       5       1       4
        MIR_3_K:       -       2       1       -       2       -       3       -       -       1
       MIR_3_KL:       -       -       -       -       1       -       -       -       -       -
        MIR_3_R:       3       1       5       4      10       2      10       2       1       6
       MIR_3_RB:       4       4       5       3       7       2       9       6       1       4
      MIR_3_RBP:       2       2       1       -       2       1       3       1       1       3
       MIR_4_FF:       -       1       1       4       4       1       2       3       -       2
        MIR_4_K:       -       -       -       1       3       -       -       -       -       2
        MIR_4_R:       -       1       -       4       5       1       -       -       -       4
       MIR_4_RB:       1       1       1       3       3       -       2       3       -       2
      MIR_4_RBP:       -       -       -       2       -       -       -       -       -       1
       MIR_5_FF:       -       -       -       2       -       -       -       1       -       1
       MIR_5_KL:       -       -       -       1       -       -       -       -       -       -
        MIR_5_R:       -       -       -       2       -       -       -       -       -       1
       MIR_5_RB:       -       -       1       2       -       -       -       1       -       1
      MIR_5_RBP:       -       -       -       1       -       -       -       -       -       -
       MIR_6_FF:       -       -       -       -       -       -       -       -       -       1
        MIR_6_K:       -       -       -       -       -       -       -       -       -       1
        MIR_6_R:       -       -       -       -       -       -       -       -       -       1
       MIR_6_RB:       -       -       -       -       -       -       -       -       -       1
   ZERO_HALF_FF:       8       6       8      15      14       6       8       8       3      13
    ZERO_HALF_K:       1       -       -       -       -       -       3       2       -       -
    ZERO_HALF_R:       9       5       9      16      19       5       9      10       2      13
   ZERO_HALF_RB:       5       2       6      12      11       2       2       6       1      11
  ZERO_HALF_RBP:       1       2       -       3       3       2       1       2       1       3

LNS stats           Improv/Calls  Closed  Difficulty  TimeLimit
  'graph_arc_lns':           1/2    100%        0.81       0.10
  'graph_cst_lns':           0/1    100%        0.71       0.10
  'graph_dec_lns':           0/3    100%        0.88       0.10
  'graph_var_lns':           1/3    100%        0.88       0.10
      'rins/rens':           1/2    100%        0.81       0.10
    'rnd_cst_lns':           0/1    100%        0.71       0.10
    'rnd_var_lns':           0/3    100%        0.88       0.10

LS stats                   Batches  Restarts  LinMoves  GenMoves  CompoundMoves  WeightUpdates
       'fj_long_default':        0         0         0         0              0              0
       'fj_long_default':        0         0         0         0              0              0
   'fj_long_lin_default':        0         0         0         0              0              0
   'fj_long_lin_perturb':        0         0         0         0              0              0
    'fj_long_lin_random':        0         0         0         0              0              0
       'fj_long_perturb':        0         0         0         0              0              0
        'fj_long_random':        0         0         0         0              0              0
      'fj_short_default':        0         0         0         0              0              0
      'fj_short_default':        0         0         0         0              0              0
  'fj_short_lin_default':        0         0         0         0              0              0
  'fj_short_lin_default':        0         0         0         0              0              0
  'fj_short_lin_perturb':        0         0         0         0              0              0
   'fj_short_lin_random':        0         0         0         0              0              0
      'fj_short_perturb':        0         0         0         0              0              0
       'fj_short_random':        0         0         0         0              0              0
          'violation_ls':        3         0     1'166         0              0            927
          'violation_ls':        3         0     1'223        44             14            243
          'violation_ls':        3         0       472       196             20            497
          'violation_ls':        3         0       641        29              7            217
          'violation_ls':        3         0       734       100             10            694

Solutions (21)            Num    Rank
                'no_lp':   13  [1,21]
  'quick_restart_no_lp':    5  [3,14]
         'violation_ls':    3  [2,12]

Objective bounds                Num
                  'bool_core':   15
             'initial_domain':    1
  'objective_lb_search_no_lp':    7
              'quick_restart':    1
        'quick_restart_no_lp':    1

Solution repositories    Added  Queried  Ignored  Synchro
  'feasible solutions':     47       59        0       34
        'lp solutions':      0        0        0        0
                'pump':     38        2

Improving bounds shared         Num
                       'core':    3
                      'no_lp':  364
        'objective_lb_search':    1
  'objective_lb_search_no_lp':    5
        'quick_restart_no_lp':   59

Clauses shared                  Num
                 'default_lp':    2
                      'no_lp':   19
  'objective_lb_search_no_lp':    1
        'quick_restart_no_lp':   20

CpSolverResponse summary:
status: OPTIMAL
objective: 359
best_bound: 359
integers: 0
booleans: 0
conflicts: 0
branches: 0
propagations: 0
integer_propagations: 0
restarts: 0
lp_iterations: 0
walltime: 0.0740003
usertime: 0.0740004
deterministic_time: 0.05346
gap_integral: 0.044087
solution_fingerprint: 0xfb785891db001d42


--- Simulation Gantt  partir du modle mathmatique ---
{'big':1, 'due_date':76, 'pos_time':5, 'status':2, 'blocked':0, 'operations':["{'type':0, 'processing_time':57}", "{'type':1, 'processing_time':50}"]}
{'big':0, 'due_date':120, 'pos_time':5, 'status':2, 'blocked':1, 'operations':["{'type':0, 'processing_time':31}", "{'type':1, 'processing_time':22}"]}
{'big':0, 'due_date':101, 'pos_time':5, 'status':2, 'blocked':0, 'operations':["{'type':0, 'processing_time':18}"]}
{'big':0, 'due_date':55, 'pos_time':5, 'status':2, 'blocked':0, 'operations':["{'type':1, 'processing_time':49}"]}
