created virtual environment CPython3.12.4.final.0-64 in 348ms
  creator CPython3Posix(dest=/localscratch/aneumann.46806158.0/env, clear=False, no_vcs_ignore=False, global=False)
  seeder FromAppData(download=False, pip=bundle, via=copy, app_data_dir=/home/aneumann/.local/share/virtualenv)
    added seed packages: pip==24.2+computecanada
  activators BashActivator,CShellActivator,FishActivator,NushellActivator,PowerShellActivator,PythonActivator
Looking in links: /cvmfs/soft.computecanada.ca/custom/python/wheelhouse/gentoo2023/x86-64-v3, /cvmfs/soft.computecanada.ca/custom/python/wheelhouse/gentoo2023/generic, /cvmfs/soft.computecanada.ca/custom/python/wheelhouse/generic
Requirement already satisfied: pip in /localscratch/aneumann.46806158.0/env/lib/python3.12/site-packages (24.2+computecanada)
Processing /cvmfs/soft.computecanada.ca/custom/python/wheelhouse/generic/pip-25.0+computecanada-py3-none-any.whl
Installing collected packages: pip
  Attempting uninstall: pip
    Found existing installation: pip 24.2+computecanada
    Uninstalling pip-24.2+computecanada:
      Successfully uninstalled pip-24.2+computecanada
Successfully installed pip-25.0+computecanada
Looking in links: /cvmfs/soft.computecanada.ca/custom/python/wheelhouse/gentoo2023/x86-64-v3, /cvmfs/soft.computecanada.ca/custom/python/wheelhouse/gentoo2023/generic, /cvmfs/soft.computecanada.ca/custom/python/wheelhouse/generic
ERROR: protobuf-5.28.3-cp38-abi3-manylinux2014_x86_64.whl is not a supported wheel on this platform.
Looking in links: /cvmfs/soft.computecanada.ca/custom/python/wheelhouse/gentoo2023/x86-64-v3, /cvmfs/soft.computecanada.ca/custom/python/wheelhouse/gentoo2023/generic, /cvmfs/soft.computecanada.ca/custom/python/wheelhouse/generic
Processing /home/aneumann/projects/def-adhaj/aneumann/GNRS/wheels/immutabledict-4.2.0-py3-none-any.whl
Installing collected packages: immutabledict
Successfully installed immutabledict-4.2.0
Looking in links: /cvmfs/soft.computecanada.ca/custom/python/wheelhouse/gentoo2023/x86-64-v3, /cvmfs/soft.computecanada.ca/custom/python/wheelhouse/gentoo2023/generic, /cvmfs/soft.computecanada.ca/custom/python/wheelhouse/generic
Processing /cvmfs/soft.computecanada.ca/custom/python/wheelhouse/generic/ortools-9.10.4067+computecanada-cp312-cp312-linux_x86_64.whl (from -r /home/aneumann/projects/def-adhaj/aneumann/GNRS/requirements/or.txt (line 1))
Processing /cvmfs/soft.computecanada.ca/custom/python/wheelhouse/gentoo2023/x86-64-v3/matplotlib-3.10.0+computecanada-cp312-cp312-linux_x86_64.whl (from -r /home/aneumann/projects/def-adhaj/aneumann/GNRS/requirements/or.txt (line 2))
Processing /cvmfs/soft.computecanada.ca/custom/python/wheelhouse/gentoo2023/x86-64-v3/pandas-2.2.3+computecanada-cp312-cp312-linux_x86_64.whl (from -r /home/aneumann/projects/def-adhaj/aneumann/GNRS/requirements/or.txt (line 3))
Processing /cvmfs/soft.computecanada.ca/custom/python/wheelhouse/generic/absl_py-2.3.0+computecanada-py3-none-any.whl (from ortools<9.11,>=9.10->-r /home/aneumann/projects/def-adhaj/aneumann/GNRS/requirements/or.txt (line 1))
Processing /cvmfs/soft.computecanada.ca/custom/python/wheelhouse/gentoo2023/generic/numpy-2.2.2+computecanada-cp312-cp312-linux_x86_64.whl (from ortools<9.11,>=9.10->-r /home/aneumann/projects/def-adhaj/aneumann/GNRS/requirements/or.txt (line 1))
Processing /cvmfs/soft.computecanada.ca/custom/python/wheelhouse/gentoo2023/x86-64-v3/protobuf-6.31.1+computecanada-cp312-cp312-linux_x86_64.whl (from ortools<9.11,>=9.10->-r /home/aneumann/projects/def-adhaj/aneumann/GNRS/requirements/or.txt (line 1))
Requirement already satisfied: immutabledict>=3.0.0 in /localscratch/aneumann.46806158.0/env/lib/python3.12/site-packages (from ortools<9.11,>=9.10->-r /home/aneumann/projects/def-adhaj/aneumann/GNRS/requirements/or.txt (line 1)) (4.2.0)
Processing /cvmfs/soft.computecanada.ca/custom/python/wheelhouse/gentoo2023/generic/contourpy-1.3.1+computecanada-cp312-cp312-linux_x86_64.whl (from matplotlib->-r /home/aneumann/projects/def-adhaj/aneumann/GNRS/requirements/or.txt (line 2))
Processing /cvmfs/soft.computecanada.ca/custom/python/wheelhouse/generic/cycler-0.12.1+computecanada-py3-none-any.whl (from matplotlib->-r /home/aneumann/projects/def-adhaj/aneumann/GNRS/requirements/or.txt (line 2))
Processing /cvmfs/soft.computecanada.ca/custom/python/wheelhouse/generic/fonttools-4.59.0+computecanada-cp312-cp312-linux_x86_64.whl (from matplotlib->-r /home/aneumann/projects/def-adhaj/aneumann/GNRS/requirements/or.txt (line 2))
Processing /cvmfs/soft.computecanada.ca/custom/python/wheelhouse/gentoo2023/x86-64-v3/kiwisolver-1.4.8+computecanada-cp312-cp312-linux_x86_64.whl (from matplotlib->-r /home/aneumann/projects/def-adhaj/aneumann/GNRS/requirements/or.txt (line 2))
Processing /cvmfs/soft.computecanada.ca/custom/python/wheelhouse/generic/packaging-25.0+computecanada-py3-none-any.whl (from matplotlib->-r /home/aneumann/projects/def-adhaj/aneumann/GNRS/requirements/or.txt (line 2))
Processing /cvmfs/soft.computecanada.ca/custom/python/wheelhouse/gentoo2023/x86-64-v3/pillow-11.1.0+computecanada-cp312-cp312-linux_x86_64.whl (from matplotlib->-r /home/aneumann/projects/def-adhaj/aneumann/GNRS/requirements/or.txt (line 2))
Processing /cvmfs/soft.computecanada.ca/custom/python/wheelhouse/generic/pyparsing-3.2.3+computecanada-py3-none-any.whl (from matplotlib->-r /home/aneumann/projects/def-adhaj/aneumann/GNRS/requirements/or.txt (line 2))
Processing /cvmfs/soft.computecanada.ca/custom/python/wheelhouse/generic/python_dateutil-2.9.0.post0+computecanada-py2.py3-none-any.whl (from matplotlib->-r /home/aneumann/projects/def-adhaj/aneumann/GNRS/requirements/or.txt (line 2))
Processing /cvmfs/soft.computecanada.ca/custom/python/wheelhouse/generic/pytz-2025.2+computecanada-py2.py3-none-any.whl (from pandas->-r /home/aneumann/projects/def-adhaj/aneumann/GNRS/requirements/or.txt (line 3))
Processing /cvmfs/soft.computecanada.ca/custom/python/wheelhouse/generic/tzdata-2025.2+computecanada-py2.py3-none-any.whl (from pandas->-r /home/aneumann/projects/def-adhaj/aneumann/GNRS/requirements/or.txt (line 3))
Processing /cvmfs/soft.computecanada.ca/custom/python/wheelhouse/generic/six-1.17.0+computecanada-py2.py3-none-any.whl (from python-dateutil>=2.7->matplotlib->-r /home/aneumann/projects/def-adhaj/aneumann/GNRS/requirements/or.txt (line 2))
Installing collected packages: pytz, tzdata, six, pyparsing, protobuf, pillow, packaging, numpy, kiwisolver, fonttools, cycler, absl-py, python-dateutil, contourpy, pandas, matplotlib, ortools
Successfully installed absl-py-2.3.0+computecanada contourpy-1.3.1+computecanada cycler-0.12.1+computecanada fonttools-4.59.0+computecanada kiwisolver-1.4.8+computecanada matplotlib-3.10.0+computecanada numpy-2.2.2+computecanada ortools-9.10.4067+computecanada packaging-25.0+computecanada pandas-2.2.3+computecanada pillow-11.1.0+computecanada protobuf-6.31.1+computecanada pyparsing-3.2.3+computecanada python-dateutil-2.9.0.post0+computecanada pytz-2025.2+computecanada six-1.17.0+computecanada tzdata-2025.2+computecanada

Starting CP-SAT solver v9.10.4067
Parameters: max_time_in_seconds: 86400 max_memory_in_mb: 185000 log_search_progress: true enumerate_all_solutions: false num_search_workers: 32 absolute_gap_limit: 0 relative_gap_limit: 0

Initial optimization model '': (model_fingerprint: 0x2772dbe000721543)
#Variables: 287 (#ints: 8 in objective)
  - 207 Booleans in [0,1]
  - 80 in [0,606]
#kLinear1: 40
#kLinear2: 382
#kLinear3: 155
#kLinearN: 3'099 (#terms: 46'661)

Starting presolve at 0.00s
  1.46e-03s  0.00e+00d  [DetectDominanceRelations] 
  2.24e-02s  0.00e+00d  [PresolveToFixPoint] #num_loops=8 #num_dual_strengthening=3 
  2.93e-05s  0.00e+00d  [ExtractEncodingFromLinear] #potential_supersets=5 
[Symmetry] Graph for symmetry has 3'762 nodes and 37'832 arcs.
[Symmetry] Symmetry computation done. time: 0.00143732 dtime: 0.00305591
[Symmetry] #generators: 1, average support size: 24
[Symmetry] The model contains 188 duplicate constraints !
[Symmetry] 12 orbits with sizes: 2,2,2,2,2,2,2,2,2,2,...
[Symmetry] Num fixable by intersecting at_most_one with orbits: 1 largest_orbit: 2
  8.32e-03s  1.94e-03d  [Probe] #probed=304 #new_bounds=5 #equiv=1 
  8.00e-05s  0.00e+00d  [MaxClique] Merged 17(34 literals) into 8(16 literals) at_most_ones. 
  1.36e-03s  0.00e+00d  [DetectDominanceRelations] 
  9.69e-03s  0.00e+00d  [PresolveToFixPoint] #num_loops=5 #num_dual_strengthening=3 
  4.50e-03s  0.00e+00d  [ProcessAtMostOneAndLinear] 
  1.65e-03s  0.00e+00d  [DetectDuplicateConstraints] #duplicates=238 #without_enforcements=74 
  1.84e-03s  1.84e-04d  [DetectDominatedLinearConstraints] #relevant_constraints=2'723 #num_inclusions=2'150 
  3.23e-04s  0.00e+00d  [DetectDifferentVariables] #different=23 #cliques=1 #size=5 
  4.30e-04s  5.34e-05d  [ProcessSetPPC] #relevant_constraints=2'393 
  1.40e-05s  0.00e+00d  [FindAlmostIdenticalLinearConstraints] 
  1.72e-04s  2.58e-04d  [FindBigAtMostOneAndLinearOverlap] 
  4.34e-03s  3.36e-03d  [FindBigVerticalLinearOverlap] #blocks=52 #saved_nz=6'229 
  2.61e-04s  1.25e-04d  [FindBigHorizontalLinearOverlap] #linears=2'336 
  1.73e-05s  0.00e+00d  [MergeClauses] 
  1.46e-03s  0.00e+00d  [DetectDominanceRelations] 
  1.43e-02s  0.00e+00d  [PresolveToFixPoint] #num_loops=2 #num_dual_strengthening=1 
  1.46e-03s  0.00e+00d  [DetectDominanceRelations] 
  8.35e-03s  0.00e+00d  [PresolveToFixPoint] #num_loops=1 #num_dual_strengthening=1 
[Symmetry] Graph for symmetry has 3'692 nodes and 30'719 arcs.
[Symmetry] Symmetry computation done. time: 0.000605804 dtime: 0.00158603
  7.72e-03s  1.84e-03d  [Probe] #probed=304 #new_bounds=32 
  8.59e-06s  0.00e+00d  [MaxClique] 
  1.45e-03s  0.00e+00d  [DetectDominanceRelations] 
  1.27e-02s  0.00e+00d  [PresolveToFixPoint] #num_loops=2 #num_dual_strengthening=1 
  4.11e-03s  0.00e+00d  [ProcessAtMostOneAndLinear] 
  1.47e-03s  0.00e+00d  [DetectDuplicateConstraints] #without_enforcements=87 
  1.14e-03s  9.90e-05d  [DetectDominatedLinearConstraints] #relevant_constraints=2'538 #num_inclusions=444 
  1.87e-04s  0.00e+00d  [DetectDifferentVariables] 
  3.97e-04s  3.95e-05d  [ProcessSetPPC] #relevant_constraints=2'266 
  2.05e-05s  1.50e-07d  [FindAlmostIdenticalLinearConstraints] #num_tested_pairs=10 
  8.61e-05s  1.13e-04d  [FindBigAtMostOneAndLinearOverlap] 
  2.41e-03s  2.30e-03d  [FindBigVerticalLinearOverlap] #blocks=32 #saved_nz=2'085 
  2.43e-04s  1.10e-04d  [FindBigHorizontalLinearOverlap] #linears=2'223 
  8.42e-06s  0.00e+00d  [MergeClauses] 
  1.41e-03s  0.00e+00d  [DetectDominanceRelations] 
  1.23e-02s  0.00e+00d  [PresolveToFixPoint] #num_loops=2 #num_dual_strengthening=1 
  1.39e-03s  0.00e+00d  [DetectDominanceRelations] 
  8.93e-03s  0.00e+00d  [PresolveToFixPoint] #num_loops=1 #num_dual_strengthening=1 
[Symmetry] Graph for symmetry has 3'780 nodes and 28'658 arcs.
[Symmetry] Symmetry computation done. time: 0.000539574 dtime: 0.00150351
  7.17e-03s  1.77e-03d  [Probe] #probed=304 #new_bounds=22 
  9.12e-06s  0.00e+00d  [MaxClique] 
  1.40e-03s  0.00e+00d  [DetectDominanceRelations] 
  1.13e-02s  0.00e+00d  [PresolveToFixPoint] #num_loops=2 #num_dual_strengthening=1 
  3.91e-03s  0.00e+00d  [ProcessAtMostOneAndLinear] 
  1.45e-03s  0.00e+00d  [DetectDuplicateConstraints] #without_enforcements=94 
  8.55e-04s  7.78e-05d  [DetectDominatedLinearConstraints] #relevant_constraints=2'480 #num_inclusions=30 
  1.82e-04s  0.00e+00d  [DetectDifferentVariables] 
  3.71e-04s  3.45e-05d  [ProcessSetPPC] #relevant_constraints=2'185 
  2.91e-05s  5.20e-07d  [FindAlmostIdenticalLinearConstraints] #num_tested_pairs=34 
  8.36e-05s  1.04e-04d  [FindBigAtMostOneAndLinearOverlap] 
  2.08e-03s  1.99e-03d  [FindBigVerticalLinearOverlap] #blocks=32 #saved_nz=1'901 
  2.21e-04s  9.51e-05d  [FindBigHorizontalLinearOverlap] #linears=2'034 
  8.96e-06s  0.00e+00d  [MergeClauses] 
  1.32e-03s  0.00e+00d  [DetectDominanceRelations] 
  1.14e-02s  0.00e+00d  [PresolveToFixPoint] #num_loops=2 #num_dual_strengthening=1 
  7.66e-05s  0.00e+00d  [ExpandObjective] #entries=487 #tight_variables=190 #tight_constraints=109 

Presolve summary:
  - 66 affine relations were detected.
  - rule 'TODO dual: only one blocking constraint?' was applied 613 times.
  - rule 'TODO dual: only one blocking enforced constraint?' was applied 104 times.
  - rule 'TODO dual: only one unspecified blocking constraint?' was applied 65 times.
  - rule 'TODO duplicate: identical constraint with different enforcements' was applied 255 times.
  - rule 'affine: new relation' was applied 66 times.
  - rule 'at_most_one: removed literals' was applied 8 times.
  - rule 'at_most_one: size one' was applied 8 times.
  - rule 'at_most_one: transformed into max clique.' was applied 1 time.
  - rule 'deductions: 216 stored' was applied 1 time.
  - rule 'dual: fix variable' was applied 21 times.
  - rule 'dual: reduced domain' was applied 49 times.
  - rule 'duplicate: merged rhs of linear constraint' was applied 46 times.
  - rule 'duplicate: removed constraint' was applied 238 times.
  - rule 'enforcement: false literal' was applied 4 times.
  - rule 'exactly_one: x and not(x)' was applied 1 time.
  - rule 'incompatible linear: add implication' was applied 30 times.
  - rule 'linear matrix: common vertical rectangle' was applied 116 times.
  - rule 'linear: always true' was applied 432 times.
  - rule 'linear: doubleton free' was applied 11 times.
  - rule 'linear: empty' was applied 26 times.
  - rule 'linear: extracted enforcement literal' was applied 4'991 times.
  - rule 'linear: fixed or dup variables' was applied 3'147 times.
  - rule 'linear: positive equal one' was applied 5 times.
  - rule 'linear: reduced variable domains' was applied 205 times.
  - rule 'linear: remapped using affine relations' was applied 3'190 times.
  - rule 'linear: simplified rhs' was applied 9'011 times.
  - rule 'linear: tightened into equality' was applied 4 times.
  - rule 'linear: variable substitution 1' was applied 11 times.
  - rule 'no_overlap: inferred from x != y constraints' was applied 1 time.
  - rule 'presolve: 77 unused variables removed.' was applied 1 time.
  - rule 'presolve: iteration' was applied 3 times.
  - rule 'probing: reduced enforced constraint to implication.' was applied 17 times.
  - rule 'symmetry: fixed to false in general orbit' was applied 1 time.

Presolved optimization model '': (model_fingerprint: 0x713d62ca1bf99690)
#Variables: 249 (#ints: 8 in objective)
  - 79 Booleans in [0,1]
  - 138 different domains in [-5388,6496] with a largest complexity of 13.
#kExactlyOne: 4 (#literals: 12)
#kInterval: 5
#kLinear2: 532 (#enforced: 492 #multi: 393)
#kLinear3: 237 (#enforced: 130)
#kLinearN: 2'225 (#enforced: 2'062 #multi: 58) (#terms: 19'787)
#kNoOverlap: 1 (#intervals: 5)

Preloading model.
#Bound   0.19s best:inf   next:[135,3893] initial_domain
[Symmetry] Graph for symmetry has 3'717 nodes and 26'784 arcs.
[Symmetry] Symmetry computation done. time: 0.000553294 dtime: 0.00145581
#Model   0.19s var:249/249 constraints:3004/3004

Starting search at 0.19s with 32 workers.
17 full problem subsolvers: [core, default_lp, fixed, lb_tree_search, max_lp, no_lp, objective_lb_search, objective_lb_search_max_lp, objective_lb_search_no_lp, objective_shaving_search_max_lp, objective_shaving_search_no_lp, probing, probing_max_lp, pseudo_costs, quick_restart, quick_restart_no_lp, reduced_costs]
13 first solution subsolvers: [fj_long_default, fj_long_lin_default, fj_long_random, fj_short_default, fj_short_lin_default, fj_short_lin_random, fj_short_random, fs_random(2), fs_random_no_lp, fs_random_quick_restart(2), fs_random_quick_restart_no_lp]
13 incomplete subsolvers: [feasibility_pump, graph_arc_lns, graph_cst_lns, graph_dec_lns, graph_var_lns, rins/rens, rnd_cst_lns, rnd_var_lns, scheduling_intervals_lns, scheduling_precedences_lns, scheduling_time_window_lns, violation_ls(2)]
3 helper subsolvers: [neighborhood_helper, synchronization_agent, update_gap_integral]
#Bound   0.23s best:inf   next:[136,3893] core (initial_propagation)
#Bound   0.25s best:inf   next:[145,3893] objective_lb_search_no_lp
#Bound   0.26s best:inf   next:[255,3893] objective_lb_search_no_lp
#1       0.26s best:1979  next:[255,1978] quick_restart_no_lp (fixed_bools=0/118)
#2       0.27s best:1663  next:[255,1662] no_lp (fixed_bools=0/103)
#3       0.27s best:1662  next:[255,1661] violation_ls(batch:1 #solutions_imported:1 #lin_moves:0 #lin_evals:848 #gen_moves:382 #gen_evals:80 #comp_moves:30 #backtracks:176 #weight_updates:7)
#4       0.27s best:1661  next:[255,1660] violation_ls(batch:1 #solutions_imported:1 #lin_moves:38 #lin_evals:174 #weight_updates:21)
#5       0.28s best:1252  next:[255,1251] no_lp (fixed_bools=0/121)
#6       0.28s best:1232  next:[255,1231] no_lp (fixed_bools=0/124)
#7       0.28s best:1206  next:[255,1205] no_lp (fixed_bools=0/125)
#8       0.28s best:1199  next:[255,1198] no_lp (fixed_bools=0/130)
#9       0.29s best:1112  next:[255,1111] no_lp (fixed_bools=0/142)
#10      0.29s best:1111  next:[255,1110] violation_ls(batch:2 #solutions_imported:2 #lin_moves:38 #lin_evals:187 #gen_moves:7 #gen_evals:2 #comp_moves:3 #backtracks:2 #weight_updates:21)
#11      0.29s best:1001  next:[255,1000] no_lp (fixed_bools=0/145)
#12      0.32s best:997   next:[255,996]  quick_restart_no_lp (fixed_bools=0/146)
#13      0.34s best:993   next:[255,992]  graph_dec_lns (d=0.71 s=65 t=0.10 p=1.00 stall=1 h=auto_l0) [presolve]
#Bound   0.35s best:993   next:[266,992]  objective_lb_search_no_lp
#Bound   0.35s best:993   next:[283,992]  objective_lb_search_no_lp
#Bound   0.35s best:993   next:[286,992]  objective_lb_search_no_lp
#14      0.36s best:959   next:[286,958]  no_lp (fixed_bools=0/166)
#Bound   0.39s best:959   next:[344,958]  objective_lb_search_no_lp
#Bound   0.40s best:959   next:[345,958]  objective_lb_search_no_lp
#Bound   0.41s best:959   next:[356,958]  objective_lb_search_no_lp
#Bound   0.43s best:959   next:[360,958]  objective_lb_search_no_lp
#Bound   0.48s best:959   next:[365,958]  objective_lb_search_no_lp
#Bound   0.48s best:959   next:[367,958]  objective_lb_search_no_lp
#Bound   0.49s best:959   next:[392,958]  objective_lb_search_no_lp
#Bound   0.50s best:959   next:[393,958]  objective_lb_search_no_lp
#Bound   0.51s best:959   next:[395,958]  objective_lb_search_no_lp
#Bound   0.56s best:959   next:[468,958]  objective_lb_search_no_lp
#Bound   0.76s best:959   next:[478,958]  objective_lb_search_no_lp
#Bound   0.84s best:959   next:[479,958]  objective_lb_search_no_lp
#15      0.86s best:933   next:[479,932]  scheduling_time_window_lns (d=0.50 s=67 t=0.10 p=0.00 stall=0 h=auto_l0)
#Bound   0.94s best:933   next:[483,932]  objective_lb_search_no_lp
#Bound   0.99s best:933   next:[490,932]  objective_lb_search_no_lp
#Bound   1.02s best:933   next:[491,932]  objective_lb_search_no_lp
#16      1.03s best:915   next:[491,914]  scheduling_precedences_lns (d=0.50 s=68 t=0.10 p=0.00 stall=0 h=auto_l0)
#Bound   1.91s best:915   next:[520,914]  objective_lb_search_no_lp [skipped_logs=5]
#17      2.30s best:902   next:[521,901]  rins_lp_lns (d=0.92 s=196 t=0.10 p=0.75 stall=7 h=auto_l0)
#18      2.97s best:894   next:[525,893]  rnd_cst_lns (d=0.98 s=230 t=0.10 p=0.92 stall=12 h=auto_l0)
#Bound   2.31s best:902   next:[525,901]  objective_lb_search_no_lp [skipped_logs=1]
#19      3.04s best:875   next:[525,874]  rins_pump_lns (d=0.78 s=254 t=0.10 p=0.50 stall=3 h=auto_l0)
#Bound   3.93s best:875   next:[538,874]  objective_lb_search_no_lp [skipped_logs=2]
#Bound   5.05s best:875   next:[559,874]  objective_lb_search_no_lp [skipped_logs=3]
#Bound   5.77s best:875   next:[567,874]  objective_lb_search_no_lp [skipped_logs=3]
#Bound   6.22s best:875   next:[571,874]  objective_lb_search_no_lp [skipped_logs=0]
#Bound   7.90s best:875   next:[574,874]  objective_lb_search_no_lp [skipped_logs=1]
#Bound   8.83s best:875   next:[583,874]  objective_lb_search_no_lp [skipped_logs=1]
#Bound   9.05s best:875   next:[585,874]  objective_lb_search_no_lp [skipped_logs=0]
#Bound  10.74s best:875   next:[591,874]  objective_lb_search_no_lp [skipped_logs=2]
#Bound  11.95s best:875   next:[595,874]  objective_lb_search_no_lp [skipped_logs=1]
#Bound  13.66s best:875   next:[596,874]  objective_shaving_search_no_lp (vars=284 csts=2948)
#Bound  16.15s best:875   next:[597,874]  objective_lb_search
#Bound  16.69s best:875   next:[599,874]  objective_lb_search_no_lp
#Bound  16.76s best:875   next:[600,874]  objective_lb_search_no_lp
#Bound  17.05s best:875   next:[602,874]  objective_lb_search_no_lp
#Bound  18.04s best:875   next:[603,874]  objective_lb_search_no_lp
#Bound  19.33s best:875   next:[605,874]  objective_lb_search_no_lp
#Bound  19.59s best:875   next:[606,874]  objective_lb_search_no_lp [skipped_logs=0]
#Bound  20.23s best:875   next:[608,874]  objective_lb_search_no_lp [skipped_logs=0]
#Bound  22.12s best:875   next:[611,874]  objective_lb_search_no_lp
#Bound  22.97s best:875   next:[617,874]  objective_lb_search_no_lp [skipped_logs=1]
#Bound  23.76s best:875   next:[618,874]  objective_lb_search_no_lp [skipped_logs=0]
#Bound  26.38s best:875   next:[619,874]  objective_shaving_search_no_lp (vars=288 csts=2952)
#Bound  27.65s best:875   next:[620,874]  objective_lb_search_no_lp
#Bound  28.08s best:875   next:[621,874]  objective_lb_search_no_lp
#Bound  28.86s best:875   next:[623,874]  objective_lb_search_no_lp
#Bound  29.18s best:875   next:[626,874]  objective_lb_search_no_lp
#Bound  29.50s best:875   next:[627,874]  objective_lb_search_no_lp [skipped_logs=0]
#Bound  30.48s best:875   next:[629,874]  objective_lb_search_no_lp [skipped_logs=0]
#Bound  31.69s best:875   next:[633,874]  objective_lb_search_no_lp [skipped_logs=1]
#Bound  32.17s best:875   next:[634,874]  objective_lb_search_no_lp [skipped_logs=0]
#Bound  33.86s best:875   next:[637,874]  objective_lb_search_no_lp [skipped_logs=1]
#Bound  34.37s best:875   next:[639,874]  objective_lb_search_no_lp [skipped_logs=0]
#Bound  35.37s best:875   next:[643,874]  objective_lb_search_no_lp [skipped_logs=0]
#Bound  36.96s best:875   next:[645,874]  objective_lb_search_no_lp [skipped_logs=1]
#Bound  38.35s best:875   next:[648,874]  objective_lb_search_no_lp
#Bound  41.26s best:875   next:[678,874]  objective_lb_search_no_lp
#Bound  48.51s best:875   next:[679,874]  objective_shaving_search_no_lp (vars=288 csts=2952)
#Bound  50.69s best:875   next:[680,874]  objective_lb_search_no_lp
#Bound  51.42s best:875   next:[681,874]  objective_lb_search_no_lp
#Bound  51.92s best:875   next:[682,874]  objective_lb_search_no_lp
#Bound  54.17s best:875   next:[683,874]  objective_lb_search_no_lp
#Bound  54.36s best:875   next:[684,874]  objective_lb_search_no_lp
#Bound  55.07s best:875   next:[685,874]  objective_lb_search_no_lp
#Bound  55.30s best:875   next:[686,874]  objective_lb_search_no_lp
#Bound  55.94s best:875   next:[687,874]  objective_lb_search_no_lp
#Bound  58.08s best:875   next:[688,874]  objective_lb_search_no_lp
#Bound  63.25s best:875   next:[689,874]  objective_lb_search_no_lp
#Bound  63.90s best:875   next:[690,874]  objective_lb_search_no_lp
#Bound  64.61s best:875   next:[691,874]  objective_lb_search_no_lp
#Bound  66.03s best:875   next:[692,874]  objective_lb_search_no_lp
#Bound  67.36s best:875   next:[695,874]  objective_lb_search_no_lp
#Bound  67.61s best:875   next:[696,874]  objective_lb_search_no_lp
#Bound  70.61s best:875   next:[698,874]  objective_lb_search_no_lp
#Bound  72.15s best:875   next:[699,874]  objective_lb_search_no_lp
#Bound  73.35s best:875   next:[701,874]  objective_lb_search_no_lp
#Bound  74.00s best:875   next:[703,874]  objective_lb_search_no_lp
#Bound  74.97s best:875   next:[705,874]  objective_lb_search_no_lp
#Model  75.37s var:248/249 constraints:2887/3004
#Model  75.63s var:247/249 constraints:2819/3004
#Bound  75.95s best:875   next:[707,874]  objective_lb_search_no_lp
#Model  76.26s var:246/249 constraints:2794/3004
#Model  76.80s var:245/249 constraints:2769/3004
#Model  77.66s var:244/249 constraints:2760/3004
#Model  78.63s var:243/249 constraints:2680/3004
#Bound  78.95s best:875   next:[721,874]  objective_lb_search_max_lp
#Model  78.99s var:239/249 constraints:2523/3004
#Model  79.01s var:238/249 constraints:2424/3004
#Model  79.12s var:237/249 constraints:2396/3004
#Bound  79.35s best:875   next:[722,874]  objective_lb_search_max_lp
#Model  79.38s var:236/249 constraints:2360/3004
#Model  79.41s var:234/249 constraints:2121/3004
#Bound  79.42s best:875   next:[723,874]  objective_lb_search
#Model  79.51s var:233/249 constraints:2106/3004
#Model  79.54s var:229/249 constraints:1966/3004
#Bound  79.54s best:875   next:[765,874]  quick_restart_no_lp
#Done   79.54s no_lp
#Done   79.54s quick_restart_no_lp
#Model  79.54s var:197/249 constraints:405/3004
#Done   79.54s core
#Done   79.54s probing_max_lp

Task timing                                  n [     min,      max]      avg      dev     time         n [     min,      max]      avg      dev    dtime
                             'core':         1 [   1.32m,    1.32m]    1.32m   0.00ns    1.32m         1 [   1.72m,    1.72m]    1.72m   0.00ns    1.72m
                       'default_lp':         1 [   1.32m,    1.32m]    1.32m   0.00ns    1.32m         1 [  30.27s,   30.27s]   30.27s   0.00ns   30.27s
                 'feasibility_pump':       283 [ 16.80ms, 150.48ms]  75.25ms   6.60ms   21.29s       282 [  4.81ms,  42.51ms]  20.57ms   1.61ms    5.80s
                            'fixed':         1 [   1.32m,    1.32m]    1.32m   0.00ns    1.32m         1 [  34.52s,   34.52s]   34.52s   0.00ns   34.52s
                  'fj_long_default':         1 [ 62.08ms,  62.08ms]  62.08ms   0.00ns  62.08ms         1 [ 43.21ms,  43.21ms]  43.21ms   0.00ns  43.21ms
              'fj_long_lin_default':         1 [ 86.77ms,  86.77ms]  86.77ms   0.00ns  86.77ms         1 [120.42ms, 120.42ms] 120.42ms   0.00ns 120.42ms
                   'fj_long_random':         1 [ 61.59ms,  61.59ms]  61.59ms   0.00ns  61.59ms         1 [ 38.75ms,  38.75ms]  38.75ms   0.00ns  38.75ms
                 'fj_short_default':         1 [102.09ms, 102.09ms] 102.09ms   0.00ns 102.09ms         1 [116.05ms, 116.05ms] 116.05ms   0.00ns 116.05ms
             'fj_short_lin_default':         1 [ 81.36ms,  81.36ms]  81.36ms   0.00ns  81.36ms         1 [113.36ms, 113.36ms] 113.36ms   0.00ns 113.36ms
              'fj_short_lin_random':         1 [ 90.69ms,  90.69ms]  90.69ms   0.00ns  90.69ms         1 [131.25ms, 131.25ms] 131.25ms   0.00ns 131.25ms
                  'fj_short_random':         1 [ 86.10ms,  86.10ms]  86.10ms   0.00ns  86.10ms         1 [121.74ms, 121.74ms] 121.74ms   0.00ns 121.74ms
                        'fs_random':         1 [ 67.03ms,  67.03ms]  67.03ms   0.00ns  67.03ms         1 [  2.29us,   2.29us]   2.29us   0.00ns   2.29us
                        'fs_random':         1 [ 69.54ms,  69.54ms]  69.54ms   0.00ns  69.54ms         1 [ 16.79us,  16.79us]  16.79us   0.00ns  16.79us
                  'fs_random_no_lp':         1 [ 67.21ms,  67.21ms]  67.21ms   0.00ns  67.21ms         1 [468.66us, 468.66us] 468.66us   0.00ns 468.66us
          'fs_random_quick_restart':         1 [ 68.78ms,  68.78ms]  68.78ms   0.00ns  68.78ms         1 [ 16.77us,  16.77us]  16.77us   0.00ns  16.77us
          'fs_random_quick_restart':         1 [ 69.47ms,  69.47ms]  69.47ms   0.00ns  69.47ms         1 [ 16.78us,  16.78us]  16.78us   0.00ns  16.78us
    'fs_random_quick_restart_no_lp':         1 [ 69.03ms,  69.03ms]  69.03ms   0.00ns  69.03ms         1 [416.26us, 416.26us] 416.26us   0.00ns 416.26us
                    'graph_arc_lns':       282 [  6.60ms, 875.51ms] 365.24ms 193.94ms    1.72m       282 [ 10.00ns, 110.77ms]  65.35ms  42.91ms   18.43s
                    'graph_cst_lns':       282 [  1.11ms, 625.94ms] 364.47ms 197.80ms    1.71m       275 [ 10.00ns, 106.34ms]  65.48ms  41.71ms   18.01s
                    'graph_dec_lns':       282 [ 11.15ms, 975.77ms] 338.20ms 193.64ms    1.59m       281 [ 10.00ns, 136.70ms]  61.46ms  44.44ms   17.27s
                    'graph_var_lns':       282 [  9.34ms, 747.05ms] 363.10ms 187.48ms    1.71m       280 [  3.33us, 144.99ms]  64.38ms  42.92ms   18.03s
                   'lb_tree_search':         1 [   1.32m,    1.32m]    1.32m   0.00ns    1.32m         1 [  44.75s,   44.75s]   44.75s   0.00ns   44.75s
                           'max_lp':         1 [   1.32m,    1.32m]    1.32m   0.00ns    1.32m         1 [  36.51s,   36.51s]   36.51s   0.00ns   36.51s
                            'no_lp':         1 [   1.32m,    1.32m]    1.32m   0.00ns    1.32m         1 [  26.37s,   26.37s]   26.37s   0.00ns   26.37s
              'objective_lb_search':         1 [   1.32m,    1.32m]    1.32m   0.00ns    1.32m         1 [  32.58s,   32.58s]   32.58s   0.00ns   32.58s
       'objective_lb_search_max_lp':         1 [   1.32m,    1.32m]    1.32m   0.00ns    1.32m         1 [  41.97s,   41.97s]   41.97s   0.00ns   41.97s
        'objective_lb_search_no_lp':         1 [   1.32m,    1.32m]    1.32m   0.00ns    1.32m         1 [  22.03s,   22.03s]   22.03s   0.00ns   22.03s
  'objective_shaving_search_max_lp':        93 [ 19.30ms,    7.24s] 841.71ms    1.08s    1.30m        89 [  1.91ms,    2.38s] 244.98ms 350.03ms   21.80s
   'objective_shaving_search_no_lp':        93 [  5.50ms,    7.23s] 841.70ms    1.08s    1.30m        87 [  1.96ms,    1.63s] 182.40ms 251.45ms   15.87s
                          'probing':         1 [   1.32m,    1.32m]    1.32m   0.00ns    1.32m         1 [  33.64s,   33.64s]   33.64s   0.00ns   33.64s
                   'probing_max_lp':         1 [   1.32m,    1.32m]    1.32m   0.00ns    1.32m         1 [  46.50s,   46.50s]   46.50s   0.00ns   46.50s
                     'pseudo_costs':         1 [   1.32m,    1.32m]    1.32m   0.00ns    1.32m         1 [  34.43s,   34.43s]   34.43s   0.00ns   34.43s
                    'quick_restart':         1 [   1.32m,    1.32m]    1.32m   0.00ns    1.32m         1 [  42.42s,   42.42s]   42.42s   0.00ns   42.42s
              'quick_restart_no_lp':         1 [   1.32m,    1.32m]    1.32m   0.00ns    1.32m         1 [  44.83s,   44.83s]   44.83s   0.00ns   44.83s
                    'reduced_costs':         1 [   1.32m,    1.32m]    1.32m   0.00ns    1.32m         1 [  38.90s,   38.90s]   38.90s   0.00ns   38.90s
                        'rins/rens':       283 [ 76.11us, 533.32ms] 281.11ms 195.08ms    1.33m       220 [ 10.00ns, 101.44ms]  77.66ms  33.49ms   17.09s
                      'rnd_cst_lns':       282 [  1.20ms, 636.76ms] 365.68ms 189.53ms    1.72m       281 [ 10.00ns, 110.60ms]  64.90ms  42.11ms   18.24s
                      'rnd_var_lns':       282 [  4.28ms, 594.13ms] 366.14ms 178.93ms    1.72m       282 [ 10.00ns, 110.60ms]  67.65ms  41.31ms   19.08s
         'scheduling_intervals_lns':       282 [ 35.35ms, 693.44ms] 518.45ms  50.88ms    2.44m       281 [ 51.10ms, 110.57ms] 104.31ms   4.57ms   29.31s
       'scheduling_precedences_lns':       282 [ 22.48ms, 692.25ms] 522.21ms  53.26ms    2.45m       281 [ 34.31ms, 111.23ms] 104.24ms   5.33ms   29.29s
       'scheduling_time_window_lns':       282 [ 24.16ms, 643.06ms] 517.36ms  50.78ms    2.43m       279 [ 44.51ms, 200.08ms] 104.97ms   9.64ms   29.29s
                     'violation_ls':       282 [679.89us,  96.44ms]  59.95ms   9.22ms   16.91s       282 [119.70us, 192.57ms] 126.92ms  25.68ms   35.79s
                     'violation_ls':       283 [  2.93ms,  95.35ms]  61.96ms  10.60ms   17.53s       283 [  3.78ms, 215.46ms] 104.65ms  29.05ms   29.62s

Search stats                        Bools  Conflicts  Branches  Restarts  BoolPropag  IntegerPropag
                           'core':  3'202     76'678   150'942    14'677  83'176'633     43'477'450
                     'default_lp':    751     42'297   157'001    17'862  10'630'613     29'922'294
                          'fixed':  1'609    330'144   878'662       158  64'716'214     59'110'774
                      'fs_random':     79          0       158       158          24          3'588
                      'fs_random':     79          0       158       158          24          3'588
                'fs_random_no_lp':    104          5       205       158         135          5'551
        'fs_random_quick_restart':     79          0       158       158          24          3'588
        'fs_random_quick_restart':     79          0       158       158          24          3'588
  'fs_random_quick_restart_no_lp':     79          0       216       158          28          5'043
                 'lb_tree_search':     89        597   196'192    24'419     449'625     15'140'557
                         'max_lp':     79     27'893   189'845    27'412   1'003'580     32'421'426
                          'no_lp':    978    126'241   238'308    15'596  30'624'445     75'436'179
            'objective_lb_search':    231     29'615   212'962    37'801   1'721'112     36'162'101
     'objective_lb_search_max_lp':    208     16'560   228'815    49'900   1'461'595     31'043'290
      'objective_lb_search_no_lp':    721     98'364   210'418    16'680  13'902'493     66'001'902
                        'probing':    429        240     3'892     2'354      27'171        181'537
                 'probing_max_lp':    429        231     2'139     1'479      19'631        128'408
                   'pseudo_costs':     79     36'223   194'069    27'708   1'023'618     34'713'131
                  'quick_restart':  1'549     31'730   203'529    25'653  23'993'430     26'186'261
            'quick_restart_no_lp':  2'295    112'434   334'456    22'851  51'085'988     55'365'001
                  'reduced_costs':  3'950     40'555   217'333    20'794  41'578'378     31'828'212

SAT stats                           ClassicMinim  LitRemoved  LitLearned  LitForgotten  Subsumed  MClauses  MDecisions  MLitTrue  MSubsumed  MLitRemoved  MReused
                           'core':        71'044     528'875     633'278        63'034       220     6'581      32'596         0        160          571       60
                     'default_lp':        31'700     122'586     445'362       153'500     1'117    11'267     100'371         0      5'830       40'258    1'408
                          'fixed':       225'936     537'237   8'116'610     7'559'015     1'070         0           0         0          0            0        0
                      'fs_random':             0           0           0             0         0         0           0         0          0            0        0
                      'fs_random':             0           0           0             0         0         0           0         0          0            0        0
                'fs_random_no_lp':             0           0          48             0         0         0           0         0          0            0        0
        'fs_random_quick_restart':             0           0           0             0         0         0           0         0          0            0        0
        'fs_random_quick_restart':             0           0           0             0         0         0           0         0          0            0        0
  'fs_random_quick_restart_no_lp':             0           0           0             0         0         0           0         0          0            0        0
                 'lb_tree_search':           159         318       4'496             0         5    10'089      54'636         0         89          391      392
                         'max_lp':        20'394      62'886     374'816       132'741       911    13'192     148'415         0      1'199        8'639    3'302
                          'no_lp':       106'426     577'236   1'755'392     1'344'147     1'321     8'255      74'314         8      3'247       22'879    1'130
            'objective_lb_search':        22'794      71'214     301'132        19'324       988    17'611     161'470         0      2'410       15'756    3'961
     'objective_lb_search_max_lp':        12'533      40'975     168'792         5'625       634    18'365     172'080         0        763        4'972    5'486
      'objective_lb_search_no_lp':        85'358     400'795     918'471       350'387     1'379    10'170      91'407        20      5'426       37'021    1'350
                        'probing':             0           0         240             0         0         0           0         0          0            0        0
                 'probing_max_lp':             1           1         232             0         0         0           0         0          0            0        0
                   'pseudo_costs':        26'909      87'676     472'588       206'258       994    13'858     142'660         0      2'291       16'019    2'702
                  'quick_restart':        22'829      99'962     281'717        30'866       740    17'400     144'967        40     11'625       90'178    2'431
            'quick_restart_no_lp':        91'580     662'589   1'404'786       576'266       579     9'298      84'359         1      7'423       66'547      826
                  'reduced_costs':        30'826     134'829     511'515       223'553       630    11'988     107'781       140      4'773       33'069    2'145

Lp stats                         Component  Iterations  AddedCuts  OPTIMAL  DUAL_F.  DUAL_U.
                  'default_lp':          1     374'912     31'260   65'720        1        0
                       'fixed':          1      31'674        673  343'243        0        0
                   'fs_random':          1          71         94        3        0        0
                   'fs_random':          1          71         98        3        0        0
     'fs_random_quick_restart':          1          71         96        3        0        0
     'fs_random_quick_restart':          1          71         97        3        0        0
              'lb_tree_search':          1   1'276'871      8'879   94'038   39'671        0
                      'max_lp':          1     684'905     18'589   51'152   14'671       22
         'objective_lb_search':          1     436'497     21'512   54'798        0        0
  'objective_lb_search_max_lp':          1     675'190     13'752   34'787    8'105       15
                     'probing':          1     205'430     38'279   12'055        0        1
              'probing_max_lp':          1     175'545     26'396    6'770      765        0
                'pseudo_costs':          1     632'442     26'112   53'962   20'357       12
               'quick_restart':          1     454'753     30'350   46'529        0        0
               'reduced_costs':          1     629'977     28'939   57'313   18'257        3

Lp dimension                                                                      Final dimension of first component
                  'default_lp':   667 rows, 241 columns, 4070 entries with magnitude in [1.374219e-04, 1.000000e+00]
                       'fixed':    131 rows, 241 columns, 445 entries with magnitude in [4.062222e-02, 1.000000e+00]
                   'fs_random':    118 rows, 241 columns, 389 entries with magnitude in [4.062222e-02, 1.000000e+00]
                   'fs_random':     68 rows, 241 columns, 245 entries with magnitude in [9.083405e-02, 1.000000e+00]
     'fs_random_quick_restart':    118 rows, 241 columns, 389 entries with magnitude in [4.062222e-02, 1.000000e+00]
     'fs_random_quick_restart':    118 rows, 241 columns, 389 entries with magnitude in [4.062222e-02, 1.000000e+00]
              'lb_tree_search':   661 rows, 249 columns, 2626 entries with magnitude in [8.638198e-03, 1.000000e+00]
                      'max_lp':   497 rows, 249 columns, 1918 entries with magnitude in [3.342488e-03, 1.000000e+00]
         'objective_lb_search':   490 rows, 241 columns, 2443 entries with magnitude in [7.695147e-04, 1.000000e+00]
  'objective_lb_search_max_lp':   540 rows, 249 columns, 2092 entries with magnitude in [1.650246e-04, 1.000000e+00]
                     'probing':   632 rows, 241 columns, 3659 entries with magnitude in [9.432860e-05, 1.000000e+00]
              'probing_max_lp':  1197 rows, 249 columns, 9770 entries with magnitude in [2.509684e-04, 1.000000e+00]
                'pseudo_costs':   466 rows, 249 columns, 1872 entries with magnitude in [2.037366e-03, 1.000000e+00]
               'quick_restart':   670 rows, 241 columns, 4858 entries with magnitude in [4.449602e-05, 1.000000e+00]
               'reduced_costs':   589 rows, 249 columns, 2262 entries with magnitude in [2.306132e-03, 1.000000e+00]

Lp debug                         CutPropag  CutEqPropag  Adjust  Overflow        Bad  BadScaling
                  'default_lp':         12          203  19'513         0    277'694           0
                       'fixed':          0            0       1         0      1'530           0
                   'fs_random':          0            0       0         0         45           0
                   'fs_random':          0            0       0         0         48           0
     'fs_random_quick_restart':          0            0       0         0         46           0
     'fs_random_quick_restart':          0            0       0         0         50           0
              'lb_tree_search':          6            8  62'718         0     98'995           0
                      'max_lp':         28           99  32'594         0    246'966           0
         'objective_lb_search':         26           64  24'744         0    284'765           0
  'objective_lb_search_max_lp':         17           30  25'030         0    245'772           0
                     'probing':         49          488   9'205         0  5'185'641           0
              'probing_max_lp':         69          290   4'734         0  3'591'328           0
                'pseudo_costs':         28           55  40'088         0    247'139           0
               'quick_restart':         14          155  23'536         0    629'346           0
               'reduced_costs':         22           48  47'261         0    283'841           0

Lp pool                          Constraints  Updates  Simplif  Merged  Shortened    Split  Strenghtened      Cuts/Call
                  'default_lp':        9'317    2'938  115'902     257      6'075   46'674        41'969  31'260/73'528
                       'fixed':          987       26        7       0          0       19            47      673/1'117
                   'fs_random':          408        0        0       0          0        0             0         94/144
                   'fs_random':          412        0        0       0          0        0             1         98/153
     'fs_random_quick_restart':          410        0        0       0          0        0             1         96/142
     'fs_random_quick_restart':          411        0        0       0          0        0             0         97/153
              'lb_tree_search':       11'651      957   80'731     226      3'287    1'777        81'655   8'879/38'440
                      'max_lp':       12'268    1'647   88'033     319        809   13'921       112'904  18'589/49'476
         'objective_lb_search':        9'661    2'544  117'936     165      3'635   29'470        31'058  21'512/55'741
  'objective_lb_search_max_lp':       12'631    1'742  164'007     119     10'073    8'904       140'217  13'752/39'593
                     'probing':        9'585    4'957  184'947       8         39   64'516        17'735  38'279/70'911
              'probing_max_lp':       12'389    3'302   54'545       5          0   30'200        57'442  26'396/68'793
                'pseudo_costs':       11'592    1'707  179'806     518      8'607   11'556       134'282  26'112/63'564
               'quick_restart':        9'602    3'146  145'420      62         83  100'887        27'192  30'350/70'714
               'reduced_costs':       12'417    1'677  113'400     520      4'407   15'089       124'687  28'939/74'712

Lp Cut                                                fs_ran  fs_ran  fs_ran  fs_ran  defaul  fixed  max_lp  quick_  reduce  pseudo  lb_tre  probin  object  probin  object
                                              CG_FF:       5       5       5       5   2'049     39   1'018     975   1'781   1'362     436     671   1'076     140     481
                                               CG_K:       5       5       5       5   1'310     25     823     708   1'495   1'283     322     462     719     142     400
                                               CG_R:       3       3       3       3   2'844     38     889   3'168   1'730   1'718     437   2'826   1'822     398     500
                                              CG_RB:       1       1       1       1   8'759     68   2'216  11'271   3'446   3'827   1'157  13'513   7'516     672   1'593
                                             CG_RBP:       -       -       -       -   1'331     13     368   1'808     644     747     130   1'807   1'062     100     135
                                             Clique:       -       -       -       -       -      -      73       -     108     154      71       -       -      52      90
                                                 IB:      50      50      50      50   3'960    231   1'824   2'423   2'955   2'332     813   1'639   2'002     573     946
                                           MIR_1_FF:      14      14      14      14     960     31     860     802   1'262   1'084     425   1'072     657     575     692
                                            MIR_1_K:       1       1       1       2     246      5     323     193     514     455     141     182     195      90     200
                                           MIR_1_KL:       -       -       -       -       9      -       2       3       4       5       -      20       -       3       -
                                            MIR_1_R:       6       6       6       6     294     13     154     294     311     262      61     476     205     101     113
                                           MIR_1_RB:       2       2       2       2   1'485     37   1'631   1'512   2'377   2'002     813   2'528   1'040   1'125   1'312
                                          MIR_1_RBP:       -       -       -       -      58      5     211      41     241     265     127      70      30      79     105
                                          MIR_1_RLT:       -       -       -       -       -      -      10       -      13      12       5       -       -      12      11
                                           MIR_2_FF:       2       2       2       1     610     14     642     465     986     853     341     727     396     492     485
                                            MIR_2_K:       -       -       -       -     176      1     166     107     301     239      82     165      89      60     136
                                           MIR_2_KL:       -       -       -       -       4      -       5       8       2      11       1      16       4       3       1
                                            MIR_2_R:       -       -       -       -     274      2     224     327     331     309      83     613     182     310     223
                                           MIR_2_RB:       3       3       3       3   1'066     30     923     895   1'509   1'311     429   1'645     820     702     833
                                          MIR_2_RBP:       -       -       -       -     125      3     156      99     211     216      67     113      38      58      96
                                           MIR_3_FF:       -       -       -       -     402      4     449     287     705     634     249     376     228     260     376
                                            MIR_3_K:       -       1       1       1     148      2     148      80     222     218      57     102      58      40     103
                                           MIR_3_KL:       -       -       -       -       7      -      11       7       3       4       5      16       2       2       1
                                            MIR_3_R:       -       -       -       -     223      4     201     209     261     241      85     348     129     235     156
                                           MIR_3_RB:       -       1       1       1     771     15     639     667     950     888     262   1'041     486     478     541
                                          MIR_3_RBP:       -       -       -       -      91      -     102      71     136     146      43      69      38      48      56
                                           MIR_4_FF:       -       -       -       -     265      6     267     162     450     371     149     207     164     125     244
                                            MIR_4_K:       1       1       -       -     121      3      86      47     152     140      56      55      41      29      67
                                           MIR_4_KL:       -       -       -       -       6      -      17       5      12      18       4      28       6       8       4
                                            MIR_4_R:       -       -       -       -     181      3     104     117     158     162      44     199     101     113      83
                                           MIR_4_RB:       1       1       -       -     553      9     407     393     596     531     160     623     318     274     332
                                          MIR_4_RBP:       -       -       -       -      71      2      51      41     100      88      29      58      36      24      43
                                           MIR_5_FF:       -       -       -       -     185      6     172     134     278     238      93     144     118     112     135
                                            MIR_5_K:       -       -       -       -      63      2      69      29     105     105      33      42      29      28      36
                                           MIR_5_KL:       -       -       -       -       4      -       9       5      10      13       3      18       3       3       7
                                            MIR_5_R:       -       -       -       -     124      2      52      81      97      90      29     138      60      67      56
                                           MIR_5_RB:       -       -       -       -     359      5     244     247     338     346      93     337     169     167     169
                                          MIR_5_RBP:       -       -       -       -      32      -      32      24      67      66      17      35      19      15      19
                                           MIR_6_FF:       -       -       -       -      93      4     143      90     215     152      77      93      63      40      84
                                            MIR_6_K:       -       -       -       -      48      1      47      24     107      76      29      33      24      13      39
                                           MIR_6_KL:       -       -       -       -       7      -       2       6       3       2       5      12       2       1       1
                                            MIR_6_R:       -       -       -       -      81      1      40      49      78      60      27      75      44      35      19
                                           MIR_6_RB:       -       -       -       -     196      4     196     165     275     233      88     193     118      77     107
                                          MIR_6_RBP:       -       -       -       -      26      -      35      12      57      57      14      27      10       8      14
         NoOverlapCompletionTimeExhaustive_weighted:       -       -       -       -       -      -      37       -      76      57      17       -       -       6      14
  NoOverlapCompletionTimeExhaustive_weighted_lifted:       -       -       -       -       -      -       -       -       2       -       -       -       -       -       -
                        NoOverlapDisjunctionOnStart:       -       -       -       -       -      -      26       -      62      42      11       -       -       5      12
                                       ZERO_HALF_FF:       -       -       -       -     227     11     175     132     338     253      98      98     160      42     114
                                        ZERO_HALF_K:       -       -       1       -      94      1      85      52     164     146      50      67      54      13      58
                                        ZERO_HALF_R:       -       1       1       1     864     18   1'698   1'547   1'996   1'563     783   4'342     682  16'904   2'081
                                       ZERO_HALF_RB:       -       -       1       -     392     13     437     513     600     597     293     812     437   1'165     384
                                      ZERO_HALF_RBP:       -       1       -       1      66      2      90      55     105     128      35     146      60     372      45

LNS stats                        Improv/Calls  Closed  Difficulty  TimeLimit
               'graph_arc_lns':         1/282     52%        0.98       0.11
               'graph_cst_lns':         2/275     52%        0.98       0.11
               'graph_dec_lns':         2/282     52%        0.98       0.11
               'graph_var_lns':         2/282     52%        0.99       0.11
                   'rins/rens':        47/259     50%        0.84       0.10
                 'rnd_cst_lns':         2/281     52%        0.98       0.11
                 'rnd_var_lns':         1/282     52%        0.98       0.11
    'scheduling_intervals_lns':         5/281      0%        0.00       0.11
  'scheduling_precedences_lns':         4/281      1%        0.00       0.11
  'scheduling_time_window_lns':         5/281      0%        0.00       0.11

LS stats                   Batches  Restarts   LinMoves  GenMoves  CompoundMoves  WeightUpdates
       'fj_long_default':        1         1      4'102         0              0            167
   'fj_long_lin_default':        1         1          0     2'092            228              0
        'fj_long_random':        1         1      4'064         0              0            122
      'fj_short_default':        1         1          0     2'092            359              1
  'fj_short_lin_default':        1         1          0     2'176            338              1
   'fj_short_lin_random':        1         1          0     2'283            285              1
       'fj_short_random':        1         1          0     2'236            380              1
          'violation_ls':      282         0  1'376'141   399'295         31'019        384'405
          'violation_ls':      283         0  1'873'482   302'410         22'703        217'007

Solutions (19)                   Num     Rank
               'graph_dec_lns':    1  [13,13]
                       'no_lp':    8   [2,14]
         'quick_restart_no_lp':    2   [1,12]
                 'rins_lp_lns':    1  [17,17]
               'rins_pump_lns':    1  [19,19]
                 'rnd_cst_lns':    1  [18,18]
  'scheduling_precedences_lns':    1  [16,16]
  'scheduling_time_window_lns':    1  [15,15]
                'violation_ls':    3   [3,10]

Objective bounds                     Num
                            'core':    1
                  'initial_domain':    1
             'objective_lb_search':    5
      'objective_lb_search_max_lp':    2
       'objective_lb_search_no_lp':   94
  'objective_shaving_search_no_lp':    5
             'quick_restart_no_lp':    1

Solution repositories    Added  Queried  Ignored  Synchro
  'feasible solutions':  2'737    6'415        5    2'572
        'lp solutions':  1'564      127        0    1'167
                'pump':  5'835      155

Improving bounds shared            Num
                        'core':     73
                  'default_lp':    100
              'lb_tree_search':      4
                      'max_lp':     54
                       'no_lp':    326
         'objective_lb_search':     20
  'objective_lb_search_max_lp':    105
   'objective_lb_search_no_lp':     18
                     'probing':    542
              'probing_max_lp':    228
                'pseudo_costs':    183
               'quick_restart':  1'039
         'quick_restart_no_lp':  3'411
               'reduced_costs':    135

Clauses shared                   Num
                        'core':    4
                  'default_lp':   23
              'lb_tree_search':   17
                      'max_lp':    8
                       'no_lp':   34
         'objective_lb_search':   14
  'objective_lb_search_max_lp':   31
   'objective_lb_search_no_lp':    7
                'pseudo_costs':   97
               'quick_restart':    7
         'quick_restart_no_lp':   10
               'reduced_costs':   28

CpSolverResponse summary:
status: OPTIMAL
objective: 875
best_bound: 875
integers: 246
booleans: 104
conflicts: 5
branches: 205
propagations: 135
integer_propagations: 5551
restarts: 158
lp_iterations: 0
walltime: 79.6085
usertime: 79.6085
deterministic_time: 936.63
gap_integral: 2331.58
solution_fingerprint: 0xc25db39d18c8f7fb


--- Simulation Gantt  partir du modle mathmatique ---
