created virtual environment CPython3.12.4.final.0-64 in 3557ms
  creator CPython3Posix(dest=/localscratch/aneumann.63447106.0/env, clear=False, no_vcs_ignore=False, global=False)
  seeder FromAppData(download=False, pip=bundle, via=copy, app_data_dir=/home/aneumann/.local/share/virtualenv)
    added seed packages: pip==25.1.1
  activators BashActivator,CShellActivator,FishActivator,NushellActivator,PowerShellActivator,PythonActivator
Looking in links: /cvmfs/soft.computecanada.ca/custom/python/wheelhouse/gentoo2023/x86-64-v3, /cvmfs/soft.computecanada.ca/custom/python/wheelhouse/gentoo2023/generic, /cvmfs/soft.computecanada.ca/custom/python/wheelhouse/generic
Requirement already satisfied: pip in /localscratch/aneumann.63447106.0/env/lib/python3.12/site-packages (25.1.1)
Looking in links: /cvmfs/soft.computecanada.ca/custom/python/wheelhouse/gentoo2023/x86-64-v3, /cvmfs/soft.computecanada.ca/custom/python/wheelhouse/gentoo2023/generic, /cvmfs/soft.computecanada.ca/custom/python/wheelhouse/generic
ERROR: protobuf-5.28.3-cp38-abi3-manylinux2014_x86_64.whl is not a supported wheel on this platform.
Looking in links: /cvmfs/soft.computecanada.ca/custom/python/wheelhouse/gentoo2023/x86-64-v3, /cvmfs/soft.computecanada.ca/custom/python/wheelhouse/gentoo2023/generic, /cvmfs/soft.computecanada.ca/custom/python/wheelhouse/generic
Processing /home/aneumann/projects/def-adhaj/aneumann/GNRS/wheels/immutabledict-4.2.0-py3-none-any.whl
Installing collected packages: immutabledict
Successfully installed immutabledict-4.2.0
Looking in links: /cvmfs/soft.computecanada.ca/custom/python/wheelhouse/gentoo2023/x86-64-v3, /cvmfs/soft.computecanada.ca/custom/python/wheelhouse/gentoo2023/generic, /cvmfs/soft.computecanada.ca/custom/python/wheelhouse/generic
Processing /cvmfs/soft.computecanada.ca/custom/python/wheelhouse/generic/ortools-9.10.4067+computecanada-cp312-cp312-linux_x86_64.whl (from -r /home/aneumann/projects/def-adhaj/aneumann/GNRS/requirements/or.txt (line 1))
Processing /cvmfs/soft.computecanada.ca/custom/python/wheelhouse/gentoo2023/x86-64-v3/matplotlib-3.10.0+computecanada-cp312-cp312-linux_x86_64.whl (from -r /home/aneumann/projects/def-adhaj/aneumann/GNRS/requirements/or.txt (line 2))
Processing /cvmfs/soft.computecanada.ca/custom/python/wheelhouse/gentoo2023/x86-64-v3/pandas-2.2.3+computecanada-cp312-cp312-linux_x86_64.whl (from -r /home/aneumann/projects/def-adhaj/aneumann/GNRS/requirements/or.txt (line 3))
Processing /cvmfs/soft.computecanada.ca/custom/python/wheelhouse/generic/absl_py-2.2.2+computecanada-py3-none-any.whl (from ortools<9.11,>=9.10->-r /home/aneumann/projects/def-adhaj/aneumann/GNRS/requirements/or.txt (line 1))
Processing /cvmfs/soft.computecanada.ca/custom/python/wheelhouse/gentoo2023/generic/numpy-2.2.2+computecanada-cp312-cp312-linux_x86_64.whl (from ortools<9.11,>=9.10->-r /home/aneumann/projects/def-adhaj/aneumann/GNRS/requirements/or.txt (line 1))
Processing /cvmfs/soft.computecanada.ca/custom/python/wheelhouse/gentoo2023/x86-64-v3/protobuf-6.30.2+computecanada-cp312-cp312-linux_x86_64.whl (from ortools<9.11,>=9.10->-r /home/aneumann/projects/def-adhaj/aneumann/GNRS/requirements/or.txt (line 1))
Requirement already satisfied: immutabledict>=3.0.0 in /localscratch/aneumann.63447106.0/env/lib/python3.12/site-packages (from ortools<9.11,>=9.10->-r /home/aneumann/projects/def-adhaj/aneumann/GNRS/requirements/or.txt (line 1)) (4.2.0)
Processing /cvmfs/soft.computecanada.ca/custom/python/wheelhouse/gentoo2023/generic/contourpy-1.3.1+computecanada-cp312-cp312-linux_x86_64.whl (from matplotlib->-r /home/aneumann/projects/def-adhaj/aneumann/GNRS/requirements/or.txt (line 2))
Processing /cvmfs/soft.computecanada.ca/custom/python/wheelhouse/generic/cycler-0.12.1+computecanada-py3-none-any.whl (from matplotlib->-r /home/aneumann/projects/def-adhaj/aneumann/GNRS/requirements/or.txt (line 2))
Processing /cvmfs/soft.computecanada.ca/custom/python/wheelhouse/generic/fonttools-4.58.2+computecanada-cp312-cp312-linux_x86_64.whl (from matplotlib->-r /home/aneumann/projects/def-adhaj/aneumann/GNRS/requirements/or.txt (line 2))
Processing /cvmfs/soft.computecanada.ca/custom/python/wheelhouse/gentoo2023/x86-64-v3/kiwisolver-1.4.8+computecanada-cp312-cp312-linux_x86_64.whl (from matplotlib->-r /home/aneumann/projects/def-adhaj/aneumann/GNRS/requirements/or.txt (line 2))
Processing /cvmfs/soft.computecanada.ca/custom/python/wheelhouse/generic/packaging-25.0+computecanada-py3-none-any.whl (from matplotlib->-r /home/aneumann/projects/def-adhaj/aneumann/GNRS/requirements/or.txt (line 2))
Processing /cvmfs/soft.computecanada.ca/custom/python/wheelhouse/gentoo2023/x86-64-v3/pillow-11.1.0+computecanada-cp312-cp312-linux_x86_64.whl (from matplotlib->-r /home/aneumann/projects/def-adhaj/aneumann/GNRS/requirements/or.txt (line 2))
Processing /cvmfs/soft.computecanada.ca/custom/python/wheelhouse/generic/pyparsing-3.2.1+computecanada-py3-none-any.whl (from matplotlib->-r /home/aneumann/projects/def-adhaj/aneumann/GNRS/requirements/or.txt (line 2))
Processing /cvmfs/soft.computecanada.ca/custom/python/wheelhouse/generic/python_dateutil-2.9.0.post0+computecanada-py2.py3-none-any.whl (from matplotlib->-r /home/aneumann/projects/def-adhaj/aneumann/GNRS/requirements/or.txt (line 2))
Processing /cvmfs/soft.computecanada.ca/custom/python/wheelhouse/generic/pytz-2025.2+computecanada-py2.py3-none-any.whl (from pandas->-r /home/aneumann/projects/def-adhaj/aneumann/GNRS/requirements/or.txt (line 3))
Processing /cvmfs/soft.computecanada.ca/custom/python/wheelhouse/generic/tzdata-2025.2+computecanada-py2.py3-none-any.whl (from pandas->-r /home/aneumann/projects/def-adhaj/aneumann/GNRS/requirements/or.txt (line 3))
Processing /cvmfs/soft.computecanada.ca/custom/python/wheelhouse/generic/six-1.17.0+computecanada-py2.py3-none-any.whl (from python-dateutil>=2.7->matplotlib->-r /home/aneumann/projects/def-adhaj/aneumann/GNRS/requirements/or.txt (line 2))
Installing collected packages: pytz, tzdata, six, pyparsing, protobuf, pillow, packaging, numpy, kiwisolver, fonttools, cycler, absl-py, python-dateutil, contourpy, pandas, matplotlib, ortools

Successfully installed absl-py-2.2.2+computecanada contourpy-1.3.1+computecanada cycler-0.12.1+computecanada fonttools-4.58.2+computecanada kiwisolver-1.4.8+computecanada matplotlib-3.10.0+computecanada numpy-2.2.2+computecanada ortools-9.10.4067+computecanada packaging-25.0+computecanada pandas-2.2.3+computecanada pillow-11.1.0+computecanada protobuf-6.30.2+computecanada pyparsing-3.2.1+computecanada python-dateutil-2.9.0.post0+computecanada pytz-2025.2+computecanada six-1.17.0+computecanada tzdata-2025.2+computecanada

Starting CP-SAT solver v9.10.4067
Parameters: max_time_in_seconds: 3600 max_memory_in_mb: 12000 log_search_progress: true enumerate_all_solutions: false absolute_gap_limit: 0 relative_gap_limit: 0
Setting number of workers to 32

Initial optimization model '': (model_fingerprint: 0x50576ad4c0553fc8)
#Variables: 1'162 (#ints: 19 in objective)
  - 945 Booleans in [0,1]
  - 217 in [0,1486]
#kLinear1: 99
#kLinear2: 3'114
#kLinear3: 990
#kLinearN: 38'052 (#terms: 991'801)

Starting presolve at 0.02s
  5.25e-02s  0.00e+00d  [DetectDominanceRelations] 
  1.01e+00s  0.00e+00d  [PresolveToFixPoint] #num_loops=6 #num_dual_strengthening=3 
  2.86e-04s  0.00e+00d  [ExtractEncodingFromLinear] #potential_supersets=11 
[Symmetry] Graph for symmetry has 41'285 nodes and 866'134 arcs.
[Symmetry] Symmetry computation done. time: 0.0531251 dtime: 0.0780856
[Symmetry] #generators: 1, average support size: 58
[Symmetry] The model contains 1830 duplicate constraints !
[Symmetry] 29 orbits with sizes: 2,2,2,2,2,2,2,2,2,2,...
[Symmetry] Num fixable by intersecting at_most_one with orbits: 1 largest_orbit: 2
  5.10e-01s  8.37e-02d  [Probe] #probed=1'598 #fixed_bools=9 #new_bounds=32 #equiv=1 
  2.17e-04s  0.00e+00d  [MaxClique] 
  5.25e-02s  0.00e+00d  [DetectDominanceRelations] 
  5.17e-01s  0.00e+00d  [PresolveToFixPoint] #num_loops=4 #num_dual_strengthening=3 
  1.95e-01s  0.00e+00d  [ProcessAtMostOneAndLinear] 
  5.75e-02s  0.00e+00d  [DetectDuplicateConstraints] #duplicates=2'231 #without_enforcements=240 
  1.10e-01s  4.59e-03d  [DetectDominatedLinearConstraints] #relevant_constraints=35'323 #num_inclusions=6'957 #num_redundant=5 
  6.02e-03s  0.00e+00d  [DetectDifferentVariables] #different=176 
  1.88e-02s  1.51e-03d  [ProcessSetPPC] #relevant_constraints=34'182 
  2.84e-04s  0.00e+00d  [FindAlmostIdenticalLinearConstraints] 
  9.53e-03s  9.38e-03d  [FindBigAtMostOneAndLinearOverlap] 
  4.84e-01s  1.57e-01d  [FindBigVerticalLinearOverlap] #blocks=485 #saved_nz=254'867 
  7.51e-03s  2.80e-03d  [FindBigHorizontalLinearOverlap] #linears=33'458 
  2.19e-04s  0.00e+00d  [MergeClauses] 
  4.91e-02s  0.00e+00d  [DetectDominanceRelations] 
  4.47e-01s  0.00e+00d  [PresolveToFixPoint] #num_loops=3 #num_dual_strengthening=1 
  4.89e-02s  0.00e+00d  [DetectDominanceRelations] 
  2.66e-01s  0.00e+00d  [PresolveToFixPoint] #num_loops=1 #num_dual_strengthening=1 
[Symmetry] Graph for symmetry has 40'503 nodes and 604'853 arcs.
[Symmetry] Symmetry computation done. time: 0.0218418 dtime: 0.0348558
  4.05e-01s  6.15e-02d  [Probe] #probed=1'582 #new_bounds=443 #new_binary_clauses=23 
  1.75e-04s  0.00e+00d  [MaxClique] 
  4.98e-02s  0.00e+00d  [DetectDominanceRelations] 
  5.00e-01s  0.00e+00d  [PresolveToFixPoint] #num_loops=5 #num_dual_strengthening=3 
  1.85e-01s  0.00e+00d  [ProcessAtMostOneAndLinear] 
  4.97e-02s  0.00e+00d  [DetectDuplicateConstraints] #without_enforcements=240 
  7.16e-02s  3.39e-03d  [DetectDominatedLinearConstraints] #relevant_constraints=35'309 #num_inclusions=311 
  5.80e-03s  0.00e+00d  [DetectDifferentVariables] #different=195 #cliques=4 #size=12 
  1.53e-02s  9.82e-04d  [ProcessSetPPC] #relevant_constraints=33'463 
  3.82e-04s  4.39e-06d  [FindAlmostIdenticalLinearConstraints] #num_tested_pairs=276 
  3.92e-03s  3.44e-03d  [FindBigAtMostOneAndLinearOverlap] 
  2.10e-01s  7.47e-02d  [FindBigVerticalLinearOverlap] #blocks=1'437 #saved_nz=195'983 
  6.13e-03s  1.69e-03d  [FindBigHorizontalLinearOverlap] #linears=28'302 
  2.30e-04s  0.00e+00d  [MergeClauses] 
  3.29e-02s  0.00e+00d  [DetectDominanceRelations] 
  4.17e-01s  0.00e+00d  [PresolveToFixPoint] #num_loops=3 #num_dual_strengthening=1 
  3.58e-02s  0.00e+00d  [DetectDominanceRelations] 
  2.68e-01s  0.00e+00d  [PresolveToFixPoint] #num_loops=1 #num_dual_strengthening=1 
  3.21e-01s  4.22e-02d  [Probe] #probed=1'582 #new_bounds=838 #new_binary_clauses=23 
  1.84e-04s  0.00e+00d  [MaxClique] 
  3.28e-02s  0.00e+00d  [DetectDominanceRelations] 
  3.91e-01s  0.00e+00d  [PresolveToFixPoint] #num_loops=2 #num_dual_strengthening=1 
  1.50e-01s  0.00e+00d  [ProcessAtMostOneAndLinear] 
  4.60e-02s  0.00e+00d  [DetectDuplicateConstraints] #without_enforcements=240 
  4.51e-02s  2.22e-03d  [DetectDominatedLinearConstraints] #relevant_constraints=36'073 #num_inclusions=106 
  5.09e-03s  0.00e+00d  [DetectDifferentVariables] 
  1.07e-02s  5.65e-04d  [ProcessSetPPC] #relevant_constraints=28'403 
  8.46e-04s  7.40e-05d  [FindAlmostIdenticalLinearConstraints] #num_tested_pairs=3'592 
  2.90e-03s  2.11e-03d  [FindBigAtMostOneAndLinearOverlap] 
  1.25e-01s  3.70e-02d  [FindBigVerticalLinearOverlap] #blocks=1'286 #saved_nz=104'826 
  4.50e-03s  1.03e-03d  [FindBigHorizontalLinearOverlap] #linears=21'158 
  2.41e-04s  0.00e+00d  [MergeClauses] 
  2.56e-02s  0.00e+00d  [DetectDominanceRelations] 
  4.41e-01s  0.00e+00d  [PresolveToFixPoint] #num_loops=6 #num_dual_strengthening=1 
  1.69e-03s  0.00e+00d  [ExpandObjective] #entries=14'753 #tight_variables=4'676 #tight_constraints=2'472 

Presolve summary:
  - 363 affine relations were detected.
  - rule 'TODO dual: only one blocking constraint?' was applied 3'144 times.
  - rule 'TODO dual: only one unspecified blocking constraint?' was applied 285 times.
  - rule 'TODO duplicate: identical constraint with different enforcements' was applied 720 times.
  - rule 'TODO no_overlap: with task always last' was applied 4 times.
  - rule 'affine: new relation' was applied 363 times.
  - rule 'all_diff: inferred from x != y constraints' was applied 4 times.
  - rule 'at_most_one: removed literals' was applied 5 times.
  - rule 'at_most_one: size one' was applied 5 times.
  - rule 'deductions: 3109 stored' was applied 1 time.
  - rule 'dual: fix variable' was applied 54 times.
  - rule 'dual: reduced domain' was applied 140 times.
  - rule 'duplicate: merged rhs of linear constraint' was applied 411 times.
  - rule 'duplicate: removed constraint' was applied 2'231 times.
  - rule 'enforcement: false literal' was applied 55 times.
  - rule 'enforcement: true literal' was applied 40 times.
  - rule 'exactly_one: x and not(x)' was applied 1 time.
  - rule 'incompatible linear: add implication' was applied 360 times.
  - rule 'linear inclusion: redundant containing constraint' was applied 5 times.
  - rule 'linear matrix: common vertical rectangle' was applied 3'208 times.
  - rule 'linear: always true' was applied 2'962 times.
  - rule 'linear: doubleton free' was applied 27 times.
  - rule 'linear: empty' was applied 68 times.
  - rule 'linear: extracted enforcement literal' was applied 38'147 times.
  - rule 'linear: fixed or dup variables' was applied 38'624 times.
  - rule 'linear: positive equal one' was applied 11 times.
  - rule 'linear: reduced variable domains' was applied 2'540 times.
  - rule 'linear: remapped using affine relations' was applied 38'171 times.
  - rule 'linear: simplified rhs' was applied 159'701 times.
  - rule 'linear: variable substitution 1' was applied 27 times.
  - rule 'linear: variable substitution 2' was applied 413 times.
  - rule 'linear: variable substitution 3' was applied 183 times.
  - rule 'presolve: 209 unused variables removed.' was applied 1 time.
  - rule 'presolve: iteration' was applied 3 times.
  - rule 'probing: reduced enforced constraint to implication.' was applied 5 times.
  - rule 'symmetry: fixed to false in general orbit' was applied 1 time.

Presolved optimization model '': (model_fingerprint: 0xc4342ec24470d1fb)
#Variables: 3'175 (#ints: 19 in objective)
  - 400 Booleans in [0,1]
  - 2'101 different domains in [-29587,32508] with a largest complexity of 23.
#kAllDiff: 4
#kExactlyOne: 10 (#literals: 30)
#kLinear1: 1 (#enforced: 1 #multi: 1)
#kLinear2: 2'973 (#enforced: 2'793 #multi: 1'129)
#kLinear3: 7'295 (#enforced: 5'750)
#kLinearN: 28'872 (#enforced: 27'231) (#terms: 237'013)

Preloading model.
#Bound   7.67s best:inf   next:[252,24988] initial_domain
#Model   7.73s var:3175/3175 constraints:39155/39155

Starting search at 7.76s with 32 workers.
16 full problem subsolvers: [core, default_lp, lb_tree_search, max_lp, no_lp, objective_lb_search, objective_lb_search_max_lp, objective_lb_search_no_lp, objective_shaving_search_max_lp, objective_shaving_search_no_lp, probing, probing_max_lp, pseudo_costs, quick_restart, quick_restart_no_lp, reduced_costs]
14 first solution subsolvers: [fj_long_default, fj_long_lin_default, fj_long_random, fj_short_default, fj_short_lin_default, fj_short_lin_random, fj_short_random, fs_random(2), fs_random_no_lp(2), fs_random_quick_restart(2), fs_random_quick_restart_no_lp]
11 incomplete subsolvers: [feasibility_pump, graph_arc_lns, graph_cst_lns, graph_dec_lns, graph_var_lns, rins/rens, rnd_cst_lns, rnd_var_lns, violation_ls(3)]
3 helper subsolvers: [neighborhood_helper, synchronization_agent, update_gap_integral]
#Bound   8.34s best:inf   next:[357,24988] objective_lb_search_no_lp
#1       8.58s best:10484 next:[357,10483] fs_random_quick_restart_no_lp (fixed_bools=0/471)
#2       8.66s best:10423 next:[357,10422] no_lp (fixed_bools=0/471)
#3       9.67s best:9510  next:[357,9509] no_lp (fixed_bools=0/509)
#Bound   9.88s best:9510  next:[358,9509] objective_shaving_search_max_lp (vars=3176 csts=39166)
#4       9.92s best:9509  next:[358,9508] violation_ls(batch:8 #solutions_imported:2 #lin_moves:69'391 #lin_evals:229'272 #gen_moves:6'354 #gen_evals:743 #comp_moves:576 #backtracks:2'889 #weight_updates:674)
#5       9.93s best:9508  next:[358,9507] violation_ls(batch:9 #solutions_imported:3 #lin_moves:69'392 #lin_evals:229'291 #gen_moves:6'354 #gen_evals:743 #comp_moves:576 #backtracks:2'889 #weight_updates:674)
#6       9.97s best:9507  next:[358,9506] violation_ls(batch:7 #solutions_imported:3 #lin_moves:9'784 #lin_evals:139'197 #gen_moves:23'691 #gen_evals:4'407 #comp_moves:4'633 #backtracks:9'520 #weight_updates:363)
#7       9.98s best:9506  next:[358,9505] violation_ls(batch:8 #solutions_imported:4 #lin_moves:9'785 #lin_evals:139'214 #gen_moves:23'691 #gen_evals:4'407 #comp_moves:4'633 #backtracks:9'520 #weight_updates:363)
#Bound  10.11s best:9506  next:[444,9505] objective_lb_search
#8      10.20s best:9268  next:[444,9267] no_lp (fixed_bools=0/544)
#9      10.28s best:9267  next:[444,9266] violation_ls(batch:9 #solutions_imported:4 #lin_moves:0 #lin_evals:163'132 #gen_moves:46'528 #gen_evals:6'190 #comp_moves:7'549 #backtracks:19'469 #weight_updates:394)
#10     10.28s best:9266  next:[444,9265] violation_ls(batch:10 #solutions_imported:5 #lin_moves:1 #lin_evals:163'151 #gen_moves:46'528 #gen_evals:6'190 #comp_moves:7'549 #backtracks:19'469 #weight_updates:394)
#11     10.50s best:9265  next:[444,9264] violation_ls(batch:11 #solutions_imported:7 #lin_moves:19'504 #lin_evals:224'850 #gen_moves:32'933 #gen_evals:5'541 #comp_moves:5'930 #backtracks:13'492 #weight_updates:758)
#12     10.58s best:9264  next:[444,9263] violation_ls(batch:12 #solutions_imported:8 #lin_moves:19'505 #lin_evals:224'868 #gen_moves:32'933 #gen_evals:5'541 #comp_moves:5'930 #backtracks:13'492 #weight_updates:758)
#13     10.62s best:9263  next:[444,9262] violation_ls(batch:12 #solutions_imported:7 #lin_moves:801 #lin_evals:190'048 #gen_moves:54'458 #gen_evals:7'141 #comp_moves:7'951 #backtracks:23'231 #weight_updates:631)
#14     10.79s best:9253  next:[444,9252] no_lp (fixed_bools=0/553)
#15     11.19s best:9252  next:[444,9251] violation_ls(batch:13 #solutions_imported:9 #lin_moves:21'251 #lin_evals:231'023 #gen_moves:32'933 #gen_evals:5'541 #comp_moves:5'930 #backtracks:13'492 #weight_updates:947)
#16     11.20s best:9251  next:[444,9250] violation_ls(batch:13 #solutions_imported:7 #lin_moves:79'224 #lin_evals:306'236 #gen_moves:16'506 #gen_evals:1'890 #comp_moves:1'661 #backtracks:7'422 #weight_updates:960)
#17     11.31s best:9250  next:[444,9249] violation_ls(batch:13 #solutions_imported:8 #lin_moves:801 #lin_evals:202'871 #gen_moves:58'646 #gen_evals:7'682 #comp_moves:8'165 #backtracks:25'218 #weight_updates:697)
#Bound  11.59s best:9250  next:[445,9249] objective_lb_search
#18     11.60s best:8575  next:[445,8574] rnd_cst_lns (d=0.98 s=163 t=0.10 p=1.00 stall=9 h=auto_l0)
#19     11.97s best:8570  next:[445,8569] quick_restart_no_lp (fixed_bools=0/610)
#20     12.12s best:8551  next:[445,8550] no_lp (fixed_bools=0/561)
#21     12.40s best:8535  next:[445,8534] graph_var_lns (d=0.98 s=175 t=0.10 p=1.00 stall=2 h=auto_l0)
#22     12.68s best:8485  next:[445,8484] rins_lp_lns (d=0.83 s=201 t=0.10 p=0.67 stall=1 h=auto_l0)
#23     12.70s best:8484  next:[445,8483] violation_ls(batch:15 #solutions_imported:9 #lin_moves:79'540 #lin_evals:331'628 #gen_moves:24'187 #gen_evals:2'850 #comp_moves:2'014 #backtracks:11'083 #weight_updates:1'198)
#24     12.90s best:8334  next:[445,8333] graph_var_lns (d=0.98 s=164 t=0.10 p=1.00 stall=2 h=auto_l0)
#25     13.20s best:8182  next:[445,8181] rins_pump_lns (d=0.88 s=191 t=0.10 p=0.80 stall=0 h=auto_l0)
#Bound  13.37s best:8182  next:[494,8181] objective_lb_search_no_lp
#26     13.88s best:8035  next:[494,8034] graph_arc_lns (d=0.99 s=186 t=0.10 p=1.00 stall=0 h=auto_l0)
#27     14.15s best:7992  next:[494,7991] rnd_var_lns (d=0.99 s=195 t=0.10 p=1.00 stall=11 h=folio_rnd)
#28     14.17s best:7991  next:[494,7990] violation_ls(batch:17 #solutions_imported:13 #lin_moves:21'472 #lin_evals:305'975 #gen_moves:56'582 #gen_evals:8'285 #comp_moves:7'149 #backtracks:24'701 #weight_updates:1'386)
#29     14.18s best:7990  next:[494,7989] violation_ls(batch:17 #solutions_imported:12 #lin_moves:11'049 #lin_evals:283'203 #gen_moves:73'939 #gen_evals:9'536 #comp_moves:9'125 #backtracks:32'380 #weight_updates:1'395)
#30     15.18s best:7895  next:[494,7894] graph_var_lns (d=0.99 s=207 t=0.10 p=1.00 stall=0 h=auto_l0)
#Bound  15.30s best:7895  next:[501,7894] objective_lb_search_max_lp
#31     15.52s best:7894  next:[501,7893] violation_ls(batch:18 #solutions_imported:12 #lin_moves:89'915 #lin_evals:374'468 #gen_moves:24'187 #gen_evals:2'850 #comp_moves:2'014 #backtracks:11'083 #weight_updates:3'707)
#32     15.53s best:7893  next:[501,7892] violation_ls(batch:18 #solutions_imported:13 #lin_moves:11'049 #lin_evals:283'230 #gen_moves:73'949 #gen_evals:9'538 #comp_moves:9'127 #backtracks:32'384 #weight_updates:1'395)
#Bound  16.46s best:7893  next:[502,7892] objective_lb_search_no_lp
#33     16.58s best:7686  next:[502,7685] rnd_cst_lns (d=0.99 s=228 t=0.10 p=1.00 stall=0 h=auto_l0)
#34     16.73s best:7333  next:[502,7332] rnd_cst_lns (d=0.99 s=218 t=0.10 p=1.00 stall=0 h=auto_l0)
#35     16.78s best:7332  next:[502,7331] violation_ls(batch:19 #solutions_imported:13 #lin_moves:92'450 #lin_evals:385'512 #gen_moves:24'187 #gen_evals:2'850 #comp_moves:2'014 #backtracks:11'083 #weight_updates:4'529)
#Bound  16.95s best:7332  next:[518,7331] objective_lb_search_no_lp
#Bound  17.30s best:7332  next:[541,7331] objective_lb_search_no_lp
#Bound  17.74s best:7332  next:[651,7331] objective_lb_search_max_lp
#36     18.07s best:7331  next:[651,7330] quick_restart_no_lp (fixed_bools=0/810)
#37     18.21s best:7243  next:[651,7242] rins_lp_lns (d=0.87 s=263 t=0.10 p=0.62 stall=0 h=auto_l0)
#Bound  20.77s best:7243  next:[653,7242] objective_lb_search_max_lp
#38     25.62s best:7160  next:[653,7159] graph_dec_lns (d=0.99 s=294 t=0.10 p=0.84 stall=0 h=auto_l0)
#39     26.53s best:7159  next:[653,7158] violation_ls(batch:25 #solutions_imported:17 #lin_moves:75'802 #lin_evals:564'353 #gen_moves:71'766 #gen_evals:10'015 #comp_moves:8'501 #backtracks:31'617 #weight_updates:2'998)
#40     26.54s best:7158  next:[653,7157] violation_ls(batch:25 #solutions_imported:16 #lin_moves:11'049 #lin_evals:423'441 #gen_moves:110'931 #gen_evals:13'802 #comp_moves:16'415 #backtracks:47'217 #weight_updates:1'677)
#41     26.68s best:7068  next:[653,7067] rins_lp_lns (d=0.87 s=315 t=0.10 p=0.59 stall=3 h=auto_l0)
#42     28.68s best:7054  next:[653,7053] quick_restart_no_lp (fixed_bools=0/1008)
#43     29.08s best:7011  next:[653,7010] graph_var_lns (d=0.99 s=321 t=0.10 p=0.74 stall=4 h=auto_l0)
#44     30.26s best:7001  next:[653,7000] rins_lp_lns (d=0.89 s=335 t=0.10 p=0.61 stall=0 h=auto_l0)
#45     30.45s best:7000  next:[653,6999] violation_ls(batch:28 #solutions_imported:19 #lin_moves:15'784 #lin_evals:489'609 #gen_moves:128'601 #gen_evals:15'426 #comp_moves:17'079 #backtracks:55'717 #weight_updates:2'173)
#46     31.16s best:6999  next:[653,6998] violation_ls(batch:29 #solutions_imported:21 #lin_moves:85'616 #lin_evals:664'291 #gen_moves:88'141 #gen_evals:11'669 #comp_moves:9'752 #backtracks:39'175 #weight_updates:3'372)
#47     31.16s best:6949  next:[653,6948] graph_var_lns (d=0.99 s=341 t=0.10 p=0.72 stall=0 h=auto_l0)
#48     31.26s best:6948  next:[653,6947] violation_ls(batch:29 #solutions_imported:20 #lin_moves:15'784 #lin_evals:506'600 #gen_moves:133'877 #gen_evals:15'728 #comp_moves:17'679 #backtracks:58'055 #weight_updates:2'234)
#49     31.60s best:6947  next:[653,6946] quick_restart_no_lp (fixed_bools=0/1088)
#50     32.59s best:6917  next:[653,6916] rins_lp_lns (d=0.87 s=365 t=0.10 p=0.57 stall=1 h=auto_l0)
#51     32.63s best:6916  next:[653,6915] violation_ls(batch:30 #solutions_imported:22 #lin_moves:88'137 #lin_evals:674'762 #gen_moves:88'141 #gen_evals:11'669 #comp_moves:9'752 #backtracks:39'175 #weight_updates:3'970)
#52     32.63s best:6894  next:[653,6893] rnd_var_lns (d=0.99 s=349 t=0.10 p=0.73 stall=1 h=auto_l0)
#53     32.65s best:6893  next:[653,6892] violation_ls(batch:30 #solutions_imported:21 #lin_moves:16'509 #lin_evals:510'164 #gen_moves:133'877 #gen_evals:15'728 #comp_moves:17'679 #backtracks:58'055 #weight_updates:2'561)
#54     34.40s best:6892  next:[653,6891] violation_ls(batch:31 #solutions_imported:23 #lin_moves:88'137 #lin_evals:674'775 #gen_moves:88'149 #gen_evals:11'669 #comp_moves:9'754 #backtracks:39'178 #weight_updates:3'970)
#55     35.30s best:6889  next:[653,6888] rins_lp_lns (d=0.89 s=375 t=0.10 p=0.59 stall=0 h=auto_l0)
#56     35.78s best:6572  next:[653,6571] graph_arc_lns (d=0.99 s=372 t=0.10 p=0.70 stall=0 h=auto_l0)
#57     36.20s best:6571  next:[653,6570] violation_ls(batch:32 #solutions_imported:24 #lin_moves:88'297 #lin_evals:675'711 #gen_moves:88'149 #gen_evals:11'669 #comp_moves:9'754 #backtracks:39'178 #weight_updates:4'058)
#58     36.21s best:6570  next:[653,6569] violation_ls(batch:32 #solutions_imported:22 #lin_moves:121'756 #lin_evals:738'890 #gen_moves:99'789 #gen_evals:9'868 #comp_moves:5'729 #backtracks:47'016 #weight_updates:6'072)
#59     36.27s best:6569  next:[653,6568] violation_ls(batch:32 #solutions_imported:23 #lin_moves:26'280 #lin_evals:561'512 #gen_moves:137'217 #gen_evals:15'997 #comp_moves:17'887 #backtracks:59'621 #weight_updates:2'847)
#Bound  36.28s best:6569  next:[670,6568] objective_lb_search_max_lp
#60     37.82s best:6568  next:[670,6567] violation_ls(batch:33 #solutions_imported:25 #lin_moves:88'354 #lin_evals:676'073 #gen_moves:88'149 #gen_evals:11'669 #comp_moves:9'754 #backtracks:39'178 #weight_updates:4'112)
#Bound  38.99s best:6568  next:[680,6567] objective_lb_search_max_lp
#61     39.99s best:6567  next:[680,6566] violation_ls(batch:34 #solutions_imported:26 #lin_moves:88'725 #lin_evals:678'104 #gen_moves:88'149 #gen_evals:11'669 #comp_moves:9'754 #backtracks:39'178 #weight_updates:4'343)
#62     40.00s best:6566  next:[680,6565] violation_ls(batch:34 #solutions_imported:24 #lin_moves:131'588 #lin_evals:774'499 #gen_moves:99'789 #gen_evals:9'868 #comp_moves:5'729 #backtracks:47'016 #weight_updates:6'332)
#63     40.03s best:6565  next:[680,6564] violation_ls(batch:34 #solutions_imported:25 #lin_moves:27'148 #lin_evals:590'513 #gen_moves:144'793 #gen_evals:16'889 #comp_moves:18'562 #backtracks:63'067 #weight_updates:3'072)
#64     40.09s best:6550  next:[680,6549] graph_var_lns (d=0.99 s=393 t=0.10 p=0.72 stall=0 h=auto_l0)
#65     41.31s best:6549  next:[680,6548] violation_ls(batch:35 #solutions_imported:25 #lin_moves:131'895 #lin_evals:776'087 #gen_moves:99'789 #gen_evals:9'868 #comp_moves:5'729 #backtracks:47'016 #weight_updates:6'465)
#66     41.31s best:6548  next:[680,6547] violation_ls(batch:35 #solutions_imported:26 #lin_moves:27'149 #lin_evals:590'532 #gen_moves:144'793 #gen_evals:16'889 #comp_moves:18'562 #backtracks:63'067 #weight_updates:3'072)
#67     41.63s best:6519  next:[680,6518] rnd_cst_lns (d=0.99 s=402 t=0.10 p=0.72 stall=0 h=auto_l0)
#68     42.82s best:6518  next:[680,6517] violation_ls(batch:36 #solutions_imported:28 #lin_moves:98'851 #lin_evals:720'533 #gen_moves:88'149 #gen_evals:11'669 #comp_moves:9'754 #backtracks:39'178 #weight_updates:4'735)
#69     43.00s best:6517  next:[680,6516] violation_ls(batch:36 #solutions_imported:27 #lin_moves:28'617 #lin_evals:595'708 #gen_moves:144'793 #gen_evals:16'889 #comp_moves:18'562 #backtracks:63'067 #weight_updates:3'259)
#70     43.96s best:6505  next:[680,6504] graph_var_lns (d=0.99 s=425 t=0.10 p=0.72 stall=0 h=auto_l0)
#71     44.66s best:6498  next:[680,6497] rnd_var_lns (d=1.00 s=413 t=0.10 p=0.74 stall=0 h=auto_l0)
#72     44.78s best:6497  next:[680,6496] rins_lp_lns (d=0.85 s=439 t=0.10 p=0.54 stall=2 h=auto_l0)
#73     45.66s best:6444  next:[680,6443] graph_var_lns (d=0.99 s=435 t=0.10 p=0.70 stall=1 h=auto_l0)
#74     46.08s best:6434  next:[680,6433] rins_lp_lns (d=0.87 s=449 t=0.10 p=0.55 stall=0 h=auto_l0)
#75     52.10s best:6432  next:[680,6431] graph_var_lns (d=0.99 s=465 t=0.10 p=0.68 stall=0 h=auto_l0)
#76     53.19s best:6430  next:[680,6429] rins_lp_lns (d=0.87 s=489 t=0.10 p=0.55 stall=1 h=auto_l0)
#77     53.24s best:6305  next:[680,6304] graph_var_lns (d=0.99 s=475 t=0.10 p=0.66 stall=0 h=auto_l0)
#Bound  56.01s best:6305  next:[681,6304] objective_shaving_search_max_lp (vars=4018 csts=39619)
#78     57.76s best:6290  next:[681,6289] rnd_var_lns (d=1.00 s=503 t=0.10 p=0.69 stall=0 h=auto_l0)
#79     58.37s best:6194  next:[681,6193] graph_var_lns (d=0.99 s=505 t=0.10 p=0.68 stall=0 h=auto_l0)
#80     60.59s best:6162  next:[681,6161] graph_cst_lns (d=0.99 s=519 t=0.10 p=0.72 stall=4 h=auto_l0)
#81     60.78s best:6161  next:[681,6160] violation_ls(batch:47 #solutions_imported:35 #lin_moves:132'260 #lin_evals:988'817 #gen_moves:125'305 #gen_evals:15'516 #comp_moves:14'884 #backtracks:55'180 #weight_updates:16'564)
#82     60.79s best:6160  next:[681,6159] violation_ls(batch:47 #solutions_imported:32 #lin_moves:141'444 #lin_evals:1'066'975 #gen_moves:167'960 #gen_evals:17'723 #comp_moves:17'829 #backtracks:75'039 #weight_updates:7'531)
#83     60.80s best:6159  next:[681,6158] violation_ls(batch:47 #solutions_imported:32 #lin_moves:38'380 #lin_evals:823'627 #gen_moves:195'168 #gen_evals:24'648 #comp_moves:26'323 #backtracks:84'347 #weight_updates:3'821)
#84     60.92s best:6087  next:[681,6086] rnd_cst_lns (d=0.99 s=536 t=0.10 p=0.63 stall=1 h=auto_l0)
#85     63.00s best:6082  next:[681,6081] quick_restart_no_lp (fixed_bools=0/1467)
#86     63.89s best:6081  next:[681,6080] violation_ls(batch:49 #solutions_imported:34 #lin_moves:142'763 #lin_evals:1'099'969 #gen_moves:176'727 #gen_evals:18'404 #comp_moves:18'593 #backtracks:79'039 #weight_updates:8'045)
#87     64.60s best:5998  next:[681,5997] rins_lp_lns (d=0.89 s=561 t=0.10 p=0.56 stall=1 h=auto_l0)
#Bound  64.69s best:5998  next:[741,5997] objective_lb_search_max_lp
#Bound  69.04s best:5998  next:[743,5997] objective_lb_search_max_lp
#88     72.90s best:5975  next:[743,5974] rnd_cst_lns (d=0.99 s=600 t=0.10 p=0.63 stall=0 h=auto_l0)
#89     72.92s best:5974  next:[743,5973] violation_ls(batch:54 #solutions_imported:39 #lin_moves:141'796 #lin_evals:1'140'974 #gen_moves:155'142 #gen_evals:19'030 #comp_moves:19'526 #backtracks:67'757 #weight_updates:17'267)
#90     72.92s best:5973  next:[743,5972] violation_ls(batch:54 #solutions_imported:36 #lin_moves:182'477 #lin_evals:1'252'831 #gen_moves:176'735 #gen_evals:18'404 #comp_moves:18'595 #backtracks:79'042 #weight_updates:8'331)
#91     72.93s best:5972  next:[743,5971] violation_ls(batch:54 #solutions_imported:36 #lin_moves:87'703 #lin_evals:1'015'029 #gen_moves:204'500 #gen_evals:25'402 #comp_moves:26'673 #backtracks:88'832 #weight_updates:4'697)
#92     73.77s best:5971  next:[743,5970] violation_ls(batch:55 #solutions_imported:40 #lin_moves:141'796 #lin_evals:1'141'092 #gen_moves:155'184 #gen_evals:19'030 #comp_moves:19'528 #backtracks:67'777 #weight_updates:17'267)
#93     73.78s best:5970  next:[743,5969] violation_ls(batch:55 #solutions_imported:37 #lin_moves:182'480 #lin_evals:1'252'868 #gen_moves:176'735 #gen_evals:18'404 #comp_moves:18'595 #backtracks:79'042 #weight_updates:8'333)
#94     73.79s best:5969  next:[743,5968] violation_ls(batch:55 #solutions_imported:37 #lin_moves:87'703 #lin_evals:1'015'214 #gen_moves:204'568 #gen_evals:25'406 #comp_moves:26'675 #backtracks:88'865 #weight_updates:4'697)
#Bound  73.90s best:5969  next:[746,5968] objective_lb_search_max_lp
#95     74.81s best:5825  next:[746,5824] rins_lp_lns (d=0.87 s=625 t=0.10 p=0.54 stall=3 h=auto_l0)
#96     75.98s best:5790  next:[746,5789] quick_restart_no_lp (fixed_bools=0/1675)
#Bound  77.71s best:5790  next:[764,5789] objective_lb_search_max_lp
#97     78.77s best:5746  next:[764,5745] graph_cst_lns (d=0.99 s=635 t=0.10 p=0.68 stall=0 h=auto_l0)
#98     78.94s best:5745  next:[764,5744] violation_ls(batch:58 #solutions_imported:40 #lin_moves:194'430 #lin_evals:1'334'805 #gen_moves:185'634 #gen_evals:19'210 #comp_moves:18'858 #backtracks:83'360 #weight_updates:8'970)
#99     78.95s best:5744  next:[764,5743] violation_ls(batch:58 #solutions_imported:39 #lin_moves:100'714 #lin_evals:1'074'234 #gen_moves:204'593 #gen_evals:25'406 #comp_moves:26'676 #backtracks:88'877 #weight_updates:11'686)
#100    79.08s best:5650  next:[764,5649] rins_lp_lns (d=0.87 s=659 t=0.10 p=0.53 stall=2 h=auto_l0)
#Bound  83.94s best:5650  next:[766,5649] objective_lb_search_max_lp
#101    87.10s best:5562  next:[766,5561] graph_dec_lns (d=0.99 s=701 t=0.10 p=0.62 stall=3 h=auto_l0)
#102    90.23s best:5551  next:[766,5550] rnd_cst_lns (d=0.99 s=717 t=0.10 p=0.60 stall=3 h=auto_l0)
#Bound  94.08s best:5551  next:[978,5550] objective_lb_search
#103    95.87s best:5523  next:[978,5522] graph_cst_lns (d=0.99 s=750 t=0.10 p=0.62 stall=0 h=auto_l0)
#104    95.90s best:5522  next:[978,5521] violation_ls(batch:69 #solutions_imported:47 #lin_moves:148'851 #lin_evals:1'462'124 #gen_moves:235'835 #gen_evals:27'826 #comp_moves:30'592 #backtracks:102'546 #weight_updates:20'817)
#105    95.91s best:5521  next:[978,5520] violation_ls(batch:69 #solutions_imported:44 #lin_moves:259'080 #lin_evals:1'681'682 #gen_moves:201'110 #gen_evals:20'598 #comp_moves:20'940 #backtracks:90'056 #weight_updates:24'468)
#106    97.37s best:5499  next:[978,5498] rins_pump_lns (d=0.90 s=775 t=0.10 p=0.55 stall=7 h=auto_l0)
#107    98.97s best:5473  next:[978,5472] rins_pump_lns (d=0.89 s=795 t=0.10 p=0.53 stall=1 h=auto_l0)
#108   103.27s best:5469  next:[978,5468] graph_cst_lns (d=0.99 s=803 t=0.10 p=0.63 stall=0 h=auto_l0)
#109   104.92s best:5468  next:[978,5467] violation_ls(batch:74 #solutions_imported:50 #lin_moves:188'278 #lin_evals:1'630'641 #gen_moves:235'870 #gen_evals:27'831 #comp_moves:30'595 #backtracks:102'562 #weight_updates:21'390)
#110   104.93s best:5467  next:[978,5466] violation_ls(batch:74 #solutions_imported:47 #lin_moves:266'904 #lin_evals:1'779'703 #gen_moves:217'497 #gen_evals:23'175 #comp_moves:23'670 #backtracks:96'881 #weight_updates:26'913)
#111   104.94s best:5466  next:[978,5465] violation_ls(batch:74 #solutions_imported:46 #lin_moves:201'158 #lin_evals:1'603'536 #gen_moves:239'507 #gen_evals:28'629 #comp_moves:27'715 #backtracks:105'813 #weight_updates:21'736)
#112   105.33s best:5463  next:[978,5462] quick_restart_no_lp (fixed_bools=0/1949)
#113   106.71s best:5462  next:[978,5461] violation_ls(batch:75 #solutions_imported:51 #lin_moves:188'278 #lin_evals:1'630'728 #gen_moves:235'916 #gen_evals:27'831 #comp_moves:30'597 #backtracks:102'584 #weight_updates:21'390)
#114   106.71s best:5461  next:[978,5460] violation_ls(batch:75 #solutions_imported:48 #lin_moves:266'930 #lin_evals:1'779'833 #gen_moves:217'497 #gen_evals:23'175 #comp_moves:23'670 #backtracks:96'881 #weight_updates:26'926)
#115   106.74s best:5460  next:[978,5459] violation_ls(batch:75 #solutions_imported:47 #lin_moves:203'250 #lin_evals:1'610'465 #gen_moves:239'507 #gen_evals:28'629 #comp_moves:27'715 #backtracks:105'813 #weight_updates:21'888)
#116   106.90s best:5423  next:[978,5422] graph_arc_lns (d=0.99 s=822 t=0.10 p=0.60 stall=2 h=auto_l0)
#Bound 111.94s best:5423  next:[979,5422] objective_lb_search
#117   121.04s best:5383  next:[979,5382] rnd_var_lns (d=0.99 s=903 t=0.10 p=0.59 stall=1 h=auto_l0)
#118   138.83s best:5353  next:[979,5352] graph_var_lns (d=0.99 s=1007 t=0.10 p=0.58 stall=0 h=auto_l0)
#119   151.36s best:5340  next:[979,5339] rnd_cst_lns (d=0.99 s=1087 t=0.10 p=0.57 stall=2 h=auto_l0)
#Bound 157.88s best:5340  next:[980,5339] objective_lb_search
#120   157.94s best:5328  next:[980,5327] graph_var_lns (d=0.99 s=1139 t=0.10 p=0.56 stall=0 h=auto_l0)
#121   159.17s best:5284  next:[980,5283] rins_lp_lns (d=0.87 s=1155 t=0.10 p=0.51 stall=4 h=auto_l0)
#122   161.92s best:5276  next:[980,5275] rnd_var_lns (d=0.99 s=1159 t=0.10 p=0.56 stall=0 h=auto_l0)
#123   163.83s best:5271  next:[980,5270] quick_restart_no_lp (fixed_bools=0/2362)
#124   163.96s best:5270  next:[980,5269] violation_ls(batch:109 #solutions_imported:59 #lin_moves:311'020 #lin_evals:2'527'172 #gen_moves:305'583 #gen_evals:37'593 #comp_moves:38'769 #backtracks:133'322 #weight_updates:89'251)
#125   163.97s best:5269  next:[980,5268] violation_ls(batch:109 #solutions_imported:56 #lin_moves:485'272 #lin_evals:2'795'301 #gen_moves:311'165 #gen_evals:31'249 #comp_moves:27'607 #backtracks:141'733 #weight_updates:29'511)
#126   163.98s best:5268  next:[980,5267] violation_ls(batch:109 #solutions_imported:54 #lin_moves:384'482 #lin_evals:2'567'527 #gen_moves:325'784 #gen_evals:34'838 #comp_moves:31'556 #backtracks:147'027 #weight_updates:71'412)
#127   165.35s best:5267  next:[980,5266] violation_ls(batch:110 #solutions_imported:60 #lin_moves:311'020 #lin_evals:2'527'178 #gen_moves:305'587 #gen_evals:37'593 #comp_moves:38'773 #backtracks:133'322 #weight_updates:89'251)
#128   165.36s best:5266  next:[980,5265] violation_ls(batch:110 #solutions_imported:57 #lin_moves:485'289 #lin_evals:2'795'418 #gen_moves:311'165 #gen_evals:31'249 #comp_moves:27'607 #backtracks:141'733 #weight_updates:29'526)
#129   165.37s best:5265  next:[980,5264] violation_ls(batch:110 #solutions_imported:55 #lin_moves:384'521 #lin_evals:2'567'768 #gen_moves:325'784 #gen_evals:34'838 #comp_moves:31'556 #backtracks:147'027 #weight_updates:71'442)
#130   165.77s best:5258  next:[980,5257] graph_cst_lns (d=0.99 s=1184 t=0.10 p=0.56 stall=0 h=auto_l0)
#131   165.84s best:5218  next:[980,5217] rins_pump_lns (d=0.89 s=1196 t=0.10 p=0.52 stall=3 h=auto_l0)
#132   169.97s best:5172  next:[980,5171] graph_arc_lns (d=0.99 s=1203 t=0.10 p=0.56 stall=0 h=auto_l0)
#133   169.99s best:5171  next:[980,5170] violation_ls(batch:113 #solutions_imported:57 #lin_moves:398'731 #lin_evals:2'631'585 #gen_moves:325'784 #gen_evals:34'838 #comp_moves:31'556 #backtracks:147'027 #weight_updates:77'379)
#134   170.86s best:5139  next:[980,5138] rnd_var_lns (d=0.99 s=1210 t=0.10 p=0.56 stall=1 h=auto_l0)
#135   171.63s best:5138  next:[980,5137] violation_ls(batch:114 #solutions_imported:62 #lin_moves:312'923 #lin_evals:2'616'648 #gen_moves:330'385 #gen_evals:40'066 #comp_moves:39'668 #backtracks:145'268 #weight_updates:90'209)
#136   171.63s best:5137  next:[980,5136] violation_ls(batch:114 #solutions_imported:59 #lin_moves:485'289 #lin_evals:2'877'555 #gen_moves:336'746 #gen_evals:33'519 #comp_moves:28'486 #backtracks:154'084 #weight_updates:29'781)
#137   171.64s best:5136  next:[980,5135] violation_ls(batch:114 #solutions_imported:58 #lin_moves:398'891 #lin_evals:2'632'425 #gen_moves:325'784 #gen_evals:34'838 #comp_moves:31'556 #backtracks:147'027 #weight_updates:77'486)
#138   173.12s best:5132  next:[980,5131] graph_arc_lns (d=0.99 s=1234 t=0.10 p=0.55 stall=0 h=auto_l0)
#139   173.42s best:5131  next:[980,5130] violation_ls(batch:115 #solutions_imported:59 #lin_moves:399'708 #lin_evals:2'635'547 #gen_moves:325'784 #gen_evals:34'838 #comp_moves:31'556 #backtracks:147'027 #weight_updates:77'615)
#140   174.61s best:5130  next:[980,5129] violation_ls(batch:116 #solutions_imported:64 #lin_moves:312'923 #lin_evals:2'645'247 #gen_moves:338'727 #gen_evals:40'720 #comp_moves:40'535 #backtracks:149'002 #weight_updates:90'287)
#141   174.66s best:5102  next:[980,5101] rnd_var_lns (d=0.99 s=1241 t=0.10 p=0.56 stall=0 h=auto_l0)
#142   176.31s best:5101  next:[980,5100] violation_ls(batch:117 #solutions_imported:62 #lin_moves:487'044 #lin_evals:2'938'506 #gen_moves:353'364 #gen_evals:35'068 #comp_moves:29'591 #backtracks:161'837 #weight_updates:30'218)
#143   177.12s best:5093  next:[980,5092] graph_var_lns (d=0.99 s=1263 t=0.10 p=0.54 stall=0 h=auto_l0)
#144   178.10s best:5092  next:[980,5091] violation_ls(batch:118 #solutions_imported:62 #lin_moves:401'080 #lin_evals:2'692'873 #gen_moves:342'407 #gen_evals:36'639 #comp_moves:32'232 #backtracks:154'995 #weight_updates:77'949)
#145   179.21s best:5085  next:[980,5084] graph_dec_lns (d=0.99 s=1266 t=0.10 p=0.55 stall=2 h=auto_l0)
#146   179.52s best:5063  next:[980,5062] graph_cst_lns (d=0.99 s=1275 t=0.10 p=0.56 stall=0 h=auto_l0)
#147   180.38s best:5055  next:[980,5054] quick_restart_no_lp (fixed_bools=0/2646)
#148   180.44s best:4984  next:[980,4983] rins_lp_lns (d=0.89 s=1288 t=0.10 p=0.52 stall=1 h=auto_l0)
#149   188.68s best:4960  next:[980,4959] rnd_var_lns (d=0.99 s=1332 t=0.10 p=0.55 stall=2 h=auto_l0)
#150   197.98s best:4958  next:[980,4957] graph_dec_lns (d=0.99 s=1388 t=0.10 p=0.55 stall=1 h=auto_l0)
#151   201.30s best:4943  next:[980,4942] graph_arc_lns (d=0.99 s=1407 t=0.10 p=0.55 stall=6 h=auto_l0)
#Bound 214.03s best:4943  next:[981,4942] objective_lb_search_max_lp
#Bound 258.06s best:4943  next:[989,4942] objective_lb_search
#Bound 288.46s best:4943  next:[1008,4942] objective_lb_search
#Bound 329.65s best:4943  next:[1017,4942] objective_lb_search
#152   352.37s best:4927  next:[1017,4926] graph_arc_lns (d=0.99 s=2321 t=0.10 p=0.53 stall=4 h=auto_l0)
#153   353.57s best:4898  next:[1017,4897] rins_pump_lns (d=0.89 s=2344 t=0.10 p=0.51 stall=2 h=auto_l0)
#Bound 355.74s best:4898  next:[1142,4897] objective_lb_search_no_lp
#154   358.37s best:4890  next:[1142,4889] rnd_var_lns (d=1.00 s=2349 t=0.10 p=0.53 stall=0 h=auto_l0)
#155   414.36s best:4881  next:[1142,4880] graph_dec_lns (d=1.00 s=2692 t=0.10 p=0.53 stall=0 h=auto_l0)
#156   461.93s best:4858  next:[1142,4857] rnd_cst_lns (d=0.99 s=2984 t=0.10 p=0.53 stall=0 h=auto_l0)
#157   489.59s best:4850  next:[1142,4849] rnd_var_lns (d=0.99 s=3156 t=0.10 p=0.53 stall=2 h=auto_l0)
#Bound 493.12s best:4850  next:[1144,4849] objective_lb_search_no_lp
#158   520.41s best:4847  next:[1144,4846] rnd_cst_lns (d=0.99 s=3343 t=0.10 p=0.52 stall=1 h=auto_l0)
#159   671.85s best:4801  next:[1144,4800] graph_dec_lns (d=1.00 s=4275 t=0.10 p=0.52 stall=1 h=auto_l0)
#160   694.26s best:4798  next:[1144,4797] rnd_var_lns (d=1.00 s=4422 t=0.10 p=0.52 stall=1 h=auto_l0)
#161   700.97s best:4795  next:[1144,4794] graph_arc_lns (d=0.99 s=4466 t=0.10 p=0.52 stall=8 h=auto_l0)
#Bound 856.82s best:4795  next:[1147,4794] objective_lb_search_max_lp
#Bound 903.90s best:4795  next:[1148,4794] objective_lb_search_no_lp
#Bound 940.11s best:4795  next:[1163,4794] objective_lb_search_no_lp
#Bound 959.86s best:4795  next:[1165,4794] objective_lb_search_no_lp
#Bound 976.79s best:4795  next:[1188,4794] objective_lb_search_no_lp
#162   992.95s best:4779  next:[1188,4778] graph_dec_lns (d=1.00 s=6244 t=0.10 p=0.51 stall=5 h=auto_l0)
#163   994.50s best:4778  next:[1188,4777] violation_ls(batch:606 #solutions_imported:81 #perturbations:1 #lin_moves:1'323'580 #lin_evals:15'152'382 #gen_moves:2'189'394 #gen_evals:270'586 #comp_moves:139'357 #backtracks:1'024'812 #weight_updates:589'443)
#164   994.51s best:4777  next:[1188,4776] violation_ls(batch:606 #solutions_imported:78 #perturbations:1 #lin_moves:2'389'498 #lin_evals:20'389'859 #gen_moves:1'564'565 #gen_evals:182'396 #comp_moves:103'018 #backtracks:730'608 #weight_updates:583'829)
#165   994.93s best:4759  next:[1188,4758] rins_pump_lns (d=0.90 s=6275 t=0.10 p=0.50 stall=8 h=auto_l0)
#Bound 1018.27s best:4759  next:[1190,4758] objective_lb_search_no_lp
#Bound 1055.77s best:4759  next:[1193,4758] objective_lb_search_no_lp
#Bound 1073.58s best:4759  next:[1195,4758] objective_lb_search_no_lp
#Bound 1092.72s best:4759  next:[1207,4758] objective_lb_search_no_lp
#Bound 1103.98s best:4759  next:[1215,4758] objective_lb_search_no_lp
#Bound 1145.74s best:4759  next:[1217,4758] objective_lb_search_no_lp
#166   1217.88s best:4735  next:[1217,4734] graph_dec_lns (d=1.00 s=7654 t=0.10 p=0.51 stall=1 h=auto_l0)
#167   1219.17s best:4734  next:[1217,4733] violation_ls(batch:742 #solutions_imported:79 #perturbations:2 #lin_moves:3'068'948 #lin_evals:20'462'060 #gen_moves:2'200'866 #gen_evals:233'863 #comp_moves:118'530 #backtracks:1'041'011 #weight_updates:711'941)
#168   1221.01s best:4733  next:[1217,4732] violation_ls(batch:743 #solutions_imported:81 #perturbations:2 #lin_moves:2'399'174 #lin_evals:22'842'974 #gen_moves:1'830'454 #gen_evals:284'327 #comp_moves:138'171 #backtracks:845'905 #weight_updates:584'341)
#169   1265.30s best:4713  next:[1217,4712] graph_cst_lns (d=0.99 s=7938 t=0.10 p=0.51 stall=2 h=auto_l0)
#Bound 1684.15s best:4713  next:[1218,4712] objective_lb_search
#Bound 1924.59s best:4713  next:[1220,4712] objective_lb_search
#Bound 2375.09s best:4713  next:[1221,4712] objective_lb_search_no_lp
#Bound 2789.78s best:4713  next:[1222,4712] objective_lb_search
#Bound 2853.92s best:4713  next:[1223,4712] objective_lb_search_no_lp
#Bound 3136.19s best:4713  next:[1225,4712] objective_lb_search_no_lp
#Bound 3546.58s best:4713  next:[1226,4712] objective_lb_search_no_lp

Task timing                                  n [     min,      max]      avg      dev     time         n [     min,      max]      avg      dev    dtime
                             'core':         1 [  59.87m,   59.87m]   59.87m   0.00ns   59.87m         1 [  14.86m,   14.86m]   14.86m   0.00ns   14.86m
                       'default_lp':         1 [  59.87m,   59.87m]   59.87m   0.00ns   59.87m         1 [   2.73m,    2.73m]    2.73m   0.00ns    2.73m
                 'feasibility_pump':       464 [149.30us,    1.24m]    7.74s    3.73s   59.87m       437 [270.82ms,   12.38s] 696.55ms 563.84ms    5.07m
                  'fj_long_default':         3 [200.16ms, 316.31ms] 241.91ms  52.74ms 725.73ms         3 [128.28ms, 156.84ms] 139.12ms  12.64ms 417.35ms
              'fj_long_lin_default':         4 [184.23ms, 287.10ms] 210.63ms  44.16ms 842.53ms         4 [170.75ms, 174.75ms] 171.97ms   1.62ms 687.86ms
                   'fj_long_random':         3 [193.38ms, 313.77ms] 234.87ms  55.82ms 704.60ms         3 [126.01ms, 165.32ms] 139.93ms  17.98ms 419.78ms
                 'fj_short_default':         4 [189.02ms, 333.54ms] 236.34ms  58.96ms 945.35ms         4 [172.53ms, 175.24ms] 173.71ms 991.90us 694.85ms
             'fj_short_lin_default':         4 [178.79ms, 260.99ms] 205.07ms  32.77ms 820.27ms         4 [162.47ms, 171.29ms] 168.22ms   3.53ms 672.88ms
              'fj_short_lin_random':         4 [175.65ms, 269.21ms] 202.83ms  38.68ms 811.31ms         4 [165.19ms, 174.51ms] 169.76ms   3.86ms 679.03ms
                  'fj_short_random':         4 [163.41ms, 274.77ms] 198.29ms  44.79ms 793.17ms         4 [159.54ms, 172.36ms] 165.65ms   5.56ms 662.58ms
                        'fs_random':         1 [814.51ms, 814.51ms] 814.51ms   0.00ns 814.51ms         1 [  7.37ms,   7.37ms]   7.37ms   0.00ns   7.37ms
                        'fs_random':         1 [815.81ms, 815.81ms] 815.81ms   0.00ns 815.81ms         1 [  7.37ms,   7.37ms]   7.37ms   0.00ns   7.37ms
                  'fs_random_no_lp':         1 [830.17ms, 830.17ms] 830.17ms   0.00ns 830.17ms         1 [ 30.24ms,  30.24ms]  30.24ms   0.00ns  30.24ms
                  'fs_random_no_lp':         1 [831.65ms, 831.65ms] 831.65ms   0.00ns 831.65ms         1 [ 14.05ms,  14.05ms]  14.05ms   0.00ns  14.05ms
          'fs_random_quick_restart':         1 [813.69ms, 813.69ms] 813.69ms   0.00ns 813.69ms         1 [  7.41ms,   7.41ms]   7.41ms   0.00ns   7.41ms
          'fs_random_quick_restart':         1 [814.93ms, 814.93ms] 814.93ms   0.00ns 814.93ms         1 [  2.27ms,   2.27ms]   2.27ms   0.00ns   2.27ms
    'fs_random_quick_restart_no_lp':         1 [831.53ms, 831.53ms] 831.53ms   0.00ns 831.53ms         1 [ 25.95ms,  25.95ms]  25.95ms   0.00ns  25.95ms
                    'graph_arc_lns':      2164 [119.25ms,    6.47s]    3.94s 890.40ms    2.37h      2156 [ 58.00us, 153.87ms]  72.73ms  33.11ms    2.61m
                    'graph_cst_lns':      2164 [ 40.71ms,    7.13s]    3.88s    1.04s    2.33h      2144 [ 10.00ns, 200.36ms]  70.12ms  35.92ms    2.51m
                    'graph_dec_lns':      2164 [156.75ms,    7.74s]    4.11s 911.07ms    2.47h      2152 [ 10.00ns, 157.11ms]  73.64ms  32.97ms    2.64m
                    'graph_var_lns':      2164 [125.92ms,    6.06s]    3.27s 800.91ms    1.97h      2158 [ 10.00ns, 158.93ms]  69.94ms  36.40ms    2.52m
                   'lb_tree_search':         1 [  59.87m,   59.87m]   59.87m   0.00ns   59.87m         1 [  17.75m,   17.75m]   17.75m   0.00ns   17.75m
                           'max_lp':         1 [  59.87m,   59.87m]   59.87m   0.00ns   59.87m         1 [   4.60m,    4.60m]    4.60m   0.00ns    4.60m
                            'no_lp':         1 [  59.87m,   59.87m]   59.87m   0.00ns   59.87m         1 [   2.27m,    2.27m]    2.27m   0.00ns    2.27m
              'objective_lb_search':         1 [  59.87m,   59.87m]   59.87m   0.00ns   59.87m         1 [   4.64m,    4.64m]    4.64m   0.00ns    4.64m
       'objective_lb_search_max_lp':         1 [  59.86m,   59.86m]   59.86m   0.00ns   59.86m         1 [   7.04m,    7.04m]    7.04m   0.00ns    7.04m
        'objective_lb_search_no_lp':         1 [  59.87m,   59.87m]   59.87m   0.00ns   59.87m         1 [   1.78m,    1.78m]    1.78m   0.00ns    1.78m
  'objective_shaving_search_max_lp':        47 [305.81ms,    8.97m]    1.27m    2.27m   59.87m        39 [ 24.19ms,   13.20s]    2.23s    3.66s    1.45m
   'objective_shaving_search_no_lp':        49 [131.41ms,    8.97m]    1.22m    2.24m   59.87m        39 [ 24.60ms,   10.13s]    1.65s    2.60s    1.07m
                          'probing':         1 [  59.87m,   59.87m]   59.87m   0.00ns   59.87m         1 [   2.73m,    2.73m]    2.73m   0.00ns    2.73m
                   'probing_max_lp':         1 [  59.87m,   59.87m]   59.87m   0.00ns   59.87m         1 [  11.66m,   11.66m]   11.66m   0.00ns   11.66m
                     'pseudo_costs':         1 [  59.87m,   59.87m]   59.87m   0.00ns   59.87m         1 [   4.45m,    4.45m]    4.45m   0.00ns    4.45m
                    'quick_restart':         1 [  59.87m,   59.87m]   59.87m   0.00ns   59.87m         1 [   5.73m,    5.73m]    5.73m   0.00ns    5.73m
              'quick_restart_no_lp':         1 [  59.87m,   59.87m]   59.87m   0.00ns   59.87m         1 [   2.84m,    2.84m]    2.84m   0.00ns    2.84m
                    'reduced_costs':         1 [  59.87m,   59.87m]   59.87m   0.00ns   59.87m         1 [   5.38m,    5.38m]    5.38m   0.00ns    5.38m
                        'rins/rens':      2165 [974.45us,    3.26s]    1.03s 749.84ms   37.27m      1872 [ 10.00ns, 105.10ms]  64.05ms  43.20ms    2.00m
                      'rnd_cst_lns':      2165 [120.70ms,    7.61s]    3.92s 911.79ms    2.36h      2158 [ 10.00ns, 157.42ms]  72.93ms  33.12ms    2.62m
                      'rnd_var_lns':      2165 [ 92.89ms,    6.71s]    4.07s 930.94ms    2.45h      2158 [ 10.00ns, 184.73ms]  72.62ms  33.67ms    2.61m
                     'violation_ls':      2164 [  5.68ms, 471.88ms] 222.51ms  75.68ms    8.03m      2164 [  1.87us, 453.97ms] 173.01ms  72.61ms    6.24m
                     'violation_ls':      2164 [  5.74ms, 481.16ms] 224.65ms  79.21ms    8.10m      2164 [  3.32us, 406.08ms] 177.06ms  71.00ms    6.39m
                     'violation_ls':      2165 [  6.14ms, 557.81ms] 219.94ms  81.34ms    7.94m      2165 [  1.78us, 476.37ms] 178.46ms  73.79ms    6.44m

Search stats                         Bools  Conflicts  Branches  Restarts   BoolPropag  IntegerPropag
                           'core':   7'868    137'043   551'670    36'223  355'707'051    885'156'369
                     'default_lp':   1'449     31'235   273'389    59'462    9'034'785    476'853'365
                      'fs_random':     401          0       802       802          106        122'002
                      'fs_random':     401          0       802       802          106        122'002
                'fs_random_no_lp':     401          0       939       802          108        180'552
                'fs_random_no_lp':     401         19       955       802          221        239'391
        'fs_random_quick_restart':     401          0       802       802          106        122'002
        'fs_random_quick_restart':     401          0       802       802          106        122'003
  'fs_random_quick_restart_no_lp':     471          0     1'237       803          142        242'867
                 'lb_tree_search':     401        749   891'041   185'120    1'743'071    587'247'078
                         'max_lp':     434     32'806   631'124   192'100    3'607'790    581'623'429
                          'no_lp':   2'958     53'922   257'673    43'230   20'849'608    592'349'047
            'objective_lb_search':     553     21'706   188'470    53'129    3'063'231    409'462'529
     'objective_lb_search_max_lp':     539     15'954   358'222   121'493    3'103'471    477'817'203
      'objective_lb_search_no_lp':     532     33'641   105'204    19'742    3'508'017    390'005'599
                        'probing':   1'163        233     2'093     2'093       80'898      1'973'163
                 'probing_max_lp':     683          4     1'362     1'362        4'494        330'362
                   'pseudo_costs':   1'754     43'437   564'253   146'883    7'227'770    650'851'878
                  'quick_restart':   4'669     14'174   683'737    95'317   22'899'767    408'436'466
            'quick_restart_no_lp':   8'398     55'474   859'823    31'883   74'022'893    689'962'263
                  'reduced_costs':  19'152     59'282   877'595    55'051  134'064'162    622'087'570

SAT stats                           ClassicMinim  LitRemoved  LitLearned  LitForgotten  Subsumed  MClauses  MDecisions  MLitTrue  MSubsumed  MLitRemoved  MReused
                           'core':       117'200     676'713   1'184'672       307'976       977    16'114      78'088         0      1'170        4'031      272
                     'default_lp':        20'078      38'439     840'028       367'301       514    21'859     149'804         0        553        2'656    2'710
                      'fs_random':             0           0           0             0         0         0           0         0          0            0        0
                      'fs_random':             0           0           0             0         0         0           0         0          0            0        0
                'fs_random_no_lp':             0           0           0             0         0         0           0         0          0            0        0
                'fs_random_no_lp':             0           0          90             0         0         0           0         0          0            0        0
        'fs_random_quick_restart':             0           0           0             0         0         0           0         0          0            0        0
        'fs_random_quick_restart':             0           0           0             0         0         0           0         0          0            0        0
  'fs_random_quick_restart_no_lp':             0           0           0             0         0         0           0         0          0            0        0
                 'lb_tree_search':             0           0       2'494             0         0    73'395     387'470         0        144          590    4'808
                         'max_lp':        18'430      38'189     884'001       560'786       785    80'517     504'166         0        438        1'948    8'907
                          'no_lp':        37'373     176'412   1'339'470     1'026'224       530    10'126      84'730         0        310        1'889    2'008
            'objective_lb_search':        14'580      33'225     201'237         8'630       966    11'668      95'712         0      1'741       11'880    1'890
     'objective_lb_search_max_lp':        10'078      22'338     150'416        13'439       636    27'622     196'122         0        594        4'042    3'036
      'objective_lb_search_no_lp':        24'562      66'915     309'640        35'462       845     4'797      37'786         0      2'104       15'360      688
                        'probing':             0           0         233             0         0         0           0         0          0            0        0
                 'probing_max_lp':             0           0           4             0         0         0           0         0          0            0        0
                   'pseudo_costs':        24'971      71'795   1'128'625       833'141       686    60'875     398'898         0        686        3'104    6'594
                  'quick_restart':         8'331      31'077     298'981       122'975       411    28'848     239'124        58      1'255        8'545    4'300
            'quick_restart_no_lp':        38'131     190'512   1'347'853       746'282       896     9'162      83'581         1      2'145       14'588    1'403
                  'reduced_costs':        35'279     143'650   1'177'389       863'310       551    17'936     142'012         0      2'312       11'963    5'340

Lp stats                         Component  Iterations  AddedCuts  OPTIMAL  DUAL_F.  DUAL_U.
                  'default_lp':          1     487'085     33'803   56'695        0        4
                   'fs_random':          1       1'510        653        8        0        0
                   'fs_random':          1       1'510        660        8        0        0
     'fs_random_quick_restart':          1       1'238        384        5        0        0
     'fs_random_quick_restart':          1       1'510        672        9        0        0
              'lb_tree_search':          1   3'889'726     53'771    2'675  323'884        0
                      'max_lp':          1     891'713     48'918   12'576   73'710        3
         'objective_lb_search':          1   1'453'491     44'540   53'507       45        5
  'objective_lb_search_max_lp':          1     942'738     33'614    1'032   24'399        0
                     'probing':          1     190'893    109'519    9'621        8        1
              'probing_max_lp':          1     400'780    115'615    4'360      162        0
                'pseudo_costs':          1   1'014'259     72'788   33'426   79'844        4
               'quick_restart':          1   1'919'742    132'114  121'899       71        1
               'reduced_costs':          1   1'172'721    127'556   66'555   85'812        3

Lp dimension                                                                        Final dimension of first component
                  'default_lp':  2903 rows, 3110 columns, 12597 entries with magnitude in [2.594123e-02, 1.000000e+00]
                   'fs_random':   1010 rows, 3110 columns, 5465 entries with magnitude in [2.594123e-02, 1.000000e+00]
                   'fs_random':   1010 rows, 3110 columns, 5465 entries with magnitude in [2.594123e-02, 1.000000e+00]
     'fs_random_quick_restart':   1010 rows, 3110 columns, 5465 entries with magnitude in [2.594123e-02, 1.000000e+00]
     'fs_random_quick_restart':    910 rows, 3110 columns, 5133 entries with magnitude in [2.594123e-02, 1.000000e+00]
              'lb_tree_search':  6108 rows, 3175 columns, 27769 entries with magnitude in [1.810594e-03, 1.000000e+00]
                      'max_lp':  4227 rows, 3175 columns, 17618 entries with magnitude in [6.788903e-03, 1.000000e+00]
         'objective_lb_search':  3946 rows, 3110 columns, 17644 entries with magnitude in [1.163708e-03, 1.000000e+00]
  'objective_lb_search_max_lp':  7100 rows, 3175 columns, 32386 entries with magnitude in [1.040529e-03, 1.000000e+00]
                     'probing':  2802 rows, 3110 columns, 12426 entries with magnitude in [8.844962e-04, 1.000000e+00]
              'probing_max_lp':  5046 rows, 3175 columns, 38257 entries with magnitude in [1.321777e-03, 1.000000e+00]
                'pseudo_costs':  2883 rows, 3175 columns, 12390 entries with magnitude in [1.729415e-03, 1.000000e+00]
               'quick_restart':  3788 rows, 3110 columns, 16459 entries with magnitude in [6.072239e-04, 1.000000e+00]
               'reduced_costs':  2893 rows, 3175 columns, 12312 entries with magnitude in [1.192751e-02, 1.000000e+00]

Lp debug                         CutPropag  CutEqPropag   Adjust  Overflow          Bad  BadScaling
                  'default_lp':         11           19    3'594         0    2'325'589           0
                   'fs_random':          0            0        0         0        4'553           0
                   'fs_random':          0            0        0         0        4'558           0
     'fs_random_quick_restart':          0            0        0         0        2'496           0
     'fs_random_quick_restart':          0            0        0         0        4'549           0
              'lb_tree_search':         25           17  217'766         0    3'932'162           0
                      'max_lp':         30           31   12'578         0    2'073'615           0
         'objective_lb_search':         14           42   10'466         0    4'005'993           0
  'objective_lb_search_max_lp':         54            5   14'496         0    2'284'548           0
                     'probing':         16          953    8'255         0  114'422'181           0
              'probing_max_lp':        176          140    4'473         0   45'436'919           0
                'pseudo_costs':         16           17   15'807         0    2'925'588           0
               'quick_restart':         17          113   40'767         0    9'201'100           0
               'reduced_costs':        126           41   35'472         0    5'390'292           0

Lp pool                          Constraints  Updates  Simplif  Merged  Shortened   Split  Strenghtened        Cuts/Call
                  'default_lp':       13'170      576    3'571       9          0   7'783         7'223    33'803/95'182
                   'fs_random':        4'029        0        0       0          0       0            56        653/1'407
                   'fs_random':        4'036        0        0       0          0       0            56        660/1'429
     'fs_random_quick_restart':        3'760        0        0       0          0       0            55          384/734
     'fs_random_quick_restart':        4'048        0        0       0          0       0            56        672/1'461
              'lb_tree_search':       48'896      298   31'486      26          0   5'392        54'444    53'771/98'667
                      'max_lp':       49'041      217   37'367      28          0   4'435        54'900    48'918/89'443
         'objective_lb_search':       12'912    1'139    4'365       4          0  26'571        10'455   44'540/149'547
  'objective_lb_search_max_lp':       48'732      301   18'714      33          0   5'109        29'709    33'614/74'983
                     'probing':       12'892   11'452      505       3          0  60'290        20'687  109'519/207'109
              'probing_max_lp':       48'745    5'212   13'280      21          0  10'204        59'141  115'615/251'756
                'pseudo_costs':       48'915      343   14'436      24          0   5'793        35'636   72'788/140'624
               'quick_restart':       12'472    1'532    5'039      18          0  46'616        20'208  132'114/372'960
               'reduced_costs':       48'682      614   13'620      25          0  13'293        45'676  127'556/279'405

Lp Cut            fs_ran  fs_ran  fs_ran  fs_ran  defaul  max_lp  quick_  reduce  pseudo  lb_tre  probin  object  probin  object
          CG_FF:      49      21      49      49   2'267   2'451   4'418   9'156   4'196   1'998   4'261   1'731   1'380   1'659
           CG_K:      49      21      49      49   1'528   1'623   2'332   7'599   3'375     842   1'914   1'140     729   1'437
          CG_KL:       -       -       -       -      19       1      15      37       4       -      11      11       -       -
           CG_R:      32      13      32      32   1'072   1'003   2'989   3'493   1'811     789   6'161     841     606     736
          CG_RB:      15       -      15      15   5'374   5'879  11'605  17'471  10'321   4'450  17'659   5'411   4'239   3'094
         CG_RBP:       -       -       -       -     370     430     878   1'421     792     237   1'447     338     277     230
         Clique:       -       -       -       -       -     409       -   2'059     747     308       -       -     406     265
             IB:      75      67      75      85  10'308   7'308  75'061  24'549  13'194   4'171  11'011  19'063   2'730   3'218
       MIR_1_FF:     146      94     147     148   1'249   1'723   3'147   5'361   2'840   1'754   5'825   1'312   3'612   1'468
        MIR_1_K:      47      36      47      49     209     189     393     736     321     148     375     156     174     164
       MIR_1_KL:       -       -       -       -      17      15      30      64      17       3      15       3       1       2
        MIR_1_R:      46      32      46      47     358     189     837     861     397     193   1'938     316     568     250
       MIR_1_RB:      68      34      69      70   2'292   6'243   6'402  12'112   7'918   7'433  11'362   2'929  13'392   4'097
      MIR_1_RBP:       -       -       -       -     148   2'665     408   4'169   2'847   2'534     510     207   2'692   1'065
      MIR_1_RLT:       -       -       -       -       -      37       -     149      72      23       -       -      48      18
       MIR_2_FF:      29      12      30      29     749   1'008   1'654   2'986   1'640   1'325   2'642     703   2'325   1'059
        MIR_2_K:      19      14      17      18     148     179     265     670     301     176     320     112     262     206
       MIR_2_KL:       -       -       -       -      13      31      66     115      20      25      34      24      30       8
        MIR_2_R:      12       5      12       9     227     550     569   1'001     640   1'623   1'891     254   5'169     705
       MIR_2_RB:      37      18      34      36   1'385   2'908   3'760   5'871   3'648   4'528   6'580   1'709   8'147   2'451
      MIR_2_RBP:       -       -       -       -     135   1'195     365   1'886   1'344   1'496     490     154   1'751     752
       MIR_3_FF:       5       2       2       3     388     607     972   1'590     850     706   1'313     372   1'289     492
        MIR_3_K:       1       2       4       3      82     150     207     466     179     142     208      80     192     149
       MIR_3_KL:       -       -       -       -      49      40     193     163      51      34     132      72      29      21
        MIR_3_R:       2       1       3       2     154     349     476     554     368     948   1'040     160   2'689     450
       MIR_3_RB:       3       2       2       7     790   1'339   2'113   2'731   1'619   2'248   4'015   1'071   4'081   1'149
      MIR_3_RBP:       1       -       -       -     110     520     295     820     531     684     348     165     917     333
       MIR_4_FF:       1       1       1       2     216     251     465     722     380     349     733     230     636     206
        MIR_4_K:       -       -       -       1     103      89     240     321     134      98     245     120     156      89
       MIR_4_KL:       -       -       -       -      54      57     230     205      60      52     284     118      58      30
        MIR_4_R:       -       -       -       1     110     151     253     301     165     406     587     112   1'193     175
       MIR_4_RB:       1       1       1       -     483     617   1'193   1'325     749     876   2'129     635   1'856     508
      MIR_4_RBP:       -       -       -       -      79     212     187     362     229     272     254     107     441     137
       MIR_5_FF:       -       -       -       -     137     131     288     357     193     178     449     186     304     137
        MIR_5_K:       -       -       -       -      85     114     262     266     138      81     279     175     118      66
       MIR_5_KL:       -       -       -       -      55      77     268     182      86      67     436     159      59      36
        MIR_5_R:       -       -       -       -      65      81     131     141      85     178     288      69     476     105
       MIR_5_RB:       1       -       -       -     306     316     887     824     476     425   1'462     511     903     327
      MIR_5_RBP:       -       -       -       -      33     103     138     206     129     136     165      64     221      75
       MIR_6_FF:       -       -       -       -     112      73     183     206     111      84     241     113     151      51
        MIR_6_K:       -       -       -       -     110      78     311     217     119      59     397     212     101      41
       MIR_6_KL:       -       -       -       -      65      76     312     210     113      60     689     182      74      47
        MIR_6_R:       -       -       -       -      49      38      72     102      83      72     130      47     201      32
       MIR_6_RB:       -       -       -       -     259     225     803     602     362     246   1'515     484     453     180
      MIR_6_RBP:       -       -       -       -      30      79     121     158     106      76     257      75     145      50
   ZERO_HALF_FF:      10       3       8       7     361     856     849   2'361   1'361     678     932     315     856     545
    ZERO_HALF_K:       2       2       2       3      74     209     149     892     394     120     166      63     160     110
   ZERO_HALF_KL:       -       -       -       -       -       3       3      16       4       2       4       2       2       -
    ZERO_HALF_R:       3       -       5       4     714   2'818   3'071   3'765   3'056   7'033  11'473   1'181  42'484   3'361
   ZERO_HALF_RB:       6       3       3       3     697   2'365   1'907   4'361   3'129   2'565   3'533     822   3'883   1'379
  ZERO_HALF_RBP:       -       -       -       -     165     858     341   1'364   1'083     840   1'369     224   2'949     449

LNS stats           Improv/Calls  Closed  Difficulty  TimeLimit
  'graph_arc_lns':      526/2161     50%        0.99       0.10
  'graph_cst_lns':      680/2149     50%        0.99       0.10
  'graph_dec_lns':      616/2161     50%        1.00       0.10
  'graph_var_lns':      370/2162     50%        0.99       0.10
      'rins/rens':      219/1972     50%        0.88       0.10
    'rnd_cst_lns':      601/2162     50%        1.00       0.10
    'rnd_var_lns':      646/2163     50%        1.00       0.10

LS stats                   Batches  Restarts    LinMoves   GenMoves  CompoundMoves  WeightUpdates
       'fj_long_default':        3         1      29'895          0              0            105
   'fj_long_lin_default':        4         1           0      6'906            801              0
        'fj_long_random':        3         1      29'895          0              0            105
      'fj_short_default':        4         1           0      7'696          1'312              1
  'fj_short_lin_default':        4         1           0      7'773          1'241              1
   'fj_short_lin_random':        4         1           0      7'222          1'366              2
       'fj_short_random':        4         1           0      6'276            829              0
          'violation_ls':    2'164         0  10'024'897  3'439'295        173'811        757'820
          'violation_ls':    2'164         0   8'096'542  3'146'593        197'143      1'093'121
          'violation_ls':    2'165         0   6'994'886  3'863'035        243'461      1'138'617

Solutions (169)                     Num      Rank
  'fs_random_quick_restart_no_lp':    1     [1,1]
                  'graph_arc_lns':    8  [26,161]
                  'graph_cst_lns':    7  [80,169]
                  'graph_dec_lns':    8  [38,166]
                  'graph_var_lns':   14  [21,143]
                          'no_lp':    5    [2,20]
            'quick_restart_no_lp':    9  [19,147]
                    'rins_lp_lns':   14  [22,148]
                  'rins_pump_lns':    6  [25,165]
                    'rnd_cst_lns':   10  [18,158]
                    'rnd_var_lns':   12  [27,160]
                   'violation_ls':   75   [4,168]

Objective bounds                      Num
                   'initial_domain':    1
              'objective_lb_search':   11
       'objective_lb_search_max_lp':   12
        'objective_lb_search_no_lp':   21
  'objective_shaving_search_max_lp':    2

Solution repositories     Added  Queried  Ignored  Synchro
  'feasible solutions':  11'564   38'386        0   11'194
        'lp solutions':   3'403    1'096        0    3'332
                'pump':   8'576    1'069

Improving bounds shared               Num
                           'core':    206
                     'default_lp':     20
  'fs_random_quick_restart_no_lp':    288
                 'lb_tree_search':    316
                         'max_lp':    342
                          'no_lp':    130
            'objective_lb_search':     14
     'objective_lb_search_max_lp':    107
                        'probing':  3'285
                 'probing_max_lp':    242
                   'pseudo_costs':     29
                  'quick_restart':    384
            'quick_restart_no_lp':    754
                  'reduced_costs':    303

Clauses shared                   Num
                        'core':    7
                  'default_lp':   30
             'fs_random_no_lp':    2
              'lb_tree_search':   18
                      'max_lp':   11
                       'no_lp':   13
         'objective_lb_search':    6
  'objective_lb_search_max_lp':    3
   'objective_lb_search_no_lp':    9
                'pseudo_costs':   54
               'quick_restart':   20
         'quick_restart_no_lp':   74
               'reduced_costs':    1

CpSolverResponse summary:
status: FEASIBLE
objective: 4713
best_bound: 1226
integers: 3111
booleans: 401
conflicts: 0
branches: 802
propagations: 106
integer_propagations: 122002
restarts: 802
lp_iterations: 1510
walltime: 3600.66
usertime: 3600.66
deterministic_time: 7963.04
gap_integral: 65040.5
solution_fingerprint: 0xa37df1955e4551e3


--- Simulation Gantt  partir du modle mathmatique ---
{'big':0, 'due_date':167, 'pos_time':5, 'status':0, 'blocked':0, 'operations':["{'type':1, 'processing_time':60}"]}
{'big':0, 'due_date':196, 'pos_time':5, 'status':0, 'blocked':0, 'operations':["{'type':0, 'processing_time':16}"]}
{'big':0, 'due_date':135, 'pos_time':5, 'status':0, 'blocked':0, 'operations':["{'type':1, 'processing_time':60}"]}
{'big':0, 'due_date':166, 'pos_time':5, 'status':0, 'blocked':0, 'operations':["{'type':0, 'processing_time':41}"]}
{'big':1, 'due_date':202, 'pos_time':5, 'status':0, 'blocked':0, 'operations':["{'type':1, 'processing_time':29}"]}
{'big':1, 'due_date':201, 'pos_time':5, 'status':0, 'blocked':0, 'operations':["{'type':1, 'processing_time':55}", "{'type':0, 'processing_time':19}"]}
{'big':0, 'due_date':158, 'pos_time':5, 'status':0, 'blocked':0, 'operations':["{'type':1, 'processing_time':39}", "{'type':0, 'processing_time':28}"]}
{'big':1, 'due_date':268, 'pos_time':5, 'status':0, 'blocked':0, 'operations':["{'type':0, 'processing_time':51}", "{'type':1, 'processing_time':56}"]}
{'big':1, 'due_date':236, 'pos_time':5, 'status':0, 'blocked':0, 'operations':["{'type':1, 'processing_time':60}", "{'type':0, 'processing_time':58}"]}
{'big':0, 'due_date':122, 'pos_time':5, 'status':0, 'blocked':0, 'operations':["{'type':0, 'processing_time':13}", "{'type':1, 'processing_time':23}"]}
{'big':0, 'due_date':180, 'pos_time':5, 'status':0, 'blocked':0, 'operations':["{'type':0, 'processing_time':31}", "{'type':1, 'processing_time':34}"]}
{'big':0, 'due_date':225, 'pos_time':5, 'status':0, 'blocked':0, 'operations':["{'type':1, 'processing_time':38}", "{'type':0, 'processing_time':47}"]}
{'big':0, 'due_date':165, 'pos_time':5, 'status':0, 'blocked':0, 'operations':["{'type':1, 'processing_time':12}"]}
{'big':1, 'due_date':108, 'pos_time':5, 'status':0, 'blocked':0, 'operations':["{'type':0, 'processing_time':41}", "{'type':1, 'processing_time':34}"]}
{'big':0, 'due_date':156, 'pos_time':5, 'status':0, 'blocked':0, 'operations':["{'type':1, 'processing_time':39}"]}
{'big':1, 'due_date':101, 'pos_time':5, 'status':0, 'blocked':0, 'operations':["{'type':1, 'processing_time':53}"]}
{'big':0, 'due_date':271, 'pos_time':5, 'status':0, 'blocked':0, 'operations':["{'type':0, 'processing_time':40}", "{'type':1, 'processing_time':11}"]}
{'big':1, 'due_date':189, 'pos_time':5, 'status':0, 'blocked':0, 'operations':["{'type':1, 'processing_time':12}"]}
