created virtual environment CPython3.12.4.final.0-64 in 5993ms
  creator CPython3Posix(dest=/localscratch/aneumann.63390719.0/env, clear=False, no_vcs_ignore=False, global=False)
  seeder FromAppData(download=False, pip=bundle, via=copy, app_data_dir=/home/aneumann/.local/share/virtualenv)
    added seed packages: pip==25.1.1
  activators BashActivator,CShellActivator,FishActivator,NushellActivator,PowerShellActivator,PythonActivator
Looking in links: /cvmfs/soft.computecanada.ca/custom/python/wheelhouse/gentoo2023/x86-64-v3, /cvmfs/soft.computecanada.ca/custom/python/wheelhouse/gentoo2023/generic, /cvmfs/soft.computecanada.ca/custom/python/wheelhouse/generic
Requirement already satisfied: pip in /localscratch/aneumann.63390719.0/env/lib/python3.12/site-packages (25.1.1)
Looking in links: /cvmfs/soft.computecanada.ca/custom/python/wheelhouse/gentoo2023/x86-64-v3, /cvmfs/soft.computecanada.ca/custom/python/wheelhouse/gentoo2023/generic, /cvmfs/soft.computecanada.ca/custom/python/wheelhouse/generic
ERROR: protobuf-5.28.3-cp38-abi3-manylinux2014_x86_64.whl is not a supported wheel on this platform.
Looking in links: /cvmfs/soft.computecanada.ca/custom/python/wheelhouse/gentoo2023/x86-64-v3, /cvmfs/soft.computecanada.ca/custom/python/wheelhouse/gentoo2023/generic, /cvmfs/soft.computecanada.ca/custom/python/wheelhouse/generic
Processing /home/aneumann/projects/def-adhaj/aneumann/GNRS/wheels/immutabledict-4.2.0-py3-none-any.whl
Installing collected packages: immutabledict
Successfully installed immutabledict-4.2.0
Looking in links: /cvmfs/soft.computecanada.ca/custom/python/wheelhouse/gentoo2023/x86-64-v3, /cvmfs/soft.computecanada.ca/custom/python/wheelhouse/gentoo2023/generic, /cvmfs/soft.computecanada.ca/custom/python/wheelhouse/generic
Processing /cvmfs/soft.computecanada.ca/custom/python/wheelhouse/generic/ortools-9.10.4067+computecanada-cp312-cp312-linux_x86_64.whl (from -r /home/aneumann/projects/def-adhaj/aneumann/GNRS/requirements/or.txt (line 1))
Processing /cvmfs/soft.computecanada.ca/custom/python/wheelhouse/gentoo2023/x86-64-v3/matplotlib-3.10.0+computecanada-cp312-cp312-linux_x86_64.whl (from -r /home/aneumann/projects/def-adhaj/aneumann/GNRS/requirements/or.txt (line 2))
Processing /cvmfs/soft.computecanada.ca/custom/python/wheelhouse/gentoo2023/x86-64-v3/pandas-2.2.3+computecanada-cp312-cp312-linux_x86_64.whl (from -r /home/aneumann/projects/def-adhaj/aneumann/GNRS/requirements/or.txt (line 3))
Processing /cvmfs/soft.computecanada.ca/custom/python/wheelhouse/generic/absl_py-2.2.2+computecanada-py3-none-any.whl (from ortools<9.11,>=9.10->-r /home/aneumann/projects/def-adhaj/aneumann/GNRS/requirements/or.txt (line 1))
Processing /cvmfs/soft.computecanada.ca/custom/python/wheelhouse/gentoo2023/generic/numpy-2.2.2+computecanada-cp312-cp312-linux_x86_64.whl (from ortools<9.11,>=9.10->-r /home/aneumann/projects/def-adhaj/aneumann/GNRS/requirements/or.txt (line 1))
Processing /cvmfs/soft.computecanada.ca/custom/python/wheelhouse/gentoo2023/x86-64-v3/protobuf-6.30.2+computecanada-cp312-cp312-linux_x86_64.whl (from ortools<9.11,>=9.10->-r /home/aneumann/projects/def-adhaj/aneumann/GNRS/requirements/or.txt (line 1))
Requirement already satisfied: immutabledict>=3.0.0 in /localscratch/aneumann.63390719.0/env/lib/python3.12/site-packages (from ortools<9.11,>=9.10->-r /home/aneumann/projects/def-adhaj/aneumann/GNRS/requirements/or.txt (line 1)) (4.2.0)
Processing /cvmfs/soft.computecanada.ca/custom/python/wheelhouse/gentoo2023/generic/contourpy-1.3.1+computecanada-cp312-cp312-linux_x86_64.whl (from matplotlib->-r /home/aneumann/projects/def-adhaj/aneumann/GNRS/requirements/or.txt (line 2))
Processing /cvmfs/soft.computecanada.ca/custom/python/wheelhouse/generic/cycler-0.12.1+computecanada-py3-none-any.whl (from matplotlib->-r /home/aneumann/projects/def-adhaj/aneumann/GNRS/requirements/or.txt (line 2))
Processing /cvmfs/soft.computecanada.ca/custom/python/wheelhouse/generic/fonttools-4.58.2+computecanada-cp312-cp312-linux_x86_64.whl (from matplotlib->-r /home/aneumann/projects/def-adhaj/aneumann/GNRS/requirements/or.txt (line 2))
Processing /cvmfs/soft.computecanada.ca/custom/python/wheelhouse/gentoo2023/x86-64-v3/kiwisolver-1.4.8+computecanada-cp312-cp312-linux_x86_64.whl (from matplotlib->-r /home/aneumann/projects/def-adhaj/aneumann/GNRS/requirements/or.txt (line 2))
Processing /cvmfs/soft.computecanada.ca/custom/python/wheelhouse/generic/packaging-25.0+computecanada-py3-none-any.whl (from matplotlib->-r /home/aneumann/projects/def-adhaj/aneumann/GNRS/requirements/or.txt (line 2))
Processing /cvmfs/soft.computecanada.ca/custom/python/wheelhouse/gentoo2023/x86-64-v3/pillow-11.1.0+computecanada-cp312-cp312-linux_x86_64.whl (from matplotlib->-r /home/aneumann/projects/def-adhaj/aneumann/GNRS/requirements/or.txt (line 2))
Processing /cvmfs/soft.computecanada.ca/custom/python/wheelhouse/generic/pyparsing-3.2.1+computecanada-py3-none-any.whl (from matplotlib->-r /home/aneumann/projects/def-adhaj/aneumann/GNRS/requirements/or.txt (line 2))
Processing /cvmfs/soft.computecanada.ca/custom/python/wheelhouse/generic/python_dateutil-2.9.0.post0+computecanada-py2.py3-none-any.whl (from matplotlib->-r /home/aneumann/projects/def-adhaj/aneumann/GNRS/requirements/or.txt (line 2))
Processing /cvmfs/soft.computecanada.ca/custom/python/wheelhouse/generic/pytz-2025.2+computecanada-py2.py3-none-any.whl (from pandas->-r /home/aneumann/projects/def-adhaj/aneumann/GNRS/requirements/or.txt (line 3))
Processing /cvmfs/soft.computecanada.ca/custom/python/wheelhouse/generic/tzdata-2025.2+computecanada-py2.py3-none-any.whl (from pandas->-r /home/aneumann/projects/def-adhaj/aneumann/GNRS/requirements/or.txt (line 3))
Processing /cvmfs/soft.computecanada.ca/custom/python/wheelhouse/generic/six-1.17.0+computecanada-py2.py3-none-any.whl (from python-dateutil>=2.7->matplotlib->-r /home/aneumann/projects/def-adhaj/aneumann/GNRS/requirements/or.txt (line 2))
Installing collected packages: pytz, tzdata, six, pyparsing, protobuf, pillow, packaging, numpy, kiwisolver, fonttools, cycler, absl-py, python-dateutil, contourpy, pandas, matplotlib, ortools

Successfully installed absl-py-2.2.2+computecanada contourpy-1.3.1+computecanada cycler-0.12.1+computecanada fonttools-4.58.2+computecanada kiwisolver-1.4.8+computecanada matplotlib-3.10.0+computecanada numpy-2.2.2+computecanada ortools-9.10.4067+computecanada packaging-25.0+computecanada pandas-2.2.3+computecanada pillow-11.1.0+computecanada protobuf-6.30.2+computecanada pyparsing-3.2.1+computecanada python-dateutil-2.9.0.post0+computecanada pytz-2025.2+computecanada six-1.17.0+computecanada tzdata-2025.2+computecanada

Starting CP-SAT solver v9.10.4067
Parameters: max_time_in_seconds: 3600 max_memory_in_mb: 12000 log_search_progress: true enumerate_all_solutions: false absolute_gap_limit: 0 relative_gap_limit: 0
Setting number of workers to 48

Initial optimization model '': (model_fingerprint: 0xf816a30f355f326c)
#Variables: 154 (#ints: 5 in objective)
  - 101 Booleans in [0,1]
  - 53 in [0,329]
#kLinear1: 18
#kLinear2: 183
#kLinear3: 66
#kLinearN: 524 (#terms: 4'459)

Starting presolve at 0.00s
  2.57e-04s  0.00e+00d  [DetectDominanceRelations] 
  6.63e-03s  0.00e+00d  [PresolveToFixPoint] #num_loops=6 #num_dual_strengthening=3 
  1.62e-05s  0.00e+00d  [ExtractEncodingFromLinear] #potential_supersets=2 
[Symmetry] Graph for symmetry has 737 nodes and 2'324 arcs.
[Symmetry] Symmetry computation done. time: 0.000381554 dtime: 0.00022993
[SAT presolve] num removable Booleans: 0 / 37
[SAT presolve] num trivial clauses: 0
[SAT presolve] [0s] clauses:6 literals:16 vars:11 one_side_vars:9 simple_definition:2 singleton_clauses:0
[SAT presolve] [3.6953e-05s] clauses:6 literals:16 vars:11 one_side_vars:9 simple_definition:2 singleton_clauses:0
[SAT presolve] [4.9282e-05s] clauses:6 literals:16 vars:11 one_side_vars:9 simple_definition:2 singleton_clauses:0
  1.68e-03s  1.42e-04d  [Probe] #probed=158 #fixed_bools=3 #new_bounds=12 #new_binary_clauses=1 
  1.97e-05s  0.00e+00d  [MaxClique] 
  2.44e-04s  0.00e+00d  [DetectDominanceRelations] 
  2.73e-03s  0.00e+00d  [PresolveToFixPoint] #num_loops=4 #num_dual_strengthening=3 
  4.93e-04s  0.00e+00d  [ProcessAtMostOneAndLinear] 
  4.69e-04s  0.00e+00d  [DetectDuplicateConstraints] #duplicates=125 #without_enforcements=27 
  1.26e-04s  3.59e-06d  [DetectDominatedLinearConstraints] #relevant_constraints=190 #num_inclusions=26 #num_redundant=4 
  1.20e-04s  0.00e+00d  [DetectDifferentVariables] #different=20 #cliques=1 #size=3 
  5.79e-05s  1.37e-06d  [ProcessSetPPC] #relevant_constraints=112 
  9.11e-06s  0.00e+00d  [FindAlmostIdenticalLinearConstraints] 
  4.06e-05s  1.95e-05d  [FindBigAtMostOneAndLinearOverlap] 
  2.89e-04s  8.52e-05d  [FindBigVerticalLinearOverlap] #blocks=1 #saved_nz=40 
  2.81e-05s  4.11e-06d  [FindBigHorizontalLinearOverlap] #linears=106 
  1.71e-05s  6.00e-08d  [MergeClauses] 
  1.71e-04s  0.00e+00d  [DetectDominanceRelations] 
  1.71e-03s  0.00e+00d  [PresolveToFixPoint] #num_loops=2 #num_dual_strengthening=1 
  1.67e-04s  0.00e+00d  [DetectDominanceRelations] 
  1.35e-03s  0.00e+00d  [PresolveToFixPoint] #num_loops=1 #num_dual_strengthening=1 
[SAT presolve] num removable Booleans: 0 / 34
[SAT presolve] num trivial clauses: 0
[SAT presolve] [0s] clauses:6 literals:16 vars:11 one_side_vars:9 simple_definition:2 singleton_clauses:0
[SAT presolve] [3.4334e-05s] clauses:6 literals:16 vars:11 one_side_vars:9 simple_definition:2 singleton_clauses:0
[SAT presolve] [4.5967e-05s] clauses:6 literals:16 vars:11 one_side_vars:9 simple_definition:2 singleton_clauses:0
  1.38e-03s  1.26e-04d  [Probe] #probed=152 #new_bounds=5 #new_binary_clauses=2 
  1.78e-05s  0.00e+00d  [MaxClique] 
  1.70e-04s  0.00e+00d  [DetectDominanceRelations] 
  1.88e-03s  0.00e+00d  [PresolveToFixPoint] #num_loops=2 #num_dual_strengthening=1 
  4.37e-04s  0.00e+00d  [ProcessAtMostOneAndLinear] 
  3.38e-04s  0.00e+00d  [DetectDuplicateConstraints] #without_enforcements=27 
  1.07e-04s  3.30e-06d  [DetectDominatedLinearConstraints] #relevant_constraints=187 #num_inclusions=18 
  4.41e-05s  0.00e+00d  [DetectDifferentVariables] 
  5.70e-05s  1.29e-06d  [ProcessSetPPC] #relevant_constraints=112 
  9.26e-06s  0.00e+00d  [FindAlmostIdenticalLinearConstraints] 
  3.75e-05s  1.88e-05d  [FindBigAtMostOneAndLinearOverlap] 
  2.37e-04s  8.06e-05d  [FindBigVerticalLinearOverlap] 
  2.64e-05s  4.11e-06d  [FindBigHorizontalLinearOverlap] #linears=106 
  1.63e-05s  6.00e-08d  [MergeClauses] 
  1.71e-04s  0.00e+00d  [DetectDominanceRelations] 
  1.38e-03s  0.00e+00d  [PresolveToFixPoint] #num_loops=1 #num_dual_strengthening=1 
  1.66e-04s  0.00e+00d  [DetectDominanceRelations] 
  1.35e-03s  0.00e+00d  [PresolveToFixPoint] #num_loops=1 #num_dual_strengthening=1 
[SAT presolve] num removable Booleans: 0 / 34
[SAT presolve] num trivial clauses: 0
[SAT presolve] [0s] clauses:6 literals:16 vars:11 one_side_vars:9 simple_definition:2 singleton_clauses:0
[SAT presolve] [3.9054e-05s] clauses:6 literals:16 vars:11 one_side_vars:9 simple_definition:2 singleton_clauses:0
[SAT presolve] [5.1489e-05s] clauses:6 literals:16 vars:11 one_side_vars:9 simple_definition:2 singleton_clauses:0
  1.37e-03s  1.25e-04d  [Probe] #probed=152 #new_binary_clauses=2 
  1.87e-05s  0.00e+00d  [MaxClique] 
  1.70e-04s  0.00e+00d  [DetectDominanceRelations] 
  1.38e-03s  0.00e+00d  [PresolveToFixPoint] #num_loops=1 #num_dual_strengthening=1 
  4.44e-04s  0.00e+00d  [ProcessAtMostOneAndLinear] 
  3.38e-04s  0.00e+00d  [DetectDuplicateConstraints] #without_enforcements=27 
  1.07e-04s  3.30e-06d  [DetectDominatedLinearConstraints] #relevant_constraints=187 #num_inclusions=18 
  4.42e-05s  0.00e+00d  [DetectDifferentVariables] 
  5.65e-05s  1.29e-06d  [ProcessSetPPC] #relevant_constraints=112 
  9.08e-06s  0.00e+00d  [FindAlmostIdenticalLinearConstraints] 
  4.34e-05s  1.88e-05d  [FindBigAtMostOneAndLinearOverlap] 
  2.37e-04s  8.06e-05d  [FindBigVerticalLinearOverlap] 
  2.72e-05s  4.11e-06d  [FindBigHorizontalLinearOverlap] #linears=106 
  1.58e-05s  6.00e-08d  [MergeClauses] 
  1.71e-04s  0.00e+00d  [DetectDominanceRelations] 
  1.37e-03s  0.00e+00d  [PresolveToFixPoint] #num_loops=1 #num_dual_strengthening=1 
  2.17e-05s  0.00e+00d  [ExpandObjective] #entries=16 #tight_variables=8 #tight_constraints=3 

Presolve summary:
  - 25 affine relations were detected.
  - rule 'TODO dual: only one blocking constraint?' was applied 323 times.
  - rule 'TODO dual: only one unspecified blocking constraint?' was applied 65 times.
  - rule 'TODO duplicate: identical constraint with different enforcements' was applied 81 times.
  - rule 'TODO linear2: contains a Boolean.' was applied 35 times.
  - rule 'TODO no_overlap: with task always last' was applied 1 time.
  - rule 'affine: new relation' was applied 25 times.
  - rule 'all_diff: inferred from x != y constraints' was applied 1 time.
  - rule 'bool_or: implications' was applied 2 times.
  - rule 'deductions: 78 stored' was applied 1 time.
  - rule 'dual: fix variable' was applied 9 times.
  - rule 'dual: reduced domain' was applied 32 times.
  - rule 'duplicate: merged rhs of linear constraint' was applied 25 times.
  - rule 'duplicate: removed constraint' was applied 125 times.
  - rule 'enforcement: false literal' was applied 14 times.
  - rule 'enforcement: true literal' was applied 12 times.
  - rule 'incompatible linear: add implication' was applied 27 times.
  - rule 'linear inclusion: redundant containing constraint' was applied 4 times.
  - rule 'linear matrix: common vertical rectangle' was applied 1 time.
  - rule 'linear1: always true' was applied 2 times.
  - rule 'linear2: contains a Boolean.' was applied 8 times.
  - rule 'linear: always true' was applied 275 times.
  - rule 'linear: doubleton free' was applied 6 times.
  - rule 'linear: empty' was applied 18 times.
  - rule 'linear: extracted enforcement literal' was applied 569 times.
  - rule 'linear: fixed or dup variables' was applied 533 times.
  - rule 'linear: negative clause' was applied 5 times.
  - rule 'linear: positive clause' was applied 1 time.
  - rule 'linear: positive equal one' was applied 2 times.
  - rule 'linear: reduced variable domains' was applied 64 times.
  - rule 'linear: remapped using affine relations' was applied 445 times.
  - rule 'linear: simplified rhs' was applied 1'378 times.
  - rule 'linear: variable substitution 1' was applied 6 times.
  - rule 'presolve: 50 unused variables removed.' was applied 1 time.
  - rule 'presolve: iteration' was applied 3 times.

Presolved optimization model '': (model_fingerprint: 0xfb68d50f877ab373)
#Variables: 74 (#ints: 5 in objective)
  - 34 Booleans in [0,1]
  - 1 in [0,175]
  - 1 in [0,231]
  - 1 in [0,232]
  - 3 in [0,240]
  - 5 in [0,243]
  - 3 in [0,248]
  - 1 in [3,251]
  - 2 in [7,273]
  - 1 in [7,308]
  - 1 in [10,311]
  - 1 in [10,311][339,640]
  - 1 in [16,259]
  - 1 in [25,291]
  - 1 in [44,287]
  - 1 in [54,302]
  - 3 in [75,318]
  - 1 in [81,324]
  - 3 in [86,318]
  - 2 in [87,318]
  - 3 in [92,318]
  - 1 in [92,324]
  - 1 in [93,324]
  - 1 in [98,324]
  - 1 in [103,329]
#kAllDiff: 1
#kBoolAnd: 1 (#enforced: 1) (#literals: 3)
#kBoolOr: 4 (#literals: 12)
#kExactlyOne: 2 (#literals: 6)
#kLinear1: 11 (#enforced: 11 #multi: 6)
#kLinear2: 147 (#enforced: 117 #multi: 83)
#kLinear3: 44 (#enforced: 35 #multi: 19)
#kLinearN: 113 (#enforced: 76) (#terms: 850)

Preloading model.
#Bound   0.03s best:inf   next:[119,1226] initial_domain
#Model   0.03s var:74/74 constraints:323/323

Starting search at 0.03s with 48 workers.
16 full problem subsolvers: [core, default_lp, lb_tree_search, max_lp, no_lp, objective_lb_search, objective_lb_search_max_lp, objective_lb_search_no_lp, objective_shaving_search_max_lp, objective_shaving_search_no_lp, probing, probing_max_lp, pseudo_costs, quick_restart, quick_restart_no_lp, reduced_costs]
30 first solution subsolvers: [fj_long_default(2), fj_long_lin_default, fj_long_lin_perturb, fj_long_lin_random, fj_long_perturb, fj_long_random, fj_short_default(2), fj_short_lin_default(2), fj_short_lin_perturb, fj_short_lin_random, fj_short_perturb, fj_short_random, fs_random(4), fs_random_no_lp(4), fs_random_quick_restart(4), fs_random_quick_restart_no_lp(3)]
13 incomplete subsolvers: [feasibility_pump, graph_arc_lns, graph_cst_lns, graph_dec_lns, graph_var_lns, rins/rens, rnd_cst_lns, rnd_var_lns, violation_ls(5)]
3 helper subsolvers: [neighborhood_helper, synchronization_agent, update_gap_integral]
#Bound   0.04s best:inf   next:[120,1226] bool_core (num_cores=1 [size:1 mw:1] a=5 d=0 fixed=0/50 clauses=14)
#1       0.04s best:678   next:[120,677]  no_lp (fixed_bools=0/63)
#2       0.04s best:677   next:[120,676]  violation_ls(batch:1 #solutions_imported:1 #lin_moves:0 #lin_evals:28 #gen_moves:27 #gen_evals:3 #comp_moves:3 #backtracks:12 #weight_updates:0)
#Bound   0.04s best:677   next:[129,676]  default_lp
#3       0.04s best:565   next:[129,564]  no_lp (fixed_bools=0/70)
#4       0.04s best:559   next:[129,558]  no_lp (fixed_bools=0/76)
#5       0.04s best:556   next:[129,555]  quick_restart_no_lp (fixed_bools=0/66)
#Bound   0.04s best:556   next:[130,555]  bool_core (num_cores=3 [cover] a=4 d=1 fixed=9/76 clauses=50)
#Bound   0.04s best:556   next:[131,555]  bool_core (num_cores=3 [cover] a=4 d=1 fixed=10/79 clauses=59)
#Bound   0.04s best:556   next:[132,555]  bool_core (num_cores=3 [cover] a=4 d=1 fixed=11/82 clauses=69)
#Bound   0.04s best:556   next:[133,555]  bool_core (num_cores=4 [size:1 mw:1] a=4 d=1 fixed=12/85 clauses=80)
#6       0.04s best:554   next:[133,553]  no_lp (fixed_bools=0/81)
#7       0.04s best:548   next:[133,547]  no_lp (fixed_bools=0/86)
#Bound   0.04s best:548   next:[134,547]  bool_core (num_cores=5 [size:2 mw:1 d:2] a=3 d=2 fixed=13/86 clauses=80)
#Bound   0.04s best:548   next:[135,547]  bool_core (num_cores=5 [cover] a=3 d=2 fixed=13/91 clauses=93)
#Bound   0.04s best:548   next:[136,547]  bool_core (num_cores=5 [cover] a=3 d=2 fixed=14/96 clauses=108)
#Bound   0.04s best:548   next:[137,547]  bool_core (num_cores=5 [cover] a=3 d=2 fixed=15/101 clauses=125)
#8       0.04s best:542   next:[137,541]  violation_ls(batch:1 #solutions_imported:1 #lin_moves:265 #lin_evals:978 #weight_updates:113)
#Bound   0.04s best:542   next:[138,541]  bool_core (num_cores=5 [cover] a=3 d=2 fixed=16/106 clauses=144)
#Bound   0.04s best:542   next:[139,541]  bool_core (num_cores=5 [cover] a=3 d=2 fixed=17/111 clauses=165)
#9       0.04s best:540   next:[139,539]  violation_ls(batch:1 #solutions_imported:1 #lin_moves:0 #lin_evals:4 #gen_moves:1 #gen_evals:0 #comp_moves:1 #backtracks:0 #weight_updates:0)
#Bound   0.04s best:540   next:[140,539]  bool_core (num_cores=5 [cover] a=3 d=2 fixed=18/116 clauses=188)
#Bound   0.05s best:540   next:[141,539]  bool_core (num_cores=5 [cover] a=3 d=2 fixed=19/121 clauses=213)
#10      0.05s best:525   next:[141,524]  quick_restart_no_lp (fixed_bools=0/90)
#Bound   0.05s best:525   next:[142,524]  bool_core (num_cores=5 [cover] a=3 d=2 fixed=20/126 clauses=240)
#Bound   0.05s best:525   next:[143,524]  bool_core (num_cores=5 [cover] a=3 d=2 fixed=21/131 clauses=269)
#Bound   0.05s best:525   next:[144,524]  bool_core (num_cores=5 [cover] a=3 d=2 fixed=22/136 clauses=300)
#Bound   0.05s best:525   next:[145,524]  bool_core (num_cores=5 [cover] a=3 d=2 fixed=23/141 clauses=333)
#Bound   0.05s best:525   next:[146,524]  bool_core (num_cores=5 [cover] a=3 d=2 fixed=24/146 clauses=368)
#11      0.05s best:415   next:[146,414]  quick_restart_no_lp (fixed_bools=0/96)
#Bound   0.05s best:415   next:[147,414]  bool_core (num_cores=5 [cover] a=3 d=2 fixed=25/151 clauses=405)
#12      0.05s best:414   next:[158,413]  quick_restart_no_lp (fixed_bools=1/114)
#13      0.05s best:405   next:[160,404]  quick_restart_no_lp (fixed_bools=1/130)
#14      0.05s best:404   next:[212,403]  quick_restart_no_lp (fixed_bools=2/143)
#15      0.06s best:403   next:[212,402]  violation_ls(batch:2 #solutions_imported:2 #lin_moves:6 #lin_evals:62 #gen_moves:27 #gen_evals:3 #comp_moves:3 #backtracks:12 #weight_updates:5)
#16      0.06s best:402   next:[212,401]  violation_ls(batch:2 #solutions_imported:2 #lin_moves:266 #lin_evals:983 #weight_updates:113)
#17      0.06s best:401   next:[212,400]  violation_ls(batch:2 #solutions_imported:2 #lin_moves:0 #lin_evals:27 #gen_moves:19 #gen_evals:3 #comp_moves:3 #backtracks:8 #weight_updates:0)
#18      0.06s best:387   next:[212,386]  rins_pump_lns (d=0.50 s=41 t=0.10 p=0.00 stall=0 h=auto_l0)
#19      0.06s best:384   next:[212,383]  no_lp (fixed_bools=1/106)
#20      0.06s best:381   next:[212,380]  no_lp (fixed_bools=1/110)
#21      0.07s best:352   next:[212,351]  no_lp (fixed_bools=1/115)
#22      0.07s best:343   next:[212,342]  no_lp (fixed_bools=1/121)
#23      0.07s best:340   next:[214,339]  no_lp (fixed_bools=1/130)
#24      0.08s best:329   next:[218,328]  no_lp (fixed_bools=1/139)
#25      0.08s best:324   next:[249,323]  quick_restart_no_lp (fixed_bools=2/149)
#26      0.08s best:323   next:[259,322]  no_lp (fixed_bools=3/143)
#Model   0.09s var:72/74 constraints:275/323
#27      0.09s best:312   next:[263,311]  no_lp (fixed_bools=3/155)
#Model   0.10s var:71/74 constraints:268/323
#Model   0.11s var:69/74 constraints:249/323
#Model   0.11s var:66/74 constraints:213/323
#Done    0.11s no_lp
#Done    0.11s quick_restart_no_lp
#Done    0.11s objective_lb_search_no_lp
#Done    0.11s objective_lb_search
#Done    0.12s quick_restart
#Model   0.12s var:54/74 constraints:112/323
#Bound   0.11s best:312   next:[296,311]  objective_lb_search_no_lp [skipped_logs=32]

Task timing                                  n [     min,      max]      avg      dev     time         n [     min,      max]      avg      dev    dtime
                             'core':         1 [ 81.16ms,  81.16ms]  81.16ms   0.00ns  81.16ms         1 [ 28.98ms,  28.98ms]  28.98ms   0.00ns  28.98ms
                       'default_lp':         1 [ 80.59ms,  80.59ms]  80.59ms   0.00ns  80.59ms         1 [  6.45ms,   6.45ms]   6.45ms   0.00ns   6.45ms
                 'feasibility_pump':         4 [  1.09ms,   9.78ms]   7.12ms   3.51ms  28.47ms         3 [  1.16ms,   1.34ms]   1.22ms  88.23us   3.66ms
                  'fj_long_default':         0 [  0.00ns,   0.00ns]   0.00ns   0.00ns   0.00ns         0 [  0.00ns,   0.00ns]   0.00ns   0.00ns   0.00ns
                  'fj_long_default':         0 [  0.00ns,   0.00ns]   0.00ns   0.00ns   0.00ns         0 [  0.00ns,   0.00ns]   0.00ns   0.00ns   0.00ns
              'fj_long_lin_default':         0 [  0.00ns,   0.00ns]   0.00ns   0.00ns   0.00ns         0 [  0.00ns,   0.00ns]   0.00ns   0.00ns   0.00ns
              'fj_long_lin_perturb':         0 [  0.00ns,   0.00ns]   0.00ns   0.00ns   0.00ns         0 [  0.00ns,   0.00ns]   0.00ns   0.00ns   0.00ns
               'fj_long_lin_random':         0 [  0.00ns,   0.00ns]   0.00ns   0.00ns   0.00ns         0 [  0.00ns,   0.00ns]   0.00ns   0.00ns   0.00ns
                  'fj_long_perturb':         0 [  0.00ns,   0.00ns]   0.00ns   0.00ns   0.00ns         0 [  0.00ns,   0.00ns]   0.00ns   0.00ns   0.00ns
                   'fj_long_random':         0 [  0.00ns,   0.00ns]   0.00ns   0.00ns   0.00ns         0 [  0.00ns,   0.00ns]   0.00ns   0.00ns   0.00ns
                 'fj_short_default':         0 [  0.00ns,   0.00ns]   0.00ns   0.00ns   0.00ns         0 [  0.00ns,   0.00ns]   0.00ns   0.00ns   0.00ns
                 'fj_short_default':         0 [  0.00ns,   0.00ns]   0.00ns   0.00ns   0.00ns         0 [  0.00ns,   0.00ns]   0.00ns   0.00ns   0.00ns
             'fj_short_lin_default':         0 [  0.00ns,   0.00ns]   0.00ns   0.00ns   0.00ns         0 [  0.00ns,   0.00ns]   0.00ns   0.00ns   0.00ns
             'fj_short_lin_default':         0 [  0.00ns,   0.00ns]   0.00ns   0.00ns   0.00ns         0 [  0.00ns,   0.00ns]   0.00ns   0.00ns   0.00ns
             'fj_short_lin_perturb':         0 [  0.00ns,   0.00ns]   0.00ns   0.00ns   0.00ns         0 [  0.00ns,   0.00ns]   0.00ns   0.00ns   0.00ns
              'fj_short_lin_random':         0 [  0.00ns,   0.00ns]   0.00ns   0.00ns   0.00ns         0 [  0.00ns,   0.00ns]   0.00ns   0.00ns   0.00ns
                 'fj_short_perturb':         0 [  0.00ns,   0.00ns]   0.00ns   0.00ns   0.00ns         0 [  0.00ns,   0.00ns]   0.00ns   0.00ns   0.00ns
                  'fj_short_random':         0 [  0.00ns,   0.00ns]   0.00ns   0.00ns   0.00ns         0 [  0.00ns,   0.00ns]   0.00ns   0.00ns   0.00ns
                        'fs_random':         0 [  0.00ns,   0.00ns]   0.00ns   0.00ns   0.00ns         0 [  0.00ns,   0.00ns]   0.00ns   0.00ns   0.00ns
                        'fs_random':         0 [  0.00ns,   0.00ns]   0.00ns   0.00ns   0.00ns         0 [  0.00ns,   0.00ns]   0.00ns   0.00ns   0.00ns
                        'fs_random':         0 [  0.00ns,   0.00ns]   0.00ns   0.00ns   0.00ns         0 [  0.00ns,   0.00ns]   0.00ns   0.00ns   0.00ns
                        'fs_random':         1 [  1.51ms,   1.51ms]   1.51ms   0.00ns   1.51ms         0 [  0.00ns,   0.00ns]   0.00ns   0.00ns   0.00ns
                  'fs_random_no_lp':         0 [  0.00ns,   0.00ns]   0.00ns   0.00ns   0.00ns         0 [  0.00ns,   0.00ns]   0.00ns   0.00ns   0.00ns
                  'fs_random_no_lp':         0 [  0.00ns,   0.00ns]   0.00ns   0.00ns   0.00ns         0 [  0.00ns,   0.00ns]   0.00ns   0.00ns   0.00ns
                  'fs_random_no_lp':         0 [  0.00ns,   0.00ns]   0.00ns   0.00ns   0.00ns         0 [  0.00ns,   0.00ns]   0.00ns   0.00ns   0.00ns
                  'fs_random_no_lp':         1 [  1.30ms,   1.30ms]   1.30ms   0.00ns   1.30ms         0 [  0.00ns,   0.00ns]   0.00ns   0.00ns   0.00ns
          'fs_random_quick_restart':         0 [  0.00ns,   0.00ns]   0.00ns   0.00ns   0.00ns         0 [  0.00ns,   0.00ns]   0.00ns   0.00ns   0.00ns
          'fs_random_quick_restart':         0 [  0.00ns,   0.00ns]   0.00ns   0.00ns   0.00ns         0 [  0.00ns,   0.00ns]   0.00ns   0.00ns   0.00ns
          'fs_random_quick_restart':         0 [  0.00ns,   0.00ns]   0.00ns   0.00ns   0.00ns         0 [  0.00ns,   0.00ns]   0.00ns   0.00ns   0.00ns
          'fs_random_quick_restart':         1 [  1.63ms,   1.63ms]   1.63ms   0.00ns   1.63ms         0 [  0.00ns,   0.00ns]   0.00ns   0.00ns   0.00ns
    'fs_random_quick_restart_no_lp':         0 [  0.00ns,   0.00ns]   0.00ns   0.00ns   0.00ns         0 [  0.00ns,   0.00ns]   0.00ns   0.00ns   0.00ns
    'fs_random_quick_restart_no_lp':         0 [  0.00ns,   0.00ns]   0.00ns   0.00ns   0.00ns         0 [  0.00ns,   0.00ns]   0.00ns   0.00ns   0.00ns
    'fs_random_quick_restart_no_lp':         1 [  3.21ms,   3.21ms]   3.21ms   0.00ns   3.21ms         0 [  0.00ns,   0.00ns]   0.00ns   0.00ns   0.00ns
                    'graph_arc_lns':         4 [  1.53ms,  13.62ms]   6.49ms   4.55ms  25.97ms         3 [  4.10us, 152.52us]  56.54us  67.97us 169.62us
                    'graph_cst_lns':         4 [371.45us, 721.81us] 471.05us 145.66us   1.88ms         0 [  0.00ns,   0.00ns]   0.00ns   0.00ns   0.00ns
                    'graph_dec_lns':         4 [  1.07ms,  10.54ms]   4.49ms   3.80ms  17.94ms         3 [ 10.00ns,  86.85us]  29.09us  40.84us  87.27us
                    'graph_var_lns':         4 [  1.49ms,  13.32ms]   7.69ms   4.33ms  30.77ms         4 [ 10.00ns, 149.86us]  68.54us  54.15us 274.14us
                   'lb_tree_search':         1 [ 79.50ms,  79.50ms]  79.50ms   0.00ns  79.50ms         1 [  1.03ms,   1.03ms]   1.03ms   0.00ns   1.03ms
                           'max_lp':         1 [ 80.67ms,  80.67ms]  80.67ms   0.00ns  80.67ms         1 [  1.24ms,   1.24ms]   1.24ms   0.00ns   1.24ms
                            'no_lp':         1 [ 77.14ms,  77.14ms]  77.14ms   0.00ns  77.14ms         1 [  9.92ms,   9.92ms]   9.92ms   0.00ns   9.92ms
              'objective_lb_search':         1 [ 77.95ms,  77.95ms]  77.95ms   0.00ns  77.95ms         1 [  7.43ms,   7.43ms]   7.43ms   0.00ns   7.43ms
       'objective_lb_search_max_lp':         1 [ 78.15ms,  78.15ms]  78.15ms   0.00ns  78.15ms         1 [  6.41ms,   6.41ms]   6.41ms   0.00ns   6.41ms
        'objective_lb_search_no_lp':         1 [ 76.30ms,  76.30ms]  76.30ms   0.00ns  76.30ms         1 [  8.56ms,   8.56ms]   8.56ms   0.00ns   8.56ms
  'objective_shaving_search_max_lp':         5 [534.98us,  17.20ms]   7.53ms   6.63ms  37.67ms         3 [ 42.42us, 272.73us] 190.76us 105.09us 572.28us
   'objective_shaving_search_no_lp':         5 [730.92us,   4.89ms]   2.76ms   1.76ms  13.82ms         1 [ 43.57us,  43.57us]  43.57us   0.00ns  43.57us
                          'probing':         1 [ 81.29ms,  81.29ms]  81.29ms   0.00ns  81.29ms         1 [  2.17ms,   2.17ms]   2.17ms   0.00ns   2.17ms
                   'probing_max_lp':         1 [ 78.98ms,  78.98ms]  78.98ms   0.00ns  78.98ms         1 [  1.42ms,   1.42ms]   1.42ms   0.00ns   1.42ms
                     'pseudo_costs':         1 [ 79.54ms,  79.54ms]  79.54ms   0.00ns  79.54ms         1 [  7.57ms,   7.57ms]   7.57ms   0.00ns   7.57ms
                    'quick_restart':         1 [ 80.15ms,  80.15ms]  80.15ms   0.00ns  80.15ms         1 [  6.28ms,   6.28ms]   6.28ms   0.00ns   6.28ms
              'quick_restart_no_lp':         1 [ 77.32ms,  77.32ms]  77.32ms   0.00ns  77.32ms         1 [  9.43ms,   9.43ms]   9.43ms   0.00ns   9.43ms
                    'reduced_costs':         1 [ 80.00ms,  80.00ms]  80.00ms   0.00ns  80.00ms         1 [  9.62ms,   9.62ms]   9.62ms   0.00ns   9.62ms
                        'rins/rens':         4 [950.14us,  20.63ms]   9.84ms   7.76ms  39.37ms         2 [ 30.31us,   1.94ms] 987.24us 956.93us   1.97ms
                      'rnd_cst_lns':         4 [450.23us,  12.75ms]   4.88ms   4.70ms  19.52ms         2 [ 22.00ns,   2.03us]   1.03us   1.01us   2.05us
                      'rnd_var_lns':         4 [903.62us,  13.51ms]   5.08ms   4.97ms  20.33ms         4 [ 10.00ns, 323.86us]  99.95us 132.94us 399.79us
                     'violation_ls':         1 [ 66.93ms,  66.93ms]  66.93ms   0.00ns  66.93ms         1 [ 30.82ms,  30.82ms]  30.82ms   0.00ns  30.82ms
                     'violation_ls':         2 [ 26.76ms,  41.52ms]  34.14ms   7.38ms  68.28ms         2 [ 12.70ms,  19.29ms]  15.99ms   3.29ms  31.99ms
                     'violation_ls':         3 [ 70.47us,  26.67ms]   9.89ms  11.92ms  29.68ms         3 [510.00ns,  12.83ms]   4.60ms   5.84ms  13.79ms
                     'violation_ls':         3 [183.31us,  29.67ms]  10.17ms  13.79ms  30.50ms         3 [ 22.48us,  19.30ms]   6.46ms   9.08ms  19.37ms
                     'violation_ls':         3 [268.51us,  25.94ms]   8.83ms  12.09ms  26.50ms         3 [690.00ns,  10.85ms]   3.64ms   5.10ms  10.91ms

Search stats                        Bools  Conflicts  Branches  Restarts  BoolPropag  IntegerPropag
                           'core':    406        376     1'624       419      80'515         55'383
                     'default_lp':     75         60       818       353       2'320         16'400
                      'fs_random':      0          0         0         0           0              0
                      'fs_random':      0          0         0         0           0              0
                      'fs_random':      0          0         0         0           0              0
                      'fs_random':     45          0         0         0           0              0
                'fs_random_no_lp':      0          0         0         0           0              0
                'fs_random_no_lp':      0          0         0         0           0              0
                'fs_random_no_lp':      0          0         0         0           0              0
                'fs_random_no_lp':     45          0         0         0           0              0
        'fs_random_quick_restart':      0          0         0         0           0              0
        'fs_random_quick_restart':      0          0         0         0           0              0
        'fs_random_quick_restart':      0          0         0         0           0              0
        'fs_random_quick_restart':     45          0         0         0           0              0
  'fs_random_quick_restart_no_lp':      0          0         0         0           0              0
  'fs_random_quick_restart_no_lp':      0          0         0         0           0              0
  'fs_random_quick_restart_no_lp':     45          0         0         0           0              0
                 'lb_tree_search':     45          0        90        90          43            460
                         'max_lp':     45          0        90        90          43            460
                          'no_lp':    158        328     1'669       415      14'423         56'682
            'objective_lb_search':     58        100       608       280       2'003         14'550
     'objective_lb_search_max_lp':     53         10       112        90         256          1'607
      'objective_lb_search_no_lp':     61        383     1'131       367       5'859         50'478
                        'probing':     87         18       156       156         502          2'042
                 'probing_max_lp':     45          0        90        90          43            460
                   'pseudo_costs':     51         26       140        90         262          3'702
                  'quick_restart':     58         32       664       329       1'198         11'102
            'quick_restart_no_lp':    178        358     2'105       475      14'736         51'098
                  'reduced_costs':     75         42       138        90         777          3'169

SAT stats                           ClassicMinim  LitRemoved  LitLearned  LitForgotten  Subsumed  MClauses  MDecisions  MLitTrue  MSubsumed  MLitRemoved  MReused
                           'core':           256         918       1'055             0         1        65         313         0          4           14        2
                     'default_lp':            29          43         414             0         4        64         327         0         13           71        4
                      'fs_random':             0           0           0             0         0         0           0         0          0            0        0
                      'fs_random':             0           0           0             0         0         0           0         0          0            0        0
                      'fs_random':             0           0           0             0         0         0           0         0          0            0        0
                      'fs_random':             0           0           0             0         0         0           0         0          0            0        0
                'fs_random_no_lp':             0           0           0             0         0         0           0         0          0            0        0
                'fs_random_no_lp':             0           0           0             0         0         0           0         0          0            0        0
                'fs_random_no_lp':             0           0           0             0         0         0           0         0          0            0        0
                'fs_random_no_lp':             0           0           0             0         0         0           0         0          0            0        0
        'fs_random_quick_restart':             0           0           0             0         0         0           0         0          0            0        0
        'fs_random_quick_restart':             0           0           0             0         0         0           0         0          0            0        0
        'fs_random_quick_restart':             0           0           0             0         0         0           0         0          0            0        0
        'fs_random_quick_restart':             0           0           0             0         0         0           0         0          0            0        0
  'fs_random_quick_restart_no_lp':             0           0           0             0         0         0           0         0          0            0        0
  'fs_random_quick_restart_no_lp':             0           0           0             0         0         0           0         0          0            0        0
  'fs_random_quick_restart_no_lp':             0           0           0             0         0         0           0         0          0            0        0
                 'lb_tree_search':             0           0           0             0         0         0           0         0          0            0        0
                         'max_lp':             0           0           0             0         0         0           0         0          0            0        0
                          'no_lp':           224         493       1'950             0        28        79         369         0         27          129       10
            'objective_lb_search':            66         138         463             0         8        36         178         0          0            0        2
     'objective_lb_search_max_lp':             1           2          49             0         4         0           0         0          0            0        0
      'objective_lb_search_no_lp':           276         644       1'573             0        38        85         457         0         24          123       12
                        'probing':             0           0          18             0         0         0           0         0          0            0        0
                 'probing_max_lp':             0           0           0             0         0         0           0         0          0            0        0
                   'pseudo_costs':            21          41         190             0         0         0           0         0          0            0        0
                  'quick_restart':            14          17         151             0         1        45         225         0          4           18        2
            'quick_restart_no_lp':           215         425       2'407             0         8        79         445         0          8           44        8
                  'reduced_costs':            16          25         193             0         1         0           0         0          0            0        0

Lp stats                         Component  Iterations  AddedCuts  OPTIMAL  DUAL_F.  DUAL_U.
                  'default_lp':          1         391        345      108        0        0
                   'fs_random':          1           0          0        0        0        0
     'fs_random_quick_restart':          1           0          0        0        0        0
              'lb_tree_search':          1         108        510        5        0        0
                      'max_lp':          1         114        481        5        0        0
         'objective_lb_search':          1         580        316      124        0        0
  'objective_lb_search_max_lp':          1         389        480       25        9        0
                     'probing':          1         152        341       94        0        0
              'probing_max_lp':          1         114        452        5        0        0
                'pseudo_costs':          1         495        462       51       12        0
               'quick_restart':          1         530        355      111        0        0
               'reduced_costs':          1         654        510       43       17        0

Lp dimension                                                                    Final dimension of first component
                  'default_lp':   185 rows, 70 columns, 114 entries with magnitude in [4.275021e-02, 1.000000e+00]
                   'fs_random':       0 rows, 70 columns, 0 entries with magnitude in [0.000000e+00, 0.000000e+00]
     'fs_random_quick_restart':       0 rows, 70 columns, 0 entries with magnitude in [0.000000e+00, 0.000000e+00]
              'lb_tree_search':  423 rows, 74 columns, 2270 entries with magnitude in [2.111635e-03, 1.000000e+00]
                      'max_lp':  423 rows, 74 columns, 2276 entries with magnitude in [7.511370e-04, 1.000000e+00]
         'objective_lb_search':   189 rows, 70 columns, 724 entries with magnitude in [7.937497e-04, 1.000000e+00]
  'objective_lb_search_max_lp':  306 rows, 74 columns, 1301 entries with magnitude in [2.476942e-03, 1.000000e+00]
                     'probing':   173 rows, 70 columns, 819 entries with magnitude in [6.351076e-04, 1.000000e+00]
              'probing_max_lp':  423 rows, 74 columns, 2289 entries with magnitude in [7.511370e-04, 1.000000e+00]
                'pseudo_costs':  296 rows, 74 columns, 1201 entries with magnitude in [2.108813e-03, 1.000000e+00]
               'quick_restart':   201 rows, 70 columns, 412 entries with magnitude in [6.542820e-03, 1.000000e+00]
               'reduced_costs':  291 rows, 74 columns, 1201 entries with magnitude in [1.179578e-03, 1.000000e+00]

Lp debug                         CutPropag  CutEqPropag  Adjust  Overflow  Bad  BadScaling
                  'default_lp':          0            0      17         0  176           0
                   'fs_random':          0            0       0         0    0           0
     'fs_random_quick_restart':          0            0       0         0    0           0
              'lb_tree_search':          0            0       5         0  473           0
                      'max_lp':          0            0       5         0  456           0
         'objective_lb_search':          0            0      25         0  204           0
  'objective_lb_search_max_lp':          0            0      31         0  327           0
                     'probing':          0            0      53         0  212           0
              'probing_max_lp':          0            0       5         0  442           0
                'pseudo_costs':          0            2      24         0  339           0
               'quick_restart':          0            0      88         0  227           0
               'reduced_costs':          0            0      42         0  263           0

Lp pool                          Constraints  Updates  Simplif  Merged  Shortened  Split  Strenghtened  Cuts/Call
                  'default_lp':          422      303    1'171       1        431     10           470    345/541
                   'fs_random':           78        0        0       0          0      0             0        0/0
     'fs_random_quick_restart':           78        0        0       0          0      0             0        0/0
              'lb_tree_search':          833        4        0       0          0      6            73    510/828
                      'max_lp':          804        3        0       0          0      6            52    481/744
         'objective_lb_search':          394      297      362       0        151     20           233    316/509
  'objective_lb_search_max_lp':          800       47      308       3          0      5           688    480/795
                     'probing':          419       19       18       0          0      4            38    341/535
              'probing_max_lp':          775        3        0       0          0      6            52    452/732
                'pseudo_costs':          781       57      305       4          0      4           683    462/720
               'quick_restart':          433      375      757       0        299      8           442    355/670
               'reduced_costs':          829       40      265       4          0      5           584    510/767

Lp Cut            defaul  max_lp  quick_  reduce  pseudo  lb_tre  probin  object  probin  object
          CG_FF:      24      45      32      65      44      59      34      29      41      52
           CG_K:      13      13      14      23      12      15      16      12      13      14
           CG_R:      19      25      20      12      18      34      23      16      24      18
          CG_RB:      45     153      48      90      84     133      56      50     130      84
         CG_RBP:      12      18       8      22      10      25      21      12      20      14
         Clique:       -       -       -       -       4       -       -       -       -       3
             IB:      91      51      90      95      86      47      91      91      47      88
       MIR_1_FF:      14      32      16      38      42      26      14      15      34      41
        MIR_1_K:       8       4       6       8      12       4       7       7       3       6
        MIR_1_R:       6       2       8       9       9       3       7       5       2       9
       MIR_1_RB:      24      36      18      37      39      34      10      26      36      39
      MIR_1_RBP:       2       2       1       6       4       3       -       2       5       4
      MIR_1_RLT:       -       -       -       6       2       -       -       -       -       3
       MIR_2_FF:       5      10       5      16      10      10       7       5      13      13
        MIR_2_K:       3       3       2       3       6       5       3       3       6       3
        MIR_2_R:       4       -       4       4       6       1       4       4       1       6
       MIR_2_RB:      10      13       9      16      15      11       3       6      12      18
      MIR_2_RBP:       3       1       1       5       5       3       1       2       1       4
       MIR_3_FF:       5       5       2       2       2       9       5       2       6       3
        MIR_3_K:       4       1       2       1       4       3       3       -       1       1
        MIR_3_R:       4       1       -       -       2       2       5       2       1       -
       MIR_3_RB:       8       5       5       4       3       6       7       3       5       5
      MIR_3_RBP:       4       1       -       -       1       1       2       -       -       1
       MIR_4_FF:       5       2       9       1       2       3       1       3       2       -
        MIR_4_K:       2       -       7       -       -       -       -       -       -       -
        MIR_4_R:       1       -       7       2       -       -       -       -       -       1
       MIR_4_RB:       6       2       4       1       2       4       1       2       3       1
      MIR_4_RBP:       1       -       -       -       -       -       -       -       -       1
       MIR_5_FF:       1       1       3       -       -       1       2       1       -       -
        MIR_5_K:       -       -       1       -       -       -       -       -       -       -
        MIR_5_R:       -       -       2       -       -       -       -       -       -       -
       MIR_5_RB:       3       1       3       -       -       1       1       2       1       -
      MIR_5_RBP:       -       -       1       -       -       -       -       -       -       -
       MIR_6_FF:       -       -       1       -       1       1       -       -       -       -
        MIR_6_K:       -       -       -       1       -       -       -       -       -       -
        MIR_6_R:       -       -       2       -       1       -       -       -       -       -
       MIR_6_RB:       1       -       1       1       1       1       2       1       -       -
   ZERO_HALF_FF:       5      12       7      11       8      13       3       4       9      12
    ZERO_HALF_K:       -       3       1       1       -       6       1       -       2       -
    ZERO_HALF_R:       6      19       8      16      15      24       4       5      16      19
   ZERO_HALF_RB:       6      11       6      12      11      14       6       5      11      14
  ZERO_HALF_RBP:       -       9       1       2       1       8       1       1       7       3

LNS stats           Improv/Calls  Closed  Difficulty  TimeLimit
  'graph_arc_lns':           2/4    100%        0.91       0.10
  'graph_cst_lns':           0/0      0%        0.50       0.10
  'graph_dec_lns':           1/4    100%        0.91       0.10
  'graph_var_lns':           1/4    100%        0.91       0.10
      'rins/rens':           2/3    100%        0.88       0.10
    'rnd_cst_lns':           0/2    100%        0.81       0.10
    'rnd_var_lns':           0/4     75%        0.82       0.10

LS stats                   Batches  Restarts  LinMoves  GenMoves  CompoundMoves  WeightUpdates
       'fj_long_default':        0         0         0         0              0              0
       'fj_long_default':        0         0         0         0              0              0
   'fj_long_lin_default':        0         0         0         0              0              0
   'fj_long_lin_perturb':        0         0         0         0              0              0
    'fj_long_lin_random':        0         0         0         0              0              0
       'fj_long_perturb':        0         0         0         0              0              0
        'fj_long_random':        0         0         0         0              0              0
      'fj_short_default':        0         0         0         0              0              0
      'fj_short_default':        0         0         0         0              0              0
  'fj_short_lin_default':        0         0         0         0              0              0
  'fj_short_lin_default':        0         0         0         0              0              0
  'fj_short_lin_perturb':        0         0         0         0              0              0
   'fj_short_lin_random':        0         0         0         0              0              0
      'fj_short_perturb':        0         0         0         0              0              0
       'fj_short_random':        0         0         0         0              0              0
          'violation_ls':        1         0         0     8'124            118             53
          'violation_ls':        2         0     3'023     4'994             94            514
          'violation_ls':        3         0         0     2'676             42             20
          'violation_ls':        3         0     3'113         0              0            526
          'violation_ls':        3         0     3'235        27              3          2'142

Solutions (27)            Num     Rank
                'no_lp':   13   [1,27]
  'quick_restart_no_lp':    7   [5,25]
        'rins_pump_lns':    1  [18,18]
         'violation_ls':    6   [2,17]

Objective bounds                Num
                  'bool_core':   39
                 'default_lp':    1
             'initial_domain':    1
        'objective_lb_search':    1
  'objective_lb_search_no_lp':   12

Solution repositories    Added  Queried  Ignored  Synchro
  'feasible solutions':     51       71        1       39
        'lp solutions':      0        0        0        0
                'pump':     63        4

Improving bounds shared         Num
                       'core':    4
                 'default_lp':   11
                      'no_lp':  268
        'objective_lb_search':   22
  'objective_lb_search_no_lp':    9
                    'probing':    1
              'quick_restart':   21
        'quick_restart_no_lp':   91

Clauses shared                  Num
                       'core':    1
                 'default_lp':    6
                      'no_lp':   13
        'objective_lb_search':    1
  'objective_lb_search_no_lp':    1
              'quick_restart':    8
        'quick_restart_no_lp':    5

CpSolverResponse summary:
status: OPTIMAL
objective: 312
best_bound: 312
integers: 0
booleans: 0
conflicts: 0
branches: 0
propagations: 0
integer_propagations: 0
restarts: 0
lp_iterations: 0
walltime: 0.123602
usertime: 0.123602
deterministic_time: 0.221308
gap_integral: 0.654888
solution_fingerprint: 0xac923f29a5fec14c


--- Simulation Gantt  partir du modle mathmatique ---
{'big':0, 'due_date':154, 'pos_time':5, 'status':1, 'blocked':0, 'operations':["{'type':0, 'processing_time':45}", "{'type':1, 'processing_time':22}"]}
{'big':1, 'due_date':98, 'pos_time':5, 'status':0, 'blocked':2, 'operations':["{'type':1, 'processing_time':13}"]}
{'big':0, 'due_date':70, 'pos_time':5, 'status':2, 'blocked':1, 'operations':["{'type':1, 'processing_time':38}", "{'type':0, 'processing_time':37}"]}
{'big':1, 'due_date':97, 'pos_time':5, 'status':3, 'blocked':2, 'operations':["{'type':0, 'processing_time':15}", "{'type':1, 'processing_time':33}"]}
