created virtual environment CPython3.12.4.final.0-64 in 5882ms
  creator CPython3Posix(dest=/localscratch/aneumann.63393205.0/env, clear=False, no_vcs_ignore=False, global=False)
  seeder FromAppData(download=False, pip=bundle, via=copy, app_data_dir=/home/aneumann/.local/share/virtualenv)
    added seed packages: pip==25.1.1
  activators BashActivator,CShellActivator,FishActivator,NushellActivator,PowerShellActivator,PythonActivator
Looking in links: /cvmfs/soft.computecanada.ca/custom/python/wheelhouse/gentoo2023/x86-64-v3, /cvmfs/soft.computecanada.ca/custom/python/wheelhouse/gentoo2023/generic, /cvmfs/soft.computecanada.ca/custom/python/wheelhouse/generic
Requirement already satisfied: pip in /localscratch/aneumann.63393205.0/env/lib/python3.12/site-packages (25.1.1)
Looking in links: /cvmfs/soft.computecanada.ca/custom/python/wheelhouse/gentoo2023/x86-64-v3, /cvmfs/soft.computecanada.ca/custom/python/wheelhouse/gentoo2023/generic, /cvmfs/soft.computecanada.ca/custom/python/wheelhouse/generic
ERROR: protobuf-5.28.3-cp38-abi3-manylinux2014_x86_64.whl is not a supported wheel on this platform.
Looking in links: /cvmfs/soft.computecanada.ca/custom/python/wheelhouse/gentoo2023/x86-64-v3, /cvmfs/soft.computecanada.ca/custom/python/wheelhouse/gentoo2023/generic, /cvmfs/soft.computecanada.ca/custom/python/wheelhouse/generic
Processing /home/aneumann/projects/def-adhaj/aneumann/GNRS/wheels/immutabledict-4.2.0-py3-none-any.whl
Installing collected packages: immutabledict
Successfully installed immutabledict-4.2.0
Looking in links: /cvmfs/soft.computecanada.ca/custom/python/wheelhouse/gentoo2023/x86-64-v3, /cvmfs/soft.computecanada.ca/custom/python/wheelhouse/gentoo2023/generic, /cvmfs/soft.computecanada.ca/custom/python/wheelhouse/generic
Processing /cvmfs/soft.computecanada.ca/custom/python/wheelhouse/generic/ortools-9.10.4067+computecanada-cp312-cp312-linux_x86_64.whl (from -r /home/aneumann/projects/def-adhaj/aneumann/GNRS/requirements/or.txt (line 1))
Processing /cvmfs/soft.computecanada.ca/custom/python/wheelhouse/gentoo2023/x86-64-v3/matplotlib-3.10.0+computecanada-cp312-cp312-linux_x86_64.whl (from -r /home/aneumann/projects/def-adhaj/aneumann/GNRS/requirements/or.txt (line 2))
Processing /cvmfs/soft.computecanada.ca/custom/python/wheelhouse/gentoo2023/x86-64-v3/pandas-2.2.3+computecanada-cp312-cp312-linux_x86_64.whl (from -r /home/aneumann/projects/def-adhaj/aneumann/GNRS/requirements/or.txt (line 3))
Processing /cvmfs/soft.computecanada.ca/custom/python/wheelhouse/generic/absl_py-2.2.2+computecanada-py3-none-any.whl (from ortools<9.11,>=9.10->-r /home/aneumann/projects/def-adhaj/aneumann/GNRS/requirements/or.txt (line 1))
Processing /cvmfs/soft.computecanada.ca/custom/python/wheelhouse/gentoo2023/generic/numpy-2.2.2+computecanada-cp312-cp312-linux_x86_64.whl (from ortools<9.11,>=9.10->-r /home/aneumann/projects/def-adhaj/aneumann/GNRS/requirements/or.txt (line 1))
Processing /cvmfs/soft.computecanada.ca/custom/python/wheelhouse/gentoo2023/x86-64-v3/protobuf-6.30.2+computecanada-cp312-cp312-linux_x86_64.whl (from ortools<9.11,>=9.10->-r /home/aneumann/projects/def-adhaj/aneumann/GNRS/requirements/or.txt (line 1))
Requirement already satisfied: immutabledict>=3.0.0 in /localscratch/aneumann.63393205.0/env/lib/python3.12/site-packages (from ortools<9.11,>=9.10->-r /home/aneumann/projects/def-adhaj/aneumann/GNRS/requirements/or.txt (line 1)) (4.2.0)
Processing /cvmfs/soft.computecanada.ca/custom/python/wheelhouse/gentoo2023/generic/contourpy-1.3.1+computecanada-cp312-cp312-linux_x86_64.whl (from matplotlib->-r /home/aneumann/projects/def-adhaj/aneumann/GNRS/requirements/or.txt (line 2))
Processing /cvmfs/soft.computecanada.ca/custom/python/wheelhouse/generic/cycler-0.12.1+computecanada-py3-none-any.whl (from matplotlib->-r /home/aneumann/projects/def-adhaj/aneumann/GNRS/requirements/or.txt (line 2))
Processing /cvmfs/soft.computecanada.ca/custom/python/wheelhouse/generic/fonttools-4.58.2+computecanada-cp312-cp312-linux_x86_64.whl (from matplotlib->-r /home/aneumann/projects/def-adhaj/aneumann/GNRS/requirements/or.txt (line 2))
Processing /cvmfs/soft.computecanada.ca/custom/python/wheelhouse/gentoo2023/x86-64-v3/kiwisolver-1.4.8+computecanada-cp312-cp312-linux_x86_64.whl (from matplotlib->-r /home/aneumann/projects/def-adhaj/aneumann/GNRS/requirements/or.txt (line 2))
Processing /cvmfs/soft.computecanada.ca/custom/python/wheelhouse/generic/packaging-25.0+computecanada-py3-none-any.whl (from matplotlib->-r /home/aneumann/projects/def-adhaj/aneumann/GNRS/requirements/or.txt (line 2))
Processing /cvmfs/soft.computecanada.ca/custom/python/wheelhouse/gentoo2023/x86-64-v3/pillow-11.1.0+computecanada-cp312-cp312-linux_x86_64.whl (from matplotlib->-r /home/aneumann/projects/def-adhaj/aneumann/GNRS/requirements/or.txt (line 2))
Processing /cvmfs/soft.computecanada.ca/custom/python/wheelhouse/generic/pyparsing-3.2.1+computecanada-py3-none-any.whl (from matplotlib->-r /home/aneumann/projects/def-adhaj/aneumann/GNRS/requirements/or.txt (line 2))
Processing /cvmfs/soft.computecanada.ca/custom/python/wheelhouse/generic/python_dateutil-2.9.0.post0+computecanada-py2.py3-none-any.whl (from matplotlib->-r /home/aneumann/projects/def-adhaj/aneumann/GNRS/requirements/or.txt (line 2))
Processing /cvmfs/soft.computecanada.ca/custom/python/wheelhouse/generic/pytz-2025.2+computecanada-py2.py3-none-any.whl (from pandas->-r /home/aneumann/projects/def-adhaj/aneumann/GNRS/requirements/or.txt (line 3))
Processing /cvmfs/soft.computecanada.ca/custom/python/wheelhouse/generic/tzdata-2025.2+computecanada-py2.py3-none-any.whl (from pandas->-r /home/aneumann/projects/def-adhaj/aneumann/GNRS/requirements/or.txt (line 3))
Processing /cvmfs/soft.computecanada.ca/custom/python/wheelhouse/generic/six-1.17.0+computecanada-py2.py3-none-any.whl (from python-dateutil>=2.7->matplotlib->-r /home/aneumann/projects/def-adhaj/aneumann/GNRS/requirements/or.txt (line 2))
Installing collected packages: pytz, tzdata, six, pyparsing, protobuf, pillow, packaging, numpy, kiwisolver, fonttools, cycler, absl-py, python-dateutil, contourpy, pandas, matplotlib, ortools

Successfully installed absl-py-2.2.2+computecanada contourpy-1.3.1+computecanada cycler-0.12.1+computecanada fonttools-4.58.2+computecanada kiwisolver-1.4.8+computecanada matplotlib-3.10.0+computecanada numpy-2.2.2+computecanada ortools-9.10.4067+computecanada packaging-25.0+computecanada pandas-2.2.3+computecanada pillow-11.1.0+computecanada protobuf-6.30.2+computecanada pyparsing-3.2.1+computecanada python-dateutil-2.9.0.post0+computecanada pytz-2025.2+computecanada six-1.17.0+computecanada tzdata-2025.2+computecanada

Starting CP-SAT solver v9.10.4067
Parameters: max_time_in_seconds: 3600 max_memory_in_mb: 12000 log_search_progress: true enumerate_all_solutions: false absolute_gap_limit: 0 relative_gap_limit: 0
Setting number of workers to 48

Initial optimization model '': (model_fingerprint: 0xe3a5d28cd1567a55)
#Variables: 294 (#ints: 8 in objective)
  - 207 Booleans in [0,1]
  - 87 in [0,539]
#kLinear1: 40
#kLinear2: 491
#kLinear3: 155
#kLinearN: 2'357 (#terms: 33'454)

Starting presolve at 0.00s
  2.01e-03s  0.00e+00d  [DetectDominanceRelations] 
  4.27e-02s  0.00e+00d  [PresolveToFixPoint] #num_loops=6 #num_dual_strengthening=3 
  2.89e-05s  0.00e+00d  [ExtractEncodingFromLinear] #potential_supersets=6 
[Symmetry] Graph for symmetry has 3'116 nodes and 28'317 arcs.
[Symmetry] Symmetry computation done. time: 0.00257894 dtime: 0.00309579
[Symmetry] #generators: 1, average support size: 26
[Symmetry] The model contains 295 duplicate constraints !
[Symmetry] 13 orbits with sizes: 2,2,2,2,2,2,2,2,2,2,...
[Symmetry] Num fixable by intersecting at_most_one with orbits: 1 largest_orbit: 2
  1.15e-02s  1.55e-03d  [Probe] #probed=310 #fixed_bools=4 #new_bounds=17 #equiv=1 
  3.68e-05s  0.00e+00d  [MaxClique] 
  1.99e-03s  0.00e+00d  [DetectDominanceRelations] 
  2.32e-02s  0.00e+00d  [PresolveToFixPoint] #num_loops=4 #num_dual_strengthening=3 
  7.17e-03s  0.00e+00d  [ProcessAtMostOneAndLinear] 
  2.87e-03s  0.00e+00d  [DetectDuplicateConstraints] #duplicates=342 #without_enforcements=47 
  2.10e-03s  1.05e-04d  [DetectDominatedLinearConstraints] #relevant_constraints=2'003 #num_inclusions=735 #num_redundant=1 
  3.70e-04s  0.00e+00d  [DetectDifferentVariables] #different=32 
  6.69e-04s  3.99e-05d  [ProcessSetPPC] #relevant_constraints=1'733 
  2.39e-05s  0.00e+00d  [FindAlmostIdenticalLinearConstraints] 
  3.89e-04s  3.57e-04d  [FindBigAtMostOneAndLinearOverlap] 
  8.91e-03s  2.60e-03d  [FindBigVerticalLinearOverlap] #blocks=60 #saved_nz=5'543 
  3.31e-04s  8.59e-05d  [FindBigHorizontalLinearOverlap] #linears=1'615 
  1.40e-05s  0.00e+00d  [MergeClauses] 
  2.04e-03s  0.00e+00d  [DetectDominanceRelations] 
  2.49e-02s  0.00e+00d  [PresolveToFixPoint] #num_loops=2 #num_dual_strengthening=1 
  2.05e-03s  0.00e+00d  [DetectDominanceRelations] 
  1.41e-02s  0.00e+00d  [PresolveToFixPoint] #num_loops=1 #num_dual_strengthening=1 
[Symmetry] Graph for symmetry has 2'943 nodes and 21'687 arcs.
[Symmetry] Symmetry computation done. time: 0.000882572 dtime: 0.0012737
  1.10e-02s  1.47e-03d  [Probe] #probed=302 #new_bounds=47 
  1.41e-05s  0.00e+00d  [MaxClique] 
  2.04e-03s  0.00e+00d  [DetectDominanceRelations] 
  2.37e-02s  0.00e+00d  [PresolveToFixPoint] #num_loops=2 #num_dual_strengthening=1 
  6.58e-03s  0.00e+00d  [ProcessAtMostOneAndLinear] 
  2.43e-03s  0.00e+00d  [DetectDuplicateConstraints] #without_enforcements=52 
  1.44e-03s  6.61e-05d  [DetectDominatedLinearConstraints] #relevant_constraints=1'895 #num_inclusions=224 
  3.72e-04s  0.00e+00d  [DetectDifferentVariables] #different=41 
  5.86e-04s  2.68e-05d  [ProcessSetPPC] #relevant_constraints=1'528 
  4.03e-05s  1.65e-07d  [FindAlmostIdenticalLinearConstraints] #num_tested_pairs=11 
  2.24e-04s  1.66e-04d  [FindBigAtMostOneAndLinearOverlap] 
  4.80e-03s  1.61e-03d  [FindBigVerticalLinearOverlap] #blocks=45 #saved_nz=3'059 
  2.70e-04s  6.28e-05d  [FindBigHorizontalLinearOverlap] #linears=1'341 
  1.38e-05s  0.00e+00d  [MergeClauses] 
  1.76e-03s  0.00e+00d  [DetectDominanceRelations] 
  2.18e-02s  0.00e+00d  [PresolveToFixPoint] #num_loops=2 #num_dual_strengthening=1 
  1.76e-03s  0.00e+00d  [DetectDominanceRelations] 
  1.48e-02s  0.00e+00d  [PresolveToFixPoint] #num_loops=1 #num_dual_strengthening=1 
[Symmetry] Graph for symmetry has 3'060 nodes and 18'655 arcs.
[Symmetry] Symmetry computation done. time: 0.00166625 dtime: 0.00121281
  1.06e-02s  1.36e-03d  [Probe] #probed=302 #new_bounds=32 
  1.41e-05s  0.00e+00d  [MaxClique] 
  1.77e-03s  0.00e+00d  [DetectDominanceRelations] 
  2.02e-02s  0.00e+00d  [PresolveToFixPoint] #num_loops=2 #num_dual_strengthening=1 
  6.03e-03s  0.00e+00d  [ProcessAtMostOneAndLinear] 
  2.34e-03s  0.00e+00d  [DetectDuplicateConstraints] #without_enforcements=56 
  1.14e-03s  5.09e-05d  [DetectDominatedLinearConstraints] #relevant_constraints=1'832 #num_inclusions=35 
  3.67e-04s  0.00e+00d  [DetectDifferentVariables] #different=44 #cliques=1 #size=3 
  4.85e-04s  1.95e-05d  [ProcessSetPPC] #relevant_constraints=1'319 
  5.41e-05s  5.40e-07d  [FindAlmostIdenticalLinearConstraints] #num_tested_pairs=26 
  1.81e-04s  1.18e-04d  [FindBigAtMostOneAndLinearOverlap] 
  3.61e-03s  1.19e-03d  [FindBigVerticalLinearOverlap] #blocks=32 #saved_nz=2'212 
  2.29e-04s  4.66e-05d  [FindBigHorizontalLinearOverlap] #linears=1'126 
  1.40e-05s  0.00e+00d  [MergeClauses] 
  1.58e-03s  0.00e+00d  [DetectDominanceRelations] 
  1.90e-02s  0.00e+00d  [PresolveToFixPoint] #num_loops=2 #num_dual_strengthening=1 
  1.10e-04s  0.00e+00d  [ExpandObjective] #entries=688 #tight_variables=198 #tight_constraints=117 

Presolve summary:
  - 62 affine relations were detected.
  - rule 'TODO dual: only one blocking constraint?' was applied 687 times.
  - rule 'TODO dual: only one unspecified blocking constraint?' was applied 104 times.
  - rule 'TODO duplicate: identical constraint with different enforcements' was applied 155 times.
  - rule 'TODO no_overlap: with task always last' was applied 1 time.
  - rule 'affine: new relation' was applied 62 times.
  - rule 'all_diff: inferred from x != y constraints' was applied 1 time.
  - rule 'at_most_one: removed literals' was applied 5 times.
  - rule 'at_most_one: size one' was applied 5 times.
  - rule 'deductions: 267 stored' was applied 1 time.
  - rule 'dual: fix variable' was applied 21 times.
  - rule 'dual: reduced domain' was applied 56 times.
  - rule 'duplicate: merged rhs of linear constraint' was applied 49 times.
  - rule 'duplicate: removed constraint' was applied 342 times.
  - rule 'enforcement: false literal' was applied 19 times.
  - rule 'enforcement: true literal' was applied 19 times.
  - rule 'exactly_one: x and not(x)' was applied 1 time.
  - rule 'incompatible linear: add implication' was applied 30 times.
  - rule 'linear inclusion: redundant containing constraint' was applied 1 time.
  - rule 'linear matrix: common vertical rectangle' was applied 137 times.
  - rule 'linear: always true' was applied 405 times.
  - rule 'linear: doubleton free' was applied 11 times.
  - rule 'linear: empty' was applied 24 times.
  - rule 'linear: extracted enforcement literal' was applied 3'471 times.
  - rule 'linear: fixed or dup variables' was applied 2'366 times.
  - rule 'linear: positive equal one' was applied 6 times.
  - rule 'linear: reduced variable domains' was applied 241 times.
  - rule 'linear: remapped using affine relations' was applied 2'330 times.
  - rule 'linear: simplified rhs' was applied 9'394 times.
  - rule 'linear: variable substitution 1' was applied 11 times.
  - rule 'linear: variable substitution 2' was applied 5 times.
  - rule 'presolve: 78 unused variables removed.' was applied 1 time.
  - rule 'presolve: iteration' was applied 3 times.
  - rule 'probing: reduced enforced constraint to implication.' was applied 5 times.
  - rule 'symmetry: fixed to false in general orbit' was applied 1 time.

Presolved optimization model '': (model_fingerprint: 0xc689531afa2f648c)
#Variables: 275 (#ints: 8 in objective)
  - 78 Booleans in [0,1]
  - 160 different domains in [-4853,6367] with a largest complexity of 13.
#kAllDiff: 1
#kExactlyOne: 5 (#literals: 15)
#kLinear2: 526 (#enforced: 459 #multi: 338)
#kLinear3: 188 (#enforced: 110)
#kLinearN: 1'587 (#enforced: 1'377) (#terms: 11'161)

Preloading model.
#Bound   0.31s best:inf   next:[112,3565] initial_domain
#Model   0.31s var:275/275 constraints:2307/2307

Starting search at 0.32s with 48 workers.
16 full problem subsolvers: [core, default_lp, lb_tree_search, max_lp, no_lp, objective_lb_search, objective_lb_search_max_lp, objective_lb_search_no_lp, objective_shaving_search_max_lp, objective_shaving_search_no_lp, probing, probing_max_lp, pseudo_costs, quick_restart, quick_restart_no_lp, reduced_costs]
30 first solution subsolvers: [fj_long_default(2), fj_long_lin_default, fj_long_lin_perturb, fj_long_lin_random, fj_long_perturb, fj_long_random, fj_short_default(2), fj_short_lin_default(2), fj_short_lin_perturb, fj_short_lin_random, fj_short_perturb, fj_short_random, fs_random(4), fs_random_no_lp(4), fs_random_quick_restart(4), fs_random_quick_restart_no_lp(3)]
13 incomplete subsolvers: [feasibility_pump, graph_arc_lns, graph_cst_lns, graph_dec_lns, graph_var_lns, rins/rens, rnd_cst_lns, rnd_var_lns, violation_ls(5)]
3 helper subsolvers: [neighborhood_helper, synchronization_agent, update_gap_integral]
#Bound   0.36s best:inf   next:[137,3565] objective_lb_search_no_lp
#1       0.36s best:1501  next:[137,1500] no_lp (fixed_bools=0/104)
#2       0.38s best:1500  next:[137,1499] violation_ls(batch:1 #solutions_imported:1 #lin_moves:498 #lin_evals:1'601 #weight_updates:134)
#3       0.38s best:1394  next:[137,1393] no_lp (fixed_bools=0/117)
#4       0.38s best:1276  next:[137,1275] no_lp (fixed_bools=0/127)
#Bound   0.38s best:1276  next:[197,1275] objective_lb_search_no_lp
#Bound   0.39s best:1276  next:[205,1275] objective_lb_search_no_lp
#5       0.39s best:1259  next:[205,1258] no_lp (fixed_bools=0/148)
#6       0.41s best:1228  next:[205,1227] no_lp (fixed_bools=0/165)
#7       0.43s best:1227  next:[205,1226] quick_restart_no_lp (fixed_bools=0/117)
#8       0.44s best:1221  next:[205,1220] quick_restart_no_lp (fixed_bools=0/139)
#9       0.46s best:1208  next:[205,1207] no_lp (fixed_bools=0/182)
#10      0.47s best:1133  next:[205,1132] no_lp (fixed_bools=0/190)
#11      0.49s best:1115  next:[205,1114] no_lp (fixed_bools=0/198)
#Bound   0.51s best:1115  next:[217,1114] objective_lb_search_no_lp
#12      0.52s best:1091  next:[217,1090] no_lp (fixed_bools=0/208)
#Bound   0.53s best:1091  next:[219,1090] objective_lb_search_no_lp
#Bound   0.54s best:1091  next:[221,1090] objective_lb_search_no_lp
#Bound   0.55s best:1091  next:[223,1090] objective_lb_search_no_lp
#13      0.56s best:1056  next:[223,1055] rnd_var_lns (d=0.97 s=136 t=0.10 p=1.00 stall=7 h=auto_l0)
#Bound   0.56s best:1056  next:[227,1055] objective_lb_search_no_lp
#14      0.57s best:1055  next:[227,1054] no_lp (fixed_bools=0/246)
#Bound   0.59s best:1055  next:[265,1054] objective_lb_search_no_lp
#15      0.64s best:1039  next:[265,1038] no_lp (fixed_bools=0/258)
#16      0.76s best:1031  next:[265,1030] no_lp (fixed_bools=0/283)
#17      0.76s best:1030  next:[265,1029] no_lp (fixed_bools=0/283)
#18      0.77s best:1028  next:[265,1027] violation_ls(batch:8 #solutions_imported:8 #lin_moves:20'391 #lin_evals:138'882 #gen_moves:21'400 #gen_evals:1'760 #comp_moves:1'899 #backtracks:9'740 #weight_updates:10'458)
#19      0.77s best:1027  next:[265,1026] violation_ls(batch:9 #solutions_imported:9 #lin_moves:20'672 #lin_evals:139'864 #gen_moves:21'400 #gen_evals:1'760 #comp_moves:1'899 #backtracks:9'740 #weight_updates:10'544)
#20      0.77s best:1026  next:[265,1025] violation_ls(batch:8 #solutions_imported:6 #lin_moves:24'817 #lin_evals:152'609 #gen_moves:22'330 #gen_evals:1'012 #comp_moves:1'457 #backtracks:10'431 #weight_updates:15'602)
#21      0.78s best:1025  next:[265,1024] violation_ls(batch:11 #solutions_imported:11 #lin_moves:20'866 #lin_evals:140'571 #gen_moves:21'400 #gen_evals:1'760 #comp_moves:1'899 #backtracks:9'740 #weight_updates:10'612)
#22      0.78s best:1024  next:[265,1023] violation_ls(batch:12 #solutions_imported:12 #lin_moves:20'875 #lin_evals:140'614 #gen_moves:21'400 #gen_evals:1'760 #comp_moves:1'899 #backtracks:9'740 #weight_updates:10'617)
#23      0.78s best:1023  next:[265,1022] no_lp (fixed_bools=0/293)
#24      0.78s best:1021  next:[265,1020] violation_ls(batch:14 #solutions_imported:14 #lin_moves:20'946 #lin_evals:140'916 #gen_moves:21'400 #gen_evals:1'760 #comp_moves:1'899 #backtracks:9'740 #weight_updates:10'647)
#25      0.79s best:1018  next:[265,1017] no_lp (fixed_bools=0/303)
#26      0.80s best:1017  next:[265,1016] no_lp (fixed_bools=0/303)
#27      0.80s best:1015  next:[265,1014] violation_ls(batch:16 #solutions_imported:16 #lin_moves:20'946 #lin_evals:146'615 #gen_moves:23'646 #gen_evals:1'946 #comp_moves:2'123 #backtracks:10'751 #weight_updates:10'679)
#Bound   0.81s best:1015  next:[267,1014] objective_lb_search_no_lp
#28      0.82s best:1014  next:[267,1013] no_lp (fixed_bools=0/303)
#Bound   0.83s best:1014  next:[270,1013] objective_lb_search_no_lp
#Bound   0.95s best:1014  next:[276,1013] objective_lb_search_no_lp
#Bound   0.96s best:1014  next:[282,1013] objective_lb_search_no_lp
#29      1.01s best:939   next:[282,938]  rnd_cst_lns (d=0.98 s=177 t=0.10 p=1.00 stall=8 h=auto_l0)
#30      1.02s best:938   next:[282,937]  violation_ls(batch:11 #solutions_imported:9 #lin_moves:40'031 #lin_evals:221'917 #gen_moves:22'442 #gen_evals:962 #comp_moves:1'427 #backtracks:10'502 #weight_updates:20'307)
#31      1.03s best:937   next:[282,936]  violation_ls(batch:12 #solutions_imported:10 #lin_moves:40'035 #lin_evals:221'939 #gen_moves:22'442 #gen_evals:962 #comp_moves:1'427 #backtracks:10'502 #weight_updates:20'309)
#32      1.03s best:936   next:[282,935]  violation_ls(batch:9 #solutions_imported:7 #lin_moves:24'533 #lin_evals:189'204 #gen_moves:40'115 #gen_evals:2'997 #comp_moves:1'993 #backtracks:19'052 #weight_updates:5'990)
#33      1.04s best:935   next:[282,934]  violation_ls(batch:10 #solutions_imported:8 #lin_moves:24'533 #lin_evals:189'250 #gen_moves:40'139 #gen_evals:2'997 #comp_moves:1'995 #backtracks:19'063 #weight_updates:5'990)
#34      1.04s best:934   next:[282,933]  violation_ls(batch:11 #solutions_imported:9 #lin_moves:24'584 #lin_evals:189'514 #gen_moves:40'139 #gen_evals:2'997 #comp_moves:1'995 #backtracks:19'063 #weight_updates:6'035)
#35      1.05s best:933   next:[282,932]  violation_ls(batch:11 #solutions_imported:9 #lin_moves:29'017 #lin_evals:194'841 #gen_moves:40'254 #gen_evals:3'015 #comp_moves:2'707 #backtracks:18'766 #weight_updates:1'400)
#Bound   1.05s best:933   next:[284,932]  objective_lb_search_no_lp
#36      1.06s best:932   next:[284,931]  violation_ls(batch:12 #solutions_imported:10 #lin_moves:29'017 #lin_evals:194'989 #gen_moves:40'318 #gen_evals:3'015 #comp_moves:2'711 #backtracks:18'796 #weight_updates:1'400)
#37      1.06s best:931   next:[284,930]  violation_ls(batch:13 #solutions_imported:11 #lin_moves:40'037 #lin_evals:221'953 #gen_moves:22'442 #gen_evals:962 #comp_moves:1'427 #backtracks:10'502 #weight_updates:20'310)
#38      1.07s best:930   next:[284,929]  violation_ls(batch:13 #solutions_imported:11 #lin_moves:25'219 #lin_evals:163'827 #gen_moves:26'297 #gen_evals:1'489 #comp_moves:1'648 #backtracks:12'319 #weight_updates:15'900)
#Bound   1.07s best:930   next:[288,929]  objective_lb_search
#39      1.08s best:929   next:[288,928]  violation_ls(batch:13 #solutions_imported:11 #lin_moves:29'017 #lin_evals:194'994 #gen_moves:40'321 #gen_evals:3'015 #comp_moves:2'714 #backtracks:18'796 #weight_updates:1'400)
#40      1.08s best:928   next:[288,927]  violation_ls(batch:14 #solutions_imported:12 #lin_moves:40'037 #lin_evals:222'010 #gen_moves:22'470 #gen_evals:962 #comp_moves:1'431 #backtracks:10'514 #weight_updates:20'310)
#41      1.09s best:927   next:[288,926]  violation_ls(batch:14 #solutions_imported:12 #lin_moves:29'033 #lin_evals:195'085 #gen_moves:40'321 #gen_evals:3'015 #comp_moves:2'714 #backtracks:18'796 #weight_updates:1'415)
#42      1.09s best:926   next:[288,925]  violation_ls(batch:15 #solutions_imported:13 #lin_moves:40'037 #lin_evals:222'247 #gen_moves:22'566 #gen_evals:962 #comp_moves:1'435 #backtracks:10'560 #weight_updates:20'310)
#43      1.09s best:925   next:[288,924]  violation_ls(batch:15 #solutions_imported:13 #lin_moves:29'065 #lin_evals:195'207 #gen_moves:40'321 #gen_evals:3'015 #comp_moves:2'714 #backtracks:18'796 #weight_updates:1'431)
#44      1.09s best:924   next:[288,923]  violation_ls(batch:16 #solutions_imported:14 #lin_moves:40'037 #lin_evals:222'279 #gen_moves:22'583 #gen_evals:962 #comp_moves:1'440 #backtracks:10'566 #weight_updates:20'310)
#45      1.09s best:923   next:[288,922]  violation_ls(batch:15 #solutions_imported:13 #lin_moves:24'620 #lin_evals:190'278 #gen_moves:40'420 #gen_evals:3'002 #comp_moves:2'012 #backtracks:19'195 #weight_updates:6'055)
#46      1.09s best:922   next:[288,921]  violation_ls(batch:15 #solutions_imported:13 #lin_moves:25'306 #lin_evals:164'173 #gen_moves:26'297 #gen_evals:1'489 #comp_moves:1'648 #backtracks:12'319 #weight_updates:15'943)
#47      1.09s best:921   next:[288,920]  violation_ls(batch:16 #solutions_imported:14 #lin_moves:29'077 #lin_evals:195'260 #gen_moves:40'321 #gen_evals:3'015 #comp_moves:2'714 #backtracks:18'796 #weight_updates:1'437)
#48      1.09s best:920   next:[288,919]  violation_ls(batch:16 #solutions_imported:14 #lin_moves:24'664 #lin_evals:190'449 #gen_moves:40'420 #gen_evals:3'002 #comp_moves:2'012 #backtracks:19'195 #weight_updates:6'077)
#49      1.10s best:919   next:[288,918]  violation_ls(batch:16 #solutions_imported:14 #lin_moves:25'306 #lin_evals:164'178 #gen_moves:26'299 #gen_evals:1'489 #comp_moves:1'650 #backtracks:12'319 #weight_updates:15'943)
#50      1.11s best:918   next:[288,917]  violation_ls(batch:17 #solutions_imported:17 #lin_moves:20'946 #lin_evals:146'674 #gen_moves:23'673 #gen_evals:1'946 #comp_moves:2'126 #backtracks:10'763 #weight_updates:10'679)
#51      1.12s best:917   next:[288,916]  violation_ls(batch:17 #solutions_imported:15 #lin_moves:29'119 #lin_evals:195'421 #gen_moves:40'321 #gen_evals:3'015 #comp_moves:2'714 #backtracks:18'796 #weight_updates:1'458)
#52      1.13s best:916   next:[288,915]  violation_ls(batch:17 #solutions_imported:15 #lin_moves:24'664 #lin_evals:190'488 #gen_moves:40'438 #gen_evals:3'002 #comp_moves:2'014 #backtracks:19'203 #weight_updates:6'077)
#53      1.14s best:915   next:[288,914]  violation_ls(batch:17 #solutions_imported:15 #lin_moves:25'338 #lin_evals:164'296 #gen_moves:26'299 #gen_evals:1'489 #comp_moves:1'650 #backtracks:12'319 #weight_updates:15'959)
#54      1.14s best:914   next:[288,913]  violation_ls(batch:17 #solutions_imported:15 #lin_moves:40'037 #lin_evals:223'366 #gen_moves:23'082 #gen_evals:980 #comp_moves:1'455 #backtracks:10'808 #weight_updates:20'315)
#55      1.15s best:913   next:[288,912]  violation_ls(batch:18 #solutions_imported:16 #lin_moves:40'037 #lin_evals:223'437 #gen_moves:23'114 #gen_evals:980 #comp_moves:1'457 #backtracks:10'823 #weight_updates:20'315)
#56      1.15s best:912   next:[288,911]  violation_ls(batch:18 #solutions_imported:18 #lin_moves:20'947 #lin_evals:146'682 #gen_moves:23'673 #gen_evals:1'946 #comp_moves:2'126 #backtracks:10'763 #weight_updates:10'679)
#57      1.15s best:911   next:[288,910]  violation_ls(batch:18 #solutions_imported:16 #lin_moves:29'119 #lin_evals:195'447 #gen_moves:40'335 #gen_evals:3'015 #comp_moves:2'716 #backtracks:18'802 #weight_updates:1'458)
#58      1.15s best:910   next:[288,909]  violation_ls(batch:18 #solutions_imported:16 #lin_moves:24'664 #lin_evals:190'491 #gen_moves:40'439 #gen_evals:3'002 #comp_moves:2'015 #backtracks:19'203 #weight_updates:6'077)
#59      1.15s best:909   next:[288,908]  violation_ls(batch:18 #solutions_imported:16 #lin_moves:25'340 #lin_evals:164'312 #gen_moves:26'299 #gen_evals:1'489 #comp_moves:1'650 #backtracks:12'319 #weight_updates:15'960)
#60      1.17s best:900   next:[288,899]  quick_restart_no_lp (fixed_bools=0/285)
#Bound   1.42s best:900   next:[289,899]  objective_lb_search
#Bound   1.44s best:900   next:[297,899]  objective_lb_search_no_lp
#61      1.60s best:845   next:[297,844]  graph_dec_lns (d=0.99 s=274 t=0.10 p=1.00 stall=0 h=auto_l0)
#Bound   1.64s best:845   next:[298,844]  objective_lb_search_no_lp
#Bound   1.91s best:845   next:[308,844]  objective_lb_search_no_lp
#Bound   1.96s best:845   next:[310,844]  objective_lb_search_no_lp
#Bound   2.00s best:845   next:[320,844]  objective_lb_search_no_lp
#62      2.33s best:834   next:[320,833]  rens_lp_lns (d=0.96 s=266 t=0.10 p=1.00 stall=6 h=auto_l0)
#Bound   2.37s best:834   next:[352,833]  objective_lb_search_no_lp
#63      2.52s best:828   next:[354,827]  rnd_cst_lns (d=0.99 s=283 t=0.10 p=1.00 stall=0 h=auto_l0)
#64      2.58s best:826   next:[358,825]  violation_ls(batch:23 #solutions_imported:19 #lin_moves:40'037 #lin_evals:315'465 #gen_moves:64'207 #gen_evals:3'299 #comp_moves:2'968 #backtracks:30'599 #weight_updates:20'661)
#65      2.58s best:824   next:[358,823]  violation_ls(batch:23 #solutions_imported:21 #lin_moves:50'239 #lin_evals:293'343 #gen_moves:31'927 #gen_evals:2'602 #comp_moves:2'526 #backtracks:14'687 #weight_updates:11'501)
#66      2.58s best:822   next:[358,821]  violation_ls(batch:23 #solutions_imported:19 #lin_moves:38'708 #lin_evals:290'534 #gen_moves:57'452 #gen_evals:5'663 #comp_moves:4'727 #backtracks:26'354 #weight_updates:1'959)
#67      2.58s best:820   next:[358,819]  violation_ls(batch:23 #solutions_imported:19 #lin_moves:39'529 #lin_evals:279'203 #gen_moves:48'958 #gen_evals:3'735 #comp_moves:2'423 #backtracks:23'254 #weight_updates:21'327)
#68      2.77s best:818   next:[362,817]  violation_ls(batch:23 #solutions_imported:19 #lin_moves:40'198 #lin_evals:252'764 #gen_moves:34'533 #gen_evals:2'268 #comp_moves:2'588 #backtracks:15'962 #weight_updates:31'184)
#69      2.78s best:816   next:[362,815]  violation_ls(batch:24 #solutions_imported:20 #lin_moves:40'037 #lin_evals:315'476 #gen_moves:64'214 #gen_evals:3'301 #comp_moves:2'969 #backtracks:30'602 #weight_updates:20'661)
#Bound   2.79s best:816   next:[372,815]  objective_lb_search_no_lp [skipped_logs=3]
#70      3.04s best:799   next:[372,798]  rins_lp_lns (d=0.98 s=310 t=0.10 p=1.00 stall=9 h=auto_l0)
#71      3.50s best:778   next:[372,777]  rnd_var_lns (d=0.99 s=301 t=0.10 p=0.88 stall=0 h=auto_l0)
#Bound   3.90s best:778   next:[390,777]  objective_lb_search_no_lp [skipped_logs=4]
#Bound   4.94s best:778   next:[418,777]  objective_lb_search_no_lp [skipped_logs=4]
#72      5.63s best:777   next:[419,776]  rnd_var_lns (d=0.99 s=420 t=0.10 p=0.76 stall=0 h=auto_l0)
#73      5.63s best:775   next:[419,774]  violation_ls(batch:38 #solutions_imported:23 #lin_moves:38'708 #lin_evals:559'970 #gen_moves:135'528 #gen_evals:15'442 #comp_moves:14'442 #backtracks:60'503 #weight_updates:2'231)
#74      5.63s best:773   next:[419,772]  violation_ls(batch:38 #solutions_imported:23 #lin_moves:93'902 #lin_evals:593'921 #gen_moves:79'419 #gen_evals:5'346 #comp_moves:4'374 #backtracks:37'504 #weight_updates:77'209)
#75      5.63s best:771   next:[419,770]  violation_ls(batch:38 #solutions_imported:23 #lin_moves:172'478 #lin_evals:807'966 #gen_moves:34'533 #gen_evals:2'268 #comp_moves:2'588 #backtracks:15'962 #weight_updates:38'905)
#76      5.76s best:769   next:[423,768]  violation_ls(batch:39 #solutions_imported:24 #lin_moves:177'047 #lin_evals:889'877 #gen_moves:64'239 #gen_evals:3'303 #comp_moves:2'970 #backtracks:30'614 #weight_updates:23'652)
#77      5.77s best:767   next:[423,766]  violation_ls(batch:39 #solutions_imported:25 #lin_moves:50'240 #lin_evals:568'041 #gen_moves:111'733 #gen_evals:16'011 #comp_moves:10'633 #backtracks:50'500 #weight_updates:11'804)
#78      5.77s best:765   next:[423,764]  violation_ls(batch:39 #solutions_imported:24 #lin_moves:38'709 #lin_evals:559'978 #gen_moves:135'528 #gen_evals:15'442 #comp_moves:14'442 #backtracks:60'503 #weight_updates:2'231)
#79      5.77s best:763   next:[423,762]  violation_ls(batch:39 #solutions_imported:24 #lin_moves:172'478 #lin_evals:808'009 #gen_moves:34'552 #gen_evals:2'268 #comp_moves:2'589 #backtracks:15'971 #weight_updates:38'905)
#Bound   5.69s best:771   next:[423,770]  objective_lb_search_no_lp [skipped_logs=1]
#Bound   6.15s best:763   next:[430,762]  objective_lb_search_no_lp [skipped_logs=0]
#Bound   8.29s best:763   next:[436,762]  objective_lb_search_no_lp
#Bound   8.54s best:763   next:[448,762]  objective_lb_search_no_lp [skipped_logs=0]
#Bound   9.66s best:763   next:[451,762]  objective_lb_search_no_lp [skipped_logs=0]
#Bound  10.27s best:763   next:[453,762]  objective_lb_search_no_lp [skipped_logs=1]
#Bound  12.00s best:763   next:[456,762]  objective_lb_search_no_lp [skipped_logs=1]
#Bound  12.59s best:763   next:[458,762]  objective_lb_search_no_lp [skipped_logs=0]
#Bound  13.16s best:763   next:[461,762]  objective_lb_search_no_lp [skipped_logs=0]
#Bound  14.01s best:763   next:[462,762]  objective_lb_search_no_lp [skipped_logs=0]
#Bound  19.39s best:763   next:[463,762]  objective_shaving_search_no_lp (vars=299 csts=2258)
#Bound  20.46s best:763   next:[466,762]  objective_lb_search_no_lp
#Bound  20.85s best:763   next:[468,762]  objective_lb_search_no_lp
#Bound  21.26s best:763   next:[469,762]  objective_lb_search_no_lp
#Bound  21.47s best:763   next:[470,762]  objective_lb_search_no_lp
#Bound  22.38s best:763   next:[474,762]  objective_lb_search_no_lp
#Bound  22.87s best:763   next:[480,762]  objective_lb_search_no_lp
#Bound  23.62s best:763   next:[481,762]  objective_lb_search_no_lp
#Bound  24.56s best:763   next:[483,762]  objective_lb_search_no_lp
#Bound  25.30s best:763   next:[485,762]  objective_lb_search_no_lp
#Bound  26.27s best:763   next:[487,762]  objective_lb_search_no_lp
#Bound  28.26s best:763   next:[489,762]  objective_lb_search_no_lp
#Bound  28.89s best:763   next:[490,762]  objective_lb_search_no_lp
#Bound  29.71s best:763   next:[492,762]  objective_lb_search_no_lp
#Bound  33.55s best:763   next:[502,762]  objective_lb_search_no_lp
#Bound  36.23s best:763   next:[503,762]  objective_lb_search_no_lp
#Bound  40.17s best:763   next:[504,762]  objective_lb_search_no_lp
#Bound  40.56s best:763   next:[506,762]  objective_lb_search_no_lp
#Bound  46.46s best:763   next:[507,762]  objective_lb_search_no_lp
#Bound  49.70s best:763   next:[508,762]  objective_lb_search_no_lp
#Bound  53.17s best:763   next:[510,762]  objective_lb_search_no_lp
#Bound  53.94s best:763   next:[512,762]  objective_lb_search_no_lp
#Bound  57.25s best:763   next:[513,762]  objective_lb_search_no_lp
#Bound  57.92s best:763   next:[514,762]  objective_lb_search_no_lp
#Bound  60.06s best:763   next:[518,762]  objective_lb_search_no_lp
#Bound  60.41s best:763   next:[522,762]  objective_lb_search_no_lp
#Bound  60.82s best:763   next:[523,762]  objective_lb_search_no_lp
#Bound  61.23s best:763   next:[524,762]  objective_lb_search_no_lp
#Bound  63.16s best:763   next:[525,762]  objective_lb_search_no_lp
#Bound  65.58s best:763   next:[526,762]  objective_lb_search_no_lp
#Bound  69.77s best:763   next:[528,762]  objective_lb_search_no_lp
#Bound  72.54s best:763   next:[529,762]  objective_lb_search_no_lp
#Bound  74.23s best:763   next:[530,762]  objective_lb_search_no_lp
#Bound  77.60s best:763   next:[531,762]  objective_lb_search_no_lp
#Bound  87.66s best:763   next:[532,762]  objective_lb_search_no_lp
#Bound  88.59s best:763   next:[536,762]  objective_lb_search_no_lp
#Bound  89.73s best:763   next:[537,762]  objective_lb_search_no_lp
#Bound  95.59s best:763   next:[539,762]  objective_lb_search_no_lp
#Bound 100.01s best:763   next:[544,762]  objective_lb_search_no_lp
#Bound 102.49s best:763   next:[547,762]  objective_lb_search_no_lp
#Bound 105.41s best:763   next:[548,762]  objective_lb_search_no_lp
#Bound 106.40s best:763   next:[549,762]  objective_lb_search_no_lp
#Bound 107.88s best:763   next:[551,762]  objective_lb_search_no_lp
#Bound 110.73s best:763   next:[552,762]  objective_lb_search_no_lp
#Bound 112.79s best:763   next:[556,762]  objective_lb_search_no_lp
#Bound 113.67s best:763   next:[557,762]  objective_lb_search_no_lp
#Bound 114.70s best:763   next:[558,762]  objective_lb_search_no_lp
#Bound 115.40s best:763   next:[559,762]  objective_lb_search_no_lp
#Bound 115.89s best:763   next:[560,762]  objective_lb_search_no_lp
#Bound 118.30s best:763   next:[562,762]  objective_lb_search_no_lp
#Bound 119.25s best:763   next:[568,762]  objective_lb_search_no_lp
#Bound 121.48s best:763   next:[570,762]  objective_lb_search_no_lp
#Bound 126.96s best:763   next:[572,762]  objective_lb_search_no_lp
#Bound 136.29s best:763   next:[573,762]  objective_lb_search_no_lp
#Bound 138.57s best:763   next:[574,762]  objective_lb_search_no_lp
#Bound 139.57s best:763   next:[575,762]  objective_lb_search_no_lp
#Bound 139.90s best:763   next:[576,762]  objective_lb_search_no_lp
#Bound 141.23s best:763   next:[577,762]  objective_lb_search_no_lp
#80    153.50s best:762   next:[577,761]  pseudo_costs (fixed_bools=0/102)
#Bound 154.23s best:762   next:[578,761]  objective_lb_search_no_lp
#Bound 157.01s best:762   next:[579,761]  objective_lb_search_no_lp
#Bound 162.02s best:762   next:[581,761]  objective_lb_search_no_lp
#Bound 167.54s best:762   next:[582,761]  objective_lb_search_no_lp
#Bound 173.85s best:762   next:[583,761]  objective_lb_search_no_lp
#Bound 174.88s best:762   next:[584,761]  objective_lb_search_no_lp
#Bound 175.56s best:762   next:[585,761]  objective_lb_search_no_lp
#Bound 178.28s best:762   next:[587,761]  objective_lb_search_no_lp
#Model 193.92s var:274/275 constraints:2223/2307
#Bound 204.37s best:762   next:[596,761]  objective_lb_search_no_lp
#Bound 209.84s best:762   next:[597,761]  objective_lb_search_no_lp
#Bound 210.80s best:762   next:[598,761]  objective_lb_search_no_lp
#Bound 212.17s best:762   next:[601,761]  objective_lb_search_no_lp
#Bound 214.73s best:762   next:[602,761]  objective_lb_search_no_lp
#Bound 225.59s best:762   next:[603,761]  objective_lb_search_no_lp
#Bound 237.43s best:762   next:[604,761]  objective_lb_search_no_lp
#Bound 241.84s best:762   next:[605,761]  objective_lb_search_no_lp
#Bound 245.94s best:762   next:[609,761]  objective_lb_search_no_lp
#Bound 246.26s best:762   next:[610,761]  objective_lb_search_no_lp
#Model 247.44s var:273/275 constraints:2211/2307
#Bound 249.03s best:762   next:[611,761]  objective_lb_search_no_lp
#Bound 250.04s best:762   next:[612,761]  objective_lb_search_no_lp
#Model 251.27s var:272/275 constraints:2162/2307
#Model 251.45s var:271/275 constraints:2140/2307
#Bound 251.85s best:762   next:[614,761]  objective_lb_search_no_lp
#Bound 252.79s best:762   next:[615,761]  objective_lb_search_no_lp
#Model 252.87s var:270/275 constraints:2082/2307
#Model 252.93s var:268/275 constraints:1986/2307
#Bound 254.74s best:762   next:[619,761]  objective_lb_search_no_lp
#Model 254.89s var:260/275 constraints:1725/2307
#Bound 255.70s best:762   next:[622,761]  objective_lb_search_no_lp
#Bound 256.53s best:762   next:[624,761]  objective_lb_search_no_lp
#Model 256.84s var:257/275 constraints:1576/2307
#Bound 257.56s best:762   next:[644,761]  objective_lb_search_no_lp
#Model 257.72s var:255/275 constraints:1534/2307
#Bound 257.90s best:762   next:[659,761]  objective_lb_search_no_lp
#Bound 258.05s best:762   next:[662,761]  objective_lb_search_no_lp
#Bound 258.17s best:762   next:[669,761]  objective_lb_search_no_lp
#Bound 258.32s best:762   next:[673,761]  objective_lb_search_no_lp
#Bound 258.49s best:762   next:[717,761]  objective_lb_search_no_lp
#Model 258.56s var:253/275 constraints:1454/2307
#Done  258.60s quick_restart_no_lp
#Model 258.60s var:248/275 constraints:1190/2307
#Done  258.60s core

Task timing                                  n [     min,      max]      avg      dev     time         n [     min,      max]      avg      dev    dtime
                             'core':         1 [   4.30m,    4.30m]    4.30m   0.00ns    4.30m         1 [   3.02m,    3.02m]    3.02m   0.00ns    3.02m
                       'default_lp':         1 [   4.30m,    4.30m]    4.30m   0.00ns    4.30m         1 [  37.79s,   37.79s]   37.79s   0.00ns   37.79s
                 'feasibility_pump':       945 [ 36.53ms, 590.45ms] 212.21ms  62.83ms    3.34m       944 [ 16.02ms,  52.62ms]  17.30ms   1.15ms   16.33s
                  'fj_long_default':         1 [104.74ms, 104.74ms] 104.74ms   0.00ns 104.74ms         1 [ 32.31ms,  32.31ms]  32.31ms   0.00ns  32.31ms
                  'fj_long_default':         1 [121.29ms, 121.29ms] 121.29ms   0.00ns 121.29ms         1 [ 32.29ms,  32.29ms]  32.29ms   0.00ns  32.29ms
              'fj_long_lin_default':         1 [111.44ms, 111.44ms] 111.44ms   0.00ns 111.44ms         1 [ 56.78ms,  56.78ms]  56.78ms   0.00ns  56.78ms
              'fj_long_lin_perturb':         1 [224.38ms, 224.38ms] 224.38ms   0.00ns 224.38ms         1 [ 58.26ms,  58.26ms]  58.26ms   0.00ns  58.26ms
               'fj_long_lin_random':         1 [116.14ms, 116.14ms] 116.14ms   0.00ns 116.14ms         1 [ 50.58ms,  50.58ms]  50.58ms   0.00ns  50.58ms
                  'fj_long_perturb':         1 [119.81ms, 119.81ms] 119.81ms   0.00ns 119.81ms         1 [ 56.43ms,  56.43ms]  56.43ms   0.00ns  56.43ms
                   'fj_long_random':         1 [127.92ms, 127.92ms] 127.92ms   0.00ns 127.92ms         1 [ 38.70ms,  38.70ms]  38.70ms   0.00ns  38.70ms
                 'fj_short_default':         1 [113.22ms, 113.22ms] 113.22ms   0.00ns 113.22ms         1 [ 54.36ms,  54.36ms]  54.36ms   0.00ns  54.36ms
                 'fj_short_default':         1 [140.16ms, 140.16ms] 140.16ms   0.00ns 140.16ms         1 [ 59.49ms,  59.49ms]  59.49ms   0.00ns  59.49ms
             'fj_short_lin_default':         1 [105.75ms, 105.75ms] 105.75ms   0.00ns 105.75ms         1 [ 54.75ms,  54.75ms]  54.75ms   0.00ns  54.75ms
             'fj_short_lin_default':         1 [116.44ms, 116.44ms] 116.44ms   0.00ns 116.44ms         1 [ 54.89ms,  54.89ms]  54.89ms   0.00ns  54.89ms
             'fj_short_lin_perturb':         1 [142.03ms, 142.03ms] 142.03ms   0.00ns 142.03ms         1 [ 34.88ms,  34.88ms]  34.88ms   0.00ns  34.88ms
              'fj_short_lin_random':         1 [151.56ms, 151.56ms] 151.56ms   0.00ns 151.56ms         1 [ 56.03ms,  56.03ms]  56.03ms   0.00ns  56.03ms
                 'fj_short_perturb':         1 [131.54ms, 131.54ms] 131.54ms   0.00ns 131.54ms         1 [ 34.03ms,  34.03ms]  34.03ms   0.00ns  34.03ms
                  'fj_short_random':         1 [110.89ms, 110.89ms] 110.89ms   0.00ns 110.89ms         1 [ 55.10ms,  55.10ms]  55.10ms   0.00ns  55.10ms
                        'fs_random':         1 [ 46.17ms,  46.17ms]  46.17ms   0.00ns  46.17ms         1 [ 20.00ns,  20.00ns]  20.00ns   0.00ns  20.00ns
                        'fs_random':         1 [ 48.54ms,  48.54ms]  48.54ms   0.00ns  48.54ms         1 [ 20.00ns,  20.00ns]  20.00ns   0.00ns  20.00ns
                        'fs_random':         1 [ 48.86ms,  48.86ms]  48.86ms   0.00ns  48.86ms         1 [ 20.00ns,  20.00ns]  20.00ns   0.00ns  20.00ns
                        'fs_random':         1 [ 50.60ms,  50.60ms]  50.60ms   0.00ns  50.60ms         1 [ 20.00ns,  20.00ns]  20.00ns   0.00ns  20.00ns
                  'fs_random_no_lp':         1 [ 41.99ms,  41.99ms]  41.99ms   0.00ns  41.99ms         0 [  0.00ns,   0.00ns]   0.00ns   0.00ns   0.00ns
                  'fs_random_no_lp':         1 [ 42.72ms,  42.72ms]  42.72ms   0.00ns  42.72ms         0 [  0.00ns,   0.00ns]   0.00ns   0.00ns   0.00ns
                  'fs_random_no_lp':         1 [ 43.36ms,  43.36ms]  43.36ms   0.00ns  43.36ms         0 [  0.00ns,   0.00ns]   0.00ns   0.00ns   0.00ns
                  'fs_random_no_lp':         1 [ 43.97ms,  43.97ms]  43.97ms   0.00ns  43.97ms         0 [  0.00ns,   0.00ns]   0.00ns   0.00ns   0.00ns
          'fs_random_quick_restart':         1 [ 47.87ms,  47.87ms]  47.87ms   0.00ns  47.87ms         1 [ 20.00ns,  20.00ns]  20.00ns   0.00ns  20.00ns
          'fs_random_quick_restart':         1 [ 50.02ms,  50.02ms]  50.02ms   0.00ns  50.02ms         1 [ 20.00ns,  20.00ns]  20.00ns   0.00ns  20.00ns
          'fs_random_quick_restart':         1 [ 50.41ms,  50.41ms]  50.41ms   0.00ns  50.41ms         1 [ 20.00ns,  20.00ns]  20.00ns   0.00ns  20.00ns
          'fs_random_quick_restart':         1 [ 50.89ms,  50.89ms]  50.89ms   0.00ns  50.89ms         1 [ 20.00ns,  20.00ns]  20.00ns   0.00ns  20.00ns
    'fs_random_quick_restart_no_lp':         1 [ 42.64ms,  42.64ms]  42.64ms   0.00ns  42.64ms         0 [  0.00ns,   0.00ns]   0.00ns   0.00ns   0.00ns
    'fs_random_quick_restart_no_lp':         1 [ 43.74ms,  43.74ms]  43.74ms   0.00ns  43.74ms         0 [  0.00ns,   0.00ns]   0.00ns   0.00ns   0.00ns
    'fs_random_quick_restart_no_lp':         1 [ 46.36ms,  46.36ms]  46.36ms   0.00ns  46.36ms         1 [188.26us, 188.26us] 188.26us   0.00ns 188.26us
                    'graph_arc_lns':       961 [  3.79ms,    3.70s]    1.18s 743.52ms   18.82m       929 [ 10.00ns, 259.64ms]  75.35ms  48.64ms    1.17m
                    'graph_cst_lns':       961 [  1.83ms,    3.05s]    1.00s 784.80ms   16.03m       789 [ 10.00ns, 216.50ms]  76.29ms  46.83ms    1.00m
                    'graph_dec_lns':       961 [  4.14ms,    3.24s]    1.15s 710.65ms   18.42m       930 [ 10.00ns, 304.43ms]  75.16ms  49.68ms    1.16m
                    'graph_var_lns':       962 [  4.20ms,    3.34s]    1.17s 706.05ms   18.74m       944 [ 10.00ns, 269.42ms]  76.32ms  48.27ms    1.20m
                   'lb_tree_search':         1 [   4.30m,    4.30m]    4.30m   0.00ns    4.30m         1 [   1.06m,    1.06m]    1.06m   0.00ns    1.06m
                           'max_lp':         1 [   4.30m,    4.30m]    4.30m   0.00ns    4.30m         1 [  48.86s,   48.86s]   48.86s   0.00ns   48.86s
                            'no_lp':         1 [   4.30m,    4.30m]    4.30m   0.00ns    4.30m         1 [  30.91s,   30.91s]   30.91s   0.00ns   30.91s
              'objective_lb_search':         1 [   4.30m,    4.30m]    4.30m   0.00ns    4.30m         1 [  41.24s,   41.24s]   41.24s   0.00ns   41.24s
       'objective_lb_search_max_lp':         1 [   4.30m,    4.30m]    4.30m   0.00ns    4.30m         1 [  57.09s,   57.09s]   57.09s   0.00ns   57.09s
        'objective_lb_search_no_lp':         1 [   4.30m,    4.30m]    4.30m   0.00ns    4.30m         1 [  25.04s,   25.04s]   25.04s   0.00ns   25.04s
  'objective_shaving_search_max_lp':       132 [  3.62ms,   26.02s]    1.95s    3.19s    4.30m       115 [493.61us,    2.81s] 207.63ms 357.40ms   23.88s
   'objective_shaving_search_no_lp':       132 [  3.24ms,   26.02s]    1.95s    3.19s    4.30m       118 [494.01us,    1.95s] 145.00ms 256.51ms   17.11s
                          'probing':         1 [   4.30m,    4.30m]    4.30m   0.00ns    4.30m         1 [  49.89s,   49.89s]   49.89s   0.00ns   49.89s
                   'probing_max_lp':         1 [   4.30m,    4.30m]    4.30m   0.00ns    4.30m         1 [  38.47s,   38.47s]   38.47s   0.00ns   38.47s
                     'pseudo_costs':         1 [   4.30m,    4.30m]    4.30m   0.00ns    4.30m         1 [  39.77s,   39.77s]   39.77s   0.00ns   39.77s
                    'quick_restart':         1 [   4.30m,    4.30m]    4.30m   0.00ns    4.30m         1 [  51.52s,   51.52s]   51.52s   0.00ns   51.52s
              'quick_restart_no_lp':         1 [   4.30m,    4.30m]    4.30m   0.00ns    4.30m         1 [  50.27s,   50.27s]   50.27s   0.00ns   50.27s
                    'reduced_costs':         1 [   4.30m,    4.30m]    4.30m   0.00ns    4.30m         1 [  43.24s,   43.24s]   43.24s   0.00ns   43.24s
                        'rins/rens':       962 [170.87us,    2.73s] 854.34ms 627.42ms   13.70m       761 [ 10.00ns, 200.22ms]  77.30ms  32.84ms   58.82s
                      'rnd_cst_lns':       962 [  1.87ms,    3.46s]    1.13s 716.49ms   18.05m       918 [ 10.00ns, 238.24ms]  75.83ms  47.67ms    1.16m
                      'rnd_var_lns':       962 [  3.33ms,    3.14s]    1.11s 714.26ms   17.84m       939 [ 10.00ns, 248.77ms]  75.02ms  49.65ms    1.17m
                     'violation_ls':       948 [315.45us, 376.77ms] 156.99ms  51.79ms    2.48m       948 [  1.76us, 119.89ms]  48.92ms  14.65ms   46.38s
                     'violation_ls':       953 [272.94us, 431.17ms] 151.79ms  60.25ms    2.41m       953 [420.00ns, 107.54ms]  53.78ms  18.99ms   51.25s
                     'violation_ls':       953 [306.50us, 392.65ms] 154.17ms  59.71ms    2.45m       953 [420.00ns, 165.77ms]  51.90ms  21.57ms   49.46s
                     'violation_ls':       955 [290.81us, 307.79ms] 143.62ms  46.15ms    2.29m       955 [480.00ns,  58.34ms]  45.24ms   7.54ms   43.20s
                     'violation_ls':       956 [309.75us, 432.08ms] 148.31ms  53.55ms    2.36m       956 [810.00ns, 114.75ms]  49.69ms  13.76ms   47.50s

Search stats                        Bools  Conflicts  Branches  Restarts   BoolPropag  IntegerPropag
                           'core':  3'163    124'129   341'111    38'145  150'978'007     78'912'882
                     'default_lp':    593     50'107   230'894    30'919   12'281'396     46'893'322
                      'fs_random':     78          0       136       136           30          3'698
                      'fs_random':     78          0       142       142           30          3'953
                      'fs_random':     78          0       144       144           30          4'043
                      'fs_random':     78          0       156       156           30          4'266
                'fs_random_no_lp':     78          0       142       142           30          3'953
                'fs_random_no_lp':     78          0       144       144           30          4'043
                'fs_random_no_lp':     78          0       144       144           30          4'043
                'fs_random_no_lp':     78          0       144       144           30          4'043
        'fs_random_quick_restart':     78          0       122       122           30          3'080
        'fs_random_quick_restart':     78          0       142       142           30          3'953
        'fs_random_quick_restart':     78          0       144       144           30          4'043
        'fs_random_quick_restart':     78          0       150       150           30          4'183
  'fs_random_quick_restart_no_lp':     78          0       142       142           30          3'953
  'fs_random_quick_restart_no_lp':     78          0       144       144           30          4'043
  'fs_random_quick_restart_no_lp':     78          0       179       156           35          5'176
                 'lb_tree_search':     78        308   175'938    24'226      287'617     16'122'110
                         'max_lp':     78     28'528   287'904    40'978    1'224'850     47'398'527
                          'no_lp':  1'094    141'259   295'755    21'953   41'103'992    109'480'413
            'objective_lb_search':    246     34'791   328'057    64'180    2'231'176     56'643'218
     'objective_lb_search_max_lp':    199     20'505   236'229    53'656    1'150'861     34'389'649
      'objective_lb_search_no_lp':    361    140'982   289'884    18'111    4'275'157    108'896'735
                        'probing':    472        283     3'197     2'024       24'994        183'434
                 'probing_max_lp':    472        282     2'370     1'614       21'773        160'290
                   'pseudo_costs':    105     35'256   248'415    39'528    1'162'814     44'694'924
                  'quick_restart':  1'085     13'103   371'207    68'685   11'820'648     46'157'640
            'quick_restart_no_lp':  3'333    140'849   530'959    34'487  114'028'382     90'399'120
                  'reduced_costs':  1'307     40'158   253'456    29'714   13'790'609     44'660'965

SAT stats                           ClassicMinim  LitRemoved  LitLearned  LitForgotten  Subsumed  MClauses  MDecisions  MLitTrue  MSubsumed  MLitRemoved  MReused
                           'core':       112'551     721'543   1'088'925        92'645       731    17'981      89'529         0        244        1'001      172
                     'default_lp':        34'179      96'720     542'364       210'120     1'423    17'207     158'457       187      6'147       41'778    2'608
                      'fs_random':             0           0           0             0         0         0           0         0          0            0        0
                      'fs_random':             0           0           0             0         0         0           0         0          0            0        0
                      'fs_random':             0           0           0             0         0         0           0         0          0            0        0
                      'fs_random':             0           0           0             0         0         0           0         0          0            0        0
                'fs_random_no_lp':             0           0           0             0         0         0           0         0          0            0        0
                'fs_random_no_lp':             0           0           0             0         0         0           0         0          0            0        0
                'fs_random_no_lp':             0           0           0             0         0         0           0         0          0            0        0
                'fs_random_no_lp':             0           0           0             0         0         0           0         0          0            0        0
        'fs_random_quick_restart':             0           0           0             0         0         0           0         0          0            0        0
        'fs_random_quick_restart':             0           0           0             0         0         0           0         0          0            0        0
        'fs_random_quick_restart':             0           0           0             0         0         0           0         0          0            0        0
        'fs_random_quick_restart':             0           0           0             0         0         0           0         0          0            0        0
  'fs_random_quick_restart_no_lp':             0           0           0             0         0         0           0         0          0            0        0
  'fs_random_quick_restart_no_lp':             0           0           0             0         0         0           0         0          0            0        0
  'fs_random_quick_restart_no_lp':             0           0           0             0         0         0           0         0          0            0        0
                 'lb_tree_search':             7           8       1'261             0         2    10'828      55'391         0         50          200      854
                         'max_lp':        16'638      37'748     339'832        95'934     1'284    20'203     242'274         0      1'529       10'995    4'967
                          'no_lp':       117'274     539'256   1'837'179     1'212'634     1'995    12'246     104'433         5      5'493       39'195    1'679
            'objective_lb_search':        23'823      50'113     344'810        16'932     1'346    29'756     257'915         0      2'591       16'700    5'028
     'objective_lb_search_max_lp':        12'424      27'973     208'789         3'579     1'037    20'711     172'960         0        555        3'720    4'694
      'objective_lb_search_no_lp':       114'403     402'708   1'292'326       556'756     2'913    11'001     120'059         0      5'342       40'041    2'006
                        'probing':             0           0         283             0         0         0           0         0          0            0        0
                 'probing_max_lp':             0           0         282             0         0         0           0         0          0            0        0
                   'pseudo_costs':        20'159      44'249     422'097       115'892     1'773    19'142     192'976         0      3'344       24'146    2'714
                  'quick_restart':         9'063      29'508     143'036             0       576    32'518     302'962         7      2'549       15'951    5'362
            'quick_restart_no_lp':       117'239     666'735   1'809'951     1'157'902     1'431    15'120     116'912        35      9'946       70'769    1'056
                  'reduced_costs':        29'381      94'248     494'125       208'134     1'052    16'807     175'247         9      4'374       31'893    3'228

Lp stats                         Component  Iterations  AddedCuts  OPTIMAL  DUAL_F.  DUAL_U.
                  'default_lp':          1     428'985     30'963   64'016        0        0
                   'fs_random':          1           0          0        0        0        0
                   'fs_random':          1           0          0        0        0        0
                   'fs_random':          1           0          0        0        0        0
                   'fs_random':          1           0          0        0        0        0
     'fs_random_quick_restart':          1           0          0        0        0        0
     'fs_random_quick_restart':          1           0          0        0        0        0
     'fs_random_quick_restart':          1           0          0        0        0        0
     'fs_random_quick_restart':          1           0          0        0        0        0
              'lb_tree_search':          1   1'588'542      9'545   80'517   24'630        0
                      'max_lp':          1     808'934     21'207   44'930   10'863       25
         'objective_lb_search':          1     494'278     23'033   50'366        0        0
  'objective_lb_search_max_lp':          1     918'498     12'501   34'445    9'316        7
                     'probing':          1     280'216     30'726   10'159        0        0
              'probing_max_lp':          1     229'536     16'426    6'530      965        0
                'pseudo_costs':          1     692'745     29'418   46'964   16'613       11
               'quick_restart':          1     504'476     27'175   35'886        0        2
               'reduced_costs':          1     731'460     38'588   54'008   17'006       10

Lp dimension                                                                      Final dimension of first component
                  'default_lp':   433 rows, 271 columns, 1874 entries with magnitude in [1.530534e-05, 1.000000e+00]
                   'fs_random':        0 rows, 271 columns, 0 entries with magnitude in [0.000000e+00, 0.000000e+00]
                   'fs_random':        0 rows, 271 columns, 0 entries with magnitude in [0.000000e+00, 0.000000e+00]
                   'fs_random':        0 rows, 271 columns, 0 entries with magnitude in [0.000000e+00, 0.000000e+00]
                   'fs_random':        0 rows, 271 columns, 0 entries with magnitude in [0.000000e+00, 0.000000e+00]
     'fs_random_quick_restart':        0 rows, 271 columns, 0 entries with magnitude in [0.000000e+00, 0.000000e+00]
     'fs_random_quick_restart':        0 rows, 271 columns, 0 entries with magnitude in [0.000000e+00, 0.000000e+00]
     'fs_random_quick_restart':        0 rows, 271 columns, 0 entries with magnitude in [0.000000e+00, 0.000000e+00]
     'fs_random_quick_restart':        0 rows, 271 columns, 0 entries with magnitude in [0.000000e+00, 0.000000e+00]
              'lb_tree_search':   493 rows, 275 columns, 1889 entries with magnitude in [2.026740e-02, 1.000000e+00]
                      'max_lp':   588 rows, 275 columns, 2384 entries with magnitude in [3.674978e-03, 1.000000e+00]
         'objective_lb_search':   310 rows, 271 columns, 1228 entries with magnitude in [3.677654e-03, 1.000000e+00]
  'objective_lb_search_max_lp':   745 rows, 275 columns, 2965 entries with magnitude in [9.420696e-04, 1.000000e+00]
                     'probing':  1007 rows, 271 columns, 8047 entries with magnitude in [2.661044e-05, 1.000000e+00]
              'probing_max_lp':  1027 rows, 275 columns, 7270 entries with magnitude in [7.676462e-04, 1.000000e+00]
                'pseudo_costs':   351 rows, 275 columns, 1414 entries with magnitude in [4.532612e-03, 1.000000e+00]
               'quick_restart':   698 rows, 271 columns, 2327 entries with magnitude in [1.880073e-04, 1.000000e+00]
               'reduced_costs':   699 rows, 275 columns, 2753 entries with magnitude in [3.850951e-04, 1.000000e+00]

Lp debug                         CutPropag  CutEqPropag  Adjust  Overflow        Bad  BadScaling
                  'default_lp':         46          179  34'765         0    268'801           0
                   'fs_random':          0            0       0         0          0           0
                   'fs_random':          0            0       0         0          0           0
                   'fs_random':          0            0       0         0          0           0
                   'fs_random':          0            0       0         0          0           0
     'fs_random_quick_restart':          0            0       0         0          0           0
     'fs_random_quick_restart':          0            0       0         0          0           0
     'fs_random_quick_restart':          0            0       0         0          0           0
     'fs_random_quick_restart':          0            0       0         0          0           0
              'lb_tree_search':         21            9  56'905         0    104'424           0
                      'max_lp':        101           45  25'264         0    302'902           0
         'objective_lb_search':         35          186  31'919         0    319'394           0
  'objective_lb_search_max_lp':        147           41  23'165         0    335'808           0
                     'probing':         36          604   8'671         0  4'124'902           0
              'probing_max_lp':         76          124   7'348         0  4'050'689           0
                'pseudo_costs':         85           77  32'216         0    309'986           0
               'quick_restart':        105          233  24'090         0    564'268           0
               'reduced_costs':        237           70  42'049         0    427'430           0

Lp pool                          Constraints  Updates  Simplif  Merged  Shortened    Split  Strenghtened      Cuts/Call
                  'default_lp':       10'050    3'525   74'966     273     11'912   47'698        20'247  30'963/70'679
                   'fs_random':          360        0        0       0          0        0            37            0/0
                   'fs_random':          360        0        0       0          0        0            37            0/0
                   'fs_random':          360        0        0       0          0        0            37            0/0
                   'fs_random':          360        0        0       0          0        0            37            0/0
     'fs_random_quick_restart':          360        0        0       0          0        0            25            0/0
     'fs_random_quick_restart':          360        0        0       0          0        0            37            0/0
     'fs_random_quick_restart':          360        0        0       0          0        0            37            0/0
     'fs_random_quick_restart':          360        0        0       0          0        0            37            0/0
              'lb_tree_search':       11'746      900   63'120     105      6'091    2'300        42'669   9'545/43'026
                      'max_lp':       11'326    1'697   80'587     187        635   18'700        53'827  21'207/59'199
         'objective_lb_search':       10'280    3'795   55'110     113     17'374   56'237        17'793  23'033/56'354
  'objective_lb_search_max_lp':       11'737    1'695  194'553      70     11'317   14'982        68'789  12'501/39'697
                     'probing':       10'053    6'805   30'028      33      6'861   73'084         9'919  30'726/53'245
              'probing_max_lp':       11'705    3'297  106'369      27      1'968   30'401        34'474  16'426/39'516
                'pseudo_costs':       11'420    1'778   83'706     304      1'491   14'525        55'241  29'418/76'012
               'quick_restart':        9'486    6'027  168'309      49     15'446  159'435        28'067  27'175/61'681
               'reduced_costs':       11'433    2'099  166'241     461     15'830   18'414        78'455  38'588/99'725

Lp Cut            defaul  max_lp  quick_  reduce  pseudo  lb_tre  probin  object  probin  object
          CG_FF:   1'443   1'034     603   2'168   1'383     539     364     867     340     335
           CG_K:     983     690     377   1'784   1'243     302     265     688     144     150
           CG_R:   1'896     615   1'397   1'768   1'485     252     792   1'413     215     217
          CG_RB:  10'102   3'542  10'226   5'647   4'697   1'864  13'357   8'506   1'295   1'960
         CG_RBP:   1'864     380   1'484     805     510     218   1'411     951     139     115
         Clique:       -      71       -     164     120      54       -       -      46      71
             IB:   4'018   1'723   2'245   3'600   3'028     727   1'379   2'547     578     885
       MIR_1_FF:     842     920     772   1'829   1'269     500     684     700     631     653
        MIR_1_K:     166     337     115     612     506     126      86     161      82     179
       MIR_1_KL:       6       8       8      11      13       -      12       -       -       -
        MIR_1_R:     291     147     201     360     228      63     201     170      90      89
       MIR_1_RB:   1'536   1'967   1'800   3'573   2'811     818   2'181   1'256   1'291   1'311
      MIR_1_RBP:      70     202      53     325     247     111      58      16      81      74
      MIR_1_RLT:       -      11       -      31      23       8       -       -      13       7
       MIR_2_FF:     546     610     490   1'278     877     330     455     425     367     434
        MIR_2_K:     126     178     119     350     311      87     111      87      52     124
       MIR_2_KL:       9       8       8      14      10       2      12       5       2       -
        MIR_2_R:     210     299     230     466     370      96     344     158     234     207
       MIR_2_RB:   1'150   1'156   1'215   2'104   1'679     452   1'687     905     618     771
      MIR_2_RBP:      97     176      74     278     182      75     101      36      81      44
       MIR_3_FF:     386     450     338     890     576     194     273     307     244     294
        MIR_3_K:     115     138      79     292     214      69      57      73      46      88
       MIR_3_KL:       4       8       7      14      12       1      15       3       2       1
        MIR_3_R:     175     213     195     372     286      71     179     127     171     152
       MIR_3_RB:     862     709     898   1'399   1'007     263     935     634     471     441
      MIR_3_RBP:      86     103      57     158     127      42      66      28      54      27
       MIR_4_FF:     245     254     259     509     342     118     164     197     125     204
        MIR_4_K:      88      95      58     227     146      62      50      56      28      60
       MIR_4_KL:       2       4       7      12       3       3      10       3       1       1
        MIR_4_R:     156     162     183     257     187      41     111     115      92      91
       MIR_4_RB:     544     453     561     731     568     140     570     455     270     255
      MIR_4_RBP:      44      53      28     138      82      30      31      25      17      17
       MIR_5_FF:     165     170     162     288     220      65     141     134      64      91
        MIR_5_K:      44      67      46     133      77      24      37      49      14      25
       MIR_5_KL:       -       2       8       -       5       1       5       3       -       1
        MIR_5_R:     123     105     128     165     125      28      79      89      59      54
       MIR_5_RB:     290     242     312     396     322      72     358     234     120     121
      MIR_5_RBP:      24      34      20      88      56      19      33      15       9      12
       MIR_6_FF:      96      87      75     199     125      43      92      72      32      41
        MIR_6_K:      23      33      34     108      61      20      30      20       3      21
       MIR_6_KL:       3       -       3       2       2       2       3       2       -       -
        MIR_6_R:      87      67      72     114      75      25      59      54      22      28
       MIR_6_RB:     160     136     191     275     185      60     190     116      67      65
      MIR_6_RBP:      25      24      14      67      37      13      19       8       9       7
   ZERO_HALF_FF:     196     224     163     428     308     122      79     128      93     100
    ZERO_HALF_K:      42      72      32     151     120      40      20      32      15      33
    ZERO_HALF_R:     976   2'587   1'183   2'869   2'308     984   2'698     780   7'236   2'237
   ZERO_HALF_RB:     522     545     563     947     708     319     706     340     658     353
  ZERO_HALF_RBP:     125      96      82     192     142      50     216      43     205      55

LNS stats           Improv/Calls  Closed  Difficulty  TimeLimit
  'graph_arc_lns':        41/961     52%        0.99       0.14
  'graph_cst_lns':        25/820     53%        0.99       0.13
  'graph_dec_lns':        41/961     51%        0.99       0.14
  'graph_var_lns':        17/961     52%        1.00       0.14
      'rins/rens':       101/857     51%        0.93       0.10
    'rnd_cst_lns':        42/958     53%        1.00       0.14
    'rnd_var_lns':        35/962     52%        0.99       0.14

LS stats                   Batches  Restarts   LinMoves   GenMoves  CompoundMoves  WeightUpdates
       'fj_long_default':        1         1      9'237          0              0            280
       'fj_long_default':        1         1      9'693          0              0            307
   'fj_long_lin_default':        1         1          0      3'536            506              2
   'fj_long_lin_perturb':        1         1      8'819          0              0          1'181
    'fj_long_lin_random':        1         1      8'750          0              0          1'250
       'fj_long_perturb':        1         1          0      3'722            414              1
        'fj_long_random':        1         1      9'762          0              0            238
      'fj_short_default':        1         1          0      4'242            642              2
      'fj_short_default':        1         1      8'798          0              0          1'202
  'fj_short_lin_default':        1         1          0      3'946            632              2
  'fj_short_lin_default':        1         1          0      4'064            556              2
  'fj_short_lin_perturb':        1         1      9'714          0              0            286
   'fj_short_lin_random':        1         1          0      3'687            445              2
      'fj_short_perturb':        1         1      9'718          0              0            282
       'fj_short_random':        1         1          0      3'680            455              1
          'violation_ls':      948         0  5'849'130  1'910'339        125'270        435'770
          'violation_ls':      953         0  5'002'360  2'675'435        101'955        346'073
          'violation_ls':      953         0  6'069'368  1'556'812         80'480        686'936
          'violation_ls':      955         0  4'955'887  2'750'000        146'483         87'847
          'violation_ls':      956         0  3'969'538  3'099'224        183'893        625'432

Solutions (80)            Num     Rank
        'graph_dec_lns':    1  [61,61]
                'no_lp':   17   [1,28]
         'pseudo_costs':    1  [80,80]
  'quick_restart_no_lp':    3   [7,60]
          'rens_lp_lns':    1  [62,62]
          'rins_lp_lns':    1  [70,70]
          'rnd_cst_lns':    2  [29,63]
          'rnd_var_lns':    3  [13,72]
         'violation_ls':   51   [2,79]

Objective bounds                     Num
                  'initial_domain':    1
             'objective_lb_search':    2
       'objective_lb_search_no_lp':  135
  'objective_shaving_search_no_lp':    1

Solution repositories     Added  Queried  Ignored  Synchro
  'feasible solutions':   6'244   18'940        7    5'976
        'lp solutions':   1'631      469        0    1'480
                'pump':  19'819      492

Improving bounds shared            Num
                        'core':     62
                  'default_lp':    180
              'lb_tree_search':     31
                      'max_lp':    166
                       'no_lp':    307
         'objective_lb_search':     28
  'objective_lb_search_max_lp':    195
                     'probing':    601
              'probing_max_lp':    353
                'pseudo_costs':    192
               'quick_restart':    244
         'quick_restart_no_lp':  2'268
               'reduced_costs':    712

Clauses shared                   Num
                        'core':    4
                  'default_lp':   45
              'lb_tree_search':   14
                      'max_lp':    8
                       'no_lp':   50
         'objective_lb_search':   31
  'objective_lb_search_max_lp':   47
   'objective_lb_search_no_lp':    7
                'pseudo_costs':   15
               'quick_restart':    3
         'quick_restart_no_lp':   37
               'reduced_costs':   19

CpSolverResponse summary:
status: OPTIMAL
objective: 762
best_bound: 762
integers: 272
booleans: 78
conflicts: 0
branches: 144
propagations: 30
integer_propagations: 4043
restarts: 144
lp_iterations: 0
walltime: 258.692
usertime: 258.692
deterministic_time: 1525.85
gap_integral: 4266.75
solution_fingerprint: 0x84dc08f2f5ce2fc3


--- Simulation Gantt  partir du modle mathmatique ---
{'big':0, 'due_date':91, 'pos_time':5, 'status':0, 'blocked':0, 'operations':["{'type':1, 'processing_time':51}"]}
{'big':0, 'due_date':154, 'pos_time':5, 'status':0, 'blocked':0, 'operations':["{'type':1, 'processing_time':16}", "{'type':0, 'processing_time':39}"]}
{'big':0, 'due_date':94, 'pos_time':5, 'status':0, 'blocked':0, 'operations':["{'type':1, 'processing_time':45}", "{'type':0, 'processing_time':11}"]}
{'big':0, 'due_date':84, 'pos_time':5, 'status':0, 'blocked':0, 'operations':["{'type':0, 'processing_time':37}"]}
{'big':0, 'due_date':147, 'pos_time':5, 'status':0, 'blocked':0, 'operations':["{'type':1, 'processing_time':36}", "{'type':0, 'processing_time':29}"]}
{'big':1, 'due_date':80, 'pos_time':5, 'status':0, 'blocked':0, 'operations':["{'type':0, 'processing_time':14}"]}
{'big':0, 'due_date':97, 'pos_time':5, 'status':0, 'blocked':0, 'operations':["{'type':0, 'processing_time':45}", "{'type':1, 'processing_time':18}"]}
