created virtual environment CPython3.12.4.final.0-64 in 326ms
  creator CPython3Posix(dest=/localscratch/aneumann.46806168.0/env, clear=False, no_vcs_ignore=False, global=False)
  seeder FromAppData(download=False, pip=bundle, via=copy, app_data_dir=/home/aneumann/.local/share/virtualenv)
    added seed packages: pip==24.2+computecanada
  activators BashActivator,CShellActivator,FishActivator,NushellActivator,PowerShellActivator,PythonActivator
Looking in links: /cvmfs/soft.computecanada.ca/custom/python/wheelhouse/gentoo2023/x86-64-v3, /cvmfs/soft.computecanada.ca/custom/python/wheelhouse/gentoo2023/generic, /cvmfs/soft.computecanada.ca/custom/python/wheelhouse/generic
Requirement already satisfied: pip in /localscratch/aneumann.46806168.0/env/lib/python3.12/site-packages (24.2+computecanada)
Processing /cvmfs/soft.computecanada.ca/custom/python/wheelhouse/generic/pip-25.0+computecanada-py3-none-any.whl
Installing collected packages: pip
  Attempting uninstall: pip
    Found existing installation: pip 24.2+computecanada
    Uninstalling pip-24.2+computecanada:
      Successfully uninstalled pip-24.2+computecanada
Successfully installed pip-25.0+computecanada
Looking in links: /cvmfs/soft.computecanada.ca/custom/python/wheelhouse/gentoo2023/x86-64-v3, /cvmfs/soft.computecanada.ca/custom/python/wheelhouse/gentoo2023/generic, /cvmfs/soft.computecanada.ca/custom/python/wheelhouse/generic
ERROR: protobuf-5.28.3-cp38-abi3-manylinux2014_x86_64.whl is not a supported wheel on this platform.
Looking in links: /cvmfs/soft.computecanada.ca/custom/python/wheelhouse/gentoo2023/x86-64-v3, /cvmfs/soft.computecanada.ca/custom/python/wheelhouse/gentoo2023/generic, /cvmfs/soft.computecanada.ca/custom/python/wheelhouse/generic
Processing /home/aneumann/projects/def-adhaj/aneumann/GNRS/wheels/immutabledict-4.2.0-py3-none-any.whl
Installing collected packages: immutabledict
Successfully installed immutabledict-4.2.0
Looking in links: /cvmfs/soft.computecanada.ca/custom/python/wheelhouse/gentoo2023/x86-64-v3, /cvmfs/soft.computecanada.ca/custom/python/wheelhouse/gentoo2023/generic, /cvmfs/soft.computecanada.ca/custom/python/wheelhouse/generic
Processing /cvmfs/soft.computecanada.ca/custom/python/wheelhouse/generic/ortools-9.10.4067+computecanada-cp312-cp312-linux_x86_64.whl (from -r /home/aneumann/projects/def-adhaj/aneumann/GNRS/requirements/or.txt (line 1))
Processing /cvmfs/soft.computecanada.ca/custom/python/wheelhouse/gentoo2023/x86-64-v3/matplotlib-3.10.0+computecanada-cp312-cp312-linux_x86_64.whl (from -r /home/aneumann/projects/def-adhaj/aneumann/GNRS/requirements/or.txt (line 2))
Processing /cvmfs/soft.computecanada.ca/custom/python/wheelhouse/gentoo2023/x86-64-v3/pandas-2.2.3+computecanada-cp312-cp312-linux_x86_64.whl (from -r /home/aneumann/projects/def-adhaj/aneumann/GNRS/requirements/or.txt (line 3))
Processing /cvmfs/soft.computecanada.ca/custom/python/wheelhouse/generic/absl_py-2.3.0+computecanada-py3-none-any.whl (from ortools<9.11,>=9.10->-r /home/aneumann/projects/def-adhaj/aneumann/GNRS/requirements/or.txt (line 1))
Processing /cvmfs/soft.computecanada.ca/custom/python/wheelhouse/gentoo2023/generic/numpy-2.2.2+computecanada-cp312-cp312-linux_x86_64.whl (from ortools<9.11,>=9.10->-r /home/aneumann/projects/def-adhaj/aneumann/GNRS/requirements/or.txt (line 1))
Processing /cvmfs/soft.computecanada.ca/custom/python/wheelhouse/gentoo2023/x86-64-v3/protobuf-6.31.1+computecanada-cp312-cp312-linux_x86_64.whl (from ortools<9.11,>=9.10->-r /home/aneumann/projects/def-adhaj/aneumann/GNRS/requirements/or.txt (line 1))
Requirement already satisfied: immutabledict>=3.0.0 in /localscratch/aneumann.46806168.0/env/lib/python3.12/site-packages (from ortools<9.11,>=9.10->-r /home/aneumann/projects/def-adhaj/aneumann/GNRS/requirements/or.txt (line 1)) (4.2.0)
Processing /cvmfs/soft.computecanada.ca/custom/python/wheelhouse/gentoo2023/generic/contourpy-1.3.1+computecanada-cp312-cp312-linux_x86_64.whl (from matplotlib->-r /home/aneumann/projects/def-adhaj/aneumann/GNRS/requirements/or.txt (line 2))
Processing /cvmfs/soft.computecanada.ca/custom/python/wheelhouse/generic/cycler-0.12.1+computecanada-py3-none-any.whl (from matplotlib->-r /home/aneumann/projects/def-adhaj/aneumann/GNRS/requirements/or.txt (line 2))
Processing /cvmfs/soft.computecanada.ca/custom/python/wheelhouse/generic/fonttools-4.59.0+computecanada-cp312-cp312-linux_x86_64.whl (from matplotlib->-r /home/aneumann/projects/def-adhaj/aneumann/GNRS/requirements/or.txt (line 2))
Processing /cvmfs/soft.computecanada.ca/custom/python/wheelhouse/gentoo2023/x86-64-v3/kiwisolver-1.4.8+computecanada-cp312-cp312-linux_x86_64.whl (from matplotlib->-r /home/aneumann/projects/def-adhaj/aneumann/GNRS/requirements/or.txt (line 2))
Processing /cvmfs/soft.computecanada.ca/custom/python/wheelhouse/generic/packaging-25.0+computecanada-py3-none-any.whl (from matplotlib->-r /home/aneumann/projects/def-adhaj/aneumann/GNRS/requirements/or.txt (line 2))
Processing /cvmfs/soft.computecanada.ca/custom/python/wheelhouse/gentoo2023/x86-64-v3/pillow-11.1.0+computecanada-cp312-cp312-linux_x86_64.whl (from matplotlib->-r /home/aneumann/projects/def-adhaj/aneumann/GNRS/requirements/or.txt (line 2))
Processing /cvmfs/soft.computecanada.ca/custom/python/wheelhouse/generic/pyparsing-3.2.3+computecanada-py3-none-any.whl (from matplotlib->-r /home/aneumann/projects/def-adhaj/aneumann/GNRS/requirements/or.txt (line 2))
Processing /cvmfs/soft.computecanada.ca/custom/python/wheelhouse/generic/python_dateutil-2.9.0.post0+computecanada-py2.py3-none-any.whl (from matplotlib->-r /home/aneumann/projects/def-adhaj/aneumann/GNRS/requirements/or.txt (line 2))
Processing /cvmfs/soft.computecanada.ca/custom/python/wheelhouse/generic/pytz-2025.2+computecanada-py2.py3-none-any.whl (from pandas->-r /home/aneumann/projects/def-adhaj/aneumann/GNRS/requirements/or.txt (line 3))
Processing /cvmfs/soft.computecanada.ca/custom/python/wheelhouse/generic/tzdata-2025.2+computecanada-py2.py3-none-any.whl (from pandas->-r /home/aneumann/projects/def-adhaj/aneumann/GNRS/requirements/or.txt (line 3))
Processing /cvmfs/soft.computecanada.ca/custom/python/wheelhouse/generic/six-1.17.0+computecanada-py2.py3-none-any.whl (from python-dateutil>=2.7->matplotlib->-r /home/aneumann/projects/def-adhaj/aneumann/GNRS/requirements/or.txt (line 2))
Installing collected packages: pytz, tzdata, six, pyparsing, protobuf, pillow, packaging, numpy, kiwisolver, fonttools, cycler, absl-py, python-dateutil, contourpy, pandas, matplotlib, ortools
Successfully installed absl-py-2.3.0+computecanada contourpy-1.3.1+computecanada cycler-0.12.1+computecanada fonttools-4.59.0+computecanada kiwisolver-1.4.8+computecanada matplotlib-3.10.0+computecanada numpy-2.2.2+computecanada ortools-9.10.4067+computecanada packaging-25.0+computecanada pandas-2.2.3+computecanada pillow-11.1.0+computecanada protobuf-6.31.1+computecanada pyparsing-3.2.3+computecanada python-dateutil-2.9.0.post0+computecanada pytz-2025.2+computecanada six-1.17.0+computecanada tzdata-2025.2+computecanada

Starting CP-SAT solver v9.10.4067
Parameters: max_time_in_seconds: 86400 max_memory_in_mb: 185000 log_search_progress: true enumerate_all_solutions: false num_search_workers: 32 absolute_gap_limit: 0 relative_gap_limit: 0

Initial optimization model '': (model_fingerprint: 0x164a14ac4be8132d)
#Variables: 258 (#ints: 8 in objective)
  - 182 Booleans in [0,1]
  - 76 in [0,651]
#kLinear1: 37
#kLinear2: 340
#kLinear3: 153
#kLinearN: 2'507 (#terms: 31'540)

Starting presolve at 0.00s
  8.56e-04s  0.00e+00d  [DetectDominanceRelations] 
  1.47e-02s  0.00e+00d  [PresolveToFixPoint] #num_loops=8 #num_dual_strengthening=3 
  2.98e-05s  0.00e+00d  [ExtractEncodingFromLinear] #potential_supersets=3 
[Symmetry] Graph for symmetry has 2'748 nodes and 20'984 arcs.
[Symmetry] Symmetry computation done. time: 0.000929814 dtime: 0.00163994
[Symmetry] #generators: 1, average support size: 20
[Symmetry] The model contains 138 duplicate constraints !
[Symmetry] 10 orbits with sizes: 2,2,2,2,2,2,2,2,2,2
[Symmetry] Num fixable by intersecting at_most_one with orbits: 1 largest_orbit: 2
  4.79e-03s  1.05e-03d  [Probe] #probed=244 #new_bounds=9 #equiv=1 
  8.38e-05s  0.00e+00d  [MaxClique] Merged 37(74 literals) into 12(24 literals) at_most_ones. 
  7.51e-04s  0.00e+00d  [DetectDominanceRelations] 
  6.06e-03s  0.00e+00d  [PresolveToFixPoint] #num_loops=5 #num_dual_strengthening=3 
  2.27e-03s  0.00e+00d  [ProcessAtMostOneAndLinear] 
  1.17e-03s  0.00e+00d  [DetectDuplicateConstraints] #duplicates=195 #without_enforcements=255 
  9.15e-04s  7.13e-05d  [DetectDominatedLinearConstraints] #relevant_constraints=1'748 #num_inclusions=1'551 
  2.30e-04s  0.00e+00d  [DetectDifferentVariables] #different=28 #cliques=1 #size=6 
  2.21e-04s  2.15e-05d  [ProcessSetPPC] #relevant_constraints=1'279 
  1.41e-05s  0.00e+00d  [FindAlmostIdenticalLinearConstraints] 
  8.16e-05s  6.97e-05d  [FindBigAtMostOneAndLinearOverlap] 
  2.15e-03s  1.41e-03d  [FindBigVerticalLinearOverlap] #blocks=27 #saved_nz=2'977 
  1.39e-04s  5.22e-05d  [FindBigHorizontalLinearOverlap] #linears=1'229 
  1.39e-05s  0.00e+00d  [MergeClauses] 
  8.22e-04s  0.00e+00d  [DetectDominanceRelations] 
  1.02e-02s  0.00e+00d  [PresolveToFixPoint] #num_loops=2 #num_dual_strengthening=1 
  8.14e-04s  0.00e+00d  [DetectDominanceRelations] 
  5.82e-03s  0.00e+00d  [PresolveToFixPoint] #num_loops=1 #num_dual_strengthening=1 
[Symmetry] Graph for symmetry has 2'598 nodes and 17'069 arcs.
[Symmetry] Symmetry computation done. time: 0.000393861 dtime: 0.00090842
  4.30e-03s  9.81e-04d  [Probe] #probed=244 #new_bounds=15 
  7.18e-06s  0.00e+00d  [MaxClique] 
  8.07e-04s  0.00e+00d  [DetectDominanceRelations] 
  8.11e-03s  0.00e+00d  [PresolveToFixPoint] #num_loops=2 #num_dual_strengthening=1 
  1.86e-03s  0.00e+00d  [ProcessAtMostOneAndLinear] 
  1.01e-03s  0.00e+00d  [DetectDuplicateConstraints] #without_enforcements=299 
  4.11e-04s  3.46e-05d  [DetectDominatedLinearConstraints] #relevant_constraints=1'300 #num_inclusions=19 
  1.07e-04s  0.00e+00d  [DetectDifferentVariables] 
  1.95e-04s  1.48e-05d  [ProcessSetPPC] #relevant_constraints=1'125 
  1.79e-05s  6.00e-08d  [FindAlmostIdenticalLinearConstraints] #num_tested_pairs=4 
  3.90e-05s  4.20e-05d  [FindBigAtMostOneAndLinearOverlap] 
  1.13e-03s  1.02e-03d  [FindBigVerticalLinearOverlap] #blocks=15 #saved_nz=748 
  1.20e-04s  4.31e-05d  [FindBigHorizontalLinearOverlap] #linears=1'061 
  7.07e-06s  0.00e+00d  [MergeClauses] 
  7.94e-04s  0.00e+00d  [DetectDominanceRelations] 
  7.41e-03s  0.00e+00d  [PresolveToFixPoint] #num_loops=2 #num_dual_strengthening=1 
  7.99e-04s  0.00e+00d  [DetectDominanceRelations] 
  5.68e-03s  0.00e+00d  [PresolveToFixPoint] #num_loops=1 #num_dual_strengthening=1 
[Symmetry] Graph for symmetry has 2'637 nodes and 16'330 arcs.
[Symmetry] Symmetry computation done. time: 0.000360312 dtime: 0.0008832
  3.91e-03s  9.70e-04d  [Probe] #probed=244 #new_bounds=12 
  8.16e-06s  0.00e+00d  [MaxClique] 
  7.94e-04s  0.00e+00d  [DetectDominanceRelations] 
  7.12e-03s  0.00e+00d  [PresolveToFixPoint] #num_loops=2 #num_dual_strengthening=1 
  1.79e-03s  0.00e+00d  [ProcessAtMostOneAndLinear] 
  1.01e-03s  0.00e+00d  [DetectDuplicateConstraints] #without_enforcements=316 
  3.85e-04s  3.05e-05d  [DetectDominatedLinearConstraints] #relevant_constraints=1'283 #num_inclusions=19 
  1.04e-04s  0.00e+00d  [DetectDifferentVariables] 
  1.80e-04s  1.26e-05d  [ProcessSetPPC] #relevant_constraints=1'037 
  2.00e-05s  2.70e-07d  [FindAlmostIdenticalLinearConstraints] #num_tested_pairs=16 
  3.61e-05s  3.58e-05d  [FindBigAtMostOneAndLinearOverlap] 
  1.27e-03s  9.49e-04d  [FindBigVerticalLinearOverlap] #blocks=21 #saved_nz=1'269 
  1.07e-04s  3.30e-05d  [FindBigHorizontalLinearOverlap] #linears=916 
  7.06e-06s  0.00e+00d  [MergeClauses] 
  7.54e-04s  0.00e+00d  [DetectDominanceRelations] 
  7.29e-03s  0.00e+00d  [PresolveToFixPoint] #num_loops=2 #num_dual_strengthening=1 
  5.66e-05s  0.00e+00d  [ExpandObjective] #entries=257 #tight_variables=106 #tight_constraints=60 

Presolve summary:
  - 55 affine relations were detected.
  - rule 'TODO dual: only one blocking constraint?' was applied 519 times.
  - rule 'TODO dual: only one blocking enforced constraint?' was applied 78 times.
  - rule 'TODO dual: only one unspecified blocking constraint?' was applied 44 times.
  - rule 'TODO duplicate: identical constraint with different enforcements' was applied 870 times.
  - rule 'affine: new relation' was applied 55 times.
  - rule 'at_most_one: removed literals' was applied 12 times.
  - rule 'at_most_one: size one' was applied 12 times.
  - rule 'at_most_one: transformed into max clique.' was applied 1 time.
  - rule 'deductions: 192 stored' was applied 1 time.
  - rule 'dual: fix variable' was applied 21 times.
  - rule 'dual: reduced domain' was applied 31 times.
  - rule 'duplicate: merged rhs of linear constraint' was applied 51 times.
  - rule 'duplicate: removed constraint' was applied 195 times.
  - rule 'enforcement: false literal' was applied 8 times.
  - rule 'exactly_one: x and not(x)' was applied 1 time.
  - rule 'incompatible linear: add implication' was applied 45 times.
  - rule 'linear matrix: common vertical rectangle' was applied 63 times.
  - rule 'linear: always true' was applied 717 times.
  - rule 'linear: doubleton free' was applied 10 times.
  - rule 'linear: empty' was applied 28 times.
  - rule 'linear: extracted enforcement literal' was applied 5'731 times.
  - rule 'linear: fixed or dup variables' was applied 2'575 times.
  - rule 'linear: positive equal one' was applied 3 times.
  - rule 'linear: reduced variable domains' was applied 145 times.
  - rule 'linear: remapped using affine relations' was applied 2'528 times.
  - rule 'linear: simplified rhs' was applied 6'039 times.
  - rule 'linear: tightened into equality' was applied 5 times.
  - rule 'linear: variable substitution 1' was applied 10 times.
  - rule 'no_overlap: inferred from x != y constraints' was applied 1 time.
  - rule 'presolve: 80 unused variables removed.' was applied 1 time.
  - rule 'presolve: iteration' was applied 3 times.
  - rule 'probing: reduced enforced constraint to implication.' was applied 37 times.
  - rule 'symmetry: fixed to false in general orbit' was applied 1 time.

Presolved optimization model '': (model_fingerprint: 0x540f9ec447bc9656)
#Variables: 176 (#ints: 8 in objective)
  - 62 Booleans in [0,1]
  - 1 in [-3169,-2668][-2601,-2017][-1950,-1366][-1299,-715][-648,-64][3,587][654,1238][1305,1823]
  - 1 in [-3157,-2668][-2601,-2017][-1950,-1366][-1299,-715][-648,-64][3,587][654,1238][1305,1768]
  - 1 in [-3154,-2668][-2601,-2017][-1950,-1366][-1299,-715][-648,-64][3,587][654,1238][1305,1768]
  - 1 in [-3097,-2668][-2601,-2017][-1950,-1366][-1299,-715][-648,-64][3,587][654,1238][1305,1823]
  - 1 in [-2601,-2017][-1950,-1366][-1299,-715][-6 ... 3,587][654,1238][1305,1889][1956,2540][2607,3191]
  - 1 in [-2505,-2017][-1950,-1366][-1299,-715][-648,-64][3,587][654,1238][1305,1889][1956,2419]
  - 1 in [-1950,-1380][-1299,-729][-648,-78][3,573][654,1224][1305,1875][1956,2526]
  - 1 in [-1891,-1363][-1240,-712][-589,-61][62,590][713,1241][1364,1892][2015,2481]
  - 1 in [-1871,-1362][-1299,-711][-648,-60][3,591][654,1242][1305,1893][1956,2544][2607,3129]
  - 1 in [-1871,-1362][-1299,-711][-648,-60][3,591 ... 1242][1305,1893][1956,2544][2607,3195][3258,3725]
  - 1 in [-1867,-1366][-1299,-715][-648,-64][3,587][654,1117]
  - 1 in [-1867,-1366][-1299,-715][-648,-64][3,587][654,1238][1305,1768]
  - 1 in [-1299,-715][-648,-64][3,587][654,1238]
  - 1 in [-1299,-715][-648,-64][3,587][654,1238][1305,1889]
  - 1 in [-1240,-712][-589,-61][62,590][713,1241][1364,1892][2015,2543][2666,3130]
  - 1 in [-1225,-717][-653,-66][-2,464]
  - 1 in [-1220,-711][-648,-60][3,591][654,1242][1305,1893][1956,2544][2607,3195][3258,3725]
  - 1 in [-1216,-715][-648,-64][3,587][654,1182]
  - 2 in [-1216,-715][-648,-64][3,587][654,1238][1305,1823]
  - 3 in [-651,-72][0,579]
  - 2 in [-651,-66][0,585]
  - 1 in [-648,-78][3,573][654,1224][1305,1875]
  - 1 in [-648,-64][3,587][654,1238]
  - 1 in [-574,-66][-2,551]
  - 1 in [-569,-63][3,588][654,1239][1305,1890][1956,2541][2607,3158]
  - 1 in [-569,-63][3,588][654,1239][1305,1890][1956,2541][2607,3192][3258,3843][3909,4460]
  - 1 in [-569,-60][3,591][654,1242][1305,1893][1956,2544][2607,3195][3258,3846][3909,4376]
  - 1 in [-565,-64][3,587][654,1204]
  - 1 in [-565,-64][3,587][654,1238][1305,1823]
  - 1 in [-2,526]
  - 1 in [-2,585]
  - 1 in [0,460]
  - 1 in [0,469]
  - 4 in [0,501]
  - 2 in [0,504]
  - 2 in [0,505]
  - 1 in [0,515]
  - 3 in [0,528]
  - 1 in [0,528][651,1179]
  - 1 in [0,567]
  - 1 in [0,570]
  - 3 in [0,579]
  - 1 in [0,584]
  - 3 in [0,585]
  - 1 in [0,587]
  - 1 in [0,588]
  - 1 in [3,531]
  - 1 in [3,573]
  - 1 in [3,573][654,1224]
  - 1 in [3,573][654,1224][1305,1875]
  - 1 in [3,582]
  - 1 in [3,582][654,1224]
  - 1 in [3,587]
  - 1 in [3,587][654,1238]
  - 1 in [3,588]
  - 1 in [3,588][654,1239]
  - 1 in [3,590]
  - 1 in [3,591]
  - 1 in [3,591][654,1242]
  - 1 in [6,591][654,1242][1305,1772]
  - 1 in [8,593]
  - 1 in [12,591]
  - 1 in [12,591][663,1242]
  - 1 in [14,601]
  - 1 in [15,599]
  - 1 in [17,596]
  - 1 in [43,613]
  - 1 in [48,618]
  - 1 in [53,640]
  - 1 in [55,640]
  - 1 in [56,640]
  - 1 in [62,590]
  - 1 in [62,590][713,1241]
  - 1 in [62,590][713,1241][1364,1830]
  - 1 in [62,590][713,1241][1364,1892][2015,2481]
  - 1 in [62,590][713,1241][1364,1892][2015,2543][2666,3132]
  - 1 in [69,591][654,1242][1305,1893][1956,2423]
  - 1 in [69,591][654,1242][1305,1893][1956,2544][2607,3074]
  - 1 in [73,591][654,1242][1305,1837]
  - 1 in [73,591][654,1242][1305,1893][1956,2478]
  - 1 in [73,640]
  - 1 in [82,588][654,1239][1305,1856]
  - 1 in [82,588][654,1239][1305,1890][1956,2507]
  - 1 in [82,588][654,1239][1305,1890][1956,2541][2607,3158]
  - 1 in [82,591][654,1242][1305,1893][1956,2423]
  - 2 in [82,591][654,1242][1305,1893][1956,2544][2607,3074]
  - 1 in [82,591][654,1242][1305,1893][1956,2544][2607,3129]
  - 1 in [82,591][654,1242][1305,1893][1956,2544][2607,3195][3258,3725]
  - 1 in [82,591][654,1242][1305,1893][1956,2544][2607,3195][3258,3846][3909,4497][4560,5027]
  - 2 in [125,640]
  - 4 in [139,640]
  - 3 in [150,651]
#kExactlyOne: 2 (#literals: 6)
#kInterval: 6
#kLinear2: 780 (#enforced: 749 #multi: 665)
#kLinear3: 171 (#enforced: 101)
#kLinearN: 1'097 (#enforced: 1'012 #multi: 31) (#terms: 7'327)
#kNoOverlap: 1 (#intervals: 6)

Preloading model.
#Bound   0.12s best:inf   next:[187,4455] initial_domain
[Symmetry] Graph for symmetry has 2'545 nodes and 15'072 arcs.
[Symmetry] Symmetry computation done. time: 0.000346031 dtime: 0.00085647
#Model   0.12s var:176/176 constraints:2057/2057

Starting search at 0.12s with 32 workers.
17 full problem subsolvers: [core, default_lp, fixed, lb_tree_search, max_lp, no_lp, objective_lb_search, objective_lb_search_max_lp, objective_lb_search_no_lp, objective_shaving_search_max_lp, objective_shaving_search_no_lp, probing, probing_max_lp, pseudo_costs, quick_restart, quick_restart_no_lp, reduced_costs]
13 first solution subsolvers: [fj_long_default, fj_long_lin_default, fj_long_random, fj_short_default, fj_short_lin_default, fj_short_lin_random, fj_short_random, fs_random(2), fs_random_no_lp, fs_random_quick_restart(2), fs_random_quick_restart_no_lp]
13 incomplete subsolvers: [feasibility_pump, graph_arc_lns, graph_cst_lns, graph_dec_lns, graph_var_lns, rins/rens, rnd_cst_lns, rnd_var_lns, scheduling_intervals_lns, scheduling_precedences_lns, scheduling_time_window_lns, violation_ls(2)]
3 helper subsolvers: [neighborhood_helper, synchronization_agent, update_gap_integral]
#Bound   0.13s best:inf   next:[233,4455] default_lp
#1       0.14s best:1965  next:[233,1964] no_lp (fixed_bools=0/91)
#Bound   0.14s best:1965  next:[242,1964] objective_lb_search_no_lp
#Bound   0.15s best:1965  next:[243,1964] bool_core (num_cores=1 [cover] a=7 d=1 fixed=8/97 clauses=47)
#Bound   0.15s best:1965  next:[244,1964] bool_core (num_cores=1 [cover] a=7 d=1 fixed=9/100 clauses=57)
#Bound   0.15s best:1965  next:[364,1964] objective_lb_search_no_lp
#2       0.15s best:1839  next:[364,1838] no_lp (fixed_bools=0/102)
#Bound   0.16s best:1839  next:[369,1838] quick_restart
#Bound   0.17s best:1839  next:[377,1838] quick_restart
#3       0.20s best:1798  next:[377,1797] violation_ls(batch:2 #solutions_imported:2 #lin_moves:3'024 #lin_evals:10'930 #weight_updates:452)
#4       0.20s best:1727  next:[377,1726] graph_dec_lns (d=0.71 s=50 t=0.10 p=1.00 stall=1 h=auto_l0) [presolve]
#5       0.21s best:1715  next:[377,1714] no_lp (fixed_bools=0/114)
#6       0.24s best:1654  next:[377,1653] quick_restart (fixed_bools=0/95)
#Bound   0.27s best:1654  next:[389,1653] quick_restart
#Bound   0.27s best:1654  next:[390,1653] quick_restart
#7       0.28s best:1632  next:[390,1631] no_lp (fixed_bools=1/138)
#8       0.28s best:1614  next:[390,1613] no_lp (fixed_bools=1/140)
#9       0.30s best:1600  next:[390,1599] no_lp (fixed_bools=1/148)
#Bound   0.32s best:1600  next:[425,1599] objective_lb_search
#10      0.40s best:1599  next:[425,1598] violation_ls(batch:4 #solutions_imported:4 #lin_moves:14'480 #lin_evals:81'319 #gen_moves:3'084 #gen_evals:792 #comp_moves:180 #backtracks:1'452 #weight_updates:5'571)
#11      0.40s best:1598  next:[425,1597] violation_ls(batch:4 #solutions_imported:4 #lin_moves:12'380 #lin_evals:52'124 #weight_updates:1'097)
#12      0.40s best:1592  next:[425,1591] graph_dec_lns (d=0.81 s=61 t=0.10 p=1.00 stall=0 h=auto_l0)
#Bound   0.45s best:1592  next:[623,1591] objective_lb_search_no_lp
#Bound   0.46s best:1592  next:[624,1591] objective_lb_search_no_lp
#13      0.47s best:1588  next:[624,1587] graph_arc_lns (d=0.88 s=73 t=0.10 p=1.00 stall=3 h=auto_l0) [presolve]
#Bound   0.47s best:1588  next:[625,1587] objective_lb_search_no_lp
#Bound   0.48s best:1588  next:[627,1587] objective_lb_search_no_lp
#14      0.49s best:1576  next:[627,1575] no_lp (fixed_bools=1/195)
#Bound   0.50s best:1576  next:[678,1575] objective_lb_search_no_lp
#Bound   0.51s best:1576  next:[735,1575] objective_lb_search_no_lp
#15      0.52s best:1553  next:[735,1552] no_lp (fixed_bools=1/210)
#16      0.53s best:1544  next:[735,1543] violation_ls(batch:5 #solutions_imported:5 #lin_moves:15'670 #lin_evals:86'134 #gen_moves:3'084 #gen_evals:792 #comp_moves:180 #backtracks:1'452 #weight_updates:5'735)
#17      0.54s best:1543  next:[735,1542] violation_ls(batch:5 #solutions_imported:5 #lin_moves:12'380 #lin_evals:52'138 #gen_moves:8 #gen_evals:1 #comp_moves:4 #backtracks:2 #weight_updates:1'097)
#18      0.55s best:1515  next:[735,1514] no_lp (fixed_bools=1/211)
#19      0.57s best:1499  next:[735,1498] no_lp (fixed_bools=1/212)
#20      0.57s best:1498  next:[735,1497] no_lp (fixed_bools=1/212)
#21      0.58s best:1461  next:[735,1460] no_lp (fixed_bools=1/229)
#22      0.59s best:1419  next:[735,1418] quick_restart (fixed_bools=0/103)
#23      0.60s best:1418  next:[735,1417] no_lp (fixed_bools=1/233)
#24      0.61s best:1414  next:[735,1413] graph_var_lns (d=0.88 s=83 t=0.10 p=1.00 stall=3 h=auto_l0)
#Bound   0.62s best:1414  next:[838,1413] objective_lb_search_no_lp
#25      0.62s best:1404  next:[838,1403] graph_arc_lns (d=0.91 s=85 t=0.10 p=1.00 stall=0 h=auto_l0)
#26      0.63s best:1387  next:[838,1386] no_lp (fixed_bools=1/239)
#27      0.64s best:1386  next:[838,1385] no_lp (fixed_bools=1/239)
#28      0.65s best:1323  next:[838,1322] scheduling_time_window_lns (d=0.50 s=65 t=0.10 p=0.00 stall=0 h=auto_l0)
#Bound   0.65s best:1323  next:[853,1322] objective_lb_search_no_lp
#29      0.67s best:1318  next:[853,1317] no_lp (fixed_bools=1/248)
#30      0.67s best:1310  next:[853,1309] no_lp (fixed_bools=1/260)
#31      0.68s best:1307  next:[853,1306] no_lp (fixed_bools=1/265)
#32      0.68s best:1303  next:[853,1302] no_lp (fixed_bools=1/272)
#33      0.68s best:1254  next:[853,1253] no_lp (fixed_bools=1/276)
#Bound   0.69s best:1254  next:[854,1253] objective_lb_search_no_lp
#34      0.69s best:1237  next:[854,1236] no_lp (fixed_bools=1/282)
#35      0.70s best:1226  next:[854,1225] no_lp (fixed_bools=1/291)
#36      0.71s best:1197  next:[854,1196] no_lp (fixed_bools=1/297)
#37      0.73s best:1196  next:[854,1195] no_lp (fixed_bools=1/302)
#38      0.73s best:1195  next:[854,1194] no_lp (fixed_bools=1/302)
#39      0.74s best:1189  next:[854,1188] no_lp (fixed_bools=1/311)
#40      0.75s best:1187  next:[854,1186] no_lp (fixed_bools=1/312)
#41      0.76s best:1185  next:[854,1184] no_lp (fixed_bools=1/313)
#Bound   0.76s best:1185  next:[873,1184] objective_lb_search_no_lp
#42      0.77s best:1184  next:[873,1183] no_lp (fixed_bools=1/317)
#43      0.78s best:1182  next:[873,1181] no_lp (fixed_bools=1/324)
#44      0.78s best:1166  next:[873,1165] no_lp (fixed_bools=1/325)
#45      0.78s best:1163  next:[873,1162] no_lp (fixed_bools=1/326)
#46      0.78s best:1162  next:[873,1161] no_lp (fixed_bools=1/326)
#47      0.80s best:1128  next:[873,1127] scheduling_time_window_lns (d=0.50 s=90 t=0.10 p=0.00 stall=0 h=auto_l0)
#48      0.86s best:1124  next:[873,1123] no_lp (fixed_bools=2/338)
#Bound   0.92s best:1124  next:[876,1123] objective_lb_search_no_lp [skipped_logs=0]
#Bound   1.95s best:1124  next:[975,1123] objective_lb_search_no_lp [skipped_logs=12]
#Model   2.02s var:175/176 constraints:1875/2057
#Model   2.10s var:173/176 constraints:1783/2057
#Model   2.14s var:172/176 constraints:1684/2057
#Model   2.24s var:170/176 constraints:1474/2057
#Model   2.25s var:160/176 constraints:1109/2057
#Done    2.25s no_lp
#Done    2.25s objective_lb_search_no_lp
#Done    2.26s reduced_costs
#Model   2.26s var:153/176 constraints:832/2057
#Done    2.26s core
#Bound   2.25s best:1124  next:[1081,1123] objective_lb_search_no_lp [skipped_logs=4]

Task timing                                  n [     min,      max]      avg      dev     time         n [     min,      max]      avg      dev    dtime
                             'core':         1 [   2.14s,    2.14s]    2.14s   0.00ns    2.14s         1 [   2.77s,    2.77s]    2.77s   0.00ns    2.77s
                       'default_lp':         1 [   2.14s,    2.14s]    2.14s   0.00ns    2.14s         1 [446.32ms, 446.32ms] 446.32ms   0.00ns 446.32ms
                 'feasibility_pump':        16 [  6.51ms, 575.63ms]  72.93ms 132.54ms    1.17s        15 [  8.06ms,  14.42ms]   8.50ms   1.58ms 127.44ms
                            'fixed':         1 [   2.14s,    2.14s]    2.14s   0.00ns    2.14s         1 [489.90ms, 489.90ms] 489.90ms   0.00ns 489.90ms
                  'fj_long_default':         1 [280.24ms, 280.24ms] 280.24ms   0.00ns 280.24ms         1 [ 84.66ms,  84.66ms]  84.66ms   0.00ns  84.66ms
              'fj_long_lin_default':         1 [176.21ms, 176.21ms] 176.21ms   0.00ns 176.21ms         1 [ 80.69ms,  80.69ms]  80.69ms   0.00ns  80.69ms
                   'fj_long_random':         1 [272.97ms, 272.97ms] 272.97ms   0.00ns 272.97ms         1 [ 83.22ms,  83.22ms]  83.22ms   0.00ns  83.22ms
                 'fj_short_default':         1 [ 44.69ms,  44.69ms]  44.69ms   0.00ns  44.69ms         1 [ 80.39ms,  80.39ms]  80.39ms   0.00ns  80.39ms
             'fj_short_lin_default':         1 [ 91.14ms,  91.14ms]  91.14ms   0.00ns  91.14ms         1 [ 81.67ms,  81.67ms]  81.67ms   0.00ns  81.67ms
              'fj_short_lin_random':         1 [218.12ms, 218.12ms] 218.12ms   0.00ns 218.12ms         1 [ 80.36ms,  80.36ms]  80.36ms   0.00ns  80.36ms
                  'fj_short_random':         1 [ 84.39ms,  84.39ms]  84.39ms   0.00ns  84.39ms         1 [ 77.04ms,  77.04ms]  77.04ms   0.00ns  77.04ms
                        'fs_random':         1 [ 16.65ms,  16.65ms]  16.65ms   0.00ns  16.65ms         0 [  0.00ns,   0.00ns]   0.00ns   0.00ns   0.00ns
                        'fs_random':         1 [ 17.59ms,  17.59ms]  17.59ms   0.00ns  17.59ms         1 [ 20.00ns,  20.00ns]  20.00ns   0.00ns  20.00ns
                  'fs_random_no_lp':         1 [ 13.07ms,  13.07ms]  13.07ms   0.00ns  13.07ms         1 [100.56us, 100.56us] 100.56us   0.00ns 100.56us
          'fs_random_quick_restart':         1 [ 15.30ms,  15.30ms]  15.30ms   0.00ns  15.30ms         1 [ 20.00ns,  20.00ns]  20.00ns   0.00ns  20.00ns
          'fs_random_quick_restart':         1 [ 16.97ms,  16.97ms]  16.97ms   0.00ns  16.97ms         1 [ 20.00ns,  20.00ns]  20.00ns   0.00ns  20.00ns
    'fs_random_quick_restart_no_lp':         1 [ 11.68ms,  11.68ms]  11.68ms   0.00ns  11.68ms         1 [ 73.82us,  73.82us]  73.82us   0.00ns  73.82us
                    'graph_arc_lns':        16 [  2.62ms, 479.35ms] 108.80ms 125.64ms    1.74s        15 [ 10.00ns, 100.02ms]  14.61ms  29.35ms 219.11ms
                    'graph_cst_lns':        15 [909.37us, 209.74ms]  36.19ms  54.39ms 542.79ms         9 [ 10.00ns,   5.79ms]   1.16ms   1.87ms  10.48ms
                    'graph_dec_lns':        15 [  3.12ms, 468.00ms] 125.77ms 153.30ms    1.89s        14 [ 10.00ns, 100.10ms]  22.38ms  36.17ms 313.32ms
                    'graph_var_lns':        16 [  1.78ms, 417.86ms] 121.42ms 117.13ms    1.94s        13 [ 10.00ns, 122.21ms]  14.87ms  32.97ms 193.34ms
                   'lb_tree_search':         1 [   2.13s,    2.13s]    2.13s   0.00ns    2.13s         1 [622.74ms, 622.74ms] 622.74ms   0.00ns 622.74ms
                           'max_lp':         1 [   2.13s,    2.13s]    2.13s   0.00ns    2.13s         1 [563.93ms, 563.93ms] 563.93ms   0.00ns 563.93ms
                            'no_lp':         1 [   2.13s,    2.13s]    2.13s   0.00ns    2.13s         1 [500.87ms, 500.87ms] 500.87ms   0.00ns 500.87ms
              'objective_lb_search':         1 [   2.14s,    2.14s]    2.14s   0.00ns    2.14s         1 [496.05ms, 496.05ms] 496.05ms   0.00ns 496.05ms
       'objective_lb_search_max_lp':         1 [   2.13s,    2.13s]    2.13s   0.00ns    2.13s         1 [511.75ms, 511.75ms] 511.75ms   0.00ns 511.75ms
        'objective_lb_search_no_lp':         1 [   2.12s,    2.12s]    2.12s   0.00ns    2.12s         1 [421.05ms, 421.05ms] 421.05ms   0.00ns 421.05ms
  'objective_shaving_search_max_lp':        16 [ 21.04ms, 284.00ms] 109.05ms  79.98ms    1.74s        15 [778.30us,  51.22ms]   8.70ms  13.09ms 130.47ms
   'objective_shaving_search_no_lp':        16 [ 24.25ms, 238.02ms] 102.98ms  64.25ms    1.65s        14 [745.09us,  36.43ms]   8.82ms   9.84ms 123.47ms
                          'probing':         1 [   2.13s,    2.13s]    2.13s   0.00ns    2.13s         1 [162.91ms, 162.91ms] 162.91ms   0.00ns 162.91ms
                   'probing_max_lp':         1 [   2.14s,    2.14s]    2.14s   0.00ns    2.14s         1 [383.58ms, 383.58ms] 383.58ms   0.00ns 383.58ms
                     'pseudo_costs':         1 [   2.13s,    2.13s]    2.13s   0.00ns    2.13s         1 [480.51ms, 480.51ms] 480.51ms   0.00ns 480.51ms
                    'quick_restart':         1 [   2.13s,    2.13s]    2.13s   0.00ns    2.13s         1 [469.38ms, 469.38ms] 469.38ms   0.00ns 469.38ms
              'quick_restart_no_lp':         1 [   2.13s,    2.13s]    2.13s   0.00ns    2.13s         1 [468.00ms, 468.00ms] 468.00ms   0.00ns 468.00ms
                    'reduced_costs':         1 [   2.13s,    2.13s]    2.13s   0.00ns    2.13s         1 [436.04ms, 436.04ms] 436.04ms   0.00ns 436.04ms
                        'rins/rens':        16 [  1.61ms, 470.96ms] 248.52ms 179.71ms    3.98s        14 [ 10.00ns, 100.11ms]  58.89ms  43.09ms 824.50ms
                      'rnd_cst_lns':        16 [667.39us,  53.67ms]  11.68ms  15.45ms 186.93ms         7 [ 10.00ns, 776.68us] 161.42us 274.77us   1.13ms
                      'rnd_var_lns':        16 [  1.67ms, 452.80ms] 114.07ms 117.63ms    1.83s        14 [ 10.00ns, 100.24ms]  19.36ms  31.20ms 271.01ms
         'scheduling_intervals_lns':        15 [ 79.35ms,    1.29s] 472.17ms 379.39ms    7.08s        13 [  7.22ms, 116.74ms]  72.99ms  35.75ms 948.82ms
       'scheduling_precedences_lns':        15 [  7.16ms,    1.08s] 395.07ms 311.96ms    5.93s        13 [ 20.66ms, 100.16ms]  67.58ms  31.53ms 878.50ms
       'scheduling_time_window_lns':        15 [  6.69ms, 824.10ms] 225.32ms 209.96ms    3.38s        14 [  7.12ms,  75.98ms]  20.08ms  18.35ms 281.07ms
                     'violation_ls':        16 [  6.43ms,  60.36ms]  33.50ms  15.68ms 535.97ms        16 [700.00ns,  79.03ms]  53.95ms  30.53ms 863.12ms
                     'violation_ls':        16 [ 11.95ms,  60.96ms]  44.26ms  14.23ms 708.11ms        16 [  9.02ms,  84.02ms]  61.37ms  25.16ms 981.97ms

Search stats                        Bools  Conflicts  Branches  Restarts  BoolPropag  IntegerPropag
                           'core':  3'713      1'719    12'572     3'602   2'733'947      1'343'604
                     'default_lp':    168      1'240     6'389     1'639      56'583        787'798
                          'fixed':  1'073      4'130    12'847       939   1'294'009      1'277'685
                      'fs_random':     62          0       100       100          12          1'495
                      'fs_random':     62          0       122       122          12          1'806
                'fs_random_no_lp':     66          1       129       124          50          2'267
        'fs_random_quick_restart':     62          0       122       122          12          1'806
        'fs_random_quick_restart':     62          0        98        98          12          1'455
  'fs_random_quick_restart_no_lp':     62          0       145       124          14          2'145
                 'lb_tree_search':     77         56     4'266     1'225       7'026        160'237
                         'max_lp':     62        733     3'745       993      18'429        477'344
                          'no_lp':    581      3'681    15'427     2'266     539'831      1'978'364
            'objective_lb_search':     82      1'004     6'795     2'581      24'905        719'626
     'objective_lb_search_max_lp':     86        505     2'471     1'180      14'087        256'674
      'objective_lb_search_no_lp':    118      3'331     9'144     1'886      72'587      1'786'222
                        'probing':    159         39       279       279       1'076          9'731
                 'probing_max_lp':    119         19       219       219         587          6'312
                   'pseudo_costs':     62        608     6'062     1'715      21'446        570'881
                  'quick_restart':    298      1'006    13'320     3'675     219'474        892'434
            'quick_restart_no_lp':    946      3'729    14'333     1'892     812'874      1'583'833
                  'reduced_costs':    490        796    12'979     2'609     156'590        536'359

SAT stats                           ClassicMinim  LitRemoved  LitLearned  LitForgotten  Subsumed  MClauses  MDecisions  MLitTrue  MSubsumed  MLitRemoved  MReused
                           'core':         1'214       5'653       4'713             0         6     1'350       6'756         0         10           34        6
                     'default_lp':           696       1'847       9'879             0       103       479       3'414         0        155          922       88
                          'fixed':         2'065       4'121      49'385             0        51       499       4'862         0        306        2'319      135
                      'fs_random':             0           0           0             0         0         0           0         0          0            0        0
                      'fs_random':             0           0           0             0         0         0           0         0          0            0        0
                'fs_random_no_lp':             0           0           2             0         0         0           0         0          0            0        0
        'fs_random_quick_restart':             0           0           0             0         0         0           0         0          0            0        0
        'fs_random_quick_restart':             0           0           0             0         0         0           0         0          0            0        0
  'fs_random_quick_restart_no_lp':             0           0           0             0         0         0           0         0          0            0        0
                 'lb_tree_search':             2           2         186             0         0       228       1'160         0          6           26       27
                         'max_lp':           418       1'067       5'872             0        53       369       2'404         1        121          637       47
                          'no_lp':         2'648       7'914      40'914             0        97       553       3'617         0        110          624       71
            'objective_lb_search':           736       2'059       7'429             0        75       506       3'240         0        100          570       91
     'objective_lb_search_max_lp':           369       1'065       4'315             0        27        96         476         0         22          112       17
      'objective_lb_search_no_lp':         2'614       9'161      21'700             0       130       624       4'261         0        261        1'447      139
                        'probing':             0           0          39             0         0         0           0         0          0            0        0
                 'probing_max_lp':             0           0          19             0         0         0           0         0          0            0        0
                   'pseudo_costs':           366         788       4'898             0        42       574       4'311         0        143          778      115
                  'quick_restart':           493       1'124       7'109             0        95     1'055       8'887         0        340        2'304      269
            'quick_restart_no_lp':         1'965       6'426      34'354             0        58       566       4'366        13        296        2'132       91
                  'reduced_costs':           398       1'108       7'555             0        21       371       2'251         0         86          468       40

Lp stats                         Component  Iterations  AddedCuts  OPTIMAL  DUAL_F.  DUAL_U.
                  'default_lp':          1      13'324      2'437    2'419        0        0
                       'fixed':          1       2'530      1'063    4'312        0        0
                   'fs_random':          1           0          0        0        0        0
                   'fs_random':          1           0          0        0        0        0
     'fs_random_quick_restart':          1           0          0        0        0        0
     'fs_random_quick_restart':          1           0          0        0        0        0
              'lb_tree_search':          1      16'392      2'150    1'423      418        0
                      'max_lp':          1      14'799      1'724    1'228      377        0
         'objective_lb_search':          1      16'682      2'163    2'348        0        0
  'objective_lb_search_max_lp':          1      16'749      1'915    1'105      342        1
                     'probing':          1       1'357      1'664      455        0        1
              'probing_max_lp':          1       1'757      1'735      119        2        0
                'pseudo_costs':          1      13'862      2'057    1'112      326        0
               'quick_restart':          1      10'302      2'100    1'500        0        0
               'reduced_costs':          1       8'388      2'544    1'204      129        0

Lp dimension                                                                       Final dimension of first component
                  'default_lp':     316 rows, 171 columns, 712 entries with magnitude in [9.812429e-03, 1.000000e+00]
                       'fixed':      96 rows, 171 columns, 320 entries with magnitude in [6.005186e-02, 1.000000e+00]
                   'fs_random':         0 rows, 171 columns, 0 entries with magnitude in [0.000000e+00, 0.000000e+00]
                   'fs_random':         0 rows, 171 columns, 0 entries with magnitude in [0.000000e+00, 0.000000e+00]
     'fs_random_quick_restart':         0 rows, 171 columns, 0 entries with magnitude in [0.000000e+00, 0.000000e+00]
     'fs_random_quick_restart':         0 rows, 171 columns, 0 entries with magnitude in [0.000000e+00, 0.000000e+00]
              'lb_tree_search':    474 rows, 176 columns, 1413 entries with magnitude in [3.236851e-03, 1.000000e+00]
                      'max_lp':    416 rows, 176 columns, 1684 entries with magnitude in [1.195078e-03, 1.000000e+00]
         'objective_lb_search':    356 rows, 171 columns, 1078 entries with magnitude in [3.865213e-03, 1.000000e+00]
  'objective_lb_search_max_lp':    547 rows, 176 columns, 2100 entries with magnitude in [2.898368e-04, 1.000000e+00]
                     'probing':    288 rows, 171 columns, 1214 entries with magnitude in [7.958267e-04, 1.000000e+00]
              'probing_max_lp':  3000 rows, 176 columns, 21693 entries with magnitude in [3.202477e-05, 1.000000e+00]
                'pseudo_costs':    757 rows, 176 columns, 3739 entries with magnitude in [1.711622e-04, 1.000000e+00]
               'quick_restart':    360 rows, 171 columns, 1237 entries with magnitude in [6.350471e-06, 1.000000e+00]
               'reduced_costs':    388 rows, 176 columns, 1590 entries with magnitude in [1.666971e-03, 1.000000e+00]

Lp debug                         CutPropag  CutEqPropag  Adjust  Overflow      Bad  BadScaling
                  'default_lp':          2            0     958         0   17'678           0
                       'fixed':          1            0     117         0    2'261           0
                   'fs_random':          0            0       0         0        0           0
                   'fs_random':          0            0       0         0        0           0
     'fs_random_quick_restart':          0            0       0         0        0           0
     'fs_random_quick_restart':          0            0       0         0        0           0
              'lb_tree_search':         10            0     784         0    9'105           0
                      'max_lp':          3            1     552         0    6'415           0
         'objective_lb_search':          1            3   1'138         0   25'541           0
  'objective_lb_search_max_lp':          9            0     640         0    9'221           0
                     'probing':          2           22     439         0  210'092           0
              'probing_max_lp':          0            1      85         0   26'965           0
                'pseudo_costs':         18            0     556         0   14'186           0
               'quick_restart':         18           14     749         0   40'500           0
               'reduced_costs':         27            1     713         0   23'627           0

Lp pool                          Constraints  Updates  Simplif  Merged  Shortened  Split  Strenghtened    Cuts/Call
                  'default_lp':        2'604      203    3'937      21      2'467    296         1'753  2'437/5'226
                       'fixed':        1'232       46       72      19          0     46           196  1'063/2'000
                   'fs_random':          188        0        0       0          0      0            10          0/0
                   'fs_random':          188        0        0       0          0      0            10          0/0
     'fs_random_quick_restart':          188        0        0       0          0      0            10          0/0
     'fs_random_quick_restart':          188        0        0       0          0      0            10          0/0
              'lb_tree_search':        4'189      237   10'546      11      3'398     70        12'767  2'150/4'151
                      'max_lp':        3'751      167    7'430      23      1'144     72        10'909  1'724/3'174
         'objective_lb_search':        2'342      266    3'837       9      2'357    485         1'798  2'163/4'400
  'objective_lb_search_max_lp':        3'949      199    8'901      16      1'241    138        12'115  1'915/3'472
                     'probing':        1'852      194       31       0          0    299           227  1'664/2'894
              'probing_max_lp':        3'780      198    1'777       5          0     83         4'236  1'735/3'482
                'pseudo_costs':        4'101      330   14'885       6      1'297    314        17'883  2'057/3'815
               'quick_restart':        2'279      377    6'191       9      1'848    852         1'491  2'100/4'319
               'reduced_costs':        4'568      256   17'220      26      1'454    605        15'467  2'544/4'709

Lp Cut                                                defaul  fixed  max_lp  quick_  reduce  pseudo  lb_tre  probin  object  probin  object
                                              CG_FF:     163     80     145     129     119     118     164     100     136     104     104
                                               CG_K:      72     51     101      52     114      76      99      32      41      66      83
                                               CG_R:      50     30     117      53      81      70     115      39      27     108      59
                                              CG_RB:     547    228     222     408     309     233     378     376     619     208     214
                                             CG_RBP:      54     24      38      62      18      39      58      37      54      31      31
                                             Clique:       -      -      24       -      33      30      37       -       -      12      34
                                                 IB:     468    279     254     395     357     339     269     297     362      97     325
                                           MIR_1_FF:     139     58     124     134     112     102     135      82     110     120      91
                                            MIR_1_K:      18      5      18      16      20      10      20       9      12       9      10
                                           MIR_1_KL:       -      -       -       -       -       -       -       1       -       -       -
                                            MIR_1_R:      12      8      18      15      19       7      15      11       9      11       5
                                           MIR_1_RB:     216     77     168     171     252     246     202     166     202     159     182
                                          MIR_1_RBP:      10      6      35       7      54      48      44       5      10      41      55
                                          MIR_1_RLT:       -      -       -       -       -       1       2       -       -       -       2
                                           MIR_2_FF:      53     19      37      63      52      42      39      33      51      45      43
                                            MIR_2_K:      13      7       3      13      11      11      11      11      10       5      14
                                           MIR_2_KL:       1      1       -       1       -       -       -       -       -       -       1
                                            MIR_2_R:      14      6       8      13      22      22      13      14      11      14      17
                                           MIR_2_RB:      68     30      51      92     114     104      73      72      78      58      76
                                          MIR_2_RBP:       3      -      11       6      22      21      16      10       5       7      17
                                           MIR_3_FF:      24     14      20      29      34      33      25      19      26      25      32
                                            MIR_3_K:      10      6       3      12       7       6      11      11      15       5       4
                                           MIR_3_KL:       3      1       -       3       -       1       -       1       1       -       -
                                            MIR_3_R:       9      5       7      13      23      22       8       8       7      19      26
                                           MIR_3_RB:      44     23      22      48      77      58      42      60      51      45      57
                                          MIR_3_RBP:       5      3       7       5      10       6       1       1       3       4       7
                                           MIR_4_FF:      14      6       9      17      22      14      21      16      12      15      22
                                            MIR_4_K:       6      3       2       9      11       5       5       5      10       4       6
                                           MIR_4_KL:       1      -       -       2       -       -       1       -       1       -       1
                                            MIR_4_R:      10      2       1       9      17      11       7      14       4       8      12
                                           MIR_4_RB:      28      6      13      28      49      26      24      33      34      22      29
                                          MIR_4_RBP:       6      -       -       -       5       4       4       -       -       -       2
                                           MIR_5_FF:      16      8      20      22      11       8      12       8      13      18       7
                                            MIR_5_K:       7      1       2       9       2       5       4       5       6       3       2
                                           MIR_5_KL:       2      -       2       -       -       -       -       -       -       -       -
                                            MIR_5_R:       7      -       7      10      10       3       5       5       1       7       4
                                           MIR_5_RB:      25      4      27      20      20       7      16      13      20      20       7
                                          MIR_5_RBP:       5      2       3       1       3       -       2       1       3       2       1
                                           MIR_6_FF:       7      6       7       9      12       3       8       8       6       2       5
                                            MIR_6_K:       9      -       -       3       2       1       -       6       2       -       1
                                            MIR_6_R:       7      2       2       4       6       1       1       2       4       2       1
                                           MIR_6_RB:      15      7       5       8      12       5       6       6       8      11       5
                                          MIR_6_RBP:       1      1       -       1       1       2       -       -       -       2       1
         NoOverlapCompletionTimeExhaustive_weighted:       -      -       7       -      14      10      13       -       -       4      13
  NoOverlapCompletionTimeExhaustive_weighted_lifted:       -      -       1       -       2       -       -       -       -       -       -
                        NoOverlapDisjunctionOnStart:       -      -       5       -       6       6       7       -       -       5       7
                                       ZERO_HALF_FF:      43     16      24      28      30      25      31      16      28      15      33
                                        ZERO_HALF_K:       5      -       5       8      10       7       7       3       5       4       8
                                        ZERO_HALF_R:     133     21     100     114     345     188     120      75     111     354     177
                                       ZERO_HALF_RB:      93     16      44      50      83      67      72      48      52      40      71
                                      ZERO_HALF_RBP:       1      1       5       8      11      14       7       5       3       4      11

LNS stats                        Improv/Calls  Closed  Difficulty  TimeLimit
               'graph_arc_lns':          2/15     87%        0.99       0.10
               'graph_cst_lns':           0/9    100%        0.98       0.10
               'graph_dec_lns':          3/15     87%        0.99       0.10
               'graph_var_lns':          1/15     80%        0.98       0.10
                   'rins/rens':          4/16     50%        0.81       0.10
                 'rnd_cst_lns':           1/8    100%        0.98       0.10
                 'rnd_var_lns':          1/15     80%        0.98       0.10
    'scheduling_intervals_lns':          5/15     40%        0.10       0.10
  'scheduling_precedences_lns':          7/15     60%        0.66       0.10
  'scheduling_time_window_lns':          6/15    100%        1.00       0.10

LS stats                   Batches  Restarts  LinMoves  GenMoves  CompoundMoves  WeightUpdates
       'fj_long_default':        1         1     9'612         0              0            388
   'fj_long_lin_default':        1         1         0     2'172            263              1
        'fj_long_random':        1         1     9'572         0              0            428
      'fj_short_default':        1         1         0     1'924            329              1
  'fj_short_lin_default':        1         1         0     1'899            336              1
   'fj_short_lin_random':        1         1         0     1'834            219              1
       'fj_short_random':        1         1         0     2'031            343              1
          'violation_ls':       16         0    15'670    67'466          1'907          6'198
          'violation_ls':       16         0    17'374    36'417          4'250          6'218

Solutions (48)                   Num     Rank
               'graph_arc_lns':    2  [13,25]
               'graph_dec_lns':    2   [4,12]
               'graph_var_lns':    1  [24,24]
                       'no_lp':   34   [1,48]
               'quick_restart':    2   [6,22]
  'scheduling_time_window_lns':    2  [28,47]
                'violation_ls':    5   [3,17]

Objective bounds                Num
                  'bool_core':    2
                 'default_lp':    1
             'initial_domain':    1
        'objective_lb_search':    1
  'objective_lb_search_no_lp':   31
              'quick_restart':    4

Solution repositories    Added  Queried  Ignored  Synchro
  'feasible solutions':    173      357        1      142
        'lp solutions':     30        3        0       26
                'pump':    312       13

Improving bounds shared          Num
                        'core':    1
                  'default_lp':  100
                       'fixed':    1
              'lb_tree_search':    6
                      'max_lp':    2
                       'no_lp':  410
         'objective_lb_search':   53
  'objective_lb_search_max_lp':   25
   'objective_lb_search_no_lp':    3
                     'probing':   25
              'probing_max_lp':    5
                'pseudo_costs':   38
               'quick_restart':   16
         'quick_restart_no_lp':  241
               'reduced_costs':   86

Clauses shared                   Num
                  'default_lp':   32
              'lb_tree_search':   10
                      'max_lp':   26
                       'no_lp':   32
         'objective_lb_search':   13
  'objective_lb_search_max_lp':    1
   'objective_lb_search_no_lp':    2
                'pseudo_costs':    7
               'quick_restart':    4
         'quick_restart_no_lp':   19
               'reduced_costs':    3

CpSolverResponse summary:
status: OPTIMAL
objective: 1124
best_bound: 1124
integers: 174
booleans: 62
conflicts: 0
branches: 145
propagations: 14
integer_propagations: 2145
restarts: 124
lp_iterations: 0
walltime: 2.29725
usertime: 2.29725
deterministic_time: 15.9678
gap_integral: 39.5516
solution_fingerprint: 0x644de28f2b220b19


--- Simulation Gantt  partir du modle mathmatique ---
