created virtual environment CPython3.12.4.final.0-64 in 9201ms
  creator CPython3Posix(dest=/localscratch/aneumann.63390701.0/env, clear=False, no_vcs_ignore=False, global=False)
  seeder FromAppData(download=False, pip=bundle, via=copy, app_data_dir=/home/aneumann/.local/share/virtualenv)
    added seed packages: pip==25.1.1
  activators BashActivator,CShellActivator,FishActivator,NushellActivator,PowerShellActivator,PythonActivator
Looking in links: /cvmfs/soft.computecanada.ca/custom/python/wheelhouse/gentoo2023/x86-64-v3, /cvmfs/soft.computecanada.ca/custom/python/wheelhouse/gentoo2023/generic, /cvmfs/soft.computecanada.ca/custom/python/wheelhouse/generic
Requirement already satisfied: pip in /localscratch/aneumann.63390701.0/env/lib/python3.12/site-packages (25.1.1)
Looking in links: /cvmfs/soft.computecanada.ca/custom/python/wheelhouse/gentoo2023/x86-64-v3, /cvmfs/soft.computecanada.ca/custom/python/wheelhouse/gentoo2023/generic, /cvmfs/soft.computecanada.ca/custom/python/wheelhouse/generic
ERROR: protobuf-5.28.3-cp38-abi3-manylinux2014_x86_64.whl is not a supported wheel on this platform.
Looking in links: /cvmfs/soft.computecanada.ca/custom/python/wheelhouse/gentoo2023/x86-64-v3, /cvmfs/soft.computecanada.ca/custom/python/wheelhouse/gentoo2023/generic, /cvmfs/soft.computecanada.ca/custom/python/wheelhouse/generic
Processing /home/aneumann/projects/def-adhaj/aneumann/GNRS/wheels/immutabledict-4.2.0-py3-none-any.whl
Installing collected packages: immutabledict
Successfully installed immutabledict-4.2.0
Looking in links: /cvmfs/soft.computecanada.ca/custom/python/wheelhouse/gentoo2023/x86-64-v3, /cvmfs/soft.computecanada.ca/custom/python/wheelhouse/gentoo2023/generic, /cvmfs/soft.computecanada.ca/custom/python/wheelhouse/generic
Processing /cvmfs/soft.computecanada.ca/custom/python/wheelhouse/generic/ortools-9.10.4067+computecanada-cp312-cp312-linux_x86_64.whl (from -r /home/aneumann/projects/def-adhaj/aneumann/GNRS/requirements/or.txt (line 1))
Processing /cvmfs/soft.computecanada.ca/custom/python/wheelhouse/gentoo2023/x86-64-v3/matplotlib-3.10.0+computecanada-cp312-cp312-linux_x86_64.whl (from -r /home/aneumann/projects/def-adhaj/aneumann/GNRS/requirements/or.txt (line 2))
Processing /cvmfs/soft.computecanada.ca/custom/python/wheelhouse/gentoo2023/x86-64-v3/pandas-2.2.3+computecanada-cp312-cp312-linux_x86_64.whl (from -r /home/aneumann/projects/def-adhaj/aneumann/GNRS/requirements/or.txt (line 3))
Processing /cvmfs/soft.computecanada.ca/custom/python/wheelhouse/generic/absl_py-2.2.2+computecanada-py3-none-any.whl (from ortools<9.11,>=9.10->-r /home/aneumann/projects/def-adhaj/aneumann/GNRS/requirements/or.txt (line 1))
Processing /cvmfs/soft.computecanada.ca/custom/python/wheelhouse/gentoo2023/generic/numpy-2.2.2+computecanada-cp312-cp312-linux_x86_64.whl (from ortools<9.11,>=9.10->-r /home/aneumann/projects/def-adhaj/aneumann/GNRS/requirements/or.txt (line 1))
Processing /cvmfs/soft.computecanada.ca/custom/python/wheelhouse/gentoo2023/x86-64-v3/protobuf-6.30.2+computecanada-cp312-cp312-linux_x86_64.whl (from ortools<9.11,>=9.10->-r /home/aneumann/projects/def-adhaj/aneumann/GNRS/requirements/or.txt (line 1))
Requirement already satisfied: immutabledict>=3.0.0 in /localscratch/aneumann.63390701.0/env/lib/python3.12/site-packages (from ortools<9.11,>=9.10->-r /home/aneumann/projects/def-adhaj/aneumann/GNRS/requirements/or.txt (line 1)) (4.2.0)
Processing /cvmfs/soft.computecanada.ca/custom/python/wheelhouse/gentoo2023/generic/contourpy-1.3.1+computecanada-cp312-cp312-linux_x86_64.whl (from matplotlib->-r /home/aneumann/projects/def-adhaj/aneumann/GNRS/requirements/or.txt (line 2))
Processing /cvmfs/soft.computecanada.ca/custom/python/wheelhouse/generic/cycler-0.12.1+computecanada-py3-none-any.whl (from matplotlib->-r /home/aneumann/projects/def-adhaj/aneumann/GNRS/requirements/or.txt (line 2))
Processing /cvmfs/soft.computecanada.ca/custom/python/wheelhouse/generic/fonttools-4.58.2+computecanada-cp312-cp312-linux_x86_64.whl (from matplotlib->-r /home/aneumann/projects/def-adhaj/aneumann/GNRS/requirements/or.txt (line 2))
Processing /cvmfs/soft.computecanada.ca/custom/python/wheelhouse/gentoo2023/x86-64-v3/kiwisolver-1.4.8+computecanada-cp312-cp312-linux_x86_64.whl (from matplotlib->-r /home/aneumann/projects/def-adhaj/aneumann/GNRS/requirements/or.txt (line 2))
Processing /cvmfs/soft.computecanada.ca/custom/python/wheelhouse/generic/packaging-25.0+computecanada-py3-none-any.whl (from matplotlib->-r /home/aneumann/projects/def-adhaj/aneumann/GNRS/requirements/or.txt (line 2))
Processing /cvmfs/soft.computecanada.ca/custom/python/wheelhouse/gentoo2023/x86-64-v3/pillow-11.1.0+computecanada-cp312-cp312-linux_x86_64.whl (from matplotlib->-r /home/aneumann/projects/def-adhaj/aneumann/GNRS/requirements/or.txt (line 2))
Processing /cvmfs/soft.computecanada.ca/custom/python/wheelhouse/generic/pyparsing-3.2.1+computecanada-py3-none-any.whl (from matplotlib->-r /home/aneumann/projects/def-adhaj/aneumann/GNRS/requirements/or.txt (line 2))
Processing /cvmfs/soft.computecanada.ca/custom/python/wheelhouse/generic/python_dateutil-2.9.0.post0+computecanada-py2.py3-none-any.whl (from matplotlib->-r /home/aneumann/projects/def-adhaj/aneumann/GNRS/requirements/or.txt (line 2))
Processing /cvmfs/soft.computecanada.ca/custom/python/wheelhouse/generic/pytz-2025.2+computecanada-py2.py3-none-any.whl (from pandas->-r /home/aneumann/projects/def-adhaj/aneumann/GNRS/requirements/or.txt (line 3))
Processing /cvmfs/soft.computecanada.ca/custom/python/wheelhouse/generic/tzdata-2025.2+computecanada-py2.py3-none-any.whl (from pandas->-r /home/aneumann/projects/def-adhaj/aneumann/GNRS/requirements/or.txt (line 3))
Processing /cvmfs/soft.computecanada.ca/custom/python/wheelhouse/generic/six-1.17.0+computecanada-py2.py3-none-any.whl (from python-dateutil>=2.7->matplotlib->-r /home/aneumann/projects/def-adhaj/aneumann/GNRS/requirements/or.txt (line 2))
Installing collected packages: pytz, tzdata, six, pyparsing, protobuf, pillow, packaging, numpy, kiwisolver, fonttools, cycler, absl-py, python-dateutil, contourpy, pandas, matplotlib, ortools

Successfully installed absl-py-2.2.2+computecanada contourpy-1.3.1+computecanada cycler-0.12.1+computecanada fonttools-4.58.2+computecanada kiwisolver-1.4.8+computecanada matplotlib-3.10.0+computecanada numpy-2.2.2+computecanada ortools-9.10.4067+computecanada packaging-25.0+computecanada pandas-2.2.3+computecanada pillow-11.1.0+computecanada protobuf-6.30.2+computecanada pyparsing-3.2.1+computecanada python-dateutil-2.9.0.post0+computecanada pytz-2025.2+computecanada six-1.17.0+computecanada tzdata-2025.2+computecanada

Starting CP-SAT solver v9.10.4067
Parameters: max_time_in_seconds: 3600 max_memory_in_mb: 12000 log_search_progress: true enumerate_all_solutions: false absolute_gap_limit: 0 relative_gap_limit: 0
Setting number of workers to 48

Initial optimization model '': (model_fingerprint: 0xa0bcc7d363a01775)
#Variables: 154 (#ints: 5 in objective)
  - 101 Booleans in [0,1]
  - 53 in [0,384]
#kLinear1: 18
#kLinear2: 183
#kLinear3: 66
#kLinearN: 524 (#terms: 4'475)

Starting presolve at 0.00s
  2.10e-04s  0.00e+00d  [DetectDominanceRelations] 
  7.00e-03s  0.00e+00d  [PresolveToFixPoint] #num_loops=5 #num_dual_strengthening=3 
  1.64e-05s  0.00e+00d  [ExtractEncodingFromLinear] #potential_supersets=3 
[Symmetry] Graph for symmetry has 782 nodes and 2'658 arcs.
[Symmetry] Symmetry computation done. time: 0.00041434 dtime: 0.00026596
[SAT presolve] num removable Booleans: 0 / 40
[SAT presolve] num trivial clauses: 0
[SAT presolve] [0s] clauses:7 literals:21 vars:12 one_side_vars:11 simple_definition:1 singleton_clauses:0
[SAT presolve] [3.8798e-05s] clauses:7 literals:21 vars:12 one_side_vars:11 simple_definition:1 singleton_clauses:0
[SAT presolve] [5.2011e-05s] clauses:7 literals:21 vars:12 one_side_vars:11 simple_definition:1 singleton_clauses:0
  1.79e-03s  1.63e-04d  [Probe] #probed=166 #fixed_bools=3 #new_bounds=6 #new_binary_clauses=10 
  6.35e-06s  0.00e+00d  [MaxClique] 
  2.68e-04s  0.00e+00d  [DetectDominanceRelations] 
  2.65e-03s  0.00e+00d  [PresolveToFixPoint] #num_loops=4 #num_dual_strengthening=3 
  5.60e-04s  0.00e+00d  [ProcessAtMostOneAndLinear] 
  5.21e-04s  0.00e+00d  [DetectDuplicateConstraints] #duplicates=130 #without_enforcements=33 
  1.46e-04s  4.47e-06d  [DetectDominatedLinearConstraints] #relevant_constraints=229 #num_inclusions=35 #num_redundant=6 
  1.26e-04s  0.00e+00d  [DetectDifferentVariables] #different=19 #cliques=1 #size=3 
  7.06e-05s  1.63e-06d  [ProcessSetPPC] #relevant_constraints=143 
  9.55e-06s  0.00e+00d  [FindAlmostIdenticalLinearConstraints] 
  3.84e-05s  1.91e-05d  [FindBigAtMostOneAndLinearOverlap] 
  3.29e-04s  1.04e-04d  [FindBigVerticalLinearOverlap] #blocks=1 #saved_nz=39 
  3.79e-05s  4.96e-06d  [FindBigHorizontalLinearOverlap] #linears=132 
  1.86e-05s  1.05e-07d  [MergeClauses] 
  2.49e-04s  0.00e+00d  [DetectDominanceRelations] 
  2.01e-03s  0.00e+00d  [PresolveToFixPoint] #num_loops=2 #num_dual_strengthening=1 
  2.41e-04s  0.00e+00d  [DetectDominanceRelations] 
  1.63e-03s  0.00e+00d  [PresolveToFixPoint] #num_loops=1 #num_dual_strengthening=1 
[SAT presolve] num removable Booleans: 0 / 37
[SAT presolve] num trivial clauses: 0
[SAT presolve] [0s] clauses:7 literals:21 vars:12 one_side_vars:11 simple_definition:1 singleton_clauses:0
[SAT presolve] [3.9406e-05s] clauses:7 literals:21 vars:12 one_side_vars:11 simple_definition:1 singleton_clauses:0
[SAT presolve] [5.1661e-05s] clauses:7 literals:21 vars:12 one_side_vars:11 simple_definition:1 singleton_clauses:0
  1.51e-03s  1.50e-04d  [Probe] #probed=158 #new_bounds=7 #new_binary_clauses=10 
  4.74e-06s  0.00e+00d  [MaxClique] 
  2.50e-04s  0.00e+00d  [DetectDominanceRelations] 
  2.50e-03s  0.00e+00d  [PresolveToFixPoint] #num_loops=4 #num_dual_strengthening=3 
  5.06e-04s  0.00e+00d  [ProcessAtMostOneAndLinear] 
  3.77e-04s  0.00e+00d  [DetectDuplicateConstraints] #without_enforcements=33 
  1.22e-04s  4.10e-06d  [DetectDominatedLinearConstraints] #relevant_constraints=224 #num_inclusions=24 
  4.66e-05s  0.00e+00d  [DetectDifferentVariables] 
  6.72e-05s  1.55e-06d  [ProcessSetPPC] #relevant_constraints=142 
  9.45e-06s  0.00e+00d  [FindAlmostIdenticalLinearConstraints] 
  3.48e-05s  1.87e-05d  [FindBigAtMostOneAndLinearOverlap] 
  2.75e-04s  9.93e-05d  [FindBigVerticalLinearOverlap] 
  3.11e-05s  4.96e-06d  [FindBigHorizontalLinearOverlap] #linears=132 
  1.51e-05s  1.05e-07d  [MergeClauses] 
  2.43e-04s  0.00e+00d  [DetectDominanceRelations] 
  1.65e-03s  0.00e+00d  [PresolveToFixPoint] #num_loops=1 #num_dual_strengthening=1 
  2.45e-04s  0.00e+00d  [DetectDominanceRelations] 
  1.63e-03s  0.00e+00d  [PresolveToFixPoint] #num_loops=1 #num_dual_strengthening=1 
[SAT presolve] num removable Booleans: 0 / 37
[SAT presolve] num trivial clauses: 0
[SAT presolve] [0s] clauses:7 literals:21 vars:12 one_side_vars:11 simple_definition:1 singleton_clauses:0
[SAT presolve] [3.1752e-05s] clauses:7 literals:21 vars:12 one_side_vars:11 simple_definition:1 singleton_clauses:0
[SAT presolve] [4.3763e-05s] clauses:7 literals:21 vars:12 one_side_vars:11 simple_definition:1 singleton_clauses:0
  1.48e-03s  1.48e-04d  [Probe] #probed=158 #new_binary_clauses=10 
  4.64e-06s  0.00e+00d  [MaxClique] 
  2.44e-04s  0.00e+00d  [DetectDominanceRelations] 
  1.66e-03s  0.00e+00d  [PresolveToFixPoint] #num_loops=1 #num_dual_strengthening=1 
  5.09e-04s  0.00e+00d  [ProcessAtMostOneAndLinear] 
  3.72e-04s  0.00e+00d  [DetectDuplicateConstraints] #without_enforcements=33 
  1.23e-04s  4.10e-06d  [DetectDominatedLinearConstraints] #relevant_constraints=224 #num_inclusions=24 
  4.67e-05s  0.00e+00d  [DetectDifferentVariables] 
  6.79e-05s  1.55e-06d  [ProcessSetPPC] #relevant_constraints=142 
  9.54e-06s  0.00e+00d  [FindAlmostIdenticalLinearConstraints] 
  3.66e-05s  1.87e-05d  [FindBigAtMostOneAndLinearOverlap] 
  2.80e-04s  9.93e-05d  [FindBigVerticalLinearOverlap] 
  3.10e-05s  4.96e-06d  [FindBigHorizontalLinearOverlap] #linears=132 
  1.76e-05s  1.05e-07d  [MergeClauses] 
  2.45e-04s  0.00e+00d  [DetectDominanceRelations] 
  1.64e-03s  0.00e+00d  [PresolveToFixPoint] #num_loops=1 #num_dual_strengthening=1 
  2.24e-05s  0.00e+00d  [ExpandObjective] #entries=22 #tight_variables=11 #tight_constraints=4 

Presolve summary:
  - 25 affine relations were detected.
  - rule 'TODO dual: only one blocking constraint?' was applied 402 times.
  - rule 'TODO dual: only one unspecified blocking constraint?' was applied 75 times.
  - rule 'TODO duplicate: identical constraint with different enforcements' was applied 99 times.
  - rule 'TODO linear2: contains a Boolean.' was applied 12 times.
  - rule 'TODO no_overlap: with task always last' was applied 1 time.
  - rule 'affine: new relation' was applied 25 times.
  - rule 'all_diff: inferred from x != y constraints' was applied 1 time.
  - rule 'deductions: 72 stored' was applied 1 time.
  - rule 'dual: fix variable' was applied 9 times.
  - rule 'dual: reduced domain' was applied 25 times.
  - rule 'duplicate: merged rhs of linear constraint' was applied 26 times.
  - rule 'duplicate: removed constraint' was applied 130 times.
  - rule 'enforcement: false literal' was applied 7 times.
  - rule 'enforcement: true literal' was applied 12 times.
  - rule 'incompatible linear: add implication' was applied 27 times.
  - rule 'linear inclusion: redundant containing constraint' was applied 4 times.
  - rule 'linear inclusion: redundant included constraint' was applied 2 times.
  - rule 'linear matrix: common vertical rectangle' was applied 1 time.
  - rule 'linear2: contains a Boolean.' was applied 11 times.
  - rule 'linear: always true' was applied 240 times.
  - rule 'linear: doubleton free' was applied 6 times.
  - rule 'linear: empty' was applied 16 times.
  - rule 'linear: extracted enforcement literal' was applied 670 times.
  - rule 'linear: fixed or dup variables' was applied 525 times.
  - rule 'linear: negative clause' was applied 7 times.
  - rule 'linear: positive equal one' was applied 3 times.
  - rule 'linear: reduced variable domains' was applied 56 times.
  - rule 'linear: remapped using affine relations' was applied 445 times.
  - rule 'linear: simplified rhs' was applied 1'333 times.
  - rule 'linear: variable substitution 1' was applied 6 times.
  - rule 'presolve: 47 unused variables removed.' was applied 1 time.
  - rule 'presolve: iteration' was applied 3 times.

Presolved optimization model '': (model_fingerprint: 0x4ee7b62c8d9ef86d)
#Variables: 77 (#ints: 5 in objective)
  - 37 Booleans in [0,1]
  - 1 in [0,249]
  - 4 in [0,267]
  - 1 in [0,280]
  - 4 in [0,302]
  - 1 in [0,309]
  - 3 in [0,327]
  - 4 in [0,344]
  - 1 in [3,330]
  - 1 in [3,330][387,714]
  - 1 in [18,362]
  - 1 in [22,289]
  - 1 in [45,347]
  - 1 in [62,329]
  - 2 in [64,373]
  - 1 in [70,379]
  - 3 in [93,373]
  - 1 in [99,379]
  - 3 in [106,373]
  - 1 in [112,379]
  - 3 in [124,373]
  - 1 in [130,379]
  - 1 in [144,384]
#kAllDiff: 1
#kBoolOr: 7 (#literals: 21)
#kExactlyOne: 3 (#literals: 9)
#kLinear1: 11 (#enforced: 11 #multi: 6)
#kLinear2: 148 (#enforced: 117 #multi: 87)
#kLinear3: 51 (#enforced: 39 #multi: 24)
#kLinearN: 142 (#enforced: 90) (#terms: 1'032)

Preloading model.
#Bound   0.04s best:inf   next:[166,1511] initial_domain
#Model   0.04s var:77/77 constraints:363/363

Starting search at 0.04s with 48 workers.
16 full problem subsolvers: [core, default_lp, lb_tree_search, max_lp, no_lp, objective_lb_search, objective_lb_search_max_lp, objective_lb_search_no_lp, objective_shaving_search_max_lp, objective_shaving_search_no_lp, probing, probing_max_lp, pseudo_costs, quick_restart, quick_restart_no_lp, reduced_costs]
30 first solution subsolvers: [fj_long_default(2), fj_long_lin_default, fj_long_lin_perturb, fj_long_lin_random, fj_long_perturb, fj_long_random, fj_short_default(2), fj_short_lin_default(2), fj_short_lin_perturb, fj_short_lin_random, fj_short_perturb, fj_short_random, fs_random(4), fs_random_no_lp(4), fs_random_quick_restart(4), fs_random_quick_restart_no_lp(3)]
13 incomplete subsolvers: [feasibility_pump, graph_arc_lns, graph_cst_lns, graph_dec_lns, graph_var_lns, rins/rens, rnd_cst_lns, rnd_var_lns, violation_ls(5)]
3 helper subsolvers: [neighborhood_helper, synchronization_agent, update_gap_integral]
#Bound   0.04s best:inf   next:[167,1511] bool_core (num_cores=1 [size:1 mw:1] a=5 d=0 fixed=0/53 clauses=17)
#1       0.04s best:918   next:[167,917]  no_lp (fixed_bools=0/63)
#2       0.04s best:618   next:[167,617]  quick_restart_no_lp (fixed_bools=0/64)
#Bound   0.04s best:618   next:[168,617]  objective_lb_search_no_lp
#Bound   0.04s best:618   next:[177,617]  objective_lb_search_no_lp
#3       0.04s best:617   next:[177,616]  violation_ls(batch:1 #solutions_imported:1 #lin_moves:0 #lin_evals:47 #gen_moves:31 #gen_evals:5 #comp_moves:5 #backtracks:13 #weight_updates:0)
#Bound   0.05s best:617   next:[184,616]  probing
#4       0.05s best:616   next:[184,615]  violation_ls(batch:1 #solutions_imported:1 #lin_moves:1 #lin_evals:5 #weight_updates:0)
#Bound   0.05s best:616   next:[241,615]  objective_lb_search_no_lp
#5       0.05s best:615   next:[241,614]  violation_ls(batch:1 #solutions_imported:1 #lin_moves:0 #lin_evals:25 #gen_moves:16 #gen_evals:2 #comp_moves:4 #backtracks:6 #weight_updates:0)
#6       0.05s best:607   next:[241,606]  no_lp (fixed_bools=0/83)
#Bound   0.05s best:607   next:[254,606]  objective_lb_search_no_lp
#7       0.05s best:605   next:[254,604]  quick_restart_no_lp (fixed_bools=1/101)
#8       0.05s best:597   next:[254,596]  no_lp (fixed_bools=0/86)
#9       0.05s best:582   next:[254,581]  no_lp (fixed_bools=0/89)
#10      0.05s best:554   next:[254,553]  quick_restart_no_lp (fixed_bools=2/117)
#11      0.05s best:508   next:[254,507]  quick_restart_no_lp (fixed_bools=2/118)
#12      0.05s best:355   next:[254,354]  objective_lb_search_no_lp (fixed_bools=3/67)
#13      0.05s best:354   next:[254,353]  quick_restart_no_lp (fixed_bools=3/120)
#14      0.05s best:350   next:[254,349]  quick_restart_no_lp (fixed_bools=4/127)
#Bound   0.05s best:350   next:[283,349]  objective_lb_search_no_lp
#15      0.06s best:349   next:[283,348]  quick_restart_no_lp (fixed_bools=4/135)
#Bound   0.06s best:349   next:[293,348]  objective_lb_search_no_lp
#Model   0.06s var:76/77 constraints:313/363
#16      0.06s best:347   next:[293,346]  violation_ls(batch:1 #solutions_imported:1 #lin_moves:0 #lin_evals:3 #gen_moves:1 #gen_evals:0 #comp_moves:1 #backtracks:0 #weight_updates:0)
#Model   0.06s var:75/77 constraints:299/363
#17      0.06s best:346   next:[293,345]  violation_ls(batch:1 #solutions_imported:1 #lin_moves:0 #lin_evals:2 #gen_moves:1 #gen_evals:0 #comp_moves:1 #backtracks:0 #weight_updates:0)
#Model   0.06s var:74/77 constraints:290/363
#Model   0.06s var:73/77 constraints:281/363
#18      0.06s best:343   next:[293,342]  rnd_var_lns (d=0.50 s=29 t=0.10 p=0.00 stall=0 h=auto_l0) [presolve]
#Model   0.06s var:72/77 constraints:275/363
#19      0.06s best:340   next:[293,339]  no_lp (fixed_bools=1/109)
#Model   0.07s var:71/77 constraints:256/363
#Model   0.07s var:70/77 constraints:248/363
#Bound   0.07s best:340   next:[294,339]  objective_lb_search_no_lp
#Bound   0.07s best:340   next:[312,339]  objective_lb_search_no_lp
#Bound   0.07s best:340   next:[321,339]  objective_lb_search_no_lp
#Bound   0.07s best:340   next:[325,339]  objective_lb_search_no_lp
#Model   0.07s var:67/77 constraints:222/363
#Bound   0.07s best:340   next:[329,339]  objective_lb_search_no_lp
#Bound   0.07s best:340   next:[331,339]  objective_lb_search_no_lp
#Model   0.07s var:66/77 constraints:213/363
#Bound   0.07s best:340   next:[335,339]  objective_lb_search_no_lp
#Bound   0.07s best:340   next:[337,339]  objective_lb_search_no_lp
#Done    0.07s quick_restart_no_lp
#Done    0.07s objective_lb_search_no_lp
#Done    0.07s pseudo_costs
#Done    0.07s objective_lb_search
#Done    0.07s reduced_costs
#Model   0.08s var:63/77 constraints:194/363
#Done    0.08s objective_lb_search_max_lp
#Model   0.08s var:62/77 constraints:169/363

Task timing                                  n [     min,      max]      avg      dev     time         n [     min,      max]      avg      dev    dtime
                             'core':         1 [ 36.05ms,  36.05ms]  36.05ms   0.00ns  36.05ms         1 [  9.91ms,   9.91ms]   9.91ms   0.00ns   9.91ms
                       'default_lp':         1 [ 35.61ms,  35.61ms]  35.61ms   0.00ns  35.61ms         1 [  2.20ms,   2.20ms]   2.20ms   0.00ns   2.20ms
                 'feasibility_pump':         3 [792.52us,  10.20ms]   4.10ms   4.31ms  12.30ms         2 [134.18us,   1.45ms] 793.09us 658.91us   1.59ms
                  'fj_long_default':         0 [  0.00ns,   0.00ns]   0.00ns   0.00ns   0.00ns         0 [  0.00ns,   0.00ns]   0.00ns   0.00ns   0.00ns
                  'fj_long_default':         0 [  0.00ns,   0.00ns]   0.00ns   0.00ns   0.00ns         0 [  0.00ns,   0.00ns]   0.00ns   0.00ns   0.00ns
              'fj_long_lin_default':         0 [  0.00ns,   0.00ns]   0.00ns   0.00ns   0.00ns         0 [  0.00ns,   0.00ns]   0.00ns   0.00ns   0.00ns
              'fj_long_lin_perturb':         0 [  0.00ns,   0.00ns]   0.00ns   0.00ns   0.00ns         0 [  0.00ns,   0.00ns]   0.00ns   0.00ns   0.00ns
               'fj_long_lin_random':         0 [  0.00ns,   0.00ns]   0.00ns   0.00ns   0.00ns         0 [  0.00ns,   0.00ns]   0.00ns   0.00ns   0.00ns
                  'fj_long_perturb':         0 [  0.00ns,   0.00ns]   0.00ns   0.00ns   0.00ns         0 [  0.00ns,   0.00ns]   0.00ns   0.00ns   0.00ns
                   'fj_long_random':         0 [  0.00ns,   0.00ns]   0.00ns   0.00ns   0.00ns         0 [  0.00ns,   0.00ns]   0.00ns   0.00ns   0.00ns
                 'fj_short_default':         0 [  0.00ns,   0.00ns]   0.00ns   0.00ns   0.00ns         0 [  0.00ns,   0.00ns]   0.00ns   0.00ns   0.00ns
                 'fj_short_default':         0 [  0.00ns,   0.00ns]   0.00ns   0.00ns   0.00ns         0 [  0.00ns,   0.00ns]   0.00ns   0.00ns   0.00ns
             'fj_short_lin_default':         0 [  0.00ns,   0.00ns]   0.00ns   0.00ns   0.00ns         0 [  0.00ns,   0.00ns]   0.00ns   0.00ns   0.00ns
             'fj_short_lin_default':         0 [  0.00ns,   0.00ns]   0.00ns   0.00ns   0.00ns         0 [  0.00ns,   0.00ns]   0.00ns   0.00ns   0.00ns
             'fj_short_lin_perturb':         0 [  0.00ns,   0.00ns]   0.00ns   0.00ns   0.00ns         0 [  0.00ns,   0.00ns]   0.00ns   0.00ns   0.00ns
              'fj_short_lin_random':         0 [  0.00ns,   0.00ns]   0.00ns   0.00ns   0.00ns         0 [  0.00ns,   0.00ns]   0.00ns   0.00ns   0.00ns
                 'fj_short_perturb':         0 [  0.00ns,   0.00ns]   0.00ns   0.00ns   0.00ns         0 [  0.00ns,   0.00ns]   0.00ns   0.00ns   0.00ns
                  'fj_short_random':         0 [  0.00ns,   0.00ns]   0.00ns   0.00ns   0.00ns         0 [  0.00ns,   0.00ns]   0.00ns   0.00ns   0.00ns
                        'fs_random':         0 [  0.00ns,   0.00ns]   0.00ns   0.00ns   0.00ns         0 [  0.00ns,   0.00ns]   0.00ns   0.00ns   0.00ns
                        'fs_random':         0 [  0.00ns,   0.00ns]   0.00ns   0.00ns   0.00ns         0 [  0.00ns,   0.00ns]   0.00ns   0.00ns   0.00ns
                        'fs_random':         1 [  2.05ms,   2.05ms]   2.05ms   0.00ns   2.05ms         0 [  0.00ns,   0.00ns]   0.00ns   0.00ns   0.00ns
                        'fs_random':         1 [  2.14ms,   2.14ms]   2.14ms   0.00ns   2.14ms         0 [  0.00ns,   0.00ns]   0.00ns   0.00ns   0.00ns
                  'fs_random_no_lp':         0 [  0.00ns,   0.00ns]   0.00ns   0.00ns   0.00ns         0 [  0.00ns,   0.00ns]   0.00ns   0.00ns   0.00ns
                  'fs_random_no_lp':         0 [  0.00ns,   0.00ns]   0.00ns   0.00ns   0.00ns         0 [  0.00ns,   0.00ns]   0.00ns   0.00ns   0.00ns
                  'fs_random_no_lp':         1 [  1.38ms,   1.38ms]   1.38ms   0.00ns   1.38ms         0 [  0.00ns,   0.00ns]   0.00ns   0.00ns   0.00ns
                  'fs_random_no_lp':         1 [  1.73ms,   1.73ms]   1.73ms   0.00ns   1.73ms         0 [  0.00ns,   0.00ns]   0.00ns   0.00ns   0.00ns
          'fs_random_quick_restart':         0 [  0.00ns,   0.00ns]   0.00ns   0.00ns   0.00ns         0 [  0.00ns,   0.00ns]   0.00ns   0.00ns   0.00ns
          'fs_random_quick_restart':         0 [  0.00ns,   0.00ns]   0.00ns   0.00ns   0.00ns         0 [  0.00ns,   0.00ns]   0.00ns   0.00ns   0.00ns
          'fs_random_quick_restart':         1 [  1.88ms,   1.88ms]   1.88ms   0.00ns   1.88ms         0 [  0.00ns,   0.00ns]   0.00ns   0.00ns   0.00ns
          'fs_random_quick_restart':         1 [  2.12ms,   2.12ms]   2.12ms   0.00ns   2.12ms         0 [  0.00ns,   0.00ns]   0.00ns   0.00ns   0.00ns
    'fs_random_quick_restart_no_lp':         0 [  0.00ns,   0.00ns]   0.00ns   0.00ns   0.00ns         0 [  0.00ns,   0.00ns]   0.00ns   0.00ns   0.00ns
    'fs_random_quick_restart_no_lp':         0 [  0.00ns,   0.00ns]   0.00ns   0.00ns   0.00ns         0 [  0.00ns,   0.00ns]   0.00ns   0.00ns   0.00ns
    'fs_random_quick_restart_no_lp':         1 [  1.69ms,   1.69ms]   1.69ms   0.00ns   1.69ms         0 [  0.00ns,   0.00ns]   0.00ns   0.00ns   0.00ns
                    'graph_arc_lns':         4 [  4.84us,   5.97ms]   3.22ms   2.20ms  12.88ms         2 [ 15.33us, 150.84us]  83.08us  67.76us 166.17us
                    'graph_cst_lns':         3 [331.70us, 380.51us] 359.74us  20.58us   1.08ms         0 [  0.00ns,   0.00ns]   0.00ns   0.00ns   0.00ns
                    'graph_dec_lns':         3 [  1.26ms,   3.54ms]   2.32ms 938.12us   6.95ms         3 [ 10.00ns,  18.37us]   6.30us   8.54us  18.90us
                    'graph_var_lns':         4 [580.73us,   2.65ms]   1.50ms 748.19us   5.99ms         3 [ 10.00ns,  10.00ns]  10.00ns   0.00ns  30.00ns
                   'lb_tree_search':         1 [ 34.98ms,  34.98ms]  34.98ms   0.00ns  34.98ms         1 [ 29.41us,  29.41us]  29.41us   0.00ns  29.41us
                           'max_lp':         1 [ 35.79ms,  35.79ms]  35.79ms   0.00ns  35.79ms         1 [ 28.30us,  28.30us]  28.30us   0.00ns  28.30us
                            'no_lp':         1 [ 35.68ms,  35.68ms]  35.68ms   0.00ns  35.68ms         1 [  4.51ms,   4.51ms]   4.51ms   0.00ns   4.51ms
              'objective_lb_search':         1 [ 34.76ms,  34.76ms]  34.76ms   0.00ns  34.76ms         1 [  3.40ms,   3.40ms]   3.40ms   0.00ns   3.40ms
       'objective_lb_search_max_lp':         1 [ 34.13ms,  34.13ms]  34.13ms   0.00ns  34.13ms         1 [868.22us, 868.22us] 868.22us   0.00ns 868.22us
        'objective_lb_search_no_lp':         1 [ 33.76ms,  33.76ms]  33.76ms   0.00ns  33.76ms         1 [  4.10ms,   4.10ms]   4.10ms   0.00ns   4.10ms
  'objective_shaving_search_max_lp':         4 [923.30us,   5.07ms]   2.40ms   1.60ms   9.59ms         1 [  1.64us,   1.64us]   1.64us   0.00ns   1.64us
   'objective_shaving_search_no_lp':         4 [619.48us,   5.51ms]   2.46ms   1.87ms   9.83ms         1 [ 70.77us,  70.77us]  70.77us   0.00ns  70.77us
                          'probing':         1 [ 34.84ms,  34.84ms]  34.84ms   0.00ns  34.84ms         1 [959.43us, 959.43us] 959.43us   0.00ns 959.43us
                   'probing_max_lp':         1 [ 34.17ms,  34.17ms]  34.17ms   0.00ns  34.17ms         1 [ 29.90us,  29.90us]  29.90us   0.00ns  29.90us
                     'pseudo_costs':         1 [ 35.17ms,  35.17ms]  35.17ms   0.00ns  35.17ms         1 [887.58us, 887.58us] 887.58us   0.00ns 887.58us
                    'quick_restart':         1 [ 35.38ms,  35.38ms]  35.38ms   0.00ns  35.38ms         1 [  1.90ms,   1.90ms]   1.90ms   0.00ns   1.90ms
              'quick_restart_no_lp':         1 [ 34.97ms,  34.97ms]  34.97ms   0.00ns  34.97ms         1 [  4.46ms,   4.46ms]   4.46ms   0.00ns   4.46ms
                    'reduced_costs':         1 [ 35.58ms,  35.58ms]  35.58ms   0.00ns  35.58ms         1 [  1.03ms,   1.03ms]   1.03ms   0.00ns   1.03ms
                        'rins/rens':         4 [685.34us,   3.08ms]   1.91ms   1.08ms   7.66ms         2 [ 29.11us,  51.37us]  40.24us  11.13us  80.48us
                      'rnd_cst_lns':         4 [385.03us,   2.80ms]   1.30ms 935.89us   5.21ms         2 [ 10.00ns,   4.82us]   2.41us   2.40us   4.83us
                      'rnd_var_lns':         4 [907.80us,   3.20ms]   1.92ms 856.33us   7.69ms         3 [ 10.00ns,  21.67us]   7.23us  10.21us  21.69us
                     'violation_ls':         2 [374.12us,  10.31ms]   5.34ms   4.97ms  10.68ms         2 [330.00ns,   5.19ms]   2.60ms   2.60ms   5.19ms
                     'violation_ls':         2 [394.53us,  10.40ms]   5.39ms   5.00ms  10.79ms         2 [390.00ns,   4.90ms]   2.45ms   2.45ms   4.90ms
                     'violation_ls':         2 [406.43us,  11.39ms]   5.90ms   5.49ms  11.80ms         2 [480.00ns,   4.99ms]   2.50ms   2.49ms   4.99ms
                     'violation_ls':         2 [517.10us,  10.44ms]   5.48ms   4.96ms  10.96ms         2 [ 51.79us,   6.29ms]   3.17ms   3.12ms   6.34ms
                     'violation_ls':         2 [989.39us,  11.36ms]   6.17ms   5.18ms  12.35ms         2 [116.47us,   5.28ms]   2.70ms   2.58ms   5.40ms

Search stats                        Bools  Conflicts  Branches  Restarts  BoolPropag  IntegerPropag
                           'core':    417        161     1'202       379      22'085         22'409
                     'default_lp':     74         29       165        96         428          3'083
                      'fs_random':      0          0         0         0           0              0
                      'fs_random':      0          0         0         0           0              0
                      'fs_random':     48          0         0         0           0              0
                      'fs_random':     48          0         0         0           0              0
                'fs_random_no_lp':      0          0         0         0           0              0
                'fs_random_no_lp':      0          0         0         0           0              0
                'fs_random_no_lp':     48          0         0         0           0              0
                'fs_random_no_lp':     48          0         0         0           0              0
        'fs_random_quick_restart':      0          0         0         0           0              0
        'fs_random_quick_restart':      0          0         0         0           0              0
        'fs_random_quick_restart':     48          0         0         0           0              0
        'fs_random_quick_restart':     48          0         0         0           0              0
  'fs_random_quick_restart_no_lp':      0          0         0         0           0              0
  'fs_random_quick_restart_no_lp':      0          0         0         0           0              0
  'fs_random_quick_restart_no_lp':     48          0         0         0           0              0
                 'lb_tree_search':     48          0        96        96          56            477
                         'max_lp':     48          0        96        96          56            477
                          'no_lp':    109        147     1'173       384       4'589         25'302
            'objective_lb_search':     61         54       193        97         724          5'028
     'objective_lb_search_max_lp':     48          0        96        96         100            677
      'objective_lb_search_no_lp':     78        123       816       386       2'936         24'096
                        'probing':     50          0       100       100          78            530
                 'probing_max_lp':     48          0        96        96          56            477
                   'pseudo_costs':     48          0        96        96          79            678
                  'quick_restart':     65          0       129        97          88          1'015
            'quick_restart_no_lp':    141        115     1'466       446       6'013         24'678
                  'reduced_costs':     48          0        96        96          79            637

SAT stats                           ClassicMinim  LitRemoved  LitLearned  LitForgotten  Subsumed  MClauses  MDecisions  MLitTrue  MSubsumed  MLitRemoved  MReused
                           'core':            58         165         260             0         1        43         234         0          2           12        9
                     'default_lp':            20          30         240             0         0         0           0         0          0            0        0
                      'fs_random':             0           0           0             0         0         0           0         0          0            0        0
                      'fs_random':             0           0           0             0         0         0           0         0          0            0        0
                      'fs_random':             0           0           0             0         0         0           0         0          0            0        0
                      'fs_random':             0           0           0             0         0         0           0         0          0            0        0
                'fs_random_no_lp':             0           0           0             0         0         0           0         0          0            0        0
                'fs_random_no_lp':             0           0           0             0         0         0           0         0          0            0        0
                'fs_random_no_lp':             0           0           0             0         0         0           0         0          0            0        0
                'fs_random_no_lp':             0           0           0             0         0         0           0         0          0            0        0
        'fs_random_quick_restart':             0           0           0             0         0         0           0         0          0            0        0
        'fs_random_quick_restart':             0           0           0             0         0         0           0         0          0            0        0
        'fs_random_quick_restart':             0           0           0             0         0         0           0         0          0            0        0
        'fs_random_quick_restart':             0           0           0             0         0         0           0         0          0            0        0
  'fs_random_quick_restart_no_lp':             0           0           0             0         0         0           0         0          0            0        0
  'fs_random_quick_restart_no_lp':             0           0           0             0         0         0           0         0          0            0        0
  'fs_random_quick_restart_no_lp':             0           0           0             0         0         0           0         0          0            0        0
                 'lb_tree_search':             0           0           0             0         0         0           0         0          0            0        0
                         'max_lp':             0           0           0             0         0         0           0         0          0            0        0
                          'no_lp':            66         160         976             0         9        69         303         4         14           76        5
            'objective_lb_search':            30          57         442             0         2         0           0         0          0            0        0
     'objective_lb_search_max_lp':             0           0           0             0         0         0           0         0          0            0        0
      'objective_lb_search_no_lp':            73         223         457             0         6        66         318         0          0            0       10
                        'probing':             0           0           0             0         0         0           0         0          0            0        0
                 'probing_max_lp':             0           0           0             0         0         0           0         0          0            0        0
                   'pseudo_costs':             0           0           0             0         0         0           0         0          0            0        0
                  'quick_restart':             0           0           0             0         0         0           0         0          0            0        0
            'quick_restart_no_lp':            53         117         715             0         9        85         425         0         12           63       10
                  'reduced_costs':             0           0           0             0         0         0           0         0          0            0        0

Lp stats                         Component  Iterations  AddedCuts  OPTIMAL  DUAL_F.  DUAL_U.
                  'default_lp':          1         230        211       52        0        0
                   'fs_random':          1           0          0        0        0        0
                   'fs_random':          1           0          0        0        0        0
     'fs_random_quick_restart':          1           0          0        0        0        0
     'fs_random_quick_restart':          1           0          0        0        0        0
              'lb_tree_search':          1          80        300        3        0        0
                      'max_lp':          1          81        298        3        0        0
         'objective_lb_search':          1         338        190       84        0        0
  'objective_lb_search_max_lp':          1         123        312       11        0        0
                     'probing':          1         116        283       21        0        0
              'probing_max_lp':          1          67        325        3        0        0
                'pseudo_costs':          1         125        303        9        1        0
               'quick_restart':          1         186        260       32        0        0
               'reduced_costs':          1         132        296       11        0        0

Lp dimension                                                                    Final dimension of first component
                  'default_lp':   145 rows, 74 columns, 566 entries with magnitude in [1.450647e-03, 1.000000e+00]
                   'fs_random':       0 rows, 74 columns, 0 entries with magnitude in [0.000000e+00, 0.000000e+00]
                   'fs_random':       0 rows, 74 columns, 0 entries with magnitude in [0.000000e+00, 0.000000e+00]
     'fs_random_quick_restart':       0 rows, 74 columns, 0 entries with magnitude in [0.000000e+00, 0.000000e+00]
     'fs_random_quick_restart':       0 rows, 74 columns, 0 entries with magnitude in [0.000000e+00, 0.000000e+00]
              'lb_tree_search':  412 rows, 77 columns, 2330 entries with magnitude in [2.465571e-03, 1.000000e+00]
                      'max_lp':  412 rows, 77 columns, 2329 entries with magnitude in [2.465571e-03, 1.000000e+00]
         'objective_lb_search':   125 rows, 74 columns, 507 entries with magnitude in [1.450647e-03, 1.000000e+00]
  'objective_lb_search_max_lp':   199 rows, 77 columns, 781 entries with magnitude in [3.997438e-03, 1.000000e+00]
                     'probing':  172 rows, 74 columns, 1024 entries with magnitude in [3.164430e-05, 1.000000e+00]
              'probing_max_lp':  410 rows, 77 columns, 2317 entries with magnitude in [2.551552e-03, 1.000000e+00]
                'pseudo_costs':   198 rows, 77 columns, 770 entries with magnitude in [4.630053e-03, 1.000000e+00]
               'quick_restart':   165 rows, 74 columns, 868 entries with magnitude in [1.265699e-04, 1.000000e+00]
               'reduced_costs':   205 rows, 77 columns, 785 entries with magnitude in [1.261385e-02, 1.000000e+00]

Lp debug                         CutPropag  CutEqPropag  Adjust  Overflow  Bad  BadScaling
                  'default_lp':          0            0      34         0  346           0
                   'fs_random':          0            0       0         0    0           0
                   'fs_random':          0            0       0         0    0           0
     'fs_random_quick_restart':          0            0       0         0    0           0
     'fs_random_quick_restart':          0            0       0         0    0           0
              'lb_tree_search':          0            0       0         0  108           0
                      'max_lp':          0            0       0         0   94           0
         'objective_lb_search':          0            2      47         0  157           0
  'objective_lb_search_max_lp':          0            0       2         0  173           0
                     'probing':          0            0       6         0  437           0
              'probing_max_lp':          0            0       0         0   95           0
                'pseudo_costs':          0            0       3         0  150           0
               'quick_restart':          0            0      17         0  403           0
               'reduced_costs':          0            0       4         0  162           0

Lp pool                          Constraints  Updates  Simplif  Merged  Shortened  Split  Strenghtened  Cuts/Call
                  'default_lp':          299      119      206      10         76      5           281    211/372
                   'fs_random':           98        0        0       0          0      0             0        0/0
                   'fs_random':           98        0        0       0          0      0             0        0/0
     'fs_random_quick_restart':           98        0        0       0          0      0             0        0/0
     'fs_random_quick_restart':           98        0        0       0          0      0             0        0/0
              'lb_tree_search':          662        1        0       0          0      1            63    300/538
                      'max_lp':          660        3        0       0          0      3            57    298/545
         'objective_lb_search':          285       42      106       3          0      4           190    190/308
  'objective_lb_search_max_lp':          666       50      460       8          0      0         1'120    312/509
                     'probing':          381        9        0       0          0      0            24    283/442
              'probing_max_lp':          687        1        0       0          0      1            62    325/566
                'pseudo_costs':          657       41      300       8          0      0           800    303/486
               'quick_restart':          348      160      240      10         82      3           367    260/422
               'reduced_costs':          650       41      460       8          0      1         1'125    296/489

Lp Cut            defaul  max_lp  quick_  reduce  pseudo  lb_tre  probin  object  probin  object
          CG_FF:      23      43      28      29      29      42      36      24      55      31
           CG_K:       7      27      11      21      23      31       9       6      30      22
           CG_R:      15      29      17      13      13      32      17       6      32      14
          CG_RB:      34      40      42      34      34      41      70      34      52      33
         CG_RBP:       -      12       5       3       3      16       4       -      15       3
             IB:      69      56      66      77      75      56      57      59      56      80
       MIR_1_FF:      15      27      17      32      32      29      16      15      34      33
        MIR_1_K:       2       3       1       6       4       5       1       1       3       5
        MIR_1_R:       -       2       -       2       2       2       1       -       2       3
       MIR_1_RB:       7       6      11      19      18       9      15       9      12      23
      MIR_1_RBP:       -       4       1       -       -       6       1       -       -       -
      MIR_1_RLT:       -       2       -       8       8       3       -       -       3       7
       MIR_2_FF:       7       7      13       5       9       7      12       8       5       7
        MIR_2_K:       -       1       3       2       6       -       1       -       -       2
        MIR_2_R:       1       2       3       5       4       1       4       2       2       5
       MIR_2_RB:       5       3       5       8      13       1       6       3       2      11
      MIR_2_RBP:       1       2       1       5       4       2       -       1       -       2
       MIR_3_FF:       4       3       4       3       2       2       2       1       5       3
        MIR_3_K:       1       2       -       -       -       2       -       -       1       -
        MIR_3_R:       1       -       1       1       -       -       4       1       3       2
       MIR_3_RB:       1       -       2       1       -       -       6       1       1       1
      MIR_3_RBP:       -       2       -       -       -       2       -       1       2       -
       MIR_4_FF:       -       3       1       -       -       3       3       2       3       -
        MIR_4_K:       -       -       1       -       -       1       -       -       1       -
        MIR_4_R:       -       -       1       -       1       1       1       -       1       -
       MIR_4_RB:       -       -       1       -       1       -       1       -       -       -
   ZERO_HALF_FF:       1      10       5       6       6       6       1       1       4       6
    ZERO_HALF_K:       -       -       -       1       1       -       -       -       -       2
    ZERO_HALF_R:      11       6      13       8       8       -       9       8       1       9
   ZERO_HALF_RB:       6       1       7       6       6       -       6       7       -       7
  ZERO_HALF_RBP:       -       5       -       1       1       -       -       -       -       1

LNS stats           Improv/Calls  Closed  Difficulty  TimeLimit
  'graph_arc_lns':           1/2    100%        0.81       0.10
  'graph_cst_lns':           0/0      0%        0.50       0.10
  'graph_dec_lns':           0/3    100%        0.88       0.10
  'graph_var_lns':           1/3    100%        0.88       0.10
      'rins/rens':           0/2    100%        0.81       0.10
    'rnd_cst_lns':           0/2    100%        0.81       0.10
    'rnd_var_lns':           1/3    100%        0.88       0.10

LS stats                   Batches  Restarts  LinMoves  GenMoves  CompoundMoves  WeightUpdates
       'fj_long_default':        0         0         0         0              0              0
       'fj_long_default':        0         0         0         0              0              0
   'fj_long_lin_default':        0         0         0         0              0              0
   'fj_long_lin_perturb':        0         0         0         0              0              0
    'fj_long_lin_random':        0         0         0         0              0              0
       'fj_long_perturb':        0         0         0         0              0              0
        'fj_long_random':        0         0         0         0              0              0
      'fj_short_default':        0         0         0         0              0              0
      'fj_short_default':        0         0         0         0              0              0
  'fj_short_lin_default':        0         0         0         0              0              0
  'fj_short_lin_default':        0         0         0         0              0              0
  'fj_short_lin_perturb':        0         0         0         0              0              0
   'fj_short_lin_random':        0         0         0         0              0              0
      'fj_short_perturb':        0         0         0         0              0              0
       'fj_short_random':        0         0         0         0              0              0
          'violation_ls':        2         0         0     1'021             21              9
          'violation_ls':        2         0         1     1'287             17             10
          'violation_ls':        2         0     1'102        31              5            201
          'violation_ls':        2         0     1'259        16              4          1'198
          'violation_ls':        2         0       981         1              1            193

Solutions (19)                  Num     Rank
                      'no_lp':    5   [1,19]
  'objective_lb_search_no_lp':    1  [12,12]
        'quick_restart_no_lp':    7   [2,15]
                'rnd_var_lns':    1  [18,18]
               'violation_ls':    5   [3,17]

Objective bounds                Num
                  'bool_core':    1
             'initial_domain':    1
  'objective_lb_search_no_lp':   14
                    'probing':    1

Solution repositories    Added  Queried  Ignored  Synchro
  'feasible solutions':     38       63        0       29
        'lp solutions':      0        0        0        0
                'pump':     23        4

Improving bounds shared         Num
                       'core':    8
                 'default_lp':   23
                      'no_lp':   80
        'objective_lb_search':   50
  'objective_lb_search_no_lp':   59
               'pseudo_costs':   43
        'quick_restart_no_lp':  248

Clauses shared                  Num
                       'core':   13
                      'no_lp':   18
  'objective_lb_search_no_lp':   14
        'quick_restart_no_lp':   21

CpSolverResponse summary:
status: OPTIMAL
objective: 340
best_bound: 340
integers: 0
booleans: 0
conflicts: 0
branches: 0
propagations: 0
integer_propagations: 0
restarts: 0
lp_iterations: 0
walltime: 0.0825523
usertime: 0.0825524
deterministic_time: 0.063934
gap_integral: 0.102703
solution_fingerprint: 0x6d227155a7d0af22


--- Simulation Gantt  partir du modle mathmatique ---
{'big':0, 'due_date':95, 'pos_time':5, 'status':2, 'blocked':2, 'operations':["{'type':0, 'processing_time':56}", "{'type':1, 'processing_time':50}"]}
{'big':1, 'due_date':135, 'pos_time':5, 'status':2, 'blocked':2, 'operations':["{'type':1, 'processing_time':12}", "{'type':0, 'processing_time':17}"]}
{'big':0, 'due_date':104, 'pos_time':5, 'status':3, 'blocked':2, 'operations':["{'type':0, 'processing_time':42}", "{'type':1, 'processing_time':32}"]}
{'big':0, 'due_date':75, 'pos_time':5, 'status':0, 'blocked':0, 'operations':["{'type':1, 'processing_time':49}"]}
