created virtual environment CPython3.12.4.final.0-64 in 669ms
  creator CPython3Posix(dest=/localscratch/aneumann.46806182.0/env, clear=False, no_vcs_ignore=False, global=False)
  seeder FromAppData(download=False, pip=bundle, via=copy, app_data_dir=/home/aneumann/.local/share/virtualenv)
    added seed packages: pip==24.2+computecanada
  activators BashActivator,CShellActivator,FishActivator,NushellActivator,PowerShellActivator,PythonActivator
Looking in links: /cvmfs/soft.computecanada.ca/custom/python/wheelhouse/gentoo2023/x86-64-v3, /cvmfs/soft.computecanada.ca/custom/python/wheelhouse/gentoo2023/generic, /cvmfs/soft.computecanada.ca/custom/python/wheelhouse/generic
Requirement already satisfied: pip in /localscratch/aneumann.46806182.0/env/lib/python3.12/site-packages (24.2+computecanada)
Processing /cvmfs/soft.computecanada.ca/custom/python/wheelhouse/generic/pip-25.0+computecanada-py3-none-any.whl
Installing collected packages: pip
  Attempting uninstall: pip
    Found existing installation: pip 24.2+computecanada
    Uninstalling pip-24.2+computecanada:
      Successfully uninstalled pip-24.2+computecanada
Successfully installed pip-25.0+computecanada
Looking in links: /cvmfs/soft.computecanada.ca/custom/python/wheelhouse/gentoo2023/x86-64-v3, /cvmfs/soft.computecanada.ca/custom/python/wheelhouse/gentoo2023/generic, /cvmfs/soft.computecanada.ca/custom/python/wheelhouse/generic
ERROR: protobuf-5.28.3-cp38-abi3-manylinux2014_x86_64.whl is not a supported wheel on this platform.
Looking in links: /cvmfs/soft.computecanada.ca/custom/python/wheelhouse/gentoo2023/x86-64-v3, /cvmfs/soft.computecanada.ca/custom/python/wheelhouse/gentoo2023/generic, /cvmfs/soft.computecanada.ca/custom/python/wheelhouse/generic
Processing /home/aneumann/projects/def-adhaj/aneumann/GNRS/wheels/immutabledict-4.2.0-py3-none-any.whl
Installing collected packages: immutabledict
Successfully installed immutabledict-4.2.0
Looking in links: /cvmfs/soft.computecanada.ca/custom/python/wheelhouse/gentoo2023/x86-64-v3, /cvmfs/soft.computecanada.ca/custom/python/wheelhouse/gentoo2023/generic, /cvmfs/soft.computecanada.ca/custom/python/wheelhouse/generic
Processing /cvmfs/soft.computecanada.ca/custom/python/wheelhouse/generic/ortools-9.10.4067+computecanada-cp312-cp312-linux_x86_64.whl (from -r /home/aneumann/projects/def-adhaj/aneumann/GNRS/requirements/or.txt (line 1))
Processing /cvmfs/soft.computecanada.ca/custom/python/wheelhouse/gentoo2023/x86-64-v3/matplotlib-3.10.0+computecanada-cp312-cp312-linux_x86_64.whl (from -r /home/aneumann/projects/def-adhaj/aneumann/GNRS/requirements/or.txt (line 2))
Processing /cvmfs/soft.computecanada.ca/custom/python/wheelhouse/gentoo2023/x86-64-v3/pandas-2.2.3+computecanada-cp312-cp312-linux_x86_64.whl (from -r /home/aneumann/projects/def-adhaj/aneumann/GNRS/requirements/or.txt (line 3))
Processing /cvmfs/soft.computecanada.ca/custom/python/wheelhouse/generic/absl_py-2.3.0+computecanada-py3-none-any.whl (from ortools<9.11,>=9.10->-r /home/aneumann/projects/def-adhaj/aneumann/GNRS/requirements/or.txt (line 1))
Processing /cvmfs/soft.computecanada.ca/custom/python/wheelhouse/gentoo2023/generic/numpy-2.2.2+computecanada-cp312-cp312-linux_x86_64.whl (from ortools<9.11,>=9.10->-r /home/aneumann/projects/def-adhaj/aneumann/GNRS/requirements/or.txt (line 1))
Processing /cvmfs/soft.computecanada.ca/custom/python/wheelhouse/gentoo2023/x86-64-v3/protobuf-6.31.1+computecanada-cp312-cp312-linux_x86_64.whl (from ortools<9.11,>=9.10->-r /home/aneumann/projects/def-adhaj/aneumann/GNRS/requirements/or.txt (line 1))
Requirement already satisfied: immutabledict>=3.0.0 in /localscratch/aneumann.46806182.0/env/lib/python3.12/site-packages (from ortools<9.11,>=9.10->-r /home/aneumann/projects/def-adhaj/aneumann/GNRS/requirements/or.txt (line 1)) (4.2.0)
Processing /cvmfs/soft.computecanada.ca/custom/python/wheelhouse/gentoo2023/generic/contourpy-1.3.1+computecanada-cp312-cp312-linux_x86_64.whl (from matplotlib->-r /home/aneumann/projects/def-adhaj/aneumann/GNRS/requirements/or.txt (line 2))
Processing /cvmfs/soft.computecanada.ca/custom/python/wheelhouse/generic/cycler-0.12.1+computecanada-py3-none-any.whl (from matplotlib->-r /home/aneumann/projects/def-adhaj/aneumann/GNRS/requirements/or.txt (line 2))
Processing /cvmfs/soft.computecanada.ca/custom/python/wheelhouse/generic/fonttools-4.59.0+computecanada-cp312-cp312-linux_x86_64.whl (from matplotlib->-r /home/aneumann/projects/def-adhaj/aneumann/GNRS/requirements/or.txt (line 2))
Processing /cvmfs/soft.computecanada.ca/custom/python/wheelhouse/gentoo2023/x86-64-v3/kiwisolver-1.4.8+computecanada-cp312-cp312-linux_x86_64.whl (from matplotlib->-r /home/aneumann/projects/def-adhaj/aneumann/GNRS/requirements/or.txt (line 2))
Processing /cvmfs/soft.computecanada.ca/custom/python/wheelhouse/generic/packaging-25.0+computecanada-py3-none-any.whl (from matplotlib->-r /home/aneumann/projects/def-adhaj/aneumann/GNRS/requirements/or.txt (line 2))
Processing /cvmfs/soft.computecanada.ca/custom/python/wheelhouse/gentoo2023/x86-64-v3/pillow-11.1.0+computecanada-cp312-cp312-linux_x86_64.whl (from matplotlib->-r /home/aneumann/projects/def-adhaj/aneumann/GNRS/requirements/or.txt (line 2))
Processing /cvmfs/soft.computecanada.ca/custom/python/wheelhouse/generic/pyparsing-3.2.3+computecanada-py3-none-any.whl (from matplotlib->-r /home/aneumann/projects/def-adhaj/aneumann/GNRS/requirements/or.txt (line 2))
Processing /cvmfs/soft.computecanada.ca/custom/python/wheelhouse/generic/python_dateutil-2.9.0.post0+computecanada-py2.py3-none-any.whl (from matplotlib->-r /home/aneumann/projects/def-adhaj/aneumann/GNRS/requirements/or.txt (line 2))
Processing /cvmfs/soft.computecanada.ca/custom/python/wheelhouse/generic/pytz-2025.2+computecanada-py2.py3-none-any.whl (from pandas->-r /home/aneumann/projects/def-adhaj/aneumann/GNRS/requirements/or.txt (line 3))
Processing /cvmfs/soft.computecanada.ca/custom/python/wheelhouse/generic/tzdata-2025.2+computecanada-py2.py3-none-any.whl (from pandas->-r /home/aneumann/projects/def-adhaj/aneumann/GNRS/requirements/or.txt (line 3))
Processing /cvmfs/soft.computecanada.ca/custom/python/wheelhouse/generic/six-1.17.0+computecanada-py2.py3-none-any.whl (from python-dateutil>=2.7->matplotlib->-r /home/aneumann/projects/def-adhaj/aneumann/GNRS/requirements/or.txt (line 2))
Installing collected packages: pytz, tzdata, six, pyparsing, protobuf, pillow, packaging, numpy, kiwisolver, fonttools, cycler, absl-py, python-dateutil, contourpy, pandas, matplotlib, ortools
Successfully installed absl-py-2.3.0+computecanada contourpy-1.3.1+computecanada cycler-0.12.1+computecanada fonttools-4.59.0+computecanada kiwisolver-1.4.8+computecanada matplotlib-3.10.0+computecanada numpy-2.2.2+computecanada ortools-9.10.4067+computecanada packaging-25.0+computecanada pandas-2.2.3+computecanada pillow-11.1.0+computecanada protobuf-6.31.1+computecanada pyparsing-3.2.3+computecanada python-dateutil-2.9.0.post0+computecanada pytz-2025.2+computecanada six-1.17.0+computecanada tzdata-2025.2+computecanada

Starting CP-SAT solver v9.10.4067
Parameters: max_time_in_seconds: 86400 max_memory_in_mb: 185000 log_search_progress: true enumerate_all_solutions: false num_search_workers: 32 absolute_gap_limit: 0 relative_gap_limit: 0

Initial optimization model '': (model_fingerprint: 0x5b0b70258661310b)
#Variables: 419 (#ints: 11 in objective)
  - 312 Booleans in [0,1]
  - 107 in [0,693]
#kLinear1: 52
#kLinear2: 682
#kLinear3: 308
#kLinearN: 7'434 (#terms: 133'234)

Starting presolve at 0.00s
  4.17e-03s  0.00e+00d  [DetectDominanceRelations] 
  6.41e-02s  0.00e+00d  [PresolveToFixPoint] #num_loops=8 #num_dual_strengthening=3 
  5.04e-05s  0.00e+00d  [ExtractEncodingFromLinear] #potential_supersets=6 
[Symmetry] Graph for symmetry has 8'392 nodes and 108'922 arcs.
[Symmetry] Symmetry computation done. time: 0.00377182 dtime: 0.00860221
[Symmetry] #generators: 1, average support size: 32
[Symmetry] The model contains 296 duplicate constraints !
[Symmetry] 16 orbits with sizes: 2,2,2,2,2,2,2,2,2,2,...
[Symmetry] Num fixable by intersecting at_most_one with orbits: 1 largest_orbit: 2
  2.61e-02s  6.16e-03d  [Probe] #probed=468 #new_bounds=9 #equiv=1 
  7.60e-05s  0.00e+00d  [MaxClique] 
  4.07e-03s  0.00e+00d  [DetectDominanceRelations] 
  2.94e-02s  0.00e+00d  [PresolveToFixPoint] #num_loops=5 #num_dual_strengthening=3 
  1.43e-02s  0.00e+00d  [ProcessAtMostOneAndLinear] 
  5.17e-03s  0.00e+00d  [DetectDuplicateConstraints] #duplicates=401 #without_enforcements=69 
  5.46e-03s  4.86e-04d  [DetectDominatedLinearConstraints] #relevant_constraints=6'767 #num_inclusions=4'145 
  6.54e-04s  0.00e+00d  [DetectDifferentVariables] #different=31 #cliques=1 #size=7 
  1.33e-03s  1.70e-04d  [ProcessSetPPC] #relevant_constraints=6'323 
  3.10e-05s  0.00e+00d  [FindAlmostIdenticalLinearConstraints] 
  3.88e-04s  6.96e-04d  [FindBigAtMostOneAndLinearOverlap] 
  1.20e-02s  1.10e-02d  [FindBigVerticalLinearOverlap] #blocks=70 #saved_nz=14'611 
  7.89e-04s  4.13e-04d  [FindBigHorizontalLinearOverlap] #linears=6'223 
  2.68e-05s  0.00e+00d  [MergeClauses] 
  4.31e-03s  0.00e+00d  [DetectDominanceRelations] 
  3.89e-02s  0.00e+00d  [PresolveToFixPoint] #num_loops=2 #num_dual_strengthening=1 
  4.36e-03s  0.00e+00d  [DetectDominanceRelations] 
  2.33e-02s  0.00e+00d  [PresolveToFixPoint] #num_loops=1 #num_dual_strengthening=1 
[Symmetry] Graph for symmetry has 8'228 nodes and 93'027 arcs.
[Symmetry] Symmetry computation done. time: 0.00179152 dtime: 0.00503956
  2.39e-02s  5.57e-03d  [Probe] #probed=468 #new_bounds=31 
  1.55e-05s  0.00e+00d  [MaxClique] 
  4.30e-03s  0.00e+00d  [DetectDominanceRelations] 
  3.03e-02s  0.00e+00d  [PresolveToFixPoint] #num_loops=2 #num_dual_strengthening=1 
  1.41e-02s  0.00e+00d  [ProcessAtMostOneAndLinear] 
  4.51e-03s  0.00e+00d  [DetectDuplicateConstraints] #without_enforcements=78 
  4.05e-03s  3.62e-04d  [DetectDominatedLinearConstraints] #relevant_constraints=6'722 #num_inclusions=1'274 
  5.25e-04s  0.00e+00d  [DetectDifferentVariables] 
  1.24e-03s  1.39e-04d  [ProcessSetPPC] #relevant_constraints=6'195 
  3.96e-05s  1.60e-07d  [FindAlmostIdenticalLinearConstraints] #num_tested_pairs=10 
  1.80e-04s  2.77e-04d  [FindBigAtMostOneAndLinearOverlap] 
  1.00e-02s  9.07e-03d  [FindBigVerticalLinearOverlap] #blocks=93 #saved_nz=11'944 
  7.60e-04s  3.48e-04d  [FindBigHorizontalLinearOverlap] #linears=6'073 
  1.95e-05s  0.00e+00d  [MergeClauses] 
  3.96e-03s  0.00e+00d  [DetectDominanceRelations] 
  4.01e-02s  0.00e+00d  [PresolveToFixPoint] #num_loops=2 #num_dual_strengthening=1 
  3.95e-03s  0.00e+00d  [DetectDominanceRelations] 
  2.66e-02s  0.00e+00d  [PresolveToFixPoint] #num_loops=1 #num_dual_strengthening=1 
[Symmetry] Graph for symmetry has 8'483 nodes and 81'154 arcs.
[Symmetry] Symmetry computation done. time: 0.00165257 dtime: 0.00446732
  2.20e-02s  4.94e-03d  [Probe] #probed=468 #new_bounds=71 
  1.53e-05s  0.00e+00d  [MaxClique] 
  3.94e-03s  0.00e+00d  [DetectDominanceRelations] 
  3.73e-02s  0.00e+00d  [PresolveToFixPoint] #num_loops=2 #num_dual_strengthening=1 
  1.32e-02s  0.00e+00d  [ProcessAtMostOneAndLinear] 
  4.44e-03s  0.00e+00d  [DetectDuplicateConstraints] #without_enforcements=96 
  3.20e-03s  2.84e-04d  [DetectDominatedLinearConstraints] #relevant_constraints=6'602 #num_inclusions=379 
  5.16e-04s  0.00e+00d  [DetectDifferentVariables] 
  1.10e-03s  1.14e-04d  [ProcessSetPPC] #relevant_constraints=6'031 
  5.37e-05s  1.60e-06d  [FindAlmostIdenticalLinearConstraints] #num_tested_pairs=104 
  1.71e-04s  2.36e-04d  [FindBigAtMostOneAndLinearOverlap] 
  8.99e-03s  7.27e-03d  [FindBigVerticalLinearOverlap] #blocks=129 #saved_nz=11'469 
  6.76e-04s  2.81e-04d  [FindBigHorizontalLinearOverlap] #linears=5'717 
  2.00e-05s  0.00e+00d  [MergeClauses] 
  3.47e-03s  0.00e+00d  [DetectDominanceRelations] 
  4.37e-02s  0.00e+00d  [PresolveToFixPoint] #num_loops=2 #num_dual_strengthening=1 
  1.30e-04s  0.00e+00d  [ExpandObjective] #entries=1'177 #tight_variables=471 #tight_constraints=253 

Presolve summary:
  - 109 affine relations were detected.
  - rule 'TODO dual: only one blocking constraint?' was applied 835 times.
  - rule 'TODO dual: only one blocking enforced constraint?' was applied 104 times.
  - rule 'TODO dual: only one unspecified blocking constraint?' was applied 38 times.
  - rule 'TODO duplicate: identical constraint with different enforcements' was applied 243 times.
  - rule 'affine: new relation' was applied 109 times.
  - rule 'at_most_one: removed literals' was applied 4 times.
  - rule 'at_most_one: size one' was applied 4 times.
  - rule 'deductions: 356 stored' was applied 1 time.
  - rule 'dual: fix variable' was applied 30 times.
  - rule 'dual: reduced domain' was applied 57 times.
  - rule 'duplicate: merged rhs of linear constraint' was applied 87 times.
  - rule 'duplicate: removed constraint' was applied 401 times.
  - rule 'enforcement: false literal' was applied 8 times.
  - rule 'exactly_one: x and not(x)' was applied 1 time.
  - rule 'incompatible linear: add implication' was applied 63 times.
  - rule 'linear matrix: common vertical rectangle' was applied 292 times.
  - rule 'linear: always true' was applied 868 times.
  - rule 'linear: doubleton free' was applied 14 times.
  - rule 'linear: empty' was applied 36 times.
  - rule 'linear: extracted enforcement literal' was applied 8'660 times.
  - rule 'linear: fixed or dup variables' was applied 7'560 times.
  - rule 'linear: positive equal one' was applied 6 times.
  - rule 'linear: reduced variable domains' was applied 381 times.
  - rule 'linear: remapped using affine relations' was applied 7'798 times.
  - rule 'linear: simplified rhs' was applied 21'363 times.
  - rule 'linear: tightened into equality' was applied 10 times.
  - rule 'linear: variable substitution 1' was applied 14 times.
  - rule 'linear: variable substitution 2' was applied 11 times.
  - rule 'linear: variable substitution 3' was applied 10 times.
  - rule 'no_overlap: inferred from x != y constraints' was applied 1 time.
  - rule 'presolve: 106 unused variables removed.' was applied 1 time.
  - rule 'presolve: iteration' was applied 3 times.
  - rule 'probing: reduced enforced constraint to implication.' was applied 4 times.
  - rule 'symmetry: fixed to false in general orbit' was applied 1 time.

Presolved optimization model '': (model_fingerprint: 0xe27d4462d4c0953d)
#Variables: 461 (#ints: 11 in objective)
  - 121 Booleans in [0,1]
  - 288 different domains in [-6134,6819] with a largest complexity of 15.
#kExactlyOne: 5 (#literals: 15)
#kInterval: 7
#kLinear2: 646 (#enforced: 602 #multi: 426)
#kLinear3: 672 (#enforced: 425 #multi: 17)
#kLinearN: 5'984 (#enforced: 5'602) (#terms: 57'235)
#kNoOverlap: 1 (#intervals: 7)

Preloading model.
#Bound   0.55s best:inf   next:[190,6528] initial_domain
[Symmetry] Graph for symmetry has 8'587 nodes and 69'789 arcs.
[Symmetry] Symmetry computation done. time: 0.00138284 dtime: 0.00386122
#Model   0.56s var:461/461 constraints:7315/7315

Starting search at 0.57s with 32 workers.
17 full problem subsolvers: [core, default_lp, fixed, lb_tree_search, max_lp, no_lp, objective_lb_search, objective_lb_search_max_lp, objective_lb_search_no_lp, objective_shaving_search_max_lp, objective_shaving_search_no_lp, probing, probing_max_lp, pseudo_costs, quick_restart, quick_restart_no_lp, reduced_costs]
13 first solution subsolvers: [fj_long_default, fj_long_lin_default, fj_long_random, fj_short_default, fj_short_lin_default, fj_short_lin_random, fj_short_random, fs_random(2), fs_random_no_lp, fs_random_quick_restart(2), fs_random_quick_restart_no_lp]
13 incomplete subsolvers: [feasibility_pump, graph_arc_lns, graph_cst_lns, graph_dec_lns, graph_var_lns, rins/rens, rnd_cst_lns, rnd_var_lns, scheduling_intervals_lns, scheduling_precedences_lns, scheduling_time_window_lns, violation_ls(2)]
3 helper subsolvers: [neighborhood_helper, synchronization_agent, update_gap_integral]
#Bound   0.67s best:inf   next:[191,6528] bool_core (num_cores=1 [size:2 mw:1 d:1] a=10 d=1 fixed=0/132 clauses=7)
#Bound   0.67s best:inf   next:[192,6528] bool_core (num_cores=1 [cover] a=10 d=1 fixed=0/135 clauses=8)
#Bound   0.67s best:inf   next:[193,6528] bool_core (num_cores=1 [cover] a=10 d=1 fixed=1/138 clauses=10)
#Bound   0.67s best:inf   next:[194,6528] bool_core (num_cores=1 [cover] a=10 d=1 fixed=2/141 clauses=13)
#Bound   0.68s best:inf   next:[195,6528] bool_core (num_cores=1 [cover] a=10 d=1 fixed=3/144 clauses=17)
#Bound   0.68s best:inf   next:[196,6528] bool_core (num_cores=1 [cover] a=10 d=1 fixed=4/147 clauses=22)
#Bound   0.68s best:inf   next:[197,6528] bool_core (num_cores=1 [cover] a=10 d=1 fixed=5/150 clauses=28)
#Bound   0.68s best:inf   next:[198,6528] bool_core (num_cores=1 [cover] a=10 d=1 fixed=6/153 clauses=35)
#Bound   0.68s best:inf   next:[199,6528] bool_core (num_cores=1 [cover] a=10 d=1 fixed=7/156 clauses=43)
#Bound   0.69s best:inf   next:[200,6528] bool_core (num_cores=1 [cover] a=10 d=1 fixed=8/159 clauses=52)
#Bound   0.69s best:inf   next:[201,6528] bool_core (num_cores=1 [cover] a=10 d=1 fixed=9/162 clauses=62)
#Bound   0.69s best:inf   next:[202,6528] bool_core (num_cores=1 [cover] a=10 d=1 fixed=10/165 clauses=73)
#Bound   0.70s best:inf   next:[203,6528] bool_core (num_cores=1 [cover] a=10 d=1 fixed=11/168 clauses=85)
#Bound   0.70s best:inf   next:[204,6528] bool_core (num_cores=1 [cover] a=10 d=1 fixed=12/171 clauses=98)
#Bound   0.71s best:inf   next:[205,6528] bool_core (num_cores=1 [cover] a=10 d=1 fixed=13/174 clauses=112)
#Bound   0.71s best:inf   next:[206,6528] bool_core (num_cores=1 [cover] a=10 d=1 fixed=14/177 clauses=127)
#Bound   0.72s best:inf   next:[207,6528] bool_core (num_cores=1 [cover] a=10 d=1 fixed=15/180 clauses=143)
#Bound   0.72s best:inf   next:[208,6528] bool_core (num_cores=1 [cover] a=10 d=1 fixed=16/183 clauses=160)
#Bound   0.73s best:inf   next:[209,6528] bool_core (num_cores=1 [cover] a=10 d=1 fixed=17/186 clauses=178)
#Bound   0.73s best:inf   next:[210,6528] bool_core (num_cores=1 [cover] a=10 d=1 fixed=18/189 clauses=197)
#Bound   0.98s best:inf   next:[353,6528] objective_lb_search_no_lp [skipped_logs=72]
#1       1.14s best:5997  next:[353,5996] fj_long_random(batch:2 #lin_moves:10'651 #lin_evals:41'617 #weight_updates:154)
#2       1.22s best:5995  next:[353,5994] violation_ls(batch:1 #solutions_imported:1 #lin_moves:0 #lin_evals:3 #gen_moves:1 #gen_evals:0 #comp_moves:1 #backtracks:0 #weight_updates:0)
#3       1.26s best:4249  next:[353,4248] rnd_var_lns (d=0.50 s=40 t=0.10 p=0.00 stall=0 h=auto_l0) [presolve]
#4       1.26s best:4102  next:[353,4101] rnd_var_lns (d=0.50 s=50 t=0.10 p=0.00 stall=0 h=auto_l0) [presolve]
#5       1.26s best:4100  next:[353,4099] violation_ls(batch:2 #solutions_imported:2 #lin_moves:2 #lin_evals:14 #weight_updates:0)
#6       1.29s best:2723  next:[353,2722] graph_var_lns (d=0.50 s=52 t=0.10 p=0.00 stall=0 h=auto_l0) [presolve]
#7       1.30s best:2493  next:[353,2492] fixed (fixed_bools=0/871)
#8       1.64s best:2293  next:[353,2292] objective_lb_search (fixed_bools=0/163)
#9       1.72s best:2292  next:[360,2291] violation_ls(batch:4 #solutions_imported:4 #lin_moves:9'668 #lin_evals:45'652 #gen_moves:4'201 #gen_evals:987 #comp_moves:295 #backtracks:1'953 #weight_updates:416)
#10      1.72s best:2291  next:[360,2290] violation_ls(batch:4 #solutions_imported:4 #lin_moves:3 #lin_evals:14'819 #gen_moves:6'239 #gen_evals:1'720 #comp_moves:401 #backtracks:2'917 #weight_updates:92)
#11      1.76s best:2290  next:[360,2289] rnd_var_lns (d=0.88 s=75 t=0.10 p=1.00 stall=1 h=auto_l0) [presolve]
#12      1.78s best:2276  next:[360,2275] no_lp (fixed_bools=0/194)
#13      1.79s best:2083  next:[360,2082] no_lp (fixed_bools=0/199)
#14      1.81s best:2075  next:[558,2074] no_lp (fixed_bools=0/206)
#15      1.85s best:2048  next:[558,2047] no_lp (fixed_bools=0/210)
#16      1.87s best:2040  next:[566,2039] no_lp (fixed_bools=0/214)
#17      1.88s best:2014  next:[566,2013] no_lp (fixed_bools=0/220)
#18      1.95s best:1984  next:[566,1983] no_lp (fixed_bools=0/229)
#19      1.96s best:1978  next:[566,1977] no_lp (fixed_bools=0/237)
#20      1.97s best:1950  next:[566,1949] no_lp (fixed_bools=0/242)
#Bound   2.00s best:1950  next:[568,1949] objective_lb_search_no_lp [skipped_logs=3]
#21      2.06s best:1937  next:[568,1936] no_lp (fixed_bools=0/248)
#22      2.07s best:1883  next:[568,1882] no_lp (fixed_bools=0/253)
#23      2.10s best:1863  next:[568,1862] no_lp (fixed_bools=0/256)
#24      2.12s best:1852  next:[568,1851] no_lp (fixed_bools=0/261)
#25      2.13s best:1846  next:[568,1845] no_lp (fixed_bools=0/267)
#26      2.17s best:1832  next:[568,1831] no_lp (fixed_bools=0/273)
#27      2.20s best:1789  next:[568,1788] no_lp (fixed_bools=0/281)
#28      2.22s best:1779  next:[586,1778] no_lp (fixed_bools=0/292)
#29      2.31s best:1768  next:[607,1767] no_lp (fixed_bools=0/296)
#30      2.44s best:1675  next:[613,1674] quick_restart_no_lp (fixed_bools=0/213)
#31      2.68s best:1670  next:[617,1669] no_lp (fixed_bools=0/328)
#32      2.76s best:1661  next:[675,1660] no_lp (fixed_bools=0/337)
#33      2.78s best:1637  next:[675,1636] no_lp (fixed_bools=0/338)
#34      2.81s best:1635  next:[675,1634] quick_restart_no_lp (fixed_bools=0/266)
#35      2.82s best:1634  next:[675,1633] quick_restart_no_lp (fixed_bools=0/274)
#36      2.84s best:1633  next:[675,1632] quick_restart_no_lp (fixed_bools=0/300)
#37      2.90s best:1632  next:[675,1631] no_lp (fixed_bools=0/342)
#38      2.98s best:1630  next:[683,1629] no_lp (fixed_bools=0/343)
#Bound   2.90s best:1632  next:[683,1631] objective_lb_search_no_lp [skipped_logs=7]
#39      3.03s best:1619  next:[683,1618] no_lp (fixed_bools=0/344)
#40      3.06s best:1618  next:[683,1617] no_lp (fixed_bools=0/344)
#41      3.08s best:1595  next:[683,1594] quick_restart_no_lp (fixed_bools=0/336)
#42      3.24s best:1556  next:[693,1555] no_lp (fixed_bools=0/354)
#43      3.36s best:1551  next:[702,1550] graph_var_lns (d=0.94 s=106 t=0.10 p=1.00 stall=1 h=auto_l0)
#44      3.39s best:1533  next:[702,1532] no_lp (fixed_bools=0/363)
#45      3.60s best:1528  next:[709,1527] rnd_var_lns (d=0.96 s=123 t=0.10 p=1.00 stall=2 h=auto_l0)
#46      3.76s best:1527  next:[711,1526] graph_dec_lns (d=0.96 s=128 t=0.10 p=1.00 stall=4 h=auto_l0)
#47      3.96s best:1513  next:[711,1512] no_lp (fixed_bools=0/384)
#Bound   3.64s best:1528  next:[711,1527] objective_lb_search_no_lp [skipped_logs=3]
#48      4.17s best:1473  next:[711,1472] rins_lp_lns (d=0.81 s=118 t=0.10 p=1.00 stall=2 h=auto_l0)
#49      4.30s best:1326  next:[712,1325] scheduling_precedences_lns (d=0.50 s=112 t=0.10 p=0.00 stall=0 h=auto_l0)
#50      4.60s best:1313  next:[713,1312] graph_dec_lns (d=0.97 s=159 t=0.10 p=1.00 stall=0 h=auto_l0)
#Bound   4.84s best:1313  next:[749,1312] objective_lb_search_max_lp [skipped_logs=4]
#51      5.24s best:1308  next:[749,1307] quick_restart (fixed_bools=1/322)
#52      5.32s best:1307  next:[749,1306] violation_ls(batch:12 #solutions_imported:11 #lin_moves:30'794 #lin_evals:200'052 #gen_moves:24'551 #gen_evals:4'566 #comp_moves:2'077 #backtracks:11'233 #weight_updates:19'553)
#53      5.41s best:1303  next:[749,1302] graph_arc_lns (d=0.99 s=187 t=0.10 p=1.00 stall=7 h=auto_l0)
#54      5.43s best:1302  next:[749,1301] rnd_cst_lns (d=0.96 s=201 t=0.10 p=1.00 stall=6 h=auto_l0)
#55      5.61s best:1293  next:[750,1292] graph_cst_lns (d=0.98 s=205 t=0.10 p=1.00 stall=8 h=auto_l0)
#56      5.62s best:1292  next:[750,1291] violation_ls(batch:13 #solutions_imported:12 #lin_moves:30'794 #lin_evals:200'075 #gen_moves:24'565 #gen_evals:4'568 #comp_moves:2'079 #backtracks:11'239 #weight_updates:19'553)
#57      5.62s best:1291  next:[750,1290] violation_ls(batch:13 #solutions_imported:12 #lin_moves:14'990 #lin_evals:169'782 #gen_moves:38'985 #gen_evals:7'585 #comp_moves:3'080 #backtracks:17'938 #weight_updates:5'516)
#58      5.78s best:1283  next:[750,1282] graph_arc_lns (d=0.99 s=203 t=0.10 p=1.00 stall=7 h=auto_l0)
#59      5.94s best:1273  next:[750,1272] rins_lp_lns (d=0.85 s=197 t=0.10 p=0.60 stall=3 h=auto_l0)
#Bound   5.94s best:1273  next:[751,1272] objective_lb_search_no_lp [skipped_logs=1]
#Bound   6.92s best:1273  next:[764,1272] objective_lb_search_no_lp [skipped_logs=2]
#60      7.52s best:1268  next:[770,1267] rins_lp_lns (d=0.80 s=274 t=0.10 p=0.53 stall=3 h=auto_l0)
#Bound   7.87s best:1268  next:[772,1267] objective_lb_search_no_lp [skipped_logs=2]
#Bound   8.93s best:1268  next:[777,1267] objective_lb_search_no_lp [skipped_logs=0]
#Bound  10.36s best:1268  next:[779,1267] objective_lb_search
#Bound  10.81s best:1268  next:[798,1267] objective_lb_search_no_lp [skipped_logs=2]
#Bound  13.73s best:1268  next:[801,1267] objective_lb_search
#Bound  13.90s best:1268  next:[808,1267] objective_lb_search
#Bound  14.07s best:1268  next:[809,1267] objective_lb_search
#Bound  14.68s best:1268  next:[813,1267] objective_lb_search [skipped_logs=0]
#Bound  15.41s best:1268  next:[818,1267] objective_lb_search [skipped_logs=0]
#Bound  18.47s best:1268  next:[826,1267] objective_lb_search_no_lp
#Bound  19.42s best:1268  next:[828,1267] objective_lb_search
#Bound  19.85s best:1268  next:[831,1267] objective_lb_search
#Bound  20.76s best:1268  next:[833,1267] objective_lb_search
#Bound  21.16s best:1268  next:[836,1267] objective_lb_search
#Bound  22.26s best:1268  next:[837,1267] objective_lb_search
#Bound  23.03s best:1268  next:[838,1267] objective_lb_search
#Bound  23.70s best:1268  next:[839,1267] objective_lb_search [skipped_logs=0]
#Bound  24.92s best:1268  next:[845,1267] objective_lb_search [skipped_logs=0]
#Bound  29.17s best:1268  next:[852,1267] objective_lb_search
#Bound  30.46s best:1268  next:[855,1267] objective_lb_search_no_lp
#Bound  32.07s best:1268  next:[856,1267] objective_lb_search
#Bound  32.16s best:1268  next:[857,1267] objective_lb_search_no_lp
#Bound  33.04s best:1268  next:[859,1267] objective_lb_search
#Bound  38.11s best:1268  next:[860,1267] objective_lb_search
#Bound  41.73s best:1268  next:[862,1267] objective_lb_search_no_lp
#Bound  41.91s best:1268  next:[864,1267] objective_lb_search
#Bound  51.48s best:1268  next:[865,1267] lb_tree_search (nodes=5045/5055 rc=32 decisions=30219 @root=17 restarts=10) 
#Bound  54.92s best:1268  next:[866,1267] lb_tree_search (nodes=5129/5140 rc=33 decisions=31227 @root=18 restarts=10) 
#Bound  58.99s best:1268  next:[867,1267] lb_tree_search (nodes=5236/5247 rc=37 decisions=32411 @root=19 restarts=10) 
#Bound  62.18s best:1268  next:[868,1267] objective_lb_search_max_lp
#Bound  65.87s best:1268  next:[869,1267] lb_tree_search (nodes=5362/5376 rc=39 decisions=34398 @root=21 restarts=10) 
#Bound  70.16s best:1268  next:[870,1267] lb_tree_search (nodes=5474/5488 rc=41 decisions=35810 @root=22 restarts=10) 
#Bound  71.11s best:1268  next:[872,1267] objective_lb_search
#Bound  77.55s best:1268  next:[874,1267] objective_lb_search
#Bound  83.27s best:1268  next:[875,1267] lb_tree_search (nodes=5887/5905 rc=54 decisions=40623 @root=24 restarts=10) 
#Bound  87.37s best:1268  next:[876,1267] lb_tree_search (nodes=5962/5981 rc=55 decisions=41891 @root=25 restarts=10) 
#Bound  91.57s best:1268  next:[877,1267] lb_tree_search (nodes=6041/6060 rc=57 decisions=43194 @root=26 restarts=10) 
#Bound  92.28s best:1268  next:[878,1267] objective_lb_search
#Bound  96.76s best:1268  next:[881,1267] objective_lb_search_no_lp
#Bound 105.86s best:1268  next:[882,1267] lb_tree_search (nodes=6500/6525 rc=77 decisions=48359 @root=28 restarts=10) 
#Bound 109.17s best:1268  next:[884,1267] objective_lb_search_no_lp
#Bound 109.74s best:1268  next:[885,1267] objective_lb_search_no_lp
#Bound 119.92s best:1268  next:[886,1267] objective_lb_search_no_lp
#Bound 121.00s best:1268  next:[889,1267] objective_lb_search_no_lp
#Bound 124.21s best:1268  next:[890,1267] objective_lb_search_no_lp
#Bound 130.41s best:1268  next:[891,1267] objective_lb_search_no_lp
#Bound 139.95s best:1268  next:[892,1267] lb_tree_search (nodes=7821/7851 rc=126 decisions=60165 @root=31 restarts=10) 
#Bound 143.56s best:1268  next:[893,1267] objective_lb_search_no_lp
#Bound 150.14s best:1268  next:[894,1267] objective_lb_search_no_lp
#Bound 153.33s best:1268  next:[895,1267] objective_lb_search_no_lp
#Bound 155.94s best:1268  next:[896,1267] objective_lb_search_no_lp
#Bound 160.28s best:1268  next:[898,1267] objective_lb_search
#Bound 164.01s best:1268  next:[900,1267] objective_lb_search_no_lp
#Bound 171.39s best:1268  next:[901,1267] objective_lb_search_no_lp
#Bound 175.94s best:1268  next:[903,1267] objective_lb_search_no_lp
#Bound 189.74s best:1268  next:[906,1267] objective_lb_search_no_lp
#Bound 193.42s best:1268  next:[908,1267] objective_lb_search_no_lp
#Bound 204.95s best:1268  next:[910,1267] objective_lb_search_no_lp
#Bound 211.18s best:1268  next:[914,1267] objective_lb_search_no_lp
#Bound 225.76s best:1268  next:[916,1267] objective_lb_search_no_lp
#Bound 241.67s best:1268  next:[918,1267] objective_lb_search
#Bound 243.64s best:1268  next:[919,1267] objective_lb_search
#Bound 251.00s best:1268  next:[920,1267] objective_lb_search
#Bound 263.68s best:1268  next:[921,1267] objective_lb_search_no_lp
#Bound 264.28s best:1268  next:[932,1267] objective_lb_search
#Bound 277.12s best:1268  next:[933,1267] objective_lb_search_no_lp
#Bound 282.61s best:1268  next:[934,1267] objective_lb_search
#Bound 285.64s best:1268  next:[935,1267] objective_lb_search
#Bound 290.71s best:1268  next:[938,1267] objective_lb_search
#Bound 292.76s best:1268  next:[939,1267] objective_lb_search
#Bound 303.45s best:1268  next:[941,1267] objective_lb_search
#Bound 305.51s best:1268  next:[944,1267] objective_lb_search
#Bound 308.58s best:1268  next:[946,1267] objective_lb_search
#Bound 315.38s best:1268  next:[948,1267] objective_lb_search
#Bound 316.46s best:1268  next:[949,1267] objective_lb_search
#Bound 330.07s best:1268  next:[950,1267] objective_lb_search
#Bound 340.90s best:1268  next:[951,1267] objective_lb_search
#Bound 354.91s best:1268  next:[953,1267] objective_lb_search
#Bound 356.84s best:1268  next:[954,1267] objective_lb_search
#Bound 367.68s best:1268  next:[956,1267] objective_lb_search
#Bound 380.22s best:1268  next:[957,1267] objective_lb_search
#Model 391.89s var:460/461 constraints:7184/7315
#Bound 394.56s best:1268  next:[960,1267] objective_lb_search
#Bound 396.60s best:1268  next:[961,1267] objective_lb_search
#Bound 430.63s best:1268  next:[962,1267] objective_lb_search_no_lp
#Bound 455.36s best:1268  next:[964,1267] objective_lb_search
#Bound 478.01s best:1268  next:[965,1267] objective_lb_search
#Bound 481.57s best:1268  next:[966,1267] objective_lb_search
#Bound 487.57s best:1268  next:[968,1267] objective_lb_search
#Bound 500.18s best:1268  next:[969,1267] objective_lb_search
#Bound 506.52s best:1268  next:[970,1267] objective_lb_search
#Bound 508.99s best:1268  next:[972,1267] objective_lb_search
#Bound 539.80s best:1268  next:[973,1267] objective_lb_search
#Bound 542.85s best:1268  next:[975,1267] objective_lb_search
#Bound 549.28s best:1268  next:[977,1267] objective_lb_search
#Bound 551.52s best:1268  next:[978,1267] objective_lb_search
#Bound 561.55s best:1268  next:[979,1267] objective_lb_search
#Bound 568.82s best:1268  next:[980,1267] objective_lb_search
#Bound 569.51s best:1268  next:[982,1267] objective_lb_search
#Bound 579.18s best:1268  next:[984,1267] objective_lb_search
#Bound 579.88s best:1268  next:[985,1267] objective_lb_search
#Bound 605.62s best:1268  next:[986,1267] objective_lb_search_no_lp
#Bound 628.29s best:1268  next:[987,1267] objective_lb_search
#Bound 630.93s best:1268  next:[989,1267] objective_lb_search
#Bound 663.02s best:1268  next:[990,1267] objective_lb_search_no_lp
#Bound 669.24s best:1268  next:[993,1267] objective_lb_search
#Bound 713.14s best:1268  next:[994,1267] objective_lb_search
#Bound 714.55s best:1268  next:[996,1267] objective_lb_search
#Bound 727.67s best:1268  next:[1000,1267] objective_lb_search
#Bound 747.34s best:1268  next:[1001,1267] objective_lb_search
#Bound 752.17s best:1268  next:[1002,1267] objective_lb_search
#Bound 772.94s best:1268  next:[1004,1267] objective_lb_search
#Bound 781.95s best:1268  next:[1005,1267] objective_lb_search
#Bound 782.19s best:1268  next:[1006,1267] objective_lb_search
#Bound 818.82s best:1268  next:[1007,1267] objective_lb_search
#Bound 829.06s best:1268  next:[1010,1267] objective_lb_search
#Bound 860.50s best:1268  next:[1013,1267] objective_lb_search
#Bound 905.34s best:1268  next:[1015,1267] objective_lb_search
#Bound 908.45s best:1268  next:[1016,1267] objective_lb_search
#Bound 917.76s best:1268  next:[1017,1267] objective_lb_search
#Bound 923.54s best:1268  next:[1018,1267] objective_lb_search
#Bound 941.87s best:1268  next:[1019,1267] objective_lb_search
#Bound 944.33s best:1268  next:[1022,1267] objective_lb_search
#Bound 949.66s best:1268  next:[1025,1267] objective_lb_search
#Bound 980.31s best:1268  next:[1028,1267] objective_lb_search
#Bound 981.60s best:1268  next:[1030,1267] objective_lb_search
#Bound 1026.75s best:1268  next:[1031,1267] objective_lb_search
#Bound 1030.21s best:1268  next:[1032,1267] objective_lb_search
#Bound 1032.92s best:1268  next:[1033,1267] objective_lb_search
#Bound 1040.72s best:1268  next:[1034,1267] objective_lb_search
#Bound 1057.69s best:1268  next:[1035,1267] objective_lb_search
#Bound 1078.17s best:1268  next:[1036,1267] objective_lb_search
#Bound 1124.72s best:1268  next:[1037,1267] objective_lb_search
#Bound 1134.52s best:1268  next:[1038,1267] objective_lb_search
#Bound 1179.52s best:1268  next:[1039,1267] objective_lb_search
#Bound 1198.02s best:1268  next:[1040,1267] objective_lb_search
#Bound 1203.35s best:1268  next:[1041,1267] objective_lb_search
#Bound 1206.96s best:1268  next:[1042,1267] objective_lb_search
#Bound 1227.32s best:1268  next:[1044,1267] objective_lb_search_no_lp
#Bound 1243.13s best:1268  next:[1045,1267] objective_lb_search_no_lp
#Bound 1274.62s best:1268  next:[1046,1267] objective_lb_search_no_lp
#Bound 1323.40s best:1268  next:[1047,1267] objective_lb_search_no_lp
#Bound 1343.55s best:1268  next:[1048,1267] objective_lb_search
#Bound 1361.40s best:1268  next:[1049,1267] objective_lb_search_no_lp
#Bound 1373.29s best:1268  next:[1050,1267] objective_lb_search_no_lp
#Bound 1392.08s best:1268  next:[1051,1267] objective_lb_search_no_lp
#Bound 1411.71s best:1268  next:[1052,1267] objective_lb_search
#Bound 1418.08s best:1268  next:[1054,1267] objective_lb_search
#Bound 1419.76s best:1268  next:[1055,1267] objective_lb_search
#Bound 1456.97s best:1268  next:[1056,1267] objective_lb_search
#Bound 1472.82s best:1268  next:[1058,1267] objective_lb_search
#Bound 1520.54s best:1268  next:[1060,1267] objective_lb_search
#Bound 1536.58s best:1268  next:[1064,1267] objective_lb_search
#Bound 1601.68s best:1268  next:[1067,1267] objective_lb_search
#Bound 1604.85s best:1268  next:[1068,1267] objective_lb_search
#Bound 1715.46s best:1268  next:[1070,1267] objective_lb_search
#Bound 1723.15s best:1268  next:[1071,1267] objective_lb_search
#Bound 1725.42s best:1268  next:[1072,1267] objective_lb_search
#Bound 1729.02s best:1268  next:[1073,1267] objective_lb_search
#Bound 1732.09s best:1268  next:[1075,1267] objective_lb_search
#Bound 1741.39s best:1268  next:[1076,1267] objective_lb_search
#Bound 1743.68s best:1268  next:[1077,1267] objective_lb_search
#Bound 1746.37s best:1268  next:[1078,1267] objective_lb_search
#Bound 1755.20s best:1268  next:[1080,1267] objective_lb_search
#Bound 1756.73s best:1268  next:[1082,1267] objective_lb_search
#Bound 1760.63s best:1268  next:[1083,1267] objective_lb_search
#Bound 1773.40s best:1268  next:[1084,1267] objective_lb_search
#Bound 1776.18s best:1268  next:[1086,1267] objective_lb_search
#Bound 1778.32s best:1268  next:[1087,1267] objective_lb_search
#Bound 1779.52s best:1268  next:[1088,1267] objective_lb_search
#Bound 1785.38s best:1268  next:[1089,1267] objective_lb_search
#Bound 1796.79s best:1268  next:[1090,1267] objective_lb_search
#Bound 1796.96s best:1268  next:[1092,1267] objective_lb_search
#Bound 1814.84s best:1268  next:[1093,1267] objective_lb_search
#Bound 1821.80s best:1268  next:[1095,1267] objective_lb_search
#Bound 1839.25s best:1268  next:[1097,1267] objective_lb_search
#Bound 1975.97s best:1268  next:[1098,1267] objective_lb_search
#Bound 1977.44s best:1268  next:[1099,1267] objective_lb_search
#Bound 2050.43s best:1268  next:[1100,1267] objective_lb_search
#Bound 2053.13s best:1268  next:[1101,1267] objective_lb_search
#Bound 2066.62s best:1268  next:[1103,1267] objective_lb_search
#Bound 2069.85s best:1268  next:[1105,1267] objective_lb_search
#Model 2078.29s var:458/461 constraints:7059/7315
#Bound 2093.19s best:1268  next:[1108,1267] objective_lb_search
#Bound 2112.45s best:1268  next:[1109,1267] objective_lb_search
#Bound 2117.84s best:1268  next:[1110,1267] objective_lb_search
#Bound 2136.73s best:1268  next:[1112,1267] objective_lb_search
#Bound 2139.47s best:1268  next:[1113,1267] objective_lb_search
#Bound 2141.56s best:1268  next:[1115,1267] objective_lb_search
#Bound 2144.30s best:1268  next:[1116,1267] objective_lb_search
#Bound 2168.37s best:1268  next:[1117,1267] objective_lb_search
#Bound 2168.89s best:1268  next:[1118,1267] objective_lb_search
#Bound 2176.54s best:1268  next:[1119,1267] objective_lb_search
#Bound 2181.69s best:1268  next:[1120,1267] objective_lb_search
#Bound 2210.94s best:1268  next:[1129,1267] objective_lb_search
#Model 2211.97s var:456/461 constraints:6914/7315
#Bound 2248.17s best:1268  next:[1130,1267] objective_lb_search
#Bound 2252.29s best:1268  next:[1131,1267] objective_lb_search
#Bound 2262.93s best:1268  next:[1134,1267] objective_lb_search
#Bound 2263.33s best:1268  next:[1135,1267] objective_lb_search
#Bound 2266.06s best:1268  next:[1136,1267] objective_lb_search
#Bound 2281.06s best:1268  next:[1137,1267] objective_lb_search
#Bound 2285.09s best:1268  next:[1138,1267] objective_lb_search
#Bound 2295.05s best:1268  next:[1139,1267] objective_lb_search
#Bound 2300.28s best:1268  next:[1140,1267] objective_lb_search
#Bound 2313.08s best:1268  next:[1141,1267] objective_lb_search
#Bound 2315.07s best:1268  next:[1143,1267] objective_lb_search
#Bound 2320.25s best:1268  next:[1144,1267] objective_lb_search
#Bound 2325.68s best:1268  next:[1145,1267] objective_lb_search
#Model 2327.53s var:455/461 constraints:6896/7315
#Bound 2328.41s best:1268  next:[1147,1267] objective_lb_search
#Bound 2331.37s best:1268  next:[1148,1267] objective_lb_search
#Model 2336.37s var:453/461 constraints:6741/7315
#Model 2337.33s var:439/461 constraints:5729/7315
#Model 2344.91s var:437/461 constraints:5636/7315
#Model 2346.68s var:436/461 constraints:5595/7315
#Bound 2348.51s best:1268  next:[1150,1267] objective_lb_search
#Bound 2353.34s best:1268  next:[1152,1267] objective_lb_search
#Model 2358.80s var:434/461 constraints:5343/7315
#Bound 2359.82s best:1268  next:[1153,1267] objective_lb_search
#Model 2359.84s var:433/461 constraints:5305/7315
#Model 2364.36s var:432/461 constraints:5254/7315
#Bound 2366.22s best:1268  next:[1154,1267] objective_lb_search
#Bound 2367.01s best:1268  next:[1155,1267] objective_lb_search
#Bound 2367.68s best:1268  next:[1159,1267] objective_lb_search
#Model 2367.98s var:431/461 constraints:5211/7315
#Bound 2368.45s best:1268  next:[1163,1267] objective_lb_search
#Bound 2369.12s best:1268  next:[1164,1267] objective_lb_search
#Model 2370.08s var:429/461 constraints:5075/7315
#Bound 2370.92s best:1268  next:[1166,1267] objective_lb_search
#Model 2371.80s var:428/461 constraints:5044/7315
#Model 2372.50s var:427/461 constraints:4974/7315
#Model 2373.76s var:424/461 constraints:4629/7315
#Model 2375.47s var:423/461 constraints:4546/7315
#Bound 2375.98s best:1268  next:[1178,1267] objective_lb_search
#Model 2376.32s var:419/461 constraints:4334/7315
#Model 2376.82s var:414/461 constraints:4022/7315
#Model 2377.08s var:413/461 constraints:3946/7315
#Model 2377.11s var:412/461 constraints:3834/7315
#Model 2377.17s var:411/461 constraints:3792/7315
#Model 2377.21s var:410/461 constraints:3705/7315
#Model 2377.30s var:403/461 constraints:3083/7315
#Bound 2377.31s best:1268  next:[1192,1267] quick_restart_no_lp
#Bound 2377.31s best:1268  next:[1198,1267] quick_restart_no_lp
#Model 2377.31s var:399/461 constraints:2630/7315
#Bound 2377.31s best:1268  next:[1202,1267] quick_restart_no_lp
#Done  2377.31s quick_restart_no_lp
#Model 2377.32s var:391/461 constraints:1928/7315
#Model 2377.32s var:385/461 constraints:1098/7315

Task timing                                  n [     min,      max]      avg      dev     time         n [     min,      max]      avg      dev    dtime
                             'core':         1 [  39.62m,   39.62m]   39.62m   0.00ns   39.62m         1 [  39.95m,   39.95m]   39.95m   0.00ns   39.95m
                       'default_lp':         1 [  39.61m,   39.61m]   39.61m   0.00ns   39.61m         1 [   8.44m,    8.44m]    8.44m   0.00ns    8.44m
                 'feasibility_pump':      2923 [146.18ms,    2.80s] 302.03ms 165.58ms   14.71m      2922 [ 32.10ms, 133.53ms]  50.68ms   1.65ms    2.47m
                            'fixed':         1 [  39.61m,   39.61m]   39.61m   0.00ns   39.61m         1 [   8.55m,    8.55m]    8.55m   0.00ns    8.55m
                  'fj_long_default':         1 [376.68ms, 376.68ms] 376.68ms   0.00ns 376.68ms         1 [103.09ms, 103.09ms] 103.09ms   0.00ns 103.09ms
              'fj_long_lin_default':         1 [224.95ms, 224.95ms] 224.95ms   0.00ns 224.95ms         1 [128.81ms, 128.81ms] 128.81ms   0.00ns 128.81ms
                   'fj_long_random':         2 [ 52.85ms, 171.60ms] 112.22ms  59.38ms 224.45ms         2 [  6.26ms, 114.06ms]  60.16ms  53.90ms 120.32ms
                 'fj_short_default':         1 [   1.28s,    1.28s]    1.28s   0.00ns    1.28s         1 [131.80ms, 131.80ms] 131.80ms   0.00ns 131.80ms
             'fj_short_lin_default':         1 [304.77ms, 304.77ms] 304.77ms   0.00ns 304.77ms         1 [122.25ms, 122.25ms] 122.25ms   0.00ns 122.25ms
              'fj_short_lin_random':         2 [115.38ms, 187.09ms] 151.24ms  35.86ms 302.47ms         2 [127.37ms, 134.50ms] 130.93ms   3.56ms 261.86ms
                  'fj_short_random':         3 [ 71.81ms, 136.87ms] 100.96ms  26.99ms 302.89ms         3 [119.54ms, 128.97ms] 125.13ms   4.05ms 375.40ms
                        'fs_random':         1 [622.35ms, 622.35ms] 622.35ms   0.00ns 622.35ms         1 [ 20.00ns,  20.00ns]  20.00ns   0.00ns  20.00ns
                        'fs_random':         1 [632.51ms, 632.51ms] 632.51ms   0.00ns 632.51ms         1 [  8.61ms,   8.61ms]   8.61ms   0.00ns   8.61ms
                  'fs_random_no_lp':         1 [660.58ms, 660.58ms] 660.58ms   0.00ns 660.58ms         0 [  0.00ns,   0.00ns]   0.00ns   0.00ns   0.00ns
          'fs_random_quick_restart':         1 [538.30ms, 538.30ms] 538.30ms   0.00ns 538.30ms         1 [  4.87ms,   4.87ms]   4.87ms   0.00ns   4.87ms
          'fs_random_quick_restart':         1 [630.85ms, 630.85ms] 630.85ms   0.00ns 630.85ms         1 [ 20.00ns,  20.00ns]  20.00ns   0.00ns  20.00ns
    'fs_random_quick_restart_no_lp':         1 [540.56ms, 540.56ms] 540.56ms   0.00ns 540.56ms         1 [316.22us, 316.22us] 316.22us   0.00ns 316.22us
                    'graph_arc_lns':      2934 [  4.35ms,    8.20s]    1.11s 770.84ms   54.12m      2832 [ 10.00ns, 309.29ms] 110.09ms  79.15ms    5.20m
                    'graph_cst_lns':      2934 [  3.90ms,    7.42s]    1.06s 734.40ms   51.64m      2818 [ 10.00ns, 305.35ms]  99.76ms  67.24ms    4.69m
                    'graph_dec_lns':      2934 [  7.46ms,    8.85s]    1.18s 793.74ms   57.53m      2853 [ 10.00ns, 477.80ms] 113.36ms  76.31ms    5.39m
                    'graph_var_lns':      2934 [  5.51ms,    6.94s]    1.05s 762.03ms   51.38m      2811 [ 10.00ns, 416.55ms] 103.88ms  80.14ms    4.87m
                   'lb_tree_search':         1 [  39.61m,   39.61m]   39.61m   0.00ns   39.61m         1 [  16.10m,   16.10m]   16.10m   0.00ns   16.10m
                           'max_lp':         1 [  39.61m,   39.61m]   39.61m   0.00ns   39.61m         1 [   9.59m,    9.59m]    9.59m   0.00ns    9.59m
                            'no_lp':         1 [  39.61m,   39.61m]   39.61m   0.00ns   39.61m         1 [   6.95m,    6.95m]    6.95m   0.00ns    6.95m
              'objective_lb_search':         1 [  39.61m,   39.61m]   39.61m   0.00ns   39.61m         1 [   9.33m,    9.33m]    9.33m   0.00ns    9.33m
       'objective_lb_search_max_lp':         1 [  39.61m,   39.61m]   39.61m   0.00ns   39.61m         1 [  11.21m,   11.21m]   11.21m   0.00ns   11.21m
        'objective_lb_search_no_lp':         1 [  39.61m,   39.61m]   39.61m   0.00ns   39.61m         1 [   5.10m,    5.10m]    5.10m   0.00ns    5.10m
  'objective_shaving_search_max_lp':       237 [ 53.97ms,    2.28m]   10.01s   15.81s   39.54m       220 [  5.59ms,   32.18s]    1.79s    3.25s    6.55m
   'objective_shaving_search_no_lp':       238 [ 47.46ms,    2.28m]    9.96s   15.80s   39.52m       223 [  5.64ms,   17.48s]    1.19s    1.99s    4.43m
                          'probing':         1 [  39.61m,   39.61m]   39.61m   0.00ns   39.61m         1 [  17.78m,   17.78m]   17.78m   0.00ns   17.78m
                   'probing_max_lp':         1 [  39.61m,   39.61m]   39.61m   0.00ns   39.61m         1 [  19.31m,   19.31m]   19.31m   0.00ns   19.31m
                     'pseudo_costs':         1 [  39.61m,   39.61m]   39.61m   0.00ns   39.61m         1 [   8.94m,    8.94m]    8.94m   0.00ns    8.94m
                    'quick_restart':         1 [  39.61m,   39.61m]   39.61m   0.00ns   39.61m         1 [  13.44m,   13.44m]   13.44m   0.00ns   13.44m
              'quick_restart_no_lp':         1 [  39.61m,   39.61m]   39.61m   0.00ns   39.61m         1 [  16.49m,   16.49m]   16.49m   0.00ns   16.49m
                    'reduced_costs':         1 [  39.61m,   39.61m]   39.61m   0.00ns   39.61m         1 [  10.21m,   10.21m]   10.21m   0.00ns   10.21m
                        'rins/rens':      2935 [108.63us,    3.86s] 468.73ms 418.49ms   22.93m      2339 [ 10.00ns, 124.42ms]  77.02ms  32.48ms    3.00m
                      'rnd_cst_lns':      2935 [  3.61ms,    7.56s]    1.10s 739.83ms   53.60m      2834 [ 10.00ns, 486.83ms] 112.80ms  79.94ms    5.33m
                      'rnd_var_lns':      2935 [  5.01ms,    7.71s]    1.07s 732.49ms   52.33m      2841 [ 10.00ns, 269.38ms] 106.67ms  72.43ms    5.05m
         'scheduling_intervals_lns':      2934 [  5.31ms,    8.50s]    1.51s 772.49ms    1.23h      2754 [100.00ms, 303.13ms] 174.40ms  53.10ms    8.00m
       'scheduling_precedences_lns':      2934 [  5.20ms,   10.28s]    1.49s 771.58ms    1.21h      2756 [100.00ms, 323.10ms] 174.27ms  53.12ms    8.00m
       'scheduling_time_window_lns':      2934 [  5.06ms,    9.59s]    1.54s 836.57ms    1.26h      2754 [100.00ms, 369.78ms] 177.47ms  54.55ms    8.15m
                     'violation_ls':      2935 [  1.02ms, 926.29ms] 127.50ms  65.65ms    6.24m      2935 [770.00ns, 412.88ms] 170.84ms  62.28ms    8.36m
                     'violation_ls':      2935 [942.66us,    1.47s] 124.43ms  81.16ms    6.09m      2935 [610.00ns, 430.71ms] 150.55ms  55.09ms    7.36m

Search stats                         Bools  Conflicts   Branches  Restarts     BoolPropag  IntegerPropag
                           'core':   9'538    526'695  1'198'084    71'673  1'245'813'567    641'788'664
                     'default_lp':   2'328    446'280  1'561'802   114'076    306'241'651    539'226'387
                          'fixed':   2'910  2'310'105  4'185'298       896    678'067'136    714'785'097
                      'fs_random':     121          0        242       242             30          7'695
                      'fs_random':     121          0        269       242             35          9'310
                'fs_random_no_lp':     121          0          0         0              0              0
        'fs_random_quick_restart':     121          0          0         0              0              0
        'fs_random_quick_restart':     121          0        256       242             31          8'169
  'fs_random_quick_restart_no_lp':     121          0        273       242             35          8'376
                 'lb_tree_search':     142      1'106  2'418'923   458'298      6'255'179    278'489'501
                         'max_lp':     121    322'792  1'626'036   206'257     13'774'081    608'030'592
                          'no_lp':   2'256    988'052  2'129'392   110'447    531'899'825  1'144'435'653
            'objective_lb_search':   1'945    365'185  1'626'229   163'069    199'719'521    566'385'154
     'objective_lb_search_max_lp':     439    153'023  2'600'181   638'434     23'148'071    496'342'748
      'objective_lb_search_no_lp':     534    716'082  1'747'095   162'810     27'657'917    962'926'983
                        'probing':     822        492     37'202    19'415        298'365      2'137'214
                 'probing_max_lp':     822        518     29'417    15'493        247'959      1'805'702
                   'pseudo_costs':     121    426'360  1'866'441   268'239     13'466'797    608'688'480
                  'quick_restart':   5'515    239'251  2'250'142   139'296    417'817'957    345'579'823
            'quick_restart_no_lp':   8'067    811'095  3'187'884   128'875  1'090'817'518    702'156'626
                  'reduced_costs':  15'675    457'138  2'636'214   144'139    786'064'347    666'201'490

SAT stats                           ClassicMinim  LitRemoved  LitLearned  LitForgotten  Subsumed  MClauses  MDecisions  MLitTrue  MSubsumed  MLitRemoved  MReused
                           'core':       487'778   4'724'496   6'272'850     1'039'850     1'548    35'425     165'825         0      2'939        9'121      365
                     'default_lp':       380'000   2'192'621   6'369'284     4'349'674     4'035    66'918     690'647       112     36'208      271'434    8'573
                          'fixed':     1'827'460   5'790'583  58'847'335    57'006'259     1'254       222       3'453         0         91          671      101
                      'fs_random':             0           0           0             0         0         0           0         0          0            0        0
                      'fs_random':             0           0           0             0         0         0           0         0          0            0        0
                'fs_random_no_lp':             0           0           0             0         0         0           0         0          0            0        0
        'fs_random_quick_restart':             0           0           0             0         0         0           0         0          0            0        0
        'fs_random_quick_restart':             0           0           0             0         0         0           0         0          0            0        0
  'fs_random_quick_restart_no_lp':             0           0           0             0         0         0           0         0          0            0        0
                 'lb_tree_search':           183         336       6'503             0         8   215'978   1'093'512         0        225          920   16'980
                         'max_lp':       253'095     938'750   4'996'523     3'361'852     6'398   105'595   1'194'845         5     12'430       90'581   20'400
                          'no_lp':       875'016   5'759'260  16'817'040    14'288'599     6'824    59'536     623'517         0     27'963      215'357    8'537
            'objective_lb_search':       331'123   2'051'911   3'828'872     1'234'850     3'833    95'363     974'876        35     47'341      350'669   14'568
     'objective_lb_search_max_lp':       122'068     436'948   2'121'820       364'886     3'213   272'441   2'135'351         0      5'204       38'232   40'127
      'objective_lb_search_no_lp':       603'581   2'401'091   9'573'413     4'480'021     9'363    81'992     766'563         6     13'228      100'179   12'309
                        'probing':             1           1         493             0         0         0           0         0          0            0        0
                 'probing_max_lp':             1           1         521             0         0         0           0         0          0            0        0
                   'pseudo_costs':       354'067   1'572'314   6'988'537     4'748'879     6'131   134'856   1'186'735         0      7'420       54'159   24'424
                  'quick_restart':       201'408   1'322'040   3'233'747     1'446'948     2'379    80'185     997'036        14     58'917      619'303    9'244
            'quick_restart_no_lp':       720'032   7'119'084  15'361'837     8'640'236     1'735    31'816     381'660        16     26'237      294'141    2'053
                  'reduced_costs':       392'502   2'158'087   7'739'084     6'222'997     3'450    66'590     747'725        28     18'408      132'183   10'515

Lp stats                         Component  Iterations  AddedCuts    OPTIMAL  DUAL_F.  DUAL_U.
                  'default_lp':          1   5'382'964    204'106    787'734        0        0
                       'fixed':          1   1'080'682      1'628  1'721'626        0        0
                   'fs_random':          1          33          0          1        1        0
                   'fs_random':          1         717        838         43        0        0
     'fs_random_quick_restart':          1           0          0          0        0        0
     'fs_random_quick_restart':          1         599      1'009         25        0        0
              'lb_tree_search':          1  16'613'746     82'384    857'891  468'106        0
                      'max_lp':          1   8'378'246    198'866    495'959  394'013      168
         'objective_lb_search':          1   6'281'728    137'122    686'809        0        3
  'objective_lb_search_max_lp':          1   8'036'415    108'457    332'865  123'316      149
                     'probing':          1   5'209'800    248'477    111'027      182        5
              'probing_max_lp':          1   4'190'307    235'365     72'315   12'707        0
                'pseudo_costs':          1   7'616'108    283'404    524'147  428'656      281
               'quick_restart':          1   7'184'718    115'978    498'952        4        1
               'reduced_costs':          1   7'203'540    315'808    680'366  402'579       66

Lp dimension                                                                       Final dimension of first component
                  'default_lp':    922 rows, 449 columns, 3613 entries with magnitude in [1.598490e-05, 1.000000e+00]
                       'fixed':    295 rows, 449 columns, 1015 entries with magnitude in [2.475583e-02, 1.000000e+00]
                   'fs_random':     118 rows, 449 columns, 453 entries with magnitude in [5.449012e-02, 1.000000e+00]
                   'fs_random':    565 rows, 449 columns, 1982 entries with magnitude in [5.542872e-03, 1.000000e+00]
     'fs_random_quick_restart':         0 rows, 449 columns, 0 entries with magnitude in [0.000000e+00, 0.000000e+00]
     'fs_random_quick_restart':    523 rows, 449 columns, 1907 entries with magnitude in [8.894187e-03, 1.000000e+00]
              'lb_tree_search':    930 rows, 461 columns, 3169 entries with magnitude in [4.139307e-04, 1.000000e+00]
                      'max_lp':    553 rows, 461 columns, 1909 entries with magnitude in [3.705483e-04, 1.000000e+00]
         'objective_lb_search':    515 rows, 449 columns, 2150 entries with magnitude in [5.169357e-05, 1.000000e+00]
  'objective_lb_search_max_lp':    946 rows, 461 columns, 3756 entries with magnitude in [1.212018e-03, 1.000000e+00]
                     'probing':  1282 rows, 449 columns, 13585 entries with magnitude in [6.726665e-06, 1.000000e+00]
              'probing_max_lp':   1023 rows, 461 columns, 5009 entries with magnitude in [4.607686e-04, 1.000000e+00]
                'pseudo_costs':    761 rows, 461 columns, 2791 entries with magnitude in [3.142061e-03, 1.000000e+00]
               'quick_restart':    862 rows, 449 columns, 3730 entries with magnitude in [2.000615e-04, 1.000000e+00]
               'reduced_costs':    580 rows, 461 columns, 2001 entries with magnitude in [1.445930e-03, 1.000000e+00]

Lp debug                         CutPropag  CutEqPropag   Adjust  Overflow         Bad  BadScaling
                  'default_lp':        111          382  449'512         0   2'513'395           0
                       'fixed':          0            0   89'494         0       6'991           0
                   'fs_random':          0            0        0         0           0           0
                   'fs_random':          0            0       26         0       1'119           0
     'fs_random_quick_restart':          0            0        0         0           0           0
     'fs_random_quick_restart':          0            0        6         0       1'956           0
              'lb_tree_search':         78          157  702'262         0   1'336'606           0
                      'max_lp':        134          216  419'212         0   2'146'993           0
         'objective_lb_search':         60          417  392'427         0   2'898'431           0
  'objective_lb_search_max_lp':        131          202  273'507         0   2'315'568           0
                     'probing':         90        5'332   91'948         0  86'502'436           0
              'probing_max_lp':        295        2'990   72'600         0  66'484'632           0
                'pseudo_costs':        170          336  439'093         0   2'894'565           0
               'quick_restart':        151          525  313'420         0   6'001'051           0
               'reduced_costs':        157          241  647'445         0   2'898'340           0

Lp pool                          Constraints  Updates  Simplif  Merged  Shortened      Split  Strenghtened        Cuts/Call
                  'default_lp':        8'109   10'475  221'305   1'675     18'912    174'135        96'594  204'106/719'877
                       'fixed':        2'306       11       54       0          0          5           317     1'628/13'418
                   'fs_random':        1'516        4        0       0          0          0           184        838/1'475
                   'fs_random':          678        0        0       0          0          0           144              0/0
     'fs_random_quick_restart':        1'687        7        0       0          0          3           229      1'009/1'806
     'fs_random_quick_restart':          678        0        0       0          0          0             0              0/0
              'lb_tree_search':       15'502    6'074  387'620   1'189     23'542     38'974       340'697   82'384/395'020
                      'max_lp':       15'146    7'421  495'585   2'027     20'744     91'230       418'284  198'866/531'449
         'objective_lb_search':        8'378   10'659  213'545   1'422     16'030    205'090        93'838  137'122/534'736
  'objective_lb_search_max_lp':       15'540    9'635  482'576   1'224     16'831    153'357       408'650  108'457/339'785
                     'probing':       10'135   50'498  123'337      20     15'962    594'414        60'763  248'477/539'266
              'probing_max_lp':       16'653   46'635  526'727      19     24'915    398'338       287'715  235'365/681'659
                'pseudo_costs':       14'042    8'332  601'300   2'669     18'597    120'247       413'852  283'404/653'440
               'quick_restart':       10'230   16'981  309'854     426     20'151  1'145'167       120'756  115'978/483'050
               'reduced_costs':       14'221    8'155  695'750   2'894     25'273    116'060       466'276  315'808/774'594

Lp Cut                                                fs_ran  fs_ran  defaul  fixed  max_lp  quick_  reduce  pseudo  lb_tre  probin  object   probin  object
                                              CG_FF:      55      45   8'475    108   9'519   2'818  20'314  17'424   3'641   4'045   6'718    1'106   4'591
                                               CG_K:      47      38   6'031     89   7'998   2'176  18'050  16'311   3'458   3'880   5'538      777   4'275
                                              CG_KL:       -       -      10      -       3       1      10       1       -       -      10        -       -
                                               CG_R:      43      22   9'046     79   7'983   3'564  20'202  15'680   3'399  10'589   7'260    3'353   3'872
                                              CG_RB:     116      75  19'967    161  23'248   7'552  41'201  41'017   8'932  15'592  16'059    3'273   9'629
                                             CG_RBP:       8       4   3'588     30   3'384   1'322   7'015   6'345   1'236   2'307   1'743      528     897
                                             Clique:       -       -       -      -   1'026       -   2'876   2'261     564       -       -      317     560
                                                 IB:     345     401  90'046    586  47'165  42'579  59'148  43'429  16'184  25'471  42'912   10'290  19'997
                                           MIR_1_FF:      49      47   5'410     72   7'520   4'163  12'847  11'859   3'452  15'563   5'201    3'740   5'000
                                            MIR_1_K:       9       5   1'452     14   2'450     813   3'955   4'246   1'296   4'746   1'464      785   1'610
                                           MIR_1_KL:       -       -     321      -     238      84     223     109      23     191     121      103      21
                                            MIR_1_R:      19      18   1'787     28   1'754   1'491   3'210   3'106     808   7'598   1'738    1'445   1'195
                                           MIR_1_RB:      52      33   9'560     90  15'918   6'363  23'410  23'412   7'075  18'364   7'532    8'937  10'315
                                          MIR_1_RBP:       5       5     754     10   2'860     386   3'657   2'409     677     805     361      403     545
                                          MIR_1_RLT:       -       -       -      -      72       -     171     120      26       -       -      197      45
                                           MIR_2_FF:      28      17   3'664     35   5'826   3'002   9'441   8'751   2'777   8'921   3'344    3'321   4'105
                                            MIR_2_K:       9       6   1'048      6   1'502     750   2'335   2'590     702   4'212     944      699     972
                                           MIR_2_KL:       -       -     288      -     200      77     221     131      25     229      51       95      22
                                            MIR_2_R:      12       4   1'465     11   1'654   1'424   2'757   2'892     920   7'048   1'403    2'342   1'391
                                           MIR_2_RB:      45      25   6'797     51   9'172   5'193  13'046  13'150   4'123  13'347   5'391    5'519   6'033
                                          MIR_2_RBP:       6       1     842      7   1'462     505   2'145   1'496     343   1'040     339      414     311
                                           MIR_3_FF:      12       6   2'437     28   3'843   2'016   6'265   5'665   1'857   4'547   2'314    1'897   2'652
                                            MIR_3_K:       5       6     919     13   1'075     570   1'775   1'770     530   2'189     773      574     678
                                           MIR_3_KL:       -       -     272      -     179     108     213     140      24     241      95       78      28
                                            MIR_3_R:       4       2   1'094     11   1'228   1'116   2'041   2'230     702   3'516   1'070    1'552   1'002
                                           MIR_3_RB:      22      14   4'916     38   5'919   3'736   8'177   8'060   2'609   8'240   3'749    3'172   3'701
                                          MIR_3_RBP:       1       1     664      4     918     365   1'404     927     239     637     272      303     232
                                           MIR_4_FF:      10       5   1'524     15   2'271   1'316   3'549   3'472   1'223   2'536   1'561    1'147   1'723
                                            MIR_4_K:       5       2     667      6     728     412   1'222   1'299     368   1'283     591      382     488
                                           MIR_4_KL:       -       -     216      -     135     103     143     140      45     218      67       88      25
                                            MIR_4_R:       1       1     774      5     762     747   1'216   1'349     427   1'858     852      883     603
                                           MIR_4_RB:      14       5   3'127     18   3'445   2'255   4'580   4'707   1'554   4'827   2'352    2'003   2'099
                                          MIR_4_RBP:       2       -     471      2     502     263     864     591     155     421     198      195     145
                                           MIR_5_FF:       6       3   1'033      3   1'470     804   2'194   2'080     756   1'349   1'072      616   1'064
                                            MIR_5_K:       3       1     440      3     507     245     806     864     270     678     406      214     298
                                           MIR_5_KL:       2       -     164      -     151      82     131     145      39     159     101       57      52
                                            MIR_5_R:       2       -     566      2     476     433     769     774     260   1'011     652      460     370
                                           MIR_5_RB:       8       2   2'048      8   2'309   1'351   2'923   3'007   1'012   2'738   1'474    1'014   1'315
                                          MIR_5_RBP:       1       -     318      -     317     178     512     421     127     312     173      127      91
                                           MIR_6_FF:       5       3     637      5     966     516   1'376   1'211     413     754     678      384     687
                                            MIR_6_K:       1       -     335      3     403     216     623     605     198     396     270      178     255
                                           MIR_6_KL:       1       -     168      -      93      68     113     125      43     154      95       78      68
                                            MIR_6_R:       2       -     377      -     295     273     567     572     164     481     440      196     222
                                           MIR_6_RB:       7       3   1'304      7   1'574     770   2'081   2'022     619   1'645     984      612     895
                                          MIR_6_RBP:       1       -     233      -     229     118     378     302      91     208     114      112      85
         NoOverlapCompletionTimeExhaustive_weighted:       -       -       -      -     120       -     198     113      47       -       -       23     109
  NoOverlapCompletionTimeExhaustive_weighted_lifted:       -       -       -      -     211       -     474     465      30       -       -        7     150
                        NoOverlapDetectedPrecedence:       -       -       -      -       -       -       1       -       -       -       -        -       -
                          NoOverlapDisjunctionOnEnd:       -       -       -      -       1       -       1       -       -       -       -        -       -
                        NoOverlapDisjunctionOnStart:       -       -       -      -     333       -     811     719     106       -       -        7     136
                                       ZERO_HALF_FF:      10       8   1'042     27   1'852     519   3'546   2'991     728     641     913      215     991
                                        ZERO_HALF_K:       6       3     417      5     811     236   1'479   1'508     457     295     412       92     485
                                       ZERO_HALF_KL:       -       -       7      -       1       4       2       -       -       -      13        -       -
                                        ZERO_HALF_R:      15      12   4'840     28   9'641  10'429  11'638  11'399   5'501  55'365   5'189  158'688   9'513
                                       ZERO_HALF_RB:      13      14   2'071     17   4'185   1'889   5'831   5'822   1'862   6'281   1'777    9'360   2'631
                                      ZERO_HALF_RBP:       2       1     474      3     962     577   1'671   1'170     267   1'549     336    3'007     278

LNS stats                        Improv/Calls  Closed  Difficulty  TimeLimit
               'graph_arc_lns':      125/2930     51%        1.00       0.24
               'graph_cst_lns':      146/2928     51%        1.00       0.21
               'graph_dec_lns':       94/2934     51%        1.00       0.24
               'graph_var_lns':      169/2933     52%        1.00       0.23
                   'rins/rens':      305/2632     51%        0.91       0.10
                 'rnd_cst_lns':      112/2929     51%        0.99       0.25
                 'rnd_var_lns':      131/2934     51%        1.00       0.22
    'scheduling_intervals_lns':      180/2934      6%        0.00       0.29
  'scheduling_precedences_lns':      181/2934      6%        0.00       0.29
  'scheduling_time_window_lns':      178/2934      6%        0.00       0.29

LS stats                   Batches  Restarts    LinMoves   GenMoves  CompoundMoves  WeightUpdates
       'fj_long_default':        1         1       9'708          0              0            161
   'fj_long_lin_default':        1         1           0      1'813            155              0
        'fj_long_random':        2         1      10'651          0              0            154
      'fj_short_default':        1         1           0      1'928            235              0
  'fj_short_lin_default':        1         1           0      1'893            255              0
   'fj_short_lin_random':        2         1           0      3'399            350              0
       'fj_short_random':        3         1           0      5'204            502              1
          'violation_ls':    2'935         0  12'653'626  4'781'121        276'426      1'398'875
          'violation_ls':    2'935         0  17'901'030  2'969'130        180'021      2'300'892

Solutions (60)                   Num     Rank
                       'fixed':    1    [7,7]
              'fj_long_random':    1    [1,1]
               'graph_arc_lns':    2  [53,58]
               'graph_cst_lns':    1  [55,55]
               'graph_dec_lns':    2  [46,50]
               'graph_var_lns':    2   [6,43]
                       'no_lp':   28  [12,47]
         'objective_lb_search':    1    [8,8]
               'quick_restart':    1  [51,51]
         'quick_restart_no_lp':    5  [30,41]
                 'rins_lp_lns':    3  [48,60]
                 'rnd_cst_lns':    1  [54,54]
                 'rnd_var_lns':    4   [3,45]
  'scheduling_precedences_lns':    1  [49,49]
                'violation_ls':    7   [2,57]

Objective bounds                 Num
                   'bool_core':   91
              'initial_domain':    1
              'lb_tree_search':   10
         'objective_lb_search':  172
  'objective_lb_search_max_lp':    2
   'objective_lb_search_no_lp':   66
         'quick_restart_no_lp':    3

Solution repositories     Added  Queried  Ignored  Synchro
  'feasible solutions':  27'392   66'794        5   26'305
        'lp solutions':  20'169    1'431        0   15'735
                'pump':  61'349    1'504

Improving bounds shared             Num
                        'core':     118
                  'default_lp':   1'075
              'lb_tree_search':     144
                      'max_lp':     375
                       'no_lp':     209
         'objective_lb_search':      54
  'objective_lb_search_max_lp':     126
   'objective_lb_search_no_lp':       1
                     'probing':   2'599
              'probing_max_lp':   1'778
                'pseudo_costs':     583
               'quick_restart':   1'775
         'quick_restart_no_lp':  15'111
               'reduced_costs':     488

Clauses shared                   Num
                        'core':    2
                  'default_lp':  116
              'lb_tree_search':   61
                      'max_lp':  125
                       'no_lp':   77
         'objective_lb_search':  103
  'objective_lb_search_max_lp':   24
   'objective_lb_search_no_lp':   36
                     'probing':    1
              'probing_max_lp':    2
                'pseudo_costs':  126
               'quick_restart':   10
         'quick_restart_no_lp':   39
               'reduced_costs':   70

CpSolverResponse summary:
status: OPTIMAL
objective: 1268
best_bound: 1268
integers: 458
booleans: 121
conflicts: 0
branches: 256
propagations: 31
integer_propagations: 8169
restarts: 242
lp_iterations: 599
walltime: 2377.68
usertime: 2377.68
deterministic_time: 17296
gap_integral: 32229.1
solution_fingerprint: 0x41b63effd79b3325


--- Simulation Gantt  partir du modle mathmatique ---
