created virtual environment CPython3.12.4.final.0-64 in 352ms
  creator CPython3Posix(dest=/localscratch/aneumann.46806152.0/env, clear=False, no_vcs_ignore=False, global=False)
  seeder FromAppData(download=False, pip=bundle, via=copy, app_data_dir=/home/aneumann/.local/share/virtualenv)
    added seed packages: pip==24.2+computecanada
  activators BashActivator,CShellActivator,FishActivator,NushellActivator,PowerShellActivator,PythonActivator
Looking in links: /cvmfs/soft.computecanada.ca/custom/python/wheelhouse/gentoo2023/x86-64-v3, /cvmfs/soft.computecanada.ca/custom/python/wheelhouse/gentoo2023/generic, /cvmfs/soft.computecanada.ca/custom/python/wheelhouse/generic
Requirement already satisfied: pip in /localscratch/aneumann.46806152.0/env/lib/python3.12/site-packages (24.2+computecanada)
Processing /cvmfs/soft.computecanada.ca/custom/python/wheelhouse/generic/pip-25.0+computecanada-py3-none-any.whl
Installing collected packages: pip
  Attempting uninstall: pip
    Found existing installation: pip 24.2+computecanada
    Uninstalling pip-24.2+computecanada:
      Successfully uninstalled pip-24.2+computecanada
Successfully installed pip-24.2+computecanada
Looking in links: /cvmfs/soft.computecanada.ca/custom/python/wheelhouse/gentoo2023/x86-64-v3, /cvmfs/soft.computecanada.ca/custom/python/wheelhouse/gentoo2023/generic, /cvmfs/soft.computecanada.ca/custom/python/wheelhouse/generic
ERROR: protobuf-5.28.3-cp38-abi3-manylinux2014_x86_64.whl is not a supported wheel on this platform.
Looking in links: /cvmfs/soft.computecanada.ca/custom/python/wheelhouse/gentoo2023/x86-64-v3, /cvmfs/soft.computecanada.ca/custom/python/wheelhouse/gentoo2023/generic, /cvmfs/soft.computecanada.ca/custom/python/wheelhouse/generic
Processing /home/aneumann/projects/def-adhaj/aneumann/GNRS/wheels/immutabledict-4.2.0-py3-none-any.whl
Installing collected packages: immutabledict
Successfully installed immutabledict-4.2.0
Looking in links: /cvmfs/soft.computecanada.ca/custom/python/wheelhouse/gentoo2023/x86-64-v3, /cvmfs/soft.computecanada.ca/custom/python/wheelhouse/gentoo2023/generic, /cvmfs/soft.computecanada.ca/custom/python/wheelhouse/generic
Processing /cvmfs/soft.computecanada.ca/custom/python/wheelhouse/generic/ortools-9.10.4067+computecanada-cp312-cp312-linux_x86_64.whl (from -r /home/aneumann/projects/def-adhaj/aneumann/GNRS/requirements/or.txt (line 1))
Processing /cvmfs/soft.computecanada.ca/custom/python/wheelhouse/gentoo2023/x86-64-v3/matplotlib-3.10.0+computecanada-cp312-cp312-linux_x86_64.whl (from -r /home/aneumann/projects/def-adhaj/aneumann/GNRS/requirements/or.txt (line 2))
Processing /cvmfs/soft.computecanada.ca/custom/python/wheelhouse/gentoo2023/x86-64-v3/pandas-2.2.3+computecanada-cp312-cp312-linux_x86_64.whl (from -r /home/aneumann/projects/def-adhaj/aneumann/GNRS/requirements/or.txt (line 3))
Processing /cvmfs/soft.computecanada.ca/custom/python/wheelhouse/generic/absl_py-2.3.0+computecanada-py3-none-any.whl (from ortools<9.11,>=9.10->-r /home/aneumann/projects/def-adhaj/aneumann/GNRS/requirements/or.txt (line 1))
Processing /cvmfs/soft.computecanada.ca/custom/python/wheelhouse/gentoo2023/generic/numpy-2.2.2+computecanada-cp312-cp312-linux_x86_64.whl (from ortools<9.11,>=9.10->-r /home/aneumann/projects/def-adhaj/aneumann/GNRS/requirements/or.txt (line 1))
Processing /cvmfs/soft.computecanada.ca/custom/python/wheelhouse/gentoo2023/x86-64-v3/protobuf-6.31.1+computecanada-cp312-cp312-linux_x86_64.whl (from ortools<9.11,>=9.10->-r /home/aneumann/projects/def-adhaj/aneumann/GNRS/requirements/or.txt (line 1))
Requirement already satisfied: immutabledict>=3.0.0 in /localscratch/aneumann.46806152.0/env/lib/python3.12/site-packages (from ortools<9.11,>=9.10->-r /home/aneumann/projects/def-adhaj/aneumann/GNRS/requirements/or.txt (line 1)) (4.2.0)
Processing /cvmfs/soft.computecanada.ca/custom/python/wheelhouse/gentoo2023/generic/contourpy-1.3.1+computecanada-cp312-cp312-linux_x86_64.whl (from matplotlib->-r /home/aneumann/projects/def-adhaj/aneumann/GNRS/requirements/or.txt (line 2))
Processing /cvmfs/soft.computecanada.ca/custom/python/wheelhouse/generic/cycler-0.12.1+computecanada-py3-none-any.whl (from matplotlib->-r /home/aneumann/projects/def-adhaj/aneumann/GNRS/requirements/or.txt (line 2))
Processing /cvmfs/soft.computecanada.ca/custom/python/wheelhouse/generic/fonttools-4.59.0+computecanada-cp312-cp312-linux_x86_64.whl (from matplotlib->-r /home/aneumann/projects/def-adhaj/aneumann/GNRS/requirements/or.txt (line 2))
Processing /cvmfs/soft.computecanada.ca/custom/python/wheelhouse/gentoo2023/x86-64-v3/kiwisolver-1.4.8+computecanada-cp312-cp312-linux_x86_64.whl (from matplotlib->-r /home/aneumann/projects/def-adhaj/aneumann/GNRS/requirements/or.txt (line 2))
Processing /cvmfs/soft.computecanada.ca/custom/python/wheelhouse/generic/packaging-25.0+computecanada-py3-none-any.whl (from matplotlib->-r /home/aneumann/projects/def-adhaj/aneumann/GNRS/requirements/or.txt (line 2))
Processing /cvmfs/soft.computecanada.ca/custom/python/wheelhouse/gentoo2023/x86-64-v3/pillow-11.1.0+computecanada-cp312-cp312-linux_x86_64.whl (from matplotlib->-r /home/aneumann/projects/def-adhaj/aneumann/GNRS/requirements/or.txt (line 2))
Processing /cvmfs/soft.computecanada.ca/custom/python/wheelhouse/generic/pyparsing-3.2.3+computecanada-py3-none-any.whl (from matplotlib->-r /home/aneumann/projects/def-adhaj/aneumann/GNRS/requirements/or.txt (line 2))
Processing /cvmfs/soft.computecanada.ca/custom/python/wheelhouse/generic/python_dateutil-2.9.0.post0+computecanada-py2.py3-none-any.whl (from matplotlib->-r /home/aneumann/projects/def-adhaj/aneumann/GNRS/requirements/or.txt (line 2))
Processing /cvmfs/soft.computecanada.ca/custom/python/wheelhouse/generic/pytz-2025.2+computecanada-py2.py3-none-any.whl (from pandas->-r /home/aneumann/projects/def-adhaj/aneumann/GNRS/requirements/or.txt (line 3))
Processing /cvmfs/soft.computecanada.ca/custom/python/wheelhouse/generic/tzdata-2025.2+computecanada-py2.py3-none-any.whl (from pandas->-r /home/aneumann/projects/def-adhaj/aneumann/GNRS/requirements/or.txt (line 3))
Processing /cvmfs/soft.computecanada.ca/custom/python/wheelhouse/generic/six-1.17.0+computecanada-py2.py3-none-any.whl (from python-dateutil>=2.7->matplotlib->-r /home/aneumann/projects/def-adhaj/aneumann/GNRS/requirements/or.txt (line 2))
Installing collected packages: pytz, tzdata, six, pyparsing, protobuf, pillow, packaging, numpy, kiwisolver, fonttools, cycler, absl-py, python-dateutil, contourpy, pandas, matplotlib, ortools
Successfully installed absl-py-2.3.0+computecanada contourpy-1.3.1+computecanada cycler-0.12.1+computecanada fonttools-4.59.0+computecanada kiwisolver-1.4.8+computecanada matplotlib-3.10.0+computecanada numpy-2.2.2+computecanada ortools-9.10.4067+computecanada packaging-25.0+computecanada pandas-2.2.3+computecanada pillow-11.1.0+computecanada protobuf-6.31.1+computecanada pyparsing-3.2.3+computecanada python-dateutil-2.9.0.post0+computecanada pytz-2025.2+computecanada six-1.17.0+computecanada tzdata-2025.2+computecanada

Starting CP-SAT solver v9.10.4067
Parameters: max_time_in_seconds: 86400 max_memory_in_mb: 185000 log_search_progress: true enumerate_all_solutions: false num_search_workers: 32 absolute_gap_limit: 0 relative_gap_limit: 0

Initial optimization model '': (model_fingerprint: 0x685ffa259793f660)
#Variables: 373 (#ints: 10 in objective)
  - 275 Booleans in [0,1]
  - 98 in [0,681]
#kLinear1: 48
#kLinear2: 572
#kLinear3: 251
#kLinearN: 5'717 (#terms: 107'528)

Starting presolve at 0.00s
  3.43e-03s  0.00e+00d  [DetectDominanceRelations] 
  4.78e-02s  0.00e+00d  [PresolveToFixPoint] #num_loops=7 #num_dual_strengthening=3 
  4.20e-05s  0.00e+00d  [ExtractEncodingFromLinear] #potential_supersets=6 
[Symmetry] Graph for symmetry has 6'629 nodes and 90'007 arcs.
[Symmetry] Symmetry computation done. time: 0.00288411 dtime: 0.00714423
[Symmetry] #generators: 1, average support size: 30
[Symmetry] The model contains 277 duplicate constraints !
[Symmetry] 15 orbits with sizes: 2,2,2,2,2,2,2,2,2,2,...
[Symmetry] Num fixable by intersecting at_most_one with orbits: 1 largest_orbit: 2
  2.00e-02s  5.08e-03d  [Probe] #probed=414 #new_bounds=7 #equiv=1 
  9.10e-05s  0.00e+00d  [MaxClique] Merged 7(14 literals) into 5(10 literals) at_most_ones. 
  3.31e-03s  0.00e+00d  [DetectDominanceRelations] 
  2.24e-02s  0.00e+00d  [PresolveToFixPoint] #num_loops=5 #num_dual_strengthening=3 
  1.08e-02s  0.00e+00d  [ProcessAtMostOneAndLinear] 
  3.23e-03s  0.00e+00d  [DetectDuplicateConstraints] #duplicates=340 #without_enforcements=20 
  4.77e-03s  5.17e-04d  [DetectDominatedLinearConstraints] #relevant_constraints=5'236 #num_inclusions=3'404 
  5.48e-04s  0.00e+00d  [DetectDifferentVariables] #different=21 #cliques=1 #size=5 
  1.04e-03s  1.45e-04d  [ProcessSetPPC] #relevant_constraints=4'875 
  2.22e-05s  0.00e+00d  [FindAlmostIdenticalLinearConstraints] 
  3.39e-04s  6.54e-04d  [FindBigAtMostOneAndLinearOverlap] 
  1.28e-02s  1.07e-02d  [FindBigVerticalLinearOverlap] #blocks=92 #saved_nz=18'075 
  5.53e-04s  3.16e-04d  [FindBigHorizontalLinearOverlap] #linears=4'794 
  2.34e-05s  0.00e+00d  [MergeClauses] 
  3.35e-03s  0.00e+00d  [DetectDominanceRelations] 
  2.64e-02s  0.00e+00d  [PresolveToFixPoint] #num_loops=2 #num_dual_strengthening=1 
  3.33e-03s  0.00e+00d  [DetectDominanceRelations] 
  1.60e-02s  0.00e+00d  [PresolveToFixPoint] #num_loops=1 #num_dual_strengthening=1 
[Symmetry] Graph for symmetry has 6'585 nodes and 70'807 arcs.
[Symmetry] Symmetry computation done. time: 0.00121886 dtime: 0.00374804
  1.74e-02s  4.31e-03d  [Probe] #probed=414 #new_bounds=62 
  1.86e-05s  0.00e+00d  [MaxClique] 
  3.33e-03s  0.00e+00d  [DetectDominanceRelations] 
  2.38e-02s  0.00e+00d  [PresolveToFixPoint] #num_loops=2 #num_dual_strengthening=1 
  9.88e-03s  0.00e+00d  [ProcessAtMostOneAndLinear] 
  2.91e-03s  0.00e+00d  [DetectDuplicateConstraints] #without_enforcements=20 
  2.82e-03s  2.87e-04d  [DetectDominatedLinearConstraints] #relevant_constraints=5'191 #num_inclusions=670 
  3.85e-04s  0.00e+00d  [DetectDifferentVariables] 
  9.31e-04s  1.07e-04d  [ProcessSetPPC] #relevant_constraints=4'799 
  3.75e-05s  4.05e-07d  [FindAlmostIdenticalLinearConstraints] #num_tested_pairs=27 
  1.57e-04s  2.47e-04d  [FindBigAtMostOneAndLinearOverlap] 
  8.69e-03s  7.10e-03d  [FindBigVerticalLinearOverlap] #blocks=156 #saved_nz=12'161 
  5.01e-04s  2.45e-04d  [FindBigHorizontalLinearOverlap] #linears=4'434 
  1.61e-05s  0.00e+00d  [MergeClauses] 
  2.79e-03s  0.00e+00d  [DetectDominanceRelations] 
  2.76e-02s  0.00e+00d  [PresolveToFixPoint] #num_loops=2 #num_dual_strengthening=1 
  2.77e-03s  0.00e+00d  [DetectDominanceRelations] 
  1.75e-02s  0.00e+00d  [PresolveToFixPoint] #num_loops=1 #num_dual_strengthening=1 
[Symmetry] Graph for symmetry has 7'018 nodes and 58'780 arcs.
[Symmetry] Symmetry computation done. time: 0.00108848 dtime: 0.00322365
  1.59e-02s  3.89e-03d  [Probe] #probed=414 #new_bounds=87 
  1.83e-05s  0.00e+00d  [MaxClique] 
  2.81e-03s  0.00e+00d  [DetectDominanceRelations] 
  2.37e-02s  0.00e+00d  [PresolveToFixPoint] #num_loops=2 #num_dual_strengthening=1 
  9.01e-03s  0.00e+00d  [ProcessAtMostOneAndLinear] 
  2.72e-03s  0.00e+00d  [DetectDuplicateConstraints] #without_enforcements=20 
  2.14e-03s  1.96e-04d  [DetectDominatedLinearConstraints] #relevant_constraints=5'281 #num_inclusions=47 
  3.81e-04s  0.00e+00d  [DetectDifferentVariables] 
  7.74e-04s  8.06e-05d  [ProcessSetPPC] #relevant_constraints=4'439 
  6.05e-05s  3.71e-06d  [FindAlmostIdenticalLinearConstraints] #num_tested_pairs=207 
  1.44e-04s  2.00e-04d  [FindBigAtMostOneAndLinearOverlap] 
  4.90e-03s  4.60e-03d  [FindBigVerticalLinearOverlap] #blocks=82 #saved_nz=4'826 
  4.54e-04s  2.15e-04d  [FindBigHorizontalLinearOverlap] #linears=4'163 
  1.64e-05s  0.00e+00d  [MergeClauses] 
  2.60e-03s  0.00e+00d  [DetectDominanceRelations] 
  2.39e-02s  0.00e+00d  [PresolveToFixPoint] #num_loops=2 #num_dual_strengthening=1 
  1.32e-04s  0.00e+00d  [ExpandObjective] #entries=1'365 #tight_variables=507 #tight_constraints=275 

Presolve summary:
  - 95 affine relations were detected.
  - rule 'TODO dual: only one blocking constraint?' was applied 901 times.
  - rule 'TODO dual: only one blocking enforced constraint?' was applied 104 times.
  - rule 'TODO dual: only one unspecified blocking constraint?' was applied 54 times.
  - rule 'TODO duplicate: identical constraint with different enforcements' was applied 60 times.
  - rule 'affine: new relation' was applied 95 times.
  - rule 'at_most_one: removed literals' was applied 5 times.
  - rule 'at_most_one: size one' was applied 5 times.
  - rule 'at_most_one: transformed into max clique.' was applied 1 time.
  - rule 'deductions: 330 stored' was applied 1 time.
  - rule 'dual: fix variable' was applied 27 times.
  - rule 'dual: reduced domain' was applied 55 times.
  - rule 'duplicate: merged rhs of linear constraint' was applied 56 times.
  - rule 'duplicate: removed constraint' was applied 340 times.
  - rule 'enforcement: false literal' was applied 6 times.
  - rule 'exactly_one: x and not(x)' was applied 1 time.
  - rule 'incompatible linear: add implication' was applied 30 times.
  - rule 'linear matrix: common vertical rectangle' was applied 330 times.
  - rule 'linear: always true' was applied 667 times.
  - rule 'linear: doubleton free' was applied 13 times.
  - rule 'linear: empty' was applied 32 times.
  - rule 'linear: extracted enforcement literal' was applied 5'662 times.
  - rule 'linear: fixed or dup variables' was applied 5'815 times.
  - rule 'linear: positive equal one' was applied 6 times.
  - rule 'linear: reduced variable domains' was applied 415 times.
  - rule 'linear: remapped using affine relations' was applied 5'998 times.
  - rule 'linear: simplified rhs' was applied 17'760 times.
  - rule 'linear: tightened into equality' was applied 8 times.
  - rule 'linear: variable substitution 1' was applied 13 times.
  - rule 'linear: variable substitution 2' was applied 3 times.
  - rule 'linear: variable substitution 3' was applied 25 times.
  - rule 'no_overlap: inferred from x != y constraints' was applied 1 time.
  - rule 'presolve: 94 unused variables removed.' was applied 1 time.
  - rule 'presolve: iteration' was applied 3 times.
  - rule 'probing: reduced enforced constraint to implication.' was applied 7 times.
  - rule 'symmetry: fixed to false in general orbit' was applied 1 time.

Presolved optimization model '': (model_fingerprint: 0x9002de9b180fe3a4)
#Variables: 473 (#ints: 10 in objective)
  - 107 Booleans in [0,1]
  - 292 different domains in [-7431,8724] with a largest complexity of 16.
#kExactlyOne: 5 (#literals: 15)
#kInterval: 5
#kLinear2: 456 (#enforced: 405 #multi: 237)
#kLinear3: 622 (#enforced: 368)
#kLinearN: 4'647 (#enforced: 4'410) (#terms: 44'952)
#kNoOverlap: 1 (#intervals: 5)

Preloading model.
#Bound   0.40s best:inf   next:[150,5774] initial_domain
[Symmetry] Graph for symmetry has 6'995 nodes and 54'009 arcs.
[Symmetry] Symmetry computation done. time: 0.0010316 dtime: 0.00298196
#Model   0.40s var:473/473 constraints:5736/5736

Starting search at 0.40s with 32 workers.
17 full problem subsolvers: [core, default_lp, fixed, lb_tree_search, max_lp, no_lp, objective_lb_search, objective_lb_search_max_lp, objective_lb_search_no_lp, objective_shaving_search_max_lp, objective_shaving_search_no_lp, probing, probing_max_lp, pseudo_costs, quick_restart, quick_restart_no_lp, reduced_costs]
13 first solution subsolvers: [fj_long_default, fj_long_lin_default, fj_long_random, fj_short_default, fj_short_lin_default, fj_short_lin_random, fj_short_random, fs_random(2), fs_random_no_lp, fs_random_quick_restart(2), fs_random_quick_restart_no_lp]
13 incomplete subsolvers: [feasibility_pump, graph_arc_lns, graph_cst_lns, graph_dec_lns, graph_var_lns, rins/rens, rnd_cst_lns, rnd_var_lns, scheduling_intervals_lns, scheduling_precedences_lns, scheduling_time_window_lns, violation_ls(2)]
3 helper subsolvers: [neighborhood_helper, synchronization_agent, update_gap_integral]
#Bound   0.48s best:inf   next:[159,5774] objective_lb_search_no_lp
#Bound   0.50s best:inf   next:[230,5774] objective_lb_search_no_lp
#1       0.51s best:2509  next:[230,2508] quick_restart_no_lp (fixed_bools=0/158)
#2       0.53s best:2459  next:[230,2458] no_lp (fixed_bools=0/145)
#3       0.54s best:2135  next:[230,2134] no_lp (fixed_bools=0/168)
#4       0.56s best:2122  next:[230,2121] no_lp (fixed_bools=0/177)
#5       0.58s best:1949  next:[230,1948] no_lp (fixed_bools=0/184)
#Bound   0.61s best:1949  next:[232,1948] objective_lb_search
#6       0.62s best:1749  next:[232,1748] no_lp (fixed_bools=0/198)
#7       0.65s best:1610  next:[232,1609] no_lp (fixed_bools=0/209)
#8       0.73s best:1604  next:[232,1603] no_lp (fixed_bools=0/217)
#9       0.74s best:1602  next:[232,1601] no_lp (fixed_bools=0/219)
#10      0.76s best:1588  next:[232,1587] no_lp (fixed_bools=0/227)
#11      0.78s best:1548  next:[232,1547] no_lp (fixed_bools=0/236)
#Bound   0.80s best:1548  next:[258,1547] objective_lb_search
#12      0.80s best:1511  next:[258,1510] no_lp (fixed_bools=0/242)
#Bound   0.85s best:1511  next:[260,1510] objective_lb_search_no_lp
#Bound   0.86s best:1511  next:[261,1510] objective_lb_search_no_lp
#Bound   0.87s best:1511  next:[265,1510] objective_lb_search_no_lp
#Bound   1.03s best:1511  next:[267,1510] objective_lb_search_no_lp
#13      1.09s best:1476  next:[267,1475] quick_restart_no_lp (fixed_bools=1/210)
#Bound   1.11s best:1476  next:[276,1475] objective_lb_search_no_lp
#Bound   1.12s best:1476  next:[284,1475] objective_lb_search_no_lp
#Bound   1.16s best:1476  next:[286,1475] objective_lb_search_no_lp
#Bound   1.17s best:1476  next:[301,1475] objective_lb_search_no_lp
#Bound   1.18s best:1476  next:[305,1475] objective_lb_search_no_lp
#Bound   1.18s best:1476  next:[306,1475] objective_lb_search_no_lp
#Bound   1.36s best:1476  next:[367,1475] objective_lb_search
#14      1.45s best:1468  next:[367,1467] no_lp (fixed_bools=0/274)
#15      1.60s best:1454  next:[367,1453] quick_restart_no_lp (fixed_bools=1/353)
#16      1.61s best:1452  next:[367,1451] quick_restart_no_lp (fixed_bools=1/357)
#17      1.66s best:1450  next:[367,1449] quick_restart_no_lp (fixed_bools=1/374)
#18      1.71s best:1449  next:[367,1448] quick_restart_no_lp (fixed_bools=1/378)
#Bound   1.72s best:1449  next:[372,1448] objective_lb_search
#19      1.90s best:1417  next:[372,1416] quick_restart_no_lp (fixed_bools=1/444)
#20      1.94s best:1416  next:[372,1415] graph_dec_lns (d=0.91 s=99 t=0.10 p=1.00 stall=4 h=auto_l0) [hint]
#Bound   2.01s best:1416  next:[388,1415] objective_lb_search
#21      2.05s best:1412  next:[388,1411] quick_restart_no_lp (fixed_bools=1/454)
#22      2.12s best:1411  next:[388,1410] quick_restart_no_lp (fixed_bools=1/454)
#Bound   2.23s best:1411  next:[396,1410] objective_lb_search
#23      2.30s best:1410  next:[396,1409] quick_restart_no_lp (fixed_bools=1/464)
#Bound   2.31s best:1410  next:[402,1409] objective_lb_search
#Bound   2.41s best:1410  next:[413,1409] objective_lb_search
#24      2.44s best:1409  next:[413,1408] rins_lp_lns (d=0.60 s=106 t=0.10 p=0.50 stall=0 h=auto_l0) [presolve]
#25      2.46s best:1408  next:[413,1407] violation_ls(batch:6 #solutions_imported:6 #lin_moves:9'693 #lin_evals:101'742 #gen_moves:25'656 #gen_evals:3'717 #comp_moves:3'692 #backtracks:10'978 #weight_updates:631)
#Bound   2.46s best:1408  next:[423,1407] objective_lb_search_no_lp
#26      2.49s best:1407  next:[423,1406] violation_ls(batch:6 #solutions_imported:5 #lin_moves:20'444 #lin_evals:125'616 #gen_moves:16'551 #gen_evals:1'850 #comp_moves:740 #backtracks:7'904 #weight_updates:9'754)
#Bound   2.51s best:1407  next:[450,1406] objective_lb_search_no_lp
#27      2.52s best:1406  next:[450,1405] quick_restart_no_lp (fixed_bools=1/474)
#28      2.54s best:1405  next:[450,1404] rnd_var_lns (d=0.94 s=109 t=0.10 p=1.00 stall=5 h=auto_l0) [hint]
#Bound   3.02s best:1405  next:[463,1404] objective_lb_search
#29      3.09s best:1404  next:[463,1403] violation_ls(batch:7 #solutions_imported:7 #lin_moves:10'487 #lin_evals:105'310 #gen_moves:25'656 #gen_evals:3'717 #comp_moves:3'692 #backtracks:10'978 #weight_updates:880)
#30      3.16s best:1402  next:[463,1401] rnd_var_lns (d=0.96 s=124 t=0.10 p=1.00 stall=0 h=auto_l0)
#31      3.22s best:1401  next:[463,1400] quick_restart (fixed_bools=0/287)
#32      3.37s best:1400  next:[464,1399] violation_ls(batch:8 #solutions_imported:7 #lin_moves:21'304 #lin_evals:128'686 #gen_moves:16'551 #gen_evals:1'850 #comp_moves:740 #backtracks:7'904 #weight_updates:9'949)
#33      3.39s best:1399  next:[464,1398] violation_ls(batch:8 #solutions_imported:8 #lin_moves:10'487 #lin_evals:112'135 #gen_moves:28'380 #gen_evals:4'146 #comp_moves:4'044 #backtracks:12'164 #weight_updates:916)
#34      3.43s best:1343  next:[464,1342] scheduling_intervals_lns (d=0.50 s=115 t=0.10 p=0.00 stall=0 h=auto_l0)
#35      3.53s best:1241  next:[464,1240] scheduling_intervals_lns (d=0.50 s=100 t=0.10 p=0.00 stall=0 h=auto_l0)
#Bound   3.69s best:1241  next:[551,1240] objective_lb_search_no_lp [skipped_logs=1]
#Bound   4.85s best:1241  next:[563,1240] objective_lb_search_no_lp [skipped_logs=2]
#36      5.07s best:1222  next:[563,1221] graph_arc_lns (d=0.99 s=215 t=0.10 p=1.00 stall=4 h=auto_l0)
#Bound   5.16s best:1222  next:[564,1221] objective_lb_search_no_lp [skipped_logs=0]
#Bound   7.02s best:1222  next:[570,1221] objective_lb_search_no_lp [skipped_logs=1]
#Bound   8.05s best:1222  next:[592,1221] objective_lb_search_no_lp [skipped_logs=1]
#Bound   8.73s best:1222  next:[593,1221] objective_lb_search_no_lp [skipped_logs=0]
#Bound   9.79s best:1222  next:[604,1221] objective_lb_search_no_lp [skipped_logs=1]
#Bound  11.30s best:1222  next:[608,1221] objective_lb_search_no_lp
#Bound  12.81s best:1222  next:[609,1221] objective_lb_search_no_lp
#Bound  14.14s best:1222  next:[613,1221] objective_lb_search
#Bound  14.86s best:1222  next:[621,1221] objective_lb_search_no_lp
#Bound  18.20s best:1222  next:[622,1221] objective_shaving_search_no_lp (vars=507 csts=5686)
#Bound  19.63s best:1222  next:[623,1221] objective_lb_search_no_lp
#Bound  20.73s best:1222  next:[626,1221] objective_lb_search_no_lp
#Bound  21.96s best:1222  next:[628,1221] objective_lb_search_no_lp
#Bound  22.76s best:1222  next:[635,1221] objective_lb_search_no_lp
#Bound  26.11s best:1222  next:[636,1221] objective_shaving_search_no_lp (vars=502 csts=5681)
#Bound  27.63s best:1222  next:[638,1221] objective_lb_search_no_lp
#Bound  28.11s best:1222  next:[642,1221] objective_lb_search_no_lp
#Bound  28.57s best:1222  next:[643,1221] objective_lb_search_no_lp
#Bound  29.24s best:1222  next:[645,1221] objective_lb_search_no_lp
#Bound  29.43s best:1222  next:[646,1221] objective_lb_search_no_lp
#Bound  30.23s best:1222  next:[647,1221] objective_lb_search_no_lp
#Bound  31.14s best:1222  next:[650,1221] objective_lb_search_no_lp
#Bound  32.52s best:1222  next:[654,1221] objective_lb_search_no_lp
#Bound  33.00s best:1222  next:[660,1221] objective_lb_search_no_lp
#Bound  34.29s best:1222  next:[662,1221] objective_lb_search_no_lp
#Bound  35.00s best:1222  next:[679,1221] objective_lb_search_no_lp
#Bound  37.43s best:1222  next:[683,1221] objective_lb_search_no_lp
#Bound  38.05s best:1222  next:[686,1221] objective_lb_search_no_lp
#Bound  39.19s best:1222  next:[687,1221] objective_lb_search_no_lp
#Bound  39.27s best:1222  next:[689,1221] objective_lb_search_no_lp
#Bound  39.45s best:1222  next:[691,1221] objective_lb_search_no_lp
#Bound  39.57s best:1222  next:[692,1221] objective_lb_search_no_lp
#Bound  39.65s best:1222  next:[693,1221] objective_lb_search_no_lp
#Bound  41.57s best:1222  next:[695,1221] objective_lb_search_no_lp
#Bound  44.63s best:1222  next:[697,1221] objective_lb_search_no_lp
#Bound  45.28s best:1222  next:[699,1221] objective_lb_search_no_lp
#Bound  46.31s best:1222  next:[700,1221] objective_lb_search_no_lp
#Bound  48.53s best:1222  next:[701,1221] objective_lb_search_no_lp
#Bound  49.00s best:1222  next:[702,1221] objective_lb_search_no_lp
#Bound  56.42s best:1222  next:[712,1221] objective_lb_search_no_lp
#Bound  58.38s best:1222  next:[720,1221] objective_lb_search_no_lp
#Bound  63.69s best:1222  next:[722,1221] objective_lb_search_no_lp
#Bound  65.35s best:1222  next:[723,1221] objective_lb_search_no_lp
#Bound  71.53s best:1222  next:[726,1221] objective_lb_search_no_lp
#Bound  73.39s best:1222  next:[727,1221] objective_lb_search_no_lp
#Bound  80.86s best:1222  next:[729,1221] objective_lb_search_no_lp
#Bound  81.62s best:1222  next:[730,1221] objective_lb_search_no_lp
#Bound  83.19s best:1222  next:[731,1221] objective_lb_search_no_lp
#Bound  90.24s best:1222  next:[732,1221] objective_lb_search_no_lp
#Bound  91.76s best:1222  next:[733,1221] objective_lb_search_no_lp
#Bound  95.97s best:1222  next:[734,1221] objective_lb_search_no_lp
#Bound  98.06s best:1222  next:[735,1221] objective_lb_search_no_lp
#Bound 101.48s best:1222  next:[736,1221] objective_lb_search_no_lp
#Bound 114.81s best:1222  next:[737,1221] objective_shaving_search_no_lp (vars=514 csts=5693)
#Bound 116.14s best:1222  next:[738,1221] objective_lb_search
#Bound 119.26s best:1222  next:[740,1221] objective_lb_search_no_lp
#Bound 119.69s best:1222  next:[745,1221] objective_lb_search_no_lp
#Bound 120.32s best:1222  next:[747,1221] objective_lb_search_no_lp
#Bound 121.42s best:1222  next:[749,1221] objective_lb_search_no_lp
#Bound 132.53s best:1222  next:[750,1221] objective_lb_search_no_lp
#Bound 143.37s best:1222  next:[751,1221] objective_lb_search_no_lp
#Bound 144.87s best:1222  next:[752,1221] objective_lb_search_no_lp
#Bound 146.71s best:1222  next:[753,1221] objective_lb_search_no_lp
#Bound 148.13s best:1222  next:[754,1221] objective_lb_search_no_lp
#Bound 150.42s best:1222  next:[755,1221] objective_lb_search_no_lp
#Bound 158.93s best:1222  next:[757,1221] objective_lb_search_no_lp
#Bound 162.72s best:1222  next:[759,1221] objective_lb_search_no_lp
#Bound 167.68s best:1222  next:[760,1221] objective_lb_search_no_lp
#Bound 171.50s best:1222  next:[761,1221] objective_lb_search_no_lp
#Bound 174.06s best:1222  next:[762,1221] objective_lb_search_no_lp
#Bound 175.73s best:1222  next:[763,1221] objective_lb_search_no_lp
#Bound 181.21s best:1222  next:[764,1221] objective_lb_search_no_lp
#Bound 183.29s best:1222  next:[765,1221] objective_lb_search_no_lp
#Bound 184.98s best:1222  next:[766,1221] objective_lb_search_no_lp
#Bound 195.89s best:1222  next:[767,1221] objective_lb_search_no_lp
#Bound 199.93s best:1222  next:[768,1221] objective_lb_search_no_lp
#Bound 210.60s best:1222  next:[769,1221] objective_lb_search_no_lp
#Bound 214.53s best:1222  next:[770,1221] objective_lb_search_no_lp
#Bound 217.53s best:1222  next:[772,1221] objective_lb_search_no_lp
#Bound 231.44s best:1222  next:[773,1221] objective_lb_search_no_lp
#Bound 244.44s best:1222  next:[775,1221] objective_lb_search_no_lp
#Bound 246.92s best:1222  next:[777,1221] objective_lb_search_no_lp
#Bound 249.18s best:1222  next:[778,1221] objective_lb_search_no_lp
#Bound 249.50s best:1222  next:[779,1221] objective_lb_search_no_lp
#Bound 255.22s best:1222  next:[780,1221] objective_lb_search_no_lp
#Bound 256.49s best:1222  next:[782,1221] objective_lb_search_no_lp
#Bound 257.38s best:1222  next:[783,1221] objective_lb_search_no_lp
#Bound 258.25s best:1222  next:[784,1221] objective_lb_search_no_lp
#Bound 259.52s best:1222  next:[785,1221] objective_lb_search_no_lp
#Bound 260.62s best:1222  next:[786,1221] objective_lb_search_no_lp
#Bound 261.98s best:1222  next:[787,1221] objective_lb_search_no_lp
#Bound 264.04s best:1222  next:[788,1221] objective_lb_search_no_lp
#Bound 266.48s best:1222  next:[790,1221] objective_lb_search_no_lp
#Bound 269.12s best:1222  next:[791,1221] objective_lb_search_no_lp
#Bound 271.32s best:1222  next:[793,1221] objective_lb_search_no_lp
#Bound 275.10s best:1222  next:[794,1221] objective_lb_search_no_lp
#Bound 280.30s best:1222  next:[795,1221] objective_lb_search_no_lp
#Bound 307.36s best:1222  next:[796,1221] objective_shaving_search_no_lp (vars=514 csts=5693)
#Bound 320.99s best:1222  next:[797,1221] objective_lb_search_no_lp
#Bound 340.84s best:1222  next:[799,1221] objective_lb_search_no_lp
#Bound 357.81s best:1222  next:[800,1221] objective_lb_search_no_lp
#Bound 383.67s best:1222  next:[801,1221] objective_lb_search_no_lp
#Bound 387.45s best:1222  next:[802,1221] objective_lb_search_no_lp
#Bound 398.02s best:1222  next:[804,1221] objective_lb_search_no_lp
#Bound 420.01s best:1222  next:[806,1221] objective_lb_search_no_lp
#Bound 429.27s best:1222  next:[807,1221] objective_lb_search_no_lp
#Bound 447.05s best:1222  next:[808,1221] bool_core (num_cores=172 [size:1 mw:1] a=1 d=6 fixed=636/5680 clauses=479'401)
#Bound 449.94s best:1222  next:[809,1221] bool_core (num_cores=173 [size:1 mw:1] a=1 d=6 fixed=637/5696 clauses=483'593)
#Bound 453.64s best:1222  next:[810,1221] bool_core (num_cores=174 [size:1 mw:1] a=1 d=6 fixed=638/5712 clauses=484'181)
#Bound 456.80s best:1222  next:[811,1221] bool_core (num_cores=175 [size:1 mw:1] a=1 d=6 fixed=640/5728 clauses=488'571)
#Bound 461.00s best:1222  next:[812,1221] bool_core (num_cores=176 [size:1 mw:1] a=1 d=6 fixed=643/5744 clauses=490'346)
#Bound 464.77s best:1222  next:[813,1221] bool_core (num_cores=177 [size:1 mw:1] a=1 d=6 fixed=644/5760 clauses=490'290)
#Bound 468.91s best:1222  next:[814,1221] bool_core (num_cores=178 [size:1 mw:1] a=1 d=6 fixed=645/5776 clauses=492'938)
#Bound 472.36s best:1222  next:[815,1221] bool_core (num_cores=179 [size:1 mw:1] a=1 d=6 fixed=647/5792 clauses=497'542)
#Bound 476.62s best:1222  next:[816,1221] bool_core (num_cores=180 [size:1 mw:1] a=1 d=6 fixed=648/5808 clauses=498'791)
#Bound 480.31s best:1222  next:[817,1221] bool_core (num_cores=181 [size:1 mw:1] a=1 d=6 fixed=650/5824 clauses=503'531)
#Bound 484.94s best:1222  next:[818,1221] bool_core (num_cores=182 [size:1 mw:1] a=1 d=6 fixed=651/5840 clauses=504'845)
#Bound 488.88s best:1222  next:[819,1221] bool_core (num_cores=183 [size:1 mw:1] a=1 d=6 fixed=652/5856 clauses=505'818)
#Bound 494.04s best:1222  next:[820,1221] bool_core (num_cores=184 [size:1 mw:1] a=1 d=6 fixed=653/5872 clauses=509'121)
#Bound 498.21s best:1222  next:[821,1221] bool_core (num_cores=185 [size:1 mw:1] a=1 d=6 fixed=655/5888 clauses=514'197)
#Bound 503.54s best:1222  next:[822,1221] bool_core (num_cores=186 [size:1 mw:1] a=1 d=6 fixed=656/5904 clauses=515'223)
#Bound 507.93s best:1222  next:[823,1221] bool_core (num_cores=187 [size:1 mw:1] a=1 d=6 fixed=660/5920 clauses=515'794)
#Bound 513.34s best:1222  next:[824,1221] bool_core (num_cores=188 [size:1 mw:1] a=1 d=6 fixed=661/5936 clauses=518'927)
#Bound 517.96s best:1222  next:[825,1221] bool_core (num_cores=189 [size:1 mw:1] a=1 d=6 fixed=663/5952 clauses=524'226)
#Bound 524.32s best:1222  next:[826,1221] bool_core (num_cores=190 [size:1 mw:1] a=1 d=6 fixed=664/5968 clauses=525'343)
#Bound 530.56s best:1222  next:[827,1221] bool_core (num_cores=191 [size:1 mw:1] a=1 d=6 fixed=700/5984 clauses=525'996)
#Bound 536.35s best:1222  next:[828,1221] bool_core (num_cores=192 [size:1 mw:1] a=1 d=6 fixed=701/5999 clauses=531'988)
#Bound 542.92s best:1222  next:[829,1221] bool_core (num_cores=193 [size:1 mw:1] a=1 d=6 fixed=702/6014 clauses=532'373)
#Bound 549.26s best:1222  next:[830,1221] bool_core (num_cores=194 [size:1 mw:1] a=1 d=6 fixed=705/6029 clauses=533'185)
#Bound 555.22s best:1222  next:[831,1221] bool_core (num_cores=195 [size:1 mw:1] a=1 d=6 fixed=706/6044 clauses=536'396)
#Bound 560.39s best:1222  next:[832,1221] bool_core (num_cores=196 [size:1 mw:1] a=1 d=6 fixed=708/6059 clauses=542'097)
#Bound 567.61s best:1222  next:[833,1221] bool_core (num_cores=197 [size:1 mw:1] a=1 d=6 fixed=709/6074 clauses=543'181)
#Bound 575.11s best:1222  next:[834,1221] bool_core (num_cores=198 [size:1 mw:1] a=1 d=6 fixed=712/6089 clauses=544'950)
#Bound 582.25s best:1222  next:[835,1221] bool_core (num_cores=199 [size:1 mw:1] a=1 d=6 fixed=717/6104 clauses=547'826)
#Bound 589.33s best:1222  next:[836,1221] bool_core (num_cores=200 [size:1 mw:1] a=1 d=6 fixed=720/6119 clauses=548'725)
#Bound 599.67s best:1222  next:[837,1221] bool_core (num_cores=201 [size:1 mw:1] a=1 d=6 fixed=722/6134 clauses=554'000)
#Bound 608.10s best:1222  next:[838,1221] bool_core (num_cores=202 [size:1 mw:1] a=1 d=6 fixed=723/6149 clauses=556'421)
#Bound 617.43s best:1222  next:[839,1221] bool_core (num_cores=203 [size:1 mw:1] a=1 d=6 fixed=731/6164 clauses=558'441)
#Bound 626.04s best:1222  next:[840,1221] bool_core (num_cores=204 [size:1 mw:1] a=1 d=6 fixed=734/6179 clauses=561'409)
#Bound 633.48s best:1222  next:[841,1221] bool_core (num_cores=205 [size:1 mw:1] a=1 d=6 fixed=737/6194 clauses=557'786)
#Bound 638.60s best:1222  next:[842,1221] bool_core (num_cores=206 [size:1 mw:1] a=1 d=6 fixed=801/6209 clauses=553'871)
#Bound 645.51s best:1222  next:[843,1221] bool_core (num_cores=207 [size:1 mw:1] a=1 d=6 fixed=802/6224 clauses=557'279)
#Bound 651.77s best:1222  next:[844,1221] bool_core (num_cores=208 [size:1 mw:1] a=1 d=6 fixed=803/6239 clauses=563'250)
#Bound 659.33s best:1222  next:[845,1221] bool_core (num_cores=209 [size:1 mw:1] a=1 d=6 fixed=805/6254 clauses=562'221)
#Bound 666.83s best:1222  next:[846,1221] bool_core (num_cores=210 [size:1 mw:1] a=1 d=6 fixed=806/6269 clauses=565'171)
#Bound 672.72s best:1222  next:[847,1221] bool_core (num_cores=211 [size:1 mw:1] a=1 d=6 fixed=811/6284 clauses=571'007)
#Bound 681.09s best:1222  next:[848,1221] bool_core (num_cores=212 [size:1 mw:1] a=1 d=6 fixed=813/6299 clauses=569'671)
#Bound 690.73s best:1222  next:[849,1221] bool_core (num_cores=213 [size:1 mw:1] a=1 d=6 fixed=814/6314 clauses=573'347)
#Bound 698.11s best:1222  next:[850,1221] bool_core (num_cores=214 [size:1 mw:1] a=1 d=6 fixed=815/6329 clauses=575'488)
#Bound 707.73s best:1222  next:[851,1221] bool_core (num_cores=215 [size:1 mw:1] a=1 d=6 fixed=818/6349 clauses=578'582)
#Bound 715.86s best:1222  next:[852,1221] bool_core (num_cores=216 [size:1 mw:1] a=1 d=6 fixed=844/6364 clauses=577'650)
#Bound 721.72s best:1222  next:[853,1221] bool_core (num_cores=217 [size:1 mw:1] a=1 d=6 fixed=848/6379 clauses=577'618)
#Bound 728.30s best:1222  next:[854,1221] bool_core (num_cores=218 [size:1 mw:1] a=1 d=6 fixed=887/6394 clauses=573'996)
#Bound 734.86s best:1222  next:[855,1221] bool_core (num_cores=219 [size:1 mw:1] a=1 d=6 fixed=893/6409 clauses=576'180)
#Bound 740.75s best:1222  next:[856,1221] bool_core (num_cores=220 [size:1 mw:1] a=1 d=6 fixed=894/6424 clauses=582'015)
#Bound 748.11s best:1222  next:[857,1221] bool_core (num_cores=221 [size:1 mw:1] a=1 d=6 fixed=901/6439 clauses=579'873)
#Bound 753.35s best:1222  next:[858,1221] bool_core (num_cores=222 [size:1 mw:1] a=1 d=6 fixed=906/6454 clauses=585'377)
#Bound 760.31s best:1222  next:[859,1221] bool_core (num_cores=223 [size:1 mw:1] a=1 d=6 fixed=911/6469 clauses=581'789)
#Bound 767.46s best:1222  next:[860,1221] bool_core (num_cores=224 [size:1 mw:1] a=1 d=6 fixed=933/6484 clauses=580'447)
#Bound 774.43s best:1222  next:[861,1221] bool_core (num_cores=225 [size:1 mw:1] a=1 d=6 fixed=943/6499 clauses=581'852)
#Bound 782.05s best:1222  next:[862,1221] bool_core (num_cores=226 [size:1 mw:1] a=1 d=6 fixed=945/6514 clauses=584'305)
#Bound 790.06s best:1222  next:[863,1221] bool_core (num_cores=227 [size:1 mw:1] a=1 d=6 fixed=955/6529 clauses=587'352)
#Bound 797.94s best:1222  next:[864,1221] bool_core (num_cores=228 [size:1 mw:1] a=1 d=6 fixed=968/6543 clauses=588'726)
#Bound 805.49s best:1222  next:[865,1221] bool_core (num_cores=229 [size:1 mw:1] a=1 d=6 fixed=971/6556 clauses=595'149)
#Bound 814.85s best:1222  next:[866,1221] bool_core (num_cores=230 [size:1 mw:1] a=1 d=6 fixed=977/6569 clauses=592'238)
#Bound 825.29s best:1222  next:[867,1221] bool_core (num_cores=231 [size:1 mw:1] a=1 d=6 fixed=979/6583 clauses=596'610)
#Bound 837.78s best:1222  next:[868,1221] bool_core (num_cores=232 [size:1 mw:1] a=1 d=6 fixed=980/6596 clauses=597'631)
#Bound 846.92s best:1222  next:[869,1221] bool_core (num_cores=233 [size:1 mw:1] a=1 d=6 fixed=981/6609 clauses=601'118)
#Bound 856.96s best:1222  next:[870,1221] bool_core (num_cores=234 [size:1 mw:1] a=1 d=6 fixed=984/6622 clauses=604'274)
#Bound 867.69s best:1222  next:[871,1221] bool_core (num_cores=235 [size:1 mw:1] a=1 d=6 fixed=985/6635 clauses=606'284)
#Bound 881.66s best:1222  next:[874,1221] objective_lb_search_no_lp
#Bound 884.85s best:1222  next:[877,1221] objective_lb_search_no_lp
#Bound 888.80s best:1222  next:[879,1221] objective_lb_search_no_lp
#Bound 890.28s best:1222  next:[880,1221] objective_lb_search_no_lp
#Bound 912.22s best:1222  next:[881,1221] objective_lb_search_no_lp
#Bound 920.44s best:1222  next:[882,1221] objective_lb_search_no_lp
#Bound 931.05s best:1222  next:[883,1221] objective_lb_search_no_lp
#Bound 938.89s best:1222  next:[884,1221] objective_lb_search_no_lp
#Bound 954.33s best:1222  next:[887,1221] objective_lb_search_no_lp
#Bound 960.97s best:1222  next:[888,1221] objective_lb_search_no_lp
#Bound 972.14s best:1222  next:[890,1221] objective_lb_search_no_lp
#Bound 977.76s best:1222  next:[891,1221] objective_lb_search_no_lp
#Bound 987.91s best:1222  next:[893,1221] objective_lb_search_no_lp
#Bound 993.22s best:1222  next:[894,1221] objective_lb_search_no_lp
#Bound 1004.82s best:1222  next:[896,1221] objective_lb_search_no_lp
#Bound 1026.03s best:1222  next:[898,1221] objective_lb_search_no_lp
#Bound 1028.93s best:1222  next:[899,1221] objective_lb_search_no_lp
#Bound 1030.70s best:1222  next:[901,1221] objective_lb_search_no_lp
#Bound 1032.83s best:1222  next:[902,1221] objective_lb_search_no_lp
#Bound 1033.80s best:1222  next:[903,1221] objective_lb_search_no_lp
#Bound 1036.13s best:1222  next:[904,1221] objective_lb_search_no_lp
#Bound 1046.49s best:1222  next:[905,1221] objective_lb_search_no_lp
#Bound 1050.36s best:1222  next:[907,1221] objective_lb_search_no_lp
#Bound 1057.23s best:1222  next:[909,1221] objective_lb_search_no_lp
#Bound 1072.58s best:1222  next:[911,1221] objective_lb_search_no_lp
#Bound 1074.20s best:1222  next:[912,1221] objective_lb_search_no_lp
#Bound 1077.82s best:1222  next:[914,1221] objective_lb_search_no_lp
#Bound 1081.88s best:1222  next:[915,1221] objective_lb_search_no_lp
#Bound 1087.99s best:1222  next:[916,1221] objective_lb_search_no_lp
#Bound 1088.19s best:1222  next:[917,1221] objective_lb_search_no_lp
#Bound 1091.76s best:1222  next:[919,1221] objective_lb_search_no_lp
#Bound 1101.16s best:1222  next:[921,1221] objective_lb_search_no_lp
#Bound 1105.63s best:1222  next:[922,1221] objective_lb_search_no_lp
#Bound 1107.43s best:1222  next:[923,1221] objective_lb_search_no_lp
#Bound 1110.53s best:1222  next:[924,1221] objective_lb_search_no_lp
#Bound 1117.10s best:1222  next:[925,1221] objective_lb_search_no_lp
#Bound 1124.35s best:1222  next:[926,1221] objective_lb_search_no_lp
#Bound 1127.31s best:1222  next:[927,1221] objective_lb_search_no_lp
#Bound 1131.81s best:1222  next:[929,1221] objective_lb_search_no_lp
#Bound 1134.72s best:1222  next:[930,1221] objective_lb_search_no_lp
#Bound 1136.67s best:1222  next:[932,1221] objective_lb_search_no_lp
#Bound 1142.03s best:1222  next:[934,1221] objective_lb_search_no_lp
#Bound 1155.66s best:1222  next:[941,1221] objective_lb_search_no_lp
#Bound 1181.16s best:1222  next:[944,1221] objective_lb_search_no_lp
#Bound 1183.65s best:1222  next:[946,1221] objective_lb_search_no_lp
#Bound 1192.35s best:1222  next:[948,1221] objective_lb_search_no_lp
#Bound 1196.94s best:1222  next:[949,1221] objective_lb_search_no_lp
#Bound 1204.04s best:1222  next:[950,1221] objective_lb_search_no_lp
#Bound 1247.12s best:1222  next:[951,1221] objective_lb_search_no_lp
#Bound 1266.14s best:1222  next:[952,1221] objective_lb_search_no_lp
#Bound 1266.96s best:1222  next:[953,1221] objective_lb_search_no_lp
#Model 1268.61s var:471/473 constraints:5577/5736
#Bound 1286.31s best:1222  next:[954,1221] objective_lb_search_no_lp
#Bound 1295.60s best:1222  next:[955,1221] objective_lb_search_no_lp
#Bound 1301.16s best:1222  next:[956,1221] lb_tree_search (nodes=25620/59846 rc=1728 decisions=793476 @root=198 restarts=12) 
#Model 1302.84s var:470/473 constraints:5565/5736
#Model 1304.86s var:469/473 constraints:5531/5736
#Bound 1305.79s best:1222  next:[957,1221] lb_tree_search (nodes=25513/60070 rc=1734 decisions=796915 @root=199 restarts=12) 
#Bound 1310.06s best:1222  next:[958,1221] lb_tree_search (nodes=24345/60310 rc=1741 decisions=800259 @root=200 restarts=12) 
#Bound 1313.03s best:1222  next:[959,1221] objective_lb_search_no_lp
#Bound 1314.12s best:1222  next:[960,1221] objective_lb_search_no_lp
#Model 1317.46s var:458/473 constraints:4898/5736
#Model 1317.58s var:457/473 constraints:4864/5736
#Bound 1317.90s best:1222  next:[962,1221] objective_lb_search_no_lp
#Bound 1319.52s best:1222  next:[967,1221] objective_lb_search_no_lp
#Bound 1320.68s best:1222  next:[986,1221] objective_lb_search_max_lp
#Bound 1323.33s best:1222  next:[987,1221] objective_lb_search_no_lp
#Model 1324.81s var:456/473 constraints:4770/5736
#Bound 1325.07s best:1222  next:[988,1221] objective_lb_search_no_lp
#Model 1325.18s var:453/473 constraints:4487/5736
#Bound 1325.52s best:1222  next:[994,1221] objective_lb_search_no_lp
#Model 1325.87s var:452/473 constraints:4443/5736
#Model 1326.12s var:451/473 constraints:4283/5736
#Bound 1326.29s best:1222  next:[1005,1221] objective_lb_search_no_lp
#Bound 1326.97s best:1222  next:[1006,1221] objective_shaving_search_no_lp (vars=378 csts=4209)
#Bound 1327.45s best:1222  next:[1007,1221] objective_shaving_search_no_lp (vars=380 csts=4211)
#Bound 1327.94s best:1222  next:[1008,1221] objective_shaving_search_no_lp (vars=384 csts=4208)
#Bound 1328.08s best:1222  next:[1109,1221] objective_lb_search_no_lp
#Model 1329.31s var:450/473 constraints:4172/5736
#Bound 1329.60s best:1222  next:[1110,1221] objective_lb_search_no_lp
#Model 1329.70s var:446/473 constraints:3929/5736
#Model 1329.85s var:441/473 constraints:3286/5736
#Model 1329.86s var:436/473 constraints:2789/5736
#Model 1330.06s var:432/473 constraints:2528/5736
#Done  1330.07s quick_restart_no_lp
#Done  1330.07s core
#Done  1330.07s objective_lb_search
#Model 1330.07s var:415/473 constraints:1626/5736
#Done  1330.07s reduced_costs
#Done  1330.08s pseudo_costs
#Done  1330.08s probing_max_lp

Task timing                                  n [     min,      max]      avg      dev     time         n [     min,      max]      avg      dev    dtime
                             'core':         1 [  22.16m,   22.16m]   22.16m   0.00ns   22.16m         1 [  38.66m,   38.66m]   38.66m   0.00ns   38.66m
                       'default_lp':         1 [  22.16m,   22.16m]   22.16m   0.00ns   22.16m         1 [   5.72m,    5.72m]    5.72m   0.00ns    5.72m
                 'feasibility_pump':      2779 [ 67.25ms, 729.51ms] 194.09ms  17.45ms    8.99m      2778 [ 43.23ms, 149.51ms]  47.69ms   2.03ms    2.21m
                            'fixed':         1 [  22.16m,   22.16m]   22.16m   0.00ns   22.16m         1 [   7.76m,    7.76m]    7.76m   0.00ns    7.76m
                  'fj_long_default':         1 [487.35ms, 487.35ms] 487.35ms   0.00ns 487.35ms         1 [ 92.59ms,  92.59ms]  92.59ms   0.00ns  92.59ms
              'fj_long_lin_default':         1 [206.33ms, 206.33ms] 206.33ms   0.00ns 206.33ms         1 [102.01ms, 102.01ms] 102.01ms   0.00ns 102.01ms
                   'fj_long_random':         1 [355.25ms, 355.25ms] 355.25ms   0.00ns 355.25ms         1 [ 89.56ms,  89.56ms]  89.56ms   0.00ns  89.56ms
                 'fj_short_default':         1 [142.94ms, 142.94ms] 142.94ms   0.00ns 142.94ms         1 [106.55ms, 106.55ms] 106.55ms   0.00ns 106.55ms
             'fj_short_lin_default':         1 [379.63ms, 379.63ms] 379.63ms   0.00ns 379.63ms         1 [100.03ms, 100.03ms] 100.03ms   0.00ns 100.03ms
              'fj_short_lin_random':         1 [406.59ms, 406.59ms] 406.59ms   0.00ns 406.59ms         1 [ 99.27ms,  99.27ms]  99.27ms   0.00ns  99.27ms
                  'fj_short_random':         1 [393.84ms, 393.84ms] 393.84ms   0.00ns 393.84ms         1 [ 97.99ms,  97.99ms]  97.99ms   0.00ns  97.99ms
                        'fs_random':         1 [114.31ms, 114.31ms] 114.31ms   0.00ns 114.31ms         1 [  5.17us,   5.17us]   5.17us   0.00ns   5.17us
                        'fs_random':         1 [124.04ms, 124.04ms] 124.04ms   0.00ns 124.04ms         1 [ 20.00ns,  20.00ns]  20.00ns   0.00ns  20.00ns
                  'fs_random_no_lp':         1 [151.18ms, 151.18ms] 151.18ms   0.00ns 151.18ms         1 [951.92us, 951.92us] 951.92us   0.00ns 951.92us
          'fs_random_quick_restart':         1 [ 96.15ms,  96.15ms]  96.15ms   0.00ns  96.15ms         1 [185.75us, 185.75us] 185.75us   0.00ns 185.75us
          'fs_random_quick_restart':         1 [114.56ms, 114.56ms] 114.56ms   0.00ns 114.56ms         1 [ 27.35us,  27.35us]  27.35us   0.00ns  27.35us
    'fs_random_quick_restart_no_lp':         1 [114.41ms, 114.41ms] 114.41ms   0.00ns 114.41ms         1 [344.18us, 344.18us] 344.18us   0.00ns 344.18us
                    'graph_arc_lns':      2779 [  4.92ms,    1.77s] 628.64ms 362.08ms   29.12m      2467 [ 10.00ns, 253.78ms] 106.76ms  64.94ms    4.39m
                    'graph_cst_lns':      2779 [  2.49ms,    1.30s] 576.89ms 313.66ms   26.72m      2478 [ 10.00ns, 181.60ms]  93.24ms  53.55ms    3.85m
                    'graph_dec_lns':      2779 [  5.13ms,    1.51s] 636.70ms 331.05ms   29.49m      2514 [ 10.00ns, 215.58ms] 103.34ms  58.74ms    4.33m
                    'graph_var_lns':      2779 [  4.58ms,    1.36s] 576.30ms 365.97ms   26.69m      2449 [ 10.00ns, 174.97ms]  96.58ms  66.27ms    3.94m
                   'lb_tree_search':         1 [  22.16m,   22.16m]   22.16m   0.00ns   22.16m         1 [  12.97m,   12.97m]   12.97m   0.00ns   12.97m
                           'max_lp':         1 [  22.16m,   22.16m]   22.16m   0.00ns   22.16m         1 [   8.59m,    8.59m]    8.59m   0.00ns    8.59m
                            'no_lp':         1 [  22.16m,   22.16m]   22.16m   0.00ns   22.16m         1 [   6.22m,    6.22m]    6.22m   0.00ns    6.22m
              'objective_lb_search':         1 [  22.16m,   22.16m]   22.16m   0.00ns   22.16m         1 [   7.96m,    7.96m]    7.96m   0.00ns    7.96m
       'objective_lb_search_max_lp':         1 [  22.16m,   22.16m]   22.16m   0.00ns   22.16m         1 [  10.96m,   10.96m]   10.96m   0.00ns   10.96m
        'objective_lb_search_no_lp':         1 [  22.16m,   22.16m]   22.16m   0.00ns   22.16m         1 [   4.43m,    4.43m]    4.43m   0.00ns    4.43m
  'objective_shaving_search_max_lp':       255 [ 64.22ms,   43.08s]    5.21s    5.55s   22.13m       248 [  4.26ms,   12.99s]    1.47s    1.62s    6.08m
   'objective_shaving_search_no_lp':       255 [ 77.04ms,   43.09s]    5.21s    5.55s   22.13m       252 [165.13us,    8.72s] 974.30ms    1.08s    4.09m
                          'probing':         1 [  22.16m,   22.16m]   22.16m   0.00ns   22.16m         1 [   5.25m,    5.25m]    5.25m   0.00ns    5.25m
                   'probing_max_lp':         1 [  22.16m,   22.16m]   22.16m   0.00ns   22.16m         1 [  16.86m,   16.86m]   16.86m   0.00ns   16.86m
                     'pseudo_costs':         1 [  22.16m,   22.16m]   22.16m   0.00ns   22.16m         1 [   7.97m,    7.97m]    7.97m   0.00ns    7.97m
                    'quick_restart':         1 [  22.16m,   22.16m]   22.16m   0.00ns   22.16m         1 [  11.50m,   11.50m]   11.50m   0.00ns   11.50m
              'quick_restart_no_lp':         1 [  22.16m,   22.16m]   22.16m   0.00ns   22.16m         1 [  13.99m,   13.99m]   13.99m   0.00ns   13.99m
                    'reduced_costs':         1 [  22.16m,   22.16m]   22.16m   0.00ns   22.16m         1 [  10.06m,   10.06m]   10.06m   0.00ns   10.06m
                        'rins/rens':      2779 [119.63us,    1.00s] 288.73ms 245.06ms   13.37m      1958 [ 10.00ns, 101.40ms]  73.48ms  39.68ms    2.40m
                      'rnd_cst_lns':      2779 [  2.40ms,    1.60s] 637.29ms 352.80ms   29.52m      2509 [ 10.00ns, 231.42ms] 105.94ms  63.63ms    4.43m
                      'rnd_var_lns':      2779 [  4.72ms,    1.99s] 617.85ms 323.62ms   28.62m      2521 [ 10.00ns, 169.17ms]  99.65ms  57.90ms    4.19m
         'scheduling_intervals_lns':      2779 [ 35.59ms,    2.66s] 962.35ms 242.80ms   44.57m      2776 [100.00ms, 460.54ms] 177.79ms  54.92ms    8.23m
       'scheduling_precedences_lns':      2779 [ 19.35ms,    2.87s] 961.58ms 243.75ms   44.54m      2776 [100.01ms, 360.23ms] 177.76ms  54.77ms    8.22m
       'scheduling_time_window_lns':      2779 [ 36.90ms,    3.00s] 964.93ms 243.79ms   44.69m      2776 [100.01ms, 458.98ms] 178.14ms  55.03ms    8.24m
                     'violation_ls':      2779 [  2.83ms, 135.93ms]  61.97ms  12.07ms    2.87m      2779 [  1.87ms, 275.35ms] 109.35ms  30.74ms    5.06m
                     'violation_ls':      2779 [ 11.15ms, 178.93ms]  61.52ms  11.75ms    2.85m      2779 [  5.55ms, 333.82ms] 109.20ms  29.97ms    5.06m

Search stats                         Bools  Conflicts   Branches  Restarts     BoolPropag  IntegerPropag
                           'core':   8'344    664'728  1'793'130    94'320  1'302'630'088    672'954'856
                     'default_lp':     107    338'195  1'235'209   121'989      9'515'628    540'472'575
                          'fixed':   2'532  1'870'627  3'982'351       510    585'913'759    807'959'156
                      'fs_random':     107          0        214       214             30          8'439
                      'fs_random':     107          0        214       214             30          8'439
                'fs_random_no_lp':     120          2        256       214            123         12'595
        'fs_random_quick_restart':     107          0        214       214             30          8'439
        'fs_random_quick_restart':     107          0        214       214             30          8'439
  'fs_random_quick_restart_no_lp':     107          0        254       214             35          9'415
                 'lb_tree_search':     117        836  1'512'914   273'918      3'441'974    196'848'656
                         'max_lp':     107    297'228  1'975'014   318'478     11'811'239    608'776'931
                          'no_lp':   2'234    986'447  2'084'312   112'144    522'630'182  1'156'282'374
            'objective_lb_search':     514    264'621  1'582'272   202'953     27'463'859    573'897'518
     'objective_lb_search_max_lp':     453    114'278  2'179'279   389'657     25'257'915    524'937'991
      'objective_lb_search_no_lp':     581    668'585  1'543'529   114'247     32'515'524    896'321'476
                        'probing':     849        550     50'092    25'871        345'712      3'018'805
                 'probing_max_lp':     849        581     26'489    13'997        200'299      1'756'099
                   'pseudo_costs':     107    373'731  1'599'705   195'805     11'976'696    620'689'694
                  'quick_restart':   4'835    233'717  2'029'387   132'830    343'375'835    361'052'827
            'quick_restart_no_lp':   7'398    730'677  2'767'770   116'284    864'330'267    677'434'027
                  'reduced_costs':  25'369    413'564  3'408'941   115'556  1'642'631'251    616'032'883

SAT stats                           ClassicMinim  LitRemoved  LitLearned  LitForgotten  Subsumed  MClauses  MDecisions  MLitTrue  MSubsumed  MLitRemoved  MReused
                           'core':       609'313   5'489'942   7'323'635     1'369'666     2'204    45'629     223'189         7      2'501       10'377      382
                     'default_lp':       221'781     661'894   5'033'866     3'774'220     9'226    61'260     776'838         1      9'215       73'659   12'092
                          'fixed':     1'328'354   9'416'925  37'957'452    37'423'333        25        10          50         0          0            0        0
                      'fs_random':             0           0           0             0         0         0           0         0          0            0        0
                      'fs_random':             0           0           0             0         0         0           0         0          0            0        0
                'fs_random_no_lp':             1           1          26             0         0         0           0         0          0            0        0
        'fs_random_quick_restart':             0           0           0             0         0         0           0         0          0            0        0
        'fs_random_quick_restart':             0           0           0             0         0         0           0         0          0            0        0
  'fs_random_quick_restart_no_lp':             0           0           0             0         0         0           0         0          0            0        0
                 'lb_tree_search':            85         159       4'544             0         2   126'527     639'365         0        175          703    8'709
                         'max_lp':       199'233     667'341   4'898'840     3'879'762     7'858   154'856   1'555'821         2      3'098       22'212   20'871
                          'no_lp':       853'052   5'492'955  17'739'252    15'862'718     6'752    59'017     611'909         0     23'530      173'138    8'623
            'objective_lb_search':       200'307     653'525   3'005'276       651'805     6'742   109'227   1'204'551         0     21'618      160'414   24'021
     'objective_lb_search_max_lp':        83'393     263'166   1'360'440       155'408     3'363   180'444   1'879'179         0      5'938       42'618   40'000
      'objective_lb_search_no_lp':       531'114   2'013'725   7'550'500     3'084'575    11'783    62'110     656'387         9     17'860      134'466    9'980
                        'probing':             1           1         551             0         0         0           0         0          0            0        0
                 'probing_max_lp':             0           0         581             0         0         0           0         0          0            0        0
                   'pseudo_costs':       257'420     916'572   5'339'088     3'280'339     8'390   101'644   1'073'295         0     16'774      128'766   18'812
                  'quick_restart':       192'886   1'170'753   3'076'167     1'277'839     2'966    82'566     980'964        30     64'239      674'797    8'318
            'quick_restart_no_lp':       637'211   5'454'444  12'879'248     7'080'840     2'034    32'020     360'661        25     26'730      304'732    2'476
                  'reduced_costs':       337'211   1'976'324   6'895'285     5'719'721     3'419    56'396     568'921         2     17'327      114'866   11'265

Lp stats                         Component  Iterations  AddedCuts    OPTIMAL  DUAL_F.  DUAL_U.
                  'default_lp':          1   3'981'049    202'801    603'191        0        0
                       'fixed':          1     353'026      1'641  1'004'051        0        0
                   'fs_random':          1         148         92          3        0        0
                   'fs_random':          1          66          0          1        1        0
     'fs_random_quick_restart':          1         148        179          3        0        0
     'fs_random_quick_restart':          1         217        176          4        0        0
              'lb_tree_search':          1  13'238'770     53'600    560'370  320'647        0
                      'max_lp':          1   7'369'083    174'189    401'482  392'813      182
         'objective_lb_search':          1   5'695'007    114'775    523'862        0        0
  'objective_lb_search_max_lp':          1   7'226'096     67'812    249'445   74'712      179
                     'probing':          1   2'462'003    113'983    126'210        0        0
              'probing_max_lp':          1   4'578'090     83'360     57'166   12'724        0
                'pseudo_costs':          1   6'875'850    299'057    460'304  428'795      133
               'quick_restart':          1   6'506'454    126'465    473'198        1        1
               'reduced_costs':          1   6'094'238    341'597    575'836  358'641       37

Lp dimension                                                                       Final dimension of first component
                  'default_lp':    467 rows, 465 columns, 1957 entries with magnitude in [1.048594e-03, 1.000000e+00]
                       'fixed':    332 rows, 465 columns, 1213 entries with magnitude in [3.832008e-02, 1.000000e+00]
                   'fs_random':     132 rows, 465 columns, 568 entries with magnitude in [5.285162e-02, 1.000000e+00]
                   'fs_random':     132 rows, 465 columns, 568 entries with magnitude in [5.285162e-02, 1.000000e+00]
     'fs_random_quick_restart':     182 rows, 465 columns, 727 entries with magnitude in [3.832008e-02, 1.000000e+00]
     'fs_random_quick_restart':     182 rows, 465 columns, 727 entries with magnitude in [3.832008e-02, 1.000000e+00]
              'lb_tree_search':    692 rows, 473 columns, 2662 entries with magnitude in [7.260325e-04, 1.000000e+00]
                      'max_lp':    663 rows, 473 columns, 2341 entries with magnitude in [3.694123e-03, 1.000000e+00]
         'objective_lb_search':    601 rows, 465 columns, 2597 entries with magnitude in [1.355407e-03, 1.000000e+00]
  'objective_lb_search_max_lp':    728 rows, 473 columns, 2639 entries with magnitude in [1.061631e-02, 1.000000e+00]
                     'probing':  1264 rows, 465 columns, 10315 entries with magnitude in [1.742218e-04, 1.000000e+00]
              'probing_max_lp':  1525 rows, 473 columns, 13127 entries with magnitude in [4.449244e-04, 1.000000e+00]
                'pseudo_costs':   1042 rows, 473 columns, 2969 entries with magnitude in [8.999154e-04, 1.000000e+00]
               'quick_restart':    919 rows, 465 columns, 4773 entries with magnitude in [1.063349e-03, 1.000000e+00]
               'reduced_costs':   1160 rows, 473 columns, 4135 entries with magnitude in [3.465788e-04, 1.000000e+00]

Lp debug                         CutPropag  CutEqPropag   Adjust  Overflow          Bad  BadScaling
                  'default_lp':         48          346  370'076         0    2'172'922           0
                       'fixed':          0            0       38         0        6'095           0
                   'fs_random':          0            0        0         0            0           0
                   'fs_random':          0            0        0         0           45           0
     'fs_random_quick_restart':          0            0        0         0          107           0
     'fs_random_quick_restart':          0            0        0         0          118           0
              'lb_tree_search':         77           76  553'833         0    1'013'765           0
                      'max_lp':        199          161  399'137         0    2'054'195           0
         'objective_lb_search':         77          380  357'767         0    2'845'453           0
  'objective_lb_search_max_lp':        136          142  180'969         0    2'207'671           0
                     'probing':         96        3'451  122'550         0  105'100'903           0
              'probing_max_lp':        133        1'233   69'249         0   61'452'062           0
                'pseudo_costs':        333          297  538'108         0    2'889'822           0
               'quick_restart':        233          482  296'779         0    7'151'253           0
               'reduced_costs':        363          455  592'879         0    3'051'414           0

Lp pool                          Constraints  Updates  Simplif  Merged  Shortened      Split  Strenghtened        Cuts/Call
                  'default_lp':        7'693    8'877   29'426   2'655      1'650     92'934        41'941  202'801/610'477
                       'fixed':        2'188       14        0       0          0         12           140      1'641/4'026
                   'fs_random':          547        0        0       0          0          0            44              0/0
                   'fs_random':          639        0        0       0          0          0            45           92/132
     'fs_random_quick_restart':          723        0        0       0          0          0            48          176/284
     'fs_random_quick_restart':          726        0        0       0          0          0            48          179/290
              'lb_tree_search':       13'951    5'581  214'815   1'379     13'455     21'399       187'223   53'600/313'397
                      'max_lp':       12'444    7'734  275'943   2'475     12'149     50'335       237'360  174'189/484'949
         'objective_lb_search':        8'851   11'319  117'009   1'471     10'970    199'930        54'647  114'775/447'275
  'objective_lb_search_max_lp':       14'094    8'802  347'085   1'448     17'077     70'445       261'758   67'812/257'256
                     'probing':       10'514   46'763  142'579      16      8'345    949'361        41'526  113'983/286'252
              'probing_max_lp':       15'078   26'546  243'397      12      8'747    319'630       174'146   83'360/221'340
                'pseudo_costs':       12'588    9'611  467'100   3'199     24'251     63'643       291'833  299'057/720'720
               'quick_restart':        9'415   19'172  282'689     597      9'770  1'113'283        82'029  126'465/502'258
               'reduced_costs':       11'495    9'519  478'401   3'832     23'887     72'590       299'846  341'597/821'670

Lp Cut                                                fs_ran  fs_ran  fs_ran  defaul  fixed  max_lp  quick_  reduce  pseudo  lb_tre  probin  object  probin  object
                                              CG_FF:      17      17       -   9'801    131   8'368   2'360  21'078  17'258   1'718   2'170   4'424     329   1'605
                                               CG_K:      15      15       -   6'940     73   7'326   1'456  19'868  18'290   1'523   1'533   3'393     216   1'616
                                              CG_KL:       -       -       -       3      -       1       1       5       2       -       -       -       -       -
                                               CG_R:       9       9       -  10'087     88   7'599   2'930  23'008  17'737   1'287   3'937   4'603     443   1'130
                                              CG_RB:       3       3       -  25'071    386  21'241  10'389  47'818  41'267   5'327   7'350  16'168   1'086   4'915
                                             CG_RBP:       2       2       -   4'274     19   3'169   1'398   9'934   6'615     616   1'201   1'898     112     396
                                             Clique:       -       -       -       -      -     822       -   2'897   1'952     229       -       -     184     267
                                                 IB:      50      50      50  74'206    395  34'208  53'960  52'017  39'554  11'666  21'458  41'722   4'387  13'514
                                           MIR_1_FF:      26      24      12   7'343     86   7'704   3'876  16'003  14'212   2'656   4'142   4'073   1'643   3'302
                                            MIR_1_K:       3       2       2   1'548     12   2'612     771   4'972   4'727     724     799     811     251     975
                                           MIR_1_KL:       -       -       -     209      -     164      23     323     356      10     100      24      19       6
                                            MIR_1_R:       7       7       4   1'922     27   1'509   1'059   3'530   2'735     350   1'599     946     365     527
                                           MIR_1_RB:      16      16      10  11'451     78  14'673   7'819  26'376  24'753   5'077   8'040   6'526   3'215   7'073
                                          MIR_1_RBP:       -       -       -     435      6   2'746     234   4'225   2'715     408     314     142     190     207
                                          MIR_1_RLT:       -       -       -       -      -      66       -     216     161      18       -       -      74      27
                                           MIR_2_FF:       9      11       4   5'107     46   5'030   2'813  10'670   9'790   1'745   3'544   2'716   1'038   2'309
                                            MIR_2_K:       1       2       2   1'330     12   1'688     566   3'326   3'260     418     828     539     197     571
                                           MIR_2_KL:       -       -       -     155      -     131      58     259     214      12     134      38      17      12
                                            MIR_2_R:       3       4       3   1'352     12   1'478     956   2'990   2'799     564   2'568     751     872     812
                                           MIR_2_RB:       4       2       2   8'037     43   8'147   6'601  14'428  14'313   2'946   7'590   4'555   2'189   3'992
                                          MIR_2_RBP:       1       -       1     714      6   1'566     353   2'638   1'834     279     640     160     249     133
                                           MIR_3_FF:       3       3       2   3'178     28   3'431   1'849   6'747   6'736   1'151   2'434   1'788     640   1'500
                                            MIR_3_K:       -       1       -     893      8   1'158     426   2'514   2'358     348     638     394     134     395
                                           MIR_3_KL:       -       -       -     126      -      73      54     182     174      14     128      17      17       9
                                            MIR_3_R:       1       1       -   1'041     12   1'355     822   2'231   2'492     572   1'764     650     723     754
                                           MIR_3_RB:       -       1       -   5'215     23   5'152   4'867   8'960   8'979   1'729   5'798   3'096   1'390   2'300
                                          MIR_3_RBP:       1       -       -     480      4     905     265   1'644   1'130     188     410     126     118     123
                                           MIR_4_FF:       -       -       -   1'987     12   2'230   1'168   3'975   4'306     803   1'566   1'285     336   1'030
                                            MIR_4_K:       -       -       -     630      6     884     349   1'713   1'737     288     489     397      68     306
                                           MIR_4_KL:       -       -       -     143      -      69     109     172     169      13     193      69      20      16
                                            MIR_4_R:       -       -       -     790      1     995     618   1'504   1'762     449   1'103     584     339     642
                                           MIR_4_RB:       -       -       -   3'208     20   3'081   3'076   5'378   5'546   1'054   3'695   2'097     834   1'405
                                          MIR_4_RBP:       -       -       -     332      3     575     173   1'049     841     122     249     114      70      99
                                           MIR_5_FF:       -       -       -   1'120      8   1'191     704   2'154   2'335     410     975     791     166     537
                                            MIR_5_K:       -       -       -     451      2     573     227   1'113   1'152     179     351     255      45     179
                                           MIR_5_KL:       -       -       -     109      -      61      59     155     122      19     164      53       8      14
                                            MIR_5_R:       -       -       -     553      4     643     420     894   1'128     249     731     433     156     381
                                           MIR_5_RB:       -       -       -   2'113      9   1'839   1'768   3'461   3'490     594   2'135   1'269     352     818
                                          MIR_5_RBP:       -       -       -     294      2     370     111     722     592      92     181     129      35      86
                                           MIR_6_FF:       -       -       -     588      4     668     386   1'132   1'302     272     583     480     116     302
                                            MIR_6_K:       -       -       -     269      1     337     149     765     691     137     244     156      22     114
                                           MIR_6_KL:       -       -       -      55      -      45      51     108      72      10     137      20       3       6
                                            MIR_6_R:       -       -       -     295      -     376     265     636     625     152     390     285      97     167
                                           MIR_6_RB:       -       -       -   1'316      5   1'158   1'095   2'186   2'217     381   1'330     800     210     429
                                          MIR_6_RBP:       -       -       -     154      -     235      83     498     480      81     136     115      24      88
   NoOverlapCompletionTimeExhaustiveMirror_weighted:       -       -       -       -      -       -       -       1       1       -       -       -       -       1
         NoOverlapCompletionTimeExhaustive_weighted:       -       -       -       -      -     150       -     252     242      37       -       -      11      90
  NoOverlapCompletionTimeExhaustive_weighted_lifted:       -       -       -       -      -      54       -     191     121       4       -       -       1      12
                          NoOverlapDisjunctionOnEnd:       -       -       -       -      -       -       -       3       3       -       -       -       -       3
                        NoOverlapDisjunctionOnStart:       -       -       -       -      -     227       -     579     383      25       -       -       8      35
                                       ZERO_HALF_FF:       1       4       -   1'093     20   1'866     440   3'799   3'611     468     369     560     115     577
                                        ZERO_HALF_K:       2       -       -     313      1     707     141   1'568   1'719     205     104     201      46     256
                                       ZERO_HALF_KL:       -       -       -       -      -       -       -       -       2       -       -       -       -       -
                                        ZERO_HALF_R:       2       2       -   3'842     26   9'012   7'450  10'910  10'920   4'509  16'270   3'737  45'988   9'977
                                       ZERO_HALF_RB:       -       3       -   1'846     17   3'667   1'432   6'268   5'929   1'315   2'805   1'179  11'053   1'657
                                      ZERO_HALF_RBP:       -       -       -     382      5     854     285   1'552   1'146     157     664     206   3'139     115

LNS stats                        Improv/Calls  Closed  Difficulty  TimeLimit
               'graph_arc_lns':      367/2778     51%        0.99       0.18
               'graph_cst_lns':      351/2772     51%        0.99       0.15
               'graph_dec_lns':      315/2779     51%        0.99       0.17
               'graph_var_lns':      449/2779     50%        0.99       0.17
                   'rins/rens':      670/2550     51%        0.92       0.10
                 'rnd_cst_lns':      314/2776     51%        0.99       0.18
                 'rnd_var_lns':      319/2779     51%        0.99       0.17
    'scheduling_intervals_lns':        6/2778      0%        0.00       0.29
  'scheduling_precedences_lns':        5/2778      0%        0.00       0.29
  'scheduling_time_window_lns':        1/2778      0%        0.00       0.29

LS stats                   Batches  Restarts    LinMoves   GenMoves  CompoundMoves  WeightUpdates
       'fj_long_default':        1         1       9'866          0              0            134
   'fj_long_lin_default':        1         1           0      2'419            428              1
        'fj_long_random':        1         1       9'863          0              0            137
      'fj_short_default':        1         1           0      2'136            209              0
  'fj_short_lin_default':        1         1           0      2'099            424              1
   'fj_short_lin_random':        1         1           0      2'590            512              1
       'fj_short_random':        1         1           0      2'627            548              1
          'violation_ls':    2'779         0  12'186'927  5'100'096        291'765      1'496'618
          'violation_ls':    2'779         0   9'922'936  5'478'510        270'011        800'665

Solutions (36)                 Num     Rank
             'graph_arc_lns':    1  [36,36]
             'graph_dec_lns':    1  [20,20]
                     'no_lp':   12   [2,14]
             'quick_restart':    1  [31,31]
       'quick_restart_no_lp':   11   [1,27]
               'rins_lp_lns':    1  [24,24]
               'rnd_var_lns':    2  [28,30]
  'scheduling_intervals_lns':    2  [34,35]
              'violation_ls':    5  [25,33]

Objective bounds                     Num
                       'bool_core':   64
                  'initial_domain':    1
                  'lb_tree_search':    3
             'objective_lb_search':   12
      'objective_lb_search_max_lp':    1
       'objective_lb_search_no_lp':  184
  'objective_shaving_search_no_lp':    7

Solution repositories     Added  Queried  Ignored  Synchro
  'feasible solutions':  24'738   63'184        2   23'878
        'lp solutions':  17'084    1'396        0   12'866
                'pump':  58'330    1'382

Improving bounds shared             Num
                        'core':     159
                  'default_lp':     204
              'lb_tree_search':     173
                      'max_lp':     269
                       'no_lp':     123
         'objective_lb_search':      69
  'objective_lb_search_max_lp':     128
                     'probing':   4'049
              'probing_max_lp':   1'700
                'pseudo_costs':   1'350
               'quick_restart':   1'100
         'quick_restart_no_lp':  12'255
               'reduced_costs':   1'240

Clauses shared                   Num
                        'core':    7
                  'default_lp':   17
              'lb_tree_search':   24
                      'max_lp':   31
                       'no_lp':   28
         'objective_lb_search':   14
  'objective_lb_search_max_lp':   27
   'objective_lb_search_no_lp':   45
                     'probing':    1
                'pseudo_costs':  207
               'quick_restart':   27
         'quick_restart_no_lp':   50
               'reduced_costs':   17

CpSolverResponse summary:
status: OPTIMAL
objective: 1222
best_bound: 1222
integers: 470
booleans: 107
conflicts: 0
branches: 214
propagations: 30
integer_propagations: 8439
restarts: 214
lp_iterations: 217
walltime: 1330.19
usertime: 1330.19
deterministic_time: 14617.9
gap_integral: 47331.5
solution_fingerprint: 0x438134f75c95bf1a


--- Simulation Gantt  partir du modle mathmatique ---
