created virtual environment CPython3.12.4.final.0-64 in 6246ms
  creator CPython3Posix(dest=/localscratch/aneumann.63393193.0/env, clear=False, no_vcs_ignore=False, global=False)
  seeder FromAppData(download=False, pip=bundle, via=copy, app_data_dir=/home/aneumann/.local/share/virtualenv)
    added seed packages: pip==25.1.1
  activators BashActivator,CShellActivator,FishActivator,NushellActivator,PowerShellActivator,PythonActivator
Looking in links: /cvmfs/soft.computecanada.ca/custom/python/wheelhouse/gentoo2023/x86-64-v3, /cvmfs/soft.computecanada.ca/custom/python/wheelhouse/gentoo2023/generic, /cvmfs/soft.computecanada.ca/custom/python/wheelhouse/generic
Requirement already satisfied: pip in /localscratch/aneumann.63393193.0/env/lib/python3.12/site-packages (25.1.1)
Looking in links: /cvmfs/soft.computecanada.ca/custom/python/wheelhouse/gentoo2023/x86-64-v3, /cvmfs/soft.computecanada.ca/custom/python/wheelhouse/gentoo2023/generic, /cvmfs/soft.computecanada.ca/custom/python/wheelhouse/generic
ERROR: protobuf-5.28.3-cp38-abi3-manylinux2014_x86_64.whl is not a supported wheel on this platform.
Looking in links: /cvmfs/soft.computecanada.ca/custom/python/wheelhouse/gentoo2023/x86-64-v3, /cvmfs/soft.computecanada.ca/custom/python/wheelhouse/gentoo2023/generic, /cvmfs/soft.computecanada.ca/custom/python/wheelhouse/generic
Processing /home/aneumann/projects/def-adhaj/aneumann/GNRS/wheels/immutabledict-4.2.0-py3-none-any.whl
Installing collected packages: immutabledict
Successfully installed immutabledict-4.2.0
Looking in links: /cvmfs/soft.computecanada.ca/custom/python/wheelhouse/gentoo2023/x86-64-v3, /cvmfs/soft.computecanada.ca/custom/python/wheelhouse/gentoo2023/generic, /cvmfs/soft.computecanada.ca/custom/python/wheelhouse/generic
Processing /cvmfs/soft.computecanada.ca/custom/python/wheelhouse/generic/ortools-9.10.4067+computecanada-cp312-cp312-linux_x86_64.whl (from -r /home/aneumann/projects/def-adhaj/aneumann/GNRS/requirements/or.txt (line 1))
Processing /cvmfs/soft.computecanada.ca/custom/python/wheelhouse/gentoo2023/x86-64-v3/matplotlib-3.10.0+computecanada-cp312-cp312-linux_x86_64.whl (from -r /home/aneumann/projects/def-adhaj/aneumann/GNRS/requirements/or.txt (line 2))
Processing /cvmfs/soft.computecanada.ca/custom/python/wheelhouse/gentoo2023/x86-64-v3/pandas-2.2.3+computecanada-cp312-cp312-linux_x86_64.whl (from -r /home/aneumann/projects/def-adhaj/aneumann/GNRS/requirements/or.txt (line 3))
Processing /cvmfs/soft.computecanada.ca/custom/python/wheelhouse/generic/absl_py-2.2.2+computecanada-py3-none-any.whl (from ortools<9.11,>=9.10->-r /home/aneumann/projects/def-adhaj/aneumann/GNRS/requirements/or.txt (line 1))
Processing /cvmfs/soft.computecanada.ca/custom/python/wheelhouse/gentoo2023/generic/numpy-2.2.2+computecanada-cp312-cp312-linux_x86_64.whl (from ortools<9.11,>=9.10->-r /home/aneumann/projects/def-adhaj/aneumann/GNRS/requirements/or.txt (line 1))
Processing /cvmfs/soft.computecanada.ca/custom/python/wheelhouse/gentoo2023/x86-64-v3/protobuf-6.30.2+computecanada-cp312-cp312-linux_x86_64.whl (from ortools<9.11,>=9.10->-r /home/aneumann/projects/def-adhaj/aneumann/GNRS/requirements/or.txt (line 1))
Requirement already satisfied: immutabledict>=3.0.0 in /localscratch/aneumann.63393193.0/env/lib/python3.12/site-packages (from ortools<9.11,>=9.10->-r /home/aneumann/projects/def-adhaj/aneumann/GNRS/requirements/or.txt (line 1)) (4.2.0)
Processing /cvmfs/soft.computecanada.ca/custom/python/wheelhouse/gentoo2023/generic/contourpy-1.3.1+computecanada-cp312-cp312-linux_x86_64.whl (from matplotlib->-r /home/aneumann/projects/def-adhaj/aneumann/GNRS/requirements/or.txt (line 2))
Processing /cvmfs/soft.computecanada.ca/custom/python/wheelhouse/generic/cycler-0.12.1+computecanada-py3-none-any.whl (from matplotlib->-r /home/aneumann/projects/def-adhaj/aneumann/GNRS/requirements/or.txt (line 2))
Processing /cvmfs/soft.computecanada.ca/custom/python/wheelhouse/generic/fonttools-4.58.2+computecanada-cp312-cp312-linux_x86_64.whl (from matplotlib->-r /home/aneumann/projects/def-adhaj/aneumann/GNRS/requirements/or.txt (line 2))
Processing /cvmfs/soft.computecanada.ca/custom/python/wheelhouse/gentoo2023/x86-64-v3/kiwisolver-1.4.8+computecanada-cp312-cp312-linux_x86_64.whl (from matplotlib->-r /home/aneumann/projects/def-adhaj/aneumann/GNRS/requirements/or.txt (line 2))
Processing /cvmfs/soft.computecanada.ca/custom/python/wheelhouse/generic/packaging-25.0+computecanada-py3-none-any.whl (from matplotlib->-r /home/aneumann/projects/def-adhaj/aneumann/GNRS/requirements/or.txt (line 2))
Processing /cvmfs/soft.computecanada.ca/custom/python/wheelhouse/gentoo2023/x86-64-v3/pillow-11.1.0+computecanada-cp312-cp312-linux_x86_64.whl (from matplotlib->-r /home/aneumann/projects/def-adhaj/aneumann/GNRS/requirements/or.txt (line 2))
Processing /cvmfs/soft.computecanada.ca/custom/python/wheelhouse/generic/pyparsing-3.2.1+computecanada-py3-none-any.whl (from matplotlib->-r /home/aneumann/projects/def-adhaj/aneumann/GNRS/requirements/or.txt (line 2))
Processing /cvmfs/soft.computecanada.ca/custom/python/wheelhouse/generic/python_dateutil-2.9.0.post0+computecanada-py2.py3-none-any.whl (from matplotlib->-r /home/aneumann/projects/def-adhaj/aneumann/GNRS/requirements/or.txt (line 2))
Processing /cvmfs/soft.computecanada.ca/custom/python/wheelhouse/generic/pytz-2025.2+computecanada-py2.py3-none-any.whl (from pandas->-r /home/aneumann/projects/def-adhaj/aneumann/GNRS/requirements/or.txt (line 3))
Processing /cvmfs/soft.computecanada.ca/custom/python/wheelhouse/generic/tzdata-2025.2+computecanada-py2.py3-none-any.whl (from pandas->-r /home/aneumann/projects/def-adhaj/aneumann/GNRS/requirements/or.txt (line 3))
Processing /cvmfs/soft.computecanada.ca/custom/python/wheelhouse/generic/six-1.17.0+computecanada-py2.py3-none-any.whl (from python-dateutil>=2.7->matplotlib->-r /home/aneumann/projects/def-adhaj/aneumann/GNRS/requirements/or.txt (line 2))
Installing collected packages: pytz, tzdata, six, pyparsing, protobuf, pillow, packaging, numpy, kiwisolver, fonttools, cycler, absl-py, python-dateutil, contourpy, pandas, matplotlib, ortools

Successfully installed absl-py-2.2.2+computecanada contourpy-1.3.1+computecanada cycler-0.12.1+computecanada fonttools-4.58.2+computecanada kiwisolver-1.4.8+computecanada matplotlib-3.10.0+computecanada numpy-2.2.2+computecanada ortools-9.10.4067+computecanada packaging-25.0+computecanada pandas-2.2.3+computecanada pillow-11.1.0+computecanada protobuf-6.30.2+computecanada pyparsing-3.2.1+computecanada python-dateutil-2.9.0.post0+computecanada pytz-2025.2+computecanada six-1.17.0+computecanada tzdata-2025.2+computecanada

Starting CP-SAT solver v9.10.4067
Parameters: max_time_in_seconds: 3600 max_memory_in_mb: 12000 log_search_progress: true enumerate_all_solutions: false absolute_gap_limit: 0 relative_gap_limit: 0
Setting number of workers to 48

Initial optimization model '': (model_fingerprint: 0xf48cea3abe48ea7b)
#Variables: 325 (#ints: 8 in objective)
  - 234 Booleans in [0,1]
  - 91 in [0,665]
#kLinear1: 43
#kLinear2: 557
#kLinear3: 157
#kLinearN: 2'801 (#terms: 36'791)

Starting presolve at 0.00s
  2.11e-03s  0.00e+00d  [DetectDominanceRelations] 
  4.57e-02s  0.00e+00d  [PresolveToFixPoint] #num_loops=6 #num_dual_strengthening=3 
  3.35e-05s  0.00e+00d  [ExtractEncodingFromLinear] #potential_supersets=6 
[Symmetry] Graph for symmetry has 3'589 nodes and 30'095 arcs.
[Symmetry] Symmetry computation done. time: 0.00287232 dtime: 0.00332014
[Symmetry] #generators: 1, average support size: 26
[Symmetry] The model contains 337 duplicate constraints !
[Symmetry] 13 orbits with sizes: 2,2,2,2,2,2,2,2,2,2,...
[Symmetry] Num fixable by intersecting at_most_one with orbits: 1 largest_orbit: 2
  1.24e-02s  1.79e-03d  [Probe] #probed=356 #fixed_bools=5 #new_bounds=16 #equiv=1 
  5.62e-05s  0.00e+00d  [MaxClique] Merged 27(54 literals) into 11(22 literals) at_most_ones. 
  2.07e-03s  0.00e+00d  [DetectDominanceRelations] 
  2.37e-02s  0.00e+00d  [PresolveToFixPoint] #num_loops=4 #num_dual_strengthening=3 
  8.03e-03s  0.00e+00d  [ProcessAtMostOneAndLinear] 
  3.26e-03s  0.00e+00d  [DetectDuplicateConstraints] #duplicates=408 #without_enforcements=196 
  2.38e-03s  1.05e-04d  [DetectDominatedLinearConstraints] #relevant_constraints=2'255 #num_inclusions=1'608 #num_redundant=2 
  3.86e-04s  0.00e+00d  [DetectDifferentVariables] #different=45 
  6.74e-04s  3.67e-05d  [ProcessSetPPC] #relevant_constraints=1'789 
  2.76e-05s  0.00e+00d  [FindAlmostIdenticalLinearConstraints] 
  3.74e-04s  3.49e-04d  [FindBigAtMostOneAndLinearOverlap] 
  8.96e-03s  2.43e-03d  [FindBigVerticalLinearOverlap] #blocks=61 #saved_nz=5'771 
  3.48e-04s  7.87e-05d  [FindBigHorizontalLinearOverlap] #linears=1'663 
  1.59e-05s  0.00e+00d  [MergeClauses] 
  2.15e-03s  0.00e+00d  [DetectDominanceRelations] 
  2.88e-02s  0.00e+00d  [PresolveToFixPoint] #num_loops=2 #num_dual_strengthening=1 
  2.15e-03s  0.00e+00d  [DetectDominanceRelations] 
  1.60e-02s  0.00e+00d  [PresolveToFixPoint] #num_loops=1 #num_dual_strengthening=1 
[Symmetry] Graph for symmetry has 3'329 nodes and 22'814 arcs.
[Symmetry] Symmetry computation done. time: 0.000987946 dtime: 0.00138277
  1.23e-02s  1.70e-03d  [Probe] #probed=346 #new_bounds=60 
  1.50e-05s  0.00e+00d  [MaxClique] 
  2.11e-03s  0.00e+00d  [DetectDominanceRelations] 
  2.94e-02s  0.00e+00d  [PresolveToFixPoint] #num_loops=4 #num_dual_strengthening=3 
  6.13e-03s  0.00e+00d  [ProcessAtMostOneAndLinear] 
  2.77e-03s  0.00e+00d  [DetectDuplicateConstraints] #without_enforcements=227 
  1.17e-03s  4.99e-05d  [DetectDominatedLinearConstraints] #relevant_constraints=1'817 #num_inclusions=21 
  3.93e-04s  0.00e+00d  [DetectDifferentVariables] #different=54 #cliques=2 #size=6 
  5.42e-04s  2.28e-05d  [ProcessSetPPC] #relevant_constraints=1'507 
  4.19e-05s  2.25e-07d  [FindAlmostIdenticalLinearConstraints] #num_tested_pairs=13 
  2.52e-04s  1.78e-04d  [FindBigAtMostOneAndLinearOverlap] 
  4.94e-03s  1.52e-03d  [FindBigVerticalLinearOverlap] #blocks=54 #saved_nz=3'507 
  2.59e-04s  4.84e-05d  [FindBigHorizontalLinearOverlap] #linears=1'238 
  1.56e-05s  0.00e+00d  [MergeClauses] 
  1.85e-03s  0.00e+00d  [DetectDominanceRelations] 
  2.50e-02s  0.00e+00d  [PresolveToFixPoint] #num_loops=3 #num_dual_strengthening=1 
  1.85e-03s  0.00e+00d  [DetectDominanceRelations] 
  1.67e-02s  0.00e+00d  [PresolveToFixPoint] #num_loops=1 #num_dual_strengthening=1 
  1.17e-02s  1.56e-03d  [Probe] #probed=346 #new_bounds=37 
  1.54e-05s  0.00e+00d  [MaxClique] 
  1.85e-03s  0.00e+00d  [DetectDominanceRelations] 
  2.27e-02s  0.00e+00d  [PresolveToFixPoint] #num_loops=2 #num_dual_strengthening=1 
  5.67e-03s  0.00e+00d  [ProcessAtMostOneAndLinear] 
  2.66e-03s  0.00e+00d  [DetectDuplicateConstraints] #without_enforcements=227 
  1.02e-03s  3.84e-05d  [DetectDominatedLinearConstraints] #relevant_constraints=1'833 #num_inclusions=21 
  2.67e-04s  0.00e+00d  [DetectDifferentVariables] 
  4.19e-04s  1.42e-05d  [ProcessSetPPC] #relevant_constraints=1'234 
  5.69e-05s  9.95e-07d  [FindAlmostIdenticalLinearConstraints] #num_tested_pairs=41 
  2.15e-04s  1.19e-04d  [FindBigAtMostOneAndLinearOverlap] 
  2.99e-03s  1.04e-03d  [FindBigVerticalLinearOverlap] #blocks=21 #saved_nz=1'134 
  2.21e-04s  3.80e-05d  [FindBigHorizontalLinearOverlap] #linears=1'031 
  1.56e-05s  0.00e+00d  [MergeClauses] 
  1.74e-03s  0.00e+00d  [DetectDominanceRelations] 
  1.88e-02s  0.00e+00d  [PresolveToFixPoint] #num_loops=2 #num_dual_strengthening=1 
  1.09e-04s  0.00e+00d  [ExpandObjective] #entries=623 #tight_variables=191 #tight_constraints=112 

Presolve summary:
  - 72 affine relations were detected.
  - rule 'TODO dual: only one blocking constraint?' was applied 854 times.
  - rule 'TODO dual: only one unspecified blocking constraint?' was applied 120 times.
  - rule 'TODO duplicate: identical constraint with different enforcements' was applied 650 times.
  - rule 'TODO no_overlap: with task always last' was applied 2 times.
  - rule 'affine: new relation' was applied 72 times.
  - rule 'all_diff: inferred from x != y constraints' was applied 2 times.
  - rule 'at_most_one: removed literals' was applied 11 times.
  - rule 'at_most_one: size one' was applied 11 times.
  - rule 'at_most_one: transformed into max clique.' was applied 1 time.
  - rule 'deductions: 299 stored' was applied 1 time.
  - rule 'dual: fix variable' was applied 21 times.
  - rule 'dual: reduced domain' was applied 54 times.
  - rule 'duplicate: merged rhs of linear constraint' was applied 75 times.
  - rule 'duplicate: removed constraint' was applied 408 times.
  - rule 'enforcement: false literal' was applied 24 times.
  - rule 'enforcement: true literal' was applied 23 times.
  - rule 'exactly_one: x and not(x)' was applied 1 time.
  - rule 'incompatible linear: add implication' was applied 63 times.
  - rule 'linear inclusion: redundant containing constraint' was applied 2 times.
  - rule 'linear matrix: common vertical rectangle' was applied 136 times.
  - rule 'linear: always true' was applied 486 times.
  - rule 'linear: doubleton free' was applied 12 times.
  - rule 'linear: empty' was applied 26 times.
  - rule 'linear: extracted enforcement literal' was applied 6'137 times.
  - rule 'linear: fixed or dup variables' was applied 2'859 times.
  - rule 'linear: positive equal one' was applied 6 times.
  - rule 'linear: reduced variable domains' was applied 248 times.
  - rule 'linear: remapped using affine relations' was applied 2'770 times.
  - rule 'linear: simplified rhs' was applied 10'738 times.
  - rule 'linear: variable substitution 1' was applied 12 times.
  - rule 'linear: variable substitution 2' was applied 6 times.
  - rule 'linear: variable substitution 3' was applied 1 time.
  - rule 'presolve: 85 unused variables removed.' was applied 1 time.
  - rule 'presolve: iteration' was applied 3 times.
  - rule 'probing: reduced enforced constraint to implication.' was applied 27 times.
  - rule 'symmetry: fixed to false in general orbit' was applied 1 time.

Presolved optimization model '': (model_fingerprint: 0x36c2e2e3fbb25183)
#Variables: 285 (#ints: 8 in objective)
  - 89 Booleans in [0,1]
  - 154 different domains in [-5242,5794] with a largest complexity of 11.
#kAllDiff: 2
#kExactlyOne: 5 (#literals: 15)
#kLinear2: 858 (#enforced: 794 #multi: 642)
#kLinear3: 215 (#enforced: 146)
#kLinearN: 1'552 (#enforced: 1'378) (#terms: 9'698)

Preloading model.
#Bound   0.34s best:inf   next:[166,4507] initial_domain
#Model   0.34s var:285/285 constraints:2632/2632

Starting search at 0.34s with 48 workers.
16 full problem subsolvers: [core, default_lp, lb_tree_search, max_lp, no_lp, objective_lb_search, objective_lb_search_max_lp, objective_lb_search_no_lp, objective_shaving_search_max_lp, objective_shaving_search_no_lp, probing, probing_max_lp, pseudo_costs, quick_restart, quick_restart_no_lp, reduced_costs]
30 first solution subsolvers: [fj_long_default(2), fj_long_lin_default, fj_long_lin_perturb, fj_long_lin_random, fj_long_perturb, fj_long_random, fj_short_default(2), fj_short_lin_default(2), fj_short_lin_perturb, fj_short_lin_random, fj_short_perturb, fj_short_random, fs_random(4), fs_random_no_lp(4), fs_random_quick_restart(4), fs_random_quick_restart_no_lp(3)]
13 incomplete subsolvers: [feasibility_pump, graph_arc_lns, graph_cst_lns, graph_dec_lns, graph_var_lns, rins/rens, rnd_cst_lns, rnd_var_lns, violation_ls(5)]
3 helper subsolvers: [neighborhood_helper, synchronization_agent, update_gap_integral]
#Bound   0.39s best:inf   next:[207,4507] objective_lb_search_no_lp
#Bound   0.40s best:inf   next:[262,4507] objective_lb_search_no_lp
#Bound   0.40s best:inf   next:[263,4507] objective_lb_search_no_lp
#Bound   0.40s best:inf   next:[277,4507] objective_lb_search_no_lp
#1       0.40s best:2075  next:[277,2074] no_lp (fixed_bools=0/112)
#Bound   0.40s best:2075  next:[281,2074] objective_lb_search_no_lp
#2       0.42s best:2074  next:[281,2073] violation_ls(batch:1 #solutions_imported:1 #lin_moves:521 #lin_evals:1'645 #weight_updates:143)
#3       0.42s best:1451  next:[281,1450] no_lp (fixed_bools=0/135)
#Bound   0.42s best:1451  next:[455,1450] objective_lb_search_no_lp
#4       0.42s best:1436  next:[455,1435] no_lp (fixed_bools=0/138)
#5       0.43s best:1385  next:[455,1384] no_lp (fixed_bools=0/142)
#6       0.43s best:1369  next:[455,1368] no_lp (fixed_bools=0/147)
#Bound   0.44s best:1369  next:[479,1368] objective_lb_search_no_lp
#7       0.48s best:1366  next:[479,1365] quick_restart_no_lp (fixed_bools=0/137)
#8       0.51s best:1358  next:[479,1357] graph_var_lns (d=0.88 s=110 t=0.10 p=1.00 stall=3 h=auto_l0)
#9       0.52s best:1357  next:[479,1356] violation_ls(batch:2 #solutions_imported:2 #lin_moves:0 #lin_evals:17'740 #gen_moves:8'221 #gen_evals:1'310 #comp_moves:854 #backtracks:3'678 #weight_updates:84)
#10      0.52s best:1356  next:[479,1355] violation_ls(batch:3 #solutions_imported:3 #lin_moves:1 #lin_evals:17'748 #gen_moves:8'221 #gen_evals:1'310 #comp_moves:854 #backtracks:3'678 #weight_updates:84)
#11      0.52s best:1355  next:[479,1354] violation_ls(batch:3 #solutions_imported:3 #lin_moves:9'861 #lin_evals:40'486 #gen_moves:719 #gen_evals:170 #comp_moves:39 #backtracks:340 #weight_updates:513)
#12      0.52s best:1354  next:[479,1353] violation_ls(batch:4 #solutions_imported:4 #lin_moves:9'861 #lin_evals:40'490 #gen_moves:720 #gen_evals:170 #comp_moves:40 #backtracks:340 #weight_updates:513)
#13      0.53s best:1316  next:[479,1315] no_lp (fixed_bools=0/174)
#14      0.55s best:1314  next:[479,1313] no_lp (fixed_bools=0/179)
#15      0.55s best:1306  next:[479,1305] no_lp (fixed_bools=0/183)
#16      0.57s best:1205  next:[479,1204] no_lp (fixed_bools=0/191)
#Bound   0.74s best:1205  next:[487,1204] objective_lb_search_no_lp
#Bound   0.74s best:1205  next:[488,1204] objective_lb_search_no_lp
#Bound   0.76s best:1205  next:[538,1204] objective_lb_search_no_lp
#Bound   0.85s best:1205  next:[561,1204] objective_lb_search_no_lp
#17      1.04s best:1186  next:[561,1185] no_lp (fixed_bools=0/238)
#18      1.13s best:1156  next:[561,1155] no_lp (fixed_bools=0/254)
#Bound   1.16s best:1156  next:[562,1155] objective_lb_search_no_lp
#Bound   1.53s best:1156  next:[563,1155] objective_lb_search_no_lp
#Bound   1.63s best:1156  next:[578,1155] objective_lb_search_no_lp
#19      1.75s best:1141  next:[578,1140] no_lp (fixed_bools=0/270)
#Bound   1.78s best:1141  next:[581,1140] objective_lb_search_no_lp
#20      1.83s best:1137  next:[581,1136] no_lp (fixed_bools=0/298)
#21      2.19s best:1121  next:[581,1120] no_lp (fixed_bools=0/321)
#Bound   2.20s best:1121  next:[589,1120] objective_lb_search_no_lp
#Bound   2.37s best:1121  next:[604,1120] objective_lb_search_no_lp
#Bound   2.66s best:1121  next:[606,1120] objective_lb_search_no_lp
#22      2.95s best:1097  next:[606,1096] rnd_var_lns (d=0.99 s=337 t=0.10 p=0.83 stall=1 h=auto_l0)
#Bound   3.07s best:1097  next:[607,1096] objective_lb_search_no_lp
#Bound   3.88s best:1097  next:[611,1096] objective_lb_search_no_lp
#Bound   4.07s best:1097  next:[612,1096] objective_lb_search_no_lp
#Bound   5.00s best:1097  next:[615,1096] objective_lb_search_no_lp
#Bound   5.22s best:1097  next:[616,1096] objective_lb_search_no_lp
#Bound   5.83s best:1097  next:[618,1096] objective_lb_search_no_lp
#Bound   7.42s best:1097  next:[620,1096] objective_lb_search
#Bound   8.38s best:1097  next:[621,1096] objective_shaving_search_no_lp (vars=293 csts=2507)
#Bound   8.89s best:1097  next:[627,1096] objective_lb_search_no_lp
#Bound   9.16s best:1097  next:[632,1096] objective_lb_search_no_lp
#Bound   9.47s best:1097  next:[638,1096] objective_lb_search_no_lp
#Bound  10.21s best:1097  next:[642,1096] objective_lb_search_no_lp
#Bound  10.82s best:1097  next:[646,1096] objective_lb_search_no_lp [skipped_logs=3]
#Bound  12.17s best:1097  next:[648,1096] objective_lb_search_no_lp
#Bound  12.96s best:1097  next:[653,1096] objective_lb_search_no_lp [skipped_logs=2]
#Bound  13.71s best:1097  next:[659,1096] objective_lb_search_no_lp [skipped_logs=1]
#Bound  14.61s best:1097  next:[661,1096] objective_lb_search_no_lp [skipped_logs=0]
#Bound  15.49s best:1097  next:[663,1096] objective_lb_search_no_lp [skipped_logs=0]
#Bound  17.93s best:1097  next:[664,1096] objective_lb_search_max_lp
#Bound  19.57s best:1097  next:[665,1096] objective_lb_search_no_lp
#Bound  19.79s best:1097  next:[666,1096] objective_lb_search_max_lp
#Bound  21.24s best:1097  next:[668,1096] objective_lb_search_no_lp
#Bound  21.82s best:1097  next:[669,1096] objective_lb_search_no_lp
#Bound  23.27s best:1097  next:[671,1096] objective_lb_search_no_lp
#Bound  23.27s best:1097  next:[673,1096] objective_lb_search_no_lp
#Bound  23.29s best:1097  next:[698,1096] objective_lb_search_no_lp [skipped_logs=1]
#Bound  26.77s best:1097  next:[706,1096] objective_lb_search
#Bound  30.28s best:1097  next:[707,1096] objective_shaving_search_no_lp (vars=292 csts=2506)
#Bound  31.53s best:1097  next:[713,1096] objective_lb_search_no_lp
#Bound  33.78s best:1097  next:[715,1096] objective_lb_search_no_lp
#Bound  34.31s best:1097  next:[717,1096] objective_lb_search_no_lp
#Bound  35.27s best:1097  next:[718,1096] objective_lb_search_no_lp
#Bound  35.39s best:1097  next:[720,1096] objective_lb_search_no_lp
#Bound  35.71s best:1097  next:[723,1096] objective_lb_search_no_lp
#Bound  35.88s best:1097  next:[724,1096] objective_lb_search_no_lp
#Bound  38.19s best:1097  next:[726,1096] objective_lb_search_no_lp
#Bound  46.28s best:1097  next:[727,1096] objective_shaving_search_no_lp (vars=297 csts=2511)
#Bound  48.56s best:1097  next:[728,1096] objective_lb_search_no_lp
#Bound  50.90s best:1097  next:[729,1096] objective_lb_search_no_lp
#Bound  55.45s best:1097  next:[730,1096] objective_lb_search_no_lp
#Bound  57.55s best:1097  next:[732,1096] objective_lb_search_no_lp
#Bound  60.77s best:1097  next:[733,1096] objective_lb_search_no_lp
#Bound  62.95s best:1097  next:[736,1096] objective_lb_search_no_lp
#Bound  64.80s best:1097  next:[737,1096] objective_lb_search_no_lp
#Bound  66.34s best:1097  next:[741,1096] objective_lb_search_no_lp
#Bound  69.90s best:1097  next:[742,1096] objective_lb_search_no_lp
#Bound  70.47s best:1097  next:[744,1096] objective_lb_search_no_lp
#Bound  72.28s best:1097  next:[747,1096] objective_lb_search_no_lp
#Bound  73.38s best:1097  next:[748,1096] objective_lb_search_no_lp
#Bound  74.06s best:1097  next:[750,1096] objective_lb_search_no_lp
#Bound  74.78s best:1097  next:[751,1096] objective_lb_search_no_lp
#Bound  75.70s best:1097  next:[753,1096] objective_lb_search_no_lp
#Bound  76.55s best:1097  next:[755,1096] objective_lb_search_no_lp
#Bound  78.80s best:1097  next:[756,1096] objective_lb_search_no_lp
#Bound  82.19s best:1097  next:[757,1096] objective_lb_search_no_lp
#Bound  92.58s best:1097  next:[772,1096] objective_lb_search_no_lp
#Bound  96.61s best:1097  next:[773,1096] objective_lb_search_no_lp
#Bound  98.45s best:1097  next:[775,1096] objective_lb_search_no_lp
#Bound  99.49s best:1097  next:[776,1096] objective_lb_search_no_lp
#Bound 100.32s best:1097  next:[778,1096] objective_lb_search_no_lp
#Bound 102.71s best:1097  next:[780,1096] objective_lb_search_no_lp
#Bound 107.02s best:1097  next:[781,1096] objective_lb_search_no_lp
#Bound 116.79s best:1097  next:[782,1096] objective_lb_search_no_lp
#Bound 123.06s best:1097  next:[783,1096] objective_lb_search_no_lp
#Bound 126.42s best:1097  next:[784,1096] objective_lb_search_no_lp
#Bound 142.61s best:1097  next:[785,1096] objective_shaving_search_no_lp (vars=302 csts=2574)
#Bound 148.21s best:1097  next:[787,1096] objective_lb_search_no_lp
#Bound 150.52s best:1097  next:[788,1096] objective_lb_search_no_lp
#Bound 154.59s best:1097  next:[789,1096] objective_lb_search_no_lp
#Bound 162.65s best:1097  next:[790,1096] objective_lb_search_no_lp
#Bound 169.01s best:1097  next:[791,1096] objective_lb_search_no_lp
#Bound 178.56s best:1097  next:[792,1096] objective_lb_search_no_lp
#Bound 181.43s best:1097  next:[793,1096] objective_lb_search_no_lp
#Bound 185.83s best:1097  next:[794,1096] objective_lb_search_no_lp
#Bound 195.55s best:1097  next:[795,1096] objective_lb_search_no_lp
#Bound 218.27s best:1097  next:[808,1096] objective_lb_search_no_lp
#Bound 218.31s best:1097  next:[809,1096] objective_lb_search_no_lp
#Bound 218.42s best:1097  next:[823,1096] objective_lb_search_no_lp
#Bound 219.27s best:1097  next:[825,1096] objective_lb_search_no_lp
#Bound 252.02s best:1097  next:[826,1096] objective_shaving_search_max_lp (vars=301 csts=2515)
#Bound 254.12s best:1097  next:[827,1096] objective_lb_search_no_lp
#Bound 268.20s best:1097  next:[828,1096] objective_lb_search_no_lp
#Bound 271.64s best:1097  next:[829,1096] objective_lb_search_no_lp
#Bound 278.98s best:1097  next:[830,1096] objective_lb_search_no_lp
#Bound 283.49s best:1097  next:[831,1096] objective_lb_search_no_lp
#Bound 292.11s best:1097  next:[832,1096] objective_lb_search_no_lp
#Bound 295.90s best:1097  next:[833,1096] objective_lb_search_no_lp
#Bound 306.47s best:1097  next:[834,1096] objective_lb_search_no_lp
#Bound 312.48s best:1097  next:[835,1096] objective_lb_search_no_lp
#Bound 318.25s best:1097  next:[836,1096] objective_lb_search_no_lp
#Bound 328.76s best:1097  next:[837,1096] objective_lb_search_no_lp
#Bound 332.47s best:1097  next:[838,1096] objective_lb_search_no_lp
#Model 349.19s var:284/285 constraints:2478/2632
#Bound 353.44s best:1097  next:[840,1096] objective_lb_search_no_lp
#Bound 357.32s best:1097  next:[842,1096] objective_lb_search_no_lp
#Bound 369.01s best:1097  next:[843,1096] objective_lb_search_no_lp
#Bound 372.00s best:1097  next:[845,1096] objective_lb_search_no_lp
#Bound 374.95s best:1097  next:[847,1096] objective_lb_search_no_lp
#Bound 380.25s best:1097  next:[849,1096] objective_lb_search_no_lp
#Bound 383.33s best:1097  next:[850,1096] objective_lb_search_no_lp
#Bound 388.16s best:1097  next:[851,1096] objective_lb_search_no_lp
#Bound 390.79s best:1097  next:[852,1096] objective_lb_search_no_lp
#Bound 393.26s best:1097  next:[853,1096] objective_lb_search_no_lp
#Bound 395.44s best:1097  next:[854,1096] objective_lb_search_no_lp
#Bound 415.02s best:1097  next:[855,1096] objective_lb_search_no_lp
#Bound 420.89s best:1097  next:[856,1096] objective_lb_search_no_lp
#Bound 423.51s best:1097  next:[857,1096] objective_lb_search_no_lp
#Bound 433.40s best:1097  next:[858,1096] objective_lb_search_no_lp
#Bound 445.09s best:1097  next:[865,1096] objective_lb_search_no_lp
#Bound 453.86s best:1097  next:[882,1096] objective_lb_search_no_lp
#Bound 460.62s best:1097  next:[883,1096] objective_lb_search_no_lp
#Model 461.70s var:283/285 constraints:2466/2632
#Bound 466.35s best:1097  next:[885,1096] objective_lb_search_no_lp
#Bound 472.27s best:1097  next:[889,1096] objective_lb_search_no_lp
#Bound 480.12s best:1097  next:[890,1096] objective_lb_search_no_lp
#Model 480.21s var:282/285 constraints:2447/2632
#Model 481.50s var:281/285 constraints:2437/2632
#Bound 482.15s best:1097  next:[891,1096] objective_lb_search_no_lp
#Bound 483.35s best:1097  next:[895,1096] objective_lb_search_no_lp
#Bound 486.08s best:1097  next:[896,1096] objective_lb_search_no_lp
#Bound 487.61s best:1097  next:[898,1096] objective_lb_search_no_lp
#Bound 489.12s best:1097  next:[901,1096] objective_lb_search_no_lp
#Bound 490.10s best:1097  next:[902,1096] objective_lb_search_no_lp
#Model 490.25s var:280/285 constraints:2364/2632
#Bound 492.48s best:1097  next:[908,1096] objective_lb_search_no_lp
#Bound 493.67s best:1097  next:[911,1096] objective_lb_search_no_lp
#Bound 494.38s best:1097  next:[914,1096] objective_lb_search_no_lp
#Bound 495.97s best:1097  next:[916,1096] objective_lb_search_no_lp
#Model 502.09s var:279/285 constraints:2353/2632
#Model 503.61s var:278/285 constraints:2336/2632
#Model 503.80s var:277/285 constraints:2318/2632
#Bound 504.49s best:1097  next:[917,1096] objective_lb_search_no_lp
#Bound 505.95s best:1097  next:[918,1096] objective_lb_search_max_lp
#Bound 506.25s best:1097  next:[943,1096] objective_lb_search_no_lp
#Model 506.47s var:271/285 constraints:2091/2632
#Bound 507.77s best:1097  next:[944,1096] objective_lb_search_no_lp
#Bound 509.29s best:1097  next:[958,1096] objective_lb_search_no_lp
#Bound 510.01s best:1097  next:[960,1096] objective_lb_search_no_lp
#Bound 510.66s best:1097  next:[961,1096] objective_lb_search_no_lp
#Bound 511.45s best:1097  next:[965,1096] objective_lb_search_no_lp
#Bound 512.26s best:1097  next:[966,1096] objective_lb_search_no_lp
#Bound 512.74s best:1097  next:[970,1096] objective_lb_search_no_lp
#Model 512.92s var:268/285 constraints:1887/2632
#Bound 513.35s best:1097  next:[988,1096] objective_lb_search_no_lp
#Model 513.58s var:266/285 constraints:1824/2632
#Model 513.63s var:265/285 constraints:1802/2632
#Bound 513.83s best:1097  next:[990,1096] objective_lb_search_no_lp
#Bound 514.28s best:1097  next:[1004,1096] objective_lb_search_no_lp
#Model 514.40s var:258/285 constraints:1503/2632
#Model 514.46s var:257/285 constraints:1485/2632
#Bound 514.97s best:1097  next:[1010,1096] objective_lb_search_no_lp
#Model 515.03s var:256/285 constraints:1410/2632
#Bound 515.38s best:1097  next:[1017,1096] objective_lb_search_no_lp
#Model 515.46s var:254/285 constraints:1318/2632
#Bound 515.58s best:1097  next:[1043,1096] objective_lb_search_no_lp
#Model 515.73s var:251/285 constraints:1192/2632
#Bound 515.78s best:1097  next:[1060,1096] objective_lb_search_no_lp
#Model 515.85s var:248/285 constraints:1079/2632
#Model 515.91s var:246/285 constraints:980/2632
#Model 515.91s var:241/285 constraints:870/2632
#Model 515.92s var:237/285 constraints:695/2632
#Bound 515.96s best:1097  next:[1063,1096] objective_lb_search_no_lp
#Model 515.97s var:236/285 constraints:690/2632
#Done  515.97s reduced_costs
#Done  515.97s core
#Done  515.97s quick_restart_no_lp

Task timing                                  n [     min,      max]      avg      dev     time         n [     min,      max]      avg      dev    dtime
                             'core':         1 [   8.59m,    8.59m]    8.59m   0.00ns    8.59m         1 [   6.24m,    6.24m]    6.24m   0.00ns    6.24m
                       'default_lp':         1 [   8.59m,    8.59m]    8.59m   0.00ns    8.59m         1 [   1.27m,    1.27m]    1.27m   0.00ns    1.27m
                 'feasibility_pump':      1646 [ 35.50ms, 727.63ms] 245.96ms 102.07ms    6.75m      1645 [ 13.34ms,  48.04ms]  19.20ms 753.71us   31.59s
                  'fj_long_default':         1 [ 62.44ms,  62.44ms]  62.44ms   0.00ns  62.44ms         1 [ 19.51ms,  19.51ms]  19.51ms   0.00ns  19.51ms
                  'fj_long_default':         1 [ 75.63ms,  75.63ms]  75.63ms   0.00ns  75.63ms         1 [ 25.91ms,  25.91ms]  25.91ms   0.00ns  25.91ms
              'fj_long_lin_default':         1 [ 97.88ms,  97.88ms]  97.88ms   0.00ns  97.88ms         1 [ 71.53ms,  71.53ms]  71.53ms   0.00ns  71.53ms
              'fj_long_lin_perturb':         1 [ 71.96ms,  71.96ms]  71.96ms   0.00ns  71.96ms         1 [ 26.67ms,  26.67ms]  26.67ms   0.00ns  26.67ms
               'fj_long_lin_random':         1 [ 74.06ms,  74.06ms]  74.06ms   0.00ns  74.06ms         1 [ 27.35ms,  27.35ms]  27.35ms   0.00ns  27.35ms
                  'fj_long_perturb':         1 [ 97.30ms,  97.30ms]  97.30ms   0.00ns  97.30ms         1 [ 72.33ms,  72.33ms]  72.33ms   0.00ns  72.33ms
                   'fj_long_random':         1 [111.55ms, 111.55ms] 111.55ms   0.00ns 111.55ms         1 [ 42.26ms,  42.26ms]  42.26ms   0.00ns  42.26ms
                 'fj_short_default':         1 [ 78.23ms,  78.23ms]  78.23ms   0.00ns  78.23ms         1 [ 31.59ms,  31.59ms]  31.59ms   0.00ns  31.59ms
                 'fj_short_default':         1 [112.53ms, 112.53ms] 112.53ms   0.00ns 112.53ms         1 [ 70.16ms,  70.16ms]  70.16ms   0.00ns  70.16ms
             'fj_short_lin_default':         1 [ 99.13ms,  99.13ms]  99.13ms   0.00ns  99.13ms         1 [ 71.82ms,  71.82ms]  71.82ms   0.00ns  71.82ms
             'fj_short_lin_default':         1 [102.97ms, 102.97ms] 102.97ms   0.00ns 102.97ms         1 [ 72.87ms,  72.87ms]  72.87ms   0.00ns  72.87ms
             'fj_short_lin_perturb':         1 [116.08ms, 116.08ms] 116.08ms   0.00ns 116.08ms         1 [ 46.59ms,  46.59ms]  46.59ms   0.00ns  46.59ms
              'fj_short_lin_random':         1 [101.07ms, 101.07ms] 101.07ms   0.00ns 101.07ms         1 [ 71.62ms,  71.62ms]  71.62ms   0.00ns  71.62ms
                 'fj_short_perturb':         1 [112.58ms, 112.58ms] 112.58ms   0.00ns 112.58ms         1 [ 43.22ms,  43.22ms]  43.22ms   0.00ns  43.22ms
                  'fj_short_random':         1 [101.86ms, 101.86ms] 101.86ms   0.00ns 101.86ms         1 [ 71.13ms,  71.13ms]  71.13ms   0.00ns  71.13ms
                        'fs_random':         1 [ 54.58ms,  54.58ms]  54.58ms   0.00ns  54.58ms         1 [  4.39us,   4.39us]   4.39us   0.00ns   4.39us
                        'fs_random':         1 [ 55.43ms,  55.43ms]  55.43ms   0.00ns  55.43ms         1 [  4.39us,   4.39us]   4.39us   0.00ns   4.39us
                        'fs_random':         1 [ 55.92ms,  55.92ms]  55.92ms   0.00ns  55.92ms         1 [  4.39us,   4.39us]   4.39us   0.00ns   4.39us
                        'fs_random':         1 [ 57.82ms,  57.82ms]  57.82ms   0.00ns  57.82ms         1 [ 20.00ns,  20.00ns]  20.00ns   0.00ns  20.00ns
                  'fs_random_no_lp':         1 [ 54.04ms,  54.04ms]  54.04ms   0.00ns  54.04ms         1 [363.94us, 363.94us] 363.94us   0.00ns 363.94us
                  'fs_random_no_lp':         1 [ 54.84ms,  54.84ms]  54.84ms   0.00ns  54.84ms         1 [701.97us, 701.97us] 701.97us   0.00ns 701.97us
                  'fs_random_no_lp':         1 [ 58.54ms,  58.54ms]  58.54ms   0.00ns  58.54ms         1 [576.59us, 576.59us] 576.59us   0.00ns 576.59us
                  'fs_random_no_lp':         1 [ 59.85ms,  59.85ms]  59.85ms   0.00ns  59.85ms         1 [474.97us, 474.97us] 474.97us   0.00ns 474.97us
          'fs_random_quick_restart':         1 [ 53.80ms,  53.80ms]  53.80ms   0.00ns  53.80ms         1 [  4.39us,   4.39us]   4.39us   0.00ns   4.39us
          'fs_random_quick_restart':         1 [ 55.73ms,  55.73ms]  55.73ms   0.00ns  55.73ms         1 [  4.39us,   4.39us]   4.39us   0.00ns   4.39us
          'fs_random_quick_restart':         1 [ 56.04ms,  56.04ms]  56.04ms   0.00ns  56.04ms         1 [  4.39us,   4.39us]   4.39us   0.00ns   4.39us
          'fs_random_quick_restart':         1 [ 58.68ms,  58.68ms]  58.68ms   0.00ns  58.68ms         1 [ 20.00ns,  20.00ns]  20.00ns   0.00ns  20.00ns
    'fs_random_quick_restart_no_lp':         1 [ 53.67ms,  53.67ms]  53.67ms   0.00ns  53.67ms         1 [353.61us, 353.61us] 353.61us   0.00ns 353.61us
    'fs_random_quick_restart_no_lp':         1 [ 54.81ms,  54.81ms]  54.81ms   0.00ns  54.81ms         1 [279.31us, 279.31us] 279.31us   0.00ns 279.31us
    'fs_random_quick_restart_no_lp':         1 [ 56.05ms,  56.05ms]  56.05ms   0.00ns  56.05ms         1 [236.96us, 236.96us] 236.96us   0.00ns 236.96us
                    'graph_arc_lns':      1648 [  6.08ms,    5.23s]    1.32s 899.02ms   36.13m      1634 [ 10.00ns, 328.32ms]  85.95ms  59.32ms    2.34m
                    'graph_cst_lns':      1648 [  2.10ms,    4.99s]    1.34s 943.50ms   36.92m      1571 [ 10.00ns, 317.20ms]  88.37ms  56.70ms    2.31m
                    'graph_dec_lns':      1648 [  4.34ms,    5.02s]    1.43s 952.57ms   39.29m      1627 [ 10.00ns, 418.58ms]  88.35ms  58.48ms    2.40m
                    'graph_var_lns':      1648 [  5.60ms,    5.57s]    1.40s 913.39ms   38.44m      1639 [ 10.00ns, 321.74ms]  90.56ms  55.51ms    2.47m
                   'lb_tree_search':         1 [   8.59m,    8.59m]    8.59m   0.00ns    8.59m         1 [   1.92m,    1.92m]    1.92m   0.00ns    1.92m
                           'max_lp':         1 [   8.59m,    8.59m]    8.59m   0.00ns    8.59m         1 [   1.60m,    1.60m]    1.60m   0.00ns    1.60m
                            'no_lp':         1 [   8.59m,    8.59m]    8.59m   0.00ns    8.59m         1 [   1.02m,    1.02m]    1.02m   0.00ns    1.02m
              'objective_lb_search':         1 [   8.59m,    8.59m]    8.59m   0.00ns    8.59m         1 [   1.43m,    1.43m]    1.43m   0.00ns    1.43m
       'objective_lb_search_max_lp':         1 [   8.59m,    8.59m]    8.59m   0.00ns    8.59m         1 [   1.89m,    1.89m]    1.89m   0.00ns    1.89m
        'objective_lb_search_no_lp':         1 [   8.59m,    8.59m]    8.59m   0.00ns    8.59m         1 [  48.51s,   48.51s]   48.51s   0.00ns   48.51s
  'objective_shaving_search_max_lp':       158 [  7.14ms,   32.76s]    3.26s    4.68s    8.59m       148 [ 50.62us,    4.67s] 376.56ms 593.83ms   55.73s
   'objective_shaving_search_no_lp':       158 [  3.45ms,   32.75s]    3.26s    4.68s    8.59m       149 [972.34us,    1.97s] 241.10ms 348.49ms   35.92s
                          'probing':         1 [   8.59m,    8.59m]    8.59m   0.00ns    8.59m         1 [   1.66m,    1.66m]    1.66m   0.00ns    1.66m
                   'probing_max_lp':         1 [   8.59m,    8.59m]    8.59m   0.00ns    8.59m         1 [   1.82m,    1.82m]    1.82m   0.00ns    1.82m
                     'pseudo_costs':         1 [   8.59m,    8.59m]    8.59m   0.00ns    8.59m         1 [   1.37m,    1.37m]    1.37m   0.00ns    1.37m
                    'quick_restart':         1 [   8.59m,    8.59m]    8.59m   0.00ns    8.59m         1 [   1.57m,    1.57m]    1.57m   0.00ns    1.57m
              'quick_restart_no_lp':         1 [   8.59m,    8.59m]    8.59m   0.00ns    8.59m         1 [   1.50m,    1.50m]    1.50m   0.00ns    1.50m
                    'reduced_costs':         1 [   8.59m,    8.59m]    8.59m   0.00ns    8.59m         1 [   1.69m,    1.69m]    1.69m   0.00ns    1.69m
                        'rins/rens':      1649 [176.87us,    3.22s] 901.08ms 682.69ms   24.76m      1325 [ 10.00ns, 200.16ms]  79.70ms  31.38ms    1.76m
                      'rnd_cst_lns':      1648 [  4.45ms,    4.99s]    1.33s 856.91ms   36.57m      1631 [ 10.00ns, 288.69ms]  89.74ms  57.03ms    2.44m
                      'rnd_var_lns':      1648 [  5.34ms,    5.39s]    1.23s 842.80ms   33.84m      1633 [ 10.00ns, 437.41ms]  82.29ms  56.21ms    2.24m
                     'violation_ls':      1648 [  5.98ms, 582.28ms] 153.90ms  71.99ms    4.23m      1648 [  1.92ms, 184.48ms]  66.47ms  18.72ms    1.83m
                     'violation_ls':      1648 [  7.82ms, 632.74ms] 150.02ms  70.38ms    4.12m      1648 [  2.76ms, 156.30ms]  65.91ms  19.52ms    1.81m
                     'violation_ls':      1648 [311.03us, 447.87ms] 153.33ms  69.65ms    4.21m      1648 [  1.35us, 153.23ms]  64.26ms  20.47ms    1.77m
                     'violation_ls':      1648 [329.01us, 566.27ms] 145.60ms  68.09ms    4.00m      1648 [780.00ns, 194.65ms]  67.67ms  19.32ms    1.86m
                     'violation_ls':      1649 [  2.75ms, 736.76ms] 160.79ms  75.68ms    4.42m      1649 [153.80us, 184.82ms]  60.76ms  18.10ms    1.67m

Search stats                        Bools  Conflicts  Branches  Restarts   BoolPropag  IntegerPropag
                           'core':  4'615    169'031   591'748    47'540  266'039'913    122'450'656
                     'default_lp':     89    105'212   519'584    72'828    3'045'701    108'977'742
                      'fs_random':     89          0       178       178           30          4'120
                      'fs_random':     89          0       178       178           30          4'120
                      'fs_random':     89          0       178       178           30          4'120
                      'fs_random':     89          0       178       178           30          4'120
                'fs_random_no_lp':     89          0       230       178           41          6'407
                'fs_random_no_lp':     89         11       231       178           87          6'866
                'fs_random_no_lp':     89          5       218       178           54          5'855
                'fs_random_no_lp':     89          6       251       178           96          7'624
        'fs_random_quick_restart':     89          0       178       178           30          4'120
        'fs_random_quick_restart':     89          0       178       178           30          4'120
        'fs_random_quick_restart':     89          0       178       178           30          4'120
        'fs_random_quick_restart':     89          0       178       178           30          4'120
  'fs_random_quick_restart_no_lp':     89          0       216       178           32          5'394
  'fs_random_quick_restart_no_lp':     89          0       229       178           35          5'191
  'fs_random_quick_restart_no_lp':     89          0       240       178           32          5'796
                 'lb_tree_search':     89      1'740   450'626    61'613      986'724     35'942'069
                         'max_lp':     89     49'036   619'390    84'823    2'801'898     90'730'900
                          'no_lp':  1'432    273'636   572'534    41'302   88'070'899    212'706'573
            'objective_lb_search':    327     79'368   648'120   115'866    6'372'571    119'356'658
     'objective_lb_search_max_lp':    259     34'711   642'785   134'068    4'226'540     86'901'135
      'objective_lb_search_no_lp':    466    264'142   543'664    32'601    9'064'913    208'063'449
                        'probing':    481        281     6'859     3'896       42'470        305'124
                 'probing_max_lp':    481        280     4'208     2'568       30'095        216'515
                   'pseudo_costs':     89     65'302   541'462    87'582    2'464'231     83'830'486
                  'quick_restart':  2'501     31'495   610'714    99'590   53'308'725     75'073'311
            'quick_restart_no_lp':  3'620    233'681   886'047    54'366  208'896'017    147'309'537
                  'reduced_costs':  5'845     94'790   593'006    55'313  125'210'915     86'437'114

SAT stats                           ClassicMinim  LitRemoved  LitLearned  LitForgotten  Subsumed  MClauses  MDecisions  MLitTrue  MSubsumed  MLitRemoved  MReused
                           'core':       152'910     868'743   1'531'239        45'589       943    22'085     108'950        56      1'209        3'876      123
                     'default_lp':        75'458     226'792   1'320'270       684'535     2'739    38'304     374'729         0      4'703       31'625    6'759
                      'fs_random':             0           0           0             0         0         0           0         0          0            0        0
                      'fs_random':             0           0           0             0         0         0           0         0          0            0        0
                      'fs_random':             0           0           0             0         0         0           0         0          0            0        0
                      'fs_random':             0           0           0             0         0         0           0         0          0            0        0
                'fs_random_no_lp':             0           0           0             0         0         0           0         0          0            0        0
                'fs_random_no_lp':             0           0          20             0         0         0           0         0          0            0        0
                'fs_random_no_lp':             0           0          42             0         0         0           0         0          0            0        0
                'fs_random_no_lp':             1           1          74             0         0         0           0         0          0            0        0
        'fs_random_quick_restart':             0           0           0             0         0         0           0         0          0            0        0
        'fs_random_quick_restart':             0           0           0             0         0         0           0         0          0            0        0
        'fs_random_quick_restart':             0           0           0             0         0         0           0         0          0            0        0
        'fs_random_quick_restart':             0           0           0             0         0         0           0         0          0            0        0
  'fs_random_quick_restart_no_lp':             0           0           0             0         0         0           0         0          0            0        0
  'fs_random_quick_restart_no_lp':             0           0           0             0         0         0           0         0          0            0        0
  'fs_random_quick_restart_no_lp':             0           0           0             0         0         0           0         0          0            0        0
                 'lb_tree_search':           485         953      13'779             0        25    30'151     195'909         0        313        1'580    3'340
                         'max_lp':        32'502      88'869     633'521       252'206     1'548    44'143     543'797         0      2'746       18'786    9'875
                          'no_lp':       216'751   1'142'337   3'992'400     3'258'668     3'494    23'100     193'871        35      9'031       64'556    2'865
            'objective_lb_search':        58'864     145'687     804'130        70'042     2'148    59'092     513'414         0      5'919       38'295   10'300
     'objective_lb_search_max_lp':        22'952      54'574     343'894        20'259     1'466    60'530     530'831         0      2'002       13'100   10'592
      'objective_lb_search_no_lp':       214'464     754'419   2'575'288     1'059'737     4'878    19'965     218'396         1      8'759       63'604    4'016
                        'probing':             0           0         281             0         0         0           0         0          0            0        0
                 'probing_max_lp':             0           0         280             0         0         0           0         0          0            0        0
                   'pseudo_costs':        41'034     105'800     809'205       327'255     1'856    44'959     437'290         0      5'969       43'388    7'634
                  'quick_restart':        23'170      85'901     355'394       125'968     1'304    48'632     449'146        22      7'531       48'007    7'445
            'quick_restart_no_lp':       194'556   1'129'644   3'116'190     2'208'151     2'283    23'054     182'615        32     14'741      102'491    1'805
                  'reduced_costs':        73'125     351'734   1'244'155       635'380     1'766    32'232     309'726         0     11'112       75'891    5'560

Lp stats                         Component  Iterations  AddedCuts  OPTIMAL  DUAL_F.  DUAL_U.
                  'default_lp':          1     897'698     46'986  145'938        0        0
                   'fs_random':          1         122         50        3        0        0
                   'fs_random':          1         122         53        3        0        0
                   'fs_random':          1         122         67        3        0        0
                   'fs_random':          1           6          0        1        1        0
     'fs_random_quick_restart':          1         122         50        3        0        0
     'fs_random_quick_restart':          1         122         52        3        0        0
     'fs_random_quick_restart':          1         122         54        3        0        0
     'fs_random_quick_restart':          1          65          0        1        1        0
              'lb_tree_search':          1   2'895'374     15'370  172'812   53'748        0
                      'max_lp':          1   1'573'485     32'184   82'691   18'719       35
         'objective_lb_search':          1   1'016'320     41'612  112'499        0        0
  'objective_lb_search_max_lp':          1   1'657'816     20'721   59'524   15'373       29
                     'probing':          1     594'815     61'515   20'381        0        0
              'probing_max_lp':          1     553'824     35'220   11'221    1'769        0
                'pseudo_costs':          1   1'430'009     52'424   98'072   31'164       41
               'quick_restart':          1   1'041'286     42'390   86'874        0        3
               'reduced_costs':          1   1'615'505     81'933  128'720   45'802        2

Lp dimension                                                                       Final dimension of first component
                  'default_lp':    296 rows, 274 columns, 1190 entries with magnitude in [3.328676e-04, 1.000000e+00]
                   'fs_random':     107 rows, 274 columns, 477 entries with magnitude in [5.798714e-02, 1.000000e+00]
                   'fs_random':     107 rows, 274 columns, 477 entries with magnitude in [5.798714e-02, 1.000000e+00]
                   'fs_random':     108 rows, 274 columns, 481 entries with magnitude in [3.877834e-02, 1.000000e+00]
                   'fs_random':     108 rows, 274 columns, 481 entries with magnitude in [3.877834e-02, 1.000000e+00]
     'fs_random_quick_restart':     107 rows, 274 columns, 477 entries with magnitude in [5.798714e-02, 1.000000e+00]
     'fs_random_quick_restart':     108 rows, 274 columns, 481 entries with magnitude in [3.877834e-02, 1.000000e+00]
     'fs_random_quick_restart':     108 rows, 274 columns, 481 entries with magnitude in [3.877834e-02, 1.000000e+00]
     'fs_random_quick_restart':     108 rows, 274 columns, 481 entries with magnitude in [3.877834e-02, 1.000000e+00]
              'lb_tree_search':    507 rows, 285 columns, 1894 entries with magnitude in [1.707532e-02, 1.000000e+00]
                      'max_lp':    613 rows, 285 columns, 2326 entries with magnitude in [4.791593e-03, 1.000000e+00]
         'objective_lb_search':    459 rows, 274 columns, 1629 entries with magnitude in [1.126250e-03, 1.000000e+00]
  'objective_lb_search_max_lp':    705 rows, 285 columns, 1956 entries with magnitude in [6.480856e-03, 1.000000e+00]
                     'probing':  1266 rows, 274 columns, 15158 entries with magnitude in [1.612344e-05, 1.000000e+00]
              'probing_max_lp':   1446 rows, 285 columns, 6996 entries with magnitude in [3.536340e-04, 1.000000e+00]
                'pseudo_costs':    669 rows, 285 columns, 2543 entries with magnitude in [1.488428e-03, 1.000000e+00]
               'quick_restart':    787 rows, 274 columns, 2595 entries with magnitude in [1.439199e-04, 1.000000e+00]
               'reduced_costs':    523 rows, 285 columns, 1431 entries with magnitude in [2.817181e-03, 1.000000e+00]

Lp debug                         CutPropag  CutEqPropag  Adjust  Overflow        Bad  BadScaling
                  'default_lp':         13          150  67'974         0    322'126           0
                   'fs_random':          0            0       0         0          0           0
                   'fs_random':          0            0       0         0         20           0
                   'fs_random':          0            0       0         0          9           0
                   'fs_random':          0            0       0         0         91           0
     'fs_random_quick_restart':          0            0       0         0          0           0
     'fs_random_quick_restart':          0            0       0         0          0           0
     'fs_random_quick_restart':          0            0       0         0         30           0
     'fs_random_quick_restart':          0            0       0         0         58           0
              'lb_tree_search':         32           57  80'936         0    118'494           0
                      'max_lp':         89           22  29'237         0    382'677           0
         'objective_lb_search':         12          245  72'502         0    457'939           0
  'objective_lb_search_max_lp':         93           69  29'368         0    396'821           0
                     'probing':         17          383  17'808         0  6'844'467           0
              'probing_max_lp':         97          216  12'037         0  5'489'243           0
                'pseudo_costs':        154           38  60'907         0    445'143           0
               'quick_restart':         28           90  47'273         0    966'783           0
               'reduced_costs':        306           99  90'298         0    560'282           0

Lp pool                          Constraints  Updates  Simplif  Merged  Shortened    Split  Strenghtened       Cuts/Call
                  'default_lp':        9'930    3'066   51'769     368     15'696   40'759        24'308  46'986/132'976
                   'fs_random':          312        0        0       0          0        0             9             0/0
                   'fs_random':          362        0        0       0          0        0             9           50/50
                   'fs_random':          365        0        0       0          0        0             9           53/56
                   'fs_random':          379        0        0       0          0        0            10           67/88
     'fs_random_quick_restart':          312        0        0       0          0        0             9             0/0
     'fs_random_quick_restart':          362        0        0       0          0        0             9           50/50
     'fs_random_quick_restart':          364        0        0       0          0        0            10           52/54
     'fs_random_quick_restart':          366        0        0       0          0        0             9           54/58
              'lb_tree_search':       11'762    1'149   86'062     238      6'483    2'342        89'086   15'370/78'455
                      'max_lp':       11'515    1'964  138'528     299      6'347   19'988       122'411   32'184/92'927
         'objective_lb_search':        9'724    3'840  112'686     200     17'701   47'909        42'061  41'612/114'354
  'objective_lb_search_max_lp':       12'233    2'395  246'985     118     19'372   19'382       162'870   20'721/64'851
                     'probing':        9'779    8'559   37'251      48      5'733   89'181        12'411  61'515/113'145
              'probing_max_lp':       11'837    3'981  152'121      13     19'488   43'366        90'174   35'220/90'764
                'pseudo_costs':       11'616    2'346  138'441     438     10'564   23'023       137'044  52'424/128'190
               'quick_restart':        9'560    4'949  213'091     142     16'233  205'745        39'552  42'390/123'916
               'reduced_costs':       12'003    2'950  251'608     560     26'424   28'968       167'696  81'933/204'453

Lp Cut            fs_ran  fs_ran  fs_ran  fs_ran  fs_ran  fs_ran  defaul  max_lp  quick_  reduce  pseudo  lb_tre  probin  object  probin  object
          CG_FF:       -       -       -       -       -       -   2'158   1'129     913   5'118   2'473     570     448   1'485     435     502
           CG_K:       -       -       -       -       -       -   1'492     824     540   4'222   1'889     350     353   1'018     193     329
          CG_KL:       -       -       -       -       -       -       2       -       -       -       -       -       1       -       -       -
           CG_R:       -       -       -       -       -       -   2'539     750   1'020   4'501   1'953     449   2'061   1'563     315     394
          CG_RB:       -       -       -       -       -       -  14'996   3'969  17'456  12'689   7'670   2'966  30'037  15'225   1'702   2'491
         CG_RBP:       -       -       -       -       -       -   2'648     433   2'292   2'125   1'207     302   3'404   2'631     133     239
         Clique:       -       -       -       -       -       -       -     189       -     745     367     123       -       -     125     196
             IB:      50      50      50      50      50      50   8'041   3'854   4'318   9'267   5'725   1'559   2'516   6'216     838   1'632
       MIR_1_FF:       2       1      10       2       -       -   1'440   1'484   1'247   3'552   2'188     663     971   1'167     715     949
        MIR_1_K:       -       -       -       -       -       -     498     478     285   1'418     916     238     166     368      83     352
       MIR_1_KL:       -       -       -       -       -       -      10      11      27      25      18       3      49       8      11       -
        MIR_1_R:       1       -       3       1       -       -     500     195     293     772     393      71     377     378     124     126
       MIR_1_RB:       -       1       1       -       -       -   2'369   3'241   2'668   6'776   4'906   1'566   3'636   2'053   1'930   2'023
      MIR_1_RBP:       -       -       -       -       -       -     126     449      68   1'057     866     285     169     124     142     247
      MIR_1_RLT:       -       -       -       -       -       -       -      18       -      70      39      10       -       -      11      11
       MIR_2_FF:       -       -       2       1       -       -     819   1'081     764   2'502   1'543     482     566     681     513     676
        MIR_2_K:       -       -       -       -       -       -     276     299     202     952     600     163     123     214      76     232
       MIR_2_KL:       -       -       -       -       -       -      16      23      23      50      21       4      39      11       3       1
        MIR_2_R:       -       -       1       -       -       -     326     552     329   1'061     726     192     474     267     616     351
       MIR_2_RB:       -       -       -       -       -       -   1'483   1'976   1'660   3'902   2'964     907   2'410   1'563   1'377   1'359
      MIR_2_RBP:       -       -       -       -       -       -     170     329     112     740     642     197     147     170     136     211
       MIR_3_FF:       -       -       -       -       -       -     521     716     453   1'646   1'137     349     366     443     383     442
        MIR_3_K:       -       -       -       -       -       -     193     247     142     673     472     135     127     166      91     158
       MIR_3_KL:       -       -       -       -       -       -       8      14      18      45      14       5      28       7       7       4
        MIR_3_R:       -       -       -       -       -       -     292     411     273     834     619     140     361     236     519     311
       MIR_3_RB:       -       -       -       -       -       -     969   1'215   1'132   2'187   1'717     515   1'353     991     897     841
      MIR_3_RBP:       -       -       -       -       -       -      94     172      81     433     355      81      96     112     130     123
       MIR_4_FF:       -       -       -       -       -       -     329     362     288     813     587     132     207     258     159     206
        MIR_4_K:       -       -       -       -       -       -     115     146      94     404     284      56      58      98      64      94
       MIR_4_KL:       -       -       -       -       -       -      10       5      10      26      11       6      21       5       7       3
        MIR_4_R:       -       -       -       -       -       -     234     248     241     500     352      73     233     205     251     183
       MIR_4_RB:       -       -       -       -       -       -     647     594     710   1'105     821     226     814     612     488     427
      MIR_4_RBP:       -       -       -       -       -       -      65     109      39     298     223      31      63      59      71      63
       MIR_5_FF:       -       -       -       -       -       -     204     194     162     427     287      65     160     146      92     118
        MIR_5_K:       -       -       -       -       -       -      58      78      39     240     145      43      53      59      28      69
       MIR_5_KL:       -       -       -       -       -       -       7       1      10       9       7       3       7       2       -       1
        MIR_5_R:       -       -       -       -       -       -     193     131     121     266     204      30     149     137     124      85
       MIR_5_RB:       -       -       -       -       -       -     369     276     356     560     398     110     509     286     211     211
      MIR_5_RBP:       -       -       -       -       -       -      39      55      36     179     117      26      34      24      21      40
       MIR_6_FF:       -       -       -       -       -       -     113      90     108     252     162      46      81     111      39      56
        MIR_6_K:       -       -       -       -       -       -      41      46      38     136      77      21      24      40      20      29
       MIR_6_KL:       -       -       -       -       -       -       -       -       6       7       2       2      15       6       2       2
        MIR_6_R:       -       -       -       -       -       -      92      64      70     171     109      17      70      86      64      45
       MIR_6_RB:       -       -       -       -       -       -     183     153     215     341     245      57     280     162      96      98
      MIR_6_RBP:       -       -       -       -       -       -      37      35      17     140      95      23      37      26      15      23
   ZERO_HALF_FF:       -       -       -       -       -       -     305     365     234   1'094     585     208     143     231     123     193
    ZERO_HALF_K:       -       -       -       -       -       -     141     141      94     434     290      42      44      94      23      80
    ZERO_HALF_R:       -       -       -       -       -       -   1'025   3'747   2'145   4'558   3'872   1'160   6'009   1'028  20'522   3'651
   ZERO_HALF_RB:       -       -       -       -       -       -     690   1'102     901   2'069   1'712     530   1'996     711     824     673
  ZERO_HALF_RBP:       -       -       -       -       -       -     103     183     140     542     419     138     230     129     471     171

LNS stats           Improv/Calls  Closed  Difficulty  TimeLimit
  'graph_arc_lns':       15/1648     51%        0.99       0.18
  'graph_cst_lns':       10/1585     51%        0.99       0.18
  'graph_dec_lns':       10/1647     51%        0.99       0.18
  'graph_var_lns':        4/1647     51%        0.99       0.18
      'rins/rens':      198/1500     50%        0.85       0.10
    'rnd_cst_lns':       18/1647     51%        0.99       0.18
    'rnd_var_lns':       19/1648     51%        0.99       0.17

LS stats                   Batches  Restarts   LinMoves   GenMoves  CompoundMoves  WeightUpdates
       'fj_long_default':        1         1      4'521          0              0            106
       'fj_long_default':        1         1      6'282          0              0            143
   'fj_long_lin_default':        1         1          0      3'078            390              1
   'fj_long_lin_perturb':        1         1      5'510          0              0          1'234
    'fj_long_lin_random':        1         1      5'868          0              0          1'379
       'fj_long_perturb':        1         1          0      3'172            386              1
        'fj_long_random':        1         1      9'730          0              0            270
      'fj_short_default':        1         1          0      3'075            388              2
      'fj_short_default':        1         1      5'876          0              0          2'358
  'fj_short_lin_default':        1         1          0      3'087            413              1
  'fj_short_lin_default':        1         1          0      3'260            333              1
  'fj_short_lin_perturb':        1         1      9'775          0              0            225
   'fj_short_lin_random':        1         1          0      3'152            380              1
      'fj_short_perturb':        1         1      9'744          0              0            256
       'fj_short_random':        1         1          0      3'197            412              1
          'violation_ls':    1'648         0  6'329'646  4'712'590        253'764      1'105'768
          'violation_ls':    1'648         0  6'777'841  4'500'826        282'499      1'326'811
          'violation_ls':    1'648         0  7'212'474  4'559'614        219'085        994'313
          'violation_ls':    1'648         0  9'369'438  3'181'185        121'273        915'618
          'violation_ls':    1'649         0  7'657'236  4'564'814        251'353        478'420

Solutions (22)            Num     Rank
        'graph_var_lns':    1    [8,8]
                'no_lp':   14   [1,21]
  'quick_restart_no_lp':    1    [7,7]
          'rnd_var_lns':    1  [22,22]
         'violation_ls':    5   [2,12]

Objective bounds                      Num
                   'initial_domain':    1
              'objective_lb_search':    2
       'objective_lb_search_max_lp':    3
        'objective_lb_search_no_lp':  156
  'objective_shaving_search_max_lp':    1
   'objective_shaving_search_no_lp':    4

Solution repositories     Added  Queried  Ignored  Synchro
  'feasible solutions':  11'002   32'552       15   10'583
        'lp solutions':   3'318      790        0    2'994
                'pump':  34'499      859

Improving bounds shared            Num
                        'core':     35
                  'default_lp':     82
              'lb_tree_search':     19
                      'max_lp':    167
                       'no_lp':     69
         'objective_lb_search':     28
  'objective_lb_search_max_lp':     97
                     'probing':    970
              'probing_max_lp':    532
                'pseudo_costs':    553
               'quick_restart':    257
         'quick_restart_no_lp':  3'006
               'reduced_costs':    538

Clauses shared                   Num
                        'core':    9
                  'default_lp':  118
             'fs_random_no_lp':    1
              'lb_tree_search':   10
                      'max_lp':   21
                       'no_lp':   43
         'objective_lb_search':   63
  'objective_lb_search_max_lp':   17
   'objective_lb_search_no_lp':    3
                'pseudo_costs':   78
               'quick_restart':   16
         'quick_restart_no_lp':   50
               'reduced_costs':   44

CpSolverResponse summary:
status: OPTIMAL
objective: 1097
best_bound: 1097
integers: 275
booleans: 89
conflicts: 0
branches: 178
propagations: 30
integer_propagations: 4120
restarts: 178
lp_iterations: 122
walltime: 516.074
usertime: 516.074
deterministic_time: 3165.19
gap_integral: 9452.86
solution_fingerprint: 0x934894f0bd48c140


--- Simulation Gantt  partir du modle mathmatique ---
{'big':0, 'due_date':144, 'pos_time':5, 'status':0, 'blocked':0, 'operations':["{'type':0, 'processing_time':21}", "{'type':1, 'processing_time':59}"]}
{'big':0, 'due_date':109, 'pos_time':5, 'status':0, 'blocked':0, 'operations':["{'type':1, 'processing_time':24}", "{'type':0, 'processing_time':11}"]}
{'big':0, 'due_date':71, 'pos_time':5, 'status':0, 'blocked':0, 'operations':["{'type':1, 'processing_time':50}"]}
{'big':0, 'due_date':155, 'pos_time':5, 'status':0, 'blocked':0, 'operations':["{'type':1, 'processing_time':16}", "{'type':0, 'processing_time':37}"]}
{'big':0, 'due_date':154, 'pos_time':5, 'status':0, 'blocked':0, 'operations':["{'type':1, 'processing_time':13}", "{'type':0, 'processing_time':50}"]}
{'big':0, 'due_date':124, 'pos_time':5, 'status':0, 'blocked':0, 'operations':["{'type':0, 'processing_time':59}", "{'type':1, 'processing_time':56}"]}
{'big':1, 'due_date':56, 'pos_time':5, 'status':0, 'blocked':0, 'operations':["{'type':1, 'processing_time':53}"]}
