created virtual environment CPython3.12.4.final.0-64 in 4522ms
  creator CPython3Posix(dest=/localscratch/aneumann.63393202.0/env, clear=False, no_vcs_ignore=False, global=False)
  seeder FromAppData(download=False, pip=bundle, via=copy, app_data_dir=/home/aneumann/.local/share/virtualenv)
    added seed packages: pip==25.1.1
  activators BashActivator,CShellActivator,FishActivator,NushellActivator,PowerShellActivator,PythonActivator
Looking in links: /cvmfs/soft.computecanada.ca/custom/python/wheelhouse/gentoo2023/x86-64-v3, /cvmfs/soft.computecanada.ca/custom/python/wheelhouse/gentoo2023/generic, /cvmfs/soft.computecanada.ca/custom/python/wheelhouse/generic
Requirement already satisfied: pip in /localscratch/aneumann.63393202.0/env/lib/python3.12/site-packages (25.1.1)
Looking in links: /cvmfs/soft.computecanada.ca/custom/python/wheelhouse/gentoo2023/x86-64-v3, /cvmfs/soft.computecanada.ca/custom/python/wheelhouse/gentoo2023/generic, /cvmfs/soft.computecanada.ca/custom/python/wheelhouse/generic
ERROR: protobuf-5.28.3-cp38-abi3-manylinux2014_x86_64.whl is not a supported wheel on this platform.
Looking in links: /cvmfs/soft.computecanada.ca/custom/python/wheelhouse/gentoo2023/x86-64-v3, /cvmfs/soft.computecanada.ca/custom/python/wheelhouse/gentoo2023/generic, /cvmfs/soft.computecanada.ca/custom/python/wheelhouse/generic
Processing /home/aneumann/projects/def-adhaj/aneumann/GNRS/wheels/immutabledict-4.2.0-py3-none-any.whl
Installing collected packages: immutabledict
Successfully installed immutabledict-4.2.0
Looking in links: /cvmfs/soft.computecanada.ca/custom/python/wheelhouse/gentoo2023/x86-64-v3, /cvmfs/soft.computecanada.ca/custom/python/wheelhouse/gentoo2023/generic, /cvmfs/soft.computecanada.ca/custom/python/wheelhouse/generic
Processing /cvmfs/soft.computecanada.ca/custom/python/wheelhouse/generic/ortools-9.10.4067+computecanada-cp312-cp312-linux_x86_64.whl (from -r /home/aneumann/projects/def-adhaj/aneumann/GNRS/requirements/or.txt (line 1))
Processing /cvmfs/soft.computecanada.ca/custom/python/wheelhouse/gentoo2023/x86-64-v3/matplotlib-3.10.0+computecanada-cp312-cp312-linux_x86_64.whl (from -r /home/aneumann/projects/def-adhaj/aneumann/GNRS/requirements/or.txt (line 2))
Processing /cvmfs/soft.computecanada.ca/custom/python/wheelhouse/gentoo2023/x86-64-v3/pandas-2.2.3+computecanada-cp312-cp312-linux_x86_64.whl (from -r /home/aneumann/projects/def-adhaj/aneumann/GNRS/requirements/or.txt (line 3))
Processing /cvmfs/soft.computecanada.ca/custom/python/wheelhouse/generic/absl_py-2.2.2+computecanada-py3-none-any.whl (from ortools<9.11,>=9.10->-r /home/aneumann/projects/def-adhaj/aneumann/GNRS/requirements/or.txt (line 1))
Processing /cvmfs/soft.computecanada.ca/custom/python/wheelhouse/gentoo2023/generic/numpy-2.2.2+computecanada-cp312-cp312-linux_x86_64.whl (from ortools<9.11,>=9.10->-r /home/aneumann/projects/def-adhaj/aneumann/GNRS/requirements/or.txt (line 1))
Processing /cvmfs/soft.computecanada.ca/custom/python/wheelhouse/gentoo2023/x86-64-v3/protobuf-6.30.2+computecanada-cp312-cp312-linux_x86_64.whl (from ortools<9.11,>=9.10->-r /home/aneumann/projects/def-adhaj/aneumann/GNRS/requirements/or.txt (line 1))
Requirement already satisfied: immutabledict>=3.0.0 in /localscratch/aneumann.63393202.0/env/lib/python3.12/site-packages (from ortools<9.11,>=9.10->-r /home/aneumann/projects/def-adhaj/aneumann/GNRS/requirements/or.txt (line 1)) (4.2.0)
Processing /cvmfs/soft.computecanada.ca/custom/python/wheelhouse/gentoo2023/generic/contourpy-1.3.1+computecanada-cp312-cp312-linux_x86_64.whl (from matplotlib->-r /home/aneumann/projects/def-adhaj/aneumann/GNRS/requirements/or.txt (line 2))
Processing /cvmfs/soft.computecanada.ca/custom/python/wheelhouse/generic/cycler-0.12.1+computecanada-py3-none-any.whl (from matplotlib->-r /home/aneumann/projects/def-adhaj/aneumann/GNRS/requirements/or.txt (line 2))
Processing /cvmfs/soft.computecanada.ca/custom/python/wheelhouse/generic/fonttools-4.58.2+computecanada-cp312-cp312-linux_x86_64.whl (from matplotlib->-r /home/aneumann/projects/def-adhaj/aneumann/GNRS/requirements/or.txt (line 2))
Processing /cvmfs/soft.computecanada.ca/custom/python/wheelhouse/gentoo2023/x86-64-v3/kiwisolver-1.4.8+computecanada-cp312-cp312-linux_x86_64.whl (from matplotlib->-r /home/aneumann/projects/def-adhaj/aneumann/GNRS/requirements/or.txt (line 2))
Processing /cvmfs/soft.computecanada.ca/custom/python/wheelhouse/generic/packaging-25.0+computecanada-py3-none-any.whl (from matplotlib->-r /home/aneumann/projects/def-adhaj/aneumann/GNRS/requirements/or.txt (line 2))
Processing /cvmfs/soft.computecanada.ca/custom/python/wheelhouse/gentoo2023/x86-64-v3/pillow-11.1.0+computecanada-cp312-cp312-linux_x86_64.whl (from matplotlib->-r /home/aneumann/projects/def-adhaj/aneumann/GNRS/requirements/or.txt (line 2))
Processing /cvmfs/soft.computecanada.ca/custom/python/wheelhouse/generic/pyparsing-3.2.1+computecanada-py3-none-any.whl (from matplotlib->-r /home/aneumann/projects/def-adhaj/aneumann/GNRS/requirements/or.txt (line 2))
Processing /cvmfs/soft.computecanada.ca/custom/python/wheelhouse/generic/python_dateutil-2.9.0.post0+computecanada-py2.py3-none-any.whl (from matplotlib->-r /home/aneumann/projects/def-adhaj/aneumann/GNRS/requirements/or.txt (line 2))
Processing /cvmfs/soft.computecanada.ca/custom/python/wheelhouse/generic/pytz-2025.2+computecanada-py2.py3-none-any.whl (from pandas->-r /home/aneumann/projects/def-adhaj/aneumann/GNRS/requirements/or.txt (line 3))
Processing /cvmfs/soft.computecanada.ca/custom/python/wheelhouse/generic/tzdata-2025.2+computecanada-py2.py3-none-any.whl (from pandas->-r /home/aneumann/projects/def-adhaj/aneumann/GNRS/requirements/or.txt (line 3))
Processing /cvmfs/soft.computecanada.ca/custom/python/wheelhouse/generic/six-1.17.0+computecanada-py2.py3-none-any.whl (from python-dateutil>=2.7->matplotlib->-r /home/aneumann/projects/def-adhaj/aneumann/GNRS/requirements/or.txt (line 2))
Installing collected packages: pytz, tzdata, six, pyparsing, protobuf, pillow, packaging, numpy, kiwisolver, fonttools, cycler, absl-py, python-dateutil, contourpy, pandas, matplotlib, ortools

Successfully installed absl-py-2.2.2+computecanada contourpy-1.3.1+computecanada cycler-0.12.1+computecanada fonttools-4.58.2+computecanada kiwisolver-1.4.8+computecanada matplotlib-3.10.0+computecanada numpy-2.2.2+computecanada ortools-9.10.4067+computecanada packaging-25.0+computecanada pandas-2.2.3+computecanada pillow-11.1.0+computecanada protobuf-6.30.2+computecanada pyparsing-3.2.1+computecanada python-dateutil-2.9.0.post0+computecanada pytz-2025.2+computecanada six-1.17.0+computecanada tzdata-2025.2+computecanada

Starting CP-SAT solver v9.10.4067
Parameters: max_time_in_seconds: 3600 max_memory_in_mb: 12000 log_search_progress: true enumerate_all_solutions: false absolute_gap_limit: 0 relative_gap_limit: 0
Setting number of workers to 32

Initial optimization model '': (model_fingerprint: 0x4cc51a0b528a05bb)
#Variables: 337 (#ints: 9 in objective)
  - 240 Booleans in [0,1]
  - 97 in [0,700]
#kLinear1: 44
#kLinear2: 604
#kLinear3: 200
#kLinearN: 3'232 (#terms: 51'924)

Starting presolve at 0.00s
  2.56e-03s  0.00e+00d  [DetectDominanceRelations] 
  5.65e-02s  0.00e+00d  [PresolveToFixPoint] #num_loops=6 #num_dual_strengthening=3 
  3.69e-05s  0.00e+00d  [ExtractEncodingFromLinear] #potential_supersets=1 
[Symmetry] Graph for symmetry has 3'959 nodes and 40'243 arcs.
[Symmetry] Symmetry computation done. time: 0.00301121 dtime: 0.00355034
[Symmetry] #generators: 1, average support size: 18
[Symmetry] The model contains 360 duplicate constraints !
[Symmetry] 9 orbits with sizes: 2,2,2,2,2,2,2,2,2
[Symmetry] Num fixable by intersecting at_most_one with orbits: 1 largest_orbit: 2
  1.59e-02s  2.15e-03d  [Probe] #probed=330 #fixed_bools=4 #new_bounds=25 #equiv=1 
  1.78e-05s  0.00e+00d  [MaxClique] 
  2.49e-03s  0.00e+00d  [DetectDominanceRelations] 
  3.07e-02s  0.00e+00d  [PresolveToFixPoint] #num_loops=4 #num_dual_strengthening=3 
  9.30e-03s  0.00e+00d  [ProcessAtMostOneAndLinear] 
  3.77e-03s  0.00e+00d  [DetectDuplicateConstraints] #duplicates=412 #without_enforcements=93 
  2.86e-03s  1.49e-04d  [DetectDominatedLinearConstraints] #relevant_constraints=2'712 #num_inclusions=1'299 #num_redundant=1 
  4.33e-04s  0.00e+00d  [DetectDifferentVariables] #different=34 
  5.21e-04s  0.00e+00d  [ProcessSetPPC] #relevant_constraints=2'286 
  2.74e-05s  0.00e+00d  [FindAlmostIdenticalLinearConstraints] 
  1.32e-05s  0.00e+00d  [FindBigAtMostOneAndLinearOverlap] 
  1.20e-02s  3.98e-03d  [FindBigVerticalLinearOverlap] #blocks=58 #saved_nz=7'242 
  4.24e-04s  1.28e-04d  [FindBigHorizontalLinearOverlap] #linears=2'203 
  2.06e-05s  0.00e+00d  [MergeClauses] 
  2.51e-03s  0.00e+00d  [DetectDominanceRelations] 
  2.98e-02s  0.00e+00d  [PresolveToFixPoint] #num_loops=2 #num_dual_strengthening=1 
  2.52e-03s  0.00e+00d  [DetectDominanceRelations] 
  1.80e-02s  0.00e+00d  [PresolveToFixPoint] #num_loops=1 #num_dual_strengthening=1 
[Symmetry] Graph for symmetry has 3'677 nodes and 31'618 arcs.
[Symmetry] Symmetry computation done. time: 0.00121546 dtime: 0.00197444
  1.40e-02s  1.95e-03d  [Probe] #probed=322 #new_bounds=63 
  1.62e-05s  0.00e+00d  [MaxClique] 
  2.50e-03s  0.00e+00d  [DetectDominanceRelations] 
  2.97e-02s  0.00e+00d  [PresolveToFixPoint] #num_loops=2 #num_dual_strengthening=1 
  7.80e-03s  0.00e+00d  [ProcessAtMostOneAndLinear] 
  3.21e-03s  0.00e+00d  [DetectDuplicateConstraints] #without_enforcements=122 
  1.71e-03s  8.81e-05d  [DetectDominatedLinearConstraints] #relevant_constraints=2'344 #num_inclusions=96 
  4.26e-04s  0.00e+00d  [DetectDifferentVariables] #different=46 #cliques=1 #size=3 
  4.18e-04s  0.00e+00d  [ProcessSetPPC] #relevant_constraints=1'987 
  3.98e-05s  1.75e-07d  [FindAlmostIdenticalLinearConstraints] #num_tested_pairs=10 
  1.44e-05s  0.00e+00d  [FindBigAtMostOneAndLinearOverlap] 
  6.90e-03s  2.58e-03d  [FindBigVerticalLinearOverlap] #blocks=56 #saved_nz=5'307 
  3.39e-04s  8.62e-05d  [FindBigHorizontalLinearOverlap] #linears=1'775 
  2.06e-05s  0.00e+00d  [MergeClauses] 
  2.21e-03s  0.00e+00d  [DetectDominanceRelations] 
  2.81e-02s  0.00e+00d  [PresolveToFixPoint] #num_loops=3 #num_dual_strengthening=1 
  2.19e-03s  0.00e+00d  [DetectDominanceRelations] 
  1.94e-02s  0.00e+00d  [PresolveToFixPoint] #num_loops=1 #num_dual_strengthening=1 
  1.34e-02s  1.80e-03d  [Probe] #probed=322 #new_bounds=48 
  1.66e-05s  0.00e+00d  [MaxClique] 
  2.18e-03s  0.00e+00d  [DetectDominanceRelations] 
  2.85e-02s  0.00e+00d  [PresolveToFixPoint] #num_loops=2 #num_dual_strengthening=1 
  7.14e-03s  0.00e+00d  [ProcessAtMostOneAndLinear] 
  3.09e-03s  0.00e+00d  [DetectDuplicateConstraints] #without_enforcements=122 
  1.43e-03s  7.16e-05d  [DetectDominatedLinearConstraints] #relevant_constraints=2'383 #num_inclusions=51 
  3.08e-04s  0.00e+00d  [DetectDifferentVariables] 
  3.56e-04s  0.00e+00d  [ProcessSetPPC] #relevant_constraints=1'775 
  5.59e-05s  1.10e-06d  [FindAlmostIdenticalLinearConstraints] #num_tested_pairs=43 
  1.61e-05s  0.00e+00d  [FindBigAtMostOneAndLinearOverlap] 
  5.30e-03s  1.82e-03d  [FindBigVerticalLinearOverlap] #blocks=42 #saved_nz=4'167 
  2.79e-04s  5.97e-05d  [FindBigHorizontalLinearOverlap] #linears=1'477 
  2.06e-05s  0.00e+00d  [MergeClauses] 
  1.88e-03s  0.00e+00d  [DetectDominanceRelations] 
  2.53e-02s  0.00e+00d  [PresolveToFixPoint] #num_loops=2 #num_dual_strengthening=1 
  1.17e-04s  0.00e+00d  [ExpandObjective] #entries=873 #tight_variables=199 #tight_constraints=121 

Presolve summary:
  - 74 affine relations were detected.
  - rule 'TODO dual: only one blocking constraint?' was applied 705 times.
  - rule 'TODO dual: only one unspecified blocking constraint?' was applied 117 times.
  - rule 'TODO duplicate: identical constraint with different enforcements' was applied 337 times.
  - rule 'TODO no_overlap: with task always last' was applied 1 time.
  - rule 'affine: new relation' was applied 74 times.
  - rule 'all_diff: inferred from x != y constraints' was applied 1 time.
  - rule 'deductions: 348 stored' was applied 1 time.
  - rule 'dual: fix variable' was applied 24 times.
  - rule 'dual: reduced domain' was applied 60 times.
  - rule 'duplicate: merged rhs of linear constraint' was applied 54 times.
  - rule 'duplicate: removed constraint' was applied 412 times.
  - rule 'enforcement: false literal' was applied 31 times.
  - rule 'enforcement: true literal' was applied 19 times.
  - rule 'exactly_one: x and not(x)' was applied 1 time.
  - rule 'incompatible linear: add implication' was applied 30 times.
  - rule 'linear inclusion: redundant containing constraint' was applied 1 time.
  - rule 'linear matrix: common vertical rectangle' was applied 156 times.
  - rule 'linear: always true' was applied 645 times.
  - rule 'linear: doubleton free' was applied 12 times.
  - rule 'linear: empty' was applied 38 times.
  - rule 'linear: extracted enforcement literal' was applied 5'859 times.
  - rule 'linear: fixed or dup variables' was applied 3'377 times.
  - rule 'linear: positive equal one' was applied 1 time.
  - rule 'linear: reduced variable domains' was applied 275 times.
  - rule 'linear: remapped using affine relations' was applied 3'302 times.
  - rule 'linear: simplified rhs' was applied 12'508 times.
  - rule 'linear: variable substitution 1' was applied 12 times.
  - rule 'linear: variable substitution 2' was applied 8 times.
  - rule 'presolve: 103 unused variables removed.' was applied 1 time.
  - rule 'presolve: iteration' was applied 3 times.
  - rule 'symmetry: fixed to false in general orbit' was applied 1 time.

Presolved optimization model '': (model_fingerprint: 0xa700917f4b45be28)
#Variables: 296 (#ints: 9 in objective)
  - 75 Booleans in [0,1]
  - 188 different domains in [-7697,7549] with a largest complexity of 15.
#kAllDiff: 1
#kLinear2: 680 (#enforced: 609 #multi: 462)
#kLinear3: 609 (#enforced: 500)
#kLinearN: 1'726 (#enforced: 1'617) (#terms: 12'945)

Preloading model.
#Bound   0.40s best:inf   next:[202,5296] initial_domain
#Model   0.41s var:296/296 constraints:3016/3016

Starting search at 0.41s with 32 workers.
16 full problem subsolvers: [core, default_lp, lb_tree_search, max_lp, no_lp, objective_lb_search, objective_lb_search_max_lp, objective_lb_search_no_lp, objective_shaving_search_max_lp, objective_shaving_search_no_lp, probing, probing_max_lp, pseudo_costs, quick_restart, quick_restart_no_lp, reduced_costs]
14 first solution subsolvers: [fj_long_default, fj_long_lin_default, fj_long_random, fj_short_default, fj_short_lin_default, fj_short_lin_random, fj_short_random, fs_random(2), fs_random_no_lp(2), fs_random_quick_restart(2), fs_random_quick_restart_no_lp]
11 incomplete subsolvers: [feasibility_pump, graph_arc_lns, graph_cst_lns, graph_dec_lns, graph_var_lns, rins/rens, rnd_cst_lns, rnd_var_lns, violation_ls(3)]
3 helper subsolvers: [neighborhood_helper, synchronization_agent, update_gap_integral]
#Bound   0.44s best:inf   next:[243,5296] objective_lb_search_no_lp
#1       0.44s best:2241  next:[243,2240] fs_random_quick_restart_no_lp (fixed_bools=0/94)
#2       0.46s best:2112  next:[243,2111] no_lp (fixed_bools=0/105)
#3       0.48s best:2107  next:[243,2106] quick_restart_no_lp (fixed_bools=0/108)
#Bound   0.48s best:2107  next:[244,2106] objective_shaving_search_max_lp (vars=297 csts=3019)
#4       0.49s best:2102  next:[244,2101] quick_restart_no_lp (fixed_bools=0/109)
#Bound   0.50s best:2102  next:[262,2101] default_lp
#5       0.53s best:2097  next:[262,2096] quick_restart_no_lp (fixed_bools=0/112)
#Bound   0.54s best:2097  next:[263,2096] probing
#Bound   0.54s best:2097  next:[264,2096] quick_restart
#6       0.57s best:2093  next:[264,2092] quick_restart_no_lp (fixed_bools=0/123)
#Bound   0.57s best:2093  next:[265,2092] objective_lb_search
#7       0.57s best:2089  next:[265,2088] quick_restart_no_lp (fixed_bools=0/124)
#Bound   0.57s best:2089  next:[267,2088] objective_lb_search
#Bound   0.58s best:2089  next:[291,2088] default_lp
#Bound   0.58s best:2089  next:[303,2088] default_lp
#8       0.59s best:1991  next:[303,1990] no_lp (fixed_bools=0/127)
#Bound   0.63s best:1991  next:[316,1990] probing
#Bound   0.63s best:1991  next:[320,1990] probing
#9       0.66s best:1972  next:[320,1971] quick_restart_no_lp (fixed_bools=0/137)
#10      0.66s best:1959  next:[320,1958] no_lp (fixed_bools=0/137)
#11      0.67s best:1927  next:[320,1926] no_lp (fixed_bools=0/141)
#12      0.68s best:1921  next:[320,1920] no_lp (fixed_bools=0/146)
#Bound   0.69s best:1921  next:[337,1920] probing
#Bound   0.73s best:1921  next:[349,1920] probing
#Bound   0.78s best:1921  next:[355,1920] probing
#Bound   0.81s best:1921  next:[358,1920] quick_restart
#Bound   0.82s best:1921  next:[359,1920] probing
#Bound   0.86s best:1921  next:[360,1920] quick_restart
#Bound   0.86s best:1921  next:[361,1920] quick_restart
#Bound   0.88s best:1921  next:[365,1920] objective_lb_search
#13      0.89s best:1891  next:[365,1890] pseudo_costs (fixed_bools=0/94)
#Bound   0.90s best:1891  next:[366,1890] quick_restart
#14      0.96s best:1881  next:[371,1880] quick_restart_no_lp (fixed_bools=0/157)
#15      0.97s best:1861  next:[371,1860] rnd_cst_lns (d=0.98 s=136 t=0.10 p=1.00 stall=8 h=auto_l0)
#16      1.00s best:1858  next:[456,1857] quick_restart_no_lp (fixed_bools=0/180)
#Bound   0.97s best:1861  next:[456,1860] objective_lb_search_max_lp [skipped_logs=2]
#17      1.00s best:1856  next:[456,1855] violation_ls(batch:8 #solutions_imported:5 #lin_moves:29'599 #lin_evals:200'653 #gen_moves:19'283 #gen_evals:802 #comp_moves:903 #backtracks:9'189 #weight_updates:20'660)
#18      1.00s best:1855  next:[456,1854] violation_ls(batch:9 #solutions_imported:6 #lin_moves:29'599 #lin_evals:200'658 #gen_moves:19'284 #gen_evals:802 #comp_moves:904 #backtracks:9'189 #weight_updates:20'660)
#19      1.08s best:1806  next:[456,1805] graph_dec_lns (d=0.99 s=146 t=0.10 p=1.00 stall=10 h=auto_l0)
#20      1.13s best:1805  next:[456,1804] violation_ls(batch:9 #solutions_imported:7 #lin_moves:44'603 #lin_evals:258'368 #gen_moves:11'461 #gen_evals:574 #comp_moves:617 #backtracks:5'419 #weight_updates:16'242)
#21      1.13s best:1804  next:[456,1803] violation_ls(batch:9 #solutions_imported:7 #lin_moves:24'715 #lin_evals:211'347 #gen_moves:36'893 #gen_evals:2'415 #comp_moves:2'814 #backtracks:17'036 #weight_updates:15'901)
#22      1.13s best:1803  next:[456,1802] violation_ls(batch:10 #solutions_imported:8 #lin_moves:24'715 #lin_evals:211'350 #gen_moves:36'894 #gen_evals:2'415 #comp_moves:2'815 #backtracks:17'036 #weight_updates:15'901)
#23      1.14s best:1802  next:[456,1801] violation_ls(batch:11 #solutions_imported:9 #lin_moves:25'031 #lin_evals:212'942 #gen_moves:36'894 #gen_evals:2'415 #comp_moves:2'815 #backtracks:17'036 #weight_updates:16'081)
#24      1.14s best:1801  next:[456,1800] violation_ls(batch:12 #solutions_imported:10 #lin_moves:25'031 #lin_evals:214'340 #gen_moves:37'426 #gen_evals:2'487 #comp_moves:2'841 #backtracks:17'289 #weight_updates:16'090)
#25      1.15s best:1800  next:[456,1799] violation_ls(batch:11 #solutions_imported:9 #lin_moves:44'854 #lin_evals:263'312 #gen_moves:12'983 #gen_evals:701 #comp_moves:665 #backtracks:6'156 #weight_updates:16'439)
#26      1.15s best:1799  next:[456,1798] violation_ls(batch:12 #solutions_imported:10 #lin_moves:45'038 #lin_evals:264'004 #gen_moves:12'983 #gen_evals:701 #comp_moves:665 #backtracks:6'156 #weight_updates:16'501)
#27      1.15s best:1617  next:[456,1616] graph_arc_lns (d=0.98 s=123 t=0.10 p=1.00 stall=0 h=auto_l0)
#28      1.15s best:1616  next:[456,1615] violation_ls(batch:13 #solutions_imported:9 #lin_moves:39'748 #lin_evals:261'611 #gen_moves:22'470 #gen_evals:991 #comp_moves:1'226 #backtracks:10'621 #weight_updates:30'554)
#29      1.15s best:1615  next:[456,1614] violation_ls(batch:13 #solutions_imported:11 #lin_moves:45'039 #lin_evals:264'013 #gen_moves:12'983 #gen_evals:701 #comp_moves:665 #backtracks:6'156 #weight_updates:16'501)
#30      1.18s best:1603  next:[456,1602] quick_restart_no_lp (fixed_bools=0/227)
#31      1.39s best:1581  next:[894,1580] graph_var_lns (d=0.99 s=187 t=0.10 p=1.00 stall=0 h=auto_l0)
#32      1.78s best:1547  next:[894,1546] max_lp (fixed_bools=0/95)
#33      1.88s best:1537  next:[894,1536] no_lp (fixed_bools=0/184)
#Bound   1.30s best:1603  next:[894,1602] objective_lb_search_no_lp [skipped_logs=1]
#34      2.09s best:1535  next:[894,1534] quick_restart_no_lp (fixed_bools=0/279)
#35      2.13s best:1534  next:[894,1533] violation_ls(batch:16 #solutions_imported:13 #lin_moves:25'042 #lin_evals:266'060 #gen_moves:54'182 #gen_evals:3'767 #comp_moves:4'991 #backtracks:24'592 #weight_updates:16'235)
#36      2.13s best:1533  next:[894,1532] violation_ls(batch:16 #solutions_imported:11 #lin_moves:39'768 #lin_evals:314'737 #gen_moves:42'920 #gen_evals:1'920 #comp_moves:1'972 #backtracks:20'473 #weight_updates:30'805)
#37      2.13s best:1532  next:[894,1531] violation_ls(batch:16 #solutions_imported:13 #lin_moves:55'076 #lin_evals:317'226 #gen_moves:13'000 #gen_evals:701 #comp_moves:668 #backtracks:6'163 #weight_updates:26'465)
#38      2.19s best:1474  next:[894,1473] quick_restart_no_lp (fixed_bools=0/287)
#39      2.29s best:1450  next:[894,1449] quick_restart_no_lp (fixed_bools=0/294)
#Bound   2.78s best:1450  next:[939,1449] objective_lb_search_max_lp [skipped_logs=0]
#Bound   3.84s best:1450  next:[945,1449] objective_lb_search_no_lp [skipped_logs=0]
#Bound   4.79s best:1450  next:[961,1449] objective_lb_search_no_lp [skipped_logs=2]
#Bound   5.30s best:1450  next:[970,1449] objective_lb_search_no_lp [skipped_logs=1]
#Bound   7.50s best:1450  next:[971,1449] objective_lb_search_no_lp
#Bound   7.64s best:1450  next:[990,1449] objective_lb_search [skipped_logs=0]
#Bound   8.70s best:1450  next:[991,1449] objective_lb_search_no_lp [skipped_logs=0]
#Bound   9.83s best:1450  next:[994,1449] objective_lb_search_no_lp [skipped_logs=1]
#Bound  10.69s best:1450  next:[998,1449] objective_lb_search_no_lp [skipped_logs=0]
#Bound  12.16s best:1450  next:[1001,1449] objective_lb_search_no_lp
#Bound  14.16s best:1450  next:[1002,1449] objective_shaving_search_no_lp (vars=316 csts=3037)
#Bound  15.38s best:1450  next:[1011,1449] objective_lb_search_no_lp
#Bound  15.52s best:1450  next:[1013,1449] objective_lb_search_no_lp
#Bound  16.58s best:1450  next:[1014,1449] objective_lb_search_no_lp
#Bound  17.11s best:1450  next:[1016,1449] objective_lb_search_no_lp
#Bound  17.73s best:1450  next:[1021,1449] objective_lb_search_no_lp [skipped_logs=0]
#Bound  18.67s best:1450  next:[1027,1449] objective_lb_search_no_lp [skipped_logs=1]
#Bound  19.27s best:1450  next:[1045,1449] objective_lb_search_no_lp [skipped_logs=0]
#Bound  21.06s best:1450  next:[1054,1449] objective_lb_search_no_lp [skipped_logs=1]
#Model  21.78s var:295/296 constraints:3005/3016
#Bound  22.79s best:1450  next:[1058,1449] objective_lb_search_max_lp
#Bound  24.50s best:1450  next:[1072,1449] objective_lb_search_max_lp
#Bound  25.57s best:1450  next:[1075,1449] objective_lb_search_no_lp
#Bound  26.03s best:1450  next:[1083,1449] objective_lb_search_no_lp
#Bound  26.60s best:1450  next:[1087,1449] objective_lb_search_no_lp
#Bound  27.36s best:1450  next:[1091,1449] objective_lb_search_no_lp
#Model  28.00s var:291/296 constraints:2785/3016
#Bound  28.43s best:1450  next:[1093,1449] objective_lb_search_no_lp
#Bound  28.97s best:1450  next:[1104,1449] objective_lb_search_max_lp [skipped_logs=1]
#Bound  29.99s best:1450  next:[1109,1449] objective_lb_search_max_lp [skipped_logs=1]
#Bound  30.86s best:1450  next:[1161,1449] objective_lb_search_no_lp [skipped_logs=3]
#Model  31.09s var:287/296 constraints:2563/3016
#Model  31.35s var:286/296 constraints:2466/3016
#Model  31.40s var:285/296 constraints:2431/3016
#Model  31.65s var:283/296 constraints:2377/3016
#Model  31.66s var:281/296 constraints:2220/3016
#Model  31.72s var:276/296 constraints:1999/3016
#Model  31.80s var:269/296 constraints:1579/3016
#Done   31.81s pseudo_costs
#Done   31.81s no_lp
#Model  31.81s var:256/296 constraints:957/3016
#Done   31.81s max_lp
#Done   31.81s core
#Done   31.81s probing_max_lp
#Bound  31.80s best:1450  next:[1223,1449] objective_lb_search [skipped_logs=2]

Task timing                                  n [     min,      max]      avg      dev     time         n [     min,      max]      avg      dev    dtime
                             'core':         1 [  31.40s,   31.40s]   31.40s   0.00ns   31.40s         1 [  27.72s,   27.72s]   27.72s   0.00ns   27.72s
                       'default_lp':         1 [  31.40s,   31.40s]   31.40s   0.00ns   31.40s         1 [   5.34s,    5.34s]    5.34s   0.00ns    5.34s
                 'feasibility_pump':       113 [ 11.98ms, 234.93ms] 152.05ms  15.92ms   17.18s       112 [ 21.65ms,  55.51ms]  22.39ms   3.17ms    2.51s
                  'fj_long_default':         1 [139.71ms, 139.71ms] 139.71ms   0.00ns 139.71ms         1 [ 77.05ms,  77.05ms]  77.05ms   0.00ns  77.05ms
              'fj_long_lin_default':         1 [101.74ms, 101.74ms] 101.74ms   0.00ns 101.74ms         1 [ 66.80ms,  66.80ms]  66.80ms   0.00ns  66.80ms
                   'fj_long_random':         1 [ 99.06ms,  99.06ms]  99.06ms   0.00ns  99.06ms         1 [ 54.56ms,  54.56ms]  54.56ms   0.00ns  54.56ms
                 'fj_short_default':         1 [106.00ms, 106.00ms] 106.00ms   0.00ns 106.00ms         1 [ 68.02ms,  68.02ms]  68.02ms   0.00ns  68.02ms
             'fj_short_lin_default':         1 [ 97.93ms,  97.93ms]  97.93ms   0.00ns  97.93ms         1 [ 65.46ms,  65.46ms]  65.46ms   0.00ns  65.46ms
              'fj_short_lin_random':         1 [103.16ms, 103.16ms] 103.16ms   0.00ns 103.16ms         1 [ 66.16ms,  66.16ms]  66.16ms   0.00ns  66.16ms
                  'fj_short_random':         1 [100.33ms, 100.33ms] 100.33ms   0.00ns 100.33ms         1 [ 64.91ms,  64.91ms]  64.91ms   0.00ns  64.91ms
                        'fs_random':         1 [ 29.97ms,  29.97ms]  29.97ms   0.00ns  29.97ms         1 [  5.69us,   5.69us]   5.69us   0.00ns   5.69us
                        'fs_random':         1 [ 30.61ms,  30.61ms]  30.61ms   0.00ns  30.61ms         1 [  5.69us,   5.69us]   5.69us   0.00ns   5.69us
                  'fs_random_no_lp':         1 [ 29.38ms,  29.38ms]  29.38ms   0.00ns  29.38ms         1 [  1.11ms,   1.11ms]   1.11ms   0.00ns   1.11ms
                  'fs_random_no_lp':         1 [ 30.21ms,  30.21ms]  30.21ms   0.00ns  30.21ms         1 [907.91us, 907.91us] 907.91us   0.00ns 907.91us
          'fs_random_quick_restart':         1 [ 29.64ms,  29.64ms]  29.64ms   0.00ns  29.64ms         1 [  5.69us,   5.69us]   5.69us   0.00ns   5.69us
          'fs_random_quick_restart':         1 [ 30.48ms,  30.48ms]  30.48ms   0.00ns  30.48ms         1 [  5.69us,   5.69us]   5.69us   0.00ns   5.69us
    'fs_random_quick_restart_no_lp':         1 [ 30.12ms,  30.12ms]  30.12ms   0.00ns  30.12ms         1 [833.90us, 833.90us] 833.90us   0.00ns 833.90us
                    'graph_arc_lns':       113 [  7.49ms,    1.23s] 720.11ms 404.81ms    1.36m       108 [ 10.00ns, 132.84ms]  63.97ms  41.35ms    6.91s
                    'graph_cst_lns':       112 [846.15us,   3.47ms]   2.79ms 332.02us 312.17ms         0 [  0.00ns,   0.00ns]   0.00ns   0.00ns   0.00ns
                    'graph_dec_lns':       112 [  9.17ms,    1.24s] 680.11ms 400.92ms    1.27m       110 [ 10.00ns, 102.31ms]  58.62ms  41.43ms    6.45s
                    'graph_var_lns':       113 [  7.02ms,    1.25s] 680.10ms 429.53ms    1.28m       111 [ 10.00ns, 102.27ms]  58.12ms  43.24ms    6.45s
                   'lb_tree_search':         1 [  31.40s,   31.40s]   31.40s   0.00ns   31.40s         1 [  10.55s,   10.55s]   10.55s   0.00ns   10.55s
                           'max_lp':         1 [  31.40s,   31.40s]   31.40s   0.00ns   31.40s         1 [   5.74s,    5.74s]    5.74s   0.00ns    5.74s
                            'no_lp':         1 [  31.40s,   31.40s]   31.40s   0.00ns   31.40s         1 [   4.05s,    4.05s]    4.05s   0.00ns    4.05s
              'objective_lb_search':         1 [  31.40s,   31.40s]   31.40s   0.00ns   31.40s         1 [   6.50s,    6.50s]    6.50s   0.00ns    6.50s
       'objective_lb_search_max_lp':         1 [  31.40s,   31.40s]   31.40s   0.00ns   31.40s         1 [   7.71s,    7.71s]    7.71s   0.00ns    7.71s
        'objective_lb_search_no_lp':         1 [  31.40s,   31.40s]   31.40s   0.00ns   31.40s         1 [   3.14s,    3.14s]    3.14s   0.00ns    3.14s
  'objective_shaving_search_max_lp':        56 [ 16.42ms,    2.16s] 553.10ms 547.94ms   30.97s        43 [  1.13ms, 276.04ms]  71.59ms  71.90ms    3.08s
   'objective_shaving_search_no_lp':        56 [ 16.44ms,    2.16s] 554.33ms 547.41ms   31.04s        43 [  1.13ms, 193.52ms]  50.71ms  48.38ms    2.18s
                          'probing':         1 [  31.40s,   31.40s]   31.40s   0.00ns   31.40s         1 [   1.97s,    1.97s]    1.97s   0.00ns    1.97s
                   'probing_max_lp':         1 [  31.40s,   31.40s]   31.40s   0.00ns   31.40s         1 [   2.46s,    2.46s]    2.46s   0.00ns    2.46s
                     'pseudo_costs':         1 [  31.39s,   31.39s]   31.39s   0.00ns   31.39s         1 [   5.78s,    5.78s]    5.78s   0.00ns    5.78s
                    'quick_restart':         1 [  31.40s,   31.40s]   31.40s   0.00ns   31.40s         1 [   7.00s,    7.00s]    7.00s   0.00ns    7.00s
              'quick_restart_no_lp':         1 [  31.40s,   31.40s]   31.40s   0.00ns   31.40s         1 [   4.40s,    4.40s]    4.40s   0.00ns    4.40s
                    'reduced_costs':         1 [  31.40s,   31.40s]   31.40s   0.00ns   31.40s         1 [   5.77s,    5.77s]    5.77s   0.00ns    5.77s
                        'rins/rens':       113 [174.26us,    1.12s] 578.09ms 436.39ms    1.09m        98 [ 10.00ns, 100.39ms]  65.47ms  41.83ms    6.42s
                      'rnd_cst_lns':       113 [  2.77ms,    1.25s] 690.03ms 401.47ms    1.30m       110 [ 10.00ns, 102.16ms]  61.27ms  41.19ms    6.74s
                      'rnd_var_lns':       113 [  4.82ms,    1.38s] 635.72ms 421.22ms    1.20m       111 [ 10.00ns, 102.09ms]  54.24ms  44.23ms    6.02s
                     'violation_ls':       113 [331.36us, 129.31ms] 109.67ms  27.35ms   12.39s       113 [520.00ns,  75.36ms]  60.42ms  16.01ms    6.83s
                     'violation_ls':       113 [331.87us, 138.96ms]  88.22ms  21.96ms    9.97s       113 [400.00ns,  66.37ms]  56.66ms  14.46ms    6.40s
                     'violation_ls':       113 [359.91us, 136.15ms] 110.41ms  31.82ms   12.48s       113 [890.00ns,  73.22ms]  55.99ms  15.77ms    6.33s

Search stats                        Bools  Conflicts  Branches  Restarts  BoolPropag  IntegerPropag
                           'core':  6'126      9'196    26'206     6'651  17'636'040     10'261'982
                     'default_lp':     75      6'981    33'692     4'535     235'843      9'355'676
                      'fs_random':     75          0       150       150           0          5'220
                      'fs_random':     75          0       150       150           0          5'220
                'fs_random_no_lp':     75          0       199       150          23          9'503
                'fs_random_no_lp':     75          0       289       287           1         10'139
        'fs_random_quick_restart':     75          0       150       150           0          5'220
        'fs_random_quick_restart':     75          0       150       150           0          5'220
  'fs_random_quick_restart_no_lp':     94          0       243       151           1          9'363
                 'lb_tree_search':     75         88    33'448     9'110      80'402      3'798'420
                         'max_lp':    355      5'408    41'976     5'605     870'853      9'750'170
                          'no_lp':    525     14'251    43'848     4'818   2'049'316     15'743'098
            'objective_lb_search':    131      3'860    44'254    10'775     266'961      8'504'553
     'objective_lb_search_max_lp':    118      3'310    39'259     9'202     221'651      7'711'661
      'objective_lb_search_no_lp':    194     13'585    33'080     4'058     431'992     14'007'757
                        'probing':    197         10       384       384       1'479         21'823
                 'probing_max_lp':    177         13       341       341       1'776         26'703
                   'pseudo_costs':    417      5'212    41'279     6'277     913'881      9'336'098
                  'quick_restart':     75      1'984    67'601    25'675     176'572      7'356'458
            'quick_restart_no_lp':  2'347     14'392    68'871     6'255   6'001'795     15'596'555
                  'reduced_costs':    671      5'783    46'240     6'684   2'348'796      8'692'173

SAT stats                           ClassicMinim  LitRemoved  LitLearned  LitForgotten  Subsumed  MClauses  MDecisions  MLitTrue  MSubsumed  MLitRemoved  MReused
                           'core':         7'791      43'823      42'357             0        96     2'815      13'915         0         38          122       34
                     'default_lp':         3'399       6'583      60'482             0       415     2'346      24'405         0        852        5'912      578
                      'fs_random':             0           0           0             0         0         0           0         0          0            0        0
                      'fs_random':             0           0           0             0         0         0           0         0          0            0        0
                'fs_random_no_lp':             0           0           0             0         0         0           0         0          0            0        0
                'fs_random_no_lp':             0           0           0             0         0         0           0         0          0            0        0
        'fs_random_quick_restart':             0           0           0             0         0         0           0         0          0            0        0
        'fs_random_quick_restart':             0           0           0             0         0         0           0         0          0            0        0
  'fs_random_quick_restart_no_lp':             0           0           0             0         0         0           0         0          0            0        0
                 'lb_tree_search':             3           3         285             0         1     3'220      15'903         2         17           76      443
                         'max_lp':         2'487       4'663      48'814             0       327     2'809      33'206         0        731        5'299      727
                          'no_lp':         9'296      23'276     141'066        24'068       420     2'518      23'506        12      1'326        9'653      411
            'objective_lb_search':         2'308       4'712      24'944             0       293     4'397      34'941         0        839        4'793    1'284
     'objective_lb_search_max_lp':         1'956       4'072      22'681             0       224     3'177      30'002         0        288        1'703      958
      'objective_lb_search_no_lp':         9'613      24'258      92'583             0       454     1'951      15'510         0        756        4'505      448
                        'probing':             0           0          10             0         0         0           0         0          0            0        0
                 'probing_max_lp':             0           0          13             0         0         0           0         0          0            0        0
                   'pseudo_costs':         3'038       7'020      48'740             0       274     2'750      31'484         1        637        4'445      616
                  'quick_restart':           797       1'252      23'194             0        83     8'505      49'159         0         72          352    1'041
            'quick_restart_no_lp':         9'817      35'625     152'498        42'542       457     2'630      23'748        11        956        6'453      402
                  'reduced_costs':         3'721       8'925      52'359             0       181     2'965      24'647         0        985        6'203      643

Lp stats                         Component  Iterations  AddedCuts  OPTIMAL  DUAL_F.  DUAL_U.
                  'default_lp':          1     105'569      5'548   10'594        0        1
                   'fs_random':          1         126         72        3        0        0
                   'fs_random':          1         126         77        3        0        0
     'fs_random_quick_restart':          1         126         69        3        0        0
     'fs_random_quick_restart':          1         126         70        3        0        0
              'lb_tree_search':          1     220'528      5'706    9'230    2'782        0
                      'max_lp':          1      88'642      6'135    6'530    2'319        3
         'objective_lb_search':          1     109'760      4'901    6'329        0        2
  'objective_lb_search_max_lp':          1     134'156      4'211    4'711    1'567        2
                     'probing':          1      14'479      3'613    1'334        1        5
              'probing_max_lp':          1       7'146      3'826      821       50        0
                'pseudo_costs':          1      94'612      5'640    6'551    1'931        5
               'quick_restart':          1     111'964      4'902    7'614        0        0
               'reduced_costs':          1      95'952      7'112    7'130    1'721        2

Lp dimension                                                                     Final dimension of first component
                  'default_lp':  630 rows, 292 columns, 1937 entries with magnitude in [1.084976e-03, 1.000000e+00]
                   'fs_random':   128 rows, 292 columns, 682 entries with magnitude in [8.451543e-02, 1.000000e+00]
                   'fs_random':   128 rows, 292 columns, 682 entries with magnitude in [8.451543e-02, 1.000000e+00]
     'fs_random_quick_restart':   128 rows, 292 columns, 682 entries with magnitude in [8.451543e-02, 1.000000e+00]
     'fs_random_quick_restart':   128 rows, 292 columns, 682 entries with magnitude in [8.451543e-02, 1.000000e+00]
              'lb_tree_search':  806 rows, 296 columns, 2835 entries with magnitude in [5.670909e-03, 1.000000e+00]
                      'max_lp':  796 rows, 296 columns, 2315 entries with magnitude in [7.354854e-03, 1.000000e+00]
         'objective_lb_search':  717 rows, 292 columns, 2561 entries with magnitude in [4.566394e-05, 1.000000e+00]
  'objective_lb_search_max_lp':  873 rows, 296 columns, 3041 entries with magnitude in [1.061963e-03, 1.000000e+00]
                     'probing':  699 rows, 292 columns, 5677 entries with magnitude in [1.390404e-03, 1.000000e+00]
              'probing_max_lp':  458 rows, 296 columns, 3278 entries with magnitude in [9.580070e-03, 1.000000e+00]
                'pseudo_costs':  875 rows, 296 columns, 3285 entries with magnitude in [1.833158e-04, 1.000000e+00]
               'quick_restart':  694 rows, 292 columns, 2496 entries with magnitude in [1.267217e-04, 1.000000e+00]
               'reduced_costs':  372 rows, 296 columns, 1440 entries with magnitude in [1.361141e-02, 1.000000e+00]

Lp debug                         CutPropag  CutEqPropag  Adjust  Overflow        Bad  BadScaling
                  'default_lp':         19            9   2'365         0     85'579           0
                   'fs_random':          0            0       0         0        105           0
                   'fs_random':          0            0       0         0         86           0
     'fs_random_quick_restart':          0            0       0         0         72           0
     'fs_random_quick_restart':          0            0       0         0         83           0
              'lb_tree_search':         41            2   6'203         0    102'505           0
                      'max_lp':         21            2   2'438         0     60'055           0
         'objective_lb_search':         27           10   2'415         0    145'680           0
  'objective_lb_search_max_lp':         40            2   3'569         0    108'468           0
                     'probing':          2           14   1'014         0  1'244'904           0
              'probing_max_lp':         10            3     756         0    818'397           0
                'pseudo_costs':         50            0   2'679         0     99'244           0
               'quick_restart':         22            5   2'938         0    196'128           0
               'reduced_costs':         17            2   3'359         0     81'393           0

Lp pool                          Constraints  Updates  Simplif  Merged  Shortened  Split  Strenghtened     Cuts/Call
                  'default_lp':        5'822      204   29'149      15      6'019  1'708         6'808  5'548/17'238
                   'fs_random':          361        0        0       0          0      0             4         72/94
                   'fs_random':          366        0        0       0          0      0             5        77/104
     'fs_random_quick_restart':          358        0        0       0          0      0             3         69/85
     'fs_random_quick_restart':          359        0        0       0          0      0             4         70/92
              'lb_tree_search':        8'714      168   34'205       7      7'767  1'225        17'624  5'706/17'742
                      'max_lp':        9'107      130   27'568      43      7'611    670        13'983  6'135/16'002
         'objective_lb_search':        5'167      284   23'556      23      6'616  3'274         5'736  4'901/13'477
  'objective_lb_search_max_lp':        7'226      149   28'643       0      6'752  1'069        16'539  4'211/11'392
                     'probing':        3'902      316    2'123       0      1'250    330         2'128   3'613/7'098
              'probing_max_lp':        6'840       90      806       1          0    352         2'453   3'826/7'640
                'pseudo_costs':        8'641      181   36'935      14      6'187  1'376        16'413  5'640/15'444
               'quick_restart':        5'186      255   27'971       5      5'157  4'886         4'561  4'902/15'471
               'reduced_costs':       10'101      110   12'660      26      3'086  1'577         9'712  7'112/19'747

Lp Cut            fs_ran  fs_ran  fs_ran  fs_ran  defaul  max_lp  quick_  reduce  pseudo  lb_tre  probin  object  probin  object
          CG_FF:       -       -       -       -     239     281     127     302     151     179     104     167     177     110
           CG_K:       -       -       -       -     131     184      68     238      93     111      49      71     103      61
           CG_R:       -       -       -       -      88     146      37     210      73     116      27      62     113      72
          CG_RB:       -       -       -       -     670     941     446     910     508     727     374     585     601     338
         CG_RBP:       -       -       -       -      74      43      49     110      33      27      44      38      31      35
         Clique:       -       -       -       -       -      78       -      65      80      83       -       -      45      84
             IB:      50      50      50      50     927     564   1'010     727     687     513     695     818     198     647
       MIR_1_FF:      13       8      12      10     355     381     300     399     368     369     209     307     247     276
        MIR_1_K:       2       2       -       1      48      58      35      65      41      37      28      29      20      33
       MIR_1_KL:       -       -       -       -       3       -       6       1       1       3       -       -       -       -
        MIR_1_R:       4       3       4       2      57      36      43      39      28      24      32      38      17      22
       MIR_1_RB:       4       3       4       4     617     664     480     787     649     676     333     535     425     458
      MIR_1_RBP:       1       -       -       1      59     122      33     138     106     110      29      42      74      67
       MIR_2_FF:       1       -       -       1     149     171     135     194     163     147      73     117      80     100
        MIR_2_K:       -       2       1       -      25      35      24      52      38      32      16      19      17      14
       MIR_2_KL:       -       -       -       -       3       -       3       8       5       2       3       1       1       1
        MIR_2_R:       -       -       -       -      27      35      49      49      46      33      39      35      19      20
       MIR_2_RB:       -       1       -       1     278     318     271     435     370     329     168     255     156     227
      MIR_2_RBP:       -       -       -       -      42      63      27      92      76      46      16      26      27      38
       MIR_3_FF:       1       -       1       -      75     104      83     112      83      82      34      66      61      57
        MIR_3_K:       -       -       -       -      18      38      11      18      19      29       6       7       6      12
       MIR_3_KL:       -       -       -       -       2       1       -       3       1       -       -       1       -       4
        MIR_3_R:       1       -       -       -      29      60      47      54      53      68      34      30      41      23
       MIR_3_RB:       -       -       -       -     208     205     180     259     207     237     119     176     125     146
      MIR_3_RBP:       -       -       -       -      44      57      29      58      37      34       8      23      21      32
       MIR_4_FF:       -       -       -       -      55      68      59      75      77      55      24      47      33      30
        MIR_4_K:       -       -       -       -      14      25      10      20      16      11       9      11       4       9
       MIR_4_KL:       -       -       -       -       1       -       1       4       -       1       -       -       -       -
        MIR_4_R:       -       -       -       -      43      35      44      42      51      29      28      31      18      29
       MIR_4_RB:       -       -       -       -     148     136     108     172     138     145      59     123      51      98
      MIR_4_RBP:       -       -       -       -      22      24      13      35      24      21       9       6       3      14
       MIR_5_FF:       -       -       -       -      51      58      37      68      52      36      28      27      27      26
        MIR_5_K:       -       -       -       -      19      14      14      16      16       5       8      11       4       9
       MIR_5_KL:       -       -       -       -       2       -       -       -       1       -       -       -       -       -
        MIR_5_R:       -       -       -       -      37      39      24      32      41      33      14      22      20      21
       MIR_5_RB:       -       -       -       -     122      93      70     114     100      98      49      95      37      61
      MIR_5_RBP:       -       -       -       -      13      16       6      17      14      12       1       2       2       4
       MIR_6_FF:       -       -       -       -      38      33      15      25      23      26      13      12      13      16
        MIR_6_K:       -       -       -       -      10      10       8      11      12       8       5      11       2       4
       MIR_6_KL:       -       -       -       -       -       -       1       -       -       -       -       1       -       -
        MIR_6_R:       -       -       -       -      22      23      14      20      16      11       9      14       7      10
       MIR_6_RB:       -       -       -       -      81      72      40      61      55      61      27      41      19      39
      MIR_6_RBP:       -       -       -       -       3      13       2      12      10       6       4       -       1       5
   ZERO_HALF_FF:       -       -       -       -      57      78      41     100      75      69      31      40      52      37
    ZERO_HALF_K:       -       -       -       -       9      23       5      22      16      14       6       4       8       7
    ZERO_HALF_R:       -       -       -       -     435     533     776     699     747     820     679     764     807     779
   ZERO_HALF_RB:       -       -       -       -     165     222      99     210     196     202     130     166     101     117
  ZERO_HALF_RBP:       -       -       -       -      33      35      22      32      44      29      40      25      12      19

LNS stats           Improv/Calls  Closed  Difficulty  TimeLimit
  'graph_arc_lns':         8/112     54%        0.98       0.10
  'graph_cst_lns':           0/0      0%        0.50       0.10
  'graph_dec_lns':         6/112     56%        0.99       0.10
  'graph_var_lns':         7/112     56%        0.99       0.10
      'rins/rens':        19/110     53%        0.91       0.10
    'rnd_cst_lns':         7/112     55%        0.99       0.10
    'rnd_var_lns':         5/113     58%        0.99       0.10

LS stats                   Batches  Restarts  LinMoves  GenMoves  CompoundMoves  WeightUpdates
       'fj_long_default':        1         1     9'853         0              0            147
   'fj_long_lin_default':        1         1         0     3'133            554              2
        'fj_long_random':        1         1     6'462         0              0            109
      'fj_short_default':        1         1         0     3'059            406              1
  'fj_short_lin_default':        1         1         0     2'889            383              1
   'fj_short_lin_random':        1         1         0     3'181            680              2
       'fj_short_random':        1         1         0     3'129            439              1
          'violation_ls':      113         0    25'042   546'351         48'093         16'473
          'violation_ls':      113         0    55'076   941'320         11'880         30'007
          'violation_ls':      113         0   993'097    42'920          1'972         44'748

Solutions (39)                      Num     Rank
  'fs_random_quick_restart_no_lp':    1    [1,1]
                  'graph_arc_lns':    1  [27,27]
                  'graph_dec_lns':    1  [19,19]
                  'graph_var_lns':    1  [31,31]
                         'max_lp':    1  [32,32]
                          'no_lp':    6   [2,33]
                   'pseudo_costs':    1  [13,13]
            'quick_restart_no_lp':   12   [3,39]
                    'rnd_cst_lns':    1  [15,15]
                   'violation_ls':   14  [17,37]

Objective bounds                      Num
                       'default_lp':    4
                   'initial_domain':    1
              'objective_lb_search':    8
       'objective_lb_search_max_lp':    7
        'objective_lb_search_no_lp':   35
  'objective_shaving_search_max_lp':    1
   'objective_shaving_search_no_lp':    1
                          'probing':    7
                    'quick_restart':    5

Solution repositories    Added  Queried  Ignored  Synchro
  'feasible solutions':    663    1'997        1      639
        'lp solutions':    252       49        0      210
                'pump':  2'350       64

Improving bounds shared          Num
                        'core':   39
                  'default_lp':   52
             'fs_random_no_lp':    7
              'lb_tree_search':   81
                      'max_lp':   22
                       'no_lp':  721
         'objective_lb_search':   12
  'objective_lb_search_max_lp':  167
                     'probing':   18
              'probing_max_lp':   21
                'pseudo_costs':  121
               'quick_restart':   75
         'quick_restart_no_lp':  255
               'reduced_costs':  115

Clauses shared                   Num
                        'core':    4
                  'default_lp':   19
              'lb_tree_search':   23
                      'max_lp':    2
                       'no_lp':   34
         'objective_lb_search':    2
  'objective_lb_search_max_lp':   37
   'objective_lb_search_no_lp':    6
                'pseudo_costs':    8
               'quick_restart':   22
         'quick_restart_no_lp':   24
               'reduced_costs':    9

CpSolverResponse summary:
status: OPTIMAL
objective: 1450
best_bound: 1450
integers: 293
booleans: 75
conflicts: 0
branches: 150
propagations: 0
integer_propagations: 5220
restarts: 150
lp_iterations: 126
walltime: 31.8942
usertime: 31.8942
deterministic_time: 164.933
gap_integral: 456.975
solution_fingerprint: 0x3fdaf1b7d953da8


--- Simulation Gantt  partir du modle mathmatique ---
{'big':1, 'due_date':142, 'pos_time':5, 'status':0, 'blocked':0, 'operations':["{'type':1, 'processing_time':45}", "{'type':0, 'processing_time':52}"]}
{'big':1, 'due_date':133, 'pos_time':5, 'status':0, 'blocked':0, 'operations':["{'type':0, 'processing_time':49}"]}
{'big':0, 'due_date':121, 'pos_time':5, 'status':0, 'blocked':0, 'operations':["{'type':0, 'processing_time':59}", "{'type':1, 'processing_time':18}"]}
{'big':1, 'due_date':120, 'pos_time':5, 'status':0, 'blocked':0, 'operations':["{'type':1, 'processing_time':23}", "{'type':0, 'processing_time':39}"]}
{'big':1, 'due_date':134, 'pos_time':5, 'status':0, 'blocked':0, 'operations':["{'type':0, 'processing_time':49}"]}
{'big':1, 'due_date':90, 'pos_time':5, 'status':0, 'blocked':0, 'operations':["{'type':1, 'processing_time':55}"]}
{'big':1, 'due_date':125, 'pos_time':5, 'status':0, 'blocked':0, 'operations':["{'type':0, 'processing_time':20}"]}
{'big':1, 'due_date':139, 'pos_time':5, 'status':0, 'blocked':0, 'operations':["{'type':1, 'processing_time':59}", "{'type':0, 'processing_time':16}"]}
