created virtual environment CPython3.12.4.final.0-64 in 7495ms
  creator CPython3Posix(dest=/localscratch/aneumann.63390777.0/env, clear=False, no_vcs_ignore=False, global=False)
  seeder FromAppData(download=False, pip=bundle, via=copy, app_data_dir=/home/aneumann/.local/share/virtualenv)
    added seed packages: pip==25.1.1
  activators BashActivator,CShellActivator,FishActivator,NushellActivator,PowerShellActivator,PythonActivator
Looking in links: /cvmfs/soft.computecanada.ca/custom/python/wheelhouse/gentoo2023/x86-64-v3, /cvmfs/soft.computecanada.ca/custom/python/wheelhouse/gentoo2023/generic, /cvmfs/soft.computecanada.ca/custom/python/wheelhouse/generic
Requirement already satisfied: pip in /localscratch/aneumann.63390777.0/env/lib/python3.12/site-packages (25.1.1)
Looking in links: /cvmfs/soft.computecanada.ca/custom/python/wheelhouse/gentoo2023/x86-64-v3, /cvmfs/soft.computecanada.ca/custom/python/wheelhouse/gentoo2023/generic, /cvmfs/soft.computecanada.ca/custom/python/wheelhouse/generic
ERROR: protobuf-5.28.3-cp38-abi3-manylinux2014_x86_64.whl is not a supported wheel on this platform.
Looking in links: /cvmfs/soft.computecanada.ca/custom/python/wheelhouse/gentoo2023/x86-64-v3, /cvmfs/soft.computecanada.ca/custom/python/wheelhouse/gentoo2023/generic, /cvmfs/soft.computecanada.ca/custom/python/wheelhouse/generic
Processing /home/aneumann/projects/def-adhaj/aneumann/GNRS/wheels/immutabledict-4.2.0-py3-none-any.whl
Installing collected packages: immutabledict
Successfully installed immutabledict-4.2.0
Looking in links: /cvmfs/soft.computecanada.ca/custom/python/wheelhouse/gentoo2023/x86-64-v3, /cvmfs/soft.computecanada.ca/custom/python/wheelhouse/gentoo2023/generic, /cvmfs/soft.computecanada.ca/custom/python/wheelhouse/generic
Processing /cvmfs/soft.computecanada.ca/custom/python/wheelhouse/generic/ortools-9.10.4067+computecanada-cp312-cp312-linux_x86_64.whl (from -r /home/aneumann/projects/def-adhaj/aneumann/GNRS/requirements/or.txt (line 1))
Processing /cvmfs/soft.computecanada.ca/custom/python/wheelhouse/gentoo2023/x86-64-v3/matplotlib-3.10.0+computecanada-cp312-cp312-linux_x86_64.whl (from -r /home/aneumann/projects/def-adhaj/aneumann/GNRS/requirements/or.txt (line 2))
Processing /cvmfs/soft.computecanada.ca/custom/python/wheelhouse/gentoo2023/x86-64-v3/pandas-2.2.3+computecanada-cp312-cp312-linux_x86_64.whl (from -r /home/aneumann/projects/def-adhaj/aneumann/GNRS/requirements/or.txt (line 3))
Processing /cvmfs/soft.computecanada.ca/custom/python/wheelhouse/generic/absl_py-2.2.2+computecanada-py3-none-any.whl (from ortools<9.11,>=9.10->-r /home/aneumann/projects/def-adhaj/aneumann/GNRS/requirements/or.txt (line 1))
Processing /cvmfs/soft.computecanada.ca/custom/python/wheelhouse/gentoo2023/generic/numpy-2.2.2+computecanada-cp312-cp312-linux_x86_64.whl (from ortools<9.11,>=9.10->-r /home/aneumann/projects/def-adhaj/aneumann/GNRS/requirements/or.txt (line 1))
Processing /cvmfs/soft.computecanada.ca/custom/python/wheelhouse/gentoo2023/x86-64-v3/protobuf-6.30.2+computecanada-cp312-cp312-linux_x86_64.whl (from ortools<9.11,>=9.10->-r /home/aneumann/projects/def-adhaj/aneumann/GNRS/requirements/or.txt (line 1))
Requirement already satisfied: immutabledict>=3.0.0 in /localscratch/aneumann.63390777.0/env/lib/python3.12/site-packages (from ortools<9.11,>=9.10->-r /home/aneumann/projects/def-adhaj/aneumann/GNRS/requirements/or.txt (line 1)) (4.2.0)
Processing /cvmfs/soft.computecanada.ca/custom/python/wheelhouse/gentoo2023/generic/contourpy-1.3.1+computecanada-cp312-cp312-linux_x86_64.whl (from matplotlib->-r /home/aneumann/projects/def-adhaj/aneumann/GNRS/requirements/or.txt (line 2))
Processing /cvmfs/soft.computecanada.ca/custom/python/wheelhouse/generic/cycler-0.12.1+computecanada-py3-none-any.whl (from matplotlib->-r /home/aneumann/projects/def-adhaj/aneumann/GNRS/requirements/or.txt (line 2))
Processing /cvmfs/soft.computecanada.ca/custom/python/wheelhouse/generic/fonttools-4.58.2+computecanada-cp312-cp312-linux_x86_64.whl (from matplotlib->-r /home/aneumann/projects/def-adhaj/aneumann/GNRS/requirements/or.txt (line 2))
Processing /cvmfs/soft.computecanada.ca/custom/python/wheelhouse/gentoo2023/x86-64-v3/kiwisolver-1.4.8+computecanada-cp312-cp312-linux_x86_64.whl (from matplotlib->-r /home/aneumann/projects/def-adhaj/aneumann/GNRS/requirements/or.txt (line 2))
Processing /cvmfs/soft.computecanada.ca/custom/python/wheelhouse/generic/packaging-25.0+computecanada-py3-none-any.whl (from matplotlib->-r /home/aneumann/projects/def-adhaj/aneumann/GNRS/requirements/or.txt (line 2))
Processing /cvmfs/soft.computecanada.ca/custom/python/wheelhouse/gentoo2023/x86-64-v3/pillow-11.1.0+computecanada-cp312-cp312-linux_x86_64.whl (from matplotlib->-r /home/aneumann/projects/def-adhaj/aneumann/GNRS/requirements/or.txt (line 2))
Processing /cvmfs/soft.computecanada.ca/custom/python/wheelhouse/generic/pyparsing-3.2.1+computecanada-py3-none-any.whl (from matplotlib->-r /home/aneumann/projects/def-adhaj/aneumann/GNRS/requirements/or.txt (line 2))
Processing /cvmfs/soft.computecanada.ca/custom/python/wheelhouse/generic/python_dateutil-2.9.0.post0+computecanada-py2.py3-none-any.whl (from matplotlib->-r /home/aneumann/projects/def-adhaj/aneumann/GNRS/requirements/or.txt (line 2))
Processing /cvmfs/soft.computecanada.ca/custom/python/wheelhouse/generic/pytz-2025.2+computecanada-py2.py3-none-any.whl (from pandas->-r /home/aneumann/projects/def-adhaj/aneumann/GNRS/requirements/or.txt (line 3))
Processing /cvmfs/soft.computecanada.ca/custom/python/wheelhouse/generic/tzdata-2025.2+computecanada-py2.py3-none-any.whl (from pandas->-r /home/aneumann/projects/def-adhaj/aneumann/GNRS/requirements/or.txt (line 3))
Processing /cvmfs/soft.computecanada.ca/custom/python/wheelhouse/generic/six-1.17.0+computecanada-py2.py3-none-any.whl (from python-dateutil>=2.7->matplotlib->-r /home/aneumann/projects/def-adhaj/aneumann/GNRS/requirements/or.txt (line 2))
Installing collected packages: pytz, tzdata, six, pyparsing, protobuf, pillow, packaging, numpy, kiwisolver, fonttools, cycler, absl-py, python-dateutil, contourpy, pandas, matplotlib, ortools

Successfully installed absl-py-2.2.2+computecanada contourpy-1.3.1+computecanada cycler-0.12.1+computecanada fonttools-4.58.2+computecanada kiwisolver-1.4.8+computecanada matplotlib-3.10.0+computecanada numpy-2.2.2+computecanada ortools-9.10.4067+computecanada packaging-25.0+computecanada pandas-2.2.3+computecanada pillow-11.1.0+computecanada protobuf-6.30.2+computecanada pyparsing-3.2.1+computecanada python-dateutil-2.9.0.post0+computecanada pytz-2025.2+computecanada six-1.17.0+computecanada tzdata-2025.2+computecanada

Starting CP-SAT solver v9.10.4067
Parameters: max_time_in_seconds: 3600 max_memory_in_mb: 12000 log_search_progress: true enumerate_all_solutions: false absolute_gap_limit: 0 relative_gap_limit: 0
Setting number of workers to 48

Initial optimization model '': (model_fingerprint: 0x3daf2a6280051c39)
#Variables: 145 (#ints: 6 in objective)
  - 90 Booleans in [0,1]
  - 55 in [0,362]
#kLinear1: 17
#kLinear2: 176
#kLinear3: 87
#kLinearN: 500 (#terms: 5'049)

Starting presolve at 0.00s
  3.04e-04s  0.00e+00d  [DetectDominanceRelations] 
  7.43e-03s  0.00e+00d  [PresolveToFixPoint] #num_loops=5 #num_dual_strengthening=3 
  1.68e-05s  0.00e+00d  [ExtractEncodingFromLinear] #potential_supersets=2 
[Symmetry] Graph for symmetry has 750 nodes and 3'151 arcs.
[Symmetry] Symmetry computation done. time: 0.000427241 dtime: 0.0002698
[SAT presolve] num removable Booleans: 0 / 32
[SAT presolve] num trivial clauses: 0
[SAT presolve] [0s] clauses:8 literals:24 vars:16 one_side_vars:15 simple_definition:1 singleton_clauses:0
[SAT presolve] [3.8233e-05s] clauses:8 literals:24 vars:16 one_side_vars:15 simple_definition:1 singleton_clauses:0
[SAT presolve] [5.0298e-05s] clauses:8 literals:24 vars:16 one_side_vars:15 simple_definition:1 singleton_clauses:0
  1.95e-03s  2.06e-04d  [Probe] #probed=146 #fixed_bools=1 #new_bounds=13 #new_binary_clauses=13 
  9.55e-06s  0.00e+00d  [MaxClique] 
  2.87e-04s  0.00e+00d  [DetectDominanceRelations] 
  3.13e-03s  0.00e+00d  [PresolveToFixPoint] #num_loops=4 #num_dual_strengthening=3 
  7.20e-04s  0.00e+00d  [ProcessAtMostOneAndLinear] 
  5.16e-04s  0.00e+00d  [DetectDuplicateConstraints] #duplicates=94 #without_enforcements=31 
  2.61e-04s  7.85e-06d  [DetectDominatedLinearConstraints] #relevant_constraints=320 #num_inclusions=184 #num_redundant=4 
  1.28e-04s  0.00e+00d  [DetectDifferentVariables] #different=15 #cliques=1 #size=3 
  7.72e-05s  1.95e-06d  [ProcessSetPPC] #relevant_constraints=137 
  8.96e-06s  0.00e+00d  [FindAlmostIdenticalLinearConstraints] 
  3.50e-05s  1.72e-05d  [FindBigAtMostOneAndLinearOverlap] 
  5.10e-04s  1.52e-04d  [FindBigVerticalLinearOverlap] #blocks=4 #saved_nz=165 
  3.22e-05s  5.32e-06d  [FindBigHorizontalLinearOverlap] #linears=112 
  1.85e-05s  1.20e-07d  [MergeClauses] 
  2.69e-04s  0.00e+00d  [DetectDominanceRelations] 
  2.14e-03s  0.00e+00d  [PresolveToFixPoint] #num_loops=2 #num_dual_strengthening=1 
  2.70e-04s  0.00e+00d  [DetectDominanceRelations] 
  1.56e-03s  0.00e+00d  [PresolveToFixPoint] #num_loops=1 #num_dual_strengthening=1 
[Symmetry] Graph for symmetry has 665 nodes and 2'727 arcs.
[Symmetry] Symmetry computation done. time: 0.000184051 dtime: 0.00019782
[SAT presolve] num removable Booleans: 0 / 31
[SAT presolve] num trivial clauses: 0
[SAT presolve] [0s] clauses:8 literals:24 vars:16 one_side_vars:15 simple_definition:1 singleton_clauses:0
[SAT presolve] [2.9659e-05s] clauses:8 literals:24 vars:16 one_side_vars:15 simple_definition:1 singleton_clauses:0
[SAT presolve] [4.131e-05s] clauses:8 literals:24 vars:16 one_side_vars:15 simple_definition:1 singleton_clauses:0
  1.83e-03s  1.90e-04d  [Probe] #probed=140 #new_binary_clauses=13 
  7.47e-06s  0.00e+00d  [MaxClique] 
  2.70e-04s  0.00e+00d  [DetectDominanceRelations] 
  1.61e-03s  0.00e+00d  [PresolveToFixPoint] #num_loops=1 #num_dual_strengthening=1 
  5.24e-04s  0.00e+00d  [ProcessAtMostOneAndLinear] 
  4.13e-04s  0.00e+00d  [DetectDuplicateConstraints] #without_enforcements=31 
  1.39e-04s  4.45e-06d  [DetectDominatedLinearConstraints] #relevant_constraints=208 #num_inclusions=27 
  4.38e-05s  0.00e+00d  [DetectDifferentVariables] 
  6.97e-05s  1.76e-06d  [ProcessSetPPC] #relevant_constraints=120 
  1.10e-05s  0.00e+00d  [FindAlmostIdenticalLinearConstraints] 
  2.94e-05s  1.59e-05d  [FindBigAtMostOneAndLinearOverlap] 
  4.23e-04s  1.42e-04d  [FindBigVerticalLinearOverlap] #blocks=2 #saved_nz=77 
  2.95e-05s  4.91e-06d  [FindBigHorizontalLinearOverlap] #linears=112 
  1.79e-05s  1.20e-07d  [MergeClauses] 
  2.71e-04s  0.00e+00d  [DetectDominanceRelations] 
  1.96e-03s  0.00e+00d  [PresolveToFixPoint] #num_loops=2 #num_dual_strengthening=1 
  2.62e-04s  0.00e+00d  [DetectDominanceRelations] 
  1.62e-03s  0.00e+00d  [PresolveToFixPoint] #num_loops=1 #num_dual_strengthening=1 
[Symmetry] Graph for symmetry has 668 nodes and 2'649 arcs.
[Symmetry] Symmetry computation done. time: 0.000183106 dtime: 0.00019282
[SAT presolve] num removable Booleans: 0 / 31
[SAT presolve] num trivial clauses: 0
[SAT presolve] [0s] clauses:8 literals:24 vars:16 one_side_vars:15 simple_definition:1 singleton_clauses:0
[SAT presolve] [2.9217e-05s] clauses:8 literals:24 vars:16 one_side_vars:15 simple_definition:1 singleton_clauses:0
[SAT presolve] [4.0425e-05s] clauses:8 literals:24 vars:16 one_side_vars:15 simple_definition:1 singleton_clauses:0
  1.78e-03s  1.87e-04d  [Probe] #probed=140 #new_bounds=2 #new_binary_clauses=13 
  5.28e-06s  0.00e+00d  [MaxClique] 
  2.71e-04s  0.00e+00d  [DetectDominanceRelations] 
  1.94e-03s  0.00e+00d  [PresolveToFixPoint] #num_loops=2 #num_dual_strengthening=1 
  5.09e-04s  0.00e+00d  [ProcessAtMostOneAndLinear] 
  4.13e-04s  0.00e+00d  [DetectDuplicateConstraints] #without_enforcements=33 
  1.22e-04s  3.92e-06d  [DetectDominatedLinearConstraints] #relevant_constraints=204 #num_inclusions=17 
  4.43e-05s  0.00e+00d  [DetectDifferentVariables] 
  6.53e-05s  1.52e-06d  [ProcessSetPPC] #relevant_constraints=114 
  1.11e-05s  0.00e+00d  [FindAlmostIdenticalLinearConstraints] 
  2.90e-05s  1.47e-05d  [FindBigAtMostOneAndLinearOverlap] 
  3.11e-04s  1.28e-04d  [FindBigVerticalLinearOverlap] 
  2.76e-05s  4.65e-06d  [FindBigHorizontalLinearOverlap] #linears=106 
  1.78e-05s  1.20e-07d  [MergeClauses] 
  2.66e-04s  0.00e+00d  [DetectDominanceRelations] 
  1.64e-03s  0.00e+00d  [PresolveToFixPoint] #num_loops=1 #num_dual_strengthening=1 
  2.52e-05s  0.00e+00d  [ExpandObjective] #entries=32 #tight_variables=16 #tight_constraints=7 

Presolve summary:
  - 20 affine relations were detected.
  - rule 'TODO dual: make linear1 equiv' was applied 36 times.
  - rule 'TODO dual: only one blocking constraint?' was applied 456 times.
  - rule 'TODO dual: only one unspecified blocking constraint?' was applied 78 times.
  - rule 'TODO duplicate: identical constraint with different enforcements' was applied 95 times.
  - rule 'TODO linear2: contains a Boolean.' was applied 63 times.
  - rule 'affine: new relation' was applied 20 times.
  - rule 'deductions: 69 stored' was applied 1 time.
  - rule 'dual: fix variable' was applied 10 times.
  - rule 'dual: reduced domain' was applied 33 times.
  - rule 'duplicate: merged rhs of linear constraint' was applied 12 times.
  - rule 'duplicate: removed constraint' was applied 94 times.
  - rule 'enforcement: false literal' was applied 15 times.
  - rule 'enforcement: true literal' was applied 4 times.
  - rule 'incompatible linear: add implication' was applied 6 times.
  - rule 'linear inclusion: redundant containing constraint' was applied 1 time.
  - rule 'linear inclusion: redundant included constraint' was applied 3 times.
  - rule 'linear matrix: common vertical rectangle' was applied 6 times.
  - rule 'linear2: contains a Boolean.' was applied 24 times.
  - rule 'linear: always true' was applied 235 times.
  - rule 'linear: doubleton free' was applied 5 times.
  - rule 'linear: empty' was applied 18 times.
  - rule 'linear: extracted enforcement literal' was applied 970 times.
  - rule 'linear: fixed or dup variables' was applied 501 times.
  - rule 'linear: negative clause' was applied 8 times.
  - rule 'linear: positive equal one' was applied 2 times.
  - rule 'linear: reduced variable domains' was applied 62 times.
  - rule 'linear: remapped using affine relations' was applied 472 times.
  - rule 'linear: simplified rhs' was applied 1'397 times.
  - rule 'linear: variable substitution 1' was applied 5 times.
  - rule 'no_overlap: inferred from x != y constraints' was applied 1 time.
  - rule 'presolve: 46 unused variables removed.' was applied 1 time.
  - rule 'presolve: iteration' was applied 3 times.
  - rule 'probing: simplified enforcement list.' was applied 1 time.

Presolved optimization model '': (model_fingerprint: 0xe2d81a53cee3232d)
#Variables: 80 (#ints: 6 in objective)
  - 31 Booleans in [0,1]
  - 1 in [-292,-33][3,262]
  - 1 in [-292,-33][3,329][365,624]
  - 1 in [-5,299]
  - 1 in [-2,295]
  - 1 in [-2,306]
  - 1 in [0,212]
  - 4 in [0,241]
  - 1 in [0,251]
  - 1 in [0,255]
  - 2 in [0,259]
  - 1 in [0,278]
  - 4 in [0,281]
  - 1 in [0,285]
  - 1 in [0,297]
  - 4 in [0,304]
  - 1 in [0,308]
  - 1 in [0,326]
  - 1 in [3,300]
  - 1 in [3,311]
  - 1 in [3,329]
  - 1 in [22,303]
  - 1 in [27,308]
  - 2 in [66,351]
  - 1 in [72,357]
  - 2 in [73,351]
  - 1 in [79,357]
  - 2 in [96,351]
  - 2 in [100,351]
  - 1 in [102,357]
  - 1 in [106,357]
  - 3 in [110,351]
  - 1 in [116,357]
  - 1 in [121,362]
#kBoolOr: 8 (#literals: 24)
#kExactlyOne: 2 (#literals: 6)
#kInterval: 3
#kLinear1: 14 (#enforced: 14 #multi: 6)
#kLinear2: 201 (#enforced: 167 #multi: 137)
#kLinear3: 43 (#enforced: 25)
#kLinearN: 127 (#enforced: 97) (#terms: 1'015)
#kNoOverlap: 1 (#intervals: 3)

Preloading model.
#Bound   0.04s best:inf   next:[121,1643] initial_domain
[Symmetry] Graph for symmetry has 597 nodes and 2'649 arcs.
[Symmetry] Symmetry computation done. time: 0.000161451 dtime: 0.00018873
#Model   0.04s var:80/80 constraints:399/399

Starting search at 0.04s with 48 workers.
17 full problem subsolvers: [core, default_lp, fixed, lb_tree_search, max_lp, no_lp, objective_lb_search, objective_lb_search_max_lp, objective_lb_search_no_lp, objective_shaving_search_max_lp, objective_shaving_search_no_lp, probing, probing_max_lp, pseudo_costs, quick_restart, quick_restart_no_lp, reduced_costs]
29 first solution subsolvers: [fj_long_default(2), fj_long_lin_default, fj_long_lin_perturb, fj_long_lin_random, fj_long_perturb, fj_long_random, fj_short_default(2), fj_short_lin_default(2), fj_short_lin_perturb, fj_short_lin_random, fj_short_perturb, fj_short_random, fs_random(4), fs_random_no_lp(3), fs_random_quick_restart(4), fs_random_quick_restart_no_lp(3)]
15 incomplete subsolvers: [feasibility_pump, graph_arc_lns, graph_cst_lns, graph_dec_lns, graph_var_lns, rins/rens, rnd_cst_lns, rnd_var_lns, scheduling_intervals_lns, scheduling_precedences_lns, scheduling_time_window_lns, violation_ls(4)]
3 helper subsolvers: [neighborhood_helper, synchronization_agent, update_gap_integral]
#1       0.05s best:730   next:[121,729]  no_lp (fixed_bools=0/61)
#Bound   0.05s best:730   next:[122,729]  bool_core (num_cores=1 [size:2 mw:1 d:1] a=5 d=1 fixed=0/51 clauses=17)
#Bound   0.05s best:730   next:[123,729]  bool_core (num_cores=1 [cover] a=5 d=1 fixed=0/54 clauses=18)
#Bound   0.05s best:730   next:[124,729]  bool_core (num_cores=1 [cover] a=5 d=1 fixed=1/57 clauses=20)
#Bound   0.05s best:730   next:[125,729]  bool_core (num_cores=1 [cover] a=5 d=1 fixed=2/60 clauses=23)
#Bound   0.05s best:730   next:[126,729]  bool_core (num_cores=1 [cover] a=5 d=1 fixed=3/63 clauses=27)
#Bound   0.05s best:730   next:[127,729]  bool_core (num_cores=1 [cover] a=5 d=1 fixed=4/66 clauses=32)
#Bound   0.05s best:730   next:[128,729]  bool_core (num_cores=1 [cover] a=5 d=1 fixed=5/69 clauses=38)
#Bound   0.05s best:730   next:[129,729]  bool_core (num_cores=1 [cover] a=5 d=1 fixed=6/72 clauses=45)
#Bound   0.05s best:730   next:[130,729]  bool_core (num_cores=1 [cover] a=5 d=1 fixed=7/75 clauses=53)
#Bound   0.05s best:730   next:[131,729]  bool_core (num_cores=1 [cover] a=5 d=1 fixed=8/78 clauses=62)
#Bound   0.05s best:730   next:[132,729]  bool_core (num_cores=1 [cover] a=5 d=1 fixed=9/81 clauses=72)
#Bound   0.05s best:730   next:[133,729]  bool_core (num_cores=1 [cover] a=5 d=1 fixed=10/84 clauses=83)
#Bound   0.05s best:730   next:[134,729]  bool_core (num_cores=1 [cover] a=5 d=1 fixed=11/87 clauses=95)
#Bound   0.05s best:730   next:[135,729]  bool_core (num_cores=1 [cover] a=5 d=1 fixed=12/90 clauses=108)
#Bound   0.05s best:730   next:[136,729]  bool_core (num_cores=1 [cover] a=5 d=1 fixed=13/93 clauses=122)
#Bound   0.05s best:730   next:[137,729]  bool_core (num_cores=1 [cover] a=5 d=1 fixed=14/96 clauses=137)
#Bound   0.05s best:730   next:[138,729]  bool_core (num_cores=1 [cover] a=5 d=1 fixed=15/99 clauses=153)
#Bound   0.05s best:730   next:[139,729]  bool_core (num_cores=1 [cover] a=5 d=1 fixed=16/102 clauses=170)
#Bound   0.05s best:730   next:[140,729]  bool_core (num_cores=1 [cover] a=5 d=1 fixed=17/105 clauses=188)
#Bound   0.05s best:730   next:[141,729]  bool_core (num_cores=1 [cover] a=5 d=1 fixed=18/108 clauses=207)
#2       0.05s best:715   next:[176,714]  no_lp (fixed_bools=0/64)
#3       0.05s best:714   next:[176,713]  violation_ls(batch:1 #solutions_imported:1 #lin_moves:0 #lin_evals:52 #gen_moves:38 #gen_evals:3 #comp_moves:8 #backtracks:15 #weight_updates:0)
#4       0.05s best:694   next:[176,693]  no_lp (fixed_bools=0/76)
#5       0.05s best:620   next:[332,619]  no_lp (fixed_bools=0/84)
#6       0.06s best:616   next:[332,615]  quick_restart_no_lp (fixed_bools=0/99)
#7       0.06s best:612   next:[360,611]  quick_restart_no_lp (fixed_bools=0/102)
#8       0.06s best:608   next:[360,607]  quick_restart_no_lp (fixed_bools=0/105)
#9       0.06s best:574   next:[360,573]  no_lp (fixed_bools=0/98)
#10      0.06s best:557   next:[360,556]  no_lp (fixed_bools=0/108)
#11      0.06s best:554   next:[361,553]  no_lp (fixed_bools=0/112)
#12      0.06s best:532   next:[364,531]  no_lp (fixed_bools=0/118)
#13      0.06s best:531   next:[364,530]  no_lp (fixed_bools=0/119)
#14      0.06s best:500   next:[364,499]  no_lp (fixed_bools=0/132)
#15      0.07s best:492   next:[364,491]  no_lp (fixed_bools=0/134)
#16      0.07s best:490   next:[364,489]  no_lp (fixed_bools=0/139)
#17      0.07s best:464   next:[364,463]  no_lp (fixed_bools=0/147)
#18      0.07s best:461   next:[364,460]  no_lp (fixed_bools=0/159)
#19      0.08s best:456   next:[368,455]  graph_var_lns (d=0.71 s=44 t=0.10 p=1.00 stall=1 h=auto_l0)
#20      0.08s best:446   next:[376,445]  graph_dec_lns (d=0.71 s=47 t=0.10 p=1.00 stall=1 h=auto_l0) [presolve]
#Model   0.10s var:79/80 constraints:338/399
#Model   0.10s var:78/80 constraints:335/399
#Done    0.10s objective_lb_search_no_lp
#Done    0.10s no_lp
#Done    0.11s objective_lb_search
#Done    0.11s fixed
#Done    0.11s default_lp
#Model   0.11s var:70/80 constraints:187/399
#Bound   0.10s best:446   next:[440,445]  objective_lb_search_no_lp [skipped_logs=31]

Task timing                                  n [     min,      max]      avg      dev     time         n [     min,      max]      avg      dev    dtime
                             'core':         1 [ 62.33ms,  62.33ms]  62.33ms   0.00ns  62.33ms         1 [ 32.63ms,  32.63ms]  32.63ms   0.00ns  32.63ms
                       'default_lp':         1 [ 62.97ms,  62.97ms]  62.97ms   0.00ns  62.97ms         1 [  1.85ms,   1.85ms]   1.85ms   0.00ns   1.85ms
                 'feasibility_pump':         3 [863.42us,  10.87ms]   7.04ms   4.41ms  21.11ms         2 [  1.23ms,   1.43ms]   1.33ms 101.24us   2.67ms
                            'fixed':         1 [ 62.87ms,  62.87ms]  62.87ms   0.00ns  62.87ms         1 [  3.47ms,   3.47ms]   3.47ms   0.00ns   3.47ms
                  'fj_long_default':         0 [  0.00ns,   0.00ns]   0.00ns   0.00ns   0.00ns         0 [  0.00ns,   0.00ns]   0.00ns   0.00ns   0.00ns
                  'fj_long_default':         0 [  0.00ns,   0.00ns]   0.00ns   0.00ns   0.00ns         0 [  0.00ns,   0.00ns]   0.00ns   0.00ns   0.00ns
              'fj_long_lin_default':         0 [  0.00ns,   0.00ns]   0.00ns   0.00ns   0.00ns         0 [  0.00ns,   0.00ns]   0.00ns   0.00ns   0.00ns
              'fj_long_lin_perturb':         0 [  0.00ns,   0.00ns]   0.00ns   0.00ns   0.00ns         0 [  0.00ns,   0.00ns]   0.00ns   0.00ns   0.00ns
               'fj_long_lin_random':         0 [  0.00ns,   0.00ns]   0.00ns   0.00ns   0.00ns         0 [  0.00ns,   0.00ns]   0.00ns   0.00ns   0.00ns
                  'fj_long_perturb':         0 [  0.00ns,   0.00ns]   0.00ns   0.00ns   0.00ns         0 [  0.00ns,   0.00ns]   0.00ns   0.00ns   0.00ns
                   'fj_long_random':         0 [  0.00ns,   0.00ns]   0.00ns   0.00ns   0.00ns         0 [  0.00ns,   0.00ns]   0.00ns   0.00ns   0.00ns
                 'fj_short_default':         0 [  0.00ns,   0.00ns]   0.00ns   0.00ns   0.00ns         0 [  0.00ns,   0.00ns]   0.00ns   0.00ns   0.00ns
                 'fj_short_default':         0 [  0.00ns,   0.00ns]   0.00ns   0.00ns   0.00ns         0 [  0.00ns,   0.00ns]   0.00ns   0.00ns   0.00ns
             'fj_short_lin_default':         0 [  0.00ns,   0.00ns]   0.00ns   0.00ns   0.00ns         0 [  0.00ns,   0.00ns]   0.00ns   0.00ns   0.00ns
             'fj_short_lin_default':         0 [  0.00ns,   0.00ns]   0.00ns   0.00ns   0.00ns         0 [  0.00ns,   0.00ns]   0.00ns   0.00ns   0.00ns
             'fj_short_lin_perturb':         0 [  0.00ns,   0.00ns]   0.00ns   0.00ns   0.00ns         0 [  0.00ns,   0.00ns]   0.00ns   0.00ns   0.00ns
              'fj_short_lin_random':         0 [  0.00ns,   0.00ns]   0.00ns   0.00ns   0.00ns         0 [  0.00ns,   0.00ns]   0.00ns   0.00ns   0.00ns
                 'fj_short_perturb':         0 [  0.00ns,   0.00ns]   0.00ns   0.00ns   0.00ns         0 [  0.00ns,   0.00ns]   0.00ns   0.00ns   0.00ns
                  'fj_short_random':         0 [  0.00ns,   0.00ns]   0.00ns   0.00ns   0.00ns         0 [  0.00ns,   0.00ns]   0.00ns   0.00ns   0.00ns
                        'fs_random':         0 [  0.00ns,   0.00ns]   0.00ns   0.00ns   0.00ns         0 [  0.00ns,   0.00ns]   0.00ns   0.00ns   0.00ns
                        'fs_random':         0 [  0.00ns,   0.00ns]   0.00ns   0.00ns   0.00ns         0 [  0.00ns,   0.00ns]   0.00ns   0.00ns   0.00ns
                        'fs_random':         0 [  0.00ns,   0.00ns]   0.00ns   0.00ns   0.00ns         0 [  0.00ns,   0.00ns]   0.00ns   0.00ns   0.00ns
                        'fs_random':         1 [  3.73ms,   3.73ms]   3.73ms   0.00ns   3.73ms         1 [ 20.00ns,  20.00ns]  20.00ns   0.00ns  20.00ns
                  'fs_random_no_lp':         0 [  0.00ns,   0.00ns]   0.00ns   0.00ns   0.00ns         0 [  0.00ns,   0.00ns]   0.00ns   0.00ns   0.00ns
                  'fs_random_no_lp':         0 [  0.00ns,   0.00ns]   0.00ns   0.00ns   0.00ns         0 [  0.00ns,   0.00ns]   0.00ns   0.00ns   0.00ns
                  'fs_random_no_lp':         0 [  0.00ns,   0.00ns]   0.00ns   0.00ns   0.00ns         0 [  0.00ns,   0.00ns]   0.00ns   0.00ns   0.00ns
          'fs_random_quick_restart':         0 [  0.00ns,   0.00ns]   0.00ns   0.00ns   0.00ns         0 [  0.00ns,   0.00ns]   0.00ns   0.00ns   0.00ns
          'fs_random_quick_restart':         0 [  0.00ns,   0.00ns]   0.00ns   0.00ns   0.00ns         0 [  0.00ns,   0.00ns]   0.00ns   0.00ns   0.00ns
          'fs_random_quick_restart':         0 [  0.00ns,   0.00ns]   0.00ns   0.00ns   0.00ns         0 [  0.00ns,   0.00ns]   0.00ns   0.00ns   0.00ns
          'fs_random_quick_restart':         1 [  3.51ms,   3.51ms]   3.51ms   0.00ns   3.51ms         1 [ 20.00ns,  20.00ns]  20.00ns   0.00ns  20.00ns
    'fs_random_quick_restart_no_lp':         0 [  0.00ns,   0.00ns]   0.00ns   0.00ns   0.00ns         0 [  0.00ns,   0.00ns]   0.00ns   0.00ns   0.00ns
    'fs_random_quick_restart_no_lp':         0 [  0.00ns,   0.00ns]   0.00ns   0.00ns   0.00ns         0 [  0.00ns,   0.00ns]   0.00ns   0.00ns   0.00ns
    'fs_random_quick_restart_no_lp':         0 [  0.00ns,   0.00ns]   0.00ns   0.00ns   0.00ns         0 [  0.00ns,   0.00ns]   0.00ns   0.00ns   0.00ns
                    'graph_arc_lns':         3 [  1.43ms,   4.12ms]   2.44ms   1.19ms   7.32ms         2 [ 10.00ns,  46.93us]  23.47us  23.46us  46.94us
                    'graph_cst_lns':         3 [428.39us, 567.09us] 513.43us  60.82us   1.54ms         0 [  0.00ns,   0.00ns]   0.00ns   0.00ns   0.00ns
                    'graph_dec_lns':         3 [  1.69ms,   2.79ms]   2.19ms 453.51us   6.58ms         2 [ 10.00ns,  10.00ns]  10.00ns   0.00ns  20.00ns
                    'graph_var_lns':         3 [  1.29ms,   5.08ms]   3.17ms   1.55ms   9.52ms         2 [ 10.00ns,  14.10us]   7.05us   7.04us  14.11us
                   'lb_tree_search':         1 [ 61.11ms,  61.11ms]  61.11ms   0.00ns  61.11ms         1 [  1.29ms,   1.29ms]   1.29ms   0.00ns   1.29ms
                           'max_lp':         1 [ 61.85ms,  61.85ms]  61.85ms   0.00ns  61.85ms         1 [  2.11ms,   2.11ms]   2.11ms   0.00ns   2.11ms
                            'no_lp':         1 [ 61.32ms,  61.32ms]  61.32ms   0.00ns  61.32ms         1 [  8.19ms,   8.19ms]   8.19ms   0.00ns   8.19ms
              'objective_lb_search':         1 [ 60.77ms,  60.77ms]  60.77ms   0.00ns  60.77ms         1 [  1.71ms,   1.71ms]   1.71ms   0.00ns   1.71ms
       'objective_lb_search_max_lp':         1 [ 59.22ms,  59.22ms]  59.22ms   0.00ns  59.22ms         1 [  4.59ms,   4.59ms]   4.59ms   0.00ns   4.59ms
        'objective_lb_search_no_lp':         1 [ 58.73ms,  58.73ms]  58.73ms   0.00ns  58.73ms         1 [  6.95ms,   6.95ms]   6.95ms   0.00ns   6.95ms
  'objective_shaving_search_max_lp':         3 [  5.29ms,  16.31ms]   8.98ms   5.19ms  26.93ms         1 [317.34us, 317.34us] 317.34us   0.00ns 317.34us
   'objective_shaving_search_no_lp':         4 [  1.12ms,  16.36ms]   6.35ms   6.00ms  25.39ms         1 [505.11us, 505.11us] 505.11us   0.00ns 505.11us
                          'probing':         1 [ 60.77ms,  60.77ms]  60.77ms   0.00ns  60.77ms         1 [  1.34ms,   1.34ms]   1.34ms   0.00ns   1.34ms
                   'probing_max_lp':         1 [ 59.94ms,  59.94ms]  59.94ms   0.00ns  59.94ms         1 [  2.84ms,   2.84ms]   2.84ms   0.00ns   2.84ms
                     'pseudo_costs':         1 [ 60.96ms,  60.96ms]  60.96ms   0.00ns  60.96ms         1 [  3.69ms,   3.69ms]   3.69ms   0.00ns   3.69ms
                    'quick_restart':         1 [ 61.49ms,  61.49ms]  61.49ms   0.00ns  61.49ms         1 [  3.96ms,   3.96ms]   3.96ms   0.00ns   3.96ms
              'quick_restart_no_lp':         1 [ 61.25ms,  61.25ms]  61.25ms   0.00ns  61.25ms         1 [  8.74ms,   8.74ms]   8.74ms   0.00ns   8.74ms
                    'reduced_costs':         1 [ 61.45ms,  61.45ms]  61.45ms   0.00ns  61.45ms         1 [  4.53ms,   4.53ms]   4.53ms   0.00ns   4.53ms
                        'rins/rens':         3 [  3.08ms,  23.31ms]   9.92ms   9.47ms  29.76ms         2 [ 88.93us,   1.67ms] 880.12us 791.19us   1.76ms
                      'rnd_cst_lns':         3 [556.53us,   2.78ms]   1.65ms 908.75us   4.95ms         2 [ 10.00ns,  10.00ns]  10.00ns   0.00ns  20.00ns
                      'rnd_var_lns':         3 [  1.19ms,   3.18ms]   2.09ms 825.86us   6.26ms         3 [ 10.00ns,  10.00ns]  10.00ns   0.00ns  30.00ns
         'scheduling_intervals_lns':         3 [  3.44ms,  52.68ms]  27.33ms  20.13ms  81.98ms         1 [  6.25ms,   6.25ms]   6.25ms   0.00ns   6.25ms
       'scheduling_precedences_lns':         3 [  2.57ms,  51.74ms]  26.43ms  20.10ms  79.29ms         1 [  6.41ms,   6.41ms]   6.41ms   0.00ns   6.41ms
       'scheduling_time_window_lns':         3 [  3.25ms,  51.97ms]  27.08ms  19.90ms  81.24ms         1 [  6.19ms,   6.19ms]   6.19ms   0.00ns   6.19ms
                     'violation_ls':         2 [544.84us,  32.92ms]  16.73ms  16.19ms  33.46ms         2 [ 50.46us,  15.13ms]   7.59ms   7.54ms  15.18ms
                     'violation_ls':         2 [751.50us,  33.02ms]  16.88ms  16.13ms  33.77ms         2 [ 88.30us,  14.98ms]   7.54ms   7.45ms  15.07ms
                     'violation_ls':         3 [541.50us,  18.96ms]   9.02ms   7.59ms  27.07ms         3 [ 75.95us,   8.41ms]   3.38ms   3.62ms  10.14ms
                     'violation_ls':         3 [712.65us,  27.29ms]  14.40ms  10.86ms  43.19ms         3 [ 77.23us,  11.22ms]   6.05ms   4.58ms  18.14ms

Search stats                        Bools  Conflicts  Branches  Restarts  BoolPropag  IntegerPropag
                           'core':    287        100     2'199       748      75'825         43'152
                     'default_lp':     52          0        99        91         118            785
                          'fixed':     98         54       144        91         558          7'684
                      'fs_random':      0          0         0         0           0              0
                      'fs_random':      0          0         0         0           0              0
                      'fs_random':      0          0         0         0           0              0
                      'fs_random':     45          0         0         0           0              0
                'fs_random_no_lp':      0          0         0         0           0              0
                'fs_random_no_lp':      0          0         0         0           0              0
                'fs_random_no_lp':      0          0         0         0           0              0
        'fs_random_quick_restart':      0          0         0         0           0              0
        'fs_random_quick_restart':      0          0         0         0           0              0
        'fs_random_quick_restart':      0          0         0         0           0              0
        'fs_random_quick_restart':     45          0         0         0           0              0
  'fs_random_quick_restart_no_lp':      0          0         0         0           0              0
  'fs_random_quick_restart_no_lp':      0          0         0         0           0              0
  'fs_random_quick_restart_no_lp':      0          0         0         0           0              0
                 'lb_tree_search':     48          1        96        96          77            517
                         'max_lp':     45          0        90        90          72            504
                          'no_lp':    168        235     1'926       432      12'145         45'969
            'objective_lb_search':     54          0       100        91         121            873
     'objective_lb_search_max_lp':     53         11       124        96         179          1'956
      'objective_lb_search_no_lp':     70        330     1'056       370       3'673         41'880
                        'probing':     50          1       100       100          80            541
                 'probing_max_lp':     48          1        96        96          77            517
                   'pseudo_costs':     50          5       107        90         124          1'187
                  'quick_restart':     56          8       439       205         753          4'277
            'quick_restart_no_lp':    184        165     1'796       529      18'844         43'005
                  'reduced_costs':     74         23       158        96         459          2'617

SAT stats                           ClassicMinim  LitRemoved  LitLearned  LitForgotten  Subsumed  MClauses  MDecisions  MLitTrue  MSubsumed  MLitRemoved  MReused
                           'core':            31          97         110             0         2       243       1'194         0          4           12        3
                     'default_lp':             0           0           0             0         0         0           0         0          0            0        0
                          'fixed':             2           2         332             0         1         0           0         0          0            0        0
                      'fs_random':             0           0           0             0         0         0           0         0          0            0        0
                      'fs_random':             0           0           0             0         0         0           0         0          0            0        0
                      'fs_random':             0           0           0             0         0         0           0         0          0            0        0
                      'fs_random':             0           0           0             0         0         0           0         0          0            0        0
                'fs_random_no_lp':             0           0           0             0         0         0           0         0          0            0        0
                'fs_random_no_lp':             0           0           0             0         0         0           0         0          0            0        0
                'fs_random_no_lp':             0           0           0             0         0         0           0         0          0            0        0
        'fs_random_quick_restart':             0           0           0             0         0         0           0         0          0            0        0
        'fs_random_quick_restart':             0           0           0             0         0         0           0         0          0            0        0
        'fs_random_quick_restart':             0           0           0             0         0         0           0         0          0            0        0
        'fs_random_quick_restart':             0           0           0             0         0         0           0         0          0            0        0
  'fs_random_quick_restart_no_lp':             0           0           0             0         0         0           0         0          0            0        0
  'fs_random_quick_restart_no_lp':             0           0           0             0         0         0           0         0          0            0        0
  'fs_random_quick_restart_no_lp':             0           0           0             0         0         0           0         0          0            0        0
                 'lb_tree_search':             0           0           1             0         0         0           0         0          0            0        0
                         'max_lp':             0           0           0             0         0         0           0         0          0            0        0
                          'no_lp':            86         139       1'384             0        26        81         413         0          4           19        5
            'objective_lb_search':             0           0           0             0         0         0           0         0          0            0        0
     'objective_lb_search_max_lp':             0           0          70             0         1         0           0         0          0            0        0
      'objective_lb_search_no_lp':           220         345       1'114             0        29        83         412         0         10           46       13
                        'probing':             0           0           1             0         0         0           0         0          0            0        0
                 'probing_max_lp':             0           0           1             0         0         0           0         0          0            0        0
                   'pseudo_costs':             2           3          34             0         0         0           0         0          0            0        0
                  'quick_restart':             0           0          41             0         0        34         184         0          0            0        2
            'quick_restart_no_lp':            84         149         818             0         9       167         794         1         84          461       24
                  'reduced_costs':             6          11         145             0         0         0           0         0          0            0        0

Lp stats                         Component  Iterations  AddedCuts  OPTIMAL  DUAL_F.  DUAL_U.
                  'default_lp':          1         220        423       22        0        0
                       'fixed':          1         225        383       70        0        0
                   'fs_random':          1           0          0        0        0        0
     'fs_random_quick_restart':          1           0          0        0        0        0
              'lb_tree_search':          1         105        446        5        0        0
                      'max_lp':          1         125        456        5        0        0
         'objective_lb_search':          1         201        443       24        0        0
  'objective_lb_search_max_lp':          1         350        366       27        7        0
                     'probing':          1         157        459       20        0        0
              'probing_max_lp':          1         121        420        5        0        0
                'pseudo_costs':          1         264        389       23        2        0
               'quick_restart':          1         334        365       55        0        0
               'reduced_costs':          1         280        373       38        3        0

Lp dimension                                                                    Final dimension of first component
                  'default_lp':   188 rows, 76 columns, 896 entries with magnitude in [5.929536e-04, 1.000000e+00]
                       'fixed':   191 rows, 76 columns, 805 entries with magnitude in [3.619176e-03, 1.000000e+00]
                   'fs_random':       0 rows, 76 columns, 0 entries with magnitude in [0.000000e+00, 0.000000e+00]
     'fs_random_quick_restart':       0 rows, 76 columns, 0 entries with magnitude in [0.000000e+00, 0.000000e+00]
              'lb_tree_search':  497 rows, 80 columns, 2946 entries with magnitude in [4.875838e-03, 1.000000e+00]
                      'max_lp':  495 rows, 80 columns, 2964 entries with magnitude in [8.683568e-03, 1.000000e+00]
         'objective_lb_search':   200 rows, 76 columns, 908 entries with magnitude in [5.236424e-04, 1.000000e+00]
  'objective_lb_search_max_lp':  259 rows, 80 columns, 1087 entries with magnitude in [7.192637e-04, 1.000000e+00]
                     'probing':  222 rows, 76 columns, 1110 entries with magnitude in [6.359911e-04, 1.000000e+00]
              'probing_max_lp':  496 rows, 80 columns, 2955 entries with magnitude in [2.500897e-03, 1.000000e+00]
                'pseudo_costs':  254 rows, 80 columns, 1044 entries with magnitude in [7.156666e-04, 1.000000e+00]
               'quick_restart':   214 rows, 76 columns, 910 entries with magnitude in [1.134421e-03, 1.000000e+00]
               'reduced_costs':  269 rows, 80 columns, 1213 entries with magnitude in [7.738090e-04, 1.000000e+00]

Lp debug                         CutPropag  CutEqPropag  Adjust  Overflow  Bad  BadScaling
                  'default_lp':          0            0      16         0  388           0
                       'fixed':          0            0      61         0  413           0
                   'fs_random':          0            0       0         0    0           0
     'fs_random_quick_restart':          0            0       0         0    0           0
              'lb_tree_search':          0            0       4         0  273           0
                      'max_lp':          0            0       2         0  243           0
         'objective_lb_search':          0            0      15         0  522           0
  'objective_lb_search_max_lp':          0            0      22         0  373           0
                     'probing':          0            0      13         0  607           0
              'probing_max_lp':          0            0       4         0  186           0
                'pseudo_costs':          0            0      20         0  385           0
               'quick_restart':          0            0      35         0  473           0
               'reduced_costs':          0            0      32         0  278           0

Lp pool                          Constraints  Updates  Simplif  Merged  Shortened  Split  Strenghtened  Cuts/Call
                  'default_lp':          506       22       22       1          0      5           109    423/718
                       'fixed':          466       18       52       1          0      5           127    383/629
                   'fs_random':           84        0        0       0          0      0             0        0/0
     'fs_random_quick_restart':           84        0        0       0          0      0             0        0/0
              'lb_tree_search':          840        3        0       1          0      6           107    446/758
                      'max_lp':          850        5        0       1          0      8           116    456/818
         'objective_lb_search':          526       19       22       1          0      7            83    443/723
  'objective_lb_search_max_lp':          759       20      115       2          0      1           337    366/629
                     'probing':          543        8        0       0          0      8            64    459/743
              'probing_max_lp':          814        3        0       1          0      6            96    420/726
                'pseudo_costs':          782       23      115       2          0      3           344    389/675
               'quick_restart':          449       23       26       0          0     18           105    365/638
               'reduced_costs':          768       18      115       0          0      2           323    373/644

Lp Cut                                         defaul  fixed  max_lp  quick_  reduce  pseudo  lb_tre  probin  object  probin  object
                                       CG_FF:      33     37      51      34      27      36      44      59      39      44      29
                                        CG_K:       9     12      18      11      12      15      12      10      12      16      13
                                        CG_R:      13      9      49      12      20      30      45      14      25      43      30
                                       CG_RB:      96     73      67      86      70      68      82     120     111      59      58
                                      CG_RBP:      14     15      14      16       2      12      14      12      33      12       9
                                      Clique:       -      -       -       -       1       2       -       -       -       -       3
                                          IB:      81     81      54      78      79      81      46      76      78      48      78
                                    MIR_1_FF:      17     19      27      15      33      24      24      22      17      22      28
                                     MIR_1_K:       2      3       7       -       1       -       7       1       3       6       1
                                     MIR_1_R:       -      1       4       1       2       2       2       -       1       2       1
                                    MIR_1_RB:      28     15      27      18      27      29      25      32      18      21      31
                                   MIR_1_RBP:       2      3       6       3       2       2       6       2       1       6       3
                                   MIR_1_RLT:       -      -       -       -      12       7       -       -       -       -       7
                                    MIR_2_FF:      10     13      17       5       9       9      11       9       6      11       6
                                     MIR_2_K:       1      2       3       1       2       2       6       -       -       4       2
                                     MIR_2_R:       3      5       6       2       1       4       4       -       3       5       4
                                    MIR_2_RB:      13     15      12      10      10      11      10      17      16      15       7
                                   MIR_2_RBP:       5      4       5       1       3       1       2       3       2       5       3
                                    MIR_3_FF:       4      3       7       4       1       3      12       5       3       9       6
                                     MIR_3_K:       2      1       -       1       1       -       3       2       1       3       -
                                     MIR_3_R:       5      5       4       4       -       2       3       6       2       5       1
                                    MIR_3_RB:      11      2       4       6       3       3       6       5       4       6       3
                                   MIR_3_RBP:       4      1       1       2       1       2       2       1       1       1       3
                                    MIR_4_FF:       -      3       7       3       4       -       6       4       6      10       1
                                     MIR_4_K:       -      1       2       -       2       1       1       -       2       1       -
                                     MIR_4_R:       2      3       3       5       3       3       1       6       6       3       -
                                    MIR_4_RB:       -      3       2       4       5       5       3       4       5       3       2
                                   MIR_4_RBP:       -      -       1       -       2       1       -       -       -       2       -
                                    MIR_5_FF:       2      2       5       -       1       1       3       2       -       3       -
                                     MIR_5_K:       -      1       2       -       -       -       -       1       -       -       -
                                     MIR_5_R:       1      2       2       -       1       1       -       3       -       3       -
                                    MIR_5_RB:       3      5       1       -       1       1       1       4       -       1       2
                                   MIR_5_RBP:       -      -       -       -       -       -       -       -       -       2       -
                                    MIR_6_FF:       1      1       1       -       -       2       2       -       -       1       -
                                     MIR_6_K:       -      -       1       -       -       -       2       -       -       1       -
                                     MIR_6_R:       -      2       1       -       -       1       2       -       -       1       -
                                    MIR_6_RB:       -      -       1       -       -       1       2       -       -       -       -
  NoOverlapCompletionTimeExhaustive_weighted:       -      -       1       -       1       1       1       -       -       1       1
                 NoOverlapDisjunctionOnStart:       -      -       1       -       1       1       1       -       -       1       1
                                ZERO_HALF_FF:      13      9      12      10       8       6      14       6       6       7       7
                                 ZERO_HALF_K:       1      -       -       -       2       -       3       -       2       -       1
                                 ZERO_HALF_R:      19     14      13      17      10       8      15      21      21      15      11
                                ZERO_HALF_RB:      20     13      11      14      13      11      14      11      14      13      14
                               ZERO_HALF_RBP:       8      5       6       2       -       -       9       1       5       9       -

LNS stats                        Improv/Calls  Closed  Difficulty  TimeLimit
               'graph_arc_lns':           3/3    100%        0.88       0.10
               'graph_cst_lns':           0/0      0%        0.50       0.10
               'graph_dec_lns':           2/3    100%        0.88       0.10
               'graph_var_lns':           1/2    100%        0.81       0.10
                   'rins/rens':           0/3     67%        0.72       0.10
                 'rnd_cst_lns':           0/2    100%        0.81       0.10
                 'rnd_var_lns':           0/3    100%        0.88       0.10
    'scheduling_intervals_lns':           2/2      0%        0.19       0.10
  'scheduling_precedences_lns':           2/2      0%        0.19       0.10
  'scheduling_time_window_lns':           2/2      0%        0.19       0.10

LS stats                   Batches  Restarts  LinMoves  GenMoves  CompoundMoves  WeightUpdates
       'fj_long_default':        0         0         0         0              0              0
       'fj_long_default':        0         0         0         0              0              0
   'fj_long_lin_default':        0         0         0         0              0              0
   'fj_long_lin_perturb':        0         0         0         0              0              0
    'fj_long_lin_random':        0         0         0         0              0              0
       'fj_long_perturb':        0         0         0         0              0              0
        'fj_long_random':        0         0         0         0              0              0
      'fj_short_default':        0         0         0         0              0              0
      'fj_short_default':        0         0         0         0              0              0
  'fj_short_lin_default':        0         0         0         0              0              0
  'fj_short_lin_default':        0         0         0         0              0              0
  'fj_short_lin_perturb':        0         0         0         0              0              0
   'fj_short_lin_random':        0         0         0         0              0              0
      'fj_short_perturb':        0         0         0         0              0              0
       'fj_short_random':        0         0         0         0              0              0
          'violation_ls':        2         0         0     4'044             56             28
          'violation_ls':        2         0        36     4'015             49             50
          'violation_ls':        3         0     4'866     2'042             44          5'150
          'violation_ls':        3         0       570     2'338             70            212

Solutions (20)            Num     Rank
        'graph_dec_lns':    1  [20,20]
        'graph_var_lns':    1  [19,19]
                'no_lp':   14   [1,18]
  'quick_restart_no_lp':    3    [6,8]
         'violation_ls':    1    [3,3]

Objective bounds                Num
                  'bool_core':   29
             'initial_domain':    1
  'objective_lb_search_no_lp':   23

Solution repositories    Added  Queried  Ignored  Synchro
  'feasible solutions':     40       73        0       34
        'lp solutions':      0        0        0        0
                'pump':     42        3

Improving bounds shared    Num
                  'core':    2
                 'fixed':    2
                 'no_lp':  110
   'objective_lb_search':    7
         'quick_restart':    5
   'quick_restart_no_lp':   19

Clauses shared                  Num
                       'core':    1
                      'no_lp':   15
  'objective_lb_search_no_lp':    1
        'quick_restart_no_lp':    2

CpSolverResponse summary:
status: OPTIMAL
objective: 446
best_bound: 446
integers: 0
booleans: 0
conflicts: 0
branches: 0
propagations: 0
integer_propagations: 0
restarts: 0
lp_iterations: 0
walltime: 0.114267
usertime: 0.114267
deterministic_time: 0.171684
gap_integral: 0.548526
solution_fingerprint: 0x9d1bac612c860536


--- Simulation Gantt  partir du modle mathmatique ---
{'big':1, 'due_date':107, 'pos_time':5, 'status':1, 'blocked':2, 'operations':["{'type':0, 'processing_time':57}"]}
{'big':0, 'due_date':150, 'pos_time':5, 'status':3, 'blocked':0, 'operations':["{'type':1, 'processing_time':21}", "{'type':0, 'processing_time':49}"]}
{'big':1, 'due_date':111, 'pos_time':5, 'status':1, 'blocked':0, 'operations':["{'type':1, 'processing_time':28}"]}
{'big':1, 'due_date':84, 'pos_time':5, 'status':1, 'blocked':0, 'operations':["{'type':0, 'processing_time':46}"]}
{'big':0, 'due_date':77, 'pos_time':5, 'status':2, 'blocked':0, 'operations':["{'type':0, 'processing_time':53}"]}
