created virtual environment CPython3.12.4.final.0-64 in 8946ms
  creator CPython3Posix(dest=/localscratch/aneumann.63393114.0/env, clear=False, no_vcs_ignore=False, global=False)
  seeder FromAppData(download=False, pip=bundle, via=copy, app_data_dir=/home/aneumann/.local/share/virtualenv)
    added seed packages: pip==25.1.1
  activators BashActivator,CShellActivator,FishActivator,NushellActivator,PowerShellActivator,PythonActivator
Looking in links: /cvmfs/soft.computecanada.ca/custom/python/wheelhouse/gentoo2023/x86-64-v3, /cvmfs/soft.computecanada.ca/custom/python/wheelhouse/gentoo2023/generic, /cvmfs/soft.computecanada.ca/custom/python/wheelhouse/generic
Requirement already satisfied: pip in /localscratch/aneumann.63393114.0/env/lib/python3.12/site-packages (25.1.1)
Looking in links: /cvmfs/soft.computecanada.ca/custom/python/wheelhouse/gentoo2023/x86-64-v3, /cvmfs/soft.computecanada.ca/custom/python/wheelhouse/gentoo2023/generic, /cvmfs/soft.computecanada.ca/custom/python/wheelhouse/generic
ERROR: protobuf-5.28.3-cp38-abi3-manylinux2014_x86_64.whl is not a supported wheel on this platform.
Looking in links: /cvmfs/soft.computecanada.ca/custom/python/wheelhouse/gentoo2023/x86-64-v3, /cvmfs/soft.computecanada.ca/custom/python/wheelhouse/gentoo2023/generic, /cvmfs/soft.computecanada.ca/custom/python/wheelhouse/generic
Processing /home/aneumann/projects/def-adhaj/aneumann/GNRS/wheels/immutabledict-4.2.0-py3-none-any.whl
Installing collected packages: immutabledict
Successfully installed immutabledict-4.2.0
Looking in links: /cvmfs/soft.computecanada.ca/custom/python/wheelhouse/gentoo2023/x86-64-v3, /cvmfs/soft.computecanada.ca/custom/python/wheelhouse/gentoo2023/generic, /cvmfs/soft.computecanada.ca/custom/python/wheelhouse/generic
Processing /cvmfs/soft.computecanada.ca/custom/python/wheelhouse/generic/ortools-9.10.4067+computecanada-cp312-cp312-linux_x86_64.whl (from -r /home/aneumann/projects/def-adhaj/aneumann/GNRS/requirements/or.txt (line 1))
Processing /cvmfs/soft.computecanada.ca/custom/python/wheelhouse/gentoo2023/x86-64-v3/matplotlib-3.10.0+computecanada-cp312-cp312-linux_x86_64.whl (from -r /home/aneumann/projects/def-adhaj/aneumann/GNRS/requirements/or.txt (line 2))
Processing /cvmfs/soft.computecanada.ca/custom/python/wheelhouse/gentoo2023/x86-64-v3/pandas-2.2.3+computecanada-cp312-cp312-linux_x86_64.whl (from -r /home/aneumann/projects/def-adhaj/aneumann/GNRS/requirements/or.txt (line 3))
Processing /cvmfs/soft.computecanada.ca/custom/python/wheelhouse/generic/absl_py-2.2.2+computecanada-py3-none-any.whl (from ortools<9.11,>=9.10->-r /home/aneumann/projects/def-adhaj/aneumann/GNRS/requirements/or.txt (line 1))
Processing /cvmfs/soft.computecanada.ca/custom/python/wheelhouse/gentoo2023/generic/numpy-2.2.2+computecanada-cp312-cp312-linux_x86_64.whl (from ortools<9.11,>=9.10->-r /home/aneumann/projects/def-adhaj/aneumann/GNRS/requirements/or.txt (line 1))
Processing /cvmfs/soft.computecanada.ca/custom/python/wheelhouse/gentoo2023/x86-64-v3/protobuf-6.30.2+computecanada-cp312-cp312-linux_x86_64.whl (from ortools<9.11,>=9.10->-r /home/aneumann/projects/def-adhaj/aneumann/GNRS/requirements/or.txt (line 1))
Requirement already satisfied: immutabledict>=3.0.0 in /localscratch/aneumann.63393114.0/env/lib/python3.12/site-packages (from ortools<9.11,>=9.10->-r /home/aneumann/projects/def-adhaj/aneumann/GNRS/requirements/or.txt (line 1)) (4.2.0)
Processing /cvmfs/soft.computecanada.ca/custom/python/wheelhouse/gentoo2023/generic/contourpy-1.3.1+computecanada-cp312-cp312-linux_x86_64.whl (from matplotlib->-r /home/aneumann/projects/def-adhaj/aneumann/GNRS/requirements/or.txt (line 2))
Processing /cvmfs/soft.computecanada.ca/custom/python/wheelhouse/generic/cycler-0.12.1+computecanada-py3-none-any.whl (from matplotlib->-r /home/aneumann/projects/def-adhaj/aneumann/GNRS/requirements/or.txt (line 2))
Processing /cvmfs/soft.computecanada.ca/custom/python/wheelhouse/generic/fonttools-4.58.2+computecanada-cp312-cp312-linux_x86_64.whl (from matplotlib->-r /home/aneumann/projects/def-adhaj/aneumann/GNRS/requirements/or.txt (line 2))
Processing /cvmfs/soft.computecanada.ca/custom/python/wheelhouse/gentoo2023/x86-64-v3/kiwisolver-1.4.8+computecanada-cp312-cp312-linux_x86_64.whl (from matplotlib->-r /home/aneumann/projects/def-adhaj/aneumann/GNRS/requirements/or.txt (line 2))
Processing /cvmfs/soft.computecanada.ca/custom/python/wheelhouse/generic/packaging-25.0+computecanada-py3-none-any.whl (from matplotlib->-r /home/aneumann/projects/def-adhaj/aneumann/GNRS/requirements/or.txt (line 2))
Processing /cvmfs/soft.computecanada.ca/custom/python/wheelhouse/gentoo2023/x86-64-v3/pillow-11.1.0+computecanada-cp312-cp312-linux_x86_64.whl (from matplotlib->-r /home/aneumann/projects/def-adhaj/aneumann/GNRS/requirements/or.txt (line 2))
Processing /cvmfs/soft.computecanada.ca/custom/python/wheelhouse/generic/pyparsing-3.2.1+computecanada-py3-none-any.whl (from matplotlib->-r /home/aneumann/projects/def-adhaj/aneumann/GNRS/requirements/or.txt (line 2))
Processing /cvmfs/soft.computecanada.ca/custom/python/wheelhouse/generic/python_dateutil-2.9.0.post0+computecanada-py2.py3-none-any.whl (from matplotlib->-r /home/aneumann/projects/def-adhaj/aneumann/GNRS/requirements/or.txt (line 2))
Processing /cvmfs/soft.computecanada.ca/custom/python/wheelhouse/generic/pytz-2025.2+computecanada-py2.py3-none-any.whl (from pandas->-r /home/aneumann/projects/def-adhaj/aneumann/GNRS/requirements/or.txt (line 3))
Processing /cvmfs/soft.computecanada.ca/custom/python/wheelhouse/generic/tzdata-2025.2+computecanada-py2.py3-none-any.whl (from pandas->-r /home/aneumann/projects/def-adhaj/aneumann/GNRS/requirements/or.txt (line 3))
Processing /cvmfs/soft.computecanada.ca/custom/python/wheelhouse/generic/six-1.17.0+computecanada-py2.py3-none-any.whl (from python-dateutil>=2.7->matplotlib->-r /home/aneumann/projects/def-adhaj/aneumann/GNRS/requirements/or.txt (line 2))
Installing collected packages: pytz, tzdata, six, pyparsing, protobuf, pillow, packaging, numpy, kiwisolver, fonttools, cycler, absl-py, python-dateutil, contourpy, pandas, matplotlib, ortools

Successfully installed absl-py-2.2.2+computecanada contourpy-1.3.1+computecanada cycler-0.12.1+computecanada fonttools-4.58.2+computecanada kiwisolver-1.4.8+computecanada matplotlib-3.10.0+computecanada numpy-2.2.2+computecanada ortools-9.10.4067+computecanada packaging-25.0+computecanada pandas-2.2.3+computecanada pillow-11.1.0+computecanada protobuf-6.30.2+computecanada pyparsing-3.2.1+computecanada python-dateutil-2.9.0.post0+computecanada pytz-2025.2+computecanada six-1.17.0+computecanada tzdata-2025.2+computecanada

Starting CP-SAT solver v9.10.4067
Parameters: max_time_in_seconds: 3600 max_memory_in_mb: 12000 log_search_progress: true enumerate_all_solutions: false absolute_gap_limit: 0 relative_gap_limit: 0
Setting number of workers to 48

Initial optimization model '': (model_fingerprint: 0x1f35b915aaa997e7)
#Variables: 189 (#ints: 6 in objective)
  - 126 Booleans in [0,1]
  - 63 in [0,404]
#kLinear1: 29
#kLinear2: 253
#kLinear3: 81
#kLinearN: 875 (#terms: 8'263)

Starting presolve at 0.00s
  3.98e-04s  0.00e+00d  [DetectDominanceRelations] 
  1.13e-02s  0.00e+00d  [PresolveToFixPoint] #num_loops=6 #num_dual_strengthening=3 
  1.79e-05s  0.00e+00d  [ExtractEncodingFromLinear] #potential_supersets=3 
[Symmetry] Graph for symmetry has 1'064 nodes and 4'396 arcs.
[Symmetry] Symmetry computation done. time: 0.000644686 dtime: 0.00048973
[Symmetry] #generators: 1, average support size: 16
[Symmetry] The model contains 137 duplicate constraints !
[Symmetry] 8 orbits with sizes: 2,2,2,2,2,2,2,2
[Symmetry] Num fixable by intersecting at_most_one with orbits: 1 largest_orbit: 2
  2.22e-03s  1.95e-04d  [Probe] #probed=166 #fixed_bools=3 #new_bounds=5 #equiv=1 
  3.77e-05s  0.00e+00d  [MaxClique] Merged 10(20 literals) into 9(18 literals) at_most_ones. 
  2.81e-04s  0.00e+00d  [DetectDominanceRelations] 
  3.85e-03s  0.00e+00d  [PresolveToFixPoint] #num_loops=4 #num_dual_strengthening=3 
  9.32e-04s  0.00e+00d  [ProcessAtMostOneAndLinear] 
  7.60e-04s  0.00e+00d  [DetectDuplicateConstraints] #duplicates=163 #without_enforcements=60 
  2.03e-04s  7.49e-06d  [DetectDominatedLinearConstraints] #relevant_constraints=361 #num_inclusions=26 #num_redundant=3 
  1.42e-04s  0.00e+00d  [DetectDifferentVariables] #different=25 
  9.81e-05s  3.09e-06d  [ProcessSetPPC] #relevant_constraints=249 
  1.12e-05s  0.00e+00d  [FindAlmostIdenticalLinearConstraints] 
  4.01e-05s  2.02e-05d  [FindBigAtMostOneAndLinearOverlap] 
  6.56e-04s  1.97e-04d  [FindBigVerticalLinearOverlap] #blocks=5 #saved_nz=186 
  5.36e-05s  9.00e-06d  [FindBigHorizontalLinearOverlap] #linears=241 
  5.42e-06s  0.00e+00d  [MergeClauses] 
  2.81e-04s  0.00e+00d  [DetectDominanceRelations] 
  3.60e-03s  0.00e+00d  [PresolveToFixPoint] #num_loops=2 #num_dual_strengthening=1 
  2.73e-04s  0.00e+00d  [DetectDominanceRelations] 
  2.61e-03s  0.00e+00d  [PresolveToFixPoint] #num_loops=1 #num_dual_strengthening=1 
[Symmetry] Graph for symmetry has 879 nodes and 3'630 arcs.
[Symmetry] Symmetry computation done. time: 0.000197145 dtime: 0.00024028
  1.84e-03s  1.84e-04d  [Probe] #probed=160 #new_bounds=19 
  5.97e-06s  0.00e+00d  [MaxClique] 
  2.75e-04s  0.00e+00d  [DetectDominanceRelations] 
  5.00e-03s  0.00e+00d  [PresolveToFixPoint] #num_loops=4 #num_dual_strengthening=3 
  8.11e-04s  0.00e+00d  [ProcessAtMostOneAndLinear] 
  5.88e-04s  0.00e+00d  [DetectDuplicateConstraints] #without_enforcements=76 
  1.84e-04s  6.45e-06d  [DetectDominatedLinearConstraints] #relevant_constraints=335 #num_inclusions=21 
  1.25e-04s  0.00e+00d  [DetectDifferentVariables] #different=25 
  8.88e-05s  2.43e-06d  [ProcessSetPPC] #relevant_constraints=221 
  1.29e-05s  0.00e+00d  [FindAlmostIdenticalLinearConstraints] 
  3.50e-05s  1.81e-05d  [FindBigAtMostOneAndLinearOverlap] 
  4.96e-04s  1.69e-04d  [FindBigVerticalLinearOverlap] #blocks=1 #saved_nz=38 
  4.67e-05s  7.99e-06d  [FindBigHorizontalLinearOverlap] #linears=219 
  5.43e-06s  0.00e+00d  [MergeClauses] 
  2.76e-04s  0.00e+00d  [DetectDominanceRelations] 
  2.88e-03s  0.00e+00d  [PresolveToFixPoint] #num_loops=2 #num_dual_strengthening=1 
  2.74e-04s  0.00e+00d  [DetectDominanceRelations] 
  2.53e-03s  0.00e+00d  [PresolveToFixPoint] #num_loops=1 #num_dual_strengthening=1 
[Symmetry] Graph for symmetry has 875 nodes and 3'586 arcs.
[Symmetry] Symmetry computation done. time: 0.000199466 dtime: 0.00023564
  1.75e-03s  1.79e-04d  [Probe] #probed=160 
  5.87e-06s  0.00e+00d  [MaxClique] 
  2.76e-04s  0.00e+00d  [DetectDominanceRelations] 
  2.57e-03s  0.00e+00d  [PresolveToFixPoint] #num_loops=1 #num_dual_strengthening=1 
  8.21e-04s  0.00e+00d  [ProcessAtMostOneAndLinear] 
  5.87e-04s  0.00e+00d  [DetectDuplicateConstraints] #without_enforcements=76 
  1.80e-04s  6.30e-06d  [DetectDominatedLinearConstraints] #relevant_constraints=336 #num_inclusions=21 
  1.28e-04s  0.00e+00d  [DetectDifferentVariables] #different=25 
  8.87e-05s  2.35e-06d  [ProcessSetPPC] #relevant_constraints=221 
  1.28e-05s  0.00e+00d  [FindAlmostIdenticalLinearConstraints] 
  3.53e-05s  1.77e-05d  [FindBigAtMostOneAndLinearOverlap] 
  4.45e-04s  1.65e-04d  [FindBigVerticalLinearOverlap] 
  4.68e-05s  7.99e-06d  [FindBigHorizontalLinearOverlap] #linears=219 
  5.22e-06s  0.00e+00d  [MergeClauses] 
  2.76e-04s  0.00e+00d  [DetectDominanceRelations] 
  2.55e-03s  0.00e+00d  [PresolveToFixPoint] #num_loops=1 #num_dual_strengthening=1 
  2.63e-05s  0.00e+00d  [ExpandObjective] #entries=20 #tight_variables=10 #tight_constraints=4 

Presolve summary:
  - 32 affine relations were detected.
  - rule 'TODO dual: only one blocking constraint?' was applied 475 times.
  - rule 'TODO dual: only one unspecified blocking constraint?' was applied 90 times.
  - rule 'TODO duplicate: identical constraint with different enforcements' was applied 212 times.
  - rule 'affine: new relation' was applied 32 times.
  - rule 'at_most_one: removed literals' was applied 9 times.
  - rule 'at_most_one: size one' was applied 9 times.
  - rule 'at_most_one: transformed into max clique.' was applied 1 time.
  - rule 'deductions: 102 stored' was applied 1 time.
  - rule 'dual: fix variable' was applied 15 times.
  - rule 'dual: reduced domain' was applied 41 times.
  - rule 'duplicate: merged rhs of linear constraint' was applied 32 times.
  - rule 'duplicate: removed constraint' was applied 163 times.
  - rule 'enforcement: false literal' was applied 16 times.
  - rule 'enforcement: true literal' was applied 12 times.
  - rule 'exactly_one: x and not(x)' was applied 1 time.
  - rule 'incompatible linear: add implication' was applied 30 times.
  - rule 'linear inclusion: redundant containing constraint' was applied 3 times.
  - rule 'linear matrix: common vertical rectangle' was applied 6 times.
  - rule 'linear: always true' was applied 443 times.
  - rule 'linear: doubleton free' was applied 8 times.
  - rule 'linear: empty' was applied 20 times.
  - rule 'linear: extracted enforcement literal' was applied 1'253 times.
  - rule 'linear: fixed or dup variables' was applied 910 times.
  - rule 'linear: positive equal one' was applied 3 times.
  - rule 'linear: reduced variable domains' was applied 73 times.
  - rule 'linear: remapped using affine relations' was applied 830 times.
  - rule 'linear: simplified rhs' was applied 2'329 times.
  - rule 'linear: variable substitution 1' was applied 8 times.
  - rule 'linear: variable substitution 3' was applied 2 times.
  - rule 'presolve: 62 unused variables removed.' was applied 1 time.
  - rule 'presolve: iteration' was applied 3 times.
  - rule 'probing: reduced enforced constraint to implication.' was applied 10 times.
  - rule 'symmetry: fixed to false in general orbit' was applied 1 time.

Presolved optimization model '': (model_fingerprint: 0x97343e25ff376da6)
#Variables: 91 (#ints: 6 in objective)
  - 40 Booleans in [0,1]
  - 1 in [-398,-53][3,351][407,689]
  - 1 in [-398,-41][3,363][407,701]
  - 1 in [0,230]
  - 4 in [0,255]
  - 1 in [0,283]
  - 1 in [0,298]
  - 1 in [0,306]
  - 1 in [0,315]
  - 1 in [0,330]
  - 3 in [0,336]
  - 1 in [0,343]
  - 3 in [0,348]
  - 3 in [0,360]
  - 1 in [3,318]
  - 1 in [3,339]
  - 1 in [3,346]
  - 1 in [3,351]
  - 1 in [3,363]
  - 1 in [20,363]
  - 1 in [20,363][424,767]
  - 1 in [37,373]
  - 1 in [37,373][441,777]
  - 1 in [51,366]
  - 2 in [63,393]
  - 1 in [69,399]
  - 3 in [87,393]
  - 1 in [93,399]
  - 2 in [95,393]
  - 1 in [101,399]
  - 3 in [110,393]
  - 1 in [116,399]
  - 3 in [138,393]
  - 1 in [144,399]
  - 1 in [149,404]
#kExactlyOne: 2 (#literals: 6)
#kLinear2: 242 (#enforced: 209 #multi: 174)
#kLinear3: 63 (#enforced: 53 #multi: 24)
#kLinearN: 240 (#enforced: 184) (#terms: 1'682)

Preloading model.
#Bound   0.06s best:inf   next:[149,1851] initial_domain
[Symmetry] Graph for symmetry has 771 nodes and 3'586 arcs.
[Symmetry] Symmetry computation done. time: 0.000186857 dtime: 0.0002294
#Model   0.06s var:91/91 constraints:547/547

Starting search at 0.06s with 48 workers.
16 full problem subsolvers: [core, default_lp, lb_tree_search, max_lp, no_lp, objective_lb_search, objective_lb_search_max_lp, objective_lb_search_no_lp, objective_shaving_search_max_lp, objective_shaving_search_no_lp, probing, probing_max_lp, pseudo_costs, quick_restart, quick_restart_no_lp, reduced_costs]
30 first solution subsolvers: [fj_long_default(2), fj_long_lin_default, fj_long_lin_perturb, fj_long_lin_random, fj_long_perturb, fj_long_random, fj_short_default(2), fj_short_lin_default(2), fj_short_lin_perturb, fj_short_lin_random, fj_short_perturb, fj_short_random, fs_random(4), fs_random_no_lp(4), fs_random_quick_restart(4), fs_random_quick_restart_no_lp(3)]
13 incomplete subsolvers: [feasibility_pump, graph_arc_lns, graph_cst_lns, graph_dec_lns, graph_var_lns, rins/rens, rnd_cst_lns, rnd_var_lns, violation_ls(5)]
3 helper subsolvers: [neighborhood_helper, synchronization_agent, update_gap_integral]
#Bound   0.07s best:inf   next:[150,1851] bool_core (num_cores=1 [size:1 mw:1] a=6 d=0 fixed=0/46 clauses=7)
#1       0.07s best:790   next:[150,789]  no_lp (fixed_bools=0/62)
#Bound   0.07s best:790   next:[159,789]  objective_lb_search_no_lp
#2       0.07s best:607   next:[159,606]  no_lp (fixed_bools=0/75)
#3       0.07s best:599   next:[159,598]  quick_restart_no_lp (fixed_bools=0/64)
#4       0.07s best:597   next:[159,596]  no_lp (fixed_bools=0/77)
#5       0.07s best:589   next:[159,588]  no_lp (fixed_bools=0/82)
#6       0.07s best:588   next:[159,587]  violation_ls(batch:1 #solutions_imported:1 #lin_moves:0 #lin_evals:9 #gen_moves:5 #gen_evals:0 #comp_moves:5 #backtracks:0 #weight_updates:0)
#7       0.07s best:583   next:[159,582]  quick_restart_no_lp (fixed_bools=0/67)
#8       0.07s best:577   next:[159,576]  no_lp (fixed_bools=0/85)
#9       0.07s best:576   next:[159,575]  violation_ls(batch:2 #solutions_imported:2 #lin_moves:5 #lin_evals:35 #gen_moves:5 #gen_evals:0 #comp_moves:5 #backtracks:0 #weight_updates:3)
#10      0.08s best:575   next:[159,574]  violation_ls(batch:2 #solutions_imported:2 #lin_moves:0 #lin_evals:63 #gen_moves:49 #gen_evals:0 #comp_moves:5 #backtracks:22 #weight_updates:0)
#11      0.08s best:574   next:[159,573]  violation_ls(batch:2 #solutions_imported:2 #lin_moves:4 #lin_evals:28 #gen_moves:4 #gen_evals:0 #comp_moves:4 #backtracks:0 #weight_updates:3)
#12      0.08s best:573   next:[159,572]  violation_ls(batch:3 #solutions_imported:3 #lin_moves:0 #lin_evals:44 #gen_moves:27 #gen_evals:0 #comp_moves:11 #backtracks:8 #weight_updates:0)
#13      0.08s best:572   next:[159,571]  violation_ls(batch:3 #solutions_imported:3 #lin_moves:5 #lin_evals:40 #gen_moves:9 #gen_evals:0 #comp_moves:9 #backtracks:0 #weight_updates:4)
#14      0.08s best:571   next:[159,570]  violation_ls(batch:3 #solutions_imported:3 #lin_moves:5 #lin_evals:34 #gen_moves:4 #gen_evals:0 #comp_moves:4 #backtracks:0 #weight_updates:3)
#15      0.08s best:567   next:[159,566]  graph_var_lns (d=0.71 s=53 t=0.10 p=1.00 stall=1 h=auto_l0) [presolve]
#Bound   0.08s best:567   next:[160,566]  objective_shaving_search_no_lp (vars=91 csts=548)
#16      0.08s best:538   next:[160,537]  no_lp (fixed_bools=0/90)
#17      0.08s best:537   next:[160,536]  no_lp (fixed_bools=0/94)
#Bound   0.08s best:537   next:[167,536]  default_lp
#Bound   0.08s best:537   next:[168,536]  quick_restart
#18      0.08s best:531   next:[168,530]  no_lp (fixed_bools=0/99)
#Bound   0.08s best:531   next:[191,530]  objective_lb_search_no_lp
#Bound   0.08s best:531   next:[192,530]  objective_lb_search_no_lp
#Bound   0.08s best:531   next:[194,530]  objective_lb_search_no_lp
#Bound   0.09s best:531   next:[205,530]  objective_lb_search_no_lp
#19      0.09s best:521   next:[205,520]  no_lp (fixed_bools=0/101)
#20      0.09s best:504   next:[205,503]  no_lp (fixed_bools=0/103)
#Bound   0.10s best:504   next:[328,503]  objective_lb_search_no_lp
#21      0.11s best:503   next:[328,502]  no_lp (fixed_bools=0/115)
#22      0.11s best:472   next:[328,471]  graph_arc_lns (d=0.88 s=93 t=0.10 p=1.00 stall=1 h=auto_l0)
#Bound   0.11s best:472   next:[330,471]  objective_lb_search_no_lp
#23      0.12s best:471   next:[330,470]  quick_restart_no_lp (fixed_bools=3/109)
#24      0.12s best:470   next:[330,469]  violation_ls(batch:5 #solutions_imported:5 #lin_moves:3'072 #lin_evals:14'604 #gen_moves:4 #gen_evals:0 #comp_moves:4 #backtracks:0 #weight_updates:492)
#25      0.12s best:469   next:[330,468]  violation_ls(batch:6 #solutions_imported:6 #lin_moves:3'073 #lin_evals:14'610 #gen_moves:4 #gen_evals:0 #comp_moves:4 #backtracks:0 #weight_updates:492)
#Bound   0.13s best:469   next:[331,468]  objective_lb_search_no_lp
#26      0.14s best:465   next:[331,464]  no_lp (fixed_bools=0/136)
#Bound   0.14s best:465   next:[333,464]  objective_lb_search_no_lp
#27      0.14s best:463   next:[333,462]  no_lp (fixed_bools=0/137)
#28      0.15s best:462   next:[333,461]  no_lp (fixed_bools=0/137)
#Bound   0.16s best:462   next:[363,461]  objective_lb_search_no_lp
#Bound   0.21s best:462   next:[365,461]  objective_lb_search_no_lp
#29      0.23s best:459   next:[365,458]  rins_pump_lns (d=0.88 s=89 t=0.10 p=1.00 stall=3 h=auto_l0)
#Bound   0.26s best:459   next:[370,458]  objective_lb_search_no_lp
#Bound   0.35s best:459   next:[371,458]  objective_shaving_search_no_lp (vars=91 csts=444)
#Bound   0.35s best:459   next:[372,458]  objective_lb_search
#Model   0.37s var:89/91 constraints:437/547
#Bound   0.40s best:459   next:[379,458]  objective_lb_search_no_lp
#Bound   0.41s best:459   next:[381,458]  objective_lb_search_no_lp
#Model   0.44s var:82/91 constraints:338/547
#Done    0.45s quick_restart_no_lp
#Done    0.45s no_lp
#Done    0.45s objective_lb_search_no_lp
#Done    0.45s quick_restart
#Done    0.45s objective_lb_search
#Done    0.45s pseudo_costs
#Done    0.45s default_lp
#Model   0.45s var:68/91 constraints:155/547
#Done    0.45s core
#Bound   0.45s best:459   next:[445,458]  objective_lb_search_no_lp [skipped_logs=5]

Task timing                                  n [     min,      max]      avg      dev     time         n [     min,      max]      avg      dev    dtime
                             'core':         1 [393.71ms, 393.71ms] 393.71ms   0.00ns 393.71ms         1 [107.26ms, 107.26ms] 107.26ms   0.00ns 107.26ms
                       'default_lp':         1 [391.21ms, 391.21ms] 391.21ms   0.00ns 391.21ms         1 [ 49.56ms,  49.56ms]  49.56ms   0.00ns  49.56ms
                 'feasibility_pump':        13 [971.71us,  46.82ms]  18.28ms   9.51ms 237.63ms        12 [  2.34ms,   2.83ms]   2.39ms 132.38us  28.65ms
                  'fj_long_default':         0 [  0.00ns,   0.00ns]   0.00ns   0.00ns   0.00ns         0 [  0.00ns,   0.00ns]   0.00ns   0.00ns   0.00ns
                  'fj_long_default':         0 [  0.00ns,   0.00ns]   0.00ns   0.00ns   0.00ns         0 [  0.00ns,   0.00ns]   0.00ns   0.00ns   0.00ns
              'fj_long_lin_default':         0 [  0.00ns,   0.00ns]   0.00ns   0.00ns   0.00ns         0 [  0.00ns,   0.00ns]   0.00ns   0.00ns   0.00ns
              'fj_long_lin_perturb':         0 [  0.00ns,   0.00ns]   0.00ns   0.00ns   0.00ns         0 [  0.00ns,   0.00ns]   0.00ns   0.00ns   0.00ns
               'fj_long_lin_random':         0 [  0.00ns,   0.00ns]   0.00ns   0.00ns   0.00ns         0 [  0.00ns,   0.00ns]   0.00ns   0.00ns   0.00ns
                  'fj_long_perturb':         0 [  0.00ns,   0.00ns]   0.00ns   0.00ns   0.00ns         0 [  0.00ns,   0.00ns]   0.00ns   0.00ns   0.00ns
                   'fj_long_random':         0 [  0.00ns,   0.00ns]   0.00ns   0.00ns   0.00ns         0 [  0.00ns,   0.00ns]   0.00ns   0.00ns   0.00ns
                 'fj_short_default':         0 [  0.00ns,   0.00ns]   0.00ns   0.00ns   0.00ns         0 [  0.00ns,   0.00ns]   0.00ns   0.00ns   0.00ns
                 'fj_short_default':         0 [  0.00ns,   0.00ns]   0.00ns   0.00ns   0.00ns         0 [  0.00ns,   0.00ns]   0.00ns   0.00ns   0.00ns
             'fj_short_lin_default':         0 [  0.00ns,   0.00ns]   0.00ns   0.00ns   0.00ns         0 [  0.00ns,   0.00ns]   0.00ns   0.00ns   0.00ns
             'fj_short_lin_default':         0 [  0.00ns,   0.00ns]   0.00ns   0.00ns   0.00ns         0 [  0.00ns,   0.00ns]   0.00ns   0.00ns   0.00ns
             'fj_short_lin_perturb':         0 [  0.00ns,   0.00ns]   0.00ns   0.00ns   0.00ns         0 [  0.00ns,   0.00ns]   0.00ns   0.00ns   0.00ns
              'fj_short_lin_random':         0 [  0.00ns,   0.00ns]   0.00ns   0.00ns   0.00ns         0 [  0.00ns,   0.00ns]   0.00ns   0.00ns   0.00ns
                 'fj_short_perturb':         0 [  0.00ns,   0.00ns]   0.00ns   0.00ns   0.00ns         0 [  0.00ns,   0.00ns]   0.00ns   0.00ns   0.00ns
                  'fj_short_random':         0 [  0.00ns,   0.00ns]   0.00ns   0.00ns   0.00ns         0 [  0.00ns,   0.00ns]   0.00ns   0.00ns   0.00ns
                        'fs_random':         1 [  4.94ms,   4.94ms]   4.94ms   0.00ns   4.94ms         1 [ 20.00ns,  20.00ns]  20.00ns   0.00ns  20.00ns
                        'fs_random':         1 [  5.55ms,   5.55ms]   5.55ms   0.00ns   5.55ms         1 [ 20.00ns,  20.00ns]  20.00ns   0.00ns  20.00ns
                        'fs_random':         1 [  5.96ms,   5.96ms]   5.96ms   0.00ns   5.96ms         1 [ 20.00ns,  20.00ns]  20.00ns   0.00ns  20.00ns
                        'fs_random':         1 [  7.94ms,   7.94ms]   7.94ms   0.00ns   7.94ms         1 [ 20.00ns,  20.00ns]  20.00ns   0.00ns  20.00ns
                  'fs_random_no_lp':         1 [  3.42ms,   3.42ms]   3.42ms   0.00ns   3.42ms         0 [  0.00ns,   0.00ns]   0.00ns   0.00ns   0.00ns
                  'fs_random_no_lp':         1 [  4.36ms,   4.36ms]   4.36ms   0.00ns   4.36ms         0 [  0.00ns,   0.00ns]   0.00ns   0.00ns   0.00ns
                  'fs_random_no_lp':         1 [  4.61ms,   4.61ms]   4.61ms   0.00ns   4.61ms         0 [  0.00ns,   0.00ns]   0.00ns   0.00ns   0.00ns
                  'fs_random_no_lp':         1 [  4.89ms,   4.89ms]   4.89ms   0.00ns   4.89ms         0 [  0.00ns,   0.00ns]   0.00ns   0.00ns   0.00ns
          'fs_random_quick_restart':         1 [  5.00ms,   5.00ms]   5.00ms   0.00ns   5.00ms         1 [ 20.00ns,  20.00ns]  20.00ns   0.00ns  20.00ns
          'fs_random_quick_restart':         1 [  5.41ms,   5.41ms]   5.41ms   0.00ns   5.41ms         1 [ 20.00ns,  20.00ns]  20.00ns   0.00ns  20.00ns
          'fs_random_quick_restart':         1 [  5.53ms,   5.53ms]   5.53ms   0.00ns   5.53ms         1 [ 20.00ns,  20.00ns]  20.00ns   0.00ns  20.00ns
          'fs_random_quick_restart':         1 [  5.71ms,   5.71ms]   5.71ms   0.00ns   5.71ms         1 [ 20.00ns,  20.00ns]  20.00ns   0.00ns  20.00ns
    'fs_random_quick_restart_no_lp':         1 [  4.60ms,   4.60ms]   4.60ms   0.00ns   4.60ms         0 [  0.00ns,   0.00ns]   0.00ns   0.00ns   0.00ns
    'fs_random_quick_restart_no_lp':         1 [  4.82ms,   4.82ms]   4.82ms   0.00ns   4.82ms         0 [  0.00ns,   0.00ns]   0.00ns   0.00ns   0.00ns
    'fs_random_quick_restart_no_lp':         1 [  5.29ms,   5.29ms]   5.29ms   0.00ns   5.29ms         0 [  0.00ns,   0.00ns]   0.00ns   0.00ns   0.00ns
                    'graph_arc_lns':        12 [  1.64ms, 245.74ms]  63.72ms  72.56ms 764.67ms        12 [ 10.00ns,  28.62ms]   5.82ms   8.88ms  69.79ms
                    'graph_cst_lns':        12 [550.94us,   4.33ms]   1.04ms   1.03ms  12.46ms         1 [ 10.00ns,  10.00ns]  10.00ns   0.00ns  10.00ns
                    'graph_dec_lns':        12 [  1.86ms, 258.81ms]  61.11ms  77.56ms 733.29ms        11 [ 10.00ns,  40.83ms]   6.84ms  12.28ms  75.24ms
                    'graph_var_lns':        12 [  2.03ms, 112.70ms]  33.02ms  32.49ms 396.27ms        11 [ 10.00ns,  11.66ms]   1.95ms   3.52ms  21.48ms
                   'lb_tree_search':         1 [388.46ms, 388.46ms] 388.46ms   0.00ns 388.46ms         1 [156.66ms, 156.66ms] 156.66ms   0.00ns 156.66ms
                           'max_lp':         1 [393.37ms, 393.37ms] 393.37ms   0.00ns 393.37ms         1 [ 96.64ms,  96.64ms]  96.64ms   0.00ns  96.64ms
                            'no_lp':         1 [388.49ms, 388.49ms] 388.49ms   0.00ns 388.49ms         1 [ 58.93ms,  58.93ms]  58.93ms   0.00ns  58.93ms
              'objective_lb_search':         1 [389.83ms, 389.83ms] 389.83ms   0.00ns 389.83ms         1 [ 63.78ms,  63.78ms]  63.78ms   0.00ns  63.78ms
       'objective_lb_search_max_lp':         1 [391.79ms, 391.79ms] 391.79ms   0.00ns 391.79ms         1 [ 98.14ms,  98.14ms]  98.14ms   0.00ns  98.14ms
        'objective_lb_search_no_lp':         1 [387.37ms, 387.37ms] 387.37ms   0.00ns 387.37ms         1 [ 50.64ms,  50.64ms]  50.64ms   0.00ns  50.64ms
  'objective_shaving_search_max_lp':        12 [  1.53ms,  83.99ms]  24.11ms  23.49ms 289.36ms         7 [142.42us,  11.99ms]   2.38ms   3.99ms  16.63ms
   'objective_shaving_search_no_lp':        12 [  1.88ms,  75.95ms]  23.91ms  22.15ms 286.96ms         7 [149.10us,   6.98ms]   2.19ms   2.44ms  15.30ms
                          'probing':         1 [393.04ms, 393.04ms] 393.04ms   0.00ns 393.04ms         1 [ 20.79ms,  20.79ms]  20.79ms   0.00ns  20.79ms
                   'probing_max_lp':         1 [394.00ms, 394.00ms] 394.00ms   0.00ns 394.00ms         1 [ 39.29ms,  39.29ms]  39.29ms   0.00ns  39.29ms
                     'pseudo_costs':         1 [390.34ms, 390.34ms] 390.34ms   0.00ns 390.34ms         1 [ 68.96ms,  68.96ms]  68.96ms   0.00ns  68.96ms
                    'quick_restart':         1 [390.54ms, 390.54ms] 390.54ms   0.00ns 390.54ms         1 [ 50.31ms,  50.31ms]  50.31ms   0.00ns  50.31ms
              'quick_restart_no_lp':         1 [388.01ms, 388.01ms] 388.01ms   0.00ns 388.01ms         1 [ 55.47ms,  55.47ms]  55.47ms   0.00ns  55.47ms
                    'reduced_costs':         1 [393.99ms, 393.99ms] 393.99ms   0.00ns 393.99ms         1 [ 58.92ms,  58.92ms]  58.92ms   0.00ns  58.92ms
                        'rins/rens':        13 [109.87us, 213.07ms]  91.26ms  79.80ms    1.19s         9 [ 10.00ns,  45.66ms]  15.12ms  14.47ms 136.09ms
                      'rnd_cst_lns':        13 [500.90us,  76.15ms]  22.34ms  25.02ms 290.43ms        10 [ 10.00ns,   6.55ms]   1.33ms   2.26ms  13.32ms
                      'rnd_var_lns':        13 [  1.19ms, 212.83ms]  51.30ms  60.02ms 666.84ms        12 [ 10.00ns,  37.67ms]   4.52ms  10.25ms  54.30ms
                     'violation_ls':         6 [215.14us, 145.37ms]  62.04ms  64.95ms 372.26ms         6 [430.00ns,  49.96ms]  21.44ms  22.45ms 128.63ms
                     'violation_ls':         6 [229.32us, 142.42ms]  61.85ms  62.61ms 371.07ms         6 [ 13.06us,  55.81ms]  24.82ms  25.02ms 148.94ms
                     'violation_ls':         7 [120.44us, 139.79ms]  49.68ms  59.31ms 347.76ms         7 [  8.56us,  50.41ms]  22.55ms  23.51ms 157.84ms
                     'violation_ls':         7 [158.24us, 138.87ms]  50.74ms  50.85ms 355.20ms         7 [  8.02us,  56.98ms]  25.16ms  23.01ms 176.10ms
                     'violation_ls':         9 [110.90us, 136.75ms]  38.49ms  52.93ms 346.38ms         9 [620.00ns,  49.70ms]  14.51ms  19.60ms 130.62ms

Search stats                        Bools  Conflicts  Branches  Restarts  BoolPropag  IntegerPropag
                           'core':    695        531     7'402     2'592     299'266        231'976
                     'default_lp':     40        512     3'173       707      11'439        162'940
                      'fs_random':     40          0         0         0           0              0
                      'fs_random':     40          0         0         0           0              0
                      'fs_random':     40          0         0         0           0              0
                      'fs_random':     40          0         0         0           0              0
                'fs_random_no_lp':     40          0         0         0           0              0
                'fs_random_no_lp':     40          0         0         0           0              0
                'fs_random_no_lp':     40          0         0         0           0              0
                'fs_random_no_lp':     40          0         0         0           0              0
        'fs_random_quick_restart':     40          0         0         0           0              0
        'fs_random_quick_restart':     40          0         0         0           0              0
        'fs_random_quick_restart':     40          0         0         0           0              0
        'fs_random_quick_restart':     40          0         0         0           0              0
  'fs_random_quick_restart_no_lp':     40          0         0         0           0              0
  'fs_random_quick_restart_no_lp':     40          0         0         0           0              0
  'fs_random_quick_restart_no_lp':     40          0         0         0           0              0
                 'lb_tree_search':     40         14       571        80         619          9'073
                         'max_lp':     40        154       964       321       2'832         41'673
                          'no_lp':    186      1'147     4'722       926      67'296        276'085
            'objective_lb_search':     49        454     1'867       724       5'969         77'879
     'objective_lb_search_max_lp':     43        213       584       204       2'487         29'130
      'objective_lb_search_no_lp':     71      1'452     4'272       946      21'648        251'610
                        'probing':    122         36       208       208         455          2'060
                 'probing_max_lp':     82         19       145       145         334          1'607
                   'pseudo_costs':     67         69     1'760       731       4'465         54'646
                  'quick_restart':     89        305     2'358       620       8'560         89'879
            'quick_restart_no_lp':    147      1'494     5'780       858      49'857        246'936
                  'reduced_costs':    146        217     2'363       643      33'948        103'634

SAT stats                           ClassicMinim  LitRemoved  LitLearned  LitForgotten  Subsumed  MClauses  MDecisions  MLitTrue  MSubsumed  MLitRemoved  MReused
                           'core':           229         559       1'251             0        10     1'075       5'456         0         49          182       22
                     'default_lp':           208         383       3'321             0        72       344       2'444         0        128          726       59
                      'fs_random':             0           0           0             0         0         0           0         0          0            0        0
                      'fs_random':             0           0           0             0         0         0           0         0          0            0        0
                      'fs_random':             0           0           0             0         0         0           0         0          0            0        0
                      'fs_random':             0           0           0             0         0         0           0         0          0            0        0
                'fs_random_no_lp':             0           0           0             0         0         0           0         0          0            0        0
                'fs_random_no_lp':             0           0           0             0         0         0           0         0          0            0        0
                'fs_random_no_lp':             0           0           0             0         0         0           0         0          0            0        0
                'fs_random_no_lp':             0           0           0             0         0         0           0         0          0            0        0
        'fs_random_quick_restart':             0           0           0             0         0         0           0         0          0            0        0
        'fs_random_quick_restart':             0           0           0             0         0         0           0         0          0            0        0
        'fs_random_quick_restart':             0           0           0             0         0         0           0         0          0            0        0
        'fs_random_quick_restart':             0           0           0             0         0         0           0         0          0            0        0
  'fs_random_quick_restart_no_lp':             0           0           0             0         0         0           0         0          0            0        0
  'fs_random_quick_restart_no_lp':             0           0           0             0         0         0           0         0          0            0        0
  'fs_random_quick_restart_no_lp':             0           0           0             0         0         0           0         0          0            0        0
                 'lb_tree_search':             3           8          73             0         0         0           0         0          0            0        0
                         'max_lp':            78         136       1'145             0        14        65         444         0         16           88       10
                          'no_lp':           717       1'704       7'717             0        78       317       1'959         0        141          794       38
            'objective_lb_search':           289         540       2'238             0        39       144         621         0         75          365        9
     'objective_lb_search_max_lp':           125         261       1'356             0        24        10          56         0          0            0        0
      'objective_lb_search_no_lp':           990       2'200       7'627             0        98       302       2'009         0        101          527       46
                        'probing':             0           0          36             0         0         0           0         0          0            0        0
                 'probing_max_lp':             0           0          19             0         0         0           0         0          0            0        0
                   'pseudo_costs':            20          24         484             0        16       128         921         0         15           87       65
                  'quick_restart':           169         396       2'446             0        28       170       1'239         0         47          332       48
            'quick_restart_no_lp':           899       2'194      12'303             0        67       220       1'592         0         68          401       27
                  'reduced_costs':           125         267       1'115             0        10       259       1'684         0        137          732       33

Lp stats                         Component  Iterations  AddedCuts  OPTIMAL  DUAL_F.  DUAL_U.
                  'default_lp':          1       1'658        545      428        0        0
                   'fs_random':          1           0          0        0        0        0
                   'fs_random':          1           0          0        0        0        0
                   'fs_random':          1           0          0        0        0        0
                   'fs_random':          1           0          0        0        0        0
     'fs_random_quick_restart':          1           0          0        0        0        0
     'fs_random_quick_restart':          1           0          0        0        0        0
     'fs_random_quick_restart':          1           0          0        0        0        0
     'fs_random_quick_restart':          1           0          0        0        0        0
              'lb_tree_search':          1       4'279        790      265       90        0
                      'max_lp':          1       2'533        762      233       35        0
         'objective_lb_search':          1       3'011        797      497        0        0
  'objective_lb_search_max_lp':          1       4'281        808      287      116        0
                     'probing':          1         622        640      469        0        0
              'probing_max_lp':          1         699      1'100       59        1        0
                'pseudo_costs':          1       2'025      1'047      137       31        0
               'quick_restart':          1       2'609        668      553        0        0
               'reduced_costs':          1       1'428        876      131       25        0

Lp dimension                                                                     Final dimension of first component
                  'default_lp':    155 rows, 82 columns, 293 entries with magnitude in [4.067259e-03, 1.000000e+00]
                   'fs_random':        0 rows, 82 columns, 0 entries with magnitude in [0.000000e+00, 0.000000e+00]
                   'fs_random':        0 rows, 82 columns, 0 entries with magnitude in [0.000000e+00, 0.000000e+00]
                   'fs_random':        0 rows, 82 columns, 0 entries with magnitude in [0.000000e+00, 0.000000e+00]
                   'fs_random':        0 rows, 82 columns, 0 entries with magnitude in [0.000000e+00, 0.000000e+00]
     'fs_random_quick_restart':        0 rows, 82 columns, 0 entries with magnitude in [0.000000e+00, 0.000000e+00]
     'fs_random_quick_restart':        0 rows, 82 columns, 0 entries with magnitude in [0.000000e+00, 0.000000e+00]
     'fs_random_quick_restart':        0 rows, 82 columns, 0 entries with magnitude in [0.000000e+00, 0.000000e+00]
     'fs_random_quick_restart':        0 rows, 82 columns, 0 entries with magnitude in [0.000000e+00, 0.000000e+00]
              'lb_tree_search':    240 rows, 91 columns, 853 entries with magnitude in [1.157644e-02, 1.000000e+00]
                      'max_lp':   286 rows, 91 columns, 1074 entries with magnitude in [1.049030e-02, 1.000000e+00]
         'objective_lb_search':    151 rows, 82 columns, 256 entries with magnitude in [1.489494e-02, 1.000000e+00]
  'objective_lb_search_max_lp':   359 rows, 91 columns, 1560 entries with magnitude in [5.627781e-04, 1.000000e+00]
                     'probing':     54 rows, 82 columns, 280 entries with magnitude in [1.333818e-03, 1.000000e+00]
              'probing_max_lp':  1115 rows, 91 columns, 6348 entries with magnitude in [2.029914e-04, 1.000000e+00]
                'pseudo_costs':   649 rows, 91 columns, 3022 entries with magnitude in [6.886896e-04, 1.000000e+00]
               'quick_restart':    178 rows, 82 columns, 323 entries with magnitude in [1.463926e-03, 1.000000e+00]
               'reduced_costs':   500 rows, 91 columns, 1054 entries with magnitude in [1.259642e-03, 1.000000e+00]

Lp debug                         CutPropag  CutEqPropag  Adjust  Overflow    Bad  BadScaling
                  'default_lp':          0            0     166         0    759           0
                   'fs_random':          0            0       0         0      0           0
                   'fs_random':          0            0       0         0      0           0
                   'fs_random':          0            0       0         0      0           0
                   'fs_random':          0            0       0         0      0           0
     'fs_random_quick_restart':          0            0       0         0      0           0
     'fs_random_quick_restart':          0            0       0         0      0           0
     'fs_random_quick_restart':          0            0       0         0      0           0
     'fs_random_quick_restart':          0            0       0         0      0           0
              'lb_tree_search':          0            0     300         0    430           0
                      'max_lp':          0            0     182         0  2'026           0
         'objective_lb_search':          5            0     198         0  1'759           0
  'objective_lb_search_max_lp':          1            1     287         0  1'141           0
                     'probing':          0            0     139         0  3'028           0
              'probing_max_lp':          2            0      54         0  6'263           0
                'pseudo_costs':          1            0      95         0  2'838           0
               'quick_restart':         20            0     264         0  1'396           0
               'reduced_costs':          0            0     129         0  1'896           0

Lp pool                          Constraints  Updates  Simplif  Merged  Shortened  Split  Strenghtened    Cuts/Call
                  'default_lp':          643      272    1'301       3        526     90           861    545/1'017
                   'fs_random':          101        0        0       0          0      0             0          0/0
                   'fs_random':          101        0        0       0          0      0             0          0/0
                   'fs_random':          101        0        0       0          0      0             0          0/0
                   'fs_random':          101        0        0       0          0      0             0          0/0
     'fs_random_quick_restart':          101        0        0       0          0      0             0          0/0
     'fs_random_quick_restart':          101        0        0       0          0      0             0          0/0
     'fs_random_quick_restart':          101        0        0       0          0      0             0          0/0
     'fs_random_quick_restart':          101        0        0       0          0      0             0          0/0
              'lb_tree_search':        1'330       46      354       7          0      8           706    790/1'246
                      'max_lp':        1'307      127    1'654       2        240     26         2'282    762/1'340
         'objective_lb_search':          897      311    1'187       1        767    135           872    797/1'310
  'objective_lb_search_max_lp':        1'353      115      991       2          0      7         2'102    808/1'460
                     'probing':          727      160       55      14          0    263           131    640/1'013
              'probing_max_lp':        1'645       76      565       2          0     14         1'115  1'100/1'869
                'pseudo_costs':        1'590      212    2'847       4        663     18         3'316  1'047/1'868
               'quick_restart':          767      328    2'542       2        795    224         1'333    668/1'214
               'reduced_costs':        1'420      162    2'612       3      1'014     16         3'109    876/1'584

Lp Cut            defaul  max_lp  quick_  reduce  pseudo  lb_tre  probin  object  probin  object
          CG_FF:      63      56      82      58      61     111      44      87      61      56
           CG_K:      41      25      45      37      48      46      27      46      27      33
           CG_R:      51      37      62      52      32      46      31      69      41      39
          CG_RB:      80     149     128     195     306     208     140     161     285     218
         CG_RBP:       8       8      27       5       6       9      13      24      22      10
         Clique:       -      11       -      10       8       9       -       -       4      14
             IB:      80      78      85      88      91      77      90      76      55      98
       MIR_1_FF:      30      76      31      72      65      73      21      31      81      68
        MIR_1_K:       4       7       4       3       2       9       2       2      10       1
        MIR_1_R:       6       4       4       6       8       5       2       9       7       6
       MIR_1_RB:      26      59      30      77     104      44      39      31     119      61
      MIR_1_RBP:       -      11       3      14      17      13       2       -      18      14
      MIR_1_RLT:       -       2       -       2       2       3       -       -       3       1
       MIR_2_FF:      24      20      27      31      28      20      21      31      21      18
        MIR_2_K:       3      10       2       6       8       5       -       4      10       3
        MIR_2_R:      12      10       6      16      14       4      13      17      19      11
       MIR_2_RB:      20      25      26      35      44      21      36      30      48      23
      MIR_2_RBP:       2       5       7       2       6       1       2       3       8       3
       MIR_3_FF:      13       7      12      14      16       5      25      19      15      13
        MIR_3_K:       3       6       1       8       4       -       2       2       5       1
        MIR_3_R:      12       4       6       9       9       1      22      14      12       4
       MIR_3_RB:       9      10       9      13      20       5      25      15      25      12
      MIR_3_RBP:       2       1       3       -       3       -       2       2       3       1
       MIR_4_FF:       4       4       9       3       2       3       9      19       5       1
        MIR_4_K:       3       3       2       3       3       1       3       8       2       3
        MIR_4_R:       5       1       7       4       1       2      10      16       4       3
       MIR_4_RB:       4       5       1       8       3       4       7      21      10       5
      MIR_4_RBP:       -       1       -       -       -       -       -       4       1       1
       MIR_5_FF:       1       2       7       1       -       -       1       4       4       -
        MIR_5_K:       -       1       2       2       2       -       -       2       1       1
        MIR_5_R:       2       -       4       2       -       -       2       3       5       -
       MIR_5_RB:       1       -       -       1       1       -       2       6       1       1
       MIR_6_FF:       -       -       -       1       -       -       -       1       3       -
        MIR_6_K:       1       -       -       -       -       -       -       -       1       -
        MIR_6_R:       -       -       -       -       -       -       -       1       3       -
       MIR_6_RB:       1       1       1       -       -       -       1       2       2       -
   ZERO_HALF_FF:       7      22       7      18      23      17       8       8      20      19
    ZERO_HALF_K:       -       1       -       -       1       4       1       -       3       -
    ZERO_HALF_R:      16      73      17      50      67      24      22      15     100      35
   ZERO_HALF_RB:      10      25      11      25      38      16      15      12      29      25
  ZERO_HALF_RBP:       1       2       -       5       4       4       -       2       7       6

LNS stats           Improv/Calls  Closed  Difficulty  TimeLimit
  'graph_arc_lns':          4/12    100%        0.99       0.10
  'graph_cst_lns':           0/1    100%        0.71       0.10
  'graph_dec_lns':          4/12     83%        0.98       0.10
  'graph_var_lns':          2/12     92%        0.99       0.10
      'rins/rens':          4/12     75%        0.96       0.10
    'rnd_cst_lns':          0/10    100%        0.99       0.10
    'rnd_var_lns':          3/13     85%        0.98       0.10

LS stats                   Batches  Restarts  LinMoves  GenMoves  CompoundMoves  WeightUpdates
       'fj_long_default':        0         0         0         0              0              0
       'fj_long_default':        0         0         0         0              0              0
   'fj_long_lin_default':        0         0         0         0              0              0
   'fj_long_lin_perturb':        0         0         0         0              0              0
    'fj_long_lin_random':        0         0         0         0              0              0
       'fj_long_perturb':        0         0         0         0              0              0
        'fj_long_random':        0         0         0         0              0              0
      'fj_short_default':        0         0         0         0              0              0
      'fj_short_default':        0         0         0         0              0              0
  'fj_short_lin_default':        0         0         0         0              0              0
  'fj_short_lin_default':        0         0         0         0              0              0
  'fj_short_lin_perturb':        0         0         0         0              0              0
   'fj_short_lin_random':        0         0         0         0              0              0
      'fj_short_perturb':        0         0         0         0              0              0
       'fj_short_random':        0         0         0         0              0              0
          'violation_ls':        6         0         0    36'825            725            221
          'violation_ls':        6         0     8'922    25'479            641          1'238
          'violation_ls':        7         0    19'510    13'370            214          6'582
          'violation_ls':        7         0     6'589    27'030            621          5'181
          'violation_ls':        9         0     3'073    28'337            941            659

Solutions (29)            Num     Rank
        'graph_arc_lns':    1  [22,22]
        'graph_var_lns':    1  [15,15]
                'no_lp':   14   [1,28]
  'quick_restart_no_lp':    3   [3,23]
        'rins_pump_lns':    1  [29,29]
         'violation_ls':    9   [6,25]

Objective bounds                     Num
                       'bool_core':    1
                      'default_lp':    1
                  'initial_domain':    1
             'objective_lb_search':    1
       'objective_lb_search_no_lp':   20
  'objective_shaving_search_no_lp':    2
                   'quick_restart':    1

Solution repositories    Added  Queried  Ignored  Synchro
  'feasible solutions':    101      218        1       67
        'lp solutions':      5        0        0        5
                'pump':    250       13

Improving bounds shared         Num
                       'core':   18
                 'default_lp':   40
                      'no_lp':  101
        'objective_lb_search':   68
  'objective_lb_search_no_lp':   16
                    'probing':   28
             'probing_max_lp':    2
               'pseudo_costs':    9
              'quick_restart':   81
        'quick_restart_no_lp':  224

Clauses shared                  Num
                       'core':    7
                 'default_lp':    9
                     'max_lp':    1
                      'no_lp':   30
        'objective_lb_search':   13
  'objective_lb_search_no_lp':    3
               'pseudo_costs':    2
              'quick_restart':    2
        'quick_restart_no_lp':   11
              'reduced_costs':    1

CpSolverResponse summary:
status: OPTIMAL
objective: 459
best_bound: 459
integers: 83
booleans: 40
conflicts: 0
branches: 0
propagations: 0
integer_propagations: 0
restarts: 0
lp_iterations: 0
walltime: 0.465516
usertime: 0.465516
deterministic_time: 2.14943
gap_integral: 6.0175
solution_fingerprint: 0x75eb84bc3cf58026


--- Simulation Gantt  partir du modle mathmatique ---
{'big':1, 'due_date':174, 'pos_time':5, 'status':0, 'blocked':0, 'operations':["{'type':0, 'processing_time':11}", "{'type':1, 'processing_time':36}"]}
{'big':0, 'due_date':98, 'pos_time':5, 'status':0, 'blocked':0, 'operations':["{'type':0, 'processing_time':28}", "{'type':1, 'processing_time':26}"]}
{'big':0, 'due_date':74, 'pos_time':5, 'status':0, 'blocked':0, 'operations':["{'type':1, 'processing_time':36}"]}
{'big':1, 'due_date':121, 'pos_time':5, 'status':0, 'blocked':0, 'operations':["{'type':0, 'processing_time':42}", "{'type':1, 'processing_time':33}"]}
{'big':0, 'due_date':106, 'pos_time':5, 'status':0, 'blocked':0, 'operations':["{'type':1, 'processing_time':48}"]}
