created virtual environment CPython3.12.4.final.0-64 in 7865ms
  creator CPython3Posix(dest=/localscratch/aneumann.63393206.0/env, clear=False, no_vcs_ignore=False, global=False)
  seeder FromAppData(download=False, pip=bundle, via=copy, app_data_dir=/home/aneumann/.local/share/virtualenv)
    added seed packages: pip==25.1.1
  activators BashActivator,CShellActivator,FishActivator,NushellActivator,PowerShellActivator,PythonActivator
Looking in links: /cvmfs/soft.computecanada.ca/custom/python/wheelhouse/gentoo2023/x86-64-v3, /cvmfs/soft.computecanada.ca/custom/python/wheelhouse/gentoo2023/generic, /cvmfs/soft.computecanada.ca/custom/python/wheelhouse/generic
Requirement already satisfied: pip in /localscratch/aneumann.63393206.0/env/lib/python3.12/site-packages (25.1.1)
Looking in links: /cvmfs/soft.computecanada.ca/custom/python/wheelhouse/gentoo2023/x86-64-v3, /cvmfs/soft.computecanada.ca/custom/python/wheelhouse/gentoo2023/generic, /cvmfs/soft.computecanada.ca/custom/python/wheelhouse/generic
ERROR: protobuf-5.28.3-cp38-abi3-manylinux2014_x86_64.whl is not a supported wheel on this platform.
Looking in links: /cvmfs/soft.computecanada.ca/custom/python/wheelhouse/gentoo2023/x86-64-v3, /cvmfs/soft.computecanada.ca/custom/python/wheelhouse/gentoo2023/generic, /cvmfs/soft.computecanada.ca/custom/python/wheelhouse/generic
Processing /home/aneumann/projects/def-adhaj/aneumann/GNRS/wheels/immutabledict-4.2.0-py3-none-any.whl
Installing collected packages: immutabledict
Successfully installed immutabledict-4.2.0
Looking in links: /cvmfs/soft.computecanada.ca/custom/python/wheelhouse/gentoo2023/x86-64-v3, /cvmfs/soft.computecanada.ca/custom/python/wheelhouse/gentoo2023/generic, /cvmfs/soft.computecanada.ca/custom/python/wheelhouse/generic
Processing /cvmfs/soft.computecanada.ca/custom/python/wheelhouse/generic/ortools-9.10.4067+computecanada-cp312-cp312-linux_x86_64.whl (from -r /home/aneumann/projects/def-adhaj/aneumann/GNRS/requirements/or.txt (line 1))
Processing /cvmfs/soft.computecanada.ca/custom/python/wheelhouse/gentoo2023/x86-64-v3/matplotlib-3.10.0+computecanada-cp312-cp312-linux_x86_64.whl (from -r /home/aneumann/projects/def-adhaj/aneumann/GNRS/requirements/or.txt (line 2))
Processing /cvmfs/soft.computecanada.ca/custom/python/wheelhouse/gentoo2023/x86-64-v3/pandas-2.2.3+computecanada-cp312-cp312-linux_x86_64.whl (from -r /home/aneumann/projects/def-adhaj/aneumann/GNRS/requirements/or.txt (line 3))
Processing /cvmfs/soft.computecanada.ca/custom/python/wheelhouse/generic/absl_py-2.2.2+computecanada-py3-none-any.whl (from ortools<9.11,>=9.10->-r /home/aneumann/projects/def-adhaj/aneumann/GNRS/requirements/or.txt (line 1))
Processing /cvmfs/soft.computecanada.ca/custom/python/wheelhouse/gentoo2023/generic/numpy-2.2.2+computecanada-cp312-cp312-linux_x86_64.whl (from ortools<9.11,>=9.10->-r /home/aneumann/projects/def-adhaj/aneumann/GNRS/requirements/or.txt (line 1))
Processing /cvmfs/soft.computecanada.ca/custom/python/wheelhouse/gentoo2023/x86-64-v3/protobuf-6.30.2+computecanada-cp312-cp312-linux_x86_64.whl (from ortools<9.11,>=9.10->-r /home/aneumann/projects/def-adhaj/aneumann/GNRS/requirements/or.txt (line 1))
Requirement already satisfied: immutabledict>=3.0.0 in /localscratch/aneumann.63393206.0/env/lib/python3.12/site-packages (from ortools<9.11,>=9.10->-r /home/aneumann/projects/def-adhaj/aneumann/GNRS/requirements/or.txt (line 1)) (4.2.0)
Processing /cvmfs/soft.computecanada.ca/custom/python/wheelhouse/gentoo2023/generic/contourpy-1.3.1+computecanada-cp312-cp312-linux_x86_64.whl (from matplotlib->-r /home/aneumann/projects/def-adhaj/aneumann/GNRS/requirements/or.txt (line 2))
Processing /cvmfs/soft.computecanada.ca/custom/python/wheelhouse/generic/cycler-0.12.1+computecanada-py3-none-any.whl (from matplotlib->-r /home/aneumann/projects/def-adhaj/aneumann/GNRS/requirements/or.txt (line 2))
Processing /cvmfs/soft.computecanada.ca/custom/python/wheelhouse/generic/fonttools-4.58.2+computecanada-cp312-cp312-linux_x86_64.whl (from matplotlib->-r /home/aneumann/projects/def-adhaj/aneumann/GNRS/requirements/or.txt (line 2))
Processing /cvmfs/soft.computecanada.ca/custom/python/wheelhouse/gentoo2023/x86-64-v3/kiwisolver-1.4.8+computecanada-cp312-cp312-linux_x86_64.whl (from matplotlib->-r /home/aneumann/projects/def-adhaj/aneumann/GNRS/requirements/or.txt (line 2))
Processing /cvmfs/soft.computecanada.ca/custom/python/wheelhouse/generic/packaging-25.0+computecanada-py3-none-any.whl (from matplotlib->-r /home/aneumann/projects/def-adhaj/aneumann/GNRS/requirements/or.txt (line 2))
Processing /cvmfs/soft.computecanada.ca/custom/python/wheelhouse/gentoo2023/x86-64-v3/pillow-11.1.0+computecanada-cp312-cp312-linux_x86_64.whl (from matplotlib->-r /home/aneumann/projects/def-adhaj/aneumann/GNRS/requirements/or.txt (line 2))
Processing /cvmfs/soft.computecanada.ca/custom/python/wheelhouse/generic/pyparsing-3.2.1+computecanada-py3-none-any.whl (from matplotlib->-r /home/aneumann/projects/def-adhaj/aneumann/GNRS/requirements/or.txt (line 2))
Processing /cvmfs/soft.computecanada.ca/custom/python/wheelhouse/generic/python_dateutil-2.9.0.post0+computecanada-py2.py3-none-any.whl (from matplotlib->-r /home/aneumann/projects/def-adhaj/aneumann/GNRS/requirements/or.txt (line 2))
Processing /cvmfs/soft.computecanada.ca/custom/python/wheelhouse/generic/pytz-2025.2+computecanada-py2.py3-none-any.whl (from pandas->-r /home/aneumann/projects/def-adhaj/aneumann/GNRS/requirements/or.txt (line 3))
Processing /cvmfs/soft.computecanada.ca/custom/python/wheelhouse/generic/tzdata-2025.2+computecanada-py2.py3-none-any.whl (from pandas->-r /home/aneumann/projects/def-adhaj/aneumann/GNRS/requirements/or.txt (line 3))
Processing /cvmfs/soft.computecanada.ca/custom/python/wheelhouse/generic/six-1.17.0+computecanada-py2.py3-none-any.whl (from python-dateutil>=2.7->matplotlib->-r /home/aneumann/projects/def-adhaj/aneumann/GNRS/requirements/or.txt (line 2))
Installing collected packages: pytz, tzdata, six, pyparsing, protobuf, pillow, packaging, numpy, kiwisolver, fonttools, cycler, absl-py, python-dateutil, contourpy, pandas, matplotlib, ortools

Successfully installed absl-py-2.2.2+computecanada contourpy-1.3.1+computecanada cycler-0.12.1+computecanada fonttools-4.58.2+computecanada kiwisolver-1.4.8+computecanada matplotlib-3.10.0+computecanada numpy-2.2.2+computecanada ortools-9.10.4067+computecanada packaging-25.0+computecanada pandas-2.2.3+computecanada pillow-11.1.0+computecanada protobuf-6.30.2+computecanada pyparsing-3.2.1+computecanada python-dateutil-2.9.0.post0+computecanada pytz-2025.2+computecanada six-1.17.0+computecanada tzdata-2025.2+computecanada

Starting CP-SAT solver v9.10.4067
Parameters: max_time_in_seconds: 3600 max_memory_in_mb: 12000 log_search_progress: true enumerate_all_solutions: false absolute_gap_limit: 0 relative_gap_limit: 0
Setting number of workers to 48

Initial optimization model '': (model_fingerprint: 0xac535b36244f199c)
#Variables: 318 (#ints: 10 in objective)
  - 219 Booleans in [0,1]
  - 99 in [0,556]
#kLinear1: 42
#kLinear2: 591
#kLinear3: 247
#kLinearN: 3'107 (#terms: 47'544)

Starting presolve at 0.00s
  2.65e-03s  0.00e+00d  [DetectDominanceRelations] 
  5.56e-02s  0.00e+00d  [PresolveToFixPoint] #num_loops=6 #num_dual_strengthening=3 
  3.47e-05s  0.00e+00d  [ExtractEncodingFromLinear] #potential_supersets=5 
[Symmetry] Graph for symmetry has 3'838 nodes and 37'904 arcs.
[Symmetry] Symmetry computation done. time: 0.00314355 dtime: 0.00359922
[Symmetry] #generators: 1, average support size: 28
[Symmetry] The model contains 297 duplicate constraints !
[Symmetry] 14 orbits with sizes: 2,2,2,2,2,2,2,2,2,2,...
[Symmetry] Num fixable by intersecting at_most_one with orbits: 1 largest_orbit: 2
  1.36e-02s  1.84e-03d  [Probe] #probed=304 #fixed_bools=2 #new_bounds=13 #equiv=1 
  3.88e-05s  0.00e+00d  [MaxClique] 
  2.62e-03s  0.00e+00d  [DetectDominanceRelations] 
  2.54e-02s  0.00e+00d  [PresolveToFixPoint] #num_loops=4 #num_dual_strengthening=3 
  9.71e-03s  0.00e+00d  [ProcessAtMostOneAndLinear] 
  4.02e-03s  0.00e+00d  [DetectDuplicateConstraints] #duplicates=344 #without_enforcements=74 
  3.17e-03s  1.47e-04d  [DetectDominatedLinearConstraints] #relevant_constraints=2'711 #num_inclusions=1'481 #num_redundant=1 
  4.57e-04s  0.00e+00d  [DetectDifferentVariables] #different=34 
  9.01e-04s  5.31e-05d  [ProcessSetPPC] #relevant_constraints=2'292 
  3.06e-05s  0.00e+00d  [FindAlmostIdenticalLinearConstraints] 
  3.34e-04s  3.08e-04d  [FindBigAtMostOneAndLinearOverlap] 
  1.15e-02s  3.51e-03d  [FindBigVerticalLinearOverlap] #blocks=54 #saved_nz=6'822 
  4.62e-04s  1.20e-04d  [FindBigHorizontalLinearOverlap] #linears=2'189 
  1.69e-05s  0.00e+00d  [MergeClauses] 
  2.71e-03s  0.00e+00d  [DetectDominanceRelations] 
  3.28e-02s  0.00e+00d  [PresolveToFixPoint] #num_loops=2 #num_dual_strengthening=1 
  2.70e-03s  0.00e+00d  [DetectDominanceRelations] 
  1.87e-02s  0.00e+00d  [PresolveToFixPoint] #num_loops=1 #num_dual_strengthening=1 
[Symmetry] Graph for symmetry has 3'659 nodes and 29'997 arcs.
[Symmetry] Symmetry computation done. time: 0.00123017 dtime: 0.00182206
  1.22e-02s  1.64e-03d  [Probe] #probed=300 #new_bounds=42 
  1.70e-05s  0.00e+00d  [MaxClique] 
  2.69e-03s  0.00e+00d  [DetectDominanceRelations] 
  2.94e-02s  0.00e+00d  [PresolveToFixPoint] #num_loops=2 #num_dual_strengthening=1 
  8.50e-03s  0.00e+00d  [ProcessAtMostOneAndLinear] 
  3.51e-03s  0.00e+00d  [DetectDuplicateConstraints] #without_enforcements=104 
  1.98e-03s  9.46e-05d  [DetectDominatedLinearConstraints] #relevant_constraints=2'414 #num_inclusions=234 
  4.66e-04s  0.00e+00d  [DetectDifferentVariables] #different=42 #cliques=1 #size=3 
  7.64e-04s  3.74e-05d  [ProcessSetPPC] #relevant_constraints=2'053 
  4.21e-05s  1.05e-07d  [FindAlmostIdenticalLinearConstraints] #num_tested_pairs=7 
  1.87e-04s  1.28e-04d  [FindBigAtMostOneAndLinearOverlap] 
  7.68e-03s  2.44e-03d  [FindBigVerticalLinearOverlap] #blocks=42 #saved_nz=4'722 
  4.01e-04s  8.85e-05d  [FindBigHorizontalLinearOverlap] #linears=1'980 
  1.67e-05s  0.00e+00d  [MergeClauses] 
  2.35e-03s  0.00e+00d  [DetectDominanceRelations] 
  3.33e-02s  0.00e+00d  [PresolveToFixPoint] #num_loops=2 #num_dual_strengthening=1 
  2.35e-03s  0.00e+00d  [DetectDominanceRelations] 
  2.22e-02s  0.00e+00d  [PresolveToFixPoint] #num_loops=1 #num_dual_strengthening=1 
  1.15e-02s  1.47e-03d  [Probe] #probed=300 #new_bounds=35 
  1.74e-05s  0.00e+00d  [MaxClique] 
  2.31e-03s  0.00e+00d  [DetectDominanceRelations] 
  3.07e-02s  0.00e+00d  [PresolveToFixPoint] #num_loops=2 #num_dual_strengthening=1 
  7.42e-03s  0.00e+00d  [ProcessAtMostOneAndLinear] 
  3.38e-03s  0.00e+00d  [DetectDuplicateConstraints] #without_enforcements=130 
  1.51e-03s  6.66e-05d  [DetectDominatedLinearConstraints] #relevant_constraints=2'293 #num_inclusions=55 
  3.19e-04s  0.00e+00d  [DetectDifferentVariables] 
  6.24e-04s  2.59e-05d  [ProcessSetPPC] #relevant_constraints=1'862 
  5.26e-05s  6.10e-07d  [FindAlmostIdenticalLinearConstraints] #num_tested_pairs=28 
  1.62e-04s  1.03e-04d  [FindBigAtMostOneAndLinearOverlap] 
  4.23e-03s  1.59e-03d  [FindBigVerticalLinearOverlap] #blocks=29 #saved_nz=2'146 
  3.60e-04s  7.04e-05d  [FindBigHorizontalLinearOverlap] #linears=1'762 
  1.74e-05s  0.00e+00d  [MergeClauses] 
  2.13e-03s  0.00e+00d  [DetectDominanceRelations] 
  2.81e-02s  0.00e+00d  [PresolveToFixPoint] #num_loops=2 #num_dual_strengthening=1 
  1.06e-04s  0.00e+00d  [ExpandObjective] #entries=562 #tight_variables=175 #tight_constraints=97 

Presolve summary:
  - 62 affine relations were detected.
  - rule 'TODO dual: only one blocking constraint?' was applied 821 times.
  - rule 'TODO dual: only one unspecified blocking constraint?' was applied 130 times.
  - rule 'TODO duplicate: identical constraint with different enforcements' was applied 308 times.
  - rule 'TODO no_overlap: with task always last' was applied 1 time.
  - rule 'affine: new relation' was applied 62 times.
  - rule 'all_diff: inferred from x != y constraints' was applied 1 time.
  - rule 'at_most_one: removed literals' was applied 4 times.
  - rule 'at_most_one: size one' was applied 4 times.
  - rule 'deductions: 247 stored' was applied 1 time.
  - rule 'dual: fix variable' was applied 27 times.
  - rule 'dual: reduced domain' was applied 56 times.
  - rule 'duplicate: merged rhs of linear constraint' was applied 49 times.
  - rule 'duplicate: removed constraint' was applied 344 times.
  - rule 'enforcement: false literal' was applied 17 times.
  - rule 'enforcement: true literal' was applied 9 times.
  - rule 'exactly_one: x and not(x)' was applied 1 time.
  - rule 'incompatible linear: add implication' was applied 30 times.
  - rule 'linear inclusion: redundant containing constraint' was applied 1 time.
  - rule 'linear matrix: common vertical rectangle' was applied 125 times.
  - rule 'linear: always true' was applied 654 times.
  - rule 'linear: doubleton free' was applied 11 times.
  - rule 'linear: empty' was applied 30 times.
  - rule 'linear: extracted enforcement literal' was applied 5'808 times.
  - rule 'linear: fixed or dup variables' was applied 3'183 times.
  - rule 'linear: positive equal one' was applied 5 times.
  - rule 'linear: reduced variable domains' was applied 232 times.
  - rule 'linear: remapped using affine relations' was applied 3'142 times.
  - rule 'linear: simplified rhs' was applied 11'404 times.
  - rule 'linear: variable substitution 1' was applied 11 times.
  - rule 'linear: variable substitution 2' was applied 8 times.
  - rule 'presolve: 91 unused variables removed.' was applied 1 time.
  - rule 'presolve: iteration' was applied 3 times.
  - rule 'probing: reduced enforced constraint to implication.' was applied 4 times.
  - rule 'symmetry: fixed to false in general orbit' was applied 1 time.

Presolved optimization model '': (model_fingerprint: 0xcb84f0bee14e28f0)
#Variables: 271 (#ints: 10 in objective)
  - 77 Booleans in [0,1]
  - 146 different domains in [-5431,3810] with a largest complexity of 13.
#kAllDiff: 1
#kExactlyOne: 4 (#literals: 12)
#kLinear2: 736 (#enforced: 666 #multi: 567)
#kLinear3: 319 (#enforced: 226)
#kLinearN: 1'922 (#enforced: 1'768) (#terms: 14'715)

Preloading model.
#Bound   0.41s best:inf   next:[177,4551] initial_domain
#Model   0.41s var:271/271 constraints:2982/2982

Starting search at 0.41s with 48 workers.
16 full problem subsolvers: [core, default_lp, lb_tree_search, max_lp, no_lp, objective_lb_search, objective_lb_search_max_lp, objective_lb_search_no_lp, objective_shaving_search_max_lp, objective_shaving_search_no_lp, probing, probing_max_lp, pseudo_costs, quick_restart, quick_restart_no_lp, reduced_costs]
30 first solution subsolvers: [fj_long_default(2), fj_long_lin_default, fj_long_lin_perturb, fj_long_lin_random, fj_long_perturb, fj_long_random, fj_short_default(2), fj_short_lin_default(2), fj_short_lin_perturb, fj_short_lin_random, fj_short_perturb, fj_short_random, fs_random(4), fs_random_no_lp(4), fs_random_quick_restart(4), fs_random_quick_restart_no_lp(3)]
13 incomplete subsolvers: [feasibility_pump, graph_arc_lns, graph_cst_lns, graph_dec_lns, graph_var_lns, rins/rens, rnd_cst_lns, rnd_var_lns, violation_ls(5)]
3 helper subsolvers: [neighborhood_helper, synchronization_agent, update_gap_integral]
#Bound   0.45s best:inf   next:[218,4551] objective_lb_search_no_lp
#Bound   0.46s best:inf   next:[219,4551] objective_lb_search_no_lp
#1       0.47s best:1652  next:[219,1651] no_lp (fixed_bools=0/109)
#Bound   0.47s best:1652  next:[288,1651] objective_lb_search_no_lp
#Bound   0.47s best:1652  next:[289,1651] objective_lb_search_no_lp
#Bound   0.47s best:1652  next:[303,1651] objective_lb_search_no_lp
#2       0.48s best:1651  next:[303,1650] violation_ls(batch:1 #solutions_imported:1 #lin_moves:417 #lin_evals:1'443 #weight_updates:126)
#Bound   0.48s best:1651  next:[326,1650] objective_lb_search_no_lp
#3       0.48s best:1300  next:[326,1299] no_lp (fixed_bools=0/132)
#Bound   0.48s best:1300  next:[327,1299] objective_lb_search_no_lp
#4       0.49s best:1231  next:[327,1230] no_lp (fixed_bools=0/145)
#Bound   0.49s best:1231  next:[333,1230] objective_lb_search_no_lp
#Bound   0.50s best:1231  next:[337,1230] objective_lb_search_no_lp
#5       0.50s best:1210  next:[337,1209] no_lp (fixed_bools=0/156)
#6       0.51s best:1205  next:[337,1204] quick_restart_no_lp (fixed_bools=0/132)
#7       0.51s best:985   next:[337,984]  no_lp (fixed_bools=0/164)
#8       0.54s best:941   next:[337,940]  no_lp (fixed_bools=0/167)
#9       0.56s best:938   next:[337,937]  quick_restart_no_lp (fixed_bools=0/169)
#10      0.57s best:937   next:[337,936]  violation_ls(batch:5 #solutions_imported:5 #lin_moves:5'098 #lin_evals:31'898 #gen_moves:2'438 #gen_evals:252 #comp_moves:170 #backtracks:1'134 #weight_updates:4'939)
#11      0.57s best:936   next:[337,935]  violation_ls(batch:6 #solutions_imported:6 #lin_moves:5'098 #lin_evals:31'903 #gen_moves:2'439 #gen_evals:252 #comp_moves:171 #backtracks:1'134 #weight_updates:4'939)
#12      0.57s best:935   next:[337,934]  violation_ls(batch:7 #solutions_imported:7 #lin_moves:5'099 #lin_evals:31'913 #gen_moves:2'439 #gen_evals:252 #comp_moves:171 #backtracks:1'134 #weight_updates:4'939)
#13      0.60s best:920   next:[337,919]  graph_arc_lns (d=0.91 s=119 t=0.10 p=1.00 stall=4 h=auto_l0)
#Bound   0.62s best:920   next:[511,919]  objective_lb_search_no_lp
#14      0.63s best:919   next:[511,918]  violation_ls(batch:4 #solutions_imported:4 #lin_moves:9'854 #lin_evals:46'065 #gen_moves:3'100 #gen_evals:358 #comp_moves:138 #backtracks:1'481 #weight_updates:615)
#15      0.63s best:918   next:[511,917]  violation_ls(batch:5 #solutions_imported:5 #lin_moves:9'855 #lin_evals:46'075 #gen_moves:3'100 #gen_evals:358 #comp_moves:138 #backtracks:1'481 #weight_updates:615)
#16      0.63s best:917   next:[511,916]  violation_ls(batch:5 #solutions_imported:5 #lin_moves:302 #lin_evals:28'262 #gen_moves:11'417 #gen_evals:1'277 #comp_moves:1'082 #backtracks:5'164 #weight_updates:345)
#17      0.64s best:916   next:[511,915]  violation_ls(batch:6 #solutions_imported:6 #lin_moves:302 #lin_evals:28'267 #gen_moves:11'418 #gen_evals:1'277 #comp_moves:1'083 #backtracks:5'164 #weight_updates:345)
#18      0.67s best:915   next:[511,914]  violation_ls(batch:7 #solutions_imported:7 #lin_moves:302 #lin_evals:35'493 #gen_moves:14'501 #gen_evals:1'417 #comp_moves:1'342 #backtracks:6'576 #weight_updates:381)
#19      0.67s best:914   next:[511,913]  violation_ls(batch:8 #solutions_imported:8 #lin_moves:303 #lin_evals:35'503 #gen_moves:14'501 #gen_evals:1'417 #comp_moves:1'342 #backtracks:6'576 #weight_updates:381)
#20      0.68s best:912   next:[511,911]  quick_restart_no_lp (fixed_bools=0/179)
#21      0.69s best:911   next:[511,910]  violation_ls(batch:10 #solutions_imported:10 #lin_moves:303 #lin_evals:38'186 #gen_moves:15'697 #gen_evals:1'449 #comp_moves:1'386 #backtracks:7'152 #weight_updates:399)
#22      0.69s best:910   next:[511,909]  violation_ls(batch:11 #solutions_imported:11 #lin_moves:303 #lin_evals:38'201 #gen_moves:15'704 #gen_evals:1'449 #comp_moves:1'387 #backtracks:7'155 #weight_updates:399)
#Bound   0.78s best:910   next:[518,909]  objective_lb_search_no_lp
#23      0.85s best:876   next:[518,875]  graph_dec_lns (d=0.96 s=151 t=0.10 p=1.00 stall=3 h=auto_l0)
#Bound   1.06s best:876   next:[519,875]  objective_lb_search_no_lp
#Bound   1.35s best:876   next:[521,875]  objective_lb_search_no_lp
#24      1.37s best:861   next:[521,860]  graph_dec_lns (d=0.99 s=190 t=0.10 p=1.00 stall=1 h=auto_l0)
#Bound   1.84s best:861   next:[532,860]  objective_lb_search_no_lp
#Bound   2.09s best:861   next:[533,860]  objective_lb_search_no_lp
#Bound   3.02s best:861   next:[537,860]  objective_lb_search_no_lp
#Bound   3.32s best:861   next:[538,860]  objective_lb_search_no_lp
#Bound   3.49s best:861   next:[541,860]  objective_lb_search_no_lp
#25      3.60s best:835   next:[541,834]  graph_var_lns (d=0.99 s=306 t=0.10 p=0.88 stall=0 h=auto_l0)
#Bound   3.67s best:835   next:[543,834]  objective_lb_search
#Bound   4.35s best:835   next:[546,834]  objective_lb_search_no_lp
#Bound   4.41s best:835   next:[561,834]  objective_lb_search
#Bound   4.80s best:835   next:[611,834]  objective_lb_search_no_lp
#Bound   6.59s best:835   next:[612,834]  objective_shaving_search_no_lp (vars=282 csts=2826)
#Bound   6.91s best:835   next:[615,834]  objective_lb_search_no_lp
#Bound   7.41s best:835   next:[617,834]  objective_lb_search_no_lp
#Bound   7.58s best:835   next:[618,834]  objective_lb_search_no_lp
#Bound   7.96s best:835   next:[625,834]  objective_lb_search_no_lp
#Bound   8.48s best:835   next:[626,834]  objective_lb_search_no_lp
#Bound   8.69s best:835   next:[651,834]  objective_lb_search_no_lp [skipped_logs=2]
#Bound   9.50s best:835   next:[652,834]  objective_lb_search_no_lp [skipped_logs=0]
#Bound  11.46s best:835   next:[653,834]  objective_lb_search_no_lp
#Bound  12.36s best:835   next:[655,834]  objective_lb_search_no_lp
#Bound  16.82s best:835   next:[658,834]  objective_lb_search
#Bound  17.31s best:835   next:[659,834]  objective_lb_search_no_lp
#Bound  18.20s best:835   next:[660,834]  objective_lb_search_no_lp
#Bound  22.19s best:835   next:[665,834]  objective_lb_search
#Bound  24.10s best:835   next:[704,834]  objective_lb_search_no_lp
#Bound  27.24s best:835   next:[705,834]  objective_lb_search_no_lp
#Bound  33.30s best:835   next:[707,834]  objective_lb_search_no_lp
#Bound  33.85s best:835   next:[710,834]  objective_lb_search_no_lp
#Bound  34.45s best:835   next:[711,834]  objective_lb_search_no_lp
#Bound  35.06s best:835   next:[715,834]  objective_lb_search_no_lp
#Bound  38.88s best:835   next:[718,834]  objective_lb_search_no_lp
#Model  40.19s var:269/271 constraints:2817/2982
#Model  41.05s var:268/271 constraints:2725/2982
#Bound  41.14s best:835   next:[720,834]  objective_lb_search_no_lp
#Bound  42.87s best:835   next:[722,834]  objective_lb_search_no_lp
#Model  43.01s var:267/271 constraints:2710/2982
#Bound  44.59s best:835   next:[724,834]  objective_lb_search
#Bound  45.05s best:835   next:[725,834]  objective_lb_search_no_lp
#Bound  45.94s best:835   next:[726,834]  objective_lb_search
#Bound  46.15s best:835   next:[730,834]  objective_lb_search
#Bound  46.31s best:835   next:[731,834]  objective_lb_search
#Bound  46.40s best:835   next:[732,834]  objective_lb_search
#Model  47.65s var:265/271 constraints:2601/2982
#Bound  47.90s best:835   next:[734,834]  objective_lb_search_no_lp
#Bound  48.38s best:835   next:[738,834]  objective_lb_search_no_lp
#Bound  48.92s best:835   next:[751,834]  objective_lb_search_no_lp
#Bound  49.73s best:835   next:[752,834]  objective_lb_search_max_lp
#Bound  50.27s best:835   next:[754,834]  objective_lb_search_max_lp
#Model  50.62s var:264/271 constraints:2519/2982
#Bound  51.50s best:835   next:[755,834]  objective_lb_search_no_lp
#Bound  52.96s best:835   next:[758,834]  objective_lb_search_no_lp
#Model  53.66s var:261/271 constraints:2329/2982
#Bound  53.76s best:835   next:[760,834]  objective_lb_search_no_lp
#Bound  54.10s best:835   next:[768,834]  objective_lb_search_no_lp
#Model  54.32s var:258/271 constraints:2206/2982
#Done   54.45s default_lp
#Model  54.45s var:230/271 constraints:697/2982
#Done   54.45s core

Task timing                                  n [     min,      max]      avg      dev     time         n [     min,      max]      avg      dev    dtime
                             'core':         1 [  54.03s,   54.03s]   54.03s   0.00ns   54.03s         1 [  22.88s,   22.88s]   22.88s   0.00ns   22.88s
                       'default_lp':         1 [  54.03s,   54.03s]   54.03s   0.00ns   54.03s         1 [   5.65s,    5.65s]    5.65s   0.00ns    5.65s
                 'feasibility_pump':       214 [ 21.09ms, 505.28ms] 230.48ms  77.91ms   49.32s       213 [  2.79ms,  37.13ms]  19.00ms   1.67ms    4.05s
                  'fj_long_default':         1 [ 71.43ms,  71.43ms]  71.43ms   0.00ns  71.43ms         1 [ 23.47ms,  23.47ms]  23.47ms   0.00ns  23.47ms
                  'fj_long_default':         1 [ 84.24ms,  84.24ms]  84.24ms   0.00ns  84.24ms         1 [ 28.73ms,  28.73ms]  28.73ms   0.00ns  28.73ms
              'fj_long_lin_default':         1 [133.68ms, 133.68ms] 133.68ms   0.00ns 133.68ms         1 [ 85.73ms,  85.73ms]  85.73ms   0.00ns  85.73ms
              'fj_long_lin_perturb':         1 [121.83ms, 121.83ms] 121.83ms   0.00ns 121.83ms         1 [ 54.68ms,  54.68ms]  54.68ms   0.00ns  54.68ms
               'fj_long_lin_random':         1 [105.20ms, 105.20ms] 105.20ms   0.00ns 105.20ms         1 [ 46.74ms,  46.74ms]  46.74ms   0.00ns  46.74ms
                  'fj_long_perturb':         1 [131.39ms, 131.39ms] 131.39ms   0.00ns 131.39ms         1 [ 88.18ms,  88.18ms]  88.18ms   0.00ns  88.18ms
                   'fj_long_random':         1 [ 69.66ms,  69.66ms]  69.66ms   0.00ns  69.66ms         1 [ 22.42ms,  22.42ms]  22.42ms   0.00ns  22.42ms
                 'fj_short_default':         1 [130.29ms, 130.29ms] 130.29ms   0.00ns 130.29ms         1 [ 87.98ms,  87.98ms]  87.98ms   0.00ns  87.98ms
                 'fj_short_default':         1 [136.88ms, 136.88ms] 136.88ms   0.00ns 136.88ms         1 [ 66.36ms,  66.36ms]  66.36ms   0.00ns  66.36ms
             'fj_short_lin_default':         1 [130.15ms, 130.15ms] 130.15ms   0.00ns 130.15ms         1 [ 84.96ms,  84.96ms]  84.96ms   0.00ns  84.96ms
             'fj_short_lin_default':         1 [133.55ms, 133.55ms] 133.55ms   0.00ns 133.55ms         1 [ 82.39ms,  82.39ms]  82.39ms   0.00ns  82.39ms
             'fj_short_lin_perturb':         1 [ 75.44ms,  75.44ms]  75.44ms   0.00ns  75.44ms         1 [ 25.91ms,  25.91ms]  25.91ms   0.00ns  25.91ms
              'fj_short_lin_random':         1 [135.58ms, 135.58ms] 135.58ms   0.00ns 135.58ms         1 [ 85.18ms,  85.18ms]  85.18ms   0.00ns  85.18ms
                 'fj_short_perturb':         1 [ 77.19ms,  77.19ms]  77.19ms   0.00ns  77.19ms         1 [ 26.36ms,  26.36ms]  26.36ms   0.00ns  26.36ms
                  'fj_short_random':         1 [133.54ms, 133.54ms] 133.54ms   0.00ns 133.54ms         1 [ 84.82ms,  84.82ms]  84.82ms   0.00ns  84.82ms
                        'fs_random':         1 [ 45.83ms,  45.83ms]  45.83ms   0.00ns  45.83ms         1 [ 20.00ns,  20.00ns]  20.00ns   0.00ns  20.00ns
                        'fs_random':         1 [ 47.46ms,  47.46ms]  47.46ms   0.00ns  47.46ms         1 [  3.61us,   3.61us]   3.61us   0.00ns   3.61us
                        'fs_random':         1 [ 48.06ms,  48.06ms]  48.06ms   0.00ns  48.06ms         1 [  3.61us,   3.61us]   3.61us   0.00ns   3.61us
                        'fs_random':         1 [ 62.21ms,  62.21ms]  62.21ms   0.00ns  62.21ms         1 [ 20.00ns,  20.00ns]  20.00ns   0.00ns  20.00ns
                  'fs_random_no_lp':         1 [ 46.72ms,  46.72ms]  46.72ms   0.00ns  46.72ms         1 [569.12us, 569.12us] 569.12us   0.00ns 569.12us
                  'fs_random_no_lp':         1 [ 47.50ms,  47.50ms]  47.50ms   0.00ns  47.50ms         1 [318.00us, 318.00us] 318.00us   0.00ns 318.00us
                  'fs_random_no_lp':         1 [ 51.82ms,  51.82ms]  51.82ms   0.00ns  51.82ms         1 [445.92us, 445.92us] 445.92us   0.00ns 445.92us
                  'fs_random_no_lp':         1 [ 61.92ms,  61.92ms]  61.92ms   0.00ns  61.92ms         1 [422.31us, 422.31us] 422.31us   0.00ns 422.31us
          'fs_random_quick_restart':         1 [ 46.12ms,  46.12ms]  46.12ms   0.00ns  46.12ms         1 [ 20.00ns,  20.00ns]  20.00ns   0.00ns  20.00ns
          'fs_random_quick_restart':         1 [ 47.21ms,  47.21ms]  47.21ms   0.00ns  47.21ms         1 [  3.61us,   3.61us]   3.61us   0.00ns   3.61us
          'fs_random_quick_restart':         1 [ 48.35ms,  48.35ms]  48.35ms   0.00ns  48.35ms         1 [  3.61us,   3.61us]   3.61us   0.00ns   3.61us
          'fs_random_quick_restart':         1 [ 61.37ms,  61.37ms]  61.37ms   0.00ns  61.37ms         1 [  3.61us,   3.61us]   3.61us   0.00ns   3.61us
    'fs_random_quick_restart_no_lp':         1 [ 46.29ms,  46.29ms]  46.29ms   0.00ns  46.29ms         1 [343.46us, 343.46us] 343.46us   0.00ns 343.46us
    'fs_random_quick_restart_no_lp':         1 [ 46.42ms,  46.42ms]  46.42ms   0.00ns  46.42ms         1 [387.27us, 387.27us] 387.27us   0.00ns 387.27us
    'fs_random_quick_restart_no_lp':         1 [ 48.17ms,  48.17ms]  48.17ms   0.00ns  48.17ms         1 [405.27us, 405.27us] 405.27us   0.00ns 405.27us
                    'graph_arc_lns':       216 [  8.53ms,    2.86s]    1.02s 656.40ms    3.68m       213 [ 10.00ns, 106.42ms]  61.47ms  43.17ms   13.09s
                    'graph_cst_lns':       216 [  2.44ms,    3.10s] 745.49ms 697.62ms    2.68m       156 [ 10.00ns, 104.25ms]  61.34ms  41.92ms    9.57s
                    'graph_dec_lns':       216 [  8.40ms,    2.79s]    1.05s 656.11ms    3.77m       211 [ 10.00ns, 208.12ms]  62.35ms  43.83ms   13.16s
                    'graph_var_lns':       216 [  6.94ms,    3.24s]    1.13s 696.96ms    4.08m       210 [ 10.00ns, 204.17ms]  64.01ms  42.59ms   13.44s
                   'lb_tree_search':         1 [  54.03s,   54.03s]   54.03s   0.00ns   54.03s         1 [  10.41s,   10.41s]   10.41s   0.00ns   10.41s
                           'max_lp':         1 [  54.03s,   54.03s]   54.03s   0.00ns   54.03s         1 [   7.46s,    7.46s]    7.46s   0.00ns    7.46s
                            'no_lp':         1 [  54.04s,   54.04s]   54.04s   0.00ns   54.04s         1 [   4.08s,    4.08s]    4.08s   0.00ns    4.08s
              'objective_lb_search':         1 [  54.03s,   54.03s]   54.03s   0.00ns   54.03s         1 [   6.63s,    6.63s]    6.63s   0.00ns    6.63s
       'objective_lb_search_max_lp':         1 [  54.03s,   54.03s]   54.03s   0.00ns   54.03s         1 [   8.97s,    8.97s]    8.97s   0.00ns    8.97s
        'objective_lb_search_no_lp':         1 [  54.03s,   54.03s]   54.03s   0.00ns   54.03s         1 [   3.87s,    3.87s]    3.87s   0.00ns    3.87s
  'objective_shaving_search_max_lp':        55 [ 39.21ms,    6.05s] 979.32ms    1.22s   53.86s        47 [  1.32ms, 455.29ms]  78.73ms 119.87ms    3.70s
   'objective_shaving_search_no_lp':        56 [  4.08ms,    6.05s] 961.05ms    1.21s   53.82s        45 [ 51.49us, 384.73ms]  62.91ms  95.93ms    2.83s
                          'probing':         1 [  54.04s,   54.04s]   54.04s   0.00ns   54.04s         1 [   2.02s,    2.02s]    2.02s   0.00ns    2.02s
                   'probing_max_lp':         1 [  54.05s,   54.05s]   54.05s   0.00ns   54.05s         1 [   2.40s,    2.40s]    2.40s   0.00ns    2.40s
                     'pseudo_costs':         1 [  54.03s,   54.03s]   54.03s   0.00ns   54.03s         1 [   6.88s,    6.88s]    6.88s   0.00ns    6.88s
                    'quick_restart':         1 [  54.04s,   54.04s]   54.04s   0.00ns   54.04s         1 [   6.58s,    6.58s]    6.58s   0.00ns    6.58s
              'quick_restart_no_lp':         1 [  54.04s,   54.04s]   54.04s   0.00ns   54.04s         1 [   5.52s,    5.52s]    5.52s   0.00ns    5.52s
                    'reduced_costs':         1 [  54.04s,   54.04s]   54.04s   0.00ns   54.04s         1 [   6.02s,    6.02s]    6.02s   0.00ns    6.02s
                        'rins/rens':       217 [197.51us,    2.86s] 914.54ms 672.50ms    3.31m       193 [ 10.00ns, 189.22ms]  69.61ms  41.54ms   13.43s
                      'rnd_cst_lns':       216 [  2.48ms,    2.63s] 995.20ms 682.19ms    3.58m       201 [ 10.00ns, 106.26ms]  60.34ms  43.47ms   12.13s
                      'rnd_var_lns':       216 [  5.10ms,    2.73s]    1.02s 636.76ms    3.68m       210 [ 10.00ns, 219.32ms]  61.47ms  44.31ms   12.91s
                     'violation_ls':       216 [332.46us, 432.08ms] 181.33ms  83.81ms   39.17s       216 [  1.45us, 187.87ms]  86.67ms  34.36ms   18.72s
                     'violation_ls':       216 [335.88us, 401.75ms] 166.04ms  75.59ms   35.86s       216 [  1.39us,  91.16ms]  64.62ms  16.67ms   13.96s
                     'violation_ls':       216 [357.26us, 601.57ms] 163.80ms  72.47ms   35.38s       216 [  1.45us,  84.08ms]  68.39ms  15.11ms   14.77s
                     'violation_ls':       217 [  5.84ms, 331.98ms] 153.61ms  58.43ms   33.33s       217 [  1.49ms,  83.01ms]  68.06ms  16.12ms   14.77s
                     'violation_ls':       217 [530.92us, 356.51ms] 163.84ms  60.16ms   35.55s       217 [  1.45us,  85.86ms]  65.70ms  13.55ms   14.26s

Search stats                        Bools  Conflicts  Branches  Restarts  BoolPropag  IntegerPropag
                           'core':  4'205     13'670    29'602     5'229  19'734'835     10'213'709
                     'default_lp':     77     10'245    41'997     6'983     255'759      9'881'334
                      'fs_random':     77          0       154       154          24          3'148
                      'fs_random':     77          0       154       154          24          3'148
                      'fs_random':     77          0       154       154          24          3'148
                      'fs_random':     77          0       154       154          24          3'148
                'fs_random_no_lp':     77          0       192       154          26          4'397
                'fs_random_no_lp':     77          3       196       154          54          5'433
                'fs_random_no_lp':     77          4       201       154          35          4'802
                'fs_random_no_lp':     77          5       200       154          42          4'777
        'fs_random_quick_restart':     77          0       154       154          24          3'148
        'fs_random_quick_restart':     77          0       154       154          24          3'148
        'fs_random_quick_restart':     77          0       154       154          24          3'148
        'fs_random_quick_restart':     77          0       154       154          24          3'148
  'fs_random_quick_restart_no_lp':     77          0       191       154          26          4'557
  'fs_random_quick_restart_no_lp':     77          0       199       154          28          4'689
  'fs_random_quick_restart_no_lp':     77          0       215       154          28          4'792
                 'lb_tree_search':     77        262    46'194     6'959      56'515      3'040'505
                         'max_lp':     77      5'663    46'639    10'086     221'655      8'529'854
                          'no_lp':    582     17'912    53'681     8'716   2'954'137     14'739'357
            'objective_lb_search':    154      8'711    45'186     8'829     323'276     10'035'319
     'objective_lb_search_max_lp':    120      4'726    41'858    10'989     187'795      6'984'888
      'objective_lb_search_no_lp':    208     21'174    46'812     5'274     517'330     15'605'119
                        'probing':    465        271       753       753      10'639         72'476
                 'probing_max_lp':    319        121       517       517       4'520         42'820
                   'pseudo_costs':     77      5'065    43'943     9'384     195'420      7'670'392
                  'quick_restart':     77      2'678    83'067    28'714     158'000      6'339'675
            'quick_restart_no_lp':  1'524     20'469    93'669     8'552   6'216'636     16'352'103
                  'reduced_costs':    871      6'309    46'214     6'453   2'445'392      7'440'478

SAT stats                           ClassicMinim  LitRemoved  LitLearned  LitForgotten  Subsumed  MClauses  MDecisions  MLitTrue  MSubsumed  MLitRemoved  MReused
                           'core':        12'169      62'057      82'221             0        85     2'227      10'923         0         71          216       40
                     'default_lp':         6'283      15'475     100'185             0       565     3'421      27'531        11      1'198        7'168      558
                      'fs_random':             0           0           0             0         0         0           0         0          0            0        0
                      'fs_random':             0           0           0             0         0         0           0         0          0            0        0
                      'fs_random':             0           0           0             0         0         0           0         0          0            0        0
                      'fs_random':             0           0           0             0         0         0           0         0          0            0        0
                'fs_random_no_lp':             0           0           0             0         0         0           0         0          0            0        0
                'fs_random_no_lp':             0           0          13             0         0         0           0         0          0            0        0
                'fs_random_no_lp':             0           0          18             0         0         0           0         0          0            0        0
                'fs_random_no_lp':             1           1          22             0         0         0           0         0          0            0        0
        'fs_random_quick_restart':             0           0           0             0         0         0           0         0          0            0        0
        'fs_random_quick_restart':             0           0           0             0         0         0           0         0          0            0        0
        'fs_random_quick_restart':             0           0           0             0         0         0           0         0          0            0        0
        'fs_random_quick_restart':             0           0           0             0         0         0           0         0          0            0        0
  'fs_random_quick_restart_no_lp':             0           0           0             0         0         0           0         0          0            0        0
  'fs_random_quick_restart_no_lp':             0           0           0             0         0         0           0         0          0            0        0
  'fs_random_quick_restart_no_lp':             0           0           0             0         0         0           0         0          0            0        0
                 'lb_tree_search':             6           9       1'101             0         1     2'558      13'647         0         54          224      302
                         'max_lp':         3'036       7'536      55'151             0       381     4'537      36'604         1        691        4'140      892
                          'no_lp':        13'393      43'181     203'508        29'417       391     3'341      22'433         0      1'274        7'809      301
            'objective_lb_search':         6'749      18'449      67'348             0       379     3'913      30'860         1      1'200        7'012      954
     'objective_lb_search_max_lp':         3'259       8'473      37'472             0       236     3'290      27'887         0        399        2'380      707
      'objective_lb_search_no_lp':        16'337      46'748     170'713        13'687       698     2'475      19'072         0      1'128        6'965      477
                        'probing':             0           0         271             0         0         0           0         0          0            0        0
                 'probing_max_lp':             0           0         121             0         0         0           0         0          0            0        0
                   'pseudo_costs':         2'900       6'521      49'055             0       324     4'057      34'362         0        721        4'428      830
                  'quick_restart':         1'411       2'704      32'748             0       103     9'529      59'506         0        155          834    1'361
            'quick_restart_no_lp':        15'172      62'376     236'726        64'775       473     4'137      31'711        63      2'405       16'221      335
                  'reduced_costs':         3'947      11'611      71'088             0       181     2'724      22'921         4        671        4'336      517

Lp stats                         Component  Iterations  AddedCuts  OPTIMAL  DUAL_F.  DUAL_U.
                  'default_lp':          1      98'172      7'707   14'121        0        0
                   'fs_random':          1          65          0        1        1        0
                   'fs_random':          1          99          0        2        0        0
                   'fs_random':          1          99         79        3        0        0
                   'fs_random':          1          99         92        3        0        0
     'fs_random_quick_restart':          1          99          0        2        0        0
     'fs_random_quick_restart':          1          99         50        3        0        0
     'fs_random_quick_restart':          1          99         50        3        0        0
     'fs_random_quick_restart':          1          99         79        3        0        0
              'lb_tree_search':          1     291'166      5'148   18'374    6'602        0
                      'max_lp':          1     136'253      8'191    8'463    2'606        2
         'objective_lb_search':          1     126'488      6'533   13'198        0        0
  'objective_lb_search_max_lp':          1     168'621      6'283    7'879    1'929        3
                     'probing':          1      11'923      6'205    2'720        0        1
              'probing_max_lp':          1       8'121      4'941    1'740       63        0
                'pseudo_costs':          1     128'514      8'089    8'009    1'819        3
               'quick_restart':          1     101'803      7'481   11'045        0        2
               'reduced_costs':          1      99'950     11'844    9'015    1'854        0

Lp dimension                                                                     Final dimension of first component
                  'default_lp':  826 rows, 267 columns, 2102 entries with magnitude in [6.664002e-04, 1.000000e+00]
                   'fs_random':    97 rows, 267 columns, 420 entries with magnitude in [9.483041e-02, 1.000000e+00]
                   'fs_random':    97 rows, 267 columns, 420 entries with magnitude in [9.483041e-02, 1.000000e+00]
                   'fs_random':    97 rows, 267 columns, 420 entries with magnitude in [9.483041e-02, 1.000000e+00]
                   'fs_random':    97 rows, 267 columns, 420 entries with magnitude in [9.483041e-02, 1.000000e+00]
     'fs_random_quick_restart':    97 rows, 267 columns, 420 entries with magnitude in [9.483041e-02, 1.000000e+00]
     'fs_random_quick_restart':    97 rows, 267 columns, 420 entries with magnitude in [9.483041e-02, 1.000000e+00]
     'fs_random_quick_restart':    98 rows, 267 columns, 424 entries with magnitude in [4.240945e-02, 1.000000e+00]
     'fs_random_quick_restart':    98 rows, 267 columns, 424 entries with magnitude in [4.240945e-02, 1.000000e+00]
              'lb_tree_search':  703 rows, 271 columns, 2826 entries with magnitude in [1.319583e-03, 1.000000e+00]
                      'max_lp':  754 rows, 271 columns, 3243 entries with magnitude in [3.699535e-03, 1.000000e+00]
         'objective_lb_search':  459 rows, 267 columns, 1867 entries with magnitude in [3.307847e-03, 1.000000e+00]
  'objective_lb_search_max_lp':  732 rows, 271 columns, 2859 entries with magnitude in [2.218045e-03, 1.000000e+00]
                     'probing':  537 rows, 267 columns, 3320 entries with magnitude in [4.024759e-03, 1.000000e+00]
              'probing_max_lp':  871 rows, 271 columns, 4634 entries with magnitude in [7.517951e-04, 1.000000e+00]
                'pseudo_costs':  720 rows, 271 columns, 2967 entries with magnitude in [3.002995e-03, 1.000000e+00]
               'quick_restart':  825 rows, 267 columns, 2888 entries with magnitude in [4.616728e-05, 1.000000e+00]
               'reduced_costs':  727 rows, 271 columns, 2563 entries with magnitude in [4.969962e-03, 1.000000e+00]

Lp debug                         CutPropag  CutEqPropag  Adjust  Overflow        Bad  BadScaling
                  'default_lp':         40           35   8'295         0    124'729           0
                   'fs_random':          0            0       0         0          0           0
                   'fs_random':          0            0       0         0          0           0
                   'fs_random':          0            0       0         0         66           0
                   'fs_random':          0            0       0         0         99           0
     'fs_random_quick_restart':          0            0       0         0          0           0
     'fs_random_quick_restart':          0            0       0         0          0           0
     'fs_random_quick_restart':          0            0       0         0          0           0
     'fs_random_quick_restart':          0            0       0         0         75           0
              'lb_tree_search':         11            0  11'433         0     35'296           0
                      'max_lp':         76           31   4'910         0    114'521           0
         'objective_lb_search':         21           21   7'908         0    138'097           0
  'objective_lb_search_max_lp':         34            2   5'392         0     85'934           0
                     'probing':         14          110   2'676         0  1'754'496           0
              'probing_max_lp':         75           12   1'793         0  1'168'572           0
                'pseudo_costs':         53            7   4'124         0     98'000           0
               'quick_restart':         31           30   7'787         0    224'144           0
               'reduced_costs':         86           55   5'711         0    138'556           0

Lp pool                          Constraints  Updates  Simplif  Merged  Shortened   Split  Strenghtened      Cuts/Call
                  'default_lp':        7'978    1'153   51'882      50     11'370  10'226        15'623   7'707/19'271
                   'fs_random':          321        0        0       0          0       0            10            0/0
                   'fs_random':          321        0        0       0          0       0            10            0/0
                   'fs_random':          400        0        0       0          0       0            10         79/102
                   'fs_random':          413        0        0       0          0       0            10         92/123
     'fs_random_quick_restart':          321        0        0       0          0       0            10            0/0
     'fs_random_quick_restart':          371        0        0       0          0       0            10          50/50
     'fs_random_quick_restart':          371        0        0       0          0       0            10          50/50
     'fs_random_quick_restart':          400        0        0       0          0       0            10         79/107
              'lb_tree_search':        8'067      364    9'449      62          0     711        18'695   5'148/15'833
                      'max_lp':       11'045      945   95'139     127      9'428   4'459        61'956   8'191/19'151
         'objective_lb_search':        6'742      966   23'978     112      5'069   9'046        11'156   6'533/17'400
  'objective_lb_search_max_lp':        9'212      711   42'360      52      4'797   2'545        47'095   6'283/15'370
                     'probing':        6'510    1'400    8'069      16        923  22'012         3'513   6'205/11'729
              'probing_max_lp':        7'905      979   48'173      17      3'391   9'181        26'748   4'941/10'630
                'pseudo_costs':       10'957      790   58'745     113      5'221   3'905        50'713   8'089/19'086
               'quick_restart':        7'777    1'412   45'587      25      6'246  29'275        12'123   7'481/18'869
               'reduced_costs':       12'639    1'052  109'011     186     14'983   5'351        63'675  11'844/27'791

Lp Cut            fs_ran  fs_ran  fs_ran  fs_ran  fs_ran  defaul  max_lp  quick_  reduce  pseudo  lb_tre  probin  object  probin  object
          CG_FF:       -       -       -       -       -     413     252     313     603     254     224     219     397     185     150
           CG_K:       -       -       -       -       -     213     123     116     441     133     149      60     226      97      71
           CG_R:       -       -       -       -       -     298     195     359     494     138     179     264     384     166     100
          CG_RB:       -       -       -       -       -   1'411   1'283   1'162   1'716   1'010     793     880   1'034     580     761
         CG_RBP:       -       -       -       -       -     171      91     132     197      61      71      59     111      70      50
         Clique:       -       -       -       -       -       -      66       -      69      58      31       -       -      28      57
             IB:      50      50      50      50      50     840     612     879     674     714     494     519     741     240     552
       MIR_1_FF:      19      12      15       -       -     364     417     355     597     429     249     296     324     285     329
        MIR_1_K:       6       4       3       -       -      69      62      36     107      77      36      33      49      27      38
       MIR_1_KL:       -       -       -       -       -       3       4       2       -       1       3       4       -       -       1
        MIR_1_R:       8       3       5       -       -      68      32      70      99      61      19      52      69      27      43
       MIR_1_RB:       4       3       -       -       -     645     793     627   1'137     845     511     577     497     396     738
      MIR_1_RBP:       -       -       -       -       -      38     120      28     163     132     100      26      36      50      99
      MIR_1_RLT:       -       -       -       -       -       -       3       -      10       9       4       -       -       2       4
       MIR_2_FF:       2       1       2       -       -     228     286     236     386     316     147     213     252     145     185
        MIR_2_K:       -       -       1       -       -      44      59      25     111      69      27      20      41      22      41
       MIR_2_KL:       -       -       -       -       -       2       1       4       3       2       2       1       -       -       4
        MIR_2_R:       -       -       1       -       -      74     131     100     165     136      57     119      66      63     104
       MIR_2_RB:       3       3       2       -       -     417     487     464     720     508     273     435     347     250     426
      MIR_2_RBP:       -       -       -       -       -      43     124      33     133      99      68      25      41      46      66
       MIR_3_FF:       -       -       -       -       -     141     182     159     278     156     120     116     134     106     134
        MIR_3_K:       -       1       -       -       -      27      55      29      80      38      31      19      34      34      34
       MIR_3_KL:       -       -       -       -       -       3       2       1       3       1       1       -       2       -       2
        MIR_3_R:       -       -       -       -       -      64     111     106     167     119      72      99      57      78      96
       MIR_3_RB:       -       2       -       -       -     293     299     386     430     302     170     294     238     176     283
      MIR_3_RBP:       -       -       -       -       -      24      68      33      75      55      40      29      25      28      42
       MIR_4_FF:       -       -       -       -       -     106     110      91     153     123      49      82      90      67      82
        MIR_4_K:       -       -       -       -       -      32      45      33      64      39      17      19      34      26      38
       MIR_4_KL:       -       -       -       -       -       2       -       1       1       -       1       2       2       -       -
        MIR_4_R:       -       -       -       -       -      64      71      61      81      91      39      43      46      37      72
       MIR_4_RB:       -       -       -       -       -     212     178     204     240     215      98     210     161      94     164
      MIR_4_RBP:       -       -       -       -       -      19      39      22      46      38      28       8       8      13      28
       MIR_5_FF:       -       -       -       -       -      56      67      54      92      77      39      37      69      32      35
        MIR_5_K:       -       -       -       -       -      23      34      15      33      15      16       8      14      11      16
       MIR_5_KL:       -       -       -       -       -       1       -       3       -       2       1       -       -       1       -
        MIR_5_R:       -       -       -       -       -      34      49      37      61      43      30      39      23      24      38
       MIR_5_RB:       -       -       -       -       -     129     129     122     169     116      72     101     111      51      91
      MIR_5_RBP:       -       -       -       -       -      15      20      12      33      31       7      12      10       7      11
       MIR_6_FF:       -       -       -       -       -      45      37      34      56      33      18      34      33      24      36
        MIR_6_K:       -       -       -       -       -      12      20      12      22      18       8      10      11       6      13
       MIR_6_KL:       -       -       -       -       -       1       -       -       -       -       -       -       2       -       -
        MIR_6_R:       -       -       -       -       -      36      21      31      36      15      11      16      23      17      20
       MIR_6_RB:       -       -       -       -       -      88      82      50      81      89      38      73      64      41      64
      MIR_6_RBP:       -       -       -       -       -       6      15       3      18      13       4       4       4       4       9
   ZERO_HALF_FF:       -       -       -       -       -      85      86      75     152     113      63      43      53      41      56
    ZERO_HALF_K:       -       -       -       -       -      18      21      15      55      24      17      11      16      13      14
    ZERO_HALF_R:       -       -       -       -       -     605     971     699   1'190     936     493     813     472   1'143     818
   ZERO_HALF_RB:       -       -       -       -       -     175     267     206     333     264     193     196     148      99     232
  ZERO_HALF_RBP:       -       -       -       -       -      50      71      46      70      71      35      85      34      89      36

LNS stats           Improv/Calls  Closed  Difficulty  TimeLimit
  'graph_arc_lns':         8/215     53%        0.98       0.11
  'graph_cst_lns':         2/158     54%        0.99       0.10
  'graph_dec_lns':        13/215     53%        0.99       0.11
  'graph_var_lns':         9/215     53%        0.99       0.11
      'rins/rens':        15/212     50%        0.89       0.10
    'rnd_cst_lns':         7/206     56%        0.99       0.11
    'rnd_var_lns':        11/216     54%        0.99       0.11

LS stats                   Batches  Restarts   LinMoves   GenMoves  CompoundMoves  WeightUpdates
       'fj_long_default':        1         1      3'481          0              0             93
       'fj_long_default':        1         1      4'416          0              0            109
   'fj_long_lin_default':        1         1          0      3'641            262              2
   'fj_long_lin_perturb':        1         1      7'591          0              0          2'409
    'fj_long_lin_random':        1         1      5'410          0              0          1'424
       'fj_long_perturb':        1         1          0      3'371            317              2
        'fj_long_random':        1         1      3'214          0              0             89
      'fj_short_default':        1         1          0      3'061            348              2
      'fj_short_default':        1         1      8'285          0              0          1'715
  'fj_short_lin_default':        1         1          0      3'632            378              1
  'fj_short_lin_default':        1         1          0      3'645            367              2
  'fj_short_lin_perturb':        1         1      3'636          0              0             92
   'fj_short_lin_random':        1         1          0      3'414            323              2
      'fj_short_perturb':        1         1      3'735          0              0             87
       'fj_short_random':        1         1          0      3'668            448              3
          'violation_ls':      216         0  1'029'139    540'750         17'655         71'975
          'violation_ls':      216         0    885'450    561'269         47'183        265'388
          'violation_ls':      216         0      9'925  1'229'573         92'509          2'202
          'violation_ls':      217         0    118'253  1'069'101         90'497         83'118
          'violation_ls':      217         0    913'255    692'371         50'045         20'112

Solutions (25)            Num     Rank
        'graph_arc_lns':    1  [13,13]
        'graph_dec_lns':    2  [23,24]
        'graph_var_lns':    1  [25,25]
                'no_lp':    6    [1,8]
  'quick_restart_no_lp':    3   [6,20]
         'violation_ls':   12   [2,22]

Objective bounds                     Num
                  'initial_domain':    1
             'objective_lb_search':    9
      'objective_lb_search_max_lp':    2
       'objective_lb_search_no_lp':   50
  'objective_shaving_search_no_lp':    1

Solution repositories    Added  Queried  Ignored  Synchro
  'feasible solutions':  1'373    4'268        6    1'295
        'lp solutions':    296       96        0      274
                'pump':  4'449      121

Improving bounds shared          Num
                        'core':    1
                  'default_lp':  527
              'lb_tree_search':   17
                      'max_lp':  419
                       'no_lp':   38
         'objective_lb_search':   53
  'objective_lb_search_max_lp':   76
   'objective_lb_search_no_lp':    3
                     'probing':  497
              'probing_max_lp':  154
                'pseudo_costs':  124
               'quick_restart':  121
         'quick_restart_no_lp':  556
               'reduced_costs':  187

Clauses shared                   Num
                  'default_lp':   63
             'fs_random_no_lp':    1
              'lb_tree_search':    3
                      'max_lp':   45
                       'no_lp':   11
         'objective_lb_search':    4
  'objective_lb_search_max_lp':    4
   'objective_lb_search_no_lp':    1
                'pseudo_costs':   14
               'quick_restart':   18
         'quick_restart_no_lp':   13
               'reduced_costs':    5

CpSolverResponse summary:
status: OPTIMAL
objective: 835
best_bound: 835
integers: 268
booleans: 77
conflicts: 0
branches: 154
propagations: 24
integer_propagations: 3148
restarts: 154
lp_iterations: 99
walltime: 54.528
usertime: 54.528
deterministic_time: 275.042
gap_integral: 894.053
solution_fingerprint: 0xde04c17d17e08125


--- Simulation Gantt  partir du modle mathmatique ---
{'big':1, 'due_date':100, 'pos_time':5, 'status':0, 'blocked':0, 'operations':["{'type':0, 'processing_time':57}"]}
{'big':0, 'due_date':129, 'pos_time':5, 'status':0, 'blocked':0, 'operations':["{'type':1, 'processing_time':14}"]}
{'big':1, 'due_date':129, 'pos_time':5, 'status':0, 'blocked':0, 'operations':["{'type':1, 'processing_time':43}", "{'type':0, 'processing_time':52}"]}
{'big':0, 'due_date':92, 'pos_time':5, 'status':0, 'blocked':0, 'operations':["{'type':0, 'processing_time':39}", "{'type':1, 'processing_time':16}"]}
{'big':0, 'due_date':113, 'pos_time':5, 'status':0, 'blocked':0, 'operations':["{'type':0, 'processing_time':42}"]}
{'big':1, 'due_date':126, 'pos_time':5, 'status':0, 'blocked':0, 'operations':["{'type':0, 'processing_time':13}"]}
{'big':0, 'due_date':77, 'pos_time':5, 'status':0, 'blocked':0, 'operations':["{'type':0, 'processing_time':14}"]}
{'big':0, 'due_date':120, 'pos_time':5, 'status':0, 'blocked':0, 'operations':["{'type':1, 'processing_time':10}"]}
{'big':1, 'due_date':123, 'pos_time':5, 'status':0, 'blocked':0, 'operations':["{'type':1, 'processing_time':58}"]}
