created virtual environment CPython3.12.4.final.0-64 in 4923ms
  creator CPython3Posix(dest=/localscratch/aneumann.46806180.0/env, clear=False, no_vcs_ignore=False, global=False)
  seeder FromAppData(download=False, pip=bundle, via=copy, app_data_dir=/home/aneumann/.local/share/virtualenv)
    added seed packages: pip==24.2+computecanada
  activators BashActivator,CShellActivator,FishActivator,NushellActivator,PowerShellActivator,PythonActivator
Looking in links: /cvmfs/soft.computecanada.ca/custom/python/wheelhouse/gentoo2023/x86-64-v3, /cvmfs/soft.computecanada.ca/custom/python/wheelhouse/gentoo2023/generic, /cvmfs/soft.computecanada.ca/custom/python/wheelhouse/generic
Requirement already satisfied: pip in /localscratch/aneumann.46806180.0/env/lib/python3.12/site-packages (24.2+computecanada)
Processing /cvmfs/soft.computecanada.ca/custom/python/wheelhouse/generic/pip-25.0+computecanada-py3-none-any.whl
Installing collected packages: pip
  Attempting uninstall: pip
    Found existing installation: pip 24.2+computecanada
    Uninstalling pip-24.2+computecanada:
      Successfully uninstalled pip-24.2+computecanada
Successfully installed pip-25.0+computecanada
Looking in links: /cvmfs/soft.computecanada.ca/custom/python/wheelhouse/gentoo2023/x86-64-v3, /cvmfs/soft.computecanada.ca/custom/python/wheelhouse/gentoo2023/generic, /cvmfs/soft.computecanada.ca/custom/python/wheelhouse/generic
ERROR: protobuf-5.28.3-cp38-abi3-manylinux2014_x86_64.whl is not a supported wheel on this platform.
Looking in links: /cvmfs/soft.computecanada.ca/custom/python/wheelhouse/gentoo2023/x86-64-v3, /cvmfs/soft.computecanada.ca/custom/python/wheelhouse/gentoo2023/generic, /cvmfs/soft.computecanada.ca/custom/python/wheelhouse/generic
Processing /home/aneumann/projects/def-adhaj/aneumann/GNRS/wheels/immutabledict-4.2.0-py3-none-any.whl
Installing collected packages: immutabledict
Successfully installed immutabledict-4.2.0
Looking in links: /cvmfs/soft.computecanada.ca/custom/python/wheelhouse/gentoo2023/x86-64-v3, /cvmfs/soft.computecanada.ca/custom/python/wheelhouse/gentoo2023/generic, /cvmfs/soft.computecanada.ca/custom/python/wheelhouse/generic
Processing /cvmfs/soft.computecanada.ca/custom/python/wheelhouse/generic/ortools-9.10.4067+computecanada-cp312-cp312-linux_x86_64.whl (from -r /home/aneumann/projects/def-adhaj/aneumann/GNRS/requirements/or.txt (line 1))
Processing /cvmfs/soft.computecanada.ca/custom/python/wheelhouse/gentoo2023/x86-64-v3/matplotlib-3.10.0+computecanada-cp312-cp312-linux_x86_64.whl (from -r /home/aneumann/projects/def-adhaj/aneumann/GNRS/requirements/or.txt (line 2))
Processing /cvmfs/soft.computecanada.ca/custom/python/wheelhouse/gentoo2023/x86-64-v3/pandas-2.2.3+computecanada-cp312-cp312-linux_x86_64.whl (from -r /home/aneumann/projects/def-adhaj/aneumann/GNRS/requirements/or.txt (line 3))
Processing /cvmfs/soft.computecanada.ca/custom/python/wheelhouse/generic/absl_py-2.3.0+computecanada-py3-none-any.whl (from ortools<9.11,>=9.10->-r /home/aneumann/projects/def-adhaj/aneumann/GNRS/requirements/or.txt (line 1))
Processing /cvmfs/soft.computecanada.ca/custom/python/wheelhouse/gentoo2023/generic/numpy-2.2.2+computecanada-cp312-cp312-linux_x86_64.whl (from ortools<9.11,>=9.10->-r /home/aneumann/projects/def-adhaj/aneumann/GNRS/requirements/or.txt (line 1))
Processing /cvmfs/soft.computecanada.ca/custom/python/wheelhouse/gentoo2023/x86-64-v3/protobuf-6.31.1+computecanada-cp312-cp312-linux_x86_64.whl (from ortools<9.11,>=9.10->-r /home/aneumann/projects/def-adhaj/aneumann/GNRS/requirements/or.txt (line 1))
Requirement already satisfied: immutabledict>=3.0.0 in /localscratch/aneumann.46806180.0/env/lib/python3.12/site-packages (from ortools<9.11,>=9.10->-r /home/aneumann/projects/def-adhaj/aneumann/GNRS/requirements/or.txt (line 1)) (4.2.0)
Processing /cvmfs/soft.computecanada.ca/custom/python/wheelhouse/gentoo2023/generic/contourpy-1.3.1+computecanada-cp312-cp312-linux_x86_64.whl (from matplotlib->-r /home/aneumann/projects/def-adhaj/aneumann/GNRS/requirements/or.txt (line 2))
Processing /cvmfs/soft.computecanada.ca/custom/python/wheelhouse/generic/cycler-0.12.1+computecanada-py3-none-any.whl (from matplotlib->-r /home/aneumann/projects/def-adhaj/aneumann/GNRS/requirements/or.txt (line 2))
Processing /cvmfs/soft.computecanada.ca/custom/python/wheelhouse/generic/fonttools-4.59.0+computecanada-cp312-cp312-linux_x86_64.whl (from matplotlib->-r /home/aneumann/projects/def-adhaj/aneumann/GNRS/requirements/or.txt (line 2))
Processing /cvmfs/soft.computecanada.ca/custom/python/wheelhouse/gentoo2023/x86-64-v3/kiwisolver-1.4.8+computecanada-cp312-cp312-linux_x86_64.whl (from matplotlib->-r /home/aneumann/projects/def-adhaj/aneumann/GNRS/requirements/or.txt (line 2))
Processing /cvmfs/soft.computecanada.ca/custom/python/wheelhouse/generic/packaging-25.0+computecanada-py3-none-any.whl (from matplotlib->-r /home/aneumann/projects/def-adhaj/aneumann/GNRS/requirements/or.txt (line 2))
Processing /cvmfs/soft.computecanada.ca/custom/python/wheelhouse/gentoo2023/x86-64-v3/pillow-11.1.0+computecanada-cp312-cp312-linux_x86_64.whl (from matplotlib->-r /home/aneumann/projects/def-adhaj/aneumann/GNRS/requirements/or.txt (line 2))
Processing /cvmfs/soft.computecanada.ca/custom/python/wheelhouse/generic/pyparsing-3.2.3+computecanada-py3-none-any.whl (from matplotlib->-r /home/aneumann/projects/def-adhaj/aneumann/GNRS/requirements/or.txt (line 2))
Processing /cvmfs/soft.computecanada.ca/custom/python/wheelhouse/generic/python_dateutil-2.9.0.post0+computecanada-py2.py3-none-any.whl (from matplotlib->-r /home/aneumann/projects/def-adhaj/aneumann/GNRS/requirements/or.txt (line 2))
Processing /cvmfs/soft.computecanada.ca/custom/python/wheelhouse/generic/pytz-2025.2+computecanada-py2.py3-none-any.whl (from pandas->-r /home/aneumann/projects/def-adhaj/aneumann/GNRS/requirements/or.txt (line 3))
Processing /cvmfs/soft.computecanada.ca/custom/python/wheelhouse/generic/tzdata-2025.2+computecanada-py2.py3-none-any.whl (from pandas->-r /home/aneumann/projects/def-adhaj/aneumann/GNRS/requirements/or.txt (line 3))
Processing /cvmfs/soft.computecanada.ca/custom/python/wheelhouse/generic/six-1.17.0+computecanada-py2.py3-none-any.whl (from python-dateutil>=2.7->matplotlib->-r /home/aneumann/projects/def-adhaj/aneumann/GNRS/requirements/or.txt (line 2))
Installing collected packages: pytz, tzdata, six, pyparsing, protobuf, pillow, packaging, numpy, kiwisolver, fonttools, cycler, absl-py, python-dateutil, contourpy, pandas, matplotlib, ortools
Successfully installed absl-py-2.3.0+computecanada contourpy-1.3.1+computecanada cycler-0.12.1+computecanada fonttools-4.59.0+computecanada kiwisolver-1.4.8+computecanada matplotlib-3.10.0+computecanada numpy-2.2.2+computecanada ortools-9.10.4067+computecanada packaging-25.0+computecanada pandas-2.2.3+computecanada pillow-11.1.0+computecanada protobuf-6.31.1+computecanada pyparsing-3.2.3+computecanada python-dateutil-2.9.0.post0+computecanada pytz-2025.2+computecanada six-1.17.0+computecanada tzdata-2025.2+computecanada

Starting CP-SAT solver v9.10.4067
Parameters: max_time_in_seconds: 86400 max_memory_in_mb: 185000 log_search_progress: true enumerate_all_solutions: false num_search_workers: 32 absolute_gap_limit: 0 relative_gap_limit: 0

Initial optimization model '': (model_fingerprint: 0x17c619651f7555df)
#Variables: 456 (#ints: 11 in objective)
  - 345 Booleans in [0,1]
  - 111 in [0,913]
#kLinear1: 55
#kLinear2: 740
#kLinear3: 310
#kLinearN: 8'680 (#terms: 169'405)

Starting presolve at 0.00s
  5.27e-03s  0.00e+00d  [DetectDominanceRelations] 
  7.37e-02s  0.00e+00d  [PresolveToFixPoint] #num_loops=8 #num_dual_strengthening=3 
  5.02e-05s  0.00e+00d  [ExtractEncodingFromLinear] #potential_supersets=4 
[Symmetry] Graph for symmetry has 9'709 nodes and 139'839 arcs.
[Symmetry] Symmetry computation done. time: 0.00376735 dtime: 0.0098579
[Symmetry] #generators: 1, average support size: 28
[Symmetry] The model contains 360 duplicate constraints !
[Symmetry] 14 orbits with sizes: 2,2,2,2,2,2,2,2,2,2,...
[Symmetry] Num fixable by intersecting at_most_one with orbits: 1 largest_orbit: 2
  3.25e-02s  8.48e-03d  [Probe] #probed=518 #new_bounds=13 #equiv=1 
  8.77e-05s  0.00e+00d  [MaxClique] 
  5.12e-03s  0.00e+00d  [DetectDominanceRelations] 
  3.58e-02s  0.00e+00d  [PresolveToFixPoint] #num_loops=5 #num_dual_strengthening=3 
  1.67e-02s  0.00e+00d  [ProcessAtMostOneAndLinear] 
  5.32e-03s  0.00e+00d  [DetectDuplicateConstraints] #duplicates=461 #without_enforcements=47 
  8.01e-03s  9.23e-04d  [DetectDominatedLinearConstraints] #relevant_constraints=7'927 #num_inclusions=4'591 
  7.81e-04s  0.00e+00d  [DetectDifferentVariables] #different=31 #cliques=1 #size=7 
  1.62e-03s  2.26e-04d  [ProcessSetPPC] #relevant_constraints=7'513 
  2.90e-05s  0.00e+00d  [FindAlmostIdenticalLinearConstraints] 
  2.63e-04s  4.88e-04d  [FindBigAtMostOneAndLinearOverlap] 
  2.15e-02s  1.72e-02d  [FindBigVerticalLinearOverlap] #blocks=115 #saved_nz=30'877 
  8.98e-04s  4.80e-04d  [FindBigHorizontalLinearOverlap] #linears=7'319 
  3.22e-05s  0.00e+00d  [MergeClauses] 
  5.12e-03s  0.00e+00d  [DetectDominanceRelations] 
  4.29e-02s  0.00e+00d  [PresolveToFixPoint] #num_loops=2 #num_dual_strengthening=1 
  5.10e-03s  0.00e+00d  [DetectDominanceRelations] 
  2.59e-02s  0.00e+00d  [PresolveToFixPoint] #num_loops=1 #num_dual_strengthening=1 
[Symmetry] Graph for symmetry has 9'623 nodes and 107'472 arcs.
[Symmetry] Symmetry computation done. time: 0.00190748 dtime: 0.00554572
  2.89e-02s  7.03e-03d  [Probe] #probed=518 #new_bounds=94 
  2.87e-05s  0.00e+00d  [MaxClique] 
  5.09e-03s  0.00e+00d  [DetectDominanceRelations] 
  4.04e-02s  0.00e+00d  [PresolveToFixPoint] #num_loops=2 #num_dual_strengthening=1 
  1.49e-02s  0.00e+00d  [ProcessAtMostOneAndLinear] 
  4.50e-03s  0.00e+00d  [DetectDuplicateConstraints] #without_enforcements=47 
  4.95e-03s  5.06e-04d  [DetectDominatedLinearConstraints] #relevant_constraints=7'852 #num_inclusions=951 
  6.06e-04s  0.00e+00d  [DetectDifferentVariables] 
  1.40e-03s  1.62e-04d  [ProcessSetPPC] #relevant_constraints=7'263 
  4.83e-05s  5.00e-07d  [FindAlmostIdenticalLinearConstraints] #num_tested_pairs=30 
  1.10e-04s  1.58e-04d  [FindBigAtMostOneAndLinearOverlap] 
  1.47e-02s  1.10e-02d  [FindBigVerticalLinearOverlap] #blocks=272 #saved_nz=24'509 
  7.51e-04s  3.37e-04d  [FindBigHorizontalLinearOverlap] #linears=6'507 
  2.49e-05s  0.00e+00d  [MergeClauses] 
  3.96e-03s  0.00e+00d  [DetectDominanceRelations] 
  4.87e-02s  0.00e+00d  [PresolveToFixPoint] #num_loops=3 #num_dual_strengthening=1 
  3.94e-03s  0.00e+00d  [DetectDominanceRelations] 
  3.03e-02s  0.00e+00d  [PresolveToFixPoint] #num_loops=1 #num_dual_strengthening=1 
[Symmetry] Graph for symmetry has 10'360 nodes and 83'181 arcs.
[Symmetry] Symmetry computation done. time: 0.00156263 dtime: 0.00448266
  2.57e-02s  6.01e-03d  [Probe] #probed=518 #new_bounds=176 
  3.21e-05s  0.00e+00d  [MaxClique] 
  3.95e-03s  0.00e+00d  [DetectDominanceRelations] 
  4.42e-02s  0.00e+00d  [PresolveToFixPoint] #num_loops=2 #num_dual_strengthening=1 
  1.32e-02s  0.00e+00d  [ProcessAtMostOneAndLinear] 
  4.26e-03s  0.00e+00d  [DetectDuplicateConstraints] #without_enforcements=51 
  3.51e-03s  3.12e-04d  [DetectDominatedLinearConstraints] #relevant_constraints=7'994 #num_inclusions=70 
  5.86e-04s  0.00e+00d  [DetectDifferentVariables] 
  1.10e-03s  1.09e-04d  [ProcessSetPPC] #relevant_constraints=6'486 
  9.53e-05s  1.19e-05d  [FindAlmostIdenticalLinearConstraints] #num_tested_pairs=551 
  1.06e-04s  1.17e-04d  [FindBigAtMostOneAndLinearOverlap] 
  9.30e-03s  6.75e-03d  [FindBigVerticalLinearOverlap] #blocks=153 #saved_nz=14'850 
  6.33e-04s  2.46e-04d  [FindBigHorizontalLinearOverlap] #linears=5'678 
  2.92e-05s  0.00e+00d  [MergeClauses] 
  3.33e-03s  0.00e+00d  [DetectDominanceRelations] 
  4.22e-02s  0.00e+00d  [PresolveToFixPoint] #num_loops=2 #num_dual_strengthening=1 
  2.17e-04s  0.00e+00d  [ExpandObjective] #entries=2'665 #tight_variables=788 #tight_constraints=454 

Presolve summary:
  - 124 affine relations were detected.
  - rule 'TODO dual: only one blocking constraint?' was applied 1'065 times.
  - rule 'TODO dual: only one blocking enforced constraint?' was applied 130 times.
  - rule 'TODO dual: only one unspecified blocking constraint?' was applied 34 times.
  - rule 'TODO duplicate: identical constraint with different enforcements' was applied 145 times.
  - rule 'affine: new relation' was applied 124 times.
  - rule 'at_most_one: removed literals' was applied 3 times.
  - rule 'at_most_one: size one' was applied 3 times.
  - rule 'deductions: 568 stored' was applied 1 time.
  - rule 'dual: fix variable' was applied 30 times.
  - rule 'dual: reduced domain' was applied 56 times.
  - rule 'duplicate: merged rhs of linear constraint' was applied 93 times.
  - rule 'duplicate: removed constraint' was applied 461 times.
  - rule 'enforcement: false literal' was applied 12 times.
  - rule 'exactly_one: x and not(x)' was applied 1 time.
  - rule 'incompatible linear: add implication' was applied 63 times.
  - rule 'linear matrix: common vertical rectangle' was applied 540 times.
  - rule 'linear: always true' was applied 915 times.
  - rule 'linear: doubleton free' was applied 15 times.
  - rule 'linear: empty' was applied 42 times.
  - rule 'linear: extracted enforcement literal' was applied 9'144 times.
  - rule 'linear: fixed or dup variables' was applied 8'921 times.
  - rule 'linear: positive equal one' was applied 4 times.
  - rule 'linear: reduced variable domains' was applied 633 times.
  - rule 'linear: remapped using affine relations' was applied 9'034 times.
  - rule 'linear: simplified rhs' was applied 30'236 times.
  - rule 'linear: tightened into equality' was applied 10 times.
  - rule 'linear: variable substitution 1' was applied 15 times.
  - rule 'linear: variable substitution 2' was applied 7 times.
  - rule 'linear: variable substitution 3' was applied 40 times.
  - rule 'no_overlap: inferred from x != y constraints' was applied 1 time.
  - rule 'presolve: 116 unused variables removed.' was applied 1 time.
  - rule 'presolve: iteration' was applied 3 times.
  - rule 'probing: reduced enforced constraint to implication.' was applied 3 times.
  - rule 'symmetry: fixed to false in general orbit' was applied 1 time.

Presolved optimization model '': (model_fingerprint: 0x75b8731cf69aa234)
#Variables: 694 (#ints: 11 in objective)
  - 130 Booleans in [0,1]
  - 478 different domains in [-12659,9882] with a largest complexity of 16.
#kExactlyOne: 3 (#literals: 9)
#kInterval: 7
#kLinear2: 678 (#enforced: 620 #multi: 347)
#kLinear3: 1'463 (#enforced: 1'080)
#kLinearN: 6'562 (#enforced: 6'317) (#terms: 52'736)
#kNoOverlap: 1 (#intervals: 7)

Preloading model.
#Bound   0.65s best:inf   next:[229,8784] initial_domain
[Symmetry] Graph for symmetry has 10'471 nodes and 68'454 arcs.
[Symmetry] Symmetry computation done. time: 0.00132675 dtime: 0.00379188
#Model   0.65s var:694/694 constraints:8714/8714

Starting search at 0.66s with 32 workers.
17 full problem subsolvers: [core, default_lp, fixed, lb_tree_search, max_lp, no_lp, objective_lb_search, objective_lb_search_max_lp, objective_lb_search_no_lp, objective_shaving_search_max_lp, objective_shaving_search_no_lp, probing, probing_max_lp, pseudo_costs, quick_restart, quick_restart_no_lp, reduced_costs]
13 first solution subsolvers: [fj_long_default, fj_long_lin_default, fj_long_random, fj_short_default, fj_short_lin_default, fj_short_lin_random, fj_short_random, fs_random(2), fs_random_no_lp, fs_random_quick_restart(2), fs_random_quick_restart_no_lp]
13 incomplete subsolvers: [feasibility_pump, graph_arc_lns, graph_cst_lns, graph_dec_lns, graph_var_lns, rins/rens, rnd_cst_lns, rnd_var_lns, scheduling_intervals_lns, scheduling_precedences_lns, scheduling_time_window_lns, violation_ls(2)]
3 helper subsolvers: [neighborhood_helper, synchronization_agent, update_gap_integral]
#Bound   0.77s best:inf   next:[238,8784] objective_lb_search_no_lp
#1       0.79s best:3934  next:[238,3933] fs_random_no_lp (fixed_bools=0/173)
#Bound   0.79s best:3934  next:[240,3933] objective_lb_search_no_lp
#Bound   0.80s best:3934  next:[303,3933] objective_lb_search_no_lp
#Bound   0.81s best:3934  next:[313,3933] objective_lb_search_no_lp
#Bound   0.81s best:3934  next:[423,3933] objective_lb_search_no_lp
#2       0.92s best:3929  next:[423,3928] quick_restart_no_lp (fixed_bools=0/201)
#3       0.93s best:3927  next:[423,3926] quick_restart_no_lp (fixed_bools=0/209)
#4       0.95s best:3925  next:[423,3924] violation_ls(batch:3 #solutions_imported:2 #lin_moves:0 #lin_evals:32'798 #gen_moves:11'587 #gen_evals:2'472 #comp_moves:2'180 #backtracks:4'692 #weight_updates:96)
#5       0.96s best:3863  next:[423,3862] rnd_var_lns (d=0.81 s=56 t=0.10 p=1.00 stall=2 h=auto_l0) [presolve]
#6       0.99s best:3861  next:[423,3860] violation_ls(batch:3 #solutions_imported:2 #lin_moves:19'692 #lin_evals:104'243 #gen_moves:11 #gen_evals:2 #comp_moves:1 #backtracks:5 #weight_updates:308)
#7       0.99s best:3298  next:[423,3297] no_lp (fixed_bools=0/166)
#8       1.07s best:3180  next:[423,3179] no_lp (fixed_bools=0/198)
#9       1.09s best:3172  next:[423,3171] no_lp (fixed_bools=0/204)
#10      1.12s best:3146  next:[423,3145] no_lp (fixed_bools=0/216)
#11      1.17s best:3136  next:[423,3135] no_lp (fixed_bools=0/217)
#12      1.22s best:3125  next:[423,3124] no_lp (fixed_bools=0/224)
#Bound   1.23s best:3125  next:[448,3124] objective_lb_search_no_lp
#Bound   1.25s best:3125  next:[451,3124] objective_lb_search_no_lp
#Bound   1.26s best:3125  next:[452,3124] objective_lb_search_no_lp
#Bound   1.26s best:3125  next:[456,3124] objective_lb_search_no_lp
#13      1.28s best:3053  next:[456,3052] no_lp (fixed_bools=0/238)
#Bound   1.49s best:3053  next:[458,3052] objective_lb_search_no_lp
#14      1.51s best:3038  next:[458,3037] no_lp (fixed_bools=0/240)
#Bound   1.53s best:3038  next:[503,3037] objective_lb_search_no_lp
#Bound   1.56s best:3038  next:[506,3037] objective_lb_search_no_lp
#Bound   1.57s best:3038  next:[508,3037] objective_lb_search_no_lp
#Bound   1.58s best:3038  next:[510,3037] objective_lb_search_no_lp
#Bound   1.60s best:3038  next:[511,3037] objective_lb_search_no_lp
#15      1.62s best:2975  next:[511,2974] default_lp (fixed_bools=0/185)
#16      1.70s best:2752  next:[511,2751] no_lp (fixed_bools=0/246)
#Bound   1.83s best:2752  next:[748,2751] objective_lb_search_no_lp
#17      1.91s best:2724  next:[748,2723] no_lp (fixed_bools=0/262)
#18      1.98s best:2723  next:[748,2722] no_lp (fixed_bools=0/262)
#19      1.99s best:2647  next:[748,2646] rins_lp_lns (d=0.81 s=97 t=0.10 p=1.00 stall=2 h=auto_l0)
#20      2.17s best:2315  next:[748,2314] scheduling_time_window_lns (d=0.50 s=65 t=0.10 p=0.00 stall=0 h=auto_l0)
#Bound   2.37s best:2315  next:[824,2314] objective_lb_search_no_lp
#21      2.43s best:2255  next:[824,2254] scheduling_intervals_lns (d=0.50 s=52 t=0.10 p=0.00 stall=0 h=auto_l0)
#22      2.51s best:2254  next:[824,2253] violation_ls(batch:7 #solutions_imported:6 #lin_moves:19'546 #lin_evals:130'500 #gen_moves:18'817 #gen_evals:3'791 #comp_moves:2'602 #backtracks:8'095 #weight_updates:927)
#23      2.55s best:2253  next:[824,2252] violation_ls(batch:7 #solutions_imported:6 #lin_moves:29'396 #lin_evals:186'126 #gen_moves:17'617 #gen_evals:2'060 #comp_moves:1'207 #backtracks:8'204 #weight_updates:868)
#24      2.76s best:2252  next:[824,2251] violation_ls(batch:8 #solutions_imported:7 #lin_moves:19'546 #lin_evals:136'336 #gen_moves:21'085 #gen_evals:4'043 #comp_moves:2'764 #backtracks:9'148 #weight_updates:970)
#25      2.76s best:2251  next:[824,2250] violation_ls(batch:8 #solutions_imported:7 #lin_moves:30'041 #lin_evals:188'447 #gen_moves:17'617 #gen_evals:2'060 #comp_moves:1'207 #backtracks:8'204 #weight_updates:1'000)
#26      2.87s best:2228  next:[824,2227] rins_lp_lns (d=0.91 s=102 t=0.10 p=1.00 stall=1 h=auto_l0)
#27      2.99s best:2217  next:[824,2216] graph_dec_lns (d=0.97 s=138 t=0.10 p=1.00 stall=4 h=auto_l0)
#28      3.00s best:2216  next:[824,2215] violation_ls(batch:9 #solutions_imported:8 #lin_moves:30'041 #lin_evals:190'777 #gen_moves:18'574 #gen_evals:2'161 #comp_moves:1'276 #backtracks:8'648 #weight_updates:1'018)
#29      3.20s best:2201  next:[824,2200] graph_var_lns (d=0.98 s=147 t=0.10 p=1.00 stall=0 h=auto_l0)
#Bound   3.25s best:2201  next:[873,2200] objective_lb_search_no_lp
#30      3.28s best:2185  next:[873,2184] graph_arc_lns (d=0.98 s=148 t=0.10 p=1.00 stall=6 h=auto_l0)
#31      3.36s best:2184  next:[873,2183] violation_ls(batch:10 #solutions_imported:9 #lin_moves:20'417 #lin_evals:160'215 #gen_moves:28'885 #gen_evals:5'055 #comp_moves:3'392 #backtracks:12'733 #weight_updates:1'468)
#32      3.39s best:2183  next:[873,2182] violation_ls(batch:10 #solutions_imported:9 #lin_moves:30'041 #lin_evals:198'963 #gen_moves:21'997 #gen_evals:2'501 #comp_moves:1'469 #backtracks:10'263 #weight_updates:1'067)
#33      3.41s best:2137  next:[873,2136] rins_lp_lns (d=0.84 s=157 t=0.10 p=0.62 stall=1 h=auto_l0)
#34      3.56s best:2129  next:[873,2128] quick_restart_no_lp (fixed_bools=0/484)
#35      3.58s best:2127  next:[873,2126] violation_ls(batch:11 #solutions_imported:10 #lin_moves:20'417 #lin_evals:160'265 #gen_moves:28'908 #gen_evals:5'056 #comp_moves:3'393 #backtracks:12'744 #weight_updates:1'468)
#36      3.59s best:2125  next:[873,2124] violation_ls(batch:11 #solutions_imported:10 #lin_moves:30'041 #lin_evals:198'966 #gen_moves:21'998 #gen_evals:2'501 #comp_moves:1'470 #backtracks:10'263 #weight_updates:1'067)
#Bound   3.60s best:2125  next:[992,2124] objective_lb_search
#37      3.64s best:2118  next:[992,2117] quick_restart_no_lp (fixed_bools=0/486)
#38      3.68s best:2076  next:[992,2075] quick_restart_no_lp (fixed_bools=0/487)
#39      3.74s best:2058  next:[992,2057] quick_restart_no_lp (fixed_bools=0/493)
#40      3.83s best:2040  next:[992,2039] quick_restart_no_lp (fixed_bools=0/500)
#41      3.86s best:2022  next:[992,2021] quick_restart_no_lp (fixed_bools=0/501)
#42      4.10s best:1995  next:[992,1994] rnd_var_lns (d=0.99 s=173 t=0.10 p=1.00 stall=0 h=auto_l0)
#Bound   6.04s best:1995  next:[994,1994] objective_lb_search_no_lp
#Bound   8.17s best:1995  next:[995,1994] objective_lb_search
#Bound   8.52s best:1995  next:[998,1994] objective_lb_search_no_lp
#Bound   9.62s best:1995  next:[1000,1994] objective_lb_search
#Bound  10.47s best:1995  next:[1001,1994] objective_lb_search_no_lp
#Bound  11.08s best:1995  next:[1012,1994] objective_lb_search
#43     12.94s best:1981  next:[1012,1980] graph_cst_lns (d=1.00 s=417 t=0.10 p=0.83 stall=9 h=auto_l0)
#44     12.96s best:1980  next:[1012,1979] violation_ls(batch:30 #solutions_imported:13 #lin_moves:106'715 #lin_evals:616'751 #gen_moves:36'185 #gen_evals:5'922 #comp_moves:4'889 #backtracks:15'629 #weight_updates:86'992)
#45     12.96s best:1979  next:[1012,1978] violation_ls(batch:30 #solutions_imported:13 #lin_moves:30'041 #lin_evals:544'511 #gen_moves:162'525 #gen_evals:17'366 #comp_moves:5'701 #backtracks:78'380 #weight_updates:2'279)
#Bound  13.73s best:1979  next:[1013,1978] objective_lb_search_no_lp
#46     13.80s best:1940  next:[1013,1939] graph_var_lns (d=0.99 s=441 t=0.10 p=0.75 stall=9 h=auto_l0)
#Bound  13.96s best:1940  next:[1017,1939] objective_lb_search
#47     14.05s best:1939  next:[1017,1938] violation_ls(batch:32 #solutions_imported:15 #lin_moves:107'382 #lin_evals:642'197 #gen_moves:44'363 #gen_evals:6'737 #comp_moves:5'429 #backtracks:19'447 #weight_updates:87'413)
#48     14.05s best:1938  next:[1017,1937] violation_ls(batch:32 #solutions_imported:15 #lin_moves:39'720 #lin_evals:584'875 #gen_moves:162'532 #gen_evals:17'366 #comp_moves:5'702 #backtracks:78'383 #weight_updates:2'600)
#49     14.28s best:1926  next:[1017,1925] rnd_cst_lns (d=0.99 s=470 t=0.10 p=0.70 stall=19 h=auto_l0)
#50     14.34s best:1909  next:[1017,1908] rins_lp_lns (d=0.88 s=466 t=0.10 p=0.55 stall=0 h=auto_l0)
#Bound  15.28s best:1909  next:[1019,1908] objective_lb_search_no_lp
#Bound  16.01s best:1909  next:[1022,1908] objective_lb_search
#Bound  16.32s best:1909  next:[1023,1908] objective_lb_search
#Bound  16.80s best:1909  next:[1026,1908] objective_lb_search_max_lp
#Bound  18.83s best:1909  next:[1041,1908] objective_lb_search
#Bound  20.03s best:1909  next:[1048,1908] objective_lb_search
#Bound  21.04s best:1909  next:[1053,1908] objective_lb_search
#Bound  23.10s best:1909  next:[1057,1908] objective_lb_search
#Bound  25.64s best:1909  next:[1059,1908] objective_lb_search
#Bound  27.07s best:1909  next:[1061,1908] objective_lb_search
#Bound  28.08s best:1909  next:[1072,1908] objective_lb_search_max_lp
#Bound  32.12s best:1909  next:[1074,1908] objective_lb_search
#Bound  33.97s best:1909  next:[1075,1908] objective_lb_search_max_lp
#Bound  34.53s best:1909  next:[1080,1908] objective_lb_search
#Bound  35.39s best:1909  next:[1081,1908] objective_lb_search
#Bound  40.32s best:1909  next:[1088,1908] objective_lb_search
#Bound  42.00s best:1909  next:[1090,1908] objective_lb_search
#Bound  44.48s best:1909  next:[1092,1908] objective_lb_search
#Bound  44.80s best:1909  next:[1093,1908] objective_lb_search
#Bound  47.76s best:1909  next:[1094,1908] objective_lb_search
#Bound  49.92s best:1909  next:[1099,1908] objective_lb_search
#Bound  54.25s best:1909  next:[1102,1908] objective_lb_search_max_lp
#Bound  58.96s best:1909  next:[1104,1908] objective_lb_search_max_lp
#Bound  59.59s best:1909  next:[1106,1908] objective_lb_search_max_lp
#Bound  63.83s best:1909  next:[1109,1908] objective_lb_search_max_lp
#Bound  66.38s best:1909  next:[1111,1908] objective_lb_search_max_lp
#Bound  66.45s best:1909  next:[1115,1908] objective_lb_search
#Bound  72.27s best:1909  next:[1118,1908] objective_lb_search_max_lp
#Bound  74.06s best:1909  next:[1127,1908] objective_lb_search
#Bound  75.11s best:1909  next:[1129,1908] objective_lb_search_max_lp
#Bound  76.29s best:1909  next:[1154,1908] objective_lb_search
#Bound  79.59s best:1909  next:[1159,1908] objective_lb_search
#Bound  86.95s best:1909  next:[1161,1908] objective_lb_search
#Bound  91.06s best:1909  next:[1162,1908] objective_lb_search
#Bound  95.65s best:1909  next:[1164,1908] objective_lb_search
#Bound 103.83s best:1909  next:[1169,1908] objective_lb_search
#Bound 112.84s best:1909  next:[1170,1908] lb_tree_search (nodes=5784/5787 rc=55 decisions=61619 @root=33 restarts=11) 
#Bound 116.39s best:1909  next:[1171,1908] lb_tree_search (nodes=5807/5810 rc=56 decisions=62333 @root=34 restarts=11) 
#Bound 119.73s best:1909  next:[1172,1908] lb_tree_search (nodes=5835/5838 rc=56 decisions=63018 @root=35 restarts=11) 
#Bound 123.24s best:1909  next:[1173,1908] lb_tree_search (nodes=5871/5875 rc=59 decisions=63760 @root=36 restarts=11) 
#Bound 126.77s best:1909  next:[1174,1908] lb_tree_search (nodes=5893/5897 rc=59 decisions=64441 @root=37 restarts=11) 
#Bound 130.52s best:1909  next:[1175,1908] lb_tree_search (nodes=5924/5928 rc=60 decisions=65209 @root=38 restarts=11) 
#Bound 135.36s best:1909  next:[1176,1908] lb_tree_search (nodes=5948/5952 rc=60 decisions=66043 @root=40 restarts=11) 
#Bound 136.49s best:1909  next:[1181,1908] objective_lb_search
#Bound 141.24s best:1909  next:[1183,1908] objective_lb_search_max_lp
#Bound 144.79s best:1909  next:[1184,1908] objective_lb_search
#Bound 155.27s best:1909  next:[1185,1908] lb_tree_search (nodes=6262/6266 rc=62 decisions=70517 @root=47 restarts=11) 
#Bound 155.47s best:1909  next:[1186,1908] objective_lb_search
#Bound 162.85s best:1909  next:[1187,1908] lb_tree_search (nodes=6327/6331 rc=63 decisions=71885 @root=50 restarts=11) 
#Bound 166.00s best:1909  next:[1188,1908] objective_lb_search
#Bound 168.21s best:1909  next:[1189,1908] objective_lb_search
#Bound 169.91s best:1909  next:[1191,1908] objective_lb_search
#Bound 174.87s best:1909  next:[1192,1908] lb_tree_search (nodes=6247/6452 rc=67 decisions=74313 @root=54 restarts=11) 
#Bound 176.42s best:1909  next:[1193,1908] objective_lb_search
#Bound 181.40s best:1909  next:[1194,1908] lb_tree_search (nodes=6228/6472 rc=69 decisions=75160 @root=58 restarts=11) 
#Bound 184.00s best:1909  next:[1195,1908] lb_tree_search (nodes=6236/6480 rc=69 decisions=75611 @root=59 restarts=11) 
#Bound 186.77s best:1909  next:[1196,1908] lb_tree_search (nodes=6250/6494 rc=71 decisions=76124 @root=60 restarts=11) 
#Bound 187.03s best:1909  next:[1210,1908] objective_lb_search
#Bound 194.40s best:1909  next:[1211,1908] lb_tree_search (nodes=6530/6836 rc=75 decisions=79474 @root=61 restarts=11) 
#Bound 196.56s best:1909  next:[1212,1908] lb_tree_search (nodes=6542/6850 rc=75 decisions=79964 @root=62 restarts=11) 
#Bound 199.52s best:1909  next:[1213,1908] lb_tree_search (nodes=6552/6868 rc=75 decisions=80523 @root=63 restarts=11) 
#Bound 202.21s best:1909  next:[1214,1908] lb_tree_search (nodes=6569/6888 rc=75 decisions=81057 @root=64 restarts=11) 
#Bound 204.89s best:1909  next:[1216,1908] objective_lb_search
#Bound 208.28s best:1909  next:[1217,1908] objective_lb_search
#Bound 211.81s best:1909  next:[1218,1908] lb_tree_search (nodes=6602/6922 rc=78 decisions=82686 @root=69 restarts=11) 
#Bound 214.36s best:1909  next:[1219,1908] lb_tree_search (nodes=6610/6932 rc=79 decisions=83176 @root=70 restarts=11) 
#Bound 216.89s best:1909  next:[1220,1908] lb_tree_search (nodes=6615/6937 rc=79 decisions=83613 @root=71 restarts=11) 
#Bound 217.08s best:1909  next:[1221,1908] objective_lb_search
#Bound 217.91s best:1909  next:[1222,1908] objective_lb_search
#Bound 219.55s best:1909  next:[1227,1908] objective_lb_search
#Bound 225.88s best:1909  next:[1228,1908] lb_tree_search (nodes=6744/7075 rc=84 decisions=86409 @root=73 restarts=11) 
#Bound 226.98s best:1909  next:[1230,1908] objective_lb_search
#Bound 228.52s best:1909  next:[1233,1908] objective_lb_search
#Bound 231.55s best:1909  next:[1241,1908] objective_lb_search
#Bound 238.95s best:1909  next:[1243,1908] objective_lb_search
#Bound 244.49s best:1909  next:[1244,1908] objective_lb_search
#Bound 245.27s best:1909  next:[1249,1908] objective_lb_search
#Bound 246.43s best:1909  next:[1250,1908] objective_lb_search
#Bound 247.57s best:1909  next:[1254,1908] objective_lb_search
#Bound 249.31s best:1909  next:[1255,1908] objective_lb_search
#Bound 252.67s best:1909  next:[1256,1908] lb_tree_search (nodes=1549/1549 rc=89 decisions=92738 @root=81 restarts=12) 
#Bound 256.09s best:1909  next:[1257,1908] objective_lb_search
#Bound 258.12s best:1909  next:[1261,1908] objective_lb_search
#Bound 258.81s best:1909  next:[1262,1908] objective_lb_search
#Bound 259.64s best:1909  next:[1264,1908] objective_lb_search
#Bound 261.49s best:1909  next:[1265,1908] objective_lb_search
#Bound 267.97s best:1909  next:[1266,1908] lb_tree_search (nodes=1652/1662 rc=93 decisions=94017 @root=92 restarts=12) 
#Bound 269.35s best:1909  next:[1267,1908] lb_tree_search (nodes=1661/1674 rc=93 decisions=94208 @root=93 restarts=12) 
#Bound 270.94s best:1909  next:[1268,1908] lb_tree_search (nodes=1676/1690 rc=93 decisions=94410 @root=94 restarts=12) 
#Bound 271.78s best:1909  next:[1269,1908] objective_lb_search
#Bound 274.98s best:1909  next:[1270,1908] lb_tree_search (nodes=1700/1721 rc=94 decisions=94796 @root=97 restarts=12) 
#Bound 278.21s best:1909  next:[1271,1908] lb_tree_search (nodes=1695/1729 rc=94 decisions=94945 @root=100 restarts=12) 
#Bound 279.68s best:1909  next:[1272,1908] lb_tree_search (nodes=1677/1741 rc=94 decisions=95103 @root=101 restarts=12) 
#Bound 281.28s best:1909  next:[1273,1908] lb_tree_search (nodes=1686/1758 rc=94 decisions=95314 @root=102 restarts=12) 
#Bound 282.77s best:1909  next:[1274,1908] lb_tree_search (nodes=1693/1780 rc=94 decisions=95529 @root=103 restarts=12) 
#Bound 284.09s best:1909  next:[1275,1908] lb_tree_search (nodes=1693/1787 rc=94 decisions=95667 @root=104 restarts=12) 
#Bound 286.87s best:1909  next:[1276,1908] lb_tree_search (nodes=1712/1806 rc=95 decisions=95900 @root=106 restarts=12) 
#Bound 288.12s best:1909  next:[1277,1908] lb_tree_search (nodes=1721/1815 rc=95 decisions=96054 @root=107 restarts=12) 
#Bound 289.73s best:1909  next:[1278,1908] lb_tree_search (nodes=1717/1825 rc=95 decisions=96235 @root=108 restarts=12) 
#Bound 293.48s best:1909  next:[1282,1908] objective_lb_search
#Model 297.03s var:690/694 constraints:8403/8714
#Bound 297.59s best:1909  next:[1283,1908] lb_tree_search (nodes=1760/1879 rc=97 decisions=96921 @root=114 restarts=12) 
#Bound 298.61s best:1909  next:[1288,1908] objective_lb_search
#Bound 303.34s best:1909  next:[1289,1908] lb_tree_search (nodes=1452/1928 rc=99 decisions=97558 @root=118 restarts=12) 
#Bound 304.57s best:1909  next:[1290,1908] lb_tree_search (nodes=1457/1933 rc=99 decisions=97694 @root=119 restarts=12) 
#Bound 305.91s best:1909  next:[1291,1908] lb_tree_search (nodes=1467/1954 rc=99 decisions=97891 @root=120 restarts=12) 
#Bound 307.01s best:1909  next:[1292,1908] lb_tree_search (nodes=1476/1964 rc=99 decisions=98040 @root=121 restarts=12) 
#Bound 308.11s best:1909  next:[1293,1908] lb_tree_search (nodes=1484/1973 rc=99 decisions=98190 @root=122 restarts=12) 
#Bound 309.29s best:1909  next:[1294,1908] lb_tree_search (nodes=1473/1983 rc=100 decisions=98331 @root=123 restarts=12) 
#Bound 311.68s best:1909  next:[1295,1908] lb_tree_search (nodes=1498/2008 rc=103 decisions=98558 @root=125 restarts=12) 
#Bound 312.72s best:1909  next:[1296,1908] lb_tree_search (nodes=1496/2012 rc=103 decisions=98676 @root=126 restarts=12) 
#Bound 314.93s best:1909  next:[1297,1908] lb_tree_search (nodes=1507/2023 rc=103 decisions=98853 @root=128 restarts=12) 
#Bound 316.20s best:1909  next:[1298,1908] lb_tree_search (nodes=1517/2033 rc=103 decisions=99049 @root=129 restarts=12) 
#Bound 316.95s best:1909  next:[1302,1908] objective_lb_search
#Bound 320.94s best:1909  next:[1303,1908] lb_tree_search (nodes=1551/2092 rc=106 decisions=99794 @root=132 restarts=12) 
#Bound 321.39s best:1909  next:[1304,1908] objective_lb_search_max_lp
#Bound 323.18s best:1909  next:[1305,1908] lb_tree_search (nodes=1571/2112 rc=106 decisions=100162 @root=133 restarts=12) 
#Bound 324.53s best:1909  next:[1306,1908] lb_tree_search (nodes=1580/2122 rc=106 decisions=100353 @root=134 restarts=12) 
#Bound 325.88s best:1909  next:[1307,1908] lb_tree_search (nodes=1583/2128 rc=106 decisions=100537 @root=135 restarts=12) 
#Bound 327.00s best:1909  next:[1308,1908] lb_tree_search (nodes=1593/2138 rc=106 decisions=100680 @root=136 restarts=12) 
#Bound 328.11s best:1909  next:[1309,1908] lb_tree_search (nodes=1592/2140 rc=106 decisions=100810 @root=137 restarts=12) 
#Bound 329.38s best:1909  next:[1310,1908] objective_lb_search_max_lp
#Bound 330.67s best:1909  next:[1311,1908] lb_tree_search (nodes=1617/2166 rc=106 decisions=101165 @root=139 restarts=12) 
#Bound 332.99s best:1909  next:[1312,1908] lb_tree_search (nodes=1632/2181 rc=106 decisions=101384 @root=141 restarts=12) 
#Bound 333.31s best:1909  next:[1317,1908] objective_lb_search_max_lp
#Bound 334.72s best:1909  next:[1320,1908] objective_lb_search_no_lp
#Bound 337.33s best:1909  next:[1321,1908] lb_tree_search (nodes=1745/2310 rc=109 decisions=102506 @root=143 restarts=12) 
#Bound 338.82s best:1909  next:[1322,1908] lb_tree_search (nodes=1759/2324 rc=109 decisions=102685 @root=144 restarts=12) 
#Bound 340.05s best:1909  next:[1323,1908] lb_tree_search (nodes=1761/2326 rc=110 decisions=102826 @root=145 restarts=12) 
#Bound 340.42s best:1909  next:[1324,1908] objective_lb_search_max_lp
#Bound 341.86s best:1909  next:[1325,1908] lb_tree_search (nodes=1780/2346 rc=110 decisions=103109 @root=146 restarts=12) 
#Bound 346.12s best:1909  next:[1326,1908] lb_tree_search (nodes=1730/2366 rc=110 decisions=103351 @root=150 restarts=12) 
#Bound 347.38s best:1909  next:[1327,1908] lb_tree_search (nodes=1709/2369 rc=110 decisions=103517 @root=151 restarts=12) 
#Bound 349.01s best:1909  next:[1328,1908] lb_tree_search (nodes=1720/2385 rc=110 decisions=103763 @root=152 restarts=12) 
#Bound 350.47s best:1909  next:[1329,1908] lb_tree_search (nodes=1709/2391 rc=110 decisions=103957 @root=153 restarts=12) 
#Bound 351.93s best:1909  next:[1330,1908] lb_tree_search (nodes=1718/2401 rc=110 decisions=104128 @root=154 restarts=12) 
#Bound 353.31s best:1909  next:[1331,1908] lb_tree_search (nodes=1730/2413 rc=110 decisions=104332 @root=155 restarts=12) 
#Bound 354.37s best:1909  next:[1334,1908] objective_lb_search_max_lp
#Bound 357.59s best:1909  next:[1335,1908] lb_tree_search (nodes=1706/2466 rc=113 decisions=104968 @root=158 restarts=12) 
#Bound 358.74s best:1909  next:[1336,1908] lb_tree_search (nodes=1678/2475 rc=113 decisions=105105 @root=159 restarts=12) 
#Bound 360.24s best:1909  next:[1337,1908] lb_tree_search (nodes=1687/2487 rc=113 decisions=105323 @root=160 restarts=12) 
#Bound 361.30s best:1909  next:[1338,1908] lb_tree_search (nodes=1695/2495 rc=113 decisions=105461 @root=161 restarts=12) 
#Bound 363.84s best:1909  next:[1339,1908] lb_tree_search (nodes=1647/2510 rc=113 decisions=105657 @root=163 restarts=12) 
#Bound 365.19s best:1909  next:[1340,1908] lb_tree_search (nodes=1610/2530 rc=113 decisions=105844 @root=164 restarts=12) 
#Bound 366.10s best:1909  next:[1344,1908] objective_lb_search_no_lp
#Bound 368.78s best:1909  next:[1345,1908] lb_tree_search (nodes=1550/2590 rc=113 decisions=106432 @root=166 restarts=12) 
#Bound 369.91s best:1909  next:[1346,1908] lb_tree_search (nodes=1554/2595 rc=113 decisions=106556 @root=167 restarts=12) 
#Model 370.54s var:686/694 constraints:8131/8714
#Bound 370.91s best:1909  next:[1347,1908] lb_tree_search (nodes=1513/2604 rc=114 decisions=106666 @root=168 restarts=12) 
#Bound 371.28s best:1909  next:[1349,1908] objective_lb_search_max_lp
#Bound 376.39s best:1909  next:[1350,1908] lb_tree_search (nodes=1439/2630 rc=114 decisions=107010 @root=173 restarts=12) 
#Bound 377.19s best:1909  next:[1351,1908] objective_lb_search_max_lp
#Bound 378.95s best:1909  next:[1352,1908] lb_tree_search (nodes=1430/2645 rc=115 decisions=107185 @root=176 restarts=12) 
#Bound 380.18s best:1909  next:[1353,1908] lb_tree_search (nodes=1439/2661 rc=115 decisions=107367 @root=177 restarts=12) 
#Bound 381.09s best:1909  next:[1354,1908] lb_tree_search (nodes=1442/2667 rc=115 decisions=107469 @root=178 restarts=12) 
#Bound 381.93s best:1909  next:[1355,1908] lb_tree_search (nodes=1427/2671 rc=115 decisions=107549 @root=179 restarts=12) 
#Bound 381.98s best:1909  next:[1376,1908] objective_lb_search_max_lp
#Bound 384.42s best:1909  next:[1402,1908] objective_lb_search_max_lp
#Bound 387.06s best:1909  next:[1406,1908] objective_lb_search_max_lp
#Model 389.68s var:684/694 constraints:7928/8714
#Bound 390.55s best:1909  next:[1409,1908] objective_lb_search
#Model 392.15s var:683/694 constraints:7837/8714
#Bound 392.21s best:1909  next:[1418,1908] objective_lb_search_max_lp
#Bound 392.90s best:1909  next:[1419,1908] objective_lb_search_max_lp
#Bound 393.49s best:1909  next:[1420,1908] objective_lb_search_max_lp
#Model 393.50s var:682/694 constraints:7683/8714
#Bound 394.02s best:1909  next:[1430,1908] objective_lb_search_max_lp
#Bound 394.07s best:1909  next:[1439,1908] objective_lb_search
#Bound 394.59s best:1909  next:[1442,1908] objective_lb_search_max_lp
#Model 394.83s var:681/694 constraints:7458/8714
#Bound 395.10s best:1909  next:[1443,1908] objective_lb_search
#Bound 395.40s best:1909  next:[1462,1908] objective_lb_search_no_lp
#Bound 396.18s best:1909  next:[1463,1908] objective_lb_search_no_lp
#Bound 396.55s best:1909  next:[1467,1908] objective_lb_search
#Bound 396.97s best:1909  next:[1489,1908] objective_lb_search_no_lp
#Model 397.18s var:679/694 constraints:7187/8714
#Model 397.54s var:663/694 constraints:5954/8714
#Bound 397.63s best:1909  next:[1544,1908] objective_lb_search_max_lp
#Bound 397.97s best:1909  next:[1556,1908] objective_lb_search
#Bound 398.19s best:1909  next:[1577,1908] objective_lb_search
#Model 398.34s var:662/694 constraints:5784/8714
#Bound 398.46s best:1909  next:[1624,1908] objective_lb_search
#Bound 398.86s best:1909  next:[1635,1908] objective_lb_search_no_lp
#Model 398.87s var:660/694 constraints:5645/8714
#Bound 399.38s best:1909  next:[1648,1908] objective_lb_search
#Bound 399.73s best:1909  next:[1674,1908] objective_lb_search_max_lp
#Model 399.80s var:657/694 constraints:5461/8714
#Bound 399.80s best:1909  next:[1685,1908] objective_lb_search_no_lp
#Model 399.83s var:655/694 constraints:5231/8714
#Model 400.12s var:651/694 constraints:4953/8714
#Model 400.22s var:647/694 constraints:4474/8714
#Bound 400.30s best:1909  next:[1686,1908] objective_lb_search_no_lp
#Model 400.31s var:646/694 constraints:4367/8714
#Model 400.31s var:642/694 constraints:3924/8714
#Bound 400.33s best:1909  next:[1735,1908] objective_lb_search_max_lp
#Model 400.35s var:641/694 constraints:3843/8714
#Model 400.38s var:640/694 constraints:3678/8714
#Bound 400.41s best:1909  next:[1737,1908] objective_lb_search_no_lp
#Model 400.49s var:639/694 constraints:3551/8714
#Model 400.53s var:637/694 constraints:3284/8714
#Bound 400.56s best:1909  next:[1822,1908] objective_lb_search_no_lp
#Done  400.62s quick_restart_no_lp
#Model 400.62s var:613/694 constraints:1705/8714
#Model 400.63s var:610/694 constraints:1487/8714
#Done  400.63s core

Task timing                                  n [     min,      max]      avg      dev     time         n [     min,      max]      avg      dev    dtime
                             'core':         1 [   6.67m,    6.67m]    6.67m   0.00ns    6.67m         1 [   7.88m,    7.88m]    7.88m   0.00ns    7.88m
                       'default_lp':         1 [   6.67m,    6.67m]    6.67m   0.00ns    6.67m         1 [   1.89m,    1.89m]    1.89m   0.00ns    1.89m
                 'feasibility_pump':       883 [ 85.58ms,    1.56s] 318.53ms  45.53ms    4.69m       882 [ 42.17ms, 376.74ms]  76.58ms  10.25ms    1.13m
                            'fixed':         1 [   6.67m,    6.67m]    6.67m   0.00ns    6.67m         1 [   1.81m,    1.81m]    1.81m   0.00ns    1.81m
                  'fj_long_default':         1 [177.08ms, 177.08ms] 177.08ms   0.00ns 177.08ms         1 [129.81ms, 129.81ms] 129.81ms   0.00ns 129.81ms
              'fj_long_lin_default':         1 [230.36ms, 230.36ms] 230.36ms   0.00ns 230.36ms         1 [101.92ms, 101.92ms] 101.92ms   0.00ns 101.92ms
                   'fj_long_random':         1 [190.47ms, 190.47ms] 190.47ms   0.00ns 190.47ms         1 [135.64ms, 135.64ms] 135.64ms   0.00ns 135.64ms
                 'fj_short_default':         1 [171.28ms, 171.28ms] 171.28ms   0.00ns 171.28ms         1 [ 96.26ms,  96.26ms]  96.26ms   0.00ns  96.26ms
             'fj_short_lin_default':         1 [207.14ms, 207.14ms] 207.14ms   0.00ns 207.14ms         1 [101.84ms, 101.84ms] 101.84ms   0.00ns 101.84ms
              'fj_short_lin_random':         1 [248.76ms, 248.76ms] 248.76ms   0.00ns 248.76ms         1 [100.79ms, 100.79ms] 100.79ms   0.00ns 100.79ms
                  'fj_short_random':         1 [223.91ms, 223.91ms] 223.91ms   0.00ns 223.91ms         1 [ 98.78ms,  98.78ms]  98.78ms   0.00ns  98.78ms
                        'fs_random':         1 [132.63ms, 132.63ms] 132.63ms   0.00ns 132.63ms         1 [ 20.00ns,  20.00ns]  20.00ns   0.00ns  20.00ns
                        'fs_random':         1 [138.81ms, 138.81ms] 138.81ms   0.00ns 138.81ms         1 [ 20.00ns,  20.00ns]  20.00ns   0.00ns  20.00ns
                  'fs_random_no_lp':         1 [129.08ms, 129.08ms] 129.08ms   0.00ns 129.08ms         1 [  1.48ms,   1.48ms]   1.48ms   0.00ns   1.48ms
          'fs_random_quick_restart':         1 [132.49ms, 132.49ms] 132.49ms   0.00ns 132.49ms         1 [ 20.00ns,  20.00ns]  20.00ns   0.00ns  20.00ns
          'fs_random_quick_restart':         1 [138.72ms, 138.72ms] 138.72ms   0.00ns 138.72ms         1 [ 20.00ns,  20.00ns]  20.00ns   0.00ns  20.00ns
    'fs_random_quick_restart_no_lp':         1 [128.47ms, 128.47ms] 128.47ms   0.00ns 128.47ms         1 [  1.65ms,   1.65ms]   1.65ms   0.00ns   1.65ms
                    'graph_arc_lns':       934 [  7.61ms,    1.35s] 625.06ms 326.02ms    9.73m       800 [ 10.00ns, 126.42ms]  73.70ms  42.16ms   58.96s
                    'graph_cst_lns':       934 [  3.60ms,    1.22s] 607.92ms 339.39ms    9.46m       800 [ 10.00ns, 116.64ms]  71.92ms  45.87ms   57.54s
                    'graph_dec_lns':       934 [ 10.33ms,    1.35s] 657.68ms 337.80ms   10.24m       806 [ 10.00ns, 124.31ms]  77.20ms  40.95ms    1.04m
                    'graph_var_lns':       935 [  7.22ms,    1.33s] 581.97ms 348.88ms    9.07m       760 [ 10.00ns, 183.40ms]  71.29ms  44.32ms   54.18s
                   'lb_tree_search':         1 [   6.67m,    6.67m]    6.67m   0.00ns    6.67m         1 [   5.13m,    5.13m]    5.13m   0.00ns    5.13m
                           'max_lp':         1 [   6.67m,    6.67m]    6.67m   0.00ns    6.67m         1 [   2.22m,    2.22m]    2.22m   0.00ns    2.22m
                            'no_lp':         1 [   6.67m,    6.67m]    6.67m   0.00ns    6.67m         1 [   1.21m,    1.21m]    1.21m   0.00ns    1.21m
              'objective_lb_search':         1 [   6.67m,    6.67m]    6.67m   0.00ns    6.67m         1 [   2.58m,    2.58m]    2.58m   0.00ns    2.58m
       'objective_lb_search_max_lp':         1 [   6.67m,    6.67m]    6.67m   0.00ns    6.67m         1 [   3.16m,    3.16m]    3.16m   0.00ns    3.16m
        'objective_lb_search_no_lp':         1 [   6.67m,    6.67m]    6.67m   0.00ns    6.67m         1 [  56.47s,   56.47s]   56.47s   0.00ns   56.47s
  'objective_shaving_search_max_lp':       198 [ 20.74ms,   10.44s]    2.02s    1.84s    6.65m       188 [  1.10ms,    1.85s] 350.93ms 350.04ms    1.10m
   'objective_shaving_search_no_lp':       198 [ 20.48ms,   10.44s]    2.02s    1.84s    6.65m       188 [  1.03ms,    1.25s] 246.81ms 237.83ms   46.40s
                          'probing':         1 [   6.67m,    6.67m]    6.67m   0.00ns    6.67m         1 [   1.65m,    1.65m]    1.65m   0.00ns    1.65m
                   'probing_max_lp':         1 [   6.67m,    6.67m]    6.67m   0.00ns    6.67m         1 [   1.90m,    1.90m]    1.90m   0.00ns    1.90m
                     'pseudo_costs':         1 [   6.67m,    6.67m]    6.67m   0.00ns    6.67m         1 [   1.98m,    1.98m]    1.98m   0.00ns    1.98m
                    'quick_restart':         1 [   6.67m,    6.67m]    6.67m   0.00ns    6.67m         1 [   2.71m,    2.71m]    2.71m   0.00ns    2.71m
              'quick_restart_no_lp':         1 [   6.67m,    6.67m]    6.67m   0.00ns    6.67m         1 [   1.77m,    1.77m]    1.77m   0.00ns    1.77m
                    'reduced_costs':         1 [   6.67m,    6.67m]    6.67m   0.00ns    6.67m         1 [   2.03m,    2.03m]    2.03m   0.00ns    2.03m
                        'rins/rens':       935 [155.91us, 878.36ms] 412.77ms 272.84ms    6.43m       762 [ 10.00ns, 100.89ms]  72.56ms  37.01ms   55.29s
                      'rnd_cst_lns':       935 [  3.57ms,    1.27s] 617.81ms 333.91ms    9.63m       805 [ 10.00ns, 192.80ms]  71.78ms  43.84ms   57.78s
                      'rnd_var_lns':       935 [  5.62ms,    1.44s] 652.71ms 341.18ms   10.17m       803 [ 10.00ns, 164.50ms]  77.63ms  42.29ms    1.04m
         'scheduling_intervals_lns':       934 [  2.25ms,    1.80s] 606.10ms 447.11ms    9.43m       557 [100.01ms, 122.99ms] 110.46ms   6.91ms    1.03m
       'scheduling_precedences_lns':       934 [  2.29ms,    1.94s] 613.22ms 446.99ms    9.55m       557 [100.00ms, 122.99ms] 110.47ms   6.89ms    1.03m
       'scheduling_time_window_lns':       934 [  2.37ms,    1.32s] 603.58ms 443.05ms    9.40m       557 [100.01ms, 122.99ms] 110.40ms   6.90ms    1.02m
                     'violation_ls':       935 [  1.17ms, 108.23ms]  65.31ms  14.06ms    1.02m       935 [730.00ns, 232.64ms] 114.09ms  31.02ms    1.78m
                     'violation_ls':       935 [733.29us, 160.23ms]  67.09ms  19.01ms    1.05m       935 [810.00ns, 357.94ms] 131.67ms  49.93ms    2.05m

Search stats                        Bools  Conflicts  Branches  Restarts   BoolPropag  IntegerPropag
                           'core':  8'341    100'618   125'072     2'727  233'210'424    188'820'574
                     'default_lp':  3'251     66'257   324'420    35'083   54'816'332    186'855'148
                          'fixed':  2'643    365'723   879'806     2'184   98'713'584    214'026'861
                      'fs_random':    130          0       242       242           18         15'241
                      'fs_random':    130          0       260       260           18         15'899
                'fs_random_no_lp':    173          2       336       261          131         23'046
        'fs_random_quick_restart':    130          0       242       242           18         15'241
        'fs_random_quick_restart':    130          0       260       260           18         15'899
  'fs_random_quick_restart_no_lp':    130          0       369       260           21         23'059
                 'lb_tree_search':    151        250   497'508   162'198    1'319'654     88'966'718
                         'max_lp':    130     45'130   319'920    63'318    2'410'539    177'972'084
                          'no_lp':  2'369    118'076   304'591    29'294   65'551'247    267'644'413
            'objective_lb_search':    378     28'509   274'606    50'171    3'526'254    168'159'920
     'objective_lb_search_max_lp':    333     20'246   321'468    70'311    3'434'288    170'960'139
      'objective_lb_search_no_lp':    518     84'848   200'493    21'350    4'519'852    217'670'928
                        'probing':  1'279        920     4'432     3'180      117'515      1'355'564
                 'probing_max_lp':  1'279        918     2'384     2'153       98'397      1'206'489
                   'pseudo_costs':  1'072     58'699   313'373    44'619   22'420'949    176'457'867
                  'quick_restart':  2'786     38'344   380'197    30'188   40'323'585    135'986'419
            'quick_restart_no_lp':  5'784    142'467   532'648    24'258  140'895'781    263'517'599
                  'reduced_costs':  1'781     59'637   356'452    43'841   26'855'284    185'084'007

SAT stats                           ClassicMinim  LitRemoved  LitLearned  LitForgotten  Subsumed  MClauses  MDecisions  MLitTrue  MSubsumed  MLitRemoved  MReused
                           'core':        95'074     631'129     757'139        11'286       508       685       3'097         0         93          281       10
                     'default_lp':        52'812     231'272     921'853       583'148       846    16'178     145'396        38      4'564       31'149    2'489
                          'fixed':       196'008     871'933   6'683'285     3'277'575       213     1'626       6'631         0      1'610       11'715        0
                      'fs_random':             0           0           0             0         0         0           0         0          0            0        0
                      'fs_random':             0           0           0             0         0         0           0         0          0            0        0
                'fs_random_no_lp':             0           0          20             0         0         0           0         0          0            0        0
        'fs_random_quick_restart':             0           0           0             0         0         0           0         0          0            0        0
        'fs_random_quick_restart':             0           0           0             0         0         0           0         0          0            0        0
  'fs_random_quick_restart_no_lp':             0           0           0             0         0         0           0         0          0            0        0
                 'lb_tree_search':             4           4         822             0         1    63'681     326'328         0         71          265    4'234
                         'max_lp':        28'217      75'816     622'504       350'942     1'573    26'434     243'524         0      1'263        9'851    3'668
                          'no_lp':        99'841     513'656   1'812'898     1'417'710     1'142    13'638      98'579        35      3'778       23'068    1'958
            'objective_lb_search':        22'503      72'539     214'915         5'122       915    23'336     223'052         4      4'078       25'295    5'493
     'objective_lb_search_max_lp':        15'198      46'211     154'766         5'681       842    28'385     262'852         0      3'513       22'079    6'801
      'objective_lb_search_no_lp':        66'599     213'792     817'148       107'502     2'002     9'100      86'977         1      1'739       12'403    1'967
                        'probing':             0           0         920             0         0         0           0         0          0            0        0
                 'probing_max_lp':             0           0         918             0         0         0           0         0          0            0        0
                   'pseudo_costs':        46'940     176'343     722'209       249'294     1'048    21'053     178'185         2      6'346       45'338    2'723
                  'quick_restart':        28'158     114'778     432'676        81'896       957    16'803     229'895        33     11'652      121'771    2'962
            'quick_restart_no_lp':       112'746     614'137   2'082'935       888'958       743     6'686      92'227        12      5'593       69'093      393
                  'reduced_costs':        47'701     176'851     839'999       481'376       633    18'415     182'082         0      3'810       27'100    2'688

Lp stats                         Component  Iterations  AddedCuts  OPTIMAL  DUAL_F.  DUAL_U.
                  'default_lp':          1     977'450     81'711  104'149        0        5
                       'fixed':          1     131'135      2'566  361'013        0        0
                   'fs_random':          1           0          0        0        0        0
                   'fs_random':          1          65          0        1        1        0
     'fs_random_quick_restart':          1           0          0        0        0        0
     'fs_random_quick_restart':          1           0          0        0        0        0
              'lb_tree_search':          1   3'432'761     28'624   70'424   54'089        0
                      'max_lp':          1   1'367'017     47'358   53'425   65'192       48
         'objective_lb_search':          1   1'504'327     28'434   59'386        0       14
  'objective_lb_search_max_lp':          1   1'637'201     19'181   32'162   13'678       20
                     'probing':          1     494'957     24'214   13'639        1        4
              'probing_max_lp':          1     114'369     27'039    7'533      671        0
                'pseudo_costs':          1   1'222'794     80'053   61'127   74'459       20
               'quick_restart':          1   1'373'447     32'144   63'710        2        1
               'reduced_costs':          1   1'258'396     90'033   75'732   79'662       11

Lp dimension                                                                       Final dimension of first component
                  'default_lp':    885 rows, 688 columns, 3712 entries with magnitude in [6.121235e-04, 1.000000e+00]
                       'fixed':    516 rows, 688 columns, 2167 entries with magnitude in [2.013142e-02, 1.000000e+00]
                   'fs_random':         0 rows, 688 columns, 0 entries with magnitude in [0.000000e+00, 0.000000e+00]
                   'fs_random':    206 rows, 688 columns, 1049 entries with magnitude in [2.013142e-02, 1.000000e+00]
     'fs_random_quick_restart':         0 rows, 688 columns, 0 entries with magnitude in [0.000000e+00, 0.000000e+00]
     'fs_random_quick_restart':         0 rows, 688 columns, 0 entries with magnitude in [0.000000e+00, 0.000000e+00]
              'lb_tree_search':   1222 rows, 694 columns, 4115 entries with magnitude in [2.310157e-03, 1.000000e+00]
                      'max_lp':   1067 rows, 694 columns, 4322 entries with magnitude in [4.829210e-03, 1.000000e+00]
         'objective_lb_search':    849 rows, 688 columns, 3013 entries with magnitude in [1.238201e-03, 1.000000e+00]
  'objective_lb_search_max_lp':   1288 rows, 694 columns, 4401 entries with magnitude in [4.054817e-04, 1.000000e+00]
                     'probing':   1202 rows, 688 columns, 5422 entries with magnitude in [2.620988e-03, 1.000000e+00]
              'probing_max_lp':  1870 rows, 694 columns, 14338 entries with magnitude in [8.200413e-04, 1.000000e+00]
                'pseudo_costs':   1233 rows, 694 columns, 3705 entries with magnitude in [1.632959e-03, 1.000000e+00]
               'quick_restart':   1265 rows, 688 columns, 5662 entries with magnitude in [1.032282e-04, 1.000000e+00]
               'reduced_costs':    808 rows, 694 columns, 3116 entries with magnitude in [6.248294e-03, 1.000000e+00]

Lp debug                         CutPropag  CutEqPropag   Adjust  Overflow         Bad  BadScaling
                  'default_lp':         45           84   40'336         0   2'065'244           0
                       'fixed':          0            0  113'896         0      10'569           0
                   'fs_random':          0            0        0         0           0           0
                   'fs_random':          0            0        0         0           0           0
     'fs_random_quick_restart':          0            0        0         0           0           0
     'fs_random_quick_restart':          0            0        0         0           0           0
              'lb_tree_search':         77           21   84'187         0   1'752'246           0
                      'max_lp':         54           23   51'828         0   1'446'010           0
         'objective_lb_search':        169           48   26'628         0   2'086'410           0
  'objective_lb_search_max_lp':        136           15   32'140         0   1'365'392           0
                     'probing':        126          101   12'235         0  29'271'182           0
              'probing_max_lp':        134          147    8'096         0  17'724'780           0
                'pseudo_costs':        283           75   72'143         0   2'079'332           0
               'quick_restart':        270           79   34'500         0   5'318'711           0
               'reduced_costs':         68           26   74'757         0   1'718'999           0

Lp pool                          Constraints  Updates  Simplif  Merged  Shortened    Split  Strenghtened       Cuts/Call
                  'default_lp':        9'856    2'891   35'013     544      7'166   45'534        21'393  81'711/224'572
                       'fixed':        3'247       39      427       8          0       11           536     2'566/9'924
                   'fs_random':          689        0        0       0          0        0            19             0/0
                   'fs_random':          689        0        0       0          0        0            19             0/0
     'fs_random_quick_restart':          689        0        0       0          0        0            19             0/0
     'fs_random_quick_restart':          689        0        0       0          0        0            19             0/0
              'lb_tree_search':       18'009    2'952  391'136     321     33'364   24'340       176'578  28'624/106'530
                      'max_lp':       17'531    2'501  184'108     533     12'590   31'559       135'001  47'358/129'138
         'objective_lb_search':        9'895    3'055  222'932     228     19'446   43'302        25'884  28'434/111'046
  'objective_lb_search_max_lp':       17'736    2'907  464'072     151     37'303   23'186       195'319   19'181/68'787
                     'probing':        9'893    4'084  223'456      10      6'983  217'429        15'941   24'214/58'511
              'probing_max_lp':       17'719    5'301  176'437      26     21'838   66'911        95'818   27'039/68'786
                'pseudo_costs':       16'847    3'638  561'061     912     36'700   30'285       212'944  80'053/209'563
               'quick_restart':        9'695    4'640  481'025     138     15'999  297'005        32'575  32'144/127'994
               'reduced_costs':       16'742    2'784  201'504     997     11'757   30'518       145'713  90'033/224'665

Lp Cut                                                defaul  fixed  max_lp  quick_  reduce  pseudo  lb_tre  probin  object  probin  object
                                              CG_FF:   3'178    213   1'195     363   4'346   2'223     340     303     511     270     254
                                               CG_K:   2'084    149   1'036     211   3'658   1'683     337     171     303     278     165
                                              CG_KL:       -      -       -       -       1       1       -       -       -       -       1
                                               CG_R:   2'037    188     606     259   2'718   1'237     194     188     303     191     168
                                              CG_RB:   7'347    248   2'884   1'089   7'134   4'667     768     932   1'191     668     712
                                             CG_RBP:     948     30     250     128   1'156     460      55      82     125      72      33
                                             Clique:       -      -     192       -     593     527     209       -       -     146     197
                                                 IB:  23'372    759   8'397   8'167  11'898  11'666   4'515   4'926   6'844   1'492   2'293
                                           MIR_1_FF:   4'044    213   2'593   1'448   5'245   4'940   1'320   1'036   1'596     797     989
                                            MIR_1_K:     747     29     535     229   1'103   1'075     213     146     245      81     196
                                           MIR_1_KL:      97      -      45      13      53     100      10      39       2      17       -
                                            MIR_1_R:     885     68     383     212   1'064     814     128     173     298      58     115
                                           MIR_1_RB:   7'638    178   5'597   2'783  11'013  10'682   3'260   2'295   3'004   1'651   1'829
                                          MIR_1_RBP:     415     14     790     119   1'604   1'322     406      88     138     194     202
                                          MIR_1_RLT:       -      -       7       -      20       5       2       -       -       3       4
                                           MIR_2_FF:   2'736     85   1'826     890   3'546   3'260     961     548     948     474     741
                                            MIR_2_K:     562     16     338     166     687     685     120     105     193      47     157
                                           MIR_2_KL:      97      -      37      12      63      85       9      41       1       6       -
                                            MIR_2_R:     654     28     387     241     814     750     182     222     256     120     154
                                           MIR_2_RB:   4'691     80   2'911   1'847   5'791   5'859   1'613   1'479   1'729     719     996
                                          MIR_2_RBP:     395      5     407     132     964     792     158      96     122      53      95
                                           MIR_3_FF:   1'727     40   1'342     651   2'459   2'295     704     360     598     324     591
                                            MIR_3_K:     433     11     315     136     618     625     157      89     139      63     150
                                           MIR_3_KL:      90      -      23      19      46      48       9      46       1       5       -
                                            MIR_3_R:     446     14     320     203     610     664     144     121     186      78     123
                                           MIR_3_RB:   2'857     37   1'803   1'345   3'349   3'461   1'060     985   1'222     450     637
                                          MIR_3_RBP:     241      5     258      91     556     473     113      61      85      35      49
                                           MIR_4_FF:   1'015     12     827     441   1'554   1'508     531     278     435     271     410
                                            MIR_4_K:     289      9     206      97     405     395      95      69     112      25      97
                                           MIR_4_KL:      70      1      19      21      39      31       4      49       6       2       -
                                            MIR_4_R:     304      4     243     116     431     448      98      75     131      44      80
                                           MIR_4_RB:   1'821     17     987     802   1'775   1'899     622     545     651     277     329
                                          MIR_4_RBP:     162      1     131      43     304     254      75      61      47      24      24
                                           MIR_5_FF:     654      1     498     328     886     953     372     167     284     154     252
                                            MIR_5_K:     239      2     149     113     333     335      79      80      92      25      70
                                           MIR_5_KL:      43      -       7      19      37      27       3      38      10       1       2
                                            MIR_5_R:     237      -     143      91     282     288      99      43      96      32      50
                                           MIR_5_RB:   1'228      3     550     492   1'041   1'178     404     364     419     163     215
                                          MIR_5_RBP:     107      -      65      24     146     153      42      22      32      14      23
                                           MIR_6_FF:     404      3     253     149     509     563     214      88     163      68     118
                                            MIR_6_K:     145      -      80      61     183     180      51      51      68      12      39
                                           MIR_6_KL:      58      1      11      27      33      23       3      47       7       1       1
                                            MIR_6_R:     125      -      91      51     194     185      59      24      61      18      27
                                           MIR_6_RB:     637      1     284     259     586     701     215     234     215      84      97
                                          MIR_6_RBP:      65      -      46      17     119     111      20      18      13       6      10
         NoOverlapCompletionTimeExhaustive_weighted:       -      -      90       -     229     170      26       -       -      11      50
  NoOverlapCompletionTimeExhaustive_weighted_lifted:       -      -       -       -       2       -       -       -       -       -       -
                        NoOverlapDisjunctionOnStart:       -      -      64       -     113      76       6       -       -       5      12
                                       ZERO_HALF_FF:     571     31     441     146     991     853     160      97     162      70     121
                                        ZERO_HALF_K:     170      4     158      31     391     251      55      34      43      22      30
                                        ZERO_HALF_R:   4'214     32   6'036   6'698   5'530   6'558   7'506   6'239   4'586  16'653   5'643
                                       ZERO_HALF_RB:   1'205     30   1'161   1'125   2'202   2'034     705     693     637     454     524
                                      ZERO_HALF_RBP:     227      4     341     239     609     480     193     366     124     311     106

LNS stats                        Improv/Calls  Closed  Difficulty  TimeLimit
               'graph_arc_lns':       212/934     52%        1.00       0.11
               'graph_cst_lns':       217/930     53%        1.00       0.11
               'graph_dec_lns':       165/934     52%        1.00       0.11
               'graph_var_lns':       215/934     52%        1.00       0.11
                   'rins/rens':       121/870     51%        0.94       0.10
                 'rnd_cst_lns':       218/931     53%        1.00       0.11
                 'rnd_var_lns':       168/934     52%        1.00       0.11
    'scheduling_intervals_lns':       369/921     40%        0.00       0.12
  'scheduling_precedences_lns':       369/921     40%        0.00       0.12
  'scheduling_time_window_lns':       371/921     40%        0.00       0.12

LS stats                   Batches  Restarts   LinMoves   GenMoves  CompoundMoves  WeightUpdates
       'fj_long_default':        1         1      9'892          0              0            108
   'fj_long_lin_default':        1         1          0      2'255            456              0
        'fj_long_random':        1         1      9'894          0              0            106
      'fj_short_default':        1         1          0      1'859            358              0
  'fj_short_lin_default':        1         1          0      2'041            478              0
   'fj_short_lin_random':        1         1          0      1'891            375              0
       'fj_short_random':        1         1          0      2'043            412              0
          'violation_ls':      935         0  2'542'954  2'318'581        118'180        502'268
          'violation_ls':      935         0  5'023'771    962'264         46'019        172'172

Solutions (50)                   Num     Rank
                  'default_lp':    1  [15,15]
             'fs_random_no_lp':    1    [1,1]
               'graph_arc_lns':    1  [30,30]
               'graph_cst_lns':    1  [43,43]
               'graph_dec_lns':    1  [27,27]
               'graph_var_lns':    2  [29,46]
                       'no_lp':   11   [7,18]
         'quick_restart_no_lp':    8   [2,41]
                 'rins_lp_lns':    4  [19,50]
                 'rnd_cst_lns':    1  [49,49]
                 'rnd_var_lns':    2   [5,42]
    'scheduling_intervals_lns':    1  [21,21]
  'scheduling_time_window_lns':    1  [20,20]
                'violation_ls':   15   [4,48]

Objective bounds                 Num
              'initial_domain':    1
              'lb_tree_search':   77
         'objective_lb_search':   69
  'objective_lb_search_max_lp':   29
   'objective_lb_search_no_lp':   33

Solution repositories     Added  Queried  Ignored  Synchro
  'feasible solutions':   6'832   21'251        4    6'615
        'lp solutions':   2'432      472        0    2'173
                'pump':  18'498      463

Improving bounds shared            Num
                        'core':      2
                  'default_lp':    692
             'fs_random_no_lp':    103
              'lb_tree_search':    296
                      'max_lp':    307
                       'no_lp':    298
         'objective_lb_search':    499
  'objective_lb_search_max_lp':    493
   'objective_lb_search_no_lp':    674
                     'probing':  3'848
              'probing_max_lp':  1'677
                'pseudo_costs':  2'262
               'quick_restart':  1'115
         'quick_restart_no_lp':  6'360
               'reduced_costs':    444

Clauses shared                   Num
                        'core':    7
                  'default_lp':   18
              'lb_tree_search':   39
                      'max_lp':   17
                       'no_lp':   32
         'objective_lb_search':   72
  'objective_lb_search_max_lp':   91
   'objective_lb_search_no_lp':  113
                'pseudo_costs':   80
               'quick_restart':   11
         'quick_restart_no_lp':   26
               'reduced_costs':   14

CpSolverResponse summary:
status: OPTIMAL
objective: 1909
best_bound: 1909
integers: 690
booleans: 173
conflicts: 2
branches: 336
propagations: 131
integer_propagations: 23046
restarts: 261
lp_iterations: 0
walltime: 400.763
usertime: 400.763
deterministic_time: 3334.27
gap_integral: 8381.76
solution_fingerprint: 0x977643dc6d61598c


--- Simulation Gantt  partir du modle mathmatique ---
