created virtual environment CPython3.12.4.final.0-64 in 10464ms
  creator CPython3Posix(dest=/localscratch/aneumann.63390845.0/env, clear=False, no_vcs_ignore=False, global=False)
  seeder FromAppData(download=False, pip=bundle, via=copy, app_data_dir=/home/aneumann/.local/share/virtualenv)
    added seed packages: pip==25.1.1
  activators BashActivator,CShellActivator,FishActivator,NushellActivator,PowerShellActivator,PythonActivator
Looking in links: /cvmfs/soft.computecanada.ca/custom/python/wheelhouse/gentoo2023/x86-64-v3, /cvmfs/soft.computecanada.ca/custom/python/wheelhouse/gentoo2023/generic, /cvmfs/soft.computecanada.ca/custom/python/wheelhouse/generic
Requirement already satisfied: pip in /localscratch/aneumann.63390845.0/env/lib/python3.12/site-packages (25.1.1)
Looking in links: /cvmfs/soft.computecanada.ca/custom/python/wheelhouse/gentoo2023/x86-64-v3, /cvmfs/soft.computecanada.ca/custom/python/wheelhouse/gentoo2023/generic, /cvmfs/soft.computecanada.ca/custom/python/wheelhouse/generic
ERROR: protobuf-5.28.3-cp38-abi3-manylinux2014_x86_64.whl is not a supported wheel on this platform.
Looking in links: /cvmfs/soft.computecanada.ca/custom/python/wheelhouse/gentoo2023/x86-64-v3, /cvmfs/soft.computecanada.ca/custom/python/wheelhouse/gentoo2023/generic, /cvmfs/soft.computecanada.ca/custom/python/wheelhouse/generic
Processing /home/aneumann/projects/def-adhaj/aneumann/GNRS/wheels/immutabledict-4.2.0-py3-none-any.whl
Installing collected packages: immutabledict
Successfully installed immutabledict-4.2.0
Looking in links: /cvmfs/soft.computecanada.ca/custom/python/wheelhouse/gentoo2023/x86-64-v3, /cvmfs/soft.computecanada.ca/custom/python/wheelhouse/gentoo2023/generic, /cvmfs/soft.computecanada.ca/custom/python/wheelhouse/generic
Processing /cvmfs/soft.computecanada.ca/custom/python/wheelhouse/generic/ortools-9.10.4067+computecanada-cp312-cp312-linux_x86_64.whl (from -r /home/aneumann/projects/def-adhaj/aneumann/GNRS/requirements/or.txt (line 1))
Processing /cvmfs/soft.computecanada.ca/custom/python/wheelhouse/gentoo2023/x86-64-v3/matplotlib-3.10.0+computecanada-cp312-cp312-linux_x86_64.whl (from -r /home/aneumann/projects/def-adhaj/aneumann/GNRS/requirements/or.txt (line 2))
Processing /cvmfs/soft.computecanada.ca/custom/python/wheelhouse/gentoo2023/x86-64-v3/pandas-2.2.3+computecanada-cp312-cp312-linux_x86_64.whl (from -r /home/aneumann/projects/def-adhaj/aneumann/GNRS/requirements/or.txt (line 3))
Processing /cvmfs/soft.computecanada.ca/custom/python/wheelhouse/generic/absl_py-2.2.2+computecanada-py3-none-any.whl (from ortools<9.11,>=9.10->-r /home/aneumann/projects/def-adhaj/aneumann/GNRS/requirements/or.txt (line 1))
Processing /cvmfs/soft.computecanada.ca/custom/python/wheelhouse/gentoo2023/generic/numpy-2.2.2+computecanada-cp312-cp312-linux_x86_64.whl (from ortools<9.11,>=9.10->-r /home/aneumann/projects/def-adhaj/aneumann/GNRS/requirements/or.txt (line 1))
Processing /cvmfs/soft.computecanada.ca/custom/python/wheelhouse/gentoo2023/x86-64-v3/protobuf-6.30.2+computecanada-cp312-cp312-linux_x86_64.whl (from ortools<9.11,>=9.10->-r /home/aneumann/projects/def-adhaj/aneumann/GNRS/requirements/or.txt (line 1))
Requirement already satisfied: immutabledict>=3.0.0 in /localscratch/aneumann.63390845.0/env/lib/python3.12/site-packages (from ortools<9.11,>=9.10->-r /home/aneumann/projects/def-adhaj/aneumann/GNRS/requirements/or.txt (line 1)) (4.2.0)
Processing /cvmfs/soft.computecanada.ca/custom/python/wheelhouse/gentoo2023/generic/contourpy-1.3.1+computecanada-cp312-cp312-linux_x86_64.whl (from matplotlib->-r /home/aneumann/projects/def-adhaj/aneumann/GNRS/requirements/or.txt (line 2))
Processing /cvmfs/soft.computecanada.ca/custom/python/wheelhouse/generic/cycler-0.12.1+computecanada-py3-none-any.whl (from matplotlib->-r /home/aneumann/projects/def-adhaj/aneumann/GNRS/requirements/or.txt (line 2))
Processing /cvmfs/soft.computecanada.ca/custom/python/wheelhouse/generic/fonttools-4.58.2+computecanada-cp312-cp312-linux_x86_64.whl (from matplotlib->-r /home/aneumann/projects/def-adhaj/aneumann/GNRS/requirements/or.txt (line 2))
Processing /cvmfs/soft.computecanada.ca/custom/python/wheelhouse/gentoo2023/x86-64-v3/kiwisolver-1.4.8+computecanada-cp312-cp312-linux_x86_64.whl (from matplotlib->-r /home/aneumann/projects/def-adhaj/aneumann/GNRS/requirements/or.txt (line 2))
Processing /cvmfs/soft.computecanada.ca/custom/python/wheelhouse/generic/packaging-25.0+computecanada-py3-none-any.whl (from matplotlib->-r /home/aneumann/projects/def-adhaj/aneumann/GNRS/requirements/or.txt (line 2))
Processing /cvmfs/soft.computecanada.ca/custom/python/wheelhouse/gentoo2023/x86-64-v3/pillow-11.1.0+computecanada-cp312-cp312-linux_x86_64.whl (from matplotlib->-r /home/aneumann/projects/def-adhaj/aneumann/GNRS/requirements/or.txt (line 2))
Processing /cvmfs/soft.computecanada.ca/custom/python/wheelhouse/generic/pyparsing-3.2.1+computecanada-py3-none-any.whl (from matplotlib->-r /home/aneumann/projects/def-adhaj/aneumann/GNRS/requirements/or.txt (line 2))
Processing /cvmfs/soft.computecanada.ca/custom/python/wheelhouse/generic/python_dateutil-2.9.0.post0+computecanada-py2.py3-none-any.whl (from matplotlib->-r /home/aneumann/projects/def-adhaj/aneumann/GNRS/requirements/or.txt (line 2))
Processing /cvmfs/soft.computecanada.ca/custom/python/wheelhouse/generic/pytz-2025.2+computecanada-py2.py3-none-any.whl (from pandas->-r /home/aneumann/projects/def-adhaj/aneumann/GNRS/requirements/or.txt (line 3))
Processing /cvmfs/soft.computecanada.ca/custom/python/wheelhouse/generic/tzdata-2025.2+computecanada-py2.py3-none-any.whl (from pandas->-r /home/aneumann/projects/def-adhaj/aneumann/GNRS/requirements/or.txt (line 3))
Processing /cvmfs/soft.computecanada.ca/custom/python/wheelhouse/generic/six-1.17.0+computecanada-py2.py3-none-any.whl (from python-dateutil>=2.7->matplotlib->-r /home/aneumann/projects/def-adhaj/aneumann/GNRS/requirements/or.txt (line 2))
Installing collected packages: pytz, tzdata, six, pyparsing, protobuf, pillow, packaging, numpy, kiwisolver, fonttools, cycler, absl-py, python-dateutil, contourpy, pandas, matplotlib, ortools

Successfully installed absl-py-2.2.2+computecanada contourpy-1.3.1+computecanada cycler-0.12.1+computecanada fonttools-4.58.2+computecanada kiwisolver-1.4.8+computecanada matplotlib-3.10.0+computecanada numpy-2.2.2+computecanada ortools-9.10.4067+computecanada packaging-25.0+computecanada pandas-2.2.3+computecanada pillow-11.1.0+computecanada protobuf-6.30.2+computecanada pyparsing-3.2.1+computecanada python-dateutil-2.9.0.post0+computecanada pytz-2025.2+computecanada six-1.17.0+computecanada tzdata-2025.2+computecanada

Starting CP-SAT solver v9.10.4067
Parameters: max_time_in_seconds: 3600 max_memory_in_mb: 12000 log_search_progress: true enumerate_all_solutions: false absolute_gap_limit: 0 relative_gap_limit: 0
Setting number of workers to 48

Initial optimization model '': (model_fingerprint: 0x4f4d7be964cfdfb1)
#Variables: 189 (#ints: 6 in objective)
  - 126 Booleans in [0,1]
  - 63 in [0,394]
#kLinear1: 21
#kLinear2: 254
#kLinear3: 95
#kLinearN: 868 (#terms: 8'879)

Starting presolve at 0.00s
  3.50e-04s  0.00e+00d  [DetectDominanceRelations] 
  1.18e-02s  0.00e+00d  [PresolveToFixPoint] #num_loops=6 #num_dual_strengthening=3 
  1.98e-05s  0.00e+00d  [ExtractEncodingFromLinear] #potential_supersets=3 
[Symmetry] Graph for symmetry has 1'147 nodes and 5'205 arcs.
[Symmetry] Symmetry computation done. time: 0.0005975 dtime: 0.00047611
[SAT presolve] num removable Booleans: 0 / 48
[SAT presolve] num trivial clauses: 0
[SAT presolve] [0s] clauses:8 literals:23 vars:16 one_side_vars:15 simple_definition:1 singleton_clauses:0
[SAT presolve] [3.9156e-05s] clauses:8 literals:23 vars:16 one_side_vars:15 simple_definition:1 singleton_clauses:0
[SAT presolve] [5.8329e-05s] clauses:8 literals:23 vars:16 one_side_vars:15 simple_definition:1 singleton_clauses:0
  2.99e-03s  3.27e-04d  [Probe] #probed=210 #fixed_bools=3 #new_bounds=6 #new_binary_clauses=10 
  2.73e-05s  0.00e+00d  [MaxClique] 
  3.32e-04s  0.00e+00d  [DetectDominanceRelations] 
  4.30e-03s  0.00e+00d  [PresolveToFixPoint] #num_loops=4 #num_dual_strengthening=3 
  1.19e-03s  0.00e+00d  [ProcessAtMostOneAndLinear] 
  8.39e-04s  0.00e+00d  [DetectDuplicateConstraints] #duplicates=172 #without_enforcements=57 
  3.04e-04s  1.19e-05d  [DetectDominatedLinearConstraints] #relevant_constraints=460 #num_inclusions=173 #num_redundant=3 
  1.49e-04s  0.00e+00d  [DetectDifferentVariables] #different=24 #cliques=1 #size=3 
  1.22e-04s  4.11e-06d  [ProcessSetPPC] #relevant_constraints=290 
  1.33e-05s  0.00e+00d  [FindAlmostIdenticalLinearConstraints] 
  8.30e-05s  4.80e-05d  [FindBigAtMostOneAndLinearOverlap] 
  6.01e-04s  2.58e-04d  [FindBigVerticalLinearOverlap] #blocks=1 #saved_nz=65 
  6.04e-05s  1.27e-05d  [FindBigHorizontalLinearOverlap] #linears=277 
  2.21e-05s  1.05e-07d  [MergeClauses] 
  4.18e-04s  0.00e+00d  [DetectDominanceRelations] 
  2.79e-03s  0.00e+00d  [PresolveToFixPoint] #num_loops=2 #num_dual_strengthening=1 
  4.17e-04s  0.00e+00d  [DetectDominanceRelations] 
  2.61e-03s  0.00e+00d  [PresolveToFixPoint] #num_loops=1 #num_dual_strengthening=1 
[SAT presolve] num removable Booleans: 0 / 45
[SAT presolve] num trivial clauses: 0
[SAT presolve] [0s] clauses:8 literals:23 vars:16 one_side_vars:15 simple_definition:1 singleton_clauses:0
[SAT presolve] [3.4849e-05s] clauses:8 literals:23 vars:16 one_side_vars:15 simple_definition:1 singleton_clauses:0
[SAT presolve] [4.8236e-05s] clauses:8 literals:23 vars:16 one_side_vars:15 simple_definition:1 singleton_clauses:0
  2.56e-03s  2.99e-04d  [Probe] #probed=198 #new_bounds=11 #new_binary_clauses=10 
  1.79e-05s  0.00e+00d  [MaxClique] 
  4.20e-04s  0.00e+00d  [DetectDominanceRelations] 
  4.60e-03s  0.00e+00d  [PresolveToFixPoint] #num_loops=4 #num_dual_strengthening=3 
  1.06e-03s  0.00e+00d  [ProcessAtMostOneAndLinear] 
  6.58e-04s  0.00e+00d  [DetectDuplicateConstraints] #without_enforcements=57 
  2.27e-04s  9.65e-06d  [DetectDominatedLinearConstraints] #relevant_constraints=402 #num_inclusions=41 
  6.87e-05s  0.00e+00d  [DetectDifferentVariables] 
  1.22e-04s  4.07e-06d  [ProcessSetPPC] #relevant_constraints=286 
  1.28e-05s  0.00e+00d  [FindAlmostIdenticalLinearConstraints] 
  7.00e-05s  4.67e-05d  [FindBigAtMostOneAndLinearOverlap] 
  7.29e-04s  2.60e-04d  [FindBigVerticalLinearOverlap] #blocks=4 #saved_nz=200 
  6.76e-05s  1.16e-05d  [FindBigHorizontalLinearOverlap] #linears=277 
  1.96e-05s  1.05e-07d  [MergeClauses] 
  4.20e-04s  0.00e+00d  [DetectDominanceRelations] 
  3.73e-03s  0.00e+00d  [PresolveToFixPoint] #num_loops=2 #num_dual_strengthening=1 
  4.19e-04s  0.00e+00d  [DetectDominanceRelations] 
  2.85e-03s  0.00e+00d  [PresolveToFixPoint] #num_loops=1 #num_dual_strengthening=1 
[SAT presolve] num removable Booleans: 0 / 45
[SAT presolve] num trivial clauses: 0
[SAT presolve] [0s] clauses:8 literals:23 vars:16 one_side_vars:15 simple_definition:1 singleton_clauses:0
[SAT presolve] [3.4243e-05s] clauses:8 literals:23 vars:16 one_side_vars:15 simple_definition:1 singleton_clauses:0
[SAT presolve] [5.4232e-05s] clauses:8 literals:23 vars:16 one_side_vars:15 simple_definition:1 singleton_clauses:0
  2.54e-03s  2.92e-04d  [Probe] #probed=198 #new_bounds=3 #new_binary_clauses=10 
  1.79e-05s  0.00e+00d  [MaxClique] 
  4.21e-04s  0.00e+00d  [DetectDominanceRelations] 
  3.59e-03s  0.00e+00d  [PresolveToFixPoint] #num_loops=2 #num_dual_strengthening=1 
  9.70e-04s  0.00e+00d  [ProcessAtMostOneAndLinear] 
  6.64e-04s  0.00e+00d  [DetectDuplicateConstraints] #without_enforcements=77 
  2.10e-04s  8.20e-06d  [DetectDominatedLinearConstraints] #relevant_constraints=370 #num_inclusions=41 
  6.71e-05s  0.00e+00d  [DetectDifferentVariables] 
  1.08e-04s  3.30e-06d  [ProcessSetPPC] #relevant_constraints=250 
  1.38e-05s  0.00e+00d  [FindAlmostIdenticalLinearConstraints] 
  6.71e-05s  4.22e-05d  [FindBigAtMostOneAndLinearOverlap] 
  7.49e-04s  2.41e-04d  [FindBigVerticalLinearOverlap] #blocks=5 #saved_nz=219 
  5.53e-05s  9.15e-06d  [FindBigHorizontalLinearOverlap] #linears=238 
  1.91e-05s  1.05e-07d  [MergeClauses] 
  3.21e-04s  0.00e+00d  [DetectDominanceRelations] 
  3.85e-03s  0.00e+00d  [PresolveToFixPoint] #num_loops=2 #num_dual_strengthening=1 
  3.26e-05s  0.00e+00d  [ExpandObjective] #entries=50 #tight_variables=25 #tight_constraints=13 

Presolve summary:
  - 33 affine relations were detected.
  - rule 'TODO dual: only one blocking constraint?' was applied 500 times.
  - rule 'TODO dual: only one unspecified blocking constraint?' was applied 90 times.
  - rule 'TODO duplicate: identical constraint with different enforcements' was applied 191 times.
  - rule 'TODO linear2: contains a Boolean.' was applied 71 times.
  - rule 'TODO no_overlap: with task always last' was applied 1 time.
  - rule 'affine: new relation' was applied 33 times.
  - rule 'all_diff: inferred from x != y constraints' was applied 1 time.
  - rule 'at_most_one: removed literals' was applied 2 times.
  - rule 'at_most_one: size one' was applied 2 times.
  - rule 'bool_or: always true' was applied 3 times.
  - rule 'bool_or: implications' was applied 2 times.
  - rule 'deductions: 113 stored' was applied 1 time.
  - rule 'dual: fix variable' was applied 12 times.
  - rule 'dual: reduced domain' was applied 44 times.
  - rule 'duplicate: merged rhs of linear constraint' was applied 33 times.
  - rule 'duplicate: removed constraint' was applied 172 times.
  - rule 'enforcement: false literal' was applied 14 times.
  - rule 'enforcement: true literal' was applied 12 times.
  - rule 'incompatible linear: add implication' was applied 27 times.
  - rule 'linear inclusion: redundant containing constraint' was applied 2 times.
  - rule 'linear inclusion: redundant included constraint' was applied 1 time.
  - rule 'linear matrix: common vertical rectangle' was applied 10 times.
  - rule 'linear1: always true' was applied 2 times.
  - rule 'linear2: contains a Boolean.' was applied 16 times.
  - rule 'linear: always true' was applied 368 times.
  - rule 'linear: doubleton free' was applied 7 times.
  - rule 'linear: empty' was applied 20 times.
  - rule 'linear: extracted enforcement literal' was applied 1'516 times.
  - rule 'linear: fixed or dup variables' was applied 860 times.
  - rule 'linear: negative clause' was applied 11 times.
  - rule 'linear: positive clause' was applied 1 time.
  - rule 'linear: positive equal one' was applied 3 times.
  - rule 'linear: reduced variable domains' was applied 80 times.
  - rule 'linear: remapped using affine relations' was applied 774 times.
  - rule 'linear: simplified rhs' was applied 2'438 times.
  - rule 'linear: variable substitution 1' was applied 7 times.
  - rule 'presolve: 57 unused variables removed.' was applied 1 time.
  - rule 'presolve: iteration' was applied 3 times.
  - rule 'probing: reduced enforced constraint to implication.' was applied 2 times.

Presolved optimization model '': (model_fingerprint: 0xb44a7f60aaab5028)
#Variables: 102 (#ints: 6 in objective)
  - 45 Booleans in [0,1]
  - 1 in [-371,-25][23,369][417,705]
  - 1 in [0,240]
  - 2 in [0,276]
  - 2 in [0,279]
  - 1 in [0,291]
  - 1 in [0,298]
  - 1 in [0,301]
  - 1 in [0,312]
  - 4 in [0,313]
  - 3 in [0,336]
  - 3 in [0,346]
  - 1 in [3,339]
  - 1 in [3,339][397,733]
  - 1 in [3,339][397,733][791,1127]
  - 1 in [3,339][397,733][791,1127][1185,1521]
  - 1 in [3,349]
  - 1 in [4,339]
  - 1 in [4,342]
  - 1 in [5,332]
  - 1 in [7,334]
  - 1 in [10,337]
  - 1 in [23,369]
  - 1 in [23,369][417,763]
  - 1 in [27,340]
  - 1 in [30,340][421,734]
  - 1 in [30,340][421,734][815,1070]
  - 1 in [36,374]
  - 1 in [36,374][430,686]
  - 1 in [36,374][430,768][824,1080]
  - 2 in [71,383]
  - 1 in [77,389]
  - 3 in [82,383]
  - 3 in [85,383]
  - 1 in [88,389]
  - 1 in [91,389]
  - 2 in [92,383]
  - 1 in [98,389]
  - 3 in [107,383]
  - 1 in [113,389]
  - 1 in [118,394]
#kAllDiff: 1
#kBoolAnd: 1 (#enforced: 1) (#literals: 2)
#kBoolOr: 7 (#literals: 21)
#kExactlyOne: 3 (#literals: 9)
#kLinear1: 14 (#enforced: 14 #multi: 6)
#kLinear2: 269 (#enforced: 233 #multi: 191)
#kLinear3: 89 (#enforced: 72 #multi: 41)
#kLinearN: 240 (#enforced: 203) (#terms: 1'810)

Preloading model.
#Bound   0.06s best:inf   next:[118,1836] initial_domain
#Model   0.06s var:102/102 constraints:624/624

Starting search at 0.07s with 48 workers.
16 full problem subsolvers: [core, default_lp, lb_tree_search, max_lp, no_lp, objective_lb_search, objective_lb_search_max_lp, objective_lb_search_no_lp, objective_shaving_search_max_lp, objective_shaving_search_no_lp, probing, probing_max_lp, pseudo_costs, quick_restart, quick_restart_no_lp, reduced_costs]
30 first solution subsolvers: [fj_long_default(2), fj_long_lin_default, fj_long_lin_perturb, fj_long_lin_random, fj_long_perturb, fj_long_random, fj_short_default(2), fj_short_lin_default(2), fj_short_lin_perturb, fj_short_lin_random, fj_short_perturb, fj_short_random, fs_random(4), fs_random_no_lp(4), fs_random_quick_restart(4), fs_random_quick_restart_no_lp(3)]
13 incomplete subsolvers: [feasibility_pump, graph_arc_lns, graph_cst_lns, graph_dec_lns, graph_var_lns, rins/rens, rnd_cst_lns, rnd_var_lns, violation_ls(5)]
3 helper subsolvers: [neighborhood_helper, synchronization_agent, update_gap_integral]
#Bound   0.07s best:inf   next:[119,1836] bool_core (num_cores=1 [size:1 mw:1] a=6 d=0 fixed=0/65 clauses=16)
#1       0.07s best:823   next:[119,822]  no_lp (fixed_bools=0/81)
#Bound   0.07s best:823   next:[128,822]  objective_lb_search_no_lp
#Bound   0.07s best:823   next:[146,822]  default_lp
#2       0.07s best:822   next:[146,821]  violation_ls(batch:1 #solutions_imported:1 #lin_moves:11 #lin_evals:49 #weight_updates:7)
#3       0.07s best:821   next:[146,820]  violation_ls(batch:1 #solutions_imported:1 #lin_moves:0 #lin_evals:3 #gen_moves:2 #gen_evals:0 #comp_moves:2 #backtracks:0 #weight_updates:0)
#4       0.08s best:820   next:[146,819]  graph_var_lns (d=0.50 s=24 t=0.10 p=0.00 stall=0 h=auto_l0) [presolve]
#5       0.08s best:798   next:[146,797]  no_lp (fixed_bools=0/87)
#Bound   0.08s best:798   next:[150,797]  quick_restart
#6       0.08s best:778   next:[150,777]  no_lp (fixed_bools=0/94)
#7       0.08s best:777   next:[150,776]  violation_ls(batch:2 #solutions_imported:2 #lin_moves:0 #lin_evals:255 #gen_moves:154 #gen_evals:16 #comp_moves:12 #backtracks:71 #weight_updates:1)
#8       0.08s best:648   next:[150,647]  no_lp (fixed_bools=0/103)
#Bound   0.08s best:648   next:[151,647]  bool_core (num_cores=4 [cover] a=4 d=1 fixed=30/157 clauses=337)
#Bound   0.08s best:648   next:[152,647]  bool_core (num_cores=4 [cover] a=4 d=1 fixed=31/160 clauses=344)
#Bound   0.08s best:648   next:[153,647]  bool_core (num_cores=4 [cover] a=4 d=1 fixed=32/163 clauses=352)
#Bound   0.08s best:648   next:[154,647]  bool_core (num_cores=4 [cover] a=4 d=1 fixed=33/166 clauses=361)
#Bound   0.08s best:648   next:[155,647]  bool_core (num_cores=4 [cover] a=4 d=1 fixed=34/169 clauses=371)
#Bound   0.08s best:648   next:[156,647]  bool_core (num_cores=4 [cover] a=4 d=1 fixed=35/172 clauses=382)
#9       0.08s best:647   next:[156,646]  violation_ls(batch:2 #solutions_imported:2 #lin_moves:12 #lin_evals:260 #gen_moves:114 #gen_evals:13 #comp_moves:10 #backtracks:52 #weight_updates:12)
#Bound   0.08s best:647   next:[157,646]  bool_core (num_cores=4 [cover] a=4 d=1 fixed=36/175 clauses=394)
#Bound   0.08s best:647   next:[158,646]  bool_core (num_cores=4 [cover] a=4 d=1 fixed=37/178 clauses=407)
#10      0.08s best:646   next:[158,645]  violation_ls(batch:2 #solutions_imported:2 #lin_moves:2 #lin_evals:38 #gen_moves:18 #gen_evals:2 #comp_moves:6 #backtracks:6 #weight_updates:1)
#Bound   0.08s best:646   next:[159,645]  bool_core (num_cores=4 [cover] a=4 d=1 fixed=38/181 clauses=421)
#Bound   0.08s best:646   next:[160,645]  bool_core (num_cores=4 [cover] a=4 d=1 fixed=39/184 clauses=436)
#Bound   0.08s best:646   next:[161,645]  bool_core (num_cores=4 [cover] a=4 d=1 fixed=40/187 clauses=452)
#Bound   0.08s best:646   next:[162,645]  bool_core (num_cores=4 [cover] a=4 d=1 fixed=41/190 clauses=469)
#Bound   0.08s best:646   next:[163,645]  bool_core (num_cores=4 [cover] a=4 d=1 fixed=42/193 clauses=487)
#Bound   0.08s best:646   next:[164,645]  bool_core (num_cores=4 [cover] a=4 d=1 fixed=43/196 clauses=506)
#Bound   0.08s best:646   next:[165,645]  bool_core (num_cores=4 [cover] a=4 d=1 fixed=44/199 clauses=526)
#Bound   0.08s best:646   next:[166,645]  bool_core (num_cores=4 [cover] a=4 d=1 fixed=45/202 clauses=547)
#11      0.09s best:645   next:[175,644]  violation_ls(batch:2 #solutions_imported:2 #lin_moves:5 #lin_evals:28 #gen_moves:2 #gen_evals:0 #comp_moves:2 #backtracks:0 #weight_updates:4)
#12      0.09s best:641   next:[175,640]  rnd_var_lns (d=0.71 s=38 t=0.10 p=1.00 stall=1 h=auto_l0) [presolve]
#13      0.09s best:627   next:[176,626]  quick_restart_no_lp (fixed_bools=0/103)
#14      0.09s best:609   next:[180,608]  quick_restart_no_lp (fixed_bools=0/140)
#15      0.09s best:600   next:[180,599]  no_lp (fixed_bools=0/126)
#16      0.09s best:435   next:[180,434]  quick_restart_no_lp (fixed_bools=0/147)
#17      0.10s best:434   next:[183,433]  quick_restart_no_lp (fixed_bools=0/158)
#18      0.10s best:433   next:[188,432]  quick_restart_no_lp (fixed_bools=0/161)
#19      0.12s best:432   next:[258,431]  graph_dec_lns (d=0.81 s=58 t=0.10 p=1.00 stall=1 h=auto_l0)
#20      0.13s best:431   next:[308,430]  violation_ls(batch:4 #solutions_imported:4 #lin_moves:32 #lin_evals:2'258 #gen_moves:990 #gen_evals:289 #comp_moves:30 #backtracks:480 #weight_updates:28)
#21      0.23s best:425   next:[371,424]  quick_restart_no_lp (fixed_bools=3/209)
#22      0.23s best:424   next:[371,423]  quick_restart_no_lp (fixed_bools=3/210)
#23      0.23s best:423   next:[371,422]  quick_restart_no_lp (fixed_bools=3/213)
#24      0.24s best:422   next:[371,421]  quick_restart_no_lp (fixed_bools=3/220)
#25      0.24s best:421   next:[371,420]  violation_ls(batch:5 #solutions_imported:5 #lin_moves:9'192 #lin_evals:53'962 #gen_moves:4'183 #gen_evals:887 #comp_moves:169 #backtracks:2'007 #weight_updates:840)
#26      0.24s best:420   next:[371,419]  violation_ls(batch:6 #solutions_imported:6 #lin_moves:9'192 #lin_evals:53'965 #gen_moves:4'184 #gen_evals:887 #comp_moves:170 #backtracks:2'007 #weight_updates:840)
#27      0.24s best:419   next:[371,418]  violation_ls(batch:7 #solutions_imported:7 #lin_moves:9'198 #lin_evals:53'996 #gen_moves:4'184 #gen_evals:887 #comp_moves:170 #backtracks:2'007 #weight_updates:845)
#28      0.24s best:417   next:[371,416]  violation_ls(batch:8 #solutions_imported:8 #lin_moves:9'199 #lin_evals:54'002 #gen_moves:4'184 #gen_evals:887 #comp_moves:170 #backtracks:2'007 #weight_updates:845)
#29      0.24s best:412   next:[371,411]  quick_restart_no_lp (fixed_bools=3/226)
#30      0.25s best:410   next:[371,409]  violation_ls(batch:5 #solutions_imported:5 #lin_moves:2 #lin_evals:23'264 #gen_moves:12'947 #gen_evals:2'674 #comp_moves:294 #backtracks:6'325 #weight_updates:107)
#31      0.25s best:408   next:[371,407]  violation_ls(batch:6 #solutions_imported:6 #lin_moves:2 #lin_evals:23'268 #gen_moves:12'948 #gen_evals:2'674 #comp_moves:295 #backtracks:6'325 #weight_updates:107)
#32      0.25s best:406   next:[371,405]  violation_ls(batch:7 #solutions_imported:7 #lin_moves:9'204 #lin_evals:48'754 #gen_moves:990 #gen_evals:289 #comp_moves:30 #backtracks:480 #weight_updates:858)
#33      0.25s best:405   next:[371,404]  violation_ls(batch:7 #solutions_imported:7 #lin_moves:8 #lin_evals:23'297 #gen_moves:12'948 #gen_evals:2'674 #comp_moves:295 #backtracks:6'325 #weight_updates:111)
#34      0.25s best:404   next:[371,403]  violation_ls(batch:8 #solutions_imported:8 #lin_moves:9'205 #lin_evals:48'760 #gen_moves:990 #gen_evals:289 #comp_moves:30 #backtracks:480 #weight_updates:858)
#Model   0.29s var:101/102 constraints:543/624
#Model   0.31s var:98/102 constraints:479/624
#Done    0.32s no_lp
#Done    0.32s objective_lb_search_no_lp
#Model   0.33s var:88/102 constraints:298/624
#Done    0.33s core
#Bound   0.32s best:404   next:[398,403]  objective_lb_search_no_lp [skipped_logs=75]

Task timing                                  n [     min,      max]      avg      dev     time         n [     min,      max]      avg      dev    dtime
                             'core':         1 [258.73ms, 258.73ms] 258.73ms   0.00ns 258.73ms         1 [177.30ms, 177.30ms] 177.30ms   0.00ns 177.30ms
                       'default_lp':         1 [258.57ms, 258.57ms] 258.57ms   0.00ns 258.57ms         1 [ 30.15ms,  30.15ms]  30.15ms   0.00ns  30.15ms
                 'feasibility_pump':        11 [  1.06ms,  19.90ms]  15.27ms   4.61ms 167.96ms        10 [  1.98ms,   2.77ms]   2.12ms 222.29us  21.17ms
                  'fj_long_default':         0 [  0.00ns,   0.00ns]   0.00ns   0.00ns   0.00ns         0 [  0.00ns,   0.00ns]   0.00ns   0.00ns   0.00ns
                  'fj_long_default':         0 [  0.00ns,   0.00ns]   0.00ns   0.00ns   0.00ns         0 [  0.00ns,   0.00ns]   0.00ns   0.00ns   0.00ns
              'fj_long_lin_default':         0 [  0.00ns,   0.00ns]   0.00ns   0.00ns   0.00ns         0 [  0.00ns,   0.00ns]   0.00ns   0.00ns   0.00ns
              'fj_long_lin_perturb':         0 [  0.00ns,   0.00ns]   0.00ns   0.00ns   0.00ns         0 [  0.00ns,   0.00ns]   0.00ns   0.00ns   0.00ns
               'fj_long_lin_random':         0 [  0.00ns,   0.00ns]   0.00ns   0.00ns   0.00ns         0 [  0.00ns,   0.00ns]   0.00ns   0.00ns   0.00ns
                  'fj_long_perturb':         0 [  0.00ns,   0.00ns]   0.00ns   0.00ns   0.00ns         0 [  0.00ns,   0.00ns]   0.00ns   0.00ns   0.00ns
                   'fj_long_random':         0 [  0.00ns,   0.00ns]   0.00ns   0.00ns   0.00ns         0 [  0.00ns,   0.00ns]   0.00ns   0.00ns   0.00ns
                 'fj_short_default':         0 [  0.00ns,   0.00ns]   0.00ns   0.00ns   0.00ns         0 [  0.00ns,   0.00ns]   0.00ns   0.00ns   0.00ns
                 'fj_short_default':         0 [  0.00ns,   0.00ns]   0.00ns   0.00ns   0.00ns         0 [  0.00ns,   0.00ns]   0.00ns   0.00ns   0.00ns
             'fj_short_lin_default':         0 [  0.00ns,   0.00ns]   0.00ns   0.00ns   0.00ns         0 [  0.00ns,   0.00ns]   0.00ns   0.00ns   0.00ns
             'fj_short_lin_default':         0 [  0.00ns,   0.00ns]   0.00ns   0.00ns   0.00ns         0 [  0.00ns,   0.00ns]   0.00ns   0.00ns   0.00ns
             'fj_short_lin_perturb':         0 [  0.00ns,   0.00ns]   0.00ns   0.00ns   0.00ns         0 [  0.00ns,   0.00ns]   0.00ns   0.00ns   0.00ns
              'fj_short_lin_random':         0 [  0.00ns,   0.00ns]   0.00ns   0.00ns   0.00ns         0 [  0.00ns,   0.00ns]   0.00ns   0.00ns   0.00ns
                 'fj_short_perturb':         0 [  0.00ns,   0.00ns]   0.00ns   0.00ns   0.00ns         0 [  0.00ns,   0.00ns]   0.00ns   0.00ns   0.00ns
                  'fj_short_random':         0 [  0.00ns,   0.00ns]   0.00ns   0.00ns   0.00ns         0 [  0.00ns,   0.00ns]   0.00ns   0.00ns   0.00ns
                        'fs_random':         0 [  0.00ns,   0.00ns]   0.00ns   0.00ns   0.00ns         0 [  0.00ns,   0.00ns]   0.00ns   0.00ns   0.00ns
                        'fs_random':         0 [  0.00ns,   0.00ns]   0.00ns   0.00ns   0.00ns         0 [  0.00ns,   0.00ns]   0.00ns   0.00ns   0.00ns
                        'fs_random':         0 [  0.00ns,   0.00ns]   0.00ns   0.00ns   0.00ns         0 [  0.00ns,   0.00ns]   0.00ns   0.00ns   0.00ns
                        'fs_random':         0 [  0.00ns,   0.00ns]   0.00ns   0.00ns   0.00ns         0 [  0.00ns,   0.00ns]   0.00ns   0.00ns   0.00ns
                  'fs_random_no_lp':         0 [  0.00ns,   0.00ns]   0.00ns   0.00ns   0.00ns         0 [  0.00ns,   0.00ns]   0.00ns   0.00ns   0.00ns
                  'fs_random_no_lp':         0 [  0.00ns,   0.00ns]   0.00ns   0.00ns   0.00ns         0 [  0.00ns,   0.00ns]   0.00ns   0.00ns   0.00ns
                  'fs_random_no_lp':         0 [  0.00ns,   0.00ns]   0.00ns   0.00ns   0.00ns         0 [  0.00ns,   0.00ns]   0.00ns   0.00ns   0.00ns
                  'fs_random_no_lp':         0 [  0.00ns,   0.00ns]   0.00ns   0.00ns   0.00ns         0 [  0.00ns,   0.00ns]   0.00ns   0.00ns   0.00ns
          'fs_random_quick_restart':         0 [  0.00ns,   0.00ns]   0.00ns   0.00ns   0.00ns         0 [  0.00ns,   0.00ns]   0.00ns   0.00ns   0.00ns
          'fs_random_quick_restart':         0 [  0.00ns,   0.00ns]   0.00ns   0.00ns   0.00ns         0 [  0.00ns,   0.00ns]   0.00ns   0.00ns   0.00ns
          'fs_random_quick_restart':         0 [  0.00ns,   0.00ns]   0.00ns   0.00ns   0.00ns         0 [  0.00ns,   0.00ns]   0.00ns   0.00ns   0.00ns
          'fs_random_quick_restart':         0 [  0.00ns,   0.00ns]   0.00ns   0.00ns   0.00ns         0 [  0.00ns,   0.00ns]   0.00ns   0.00ns   0.00ns
    'fs_random_quick_restart_no_lp':         0 [  0.00ns,   0.00ns]   0.00ns   0.00ns   0.00ns         0 [  0.00ns,   0.00ns]   0.00ns   0.00ns   0.00ns
    'fs_random_quick_restart_no_lp':         0 [  0.00ns,   0.00ns]   0.00ns   0.00ns   0.00ns         0 [  0.00ns,   0.00ns]   0.00ns   0.00ns   0.00ns
    'fs_random_quick_restart_no_lp':         0 [  0.00ns,   0.00ns]   0.00ns   0.00ns   0.00ns         0 [  0.00ns,   0.00ns]   0.00ns   0.00ns   0.00ns
                    'graph_arc_lns':        11 [  2.01ms,  64.89ms]  22.09ms  18.05ms 242.95ms         9 [ 10.00ns,   5.63ms] 963.19us   1.68ms   8.67ms
                    'graph_cst_lns':        10 [614.74us,   1.96ms] 873.97us 368.84us   8.74ms         1 [ 10.00ns,  10.00ns]  10.00ns   0.00ns  10.00ns
                    'graph_dec_lns':        10 [  2.43ms,  51.44ms]  19.92ms  15.48ms 199.24ms         9 [ 10.00ns,   3.08ms] 843.57us   1.02ms   7.59ms
                    'graph_var_lns':        11 [  1.89ms,  43.12ms]  16.86ms  15.48ms 185.47ms        11 [ 10.00ns,   2.40ms] 571.97us 839.84us   6.29ms
                   'lb_tree_search':         1 [258.32ms, 258.32ms] 258.32ms   0.00ns 258.32ms         1 [ 31.19ms,  31.19ms]  31.19ms   0.00ns  31.19ms
                           'max_lp':         1 [258.71ms, 258.71ms] 258.71ms   0.00ns 258.71ms         1 [ 11.72ms,  11.72ms]  11.72ms   0.00ns  11.72ms
                            'no_lp':         1 [255.58ms, 255.58ms] 255.58ms   0.00ns 255.58ms         1 [ 35.38ms,  35.38ms]  35.38ms   0.00ns  35.38ms
              'objective_lb_search':         1 [257.47ms, 257.47ms] 257.47ms   0.00ns 257.47ms         1 [ 30.63ms,  30.63ms]  30.63ms   0.00ns  30.63ms
       'objective_lb_search_max_lp':         1 [253.71ms, 253.71ms] 253.71ms   0.00ns 253.71ms         1 [ 19.89ms,  19.89ms]  19.89ms   0.00ns  19.89ms
        'objective_lb_search_no_lp':         1 [254.10ms, 254.10ms] 254.10ms   0.00ns 254.10ms         1 [ 31.21ms,  31.21ms]  31.21ms   0.00ns  31.21ms
  'objective_shaving_search_max_lp':         9 [  1.02ms,  63.17ms]  18.89ms  19.83ms 170.04ms         4 [149.95us,   1.31ms] 702.11us 412.86us   2.81ms
   'objective_shaving_search_no_lp':         9 [  1.06ms,  65.72ms]  18.59ms  21.17ms 167.32ms         4 [206.79us,   4.62ms]   1.87ms   1.66ms   7.47ms
                          'probing':         1 [260.36ms, 260.36ms] 260.36ms   0.00ns 260.36ms         1 [ 13.00ms,  13.00ms]  13.00ms   0.00ns  13.00ms
                   'probing_max_lp':         1 [257.32ms, 257.32ms] 257.32ms   0.00ns 257.32ms         1 [ 14.41ms,  14.41ms]  14.41ms   0.00ns  14.41ms
                     'pseudo_costs':         1 [258.56ms, 258.56ms] 258.56ms   0.00ns 258.56ms         1 [ 18.79ms,  18.79ms]  18.79ms   0.00ns  18.79ms
                    'quick_restart':         1 [258.59ms, 258.59ms] 258.59ms   0.00ns 258.59ms         1 [ 26.22ms,  26.22ms]  26.22ms   0.00ns  26.22ms
              'quick_restart_no_lp':         1 [258.05ms, 258.05ms] 258.05ms   0.00ns 258.05ms         1 [ 36.34ms,  36.34ms]  36.34ms   0.00ns  36.34ms
                    'reduced_costs':         1 [258.92ms, 258.92ms] 258.92ms   0.00ns 258.92ms         1 [ 25.77ms,  25.77ms]  25.77ms   0.00ns  25.77ms
                        'rins/rens':        11 [ 84.42us, 169.27ms]  64.99ms  59.46ms 714.84ms         8 [ 10.00ns,  38.93ms]  10.74ms  12.00ms  85.91ms
                      'rnd_cst_lns':        11 [574.88us,  14.74ms]   2.81ms   3.99ms  30.91ms         4 [ 10.00ns, 372.13us]  93.04us 161.13us 372.16us
                      'rnd_var_lns':        11 [  1.81ms,  79.98ms]  27.67ms  23.72ms 304.34ms        10 [ 10.00ns,   7.35ms]   1.75ms   2.29ms  17.51ms
                     'violation_ls':         5 [965.87us,  95.33ms]  47.05ms  41.29ms 235.26ms         5 [520.00ns,  49.68ms]  23.13ms  21.57ms 115.66ms
                     'violation_ls':         6 [286.48us,  91.25ms]  38.75ms  34.31ms 232.51ms         6 [ 31.55us,  49.26ms]  20.87ms  20.30ms 125.20ms
                     'violation_ls':         9 [123.79us,  89.98ms]  24.33ms  32.63ms 218.93ms         9 [  1.02us,  47.11ms]  14.18ms  18.41ms 127.66ms
                     'violation_ls':         9 [129.77us,  99.42ms]  22.70ms  36.36ms 204.27ms         9 [560.00ns,  50.31ms]  10.94ms  18.80ms  98.43ms
                     'violation_ls':        10 [150.94us,  96.06ms]  22.00ms  30.51ms 220.02ms        10 [780.00ns,  48.41ms]  11.11ms  15.58ms 111.09ms

Search stats                        Bools  Conflicts  Branches  Restarts  BoolPropag  IntegerPropag
                           'core':    904        892     1'663       452     318'344        138'179
                     'default_lp':     92        281     1'139       381       5'913         51'018
                      'fs_random':      0          0         0         0           0              0
                      'fs_random':      0          0         0         0           0              0
                      'fs_random':      0          0         0         0           0              0
                      'fs_random':      0          0         0         0           0              0
                'fs_random_no_lp':      0          0         0         0           0              0
                'fs_random_no_lp':      0          0         0         0           0              0
                'fs_random_no_lp':      0          0         0         0           0              0
                'fs_random_no_lp':      0          0         0         0           0              0
        'fs_random_quick_restart':      0          0         0         0           0              0
        'fs_random_quick_restart':      0          0         0         0           0              0
        'fs_random_quick_restart':      0          0         0         0           0              0
        'fs_random_quick_restart':      0          0         0         0           0              0
  'fs_random_quick_restart_no_lp':      0          0         0         0           0              0
  'fs_random_quick_restart_no_lp':      0          0         0         0           0              0
  'fs_random_quick_restart_no_lp':      0          0         0         0           0              0
                 'lb_tree_search':     59          1       143       119         114          1'192
                         'max_lp':     59          0       118       118          86            948
                          'no_lp':    203        873     2'825       560      42'046        173'308
            'objective_lb_search':     77        193     1'927       734       5'937         61'764
     'objective_lb_search_max_lp':     63         16       135       119         439          3'161
      'objective_lb_search_no_lp':     83        883     2'540       632      14'997        163'454
                        'probing':    101         20       182       182         505          2'563
                 'probing_max_lp':     61          0       122       122          89            848
                   'pseudo_costs':     70          9       141       119         215          2'712
                  'quick_restart':     82         67     1'527       653       3'052         32'126
            'quick_restart_no_lp':    226        720     4'695       879      43'049        171'064
                  'reduced_costs':    113         50       483       239       1'444         10'558

SAT stats                           ClassicMinim  LitRemoved  LitLearned  LitForgotten  Subsumed  MClauses  MDecisions  MLitTrue  MSubsumed  MLitRemoved  MReused
                           'core':           649       2'373       2'682             0         1        31         172         0          0            0        4
                     'default_lp':           145         280       2'153             0        17        65         334         0          2           11        8
                      'fs_random':             0           0           0             0         0         0           0         0          0            0        0
                      'fs_random':             0           0           0             0         0         0           0         0          0            0        0
                      'fs_random':             0           0           0             0         0         0           0         0          0            0        0
                      'fs_random':             0           0           0             0         0         0           0         0          0            0        0
                'fs_random_no_lp':             0           0           0             0         0         0           0         0          0            0        0
                'fs_random_no_lp':             0           0           0             0         0         0           0         0          0            0        0
                'fs_random_no_lp':             0           0           0             0         0         0           0         0          0            0        0
                'fs_random_no_lp':             0           0           0             0         0         0           0         0          0            0        0
        'fs_random_quick_restart':             0           0           0             0         0         0           0         0          0            0        0
        'fs_random_quick_restart':             0           0           0             0         0         0           0         0          0            0        0
        'fs_random_quick_restart':             0           0           0             0         0         0           0         0          0            0        0
        'fs_random_quick_restart':             0           0           0             0         0         0           0         0          0            0        0
  'fs_random_quick_restart_no_lp':             0           0           0             0         0         0           0         0          0            0        0
  'fs_random_quick_restart_no_lp':             0           0           0             0         0         0           0         0          0            0        0
  'fs_random_quick_restart_no_lp':             0           0           0             0         0         0           0         0          0            0        0
                 'lb_tree_search':             1           1          14             0         0         0           0         0          0            0        0
                         'max_lp':             0           0           0             0         0         0           0         0          0            0        0
                          'no_lp':           576       1'454       6'599             0        45       127         763         0         26          164       15
            'objective_lb_search':           137         338       1'182             0        11       188       1'048         0         27          144       32
     'objective_lb_search_max_lp':             7          12          57             0         3         0           0         0          0            0        0
      'objective_lb_search_no_lp':           705       1'940       5'053             0        36       156         968         0         23          144       27
                        'probing':             0           0          20             0         0         0           0         0          0            0        0
                 'probing_max_lp':             0           0           0             0         0         0           0         0          0            0        0
                   'pseudo_costs':             7           7          69             0         0         0           0         0          0            0        0
                  'quick_restart':            38          70         514             0         3       137         707         0          9           47       23
            'quick_restart_no_lp':           383         821       5'727             0        45       265       1'384         1        120          724       22
                  'reduced_costs':            21          46         268             0         0        28         136         0          0            0        4

Lp stats                         Component  Iterations  AddedCuts  OPTIMAL  DUAL_F.  DUAL_U.
                  'default_lp':          1       1'121        874      368        0        0
              'lb_tree_search':          1         628      1'361       27        1        0
                      'max_lp':          1         345      1'538       13        1        0
         'objective_lb_search':          1         819        731      217        0        0
  'objective_lb_search_max_lp':          1         838      1'251       37       10        0
                     'probing':          1         279        969      110        1        0
              'probing_max_lp':          1         369      1'497       12        0        0
                'pseudo_costs':          1         728      1'259       52        4        0
               'quick_restart':          1         824      1'039      178        0        0
               'reduced_costs':          1         768      1'300       87        4        0

Lp dimension                                                                     Final dimension of first component
                  'default_lp':     85 rows, 95 columns, 267 entries with magnitude in [1.133225e-02, 1.000000e+00]
              'lb_tree_search':  914 rows, 102 columns, 4985 entries with magnitude in [1.289985e-03, 1.000000e+00]
                      'max_lp':  966 rows, 102 columns, 5299 entries with magnitude in [1.683141e-03, 1.000000e+00]
         'objective_lb_search':    113 rows, 95 columns, 426 entries with magnitude in [3.555979e-03, 1.000000e+00]
  'objective_lb_search_max_lp':  547 rows, 102 columns, 2635 entries with magnitude in [5.074678e-05, 1.000000e+00]
                     'probing':   461 rows, 95 columns, 3631 entries with magnitude in [3.626618e-05, 1.000000e+00]
              'probing_max_lp':  923 rows, 102 columns, 5492 entries with magnitude in [1.598050e-03, 1.000000e+00]
                'pseudo_costs':  518 rows, 102 columns, 2678 entries with magnitude in [2.044292e-04, 1.000000e+00]
               'quick_restart':    203 rows, 95 columns, 867 entries with magnitude in [1.124243e-03, 1.000000e+00]
               'reduced_costs':  499 rows, 102 columns, 2552 entries with magnitude in [4.043535e-04, 1.000000e+00]

Lp debug                         CutPropag  CutEqPropag  Adjust  Overflow    Bad  BadScaling
                  'default_lp':          0            0     189         0    785           0
              'lb_tree_search':          0            0      27         0  1'034           0
                      'max_lp':          1            0      13         0  1'393           0
         'objective_lb_search':         10            2     111         0    587           0
  'objective_lb_search_max_lp':          7            0      40         0  1'584           0
                     'probing':          1            7      94         0  1'682           0
              'probing_max_lp':          0            0       7         0  1'088           0
                'pseudo_costs':          6            0      40         0  1'425           0
               'quick_restart':          5            1     127         0  1'183           0
               'reduced_costs':          4            0      83         0  1'354           0

Lp pool                          Constraints  Updates  Simplif  Merged  Shortened  Split  Strenghtened    Cuts/Call
                  'default_lp':          964      157      125       3          0     54           285    874/1'438
              'lb_tree_search':        1'979       79      521       5          0     11         1'321  1'361/2'030
                      'max_lp':        2'156       93      588       5          0     27         1'415  1'538/2'343
         'objective_lb_search':          820      326      443       4        167     44           437    731/1'244
  'objective_lb_search_max_lp':        1'861      104    1'096      13          0     22         2'020  1'251/2'028
                     'probing':        1'062      135      136       0          0     36           280    969/1'600
              'probing_max_lp':        2'120        8        0       0          0     23           311  1'497/2'237
                'pseudo_costs':        1'871      109      952      11          0     20         1'693  1'259/1'899
               'quick_restart':        1'128      644    1'775       4        876    158           977  1'039/1'687
               'reduced_costs':        1'908      123    1'120      15          0      6         2'252  1'300/1'934

Lp Cut            defaul  max_lp  quick_  reduce  pseudo  lb_tre  probin  object  probin  object
          CG_FF:     118     167     137      85      72     128     133      77     143      76
           CG_K:      39      28      34      39      33      17      21      26      20      36
           CG_R:      47     111      57      36      31     115      59      30     107      31
          CG_RB:     218     456     234     365     398     391     267     144     453     367
         CG_RBP:      36      71      53      75      50      64      44      42      47      56
         Clique:       -       -       -       5       5       6       -       -       -       5
             IB:     136      89     131     152     159      97     124     130      81     164
       MIR_1_FF:      31      76      39      52      57      81      29      27      76      57
        MIR_1_K:       8      16      10       7       7      20       6       6      12       8
        MIR_1_R:       9       8      10       5       6      11       4       5       8       7
       MIR_1_RB:      45      90      64      95      94      79      48      61      96      88
      MIR_1_RBP:       8      28      10      31      34      30       8      16      25      27
      MIR_1_RLT:       -       3       -       8       8       2       -       -       2       6
       MIR_2_FF:      20      40      23      24      21      21      15      12      33      23
        MIR_2_K:       8      11       4       6       5       6       3       4      13       9
        MIR_2_R:       8      14       8      11      21       5      10       6       5      18
       MIR_2_RB:      26      48      25      36      39      24      35      28      39      50
      MIR_2_RBP:       7      12       5       6      10       8       6      11       8       6
       MIR_3_FF:       9      25      17       9       4      19       9       6      21       9
        MIR_3_K:       -       5       2       5       2       8       4       -       6       4
        MIR_3_R:       4       9      14      10      10      10       9       1      14       9
       MIR_3_RB:      14      26      25      22      24      16      19      16      21      24
      MIR_3_RBP:       2       6       6       3       2       5       1       1       8       3
       MIR_4_FF:       6       6      10       3       2      12       8       6      11       4
        MIR_4_K:       1       -       3       3       -       1       1       2       2       2
        MIR_4_R:       5       6      11       4       1       5      10       4       4       1
       MIR_4_RB:       8       6      11      12       8      10      13      10       7       8
      MIR_4_RBP:       -       1       4       1       1       1       2       2       4       1
       MIR_5_FF:       -       4       6       1       -       4       2       5       5       -
        MIR_5_K:       -       1       3       -       -       -       1       1       -       -
        MIR_5_R:       -       4       5       -       1       2       5       1       4       -
       MIR_5_RB:       1       3       5       4       5       3       3       6       9       5
      MIR_5_RBP:       -       -       3       -       -       -       -       -       -       -
       MIR_6_FF:       -       -       1       -       -       2       -       1       1       -
        MIR_6_K:       -       -       -       -       -       1       -       1       -       -
        MIR_6_R:       -       -       -       1       -       1       -       -       1       -
       MIR_6_RB:       -       -       1       -       -       -       -       1       -       -
   ZERO_HALF_FF:      15      35      15      35      23      35      21      11      51      30
    ZERO_HALF_K:       1       5       3       4       1      13       -       -      13       -
    ZERO_HALF_R:      23      59      27      73      58      49      31      21      68      60
   ZERO_HALF_RB:      17      48      17      52      51      36      18       9      53      45
  ZERO_HALF_RBP:       4      21       6      20      16      23       -       1      26      12

LNS stats           Improv/Calls  Closed  Difficulty  TimeLimit
  'graph_arc_lns':          2/11     91%        0.98       0.10
  'graph_cst_lns':           0/1    100%        0.71       0.10
  'graph_dec_lns':          2/10     90%        0.98       0.10
  'graph_var_lns':          3/11    100%        0.99       0.10
      'rins/rens':          4/10     80%        0.96       0.10
    'rnd_cst_lns':           0/4    100%        0.91       0.10
    'rnd_var_lns':          2/11    100%        0.99       0.10

LS stats                   Batches  Restarts  LinMoves  GenMoves  CompoundMoves  WeightUpdates
       'fj_long_default':        0         0         0         0              0              0
       'fj_long_default':        0         0         0         0              0              0
   'fj_long_lin_default':        0         0         0         0              0              0
   'fj_long_lin_perturb':        0         0         0         0              0              0
    'fj_long_lin_random':        0         0         0         0              0              0
       'fj_long_perturb':        0         0         0         0              0              0
        'fj_long_random':        0         0         0         0              0              0
      'fj_short_default':        0         0         0         0              0              0
      'fj_short_default':        0         0         0         0              0              0
  'fj_short_lin_default':        0         0         0         0              0              0
  'fj_short_lin_default':        0         0         0         0              0              0
  'fj_short_lin_perturb':        0         0         0         0              0              0
   'fj_short_lin_random':        0         0         0         0              0              0
      'fj_short_perturb':        0         0         0         0              0              0
       'fj_short_random':        0         0         0         0              0              0
          'violation_ls':       10         0    18'512     4'184            170         10'795
          'violation_ls':        5         0     9'133    13'154            269            978
          'violation_ls':        6         0     2'456    16'457            981            434
          'violation_ls':        9         0    17'002       990             30          1'603
          'violation_ls':        9         0     7'955    12'948            295          3'928

Solutions (34)            Num     Rank
        'graph_dec_lns':    1  [19,19]
        'graph_var_lns':    1    [4,4]
                'no_lp':    5   [1,15]
  'quick_restart_no_lp':   10  [13,29]
          'rnd_var_lns':    1  [12,12]
         'violation_ls':   16   [2,34]

Objective bounds                Num
                  'bool_core':   80
                 'default_lp':    1
             'initial_domain':    1
  'objective_lb_search_no_lp':   14
              'quick_restart':    1

Solution repositories    Added  Queried  Ignored  Synchro
  'feasible solutions':     93      196        1       66
        'lp solutions':      1        0        0        1
                'pump':    207       10

Improving bounds shared          Num
                        'core':   12
                       'no_lp':  142
         'objective_lb_search':   72
  'objective_lb_search_max_lp':   10
   'objective_lb_search_no_lp':    7
                'pseudo_costs':    5
               'quick_restart':   33
         'quick_restart_no_lp':  143
               'reduced_costs':    3

Clauses shared                  Num
                       'core':    1
                 'default_lp':    2
             'lb_tree_search':    1
                      'no_lp':   18
        'objective_lb_search':    1
  'objective_lb_search_no_lp':    1
              'quick_restart':    1
        'quick_restart_no_lp':   10

CpSolverResponse summary:
status: OPTIMAL
objective: 404
best_bound: 404
integers: 0
booleans: 0
conflicts: 0
branches: 0
propagations: 0
integer_propagations: 0
restarts: 0
lp_iterations: 0
walltime: 0.338532
usertime: 0.338532
deterministic_time: 1.23971
gap_integral: 2.4927
solution_fingerprint: 0x441db84576ca52a7


--- Simulation Gantt  partir du modle mathmatique ---
{'big':0, 'due_date':103, 'pos_time':5, 'status':1, 'blocked':2, 'operations':["{'type':1, 'processing_time':50}"]}
{'big':1, 'due_date':93, 'pos_time':5, 'status':2, 'blocked':1, 'operations':["{'type':0, 'processing_time':26}", "{'type':1, 'processing_time':15}"]}
{'big':0, 'due_date':96, 'pos_time':5, 'status':3, 'blocked':2, 'operations':["{'type':0, 'processing_time':24}", "{'type':1, 'processing_time':49}"]}
{'big':1, 'due_date':82, 'pos_time':5, 'status':1, 'blocked':1, 'operations':["{'type':0, 'processing_time':52}"]}
{'big':0, 'due_date':154, 'pos_time':5, 'status':0, 'blocked':1, 'operations':["{'type':0, 'processing_time':14}", "{'type':1, 'processing_time':20}"]}
