created virtual environment CPython3.12.4.final.0-64 in 6555ms
  creator CPython3Posix(dest=/localscratch/aneumann.63393189.0/env, clear=False, no_vcs_ignore=False, global=False)
  seeder FromAppData(download=False, pip=bundle, via=copy, app_data_dir=/home/aneumann/.local/share/virtualenv)
    added seed packages: pip==25.1.1
  activators BashActivator,CShellActivator,FishActivator,NushellActivator,PowerShellActivator,PythonActivator
Looking in links: /cvmfs/soft.computecanada.ca/custom/python/wheelhouse/gentoo2023/x86-64-v3, /cvmfs/soft.computecanada.ca/custom/python/wheelhouse/gentoo2023/generic, /cvmfs/soft.computecanada.ca/custom/python/wheelhouse/generic
Requirement already satisfied: pip in /localscratch/aneumann.63393189.0/env/lib/python3.12/site-packages (25.1.1)
Looking in links: /cvmfs/soft.computecanada.ca/custom/python/wheelhouse/gentoo2023/x86-64-v3, /cvmfs/soft.computecanada.ca/custom/python/wheelhouse/gentoo2023/generic, /cvmfs/soft.computecanada.ca/custom/python/wheelhouse/generic
ERROR: protobuf-5.28.3-cp38-abi3-manylinux2014_x86_64.whl is not a supported wheel on this platform.
Looking in links: /cvmfs/soft.computecanada.ca/custom/python/wheelhouse/gentoo2023/x86-64-v3, /cvmfs/soft.computecanada.ca/custom/python/wheelhouse/gentoo2023/generic, /cvmfs/soft.computecanada.ca/custom/python/wheelhouse/generic
Processing /home/aneumann/projects/def-adhaj/aneumann/GNRS/wheels/immutabledict-4.2.0-py3-none-any.whl
Installing collected packages: immutabledict
Successfully installed immutabledict-4.2.0
Looking in links: /cvmfs/soft.computecanada.ca/custom/python/wheelhouse/gentoo2023/x86-64-v3, /cvmfs/soft.computecanada.ca/custom/python/wheelhouse/gentoo2023/generic, /cvmfs/soft.computecanada.ca/custom/python/wheelhouse/generic
Processing /cvmfs/soft.computecanada.ca/custom/python/wheelhouse/generic/ortools-9.10.4067+computecanada-cp312-cp312-linux_x86_64.whl (from -r /home/aneumann/projects/def-adhaj/aneumann/GNRS/requirements/or.txt (line 1))
Processing /cvmfs/soft.computecanada.ca/custom/python/wheelhouse/gentoo2023/x86-64-v3/matplotlib-3.10.0+computecanada-cp312-cp312-linux_x86_64.whl (from -r /home/aneumann/projects/def-adhaj/aneumann/GNRS/requirements/or.txt (line 2))
Processing /cvmfs/soft.computecanada.ca/custom/python/wheelhouse/gentoo2023/x86-64-v3/pandas-2.2.3+computecanada-cp312-cp312-linux_x86_64.whl (from -r /home/aneumann/projects/def-adhaj/aneumann/GNRS/requirements/or.txt (line 3))
Processing /cvmfs/soft.computecanada.ca/custom/python/wheelhouse/generic/absl_py-2.2.2+computecanada-py3-none-any.whl (from ortools<9.11,>=9.10->-r /home/aneumann/projects/def-adhaj/aneumann/GNRS/requirements/or.txt (line 1))
Processing /cvmfs/soft.computecanada.ca/custom/python/wheelhouse/gentoo2023/generic/numpy-2.2.2+computecanada-cp312-cp312-linux_x86_64.whl (from ortools<9.11,>=9.10->-r /home/aneumann/projects/def-adhaj/aneumann/GNRS/requirements/or.txt (line 1))
Processing /cvmfs/soft.computecanada.ca/custom/python/wheelhouse/gentoo2023/x86-64-v3/protobuf-6.30.2+computecanada-cp312-cp312-linux_x86_64.whl (from ortools<9.11,>=9.10->-r /home/aneumann/projects/def-adhaj/aneumann/GNRS/requirements/or.txt (line 1))
Requirement already satisfied: immutabledict>=3.0.0 in /localscratch/aneumann.63393189.0/env/lib/python3.12/site-packages (from ortools<9.11,>=9.10->-r /home/aneumann/projects/def-adhaj/aneumann/GNRS/requirements/or.txt (line 1)) (4.2.0)
Processing /cvmfs/soft.computecanada.ca/custom/python/wheelhouse/gentoo2023/generic/contourpy-1.3.1+computecanada-cp312-cp312-linux_x86_64.whl (from matplotlib->-r /home/aneumann/projects/def-adhaj/aneumann/GNRS/requirements/or.txt (line 2))
Processing /cvmfs/soft.computecanada.ca/custom/python/wheelhouse/generic/cycler-0.12.1+computecanada-py3-none-any.whl (from matplotlib->-r /home/aneumann/projects/def-adhaj/aneumann/GNRS/requirements/or.txt (line 2))
Processing /cvmfs/soft.computecanada.ca/custom/python/wheelhouse/generic/fonttools-4.58.2+computecanada-cp312-cp312-linux_x86_64.whl (from matplotlib->-r /home/aneumann/projects/def-adhaj/aneumann/GNRS/requirements/or.txt (line 2))
Processing /cvmfs/soft.computecanada.ca/custom/python/wheelhouse/gentoo2023/x86-64-v3/kiwisolver-1.4.8+computecanada-cp312-cp312-linux_x86_64.whl (from matplotlib->-r /home/aneumann/projects/def-adhaj/aneumann/GNRS/requirements/or.txt (line 2))
Processing /cvmfs/soft.computecanada.ca/custom/python/wheelhouse/generic/packaging-25.0+computecanada-py3-none-any.whl (from matplotlib->-r /home/aneumann/projects/def-adhaj/aneumann/GNRS/requirements/or.txt (line 2))
Processing /cvmfs/soft.computecanada.ca/custom/python/wheelhouse/gentoo2023/x86-64-v3/pillow-11.1.0+computecanada-cp312-cp312-linux_x86_64.whl (from matplotlib->-r /home/aneumann/projects/def-adhaj/aneumann/GNRS/requirements/or.txt (line 2))
Processing /cvmfs/soft.computecanada.ca/custom/python/wheelhouse/generic/pyparsing-3.2.1+computecanada-py3-none-any.whl (from matplotlib->-r /home/aneumann/projects/def-adhaj/aneumann/GNRS/requirements/or.txt (line 2))
Processing /cvmfs/soft.computecanada.ca/custom/python/wheelhouse/generic/python_dateutil-2.9.0.post0+computecanada-py2.py3-none-any.whl (from matplotlib->-r /home/aneumann/projects/def-adhaj/aneumann/GNRS/requirements/or.txt (line 2))
Processing /cvmfs/soft.computecanada.ca/custom/python/wheelhouse/generic/pytz-2025.2+computecanada-py2.py3-none-any.whl (from pandas->-r /home/aneumann/projects/def-adhaj/aneumann/GNRS/requirements/or.txt (line 3))
Processing /cvmfs/soft.computecanada.ca/custom/python/wheelhouse/generic/tzdata-2025.2+computecanada-py2.py3-none-any.whl (from pandas->-r /home/aneumann/projects/def-adhaj/aneumann/GNRS/requirements/or.txt (line 3))
Processing /cvmfs/soft.computecanada.ca/custom/python/wheelhouse/generic/six-1.17.0+computecanada-py2.py3-none-any.whl (from python-dateutil>=2.7->matplotlib->-r /home/aneumann/projects/def-adhaj/aneumann/GNRS/requirements/or.txt (line 2))
Installing collected packages: pytz, tzdata, six, pyparsing, protobuf, pillow, packaging, numpy, kiwisolver, fonttools, cycler, absl-py, python-dateutil, contourpy, pandas, matplotlib, ortools

Successfully installed absl-py-2.2.2+computecanada contourpy-1.3.1+computecanada cycler-0.12.1+computecanada fonttools-4.58.2+computecanada kiwisolver-1.4.8+computecanada matplotlib-3.10.0+computecanada numpy-2.2.2+computecanada ortools-9.10.4067+computecanada packaging-25.0+computecanada pandas-2.2.3+computecanada pillow-11.1.0+computecanada protobuf-6.30.2+computecanada pyparsing-3.2.1+computecanada python-dateutil-2.9.0.post0+computecanada pytz-2025.2+computecanada six-1.17.0+computecanada tzdata-2025.2+computecanada

Starting CP-SAT solver v9.10.4067
Parameters: max_time_in_seconds: 3600 max_memory_in_mb: 12000 log_search_progress: true enumerate_all_solutions: false absolute_gap_limit: 0 relative_gap_limit: 0
Setting number of workers to 48

Initial optimization model '': (model_fingerprint: 0x92f79579abc98aa6)
#Variables: 306 (#ints: 9 in objective)
  - 213 Booleans in [0,1]
  - 93 in [0,550]
#kLinear1: 41
#kLinear2: 538
#kLinear3: 198
#kLinearN: 2'726 (#terms: 37'049)

Starting presolve at 0.00s
  1.83e-03s  0.00e+00d  [DetectDominanceRelations] 
  3.99e-02s  0.00e+00d  [PresolveToFixPoint] #num_loops=6 #num_dual_strengthening=3 
  3.52e-05s  0.00e+00d  [ExtractEncodingFromLinear] #potential_supersets=3 
[Symmetry] Graph for symmetry has 3'154 nodes and 25'366 arcs.
[Symmetry] Symmetry computation done. time: 0.00241862 dtime: 0.00239435
[Symmetry] #generators: 1, average support size: 22
[Symmetry] The model contains 286 duplicate constraints !
[Symmetry] 11 orbits with sizes: 2,2,2,2,2,2,2,2,2,2,...
[Symmetry] Num fixable by intersecting at_most_one with orbits: 1 largest_orbit: 2
  1.00e-02s  1.38e-03d  [Probe] #probed=290 #fixed_bools=3 #new_bounds=16 #equiv=1 
  6.73e-05s  0.00e+00d  [MaxClique] Merged 30(60 literals) into 10(20 literals) at_most_ones. 
  1.77e-03s  0.00e+00d  [DetectDominanceRelations] 
  1.84e-02s  0.00e+00d  [PresolveToFixPoint] #num_loops=4 #num_dual_strengthening=3 
  6.04e-03s  0.00e+00d  [ProcessAtMostOneAndLinear] 
  2.92e-03s  0.00e+00d  [DetectDuplicateConstraints] #duplicates=340 #without_enforcements=244 
  2.97e-03s  8.73e-05d  [DetectDominatedLinearConstraints] #relevant_constraints=1'982 #num_inclusions=1'423 #num_redundant=2 
  3.83e-04s  0.00e+00d  [DetectDifferentVariables] #different=38 
  5.67e-04s  2.82e-05d  [ProcessSetPPC] #relevant_constraints=1'447 
  2.80e-05s  0.00e+00d  [FindAlmostIdenticalLinearConstraints] 
  1.44e-04s  1.11e-04d  [FindBigAtMostOneAndLinearOverlap] 
  6.71e-03s  1.94e-03d  [FindBigVerticalLinearOverlap] #blocks=37 #saved_nz=3'860 
  3.08e-04s  6.60e-05d  [FindBigHorizontalLinearOverlap] #linears=1'395 
  1.52e-05s  0.00e+00d  [MergeClauses] 
  1.84e-03s  0.00e+00d  [DetectDominanceRelations] 
  2.39e-02s  0.00e+00d  [PresolveToFixPoint] #num_loops=2 #num_dual_strengthening=1 
  1.84e-03s  0.00e+00d  [DetectDominanceRelations] 
  1.37e-02s  0.00e+00d  [PresolveToFixPoint] #num_loops=1 #num_dual_strengthening=1 
[Symmetry] Graph for symmetry has 2'879 nodes and 20'127 arcs.
[Symmetry] Symmetry computation done. time: 0.000905097 dtime: 0.00123663
  9.11e-03s  1.23e-03d  [Probe] #probed=284 #new_bounds=37 
  2.31e-05s  0.00e+00d  [MaxClique] 
  1.82e-03s  0.00e+00d  [DetectDominanceRelations] 
  2.30e-02s  0.00e+00d  [PresolveToFixPoint] #num_loops=2 #num_dual_strengthening=1 
  5.07e-03s  0.00e+00d  [ProcessAtMostOneAndLinear] 
  2.50e-03s  0.00e+00d  [DetectDuplicateConstraints] #without_enforcements=266 
  1.03e-03s  4.55e-05d  [DetectDominatedLinearConstraints] #relevant_constraints=1'577 #num_inclusions=25 
  3.71e-04s  0.00e+00d  [DetectDifferentVariables] #different=45 #cliques=2 #size=6 
  4.82e-04s  2.00e-05d  [ProcessSetPPC] #relevant_constraints=1'334 
  3.66e-05s  9.00e-08d  [FindAlmostIdenticalLinearConstraints] #num_tested_pairs=6 
  9.54e-05s  5.74e-05d  [FindBigAtMostOneAndLinearOverlap] 
  4.00e-03s  1.35e-03d  [FindBigVerticalLinearOverlap] #blocks=28 #saved_nz=2'167 
  2.78e-04s  5.10e-05d  [FindBigHorizontalLinearOverlap] #linears=1'274 
  1.54e-05s  0.00e+00d  [MergeClauses] 
  1.71e-03s  0.00e+00d  [DetectDominanceRelations] 
  2.29e-02s  0.00e+00d  [PresolveToFixPoint] #num_loops=3 #num_dual_strengthening=1 
  1.69e-03s  0.00e+00d  [DetectDominanceRelations] 
  1.53e-02s  0.00e+00d  [PresolveToFixPoint] #num_loops=1 #num_dual_strengthening=1 
  8.62e-03s  1.12e-03d  [Probe] #probed=284 #new_bounds=19 
  1.68e-05s  0.00e+00d  [MaxClique] 
  1.67e-03s  0.00e+00d  [DetectDominanceRelations] 
  1.99e-02s  0.00e+00d  [PresolveToFixPoint] #num_loops=2 #num_dual_strengthening=1 
  4.59e-03s  0.00e+00d  [ProcessAtMostOneAndLinear] 
  2.45e-03s  0.00e+00d  [DetectDuplicateConstraints] #without_enforcements=292 
  8.99e-04s  3.63e-05d  [DetectDominatedLinearConstraints] #relevant_constraints=1'527 #num_inclusions=25 
  2.33e-04s  0.00e+00d  [DetectDifferentVariables] 
  4.24e-04s  1.45e-05d  [ProcessSetPPC] #relevant_constraints=1'210 
  4.61e-05s  2.30e-07d  [FindAlmostIdenticalLinearConstraints] #num_tested_pairs=11 
  8.17e-05s  4.20e-05d  [FindBigAtMostOneAndLinearOverlap] 
  2.56e-03s  1.02e-03d  [FindBigVerticalLinearOverlap] #blocks=11 #saved_nz=695 
  2.43e-04s  4.26e-05d  [FindBigHorizontalLinearOverlap] #linears=1'084 
  1.48e-05s  0.00e+00d  [MergeClauses] 
  1.62e-03s  0.00e+00d  [DetectDominanceRelations] 
  1.55e-02s  0.00e+00d  [PresolveToFixPoint] #num_loops=2 #num_dual_strengthening=1 
  8.32e-05s  0.00e+00d  [ExpandObjective] #entries=307 #tight_variables=94 #tight_constraints=54 

Presolve summary:
  - 61 affine relations were detected.
  - rule 'TODO dual: only one blocking constraint?' was applied 692 times.
  - rule 'TODO dual: only one unspecified blocking constraint?' was applied 117 times.
  - rule 'TODO duplicate: identical constraint with different enforcements' was applied 802 times.
  - rule 'TODO no_overlap: with task always last' was applied 2 times.
  - rule 'affine: new relation' was applied 61 times.
  - rule 'all_diff: inferred from x != y constraints' was applied 2 times.
  - rule 'at_most_one: removed literals' was applied 10 times.
  - rule 'at_most_one: size one' was applied 10 times.
  - rule 'at_most_one: transformed into max clique.' was applied 1 time.
  - rule 'deductions: 255 stored' was applied 1 time.
  - rule 'dual: fix variable' was applied 24 times.
  - rule 'dual: reduced domain' was applied 58 times.
  - rule 'duplicate: merged rhs of linear constraint' was applied 58 times.
  - rule 'duplicate: removed constraint' was applied 340 times.
  - rule 'enforcement: false literal' was applied 24 times.
  - rule 'enforcement: true literal' was applied 13 times.
  - rule 'exactly_one: x and not(x)' was applied 1 time.
  - rule 'incompatible linear: add implication' was applied 45 times.
  - rule 'linear inclusion: redundant containing constraint' was applied 2 times.
  - rule 'linear matrix: common vertical rectangle' was applied 76 times.
  - rule 'linear: always true' was applied 818 times.
  - rule 'linear: doubleton free' was applied 11 times.
  - rule 'linear: empty' was applied 32 times.
  - rule 'linear: extracted enforcement literal' was applied 5'988 times.
  - rule 'linear: fixed or dup variables' was applied 2'790 times.
  - rule 'linear: positive equal one' was applied 3 times.
  - rule 'linear: reduced variable domains' was applied 181 times.
  - rule 'linear: remapped using affine relations' was applied 2'694 times.
  - rule 'linear: simplified rhs' was applied 8'910 times.
  - rule 'linear: variable substitution 1' was applied 11 times.
  - rule 'linear: variable substitution 2' was applied 8 times.
  - rule 'linear: variable substitution 3' was applied 1 time.
  - rule 'presolve: 93 unused variables removed.' was applied 1 time.
  - rule 'presolve: iteration' was applied 3 times.
  - rule 'probing: reduced enforced constraint to implication.' was applied 30 times.
  - rule 'symmetry: fixed to false in general orbit' was applied 1 time.

Presolved optimization model '': (model_fingerprint: 0x76d54503173a6ddd)
#Variables: 208 (#ints: 9 in objective)
  - 70 Booleans in [0,1]
  - 106 different domains in [-3759,4870] with a largest complexity of 11.
#kAllDiff: 2
#kExactlyOne: 2 (#literals: 6)
#kLinear2: 779 (#enforced: 720 #multi: 617)
#kLinear3: 227 (#enforced: 160)
#kLinearN: 1'244 (#enforced: 1'159) (#terms: 9'167)

Preloading model.
#Bound   0.28s best:inf   next:[150,3936] initial_domain
#Model   0.29s var:208/208 constraints:2254/2254

Starting search at 0.29s with 48 workers.
16 full problem subsolvers: [core, default_lp, lb_tree_search, max_lp, no_lp, objective_lb_search, objective_lb_search_max_lp, objective_lb_search_no_lp, objective_shaving_search_max_lp, objective_shaving_search_no_lp, probing, probing_max_lp, pseudo_costs, quick_restart, quick_restart_no_lp, reduced_costs]
30 first solution subsolvers: [fj_long_default(2), fj_long_lin_default, fj_long_lin_perturb, fj_long_lin_random, fj_long_perturb, fj_long_random, fj_short_default(2), fj_short_lin_default(2), fj_short_lin_perturb, fj_short_lin_random, fj_short_perturb, fj_short_random, fs_random(4), fs_random_no_lp(4), fs_random_quick_restart(4), fs_random_quick_restart_no_lp(3)]
13 incomplete subsolvers: [feasibility_pump, graph_arc_lns, graph_cst_lns, graph_dec_lns, graph_var_lns, rins/rens, rnd_cst_lns, rnd_var_lns, violation_ls(5)]
3 helper subsolvers: [neighborhood_helper, synchronization_agent, update_gap_integral]
#Bound   0.32s best:inf   next:[175,3936] objective_lb_search_no_lp
#1       0.34s best:1888  next:[175,1887] no_lp (fixed_bools=0/97)
#2       0.35s best:1513  next:[175,1512] no_lp (fixed_bools=0/113)
#3       0.35s best:1274  next:[175,1273] objective_lb_search_no_lp (fixed_bools=1/102)
#Bound   0.35s best:1274  next:[180,1273] objective_lb_search_no_lp
#4       0.36s best:1273  next:[180,1272] violation_ls(batch:2 #solutions_imported:2 #lin_moves:415 #lin_evals:3'136 #gen_moves:969 #gen_evals:223 #comp_moves:57 #backtracks:456 #weight_updates:137)
#5       0.37s best:1272  next:[180,1271] violation_ls(batch:1 #solutions_imported:1 #lin_moves:0 #lin_evals:6 #gen_moves:4 #gen_evals:0 #comp_moves:4 #backtracks:0 #weight_updates:0)
#6       0.37s best:1271  next:[180,1270] violation_ls(batch:2 #solutions_imported:2 #lin_moves:11 #lin_evals:3'667 #gen_moves:1'785 #gen_evals:199 #comp_moves:95 #backtracks:845 #weight_updates:28)
#7       0.37s best:1270  next:[180,1269] violation_ls(batch:1 #solutions_imported:1 #lin_moves:0 #lin_evals:2 #gen_moves:1 #gen_evals:0 #comp_moves:1 #backtracks:0 #weight_updates:0)
#8       0.37s best:1268  next:[180,1267] no_lp (fixed_bools=0/131)
#9       0.38s best:1246  next:[180,1245] quick_restart_no_lp (fixed_bools=0/111)
#10      0.38s best:1245  next:[180,1244] violation_ls(batch:3 #solutions_imported:3 #lin_moves:99 #lin_evals:550 #gen_moves:9 #gen_evals:0 #comp_moves:9 #backtracks:0 #weight_updates:84)
#11      0.38s best:1244  next:[180,1243] violation_ls(batch:2 #solutions_imported:2 #lin_moves:20 #lin_evals:114 #gen_moves:11 #gen_evals:0 #comp_moves:5 #backtracks:3 #weight_updates:11)
#12      0.39s best:1237  next:[180,1236] quick_restart_no_lp (fixed_bools=0/122)
#13      0.39s best:1222  next:[180,1221] quick_restart_no_lp (fixed_bools=0/123)
#14      0.39s best:1221  next:[180,1220] quick_restart_no_lp (fixed_bools=0/124)
#15      0.40s best:1218  next:[180,1217] quick_restart_no_lp (fixed_bools=0/130)
#16      0.41s best:1214  next:[180,1213] rnd_var_lns (d=0.88 s=102 t=0.10 p=1.00 stall=3 h=auto_l0)
#17      0.42s best:1213  next:[180,1212] violation_ls(batch:3 #solutions_imported:3 #lin_moves:5'201 #lin_evals:26'424 #gen_moves:1 #gen_evals:0 #comp_moves:1 #backtracks:0 #weight_updates:5'128)
#18      0.42s best:1212  next:[180,1211] violation_ls(batch:4 #solutions_imported:4 #lin_moves:5'202 #lin_evals:26'433 #gen_moves:1 #gen_evals:0 #comp_moves:1 #backtracks:0 #weight_updates:5'128)
#Bound   0.42s best:1212  next:[181,1211] objective_shaving_search_no_lp (vars=208 csts=2257)
#19      0.42s best:1211  next:[181,1210] violation_ls(batch:5 #solutions_imported:5 #lin_moves:5'208 #lin_evals:26'469 #gen_moves:1 #gen_evals:0 #comp_moves:1 #backtracks:0 #weight_updates:5'133)
#20      0.43s best:1210  next:[181,1209] violation_ls(batch:7 #solutions_imported:7 #lin_moves:5'194 #lin_evals:30'027 #gen_moves:1'834 #gen_evals:202 #comp_moves:98 #backtracks:868 #weight_updates:5'143)
#21      0.43s best:1209  next:[181,1208] violation_ls(batch:8 #solutions_imported:8 #lin_moves:5'252 #lin_evals:30'278 #gen_moves:1'834 #gen_evals:202 #comp_moves:98 #backtracks:868 #weight_updates:5'170)
#22      0.43s best:1208  next:[181,1207] violation_ls(batch:9 #solutions_imported:9 #lin_moves:5'252 #lin_evals:30'282 #gen_moves:1'835 #gen_evals:202 #comp_moves:99 #backtracks:868 #weight_updates:5'170)
#23      0.43s best:1192  next:[181,1191] rnd_var_lns (d=0.91 s=114 t=0.10 p=1.00 stall=4 h=auto_l0)
#24      0.45s best:1191  next:[181,1190] violation_ls(batch:5 #solutions_imported:5 #lin_moves:731 #lin_evals:15'006 #gen_moves:5'606 #gen_evals:994 #comp_moves:482 #backtracks:2'562 #weight_updates:283)
#25      0.45s best:1190  next:[181,1189] violation_ls(batch:6 #solutions_imported:6 #lin_moves:785 #lin_evals:15'285 #gen_moves:5'606 #gen_evals:994 #comp_moves:482 #backtracks:2'562 #weight_updates:330)
#26      0.46s best:1189  next:[181,1188] violation_ls(batch:7 #solutions_imported:7 #lin_moves:860 #lin_evals:15'606 #gen_moves:5'606 #gen_evals:994 #comp_moves:482 #backtracks:2'562 #weight_updates:364)
#27      0.46s best:1188  next:[181,1187] violation_ls(batch:8 #solutions_imported:8 #lin_moves:860 #lin_evals:15'641 #gen_moves:5'629 #gen_evals:996 #comp_moves:483 #backtracks:2'573 #weight_updates:364)
#28      0.46s best:1187  next:[181,1186] violation_ls(batch:9 #solutions_imported:9 #lin_moves:901 #lin_evals:15'837 #gen_moves:5'629 #gen_evals:996 #comp_moves:483 #backtracks:2'573 #weight_updates:384)
#29      0.46s best:1186  next:[181,1185] violation_ls(batch:10 #solutions_imported:10 #lin_moves:902 #lin_evals:15'846 #gen_moves:5'629 #gen_evals:996 #comp_moves:483 #backtracks:2'573 #weight_updates:384)
#30      0.47s best:1185  next:[181,1184] violation_ls(batch:11 #solutions_imported:11 #lin_moves:1'122 #lin_evals:16'674 #gen_moves:5'629 #gen_evals:996 #comp_moves:483 #backtracks:2'573 #weight_updates:453)
#31      0.47s best:1184  next:[181,1183] violation_ls(batch:12 #solutions_imported:12 #lin_moves:1'122 #lin_evals:17'889 #gen_moves:6'272 #gen_evals:1'110 #comp_moves:516 #backtracks:2'878 #weight_updates:465)
#32      0.47s best:1183  next:[181,1182] violation_ls(batch:10 #solutions_imported:10 #lin_moves:5'209 #lin_evals:34'008 #gen_moves:3'687 #gen_evals:512 #comp_moves:237 #backtracks:1'725 #weight_updates:5'189)
#Bound   0.48s best:1183  next:[182,1182] objective_shaving_search_no_lp (vars=209 csts=2273)
#33      0.48s best:1182  next:[182,1181] violation_ls(batch:13 #solutions_imported:13 #lin_moves:1'122 #lin_evals:19'930 #gen_moves:7'164 #gen_evals:1'252 #comp_moves:586 #backtracks:3'289 #weight_updates:484)
#34      0.49s best:1146  next:[182,1145] quick_restart_no_lp (fixed_bools=0/155)
#35      0.50s best:1144  next:[182,1143] violation_ls(batch:14 #solutions_imported:14 #lin_moves:5'252 #lin_evals:40'520 #gen_moves:6'922 #gen_evals:902 #comp_moves:368 #backtracks:3'277 #weight_updates:5'254)
#36      0.50s best:1142  next:[182,1141] violation_ls(batch:14 #solutions_imported:14 #lin_moves:1'123 #lin_evals:19'939 #gen_moves:7'164 #gen_evals:1'252 #comp_moves:586 #backtracks:3'289 #weight_updates:484)
#37      0.50s best:1140  next:[182,1139] violation_ls(batch:6 #solutions_imported:6 #lin_moves:24 #lin_evals:19'162 #gen_moves:9'504 #gen_evals:1'156 #comp_moves:317 #backtracks:4'591 #weight_updates:121)
#38      0.50s best:1138  next:[182,1137] violation_ls(batch:7 #solutions_imported:7 #lin_moves:25 #lin_evals:19'171 #gen_moves:9'504 #gen_evals:1'156 #comp_moves:317 #backtracks:4'591 #weight_updates:121)
#39      0.50s best:1136  next:[182,1135] violation_ls(batch:8 #solutions_imported:8 #lin_moves:25 #lin_evals:19'184 #gen_moves:9'511 #gen_evals:1'156 #comp_moves:318 #backtracks:4'594 #weight_updates:121)
#40      0.50s best:1135  next:[182,1134] violation_ls(batch:9 #solutions_imported:9 #lin_moves:26 #lin_evals:19'193 #gen_moves:9'511 #gen_evals:1'156 #comp_moves:318 #backtracks:4'594 #weight_updates:121)
#Bound   0.50s best:1135  next:[183,1134] bool_core (num_cores=6 [cover] a=6 d=3 fixed=30/256 clauses=896)
#41      0.50s best:1134  next:[183,1133] violation_ls(batch:10 #solutions_imported:10 #lin_moves:175 #lin_evals:19'766 #gen_moves:9'511 #gen_evals:1'156 #comp_moves:318 #backtracks:4'594 #weight_updates:180)
#Bound   0.50s best:1134  next:[184,1133] bool_core (num_cores=6 [cover] a=6 d=3 fixed=31/263 clauses=971)
#42      0.50s best:1133  next:[184,1132] violation_ls(batch:11 #solutions_imported:11 #lin_moves:181 #lin_evals:19'796 #gen_moves:9'511 #gen_evals:1'156 #comp_moves:318 #backtracks:4'594 #weight_updates:183)
#43      0.50s best:1132  next:[184,1131] violation_ls(batch:12 #solutions_imported:12 #lin_moves:201 #lin_evals:19'910 #gen_moves:9'511 #gen_evals:1'156 #comp_moves:318 #backtracks:4'594 #weight_updates:201)
#Bound   0.50s best:1132  next:[185,1131] bool_core (num_cores=6 [cover] a=6 d=3 fixed=32/270 clauses=1'049)
#44      0.50s best:1131  next:[185,1130] violation_ls(batch:13 #solutions_imported:13 #lin_moves:225 #lin_evals:20'017 #gen_moves:9'511 #gen_evals:1'156 #comp_moves:318 #backtracks:4'594 #weight_updates:213)
#45      0.51s best:1130  next:[185,1129] violation_ls(batch:14 #solutions_imported:14 #lin_moves:233 #lin_evals:20'065 #gen_moves:9'511 #gen_evals:1'156 #comp_moves:318 #backtracks:4'594 #weight_updates:220)
#Bound   0.51s best:1130  next:[186,1129] bool_core (num_cores=6 [cover] a=6 d=3 fixed=33/277 clauses=1'130)
#Bound   0.51s best:1130  next:[187,1129] bool_core (num_cores=6 [cover] a=6 d=3 fixed=34/284 clauses=1'214)
#46      0.51s best:1126  next:[187,1125] quick_restart_no_lp (fixed_bools=0/178)
#Bound   0.52s best:1126  next:[188,1125] bool_core (num_cores=6 [cover] a=6 d=3 fixed=35/291 clauses=1'301)
#47      0.52s best:1028  next:[188,1027] rins_pump_lns (d=0.71 s=174 t=0.10 p=1.00 stall=0 h=auto_l0)
#Bound   0.53s best:1028  next:[189,1027] objective_lb_search_no_lp
#Bound   0.53s best:1028  next:[230,1027] objective_lb_search_no_lp
#Bound   0.53s best:1028  next:[242,1027] objective_lb_search_no_lp
#Bound   0.54s best:1028  next:[245,1027] objective_lb_search_no_lp
#Bound   0.54s best:1028  next:[249,1027] objective_lb_search_no_lp
#Bound   0.55s best:1028  next:[326,1027] objective_lb_search_no_lp
#Bound   0.57s best:1028  next:[331,1027] objective_lb_search_no_lp
#48      0.62s best:1027  next:[331,1026] violation_ls(batch:7 #solutions_imported:6 #lin_moves:532 #lin_evals:37'571 #gen_moves:17'090 #gen_evals:2'563 #comp_moves:577 #backtracks:8'250 #weight_updates:422)
#49      0.63s best:1025  next:[331,1024] violation_ls(batch:8 #solutions_imported:7 #lin_moves:532 #lin_evals:37'622 #gen_moves:17'117 #gen_evals:2'567 #comp_moves:578 #backtracks:8'263 #weight_updates:422)
#50      0.63s best:1023  next:[331,1022] violation_ls(batch:15 #solutions_imported:15 #lin_moves:1'123 #lin_evals:19'958 #gen_moves:7'175 #gen_evals:1'252 #comp_moves:587 #backtracks:3'294 #weight_updates:484)
#51      0.63s best:1021  next:[331,1020] violation_ls(batch:15 #solutions_imported:15 #lin_moves:10'176 #lin_evals:76'539 #gen_moves:11'171 #gen_evals:1'623 #comp_moves:723 #backtracks:5'224 #weight_updates:10'321)
#52      0.63s best:1019  next:[331,1018] violation_ls(batch:10 #solutions_imported:9 #lin_moves:533 #lin_evals:37'635 #gen_moves:17'118 #gen_evals:2'567 #comp_moves:579 #backtracks:8'263 #weight_updates:422)
#53      0.63s best:1017  next:[331,1016] violation_ls(batch:11 #solutions_imported:10 #lin_moves:533 #lin_evals:37'652 #gen_moves:17'127 #gen_evals:2'569 #comp_moves:580 #backtracks:8'267 #weight_updates:422)
#54      0.63s best:1015  next:[331,1014] violation_ls(batch:12 #solutions_imported:11 #lin_moves:534 #lin_evals:37'661 #gen_moves:17'127 #gen_evals:2'569 #comp_moves:580 #backtracks:8'267 #weight_updates:422)
#55      0.63s best:1014  next:[331,1013] violation_ls(batch:13 #solutions_imported:12 #lin_moves:534 #lin_evals:37'682 #gen_moves:17'139 #gen_evals:2'571 #comp_moves:584 #backtracks:8'271 #weight_updates:422)
#56      0.63s best:1013  next:[331,1012] violation_ls(batch:14 #solutions_imported:13 #lin_moves:534 #lin_evals:37'705 #gen_moves:17'151 #gen_evals:2'573 #comp_moves:588 #backtracks:8'275 #weight_updates:422)
#57      0.63s best:1012  next:[331,1011] violation_ls(batch:15 #solutions_imported:14 #lin_moves:534 #lin_evals:37'767 #gen_moves:17'185 #gen_evals:2'576 #comp_moves:592 #backtracks:8'290 #weight_updates:422)
#58      0.68s best:1011  next:[331,1010] violation_ls(batch:16 #solutions_imported:16 #lin_moves:10'248 #lin_evals:66'917 #gen_moves:6'922 #gen_evals:902 #comp_moves:368 #backtracks:3'277 #weight_updates:10'286)
#59      0.68s best:1010  next:[331,1009] violation_ls(batch:16 #solutions_imported:16 #lin_moves:1'127 #lin_evals:19'982 #gen_moves:7'175 #gen_evals:1'252 #comp_moves:587 #backtracks:3'294 #weight_updates:487)
#60      0.69s best:1009  next:[331,1008] violation_ls(batch:16 #solutions_imported:16 #lin_moves:255 #lin_evals:20'204 #gen_moves:9'515 #gen_evals:1'156 #comp_moves:322 #backtracks:4'594 #weight_updates:241)
#61      0.69s best:1008  next:[331,1007] violation_ls(batch:16 #solutions_imported:16 #lin_moves:10'180 #lin_evals:76'565 #gen_moves:11'171 #gen_evals:1'623 #comp_moves:723 #backtracks:5'224 #weight_updates:10'324)
#62      0.69s best:1007  next:[331,1006] violation_ls(batch:16 #solutions_imported:15 #lin_moves:534 #lin_evals:37'981 #gen_moves:17'295 #gen_evals:2'596 #comp_moves:596 #backtracks:8'343 #weight_updates:422)
#63      0.70s best:1006  next:[331,1005] quick_restart_no_lp (fixed_bools=0/251)
#64      0.72s best:1003  next:[331,1002] quick_restart_no_lp (fixed_bools=0/265)
#65      0.74s best:982   next:[331,981]  quick_restart_no_lp (fixed_bools=0/269)
#66      0.77s best:966   next:[331,965]  quick_restart_no_lp (fixed_bools=0/272)
#67      0.78s best:965   next:[331,964]  quick_restart_no_lp (fixed_bools=0/275)
#68      0.79s best:964   next:[331,963]  quick_restart_no_lp (fixed_bools=0/275)
#69      0.82s best:902   next:[331,901]  quick_restart_no_lp (fixed_bools=0/286)
#70      0.84s best:881   next:[331,880]  quick_restart_no_lp (fixed_bools=0/290)
#71      0.86s best:879   next:[331,878]  violation_ls(batch:17 #solutions_imported:17 #lin_moves:10'249 #lin_evals:66'926 #gen_moves:6'922 #gen_evals:902 #comp_moves:368 #backtracks:3'277 #weight_updates:10'286)
#72      0.86s best:877   next:[331,876]  violation_ls(batch:17 #solutions_imported:17 #lin_moves:1'127 #lin_evals:20'052 #gen_moves:7'210 #gen_evals:1'258 #comp_moves:588 #backtracks:3'311 #weight_updates:487)
#Bound   0.86s best:877   next:[332,876]  objective_shaving_search_no_lp (vars=220 csts=2038)
#73      0.87s best:875   next:[332,874]  violation_ls(batch:17 #solutions_imported:17 #lin_moves:255 #lin_evals:20'229 #gen_moves:9'526 #gen_evals:1'156 #comp_moves:323 #backtracks:4'599 #weight_updates:241)
#74      0.87s best:874   next:[332,873]  violation_ls(batch:17 #solutions_imported:17 #lin_moves:10'181 #lin_evals:76'573 #gen_moves:11'171 #gen_evals:1'623 #comp_moves:723 #backtracks:5'224 #weight_updates:10'324)
#Bound   1.03s best:874   next:[334,873]  objective_lb_search_no_lp
#Bound   1.04s best:874   next:[335,873]  objective_lb_search_no_lp
#Bound   1.06s best:874   next:[381,873]  objective_lb_search_no_lp
#75      1.28s best:873   next:[430,872]  violation_ls(batch:18 #solutions_imported:18 #lin_moves:13'927 #lin_evals:86'639 #gen_moves:6'922 #gen_evals:902 #comp_moves:368 #backtracks:3'277 #weight_updates:13'621)
#76      1.28s best:861   next:[430,860]  quick_restart_no_lp (fixed_bools=2/299)
#77      1.48s best:850   next:[461,849]  quick_restart_no_lp (fixed_bools=2/313)
#78      1.54s best:849   next:[495,848]  quick_restart_no_lp (fixed_bools=2/313)
#79      1.81s best:842   next:[525,841]  rins_pump_lns (d=0.91 s=221 t=0.10 p=1.00 stall=1 h=auto_l0)
#80      1.88s best:830   next:[525,829]  graph_var_lns (d=0.99 s=255 t=0.10 p=1.00 stall=2 h=auto_l0)
#81      1.89s best:828   next:[525,827]  violation_ls(batch:19 #solutions_imported:19 #lin_moves:15'259 #lin_evals:102'063 #gen_moves:11'180 #gen_evals:1'626 #comp_moves:724 #backtracks:5'228 #weight_updates:15'246)
#82      1.90s best:826   next:[526,825]  violation_ls(batch:19 #solutions_imported:18 #lin_moves:10'105 #lin_evals:96'781 #gen_moves:24'755 #gen_evals:4'126 #comp_moves:814 #backtracks:11'958 #weight_updates:934)
#83      1.93s best:824   next:[526,823]  violation_ls(batch:20 #solutions_imported:20 #lin_moves:6'164 #lin_evals:65'691 #gen_moves:14'549 #gen_evals:2'576 #comp_moves:1'158 #backtracks:6'694 #weight_updates:5'519)
#84      1.98s best:822   next:[528,821]  violation_ls(batch:20 #solutions_imported:20 #lin_moves:23'435 #lin_evals:131'910 #gen_moves:6'922 #gen_evals:902 #comp_moves:368 #backtracks:3'277 #weight_updates:14'114)
#85      1.98s best:820   next:[528,819]  violation_ls(batch:20 #solutions_imported:19 #lin_moves:10'106 #lin_evals:96'790 #gen_moves:24'755 #gen_evals:4'126 #comp_moves:814 #backtracks:11'958 #weight_updates:934)
#86      2.00s best:818   next:[528,817]  violation_ls(batch:20 #solutions_imported:20 #lin_moves:256 #lin_evals:52'439 #gen_moves:23'589 #gen_evals:4'087 #comp_moves:798 #backtracks:11'389 #weight_updates:408)
#Bound   1.98s best:824   next:[528,823]  objective_lb_search_no_lp [skipped_logs=15]
#87      2.08s best:816   next:[528,815]  violation_ls(batch:21 #solutions_imported:21 #lin_moves:23'435 #lin_evals:131'949 #gen_moves:6'941 #gen_evals:904 #comp_moves:369 #backtracks:3'286 #weight_updates:14'114)
#88      2.08s best:814   next:[528,813]  violation_ls(batch:21 #solutions_imported:21 #lin_moves:6'164 #lin_evals:65'710 #gen_moves:14'560 #gen_evals:2'576 #comp_moves:1'159 #backtracks:6'699 #weight_updates:5'519)
#89      2.08s best:812   next:[528,811]  violation_ls(batch:21 #solutions_imported:21 #lin_moves:256 #lin_evals:52'510 #gen_moves:23'626 #gen_evals:4'092 #comp_moves:799 #backtracks:11'407 #weight_updates:408)
#90      2.09s best:811   next:[528,810]  violation_ls(batch:21 #solutions_imported:21 #lin_moves:15'259 #lin_evals:102'106 #gen_moves:11'200 #gen_evals:1'628 #comp_moves:726 #backtracks:5'237 #weight_updates:15'246)
#Bound   2.94s best:811   next:[532,810]  objective_lb_search [skipped_logs=1]
#Bound   3.86s best:811   next:[543,810]  objective_lb_search [skipped_logs=5]
#Bound   4.96s best:811   next:[545,810]  objective_lb_search [skipped_logs=1]
#Bound   5.97s best:811   next:[548,810]  objective_lb_search_no_lp [skipped_logs=1]
#Bound   6.46s best:811   next:[551,810]  objective_lb_search_max_lp [skipped_logs=0]
#Bound   8.07s best:811   next:[552,810]  objective_shaving_search_no_lp (vars=220 csts=2038)
#Bound   9.01s best:811   next:[553,810]  objective_lb_search_no_lp
#Bound  10.18s best:811   next:[555,810]  objective_lb_search_no_lp
#Bound  10.56s best:811   next:[557,810]  objective_lb_search_no_lp [skipped_logs=0]
#Bound  11.89s best:811   next:[559,810]  objective_lb_search_no_lp [skipped_logs=1]
#Bound  12.97s best:811   next:[562,810]  objective_lb_search_no_lp [skipped_logs=1]
#Bound  13.91s best:811   next:[571,810]  objective_lb_search_no_lp [skipped_logs=0]
#Bound  14.20s best:811   next:[574,810]  objective_lb_search_no_lp [skipped_logs=0]
#Bound  15.84s best:811   next:[577,810]  objective_lb_search_no_lp [skipped_logs=0]
#Bound  18.06s best:811   next:[578,810]  objective_shaving_search_no_lp (vars=220 csts=2038)
#Bound  19.06s best:811   next:[579,810]  objective_lb_search_no_lp
#Bound  19.29s best:811   next:[580,810]  objective_lb_search_no_lp
#Bound  20.31s best:811   next:[581,810]  objective_lb_search_no_lp
#Bound  20.92s best:811   next:[583,810]  objective_lb_search_no_lp [skipped_logs=0]
#Bound  21.28s best:811   next:[589,810]  objective_lb_search_no_lp [skipped_logs=0]
#Bound  22.95s best:811   next:[590,810]  objective_lb_search_no_lp [skipped_logs=0]
#Bound  25.64s best:811   next:[591,810]  objective_lb_search_no_lp
#Bound  29.36s best:811   next:[592,810]  objective_shaving_search_no_lp (vars=220 csts=2038)
#Bound  31.82s best:811   next:[594,810]  objective_lb_search_no_lp
#Bound  32.17s best:811   next:[596,810]  objective_lb_search_no_lp
#Bound  32.73s best:811   next:[597,810]  objective_lb_search_no_lp
#Bound  33.08s best:811   next:[598,810]  objective_lb_search_no_lp
#Bound  34.25s best:811   next:[599,810]  objective_lb_search_no_lp
#Bound  35.86s best:811   next:[601,810]  objective_lb_search_no_lp
#Bound  36.78s best:811   next:[603,810]  objective_lb_search_no_lp
#Bound  40.34s best:811   next:[604,810]  objective_lb_search
#Bound  42.57s best:811   next:[606,810]  objective_lb_search_no_lp
#Bound  44.09s best:811   next:[608,810]  objective_lb_search_no_lp
#Bound  46.47s best:811   next:[610,810]  objective_lb_search_no_lp
#Bound  49.82s best:811   next:[612,810]  objective_lb_search
#Bound  51.90s best:811   next:[613,810]  objective_lb_search_no_lp
#Bound  53.68s best:811   next:[614,810]  objective_lb_search_no_lp
#Bound  54.53s best:811   next:[615,810]  objective_lb_search_no_lp
#Bound  56.12s best:811   next:[619,810]  objective_lb_search_no_lp
#Bound  56.74s best:811   next:[620,810]  objective_lb_search_no_lp
#Bound  57.72s best:811   next:[624,810]  objective_lb_search_no_lp
#Bound  58.93s best:811   next:[625,810]  objective_lb_search_no_lp
#Bound  59.64s best:811   next:[627,810]  objective_lb_search_no_lp
#Bound  61.96s best:811   next:[628,810]  objective_lb_search_no_lp
#Bound  63.99s best:811   next:[629,810]  objective_lb_search_no_lp
#Bound  67.52s best:811   next:[630,810]  objective_lb_search_no_lp
#Bound  70.38s best:811   next:[631,810]  objective_lb_search_no_lp
#Bound  75.32s best:811   next:[632,810]  objective_lb_search
#Bound  76.67s best:811   next:[635,810]  objective_lb_search_no_lp
#Bound  76.99s best:811   next:[639,810]  objective_lb_search_no_lp
#Bound  77.45s best:811   next:[653,810]  objective_lb_search_no_lp
#Bound  78.57s best:811   next:[654,810]  objective_lb_search_no_lp
#Bound  79.16s best:811   next:[655,810]  objective_lb_search_no_lp
#Bound  84.08s best:811   next:[656,810]  objective_lb_search_no_lp
#Model  85.51s var:207/208 constraints:2015/2254
#Bound  89.79s best:811   next:[657,810]  objective_lb_search_no_lp
#Bound  92.35s best:811   next:[659,810]  objective_lb_search_no_lp
#Bound 100.46s best:811   next:[660,810]  lb_tree_search (nodes=6977/10250 rc=54 decisions=53480 @root=29 restarts=10) 
#Bound 102.77s best:811   next:[661,810]  lb_tree_search (nodes=5558/10309 rc=55 decisions=54185 @root=31 restarts=10) 
#Model 105.51s var:205/208 constraints:1942/2254
#Bound 107.55s best:811   next:[666,810]  objective_lb_search_no_lp
#Bound 109.75s best:811   next:[668,810]  objective_lb_search_no_lp
#Model 109.76s var:204/208 constraints:1913/2254
#Model 110.46s var:203/208 constraints:1894/2254
#Model 110.62s var:199/208 constraints:1810/2254
#Bound 110.63s best:811   next:[671,810]  objective_lb_search_no_lp
#Bound 110.92s best:811   next:[678,810]  objective_lb_search_no_lp
#Bound 111.30s best:811   next:[683,810]  objective_lb_search
#Bound 111.34s best:811   next:[698,810]  objective_lb_search_no_lp
#Bound 111.57s best:811   next:[700,810]  objective_lb_search_no_lp
#Model 111.74s var:198/208 constraints:1745/2254
#Bound 111.77s best:811   next:[701,810]  objective_lb_search_no_lp
#Model 111.83s var:196/208 constraints:1646/2254
#Bound 111.93s best:811   next:[703,810]  objective_lb_search
#Bound 112.00s best:811   next:[717,810]  objective_lb_search_no_lp
#Model 112.00s var:191/208 constraints:1431/2254
#Model 112.01s var:190/208 constraints:1400/2254
#Model 112.01s var:189/208 constraints:1350/2254
#Model 112.03s var:185/208 constraints:1192/2254
#Done  112.07s quick_restart_no_lp
#Model 112.07s var:177/208 constraints:886/2254
#Done  112.07s core
#Done  112.08s probing

Task timing                                  n [     min,      max]      avg      dev     time         n [     min,      max]      avg      dev    dtime
                             'core':         1 [   1.86m,    1.86m]    1.86m   0.00ns    1.86m         1 [   1.22m,    1.22m]    1.22m   0.00ns    1.22m
                       'default_lp':         1 [   1.86m,    1.86m]    1.86m   0.00ns    1.86m         1 [  15.95s,   15.95s]   15.95s   0.00ns   15.95s
                 'feasibility_pump':       470 [ 13.90ms, 532.76ms] 156.55ms  68.08ms    1.23m       469 [  8.10ms,  21.73ms]  12.09ms 485.96us    5.67s
                  'fj_long_default':         1 [ 67.26ms,  67.26ms]  67.26ms   0.00ns  67.26ms         1 [ 23.91ms,  23.91ms]  23.91ms   0.00ns  23.91ms
                  'fj_long_default':         1 [ 76.15ms,  76.15ms]  76.15ms   0.00ns  76.15ms         1 [ 27.93ms,  27.93ms]  27.93ms   0.00ns  27.93ms
              'fj_long_lin_default':         1 [114.24ms, 114.24ms] 114.24ms   0.00ns 114.24ms         1 [ 76.55ms,  76.55ms]  76.55ms   0.00ns  76.55ms
              'fj_long_lin_perturb':         1 [ 83.67ms,  83.67ms]  83.67ms   0.00ns  83.67ms         1 [ 37.41ms,  37.41ms]  37.41ms   0.00ns  37.41ms
               'fj_long_lin_random':         1 [ 86.60ms,  86.60ms]  86.60ms   0.00ns  86.60ms         1 [ 38.34ms,  38.34ms]  38.34ms   0.00ns  38.34ms
                  'fj_long_perturb':         1 [116.09ms, 116.09ms] 116.09ms   0.00ns 116.09ms         1 [ 74.55ms,  74.55ms]  74.55ms   0.00ns  74.55ms
                   'fj_long_random':         1 [ 75.63ms,  75.63ms]  75.63ms   0.00ns  75.63ms         1 [ 28.00ms,  28.00ms]  28.00ms   0.00ns  28.00ms
                 'fj_short_default':         1 [ 77.77ms,  77.77ms]  77.77ms   0.00ns  77.77ms         1 [ 34.35ms,  34.35ms]  34.35ms   0.00ns  34.35ms
                 'fj_short_default':         1 [101.69ms, 101.69ms] 101.69ms   0.00ns 101.69ms         1 [ 76.58ms,  76.58ms]  76.58ms   0.00ns  76.58ms
             'fj_short_lin_default':         1 [114.13ms, 114.13ms] 114.13ms   0.00ns 114.13ms         1 [ 72.82ms,  72.82ms]  72.82ms   0.00ns  72.82ms
             'fj_short_lin_default':         1 [117.26ms, 117.26ms] 117.26ms   0.00ns 117.26ms         1 [ 74.15ms,  74.15ms]  74.15ms   0.00ns  74.15ms
             'fj_short_lin_perturb':         1 [ 65.30ms,  65.30ms]  65.30ms   0.00ns  65.30ms         1 [ 23.78ms,  23.78ms]  23.78ms   0.00ns  23.78ms
              'fj_short_lin_random':         1 [118.09ms, 118.09ms] 118.09ms   0.00ns 118.09ms         1 [ 75.69ms,  75.69ms]  75.69ms   0.00ns  75.69ms
                 'fj_short_perturb':         1 [ 72.71ms,  72.71ms]  72.71ms   0.00ns  72.71ms         1 [ 27.40ms,  27.40ms]  27.40ms   0.00ns  27.40ms
                  'fj_short_random':         1 [114.97ms, 114.97ms] 114.97ms   0.00ns 114.97ms         1 [ 75.07ms,  75.07ms]  75.07ms   0.00ns  75.07ms
                        'fs_random':         1 [ 44.57ms,  44.57ms]  44.57ms   0.00ns  44.57ms         1 [  2.39us,   2.39us]   2.39us   0.00ns   2.39us
                        'fs_random':         1 [ 45.44ms,  45.44ms]  45.44ms   0.00ns  45.44ms         1 [  2.39us,   2.39us]   2.39us   0.00ns   2.39us
                        'fs_random':         1 [ 46.15ms,  46.15ms]  46.15ms   0.00ns  46.15ms         1 [  2.39us,   2.39us]   2.39us   0.00ns   2.39us
                        'fs_random':         1 [ 50.34ms,  50.34ms]  50.34ms   0.00ns  50.34ms         1 [  2.39us,   2.39us]   2.39us   0.00ns   2.39us
                  'fs_random_no_lp':         1 [ 40.60ms,  40.60ms]  40.60ms   0.00ns  40.60ms         1 [402.83us, 402.83us] 402.83us   0.00ns 402.83us
                  'fs_random_no_lp':         1 [ 41.92ms,  41.92ms]  41.92ms   0.00ns  41.92ms         1 [527.90us, 527.90us] 527.90us   0.00ns 527.90us
                  'fs_random_no_lp':         1 [ 43.12ms,  43.12ms]  43.12ms   0.00ns  43.12ms         1 [346.34us, 346.34us] 346.34us   0.00ns 346.34us
                  'fs_random_no_lp':         1 [ 49.01ms,  49.01ms]  49.01ms   0.00ns  49.01ms         1 [646.32us, 646.32us] 646.32us   0.00ns 646.32us
          'fs_random_quick_restart':         1 [ 43.44ms,  43.44ms]  43.44ms   0.00ns  43.44ms         1 [  2.39us,   2.39us]   2.39us   0.00ns   2.39us
          'fs_random_quick_restart':         1 [ 45.10ms,  45.10ms]  45.10ms   0.00ns  45.10ms         1 [  2.39us,   2.39us]   2.39us   0.00ns   2.39us
          'fs_random_quick_restart':         1 [ 46.69ms,  46.69ms]  46.69ms   0.00ns  46.69ms         1 [  2.39us,   2.39us]   2.39us   0.00ns   2.39us
          'fs_random_quick_restart':         1 [ 49.27ms,  49.27ms]  49.27ms   0.00ns  49.27ms         1 [  2.39us,   2.39us]   2.39us   0.00ns   2.39us
    'fs_random_quick_restart_no_lp':         1 [ 41.76ms,  41.76ms]  41.76ms   0.00ns  41.76ms         1 [378.44us, 378.44us] 378.44us   0.00ns 378.44us
    'fs_random_quick_restart_no_lp':         1 [ 45.47ms,  45.47ms]  45.47ms   0.00ns  45.47ms         1 [307.25us, 307.25us] 307.25us   0.00ns 307.25us
    'fs_random_quick_restart_no_lp':         1 [ 45.74ms,  45.74ms]  45.74ms   0.00ns  45.74ms         1 [299.53us, 299.53us] 299.53us   0.00ns 299.53us
                    'graph_arc_lns':       470 [  5.37ms,    2.76s]    1.04s 638.28ms    8.14m       463 [ 10.00ns, 202.67ms]  69.76ms  44.47ms   32.30s
                    'graph_cst_lns':       470 [  1.81ms,    3.04s] 671.43ms 695.30ms    5.26m       322 [ 10.00ns, 196.24ms]  65.63ms  44.64ms   21.13s
                    'graph_dec_lns':       470 [  5.24ms,    3.04s] 984.95ms 691.02ms    7.72m       460 [ 10.00ns, 118.28ms]  65.24ms  45.36ms   30.01s
                    'graph_var_lns':       470 [  4.75ms,    2.69s]    1.01s 629.34ms    7.89m       464 [ 10.00ns, 126.92ms]  68.96ms  43.88ms   32.00s
                   'lb_tree_search':         1 [   1.86m,    1.86m]    1.86m   0.00ns    1.86m         1 [  22.64s,   22.64s]   22.64s   0.00ns   22.64s
                           'max_lp':         1 [   1.86m,    1.86m]    1.86m   0.00ns    1.86m         1 [  19.29s,   19.29s]   19.29s   0.00ns   19.29s
                            'no_lp':         1 [   1.86m,    1.86m]    1.86m   0.00ns    1.86m         1 [  13.36s,   13.36s]   13.36s   0.00ns   13.36s
              'objective_lb_search':         1 [   1.86m,    1.86m]    1.86m   0.00ns    1.86m         1 [  16.25s,   16.25s]   16.25s   0.00ns   16.25s
       'objective_lb_search_max_lp':         1 [   1.86m,    1.86m]    1.86m   0.00ns    1.86m         1 [  26.54s,   26.54s]   26.54s   0.00ns   26.54s
        'objective_lb_search_no_lp':         1 [   1.86m,    1.86m]    1.86m   0.00ns    1.86m         1 [  10.79s,   10.79s]   10.79s   0.00ns   10.79s
  'objective_shaving_search_max_lp':        98 [ 14.01ms,    8.10s]    1.13s    1.44s    1.85m        75 [489.20us, 849.48ms] 142.20ms 171.47ms   10.67s
   'objective_shaving_search_no_lp':        98 [  2.90ms,    8.10s]    1.13s    1.44s    1.85m        75 [955.98us, 755.87ms]  99.64ms 133.87ms    7.47s
                          'probing':         1 [   1.86m,    1.86m]    1.86m   0.00ns    1.86m         1 [   5.81s,    5.81s]    5.81s   0.00ns    5.81s
                   'probing_max_lp':         1 [   1.86m,    1.86m]    1.86m   0.00ns    1.86m         1 [  13.10s,   13.10s]   13.10s   0.00ns   13.10s
                     'pseudo_costs':         1 [   1.86m,    1.86m]    1.86m   0.00ns    1.86m         1 [  19.13s,   19.13s]   19.13s   0.00ns   19.13s
                    'quick_restart':         1 [   1.86m,    1.86m]    1.86m   0.00ns    1.86m         1 [  17.15s,   17.15s]   17.15s   0.00ns   17.15s
              'quick_restart_no_lp':         1 [   1.86m,    1.86m]    1.86m   0.00ns    1.86m         1 [  17.35s,   17.35s]   17.35s   0.00ns   17.35s
                    'reduced_costs':         1 [   1.86m,    1.86m]    1.86m   0.00ns    1.86m         1 [  19.21s,   19.21s]   19.21s   0.00ns   19.21s
                        'rins/rens':       471 [150.18us,    2.81s] 792.26ms 592.23ms    6.22m       409 [ 10.00ns, 200.19ms]  73.92ms  37.73ms   30.23s
                      'rnd_cst_lns':       470 [  9.29ms,    2.99s]    1.01s 648.28ms    7.89m       462 [ 10.00ns, 200.30ms]  68.25ms  45.35ms   31.53s
                      'rnd_var_lns':       470 [  5.09ms,    3.40s]    1.03s 638.98ms    8.07m       460 [ 10.00ns, 200.25ms]  70.65ms  44.42ms   32.50s
                     'violation_ls':       466 [534.61us, 512.05ms] 176.59ms  86.04ms    1.37m       466 [650.00ns, 135.40ms]  71.45ms  18.61ms   33.30s
                     'violation_ls':       468 [411.98us, 598.65ms] 181.45ms  92.56ms    1.42m       468 [460.00ns, 177.46ms]  80.27ms  29.70ms   37.57s
                     'violation_ls':       469 [296.94us, 689.52ms] 192.12ms 102.78ms    1.50m       469 [890.00ns, 212.85ms]  81.56ms  29.86ms   38.25s
                     'violation_ls':       469 [341.47us, 477.72ms] 163.15ms  75.36ms    1.28m       469 [370.00ns, 178.28ms]  75.31ms  25.74ms   35.32s
                     'violation_ls':       470 [346.69us, 519.68ms] 156.43ms  73.69ms    1.23m       470 [890.00ns,  86.74ms]  68.10ms  14.74ms   32.01s

Search stats                        Bools  Conflicts  Branches  Restarts  BoolPropag  IntegerPropag
                           'core':  3'769     51'723   111'673    15'007  61'341'421     24'370'399
                     'default_lp':     70     29'764   135'408    21'714     738'675     20'731'305
                      'fs_random':     70          0       140       140          12          1'994
                      'fs_random':     70          0       140       140          12          1'994
                      'fs_random':     70          0       140       140          12          1'994
                      'fs_random':     70          0       140       140          12          1'994
                'fs_random_no_lp':     70          0       175       140          24          3'396
                'fs_random_no_lp':     70         10       188       140          54          3'622
                'fs_random_no_lp':     70         16       209       140          83          4'626
                'fs_random_no_lp':     70          3       204       140          37          4'002
        'fs_random_quick_restart':     70          0       140       140          12          1'994
        'fs_random_quick_restart':     70          0       140       140          12          1'994
        'fs_random_quick_restart':     70          0       140       140          12          1'994
        'fs_random_quick_restart':     70          0       140       140          12          1'994
  'fs_random_quick_restart_no_lp':     70          0       189       140          14          3'214
  'fs_random_quick_restart_no_lp':     70          0       191       140          28          3'674
  'fs_random_quick_restart_no_lp':     70          0       197       140          14          3'196
                 'lb_tree_search':     70        194   102'592    19'626     173'129      5'203'526
                         'max_lp':     70     16'137   151'044    26'414     686'480     17'809'911
                          'no_lp':    885     75'615   159'163    14'059  17'024'499     41'844'921
            'objective_lb_search':    199     20'308   153'321    28'384   1'152'890     20'966'566
     'objective_lb_search_max_lp':    164     12'030   134'036    34'996     646'311     13'513'525
      'objective_lb_search_no_lp':    421     67'225   150'347    13'905   3'605'431     40'971'662
                        'probing':    346        172     3'696     2'189      20'329        103'507
                 'probing_max_lp':    346        175     1'981     1'330      13'488         69'081
                   'pseudo_costs':    269     17'339   148'138    25'008   1'938'134     17'202'380
                  'quick_restart':     70      7'711   199'813    50'486     577'769     14'133'571
            'quick_restart_no_lp':  2'491     61'908   239'080    17'271  36'699'768     32'100'662
                  'reduced_costs':  3'025     22'574   151'914    17'445  17'943'362     15'449'937

SAT stats                           ClassicMinim  LitRemoved  LitLearned  LitForgotten  Subsumed  MClauses  MDecisions  MLitTrue  MSubsumed  MLitRemoved  MReused
                           'core':        46'265     260'622     382'266        32'533       258     7'071      33'971         0        474        1'699       94
                     'default_lp':        19'812      42'978     342'969        99'791       933     9'812      92'389         0      1'325        9'090    1'569
                      'fs_random':             0           0           0             0         0         0           0         0          0            0        0
                      'fs_random':             0           0           0             0         0         0           0         0          0            0        0
                      'fs_random':             0           0           0             0         0         0           0         0          0            0        0
                      'fs_random':             0           0           0             0         0         0           0         0          0            0        0
                'fs_random_no_lp':             0           0           0             0         0         0           0         0          0            0        0
                'fs_random_no_lp':             0           0          10             0         0         0           0         0          0            0        0
                'fs_random_no_lp':             1           1          73             0         0         0           0         0          0            0        0
                'fs_random_no_lp':             2           2          42             0         0         0           0         0          0            0        0
        'fs_random_quick_restart':             0           0           0             0         0         0           0         0          0            0        0
        'fs_random_quick_restart':             0           0           0             0         0         0           0         0          0            0        0
        'fs_random_quick_restart':             0           0           0             0         0         0           0         0          0            0        0
        'fs_random_quick_restart':             0           0           0             0         0         0           0         0          0            0        0
  'fs_random_quick_restart_no_lp':             0           0           0             0         0         0           0         0          0            0        0
  'fs_random_quick_restart_no_lp':             0           0           0             0         0         0           0         0          0            0        0
  'fs_random_quick_restart_no_lp':             0           0           0             0         0         0           0         0          0            0        0
                 'lb_tree_search':            17          20         896             0         0     7'949      39'500         0         35          146      559
                         'max_lp':        10'485      23'461     190'228        38'841       560    12'433     124'884         0        954        6'316    2'783
                          'no_lp':        65'000     307'752     870'003       411'551       921     7'392      57'647        10      2'965       19'446      977
            'objective_lb_search':        14'698      35'287     173'002         5'796       695    12'645     116'637         1      1'293        8'593    2'320
     'objective_lb_search_max_lp':         7'943      16'909     112'096         7'283       493    12'599      97'557         0        537        3'576    2'140
      'objective_lb_search_no_lp':        60'364     208'365     530'223        65'672       941     7'614      65'058         0      3'174       19'701    1'293
                        'probing':             0           0         172             0         0         0           0         0          0            0        0
                 'probing_max_lp':             0           0         175             0         0         0           0         0          0            0        0
                   'pseudo_costs':        12'142      29'026     196'761        38'796       587    10'942     113'094         1      1'174        7'884    1'887
                  'quick_restart':         4'380       8'693      99'598             0       241    20'798     161'066         0        375        2'123    3'050
            'quick_restart_no_lp':        49'349     237'572     743'882       333'565       709     7'174      57'693        43      3'899       26'541      650
                  'reduced_costs':        14'381      47'004     224'537        48'741       552     9'799      89'035         0      3'676       25'766    2'120

Lp stats                         Component  Iterations  AddedCuts  OPTIMAL  DUAL_F.  DUAL_U.
                  'default_lp':          1     301'939      8'570   42'721        0        0
                   'fs_random':          1          65         78        3        0        0
                   'fs_random':          1          65         93        3        0        0
                   'fs_random':          1          65         93        3        0        0
                   'fs_random':          1          65         94        3        0        0
     'fs_random_quick_restart':          1          65         59        3        0        0
     'fs_random_quick_restart':          1          65         63        3        0        0
     'fs_random_quick_restart':          1          65         74        3        0        0
     'fs_random_quick_restart':          1          65         97        3        0        0
              'lb_tree_search':          1     645'831      7'007   39'353   11'235        0
                      'max_lp':          1     379'960     10'391   24'552    5'969        4
         'objective_lb_search':          1     325'914      6'778   33'089        0        2
  'objective_lb_search_max_lp':          1     500'619      7'137   19'107    6'263        4
                     'probing':          1      73'849     11'533    9'579        0        0
              'probing_max_lp':          1     115'073     10'068    5'176      798        0
                'pseudo_costs':          1     381'039     11'864   25'729    5'884       12
               'quick_restart':          1     252'996      9'171   27'423        0        2
               'reduced_costs':          1     318'914     14'283   28'729    5'677        7

Lp dimension                                                                     Final dimension of first component
                  'default_lp':  328 rows, 199 columns, 1469 entries with magnitude in [3.996309e-04, 1.000000e+00]
                   'fs_random':    65 rows, 199 columns, 272 entries with magnitude in [9.534626e-02, 1.000000e+00]
                   'fs_random':    65 rows, 199 columns, 272 entries with magnitude in [9.534626e-02, 1.000000e+00]
                   'fs_random':    65 rows, 199 columns, 272 entries with magnitude in [9.534626e-02, 1.000000e+00]
                   'fs_random':    66 rows, 199 columns, 276 entries with magnitude in [4.264014e-02, 1.000000e+00]
     'fs_random_quick_restart':    66 rows, 199 columns, 276 entries with magnitude in [4.264014e-02, 1.000000e+00]
     'fs_random_quick_restart':    66 rows, 199 columns, 276 entries with magnitude in [4.264014e-02, 1.000000e+00]
     'fs_random_quick_restart':    66 rows, 199 columns, 276 entries with magnitude in [4.264014e-02, 1.000000e+00]
     'fs_random_quick_restart':    76 rows, 199 columns, 310 entries with magnitude in [4.264014e-02, 1.000000e+00]
              'lb_tree_search':  544 rows, 208 columns, 2078 entries with magnitude in [1.742426e-03, 1.000000e+00]
                      'max_lp':  570 rows, 208 columns, 2312 entries with magnitude in [1.851493e-03, 1.000000e+00]
         'objective_lb_search':  371 rows, 199 columns, 1660 entries with magnitude in [9.357693e-04, 1.000000e+00]
  'objective_lb_search_max_lp':  808 rows, 208 columns, 3377 entries with magnitude in [3.300733e-03, 1.000000e+00]
                     'probing':  628 rows, 199 columns, 3890 entries with magnitude in [1.835023e-05, 1.000000e+00]
              'probing_max_lp':  970 rows, 208 columns, 6059 entries with magnitude in [4.613638e-04, 1.000000e+00]
                'pseudo_costs':  616 rows, 208 columns, 2407 entries with magnitude in [2.858310e-03, 1.000000e+00]
               'quick_restart':  704 rows, 199 columns, 3830 entries with magnitude in [2.580428e-04, 1.000000e+00]
               'reduced_costs':  433 rows, 208 columns, 1673 entries with magnitude in [1.358420e-03, 1.000000e+00]

Lp debug                         CutPropag  CutEqPropag  Adjust  Overflow        Bad  BadScaling
                  'default_lp':         47           12  24'585         0    120'658           0
                   'fs_random':          0            0       0         0         26           0
                   'fs_random':          0            0       0         0         31           0
                   'fs_random':          0            0       0         0         36           0
                   'fs_random':          0            0       0         0         39           0
     'fs_random_quick_restart':          0            0       0         0         10           0
     'fs_random_quick_restart':          0            0       0         0         20           0
     'fs_random_quick_restart':          0            0       0         0         46           0
     'fs_random_quick_restart':          0            0       0         0          5           0
              'lb_tree_search':         25           14  21'315         0     63'091           0
                      'max_lp':         38           11  19'112         0    102'667           0
         'objective_lb_search':         18           61  17'403         0    146'040           0
  'objective_lb_search_max_lp':         32           19  13'610         0    130'077           0
                     'probing':          9          548   9'237         0  2'560'038           0
              'probing_max_lp':         36           92   5'523         0  2'018'216           0
                'pseudo_costs':         51            7  21'989         0    111'138           0
               'quick_restart':         26           48  19'267         0    267'396           0
               'reduced_costs':         50           41  15'681         0    118'929           0

Lp pool                          Constraints  Updates  Simplif  Merged  Shortened   Split  Strenghtened      Cuts/Call
                  'default_lp':        8'684    1'088   66'760      99      4'673  11'697         7'600   8'570/28'584
                   'fs_random':          291        0        0       0          0       0             7         78/114
                   'fs_random':          306        0        0       0          0       0             7         93/136
                   'fs_random':          306        0        0       0          0       0             7         93/136
                   'fs_random':          307        0        0       0          0       0             7         94/139
     'fs_random_quick_restart':          272        0        0       0          0       0             6          59/73
     'fs_random_quick_restart':          276        0        0       0          0       0             6          63/73
     'fs_random_quick_restart':          287        0        0       0          0       0             6         74/103
     'fs_random_quick_restart':          310        0        0       0          0       0             7         97/142
              'lb_tree_search':        9'187      698   40'583      72      1'219   1'314        49'291   7'007/23'974
                      'max_lp':       11'536      798   79'414     107      2'184   6'494        53'659  10'391/27'500
         'objective_lb_search':        6'968    1'475   87'353      23      6'581  16'071         9'394   6'778/22'704
  'objective_lb_search_max_lp':        9'364    1'037  120'836      25      4'994   5'264        67'470   7'137/20'859
                     'probing':        9'735    3'127   73'266      11      1'186  27'096         4'513  11'533/24'425
              'probing_max_lp':       11'287    1'471   69'649      33      1'429  10'269        34'337  10'068/24'278
                'pseudo_costs':       11'969      997  161'514     147     11'812   5'288        75'148  11'864/30'569
               'quick_restart':        9'351    1'629  210'490      33      5'440  44'820        12'372   9'171/27'277
               'reduced_costs':       11'380      991  105'875     155      7'461   7'578        67'538  14'283/37'306

Lp Cut            fs_ran  fs_ran  fs_ran  fs_ran  fs_ran  fs_ran  fs_ran  fs_ran  defaul  max_lp  quick_  reduce  pseudo  lb_tre  probin  object  probin  object
          CG_FF:       2       -       -       -       -       -       -       -     564     537     473     790     632     303     498     336     231     263
           CG_K:       2       -       -       -       -       -       -       -     379     341     269     586     491     183     250     173     110     203
           CG_R:       1       -       -       -       -       -       -       -     652     423     687     790     628     296   1'217     411     258     195
          CG_RB:       -       -       -       -       -       -       -       -   1'485   1'668   1'575   2'196   1'905   1'376   2'096   1'287   1'081   1'064
         CG_RBP:       -       -       -       -       -       -       -       -     149     169     258     329     251     120     281      99      72      57
         Clique:       -       -       -       -       -       -       -       -       -      51       -      93      65      58       -       -      40      72
             IB:      50      50      50      50      50      50      50      50     565     443     674     717     563     415     657     474     390     398
       MIR_1_FF:      24      23      23       7      23      14      17       7     370     486     319     640     486     319     409     283     361     318
        MIR_1_K:       3       3       3       2       3       1       2       -      61      93      26     142     111      38      30      29      38      49
       MIR_1_KL:       -       -       -       -       -       -       -       -       1       -       3       1       -       -       4       -       2       -
        MIR_1_R:       8       7       8       3       8       3       5       2     108      96     103     143     103      37     128      62      60      51
       MIR_1_RB:       3       3       3       1       2       2       2       -     582     876     638   1'219     925     621     687     517     797     694
      MIR_1_RBP:       -       -       -       -       -       -       -       -      56     179      44     207     180     135      39      25      88      76
      MIR_1_RLT:       -       -       -       -       -       -       -       -       -       7       -       2       1       4       -       -       4       -
       MIR_2_FF:       3       4       4       -       5       3       1       -     248     326     264     394     364     197     359     201     217     217
        MIR_2_K:       1       2       1       -       2       1       -       -      39      77      36     108      92      27      37      37      33      44
       MIR_2_KL:       -       -       -       -       -       -       -       -       6       2       3       9       8       -       8       2       1       6
        MIR_2_R:       -       1       1       -       1       -       -       -     140     190     130     235     196     108     317     110     177     126
       MIR_2_RB:       -       -       -       -       -       -       1       -     420     558     437     760     620     335     583     315     487     400
      MIR_2_RBP:       -       -       -       -       -       -       -       -      59     142      49     163     149      96      59      41      68      72
       MIR_3_FF:       -       -       -       -       -       -       -       -     136     224     156     251     223     114     181     114     144     145
        MIR_3_K:       -       -       -       -       -       -       -       -      31      81      30     114      87      32      33      23      45      38
       MIR_3_KL:       -       -       -       -       -       -       -       -       1       4       2       2       1       -       3       1       3       2
        MIR_3_R:       -       -       -       -       -       -       -       -     115     158     114     179     194      71     183      90     134     129
       MIR_3_RB:       -       -       -       -       -       -       -       -     273     372     345     491     477     208     445     232     296     268
      MIR_3_RBP:       -       -       -       -       -       -       -       -      43      88      27      88     105      53      30      19      37      49
       MIR_4_FF:       -       -       -       -       -       -       -       -     102     133      69     146     139      76     102      77     101      88
        MIR_4_K:       -       -       -       -       -       -       -       -      30      50      11      58      57      27      23      17      13      29
       MIR_4_KL:       -       -       -       -       -       -       -       -       1       2       1       2       1       -       2       2       1       -
        MIR_4_R:       -       -       -       -       -       -       -       -      88     119      61     131     155      69     114      61      88      77
       MIR_4_RB:       -       -       -       -       -       -       -       -     193     217     197     283     291     122     257     148     136     173
      MIR_4_RBP:       -       -       -       -       -       -       -       -      34      60      33      60      60      31      34      21      24      20
       MIR_5_FF:       -       -       -       -       -       -       -       -      75      91      62     112      96      57      75      65      55      63
        MIR_5_K:       -       -       -       -       -       -       -       -      34      37      21      43      56      29      28      21      22      14
       MIR_5_KL:       -       -       -       -       -       -       -       -       -       -       2       -       2       1       2       -       -       -
        MIR_5_R:       -       -       -       -       -       -       -       -      74      77      51     103      98      46      79      36      43      51
       MIR_5_RB:       -       -       -       -       -       -       -       -     133     129     110     161     172      93     153      91      81      77
      MIR_5_RBP:       -       -       -       -       -       -       -       -      22      26       9      33      34      19      13      10       8      11
       MIR_6_FF:       -       -       -       -       -       -       -       -      43      56      50      73      60      40      57      43      31      28
        MIR_6_K:       -       -       -       -       -       -       -       -      25      31      23      26      32      13      15      22      14      18
       MIR_6_KL:       -       -       -       -       -       -       -       -       -       -       -       1       -       -       -       -       -       -
        MIR_6_R:       -       -       -       -       -       -       -       -      43      37      31      66      56      19      35      38      30      17
       MIR_6_RB:       -       -       -       -       -       -       -       -      68      68      62     103      90      49      72      55      52      29
      MIR_6_RBP:       -       -       -       -       -       -       -       -       9      26       2      15      17      10       8      11       4       5
   ZERO_HALF_FF:       -       -       -       -       -       -       -       -      86     153      97     173     131     103      95      79      63      85
    ZERO_HALF_K:       -       -       -       -       -       -       -       -      30      43      19      82      64       9       8       6      13      26
   ZERO_HALF_KL:       -       -       -       -       -       -       -       -       -       -       -       -       -       -       -       -       1       -
    ZERO_HALF_R:       -       -       -       -       -       -       -       -     754   1'071   1'315   1'421   1'026     750   1'494     865   3'781   1'144
   ZERO_HALF_RB:       -       -       -       -       -       -       -       -     211     316     230     440     301     247     271     203     244     211
  ZERO_HALF_RBP:       -       -       -       -       -       -       -       -      32      58      53     102      69      51      62      26      89      35

LNS stats           Improv/Calls  Closed  Difficulty  TimeLimit
  'graph_arc_lns':        13/469     51%        0.98       0.12
  'graph_cst_lns':         3/327     52%        0.98       0.11
  'graph_dec_lns':        12/468     51%        0.98       0.12
  'graph_var_lns':        14/469     52%        0.99       0.12
      'rins/rens':        41/439     51%        0.85       0.10
    'rnd_cst_lns':         8/467     51%        0.98       0.12
    'rnd_var_lns':        18/469     51%        0.98       0.12

LS stats                   Batches  Restarts   LinMoves   GenMoves  CompoundMoves  WeightUpdates
       'fj_long_default':        1         1      3'072          0              0             90
       'fj_long_default':        1         1      3'272          0              0             93
   'fj_long_lin_default':        1         1          0      2'281            323              1
   'fj_long_lin_perturb':        1         1      3'730          0              0            550
    'fj_long_lin_random':        1         1      4'057          0              0            550
       'fj_long_perturb':        1         1          0      2'791            351              2
        'fj_long_random':        1         1      3'367          0              0             97
      'fj_short_default':        1         1          0      2'589            358              1
      'fj_short_default':        1         1      3'205          0              0            550
  'fj_short_lin_default':        1         1          0      2'780            371              1
  'fj_short_lin_default':        1         1          0      2'885            469              1
  'fj_short_lin_perturb':        1         1      2'492          0              0             76
   'fj_short_lin_random':        1         1          0      2'884            333              1
      'fj_short_perturb':        1         1      3'031          0              0            112
       'fj_short_random':        1         1          0      2'629            350              1
          'violation_ls':      466         0  2'080'567    871'291         70'391        402'620
          'violation_ls':      468         0  1'789'956  1'321'690         41'751        224'212
          'violation_ls':      469         0  2'719'564    688'544         54'749        281'612
          'violation_ls':      469         0    808'065  1'807'121         69'732        226'456
          'violation_ls':      470         0    976'324  1'547'328         92'492         37'059

Solutions (90)                  Num     Rank
              'graph_var_lns':    1  [80,80]
                      'no_lp':    3    [1,8]
  'objective_lb_search_no_lp':    1    [3,3]
        'quick_restart_no_lp':   18   [9,78]
              'rins_pump_lns':    2  [47,79]
                'rnd_var_lns':    2  [16,23]
               'violation_ls':   63   [4,90]

Objective bounds                     Num
                       'bool_core':    6
                  'initial_domain':    1
                  'lb_tree_search':    2
             'objective_lb_search':    9
      'objective_lb_search_max_lp':    1
       'objective_lb_search_no_lp':   90
  'objective_shaving_search_no_lp':    7

Solution repositories    Added  Queried  Ignored  Synchro
  'feasible solutions':  3'130    9'295       11    2'986
        'lp solutions':    895      199        0      801
                'pump':  9'834      271

Improving bounds shared            Num
                        'core':     72
                  'default_lp':     90
              'lb_tree_search':     38
                      'max_lp':     93
                       'no_lp':     19
         'objective_lb_search':    201
  'objective_lb_search_max_lp':     38
                     'probing':    435
              'probing_max_lp':    206
                'pseudo_costs':     73
               'quick_restart':    130
         'quick_restart_no_lp':  1'045
               'reduced_costs':    116

Clauses shared                   Num
                  'default_lp':    8
             'fs_random_no_lp':    2
              'lb_tree_search':    4
                      'max_lp':   10
                       'no_lp':   19
         'objective_lb_search':   69
  'objective_lb_search_max_lp':   17
   'objective_lb_search_no_lp':    1
                'pseudo_costs':   65
               'quick_restart':    9
         'quick_restart_no_lp':   21
               'reduced_costs':   11

CpSolverResponse summary:
status: OPTIMAL
objective: 811
best_bound: 811
integers: 200
booleans: 70
conflicts: 0
branches: 140
propagations: 12
integer_propagations: 1994
restarts: 140
lp_iterations: 65
walltime: 112.153
usertime: 112.153
deterministic_time: 700.761
gap_integral: 2334.49
solution_fingerprint: 0x5aa610ba2ec5d9a3


--- Simulation Gantt  partir du modle mathmatique ---
{'big':1, 'due_date':162, 'pos_time':5, 'status':0, 'blocked':0, 'operations':["{'type':0, 'processing_time':11}", "{'type':1, 'processing_time':27}"]}
{'big':1, 'due_date':78, 'pos_time':5, 'status':0, 'blocked':0, 'operations':["{'type':1, 'processing_time':19}"]}
{'big':0, 'due_date':120, 'pos_time':5, 'status':0, 'blocked':0, 'operations':["{'type':0, 'processing_time':13}"]}
{'big':1, 'due_date':122, 'pos_time':5, 'status':0, 'blocked':0, 'operations':["{'type':1, 'processing_time':56}"]}
{'big':0, 'due_date':111, 'pos_time':5, 'status':0, 'blocked':0, 'operations':["{'type':0, 'processing_time':50}"]}
{'big':0, 'due_date':123, 'pos_time':5, 'status':0, 'blocked':0, 'operations':["{'type':1, 'processing_time':23}", "{'type':0, 'processing_time':24}"]}
{'big':1, 'due_date':125, 'pos_time':5, 'status':0, 'blocked':0, 'operations':["{'type':1, 'processing_time':57}"]}
{'big':1, 'due_date':173, 'pos_time':5, 'status':0, 'blocked':0, 'operations':["{'type':0, 'processing_time':28}", "{'type':1, 'processing_time':44}"]}
