created virtual environment CPython3.12.4.final.0-64 in 6547ms
  creator CPython3Posix(dest=/localscratch/aneumann.63393156.0/env, clear=False, no_vcs_ignore=False, global=False)
  seeder FromAppData(download=False, pip=bundle, via=copy, app_data_dir=/home/aneumann/.local/share/virtualenv)
    added seed packages: pip==25.1.1
  activators BashActivator,CShellActivator,FishActivator,NushellActivator,PowerShellActivator,PythonActivator
Looking in links: /cvmfs/soft.computecanada.ca/custom/python/wheelhouse/gentoo2023/x86-64-v3, /cvmfs/soft.computecanada.ca/custom/python/wheelhouse/gentoo2023/generic, /cvmfs/soft.computecanada.ca/custom/python/wheelhouse/generic
Requirement already satisfied: pip in /localscratch/aneumann.63393156.0/env/lib/python3.12/site-packages (25.1.1)
Looking in links: /cvmfs/soft.computecanada.ca/custom/python/wheelhouse/gentoo2023/x86-64-v3, /cvmfs/soft.computecanada.ca/custom/python/wheelhouse/gentoo2023/generic, /cvmfs/soft.computecanada.ca/custom/python/wheelhouse/generic
ERROR: protobuf-5.28.3-cp38-abi3-manylinux2014_x86_64.whl is not a supported wheel on this platform.
Looking in links: /cvmfs/soft.computecanada.ca/custom/python/wheelhouse/gentoo2023/x86-64-v3, /cvmfs/soft.computecanada.ca/custom/python/wheelhouse/gentoo2023/generic, /cvmfs/soft.computecanada.ca/custom/python/wheelhouse/generic
Processing /home/aneumann/projects/def-adhaj/aneumann/GNRS/wheels/immutabledict-4.2.0-py3-none-any.whl
Installing collected packages: immutabledict
Successfully installed immutabledict-4.2.0
Looking in links: /cvmfs/soft.computecanada.ca/custom/python/wheelhouse/gentoo2023/x86-64-v3, /cvmfs/soft.computecanada.ca/custom/python/wheelhouse/gentoo2023/generic, /cvmfs/soft.computecanada.ca/custom/python/wheelhouse/generic
Processing /cvmfs/soft.computecanada.ca/custom/python/wheelhouse/generic/ortools-9.10.4067+computecanada-cp312-cp312-linux_x86_64.whl (from -r /home/aneumann/projects/def-adhaj/aneumann/GNRS/requirements/or.txt (line 1))
Processing /cvmfs/soft.computecanada.ca/custom/python/wheelhouse/gentoo2023/x86-64-v3/matplotlib-3.10.0+computecanada-cp312-cp312-linux_x86_64.whl (from -r /home/aneumann/projects/def-adhaj/aneumann/GNRS/requirements/or.txt (line 2))
Processing /cvmfs/soft.computecanada.ca/custom/python/wheelhouse/gentoo2023/x86-64-v3/pandas-2.2.3+computecanada-cp312-cp312-linux_x86_64.whl (from -r /home/aneumann/projects/def-adhaj/aneumann/GNRS/requirements/or.txt (line 3))
Processing /cvmfs/soft.computecanada.ca/custom/python/wheelhouse/generic/absl_py-2.2.2+computecanada-py3-none-any.whl (from ortools<9.11,>=9.10->-r /home/aneumann/projects/def-adhaj/aneumann/GNRS/requirements/or.txt (line 1))
Processing /cvmfs/soft.computecanada.ca/custom/python/wheelhouse/gentoo2023/generic/numpy-2.2.2+computecanada-cp312-cp312-linux_x86_64.whl (from ortools<9.11,>=9.10->-r /home/aneumann/projects/def-adhaj/aneumann/GNRS/requirements/or.txt (line 1))
Processing /cvmfs/soft.computecanada.ca/custom/python/wheelhouse/gentoo2023/x86-64-v3/protobuf-6.30.2+computecanada-cp312-cp312-linux_x86_64.whl (from ortools<9.11,>=9.10->-r /home/aneumann/projects/def-adhaj/aneumann/GNRS/requirements/or.txt (line 1))
Requirement already satisfied: immutabledict>=3.0.0 in /localscratch/aneumann.63393156.0/env/lib/python3.12/site-packages (from ortools<9.11,>=9.10->-r /home/aneumann/projects/def-adhaj/aneumann/GNRS/requirements/or.txt (line 1)) (4.2.0)
Processing /cvmfs/soft.computecanada.ca/custom/python/wheelhouse/gentoo2023/generic/contourpy-1.3.1+computecanada-cp312-cp312-linux_x86_64.whl (from matplotlib->-r /home/aneumann/projects/def-adhaj/aneumann/GNRS/requirements/or.txt (line 2))
Processing /cvmfs/soft.computecanada.ca/custom/python/wheelhouse/generic/cycler-0.12.1+computecanada-py3-none-any.whl (from matplotlib->-r /home/aneumann/projects/def-adhaj/aneumann/GNRS/requirements/or.txt (line 2))
Processing /cvmfs/soft.computecanada.ca/custom/python/wheelhouse/generic/fonttools-4.58.2+computecanada-cp312-cp312-linux_x86_64.whl (from matplotlib->-r /home/aneumann/projects/def-adhaj/aneumann/GNRS/requirements/or.txt (line 2))
Processing /cvmfs/soft.computecanada.ca/custom/python/wheelhouse/gentoo2023/x86-64-v3/kiwisolver-1.4.8+computecanada-cp312-cp312-linux_x86_64.whl (from matplotlib->-r /home/aneumann/projects/def-adhaj/aneumann/GNRS/requirements/or.txt (line 2))
Processing /cvmfs/soft.computecanada.ca/custom/python/wheelhouse/generic/packaging-25.0+computecanada-py3-none-any.whl (from matplotlib->-r /home/aneumann/projects/def-adhaj/aneumann/GNRS/requirements/or.txt (line 2))
Processing /cvmfs/soft.computecanada.ca/custom/python/wheelhouse/gentoo2023/x86-64-v3/pillow-11.1.0+computecanada-cp312-cp312-linux_x86_64.whl (from matplotlib->-r /home/aneumann/projects/def-adhaj/aneumann/GNRS/requirements/or.txt (line 2))
Processing /cvmfs/soft.computecanada.ca/custom/python/wheelhouse/generic/pyparsing-3.2.1+computecanada-py3-none-any.whl (from matplotlib->-r /home/aneumann/projects/def-adhaj/aneumann/GNRS/requirements/or.txt (line 2))
Processing /cvmfs/soft.computecanada.ca/custom/python/wheelhouse/generic/python_dateutil-2.9.0.post0+computecanada-py2.py3-none-any.whl (from matplotlib->-r /home/aneumann/projects/def-adhaj/aneumann/GNRS/requirements/or.txt (line 2))
Processing /cvmfs/soft.computecanada.ca/custom/python/wheelhouse/generic/pytz-2025.2+computecanada-py2.py3-none-any.whl (from pandas->-r /home/aneumann/projects/def-adhaj/aneumann/GNRS/requirements/or.txt (line 3))
Processing /cvmfs/soft.computecanada.ca/custom/python/wheelhouse/generic/tzdata-2025.2+computecanada-py2.py3-none-any.whl (from pandas->-r /home/aneumann/projects/def-adhaj/aneumann/GNRS/requirements/or.txt (line 3))
Processing /cvmfs/soft.computecanada.ca/custom/python/wheelhouse/generic/six-1.17.0+computecanada-py2.py3-none-any.whl (from python-dateutil>=2.7->matplotlib->-r /home/aneumann/projects/def-adhaj/aneumann/GNRS/requirements/or.txt (line 2))
Installing collected packages: pytz, tzdata, six, pyparsing, protobuf, pillow, packaging, numpy, kiwisolver, fonttools, cycler, absl-py, python-dateutil, contourpy, pandas, matplotlib, ortools

Successfully installed absl-py-2.2.2+computecanada contourpy-1.3.1+computecanada cycler-0.12.1+computecanada fonttools-4.58.2+computecanada kiwisolver-1.4.8+computecanada matplotlib-3.10.0+computecanada numpy-2.2.2+computecanada ortools-9.10.4067+computecanada packaging-25.0+computecanada pandas-2.2.3+computecanada pillow-11.1.0+computecanada protobuf-6.30.2+computecanada pyparsing-3.2.1+computecanada python-dateutil-2.9.0.post0+computecanada pytz-2025.2+computecanada six-1.17.0+computecanada tzdata-2025.2+computecanada

Starting CP-SAT solver v9.10.4067
Parameters: max_time_in_seconds: 3600 max_memory_in_mb: 12000 log_search_progress: true enumerate_all_solutions: false absolute_gap_limit: 0 relative_gap_limit: 0
Setting number of workers to 48

Initial optimization model '': (model_fingerprint: 0x3f92244736cf8456)
#Variables: 166 (#ints: 6 in objective)
  - 107 Booleans in [0,1]
  - 59 in [0,342]
#kLinear1: 26
#kLinear2: 211
#kLinear3: 79
#kLinearN: 675 (#terms: 6'406)

Starting presolve at 0.00s
  3.54e-04s  0.00e+00d  [DetectDominanceRelations] 
  9.08e-03s  0.00e+00d  [PresolveToFixPoint] #num_loops=6 #num_dual_strengthening=3 
  1.70e-05s  0.00e+00d  [ExtractEncodingFromLinear] #potential_supersets=4 
[Symmetry] Graph for symmetry has 898 nodes and 3'835 arcs.
[Symmetry] Symmetry computation done. time: 0.0005755 dtime: 0.00046268
[Symmetry] #generators: 1, average support size: 18
[Symmetry] The model contains 105 duplicate constraints !
[Symmetry] 9 orbits with sizes: 2,2,2,2,2,2,2,2,2
[Symmetry] Num fixable by intersecting at_most_one with orbits: 1 largest_orbit: 2
  1.82e-03s  1.70e-04d  [Probe] #probed=140 #fixed_bools=2 #new_bounds=5 #equiv=1 
  3.25e-05s  0.00e+00d  [MaxClique] Merged 12(24 literals) into 5(10 literals) at_most_ones. 
  2.49e-04s  0.00e+00d  [DetectDominanceRelations] 
  2.95e-03s  0.00e+00d  [PresolveToFixPoint] #num_loops=2 #num_dual_strengthening=1 
  8.22e-04s  0.00e+00d  [ProcessAtMostOneAndLinear] 
  6.41e-04s  0.00e+00d  [DetectDuplicateConstraints] #duplicates=126 #without_enforcements=41 
  2.36e-04s  8.39e-06d  [DetectDominatedLinearConstraints] #relevant_constraints=338 #num_inclusions=87 #num_redundant=1 
  1.33e-04s  0.00e+00d  [DetectDifferentVariables] #different=21 
  9.17e-05s  2.90e-06d  [ProcessSetPPC] #relevant_constraints=216 
  1.06e-05s  0.00e+00d  [FindAlmostIdenticalLinearConstraints] 
  5.11e-05s  3.13e-05d  [FindBigAtMostOneAndLinearOverlap] 
  5.27e-04s  1.80e-04d  [FindBigVerticalLinearOverlap] #blocks=2 #saved_nz=100 
  4.85e-05s  8.75e-06d  [FindBigHorizontalLinearOverlap] #linears=211 
  5.15e-06s  0.00e+00d  [MergeClauses] 
  2.43e-04s  0.00e+00d  [DetectDominanceRelations] 
  2.72e-03s  0.00e+00d  [PresolveToFixPoint] #num_loops=2 #num_dual_strengthening=1 
  2.34e-04s  0.00e+00d  [DetectDominanceRelations] 
  2.16e-03s  0.00e+00d  [PresolveToFixPoint] #num_loops=1 #num_dual_strengthening=1 
[Symmetry] Graph for symmetry has 750 nodes and 3'239 arcs.
[Symmetry] Symmetry computation done. time: 0.00018407 dtime: 0.00022588
  1.59e-03s  1.64e-04d  [Probe] #probed=136 #new_bounds=9 
  6.21e-06s  0.00e+00d  [MaxClique] 
  2.40e-04s  0.00e+00d  [DetectDominanceRelations] 
  3.63e-03s  0.00e+00d  [PresolveToFixPoint] #num_loops=4 #num_dual_strengthening=3 
  7.68e-04s  0.00e+00d  [ProcessAtMostOneAndLinear] 
  5.06e-04s  0.00e+00d  [DetectDuplicateConstraints] #without_enforcements=44 
  2.27e-04s  7.64e-06d  [DetectDominatedLinearConstraints] #relevant_constraints=333 #num_inclusions=82 
  1.20e-04s  0.00e+00d  [DetectDifferentVariables] #different=21 
  8.85e-05s  2.61e-06d  [ProcessSetPPC] #relevant_constraints=208 
  1.20e-05s  0.00e+00d  [FindAlmostIdenticalLinearConstraints] 
  5.29e-05s  2.95e-05d  [FindBigAtMostOneAndLinearOverlap] 
  5.77e-04s  1.69e-04d  [FindBigVerticalLinearOverlap] #blocks=4 #saved_nz=170 
  4.48e-05s  7.67e-06d  [FindBigHorizontalLinearOverlap] #linears=202 
  5.22e-06s  0.00e+00d  [MergeClauses] 
  2.43e-04s  0.00e+00d  [DetectDominanceRelations] 
  3.23e-03s  0.00e+00d  [PresolveToFixPoint] #num_loops=2 #num_dual_strengthening=1 
  2.39e-04s  0.00e+00d  [DetectDominanceRelations] 
  2.35e-03s  0.00e+00d  [PresolveToFixPoint] #num_loops=1 #num_dual_strengthening=1 
[Symmetry] Graph for symmetry has 755 nodes and 3'066 arcs.
[Symmetry] Symmetry computation done. time: 0.000178161 dtime: 0.00021782
  1.58e-03s  1.62e-04d  [Probe] #probed=136 #new_bounds=1 
  5.41e-06s  0.00e+00d  [MaxClique] 
  2.45e-04s  0.00e+00d  [DetectDominanceRelations] 
  2.82e-03s  0.00e+00d  [PresolveToFixPoint] #num_loops=2 #num_dual_strengthening=1 
  7.21e-04s  0.00e+00d  [ProcessAtMostOneAndLinear] 
  5.02e-04s  0.00e+00d  [DetectDuplicateConstraints] #without_enforcements=47 
  1.76e-04s  6.05e-06d  [DetectDominatedLinearConstraints] #relevant_constraints=301 #num_inclusions=38 
  1.27e-04s  0.00e+00d  [DetectDifferentVariables] #different=23 
  9.07e-05s  2.17e-06d  [ProcessSetPPC] #relevant_constraints=195 
  1.21e-05s  0.00e+00d  [FindAlmostIdenticalLinearConstraints] 
  4.57e-05s  2.65e-05d  [FindBigAtMostOneAndLinearOverlap] 
  4.09e-04s  1.47e-04d  [FindBigVerticalLinearOverlap] #blocks=1 #saved_nz=38 
  4.27e-05s  7.04e-06d  [FindBigHorizontalLinearOverlap] #linears=190 
  4.85e-06s  0.00e+00d  [MergeClauses] 
  2.48e-04s  0.00e+00d  [DetectDominanceRelations] 
  2.70e-03s  0.00e+00d  [PresolveToFixPoint] #num_loops=2 #num_dual_strengthening=1 
  2.73e-05s  0.00e+00d  [ExpandObjective] #entries=34 #tight_variables=15 #tight_constraints=6 

Presolve summary:
  - 25 affine relations were detected.
  - rule 'TODO dual: only one blocking constraint?' was applied 467 times.
  - rule 'TODO dual: only one unspecified blocking constraint?' was applied 78 times.
  - rule 'TODO duplicate: identical constraint with different enforcements' was applied 132 times.
  - rule 'affine: new relation' was applied 25 times.
  - rule 'at_most_one: removed literals' was applied 5 times.
  - rule 'at_most_one: size one' was applied 5 times.
  - rule 'at_most_one: transformed into max clique.' was applied 1 time.
  - rule 'deductions: 79 stored' was applied 1 time.
  - rule 'dual: fix variable' was applied 15 times.
  - rule 'dual: reduced domain' was applied 31 times.
  - rule 'duplicate: merged rhs of linear constraint' was applied 23 times.
  - rule 'duplicate: removed constraint' was applied 126 times.
  - rule 'enforcement: false literal' was applied 10 times.
  - rule 'enforcement: true literal' was applied 8 times.
  - rule 'exactly_one: x and not(x)' was applied 1 time.
  - rule 'incompatible linear: add implication' was applied 18 times.
  - rule 'linear inclusion: redundant containing constraint' was applied 1 time.
  - rule 'linear matrix: common vertical rectangle' was applied 7 times.
  - rule 'linear: always true' was applied 342 times.
  - rule 'linear: doubleton free' was applied 7 times.
  - rule 'linear: empty' was applied 16 times.
  - rule 'linear: extracted enforcement literal' was applied 1'073 times.
  - rule 'linear: fixed or dup variables' was applied 669 times.
  - rule 'linear: positive equal one' was applied 4 times.
  - rule 'linear: reduced variable domains' was applied 68 times.
  - rule 'linear: remapped using affine relations' was applied 611 times.
  - rule 'linear: simplified rhs' was applied 1'786 times.
  - rule 'linear: variable substitution 1' was applied 7 times.
  - rule 'linear: variable substitution 2' was applied 1 time.
  - rule 'linear: variable substitution 3' was applied 1 time.
  - rule 'presolve: 53 unused variables removed.' was applied 1 time.
  - rule 'presolve: iteration' was applied 3 times.
  - rule 'probing: reduced enforced constraint to implication.' was applied 12 times.
  - rule 'symmetry: fixed to false in general orbit' was applied 1 time.

Presolved optimization model '': (model_fingerprint: 0x99bc33e0857b2bd5)
#Variables: 86 (#ints: 6 in objective)
  - 36 Booleans in [0,1]
  - 1 in [-2,303]
  - 1 in [0,219]
  - 1 in [0,234]
  - 3 in [0,237]
  - 1 in [0,268]
  - 1 in [0,279]
  - 3 in [0,295]
  - 3 in [0,299]
  - 3 in [0,305]
  - 3 in [0,306]
  - 1 in [2,239]
  - 1 in [3,240]
  - 1 in [3,298]
  - 1 in [3,302]
  - 1 in [3,308]
  - 1 in [3,309]
  - 1 in [3,309][345,651][687,993][1029,1335]
  - 1 in [21,320]
  - 1 in [38,298][345,640][687,947]
  - 1 in [44,309][345,651][687,970]
  - 2 in [52,331]
  - 1 in [54,291]
  - 1 in [54,291][396,633]
  - 1 in [58,337]
  - 2 in [63,331]
  - 1 in [69,337]
  - 8 in [94,331]
  - 3 in [100,337]
  - 1 in [105,342]
#kExactlyOne: 3 (#literals: 9)
#kLinear2: 186 (#enforced: 152 #multi: 127)
#kLinear3: 59 (#enforced: 52 #multi: 24)
#kLinearN: 209 (#enforced: 135) (#terms: 1'485)

Preloading model.
#Bound   0.05s best:inf   next:[107,1581] initial_domain
[Symmetry] Graph for symmetry has 667 nodes and 3'026 arcs.
[Symmetry] Symmetry computation done. time: 0.00017711 dtime: 0.00020876
#Model   0.05s var:86/86 constraints:457/457

Starting search at 0.05s with 48 workers.
16 full problem subsolvers: [core, default_lp, lb_tree_search, max_lp, no_lp, objective_lb_search, objective_lb_search_max_lp, objective_lb_search_no_lp, objective_shaving_search_max_lp, objective_shaving_search_no_lp, probing, probing_max_lp, pseudo_costs, quick_restart, quick_restart_no_lp, reduced_costs]
30 first solution subsolvers: [fj_long_default(2), fj_long_lin_default, fj_long_lin_perturb, fj_long_lin_random, fj_long_perturb, fj_long_random, fj_short_default(2), fj_short_lin_default(2), fj_short_lin_perturb, fj_short_lin_random, fj_short_perturb, fj_short_random, fs_random(4), fs_random_no_lp(4), fs_random_quick_restart(4), fs_random_quick_restart_no_lp(3)]
13 incomplete subsolvers: [feasibility_pump, graph_arc_lns, graph_cst_lns, graph_dec_lns, graph_var_lns, rins/rens, rnd_cst_lns, rnd_var_lns, violation_ls(5)]
3 helper subsolvers: [neighborhood_helper, synchronization_agent, update_gap_integral]
#1       0.06s best:742   next:[107,741]  no_lp (fixed_bools=0/53)
#Bound   0.06s best:742   next:[108,741]  bool_core (num_cores=1 [size:2 mw:1 d:1] a=5 d=1 fixed=0/42 clauses=4)
#2       0.06s best:726   next:[108,725]  no_lp (fixed_bools=0/64)
#3       0.06s best:654   next:[108,653]  no_lp (fixed_bools=0/69)
#4       0.06s best:653   next:[108,652]  violation_ls(batch:1 #solutions_imported:1 #lin_moves:0 #lin_evals:16 #gen_moves:7 #gen_evals:0 #comp_moves:7 #backtracks:0 #weight_updates:0)
#5       0.06s best:638   next:[108,637]  no_lp (fixed_bools=0/77)
#Bound   0.06s best:638   next:[109,637]  bool_core (num_cores=2 [size:1 mw:1] a=5 d=1 fixed=1/45 clauses=4)
#Bound   0.06s best:638   next:[118,637]  objective_lb_search_no_lp
#Bound   0.06s best:638   next:[121,637]  objective_lb_search_no_lp
#Bound   0.06s best:638   next:[123,637]  objective_lb_search_no_lp
#Bound   0.06s best:638   next:[132,637]  default_lp
#Bound   0.06s best:638   next:[133,637]  objective_lb_search_no_lp
#6       0.06s best:602   next:[133,601]  quick_restart_no_lp (fixed_bools=0/67)
#Bound   0.06s best:602   next:[154,601]  objective_lb_search_no_lp
#Bound   0.06s best:602   next:[155,601]  objective_lb_search_no_lp
#7       0.06s best:569   next:[155,568]  quick_restart_no_lp (fixed_bools=0/73)
#Bound   0.06s best:569   next:[161,568]  objective_lb_search_no_lp
#Bound   0.06s best:569   next:[176,568]  objective_lb_search_no_lp
#8       0.06s best:568   next:[176,567]  violation_ls(batch:1 #solutions_imported:1 #lin_moves:0 #lin_evals:20 #gen_moves:13 #gen_evals:0 #comp_moves:1 #backtracks:6 #weight_updates:0)
#Bound   0.06s best:568   next:[177,567]  objective_lb_search_no_lp
#9       0.06s best:565   next:[177,564]  rnd_var_lns (d=0.50 s=22 t=0.10 p=0.00 stall=0 h=auto_l0) [presolve]
#Bound   0.06s best:565   next:[183,564]  objective_lb_search_no_lp
#Bound   0.06s best:565   next:[185,564]  objective_lb_search_no_lp
#10      0.07s best:552   next:[185,551]  no_lp (fixed_bools=0/102)
#11      0.07s best:550   next:[185,549]  quick_restart_no_lp (fixed_bools=0/110)
#12      0.07s best:546   next:[185,545]  no_lp (fixed_bools=0/108)
#13      0.07s best:506   next:[185,505]  quick_restart_no_lp (fixed_bools=0/136)
#14      0.07s best:505   next:[185,504]  quick_restart_no_lp (fixed_bools=0/139)
#15      0.07s best:485   next:[185,484]  quick_restart_no_lp (fixed_bools=0/141)
#16      0.07s best:480   next:[185,479]  no_lp (fixed_bools=0/115)
#17      0.08s best:478   next:[185,477]  no_lp (fixed_bools=0/122)
#18      0.08s best:476   next:[185,475]  no_lp (fixed_bools=0/124)
#19      0.08s best:472   next:[185,471]  no_lp (fixed_bools=0/128)
#20      0.08s best:455   next:[185,454]  quick_restart_no_lp (fixed_bools=2/159)
#21      0.08s best:454   next:[185,453]  quick_restart_no_lp (fixed_bools=2/159)
#22      0.08s best:451   next:[185,450]  quick_restart_no_lp (fixed_bools=2/160)
#Bound   0.08s best:451   next:[267,450]  objective_lb_search_no_lp
#23      0.08s best:449   next:[267,448]  violation_ls(batch:3 #solutions_imported:3 #lin_moves:1'546 #lin_evals:6'319 #gen_moves:7 #gen_evals:0 #comp_moves:7 #backtracks:0 #weight_updates:294)
#24      0.08s best:432   next:[267,431]  quick_restart_no_lp (fixed_bools=2/166)
#25      0.09s best:419   next:[267,418]  no_lp (fixed_bools=1/147)
#26      0.09s best:411   next:[267,410]  no_lp (fixed_bools=1/153)
#27      0.09s best:383   next:[267,382]  no_lp (fixed_bools=1/156)
#Bound   0.09s best:383   next:[271,382]  objective_lb_search_no_lp
#28      0.12s best:377   next:[271,376]  no_lp (fixed_bools=1/177)
#29      0.14s best:372   next:[271,371]  quick_restart_no_lp (fixed_bools=7/196)
#30      0.14s best:369   next:[271,368]  no_lp (fixed_bools=1/189)
#31      0.14s best:365   next:[271,364]  no_lp (fixed_bools=1/194)
#32      0.14s best:359   next:[271,358]  no_lp (fixed_bools=1/199)
#Bound   0.14s best:359   next:[273,358]  objective_lb_search_no_lp
#Bound   0.15s best:359   next:[275,358]  objective_lb_search_no_lp
#33      0.15s best:344   next:[275,343]  no_lp (fixed_bools=1/203)
#Bound   0.15s best:344   next:[277,343]  objective_lb_search_no_lp
#34      0.15s best:339   next:[277,338]  quick_restart_no_lp (fixed_bools=11/229)
#Bound   0.15s best:339   next:[280,338]  objective_lb_search_no_lp
#35      0.16s best:338   next:[280,337]  violation_ls(batch:3 #solutions_imported:3 #lin_moves:0 #lin_evals:13'217 #gen_moves:8'562 #gen_evals:0 #comp_moves:272 #backtracks:4'145 #weight_updates:44)
#36      0.16s best:337   next:[280,336]  violation_ls(batch:4 #solutions_imported:4 #lin_moves:0 #lin_evals:13'236 #gen_moves:8'573 #gen_evals:0 #comp_moves:273 #backtracks:4'150 #weight_updates:44)
#37      0.16s best:324   next:[293,323]  no_lp (fixed_bools=3/213)
#Model   0.20s var:85/86 constraints:386/457
#Model   0.21s var:84/86 constraints:374/457
#Done    0.23s objective_lb_search_no_lp
#Model   0.23s var:75/86 constraints:244/457
#Model   0.23s var:74/86 constraints:232/457
#Bound   0.23s best:324   next:[323,323]  objective_lb_search_no_lp [skipped_logs=10]

Task timing                                  n [     min,      max]      avg      dev     time         n [     min,      max]      avg      dev    dtime
                             'core':         1 [181.37ms, 181.37ms] 181.37ms   0.00ns 181.37ms         1 [103.84ms, 103.84ms] 103.84ms   0.00ns 103.84ms
                       'default_lp':         1 [180.75ms, 180.75ms] 180.75ms   0.00ns 180.75ms         1 [ 22.07ms,  22.07ms]  22.07ms   0.00ns  22.07ms
                 'feasibility_pump':         6 [  1.06ms,  18.73ms]  12.63ms   5.46ms  75.76ms         5 [  2.09ms,   2.63ms]   2.20ms 214.56us  11.01ms
                  'fj_long_default':         0 [  0.00ns,   0.00ns]   0.00ns   0.00ns   0.00ns         0 [  0.00ns,   0.00ns]   0.00ns   0.00ns   0.00ns
                  'fj_long_default':         0 [  0.00ns,   0.00ns]   0.00ns   0.00ns   0.00ns         0 [  0.00ns,   0.00ns]   0.00ns   0.00ns   0.00ns
              'fj_long_lin_default':         0 [  0.00ns,   0.00ns]   0.00ns   0.00ns   0.00ns         0 [  0.00ns,   0.00ns]   0.00ns   0.00ns   0.00ns
              'fj_long_lin_perturb':         0 [  0.00ns,   0.00ns]   0.00ns   0.00ns   0.00ns         0 [  0.00ns,   0.00ns]   0.00ns   0.00ns   0.00ns
               'fj_long_lin_random':         0 [  0.00ns,   0.00ns]   0.00ns   0.00ns   0.00ns         0 [  0.00ns,   0.00ns]   0.00ns   0.00ns   0.00ns
                  'fj_long_perturb':         0 [  0.00ns,   0.00ns]   0.00ns   0.00ns   0.00ns         0 [  0.00ns,   0.00ns]   0.00ns   0.00ns   0.00ns
                   'fj_long_random':         0 [  0.00ns,   0.00ns]   0.00ns   0.00ns   0.00ns         0 [  0.00ns,   0.00ns]   0.00ns   0.00ns   0.00ns
                 'fj_short_default':         0 [  0.00ns,   0.00ns]   0.00ns   0.00ns   0.00ns         0 [  0.00ns,   0.00ns]   0.00ns   0.00ns   0.00ns
                 'fj_short_default':         0 [  0.00ns,   0.00ns]   0.00ns   0.00ns   0.00ns         0 [  0.00ns,   0.00ns]   0.00ns   0.00ns   0.00ns
             'fj_short_lin_default':         0 [  0.00ns,   0.00ns]   0.00ns   0.00ns   0.00ns         0 [  0.00ns,   0.00ns]   0.00ns   0.00ns   0.00ns
             'fj_short_lin_default':         0 [  0.00ns,   0.00ns]   0.00ns   0.00ns   0.00ns         0 [  0.00ns,   0.00ns]   0.00ns   0.00ns   0.00ns
             'fj_short_lin_perturb':         0 [  0.00ns,   0.00ns]   0.00ns   0.00ns   0.00ns         0 [  0.00ns,   0.00ns]   0.00ns   0.00ns   0.00ns
              'fj_short_lin_random':         0 [  0.00ns,   0.00ns]   0.00ns   0.00ns   0.00ns         0 [  0.00ns,   0.00ns]   0.00ns   0.00ns   0.00ns
                 'fj_short_perturb':         0 [  0.00ns,   0.00ns]   0.00ns   0.00ns   0.00ns         0 [  0.00ns,   0.00ns]   0.00ns   0.00ns   0.00ns
                  'fj_short_random':         0 [  0.00ns,   0.00ns]   0.00ns   0.00ns   0.00ns         0 [  0.00ns,   0.00ns]   0.00ns   0.00ns   0.00ns
                        'fs_random':         0 [  0.00ns,   0.00ns]   0.00ns   0.00ns   0.00ns         0 [  0.00ns,   0.00ns]   0.00ns   0.00ns   0.00ns
                        'fs_random':         0 [  0.00ns,   0.00ns]   0.00ns   0.00ns   0.00ns         0 [  0.00ns,   0.00ns]   0.00ns   0.00ns   0.00ns
                        'fs_random':         0 [  0.00ns,   0.00ns]   0.00ns   0.00ns   0.00ns         0 [  0.00ns,   0.00ns]   0.00ns   0.00ns   0.00ns
                        'fs_random':         0 [  0.00ns,   0.00ns]   0.00ns   0.00ns   0.00ns         0 [  0.00ns,   0.00ns]   0.00ns   0.00ns   0.00ns
                  'fs_random_no_lp':         0 [  0.00ns,   0.00ns]   0.00ns   0.00ns   0.00ns         0 [  0.00ns,   0.00ns]   0.00ns   0.00ns   0.00ns
                  'fs_random_no_lp':         0 [  0.00ns,   0.00ns]   0.00ns   0.00ns   0.00ns         0 [  0.00ns,   0.00ns]   0.00ns   0.00ns   0.00ns
                  'fs_random_no_lp':         0 [  0.00ns,   0.00ns]   0.00ns   0.00ns   0.00ns         0 [  0.00ns,   0.00ns]   0.00ns   0.00ns   0.00ns
                  'fs_random_no_lp':         0 [  0.00ns,   0.00ns]   0.00ns   0.00ns   0.00ns         0 [  0.00ns,   0.00ns]   0.00ns   0.00ns   0.00ns
          'fs_random_quick_restart':         0 [  0.00ns,   0.00ns]   0.00ns   0.00ns   0.00ns         0 [  0.00ns,   0.00ns]   0.00ns   0.00ns   0.00ns
          'fs_random_quick_restart':         0 [  0.00ns,   0.00ns]   0.00ns   0.00ns   0.00ns         0 [  0.00ns,   0.00ns]   0.00ns   0.00ns   0.00ns
          'fs_random_quick_restart':         0 [  0.00ns,   0.00ns]   0.00ns   0.00ns   0.00ns         0 [  0.00ns,   0.00ns]   0.00ns   0.00ns   0.00ns
          'fs_random_quick_restart':         0 [  0.00ns,   0.00ns]   0.00ns   0.00ns   0.00ns         0 [  0.00ns,   0.00ns]   0.00ns   0.00ns   0.00ns
    'fs_random_quick_restart_no_lp':         0 [  0.00ns,   0.00ns]   0.00ns   0.00ns   0.00ns         0 [  0.00ns,   0.00ns]   0.00ns   0.00ns   0.00ns
    'fs_random_quick_restart_no_lp':         0 [  0.00ns,   0.00ns]   0.00ns   0.00ns   0.00ns         0 [  0.00ns,   0.00ns]   0.00ns   0.00ns   0.00ns
    'fs_random_quick_restart_no_lp':         0 [  0.00ns,   0.00ns]   0.00ns   0.00ns   0.00ns         0 [  0.00ns,   0.00ns]   0.00ns   0.00ns   0.00ns
                    'graph_arc_lns':         6 [  3.37ms,  25.14ms]  14.95ms   8.32ms  89.70ms         5 [  1.91us, 894.20us] 408.88us 369.18us   2.04ms
                    'graph_cst_lns':         6 [458.74us, 873.01us] 583.71us 138.04us   3.50ms         0 [  0.00ns,   0.00ns]   0.00ns   0.00ns   0.00ns
                    'graph_dec_lns':         5 [  2.06ms,  13.22ms]   7.33ms   4.87ms  36.67ms         4 [ 10.00ns, 344.85us] 156.18us 157.75us 624.72us
                    'graph_var_lns':         6 [  1.36ms,  74.78ms]  23.30ms  25.57ms 139.78ms         5 [ 10.00ns,  10.72ms]   2.27ms   4.23ms  11.35ms
                   'lb_tree_search':         1 [178.28ms, 178.28ms] 178.28ms   0.00ns 178.28ms         1 [ 19.75ms,  19.75ms]  19.75ms   0.00ns  19.75ms
                           'max_lp':         1 [180.32ms, 180.32ms] 180.32ms   0.00ns 180.32ms         1 [ 19.80ms,  19.80ms]  19.80ms   0.00ns  19.80ms
                            'no_lp':         1 [180.70ms, 180.70ms] 180.70ms   0.00ns 180.70ms         1 [ 27.19ms,  27.19ms]  27.19ms   0.00ns  27.19ms
              'objective_lb_search':         1 [177.33ms, 177.33ms] 177.33ms   0.00ns 177.33ms         1 [ 22.70ms,  22.70ms]  22.70ms   0.00ns  22.70ms
       'objective_lb_search_max_lp':         1 [177.14ms, 177.14ms] 177.14ms   0.00ns 177.14ms         1 [ 24.96ms,  24.96ms]  24.96ms   0.00ns  24.96ms
        'objective_lb_search_no_lp':         1 [175.73ms, 175.73ms] 175.73ms   0.00ns 175.73ms         1 [ 22.55ms,  22.55ms]  22.55ms   0.00ns  22.55ms
  'objective_shaving_search_max_lp':         6 [  4.80ms,  33.80ms]  14.94ms   9.49ms  89.64ms         5 [146.32us, 652.55us] 274.39us 194.72us   1.37ms
   'objective_shaving_search_no_lp':         6 [905.06us,  43.03ms]  15.02ms  14.19ms  90.09ms         4 [151.63us,   2.92ms] 873.63us   1.18ms   3.49ms
                          'probing':         1 [180.18ms, 180.18ms] 180.18ms   0.00ns 180.18ms         1 [ 10.58ms,  10.58ms]  10.58ms   0.00ns  10.58ms
                   'probing_max_lp':         1 [177.44ms, 177.44ms] 177.44ms   0.00ns 177.44ms         1 [  9.74ms,   9.74ms]   9.74ms   0.00ns   9.74ms
                     'pseudo_costs':         1 [177.76ms, 177.76ms] 177.76ms   0.00ns 177.76ms         1 [ 21.89ms,  21.89ms]  21.89ms   0.00ns  21.89ms
                    'quick_restart':         1 [178.24ms, 178.24ms] 178.24ms   0.00ns 178.24ms         1 [ 19.19ms,  19.19ms]  19.19ms   0.00ns  19.19ms
              'quick_restart_no_lp':         1 [177.96ms, 177.96ms] 177.96ms   0.00ns 177.96ms         1 [ 24.78ms,  24.78ms]  24.78ms   0.00ns  24.78ms
                    'reduced_costs':         1 [178.15ms, 178.15ms] 178.15ms   0.00ns 178.15ms         1 [ 19.33ms,  19.33ms]  19.33ms   0.00ns  19.33ms
                        'rins/rens':         6 [ 64.58us,  49.19ms]  17.32ms  18.24ms 103.93ms         5 [ 10.00ns,   3.44ms]   1.27ms   1.33ms   6.37ms
                      'rnd_cst_lns':         6 [  1.94ms,  18.91ms]  10.86ms   5.87ms  65.15ms         5 [ 10.00ns, 533.52us] 177.56us 189.65us 887.80us
                      'rnd_var_lns':         6 [  1.41ms,  34.67ms]  12.57ms  11.09ms  75.41ms         6 [ 10.00ns,   2.34ms] 473.78us 842.39us   2.84ms
                     'violation_ls':         3 [539.53us, 104.05ms]  55.79ms  42.54ms 167.38ms         3 [ 15.44us,  36.65ms]  19.27ms  15.01ms  57.81ms
                     'violation_ls':         3 [586.51us, 135.83ms]  52.25ms  59.65ms 156.75ms         3 [ 39.04us,  47.47ms]  19.95ms  20.10ms  59.84ms
                     'violation_ls':         3 [819.64us, 108.69ms]  53.00ms  44.11ms 158.99ms         3 [101.13us,  38.04ms]  18.27ms  15.53ms  54.82ms
                     'violation_ls':         5 [224.34us,  85.56ms]  31.33ms  37.71ms 156.67ms         5 [  8.04us,  30.52ms]  10.82ms  13.19ms  54.08ms
                     'violation_ls':         5 [247.84us,  51.74ms]  24.10ms  23.11ms 120.51ms         5 [560.00ns,  33.88ms]  13.82ms  14.57ms  69.09ms

Search stats                        Bools  Conflicts  Branches  Restarts  BoolPropag  IntegerPropag
                           'core':    458        198     4'408     1'534     386'837        102'733
                     'default_lp':     82        188     1'329       592       3'712         37'948
                      'fs_random':      0          0         0         0           0              0
                      'fs_random':      0          0         0         0           0              0
                      'fs_random':      0          0         0         0           0              0
                      'fs_random':      0          0         0         0           0              0
                'fs_random_no_lp':      0          0         0         0           0              0
                'fs_random_no_lp':      0          0         0         0           0              0
                'fs_random_no_lp':      0          0         0         0           0              0
                'fs_random_no_lp':      0          0         0         0           0              0
        'fs_random_quick_restart':      0          0         0         0           0              0
        'fs_random_quick_restart':      0          0         0         0           0              0
        'fs_random_quick_restart':      0          0         0         0           0              0
        'fs_random_quick_restart':      0          0         0         0           0              0
  'fs_random_quick_restart_no_lp':      0          0         0         0           0              0
  'fs_random_quick_restart_no_lp':      0          0         0         0           0              0
  'fs_random_quick_restart_no_lp':      0          0         0         0           0              0
                 'lb_tree_search':     36          1        91        73          45            746
                         'max_lp':     36          3        90        72          50          1'003
                          'no_lp':    227        578     3'913       780      38'631        139'564
            'objective_lb_search':     40        217     1'015       383       3'002         43'865
     'objective_lb_search_max_lp':     37         50       139        73         498          7'163
      'objective_lb_search_no_lp':     69        932     1'978       459       9'971        122'391
                        'probing':     78         21       135       135         374          1'954
                 'probing_max_lp':     38          0        76        76          26            467
                   'pseudo_costs':     36         38       229       129         365          5'320
                  'quick_restart':     96         51     1'342       649       1'961         19'347
            'quick_restart_no_lp':    253        767     4'008       605      41'803        118'960
                  'reduced_costs':     97        114       566       210       3'440         20'373

SAT stats                           ClassicMinim  LitRemoved  LitLearned  LitForgotten  Subsumed  MClauses  MDecisions  MLitTrue  MSubsumed  MLitRemoved  MReused
                           'core':            51         189         312             0         0       636       3'143         0         63          189       14
                     'default_lp':            79         122       1'276             0        17        93         371         7         30          164       12
                      'fs_random':             0           0           0             0         0         0           0         0          0            0        0
                      'fs_random':             0           0           0             0         0         0           0         0          0            0        0
                      'fs_random':             0           0           0             0         0         0           0         0          0            0        0
                      'fs_random':             0           0           0             0         0         0           0         0          0            0        0
                'fs_random_no_lp':             0           0           0             0         0         0           0         0          0            0        0
                'fs_random_no_lp':             0           0           0             0         0         0           0         0          0            0        0
                'fs_random_no_lp':             0           0           0             0         0         0           0         0          0            0        0
                'fs_random_no_lp':             0           0           0             0         0         0           0         0          0            0        0
        'fs_random_quick_restart':             0           0           0             0         0         0           0         0          0            0        0
        'fs_random_quick_restart':             0           0           0             0         0         0           0         0          0            0        0
        'fs_random_quick_restart':             0           0           0             0         0         0           0         0          0            0        0
        'fs_random_quick_restart':             0           0           0             0         0         0           0         0          0            0        0
  'fs_random_quick_restart_no_lp':             0           0           0             0         0         0           0         0          0            0        0
  'fs_random_quick_restart_no_lp':             0           0           0             0         0         0           0         0          0            0        0
  'fs_random_quick_restart_no_lp':             0           0           0             0         0         0           0         0          0            0        0
                 'lb_tree_search':             0           0           2             0         0         0           0         0          0            0        0
                         'max_lp':             3           4          21             0         0         0           0         0          0            0        0
                          'no_lp':           309         677       4'498             0        45       134         685         0         41          209        8
            'objective_lb_search':           125         242       1'201             0        24        96         474         0         30          150        9
     'objective_lb_search_max_lp':            23          33         439             0         5         0           0         0          0            0        0
      'objective_lb_search_no_lp':           670       1'790       4'478             0        57       102         586         0         27          137       20
                        'probing':             0           0          21             0         0         0           0         0          0            0        0
                 'probing_max_lp':             0           0           0             0         0         0           0         0          0            0        0
                   'pseudo_costs':            21          29         218             0         3         6          30         0          0            0        0
                  'quick_restart':            10          11         279             0         3        48         249         2          7           40        0
            'quick_restart_no_lp':           424         914       5'322             0        43       102         682         0         35          173        6
                  'reduced_costs':            31          37         478             0        17        64         233         5         17           85        7

Lp stats                         Component  Iterations  AddedCuts  OPTIMAL  DUAL_F.  DUAL_U.
                  'default_lp':          1       1'042        552      291        0        0
              'lb_tree_search':          1         445        989       28        1        0
                      'max_lp':          1         446      1'054       29        1        0
         'objective_lb_search':          1       1'140        446      264        0        0
  'objective_lb_search_max_lp':          1       1'184        918       79       28        0
                     'probing':          1         277        781       96        0        0
              'probing_max_lp':          1         249        953       21        0        0
                'pseudo_costs':          1         907        877       76       16        0
               'quick_restart':          1         802        676      185        0        0
               'reduced_costs':          1         739        900       93       16        0

Lp dimension                                                                    Final dimension of first component
                  'default_lp':   169 rows, 83 columns, 907 entries with magnitude in [1.413242e-04, 1.000000e+00]
              'lb_tree_search':  750 rows, 86 columns, 3646 entries with magnitude in [9.238025e-04, 1.000000e+00]
                      'max_lp':  804 rows, 86 columns, 4417 entries with magnitude in [1.448079e-04, 1.000000e+00]
         'objective_lb_search':  187 rows, 83 columns, 1056 entries with magnitude in [9.643274e-05, 1.000000e+00]
  'objective_lb_search_max_lp':  415 rows, 86 columns, 1573 entries with magnitude in [3.371514e-04, 1.000000e+00]
                     'probing':  419 rows, 83 columns, 3641 entries with magnitude in [3.442927e-05, 1.000000e+00]
              'probing_max_lp':  777 rows, 86 columns, 4751 entries with magnitude in [2.834033e-03, 1.000000e+00]
                'pseudo_costs':  452 rows, 86 columns, 2308 entries with magnitude in [1.487690e-03, 1.000000e+00]
               'quick_restart':  350 rows, 83 columns, 2309 entries with magnitude in [4.197608e-05, 1.000000e+00]
               'reduced_costs':  424 rows, 86 columns, 1704 entries with magnitude in [5.243070e-03, 1.000000e+00]

Lp debug                         CutPropag  CutEqPropag  Adjust  Overflow    Bad  BadScaling
                  'default_lp':          2            0      57         0    659           0
              'lb_tree_search':          0            0      26         0    826           0
                      'max_lp':          1            0      24         0    981           0
         'objective_lb_search':         11            0      47         0    604           0
  'objective_lb_search_max_lp':          2            0      79         0    879           0
                     'probing':          1            0      30         0  3'878           0
              'probing_max_lp':          1            0      14         0  1'664           0
                'pseudo_costs':          1            0      65         0    815           0
               'quick_restart':         12            2     114         0  1'302           0
               'reduced_costs':          1            0      92         0    792           0

Lp pool                          Constraints  Updates  Simplif  Merged  Shortened  Split  Strenghtened    Cuts/Call
                  'default_lp':          661      182      455       9         62     31           790      552/889
              'lb_tree_search':        1'443       89    1'281       3        572     16         1'881    989/1'558
                      'max_lp':        1'509      108      711       2          0     27         1'489  1'054/1'639
         'objective_lb_search':          558      137      230       6          0     22           516      446/711
  'objective_lb_search_max_lp':        1'370      105    1'702       5        612     14         2'941    918/1'378
                     'probing':          899       91       49       0          0     26           265    781/1'208
              'probing_max_lp':        1'408       11        0       2          0     26           170    953/1'594
                'pseudo_costs':        1'329      100      855       5          0     15         1'938    877/1'390
               'quick_restart':          792      217      718       2         51     44         1'076    676/1'114
               'reduced_costs':        1'351       94    1'729       6        447     15         3'053    900/1'381

Lp Cut            defaul  max_lp  quick_  reduce  pseudo  lb_tre  probin  object  probin  object
          CG_FF:      61     125      60      74      92     116      58      33     115     103
           CG_K:      41      62      35      39      42      54      36      19      55      32
           CG_R:      46      70      86      59      60      56      86      30      54      61
          CG_RB:      80     276     134     172     181     260     156      75     229     183
         CG_RBP:      23      56      26      44      37      76      47      12      38      67
         Clique:       -       5       -       -       2       1       -       -       -       3
             IB:      92      65      82      84      87      66      65      82      59      93
       MIR_1_FF:      23      78      18      61      65      78      27      21      75      60
        MIR_1_K:       1       6       1      12       8       8       4       4       5       8
        MIR_1_R:       8      10      11      12      11      10      13       7       9      12
       MIR_1_RB:      25      47      29      60      64      62      26      21      50      57
      MIR_1_RBP:       2      11       4      14      17       7       2       1      10      18
      MIR_1_RLT:       -       4       -       -       -       4       -       -       5       -
       MIR_2_FF:      19      32      17      15      17      19      21      22      34      17
        MIR_2_K:       -      14       4       8       6      10       3       6      14       9
        MIR_2_R:      17      13       7      10       8       5      18      10      10      14
       MIR_2_RB:      19      21      27      23      18      26      31      18      13      17
      MIR_2_RBP:       2      10       4      10       4       3       7       -       6       9
       MIR_3_FF:      11      15      11      18      15      15      22       7      20       8
        MIR_3_K:       3       7       3      13       8       4       2       4       9       4
        MIR_3_R:       9       6      17       5       4       4      23       8       9       7
       MIR_3_RB:      10       4      14      13      13       5      34       8      13       9
      MIR_3_RBP:       1       3       4       3       4       1       8       3       2       2
       MIR_4_FF:       3       5       6       5       2       2       8       4       2       3
        MIR_4_K:       2       2       3       3       2       1       5       1       1       1
        MIR_4_R:       1       3       7       2       2       -       6       3       3       -
       MIR_4_RB:       6       2      11       8       1       1       9       8       2       1
      MIR_4_RBP:       -       -       1       2       -       -       2       1       3       -
       MIR_5_FF:       2       2       -       -       1       -       3       1       -       2
        MIR_5_K:       1       1       -       -       1       -       2       -       -       1
        MIR_5_R:       1       1       1       -       1       -       3       1       -       1
       MIR_5_RB:       1       2       1       -       1       -       3       2       1       2
      MIR_5_RBP:       1       -       -       -       -       -       -       -       -       -
       MIR_6_RB:       -       -       -       -       -       -       1       -       -       -
   ZERO_HALF_FF:       8      18       9      24      14      18       5       8      19      19
    ZERO_HALF_K:       1       2       1       6       3       4       -       1       7       2
    ZERO_HALF_R:      23      44      27      51      53      47      32      17      52      54
   ZERO_HALF_RB:       9      21      14      36      28      15      10       7      23      28
  ZERO_HALF_RBP:       -      11       1      14       5      11       3       1       6      11

LNS stats           Improv/Calls  Closed  Difficulty  TimeLimit
  'graph_arc_lns':           3/6     83%        0.92       0.10
  'graph_cst_lns':           0/0      0%        0.50       0.10
  'graph_dec_lns':           3/5    100%        0.94       0.10
  'graph_var_lns':           1/6     67%        0.83       0.10
      'rins/rens':           3/5    100%        0.94       0.10
    'rnd_cst_lns':           5/6    100%        0.96       0.10
    'rnd_var_lns':           4/6     83%        0.92       0.10

LS stats                   Batches  Restarts  LinMoves  GenMoves  CompoundMoves  WeightUpdates
       'fj_long_default':        0         0         0         0              0              0
       'fj_long_default':        0         0         0         0              0              0
   'fj_long_lin_default':        0         0         0         0              0              0
   'fj_long_lin_perturb':        0         0         0         0              0              0
    'fj_long_lin_random':        0         0         0         0              0              0
       'fj_long_perturb':        0         0         0         0              0              0
        'fj_long_random':        0         0         0         0              0              0
      'fj_short_default':        0         0         0         0              0              0
      'fj_short_default':        0         0         0         0              0              0
  'fj_short_lin_default':        0         0         0         0              0              0
  'fj_short_lin_default':        0         0         0         0              0              0
  'fj_short_lin_perturb':        0         0         0         0              0              0
   'fj_short_lin_random':        0         0         0         0              0              0
      'fj_short_perturb':        0         0         0         0              0              0
       'fj_short_random':        0         0         0         0              0              0
          'violation_ls':        3         0         0    16'628            524             98
          'violation_ls':        3         0     2'185    13'433            223            867
          'violation_ls':        3         0         9    17'173            543             98
          'violation_ls':        5         0         0    16'509            399            104
          'violation_ls':        5         0    12'634         7              7          9'206

Solutions (37)            Num    Rank
                'no_lp':   19  [1,37]
  'quick_restart_no_lp':   12  [6,34]
          'rnd_var_lns':    1   [9,9]
         'violation_ls':    5  [4,36]

Objective bounds                Num
                  'bool_core':    2
                 'default_lp':    1
             'initial_domain':    1
  'objective_lb_search_no_lp':   28

Solution repositories    Added  Queried  Ignored  Synchro
  'feasible solutions':     93      103        0       60
        'lp solutions':      1        0        0        1
                'pump':    104        5

Improving bounds shared          Num
                        'core':    7
                  'default_lp':   24
                       'no_lp':  224
         'objective_lb_search':   60
  'objective_lb_search_max_lp':    1
   'objective_lb_search_no_lp':   64
                     'probing':    1
                'pseudo_costs':    1
               'quick_restart':   76
         'quick_restart_no_lp':  330
               'reduced_costs':    9

Clauses shared                  Num
                 'default_lp':   12
             'lb_tree_search':    1
                      'no_lp':   10
        'objective_lb_search':    6
  'objective_lb_search_no_lp':    6
               'pseudo_costs':    1
              'quick_restart':   12
        'quick_restart_no_lp':    5

CpSolverResponse summary:
status: OPTIMAL
objective: 324
best_bound: 324
integers: 0
booleans: 0
conflicts: 0
branches: 0
propagations: 0
integer_propagations: 0
restarts: 0
lp_iterations: 0
walltime: 0.245957
usertime: 0.245957
deterministic_time: 0.705138
gap_integral: 0.893742
solution_fingerprint: 0xcfd2efb715150ba5


--- Simulation Gantt  partir du modle mathmatique ---
{'big':0, 'due_date':108, 'pos_time':5, 'status':0, 'blocked':0, 'operations':["{'type':1, 'processing_time':28}"]}
{'big':1, 'due_date':74, 'pos_time':5, 'status':0, 'blocked':0, 'operations':["{'type':1, 'processing_time':39}"]}
{'big':0, 'due_date':103, 'pos_time':5, 'status':0, 'blocked':0, 'operations':["{'type':0, 'processing_time':45}", "{'type':1, 'processing_time':46}"]}
{'big':0, 'due_date':123, 'pos_time':5, 'status':0, 'blocked':0, 'operations':["{'type':1, 'processing_time':12}", "{'type':0, 'processing_time':17}"]}
{'big':0, 'due_date':63, 'pos_time':5, 'status':0, 'blocked':0, 'operations':["{'type':0, 'processing_time':29}"]}
