created virtual environment CPython3.12.4.final.0-64 in 8830ms
  creator CPython3Posix(dest=/localscratch/aneumann.63393247.0/env, clear=False, no_vcs_ignore=False, global=False)
  seeder FromAppData(download=False, pip=bundle, via=copy, app_data_dir=/home/aneumann/.local/share/virtualenv)
    added seed packages: pip==25.1.1
  activators BashActivator,CShellActivator,FishActivator,NushellActivator,PowerShellActivator,PythonActivator
Looking in links: /cvmfs/soft.computecanada.ca/custom/python/wheelhouse/gentoo2023/x86-64-v3, /cvmfs/soft.computecanada.ca/custom/python/wheelhouse/gentoo2023/generic, /cvmfs/soft.computecanada.ca/custom/python/wheelhouse/generic
Requirement already satisfied: pip in /localscratch/aneumann.63393247.0/env/lib/python3.12/site-packages (25.1.1)
Looking in links: /cvmfs/soft.computecanada.ca/custom/python/wheelhouse/gentoo2023/x86-64-v3, /cvmfs/soft.computecanada.ca/custom/python/wheelhouse/gentoo2023/generic, /cvmfs/soft.computecanada.ca/custom/python/wheelhouse/generic
ERROR: protobuf-5.28.3-cp38-abi3-manylinux2014_x86_64.whl is not a supported wheel on this platform.
Looking in links: /cvmfs/soft.computecanada.ca/custom/python/wheelhouse/gentoo2023/x86-64-v3, /cvmfs/soft.computecanada.ca/custom/python/wheelhouse/gentoo2023/generic, /cvmfs/soft.computecanada.ca/custom/python/wheelhouse/generic
Processing /home/aneumann/projects/def-adhaj/aneumann/GNRS/wheels/immutabledict-4.2.0-py3-none-any.whl
Installing collected packages: immutabledict
Successfully installed immutabledict-4.2.0
Looking in links: /cvmfs/soft.computecanada.ca/custom/python/wheelhouse/gentoo2023/x86-64-v3, /cvmfs/soft.computecanada.ca/custom/python/wheelhouse/gentoo2023/generic, /cvmfs/soft.computecanada.ca/custom/python/wheelhouse/generic
Processing /cvmfs/soft.computecanada.ca/custom/python/wheelhouse/generic/ortools-9.10.4067+computecanada-cp312-cp312-linux_x86_64.whl (from -r /home/aneumann/projects/def-adhaj/aneumann/GNRS/requirements/or.txt (line 1))
Processing /cvmfs/soft.computecanada.ca/custom/python/wheelhouse/gentoo2023/x86-64-v3/matplotlib-3.10.0+computecanada-cp312-cp312-linux_x86_64.whl (from -r /home/aneumann/projects/def-adhaj/aneumann/GNRS/requirements/or.txt (line 2))
Processing /cvmfs/soft.computecanada.ca/custom/python/wheelhouse/gentoo2023/x86-64-v3/pandas-2.2.3+computecanada-cp312-cp312-linux_x86_64.whl (from -r /home/aneumann/projects/def-adhaj/aneumann/GNRS/requirements/or.txt (line 3))
Processing /cvmfs/soft.computecanada.ca/custom/python/wheelhouse/generic/absl_py-2.2.2+computecanada-py3-none-any.whl (from ortools<9.11,>=9.10->-r /home/aneumann/projects/def-adhaj/aneumann/GNRS/requirements/or.txt (line 1))
Processing /cvmfs/soft.computecanada.ca/custom/python/wheelhouse/gentoo2023/generic/numpy-2.2.2+computecanada-cp312-cp312-linux_x86_64.whl (from ortools<9.11,>=9.10->-r /home/aneumann/projects/def-adhaj/aneumann/GNRS/requirements/or.txt (line 1))
Processing /cvmfs/soft.computecanada.ca/custom/python/wheelhouse/gentoo2023/x86-64-v3/protobuf-6.30.2+computecanada-cp312-cp312-linux_x86_64.whl (from ortools<9.11,>=9.10->-r /home/aneumann/projects/def-adhaj/aneumann/GNRS/requirements/or.txt (line 1))
Requirement already satisfied: immutabledict>=3.0.0 in /localscratch/aneumann.63393247.0/env/lib/python3.12/site-packages (from ortools<9.11,>=9.10->-r /home/aneumann/projects/def-adhaj/aneumann/GNRS/requirements/or.txt (line 1)) (4.2.0)
Processing /cvmfs/soft.computecanada.ca/custom/python/wheelhouse/gentoo2023/generic/contourpy-1.3.1+computecanada-cp312-cp312-linux_x86_64.whl (from matplotlib->-r /home/aneumann/projects/def-adhaj/aneumann/GNRS/requirements/or.txt (line 2))
Processing /cvmfs/soft.computecanada.ca/custom/python/wheelhouse/generic/cycler-0.12.1+computecanada-py3-none-any.whl (from matplotlib->-r /home/aneumann/projects/def-adhaj/aneumann/GNRS/requirements/or.txt (line 2))
Processing /cvmfs/soft.computecanada.ca/custom/python/wheelhouse/generic/fonttools-4.58.2+computecanada-cp312-cp312-linux_x86_64.whl (from matplotlib->-r /home/aneumann/projects/def-adhaj/aneumann/GNRS/requirements/or.txt (line 2))
Processing /cvmfs/soft.computecanada.ca/custom/python/wheelhouse/gentoo2023/x86-64-v3/kiwisolver-1.4.8+computecanada-cp312-cp312-linux_x86_64.whl (from matplotlib->-r /home/aneumann/projects/def-adhaj/aneumann/GNRS/requirements/or.txt (line 2))
Processing /cvmfs/soft.computecanada.ca/custom/python/wheelhouse/generic/packaging-25.0+computecanada-py3-none-any.whl (from matplotlib->-r /home/aneumann/projects/def-adhaj/aneumann/GNRS/requirements/or.txt (line 2))
Processing /cvmfs/soft.computecanada.ca/custom/python/wheelhouse/gentoo2023/x86-64-v3/pillow-11.1.0+computecanada-cp312-cp312-linux_x86_64.whl (from matplotlib->-r /home/aneumann/projects/def-adhaj/aneumann/GNRS/requirements/or.txt (line 2))
Processing /cvmfs/soft.computecanada.ca/custom/python/wheelhouse/generic/pyparsing-3.2.1+computecanada-py3-none-any.whl (from matplotlib->-r /home/aneumann/projects/def-adhaj/aneumann/GNRS/requirements/or.txt (line 2))
Processing /cvmfs/soft.computecanada.ca/custom/python/wheelhouse/generic/python_dateutil-2.9.0.post0+computecanada-py2.py3-none-any.whl (from matplotlib->-r /home/aneumann/projects/def-adhaj/aneumann/GNRS/requirements/or.txt (line 2))
Processing /cvmfs/soft.computecanada.ca/custom/python/wheelhouse/generic/pytz-2025.2+computecanada-py2.py3-none-any.whl (from pandas->-r /home/aneumann/projects/def-adhaj/aneumann/GNRS/requirements/or.txt (line 3))
Processing /cvmfs/soft.computecanada.ca/custom/python/wheelhouse/generic/tzdata-2025.2+computecanada-py2.py3-none-any.whl (from pandas->-r /home/aneumann/projects/def-adhaj/aneumann/GNRS/requirements/or.txt (line 3))
Processing /cvmfs/soft.computecanada.ca/custom/python/wheelhouse/generic/six-1.17.0+computecanada-py2.py3-none-any.whl (from python-dateutil>=2.7->matplotlib->-r /home/aneumann/projects/def-adhaj/aneumann/GNRS/requirements/or.txt (line 2))
Installing collected packages: pytz, tzdata, six, pyparsing, protobuf, pillow, packaging, numpy, kiwisolver, fonttools, cycler, absl-py, python-dateutil, contourpy, pandas, matplotlib, ortools

Successfully installed absl-py-2.2.2+computecanada contourpy-1.3.1+computecanada cycler-0.12.1+computecanada fonttools-4.58.2+computecanada kiwisolver-1.4.8+computecanada matplotlib-3.10.0+computecanada numpy-2.2.2+computecanada ortools-9.10.4067+computecanada packaging-25.0+computecanada pandas-2.2.3+computecanada pillow-11.1.0+computecanada protobuf-6.30.2+computecanada pyparsing-3.2.1+computecanada python-dateutil-2.9.0.post0+computecanada pytz-2025.2+computecanada six-1.17.0+computecanada tzdata-2025.2+computecanada

Starting CP-SAT solver v9.10.4067
Parameters: max_time_in_seconds: 3600 max_memory_in_mb: 12000 log_search_progress: true enumerate_all_solutions: false absolute_gap_limit: 0 relative_gap_limit: 0
Setting number of workers to 48

Initial optimization model '': (model_fingerprint: 0xcfc678dc355ddd44)
#Variables: 417 (#ints: 10 in objective)
  - 306 Booleans in [0,1]
  - 111 in [0,666]
#kLinear1: 51
#kLinear2: 807
#kLinear3: 253
#kLinearN: 4'973 (#terms: 76'812)

Starting presolve at 0.00s
  4.62e-03s  0.00e+00d  [DetectDominanceRelations] 
  9.87e-02s  0.00e+00d  [PresolveToFixPoint] #num_loops=6 #num_dual_strengthening=3 
  6.10e-05s  0.00e+00d  [ExtractEncodingFromLinear] #potential_supersets=4 
[Symmetry] Graph for symmetry has 5'857 nodes and 59'498 arcs.
[Symmetry] Symmetry computation done. time: 0.00586397 dtime: 0.00561451
[Symmetry] #generators: 1, average support size: 26
[Symmetry] The model contains 471 duplicate constraints !
[Symmetry] 13 orbits with sizes: 2,2,2,2,2,2,2,2,2,2,...
[Symmetry] Num fixable by intersecting at_most_one with orbits: 1 largest_orbit: 2
  2.85e-02s  3.52e-03d  [Probe] #probed=454 #fixed_bools=5 #new_bounds=21 #equiv=1 
  7.38e-05s  0.00e+00d  [MaxClique] Merged 14(28 literals) into 6(12 literals) at_most_ones. 
  4.55e-03s  0.00e+00d  [DetectDominanceRelations] 
  4.98e-02s  0.00e+00d  [PresolveToFixPoint] #num_loops=4 #num_dual_strengthening=3 
  1.66e-02s  0.00e+00d  [ProcessAtMostOneAndLinear] 
  6.75e-03s  0.00e+00d  [DetectDuplicateConstraints] #duplicates=566 #without_enforcements=347 
  6.43e-03s  2.58e-04d  [DetectDominatedLinearConstraints] #relevant_constraints=4'144 #num_inclusions=3'389 #num_redundant=3 
  7.37e-04s  0.00e+00d  [DetectDifferentVariables] #different=56 
  1.51e-03s  7.95e-05d  [ProcessSetPPC] #relevant_constraints=3'415 
  5.41e-05s  0.00e+00d  [FindAlmostIdenticalLinearConstraints] 
  5.03e-04s  3.65e-04d  [FindBigAtMostOneAndLinearOverlap] 
  2.06e-02s  5.47e-03d  [FindBigVerticalLinearOverlap] #blocks=65 #saved_nz=10'500 
  8.22e-04s  1.79e-04d  [FindBigHorizontalLinearOverlap] #linears=3'301 
  3.20e-05s  0.00e+00d  [MergeClauses] 
  4.70e-03s  0.00e+00d  [DetectDominanceRelations] 
  5.68e-02s  0.00e+00d  [PresolveToFixPoint] #num_loops=2 #num_dual_strengthening=1 
  4.69e-03s  0.00e+00d  [DetectDominanceRelations] 
  3.27e-02s  0.00e+00d  [PresolveToFixPoint] #num_loops=1 #num_dual_strengthening=1 
[Symmetry] Graph for symmetry has 5'451 nodes and 47'085 arcs.
[Symmetry] Symmetry computation done. time: 0.00214688 dtime: 0.00280389
  2.46e-02s  3.07e-03d  [Probe] #probed=444 #new_bounds=67 
  2.87e-05s  0.00e+00d  [MaxClique] 
  4.66e-03s  0.00e+00d  [DetectDominanceRelations] 
  5.63e-02s  0.00e+00d  [PresolveToFixPoint] #num_loops=2 #num_dual_strengthening=1 
  1.50e-02s  0.00e+00d  [ProcessAtMostOneAndLinear] 
  5.79e-03s  0.00e+00d  [DetectDuplicateConstraints] #without_enforcements=361 
  3.56e-03s  1.37e-04d  [DetectDominatedLinearConstraints] #relevant_constraints=3'728 #num_inclusions=392 
  7.47e-04s  0.00e+00d  [DetectDifferentVariables] #different=67 #cliques=2 #size=6 
  1.32e-03s  5.76e-05d  [ProcessSetPPC] #relevant_constraints=3'257 
  7.15e-05s  1.30e-07d  [FindAlmostIdenticalLinearConstraints] #num_tested_pairs=6 
  2.93e-04s  1.67e-04d  [FindBigAtMostOneAndLinearOverlap] 
  1.22e-02s  3.66e-03d  [FindBigVerticalLinearOverlap] #blocks=70 #saved_nz=7'176 
  7.12e-04s  1.35e-04d  [FindBigHorizontalLinearOverlap] #linears=3'011 
  3.22e-05s  0.00e+00d  [MergeClauses] 
  4.09e-03s  0.00e+00d  [DetectDominanceRelations] 
  6.12e-02s  0.00e+00d  [PresolveToFixPoint] #num_loops=3 #num_dual_strengthening=1 
  4.08e-03s  0.00e+00d  [DetectDominanceRelations] 
  3.85e-02s  0.00e+00d  [PresolveToFixPoint] #num_loops=1 #num_dual_strengthening=1 
  2.26e-02s  2.64e-03d  [Probe] #probed=444 #new_bounds=42 
  2.90e-05s  0.00e+00d  [MaxClique] 
  4.05e-03s  0.00e+00d  [DetectDominanceRelations] 
  5.00e-02s  0.00e+00d  [PresolveToFixPoint] #num_loops=2 #num_dual_strengthening=1 
  1.31e-02s  0.00e+00d  [ProcessAtMostOneAndLinear] 
  5.58e-03s  0.00e+00d  [DetectDuplicateConstraints] #without_enforcements=388 
  2.77e-03s  1.02e-04d  [DetectDominatedLinearConstraints] #relevant_constraints=3'568 #num_inclusions=26 
  5.88e-04s  0.00e+00d  [DetectDifferentVariables] 
  1.09e-03s  4.06e-05d  [ProcessSetPPC] #relevant_constraints=2'910 
  9.02e-05s  1.07e-06d  [FindAlmostIdenticalLinearConstraints] #num_tested_pairs=43 
  2.47e-04s  1.21e-04d  [FindBigAtMostOneAndLinearOverlap] 
  1.08e-02s  2.72e-03d  [FindBigVerticalLinearOverlap] #blocks=57 #saved_nz=4'778 
  6.17e-04s  1.00e-04d  [FindBigHorizontalLinearOverlap] #linears=2'586 
  3.28e-05s  0.00e+00d  [MergeClauses] 
  3.73e-03s  0.00e+00d  [DetectDominanceRelations] 
  5.29e-02s  0.00e+00d  [PresolveToFixPoint] #num_loops=3 #num_dual_strengthening=1 
  1.75e-04s  0.00e+00d  [ExpandObjective] #entries=975 #tight_variables=282 #tight_constraints=156 

Presolve summary:
  - 98 affine relations were detected.
  - rule 'TODO dual: only one blocking constraint?' was applied 869 times.
  - rule 'TODO dual: only one unspecified blocking constraint?' was applied 130 times.
  - rule 'TODO duplicate: identical constraint with different enforcements' was applied 1'096 times.
  - rule 'TODO no_overlap: with task always last' was applied 2 times.
  - rule 'affine: new relation' was applied 98 times.
  - rule 'all_diff: inferred from x != y constraints' was applied 2 times.
  - rule 'at_most_one: removed literals' was applied 6 times.
  - rule 'at_most_one: size one' was applied 6 times.
  - rule 'at_most_one: transformed into max clique.' was applied 1 time.
  - rule 'deductions: 403 stored' was applied 1 time.
  - rule 'dual: fix variable' was applied 27 times.
  - rule 'dual: reduced domain' was applied 63 times.
  - rule 'duplicate: merged rhs of linear constraint' was applied 101 times.
  - rule 'duplicate: removed constraint' was applied 566 times.
  - rule 'enforcement: false literal' was applied 33 times.
  - rule 'enforcement: true literal' was applied 22 times.
  - rule 'exactly_one: x and not(x)' was applied 1 time.
  - rule 'incompatible linear: add implication' was applied 84 times.
  - rule 'linear inclusion: redundant containing constraint' was applied 3 times.
  - rule 'linear matrix: common vertical rectangle' was applied 192 times.
  - rule 'linear: always true' was applied 883 times.
  - rule 'linear: doubleton free' was applied 14 times.
  - rule 'linear: empty' was applied 38 times.
  - rule 'linear: extracted enforcement literal' was applied 9'958 times.
  - rule 'linear: fixed or dup variables' was applied 5'127 times.
  - rule 'linear: positive equal one' was applied 4 times.
  - rule 'linear: reduced variable domains' was applied 330 times.
  - rule 'linear: remapped using affine relations' was applied 4'941 times.
  - rule 'linear: simplified rhs' was applied 18'849 times.
  - rule 'linear: variable substitution 1' was applied 14 times.
  - rule 'linear: variable substitution 2' was applied 16 times.
  - rule 'linear: variable substitution 3' was applied 1 time.
  - rule 'presolve: 112 unused variables removed.' was applied 1 time.
  - rule 'presolve: iteration' was applied 3 times.
  - rule 'probing: reduced enforced constraint to implication.' was applied 14 times.
  - rule 'symmetry: fixed to false in general orbit' was applied 1 time.

Presolved optimization model '': (model_fingerprint: 0x21d73185f6ee3f45)
#Variables: 368 (#ints: 10 in objective)
  - 110 Booleans in [0,1]
  - 206 different domains in [-5910,5887] with a largest complexity of 13.
#kAllDiff: 2
#kExactlyOne: 3 (#literals: 9)
#kLinear2: 1'117 (#enforced: 1'039 #multi: 820)
#kLinear3: 451 (#enforced: 340)
#kLinearN: 3'039 (#enforced: 2'865) (#terms: 21'883)

Preloading model.
#Bound   0.74s best:inf   next:[212,5299] initial_domain
#Model   0.75s var:368/368 constraints:4612/4612

Starting search at 0.75s with 48 workers.
16 full problem subsolvers: [core, default_lp, lb_tree_search, max_lp, no_lp, objective_lb_search, objective_lb_search_max_lp, objective_lb_search_no_lp, objective_shaving_search_max_lp, objective_shaving_search_no_lp, probing, probing_max_lp, pseudo_costs, quick_restart, quick_restart_no_lp, reduced_costs]
30 first solution subsolvers: [fj_long_default(2), fj_long_lin_default, fj_long_lin_perturb, fj_long_lin_random, fj_long_perturb, fj_long_random, fj_short_default(2), fj_short_lin_default(2), fj_short_lin_perturb, fj_short_lin_random, fj_short_perturb, fj_short_random, fs_random(4), fs_random_no_lp(4), fs_random_quick_restart(4), fs_random_quick_restart_no_lp(3)]
13 incomplete subsolvers: [feasibility_pump, graph_arc_lns, graph_cst_lns, graph_dec_lns, graph_var_lns, rins/rens, rnd_cst_lns, rnd_var_lns, violation_ls(5)]
3 helper subsolvers: [neighborhood_helper, synchronization_agent, update_gap_integral]
#Bound   0.82s best:inf   next:[253,5299] objective_lb_search_no_lp
#Bound   0.84s best:inf   next:[257,5299] objective_lb_search_no_lp
#Bound   0.85s best:inf   next:[258,5299] objective_lb_search_no_lp
#1       0.86s best:2394  next:[258,2393] no_lp (fixed_bools=0/136)
#Bound   0.87s best:2394  next:[327,2393] objective_lb_search_no_lp
#2       0.89s best:2322  next:[327,2321] no_lp (fixed_bools=0/151)
#Bound   0.89s best:2322  next:[328,2321] objective_lb_search_no_lp
#3       0.92s best:2136  next:[328,2135] no_lp (fixed_bools=0/169)
#Bound   0.92s best:2136  next:[342,2135] objective_lb_search_no_lp
#4       0.94s best:2071  next:[342,2070] no_lp (fixed_bools=0/177)
#5       0.95s best:2046  next:[342,2045] no_lp (fixed_bools=0/179)
#6       0.96s best:1937  next:[342,1936] no_lp (fixed_bools=0/182)
#Bound   0.98s best:1937  next:[367,1936] objective_lb_search_no_lp
#7       1.05s best:1901  next:[367,1900] no_lp (fixed_bools=0/184)
#8       1.06s best:1715  next:[367,1714] no_lp (fixed_bools=0/190)
#9       1.07s best:1548  next:[367,1547] no_lp (fixed_bools=0/198)
#10      1.08s best:1544  next:[367,1543] no_lp (fixed_bools=0/202)
#11      1.10s best:1528  next:[367,1527] no_lp (fixed_bools=0/203)
#12      1.16s best:1444  next:[367,1443] no_lp (fixed_bools=0/211)
#Bound   1.21s best:1444  next:[379,1443] objective_lb_search_no_lp
#13      1.22s best:1380  next:[379,1379] no_lp (fixed_bools=0/217)
#14      1.23s best:1266  next:[379,1265] no_lp (fixed_bools=0/229)
#15      1.28s best:1263  next:[379,1262] rins_pump_lns (d=0.71 s=161 t=0.10 p=1.00 stall=1 h=auto_l0)
#16      1.30s best:1249  next:[379,1248] no_lp (fixed_bools=0/245)
#17      1.31s best:1248  next:[379,1247] violation_ls(batch:6 #solutions_imported:6 #lin_moves:26'185 #lin_evals:117'089 #gen_moves:3'918 #gen_evals:603 #comp_moves:326 #backtracks:1'796 #weight_updates:5'900)
#18      1.37s best:1142  next:[379,1141] no_lp (fixed_bools=0/258)
#19      1.47s best:1101  next:[379,1100] no_lp (fixed_bools=0/269)
#20      1.61s best:1086  next:[379,1085] no_lp (fixed_bools=0/277)
#Bound   1.63s best:1086  next:[386,1085] objective_lb_search_no_lp
#21      1.79s best:1082  next:[386,1081] no_lp (fixed_bools=0/301)
#22      1.82s best:1081  next:[386,1080] violation_ls(batch:10 #solutions_imported:9 #lin_moves:20'393 #lin_evals:196'117 #gen_moves:37'196 #gen_evals:6'430 #comp_moves:3'091 #backtracks:17'046 #weight_updates:20'044)
#23      1.83s best:1080  next:[386,1079] violation_ls(batch:11 #solutions_imported:10 #lin_moves:20'394 #lin_evals:196'127 #gen_moves:37'196 #gen_evals:6'430 #comp_moves:3'091 #backtracks:17'046 #weight_updates:20'044)
#24      1.83s best:1035  next:[386,1034] graph_dec_lns (d=0.98 s=180 t=0.10 p=1.00 stall=9 h=auto_l0)
#25      1.86s best:1034  next:[386,1033] violation_ls(batch:8 #solutions_imported:8 #lin_moves:24'830 #lin_evals:187'916 #gen_moves:29'725 #gen_evals:4'757 #comp_moves:1'450 #backtracks:14'129 #weight_updates:6'118)
#26      1.86s best:1033  next:[386,1032] violation_ls(batch:10 #solutions_imported:10 #lin_moves:45'361 #lin_evals:221'185 #gen_moves:14'401 #gen_evals:2'550 #comp_moves:1'868 #backtracks:6'265 #weight_updates:6'847)
#27      1.87s best:1030  next:[386,1029] quick_restart_no_lp (fixed_bools=5/293)
#28      1.88s best:1029  next:[386,1028] violation_ls(batch:10 #solutions_imported:10 #lin_moves:55'258 #lin_evals:266'041 #gen_moves:3'918 #gen_evals:603 #comp_moves:326 #backtracks:1'796 #weight_updates:6'828)
#29      1.88s best:1028  next:[386,1027] violation_ls(batch:11 #solutions_imported:11 #lin_moves:55'416 #lin_evals:266'667 #gen_moves:3'918 #gen_evals:603 #comp_moves:326 #backtracks:1'796 #weight_updates:6'891)
#30      1.88s best:1027  next:[386,1026] violation_ls(batch:12 #solutions_imported:12 #lin_moves:55'498 #lin_evals:267'009 #gen_moves:3'918 #gen_evals:603 #comp_moves:326 #backtracks:1'796 #weight_updates:6'928)
#31      1.89s best:1026  next:[386,1025] violation_ls(batch:13 #solutions_imported:13 #lin_moves:55'570 #lin_evals:267'398 #gen_moves:3'918 #gen_evals:603 #comp_moves:326 #backtracks:1'796 #weight_updates:6'986)
#32      1.90s best:1025  next:[386,1024] violation_ls(batch:14 #solutions_imported:14 #lin_moves:55'570 #lin_evals:268'774 #gen_moves:4'412 #gen_evals:625 #comp_moves:352 #backtracks:2'030 #weight_updates:6'995)
#33      1.91s best:1024  next:[386,1023] violation_ls(batch:15 #solutions_imported:15 #lin_moves:55'570 #lin_evals:270'927 #gen_moves:5'255 #gen_evals:713 #comp_moves:387 #backtracks:2'434 #weight_updates:7'008)
#34      1.91s best:1023  next:[386,1022] violation_ls(batch:16 #solutions_imported:16 #lin_moves:55'638 #lin_evals:271'287 #gen_moves:5'255 #gen_evals:713 #comp_moves:387 #backtracks:2'434 #weight_updates:7'063)
#35      1.92s best:1022  next:[386,1021] violation_ls(batch:16 #solutions_imported:13 #lin_moves:41'395 #lin_evals:275'003 #gen_moves:26'870 #gen_evals:4'090 #comp_moves:3'041 #backtracks:11'908 #weight_updates:30'694)
#36      1.92s best:1021  next:[386,1020] violation_ls(batch:17 #solutions_imported:17 #lin_moves:55'698 #lin_evals:271'559 #gen_moves:5'255 #gen_evals:713 #comp_moves:387 #backtracks:2'434 #weight_updates:7'089)
#37      1.92s best:1020  next:[386,1019] violation_ls(batch:17 #solutions_imported:14 #lin_moves:41'444 #lin_evals:275'220 #gen_moves:26'870 #gen_evals:4'090 #comp_moves:3'041 #backtracks:11'908 #weight_updates:30'721)
#38      1.93s best:1019  next:[386,1018] violation_ls(batch:13 #solutions_imported:12 #lin_moves:20'394 #lin_evals:210'748 #gen_moves:42'900 #gen_evals:7'037 #comp_moves:3'371 #backtracks:19'758 #weight_updates:20'132)
#39      1.94s best:1018  next:[386,1017] violation_ls(batch:14 #solutions_imported:13 #lin_moves:20'427 #lin_evals:210'924 #gen_moves:42'900 #gen_evals:7'037 #comp_moves:3'371 #backtracks:19'758 #weight_updates:20'161)
#40      1.95s best:1017  next:[386,1016] violation_ls(batch:15 #solutions_imported:14 #lin_moves:20'462 #lin_evals:211'086 #gen_moves:42'900 #gen_evals:7'037 #comp_moves:3'371 #backtracks:19'758 #weight_updates:20'180)
#Bound   1.95s best:1017  next:[389,1016] objective_lb_search_no_lp
#41      1.95s best:1016  next:[389,1015] violation_ls(batch:13 #solutions_imported:13 #lin_moves:45'467 #lin_evals:234'889 #gen_moves:19'490 #gen_evals:2'966 #comp_moves:2'105 #backtracks:8'691 #weight_updates:6'997)
#42      1.95s best:1015  next:[389,1014] violation_ls(batch:14 #solutions_imported:14 #lin_moves:45'468 #lin_evals:234'899 #gen_moves:19'490 #gen_evals:2'966 #comp_moves:2'105 #backtracks:8'691 #weight_updates:6'997)
#43      1.95s best:1014  next:[389,1013] violation_ls(batch:17 #solutions_imported:16 #lin_moves:20'765 #lin_evals:212'283 #gen_moves:42'900 #gen_evals:7'037 #comp_moves:3'371 #backtracks:19'758 #weight_updates:20'299)
#44      1.97s best:1013  next:[389,1012] violation_ls(batch:16 #solutions_imported:16 #lin_moves:45'468 #lin_evals:238'768 #gen_moves:20'971 #gen_evals:3'140 #comp_moves:2'212 #backtracks:9'378 #weight_updates:7'023)
#45      1.98s best:1012  next:[389,1011] violation_ls(batch:17 #solutions_imported:17 #lin_moves:45'468 #lin_evals:241'156 #gen_moves:21'936 #gen_evals:3'235 #comp_moves:2'251 #backtracks:9'841 #weight_updates:7'038)
#46      2.01s best:976   next:[389,975]  quick_restart_no_lp (fixed_bools=5/387)
#47      2.04s best:975   next:[389,974]  violation_ls(batch:10 #solutions_imported:10 #lin_moves:24'830 #lin_evals:210'769 #gen_moves:38'041 #gen_evals:5'363 #comp_moves:1'865 #backtracks:18'078 #weight_updates:6'244)
#48      2.05s best:974   next:[389,973]  violation_ls(batch:11 #solutions_imported:11 #lin_moves:24'831 #lin_evals:210'779 #gen_moves:38'041 #gen_evals:5'363 #comp_moves:1'865 #backtracks:18'078 #weight_updates:6'244)
#49      2.05s best:973   next:[389,972]  violation_ls(batch:12 #solutions_imported:12 #lin_moves:24'833 #lin_evals:210'797 #gen_moves:38'041 #gen_evals:5'363 #comp_moves:1'865 #backtracks:18'078 #weight_updates:6'245)
#50      2.05s best:972   next:[389,971]  violation_ls(batch:13 #solutions_imported:13 #lin_moves:24'833 #lin_evals:210'851 #gen_moves:38'064 #gen_evals:5'365 #comp_moves:1'868 #backtracks:18'088 #weight_updates:6'245)
#51      2.05s best:971   next:[389,970]  violation_ls(batch:14 #solutions_imported:14 #lin_moves:24'836 #lin_evals:210'872 #gen_moves:38'064 #gen_evals:5'365 #comp_moves:1'868 #backtracks:18'088 #weight_updates:6'247)
#52      2.06s best:970   next:[389,969]  violation_ls(batch:15 #solutions_imported:15 #lin_moves:24'836 #lin_evals:210'937 #gen_moves:38'089 #gen_evals:5'367 #comp_moves:1'871 #backtracks:18'099 #weight_updates:6'247)
#53      2.06s best:969   next:[389,968]  violation_ls(batch:16 #solutions_imported:16 #lin_moves:24'849 #lin_evals:211'012 #gen_moves:38'089 #gen_evals:5'367 #comp_moves:1'871 #backtracks:18'099 #weight_updates:6'259)
#54      2.06s best:968   next:[389,967]  violation_ls(batch:17 #solutions_imported:17 #lin_moves:24'866 #lin_evals:211'100 #gen_moves:38'089 #gen_evals:5'367 #comp_moves:1'871 #backtracks:18'099 #weight_updates:6'268)
#Bound   2.06s best:968   next:[391,967]  objective_lb_search_no_lp
#55      2.16s best:954   next:[391,953]  quick_restart_no_lp (fixed_bools=6/395)
#Bound   2.31s best:954   next:[441,953]  objective_lb_search_no_lp
#56      2.35s best:953   next:[441,952]  quick_restart_no_lp (fixed_bools=7/400)
#57      2.46s best:952   next:[441,951]  violation_ls(batch:18 #solutions_imported:18 #lin_moves:55'880 #lin_evals:272'327 #gen_moves:5'255 #gen_evals:713 #comp_moves:387 #backtracks:2'434 #weight_updates:7'153)
#58      2.46s best:951   next:[441,950]  violation_ls(batch:18 #solutions_imported:18 #lin_moves:45'468 #lin_evals:241'175 #gen_moves:21'943 #gen_evals:3'238 #comp_moves:2'252 #backtracks:9'844 #weight_updates:7'038)
#59      2.56s best:950   next:[441,949]  violation_ls(batch:18 #solutions_imported:18 #lin_moves:24'866 #lin_evals:219'063 #gen_moves:40'872 #gen_evals:5'728 #comp_moves:2'250 #backtracks:19'301 #weight_updates:6'309)
#60      2.79s best:949   next:[441,948]  quick_restart_no_lp (fixed_bools=7/423)
#61      2.79s best:948   next:[441,947]  quick_restart_no_lp (fixed_bools=7/428)
#62      2.85s best:947   next:[441,946]  quick_restart_no_lp (fixed_bools=8/435)
#63      3.03s best:944   next:[441,943]  no_lp (fixed_bools=0/345)
#64      3.06s best:943   next:[441,942]  no_lp (fixed_bools=0/345)
#65      3.10s best:942   next:[441,941]  no_lp (fixed_bools=0/345)
#66      3.14s best:941   next:[441,940]  violation_ls(batch:19 #solutions_imported:19 #lin_moves:55'880 #lin_evals:272'330 #gen_moves:5'256 #gen_evals:713 #comp_moves:388 #backtracks:2'434 #weight_updates:7'153)
#67      3.14s best:939   next:[441,938]  violation_ls(batch:19 #solutions_imported:19 #lin_moves:45'468 #lin_evals:241'251 #gen_moves:21'970 #gen_evals:3'243 #comp_moves:2'253 #backtracks:9'857 #weight_updates:7'038)
#68      3.16s best:937   next:[441,936]  violation_ls(batch:19 #solutions_imported:18 #lin_moves:20'766 #lin_evals:232'775 #gen_moves:50'576 #gen_evals:7'979 #comp_moves:4'356 #backtracks:23'095 #weight_updates:20'371)
#69      3.18s best:936   next:[441,935]  violation_ls(batch:19 #solutions_imported:19 #lin_moves:24'866 #lin_evals:219'066 #gen_moves:40'873 #gen_evals:5'728 #comp_moves:2'251 #backtracks:19'301 #weight_updates:6'309)
#70      3.19s best:934   next:[441,933]  no_lp (fixed_bools=0/346)
#71      3.26s best:924   next:[441,923]  no_lp (fixed_bools=0/357)
#72      3.35s best:920   next:[441,919]  quick_restart_no_lp (fixed_bools=9/460)
#73      3.43s best:915   next:[441,914]  quick_restart_no_lp (fixed_bools=9/464)
#74      3.52s best:914   next:[441,913]  violation_ls(batch:20 #solutions_imported:20 #lin_moves:55'880 #lin_evals:272'334 #gen_moves:5'257 #gen_evals:713 #comp_moves:389 #backtracks:2'434 #weight_updates:7'153)
#75      3.52s best:912   next:[441,911]  violation_ls(batch:20 #solutions_imported:20 #lin_moves:45'468 #lin_evals:241'256 #gen_moves:21'971 #gen_evals:3'243 #comp_moves:2'254 #backtracks:9'857 #weight_updates:7'038)
#76      3.52s best:910   next:[441,909]  violation_ls(batch:20 #solutions_imported:19 #lin_moves:20'767 #lin_evals:232'785 #gen_moves:50'576 #gen_evals:7'979 #comp_moves:4'356 #backtracks:23'095 #weight_updates:20'371)
#77      3.52s best:909   next:[441,908]  violation_ls(batch:20 #solutions_imported:20 #lin_moves:24'866 #lin_evals:219'069 #gen_moves:40'874 #gen_evals:5'728 #comp_moves:2'252 #backtracks:19'301 #weight_updates:6'309)
#78      3.52s best:908   next:[441,907]  violation_ls(batch:20 #solutions_imported:17 #lin_moves:46'558 #lin_evals:300'358 #gen_moves:26'885 #gen_evals:4'092 #comp_moves:3'042 #backtracks:11'915 #weight_updates:35'608)
#79      3.64s best:847   next:[441,846]  rins_lp_lns (d=0.98 s=270 t=0.10 p=1.00 stall=2 h=auto_l0)
#80      3.70s best:839   next:[441,838]  quick_restart_no_lp (fixed_bools=10/497)
#81      3.71s best:837   next:[441,836]  violation_ls(batch:21 #solutions_imported:21 #lin_moves:55'881 #lin_evals:272'344 #gen_moves:5'257 #gen_evals:713 #comp_moves:389 #backtracks:2'434 #weight_updates:7'153)
#82      3.71s best:835   next:[441,834]  violation_ls(batch:21 #solutions_imported:21 #lin_moves:45'468 #lin_evals:241'261 #gen_moves:21'972 #gen_evals:3'243 #comp_moves:2'255 #backtracks:9'857 #weight_updates:7'038)
#83      3.71s best:833   next:[441,832]  violation_ls(batch:21 #solutions_imported:20 #lin_moves:20'768 #lin_evals:232'795 #gen_moves:50'576 #gen_evals:7'979 #comp_moves:4'356 #backtracks:23'095 #weight_updates:20'371)
#84      3.72s best:832   next:[441,831]  violation_ls(batch:21 #solutions_imported:21 #lin_moves:24'867 #lin_evals:219'079 #gen_moves:40'874 #gen_evals:5'728 #comp_moves:2'252 #backtracks:19'301 #weight_updates:6'309)
#85      3.72s best:831   next:[441,830]  violation_ls(batch:21 #solutions_imported:18 #lin_moves:46'558 #lin_evals:300'361 #gen_moves:26'886 #gen_evals:4'092 #comp_moves:3'043 #backtracks:11'915 #weight_updates:35'608)
#86      3.76s best:816   next:[441,815]  quick_restart_no_lp (fixed_bools=10/506)
#87      3.82s best:815   next:[441,814]  quick_restart_no_lp (fixed_bools=10/514)
#88      3.85s best:808   next:[441,807]  quick_restart_no_lp (fixed_bools=10/515)
#Bound   3.93s best:808   next:[442,807]  objective_shaving_search_no_lp (vars=416 csts=4384)
#Bound   4.27s best:808   next:[459,807]  objective_lb_search_no_lp
#89      5.08s best:802   next:[459,801]  rnd_var_lns (d=0.99 s=332 t=0.10 p=0.88 stall=0 h=auto_l0)
#Bound   5.08s best:802   next:[465,801]  objective_lb_search_no_lp
#90      5.16s best:801   next:[465,800]  violation_ls(batch:25 #solutions_imported:23 #lin_moves:75'225 #lin_evals:372'928 #gen_moves:21'972 #gen_evals:3'243 #comp_moves:2'255 #backtracks:9'857 #weight_updates:7'752)
#91      5.16s best:800   next:[465,799]  violation_ls(batch:25 #solutions_imported:20 #lin_moves:46'559 #lin_evals:348'135 #gen_moves:40'685 #gen_evals:7'852 #comp_moves:5'373 #backtracks:17'642 #weight_updates:35'686)
#92      5.19s best:799   next:[465,798]  violation_ls(batch:25 #solutions_imported:22 #lin_moves:21'333 #lin_evals:284'850 #gen_moves:65'564 #gen_evals:11'626 #comp_moves:6'531 #backtracks:29'493 #weight_updates:20'601)
#93      5.23s best:798   next:[465,797]  violation_ls(batch:25 #solutions_imported:23 #lin_moves:24'867 #lin_evals:274'933 #gen_moves:64'091 #gen_evals:9'426 #comp_moves:3'063 #backtracks:30'503 #weight_updates:6'564)
#94      5.24s best:790   next:[465,789]  graph_arc_lns (d=0.96 s=364 t=0.10 p=0.62 stall=0 h=auto_l0)
#Bound   5.89s best:790   next:[471,789]  objective_lb_search_no_lp
#Bound   6.43s best:790   next:[473,789]  objective_lb_search_no_lp
#Bound   6.54s best:790   next:[481,789]  objective_lb_search
#95      7.64s best:788   next:[481,787]  rnd_var_lns (d=0.99 s=388 t=0.10 p=0.77 stall=1 h=auto_l0)
#Bound   8.57s best:788   next:[510,787]  objective_lb_search_max_lp
#Bound  12.57s best:788   next:[511,787]  objective_shaving_search_no_lp (vars=417 csts=4385)
#Bound  14.22s best:788   next:[515,787]  objective_lb_search_no_lp
#Bound  16.99s best:788   next:[516,787]  objective_lb_search_no_lp
#96     20.54s best:786   next:[516,785]  rnd_cst_lns (d=0.98 s=964 t=0.10 p=0.57 stall=35 h=auto_l0)
#Bound  21.56s best:786   next:[517,785]  objective_lb_search_no_lp
#Bound  24.57s best:786   next:[521,785]  objective_lb_search_no_lp
#Bound  28.58s best:786   next:[523,785]  objective_lb_search_no_lp
#Bound  30.85s best:786   next:[526,785]  objective_lb_search_no_lp
#Bound  32.66s best:786   next:[527,785]  objective_lb_search_no_lp
#Bound  38.86s best:786   next:[528,785]  objective_shaving_search_max_lp (vars=413 csts=4381)
#Bound  39.34s best:786   next:[529,785]  objective_lb_search_no_lp
#Bound  40.34s best:786   next:[531,785]  objective_lb_search_no_lp
#Bound  41.95s best:786   next:[532,785]  objective_lb_search_no_lp
#Bound  42.97s best:786   next:[534,785]  objective_lb_search_no_lp
#Bound  43.97s best:786   next:[536,785]  objective_lb_search_no_lp
#Bound  48.70s best:786   next:[538,785]  objective_lb_search_no_lp
#Bound  51.05s best:786   next:[539,785]  objective_lb_search_no_lp
#Bound  53.89s best:786   next:[541,785]  objective_lb_search_no_lp
#Bound  59.26s best:786   next:[543,785]  objective_lb_search_no_lp
#Bound  65.68s best:786   next:[546,785]  objective_lb_search_no_lp
#Bound  76.89s best:786   next:[547,785]  objective_shaving_search_no_lp (vars=411 csts=4379)
#Bound  79.75s best:786   next:[548,785]  objective_lb_search_no_lp
#Bound  84.82s best:786   next:[555,785]  objective_lb_search_no_lp
#Bound  95.25s best:786   next:[556,785]  objective_shaving_search_no_lp (vars=411 csts=4379)
#Bound  96.89s best:786   next:[557,785]  objective_lb_search_no_lp
#Bound  98.81s best:786   next:[558,785]  objective_lb_search_no_lp
#Bound 104.42s best:786   next:[559,785]  objective_lb_search_no_lp
#Bound 104.95s best:786   next:[561,785]  objective_lb_search_no_lp
#Bound 115.13s best:786   next:[562,785]  lb_tree_search (nodes=4785/4788 rc=29 decisions=28109 @root=25 restarts=10) 
#Bound 117.06s best:786   next:[563,785]  objective_lb_search_no_lp
#Bound 118.47s best:786   next:[564,785]  objective_lb_search_no_lp
#Bound 122.60s best:786   next:[565,785]  objective_lb_search_no_lp
#Bound 127.22s best:786   next:[566,785]  objective_lb_search_no_lp
#Bound 134.86s best:786   next:[567,785]  lb_tree_search (nodes=5312/5315 rc=34 decisions=32412 @root=28 restarts=10) 
#Bound 139.35s best:786   next:[568,785]  objective_lb_search_no_lp
#Bound 146.19s best:786   next:[569,785]  lb_tree_search (nodes=5514/5517 rc=37 decisions=34431 @root=30 restarts=10) 
#Bound 153.45s best:786   next:[570,785]  lb_tree_search (nodes=5648/5653 rc=40 decisions=35753 @root=31 restarts=10) 
#Bound 158.18s best:786   next:[572,785]  objective_lb_search_no_lp
#Bound 167.38s best:786   next:[573,785]  lb_tree_search (nodes=6048/6053 rc=44 decisions=38757 @root=33 restarts=10) 
#Bound 174.53s best:786   next:[574,785]  lb_tree_search (nodes=6184/6189 rc=45 decisions=40003 @root=34 restarts=10) 
#Bound 181.79s best:786   next:[575,785]  objective_lb_search_no_lp
#Bound 183.12s best:786   next:[576,785]  objective_lb_search_no_lp
#Bound 184.94s best:786   next:[579,785]  objective_lb_search_no_lp
#Bound 189.45s best:786   next:[580,785]  objective_lb_search_no_lp
#Bound 193.79s best:786   next:[581,785]  objective_lb_search_no_lp
#Bound 198.13s best:786   next:[583,785]  objective_lb_search_no_lp
#Bound 228.79s best:786   next:[584,785]  objective_shaving_search_no_lp (vars=419 csts=4387)
#Bound 234.92s best:786   next:[586,785]  objective_lb_search_no_lp
#Bound 240.89s best:786   next:[587,785]  objective_lb_search_no_lp
#Bound 258.63s best:786   next:[588,785]  objective_lb_search_no_lp
#Bound 260.23s best:786   next:[589,785]  objective_lb_search_no_lp
#Bound 267.34s best:786   next:[590,785]  objective_lb_search_no_lp
#Bound 272.58s best:786   next:[591,785]  objective_lb_search_no_lp
#Bound 292.19s best:786   next:[592,785]  lb_tree_search (nodes=9026/9062 rc=69 decisions=60203 @root=39 restarts=10) 
#Bound 306.86s best:786   next:[593,785]  lb_tree_search (nodes=9101/9273 rc=70 decisions=62088 @root=40 restarts=10) 
#Bound 310.19s best:786   next:[594,785]  objective_lb_search_no_lp
#Bound 318.43s best:786   next:[595,785]  objective_lb_search_no_lp
#Bound 329.48s best:786   next:[596,785]  objective_lb_search_no_lp
#Bound 346.88s best:786   next:[597,785]  objective_lb_search_no_lp
#Bound 358.25s best:786   next:[598,785]  bool_core (num_cores=120 [cover] a=4 d=6 fixed=394/2813 clauses=121'212)
#Model 361.84s var:360/368 constraints:3997/4612
#Bound 362.49s best:786   next:[599,785]  bool_core (num_cores=121 [size:1 mw:1] a=4 d=6 fixed=396/2827 clauses=123'930)
#Bound 368.37s best:786   next:[600,785]  bool_core (num_cores=122 [size:1 mw:1] a=4 d=6 fixed=705/2828 clauses=62'312)
#Bound 370.45s best:786   next:[601,785]  bool_core (num_cores=122 [cover] a=4 d=6 fixed=705/2828 clauses=62'900)
#Bound 373.94s best:786   next:[602,785]  bool_core (num_cores=123 [size:1 mw:1] a=4 d=6 fixed=724/2842 clauses=65'119)
#Bound 376.81s best:786   next:[603,785]  bool_core (num_cores=124 [size:1 mw:1] a=4 d=6 fixed=755/2843 clauses=66'537)
#Bound 377.23s best:786   next:[604,785]  bool_core (num_cores=124 [cover] a=4 d=6 fixed=755/2843 clauses=66'735)
#Bound 379.99s best:786   next:[605,785]  bool_core (num_cores=125 [size:1 mw:1] a=4 d=6 fixed=769/2855 clauses=69'021)
#Bound 382.87s best:786   next:[606,785]  bool_core (num_cores=126 [size:1 mw:1] a=4 d=6 fixed=770/2856 clauses=70'421)
#Bound 383.97s best:786   next:[607,785]  bool_core (num_cores=126 [cover] a=4 d=6 fixed=770/2856 clauses=70'878)
#Bound 385.84s best:786   next:[609,785]  objective_lb_search_no_lp
#Bound 389.28s best:786   next:[615,785]  objective_lb_search_no_lp
#Bound 396.90s best:786   next:[631,785]  objective_lb_search_no_lp
#Bound 406.36s best:786   next:[633,785]  objective_lb_search_no_lp
#Bound 409.19s best:786   next:[634,785]  objective_lb_search_no_lp
#Model 416.69s var:359/368 constraints:3719/4612
#Bound 418.95s best:786   next:[635,785]  objective_lb_search_no_lp
#Bound 419.60s best:786   next:[636,785]  objective_lb_search_no_lp
#Bound 420.25s best:786   next:[637,785]  objective_lb_search_no_lp
#Bound 421.91s best:786   next:[639,785]  objective_lb_search_no_lp
#Model 425.40s var:358/368 constraints:3601/4612
#Bound 427.87s best:786   next:[640,785]  objective_lb_search
#Model 428.38s var:357/368 constraints:3561/4612
#Model 428.77s var:356/368 constraints:3555/4612
#Model 429.38s var:355/368 constraints:3527/4612
#Model 429.49s var:353/368 constraints:3444/4612
#Model 429.55s var:352/368 constraints:3397/4612
#Model 429.63s var:350/368 constraints:3309/4612
#Bound 429.72s best:786   next:[644,785]  objective_lb_search_no_lp
#Model 430.42s var:348/368 constraints:3188/4612
#Model 430.58s var:346/368 constraints:3099/4612
#Bound 431.10s best:786   next:[648,785]  objective_lb_search_max_lp
#Bound 431.43s best:786   next:[687,785]  objective_lb_search_no_lp
#Model 431.61s var:345/368 constraints:3026/4612
#Model 431.62s var:343/368 constraints:2838/4612
#Bound 432.01s best:786   next:[688,785]  objective_lb_search_no_lp
#Model 432.06s var:342/368 constraints:2789/4612
#Model 432.13s var:341/368 constraints:2710/4612
#Model 432.22s var:325/368 constraints:1926/4612
#Model 432.29s var:324/368 constraints:1890/4612
#Model 432.33s var:323/368 constraints:1879/4612
#Done  432.45s no_lp
#Model 432.45s var:308/368 constraints:1341/4612
#Done  432.45s core
#Model 432.46s var:306/368 constraints:1267/4612
#Model 432.46s var:302/368 constraints:1068/4612

Task timing                                  n [     min,      max]      avg      dev     time         n [     min,      max]      avg      dev    dtime
                             'core':         1 [   7.19m,    7.19m]    7.19m   0.00ns    7.19m         1 [   2.70m,    2.70m]    2.70m   0.00ns    2.70m
                       'default_lp':         1 [   7.19m,    7.19m]    7.19m   0.00ns    7.19m         1 [  43.49s,   43.49s]   43.49s   0.00ns   43.49s
                 'feasibility_pump':       971 [ 31.10ms,    2.34s] 440.82ms 248.84ms    7.13m       970 [  6.30ms,  66.75ms]  30.80ms   1.52ms   29.87s
                  'fj_long_default':         1 [217.45ms, 217.45ms] 217.45ms   0.00ns 217.45ms         1 [ 76.34ms,  76.34ms]  76.34ms   0.00ns  76.34ms
                  'fj_long_default':         1 [232.78ms, 232.78ms] 232.78ms   0.00ns 232.78ms         1 [ 85.81ms,  85.81ms]  85.81ms   0.00ns  85.81ms
              'fj_long_lin_default':         1 [170.29ms, 170.29ms] 170.29ms   0.00ns 170.29ms         1 [ 87.69ms,  87.69ms]  87.69ms   0.00ns  87.69ms
              'fj_long_lin_perturb':         1 [244.54ms, 244.54ms] 244.54ms   0.00ns 244.54ms         1 [115.59ms, 115.59ms] 115.59ms   0.00ns 115.59ms
               'fj_long_lin_random':         1 [248.34ms, 248.34ms] 248.34ms   0.00ns 248.34ms         1 [117.09ms, 117.09ms] 117.09ms   0.00ns 117.09ms
                  'fj_long_perturb':         1 [180.66ms, 180.66ms] 180.66ms   0.00ns 180.66ms         1 [ 90.35ms,  90.35ms]  90.35ms   0.00ns  90.35ms
                   'fj_long_random':         1 [241.28ms, 241.28ms] 241.28ms   0.00ns 241.28ms         1 [ 88.53ms,  88.53ms]  88.53ms   0.00ns  88.53ms
                 'fj_short_default':         1 [143.00ms, 143.00ms] 143.00ms   0.00ns 143.00ms         1 [ 88.38ms,  88.38ms]  88.38ms   0.00ns  88.38ms
                 'fj_short_default':         1 [259.71ms, 259.71ms] 259.71ms   0.00ns 259.71ms         1 [120.17ms, 120.17ms] 120.17ms   0.00ns 120.17ms
             'fj_short_lin_default':         1 [161.87ms, 161.87ms] 161.87ms   0.00ns 161.87ms         1 [ 88.70ms,  88.70ms]  88.70ms   0.00ns  88.70ms
             'fj_short_lin_default':         1 [171.98ms, 171.98ms] 171.98ms   0.00ns 171.98ms         1 [ 89.89ms,  89.89ms]  89.89ms   0.00ns  89.89ms
             'fj_short_lin_perturb':         1 [237.25ms, 237.25ms] 237.25ms   0.00ns 237.25ms         1 [ 87.51ms,  87.51ms]  87.51ms   0.00ns  87.51ms
              'fj_short_lin_random':         1 [176.38ms, 176.38ms] 176.38ms   0.00ns 176.38ms         1 [ 91.86ms,  91.86ms]  91.86ms   0.00ns  91.86ms
                 'fj_short_perturb':         1 [196.04ms, 196.04ms] 196.04ms   0.00ns 196.04ms         1 [ 71.55ms,  71.55ms]  71.55ms   0.00ns  71.55ms
                  'fj_short_random':         1 [173.29ms, 173.29ms] 173.29ms   0.00ns 173.29ms         1 [ 88.78ms,  88.78ms]  88.78ms   0.00ns  88.78ms
                        'fs_random':         1 [ 96.96ms,  96.96ms]  96.96ms   0.00ns  96.96ms         1 [389.88us, 389.88us] 389.88us   0.00ns 389.88us
                        'fs_random':         1 [ 98.35ms,  98.35ms]  98.35ms   0.00ns  98.35ms         1 [389.78us, 389.78us] 389.78us   0.00ns 389.78us
                        'fs_random':         1 [ 99.33ms,  99.33ms]  99.33ms   0.00ns  99.33ms         1 [389.85us, 389.85us] 389.85us   0.00ns 389.85us
                        'fs_random':         1 [106.32ms, 106.32ms] 106.32ms   0.00ns 106.32ms         1 [268.56us, 268.56us] 268.56us   0.00ns 268.56us
                  'fs_random_no_lp':         1 [ 94.80ms,  94.80ms]  94.80ms   0.00ns  94.80ms         1 [  2.47ms,   2.47ms]   2.47ms   0.00ns   2.47ms
                  'fs_random_no_lp':         1 [ 97.03ms,  97.03ms]  97.03ms   0.00ns  97.03ms         1 [  2.22ms,   2.22ms]   2.22ms   0.00ns   2.22ms
                  'fs_random_no_lp':         1 [106.73ms, 106.73ms] 106.73ms   0.00ns 106.73ms         1 [  1.69ms,   1.69ms]   1.69ms   0.00ns   1.69ms
                  'fs_random_no_lp':         1 [109.37ms, 109.37ms] 109.37ms   0.00ns 109.37ms         1 [  1.19ms,   1.19ms]   1.19ms   0.00ns   1.19ms
          'fs_random_quick_restart':         1 [ 96.00ms,  96.00ms]  96.00ms   0.00ns  96.00ms         1 [ 47.71us,  47.71us]  47.71us   0.00ns  47.71us
          'fs_random_quick_restart':         1 [103.63ms, 103.63ms] 103.63ms   0.00ns 103.63ms         1 [ 26.49us,  26.49us]  26.49us   0.00ns  26.49us
          'fs_random_quick_restart':         1 [105.01ms, 105.01ms] 105.01ms   0.00ns 105.01ms         1 [389.84us, 389.84us] 389.84us   0.00ns 389.84us
          'fs_random_quick_restart':         1 [109.40ms, 109.40ms] 109.40ms   0.00ns 109.40ms         1 [389.84us, 389.84us] 389.84us   0.00ns 389.84us
    'fs_random_quick_restart_no_lp':         1 [ 98.49ms,  98.49ms]  98.49ms   0.00ns  98.49ms         1 [  1.10ms,   1.10ms]   1.10ms   0.00ns   1.10ms
    'fs_random_quick_restart_no_lp':         1 [104.29ms, 104.29ms] 104.29ms   0.00ns 104.29ms         1 [821.62us, 821.62us] 821.62us   0.00ns 821.62us
    'fs_random_quick_restart_no_lp':         1 [106.44ms, 106.44ms] 106.44ms   0.00ns 106.44ms         1 [910.02us, 910.02us] 910.02us   0.00ns 910.02us
                    'graph_arc_lns':      1083 [  6.70ms,   11.62s]    1.62s    1.31s   29.31m      1064 [ 10.00ns, 145.93ms]  72.65ms  53.85ms    1.29m
                    'graph_cst_lns':      1083 [  3.98ms,    8.36s]    1.49s    1.32s   26.90m       944 [ 10.00ns, 242.95ms]  71.64ms  49.66ms    1.13m
                    'graph_dec_lns':      1083 [ 10.60ms,    8.91s]    1.80s    1.24s   32.41m      1065 [ 10.00ns, 259.00ms]  77.88ms  50.53ms    1.38m
                    'graph_var_lns':      1084 [ 10.63ms,    9.79s]    1.70s    1.26s   30.74m      1067 [ 10.00ns, 214.60ms]  77.22ms  49.93ms    1.37m
                   'lb_tree_search':         1 [   7.19m,    7.19m]    7.19m   0.00ns    7.19m         1 [   2.03m,    2.03m]    2.03m   0.00ns    2.03m
                           'max_lp':         1 [   7.19m,    7.19m]    7.19m   0.00ns    7.19m         1 [   1.33m,    1.33m]    1.33m   0.00ns    1.33m
                            'no_lp':         1 [   7.19m,    7.19m]    7.19m   0.00ns    7.19m         1 [  41.68s,   41.68s]   41.68s   0.00ns   41.68s
              'objective_lb_search':         1 [   7.19m,    7.19m]    7.19m   0.00ns    7.19m         1 [  49.88s,   49.88s]   49.88s   0.00ns   49.88s
       'objective_lb_search_max_lp':         1 [   7.19m,    7.19m]    7.19m   0.00ns    7.19m         1 [   1.75m,    1.75m]    1.75m   0.00ns    1.75m
        'objective_lb_search_no_lp':         1 [   7.19m,    7.19m]    7.19m   0.00ns    7.19m         1 [  30.24s,   30.24s]   30.24s   0.00ns   30.24s
  'objective_shaving_search_max_lp':        99 [ 13.84ms,   30.60s]    4.36s    4.83s    7.19m        92 [  2.13ms,    2.19s] 405.68ms 484.14ms   37.32s
   'objective_shaving_search_no_lp':        97 [ 73.43ms,   30.59s]    4.45s    4.83s    7.19m        90 [  1.19ms,    1.59s] 283.95ms 330.30ms   25.56s
                          'probing':         1 [   7.20m,    7.20m]    7.20m   0.00ns    7.20m         1 [  23.69s,   23.69s]   23.69s   0.00ns   23.69s
                   'probing_max_lp':         1 [   7.20m,    7.20m]    7.20m   0.00ns    7.20m         1 [  36.88s,   36.88s]   36.88s   0.00ns   36.88s
                     'pseudo_costs':         1 [   7.19m,    7.19m]    7.19m   0.00ns    7.19m         1 [  53.70s,   53.70s]   53.70s   0.00ns   53.70s
                    'quick_restart':         1 [   7.19m,    7.19m]    7.19m   0.00ns    7.19m         1 [  47.88s,   47.88s]   47.88s   0.00ns   47.88s
              'quick_restart_no_lp':         1 [   7.20m,    7.20m]    7.20m   0.00ns    7.20m         1 [  49.03s,   49.03s]   49.03s   0.00ns   49.03s
                    'reduced_costs':         1 [   7.19m,    7.19m]    7.19m   0.00ns    7.19m         1 [   1.07m,    1.07m]    1.07m   0.00ns    1.07m
                        'rins/rens':      1084 [218.90us,   10.40s]    1.03s 954.31ms   18.52m       837 [ 10.00ns, 200.24ms]  75.77ms  34.68ms    1.06m
                      'rnd_cst_lns':      1084 [  7.63ms,   13.37s]    1.63s    1.20s   29.51m      1059 [ 10.00ns, 280.20ms]  74.29ms  51.05ms    1.31m
                      'rnd_var_lns':      1084 [  8.30ms,    9.31s]    1.70s    1.23s   30.70m      1066 [ 10.00ns, 203.74ms]  77.26ms  49.87ms    1.37m
                     'violation_ls':      1072 [614.16us,    1.33s] 266.52ms 173.58ms    4.76m      1072 [410.00ns, 123.96ms]  86.84ms  14.06ms    1.55m
                     'violation_ls':      1077 [627.17us,    1.54s] 270.44ms 172.98ms    4.85m      1077 [500.00ns, 230.28ms]  98.79ms  34.72ms    1.77m
                     'violation_ls':      1078 [604.93us,    1.53s] 283.68ms 192.80ms    5.10m      1078 [760.00ns, 256.17ms] 108.71ms  47.65ms    1.95m
                     'violation_ls':      1078 [646.96us,    1.98s] 273.96ms 175.81ms    4.92m      1078 [590.00ns, 303.08ms] 113.52ms  46.75ms    2.04m
                     'violation_ls':      1080 [820.10us,    1.72s] 248.23ms 163.64ms    4.47m      1080 [970.00ns, 233.82ms]  94.73ms  32.83ms    1.71m

Search stats                        Bools  Conflicts  Branches  Restarts   BoolPropag  IntegerPropag
                           'core':  3'052    138'526   347'083    39'696  160'920'907    106'530'969
                     'default_lp':    321     40'382   215'335    34'440    3'084'521     50'189'555
                      'fs_random':    110          0       220       220           18          5'203
                      'fs_random':    110          0       220       220           18          5'203
                      'fs_random':    110          0       220       220           18          5'203
                      'fs_random':    110          0       220       220           18          5'203
                'fs_random_no_lp':    110          0       298       220           40         10'231
                'fs_random_no_lp':    110         13       379       220          119         13'583
                'fs_random_no_lp':    110         20       381       220          144         14'784
                'fs_random_no_lp':    110         22       322       220          131         12'022
        'fs_random_quick_restart':    110          0       220       220           18          5'203
        'fs_random_quick_restart':    110          0       220       220           18          5'203
        'fs_random_quick_restart':    110          0       220       220           18          5'203
        'fs_random_quick_restart':    110          0       220       220           18          5'203
  'fs_random_quick_restart_no_lp':    110          0       282       220           40          8'471
  'fs_random_quick_restart_no_lp':    110          0       306       220           20          8'637
  'fs_random_quick_restart_no_lp':    118          0       334       220           22          9'991
                 'lb_tree_search':    110        388   139'267    17'809      332'078     13'288'158
                         'max_lp':    110     29'490   376'336    81'008    2'251'576     62'317'507
                          'no_lp':  1'175    155'283   335'605    25'313   40'600'521    136'687'702
            'objective_lb_search':    247     33'457   350'822    86'141    2'720'113     57'855'988
     'objective_lb_search_max_lp':    219     20'336   194'211    49'427    1'531'107     36'654'886
      'objective_lb_search_no_lp':    313    113'655   246'406    16'963    5'210'927    110'081'223
                        'probing':    626        381     4'022     2'581       45'058        309'898
                 'probing_max_lp':    626        372     1'318     1'220       29'867        198'100
                   'pseudo_costs':    110     33'762   269'957    53'766    1'860'218     52'892'839
                  'quick_restart':  1'370     14'658   255'333    44'699   11'538'259     38'646'965
            'quick_restart_no_lp':  3'643    117'034   477'237    29'479   79'224'923     95'775'887
                  'reduced_costs':  2'779     47'599   275'228    28'913   40'402'154     56'005'664

SAT stats                           ClassicMinim  LitRemoved  LitLearned  LitForgotten  Subsumed  MClauses  MDecisions  MLitTrue  MSubsumed  MLitRemoved  MReused
                           'core':       124'767     716'570   1'221'317       192'227       679    18'936      91'867         1      1'679        7'062      260
                     'default_lp':        26'040      65'114     498'307       187'012     1'180    15'515     149'130         0      1'339        9'160    2'887
                      'fs_random':             0           0           0             0         0         0           0         0          0            0        0
                      'fs_random':             0           0           0             0         0         0           0         0          0            0        0
                      'fs_random':             0           0           0             0         0         0           0         0          0            0        0
                      'fs_random':             0           0           0             0         0         0           0         0          0            0        0
                'fs_random_no_lp':             0           0           0             0         0         0           0         0          0            0        0
                'fs_random_no_lp':             0           0          43             0         0         0           0         0          0            0        0
                'fs_random_no_lp':             0           0          81             0         0         0           0         0          0            0        0
                'fs_random_no_lp':             0           0          87             0         0         0           0         0          0            0        0
        'fs_random_quick_restart':             0           0           0             0         0         0           0         0          0            0        0
        'fs_random_quick_restart':             0           0           0             0         0         0           0         0          0            0        0
        'fs_random_quick_restart':             0           0           0             0         0         0           0         0          0            0        0
        'fs_random_quick_restart':             0           0           0             0         0         0           0         0          0            0        0
  'fs_random_quick_restart_no_lp':             0           0           0             0         0         0           0         0          0            0        0
  'fs_random_quick_restart_no_lp':             0           0           0             0         0         0           0         0          0            0        0
  'fs_random_quick_restart_no_lp':             0           0           0             0         0         0           0         0          0            0        0
                 'lb_tree_search':            80         128       3'095             0         1     6'151      32'365         0         40          155      491
                         'max_lp':        19'097      52'812     383'884       123'676       765    34'870     308'106         0        820        5'163    6'820
                          'no_lp':       130'108     634'776   2'227'909     1'703'323     1'421    12'747     118'688         1      4'064       28'601    1'225
            'objective_lb_search':        24'866      69'905     360'471        27'262       933    30'137     236'220         0        753        5'002    3'750
     'objective_lb_search_max_lp':        15'132      44'616     203'963         3'628       646    15'478     121'266         0        793        4'894    3'050
      'objective_lb_search_no_lp':        99'583     402'744   1'069'933       364'645     1'556     9'113     101'022         0      3'584       26'022    1'987
                        'probing':             0           0         381             0         0         0           0         0          0            0        0
                 'probing_max_lp':             0           0         372             0         0         0           0         0          0            0        0
                   'pseudo_costs':        21'784      62'406     434'427       151'910     1'028    23'842     208'693        10      1'887       12'434    4'201
                  'quick_restart':        10'268      35'540     165'611        45'781       478    19'963     183'147         0      3'164       18'799    3'371
            'quick_restart_no_lp':        96'416     644'718   1'685'151     1'141'202       858    11'461      90'821        93      7'172       51'638      798
                  'reduced_costs':        35'448     145'875     550'161       209'464       823    17'104     153'438         0      7'679       54'832    2'373

Lp stats                         Component  Iterations  AddedCuts  OPTIMAL  DUAL_F.  DUAL_U.
                  'default_lp':          1     604'466     34'228   64'259        0        0
                   'fs_random':          1         200        137        3        1        0
                   'fs_random':          1         220        196        5        0        0
                   'fs_random':          1         220        198        5        0        0
                   'fs_random':          1         220        203        5        0        0
     'fs_random_quick_restart':          1         145        135        3        0        0
     'fs_random_quick_restart':          1         147        135        3        1        0
     'fs_random_quick_restart':          1         220        181        5        0        0
     'fs_random_quick_restart':          1         220        188        5        0        0
              'lb_tree_search':          1   2'026'474     13'808   76'658   20'052        0
                      'max_lp':          1   1'128'552     28'000   50'756   12'234       19
         'objective_lb_search':          1     702'821     20'897   57'369        0        2
  'objective_lb_search_max_lp':          1   1'293'600     21'019   36'152    8'935       13
                     'probing':          1     161'740     49'920   12'952        0        0
              'probing_max_lp':          1      78'707     38'188    5'615      215        0
                'pseudo_costs':          1     824'957     40'097   47'269   18'345       22
               'quick_restart':          1     524'707     40'709   42'096        0        1
               'reduced_costs':          1     955'109     60'298   57'185   25'243        4

Lp dimension                                                                       Final dimension of first component
                  'default_lp':    743 rows, 350 columns, 3871 entries with magnitude in [7.156394e-05, 1.000000e+00]
                   'fs_random':     186 rows, 350 columns, 772 entries with magnitude in [3.874921e-02, 1.000000e+00]
                   'fs_random':     186 rows, 350 columns, 772 entries with magnitude in [3.874921e-02, 1.000000e+00]
                   'fs_random':     186 rows, 350 columns, 772 entries with magnitude in [3.874921e-02, 1.000000e+00]
                   'fs_random':     186 rows, 350 columns, 772 entries with magnitude in [3.874921e-02, 1.000000e+00]
     'fs_random_quick_restart':     186 rows, 350 columns, 772 entries with magnitude in [3.874921e-02, 1.000000e+00]
     'fs_random_quick_restart':     186 rows, 350 columns, 772 entries with magnitude in [3.874921e-02, 1.000000e+00]
     'fs_random_quick_restart':     186 rows, 350 columns, 772 entries with magnitude in [3.874921e-02, 1.000000e+00]
     'fs_random_quick_restart':     186 rows, 350 columns, 772 entries with magnitude in [3.874921e-02, 1.000000e+00]
              'lb_tree_search':    736 rows, 368 columns, 2921 entries with magnitude in [3.641038e-03, 1.000000e+00]
                      'max_lp':    863 rows, 368 columns, 3134 entries with magnitude in [2.288708e-03, 1.000000e+00]
         'objective_lb_search':    573 rows, 350 columns, 2679 entries with magnitude in [4.961126e-04, 1.000000e+00]
  'objective_lb_search_max_lp':   1231 rows, 368 columns, 4769 entries with magnitude in [1.101077e-03, 1.000000e+00]
                     'probing':  1552 rows, 350 columns, 12686 entries with magnitude in [3.837010e-05, 1.000000e+00]
              'probing_max_lp':  2262 rows, 368 columns, 20172 entries with magnitude in [2.425491e-05, 1.000000e+00]
                'pseudo_costs':   1223 rows, 368 columns, 5555 entries with magnitude in [1.455182e-03, 1.000000e+00]
               'quick_restart':   1177 rows, 350 columns, 6174 entries with magnitude in [4.823720e-05, 1.000000e+00]
               'reduced_costs':   1107 rows, 368 columns, 3841 entries with magnitude in [5.275487e-04, 1.000000e+00]

Lp debug                         CutPropag  CutEqPropag  Adjust  Overflow        Bad  BadScaling
                  'default_lp':         91           79  40'944         0    634'190           0
                   'fs_random':          0            0       0         0        200           0
                   'fs_random':          0            0       0         0        227           0
                   'fs_random':          0            0       0         0        229           0
                   'fs_random':          0            0       0         0        250           0
     'fs_random_quick_restart':          0            0       0         0        174           0
     'fs_random_quick_restart':          0            0       0         0        183           0
     'fs_random_quick_restart':          0            0       0         0        185           0
     'fs_random_quick_restart':          0            0       0         0        206           0
              'lb_tree_search':        125           35  46'714         0    174'840           0
                      'max_lp':        150           46  37'795         0    391'529           0
         'objective_lb_search':        115          135  40'225         0    556'153           0
  'objective_lb_search_max_lp':        149           60  28'897         0    429'899           0
                     'probing':         73          645  11'513         0  7'728'411           0
              'probing_max_lp':        152          174   2'476         0  4'755'325           0
                'pseudo_costs':        174           52  46'134         0    440'638           0
               'quick_restart':        144          219  29'328         0  1'131'837           0
               'reduced_costs':        360          128  57'480         0    659'967           0

Lp pool                          Constraints  Updates  Simplif  Merged  Shortened    Split  Strenghtened       Cuts/Call
                  'default_lp':        9'260    3'757  176'454     334      9'020   57'655        18'337   34'228/87'589
                   'fs_random':          503        0        0       0          0        0            13         137/227
                   'fs_random':          562        1        0       0          0        0            13         196/296
                   'fs_random':          564        2        0       0          0        0            13         198/297
                   'fs_random':          569        1        0       0          0        0            13         203/306
     'fs_random_quick_restart':          501        0        0       0          0        0            13         135/213
     'fs_random_quick_restart':          501        0        0       0          0        0            13         135/219
     'fs_random_quick_restart':          547        0        0       0          0        0            12         181/276
     'fs_random_quick_restart':          554        0        0       0          0        0            13         188/279
              'lb_tree_search':       14'238    1'962  116'225     180      6'757    3'263       110'213   13'808/59'517
                      'max_lp':       14'235    2'780  252'143     375     14'041   16'518       161'437   28'000/71'909
         'objective_lb_search':       10'134    3'482  142'352     129      9'067   53'065        18'333   20'897/62'902
  'objective_lb_search_max_lp':       13'462    3'164  278'000     167     12'686   18'388       161'674   21'019/59'536
                     'probing':       10'248    7'571  125'416      38      3'567   98'014        18'328  49'920/101'926
              'probing_max_lp':       13'757    4'750  107'294      41      6'740   45'257        74'107   38'188/96'159
                'pseudo_costs':       13'164    2'866  324'451     543     15'445   16'554       164'951   40'097/99'668
               'quick_restart':        9'957    5'410   72'722     118      2'828  178'860        19'206   40'709/90'986
               'reduced_costs':       13'369    3'316  438'406     539     23'180   24'975       182'771  60'298/151'911

Lp Cut            fs_ran  fs_ran  fs_ran  fs_ran  fs_ran  fs_ran  fs_ran  fs_ran  defaul  max_lp  quick_  reduce  pseudo  lb_tre  probin  object  probin  object
          CG_FF:       8       8       8       8       8       8       8       8   1'725   1'159   1'518   3'542   2'076     616   1'799   1'074     513     824
           CG_K:       5       5       5       5       5       5       5       5   1'060     893     951   2'498   1'701     344   1'297     759     335     574
           CG_R:       2       2       2       2       2       2       2       2   2'492   1'101   3'152   3'157   1'998     483   5'125   1'409   1'342     709
          CG_RB:       -       -       -       -       -       -       -       -   6'408   2'770   6'839   7'780   4'906   2'397   7'726   3'876   2'409   2'273
         CG_RBP:       -       -       -       -       -       -       -       -     814     328     759     951     594     169     990     342     311     143
         Clique:       -       -       -       -       -       -       -       -       -     258       -     475     325     184       -       -     115     229
             IB:      94      94      94      50      94      50      94      50   4'087   2'438   4'460   5'795   3'748   1'307   2'814   1'969     911   1'623
       MIR_1_FF:      37      38      38      31      35      31      33      30   1'395   1'248   1'693   2'558   1'654     548   1'503     901   1'088     902
        MIR_1_K:       6       6       6       3       4       3       3       3     234     257     238     629     515      81     145     149     175     179
       MIR_1_KL:       -       -       -       -       -       -       -       -      17       8      14      17      10       -      18       2       9       1
        MIR_1_R:      12      12      12       9      10       9       9       9     384     248     433     572     354      93     481     245     245     148
       MIR_1_RB:      10      10      12       7      10       8       8       8   2'679   3'135   3'392   5'781   4'019   1'418   3'371   1'696   2'822   2'385
      MIR_1_RBP:       -       1       -       -       -       -       -       -     106     415      95     687     377     176      97      21     204     133
      MIR_1_RLT:       -       -       -       -       -       -       -       -       -       8       -      19       6      12       -       -       6       6
       MIR_2_FF:       9      11       8       8       7       8       9       8     900     836   1'054   1'830   1'178     375   1'161     577     619     614
        MIR_2_K:       1       -       4       -       2       1       1       3     153     201     151     456     353      66     198     104     108     117
       MIR_2_KL:       -       -       -       -       -       -       -       -      27      13      22      48      31       5      43      10      10      10
        MIR_2_R:       2       3       2       2       2       2       3       3     433     551     568     978     677     290     879     240     957     505
       MIR_2_RB:       6       2       7       5       3       4       3       4   1'957   1'979   2'440   3'662   2'632     894   2'770   1'266   1'867   1'530
      MIR_2_RBP:       -       -       -       -       -       -       -       -     157     335     131     464     322     103     201      31     184     100
       MIR_3_FF:       -       -       -       -       -       -       -       -     519     592     629   1'314     818     235     618     397     463     377
        MIR_3_K:       -       -       -       -       -       -       -       -     127     123     124     432     255      50     142      97     121      94
       MIR_3_KL:       -       -       -       -       -       -       -       -      20      20      20      36      28      11      31      11      11      12
        MIR_3_R:       -       -       -       -       -       -       -       -     308     418     402     837     539     183     539     216     567     358
       MIR_3_RB:       -       -       -       -       -       -       -       -   1'278   1'194   1'706   2'321   1'510     519   1'860     889   1'170     934
      MIR_3_RBP:       -       -       -       -       -       -       -       -      92     182     102     303     212      63     110      31     128      58
       MIR_4_FF:       -       -       -       -       -       -       -       -     313     315     378     707     484     141     367     217     211     214
        MIR_4_K:       -       -       -       -       -       -       -       -      84      96     109     281     162      36     139      73      65      67
       MIR_4_KL:       -       -       -       -       -       -       -       -      14       9      25      16      23       2      34       8       4      11
        MIR_4_R:       -       -       -       -       -       -       -       -     214     243     266     500     318     104     336     176     308     216
       MIR_4_RB:       -       -       -       -       -       -       -       -     684     593   1'012   1'241     802     299   1'090     540     624     470
      MIR_4_RBP:       -       -       -       -       -       -       -       -      70     115      62     165     118      28      51      19      65      43
       MIR_5_FF:       -       -       -       -       -       -       -       -     238     156     263     376     241      83     243     150     105     112
        MIR_5_K:       -       -       -       -       -       -       -       -      59      51      81     159     106      18     103      35      41      47
       MIR_5_KL:       -       -       -       -       -       -       -       -       8       7      15       7      21       4      28      14       9       6
        MIR_5_R:       -       -       -       -       -       -       -       -     174     132     202     264     181      69     224     119     120     110
       MIR_5_RB:       -       -       -       -       -       -       -       -     421     336     620     671     480     180     651     318     281     262
      MIR_5_RBP:       -       -       -       -       -       -       -       -      40      47      30     120      63      21      66      16      55      36
       MIR_6_FF:       -       -       -       -       -       -       -       -     155      89     146     205     160      49     145      97      54      70
        MIR_6_K:       -       -       -       -       -       -       -       -      50      35      49     100      69      14      70      33      37      29
       MIR_6_KL:       -       -       -       -       -       -       -       -       6       -       7       7       8       -       7       7       1       2
        MIR_6_R:       -       -       -       -       -       -       -       -     138      65      97     126     109      33     112      68      85      49
       MIR_6_RB:       -       -       -       -       -       -       -       -     274     166     320     394     288      82     363     165     149     153
      MIR_6_RBP:       -       -       -       -       -       -       -       -      26      38      14      73      67      15      23       8      26      25
   ZERO_HALF_FF:       2       1       2       2       2       1       1       1     338     276     290     665     479     114     280     169     142     182
    ZERO_HALF_K:       -       -       -       -       -       -       -       -      57     104      55     264     197      43      57      42      54      47
   ZERO_HALF_KL:       -       -       -       -       -       -       -       -       -       -       -       2       1       2       -       -       -       -
    ZERO_HALF_R:       3       2       2       2       3       2       1       2   2'502   3'264   4'464   4'804   3'424   1'334   9'927   1'779  16'492   3'228
   ZERO_HALF_RB:       1       1       1       1       1       1       1       1     824     956   1'089   1'675   1'257     463   1'230     492   1'396     718
  ZERO_HALF_RBP:       -       -       -       -       -       -       -       -     167     197     222     334     201      52     456      40   1'174      84

LNS stats           Improv/Calls  Closed  Difficulty  TimeLimit
  'graph_arc_lns':       32/1082     51%        0.99       0.15
  'graph_cst_lns':        22/963     52%        0.99       0.13
  'graph_dec_lns':       22/1082     51%        0.99       0.15
  'graph_var_lns':       35/1082     51%        0.99       0.15
      'rins/rens':       138/945     51%        0.90       0.10
    'rnd_cst_lns':       33/1082     52%        0.99       0.14
    'rnd_var_lns':       30/1083     52%        0.99       0.15

LS stats                   Batches  Restarts   LinMoves   GenMoves  CompoundMoves  WeightUpdates
       'fj_long_default':        1         1      8'250          0              0            139
       'fj_long_default':        1         1      9'823          0              0            177
   'fj_long_lin_default':        1         1          0      2'724            565              2
   'fj_long_lin_perturb':        1         1      8'624          0              0          1'376
    'fj_long_lin_random':        1         1      9'050          0              0            950
       'fj_long_perturb':        1         1          0      2'436            481              1
        'fj_long_random':        1         1      9'829          0              0            171
      'fj_short_default':        1         1          0      2'418            341              0
      'fj_short_default':        1         1      9'175          0              0            825
  'fj_short_lin_default':        1         1          0      2'333            557              1
  'fj_short_lin_default':        1         1          0      2'484            495              1
  'fj_short_lin_perturb':        1         1      9'834          0              0            166
   'fj_short_lin_random':        1         1          0      2'144            406              0
      'fj_short_perturb':        1         1      7'393          0              0            119
       'fj_short_random':        1         1          0      2'607            681              1
          'violation_ls':    1'072         0  5'908'864  2'047'070        140'317         86'073
          'violation_ls':    1'077         0  4'786'999  2'351'478        182'097        386'889
          'violation_ls':    1'078         0  5'572'455  1'769'125         87'754        970'529
          'violation_ls':    1'078         0  5'802'792  1'918'891        121'547        690'526
          'violation_ls':    1'080         0  1'771'507  3'979'578        239'766        294'944

Solutions (96)            Num     Rank
        'graph_arc_lns':    1  [94,94]
        'graph_dec_lns':    1  [24,24]
                'no_lp':   24   [1,71]
  'quick_restart_no_lp':   13  [27,88]
          'rins_lp_lns':    1  [79,79]
        'rins_pump_lns':    1  [15,15]
          'rnd_cst_lns':    1  [96,96]
          'rnd_var_lns':    2  [89,95]
         'violation_ls':   52  [17,93]

Objective bounds                      Num
                        'bool_core':   10
                   'initial_domain':    1
                   'lb_tree_search':    8
              'objective_lb_search':    2
       'objective_lb_search_max_lp':    2
        'objective_lb_search_no_lp':   73
  'objective_shaving_search_max_lp':    1
   'objective_shaving_search_no_lp':    5

Solution repositories     Added  Queried  Ignored  Synchro
  'feasible solutions':   7'065   21'364        1    6'768
        'lp solutions':   1'740      509        0    1'602
                'pump':  20'344      575

Improving bounds shared            Num
                        'core':     73
                  'default_lp':    301
              'lb_tree_search':    164
                      'max_lp':    211
                       'no_lp':    549
         'objective_lb_search':    207
  'objective_lb_search_max_lp':    132
   'objective_lb_search_no_lp':      5
                     'probing':    931
              'probing_max_lp':    477
                'pseudo_costs':    538
               'quick_restart':    503
         'quick_restart_no_lp':  2'977
               'reduced_costs':    546

Clauses shared                   Num
                        'core':    9
                  'default_lp':   26
             'fs_random_no_lp':    2
              'lb_tree_search':    6
                      'max_lp':   94
                       'no_lp':   51
         'objective_lb_search':   25
  'objective_lb_search_max_lp':   37
   'objective_lb_search_no_lp':    7
                'pseudo_costs':  160
               'quick_restart':   30
         'quick_restart_no_lp':  120
               'reduced_costs':   54

CpSolverResponse summary:
status: OPTIMAL
objective: 786
best_bound: 786
integers: 351
booleans: 110
conflicts: 0
branches: 220
propagations: 18
integer_propagations: 5203
restarts: 220
lp_iterations: 220
walltime: 432.585
usertime: 432.585
deterministic_time: 2079.8
gap_integral: 6438.41
solution_fingerprint: 0x8b5277b9019cc8c9


--- Simulation Gantt  partir du modle mathmatique ---
{'big':0, 'due_date':112, 'pos_time':5, 'status':0, 'blocked':0, 'operations':["{'type':1, 'processing_time':16}"]}
{'big':0, 'due_date':156, 'pos_time':5, 'status':0, 'blocked':0, 'operations':["{'type':1, 'processing_time':10}", "{'type':0, 'processing_time':33}"]}
{'big':1, 'due_date':144, 'pos_time':5, 'status':0, 'blocked':0, 'operations':["{'type':1, 'processing_time':15}"]}
{'big':1, 'due_date':203, 'pos_time':5, 'status':0, 'blocked':0, 'operations':["{'type':0, 'processing_time':60}", "{'type':1, 'processing_time':11}"]}
{'big':1, 'due_date':162, 'pos_time':5, 'status':0, 'blocked':0, 'operations':["{'type':0, 'processing_time':13}", "{'type':1, 'processing_time':17}"]}
{'big':1, 'due_date':123, 'pos_time':5, 'status':0, 'blocked':0, 'operations':["{'type':1, 'processing_time':26}"]}
{'big':1, 'due_date':160, 'pos_time':5, 'status':0, 'blocked':0, 'operations':["{'type':0, 'processing_time':54}", "{'type':1, 'processing_time':60}"]}
{'big':0, 'due_date':188, 'pos_time':5, 'status':0, 'blocked':0, 'operations':["{'type':1, 'processing_time':40}", "{'type':0, 'processing_time':34}"]}
{'big':0, 'due_date':113, 'pos_time':5, 'status':0, 'blocked':0, 'operations':["{'type':0, 'processing_time':25}"]}
