created virtual environment CPython3.12.4.final.0-64 in 343ms
  creator CPython3Posix(dest=/localscratch/aneumann.46806145.0/env, clear=False, no_vcs_ignore=False, global=False)
  seeder FromAppData(download=False, pip=bundle, via=copy, app_data_dir=/home/aneumann/.local/share/virtualenv)
    added seed packages: pip==24.2+computecanada
  activators BashActivator,CShellActivator,FishActivator,NushellActivator,PowerShellActivator,PythonActivator
Looking in links: /cvmfs/soft.computecanada.ca/custom/python/wheelhouse/gentoo2023/x86-64-v3, /cvmfs/soft.computecanada.ca/custom/python/wheelhouse/gentoo2023/generic, /cvmfs/soft.computecanada.ca/custom/python/wheelhouse/generic
Requirement already satisfied: pip in /localscratch/aneumann.46806145.0/env/lib/python3.12/site-packages (24.2+computecanada)
Processing /cvmfs/soft.computecanada.ca/custom/python/wheelhouse/generic/pip-25.0+computecanada-py3-none-any.whl
Installing collected packages: pip
  Attempting uninstall: pip
    Found existing installation: pip 24.2+computecanada
    Uninstalling pip-24.2+computecanada:
      Successfully uninstalled pip-24.2+computecanada
Successfully installed pip-24.2+computecanada
Looking in links: /cvmfs/soft.computecanada.ca/custom/python/wheelhouse/gentoo2023/x86-64-v3, /cvmfs/soft.computecanada.ca/custom/python/wheelhouse/gentoo2023/generic, /cvmfs/soft.computecanada.ca/custom/python/wheelhouse/generic
ERROR: protobuf-5.28.3-cp38-abi3-manylinux2014_x86_64.whl is not a supported wheel on this platform.
Looking in links: /cvmfs/soft.computecanada.ca/custom/python/wheelhouse/gentoo2023/x86-64-v3, /cvmfs/soft.computecanada.ca/custom/python/wheelhouse/gentoo2023/generic, /cvmfs/soft.computecanada.ca/custom/python/wheelhouse/generic
Processing /home/aneumann/projects/def-adhaj/aneumann/GNRS/wheels/immutabledict-4.2.0-py3-none-any.whl
Installing collected packages: immutabledict
Successfully installed immutabledict-4.2.0
Looking in links: /cvmfs/soft.computecanada.ca/custom/python/wheelhouse/gentoo2023/x86-64-v3, /cvmfs/soft.computecanada.ca/custom/python/wheelhouse/gentoo2023/generic, /cvmfs/soft.computecanada.ca/custom/python/wheelhouse/generic
Processing /cvmfs/soft.computecanada.ca/custom/python/wheelhouse/generic/ortools-9.10.4067+computecanada-cp312-cp312-linux_x86_64.whl (from -r /home/aneumann/projects/def-adhaj/aneumann/GNRS/requirements/or.txt (line 1))
Processing /cvmfs/soft.computecanada.ca/custom/python/wheelhouse/gentoo2023/x86-64-v3/matplotlib-3.10.0+computecanada-cp312-cp312-linux_x86_64.whl (from -r /home/aneumann/projects/def-adhaj/aneumann/GNRS/requirements/or.txt (line 2))
Processing /cvmfs/soft.computecanada.ca/custom/python/wheelhouse/gentoo2023/x86-64-v3/pandas-2.2.3+computecanada-cp312-cp312-linux_x86_64.whl (from -r /home/aneumann/projects/def-adhaj/aneumann/GNRS/requirements/or.txt (line 3))
Processing /cvmfs/soft.computecanada.ca/custom/python/wheelhouse/generic/absl_py-2.3.0+computecanada-py3-none-any.whl (from ortools<9.11,>=9.10->-r /home/aneumann/projects/def-adhaj/aneumann/GNRS/requirements/or.txt (line 1))
Processing /cvmfs/soft.computecanada.ca/custom/python/wheelhouse/gentoo2023/generic/numpy-2.2.2+computecanada-cp312-cp312-linux_x86_64.whl (from ortools<9.11,>=9.10->-r /home/aneumann/projects/def-adhaj/aneumann/GNRS/requirements/or.txt (line 1))
Processing /cvmfs/soft.computecanada.ca/custom/python/wheelhouse/gentoo2023/x86-64-v3/protobuf-6.31.1+computecanada-cp312-cp312-linux_x86_64.whl (from ortools<9.11,>=9.10->-r /home/aneumann/projects/def-adhaj/aneumann/GNRS/requirements/or.txt (line 1))
Requirement already satisfied: immutabledict>=3.0.0 in /localscratch/aneumann.46806145.0/env/lib/python3.12/site-packages (from ortools<9.11,>=9.10->-r /home/aneumann/projects/def-adhaj/aneumann/GNRS/requirements/or.txt (line 1)) (4.2.0)
Processing /cvmfs/soft.computecanada.ca/custom/python/wheelhouse/gentoo2023/generic/contourpy-1.3.1+computecanada-cp312-cp312-linux_x86_64.whl (from matplotlib->-r /home/aneumann/projects/def-adhaj/aneumann/GNRS/requirements/or.txt (line 2))
Processing /cvmfs/soft.computecanada.ca/custom/python/wheelhouse/generic/cycler-0.12.1+computecanada-py3-none-any.whl (from matplotlib->-r /home/aneumann/projects/def-adhaj/aneumann/GNRS/requirements/or.txt (line 2))
Processing /cvmfs/soft.computecanada.ca/custom/python/wheelhouse/generic/fonttools-4.59.0+computecanada-cp312-cp312-linux_x86_64.whl (from matplotlib->-r /home/aneumann/projects/def-adhaj/aneumann/GNRS/requirements/or.txt (line 2))
Processing /cvmfs/soft.computecanada.ca/custom/python/wheelhouse/gentoo2023/x86-64-v3/kiwisolver-1.4.8+computecanada-cp312-cp312-linux_x86_64.whl (from matplotlib->-r /home/aneumann/projects/def-adhaj/aneumann/GNRS/requirements/or.txt (line 2))
Processing /cvmfs/soft.computecanada.ca/custom/python/wheelhouse/generic/packaging-25.0+computecanada-py3-none-any.whl (from matplotlib->-r /home/aneumann/projects/def-adhaj/aneumann/GNRS/requirements/or.txt (line 2))
Processing /cvmfs/soft.computecanada.ca/custom/python/wheelhouse/gentoo2023/x86-64-v3/pillow-11.1.0+computecanada-cp312-cp312-linux_x86_64.whl (from matplotlib->-r /home/aneumann/projects/def-adhaj/aneumann/GNRS/requirements/or.txt (line 2))
Processing /cvmfs/soft.computecanada.ca/custom/python/wheelhouse/generic/pyparsing-3.2.3+computecanada-py3-none-any.whl (from matplotlib->-r /home/aneumann/projects/def-adhaj/aneumann/GNRS/requirements/or.txt (line 2))
Processing /cvmfs/soft.computecanada.ca/custom/python/wheelhouse/generic/python_dateutil-2.9.0.post0+computecanada-py2.py3-none-any.whl (from matplotlib->-r /home/aneumann/projects/def-adhaj/aneumann/GNRS/requirements/or.txt (line 2))
Processing /cvmfs/soft.computecanada.ca/custom/python/wheelhouse/generic/pytz-2025.2+computecanada-py2.py3-none-any.whl (from pandas->-r /home/aneumann/projects/def-adhaj/aneumann/GNRS/requirements/or.txt (line 3))
Processing /cvmfs/soft.computecanada.ca/custom/python/wheelhouse/generic/tzdata-2025.2+computecanada-py2.py3-none-any.whl (from pandas->-r /home/aneumann/projects/def-adhaj/aneumann/GNRS/requirements/or.txt (line 3))
Processing /cvmfs/soft.computecanada.ca/custom/python/wheelhouse/generic/six-1.17.0+computecanada-py2.py3-none-any.whl (from python-dateutil>=2.7->matplotlib->-r /home/aneumann/projects/def-adhaj/aneumann/GNRS/requirements/or.txt (line 2))
Installing collected packages: pytz, tzdata, six, pyparsing, protobuf, pillow, packaging, numpy, kiwisolver, fonttools, cycler, absl-py, python-dateutil, contourpy, pandas, matplotlib, ortools
Successfully installed absl-py-2.3.0+computecanada contourpy-1.3.1+computecanada cycler-0.12.1+computecanada fonttools-4.59.0+computecanada kiwisolver-1.4.8+computecanada matplotlib-3.10.0+computecanada numpy-2.2.2+computecanada ortools-9.10.4067+computecanada packaging-25.0+computecanada pandas-2.2.3+computecanada pillow-11.1.0+computecanada protobuf-6.31.1+computecanada pyparsing-3.2.3+computecanada python-dateutil-2.9.0.post0+computecanada pytz-2025.2+computecanada six-1.17.0+computecanada tzdata-2025.2+computecanada

Starting CP-SAT solver v9.10.4067
Parameters: max_time_in_seconds: 86400 max_memory_in_mb: 185000 log_search_progress: true enumerate_all_solutions: false num_search_workers: 32 absolute_gap_limit: 0 relative_gap_limit: 0

Initial optimization model '': (model_fingerprint: 0xadeba2745b2a5352)
#Variables: 318 (#ints: 8 in objective)
  - 234 Booleans in [0,1]
  - 84 in [0,665]
#kLinear1: 43
#kLinear2: 428
#kLinear3: 157
#kLinearN: 3'781 (#terms: 52'711)

Starting presolve at 0.00s
  1.60e-03s  0.00e+00d  [DetectDominanceRelations] 
  2.60e-02s  0.00e+00d  [PresolveToFixPoint] #num_loops=8 #num_dual_strengthening=3 
  3.49e-05s  0.00e+00d  [ExtractEncodingFromLinear] #potential_supersets=6 
[Symmetry] Graph for symmetry has 4'486 nodes and 42'377 arcs.
[Symmetry] Symmetry computation done. time: 0.00165067 dtime: 0.00373664
[Symmetry] #generators: 1, average support size: 26
[Symmetry] The model contains 208 duplicate constraints !
[Symmetry] 13 orbits with sizes: 2,2,2,2,2,2,2,2,2,2,...
[Symmetry] Num fixable by intersecting at_most_one with orbits: 1 largest_orbit: 2
  9.54e-03s  2.35e-03d  [Probe] #probed=356 #new_bounds=1 #equiv=1 
  8.17e-05s  0.00e+00d  [MaxClique] Merged 27(54 literals) into 11(22 literals) at_most_ones. 
  1.49e-03s  0.00e+00d  [DetectDominanceRelations] 
  1.01e-02s  0.00e+00d  [PresolveToFixPoint] #num_loops=5 #num_dual_strengthening=3 
  4.83e-03s  0.00e+00d  [ProcessAtMostOneAndLinear] 
  2.01e-03s  0.00e+00d  [DetectDuplicateConstraints] #duplicates=284 #without_enforcements=246 
  2.02e-03s  1.76e-04d  [DetectDominatedLinearConstraints] #relevant_constraints=3'254 #num_inclusions=3'280 
  3.51e-04s  0.00e+00d  [DetectDifferentVariables] #different=33 #cliques=1 #size=7 
  4.59e-04s  5.43e-05d  [ProcessSetPPC] #relevant_constraints=2'714 
  1.62e-05s  0.00e+00d  [FindAlmostIdenticalLinearConstraints] 
  2.09e-04s  3.49e-04d  [FindBigAtMostOneAndLinearOverlap] 
  4.82e-03s  3.39e-03d  [FindBigVerticalLinearOverlap] #blocks=50 #saved_nz=7'074 
  2.93e-04s  1.27e-04d  [FindBigHorizontalLinearOverlap] #linears=2'617 
  1.89e-05s  0.00e+00d  [MergeClauses] 
  1.62e-03s  0.00e+00d  [DetectDominanceRelations] 
  1.80e-02s  0.00e+00d  [PresolveToFixPoint] #num_loops=2 #num_dual_strengthening=1 
  1.62e-03s  0.00e+00d  [DetectDominanceRelations] 
  1.00e-02s  0.00e+00d  [PresolveToFixPoint] #num_loops=1 #num_dual_strengthening=1 
[Symmetry] Graph for symmetry has 4'362 nodes and 34'225 arcs.
[Symmetry] Symmetry computation done. time: 0.000768815 dtime: 0.00183637
  9.20e-03s  2.28e-03d  [Probe] #probed=356 #new_bounds=29 
  1.16e-05s  0.00e+00d  [MaxClique] 
  1.62e-03s  0.00e+00d  [DetectDominanceRelations] 
  1.47e-02s  0.00e+00d  [PresolveToFixPoint] #num_loops=2 #num_dual_strengthening=1 
  4.28e-03s  0.00e+00d  [ProcessAtMostOneAndLinear] 
  1.76e-03s  0.00e+00d  [DetectDuplicateConstraints] #without_enforcements=295 
  9.87e-04s  8.36e-05d  [DetectDominatedLinearConstraints] #relevant_constraints=2'737 #num_inclusions=25 
  2.03e-04s  0.00e+00d  [DetectDifferentVariables] 
  4.17e-04s  3.83e-05d  [ProcessSetPPC] #relevant_constraints=2'484 
  2.56e-05s  1.80e-07d  [FindAlmostIdenticalLinearConstraints] #num_tested_pairs=12 
  1.36e-04s  1.91e-04d  [FindBigAtMostOneAndLinearOverlap] 
  3.14e-03s  2.42e-03d  [FindBigVerticalLinearOverlap] #blocks=49 #saved_nz=3'609 
  2.49e-04s  9.89e-05d  [FindBigHorizontalLinearOverlap] #linears=2'335 
  1.05e-05s  0.00e+00d  [MergeClauses] 
  1.51e-03s  0.00e+00d  [DetectDominanceRelations] 
  1.61e-02s  0.00e+00d  [PresolveToFixPoint] #num_loops=2 #num_dual_strengthening=1 
  1.50e-03s  0.00e+00d  [DetectDominanceRelations] 
  1.08e-02s  0.00e+00d  [PresolveToFixPoint] #num_loops=1 #num_dual_strengthening=1 
[Symmetry] Graph for symmetry has 4'486 nodes and 30'643 arcs.
[Symmetry] Symmetry computation done. time: 0.000612434 dtime: 0.00171745
  8.45e-03s  2.16e-03d  [Probe] #probed=356 #new_bounds=36 
  1.21e-05s  0.00e+00d  [MaxClique] 
  1.51e-03s  0.00e+00d  [DetectDominanceRelations] 
  1.49e-02s  0.00e+00d  [PresolveToFixPoint] #num_loops=2 #num_dual_strengthening=1 
  3.99e-03s  0.00e+00d  [ProcessAtMostOneAndLinear] 
  1.77e-03s  0.00e+00d  [DetectDuplicateConstraints] #without_enforcements=309 
  8.34e-04s  6.88e-05d  [DetectDominatedLinearConstraints] #relevant_constraints=2'719 #num_inclusions=21 
  2.00e-04s  0.00e+00d  [DetectDifferentVariables] 
  3.51e-04s  2.95e-05d  [ProcessSetPPC] #relevant_constraints=2'279 
  3.21e-05s  5.40e-07d  [FindAlmostIdenticalLinearConstraints] #num_tested_pairs=35 
  1.02e-04s  1.25e-04d  [FindBigAtMostOneAndLinearOverlap] 
  2.42e-03s  1.92e-03d  [FindBigVerticalLinearOverlap] #blocks=39 #saved_nz=2'448 
  2.31e-04s  7.87e-05d  [FindBigHorizontalLinearOverlap] #linears=2'005 
  9.99e-06s  0.00e+00d  [MergeClauses] 
  1.39e-03s  0.00e+00d  [DetectDominanceRelations] 
  1.38e-02s  0.00e+00d  [PresolveToFixPoint] #num_loops=2 #num_dual_strengthening=1 
  8.44e-05s  0.00e+00d  [ExpandObjective] #entries=591 #tight_variables=219 #tight_constraints=124 

Presolve summary:
  - 77 affine relations were detected.
  - rule 'TODO dual: only one blocking constraint?' was applied 675 times.
  - rule 'TODO dual: only one blocking enforced constraint?' was applied 130 times.
  - rule 'TODO dual: only one unspecified blocking constraint?' was applied 45 times.
  - rule 'TODO duplicate: identical constraint with different enforcements' was applied 850 times.
  - rule 'affine: new relation' was applied 77 times.
  - rule 'at_most_one: removed literals' was applied 11 times.
  - rule 'at_most_one: size one' was applied 11 times.
  - rule 'at_most_one: transformed into max clique.' was applied 1 time.
  - rule 'deductions: 253 stored' was applied 1 time.
  - rule 'dual: fix variable' was applied 21 times.
  - rule 'dual: reduced domain' was applied 40 times.
  - rule 'duplicate: merged rhs of linear constraint' was applied 72 times.
  - rule 'duplicate: removed constraint' was applied 284 times.
  - rule 'enforcement: false literal' was applied 2 times.
  - rule 'exactly_one: x and not(x)' was applied 1 time.
  - rule 'incompatible linear: add implication' was applied 63 times.
  - rule 'linear matrix: common vertical rectangle' was applied 138 times.
  - rule 'linear: always true' was applied 484 times.
  - rule 'linear: doubleton free' was applied 12 times.
  - rule 'linear: empty' was applied 26 times.
  - rule 'linear: extracted enforcement literal' was applied 7'957 times.
  - rule 'linear: fixed or dup variables' was applied 3'851 times.
  - rule 'linear: positive equal one' was applied 6 times.
  - rule 'linear: reduced variable domains' was applied 234 times.
  - rule 'linear: remapped using affine relations' was applied 3'870 times.
  - rule 'linear: simplified rhs' was applied 10'417 times.
  - rule 'linear: tightened into equality' was applied 5 times.
  - rule 'linear: variable substitution 1' was applied 12 times.
  - rule 'linear: variable substitution 3' was applied 6 times.
  - rule 'no_overlap: inferred from x != y constraints' was applied 1 time.
  - rule 'presolve: 80 unused variables removed.' was applied 1 time.
  - rule 'presolve: iteration' was applied 3 times.
  - rule 'probing: reduced enforced constraint to implication.' was applied 27 times.
  - rule 'symmetry: fixed to false in general orbit' was applied 1 time.

Presolved optimization model '': (model_fingerprint: 0x5aa4f97d880f5e87)
#Variables: 281 (#ints: 8 in objective)
  - 94 Booleans in [0,1]
  - 150 different domains in [-5245,5176] with a largest complexity of 11.
#kExactlyOne: 5 (#literals: 15)
#kInterval: 7
#kLinear2: 929 (#enforced: 888 #multi: 770)
#kLinear3: 297 (#enforced: 192)
#kLinearN: 2'398 (#enforced: 2'180 #multi: 91) (#terms: 17'337)
#kNoOverlap: 1 (#intervals: 7)

Preloading model.
#Bound   0.22s best:inf   next:[160,4507] initial_domain
[Symmetry] Graph for symmetry has 4'414 nodes and 28'225 arcs.
[Symmetry] Symmetry computation done. time: 0.000586505 dtime: 0.00161087
#Model   0.22s var:281/281 constraints:3637/3637

Starting search at 0.23s with 32 workers.
17 full problem subsolvers: [core, default_lp, fixed, lb_tree_search, max_lp, no_lp, objective_lb_search, objective_lb_search_max_lp, objective_lb_search_no_lp, objective_shaving_search_max_lp, objective_shaving_search_no_lp, probing, probing_max_lp, pseudo_costs, quick_restart, quick_restart_no_lp, reduced_costs]
13 first solution subsolvers: [fj_long_default, fj_long_lin_default, fj_long_random, fj_short_default, fj_short_lin_default, fj_short_lin_random, fj_short_random, fs_random(2), fs_random_no_lp, fs_random_quick_restart(2), fs_random_quick_restart_no_lp]
13 incomplete subsolvers: [feasibility_pump, graph_arc_lns, graph_cst_lns, graph_dec_lns, graph_var_lns, rins/rens, rnd_cst_lns, rnd_var_lns, scheduling_intervals_lns, scheduling_precedences_lns, scheduling_time_window_lns, violation_ls(2)]
3 helper subsolvers: [neighborhood_helper, synchronization_agent, update_gap_integral]
#Bound   0.28s best:inf   next:[169,4507] objective_lb_search_no_lp
#Bound   0.29s best:inf   next:[240,4507] objective_lb_search_no_lp
#1       0.31s best:2006  next:[240,2005] no_lp (fixed_bools=0/125)
#2       0.32s best:1819  next:[240,1818] no_lp (fixed_bools=0/143)
#3       0.33s best:1755  next:[240,1754] no_lp (fixed_bools=1/154)
#4       0.33s best:1739  next:[240,1738] no_lp (fixed_bools=1/160)
#5       0.36s best:1738  next:[240,1737] violation_ls(batch:1 #solutions_imported:1 #lin_moves:2'383 #lin_evals:7'324 #weight_updates:243)
#6       0.36s best:1736  next:[240,1735] violation_ls(batch:2 #solutions_imported:2 #lin_moves:2'384 #lin_evals:7'332 #weight_updates:243)
#7       0.37s best:1734  next:[240,1733] graph_var_lns (d=0.50 s=46 t=0.10 p=0.00 stall=0 h=auto_l0) [hint]
#8       0.38s best:1733  next:[240,1732] violation_ls(batch:2 #solutions_imported:2 #lin_moves:63 #lin_evals:13'516 #gen_moves:6'690 #gen_evals:1'799 #comp_moves:693 #backtracks:2'996 #weight_updates:107)
#9       0.39s best:1683  next:[240,1682] no_lp (fixed_bools=1/182)
#10      0.39s best:1406  next:[240,1405] no_lp (fixed_bools=1/194)
#Bound   0.42s best:1406  next:[241,1405] bool_core (num_cores=3 [cover] a=6 d=1 fixed=78/340 clauses=643)
#Bound   0.42s best:1406  next:[243,1405] objective_lb_search_no_lp
#Bound   0.42s best:1406  next:[244,1405] bool_core (num_cores=3 [cover] a=6 d=1 fixed=81/349 clauses=754)
#Bound   0.42s best:1406  next:[251,1405] objective_lb_search_no_lp
#Bound   0.42s best:1406  next:[255,1405] objective_lb_search_no_lp
#Bound   0.42s best:1406  next:[353,1405] objective_lb_search_no_lp
#11      0.42s best:1396  next:[353,1395] no_lp (fixed_bools=1/204)
#Bound   0.42s best:1396  next:[360,1395] objective_lb_search_no_lp
#Bound   0.43s best:1396  next:[558,1395] objective_lb_search_no_lp
#Bound   0.45s best:1396  next:[559,1395] objective_lb_search_no_lp
#12      0.45s best:1368  next:[559,1367] no_lp (fixed_bools=1/211)
#13      0.48s best:1366  next:[559,1365] no_lp (fixed_bools=1/225)
#Bound   0.48s best:1366  next:[564,1365] objective_lb_search_no_lp
#14      0.49s best:1361  next:[564,1360] no_lp (fixed_bools=1/233)
#Bound   0.50s best:1361  next:[582,1360] objective_lb_search_no_lp
#15      0.50s best:1358  next:[582,1357] no_lp (fixed_bools=1/234)
#16      0.51s best:1347  next:[582,1346] no_lp (fixed_bools=1/238)
#17      0.52s best:1342  next:[582,1341] no_lp (fixed_bools=1/239)
#18      0.52s best:1341  next:[582,1340] no_lp (fixed_bools=1/239)
#Bound   0.53s best:1341  next:[608,1340] objective_lb_search_no_lp
#19      0.55s best:1340  next:[608,1339] no_lp (fixed_bools=1/239)
#20      0.57s best:1338  next:[608,1337] rnd_cst_lns (d=0.50 s=57 t=0.10 p=0.00 stall=0 h=auto_l0) [presolve]
#21      0.57s best:1331  next:[608,1330] no_lp (fixed_bools=1/240)
#Bound   0.63s best:1331  next:[614,1330] objective_lb_search_no_lp
#Bound   0.65s best:1331  next:[615,1330] objective_lb_search_no_lp
#22      0.65s best:1313  next:[615,1312] quick_restart_no_lp (fixed_bools=0/228)
#Bound   0.69s best:1313  next:[624,1312] objective_lb_search_no_lp
#Bound   0.74s best:1313  next:[645,1312] objective_lb_search_no_lp
#Bound   0.80s best:1313  next:[672,1312] objective_lb_search_no_lp
#23      0.84s best:1306  next:[672,1305] no_lp (fixed_bools=1/262)
#24      0.87s best:1285  next:[672,1284] no_lp (fixed_bools=1/271)
#Bound   0.90s best:1285  next:[675,1284] objective_lb_search_no_lp
#25      0.96s best:1269  next:[675,1268] no_lp (fixed_bools=1/304)
#26      1.07s best:1251  next:[675,1250] no_lp (fixed_bools=1/328)
#Bound   1.18s best:1251  next:[679,1250] objective_lb_search_no_lp
#27      1.23s best:1241  next:[690,1240] graph_dec_lns (d=0.91 s=96 t=0.10 p=1.00 stall=2 h=auto_l0)
#28      1.35s best:1236  next:[690,1235] no_lp (fixed_bools=1/375)
#29      1.44s best:1226  next:[690,1225] no_lp (fixed_bools=1/394)
#30      1.51s best:1209  next:[712,1208] no_lp (fixed_bools=1/406)
#31      1.58s best:1200  next:[735,1199] no_lp (fixed_bools=1/416)
#32      1.66s best:1179  next:[740,1178] rins_pump_lns (d=0.91 s=105 t=0.10 p=1.00 stall=1 h=auto_l0)
#Bound   2.01s best:1179  next:[748,1178] objective_lb_search_no_lp [skipped_logs=10]
#33      2.06s best:1171  next:[748,1170] quick_restart_no_lp (fixed_bools=2/500)
#34      2.22s best:1156  next:[757,1155] quick_restart_no_lp (fixed_bools=3/562)
#35      2.25s best:1112  next:[797,1111] quick_restart_no_lp (fixed_bools=3/599)
#Bound   2.70s best:1112  next:[807,1111] objective_lb_search_no_lp [skipped_logs=8]
#Bound   3.98s best:1112  next:[822,1111] objective_lb_search_no_lp [skipped_logs=2]
#Bound   4.73s best:1112  next:[825,1111] objective_lb_search_no_lp [skipped_logs=1]
#Bound   5.31s best:1112  next:[827,1111] objective_lb_search_no_lp [skipped_logs=0]
#Bound   6.94s best:1112  next:[835,1111] objective_lb_search_no_lp [skipped_logs=4]
#Bound   7.60s best:1112  next:[839,1111] objective_lb_search_no_lp [skipped_logs=2]
#Bound   8.11s best:1112  next:[841,1111] objective_lb_search_no_lp [skipped_logs=0]
#Bound   9.97s best:1112  next:[845,1111] objective_lb_search_no_lp [skipped_logs=2]
#Bound  11.50s best:1112  next:[847,1111] objective_lb_search_no_lp
#Bound  13.01s best:1112  next:[848,1111] objective_lb_search_no_lp
#Bound  15.54s best:1112  next:[849,1111] objective_shaving_search_no_lp (vars=323 csts=3582)
#Bound  15.87s best:1112  next:[850,1111] objective_lb_search_no_lp
#Bound  16.63s best:1112  next:[853,1111] objective_lb_search_no_lp
#Bound  17.37s best:1112  next:[855,1111] objective_lb_search_no_lp
#Bound  18.03s best:1112  next:[857,1111] objective_lb_search_no_lp
#Bound  18.39s best:1112  next:[859,1111] objective_lb_search_no_lp
#Bound  18.56s best:1112  next:[861,1111] objective_lb_search_no_lp [skipped_logs=0]
#Bound  19.75s best:1112  next:[864,1111] objective_lb_search_no_lp [skipped_logs=1]
#Bound  20.48s best:1112  next:[866,1111] objective_lb_search_no_lp [skipped_logs=0]
#Bound  22.13s best:1112  next:[872,1111] objective_lb_search_no_lp
#Bound  24.57s best:1112  next:[874,1111] objective_lb_search_no_lp
#Bound  25.18s best:1112  next:[875,1111] objective_lb_search_no_lp
#Bound  25.98s best:1112  next:[878,1111] objective_lb_search_no_lp
#Bound  29.78s best:1112  next:[879,1111] objective_lb_search_no_lp
#Bound  30.16s best:1112  next:[881,1111] objective_lb_search_no_lp
#Bound  31.53s best:1112  next:[885,1111] objective_lb_search_no_lp
#Bound  32.70s best:1112  next:[886,1111] objective_lb_search_no_lp
#Bound  33.19s best:1112  next:[888,1111] objective_lb_search_no_lp
#Bound  35.38s best:1112  next:[890,1111] objective_lb_search_no_lp
#Bound  35.89s best:1112  next:[891,1111] objective_lb_search_no_lp
#Bound  36.58s best:1112  next:[892,1111] objective_lb_search_no_lp
#Bound  37.17s best:1112  next:[894,1111] objective_lb_search_no_lp
#Bound  37.73s best:1112  next:[895,1111] objective_lb_search_no_lp
#Bound  38.47s best:1112  next:[898,1111] objective_lb_search_no_lp
#Bound  42.50s best:1112  next:[899,1111] objective_lb_search_no_lp
#Bound  43.40s best:1112  next:[901,1111] objective_lb_search_no_lp
#Bound  44.48s best:1112  next:[903,1111] objective_lb_search_no_lp
#Bound  45.51s best:1112  next:[905,1111] objective_lb_search_no_lp
#Bound  46.03s best:1112  next:[906,1111] objective_lb_search_no_lp
#Bound  47.66s best:1112  next:[907,1111] objective_lb_search_no_lp
#Bound  49.52s best:1112  next:[912,1111] objective_lb_search_no_lp
#Bound  50.86s best:1112  next:[913,1111] objective_lb_search_no_lp
#Bound  55.16s best:1112  next:[914,1111] objective_lb_search_no_lp
#Bound  56.20s best:1112  next:[915,1111] objective_lb_search_no_lp
#Model  56.88s var:280/281 constraints:3496/3637
#Bound  61.49s best:1112  next:[917,1111] objective_lb_search_no_lp
#Bound  61.71s best:1112  next:[918,1111] objective_lb_search_no_lp
#Bound  63.04s best:1112  next:[920,1111] objective_lb_search_no_lp
#Bound  66.61s best:1112  next:[921,1111] objective_lb_search_no_lp
#Bound  67.50s best:1112  next:[922,1111] objective_lb_search_no_lp
#Bound  69.04s best:1112  next:[923,1111] objective_lb_search_no_lp
#Bound  70.95s best:1112  next:[925,1111] objective_lb_search_no_lp
#Bound  73.12s best:1112  next:[926,1111] objective_lb_search_no_lp
#Bound  75.93s best:1112  next:[927,1111] objective_lb_search_no_lp
#Bound  79.68s best:1112  next:[930,1111] objective_lb_search_no_lp
#Bound  80.24s best:1112  next:[931,1111] objective_lb_search_no_lp
#Bound  80.93s best:1112  next:[933,1111] objective_lb_search_no_lp
#Bound  82.28s best:1112  next:[934,1111] objective_lb_search_no_lp
#Bound  82.56s best:1112  next:[935,1111] objective_lb_search_no_lp
#Bound  83.80s best:1112  next:[937,1111] objective_lb_search_no_lp
#Bound  85.87s best:1112  next:[939,1111] objective_lb_search_no_lp
#Bound  87.32s best:1112  next:[941,1111] objective_lb_search_no_lp
#Bound  88.93s best:1112  next:[942,1111] objective_lb_search_no_lp
#Bound  90.98s best:1112  next:[943,1111] objective_lb_search_no_lp
#Bound  92.15s best:1112  next:[944,1111] objective_lb_search_no_lp
#Bound  94.39s best:1112  next:[945,1111] objective_lb_search_no_lp
#Bound  95.55s best:1112  next:[946,1111] objective_lb_search_no_lp
#Bound 103.18s best:1112  next:[947,1111] objective_lb_search_no_lp
#Bound 103.40s best:1112  next:[948,1111] objective_lb_search_no_lp
#Bound 103.79s best:1112  next:[949,1111] objective_lb_search_no_lp
#Bound 108.23s best:1112  next:[950,1111] objective_lb_search_no_lp
#Bound 108.57s best:1112  next:[951,1111] objective_lb_search_no_lp
#Bound 109.07s best:1112  next:[952,1111] objective_lb_search_no_lp
#Bound 109.58s best:1112  next:[953,1111] objective_lb_search_no_lp
#Bound 112.87s best:1112  next:[955,1111] objective_lb_search_no_lp
#Bound 113.08s best:1112  next:[957,1111] objective_lb_search_no_lp
#Bound 114.58s best:1112  next:[960,1111] objective_lb_search_no_lp
#Bound 115.53s best:1112  next:[961,1111] objective_lb_search_no_lp
#Bound 116.54s best:1112  next:[962,1111] objective_lb_search_no_lp
#Bound 117.85s best:1112  next:[963,1111] objective_lb_search_no_lp
#Bound 119.82s best:1112  next:[964,1111] objective_lb_search_no_lp
#Bound 120.27s best:1112  next:[965,1111] objective_lb_search_no_lp
#Bound 120.57s best:1112  next:[966,1111] objective_lb_search_no_lp
#Bound 122.53s best:1112  next:[967,1111] objective_lb_search_no_lp
#Bound 126.94s best:1112  next:[968,1111] objective_lb_search_no_lp
#Bound 127.40s best:1112  next:[969,1111] objective_lb_search_no_lp
#Bound 132.28s best:1112  next:[970,1111] objective_lb_search_no_lp
#Bound 132.55s best:1112  next:[971,1111] objective_lb_search_no_lp
#Bound 136.00s best:1112  next:[975,1111] objective_lb_search_no_lp
#Bound 136.97s best:1112  next:[976,1111] objective_lb_search_no_lp
#Bound 137.43s best:1112  next:[977,1111] objective_lb_search_no_lp
#Bound 140.25s best:1112  next:[979,1111] objective_lb_search_no_lp
#Bound 141.35s best:1112  next:[981,1111] objective_lb_search_no_lp
#Bound 142.61s best:1112  next:[982,1111] objective_lb_search_no_lp
#Bound 143.16s best:1112  next:[983,1111] objective_lb_search_no_lp
#Bound 144.17s best:1112  next:[985,1111] objective_lb_search_no_lp
#Bound 144.78s best:1112  next:[986,1111] objective_lb_search_no_lp
#Bound 146.13s best:1112  next:[987,1111] objective_lb_search_no_lp
#Bound 146.62s best:1112  next:[988,1111] objective_lb_search_no_lp
#Bound 150.88s best:1112  next:[990,1111] objective_lb_search_no_lp
#Bound 151.54s best:1112  next:[991,1111] objective_lb_search_no_lp
#Bound 152.50s best:1112  next:[992,1111] objective_lb_search_no_lp
#Bound 154.73s best:1112  next:[994,1111] objective_lb_search_no_lp
#Bound 158.86s best:1112  next:[995,1111] objective_lb_search_no_lp
#Bound 161.05s best:1112  next:[997,1111] objective_lb_search_no_lp
#Bound 163.41s best:1112  next:[998,1111] objective_lb_search_no_lp
#Bound 164.66s best:1112  next:[999,1111] objective_lb_search_no_lp
#Model 164.76s var:279/281 constraints:3486/3637
#Bound 165.76s best:1112  next:[1000,1111] objective_lb_search_no_lp
#Bound 170.08s best:1112  next:[1001,1111] objective_lb_search_no_lp
#Bound 170.89s best:1112  next:[1006,1111] objective_lb_search_no_lp
#Bound 174.24s best:1112  next:[1007,1111] objective_lb_search_no_lp
#Model 176.04s var:278/281 constraints:3366/3637
#Bound 177.09s best:1112  next:[1010,1111] objective_lb_search_no_lp
#Model 177.60s var:276/281 constraints:3337/3637
#Bound 179.34s best:1112  next:[1011,1111] objective_lb_search_no_lp
#Bound 180.71s best:1112  next:[1013,1111] objective_lb_search_no_lp
#Bound 181.14s best:1112  next:[1015,1111] objective_lb_search_no_lp
#Model 181.41s var:275/281 constraints:3311/3637
#Bound 181.58s best:1112  next:[1016,1111] objective_lb_search_no_lp
#Model 182.10s var:274/281 constraints:3301/3637
#Bound 182.11s best:1112  next:[1019,1111] objective_lb_search_no_lp
#Bound 182.46s best:1112  next:[1031,1111] objective_lb_search_no_lp
#Model 182.65s var:273/281 constraints:3206/3637
#Bound 182.66s best:1112  next:[1032,1111] objective_lb_search_no_lp
#Bound 183.02s best:1112  next:[1033,1111] objective_lb_search_no_lp
#Bound 183.19s best:1112  next:[1034,1111] objective_lb_search_no_lp
#Bound 183.36s best:1112  next:[1035,1111] objective_lb_search_no_lp
#Bound 183.45s best:1112  next:[1036,1111] objective_lb_search_no_lp
#Bound 183.51s best:1112  next:[1037,1111] objective_lb_search_no_lp
#Bound 183.67s best:1112  next:[1052,1111] objective_lb_search_no_lp
#Model 183.71s var:272/281 constraints:3047/3637
#Model 183.74s var:271/281 constraints:2971/3637
#Done  183.75s no_lp
#Model 183.75s var:249/281 constraints:1753/3637
#Done  183.76s probing_max_lp

Task timing                                  n [     min,      max]      avg      dev     time         n [     min,      max]      avg      dev    dtime
                             'core':         1 [   3.06m,    3.06m]    3.06m   0.00ns    3.06m         1 [   6.56m,    6.56m]    6.56m   0.00ns    6.56m
                       'default_lp':         1 [   3.06m,    3.06m]    3.06m   0.00ns    3.06m         1 [   1.19m,    1.19m]    1.19m   0.00ns    1.19m
                 'feasibility_pump':       598 [ 48.93ms, 756.33ms]  89.45ms  28.55ms   53.49s       597 [ 23.13ms,  44.56ms]  23.60ms 879.60us   14.09s
                            'fixed':         1 [   3.06m,    3.06m]    3.06m   0.00ns    3.06m         1 [   1.44m,    1.44m]    1.44m   0.00ns    1.44m
                  'fj_long_default':         1 [428.95ms, 428.95ms] 428.95ms   0.00ns 428.95ms         1 [ 74.03ms,  74.03ms]  74.03ms   0.00ns  74.03ms
              'fj_long_lin_default':         1 [310.82ms, 310.82ms] 310.82ms   0.00ns 310.82ms         1 [ 85.39ms,  85.39ms]  85.39ms   0.00ns  85.39ms
                   'fj_long_random':         1 [323.95ms, 323.95ms] 323.95ms   0.00ns 323.95ms         1 [ 81.77ms,  81.77ms]  81.77ms   0.00ns  81.77ms
                 'fj_short_default':         1 [ 96.82ms,  96.82ms]  96.82ms   0.00ns  96.82ms         1 [ 84.12ms,  84.12ms]  84.12ms   0.00ns  84.12ms
             'fj_short_lin_default':         1 [310.87ms, 310.87ms] 310.87ms   0.00ns 310.87ms         1 [ 86.09ms,  86.09ms]  86.09ms   0.00ns  86.09ms
              'fj_short_lin_random':         1 [413.50ms, 413.50ms] 413.50ms   0.00ns 413.50ms         1 [ 82.29ms,  82.29ms]  82.29ms   0.00ns  82.29ms
                  'fj_short_random':         1 [349.08ms, 349.08ms] 349.08ms   0.00ns 349.08ms         1 [ 83.07ms,  83.07ms]  83.07ms   0.00ns  83.07ms
                        'fs_random':         1 [ 87.95ms,  87.95ms]  87.95ms   0.00ns  87.95ms         1 [  3.19us,   3.19us]   3.19us   0.00ns   3.19us
                        'fs_random':         1 [ 92.28ms,  92.28ms]  92.28ms   0.00ns  92.28ms         1 [ 20.00ns,  20.00ns]  20.00ns   0.00ns  20.00ns
                  'fs_random_no_lp':         1 [ 84.57ms,  84.57ms]  84.57ms   0.00ns  84.57ms         1 [  2.23ms,   2.23ms]   2.23ms   0.00ns   2.23ms
          'fs_random_quick_restart':         1 [ 87.79ms,  87.79ms]  87.79ms   0.00ns  87.79ms         1 [  3.19us,   3.19us]   3.19us   0.00ns   3.19us
          'fs_random_quick_restart':         1 [ 91.96ms,  91.96ms]  91.96ms   0.00ns  91.96ms         1 [ 20.00ns,  20.00ns]  20.00ns   0.00ns  20.00ns
    'fs_random_quick_restart_no_lp':         1 [ 94.69ms,  94.69ms]  94.69ms   0.00ns  94.69ms         1 [422.57us, 422.57us] 422.57us   0.00ns 422.57us
                    'graph_arc_lns':       598 [  3.25ms, 843.59ms] 406.41ms 206.59ms    4.05m       583 [ 10.00ns, 123.88ms]  72.76ms  42.80ms   42.42s
                    'graph_cst_lns':       598 [  1.32ms,    1.29s] 364.96ms 226.54ms    3.64m       560 [ 10.00ns, 115.35ms]  66.51ms  43.77ms   37.24s
                    'graph_dec_lns':       598 [  4.71ms, 715.56ms] 419.01ms 195.42ms    4.18m       589 [ 10.00ns, 188.06ms]  72.89ms  43.64ms   42.93s
                    'graph_var_lns':       598 [  3.42ms,    1.10s] 403.68ms 212.71ms    4.02m       574 [ 10.00ns, 131.01ms]  71.75ms  43.68ms   41.19s
                   'lb_tree_search':         1 [   3.06m,    3.06m]    3.06m   0.00ns    3.06m         1 [   1.84m,    1.84m]    1.84m   0.00ns    1.84m
                           'max_lp':         1 [   3.06m,    3.06m]    3.06m   0.00ns    3.06m         1 [   1.45m,    1.45m]    1.45m   0.00ns    1.45m
                            'no_lp':         1 [   3.06m,    3.06m]    3.06m   0.00ns    3.06m         1 [   1.03m,    1.03m]    1.03m   0.00ns    1.03m
              'objective_lb_search':         1 [   3.06m,    3.06m]    3.06m   0.00ns    3.06m         1 [   1.21m,    1.21m]    1.21m   0.00ns    1.21m
       'objective_lb_search_max_lp':         1 [   3.06m,    3.06m]    3.06m   0.00ns    3.06m         1 [   1.76m,    1.76m]    1.76m   0.00ns    1.76m
        'objective_lb_search_no_lp':         1 [   3.06m,    3.06m]    3.06m   0.00ns    3.06m         1 [  45.89s,   45.89s]   45.89s   0.00ns   45.89s
  'objective_shaving_search_max_lp':       148 [ 20.10ms,    7.61s]    1.23s    1.30s    3.04m       142 [  1.40ms,    2.52s] 371.97ms 422.24ms   52.82s
   'objective_shaving_search_no_lp':       148 [ 24.29ms,    7.62s]    1.23s    1.30s    3.04m       143 [  1.39ms,    1.60s] 243.94ms 279.96ms   34.88s
                          'probing':         1 [   3.06m,    3.06m]    3.06m   0.00ns    3.06m         1 [   2.28m,    2.28m]    2.28m   0.00ns    2.28m
                   'probing_max_lp':         1 [   3.06m,    3.06m]    3.06m   0.00ns    3.06m         1 [   1.41m,    1.41m]    1.41m   0.00ns    1.41m
                     'pseudo_costs':         1 [   3.06m,    3.06m]    3.06m   0.00ns    3.06m         1 [   1.41m,    1.41m]    1.41m   0.00ns    1.41m
                    'quick_restart':         1 [   3.06m,    3.06m]    3.06m   0.00ns    3.06m         1 [   1.80m,    1.80m]    1.80m   0.00ns    1.80m
              'quick_restart_no_lp':         1 [   3.06m,    3.06m]    3.06m   0.00ns    3.06m         1 [   1.88m,    1.88m]    1.88m   0.00ns    1.88m
                    'reduced_costs':         1 [   3.06m,    3.06m]    3.06m   0.00ns    3.06m         1 [   1.43m,    1.43m]    1.43m   0.00ns    1.43m
                        'rins/rens':       598 [ 74.43us, 748.37ms] 299.15ms 203.27ms    2.98m       468 [ 10.00ns, 102.09ms]  76.90ms  32.78ms   35.99s
                      'rnd_cst_lns':       598 [  1.32ms,    1.25s] 389.92ms 219.54ms    3.89m       577 [ 10.00ns, 159.81ms]  70.61ms  44.92ms   40.74s
                      'rnd_var_lns':       598 [  1.67ms,    1.25s] 406.34ms 209.87ms    4.05m       581 [ 10.00ns, 146.48ms]  71.83ms  43.74ms   41.73s
         'scheduling_intervals_lns':       598 [ 32.31ms,    1.33s] 562.90ms 105.61ms    5.61m       596 [775.12us, 182.40ms] 101.99ms  19.48ms    1.01m
       'scheduling_precedences_lns':       597 [ 68.43ms,    1.32s] 560.69ms 101.40ms    5.58m       597 [775.12us, 122.42ms] 101.75ms  19.04ms    1.01m
       'scheduling_time_window_lns':       598 [ 15.12ms,    1.13s] 560.55ms  99.37ms    5.59m       596 [775.12us, 122.12ms] 101.82ms  18.87ms    1.01m
                     'violation_ls':       598 [473.20us, 125.83ms]  53.59ms  10.14ms   32.05s       598 [960.00ns, 298.58ms]  95.22ms  31.79ms   56.94s
                     'violation_ls':       598 [717.63us, 137.59ms]  64.85ms   9.06ms   38.78s       598 [329.11us, 226.38ms]  96.71ms  26.97ms   57.83s

Search stats                        Bools  Conflicts   Branches  Restarts   BoolPropag  IntegerPropag
                           'core':  5'612    112'394    318'239    25'771  220'205'148     90'365'325
                     'default_lp':     94     77'805    386'642    51'881    2'344'225     83'116'940
                          'fixed':  2'763    361'828  1'186'443     2'873  221'331'672    104'877'544
                      'fs_random':     94          0        188       188           30          4'250
                      'fs_random':     94          0        188       188           30          4'250
                'fs_random_no_lp':    146         50        374       292          852         12'251
        'fs_random_quick_restart':     94          0        188       188           30          4'250
        'fs_random_quick_restart':     94          0        188       188           30          4'250
  'fs_random_quick_restart_no_lp':     94          0        256       188           35          5'793
                 'lb_tree_search':    115        503    310'887    43'517      851'590     25'029'578
                         'max_lp':     94     37'091    441'360    72'805    2'208'463     70'345'379
                          'no_lp':  1'511    235'572    499'805    34'977   92'426'243    181'421'627
            'objective_lb_search':    283     58'640    585'354   130'327    3'609'672     85'398'517
     'objective_lb_search_max_lp':    252     26'034    551'020   134'836    3'092'313     62'178'281
      'objective_lb_search_no_lp':    379    212'917    467'403    33'642    6'830'147    165'060'021
                        'probing':    489        266      8'122     4'551       40'286        322'799
                 'probing_max_lp':    489        259      4'742     2'858       29'989        220'682
                   'pseudo_costs':     94     51'835    433'361    72'428    2'180'884     71'997'944
                  'quick_restart':  2'737     57'928    525'069    58'819   74'278'993     59'302'961
            'quick_restart_no_lp':  4'424    222'856    725'286    43'743  188'612'420    118'106'497
                  'reduced_costs':  2'202     64'915    445'122    56'035   48'993'084     65'170'628

SAT stats                           ClassicMinim  LitRemoved  LitLearned  LitForgotten  Subsumed  MClauses  MDecisions  MLitTrue  MSubsumed  MLitRemoved  MReused
                           'core':       105'313   1'121'385   1'126'456        67'827       315    12'328      58'205         0      1'401        4'450       92
                     'default_lp':        62'858     238'483   1'098'026       560'803     1'475    27'782     282'373         0      4'503       31'996    4'583
                          'fixed':       284'712   1'750'847   8'859'703     5'977'454       931     1'946      16'830         0      1'208        9'382      386
                      'fs_random':             0           0           0             0         0         0           0         0          0            0        0
                      'fs_random':             0           0           0             0         0         0           0         0          0            0        0
                'fs_random_no_lp':            24          83         443             0         0         0           0         0          0            0        0
        'fs_random_quick_restart':             0           0           0             0         0         0           0         0          0            0        0
        'fs_random_quick_restart':             0           0           0             0         0         0           0         0          0            0        0
  'fs_random_quick_restart_no_lp':             0           0           0             0         0         0           0         0          0            0        0
                 'lb_tree_search':            64         122       2'813             0         1    19'461      97'255         0         47          187    1'215
                         'max_lp':        30'639     122'116     457'446       112'596       875    38'245     385'857         0      4'342       30'183    8'428
                          'no_lp':       208'944   1'514'960   3'670'154     2'905'631     2'085    18'900     167'131         0      8'710       64'131    2'052
            'objective_lb_search':        52'278     239'704     705'303        27'922       879    60'513     467'524         0      2'775       19'821    9'004
     'objective_lb_search_max_lp':        23'124     101'418     296'160         8'936       465    56'518     458'681         0      1'373        9'600    9'524
      'objective_lb_search_no_lp':       197'291   1'258'915   2'328'088       972'622     2'049    19'309     205'049         0      7'787       60'939    3'440
                        'probing':             0           0         266             0         0         0           0         0          0            0        0
                 'probing_max_lp':             0           0         260             0         0         0           0         0          0            0        0
                   'pseudo_costs':        43'044     190'671     722'924       265'304     1'097    37'020     354'464        85      3'800       26'637    7'712
                  'quick_restart':        44'479     211'887     597'419       170'327     1'318    33'873     353'442        11     17'446      146'684    6'401
            'quick_restart_no_lp':       183'845   1'425'653   3'226'464     1'726'161     1'035    16'406     160'578        28     12'484      114'174    1'718
                  'reduced_costs':        55'570     337'106     958'845       495'646       884    27'829     267'047         0      6'667       47'277    4'033

Lp stats                         Component  Iterations  AddedCuts  OPTIMAL  DUAL_F.  DUAL_U.
                  'default_lp':          1     811'271     47'008  155'937        0        0
                       'fixed':          1     105'305      1'104  383'960        0        0
                   'fs_random':          1          99          0        2        0        0
                   'fs_random':          1          99         50        3        0        0
     'fs_random_quick_restart':          1          57          0        1        1        0
     'fs_random_quick_restart':          1          99         50        3        0        0
              'lb_tree_search':          1   2'828'427     10'337  183'205   59'002        0
                      'max_lp':          1   1'392'662     27'132   86'128   17'226       10
         'objective_lb_search':          1     830'706     41'076  128'999        0        0
  'objective_lb_search_max_lp':          1   1'567'568     18'771   71'552   15'076       12
                     'probing':          1     724'598     63'012   23'696        1        0
              'probing_max_lp':          1     292'822     77'218   15'397      934        0
                'pseudo_costs':          1   1'426'243     36'622  105'521   24'438       19
               'quick_restart':          1   1'136'790     54'207  104'598        0        1
               'reduced_costs':          1   1'484'443     53'926  119'856   39'197        7

Lp dimension                                                                       Final dimension of first component
                  'default_lp':    523 rows, 270 columns, 2369 entries with magnitude in [3.708547e-04, 1.000000e+00]
                       'fixed':     158 rows, 270 columns, 569 entries with magnitude in [3.877834e-02, 1.000000e+00]
                   'fs_random':      88 rows, 270 columns, 340 entries with magnitude in [8.671100e-02, 1.000000e+00]
                   'fs_random':      89 rows, 270 columns, 344 entries with magnitude in [3.877834e-02, 1.000000e+00]
     'fs_random_quick_restart':      88 rows, 270 columns, 340 entries with magnitude in [8.671100e-02, 1.000000e+00]
     'fs_random_quick_restart':      89 rows, 270 columns, 344 entries with magnitude in [3.877834e-02, 1.000000e+00]
              'lb_tree_search':    611 rows, 281 columns, 2295 entries with magnitude in [1.178511e-03, 1.000000e+00]
                      'max_lp':    795 rows, 281 columns, 3229 entries with magnitude in [6.336106e-04, 1.000000e+00]
         'objective_lb_search':    292 rows, 270 columns, 1133 entries with magnitude in [4.910158e-03, 1.000000e+00]
  'objective_lb_search_max_lp':    788 rows, 281 columns, 3061 entries with magnitude in [6.945006e-03, 1.000000e+00]
                     'probing':  1146 rows, 270 columns, 13052 entries with magnitude in [2.386304e-04, 1.000000e+00]
              'probing_max_lp':    974 rows, 281 columns, 5511 entries with magnitude in [7.705398e-04, 1.000000e+00]
                'pseudo_costs':    679 rows, 281 columns, 2694 entries with magnitude in [3.964090e-03, 1.000000e+00]
               'quick_restart':    558 rows, 270 columns, 2929 entries with magnitude in [1.239954e-04, 1.000000e+00]
               'reduced_costs':    651 rows, 281 columns, 2550 entries with magnitude in [6.314682e-04, 1.000000e+00]

Lp debug                         CutPropag  CutEqPropag   Adjust  Overflow        Bad  BadScaling
                  'default_lp':          3          184   58'195         0    317'063           0
                       'fixed':          0            1       55         0      2'448           0
                   'fs_random':          0            0        0         0          0           0
                   'fs_random':          0            0        0         0          0           0
     'fs_random_quick_restart':          0            0        0         0          0           0
     'fs_random_quick_restart':          0            0        0         0          0           0
              'lb_tree_search':          8            5  121'262         0    110'399           0
                      'max_lp':         25           38   46'713         0    377'723           0
         'objective_lb_search':          6          173   50'142         0    378'676           0
  'objective_lb_search_max_lp':         13           62   46'471         0    336'798           0
                     'probing':         34          471   20'785         0  8'946'041           0
              'probing_max_lp':         57          657   12'188         0  5'695'204           0
                'pseudo_costs':         35           68   62'796         0    397'804           0
               'quick_restart':          5          118   51'411         0    766'203           0
               'reduced_costs':         58          107  107'365         0    479'566           0

Lp pool                          Constraints  Updates  Simplif  Merged  Shortened    Split  Strenghtened       Cuts/Call
                  'default_lp':        8'862    4'239   40'223     515     11'253   41'175        16'571  47'008/128'048
                       'fixed':        1'462       48      349      11          0       22           513     1'104/4'382
                   'fs_random':          369        0        0       0          0        0            68             0/0
                   'fs_random':          419        0        0       0          0        0            68           50/50
     'fs_random_quick_restart':          369        0        0       0          0        0            68             0/0
     'fs_random_quick_restart':          419        0        0       0          0        0            68           50/50
              'lb_tree_search':       12'817    1'441  107'725     149      5'766    1'704       114'904   10'337/75'955
                      'max_lp':       12'251    2'883  198'809     510      7'216   31'485       203'536   27'132/84'661
         'objective_lb_search':        9'022    4'221   25'958     423      7'514   31'420        13'995  41'076/116'049
  'objective_lb_search_max_lp':       13'152    2'589  146'501     248      7'079   19'684       188'805   18'771/65'676
                     'probing':        9'356   12'479   35'763      25      5'205   84'180        17'374  63'012/112'832
              'probing_max_lp':       12'837   10'251  140'175      10      7'457   32'678       111'349  77'218/212'266
                'pseudo_costs':       12'629    2'700  174'778     622      6'263   27'440       198'653  36'622/108'829
               'quick_restart':        9'406    7'150   70'129     170     11'141  113'692        31'519  54'207/133'382
               'reduced_costs':       12'750    2'894  236'069     805      6'678   28'504       213'533  53'926/143'818

Lp Cut                                                fs_ran  fs_ran  defaul  fixed  max_lp  quick_  reduce  pseudo  lb_tre  probin  object  probin  object
                                              CG_FF:       -       -   2'424     58   1'000     543   3'129   1'883     675     254   1'388     800     448
                                               CG_K:       -       -   1'805     44     761     356   2'787   1'728     457     196   1'123     438     432
                                               CG_R:       -       -   2'802     39     703   1'356   2'845   1'460     343   1'901   1'662     860     324
                                              CG_RB:       -       -  13'010    130   1'808  24'366   5'878   3'441   1'067  28'698  14'568   1'115     777
                                             CG_RBP:       -       -   2'682     13     270   7'364   1'279     507     114   4'624   2'017     118      66
                                             Clique:       -       -       -      -     137       -     290     201     100       -       -     119     133
                                                 IB:      50      50   8'657    385   3'152   7'153   6'791   4'445   1'003   2'968   8'017   1'370   1'620
                                           MIR_1_FF:       -       -   1'123     62   1'356     862   2'435   1'652     569     950     807   2'297   1'163
                                            MIR_1_K:       -       -     370     10     637     182   1'281     907     194     160     241     663     466
                                           MIR_1_KL:       -       -      10      -       9      18      35       5       3      30       -      52       2
                                            MIR_1_R:       -       -     447     18     204     213     575     307      57     595     264     376     116
                                           MIR_1_RB:       -       -   2'247     63   3'453   2'645   5'021   3'932   1'257   4'026   2'011   5'662   2'556
                                          MIR_1_RBP:       -       -      76      3     602     282     925     690     208     278      39     244     257
                                          MIR_1_RLT:       -       -       -      -      20       -      41      22       5       -       -      26      16
                                           MIR_2_FF:       -       -     902     30     776     461   1'510   1'046     296     549     626   1'309     640
                                            MIR_2_K:       -       -     299      6     262     122     586     382      93     160     205     260     178
                                           MIR_2_KL:       -       -       6      -      21      13      32       6       1      35       -      26       5
                                            MIR_2_R:       -       -     369     11     238     212     487     337      83     656     223     627     159
                                           MIR_2_RB:       -       -   1'712     40   1'387   1'410   2'401   1'696     485   2'252   1'452   2'044     959
                                          MIR_2_RBP:       -       -     111      3     216     182     429     322      47     238      69     153      66
                                           MIR_3_FF:       -       -     512     14     486     304     901     710     175     361     402     643     405
                                            MIR_3_K:       -       -     200      5     154      83     318     266      73     111     174     163     108
                                           MIR_3_KL:       -       -       4      -      21       5      40      17       3      36       1      18       5
                                            MIR_3_R:       -       -     234      9     215     173     362     292      65     339     185     556     163
                                           MIR_3_RB:       -       -   1'156     19     861     870   1'374   1'060     276   1'259     957   1'292     665
                                          MIR_3_RBP:       -       -      84      2     148     106     288     214      43     129      63     109      54
                                           MIR_4_FF:       -       -     401      2     347     197     551     469      98     232     271     348     228
                                            MIR_4_K:       -       -     157      6     128      54     247     170      38      86     120     100      76
                                           MIR_4_KL:       -       -      16      -      14       6      34      17       3      29       2      11       5
                                            MIR_4_R:       -       -     264      3     130     144     224     188      32     281     195     199      91
                                           MIR_4_RB:       -       -     709     12     513     582     780     540     150     809     561     729     372
                                          MIR_4_RBP:       -       -      71      1      98      61     196     143      42      83      44      79      43
                                           MIR_5_FF:       -       -     255      7     177     153     330     240      59     164     183     213     151
                                            MIR_5_K:       -       -      94      4      67      39     166     107      23      47      64      62      61
                                           MIR_5_KL:       -       -       3      -       9       7      19      14       3      16       6      15       9
                                            MIR_5_R:       -       -     186      3      73     119     123      98      18     168     146     126      49
                                           MIR_5_RB:       -       -     418     11     296     364     473     331      79     509     364     377     198
                                          MIR_5_RBP:       -       -      42      3      53      56     131      82      17      70      38      56      33
                                           MIR_6_FF:       -       -     145      4     109      89     197     145      45      85     112     147      82
                                            MIR_6_K:       -       -      48      2      43      31      85      53      15      30      30      45      35
                                           MIR_6_KL:       -       -       5      -       5       6       6       3       1      10       4      11       1
                                            MIR_6_R:       -       -      97      2      30      72      81      59      13      88      74      86      37
                                           MIR_6_RB:       -       -     282      3     164     248     304     200      61     313     234     261     106
                                          MIR_6_RBP:       -       -      38      -      22      42      79      39       9      53      22      41      14
         NoOverlapCompletionTimeExhaustive_weighted:       -       -       -      -      67       -     157     100      20       -       -      17      37
  NoOverlapCompletionTimeExhaustive_weighted_lifted:       -       -       -      -      48       -      71      41       9       -       -      11      26
                          NoOverlapDisjunctionOnEnd:       -       -       -      -       -       -       1       -       -       -       -       -       -
                        NoOverlapDisjunctionOnStart:       -       -       -      -      35       -     118      70      12       -       -       7      25
                                       ZERO_HALF_FF:       -       -     325     18     292     133     652     443     128     105     239     156     248
                                        ZERO_HALF_K:       -       -     145      6     179      41     411     268      62      32     103     109     159
                                        ZERO_HALF_R:       -       -   1'210     27   4'236   1'482   4'572   3'964   1'300   6'840     989  49'950   4'054
                                       ZERO_HALF_RB:       -       -     751     20     972     836   1'561   1'133     366   1'913     698   1'942     775
                                      ZERO_HALF_RBP:       -       -     104      6     128     164     317     177      42     244      83     780      73

LNS stats                        Improv/Calls  Closed  Difficulty  TimeLimit
               'graph_arc_lns':        17/598     52%        0.99       0.12
               'graph_cst_lns':        23/576     52%        0.99       0.11
               'graph_dec_lns':         8/598     52%        0.99       0.12
               'graph_var_lns':        25/598     53%        0.99       0.12
                   'rins/rens':        80/534     50%        0.88       0.10
                 'rnd_cst_lns':        22/595     52%        0.99       0.12
                 'rnd_var_lns':        14/597     51%        0.99       0.12
    'scheduling_intervals_lns':        15/597     30%        0.00       0.12
  'scheduling_precedences_lns':        16/597     31%        0.00       0.12
  'scheduling_time_window_lns':        11/597     30%        0.00       0.12

LS stats                   Batches  Restarts   LinMoves   GenMoves  CompoundMoves  WeightUpdates
       'fj_long_default':        1         1      9'754          0              0            246
   'fj_long_lin_default':        1         1          0      2'139            270              1
        'fj_long_random':        1         1      9'745          0              0            255
      'fj_short_default':        1         1          0      1'992            276              0
  'fj_short_lin_default':        1         1          0      1'684            260              0
   'fj_short_lin_random':        1         1          0      2'035            381              1
       'fj_short_random':        1         1          0      2'098            317              0
          'violation_ls':      598         0  1'786'561  1'603'276        102'077        248'015
          'violation_ls':      598         0  5'603'906     33'212          3'030        315'899

Solutions (35)            Num     Rank
        'graph_dec_lns':    1  [27,27]
        'graph_var_lns':    1    [7,7]
                'no_lp':   24   [1,31]
  'quick_restart_no_lp':    4  [22,35]
        'rins_pump_lns':    1  [32,32]
          'rnd_cst_lns':    1  [20,20]
         'violation_ls':    3    [5,8]

Objective bounds                     Num
                       'bool_core':    2
                  'initial_domain':    1
             'objective_lb_search':    3
       'objective_lb_search_no_lp':  170
  'objective_shaving_search_no_lp':    1

Solution repositories     Added  Queried  Ignored  Synchro
  'feasible solutions':   5'683   13'599        5    5'372
        'lp solutions':   2'320      296        0    1'915
                'pump':  12'406      301

Improving bounds shared            Num
                        'core':     50
                  'default_lp':     58
              'lb_tree_search':      7
                      'max_lp':    124
                       'no_lp':    368
         'objective_lb_search':      2
  'objective_lb_search_max_lp':     15
                     'probing':    704
              'probing_max_lp':    419
                'pseudo_costs':    119
               'quick_restart':    316
         'quick_restart_no_lp':  4'773
               'reduced_costs':    167

Clauses shared                   Num
                        'core':    4
                  'default_lp':   30
              'lb_tree_search':    7
                      'max_lp':   35
                       'no_lp':   45
         'objective_lb_search':   12
  'objective_lb_search_max_lp':   17
              'probing_max_lp':    1
                'pseudo_costs':  106
               'quick_restart':   12
         'quick_restart_no_lp':   17
               'reduced_costs':   15

CpSolverResponse summary:
status: OPTIMAL
objective: 1112
best_bound: 1112
integers: 277
booleans: 146
conflicts: 50
branches: 374
propagations: 852
integer_propagations: 12251
restarts: 292
lp_iterations: 0
walltime: 183.91
usertime: 183.91
deterministic_time: 2329.16
gap_integral: 4198.76
solution_fingerprint: 0xb9e18aa51e719b3b


--- Simulation Gantt  partir du modle mathmatique ---
