created virtual environment CPython3.12.4.final.0-64 in 526ms
  creator CPython3Posix(dest=/localscratch/aneumann.46806163.0/env, clear=False, no_vcs_ignore=False, global=False)
  seeder FromAppData(download=False, pip=bundle, via=copy, app_data_dir=/home/aneumann/.local/share/virtualenv)
    added seed packages: pip==24.2+computecanada
  activators BashActivator,CShellActivator,FishActivator,NushellActivator,PowerShellActivator,PythonActivator
Looking in links: /cvmfs/soft.computecanada.ca/custom/python/wheelhouse/gentoo2023/x86-64-v3, /cvmfs/soft.computecanada.ca/custom/python/wheelhouse/gentoo2023/generic, /cvmfs/soft.computecanada.ca/custom/python/wheelhouse/generic
Requirement already satisfied: pip in /localscratch/aneumann.46806163.0/env/lib/python3.12/site-packages (24.2+computecanada)
Processing /cvmfs/soft.computecanada.ca/custom/python/wheelhouse/generic/pip-25.0+computecanada-py3-none-any.whl
Installing collected packages: pip
  Attempting uninstall: pip
    Found existing installation: pip 24.2+computecanada
    Uninstalling pip-24.2+computecanada:
      Successfully uninstalled pip-24.2+computecanada
Successfully installed pip-25.0+computecanada
Looking in links: /cvmfs/soft.computecanada.ca/custom/python/wheelhouse/gentoo2023/x86-64-v3, /cvmfs/soft.computecanada.ca/custom/python/wheelhouse/gentoo2023/generic, /cvmfs/soft.computecanada.ca/custom/python/wheelhouse/generic
ERROR: protobuf-5.28.3-cp38-abi3-manylinux2014_x86_64.whl is not a supported wheel on this platform.
Looking in links: /cvmfs/soft.computecanada.ca/custom/python/wheelhouse/gentoo2023/x86-64-v3, /cvmfs/soft.computecanada.ca/custom/python/wheelhouse/gentoo2023/generic, /cvmfs/soft.computecanada.ca/custom/python/wheelhouse/generic
Processing /home/aneumann/projects/def-adhaj/aneumann/GNRS/wheels/immutabledict-4.2.0-py3-none-any.whl
Installing collected packages: immutabledict
Successfully installed immutabledict-4.2.0
Looking in links: /cvmfs/soft.computecanada.ca/custom/python/wheelhouse/gentoo2023/x86-64-v3, /cvmfs/soft.computecanada.ca/custom/python/wheelhouse/gentoo2023/generic, /cvmfs/soft.computecanada.ca/custom/python/wheelhouse/generic
Processing /cvmfs/soft.computecanada.ca/custom/python/wheelhouse/generic/ortools-9.10.4067+computecanada-cp312-cp312-linux_x86_64.whl (from -r /home/aneumann/projects/def-adhaj/aneumann/GNRS/requirements/or.txt (line 1))
Processing /cvmfs/soft.computecanada.ca/custom/python/wheelhouse/gentoo2023/x86-64-v3/matplotlib-3.10.0+computecanada-cp312-cp312-linux_x86_64.whl (from -r /home/aneumann/projects/def-adhaj/aneumann/GNRS/requirements/or.txt (line 2))
Processing /cvmfs/soft.computecanada.ca/custom/python/wheelhouse/gentoo2023/x86-64-v3/pandas-2.2.3+computecanada-cp312-cp312-linux_x86_64.whl (from -r /home/aneumann/projects/def-adhaj/aneumann/GNRS/requirements/or.txt (line 3))
Processing /cvmfs/soft.computecanada.ca/custom/python/wheelhouse/generic/absl_py-2.3.0+computecanada-py3-none-any.whl (from ortools<9.11,>=9.10->-r /home/aneumann/projects/def-adhaj/aneumann/GNRS/requirements/or.txt (line 1))
Processing /cvmfs/soft.computecanada.ca/custom/python/wheelhouse/gentoo2023/generic/numpy-2.2.2+computecanada-cp312-cp312-linux_x86_64.whl (from ortools<9.11,>=9.10->-r /home/aneumann/projects/def-adhaj/aneumann/GNRS/requirements/or.txt (line 1))
Processing /cvmfs/soft.computecanada.ca/custom/python/wheelhouse/gentoo2023/x86-64-v3/protobuf-6.31.1+computecanada-cp312-cp312-linux_x86_64.whl (from ortools<9.11,>=9.10->-r /home/aneumann/projects/def-adhaj/aneumann/GNRS/requirements/or.txt (line 1))
Requirement already satisfied: immutabledict>=3.0.0 in /localscratch/aneumann.46806163.0/env/lib/python3.12/site-packages (from ortools<9.11,>=9.10->-r /home/aneumann/projects/def-adhaj/aneumann/GNRS/requirements/or.txt (line 1)) (4.2.0)
Processing /cvmfs/soft.computecanada.ca/custom/python/wheelhouse/gentoo2023/generic/contourpy-1.3.1+computecanada-cp312-cp312-linux_x86_64.whl (from matplotlib->-r /home/aneumann/projects/def-adhaj/aneumann/GNRS/requirements/or.txt (line 2))
Processing /cvmfs/soft.computecanada.ca/custom/python/wheelhouse/generic/cycler-0.12.1+computecanada-py3-none-any.whl (from matplotlib->-r /home/aneumann/projects/def-adhaj/aneumann/GNRS/requirements/or.txt (line 2))
Processing /cvmfs/soft.computecanada.ca/custom/python/wheelhouse/generic/fonttools-4.59.0+computecanada-cp312-cp312-linux_x86_64.whl (from matplotlib->-r /home/aneumann/projects/def-adhaj/aneumann/GNRS/requirements/or.txt (line 2))
Processing /cvmfs/soft.computecanada.ca/custom/python/wheelhouse/gentoo2023/x86-64-v3/kiwisolver-1.4.8+computecanada-cp312-cp312-linux_x86_64.whl (from matplotlib->-r /home/aneumann/projects/def-adhaj/aneumann/GNRS/requirements/or.txt (line 2))
Processing /cvmfs/soft.computecanada.ca/custom/python/wheelhouse/generic/packaging-25.0+computecanada-py3-none-any.whl (from matplotlib->-r /home/aneumann/projects/def-adhaj/aneumann/GNRS/requirements/or.txt (line 2))
Processing /cvmfs/soft.computecanada.ca/custom/python/wheelhouse/gentoo2023/x86-64-v3/pillow-11.1.0+computecanada-cp312-cp312-linux_x86_64.whl (from matplotlib->-r /home/aneumann/projects/def-adhaj/aneumann/GNRS/requirements/or.txt (line 2))
Processing /cvmfs/soft.computecanada.ca/custom/python/wheelhouse/generic/pyparsing-3.2.3+computecanada-py3-none-any.whl (from matplotlib->-r /home/aneumann/projects/def-adhaj/aneumann/GNRS/requirements/or.txt (line 2))
Processing /cvmfs/soft.computecanada.ca/custom/python/wheelhouse/generic/python_dateutil-2.9.0.post0+computecanada-py2.py3-none-any.whl (from matplotlib->-r /home/aneumann/projects/def-adhaj/aneumann/GNRS/requirements/or.txt (line 2))
Processing /cvmfs/soft.computecanada.ca/custom/python/wheelhouse/generic/pytz-2025.2+computecanada-py2.py3-none-any.whl (from pandas->-r /home/aneumann/projects/def-adhaj/aneumann/GNRS/requirements/or.txt (line 3))
Processing /cvmfs/soft.computecanada.ca/custom/python/wheelhouse/generic/tzdata-2025.2+computecanada-py2.py3-none-any.whl (from pandas->-r /home/aneumann/projects/def-adhaj/aneumann/GNRS/requirements/or.txt (line 3))
Processing /cvmfs/soft.computecanada.ca/custom/python/wheelhouse/generic/six-1.17.0+computecanada-py2.py3-none-any.whl (from python-dateutil>=2.7->matplotlib->-r /home/aneumann/projects/def-adhaj/aneumann/GNRS/requirements/or.txt (line 2))
Installing collected packages: pytz, tzdata, six, pyparsing, protobuf, pillow, packaging, numpy, kiwisolver, fonttools, cycler, absl-py, python-dateutil, contourpy, pandas, matplotlib, ortools
Successfully installed absl-py-2.3.0+computecanada contourpy-1.3.1+computecanada cycler-0.12.1+computecanada fonttools-4.59.0+computecanada kiwisolver-1.4.8+computecanada matplotlib-3.10.0+computecanada numpy-2.2.2+computecanada ortools-9.10.4067+computecanada packaging-25.0+computecanada pandas-2.2.3+computecanada pillow-11.1.0+computecanada protobuf-6.31.1+computecanada pyparsing-3.2.3+computecanada python-dateutil-2.9.0.post0+computecanada pytz-2025.2+computecanada six-1.17.0+computecanada tzdata-2025.2+computecanada

Starting CP-SAT solver v9.10.4067
Parameters: max_time_in_seconds: 86400 max_memory_in_mb: 185000 log_search_progress: true enumerate_all_solutions: false num_search_workers: 32 absolute_gap_limit: 0 relative_gap_limit: 0

Initial optimization model '': (model_fingerprint: 0x2c6ee4b828d307d1)
#Variables: 384 (#ints: 11 in objective)
  - 281 Booleans in [0,1]
  - 103 in [0,699]
#kLinear1: 49
#kLinear2: 628
#kLinear3: 306
#kLinearN: 6'314 (#terms: 95'749)

Starting presolve at 0.00s
  4.07e-03s  0.00e+00d  [DetectDominanceRelations] 
  7.66e-02s  0.00e+00d  [PresolveToFixPoint] #num_loops=7 #num_dual_strengthening=3 
  5.35e-05s  0.00e+00d  [ExtractEncodingFromLinear] #potential_supersets=8 
[Symmetry] Graph for symmetry has 7'170 nodes and 77'220 arcs.
[Symmetry] Symmetry computation done. time: 0.0038944 dtime: 0.0069218
[Symmetry] #generators: 1, average support size: 36
[Symmetry] The model contains 235 duplicate constraints !
[Symmetry] 18 orbits with sizes: 2,2,2,2,2,2,2,2,2,2,...
[Symmetry] Num fixable by intersecting at_most_one with orbits: 1 largest_orbit: 2
  2.08e-02s  4.09e-03d  [Probe] #probed=420 #new_bounds=5 #equiv=1 
  7.13e-05s  0.00e+00d  [MaxClique] Merged 13(26 literals) into 6(12 literals) at_most_ones. 
  3.95e-03s  0.00e+00d  [DetectDominanceRelations] 
  3.40e-02s  0.00e+00d  [PresolveToFixPoint] #num_loops=5 #num_dual_strengthening=3 
  1.69e-02s  0.00e+00d  [ProcessAtMostOneAndLinear] 
  6.41e-03s  0.00e+00d  [DetectDuplicateConstraints] #duplicates=343 #without_enforcements=237 
  5.27e-03s  3.38e-04d  [DetectDominatedLinearConstraints] #relevant_constraints=5'674 #num_inclusions=4'010 
  6.71e-04s  0.00e+00d  [DetectDifferentVariables] #different=48 #cliques=1 #size=8 
  1.33e-03s  1.11e-04d  [ProcessSetPPC] #relevant_constraints=5'142 
  3.69e-05s  0.00e+00d  [FindAlmostIdenticalLinearConstraints] 
  4.98e-04s  7.55e-04d  [FindBigAtMostOneAndLinearOverlap] 
  1.37e-02s  6.89e-03d  [FindBigVerticalLinearOverlap] #blocks=79 #saved_nz=14'720 
  6.85e-04s  2.50e-04d  [FindBigHorizontalLinearOverlap] #linears=4'941 
  2.69e-05s  0.00e+00d  [MergeClauses] 
  4.25e-03s  0.00e+00d  [DetectDominanceRelations] 
  5.86e-02s  0.00e+00d  [PresolveToFixPoint] #num_loops=3 #num_dual_strengthening=1 
  4.18e-03s  0.00e+00d  [DetectDominanceRelations] 
  3.30e-02s  0.00e+00d  [PresolveToFixPoint] #num_loops=1 #num_dual_strengthening=1 
[Symmetry] Graph for symmetry has 7'081 nodes and 61'359 arcs.
[Symmetry] Symmetry computation done. time: 0.00168815 dtime: 0.00352368
  2.00e-02s  3.71e-03d  [Probe] #probed=420 #new_bounds=43 
  1.89e-05s  0.00e+00d  [MaxClique] 
  4.19e-03s  0.00e+00d  [DetectDominanceRelations] 
  5.12e-02s  0.00e+00d  [PresolveToFixPoint] #num_loops=2 #num_dual_strengthening=1 
  1.64e-02s  0.00e+00d  [ProcessAtMostOneAndLinear] 
  5.72e-03s  0.00e+00d  [DetectDuplicateConstraints] #without_enforcements=252 
  3.64e-03s  2.29e-04d  [DetectDominatedLinearConstraints] #relevant_constraints=5'513 #num_inclusions=1'338 
  5.44e-04s  0.00e+00d  [DetectDifferentVariables] 
  1.17e-03s  7.89e-05d  [ProcessSetPPC] #relevant_constraints=4'889 
  4.58e-05s  5.50e-08d  [FindAlmostIdenticalLinearConstraints] #num_tested_pairs=3 
  2.74e-04s  3.31e-04d  [FindBigAtMostOneAndLinearOverlap] 
  8.91e-03s  4.77e-03d  [FindBigVerticalLinearOverlap] #blocks=75 #saved_nz=8'710 
  6.20e-04s  1.97e-04d  [FindBigHorizontalLinearOverlap] #linears=4'606 
  2.32e-05s  0.00e+00d  [MergeClauses] 
  3.62e-03s  0.00e+00d  [DetectDominanceRelations] 
  5.43e-02s  0.00e+00d  [PresolveToFixPoint] #num_loops=2 #num_dual_strengthening=1 
  3.62e-03s  0.00e+00d  [DetectDominanceRelations] 
  3.52e-02s  0.00e+00d  [PresolveToFixPoint] #num_loops=1 #num_dual_strengthening=1 
[Symmetry] Graph for symmetry has 7'281 nodes and 52'700 arcs.
[Symmetry] Symmetry computation done. time: 0.00151112 dtime: 0.00309401
  1.91e-02s  3.35e-03d  [Probe] #probed=420 #new_bounds=59 
  1.91e-05s  0.00e+00d  [MaxClique] 
  3.60e-03s  0.00e+00d  [DetectDominanceRelations] 
  4.91e-02s  0.00e+00d  [PresolveToFixPoint] #num_loops=2 #num_dual_strengthening=1 
  1.43e-02s  0.00e+00d  [ProcessAtMostOneAndLinear] 
  5.34e-03s  0.00e+00d  [DetectDuplicateConstraints] #without_enforcements=305 
  2.41e-03s  1.48e-04d  [DetectDominatedLinearConstraints] #relevant_constraints=5'062 #num_inclusions=57 
  4.74e-04s  0.00e+00d  [DetectDifferentVariables] 
  9.44e-04s  5.72e-05d  [ProcessSetPPC] #relevant_constraints=4'304 
  6.56e-05s  1.20e-06d  [FindAlmostIdenticalLinearConstraints] #num_tested_pairs=72 
  2.15e-04s  2.36e-04d  [FindBigAtMostOneAndLinearOverlap] 
  4.90e-03s  3.26e-03d  [FindBigVerticalLinearOverlap] #blocks=34 #saved_nz=3'091 
  5.39e-04s  1.64e-04d  [FindBigHorizontalLinearOverlap] #linears=4'003 
  2.31e-05s  0.00e+00d  [MergeClauses] 
  3.45e-03s  0.00e+00d  [DetectDominanceRelations] 
  4.23e-02s  0.00e+00d  [PresolveToFixPoint] #num_loops=2 #num_dual_strengthening=1 
  1.20e-04s  0.00e+00d  [ExpandObjective] #entries=752 #tight_variables=289 #tight_constraints=165 

Presolve summary:
  - 86 affine relations were detected.
  - rule 'TODO dual: only one blocking constraint?' was applied 953 times.
  - rule 'TODO dual: only one blocking enforced constraint?' was applied 78 times.
  - rule 'TODO dual: only one unspecified blocking constraint?' was applied 125 times.
  - rule 'TODO duplicate: identical constraint with different enforcements' was applied 794 times.
  - rule 'affine: new relation' was applied 86 times.
  - rule 'at_most_one: removed literals' was applied 6 times.
  - rule 'at_most_one: size one' was applied 6 times.
  - rule 'at_most_one: transformed into max clique.' was applied 1 time.
  - rule 'deductions: 322 stored' was applied 1 time.
  - rule 'dual: fix variable' was applied 30 times.
  - rule 'dual: reduced domain' was applied 66 times.
  - rule 'duplicate: merged rhs of linear constraint' was applied 93 times.
  - rule 'duplicate: removed constraint' was applied 343 times.
  - rule 'enforcement: false literal' was applied 4 times.
  - rule 'exactly_one: x and not(x)' was applied 1 time.
  - rule 'incompatible linear: add implication' was applied 84 times.
  - rule 'linear matrix: common vertical rectangle' was applied 188 times.
  - rule 'linear: always true' was applied 833 times.
  - rule 'linear: doubleton free' was applied 13 times.
  - rule 'linear: empty' was applied 30 times.
  - rule 'linear: extracted enforcement literal' was applied 10'469 times.
  - rule 'linear: fixed or dup variables' was applied 6'447 times.
  - rule 'linear: positive equal one' was applied 8 times.
  - rule 'linear: reduced variable domains' was applied 296 times.
  - rule 'linear: remapped using affine relations' was applied 6'214 times.
  - rule 'linear: simplified rhs' was applied 19'430 times.
  - rule 'linear: tightened into equality' was applied 2 times.
  - rule 'linear: variable substitution 1' was applied 13 times.
  - rule 'linear: variable substitution 2' was applied 3 times.
  - rule 'linear: variable substitution 3' was applied 4 times.
  - rule 'no_overlap: inferred from x != y constraints' was applied 1 time.
  - rule 'presolve: 97 unused variables removed.' was applied 1 time.
  - rule 'presolve: iteration' was applied 3 times.
  - rule 'probing: reduced enforced constraint to implication.' was applied 13 times.
  - rule 'symmetry: fixed to false in general orbit' was applied 1 time.

Presolved optimization model '': (model_fingerprint: 0x2874dc6b8dea3a3)
#Variables: 369 (#ints: 11 in objective)
  - 113 Booleans in [0,1]
  - 192 different domains in [-4111,6166] with a largest complexity of 11.
#kExactlyOne: 7 (#literals: 21)
#kInterval: 8
#kLinear2: 1'158 (#enforced: 1'091 #multi: 899)
#kLinear3: 365 (#enforced: 223)
#kLinearN: 4'626 (#enforced: 4'254 #multi: 121) (#terms: 35'377)
#kNoOverlap: 1 (#intervals: 8)

Preloading model.
#Bound   0.64s best:inf   next:[128,6167] initial_domain
[Symmetry] Graph for symmetry has 7'164 nodes and 49'628 arcs.
[Symmetry] Symmetry computation done. time: 0.00140377 dtime: 0.00292392
#Model   0.65s var:369/369 constraints:6165/6165

Starting search at 0.66s with 32 workers.
17 full problem subsolvers: [core, default_lp, fixed, lb_tree_search, max_lp, no_lp, objective_lb_search, objective_lb_search_max_lp, objective_lb_search_no_lp, objective_shaving_search_max_lp, objective_shaving_search_no_lp, probing, probing_max_lp, pseudo_costs, quick_restart, quick_restart_no_lp, reduced_costs]
13 first solution subsolvers: [fj_long_default, fj_long_lin_default, fj_long_random, fj_short_default, fj_short_lin_default, fj_short_lin_random, fj_short_random, fs_random(2), fs_random_no_lp, fs_random_quick_restart(2), fs_random_quick_restart_no_lp]
13 incomplete subsolvers: [feasibility_pump, graph_arc_lns, graph_cst_lns, graph_dec_lns, graph_var_lns, rins/rens, rnd_cst_lns, rnd_var_lns, scheduling_intervals_lns, scheduling_precedences_lns, scheduling_time_window_lns, violation_ls(2)]
3 helper subsolvers: [neighborhood_helper, synchronization_agent, update_gap_integral]
#Bound   0.74s best:inf   next:[129,6167] objective_shaving_search_no_lp (vars=369 csts=6166)
#Bound   0.78s best:inf   next:[279,6167] no_lp (initial_propagation)
#Bound   0.88s best:inf   next:[280,6167] bool_core (num_cores=1 [size:5 mw:1 d:3] a=7 d=3 fixed=0/127 clauses=46)
#Bound   0.90s best:inf   next:[281,6167] bool_core (num_cores=1 [cover] a=7 d=3 fixed=0/136 clauses=65)
#Bound   0.91s best:inf   next:[282,6167] bool_core (num_cores=1 [cover] a=7 d=3 fixed=1/145 clauses=92)
#Bound   0.93s best:inf   next:[283,6167] bool_core (num_cores=1 [cover] a=7 d=3 fixed=2/154 clauses=125)
#Bound   0.95s best:inf   next:[284,6167] bool_core (num_cores=1 [cover] a=7 d=3 fixed=3/163 clauses=162)
#Bound   0.99s best:inf   next:[285,6167] bool_core (num_cores=1 [cover] a=7 d=3 fixed=4/172 clauses=218)
#Bound   1.01s best:inf   next:[286,6167] bool_core (num_cores=1 [cover] a=7 d=3 fixed=5/181 clauses=261)
#1       1.01s best:2196  next:[286,2195] fs_random_quick_restart_no_lp (fixed_bools=0/156)
#Bound   1.04s best:2196  next:[287,2195] bool_core (num_cores=1 [cover] a=7 d=3 fixed=6/190 clauses=321)
#Bound   1.05s best:2196  next:[292,2195] objective_lb_search_no_lp
#2       1.05s best:2195  next:[292,2194] violation_ls(batch:1 #solutions_imported:1 #lin_moves:691 #lin_evals:2'311 #weight_updates:164)
#3       1.07s best:2194  next:[292,2193] graph_dec_lns (d=0.50 s=40 t=0.10 p=0.00 stall=0 h=auto_l0) [presolve]
#Bound   1.08s best:2194  next:[360,2193] objective_lb_search_no_lp
#Bound   1.09s best:2194  next:[373,2193] objective_lb_search_no_lp
#4       1.13s best:2193  next:[373,2192] violation_ls(batch:2 #solutions_imported:2 #lin_moves:691 #lin_evals:3'819 #gen_moves:787 #gen_evals:219 #comp_moves:37 #backtracks:375 #weight_updates:178)
#Bound   1.14s best:2193  next:[496,2192] objective_lb_search_no_lp
#Bound   1.16s best:2193  next:[502,2192] objective_lb_search_no_lp
#5       1.18s best:2192  next:[502,2191] violation_ls(batch:3 #solutions_imported:3 #lin_moves:691 #lin_evals:4'962 #gen_moves:1'369 #gen_evals:369 #comp_moves:71 #backtracks:649 #weight_updates:189)
#Bound   1.24s best:2192  next:[503,2191] objective_lb_search_no_lp
#6       1.24s best:2191  next:[503,2190] violation_ls(batch:1 #solutions_imported:1 #lin_moves:0 #lin_evals:1'121 #gen_moves:584 #gen_evals:137 #comp_moves:24 #backtracks:280 #weight_updates:10)
#7       1.25s best:2189  next:[503,2188] violation_ls(batch:2 #solutions_imported:2 #lin_moves:201 #lin_evals:1'968 #gen_moves:584 #gen_evals:137 #comp_moves:24 #backtracks:280 #weight_updates:75)
#8       1.25s best:2188  next:[503,2187] violation_ls(batch:3 #solutions_imported:3 #lin_moves:203 #lin_evals:1'985 #gen_moves:584 #gen_evals:137 #comp_moves:24 #backtracks:280 #weight_updates:76)
#9       1.27s best:2166  next:[503,2165] no_lp (fixed_bools=0/171)
#Bound   1.28s best:2166  next:[514,2165] objective_lb_search_no_lp
#10      1.30s best:2146  next:[514,2145] no_lp (fixed_bools=0/174)
#11      1.31s best:2110  next:[514,2109] no_lp (fixed_bools=0/184)
#12      1.33s best:2028  next:[514,2027] no_lp (fixed_bools=0/189)
#Bound   1.33s best:2028  next:[531,2027] objective_lb_search_no_lp
#13      1.34s best:1853  next:[531,1852] no_lp (fixed_bools=0/208)
#14      1.36s best:1642  next:[531,1641] no_lp (fixed_bools=0/222)
#Bound   1.40s best:1642  next:[533,1641] objective_lb_search_no_lp
#15      1.42s best:1640  next:[533,1639] no_lp (fixed_bools=0/245)
#Bound   1.46s best:1640  next:[574,1639] objective_lb_search_max_lp
#16      1.47s best:1616  next:[574,1615] no_lp (fixed_bools=0/258)
#17      1.49s best:1592  next:[574,1591] no_lp (fixed_bools=0/274)
#Bound   1.49s best:1592  next:[576,1591] objective_lb_search_max_lp
#18      1.51s best:1568  next:[586,1567] no_lp (fixed_bools=0/288)
#19      1.55s best:1567  next:[586,1566] violation_ls(batch:4 #solutions_imported:4 #lin_moves:2'723 #lin_evals:11'732 #gen_moves:1'369 #gen_evals:369 #comp_moves:71 #backtracks:649 #weight_updates:386)
#20      1.60s best:1552  next:[586,1551] no_lp (fixed_bools=0/298)
#21      1.83s best:1547  next:[600,1546] no_lp (fixed_bools=0/324)
#22      1.85s best:1546  next:[600,1545] no_lp (fixed_bools=0/324)
#23      1.86s best:1542  next:[600,1541] no_lp (fixed_bools=0/328)
#24      1.95s best:1526  next:[600,1525] no_lp (fixed_bools=0/342)
#25      2.00s best:1522  next:[604,1521] no_lp (fixed_bools=0/343)
#Bound   1.98s best:1526  next:[604,1525] objective_lb_search_no_lp [skipped_logs=3]
#26      2.02s best:1517  next:[604,1516] quick_restart_no_lp (fixed_bools=0/428)
#27      2.06s best:1480  next:[604,1479] no_lp (fixed_bools=0/363)
#28      2.14s best:1434  next:[604,1433] no_lp (fixed_bools=0/371)
#29      2.34s best:1429  next:[627,1428] quick_restart_no_lp (fixed_bools=0/564)
#30      2.39s best:1399  next:[627,1398] scheduling_intervals_lns (d=0.50 s=51 t=0.10 p=0.00 stall=0 h=auto_l0)
#31      2.49s best:1363  next:[634,1362] scheduling_precedences_lns (d=0.50 s=53 t=0.10 p=0.00 stall=0 h=auto_l0)
#32      2.58s best:1358  next:[634,1357] no_lp (fixed_bools=0/407)
#33      2.61s best:1353  next:[634,1352] quick_restart_no_lp (fixed_bools=0/707)
#34      2.62s best:1352  next:[634,1351] violation_ls(batch:7 #solutions_imported:7 #lin_moves:5'396 #lin_evals:58'811 #gen_moves:14'634 #gen_evals:2'966 #comp_moves:1'032 #backtracks:6'794 #weight_updates:5'116)
#35      2.63s best:1351  next:[634,1350] violation_ls(batch:7 #solutions_imported:7 #lin_moves:2'753 #lin_evals:45'814 #gen_moves:15'903 #gen_evals:2'960 #comp_moves:1'489 #backtracks:7'203 #weight_updates:548)
#36      2.67s best:1348  next:[634,1347] quick_restart_no_lp (fixed_bools=0/710)
#37      2.77s best:1346  next:[656,1345] quick_restart_no_lp (fixed_bools=0/715)
#Bound   2.98s best:1346  next:[658,1345] objective_lb_search_no_lp [skipped_logs=6]
#38      3.02s best:1345  next:[658,1344] violation_ls(batch:8 #solutions_imported:8 #lin_moves:5'396 #lin_evals:58'875 #gen_moves:14'673 #gen_evals:2'968 #comp_moves:1'035 #backtracks:6'812 #weight_updates:5'116)
#39      3.02s best:1344  next:[658,1343] violation_ls(batch:8 #solutions_imported:8 #lin_moves:2'753 #lin_evals:45'828 #gen_moves:15'908 #gen_evals:2'960 #comp_moves:1'490 #backtracks:7'205 #weight_updates:548)
#40      3.22s best:1342  next:[669,1341] graph_arc_lns (d=0.97 s=142 t=0.10 p=1.00 stall=7 h=auto_l0)
#41      3.22s best:1333  next:[669,1332] graph_var_lns (d=0.97 s=141 t=0.10 p=1.00 stall=0 h=auto_l0)
#42      3.69s best:1325  next:[687,1324] graph_dec_lns (d=0.98 s=159 t=0.10 p=1.00 stall=0 h=auto_l0)
#43      3.77s best:1239  next:[688,1238] scheduling_time_window_lns (d=0.12 s=131 t=0.10 p=0.00 stall=0 h=auto_l0)
#Bound   4.01s best:1239  next:[692,1238] objective_lb_search_no_lp [skipped_logs=6]
#Bound   4.38s best:1239  next:[695,1238] objective_lb_search_no_lp [skipped_logs=1]
#44      5.48s best:1233  next:[698,1232] quick_restart (fixed_bools=0/393)
#45      5.73s best:1231  next:[708,1230] rnd_cst_lns (d=0.98 s=200 t=0.10 p=1.00 stall=9 h=auto_l0)
#Bound   5.59s best:1233  next:[708,1232] objective_lb_search_no_lp [skipped_logs=1]
#Bound   6.89s best:1231  next:[712,1230] objective_lb_search_no_lp [skipped_logs=1]
#Bound   7.32s best:1231  next:[718,1230] objective_lb_search_max_lp [skipped_logs=1]
#Bound   8.84s best:1231  next:[723,1230] objective_lb_search_no_lp [skipped_logs=1]
#Bound   9.67s best:1231  next:[732,1230] objective_lb_search_max_lp [skipped_logs=1]
#Bound  10.25s best:1231  next:[733,1230] objective_lb_search_no_lp [skipped_logs=0]
#Bound  11.96s best:1231  next:[743,1230] objective_lb_search_no_lp [skipped_logs=2]
#Bound  13.57s best:1231  next:[752,1230] objective_lb_search_no_lp
#Bound  15.48s best:1231  next:[753,1230] objective_lb_search_no_lp
#Bound  16.60s best:1231  next:[754,1230] objective_lb_search_no_lp
#Bound  17.27s best:1231  next:[762,1230] objective_lb_search_no_lp
#Bound  18.17s best:1231  next:[763,1230] objective_lb_search_no_lp
#Bound  21.68s best:1231  next:[765,1230] objective_lb_search_no_lp
#Bound  21.90s best:1231  next:[767,1230] objective_lb_search_no_lp
#Bound  25.45s best:1231  next:[769,1230] objective_lb_search_no_lp
#46     26.97s best:1229  next:[769,1228] quick_restart_no_lp (fixed_bools=143/1698)
#47     27.09s best:1223  next:[769,1222] quick_restart_no_lp (fixed_bools=143/1700)
#48     27.12s best:1222  next:[769,1221] quick_restart_no_lp (fixed_bools=143/1704)
#Bound  27.19s best:1222  next:[770,1221] objective_lb_search_no_lp
#49     27.42s best:1214  next:[770,1213] quick_restart_no_lp (fixed_bools=144/1719)
#50     27.50s best:1213  next:[770,1212] violation_ls(batch:58 #solutions_imported:15 #lin_moves:29'872 #lin_evals:808'185 #gen_moves:287'309 #gen_evals:64'756 #comp_moves:8'278 #backtracks:139'433 #weight_updates:11'986)
#51     27.52s best:1212  next:[770,1211] violation_ls(batch:58 #solutions_imported:14 #lin_moves:51'515 #lin_evals:806'374 #gen_moves:141'706 #gen_evals:79'957 #comp_moves:15'228 #backtracks:63'158 #weight_updates:2'131)
#52     27.67s best:1207  next:[770,1206] quick_restart_no_lp (fixed_bools=144/1727)
#Bound  28.80s best:1207  next:[772,1206] objective_lb_search_no_lp
#Bound  29.98s best:1207  next:[773,1206] objective_lb_search_no_lp
#Bound  35.42s best:1207  next:[775,1206] objective_lb_search_no_lp
#Bound  37.05s best:1207  next:[776,1206] objective_lb_search_no_lp
#Bound  40.05s best:1207  next:[778,1206] objective_lb_search_no_lp
#Bound  41.07s best:1207  next:[783,1206] objective_lb_search_no_lp
#Bound  45.79s best:1207  next:[784,1206] objective_lb_search_no_lp
#Bound  47.56s best:1207  next:[785,1206] objective_lb_search_no_lp
#Bound  47.86s best:1207  next:[786,1206] objective_lb_search_no_lp
#Bound  48.15s best:1207  next:[787,1206] objective_lb_search_no_lp
#Bound  48.53s best:1207  next:[790,1206] objective_lb_search_no_lp
#Bound  54.48s best:1207  next:[791,1206] objective_lb_search_no_lp
#Bound  56.29s best:1207  next:[792,1206] objective_lb_search_no_lp
#Bound  58.08s best:1207  next:[794,1206] objective_lb_search_no_lp
#Bound  58.84s best:1207  next:[795,1206] objective_lb_search_no_lp
#Bound  60.71s best:1207  next:[798,1206] objective_lb_search_no_lp
#Bound  63.52s best:1207  next:[800,1206] objective_lb_search_no_lp
#Bound  64.70s best:1207  next:[801,1206] objective_lb_search_no_lp
#Bound  66.57s best:1207  next:[803,1206] objective_lb_search_no_lp
#Bound  72.88s best:1207  next:[804,1206] objective_lb_search_no_lp
#Bound  76.97s best:1207  next:[805,1206] objective_lb_search_no_lp
#Bound  85.17s best:1207  next:[806,1206] objective_lb_search_no_lp
#Bound  85.69s best:1207  next:[807,1206] objective_lb_search_no_lp
#Bound  87.74s best:1207  next:[808,1206] objective_lb_search_no_lp
#Bound  93.55s best:1207  next:[809,1206] objective_lb_search_no_lp
#Bound  94.07s best:1207  next:[811,1206] objective_lb_search_no_lp
#Bound  96.85s best:1207  next:[813,1206] objective_lb_search_no_lp
#Bound 100.96s best:1207  next:[815,1206] objective_lb_search_no_lp
#Bound 106.26s best:1207  next:[816,1206] objective_lb_search_no_lp
#Bound 119.63s best:1207  next:[818,1206] objective_lb_search_no_lp
#Bound 127.03s best:1207  next:[827,1206] objective_lb_search_no_lp
#Bound 144.23s best:1207  next:[828,1206] objective_shaving_search_no_lp (vars=452 csts=6053)
#Bound 146.65s best:1207  next:[829,1206] objective_lb_search_no_lp
#Bound 161.31s best:1207  next:[830,1206] objective_lb_search_no_lp
#Bound 162.60s best:1207  next:[831,1206] objective_lb_search_no_lp
#Bound 163.75s best:1207  next:[832,1206] objective_lb_search_no_lp
#Bound 168.32s best:1207  next:[833,1206] objective_lb_search_no_lp
#Bound 172.63s best:1207  next:[835,1206] objective_lb_search_no_lp
#Bound 182.16s best:1207  next:[836,1206] objective_lb_search_no_lp
#Bound 190.78s best:1207  next:[837,1206] objective_lb_search_no_lp
#Bound 196.43s best:1207  next:[838,1206] objective_lb_search_no_lp
#Bound 200.32s best:1207  next:[839,1206] objective_lb_search_no_lp
#Bound 204.76s best:1207  next:[840,1206] objective_lb_search_no_lp
#Bound 210.75s best:1207  next:[842,1206] objective_lb_search_no_lp
#Bound 220.72s best:1207  next:[843,1206] objective_lb_search_no_lp
#Bound 227.53s best:1207  next:[845,1206] objective_lb_search_no_lp
#Bound 252.22s best:1207  next:[846,1206] objective_shaving_search_no_lp (vars=463 csts=6064)
#Bound 261.98s best:1207  next:[847,1206] objective_lb_search_no_lp
#Bound 275.66s best:1207  next:[849,1206] objective_lb_search_no_lp
#Bound 281.43s best:1207  next:[850,1206] objective_lb_search_no_lp
#Bound 291.73s best:1207  next:[851,1206] objective_lb_search_no_lp
#Bound 307.96s best:1207  next:[853,1206] objective_lb_search_no_lp
#Bound 327.92s best:1207  next:[856,1206] objective_lb_search_no_lp
#Bound 338.42s best:1207  next:[858,1206] objective_lb_search_no_lp
#Bound 352.32s best:1207  next:[859,1206] objective_lb_search_no_lp
#Bound 361.76s best:1207  next:[860,1206] objective_lb_search_no_lp
#Bound 366.43s best:1207  next:[861,1206] objective_lb_search_no_lp
#Bound 374.55s best:1207  next:[862,1206] objective_lb_search_no_lp
#Bound 391.99s best:1207  next:[863,1206] objective_lb_search_no_lp
#Bound 397.80s best:1207  next:[864,1206] objective_lb_search_no_lp
#Bound 408.01s best:1207  next:[866,1206] objective_lb_search_no_lp
#Bound 428.03s best:1207  next:[868,1206] objective_lb_search_no_lp
#Bound 454.78s best:1207  next:[869,1206] objective_lb_search_no_lp
#Bound 459.29s best:1207  next:[871,1206] objective_lb_search_no_lp
#Bound 473.22s best:1207  next:[872,1206] objective_lb_search_no_lp
#Bound 482.39s best:1207  next:[874,1206] objective_lb_search_no_lp
#Bound 486.54s best:1207  next:[875,1206] objective_lb_search_no_lp
#Bound 502.27s best:1207  next:[876,1206] objective_lb_search_no_lp
#Bound 538.99s best:1207  next:[878,1206] objective_lb_search_no_lp
#Bound 543.86s best:1207  next:[881,1206] objective_lb_search_no_lp
#Bound 569.18s best:1207  next:[884,1206] objective_lb_search_no_lp
#Bound 570.41s best:1207  next:[885,1206] objective_lb_search_no_lp
#Bound 626.59s best:1207  next:[886,1206] objective_lb_search_no_lp
#Bound 645.16s best:1207  next:[887,1206] objective_lb_search_no_lp
#Bound 666.31s best:1207  next:[888,1206] objective_lb_search_no_lp
#Bound 702.66s best:1207  next:[889,1206] objective_lb_search_no_lp
#Bound 741.23s best:1207  next:[890,1206] objective_lb_search_no_lp
#Bound 758.11s best:1207  next:[891,1206] objective_lb_search_no_lp
#Bound 780.47s best:1207  next:[892,1206] objective_lb_search_no_lp
#Bound 814.52s best:1207  next:[894,1206] objective_lb_search_no_lp
#Bound 862.70s best:1207  next:[895,1206] objective_lb_search_no_lp
#Bound 892.27s best:1207  next:[896,1206] objective_lb_search_no_lp
#Bound 938.90s best:1207  next:[897,1206] objective_lb_search_no_lp
#Bound 977.10s best:1207  next:[898,1206] objective_lb_search_no_lp
#Bound 1015.33s best:1207  next:[899,1206] objective_lb_search_no_lp
#Bound 1115.99s best:1207  next:[900,1206] objective_shaving_search_no_lp (vars=438 csts=5999)
#Bound 1130.48s best:1207  next:[902,1206] objective_lb_search_no_lp
#Bound 1133.48s best:1207  next:[904,1206] objective_lb_search_no_lp
#Bound 1139.61s best:1207  next:[906,1206] objective_lb_search_no_lp
#Bound 1143.46s best:1207  next:[908,1206] objective_lb_search_no_lp
#Bound 1148.27s best:1207  next:[910,1206] objective_lb_search_no_lp
#Bound 1150.61s best:1207  next:[911,1206] objective_lb_search_no_lp
#Bound 1156.26s best:1207  next:[912,1206] objective_lb_search_no_lp
#Bound 1157.61s best:1207  next:[914,1206] objective_lb_search_no_lp
#Bound 1166.03s best:1207  next:[915,1206] objective_lb_search_no_lp
#Bound 1174.91s best:1207  next:[916,1206] objective_lb_search_no_lp
#Bound 1283.80s best:1207  next:[917,1206] objective_shaving_search_no_lp (vars=438 csts=5999)
#Bound 1392.87s best:1207  next:[918,1206] objective_lb_search_no_lp
#Bound 1511.40s best:1207  next:[919,1206] objective_shaving_search_no_lp (vars=438 csts=5999)
#Bound 1561.88s best:1207  next:[920,1206] objective_lb_search_no_lp
#Bound 1597.42s best:1207  next:[921,1206] objective_lb_search_no_lp
#Bound 1643.54s best:1207  next:[922,1206] objective_lb_search_no_lp
#Bound 1649.68s best:1207  next:[923,1206] objective_lb_search_no_lp
#Bound 1695.78s best:1207  next:[924,1206] objective_lb_search_no_lp
#Bound 1748.69s best:1207  next:[925,1206] objective_lb_search_no_lp
#Bound 1776.50s best:1207  next:[926,1206] objective_lb_search_no_lp
#Bound 1840.30s best:1207  next:[927,1206] objective_lb_search_no_lp
#Bound 1914.63s best:1207  next:[928,1206] objective_lb_search_no_lp
#Bound 2022.87s best:1207  next:[929,1206] objective_lb_search_no_lp
#Bound 2167.97s best:1207  next:[935,1206] objective_lb_search_no_lp
#Bound 2290.64s best:1207  next:[936,1206] objective_lb_search_no_lp
#Bound 2455.38s best:1207  next:[937,1206] objective_lb_search_no_lp
#Bound 2583.33s best:1207  next:[938,1206] objective_lb_search_no_lp
#Bound 2660.49s best:1207  next:[939,1206] objective_lb_search_no_lp
#Bound 2820.28s best:1207  next:[940,1206] lb_tree_search (nodes=173116/173154 rc=1397 decisions=1532304 @root=324 restarts=12) 
#Bound 2903.65s best:1207  next:[941,1206] objective_lb_search_no_lp
#Bound 2948.68s best:1207  next:[942,1206] objective_lb_search_no_lp
#Bound 3057.14s best:1207  next:[943,1206] objective_lb_search_no_lp
#Bound 3136.13s best:1207  next:[944,1206] objective_lb_search_no_lp
#Bound 3242.23s best:1207  next:[945,1206] objective_lb_search_no_lp
#Bound 3416.44s best:1207  next:[946,1206] objective_lb_search_no_lp
#Bound 3470.46s best:1207  next:[947,1206] objective_lb_search_no_lp
#Bound 3487.45s best:1207  next:[948,1206] objective_lb_search_no_lp
#Bound 3622.24s best:1207  next:[949,1206] objective_lb_search_no_lp
#Bound 3700.99s best:1207  next:[950,1206] objective_lb_search_no_lp
#Bound 3852.26s best:1207  next:[951,1206] objective_lb_search_no_lp
#Bound 3935.38s best:1207  next:[952,1206] objective_lb_search_no_lp
#Bound 4046.86s best:1207  next:[953,1206] objective_lb_search_no_lp
#Bound 4148.11s best:1207  next:[954,1206] objective_lb_search_no_lp
#Bound 4235.97s best:1207  next:[955,1206] objective_lb_search_no_lp
#Bound 4341.09s best:1207  next:[956,1206] objective_lb_search_no_lp
#Bound 4433.96s best:1207  next:[957,1206] objective_lb_search_no_lp
#Bound 4588.71s best:1207  next:[959,1206] objective_lb_search_no_lp
#Bound 4759.04s best:1207  next:[964,1206] objective_lb_search_no_lp
#Bound 4993.53s best:1207  next:[965,1206] objective_lb_search_no_lp
#Bound 5112.66s best:1207  next:[966,1206] objective_lb_search_no_lp
#Bound 5243.86s best:1207  next:[967,1206] objective_lb_search_no_lp
#Bound 5616.38s best:1207  next:[968,1206] objective_lb_search_no_lp
#Bound 5942.73s best:1207  next:[969,1206] lb_tree_search (nodes=357672/363518 rc=2512 decisions=2947406 @root=606 restarts=12) 
#Bound 6121.39s best:1207  next:[970,1206] objective_lb_search_no_lp
#Bound 6366.73s best:1207  next:[971,1206] lb_tree_search (nodes=371597/377718 rc=2643 decisions=3118998 @root=642 restarts=12) 
#Bound 6510.30s best:1207  next:[972,1206] objective_lb_search_no_lp
#Bound 6796.45s best:1207  next:[973,1206] objective_lb_search_no_lp
#Bound 6984.43s best:1207  next:[974,1206] objective_lb_search_no_lp
#53    7028.06s best:1204  next:[974,1203] graph_var_lns (d=0.98 s=77118 t=0.96 p=0.50 stall=3879 h=auto_l0)
#Bound 7106.54s best:1204  next:[975,1203] objective_lb_search_no_lp
#Bound 7123.48s best:1204  next:[976,1203] objective_lb_search_no_lp
#Bound 7433.94s best:1204  next:[977,1203] objective_lb_search_no_lp
#Bound 7559.13s best:1204  next:[978,1203] objective_lb_search_no_lp
#Bound 7823.03s best:1204  next:[979,1203] objective_lb_search_no_lp
#Bound 8039.65s best:1204  next:[980,1203] objective_lb_search_no_lp
#Bound 8336.86s best:1204  next:[981,1203] objective_lb_search_no_lp
#Bound 8713.92s best:1204  next:[982,1203] objective_lb_search_no_lp
#Bound 8860.44s best:1204  next:[983,1203] objective_lb_search_no_lp
#Bound 9333.96s best:1204  next:[984,1203] lb_tree_search (nodes=513134/520711 rc=3841 decisions=4393674 @root=898 restarts=12) 
#Bound 9702.51s best:1204  next:[985,1203] lb_tree_search (nodes=527099/534973 rc=3946 decisions=4536763 @root=927 restarts=12) 
#Bound 10016.79s best:1204  next:[986,1203] lb_tree_search (nodes=537388/545405 rc=4021 decisions=4671101 @root=954 restarts=12) 
#Bound 10280.08s best:1204  next:[987,1203] objective_lb_search_no_lp
#Bound 10627.84s best:1204  next:[988,1203] objective_lb_search_no_lp
#Bound 10789.02s best:1204  next:[989,1203] objective_lb_search_no_lp
#Bound 11019.55s best:1204  next:[990,1203] objective_lb_search_no_lp
#Model 11308.85s var:368/369 constraints:5918/6165
#Bound 11364.76s best:1204  next:[991,1203] objective_lb_search_no_lp
#Bound 11514.91s best:1204  next:[992,1203] objective_lb_search_no_lp
#Bound 11678.50s best:1204  next:[993,1203] objective_lb_search_no_lp
#Bound 12223.06s best:1204  next:[994,1203] objective_lb_search_no_lp
#Bound 12498.38s best:1204  next:[995,1203] objective_lb_search_no_lp
#Bound 12638.65s best:1204  next:[996,1203] objective_lb_search_no_lp
#Bound 12886.78s best:1204  next:[997,1203] objective_lb_search_no_lp
#Bound 13176.48s best:1204  next:[998,1203] objective_lb_search_no_lp
#Bound 13431.37s best:1204  next:[999,1203] objective_lb_search_no_lp
#Bound 13819.13s best:1204  next:[1000,1203] objective_lb_search_no_lp
#Bound 14444.71s best:1204  next:[1001,1203] objective_lb_search_no_lp
#Bound 15111.90s best:1204  next:[1002,1203] lb_tree_search (nodes=756633/788113 rc=5764 decisions=6865890 @root=1392 restarts=12) 
#Bound 15614.28s best:1204  next:[1003,1203] lb_tree_search (nodes=769641/801179 rc=5910 decisions=7050710 @root=1429 restarts=12) 
#Bound 15673.85s best:1204  next:[1004,1203] objective_lb_search_no_lp
#Model 15691.87s var:367/369 constraints:5907/6165
#Bound 15691.88s best:1204  next:[1005,1203] objective_lb_search_no_lp
#Bound 15691.88s best:1204  next:[1006,1203] objective_lb_search_no_lp
#Bound 16075.32s best:1204  next:[1007,1203] objective_lb_search_no_lp
#Bound 16448.41s best:1204  next:[1008,1203] objective_lb_search_no_lp
#Bound 16878.04s best:1204  next:[1009,1203] objective_lb_search_no_lp
#Bound 17269.07s best:1204  next:[1010,1203] objective_lb_search_no_lp
#Bound 17859.40s best:1204  next:[1011,1203] lb_tree_search (nodes=729288/926198 rc=6780 decisions=8080906 @root=1636 restarts=12) 
#Bound 18261.70s best:1204  next:[1012,1203] lb_tree_search (nodes=741103/938126 rc=6902 decisions=8250677 @root=1669 restarts=12) 
#Bound 18530.28s best:1204  next:[1013,1203] objective_lb_search_no_lp
#Bound 19099.86s best:1204  next:[1014,1203] lb_tree_search (nodes=773721/972434 rc=7191 decisions=8622337 @root=1744 restarts=12) 
#Bound 19584.16s best:1204  next:[1015,1203] lb_tree_search (nodes=788733/990046 rc=7337 decisions=8825852 @root=1785 restarts=12) 
#Bound 19990.14s best:1204  next:[1016,1203] lb_tree_search (nodes=729763/1005633 rc=7451 decisions=8999072 @root=1820 restarts=12) 
#Bound 20393.95s best:1204  next:[1017,1203] lb_tree_search (nodes=715296/1021675 rc=7570 decisions=9164567 @root=1853 restarts=12) 
#Bound 20762.47s best:1204  next:[1018,1203] lb_tree_search (nodes=725381/1036806 rc=7689 decisions=9324691 @root=1886 restarts=12) 
#Bound 20914.15s best:1204  next:[1019,1203] objective_lb_search_no_lp
#Bound 21231.79s best:1204  next:[1026,1203] objective_lb_search_no_lp
#Model 21507.96s var:366/369 constraints:5708/6165
#Bound 21715.37s best:1204  next:[1027,1203] lb_tree_search (nodes=471742/1106628 rc=8019 decisions=9848418 @root=1993 restarts=12) 
#Model 21783.54s var:365/369 constraints:5575/6165
#Model 21799.67s var:364/369 constraints:5360/6165
#Model 21812.60s var:363/369 constraints:5302/6165
#Bound 21813.38s best:1204  next:[1028,1203] lb_tree_search (nodes=287252/1111556 rc=8054 decisions=9899484 @root=2004 restarts=12) 
#Bound 21880.41s best:1204  next:[1029,1203] lb_tree_search (nodes=152221/1114568 rc=8075 decisions=9931033 @root=2012 restarts=12) 
#Bound 21942.33s best:1204  next:[1030,1203] lb_tree_search (nodes=152759/1117757 rc=8097 decisions=9961911 @root=2019 restarts=12) 
#Bound 22006.73s best:1204  next:[1031,1203] lb_tree_search (nodes=153940/1120764 rc=8113 decisions=9992529 @root=2026 restarts=12) 
#Bound 22074.06s best:1204  next:[1032,1203] lb_tree_search (nodes=149980/1123523 rc=8134 decisions=10021570 @root=2034 restarts=12) 
#Model 22099.12s var:362/369 constraints:5291/6165
#Bound 22136.65s best:1204  next:[1033,1203] lb_tree_search (nodes=148689/1126318 rc=8154 decisions=10050155 @root=2040 restarts=12) 
#Model 22147.65s var:361/369 constraints:5207/6165
#Bound 22192.43s best:1204  next:[1034,1203] lb_tree_search (nodes=144416/1128913 rc=8164 decisions=10076401 @root=2045 restarts=12) 
#Bound 22226.85s best:1204  next:[1036,1203] objective_lb_search_no_lp
#Model 22314.02s var:360/369 constraints:5167/6165
#Bound 22314.42s best:1204  next:[1037,1203] lb_tree_search (nodes=145877/1135384 rc=8204 decisions=10136867 @root=2057 restarts=12) 
#Model 22322.01s var:359/369 constraints:5083/6165
#Bound 22333.91s best:1204  next:[1039,1203] objective_lb_search_no_lp
#Bound 22342.22s best:1204  next:[1040,1203] objective_lb_search_no_lp
#Bound 22348.14s best:1204  next:[1042,1203] objective_lb_search_no_lp
#Bound 22363.76s best:1204  next:[1044,1203] objective_lb_search_no_lp
#Bound 22365.90s best:1204  next:[1046,1203] objective_lb_search_no_lp
#Bound 22391.56s best:1204  next:[1047,1203] objective_lb_search_no_lp
#Model 22417.20s var:358/369 constraints:5032/6165
#Bound 22427.00s best:1204  next:[1048,1203] objective_lb_search_no_lp
#Model 22428.95s var:357/369 constraints:4982/6165
#Model 22431.40s var:356/369 constraints:4942/6165
#Model 22453.24s var:355/369 constraints:4834/6165
#Bound 22456.40s best:1204  next:[1050,1203] objective_lb_search_no_lp
#Model 22457.20s var:352/369 constraints:4672/6165
#Model 22457.32s var:351/369 constraints:4487/6165
#Model 22458.04s var:349/369 constraints:4306/6165
#Model 22471.42s var:348/369 constraints:4261/6165
#Bound 22480.17s best:1204  next:[1051,1203] objective_lb_search_no_lp
#Bound 22489.18s best:1204  next:[1053,1203] objective_lb_search_max_lp
#Bound 22492.85s best:1204  next:[1058,1203] objective_lb_search_no_lp
#Model 22493.96s var:347/369 constraints:4197/6165
#Model 22494.49s var:346/369 constraints:4172/6165
#Bound 22494.95s best:1204  next:[1065,1203] objective_lb_search_no_lp
#Bound 22495.34s best:1204  next:[1076,1203] objective_lb_search_no_lp
#Bound 22496.98s best:1204  next:[1079,1203] objective_lb_search_no_lp
#Bound 22498.82s best:1204  next:[1087,1203] objective_lb_search_no_lp
#Model 22501.47s var:345/369 constraints:3910/6165
#Bound 22501.58s best:1204  next:[1088,1203] objective_lb_search_no_lp
#Bound 22504.59s best:1204  next:[1089,1203] objective_shaving_search_no_lp (vars=316 csts=3865)
#Model 22504.61s var:344/369 constraints:3865/6165
#Model 22506.92s var:342/369 constraints:3685/6165
#Model 22508.19s var:339/369 constraints:3436/6165
#Model 22508.40s var:335/369 constraints:3146/6165
#Bound 22508.58s best:1204  next:[1090,1203] objective_shaving_search_no_lp (vars=313 csts=3861)
#Model 22508.59s var:325/369 constraints:2352/6165
#Model 22508.77s var:323/369 constraints:2203/6165
#Bound 22508.78s best:1204  next:[1091,1203] objective_shaving_search_no_lp (vars=240 csts=2185)
#Done  22508.81s quick_restart_no_lp
#Model 22508.82s var:316/369 constraints:1730/6165

Task timing                                  n [     min,      max]      avg      dev     time         n [     min,      max]      avg      dev    dtime
                             'core':         1 [   6.25h,    6.25h]    6.25h   0.00ns    6.25h         1 [   7.77h,    7.77h]    7.77h   0.00ns    7.77h
                       'default_lp':         1 [   6.25h,    6.25h]    6.25h   0.00ns    6.25h         1 [   2.21h,    2.21h]    2.21h   0.00ns    2.21h
                 'feasibility_pump':      9627 [174.57ms, 650.88ms] 202.14ms  37.40ms   32.43m      9626 [ 37.60ms,  80.54ms]  39.03ms 839.95us    6.26m
                            'fixed':         1 [   6.25h,    6.25h]    6.25h   0.00ns    6.25h         1 [   2.36h,    2.36h]    2.36h   0.00ns    2.36h
                  'fj_long_default':         1 [439.75ms, 439.75ms] 439.75ms   0.00ns 439.75ms         1 [ 81.71ms,  81.71ms]  81.71ms   0.00ns  81.71ms
              'fj_long_lin_default':         1 [433.38ms, 433.38ms] 433.38ms   0.00ns 433.38ms         1 [111.63ms, 111.63ms] 111.63ms   0.00ns 111.63ms
                   'fj_long_random':         1 [519.65ms, 519.65ms] 519.65ms   0.00ns 519.65ms         1 [128.32ms, 128.32ms] 128.32ms   0.00ns 128.32ms
                 'fj_short_default':         1 [178.12ms, 178.12ms] 178.12ms   0.00ns 178.12ms         1 [106.29ms, 106.29ms] 106.29ms   0.00ns 106.29ms
             'fj_short_lin_default':         1 [452.47ms, 452.47ms] 452.47ms   0.00ns 452.47ms         1 [103.48ms, 103.48ms] 103.48ms   0.00ns 103.48ms
              'fj_short_lin_random':         1 [205.64ms, 205.64ms] 205.64ms   0.00ns 205.64ms         1 [103.66ms, 103.66ms] 103.66ms   0.00ns 103.66ms
                  'fj_short_random':         1 [172.13ms, 172.13ms] 172.13ms   0.00ns 172.13ms         1 [ 98.26ms,  98.26ms]  98.26ms   0.00ns  98.26ms
                        'fs_random':         1 [346.48ms, 346.48ms] 346.48ms   0.00ns 346.48ms         1 [906.09us, 906.09us] 906.09us   0.00ns 906.09us
                        'fs_random':         1 [364.56ms, 364.56ms] 364.56ms   0.00ns 364.56ms         1 [  2.57ms,   2.57ms]   2.57ms   0.00ns   2.57ms
                  'fs_random_no_lp':         1 [507.33ms, 507.33ms] 507.33ms   0.00ns 507.33ms         0 [  0.00ns,   0.00ns]   0.00ns   0.00ns   0.00ns
          'fs_random_quick_restart':         1 [346.42ms, 346.42ms] 346.42ms   0.00ns 346.42ms         1 [  6.36ms,   6.36ms]   6.36ms   0.00ns   6.36ms
          'fs_random_quick_restart':         1 [450.63ms, 450.63ms] 450.63ms   0.00ns 450.63ms         1 [ 20.00ns,  20.00ns]  20.00ns   0.00ns  20.00ns
    'fs_random_quick_restart_no_lp':         1 [360.37ms, 360.37ms] 360.37ms   0.00ns 360.37ms         1 [  1.36ms,   1.36ms]   1.36ms   0.00ns   1.36ms
                    'graph_arc_lns':      9627 [  7.77ms,   23.19s]    3.60s    4.26s    9.63h      9518 [ 10.00ns,    4.57s] 594.47ms 812.92ms    1.57h
                    'graph_cst_lns':      9626 [  4.10ms,   13.29s]    1.99s    1.86s    5.32h      9472 [ 10.00ns,    1.35s] 275.44ms 319.34ms   43.48m
                    'graph_dec_lns':      9626 [  8.15ms,   21.26s]    3.73s    4.38s    9.97h      9561 [ 10.00ns,    3.70s] 641.62ms 871.25ms    1.70h
                    'graph_var_lns':      9627 [  6.98ms,   23.60s]    3.85s    4.49s   10.30h      9514 [ 10.00ns,    6.05s] 650.04ms 871.87ms    1.72h
                   'lb_tree_search':         1 [   6.25h,    6.25h]    6.25h   0.00ns    6.25h         1 [   2.83h,    2.83h]    2.83h   0.00ns    2.83h
                           'max_lp':         1 [   6.25h,    6.25h]    6.25h   0.00ns    6.25h         1 [   1.80h,    1.80h]    1.80h   0.00ns    1.80h
                            'no_lp':         1 [   6.25h,    6.25h]    6.25h   0.00ns    6.25h         1 [   1.62h,    1.62h]    1.62h   0.00ns    1.62h
              'objective_lb_search':         1 [   6.25h,    6.25h]    6.25h   0.00ns    6.25h         1 [   1.62h,    1.62h]    1.62h   0.00ns    1.62h
       'objective_lb_search_max_lp':         1 [   6.25h,    6.25h]    6.25h   0.00ns    6.25h         1 [   2.32h,    2.32h]    2.32h   0.00ns    2.32h
        'objective_lb_search_no_lp':         1 [   6.25h,    6.25h]    6.25h   0.00ns    6.25h         1 [   1.15h,    1.15h]    1.15h   0.00ns    1.15h
  'objective_shaving_search_max_lp':       253 [ 34.27ms,   11.12m]    1.48m    2.31m    6.25h       240 [  1.89ms,    2.84m]   23.11s   35.20s    1.54h
   'objective_shaving_search_no_lp':       253 [ 16.30ms,   11.12m]    1.48m    2.31m    6.25h       241 [170.31us,    1.84m]   16.03s   24.49s    1.07h
                          'probing':         1 [   6.25h,    6.25h]    6.25h   0.00ns    6.25h         1 [   2.35h,    2.35h]    2.35h   0.00ns    2.35h
                   'probing_max_lp':         1 [   6.25h,    6.25h]    6.25h   0.00ns    6.25h         1 [   6.40h,    6.40h]    6.40h   0.00ns    6.40h
                     'pseudo_costs':         1 [   6.25h,    6.25h]    6.25h   0.00ns    6.25h         1 [   1.83h,    1.83h]    1.83h   0.00ns    1.83h
                    'quick_restart':         1 [   6.25h,    6.25h]    6.25h   0.00ns    6.25h         1 [   3.33h,    3.33h]    3.33h   0.00ns    3.33h
              'quick_restart_no_lp':         1 [   6.25h,    6.25h]    6.25h   0.00ns    6.25h         1 [   4.75h,    4.75h]    4.75h   0.00ns    4.75h
                    'reduced_costs':         1 [   6.25h,    6.25h]    6.25h   0.00ns    6.25h         1 [   3.52h,    3.52h]    3.52h   0.00ns    3.52h
                        'rins/rens':      9627 [114.58us,    2.37s] 455.84ms 325.09ms    1.22h      7591 [ 10.00ns, 114.78ms]  79.13ms  35.85ms   10.01m
                      'rnd_cst_lns':      9627 [  4.47ms,   19.60s]    3.40s    3.87s    9.09h      9541 [ 10.00ns,    3.15s] 548.43ms 731.06ms    1.45h
                      'rnd_var_lns':      9627 [  5.23ms,   16.68s]    3.02s    3.36s    8.07h      9572 [ 10.00ns,    2.75s] 500.18ms 651.28ms    1.33h
         'scheduling_intervals_lns':      9626 [  3.40ms,   20.79s]    4.86s    3.95s   13.00h      9604 [ 41.74us,    3.81s] 847.27ms 785.86ms    2.26h
       'scheduling_precedences_lns':      9626 [  3.49ms,   21.85s]    4.84s    3.93s   12.95h      9601 [ 41.70us,    3.79s] 845.93ms 785.55ms    2.26h
       'scheduling_time_window_lns':      9626 [  3.41ms,   20.71s]    4.85s    3.93s   12.96h      9602 [ 41.74us,    3.81s] 846.57ms 785.65ms    2.26h
                     'violation_ls':      9627 [  1.13ms, 499.58ms] 124.24ms  34.79ms   19.93m      9627 [ 31.94us, 590.43ms] 126.70ms  37.45ms   20.33m
                     'violation_ls':      9627 [437.31us, 531.29ms] 131.41ms  38.22ms   21.08m      9627 [750.00ns, 412.12ms] 132.73ms  38.52ms   21.30m

Search stats                         Bools   Conflicts     Branches   Restarts      BoolPropag   IntegerPropag
                           'core':  10'598   5'956'767    9'521'203    176'245  15'800'649'770   7'593'883'524
                     'default_lp':   5'969   6'701'323   19'839'604    666'523   9'095'972'222   5'901'350'947
                          'fixed':   2'317  37'494'264  179'665'283        226  21'340'917'129   8'025'523'347
                      'fs_random':     113           0          226        226              42           5'540
                      'fs_random':     113           0          232        226              42           5'727
                'fs_random_no_lp':     113           0            0          0               0               0
        'fs_random_quick_restart':     113           0            0          0               0               0
        'fs_random_quick_restart':     113           6          261        226              50           7'468
  'fs_random_quick_restart_no_lp':     156           0          374        227              50          10'515
                 'lb_tree_search':     141       2'182   21'168'426  4'195'732      48'940'518   1'629'561'709
                         'max_lp':     113   4'273'457   22'180'767  1'927'233     150'885'000   6'727'224'777
                          'no_lp':   2'345  14'207'863   29'777'543  1'432'842   9'421'298'381  14'270'127'095
            'objective_lb_search':     460   4'804'621   25'234'692  2'749'442     372'636'083   7'463'593'689
     'objective_lb_search_max_lp':     480   2'083'345   34'756'841  5'316'628     476'188'790   5'857'487'664
      'objective_lb_search_no_lp':     524  11'261'683   26'890'190  1'968'296     428'348'609  13'496'385'034
                        'probing':   1'429         874      816'720    302'567       5'140'548      27'184'440
                 'probing_max_lp':     653         394      317'536    118'662       1'342'130       9'819'682
                   'pseudo_costs':     113   6'337'869   28'826'042  3'811'829     158'512'775   7'517'410'804
                  'quick_restart':  17'286   2'063'623   31'864'432    642'313   8'915'483'296   2'224'084'473
            'quick_restart_no_lp':  16'580   5'990'286   31'951'246    772'093  18'696'435'260   4'306'545'462
                  'reduced_costs':  91'320   5'730'299   20'606'906    345'366  74'335'836'864   6'093'014'605

SAT stats                           ClassicMinim   LitRemoved   LitLearned  LitForgotten  Subsumed   MClauses  MDecisions  MLitTrue  MSubsumed  MLitRemoved  MReused
                           'core':     5'665'380   73'874'525   96'194'860    65'768'873    13'092     74'404     389'507         0      3'190       24'815    1'257
                     'default_lp':     6'160'565   64'084'734  127'795'183   104'899'739    21'796    339'552   3'960'096         3    194'887    1'615'869   38'557
                          'fixed':    37'424'017  159'521'127  737'971'560   737'710'915       275          0           0         0          0            0        0
                      'fs_random':             0            0            0             0         0          0           0         0          0            0        0
                      'fs_random':             0            0            0             0         0          0           0         0          0            0        0
                'fs_random_no_lp':             0            0            0             0         0          0           0         0          0            0        0
        'fs_random_quick_restart':             0            0            0             0         0          0           0         0          0            0        0
        'fs_random_quick_restart':             0            0           22             0         0          0           0         0          0            0        0
  'fs_random_quick_restart_no_lp':             0            0            0             0         0          0           0         0          0            0        0
                 'lb_tree_search':           744        1'743       19'250             0        28  2'029'708  10'414'391         0        254        1'290  166'441
                         'max_lp':     3'801'284   19'055'762   78'555'340    61'356'194    35'573    978'165  16'631'807         0     46'697      383'408  261'851
                          'no_lp':    13'121'462  116'887'643  298'864'744   269'358'837    48'111    673'916   8'940'605         1    146'472    1'108'206   80'371
            'objective_lb_search':     4'487'220   26'102'379   80'990'735    51'257'766    27'267  1'412'233  18'731'142         0     79'461      635'815  322'638
     'objective_lb_search_max_lp':     1'924'477   10'798'430   36'402'942    18'440'683    14'893  2'620'100  31'008'701         2     35'381      284'458  584'535
      'objective_lb_search_no_lp':    10'459'407   67'779'650  194'007'316   142'410'814    69'480  1'036'982  12'495'016         0    164'740    1'319'570  185'992
                        'probing':             2            9        1'097             0         0        273       1'359         0          1            3        4
                 'probing_max_lp':             0            0          488             0         0          0           0         0          0            0        0
                   'pseudo_costs':     5'728'740   27'597'844  126'095'301   102'080'443    37'172  1'888'872  20'166'483         0     14'037      127'007  353'966
                  'quick_restart':     1'824'685   17'484'597   40'164'543    28'819'436    10'457    250'903   4'089'435       185    178'723    2'169'045   33'373
            'quick_restart_no_lp':     5'491'764   75'232'601  142'553'739   111'296'941    10'296    100'775   1'550'440       112     80'378      929'457    8'769
                  'reduced_costs':     5'150'300   67'278'978  154'928'428   138'435'032    11'930    209'346   2'529'111         4    138'167    1'352'834   29'584

Lp stats                         Component   Iterations  AddedCuts     OPTIMAL    DUAL_F.  DUAL_U.
                  'default_lp':          1   63'168'809  1'194'381  13'821'014          1        1
                       'fixed':          1       58'504        852  71'071'497          0        0
                   'fs_random':          1          289        692           9          0        0
                   'fs_random':          1          420        830          15          1        0
     'fs_random_quick_restart':          1            0          0           0          0        0
     'fs_random_quick_restart':          1          530        881          46          0        0
              'lb_tree_search':          1  182'896'997    292'514  10'964'881  2'617'627        2
                      'max_lp':          1  110'669'675    457'228   7'663'117  5'514'003      909
         'objective_lb_search':          1   72'009'066    489'775  11'499'176          1        0
  'objective_lb_search_max_lp':          1  110'706'481    221'424   5'516'851  1'408'422      920
                     'probing':          1   43'781'521  4'449'417   1'822'470        232        0
              'probing_max_lp':          1   89'091'090    538'534     463'729    192'220        0
                'pseudo_costs':          1  104'559'787    516'954   8'146'497  6'241'655    3'981
               'quick_restart':          1   96'397'058  1'077'632   6'896'901        120       16
               'reduced_costs':          1   30'368'851    384'514   6'312'878  1'833'888      117

Lp dimension                                                                       Final dimension of first component
                  'default_lp':    867 rows, 366 columns, 3226 entries with magnitude in [1.697839e-05, 1.000000e+00]
                       'fixed':     206 rows, 366 columns, 721 entries with magnitude in [2.459629e-02, 1.000000e+00]
                   'fs_random':     255 rows, 366 columns, 848 entries with magnitude in [1.761658e-02, 1.000000e+00]
                   'fs_random':    412 rows, 366 columns, 1379 entries with magnitude in [8.269036e-03, 1.000000e+00]
     'fs_random_quick_restart':         0 rows, 366 columns, 0 entries with magnitude in [0.000000e+00, 0.000000e+00]
     'fs_random_quick_restart':    451 rows, 366 columns, 1468 entries with magnitude in [7.886739e-03, 1.000000e+00]
              'lb_tree_search':    994 rows, 369 columns, 3957 entries with magnitude in [3.145250e-05, 1.000000e+00]
                      'max_lp':    499 rows, 369 columns, 1869 entries with magnitude in [1.010847e-03, 1.000000e+00]
         'objective_lb_search':    508 rows, 366 columns, 1963 entries with magnitude in [6.976426e-04, 1.000000e+00]
  'objective_lb_search_max_lp':    745 rows, 369 columns, 2813 entries with magnitude in [3.865447e-04, 1.000000e+00]
                     'probing':    954 rows, 366 columns, 7150 entries with magnitude in [7.411431e-05, 1.000000e+00]
              'probing_max_lp':  1932 rows, 369 columns, 13329 entries with magnitude in [5.020573e-05, 1.000000e+00]
                'pseudo_costs':    830 rows, 369 columns, 3414 entries with magnitude in [1.080228e-03, 1.000000e+00]
               'quick_restart':   1173 rows, 366 columns, 5214 entries with magnitude in [9.006726e-05, 1.000000e+00]
               'reduced_costs':     303 rows, 369 columns, 952 entries with magnitude in [7.939718e-03, 1.000000e+00]

Lp debug                         CutPropag  CutEqPropag     Adjust  Overflow          Bad  BadScaling
                  'default_lp':         80        1'568  1'700'757         0    3'168'578           0
                       'fixed':          0            1          0         0        1'596           0
                   'fs_random':          0            0          0         0        1'320           0
                   'fs_random':          0            1          0         0        1'595           0
     'fs_random_quick_restart':          0            0          0         0            0           0
     'fs_random_quick_restart':          0            0          0         0        1'375           0
              'lb_tree_search':         80        1'443  8'462'158         0    4'066'928           0
                      'max_lp':         98        1'170  7'254'946         0    2'777'675           0
         'objective_lb_search':         41        1'565  1'380'139         0    3'302'072           0
  'objective_lb_search_max_lp':         96        1'087  4'768'873         0    2'961'816           0
                     'probing':        138       54'132    832'906         0  767'899'311           0
              'probing_max_lp':        178       26'075    640'330         0  230'668'228           0
                'pseudo_costs':         83        1'421  6'239'867         0    3'232'016           0
               'quick_restart':        249        1'838  1'524'420         0    7'071'914           0
               'reduced_costs':        100          835  4'441'457         0    2'189'811           0

Lp pool                          Constraints  Updates    Simplif  Merged  Shortened      Split  Strenghtened            Cuts/Call
                  'default_lp':        6'805   21'916    160'413   3'164     17'415    415'906       152'931  1'194'381/8'277'122
                       'fixed':        1'440       13          0       0          0          4           101            852/1'714
                   'fs_random':        1'280       12          0       0          0          4            53            692/1'172
                   'fs_random':        1'418       16          0       0          0          3            66            830/1'302
     'fs_random_quick_restart':        1'469       10          0       0          0          3            66            881/1'434
     'fs_random_quick_restart':          588        0          0       0          0          0             0                  0/0
              'lb_tree_search':       14'854   19'763    639'791     816     16'576    390'168       612'518    292'514/2'785'819
                      'max_lp':       13'903   17'005  1'053'220   1'481     16'605    438'536       749'245    457'228/2'969'545
         'objective_lb_search':        8'575   26'213     77'966   1'788     10'172    778'342        78'392    489'775/4'000'295
  'objective_lb_search_max_lp':       14'748   17'799  1'005'721     832     16'434    824'790       705'825    221'424/1'658'431
                     'probing':        9'909  595'632    104'208      96     21'666  1'367'562       597'535  4'449'417/8'865'510
              'probing_max_lp':       15'665  195'429    700'535      25     22'231    944'750       544'695    538'534/1'297'384
                'pseudo_costs':       13'698   16'701  1'201'105   2'412     14'521    491'165       747'417    516'954/2'395'431
               'quick_restart':        9'183   43'832    189'510   1'037     16'592  2'436'450       131'864  1'077'632/5'930'006
               'reduced_costs':       13'509   10'706    763'274   2'161     14'392    153'555       625'797    384'514/1'639'518

Lp Cut                                                      fs_ran  fs_ran  fs_ran   defaul  fixed   max_lp   quick_   reduce   pseudo  lb_tre   probin   object   probin  object
                                                    CG_FF:      69      56      71   37'172     68   17'875   17'060   23'748   35'698  12'867   65'933   23'336    2'393   7'151
                                                     CG_K:      47      39      50   24'143     49   19'924   13'297   23'410   35'382  15'212   40'565   19'060    1'502   8'701
                                                    CG_KL:       -       -       -        8      -        3        -        2        9       -       14        1        -       -
                                                     CG_R:      32      28      36   32'351     43   15'332   29'090   20'350   29'359  12'177  274'131   22'751   10'711   7'537
                                                    CG_RB:      82      55      65   82'483     71   31'542   56'902   37'890   55'044  21'772  526'437   48'395    7'235  12'105
                                                   CG_RBP:       9       5       9   12'085     13    9'805    9'210   10'170   11'299   5'686   74'960    7'109    1'987   2'330
                                                   Clique:       -       -       -        -      -    1'663        -    1'721    3'269   1'559        -        -      817   1'008
                                                       IB:     274     172     254  756'342    271  194'328  792'721  109'986  106'333  69'676  402'868  206'667   23'483  87'771
                                                 MIR_1_FF:      77      74      63   18'142     64   10'221   10'240   12'307   20'008   8'098  165'447   12'199   12'350   6'355
                                                  MIR_1_K:       7       9       7    4'062      6    4'142    1'751    3'619    5'848   3'483   20'104    2'798    2'631   2'410
                                                 MIR_1_KL:       -       -       -      679      -      657      177      337      233     226    3'311       15      318      13
                                                  MIR_1_R:      19      18      17    6'331     17    2'910    3'746    3'575    5'391   2'124   89'121    4'201    7'985   1'704
                                                 MIR_1_RB:      41      42      44   37'191     38   27'947   19'630   24'301   36'442  20'572  326'707   21'755   18'042  13'964
                                                MIR_1_RBP:       2       2       1    1'392      1    4'285      685    3'149    2'037   3'143   10'667      202    1'470     516
                                                MIR_1_RLT:       -       -       -        -      -      235        -      458      538     198        -        -    1'152     160
                                                 MIR_2_FF:      27      29      28   15'810     25    8'225    8'794    9'780   15'707   7'000  119'398    9'828   11'392   4'986
                                                  MIR_2_K:       8       7      11    3'873     10    2'698    1'799    2'665    3'881   2'593   19'865    2'167    2'703   1'475
                                                 MIR_2_KL:       -       -       -      645      -      680      242      335      256     242    4'204       98      258      67
                                                  MIR_2_R:       7       5       8    5'260     10    2'579    4'466    2'795    5'104   2'411  119'589    3'881   12'716   1'866
                                                 MIR_2_RB:      28      32      23   28'527     32   16'220   17'340   15'009   22'977  13'621  269'171   17'812   17'222   8'399
                                                MIR_2_RBP:       1       2       2    2'105      2    2'426    1'304    2'075    1'510   2'189   22'901      340    2'520     349
                                                 MIR_3_FF:      13      14      17   10'271     16    5'662    6'014    6'489   11'454   5'575   67'347    6'832    6'810   3'749
                                                  MIR_3_K:       4       4       6    2'745      5    2'229    1'588    2'012    3'163   2'085   15'877    1'626    1'680   1'231
                                                 MIR_3_KL:       -       -       -      398      1      502      232      238      167     269    5'626       90      197      88
                                                  MIR_3_R:       8       6       9    3'565      7    1'968    3'476    1'999    4'093   2'315   67'555    3'010    6'495   1'647
                                                 MIR_3_RB:      19      20      21   20'249     20   10'628   13'016    9'468   14'487   9'266  184'990   13'013   10'504   5'233
                                                MIR_3_RBP:       -       1       4    1'958      3    1'482    1'062    1'401    1'091   1'344   15'358      340    1'408     227
                                                 MIR_4_FF:       6       7       7    6'751      7    3'285    4'031    3'621    6'847   3'689   39'471    5'053    3'497   2'302
                                                  MIR_4_K:       3       4       3    2'323      5    1'576    1'291    1'621    2'395   1'541   13'247    1'535    1'081     862
                                                 MIR_4_KL:       -       -       -      288      -      433      267      147      180     324    5'745      114      200     133
                                                  MIR_4_R:       4       6       3    2'483      1    1'209    2'589    1'127    2'348   1'659   41'614    2'483    3'934   1'076
                                                 MIR_4_RB:      11      12      12   13'170      8    6'639    8'514    5'932    8'836   5'905  111'065    8'977    4'836   3'040
                                                MIR_4_RBP:       -       1       1    1'284      -      983      633      845      809     872   10'126      373      985     219
                                                 MIR_5_FF:       6       -       -    4'526      4    2'075    2'702    2'107    4'013   2'559   27'231    3'752    1'786   1'505
                                                  MIR_5_K:       1       -       -    1'558      -    1'042    1'014    1'002    1'532   1'174   10'640    1'153      770     643
                                                 MIR_5_KL:       -       -       -      209      -      291      241      153      181     294    5'957      115      135     126
                                                  MIR_5_R:       1       -       1    1'439      1      751    1'684      593    1'349   1'005   22'597    1'592    1'639     634
                                                 MIR_5_RB:       8       8       7    8'044      6    4'008    5'060    3'365    5'152   3'926   66'898    5'458    2'244   1'708
                                                MIR_5_RBP:       -       -       -      823      -      662      442      625      621     666    6'811      329      809     199
                                                 MIR_6_FF:       2       -       2    2'722      3    1'197    1'529    1'099    2'166   1'579   16'715    2'334      971     939
                                                  MIR_6_K:       1       1       -    1'077      1      801      560      739    1'156     886    6'576      675      463     439
                                                 MIR_6_KL:       -       -       -      127      -      144      141       51       90     183    3'999       54       77      78
                                                  MIR_6_R:       -       -       -      911      1      414      882      363      843     701   11'252      985      795     415
                                                 MIR_6_RB:       2       3       2    5'079      5    2'978    3'187    2'252    3'453   2'967   42'243    3'481    1'457   1'260
                                                MIR_6_RBP:       -       -       -      511      -      400      235      338      421     424    3'667      221      482     151
         NoOverlapCompletionTimeExhaustiveMirror_weighted:       -       -       -        -      -        4        -       19        9       1        -        -        -       -
  NoOverlapCompletionTimeExhaustiveMirror_weighted_lifted:       -       -       -        -      -        -        -        2        -       -        -        -        -       -
               NoOverlapCompletionTimeExhaustive_weighted:       -       -       -        -      -      774        -    1'941    3'239     336        -        -        5     237
        NoOverlapCompletionTimeExhaustive_weighted_lifted:       -       -       -        -      -        -        -        -       10       -        -        -        -       -
                          NoOverlapCompletionTimeQueyrane:       -       -       -        -      -       10        -       39      100       1        -        -        1       4
                   NoOverlapCompletionTimeQueyrane_lifted:       -       -       -        -      -        1        -        -        3       -        -        -        -       -
                              NoOverlapDetectedPrecedence:       -       -       -        -      -        2        -        -        1       -        -        -        -       -
                                NoOverlapDisjunctionOnEnd:       -       -       -        -      -       30        -      109       83      22        -        -        -       7
                              NoOverlapDisjunctionOnStart:       -       -       -        -      -      278        -      723    1'539     118        -        -        5      64
                                             ZERO_HALF_FF:      15       7       7    4'644      5    2'511    1'914    3'095    4'734   1'799   17'768    2'718      524   1'261
                                              ZERO_HALF_K:       3       2       1    1'585      1    2'599      671    2'505    3'538   2'292    4'408    1'091      384   1'501
                                             ZERO_HALF_KL:       -       -       -        5      -        -        -        1        1       2        7        1        -       -
                                              ZERO_HALF_R:      21      10      22   15'541     16   18'836   18'740   14'147   20'699  26'102  892'572   12'507  319'583  17'788
                                             ZERO_HALF_RB:      18       8      12    9'108     11    5'759    5'663    5'375    8'458   4'615  123'915    5'940   13'217   3'231
                                            ZERO_HALF_RBP:       5       3       4    2'386      5    1'368    1'800    1'289    1'368   1'169   52'747    1'308   12'673     560

LNS stats                        Improv/Calls  Closed  Difficulty  TimeLimit
               'graph_arc_lns':      127/9626     50%        0.99       3.46
               'graph_cst_lns':      218/9566     51%        0.99       1.34
               'graph_dec_lns':       64/9626     50%        0.99       3.67
               'graph_var_lns':      112/9627     50%        0.99       3.60
                   'rins/rens':     1074/8618     50%        0.86       0.11
                 'rnd_cst_lns':      114/9625     51%        0.99       3.14
                 'rnd_var_lns':       86/9626     51%        0.99       2.73
    'scheduling_intervals_lns':       84/9622     15%        0.00       3.98
  'scheduling_precedences_lns':       84/9622     15%        0.00       3.98
  'scheduling_time_window_lns':       84/9622     15%        0.00       3.98

LS stats                   Batches  Restarts    LinMoves    GenMoves  CompoundMoves  WeightUpdates
       'fj_long_default':        1         1       7'789           0              0            283
   'fj_long_lin_default':        1         1           0       1'914            323              1
        'fj_long_random':        1         1       9'790           0              0            210
      'fj_short_default':        1         1           0       1'893            334              0
  'fj_short_lin_default':        1         1           0       1'722            388              1
   'fj_short_lin_random':        1         1           0       1'991            346              1
       'fj_short_random':        1         1           0       1'976            467              0
          'violation_ls':    9'627         0  41'719'823  15'198'170        855'225      3'813'307
          'violation_ls':    9'627         0  51'536'249  11'997'156        596'256      4'733'678

Solutions (53)                      Num     Rank
  'fs_random_quick_restart_no_lp':    1    [1,1]
                  'graph_arc_lns':    1  [40,40]
                  'graph_dec_lns':    2   [3,42]
                  'graph_var_lns':    2  [41,53]
                          'no_lp':   19   [9,32]
                  'quick_restart':    1  [44,44]
            'quick_restart_no_lp':   10  [26,52]
                    'rnd_cst_lns':    1  [45,45]
       'scheduling_intervals_lns':    1  [30,30]
     'scheduling_precedences_lns':    1  [31,31]
     'scheduling_time_window_lns':    1  [43,43]
                   'violation_ls':   13   [2,51]

Objective bounds                     Num
                       'bool_core':    8
                  'initial_domain':    1
                  'lb_tree_search':   24
                           'no_lp':    1
      'objective_lb_search_max_lp':   14
       'objective_lb_search_no_lp':  223
  'objective_shaving_search_no_lp':    9
                    'pseudo_costs':    1
                   'reduced_costs':    3

Solution repositories      Added  Queried  Ignored  Synchro
  'feasible solutions':   93'169  218'987        1   91'490
        'lp solutions':  234'017    4'864        0  165'271
                'pump':  202'139    4'763

Improving bounds shared             Num
                        'core':      18
                  'default_lp':   2'028
              'lb_tree_search':      89
                      'max_lp':     159
                       'no_lp':     113
         'objective_lb_search':      41
  'objective_lb_search_max_lp':      97
                     'probing':   2'915
              'probing_max_lp':   1'052
                'pseudo_costs':     238
               'quick_restart':   2'275
         'quick_restart_no_lp':  10'353
               'reduced_costs':     928

Clauses shared                   Num
                        'core':    8
                  'default_lp':  288
     'fs_random_quick_restart':    2
              'lb_tree_search':   17
                      'max_lp':  109
                       'no_lp':   60
         'objective_lb_search':   37
  'objective_lb_search_max_lp':   29
   'objective_lb_search_no_lp':    6
                     'probing':    1
                'pseudo_costs':   85
               'quick_restart':   19
         'quick_restart_no_lp':   19
               'reduced_costs':    7

CpSolverResponse summary:
status: OPTIMAL
objective: 1204
best_bound: 1204
integers: 367
booleans: 113
conflicts: 6
branches: 261
propagations: 50
integer_propagations: 7468
restarts: 226
lp_iterations: 530
walltime: 22509.4
usertime: 22509.4
deterministic_time: 233018
gap_integral: 446037
solution_fingerprint: 0x5893eb12b63b5cb6


--- Simulation Gantt  partir du modle mathmatique ---
