created virtual environment CPython3.12.4.final.0-64 in 13579ms
  creator CPython3Posix(dest=/localscratch/aneumann.63390723.0/env, clear=False, no_vcs_ignore=False, global=False)
  seeder FromAppData(download=False, pip=bundle, via=copy, app_data_dir=/home/aneumann/.local/share/virtualenv)
    added seed packages: pip==25.1.1
  activators BashActivator,CShellActivator,FishActivator,NushellActivator,PowerShellActivator,PythonActivator
Looking in links: /cvmfs/soft.computecanada.ca/custom/python/wheelhouse/gentoo2023/x86-64-v3, /cvmfs/soft.computecanada.ca/custom/python/wheelhouse/gentoo2023/generic, /cvmfs/soft.computecanada.ca/custom/python/wheelhouse/generic
Requirement already satisfied: pip in /localscratch/aneumann.63390723.0/env/lib/python3.12/site-packages (25.1.1)
Looking in links: /cvmfs/soft.computecanada.ca/custom/python/wheelhouse/gentoo2023/x86-64-v3, /cvmfs/soft.computecanada.ca/custom/python/wheelhouse/gentoo2023/generic, /cvmfs/soft.computecanada.ca/custom/python/wheelhouse/generic
ERROR: protobuf-5.28.3-cp38-abi3-manylinux2014_x86_64.whl is not a supported wheel on this platform.
Looking in links: /cvmfs/soft.computecanada.ca/custom/python/wheelhouse/gentoo2023/x86-64-v3, /cvmfs/soft.computecanada.ca/custom/python/wheelhouse/gentoo2023/generic, /cvmfs/soft.computecanada.ca/custom/python/wheelhouse/generic
Processing /home/aneumann/projects/def-adhaj/aneumann/GNRS/wheels/immutabledict-4.2.0-py3-none-any.whl
Installing collected packages: immutabledict
Successfully installed immutabledict-4.2.0
Looking in links: /cvmfs/soft.computecanada.ca/custom/python/wheelhouse/gentoo2023/x86-64-v3, /cvmfs/soft.computecanada.ca/custom/python/wheelhouse/gentoo2023/generic, /cvmfs/soft.computecanada.ca/custom/python/wheelhouse/generic
Processing /cvmfs/soft.computecanada.ca/custom/python/wheelhouse/generic/ortools-9.10.4067+computecanada-cp312-cp312-linux_x86_64.whl (from -r /home/aneumann/projects/def-adhaj/aneumann/GNRS/requirements/or.txt (line 1))
Processing /cvmfs/soft.computecanada.ca/custom/python/wheelhouse/gentoo2023/x86-64-v3/matplotlib-3.10.0+computecanada-cp312-cp312-linux_x86_64.whl (from -r /home/aneumann/projects/def-adhaj/aneumann/GNRS/requirements/or.txt (line 2))
Processing /cvmfs/soft.computecanada.ca/custom/python/wheelhouse/gentoo2023/x86-64-v3/pandas-2.2.3+computecanada-cp312-cp312-linux_x86_64.whl (from -r /home/aneumann/projects/def-adhaj/aneumann/GNRS/requirements/or.txt (line 3))
Processing /cvmfs/soft.computecanada.ca/custom/python/wheelhouse/generic/absl_py-2.2.2+computecanada-py3-none-any.whl (from ortools<9.11,>=9.10->-r /home/aneumann/projects/def-adhaj/aneumann/GNRS/requirements/or.txt (line 1))
Processing /cvmfs/soft.computecanada.ca/custom/python/wheelhouse/gentoo2023/generic/numpy-2.2.2+computecanada-cp312-cp312-linux_x86_64.whl (from ortools<9.11,>=9.10->-r /home/aneumann/projects/def-adhaj/aneumann/GNRS/requirements/or.txt (line 1))
Processing /cvmfs/soft.computecanada.ca/custom/python/wheelhouse/gentoo2023/x86-64-v3/protobuf-6.30.2+computecanada-cp312-cp312-linux_x86_64.whl (from ortools<9.11,>=9.10->-r /home/aneumann/projects/def-adhaj/aneumann/GNRS/requirements/or.txt (line 1))
Requirement already satisfied: immutabledict>=3.0.0 in /localscratch/aneumann.63390723.0/env/lib/python3.12/site-packages (from ortools<9.11,>=9.10->-r /home/aneumann/projects/def-adhaj/aneumann/GNRS/requirements/or.txt (line 1)) (4.2.0)
Processing /cvmfs/soft.computecanada.ca/custom/python/wheelhouse/gentoo2023/generic/contourpy-1.3.1+computecanada-cp312-cp312-linux_x86_64.whl (from matplotlib->-r /home/aneumann/projects/def-adhaj/aneumann/GNRS/requirements/or.txt (line 2))
Processing /cvmfs/soft.computecanada.ca/custom/python/wheelhouse/generic/cycler-0.12.1+computecanada-py3-none-any.whl (from matplotlib->-r /home/aneumann/projects/def-adhaj/aneumann/GNRS/requirements/or.txt (line 2))
Processing /cvmfs/soft.computecanada.ca/custom/python/wheelhouse/generic/fonttools-4.58.2+computecanada-cp312-cp312-linux_x86_64.whl (from matplotlib->-r /home/aneumann/projects/def-adhaj/aneumann/GNRS/requirements/or.txt (line 2))
Processing /cvmfs/soft.computecanada.ca/custom/python/wheelhouse/gentoo2023/x86-64-v3/kiwisolver-1.4.8+computecanada-cp312-cp312-linux_x86_64.whl (from matplotlib->-r /home/aneumann/projects/def-adhaj/aneumann/GNRS/requirements/or.txt (line 2))
Processing /cvmfs/soft.computecanada.ca/custom/python/wheelhouse/generic/packaging-25.0+computecanada-py3-none-any.whl (from matplotlib->-r /home/aneumann/projects/def-adhaj/aneumann/GNRS/requirements/or.txt (line 2))
Processing /cvmfs/soft.computecanada.ca/custom/python/wheelhouse/gentoo2023/x86-64-v3/pillow-11.1.0+computecanada-cp312-cp312-linux_x86_64.whl (from matplotlib->-r /home/aneumann/projects/def-adhaj/aneumann/GNRS/requirements/or.txt (line 2))
Processing /cvmfs/soft.computecanada.ca/custom/python/wheelhouse/generic/pyparsing-3.2.1+computecanada-py3-none-any.whl (from matplotlib->-r /home/aneumann/projects/def-adhaj/aneumann/GNRS/requirements/or.txt (line 2))
Processing /cvmfs/soft.computecanada.ca/custom/python/wheelhouse/generic/python_dateutil-2.9.0.post0+computecanada-py2.py3-none-any.whl (from matplotlib->-r /home/aneumann/projects/def-adhaj/aneumann/GNRS/requirements/or.txt (line 2))
Processing /cvmfs/soft.computecanada.ca/custom/python/wheelhouse/generic/pytz-2025.2+computecanada-py2.py3-none-any.whl (from pandas->-r /home/aneumann/projects/def-adhaj/aneumann/GNRS/requirements/or.txt (line 3))
Processing /cvmfs/soft.computecanada.ca/custom/python/wheelhouse/generic/tzdata-2025.2+computecanada-py2.py3-none-any.whl (from pandas->-r /home/aneumann/projects/def-adhaj/aneumann/GNRS/requirements/or.txt (line 3))
Processing /cvmfs/soft.computecanada.ca/custom/python/wheelhouse/generic/six-1.17.0+computecanada-py2.py3-none-any.whl (from python-dateutil>=2.7->matplotlib->-r /home/aneumann/projects/def-adhaj/aneumann/GNRS/requirements/or.txt (line 2))
Installing collected packages: pytz, tzdata, six, pyparsing, protobuf, pillow, packaging, numpy, kiwisolver, fonttools, cycler, absl-py, python-dateutil, contourpy, pandas, matplotlib, ortools

Successfully installed absl-py-2.2.2+computecanada contourpy-1.3.1+computecanada cycler-0.12.1+computecanada fonttools-4.58.2+computecanada kiwisolver-1.4.8+computecanada matplotlib-3.10.0+computecanada numpy-2.2.2+computecanada ortools-9.10.4067+computecanada packaging-25.0+computecanada pandas-2.2.3+computecanada pillow-11.1.0+computecanada protobuf-6.30.2+computecanada pyparsing-3.2.1+computecanada python-dateutil-2.9.0.post0+computecanada pytz-2025.2+computecanada six-1.17.0+computecanada tzdata-2025.2+computecanada

Starting CP-SAT solver v9.10.4067
Parameters: max_time_in_seconds: 3600 max_memory_in_mb: 12000 log_search_progress: true enumerate_all_solutions: false absolute_gap_limit: 0 relative_gap_limit: 0
Setting number of workers to 48

Initial optimization model '': (model_fingerprint: 0x58c905f4d5bc3b9d)
#Variables: 133 (#ints: 5 in objective)
  - 84 Booleans in [0,1]
  - 49 in [0,384]
#kLinear1: 16
#kLinear2: 148
#kLinear3: 66
#kLinearN: 382 (#terms: 3'197)

Starting presolve at 0.00s
  1.59e-04s  0.00e+00d  [DetectDominanceRelations] 
  5.04e-03s  0.00e+00d  [PresolveToFixPoint] #num_loops=6 #num_dual_strengthening=3 
  1.36e-05s  0.00e+00d  [ExtractEncodingFromLinear] #potential_supersets=2 
[Symmetry] Graph for symmetry has 584 nodes and 1'741 arcs.
[Symmetry] Symmetry computation done. time: 0.000293765 dtime: 0.00017498
[SAT presolve] num removable Booleans: 0 / 29
[SAT presolve] num trivial clauses: 0
[SAT presolve] [0s] clauses:4 literals:11 vars:9 one_side_vars:9 simple_definition:0 singleton_clauses:0
[SAT presolve] [3.7542e-05s] clauses:4 literals:11 vars:9 one_side_vars:9 simple_definition:0 singleton_clauses:0
[SAT presolve] [4.8358e-05s] clauses:4 literals:11 vars:9 one_side_vars:9 simple_definition:0 singleton_clauses:0
  1.30e-03s  1.08e-04d  [Probe] #probed=122 #fixed_bools=2 #new_bounds=13 #new_binary_clauses=1 
  1.68e-05s  0.00e+00d  [MaxClique] 
  1.98e-04s  0.00e+00d  [DetectDominanceRelations] 
  1.99e-03s  0.00e+00d  [PresolveToFixPoint] #num_loops=4 #num_dual_strengthening=3 
  3.88e-04s  0.00e+00d  [ProcessAtMostOneAndLinear] 
  3.58e-04s  0.00e+00d  [DetectDuplicateConstraints] #duplicates=88 #without_enforcements=12 
  1.28e-04s  3.12e-06d  [DetectDominatedLinearConstraints] #relevant_constraints=173 #num_inclusions=49 #num_redundant=4 
  1.20e-04s  0.00e+00d  [DetectDifferentVariables] #different=17 #cliques=1 #size=4 
  4.79e-05s  8.93e-07d  [ProcessSetPPC] #relevant_constraints=76 
  7.97e-06s  0.00e+00d  [FindAlmostIdenticalLinearConstraints] 
  3.39e-05s  1.45e-05d  [FindBigAtMostOneAndLinearOverlap] 
  2.19e-04s  6.23e-05d  [FindBigVerticalLinearOverlap] #blocks=1 #saved_nz=33 
  2.11e-05s  2.64e-06d  [FindBigHorizontalLinearOverlap] #linears=70 
  1.53e-05s  4.50e-08d  [MergeClauses] 
  1.38e-04s  0.00e+00d  [DetectDominanceRelations] 
  1.36e-03s  0.00e+00d  [PresolveToFixPoint] #num_loops=2 #num_dual_strengthening=1 
  1.34e-04s  0.00e+00d  [DetectDominanceRelations] 
  1.06e-03s  0.00e+00d  [PresolveToFixPoint] #num_loops=1 #num_dual_strengthening=1 
[Symmetry] Graph for symmetry has 497 nodes and 1'461 arcs.
[Symmetry] Symmetry computation done. time: 0.000122105 dtime: 0.00012143
[SAT presolve] num removable Booleans: 0 / 27
[SAT presolve] num trivial clauses: 0
[SAT presolve] [0s] clauses:4 literals:11 vars:9 one_side_vars:9 simple_definition:0 singleton_clauses:0
[SAT presolve] [2.8471e-05s] clauses:4 literals:11 vars:9 one_side_vars:9 simple_definition:0 singleton_clauses:0
[SAT presolve] [3.9391e-05s] clauses:4 literals:11 vars:9 one_side_vars:9 simple_definition:0 singleton_clauses:0
  1.23e-03s  1.00e-04d  [Probe] #probed=118 #new_bounds=8 #new_binary_clauses=2 
  1.51e-05s  0.00e+00d  [MaxClique] 
  1.38e-04s  0.00e+00d  [DetectDominanceRelations] 
  1.70e-03s  0.00e+00d  [PresolveToFixPoint] #num_loops=4 #num_dual_strengthening=3 
  3.50e-04s  0.00e+00d  [ProcessAtMostOneAndLinear] 
  2.69e-04s  0.00e+00d  [DetectDuplicateConstraints] #without_enforcements=12 
  1.08e-04s  2.84e-06d  [DetectDominatedLinearConstraints] #relevant_constraints=170 #num_inclusions=37 
  3.54e-05s  0.00e+00d  [DetectDifferentVariables] 
  4.59e-05s  8.13e-07d  [ProcessSetPPC] #relevant_constraints=74 
  8.60e-06s  0.00e+00d  [FindAlmostIdenticalLinearConstraints] 
  2.89e-05s  1.37e-05d  [FindBigAtMostOneAndLinearOverlap] 
  1.74e-04s  5.85e-05d  [FindBigVerticalLinearOverlap] 
  1.96e-05s  2.64e-06d  [FindBigHorizontalLinearOverlap] #linears=70 
  1.21e-05s  4.50e-08d  [MergeClauses] 
  1.38e-04s  0.00e+00d  [DetectDominanceRelations] 
  1.08e-03s  0.00e+00d  [PresolveToFixPoint] #num_loops=1 #num_dual_strengthening=1 
  1.32e-04s  0.00e+00d  [DetectDominanceRelations] 
  1.05e-03s  0.00e+00d  [PresolveToFixPoint] #num_loops=1 #num_dual_strengthening=1 
[Symmetry] Graph for symmetry has 497 nodes and 1'461 arcs.
[Symmetry] Symmetry computation done. time: 0.000118974 dtime: 0.00012134
[SAT presolve] num removable Booleans: 0 / 27
[SAT presolve] num trivial clauses: 0
[SAT presolve] [0s] clauses:4 literals:11 vars:9 one_side_vars:9 simple_definition:0 singleton_clauses:0
[SAT presolve] [2.9484e-05s] clauses:4 literals:11 vars:9 one_side_vars:9 simple_definition:0 singleton_clauses:0
[SAT presolve] [4.0135e-05s] clauses:4 literals:11 vars:9 one_side_vars:9 simple_definition:0 singleton_clauses:0
  1.18e-03s  9.84e-05d  [Probe] #probed=118 #new_binary_clauses=2 
  1.41e-05s  0.00e+00d  [MaxClique] 
  1.37e-04s  0.00e+00d  [DetectDominanceRelations] 
  1.09e-03s  0.00e+00d  [PresolveToFixPoint] #num_loops=1 #num_dual_strengthening=1 
  3.53e-04s  0.00e+00d  [ProcessAtMostOneAndLinear] 
  2.68e-04s  0.00e+00d  [DetectDuplicateConstraints] #without_enforcements=12 
  1.06e-04s  2.84e-06d  [DetectDominatedLinearConstraints] #relevant_constraints=170 #num_inclusions=37 
  3.55e-05s  0.00e+00d  [DetectDifferentVariables] 
  4.54e-05s  8.13e-07d  [ProcessSetPPC] #relevant_constraints=74 
  8.16e-06s  0.00e+00d  [FindAlmostIdenticalLinearConstraints] 
  2.98e-05s  1.37e-05d  [FindBigAtMostOneAndLinearOverlap] 
  1.73e-04s  5.85e-05d  [FindBigVerticalLinearOverlap] 
  2.01e-05s  2.64e-06d  [FindBigHorizontalLinearOverlap] #linears=70 
  1.47e-05s  4.50e-08d  [MergeClauses] 
  1.37e-04s  0.00e+00d  [DetectDominanceRelations] 
  1.07e-03s  0.00e+00d  [PresolveToFixPoint] #num_loops=1 #num_dual_strengthening=1 
  2.09e-05s  0.00e+00d  [ExpandObjective] #entries=16 #tight_variables=8 #tight_constraints=3 

Presolve summary:
  - 20 affine relations were detected.
  - rule 'TODO dual: only one blocking constraint?' was applied 387 times.
  - rule 'TODO dual: only one unspecified blocking constraint?' was applied 75 times.
  - rule 'TODO duplicate: identical constraint with different enforcements' was applied 36 times.
  - rule 'TODO linear2: contains a Boolean.' was applied 8 times.
  - rule 'affine: new relation' was applied 20 times.
  - rule 'bool_or: implications' was applied 1 time.
  - rule 'deductions: 56 stored' was applied 1 time.
  - rule 'dual: fix variable' was applied 7 times.
  - rule 'dual: reduced domain' was applied 22 times.
  - rule 'duplicate: merged rhs of linear constraint' was applied 14 times.
  - rule 'duplicate: removed constraint' was applied 88 times.
  - rule 'enforcement: false literal' was applied 9 times.
  - rule 'enforcement: literal not used' was applied 1 time.
  - rule 'enforcement: true literal' was applied 8 times.
  - rule 'incompatible linear: add implication' was applied 15 times.
  - rule 'linear inclusion: redundant containing constraint' was applied 4 times.
  - rule 'linear matrix: common vertical rectangle' was applied 1 time.
  - rule 'linear1: always true' was applied 1 time.
  - rule 'linear2: contains a Boolean.' was applied 6 times.
  - rule 'linear: always true' was applied 223 times.
  - rule 'linear: doubleton free' was applied 4 times.
  - rule 'linear: empty' was applied 16 times.
  - rule 'linear: extracted enforcement literal' was applied 457 times.
  - rule 'linear: fixed or dup variables' was applied 376 times.
  - rule 'linear: negative clause' was applied 3 times.
  - rule 'linear: positive clause' was applied 1 time.
  - rule 'linear: positive equal one' was applied 2 times.
  - rule 'linear: reduced variable domains' was applied 58 times.
  - rule 'linear: remapped using affine relations' was applied 340 times.
  - rule 'linear: simplified rhs' was applied 1'008 times.
  - rule 'linear: variable substitution 1' was applied 4 times.
  - rule 'no_overlap: inferred from x != y constraints' was applied 1 time.
  - rule 'presolve: 45 unused variables removed.' was applied 1 time.
  - rule 'presolve: iteration' was applied 3 times.

Presolved optimization model '': (model_fingerprint: 0x538d7624c702ae63)
#Variables: 65 (#ints: 5 in objective)
  - 27 Booleans in [0,1]
  - 3 in [0,272]
  - 4 in [0,278]
  - 4 in [0,286]
  - 1 in [0,292]
  - 1 in [0,339]
  - 1 in [0,342]
  - 1 in [0,342][384,726]
  - 1 in [2,280]
  - 1 in [3,275]
  - 1 in [6,278]
  - 1 in [7,327]
  - 1 in [10,330]
  - 1 in [13,333]
  - 1 in [53,325]
  - 2 in [53,373]
  - 1 in [59,379]
  - 1 in [60,338]
  - 2 in [81,373]
  - 1 in [87,379]
  - 3 in [95,373]
  - 3 in [101,373]
  - 1 in [101,379]
  - 1 in [107,379]
  - 1 in [122,384]
#kBoolAnd: 1 (#enforced: 1) (#literals: 2)
#kBoolOr: 3 (#literals: 9)
#kExactlyOne: 2 (#literals: 6)
#kInterval: 4
#kLinear1: 7 (#enforced: 7 #multi: 3)
#kLinear2: 90 (#enforced: 64 #multi: 44)
#kLinear3: 61 (#enforced: 49 #multi: 29)
#kLinearN: 83 (#enforced: 47) (#terms: 579)
#kNoOverlap: 1 (#intervals: 4)

Preloading model.
#Bound   0.03s best:inf   next:[137,1561] initial_domain
[Symmetry] Graph for symmetry has 428 nodes and 1'461 arcs.
[Symmetry] Symmetry computation done. time: 0.000114947 dtime: 0.0001172
#Model   0.03s var:65/65 constraints:252/252

Starting search at 0.03s with 48 workers.
17 full problem subsolvers: [core, default_lp, fixed, lb_tree_search, max_lp, no_lp, objective_lb_search, objective_lb_search_max_lp, objective_lb_search_no_lp, objective_shaving_search_max_lp, objective_shaving_search_no_lp, probing, probing_max_lp, pseudo_costs, quick_restart, quick_restart_no_lp, reduced_costs]
29 first solution subsolvers: [fj_long_default(2), fj_long_lin_default, fj_long_lin_perturb, fj_long_lin_random, fj_long_perturb, fj_long_random, fj_short_default(2), fj_short_lin_default(2), fj_short_lin_perturb, fj_short_lin_random, fj_short_perturb, fj_short_random, fs_random(4), fs_random_no_lp(3), fs_random_quick_restart(4), fs_random_quick_restart_no_lp(3)]
15 incomplete subsolvers: [feasibility_pump, graph_arc_lns, graph_cst_lns, graph_dec_lns, graph_var_lns, rins/rens, rnd_cst_lns, rnd_var_lns, scheduling_intervals_lns, scheduling_precedences_lns, scheduling_time_window_lns, violation_ls(4)]
3 helper subsolvers: [neighborhood_helper, synchronization_agent, update_gap_integral]
#1       0.03s best:961   next:[137,960]  no_lp (fixed_bools=0/52)
#Bound   0.03s best:961   next:[138,960]  bool_core (num_cores=1 [size:2 mw:1 d:1] a=4 d=1 fixed=0/38 clauses=8)
#Bound   0.03s best:961   next:[139,960]  bool_core (num_cores=1 [cover] a=4 d=1 fixed=0/41 clauses=9)
#Bound   0.03s best:961   next:[140,960]  bool_core (num_cores=1 [cover] a=4 d=1 fixed=1/44 clauses=11)
#Bound   0.03s best:961   next:[141,960]  bool_core (num_cores=1 [cover] a=4 d=1 fixed=2/47 clauses=14)
#Bound   0.03s best:961   next:[142,960]  bool_core (num_cores=1 [cover] a=4 d=1 fixed=3/50 clauses=18)
#Bound   0.03s best:961   next:[143,960]  bool_core (num_cores=1 [cover] a=4 d=1 fixed=4/53 clauses=23)
#Bound   0.03s best:961   next:[144,960]  bool_core (num_cores=1 [cover] a=4 d=1 fixed=5/56 clauses=29)
#Bound   0.03s best:961   next:[145,960]  bool_core (num_cores=1 [cover] a=4 d=1 fixed=6/59 clauses=36)
#Bound   0.03s best:961   next:[146,960]  bool_core (num_cores=1 [cover] a=4 d=1 fixed=7/62 clauses=44)
#Bound   0.03s best:961   next:[147,960]  bool_core (num_cores=1 [cover] a=4 d=1 fixed=8/65 clauses=53)
#Bound   0.03s best:961   next:[148,960]  bool_core (num_cores=1 [cover] a=4 d=1 fixed=9/68 clauses=63)
#Bound   0.03s best:961   next:[149,960]  bool_core (num_cores=1 [cover] a=4 d=1 fixed=10/71 clauses=74)
#Bound   0.03s best:961   next:[150,960]  bool_core (num_cores=1 [cover] a=4 d=1 fixed=11/74 clauses=86)
#Bound   0.03s best:961   next:[151,960]  bool_core (num_cores=1 [cover] a=4 d=1 fixed=12/77 clauses=99)
#Bound   0.03s best:961   next:[152,960]  bool_core (num_cores=1 [cover] a=4 d=1 fixed=13/80 clauses=113)
#Bound   0.03s best:961   next:[156,960]  objective_lb_search_no_lp
#2       0.03s best:741   next:[156,740]  no_lp (fixed_bools=0/61)
#Bound   0.03s best:741   next:[201,740]  objective_lb_search
#3       0.03s best:576   next:[201,575]  no_lp (fixed_bools=0/73)
#Bound   0.04s best:576   next:[263,575]  objective_lb_search_no_lp
#4       0.04s best:575   next:[263,574]  violation_ls(batch:1 #solutions_imported:1 #lin_moves:4 #lin_evals:20 #weight_updates:3)
#5       0.04s best:574   next:[263,573]  violation_ls(batch:1 #solutions_imported:1 #lin_moves:0 #lin_evals:8 #gen_moves:11 #gen_evals:4 #comp_moves:3 #backtracks:4 #weight_updates:0)
#Bound   0.04s best:574   next:[269,573]  objective_lb_search_no_lp
#6       0.04s best:566   next:[269,565]  graph_arc_lns (d=0.50 s=28 t=0.10 p=0.00 stall=0 h=auto_l0)
#Bound   0.04s best:566   next:[356,565]  objective_lb_search_no_lp
#7       0.04s best:557   next:[356,556]  no_lp (fixed_bools=0/87)
#8       0.06s best:541   next:[358,540]  quick_restart_no_lp (fixed_bools=4/109)
#9       0.06s best:540   next:[358,539]  quick_restart_no_lp (fixed_bools=4/120)
#10      0.06s best:510   next:[364,509]  scheduling_precedences_lns (d=0.50 s=33 t=0.10 p=0.00 stall=0 h=auto_l0)
#11      0.06s best:482   next:[364,481]  no_lp (fixed_bools=2/105)
#Model   0.07s var:64/65 constraints:232/252
#12      0.07s best:477   next:[418,476]  no_lp (fixed_bools=7/119)
#Model   0.07s var:63/65 constraints:221/252
#Model   0.08s var:62/65 constraints:217/252
#Model   0.09s var:60/65 constraints:197/252
#Model   0.09s var:58/65 constraints:155/252
#Done    0.09s no_lp
#Model   0.09s var:56/65 constraints:143/252
#Bound   0.08s best:477   next:[450,476]  objective_lb_search_no_lp [skipped_logs=9]

Task timing                                  n [     min,      max]      avg      dev     time         n [     min,      max]      avg      dev    dtime
                             'core':         1 [ 57.70ms,  57.70ms]  57.70ms   0.00ns  57.70ms         1 [  3.23ms,   3.23ms]   3.23ms   0.00ns   3.23ms
                       'default_lp':         1 [ 57.59ms,  57.59ms]  57.59ms   0.00ns  57.59ms         1 [759.11us, 759.11us] 759.11us   0.00ns 759.11us
                 'feasibility_pump':         6 [674.40us,   9.09ms]   3.36ms   2.68ms  20.18ms         5 [354.70us, 503.98us] 388.25us  58.00us   1.94ms
                            'fixed':         1 [ 58.15ms,  58.15ms]  58.15ms   0.00ns  58.15ms         1 [407.20us, 407.20us] 407.20us   0.00ns 407.20us
                  'fj_long_default':         0 [  0.00ns,   0.00ns]   0.00ns   0.00ns   0.00ns         0 [  0.00ns,   0.00ns]   0.00ns   0.00ns   0.00ns
                  'fj_long_default':         0 [  0.00ns,   0.00ns]   0.00ns   0.00ns   0.00ns         0 [  0.00ns,   0.00ns]   0.00ns   0.00ns   0.00ns
              'fj_long_lin_default':         0 [  0.00ns,   0.00ns]   0.00ns   0.00ns   0.00ns         0 [  0.00ns,   0.00ns]   0.00ns   0.00ns   0.00ns
              'fj_long_lin_perturb':         0 [  0.00ns,   0.00ns]   0.00ns   0.00ns   0.00ns         0 [  0.00ns,   0.00ns]   0.00ns   0.00ns   0.00ns
               'fj_long_lin_random':         0 [  0.00ns,   0.00ns]   0.00ns   0.00ns   0.00ns         0 [  0.00ns,   0.00ns]   0.00ns   0.00ns   0.00ns
                  'fj_long_perturb':         0 [  0.00ns,   0.00ns]   0.00ns   0.00ns   0.00ns         0 [  0.00ns,   0.00ns]   0.00ns   0.00ns   0.00ns
                   'fj_long_random':         0 [  0.00ns,   0.00ns]   0.00ns   0.00ns   0.00ns         0 [  0.00ns,   0.00ns]   0.00ns   0.00ns   0.00ns
                 'fj_short_default':         0 [  0.00ns,   0.00ns]   0.00ns   0.00ns   0.00ns         0 [  0.00ns,   0.00ns]   0.00ns   0.00ns   0.00ns
                 'fj_short_default':         0 [  0.00ns,   0.00ns]   0.00ns   0.00ns   0.00ns         0 [  0.00ns,   0.00ns]   0.00ns   0.00ns   0.00ns
             'fj_short_lin_default':         0 [  0.00ns,   0.00ns]   0.00ns   0.00ns   0.00ns         0 [  0.00ns,   0.00ns]   0.00ns   0.00ns   0.00ns
             'fj_short_lin_default':         0 [  0.00ns,   0.00ns]   0.00ns   0.00ns   0.00ns         0 [  0.00ns,   0.00ns]   0.00ns   0.00ns   0.00ns
             'fj_short_lin_perturb':         0 [  0.00ns,   0.00ns]   0.00ns   0.00ns   0.00ns         0 [  0.00ns,   0.00ns]   0.00ns   0.00ns   0.00ns
              'fj_short_lin_random':         0 [  0.00ns,   0.00ns]   0.00ns   0.00ns   0.00ns         0 [  0.00ns,   0.00ns]   0.00ns   0.00ns   0.00ns
                 'fj_short_perturb':         0 [  0.00ns,   0.00ns]   0.00ns   0.00ns   0.00ns         0 [  0.00ns,   0.00ns]   0.00ns   0.00ns   0.00ns
                  'fj_short_random':         0 [  0.00ns,   0.00ns]   0.00ns   0.00ns   0.00ns         0 [  0.00ns,   0.00ns]   0.00ns   0.00ns   0.00ns
                        'fs_random':         0 [  0.00ns,   0.00ns]   0.00ns   0.00ns   0.00ns         0 [  0.00ns,   0.00ns]   0.00ns   0.00ns   0.00ns
                        'fs_random':         0 [  0.00ns,   0.00ns]   0.00ns   0.00ns   0.00ns         0 [  0.00ns,   0.00ns]   0.00ns   0.00ns   0.00ns
                        'fs_random':         0 [  0.00ns,   0.00ns]   0.00ns   0.00ns   0.00ns         0 [  0.00ns,   0.00ns]   0.00ns   0.00ns   0.00ns
                        'fs_random':         1 [  3.80ms,   3.80ms]   3.80ms   0.00ns   3.80ms         1 [ 20.00ns,  20.00ns]  20.00ns   0.00ns  20.00ns
                  'fs_random_no_lp':         0 [  0.00ns,   0.00ns]   0.00ns   0.00ns   0.00ns         0 [  0.00ns,   0.00ns]   0.00ns   0.00ns   0.00ns
                  'fs_random_no_lp':         0 [  0.00ns,   0.00ns]   0.00ns   0.00ns   0.00ns         0 [  0.00ns,   0.00ns]   0.00ns   0.00ns   0.00ns
                  'fs_random_no_lp':         1 [  3.59ms,   3.59ms]   3.59ms   0.00ns   3.59ms         0 [  0.00ns,   0.00ns]   0.00ns   0.00ns   0.00ns
          'fs_random_quick_restart':         0 [  0.00ns,   0.00ns]   0.00ns   0.00ns   0.00ns         0 [  0.00ns,   0.00ns]   0.00ns   0.00ns   0.00ns
          'fs_random_quick_restart':         0 [  0.00ns,   0.00ns]   0.00ns   0.00ns   0.00ns         0 [  0.00ns,   0.00ns]   0.00ns   0.00ns   0.00ns
          'fs_random_quick_restart':         0 [  0.00ns,   0.00ns]   0.00ns   0.00ns   0.00ns         0 [  0.00ns,   0.00ns]   0.00ns   0.00ns   0.00ns
          'fs_random_quick_restart':         1 [  3.64ms,   3.64ms]   3.64ms   0.00ns   3.64ms         1 [ 20.00ns,  20.00ns]  20.00ns   0.00ns  20.00ns
    'fs_random_quick_restart_no_lp':         0 [  0.00ns,   0.00ns]   0.00ns   0.00ns   0.00ns         0 [  0.00ns,   0.00ns]   0.00ns   0.00ns   0.00ns
    'fs_random_quick_restart_no_lp':         0 [  0.00ns,   0.00ns]   0.00ns   0.00ns   0.00ns         0 [  0.00ns,   0.00ns]   0.00ns   0.00ns   0.00ns
    'fs_random_quick_restart_no_lp':         0 [  0.00ns,   0.00ns]   0.00ns   0.00ns   0.00ns         0 [  0.00ns,   0.00ns]   0.00ns   0.00ns   0.00ns
                    'graph_arc_lns':         6 [  1.86ms,  31.16ms]  11.89ms   9.52ms  71.36ms         4 [ 20.30us, 586.19us] 253.46us 210.95us   1.01ms
                    'graph_cst_lns':         6 [323.14us,   6.22ms]   1.37ms   2.17ms   8.21ms         0 [  0.00ns,   0.00ns]   0.00ns   0.00ns   0.00ns
                    'graph_dec_lns':         6 [  1.35ms,  13.46ms]   6.49ms   4.76ms  38.95ms         4 [ 10.00ns, 258.93us]  78.88us 106.48us 315.52us
                    'graph_var_lns':         6 [  3.53ms,  16.60ms]   9.47ms   5.14ms  56.85ms         4 [ 22.97us, 125.88us]  67.71us  37.54us 270.85us
                   'lb_tree_search':         1 [ 56.76ms,  56.76ms]  56.76ms   0.00ns  56.76ms         1 [ 21.60us,  21.60us]  21.60us   0.00ns  21.60us
                           'max_lp':         1 [ 57.39ms,  57.39ms]  57.39ms   0.00ns  57.39ms         1 [ 21.64us,  21.64us]  21.64us   0.00ns  21.64us
                            'no_lp':         1 [ 56.94ms,  56.94ms]  56.94ms   0.00ns  56.94ms         1 [  6.39ms,   6.39ms]   6.39ms   0.00ns   6.39ms
              'objective_lb_search':         1 [ 56.55ms,  56.55ms]  56.55ms   0.00ns  56.55ms         1 [695.88us, 695.88us] 695.88us   0.00ns 695.88us
       'objective_lb_search_max_lp':         1 [ 55.57ms,  55.57ms]  55.57ms   0.00ns  55.57ms         1 [686.52us, 686.52us] 686.52us   0.00ns 686.52us
        'objective_lb_search_no_lp':         1 [ 55.46ms,  55.46ms]  55.46ms   0.00ns  55.46ms         1 [  6.19ms,   6.19ms]   6.19ms   0.00ns   6.19ms
  'objective_shaving_search_max_lp':         4 [  1.45ms,  21.36ms]  11.03ms   8.34ms  44.11ms         0 [  0.00ns,   0.00ns]   0.00ns   0.00ns   0.00ns
   'objective_shaving_search_no_lp':         7 [  1.09ms,  16.00ms]   6.22ms   4.73ms  43.51ms         4 [ 11.57us, 178.12us]  97.65us  68.82us 390.60us
                          'probing':         1 [ 56.81ms,  56.81ms]  56.81ms   0.00ns  56.81ms         1 [565.95us, 565.95us] 565.95us   0.00ns 565.95us
                   'probing_max_lp':         1 [ 56.01ms,  56.01ms]  56.01ms   0.00ns  56.01ms         1 [ 21.58us,  21.58us]  21.58us   0.00ns  21.58us
                     'pseudo_costs':         1 [ 56.90ms,  56.90ms]  56.90ms   0.00ns  56.90ms         1 [944.90us, 944.90us] 944.90us   0.00ns 944.90us
                    'quick_restart':         1 [ 57.27ms,  57.27ms]  57.27ms   0.00ns  57.27ms         1 [600.81us, 600.81us] 600.81us   0.00ns 600.81us
              'quick_restart_no_lp':         1 [ 56.94ms,  56.94ms]  56.94ms   0.00ns  56.94ms         1 [  6.67ms,   6.67ms]   6.67ms   0.00ns   6.67ms
                    'reduced_costs':         1 [ 57.18ms,  57.18ms]  57.18ms   0.00ns  57.18ms         1 [451.72us, 451.72us] 451.72us   0.00ns 451.72us
                        'rins/rens':         6 [ 78.29us,  27.56ms]  10.28ms  10.62ms  61.65ms         4 [ 10.00ns, 309.36us]  78.14us 133.50us 312.56us
                      'rnd_cst_lns':         6 [  1.42ms,  31.15ms]  13.67ms   9.50ms  82.05ms         5 [ 10.00ns, 196.02us]  90.96us  78.20us 454.80us
                      'rnd_var_lns':         6 [609.34us,  26.27ms]  10.53ms  10.64ms  63.19ms         5 [ 10.00ns,  23.57us]   9.71us   9.07us  48.56us
         'scheduling_intervals_lns':         6 [  6.65ms,  48.30ms]  28.54ms  14.33ms 171.23ms         1 [  9.06ms,   9.06ms]   9.06ms   0.00ns   9.06ms
       'scheduling_precedences_lns':         6 [  1.74ms,  40.38ms]  22.50ms  11.95ms 135.02ms         2 [741.21us,   1.60ms]   1.17ms 430.89us   2.34ms
       'scheduling_time_window_lns':         6 [  2.87ms,  40.42ms]  19.62ms  11.71ms 117.74ms         4 [315.47us,   1.69ms] 987.64us 594.08us   3.95ms
                     'violation_ls':         2 [329.16us,  46.30ms]  23.32ms  22.99ms  46.63ms         2 [ 45.27us,  24.13ms]  12.09ms  12.04ms  24.17ms
                     'violation_ls':         2 [417.55us,  46.05ms]  23.23ms  22.82ms  46.47ms         2 [ 42.06us,  23.87ms]  11.96ms  11.91ms  23.91ms
                     'violation_ls':         2 [812.61us,  46.88ms]  23.85ms  23.03ms  47.69ms         2 [222.54us,  24.41ms]  12.32ms  12.10ms  24.64ms
                     'violation_ls':         3 [351.64us,  39.28ms]  15.47ms  17.04ms  46.41ms         3 [  7.92us,  21.16ms]   7.98ms   9.39ms  23.94ms

Search stats                        Bools  Conflicts  Branches  Restarts  BoolPropag  IntegerPropag
                           'core':    481        128       981       346      16'914         15'722
                     'default_lp':     39          0        78        66          40            449
                          'fixed':     33          0        66        66          27            398
                      'fs_random':      0          0         0         0           0              0
                      'fs_random':      0          0         0         0           0              0
                      'fs_random':      0          0         0         0           0              0
                      'fs_random':     33          0         0         0           0              0
                'fs_random_no_lp':      0          0         0         0           0              0
                'fs_random_no_lp':      0          0         0         0           0              0
                'fs_random_no_lp':     33          0         0         0           0              0
        'fs_random_quick_restart':      0          0         0         0           0              0
        'fs_random_quick_restart':      0          0         0         0           0              0
        'fs_random_quick_restart':      0          0         0         0           0              0
        'fs_random_quick_restart':     33          0         0         0           0              0
  'fs_random_quick_restart_no_lp':      0          0         0         0           0              0
  'fs_random_quick_restart_no_lp':      0          0         0         0           0              0
  'fs_random_quick_restart_no_lp':      0          0         0         0           0              0
                 'lb_tree_search':     39          1        78        78          28            441
                         'max_lp':     33          0        66        66          27            387
                          'no_lp':    121        244     1'241       348       8'244         39'170
            'objective_lb_search':     38          0        72        66          42            592
     'objective_lb_search_max_lp':     39          1        78        78          37            503
      'objective_lb_search_no_lp':     51        326       987       352       3'451         40'197
                        'probing':     41          1        82        82          46            499
                 'probing_max_lp':     39          1        78        78          28            441
                   'pseudo_costs':     33          0        66        66          34            444
                  'quick_restart':     33          0        68        66          31            432
            'quick_restart_no_lp':    120        224     1'339       381       9'300         39'517
                  'reduced_costs':     39          1        78        78          37            503

SAT stats                           ClassicMinim  LitRemoved  LitLearned  LitForgotten  Subsumed  MClauses  MDecisions  MLitTrue  MSubsumed  MLitRemoved  MReused
                           'core':             4           9          23             0         1        29         141         0          0            0        2
                     'default_lp':             0           0           0             0         0         0           0         0          0            0        0
                          'fixed':             0           0           0             0         0         0           0         0          0            0        0
                      'fs_random':             0           0           0             0         0         0           0         0          0            0        0
                      'fs_random':             0           0           0             0         0         0           0         0          0            0        0
                      'fs_random':             0           0           0             0         0         0           0         0          0            0        0
                      'fs_random':             0           0           0             0         0         0           0         0          0            0        0
                'fs_random_no_lp':             0           0           0             0         0         0           0         0          0            0        0
                'fs_random_no_lp':             0           0           0             0         0         0           0         0          0            0        0
                'fs_random_no_lp':             0           0           0             0         0         0           0         0          0            0        0
        'fs_random_quick_restart':             0           0           0             0         0         0           0         0          0            0        0
        'fs_random_quick_restart':             0           0           0             0         0         0           0         0          0            0        0
        'fs_random_quick_restart':             0           0           0             0         0         0           0         0          0            0        0
        'fs_random_quick_restart':             0           0           0             0         0         0           0         0          0            0        0
  'fs_random_quick_restart_no_lp':             0           0           0             0         0         0           0         0          0            0        0
  'fs_random_quick_restart_no_lp':             0           0           0             0         0         0           0         0          0            0        0
  'fs_random_quick_restart_no_lp':             0           0           0             0         0         0           0         0          0            0        0
                 'lb_tree_search':             0           0           1             0         0         0           0         0          0            0        0
                         'max_lp':             0           0           0             0         0         0           0         0          0            0        0
                          'no_lp':           167         383       1'222             0        33        80         428         0         23          126       15
            'objective_lb_search':             0           0           0             0         0         0           0         0          0            0        0
     'objective_lb_search_max_lp':             0           0           1             0         0         0           0         0          0            0        0
      'objective_lb_search_no_lp':           235         557       1'412             0        32        73         345         0         23          107        5
                        'probing':             0           0           1             0         0         0           0         0          0            0        0
                 'probing_max_lp':             0           0           1             0         0         0           0         0          0            0        0
                   'pseudo_costs':             0           0           0             0         0         0           0         0          0            0        0
                  'quick_restart':             0           0           0             0         0         0           0         0          0            0        0
            'quick_restart_no_lp':           120         236       1'269             0        14       110         459         4         65          325        7
                  'reduced_costs':             0           0           1             0         0         0           0         0          0            0        0

Lp stats                         Component  Iterations  AddedCuts  OPTIMAL  DUAL_F.  DUAL_U.
                  'default_lp':          1         124        399       15        1        0
                       'fixed':          1          84        432       11        0        0
                   'fs_random':          1           0          0        0        0        0
     'fs_random_quick_restart':          1           0          0        0        0        0
              'lb_tree_search':          1          93        379        3        0        0
                      'max_lp':          1          93        309        3        0        0
         'objective_lb_search':          1         117        387       14        0        0
  'objective_lb_search_max_lp':          1         120        407        9        1        0
                     'probing':          1          92        369       13        0        0
              'probing_max_lp':          1          93        282        3        0        0
                'pseudo_costs':          1         142        423       11        0        0
               'quick_restart':          1         111        412       14        0        0
               'reduced_costs':          1          97        408        9        0        0

Lp dimension                                                                    Final dimension of first component
                  'default_lp':   164 rows, 65 columns, 600 entries with magnitude in [2.315304e-03, 1.000000e+00]
                       'fixed':   168 rows, 65 columns, 701 entries with magnitude in [1.633961e-03, 1.000000e+00]
                   'fs_random':       0 rows, 65 columns, 0 entries with magnitude in [0.000000e+00, 0.000000e+00]
     'fs_random_quick_restart':       0 rows, 65 columns, 0 entries with magnitude in [0.000000e+00, 0.000000e+00]
              'lb_tree_search':  297 rows, 65 columns, 1507 entries with magnitude in [4.075032e-03, 1.000000e+00]
                      'max_lp':  297 rows, 65 columns, 1507 entries with magnitude in [4.075032e-03, 1.000000e+00]
         'objective_lb_search':   155 rows, 65 columns, 521 entries with magnitude in [7.748561e-04, 1.000000e+00]
  'objective_lb_search_max_lp':   185 rows, 65 columns, 767 entries with magnitude in [2.082334e-03, 1.000000e+00]
                     'probing':   165 rows, 65 columns, 768 entries with magnitude in [1.225837e-03, 1.000000e+00]
              'probing_max_lp':  297 rows, 65 columns, 1503 entries with magnitude in [4.075032e-03, 1.000000e+00]
                'pseudo_costs':   186 rows, 65 columns, 390 entries with magnitude in [2.469760e-03, 1.000000e+00]
               'quick_restart':   165 rows, 65 columns, 602 entries with magnitude in [2.408759e-03, 1.000000e+00]
               'reduced_costs':   185 rows, 65 columns, 763 entries with magnitude in [2.242579e-03, 1.000000e+00]

Lp debug                         CutPropag  CutEqPropag  Adjust  Overflow  Bad  BadScaling
                  'default_lp':          0            0      11         0  212           0
                       'fixed':          0            0       6         0  255           0
                   'fs_random':          0            0       0         0    0           0
     'fs_random_quick_restart':          0            0       0         0    0           0
              'lb_tree_search':          0            0       3         0  149           0
                      'max_lp':          0            0       3         0  154           0
         'objective_lb_search':          0            0       9         0  190           0
  'objective_lb_search_max_lp':          0            0       3         0  197           0
                     'probing':          0            0       8         0  413           0
              'probing_max_lp':          0            0       3         0  125           0
                'pseudo_costs':          0            0       4         0  211           0
               'quick_restart':          0            1       8         0  222           0
               'reduced_costs':          0            0       2         0  207           0

Lp pool                          Constraints  Updates  Simplif  Merged  Shortened  Split  Strenghtened  Cuts/Call
                  'default_lp':          474       18      223       1        170      0           163    399/619
                       'fixed':          507       10       39       1          0      0            45    432/700
                   'fs_random':           76        0        0       0          0      0             0        0/0
     'fs_random_quick_restart':           76        0        0       0          0      0             0        0/0
              'lb_tree_search':          626        3        0       0          0      6            97    379/606
                      'max_lp':          556        3        0       0          0      6            92    309/515
         'objective_lb_search':          462       17      228       1        175      0           162    387/620
  'objective_lb_search_max_lp':          654        1        0       0          0      0            15    407/638
                     'probing':          445        3        0       0          0      0             0    369/608
              'probing_max_lp':          529        4        0       0          0      6            83    282/482
                'pseudo_costs':          662        5      539       8        435      0           322    423/664
               'quick_restart':          487       21      211       1        160      0           153    412/634
               'reduced_costs':          655        1        0       0          0      0            19    408/632

Lp Cut                                                defaul  fixed  max_lp  quick_  reduce  pseudo  lb_tre  probin  object  probin  object
                                              CG_FF:      71     59      43      73      50      49      64      54      64      34      50
                                               CG_K:      45     51      10      45      15      16      10      40      37      10      15
                                               CG_R:      22     20      29      22       2       2      30       6      19      27       2
                                              CG_RB:      65     87      32      66     102      99      53      92      68      21     102
                                             CG_RBP:       9     15      21       9      26      23      35      14      10      13      26
                                                 IB:     119    114      67     120      95     117      67     105     120      67      95
                                           MIR_1_FF:      23     28      33      25      37      36      33      25      25      30      37
                                            MIR_1_K:       4      7      11       4       1       1      11       -       5      10       -
                                            MIR_1_R:       8      9       1       8       7       6       -       4       9       -       6
                                           MIR_1_RB:       5      8      17       5      13      15      17       9       6      16      14
                                          MIR_1_RBP:       -      -       2       -       4       3       2       -       -       1       4
                                          MIR_1_RLT:       -      -       -       -       3       3       1       -       -       1       3
                                           MIR_2_FF:       5      5       6       4       5       6       8       2       3       3       6
                                            MIR_2_K:       -      1       -       -       1       1       2       -       -       1       1
                                            MIR_2_R:       -      -       1       -       3       5       2       -       -       -       2
                                           MIR_2_RB:       2      4       2       3       5       4       5       3       2       2       7
                                          MIR_2_RBP:       -      1       2       1       2       3       2       -       1       1       1
                                           MIR_3_FF:       4      1       5       5       3       5       7       1       2       5       -
                                            MIR_3_K:       2      -       3       3       -       -       4       -       1       3       -
                                            MIR_3_R:       2      1       -       3       2       3       2       -       1       2       -
                                           MIR_3_RB:       1      3       4       1       3       4       4       1       1       3       1
                                          MIR_3_RBP:       -      -       -       -       2       1       -       -       -       2       -
                                           MIR_4_FF:       1      2       2       1       1       -       1       -       1       2       2
                                            MIR_4_K:       -      1       -       -       -       -       1       -       -       -       1
                                            MIR_4_R:       1      1       -       1       1       -       -       -       1       -       2
                                           MIR_4_RB:       1      1       -       1       1       -       1       -       1       1       2
                                          MIR_4_RBP:       -      -       1       -       -       -       -       -       -       -       2
                                           MIR_5_FF:       -      -       -       -       1       -       -       -       -       1       -
                                            MIR_5_K:       -      -       -       -       1       -       -       -       -       -       -
                                            MIR_5_R:       -      -       -       -       1       -       -       -       -       1       -
                                           MIR_5_RB:       -      -       -       -       1       -       -       -       -       -       -
                                          MIR_5_RBP:       -      -       -       -       1       -       -       -       -       1       -
                                           MIR_6_FF:       -      -       -       -       -       -       -       -       -       1       -
                                            MIR_6_R:       -      -       -       -       -       -       -       -       -       1       -
         NoOverlapCompletionTimeExhaustive_weighted:       -      -       2       -       2       4       2       -       -       2       2
  NoOverlapCompletionTimeExhaustive_weighted_lifted:       -      -       1       -       1       1       1       -       -       1       1
                        NoOverlapDisjunctionOnStart:       -      -       2       -       2       3       2       -       -       2       2
                                       ZERO_HALF_FF:       3      5       5       4       6       5       5       5       3       6       6
                                        ZERO_HALF_K:       -      1       1       -       -       -       1       -       -       1       -
                                        ZERO_HALF_R:       4      4       3       5       6       6       3       4       4       5       7
                                       ZERO_HALF_RB:       2      3       2       3       2       2       2       4       3       3       6
                                      ZERO_HALF_RBP:       -      -       1       -       -       -       1       -       -       2       2

LNS stats                        Improv/Calls  Closed  Difficulty  TimeLimit
               'graph_arc_lns':           1/4    100%        0.91       0.10
               'graph_cst_lns':           0/0      0%        0.50       0.10
               'graph_dec_lns':           1/5    100%        0.94       0.10
               'graph_var_lns':           2/4    100%        0.91       0.10
                   'rins/rens':           0/4     75%        0.82       0.10
                 'rnd_cst_lns':           0/5    100%        0.94       0.10
                 'rnd_var_lns':           2/6    100%        0.96       0.10
    'scheduling_intervals_lns':           2/3      0%        0.12       0.10
  'scheduling_precedences_lns':           2/4     25%        0.25       0.10
  'scheduling_time_window_lns':           2/5     80%        0.88       0.10

LS stats                   Batches  Restarts  LinMoves  GenMoves  CompoundMoves  WeightUpdates
       'fj_long_default':        0         0         0         0              0              0
       'fj_long_default':        0         0         0         0              0              0
   'fj_long_lin_default':        0         0         0         0              0              0
   'fj_long_lin_perturb':        0         0         0         0              0              0
    'fj_long_lin_random':        0         0         0         0              0              0
       'fj_long_perturb':        0         0         0         0              0              0
        'fj_long_random':        0         0         0         0              0              0
      'fj_short_default':        0         0         0         0              0              0
      'fj_short_default':        0         0         0         0              0              0
  'fj_short_lin_default':        0         0         0         0              0              0
  'fj_short_lin_default':        0         0         0         0              0              0
  'fj_short_lin_perturb':        0         0         0         0              0              0
   'fj_short_lin_random':        0         0         0         0              0              0
      'fj_short_perturb':        0         0         0         0              0              0
       'fj_short_random':        0         0         0         0              0              0
          'violation_ls':        2         0         0     4'824            122             34
          'violation_ls':        2         0         0     5'004             60             38
          'violation_ls':        2         0         0     5'154            106             35
          'violation_ls':        3         0     6'433         0              0          5'746

Solutions (12)                   Num     Rank
               'graph_arc_lns':    1    [6,6]
                       'no_lp':    6   [1,12]
         'quick_restart_no_lp':    2    [8,9]
  'scheduling_precedences_lns':    1  [10,10]
                'violation_ls':    2    [4,5]

Objective bounds                Num
                  'bool_core':   15
             'initial_domain':    1
        'objective_lb_search':    1
  'objective_lb_search_no_lp':   14

Solution repositories    Added  Queried  Ignored  Synchro
  'feasible solutions':     49      130        1       34
        'lp solutions':      0        0        0        0
                'pump':     35        5

Improving bounds shared    Num
                  'core':    7
                 'no_lp':  115
   'quick_restart_no_lp':   23

Clauses shared            Num
                'no_lp':   14
  'quick_restart_no_lp':   18

CpSolverResponse summary:
status: OPTIMAL
objective: 477
best_bound: 477
integers: 0
booleans: 0
conflicts: 0
branches: 0
propagations: 0
integer_propagations: 0
restarts: 0
lp_iterations: 0
walltime: 0.0940164
usertime: 0.0940165
deterministic_time: 0.144971
gap_integral: 0.151141
solution_fingerprint: 0x99b7b204a8dd84f7


--- Simulation Gantt  partir du modle mathmatique ---
{'big':0, 'due_date':106, 'pos_time':5, 'status':0, 'blocked':2, 'operations':["{'type':0, 'processing_time':44}", "{'type':1, 'processing_time':54}"]}
{'big':1, 'due_date':92, 'pos_time':5, 'status':3, 'blocked':1, 'operations':["{'type':1, 'processing_time':37}"]}
{'big':1, 'due_date':57, 'pos_time':5, 'status':0, 'blocked':2, 'operations':["{'type':0, 'processing_time':46}"]}
{'big':0, 'due_date':104, 'pos_time':5, 'status':3, 'blocked':0, 'operations':["{'type':1, 'processing_time':54}", "{'type':0, 'processing_time':41}"]}
