created virtual environment CPython3.12.4.final.0-64 in 2460ms
  creator CPython3Posix(dest=/localscratch/aneumann.46806192.0/env, clear=False, no_vcs_ignore=False, global=False)
  seeder FromAppData(download=False, pip=bundle, via=copy, app_data_dir=/home/aneumann/.local/share/virtualenv)
    added seed packages: pip==24.2+computecanada
  activators BashActivator,CShellActivator,FishActivator,NushellActivator,PowerShellActivator,PythonActivator
Looking in links: /cvmfs/soft.computecanada.ca/custom/python/wheelhouse/gentoo2023/x86-64-v3, /cvmfs/soft.computecanada.ca/custom/python/wheelhouse/gentoo2023/generic, /cvmfs/soft.computecanada.ca/custom/python/wheelhouse/generic
Requirement already satisfied: pip in /localscratch/aneumann.46806192.0/env/lib/python3.12/site-packages (24.2+computecanada)
Processing /cvmfs/soft.computecanada.ca/custom/python/wheelhouse/generic/pip-25.0+computecanada-py3-none-any.whl
Installing collected packages: pip
  Attempting uninstall: pip
    Found existing installation: pip 24.2+computecanada
    Uninstalling pip-24.2+computecanada:
      Successfully uninstalled pip-24.2+computecanada
Successfully installed pip-25.0+computecanada
Looking in links: /cvmfs/soft.computecanada.ca/custom/python/wheelhouse/gentoo2023/x86-64-v3, /cvmfs/soft.computecanada.ca/custom/python/wheelhouse/gentoo2023/generic, /cvmfs/soft.computecanada.ca/custom/python/wheelhouse/generic
ERROR: protobuf-5.28.3-cp38-abi3-manylinux2014_x86_64.whl is not a supported wheel on this platform.
Looking in links: /cvmfs/soft.computecanada.ca/custom/python/wheelhouse/gentoo2023/x86-64-v3, /cvmfs/soft.computecanada.ca/custom/python/wheelhouse/gentoo2023/generic, /cvmfs/soft.computecanada.ca/custom/python/wheelhouse/generic
Processing /home/aneumann/projects/def-adhaj/aneumann/GNRS/wheels/immutabledict-4.2.0-py3-none-any.whl
Installing collected packages: immutabledict
Successfully installed immutabledict-4.2.0
Looking in links: /cvmfs/soft.computecanada.ca/custom/python/wheelhouse/gentoo2023/x86-64-v3, /cvmfs/soft.computecanada.ca/custom/python/wheelhouse/gentoo2023/generic, /cvmfs/soft.computecanada.ca/custom/python/wheelhouse/generic
Processing /cvmfs/soft.computecanada.ca/custom/python/wheelhouse/generic/ortools-9.10.4067+computecanada-cp312-cp312-linux_x86_64.whl (from -r /home/aneumann/projects/def-adhaj/aneumann/GNRS/requirements/or.txt (line 1))
Processing /cvmfs/soft.computecanada.ca/custom/python/wheelhouse/gentoo2023/x86-64-v3/matplotlib-3.10.0+computecanada-cp312-cp312-linux_x86_64.whl (from -r /home/aneumann/projects/def-adhaj/aneumann/GNRS/requirements/or.txt (line 2))
Processing /cvmfs/soft.computecanada.ca/custom/python/wheelhouse/gentoo2023/x86-64-v3/pandas-2.2.3+computecanada-cp312-cp312-linux_x86_64.whl (from -r /home/aneumann/projects/def-adhaj/aneumann/GNRS/requirements/or.txt (line 3))
Processing /cvmfs/soft.computecanada.ca/custom/python/wheelhouse/generic/absl_py-2.3.0+computecanada-py3-none-any.whl (from ortools<9.11,>=9.10->-r /home/aneumann/projects/def-adhaj/aneumann/GNRS/requirements/or.txt (line 1))
Processing /cvmfs/soft.computecanada.ca/custom/python/wheelhouse/gentoo2023/generic/numpy-2.2.2+computecanada-cp312-cp312-linux_x86_64.whl (from ortools<9.11,>=9.10->-r /home/aneumann/projects/def-adhaj/aneumann/GNRS/requirements/or.txt (line 1))
Processing /cvmfs/soft.computecanada.ca/custom/python/wheelhouse/gentoo2023/x86-64-v3/protobuf-6.31.1+computecanada-cp312-cp312-linux_x86_64.whl (from ortools<9.11,>=9.10->-r /home/aneumann/projects/def-adhaj/aneumann/GNRS/requirements/or.txt (line 1))
Requirement already satisfied: immutabledict>=3.0.0 in /localscratch/aneumann.46806192.0/env/lib/python3.12/site-packages (from ortools<9.11,>=9.10->-r /home/aneumann/projects/def-adhaj/aneumann/GNRS/requirements/or.txt (line 1)) (4.2.0)
Processing /cvmfs/soft.computecanada.ca/custom/python/wheelhouse/gentoo2023/generic/contourpy-1.3.1+computecanada-cp312-cp312-linux_x86_64.whl (from matplotlib->-r /home/aneumann/projects/def-adhaj/aneumann/GNRS/requirements/or.txt (line 2))
Processing /cvmfs/soft.computecanada.ca/custom/python/wheelhouse/generic/cycler-0.12.1+computecanada-py3-none-any.whl (from matplotlib->-r /home/aneumann/projects/def-adhaj/aneumann/GNRS/requirements/or.txt (line 2))
Processing /cvmfs/soft.computecanada.ca/custom/python/wheelhouse/generic/fonttools-4.59.0+computecanada-cp312-cp312-linux_x86_64.whl (from matplotlib->-r /home/aneumann/projects/def-adhaj/aneumann/GNRS/requirements/or.txt (line 2))
Processing /cvmfs/soft.computecanada.ca/custom/python/wheelhouse/gentoo2023/x86-64-v3/kiwisolver-1.4.8+computecanada-cp312-cp312-linux_x86_64.whl (from matplotlib->-r /home/aneumann/projects/def-adhaj/aneumann/GNRS/requirements/or.txt (line 2))
Processing /cvmfs/soft.computecanada.ca/custom/python/wheelhouse/generic/packaging-25.0+computecanada-py3-none-any.whl (from matplotlib->-r /home/aneumann/projects/def-adhaj/aneumann/GNRS/requirements/or.txt (line 2))
Processing /cvmfs/soft.computecanada.ca/custom/python/wheelhouse/gentoo2023/x86-64-v3/pillow-11.1.0+computecanada-cp312-cp312-linux_x86_64.whl (from matplotlib->-r /home/aneumann/projects/def-adhaj/aneumann/GNRS/requirements/or.txt (line 2))
Processing /cvmfs/soft.computecanada.ca/custom/python/wheelhouse/generic/pyparsing-3.2.3+computecanada-py3-none-any.whl (from matplotlib->-r /home/aneumann/projects/def-adhaj/aneumann/GNRS/requirements/or.txt (line 2))
Processing /cvmfs/soft.computecanada.ca/custom/python/wheelhouse/generic/python_dateutil-2.9.0.post0+computecanada-py2.py3-none-any.whl (from matplotlib->-r /home/aneumann/projects/def-adhaj/aneumann/GNRS/requirements/or.txt (line 2))
Processing /cvmfs/soft.computecanada.ca/custom/python/wheelhouse/generic/pytz-2025.2+computecanada-py2.py3-none-any.whl (from pandas->-r /home/aneumann/projects/def-adhaj/aneumann/GNRS/requirements/or.txt (line 3))
Processing /cvmfs/soft.computecanada.ca/custom/python/wheelhouse/generic/tzdata-2025.2+computecanada-py2.py3-none-any.whl (from pandas->-r /home/aneumann/projects/def-adhaj/aneumann/GNRS/requirements/or.txt (line 3))
Processing /cvmfs/soft.computecanada.ca/custom/python/wheelhouse/generic/six-1.17.0+computecanada-py2.py3-none-any.whl (from python-dateutil>=2.7->matplotlib->-r /home/aneumann/projects/def-adhaj/aneumann/GNRS/requirements/or.txt (line 2))
Installing collected packages: pytz, tzdata, six, pyparsing, protobuf, pillow, packaging, numpy, kiwisolver, fonttools, cycler, absl-py, python-dateutil, contourpy, pandas, matplotlib, ortools
Successfully installed absl-py-2.3.0+computecanada contourpy-1.3.1+computecanada cycler-0.12.1+computecanada fonttools-4.59.0+computecanada kiwisolver-1.4.8+computecanada matplotlib-3.10.0+computecanada numpy-2.2.2+computecanada ortools-9.10.4067+computecanada packaging-25.0+computecanada pandas-2.2.3+computecanada pillow-11.1.0+computecanada protobuf-6.31.1+computecanada pyparsing-3.2.3+computecanada python-dateutil-2.9.0.post0+computecanada pytz-2025.2+computecanada six-1.17.0+computecanada tzdata-2025.2+computecanada

Starting CP-SAT solver v9.10.4067
Parameters: max_time_in_seconds: 86400 max_memory_in_mb: 185000 log_search_progress: true enumerate_all_solutions: false num_search_workers: 32 absolute_gap_limit: 0 relative_gap_limit: 0

Initial optimization model '': (model_fingerprint: 0xfd305a29026a46fb)
#Variables: 362 (#ints: 9 in objective)
  - 269 Booleans in [0,1]
  - 93 in [0,705]
#kLinear1: 47
#kLinear2: 522
#kLinear3: 202
#kLinearN: 5'132 (#terms: 94'605)

Starting presolve at 0.00s
  4.05e-03s  0.00e+00d  [DetectDominanceRelations] 
  7.47e-02s  0.00e+00d  [PresolveToFixPoint] #num_loops=7 #num_dual_strengthening=3 
  4.12e-05s  0.00e+00d  [ExtractEncodingFromLinear] #potential_supersets=2 
[Symmetry] Graph for symmetry has 5'916 nodes and 76'776 arcs.
[Symmetry] Symmetry computation done. time: 0.00306105 dtime: 0.00534373
[Symmetry] #generators: 1, average support size: 20
[Symmetry] The model contains 282 duplicate constraints !
[Symmetry] 10 orbits with sizes: 2,2,2,2,2,2,2,2,2,2
[Symmetry] Num fixable by intersecting at_most_one with orbits: 1 largest_orbit: 2
  2.07e-02s  4.31e-03d  [Probe] #probed=390 #new_bounds=13 #equiv=1 
  6.11e-05s  0.00e+00d  [MaxClique] Merged 2(4 literals) into 1(2 literals) at_most_ones. 
  3.99e-03s  0.00e+00d  [DetectDominanceRelations] 
  3.68e-02s  0.00e+00d  [PresolveToFixPoint] #num_loops=5 #num_dual_strengthening=3 
  1.66e-02s  0.00e+00d  [ProcessAtMostOneAndLinear] 
  5.45e-03s  0.00e+00d  [DetectDuplicateConstraints] #duplicates=337 #without_enforcements=35 
  5.17e-03s  3.68e-04d  [DetectDominatedLinearConstraints] #relevant_constraints=4'600 #num_inclusions=3'194 
  5.63e-04s  0.00e+00d  [DetectDifferentVariables] #different=24 #cliques=1 #size=5 
  1.30e-03s  1.20e-04d  [ProcessSetPPC] #relevant_constraints=4'231 
  2.67e-05s  0.00e+00d  [FindAlmostIdenticalLinearConstraints] 
  9.77e-05s  1.31e-04d  [FindBigAtMostOneAndLinearOverlap] 
  1.15e-02s  8.24e-03d  [FindBigVerticalLinearOverlap] #blocks=59 #saved_nz=9'683 
  6.30e-04s  2.93e-04d  [FindBigHorizontalLinearOverlap] #linears=4'161 
  2.13e-05s  0.00e+00d  [MergeClauses] 
  4.44e-03s  0.00e+00d  [DetectDominanceRelations] 
  3.80e-02s  0.00e+00d  [PresolveToFixPoint] #num_loops=2 #num_dual_strengthening=1 
  4.45e-03s  0.00e+00d  [DetectDominanceRelations] 
  2.51e-02s  0.00e+00d  [PresolveToFixPoint] #num_loops=1 #num_dual_strengthening=1 
[Symmetry] Graph for symmetry has 5'774 nodes and 65'980 arcs.
[Symmetry] Symmetry computation done. time: 0.0014692 dtime: 0.00338898
  2.06e-02s  4.05e-03d  [Probe] #probed=390 #new_bounds=47 
  1.36e-05s  0.00e+00d  [MaxClique] 
  4.42e-03s  0.00e+00d  [DetectDominanceRelations] 
  3.52e-02s  0.00e+00d  [PresolveToFixPoint] #num_loops=2 #num_dual_strengthening=1 
  1.57e-02s  0.00e+00d  [ProcessAtMostOneAndLinear] 
  4.81e-03s  0.00e+00d  [DetectDuplicateConstraints] #without_enforcements=35 
  3.68e-03s  2.59e-04d  [DetectDominatedLinearConstraints] #relevant_constraints=4'553 #num_inclusions=1'014 
  4.32e-04s  0.00e+00d  [DetectDifferentVariables] 
  1.22e-03s  1.00e-04d  [ProcessSetPPC] #relevant_constraints=4'134 
  3.80e-05s  2.10e-07d  [FindAlmostIdenticalLinearConstraints] #num_tested_pairs=14 
  5.55e-05s  6.41e-05d  [FindBigAtMostOneAndLinearOverlap] 
  8.64e-03s  6.50e-03d  [FindBigVerticalLinearOverlap] #blocks=101 #saved_nz=7'882 
  5.66e-04s  2.47e-04d  [FindBigHorizontalLinearOverlap] #linears=3'863 
  1.70e-05s  0.00e+00d  [MergeClauses] 
  4.04e-03s  0.00e+00d  [DetectDominanceRelations] 
  3.97e-02s  0.00e+00d  [PresolveToFixPoint] #num_loops=2 #num_dual_strengthening=1 
  4.03e-03s  0.00e+00d  [DetectDominanceRelations] 
  2.78e-02s  0.00e+00d  [PresolveToFixPoint] #num_loops=1 #num_dual_strengthening=1 
[Symmetry] Graph for symmetry has 6'061 nodes and 58'187 arcs.
[Symmetry] Symmetry computation done. time: 0.00140245 dtime: 0.00303253
  2.01e-02s  3.79e-03d  [Probe] #probed=390 #new_bounds=82 
  1.45e-05s  0.00e+00d  [MaxClique] 
  3.99e-03s  0.00e+00d  [DetectDominanceRelations] 
  3.70e-02s  0.00e+00d  [PresolveToFixPoint] #num_loops=2 #num_dual_strengthening=1 
  1.48e-02s  0.00e+00d  [ProcessAtMostOneAndLinear] 
  4.83e-03s  0.00e+00d  [DetectDuplicateConstraints] #without_enforcements=35 
  3.06e-03s  2.18e-04d  [DetectDominatedLinearConstraints] #relevant_constraints=4'567 #num_inclusions=509 
  4.44e-04s  0.00e+00d  [DetectDifferentVariables] 
  1.08e-03s  8.32e-05d  [ProcessSetPPC] #relevant_constraints=3'857 
  5.63e-05s  2.71e-06d  [FindAlmostIdenticalLinearConstraints] #num_tested_pairs=136 
  5.55e-05s  5.55e-05d  [FindBigAtMostOneAndLinearOverlap] 
  8.07e-03s  5.35e-03d  [FindBigVerticalLinearOverlap] #blocks=65 #saved_nz=7'408 
  6.74e-04s  2.04e-04d  [FindBigHorizontalLinearOverlap] #linears=3'604 
  1.73e-05s  0.00e+00d  [MergeClauses] 
  3.50e-03s  0.00e+00d  [DetectDominanceRelations] 
  3.87e-02s  0.00e+00d  [PresolveToFixPoint] #num_loops=2 #num_dual_strengthening=1 
  1.27e-04s  0.00e+00d  [ExpandObjective] #entries=992 #tight_variables=320 #tight_constraints=194 

Presolve summary:
  - 92 affine relations were detected.
  - rule 'TODO dual: only one blocking constraint?' was applied 695 times.
  - rule 'TODO dual: only one blocking enforced constraint?' was applied 130 times.
  - rule 'TODO dual: only one unspecified blocking constraint?' was applied 72 times.
  - rule 'TODO duplicate: identical constraint with different enforcements' was applied 105 times.
  - rule 'affine: new relation' was applied 92 times.
  - rule 'at_most_one: removed literals' was applied 1 time.
  - rule 'at_most_one: size one' was applied 1 time.
  - rule 'at_most_one: transformed into max clique.' was applied 1 time.
  - rule 'deductions: 343 stored' was applied 1 time.
  - rule 'dual: fix variable' was applied 24 times.
  - rule 'dual: reduced domain' was applied 60 times.
  - rule 'duplicate: merged rhs of linear constraint' was applied 55 times.
  - rule 'duplicate: removed constraint' was applied 337 times.
  - rule 'enforcement: false literal' was applied 12 times.
  - rule 'exactly_one: x and not(x)' was applied 1 time.
  - rule 'incompatible linear: add implication' was applied 30 times.
  - rule 'linear matrix: common vertical rectangle' was applied 225 times.
  - rule 'linear1: always true' was applied 1 time.
  - rule 'linear: always true' was applied 637 times.
  - rule 'linear: doubleton free' was applied 13 times.
  - rule 'linear: empty' was applied 38 times.
  - rule 'linear: extracted enforcement literal' was applied 5'611 times.
  - rule 'linear: fixed or dup variables' was applied 5'283 times.
  - rule 'linear: positive equal one' was applied 2 times.
  - rule 'linear: reduced variable domains' was applied 335 times.
  - rule 'linear: remapped using affine relations' was applied 5'369 times.
  - rule 'linear: simplified rhs' was applied 15'763 times.
  - rule 'linear: tightened into equality' was applied 5 times.
  - rule 'linear: variable substitution 1' was applied 13 times.
  - rule 'linear: variable substitution 2' was applied 8 times.
  - rule 'linear: variable substitution 3' was applied 6 times.
  - rule 'no_overlap: inferred from x != y constraints' was applied 1 time.
  - rule 'presolve: 100 unused variables removed.' was applied 1 time.
  - rule 'presolve: iteration' was applied 3 times.
  - rule 'probing: reduced enforced constraint to implication.' was applied 2 times.
  - rule 'symmetry: fixed to false in general orbit' was applied 1 time.

Presolved optimization model '': (model_fingerprint: 0x7fac0ec6a743d059)
#Variables: 368 (#ints: 9 in objective)
  - 95 Booleans in [0,1]
  - 242 different domains in [-9044,8343] with a largest complexity of 15.
#kExactlyOne: 1 (#literals: 3)
#kInterval: 5
#kLinear2: 477 (#enforced: 426 #multi: 254)
#kLinear3: 618 (#enforced: 420)
#kLinearN: 3'886 (#enforced: 3'725) (#terms: 41'913)
#kNoOverlap: 1 (#intervals: 5)

Preloading model.
#Bound   0.56s best:inf   next:[168,5143] initial_domain
[Symmetry] Graph for symmetry has 6'008 nodes and 50'817 arcs.
[Symmetry] Symmetry computation done. time: 0.00127922 dtime: 0.00271673
#Model   0.57s var:368/368 constraints:4988/4988

Starting search at 0.57s with 32 workers.
17 full problem subsolvers: [core, default_lp, fixed, lb_tree_search, max_lp, no_lp, objective_lb_search, objective_lb_search_max_lp, objective_lb_search_no_lp, objective_shaving_search_max_lp, objective_shaving_search_no_lp, probing, probing_max_lp, pseudo_costs, quick_restart, quick_restart_no_lp, reduced_costs]
13 first solution subsolvers: [fj_long_default, fj_long_lin_default, fj_long_random, fj_short_default, fj_short_lin_default, fj_short_lin_random, fj_short_random, fs_random(2), fs_random_no_lp, fs_random_quick_restart(2), fs_random_quick_restart_no_lp]
13 incomplete subsolvers: [feasibility_pump, graph_arc_lns, graph_cst_lns, graph_dec_lns, graph_var_lns, rins/rens, rnd_cst_lns, rnd_var_lns, scheduling_intervals_lns, scheduling_precedences_lns, scheduling_time_window_lns, violation_ls(2)]
3 helper subsolvers: [neighborhood_helper, synchronization_agent, update_gap_integral]
#Bound   0.67s best:inf   next:[169,5143] bool_core (num_cores=1 [size:1 mw:1] a=9 d=0 fixed=0/104 clauses=1)
#Bound   0.75s best:inf   next:[170,5143] bool_core (num_cores=2 [size:1 mw:1] a=9 d=0 fixed=2/105 clauses=7)
#Bound   0.77s best:inf   next:[171,5143] bool_core (num_cores=3 [size:2 mw:1 d:1] a=8 d=1 fixed=2/106 clauses=9)
#Bound   0.77s best:inf   next:[172,5143] bool_core (num_cores=3 [cover] a=8 d=1 fixed=2/109 clauses=10)
#Bound   0.77s best:inf   next:[173,5143] bool_core (num_cores=3 [cover] a=8 d=1 fixed=3/112 clauses=12)
#Bound   0.78s best:inf   next:[174,5143] bool_core (num_cores=3 [cover] a=8 d=1 fixed=4/115 clauses=15)
#Bound   0.79s best:inf   next:[175,5143] bool_core (num_cores=3 [cover] a=8 d=1 fixed=5/118 clauses=19)
#Bound   0.79s best:inf   next:[176,5143] bool_core (num_cores=3 [cover] a=8 d=1 fixed=6/121 clauses=24)
#Bound   0.80s best:inf   next:[177,5143] bool_core (num_cores=4 [size:1 mw:1] a=8 d=1 fixed=7/124 clauses=30)
#Bound   0.81s best:inf   next:[178,5143] bool_core (num_cores=5 [size:1 mw:1] a=8 d=1 fixed=8/125 clauses=33)
#Bound   0.83s best:inf   next:[179,5143] bool_core (num_cores=6 [size:1 mw:1] a=8 d=1 fixed=9/126 clauses=37)
#Bound   0.84s best:inf   next:[180,5143] bool_core (num_cores=7 [size:1 mw:1] a=8 d=1 fixed=10/127 clauses=40)
#Bound   0.85s best:inf   next:[181,5143] bool_core (num_cores=8 [size:1 mw:1] a=8 d=1 fixed=11/128 clauses=44)
#1       0.90s best:2341  next:[181,2340] quick_restart_no_lp (fixed_bools=0/135)
#Bound   0.92s best:2341  next:[182,2340] bool_core (num_cores=9 [size:1 mw:1] a=8 d=1 fixed=13/129 clauses=25)
#Bound   0.94s best:2341  next:[193,2340] default_lp
#Bound   0.99s best:2341  next:[194,2340] bool_core (num_cores=10 [cover] a=7 d=2 fixed=23/185 clauses=228)
#Bound   1.00s best:2341  next:[195,2340] bool_core (num_cores=10 [cover] a=7 d=2 fixed=24/190 clauses=258)
#Bound   1.00s best:2341  next:[196,2340] bool_core (num_cores=10 [cover] a=7 d=2 fixed=25/195 clauses=290)
#Bound   1.01s best:2341  next:[197,2340] bool_core (num_cores=10 [cover] a=7 d=2 fixed=26/200 clauses=324)
#Bound   1.02s best:2341  next:[198,2340] bool_core (num_cores=10 [cover] a=7 d=2 fixed=27/205 clauses=360)
#Bound   1.02s best:2341  next:[199,2340] bool_core (num_cores=10 [cover] a=7 d=2 fixed=28/210 clauses=398)
#2       1.03s best:2305  next:[205,2304] no_lp (fixed_bools=0/124)
#3       1.05s best:2126  next:[210,2125] no_lp (fixed_bools=0/132)
#4       1.06s best:2064  next:[211,2063] no_lp (fixed_bools=0/147)
#5       1.07s best:2058  next:[212,2057] no_lp (fixed_bools=0/158)
#6       1.08s best:1889  next:[213,1888] no_lp (fixed_bools=0/176)
#7       1.09s best:1873  next:[214,1872] no_lp (fixed_bools=0/185)
#8       1.10s best:1832  next:[215,1831] no_lp (fixed_bools=0/189)
#9       1.11s best:1790  next:[216,1789] no_lp (fixed_bools=0/193)
#10      1.13s best:1755  next:[217,1754] no_lp (fixed_bools=0/200)
#11      1.14s best:1722  next:[218,1721] no_lp (fixed_bools=0/204)
#12      1.20s best:1698  next:[263,1697] no_lp (fixed_bools=0/216)
#13      1.32s best:1660  next:[263,1659] no_lp (fixed_bools=0/228)
#14      1.36s best:1536  next:[263,1535] no_lp (fixed_bools=0/241)
#15      1.38s best:1535  next:[263,1534] no_lp (fixed_bools=0/241)
#16      1.46s best:1524  next:[263,1523] no_lp (fixed_bools=0/255)
#17      1.47s best:1522  next:[263,1521] no_lp (fixed_bools=0/256)
#18      1.48s best:1517  next:[263,1516] no_lp (fixed_bools=0/263)
#19      1.52s best:1512  next:[263,1511] no_lp (fixed_bools=0/276)
#20      1.53s best:1505  next:[263,1504] no_lp (fixed_bools=0/277)
#21      1.55s best:1483  next:[263,1482] no_lp (fixed_bools=0/288)
#22      1.57s best:1458  next:[263,1457] no_lp (fixed_bools=0/307)
#23      1.58s best:1456  next:[263,1455] no_lp (fixed_bools=0/309)
#24      1.59s best:1450  next:[263,1449] no_lp (fixed_bools=0/310)
#25      1.60s best:1449  next:[263,1448] no_lp (fixed_bools=0/310)
#26      1.61s best:1443  next:[263,1442] no_lp (fixed_bools=0/311)
#27      1.62s best:1441  next:[263,1440] no_lp (fixed_bools=0/312)
#28      1.64s best:1426  next:[263,1425] no_lp (fixed_bools=0/313)
#29      1.76s best:1414  next:[263,1413] quick_restart_no_lp (fixed_bools=0/268)
#30      1.78s best:1413  next:[263,1412] violation_ls(batch:5 #solutions_imported:4 #lin_moves:5'267 #lin_evals:77'967 #gen_moves:21'370 #gen_evals:3'227 #comp_moves:2'604 #backtracks:9'374 #weight_updates:4'963)
#31      1.78s best:1412  next:[263,1411] violation_ls(batch:5 #solutions_imported:4 #lin_moves:19'536 #lin_evals:120'189 #gen_moves:16'069 #gen_evals:2'239 #comp_moves:875 #backtracks:7'591 #weight_updates:701)
#32      1.83s best:1408  next:[264,1407] quick_restart_no_lp (fixed_bools=0/274)
#33      1.88s best:1404  next:[264,1403] quick_restart_no_lp (fixed_bools=0/275)
#34      1.93s best:1342  next:[276,1341] quick_restart_no_lp (fixed_bools=0/302)
#35      1.98s best:1341  next:[302,1340] quick_restart_no_lp (fixed_bools=0/302)
#36      2.00s best:1339  next:[302,1338] quick_restart_no_lp (fixed_bools=0/305)
#Bound   1.97s best:1342  next:[302,1341] objective_lb_search_no_lp [skipped_logs=28]
#37      2.04s best:1336  next:[398,1335] no_lp (fixed_bools=0/365)
#38      2.25s best:1326  next:[437,1325] no_lp (fixed_bools=0/371)
#39      2.28s best:1324  next:[437,1323] no_lp (fixed_bools=0/377)
#40      2.29s best:1298  next:[452,1297] no_lp (fixed_bools=0/378)
#41      2.30s best:1297  next:[452,1296] no_lp (fixed_bools=0/378)
#42      2.55s best:1296  next:[454,1295] quick_restart_no_lp (fixed_bools=1/397)
#43      2.56s best:1295  next:[454,1294] quick_restart_no_lp (fixed_bools=1/399)
#44      2.56s best:1294  next:[454,1293] violation_ls(batch:6 #solutions_imported:5 #lin_moves:19'560 #lin_evals:120'314 #gen_moves:16'069 #gen_evals:2'239 #comp_moves:875 #backtracks:7'591 #weight_updates:713)
#45      2.57s best:1292  next:[454,1291] quick_restart_no_lp (fixed_bools=1/402)
#46      2.69s best:1267  next:[454,1266] no_lp (fixed_bools=0/442)
#47      2.75s best:1260  next:[460,1259] scheduling_precedences_lns (d=0.50 s=80 t=0.10 p=0.00 stall=0 h=auto_l0)
#48      2.83s best:1255  next:[460,1254] quick_restart_no_lp (fixed_bools=2/462)
#49      2.92s best:1250  next:[463,1249] quick_restart_no_lp (fixed_bools=2/465)
#50      2.96s best:1249  next:[464,1248] violation_ls(batch:8 #solutions_imported:7 #lin_moves:5'814 #lin_evals:118'771 #gen_moves:36'623 #gen_evals:5'124 #comp_moves:3'929 #backtracks:16'333 #weight_updates:5'427)
#51      2.96s best:1248  next:[464,1247] violation_ls(batch:8 #solutions_imported:7 #lin_moves:19'561 #lin_evals:139'760 #gen_moves:23'891 #gen_evals:3'067 #comp_moves:1'776 #backtracks:11'050 #weight_updates:784)
#Bound   2.92s best:1250  next:[464,1249] objective_lb_search [skipped_logs=7]
#52      3.10s best:1244  next:[464,1243] quick_restart_no_lp (fixed_bools=3/479)
#53      3.12s best:1240  next:[464,1239] rnd_var_lns (d=0.97 s=140 t=0.10 p=1.00 stall=1 h=auto_l0)
#Bound   3.98s best:1240  next:[509,1239] objective_lb_search_no_lp [skipped_logs=5]
#Bound   4.97s best:1240  next:[553,1239] objective_lb_search_no_lp [skipped_logs=5]
#Bound   5.98s best:1240  next:[563,1239] objective_lb_search_no_lp [skipped_logs=1]
#54      6.26s best:1215  next:[563,1214] no_lp (fixed_bools=1/613)
#55      6.29s best:1207  next:[563,1206] graph_arc_lns (d=0.99 s=233 t=0.10 p=1.00 stall=4 h=auto_l0)
#Bound   6.75s best:1207  next:[571,1206] objective_lb_search_no_lp [skipped_logs=0]
#56      7.30s best:1206  next:[572,1205] no_lp (fixed_bools=2/643)
#57      7.31s best:1202  next:[572,1201] rnd_var_lns (d=0.99 s=260 t=0.10 p=0.93 stall=7 h=auto_l0)
#Bound   7.77s best:1202  next:[589,1201] objective_lb_search_no_lp [skipped_logs=2]
#Bound   8.98s best:1202  next:[590,1201] objective_lb_search_max_lp [skipped_logs=0]
#Bound  10.93s best:1202  next:[591,1201] objective_shaving_search_no_lp (vars=457 csts=5025)
#Bound  11.01s best:1202  next:[594,1201] objective_lb_search_no_lp
#58     11.88s best:1188  next:[598,1187] rnd_var_lns (d=0.99 s=404 t=0.10 p=0.72 stall=9 h=auto_l0)
#Bound  11.62s best:1202  next:[598,1201] objective_lb_search [skipped_logs=0]
#Bound  12.62s best:1188  next:[607,1187] objective_lb_search_no_lp [skipped_logs=0]
#Bound  14.58s best:1188  next:[609,1187] objective_lb_search_no_lp
#Bound  15.73s best:1188  next:[611,1187] objective_lb_search_no_lp
#Bound  17.08s best:1188  next:[612,1187] objective_lb_search_no_lp
#Bound  18.33s best:1188  next:[614,1187] objective_lb_search_no_lp
#Bound  18.75s best:1188  next:[615,1187] objective_lb_search_no_lp
#Bound  20.41s best:1188  next:[616,1187] objective_lb_search
#Bound  22.24s best:1188  next:[618,1187] objective_lb_search_no_lp
#Bound  23.36s best:1188  next:[622,1187] objective_lb_search_no_lp
#Bound  24.98s best:1188  next:[646,1187] objective_lb_search_max_lp
#Bound  28.33s best:1188  next:[649,1187] objective_lb_search
#Bound  29.96s best:1188  next:[650,1187] lb_tree_search (nodes=320/320 rc=1 decisions=8816 @root=36 restarts=8) 
#Bound  30.61s best:1188  next:[652,1187] objective_lb_search
#Bound  31.83s best:1188  next:[656,1187] objective_lb_search_max_lp
#Bound  33.35s best:1188  next:[658,1187] objective_lb_search
#Bound  33.70s best:1188  next:[659,1187] objective_lb_search_max_lp
#Bound  33.78s best:1188  next:[660,1187] objective_lb_search
#Bound  34.40s best:1188  next:[667,1187] objective_lb_search_no_lp
#Bound  37.91s best:1188  next:[668,1187] objective_lb_search
#Bound  38.21s best:1188  next:[669,1187] objective_lb_search_no_lp
#Bound  38.24s best:1188  next:[671,1187] objective_lb_search_no_lp
#Bound  38.43s best:1188  next:[676,1187] objective_lb_search
#Bound  39.34s best:1188  next:[677,1187] objective_lb_search_no_lp
#Bound  40.54s best:1188  next:[679,1187] objective_lb_search
#Bound  43.18s best:1188  next:[680,1187] objective_lb_search_no_lp
#Bound  43.42s best:1188  next:[681,1187] lb_tree_search (nodes=483/483 rc=2 decisions=11341 @root=54 restarts=10) 
#Bound  43.53s best:1188  next:[682,1187] lb_tree_search (nodes=488/488 rc=2 decisions=11389 @root=54 restarts=10) 
#Bound  44.04s best:1188  next:[683,1187] lb_tree_search (nodes=494/494 rc=2 decisions=11450 @root=55 restarts=10) 
#Bound  44.30s best:1188  next:[685,1187] objective_lb_search_max_lp
#Bound  45.35s best:1188  next:[692,1187] objective_lb_search
#Bound  45.92s best:1188  next:[694,1187] objective_lb_search
#Bound  47.29s best:1188  next:[695,1187] lb_tree_search (nodes=564/564 rc=2 decisions=12031 @root=59 restarts=10) 
#Bound  47.78s best:1188  next:[696,1187] lb_tree_search (nodes=567/567 rc=2 decisions=12090 @root=60 restarts=10) 
#Bound  49.65s best:1188  next:[697,1187] lb_tree_search (nodes=576/576 rc=2 decisions=12208 @root=63 restarts=10) 
#Bound  50.83s best:1188  next:[698,1187] lb_tree_search (nodes=577/577 rc=2 decisions=12265 @root=65 restarts=10) 
#Bound  52.04s best:1188  next:[699,1187] lb_tree_search (nodes=581/581 rc=2 decisions=12337 @root=67 restarts=10) 
#Bound  52.51s best:1188  next:[700,1187] lb_tree_search (nodes=584/584 rc=2 decisions=12379 @root=68 restarts=10) 
#Bound  52.98s best:1188  next:[701,1187] lb_tree_search (nodes=588/588 rc=2 decisions=12448 @root=69 restarts=10) 
#Bound  53.49s best:1188  next:[702,1187] lb_tree_search (nodes=598/598 rc=2 decisions=12526 @root=70 restarts=10) 
#Bound  53.56s best:1188  next:[703,1187] lb_tree_search (nodes=601/601 rc=2 decisions=12551 @root=70 restarts=10) 
#Bound  54.16s best:1188  next:[705,1187] lb_tree_search (nodes=615/615 rc=2 decisions=12660 @root=71 restarts=10) 
#Bound  54.79s best:1188  next:[706,1187] lb_tree_search (nodes=621/621 rc=2 decisions=12724 @root=72 restarts=10) 
#Bound  55.39s best:1188  next:[707,1187] lb_tree_search (nodes=627/627 rc=2 decisions=12774 @root=73 restarts=10) 
#Bound  56.96s best:1188  next:[708,1187] lb_tree_search (nodes=636/636 rc=2 decisions=12859 @root=75 restarts=10) 
#Bound  57.56s best:1188  next:[709,1187] lb_tree_search (nodes=641/641 rc=2 decisions=12927 @root=76 restarts=10) 
#Bound  58.22s best:1188  next:[710,1187] lb_tree_search (nodes=647/647 rc=2 decisions=12997 @root=77 restarts=10) 
#Bound  59.40s best:1188  next:[711,1187] lb_tree_search (nodes=657/657 rc=2 decisions=13089 @root=79 restarts=10) 
#Bound  60.01s best:1188  next:[712,1187] lb_tree_search (nodes=670/670 rc=2 decisions=13195 @root=80 restarts=10) 
#Bound  60.68s best:1188  next:[713,1187] lb_tree_search (nodes=677/677 rc=2 decisions=13277 @root=81 restarts=10)  [skipped_logs=0]
#Bound  61.66s best:1188  next:[715,1187] lb_tree_search (nodes=684/684 rc=2 decisions=13369 @root=83 restarts=10)  [skipped_logs=1]
#Bound  62.93s best:1188  next:[717,1187] lb_tree_search (nodes=702/702 rc=2 decisions=13554 @root=85 restarts=10)  [skipped_logs=1]
#Bound  63.90s best:1188  next:[719,1187] lb_tree_search (nodes=716/716 rc=2 decisions=13663 @root=87 restarts=10)  [skipped_logs=1]
#Bound  64.48s best:1188  next:[720,1187] lb_tree_search (nodes=722/722 rc=2 decisions=13731 @root=88 restarts=10)  [skipped_logs=0]
#Bound  65.75s best:1188  next:[722,1187] lb_tree_search (nodes=737/743 rc=2 decisions=13907 @root=90 restarts=10)  [skipped_logs=1]
#Bound  66.35s best:1188  next:[723,1187] lb_tree_search (nodes=717/745 rc=2 decisions=13950 @root=91 restarts=10)  [skipped_logs=0]
#Bound  67.84s best:1188  next:[727,1187] objective_lb_search [skipped_logs=2]
#Bound  68.85s best:1188  next:[729,1187] lb_tree_search (nodes=717/777 rc=2 decisions=14317 @root=95 restarts=10)  [skipped_logs=1]
#Bound  70.11s best:1188  next:[730,1187] lb_tree_search (nodes=715/783 rc=2 decisions=14397 @root=97 restarts=10) 
#Bound  70.87s best:1188  next:[731,1187] lb_tree_search (nodes=729/797 rc=2 decisions=14511 @root=98 restarts=10)  [skipped_logs=0]
#Bound  71.64s best:1188  next:[732,1187] lb_tree_search (nodes=744/815 rc=3 decisions=14660 @root=99 restarts=10)  [skipped_logs=0]
#Bound  72.62s best:1188  next:[733,1187] lb_tree_search (nodes=751/822 rc=3 decisions=14763 @root=100 restarts=10)  [skipped_logs=0]
#Bound  74.00s best:1188  next:[734,1187] lb_tree_search (nodes=758/829 rc=3 decisions=14830 @root=102 restarts=10)  [skipped_logs=0]
#Bound  74.66s best:1188  next:[735,1187] lb_tree_search (nodes=765/836 rc=3 decisions=14909 @root=103 restarts=10)  [skipped_logs=0]
#Bound  75.47s best:1188  next:[736,1187] lb_tree_search (nodes=780/851 rc=4 decisions=15065 @root=104 restarts=10)  [skipped_logs=0]
#Bound  76.84s best:1188  next:[738,1187] lb_tree_search (nodes=797/868 rc=4 decisions=15248 @root=106 restarts=10)  [skipped_logs=1]
#Bound  77.89s best:1188  next:[740,1187] lb_tree_search (nodes=806/877 rc=4 decisions=15381 @root=108 restarts=10)  [skipped_logs=1]
#Bound  78.35s best:1188  next:[741,1187] lb_tree_search (nodes=810/881 rc=4 decisions=15420 @root=109 restarts=10)  [skipped_logs=0]
#Bound  79.70s best:1188  next:[742,1187] lb_tree_search (nodes=825/896 rc=5 decisions=15545 @root=111 restarts=10)  [skipped_logs=0]
#Bound  80.77s best:1188  next:[743,1187] lb_tree_search (nodes=828/899 rc=5 decisions=15601 @root=113 restarts=10)  [skipped_logs=0]
#Bound  81.95s best:1188  next:[744,1187] lb_tree_search (nodes=832/903 rc=5 decisions=15701 @root=115 restarts=10)  [skipped_logs=0]
#Bound  82.72s best:1188  next:[745,1187] lb_tree_search (nodes=843/914 rc=5 decisions=15815 @root=116 restarts=10)  [skipped_logs=0]
#Bound  83.41s best:1188  next:[746,1187] lb_tree_search (nodes=854/925 rc=5 decisions=15926 @root=117 restarts=10)  [skipped_logs=0]
#Bound  84.18s best:1188  next:[747,1187] lb_tree_search (nodes=862/933 rc=5 decisions=16042 @root=118 restarts=10)  [skipped_logs=0]
#Bound  85.13s best:1188  next:[748,1187] lb_tree_search (nodes=880/951 rc=7 decisions=16207 @root=119 restarts=10)  [skipped_logs=0]
#Bound  86.61s best:1188  next:[749,1187] lb_tree_search (nodes=892/963 rc=7 decisions=16374 @root=121 restarts=10)  [skipped_logs=0]
#Bound  88.13s best:1188  next:[750,1187] lb_tree_search (nodes=904/975 rc=7 decisions=16534 @root=123 restarts=10) 
#Bound  89.82s best:1188  next:[751,1187] lb_tree_search (nodes=921/992 rc=7 decisions=16733 @root=125 restarts=10) 
#Bound  90.56s best:1188  next:[752,1187] lb_tree_search (nodes=934/1005 rc=7 decisions=16861 @root=126 restarts=10) 
#Bound  91.35s best:1188  next:[753,1187] lb_tree_search (nodes=944/1015 rc=7 decisions=16978 @root=127 restarts=10) 
#Bound  92.14s best:1188  next:[754,1187] lb_tree_search (nodes=958/1029 rc=7 decisions=17131 @root=128 restarts=10) 
#Bound  93.90s best:1188  next:[755,1187] objective_lb_search_no_lp
#Model  94.84s var:364/368 constraints:4773/4988
#Bound  95.04s best:1188  next:[756,1187] lb_tree_search (nodes=799/1058 rc=7 decisions=17368 @root=132 restarts=10) 
#Bound  96.36s best:1188  next:[757,1187] lb_tree_search (nodes=731/1063 rc=7 decisions=17453 @root=134 restarts=10) 
#Bound  97.62s best:1188  next:[759,1187] objective_lb_search_max_lp
#Bound  99.51s best:1188  next:[760,1187] lb_tree_search (nodes=581/1081 rc=7 decisions=17638 @root=139 restarts=10) 
#Bound 100.21s best:1188  next:[761,1187] objective_lb_search
#Bound 100.63s best:1188  next:[762,1187] lb_tree_search (nodes=563/1088 rc=7 decisions=17717 @root=141 restarts=10) 
#Bound 100.72s best:1188  next:[763,1187] lb_tree_search (nodes=565/1090 rc=7 decisions=17745 @root=141 restarts=10) 
#Bound 101.17s best:1188  next:[764,1187] lb_tree_search (nodes=469/1097 rc=7 decisions=17810 @root=142 restarts=10) 
#Bound 102.09s best:1188  next:[766,1187] objective_lb_search
#Bound 102.46s best:1188  next:[767,1187] objective_lb_search_no_lp [skipped_logs=0]
#Bound 103.84s best:1188  next:[771,1187] objective_lb_search_no_lp [skipped_logs=0]
#Bound 104.77s best:1188  next:[776,1187] objective_lb_search [skipped_logs=1]
#Bound 105.29s best:1188  next:[785,1187] objective_lb_search [skipped_logs=0]
#Bound 106.04s best:1188  next:[787,1187] objective_lb_search [skipped_logs=0]
#Bound 107.56s best:1188  next:[800,1187] objective_lb_search [skipped_logs=0]
#Bound 109.23s best:1188  next:[801,1187] lb_tree_search (nodes=501/501 rc=12 decisions=19519 @root=151 restarts=11) 
#Bound 109.67s best:1188  next:[802,1187] lb_tree_search (nodes=503/503 rc=12 decisions=19576 @root=152 restarts=11)  [skipped_logs=0]
#Bound 110.24s best:1188  next:[807,1187] objective_lb_search [skipped_logs=1]
#Model 111.47s var:360/368 constraints:4550/4988
#Bound 111.97s best:1188  next:[811,1187] lb_tree_search (nodes=543/543 rc=13 decisions=20076 @root=155 restarts=11)  [skipped_logs=3]
#Model 112.84s var:358/368 constraints:4432/4988
#Bound 112.84s best:1188  next:[821,1187] objective_lb_search [skipped_logs=2]
#Bound 114.01s best:1188  next:[848,1187] objective_lb_search_no_lp [skipped_logs=2]
#Bound 114.83s best:1188  next:[850,1187] objective_lb_search_no_lp [skipped_logs=1]
#Bound 115.92s best:1188  next:[872,1187] objective_lb_search [skipped_logs=2]
#Bound 116.73s best:1188  next:[875,1187] objective_lb_search [skipped_logs=0]
#Bound 117.32s best:1188  next:[928,1187] objective_lb_search_max_lp [skipped_logs=1]
#Bound 119.00s best:1188  next:[953,1187] objective_lb_search_no_lp [skipped_logs=3]
#Model 119.03s var:356/368 constraints:4259/4988
#Model 119.17s var:354/368 constraints:4142/4988
#Model 119.35s var:344/368 constraints:3369/4988
#Model 119.77s var:343/368 constraints:3323/4988
#Model 119.92s var:342/368 constraints:3293/4988
#Model 119.92s var:341/368 constraints:3263/4988
#Bound 119.98s best:1188  next:[1038,1187] objective_lb_search_no_lp [skipped_logs=11]
#Model 120.07s var:340/368 constraints:3240/4988
#Model 120.14s var:331/368 constraints:2380/4988
#Done  120.15s no_lp
#Done  120.15s objective_lb_search_no_lp
#Model 120.15s var:312/368 constraints:993/4988
#Done  120.15s core
#Model 120.16s var:311/368 constraints:961/4988
#Bound 120.15s best:1188  next:[1120,1187] objective_lb_search_no_lp [skipped_logs=8]

Task timing                                  n [     min,      max]      avg      dev     time         n [     min,      max]      avg      dev    dtime
                             'core':         1 [   1.99m,    1.99m]    1.99m   0.00ns    1.99m         1 [   1.60m,    1.60m]    1.60m   0.00ns    1.60m
                       'default_lp':         1 [   1.99m,    1.99m]    1.99m   0.00ns    1.99m         1 [  28.40s,   28.40s]   28.40s   0.00ns   28.40s
                 'feasibility_pump':       226 [151.98ms,    1.08s] 188.23ms  66.01ms   42.54s       225 [ 26.48ms,  99.27ms]  31.74ms   4.52ms    7.14s
                            'fixed':         1 [   1.99m,    1.99m]    1.99m   0.00ns    1.99m         1 [  25.90s,   25.90s]   25.90s   0.00ns   25.90s
                  'fj_long_default':         1 [401.10ms, 401.10ms] 401.10ms   0.00ns 401.10ms         1 [111.30ms, 111.30ms] 111.30ms   0.00ns 111.30ms
              'fj_long_lin_default':         1 [952.89ms, 952.89ms] 952.89ms   0.00ns 952.89ms         1 [104.59ms, 104.59ms] 104.59ms   0.00ns 104.59ms
                   'fj_long_random':         1 [198.09ms, 198.09ms] 198.09ms   0.00ns 198.09ms         1 [108.49ms, 108.49ms] 108.49ms   0.00ns 108.49ms
                 'fj_short_default':         2 [ 92.19ms, 158.09ms] 125.14ms  32.95ms 250.28ms         2 [105.11ms, 107.58ms] 106.35ms   1.23ms 212.69ms
             'fj_short_lin_default':         1 [629.82ms, 629.82ms] 629.82ms   0.00ns 629.82ms         1 [102.30ms, 102.30ms] 102.30ms   0.00ns 102.30ms
              'fj_short_lin_random':         1 [312.80ms, 312.80ms] 312.80ms   0.00ns 312.80ms         1 [110.52ms, 110.52ms] 110.52ms   0.00ns 110.52ms
                  'fj_short_random':         1 [250.37ms, 250.37ms] 250.37ms   0.00ns 250.37ms         1 [101.03ms, 101.03ms] 101.03ms   0.00ns 101.03ms
                        'fs_random':         1 [319.51ms, 319.51ms] 319.51ms   0.00ns 319.51ms         1 [  1.25ms,   1.25ms]   1.25ms   0.00ns   1.25ms
                        'fs_random':         1 [344.21ms, 344.21ms] 344.21ms   0.00ns 344.21ms         1 [ 20.00ns,  20.00ns]  20.00ns   0.00ns  20.00ns
                  'fs_random_no_lp':         1 [333.29ms, 333.29ms] 333.29ms   0.00ns 333.29ms         1 [257.67us, 257.67us] 257.67us   0.00ns 257.67us
          'fs_random_quick_restart':         1 [347.45ms, 347.45ms] 347.45ms   0.00ns 347.45ms         1 [600.26us, 600.26us] 600.26us   0.00ns 600.26us
          'fs_random_quick_restart':         1 [458.62ms, 458.62ms] 458.62ms   0.00ns 458.62ms         1 [ 20.00ns,  20.00ns]  20.00ns   0.00ns  20.00ns
    'fs_random_quick_restart_no_lp':         1 [369.52ms, 369.52ms] 369.52ms   0.00ns 369.52ms         0 [  0.00ns,   0.00ns]   0.00ns   0.00ns   0.00ns
                    'graph_arc_lns':       225 [  8.82ms,    1.43s] 677.51ms 350.76ms    2.54m       213 [ 10.00ns, 104.67ms]  61.96ms  42.81ms   13.20s
                    'graph_cst_lns':       225 [  3.66ms,    1.60s] 689.79ms 365.34ms    2.59m       205 [ 10.00ns, 104.53ms]  65.60ms  41.20ms   13.45s
                    'graph_dec_lns':       225 [  7.86ms,    1.39s] 667.23ms 347.90ms    2.50m       213 [ 10.00ns, 104.98ms]  61.44ms  43.45ms   13.09s
                    'graph_var_lns':       225 [  6.22ms,    1.77s] 693.95ms 338.22ms    2.60m       217 [ 10.00ns, 110.14ms]  63.26ms  42.75ms   13.73s
                   'lb_tree_search':         1 [   1.99m,    1.99m]    1.99m   0.00ns    1.99m         1 [  54.07s,   54.07s]   54.07s   0.00ns   54.07s
                           'max_lp':         1 [   1.99m,    1.99m]    1.99m   0.00ns    1.99m         1 [  35.67s,   35.67s]   35.67s   0.00ns   35.67s
                            'no_lp':         1 [   1.99m,    1.99m]    1.99m   0.00ns    1.99m         1 [  22.44s,   22.44s]   22.44s   0.00ns   22.44s
              'objective_lb_search':         1 [   1.99m,    1.99m]    1.99m   0.00ns    1.99m         1 [  34.20s,   34.20s]   34.20s   0.00ns   34.20s
       'objective_lb_search_max_lp':         1 [   1.99m,    1.99m]    1.99m   0.00ns    1.99m         1 [  44.80s,   44.80s]   44.80s   0.00ns   44.80s
        'objective_lb_search_no_lp':         1 [   1.99m,    1.99m]    1.99m   0.00ns    1.99m         1 [  17.71s,   17.71s]   17.71s   0.00ns   17.71s
  'objective_shaving_search_max_lp':       162 [ 28.89ms,    3.47s] 722.09ms 581.46ms    1.95m       144 [113.46us, 625.84ms]  88.09ms 104.16ms   12.69s
   'objective_shaving_search_no_lp':       162 [  7.55ms,    3.47s] 717.12ms 585.63ms    1.94m       145 [165.89us, 446.21ms]  68.08ms  73.52ms    9.87s
                          'probing':         1 [   1.99m,    1.99m]    1.99m   0.00ns    1.99m         1 [  18.34s,   18.34s]   18.34s   0.00ns   18.34s
                   'probing_max_lp':         1 [   1.99m,    1.99m]    1.99m   0.00ns    1.99m         1 [  18.46s,   18.46s]   18.46s   0.00ns   18.46s
                     'pseudo_costs':         1 [   1.99m,    1.99m]    1.99m   0.00ns    1.99m         1 [  32.79s,   32.79s]   32.79s   0.00ns   32.79s
                    'quick_restart':         1 [   1.99m,    1.99m]    1.99m   0.00ns    1.99m         1 [  35.85s,   35.85s]   35.85s   0.00ns   35.85s
              'quick_restart_no_lp':         1 [   1.99m,    1.99m]    1.99m   0.00ns    1.99m         1 [  29.06s,   29.06s]   29.06s   0.00ns   29.06s
                    'reduced_costs':         1 [   1.99m,    1.99m]    1.99m   0.00ns    1.99m         1 [  35.25s,   35.25s]   35.25s   0.00ns   35.25s
                        'rins/rens':       226 [150.99us,    1.04s] 469.99ms 345.99ms    1.77m       199 [ 10.00ns, 100.87ms]  63.81ms  43.01ms   12.70s
                      'rnd_cst_lns':       225 [  4.08ms,    1.64s] 674.69ms 349.79ms    2.53m       213 [ 10.00ns, 102.81ms]  61.34ms  41.84ms   13.07s
                      'rnd_var_lns':       225 [  5.89ms,    1.25s] 665.17ms 342.69ms    2.49m       212 [ 10.00ns, 106.60ms]  62.79ms  42.93ms   13.31s
         'scheduling_intervals_lns':       225 [221.65ms,    1.63s]    1.00s 139.15ms    3.75m       223 [100.00ms, 165.10ms] 103.66ms   4.86ms   23.12s
       'scheduling_precedences_lns':       225 [189.09ms,    1.75s] 994.19ms 134.70ms    3.73m       222 [100.00ms, 208.49ms] 103.82ms   7.49ms   23.05s
       'scheduling_time_window_lns':       225 [208.70ms,    1.59s] 997.78ms 135.95ms    3.74m       223 [ 56.00ms, 200.15ms] 103.65ms   7.65ms   23.11s
                     'violation_ls':       226 [  9.64ms, 244.57ms] 103.36ms  24.83ms   23.36s       226 [143.58us, 129.06ms] 102.37ms  13.16ms   23.14s
                     'violation_ls':       226 [779.46us, 288.78ms] 100.80ms  47.21ms   22.78s       226 [790.00ns, 145.56ms]  79.64ms  35.85ms   18.00s

Search stats                        Bools  Conflicts  Branches  Restarts  BoolPropag  IntegerPropag
                           'core':  4'090     49'473    77'364     6'219  66'935'919     46'128'024
                     'default_lp':     95     28'147   120'201    22'178     833'988     41'092'600
                          'fixed':  1'032    105'806   449'239       423  12'905'835     47'212'087
                      'fs_random':     95          0         0         0           0              0
                      'fs_random':     95          0       190       190           6          7'223
                'fs_random_no_lp':     98          0       193       190          45          7'965
        'fs_random_quick_restart':     95          0         0         0           0              0
        'fs_random_quick_restart':     95          0       190       190           6          7'221
  'fs_random_quick_restart_no_lp':     95          0       102       102           6          3'867
                 'lb_tree_search':    105        139   219'547    83'251     700'306     22'544'165
                         'max_lp':     95     21'370   118'123    22'943     771'853     34'200'813
                          'no_lp':  1'817     63'306   141'436    11'685  24'784'954     66'729'423
            'objective_lb_search':    254     16'271   107'806    21'024   1'092'879     33'817'358
     'objective_lb_search_max_lp':    208      9'461   128'023    27'872     942'256     31'356'782
      'objective_lb_search_no_lp':    380     48'116   100'294     8'078   1'805'869     54'871'031
                        'probing':    651        388     2'045     1'581      39'834        317'015
                 'probing_max_lp':    651        418     1'062     1'062      34'632        263'344
                   'pseudo_costs':     95     21'797   122'006    23'607     789'347     34'278'503
                  'quick_restart':  1'675     15'589   116'163    13'754  11'032'905     26'701'576
            'quick_restart_no_lp':  2'432     62'803   206'931    13'938  31'055'588     59'505'083
                  'reduced_costs':  4'697     36'918   166'105    14'872  52'040'071     33'860'852

SAT stats                           ClassicMinim  LitRemoved  LitLearned  LitForgotten  Subsumed  MClauses  MDecisions  MLitTrue  MSubsumed  MLitRemoved  MReused
                           'core':        44'485     209'529     341'212         3'379       498     2'567      12'850         0         40          131       63
                     'default_lp':        15'649      32'444     357'376       140'062     1'238     9'209      76'906         0        523        3'480    1'274
                          'fixed':        87'336     293'443   1'760'247     1'144'856        19         2           8         0          0            0        2
                      'fs_random':             0           0           0             0         0         0           0         0          0            0        0
                      'fs_random':             0           0           0             0         0         0           0         0          0            0        0
                'fs_random_no_lp':             0           0           0             0         0         0           0         0          0            0        0
        'fs_random_quick_restart':             0           0           0             0         0         0           0         0          0            0        0
        'fs_random_quick_restart':             0           0           0             0         0         0           0         0          0            0        0
  'fs_random_quick_restart_no_lp':             0           0           0             0         0         0           0         0          0            0        0
                 'lb_tree_search':             1           1         415             0         1    31'145     160'189         0         23           88    2'889
                         'max_lp':        11'838      25'974     268'453       116'468       890     9'149      81'234         0        551        4'116    2'185
                          'no_lp':        50'125     206'335     889'277       624'921       581     4'911      37'383         2      1'176        6'946      686
            'objective_lb_search':        12'201      32'813     116'642            79       678     8'695      77'524         0      1'840       11'175    1'963
     'objective_lb_search_max_lp':         6'376      15'615      72'317             0       458    10'357      99'786         2        995        6'197    2'732
      'objective_lb_search_no_lp':        38'864     116'631     384'911        82'102     1'044     3'912      39'081         7      1'698       11'444      774
                        'probing':             0           0         388             0         0         0           0         0          0            0        0
                 'probing_max_lp':             0           0         418             0         0         0           0         0          0            0        0
                   'pseudo_costs':        12'119      25'047     229'777        50'424     1'096    10'532      86'763         3      2'168       15'180    1'345
                  'quick_restart':        10'484      35'270     142'853             0       391     8'115      76'458        85      5'584       45'156    1'250
            'quick_restart_no_lp':        47'499     209'233     775'663       252'963       443     5'342      48'028        30      4'007       35'373      544
                  'reduced_costs':        25'453      97'438     442'521       160'784       555     7'807      61'325         1      4'463       26'431    1'230

Lp stats                         Component  Iterations  AddedCuts  OPTIMAL  DUAL_F.  DUAL_U.
                  'default_lp':          1     385'611     20'879   46'074        0        0
                       'fixed':          1      21'981      1'592  102'211        0        0
                   'fs_random':          1           0          0        0        0        0
                   'fs_random':          1         307        481        9        0        0
     'fs_random_quick_restart':          1           0          0        0        0        0
     'fs_random_quick_restart':          1         242        268        7        0        0
              'lb_tree_search':          1     610'946     16'587   16'620    5'605        1
                      'max_lp':          1     540'097     20'581   32'701   15'585       25
         'objective_lb_search':          1     488'324     13'205   28'185        0        0
  'objective_lb_search_max_lp':          1     535'485     11'573   14'403    4'700        3
                     'probing':          1     117'778     19'253    7'037        0        1
              'probing_max_lp':          1      45'757     16'227    4'252      193        0
                'pseudo_costs':          1     477'793     24'152   30'232   12'940       13
               'quick_restart':          1     411'198     14'288   25'986        0        1
               'reduced_costs':          1     344'580     39'726   40'817   12'884        2

Lp dimension                                                                      Final dimension of first component
                  'default_lp':   765 rows, 361 columns, 2190 entries with magnitude in [1.364733e-05, 1.000000e+00]
                       'fixed':    234 rows, 361 columns, 911 entries with magnitude in [4.478813e-02, 1.000000e+00]
                   'fs_random':        0 rows, 361 columns, 0 entries with magnitude in [0.000000e+00, 0.000000e+00]
                   'fs_random':    256 rows, 361 columns, 939 entries with magnitude in [8.657776e-03, 1.000000e+00]
     'fs_random_quick_restart':        0 rows, 361 columns, 0 entries with magnitude in [0.000000e+00, 0.000000e+00]
     'fs_random_quick_restart':    206 rows, 361 columns, 779 entries with magnitude in [4.609742e-02, 1.000000e+00]
              'lb_tree_search':  1097 rows, 368 columns, 3658 entries with magnitude in [3.268602e-04, 1.000000e+00]
                      'max_lp':   739 rows, 368 columns, 2742 entries with magnitude in [1.538644e-03, 1.000000e+00]
         'objective_lb_search':   786 rows, 361 columns, 3865 entries with magnitude in [8.362470e-06, 1.000000e+00]
  'objective_lb_search_max_lp':  1107 rows, 368 columns, 3467 entries with magnitude in [2.756176e-03, 1.000000e+00]
                     'probing':  1046 rows, 361 columns, 5087 entries with magnitude in [3.111056e-04, 1.000000e+00]
              'probing_max_lp':  1213 rows, 368 columns, 3786 entries with magnitude in [4.477720e-03, 1.000000e+00]
                'pseudo_costs':  1184 rows, 368 columns, 4580 entries with magnitude in [8.190499e-04, 1.000000e+00]
               'quick_restart':   885 rows, 361 columns, 4255 entries with magnitude in [2.288383e-04, 1.000000e+00]
               'reduced_costs':  1426 rows, 368 columns, 5375 entries with magnitude in [2.669412e-05, 1.000000e+00]

Lp debug                         CutPropag  CutEqPropag  Adjust  Overflow        Bad  BadScaling
                  'default_lp':         87           23  19'741         0    433'397           0
                       'fixed':          0            1      27         0      6'667           0
                   'fs_random':          0            0       0         0          0           0
                   'fs_random':          0            0       0         0      1'474           0
     'fs_random_quick_restart':          0            0       0         0          0           0
     'fs_random_quick_restart':          0            0       0         0        338           0
              'lb_tree_search':        170            5  14'484         0    909'508           0
                      'max_lp':         74           12  16'996         0    389'270           0
         'objective_lb_search':        119           17  14'188         0    642'189           0
  'objective_lb_search_max_lp':        105            7  11'393         0    458'948           0
                     'probing':         90           61   6'172         0  7'003'288           0
              'probing_max_lp':        116           51   4'399         0  5'159'423           0
                'pseudo_costs':        274           42  16'489         0    466'555           0
               'quick_restart':        167           53  14'667         0  1'446'774           0
               'reduced_costs':        136           66  23'433         0    664'227           0

Lp pool                          Constraints  Updates  Simplif  Merged  Shortened   Split  Strenghtened       Cuts/Call
                  'default_lp':        9'962    1'220  107'948     328     11'913  13'529        23'058   20'879/58'973
                       'fixed':        2'003       15       15       0          0      28           307     1'592/2'594
                   'fs_random':          411        0        0       0          0       0             0             0/0
                   'fs_random':          892        4        0       0          0       1            54         481/808
     'fs_random_quick_restart':          411        0        0       0          0       0             0             0/0
     'fs_random_quick_restart':          679        0        0       0          0       0            15         268/458
              'lb_tree_search':       14'493    1'827  299'360      76     20'968  18'077       132'151   16'587/47'061
                      'max_lp':       14'220    1'043   92'180     343      3'362   8'183        85'140   20'581/54'061
         'objective_lb_search':        9'513    1'420  253'911     103     10'068  19'980        29'579   13'205/45'122
  'objective_lb_search_max_lp':       14'511    1'353  241'988      44     15'428   7'845       120'971   11'573/31'652
                     'probing':        9'648    2'278  222'689      16      4'755  62'812        14'648   19'253/41'611
              'probing_max_lp':       14'176    1'927   90'740      33     14'610  22'172        54'073   16'227/42'151
                'pseudo_costs':       13'723    1'680  291'580     411     18'622   8'525       128'082   24'152/64'595
               'quick_restart':        9'646    1'793  645'118      53      5'364  91'927        35'031   14'288/44'352
               'reduced_costs':       14'081    1'944  283'963     627     19'027  16'750       128'971  39'726/102'122

Lp Cut                                                fs_ran  fs_ran  defaul  fixed  max_lp  quick_  reduce  pseudo  lb_tre  probin  object  probin  object
                                              CG_FF:      26      17   1'135     73     896     406   2'125     790     331     438     587     261     268
                                               CG_K:      20      18     708     60     715     196   1'796     617     257     253     402     191     161
                                               CG_R:      16      13   1'196     73     558     395   1'926     544     275     789     550     337     159
                                              CG_RB:      22       7   3'239    224   2'490   1'840   4'799   2'776   1'716   1'703   2'293   1'150   1'577
                                             CG_RBP:       -       -     382     12     278     132     810     291     151     185     193     123      94
                                             Clique:       -       -       -      -     104       -     294     163     160       -       -      82     153
                                                 IB:     167     124   3'224    416   2'319   1'645   4'826   2'597   1'123   2'068   1'530     715   1'062
                                           MIR_1_FF:      48      37     794     75     890     777   1'625   1'109     681     943     649     577     467
                                            MIR_1_K:       5       4     134      8     178      95     343     267     104     107      84      61      75
                                           MIR_1_KL:       -       -      26      -      11       5      12      15       3      50       9       1       -
                                            MIR_1_R:      13      12     254     17     133     166     370     199      72     146     142      57      57
                                           MIR_1_RB:      46      15   1'802    142   2'127   1'520   3'608   2'638   1'559   1'933   1'208   1'242   1'096
                                          MIR_1_RBP:       9       1     133     28     400      87     485     349     203      93      81     189     129
                                          MIR_1_RLT:       -       -       -      -       -       -       -       -       -       -       -       1       -
                                           MIR_2_FF:      21       6     569     42     528     419   1'106     764     420     473     453     292     292
                                            MIR_2_K:       5       2     123      5     102      65     252     162      69      66      69      35      53
                                           MIR_2_KL:       -       -      17      -       8       6      12      12       -      39       6       1       1
                                            MIR_2_R:       6       3     180     11     162     135     383     258     134     203     111     152     113
                                           MIR_2_RB:      22       3   1'222     77   1'203   1'059   2'283   1'614     883   1'306     896     603     606
                                          MIR_2_RBP:       4       -     169     22     227      85     389     275     101     119      95      65      77
                                           MIR_3_FF:       3       1     378     24     460     248     957     593     329     269     267     200     220
                                            MIR_3_K:       2       1      76      3     128      38     251     183      72      44      50      47      56
                                           MIR_3_KL:       -       -      18      1      13       9       8      11       -      24       9       2       -
                                            MIR_3_R:       1       1     125      8     209     107     405     255     175     138      87     139     117
                                           MIR_3_RB:      12       -     826     35     896     660   1'565   1'126     651     797     559     400     436
                                          MIR_3_RBP:       4       -     115      3     160      51     302     170      82      69      71      41      61
                                           MIR_4_FF:       6       -     247     18     285     176     540     380     195     185     182     114     119
                                            MIR_4_K:       1       1      71      4      90      32     185     125      54      44      50      26      38
                                           MIR_4_KL:       -       -      11      2       5      13       9      16       -      38      14       -       -
                                            MIR_4_R:       -       -     114      6     138     105     285     200     108     115      94     103      86
                                           MIR_4_RB:       6       1     550     20     530     430     914     686     401     598     358     241     267
                                          MIR_4_RBP:       -       -      63      6      90      44     149     102      42      55      35      21      30
                                           MIR_5_FF:       1       -     181      8     163     145     325     209     130     130     130      73      97
                                            MIR_5_K:       -       -      61      1      73      28     127      91      36      23      18      24      26
                                           MIR_5_KL:       -       -      18      1       6       8       9      12       -      21      13       1       -
                                            MIR_5_R:       -       -      91      6     100      90     177     126      92      88      71      55      52
                                           MIR_5_RB:       -       -     332     17     323     281     586     418     250     356     228     168     193
                                          MIR_5_RBP:       -       -      34      -      51      30      90      66      25      26      17      13      16
                                           MIR_6_FF:       2       -     104      6      99      69     202     137      80      92      81      33      60
                                            MIR_6_K:       -       -      45      2      60      35     106      73      36      35      28      18      25
                                           MIR_6_KL:       -       -      17      1       3       9      11       7       2      15       2       -       -
                                            MIR_6_R:       -       -      47      3      66      50     101      68      49      54      41      30      39
                                           MIR_6_RB:       -       -     205     12     183     144     351     251     134     216     132      64      79
                                          MIR_6_RBP:       -       -      23      -      31      22      72      40      16      24      11       6      11
         NoOverlapCompletionTimeExhaustive_weighted:       -       -       -      -      18       -      61      22       6       -       -      10       8
  NoOverlapCompletionTimeExhaustive_weighted_lifted:       -       -       -      -       1       -       2       1       1       -       -       1       -
                        NoOverlapDisjunctionOnStart:       -       -       -      -       8       -      37      11       5       -       -       6       3
                                       ZERO_HALF_FF:       4       -     159     16     167      64     328     229     110     100      98      75      72
                                        ZERO_HALF_K:       -       -      25      3      67      15     144      74      18      15      12      13       9
                                        ZERO_HALF_R:       5       1   1'162     50   2'158   1'940   3'017   2'250   4'651   4'055     908   7'146   2'610
                                       ZERO_HALF_RB:       3       -     394     41     562     302     778     640     487     436     238     827     349
                                      ZERO_HALF_RBP:       1       -      80     10     109     110     188     140     108     277      43     195      54

LNS stats                        Improv/Calls  Closed  Difficulty  TimeLimit
               'graph_arc_lns':        18/225     55%        0.99       0.10
               'graph_cst_lns':        11/212     55%        0.99       0.10
               'graph_dec_lns':        20/225     54%        0.99       0.10
               'graph_var_lns':        12/224     53%        0.99       0.11
                   'rins/rens':        17/213     51%        0.86       0.10
                 'rnd_cst_lns':        16/222     55%        0.99       0.10
                 'rnd_var_lns':        22/225     56%        1.00       0.11
    'scheduling_intervals_lns':         4/225      0%        0.00       0.11
  'scheduling_precedences_lns':         6/225      0%        0.00       0.11
  'scheduling_time_window_lns':         3/224      0%        0.00       0.11

LS stats                   Batches  Restarts   LinMoves  GenMoves  CompoundMoves  WeightUpdates
       'fj_long_default':        1         1      9'867         0              0            133
   'fj_long_lin_default':        1         1          0     2'179            411              0
        'fj_long_random':        1         1      9'390         0              0            124
      'fj_short_default':        2         1          0     4'370            506              0
  'fj_short_lin_default':        1         1          0     2'018            385              0
   'fj_short_lin_random':        1         1          0     2'575            283              0
       'fj_short_random':        1         1          0     2'468            291              0
          'violation_ls':      226         0  1'648'900    42'487          2'461        522'755
          'violation_ls':      226         0    153'568   697'677         55'779          8'287

Solutions (58)                   Num     Rank
               'graph_arc_lns':    1  [55,55]
                       'no_lp':   35   [2,56]
         'quick_restart_no_lp':   13   [1,52]
                 'rnd_var_lns':    3  [53,58]
  'scheduling_precedences_lns':    1  [47,47]
                'violation_ls':    5  [30,51]

Objective bounds                     Num
                       'bool_core':   42
                      'default_lp':    1
                  'initial_domain':    1
                  'lb_tree_search':   75
             'objective_lb_search':   31
      'objective_lb_search_max_lp':   10
       'objective_lb_search_no_lp':   72
  'objective_shaving_search_no_lp':    2

Solution repositories    Added  Queried  Ignored  Synchro
  'feasible solutions':  2'159    5'125        2    2'047
        'lp solutions':  1'159      114        0      929
                'pump':  4'714      112

Improving bounds shared            Num
                        'core':     74
                  'default_lp':    158
              'lb_tree_search':    568
                      'max_lp':    133
                       'no_lp':  1'018
         'objective_lb_search':    132
  'objective_lb_search_max_lp':     73
   'objective_lb_search_no_lp':     14
                     'probing':  1'163
              'probing_max_lp':    586
                'pseudo_costs':    457
               'quick_restart':  1'314
         'quick_restart_no_lp':  2'566
               'reduced_costs':    444

Clauses shared                   Num
                        'core':    7
                  'default_lp':   71
              'lb_tree_search':   73
                      'max_lp':    4
                       'no_lp':   40
         'objective_lb_search':   61
  'objective_lb_search_max_lp':   35
   'objective_lb_search_no_lp':   10
                'pseudo_costs':   70
               'quick_restart':   10
         'quick_restart_no_lp':   39
               'reduced_costs':    5

CpSolverResponse summary:
status: OPTIMAL
objective: 1188
best_bound: 1188
integers: 364
booleans: 95
conflicts: 0
branches: 190
propagations: 6
integer_propagations: 7223
restarts: 190
lp_iterations: 307
walltime: 120.299
usertime: 120.299
deterministic_time: 762.594
gap_integral: 1626.19
solution_fingerprint: 0xaa0d89298a7086eb


--- Simulation Gantt  partir du modle mathmatique ---
