created virtual environment CPython3.12.4.final.0-64 in 12815ms
  creator CPython3Posix(dest=/localscratch/aneumann.46806166.0/env, clear=False, no_vcs_ignore=False, global=False)
  seeder FromAppData(download=False, pip=bundle, via=copy, app_data_dir=/home/aneumann/.local/share/virtualenv)
    added seed packages: pip==24.2+computecanada
  activators BashActivator,CShellActivator,FishActivator,NushellActivator,PowerShellActivator,PythonActivator
Looking in links: /cvmfs/soft.computecanada.ca/custom/python/wheelhouse/gentoo2023/x86-64-v3, /cvmfs/soft.computecanada.ca/custom/python/wheelhouse/gentoo2023/generic, /cvmfs/soft.computecanada.ca/custom/python/wheelhouse/generic
Requirement already satisfied: pip in /localscratch/aneumann.46806166.0/env/lib/python3.12/site-packages (24.2+computecanada)
Processing /cvmfs/soft.computecanada.ca/custom/python/wheelhouse/generic/pip-25.0+computecanada-py3-none-any.whl
Installing collected packages: pip
  Attempting uninstall: pip
    Found existing installation: pip 24.2+computecanada
    Uninstalling pip-24.2+computecanada:
      Successfully uninstalled pip-24.2+computecanada
Successfully installed pip-24.2+computecanada
Looking in links: /cvmfs/soft.computecanada.ca/custom/python/wheelhouse/gentoo2023/x86-64-v3, /cvmfs/soft.computecanada.ca/custom/python/wheelhouse/gentoo2023/generic, /cvmfs/soft.computecanada.ca/custom/python/wheelhouse/generic
ERROR: protobuf-5.28.3-cp38-abi3-manylinux2014_x86_64.whl is not a supported wheel on this platform.
Looking in links: /cvmfs/soft.computecanada.ca/custom/python/wheelhouse/gentoo2023/x86-64-v3, /cvmfs/soft.computecanada.ca/custom/python/wheelhouse/gentoo2023/generic, /cvmfs/soft.computecanada.ca/custom/python/wheelhouse/generic
Processing /home/aneumann/projects/def-adhaj/aneumann/GNRS/wheels/immutabledict-4.2.0-py3-none-any.whl
Installing collected packages: immutabledict
Successfully installed immutabledict-4.2.0
Looking in links: /cvmfs/soft.computecanada.ca/custom/python/wheelhouse/gentoo2023/x86-64-v3, /cvmfs/soft.computecanada.ca/custom/python/wheelhouse/gentoo2023/generic, /cvmfs/soft.computecanada.ca/custom/python/wheelhouse/generic
Processing /cvmfs/soft.computecanada.ca/custom/python/wheelhouse/generic/ortools-9.10.4067+computecanada-cp312-cp312-linux_x86_64.whl (from -r /home/aneumann/projects/def-adhaj/aneumann/GNRS/requirements/or.txt (line 1))
Processing /cvmfs/soft.computecanada.ca/custom/python/wheelhouse/gentoo2023/x86-64-v3/matplotlib-3.10.0+computecanada-cp312-cp312-linux_x86_64.whl (from -r /home/aneumann/projects/def-adhaj/aneumann/GNRS/requirements/or.txt (line 2))
Processing /cvmfs/soft.computecanada.ca/custom/python/wheelhouse/gentoo2023/x86-64-v3/pandas-2.2.3+computecanada-cp312-cp312-linux_x86_64.whl (from -r /home/aneumann/projects/def-adhaj/aneumann/GNRS/requirements/or.txt (line 3))
Processing /cvmfs/soft.computecanada.ca/custom/python/wheelhouse/generic/absl_py-2.3.0+computecanada-py3-none-any.whl (from ortools<9.11,>=9.10->-r /home/aneumann/projects/def-adhaj/aneumann/GNRS/requirements/or.txt (line 1))
Processing /cvmfs/soft.computecanada.ca/custom/python/wheelhouse/gentoo2023/generic/numpy-2.2.2+computecanada-cp312-cp312-linux_x86_64.whl (from ortools<9.11,>=9.10->-r /home/aneumann/projects/def-adhaj/aneumann/GNRS/requirements/or.txt (line 1))
Processing /cvmfs/soft.computecanada.ca/custom/python/wheelhouse/gentoo2023/x86-64-v3/protobuf-6.31.1+computecanada-cp312-cp312-linux_x86_64.whl (from ortools<9.11,>=9.10->-r /home/aneumann/projects/def-adhaj/aneumann/GNRS/requirements/or.txt (line 1))
Requirement already satisfied: immutabledict>=3.0.0 in /localscratch/aneumann.46806166.0/env/lib/python3.12/site-packages (from ortools<9.11,>=9.10->-r /home/aneumann/projects/def-adhaj/aneumann/GNRS/requirements/or.txt (line 1)) (4.2.0)
Processing /cvmfs/soft.computecanada.ca/custom/python/wheelhouse/gentoo2023/generic/contourpy-1.3.1+computecanada-cp312-cp312-linux_x86_64.whl (from matplotlib->-r /home/aneumann/projects/def-adhaj/aneumann/GNRS/requirements/or.txt (line 2))
Processing /cvmfs/soft.computecanada.ca/custom/python/wheelhouse/generic/cycler-0.12.1+computecanada-py3-none-any.whl (from matplotlib->-r /home/aneumann/projects/def-adhaj/aneumann/GNRS/requirements/or.txt (line 2))
Processing /cvmfs/soft.computecanada.ca/custom/python/wheelhouse/generic/fonttools-4.59.0+computecanada-cp312-cp312-linux_x86_64.whl (from matplotlib->-r /home/aneumann/projects/def-adhaj/aneumann/GNRS/requirements/or.txt (line 2))
Processing /cvmfs/soft.computecanada.ca/custom/python/wheelhouse/gentoo2023/x86-64-v3/kiwisolver-1.4.8+computecanada-cp312-cp312-linux_x86_64.whl (from matplotlib->-r /home/aneumann/projects/def-adhaj/aneumann/GNRS/requirements/or.txt (line 2))
Processing /cvmfs/soft.computecanada.ca/custom/python/wheelhouse/generic/packaging-25.0+computecanada-py3-none-any.whl (from matplotlib->-r /home/aneumann/projects/def-adhaj/aneumann/GNRS/requirements/or.txt (line 2))
Processing /cvmfs/soft.computecanada.ca/custom/python/wheelhouse/gentoo2023/x86-64-v3/pillow-11.1.0+computecanada-cp312-cp312-linux_x86_64.whl (from matplotlib->-r /home/aneumann/projects/def-adhaj/aneumann/GNRS/requirements/or.txt (line 2))
Processing /cvmfs/soft.computecanada.ca/custom/python/wheelhouse/generic/pyparsing-3.2.3+computecanada-py3-none-any.whl (from matplotlib->-r /home/aneumann/projects/def-adhaj/aneumann/GNRS/requirements/or.txt (line 2))
Processing /cvmfs/soft.computecanada.ca/custom/python/wheelhouse/generic/python_dateutil-2.9.0.post0+computecanada-py2.py3-none-any.whl (from matplotlib->-r /home/aneumann/projects/def-adhaj/aneumann/GNRS/requirements/or.txt (line 2))
Processing /cvmfs/soft.computecanada.ca/custom/python/wheelhouse/generic/pytz-2025.2+computecanada-py2.py3-none-any.whl (from pandas->-r /home/aneumann/projects/def-adhaj/aneumann/GNRS/requirements/or.txt (line 3))
Processing /cvmfs/soft.computecanada.ca/custom/python/wheelhouse/generic/tzdata-2025.2+computecanada-py2.py3-none-any.whl (from pandas->-r /home/aneumann/projects/def-adhaj/aneumann/GNRS/requirements/or.txt (line 3))
Processing /cvmfs/soft.computecanada.ca/custom/python/wheelhouse/generic/six-1.17.0+computecanada-py2.py3-none-any.whl (from python-dateutil>=2.7->matplotlib->-r /home/aneumann/projects/def-adhaj/aneumann/GNRS/requirements/or.txt (line 2))
Installing collected packages: pytz, tzdata, six, pyparsing, protobuf, pillow, packaging, numpy, kiwisolver, fonttools, cycler, absl-py, python-dateutil, contourpy, pandas, matplotlib, ortools
Successfully installed absl-py-2.3.0+computecanada contourpy-1.3.1+computecanada cycler-0.12.1+computecanada fonttools-4.59.0+computecanada kiwisolver-1.4.8+computecanada matplotlib-3.10.0+computecanada numpy-2.2.2+computecanada ortools-9.10.4067+computecanada packaging-25.0+computecanada pandas-2.2.3+computecanada pillow-11.1.0+computecanada protobuf-6.31.1+computecanada pyparsing-3.2.3+computecanada python-dateutil-2.9.0.post0+computecanada pytz-2025.2+computecanada six-1.17.0+computecanada tzdata-2025.2+computecanada

Starting CP-SAT solver v9.10.4067
Parameters: max_time_in_seconds: 86400 max_memory_in_mb: 185000 log_search_progress: true enumerate_all_solutions: false num_search_workers: 32 absolute_gap_limit: 0 relative_gap_limit: 0

Initial optimization model '': (model_fingerprint: 0x850373401c084b69)
#Variables: 298 (#ints: 9 in objective)
  - 213 Booleans in [0,1]
  - 85 in [0,593]
#kLinear1: 41
#kLinear2: 426
#kLinear3: 198
#kLinearN: 3'530 (#terms: 50'531)

Starting presolve at 0.00s
  1.46e-03s  0.00e+00d  [DetectDominanceRelations] 
  2.24e-02s  0.00e+00d  [PresolveToFixPoint] #num_loops=8 #num_dual_strengthening=3 
  3.63e-05s  0.00e+00d  [ExtractEncodingFromLinear] #potential_supersets=4 
[Symmetry] Graph for symmetry has 4'051 nodes and 38'067 arcs.
[Symmetry] Symmetry computation done. time: 0.00153017 dtime: 0.00306259
[Symmetry] #generators: 1, average support size: 24
[Symmetry] The model contains 175 duplicate constraints !
[Symmetry] 12 orbits with sizes: 2,2,2,2,2,2,2,2,2,2,...
[Symmetry] Num fixable by intersecting at_most_one with orbits: 1 largest_orbit: 2
  8.25e-03s  1.93e-03d  [Probe] #probed=296 #new_bounds=9 #equiv=1 
  8.85e-05s  0.00e+00d  [MaxClique] Merged 26(52 literals) into 11(22 literals) at_most_ones. 
  1.34e-03s  0.00e+00d  [DetectDominanceRelations] 
  1.00e-02s  0.00e+00d  [PresolveToFixPoint] #num_loops=5 #num_dual_strengthening=3 
  4.32e-03s  0.00e+00d  [ProcessAtMostOneAndLinear] 
  1.80e-03s  0.00e+00d  [DetectDuplicateConstraints] #duplicates=241 #without_enforcements=225 
  1.92e-03s  1.82e-04d  [DetectDominatedLinearConstraints] #relevant_constraints=2'933 #num_inclusions=2'760 
  3.27e-04s  0.00e+00d  [DetectDifferentVariables] #different=27 #cliques=1 #size=6 
  4.18e-04s  4.82e-05d  [ProcessSetPPC] #relevant_constraints=2'412 
  1.68e-05s  0.00e+00d  [FindAlmostIdenticalLinearConstraints] 
  1.39e-04s  1.78e-04d  [FindBigAtMostOneAndLinearOverlap] 
  4.89e-03s  3.20e-03d  [FindBigVerticalLinearOverlap] #blocks=51 #saved_nz=7'583 
  2.58e-04s  1.06e-04d  [FindBigHorizontalLinearOverlap] #linears=2'332 
  2.11e-05s  0.00e+00d  [MergeClauses] 
  1.42e-03s  0.00e+00d  [DetectDominanceRelations] 
  1.76e-02s  0.00e+00d  [PresolveToFixPoint] #num_loops=2 #num_dual_strengthening=1 
  1.42e-03s  0.00e+00d  [DetectDominanceRelations] 
  9.80e-03s  0.00e+00d  [PresolveToFixPoint] #num_loops=1 #num_dual_strengthening=1 
[Symmetry] Graph for symmetry has 3'948 nodes and 29'476 arcs.
[Symmetry] Symmetry computation done. time: 0.000596308 dtime: 0.00161752
  7.39e-03s  1.76e-03d  [Probe] #probed=296 #new_bounds=34 
  1.08e-05s  0.00e+00d  [MaxClique] 
  1.42e-03s  0.00e+00d  [DetectDominanceRelations] 
  1.55e-02s  0.00e+00d  [PresolveToFixPoint] #num_loops=2 #num_dual_strengthening=1 
  3.75e-03s  0.00e+00d  [ProcessAtMostOneAndLinear] 
  1.58e-03s  0.00e+00d  [DetectDuplicateConstraints] #without_enforcements=259 
  1.03e-03s  8.53e-05d  [DetectDominatedLinearConstraints] #relevant_constraints=2'629 #num_inclusions=749 
  1.82e-04s  0.00e+00d  [DetectDifferentVariables] 
  3.65e-04s  3.11e-05d  [ProcessSetPPC] #relevant_constraints=2'192 
  2.30e-05s  1.50e-07d  [FindAlmostIdenticalLinearConstraints] #num_tested_pairs=10 
  7.08e-05s  8.78e-05d  [FindBigAtMostOneAndLinearOverlap] 
  2.53e-03s  1.99e-03d  [FindBigVerticalLinearOverlap] #blocks=42 #saved_nz=2'525 
  2.22e-04s  8.45e-05d  [FindBigHorizontalLinearOverlap] #linears=2'061 
  9.67e-06s  0.00e+00d  [MergeClauses] 
  1.31e-03s  0.00e+00d  [DetectDominanceRelations] 
  1.42e-02s  0.00e+00d  [PresolveToFixPoint] #num_loops=2 #num_dual_strengthening=1 
  1.30e-03s  0.00e+00d  [DetectDominanceRelations] 
  1.00e-02s  0.00e+00d  [PresolveToFixPoint] #num_loops=1 #num_dual_strengthening=1 
[Symmetry] Graph for symmetry has 4'059 nodes and 26'978 arcs.
[Symmetry] Symmetry computation done. time: 0.000594998 dtime: 0.00150933
  6.67e-03s  1.64e-03d  [Probe] #probed=296 #new_bounds=34 
  9.87e-06s  0.00e+00d  [MaxClique] 
  1.30e-03s  0.00e+00d  [DetectDominanceRelations] 
  1.30e-02s  0.00e+00d  [PresolveToFixPoint] #num_loops=2 #num_dual_strengthening=1 
  3.45e-03s  0.00e+00d  [ProcessAtMostOneAndLinear] 
  1.59e-03s  0.00e+00d  [DetectDuplicateConstraints] #without_enforcements=270 
  8.44e-04s  6.75e-05d  [DetectDominatedLinearConstraints] #relevant_constraints=2'495 #num_inclusions=421 
  1.72e-04s  0.00e+00d  [DetectDifferentVariables] 
  3.09e-04s  2.47e-05d  [ProcessSetPPC] #relevant_constraints=1'983 
  2.76e-05s  6.90e-07d  [FindAlmostIdenticalLinearConstraints] #num_tested_pairs=44 
  5.91e-05s  6.35e-05d  [FindBigAtMostOneAndLinearOverlap] 
  2.01e-03s  1.62e-03d  [FindBigVerticalLinearOverlap] #blocks=25 #saved_nz=1'805 
  1.91e-04s  6.87e-05d  [FindBigHorizontalLinearOverlap] #linears=1'765 
  9.72e-06s  0.00e+00d  [MergeClauses] 
  1.22e-03s  0.00e+00d  [DetectDominanceRelations] 
  1.16e-02s  0.00e+00d  [PresolveToFixPoint] #num_loops=2 #num_dual_strengthening=1 
  7.38e-05s  0.00e+00d  [ExpandObjective] #entries=449 #tight_variables=175 #tight_constraints=105 

Presolve summary:
  - 67 affine relations were detected.
  - rule 'TODO dual: only one blocking constraint?' was applied 653 times.
  - rule 'TODO dual: only one blocking enforced constraint?' was applied 78 times.
  - rule 'TODO dual: only one unspecified blocking constraint?' was applied 56 times.
  - rule 'TODO duplicate: identical constraint with different enforcements' was applied 754 times.
  - rule 'affine: new relation' was applied 67 times.
  - rule 'at_most_one: removed literals' was applied 11 times.
  - rule 'at_most_one: size one' was applied 11 times.
  - rule 'at_most_one: transformed into max clique.' was applied 1 time.
  - rule 'deductions: 243 stored' was applied 1 time.
  - rule 'dual: fix variable' was applied 24 times.
  - rule 'dual: reduced domain' was applied 48 times.
  - rule 'duplicate: merged rhs of linear constraint' was applied 57 times.
  - rule 'duplicate: removed constraint' was applied 241 times.
  - rule 'enforcement: false literal' was applied 8 times.
  - rule 'exactly_one: x and not(x)' was applied 1 time.
  - rule 'incompatible linear: add implication' was applied 45 times.
  - rule 'linear matrix: common vertical rectangle' was applied 118 times.
  - rule 'linear: always true' was applied 664 times.
  - rule 'linear: doubleton free' was applied 11 times.
  - rule 'linear: empty' was applied 30 times.
  - rule 'linear: extracted enforcement literal' was applied 7'812 times.
  - rule 'linear: fixed or dup variables' was applied 3'603 times.
  - rule 'linear: positive equal one' was applied 4 times.
  - rule 'linear: reduced variable domains' was applied 213 times.
  - rule 'linear: remapped using affine relations' was applied 3'608 times.
  - rule 'linear: simplified rhs' was applied 10'952 times.
  - rule 'linear: tightened into equality' was applied 6 times.
  - rule 'linear: variable substitution 1' was applied 11 times.
  - rule 'no_overlap: inferred from x != y constraints' was applied 1 time.
  - rule 'presolve: 87 unused variables removed.' was applied 1 time.
  - rule 'presolve: iteration' was applied 3 times.
  - rule 'probing: reduced enforced constraint to implication.' was applied 26 times.
  - rule 'symmetry: fixed to false in general orbit' was applied 1 time.

Presolved optimization model '': (model_fingerprint: 0xf4ba2cc470a0ef97)
#Variables: 251 (#ints: 9 in objective)
  - 76 Booleans in [0,1]
  - 146 different domains in [-4640,4667] with a largest complexity of 11.
#kExactlyOne: 3 (#literals: 9)
#kInterval: 6
#kLinear2: 937 (#enforced: 895 #multi: 786)
#kLinear3: 386 (#enforced: 264)
#kLinearN: 1'940 (#enforced: 1'823 #multi: 109) (#terms: 14'249)
#kNoOverlap: 1 (#intervals: 6)

Preloading model.
#Bound   0.20s best:inf   next:[152,4377] initial_domain
[Symmetry] Graph for symmetry has 3'960 nodes and 25'189 arcs.
[Symmetry] Symmetry computation done. time: 0.000538837 dtime: 0.00142783
#Model   0.20s var:251/251 constraints:3273/3273

Starting search at 0.21s with 32 workers.
17 full problem subsolvers: [core, default_lp, fixed, lb_tree_search, max_lp, no_lp, objective_lb_search, objective_lb_search_max_lp, objective_lb_search_no_lp, objective_shaving_search_max_lp, objective_shaving_search_no_lp, probing, probing_max_lp, pseudo_costs, quick_restart, quick_restart_no_lp, reduced_costs]
13 first solution subsolvers: [fj_long_default, fj_long_lin_default, fj_long_random, fj_short_default, fj_short_lin_default, fj_short_lin_random, fj_short_random, fs_random(2), fs_random_no_lp, fs_random_quick_restart(2), fs_random_quick_restart_no_lp]
13 incomplete subsolvers: [feasibility_pump, graph_arc_lns, graph_cst_lns, graph_dec_lns, graph_var_lns, rins/rens, rnd_cst_lns, rnd_var_lns, scheduling_intervals_lns, scheduling_precedences_lns, scheduling_time_window_lns, violation_ls(2)]
3 helper subsolvers: [neighborhood_helper, synchronization_agent, update_gap_integral]
#Bound   0.23s best:inf   next:[161,4377] objective_lb_search_no_lp
#1       0.23s best:1908  next:[161,1907] quick_restart_no_lp (fixed_bools=0/115)
#2       0.23s best:1819  next:[161,1818] no_lp (fixed_bools=0/121)
#Bound   0.23s best:1819  next:[163,1818] objective_lb_search_no_lp
#Bound   0.23s best:1819  next:[194,1818] objective_lb_search_no_lp
#Bound   0.23s best:1819  next:[204,1818] objective_lb_search_no_lp
#Bound   0.23s best:1819  next:[250,1818] objective_lb_search_no_lp
#3       0.24s best:1797  next:[250,1796] violation_ls(batch:1 #solutions_imported:1 #lin_moves:547 #lin_evals:1'769 #weight_updates:140)
#4       0.24s best:1796  next:[250,1795] violation_ls(batch:2 #solutions_imported:2 #lin_moves:547 #lin_evals:1'774 #gen_moves:2 #gen_evals:0 #comp_moves:2 #backtracks:0 #weight_updates:140)
#5       0.24s best:1787  next:[250,1786] no_lp (fixed_bools=0/138)
#6       0.24s best:1777  next:[250,1776] no_lp (fixed_bools=0/139)
#7       0.25s best:1770  next:[250,1769] no_lp (fixed_bools=0/144)
#8       0.25s best:1698  next:[250,1697] no_lp (fixed_bools=0/151)
#9       0.25s best:1600  next:[250,1599] rins_pump_lns (d=0.50 s=38 t=0.10 p=0.00 stall=0 h=auto_l0)
#Bound   0.26s best:1600  next:[345,1599] max_lp
#10      0.27s best:1530  next:[345,1529] no_lp (fixed_bools=0/178)
#11      0.27s best:1511  next:[345,1510] no_lp (fixed_bools=0/184)
#Bound   0.27s best:1511  next:[358,1510] objective_lb_search_no_lp
#12      0.29s best:1427  next:[358,1426] no_lp (fixed_bools=0/197)
#Bound   0.31s best:1427  next:[481,1426] objective_lb_search_no_lp
#13      0.31s best:1404  next:[481,1403] quick_restart_no_lp (fixed_bools=0/231)
#14      0.33s best:1293  next:[481,1292] no_lp (fixed_bools=0/231)
#15      0.36s best:1270  next:[481,1269] graph_var_lns (d=0.88 s=79 t=0.10 p=1.00 stall=3 h=auto_l0)
#16      0.39s best:1190  next:[481,1189] no_lp (fixed_bools=0/246)
#17      0.39s best:1186  next:[481,1185] no_lp (fixed_bools=0/254)
#18      0.40s best:1185  next:[481,1184] no_lp (fixed_bools=0/254)
#19      0.41s best:1184  next:[481,1183] quick_restart_no_lp (fixed_bools=0/291)
#20      0.42s best:1113  next:[481,1112] quick_restart_no_lp (fixed_bools=0/294)
#21      0.45s best:1106  next:[481,1105] quick_restart_no_lp (fixed_bools=0/295)
#Bound   0.50s best:1106  next:[520,1105] objective_lb_search_no_lp
#Bound   0.51s best:1106  next:[529,1105] objective_lb_search_no_lp
#Bound   0.54s best:1106  next:[570,1105] objective_lb_search_no_lp
#Bound   0.58s best:1106  next:[571,1105] objective_lb_search_no_lp
#Bound   0.60s best:1106  next:[576,1105] objective_lb_search_no_lp
#Bound   0.63s best:1106  next:[579,1105] objective_lb_search_no_lp
#Bound   0.71s best:1106  next:[587,1105] objective_lb_search_no_lp
#Bound   0.75s best:1106  next:[598,1105] objective_lb_search_no_lp
#22      0.76s best:1074  next:[598,1073] scheduling_time_window_lns (d=0.50 s=68 t=0.10 p=0.00 stall=0 h=auto_l0)
#Bound   0.79s best:1074  next:[599,1073] objective_lb_search_no_lp
#23      0.80s best:948   next:[599,947]  scheduling_precedences_lns (d=0.50 s=43 t=0.10 p=0.00 stall=0 h=auto_l0)
#24      0.95s best:946   next:[599,945]  quick_restart_no_lp (fixed_bools=0/359)
#25      0.95s best:945   next:[599,944]  violation_ls(batch:8 #solutions_imported:8 #lin_moves:20'376 #lin_evals:115'848 #gen_moves:8'073 #gen_evals:1'618 #comp_moves:803 #backtracks:3'635 #weight_updates:10'414)
#Bound   0.98s best:945   next:[608,944]  objective_lb_search_no_lp
#26      0.98s best:936   next:[608,935]  quick_restart_no_lp (fixed_bools=0/368)
#27      1.00s best:933   next:[608,932]  rnd_cst_lns (d=0.96 s=138 t=0.10 p=1.00 stall=6 h=auto_l0)
#28      1.01s best:932   next:[608,931]  quick_restart_no_lp (fixed_bools=1/387)
#29      1.10s best:893   next:[608,892]  quick_restart_no_lp (fixed_bools=1/396)
#30      1.15s best:892   next:[608,891]  quick_restart_no_lp (fixed_bools=1/411)
#31      1.15s best:891   next:[608,890]  violation_ls(batch:9 #solutions_imported:7 #lin_moves:25'241 #lin_evals:168'632 #gen_moves:21'224 #gen_evals:4'433 #comp_moves:2'495 #backtracks:9'359 #weight_updates:24'995)
#32      1.15s best:890   next:[608,889]  violation_ls(batch:9 #solutions_imported:9 #lin_moves:20'425 #lin_evals:116'115 #gen_moves:8'073 #gen_evals:1'618 #comp_moves:803 #backtracks:3'635 #weight_updates:10'452)
#33      1.16s best:889   next:[608,888]  quick_restart_no_lp (fixed_bools=1/412)
#Bound   1.28s best:889   next:[609,888]  objective_lb_search_no_lp
#Bound   1.49s best:889   next:[610,888]  objective_lb_search_no_lp
#Bound   1.58s best:889   next:[613,888]  objective_lb_search
#Bound   1.77s best:889   next:[614,888]  objective_lb_search_no_lp [skipped_logs=0]
#Bound   2.96s best:889   next:[632,888]  objective_lb_search_no_lp [skipped_logs=8]
#Bound   4.03s best:889   next:[665,888]  objective_lb_search_no_lp [skipped_logs=6]
#Bound   4.75s best:889   next:[680,888]  objective_lb_search_no_lp [skipped_logs=2]
#Bound   5.98s best:889   next:[689,888]  objective_lb_search_no_lp [skipped_logs=3]
#Bound   6.62s best:889   next:[697,888]  objective_lb_search_no_lp [skipped_logs=2]
#Model   7.42s var:250/251 constraints:3034/3273
#Bound   7.85s best:889   next:[706,888]  objective_lb_search_no_lp [skipped_logs=2]
#Bound   8.65s best:889   next:[709,888]  objective_lb_search_no_lp [skipped_logs=2]
#Bound  10.02s best:889   next:[734,888]  objective_lb_search_no_lp [skipped_logs=3]
#Bound  10.82s best:889   next:[735,888]  objective_lb_search_no_lp [skipped_logs=0]
#Bound  11.16s best:889   next:[737,888]  objective_lb_search_no_lp [skipped_logs=0]
#Model  12.35s var:249/251 constraints:2976/3273
#Bound  12.35s best:889   next:[739,888]  objective_lb_search_no_lp [skipped_logs=0]
#Bound  13.70s best:889   next:[741,888]  objective_lb_search_no_lp [skipped_logs=1]
#Bound  14.86s best:889   next:[743,888]  lb_tree_search (nodes=1977/2330 rc=20 decisions=19556 @root=19 restarts=10)  [skipped_logs=1]
#Model  15.13s var:247/251 constraints:2917/3273
#Bound  15.53s best:889   next:[745,888]  objective_lb_search_no_lp [skipped_logs=1]
#Bound  16.72s best:889   next:[747,888]  lb_tree_search (nodes=1723/2491 rc=22 decisions=21187 @root=23 restarts=10)  [skipped_logs=1]
#Model  17.81s var:246/251 constraints:2780/3273
#Bound  17.85s best:889   next:[750,888]  objective_lb_search_no_lp [skipped_logs=2]
#Model  18.55s var:242/251 constraints:2514/3273
#Model  18.61s var:238/251 constraints:2244/3273
#Bound  18.91s best:889   next:[764,888]  objective_lb_search_no_lp [skipped_logs=5]
#Model  19.12s var:237/251 constraints:2239/3273
#Model  19.29s var:236/251 constraints:2220/3273
#Model  19.37s var:234/251 constraints:2145/3273
#Model  19.39s var:230/251 constraints:1823/3273
#Done   19.39s no_lp
#Done   19.39s objective_lb_search_no_lp
#Done   19.40s quick_restart_no_lp
#Model  19.40s var:221/251 constraints:1461/3273
#Done   19.40s probing
#Done   19.40s core
#Done   19.40s objective_lb_search
#Done   19.40s pseudo_costs
#Model  19.40s var:218/251 constraints:1245/3273
#Bound  19.39s best:889   next:[832,888]  objective_lb_search_no_lp [skipped_logs=3]

Task timing                                  n [     min,      max]      avg      dev     time         n [     min,      max]      avg      dev    dtime
                             'core':         1 [  19.19s,   19.19s]   19.19s   0.00ns   19.19s         1 [  31.33s,   31.33s]   31.33s   0.00ns   31.33s
                       'default_lp':         1 [  19.19s,   19.19s]   19.19s   0.00ns   19.19s         1 [   6.88s,    6.88s]    6.88s   0.00ns    6.88s
                 'feasibility_pump':        89 [  8.99ms, 145.96ms]  57.25ms  12.43ms    5.10s        88 [ 14.96ms,  26.87ms]  15.13ms   1.26ms    1.33s
                            'fixed':         1 [  19.19s,   19.19s]   19.19s   0.00ns   19.19s         1 [   6.74s,    6.74s]    6.74s   0.00ns    6.74s
                  'fj_long_default':         1 [ 56.90ms,  56.90ms]  56.90ms   0.00ns  56.90ms         1 [ 57.01ms,  57.01ms]  57.01ms   0.00ns  57.01ms
              'fj_long_lin_default':         1 [ 51.83ms,  51.83ms]  51.83ms   0.00ns  51.83ms         1 [ 76.12ms,  76.12ms]  76.12ms   0.00ns  76.12ms
                   'fj_long_random':         1 [ 39.85ms,  39.85ms]  39.85ms   0.00ns  39.85ms         1 [ 38.49ms,  38.49ms]  38.49ms   0.00ns  38.49ms
                 'fj_short_default':         1 [ 48.40ms,  48.40ms]  48.40ms   0.00ns  48.40ms         1 [ 75.06ms,  75.06ms]  75.06ms   0.00ns  75.06ms
             'fj_short_lin_default':         1 [ 51.72ms,  51.72ms]  51.72ms   0.00ns  51.72ms         1 [ 78.47ms,  78.47ms]  78.47ms   0.00ns  78.47ms
              'fj_short_lin_random':         1 [ 53.15ms,  53.15ms]  53.15ms   0.00ns  53.15ms         1 [ 76.39ms,  76.39ms]  76.39ms   0.00ns  76.39ms
                  'fj_short_random':         1 [ 53.39ms,  53.39ms]  53.39ms   0.00ns  53.39ms         1 [ 78.79ms,  78.79ms]  78.79ms   0.00ns  78.79ms
                        'fs_random':         1 [ 17.99ms,  17.99ms]  17.99ms   0.00ns  17.99ms         1 [  2.34us,   2.34us]   2.34us   0.00ns   2.34us
                        'fs_random':         1 [ 18.65ms,  18.65ms]  18.65ms   0.00ns  18.65ms         1 [ 20.00ns,  20.00ns]  20.00ns   0.00ns  20.00ns
                  'fs_random_no_lp':         1 [ 17.97ms,  17.97ms]  17.97ms   0.00ns  17.97ms         1 [302.74us, 302.74us] 302.74us   0.00ns 302.74us
          'fs_random_quick_restart':         1 [ 17.85ms,  17.85ms]  17.85ms   0.00ns  17.85ms         1 [  2.34us,   2.34us]   2.34us   0.00ns   2.34us
          'fs_random_quick_restart':         1 [ 22.80ms,  22.80ms]  22.80ms   0.00ns  22.80ms         1 [  2.34us,   2.34us]   2.34us   0.00ns   2.34us
    'fs_random_quick_restart_no_lp':         1 [ 17.97ms,  17.97ms]  17.97ms   0.00ns  17.97ms         1 [342.34us, 342.34us] 342.34us   0.00ns 342.34us
                    'graph_arc_lns':        88 [  3.58ms, 573.03ms] 332.30ms 195.70ms   29.24s        86 [ 10.00ns, 114.51ms]  60.54ms  42.77ms    5.21s
                    'graph_cst_lns':        88 [  1.10ms, 534.30ms] 193.05ms 215.03ms   16.99s        52 [ 10.00ns, 128.28ms]  59.33ms  44.76ms    3.08s
                    'graph_dec_lns':        88 [  5.81ms, 595.99ms] 345.68ms 181.68ms   30.42s        87 [ 10.00ns, 103.22ms]  61.39ms  40.99ms    5.34s
                    'graph_var_lns':        88 [  3.87ms, 538.63ms] 322.71ms 189.25ms   28.40s        87 [ 10.00ns, 106.30ms]  58.35ms  42.98ms    5.08s
                   'lb_tree_search':         1 [  19.19s,   19.19s]   19.19s   0.00ns   19.19s         1 [  11.80s,   11.80s]   11.80s   0.00ns   11.80s
                           'max_lp':         1 [  19.19s,   19.19s]   19.19s   0.00ns   19.19s         1 [   7.98s,    7.98s]    7.98s   0.00ns    7.98s
                            'no_lp':         1 [  19.19s,   19.19s]   19.19s   0.00ns   19.19s         1 [   5.69s,    5.69s]    5.69s   0.00ns    5.69s
              'objective_lb_search':         1 [  19.19s,   19.19s]   19.19s   0.00ns   19.19s         1 [   7.59s,    7.59s]    7.59s   0.00ns    7.59s
       'objective_lb_search_max_lp':         1 [  19.19s,   19.19s]   19.19s   0.00ns   19.19s         1 [   9.56s,    9.56s]    9.56s   0.00ns    9.56s
        'objective_lb_search_no_lp':         1 [  19.19s,   19.19s]   19.19s   0.00ns   19.19s         1 [   4.41s,    4.41s]    4.41s   0.00ns    4.41s
  'objective_shaving_search_max_lp':        64 [ 12.29ms,    1.22s] 276.98ms 246.20ms   17.73s        58 [718.14us, 363.87ms]  69.11ms  79.97ms    4.01s
   'objective_shaving_search_no_lp':        65 [ 12.40ms,    1.22s] 268.42ms 246.48ms   17.45s        58 [  1.40ms, 243.55ms]  47.13ms  52.47ms    2.73s
                          'probing':         1 [  19.19s,   19.19s]   19.19s   0.00ns   19.19s         1 [   2.94s,    2.94s]    2.94s   0.00ns    2.94s
                   'probing_max_lp':         1 [  19.20s,   19.20s]   19.20s   0.00ns   19.20s         1 [   5.02s,    5.02s]    5.02s   0.00ns    5.02s
                     'pseudo_costs':         1 [  19.19s,   19.19s]   19.19s   0.00ns   19.19s         1 [   7.88s,    7.88s]    7.88s   0.00ns    7.88s
                    'quick_restart':         1 [  19.19s,   19.19s]   19.19s   0.00ns   19.19s         1 [   8.37s,    8.37s]    8.37s   0.00ns    8.37s
              'quick_restart_no_lp':         1 [  19.19s,   19.19s]   19.19s   0.00ns   19.19s         1 [   7.02s,    7.02s]    7.02s   0.00ns    7.02s
                    'reduced_costs':         1 [  19.19s,   19.19s]   19.19s   0.00ns   19.19s         1 [   7.68s,    7.68s]    7.68s   0.00ns    7.68s
                        'rins/rens':        89 [ 89.97us, 494.82ms] 268.44ms 199.22ms   23.89s        69 [ 10.00ns, 101.31ms]  72.91ms  36.57ms    5.03s
                      'rnd_cst_lns':        88 [  2.60ms, 727.24ms] 306.65ms 202.63ms   26.99s        86 [ 10.00ns, 102.31ms]  53.65ms  43.63ms    4.61s
                      'rnd_var_lns':        88 [  2.90ms, 809.75ms] 301.55ms 197.34ms   26.54s        87 [ 10.00ns, 126.17ms]  54.04ms  44.06ms    4.70s
         'scheduling_intervals_lns':        88 [115.05ms, 638.24ms] 366.64ms 155.41ms   32.26s        86 [  8.43ms, 134.13ms]  67.64ms  37.14ms    5.82s
       'scheduling_precedences_lns':        88 [ 83.73ms, 776.61ms] 383.70ms 157.75ms   33.77s        88 [  7.98ms, 102.74ms]  68.69ms  35.86ms    6.04s
       'scheduling_time_window_lns':        88 [ 68.85ms, 541.45ms] 323.55ms 156.25ms   28.47s        88 [  3.47ms, 102.17ms]  55.47ms  38.20ms    4.88s
                     'violation_ls':        88 [447.70us,  66.15ms]  21.87ms   8.93ms    1.92s        88 [870.00ns, 100.59ms]  32.46ms  19.76ms    2.86s
                     'violation_ls':        89 [271.19us, 100.83ms]  24.75ms  13.29ms    2.20s        88 [960.00ns, 128.18ms]  36.99ms  26.27ms    3.25s

Search stats                        Bools  Conflicts  Branches  Restarts  BoolPropag  IntegerPropag
                           'core':  3'687     15'615    62'931    10'405  26'788'273     13'176'462
                     'default_lp':    395      9'236    57'974     9'873   2'038'899     10'363'454
                          'fixed':  1'429     47'023    80'677       403   9'904'956     14'719'688
                      'fs_random':     76          0       152       152          18          3'324
                      'fs_random':     76          0       152       152          18          3'324
                'fs_random_no_lp':     83          2       175       152          99          4'680
        'fs_random_quick_restart':     76          0       152       152          18          3'324
        'fs_random_quick_restart':     76          0       152       152          18          3'324
  'fs_random_quick_restart_no_lp':     76          0       206       152          21          4'704
                 'lb_tree_search':     91        162    48'463    11'144     141'530      3'586'440
                         'max_lp':     76      5'785    56'820    13'014     266'369      8'941'135
                          'no_lp':    848     24'844    65'171     7'027   5'551'558     19'654'368
            'objective_lb_search':    133      5'672    63'121    16'375     312'714      9'519'629
     'objective_lb_search_max_lp':    133      4'341    51'643    14'726     282'356      7'857'548
      'objective_lb_search_no_lp':    225     20'743    49'437     6'475     627'799     17'675'728
                        'probing':    441        244       794       794      13'032         85'422
                 'probing_max_lp':    373        184       562       562       8'820         60'514
                   'pseudo_costs':    280      5'385    62'885    14'992     715'640      8'684'807
                  'quick_restart':    681      6'331    66'157    10'348   3'256'808      8'659'911
            'quick_restart_no_lp':  1'976     26'355    88'705     8'265  12'354'608     16'270'897
                  'reduced_costs':    529      6'914    61'604     9'650   1'522'545      9'186'774

SAT stats                           ClassicMinim  LitRemoved  LitLearned  LitForgotten  Subsumed  MClauses  MDecisions  MLitTrue  MSubsumed  MLitRemoved  MReused
                           'core':        14'334      99'281     101'912             0        37     4'596      22'880         0         33          119       71
                     'default_lp':         6'485      19'915      85'090             0       385     5'241      43'212         0      2'108       13'634      820
                          'fixed':        31'018      97'966     825'413       231'453        94        39         359         0         12           82       16
                      'fs_random':             0           0           0             0         0         0           0         0          0            0        0
                      'fs_random':             0           0           0             0         0         0           0         0          0            0        0
                'fs_random_no_lp':             0           0          11             0         0         0           0         0          0            0        0
        'fs_random_quick_restart':             0           0           0             0         0         0           0         0          0            0        0
        'fs_random_quick_restart':             0           0           0             0         0         0           0         0          0            0        0
  'fs_random_quick_restart_no_lp':             0           0           0             0         0         0           0         0          0            0        0
                 'lb_tree_search':            13          15         598             0         0     4'066      20'153         0         29          116      405
                         'max_lp':         4'237      12'792      59'212             0       190     5'814      45'852         0        819        5'516    1'280
                          'no_lp':        21'115     103'963     289'478       105'962       329     3'451      27'646        10      1'591       11'126      410
            'objective_lb_search':         4'475      14'628      46'997             0       200     5'808      47'284         0        636        3'954      883
     'objective_lb_search_max_lp':         3'498      12'398      36'309             0       136     4'625      37'205         0        433        2'622    1'361
      'objective_lb_search_no_lp':        17'336      66'081     162'774        13'723       433     3'109      23'132         0      1'402        8'869      482
                        'probing':             0           0         244             0         0         0           0         0          0            0        0
                 'probing_max_lp':             0           0         184             0         0         0           0         0          0            0        0
                   'pseudo_costs':         4'065      12'860      52'553             0       171     5'653      44'578         0        715        4'411    1'074
                  'quick_restart':         4'332      12'941      51'385             0       334     5'777      53'975         0      2'597       18'855    1'164
            'quick_restart_no_lp':        18'890      87'276     280'164        48'497       345     4'019      35'456        32      2'958       24'494      423
                  'reduced_costs':         5'436      17'670      86'587             0       146     3'718      36'712         0        682        4'819      867

Lp stats                         Component  Iterations  AddedCuts  OPTIMAL  DUAL_F.  DUAL_U.
                  'default_lp':          1     114'511      8'792   15'063        1        0
                       'fixed':          1      54'999      1'458   46'474        0        0
                   'fs_random':          1          75          0        2        0        0
                   'fs_random':          1          75         57        3        0        0
     'fs_random_quick_restart':          1          75         50        3        0        0
     'fs_random_quick_restart':          1          75         50        3        0        0
              'lb_tree_search':          1     330'459      4'746   19'250    6'853        0
                      'max_lp':          1     152'358      6'416   10'846    2'883        7
         'objective_lb_search':          1     148'347      6'658   13'666        0        0
  'objective_lb_search_max_lp':          1     194'503      5'119    9'975    2'739        0
                     'probing':          1      23'763      5'797    3'023        0        0
              'probing_max_lp':          1      14'157      6'897    1'909       60        0
                'pseudo_costs':          1     154'501      6'738   10'729    2'815        4
               'quick_restart':          1     122'212      6'150    9'805        0        0
               'reduced_costs':          1     155'398      6'586   12'601    4'343        0

Lp dimension                                                                     Final dimension of first component
                  'default_lp':  416 rows, 248 columns, 1608 entries with magnitude in [1.114086e-03, 1.000000e+00]
                       'fixed':   167 rows, 248 columns, 599 entries with magnitude in [3.479016e-02, 1.000000e+00]
                   'fs_random':    69 rows, 248 columns, 249 entries with magnitude in [9.182431e-02, 1.000000e+00]
                   'fs_random':    69 rows, 248 columns, 249 entries with magnitude in [9.182431e-02, 1.000000e+00]
     'fs_random_quick_restart':    69 rows, 248 columns, 249 entries with magnitude in [9.182431e-02, 1.000000e+00]
     'fs_random_quick_restart':    69 rows, 248 columns, 249 entries with magnitude in [9.182431e-02, 1.000000e+00]
              'lb_tree_search':  539 rows, 251 columns, 1948 entries with magnitude in [8.706356e-03, 1.000000e+00]
                      'max_lp':  722 rows, 251 columns, 3387 entries with magnitude in [2.193855e-03, 1.000000e+00]
         'objective_lb_search':  565 rows, 248 columns, 2474 entries with magnitude in [1.931731e-03, 1.000000e+00]
  'objective_lb_search_max_lp':  680 rows, 251 columns, 2698 entries with magnitude in [1.124815e-03, 1.000000e+00]
                     'probing':  554 rows, 248 columns, 2877 entries with magnitude in [4.199258e-03, 1.000000e+00]
              'probing_max_lp':  465 rows, 251 columns, 2060 entries with magnitude in [4.111762e-03, 1.000000e+00]
                'pseudo_costs':  603 rows, 251 columns, 2399 entries with magnitude in [7.519654e-04, 1.000000e+00]
               'quick_restart':  746 rows, 248 columns, 3618 entries with magnitude in [3.886501e-04, 1.000000e+00]
               'reduced_costs':  483 rows, 251 columns, 1690 entries with magnitude in [5.304111e-03, 1.000000e+00]

Lp debug                         CutPropag  CutEqPropag  Adjust  Overflow        Bad  BadScaling
                  'default_lp':          6           34   8'486         0    138'116           0
                       'fixed':          0            1  10'606         0      3'626           0
                   'fs_random':          0            0       0         0          0           0
                   'fs_random':          0            0       0         0          6           0
     'fs_random_quick_restart':          0            0       0         0          0           0
     'fs_random_quick_restart':          0            0       0         0          0           0
              'lb_tree_search':         20            1  15'341         0     78'075           0
                      'max_lp':         54            2   7'665         0    136'735           0
         'objective_lb_search':         12           45   8'937         0    136'949           0
  'objective_lb_search_max_lp':         27            7   8'086         0    103'838           0
                     'probing':         44           30   2'944         0  2'266'231           0
              'probing_max_lp':         47          117   1'625         0  1'175'558           0
                'pseudo_costs':         75            8   7'230         0    156'633           0
               'quick_restart':         16           87   6'660         0    274'054           0
               'reduced_costs':         41           16   8'828         0    132'765           0

Lp pool                          Constraints  Updates  Simplif  Merged  Shortened   Split  Strenghtened     Cuts/Call
                  'default_lp':        8'969      786   34'565     107      4'417   5'510         9'236  8'792/21'676
                       'fixed':        1'742       11        7       0          0      27            95   1'458/2'759
                   'fs_random':          284        0        0       0          0       0            17           0/0
                   'fs_random':          341        0        0       0          0       0            18         57/66
     'fs_random_quick_restart':          334        0        0       0          0       0            17         50/50
     'fs_random_quick_restart':          334        0        0       0          0       0            17         50/50
              'lb_tree_search':        8'002      681   64'393      10      5'970   1'124        57'395  4'746/16'465
                      'max_lp':        9'637      842  121'578      45      8'656   4'940        69'614  6'416/16'154
         'objective_lb_search':        6'853      797   18'800      89      3'987   4'245         7'513  6'658/19'262
  'objective_lb_search_max_lp':        8'362      791   69'845      23      7'461   2'476        61'116  5'119/14'038
                     'probing':        6'067      840   20'890      14      1'639   9'161         3'216  5'797/11'325
              'probing_max_lp':       10'158    2'474   43'791       5      4'674  17'811        33'935  6'897/18'071
                'pseudo_costs':        9'972    1'001  125'078      32      9'672   5'263        75'000  6'738/16'973
               'quick_restart':        6'423      982   20'268      11      1'813  13'368         4'159  6'150/16'123
               'reduced_costs':        9'747      762   83'193     105      7'490   3'873        61'392  6'586/16'437

Lp Cut                                         fs_ran  fs_ran  fs_ran  defaul  fixed  max_lp  quick_  reduce  pseudo  lb_tre  probin  object  probin  object
                                       CG_FF:       -       -       -     534    134     324     154     324     269     265     146     333     200     183
                                        CG_K:       -       -       -     292     78     239      97     253     209     193      74     217     110     146
                                        CG_R:       -       -       -     506     87     290     196     295     226     247     129     233     277     177
                                       CG_RB:       -       -       -   1'651    202     791   1'300     575     654     470   1'148   1'263     341     441
                                      CG_RBP:       -       -       -     229     29      89     120      96      68      41     108      93      33      39
                                      Clique:       -       -       -       -      -      73       -      66      56      65       -       -      41      70
                                          IB:      50      50      50   1'109    348     578     839     674     721     614     863     939     131     631
                                    MIR_1_FF:       5       -       -     401     67     336     328     300     329     259     286     385     237     229
                                     MIR_1_K:       -       -       -      59     11      56      22      70      78      38      32      55      32      34
                                    MIR_1_KL:       -       -       -       5      -       5       3       -       3       1      11       2       -       -
                                     MIR_1_R:       1       -       -      63     16      37      39      48      31      24      34      58      40      37
                                    MIR_1_RB:       1       -       -     752    108     565     457     581     626     410     560     594     289     437
                                   MIR_1_RBP:       -       -       -      29      9      84      23      83      93      51      36      23      46      65
                                   MIR_1_RLT:       -       -       -       -      -       3       -       2       1       4       -       -       3       2
                                    MIR_2_FF:       -       -       -     235     40     231     169     258     278     170     165     216     226     194
                                     MIR_2_K:       -       -       -      35      3      36      12      46      48      36      18      35      19      23
                                    MIR_2_KL:       -       -       -       2      -       3       1       5       7       2       4       2       -       5
                                     MIR_2_R:       -       -       -      94     11      49      65      61      62      39      64      85      37      52
                                    MIR_2_RB:       -       -       -     472     46     268     348     282     289     185     301     354     170     206
                                   MIR_2_RBP:       -       -       -      31      8      31      32      27      50      28      33      37      10      25
                                    MIR_3_FF:       -       -       -     141     25     170      91     171     168     117      82     133     128     153
                                     MIR_3_K:       -       -       -      39      4      28      18      49      46      29      27      37      27      31
                                    MIR_3_KL:       -       -       -       4      -       8       7      10       3       7      10       2       6       2
                                     MIR_3_R:       -       -       -      69     11      43      56      51      52      29      58      64      36      58
                                    MIR_3_RB:       -       -       -     292     50     170     273     210     193     126     209     246     109     170
                                   MIR_3_RBP:       -       -       -      29      8      30      18      35      23      13      30      23       7       9
                                    MIR_4_FF:       -       -       -      79     12      71      54      92      97      54      52      59      76      73
                                     MIR_4_K:       -       -       -      29      4      14      15      33      22      23      12      20      20      20
                                    MIR_4_KL:       -       -       -       9      -       5       8      14       3       -       5       4       3       3
                                     MIR_4_R:       -       -       -      51      3       9      58      29      29      16      32      35      15      34
                                    MIR_4_RB:       -       -       -     188     24     100     161     125     135      74     121     121      63      97
                                   MIR_4_RBP:       -       -       -      18      1      17      15      24      11      13      18      17       7      11
                                    MIR_5_FF:       -       -       -      44      9      55      47      70      66      43      26      49      28      45
                                     MIR_5_K:       -       -       -      24      -      20      18      29      16      20      19      17       7      13
                                    MIR_5_KL:       -       -       -      10      -       3      15       8       4       6       7       5       2       2
                                     MIR_5_R:       -       -       -      33      2      15      43      17      26      13      21      23       9      18
                                    MIR_5_RB:       -       -       -     102     16      67      94      78      90      47      74      61      41      59
                                   MIR_5_RBP:       -       -       -      20      2      15      16      19      16      10       8      14       9      10
                                    MIR_6_FF:       -       -       -      19      3      52      28      45      66      31      16      26      36      28
                                     MIR_6_K:       -       -       -      18      -      19      15      21      19       9      12      16       7       8
                                    MIR_6_KL:       -       -       -       8      -       1       7       3       2       -       3       3       1       -
                                     MIR_6_R:       -       -       -      28      -      14      36      11      14       8      11      18       8      15
                                    MIR_6_RB:       -       -       -      86      5      56      75      67      58      53      41      47      32      60
                                   MIR_6_RBP:       -       -       -      14      1       7       9       6       6       4       6       3       5       2
  NoOverlapCompletionTimeExhaustive_weighted:       -       -       -       -      -      10       -      14      10       8       -       -       4       8
                 NoOverlapDisjunctionOnStart:       -       -       -       -      -       8       -      11       8       7       -       -       5       8
                                ZERO_HALF_FF:       -       -       -      87     17      66      41      86      59      66      26      66      40      67
                                 ZERO_HALF_K:       -       -       -      18      5      19      11      29      39      30       3      19      10      25
                                 ZERO_HALF_R:       -       -       -     567     36   1'052     540     977   1'123     610     652     401   3'754     907
                                ZERO_HALF_RB:       -       -       -     224     21     159     150     172     201     134     181     192     128     159
                               ZERO_HALF_RBP:       -       -       -      43      2      25      26      34      35       4      23      13      32      28

LNS stats                        Improv/Calls  Closed  Difficulty  TimeLimit
               'graph_arc_lns':          1/88     57%        0.99       0.10
               'graph_cst_lns':          0/54     56%        0.97       0.10
               'graph_dec_lns':          1/88     55%        0.99       0.10
               'graph_var_lns':          2/88     58%        0.99       0.10
                   'rins/rens':         23/85     54%        0.93       0.10
                 'rnd_cst_lns':          2/87     57%        0.99       0.10
                 'rnd_var_lns':          3/88     57%        0.99       0.10
    'scheduling_intervals_lns':          6/88     49%        0.09       0.10
  'scheduling_precedences_lns':          6/88     50%        0.14       0.10
  'scheduling_time_window_lns':          5/88     67%        1.00       0.10

LS stats                   Batches  Restarts  LinMoves  GenMoves  CompoundMoves  WeightUpdates
       'fj_long_default':        1         1     7'487         0              0            253
   'fj_long_lin_default':        1         1         0     2'067            214              1
        'fj_long_random':        1         1     4'791         0              0            171
      'fj_short_default':        1         1         0     2'085            248              1
  'fj_short_lin_default':        1         1         0     1'805            261              0
   'fj_short_lin_random':        1         1         0     2'110            238              0
       'fj_short_random':        1         1         0     2'101            329              0
          'violation_ls':       88         0   414'706     8'073            803        406'173
          'violation_ls':       88         0   428'239    21'224          2'495        412'000

Solutions (33)                   Num     Rank
               'graph_var_lns':    1  [15,15]
                       'no_lp':   12   [2,18]
         'quick_restart_no_lp':   11   [1,33]
               'rins_pump_lns':    1    [9,9]
                 'rnd_cst_lns':    1  [27,27]
  'scheduling_precedences_lns':    1  [23,23]
  'scheduling_time_window_lns':    1  [22,22]
                'violation_ls':    5   [3,32]

Objective bounds                 Num
              'initial_domain':    1
              'lb_tree_search':    6
                      'max_lp':    1
         'objective_lb_search':    2
  'objective_lb_search_max_lp':    1
   'objective_lb_search_no_lp':   72

Solution repositories    Added  Queried  Ignored  Synchro
  'feasible solutions':    839    2'003        5      748
        'lp solutions':    272       33        0      234
                'pump':  1'846       56

Improving bounds shared            Num
                        'core':     36
                  'default_lp':     94
              'lb_tree_search':     22
                      'max_lp':    164
                       'no_lp':    396
         'objective_lb_search':      5
  'objective_lb_search_max_lp':     39
   'objective_lb_search_no_lp':     24
                     'probing':    365
              'probing_max_lp':    124
                'pseudo_costs':    414
               'quick_restart':     63
         'quick_restart_no_lp':  2'103
               'reduced_costs':     96

Clauses shared                   Num
                        'core':    2
                  'default_lp':   11
              'lb_tree_search':   20
                      'max_lp':   21
                       'no_lp':   50
         'objective_lb_search':   13
  'objective_lb_search_max_lp':   22
   'objective_lb_search_no_lp':   12
                'pseudo_costs':   46
         'quick_restart_no_lp':    6
               'reduced_costs':   19

CpSolverResponse summary:
status: OPTIMAL
objective: 889
best_bound: 889
integers: 249
booleans: 76
conflicts: 0
branches: 152
propagations: 18
integer_propagations: 3324
restarts: 152
lp_iterations: 75
walltime: 19.4571
usertime: 19.4571
deterministic_time: 195.385
gap_integral: 402.08
solution_fingerprint: 0x8676a9eb31884d0d


--- Simulation Gantt  partir du modle mathmatique ---
