created virtual environment CPython3.12.4.final.0-64 in 340ms
  creator CPython3Posix(dest=/localscratch/aneumann.46806162.0/env, clear=False, no_vcs_ignore=False, global=False)
  seeder FromAppData(download=False, pip=bundle, via=copy, app_data_dir=/home/aneumann/.local/share/virtualenv)
    added seed packages: pip==24.2+computecanada
  activators BashActivator,CShellActivator,FishActivator,NushellActivator,PowerShellActivator,PythonActivator
Looking in links: /cvmfs/soft.computecanada.ca/custom/python/wheelhouse/gentoo2023/x86-64-v3, /cvmfs/soft.computecanada.ca/custom/python/wheelhouse/gentoo2023/generic, /cvmfs/soft.computecanada.ca/custom/python/wheelhouse/generic
Requirement already satisfied: pip in /localscratch/aneumann.46806162.0/env/lib/python3.12/site-packages (24.2+computecanada)
Processing /cvmfs/soft.computecanada.ca/custom/python/wheelhouse/generic/pip-25.0+computecanada-py3-none-any.whl
Installing collected packages: pip
  Attempting uninstall: pip
    Found existing installation: pip 24.2+computecanada
    Uninstalling pip-24.2+computecanada:
      Successfully uninstalled pip-24.2+computecanada
Successfully installed pip-24.2+computecanada
Looking in links: /cvmfs/soft.computecanada.ca/custom/python/wheelhouse/gentoo2023/x86-64-v3, /cvmfs/soft.computecanada.ca/custom/python/wheelhouse/gentoo2023/generic, /cvmfs/soft.computecanada.ca/custom/python/wheelhouse/generic
ERROR: protobuf-5.28.3-cp38-abi3-manylinux2014_x86_64.whl is not a supported wheel on this platform.
Looking in links: /cvmfs/soft.computecanada.ca/custom/python/wheelhouse/gentoo2023/x86-64-v3, /cvmfs/soft.computecanada.ca/custom/python/wheelhouse/gentoo2023/generic, /cvmfs/soft.computecanada.ca/custom/python/wheelhouse/generic
Processing /home/aneumann/projects/def-adhaj/aneumann/GNRS/wheels/immutabledict-4.2.0-py3-none-any.whl
Installing collected packages: immutabledict
Successfully installed immutabledict-4.2.0
Looking in links: /cvmfs/soft.computecanada.ca/custom/python/wheelhouse/gentoo2023/x86-64-v3, /cvmfs/soft.computecanada.ca/custom/python/wheelhouse/gentoo2023/generic, /cvmfs/soft.computecanada.ca/custom/python/wheelhouse/generic
Processing /cvmfs/soft.computecanada.ca/custom/python/wheelhouse/generic/ortools-9.10.4067+computecanada-cp312-cp312-linux_x86_64.whl (from -r /home/aneumann/projects/def-adhaj/aneumann/GNRS/requirements/or.txt (line 1))
Processing /cvmfs/soft.computecanada.ca/custom/python/wheelhouse/gentoo2023/x86-64-v3/matplotlib-3.10.0+computecanada-cp312-cp312-linux_x86_64.whl (from -r /home/aneumann/projects/def-adhaj/aneumann/GNRS/requirements/or.txt (line 2))
Processing /cvmfs/soft.computecanada.ca/custom/python/wheelhouse/gentoo2023/x86-64-v3/pandas-2.2.3+computecanada-cp312-cp312-linux_x86_64.whl (from -r /home/aneumann/projects/def-adhaj/aneumann/GNRS/requirements/or.txt (line 3))
Processing /cvmfs/soft.computecanada.ca/custom/python/wheelhouse/generic/absl_py-2.3.0+computecanada-py3-none-any.whl (from ortools<9.11,>=9.10->-r /home/aneumann/projects/def-adhaj/aneumann/GNRS/requirements/or.txt (line 1))
Processing /cvmfs/soft.computecanada.ca/custom/python/wheelhouse/gentoo2023/generic/numpy-2.2.2+computecanada-cp312-cp312-linux_x86_64.whl (from ortools<9.11,>=9.10->-r /home/aneumann/projects/def-adhaj/aneumann/GNRS/requirements/or.txt (line 1))
Processing /cvmfs/soft.computecanada.ca/custom/python/wheelhouse/gentoo2023/x86-64-v3/protobuf-6.31.1+computecanada-cp312-cp312-linux_x86_64.whl (from ortools<9.11,>=9.10->-r /home/aneumann/projects/def-adhaj/aneumann/GNRS/requirements/or.txt (line 1))
Requirement already satisfied: immutabledict>=3.0.0 in /localscratch/aneumann.46806162.0/env/lib/python3.12/site-packages (from ortools<9.11,>=9.10->-r /home/aneumann/projects/def-adhaj/aneumann/GNRS/requirements/or.txt (line 1)) (4.2.0)
Processing /cvmfs/soft.computecanada.ca/custom/python/wheelhouse/gentoo2023/generic/contourpy-1.3.1+computecanada-cp312-cp312-linux_x86_64.whl (from matplotlib->-r /home/aneumann/projects/def-adhaj/aneumann/GNRS/requirements/or.txt (line 2))
Processing /cvmfs/soft.computecanada.ca/custom/python/wheelhouse/generic/cycler-0.12.1+computecanada-py3-none-any.whl (from matplotlib->-r /home/aneumann/projects/def-adhaj/aneumann/GNRS/requirements/or.txt (line 2))
Processing /cvmfs/soft.computecanada.ca/custom/python/wheelhouse/generic/fonttools-4.59.0+computecanada-cp312-cp312-linux_x86_64.whl (from matplotlib->-r /home/aneumann/projects/def-adhaj/aneumann/GNRS/requirements/or.txt (line 2))
Processing /cvmfs/soft.computecanada.ca/custom/python/wheelhouse/gentoo2023/x86-64-v3/kiwisolver-1.4.8+computecanada-cp312-cp312-linux_x86_64.whl (from matplotlib->-r /home/aneumann/projects/def-adhaj/aneumann/GNRS/requirements/or.txt (line 2))
Processing /cvmfs/soft.computecanada.ca/custom/python/wheelhouse/generic/packaging-25.0+computecanada-py3-none-any.whl (from matplotlib->-r /home/aneumann/projects/def-adhaj/aneumann/GNRS/requirements/or.txt (line 2))
Processing /cvmfs/soft.computecanada.ca/custom/python/wheelhouse/gentoo2023/x86-64-v3/pillow-11.1.0+computecanada-cp312-cp312-linux_x86_64.whl (from matplotlib->-r /home/aneumann/projects/def-adhaj/aneumann/GNRS/requirements/or.txt (line 2))
Processing /cvmfs/soft.computecanada.ca/custom/python/wheelhouse/generic/pyparsing-3.2.3+computecanada-py3-none-any.whl (from matplotlib->-r /home/aneumann/projects/def-adhaj/aneumann/GNRS/requirements/or.txt (line 2))
Processing /cvmfs/soft.computecanada.ca/custom/python/wheelhouse/generic/python_dateutil-2.9.0.post0+computecanada-py2.py3-none-any.whl (from matplotlib->-r /home/aneumann/projects/def-adhaj/aneumann/GNRS/requirements/or.txt (line 2))
Processing /cvmfs/soft.computecanada.ca/custom/python/wheelhouse/generic/pytz-2025.2+computecanada-py2.py3-none-any.whl (from pandas->-r /home/aneumann/projects/def-adhaj/aneumann/GNRS/requirements/or.txt (line 3))
Processing /cvmfs/soft.computecanada.ca/custom/python/wheelhouse/generic/tzdata-2025.2+computecanada-py2.py3-none-any.whl (from pandas->-r /home/aneumann/projects/def-adhaj/aneumann/GNRS/requirements/or.txt (line 3))
Processing /cvmfs/soft.computecanada.ca/custom/python/wheelhouse/generic/six-1.17.0+computecanada-py2.py3-none-any.whl (from python-dateutil>=2.7->matplotlib->-r /home/aneumann/projects/def-adhaj/aneumann/GNRS/requirements/or.txt (line 2))
Installing collected packages: pytz, tzdata, six, pyparsing, protobuf, pillow, packaging, numpy, kiwisolver, fonttools, cycler, absl-py, python-dateutil, contourpy, pandas, matplotlib, ortools
Successfully installed absl-py-2.3.0+computecanada contourpy-1.3.1+computecanada cycler-0.12.1+computecanada fonttools-4.59.0+computecanada kiwisolver-1.4.8+computecanada matplotlib-3.10.0+computecanada numpy-2.2.2+computecanada ortools-9.10.4067+computecanada packaging-25.0+computecanada pandas-2.2.3+computecanada pillow-11.1.0+computecanada protobuf-6.31.1+computecanada pyparsing-3.2.3+computecanada python-dateutil-2.9.0.post0+computecanada pytz-2025.2+computecanada six-1.17.0+computecanada tzdata-2025.2+computecanada

Starting CP-SAT solver v9.10.4067
Parameters: max_time_in_seconds: 86400 max_memory_in_mb: 185000 log_search_progress: true enumerate_all_solutions: false num_search_workers: 32 absolute_gap_limit: 0 relative_gap_limit: 0

Initial optimization model '': (model_fingerprint: 0xb8dd3fb854ef6193)
#Variables: 329 (#ints: 9 in objective)
  - 240 Booleans in [0,1]
  - 89 in [0,743]
#kLinear1: 44
#kLinear2: 472
#kLinear3: 200
#kLinearN: 4'280 (#terms: 67'348)

Starting presolve at 0.00s
  2.02e-03s  0.00e+00d  [DetectDominanceRelations] 
  3.07e-02s  0.00e+00d  [PresolveToFixPoint] #num_loops=8 #num_dual_strengthening=3 
  3.62e-05s  0.00e+00d  [ExtractEncodingFromLinear] #potential_supersets=4 
[Symmetry] Graph for symmetry has 5'001 nodes and 53'980 arcs.
[Symmetry] Symmetry computation done. time: 0.00191903 dtime: 0.00415305
[Symmetry] #generators: 1, average support size: 24
[Symmetry] The model contains 222 duplicate constraints !
[Symmetry] 12 orbits with sizes: 2,2,2,2,2,2,2,2,2,2,...
[Symmetry] Num fixable by intersecting at_most_one with orbits: 1 largest_orbit: 2
  1.18e-02s  2.85e-03d  [Probe] #probed=346 #new_bounds=9 #equiv=1 
  7.09e-05s  0.00e+00d  [MaxClique] 
  1.92e-03s  0.00e+00d  [DetectDominanceRelations] 
  1.39e-02s  0.00e+00d  [PresolveToFixPoint] #num_loops=5 #num_dual_strengthening=3 
  6.46e-03s  0.00e+00d  [ProcessAtMostOneAndLinear] 
  2.38e-03s  0.00e+00d  [DetectDuplicateConstraints] #duplicates=288 #without_enforcements=73 
  2.60e-03s  2.37e-04d  [DetectDominatedLinearConstraints] #relevant_constraints=3'788 #num_inclusions=2'746 
  4.09e-04s  0.00e+00d  [DetectDifferentVariables] #different=23 #cliques=1 #size=6 
  6.07e-04s  7.91e-05d  [ProcessSetPPC] #relevant_constraints=3'452 
  1.65e-05s  0.00e+00d  [FindAlmostIdenticalLinearConstraints] 
  1.85e-04s  2.69e-04d  [FindBigAtMostOneAndLinearOverlap] 
  6.00e-03s  4.91e-03d  [FindBigVerticalLinearOverlap] #blocks=51 #saved_nz=8'773 
  3.65e-04s  1.86e-04d  [FindBigHorizontalLinearOverlap] #linears=3'325 
  1.84e-05s  0.00e+00d  [MergeClauses] 
  2.07e-03s  0.00e+00d  [DetectDominanceRelations] 
  2.00e-02s  0.00e+00d  [PresolveToFixPoint] #num_loops=2 #num_dual_strengthening=1 
  2.06e-03s  0.00e+00d  [DetectDominanceRelations] 
  1.15e-02s  0.00e+00d  [PresolveToFixPoint] #num_loops=1 #num_dual_strengthening=1 
[Symmetry] Graph for symmetry has 4'886 nodes and 44'320 arcs.
[Symmetry] Symmetry computation done. time: 0.000961547 dtime: 0.00241813
  1.13e-02s  2.71e-03d  [Probe] #probed=346 #new_bounds=31 
  1.35e-05s  0.00e+00d  [MaxClique] 
  2.09e-03s  0.00e+00d  [DetectDominanceRelations] 
  1.71e-02s  0.00e+00d  [PresolveToFixPoint] #num_loops=2 #num_dual_strengthening=1 
  5.99e-03s  0.00e+00d  [ProcessAtMostOneAndLinear] 
  2.10e-03s  0.00e+00d  [DetectDuplicateConstraints] #without_enforcements=95 
  1.68e-03s  1.51e-04d  [DetectDominatedLinearConstraints] #relevant_constraints=3'612 #num_inclusions=613 
  2.59e-04s  0.00e+00d  [DetectDifferentVariables] 
  5.82e-04s  5.96e-05d  [ProcessSetPPC] #relevant_constraints=3'231 
  2.33e-05s  1.35e-07d  [FindAlmostIdenticalLinearConstraints] #num_tested_pairs=9 
  9.05e-05s  1.21e-04d  [FindBigAtMostOneAndLinearOverlap] 
  4.43e-03s  3.71e-03d  [FindBigVerticalLinearOverlap] #blocks=62 #saved_nz=5'632 
  3.31e-04s  1.50e-04d  [FindBigHorizontalLinearOverlap] #linears=3'075 
  1.18e-05s  0.00e+00d  [MergeClauses] 
  1.90e-03s  0.00e+00d  [DetectDominanceRelations] 
  1.96e-02s  0.00e+00d  [PresolveToFixPoint] #num_loops=2 #num_dual_strengthening=1 
  1.89e-03s  0.00e+00d  [DetectDominanceRelations] 
  1.30e-02s  0.00e+00d  [PresolveToFixPoint] #num_loops=1 #num_dual_strengthening=1 
[Symmetry] Graph for symmetry has 5'069 nodes and 38'747 arcs.
[Symmetry] Symmetry computation done. time: 0.000862646 dtime: 0.00216008
  1.02e-02s  2.47e-03d  [Probe] #probed=346 #new_bounds=50 
  1.26e-05s  0.00e+00d  [MaxClique] 
  1.89e-03s  0.00e+00d  [DetectDominanceRelations] 
  1.85e-02s  0.00e+00d  [PresolveToFixPoint] #num_loops=2 #num_dual_strengthening=1 
  5.48e-03s  0.00e+00d  [ProcessAtMostOneAndLinear] 
  2.05e-03s  0.00e+00d  [DetectDuplicateConstraints] #without_enforcements=108 
  1.27e-03s  1.14e-04d  [DetectDominatedLinearConstraints] #relevant_constraints=3'491 #num_inclusions=266 
  2.56e-04s  0.00e+00d  [DetectDifferentVariables] 
  4.87e-04s  4.57e-05d  [ProcessSetPPC] #relevant_constraints=2'945 
  3.67e-05s  6.95e-07d  [FindAlmostIdenticalLinearConstraints] #num_tested_pairs=43 
  8.73e-05s  9.39e-05d  [FindBigAtMostOneAndLinearOverlap] 
  3.24e-03s  2.72e-03d  [FindBigVerticalLinearOverlap] #blocks=52 #saved_nz=3'700 
  2.88e-04s  1.19e-04d  [FindBigHorizontalLinearOverlap] #linears=2'646 
  1.21e-05s  0.00e+00d  [MergeClauses] 
  1.71e-03s  0.00e+00d  [DetectDominanceRelations] 
  1.68e-02s  0.00e+00d  [PresolveToFixPoint] #num_loops=2 #num_dual_strengthening=1 
  9.10e-05s  0.00e+00d  [ExpandObjective] #entries=714 #tight_variables=260 #tight_constraints=148 

Presolve summary:
  - 81 affine relations were detected.
  - rule 'TODO dual: only one blocking constraint?' was applied 621 times.
  - rule 'TODO dual: only one blocking enforced constraint?' was applied 104 times.
  - rule 'TODO dual: only one unspecified blocking constraint?' was applied 25 times.
  - rule 'TODO duplicate: identical constraint with different enforcements' was applied 276 times.
  - rule 'affine: new relation' was applied 81 times.
  - rule 'at_most_one: removed literals' was applied 2 times.
  - rule 'at_most_one: size one' was applied 2 times.
  - rule 'deductions: 320 stored' was applied 1 time.
  - rule 'dual: fix variable' was applied 24 times.
  - rule 'dual: reduced domain' was applied 37 times.
  - rule 'duplicate: merged rhs of linear constraint' was applied 62 times.
  - rule 'duplicate: removed constraint' was applied 288 times.
  - rule 'enforcement: false literal' was applied 8 times.
  - rule 'exactly_one: x and not(x)' was applied 1 time.
  - rule 'incompatible linear: add implication' was applied 45 times.
  - rule 'linear matrix: common vertical rectangle' was applied 165 times.
  - rule 'linear: always true' was applied 574 times.
  - rule 'linear: doubleton free' was applied 12 times.
  - rule 'linear: empty' was applied 32 times.
  - rule 'linear: extracted enforcement literal' was applied 6'713 times.
  - rule 'linear: fixed or dup variables' was applied 4'387 times.
  - rule 'linear: positive equal one' was applied 4 times.
  - rule 'linear: reduced variable domains' was applied 269 times.
  - rule 'linear: remapped using affine relations' was applied 4'449 times.
  - rule 'linear: simplified rhs' was applied 14'105 times.
  - rule 'linear: tightened into equality' was applied 8 times.
  - rule 'linear: variable substitution 1' was applied 12 times.
  - rule 'linear: variable substitution 3' was applied 2 times.
  - rule 'no_overlap: inferred from x != y constraints' was applied 1 time.
  - rule 'presolve: 91 unused variables removed.' was applied 1 time.
  - rule 'presolve: iteration' was applied 3 times.
  - rule 'probing: reduced enforced constraint to implication.' was applied 2 times.
  - rule 'symmetry: fixed to false in general orbit' was applied 1 time.

Presolved optimization model '': (model_fingerprint: 0xdfad7da8db170f00)
#Variables: 308 (#ints: 9 in objective)
  - 88 Booleans in [0,1]
  - 184 different domains in [-8058,6558] with a largest complexity of 13.
#kExactlyOne: 3 (#literals: 9)
#kInterval: 6
#kLinear2: 709 (#enforced: 667 #multi: 513)
#kLinear3: 501 (#enforced: 349)
#kLinearN: 2'949 (#enforced: 2'825 #multi: 63) (#terms: 25'052)
#kNoOverlap: 1 (#intervals: 6)

Preloading model.
#Bound   0.27s best:inf   next:[260,5877] initial_domain
[Symmetry] Graph for symmetry has 5'026 nodes and 35'088 arcs.
[Symmetry] Symmetry computation done. time: 0.000708065 dtime: 0.00197752
#Model   0.27s var:308/308 constraints:4169/4169

Starting search at 0.27s with 32 workers.
17 full problem subsolvers: [core, default_lp, fixed, lb_tree_search, max_lp, no_lp, objective_lb_search, objective_lb_search_max_lp, objective_lb_search_no_lp, objective_shaving_search_max_lp, objective_shaving_search_no_lp, probing, probing_max_lp, pseudo_costs, quick_restart, quick_restart_no_lp, reduced_costs]
13 first solution subsolvers: [fj_long_default, fj_long_lin_default, fj_long_random, fj_short_default, fj_short_lin_default, fj_short_lin_random, fj_short_random, fs_random(2), fs_random_no_lp, fs_random_quick_restart(2), fs_random_quick_restart_no_lp]
13 incomplete subsolvers: [feasibility_pump, graph_arc_lns, graph_cst_lns, graph_dec_lns, graph_var_lns, rins/rens, rnd_cst_lns, rnd_var_lns, scheduling_intervals_lns, scheduling_precedences_lns, scheduling_time_window_lns, violation_ls(2)]
3 helper subsolvers: [neighborhood_helper, synchronization_agent, update_gap_integral]
#Bound   0.33s best:inf   next:[324,5877] default_lp
#Bound   0.35s best:inf   next:[336,5877] default_lp
#Bound   0.37s best:inf   next:[345,5877] objective_lb_search_no_lp
#1       0.38s best:3314  next:[345,3313] quick_restart_no_lp (fixed_bools=0/136)
#2       0.38s best:2374  next:[345,2373] no_lp (fixed_bools=0/119)
#Bound   0.38s best:2374  next:[347,2373] objective_lb_search_no_lp
#Bound   0.38s best:2374  next:[378,2373] objective_lb_search_no_lp
#Bound   0.38s best:2374  next:[388,2373] objective_lb_search_no_lp
#Bound   0.38s best:2374  next:[434,2373] objective_lb_search_no_lp
#3       0.39s best:2290  next:[434,2289] no_lp (fixed_bools=0/141)
#4       0.40s best:2275  next:[434,2274] no_lp (fixed_bools=0/148)
#5       0.40s best:2270  next:[434,2269] quick_restart_no_lp (fixed_bools=0/171)
#6       0.41s best:2205  next:[434,2204] no_lp (fixed_bools=0/163)
#Bound   0.41s best:2205  next:[790,2204] reduced_costs
#7       0.41s best:1990  next:[790,1989] no_lp (fixed_bools=0/174)
#Bound   0.42s best:1990  next:[791,1989] max_lp
#Bound   0.44s best:1990  next:[798,1989] objective_lb_search_max_lp
#Bound   0.45s best:1990  next:[799,1989] max_lp
#8       0.46s best:1955  next:[799,1954] no_lp (fixed_bools=1/188)
#9       0.46s best:1951  next:[799,1950] no_lp (fixed_bools=1/198)
#Bound   0.48s best:1951  next:[800,1950] objective_lb_search_max_lp
#10      0.50s best:1936  next:[800,1935] no_lp (fixed_bools=1/207)
#Bound   0.51s best:1936  next:[801,1935] lb_tree_search
#Bound   0.51s best:1936  next:[805,1935] objective_lb_search_max_lp
#Bound   0.53s best:1936  next:[806,1935] objective_lb_search_max_lp
#11      0.54s best:1931  next:[806,1930] quick_restart_no_lp (fixed_bools=0/253)
#Bound   0.55s best:1931  next:[808,1930] objective_lb_search_max_lp
#12      0.56s best:1930  next:[808,1929] violation_ls(batch:4 #solutions_imported:4 #lin_moves:430 #lin_evals:31'692 #gen_moves:12'575 #gen_evals:2'927 #comp_moves:1'307 #backtracks:5'631 #weight_updates:279)
#13      0.56s best:1929  next:[808,1928] violation_ls(batch:5 #solutions_imported:5 #lin_moves:1 #lin_evals:38'300 #gen_moves:16'387 #gen_evals:3'158 #comp_moves:1'606 #backtracks:7'388 #weight_updates:214)
#14      0.56s best:1928  next:[808,1927] violation_ls(batch:5 #solutions_imported:5 #lin_moves:431 #lin_evals:31'701 #gen_moves:12'575 #gen_evals:2'927 #comp_moves:1'307 #backtracks:5'631 #weight_updates:279)
#15      0.56s best:1924  next:[808,1923] quick_restart_no_lp (fixed_bools=0/262)
#Bound   0.59s best:1924  next:[810,1923] objective_lb_search_max_lp
#16      0.59s best:1879  next:[810,1878] rnd_var_lns (d=0.91 s=92 t=0.10 p=1.00 stall=4 h=auto_l0)
#17      0.60s best:1877  next:[810,1876] no_lp (fixed_bools=1/240)
#18      0.61s best:1862  next:[810,1861] no_lp (fixed_bools=1/241)
#19      0.61s best:1844  next:[810,1843] no_lp (fixed_bools=1/242)
#Bound   0.63s best:1844  next:[830,1843] objective_lb_search_max_lp
#20      0.63s best:1811  next:[830,1810] quick_restart_no_lp (fixed_bools=0/285)
#21      0.64s best:1810  next:[830,1809] quick_restart_no_lp (fixed_bools=0/290)
#22      0.64s best:1805  next:[830,1804] quick_restart_no_lp (fixed_bools=0/318)
#23      0.67s best:1749  next:[830,1748] graph_dec_lns (d=0.91 s=98 t=0.10 p=1.00 stall=4 h=auto_l0) [presolve]
#Bound   0.70s best:1749  next:[839,1748] objective_lb_search_max_lp
#24      0.78s best:1708  next:[839,1707] default_lp (fixed_bools=0/159)
#Bound   0.79s best:1708  next:[854,1707] objective_lb_search
#25      0.81s best:1658  next:[854,1657] quick_restart (fixed_bools=0/127)
#26      0.91s best:1649  next:[875,1648] quick_restart_no_lp (fixed_bools=0/384)
#27      0.93s best:1644  next:[875,1643] quick_restart_no_lp (fixed_bools=0/389)
#28      0.96s best:1639  next:[875,1638] quick_restart_no_lp (fixed_bools=0/390)
#29      0.97s best:1633  next:[875,1632] quick_restart_no_lp (fixed_bools=0/397)
#30      0.97s best:1630  next:[875,1629] quick_restart_no_lp (fixed_bools=0/404)
#31      1.00s best:1621  next:[936,1620] quick_restart_no_lp (fixed_bools=0/422)
#32      1.01s best:1612  next:[936,1611] quick_restart_no_lp (fixed_bools=0/423)
#Bound   0.98s best:1630  next:[936,1629] objective_lb_search_no_lp [skipped_logs=1]
#33      1.03s best:1568  next:[936,1567] scheduling_intervals_lns (d=0.50 s=41 t=0.10 p=0.00 stall=0 h=auto_l0)
#Bound   1.93s best:1568  next:[1028,1567] objective_lb_search_max_lp [skipped_logs=4]
#34      2.28s best:1560  next:[1044,1559] rins_lp_lns (d=0.90 s=178 t=0.10 p=0.70 stall=1 h=auto_l0)
#Bound   2.77s best:1560  next:[1055,1559] objective_lb_search [skipped_logs=5]
#Bound   3.97s best:1560  next:[1062,1559] objective_lb_search_no_lp [skipped_logs=3]
#Bound   4.90s best:1560  next:[1077,1559] objective_lb_search_max_lp [skipped_logs=1]
#Bound   5.77s best:1560  next:[1080,1559] objective_lb_search_no_lp [skipped_logs=1]
#Bound   6.61s best:1560  next:[1114,1559] objective_lb_search_max_lp [skipped_logs=1]
#Bound   7.70s best:1560  next:[1120,1559] objective_lb_search_no_lp [skipped_logs=0]
#Bound   8.75s best:1560  next:[1122,1559] objective_lb_search_no_lp [skipped_logs=0]
#Bound   9.29s best:1560  next:[1124,1559] objective_lb_search_no_lp [skipped_logs=0]
#Bound  10.07s best:1560  next:[1126,1559] objective_lb_search_no_lp [skipped_logs=0]
#Bound  11.95s best:1560  next:[1132,1559] objective_lb_search_no_lp [skipped_logs=3]
#Bound  12.99s best:1560  next:[1147,1559] objective_lb_search_no_lp [skipped_logs=2]
#Bound  13.95s best:1560  next:[1167,1559] objective_lb_search_no_lp [skipped_logs=4]
#Bound  14.74s best:1560  next:[1193,1559] objective_lb_search_no_lp [skipped_logs=5]
#Bound  15.31s best:1560  next:[1197,1559] objective_lb_search_no_lp [skipped_logs=0]
#Bound  16.65s best:1560  next:[1200,1559] objective_lb_search_no_lp [skipped_logs=0]
#Bound  17.32s best:1560  next:[1202,1559] objective_lb_search_no_lp [skipped_logs=0]
#Bound  18.14s best:1560  next:[1203,1559] objective_lb_search_no_lp [skipped_logs=0]
#Bound  19.89s best:1560  next:[1206,1559] objective_lb_search_no_lp [skipped_logs=1]
#Bound  21.41s best:1560  next:[1207,1559] lb_tree_search (nodes=2552/2559 rc=15 decisions=22240 @root=31 restarts=10) 
#Bound  21.75s best:1560  next:[1209,1559] objective_lb_search_no_lp [skipped_logs=0]
#Bound  22.86s best:1560  next:[1218,1559] objective_lb_search_no_lp [skipped_logs=1]
#Bound  23.99s best:1560  next:[1223,1559] objective_lb_search_no_lp [skipped_logs=2]
#Bound  24.62s best:1560  next:[1228,1559] objective_lb_search_no_lp [skipped_logs=2]
#Bound  26.15s best:1560  next:[1230,1559] objective_lb_search_no_lp
#Bound  26.65s best:1560  next:[1232,1559] objective_lb_search_no_lp [skipped_logs=0]
#Bound  29.18s best:1560  next:[1233,1559] lb_tree_search (nodes=3260/3269 rc=23 decisions=29144 @root=34 restarts=10) 
#Bound  29.97s best:1560  next:[1234,1559] lb_tree_search (nodes=3293/3302 rc=24 decisions=29618 @root=35 restarts=10) 
#Bound  31.07s best:1560  next:[1235,1559] lb_tree_search (nodes=3349/3358 rc=24 decisions=30359 @root=36 restarts=10) 
#Bound  32.08s best:1560  next:[1236,1559] lb_tree_search (nodes=3408/3417 rc=24 decisions=31051 @root=37 restarts=10) 
#Bound  32.77s best:1560  next:[1251,1559] objective_lb_search_no_lp
#Bound  35.67s best:1560  next:[1253,1559] objective_lb_search_no_lp
#Bound  37.54s best:1560  next:[1254,1559] objective_lb_search_no_lp
#Bound  38.80s best:1560  next:[1255,1559] objective_lb_search_no_lp
#Bound  40.43s best:1560  next:[1256,1559] lb_tree_search (nodes=4354/4366 rc=43 decisions=38843 @root=42 restarts=10) 
#Bound  41.69s best:1560  next:[1257,1559] lb_tree_search (nodes=4408/4420 rc=44 decisions=39700 @root=43 restarts=10) 
#Bound  42.56s best:1560  next:[1261,1559] objective_lb_search_no_lp
#Bound  44.68s best:1560  next:[1262,1559] objective_lb_search_no_lp
#Bound  45.14s best:1560  next:[1263,1559] objective_lb_search_no_lp
#Bound  45.23s best:1560  next:[1264,1559] objective_lb_search_no_lp
#Bound  46.02s best:1560  next:[1266,1559] objective_lb_search_no_lp
#Bound  46.31s best:1560  next:[1267,1559] objective_lb_search_no_lp
#Bound  47.42s best:1560  next:[1268,1559] objective_lb_search_no_lp
#Bound  47.86s best:1560  next:[1269,1559] objective_lb_search_no_lp
#Bound  48.55s best:1560  next:[1273,1559] objective_lb_search_no_lp
#Bound  49.56s best:1560  next:[1275,1559] objective_lb_search_no_lp
#Bound  50.55s best:1560  next:[1279,1559] objective_lb_search_no_lp
#Bound  51.73s best:1560  next:[1280,1559] objective_lb_search_no_lp
#Bound  52.52s best:1560  next:[1283,1559] objective_lb_search_no_lp
#Model  53.63s var:307/308 constraints:3990/4169
#Bound  53.75s best:1560  next:[1287,1559] objective_lb_search_no_lp
#Bound  57.98s best:1560  next:[1288,1559] lb_tree_search (nodes=6057/6429 rc=87 decisions=57195 @root=47 restarts=10) 
#Bound  58.60s best:1560  next:[1290,1559] objective_lb_search_no_lp
#Bound  60.24s best:1560  next:[1293,1559] objective_lb_search_no_lp
#Bound  61.77s best:1560  next:[1295,1559] objective_lb_search_no_lp
#Bound  62.14s best:1560  next:[1296,1559] objective_lb_search_no_lp
#Bound  63.21s best:1560  next:[1297,1559] objective_lb_search_no_lp
#Bound  63.63s best:1560  next:[1299,1559] objective_lb_search_no_lp
#Bound  67.16s best:1560  next:[1300,1559] lb_tree_search (nodes=6629/7254 rc=123 decisions=66218 @root=51 restarts=10) 
#Bound  67.59s best:1560  next:[1338,1559] objective_lb_search_no_lp
#Bound  70.06s best:1560  next:[1339,1559] objective_lb_search_no_lp
#Bound  70.49s best:1560  next:[1343,1559] objective_lb_search_no_lp
#Bound  70.94s best:1560  next:[1344,1559] objective_lb_search_no_lp
#Bound  71.75s best:1560  next:[1345,1559] objective_lb_search_no_lp
#Bound  74.58s best:1560  next:[1346,1559] objective_lb_search_no_lp
#Model  77.50s var:305/308 constraints:3889/4169
#Bound  79.56s best:1560  next:[1350,1559] objective_lb_search_no_lp
#Bound  81.10s best:1560  next:[1357,1559] objective_lb_search_no_lp
#Bound  81.46s best:1560  next:[1359,1559] objective_lb_search_no_lp
#Bound  81.77s best:1560  next:[1360,1559] objective_lb_search_no_lp
#Bound  82.18s best:1560  next:[1367,1559] objective_lb_search_no_lp
#Bound  82.74s best:1560  next:[1370,1559] objective_lb_search_no_lp
#Model  82.96s var:303/308 constraints:3826/4169
#Bound  83.24s best:1560  next:[1371,1559] objective_lb_search_no_lp
#Bound  83.74s best:1560  next:[1372,1559] objective_lb_search_no_lp
#Bound  83.82s best:1560  next:[1373,1559] objective_lb_search_no_lp
#Model  83.89s var:293/308 constraints:3174/4169
#Bound  83.91s best:1560  next:[1375,1559] objective_lb_search_no_lp
#Bound  83.92s best:1560  next:[1391,1559] objective_lb_search_no_lp
#Bound  83.93s best:1560  next:[1469,1559] objective_lb_search_no_lp
#Bound  83.95s best:1560  next:[1470,1559] objective_lb_search_no_lp
#Bound  83.96s best:1560  next:[1483,1559] objective_lb_search_no_lp
#Model  83.97s var:292/308 constraints:3161/4169
#Bound  83.97s best:1560  next:[1504,1559] objective_lb_search_no_lp
#Bound  83.98s best:1560  next:[1527,1559] objective_lb_search_no_lp
#Done   83.98s no_lp
#Done   83.98s objective_lb_search_no_lp
#Done   83.98s quick_restart_no_lp
#Model  83.98s var:279/308 constraints:2188/4169
#Done   83.98s core

Task timing                                  n [     min,      max]      avg      dev     time         n [     min,      max]      avg      dev    dtime
                             'core':         1 [   1.39m,    1.39m]    1.39m   0.00ns    1.39m         1 [   2.51m,    2.51m]    2.51m   0.00ns    2.51m
                       'default_lp':         1 [   1.40m,    1.40m]    1.40m   0.00ns    1.40m         1 [  29.88s,   29.88s]   29.88s   0.00ns   29.88s
                 'feasibility_pump':       269 [ 11.01ms, 184.06ms]  92.87ms   8.87ms   24.98s       268 [ 24.16ms,  50.47ms]  24.97ms   1.58ms    6.69s
                            'fixed':         1 [   1.39m,    1.39m]    1.39m   0.00ns    1.39m         1 [  26.61s,   26.61s]   26.61s   0.00ns   26.61s
                  'fj_long_default':         1 [ 74.97ms,  74.97ms]  74.97ms   0.00ns  74.97ms         1 [ 50.64ms,  50.64ms]  50.64ms   0.00ns  50.64ms
              'fj_long_lin_default':         1 [ 84.33ms,  84.33ms]  84.33ms   0.00ns  84.33ms         1 [ 82.13ms,  82.13ms]  82.13ms   0.00ns  82.13ms
                   'fj_long_random':         1 [ 67.85ms,  67.85ms]  67.85ms   0.00ns  67.85ms         1 [ 49.43ms,  49.43ms]  49.43ms   0.00ns  49.43ms
                 'fj_short_default':         1 [ 68.20ms,  68.20ms]  68.20ms   0.00ns  68.20ms         1 [ 84.72ms,  84.72ms]  84.72ms   0.00ns  84.72ms
             'fj_short_lin_default':         1 [ 83.70ms,  83.70ms]  83.70ms   0.00ns  83.70ms         1 [ 82.03ms,  82.03ms]  82.03ms   0.00ns  82.03ms
              'fj_short_lin_random':         1 [ 79.07ms,  79.07ms]  79.07ms   0.00ns  79.07ms         1 [ 84.64ms,  84.64ms]  84.64ms   0.00ns  84.64ms
                  'fj_short_random':         1 [ 84.48ms,  84.48ms]  84.48ms   0.00ns  84.48ms         1 [ 80.60ms,  80.60ms]  80.60ms   0.00ns  80.60ms
                        'fs_random':         1 [ 45.06ms,  45.06ms]  45.06ms   0.00ns  45.06ms         1 [260.81us, 260.81us] 260.81us   0.00ns 260.81us
                        'fs_random':         1 [ 45.45ms,  45.45ms]  45.45ms   0.00ns  45.45ms         1 [260.83us, 260.83us] 260.83us   0.00ns 260.83us
                  'fs_random_no_lp':         1 [ 45.39ms,  45.39ms]  45.39ms   0.00ns  45.39ms         1 [  1.19ms,   1.19ms]   1.19ms   0.00ns   1.19ms
          'fs_random_quick_restart':         1 [ 44.94ms,  44.94ms]  44.94ms   0.00ns  44.94ms         1 [260.76us, 260.76us] 260.76us   0.00ns 260.76us
          'fs_random_quick_restart':         1 [ 45.52ms,  45.52ms]  45.52ms   0.00ns  45.52ms         1 [254.92us, 254.92us] 254.92us   0.00ns 254.92us
    'fs_random_quick_restart_no_lp':         1 [ 45.05ms,  45.05ms]  45.05ms   0.00ns  45.05ms         1 [686.60us, 686.60us] 686.60us   0.00ns 686.60us
                    'graph_arc_lns':       269 [  8.58ms, 810.93ms] 411.81ms 215.55ms    1.85m       265 [ 10.00ns, 200.80ms]  65.58ms  44.27ms   17.38s
                    'graph_cst_lns':       269 [  1.97ms, 764.11ms] 387.13ms 215.87ms    1.74m       266 [ 10.00ns, 104.15ms]  60.69ms  43.10ms   16.14s
                    'graph_dec_lns':       268 [  8.27ms, 690.86ms] 403.43ms 215.00ms    1.80m       268 [ 10.00ns, 108.58ms]  62.40ms  44.31ms   16.72s
                    'graph_var_lns':       269 [  5.00ms, 705.21ms] 387.46ms 228.93ms    1.74m       267 [ 10.00ns, 148.97ms]  61.30ms  47.10ms   16.37s
                   'lb_tree_search':         1 [   1.39m,    1.39m]    1.39m   0.00ns    1.39m         1 [  49.29s,   49.29s]   49.29s   0.00ns   49.29s
                           'max_lp':         1 [   1.39m,    1.39m]    1.39m   0.00ns    1.39m         1 [  33.04s,   33.04s]   33.04s   0.00ns   33.04s
                            'no_lp':         1 [   1.39m,    1.39m]    1.39m   0.00ns    1.39m         1 [  23.94s,   23.94s]   23.94s   0.00ns   23.94s
              'objective_lb_search':         1 [   1.39m,    1.39m]    1.39m   0.00ns    1.39m         1 [  31.09s,   31.09s]   31.09s   0.00ns   31.09s
       'objective_lb_search_max_lp':         1 [   1.39m,    1.39m]    1.39m   0.00ns    1.39m         1 [  38.32s,   38.32s]   38.32s   0.00ns   38.32s
        'objective_lb_search_no_lp':         1 [   1.39m,    1.39m]    1.39m   0.00ns    1.39m         1 [  18.44s,   18.44s]   18.44s   0.00ns   18.44s
  'objective_shaving_search_max_lp':       111 [ 12.66ms,    5.00s] 735.39ms 856.29ms    1.36m       102 [124.69us,    1.36s] 191.86ms 245.54ms   19.57s
   'objective_shaving_search_no_lp':       111 [ 12.18ms,    4.99s] 735.92ms 855.94ms    1.36m       102 [123.83us, 937.25ms] 130.21ms 162.91ms   13.28s
                          'probing':         1 [   1.39m,    1.39m]    1.39m   0.00ns    1.39m         1 [  14.88s,   14.88s]   14.88s   0.00ns   14.88s
                   'probing_max_lp':         1 [   1.39m,    1.39m]    1.39m   0.00ns    1.39m         1 [  30.48s,   30.48s]   30.48s   0.00ns   30.48s
                     'pseudo_costs':         1 [   1.39m,    1.39m]    1.39m   0.00ns    1.39m         1 [  31.08s,   31.08s]   31.08s   0.00ns   31.08s
                    'quick_restart':         1 [   1.39m,    1.39m]    1.39m   0.00ns    1.39m         1 [  33.66s,   33.66s]   33.66s   0.00ns   33.66s
              'quick_restart_no_lp':         1 [   1.39m,    1.39m]    1.39m   0.00ns    1.39m         1 [  36.28s,   36.28s]   36.28s   0.00ns   36.28s
                    'reduced_costs':         1 [   1.39m,    1.39m]    1.39m   0.00ns    1.39m         1 [  34.10s,   34.10s]   34.10s   0.00ns   34.10s
                        'rins/rens':       269 [ 90.39us, 593.81ms] 290.83ms 208.09ms    1.30m       217 [ 10.00ns, 101.26ms]  73.29ms  36.08ms   15.90s
                      'rnd_cst_lns':       269 [  1.61ms, 743.46ms] 402.58ms 212.43ms    1.80m       267 [ 10.00ns, 108.80ms]  63.75ms  43.06ms   17.02s
                      'rnd_var_lns':       269 [  3.78ms, 785.59ms] 390.96ms 220.76ms    1.75m       268 [ 10.00ns, 110.57ms]  61.85ms  44.67ms   16.57s
         'scheduling_intervals_lns':       268 [171.44ms, 814.28ms] 593.70ms  47.74ms    2.65m       268 [  4.15ms, 110.51ms] 101.82ms   8.67ms   27.29s
       'scheduling_precedences_lns':       268 [166.33ms, 923.02ms] 594.75ms  48.61ms    2.66m       268 [  3.62ms, 110.51ms] 101.88ms   8.73ms   27.30s
       'scheduling_time_window_lns':       268 [170.39ms, 761.55ms] 592.67ms  43.23ms    2.65m       267 [ 71.51ms, 110.71ms] 102.21ms   6.10ms   27.29s
                     'violation_ls':       269 [359.65us,  61.30ms]  47.21ms   5.73ms   12.70s       269 [  1.16us,  93.82ms]  79.84ms   9.17ms   21.48s
                     'violation_ls':       269 [591.48us, 158.26ms]  70.31ms  20.93ms   18.91s       269 [  1.28us, 302.08ms] 134.05ms  68.00ms   36.06s

Search stats                        Bools  Conflicts  Branches  Restarts  BoolPropag  IntegerPropag
                           'core':  7'644     33'361    50'547     2'879  79'322'040     30'558'701
                     'default_lp':  1'852     36'111   136'632    14'534  19'785'829     38'219'368
                          'fixed':  1'451     92'891   108'289       513  35'807'569     50'496'546
                      'fs_random':     88          0       176       176          18          5'138
                      'fs_random':     88          0       176       176          18          5'138
                'fs_random_no_lp':    118         24       232       176         310          9'452
        'fs_random_quick_restart':     88          0       176       176          18          5'138
        'fs_random_quick_restart':     88          0       176       176          18          5'138
  'fs_random_quick_restart_no_lp':     88          0       249       176          21          7'715
                 'lb_tree_search':    103        317   155'935    27'034     385'617     13'957'458
                         'max_lp':     88     22'405   144'195    17'358     944'430     35'363'529
                          'no_lp':  1'258     74'714   176'722    15'815  25'152'495     74'360'548
            'objective_lb_search':    248     20'521   181'340    33'349   1'302'198     36'899'734
     'objective_lb_search_max_lp':    227     14'024   217'584    46'715   1'388'483     34'714'807
      'objective_lb_search_no_lp':    378     61'414   152'532    14'322   2'443'769     63'897'117
                        'probing':    543        283     3'983     2'495      36'292        255'846
                 'probing_max_lp':    543        327     2'257     1'608      28'544        214'352
                   'pseudo_costs':    738     29'222   143'096    18'299   6'226'275     36'877'778
                  'quick_restart':  2'040     26'377   159'207    18'063  15'514'611     27'169'939
            'quick_restart_no_lp':  3'036     82'365   269'545    17'485  54'377'104     59'371'233
                  'reduced_costs':  1'575     32'770   197'364    17'436  19'269'975     37'219'953

SAT stats                           ClassicMinim  LitRemoved  LitLearned  LitForgotten  Subsumed  MClauses  MDecisions  MLitTrue  MSubsumed  MLitRemoved  MReused
                           'core':        31'025     233'893     225'965           781       122       819       3'751         0         93          284        8
                     'default_lp':        30'198     155'822     444'932       157'608       583     7'868      75'817         1      4'367       33'435    1'005
                          'fixed':        79'849     277'954   1'780'563             0        23        84         694         0         31          204       31
                      'fs_random':             0           0           0             0         0         0           0         0          0            0        0
                      'fs_random':             0           0           0             0         0         0           0         0          0            0        0
                'fs_random_no_lp':            17          19         262             0         0         0           0         0          0            0        0
        'fs_random_quick_restart':             0           0           0             0         0         0           0         0          0            0        0
        'fs_random_quick_restart':             0           0           0             0         0         0           0         0          0            0        0
  'fs_random_quick_restart_no_lp':             0           0           0             0         0         0           0         0          0            0        0
                 'lb_tree_search':            49          71       1'444             0         0    10'042      51'212         0         43          162      645
                         'max_lp':        17'196      57'898     279'387       102'171       655     9'180     114'586         0      1'747       13'209    2'446
                          'no_lp':        66'163     353'569   1'055'260       640'054       728     7'543      62'253         0      2'935       20'502      981
            'objective_lb_search':        16'706      57'840     187'865         2'866       588    14'851     143'993         0      1'809       12'478    3'353
     'objective_lb_search_max_lp':        10'974      35'626     130'329         3'064       559    17'929     176'728         0      1'392        9'057    4'262
      'objective_lb_search_no_lp':        52'769     220'499     565'569        93'233     1'144     7'708      77'843         4      3'412       25'243    1'478
                        'probing':             0           0         283             0         0         0           0         0          0            0        0
                 'probing_max_lp':             0           0         327             0         0         0           0         0          0            0        0
                   'pseudo_costs':        23'979      95'012     369'852       108'509       579     9'541      97'909         0      3'774       27'802    1'795
                  'quick_restart':        19'313      84'605     289'894        43'791       619     9'859     100'620         3      5'989       53'078    1'578
            'quick_restart_no_lp':        65'557     379'864   1'105'253       371'596       593     6'913      70'488         0      5'176       49'647      715
                  'reduced_costs':        26'033     108'958     501'048       239'182       437     8'224      84'875         0      2'137       16'160    1'462

Lp stats                         Component  Iterations  AddedCuts  OPTIMAL  DUAL_F.  DUAL_U.
                  'default_lp':          1     370'485     20'589   59'860        0        0
                       'fixed':          1      31'728      1'169   92'755        0        0
                   'fs_random':          1         185        190        5        0        0
                   'fs_random':          1         185        229        5        0        0
     'fs_random_quick_restart':          1         185        152        4        0        0
     'fs_random_quick_restart':          1         185        230        5        0        0
              'lb_tree_search':          1   1'227'331      6'001   76'584   27'171        0
                      'max_lp':          1     586'635     12'338   42'640   15'283       10
         'objective_lb_search':          1     493'275     10'773   46'946        0        3
  'objective_lb_search_max_lp':          1     635'147      8'829   30'756    7'685        9
                     'probing':          1     156'532      7'098    9'982        0        4
              'probing_max_lp':          1     139'142     22'065    7'370      595        0
                'pseudo_costs':          1     544'477     15'859   46'641   17'612        5
               'quick_restart':          1     492'415      8'646   48'773        0        0
               'reduced_costs':          1     507'633     23'069   50'254   16'161       10

Lp dimension                                                                       Final dimension of first component
                  'default_lp':    681 rows, 304 columns, 3219 entries with magnitude in [3.982651e-03, 1.000000e+00]
                       'fixed':     182 rows, 304 columns, 678 entries with magnitude in [3.668644e-02, 1.000000e+00]
                   'fs_random':     149 rows, 304 columns, 557 entries with magnitude in [3.668644e-02, 1.000000e+00]
                   'fs_random':     149 rows, 304 columns, 557 entries with magnitude in [3.668644e-02, 1.000000e+00]
     'fs_random_quick_restart':     149 rows, 304 columns, 557 entries with magnitude in [3.668644e-02, 1.000000e+00]
     'fs_random_quick_restart':     149 rows, 304 columns, 557 entries with magnitude in [3.668644e-02, 1.000000e+00]
              'lb_tree_search':    348 rows, 308 columns, 1284 entries with magnitude in [9.536186e-03, 1.000000e+00]
                      'max_lp':    761 rows, 308 columns, 2911 entries with magnitude in [6.608642e-03, 1.000000e+00]
         'objective_lb_search':    580 rows, 304 columns, 2001 entries with magnitude in [3.291207e-03, 1.000000e+00]
  'objective_lb_search_max_lp':    838 rows, 308 columns, 3154 entries with magnitude in [8.351366e-04, 1.000000e+00]
                     'probing':    766 rows, 304 columns, 4193 entries with magnitude in [1.986874e-03, 1.000000e+00]
              'probing_max_lp':  1277 rows, 308 columns, 15103 entries with magnitude in [5.674078e-05, 1.000000e+00]
                'pseudo_costs':    422 rows, 308 columns, 1539 entries with magnitude in [1.540323e-02, 1.000000e+00]
               'quick_restart':    774 rows, 304 columns, 2983 entries with magnitude in [7.548976e-04, 1.000000e+00]
               'reduced_costs':   1065 rows, 308 columns, 3379 entries with magnitude in [1.155513e-04, 1.000000e+00]

Lp debug                         CutPropag  CutEqPropag  Adjust  Overflow        Bad  BadScaling
                  'default_lp':         21           25  28'582         0    306'960           0
                       'fixed':          0            0   8'478         0      2'783           0
                   'fs_random':          0            0       0         0        114           0
                   'fs_random':          0            0       0         0        245           0
     'fs_random_quick_restart':          0            0       0         0        128           0
     'fs_random_quick_restart':          0            0       0         0        269           0
              'lb_tree_search':          3           32  56'851         0    130'673           0
                      'max_lp':          8           23  26'145         0    223'719           0
         'objective_lb_search':          5           12  19'867         0    412'178           0
  'objective_lb_search_max_lp':          6           21  21'976         0    265'004           0
                     'probing':         24           40   7'146         0  7'768'290           0
              'probing_max_lp':         48          318   6'686         0  4'073'966           0
                'pseudo_costs':         44           12  27'845         0    261'940           0
               'quick_restart':         17           12  27'242         0    851'112           0
               'reduced_costs':         81           22  33'991         0    287'091           0

Lp pool                          Constraints  Updates  Simplif  Merged  Shortened   Split  Strenghtened      Cuts/Call
                  'default_lp':        9'412    1'379   20'707     498      2'401  12'953         9'484  20'589/78'439
                       'fixed':        1'490       11        0       0          0       5            58    1'169/1'855
                   'fs_random':          511        0        0       0          0       0             0        190/297
                   'fs_random':          550        0        0       0          0       0             9        229/363
     'fs_random_quick_restart':          473        0        0       0          0       0             0        152/235
     'fs_random_quick_restart':          551        0        0       0          0       0             8        230/374
              'lb_tree_search':       10'135    1'225   65'304      28      1'761   2'130        57'202   6'001/50'664
                      'max_lp':       13'332    1'497  141'056     168      2'600   8'722        65'035  12'338/41'288
         'objective_lb_search':        9'921    1'650   42'818     173      6'771  16'557        11'883  10'773/50'381
  'objective_lb_search_max_lp':       12'920    1'965  141'153      71      4'013  13'609        78'426   8'829/32'805
                     'probing':        7'402    1'975   47'939      17        847  27'648         5'068   7'098/21'489
              'probing_max_lp':       13'216    6'498  164'446      11      1'963  50'734        51'347  22'065/60'229
                'pseudo_costs':       13'770    1'481  147'545     251      3'901  10'220        74'257  15'859/47'823
               'quick_restart':        8'878    2'197  128'950      89      5'048  69'253        12'515   8'646/47'644
               'reduced_costs':       12'871    2'079  194'669     360     12'101  15'438        90'363  23'069/61'287

Lp Cut                                         fs_ran  fs_ran  fs_ran  fs_ran  defaul  fixed  max_lp  quick_  reduce  pseudo  lb_tre  probin  object  probin  object
                                       CG_FF:       9       9       9       9   1'000     90     731     173   1'593   1'013     256     212     338     265     355
                                        CG_K:       9       9       9       9     624     45     523      75   1'277     647     207      71     177     254     242
                                        CG_R:       5       5       5       5     910     52     523      68   1'407     769     244     107     203     783     264
                                       CG_RB:       1       1       1       1   2'058    177   1'791     693   3'634   2'018     611     495   1'140   1'500     949
                                      CG_RBP:       -       -       -       -     303     21     258      90     673     373     103      49      81     238     137
                                      Clique:       -       -       -       -       -      -      74       -      95      84      59       -       -      57      83
                                          IB:      87      50      87      87   4'272    307   1'432   1'653   2'755   1'700   1'086   1'718   1'617   1'115   1'041
                                    MIR_1_FF:      31      33      43      48   1'015     93     553     486   1'011     636     241     366     658     319     302
                                     MIR_1_K:       6       6       7       8     138     13      99      51     209     158      32      39      78      47      63
                                    MIR_1_KL:       -       -       -       -      18      -       4       6       3       7       1       6       -       7       -
                                     MIR_1_R:      10      10      13      16     213     26     123      57     267     127      47      51     112     101      67
                                    MIR_1_RB:       8       9      14      12   2'105     69   1'303   1'027   1'968   1'688     592     680   1'380     776     904
                                   MIR_1_RBP:       -       -       -       -     100      6     195      42     337     305      99      28      48      78     143
                                   MIR_1_RLT:       -       -       -       -       -      -       6       -      12       8       4       -       -       8       7
                                    MIR_2_FF:       5       3       7       9     597     30     264     273     600     397      90     195     363     134     176
                                     MIR_2_K:       4       2       3       2     132      8      55      42     131      81      13      29      77      17      23
                                    MIR_2_KL:       -       -       -       -      13      -       8       3       9       6       3       5       1       9       -
                                     MIR_2_R:       3       2       3       3     177     11      57      45     175     128      41      27      86     100      61
                                    MIR_2_RB:       7       3      11       8   1'261     41     562     673     984     817     257     443     811     384     459
                                   MIR_2_RBP:       1       -       -       -      91      4      79      46     142     121      28      30      37      38      64
                                    MIR_3_FF:       -       -       1       -     394     16     209     214     425     301      69     104     250      87     116
                                     MIR_3_K:       -       -       -       -     120      3      46      30     117      82      17      22      60      16      23
                                    MIR_3_KL:       -       -       -       -      10      -      11       7      14       9       4       7       -      11       4
                                     MIR_3_R:       -       -       1       1     138      3      65      31     131      88      22      27      71     113      49
                                    MIR_3_RB:       1       -       2       2     761     22     419     459     679     578     221     300     494     437     353
                                   MIR_3_RBP:       -       -       -       -      57      1      76      23     120     105      53      15      32      56      76
                                    MIR_4_FF:       -       -       -       2     327      6     108     136     215     174      48      91     160      66      61
                                     MIR_4_K:       -       -       -       1     122      5      30      37      90      61      21      19      64       9      21
                                    MIR_4_KL:       -       -       -       -       8      -       7       2      13       9       3      12       1       9       2
                                     MIR_4_R:       -       -       -       -     127      3      43      24      81      58      23      21      57      83      40
                                    MIR_4_RB:       -       -       2       4     569     14     246     255     376     310     131     178     275     291     176
                                   MIR_4_RBP:       -       -       -       -      46      1      38      14      82      55      20      13      19      33      40
                                    MIR_5_FF:       -       -       1       -     160      5      64      67     113      82      27      32      87      52      25
                                     MIR_5_K:       -       -       -       -      62      2      18      20      53      35      16      21      34      14      18
                                    MIR_5_KL:       -       -       -       -       4      -       5       3       7       6       5       7       1       3       1
                                     MIR_5_R:       -       -       1       -      91      3      28      26      35      24      10      10      36      48      17
                                    MIR_5_RB:       -       -       2       -     251      6     144     119     214     153      65     100     138     172      88
                                   MIR_5_RBP:       -       -       -       -      29      1      16       9      33      18       9       5      10      20      22
                                    MIR_6_FF:       -       -       -       -      63      1      30      42      75      63      16      18      42      30      22
                                     MIR_6_K:       -       -       -       -      32      -      19      13      42      30       7      12      12      12      17
                                    MIR_6_KL:       -       -       -       -       6      -       1       2      10       3       2       9       7       8       2
                                     MIR_6_R:       -       -       -       1      42      1      14      11      27      20       4       6      25      30      19
                                    MIR_6_RB:       -       -       -       1     139      2     120      52     141     141      38      44      73     121      87
                                   MIR_6_RBP:       -       -       -       -       6      1      18       9      30      22       7      17       4      17      14
  NoOverlapCompletionTimeExhaustive_weighted:       -       -       -       -       -      -      39       -      78      66      12       -       -       6      29
                 NoOverlapDisjunctionOnStart:       -       -       -       -       -      -       8       -      37      16       6       -       -       5      13
                                ZERO_HALF_FF:       1       3       3       1     223     24     130      51     321     217      49      36      86      55      60
                                 ZERO_HALF_K:       1       2       1       -      34      3      38       6      80      71      11       7      12      26      21
                                 ZERO_HALF_R:       1       2       1       -   1'240     27   1'246   1'121   1'420   1'330     843   1'168   1'219  12'898   1'664
                                ZERO_HALF_RB:       -       3       2       -     398     24     378     282     574     535     187     211     248     657     337
                               ZERO_HALF_RBP:       -       -       -       -     103      2      84      78     154     114      41      35      49     450      72

LNS stats                        Improv/Calls  Closed  Difficulty  TimeLimit
               'graph_arc_lns':         1/269     52%        0.98       0.11
               'graph_cst_lns':         5/266     52%        0.98       0.10
               'graph_dec_lns':         2/268     53%        0.99       0.11
               'graph_var_lns':         0/268     49%        0.96       0.11
                   'rins/rens':        31/244     50%        0.84       0.10
                 'rnd_cst_lns':         1/267     52%        0.99       0.11
                 'rnd_var_lns':         1/269     52%        0.99       0.11
    'scheduling_intervals_lns':         6/268     15%        0.00       0.11
  'scheduling_precedences_lns':         6/268     15%        0.00       0.11
  'scheduling_time_window_lns':         4/268     15%        0.00       0.11

LS stats                   Batches  Restarts   LinMoves  GenMoves  CompoundMoves  WeightUpdates
       'fj_long_default':        1         1      5'667         0              0            103
   'fj_long_lin_default':        1         1          0     2'273            233              0
        'fj_long_random':        1         1      5'508         0              0             97
      'fj_short_default':        1         1          0     2'383            314              1
  'fj_short_lin_default':        1         1          0     2'076            322              0
   'fj_short_lin_random':        1         1          0     2'202            266              0
       'fj_short_random':        1         1          0     2'349            332              0
          'violation_ls':      269         0  1'831'050   158'797         11'882        239'214
          'violation_ls':      269         0        431   910'534         60'570            889

Solutions (34)                 Num     Rank
                'default_lp':    1  [24,24]
             'graph_dec_lns':    1  [23,23]
                     'no_lp':   11   [2,19]
             'quick_restart':    1  [25,25]
       'quick_restart_no_lp':   14   [1,32]
               'rins_lp_lns':    1  [34,34]
               'rnd_var_lns':    1  [16,16]
  'scheduling_intervals_lns':    1  [33,33]
              'violation_ls':    3  [12,14]

Objective bounds                 Num
                  'default_lp':    2
              'initial_domain':    1
              'lb_tree_search':   11
                      'max_lp':    2
         'objective_lb_search':    6
  'objective_lb_search_max_lp':   13
   'objective_lb_search_no_lp':  102
               'reduced_costs':    1

Solution repositories    Added  Queried  Ignored  Synchro
  'feasible solutions':  2'599    6'112        3    2'462
        'lp solutions':  1'307      126        0    1'033
                'pump':  5'625      143

Improving bounds shared            Num
                        'core':      5
                  'default_lp':    107
              'lb_tree_search':     48
                      'max_lp':    128
                       'no_lp':    199
         'objective_lb_search':      5
  'objective_lb_search_max_lp':     39
                     'probing':    857
              'probing_max_lp':    413
                'pseudo_costs':    259
               'quick_restart':    190
         'quick_restart_no_lp':  1'905
               'reduced_costs':    298

Clauses shared                   Num
                        'core':    1
                  'default_lp':   17
              'lb_tree_search':    1
                      'max_lp':    9
                       'no_lp':   31
         'objective_lb_search':   15
  'objective_lb_search_max_lp':   11
   'objective_lb_search_no_lp':    4
                'pseudo_costs':   23
               'quick_restart':    1
         'quick_restart_no_lp':   15
               'reduced_costs':    9

CpSolverResponse summary:
status: OPTIMAL
objective: 1560
best_bound: 1560
integers: 305
booleans: 88
conflicts: 0
branches: 176
propagations: 18
integer_propagations: 5138
restarts: 176
lp_iterations: 185
walltime: 84.0682
usertime: 84.0682
deterministic_time: 877.447
gap_integral: 2241.05
solution_fingerprint: 0x5ffa2e0bb2d855a7


--- Simulation Gantt  partir du modle mathmatique ---
