created virtual environment CPython3.12.4.final.0-64 in 15676ms
  creator CPython3Posix(dest=/localscratch/aneumann.63393239.0/env, clear=False, no_vcs_ignore=False, global=False)
  seeder FromAppData(download=False, pip=bundle, via=copy, app_data_dir=/home/aneumann/.local/share/virtualenv)
    added seed packages: pip==25.1.1
  activators BashActivator,CShellActivator,FishActivator,NushellActivator,PowerShellActivator,PythonActivator
Looking in links: /cvmfs/soft.computecanada.ca/custom/python/wheelhouse/gentoo2023/x86-64-v3, /cvmfs/soft.computecanada.ca/custom/python/wheelhouse/gentoo2023/generic, /cvmfs/soft.computecanada.ca/custom/python/wheelhouse/generic
Requirement already satisfied: pip in /localscratch/aneumann.63393239.0/env/lib/python3.12/site-packages (25.1.1)
Looking in links: /cvmfs/soft.computecanada.ca/custom/python/wheelhouse/gentoo2023/x86-64-v3, /cvmfs/soft.computecanada.ca/custom/python/wheelhouse/gentoo2023/generic, /cvmfs/soft.computecanada.ca/custom/python/wheelhouse/generic
ERROR: protobuf-5.28.3-cp38-abi3-manylinux2014_x86_64.whl is not a supported wheel on this platform.
Looking in links: /cvmfs/soft.computecanada.ca/custom/python/wheelhouse/gentoo2023/x86-64-v3, /cvmfs/soft.computecanada.ca/custom/python/wheelhouse/gentoo2023/generic, /cvmfs/soft.computecanada.ca/custom/python/wheelhouse/generic
Processing /home/aneumann/projects/def-adhaj/aneumann/GNRS/wheels/immutabledict-4.2.0-py3-none-any.whl
Installing collected packages: immutabledict
Successfully installed immutabledict-4.2.0
Looking in links: /cvmfs/soft.computecanada.ca/custom/python/wheelhouse/gentoo2023/x86-64-v3, /cvmfs/soft.computecanada.ca/custom/python/wheelhouse/gentoo2023/generic, /cvmfs/soft.computecanada.ca/custom/python/wheelhouse/generic
Processing /cvmfs/soft.computecanada.ca/custom/python/wheelhouse/generic/ortools-9.10.4067+computecanada-cp312-cp312-linux_x86_64.whl (from -r /home/aneumann/projects/def-adhaj/aneumann/GNRS/requirements/or.txt (line 1))
Processing /cvmfs/soft.computecanada.ca/custom/python/wheelhouse/gentoo2023/x86-64-v3/matplotlib-3.10.0+computecanada-cp312-cp312-linux_x86_64.whl (from -r /home/aneumann/projects/def-adhaj/aneumann/GNRS/requirements/or.txt (line 2))
Processing /cvmfs/soft.computecanada.ca/custom/python/wheelhouse/gentoo2023/x86-64-v3/pandas-2.2.3+computecanada-cp312-cp312-linux_x86_64.whl (from -r /home/aneumann/projects/def-adhaj/aneumann/GNRS/requirements/or.txt (line 3))
Processing /cvmfs/soft.computecanada.ca/custom/python/wheelhouse/generic/absl_py-2.2.2+computecanada-py3-none-any.whl (from ortools<9.11,>=9.10->-r /home/aneumann/projects/def-adhaj/aneumann/GNRS/requirements/or.txt (line 1))
Processing /cvmfs/soft.computecanada.ca/custom/python/wheelhouse/gentoo2023/generic/numpy-2.2.2+computecanada-cp312-cp312-linux_x86_64.whl (from ortools<9.11,>=9.10->-r /home/aneumann/projects/def-adhaj/aneumann/GNRS/requirements/or.txt (line 1))
Processing /cvmfs/soft.computecanada.ca/custom/python/wheelhouse/gentoo2023/x86-64-v3/protobuf-6.30.2+computecanada-cp312-cp312-linux_x86_64.whl (from ortools<9.11,>=9.10->-r /home/aneumann/projects/def-adhaj/aneumann/GNRS/requirements/or.txt (line 1))
Requirement already satisfied: immutabledict>=3.0.0 in /localscratch/aneumann.63393239.0/env/lib/python3.12/site-packages (from ortools<9.11,>=9.10->-r /home/aneumann/projects/def-adhaj/aneumann/GNRS/requirements/or.txt (line 1)) (4.2.0)
Processing /cvmfs/soft.computecanada.ca/custom/python/wheelhouse/gentoo2023/generic/contourpy-1.3.1+computecanada-cp312-cp312-linux_x86_64.whl (from matplotlib->-r /home/aneumann/projects/def-adhaj/aneumann/GNRS/requirements/or.txt (line 2))
Processing /cvmfs/soft.computecanada.ca/custom/python/wheelhouse/generic/cycler-0.12.1+computecanada-py3-none-any.whl (from matplotlib->-r /home/aneumann/projects/def-adhaj/aneumann/GNRS/requirements/or.txt (line 2))
Processing /cvmfs/soft.computecanada.ca/custom/python/wheelhouse/generic/fonttools-4.58.2+computecanada-cp312-cp312-linux_x86_64.whl (from matplotlib->-r /home/aneumann/projects/def-adhaj/aneumann/GNRS/requirements/or.txt (line 2))
Processing /cvmfs/soft.computecanada.ca/custom/python/wheelhouse/gentoo2023/x86-64-v3/kiwisolver-1.4.8+computecanada-cp312-cp312-linux_x86_64.whl (from matplotlib->-r /home/aneumann/projects/def-adhaj/aneumann/GNRS/requirements/or.txt (line 2))
Processing /cvmfs/soft.computecanada.ca/custom/python/wheelhouse/generic/packaging-25.0+computecanada-py3-none-any.whl (from matplotlib->-r /home/aneumann/projects/def-adhaj/aneumann/GNRS/requirements/or.txt (line 2))
Processing /cvmfs/soft.computecanada.ca/custom/python/wheelhouse/gentoo2023/x86-64-v3/pillow-11.1.0+computecanada-cp312-cp312-linux_x86_64.whl (from matplotlib->-r /home/aneumann/projects/def-adhaj/aneumann/GNRS/requirements/or.txt (line 2))
Processing /cvmfs/soft.computecanada.ca/custom/python/wheelhouse/generic/pyparsing-3.2.1+computecanada-py3-none-any.whl (from matplotlib->-r /home/aneumann/projects/def-adhaj/aneumann/GNRS/requirements/or.txt (line 2))
Processing /cvmfs/soft.computecanada.ca/custom/python/wheelhouse/generic/python_dateutil-2.9.0.post0+computecanada-py2.py3-none-any.whl (from matplotlib->-r /home/aneumann/projects/def-adhaj/aneumann/GNRS/requirements/or.txt (line 2))
Processing /cvmfs/soft.computecanada.ca/custom/python/wheelhouse/generic/pytz-2025.2+computecanada-py2.py3-none-any.whl (from pandas->-r /home/aneumann/projects/def-adhaj/aneumann/GNRS/requirements/or.txt (line 3))
Processing /cvmfs/soft.computecanada.ca/custom/python/wheelhouse/generic/tzdata-2025.2+computecanada-py2.py3-none-any.whl (from pandas->-r /home/aneumann/projects/def-adhaj/aneumann/GNRS/requirements/or.txt (line 3))
Processing /cvmfs/soft.computecanada.ca/custom/python/wheelhouse/generic/six-1.17.0+computecanada-py2.py3-none-any.whl (from python-dateutil>=2.7->matplotlib->-r /home/aneumann/projects/def-adhaj/aneumann/GNRS/requirements/or.txt (line 2))
Installing collected packages: pytz, tzdata, six, pyparsing, protobuf, pillow, packaging, numpy, kiwisolver, fonttools, cycler, absl-py, python-dateutil, contourpy, pandas, matplotlib, ortools

Successfully installed absl-py-2.2.2+computecanada contourpy-1.3.1+computecanada cycler-0.12.1+computecanada fonttools-4.58.2+computecanada kiwisolver-1.4.8+computecanada matplotlib-3.10.0+computecanada numpy-2.2.2+computecanada ortools-9.10.4067+computecanada packaging-25.0+computecanada pandas-2.2.3+computecanada pillow-11.1.0+computecanada protobuf-6.30.2+computecanada pyparsing-3.2.1+computecanada python-dateutil-2.9.0.post0+computecanada pytz-2025.2+computecanada six-1.17.0+computecanada tzdata-2025.2+computecanada

Starting CP-SAT solver v9.10.4067
Parameters: max_time_in_seconds: 3600 max_memory_in_mb: 12000 log_search_progress: true enumerate_all_solutions: false absolute_gap_limit: 0 relative_gap_limit: 0
Setting number of workers to 48

Initial optimization model '': (model_fingerprint: 0x546a71f2db43a290)
#Variables: 294 (#ints: 8 in objective)
  - 207 Booleans in [0,1]
  - 87 in [0,574]
#kLinear1: 40
#kLinear2: 491
#kLinear3: 155
#kLinearN: 2'357 (#terms: 28'306)

Starting presolve at 0.00s
  1.72e-03s  0.00e+00d  [DetectDominanceRelations] 
  4.03e-02s  0.00e+00d  [PresolveToFixPoint] #num_loops=6 #num_dual_strengthening=3 
  3.72e-05s  0.00e+00d  [ExtractEncodingFromLinear] #potential_supersets=5 
[Symmetry] Graph for symmetry has 2'886 nodes and 20'685 arcs.
[Symmetry] Symmetry computation done. time: 0.00247411 dtime: 0.00212877
[Symmetry] #generators: 1, average support size: 24
[Symmetry] The model contains 273 duplicate constraints !
[Symmetry] 12 orbits with sizes: 2,2,2,2,2,2,2,2,2,2,...
[Symmetry] Num fixable by intersecting at_most_one with orbits: 1 largest_orbit: 2
  9.57e-03s  1.09e-03d  [Probe] #probed=300 #fixed_bools=4 #new_bounds=20 #equiv=1 
  6.39e-05s  0.00e+00d  [MaxClique] Merged 32(64 literals) into 13(26 literals) at_most_ones. 
  1.66e-03s  0.00e+00d  [DetectDominanceRelations] 
  1.99e-02s  0.00e+00d  [PresolveToFixPoint] #num_loops=4 #num_dual_strengthening=3 
  5.44e-03s  0.00e+00d  [ProcessAtMostOneAndLinear] 
  2.89e-03s  0.00e+00d  [DetectDuplicateConstraints] #duplicates=340 #without_enforcements=246 
  1.74e-03s  6.42e-05d  [DetectDominatedLinearConstraints] #relevant_constraints=1'643 #num_inclusions=1'048 #num_redundant=1 
  3.48e-04s  0.00e+00d  [DetectDifferentVariables] #different=45 
  5.05e-04s  2.12e-05d  [ProcessSetPPC] #relevant_constraints=1'208 
  3.02e-05s  0.00e+00d  [FindAlmostIdenticalLinearConstraints] 
  2.62e-04s  1.86e-04d  [FindBigAtMostOneAndLinearOverlap] 
  5.85e-03s  1.41e-03d  [FindBigVerticalLinearOverlap] #blocks=35 #saved_nz=2'960 
  2.70e-04s  4.89e-05d  [FindBigHorizontalLinearOverlap] #linears=1'114 
  1.57e-05s  0.00e+00d  [MergeClauses] 
  1.75e-03s  0.00e+00d  [DetectDominanceRelations] 
  2.36e-02s  0.00e+00d  [PresolveToFixPoint] #num_loops=2 #num_dual_strengthening=1 
  1.75e-03s  0.00e+00d  [DetectDominanceRelations] 
  1.38e-02s  0.00e+00d  [PresolveToFixPoint] #num_loops=1 #num_dual_strengthening=1 
[Symmetry] Graph for symmetry has 2'608 nodes and 16'374 arcs.
[Symmetry] Symmetry computation done. time: 0.000815955 dtime: 0.00100762
  8.61e-03s  9.82e-04d  [Probe] #probed=292 #new_bounds=27 
  1.49e-05s  0.00e+00d  [MaxClique] 
  1.73e-03s  0.00e+00d  [DetectDominanceRelations] 
  2.13e-02s  0.00e+00d  [PresolveToFixPoint] #num_loops=2 #num_dual_strengthening=1 
  4.85e-03s  0.00e+00d  [ProcessAtMostOneAndLinear] 
  2.46e-03s  0.00e+00d  [DetectDuplicateConstraints] #without_enforcements=247 
  1.03e-03s  3.89e-05d  [DetectDominatedLinearConstraints] #relevant_constraints=1'407 #num_inclusions=196 
  3.74e-04s  0.00e+00d  [DetectDifferentVariables] #different=50 #cliques=1 #size=3 
  4.48e-04s  1.48e-05d  [ProcessSetPPC] #relevant_constraints=1'097 
  4.17e-05s  4.50e-08d  [FindAlmostIdenticalLinearConstraints] #num_tested_pairs=3 
  1.95e-04s  1.05e-04d  [FindBigAtMostOneAndLinearOverlap] 
  3.25e-03s  9.76e-04d  [FindBigVerticalLinearOverlap] #blocks=24 #saved_nz=1'193 
  2.37e-04s  3.98e-05d  [FindBigHorizontalLinearOverlap] #linears=983 
  1.46e-05s  0.00e+00d  [MergeClauses] 
  1.66e-03s  0.00e+00d  [DetectDominanceRelations] 
  1.85e-02s  0.00e+00d  [PresolveToFixPoint] #num_loops=2 #num_dual_strengthening=1 
  1.66e-03s  0.00e+00d  [DetectDominanceRelations] 
  1.35e-02s  0.00e+00d  [PresolveToFixPoint] #num_loops=1 #num_dual_strengthening=1 
  8.53e-03s  9.72e-04d  [Probe] #probed=292 #new_bounds=13 
  1.49e-05s  0.00e+00d  [MaxClique] 
  1.66e-03s  0.00e+00d  [DetectDominanceRelations] 
  1.55e-02s  0.00e+00d  [PresolveToFixPoint] #num_loops=2 #num_dual_strengthening=1 
  4.58e-03s  0.00e+00d  [ProcessAtMostOneAndLinear] 
  2.42e-03s  0.00e+00d  [DetectDuplicateConstraints] #without_enforcements=247 
  8.53e-04s  3.11e-05d  [DetectDominatedLinearConstraints] #relevant_constraints=1'336 #num_inclusions=21 
  2.42e-04s  0.00e+00d  [DetectDifferentVariables] 
  3.80e-04s  1.19e-05d  [ProcessSetPPC] #relevant_constraints=966 
  4.34e-05s  2.05e-07d  [FindAlmostIdenticalLinearConstraints] #num_tested_pairs=12 
  1.49e-04s  7.85e-05d  [FindBigAtMostOneAndLinearOverlap] 
  2.83e-03s  8.49e-04d  [FindBigVerticalLinearOverlap] #blocks=17 #saved_nz=976 
  1.99e-04s  3.15e-05d  [FindBigHorizontalLinearOverlap] #linears=820 
  1.40e-05s  0.00e+00d  [MergeClauses] 
  1.57e-03s  0.00e+00d  [DetectDominanceRelations] 
  1.51e-02s  0.00e+00d  [PresolveToFixPoint] #num_loops=2 #num_dual_strengthening=1 
  9.33e-05s  0.00e+00d  [ExpandObjective] #entries=336 #tight_variables=121 #tight_constraints=66 

Presolve summary:
  - 60 affine relations were detected.
  - rule 'TODO dual: only one blocking constraint?' was applied 618 times.
  - rule 'TODO dual: only one unspecified blocking constraint?' was applied 104 times.
  - rule 'TODO duplicate: identical constraint with different enforcements' was applied 740 times.
  - rule 'TODO no_overlap: with task always last' was applied 1 time.
  - rule 'affine: new relation' was applied 60 times.
  - rule 'all_diff: inferred from x != y constraints' was applied 1 time.
  - rule 'at_most_one: removed literals' was applied 13 times.
  - rule 'at_most_one: size one' was applied 13 times.
  - rule 'at_most_one: transformed into max clique.' was applied 1 time.
  - rule 'deductions: 222 stored' was applied 1 time.
  - rule 'dual: fix variable' was applied 21 times.
  - rule 'dual: reduced domain' was applied 47 times.
  - rule 'duplicate: merged rhs of linear constraint' was applied 69 times.
  - rule 'duplicate: removed constraint' was applied 340 times.
  - rule 'enforcement: false literal' was applied 20 times.
  - rule 'enforcement: true literal' was applied 17 times.
  - rule 'exactly_one: x and not(x)' was applied 1 time.
  - rule 'incompatible linear: add implication' was applied 63 times.
  - rule 'linear inclusion: redundant containing constraint' was applied 1 time.
  - rule 'linear matrix: common vertical rectangle' was applied 76 times.
  - rule 'linear: always true' was applied 622 times.
  - rule 'linear: doubleton free' was applied 11 times.
  - rule 'linear: empty' was applied 26 times.
  - rule 'linear: extracted enforcement literal' was applied 5'012 times.
  - rule 'linear: fixed or dup variables' was applied 2'415 times.
  - rule 'linear: positive equal one' was applied 5 times.
  - rule 'linear: reduced variable domains' was applied 179 times.
  - rule 'linear: remapped using affine relations' was applied 2'258 times.
  - rule 'linear: simplified rhs' was applied 7'645 times.
  - rule 'linear: variable substitution 1' was applied 11 times.
  - rule 'linear: variable substitution 2' was applied 2 times.
  - rule 'linear: variable substitution 3' was applied 1 time.
  - rule 'presolve: 83 unused variables removed.' was applied 1 time.
  - rule 'presolve: iteration' was applied 3 times.
  - rule 'probing: reduced enforced constraint to implication.' was applied 32 times.
  - rule 'probing: simplified enforcement list.' was applied 2 times.
  - rule 'symmetry: fixed to false in general orbit' was applied 1 time.

Presolved optimization model '': (model_fingerprint: 0xfa8c27597f099c61)
#Variables: 213 (#ints: 8 in objective)
  - 75 Booleans in [0,1]
  - 102 different domains in [-3922,3358] with a largest complexity of 9.
#kAllDiff: 1
#kExactlyOne: 4 (#literals: 12)
#kLinear2: 716 (#enforced: 658 #multi: 551)
#kLinear3: 197 (#enforced: 141)
#kLinearN: 1'087 (#enforced: 985) (#terms: 7'360)

Preloading model.
#Bound   0.27s best:inf   next:[154,3842] initial_domain
#Model   0.27s var:213/213 constraints:2005/2005

Starting search at 0.27s with 48 workers.
16 full problem subsolvers: [core, default_lp, lb_tree_search, max_lp, no_lp, objective_lb_search, objective_lb_search_max_lp, objective_lb_search_no_lp, objective_shaving_search_max_lp, objective_shaving_search_no_lp, probing, probing_max_lp, pseudo_costs, quick_restart, quick_restart_no_lp, reduced_costs]
30 first solution subsolvers: [fj_long_default(2), fj_long_lin_default, fj_long_lin_perturb, fj_long_lin_random, fj_long_perturb, fj_long_random, fj_short_default(2), fj_short_lin_default(2), fj_short_lin_perturb, fj_short_lin_random, fj_short_perturb, fj_short_random, fs_random(4), fs_random_no_lp(4), fs_random_quick_restart(4), fs_random_quick_restart_no_lp(3)]
13 incomplete subsolvers: [feasibility_pump, graph_arc_lns, graph_cst_lns, graph_dec_lns, graph_var_lns, rins/rens, rnd_cst_lns, rnd_var_lns, violation_ls(5)]
3 helper subsolvers: [neighborhood_helper, synchronization_agent, update_gap_integral]
#1       0.31s best:1504  next:[154,1503] no_lp (fixed_bools=0/101)
#Bound   0.31s best:1504  next:[179,1503] objective_lb_search_no_lp
#2       0.32s best:1479  next:[179,1478] no_lp (fixed_bools=0/108)
#3       0.32s best:1474  next:[179,1473] no_lp (fixed_bools=0/110)
#4       0.33s best:1283  next:[179,1282] no_lp (fixed_bools=0/123)
#5       0.33s best:1275  next:[179,1274] no_lp (fixed_bools=0/129)
#6       0.33s best:1247  next:[179,1246] no_lp (fixed_bools=0/134)
#Bound   0.34s best:1247  next:[180,1246] objective_shaving_search_max_lp (vars=213 csts=2006)
#7       0.35s best:1201  next:[180,1200] no_lp (fixed_bools=0/142)
#Bound   0.35s best:1201  next:[181,1200] bool_core (num_cores=3 [cover] a=6 d=1 fixed=24/159 clauses=29)
#Bound   0.35s best:1201  next:[206,1200] quick_restart
#Bound   0.35s best:1201  next:[207,1200] quick_restart
#Bound   0.37s best:1201  next:[217,1200] quick_restart
#8       0.37s best:1181  next:[217,1180] no_lp (fixed_bools=0/148)
#Bound   0.38s best:1181  next:[218,1180] default_lp
#Bound   0.38s best:1181  next:[219,1180] objective_lb_search_no_lp
#Bound   0.39s best:1181  next:[249,1180] objective_lb_search_no_lp
#9       0.39s best:1151  next:[249,1150] no_lp (fixed_bools=0/157)
#10      0.40s best:1144  next:[249,1143] graph_var_lns (d=0.94 s=98 t=0.10 p=1.00 stall=1 h=auto_l0)
#11      0.41s best:1075  next:[249,1074] no_lp (fixed_bools=0/174)
#Bound   0.41s best:1075  next:[333,1074] objective_lb_search_no_lp
#Bound   0.43s best:1075  next:[380,1074] objective_lb_search_no_lp
#Bound   0.45s best:1075  next:[383,1074] objective_lb_search_no_lp
#12      0.46s best:1064  next:[383,1063] no_lp (fixed_bools=0/189)
#13      0.48s best:1059  next:[383,1058] quick_restart_no_lp (fixed_bools=0/194)
#14      0.49s best:1055  next:[383,1054] no_lp (fixed_bools=0/199)
#15      0.52s best:1050  next:[383,1049] violation_ls(batch:4 #solutions_imported:4 #lin_moves:6'382 #lin_evals:45'935 #gen_moves:8'915 #gen_evals:1'729 #comp_moves:289 #backtracks:4'310 #weight_updates:5'277)
#16      0.52s best:1049  next:[383,1048] violation_ls(batch:5 #solutions_imported:5 #lin_moves:6'382 #lin_evals:45'937 #gen_moves:8'916 #gen_evals:1'729 #comp_moves:290 #backtracks:4'310 #weight_updates:5'277)
#17      0.52s best:1048  next:[383,1047] violation_ls(batch:6 #solutions_imported:6 #lin_moves:6'382 #lin_evals:45'957 #gen_moves:8'931 #gen_evals:1'729 #comp_moves:291 #backtracks:4'317 #weight_updates:5'277)
#18      0.52s best:1047  next:[383,1046] violation_ls(batch:7 #solutions_imported:7 #lin_moves:6'383 #lin_evals:45'964 #gen_moves:8'931 #gen_evals:1'729 #comp_moves:291 #backtracks:4'317 #weight_updates:5'277)
#19      0.52s best:1046  next:[383,1045] violation_ls(batch:8 #solutions_imported:8 #lin_moves:6'383 #lin_evals:45'968 #gen_moves:8'932 #gen_evals:1'729 #comp_moves:292 #backtracks:4'317 #weight_updates:5'277)
#20      0.52s best:1045  next:[383,1044] violation_ls(batch:9 #solutions_imported:9 #lin_moves:6'384 #lin_evals:45'976 #gen_moves:8'932 #gen_evals:1'729 #comp_moves:292 #backtracks:4'317 #weight_updates:5'277)
#21      0.54s best:1043  next:[383,1042] no_lp (fixed_bools=0/217)
#22      0.55s best:1021  next:[383,1020] no_lp (fixed_bools=0/221)
#23      0.56s best:1012  next:[383,1011] no_lp (fixed_bools=0/232)
#24      0.58s best:1011  next:[383,1010] quick_restart_no_lp (fixed_bools=1/238)
#25      0.59s best:1010  next:[383,1009] violation_ls(batch:7 #solutions_imported:7 #lin_moves:10'148 #lin_evals:69'695 #gen_moves:11'353 #gen_evals:1'469 #comp_moves:354 #backtracks:5'493 #weight_updates:9'200)
#26      0.60s best:985   next:[383,984]  no_lp (fixed_bools=0/251)
#27      0.60s best:984   next:[383,983]  violation_ls(batch:8 #solutions_imported:8 #lin_moves:10'148 #lin_evals:69'746 #gen_moves:11'381 #gen_evals:1'474 #comp_moves:356 #backtracks:5'506 #weight_updates:9'200)
#28      0.60s best:983   next:[383,982]  violation_ls(batch:9 #solutions_imported:9 #lin_moves:10'148 #lin_evals:69'754 #gen_moves:11'386 #gen_evals:1'474 #comp_moves:361 #backtracks:5'506 #weight_updates:9'200)
#29      0.60s best:982   next:[383,981]  violation_ls(batch:10 #solutions_imported:10 #lin_moves:10'149 #lin_evals:69'762 #gen_moves:11'386 #gen_evals:1'474 #comp_moves:361 #backtracks:5'506 #weight_updates:9'200)
#30      0.61s best:981   next:[383,980]  violation_ls(batch:11 #solutions_imported:11 #lin_moves:10'149 #lin_evals:69'768 #gen_moves:11'390 #gen_evals:1'474 #comp_moves:365 #backtracks:5'506 #weight_updates:9'200)
#31      0.61s best:980   next:[383,979]  violation_ls(batch:12 #solutions_imported:12 #lin_moves:10'150 #lin_evals:69'776 #gen_moves:11'390 #gen_evals:1'474 #comp_moves:365 #backtracks:5'506 #weight_updates:9'200)
#32      0.61s best:979   next:[383,978]  violation_ls(batch:13 #solutions_imported:13 #lin_moves:10'150 #lin_evals:69'781 #gen_moves:11'394 #gen_evals:1'474 #comp_moves:369 #backtracks:5'506 #weight_updates:9'200)
#33      0.62s best:913   next:[383,912]  graph_dec_lns (d=0.98 s=129 t=0.10 p=1.00 stall=2 h=auto_l0)
#34      0.62s best:912   next:[383,911]  violation_ls(batch:14 #solutions_imported:14 #lin_moves:10'251 #lin_evals:70'289 #gen_moves:11'394 #gen_evals:1'474 #comp_moves:369 #backtracks:5'506 #weight_updates:9'272)
#35      0.63s best:911   next:[383,910]  violation_ls(batch:15 #solutions_imported:15 #lin_moves:10'251 #lin_evals:70'292 #gen_moves:11'395 #gen_evals:1'474 #comp_moves:370 #backtracks:5'506 #weight_updates:9'272)
#36      0.64s best:910   next:[383,909]  violation_ls(batch:6 #solutions_imported:6 #lin_moves:14'353 #lin_evals:75'629 #gen_moves:11'380 #gen_evals:1'550 #comp_moves:360 #backtracks:5'509 #weight_updates:5'782)
#37      0.64s best:909   next:[383,908]  violation_ls(batch:7 #solutions_imported:7 #lin_moves:14'353 #lin_evals:75'642 #gen_moves:11'388 #gen_evals:1'550 #comp_moves:362 #backtracks:5'512 #weight_updates:5'782)
#Bound   0.64s best:909   next:[389,908]  objective_lb_search_no_lp
#38      0.64s best:908   next:[389,907]  violation_ls(batch:8 #solutions_imported:8 #lin_moves:14'353 #lin_evals:75'699 #gen_moves:11'423 #gen_evals:1'553 #comp_moves:365 #backtracks:5'528 #weight_updates:5'782)
#39      0.64s best:907   next:[389,906]  violation_ls(batch:9 #solutions_imported:9 #lin_moves:14'353 #lin_evals:75'756 #gen_moves:11'461 #gen_evals:1'557 #comp_moves:369 #backtracks:5'545 #weight_updates:5'782)
#40      0.64s best:906   next:[389,905]  violation_ls(batch:10 #solutions_imported:10 #lin_moves:14'353 #lin_evals:75'933 #gen_moves:11'553 #gen_evals:1'566 #comp_moves:371 #backtracks:5'590 #weight_updates:5'782)
#41      0.64s best:905   next:[389,904]  violation_ls(batch:11 #solutions_imported:11 #lin_moves:6'535 #lin_evals:64'313 #gen_moves:18'784 #gen_evals:2'697 #comp_moves:775 #backtracks:8'999 #weight_updates:5'427)
#42      0.64s best:904   next:[389,903]  violation_ls(batch:6 #solutions_imported:6 #lin_moves:5'064 #lin_evals:63'555 #gen_moves:21'082 #gen_evals:2'782 #comp_moves:618 #backtracks:10'224 #weight_updates:5'177)
#43      0.65s best:903   next:[389,902]  violation_ls(batch:7 #solutions_imported:7 #lin_moves:5'064 #lin_evals:64'381 #gen_moves:21'495 #gen_evals:2'824 #comp_moves:635 #backtracks:10'422 #weight_updates:5'183)
#44      0.66s best:902   next:[389,901]  violation_ls(batch:14 #solutions_imported:14 #lin_moves:6'690 #lin_evals:64'960 #gen_moves:18'784 #gen_evals:2'697 #comp_moves:775 #backtracks:8'999 #weight_updates:5'520)
#45      0.67s best:901   next:[389,900]  violation_ls(batch:15 #solutions_imported:15 #lin_moves:6'768 #lin_evals:65'328 #gen_moves:18'784 #gen_evals:2'697 #comp_moves:775 #backtracks:8'999 #weight_updates:5'591)
#46      0.67s best:900   next:[389,899]  violation_ls(batch:9 #solutions_imported:9 #lin_moves:5'079 #lin_evals:65'924 #gen_moves:22'351 #gen_evals:2'933 #comp_moves:667 #backtracks:10'834 #weight_updates:5'204)
#47      0.69s best:899   next:[389,898]  violation_ls(batch:10 #solutions_imported:10 #lin_moves:5'097 #lin_evals:66'018 #gen_moves:22'351 #gen_evals:2'933 #comp_moves:667 #backtracks:10'834 #weight_updates:5'220)
#48      0.70s best:898   next:[389,897]  violation_ls(batch:11 #solutions_imported:11 #lin_moves:5'097 #lin_evals:66'024 #gen_moves:22'354 #gen_evals:2'933 #comp_moves:670 #backtracks:10'834 #weight_updates:5'220)
#49      0.70s best:897   next:[389,896]  violation_ls(batch:5 #solutions_imported:5 #lin_moves:9'975 #lin_evals:74'861 #gen_moves:18'203 #gen_evals:2'418 #comp_moves:460 #backtracks:8'867 #weight_updates:836)
#50      0.70s best:896   next:[389,895]  violation_ls(batch:6 #solutions_imported:6 #lin_moves:9'989 #lin_evals:74'923 #gen_moves:18'203 #gen_evals:2'418 #comp_moves:460 #backtracks:8'867 #weight_updates:843)
#51      0.71s best:895   next:[389,894]  violation_ls(batch:7 #solutions_imported:7 #lin_moves:9'989 #lin_evals:74'946 #gen_moves:18'219 #gen_evals:2'421 #comp_moves:462 #backtracks:8'874 #weight_updates:843)
#Bound   0.73s best:895   next:[397,894]  objective_lb_search_no_lp
#52      0.73s best:894   next:[397,893]  violation_ls(batch:14 #solutions_imported:14 #lin_moves:5'098 #lin_evals:68'103 #gen_moves:23'479 #gen_evals:3'036 #comp_moves:709 #backtracks:11'377 #weight_updates:5'234)
#53      0.74s best:893   next:[397,892]  violation_ls(batch:15 #solutions_imported:15 #lin_moves:5'098 #lin_evals:68'119 #gen_moves:23'488 #gen_evals:3'036 #comp_moves:712 #backtracks:11'380 #weight_updates:5'234)
#54      0.75s best:892   next:[397,891]  violation_ls(batch:16 #solutions_imported:16 #lin_moves:5'172 #lin_evals:68'399 #gen_moves:23'488 #gen_evals:3'036 #comp_moves:712 #backtracks:11'380 #weight_updates:5'267)
#55      0.76s best:891   next:[397,890]  violation_ls(batch:14 #solutions_imported:14 #lin_moves:14'367 #lin_evals:84'793 #gen_moves:16'347 #gen_evals:2'042 #comp_moves:581 #backtracks:7'882 #weight_updates:5'851)
#56      0.77s best:890   next:[397,889]  violation_ls(batch:16 #solutions_imported:16 #lin_moves:10'252 #lin_evals:70'300 #gen_moves:11'395 #gen_evals:1'474 #comp_moves:370 #backtracks:5'506 #weight_updates:9'272)
#57      0.78s best:889   next:[397,888]  violation_ls(batch:15 #solutions_imported:15 #lin_moves:14'367 #lin_evals:86'235 #gen_moves:17'163 #gen_evals:2'110 #comp_moves:603 #backtracks:8'279 #weight_updates:5'860)
#Bound   0.79s best:889   next:[399,888]  objective_lb_search_no_lp
#58      0.81s best:888   next:[399,887]  violation_ls(batch:16 #solutions_imported:16 #lin_moves:14'367 #lin_evals:88'804 #gen_moves:18'618 #gen_evals:2'242 #comp_moves:650 #backtracks:8'983 #weight_updates:5'879)
#59      0.81s best:887   next:[399,886]  violation_ls(batch:10 #solutions_imported:10 #lin_moves:9'989 #lin_evals:81'260 #gen_moves:21'597 #gen_evals:2'724 #comp_moves:588 #backtracks:10'500 #weight_updates:885)
#60      0.82s best:885   next:[399,884]  quick_restart_no_lp (fixed_bools=4/347)
#61      0.83s best:883   next:[399,882]  violation_ls(batch:11 #solutions_imported:11 #lin_moves:9'990 #lin_evals:81'268 #gen_moves:21'597 #gen_evals:2'724 #comp_moves:588 #backtracks:10'500 #weight_updates:885)
#62      0.86s best:882   next:[399,881]  violation_ls(batch:12 #solutions_imported:12 #lin_moves:10'016 #lin_evals:81'404 #gen_moves:21'597 #gen_evals:2'724 #comp_moves:588 #backtracks:10'500 #weight_updates:910)
#Bound   0.86s best:882   next:[400,881]  objective_lb_search_no_lp
#63      0.86s best:881   next:[400,880]  violation_ls(batch:13 #solutions_imported:13 #lin_moves:10'016 #lin_evals:81'406 #gen_moves:21'598 #gen_evals:2'724 #comp_moves:589 #backtracks:10'500 #weight_updates:910)
#64      0.86s best:880   next:[400,879]  violation_ls(batch:14 #solutions_imported:14 #lin_moves:10'016 #lin_evals:81'843 #gen_moves:21'830 #gen_evals:2'745 #comp_moves:595 #backtracks:10'613 #weight_updates:911)
#65      0.88s best:876   next:[400,875]  graph_arc_lns (d=0.99 s=180 t=0.10 p=1.00 stall=0 h=auto_l0)
#66      0.90s best:875   next:[400,874]  quick_restart_no_lp (fixed_bools=4/384)
#Bound   0.94s best:875   next:[411,874]  objective_lb_search
#67      0.95s best:872   next:[411,871]  quick_restart_no_lp (fixed_bools=4/392)
#68      0.96s best:871   next:[411,870]  quick_restart_no_lp (fixed_bools=4/396)
#69      0.97s best:870   next:[411,869]  quick_restart_no_lp (fixed_bools=4/416)
#70      1.00s best:869   next:[411,868]  quick_restart_no_lp (fixed_bools=5/420)
#71      1.03s best:868   next:[411,867]  quick_restart_no_lp (fixed_bools=5/423)
#Bound   1.07s best:868   next:[423,867]  objective_lb_search_no_lp
#72      1.07s best:865   next:[423,864]  quick_restart_no_lp (fixed_bools=5/425)
#73      1.10s best:864   next:[423,863]  quick_restart_no_lp (fixed_bools=5/461)
#74      1.11s best:862   next:[423,861]  violation_ls(batch:17 #solutions_imported:17 #lin_moves:14'994 #lin_evals:107'629 #gen_moves:22'666 #gen_evals:2'832 #comp_moves:617 #backtracks:11'020 #weight_updates:5'944)
#75      1.12s best:861   next:[423,860]  violation_ls(batch:17 #solutions_imported:17 #lin_moves:10'252 #lin_evals:70'303 #gen_moves:11'396 #gen_evals:1'474 #comp_moves:371 #backtracks:5'506 #weight_updates:9'272)
#Bound   1.12s best:861   next:[425,860]  objective_lb_search_no_lp
#76      1.12s best:859   next:[425,858]  violation_ls(batch:17 #solutions_imported:17 #lin_moves:6'769 #lin_evals:66'181 #gen_moves:19'251 #gen_evals:2'735 #comp_moves:788 #backtracks:9'226 #weight_updates:5'595)
#77      1.18s best:858   next:[425,857]  quick_restart_no_lp (fixed_bools=5/490)
#78      1.19s best:857   next:[425,856]  violation_ls(batch:18 #solutions_imported:18 #lin_moves:5'172 #lin_evals:86'608 #gen_moves:33'350 #gen_evals:4'081 #comp_moves:1'400 #backtracks:15'966 #weight_updates:5'351)
#79      1.20s best:855   next:[425,854]  violation_ls(batch:18 #solutions_imported:18 #lin_moves:14'995 #lin_evals:107'634 #gen_moves:22'666 #gen_evals:2'832 #comp_moves:617 #backtracks:11'020 #weight_updates:5'944)
#80      1.20s best:853   next:[425,852]  violation_ls(batch:18 #solutions_imported:18 #lin_moves:23'961 #lin_evals:131'652 #gen_moves:18'618 #gen_evals:2'242 #comp_moves:650 #backtracks:8'983 #weight_updates:6'286)
#81      1.20s best:852   next:[425,851]  violation_ls(batch:18 #solutions_imported:18 #lin_moves:10'252 #lin_evals:70'305 #gen_moves:11'397 #gen_evals:1'474 #comp_moves:372 #backtracks:5'506 #weight_updates:9'272)
#82      1.20s best:851   next:[425,850]  violation_ls(batch:18 #solutions_imported:18 #lin_moves:6'770 #lin_evals:66'189 #gen_moves:19'251 #gen_evals:2'735 #comp_moves:788 #backtracks:9'226 #weight_updates:5'595)
#83      1.21s best:850   next:[425,849]  quick_restart_no_lp (fixed_bools=5/492)
#84      1.24s best:849   next:[425,848]  quick_restart_no_lp (fixed_bools=5/494)
#85      1.25s best:844   next:[425,843]  quick_restart_no_lp (fixed_bools=5/495)
#86      1.28s best:843   next:[425,842]  quick_restart_no_lp (fixed_bools=5/495)
#87      1.30s best:839   next:[425,838]  quick_restart_no_lp (fixed_bools=5/510)
#Bound   1.44s best:839   next:[431,838]  objective_lb_search_no_lp
#88      1.45s best:838   next:[431,837]  violation_ls(batch:19 #solutions_imported:19 #lin_moves:5'172 #lin_evals:86'611 #gen_moves:33'352 #gen_evals:4'081 #comp_moves:1'402 #backtracks:15'966 #weight_updates:5'351)
#89      1.46s best:837   next:[431,836]  violation_ls(batch:19 #solutions_imported:19 #lin_moves:14'995 #lin_evals:107'637 #gen_moves:22'667 #gen_evals:2'832 #comp_moves:618 #backtracks:11'020 #weight_updates:5'944)
#90      1.47s best:836   next:[431,835]  violation_ls(batch:19 #solutions_imported:19 #lin_moves:23'961 #lin_evals:131'657 #gen_moves:18'620 #gen_evals:2'242 #comp_moves:652 #backtracks:8'983 #weight_updates:6'286)
#91      1.47s best:834   next:[431,833]  violation_ls(batch:19 #solutions_imported:19 #lin_moves:10'253 #lin_evals:70'313 #gen_moves:11'397 #gen_evals:1'474 #comp_moves:372 #backtracks:5'506 #weight_updates:9'272)
#92      1.47s best:833   next:[431,832]  violation_ls(batch:19 #solutions_imported:19 #lin_moves:6'770 #lin_evals:66'192 #gen_moves:19'253 #gen_evals:2'735 #comp_moves:790 #backtracks:9'226 #weight_updates:5'595)
#Bound   1.61s best:833   next:[446,832]  objective_lb_search_no_lp
#93      1.65s best:831   next:[446,830]  quick_restart_no_lp (fixed_bools=7/520)
#94      1.68s best:828   next:[446,827]  quick_restart_no_lp (fixed_bools=7/521)
#95      1.68s best:827   next:[446,826]  quick_restart_no_lp (fixed_bools=7/523)
#96      1.68s best:822   next:[446,821]  quick_restart_no_lp (fixed_bools=7/524)
#97      1.78s best:792   next:[446,791]  graph_dec_lns (d=0.98 s=164 t=0.10 p=1.00 stall=0 h=auto_l0)
#Bound   1.95s best:792   next:[449,791]  objective_lb_search_no_lp [skipped_logs=1]
#Bound   2.98s best:792   next:[456,791]  objective_lb_search_no_lp [skipped_logs=1]
#Bound   3.62s best:792   next:[470,791]  objective_lb_search_no_lp [skipped_logs=3]
#Bound   4.98s best:792   next:[473,791]  objective_shaving_search_no_lp (vars=224 csts=1777) [skipped_logs=1]
#Bound   5.96s best:792   next:[474,791]  objective_lb_search [skipped_logs=0]
#Bound   6.87s best:792   next:[480,791]  objective_lb_search [skipped_logs=2]
#Bound   8.03s best:792   next:[482,791]  objective_lb_search_no_lp
#Bound   8.84s best:792   next:[483,791]  objective_shaving_search_no_lp (vars=224 csts=1777) [skipped_logs=0]
#Bound   9.71s best:792   next:[484,791]  objective_shaving_search_no_lp (vars=224 csts=1777) [skipped_logs=0]
#Bound  10.81s best:792   next:[494,791]  objective_lb_search_no_lp [skipped_logs=1]
#Bound  11.51s best:792   next:[504,791]  objective_lb_search_no_lp [skipped_logs=0]
#Bound  12.91s best:792   next:[508,791]  objective_lb_search_no_lp [skipped_logs=1]
#Bound  13.83s best:792   next:[512,791]  objective_lb_search_no_lp [skipped_logs=2]
#Bound  14.28s best:792   next:[516,791]  objective_lb_search_no_lp [skipped_logs=0]
#Bound  16.26s best:792   next:[517,791]  objective_shaving_search_max_lp (vars=219 csts=1772)
#Bound  16.85s best:792   next:[518,791]  objective_shaving_search_no_lp (vars=224 csts=1777) [skipped_logs=0]
#Bound  17.83s best:792   next:[521,791]  objective_lb_search [skipped_logs=1]
#Bound  18.06s best:792   next:[522,791]  objective_lb_search_max_lp [skipped_logs=0]
#Bound  20.07s best:792   next:[523,791]  objective_lb_search
#Bound  21.02s best:792   next:[524,791]  objective_shaving_search_no_lp (vars=228 csts=1781)
#Bound  21.91s best:792   next:[545,791]  objective_lb_search_no_lp [skipped_logs=3]
#Bound  22.49s best:792   next:[552,791]  objective_lb_search_no_lp [skipped_logs=1]
#Bound  23.19s best:792   next:[569,791]  objective_lb_search_no_lp [skipped_logs=0]
#Bound  24.34s best:792   next:[570,791]  objective_lb_search_no_lp [skipped_logs=0]
#Bound  25.85s best:792   next:[574,791]  objective_lb_search_no_lp [skipped_logs=2]
#Bound  26.68s best:792   next:[578,791]  objective_lb_search_no_lp [skipped_logs=1]
#Bound  27.58s best:792   next:[592,791]  objective_lb_search_no_lp [skipped_logs=1]
#Bound  28.93s best:792   next:[594,791]  objective_lb_search_no_lp [skipped_logs=0]
#Bound  29.95s best:792   next:[599,791]  objective_lb_search_no_lp [skipped_logs=1]
#Bound  30.76s best:792   next:[601,791]  objective_lb_search_no_lp [skipped_logs=1]
#Bound  31.93s best:792   next:[604,791]  objective_lb_search_no_lp [skipped_logs=1]
#Bound  35.58s best:792   next:[605,791]  objective_lb_search_no_lp
#Bound  36.81s best:792   next:[606,791]  objective_lb_search_no_lp
#Bound  36.96s best:792   next:[608,791]  objective_lb_search_no_lp
#Bound  37.11s best:792   next:[609,791]  objective_lb_search_no_lp
#Bound  37.23s best:792   next:[611,791]  objective_lb_search_no_lp
#Bound  37.59s best:792   next:[616,791]  objective_lb_search_no_lp [skipped_logs=1]
#Bound  38.44s best:792   next:[617,791]  objective_lb_search_no_lp [skipped_logs=0]
#Model  39.22s var:212/213 constraints:1755/2005
#Bound  40.47s best:792   next:[619,791]  objective_lb_search_no_lp
#Bound  40.64s best:792   next:[622,791]  objective_lb_search_no_lp [skipped_logs=0]
#Bound  41.12s best:792   next:[623,791]  objective_lb_search_no_lp [skipped_logs=0]
#Bound  42.53s best:792   next:[624,791]  objective_lb_search_no_lp [skipped_logs=0]
#Bound  44.20s best:792   next:[628,791]  objective_lb_search_no_lp
#Bound  45.34s best:792   next:[629,791]  objective_lb_search_no_lp
#Bound  47.84s best:792   next:[630,791]  objective_lb_search_no_lp
#Bound  49.91s best:792   next:[631,791]  objective_lb_search_no_lp
#Bound  54.60s best:792   next:[632,791]  objective_lb_search_no_lp
#Bound  54.87s best:792   next:[633,791]  objective_lb_search_no_lp
#Bound  55.20s best:792   next:[634,791]  objective_lb_search_no_lp
#Bound  56.04s best:792   next:[635,791]  objective_lb_search_no_lp
#Bound  56.50s best:792   next:[636,791]  objective_lb_search_no_lp
#Bound  57.69s best:792   next:[637,791]  objective_lb_search_no_lp
#Bound  58.45s best:792   next:[639,791]  objective_lb_search_no_lp
#Bound  59.36s best:792   next:[640,791]  objective_lb_search_no_lp
#98     59.72s best:790   next:[640,789]  no_lp (fixed_bools=42/991)
#Bound  61.36s best:790   next:[642,789]  objective_lb_search_no_lp
#Bound  63.26s best:790   next:[643,789]  objective_lb_search_no_lp
#Bound  65.31s best:790   next:[644,789]  objective_lb_search_no_lp
#Bound  65.65s best:790   next:[645,789]  objective_lb_search_no_lp
#Bound  66.45s best:790   next:[647,789]  objective_lb_search_no_lp
#Bound  67.49s best:790   next:[648,789]  objective_lb_search_no_lp
#Bound  67.98s best:790   next:[649,789]  objective_lb_search_no_lp
#Bound  72.57s best:790   next:[650,789]  objective_lb_search_no_lp
#Bound  73.63s best:790   next:[652,789]  objective_lb_search_no_lp
#Bound  76.29s best:790   next:[654,789]  objective_lb_search_no_lp
#Bound  77.97s best:790   next:[655,789]  objective_lb_search_no_lp
#Bound  79.43s best:790   next:[657,789]  objective_lb_search_no_lp
#Model  81.22s var:211/213 constraints:1746/2005
#Bound  82.19s best:790   next:[659,789]  objective_lb_search_no_lp
#Bound  82.36s best:790   next:[660,789]  objective_lb_search_no_lp
#Bound  83.57s best:790   next:[661,789]  objective_lb_search_no_lp
#Model  83.60s var:210/213 constraints:1719/2005
#Bound  84.31s best:790   next:[662,789]  objective_lb_search_no_lp
#Bound  84.55s best:790   next:[663,789]  objective_lb_search_no_lp
#Bound  84.86s best:790   next:[664,789]  objective_lb_search_no_lp
#Bound  86.03s best:790   next:[666,789]  objective_lb_search_no_lp
#Bound  86.21s best:790   next:[667,789]  objective_lb_search_no_lp
#Bound  87.55s best:790   next:[668,789]  objective_lb_search_no_lp
#Bound  87.82s best:790   next:[678,789]  objective_lb_search_no_lp
#Bound  88.04s best:790   next:[680,789]  objective_lb_search_no_lp
#Bound  88.30s best:790   next:[682,789]  objective_lb_search_no_lp
#Bound  88.70s best:790   next:[683,789]  objective_lb_search_no_lp
#Bound  88.96s best:790   next:[688,789]  objective_lb_search_no_lp
#Bound  89.43s best:790   next:[693,789]  objective_lb_search_no_lp
#Bound  90.26s best:790   next:[694,789]  objective_lb_search_no_lp
#Bound  90.83s best:790   next:[695,789]  objective_lb_search_no_lp
#Bound  91.12s best:790   next:[696,789]  objective_lb_search_no_lp
#Model  91.96s var:208/213 constraints:1613/2005
#Model  93.18s var:206/213 constraints:1490/2005
#Bound  94.52s best:790   next:[697,789]  objective_lb_search_no_lp
#Bound  94.69s best:790   next:[698,789]  objective_lb_search_no_lp
#Model  95.20s var:205/213 constraints:1479/2005
#Bound  95.29s best:790   next:[700,789]  objective_lb_search_no_lp
#Model  95.63s var:201/213 constraints:1312/2005
#Bound  95.88s best:790   next:[711,789]  objective_lb_search_no_lp
#Model  96.41s var:200/213 constraints:1285/2005
#Bound  96.57s best:790   next:[713,789]  objective_lb_search_no_lp
#Model  97.07s var:199/213 constraints:1261/2005
#Bound  97.07s best:790   next:[714,789]  objective_shaving_search_no_lp (vars=193 csts=1253)
#Model  97.20s var:197/213 constraints:1228/2005
#Model  97.20s var:195/213 constraints:1160/2005
#Model  97.24s var:193/213 constraints:1124/2005
#Model  97.31s var:192/213 constraints:1089/2005
#Model  97.52s var:191/213 constraints:1063/2005
#Bound  97.52s best:790   next:[733,789]  objective_lb_search_no_lp
#Model  97.63s var:190/213 constraints:1044/2005
#Model  97.68s var:181/213 constraints:730/2005
#Bound  97.68s best:790   next:[750,789]  objective_lb_search_no_lp
#Bound  97.69s best:790   next:[770,789]  objective_lb_search_no_lp
#Done   97.70s quick_restart_no_lp
#Model  97.70s var:177/213 constraints:635/2005
#Done   97.70s core
#Done   97.70s quick_restart
#Done   97.71s objective_lb_search_max_lp
#Model  97.71s var:173/213 constraints:559/2005

Task timing                                  n [     min,      max]      avg      dev     time         n [     min,      max]      avg      dev    dtime
                             'core':         1 [   1.62m,    1.62m]    1.62m   0.00ns    1.62m         1 [   1.19m,    1.19m]    1.19m   0.00ns    1.19m
                       'default_lp':         1 [   1.62m,    1.62m]    1.62m   0.00ns    1.62m         1 [  11.82s,   11.82s]   11.82s   0.00ns   11.82s
                 'feasibility_pump':       391 [ 21.73ms, 517.39ms] 109.94ms  66.84ms   42.99s       390 [  2.59ms,  14.67ms]   7.54ms 439.87us    2.94s
                  'fj_long_default':         0 [  0.00ns,   0.00ns]   0.00ns   0.00ns   0.00ns         0 [  0.00ns,   0.00ns]   0.00ns   0.00ns   0.00ns
                  'fj_long_default':         0 [  0.00ns,   0.00ns]   0.00ns   0.00ns   0.00ns         0 [  0.00ns,   0.00ns]   0.00ns   0.00ns   0.00ns
              'fj_long_lin_default':         0 [  0.00ns,   0.00ns]   0.00ns   0.00ns   0.00ns         0 [  0.00ns,   0.00ns]   0.00ns   0.00ns   0.00ns
              'fj_long_lin_perturb':         0 [  0.00ns,   0.00ns]   0.00ns   0.00ns   0.00ns         0 [  0.00ns,   0.00ns]   0.00ns   0.00ns   0.00ns
               'fj_long_lin_random':         0 [  0.00ns,   0.00ns]   0.00ns   0.00ns   0.00ns         0 [  0.00ns,   0.00ns]   0.00ns   0.00ns   0.00ns
                  'fj_long_perturb':         0 [  0.00ns,   0.00ns]   0.00ns   0.00ns   0.00ns         0 [  0.00ns,   0.00ns]   0.00ns   0.00ns   0.00ns
                   'fj_long_random':         0 [  0.00ns,   0.00ns]   0.00ns   0.00ns   0.00ns         0 [  0.00ns,   0.00ns]   0.00ns   0.00ns   0.00ns
                 'fj_short_default':         0 [  0.00ns,   0.00ns]   0.00ns   0.00ns   0.00ns         0 [  0.00ns,   0.00ns]   0.00ns   0.00ns   0.00ns
                 'fj_short_default':         1 [127.00ms, 127.00ms] 127.00ms   0.00ns 127.00ms         1 [ 70.47ms,  70.47ms]  70.47ms   0.00ns  70.47ms
             'fj_short_lin_default':         0 [  0.00ns,   0.00ns]   0.00ns   0.00ns   0.00ns         0 [  0.00ns,   0.00ns]   0.00ns   0.00ns   0.00ns
             'fj_short_lin_default':         0 [  0.00ns,   0.00ns]   0.00ns   0.00ns   0.00ns         0 [  0.00ns,   0.00ns]   0.00ns   0.00ns   0.00ns
             'fj_short_lin_perturb':         0 [  0.00ns,   0.00ns]   0.00ns   0.00ns   0.00ns         0 [  0.00ns,   0.00ns]   0.00ns   0.00ns   0.00ns
              'fj_short_lin_random':         0 [  0.00ns,   0.00ns]   0.00ns   0.00ns   0.00ns         0 [  0.00ns,   0.00ns]   0.00ns   0.00ns   0.00ns
                 'fj_short_perturb':         0 [  0.00ns,   0.00ns]   0.00ns   0.00ns   0.00ns         0 [  0.00ns,   0.00ns]   0.00ns   0.00ns   0.00ns
                  'fj_short_random':         0 [  0.00ns,   0.00ns]   0.00ns   0.00ns   0.00ns         0 [  0.00ns,   0.00ns]   0.00ns   0.00ns   0.00ns
                        'fs_random':         1 [ 24.30ms,  24.30ms]  24.30ms   0.00ns  24.30ms         1 [ 20.00ns,  20.00ns]  20.00ns   0.00ns  20.00ns
                        'fs_random':         1 [ 27.14ms,  27.14ms]  27.14ms   0.00ns  27.14ms         1 [ 20.00ns,  20.00ns]  20.00ns   0.00ns  20.00ns
                        'fs_random':         1 [ 28.33ms,  28.33ms]  28.33ms   0.00ns  28.33ms         1 [ 20.00ns,  20.00ns]  20.00ns   0.00ns  20.00ns
                        'fs_random':         1 [ 29.38ms,  29.38ms]  29.38ms   0.00ns  29.38ms         1 [ 20.00ns,  20.00ns]  20.00ns   0.00ns  20.00ns
                  'fs_random_no_lp':         1 [ 21.79ms,  21.79ms]  21.79ms   0.00ns  21.79ms         0 [  0.00ns,   0.00ns]   0.00ns   0.00ns   0.00ns
                  'fs_random_no_lp':         1 [ 23.28ms,  23.28ms]  23.28ms   0.00ns  23.28ms         0 [  0.00ns,   0.00ns]   0.00ns   0.00ns   0.00ns
                  'fs_random_no_lp':         1 [ 24.73ms,  24.73ms]  24.73ms   0.00ns  24.73ms         0 [  0.00ns,   0.00ns]   0.00ns   0.00ns   0.00ns
                  'fs_random_no_lp':         1 [ 26.05ms,  26.05ms]  26.05ms   0.00ns  26.05ms         0 [  0.00ns,   0.00ns]   0.00ns   0.00ns   0.00ns
          'fs_random_quick_restart':         1 [ 23.84ms,  23.84ms]  23.84ms   0.00ns  23.84ms         1 [ 20.00ns,  20.00ns]  20.00ns   0.00ns  20.00ns
          'fs_random_quick_restart':         1 [ 26.62ms,  26.62ms]  26.62ms   0.00ns  26.62ms         1 [ 20.00ns,  20.00ns]  20.00ns   0.00ns  20.00ns
          'fs_random_quick_restart':         1 [ 28.21ms,  28.21ms]  28.21ms   0.00ns  28.21ms         1 [ 20.00ns,  20.00ns]  20.00ns   0.00ns  20.00ns
          'fs_random_quick_restart':         1 [ 29.09ms,  29.09ms]  29.09ms   0.00ns  29.09ms         1 [ 20.00ns,  20.00ns]  20.00ns   0.00ns  20.00ns
    'fs_random_quick_restart_no_lp':         1 [ 22.90ms,  22.90ms]  22.90ms   0.00ns  22.90ms         0 [  0.00ns,   0.00ns]   0.00ns   0.00ns   0.00ns
    'fs_random_quick_restart_no_lp':         1 [ 24.23ms,  24.23ms]  24.23ms   0.00ns  24.23ms         0 [  0.00ns,   0.00ns]   0.00ns   0.00ns   0.00ns
    'fs_random_quick_restart_no_lp':         1 [ 25.68ms,  25.68ms]  25.68ms   0.00ns  25.68ms         0 [  0.00ns,   0.00ns]   0.00ns   0.00ns   0.00ns
                    'graph_arc_lns':       393 [  2.26ms,    6.29s]    1.03s 796.29ms    6.73m       372 [ 10.00ns, 212.51ms]  69.56ms  43.29ms   25.88s
                    'graph_cst_lns':       393 [  1.78ms,    4.32s] 740.10ms 780.13ms    4.85m       288 [ 10.00ns, 111.03ms]  66.10ms  42.91ms   19.04s
                    'graph_dec_lns':       393 [  3.83ms,    6.53s]    1.10s 922.76ms    7.18m       379 [ 10.00ns, 220.07ms]  67.93ms  43.74ms   25.74s
                    'graph_var_lns':       394 [  3.18ms,    9.62s]    1.03s 986.35ms    6.79m       371 [ 10.00ns, 200.19ms]  68.54ms  43.96ms   25.43s
                   'lb_tree_search':         1 [   1.62m,    1.62m]    1.62m   0.00ns    1.62m         1 [  14.35s,   14.35s]   14.35s   0.00ns   14.35s
                           'max_lp':         1 [   1.62m,    1.62m]    1.62m   0.00ns    1.62m         1 [  10.27s,   10.27s]   10.27s   0.00ns   10.27s
                            'no_lp':         1 [   1.62m,    1.62m]    1.62m   0.00ns    1.62m         1 [   9.10s,    9.10s]    9.10s   0.00ns    9.10s
              'objective_lb_search':         1 [   1.62m,    1.62m]    1.62m   0.00ns    1.62m         1 [  15.12s,   15.12s]   15.12s   0.00ns   15.12s
       'objective_lb_search_max_lp':         1 [   1.62m,    1.62m]    1.62m   0.00ns    1.62m         1 [  22.02s,   22.02s]   22.02s   0.00ns   22.02s
        'objective_lb_search_no_lp':         1 [   1.62m,    1.62m]    1.62m   0.00ns    1.62m         1 [   9.77s,    9.77s]    9.77s   0.00ns    9.77s
  'objective_shaving_search_max_lp':       131 [  3.64ms,    4.72s] 740.53ms 843.57ms    1.62m       114 [701.89us, 656.40ms]  64.23ms 104.49ms    7.32s
   'objective_shaving_search_no_lp':       131 [  4.19ms,    4.72s] 739.67ms 843.06ms    1.61m       114 [ 20.50us, 473.07ms]  45.44ms  68.61ms    5.18s
                          'probing':         1 [   1.62m,    1.62m]    1.62m   0.00ns    1.62m         1 [  12.48s,   12.48s]   12.48s   0.00ns   12.48s
                   'probing_max_lp':         1 [   1.62m,    1.62m]    1.62m   0.00ns    1.62m         1 [   3.22s,    3.22s]    3.22s   0.00ns    3.22s
                     'pseudo_costs':         1 [   1.62m,    1.62m]    1.62m   0.00ns    1.62m         1 [  18.14s,   18.14s]   18.14s   0.00ns   18.14s
                    'quick_restart':         1 [   1.62m,    1.62m]    1.62m   0.00ns    1.62m         1 [  13.03s,   13.03s]   13.03s   0.00ns   13.03s
              'quick_restart_no_lp':         1 [   1.62m,    1.62m]    1.62m   0.00ns    1.62m         1 [  10.05s,   10.05s]   10.05s   0.00ns   10.05s
                    'reduced_costs':         1 [   1.62m,    1.62m]    1.62m   0.00ns    1.62m         1 [  18.42s,   18.42s]   18.42s   0.00ns   18.42s
                        'rins/rens':       394 [171.50us,    5.00s] 835.05ms 789.49ms    5.48m       319 [ 10.00ns, 200.12ms]  71.08ms  39.11ms   22.67s
                      'rnd_cst_lns':       394 [  2.11ms,    5.62s]    1.01s 807.85ms    6.65m       373 [ 10.00ns, 217.07ms]  68.13ms  43.35ms   25.41s
                      'rnd_var_lns':       394 [  3.87ms,    7.93s]    1.11s 962.66ms    7.27m       384 [ 10.00ns, 505.50ms]  66.88ms  48.88ms   25.68s
                     'violation_ls':       376 [310.76us,    1.18s] 194.03ms 131.92ms    1.22m       376 [570.00ns, 150.57ms]  67.62ms  21.10ms   25.42s
                     'violation_ls':       382 [325.26us, 815.58ms] 174.62ms 101.32ms    1.11m       382 [390.00ns, 120.97ms]  63.13ms  18.33ms   24.12s
                     'violation_ls':       383 [271.29us,    1.20s] 186.13ms 140.50ms    1.19m       383 [330.00ns, 180.91ms]  74.81ms  29.03ms   28.65s
                     'violation_ls':       384 [305.58us,    1.21s] 187.98ms 129.79ms    1.20m       384 [570.00ns, 133.10ms]  61.27ms  15.61ms   23.53s
                     'violation_ls':       386 [300.89us, 955.05ms] 196.46ms 135.64ms    1.26m       386 [330.00ns,  72.43ms]  58.39ms  13.38ms   22.54s

Search stats                        Bools  Conflicts  Branches  Restarts  BoolPropag  IntegerPropag
                           'core':  3'957     52'243   104'426    12'825  65'713'506     27'346'004
                     'default_lp':     75     29'002   100'428    10'908     629'275     17'824'602
                      'fs_random':     75          0       130       130          24          2'014
                      'fs_random':     75          0         2         2           0              6
                      'fs_random':     75          0        50        50          24            476
                      'fs_random':     75          0        56        56          24            590
                'fs_random_no_lp':     75          0         0         0           0              0
                'fs_random_no_lp':     75          0       130       130          24          2'014
                'fs_random_no_lp':     75          0        48        48          24            453
                'fs_random_no_lp':     75          0        50        50          24            476
        'fs_random_quick_restart':     75          0         0         0           0              0
        'fs_random_quick_restart':     75          0       114       114          24          1'732
        'fs_random_quick_restart':     75          0         2         2           0              6
        'fs_random_quick_restart':     75          0        48        48          24            453
  'fs_random_quick_restart_no_lp':     75          0        38        38          24            247
  'fs_random_quick_restart_no_lp':     75          0        50        50          24            476
  'fs_random_quick_restart_no_lp':     75          0        78        78          24            980
                 'lb_tree_search':     75        222    60'234     6'544      97'266      2'918'767
                         'max_lp':     75      8'304    97'194    16'706     404'711     10'161'475
                          'no_lp':  1'088     61'513   127'400    10'260  15'201'145     31'254'861
            'objective_lb_search':    225     25'909   176'032    31'852   1'166'795     22'466'317
     'objective_lb_search_max_lp':    173     11'607   162'707    34'317     799'891     17'106'785
      'objective_lb_search_no_lp':    318     80'973   174'654    13'007   2'289'401     41'400'503
                        'probing':    351        175     2'617     1'666      14'560         82'587
                 'probing_max_lp':    351        175       835       768       6'921         38'563
                   'pseudo_costs':     75     13'787   156'292    24'913     655'899     16'850'644
                  'quick_restart':    733      9'436   132'022    23'548   2'616'730     12'792'204
            'quick_restart_no_lp':  2'518     44'204   172'682    13'823  22'543'383     22'530'124
                  'reduced_costs':  1'798     19'360   143'733    19'647  11'701'873     16'396'176

SAT stats                           ClassicMinim  LitRemoved  LitLearned  LitForgotten  Subsumed  MClauses  MDecisions  MLitTrue  MSubsumed  MLitRemoved  MReused
                           'core':        48'298     302'457     401'231         7'749       349     6'238      29'215         0        701        2'266       87
                     'default_lp':        18'770      50'197     316'602        89'886     1'106     5'775      60'906         0      1'601       11'894    1'239
                      'fs_random':             0           0           0             0         0         0           0         0          0            0        0
                      'fs_random':             0           0           0             0         0         0           0         0          0            0        0
                      'fs_random':             0           0           0             0         0         0           0         0          0            0        0
                      'fs_random':             0           0           0             0         0         0           0         0          0            0        0
                'fs_random_no_lp':             0           0           0             0         0         0           0         0          0            0        0
                'fs_random_no_lp':             0           0           0             0         0         0           0         0          0            0        0
                'fs_random_no_lp':             0           0           0             0         0         0           0         0          0            0        0
                'fs_random_no_lp':             0           0           0             0         0         0           0         0          0            0        0
        'fs_random_quick_restart':             0           0           0             0         0         0           0         0          0            0        0
        'fs_random_quick_restart':             0           0           0             0         0         0           0         0          0            0        0
        'fs_random_quick_restart':             0           0           0             0         0         0           0         0          0            0        0
        'fs_random_quick_restart':             0           0           0             0         0         0           0         0          0            0        0
  'fs_random_quick_restart_no_lp':             0           0           0             0         0         0           0         0          0            0        0
  'fs_random_quick_restart_no_lp':             0           0           0             0         0         0           0         0          0            0        0
  'fs_random_quick_restart_no_lp':             0           0           0             0         0         0           0         0          0            0        0
                 'lb_tree_search':            33          40       1'173             0         2     2'495      13'174         0         30          118      205
                         'max_lp':         4'305       9'513      83'943             0       528     7'568      80'572         0        986        6'288    1'474
                          'no_lp':        51'807     233'091     671'735       251'747       725     5'090      40'544         8      1'828       11'313      663
            'objective_lb_search':        18'127      46'198     231'796         5'275     1'067    14'402     128'684         0      1'658       10'860    2'676
     'objective_lb_search_max_lp':         7'341      17'914     101'135             0       695    13'655     125'553         0        976        6'003    3'665
      'objective_lb_search_no_lp':        66'462     212'292     667'794       111'932     1'915     7'608      69'472         3      3'415       23'295    1'408
                        'probing':             0           0         175             0         0         0           0         0          0            0        0
                 'probing_max_lp':             0           0         175             0         0         0           0         0          0            0        0
                   'pseudo_costs':         8'413      19'896     138'937        11'324       794    12'025     132'008         0      1'708       11'539    2'465
                  'quick_restart':         6'308      18'180      94'680             0       419    10'567      96'783         9      1'521        9'408    1'705
            'quick_restart_no_lp':        34'806     166'284     487'936       197'505       573     6'078      47'444       128      3'205       22'969      504
                  'reduced_costs':        14'074      52'394     213'260        43'464       547    10'878      92'009         7      3'418       23'150    1'830

Lp stats                         Component  Iterations  AddedCuts  OPTIMAL  DUAL_F.  DUAL_U.
                  'default_lp':          1     199'083      7'740   37'532        0        0
                   'fs_random':          1           0          0        0        0        0
                   'fs_random':          1           0          0        0        0        0
                   'fs_random':          1           0          0        0        0        0
                   'fs_random':          1           0          0        0        0        0
     'fs_random_quick_restart':          1           0          0        0        0        0
     'fs_random_quick_restart':          1           0          0        0        0        0
     'fs_random_quick_restart':          1           0          0        0        0        0
     'fs_random_quick_restart':          1           0          0        0        0        0
              'lb_tree_search':          1     468'108      5'074   28'811    8'311        0
                      'max_lp':          1     210'443      8'008   12'498    3'126       12
         'objective_lb_search':          1     292'900      7'015   37'563        0        0
  'objective_lb_search_max_lp':          1     428'947      9'501   18'120    5'408       12
                     'probing':          1      97'258     18'163    8'114        1        0
              'probing_max_lp':          1      20'747      5'937    2'793      178        0
                'pseudo_costs':          1     350'313     12'537   20'394    4'903        9
               'quick_restart':          1     215'518      9'644   25'145        0        1
               'reduced_costs':          1     359'406     15'620   26'983    6'567        2

Lp dimension                                                                      Final dimension of first component
                  'default_lp':   270 rows, 207 columns, 1205 entries with magnitude in [3.889667e-05, 1.000000e+00]
                   'fs_random':        0 rows, 207 columns, 0 entries with magnitude in [0.000000e+00, 0.000000e+00]
                   'fs_random':        0 rows, 207 columns, 0 entries with magnitude in [0.000000e+00, 0.000000e+00]
                   'fs_random':        0 rows, 207 columns, 0 entries with magnitude in [0.000000e+00, 0.000000e+00]
                   'fs_random':        0 rows, 207 columns, 0 entries with magnitude in [0.000000e+00, 0.000000e+00]
     'fs_random_quick_restart':        0 rows, 207 columns, 0 entries with magnitude in [0.000000e+00, 0.000000e+00]
     'fs_random_quick_restart':        0 rows, 207 columns, 0 entries with magnitude in [0.000000e+00, 0.000000e+00]
     'fs_random_quick_restart':        0 rows, 207 columns, 0 entries with magnitude in [0.000000e+00, 0.000000e+00]
     'fs_random_quick_restart':        0 rows, 207 columns, 0 entries with magnitude in [0.000000e+00, 0.000000e+00]
              'lb_tree_search':   450 rows, 213 columns, 1567 entries with magnitude in [4.845016e-03, 1.000000e+00]
                      'max_lp':   397 rows, 213 columns, 1495 entries with magnitude in [9.287076e-03, 1.000000e+00]
         'objective_lb_search':   321 rows, 207 columns, 1445 entries with magnitude in [8.402339e-03, 1.000000e+00]
  'objective_lb_search_max_lp':   540 rows, 213 columns, 1925 entries with magnitude in [3.134176e-03, 1.000000e+00]
                     'probing':  1273 rows, 207 columns, 9081 entries with magnitude in [6.672006e-05, 1.000000e+00]
              'probing_max_lp':  1174 rows, 213 columns, 9997 entries with magnitude in [1.907967e-03, 1.000000e+00]
                'pseudo_costs':   523 rows, 213 columns, 1569 entries with magnitude in [9.852797e-04, 1.000000e+00]
               'quick_restart':   476 rows, 207 columns, 2514 entries with magnitude in [7.241434e-05, 1.000000e+00]
               'reduced_costs':   436 rows, 213 columns, 1512 entries with magnitude in [7.620499e-03, 1.000000e+00]

Lp debug                         CutPropag  CutEqPropag  Adjust  Overflow        Bad  BadScaling
                  'default_lp':          7           39  21'600         0    105'318           0
                   'fs_random':          0            0       0         0          0           0
                   'fs_random':          0            0       0         0          0           0
                   'fs_random':          0            0       0         0          0           0
                   'fs_random':          0            0       0         0          0           0
     'fs_random_quick_restart':          0            0       0         0          0           0
     'fs_random_quick_restart':          0            0       0         0          0           0
     'fs_random_quick_restart':          0            0       0         0          0           0
     'fs_random_quick_restart':          0            0       0         0          0           0
              'lb_tree_search':         17            0  14'467         0     31'854           0
                      'max_lp':         53           13   5'303         0     95'980           0
         'objective_lb_search':         12           41  25'073         0    164'219           0
  'objective_lb_search_max_lp':         81            3  11'024         0    168'176           0
                     'probing':         15          320   5'894         0  2'122'776           0
              'probing_max_lp':         36           54   2'957         0  1'417'083           0
                'pseudo_costs':         64           25  10'525         0    136'356           0
               'quick_restart':         69           31  17'173         0    273'901           0
               'reduced_costs':         77           58  18'482         0    142'631           0

Lp pool                          Constraints  Updates  Simplif  Merged  Shortened   Split  Strenghtened      Cuts/Call
                  'default_lp':        7'760    1'493   19'943     200      3'532  11'010         7'244   7'740/28'102
                   'fs_random':          220        0        0       0          0       0             0            0/0
                   'fs_random':          220        0        0       0          0       0             0            0/0
                   'fs_random':          220        0        0       0          0       0             0            0/0
                   'fs_random':          220        0        0       0          0       0             0            0/0
     'fs_random_quick_restart':          220        0        0       0          0       0             0            0/0
     'fs_random_quick_restart':          220        0        0       0          0       0             0            0/0
     'fs_random_quick_restart':          220        0        0       0          0       0             0            0/0
     'fs_random_quick_restart':          220        0        0       0          0       0             0            0/0
              'lb_tree_search':        6'981      717   25'256      97      2'995     639        37'022   5'074/19'817
                      'max_lp':        9'854    1'272   65'081     158      5'612   4'256        69'008   8'008/21'344
         'objective_lb_search':        7'161    1'743   24'119      74      3'947  16'887        11'171   7'015/26'838
  'objective_lb_search_max_lp':       11'417    1'814  191'878      88     15'284   7'161        95'575   9'501/28'368
                     'probing':        9'333    3'211   12'001      50      1'559  27'825         4'695  18'163/40'154
              'probing_max_lp':        7'909    1'049   39'648      32      2'047   4'208        28'746   5'937/13'221
                'pseudo_costs':       11'346    1'497  149'838     195     14'749   6'861        85'712  12'537/34'569
               'quick_restart':        9'810    3'174  251'644      54     10'542  51'281        28'529   9'644/27'555
               'reduced_costs':       11'394    1'702  137'436     230     10'546   7'597        90'721  15'620/45'153

Lp Cut            defaul  max_lp  quick_  reduce  pseudo  lb_tre  probin  object  probin  object
          CG_FF:     467     341     572     824     459     209     450     440     169     309
           CG_K:     307     161     383     674     290     106     280     250      84     137
           CG_R:     491     149     665     680     264     111   1'262     393     100     106
          CG_RB:   1'587   1'007   2'028   2'147   1'805     778   2'668   1'380     556   1'280
         CG_RBP:     196      84     256     275     243      91     290     116      66     106
         Clique:       -      54       -      95      75      53       -       -      33      95
             IB:     843     498     767   1'020     788     522     863     664     347     556
       MIR_1_FF:     357     486     383     771     658     331     681     378     339     514
        MIR_1_K:      75      91      60     239     162      69      49      63      36      68
       MIR_1_KL:       -       1       -       -       -       -       1       -       -       -
        MIR_1_R:     106      45     121     130      62      33     151      99      51      50
       MIR_1_RB:     675     870     647   1'580   1'369     548   1'487     577     563     966
      MIR_1_RBP:      22     129      28     205     195     104      25      17      88      74
      MIR_1_RLT:       -      10       -       8       4       4       -       -       7       2
       MIR_2_FF:     202     282     276     538     421     159     418     218     186     286
        MIR_2_K:      34      59      59     146     116      25      56      35      27      58
       MIR_2_KL:       2       4       1       4       3       2       3       1       -       4
        MIR_2_R:      79     118     101     231     173      63     238      91     108     126
       MIR_2_RB:     370     442     507     839     708     254     852     383     325     526
      MIR_2_RBP:      30      54      32     101     110      38      51      18      45      37
       MIR_3_FF:      90     181     196     308     247     103     246     110     109     218
        MIR_3_K:      31      55      54     115      86      38      51      34      24      50
       MIR_3_KL:       7       3       5      11       5       -      18       7       1       7
        MIR_3_R:      51     111     112     176     155      66     140      63      79     124
       MIR_3_RB:     261     306     396     531     397     140     574     244     201     309
      MIR_3_RBP:      18      34      26      65      64      20      43      16      26      24
       MIR_4_FF:      59     120     143     202     149      65     151      72      52     127
        MIR_4_K:      18      48      40      79      70      38      38      34      22      43
       MIR_4_KL:       2       2       3       9       2       1      10       6       -       1
        MIR_4_R:      52      78      72     135     106      22     109      57      35     110
       MIR_4_RB:     171     180     249     281     235      68     330     174     111     200
      MIR_4_RBP:      14      24      21      46      42      11      33      13      10      20
       MIR_5_FF:      42      54      85     106      90      38     109      58      29      62
        MIR_5_K:      13      20      29      49      31      13      18      17       9      14
       MIR_5_KL:       2       1       -       5       1       1       5       -       -       1
        MIR_5_R:      38      32      58      73      64      17      82      35      16      55
       MIR_5_RB:     112      81     113     153     121      35     205      86      50      78
      MIR_5_RBP:      15      10      17      43      20       5      23       9       6      10
       MIR_6_FF:      35      28      48      59      46      12      72      33      24      38
        MIR_6_K:       7       8      18      18      25       8      16       8       5       9
       MIR_6_KL:       1       -       -       1       -       1       3       -       -       -
        MIR_6_R:      30      21      41      41      43       9      50      26      11      27
       MIR_6_RB:      59      33      54      67      62      19     100      52      44      48
      MIR_6_RBP:      12       5       6      23      18       2      22       7       4       8
   ZERO_HALF_FF:      80     115      93     258     177      79      90      73      47     104
    ZERO_HALF_K:      15      14      13      76      44      16      12      15       7      22
    ZERO_HALF_R:     518   1'240     675   1'559   1'816     492   5'250     461   1'624   2'156
   ZERO_HALF_RB:     132     279     174     515     440     210     455     156     222     293
  ZERO_HALF_RBP:      12      40      17     109      76      45      83      26      39      43

LNS stats           Improv/Calls  Closed  Difficulty  TimeLimit
  'graph_arc_lns':        30/392     53%        0.99       0.11
  'graph_cst_lns':        19/305     54%        0.99       0.11
  'graph_dec_lns':        21/392     52%        0.99       0.11
  'graph_var_lns':        31/393     53%        0.99       0.11
      'rins/rens':        62/370     52%        0.93       0.10
    'rnd_cst_lns':        21/389     53%        0.99       0.11
    'rnd_var_lns':        18/394     52%        0.99       0.11

LS stats                   Batches  Restarts   LinMoves   GenMoves  CompoundMoves  WeightUpdates
       'fj_long_default':        0         0          0          0              0              0
       'fj_long_default':        0         0          0          0              0              0
   'fj_long_lin_default':        0         0          0          0              0              0
   'fj_long_lin_perturb':        0         0          0          0              0              0
    'fj_long_lin_random':        0         0          0          0              0              0
       'fj_long_perturb':        0         0          0          0              0              0
        'fj_long_random':        0         0          0          0              0              0
      'fj_short_default':        0         0          0          0              0              0
      'fj_short_default':        1         1          0      3'896            356              2
  'fj_short_lin_default':        0         0          0          0              0              0
  'fj_short_lin_default':        0         0          0          0              0              0
  'fj_short_lin_perturb':        0         0          0          0              0              0
   'fj_short_lin_random':        0         0          0          0              0              0
      'fj_short_perturb':        0         0          0          0              0              0
       'fj_short_random':        0         0          0          0              0              0
          'violation_ls':      376         0  2'073'987    731'826         63'492        262'482
          'violation_ls':      382         0  1'457'614  1'163'220         96'122        188'924
          'violation_ls':      383         0  2'138'890    614'299         46'482        509'758
          'violation_ls':      384         0  1'143'321  1'573'981         70'146         90'580
          'violation_ls':      386         0  2'149'128    828'181         58'189         81'329

Solutions (98)            Num     Rank
        'graph_arc_lns':    1  [65,65]
        'graph_dec_lns':    2  [33,97]
        'graph_var_lns':    1  [10,10]
                'no_lp':   17   [1,98]
  'quick_restart_no_lp':   21  [13,96]
         'violation_ls':   56  [15,92]

Objective bounds                      Num
                        'bool_core':    1
                       'default_lp':    1
                   'initial_domain':    1
              'objective_lb_search':    5
       'objective_lb_search_max_lp':    3
        'objective_lb_search_no_lp':  117
  'objective_shaving_search_max_lp':    2
   'objective_shaving_search_no_lp':    7
                    'quick_restart':    3

Solution repositories    Added  Queried  Ignored  Synchro
  'feasible solutions':  2'558    7'716       10    2'442
        'lp solutions':    693      190        0      632
                'pump':  8'170      204

Improving bounds shared            Num
                        'core':     26
                  'default_lp':     68
              'lb_tree_search':     13
                      'max_lp':    108
                       'no_lp':     46
         'objective_lb_search':     12
  'objective_lb_search_max_lp':    158
                     'probing':    432
              'probing_max_lp':    165
                'pseudo_costs':    275
               'quick_restart':    237
         'quick_restart_no_lp':  2'199
               'reduced_costs':    137

Clauses shared                   Num
                        'core':    5
                  'default_lp':    7
              'lb_tree_search':    3
                      'max_lp':   28
                       'no_lp':   28
         'objective_lb_search':   14
  'objective_lb_search_max_lp':   61
   'objective_lb_search_no_lp':    4
                'pseudo_costs':   73
               'quick_restart':    5
         'quick_restart_no_lp':   31
               'reduced_costs':    4

CpSolverResponse summary:
status: OPTIMAL
objective: 790
best_bound: 790
integers: 208
booleans: 75
conflicts: 0
branches: 130
propagations: 24
integer_propagations: 2014
restarts: 130
lp_iterations: 0
walltime: 97.7778
usertime: 97.7778
deterministic_time: 548.638
gap_integral: 1629.09
solution_fingerprint: 0x4e74ea714f98701d


--- Simulation Gantt  partir du modle mathmatique ---
{'big':1, 'due_date':107, 'pos_time':5, 'status':0, 'blocked':0, 'operations':["{'type':1, 'processing_time':32}", "{'type':0, 'processing_time':48}"]}
{'big':0, 'due_date':57, 'pos_time':5, 'status':0, 'blocked':0, 'operations':["{'type':1, 'processing_time':27}"]}
{'big':0, 'due_date':98, 'pos_time':5, 'status':0, 'blocked':0, 'operations':["{'type':1, 'processing_time':20}", "{'type':0, 'processing_time':38}"]}
{'big':0, 'due_date':166, 'pos_time':5, 'status':0, 'blocked':0, 'operations':["{'type':0, 'processing_time':47}", "{'type':1, 'processing_time':21}"]}
{'big':0, 'due_date':175, 'pos_time':5, 'status':0, 'blocked':0, 'operations':["{'type':1, 'processing_time':27}", "{'type':0, 'processing_time':54}"]}
{'big':1, 'due_date':79, 'pos_time':5, 'status':0, 'blocked':0, 'operations':["{'type':1, 'processing_time':50}"]}
{'big':0, 'due_date':68, 'pos_time':5, 'status':0, 'blocked':0, 'operations':["{'type':1, 'processing_time':12}"]}
