created virtual environment CPython3.12.4.final.0-64 in 4364ms
  creator CPython3Posix(dest=/localscratch/aneumann.46806164.0/env, clear=False, no_vcs_ignore=False, global=False)
  seeder FromAppData(download=False, pip=bundle, via=copy, app_data_dir=/home/aneumann/.local/share/virtualenv)
    added seed packages: pip==24.2+computecanada
  activators BashActivator,CShellActivator,FishActivator,NushellActivator,PowerShellActivator,PythonActivator
Looking in links: /cvmfs/soft.computecanada.ca/custom/python/wheelhouse/gentoo2023/x86-64-v3, /cvmfs/soft.computecanada.ca/custom/python/wheelhouse/gentoo2023/generic, /cvmfs/soft.computecanada.ca/custom/python/wheelhouse/generic
Requirement already satisfied: pip in /localscratch/aneumann.46806164.0/env/lib/python3.12/site-packages (24.2+computecanada)
Processing /cvmfs/soft.computecanada.ca/custom/python/wheelhouse/generic/pip-25.0+computecanada-py3-none-any.whl
Installing collected packages: pip
  Attempting uninstall: pip
    Found existing installation: pip 24.2+computecanada
    Uninstalling pip-24.2+computecanada:
      Successfully uninstalled pip-24.2+computecanada
Successfully installed pip-24.2+computecanada
Looking in links: /cvmfs/soft.computecanada.ca/custom/python/wheelhouse/gentoo2023/x86-64-v3, /cvmfs/soft.computecanada.ca/custom/python/wheelhouse/gentoo2023/generic, /cvmfs/soft.computecanada.ca/custom/python/wheelhouse/generic
ERROR: protobuf-5.28.3-cp38-abi3-manylinux2014_x86_64.whl is not a supported wheel on this platform.
Looking in links: /cvmfs/soft.computecanada.ca/custom/python/wheelhouse/gentoo2023/x86-64-v3, /cvmfs/soft.computecanada.ca/custom/python/wheelhouse/gentoo2023/generic, /cvmfs/soft.computecanada.ca/custom/python/wheelhouse/generic
Processing /home/aneumann/projects/def-adhaj/aneumann/GNRS/wheels/immutabledict-4.2.0-py3-none-any.whl
Installing collected packages: immutabledict
Successfully installed immutabledict-4.2.0
Looking in links: /cvmfs/soft.computecanada.ca/custom/python/wheelhouse/gentoo2023/x86-64-v3, /cvmfs/soft.computecanada.ca/custom/python/wheelhouse/gentoo2023/generic, /cvmfs/soft.computecanada.ca/custom/python/wheelhouse/generic
Processing /cvmfs/soft.computecanada.ca/custom/python/wheelhouse/generic/ortools-9.10.4067+computecanada-cp312-cp312-linux_x86_64.whl (from -r /home/aneumann/projects/def-adhaj/aneumann/GNRS/requirements/or.txt (line 1))
Processing /cvmfs/soft.computecanada.ca/custom/python/wheelhouse/gentoo2023/x86-64-v3/matplotlib-3.10.0+computecanada-cp312-cp312-linux_x86_64.whl (from -r /home/aneumann/projects/def-adhaj/aneumann/GNRS/requirements/or.txt (line 2))
Processing /cvmfs/soft.computecanada.ca/custom/python/wheelhouse/gentoo2023/x86-64-v3/pandas-2.2.3+computecanada-cp312-cp312-linux_x86_64.whl (from -r /home/aneumann/projects/def-adhaj/aneumann/GNRS/requirements/or.txt (line 3))
Processing /cvmfs/soft.computecanada.ca/custom/python/wheelhouse/generic/absl_py-2.3.0+computecanada-py3-none-any.whl (from ortools<9.11,>=9.10->-r /home/aneumann/projects/def-adhaj/aneumann/GNRS/requirements/or.txt (line 1))
Processing /cvmfs/soft.computecanada.ca/custom/python/wheelhouse/gentoo2023/generic/numpy-2.2.2+computecanada-cp312-cp312-linux_x86_64.whl (from ortools<9.11,>=9.10->-r /home/aneumann/projects/def-adhaj/aneumann/GNRS/requirements/or.txt (line 1))
Processing /cvmfs/soft.computecanada.ca/custom/python/wheelhouse/gentoo2023/x86-64-v3/protobuf-6.31.1+computecanada-cp312-cp312-linux_x86_64.whl (from ortools<9.11,>=9.10->-r /home/aneumann/projects/def-adhaj/aneumann/GNRS/requirements/or.txt (line 1))
Requirement already satisfied: immutabledict>=3.0.0 in /localscratch/aneumann.46806164.0/env/lib/python3.12/site-packages (from ortools<9.11,>=9.10->-r /home/aneumann/projects/def-adhaj/aneumann/GNRS/requirements/or.txt (line 1)) (4.2.0)
Processing /cvmfs/soft.computecanada.ca/custom/python/wheelhouse/gentoo2023/generic/contourpy-1.3.1+computecanada-cp312-cp312-linux_x86_64.whl (from matplotlib->-r /home/aneumann/projects/def-adhaj/aneumann/GNRS/requirements/or.txt (line 2))
Processing /cvmfs/soft.computecanada.ca/custom/python/wheelhouse/generic/cycler-0.12.1+computecanada-py3-none-any.whl (from matplotlib->-r /home/aneumann/projects/def-adhaj/aneumann/GNRS/requirements/or.txt (line 2))
Processing /cvmfs/soft.computecanada.ca/custom/python/wheelhouse/generic/fonttools-4.59.0+computecanada-cp312-cp312-linux_x86_64.whl (from matplotlib->-r /home/aneumann/projects/def-adhaj/aneumann/GNRS/requirements/or.txt (line 2))
Processing /cvmfs/soft.computecanada.ca/custom/python/wheelhouse/gentoo2023/x86-64-v3/kiwisolver-1.4.8+computecanada-cp312-cp312-linux_x86_64.whl (from matplotlib->-r /home/aneumann/projects/def-adhaj/aneumann/GNRS/requirements/or.txt (line 2))
Processing /cvmfs/soft.computecanada.ca/custom/python/wheelhouse/generic/packaging-25.0+computecanada-py3-none-any.whl (from matplotlib->-r /home/aneumann/projects/def-adhaj/aneumann/GNRS/requirements/or.txt (line 2))
Processing /cvmfs/soft.computecanada.ca/custom/python/wheelhouse/gentoo2023/x86-64-v3/pillow-11.1.0+computecanada-cp312-cp312-linux_x86_64.whl (from matplotlib->-r /home/aneumann/projects/def-adhaj/aneumann/GNRS/requirements/or.txt (line 2))
Processing /cvmfs/soft.computecanada.ca/custom/python/wheelhouse/generic/pyparsing-3.2.3+computecanada-py3-none-any.whl (from matplotlib->-r /home/aneumann/projects/def-adhaj/aneumann/GNRS/requirements/or.txt (line 2))
Processing /cvmfs/soft.computecanada.ca/custom/python/wheelhouse/generic/python_dateutil-2.9.0.post0+computecanada-py2.py3-none-any.whl (from matplotlib->-r /home/aneumann/projects/def-adhaj/aneumann/GNRS/requirements/or.txt (line 2))
Processing /cvmfs/soft.computecanada.ca/custom/python/wheelhouse/generic/pytz-2025.2+computecanada-py2.py3-none-any.whl (from pandas->-r /home/aneumann/projects/def-adhaj/aneumann/GNRS/requirements/or.txt (line 3))
Processing /cvmfs/soft.computecanada.ca/custom/python/wheelhouse/generic/tzdata-2025.2+computecanada-py2.py3-none-any.whl (from pandas->-r /home/aneumann/projects/def-adhaj/aneumann/GNRS/requirements/or.txt (line 3))
Processing /cvmfs/soft.computecanada.ca/custom/python/wheelhouse/generic/six-1.17.0+computecanada-py2.py3-none-any.whl (from python-dateutil>=2.7->matplotlib->-r /home/aneumann/projects/def-adhaj/aneumann/GNRS/requirements/or.txt (line 2))
Installing collected packages: pytz, tzdata, six, pyparsing, protobuf, pillow, packaging, numpy, kiwisolver, fonttools, cycler, absl-py, python-dateutil, contourpy, pandas, matplotlib, ortools
Successfully installed absl-py-2.3.0+computecanada contourpy-1.3.1+computecanada cycler-0.12.1+computecanada fonttools-4.59.0+computecanada kiwisolver-1.4.8+computecanada matplotlib-3.10.0+computecanada numpy-2.2.2+computecanada ortools-9.10.4067+computecanada packaging-25.0+computecanada pandas-2.2.3+computecanada pillow-11.1.0+computecanada protobuf-6.31.1+computecanada pyparsing-3.2.3+computecanada python-dateutil-2.9.0.post0+computecanada pytz-2025.2+computecanada six-1.17.0+computecanada tzdata-2025.2+computecanada

Starting CP-SAT solver v9.10.4067
Parameters: max_time_in_seconds: 86400 max_memory_in_mb: 185000 log_search_progress: true enumerate_all_solutions: false num_search_workers: 32 absolute_gap_limit: 0 relative_gap_limit: 0

Initial optimization model '': (model_fingerprint: 0x363ba7a500d7c1ed)
#Variables: 329 (#ints: 9 in objective)
  - 240 Booleans in [0,1]
  - 89 in [0,624]
#kLinear1: 44
#kLinear2: 472
#kLinear3: 200
#kLinearN: 4'280 (#terms: 61'268)

Starting presolve at 0.00s
  1.52e-03s  0.00e+00d  [DetectDominanceRelations] 
  2.56e-02s  0.00e+00d  [PresolveToFixPoint] #num_loops=8 #num_dual_strengthening=3 
  3.47e-05s  0.00e+00d  [ExtractEncodingFromLinear] #potential_supersets=1 
[Symmetry] Graph for symmetry has 4'442 nodes and 40'457 arcs.
[Symmetry] Symmetry computation done. time: 0.00149264 dtime: 0.00288769
[Symmetry] #generators: 1, average support size: 18
[Symmetry] The model contains 202 duplicate constraints !
[Symmetry] 9 orbits with sizes: 2,2,2,2,2,2,2,2,2
[Symmetry] Num fixable by intersecting at_most_one with orbits: 1 largest_orbit: 2
  8.78e-03s  2.13e-03d  [Probe] #probed=326 #new_bounds=15 #equiv=1 
  9.19e-05s  0.00e+00d  [MaxClique] Merged 42(84 literals) into 12(24 literals) at_most_ones. 
  1.38e-03s  0.00e+00d  [DetectDominanceRelations] 
  1.10e-02s  0.00e+00d  [PresolveToFixPoint] #num_loops=5 #num_dual_strengthening=3 
  4.40e-03s  0.00e+00d  [ProcessAtMostOneAndLinear] 
  1.94e-03s  0.00e+00d  [DetectDuplicateConstraints] #duplicates=287 #without_enforcements=315 
  1.89e-03s  1.56e-04d  [DetectDominatedLinearConstraints] #relevant_constraints=3'147 #num_inclusions=2'841 
  3.29e-04s  0.00e+00d  [DetectDifferentVariables] #different=29 #cliques=1 #size=7 
  2.71e-04s  0.00e+00d  [ProcessSetPPC] #relevant_constraints=2'594 
  1.93e-05s  0.00e+00d  [FindAlmostIdenticalLinearConstraints] 
  1.77e-05s  0.00e+00d  [FindBigAtMostOneAndLinearOverlap] 
  3.80e-03s  3.04e-03d  [FindBigVerticalLinearOverlap] #blocks=30 #saved_nz=4'684 
  2.82e-04s  1.27e-04d  [FindBigHorizontalLinearOverlap] #linears=2'570 
  1.92e-05s  0.00e+00d  [MergeClauses] 
  1.17e-03s  0.00e+00d  [DetectDominanceRelations] 
  1.54e-02s  0.00e+00d  [PresolveToFixPoint] #num_loops=2 #num_dual_strengthening=1 
  1.16e-03s  0.00e+00d  [DetectDominanceRelations] 
  9.15e-03s  0.00e+00d  [PresolveToFixPoint] #num_loops=1 #num_dual_strengthening=1 
[Symmetry] Graph for symmetry has 4'192 nodes and 34'326 arcs.
[Symmetry] Symmetry computation done. time: 0.000802804 dtime: 0.00188774
  7.93e-03s  1.92e-03d  [Probe] #probed=326 #new_bounds=17 
  1.23e-05s  0.00e+00d  [MaxClique] 
  1.15e-03s  0.00e+00d  [DetectDominanceRelations] 
  1.19e-02s  0.00e+00d  [PresolveToFixPoint] #num_loops=2 #num_dual_strengthening=1 
  4.03e-03s  0.00e+00d  [ProcessAtMostOneAndLinear] 
  1.75e-03s  0.00e+00d  [DetectDuplicateConstraints] #without_enforcements=353 
  1.15e-03s  9.74e-05d  [DetectDominatedLinearConstraints] #relevant_constraints=2'826 #num_inclusions=769 
  1.99e-04s  0.00e+00d  [DetectDifferentVariables] 
  2.67e-04s  0.00e+00d  [ProcessSetPPC] #relevant_constraints=2'467 
  2.44e-05s  1.80e-07d  [FindAlmostIdenticalLinearConstraints] #num_tested_pairs=12 
  1.09e-05s  0.00e+00d  [FindBigAtMostOneAndLinearOverlap] 
  3.51e-03s  2.55e-03d  [FindBigVerticalLinearOverlap] #blocks=40 #saved_nz=4'406 
  2.67e-04s  9.99e-05d  [FindBigHorizontalLinearOverlap] #linears=2'377 
  1.17e-05s  0.00e+00d  [MergeClauses] 
  1.46e-03s  0.00e+00d  [DetectDominanceRelations] 
  1.82e-02s  0.00e+00d  [PresolveToFixPoint] #num_loops=2 #num_dual_strengthening=1 
  1.45e-03s  0.00e+00d  [DetectDominanceRelations] 
  1.12e-02s  0.00e+00d  [PresolveToFixPoint] #num_loops=1 #num_dual_strengthening=1 
[Symmetry] Graph for symmetry has 4'301 nodes and 29'949 arcs.
[Symmetry] Symmetry computation done. time: 0.000665464 dtime: 0.00169405
  7.13e-03s  1.75e-03d  [Probe] #probed=326 #new_bounds=34 
  1.36e-05s  0.00e+00d  [MaxClique] 
  1.46e-03s  0.00e+00d  [DetectDominanceRelations] 
  1.63e-02s  0.00e+00d  [PresolveToFixPoint] #num_loops=2 #num_dual_strengthening=1 
  3.53e-03s  0.00e+00d  [ProcessAtMostOneAndLinear] 
  1.69e-03s  0.00e+00d  [DetectDuplicateConstraints] #without_enforcements=397 
  8.15e-04s  6.56e-05d  [DetectDominatedLinearConstraints] #relevant_constraints=2'575 #num_inclusions=15 
  1.89e-04s  0.00e+00d  [DetectDifferentVariables] 
  2.29e-04s  0.00e+00d  [ProcessSetPPC] #relevant_constraints=2'238 
  2.93e-05s  4.95e-07d  [FindAlmostIdenticalLinearConstraints] #num_tested_pairs=33 
  1.18e-05s  0.00e+00d  [FindBigAtMostOneAndLinearOverlap] 
  2.32e-03s  1.89e-03d  [FindBigVerticalLinearOverlap] #blocks=32 #saved_nz=2'004 
  2.33e-04s  8.20e-05d  [FindBigHorizontalLinearOverlap] #linears=2'113 
  1.16e-05s  0.00e+00d  [MergeClauses] 
  1.36e-03s  0.00e+00d  [DetectDominanceRelations] 
  1.37e-02s  0.00e+00d  [PresolveToFixPoint] #num_loops=2 #num_dual_strengthening=1 
  7.33e-05s  0.00e+00d  [ExpandObjective] #entries=382 #tight_variables=157 #tight_constraints=85 

Presolve summary:
  - 80 affine relations were detected.
  - rule 'TODO dual: only one blocking constraint?' was applied 533 times.
  - rule 'TODO dual: only one blocking enforced constraint?' was applied 104 times.
  - rule 'TODO dual: only one unspecified blocking constraint?' was applied 22 times.
  - rule 'TODO duplicate: identical constraint with different enforcements' was applied 1'065 times.
  - rule 'affine: new relation' was applied 80 times.
  - rule 'at_most_one: removed literals' was applied 12 times.
  - rule 'at_most_one: size one' was applied 12 times.
  - rule 'at_most_one: transformed into max clique.' was applied 1 time.
  - rule 'deductions: 250 stored' was applied 1 time.
  - rule 'dual: fix variable' was applied 24 times.
  - rule 'dual: reduced domain' was applied 35 times.
  - rule 'duplicate: merged rhs of linear constraint' was applied 73 times.
  - rule 'duplicate: removed constraint' was applied 287 times.
  - rule 'enforcement: false literal' was applied 14 times.
  - rule 'exactly_one: x and not(x)' was applied 1 time.
  - rule 'incompatible linear: add implication' was applied 63 times.
  - rule 'linear matrix: common vertical rectangle' was applied 102 times.
  - rule 'linear: always true' was applied 1'111 times.
  - rule 'linear: doubleton free' was applied 12 times.
  - rule 'linear: empty' was applied 38 times.
  - rule 'linear: extracted enforcement literal' was applied 8'343 times.
  - rule 'linear: fixed or dup variables' was applied 4'411 times.
  - rule 'linear: positive equal one' was applied 1 time.
  - rule 'linear: reduced variable domains' was applied 207 times.
  - rule 'linear: remapped using affine relations' was applied 4'432 times.
  - rule 'linear: simplified rhs' was applied 10'791 times.
  - rule 'linear: tightened into equality' was applied 8 times.
  - rule 'linear: variable substitution 1' was applied 12 times.
  - rule 'no_overlap: inferred from x != y constraints' was applied 1 time.
  - rule 'presolve: 101 unused variables removed.' was applied 1 time.
  - rule 'presolve: iteration' was applied 3 times.
  - rule 'probing: reduced enforced constraint to implication.' was applied 42 times.
  - rule 'symmetry: fixed to false in general orbit' was applied 1 time.

Presolved optimization model '': (model_fingerprint: 0xb87cadcd0f0e5253)
#Variables: 238 (#ints: 9 in objective)
  - 79 Booleans in [0,1]
  - 136 different domains in [-4989,4869] with a largest complexity of 10.
#kInterval: 7
#kLinear2: 951 (#enforced: 911 #multi: 791)
#kLinear3: 343 (#enforced: 210)
#kLinearN: 2'220 (#enforced: 2'094 #multi: 114) (#terms: 16'833)
#kNoOverlap: 1 (#intervals: 7)

Preloading model.
#Bound   0.21s best:inf   next:[252,4833] initial_domain
[Symmetry] Graph for symmetry has 4'201 nodes and 27'974 arcs.
[Symmetry] Symmetry computation done. time: 0.000625293 dtime: 0.00157941
#Model   0.22s var:238/238 constraints:3522/3522

Starting search at 0.22s with 32 workers.
17 full problem subsolvers: [core, default_lp, fixed, lb_tree_search, max_lp, no_lp, objective_lb_search, objective_lb_search_max_lp, objective_lb_search_no_lp, objective_shaving_search_max_lp, objective_shaving_search_no_lp, probing, probing_max_lp, pseudo_costs, quick_restart, quick_restart_no_lp, reduced_costs]
13 first solution subsolvers: [fj_long_default, fj_long_lin_default, fj_long_random, fj_short_default, fj_short_lin_default, fj_short_lin_random, fj_short_random, fs_random(2), fs_random_no_lp, fs_random_quick_restart(2), fs_random_quick_restart_no_lp]
13 incomplete subsolvers: [feasibility_pump, graph_arc_lns, graph_cst_lns, graph_dec_lns, graph_var_lns, rins/rens, rnd_cst_lns, rnd_var_lns, scheduling_intervals_lns, scheduling_precedences_lns, scheduling_time_window_lns, violation_ls(2)]
3 helper subsolvers: [neighborhood_helper, synchronization_agent, update_gap_integral]
#Bound   0.24s best:inf   next:[253,4833] objective_shaving_search_no_lp (vars=238 csts=3523)
#Bound   0.29s best:inf   next:[254,4833] bool_core (num_cores=1 [cover] a=7 d=2 fixed=0/94 clauses=4)
#Bound   0.29s best:inf   next:[255,4833] bool_core (num_cores=1 [cover] a=7 d=2 fixed=1/99 clauses=8)
#Bound   0.29s best:inf   next:[256,4833] bool_core (num_cores=1 [cover] a=7 d=2 fixed=2/104 clauses=14)
#Bound   0.29s best:inf   next:[257,4833] bool_core (num_cores=1 [cover] a=7 d=2 fixed=3/109 clauses=22)
#Bound   0.29s best:inf   next:[258,4833] bool_core (num_cores=1 [cover] a=7 d=2 fixed=4/114 clauses=32)
#Bound   0.29s best:inf   next:[259,4833] bool_core (num_cores=1 [cover] a=7 d=2 fixed=5/119 clauses=44)
#Bound   0.29s best:inf   next:[260,4833] bool_core (num_cores=1 [cover] a=7 d=2 fixed=6/124 clauses=58)
#Bound   0.29s best:inf   next:[261,4833] bool_core (num_cores=1 [cover] a=7 d=2 fixed=7/129 clauses=74)
#Bound   0.30s best:inf   next:[262,4833] bool_core (num_cores=1 [cover] a=7 d=2 fixed=8/134 clauses=92)
#Bound   0.30s best:inf   next:[263,4833] bool_core (num_cores=1 [cover] a=7 d=2 fixed=9/139 clauses=112)
#Bound   0.30s best:inf   next:[264,4833] bool_core (num_cores=1 [cover] a=7 d=2 fixed=10/144 clauses=134)
#Bound   0.30s best:inf   next:[267,4833] objective_lb_search_no_lp
#1       0.31s best:2090  next:[267,2089] quick_restart_no_lp (fixed_bools=0/111)
#Bound   0.32s best:2090  next:[268,2089] bool_core (num_cores=1 [cover] a=7 d=2 fixed=14/164 clauses=245)
#Bound   0.32s best:2090  next:[269,2089] bool_core (num_cores=1 [cover] a=7 d=2 fixed=15/169 clauses=278)
#2       0.33s best:2085  next:[269,2084] no_lp (fixed_bools=0/118)
#Bound   0.33s best:2085  next:[270,2084] bool_core (num_cores=1 [cover] a=7 d=2 fixed=16/174 clauses=313)
#3       0.33s best:2075  next:[270,2074] no_lp (fixed_bools=0/119)
#Bound   0.33s best:2075  next:[271,2074] bool_core (num_cores=1 [cover] a=7 d=2 fixed=17/179 clauses=350)
#4       0.34s best:1955  next:[271,1954] no_lp (fixed_bools=0/122)
#5       0.34s best:1638  next:[271,1637] no_lp (fixed_bools=0/127)
#Bound   0.34s best:1638  next:[272,1637] bool_core (num_cores=1 [cover] a=7 d=2 fixed=18/184 clauses=389)
#6       0.34s best:1629  next:[272,1628] no_lp (fixed_bools=0/130)
#Bound   0.35s best:1629  next:[273,1628] bool_core (num_cores=1 [cover] a=7 d=2 fixed=19/189 clauses=430)
#Bound   0.35s best:1629  next:[274,1628] bool_core (num_cores=1 [cover] a=7 d=2 fixed=20/194 clauses=473)
#7       0.37s best:1628  next:[276,1627] violation_ls(batch:1 #solutions_imported:1 #lin_moves:0 #lin_evals:4'291 #gen_moves:1'947 #gen_evals:638 #comp_moves:193 #backtracks:877 #weight_updates:33)
#8       0.37s best:1627  next:[278,1626] violation_ls(batch:2 #solutions_imported:2 #lin_moves:0 #lin_evals:4'294 #gen_moves:1'948 #gen_evals:638 #comp_moves:194 #backtracks:877 #weight_updates:33)
#9       0.38s best:1625  next:[279,1624] rnd_var_lns (d=0.71 s=45 t=0.10 p=1.00 stall=1 h=auto_l0) [presolve]
#10      0.38s best:1623  next:[281,1622] no_lp (fixed_bools=0/139)
#11      0.39s best:1570  next:[281,1569] no_lp (fixed_bools=0/141)
#12      0.39s best:1544  next:[281,1543] no_lp (fixed_bools=0/143)
#13      0.42s best:1537  next:[331,1536] quick_restart_no_lp (fixed_bools=0/129)
#14      0.45s best:1536  next:[388,1535] violation_ls(batch:3 #solutions_imported:3 #lin_moves:7'090 #lin_evals:34'877 #gen_moves:1'612 #gen_evals:450 #comp_moves:164 #backtracks:724 #weight_updates:308)
#15      0.47s best:1535  next:[420,1534] rnd_var_lns (d=0.81 s=58 t=0.10 p=1.00 stall=0 h=auto_l0) [presolve]
#16      0.50s best:1531  next:[703,1530] graph_arc_lns (d=0.81 s=61 t=0.10 p=1.00 stall=0 h=auto_l0) [presolve]
#17      0.52s best:1528  next:[703,1527] quick_restart_no_lp (fixed_bools=0/158)
#18      0.55s best:1525  next:[703,1524] quick_restart_no_lp (fixed_bools=0/162)
#19      0.55s best:1520  next:[703,1519] quick_restart_no_lp (fixed_bools=0/168)
#20      0.57s best:1516  next:[703,1515] quick_restart_no_lp (fixed_bools=0/172)
#21      0.58s best:1515  next:[703,1514] violation_ls(batch:4 #solutions_imported:4 #lin_moves:9'481 #lin_evals:44'681 #gen_moves:1'948 #gen_evals:638 #comp_moves:194 #backtracks:877 #weight_updates:553)
#22      0.58s best:1514  next:[703,1513] violation_ls(batch:4 #solutions_imported:4 #lin_moves:7'090 #lin_evals:35'500 #gen_moves:1'876 #gen_evals:542 #comp_moves:198 #backtracks:839 #weight_updates:315)
#23      0.62s best:1513  next:[703,1512] quick_restart_no_lp (fixed_bools=0/187)
#24      0.68s best:1507  next:[703,1506] graph_var_lns (d=0.81 s=71 t=0.10 p=1.00 stall=0 h=auto_l0) [presolve]
#25      0.69s best:1503  next:[703,1502] no_lp (fixed_bools=0/155)
#26      0.70s best:1487  next:[703,1486] no_lp (fixed_bools=0/157)
#27      0.75s best:1483  next:[1004,1482] quick_restart_no_lp (fixed_bools=0/227)
#28      0.75s best:1479  next:[1004,1478] quick_restart_no_lp (fixed_bools=0/230)
#29      0.76s best:1475  next:[1004,1474] quick_restart_no_lp (fixed_bools=0/231)
#30      0.76s best:1471  next:[1004,1470] quick_restart_no_lp (fixed_bools=0/237)
#31      0.76s best:1467  next:[1004,1466] quick_restart_no_lp (fixed_bools=0/242)
#32      0.76s best:1459  next:[1004,1458] rins_lp_lns (d=0.50 s=76 t=0.10 p=0.00 stall=0 h=auto_l0) [presolve]
#33      0.77s best:1376  next:[1004,1375] scheduling_time_window_lns (d=0.50 s=52 t=0.10 p=0.00 stall=0 h=auto_l0)
#34      0.81s best:1335  next:[1004,1334] quick_restart_no_lp (fixed_bools=0/272)
#35      0.83s best:1333  next:[1004,1332] quick_restart_no_lp (fixed_bools=0/277)
#36      0.86s best:1332  next:[1004,1331] quick_restart_no_lp (fixed_bools=0/288)
#37      0.89s best:1330  next:[1004,1329] quick_restart_no_lp (fixed_bools=0/310)
#38      0.90s best:1324  next:[1004,1323] quick_restart_no_lp (fixed_bools=0/325)
#39      0.91s best:1323  next:[1004,1322] quick_restart_no_lp (fixed_bools=0/325)
#Bound   0.93s best:1323  next:[1011,1322] objective_lb_search_no_lp [skipped_logs=12]
#Bound   1.97s best:1323  next:[1027,1322] objective_lb_search_no_lp [skipped_logs=3]
#Model   2.58s var:237/238 constraints:3482/3522
#Bound   2.59s best:1323  next:[1032,1322] objective_lb_search_no_lp [skipped_logs=2]
#Bound   3.98s best:1323  next:[1091,1322] objective_lb_search_no_lp [skipped_logs=5]
#Bound   5.00s best:1323  next:[1095,1322] objective_lb_search_no_lp [skipped_logs=1]
#Bound   5.82s best:1323  next:[1098,1322] objective_lb_search_no_lp [skipped_logs=2]
#Bound   6.67s best:1323  next:[1107,1322] objective_lb_search_no_lp [skipped_logs=4]
#Bound   7.77s best:1323  next:[1114,1322] objective_lb_search_no_lp [skipped_logs=2]
#Bound   8.38s best:1323  next:[1115,1322] objective_lb_search [skipped_logs=0]
#Bound   9.89s best:1323  next:[1122,1322] objective_lb_search_no_lp [skipped_logs=4]
#Bound  10.79s best:1323  next:[1128,1322] objective_lb_search_no_lp [skipped_logs=4]
#Bound  11.26s best:1323  next:[1129,1322] objective_lb_search_no_lp [skipped_logs=0]
#Bound  12.95s best:1323  next:[1141,1322] objective_lb_search_no_lp [skipped_logs=2]
#Model  13.19s var:236/238 constraints:3380/3522
#Bound  13.81s best:1323  next:[1153,1322] objective_lb_search_no_lp [skipped_logs=2]
#Model  14.08s var:235/238 constraints:3307/3522
#Model  14.47s var:233/238 constraints:3251/3522
#Model  14.58s var:232/238 constraints:3227/3522
#Model  14.66s var:222/238 constraints:2473/3522
#Model  14.70s var:221/238 constraints:2451/3522
#Model  14.74s var:219/238 constraints:2361/3522
#Model  14.74s var:217/238 constraints:2279/3522
#Done   14.75s no_lp
#Done   14.75s quick_restart_no_lp
#Done   14.75s core
#Model  14.75s var:209/238 constraints:1757/3522
#Bound  14.74s best:1323  next:[1218,1322] objective_lb_search_no_lp [skipped_logs=4]

Task timing                                  n [     min,      max]      avg      dev     time         n [     min,      max]      avg      dev    dtime
                             'core':         1 [  14.53s,   14.53s]   14.53s   0.00ns   14.53s         1 [  24.31s,   24.31s]   24.31s   0.00ns   24.31s
                       'default_lp':         1 [  14.53s,   14.53s]   14.53s   0.00ns   14.53s         1 [   4.98s,    4.98s]    4.98s   0.00ns    4.98s
                 'feasibility_pump':        61 [ 13.66ms, 763.58ms]  78.11ms  88.99ms    4.76s        60 [  4.12ms,  34.79ms]  18.82ms   2.81ms    1.13s
                            'fixed':         1 [  14.53s,   14.53s]   14.53s   0.00ns   14.53s         1 [   3.93s,    3.93s]    3.93s   0.00ns    3.93s
                  'fj_long_default':         1 [244.70ms, 244.70ms] 244.70ms   0.00ns 244.70ms         1 [117.13ms, 117.13ms] 117.13ms   0.00ns 117.13ms
              'fj_long_lin_default':         1 [153.48ms, 153.48ms] 153.48ms   0.00ns 153.48ms         1 [ 90.84ms,  90.84ms]  90.84ms   0.00ns  90.84ms
                   'fj_long_random':         1 [392.24ms, 392.24ms] 392.24ms   0.00ns 392.24ms         1 [127.71ms, 127.71ms] 127.71ms   0.00ns 127.71ms
                 'fj_short_default':         1 [109.75ms, 109.75ms] 109.75ms   0.00ns 109.75ms         1 [ 93.66ms,  93.66ms]  93.66ms   0.00ns  93.66ms
             'fj_short_lin_default':         1 [163.83ms, 163.83ms] 163.83ms   0.00ns 163.83ms         1 [ 90.25ms,  90.25ms]  90.25ms   0.00ns  90.25ms
              'fj_short_lin_random':         1 [212.49ms, 212.49ms] 212.49ms   0.00ns 212.49ms         1 [ 91.86ms,  91.86ms]  91.86ms   0.00ns  91.86ms
                  'fj_short_random':         1 [283.15ms, 283.15ms] 283.15ms   0.00ns 283.15ms         1 [ 92.22ms,  92.22ms]  92.22ms   0.00ns  92.22ms
                        'fs_random':         1 [ 89.74ms,  89.74ms]  89.74ms   0.00ns  89.74ms         1 [  2.00us,   2.00us]   2.00us   0.00ns   2.00us
                        'fs_random':         1 [109.07ms, 109.07ms] 109.07ms   0.00ns 109.07ms         1 [  2.00us,   2.00us]   2.00us   0.00ns   2.00us
                  'fs_random_no_lp':         1 [ 90.71ms,  90.71ms]  90.71ms   0.00ns  90.71ms         1 [314.89us, 314.89us] 314.89us   0.00ns 314.89us
          'fs_random_quick_restart':         1 [ 89.61ms,  89.61ms]  89.61ms   0.00ns  89.61ms         1 [  2.00us,   2.00us]   2.00us   0.00ns   2.00us
          'fs_random_quick_restart':         1 [ 91.04ms,  91.04ms]  91.04ms   0.00ns  91.04ms         1 [  2.00us,   2.00us]   2.00us   0.00ns   2.00us
    'fs_random_quick_restart_no_lp':         1 [116.99ms, 116.99ms] 116.99ms   0.00ns 116.99ms         1 [459.05us, 459.05us] 459.05us   0.00ns 459.05us
                    'graph_arc_lns':        60 [  2.88ms, 585.72ms] 322.51ms 204.68ms   19.35s        59 [ 10.00ns, 100.31ms]  55.16ms  43.58ms    3.25s
                    'graph_cst_lns':        60 [  1.31ms, 603.75ms] 278.56ms 208.42ms   16.71s        56 [ 10.00ns, 100.41ms]  51.21ms  42.62ms    2.87s
                    'graph_dec_lns':        60 [ 14.29ms, 580.90ms] 332.64ms 184.62ms   19.96s        58 [ 10.00ns, 100.36ms]  58.88ms  39.97ms    3.42s
                    'graph_var_lns':        60 [  8.54ms, 590.32ms] 305.97ms 200.27ms   18.36s        59 [ 10.00ns, 100.79ms]  51.39ms  43.41ms    3.03s
                   'lb_tree_search':         1 [  14.53s,   14.53s]   14.53s   0.00ns   14.53s         1 [   7.70s,    7.70s]    7.70s   0.00ns    7.70s
                           'max_lp':         1 [  14.53s,   14.53s]   14.53s   0.00ns   14.53s         1 [   5.23s,    5.23s]    5.23s   0.00ns    5.23s
                            'no_lp':         1 [  14.53s,   14.53s]   14.53s   0.00ns   14.53s         1 [   4.11s,    4.11s]    4.11s   0.00ns    4.11s
              'objective_lb_search':         1 [  14.53s,   14.53s]   14.53s   0.00ns   14.53s         1 [   5.38s,    5.38s]    5.38s   0.00ns    5.38s
       'objective_lb_search_max_lp':         1 [  14.53s,   14.53s]   14.53s   0.00ns   14.53s         1 [   6.04s,    6.04s]    6.04s   0.00ns    6.04s
        'objective_lb_search_no_lp':         1 [  14.53s,   14.53s]   14.53s   0.00ns   14.53s         1 [   3.29s,    3.29s]    3.29s   0.00ns    3.29s
  'objective_shaving_search_max_lp':        49 [ 12.18ms,    1.11s] 292.64ms 239.86ms   14.34s        45 [840.49us, 308.63ms]  60.90ms  74.86ms    2.74s
   'objective_shaving_search_no_lp':        50 [ 19.92ms,    1.10s] 283.44ms 235.96ms   14.17s        46 [837.22us, 206.16ms]  41.40ms  47.35ms    1.90s
                          'probing':         1 [  14.53s,   14.53s]   14.53s   0.00ns   14.53s         1 [   1.67s,    1.67s]    1.67s   0.00ns    1.67s
                   'probing_max_lp':         1 [  14.53s,   14.53s]   14.53s   0.00ns   14.53s         1 [   4.89s,    4.89s]    4.89s   0.00ns    4.89s
                     'pseudo_costs':         1 [  14.53s,   14.53s]   14.53s   0.00ns   14.53s         1 [   5.13s,    5.13s]    5.13s   0.00ns    5.13s
                    'quick_restart':         1 [  14.53s,   14.53s]   14.53s   0.00ns   14.53s         1 [   5.75s,    5.75s]    5.75s   0.00ns    5.75s
              'quick_restart_no_lp':         1 [  14.53s,   14.53s]   14.53s   0.00ns   14.53s         1 [   5.08s,    5.08s]    5.08s   0.00ns    5.08s
                    'reduced_costs':         1 [  14.53s,   14.53s]   14.53s   0.00ns   14.53s         1 [   5.07s,    5.07s]    5.07s   0.00ns    5.07s
                        'rins/rens':        61 [ 75.72us, 688.75ms] 282.12ms 218.98ms   17.21s        50 [ 10.00ns, 100.32ms]  69.93ms  40.96ms    3.50s
                      'rnd_cst_lns':        60 [  1.32ms, 552.88ms] 293.70ms 206.62ms   17.62s        55 [ 10.00ns, 102.21ms]  57.11ms  42.43ms    3.14s
                      'rnd_var_lns':        61 [  5.77ms, 706.82ms] 334.91ms 205.76ms   20.43s        58 [ 10.00ns, 121.06ms]  57.95ms  42.86ms    3.36s
         'scheduling_intervals_lns':        60 [ 18.73ms,    1.15s] 446.94ms 219.31ms   26.82s        59 [ 14.97ms, 100.56ms]  72.94ms  31.48ms    4.30s
       'scheduling_precedences_lns':        60 [ 15.09ms,    1.67s] 459.92ms 274.96ms   27.60s        59 [  9.36ms, 100.56ms]  73.07ms  34.06ms    4.31s
       'scheduling_time_window_lns':        60 [ 14.78ms, 829.87ms] 313.46ms 165.00ms   18.81s        58 [ 11.06ms, 100.49ms]  41.45ms  29.60ms    2.40s
                     'violation_ls':        61 [  1.03ms,  76.20ms]  44.23ms  10.66ms    2.70s        61 [  1.01us,  92.71ms]  81.12ms  18.55ms    4.95s
                     'violation_ls':        61 [  2.37ms,  85.10ms]  55.33ms  15.85ms    3.37s        61 [  3.74ms, 104.07ms]  85.33ms  20.86ms    5.21s

Search stats                        Bools  Conflicts  Branches  Restarts  BoolPropag  IntegerPropag
                           'core':  4'017      9'839    27'760     3'974  16'162'531      8'363'470
                     'default_lp':     79      6'000    36'884     5'041     243'156      6'654'453
                          'fixed':  1'247     25'992    31'820       879   7'072'300      8'180'333
                      'fs_random':     79          0       158       158           0          2'927
                      'fs_random':     79          0       158       158           0          2'927
                'fs_random_no_lp':    116          5       210       159          77          4'183
        'fs_random_quick_restart':     79          0       158       158           0          2'927
        'fs_random_quick_restart':     79          0       158       158           0          2'927
  'fs_random_quick_restart_no_lp':     79          0       217       158           1          4'607
                 'lb_tree_search':    100        149    28'536     4'305     107'818      2'518'549
                         'max_lp':     79      4'861    34'084     5'579     214'440      5'762'224
                          'no_lp':    583     16'392    49'631     5'055   2'610'647     12'654'906
            'objective_lb_search':    124      4'365    41'888     9'025     295'657      6'376'173
     'objective_lb_search_max_lp':    140      3'226    47'905    12'983     304'282      5'559'829
      'objective_lb_search_no_lp':    191     14'789    37'650     5'466     479'689     12'007'963
                        'probing':    418        211       669       669      17'092         90'901
                 'probing_max_lp':    222         40       404       404       3'526         30'396
                   'pseudo_costs':     79      5'147    36'200     5'504     216'567      5'977'617
                  'quick_restart':    702      4'761    47'044     6'022   1'992'757      5'287'475
            'quick_restart_no_lp':  2'105     19'818    64'980     5'859   9'620'810     10'657'971
                  'reduced_costs':    372      5'653    42'459     6'434   1'199'529      6'388'742

SAT stats                           ClassicMinim  LitRemoved  LitLearned  LitForgotten  Subsumed  MClauses  MDecisions  MLitTrue  MSubsumed  MLitRemoved  MReused
                           'core':         8'629      44'726      61'685             0        32     1'533       7'629         0         11           35        5
                     'default_lp':         3'865       9'482      56'440             0       283     2'514      28'674         0        689        5'000      718
                          'fixed':        16'493     107'123     472'611             0        83       428       5'170         0        212        1'962      224
                      'fs_random':             0           0           0             0         0         0           0         0          0            0        0
                      'fs_random':             0           0           0             0         0         0           0         0          0            0        0
                'fs_random_no_lp':             0           0          45             0         0         0           0         0          0            0        0
        'fs_random_quick_restart':             0           0           0             0         0         0           0         0          0            0        0
        'fs_random_quick_restart':             0           0           0             0         0         0           0         0          0            0        0
  'fs_random_quick_restart_no_lp':             0           0           0             0         0         0           0         0          0            0        0
                 'lb_tree_search':             8          10         492             0         0     1'390       7'125         0         11           47      164
                         'max_lp':         3'027       7'016      45'916             0       228     2'969      27'496         0        810        5'479      727
                          'no_lp':        12'620      40'579     151'744        36'794       394     2'755      26'876         0      1'491       11'572      447
            'objective_lb_search':         3'168       8'498      32'434             0       254     3'776      33'101         0        820        5'067    1'124
     'objective_lb_search_max_lp':         2'211       5'423      24'508             0       157     4'282      37'092         0        506        3'126      900
      'objective_lb_search_no_lp':        12'088      39'488     108'021             0       304     2'499      18'385         0      1'109        6'737      394
                        'probing':             0           0         211             0         0         0           0         0          0            0        0
                 'probing_max_lp':             0           0          40             0         0         0           0         0          0            0        0
                   'pseudo_costs':         3'174       6'916      51'102             0       269     2'874      29'042         0        770        5'127      882
                  'quick_restart':         2'787       7'201      41'331             0       222     3'261      37'682         9      1'166        8'797    1'083
            'quick_restart_no_lp':        12'798      52'720     199'271             0       265     2'502      23'421        75      1'681       14'088      332
                  'reduced_costs':         4'057       9'963      49'615             0       247     3'416      30'039         2      1'452        9'434      641

Lp stats                         Component  Iterations  AddedCuts  OPTIMAL  DUAL_F.  DUAL_U.
                  'default_lp':          1     103'195      5'716   11'810        0        2
                       'fixed':          1      14'141      1'434   26'184        0        0
                   'fs_random':          1          55         50        3        0        0
                   'fs_random':          1          55         50        3        0        0
     'fs_random_quick_restart':          1          55         50        3        0        0
     'fs_random_quick_restart':          1          55         50        3        0        0
              'lb_tree_search':          1     220'809      3'448   15'277    4'526        0
                      'max_lp':          1      99'101      5'630    8'930    2'035        3
         'objective_lb_search':          1     121'493      4'102   10'307        0        4
  'objective_lb_search_max_lp':          1     121'318      4'443    6'762    1'795        3
                     'probing':          1      13'990      3'393    2'033        0        1
              'probing_max_lp':          1      13'663      7'302    1'340       61        0
                'pseudo_costs':          1     101'570      6'234    9'499    2'241        2
               'quick_restart':          1     108'948      4'817    8'911        0        1
               'reduced_costs':          1      93'764      5'852    8'227    2'284        3

Lp dimension                                                                       Final dimension of first component
                  'default_lp':    453 rows, 227 columns, 1604 entries with magnitude in [5.948740e-04, 1.000000e+00]
                       'fixed':     197 rows, 227 columns, 704 entries with magnitude in [1.554335e-02, 1.000000e+00]
                   'fs_random':      59 rows, 227 columns, 204 entries with magnitude in [8.951436e-02, 1.000000e+00]
                   'fs_random':      59 rows, 227 columns, 204 entries with magnitude in [8.951436e-02, 1.000000e+00]
     'fs_random_quick_restart':      59 rows, 227 columns, 204 entries with magnitude in [8.951436e-02, 1.000000e+00]
     'fs_random_quick_restart':      59 rows, 227 columns, 204 entries with magnitude in [8.951436e-02, 1.000000e+00]
              'lb_tree_search':    416 rows, 238 columns, 1413 entries with magnitude in [1.162896e-02, 1.000000e+00]
                      'max_lp':    548 rows, 238 columns, 2168 entries with magnitude in [2.803414e-04, 1.000000e+00]
         'objective_lb_search':    435 rows, 227 columns, 1726 entries with magnitude in [3.700578e-03, 1.000000e+00]
  'objective_lb_search_max_lp':    673 rows, 238 columns, 2561 entries with magnitude in [1.346478e-03, 1.000000e+00]
                     'probing':    436 rows, 227 columns, 2613 entries with magnitude in [5.706188e-04, 1.000000e+00]
              'probing_max_lp':  1310 rows, 238 columns, 12569 entries with magnitude in [3.012422e-03, 1.000000e+00]
                'pseudo_costs':    623 rows, 238 columns, 2244 entries with magnitude in [9.369175e-04, 1.000000e+00]
               'quick_restart':    644 rows, 227 columns, 2407 entries with magnitude in [1.890917e-03, 1.000000e+00]
               'reduced_costs':    506 rows, 238 columns, 1892 entries with magnitude in [1.914598e-03, 1.000000e+00]

Lp debug                         CutPropag  CutEqPropag  Adjust  Overflow        Bad  BadScaling
                  'default_lp':         25            2   5'242         0     75'387           0
                       'fixed':          0            0   4'144         0      2'592           0
                   'fs_random':          0            0       0         0          0           0
                   'fs_random':          0            0       0         0          0           0
     'fs_random_quick_restart':          0            0       0         0          0           0
     'fs_random_quick_restart':          0            0       0         0          0           0
              'lb_tree_search':          1            0   9'509         0     25'882           0
                      'max_lp':          4            0   4'723         0     54'889           0
         'objective_lb_search':         14            0   3'869         0     74'443           0
  'objective_lb_search_max_lp':          3            0   4'245         0     64'394           0
                     'probing':         21            7   1'378         0  1'447'097           0
              'probing_max_lp':          3           27     493         0    583'705           0
                'pseudo_costs':          7            0   4'002         0     66'287           0
               'quick_restart':         32            0   4'802         0    219'300           0
               'reduced_costs':          2            1   4'380         0     46'977           0

Lp pool                          Constraints  Updates  Simplif  Merged  Shortened  Split  Strenghtened     Cuts/Call
                  'default_lp':        5'924      474   14'105      91      4'522  2'105         5'634  5'716/17'265
                       'fixed':        1'733       16       23       0          0     36           152   1'434/4'387
                   'fs_random':          349        0        0       0          0      0            39         50/50
                   'fs_random':          349        0        0       0          0      0            39         50/50
     'fs_random_quick_restart':          349        0        0       0          0      0            39         50/50
     'fs_random_quick_restart':          349        0        0       0          0      0            39         50/50
              'lb_tree_search':        6'936      227   12'665      26        398    166        25'588  3'448/12'205
                      'max_lp':        9'110      410   27'203      34      1'287  1'041        40'151  5'630/14'898
         'objective_lb_search':        4'367      443    6'957      34        568  2'183         2'734  4'102/13'082
  'objective_lb_search_max_lp':        7'943      413   27'395      14      1'316    981        43'489  4'443/10'868
                     'probing':        3'685      414   13'760       7        776  5'647         1'921   3'393/6'536
              'probing_max_lp':       10'806    1'342    8'272      10      1'856  1'771        16'483  7'302/18'136
                'pseudo_costs':        9'718      353   23'650      30        837  1'470        36'525  6'234/16'329
               'quick_restart':        5'084      877   39'871      32      4'136  9'217         8'037  4'817/12'640
               'reduced_costs':        9'299      268   16'440      67        332    881        28'357  5'852/14'126

Lp Cut                                                fs_ran  fs_ran  fs_ran  fs_ran  defaul  fixed  max_lp  quick_  reduce  pseudo  lb_tre  probin  object  probin  object
                                              CG_FF:       -       -       -       -     273    109     355     146     445     373     184     122     131     126     194
                                               CG_K:       -       -       -       -     131     70     251      61     215     178     120      45      64     101      57
                                               CG_R:       -       -       -       -     209     56     202      66     155     179      74      64     107      78      52
                                              CG_RB:       -       -       -       -     708    250     565     436     914     714     466     484     433     263     370
                                             CG_RBP:       -       -       -       -      96     17      56      35      53      51      28      22      37      17      34
                                             Clique:       -       -       -       -       -      -      68       -      58      57      58       -       -      61      67
                                                 IB:      50      50      50      50     814    354     538     715     693     671     527     528     725     233     629
                                           MIR_1_FF:       -       -       -       -     322     83     327     281     308     330     217     189     255     321     291
                                            MIR_1_K:       -       -       -       -      32      9      54      16      31      56      21      10      30      36      31
                                           MIR_1_KL:       -       -       -       -       4      -       2       5       3       4       -       -       2       -       -
                                            MIR_1_R:       -       -       -       -      56     16      30      31      39      33      13      23      34      21      14
                                           MIR_1_RB:       -       -       -       -     508     99     622     490     593     732     419     333     364     624     546
                                          MIR_1_RBP:       -       -       -       -      41     17     120      31     130     146     107      23      32      82     118
                                           MIR_2_FF:       -       -       -       -     187     35     163     164     130     183      61     104     146     106     114
                                            MIR_2_K:       -       -       -       -      38     14      28      26      16      33      10      14      13      13      19
                                           MIR_2_KL:       -       -       -       -       2      -       -       3       3       2       -       -       -       -       -
                                            MIR_2_R:       -       -       -       -      57     15      23      51      36      39       9      39      40      14      14
                                           MIR_2_RB:       -       -       -       -     331     53     306     368     256     343     155     190     238     220     210
                                          MIR_2_RBP:       -       -       -       -      44      6      36      22      42      39      27      19      31      11      39
                                           MIR_3_FF:       -       -       -       -     126     19     123     125     111     148      67      54      83      95      86
                                            MIR_3_K:       -       -       -       -      26      5      32      17      27      42      20       3      14      23      24
                                           MIR_3_KL:       -       -       -       -       1      1       1       2       4       2       -       1       1       -       -
                                            MIR_3_R:       -       -       -       -      50      6      32      56      33      39      10      29      48      29      29
                                           MIR_3_RB:       -       -       -       -     203     27     208     220     187     204     102      91     143     155     148
                                          MIR_3_RBP:       -       -       -       -      21      3      23      15      29      23      18       9      24       7      25
                                           MIR_4_FF:       -       -       -       -      75     15      87      93      68     114      50      33      72      81      94
                                            MIR_4_K:       -       -       -       -      19      4      18      15      16      21       8      10      10      18       6
                                           MIR_4_KL:       -       -       -       -       4      -       3       3       6       6       -       1       1       1       1
                                            MIR_4_R:       -       -       -       -      39      6      28      32      27      34      18      13      41      33      39
                                           MIR_4_RB:       -       -       -       -     163     13     140     136      98     134      52      46     109     114     101
                                          MIR_4_RBP:       -       -       -       -      18      1      12      15      18      20       6       6      20      11      15
                                           MIR_5_FF:       -       -       -       -      63      5      61      62      40      44      24      19      55      63      44
                                            MIR_5_K:       -       -       -       -      20      -       9       8      13      16       4       5      12       8      10
                                           MIR_5_KL:       -       -       -       -       4      -       2       3       5       5       2       2       1       -       1
                                            MIR_5_R:       -       -       -       -      35      2      17      21      14      13       7      15      23      15      11
                                           MIR_5_RB:       -       -       -       -     109     15      66      93      71      76      37      43      71      80      61
                                          MIR_5_RBP:       -       -       -       -      17      2       9       4      11      14       3       5       9       8      13
                                           MIR_6_FF:       -       -       -       -      35      3      30      23      29      33      20       8      25      49      22
                                            MIR_6_K:       -       -       -       -      17      1       8       7       5       8       4       2       5       7       8
                                           MIR_6_KL:       -       -       -       -       2      -       1       -       1       5       1       -       -       -       -
                                            MIR_6_R:       -       -       -       -      21      -       7      18       5       8       1       5      11       8       4
                                           MIR_6_RB:       -       -       -       -      72      8      36      56      40      47      28      32      37      34      26
                                          MIR_6_RBP:       -       -       -       -       9      1       4       6       4       5       3       -      12       3       5
         NoOverlapCompletionTimeExhaustive_weighted:       -       -       -       -       -      -       9       -      14      12       3       -       -       4       7
  NoOverlapCompletionTimeExhaustive_weighted_lifted:       -       -       -       -       -      -      11       -      16      14       3       -       -       3      12
                        NoOverlapDisjunctionOnStart:       -       -       -       -       -      -       8       -       8       8       6       -       -       5       7
                                       ZERO_HALF_FF:       -       -       -       -      80     21     120      54      93      75      54      31      52      52      45
                                        ZERO_HALF_K:       -       -       -       -      11      4      35       5      23      29      11       2      11      16       6
                                        ZERO_HALF_R:       -       -       -       -     427     38     519     522     468     616     248     620     398   3'795     590
                                       ZERO_HALF_RB:       -       -       -       -     159     27     201     199     212     232     131      77     111     244     187
                                      ZERO_HALF_RBP:       -       -       -       -      37      4      24      60      36      24      11      22      21      14      17

LNS stats                        Improv/Calls  Closed  Difficulty  TimeLimit
               'graph_arc_lns':          3/60     57%        0.98       0.10
               'graph_cst_lns':          0/56     61%        0.99       0.10
               'graph_dec_lns':          2/60     58%        0.99       0.10
               'graph_var_lns':          3/59     59%        0.99       0.10
                   'rins/rens':         10/58     52%        0.87       0.10
                 'rnd_cst_lns':          1/56     57%        0.98       0.10
                 'rnd_var_lns':          4/60     58%        0.99       0.10
    'scheduling_intervals_lns':          5/60     48%        0.10       0.10
  'scheduling_precedences_lns':          5/60     47%        0.08       0.10
  'scheduling_time_window_lns':          5/60     92%        1.00       0.10

LS stats                   Batches  Restarts  LinMoves  GenMoves  CompoundMoves  WeightUpdates
       'fj_long_default':        1         1     9'743         0              0            257
   'fj_long_lin_default':        1         1         0     1'709            339              0
        'fj_long_random':        1         1     9'775         0              0            225
      'fj_short_default':        1         1         0     1'783            318              0
  'fj_short_lin_default':        1         1         0     1'697            274              0
   'fj_short_lin_random':        1         1         0     1'847            278              0
       'fj_short_random':        1         1         0     1'659            335              0
          'violation_ls':       61         0     7'090   302'490          8'660          1'797
          'violation_ls':       61         0     9'481   182'942         17'909            763

Solutions (39)                   Num     Rank
               'graph_arc_lns':    1  [16,16]
               'graph_var_lns':    1  [24,24]
                       'no_lp':   10   [2,26]
         'quick_restart_no_lp':   18   [1,39]
                 'rins_lp_lns':    1  [32,32]
                 'rnd_var_lns':    2   [9,15]
  'scheduling_time_window_lns':    1  [33,33]
                'violation_ls':    5   [7,22]

Objective bounds                     Num
                       'bool_core':   25
                      'default_lp':    2
                  'initial_domain':    1
             'objective_lb_search':    2
      'objective_lb_search_max_lp':    1
       'objective_lb_search_no_lp':   51
  'objective_shaving_search_no_lp':    1

Solution repositories    Added  Queried  Ignored  Synchro
  'feasible solutions':    599    1'370        0      544
        'lp solutions':    227       27        0      194
                'pump':  1'239       34

Improving bounds shared    Num
                  'core':    1
            'default_lp':   62
        'lb_tree_search':    3
                'max_lp':   12
                 'no_lp':  533
   'objective_lb_search':   11
               'probing':  373
        'probing_max_lp':   10
          'pseudo_costs':   38
         'quick_restart':  167
   'quick_restart_no_lp':  843
         'reduced_costs':    8

Clauses shared                   Num
                        'core':    1
                  'default_lp':   12
              'lb_tree_search':    5
                      'max_lp':   21
                       'no_lp':   55
         'objective_lb_search':    3
  'objective_lb_search_max_lp':    7
   'objective_lb_search_no_lp':   20
                'pseudo_costs':    9
               'quick_restart':    2
         'quick_restart_no_lp':   17
               'reduced_costs':    6

CpSolverResponse summary:
status: OPTIMAL
objective: 1323
best_bound: 1323
integers: 235
booleans: 79
conflicts: 0
branches: 158
propagations: 0
integer_propagations: 2927
restarts: 158
lp_iterations: 55
walltime: 14.7998
usertime: 14.7998
deterministic_time: 142.777
gap_integral: 645.158
solution_fingerprint: 0x7efd3b10e51b84a6


--- Simulation Gantt  partir du modle mathmatique ---
