created virtual environment CPython3.12.4.final.0-64 in 608ms
  creator CPython3Posix(dest=/localscratch/aneumann.47038294.0/env, clear=False, no_vcs_ignore=False, global=False)
  seeder FromAppData(download=False, pip=bundle, via=copy, app_data_dir=/home/aneumann/.local/share/virtualenv)
    added seed packages: pip==24.2+computecanada
  activators BashActivator,CShellActivator,FishActivator,NushellActivator,PowerShellActivator,PythonActivator
Looking in links: /cvmfs/soft.computecanada.ca/custom/python/wheelhouse/gentoo2023/x86-64-v3, /cvmfs/soft.computecanada.ca/custom/python/wheelhouse/gentoo2023/generic, /cvmfs/soft.computecanada.ca/custom/python/wheelhouse/generic
Requirement already satisfied: pip in /localscratch/aneumann.47038294.0/env/lib/python3.12/site-packages (24.2+computecanada)
Processing /cvmfs/soft.computecanada.ca/custom/python/wheelhouse/generic/pip-25.0+computecanada-py3-none-any.whl
Installing collected packages: pip
  Attempting uninstall: pip
    Found existing installation: pip 24.2+computecanada
    Uninstalling pip-24.2+computecanada:
      Successfully uninstalled pip-24.2+computecanada
Successfully installed pip-25.0+computecanada
Looking in links: /cvmfs/soft.computecanada.ca/custom/python/wheelhouse/gentoo2023/x86-64-v3, /cvmfs/soft.computecanada.ca/custom/python/wheelhouse/gentoo2023/generic, /cvmfs/soft.computecanada.ca/custom/python/wheelhouse/generic
ERROR: protobuf-5.28.3-cp38-abi3-manylinux2014_x86_64.whl is not a supported wheel on this platform.
Looking in links: /cvmfs/soft.computecanada.ca/custom/python/wheelhouse/gentoo2023/x86-64-v3, /cvmfs/soft.computecanada.ca/custom/python/wheelhouse/gentoo2023/generic, /cvmfs/soft.computecanada.ca/custom/python/wheelhouse/generic
Processing /home/aneumann/projects/def-adhaj/aneumann/GNRS/wheels/immutabledict-4.2.0-py3-none-any.whl
Installing collected packages: immutabledict
Successfully installed immutabledict-4.2.0
Looking in links: /cvmfs/soft.computecanada.ca/custom/python/wheelhouse/gentoo2023/x86-64-v3, /cvmfs/soft.computecanada.ca/custom/python/wheelhouse/gentoo2023/generic, /cvmfs/soft.computecanada.ca/custom/python/wheelhouse/generic
Processing /cvmfs/soft.computecanada.ca/custom/python/wheelhouse/generic/ortools-9.10.4067+computecanada-cp312-cp312-linux_x86_64.whl (from -r /home/aneumann/projects/def-adhaj/aneumann/GNRS/requirements/or.txt (line 1))
Processing /cvmfs/soft.computecanada.ca/custom/python/wheelhouse/gentoo2023/x86-64-v3/matplotlib-3.10.0+computecanada-cp312-cp312-linux_x86_64.whl (from -r /home/aneumann/projects/def-adhaj/aneumann/GNRS/requirements/or.txt (line 2))
Processing /cvmfs/soft.computecanada.ca/custom/python/wheelhouse/gentoo2023/x86-64-v3/pandas-2.2.3+computecanada-cp312-cp312-linux_x86_64.whl (from -r /home/aneumann/projects/def-adhaj/aneumann/GNRS/requirements/or.txt (line 3))
Processing /cvmfs/soft.computecanada.ca/custom/python/wheelhouse/generic/absl_py-2.3.0+computecanada-py3-none-any.whl (from ortools<9.11,>=9.10->-r /home/aneumann/projects/def-adhaj/aneumann/GNRS/requirements/or.txt (line 1))
Processing /cvmfs/soft.computecanada.ca/custom/python/wheelhouse/gentoo2023/generic/numpy-2.2.2+computecanada-cp312-cp312-linux_x86_64.whl (from ortools<9.11,>=9.10->-r /home/aneumann/projects/def-adhaj/aneumann/GNRS/requirements/or.txt (line 1))
Processing /cvmfs/soft.computecanada.ca/custom/python/wheelhouse/gentoo2023/x86-64-v3/protobuf-6.31.1+computecanada-cp312-cp312-linux_x86_64.whl (from ortools<9.11,>=9.10->-r /home/aneumann/projects/def-adhaj/aneumann/GNRS/requirements/or.txt (line 1))
Requirement already satisfied: immutabledict>=3.0.0 in /localscratch/aneumann.47038294.0/env/lib/python3.12/site-packages (from ortools<9.11,>=9.10->-r /home/aneumann/projects/def-adhaj/aneumann/GNRS/requirements/or.txt (line 1)) (4.2.0)
Processing /cvmfs/soft.computecanada.ca/custom/python/wheelhouse/gentoo2023/generic/contourpy-1.3.1+computecanada-cp312-cp312-linux_x86_64.whl (from matplotlib->-r /home/aneumann/projects/def-adhaj/aneumann/GNRS/requirements/or.txt (line 2))
Processing /cvmfs/soft.computecanada.ca/custom/python/wheelhouse/generic/cycler-0.12.1+computecanada-py3-none-any.whl (from matplotlib->-r /home/aneumann/projects/def-adhaj/aneumann/GNRS/requirements/or.txt (line 2))
Processing /cvmfs/soft.computecanada.ca/custom/python/wheelhouse/generic/fonttools-4.59.0+computecanada-cp312-cp312-linux_x86_64.whl (from matplotlib->-r /home/aneumann/projects/def-adhaj/aneumann/GNRS/requirements/or.txt (line 2))
Processing /cvmfs/soft.computecanada.ca/custom/python/wheelhouse/gentoo2023/x86-64-v3/kiwisolver-1.4.8+computecanada-cp312-cp312-linux_x86_64.whl (from matplotlib->-r /home/aneumann/projects/def-adhaj/aneumann/GNRS/requirements/or.txt (line 2))
Processing /cvmfs/soft.computecanada.ca/custom/python/wheelhouse/generic/packaging-25.0+computecanada-py3-none-any.whl (from matplotlib->-r /home/aneumann/projects/def-adhaj/aneumann/GNRS/requirements/or.txt (line 2))
Processing /cvmfs/soft.computecanada.ca/custom/python/wheelhouse/gentoo2023/x86-64-v3/pillow-11.1.0+computecanada-cp312-cp312-linux_x86_64.whl (from matplotlib->-r /home/aneumann/projects/def-adhaj/aneumann/GNRS/requirements/or.txt (line 2))
Processing /cvmfs/soft.computecanada.ca/custom/python/wheelhouse/generic/pyparsing-3.2.3+computecanada-py3-none-any.whl (from matplotlib->-r /home/aneumann/projects/def-adhaj/aneumann/GNRS/requirements/or.txt (line 2))
Processing /cvmfs/soft.computecanada.ca/custom/python/wheelhouse/generic/python_dateutil-2.9.0.post0+computecanada-py2.py3-none-any.whl (from matplotlib->-r /home/aneumann/projects/def-adhaj/aneumann/GNRS/requirements/or.txt (line 2))
Processing /cvmfs/soft.computecanada.ca/custom/python/wheelhouse/generic/pytz-2025.2+computecanada-py2.py3-none-any.whl (from pandas->-r /home/aneumann/projects/def-adhaj/aneumann/GNRS/requirements/or.txt (line 3))
Processing /cvmfs/soft.computecanada.ca/custom/python/wheelhouse/generic/tzdata-2025.2+computecanada-py2.py3-none-any.whl (from pandas->-r /home/aneumann/projects/def-adhaj/aneumann/GNRS/requirements/or.txt (line 3))
Processing /cvmfs/soft.computecanada.ca/custom/python/wheelhouse/generic/six-1.17.0+computecanada-py2.py3-none-any.whl (from python-dateutil>=2.7->matplotlib->-r /home/aneumann/projects/def-adhaj/aneumann/GNRS/requirements/or.txt (line 2))
Installing collected packages: pytz, tzdata, six, pyparsing, protobuf, pillow, packaging, numpy, kiwisolver, fonttools, cycler, absl-py, python-dateutil, contourpy, pandas, matplotlib, ortools
Successfully installed absl-py-2.3.0+computecanada contourpy-1.3.1+computecanada cycler-0.12.1+computecanada fonttools-4.59.0+computecanada kiwisolver-1.4.8+computecanada matplotlib-3.10.0+computecanada numpy-2.2.2+computecanada ortools-9.10.4067+computecanada packaging-25.0+computecanada pandas-2.2.3+computecanada pillow-11.1.0+computecanada protobuf-6.31.1+computecanada pyparsing-3.2.3+computecanada python-dateutil-2.9.0.post0+computecanada pytz-2025.2+computecanada six-1.17.0+computecanada tzdata-2025.2+computecanada

Starting CP-SAT solver v9.10.4067
Parameters: max_time_in_seconds: 86400 max_memory_in_mb: 185000 log_search_progress: true enumerate_all_solutions: false num_search_workers: 32 absolute_gap_limit: 0 relative_gap_limit: 0

Initial optimization model '': (model_fingerprint: 0x9cd91bd1e91a682b)
#Variables: 1'283 (#ints: 20 in objective)
  - 1'071 Booleans in [0,1]
  - 212 in [0,1402]
#kLinear1: 106
#kLinear2: 2'746
#kLinear3: 1'103
#kLinearN: 66'627 (#terms: 2'019'880)

Starting presolve at 0.04s
  9.25e-02s  0.00e+00d  [DetectDominanceRelations] 
  1.51e+00s  0.00e+00d  [PresolveToFixPoint] #num_loops=8 #num_dual_strengthening=3 
  8.99e-04s  0.00e+00d  [ExtractEncodingFromLinear] #potential_supersets=9 
[Symmetry] Graph for symmetry has 69'821 nodes and 1'782'361 arcs.
[Symmetry] Symmetry computation done. time: 0.0683865 dtime: 0.120369
[Symmetry] #generators: 1, average support size: 56
[Symmetry] The model contains 1316 duplicate constraints !
[Symmetry] 28 orbits with sizes: 2,2,2,2,2,2,2,2,2,2,...
[Symmetry] Num fixable by intersecting at_most_one with orbits: 1 largest_orbit: 2
  7.57e-01s  1.81e-01d  [Probe] #probed=1'818 #new_bounds=21 #equiv=1 
  6.41e-04s  0.00e+00d  [MaxClique] Merged 10(20 literals) into 8(16 literals) at_most_ones. 
  9.18e-02s  0.00e+00d  [DetectDominanceRelations] 
  7.31e-01s  0.00e+00d  [PresolveToFixPoint] #num_loops=5 #num_dual_strengthening=3 
  3.68e-01s  0.00e+00d  [ProcessAtMostOneAndLinear] 
  8.74e-02s  0.00e+00d  [DetectDuplicateConstraints] #duplicates=1'802 #without_enforcements=240 
  2.55e-01s  1.91e-02d  [DetectDominatedLinearConstraints] #relevant_constraints=63'458 #num_inclusions=29'555 
  9.41e-03s  0.00e+00d  [DetectDifferentVariables] #different=152 #cliques=1 #size=16 
  3.62e-02s  3.17e-03d  [ProcessSetPPC] #relevant_constraints=62'146 
  1.17e-03s  0.00e+00d  [FindAlmostIdenticalLinearConstraints] 
  7.02e-03s  9.30e-03d  [FindBigAtMostOneAndLinearOverlap] 
  6.73e-01s  3.41e-01d  [FindBigVerticalLinearOverlap] #blocks=628 #saved_nz=377'908 
  1.74e-02s  6.61e-03d  [FindBigHorizontalLinearOverlap] #linears=60'780 
  6.88e-04s  0.00e+00d  [MergeClauses] 
  9.97e-02s  0.00e+00d  [DetectDominanceRelations] 
  8.16e-01s  0.00e+00d  [PresolveToFixPoint] #num_loops=3 #num_dual_strengthening=1 
  9.97e-02s  0.00e+00d  [DetectDominanceRelations] 
  4.95e-01s  0.00e+00d  [PresolveToFixPoint] #num_loops=1 #num_dual_strengthening=1 
[Symmetry] Graph for symmetry has 69'827 nodes and 1'398'617 arcs.
[Symmetry] Symmetry computation done. time: 0.0349785 dtime: 0.0698708
  6.62e-01s  1.41e-01d  [Probe] #probed=1'822 #new_bounds=399 #new_binary_clauses=1 
  5.82e-04s  0.00e+00d  [MaxClique] 
  9.94e-02s  0.00e+00d  [DetectDominanceRelations] 
  7.19e-01s  0.00e+00d  [PresolveToFixPoint] #num_loops=2 #num_dual_strengthening=1 
  3.47e-01s  0.00e+00d  [ProcessAtMostOneAndLinear] 
  7.98e-02s  0.00e+00d  [DetectDuplicateConstraints] #without_enforcements=240 
  1.80e-01s  1.36e-02d  [DetectDominatedLinearConstraints] #relevant_constraints=63'530 #num_inclusions=5'508 
  8.89e-03s  0.00e+00d  [DetectDifferentVariables] 
  3.22e-02s  2.40e-03d  [ProcessSetPPC] #relevant_constraints=60'816 
  1.23e-03s  4.24e-06d  [FindAlmostIdenticalLinearConstraints] #num_tested_pairs=261 
  3.19e-03s  3.17e-03d  [FindBigAtMostOneAndLinearOverlap] 
  5.89e-01s  2.39e-01d  [FindBigVerticalLinearOverlap] #blocks=2'741 #saved_nz=385'256 
  1.49e-02s  4.47e-03d  [FindBigHorizontalLinearOverlap] #linears=50'517 
  7.13e-04s  0.00e+00d  [MergeClauses] 
  7.40e-02s  0.00e+00d  [DetectDominanceRelations] 
  7.53e-01s  0.00e+00d  [PresolveToFixPoint] #num_loops=3 #num_dual_strengthening=1 
  7.44e-02s  0.00e+00d  [DetectDominanceRelations] 
  4.80e-01s  0.00e+00d  [PresolveToFixPoint] #num_loops=1 #num_dual_strengthening=1 
[Symmetry] Graph for symmetry has 77'275 nodes and 1'015'552 arcs.
[Symmetry] Symmetry computation done. time: 0.0277707 dtime: 0.0507782
  5.72e-01s  1.07e-01d  [Probe] #probed=1'822 #new_bounds=1'811 #new_binary_clauses=1 
  6.09e-04s  0.00e+00d  [MaxClique] 
  7.36e-02s  0.00e+00d  [DetectDominanceRelations] 
  7.19e-01s  0.00e+00d  [PresolveToFixPoint] #num_loops=2 #num_dual_strengthening=1 
  3.22e-01s  0.00e+00d  [ProcessAtMostOneAndLinear] 
  7.20e-02s  0.00e+00d  [DetectDuplicateConstraints] #without_enforcements=240 
  1.21e-01s  8.74e-03d  [DetectDominatedLinearConstraints] #relevant_constraints=64'935 #num_inclusions=181 
  8.57e-03s  0.00e+00d  [DetectDifferentVariables] 
  2.53e-02s  1.59e-03d  [ProcessSetPPC] #relevant_constraints=50'694 
  1.97e-03s  1.72e-04d  [FindAlmostIdenticalLinearConstraints] #num_tested_pairs=10'351 
  2.92e-03s  2.23e-03d  [FindBigAtMostOneAndLinearOverlap] 
  3.78e-01s  1.41e-01d  [FindBigVerticalLinearOverlap] #blocks=2'582 #saved_nz=277'330 
  1.12e-02s  2.85e-03d  [FindBigHorizontalLinearOverlap] #linears=37'808 
  7.16e-04s  0.00e+00d  [MergeClauses] 
  5.75e-02s  0.00e+00d  [DetectDominanceRelations] 
  7.13e-01s  0.00e+00d  [PresolveToFixPoint] #num_loops=3 #num_dual_strengthening=1 
  4.20e-03s  0.00e+00d  [ExpandObjective] #entries=24'439 #tight_variables=9'177 #tight_constraints=4'863 

Presolve summary:
  - 430 affine relations were detected.
  - rule 'TODO dual: only one blocking constraint?' was applied 2'952 times.
  - rule 'TODO dual: only one blocking enforced constraint?' was applied 260 times.
  - rule 'TODO dual: only one unspecified blocking constraint?' was applied 163 times.
  - rule 'TODO duplicate: identical constraint with different enforcements' was applied 720 times.
  - rule 'TODO linear2: contains a Boolean.' was applied 36 times.
  - rule 'affine: new relation' was applied 430 times.
  - rule 'at_most_one: removed literals' was applied 8 times.
  - rule 'at_most_one: size one' was applied 8 times.
  - rule 'at_most_one: transformed into max clique.' was applied 1 time.
  - rule 'deductions: 4215 stored' was applied 1 time.
  - rule 'dual: fix variable' was applied 57 times.
  - rule 'dual: reduced domain' was applied 135 times.
  - rule 'duplicate: merged rhs of linear constraint' was applied 438 times.
  - rule 'duplicate: removed constraint' was applied 1'802 times.
  - rule 'enforcement: false literal' was applied 20 times.
  - rule 'exactly_one: x and not(x)' was applied 1 time.
  - rule 'incompatible linear: add implication' was applied 360 times.
  - rule 'linear matrix: common vertical rectangle' was applied 5'951 times.
  - rule 'linear: always true' was applied 3'445 times.
  - rule 'linear: doubleton free' was applied 29 times.
  - rule 'linear: empty' was applied 78 times.
  - rule 'linear: extracted enforcement literal' was applied 65'198 times.
  - rule 'linear: fixed or dup variables' was applied 67'749 times.
  - rule 'linear: positive equal one' was applied 9 times.
  - rule 'linear: reduced variable domains' was applied 5'093 times.
  - rule 'linear: remapped using affine relations' was applied 67'734 times.
  - rule 'linear: simplified rhs' was applied 233'108 times.
  - rule 'linear: tightened into equality' was applied 10 times.
  - rule 'linear: variable substitution 1' was applied 29 times.
  - rule 'linear: variable substitution 2' was applied 587 times.
  - rule 'linear: variable substitution 3' was applied 377 times.
  - rule 'no_overlap: inferred from x != y constraints' was applied 1 time.
  - rule 'presolve: 220 unused variables removed.' was applied 1 time.
  - rule 'presolve: iteration' was applied 3 times.
  - rule 'probing: reduced enforced constraint to implication.' was applied 10 times.
  - rule 'symmetry: fixed to false in general orbit' was applied 1 time.

Presolved optimization model '': (model_fingerprint: 0xdadf840f45a46b3d)
#Variables: 5'591 (#ints: 20 in objective)
  - 460 Booleans in [0,1]
  - 3'805 different domains in [-34934,34925] with a largest complexity of 28.
#kExactlyOne: 8 (#literals: 24)
#kInterval: 16
#kLinear1: 2 (#enforced: 2 #multi: 1)
#kLinear2: 4'209 (#enforced: 4'084 #multi: 1'158)
#kLinear3: 20'630 (#enforced: 16'822)
#kLinearN: 44'906 (#enforced: 42'043) (#terms: 598'525)
#kNoOverlap: 1 (#intervals: 16)

Preloading model.
#Bound  13.21s best:inf   next:[183,24820] initial_domain
[Symmetry] Graph for symmetry has 82'310 nodes and 740'042 arcs.
[Symmetry] Symmetry computation done. time: 0.0214909 dtime: 0.038036
#Model  13.35s var:5591/5591 constraints:69772/69772

Starting search at 13.39s with 32 workers.
17 full problem subsolvers: [core, default_lp, fixed, lb_tree_search, max_lp, no_lp, objective_lb_search, objective_lb_search_max_lp, objective_lb_search_no_lp, objective_shaving_search_max_lp, objective_shaving_search_no_lp, probing, probing_max_lp, pseudo_costs, quick_restart, quick_restart_no_lp, reduced_costs]
13 first solution subsolvers: [fj_long_default, fj_long_lin_default, fj_long_random, fj_short_default, fj_short_lin_default, fj_short_lin_random, fj_short_random, fs_random(2), fs_random_no_lp, fs_random_quick_restart(2), fs_random_quick_restart_no_lp]
13 incomplete subsolvers: [feasibility_pump, graph_arc_lns, graph_cst_lns, graph_dec_lns, graph_var_lns, rins/rens, rnd_cst_lns, rnd_var_lns, scheduling_intervals_lns, scheduling_precedences_lns, scheduling_time_window_lns, violation_ls(2)]
3 helper subsolvers: [neighborhood_helper, synchronization_agent, update_gap_integral]
#Bound  15.20s best:inf   next:[254,24820] objective_lb_search_no_lp (initial_propagation)
#Bound  15.26s best:inf   next:[271,24820] objective_lb_search_no_lp
#Bound  15.74s best:inf   next:[296,24820] objective_lb_search_no_lp
#Bound  15.74s best:inf   next:[409,24820] objective_lb_search_no_lp
#Bound  15.75s best:inf   next:[413,24820] objective_lb_search_no_lp
#1      18.02s best:9347  next:[413,9346] fs_random_quick_restart_no_lp (fixed_bools=0/556)
#Bound  18.44s best:9347  next:[1339,9346] pseudo_costs
#Bound  18.52s best:9347  next:[1623,9346] pseudo_costs
#Bound  18.96s best:9347  next:[1798,9346] pseudo_costs
#Bound  19.06s best:9347  next:[1898,9346] pseudo_costs
#2      19.92s best:7860  next:[1898,7859] no_lp (fixed_bools=0/601)
#3      21.08s best:7855  next:[1898,7854] graph_arc_lns (d=0.88 s=130 t=0.10 p=1.00 stall=3 h=auto_l0) [hint]
#4      21.14s best:7835  next:[1898,7834] no_lp (fixed_bools=0/606)
#5      22.42s best:7825  next:[1898,7824] graph_arc_lns (d=0.91 s=142 t=0.10 p=1.00 stall=0 h=auto_l0)
#Bound  22.54s best:7825  next:[1899,7824] probing_max_lp
#6      23.48s best:7810  next:[1899,7809] quick_restart_no_lp (fixed_bools=0/642)
#7      25.10s best:7809  next:[1899,7808] violation_ls(batch:6 #solutions_imported:3 #lin_moves:1 #lin_evals:82'406 #gen_moves:30'923 #gen_evals:5'216 #comp_moves:7'902 #backtracks:11'504 #weight_updates:208)
#8      25.66s best:7795  next:[1899,7794] rnd_var_lns (d=0.94 s=153 t=0.10 p=1.00 stall=5 h=auto_l0) [hint]
#Bound  25.69s best:7795  next:[1902,7794] probing_max_lp
#9      26.87s best:7790  next:[1902,7789] graph_arc_lns (d=0.94 s=156 t=0.10 p=1.00 stall=0 h=auto_l0) [hint]
#10     27.09s best:7789  next:[1902,7788] violation_ls(batch:7 #solutions_imported:4 #lin_moves:49'240 #lin_evals:244'188 #weight_updates:1'152)
#11     27.25s best:7640  next:[1902,7639] rins_lp_lns (d=0.91 s=165 t=0.10 p=1.00 stall=4 h=auto_l0)
#Bound  29.04s best:7640  next:[1903,7639] probing_max_lp
#12     29.62s best:7638  next:[1903,7637] quick_restart_no_lp (fixed_bools=0/730)
#13     30.57s best:7637  next:[1903,7636] violation_ls(batch:9 #solutions_imported:6 #lin_moves:61'600 #lin_evals:307'527 #weight_updates:1'707)
#14     32.00s best:7636  next:[1903,7635] rnd_var_lns (d=0.98 s=195 t=0.10 p=1.00 stall=2 h=auto_l0) [hint]
#15     32.63s best:7635  next:[1903,7634] graph_var_lns (d=0.98 s=197 t=0.10 p=1.00 stall=1 h=auto_l0) [hint]
#Bound  33.40s best:7635  next:[1904,7634] max_lp
#16     33.72s best:7634  next:[1904,7633] violation_ls(batch:10 #solutions_imported:7 #lin_moves:17'410 #lin_evals:163'990 #gen_moves:38'088 #gen_evals:6'366 #comp_moves:8'385 #backtracks:14'844 #weight_updates:902)
#17     33.95s best:7633  next:[1904,7632] violation_ls(batch:10 #solutions_imported:7 #lin_moves:61'600 #lin_evals:319'328 #gen_moves:4'297 #gen_evals:444 #comp_moves:441 #backtracks:1'928 #weight_updates:1'783)
#Bound  34.84s best:7633  next:[1906,7632] objective_lb_search_max_lp
#Bound  35.35s best:7633  next:[1914,7632] objective_lb_search_max_lp
#Bound  35.78s best:7633  next:[1915,7632] objective_lb_search_max_lp
#Bound  36.54s best:7633  next:[1930,7632] objective_lb_search_max_lp
#18     37.31s best:7632  next:[1930,7631] violation_ls(batch:11 #solutions_imported:8 #lin_moves:61'600 #lin_evals:328'627 #gen_moves:7'882 #gen_evals:911 #comp_moves:772 #backtracks:3'555 #weight_updates:1'844)
#19     38.25s best:7423  next:[1930,7422] rins_lp_lns (d=0.92 s=225 t=0.10 p=0.83 stall=0 h=auto_l0)
#20     41.25s best:7382  next:[1930,7381] rins_pump_lns (d=0.94 s=237 t=0.10 p=0.86 stall=0 h=auto_l0)
#Bound  43.13s best:7382  next:[1985,7381] objective_lb_search_max_lp
#21     48.41s best:7347  next:[1985,7346] graph_dec_lns (d=0.99 s=259 t=0.10 p=1.00 stall=12 h=folio_rnd)
#Bound  50.41s best:7347  next:[1989,7346] objective_lb_search_max_lp
#22     52.05s best:7346  next:[1989,7345] violation_ls(batch:15 #solutions_imported:11 #lin_moves:48'778 #lin_evals:302'094 #gen_moves:45'158 #gen_evals:7'460 #comp_moves:9'112 #backtracks:18'014 #weight_updates:5'422)
#23     52.06s best:7345  next:[1989,7344] violation_ls(batch:15 #solutions_imported:11 #lin_moves:87'057 #lin_evals:430'282 #gen_moves:7'883 #gen_evals:911 #comp_moves:773 #backtracks:3'555 #weight_updates:6'387)
#24     52.69s best:6939  next:[1989,6938] graph_dec_lns (d=0.99 s=271 t=0.10 p=1.00 stall=0 h=auto_l0)
#25     53.41s best:6908  next:[1989,6907] graph_arc_lns (d=0.99 s=269 t=0.10 p=1.00 stall=3 h=auto_l0)
#26     56.07s best:6876  next:[1989,6875] quick_restart_no_lp (fixed_bools=0/865)
#27     56.14s best:6875  next:[1989,6874] violation_ls(batch:16 #solutions_imported:12 #lin_moves:87'057 #lin_evals:430'306 #gen_moves:7'895 #gen_evals:911 #comp_moves:775 #backtracks:3'560 #weight_updates:6'387)
#28     60.04s best:6653  next:[1989,6652] graph_arc_lns (d=0.99 s=295 t=0.10 p=1.00 stall=0 h=auto_l0)
#29     60.24s best:6227  next:[1989,6226] rins_pump_lns (d=0.90 s=301 t=0.10 p=0.64 stall=0 h=auto_l0)
#30     65.79s best:6186  next:[1989,6185] graph_var_lns (d=1.00 s=306 t=0.10 p=1.00 stall=0 h=auto_l0)
#31     68.01s best:6102  next:[1989,6101] rnd_var_lns (d=1.00 s=316 t=0.10 p=1.00 stall=0 h=auto_l0)
#32     72.06s best:6093  next:[1989,6092] quick_restart_no_lp (fixed_bools=0/1047)
#33     72.71s best:6090  next:[1989,6089] quick_restart_no_lp (fixed_bools=0/1060)
#Bound  72.87s best:6090  next:[1998,6089] objective_lb_search_max_lp
#34     73.67s best:6079  next:[1998,6078] rnd_var_lns (d=1.00 s=328 t=0.10 p=0.94 stall=0 h=auto_l0)
#35     74.27s best:6074  next:[1998,6073] quick_restart_no_lp (fixed_bools=0/1163)
#36     76.43s best:6072  next:[1998,6071] violation_ls(batch:21 #solutions_imported:17 #lin_moves:48'778 #lin_evals:389'910 #gen_moves:82'694 #gen_evals:10'821 #comp_moves:12'872 #backtracks:34'894 #weight_updates:5'821)
#37     76.44s best:6070  next:[1998,6069] violation_ls(batch:21 #solutions_imported:17 #lin_moves:95'563 #lin_evals:524'240 #gen_moves:35'260 #gen_evals:3'329 #comp_moves:1'953 #backtracks:16'652 #weight_updates:8'167)
#38     78.52s best:6019  next:[1998,6018] rnd_cst_lns (d=1.00 s=342 t=0.10 p=0.94 stall=0 h=auto_l0)
#39     78.65s best:5974  next:[1998,5973] rnd_var_lns (d=1.00 s=341 t=0.10 p=0.89 stall=0 h=auto_l0)
#40     82.65s best:5958  next:[1998,5957] graph_var_lns (d=1.00 s=356 t=0.10 p=0.89 stall=0 h=auto_l0)
#41     86.60s best:5957  next:[1998,5956] violation_ls(batch:23 #solutions_imported:19 #lin_moves:50'742 #lin_evals:417'515 #gen_moves:92'122 #gen_evals:11'599 #comp_moves:13'166 #backtracks:39'460 #weight_updates:6'085)
#42     86.61s best:5956  next:[1998,5955] violation_ls(batch:23 #solutions_imported:19 #lin_moves:103'930 #lin_evals:557'734 #gen_moves:35'260 #gen_evals:3'329 #comp_moves:1'953 #backtracks:16'652 #weight_updates:9'805)
#43     87.03s best:5943  next:[1998,5942] graph_var_lns (d=0.99 s=368 t=0.10 p=0.85 stall=0 h=auto_l0)
#44     89.42s best:5927  next:[1998,5926] quick_restart_no_lp (fixed_bools=0/1293)
#45     90.62s best:5838  next:[1998,5837] graph_cst_lns (d=1.00 s=370 t=0.10 p=0.95 stall=0 h=auto_l0)
#46     96.27s best:5786  next:[1998,5785] rnd_cst_lns (d=1.00 s=391 t=0.10 p=0.86 stall=0 h=auto_l0)
#Bound  99.88s best:5786  next:[2000,5785] objective_lb_search_max_lp
#47    109.05s best:5727  next:[2000,5726] graph_dec_lns (d=1.00 s=421 t=0.10 p=0.83 stall=0 h=auto_l0)
#Bound 122.67s best:5727  next:[2002,5726] objective_lb_search_max_lp
#Bound 128.99s best:5727  next:[2004,5726] objective_lb_search_max_lp
#48    144.50s best:5725  next:[2004,5724] graph_dec_lns (d=1.00 s=521 t=0.10 p=0.76 stall=2 h=auto_l0)
#49    159.10s best:5631  next:[2004,5630] rnd_var_lns (d=1.00 s=556 t=0.10 p=0.72 stall=2 h=auto_l0)
#50    173.47s best:5624  next:[2004,5623] graph_dec_lns (d=1.00 s=597 t=0.10 p=0.71 stall=0 h=auto_l0)
#51    176.71s best:5609  next:[2004,5608] rnd_cst_lns (d=1.00 s=605 t=0.10 p=0.69 stall=0 h=auto_l0)
#Bound 182.37s best:5609  next:[2006,5608] objective_lb_search_max_lp
#52    183.09s best:5602  next:[2006,5601] graph_arc_lns (d=1.00 s=619 t=0.10 p=0.70 stall=0 h=auto_l0)
#Bound 187.03s best:5602  next:[2013,5601] objective_lb_search_max_lp
#Bound 188.48s best:5602  next:[2020,5601] objective_lb_search_max_lp
#53    193.42s best:5585  next:[2020,5584] graph_dec_lns (d=1.00 s=647 t=0.10 p=0.69 stall=1 h=auto_l0)
#Bound 213.44s best:5585  next:[2022,5584] objective_lb_search_max_lp
#54    216.59s best:5572  next:[2022,5571] graph_var_lns (d=1.00 s=721 t=0.10 p=0.65 stall=2 h=auto_l0)
#55    221.59s best:5557  next:[2022,5556] rins_lp_lns (d=0.93 s=742 t=0.10 p=0.56 stall=6 h=auto_l0)
#56    233.58s best:5506  next:[2022,5505] graph_var_lns (d=1.00 s=760 t=0.10 p=0.65 stall=0 h=auto_l0)
#57    240.99s best:5502  next:[2022,5501] rnd_var_lns (d=1.00 s=782 t=0.10 p=0.65 stall=3 h=auto_l0)
#58    250.94s best:5476  next:[2022,5475] rnd_var_lns (d=1.00 s=806 t=0.10 p=0.65 stall=0 h=auto_l0)
#59    254.03s best:5470  next:[2022,5469] quick_restart_no_lp (fixed_bools=0/2152)
#60    254.62s best:5469  next:[2022,5468] violation_ls(batch:59 #solutions_imported:33 #lin_moves:217'857 #lin_evals:1'427'207 #gen_moves:180'223 #gen_evals:22'889 #comp_moves:21'834 #backtracks:79'157 #weight_updates:43'814)
#61    254.63s best:5468  next:[2022,5467] violation_ls(batch:59 #solutions_imported:32 #lin_moves:183'581 #lin_evals:1'323'802 #gen_moves:195'552 #gen_evals:24'958 #comp_moves:24'098 #backtracks:85'676 #weight_updates:31'452)
#62    255.90s best:5458  next:[2022,5457] graph_cst_lns (d=1.00 s=823 t=0.10 p=0.64 stall=0 h=auto_l0)
#63    257.87s best:5457  next:[2022,5456] violation_ls(batch:60 #solutions_imported:34 #lin_moves:217'857 #lin_evals:1'427'418 #gen_moves:180'303 #gen_evals:22'894 #comp_moves:21'838 #backtracks:79'195 #weight_updates:43'814)
#64    257.89s best:5456  next:[2022,5455] violation_ls(batch:60 #solutions_imported:33 #lin_moves:183'581 #lin_evals:1'323'886 #gen_moves:195'588 #gen_evals:24'962 #comp_moves:24'102 #backtracks:85'692 #weight_updates:31'452)
#65    260.33s best:5431  next:[2022,5430] rnd_var_lns (d=1.00 s=831 t=0.10 p=0.65 stall=0 h=auto_l0)
#66    265.72s best:5428  next:[2022,5427] graph_cst_lns (d=1.00 s=848 t=0.10 p=0.63 stall=0 h=auto_l0)
#67    280.40s best:5410  next:[2022,5409] graph_dec_lns (d=1.00 s=886 t=0.10 p=0.65 stall=3 h=auto_l0)
#68    285.20s best:5392  next:[2022,5391] rnd_var_lns (d=1.00 s=905 t=0.10 p=0.62 stall=0 h=auto_l0)
#69    295.33s best:5379  next:[2022,5378] graph_cst_lns (d=1.00 s=922 t=0.10 p=0.63 stall=4 h=auto_l0)
#70    296.70s best:5378  next:[2022,5377] violation_ls(batch:68 #solutions_imported:39 #lin_moves:259'531 #lin_evals:1'707'984 #gen_moves:208'341 #gen_evals:25'080 #comp_moves:23'222 #backtracks:92'521 #weight_updates:44'796)
#71    296.75s best:5376  next:[2022,5375] violation_ls(batch:68 #solutions_imported:38 #lin_moves:232'246 #lin_evals:1'543'139 #gen_moves:210'490 #gen_evals:26'634 #comp_moves:26'810 #backtracks:91'784 #weight_updates:32'911)
#72    302.03s best:5367  next:[2022,5366] rnd_var_lns (d=1.00 s=942 t=0.10 p=0.62 stall=1 h=auto_l0)
#Bound 304.95s best:5367  next:[2024,5366] objective_lb_search_max_lp
#73    307.18s best:5360  next:[2024,5359] quick_restart_no_lp (fixed_bools=0/2433)
#74    309.17s best:5266  next:[2024,5265] graph_cst_lns (d=1.00 s=959 t=0.10 p=0.62 stall=1 h=auto_l0)
#75    311.47s best:5265  next:[2024,5264] violation_ls(batch:71 #solutions_imported:42 #lin_moves:276'495 #lin_evals:1'779'205 #gen_moves:210'133 #gen_evals:25'196 #comp_moves:23'306 #backtracks:93'375 #weight_updates:47'850)
#76    314.45s best:5256  next:[2024,5255] quick_restart_no_lp (fixed_bools=0/2511)
#Bound 314.95s best:5256  next:[2026,5255] objective_lb_search_max_lp
#77    315.90s best:5241  next:[2026,5240] quick_restart_no_lp (fixed_bools=0/2514)
#78    316.26s best:5239  next:[2026,5238] violation_ls(batch:72 #solutions_imported:43 #lin_moves:276'495 #lin_evals:1'779'249 #gen_moves:210'156 #gen_evals:25'196 #comp_moves:23'307 #backtracks:93'386 #weight_updates:47'850)
#79    316.30s best:5237  next:[2026,5236] violation_ls(batch:72 #solutions_imported:42 #lin_moves:242'045 #lin_evals:1'642'634 #gen_moves:228'380 #gen_evals:28'405 #comp_moves:27'962 #backtracks:100'147 #weight_updates:33'284)
#80    320.82s best:5204  next:[2026,5203] rnd_cst_lns (d=1.00 s=997 t=0.10 p=0.61 stall=0 h=auto_l0)
#81    323.87s best:5196  next:[2026,5195] graph_dec_lns (d=1.00 s=1001 t=0.10 p=0.61 stall=0 h=auto_l0)
#82    326.32s best:5128  next:[2026,5127] rnd_var_lns (d=1.00 s=1008 t=0.10 p=0.61 stall=1 h=auto_l0)
#Bound 327.73s best:5128  next:[2027,5127] objective_lb_search_max_lp
#83    332.14s best:5109  next:[2027,5108] rins_pump_lns (d=0.93 s=1032 t=0.10 p=0.54 stall=0 h=auto_l0)
#84    332.48s best:5076  next:[2027,5075] graph_arc_lns (d=1.00 s=1025 t=0.10 p=0.60 stall=1 h=auto_l0)
#Bound 335.12s best:5076  next:[2029,5075] objective_lb_search_max_lp
#85    341.40s best:5073  next:[2029,5072] graph_var_lns (d=1.00 s=1051 t=0.10 p=0.61 stall=0 h=auto_l0)
#86    343.27s best:5009  next:[2029,5008] rins_pump_lns (d=0.93 s=1059 t=0.10 p=0.54 stall=0 h=auto_l0)
#87    351.40s best:4998  next:[2029,4997] graph_cst_lns (d=1.00 s=1078 t=0.10 p=0.61 stall=0 h=auto_l0)
#Bound 354.78s best:4998  next:[2035,4997] objective_lb_search_max_lp
#Bound 405.56s best:4998  next:[2042,4997] objective_lb_search_max_lp
#Bound 429.50s best:4998  next:[2043,4997] objective_lb_search_max_lp
#Bound 497.52s best:4998  next:[2057,4997] objective_lb_search_max_lp
#88    525.41s best:4996  next:[2057,4995] graph_var_lns (d=1.00 s=1554 t=0.10 p=0.57 stall=0 h=auto_l0)
#89    527.53s best:4995  next:[2057,4994] violation_ls(batch:118 #solutions_imported:50 #lin_moves:312'620 #lin_evals:2'540'636 #gen_moves:309'219 #gen_evals:66'493 #comp_moves:31'020 #backtracks:139'022 #weight_updates:52'234)
#90    527.54s best:4994  next:[2057,4993] violation_ls(batch:118 #solutions_imported:50 #lin_moves:285'898 #lin_evals:2'462'969 #gen_moves:329'729 #gen_evals:64'860 #comp_moves:37'901 #backtracks:145'824 #weight_updates:39'798)
#91    531.27s best:4992  next:[2057,4991] graph_cst_lns (d=1.00 s=1569 t=0.10 p=0.57 stall=0 h=auto_l0)
#92    533.60s best:4991  next:[2057,4990] violation_ls(batch:119 #solutions_imported:51 #lin_moves:312'812 #lin_evals:2'541'754 #gen_moves:309'219 #gen_evals:66'493 #comp_moves:31'020 #backtracks:139'022 #weight_updates:52'415)
#93    533.61s best:4990  next:[2057,4989] violation_ls(batch:119 #solutions_imported:51 #lin_moves:285'962 #lin_evals:2'463'350 #gen_moves:329'729 #gen_evals:64'860 #comp_moves:37'901 #backtracks:145'824 #weight_updates:39'857)
#94    533.99s best:4978  next:[2057,4977] rnd_var_lns (d=1.00 s=1577 t=0.10 p=0.57 stall=0 h=auto_l0)
#95    544.74s best:4926  next:[2057,4925] graph_var_lns (d=1.00 s=1604 t=0.10 p=0.57 stall=1 h=auto_l0)
#96    563.45s best:4906  next:[2057,4905] graph_dec_lns (d=1.00 s=1656 t=0.10 p=0.57 stall=0 h=auto_l0)
#97    595.65s best:4897  next:[2057,4896] graph_var_lns (d=1.00 s=1740 t=0.10 p=0.57 stall=0 h=auto_l0)
#Bound 603.30s best:4897  next:[2060,4896] objective_lb_search_max_lp
#Bound 639.76s best:4897  next:[2064,4896] objective_lb_search_max_lp
#Bound 784.12s best:4897  next:[2066,4896] objective_lb_search_max_lp
#98    820.01s best:4860  next:[2066,4859] graph_dec_lns (d=1.00 s=2329 t=0.10 p=0.55 stall=0 h=auto_l0)
#99    826.66s best:4844  next:[2066,4843] graph_var_lns (d=1.00 s=2351 t=0.10 p=0.54 stall=1 h=auto_l0)
#100   834.17s best:4843  next:[2066,4842] quick_restart_no_lp (fixed_bools=0/3797)
#101   836.31s best:4842  next:[2066,4841] violation_ls(batch:183 #solutions_imported:58 #lin_moves:441'328 #lin_evals:4'125'349 #gen_moves:778'817 #gen_evals:98'935 #comp_moves:50'175 #backtracks:364'225 #weight_updates:66'821)
#102   836.32s best:4841  next:[2066,4840] violation_ls(batch:183 #solutions_imported:58 #lin_moves:353'515 #lin_evals:3'747'421 #gen_moves:487'491 #gen_evals:107'542 #comp_moves:62'113 #backtracks:212'575 #weight_updates:63'227)
#103   838.17s best:4834  next:[2066,4833] graph_var_lns (d=1.00 s=2376 t=0.10 p=0.54 stall=0 h=auto_l0)
#104   840.47s best:4832  next:[2066,4831] violation_ls(batch:184 #solutions_imported:59 #lin_moves:441'392 #lin_evals:4'125'721 #gen_moves:778'817 #gen_evals:98'935 #comp_moves:50'175 #backtracks:364'225 #weight_updates:66'881)
#105   840.48s best:4831  next:[2066,4830] violation_ls(batch:184 #solutions_imported:59 #lin_moves:353'637 #lin_evals:3'748'205 #gen_moves:487'491 #gen_evals:107'542 #comp_moves:62'113 #backtracks:212'575 #weight_updates:63'327)
#106   845.26s best:4824  next:[2066,4823] graph_dec_lns (d=1.00 s=2391 t=0.10 p=0.54 stall=0 h=auto_l0)
#Bound 967.84s best:4824  next:[2068,4823] objective_lb_search_max_lp
#107   968.07s best:4818  next:[2068,4817] rnd_cst_lns (d=1.00 s=2709 t=0.10 p=0.54 stall=0 h=auto_l0)
#108   969.47s best:4816  next:[2068,4815] rnd_var_lns (d=1.00 s=2708 t=0.10 p=0.55 stall=3 h=auto_l0)
#109   972.21s best:4805  next:[2068,4804] graph_arc_lns (d=1.00 s=2724 t=0.10 p=0.53 stall=0 h=auto_l0)
#110   977.15s best:4744  next:[2068,4743] rins_lp_lns (d=0.92 s=2744 t=0.10 p=0.51 stall=3 h=auto_l0)
#111   986.09s best:4695  next:[2068,4694] rins_pump_lns (d=0.92 s=2768 t=0.10 p=0.51 stall=0 h=auto_l0)
#Bound 1197.05s best:4695  next:[2071,4694] objective_lb_search_max_lp
#Bound 1276.10s best:4695  next:[2074,4694] objective_lb_search_max_lp
#112   1389.14s best:4655  next:[2074,4654] graph_dec_lns (d=1.00 s=3792 t=0.10 p=0.53 stall=0 h=auto_l0)
#113   1569.17s best:4617  next:[2074,4616] graph_cst_lns (d=1.00 s=4247 t=0.10 p=0.52 stall=0 h=auto_l0)
#114   1569.44s best:4616  next:[2074,4615] violation_ls(batch:335 #solutions_imported:66 #lin_moves:810'457 #lin_evals:7'526'370 #gen_moves:1'711'570 #gen_evals:178'876 #comp_moves:87'547 #backtracks:811'873 #weight_updates:73'198)
#115   1569.45s best:4615  next:[2074,4614] violation_ls(batch:335 #solutions_imported:66 #lin_moves:584'597 #lin_evals:6'885'052 #gen_moves:1'376'954 #gen_evals:179'835 #comp_moves:98'978 #backtracks:638'860 #weight_updates:237'288)
#116   1575.55s best:4597  next:[2074,4596] quick_restart_no_lp (fixed_bools=0/4610)
#117   1576.10s best:4596  next:[2074,4595] violation_ls(batch:336 #solutions_imported:67 #lin_moves:810'477 #lin_evals:7'526'474 #gen_moves:1'711'570 #gen_evals:178'876 #comp_moves:87'547 #backtracks:811'873 #weight_updates:73'208)
#118   1576.12s best:4595  next:[2074,4594] violation_ls(batch:336 #solutions_imported:67 #lin_moves:584'631 #lin_evals:6'885'265 #gen_moves:1'376'954 #gen_evals:179'835 #comp_moves:98'978 #backtracks:638'860 #weight_updates:237'321)
#119   1577.62s best:4579  next:[2074,4578] graph_dec_lns (d=1.00 s=4272 t=0.10 p=0.53 stall=2 h=auto_l0)
#120   1579.13s best:4545  next:[2074,4544] graph_var_lns (d=1.00 s=4269 t=0.10 p=0.53 stall=3 h=auto_l0)
#121   1600.00s best:4540  next:[2074,4539] rnd_var_lns (d=1.00 s=4329 t=0.10 p=0.53 stall=2 h=auto_l0)
#Bound 1618.93s best:4540  next:[2075,4539] objective_lb_search_max_lp
#Bound 1677.65s best:4540  next:[2076,4539] objective_lb_search_max_lp
#Bound 1983.83s best:4540  next:[2082,4539] objective_lb_search_max_lp
#Bound 2240.63s best:4540  next:[2083,4539] objective_lb_search_max_lp
#Bound 2632.85s best:4540  next:[2088,4539] objective_lb_search_max_lp
#Bound 2664.70s best:4540  next:[2093,4539] objective_lb_search_max_lp
#Bound 2704.97s best:4540  next:[2095,4539] objective_lb_search_max_lp
#Bound 2919.95s best:4540  next:[2097,4539] objective_lb_search_max_lp
#Bound 3432.07s best:4540  next:[2105,4539] objective_lb_search_max_lp
#Bound 4865.12s best:4540  next:[2106,4539] objective_lb_search_max_lp
#Bound 6954.34s best:4540  next:[2107,4539] objective_lb_search_max_lp
#Bound 7181.05s best:4540  next:[2108,4539] objective_lb_search_max_lp
#Bound 7454.14s best:4540  next:[2109,4539] objective_lb_search_max_lp
#Bound 7592.82s best:4540  next:[2111,4539] objective_lb_search_max_lp
#122   8046.05s best:4533  next:[2111,4532] rnd_var_lns (d=1.00 s=21179 t=0.10 p=0.51 stall=3 h=auto_l0)
#Bound 8662.66s best:4533  next:[2112,4532] objective_lb_search_max_lp
#Bound 8915.08s best:4533  next:[2113,4532] objective_lb_search_max_lp
#Bound 9186.67s best:4533  next:[2115,4532] objective_lb_search_max_lp
#Bound 10209.35s best:4533  next:[2116,4532] objective_lb_search_max_lp
#Bound 11456.17s best:4533  next:[2117,4532] objective_lb_search_max_lp
#Bound 12285.50s best:4533  next:[2118,4532] objective_lb_search_max_lp
#Bound 12805.57s best:4533  next:[2121,4532] objective_lb_search_max_lp
#Bound 14875.17s best:4533  next:[2123,4532] objective_lb_search_max_lp
#Bound 18241.31s best:4533  next:[2125,4532] objective_lb_search_max_lp
#Bound 20444.10s best:4533  next:[2126,4532] objective_lb_search_max_lp
#Bound 22069.28s best:4533  next:[2127,4532] objective_lb_search_max_lp
#Bound 24498.60s best:4533  next:[2128,4532] objective_lb_search_max_lp
#Bound 27807.66s best:4533  next:[2129,4532] objective_lb_search_max_lp
#Bound 28233.80s best:4533  next:[2130,4532] objective_lb_search_max_lp
#Bound 29213.14s best:4533  next:[2132,4532] objective_lb_search_max_lp
#Bound 32699.26s best:4533  next:[2134,4532] objective_lb_search_max_lp
#Bound 34663.88s best:4533  next:[2135,4532] objective_lb_search_max_lp
#Bound 35015.85s best:4533  next:[2136,4532] objective_lb_search_max_lp
#Bound 36038.60s best:4533  next:[2137,4532] objective_lb_search_max_lp
#Bound 39912.51s best:4533  next:[2138,4532] objective_lb_search_max_lp
#Bound 43953.15s best:4533  next:[2139,4532] objective_lb_search_max_lp
#Bound 44313.04s best:4533  next:[2140,4532] objective_lb_search_max_lp
#Bound 45341.03s best:4533  next:[2141,4532] objective_lb_search_max_lp
#Bound 48129.34s best:4533  next:[2142,4532] objective_lb_search_max_lp
#Bound 50413.81s best:4533  next:[2143,4532] objective_lb_search_max_lp
#Bound 56169.79s best:4533  next:[2145,4532] objective_lb_search_max_lp
#Bound 61749.47s best:4533  next:[2146,4532] objective_lb_search_max_lp
#Bound 66377.94s best:4533  next:[2147,4532] objective_lb_search_max_lp
#Bound 71723.66s best:4533  next:[2149,4532] objective_lb_search_max_lp
#Bound 74717.08s best:4533  next:[2150,4532] objective_lb_search_max_lp
#Bound 75530.22s best:4533  next:[2151,4532] objective_lb_search_max_lp
#Bound 77713.56s best:4533  next:[2152,4532] objective_lb_search_max_lp
#Bound 81943.36s best:4533  next:[2153,4532] objective_lb_search_max_lp
#Bound 84423.54s best:4533  next:[2154,4532] objective_lb_search_max_lp
#Bound 85042.31s best:4533  next:[2155,4532] objective_lb_search_max_lp

Task timing                                  n [     min,      max]      avg      dev     time         n [     min,      max]      avg      dev    dtime
                             'core':         1 [  24.00h,   24.00h]   24.00h   0.00ns   24.00h         1 [   9.37h,    9.37h]    9.37h   0.00ns    9.37h
                       'default_lp':         1 [  24.00h,   24.00h]   24.00h   0.00ns   24.00h         1 [   2.15h,    2.15h]    2.15h   0.00ns    2.15h
                 'feasibility_pump':      5660 [376.78us,    1.97m]   15.26s    1.94s   23.99h      5657 [609.59ms,   29.09s]    1.27s 408.65ms    2.00h
                            'fixed':         1 [  24.00h,   24.00h]   24.00h   0.00ns   24.00h         1 [   1.61h,    1.61h]    1.61h   0.00ns    1.61h
                  'fj_long_default':         4 [217.61ms,    3.19s] 989.59ms    1.27s    3.96s         4 [253.81ms, 374.96ms] 297.11ms  46.71ms    1.19s
              'fj_long_lin_default':         7 [229.95ms,    2.42s] 552.66ms 762.50ms    3.87s         7 [247.96ms, 301.23ms] 280.26ms  16.76ms    1.96s
                   'fj_long_random':         7 [222.35ms,    2.47s] 555.36ms 781.62ms    3.89s         7 [266.85ms, 368.65ms] 293.51ms  32.28ms    2.05s
                 'fj_short_default':        18 [211.16ms, 829.46ms] 263.25ms 137.79ms    4.74s        18 [273.18ms, 316.60ms] 296.93ms  13.06ms    5.34s
             'fj_short_lin_default':         2 [250.00ms,    3.55s]    1.90s    1.65s    3.80s         2 [270.48ms, 316.28ms] 293.38ms  22.90ms 586.76ms
              'fj_short_lin_random':         7 [208.87ms,    2.58s] 570.64ms 821.11ms    3.99s         7 [262.38ms, 290.54ms] 281.01ms  10.07ms    1.97s
                  'fj_short_random':        10 [213.95ms,    1.67s] 377.72ms 431.76ms    3.78s        10 [257.90ms, 300.40ms] 284.82ms  11.77ms    2.85s
                        'fs_random':         1 [   4.57s,    4.57s]    4.57s   0.00ns    4.57s         1 [ 90.24ms,  90.24ms]  90.24ms   0.00ns  90.24ms
                        'fs_random':         1 [   4.59s,    4.59s]    4.59s   0.00ns    4.59s         1 [ 67.64ms,  67.64ms]  67.64ms   0.00ns  67.64ms
                  'fs_random_no_lp':         1 [   4.61s,    4.61s]    4.61s   0.00ns    4.61s         1 [ 77.39ms,  77.39ms]  77.39ms   0.00ns  77.39ms
          'fs_random_quick_restart':         1 [   4.63s,    4.63s]    4.63s   0.00ns    4.63s         1 [ 69.02ms,  69.02ms]  69.02ms   0.00ns  69.02ms
          'fs_random_quick_restart':         1 [   4.64s,    4.64s]    4.64s   0.00ns    4.64s         1 [ 90.96ms,  90.96ms]  90.96ms   0.00ns  90.96ms
    'fs_random_quick_restart_no_lp':         1 [   4.55s,    4.55s]    4.55s   0.00ns    4.55s         1 [ 42.84ms,  42.84ms]  42.84ms   0.00ns  42.84ms
                    'graph_arc_lns':     18322 [  5.50us,   11.73s]    6.45s    1.23s   32.84h     18316 [ 22.80us, 124.27ms]  78.42ms  28.04ms   23.94m
                    'graph_cst_lns':     18321 [ 80.72ms,   14.71s]    6.61s    1.32s   33.65h     18312 [ 10.00ns, 203.24ms]  73.96ms  32.60ms   22.57m
                    'graph_dec_lns':     18321 [347.70ms,   11.86s]    6.56s    1.19s   33.36h     18315 [ 10.00ns, 175.08ms]  76.47ms  30.23ms   23.34m
                    'graph_var_lns':     18322 [ 21.74us,   12.83s]    6.18s    1.34s   31.45h     18304 [ 10.00ns, 196.44ms]  74.92ms  31.47ms   22.85m
                   'lb_tree_search':         1 [  24.00h,   24.00h]   24.00h   0.00ns   24.00h         1 [  10.76h,   10.76h]   10.76h   0.00ns   10.76h
                           'max_lp':         1 [  24.00h,   24.00h]   24.00h   0.00ns   24.00h         1 [   1.46h,    1.46h]    1.46h   0.00ns    1.46h
                            'no_lp':         1 [  24.00h,   24.00h]   24.00h   0.00ns   24.00h         1 [   1.18h,    1.18h]    1.18h   0.00ns    1.18h
              'objective_lb_search':         1 [  24.00h,   24.00h]   24.00h   0.00ns   24.00h         1 [   1.99h,    1.99h]    1.99h   0.00ns    1.99h
       'objective_lb_search_max_lp':         1 [  24.00h,   24.00h]   24.00h   0.00ns   24.00h         1 [   2.46h,    2.46h]    2.46h   0.00ns    2.46h
        'objective_lb_search_no_lp':         1 [  24.00h,   24.00h]   24.00h   0.00ns   24.00h         1 [  42.59m,   42.59m]   42.59m   0.00ns   42.59m
  'objective_shaving_search_max_lp':        84 [174.43ms,    1.60h]   17.14m   24.54m   24.00h        77 [ 82.73ms,    2.94m]   39.64s   49.92s   50.87m
   'objective_shaving_search_no_lp':        84 [426.64ms,    1.60h]   17.14m   24.54m   24.00h        77 [ 84.37ms,    1.49m]   14.62s   20.85s   18.76m
                          'probing':         1 [  24.00h,   24.00h]   24.00h   0.00ns   24.00h         1 [   3.44h,    3.44h]    3.44h   0.00ns    3.44h
                   'probing_max_lp':         1 [  24.00h,   24.00h]   24.00h   0.00ns   24.00h         1 [   3.66h,    3.66h]    3.66h   0.00ns    3.66h
                     'pseudo_costs':         1 [  24.00h,   24.00h]   24.00h   0.00ns   24.00h         1 [   1.71h,    1.71h]    1.71h   0.00ns    1.71h
                    'quick_restart':         1 [  24.00h,   24.00h]   24.00h   0.00ns   24.00h         1 [   3.32h,    3.32h]    3.32h   0.00ns    3.32h
              'quick_restart_no_lp':         1 [  24.00h,   24.00h]   24.00h   0.00ns   24.00h         1 [   1.13h,    1.13h]    1.13h   0.00ns    1.13h
                    'reduced_costs':         1 [  24.00h,   24.00h]   24.00h   0.00ns   24.00h         1 [   2.52h,    2.52h]    2.52h   0.00ns    2.52h
                        'rins/rens':     18322 [  1.36ms,    6.11s]    1.75s    1.24s    8.91h     16049 [ 10.00ns, 180.00ms]  83.58ms  56.01ms   22.36m
                      'rnd_cst_lns':     18322 [191.31ms,   13.36s]    6.59s    1.29s   33.55h     18310 [ 10.00ns, 200.52ms]  74.83ms  31.90ms   22.84m
                      'rnd_var_lns':     18322 [185.03ms,   11.71s]    6.49s    1.22s   33.04h     18309 [ 10.00ns, 200.07ms]  75.64ms  31.03ms   23.08m
         'scheduling_intervals_lns':     18321 [339.22ms,   11.57s]    8.22s 418.91ms   41.85h     18321 [  1.37ms, 102.68ms] 100.55ms   1.06ms   30.70m
       'scheduling_precedences_lns':     18321 [287.81ms,   11.40s]    8.27s 464.36ms   42.08h     18319 [  4.51ms, 102.68ms] 100.56ms 783.05us   30.70m
       'scheduling_time_window_lns':     18321 [314.38ms,   11.95s]    8.23s 428.30ms   41.88h     18320 [  6.39ms, 102.68ms] 100.55ms 984.65us   30.70m
                     'violation_ls':     18322 [ 10.09ms,    1.08s] 299.87ms  72.10ms    1.53h     18322 [660.00ns, 517.33ms] 304.39ms  67.58ms    1.55h
                     'violation_ls':     18322 [ 10.22ms,    1.08s] 330.24ms  86.83ms    1.68h     18322 [780.00ns, 660.67ms] 324.21ms  84.10ms    1.65h

Search stats                         Bools  Conflicts    Branches   Restarts      BoolPropag   IntegerPropag
                           'core':  28'413  2'345'684   3'529'239     73'265  16'806'978'212  19'701'993'084
                     'default_lp':   9'073    357'721   5'018'765    294'704     613'197'102   9'010'605'377
                          'fixed':   3'157  2'197'076   2'212'731      2'040     757'486'025  21'100'014'484
                      'fs_random':     462          0         943        924              59         242'579
                      'fs_random':     462          0         951        924              74         241'255
                'fs_random_no_lp':     535         45       1'005        924           2'238         521'356
        'fs_random_quick_restart':     462          0         944        924              70         240'097
        'fs_random_quick_restart':     462          0         947        924              71         240'284
  'fs_random_quick_restart_no_lp':     556          1       1'472        925              66         438'299
                 'lb_tree_search':     582      1'358  15'779'832  3'999'013      40'645'525  14'213'212'220
                         'max_lp':   4'346    433'559   4'583'278    753'888     241'652'823  11'801'744'538
                          'no_lp':   5'990    880'531   4'934'692    401'818     592'481'929  15'448'337'078
            'objective_lb_search':   6'372    243'116   7'673'948  1'445'609     302'515'424  10'987'258'458
     'objective_lb_search_max_lp':   1'482    339'847   6'045'689  1'466'573     173'244'481  12'711'231'155
      'objective_lb_search_no_lp':   1'383    298'787   2'017'759    449'464      68'253'653   9'024'916'104
                        'probing':  10'844      9'346      23'705     18'510       4'514'656      79'460'801
                 'probing_max_lp':  10'844      9'343      23'534     18'432       4'539'659      82'156'046
                   'pseudo_costs':   1'262    487'954   4'641'288  1'074'102     106'744'398  13'520'790'064
                  'quick_restart':  16'383    174'322  12'761'001    329'930   1'412'631'076  10'600'895'521
            'quick_restart_no_lp':  20'885    649'248   7'334'556    132'368   2'233'041'386  14'183'810'705
                  'reduced_costs':  77'245    784'512   9'576'275    249'395   7'580'957'699  14'466'050'371

SAT stats                           ClassicMinim  LitRemoved  LitLearned  LitForgotten  Subsumed   MClauses  MDecisions  MLitTrue  MSubsumed  MLitRemoved  MReused
                           'core':     2'281'298  59'841'555  46'142'711    31'972'701     2'073     31'701     156'180         0      1'713        6'715      628
                     'default_lp':       320'260   3'299'333   7'110'118     5'817'994     1'456     87'959     775'443         0      7'239       66'398   15'702
                          'fixed':     1'425'836   8'774'783  89'876'091    88'966'879     7'984        206       2'279         0        149        1'425        0
                      'fs_random':             0           0           0             0         0          0           0         0          0            0        0
                      'fs_random':             0           0           0             0         0          0           0         0          0            0        0
                'fs_random_no_lp':             5           9         471             0         1          0           0         0          0            0        0
        'fs_random_quick_restart':             0           0           0             0         0          0           0         0          0            0        0
        'fs_random_quick_restart':             0           0           0             0         0          0           0         0          0            0        0
  'fs_random_quick_restart_no_lp':             0           0           4             0         0          0           0         0          0            0        0
                 'lb_tree_search':             0           0       4'340             0         0  1'682'301   8'592'105         0        233          913  135'805
                         'max_lp':       357'920   2'136'030  12'442'077    11'432'576     2'627    243'484   1'684'959         0      3'951       24'482   29'546
                          'no_lp':       792'977   6'079'830  20'503'240    19'366'314     2'774     57'298     616'595         0      4'670       33'761   11'061
            'objective_lb_search':       206'546   1'845'017   5'986'315     2'779'142     3'064    500'537   2'867'931         0      3'796       27'608   62'012
     'objective_lb_search_max_lp':       302'502   1'988'526   4'521'309     1'807'752     3'674    199'101   2'587'583         0      6'320       49'442   55'560
      'objective_lb_search_no_lp':       258'480   2'025'347   7'580'905     3'839'811     2'944    115'708     829'426         0      1'907       11'929   18'842
                        'probing':             0           0       9'346             0         0          0           0         0          0            0        0
                 'probing_max_lp':             0           0       9'343             0         0          0           0         0          0            0        0
                   'pseudo_costs':       428'638   2'602'596  13'551'346    12'302'522     2'507    326'102   2'137'713         0      1'696        9'861   40'344
                  'quick_restart':       139'545   1'421'980   5'371'824     4'141'782     2'114    118'940   1'527'240         0     21'935      202'595   25'552
            'quick_restart_no_lp':       539'811   6'797'246  22'317'058    19'399'475     2'539     33'892     444'070         0     19'643      193'816    4'072
                  'reduced_costs':       659'173   6'546'492  22'085'517    19'458'837     4'915    113'863   1'134'553        10     33'571      237'254   32'569

Lp stats                         Component  Iterations  AddedCuts    OPTIMAL    DUAL_F.  DUAL_U.
                  'default_lp':          1  31'054'973    558'466  1'646'788      1'053       40
                       'fixed':          1   1'839'104      2'555  3'098'763          0        0
                   'fs_random':          1       4'357        553         47          0        0
                   'fs_random':          1       5'131        559         61          1        0
     'fs_random_quick_restart':          1       4'414        510         47          0        0
     'fs_random_quick_restart':          1       5'053        561         54          0        0
              'lb_tree_search':          1  77'326'699     85'322     33'064  6'959'058        1
                      'max_lp':          1  12'379'959    324'500    270'773  1'066'352       11
         'objective_lb_search':          1  23'250'557    818'529  1'092'313      2'283       29
  'objective_lb_search_max_lp':          1  14'575'108     42'436      8'799  1'168'758        0
                     'probing':          1   8'094'495    825'596     75'682      3'305        3
              'probing_max_lp':          1   2'864'398    284'846     61'322      8'813        2
                'pseudo_costs':          1  15'225'636    655'734    623'467  1'173'691       17
               'quick_restart':          1  41'889'417  3'561'103  1'243'867     16'214        9
               'reduced_costs':          1  17'364'338    584'842    613'481  1'418'675       28

Lp dimension                                                                        Final dimension of first component
                  'default_lp':  5464 rows, 5570 columns, 20730 entries with magnitude in [6.666589e-04, 1.000000e+00]
                       'fixed':  4985 rows, 5570 columns, 18257 entries with magnitude in [9.759420e-03, 1.000000e+00]
                   'fs_random':   2086 rows, 5570 columns, 8307 entries with magnitude in [1.459374e-02, 1.000000e+00]
                   'fs_random':   2486 rows, 5570 columns, 9659 entries with magnitude in [1.459374e-02, 1.000000e+00]
     'fs_random_quick_restart':   2086 rows, 5570 columns, 8283 entries with magnitude in [1.459374e-02, 1.000000e+00]
     'fs_random_quick_restart':   2286 rows, 5570 columns, 9022 entries with magnitude in [1.459374e-02, 1.000000e+00]
              'lb_tree_search':  9639 rows, 5591 columns, 62137 entries with magnitude in [1.949609e-04, 1.000000e+00]
                      'max_lp':  5456 rows, 5591 columns, 20773 entries with magnitude in [4.254692e-03, 1.000000e+00]
         'objective_lb_search':  5253 rows, 5570 columns, 19576 entries with magnitude in [1.176707e-03, 1.000000e+00]
  'objective_lb_search_max_lp':  8717 rows, 5591 columns, 42988 entries with magnitude in [3.424924e-04, 1.000000e+00]
                     'probing':  7960 rows, 5570 columns, 40227 entries with magnitude in [4.505249e-05, 1.000000e+00]
              'probing_max_lp':  7847 rows, 5591 columns, 54813 entries with magnitude in [4.684000e-05, 1.000000e+00]
                'pseudo_costs':  5424 rows, 5591 columns, 19982 entries with magnitude in [3.268994e-04, 1.000000e+00]
               'quick_restart':  6377 rows, 5570 columns, 24848 entries with magnitude in [1.296473e-03, 1.000000e+00]
               'reduced_costs':  6420 rows, 5591 columns, 26852 entries with magnitude in [1.842212e-04, 1.000000e+00]

Lp debug                         CutPropag  CutEqPropag     Adjust  Overflow            Bad  BadScaling
                  'default_lp':         46          101    510'734         0     15'184'642           0
                       'fixed':          1            0          0         0         57'340           0
                   'fs_random':          1            0          0         0          5'800           0
                   'fs_random':          1            0          0         0          5'836           0
     'fs_random_quick_restart':          1            0          0         0          5'779           0
     'fs_random_quick_restart':          1            0          0         0          5'792           0
              'lb_tree_search':         66          248  6'916'708         0     68'149'150           0
                      'max_lp':        101          125    287'307         0     24'768'436           0
         'objective_lb_search':         60          237    466'825         0     35'104'336           0
  'objective_lb_search_max_lp':         35           29  1'159'535         0     18'560'576           0
                     'probing':        857        2'012     78'655         0  1'522'831'833           0
              'probing_max_lp':        480        1'206     70'135         0  1'407'114'203           0
                'pseudo_costs':         81          159    379'702         0     50'532'516           0
               'quick_restart':        321          763    640'872         0    263'331'903           0
               'reduced_costs':        167          140  1'334'845         0     41'557'626           0

Lp pool                          Constraints  Updates  Simplif  Merged  Shortened      Split  Strenghtened            Cuts/Call
                  'default_lp':       16'202    2'367   15'852      68          0     46'054        52'485    558'466/3'460'730
                       'fixed':        9'359        4        9       0          0          3           977         2'555/61'046
                   'fs_random':        7'357        0        3       0          0          0           906            553/2'352
                   'fs_random':        7'363        0        3       0          0          0           908            559/2'707
     'fs_random_quick_restart':        7'314        0        3       0          0          0           906            510/2'340
     'fs_random_quick_restart':        7'365        0        3       0          0          0           909            561/2'541
              'lb_tree_search':       79'058    5'900  696'602      19          0    410'345       704'936       85'322/233'890
                      'max_lp':       79'205    2'707  526'084      50          0    182'954       569'439      324'500/678'313
         'objective_lb_search':       16'299    6'006   24'607      34          0    192'060        93'243    818'529/2'646'240
  'objective_lb_search_max_lp':       79'164    1'759  682'100      27          0    162'435       686'348       42'436/101'360
                     'probing':       16'393   86'105   13'723       7          0  5'304'995       168'424    825'596/1'561'812
              'probing_max_lp':       79'582   43'576  638'649      19          0  1'884'678       669'721      284'846/708'715
                'pseudo_costs':       79'423    4'772  629'975      66          0    441'387       725'374    655'734/1'354'851
               'quick_restart':       15'844   27'474   22'329      63          0  2'791'407       371'676  3'561'103/7'526'314
               'reduced_costs':       79'440    4'140  588'029     157          0    612'707       659'410    584'842/1'280'580

Lp Cut                                                      fs_ran  fs_ran  fs_ran  fs_ran   defaul  fixed  max_lp     quick_   reduce   pseudo  lb_tre   probin   object   probin  object
                                                    CG_FF:      23      23      23      23   20'394     79  20'697     60'856   36'867   39'305   1'756   15'078   28'793    2'087   1'793
                                                     CG_K:      20      20      20      20   14'837     72  20'715     38'277   39'274   40'429   1'866    5'955   18'789    1'833   1'649
                                                    CG_KL:       -       -       -       -      196      -      21        333      189      134       -      172      230        1       2
                                                     CG_R:      14      14      14      14    9'136     51   9'189     30'648   16'046   20'527   1'062    8'422   13'748    1'455     821
                                                    CG_RB:       4       4       4       4   44'309    109  40'247    132'402   68'474   85'516   4'377   51'777   72'433    7'975   3'956
                                                   CG_RBP:       -       -       -       -    4'762      8   5'890     11'937   10'800   13'565     698    2'612    6'567    2'618     555
                                                   Clique:       -       -       -       -        -      -   5'765          -   10'283   13'936     414        -        -    1'304     371
                                                       IB:     194     188     145     187  351'091  1'494  98'381  2'107'781  180'817  187'063  15'122  134'734  471'944   34'384   8'575
                                                 MIR_1_FF:      94      95      96      96   11'268    153  12'617    100'112   22'937   24'996   2'888   37'070   20'345    8'911   1'637
                                                  MIR_1_K:      28      28      28      28    1'562     38   1'820     16'001    3'437    3'850     321    4'141    3'038    1'113     267
                                                 MIR_1_KL:       -       -       -       -      547      -     510      7'770      758      587     105    3'164    1'317    1'087      88
                                                  MIR_1_R:      25      25      25      25    2'386     39   1'835     22'863    3'889    4'464     682   16'232    3'941    2'970     420
                                                 MIR_1_RB:      45      46      46      46   19'607    129  27'424    218'802   46'678   53'611   7'044   89'096   35'740   22'576   3'689
                                                MIR_1_RBP:       -       -       -       -    2'188      6   7'823     30'504   12'863   14'327   1'443    7'670    5'181    2'968     684
                                                MIR_1_RLT:       -       -       -       -        -      -     327          -      479      641      61        -        -      263      34
                                                 MIR_2_FF:      21      20      20      20    7'295     48   5'976     56'167   11'735   13'775   1'339   19'337   11'813    4'975     948
                                                  MIR_2_K:      17      16      14      18    1'328     22   1'185     10'347    2'295    2'548     212    2'677    2'324      943     216
                                                 MIR_2_KL:       -       -       -       -      393      -     484      7'159      569      439      93    2'798    1'032      948      74
                                                  MIR_2_R:       9       8       8       8    1'590     19   1'175     15'740    2'476    2'887     557   17'216    2'888    2'878     309
                                                 MIR_2_RB:      19      22      25      22   12'699     79  10'528    138'788   19'147   23'657   2'669   65'535   21'930   10'611   1'568
                                                MIR_2_RBP:       2       1       1       1    1'463      5   2'389     19'491    3'930    5'297     453    5'850    3'211    1'414     236
                                                 MIR_3_FF:       2       3       4       4    4'560     27   3'313     35'188    6'620    7'919     714   13'112    6'946    2'500     527
                                                  MIR_3_K:       2       1       1       4      940      6     991      7'143    1'915    2'231     216    1'942    1'535      693     197
                                                 MIR_3_KL:       -       -       -       -      311      -     394      5'824      515      436      88    2'008      809      692      70
                                                  MIR_3_R:       -       -       -       -      984      6     669     10'142    1'299    1'491     385   11'193    1'761    1'838     190
                                                 MIR_3_RB:       7       9       6       9    7'595     30   5'155     82'771    9'982   11'959   1'423   44'779   12'958    5'509     844
                                                MIR_3_RBP:       3       2       2       2      967      3   1'229     12'931    2'231    2'734     301    4'449    2'311      800     134
                                                 MIR_4_FF:       -       -       -       -    2'603      4   1'867     22'751    4'001    4'669     454    9'739    4'400    1'596     311
                                                  MIR_4_K:       3       2       2       3      793      4     607      5'494    1'232    1'524     140    1'688    1'248      507     141
                                                 MIR_4_KL:       -       -       -       -      261      -     272      4'221      428      343      90    1'692      546      583      66
                                                  MIR_4_R:       -       -       -       -      635      -     405      6'296      825      876     186    6'722    1'118    1'078     114
                                                 MIR_4_RB:       3       2       3       4    4'992     13   2'882     51'928    5'644    6'394     696   29'313    8'311    2'962     472
                                                MIR_4_RBP:       1       1       1       1      495      1     616      7'031    1'168    1'327     140    3'063    1'332      623      80
                                                 MIR_5_FF:       -       -       -       -    1'830      3   1'076     15'315    2'408    2'656     334    7'192    3'064    1'110     208
                                                  MIR_5_K:       1       2       2       1      501      4     418      3'922      887      884     137    1'135      859      537     104
                                                 MIR_5_KL:       -       -       -       -      210      -     261      4'085      456      309     133    1'901      528      693     103
                                                  MIR_5_R:       -       -       -       -      442      2     206      4'349      566      464     129    4'416      878      738      80
                                                 MIR_5_RB:       1       2       2       1    3'321      7   1'631     34'405    3'496    3'809     437   21'216    5'757    2'002     307
                                                MIR_5_RBP:       -       -       -       -      294      -     321      4'225      677      677     111    2'081      796      494      78
                                                 MIR_6_FF:       -       -       -       -    1'303      2     656     10'297    1'553    1'535     242    5'225    2'080      778     162
                                                  MIR_6_K:       -       -       -       -      344      2     295      3'102      598      574     111    1'101      659      550      74
                                                 MIR_6_KL:       -       -       -       -      219      -     221      4'595      556      352     162    2'602      560      878      86
                                                  MIR_6_R:       -       -       -       -      296      1     136      2'698      343      316      93    2'612      571      414      57
                                                 MIR_6_RB:       -       -       -       -    2'319     11   1'110     25'214    2'379    2'349     444   17'273    4'166    1'692     236
                                                MIR_6_RBP:       -       -       -       -      198      -     183      2'887      470      382      82    1'657      560      456      75
         NoOverlapCompletionTimeExhaustiveMirror_weighted:       -       -       -       -        -      -       2          -       17        2       -        -        -        -       -
  NoOverlapCompletionTimeExhaustiveMirror_weighted_lifted:       -       -       -       -        -      -       1          -        2        -       -        -        -        -       -
               NoOverlapCompletionTimeExhaustive_weighted:       -       -       -       -        -      -      30          -       53       58       -        -        -        -       2
        NoOverlapCompletionTimeExhaustive_weighted_lifted:       -       -       -       -        -      -     433          -      907    1'315       4        -        -        4      15
                          NoOverlapCompletionTimeQueyrane:       -       -       -       -        -      -     117          -      315      203       7        -        -        4      12
                   NoOverlapCompletionTimeQueyrane_lifted:       -       -       -       -        -      -     397          -      924      936       4        -        -        4      21
                                NoOverlapDisjunctionOnEnd:       -       -       -       -        -      -      17          -       42       11       -        -        -        -       1
                              NoOverlapDisjunctionOnStart:       -       -       -       -        -      -     455          -    1'093    1'447       5        -        -        5      17
                                             ZERO_HALF_FF:       6       5       5       4    3'269     20   3'585     17'716    6'028    7'280     391    4'142    4'924      733     252
                                              ZERO_HALF_K:       6       7       5       7    1'192     13   1'691      5'725    3'384    3'787     264    1'290    1'831      563     187
                                             ZERO_HALF_KL:       -       -       -       -       63      -      22        665       63       49       4       85      357        5       -
                                              ZERO_HALF_R:       6       5       5       7    3'782     21   8'222     82'912   12'060   13'547  30'749  101'100    9'606  122'303   7'832
                                             ZERO_HALF_RB:       1       -       2       1    5'282     19   7'386     46'356   12'261   14'671   2'136   20'242    9'897    8'637     940
                                            ZERO_HALF_RBP:       2       2       1       1    1'414      5   2'230     14'937    3'501    4'664   1'348   11'090    2'897    9'551     549

LNS stats                        Improv/Calls  Closed  Difficulty  TimeLimit
               'graph_arc_lns':    7386/18319     50%        1.00       0.10
               'graph_cst_lns':    7573/18318     50%        1.00       0.10
               'graph_dec_lns':    7321/18319     50%        1.00       0.10
               'graph_var_lns':    7844/18319     50%        1.00       0.10
                   'rins/rens':    1564/16913     50%        0.93       0.18
                 'rnd_cst_lns':    7549/18320     50%        1.00       0.10
                 'rnd_var_lns':    7340/18320     50%        1.00       0.10
    'scheduling_intervals_lns':   18321/18321      0%        0.00       0.10
  'scheduling_precedences_lns':   18319/18319      0%        0.00       0.10
  'scheduling_time_window_lns':   18320/18320      0%        0.00       0.10

LS stats                   Batches  Restarts    LinMoves    GenMoves  CompoundMoves  WeightUpdates
       'fj_long_default':        4         1      39'907           0              0             93
   'fj_long_lin_default':        7         1           0       9'396          1'869              0
        'fj_long_random':        7         1      69'853           0              0            147
      'fj_short_default':       18         1           0      20'653          2'148              0
  'fj_short_lin_default':        2         1           0       3'610            576              0
   'fj_short_lin_random':        7         1           0      10'093          1'522              0
       'fj_short_random':       10         1           0      13'819          1'851              0
          'violation_ls':   18'322         0  80'073'915  12'065'397        539'719      1'566'239
          'violation_ls':   18'322         0  88'403'634   8'868'726        336'750        530'414

Solutions (122)                     Num      Rank
  'fs_random_quick_restart_no_lp':    1     [1,1]
                  'graph_arc_lns':    8   [3,109]
                  'graph_cst_lns':    8  [45,113]
                  'graph_dec_lns':   13  [21,119]
                  'graph_var_lns':   13  [15,120]
                          'no_lp':    2     [2,4]
            'quick_restart_no_lp':   13   [6,116]
                    'rins_lp_lns':    4  [11,110]
                  'rins_pump_lns':    5  [20,111]
                    'rnd_cst_lns':    5  [38,107]
                    'rnd_var_lns':   16   [8,122]
                   'violation_ls':   34   [7,118]

Objective bounds                 Num
              'initial_domain':    1
                      'max_lp':    1
  'objective_lb_search_max_lp':   77
   'objective_lb_search_no_lp':    5
              'probing_max_lp':    3
                'pseudo_costs':    4

Solution repositories      Added  Queried  Ignored  Synchro
  'feasible solutions':   80'468  416'860        0   79'407
        'lp solutions':   32'697    9'078        0   32'273
                'pump':  118'502    9'244

Improving bounds shared             Num
                  'default_lp':     358
              'lb_tree_search':     224
                      'max_lp':     425
                       'no_lp':     297
         'objective_lb_search':      90
  'objective_lb_search_max_lp':     190
   'objective_lb_search_no_lp':     996
                     'probing':  61'561
              'probing_max_lp':  37'735
                'pseudo_costs':     153
               'quick_restart':   1'185
         'quick_restart_no_lp':   1'847
               'reduced_costs':     748

Clauses shared                   Num
                        'core':   23
                  'default_lp':   38
              'lb_tree_search':    7
                      'max_lp':   17
                       'no_lp':   22
         'objective_lb_search':   27
  'objective_lb_search_max_lp':    4
   'objective_lb_search_no_lp':   19
                'pseudo_costs':   71
               'quick_restart':   35
         'quick_restart_no_lp':   66
               'reduced_costs':    2

CpSolverResponse summary:
status: FEASIBLE
objective: 4533
best_bound: 2155
integers: 5582
booleans: 462
conflicts: 0
branches: 951
propagations: 74
integer_propagations: 241255
restarts: 924
lp_iterations: 5131
walltime: 86405.1
usertime: 86405.1
deterministic_time: 208967
gap_integral: 1.625e+06
solution_fingerprint: 0x9e7a3a6bc420a455


--- Simulation Gantt  partir du modle mathmatique ---
