created virtual environment CPython3.12.4.final.0-64 in 657ms
  creator CPython3Posix(dest=/localscratch/aneumann.46806157.0/env, clear=False, no_vcs_ignore=False, global=False)
  seeder FromAppData(download=False, pip=bundle, via=copy, app_data_dir=/home/aneumann/.local/share/virtualenv)
    added seed packages: pip==24.2+computecanada
  activators BashActivator,CShellActivator,FishActivator,NushellActivator,PowerShellActivator,PythonActivator
Looking in links: /cvmfs/soft.computecanada.ca/custom/python/wheelhouse/gentoo2023/x86-64-v3, /cvmfs/soft.computecanada.ca/custom/python/wheelhouse/gentoo2023/generic, /cvmfs/soft.computecanada.ca/custom/python/wheelhouse/generic
Requirement already satisfied: pip in /localscratch/aneumann.46806157.0/env/lib/python3.12/site-packages (24.2+computecanada)
Processing /cvmfs/soft.computecanada.ca/custom/python/wheelhouse/generic/pip-25.0+computecanada-py3-none-any.whl
Installing collected packages: pip
  Attempting uninstall: pip
    Found existing installation: pip 24.2+computecanada
    Uninstalling pip-24.2+computecanada:
      Successfully uninstalled pip-24.2+computecanada
Successfully installed pip-24.2+computecanada
Looking in links: /cvmfs/soft.computecanada.ca/custom/python/wheelhouse/gentoo2023/x86-64-v3, /cvmfs/soft.computecanada.ca/custom/python/wheelhouse/gentoo2023/generic, /cvmfs/soft.computecanada.ca/custom/python/wheelhouse/generic
ERROR: protobuf-5.28.3-cp38-abi3-manylinux2014_x86_64.whl is not a supported wheel on this platform.
Looking in links: /cvmfs/soft.computecanada.ca/custom/python/wheelhouse/gentoo2023/x86-64-v3, /cvmfs/soft.computecanada.ca/custom/python/wheelhouse/gentoo2023/generic, /cvmfs/soft.computecanada.ca/custom/python/wheelhouse/generic
Processing /home/aneumann/projects/def-adhaj/aneumann/GNRS/wheels/immutabledict-4.2.0-py3-none-any.whl
Installing collected packages: immutabledict
Successfully installed immutabledict-4.2.0
Looking in links: /cvmfs/soft.computecanada.ca/custom/python/wheelhouse/gentoo2023/x86-64-v3, /cvmfs/soft.computecanada.ca/custom/python/wheelhouse/gentoo2023/generic, /cvmfs/soft.computecanada.ca/custom/python/wheelhouse/generic
Processing /cvmfs/soft.computecanada.ca/custom/python/wheelhouse/generic/ortools-9.10.4067+computecanada-cp312-cp312-linux_x86_64.whl (from -r /home/aneumann/projects/def-adhaj/aneumann/GNRS/requirements/or.txt (line 1))
Processing /cvmfs/soft.computecanada.ca/custom/python/wheelhouse/gentoo2023/x86-64-v3/matplotlib-3.10.0+computecanada-cp312-cp312-linux_x86_64.whl (from -r /home/aneumann/projects/def-adhaj/aneumann/GNRS/requirements/or.txt (line 2))
Processing /cvmfs/soft.computecanada.ca/custom/python/wheelhouse/gentoo2023/x86-64-v3/pandas-2.2.3+computecanada-cp312-cp312-linux_x86_64.whl (from -r /home/aneumann/projects/def-adhaj/aneumann/GNRS/requirements/or.txt (line 3))
Processing /cvmfs/soft.computecanada.ca/custom/python/wheelhouse/generic/absl_py-2.3.0+computecanada-py3-none-any.whl (from ortools<9.11,>=9.10->-r /home/aneumann/projects/def-adhaj/aneumann/GNRS/requirements/or.txt (line 1))
Processing /cvmfs/soft.computecanada.ca/custom/python/wheelhouse/gentoo2023/generic/numpy-2.2.2+computecanada-cp312-cp312-linux_x86_64.whl (from ortools<9.11,>=9.10->-r /home/aneumann/projects/def-adhaj/aneumann/GNRS/requirements/or.txt (line 1))
Processing /cvmfs/soft.computecanada.ca/custom/python/wheelhouse/gentoo2023/x86-64-v3/protobuf-6.31.1+computecanada-cp312-cp312-linux_x86_64.whl (from ortools<9.11,>=9.10->-r /home/aneumann/projects/def-adhaj/aneumann/GNRS/requirements/or.txt (line 1))
Requirement already satisfied: immutabledict>=3.0.0 in /localscratch/aneumann.46806157.0/env/lib/python3.12/site-packages (from ortools<9.11,>=9.10->-r /home/aneumann/projects/def-adhaj/aneumann/GNRS/requirements/or.txt (line 1)) (4.2.0)
Processing /cvmfs/soft.computecanada.ca/custom/python/wheelhouse/gentoo2023/generic/contourpy-1.3.1+computecanada-cp312-cp312-linux_x86_64.whl (from matplotlib->-r /home/aneumann/projects/def-adhaj/aneumann/GNRS/requirements/or.txt (line 2))
Processing /cvmfs/soft.computecanada.ca/custom/python/wheelhouse/generic/cycler-0.12.1+computecanada-py3-none-any.whl (from matplotlib->-r /home/aneumann/projects/def-adhaj/aneumann/GNRS/requirements/or.txt (line 2))
Processing /cvmfs/soft.computecanada.ca/custom/python/wheelhouse/generic/fonttools-4.59.0+computecanada-cp312-cp312-linux_x86_64.whl (from matplotlib->-r /home/aneumann/projects/def-adhaj/aneumann/GNRS/requirements/or.txt (line 2))
Processing /cvmfs/soft.computecanada.ca/custom/python/wheelhouse/gentoo2023/x86-64-v3/kiwisolver-1.4.8+computecanada-cp312-cp312-linux_x86_64.whl (from matplotlib->-r /home/aneumann/projects/def-adhaj/aneumann/GNRS/requirements/or.txt (line 2))
Processing /cvmfs/soft.computecanada.ca/custom/python/wheelhouse/generic/packaging-25.0+computecanada-py3-none-any.whl (from matplotlib->-r /home/aneumann/projects/def-adhaj/aneumann/GNRS/requirements/or.txt (line 2))
Processing /cvmfs/soft.computecanada.ca/custom/python/wheelhouse/gentoo2023/x86-64-v3/pillow-11.1.0+computecanada-cp312-cp312-linux_x86_64.whl (from matplotlib->-r /home/aneumann/projects/def-adhaj/aneumann/GNRS/requirements/or.txt (line 2))
Processing /cvmfs/soft.computecanada.ca/custom/python/wheelhouse/generic/pyparsing-3.2.3+computecanada-py3-none-any.whl (from matplotlib->-r /home/aneumann/projects/def-adhaj/aneumann/GNRS/requirements/or.txt (line 2))
Processing /cvmfs/soft.computecanada.ca/custom/python/wheelhouse/generic/python_dateutil-2.9.0.post0+computecanada-py2.py3-none-any.whl (from matplotlib->-r /home/aneumann/projects/def-adhaj/aneumann/GNRS/requirements/or.txt (line 2))
Processing /cvmfs/soft.computecanada.ca/custom/python/wheelhouse/generic/pytz-2025.2+computecanada-py2.py3-none-any.whl (from pandas->-r /home/aneumann/projects/def-adhaj/aneumann/GNRS/requirements/or.txt (line 3))
Processing /cvmfs/soft.computecanada.ca/custom/python/wheelhouse/generic/tzdata-2025.2+computecanada-py2.py3-none-any.whl (from pandas->-r /home/aneumann/projects/def-adhaj/aneumann/GNRS/requirements/or.txt (line 3))
Processing /cvmfs/soft.computecanada.ca/custom/python/wheelhouse/generic/six-1.17.0+computecanada-py2.py3-none-any.whl (from python-dateutil>=2.7->matplotlib->-r /home/aneumann/projects/def-adhaj/aneumann/GNRS/requirements/or.txt (line 2))
Installing collected packages: pytz, tzdata, six, pyparsing, protobuf, pillow, packaging, numpy, kiwisolver, fonttools, cycler, absl-py, python-dateutil, contourpy, pandas, matplotlib, ortools
Successfully installed absl-py-2.3.0+computecanada contourpy-1.3.1+computecanada cycler-0.12.1+computecanada fonttools-4.59.0+computecanada kiwisolver-1.4.8+computecanada matplotlib-3.10.0+computecanada numpy-2.2.2+computecanada ortools-9.10.4067+computecanada packaging-25.0+computecanada pandas-2.2.3+computecanada pillow-11.1.0+computecanada protobuf-6.31.1+computecanada pyparsing-3.2.3+computecanada python-dateutil-2.9.0.post0+computecanada pytz-2025.2+computecanada six-1.17.0+computecanada tzdata-2025.2+computecanada

Starting CP-SAT solver v9.10.4067
Parameters: max_time_in_seconds: 86400 max_memory_in_mb: 185000 log_search_progress: true enumerate_all_solutions: false num_search_workers: 32 absolute_gap_limit: 0 relative_gap_limit: 0

Initial optimization model '': (model_fingerprint: 0x4807b1fdee5499d8)
#Variables: 329 (#ints: 9 in objective)
  - 240 Booleans in [0,1]
  - 89 in [0,700]
#kLinear1: 44
#kLinear2: 472
#kLinear3: 200
#kLinearN: 4'280 (#terms: 72'708)

Starting presolve at 0.00s
  3.03e-03s  0.00e+00d  [DetectDominanceRelations] 
  5.79e-02s  0.00e+00d  [PresolveToFixPoint] #num_loops=8 #num_dual_strengthening=3 
  3.55e-05s  0.00e+00d  [ExtractEncodingFromLinear] #potential_supersets=1 
[Symmetry] Graph for symmetry has 4'928 nodes and 56'972 arcs.
[Symmetry] Symmetry computation done. time: 0.00256953 dtime: 0.00412617
[Symmetry] #generators: 1, average support size: 18
[Symmetry] The model contains 232 duplicate constraints !
[Symmetry] 9 orbits with sizes: 2,2,2,2,2,2,2,2,2
[Symmetry] Num fixable by intersecting at_most_one with orbits: 1 largest_orbit: 2
  1.51e-02s  3.02e-03d  [Probe] #probed=330 #new_bounds=15 #equiv=1 
  1.92e-05s  0.00e+00d  [MaxClique] 
  2.91e-03s  0.00e+00d  [DetectDominanceRelations] 
  2.87e-02s  0.00e+00d  [PresolveToFixPoint] #num_loops=5 #num_dual_strengthening=3 
  1.22e-02s  0.00e+00d  [ProcessAtMostOneAndLinear] 
  4.28e-03s  0.00e+00d  [DetectDuplicateConstraints] #duplicates=287 #without_enforcements=93 
  4.09e-03s  2.75e-04d  [DetectDominatedLinearConstraints] #relevant_constraints=3'767 #num_inclusions=2'956 
  5.06e-04s  0.00e+00d  [DetectDifferentVariables] #different=18 #cliques=1 #size=5 
  6.03e-04s  0.00e+00d  [ProcessSetPPC] #relevant_constraints=3'370 
  2.31e-05s  0.00e+00d  [FindAlmostIdenticalLinearConstraints] 
  1.75e-05s  0.00e+00d  [FindBigAtMostOneAndLinearOverlap] 
  7.72e-03s  5.50e-03d  [FindBigVerticalLinearOverlap] #blocks=43 #saved_nz=6'309 
  4.85e-04s  2.13e-04d  [FindBigHorizontalLinearOverlap] #linears=3'332 
  1.86e-05s  0.00e+00d  [MergeClauses] 
  3.29e-03s  0.00e+00d  [DetectDominanceRelations] 
  3.08e-02s  0.00e+00d  [PresolveToFixPoint] #num_loops=2 #num_dual_strengthening=1 
  3.23e-03s  0.00e+00d  [DetectDominanceRelations] 
  2.03e-02s  0.00e+00d  [PresolveToFixPoint] #num_loops=1 #num_dual_strengthening=1 
[Symmetry] Graph for symmetry has 4'770 nodes and 49'688 arcs.
[Symmetry] Symmetry computation done. time: 0.00135537 dtime: 0.00269224
  1.46e-02s  2.74e-03d  [Probe] #probed=330 #new_bounds=30 
  1.33e-05s  0.00e+00d  [MaxClique] 
  3.28e-03s  0.00e+00d  [DetectDominanceRelations] 
  2.74e-02s  0.00e+00d  [PresolveToFixPoint] #num_loops=2 #num_dual_strengthening=1 
  1.18e-02s  0.00e+00d  [ProcessAtMostOneAndLinear] 
  4.01e-03s  0.00e+00d  [DetectDuplicateConstraints] #without_enforcements=95 
  2.87e-03s  2.02e-04d  [DetectDominatedLinearConstraints] #relevant_constraints=3'670 #num_inclusions=1'264 
  3.48e-04s  0.00e+00d  [DetectDifferentVariables] 
  5.91e-04s  0.00e+00d  [ProcessSetPPC] #relevant_constraints=3'299 
  2.90e-05s  1.50e-07d  [FindAlmostIdenticalLinearConstraints] #num_tested_pairs=10 
  1.31e-05s  0.00e+00d  [FindBigAtMostOneAndLinearOverlap] 
  7.67e-03s  4.61e-03d  [FindBigVerticalLinearOverlap] #blocks=76 #saved_nz=7'650 
  4.34e-04s  1.69e-04d  [FindBigHorizontalLinearOverlap] #linears=3'085 
  1.50e-05s  0.00e+00d  [MergeClauses] 
  2.88e-03s  0.00e+00d  [DetectDominanceRelations] 
  3.75e-02s  0.00e+00d  [PresolveToFixPoint] #num_loops=2 #num_dual_strengthening=1 
  2.83e-03s  0.00e+00d  [DetectDominanceRelations] 
  2.31e-02s  0.00e+00d  [PresolveToFixPoint] #num_loops=1 #num_dual_strengthening=1 
[Symmetry] Graph for symmetry has 4'993 nodes and 42'109 arcs.
[Symmetry] Symmetry computation done. time: 0.00114509 dtime: 0.00234133
  1.42e-02s  2.58e-03d  [Probe] #probed=330 #new_bounds=59 
  1.26e-05s  0.00e+00d  [MaxClique] 
  2.83e-03s  0.00e+00d  [DetectDominanceRelations] 
  3.38e-02s  0.00e+00d  [PresolveToFixPoint] #num_loops=2 #num_dual_strengthening=1 
  1.04e-02s  0.00e+00d  [ProcessAtMostOneAndLinear] 
  3.73e-03s  0.00e+00d  [DetectDuplicateConstraints] #without_enforcements=106 
  1.98e-03s  1.45e-04d  [DetectDominatedLinearConstraints] #relevant_constraints=3'544 #num_inclusions=302 
  3.45e-04s  0.00e+00d  [DetectDifferentVariables] 
  5.18e-04s  0.00e+00d  [ProcessSetPPC] #relevant_constraints=2'971 
  4.18e-05s  1.48e-06d  [FindAlmostIdenticalLinearConstraints] #num_tested_pairs=88 
  1.55e-05s  0.00e+00d  [FindBigAtMostOneAndLinearOverlap] 
  4.77e-03s  3.28e-03d  [FindBigVerticalLinearOverlap] #blocks=58 #saved_nz=3'748 
  4.09e-04s  1.41e-04d  [FindBigHorizontalLinearOverlap] #linears=2'794 
  1.43e-05s  0.00e+00d  [MergeClauses] 
  2.61e-03s  0.00e+00d  [DetectDominanceRelations] 
  3.16e-02s  0.00e+00d  [PresolveToFixPoint] #num_loops=2 #num_dual_strengthening=1 
  1.68e-04s  0.00e+00d  [ExpandObjective] #entries=768 #tight_variables=267 #tight_constraints=157 

Presolve summary:
  - 82 affine relations were detected.
  - rule 'TODO dual: only one blocking constraint?' was applied 597 times.
  - rule 'TODO dual: only one blocking enforced constraint?' was applied 104 times.
  - rule 'TODO dual: only one unspecified blocking constraint?' was applied 42 times.
  - rule 'TODO duplicate: identical constraint with different enforcements' was applied 294 times.
  - rule 'affine: new relation' was applied 82 times.
  - rule 'deductions: 316 stored' was applied 1 time.
  - rule 'dual: fix variable' was applied 24 times.
  - rule 'dual: reduced domain' was applied 55 times.
  - rule 'duplicate: merged rhs of linear constraint' was applied 51 times.
  - rule 'duplicate: removed constraint' was applied 287 times.
  - rule 'enforcement: false literal' was applied 14 times.
  - rule 'exactly_one: x and not(x)' was applied 1 time.
  - rule 'incompatible linear: add implication' was applied 30 times.
  - rule 'linear matrix: common vertical rectangle' was applied 177 times.
  - rule 'linear: always true' was applied 644 times.
  - rule 'linear: doubleton free' was applied 12 times.
  - rule 'linear: empty' was applied 38 times.
  - rule 'linear: extracted enforcement literal' was applied 6'633 times.
  - rule 'linear: fixed or dup variables' was applied 4'434 times.
  - rule 'linear: positive equal one' was applied 1 time.
  - rule 'linear: reduced variable domains' was applied 280 times.
  - rule 'linear: remapped using affine relations' was applied 4'526 times.
  - rule 'linear: simplified rhs' was applied 13'552 times.
  - rule 'linear: tightened into equality' was applied 8 times.
  - rule 'linear: variable substitution 1' was applied 12 times.
  - rule 'linear: variable substitution 2' was applied 3 times.
  - rule 'linear: variable substitution 3' was applied 4 times.
  - rule 'no_overlap: inferred from x != y constraints' was applied 1 time.
  - rule 'presolve: 99 unused variables removed.' was applied 1 time.
  - rule 'presolve: iteration' was applied 3 times.
  - rule 'symmetry: fixed to false in general orbit' was applied 1 time.

Presolved optimization model '': (model_fingerprint: 0xf09266822a24e1d0)
#Variables: 306 (#ints: 9 in objective)
  - 79 Booleans in [0,1]
  - 200 different domains in [-7613,7536] with a largest complexity of 15.
#kInterval: 5
#kLinear2: 602 (#enforced: 562 #multi: 421)
#kLinear3: 476 (#enforced: 299)
#kLinearN: 3'011 (#enforced: 2'925) (#terms: 28'737)
#kNoOverlap: 1 (#intervals: 5)

Preloading model.
#Bound   0.44s best:inf   next:[196,5296] initial_domain
[Symmetry] Graph for symmetry has 4'952 nodes and 38'408 arcs.
[Symmetry] Symmetry computation done. time: 0.00104746 dtime: 0.00214571
#Model   0.45s var:306/306 constraints:4095/4095

Starting search at 0.45s with 32 workers.
17 full problem subsolvers: [core, default_lp, fixed, lb_tree_search, max_lp, no_lp, objective_lb_search, objective_lb_search_max_lp, objective_lb_search_no_lp, objective_shaving_search_max_lp, objective_shaving_search_no_lp, probing, probing_max_lp, pseudo_costs, quick_restart, quick_restart_no_lp, reduced_costs]
13 first solution subsolvers: [fj_long_default, fj_long_lin_default, fj_long_random, fj_short_default, fj_short_lin_default, fj_short_lin_random, fj_short_random, fs_random(2), fs_random_no_lp, fs_random_quick_restart(2), fs_random_quick_restart_no_lp]
13 incomplete subsolvers: [feasibility_pump, graph_arc_lns, graph_cst_lns, graph_dec_lns, graph_var_lns, rins/rens, rnd_cst_lns, rnd_var_lns, scheduling_intervals_lns, scheduling_precedences_lns, scheduling_time_window_lns, violation_ls(2)]
3 helper subsolvers: [neighborhood_helper, synchronization_agent, update_gap_integral]
#Bound   0.59s best:inf   next:[197,5296] objective_shaving_search_max_lp (vars=306 csts=4096)
#Bound   0.73s best:inf   next:[211,5296] probing
#1       0.76s best:4162  next:[211,4161] fj_long_default(batch:1 #lin_moves:8'034 #lin_evals:42'631 #weight_updates:122)
#Bound   0.77s best:4162  next:[220,4161] probing
#2       0.83s best:4161  next:[220,4160] violation_ls(batch:1 #solutions_imported:1 #lin_moves:0 #lin_evals:3 #gen_moves:1 #gen_evals:0 #comp_moves:1 #backtracks:0 #weight_updates:0)
#3       0.83s best:4159  next:[220,4158] violation_ls(batch:2 #solutions_imported:2 #lin_moves:1 #lin_evals:8 #gen_moves:1 #gen_evals:0 #comp_moves:1 #backtracks:0 #weight_updates:0)
#4       0.83s best:4157  next:[220,4156] violation_ls(batch:1 #solutions_imported:1 #lin_moves:1 #lin_evals:4 #weight_updates:0)
#5       0.83s best:4155  next:[220,4154] violation_ls(batch:2 #solutions_imported:2 #lin_moves:1 #lin_evals:7 #gen_moves:1 #gen_evals:0 #comp_moves:1 #backtracks:0 #weight_updates:0)
#6       0.84s best:2778  next:[220,2777] rnd_var_lns (d=0.50 s=39 t=0.10 p=0.00 stall=0 h=auto_l0) [presolve]
#7       0.84s best:2121  next:[220,2120] graph_var_lns (d=0.50 s=41 t=0.10 p=0.00 stall=0 h=auto_l0) [presolve]
#Bound   0.90s best:2121  next:[262,2120] probing
#Bound   0.90s best:2121  next:[272,2120] probing
#Bound   0.94s best:2121  next:[318,2120] pseudo_costs
#Bound   0.95s best:2121  next:[319,2120] reduced_costs
#8       0.98s best:2120  next:[319,2119] violation_ls(batch:3 #solutions_imported:3 #lin_moves:1 #lin_evals:5'972 #gen_moves:2'564 #gen_evals:462 #comp_moves:276 #backtracks:1'144 #weight_updates:32)
#Bound   1.00s best:2120  next:[320,2119] reduced_costs
#9       1.11s best:2119  next:[320,2118] violation_ls(batch:4 #solutions_imported:4 #lin_moves:1 #lin_evals:13'838 #gen_moves:6'104 #gen_evals:1'121 #comp_moves:500 #backtracks:2'802 #weight_updates:89)
#10      1.11s best:2118  next:[320,2117] violation_ls(batch:4 #solutions_imported:4 #lin_moves:9'646 #lin_evals:38'563 #gen_moves:1 #gen_evals:0 #comp_moves:1 #backtracks:0 #weight_updates:473)
#Bound   1.12s best:2118  next:[331,2117] probing
#Bound   1.16s best:2118  next:[333,2117] probing
#11      1.18s best:2093  next:[333,2092] rins_pump_lns (d=0.50 s=79 t=0.10 p=0.00 stall=0 h=auto_l0)
#Bound   1.24s best:2093  next:[339,2092] objective_lb_search_no_lp
#Bound   1.33s best:2093  next:[583,2092] objective_lb_search_no_lp
#Bound   1.43s best:2093  next:[584,2092] objective_lb_search_no_lp
#12      1.44s best:2091  next:[584,2090] no_lp (fixed_bools=0/114)
#13      1.45s best:2060  next:[584,2059] no_lp (fixed_bools=0/118)
#14      1.54s best:2041  next:[584,2040] no_lp (fixed_bools=0/128)
#15      1.55s best:2024  next:[584,2023] no_lp (fixed_bools=0/135)
#Bound   1.59s best:2024  next:[586,2023] objective_lb_search_no_lp
#16      1.70s best:2020  next:[586,2019] rins_pump_lns (d=0.81 s=89 t=0.10 p=1.00 stall=1 h=auto_l0)
#17      1.73s best:2011  next:[586,2010] rins_pump_lns (d=0.81 s=92 t=0.10 p=1.00 stall=1 h=auto_l0)
#18      1.77s best:1968  next:[586,1967] rins_pump_lns (d=0.81 s=93 t=0.10 p=1.00 stall=1 h=auto_l0)
#19      1.79s best:1955  next:[586,1954] default_lp (fixed_bools=0/102)
#Bound   1.86s best:1955  next:[768,1954] objective_lb_search_no_lp
#20      1.88s best:1931  next:[768,1930] pseudo_costs (fixed_bools=0/103)
#21      2.12s best:1899  next:[768,1898] quick_restart_no_lp (fixed_bools=0/146)
#22      2.13s best:1697  next:[768,1696] scheduling_time_window_lns (d=0.50 s=57 t=0.10 p=0.00 stall=0 h=auto_l0)
#23      2.41s best:1644  next:[768,1643] scheduling_intervals_lns (d=0.50 s=69 t=0.10 p=0.00 stall=0 h=auto_l0)
#Bound   2.45s best:1644  next:[769,1643] objective_lb_search_no_lp
#Bound   2.67s best:1644  next:[770,1643] objective_lb_search
#Bound   2.72s best:1644  next:[774,1643] objective_lb_search_no_lp
#24      2.80s best:1593  next:[774,1592] quick_restart_no_lp (fixed_bools=0/310)
#25      2.83s best:1545  next:[774,1544] quick_restart_no_lp (fixed_bools=0/313)
#26      2.90s best:1494  next:[774,1493] quick_restart (fixed_bools=0/180)
#27      2.97s best:1491  next:[774,1490] scheduling_intervals_lns (d=0.50 s=102 t=0.10 p=0.00 stall=0 h=auto_l0)
#Bound   3.20s best:1491  next:[782,1490] objective_lb_search_no_lp
#28      3.49s best:1486  next:[782,1485] rnd_var_lns (d=0.98 s=157 t=0.10 p=1.00 stall=6 h=auto_l0)
#29      3.58s best:1484  next:[782,1483] violation_ls(batch:10 #solutions_imported:9 #lin_moves:9'646 #lin_evals:134'354 #gen_moves:40'785 #gen_evals:6'089 #comp_moves:2'763 #backtracks:19'006 #weight_updates:1'001)
#Bound   3.62s best:1484  next:[788,1483] objective_lb_search
#30      3.71s best:1483  next:[788,1482] quick_restart (fixed_bools=0/230)
#31      3.77s best:1473  next:[788,1472] graph_dec_lns (d=0.98 s=177 t=0.10 p=1.00 stall=8 h=auto_l0)
#32      3.83s best:1472  next:[788,1471] violation_ls(batch:11 #solutions_imported:11 #lin_moves:184 #lin_evals:112'409 #gen_moves:46'813 #gen_evals:7'514 #comp_moves:3'280 #backtracks:21'760 #weight_updates:747)
#33      3.83s best:1471  next:[788,1470] violation_ls(batch:11 #solutions_imported:10 #lin_moves:9'806 #lin_evals:135'019 #gen_moves:40'785 #gen_evals:6'089 #comp_moves:2'763 #backtracks:19'006 #weight_updates:1'068)
#Bound   3.84s best:1471  next:[792,1470] objective_lb_search_no_lp
#34      3.89s best:1446  next:[792,1445] graph_arc_lns (d=0.98 s=173 t=0.10 p=1.00 stall=8 h=auto_l0)
#Bound   3.94s best:1446  next:[793,1445] objective_lb_search_no_lp
#Bound   3.96s best:1446  next:[801,1445] objective_lb_search_max_lp
#Bound   4.01s best:1446  next:[806,1445] objective_lb_search
#Bound   5.05s best:1446  next:[902,1445] objective_lb_search_no_lp [skipped_logs=3]
#Bound   5.99s best:1446  next:[910,1445] objective_lb_search_no_lp [skipped_logs=3]
#35      6.39s best:1445  next:[917,1444] quick_restart_no_lp (fixed_bools=0/361)
#36      6.47s best:1441  next:[929,1440] quick_restart_no_lp (fixed_bools=0/374)
#37      6.49s best:1440  next:[929,1439] quick_restart_no_lp (fixed_bools=0/375)
#38      6.59s best:1439  next:[929,1438] quick_restart_no_lp (fixed_bools=0/376)
#39      6.59s best:1437  next:[929,1436] quick_restart_no_lp (fixed_bools=0/376)
#Bound   6.47s best:1445  next:[929,1444] objective_lb_search_no_lp [skipped_logs=1]
#Bound   7.90s best:1437  next:[936,1436] lb_tree_search (nodes=162/162 rc=3 decisions=1543 @root=9 restarts=1)  [skipped_logs=5]
#Bound   8.87s best:1437  next:[945,1436] lb_tree_search (nodes=172/172 rc=3 decisions=1705 @root=15 restarts=1)  [skipped_logs=8]
#Bound  10.01s best:1437  next:[952,1436] lb_tree_search (nodes=177/177 rc=3 decisions=1825 @root=20 restarts=1)  [skipped_logs=6]
#Bound  10.92s best:1437  next:[960,1436] lb_tree_search (nodes=190/190 rc=3 decisions=1989 @root=23 restarts=1)  [skipped_logs=7]
#Bound  12.82s best:1437  next:[961,1436] lb_tree_search (nodes=271/271 rc=3 decisions=2731 @root=27 restarts=2) 
#Bound  13.15s best:1437  next:[962,1436] lb_tree_search (nodes=276/276 rc=3 decisions=2782 @root=28 restarts=2) 
#Bound  13.93s best:1437  next:[967,1436] objective_lb_search [skipped_logs=1]
#Model  14.92s var:305/306 constraints:4084/4095
#Bound  14.87s best:1437  next:[972,1436] objective_lb_search_no_lp [skipped_logs=3]
#Bound  15.80s best:1437  next:[981,1436] objective_lb_search_no_lp [skipped_logs=1]
#Model  16.16s var:303/306 constraints:3969/4095
#Bound  16.75s best:1437  next:[984,1436] objective_lb_search_no_lp [skipped_logs=1]
#Bound  17.21s best:1437  next:[1013,1436] objective_lb_search [skipped_logs=1]
#Model  18.65s var:302/306 constraints:3891/4095
#Bound  18.47s best:1437  next:[1029,1436] objective_lb_search [skipped_logs=0]
#Bound  19.34s best:1437  next:[1030,1436] objective_lb_search [skipped_logs=0]
#Model  20.89s var:301/306 constraints:3860/4095
#Bound  20.73s best:1437  next:[1062,1436] objective_lb_search [skipped_logs=1]
#Bound  22.31s best:1437  next:[1064,1436] objective_lb_search_no_lp
#Bound  22.64s best:1437  next:[1065,1436] objective_lb_search [skipped_logs=0]
#Bound  23.93s best:1437  next:[1069,1436] objective_lb_search_max_lp [skipped_logs=0]
#Model  25.32s var:298/306 constraints:3520/4095
#Bound  25.61s best:1437  next:[1097,1436] objective_lb_search
#Bound  25.92s best:1437  next:[1101,1436] objective_lb_search [skipped_logs=0]
#Model  26.67s var:294/306 constraints:3383/4095
#Model  26.83s var:293/306 constraints:3333/4095
#Bound  27.00s best:1437  next:[1217,1436] objective_lb_search_no_lp [skipped_logs=6]
#Model  27.52s var:292/306 constraints:3167/4095
#Model  27.74s var:283/306 constraints:2311/4095
#Model  27.78s var:281/306 constraints:2135/4095
#Model  27.85s var:276/306 constraints:1866/4095
#Bound  27.98s best:1437  next:[1373,1436] objective_lb_search_no_lp [skipped_logs=7]
#Model  28.04s var:268/306 constraints:1343/4095
#Model  28.08s var:267/306 constraints:1236/4095
#Done   28.09s quick_restart_no_lp
#Done   28.09s pseudo_costs
#Done   28.09s objective_lb_search
#Done   28.09s core
#Model  28.09s var:265/306 constraints:1108/4095
#Bound  28.07s best:1437  next:[1386,1436] objective_lb_search_no_lp [skipped_logs=1]

Task timing                                  n [     min,      max]      avg      dev     time         n [     min,      max]      avg      dev    dtime
                             'core':         1 [  27.63s,   27.63s]   27.63s   0.00ns   27.63s         1 [  18.12s,   18.12s]   18.12s   0.00ns   18.12s
                       'default_lp':         1 [  27.63s,   27.63s]   27.63s   0.00ns   27.63s         1 [   6.13s,    6.13s]    6.13s   0.00ns    6.13s
                 'feasibility_pump':        66 [104.52ms, 719.67ms] 138.86ms  78.70ms    9.16s        65 [ 19.87ms,  69.09ms]  25.54ms   5.49ms    1.66s
                            'fixed':         1 [  27.63s,   27.63s]   27.63s   0.00ns   27.63s         1 [   4.92s,    4.92s]    4.92s   0.00ns    4.92s
                  'fj_long_default':         1 [302.59ms, 302.59ms] 302.59ms   0.00ns 302.59ms         1 [ 82.75ms,  82.75ms]  82.75ms   0.00ns  82.75ms
              'fj_long_lin_default':         2 [ 76.48ms, 183.53ms] 130.01ms  53.52ms 260.02ms         2 [ 87.71ms,  92.74ms]  90.22ms   2.51ms 180.45ms
                   'fj_long_random':         1 [435.17ms, 435.17ms] 435.17ms   0.00ns 435.17ms         1 [ 93.48ms,  93.48ms]  93.48ms   0.00ns  93.48ms
                 'fj_short_default':         1 [340.19ms, 340.19ms] 340.19ms   0.00ns 340.19ms         1 [ 92.62ms,  92.62ms]  92.62ms   0.00ns  92.62ms
             'fj_short_lin_default':         2 [ 69.25ms,  84.24ms]  76.75ms   7.49ms 153.49ms         2 [ 84.26ms,  85.98ms]  85.12ms 861.10us 170.25ms
              'fj_short_lin_random':         1 [787.87ms, 787.87ms] 787.87ms   0.00ns 787.87ms         1 [ 85.95ms,  85.95ms]  85.95ms   0.00ns  85.95ms
                  'fj_short_random':         2 [ 77.05ms, 252.39ms] 164.72ms  87.67ms 329.43ms         2 [ 86.84ms,  87.81ms]  87.32ms 483.19us 174.65ms
                        'fs_random':         1 [302.61ms, 302.61ms] 302.61ms   0.00ns 302.61ms         1 [562.54us, 562.54us] 562.54us   0.00ns 562.54us
                        'fs_random':         1 [350.21ms, 350.21ms] 350.21ms   0.00ns 350.21ms         1 [ 20.00ns,  20.00ns]  20.00ns   0.00ns  20.00ns
                  'fs_random_no_lp':         1 [720.48ms, 720.48ms] 720.48ms   0.00ns 720.48ms         0 [  0.00ns,   0.00ns]   0.00ns   0.00ns   0.00ns
          'fs_random_quick_restart':         1 [333.58ms, 333.58ms] 333.58ms   0.00ns 333.58ms         1 [ 20.00ns,  20.00ns]  20.00ns   0.00ns  20.00ns
          'fs_random_quick_restart':         1 [333.76ms, 333.76ms] 333.76ms   0.00ns 333.76ms         1 [ 20.08us,  20.08us]  20.08us   0.00ns  20.08us
    'fs_random_quick_restart_no_lp':         1 [657.99ms, 657.99ms] 657.99ms   0.00ns 657.99ms         0 [  0.00ns,   0.00ns]   0.00ns   0.00ns   0.00ns
                    'graph_arc_lns':        66 [  7.81ms,    1.04s] 522.45ms 327.87ms   34.48s        63 [ 10.00ns, 101.07ms]  52.43ms  43.40ms    3.30s
                    'graph_cst_lns':        66 [  2.82ms,    1.31s] 322.14ms 375.16ms   21.26s        41 [ 10.00ns, 100.59ms]  49.57ms  44.71ms    2.03s
                    'graph_dec_lns':        66 [ 26.86ms,    1.19s] 524.49ms 340.73ms   34.62s        65 [ 10.00ns, 100.30ms]  50.71ms  43.10ms    3.30s
                    'graph_var_lns':        66 [  3.89ms,    1.27s] 499.22ms 356.75ms   32.95s        61 [ 10.00ns, 101.12ms]  54.40ms  45.52ms    3.32s
                   'lb_tree_search':         1 [  27.63s,   27.63s]   27.63s   0.00ns   27.63s         1 [   9.42s,    9.42s]    9.42s   0.00ns    9.42s
                           'max_lp':         1 [  27.63s,   27.63s]   27.63s   0.00ns   27.63s         1 [   6.94s,    6.94s]    6.94s   0.00ns    6.94s
                            'no_lp':         1 [  27.63s,   27.63s]   27.63s   0.00ns   27.63s         1 [   4.30s,    4.30s]    4.30s   0.00ns    4.30s
              'objective_lb_search':         1 [  27.63s,   27.63s]   27.63s   0.00ns   27.63s         1 [   7.10s,    7.10s]    7.10s   0.00ns    7.10s
       'objective_lb_search_max_lp':         1 [  27.63s,   27.63s]   27.63s   0.00ns   27.63s         1 [   8.30s,    8.30s]    8.30s   0.00ns    8.30s
        'objective_lb_search_no_lp':         1 [  27.63s,   27.63s]   27.63s   0.00ns   27.63s         1 [   3.94s,    3.94s]    3.94s   0.00ns    3.94s
  'objective_shaving_search_max_lp':        67 [  4.54ms,    1.68s] 330.64ms 393.42ms   22.15s        51 [570.51us, 304.50ms]  42.22ms  77.56ms    2.15s
   'objective_shaving_search_no_lp':        67 [  4.65ms,    1.71s] 326.21ms 391.08ms   21.86s        55 [104.56us, 215.37ms]  32.15ms  53.47ms    1.77s
                          'probing':         1 [  27.65s,   27.65s]   27.65s   0.00ns   27.65s         1 [   2.77s,    2.77s]    2.77s   0.00ns    2.77s
                   'probing_max_lp':         1 [  27.63s,   27.63s]   27.63s   0.00ns   27.63s         1 [   3.67s,    3.67s]    3.67s   0.00ns    3.67s
                     'pseudo_costs':         1 [  27.63s,   27.63s]   27.63s   0.00ns   27.63s         1 [   6.70s,    6.70s]    6.70s   0.00ns    6.70s
                    'quick_restart':         1 [  27.63s,   27.63s]   27.63s   0.00ns   27.63s         1 [   7.69s,    7.69s]    7.69s   0.00ns    7.69s
              'quick_restart_no_lp':         1 [  27.63s,   27.63s]   27.63s   0.00ns   27.63s         1 [   4.81s,    4.81s]    4.81s   0.00ns    4.81s
                    'reduced_costs':         1 [  27.63s,   27.63s]   27.63s   0.00ns   27.63s         1 [   6.83s,    6.83s]    6.83s   0.00ns    6.83s
                        'rins/rens':        67 [  5.13ms,    1.29s] 486.98ms 364.53ms   32.63s        56 [ 10.00ns, 100.52ms]  64.88ms  40.17ms    3.63s
                      'rnd_cst_lns':        66 [  6.65ms,    1.08s] 477.07ms 333.56ms   31.49s        57 [ 10.00ns, 102.13ms]  53.43ms  43.07ms    3.05s
                      'rnd_var_lns':        67 [  4.66ms,    1.40s] 509.60ms 332.41ms   34.14s        65 [ 10.00ns, 100.73ms]  50.21ms  43.39ms    3.26s
         'scheduling_intervals_lns':        66 [  1.96ms,    2.00s] 895.81ms 389.20ms   59.12s        59 [ 14.53ms, 100.42ms]  97.13ms  12.63ms    5.73s
       'scheduling_precedences_lns':        66 [  1.93ms,    1.85s] 896.84ms 413.08ms   59.19s        58 [ 14.53ms, 100.39ms]  96.36ms  15.31ms    5.59s
       'scheduling_time_window_lns':        66 [  1.78ms,    2.25s] 865.29ms 359.71ms   57.11s        59 [ 24.12ms, 100.42ms]  97.15ms  12.03ms    5.73s
                     'violation_ls':        66 [998.35us, 191.66ms]  71.59ms  42.97ms    4.73s        66 [670.00ns, 312.55ms]  72.80ms  73.80ms    4.80s
                     'violation_ls':        67 [  1.06ms, 189.77ms]  86.53ms  33.43ms    5.80s        67 [580.00ns,  98.49ms]  80.22ms  22.53ms    5.38s

Search stats                        Bools  Conflicts  Branches  Restarts  BoolPropag  IntegerPropag
                           'core':  4'512      7'567    41'420     8'331  14'921'603     10'166'205
                     'default_lp':    596      6'758    34'365     4'929   1'530'892      9'242'396
                          'fixed':    784     30'227    32'586       158   3'632'331     12'999'410
                      'fs_random':     79          0       118       118           0          3'904
                      'fs_random':     79          0       158       158           0          5'069
                'fs_random_no_lp':     79          0         0         0           0              0
        'fs_random_quick_restart':     79          0       118       118           0          3'904
        'fs_random_quick_restart':     79          0       158       158           0          5'069
  'fs_random_quick_restart_no_lp':     79          0         0         0           0              0
                 'lb_tree_search':     89         69    36'716    13'956      91'429      3'812'354
                         'max_lp':     79      5'305    33'895     4'917     218'619      8'569'670
                          'no_lp':    926     14'488    40'730     4'455   3'322'262     14'283'561
            'objective_lb_search':    137      4'500    33'327     7'621     235'187      7'825'575
     'objective_lb_search_max_lp':    132      3'333    36'843    10'411     210'711      7'158'592
      'objective_lb_search_no_lp':    220     12'614    34'095     4'223     428'761     13'613'161
                        'probing':    291         72       511       511       6'052         55'959
                 'probing_max_lp':    211         16       406       406       3'145         39'662
                   'pseudo_costs':    300      5'788    38'902     6'659     858'539      9'437'084
                  'quick_restart':    941      4'881    40'311     5'435   1'966'078      7'703'357
            'quick_restart_no_lp':  1'326     15'746    54'482     5'033   5'064'977     13'138'447
                  'reduced_costs':    813      6'924    47'151     6'960   2'613'526      8'929'759

SAT stats                           ClassicMinim  LitRemoved  LitLearned  LitForgotten  Subsumed  MClauses  MDecisions  MLitTrue  MSubsumed  MLitRemoved  MReused
                           'core':         6'339      28'980      31'966             0       110     3'519      17'557         0          5           20       52
                     'default_lp':         4'096       9'558      61'949             0       335     2'272      21'662        18        852        5'287      472
                          'fixed':        15'590      54'677     514'777             0        93         0           0         0          0            0        0
                      'fs_random':             0           0           0             0         0         0           0         0          0            0        0
                      'fs_random':             0           0           0             0         0         0           0         0          0            0        0
                'fs_random_no_lp':             0           0           0             0         0         0           0         0          0            0        0
        'fs_random_quick_restart':             0           0           0             0         0         0           0         0          0            0        0
        'fs_random_quick_restart':             0           0           0             0         0         0           0         0          0            0        0
  'fs_random_quick_restart_no_lp':             0           0           0             0         0         0           0         0          0            0        0
                 'lb_tree_search':             3           4         209             0         0     3'858      19'030         0          6           26      470
                         'max_lp':         2'811       5'758      46'214             0       331     2'509      26'705         0        845        5'683      478
                          'no_lp':        10'626      31'030     123'780        41'291       347     2'280      18'647         1      1'366        9'405      360
            'objective_lb_search':         2'924       6'420      28'840             0       298     2'914      24'390         0        646        3'784      779
     'objective_lb_search_max_lp':         2'095       4'410      22'245             0       241     3'130      26'242         1        483        2'801      930
      'objective_lb_search_no_lp':         9'181      24'026      85'084             0       543     1'940      17'402         0        762        4'825      534
                        'probing':             0           0          72             0         0         0           0         0          0            0        0
                 'probing_max_lp':             0           0          16             0         0         0           0         0          0            0        0
                   'pseudo_costs':         3'322       7'390      48'997             0       345     3'060      28'195         0        760        4'766      685
                  'quick_restart':         2'846       8'484      41'901             0       171     2'912      28'871         0      1'253        8'903      713
            'quick_restart_no_lp':        10'043      36'986     150'414             0       172     2'269      20'403         0      1'440       10'862      383
                  'reduced_costs':         4'236      10'270      65'082             0       227     2'902      22'714         0      1'300        8'202      381

Lp stats                         Component  Iterations  AddedCuts  OPTIMAL  DUAL_F.  DUAL_U.
                  'default_lp':          1     103'864      6'619   10'914        0        1
                       'fixed':          1       5'963      1'030   29'941        0        0
                   'fs_random':          1           0          0        0        0        0
                   'fs_random':          1         216        370        7        0        0
     'fs_random_quick_restart':          1           0          0        0        0        0
     'fs_random_quick_restart':          1          95        157        3        0        0
              'lb_tree_search':          1     163'504      5'335    6'200    2'173        0
                      'max_lp':          1     104'744      6'097    6'984    2'516        2
         'objective_lb_search':          1     127'134      5'100    8'140        0        1
  'objective_lb_search_max_lp':          1     131'889      4'925    5'047    1'593        2
                     'probing':          1      19'383      3'891    1'658        0        8
              'probing_max_lp':          1      10'903      3'555    1'173       82        0
                'pseudo_costs':          1     109'163      6'234    7'997    2'683        5
               'quick_restart':          1     118'392      5'657    8'671        0        1
               'reduced_costs':          1     104'023      9'424    8'607    2'670        7

Lp dimension                                                                      Final dimension of first component
                  'default_lp':   625 rows, 302 columns, 2324 entries with magnitude in [3.825281e-03, 1.000000e+00]
                       'fixed':    187 rows, 302 columns, 693 entries with magnitude in [3.141366e-02, 1.000000e+00]
                   'fs_random':        0 rows, 302 columns, 0 entries with magnitude in [0.000000e+00, 0.000000e+00]
                   'fs_random':    194 rows, 302 columns, 701 entries with magnitude in [1.875340e-02, 1.000000e+00]
     'fs_random_quick_restart':        0 rows, 302 columns, 0 entries with magnitude in [0.000000e+00, 0.000000e+00]
     'fs_random_quick_restart':    144 rows, 302 columns, 545 entries with magnitude in [8.451543e-02, 1.000000e+00]
              'lb_tree_search':   804 rows, 306 columns, 1988 entries with magnitude in [1.085942e-03, 1.000000e+00]
                      'max_lp':   924 rows, 306 columns, 1857 entries with magnitude in [1.833397e-03, 1.000000e+00]
         'objective_lb_search':   500 rows, 302 columns, 1627 entries with magnitude in [1.296392e-03, 1.000000e+00]
  'objective_lb_search_max_lp':   854 rows, 306 columns, 2277 entries with magnitude in [2.587904e-03, 1.000000e+00]
                     'probing':   491 rows, 302 columns, 2367 entries with magnitude in [2.025170e-03, 1.000000e+00]
              'probing_max_lp':   480 rows, 306 columns, 2463 entries with magnitude in [3.755200e-03, 1.000000e+00]
                'pseudo_costs':   581 rows, 306 columns, 2321 entries with magnitude in [1.347144e-03, 1.000000e+00]
               'quick_restart':   613 rows, 302 columns, 1954 entries with magnitude in [2.002672e-03, 1.000000e+00]
               'reduced_costs':  1232 rows, 306 columns, 1883 entries with magnitude in [6.371198e-03, 1.000000e+00]

Lp debug                         CutPropag  CutEqPropag  Adjust  Overflow        Bad  BadScaling
                  'default_lp':          0           23   3'407         0    106'777           0
                       'fixed':          0            0       1         0      2'317           0
                   'fs_random':          0            0       0         0          0           0
                   'fs_random':          0            0       0         0        549           0
     'fs_random_quick_restart':          0            0       0         0          0           0
     'fs_random_quick_restart':          0            0       0         0        104           0
              'lb_tree_search':         33            4   4'635         0    203'382           0
                      'max_lp':         25            2   3'762         0    138'581           0
         'objective_lb_search':         25            4   3'031         0    182'347           0
  'objective_lb_search_max_lp':         43            1   4'525         0    162'169           0
                     'probing':          0            4   1'115         0  1'815'344           0
              'probing_max_lp':          9            6   1'102         0  1'363'844           0
                'pseudo_costs':         14            0   3'434         0    101'491           0
               'quick_restart':         41            6   4'017         0    341'926           0
               'reduced_costs':         24            1   4'040         0    146'149           0

Lp pool                          Constraints  Updates  Simplif  Merged  Shortened   Split  Strenghtened     Cuts/Call
                  'default_lp':        6'878      204   10'689      44      2'068   2'596         4'273  6'619/19'718
                       'fixed':        1'333       12        0       0          0      16           116   1'030/1'619
                   'fs_random':          303        0        0       0          0       0            14           0/0
                   'fs_random':          673        1        0       0          0       0            44       370/662
     'fs_random_quick_restart':          303        0        0       0          0       0            14           0/0
     'fs_random_quick_restart':          460        0        0       0          0       0            19       157/268
              'lb_tree_search':        9'403      345   99'767      21     15'653   2'189        35'144  5'335/14'569
                      'max_lp':       10'148      452  149'717      38     18'122   1'619        44'598  6'097/15'458
         'objective_lb_search':        5'393      406   39'617      10      5'445   4'068         5'352  5'100/14'414
  'objective_lb_search_max_lp':        8'988      410  111'206      26     14'706   2'077        39'008  4'925/12'829
                     'probing':        4'190      415    6'592       4        624   2'608         1'540   3'891/7'343
              'probing_max_lp':        7'640      218    4'930       4      2'365     479         7'432   3'555/7'260
                'pseudo_costs':       10'296      139   24'573      27      3'536   1'568        16'188  6'234/16'231
               'quick_restart':        5'941      721  126'679      19      6'565  11'727        10'320  5'657/15'703
               'reduced_costs':       13'451      465  156'528      62     21'470   2'835        46'654  9'424/24'460

Lp Cut                                                fs_ran  fs_ran  defaul  fixed  max_lp  quick_  reduce  pseudo  lb_tre  probin  object  probin  object
                                              CG_FF:      24      11     269     93     207     141     434     141     197     127     160     127     121
                                               CG_K:      17       8     179     51     168      81     354     101     135      62      62     102      75
                                               CG_R:      12       7     172     56     170     129     346      76     144      61      87     110      74
                                              CG_RB:      11       1     731    143     545     472     843     418     274     414     669     220     295
                                             CG_RBP:       2       -      81     24      50      54      95      32      27      32      56      20      28
                                             Clique:       -       -       -      -     100       -      93      73      99       -       -      44     102
                                                 IB:     130      50   1'105    252     658   1'089     996     934     641     813   1'015     241     825
                                           MIR_1_FF:      57      38     371     89     401     336     491     341     364     230     272     270     262
                                            MIR_1_K:       3       -      46      5      63      43     100      61      53      14      28      23      33
                                           MIR_1_KL:       1       -       9      3       1       3       4       -       5       1       1       -       -
                                            MIR_1_R:      15      11      74     21      31      47      82      39      28      28      35      27      19
                                           MIR_1_RB:      27      12     699     68     809     622   1'140     851     737     413     521     513     563
                                          MIR_1_RBP:       -       -      75      6     143      43     222     142     111      23      46     101      85
                                           MIR_2_FF:      15       6     173     36     182     147     315     201     183      80     116     120     112
                                            MIR_2_K:       1       1      29      5      40      27      66      33      33      14      15      13      21
                                           MIR_2_KL:       1       -       6      -       -       2       3       -       2       1       3       -       -
                                            MIR_2_R:       6       2      51     15      38      45      64      46      49      31      42      44      32
                                           MIR_2_RB:       8       -     397     31     345     333     545     386     319     213     283     173     285
                                          MIR_2_RBP:       -       -      66      5      38      39     100      69      44      15      36      20      29
                                           MIR_3_FF:       2       -     130      7     105      95     190     138      91      45      79      61      86
                                            MIR_3_K:       3       -      20      3      20      28      51      33      27       6      17      10      16
                                           MIR_3_KL:       -       -       3      -       -       2       2       -       1       1       1       -       1
                                            MIR_3_R:       3       -      49      1      40      47      75      41      41      18      45      32      44
                                           MIR_3_RB:       7       -     267     16     199     246     346     271     184     143     196      98     161
                                          MIR_3_RBP:       1       -      43      4      32      39      61      49      22      12      22      10      30
                                           MIR_4_FF:       1       1      92      5      76      70     152      96      64      38      56      41      64
                                            MIR_4_K:       -       -      34      1      27      18      46      21      16       7       9       5      14
                                           MIR_4_KL:       -       -       1      1       -       1       1       2       -       2       -       -       -
                                            MIR_4_R:       -       -      52      3      43      42      69      52      45      16      43      23      37
                                           MIR_4_RB:       1       1     187      9     138     166     248     183     122      84     118      66      99
                                          MIR_4_RBP:       -       -      33      1      17      15      39      29      14       5      15       5      16
                                           MIR_5_FF:       -       -      75      2      67      68     110      70      43      47      52      26      53
                                            MIR_5_K:       -       -      20      -      17       8      30      12      13      10      14       3      17
                                           MIR_5_KL:       -       -       4      -       -       1       1       -       -       3       -       1       -
                                            MIR_5_R:       -       -      45      1      21      39      53      24      33      14      37      14      29
                                           MIR_5_RB:       -       -     152      4      93     117     168     126      98      68     116      65      84
                                          MIR_5_RBP:       -       -      13      -       4       3      24      20       6       4       7       3       5
                                           MIR_6_FF:       -       -      27      1      39      29      59      31      23      24      22      10      19
                                            MIR_6_K:       -       -      11      -      17      18      13      11       6       4      12       5       3
                                           MIR_6_KL:       -       -       1      -       1       -       -       -       -       1       -       -       -
                                            MIR_6_R:       -       -      18      1      21      18      19      17      12       9      21       9       9
                                           MIR_6_RB:       -       -      65      -      44      59      81      60      43      33      44      13      27
                                          MIR_6_RBP:       -       -      10      -       4       4      15      11       3       3       4       2       1
         NoOverlapCompletionTimeExhaustive_weighted:       -       -       -      -       7       -      20      11       6       -       -       4      11
  NoOverlapCompletionTimeExhaustive_weighted_lifted:       -       -       -      -       2       -       2       1       2       -       -       -       1
                        NoOverlapDisjunctionOnStart:       -       -       -      -       9       -      14       8       9       -       -       5       7
                                       ZERO_HALF_FF:       7       3      77     13      62      33     100      90      34      28      30      18      41
                                        ZERO_HALF_K:       -       -      24      1      20       7      35      21      14       3       -       1      13
                                        ZERO_HALF_R:       8       2     422     22     746     607     710     566     718     522     545     757     897
                                       ZERO_HALF_RB:       6       3     170     20     202     160     344     238     178     122     108      79     152
                                      ZERO_HALF_RBP:       1       -      41     11      35      64      53      58      22      47      40      21      27

LNS stats                        Improv/Calls  Closed  Difficulty  TimeLimit
               'graph_arc_lns':          4/65     60%        0.99       0.10
               'graph_cst_lns':          6/46     65%        0.99       0.10
               'graph_dec_lns':          2/65     63%        1.00       0.10
               'graph_var_lns':          8/66     58%        0.99       0.10
                   'rins/rens':         15/66     56%        0.95       0.10
                 'rnd_cst_lns':          6/63     59%        0.99       0.10
                 'rnd_var_lns':          6/66     61%        0.99       0.10
    'scheduling_intervals_lns':         15/65     18%        0.00       0.10
  'scheduling_precedences_lns':         16/65     20%        0.00       0.10
  'scheduling_time_window_lns':         14/65     17%        0.00       0.10

LS stats                   Batches  Restarts  LinMoves  GenMoves  CompoundMoves  WeightUpdates
       'fj_long_default':        1         1     8'034         0              0            122
   'fj_long_lin_default':        2         1         0     4'298            446              2
        'fj_long_random':        1         1     9'820         0              0            180
      'fj_short_default':        1         1         0     2'302            272              0
  'fj_short_lin_default':        2         1         0     4'008            615              1
   'fj_short_lin_random':        1         1         0     1'982            241              0
       'fj_short_random':        2         1         0     4'115            522              1
          'violation_ls':       66         0   294'275    40'785          2'763        264'981
          'violation_ls':       67         0       184   215'800         19'776          1'015

Solutions (39)                   Num     Rank
                  'default_lp':    1  [19,19]
             'fj_long_default':    1    [1,1]
               'graph_arc_lns':    1  [34,34]
               'graph_dec_lns':    1  [31,31]
               'graph_var_lns':    1    [7,7]
                       'no_lp':    4  [12,15]
                'pseudo_costs':    1  [20,20]
               'quick_restart':    2  [26,30]
         'quick_restart_no_lp':    8  [21,39]
               'rins_pump_lns':    4  [11,18]
                 'rnd_var_lns':    2   [6,28]
    'scheduling_intervals_lns':    2  [23,27]
  'scheduling_time_window_lns':    1  [22,22]
                'violation_ls':   10   [2,33]

Objective bounds                      Num
                   'initial_domain':    1
                   'lb_tree_search':   35
              'objective_lb_search':   12
       'objective_lb_search_max_lp':    2
        'objective_lb_search_no_lp':   44
  'objective_shaving_search_max_lp':    1
   'objective_shaving_search_no_lp':    1
                          'probing':    6
                     'pseudo_costs':    1
                    'reduced_costs':    2

Solution repositories    Added  Queried  Ignored  Synchro
  'feasible solutions':    600    1'505        2      569
        'lp solutions':    268       34        0      211
                'pump':  1'349       33

Improving bounds shared            Num
                        'core':     32
                  'default_lp':     19
              'lb_tree_search':     65
                      'max_lp':    438
                       'no_lp':    236
         'objective_lb_search':     38
  'objective_lb_search_max_lp':     87
   'objective_lb_search_no_lp':     58
                     'probing':    140
              'probing_max_lp':     21
                'pseudo_costs':     52
               'quick_restart':    239
         'quick_restart_no_lp':  1'566
               'reduced_costs':    224

Clauses shared                   Num
                        'core':    1
                  'default_lp':   23
              'lb_tree_search':   27
                      'max_lp':   18
                       'no_lp':   45
         'objective_lb_search':    7
  'objective_lb_search_max_lp':   33
   'objective_lb_search_no_lp':   10
                'pseudo_costs':   26
               'quick_restart':    8
         'quick_restart_no_lp':   15
               'reduced_costs':   26

CpSolverResponse summary:
status: OPTIMAL
objective: 1437
best_bound: 1437
integers: 303
booleans: 79
conflicts: 0
branches: 158
propagations: 0
integer_propagations: 5069
restarts: 158
lp_iterations: 216
walltime: 28.1896
usertime: 28.1896
deterministic_time: 157.262
gap_integral: 354.206
solution_fingerprint: 0xdaadd515b36cb821


--- Simulation Gantt  partir du modle mathmatique ---
