created virtual environment CPython3.12.4.final.0-64 in 15987ms
  creator CPython3Posix(dest=/localscratch/aneumann.63393235.0/env, clear=False, no_vcs_ignore=False, global=False)
  seeder FromAppData(download=False, pip=bundle, via=copy, app_data_dir=/home/aneumann/.local/share/virtualenv)
    added seed packages: pip==25.1.1
  activators BashActivator,CShellActivator,FishActivator,NushellActivator,PowerShellActivator,PythonActivator
Looking in links: /cvmfs/soft.computecanada.ca/custom/python/wheelhouse/gentoo2023/x86-64-v3, /cvmfs/soft.computecanada.ca/custom/python/wheelhouse/gentoo2023/generic, /cvmfs/soft.computecanada.ca/custom/python/wheelhouse/generic
Requirement already satisfied: pip in /localscratch/aneumann.63393235.0/env/lib/python3.12/site-packages (25.1.1)
Looking in links: /cvmfs/soft.computecanada.ca/custom/python/wheelhouse/gentoo2023/x86-64-v3, /cvmfs/soft.computecanada.ca/custom/python/wheelhouse/gentoo2023/generic, /cvmfs/soft.computecanada.ca/custom/python/wheelhouse/generic
ERROR: protobuf-5.28.3-cp38-abi3-manylinux2014_x86_64.whl is not a supported wheel on this platform.
Looking in links: /cvmfs/soft.computecanada.ca/custom/python/wheelhouse/gentoo2023/x86-64-v3, /cvmfs/soft.computecanada.ca/custom/python/wheelhouse/gentoo2023/generic, /cvmfs/soft.computecanada.ca/custom/python/wheelhouse/generic
Processing /home/aneumann/projects/def-adhaj/aneumann/GNRS/wheels/immutabledict-4.2.0-py3-none-any.whl
Installing collected packages: immutabledict
Successfully installed immutabledict-4.2.0
Looking in links: /cvmfs/soft.computecanada.ca/custom/python/wheelhouse/gentoo2023/x86-64-v3, /cvmfs/soft.computecanada.ca/custom/python/wheelhouse/gentoo2023/generic, /cvmfs/soft.computecanada.ca/custom/python/wheelhouse/generic
Processing /cvmfs/soft.computecanada.ca/custom/python/wheelhouse/generic/ortools-9.10.4067+computecanada-cp312-cp312-linux_x86_64.whl (from -r /home/aneumann/projects/def-adhaj/aneumann/GNRS/requirements/or.txt (line 1))
Processing /cvmfs/soft.computecanada.ca/custom/python/wheelhouse/gentoo2023/x86-64-v3/matplotlib-3.10.0+computecanada-cp312-cp312-linux_x86_64.whl (from -r /home/aneumann/projects/def-adhaj/aneumann/GNRS/requirements/or.txt (line 2))
Processing /cvmfs/soft.computecanada.ca/custom/python/wheelhouse/gentoo2023/x86-64-v3/pandas-2.2.3+computecanada-cp312-cp312-linux_x86_64.whl (from -r /home/aneumann/projects/def-adhaj/aneumann/GNRS/requirements/or.txt (line 3))
Processing /cvmfs/soft.computecanada.ca/custom/python/wheelhouse/generic/absl_py-2.2.2+computecanada-py3-none-any.whl (from ortools<9.11,>=9.10->-r /home/aneumann/projects/def-adhaj/aneumann/GNRS/requirements/or.txt (line 1))
Processing /cvmfs/soft.computecanada.ca/custom/python/wheelhouse/gentoo2023/generic/numpy-2.2.2+computecanada-cp312-cp312-linux_x86_64.whl (from ortools<9.11,>=9.10->-r /home/aneumann/projects/def-adhaj/aneumann/GNRS/requirements/or.txt (line 1))
Processing /cvmfs/soft.computecanada.ca/custom/python/wheelhouse/gentoo2023/x86-64-v3/protobuf-6.30.2+computecanada-cp312-cp312-linux_x86_64.whl (from ortools<9.11,>=9.10->-r /home/aneumann/projects/def-adhaj/aneumann/GNRS/requirements/or.txt (line 1))
Requirement already satisfied: immutabledict>=3.0.0 in /localscratch/aneumann.63393235.0/env/lib/python3.12/site-packages (from ortools<9.11,>=9.10->-r /home/aneumann/projects/def-adhaj/aneumann/GNRS/requirements/or.txt (line 1)) (4.2.0)
Processing /cvmfs/soft.computecanada.ca/custom/python/wheelhouse/gentoo2023/generic/contourpy-1.3.1+computecanada-cp312-cp312-linux_x86_64.whl (from matplotlib->-r /home/aneumann/projects/def-adhaj/aneumann/GNRS/requirements/or.txt (line 2))
Processing /cvmfs/soft.computecanada.ca/custom/python/wheelhouse/generic/cycler-0.12.1+computecanada-py3-none-any.whl (from matplotlib->-r /home/aneumann/projects/def-adhaj/aneumann/GNRS/requirements/or.txt (line 2))
Processing /cvmfs/soft.computecanada.ca/custom/python/wheelhouse/generic/fonttools-4.58.2+computecanada-cp312-cp312-linux_x86_64.whl (from matplotlib->-r /home/aneumann/projects/def-adhaj/aneumann/GNRS/requirements/or.txt (line 2))
Processing /cvmfs/soft.computecanada.ca/custom/python/wheelhouse/gentoo2023/x86-64-v3/kiwisolver-1.4.8+computecanada-cp312-cp312-linux_x86_64.whl (from matplotlib->-r /home/aneumann/projects/def-adhaj/aneumann/GNRS/requirements/or.txt (line 2))
Processing /cvmfs/soft.computecanada.ca/custom/python/wheelhouse/generic/packaging-25.0+computecanada-py3-none-any.whl (from matplotlib->-r /home/aneumann/projects/def-adhaj/aneumann/GNRS/requirements/or.txt (line 2))
Processing /cvmfs/soft.computecanada.ca/custom/python/wheelhouse/gentoo2023/x86-64-v3/pillow-11.1.0+computecanada-cp312-cp312-linux_x86_64.whl (from matplotlib->-r /home/aneumann/projects/def-adhaj/aneumann/GNRS/requirements/or.txt (line 2))
Processing /cvmfs/soft.computecanada.ca/custom/python/wheelhouse/generic/pyparsing-3.2.1+computecanada-py3-none-any.whl (from matplotlib->-r /home/aneumann/projects/def-adhaj/aneumann/GNRS/requirements/or.txt (line 2))
Processing /cvmfs/soft.computecanada.ca/custom/python/wheelhouse/generic/python_dateutil-2.9.0.post0+computecanada-py2.py3-none-any.whl (from matplotlib->-r /home/aneumann/projects/def-adhaj/aneumann/GNRS/requirements/or.txt (line 2))
Processing /cvmfs/soft.computecanada.ca/custom/python/wheelhouse/generic/pytz-2025.2+computecanada-py2.py3-none-any.whl (from pandas->-r /home/aneumann/projects/def-adhaj/aneumann/GNRS/requirements/or.txt (line 3))
Processing /cvmfs/soft.computecanada.ca/custom/python/wheelhouse/generic/tzdata-2025.2+computecanada-py2.py3-none-any.whl (from pandas->-r /home/aneumann/projects/def-adhaj/aneumann/GNRS/requirements/or.txt (line 3))
Processing /cvmfs/soft.computecanada.ca/custom/python/wheelhouse/generic/six-1.17.0+computecanada-py2.py3-none-any.whl (from python-dateutil>=2.7->matplotlib->-r /home/aneumann/projects/def-adhaj/aneumann/GNRS/requirements/or.txt (line 2))
Installing collected packages: pytz, tzdata, six, pyparsing, protobuf, pillow, packaging, numpy, kiwisolver, fonttools, cycler, absl-py, python-dateutil, contourpy, pandas, matplotlib, ortools

Successfully installed absl-py-2.2.2+computecanada contourpy-1.3.1+computecanada cycler-0.12.1+computecanada fonttools-4.58.2+computecanada kiwisolver-1.4.8+computecanada matplotlib-3.10.0+computecanada numpy-2.2.2+computecanada ortools-9.10.4067+computecanada packaging-25.0+computecanada pandas-2.2.3+computecanada pillow-11.1.0+computecanada protobuf-6.30.2+computecanada pyparsing-3.2.1+computecanada python-dateutil-2.9.0.post0+computecanada pytz-2025.2+computecanada six-1.17.0+computecanada tzdata-2025.2+computecanada

Starting CP-SAT solver v9.10.4067
Parameters: max_time_in_seconds: 3600 max_memory_in_mb: 12000 log_search_progress: true enumerate_all_solutions: false absolute_gap_limit: 0 relative_gap_limit: 0
Setting number of workers to 48

Initial optimization model '': (model_fingerprint: 0x509147cccd7ab72b)
#Variables: 370 (#ints: 9 in objective)
  - 269 Booleans in [0,1]
  - 101 in [0,762]
#kLinear1: 47
#kLinear2: 676
#kLinear3: 202
#kLinearN: 3'786 (#terms: 61'115)

Starting presolve at 0.00s
  3.71e-03s  0.00e+00d  [DetectDominanceRelations] 
  7.84e-02s  0.00e+00d  [PresolveToFixPoint] #num_loops=6 #num_dual_strengthening=3 
  4.27e-05s  0.00e+00d  [ExtractEncodingFromLinear] #potential_supersets=1 
[Symmetry] Graph for symmetry has 4'587 nodes and 47'267 arcs.
[Symmetry] Symmetry computation done. time: 0.00420344 dtime: 0.00399834
[Symmetry] #generators: 1, average support size: 18
[Symmetry] The model contains 420 duplicate constraints !
[Symmetry] 9 orbits with sizes: 2,2,2,2,2,2,2,2,2
[Symmetry] Num fixable by intersecting at_most_one with orbits: 1 largest_orbit: 2
  2.12e-02s  2.69e-03d  [Probe] #probed=382 #fixed_bools=5 #new_bounds=28 #equiv=1 
  4.67e-05s  0.00e+00d  [MaxClique] Merged 6(12 literals) into 3(6 literals) at_most_ones. 
  3.61e-03s  0.00e+00d  [DetectDominanceRelations] 
  4.28e-02s  0.00e+00d  [PresolveToFixPoint] #num_loops=4 #num_dual_strengthening=3 
  1.33e-02s  0.00e+00d  [ProcessAtMostOneAndLinear] 
  5.04e-03s  0.00e+00d  [DetectDuplicateConstraints] #duplicates=486 #without_enforcements=128 
  4.57e-03s  1.99e-04d  [DetectDominatedLinearConstraints] #relevant_constraints=3'156 #num_inclusions=1'662 #num_redundant=2 
  5.88e-04s  0.00e+00d  [DetectDifferentVariables] #different=40 
  7.64e-04s  0.00e+00d  [ProcessSetPPC] #relevant_constraints=2'672 
  3.65e-05s  0.00e+00d  [FindAlmostIdenticalLinearConstraints] 
  1.76e-05s  0.00e+00d  [FindBigAtMostOneAndLinearOverlap] 
  1.60e-02s  4.67e-03d  [FindBigVerticalLinearOverlap] #blocks=61 #saved_nz=8'239 
  6.38e-04s  1.51e-04d  [FindBigHorizontalLinearOverlap] #linears=2'616 
  2.29e-05s  0.00e+00d  [MergeClauses] 
  3.77e-03s  0.00e+00d  [DetectDominanceRelations] 
  4.39e-02s  0.00e+00d  [PresolveToFixPoint] #num_loops=2 #num_dual_strengthening=1 
  3.76e-03s  0.00e+00d  [DetectDominanceRelations] 
  2.54e-02s  0.00e+00d  [PresolveToFixPoint] #num_loops=1 #num_dual_strengthening=1 
[Symmetry] Graph for symmetry has 4'223 nodes and 37'319 arcs.
[Symmetry] Symmetry computation done. time: 0.00156249 dtime: 0.0022748
  1.93e-02s  2.42e-03d  [Probe] #probed=372 #new_bounds=66 
  2.17e-05s  0.00e+00d  [MaxClique] 
  3.74e-03s  0.00e+00d  [DetectDominanceRelations] 
  4.22e-02s  0.00e+00d  [PresolveToFixPoint] #num_loops=2 #num_dual_strengthening=1 
  1.15e-02s  0.00e+00d  [ProcessAtMostOneAndLinear] 
  4.32e-03s  0.00e+00d  [DetectDuplicateConstraints] #without_enforcements=178 
  2.86e-03s  1.20e-04d  [DetectDominatedLinearConstraints] #relevant_constraints=2'900 #num_inclusions=463 
  6.03e-04s  0.00e+00d  [DetectDifferentVariables] #different=49 #cliques=2 #size=6 
  6.50e-04s  0.00e+00d  [ProcessSetPPC] #relevant_constraints=2'502 
  5.25e-05s  1.95e-07d  [FindAlmostIdenticalLinearConstraints] #num_tested_pairs=13 
  2.86e-05s  0.00e+00d  [FindBigAtMostOneAndLinearOverlap] 
  8.55e-03s  2.98e-03d  [FindBigVerticalLinearOverlap] #blocks=65 #saved_nz=5'879 
  5.27e-04s  1.10e-04d  [FindBigHorizontalLinearOverlap] #linears=2'197 
  2.34e-05s  0.00e+00d  [MergeClauses] 
  3.23e-03s  0.00e+00d  [DetectDominanceRelations] 
  4.49e-02s  0.00e+00d  [PresolveToFixPoint] #num_loops=3 #num_dual_strengthening=1 
  3.23e-03s  0.00e+00d  [DetectDominanceRelations] 
  2.95e-02s  0.00e+00d  [PresolveToFixPoint] #num_loops=1 #num_dual_strengthening=1 
  1.86e-02s  2.20e-03d  [Probe] #probed=372 #new_bounds=53 
  2.16e-05s  0.00e+00d  [MaxClique] 
  3.21e-03s  0.00e+00d  [DetectDominanceRelations] 
  4.18e-02s  0.00e+00d  [PresolveToFixPoint] #num_loops=2 #num_dual_strengthening=1 
  1.03e-02s  0.00e+00d  [ProcessAtMostOneAndLinear] 
  4.18e-03s  0.00e+00d  [DetectDuplicateConstraints] #without_enforcements=178 
  2.42e-03s  9.38e-05d  [DetectDominatedLinearConstraints] #relevant_constraints=2'908 #num_inclusions=249 
  4.51e-04s  0.00e+00d  [DetectDifferentVariables] 
  5.58e-04s  0.00e+00d  [ProcessSetPPC] #relevant_constraints=2'199 
  7.40e-05s  7.95e-07d  [FindAlmostIdenticalLinearConstraints] #num_tested_pairs=30 
  2.29e-05s  0.00e+00d  [FindBigAtMostOneAndLinearOverlap] 
  7.47e-03s  2.29e-03d  [FindBigVerticalLinearOverlap] #blocks=45 #saved_nz=4'391 
  4.20e-04s  8.03e-05d  [FindBigHorizontalLinearOverlap] #linears=1'780 
  2.32e-05s  0.00e+00d  [MergeClauses] 
  2.78e-03s  0.00e+00d  [DetectDominanceRelations] 
  3.28e-02s  0.00e+00d  [PresolveToFixPoint] #num_loops=2 #num_dual_strengthening=1 
  1.51e-04s  0.00e+00d  [ExpandObjective] #entries=859 #tight_variables=201 #tight_constraints=130 

Presolve summary:
  - 86 affine relations were detected.
  - rule 'TODO dual: only one blocking constraint?' was applied 741 times.
  - rule 'TODO dual: only one unspecified blocking constraint?' was applied 117 times.
  - rule 'TODO duplicate: identical constraint with different enforcements' was applied 484 times.
  - rule 'TODO no_overlap: with task always last' was applied 2 times.
  - rule 'affine: new relation' was applied 86 times.
  - rule 'all_diff: inferred from x != y constraints' was applied 2 times.
  - rule 'at_most_one: removed literals' was applied 3 times.
  - rule 'at_most_one: size one' was applied 3 times.
  - rule 'at_most_one: transformed into max clique.' was applied 1 time.
  - rule 'deductions: 412 stored' was applied 1 time.
  - rule 'dual: fix variable' was applied 24 times.
  - rule 'dual: reduced domain' was applied 46 times.
  - rule 'duplicate: merged rhs of linear constraint' was applied 70 times.
  - rule 'duplicate: removed constraint' was applied 486 times.
  - rule 'enforcement: false literal' was applied 36 times.
  - rule 'enforcement: true literal' was applied 23 times.
  - rule 'exactly_one: x and not(x)' was applied 1 time.
  - rule 'incompatible linear: add implication' was applied 45 times.
  - rule 'linear inclusion: redundant containing constraint' was applied 2 times.
  - rule 'linear matrix: common vertical rectangle' was applied 171 times.
  - rule 'linear: always true' was applied 701 times.
  - rule 'linear: doubleton free' was applied 13 times.
  - rule 'linear: empty' was applied 40 times.
  - rule 'linear: extracted enforcement literal' was applied 6'823 times.
  - rule 'linear: fixed or dup variables' was applied 3'950 times.
  - rule 'linear: positive equal one' was applied 1 time.
  - rule 'linear: reduced variable domains' was applied 299 times.
  - rule 'linear: remapped using affine relations' was applied 3'891 times.
  - rule 'linear: simplified rhs' was applied 14'881 times.
  - rule 'linear: variable substitution 1' was applied 13 times.
  - rule 'linear: variable substitution 2' was applied 11 times.
  - rule 'presolve: 109 unused variables removed.' was applied 1 time.
  - rule 'presolve: iteration' was applied 3 times.
  - rule 'probing: reduced enforced constraint to implication.' was applied 6 times.
  - rule 'symmetry: fixed to false in general orbit' was applied 1 time.

Presolved optimization model '': (model_fingerprint: 0xe3455621f307e9a9)
#Variables: 322 (#ints: 9 in objective)
  - 87 Booleans in [0,1]
  - 203 different domains in [-7573,8241] with a largest complexity of 15.
#kAllDiff: 2
#kLinear2: 763 (#enforced: 690 #multi: 512)
#kLinear3: 742 (#enforced: 625)
#kLinearN: 1'996 (#enforced: 1'880) (#terms: 16'396)

Preloading model.
#Bound   0.57s best:inf   next:[259,5922] initial_domain
#Model   0.57s var:322/322 constraints:3503/3503

Starting search at 0.58s with 48 workers.
16 full problem subsolvers: [core, default_lp, lb_tree_search, max_lp, no_lp, objective_lb_search, objective_lb_search_max_lp, objective_lb_search_no_lp, objective_shaving_search_max_lp, objective_shaving_search_no_lp, probing, probing_max_lp, pseudo_costs, quick_restart, quick_restart_no_lp, reduced_costs]
30 first solution subsolvers: [fj_long_default(2), fj_long_lin_default, fj_long_lin_perturb, fj_long_lin_random, fj_long_perturb, fj_long_random, fj_short_default(2), fj_short_lin_default(2), fj_short_lin_perturb, fj_short_lin_random, fj_short_perturb, fj_short_random, fs_random(4), fs_random_no_lp(4), fs_random_quick_restart(4), fs_random_quick_restart_no_lp(3)]
13 incomplete subsolvers: [feasibility_pump, graph_arc_lns, graph_cst_lns, graph_dec_lns, graph_var_lns, rins/rens, rnd_cst_lns, rnd_var_lns, violation_ls(5)]
3 helper subsolvers: [neighborhood_helper, synchronization_agent, update_gap_integral]
#Bound   0.67s best:inf   next:[300,5922] objective_lb_search_no_lp
#1       0.69s best:2689  next:[300,2688] no_lp (fixed_bools=0/106)
#2       0.71s best:2687  next:[300,2686] no_lp (fixed_bools=0/121)
#3       0.72s best:2565  next:[300,2564] no_lp (fixed_bools=0/130)
#Bound   0.73s best:2565  next:[301,2564] objective_shaving_search_max_lp (vars=322 csts=3504)
#4       0.73s best:2375  next:[301,2374] no_lp (fixed_bools=0/134)
#5       0.75s best:2338  next:[301,2337] no_lp (fixed_bools=0/138)
#6       0.76s best:2287  next:[301,2286] no_lp (fixed_bools=0/140)
#Bound   0.78s best:2287  next:[302,2286] objective_shaving_search_max_lp (vars=322 csts=3504)
#7       0.78s best:2286  next:[302,2285] violation_ls(batch:3 #solutions_imported:3 #lin_moves:1'211 #lin_evals:16'899 #gen_moves:5'023 #gen_evals:709 #comp_moves:537 #backtracks:2'243 #weight_updates:278)
#8       0.78s best:2285  next:[302,2284] violation_ls(batch:4 #solutions_imported:4 #lin_moves:1'248 #lin_evals:17'094 #gen_moves:5'023 #gen_evals:709 #comp_moves:537 #backtracks:2'243 #weight_updates:308)
#9       0.79s best:2258  next:[302,2257] no_lp (fixed_bools=0/142)
#10      0.82s best:2245  next:[302,2244] no_lp (fixed_bools=0/144)
#11      0.82s best:2200  next:[302,2199] quick_restart_no_lp (fixed_bools=0/172)
#12      0.82s best:2198  next:[302,2197] violation_ls(batch:3 #solutions_imported:3 #lin_moves:1 #lin_evals:5'205 #gen_moves:2'159 #gen_evals:299 #comp_moves:105 #backtracks:1'027 #weight_updates:41)
#13      0.82s best:2196  next:[302,2195] violation_ls(batch:4 #solutions_imported:4 #lin_moves:1 #lin_evals:5'209 #gen_moves:2'160 #gen_evals:299 #comp_moves:106 #backtracks:1'027 #weight_updates:41)
#14      0.83s best:2194  next:[302,2193] violation_ls(batch:5 #solutions_imported:5 #lin_moves:1 #lin_evals:5'257 #gen_moves:2'183 #gen_evals:303 #comp_moves:107 #backtracks:1'038 #weight_updates:41)
#15      0.83s best:2192  next:[302,2191] violation_ls(batch:6 #solutions_imported:6 #lin_moves:1 #lin_evals:5'260 #gen_moves:2'184 #gen_evals:303 #comp_moves:108 #backtracks:1'038 #weight_updates:41)
#16      0.83s best:2190  next:[302,2189] violation_ls(batch:7 #solutions_imported:7 #lin_moves:1 #lin_evals:5'280 #gen_moves:2'193 #gen_evals:305 #comp_moves:109 #backtracks:1'042 #weight_updates:41)
#17      0.84s best:2189  next:[302,2188] violation_ls(batch:7 #solutions_imported:7 #lin_moves:1'250 #lin_evals:21'741 #gen_moves:7'113 #gen_evals:872 #comp_moves:649 #backtracks:3'232 #weight_updates:338)
#18      0.85s best:2188  next:[302,2187] violation_ls(batch:2 #solutions_imported:2 #lin_moves:0 #lin_evals:10'986 #gen_moves:4'660 #gen_evals:436 #comp_moves:372 #backtracks:2'144 #weight_updates:52)
#Bound   0.86s best:2188  next:[307,2187] objective_lb_search_no_lp
#Bound   0.88s best:2188  next:[308,2187] bool_core (num_cores=2 [cover] a=7 d=1 fixed=46/240 clauses=821)
#Bound   0.88s best:2188  next:[309,2187] bool_core (num_cores=2 [cover] a=7 d=1 fixed=47/243 clauses=862)
#Bound   0.88s best:2188  next:[310,2187] bool_core (num_cores=2 [cover] a=7 d=1 fixed=48/246 clauses=904)
#Bound   0.88s best:2188  next:[311,2187] bool_core (num_cores=2 [cover] a=7 d=1 fixed=49/249 clauses=947)
#19      0.89s best:2183  next:[311,2182] quick_restart_no_lp (fixed_bools=0/175)
#Bound   0.89s best:2183  next:[323,2182] objective_lb_search
#20      0.90s best:2182  next:[323,2181] violation_ls(batch:2 #solutions_imported:2 #lin_moves:262 #lin_evals:15'793 #gen_moves:6'287 #gen_evals:553 #comp_moves:565 #backtracks:2'861 #weight_updates:245)
#21      0.91s best:2181  next:[323,2180] violation_ls(batch:3 #solutions_imported:3 #lin_moves:284 #lin_evals:15'884 #gen_moves:6'287 #gen_evals:553 #comp_moves:565 #backtracks:2'861 #weight_updates:256)
#22      0.91s best:2180  next:[323,2179] violation_ls(batch:4 #solutions_imported:4 #lin_moves:286 #lin_evals:15'899 #gen_moves:6'287 #gen_evals:553 #comp_moves:565 #backtracks:2'861 #weight_updates:257)
#23      0.94s best:2179  next:[323,2178] quick_restart_no_lp (fixed_bools=0/182)
#24      0.94s best:2178  next:[323,2177] violation_ls(batch:4 #solutions_imported:4 #lin_moves:5'220 #lin_evals:33'308 #gen_moves:2'802 #gen_evals:226 #comp_moves:356 #backtracks:1'223 #weight_updates:4'951)
#25      0.96s best:2177  next:[323,2176] violation_ls(batch:5 #solutions_imported:5 #lin_moves:5'967 #lin_evals:35'816 #gen_moves:2'802 #gen_evals:226 #comp_moves:356 #backtracks:1'223 #weight_updates:5'122)
#26      0.97s best:2176  next:[323,2175] violation_ls(batch:6 #solutions_imported:6 #lin_moves:6'189 #lin_evals:36'914 #gen_moves:2'802 #gen_evals:226 #comp_moves:356 #backtracks:1'223 #weight_updates:5'269)
#27      0.97s best:2175  next:[323,2174] violation_ls(batch:7 #solutions_imported:7 #lin_moves:6'189 #lin_evals:36'948 #gen_moves:2'824 #gen_evals:230 #comp_moves:358 #backtracks:1'233 #weight_updates:5'269)
#Bound   0.97s best:2175  next:[324,2174] bool_core (num_cores=3 [cover] a=6 d=1 fixed=61/288 clauses=1'069)
#Bound   0.97s best:2175  next:[325,2174] bool_core (num_cores=3 [cover] a=6 d=1 fixed=62/291 clauses=1'082)
#Bound   0.98s best:2175  next:[326,2174] bool_core (num_cores=3 [cover] a=6 d=1 fixed=63/294 clauses=1'096)
#Bound   0.98s best:2175  next:[327,2174] bool_core (num_cores=3 [cover] a=6 d=1 fixed=64/297 clauses=1'111)
#Bound   0.98s best:2175  next:[431,2174] objective_lb_search
#Bound   0.99s best:2175  next:[685,2174] objective_lb_search_no_lp
#28      1.01s best:2174  next:[685,2173] violation_ls(batch:9 #solutions_imported:9 #lin_moves:11'382 #lin_evals:70'850 #gen_moves:7'113 #gen_evals:872 #comp_moves:649 #backtracks:3'232 #weight_updates:799)
#29      1.01s best:2173  next:[685,2172] violation_ls(batch:10 #solutions_imported:10 #lin_moves:11'452 #lin_evals:71'204 #gen_moves:7'113 #gen_evals:872 #comp_moves:649 #backtracks:3'232 #weight_updates:852)
#30      1.02s best:2172  next:[685,2171] violation_ls(batch:11 #solutions_imported:11 #lin_moves:11'800 #lin_evals:72'392 #gen_moves:7'113 #gen_evals:872 #comp_moves:649 #backtracks:3'232 #weight_updates:956)
#31      1.03s best:2171  next:[685,2170] violation_ls(batch:12 #solutions_imported:12 #lin_moves:11'935 #lin_evals:72'929 #gen_moves:7'113 #gen_evals:872 #comp_moves:649 #backtracks:3'232 #weight_updates:1'013)
#32      1.05s best:2170  next:[685,2169] violation_ls(batch:13 #solutions_imported:13 #lin_moves:12'055 #lin_evals:73'538 #gen_moves:7'113 #gen_evals:872 #comp_moves:649 #backtracks:3'232 #weight_updates:1'110)
#33      1.08s best:2165  next:[685,2164] quick_restart_no_lp (fixed_bools=0/201)
#34      1.09s best:2164  next:[685,2163] violation_ls(batch:11 #solutions_imported:11 #lin_moves:6'308 #lin_evals:46'955 #gen_moves:6'701 #gen_evals:906 #comp_moves:707 #backtracks:2'997 #weight_updates:5'414)
#35      1.09s best:2163  next:[685,2162] violation_ls(batch:12 #solutions_imported:12 #lin_moves:6'540 #lin_evals:47'835 #gen_moves:6'701 #gen_evals:906 #comp_moves:707 #backtracks:2'997 #weight_updates:5'494)
#Bound   1.10s best:2163  next:[734,2162] objective_lb_search_no_lp
#36      1.10s best:2162  next:[734,2161] violation_ls(batch:14 #solutions_imported:14 #lin_moves:12'205 #lin_evals:74'279 #gen_moves:7'113 #gen_evals:872 #comp_moves:649 #backtracks:3'232 #weight_updates:1'220)
#37      1.12s best:2161  next:[734,2160] violation_ls(batch:15 #solutions_imported:15 #lin_moves:12'205 #lin_evals:75'653 #gen_moves:7'685 #gen_evals:976 #comp_moves:677 #backtracks:3'504 #weight_updates:1'231)
#38      1.13s best:2160  next:[734,2159] violation_ls(batch:9 #solutions_imported:9 #lin_moves:9'650 #lin_evals:46'149 #gen_moves:2'228 #gen_evals:307 #comp_moves:110 #backtracks:1'059 #weight_updates:392)
#39      1.13s best:2159  next:[734,2158] violation_ls(batch:10 #solutions_imported:10 #lin_moves:9'830 #lin_evals:46'841 #gen_moves:2'228 #gen_evals:307 #comp_moves:110 #backtracks:1'059 #weight_updates:456)
#40      1.15s best:2158  next:[734,2157] quick_restart_no_lp (fixed_bools=0/223)
#41      1.16s best:2157  next:[734,2156] violation_ls(batch:4 #solutions_imported:4 #lin_moves:9'613 #lin_evals:60'069 #gen_moves:4'660 #gen_evals:436 #comp_moves:372 #backtracks:2'144 #weight_updates:440)
#42      1.16s best:2156  next:[734,2155] violation_ls(batch:14 #solutions_imported:14 #lin_moves:6'540 #lin_evals:52'742 #gen_moves:8'763 #gen_evals:1'261 #comp_moves:921 #backtracks:3'921 #weight_updates:5'525)
#43      1.16s best:2155  next:[734,2154] violation_ls(batch:5 #solutions_imported:5 #lin_moves:9'613 #lin_evals:60'072 #gen_moves:4'662 #gen_evals:436 #comp_moves:374 #backtracks:2'144 #weight_updates:440)
#44      1.16s best:2154  next:[734,2153] violation_ls(batch:12 #solutions_imported:12 #lin_moves:9'831 #lin_evals:46'853 #gen_moves:2'229 #gen_evals:307 #comp_moves:111 #backtracks:1'059 #weight_updates:456)
#45      1.16s best:2153  next:[734,2152] violation_ls(batch:13 #solutions_imported:13 #lin_moves:9'831 #lin_evals:46'857 #gen_moves:2'231 #gen_evals:307 #comp_moves:113 #backtracks:1'059 #weight_updates:456)
#46      1.16s best:2152  next:[734,2151] violation_ls(batch:14 #solutions_imported:14 #lin_moves:9'831 #lin_evals:46'862 #gen_moves:2'234 #gen_evals:307 #comp_moves:116 #backtracks:1'059 #weight_updates:456)
#47      1.16s best:2151  next:[734,2150] violation_ls(batch:15 #solutions_imported:15 #lin_moves:9'831 #lin_evals:46'876 #gen_moves:2'243 #gen_evals:307 #comp_moves:119 #backtracks:1'062 #weight_updates:456)
#48      1.17s best:2150  next:[734,2149] violation_ls(batch:9 #solutions_imported:9 #lin_moves:9'649 #lin_evals:60'321 #gen_moves:4'705 #gen_evals:439 #comp_moves:377 #backtracks:2'164 #weight_updates:463)
#49      1.17s best:2149  next:[734,2148] violation_ls(batch:10 #solutions_imported:10 #lin_moves:9'667 #lin_evals:60'404 #gen_moves:4'705 #gen_evals:439 #comp_moves:377 #backtracks:2'164 #weight_updates:472)
#50      1.17s best:2148  next:[734,2147] violation_ls(batch:11 #solutions_imported:11 #lin_moves:9'667 #lin_evals:60'419 #gen_moves:4'713 #gen_evals:439 #comp_moves:379 #backtracks:2'167 #weight_updates:472)
#51      1.17s best:2147  next:[734,2146] violation_ls(batch:12 #solutions_imported:12 #lin_moves:9'688 #lin_evals:60'529 #gen_moves:4'713 #gen_evals:439 #comp_moves:379 #backtracks:2'167 #weight_updates:491)
#52      1.17s best:2146  next:[734,2145] violation_ls(batch:16 #solutions_imported:16 #lin_moves:9'858 #lin_evals:47'006 #gen_moves:2'243 #gen_evals:307 #comp_moves:119 #backtracks:1'062 #weight_updates:470)
#53      1.17s best:2145  next:[734,2144] violation_ls(batch:13 #solutions_imported:13 #lin_moves:9'731 #lin_evals:60'743 #gen_moves:4'713 #gen_evals:439 #comp_moves:379 #backtracks:2'167 #weight_updates:521)
#54      1.18s best:2144  next:[734,2143] violation_ls(batch:16 #solutions_imported:16 #lin_moves:6'541 #lin_evals:52'781 #gen_moves:8'782 #gen_evals:1'261 #comp_moves:924 #backtracks:3'929 #weight_updates:5'525)
#55      1.18s best:2143  next:[734,2142] violation_ls(batch:14 #solutions_imported:14 #lin_moves:9'731 #lin_evals:60'980 #gen_moves:4'821 #gen_evals:450 #comp_moves:383 #backtracks:2'219 #weight_updates:521)
#56      1.19s best:2142  next:[734,2141] violation_ls(batch:15 #solutions_imported:15 #lin_moves:9'731 #lin_evals:61'131 #gen_moves:4'893 #gen_evals:454 #comp_moves:387 #backtracks:2'253 #weight_updates:521)
#57      1.20s best:2141  next:[734,2140] violation_ls(batch:16 #solutions_imported:16 #lin_moves:9'779 #lin_evals:61'384 #gen_moves:4'893 #gen_evals:454 #comp_moves:387 #backtracks:2'253 #weight_updates:559)
#58      1.22s best:2140  next:[734,2139] violation_ls(batch:17 #solutions_imported:17 #lin_moves:9'792 #lin_evals:61'441 #gen_moves:4'893 #gen_evals:454 #comp_moves:387 #backtracks:2'253 #weight_updates:566)
#59      1.25s best:2139  next:[734,2138] violation_ls(batch:17 #solutions_imported:17 #lin_moves:12'277 #lin_evals:76'048 #gen_moves:7'695 #gen_evals:979 #comp_moves:679 #backtracks:3'508 #weight_updates:1'283)
#60      1.28s best:2138  next:[734,2137] violation_ls(batch:17 #solutions_imported:17 #lin_moves:6'541 #lin_evals:52'876 #gen_moves:8'831 #gen_evals:1'264 #comp_moves:927 #backtracks:3'952 #weight_updates:5'525)
#61      1.29s best:2105  next:[734,2104] rnd_var_lns (d=0.98 s=182 t=0.10 p=1.00 stall=8 h=auto_l0)
#62      1.32s best:2104  next:[734,2103] violation_ls(batch:18 #solutions_imported:18 #lin_moves:12'672 #lin_evals:77'398 #gen_moves:7'695 #gen_evals:979 #comp_moves:679 #backtracks:3'508 #weight_updates:1'407)
#Bound   1.32s best:2104  next:[757,2103] objective_lb_search_no_lp
#63      1.34s best:2103  next:[757,2102] violation_ls(batch:18 #solutions_imported:18 #lin_moves:6'541 #lin_evals:52'898 #gen_moves:8'840 #gen_evals:1'264 #comp_moves:928 #backtracks:3'956 #weight_updates:5'525)
#64      1.57s best:2084  next:[757,2083] rins_pump_lns (d=0.71 s=253 t=0.10 p=1.00 stall=0 h=auto_l0)
#65      1.62s best:2032  next:[757,2031] graph_dec_lns (d=0.98 s=212 t=0.10 p=1.00 stall=3 h=auto_l0)
#66      1.87s best:2002  next:[757,2001] pseudo_costs (fixed_bools=0/115)
#67      2.00s best:1975  next:[757,1974] quick_restart_no_lp (fixed_bools=1/275)
#68      2.11s best:1974  next:[757,1973] quick_restart_no_lp (fixed_bools=1/277)
#69      2.14s best:1973  next:[757,1972] violation_ls(batch:12 #solutions_imported:12 #lin_moves:19'741 #lin_evals:157'128 #gen_moves:24'420 #gen_evals:2'460 #comp_moves:1'541 #backtracks:11'439 #weight_updates:1'322)
#Bound   2.18s best:1973  next:[759,1972] objective_lb_search
#70      2.65s best:1965  next:[759,1964] quick_restart_no_lp (fixed_bools=1/298)
#71      2.68s best:1964  next:[759,1963] quick_restart_no_lp (fixed_bools=1/298)
#72      2.72s best:1963  next:[759,1962] violation_ls(batch:15 #solutions_imported:14 #lin_moves:39'272 #lin_evals:272'006 #gen_moves:24'420 #gen_evals:2'460 #comp_moves:1'541 #backtracks:11'439 #weight_updates:1'792)
#73      2.73s best:1962  next:[759,1961] violation_ls(batch:16 #solutions_imported:15 #lin_moves:39'272 #lin_evals:272'026 #gen_moves:24'430 #gen_evals:2'460 #comp_moves:1'543 #backtracks:11'443 #weight_updates:1'792)
#74      2.73s best:1961  next:[759,1960] violation_ls(batch:17 #solutions_imported:16 #lin_moves:39'273 #lin_evals:272'033 #gen_moves:24'430 #gen_evals:2'460 #comp_moves:1'543 #backtracks:11'443 #weight_updates:1'792)
#75      2.73s best:1960  next:[759,1959] violation_ls(batch:18 #solutions_imported:17 #lin_moves:39'273 #lin_evals:272'036 #gen_moves:24'431 #gen_evals:2'460 #comp_moves:1'544 #backtracks:11'443 #weight_updates:1'792)
#76      2.73s best:1959  next:[759,1958] violation_ls(batch:19 #solutions_imported:18 #lin_moves:39'273 #lin_evals:272'087 #gen_moves:24'459 #gen_evals:2'462 #comp_moves:1'546 #backtracks:11'456 #weight_updates:1'792)
#Bound   2.78s best:1959  next:[764,1958] objective_lb_search_no_lp
#Bound   2.87s best:1959  next:[799,1958] objective_lb_search
#77      2.87s best:1957  next:[799,1956] quick_restart_no_lp (fixed_bools=1/300)
#78      2.96s best:1956  next:[799,1955] quick_restart_no_lp (fixed_bools=1/302)
#79      2.99s best:1950  next:[799,1949] quick_restart_no_lp (fixed_bools=1/307)
#80      3.00s best:1949  next:[799,1948] quick_restart_no_lp (fixed_bools=1/307)
#81      3.02s best:1932  next:[799,1931] quick_restart_no_lp (fixed_bools=1/307)
#82      3.03s best:1928  next:[799,1927] quick_restart_no_lp (fixed_bools=1/308)
#83      3.44s best:1917  next:[799,1916] quick_restart_no_lp (fixed_bools=1/332)
#84      3.45s best:1880  next:[799,1879] graph_var_lns (d=0.99 s=236 t=0.10 p=1.00 stall=0 h=auto_l0)
#85      3.46s best:1878  next:[799,1877] violation_ls(batch:20 #solutions_imported:20 #lin_moves:6'541 #lin_evals:73'478 #gen_moves:16'945 #gen_evals:2'166 #comp_moves:1'696 #backtracks:7'623 #weight_updates:5'603)
#Bound   3.48s best:1878  next:[801,1877] objective_lb_search_no_lp
#86      3.56s best:1842  next:[801,1841] quick_restart_no_lp (fixed_bools=1/359)
#87      3.57s best:1841  next:[801,1840] quick_restart_no_lp (fixed_bools=1/367)
#88      3.61s best:1836  next:[801,1835] quick_restart_no_lp (fixed_bools=1/373)
#Bound   3.96s best:1836  next:[805,1835] objective_lb_search_no_lp
#Bound   5.26s best:1836  next:[810,1835] objective_lb_search
#89      5.62s best:1780  next:[810,1779] graph_var_lns (d=1.00 s=306 t=0.10 p=1.00 stall=0 h=auto_l0)
#90      5.63s best:1776  next:[810,1775] rnd_cst_lns (d=0.99 s=322 t=0.10 p=0.93 stall=0 h=auto_l0)
#91      5.76s best:1775  next:[810,1774] violation_ls(batch:26 #solutions_imported:22 #lin_moves:45'018 #lin_evals:269'627 #gen_moves:14'442 #gen_evals:1'652 #comp_moves:1'299 #backtracks:6'570 #weight_updates:26'089)
#Bound   5.89s best:1775  next:[887,1774] objective_lb_search
#92      5.93s best:1774  next:[887,1773] violation_ls(batch:26 #solutions_imported:22 #lin_moves:12'836 #lin_evals:196'459 #gen_moves:44'823 #gen_evals:9'414 #comp_moves:5'320 #backtracks:19'745 #weight_updates:1'802)
#93      5.94s best:1773  next:[887,1772] violation_ls(batch:26 #solutions_imported:23 #lin_moves:45'942 #lin_evals:239'085 #gen_moves:2'289 #gen_evals:309 #comp_moves:123 #backtracks:1'083 #weight_updates:26'066)
#94      6.00s best:1772  next:[887,1771] violation_ls(batch:25 #solutions_imported:22 #lin_moves:45'738 #lin_evals:238'385 #gen_moves:16'945 #gen_evals:2'166 #comp_moves:1'696 #backtracks:7'623 #weight_updates:6'464)
#95      6.02s best:1771  next:[887,1770] violation_ls(batch:26 #solutions_imported:23 #lin_moves:46'070 #lin_evals:239'557 #gen_moves:16'945 #gen_evals:2'166 #comp_moves:1'696 #backtracks:7'623 #weight_updates:6'559)
#96      6.56s best:1760  next:[887,1759] rnd_cst_lns (d=0.99 s=372 t=0.10 p=0.78 stall=0 h=auto_l0)
#Bound   7.20s best:1760  next:[888,1759] objective_lb_search
#Bound   7.73s best:1760  next:[891,1759] objective_lb_search_no_lp
#Bound   8.55s best:1760  next:[896,1759] objective_lb_search_no_lp
#Bound   9.07s best:1760  next:[899,1759] objective_lb_search_no_lp
#Bound   9.83s best:1760  next:[939,1759] objective_lb_search
#Bound  11.53s best:1760  next:[943,1759] objective_lb_search
#Bound  11.56s best:1760  next:[982,1759] objective_lb_search_max_lp
#Bound  13.75s best:1760  next:[983,1759] objective_lb_search
#Bound  14.74s best:1760  next:[984,1759] objective_lb_search
#Bound  15.16s best:1760  next:[986,1759] objective_lb_search
#Bound  15.16s best:1760  next:[1056,1759] objective_lb_search_max_lp
#Bound  17.82s best:1760  next:[1076,1759] objective_lb_search
#Bound  21.12s best:1760  next:[1077,1759] objective_lb_search
#Bound  22.50s best:1760  next:[1078,1759] objective_lb_search_max_lp
#Bound  25.11s best:1760  next:[1115,1759] objective_lb_search_max_lp
#Bound  28.04s best:1760  next:[1117,1759] objective_lb_search_no_lp
#Bound  28.33s best:1760  next:[1121,1759] objective_lb_search_no_lp
#Bound  28.40s best:1760  next:[1135,1759] objective_lb_search_no_lp
#Bound  30.61s best:1760  next:[1136,1759] objective_lb_search_no_lp
#Bound  31.42s best:1760  next:[1138,1759] objective_lb_search_no_lp
#Bound  35.13s best:1760  next:[1142,1759] objective_lb_search_max_lp
#Bound  37.96s best:1760  next:[1143,1759] objective_lb_search
#Bound  39.97s best:1760  next:[1144,1759] objective_lb_search_max_lp
#Bound  41.31s best:1760  next:[1145,1759] objective_lb_search
#Bound  42.00s best:1760  next:[1148,1759] objective_lb_search_max_lp
#Bound  44.86s best:1760  next:[1150,1759] objective_lb_search_max_lp
#Bound  45.96s best:1760  next:[1156,1759] objective_lb_search_max_lp
#Bound  48.75s best:1760  next:[1158,1759] objective_lb_search
#Bound  53.02s best:1760  next:[1159,1759] objective_lb_search_max_lp
#Bound  53.73s best:1760  next:[1164,1759] objective_lb_search_max_lp
#Bound  54.51s best:1760  next:[1167,1759] objective_lb_search_max_lp
#Bound  56.27s best:1760  next:[1169,1759] objective_lb_search_max_lp
#Bound  58.99s best:1760  next:[1175,1759] objective_lb_search_max_lp
#Bound  60.85s best:1760  next:[1178,1759] objective_lb_search_max_lp
#Bound  62.31s best:1760  next:[1182,1759] objective_lb_search
#Bound  65.74s best:1760  next:[1187,1759] objective_lb_search
#Bound  66.67s best:1760  next:[1188,1759] objective_lb_search
#Bound  70.78s best:1760  next:[1191,1759] objective_lb_search
#Bound  72.36s best:1760  next:[1200,1759] objective_lb_search_max_lp
#Bound  77.55s best:1760  next:[1207,1759] objective_lb_search_max_lp
#Bound  89.74s best:1760  next:[1208,1759] lb_tree_search (nodes=1521/1521 rc=7 decisions=15400 @root=17 restarts=10) 
#Bound  95.13s best:1760  next:[1209,1759] lb_tree_search (nodes=1534/1534 rc=7 decisions=15605 @root=19 restarts=10) 
#Bound  99.97s best:1760  next:[1210,1759] lb_tree_search (nodes=1548/1548 rc=7 decisions=15771 @root=20 restarts=10) 
#Bound 102.17s best:1760  next:[1221,1759] objective_lb_search_max_lp
#Bound 106.15s best:1760  next:[1230,1759] objective_lb_search_max_lp
#Model 106.50s var:318/322 constraints:3304/3503
#Bound 108.83s best:1760  next:[1231,1759] objective_lb_search_max_lp
#Bound 111.79s best:1760  next:[1265,1759] objective_lb_search_max_lp
#Bound 115.33s best:1760  next:[1266,1759] objective_lb_search_max_lp
#Bound 122.93s best:1760  next:[1267,1759] objective_shaving_search_max_lp (vars=344 csts=3327)
#Bound 126.01s best:1760  next:[1268,1759] objective_lb_search_max_lp
#Model 128.51s var:314/322 constraints:3077/3503
#Bound 131.79s best:1760  next:[1273,1759] objective_lb_search_max_lp
#Bound 135.21s best:1760  next:[1275,1759] objective_lb_search_max_lp
#Bound 138.86s best:1760  next:[1277,1759] objective_lb_search_max_lp
#Bound 141.31s best:1760  next:[1278,1759] objective_lb_search_no_lp
#Bound 141.38s best:1760  next:[1283,1759] objective_lb_search_max_lp
#Model 143.00s var:310/322 constraints:2877/3503
#Bound 143.42s best:1760  next:[1284,1759] objective_lb_search_max_lp
#Bound 145.83s best:1760  next:[1303,1759] objective_lb_search_max_lp
#Bound 149.24s best:1760  next:[1304,1759] objective_lb_search_max_lp
#Bound 151.90s best:1760  next:[1330,1759] objective_lb_search_max_lp
#Bound 154.22s best:1760  next:[1338,1759] objective_lb_search_no_lp
#Bound 156.63s best:1760  next:[1340,1759] objective_lb_search_no_lp
#Bound 157.84s best:1760  next:[1342,1759] objective_lb_search_no_lp
#Bound 158.61s best:1760  next:[1370,1759] objective_lb_search_no_lp
#Bound 159.49s best:1760  next:[1373,1759] objective_lb_search_no_lp
#Model 160.18s var:307/322 constraints:2588/3503
#Bound 161.02s best:1760  next:[1377,1759] objective_lb_search_no_lp
#Bound 161.93s best:1760  next:[1380,1759] objective_lb_search
#Bound 162.42s best:1760  next:[1437,1759] objective_lb_search_no_lp
#Bound 162.89s best:1760  next:[1438,1759] objective_lb_search_no_lp
#Model 162.96s var:299/322 constraints:2180/3503
#Bound 163.18s best:1760  next:[1442,1759] objective_lb_search_max_lp
#Model 163.63s var:296/322 constraints:2043/3503
#Bound 163.70s best:1760  next:[1443,1759] objective_lb_search_no_lp
#Bound 163.77s best:1760  next:[1446,1759] objective_lb_search_max_lp
#Model 163.98s var:294/322 constraints:1954/3503
#Bound 164.21s best:1760  next:[1473,1759] objective_lb_search_max_lp
#Model 164.29s var:293/322 constraints:1943/3503
#Bound 164.55s best:1760  next:[1518,1759] objective_lb_search_no_lp
#Bound 165.10s best:1760  next:[1519,1759] objective_lb_search_max_lp
#Model 165.13s var:291/322 constraints:1769/3503
#Bound 165.15s best:1760  next:[1520,1759] objective_lb_search_no_lp
#Model 165.28s var:289/322 constraints:1694/3503
#Model 165.36s var:287/322 constraints:1465/3503
#Model 165.37s var:285/322 constraints:1436/3503
#Bound 165.44s best:1760  next:[1530,1759] objective_lb_search
#Bound 165.48s best:1760  next:[1536,1759] objective_lb_search_no_lp
#Model 165.51s var:283/322 constraints:1354/3503
#Bound 165.53s best:1760  next:[1541,1759] objective_lb_search_no_lp
#Model 165.53s var:282/322 constraints:1348/3503
#Model 165.54s var:277/322 constraints:1051/3503
#Bound 165.55s best:1760  next:[1559,1759] objective_lb_search_no_lp
#Bound 165.57s best:1760  next:[1592,1759] objective_lb_search_max_lp
#Bound 165.60s best:1760  next:[1600,1759] objective_lb_search_no_lp
#Bound 165.61s best:1760  next:[1602,1759] objective_lb_search_no_lp
#Bound 165.62s best:1760  next:[1603,1759] objective_lb_search_no_lp
#Bound 165.63s best:1760  next:[1611,1759] objective_lb_search_no_lp
#Done  165.63s no_lp
#Done  165.64s probing_max_lp
#Done  165.64s core
#Model 165.64s var:273/322 constraints:994/3503
#Model 165.65s var:269/322 constraints:838/3503

Task timing                                  n [     min,      max]      avg      dev     time         n [     min,      max]      avg      dev    dtime
                             'core':         1 [   2.75m,    2.75m]    2.75m   0.00ns    2.75m         1 [  45.77s,   45.77s]   45.77s   0.00ns   45.77s
                       'default_lp':         1 [   2.75m,    2.75m]    2.75m   0.00ns    2.75m         1 [  11.91s,   11.91s]   11.91s   0.00ns   11.91s
                 'feasibility_pump':       242 [ 37.44ms,    2.27s] 677.14ms 408.75ms    2.73m       241 [ 13.23ms,  59.28ms]  28.74ms   2.30ms    6.93s
                  'fj_long_default':         1 [214.95ms, 214.95ms] 214.95ms   0.00ns 214.95ms         1 [ 81.54ms,  81.54ms]  81.54ms   0.00ns  81.54ms
                  'fj_long_default':         1 [385.74ms, 385.74ms] 385.74ms   0.00ns 385.74ms         1 [ 77.37ms,  77.37ms]  77.37ms   0.00ns  77.37ms
              'fj_long_lin_default':         1 [305.11ms, 305.11ms] 305.11ms   0.00ns 305.11ms         1 [ 79.64ms,  79.64ms]  79.64ms   0.00ns  79.64ms
              'fj_long_lin_perturb':         1 [225.22ms, 225.22ms] 225.22ms   0.00ns 225.22ms         1 [107.24ms, 107.24ms] 107.24ms   0.00ns 107.24ms
               'fj_long_lin_random':         1 [434.10ms, 434.10ms] 434.10ms   0.00ns 434.10ms         1 [107.38ms, 107.38ms] 107.38ms   0.00ns 107.38ms
                  'fj_long_perturb':         1 [292.43ms, 292.43ms] 292.43ms   0.00ns 292.43ms         1 [ 78.00ms,  78.00ms]  78.00ms   0.00ns  78.00ms
                   'fj_long_random':         1 [385.04ms, 385.04ms] 385.04ms   0.00ns 385.04ms         1 [ 80.08ms,  80.08ms]  80.08ms   0.00ns  80.08ms
                 'fj_short_default':         1 [145.48ms, 145.48ms] 145.48ms   0.00ns 145.48ms         1 [ 78.47ms,  78.47ms]  78.47ms   0.00ns  78.47ms
                 'fj_short_default':         1 [468.57ms, 468.57ms] 468.57ms   0.00ns 468.57ms         1 [129.93ms, 129.93ms] 129.93ms   0.00ns 129.93ms
             'fj_short_lin_default':         1 [167.68ms, 167.68ms] 167.68ms   0.00ns 167.68ms         1 [ 79.69ms,  79.69ms]  79.69ms   0.00ns  79.69ms
             'fj_short_lin_default':         1 [291.62ms, 291.62ms] 291.62ms   0.00ns 291.62ms         1 [ 78.44ms,  78.44ms]  78.44ms   0.00ns  78.44ms
             'fj_short_lin_perturb':         1 [380.85ms, 380.85ms] 380.85ms   0.00ns 380.85ms         1 [ 79.41ms,  79.41ms]  79.41ms   0.00ns  79.41ms
              'fj_short_lin_random':         1 [302.69ms, 302.69ms] 302.69ms   0.00ns 302.69ms         1 [ 79.83ms,  79.83ms]  79.83ms   0.00ns  79.83ms
                 'fj_short_perturb':         1 [393.38ms, 393.38ms] 393.38ms   0.00ns 393.38ms         1 [ 84.59ms,  84.59ms]  84.59ms   0.00ns  84.59ms
                  'fj_short_random':         1 [309.32ms, 309.32ms] 309.32ms   0.00ns 309.32ms         1 [ 79.68ms,  79.68ms]  79.68ms   0.00ns  79.68ms
                        'fs_random':         1 [104.63ms, 104.63ms] 104.63ms   0.00ns 104.63ms         1 [ 20.00ns,  20.00ns]  20.00ns   0.00ns  20.00ns
                        'fs_random':         1 [105.23ms, 105.23ms] 105.23ms   0.00ns 105.23ms         1 [ 20.00ns,  20.00ns]  20.00ns   0.00ns  20.00ns
                        'fs_random':         1 [108.93ms, 108.93ms] 108.93ms   0.00ns 108.93ms         1 [ 20.00ns,  20.00ns]  20.00ns   0.00ns  20.00ns
                        'fs_random':         1 [113.16ms, 113.16ms] 113.16ms   0.00ns 113.16ms         1 [ 20.00ns,  20.00ns]  20.00ns   0.00ns  20.00ns
                  'fs_random_no_lp':         1 [102.24ms, 102.24ms] 102.24ms   0.00ns 102.24ms         1 [377.87us, 377.87us] 377.87us   0.00ns 377.87us
                  'fs_random_no_lp':         1 [103.85ms, 103.85ms] 103.85ms   0.00ns 103.85ms         1 [323.49us, 323.49us] 323.49us   0.00ns 323.49us
                  'fs_random_no_lp':         1 [107.00ms, 107.00ms] 107.00ms   0.00ns 107.00ms         1 [317.87us, 317.87us] 317.87us   0.00ns 317.87us
                  'fs_random_no_lp':         1 [110.29ms, 110.29ms] 110.29ms   0.00ns 110.29ms         1 [232.09us, 232.09us] 232.09us   0.00ns 232.09us
          'fs_random_quick_restart':         1 [101.22ms, 101.22ms] 101.22ms   0.00ns 101.22ms         1 [ 20.00ns,  20.00ns]  20.00ns   0.00ns  20.00ns
          'fs_random_quick_restart':         1 [104.41ms, 104.41ms] 104.41ms   0.00ns 104.41ms         1 [ 20.00ns,  20.00ns]  20.00ns   0.00ns  20.00ns
          'fs_random_quick_restart':         1 [109.65ms, 109.65ms] 109.65ms   0.00ns 109.65ms         1 [ 20.00ns,  20.00ns]  20.00ns   0.00ns  20.00ns
          'fs_random_quick_restart':         1 [110.86ms, 110.86ms] 110.86ms   0.00ns 110.86ms         1 [ 20.00ns,  20.00ns]  20.00ns   0.00ns  20.00ns
    'fs_random_quick_restart_no_lp':         1 [ 98.49ms,  98.49ms]  98.49ms   0.00ns  98.49ms         1 [161.04us, 161.04us] 161.04us   0.00ns 161.04us
    'fs_random_quick_restart_no_lp':         1 [106.19ms, 106.19ms] 106.19ms   0.00ns 106.19ms         1 [416.63us, 416.63us] 416.63us   0.00ns 416.63us
    'fs_random_quick_restart_no_lp':         1 [112.12ms, 112.12ms] 112.12ms   0.00ns 112.12ms         1 [189.85us, 189.85us] 189.85us   0.00ns 189.85us
                    'graph_arc_lns':       275 [  6.01ms,   10.95s]    2.43s    1.94s   11.16m       264 [ 10.00ns, 136.28ms]  64.38ms  43.13ms   17.00s
                    'graph_cst_lns':       274 [  3.44ms,    9.83s]    2.11s    1.96s    9.63m       238 [ 10.00ns, 191.01ms]  62.12ms  45.09ms   14.79s
                    'graph_dec_lns':       274 [ 11.38ms,    8.62s]    2.56s    1.81s   11.70m       266 [ 10.00ns, 200.14ms]  63.66ms  42.86ms   16.93s
                    'graph_var_lns':       275 [  6.57ms,   10.55s]    2.49s    1.89s   11.40m       270 [ 10.00ns, 108.36ms]  65.86ms  41.08ms   17.78s
                   'lb_tree_search':         1 [   2.75m,    2.75m]    2.75m   0.00ns    2.75m         1 [  17.08s,   17.08s]   17.08s   0.00ns   17.08s
                           'max_lp':         1 [   2.75m,    2.75m]    2.75m   0.00ns    2.75m         1 [   8.90s,    8.90s]    8.90s   0.00ns    8.90s
                            'no_lp':         1 [   2.75m,    2.75m]    2.75m   0.00ns    2.75m         1 [   9.00s,    9.00s]    9.00s   0.00ns    9.00s
              'objective_lb_search':         1 [   2.75m,    2.75m]    2.75m   0.00ns    2.75m         1 [  10.66s,   10.66s]   10.66s   0.00ns   10.66s
       'objective_lb_search_max_lp':         1 [   2.75m,    2.75m]    2.75m   0.00ns    2.75m         1 [  15.58s,   15.58s]   15.58s   0.00ns   15.58s
        'objective_lb_search_no_lp':         1 [   2.75m,    2.75m]    2.75m   0.00ns    2.75m         1 [   7.06s,    7.06s]    7.06s   0.00ns    7.06s
  'objective_shaving_search_max_lp':        93 [ 23.10ms,   12.28s]    1.77s    1.89s    2.74m        76 [ 35.24us, 460.19ms]  63.94ms  80.88ms    4.86s
   'objective_shaving_search_no_lp':        91 [  7.75ms,   12.29s]    1.81s    1.90s    2.74m        76 [689.07us, 245.32ms]  45.79ms  50.24ms    3.48s
                          'probing':         1 [   2.75m,    2.75m]    2.75m   0.00ns    2.75m         1 [   3.03s,    3.03s]    3.03s   0.00ns    3.03s
                   'probing_max_lp':         1 [   2.75m,    2.75m]    2.75m   0.00ns    2.75m         1 [   3.25s,    3.25s]    3.25s   0.00ns    3.25s
                     'pseudo_costs':         1 [   2.75m,    2.75m]    2.75m   0.00ns    2.75m         1 [   8.56s,    8.56s]    8.56s   0.00ns    8.56s
                    'quick_restart':         1 [   2.75m,    2.75m]    2.75m   0.00ns    2.75m         1 [  11.41s,   11.41s]   11.41s   0.00ns   11.41s
              'quick_restart_no_lp':         1 [   2.75m,    2.75m]    2.75m   0.00ns    2.75m         1 [   6.79s,    6.79s]    6.79s   0.00ns    6.79s
                    'reduced_costs':         1 [   2.75m,    2.75m]    2.75m   0.00ns    2.75m         1 [   9.31s,    9.31s]    9.31s   0.00ns    9.31s
                        'rins/rens':       275 [259.30us,    9.84s]    2.03s    1.69s    9.31m       239 [ 10.00ns, 300.50ms]  70.95ms  42.23ms   16.96s
                      'rnd_cst_lns':       275 [  6.66ms,    8.53s]    2.36s    1.63s   10.83m       266 [ 10.00ns, 124.79ms]  64.44ms  41.85ms   17.14s
                      'rnd_var_lns':       275 [  5.96ms,   10.29s]    2.40s    1.78s   10.99m       269 [ 10.00ns, 131.85ms]  63.69ms  42.94ms   17.13s
                     'violation_ls':       271 [758.17us,    2.19s] 452.31ms 334.22ms    2.04m       271 [400.00ns, 184.12ms]  95.38ms  35.22ms   25.85s
                     'violation_ls':       273 [721.33us,    2.19s] 535.02ms 371.36ms    2.43m       273 [660.00ns, 312.85ms] 118.45ms  67.15ms   32.34s
                     'violation_ls':       273 [760.82us,    1.18s] 386.63ms 240.28ms    1.76m       273 [430.00ns, 103.72ms]  72.27ms  24.22ms   19.73s
                     'violation_ls':       274 [590.94us,    1.84s] 449.38ms 342.36ms    2.05m       274 [740.00ns, 212.14ms]  95.02ms  44.37ms   26.04s
                     'violation_ls':       274 [758.10us,    1.96s] 358.13ms 297.81ms    1.64m       274 [950.00ns, 160.88ms]  76.69ms  31.21ms   21.01s

Search stats                        Bools  Conflicts  Branches  Restarts  BoolPropag  IntegerPropag
                           'core':  6'901     11'110    25'468     2'839  27'075'630     11'837'305
                     'default_lp':     87     13'573    61'409    10'060     452'279     19'159'537
                      'fs_random':     87          0       174       174           0          6'011
                      'fs_random':     87          0       174       174           0          6'011
                      'fs_random':     87          0       174       174           0          6'011
                      'fs_random':     87          0       174       174           0          6'011
                'fs_random_no_lp':     87          0       187       174           1          6'938
                'fs_random_no_lp':     87          1       202       174           4          7'600
                'fs_random_no_lp':     87          2       195       174           7          7'341
                'fs_random_no_lp':     87          6       198       174          19          7'264
        'fs_random_quick_restart':     87          0       174       174           0          6'011
        'fs_random_quick_restart':     87          0       174       174           0          6'011
        'fs_random_quick_restart':     87          0       174       174           0          6'011
        'fs_random_quick_restart':     87          0       174       174           0          6'011
  'fs_random_quick_restart_no_lp':     87          0       197       174           2          6'669
  'fs_random_quick_restart_no_lp':     87          0       202       174           1          6'723
  'fs_random_quick_restart_no_lp':     87          0       214       174           4          7'735
                 'lb_tree_search':     87        134    46'147    10'365     142'959      5'927'163
                         'max_lp':     87      7'490    45'449     9'783     266'712     11'610'369
                          'no_lp':  1'115     31'985    80'051     7'914   7'287'337     35'086'728
            'objective_lb_search':    169      5'092    56'275    14'266     432'516     12'810'000
     'objective_lb_search_max_lp':    169      6'147    77'074    16'265     625'407     18'033'104
      'objective_lb_search_no_lp':    450     25'598    59'176     7'300   1'573'022     30'229'434
                        'probing':    249         13       485       485       4'409         49'943
                 'probing_max_lp':    189         12       366       366       2'096         31'711
                   'pseudo_costs':    491      7'814    50'381     7'841   1'293'466     13'194'217
                  'quick_restart':    445      4'201    68'596    12'871   1'182'343     12'339'859
            'quick_restart_no_lp':  1'991     19'881    92'573     8'018   8'667'095     21'697'941
                  'reduced_costs':    567      9'391    54'903     7'719   2'534'134     12'843'889

SAT stats                           ClassicMinim  LitRemoved  LitLearned  LitForgotten  Subsumed  MClauses  MDecisions  MLitTrue  MSubsumed  MLitRemoved  MReused
                           'core':         9'388      47'996      49'311             0        76       628       3'138         0          0            0        2
                     'default_lp':         8'110      18'851     147'820        29'319       541     4'090      40'995         3        431        2'654      616
                      'fs_random':             0           0           0             0         0         0           0         0          0            0        0
                      'fs_random':             0           0           0             0         0         0           0         0          0            0        0
                      'fs_random':             0           0           0             0         0         0           0         0          0            0        0
                      'fs_random':             0           0           0             0         0         0           0         0          0            0        0
                'fs_random_no_lp':             0           0           0             0         0         0           0         0          0            0        0
                'fs_random_no_lp':             0           0          14             0         0         0           0         0          0            0        0
                'fs_random_no_lp':             0           0           3             0         0         0           0         0          0            0        0
                'fs_random_no_lp':             0           0           4             0         0         0           0         0          0            0        0
        'fs_random_quick_restart':             0           0           0             0         0         0           0         0          0            0        0
        'fs_random_quick_restart':             0           0           0             0         0         0           0         0          0            0        0
        'fs_random_quick_restart':             0           0           0             0         0         0           0         0          0            0        0
        'fs_random_quick_restart':             0           0           0             0         0         0           0         0          0            0        0
  'fs_random_quick_restart_no_lp':             0           0           0             0         0         0           0         0          0            0        0
  'fs_random_quick_restart_no_lp':             0           0           0             0         0         0           0         0          0            0        0
  'fs_random_quick_restart_no_lp':             0           0           0             0         0         0           0         0          0            0        0
                 'lb_tree_search':             8          10         483             0         0     3'826      19'162         0         41          170      252
                         'max_lp':         3'642       6'952      84'777             0       394     3'281      30'914         0        105          638      564
                          'no_lp':        26'211      92'940     349'519        99'834       457     3'359      29'745         0        619        4'413      455
            'objective_lb_search':         3'541       8'576      31'276             0       290     5'353      42'563         0      1'066        6'015    1'377
     'objective_lb_search_max_lp':         4'888      13'870      36'723             0       239     7'883      64'975         0      1'033        5'923    2'280
      'objective_lb_search_no_lp':        21'561      71'844     211'239        12'032       448     3'125      24'832         0      1'008        6'229      615
                        'probing':             0           0          13             0         0         0           0         0          0            0        0
                 'probing_max_lp':             0           0          12             0         0         0           0         0          0            0        0
                   'pseudo_costs':         4'349       8'730      87'734             0       342     3'227      33'514         0        725        5'149      546
                  'quick_restart':         2'741       7'308      44'093             0       166     4'457      44'612         5        625        4'416    1'000
            'quick_restart_no_lp':        14'487      52'369     228'405        63'364       375     3'648      30'225        30      1'814       12'362      435
                  'reduced_costs':         6'118      14'708      76'544             0       293     3'844      30'986        42      1'789       11'605      696

Lp stats                         Component  Iterations  AddedCuts  OPTIMAL  DUAL_F.  DUAL_U.
                  'default_lp':          1     215'896      8'058   21'923        0        4
                   'fs_random':          1           0          0        0        0        0
                   'fs_random':          1           0          0        1        0        0
                   'fs_random':          1           0          0        1        0        0
                   'fs_random':          1           0          0        1        0        0
     'fs_random_quick_restart':          1           0          0        0        0        0
     'fs_random_quick_restart':          1           0          0        0        0        0
     'fs_random_quick_restart':          1           0          0        1        0        0
     'fs_random_quick_restart':          1          65          0        1        1        0
              'lb_tree_search':          1     372'766      5'986   15'699    5'546        0
                      'max_lp':          1     150'240      7'751    9'958    4'421       10
         'objective_lb_search':          1     180'463      4'997    8'382        0        6
  'objective_lb_search_max_lp':          1     247'215      5'669    7'672    3'095        1
                     'probing':          1      18'572      3'629    1'473        1        7
              'probing_max_lp':          1       8'183      4'570    1'010       61        0
                'pseudo_costs':          1     136'486      9'094   10'172    3'201        7
               'quick_restart':          1     168'436      6'106   10'717        0        5
               'reduced_costs':          1     157'027     10'587   11'209    3'591       10

Lp dimension                                                                     Final dimension of first component
                  'default_lp':  505 rows, 313 columns, 1526 entries with magnitude in [1.422387e-03, 1.000000e+00]
                   'fs_random':       0 rows, 313 columns, 0 entries with magnitude in [0.000000e+00, 0.000000e+00]
                   'fs_random':   138 rows, 313 columns, 734 entries with magnitude in [5.417077e-02, 1.000000e+00]
                   'fs_random':   138 rows, 313 columns, 734 entries with magnitude in [5.417077e-02, 1.000000e+00]
                   'fs_random':    75 rows, 313 columns, 410 entries with magnitude in [5.417077e-02, 1.000000e+00]
     'fs_random_quick_restart':       0 rows, 313 columns, 0 entries with magnitude in [0.000000e+00, 0.000000e+00]
     'fs_random_quick_restart':       0 rows, 313 columns, 0 entries with magnitude in [0.000000e+00, 0.000000e+00]
     'fs_random_quick_restart':   138 rows, 313 columns, 734 entries with magnitude in [5.417077e-02, 1.000000e+00]
     'fs_random_quick_restart':    45 rows, 313 columns, 242 entries with magnitude in [1.903318e-01, 1.000000e+00]
              'lb_tree_search':  579 rows, 322 columns, 2277 entries with magnitude in [9.348549e-03, 1.000000e+00]
                      'max_lp':  514 rows, 322 columns, 2093 entries with magnitude in [1.077011e-02, 1.000000e+00]
         'objective_lb_search':  576 rows, 313 columns, 2290 entries with magnitude in [2.421806e-03, 1.000000e+00]
  'objective_lb_search_max_lp':  729 rows, 322 columns, 2096 entries with magnitude in [6.338692e-03, 1.000000e+00]
                     'probing':  787 rows, 313 columns, 6545 entries with magnitude in [1.663371e-03, 1.000000e+00]
              'probing_max_lp':  450 rows, 322 columns, 2705 entries with magnitude in [1.057420e-02, 1.000000e+00]
                'pseudo_costs':  375 rows, 322 columns, 1361 entries with magnitude in [1.021202e-02, 1.000000e+00]
               'quick_restart':  557 rows, 313 columns, 1617 entries with magnitude in [2.339162e-02, 1.000000e+00]
               'reduced_costs':  742 rows, 322 columns, 3068 entries with magnitude in [8.902988e-04, 1.000000e+00]

Lp debug                         CutPropag  CutEqPropag  Adjust  Overflow        Bad  BadScaling
                  'default_lp':         37           18   4'586         0    163'544           0
                   'fs_random':          0            0       0         0          0           0
                   'fs_random':          0            0       0         0          0           0
                   'fs_random':          0            0       0         0          0           0
                   'fs_random':          0            0       0         0          0           0
     'fs_random_quick_restart':          0            0       0         0          0           0
     'fs_random_quick_restart':          0            0       0         0          0           0
     'fs_random_quick_restart':          0            0       0         0          0           0
     'fs_random_quick_restart':          0            0       0         0          0           0
              'lb_tree_search':         20            0  10'954         0    103'254           0
                      'max_lp':          5            3   4'174         0    107'514           0
         'objective_lb_search':         18           11   3'297         0    207'886           0
  'objective_lb_search_max_lp':         73            5   6'228         0    223'176           0
                     'probing':          1           24   1'401         0  1'356'625           0
              'probing_max_lp':          9            1   1'064         0  1'115'699           0
                'pseudo_costs':          7            2   6'537         0    111'306           0
               'quick_restart':         47            2   5'194         0    294'766           0
               'reduced_costs':         32            2   5'916         0    152'326           0

Lp pool                          Constraints  Updates  Simplif  Merged  Shortened  Split  Strenghtened      Cuts/Call
                  'default_lp':        8'330      450   77'089      34     10'270  4'381        12'721   8'058/28'511
                   'fs_random':          306        0        0       0          0      0             0            0/0
                   'fs_random':          306        0        0       0          0      0             0            0/0
                   'fs_random':          306        0        0       0          0      0             0            0/0
                   'fs_random':          306        0        0       0          0      0             0            0/0
     'fs_random_quick_restart':          306        0        0       0          0      0             0            0/0
     'fs_random_quick_restart':          306        0        0       0          0      0             0            0/0
     'fs_random_quick_restart':          306        0        0       0          0      0             0            0/0
     'fs_random_quick_restart':          306        0        0       0          0      0             0            0/0
              'lb_tree_search':        9'479      203   32'821       8      5'014  1'759        24'336   5'986/22'237
                      'max_lp':       11'224      200   19'879      28      4'090  2'463        18'432   7'751/21'323
         'objective_lb_search':        5'287      343   40'863      16      4'695  4'537         8'114   4'997/14'235
  'objective_lb_search_max_lp':        9'165      359  144'883       5     12'987  2'397        42'891   5'669/15'843
                     'probing':        3'928      478    1'380       7        697    244         1'355    3'629/7'003
              'probing_max_lp':        8'070      388      953       1          0    358         2'364    4'570/8'897
                'pseudo_costs':       12'551      245   32'963      44      6'363  2'507        27'051   9'094/25'317
               'quick_restart':        6'409      448  101'944       3      9'308  6'154        12'899   6'106/18'773
               'reduced_costs':       13'049      293   90'343      39      7'927  3'051        38'799  10'587/29'983

Lp Cut            defaul  max_lp  quick_  reduce  pseudo  lb_tre  probin  object  probin  object
          CG_FF:     276     407      75     388     470     235      93     149     335     189
           CG_K:     149     271      46     304     295     131      42      56     184      98
           CG_R:     226     225      46     228     263      90      34      74      86      88
          CG_RB:     732     849     268     988     800     598     346     443     746     350
         CG_RBP:      48      88      17      62      72      70      30      43      80      22
         Clique:       -      98       -     109     111     115       -       -      61     149
             IB:   1'155     753   1'263     995     888     818     739   1'036     342     784
       MIR_1_FF:     565     514     444     726     594     401     273     401     330     432
        MIR_1_K:      90      60      53     122      86      29      21      61      20      69
       MIR_1_KL:       1       -       6       3       1       -       -       1       -       -
        MIR_1_R:      86      55      49      93      87      19      24      56      17      35
       MIR_1_RB:   1'013     883     776   1'181   1'128     699     413     575     470     645
      MIR_1_RBP:      67     114      25     145     131      85      16      22      70      66
       MIR_2_FF:     234     229     180     365     325     149     105     148     102     163
        MIR_2_K:      43      39      32      73      55      18      11      24       8      53
       MIR_2_KL:       2       1       1       9       2       -       1       -       -       -
        MIR_2_R:      66      47      51      85      76      34      38      44      17      27
       MIR_2_RB:     470     412     367     597     537     307     197     262     140     269
      MIR_2_RBP:      54      55      28     101      83      36      24      21      20      25
       MIR_3_FF:     133     141      94     282     224      89      36      96      63     120
        MIR_3_K:      32      36      25      76      55      34       5      22      12      58
       MIR_3_KL:       2       1       1       3       1       -       -       2       -       -
        MIR_3_R:      77      65      52     141     117      47      24      38      28      37
       MIR_3_RB:     294     257     198     459     344     224      96     171      88     188
      MIR_3_RBP:      43      48      16      80      69      30      10      14      13      29
       MIR_4_FF:     114      96      65     205     154      56      28      63      30      74
        MIR_4_K:      26      29      20      61      47      23       5      19       9      37
       MIR_4_KL:       2       2       1       2       2       -       -       -       1       -
        MIR_4_R:      73      67      35     103      87      40      16      29      19      21
       MIR_4_RB:     197     176     149     261     199     149      50     107      44     104
      MIR_4_RBP:      30      35      11      58      36      16       1       6      10      10
       MIR_5_FF:      74      65      43     101      71      44       8      50      14      48
        MIR_5_K:      17      16      16      35      28      19       4      21       5      32
       MIR_5_KL:       -       -       -       1       1       -       -       -       -       -
        MIR_5_R:      44      46      27      68      64      30       5      22      13      10
       MIR_5_RB:     130      90      67     147     103      70      26      56      22      56
      MIR_5_RBP:       8      13       5      26      14       8       1       2       3       3
       MIR_6_FF:      32      35      42      61      53      21      10      36       7      32
        MIR_6_K:      23      11      12      27      16      10       2      21       5      24
       MIR_6_KL:       -       -       2       -       -       -       -       1       1       -
        MIR_6_R:      43      29      19      34      29      17       5      10       3      11
       MIR_6_RB:      71      53      53      90      61      32      20      28      23      24
      MIR_6_RBP:      10       3       3      14      10       2       -       -       -       1
   ZERO_HALF_FF:     132     124      53     172     144      74      32      30      65      48
    ZERO_HALF_K:      21      27      11      28      15       6       4       7       7      10
    ZERO_HALF_R:     850     920   1'112   1'009     820     852     721     584     737   1'061
   ZERO_HALF_RB:     253     218     212     376     270     215      89     122     278     132
  ZERO_HALF_RBP:      50      48      35      93      56      44      24      24      42      35

LNS stats           Improv/Calls  Closed  Difficulty  TimeLimit
  'graph_arc_lns':        14/274     54%        0.99       0.11
  'graph_cst_lns':         3/243     56%        1.00       0.11
  'graph_dec_lns':        15/274     52%        0.99       0.11
  'graph_var_lns':        20/273     54%        0.99       0.11
      'rins/rens':        31/260     49%        0.84       0.10
    'rnd_cst_lns':        15/272     54%        1.00       0.11
    'rnd_var_lns':        20/274     53%        0.99       0.11

LS stats                   Batches  Restarts   LinMoves   GenMoves  CompoundMoves  WeightUpdates
       'fj_long_default':        1         1      9'732          0              0            229
       'fj_long_default':        1         1      9'853          0              0            147
   'fj_long_lin_default':        1         1          0      3'023            413              2
   'fj_long_lin_perturb':        1         1      9'392          0              0            608
    'fj_long_lin_random':        1         1      9'501          0              0            499
       'fj_long_perturb':        1         1          0      2'734            300              1
        'fj_long_random':        1         1      9'838          0              0            162
      'fj_short_default':        1         1          0      2'600            418              2
      'fj_short_default':        1         1      9'281          0              0            719
  'fj_short_lin_default':        1         1          0      2'690            469              1
  'fj_short_lin_default':        1         1          0      2'968            334              2
  'fj_short_lin_perturb':        1         1      9'898          0              0            102
   'fj_short_lin_random':        1         1          0      2'700            311              1
      'fj_short_perturb':        1         1      9'868          0              0            132
       'fj_short_random':        1         1          0      2'729            329              1
          'violation_ls':      271         0  1'280'807    467'541         41'376        207'371
          'violation_ls':      273         0  1'898'665    176'903         13'817        172'502
          'violation_ls':      273         0  2'473'403      2'289            123         60'169
          'violation_ls':      274         0  1'291'245    424'551         38'130        202'340
          'violation_ls':      274         0    435'515  1'109'229         54'901         96'391

Solutions (96)            Num     Rank
        'graph_dec_lns':    1  [65,65]
        'graph_var_lns':    2  [84,89]
                'no_lp':    8   [1,10]
         'pseudo_costs':    1  [66,66]
  'quick_restart_no_lp':   19  [11,88]
        'rins_pump_lns':    1  [64,64]
          'rnd_cst_lns':    2  [90,96]
          'rnd_var_lns':    1  [61,61]
         'violation_ls':   61   [7,95]

Objective bounds                      Num
                        'bool_core':    8
                   'initial_domain':    1
                   'lb_tree_search':    3
              'objective_lb_search':   23
       'objective_lb_search_max_lp':   36
        'objective_lb_search_no_lp':   35
  'objective_shaving_search_max_lp':    3

Solution repositories    Added  Queried  Ignored  Synchro
  'feasible solutions':  1'926    5'418        5    1'828
        'lp solutions':    391      133        0      378
                'pump':  5'044      141

Improving bounds shared            Num
                        'core':     88
                  'default_lp':    367
              'lb_tree_search':     50
                      'max_lp':      5
                       'no_lp':    369
         'objective_lb_search':    170
  'objective_lb_search_max_lp':    150
   'objective_lb_search_no_lp':     24
                     'probing':     14
              'probing_max_lp':      9
                'pseudo_costs':     23
               'quick_restart':    209
         'quick_restart_no_lp':  1'242
               'reduced_costs':    378

Clauses shared                   Num
                        'core':    2
                  'default_lp':   87
             'fs_random_no_lp':    2
              'lb_tree_search':   25
                      'max_lp':    8
                       'no_lp':   44
         'objective_lb_search':   27
  'objective_lb_search_max_lp':   30
   'objective_lb_search_no_lp':    6
                'pseudo_costs':    8
               'quick_restart':    1
         'quick_restart_no_lp':   48
               'reduced_costs':   40

CpSolverResponse summary:
status: OPTIMAL
objective: 1760
best_bound: 1760
integers: 314
booleans: 87
conflicts: 1
branches: 202
propagations: 4
integer_propagations: 7600
restarts: 174
lp_iterations: 0
walltime: 165.811
usertime: 165.811
deterministic_time: 427.599
gap_integral: 1682.44
solution_fingerprint: 0x9a3b1a11c38331de


--- Simulation Gantt  partir du modle mathmatique ---
{'big':1, 'due_date':119, 'pos_time':5, 'status':0, 'blocked':0, 'operations':["{'type':0, 'processing_time':47}"]}
{'big':1, 'due_date':114, 'pos_time':5, 'status':0, 'blocked':0, 'operations':["{'type':1, 'processing_time':57}", "{'type':0, 'processing_time':60}"]}
{'big':1, 'due_date':122, 'pos_time':5, 'status':0, 'blocked':0, 'operations':["{'type':1, 'processing_time':35}", "{'type':0, 'processing_time':60}"]}
{'big':1, 'due_date':83, 'pos_time':5, 'status':0, 'blocked':0, 'operations':["{'type':1, 'processing_time':59}"]}
{'big':1, 'due_date':129, 'pos_time':5, 'status':0, 'blocked':0, 'operations':["{'type':0, 'processing_time':31}"]}
{'big':1, 'due_date':109, 'pos_time':5, 'status':0, 'blocked':0, 'operations':["{'type':0, 'processing_time':40}", "{'type':1, 'processing_time':21}"]}
{'big':0, 'due_date':96, 'pos_time':5, 'status':0, 'blocked':0, 'operations':["{'type':1, 'processing_time':31}", "{'type':0, 'processing_time':37}"]}
{'big':1, 'due_date':164, 'pos_time':5, 'status':0, 'blocked':0, 'operations':["{'type':0, 'processing_time':19}", "{'type':1, 'processing_time':31}"]}
