created virtual environment CPython3.12.4.final.0-64 in 6547ms
  creator CPython3Posix(dest=/localscratch/aneumann.63393194.0/env, clear=False, no_vcs_ignore=False, global=False)
  seeder FromAppData(download=False, pip=bundle, via=copy, app_data_dir=/home/aneumann/.local/share/virtualenv)
    added seed packages: pip==25.1.1
  activators BashActivator,CShellActivator,FishActivator,NushellActivator,PowerShellActivator,PythonActivator
Looking in links: /cvmfs/soft.computecanada.ca/custom/python/wheelhouse/gentoo2023/x86-64-v3, /cvmfs/soft.computecanada.ca/custom/python/wheelhouse/gentoo2023/generic, /cvmfs/soft.computecanada.ca/custom/python/wheelhouse/generic
Requirement already satisfied: pip in /localscratch/aneumann.63393194.0/env/lib/python3.12/site-packages (25.1.1)
Looking in links: /cvmfs/soft.computecanada.ca/custom/python/wheelhouse/gentoo2023/x86-64-v3, /cvmfs/soft.computecanada.ca/custom/python/wheelhouse/gentoo2023/generic, /cvmfs/soft.computecanada.ca/custom/python/wheelhouse/generic
ERROR: protobuf-5.28.3-cp38-abi3-manylinux2014_x86_64.whl is not a supported wheel on this platform.
Looking in links: /cvmfs/soft.computecanada.ca/custom/python/wheelhouse/gentoo2023/x86-64-v3, /cvmfs/soft.computecanada.ca/custom/python/wheelhouse/gentoo2023/generic, /cvmfs/soft.computecanada.ca/custom/python/wheelhouse/generic
Processing /home/aneumann/projects/def-adhaj/aneumann/GNRS/wheels/immutabledict-4.2.0-py3-none-any.whl
Installing collected packages: immutabledict
Successfully installed immutabledict-4.2.0
Looking in links: /cvmfs/soft.computecanada.ca/custom/python/wheelhouse/gentoo2023/x86-64-v3, /cvmfs/soft.computecanada.ca/custom/python/wheelhouse/gentoo2023/generic, /cvmfs/soft.computecanada.ca/custom/python/wheelhouse/generic
Processing /cvmfs/soft.computecanada.ca/custom/python/wheelhouse/generic/ortools-9.10.4067+computecanada-cp312-cp312-linux_x86_64.whl (from -r /home/aneumann/projects/def-adhaj/aneumann/GNRS/requirements/or.txt (line 1))
Processing /cvmfs/soft.computecanada.ca/custom/python/wheelhouse/gentoo2023/x86-64-v3/matplotlib-3.10.0+computecanada-cp312-cp312-linux_x86_64.whl (from -r /home/aneumann/projects/def-adhaj/aneumann/GNRS/requirements/or.txt (line 2))
Processing /cvmfs/soft.computecanada.ca/custom/python/wheelhouse/gentoo2023/x86-64-v3/pandas-2.2.3+computecanada-cp312-cp312-linux_x86_64.whl (from -r /home/aneumann/projects/def-adhaj/aneumann/GNRS/requirements/or.txt (line 3))
Processing /cvmfs/soft.computecanada.ca/custom/python/wheelhouse/generic/absl_py-2.2.2+computecanada-py3-none-any.whl (from ortools<9.11,>=9.10->-r /home/aneumann/projects/def-adhaj/aneumann/GNRS/requirements/or.txt (line 1))
Processing /cvmfs/soft.computecanada.ca/custom/python/wheelhouse/gentoo2023/generic/numpy-2.2.2+computecanada-cp312-cp312-linux_x86_64.whl (from ortools<9.11,>=9.10->-r /home/aneumann/projects/def-adhaj/aneumann/GNRS/requirements/or.txt (line 1))
Processing /cvmfs/soft.computecanada.ca/custom/python/wheelhouse/gentoo2023/x86-64-v3/protobuf-6.30.2+computecanada-cp312-cp312-linux_x86_64.whl (from ortools<9.11,>=9.10->-r /home/aneumann/projects/def-adhaj/aneumann/GNRS/requirements/or.txt (line 1))
Requirement already satisfied: immutabledict>=3.0.0 in /localscratch/aneumann.63393194.0/env/lib/python3.12/site-packages (from ortools<9.11,>=9.10->-r /home/aneumann/projects/def-adhaj/aneumann/GNRS/requirements/or.txt (line 1)) (4.2.0)
Processing /cvmfs/soft.computecanada.ca/custom/python/wheelhouse/gentoo2023/generic/contourpy-1.3.1+computecanada-cp312-cp312-linux_x86_64.whl (from matplotlib->-r /home/aneumann/projects/def-adhaj/aneumann/GNRS/requirements/or.txt (line 2))
Processing /cvmfs/soft.computecanada.ca/custom/python/wheelhouse/generic/cycler-0.12.1+computecanada-py3-none-any.whl (from matplotlib->-r /home/aneumann/projects/def-adhaj/aneumann/GNRS/requirements/or.txt (line 2))
Processing /cvmfs/soft.computecanada.ca/custom/python/wheelhouse/generic/fonttools-4.58.2+computecanada-cp312-cp312-linux_x86_64.whl (from matplotlib->-r /home/aneumann/projects/def-adhaj/aneumann/GNRS/requirements/or.txt (line 2))
Processing /cvmfs/soft.computecanada.ca/custom/python/wheelhouse/gentoo2023/x86-64-v3/kiwisolver-1.4.8+computecanada-cp312-cp312-linux_x86_64.whl (from matplotlib->-r /home/aneumann/projects/def-adhaj/aneumann/GNRS/requirements/or.txt (line 2))
Processing /cvmfs/soft.computecanada.ca/custom/python/wheelhouse/generic/packaging-25.0+computecanada-py3-none-any.whl (from matplotlib->-r /home/aneumann/projects/def-adhaj/aneumann/GNRS/requirements/or.txt (line 2))
Processing /cvmfs/soft.computecanada.ca/custom/python/wheelhouse/gentoo2023/x86-64-v3/pillow-11.1.0+computecanada-cp312-cp312-linux_x86_64.whl (from matplotlib->-r /home/aneumann/projects/def-adhaj/aneumann/GNRS/requirements/or.txt (line 2))
Processing /cvmfs/soft.computecanada.ca/custom/python/wheelhouse/generic/pyparsing-3.2.1+computecanada-py3-none-any.whl (from matplotlib->-r /home/aneumann/projects/def-adhaj/aneumann/GNRS/requirements/or.txt (line 2))
Processing /cvmfs/soft.computecanada.ca/custom/python/wheelhouse/generic/python_dateutil-2.9.0.post0+computecanada-py2.py3-none-any.whl (from matplotlib->-r /home/aneumann/projects/def-adhaj/aneumann/GNRS/requirements/or.txt (line 2))
Processing /cvmfs/soft.computecanada.ca/custom/python/wheelhouse/generic/pytz-2025.2+computecanada-py2.py3-none-any.whl (from pandas->-r /home/aneumann/projects/def-adhaj/aneumann/GNRS/requirements/or.txt (line 3))
Processing /cvmfs/soft.computecanada.ca/custom/python/wheelhouse/generic/tzdata-2025.2+computecanada-py2.py3-none-any.whl (from pandas->-r /home/aneumann/projects/def-adhaj/aneumann/GNRS/requirements/or.txt (line 3))
Processing /cvmfs/soft.computecanada.ca/custom/python/wheelhouse/generic/six-1.17.0+computecanada-py2.py3-none-any.whl (from python-dateutil>=2.7->matplotlib->-r /home/aneumann/projects/def-adhaj/aneumann/GNRS/requirements/or.txt (line 2))
Installing collected packages: pytz, tzdata, six, pyparsing, protobuf, pillow, packaging, numpy, kiwisolver, fonttools, cycler, absl-py, python-dateutil, contourpy, pandas, matplotlib, ortools

Successfully installed absl-py-2.2.2+computecanada contourpy-1.3.1+computecanada cycler-0.12.1+computecanada fonttools-4.58.2+computecanada kiwisolver-1.4.8+computecanada matplotlib-3.10.0+computecanada numpy-2.2.2+computecanada ortools-9.10.4067+computecanada packaging-25.0+computecanada pandas-2.2.3+computecanada pillow-11.1.0+computecanada protobuf-6.30.2+computecanada pyparsing-3.2.1+computecanada python-dateutil-2.9.0.post0+computecanada pytz-2025.2+computecanada six-1.17.0+computecanada tzdata-2025.2+computecanada

Starting CP-SAT solver v9.10.4067
Parameters: max_time_in_seconds: 3600 max_memory_in_mb: 12000 log_search_progress: true enumerate_all_solutions: false absolute_gap_limit: 0 relative_gap_limit: 0
Setting number of workers to 48

Initial optimization model '': (model_fingerprint: 0xc57b395c9c8eba04)
#Variables: 289 (#ints: 10 in objective)
  - 194 Booleans in [0,1]
  - 95 in [0,515]
#kLinear1: 39
#kLinear2: 531
#kLinear3: 245
#kLinearN: 2'593 (#terms: 36'649)

Starting presolve at 0.00s
  1.77e-03s  0.00e+00d  [DetectDominanceRelations] 
  3.95e-02s  0.00e+00d  [PresolveToFixPoint] #num_loops=6 #num_dual_strengthening=3 
  3.15e-05s  0.00e+00d  [ExtractEncodingFromLinear] #potential_supersets=2 
[Symmetry] Graph for symmetry has 3'047 nodes and 25'691 arcs.
[Symmetry] Symmetry computation done. time: 0.00225481 dtime: 0.00232364
[Symmetry] #generators: 1, average support size: 22
[Symmetry] The model contains 239 duplicate constraints !
[Symmetry] 11 orbits with sizes: 2,2,2,2,2,2,2,2,2,2,...
[Symmetry] Num fixable by intersecting at_most_one with orbits: 1 largest_orbit: 2
  8.99e-03s  1.28e-03d  [Probe] #probed=240 #fixed_bools=1 #new_bounds=20 #equiv=1 
  5.70e-05s  0.00e+00d  [MaxClique] Merged 30(60 literals) into 12(24 literals) at_most_ones. 
  1.72e-03s  0.00e+00d  [DetectDominanceRelations] 
  1.78e-02s  0.00e+00d  [PresolveToFixPoint] #num_loops=4 #num_dual_strengthening=3 
  6.00e-03s  0.00e+00d  [ProcessAtMostOneAndLinear] 
  2.85e-03s  0.00e+00d  [DetectDuplicateConstraints] #duplicates=284 #without_enforcements=274 
  2.22e-03s  1.03e-04d  [DetectDominatedLinearConstraints] #relevant_constraints=2'009 #num_inclusions=1'477 
  3.40e-04s  0.00e+00d  [DetectDifferentVariables] #different=34 
  5.49e-04s  2.88e-05d  [ProcessSetPPC] #relevant_constraints=1'444 
  2.58e-05s  0.00e+00d  [FindAlmostIdenticalLinearConstraints] 
  8.56e-05s  5.49e-05d  [FindBigAtMostOneAndLinearOverlap] 
  7.17e-03s  2.09e-03d  [FindBigVerticalLinearOverlap] #blocks=37 #saved_nz=4'329 
  2.95e-04s  6.48e-05d  [FindBigHorizontalLinearOverlap] #linears=1'401 
  1.48e-05s  0.00e+00d  [MergeClauses] 
  1.80e-03s  0.00e+00d  [DetectDominanceRelations] 
  2.59e-02s  0.00e+00d  [PresolveToFixPoint] #num_loops=2 #num_dual_strengthening=1 
  2.60e-03s  0.00e+00d  [DetectDominanceRelations] 
  1.55e-02s  0.00e+00d  [PresolveToFixPoint] #num_loops=1 #num_dual_strengthening=1 
[Symmetry] Graph for symmetry has 2'823 nodes and 20'152 arcs.
[Symmetry] Symmetry computation done. time: 0.000895729 dtime: 0.00127736
  8.35e-03s  1.19e-03d  [Probe] #probed=238 #new_bounds=31 
  1.38e-05s  0.00e+00d  [MaxClique] 
  1.80e-03s  0.00e+00d  [DetectDominanceRelations] 
  2.31e-02s  0.00e+00d  [PresolveToFixPoint] #num_loops=2 #num_dual_strengthening=1 
  5.00e-03s  0.00e+00d  [ProcessAtMostOneAndLinear] 
  2.49e-03s  0.00e+00d  [DetectDuplicateConstraints] #without_enforcements=300 
  1.26e-03s  5.51e-05d  [DetectDominatedLinearConstraints] #relevant_constraints=1'714 #num_inclusions=546 
  3.34e-04s  0.00e+00d  [DetectDifferentVariables] #different=41 
  4.64e-04s  1.91e-05d  [ProcessSetPPC] #relevant_constraints=1'290 
  3.73e-05s  9.00e-08d  [FindAlmostIdenticalLinearConstraints] #num_tested_pairs=6 
  4.54e-05s  1.90e-05d  [FindBigAtMostOneAndLinearOverlap] 
  3.71e-03s  1.31e-03d  [FindBigVerticalLinearOverlap] #blocks=24 #saved_nz=1'988 
  2.49e-04s  4.86e-05d  [FindBigHorizontalLinearOverlap] #linears=1'158 
  1.42e-05s  0.00e+00d  [MergeClauses] 
  1.64e-03s  0.00e+00d  [DetectDominanceRelations] 
  2.02e-02s  0.00e+00d  [PresolveToFixPoint] #num_loops=2 #num_dual_strengthening=1 
  1.65e-03s  0.00e+00d  [DetectDominanceRelations] 
  1.40e-02s  0.00e+00d  [PresolveToFixPoint] #num_loops=1 #num_dual_strengthening=1 
[Symmetry] Graph for symmetry has 2'869 nodes and 18'164 arcs.
[Symmetry] Symmetry computation done. time: 0.000864367 dtime: 0.00117083
  7.87e-03s  1.08e-03d  [Probe] #probed=238 #new_bounds=17 
  1.34e-05s  0.00e+00d  [MaxClique] 
  1.64e-03s  0.00e+00d  [DetectDominanceRelations] 
  1.73e-02s  0.00e+00d  [PresolveToFixPoint] #num_loops=2 #num_dual_strengthening=1 
  4.40e-03s  0.00e+00d  [ProcessAtMostOneAndLinear] 
  2.43e-03s  0.00e+00d  [DetectDuplicateConstraints] #without_enforcements=316 
  9.03e-04s  3.75e-05d  [DetectDominatedLinearConstraints] #relevant_constraints=1'522 #num_inclusions=69 
  3.38e-04s  0.00e+00d  [DetectDifferentVariables] #different=44 
  3.88e-04s  1.44e-05d  [ProcessSetPPC] #relevant_constraints=1'115 
  4.33e-05s  4.55e-07d  [FindAlmostIdenticalLinearConstraints] #num_tested_pairs=16 
  4.50e-05s  1.71e-05d  [FindBigAtMostOneAndLinearOverlap] 
  2.90e-03s  1.08e-03d  [FindBigVerticalLinearOverlap] #blocks=9 #saved_nz=881 
  2.22e-04s  4.22e-05d  [FindBigHorizontalLinearOverlap] #linears=1'093 
  1.36e-05s  0.00e+00d  [MergeClauses] 
  1.56e-03s  0.00e+00d  [DetectDominanceRelations] 
  1.69e-02s  0.00e+00d  [PresolveToFixPoint] #num_loops=2 #num_dual_strengthening=1 
  6.80e-05s  0.00e+00d  [ExpandObjective] #entries=203 #tight_variables=75 #tight_constraints=39 

Presolve summary:
  - 51 affine relations were detected.
  - rule 'TODO dual: only one blocking constraint?' was applied 748 times.
  - rule 'TODO dual: only one unspecified blocking constraint?' was applied 130 times.
  - rule 'TODO duplicate: identical constraint with different enforcements' was applied 890 times.
  - rule 'affine: new relation' was applied 51 times.
  - rule 'at_most_one: removed literals' was applied 12 times.
  - rule 'at_most_one: size one' was applied 12 times.
  - rule 'at_most_one: transformed into max clique.' was applied 1 time.
  - rule 'deductions: 207 stored' was applied 1 time.
  - rule 'dual: fix variable' was applied 27 times.
  - rule 'dual: reduced domain' was applied 45 times.
  - rule 'duplicate: merged rhs of linear constraint' was applied 45 times.
  - rule 'duplicate: removed constraint' was applied 284 times.
  - rule 'enforcement: false literal' was applied 18 times.
  - rule 'enforcement: true literal' was applied 5 times.
  - rule 'exactly_one: x and not(x)' was applied 1 time.
  - rule 'incompatible linear: add implication' was applied 30 times.
  - rule 'linear matrix: common vertical rectangle' was applied 70 times.
  - rule 'linear: always true' was applied 807 times.
  - rule 'linear: doubleton free' was applied 10 times.
  - rule 'linear: empty' was applied 34 times.
  - rule 'linear: extracted enforcement literal' was applied 6'148 times.
  - rule 'linear: fixed or dup variables' was applied 2'677 times.
  - rule 'linear: positive equal one' was applied 2 times.
  - rule 'linear: reduced variable domains' was applied 177 times.
  - rule 'linear: remapped using affine relations' was applied 2'558 times.
  - rule 'linear: simplified rhs' was applied 8'672 times.
  - rule 'linear: variable substitution 1' was applied 10 times.
  - rule 'linear: variable substitution 2' was applied 4 times.
  - rule 'linear: variable substitution 3' was applied 1 time.
  - rule 'presolve: 95 unused variables removed.' was applied 1 time.
  - rule 'presolve: iteration' was applied 3 times.
  - rule 'probing: reduced enforced constraint to implication.' was applied 30 times.
  - rule 'symmetry: fixed to false in general orbit' was applied 1 time.

Presolved optimization model '': (model_fingerprint: 0xe5c7c3d9e7cc99d0)
#Variables: 198 (#ints: 10 in objective)
  - 58 Booleans in [0,1]
  - 101 different domains in [-2531,3572] with a largest complexity of 11.
#kExactlyOne: 1 (#literals: 3)
#kLinear2: 772 (#enforced: 707 #multi: 623)
#kLinear3: 229 (#enforced: 133)
#kLinearN: 1'237 (#enforced: 1'169) (#terms: 9'020)

Preloading model.
#Bound   0.28s best:inf   next:[166,4467] initial_domain
[Symmetry] Graph for symmetry has 2'732 nodes and 17'289 arcs.
[Symmetry] Symmetry computation done. time: 0.000778209 dtime: 0.00112295
#Model   0.28s var:198/198 constraints:2239/2239

Starting search at 0.29s with 48 workers.
16 full problem subsolvers: [core, default_lp, lb_tree_search, max_lp, no_lp, objective_lb_search, objective_lb_search_max_lp, objective_lb_search_no_lp, objective_shaving_search_max_lp, objective_shaving_search_no_lp, probing, probing_max_lp, pseudo_costs, quick_restart, quick_restart_no_lp, reduced_costs]
30 first solution subsolvers: [fj_long_default(2), fj_long_lin_default, fj_long_lin_perturb, fj_long_lin_random, fj_long_perturb, fj_long_random, fj_short_default(2), fj_short_lin_default(2), fj_short_lin_perturb, fj_short_lin_random, fj_short_perturb, fj_short_random, fs_random(4), fs_random_no_lp(4), fs_random_quick_restart(4), fs_random_quick_restart_no_lp(3)]
13 incomplete subsolvers: [feasibility_pump, graph_arc_lns, graph_cst_lns, graph_dec_lns, graph_var_lns, rins/rens, rnd_cst_lns, rnd_var_lns, violation_ls(5)]
3 helper subsolvers: [neighborhood_helper, synchronization_agent, update_gap_integral]
#Bound   0.31s best:inf   next:[207,4467] objective_lb_search_no_lp
#Bound   0.33s best:inf   next:[280,4467] objective_lb_search_no_lp
#1       0.33s best:2178  next:[280,2177] quick_restart_no_lp (fixed_bools=0/85)
#2       0.33s best:1930  next:[280,1929] no_lp (fixed_bools=0/85)
#3       0.34s best:1929  next:[280,1928] no_lp (fixed_bools=0/93)
#4       0.35s best:1857  next:[280,1856] no_lp (fixed_bools=0/102)
#5       0.35s best:1822  next:[280,1821] no_lp (fixed_bools=0/106)
#6       0.36s best:1775  next:[280,1774] no_lp (fixed_bools=0/115)
#7       0.38s best:1765  next:[280,1764] no_lp (fixed_bools=0/118)
#8       0.39s best:1701  next:[280,1700] no_lp (fixed_bools=0/125)
#9       0.39s best:1674  next:[280,1673] no_lp (fixed_bools=0/128)
#10      0.39s best:1657  next:[280,1656] no_lp (fixed_bools=0/130)
#11      0.42s best:1618  next:[280,1617] no_lp (fixed_bools=0/145)
#12      0.49s best:1617  next:[280,1616] violation_ls(batch:2 #solutions_imported:2 #lin_moves:6 #lin_evals:27'060 #gen_moves:12'693 #gen_evals:0 #comp_moves:391 #backtracks:6'147 #weight_updates:149)
#13      0.49s best:1616  next:[280,1615] violation_ls(batch:3 #solutions_imported:3 #lin_moves:18 #lin_evals:27'123 #gen_moves:12'693 #gen_evals:0 #comp_moves:391 #backtracks:6'147 #weight_updates:157)
#14      0.49s best:1615  next:[280,1614] violation_ls(batch:4 #solutions_imported:4 #lin_moves:18 #lin_evals:27'153 #gen_moves:12'711 #gen_evals:0 #comp_moves:397 #backtracks:6'153 #weight_updates:157)
#15      0.49s best:1614  next:[280,1613] violation_ls(batch:5 #solutions_imported:5 #lin_moves:18 #lin_evals:27'173 #gen_moves:12'723 #gen_evals:0 #comp_moves:403 #backtracks:6'156 #weight_updates:157)
#16      0.49s best:1613  next:[280,1612] violation_ls(batch:6 #solutions_imported:6 #lin_moves:213 #lin_evals:28'129 #gen_moves:12'723 #gen_evals:0 #comp_moves:403 #backtracks:6'156 #weight_updates:299)
#17      0.50s best:1612  next:[280,1611] violation_ls(batch:7 #solutions_imported:7 #lin_moves:213 #lin_evals:28'150 #gen_moves:12'736 #gen_evals:0 #comp_moves:404 #backtracks:6'162 #weight_updates:299)
#18      0.50s best:1611  next:[280,1610] violation_ls(batch:8 #solutions_imported:8 #lin_moves:503 #lin_evals:29'605 #gen_moves:12'736 #gen_evals:0 #comp_moves:404 #backtracks:6'162 #weight_updates:508)
#19      0.50s best:1610  next:[280,1609] violation_ls(batch:9 #solutions_imported:9 #lin_moves:503 #lin_evals:29'608 #gen_moves:12'737 #gen_evals:0 #comp_moves:405 #backtracks:6'162 #weight_updates:508)
#20      0.50s best:1609  next:[280,1608] violation_ls(batch:10 #solutions_imported:10 #lin_moves:720 #lin_evals:30'392 #gen_moves:12'737 #gen_evals:0 #comp_moves:405 #backtracks:6'162 #weight_updates:590)
#21      0.51s best:1608  next:[280,1607] violation_ls(batch:11 #solutions_imported:11 #lin_moves:720 #lin_evals:30'467 #gen_moves:12'780 #gen_evals:0 #comp_moves:406 #backtracks:6'183 #weight_updates:590)
#22      0.51s best:1607  next:[280,1606] graph_dec_lns (d=0.94 s=108 t=0.10 p=1.00 stall=5 h=auto_l0)
#23      0.52s best:1539  next:[280,1538] graph_var_lns (d=0.96 s=104 t=0.10 p=1.00 stall=6 h=auto_l0)
#Bound   0.55s best:1539  next:[286,1538] default_lp
#Bound   0.59s best:1539  next:[291,1538] probing
#24      0.59s best:1490  next:[291,1489] graph_dec_lns (d=0.96 s=147 t=0.10 p=1.00 stall=0 h=auto_l0)
#Bound   0.60s best:1490  next:[297,1489] probing
#25      0.60s best:1483  next:[297,1482] graph_arc_lns (d=0.94 s=126 t=0.10 p=1.00 stall=0 h=auto_l0)
#26      0.61s best:1482  next:[297,1481] violation_ls(batch:4 #solutions_imported:4 #lin_moves:5'077 #lin_evals:67'100 #gen_moves:17'958 #gen_evals:0 #comp_moves:944 #backtracks:8'507 #weight_updates:5'171)
#27      0.61s best:1481  next:[297,1480] violation_ls(batch:5 #solutions_imported:5 #lin_moves:5'093 #lin_evals:67'190 #gen_moves:17'958 #gen_evals:0 #comp_moves:944 #backtracks:8'507 #weight_updates:5'185)
#28      0.61s best:1480  next:[297,1479] violation_ls(batch:4 #solutions_imported:4 #lin_moves:23'425 #lin_evals:97'923 #weight_updates:1'501)
#29      0.62s best:1479  next:[297,1478] violation_ls(batch:5 #solutions_imported:5 #lin_moves:23'427 #lin_evals:97'941 #weight_updates:1'502)
#30      0.62s best:1478  next:[297,1477] violation_ls(batch:6 #solutions_imported:6 #lin_moves:23'427 #lin_evals:98'154 #gen_moves:90 #gen_evals:0 #comp_moves:4 #backtracks:43 #weight_updates:1'502)
#31      0.62s best:1477  next:[297,1476] violation_ls(batch:7 #solutions_imported:7 #lin_moves:23'427 #lin_evals:98'200 #gen_moves:116 #gen_evals:0 #comp_moves:6 #backtracks:55 #weight_updates:1'502)
#32      0.62s best:1476  next:[297,1475] violation_ls(batch:8 #solutions_imported:8 #lin_moves:23'463 #lin_evals:98'415 #gen_moves:116 #gen_evals:0 #comp_moves:6 #backtracks:55 #weight_updates:1'534)
#33      0.62s best:1475  next:[297,1474] violation_ls(batch:9 #solutions_imported:9 #lin_moves:23'463 #lin_evals:98'509 #gen_moves:158 #gen_evals:0 #comp_moves:8 #backtracks:75 #weight_updates:1'534)
#34      0.62s best:1474  next:[297,1473] violation_ls(batch:10 #solutions_imported:10 #lin_moves:23'463 #lin_evals:98'835 #gen_moves:290 #gen_evals:0 #comp_moves:12 #backtracks:139 #weight_updates:1'534)
#35      0.62s best:1473  next:[297,1472] violation_ls(batch:6 #solutions_imported:6 #lin_moves:80 #lin_evals:53'895 #gen_moves:24'809 #gen_evals:0 #comp_moves:1'066 #backtracks:11'870 #weight_updates:327)
#36      0.63s best:1472  next:[297,1471] violation_ls(batch:7 #solutions_imported:7 #lin_moves:144 #lin_evals:54'155 #gen_moves:24'809 #gen_evals:0 #comp_moves:1'066 #backtracks:11'870 #weight_updates:353)
#37      0.63s best:1471  next:[297,1470] violation_ls(batch:8 #solutions_imported:8 #lin_moves:144 #lin_evals:54'176 #gen_moves:24'823 #gen_evals:0 #comp_moves:1'068 #backtracks:11'876 #weight_updates:353)
#38      0.63s best:1470  next:[297,1469] violation_ls(batch:13 #solutions_imported:13 #lin_moves:23'799 #lin_evals:100'526 #gen_moves:338 #gen_evals:0 #comp_moves:16 #backtracks:161 #weight_updates:1'764)
#39      0.64s best:1469  next:[297,1468] violation_ls(batch:10 #solutions_imported:10 #lin_moves:266 #lin_evals:56'612 #gen_moves:25'631 #gen_evals:0 #comp_moves:1'122 #backtracks:12'253 #weight_updates:456)
#40      0.65s best:1468  next:[297,1467] violation_ls(batch:14 #solutions_imported:14 #lin_moves:720 #lin_evals:37'643 #gen_moves:15'946 #gen_evals:0 #comp_moves:630 #backtracks:7'654 #weight_updates:640)
#Bound   0.66s best:1468  next:[307,1467] probing
#41      0.67s best:1467  next:[307,1466] violation_ls(batch:12 #solutions_imported:12 #lin_moves:266 #lin_evals:61'958 #gen_moves:28'055 #gen_evals:0 #comp_moves:1'278 #backtracks:13'387 #weight_updates:497)
#42      0.67s best:1466  next:[307,1465] violation_ls(batch:13 #solutions_imported:13 #lin_moves:310 #lin_evals:62'208 #gen_moves:28'055 #gen_evals:0 #comp_moves:1'278 #backtracks:13'387 #weight_updates:537)
#Bound   0.68s best:1466  next:[309,1465] probing
#43      0.68s best:1465  next:[309,1464] violation_ls(batch:14 #solutions_imported:14 #lin_moves:354 #lin_evals:62'413 #gen_moves:28'055 #gen_evals:0 #comp_moves:1'278 #backtracks:13'387 #weight_updates:559)
#44      0.69s best:1464  next:[309,1463] graph_var_lns (d=0.97 s=111 t=0.10 p=1.00 stall=0 h=auto_l0)
#45      0.69s best:1384  next:[309,1383] graph_var_lns (d=0.98 s=150 t=0.10 p=1.00 stall=0 h=auto_l0)
#Bound   0.77s best:1384  next:[312,1383] probing
#Bound   0.79s best:1384  next:[315,1383] objective_lb_search_no_lp
#Bound   0.80s best:1384  next:[620,1383] objective_lb_search_no_lp
#46      1.03s best:1355  next:[620,1354] quick_restart_no_lp (fixed_bools=0/245)
#47      1.04s best:1354  next:[620,1353] violation_ls(batch:12 #solutions_imported:5 #lin_moves:49'193 #lin_evals:304'404 #gen_moves:21'673 #gen_evals:0 #comp_moves:1'173 #backtracks:10'248 #weight_updates:41'050)
#48      1.04s best:1353  next:[620,1352] violation_ls(batch:13 #solutions_imported:6 #lin_moves:49'193 #lin_evals:304'492 #gen_moves:21'718 #gen_evals:0 #comp_moves:1'174 #backtracks:10'270 #weight_updates:41'050)
#49      1.04s best:1352  next:[620,1351] violation_ls(batch:14 #solutions_imported:7 #lin_moves:49'280 #lin_evals:304'885 #gen_moves:21'718 #gen_evals:0 #comp_moves:1'174 #backtracks:10'270 #weight_updates:41'091)
#50      1.04s best:1351  next:[620,1350] violation_ls(batch:15 #solutions_imported:8 #lin_moves:49'281 #lin_evals:304'893 #gen_moves:21'718 #gen_evals:0 #comp_moves:1'174 #backtracks:10'270 #weight_updates:41'091)
#51      1.05s best:1348  next:[620,1347] default_lp (fixed_bools=0/101)
#52      1.10s best:1341  next:[620,1340] quick_restart_no_lp (fixed_bools=0/264)
#53      1.21s best:1337  next:[620,1336] quick_restart_no_lp (fixed_bools=0/275)
#54      1.22s best:1336  next:[620,1335] quick_restart_no_lp (fixed_bools=0/291)
#55      1.31s best:1335  next:[620,1334] violation_ls(batch:11 #solutions_imported:9 #lin_moves:5'103 #lin_evals:189'766 #gen_moves:73'835 #gen_evals:0 #comp_moves:2'403 #backtracks:35'703 #weight_updates:5'740)
#56      1.31s best:1334  next:[620,1333] violation_ls(batch:12 #solutions_imported:10 #lin_moves:5'135 #lin_evals:189'906 #gen_moves:73'835 #gen_evals:0 #comp_moves:2'403 #backtracks:35'703 #weight_updates:5'756)
#57      1.46s best:1308  next:[620,1307] default_lp (fixed_bools=0/129)
#58      1.48s best:1220  next:[620,1219] rnd_var_lns (d=0.97 s=122 t=0.10 p=1.00 stall=0 h=auto_l0)
#59      1.49s best:1218  next:[620,1217] quick_restart_no_lp (fixed_bools=0/340)
#60      1.51s best:1217  next:[620,1216] violation_ls(batch:17 #solutions_imported:10 #lin_moves:49'281 #lin_evals:309'585 #gen_moves:23'819 #gen_evals:0 #comp_moves:1'269 #backtracks:11'273 #weight_updates:41'126)
#61      1.51s best:1216  next:[620,1215] violation_ls(batch:17 #solutions_imported:16 #lin_moves:24'051 #lin_evals:150'825 #gen_moves:16'586 #gen_evals:0 #comp_moves:2'026 #backtracks:7'276 #weight_updates:1'952)
#62      1.51s best:1215  next:[620,1214] violation_ls(batch:17 #solutions_imported:16 #lin_moves:354 #lin_evals:110'113 #gen_moves:41'194 #gen_evals:0 #comp_moves:2'928 #backtracks:19'121 #weight_updates:646)
#63      1.52s best:1214  next:[620,1213] violation_ls(batch:17 #solutions_imported:16 #lin_moves:19'811 #lin_evals:135'457 #gen_moves:16'805 #gen_evals:0 #comp_moves:677 #backtracks:8'060 #weight_updates:1'565)
#64      1.58s best:1213  next:[620,1212] violation_ls(batch:15 #solutions_imported:12 #lin_moves:5'136 #lin_evals:239'292 #gen_moves:89'532 #gen_evals:0 #comp_moves:4'217 #backtracks:42'644 #weight_updates:5'862)
#65      1.58s best:1212  next:[620,1211] violation_ls(batch:16 #solutions_imported:13 #lin_moves:5'164 #lin_evals:239'456 #gen_moves:89'532 #gen_evals:0 #comp_moves:4'217 #backtracks:42'644 #weight_updates:5'887)
#Bound   1.59s best:1212  next:[621,1211] objective_shaving_search_no_lp (vars=212 csts=2230)
#Bound   1.59s best:1212  next:[622,1211] objective_lb_search_no_lp
#Bound   1.60s best:1212  next:[623,1211] objective_lb_search_no_lp
#Bound   1.70s best:1212  next:[629,1211] objective_lb_search_no_lp
#Bound   1.71s best:1212  next:[642,1211] objective_lb_search_no_lp
#Bound   1.72s best:1212  next:[643,1211] objective_lb_search_no_lp
#Bound   1.95s best:1212  next:[644,1211] objective_lb_search_no_lp
#Bound   2.08s best:1212  next:[650,1211] objective_lb_search_no_lp
#66      2.23s best:1200  next:[650,1199] rnd_var_lns (d=0.99 s=309 t=0.10 p=0.86 stall=1 h=auto_l0)
#Bound   2.33s best:1200  next:[652,1199] objective_lb_search_no_lp
#67      2.35s best:1197  next:[652,1196] rnd_var_lns (d=0.98 s=272 t=0.10 p=0.91 stall=0 h=auto_l0)
#Bound   2.87s best:1197  next:[654,1196] objective_lb_search_no_lp
#Bound   3.06s best:1197  next:[667,1196] objective_lb_search_no_lp
#Bound   3.21s best:1197  next:[669,1196] objective_lb_search_no_lp
#Bound   3.53s best:1197  next:[671,1196] objective_lb_search_no_lp
#Bound   3.97s best:1197  next:[677,1196] objective_lb_search_no_lp [skipped_logs=1]
#Bound   5.01s best:1197  next:[683,1196] objective_lb_search_no_lp [skipped_logs=1]
#Bound   5.73s best:1197  next:[698,1196] objective_lb_search_no_lp [skipped_logs=2]
#Bound   7.05s best:1197  next:[702,1196] objective_lb_search_max_lp
#Bound   7.96s best:1197  next:[703,1196] objective_lb_search_max_lp [skipped_logs=0]
#Bound   9.48s best:1197  next:[705,1196] objective_lb_search_max_lp
#Bound   9.83s best:1197  next:[709,1196] objective_lb_search_no_lp [skipped_logs=0]
#Bound  11.90s best:1197  next:[710,1196] objective_lb_search
#Bound  12.28s best:1197  next:[711,1196] objective_lb_search_no_lp
#Bound  12.97s best:1197  next:[715,1196] objective_lb_search_no_lp [skipped_logs=0]
#Bound  13.49s best:1197  next:[716,1196] objective_lb_search_no_lp [skipped_logs=0]
#Bound  14.39s best:1197  next:[740,1196] objective_lb_search_max_lp [skipped_logs=0]
#Bound  17.17s best:1197  next:[741,1196] objective_shaving_search_no_lp (vars=214 csts=2256)
#Bound  18.87s best:1197  next:[743,1196] objective_lb_search
#Bound  19.93s best:1197  next:[744,1196] objective_lb_search_no_lp
#Bound  20.15s best:1197  next:[761,1196] objective_lb_search
#Bound  23.20s best:1197  next:[770,1196] objective_lb_search
#Bound  24.72s best:1197  next:[771,1196] objective_lb_search
#Bound  26.62s best:1197  next:[774,1196] objective_lb_search
#Bound  28.05s best:1197  next:[775,1196] objective_lb_search_no_lp
#Bound  29.50s best:1197  next:[776,1196] objective_lb_search_no_lp
#Bound  31.55s best:1197  next:[777,1196] objective_lb_search
#Bound  33.41s best:1197  next:[778,1196] lb_tree_search (nodes=2245/2245 rc=9 decisions=17592 @root=24 restarts=10) 
#Bound  34.74s best:1197  next:[779,1196] lb_tree_search (nodes=2266/2266 rc=9 decisions=17896 @root=25 restarts=10) 
#Bound  36.02s best:1197  next:[780,1196] objective_lb_search_no_lp
#Bound  37.09s best:1197  next:[781,1196] lb_tree_search (nodes=2315/2315 rc=9 decisions=18570 @root=27 restarts=10) 
#Bound  38.85s best:1197  next:[782,1196] lb_tree_search (nodes=2342/2343 rc=9 decisions=18924 @root=28 restarts=10) 
#Bound  39.93s best:1197  next:[783,1196] objective_lb_search_no_lp
#Bound  41.66s best:1197  next:[784,1196] lb_tree_search (nodes=2405/2406 rc=10 decisions=19780 @root=30 restarts=10) 
#Bound  42.49s best:1197  next:[785,1196] lb_tree_search (nodes=2437/2438 rc=10 decisions=20203 @root=31 restarts=10) 
#Bound  43.97s best:1197  next:[786,1196] lb_tree_search (nodes=2467/2468 rc=11 decisions=20623 @root=32 restarts=10) 
#Bound  44.51s best:1197  next:[788,1196] objective_lb_search_no_lp
#Bound  46.46s best:1197  next:[789,1196] lb_tree_search (nodes=2556/2557 rc=11 decisions=21697 @root=34 restarts=10) 
#Bound  47.36s best:1197  next:[790,1196] lb_tree_search (nodes=2586/2587 rc=11 decisions=22186 @root=35 restarts=10) 
#Bound  48.34s best:1197  next:[791,1196] lb_tree_search (nodes=2624/2625 rc=11 decisions=22654 @root=36 restarts=10) 
#Bound  49.27s best:1197  next:[792,1196] lb_tree_search (nodes=2662/2663 rc=11 decisions=23088 @root=37 restarts=10) 
#Bound  49.56s best:1197  next:[793,1196] objective_lb_search_max_lp
#Bound  51.95s best:1197  next:[794,1196] lb_tree_search (nodes=2722/2723 rc=11 decisions=23906 @root=38 restarts=10) 
#Bound  51.97s best:1197  next:[796,1196] objective_lb_search_no_lp
#Bound  52.29s best:1197  next:[797,1196] objective_lb_search
#Bound  52.64s best:1197  next:[799,1196] objective_lb_search_no_lp
#Bound  55.01s best:1197  next:[802,1196] objective_lb_search_no_lp
#Bound  55.78s best:1197  next:[803,1196] objective_lb_search_no_lp
#Bound  56.03s best:1197  next:[804,1196] objective_lb_search_no_lp
#Bound  57.40s best:1197  next:[805,1196] objective_lb_search_no_lp
#Bound  60.45s best:1197  next:[806,1196] objective_lb_search
#Bound  62.37s best:1197  next:[807,1196] objective_lb_search_no_lp
#Bound  63.76s best:1197  next:[808,1196] lb_tree_search (nodes=3263/3264 rc=19 decisions=28799 @root=42 restarts=10) 
#Bound  63.90s best:1197  next:[809,1196] objective_lb_search_no_lp
#Bound  64.95s best:1197  next:[811,1196] objective_lb_search_no_lp
#Bound  66.06s best:1197  next:[812,1196] objective_lb_search_no_lp
#Bound  66.37s best:1197  next:[813,1196] objective_lb_search_no_lp
#Bound  67.62s best:1197  next:[814,1196] objective_lb_search_no_lp
#Bound  68.28s best:1197  next:[815,1196] objective_lb_search_no_lp
#Bound  69.87s best:1197  next:[817,1196] objective_lb_search_no_lp
#Bound  73.47s best:1197  next:[818,1196] lb_tree_search (nodes=3632/3637 rc=22 decisions=32997 @root=46 restarts=10) 
#Bound  75.12s best:1197  next:[819,1196] lb_tree_search (nodes=3675/3680 rc=22 decisions=33572 @root=47 restarts=10) 
#Bound  76.81s best:1197  next:[820,1196] lb_tree_search (nodes=3713/3718 rc=22 decisions=34172 @root=48 restarts=10) 
#Bound  78.41s best:1197  next:[822,1196] objective_lb_search_max_lp
#Bound  79.68s best:1197  next:[823,1196] objective_lb_search_no_lp
#Bound  81.05s best:1197  next:[825,1196] objective_lb_search_no_lp
#Bound  82.70s best:1197  next:[827,1196] objective_lb_search_no_lp
#Bound  83.11s best:1197  next:[828,1196] objective_lb_search_no_lp
#Bound  84.48s best:1197  next:[830,1196] objective_lb_search_no_lp
#Bound  89.35s best:1197  next:[831,1196] lb_tree_search (nodes=4189/4197 rc=27 decisions=39442 @root=52 restarts=10) 
#Bound  90.67s best:1197  next:[833,1196] objective_lb_search_no_lp
#Bound  92.98s best:1197  next:[844,1196] objective_lb_search_no_lp
#Bound  97.18s best:1197  next:[858,1196] objective_lb_search_no_lp
#Bound  97.50s best:1197  next:[869,1196] objective_lb_search_no_lp
#Bound  98.31s best:1197  next:[870,1196] objective_lb_search_no_lp
#Bound  98.74s best:1197  next:[877,1196] objective_lb_search_no_lp
#Bound  99.26s best:1197  next:[882,1196] objective_lb_search_no_lp
#Bound 111.74s best:1197  next:[883,1196] objective_lb_search_no_lp
#Bound 115.41s best:1197  next:[884,1196] lb_tree_search (nodes=6172/6236 rc=39 decisions=52915 @root=56 restarts=10) 
#Model 116.19s var:196/198 constraints:2132/2239
#Bound 116.99s best:1197  next:[885,1196] lb_tree_search (nodes=5921/6260 rc=40 decisions=53596 @root=57 restarts=10) 
#Bound 118.74s best:1197  next:[886,1196] lb_tree_search (nodes=5578/6280 rc=41 decisions=54270 @root=58 restarts=10) 
#Bound 119.93s best:1197  next:[887,1196] lb_tree_search (nodes=5321/6313 rc=42 decisions=54951 @root=59 restarts=10) 
#Bound 121.31s best:1197  next:[888,1196] lb_tree_search (nodes=5319/6354 rc=42 decisions=55743 @root=60 restarts=10) 
#Bound 122.64s best:1197  next:[889,1196] lb_tree_search (nodes=5350/6397 rc=42 decisions=56489 @root=61 restarts=10) 
#Bound 124.56s best:1197  next:[890,1196] lb_tree_search (nodes=5358/6419 rc=42 decisions=57160 @root=62 restarts=10) 
#Bound 127.67s best:1197  next:[891,1196] lb_tree_search (nodes=5393/6471 rc=42 decisions=57868 @root=65 restarts=10) 
#Bound 129.36s best:1197  next:[892,1196] lb_tree_search (nodes=5368/6497 rc=42 decisions=58518 @root=66 restarts=10) 
#Bound 131.12s best:1197  next:[893,1196] lb_tree_search (nodes=5367/6517 rc=42 decisions=59166 @root=68 restarts=10) 
#Bound 133.46s best:1197  next:[894,1196] lb_tree_search (nodes=5360/6536 rc=42 decisions=59723 @root=69 restarts=10) 
#Model 133.86s var:195/198 constraints:2072/2239
#Model 134.21s var:193/198 constraints:1944/2239
#Bound 134.47s best:1197  next:[895,1196] lb_tree_search (nodes=4279/6543 rc=43 decisions=59992 @root=71 restarts=10) 
#Bound 135.05s best:1197  next:[896,1196] lb_tree_search (nodes=3835/6552 rc=43 decisions=60220 @root=72 restarts=10) 
#Bound 135.97s best:1197  next:[897,1196] lb_tree_search (nodes=3748/6554 rc=43 decisions=60473 @root=73 restarts=10) 
#Bound 135.97s best:1197  next:[901,1196] objective_lb_search
#Bound 138.10s best:1197  next:[902,1196] lb_tree_search (nodes=3161/6598 rc=43 decisions=61282 @root=75 restarts=10) 
#Bound 138.54s best:1197  next:[903,1196] lb_tree_search (nodes=3038/6602 rc=43 decisions=61450 @root=76 restarts=10) 
#Bound 139.56s best:1197  next:[904,1196] lb_tree_search (nodes=2939/6610 rc=43 decisions=61692 @root=78 restarts=10) 
#Bound 140.11s best:1197  next:[905,1196] lb_tree_search (nodes=2925/6617 rc=44 decisions=61931 @root=79 restarts=10) 
#Bound 140.79s best:1197  next:[907,1196] objective_lb_search_no_lp
#Bound 140.94s best:1197  next:[910,1196] objective_lb_search
#Bound 141.68s best:1197  next:[912,1196] objective_lb_search_no_lp
#Model 141.97s var:192/198 constraints:1909/2239
#Model 142.25s var:186/198 constraints:1629/2239
#Bound 142.58s best:1197  next:[914,1196] objective_lb_search
#Model 142.66s var:185/198 constraints:1577/2239
#Bound 142.67s best:1197  next:[936,1196] objective_lb_search
#Bound 142.80s best:1197  next:[950,1196] objective_lb_search_no_lp
#Bound 142.85s best:1197  next:[1054,1196] objective_lb_search
#Bound 143.22s best:1197  next:[1055,1196] objective_lb_search_no_lp
#Model 143.24s var:184/198 constraints:1299/2239
#Model 143.29s var:183/198 constraints:1226/2239
#Bound 143.30s best:1197  next:[1057,1196] objective_lb_search_max_lp
#Model 143.37s var:182/198 constraints:1216/2239
#Model 143.48s var:181/198 constraints:1204/2239
#Bound 143.50s best:1197  next:[1123,1196] objective_lb_search_no_lp
#Model 143.56s var:180/198 constraints:1153/2239
#Model 143.58s var:179/198 constraints:1082/2239
#Model 143.60s var:172/198 constraints:791/2239
#Model 143.62s var:165/198 constraints:529/2239
#Model 143.64s var:161/198 constraints:428/2239
#Model 143.65s var:160/198 constraints:390/2239
#Model 143.66s var:159/198 constraints:353/2239
#Model 143.67s var:158/198 constraints:333/2239
#Bound 143.67s best:1197  next:[1135,1196] objective_lb_search_no_lp
#Bound 143.67s best:1197  next:[1160,1196] objective_lb_search_no_lp
#Model 143.67s var:157/198 constraints:302/2239
#Done  143.67s no_lp
#Done  143.68s quick_restart_no_lp
#Model 143.68s var:155/198 constraints:256/2239
#Done  143.68s core
#Done  143.68s objective_lb_search_max_lp
#Model 143.68s var:154/198 constraints:250/2239

Task timing                                  n [     min,      max]      avg      dev     time         n [     min,      max]      avg      dev    dtime
                             'core':         1 [   2.39m,    2.39m]    2.39m   0.00ns    2.39m         1 [   1.44m,    1.44m]    1.44m   0.00ns    1.44m
                       'default_lp':         1 [   2.39m,    2.39m]    2.39m   0.00ns    2.39m         1 [  21.30s,   21.30s]   21.30s   0.00ns   21.30s
                 'feasibility_pump':       614 [ 16.83ms, 219.49ms]  37.62ms  17.11ms   23.10s       613 [  3.77ms,  13.33ms]   4.74ms 350.29us    2.91s
                  'fj_long_default':         1 [ 83.75ms,  83.75ms]  83.75ms   0.00ns  83.75ms         1 [ 34.16ms,  34.16ms]  34.16ms   0.00ns  34.16ms
                  'fj_long_default':         1 [172.59ms, 172.59ms] 172.59ms   0.00ns 172.59ms         1 [ 76.98ms,  76.98ms]  76.98ms   0.00ns  76.98ms
              'fj_long_lin_default':         1 [135.54ms, 135.54ms] 135.54ms   0.00ns 135.54ms         1 [ 72.82ms,  72.82ms]  72.82ms   0.00ns  72.82ms
              'fj_long_lin_perturb':         1 [123.13ms, 123.13ms] 123.13ms   0.00ns 123.13ms         1 [ 70.19ms,  70.19ms]  70.19ms   0.00ns  70.19ms
               'fj_long_lin_random':         1 [166.55ms, 166.55ms] 166.55ms   0.00ns 166.55ms         1 [ 99.31ms,  99.31ms]  99.31ms   0.00ns  99.31ms
                  'fj_long_perturb':         1 [137.74ms, 137.74ms] 137.74ms   0.00ns 137.74ms         1 [ 75.77ms,  75.77ms]  75.77ms   0.00ns  75.77ms
                   'fj_long_random':         1 [157.35ms, 157.35ms] 157.35ms   0.00ns 157.35ms         1 [ 72.32ms,  72.32ms]  72.32ms   0.00ns  72.32ms
                 'fj_short_default':         1 [138.06ms, 138.06ms] 138.06ms   0.00ns 138.06ms         1 [ 75.22ms,  75.22ms]  75.22ms   0.00ns  75.22ms
                 'fj_short_default':         1 [160.04ms, 160.04ms] 160.04ms   0.00ns 160.04ms         1 [ 85.91ms,  85.91ms]  85.91ms   0.00ns  85.91ms
             'fj_short_lin_default':         1 [129.13ms, 129.13ms] 129.13ms   0.00ns 129.13ms         1 [ 73.80ms,  73.80ms]  73.80ms   0.00ns  73.80ms
             'fj_short_lin_default':         1 [142.32ms, 142.32ms] 142.32ms   0.00ns 142.32ms         1 [ 75.41ms,  75.41ms]  75.41ms   0.00ns  75.41ms
             'fj_short_lin_perturb':         1 [151.12ms, 151.12ms] 151.12ms   0.00ns 151.12ms         1 [ 71.59ms,  71.59ms]  71.59ms   0.00ns  71.59ms
              'fj_short_lin_random':         1 [147.96ms, 147.96ms] 147.96ms   0.00ns 147.96ms         1 [ 75.12ms,  75.12ms]  75.12ms   0.00ns  75.12ms
                 'fj_short_perturb':         1 [100.93ms, 100.93ms] 100.93ms   0.00ns 100.93ms         1 [ 46.19ms,  46.19ms]  46.19ms   0.00ns  46.19ms
                  'fj_short_random':         1 [142.21ms, 142.21ms] 142.21ms   0.00ns 142.21ms         1 [ 73.30ms,  73.30ms]  73.30ms   0.00ns  73.30ms
                        'fs_random':         1 [ 38.47ms,  38.47ms]  38.47ms   0.00ns  38.47ms         1 [ 20.00ns,  20.00ns]  20.00ns   0.00ns  20.00ns
                        'fs_random':         1 [ 39.35ms,  39.35ms]  39.35ms   0.00ns  39.35ms         1 [ 20.00ns,  20.00ns]  20.00ns   0.00ns  20.00ns
                        'fs_random':         1 [ 39.73ms,  39.73ms]  39.73ms   0.00ns  39.73ms         1 [ 20.00ns,  20.00ns]  20.00ns   0.00ns  20.00ns
                        'fs_random':         1 [ 41.29ms,  41.29ms]  41.29ms   0.00ns  41.29ms         1 [ 20.00ns,  20.00ns]  20.00ns   0.00ns  20.00ns
                  'fs_random_no_lp':         1 [ 37.28ms,  37.28ms]  37.28ms   0.00ns  37.28ms         1 [341.77us, 341.77us] 341.77us   0.00ns 341.77us
                  'fs_random_no_lp':         1 [ 37.87ms,  37.87ms]  37.87ms   0.00ns  37.87ms         1 [210.82us, 210.82us] 210.82us   0.00ns 210.82us
                  'fs_random_no_lp':         1 [ 41.15ms,  41.15ms]  41.15ms   0.00ns  41.15ms         1 [248.11us, 248.11us] 248.11us   0.00ns 248.11us
                  'fs_random_no_lp':         1 [ 41.38ms,  41.38ms]  41.38ms   0.00ns  41.38ms         1 [282.25us, 282.25us] 282.25us   0.00ns 282.25us
          'fs_random_quick_restart':         1 [ 36.79ms,  36.79ms]  36.79ms   0.00ns  36.79ms         1 [ 20.00ns,  20.00ns]  20.00ns   0.00ns  20.00ns
          'fs_random_quick_restart':         1 [ 40.62ms,  40.62ms]  40.62ms   0.00ns  40.62ms         1 [ 20.00ns,  20.00ns]  20.00ns   0.00ns  20.00ns
          'fs_random_quick_restart':         1 [ 40.73ms,  40.73ms]  40.73ms   0.00ns  40.73ms         1 [  2.67us,   2.67us]   2.67us   0.00ns   2.67us
          'fs_random_quick_restart':         1 [ 41.29ms,  41.29ms]  41.29ms   0.00ns  41.29ms         1 [ 20.00ns,  20.00ns]  20.00ns   0.00ns  20.00ns
    'fs_random_quick_restart_no_lp':         1 [ 37.27ms,  37.27ms]  37.27ms   0.00ns  37.27ms         1 [211.93us, 211.93us] 211.93us   0.00ns 211.93us
    'fs_random_quick_restart_no_lp':         1 [ 41.10ms,  41.10ms]  41.10ms   0.00ns  41.10ms         1 [317.20us, 317.20us] 317.20us   0.00ns 317.20us
    'fs_random_quick_restart_no_lp':         1 [ 43.19ms,  43.19ms]  43.19ms   0.00ns  43.19ms         1 [273.09us, 273.09us] 273.09us   0.00ns 273.09us
                    'graph_arc_lns':       614 [  4.09ms,    2.78s]    1.01s 649.28ms   10.30m       600 [ 10.00ns, 234.55ms]  70.33ms  45.82ms   42.20s
                    'graph_cst_lns':       614 [  1.83ms,    2.72s] 980.72ms 662.86ms   10.04m       581 [ 10.00ns, 239.04ms]  71.49ms  45.86ms   41.53s
                    'graph_dec_lns':       614 [  5.28ms,    2.54s] 953.20ms 625.40ms    9.75m       601 [ 10.00ns, 244.67ms]  68.80ms  48.06ms   41.35s
                    'graph_var_lns':       614 [  2.35ms,    3.08s] 955.76ms 657.19ms    9.78m       598 [ 10.00ns, 243.86ms]  67.67ms  48.93ms   40.46s
                   'lb_tree_search':         1 [   2.39m,    2.39m]    2.39m   0.00ns    2.39m         1 [  35.72s,   35.72s]   35.72s   0.00ns   35.72s
                           'max_lp':         1 [   2.39m,    2.39m]    2.39m   0.00ns    2.39m         1 [  20.62s,   20.62s]   20.62s   0.00ns   20.62s
                            'no_lp':         1 [   2.39m,    2.39m]    2.39m   0.00ns    2.39m         1 [  17.94s,   17.94s]   17.94s   0.00ns   17.94s
              'objective_lb_search':         1 [   2.39m,    2.39m]    2.39m   0.00ns    2.39m         1 [  24.94s,   24.94s]   24.94s   0.00ns   24.94s
       'objective_lb_search_max_lp':         1 [   2.39m,    2.39m]    2.39m   0.00ns    2.39m         1 [  31.63s,   31.63s]   31.63s   0.00ns   31.63s
        'objective_lb_search_no_lp':         1 [   2.39m,    2.39m]    2.39m   0.00ns    2.39m         1 [  12.28s,   12.28s]   12.28s   0.00ns   12.28s
  'objective_shaving_search_max_lp':       122 [  9.17ms,   12.48s]    1.17s    1.39s    2.38m       109 [793.71us,    1.24s] 112.78ms 149.03ms   12.29s
   'objective_shaving_search_no_lp':       123 [  3.96ms,   12.48s]    1.16s    1.39s    2.38m       113 [790.62us, 693.72ms]  77.03ms  94.30ms    8.70s
                          'probing':         1 [   2.39m,    2.39m]    2.39m   0.00ns    2.39m         1 [  12.11s,   12.11s]   12.11s   0.00ns   12.11s
                   'probing_max_lp':         1 [   2.39m,    2.39m]    2.39m   0.00ns    2.39m         1 [   8.12s,    8.12s]    8.12s   0.00ns    8.12s
                     'pseudo_costs':         1 [   2.39m,    2.39m]    2.39m   0.00ns    2.39m         1 [  20.95s,   20.95s]   20.95s   0.00ns   20.95s
                    'quick_restart':         1 [   2.39m,    2.39m]    2.39m   0.00ns    2.39m         1 [  25.14s,   25.14s]   25.14s   0.00ns   25.14s
              'quick_restart_no_lp':         1 [   2.39m,    2.39m]    2.39m   0.00ns    2.39m         1 [  22.56s,   22.56s]   22.56s   0.00ns   22.56s
                    'reduced_costs':         1 [   2.39m,    2.39m]    2.39m   0.00ns    2.39m         1 [  21.43s,   21.43s]   21.43s   0.00ns   21.43s
                        'rins/rens':       615 [153.08us,    2.42s] 704.20ms 567.21ms    7.22m       563 [ 10.00ns, 113.34ms]  64.00ms  42.23ms   36.03s
                      'rnd_cst_lns':       615 [ 10.99us,    2.90s] 983.37ms 652.81ms   10.08m       601 [ 10.00ns, 184.26ms]  68.65ms  46.28ms   41.26s
                      'rnd_var_lns':       615 [  3.68ms,    2.39s] 916.91ms 633.55ms    9.40m       597 [ 10.00ns, 221.02ms]  66.85ms  48.85ms   39.91s
                     'violation_ls':       602 [375.19us, 463.27ms] 179.28ms  66.47ms    1.80m       602 [ 28.62us, 178.71ms]  69.93ms  22.15ms   42.10s
                     'violation_ls':       609 [300.76us, 607.36ms] 178.62ms  67.51ms    1.81m       609 [970.00ns, 200.75ms]  75.30ms  24.38ms   45.86s
                     'violation_ls':       609 [424.57us, 537.20ms] 174.39ms  83.37ms    1.77m       609 [410.00ns, 199.71ms]  73.62ms  35.90ms   44.83s
                     'violation_ls':       610 [370.70us, 398.44ms] 175.95ms  66.14ms    1.79m       610 [  1.76us, 170.51ms]  74.26ms  22.73ms   45.30s
                     'violation_ls':       611 [372.29us, 406.30ms] 178.53ms  60.49ms    1.82m       611 [  1.03us,  83.81ms]  65.55ms   8.71ms   40.05s

Search stats                        Bools  Conflicts  Branches  Restarts  BoolPropag  IntegerPropag
                           'core':  5'653     45'819    81'802     9'641  74'031'251     26'593'653
                     'default_lp':  1'400     37'363   150'006    15'038  15'082'830     28'995'607
                      'fs_random':     58          0       116       116           6          1'986
                      'fs_random':     58          0       116       116           6          1'986
                      'fs_random':     58          0       116       116           6          1'986
                      'fs_random':     58          0       116       116           6          1'986
                'fs_random_no_lp':     58          0       146       116          16          3'037
                'fs_random_no_lp':     58          1       135       116          24          2'834
                'fs_random_no_lp':     58          4       159       116          28          3'327
                'fs_random_no_lp':     58          5       154       116          21          3'230
        'fs_random_quick_restart':     58          0       116       116           6          1'986
        'fs_random_quick_restart':     58          0       116       116           6          1'986
        'fs_random_quick_restart':     58          0       116       116           6          1'986
        'fs_random_quick_restart':     58          0       116       116           6          1'986
  'fs_random_quick_restart_no_lp':     58          0       142       116           8          2'774
  'fs_random_quick_restart_no_lp':     58          0       149       116          15          3'306
  'fs_random_quick_restart_no_lp':     58          0       164       116           7          3'172
                 'lb_tree_search':     58        159   159'196    40'079     221'023      7'634'916
                         'max_lp':     58     25'612   166'755    19'141     650'132     23'227'671
                          'no_lp':  1'244     89'586   200'512    17'898  25'318'326     55'743'662
            'objective_lb_search':    217     23'837   215'337    34'242   1'755'636     30'407'519
     'objective_lb_search_max_lp':    211     18'853   273'943    43'293   1'856'909     33'131'350
      'objective_lb_search_no_lp':    343     74'568   167'253    12'848   2'230'625     49'574'524
                        'probing':    338        109     2'924     1'821      30'111        128'531
                 'probing_max_lp':    338        104     1'968     1'337      23'398         98'453
                   'pseudo_costs':     76     25'987   150'934    19'984     630'409     20'995'758
                  'quick_restart':  1'639     14'995   212'061    29'744   9'611'157     21'564'376
            'quick_restart_no_lp':  2'908     75'317   294'244    19'305  56'356'969     43'745'882
                  'reduced_costs':  1'154     29'895   178'398    18'079  12'251'547     22'490'976

SAT stats                           ClassicMinim  LitRemoved  LitLearned  LitForgotten  Subsumed  MClauses  MDecisions  MLitTrue  MSubsumed  MLitRemoved  MReused
                           'core':        40'447     264'027     346'410         5'484       441     4'115      20'519         0          5           18       66
                     'default_lp':        26'299      88'984     435'648       208'669       787     7'418      91'143         0      1'944       15'142    1'674
                      'fs_random':             0           0           0             0         0         0           0         0          0            0        0
                      'fs_random':             0           0           0             0         0         0           0         0          0            0        0
                      'fs_random':             0           0           0             0         0         0           0         0          0            0        0
                      'fs_random':             0           0           0             0         0         0           0         0          0            0        0
                'fs_random_no_lp':             0           0           0             0         0         0           0         0          0            0        0
                'fs_random_no_lp':             0           0          15             0         0         0           0         0          0            0        0
                'fs_random_no_lp':             0           0          23             0         0         0           0         0          0            0        0
                'fs_random_no_lp':             0           0           4             0         0         0           0         0          0            0        0
        'fs_random_quick_restart':             0           0           0             0         0         0           0         0          0            0        0
        'fs_random_quick_restart':             0           0           0             0         0         0           0         0          0            0        0
        'fs_random_quick_restart':             0           0           0             0         0         0           0         0          0            0        0
        'fs_random_quick_restart':             0           0           0             0         0         0           0         0          0            0        0
  'fs_random_quick_restart_no_lp':             0           0           0             0         0         0           0         0          0            0        0
  'fs_random_quick_restart_no_lp':             0           0           0             0         0         0           0         0          0            0        0
  'fs_random_quick_restart_no_lp':             0           0           0             0         0         0           0         0          0            0        0
                 'lb_tree_search':             2           2         534             0         0    17'049      86'043         0         27          107    2'246
                         'max_lp':        11'985      24'656     289'483       113'956     1'205     9'340     132'103         0        990        8'038    2'834
                          'no_lp':        74'046     305'940     991'346       538'547     1'544    10'225      80'624        89      5'053       35'746    1'149
            'objective_lb_search':        14'468      33'168     198'672         5'433     1'330    17'397     179'396         0      3'393       22'365    4'307
     'objective_lb_search_max_lp':        12'207      28'816     152'142         3'941     1'112    20'693     240'002         0      2'724       17'615    5'949
      'objective_lb_search_no_lp':        56'393     159'828     639'673        95'894     1'918     7'310      76'510         0      2'896       20'050    1'728
                        'probing':             0           0         112             0         0         0           0         0          0            0        0
                 'probing_max_lp':             0           0         104             0         0         0           0         0          0            0        0
                   'pseudo_costs':        10'816      19'825     259'985        84'925     1'710     9'475     113'670         0      2'450       18'390    2'166
                  'quick_restart':         9'363      29'912     169'151        57'370       739    14'201     152'472        24      2'782       18'593    3'175
            'quick_restart_no_lp':        58'311     266'254     953'465       598'122     1'207     8'369      75'698        20      4'843       36'730      924
                  'reduced_costs':        20'366      55'466     327'321       112'301       788    10'737     112'073         0      4'375       33'070    2'087

Lp stats                         Component  Iterations  AddedCuts  OPTIMAL  DUAL_F.  DUAL_U.
                  'default_lp':          1     347'283      9'855   49'010        0        1
                   'fs_random':          1          15          0        1        1        0
                   'fs_random':          1          62          0        2        0        0
                   'fs_random':          1          62          0        2        0        0
                   'fs_random':          1          62          0        2        0        0
     'fs_random_quick_restart':          1           0          0        0        0        0
     'fs_random_quick_restart':          1          33          0        1        1        0
     'fs_random_quick_restart':          1          38          0        1        1        0
     'fs_random_quick_restart':          1          62         70        3        0        0
              'lb_tree_search':          1     936'183      7'590   46'348   15'339        0
                      'max_lp':          1     412'285     10'821   35'244    8'251       30
         'objective_lb_search':          1     526'115      5'344   36'249        0        4
  'objective_lb_search_max_lp':          1     597'662      7'115   24'849    9'228       25
                     'probing':          1     190'640      4'690    7'840        0        9
              'probing_max_lp':          1      84'888      4'991    4'347    1'153        0
                'pseudo_costs':          1     428'414     13'421   34'233    8'203       29
               'quick_restart':          1     474'967      5'702   36'982        0        4
               'reduced_costs':          1     409'240     15'657   38'281    8'788       18

Lp dimension                                                                     Final dimension of first component
                  'default_lp':   179 rows, 198 columns, 658 entries with magnitude in [1.432083e-02, 1.000000e+00]
                   'fs_random':    68 rows, 198 columns, 266 entries with magnitude in [9.853293e-02, 1.000000e+00]
                   'fs_random':    68 rows, 198 columns, 266 entries with magnitude in [9.853293e-02, 1.000000e+00]
                   'fs_random':    68 rows, 198 columns, 266 entries with magnitude in [9.853293e-02, 1.000000e+00]
                   'fs_random':    68 rows, 198 columns, 266 entries with magnitude in [9.853293e-02, 1.000000e+00]
     'fs_random_quick_restart':       0 rows, 198 columns, 0 entries with magnitude in [0.000000e+00, 0.000000e+00]
     'fs_random_quick_restart':    68 rows, 198 columns, 266 entries with magnitude in [9.853293e-02, 1.000000e+00]
     'fs_random_quick_restart':    68 rows, 198 columns, 266 entries with magnitude in [9.853293e-02, 1.000000e+00]
     'fs_random_quick_restart':    69 rows, 198 columns, 270 entries with magnitude in [9.853293e-02, 1.000000e+00]
              'lb_tree_search':  820 rows, 198 columns, 3156 entries with magnitude in [3.526572e-03, 1.000000e+00]
                      'max_lp':  401 rows, 198 columns, 1412 entries with magnitude in [5.703852e-03, 1.000000e+00]
         'objective_lb_search':  399 rows, 198 columns, 1368 entries with magnitude in [1.285661e-02, 1.000000e+00]
  'objective_lb_search_max_lp':  745 rows, 198 columns, 2955 entries with magnitude in [1.973731e-03, 1.000000e+00]
                     'probing':  630 rows, 198 columns, 2869 entries with magnitude in [3.805953e-04, 1.000000e+00]
              'probing_max_lp':  476 rows, 198 columns, 3866 entries with magnitude in [2.637225e-03, 1.000000e+00]
                'pseudo_costs':   770 rows, 198 columns, 904 entries with magnitude in [1.897219e-02, 1.000000e+00]
               'quick_restart':  512 rows, 198 columns, 2039 entries with magnitude in [1.292084e-03, 1.000000e+00]
               'reduced_costs':  490 rows, 198 columns, 1942 entries with magnitude in [6.413552e-04, 1.000000e+00]

Lp debug                         CutPropag  CutEqPropag  Adjust  Overflow        Bad  BadScaling
                  'default_lp':          4            3  18'138         0     82'408           0
                   'fs_random':          0            0       0         0          0           0
                   'fs_random':          0            0       0         0          0           0
                   'fs_random':          0            0       0         0          0           0
                   'fs_random':          0            0       0         0          0           0
     'fs_random_quick_restart':          0            0       0         0          0           0
     'fs_random_quick_restart':          0            0       0         0          0           0
     'fs_random_quick_restart':          0            0       0         0          0           0
     'fs_random_quick_restart':          0            0       0         0          6           0
              'lb_tree_search':          6            2  30'140         0    118'910           0
                      'max_lp':          1            4  11'608         0     83'463           0
         'objective_lb_search':          3            3  15'547         0    123'539           0
  'objective_lb_search_max_lp':          5            9  17'024         0    137'816           0
                     'probing':          4           18   7'327         0  2'432'140           0
              'probing_max_lp':          8           16   5'445         0  1'912'132           0
                'pseudo_costs':         26            8  13'110         0    112'780           0
               'quick_restart':          4            6  17'453         0    230'310           0
               'reduced_costs':          5           11  18'941         0     93'842           0

Lp pool                          Constraints  Updates  Simplif  Merged  Shortened   Split  Strenghtened      Cuts/Call
                  'default_lp':       10'042      262   45'239      43      2'606   4'650        17'014   9'855/41'109
                   'fs_random':          230        0        0       0          0       0            13            0/0
                   'fs_random':          230        0        0       0          0       0            13            0/0
                   'fs_random':          230        0        0       0          0       0            13            0/0
                   'fs_random':          230        0        0       0          0       0            13            0/0
     'fs_random_quick_restart':          230        0        0       0          0       0            13            0/0
     'fs_random_quick_restart':          230        0        0       0          0       0            13            0/0
     'fs_random_quick_restart':          230        0        0       0          0       0            13            0/0
     'fs_random_quick_restart':          300        0        0       0          0       0            13          70/87
              'lb_tree_search':        9'805      316  101'943      24      8'575   4'252        35'928   7'590/35'070
                      'max_lp':       11'998      248   49'071      62      1'621   5'694        31'622  10'821/38'531
         'objective_lb_search':        5'563      379   52'794      11      3'876   4'908        15'887   5'344/24'757
  'objective_lb_search_max_lp':        9'345      393   92'208       9      7'284   7'093        43'247   7'115/25'015
                     'probing':        4'915      588   37'393       5      3'475   9'973         5'535   4'690/11'300
              'probing_max_lp':        7'217      546   31'356      13      2'925   5'062        16'800   4'991/11'418
                'pseudo_costs':       11'583      449  142'886      77     17'228   7'585        44'364  13'421/44'202
               'quick_restart':        5'917      433  124'934      15      6'958  12'486        17'521   5'702/27'749
               'reduced_costs':       11'827      287   60'422      69      4'248   6'579        36'639  15'657/49'382

Lp Cut            fs_ran  defaul  max_lp  quick_  reduce  pseudo  lb_tre  probin  object  probin  object
          CG_FF:       -     533     423     166     838     504     161     138     143     174     186
           CG_K:       -     335     284      42     493     277      78      36      58      66      89
           CG_R:       -     473     317      48     675     400      98      53      93      89     152
          CG_RB:       -   1'497   1'568   1'012   2'217   1'602     776     635     523     603     621
         CG_RBP:       -     181      93      42     232     133      31      52      63      20      65
         Clique:       -       -      40       -      52      51      72       -       -      30      79
             IB:      50     867     627   1'077     939     834     470     720     679     410     565
       MIR_1_FF:      11     589     635     324     836     674     469     270     375     290     432
        MIR_1_K:       2      85      94      40     148     107      56      26      57      14      72
       MIR_1_KL:       -       -       -       3       -       1       -       3       -       -       -
        MIR_1_R:       2     110      77      45     140      79      38      26      53      16      43
       MIR_1_RB:       2     984   1'197     547   1'706   1'560   1'006     464     659     469     914
      MIR_1_RBP:       -      83     146      34     190     172     105      25      51      47      92
       MIR_2_FF:       1     335     352     143     569     450     209     105     170     124     222
        MIR_2_K:       -      76      67      32     102      86      55      23      31      19      49
       MIR_2_KL:       -       3       -       4       1       2       -       1       1       -       1
        MIR_2_R:       1     124     115      29     232     190     105      44      73      33     123
       MIR_2_RB:       1     570     656     335     978     869     560     224     314     186     508
      MIR_2_RBP:       -      75     133      34     163     185      83      18      39      19      83
       MIR_3_FF:       -     196     270      89     400     321     185      60     109      65     155
        MIR_3_K:       -      55      71      18      90      67      50      17      22      20      40
       MIR_3_KL:       -       1       -       6       4       4       -       4       -       -       1
        MIR_3_R:       -     104     177      55     228     225     118      43      72      45     121
       MIR_3_RB:       -     361     434     217     646     525     383     127     219     146     296
      MIR_3_RBP:       -      52      77      25     139     128      50       8      30      13      50
       MIR_4_FF:       -     133     174      53     236     278     116      54      70      30      84
        MIR_4_K:       -      48      60      23      73      73      25      21      27      14      30
       MIR_4_KL:       -       4       -       2       1       -       -       1       1       -       -
        MIR_4_R:       -      99     126      42     196     247     106      27      68      33      91
       MIR_4_RB:       -     255     254     104     387     400     197      78     125      77     171
      MIR_4_RBP:       -      43      54      10      77      76      31       8      18       5      28
       MIR_5_FF:       -      78     110      20     139     137      80      26      34      12      43
        MIR_5_K:       -      29      35      10      43      38      11       8      17      10      14
       MIR_5_KL:       -       -       -       1       -       1       -       -       -       -       -
        MIR_5_R:       -      60      95      24     101     122      58       8      44      10      43
       MIR_5_RB:       -     162     158      74     225     210     126      42      89      24      83
      MIR_5_RBP:       -      29      34       6      33      49      23       1       6       3      12
       MIR_6_FF:       -      53      60      10      86      92      36      26      32       8      25
        MIR_6_K:       -      17      33       5      30      29       8      25      10       1       7
       MIR_6_KL:       -       -       -       -       -       -       -       -       2       -       -
        MIR_6_R:       -      30      42      10      60      73      33       5      30       5      24
       MIR_6_RB:       -      91     100      30     135     161      72      21      52      15      62
      MIR_6_RBP:       -       6      19       -      29      31       9       -       3       2       5
   ZERO_HALF_FF:       -      86     147      54     189     155      46      30      43      23      53
    ZERO_HALF_K:       -      25      32       9      43      37       1       3       8       2       8
    ZERO_HALF_R:       -     664   1'095     666   1'110   1'348   1'269     884     701   1'610   1'188
   ZERO_HALF_RB:       -     195     264     169     340     329     152     128      94      99     153
  ZERO_HALF_RBP:       -      59      76      13     106      89      33     172      36     110      32

LNS stats           Improv/Calls  Closed  Difficulty  TimeLimit
  'graph_arc_lns':        23/614     52%        0.98       0.12
  'graph_cst_lns':        11/593     52%        0.99       0.12
  'graph_dec_lns':        22/613     51%        0.98       0.12
  'graph_var_lns':        18/612     52%        0.99       0.12
      'rins/rens':        55/606     51%        0.82       0.10
    'rnd_cst_lns':        18/612     53%        0.99       0.12
    'rnd_var_lns':        22/614     51%        0.99       0.12

LS stats                   Batches  Restarts   LinMoves   GenMoves  CompoundMoves  WeightUpdates
       'fj_long_default':        1         1      3'459          0              0             95
       'fj_long_default':        1         1      9'661          0              0            339
   'fj_long_lin_default':        1         1          0      3'964            488              3
   'fj_long_lin_perturb':        1         1      4'953          0              0          1'002
    'fj_long_lin_random':        1         1      8'180          0              0          1'820
       'fj_long_perturb':        1         1          0      3'851            538              2
        'fj_long_random':        1         1      9'632          0              0            368
      'fj_short_default':        1         1          0      4'180            668              4
      'fj_short_default':        1         1      7'649          0              0          2'351
  'fj_short_lin_default':        1         1          0      3'772            414              2
  'fj_short_lin_default':        1         1          0      3'801            499              2
  'fj_short_lin_perturb':        1         1      9'602          0              0            398
   'fj_short_lin_random':        1         1          0      3'672            328              1
      'fj_short_perturb':        1         1      5'498          0              0            193
       'fj_short_random':        1         1          0      3'741            437              2
          'violation_ls':      602         0    633'003  3'237'911        273'341        191'358
          'violation_ls':      609         0  1'548'801  2'615'276        175'140        546'166
          'violation_ls':      609         0  2'891'033  1'544'305         29'455      1'033'965
          'violation_ls':      610         0  2'442'081  1'962'168        124'278        509'104
          'violation_ls':      611         0    976'943  3'353'814        195'635         39'153

Solutions (67)            Num     Rank
           'default_lp':    2  [51,57]
        'graph_arc_lns':    1  [25,25]
        'graph_dec_lns':    2  [22,24]
        'graph_var_lns':    3  [23,45]
                'no_lp':   10   [2,11]
  'quick_restart_no_lp':    6   [1,59]
          'rnd_var_lns':    3  [58,67]
         'violation_ls':   40  [12,65]

Objective bounds                     Num
                      'default_lp':    1
                  'initial_domain':    1
                  'lb_tree_search':   35
             'objective_lb_search':   15
      'objective_lb_search_max_lp':    7
       'objective_lb_search_no_lp':   66
  'objective_shaving_search_no_lp':    2
                         'probing':    5

Solution repositories    Added  Queried  Ignored  Synchro
  'feasible solutions':  4'173   12'116       13    3'996
        'lp solutions':  1'345      295        0    1'190
                'pump':  4'287      319

Improving bounds shared          Num
                        'core':   99
                  'default_lp':   19
              'lb_tree_search':    6
                      'max_lp':    2
                       'no_lp':  495
         'objective_lb_search':    7
  'objective_lb_search_max_lp':    5
   'objective_lb_search_no_lp':   13
                     'probing':  266
              'probing_max_lp':  125
                'pseudo_costs':  177
               'quick_restart':  176
         'quick_restart_no_lp':  695
               'reduced_costs':   28

Clauses shared                   Num
                  'default_lp':    1
             'fs_random_no_lp':    1
              'lb_tree_search':   46
                      'max_lp':   11
                       'no_lp':   55
         'objective_lb_search':   11
  'objective_lb_search_max_lp':   17
   'objective_lb_search_no_lp':    3
                'pseudo_costs':   23
               'quick_restart':    2
         'quick_restart_no_lp':   23
               'reduced_costs':    9

CpSolverResponse summary:
status: OPTIMAL
objective: 1197
best_bound: 1197
integers: 199
booleans: 58
conflicts: 0
branches: 116
propagations: 6
integer_propagations: 1986
restarts: 116
lp_iterations: 62
walltime: 143.769
usertime: 143.769
deterministic_time: 887.315
gap_integral: 3702.33
solution_fingerprint: 0xb210de7736f908f3


--- Simulation Gantt  partir du modle mathmatique ---
{'big':1, 'due_date':99, 'pos_time':5, 'status':0, 'blocked':0, 'operations':["{'type':1, 'processing_time':28}"]}
{'big':1, 'due_date':97, 'pos_time':5, 'status':0, 'blocked':0, 'operations':["{'type':1, 'processing_time':25}"]}
{'big':0, 'due_date':60, 'pos_time':5, 'status':0, 'blocked':0, 'operations':["{'type':0, 'processing_time':40}"]}
{'big':1, 'due_date':80, 'pos_time':5, 'status':0, 'blocked':0, 'operations':["{'type':1, 'processing_time':36}", "{'type':0, 'processing_time':47}"]}
{'big':0, 'due_date':70, 'pos_time':5, 'status':0, 'blocked':0, 'operations':["{'type':1, 'processing_time':60}"]}
{'big':1, 'due_date':80, 'pos_time':5, 'status':0, 'blocked':0, 'operations':["{'type':0, 'processing_time':17}"]}
{'big':1, 'due_date':70, 'pos_time':5, 'status':0, 'blocked':0, 'operations':["{'type':1, 'processing_time':42}"]}
{'big':1, 'due_date':63, 'pos_time':5, 'status':0, 'blocked':0, 'operations':["{'type':0, 'processing_time':12}"]}
{'big':1, 'due_date':64, 'pos_time':5, 'status':0, 'blocked':0, 'operations':["{'type':0, 'processing_time':28}"]}
