created virtual environment CPython3.12.4.final.0-64 in 8300ms
  creator CPython3Posix(dest=/localscratch/aneumann.63393199.0/env, clear=False, no_vcs_ignore=False, global=False)
  seeder FromAppData(download=False, pip=bundle, via=copy, app_data_dir=/home/aneumann/.local/share/virtualenv)
    added seed packages: pip==25.1.1
  activators BashActivator,CShellActivator,FishActivator,NushellActivator,PowerShellActivator,PythonActivator
Looking in links: /cvmfs/soft.computecanada.ca/custom/python/wheelhouse/gentoo2023/x86-64-v3, /cvmfs/soft.computecanada.ca/custom/python/wheelhouse/gentoo2023/generic, /cvmfs/soft.computecanada.ca/custom/python/wheelhouse/generic
Requirement already satisfied: pip in /localscratch/aneumann.63393199.0/env/lib/python3.12/site-packages (25.1.1)
Looking in links: /cvmfs/soft.computecanada.ca/custom/python/wheelhouse/gentoo2023/x86-64-v3, /cvmfs/soft.computecanada.ca/custom/python/wheelhouse/gentoo2023/generic, /cvmfs/soft.computecanada.ca/custom/python/wheelhouse/generic
ERROR: protobuf-5.28.3-cp38-abi3-manylinux2014_x86_64.whl is not a supported wheel on this platform.
Looking in links: /cvmfs/soft.computecanada.ca/custom/python/wheelhouse/gentoo2023/x86-64-v3, /cvmfs/soft.computecanada.ca/custom/python/wheelhouse/gentoo2023/generic, /cvmfs/soft.computecanada.ca/custom/python/wheelhouse/generic
Processing /home/aneumann/projects/def-adhaj/aneumann/GNRS/wheels/immutabledict-4.2.0-py3-none-any.whl
Installing collected packages: immutabledict
Successfully installed immutabledict-4.2.0
Looking in links: /cvmfs/soft.computecanada.ca/custom/python/wheelhouse/gentoo2023/x86-64-v3, /cvmfs/soft.computecanada.ca/custom/python/wheelhouse/gentoo2023/generic, /cvmfs/soft.computecanada.ca/custom/python/wheelhouse/generic
Processing /cvmfs/soft.computecanada.ca/custom/python/wheelhouse/generic/ortools-9.10.4067+computecanada-cp312-cp312-linux_x86_64.whl (from -r /home/aneumann/projects/def-adhaj/aneumann/GNRS/requirements/or.txt (line 1))
Processing /cvmfs/soft.computecanada.ca/custom/python/wheelhouse/gentoo2023/x86-64-v3/matplotlib-3.10.0+computecanada-cp312-cp312-linux_x86_64.whl (from -r /home/aneumann/projects/def-adhaj/aneumann/GNRS/requirements/or.txt (line 2))
Processing /cvmfs/soft.computecanada.ca/custom/python/wheelhouse/gentoo2023/x86-64-v3/pandas-2.2.3+computecanada-cp312-cp312-linux_x86_64.whl (from -r /home/aneumann/projects/def-adhaj/aneumann/GNRS/requirements/or.txt (line 3))
Processing /cvmfs/soft.computecanada.ca/custom/python/wheelhouse/generic/absl_py-2.2.2+computecanada-py3-none-any.whl (from ortools<9.11,>=9.10->-r /home/aneumann/projects/def-adhaj/aneumann/GNRS/requirements/or.txt (line 1))
Processing /cvmfs/soft.computecanada.ca/custom/python/wheelhouse/gentoo2023/generic/numpy-2.2.2+computecanada-cp312-cp312-linux_x86_64.whl (from ortools<9.11,>=9.10->-r /home/aneumann/projects/def-adhaj/aneumann/GNRS/requirements/or.txt (line 1))
Processing /cvmfs/soft.computecanada.ca/custom/python/wheelhouse/gentoo2023/x86-64-v3/protobuf-6.30.2+computecanada-cp312-cp312-linux_x86_64.whl (from ortools<9.11,>=9.10->-r /home/aneumann/projects/def-adhaj/aneumann/GNRS/requirements/or.txt (line 1))
Requirement already satisfied: immutabledict>=3.0.0 in /localscratch/aneumann.63393199.0/env/lib/python3.12/site-packages (from ortools<9.11,>=9.10->-r /home/aneumann/projects/def-adhaj/aneumann/GNRS/requirements/or.txt (line 1)) (4.2.0)
Processing /cvmfs/soft.computecanada.ca/custom/python/wheelhouse/gentoo2023/generic/contourpy-1.3.1+computecanada-cp312-cp312-linux_x86_64.whl (from matplotlib->-r /home/aneumann/projects/def-adhaj/aneumann/GNRS/requirements/or.txt (line 2))
Processing /cvmfs/soft.computecanada.ca/custom/python/wheelhouse/generic/cycler-0.12.1+computecanada-py3-none-any.whl (from matplotlib->-r /home/aneumann/projects/def-adhaj/aneumann/GNRS/requirements/or.txt (line 2))
Processing /cvmfs/soft.computecanada.ca/custom/python/wheelhouse/generic/fonttools-4.58.2+computecanada-cp312-cp312-linux_x86_64.whl (from matplotlib->-r /home/aneumann/projects/def-adhaj/aneumann/GNRS/requirements/or.txt (line 2))
Processing /cvmfs/soft.computecanada.ca/custom/python/wheelhouse/gentoo2023/x86-64-v3/kiwisolver-1.4.8+computecanada-cp312-cp312-linux_x86_64.whl (from matplotlib->-r /home/aneumann/projects/def-adhaj/aneumann/GNRS/requirements/or.txt (line 2))
Processing /cvmfs/soft.computecanada.ca/custom/python/wheelhouse/generic/packaging-25.0+computecanada-py3-none-any.whl (from matplotlib->-r /home/aneumann/projects/def-adhaj/aneumann/GNRS/requirements/or.txt (line 2))
Processing /cvmfs/soft.computecanada.ca/custom/python/wheelhouse/gentoo2023/x86-64-v3/pillow-11.1.0+computecanada-cp312-cp312-linux_x86_64.whl (from matplotlib->-r /home/aneumann/projects/def-adhaj/aneumann/GNRS/requirements/or.txt (line 2))
Processing /cvmfs/soft.computecanada.ca/custom/python/wheelhouse/generic/pyparsing-3.2.1+computecanada-py3-none-any.whl (from matplotlib->-r /home/aneumann/projects/def-adhaj/aneumann/GNRS/requirements/or.txt (line 2))
Processing /cvmfs/soft.computecanada.ca/custom/python/wheelhouse/generic/python_dateutil-2.9.0.post0+computecanada-py2.py3-none-any.whl (from matplotlib->-r /home/aneumann/projects/def-adhaj/aneumann/GNRS/requirements/or.txt (line 2))
Processing /cvmfs/soft.computecanada.ca/custom/python/wheelhouse/generic/pytz-2025.2+computecanada-py2.py3-none-any.whl (from pandas->-r /home/aneumann/projects/def-adhaj/aneumann/GNRS/requirements/or.txt (line 3))
Processing /cvmfs/soft.computecanada.ca/custom/python/wheelhouse/generic/tzdata-2025.2+computecanada-py2.py3-none-any.whl (from pandas->-r /home/aneumann/projects/def-adhaj/aneumann/GNRS/requirements/or.txt (line 3))
Processing /cvmfs/soft.computecanada.ca/custom/python/wheelhouse/generic/six-1.17.0+computecanada-py2.py3-none-any.whl (from python-dateutil>=2.7->matplotlib->-r /home/aneumann/projects/def-adhaj/aneumann/GNRS/requirements/or.txt (line 2))
Installing collected packages: pytz, tzdata, six, pyparsing, protobuf, pillow, packaging, numpy, kiwisolver, fonttools, cycler, absl-py, python-dateutil, contourpy, pandas, matplotlib, ortools

Successfully installed absl-py-2.2.2+computecanada contourpy-1.3.1+computecanada cycler-0.12.1+computecanada fonttools-4.58.2+computecanada kiwisolver-1.4.8+computecanada matplotlib-3.10.0+computecanada numpy-2.2.2+computecanada ortools-9.10.4067+computecanada packaging-25.0+computecanada pandas-2.2.3+computecanada pillow-11.1.0+computecanada protobuf-6.30.2+computecanada pyparsing-3.2.1+computecanada python-dateutil-2.9.0.post0+computecanada pytz-2025.2+computecanada six-1.17.0+computecanada tzdata-2025.2+computecanada

Starting CP-SAT solver v9.10.4067
Parameters: max_time_in_seconds: 3600 max_memory_in_mb: 12000 log_search_progress: true enumerate_all_solutions: false absolute_gap_limit: 0 relative_gap_limit: 0
Setting number of workers to 48

Initial optimization model '': (model_fingerprint: 0xe1f94c0748ca7a5c)
#Variables: 277 (#ints: 9 in objective)
  - 188 Booleans in [0,1]
  - 89 in [0,541]
#kLinear1: 38
#kLinear2: 478
#kLinear3: 196
#kLinearN: 2'268 (#terms: 30'774)

Starting presolve at 0.00s
  1.68e-03s  0.00e+00d  [DetectDominanceRelations] 
  3.58e-02s  0.00e+00d  [PresolveToFixPoint] #num_loops=6 #num_dual_strengthening=3 
  2.94e-05s  0.00e+00d  [ExtractEncodingFromLinear] #potential_supersets=4 
[Symmetry] Graph for symmetry has 2'815 nodes and 23'087 arcs.
[Symmetry] Symmetry computation done. time: 0.00218813 dtime: 0.00227447
[Symmetry] #generators: 1, average support size: 24
[Symmetry] The model contains 238 duplicate constraints !
[Symmetry] 12 orbits with sizes: 2,2,2,2,2,2,2,2,2,2,...
[Symmetry] Num fixable by intersecting at_most_one with orbits: 1 largest_orbit: 2
  8.53e-03s  1.16e-03d  [Probe] #probed=252 #fixed_bools=2 #new_bounds=13 #equiv=1 
  5.15e-05s  0.00e+00d  [MaxClique] Merged 21(42 literals) into 9(18 literals) at_most_ones. 
  1.59e-03s  0.00e+00d  [DetectDominanceRelations] 
  1.44e-02s  0.00e+00d  [PresolveToFixPoint] #num_loops=2 #num_dual_strengthening=1 
  5.50e-03s  0.00e+00d  [ProcessAtMostOneAndLinear] 
  2.56e-03s  0.00e+00d  [DetectDuplicateConstraints] #duplicates=280 #without_enforcements=192 
  2.05e-03s  9.28e-05d  [DetectDominatedLinearConstraints] #relevant_constraints=1'817 #num_inclusions=1'377 #num_redundant=1 
  3.15e-04s  0.00e+00d  [DetectDifferentVariables] #different=32 
  5.18e-04s  2.68e-05d  [ProcessSetPPC] #relevant_constraints=1'339 
  2.45e-05s  0.00e+00d  [FindAlmostIdenticalLinearConstraints] 
  1.92e-04s  1.63e-04d  [FindBigAtMostOneAndLinearOverlap] 
  7.24e-03s  1.91e-03d  [FindBigVerticalLinearOverlap] #blocks=49 #saved_nz=4'610 
  2.69e-04s  5.65e-05d  [FindBigHorizontalLinearOverlap] #linears=1'276 
  1.30e-05s  0.00e+00d  [MergeClauses] 
  1.62e-03s  0.00e+00d  [DetectDominanceRelations] 
  2.41e-02s  0.00e+00d  [PresolveToFixPoint] #num_loops=2 #num_dual_strengthening=1 
  1.61e-03s  0.00e+00d  [DetectDominanceRelations] 
  1.29e-02s  0.00e+00d  [PresolveToFixPoint] #num_loops=1 #num_dual_strengthening=1 
[Symmetry] Graph for symmetry has 2'654 nodes and 17'412 arcs.
[Symmetry] Symmetry computation done. time: 0.000730218 dtime: 0.0010249
  7.90e-03s  1.07e-03d  [Probe] #probed=248 #new_bounds=44 
  1.30e-05s  0.00e+00d  [MaxClique] 
  1.60e-03s  0.00e+00d  [DetectDominanceRelations] 
  2.32e-02s  0.00e+00d  [PresolveToFixPoint] #num_loops=4 #num_dual_strengthening=3 
  4.44e-03s  0.00e+00d  [ProcessAtMostOneAndLinear] 
  2.26e-03s  0.00e+00d  [DetectDuplicateConstraints] #without_enforcements=239 
  9.71e-04s  4.15e-05d  [DetectDominatedLinearConstraints] #relevant_constraints=1'415 #num_inclusions=260 
  3.09e-04s  0.00e+00d  [DetectDifferentVariables] #different=39 #cliques=1 #size=3 
  3.99e-04s  1.56e-05d  [ProcessSetPPC] #relevant_constraints=1'099 
  3.50e-05s  1.35e-07d  [FindAlmostIdenticalLinearConstraints] #num_tested_pairs=9 
  1.44e-04s  8.72e-05d  [FindBigAtMostOneAndLinearOverlap] 
  3.19e-03s  1.08e-03d  [FindBigVerticalLinearOverlap] #blocks=27 #saved_nz=1'814 
  1.99e-04s  3.83e-05d  [FindBigHorizontalLinearOverlap] #linears=981 
  1.30e-05s  0.00e+00d  [MergeClauses] 
  1.48e-03s  0.00e+00d  [DetectDominanceRelations] 
  1.75e-02s  0.00e+00d  [PresolveToFixPoint] #num_loops=2 #num_dual_strengthening=1 
  1.46e-03s  0.00e+00d  [DetectDominanceRelations] 
  1.28e-02s  0.00e+00d  [PresolveToFixPoint] #num_loops=1 #num_dual_strengthening=1 
  7.55e-03s  1.01e-03d  [Probe] #probed=248 #new_bounds=19 
  1.30e-05s  0.00e+00d  [MaxClique] 
  1.46e-03s  0.00e+00d  [DetectDominanceRelations] 
  1.60e-02s  0.00e+00d  [PresolveToFixPoint] #num_loops=2 #num_dual_strengthening=1 
  4.00e-03s  0.00e+00d  [ProcessAtMostOneAndLinear] 
  2.17e-03s  0.00e+00d  [DetectDuplicateConstraints] #without_enforcements=239 
  7.85e-04s  3.15e-05d  [DetectDominatedLinearConstraints] #relevant_constraints=1'371 #num_inclusions=51 
  2.04e-04s  0.00e+00d  [DetectDifferentVariables] 
  3.35e-04s  1.14e-05d  [ProcessSetPPC] #relevant_constraints=979 
  4.15e-05s  4.70e-07d  [FindAlmostIdenticalLinearConstraints] #num_tested_pairs=22 
  1.06e-04s  5.87e-05d  [FindBigAtMostOneAndLinearOverlap] 
  2.47e-03s  8.71e-04d  [FindBigVerticalLinearOverlap] #blocks=11 #saved_nz=647 
  1.94e-04s  3.37e-05d  [FindBigHorizontalLinearOverlap] #linears=928 
  1.30e-05s  0.00e+00d  [MergeClauses] 
  1.40e-03s  0.00e+00d  [DetectDominanceRelations] 
  1.45e-02s  0.00e+00d  [PresolveToFixPoint] #num_loops=2 #num_dual_strengthening=1 
  7.81e-05s  0.00e+00d  [ExpandObjective] #entries=321 #tight_variables=117 #tight_constraints=67 

Presolve summary:
  - 51 affine relations were detected.
  - rule 'TODO dual: only one blocking constraint?' was applied 789 times.
  - rule 'TODO dual: only one unspecified blocking constraint?' was applied 117 times.
  - rule 'TODO duplicate: identical constraint with different enforcements' was applied 670 times.
  - rule 'TODO no_overlap: with task always last' was applied 1 time.
  - rule 'affine: new relation' was applied 51 times.
  - rule 'all_diff: inferred from x != y constraints' was applied 1 time.
  - rule 'at_most_one: removed literals' was applied 9 times.
  - rule 'at_most_one: size one' was applied 9 times.
  - rule 'at_most_one: transformed into max clique.' was applied 1 time.
  - rule 'deductions: 203 stored' was applied 1 time.
  - rule 'dual: fix variable' was applied 24 times.
  - rule 'dual: reduced domain' was applied 43 times.
  - rule 'duplicate: merged rhs of linear constraint' was applied 44 times.
  - rule 'duplicate: removed constraint' was applied 280 times.
  - rule 'enforcement: false literal' was applied 17 times.
  - rule 'enforcement: true literal' was applied 9 times.
  - rule 'exactly_one: x and not(x)' was applied 1 time.
  - rule 'incompatible linear: add implication' was applied 30 times.
  - rule 'linear inclusion: redundant containing constraint' was applied 1 time.
  - rule 'linear matrix: common vertical rectangle' was applied 87 times.
  - rule 'linear: always true' was applied 596 times.
  - rule 'linear: doubleton free' was applied 10 times.
  - rule 'linear: empty' was applied 28 times.
  - rule 'linear: extracted enforcement literal' was applied 5'669 times.
  - rule 'linear: fixed or dup variables' was applied 2'317 times.
  - rule 'linear: positive equal one' was applied 4 times.
  - rule 'linear: reduced variable domains' was applied 191 times.
  - rule 'linear: remapped using affine relations' was applied 2'325 times.
  - rule 'linear: simplified rhs' was applied 7'833 times.
  - rule 'linear: variable substitution 1' was applied 10 times.
  - rule 'linear: variable substitution 2' was applied 5 times.
  - rule 'presolve: 84 unused variables removed.' was applied 1 time.
  - rule 'presolve: iteration' was applied 3 times.
  - rule 'probing: reduced enforced constraint to implication.' was applied 21 times.
  - rule 'symmetry: fixed to false in general orbit' was applied 1 time.

Presolved optimization model '': (model_fingerprint: 0x4cd715d6bf62141)
#Variables: 214 (#ints: 9 in objective)
  - 63 Booleans in [0,1]
  - 114 different domains in [-3195,3619] with a largest complexity of 11.
#kAllDiff: 1
#kExactlyOne: 3 (#literals: 9)
#kLinear2: 798 (#enforced: 735 #multi: 656)
#kLinear3: 154 (#enforced: 74)
#kLinearN: 1'103 (#enforced: 1'020) (#terms: 7'234)

Preloading model.
#Bound   0.25s best:inf   next:[122,4018] initial_domain
#Model   0.26s var:214/214 constraints:2059/2059

Starting search at 0.26s with 48 workers.
16 full problem subsolvers: [core, default_lp, lb_tree_search, max_lp, no_lp, objective_lb_search, objective_lb_search_max_lp, objective_lb_search_no_lp, objective_shaving_search_max_lp, objective_shaving_search_no_lp, probing, probing_max_lp, pseudo_costs, quick_restart, quick_restart_no_lp, reduced_costs]
30 first solution subsolvers: [fj_long_default(2), fj_long_lin_default, fj_long_lin_perturb, fj_long_lin_random, fj_long_perturb, fj_long_random, fj_short_default(2), fj_short_lin_default(2), fj_short_lin_perturb, fj_short_lin_random, fj_short_perturb, fj_short_random, fs_random(4), fs_random_no_lp(4), fs_random_quick_restart(4), fs_random_quick_restart_no_lp(3)]
13 incomplete subsolvers: [feasibility_pump, graph_arc_lns, graph_cst_lns, graph_dec_lns, graph_var_lns, rins/rens, rnd_cst_lns, rnd_var_lns, violation_ls(5)]
3 helper subsolvers: [neighborhood_helper, synchronization_agent, update_gap_integral]
#Bound   0.28s best:inf   next:[123,4018] bool_core (num_cores=1 [size:1 mw:1] a=9 d=0 fixed=0/72 clauses=4)
#Bound   0.28s best:inf   next:[147,4018] objective_lb_search_no_lp
#1       0.29s best:1761  next:[147,1760] no_lp (fixed_bools=0/88)
#Bound   0.29s best:1761  next:[152,1760] objective_lb_search_no_lp
#Bound   0.29s best:1761  next:[154,1760] objective_lb_search_no_lp
#Bound   0.29s best:1761  next:[158,1760] objective_lb_search_no_lp
#2       0.29s best:1448  next:[158,1447] no_lp (fixed_bools=0/100)
#Bound   0.29s best:1448  next:[159,1447] objective_lb_search_no_lp
#3       0.30s best:1440  next:[159,1439] no_lp (fixed_bools=0/108)
#4       0.30s best:1277  next:[159,1276] no_lp (fixed_bools=0/112)
#Bound   0.31s best:1277  next:[196,1276] objective_lb_search_no_lp
#5       0.31s best:1238  next:[196,1237] no_lp (fixed_bools=0/120)
#Bound   0.31s best:1238  next:[197,1237] objective_lb_search_no_lp
#Bound   0.31s best:1238  next:[211,1237] objective_lb_search_no_lp
#Bound   0.32s best:1238  next:[234,1237] objective_lb_search_no_lp
#Bound   0.32s best:1238  next:[235,1237] objective_lb_search_no_lp
#Bound   0.34s best:1238  next:[241,1237] objective_lb_search_no_lp
#6       0.35s best:1236  next:[241,1235] violation_ls(batch:3 #solutions_imported:3 #lin_moves:6'379 #lin_evals:32'163 #gen_moves:927 #gen_evals:47 #comp_moves:57 #backtracks:435 #weight_updates:5'181)
#7       0.36s best:1234  next:[241,1233] violation_ls(batch:4 #solutions_imported:4 #lin_moves:6'380 #lin_evals:32'172 #gen_moves:927 #gen_evals:47 #comp_moves:57 #backtracks:435 #weight_updates:5'181)
#8       0.36s best:1233  next:[241,1232] violation_ls(batch:5 #solutions_imported:5 #lin_moves:6'380 #lin_evals:32'200 #gen_moves:944 #gen_evals:47 #comp_moves:58 #backtracks:443 #weight_updates:5'181)
#9       0.36s best:1232  next:[241,1231] violation_ls(batch:6 #solutions_imported:6 #lin_moves:6'380 #lin_evals:32'203 #gen_moves:945 #gen_evals:47 #comp_moves:59 #backtracks:443 #weight_updates:5'181)
#10      0.37s best:1197  next:[241,1196] no_lp (fixed_bools=0/137)
#Bound   0.42s best:1197  next:[242,1196] objective_lb_search_no_lp
#11      0.43s best:1192  next:[242,1191] quick_restart_no_lp (fixed_bools=0/163)
#12      0.45s best:1190  next:[242,1189] violation_ls(batch:4 #solutions_imported:4 #lin_moves:5'405 #lin_evals:46'598 #gen_moves:9'068 #gen_evals:1'072 #comp_moves:280 #backtracks:4'392 #weight_updates:5'198)
#13      0.45s best:1189  next:[242,1188] violation_ls(batch:5 #solutions_imported:5 #lin_moves:5'405 #lin_evals:46'603 #gen_moves:9'070 #gen_evals:1'072 #comp_moves:282 #backtracks:4'392 #weight_updates:5'198)
#14      0.45s best:1188  next:[242,1187] violation_ls(batch:6 #solutions_imported:6 #lin_moves:5'405 #lin_evals:46'607 #gen_moves:9'072 #gen_evals:1'072 #comp_moves:284 #backtracks:4'392 #weight_updates:5'198)
#15      0.45s best:1187  next:[242,1186] violation_ls(batch:7 #solutions_imported:7 #lin_moves:5'406 #lin_evals:46'612 #gen_moves:9'072 #gen_evals:1'072 #comp_moves:284 #backtracks:4'392 #weight_updates:5'198)
#16      0.45s best:1186  next:[242,1185] violation_ls(batch:8 #solutions_imported:8 #lin_moves:5'407 #lin_evals:46'618 #gen_moves:9'072 #gen_evals:1'072 #comp_moves:284 #backtracks:4'392 #weight_updates:5'198)
#17      0.45s best:1184  next:[242,1183] violation_ls(batch:9 #solutions_imported:9 #lin_moves:5'408 #lin_evals:46'627 #gen_moves:9'072 #gen_evals:1'072 #comp_moves:284 #backtracks:4'392 #weight_updates:5'198)
#18      0.45s best:1183  next:[242,1182] violation_ls(batch:10 #solutions_imported:10 #lin_moves:5'409 #lin_evals:46'636 #gen_moves:9'072 #gen_evals:1'072 #comp_moves:284 #backtracks:4'392 #weight_updates:5'198)
#19      0.45s best:1182  next:[242,1181] violation_ls(batch:5 #solutions_imported:5 #lin_moves:5'003 #lin_evals:47'265 #gen_moves:10'234 #gen_evals:986 #comp_moves:411 #backtracks:4'907 #weight_updates:5'129)
#20      0.45s best:1181  next:[242,1180] violation_ls(batch:6 #solutions_imported:6 #lin_moves:5'004 #lin_evals:47'274 #gen_moves:10'234 #gen_evals:986 #comp_moves:411 #backtracks:4'907 #weight_updates:5'129)
#21      0.45s best:1180  next:[242,1179] violation_ls(batch:7 #solutions_imported:7 #lin_moves:5'004 #lin_evals:47'290 #gen_moves:10'242 #gen_evals:986 #comp_moves:413 #backtracks:4'910 #weight_updates:5'129)
#22      0.45s best:1179  next:[242,1178] violation_ls(batch:8 #solutions_imported:8 #lin_moves:5'005 #lin_evals:47'299 #gen_moves:10'242 #gen_evals:986 #comp_moves:413 #backtracks:4'910 #weight_updates:5'129)
#23      0.45s best:1178  next:[242,1177] violation_ls(batch:9 #solutions_imported:9 #lin_moves:5'007 #lin_evals:47'314 #gen_moves:10'242 #gen_evals:986 #comp_moves:413 #backtracks:4'910 #weight_updates:5'130)
#24      0.45s best:1177  next:[242,1176] violation_ls(batch:10 #solutions_imported:10 #lin_moves:5'007 #lin_evals:47'318 #gen_moves:10'244 #gen_evals:986 #comp_moves:415 #backtracks:4'910 #weight_updates:5'130)
#25      0.45s best:1176  next:[242,1175] violation_ls(batch:11 #solutions_imported:11 #lin_moves:5'008 #lin_evals:47'327 #gen_moves:10'244 #gen_evals:986 #comp_moves:415 #backtracks:4'910 #weight_updates:5'130)
#26      0.47s best:1164  next:[242,1163] no_lp (fixed_bools=0/157)
#27      0.49s best:1136  next:[242,1135] no_lp (fixed_bools=0/169)
#28      0.50s best:1133  next:[242,1132] rins_pump_lns (d=0.71 s=105 t=0.10 p=1.00 stall=1 h=auto_l0)
#29      0.50s best:1130  next:[242,1129] no_lp (fixed_bools=0/174)
#30      0.52s best:1124  next:[242,1123] violation_ls(batch:12 #solutions_imported:12 #lin_moves:5'651 #lin_evals:49'426 #gen_moves:10'244 #gen_evals:986 #comp_moves:415 #backtracks:4'910 #weight_updates:5'280)
#31      0.52s best:1123  next:[242,1122] violation_ls(batch:9 #solutions_imported:9 #lin_moves:15'952 #lin_evals:77'885 #gen_moves:3'811 #gen_evals:291 #comp_moves:269 #backtracks:1'771 #weight_updates:5'662)
#32      0.53s best:1122  next:[242,1121] violation_ls(batch:5 #solutions_imported:5 #lin_moves:24'047 #lin_evals:102'779 #gen_moves:1'269 #gen_evals:117 #comp_moves:121 #backtracks:574 #weight_updates:5'977)
#33      0.54s best:1121  next:[242,1120] violation_ls(batch:6 #solutions_imported:6 #lin_moves:24'061 #lin_evals:102'838 #gen_moves:1'269 #gen_evals:117 #comp_moves:121 #backtracks:574 #weight_updates:5'984)
#34      0.54s best:1120  next:[242,1119] violation_ls(batch:7 #solutions_imported:7 #lin_moves:24'083 #lin_evals:102'958 #gen_moves:1'269 #gen_evals:117 #comp_moves:121 #backtracks:574 #weight_updates:6'003)
#35      0.54s best:1119  next:[242,1118] violation_ls(batch:8 #solutions_imported:8 #lin_moves:24'083 #lin_evals:102'973 #gen_moves:1'279 #gen_evals:120 #comp_moves:123 #backtracks:578 #weight_updates:6'003)
#36      0.54s best:1118  next:[242,1117] violation_ls(batch:9 #solutions_imported:9 #lin_moves:24'084 #lin_evals:102'982 #gen_moves:1'279 #gen_evals:120 #comp_moves:123 #backtracks:578 #weight_updates:6'003)
#37      0.54s best:1117  next:[242,1116] violation_ls(batch:10 #solutions_imported:10 #lin_moves:24'086 #lin_evals:102'996 #gen_moves:1'279 #gen_evals:120 #comp_moves:123 #backtracks:578 #weight_updates:6'004)
#38      0.54s best:1116  next:[242,1115] violation_ls(batch:11 #solutions_imported:11 #lin_moves:24'086 #lin_evals:102'999 #gen_moves:1'280 #gen_evals:120 #comp_moves:124 #backtracks:578 #weight_updates:6'004)
#39      0.54s best:1115  next:[242,1114] violation_ls(batch:12 #solutions_imported:12 #lin_moves:24'086 #lin_evals:103'003 #gen_moves:1'282 #gen_evals:120 #comp_moves:126 #backtracks:578 #weight_updates:6'004)
#40      0.55s best:1110  next:[242,1109] quick_restart_no_lp (fixed_bools=0/193)
#41      0.55s best:1105  next:[242,1104] quick_restart_no_lp (fixed_bools=0/194)
#42      0.55s best:1103  next:[242,1102] violation_ls(batch:12 #solutions_imported:12 #lin_moves:15'953 #lin_evals:77'938 #gen_moves:3'834 #gen_evals:294 #comp_moves:272 #backtracks:1'781 #weight_updates:5'662)
#43      0.56s best:1101  next:[242,1100] violation_ls(batch:13 #solutions_imported:13 #lin_moves:24'087 #lin_evals:103'012 #gen_moves:1'282 #gen_evals:120 #comp_moves:126 #backtracks:578 #weight_updates:6'004)
#44      0.56s best:1099  next:[242,1098] violation_ls(batch:13 #solutions_imported:13 #lin_moves:15'954 #lin_evals:77'947 #gen_moves:3'834 #gen_evals:294 #comp_moves:272 #backtracks:1'781 #weight_updates:5'662)
#45      0.56s best:1097  next:[242,1096] violation_ls(batch:13 #solutions_imported:13 #lin_moves:5'652 #lin_evals:49'435 #gen_moves:10'244 #gen_evals:986 #comp_moves:415 #backtracks:4'910 #weight_updates:5'280)
#46      0.58s best:1096  next:[242,1095] violation_ls(batch:3 #solutions_imported:3 #lin_moves:9'539 #lin_evals:55'131 #gen_moves:8'944 #gen_evals:806 #comp_moves:684 #backtracks:4'126 #weight_updates:547)
#47      0.58s best:1095  next:[242,1094] violation_ls(batch:4 #solutions_imported:4 #lin_moves:9'540 #lin_evals:55'140 #gen_moves:8'944 #gen_evals:806 #comp_moves:684 #backtracks:4'126 #weight_updates:547)
#48      0.59s best:1094  next:[242,1093] violation_ls(batch:5 #solutions_imported:5 #lin_moves:10'175 #lin_evals:57'142 #gen_moves:8'944 #gen_evals:806 #comp_moves:684 #backtracks:4'126 #weight_updates:702)
#49      0.59s best:1093  next:[242,1092] violation_ls(batch:6 #solutions_imported:6 #lin_moves:10'312 #lin_evals:57'700 #gen_moves:8'944 #gen_evals:806 #comp_moves:684 #backtracks:4'126 #weight_updates:754)
#50      0.59s best:1092  next:[242,1091] violation_ls(batch:7 #solutions_imported:7 #lin_moves:10'347 #lin_evals:57'851 #gen_moves:8'944 #gen_evals:806 #comp_moves:684 #backtracks:4'126 #weight_updates:773)
#51      0.59s best:1091  next:[242,1090] violation_ls(batch:8 #solutions_imported:8 #lin_moves:10'380 #lin_evals:58'031 #gen_moves:8'944 #gen_evals:806 #comp_moves:684 #backtracks:4'126 #weight_updates:804)
#52      0.61s best:1090  next:[242,1089] violation_ls(batch:9 #solutions_imported:9 #lin_moves:10'380 #lin_evals:61'904 #gen_moves:10'566 #gen_evals:969 #comp_moves:862 #backtracks:4'848 #weight_updates:832)
#53      0.61s best:1089  next:[242,1088] violation_ls(batch:10 #solutions_imported:10 #lin_moves:10'380 #lin_evals:61'908 #gen_moves:10'567 #gen_evals:969 #comp_moves:863 #backtracks:4'848 #weight_updates:832)
#54      0.61s best:1088  next:[242,1087] violation_ls(batch:11 #solutions_imported:11 #lin_moves:10'380 #lin_evals:64'023 #gen_moves:11'579 #gen_evals:1'109 #comp_moves:931 #backtracks:5'320 #weight_updates:849)
#55      0.62s best:1087  next:[242,1086] violation_ls(batch:12 #solutions_imported:12 #lin_moves:10'380 #lin_evals:64'028 #gen_moves:11'580 #gen_evals:1'109 #comp_moves:932 #backtracks:5'320 #weight_updates:849)
#56      0.63s best:1083  next:[242,1082] rnd_cst_lns (d=0.96 s=202 t=0.10 p=1.00 stall=0 h=auto_l0)
#Bound   0.65s best:1083  next:[366,1082] objective_lb_search_no_lp
#57      0.68s best:1081  next:[366,1080] quick_restart_no_lp (fixed_bools=0/254)
#58      0.68s best:1080  next:[366,1079] violation_ls(batch:14 #solutions_imported:14 #lin_moves:5'652 #lin_evals:49'440 #gen_moves:10'247 #gen_evals:986 #comp_moves:418 #backtracks:4'910 #weight_updates:5'280)
#59      0.71s best:1076  next:[366,1075] quick_restart_no_lp (fixed_bools=0/259)
#60      0.72s best:1072  next:[366,1071] quick_restart_no_lp (fixed_bools=0/260)
#61      0.76s best:1071  next:[366,1070] violation_ls(batch:15 #solutions_imported:15 #lin_moves:15'518 #lin_evals:98'243 #gen_moves:15'429 #gen_evals:1'577 #comp_moves:1'111 #backtracks:7'155 #weight_updates:5'768)
#62      0.77s best:1070  next:[366,1069] violation_ls(batch:15 #solutions_imported:15 #lin_moves:33'593 #lin_evals:135'887 #gen_moves:1'282 #gen_evals:120 #comp_moves:126 #backtracks:578 #weight_updates:6'499)
#63      0.77s best:1068  next:[366,1067] violation_ls(batch:15 #solutions_imported:15 #lin_moves:25'487 #lin_evals:114'144 #gen_moves:3'835 #gen_evals:294 #comp_moves:273 #backtracks:1'781 #weight_updates:6'129)
#64      0.77s best:1067  next:[366,1066] violation_ls(batch:15 #solutions_imported:15 #lin_moves:5'652 #lin_evals:49'491 #gen_moves:10'278 #gen_evals:990 #comp_moves:421 #backtracks:4'924 #weight_updates:5'280)
#65      0.78s best:1066  next:[366,1065] violation_ls(batch:15 #solutions_imported:15 #lin_moves:14'907 #lin_evals:107'423 #gen_moves:21'170 #gen_evals:2'343 #comp_moves:1'375 #backtracks:9'895 #weight_updates:5'828)
#Bound   0.80s best:1066  next:[396,1065] objective_lb_search_no_lp
#66      0.82s best:1065  next:[396,1064] violation_ls(batch:16 #solutions_imported:16 #lin_moves:15'535 #lin_evals:98'321 #gen_moves:15'429 #gen_evals:1'577 #comp_moves:1'111 #backtracks:7'155 #weight_updates:5'777)
#67      0.83s best:1064  next:[396,1063] violation_ls(batch:16 #solutions_imported:16 #lin_moves:14'907 #lin_evals:107'464 #gen_moves:21'195 #gen_evals:2'347 #comp_moves:1'378 #backtracks:9'906 #weight_updates:5'828)
#68      0.83s best:1063  next:[396,1062] violation_ls(batch:16 #solutions_imported:16 #lin_moves:33'593 #lin_evals:135'921 #gen_moves:1'303 #gen_evals:123 #comp_moves:129 #backtracks:587 #weight_updates:6'499)
#69      0.83s best:1062  next:[396,1061] violation_ls(batch:16 #solutions_imported:16 #lin_moves:25'490 #lin_evals:114'164 #gen_moves:3'835 #gen_evals:294 #comp_moves:273 #backtracks:1'781 #weight_updates:6'131)
#70      0.83s best:1061  next:[396,1060] violation_ls(batch:16 #solutions_imported:16 #lin_moves:5'665 #lin_evals:49'562 #gen_moves:10'278 #gen_evals:990 #comp_moves:421 #backtracks:4'924 #weight_updates:5'292)
#71      0.88s best:1042  next:[396,1041] graph_var_lns (d=0.97 s=231 t=0.10 p=1.00 stall=0 h=auto_l0)
#72      0.92s best:1021  next:[396,1020] graph_dec_lns (d=0.99 s=213 t=0.10 p=1.00 stall=1 h=auto_l0)
#73      0.93s best:1020  next:[396,1019] violation_ls(batch:17 #solutions_imported:17 #lin_moves:15'757 #lin_evals:99'388 #gen_moves:15'429 #gen_evals:1'577 #comp_moves:1'111 #backtracks:7'155 #weight_updates:5'948)
#74      0.93s best:1019  next:[396,1018] violation_ls(batch:17 #solutions_imported:17 #lin_moves:14'907 #lin_evals:107'496 #gen_moves:21'217 #gen_evals:2'349 #comp_moves:1'380 #backtracks:9'916 #weight_updates:5'828)
#75      0.93s best:1018  next:[396,1017] violation_ls(batch:17 #solutions_imported:17 #lin_moves:33'593 #lin_evals:136'000 #gen_moves:1'343 #gen_evals:126 #comp_moves:131 #backtracks:606 #weight_updates:6'499)
#76      0.94s best:1017  next:[396,1016] violation_ls(batch:17 #solutions_imported:17 #lin_moves:25'490 #lin_evals:114'768 #gen_moves:4'112 #gen_evals:317 #comp_moves:288 #backtracks:1'912 #weight_updates:6'134)
#77      0.94s best:1016  next:[396,1015] violation_ls(batch:17 #solutions_imported:17 #lin_moves:5'665 #lin_evals:49'592 #gen_moves:10'293 #gen_evals:992 #comp_moves:422 #backtracks:4'931 #weight_updates:5'292)
#78      0.97s best:998   next:[396,997]  quick_restart_no_lp (fixed_bools=0/316)
#79      1.00s best:982   next:[396,981]  quick_restart_no_lp (fixed_bools=0/327)
#80      1.00s best:966   next:[396,965]  quick_restart_no_lp (fixed_bools=0/329)
#81      1.01s best:956   next:[396,955]  quick_restart_no_lp (fixed_bools=0/335)
#82      1.02s best:946   next:[396,945]  quick_restart_no_lp (fixed_bools=0/337)
#Bound   1.03s best:946   next:[398,945]  objective_lb_search_no_lp
#83      1.04s best:939   next:[398,938]  rnd_var_lns (d=0.99 s=241 t=0.10 p=1.00 stall=1 h=auto_l0)
#84      1.12s best:923   next:[398,922]  rnd_var_lns (d=0.97 s=228 t=0.10 p=1.00 stall=0 h=auto_l0)
#85      1.15s best:917   next:[398,916]  rnd_cst_lns (d=0.99 s=229 t=0.10 p=1.00 stall=0 h=auto_l0)
#86      1.16s best:916   next:[398,915]  violation_ls(batch:18 #solutions_imported:18 #lin_moves:14'907 #lin_evals:107'644 #gen_moves:21'272 #gen_evals:2'353 #comp_moves:1'385 #backtracks:9'941 #weight_updates:5'828)
#87      1.16s best:915   next:[398,914]  violation_ls(batch:18 #solutions_imported:18 #lin_moves:33'593 #lin_evals:136'437 #gen_moves:1'521 #gen_evals:139 #comp_moves:143 #backtracks:689 #weight_updates:6'502)
#88      1.17s best:914   next:[398,913]  violation_ls(batch:18 #solutions_imported:18 #lin_moves:25'490 #lin_evals:115'737 #gen_moves:4'545 #gen_evals:407 #comp_moves:315 #backtracks:2'115 #weight_updates:6'143)
#89      1.17s best:913   next:[398,912]  violation_ls(batch:18 #solutions_imported:18 #lin_moves:5'689 #lin_evals:49'734 #gen_moves:10'293 #gen_evals:992 #comp_moves:422 #backtracks:4'931 #weight_updates:5'314)
#90      1.18s best:905   next:[398,904]  quick_restart_no_lp (fixed_bools=0/406)
#91      1.18s best:904   next:[398,903]  quick_restart_no_lp (fixed_bools=0/411)
#92      1.21s best:890   next:[398,889]  quick_restart_no_lp (fixed_bools=0/414)
#93      1.21s best:889   next:[398,888]  quick_restart_no_lp (fixed_bools=0/415)
#94      1.22s best:888   next:[398,887]  quick_restart_no_lp (fixed_bools=0/417)
#Bound   1.23s best:888   next:[399,887]  objective_lb_search_no_lp
#95      1.27s best:886   next:[399,885]  quick_restart_no_lp (fixed_bools=0/424)
#96      1.28s best:885   next:[399,884]  quick_restart_no_lp (fixed_bools=0/424)
#97      1.30s best:874   next:[399,873]  quick_restart_no_lp (fixed_bools=0/429)
#Bound   1.32s best:874   next:[400,873]  objective_lb_search_no_lp
#98      1.34s best:872   next:[400,871]  quick_restart_no_lp (fixed_bools=0/438)
#99      1.34s best:869   next:[400,868]  quick_restart_no_lp (fixed_bools=0/439)
#100     1.34s best:867   next:[400,866]  violation_ls(batch:19 #solutions_imported:19 #lin_moves:15'758 #lin_evals:119'686 #gen_moves:23'985 #gen_evals:2'357 #comp_moves:1'886 #backtracks:11'042 #weight_updates:6'029)
#101     1.36s best:865   next:[400,864]  violation_ls(batch:19 #solutions_imported:19 #lin_moves:14'908 #lin_evals:107'651 #gen_moves:21'272 #gen_evals:2'353 #comp_moves:1'385 #backtracks:9'941 #weight_updates:5'828)
#102     1.37s best:863   next:[400,862]  violation_ls(batch:19 #solutions_imported:19 #lin_moves:33'594 #lin_evals:136'445 #gen_moves:1'521 #gen_evals:139 #comp_moves:143 #backtracks:689 #weight_updates:6'502)
#103     1.37s best:861   next:[400,860]  violation_ls(batch:19 #solutions_imported:19 #lin_moves:25'490 #lin_evals:115'741 #gen_moves:4'546 #gen_evals:407 #comp_moves:316 #backtracks:2'115 #weight_updates:6'143)
#104     1.37s best:859   next:[400,858]  violation_ls(batch:19 #solutions_imported:19 #lin_moves:5'689 #lin_evals:49'750 #gen_moves:10'300 #gen_evals:992 #comp_moves:423 #backtracks:4'934 #weight_updates:5'314)
#105     1.40s best:858   next:[400,857]  quick_restart_no_lp (fixed_bools=0/443)
#106     1.42s best:853   next:[400,852]  quick_restart_no_lp (fixed_bools=1/448)
#107     1.43s best:844   next:[400,843]  quick_restart_no_lp (fixed_bools=1/449)
#108     1.44s best:831   next:[400,830]  quick_restart_no_lp (fixed_bools=1/450)
#109     1.48s best:825   next:[400,824]  quick_restart_no_lp (fixed_bools=1/456)
#110     1.50s best:807   next:[400,806]  quick_restart_no_lp (fixed_bools=1/458)
#111     1.52s best:806   next:[400,805]  violation_ls(batch:20 #solutions_imported:20 #lin_moves:16'006 #lin_evals:120'636 #gen_moves:23'985 #gen_evals:2'357 #comp_moves:1'886 #backtracks:11'042 #weight_updates:6'111)
#112     1.53s best:799   next:[400,798]  quick_restart_no_lp (fixed_bools=1/464)
#113     1.53s best:791   next:[400,790]  quick_restart_no_lp (fixed_bools=1/465)
#114     1.75s best:729   next:[400,728]  rnd_cst_lns (d=0.99 s=270 t=0.10 p=1.00 stall=0 h=auto_l0)
#115     1.86s best:728   next:[400,727]  violation_ls(batch:21 #solutions_imported:21 #lin_moves:16'006 #lin_evals:120'654 #gen_moves:23'994 #gen_evals:2'357 #comp_moves:1'889 #backtracks:11'045 #weight_updates:6'111)
#116     1.86s best:727   next:[400,726]  violation_ls(batch:21 #solutions_imported:21 #lin_moves:14'908 #lin_evals:129'004 #gen_moves:29'491 #gen_evals:2'997 #comp_moves:1'662 #backtracks:13'911 #weight_updates:5'936)
#117     1.86s best:726   next:[400,725]  violation_ls(batch:21 #solutions_imported:21 #lin_moves:43'195 #lin_evals:178'264 #gen_moves:1'521 #gen_evals:139 #comp_moves:143 #backtracks:689 #weight_updates:6'975)
#118     1.86s best:725   next:[400,724]  violation_ls(batch:21 #solutions_imported:21 #lin_moves:30'432 #lin_evals:141'160 #gen_moves:4'546 #gen_evals:407 #comp_moves:316 #backtracks:2'115 #weight_updates:11'214)
#119     1.86s best:724   next:[400,723]  violation_ls(batch:21 #solutions_imported:21 #lin_moves:5'689 #lin_evals:70'182 #gen_moves:18'177 #gen_evals:1'802 #comp_moves:1'061 #backtracks:8'553 #weight_updates:5'389)
#Bound   2.07s best:724   next:[401,723]  objective_lb_search_no_lp
#Bound   2.16s best:724   next:[403,723]  objective_lb_search_no_lp
#120     2.19s best:712   next:[403,711]  graph_var_lns (d=0.99 s=334 t=0.10 p=0.94 stall=0 h=auto_l0)
#Bound   2.48s best:712   next:[416,711]  objective_lb_search_no_lp
#Bound   2.66s best:712   next:[417,711]  objective_lb_search_no_lp
#Bound   2.83s best:712   next:[430,711]  objective_lb_search_no_lp [skipped_logs=2]
#Bound   3.78s best:712   next:[442,711]  objective_lb_search_no_lp [skipped_logs=3]
#Bound   4.67s best:712   next:[443,711]  objective_shaving_search_no_lp (vars=218 csts=1805) [skipped_logs=0]
#Bound   5.93s best:712   next:[453,711]  objective_lb_search_no_lp [skipped_logs=2]
#Bound   6.99s best:712   next:[461,711]  objective_lb_search_no_lp [skipped_logs=3]
#Bound   7.59s best:712   next:[466,711]  objective_lb_search_no_lp [skipped_logs=1]
#Bound   8.87s best:712   next:[476,711]  objective_lb_search_no_lp [skipped_logs=2]
#Bound   9.38s best:712   next:[485,711]  objective_lb_search_no_lp [skipped_logs=0]
#Bound  10.30s best:712   next:[490,711]  objective_lb_search_no_lp [skipped_logs=1]
#Bound  11.74s best:712   next:[507,711]  objective_lb_search_no_lp [skipped_logs=1]
#Bound  12.99s best:712   next:[510,711]  objective_lb_search_no_lp [skipped_logs=2]
#Model  13.28s var:213/214 constraints:1791/2059
#Bound  13.29s best:712   next:[512,711]  objective_lb_search_no_lp [skipped_logs=0]
#Bound  14.34s best:712   next:[514,711]  objective_lb_search_no_lp [skipped_logs=1]
#Model  15.51s var:212/214 constraints:1782/2059
#Bound  15.99s best:712   next:[516,711]  objective_lb_search_no_lp [skipped_logs=1]
#Model  16.34s var:211/214 constraints:1753/2059
#Bound  16.87s best:712   next:[562,711]  objective_lb_search_no_lp [skipped_logs=2]
#Model  17.64s var:210/214 constraints:1675/2059
#Model  17.91s var:209/214 constraints:1666/2059
#Model  18.00s var:208/214 constraints:1628/2059
#Bound  17.73s best:712   next:[571,711]  objective_lb_search_no_lp [skipped_logs=1]
#Model  18.15s var:207/214 constraints:1536/2059
#Done   18.28s no_lp
#Model  18.29s var:199/214 constraints:1162/2059
#Done   18.29s core
#Model  18.29s var:198/214 constraints:1105/2059
#Done   18.29s reduced_costs
#Bound  18.25s best:712   next:[618,711]  objective_lb_search_no_lp [skipped_logs=3]

Task timing                                  n [     min,      max]      avg      dev     time         n [     min,      max]      avg      dev    dtime
                             'core':         1 [  18.03s,   18.03s]   18.03s   0.00ns   18.03s         1 [   6.83s,    6.83s]    6.83s   0.00ns    6.83s
                       'default_lp':         1 [  18.03s,   18.03s]   18.03s   0.00ns   18.03s         1 [   1.57s,    1.57s]    1.57s   0.00ns    1.57s
                 'feasibility_pump':       101 [ 17.31ms, 235.46ms] 111.36ms  40.79ms   11.25s       100 [  3.74ms,  16.33ms]  10.42ms 913.61us    1.04s
                  'fj_long_default':         1 [118.63ms, 118.63ms] 118.63ms   0.00ns 118.63ms         1 [ 41.72ms,  41.72ms]  41.72ms   0.00ns  41.72ms
                  'fj_long_default':         1 [122.06ms, 122.06ms] 122.06ms   0.00ns 122.06ms         1 [ 44.90ms,  44.90ms]  44.90ms   0.00ns  44.90ms
              'fj_long_lin_default':         1 [111.87ms, 111.87ms] 111.87ms   0.00ns 111.87ms         1 [ 62.48ms,  62.48ms]  62.48ms   0.00ns  62.48ms
              'fj_long_lin_perturb':         1 [113.95ms, 113.95ms] 113.95ms   0.00ns 113.95ms         1 [ 55.38ms,  55.38ms]  55.38ms   0.00ns  55.38ms
               'fj_long_lin_random':         1 [115.10ms, 115.10ms] 115.10ms   0.00ns 115.10ms         1 [ 54.51ms,  54.51ms]  54.51ms   0.00ns  54.51ms
                  'fj_long_perturb':         1 [112.87ms, 112.87ms] 112.87ms   0.00ns 112.87ms         1 [ 64.12ms,  64.12ms]  64.12ms   0.00ns  64.12ms
                   'fj_long_random':         1 [124.25ms, 124.25ms] 124.25ms   0.00ns 124.25ms         1 [ 51.50ms,  51.50ms]  51.50ms   0.00ns  51.50ms
                 'fj_short_default':         1 [ 95.87ms,  95.87ms]  95.87ms   0.00ns  95.87ms         1 [ 64.04ms,  64.04ms]  64.04ms   0.00ns  64.04ms
                 'fj_short_default':         1 [118.03ms, 118.03ms] 118.03ms   0.00ns 118.03ms         1 [ 65.04ms,  65.04ms]  65.04ms   0.00ns  65.04ms
             'fj_short_lin_default':         1 [119.52ms, 119.52ms] 119.52ms   0.00ns 119.52ms         1 [ 63.90ms,  63.90ms]  63.90ms   0.00ns  63.90ms
             'fj_short_lin_default':         1 [156.62ms, 156.62ms] 156.62ms   0.00ns 156.62ms         1 [ 61.45ms,  61.45ms]  61.45ms   0.00ns  61.45ms
             'fj_short_lin_perturb':         1 [131.17ms, 131.17ms] 131.17ms   0.00ns 131.17ms         1 [ 46.45ms,  46.45ms]  46.45ms   0.00ns  46.45ms
              'fj_short_lin_random':         1 [132.03ms, 132.03ms] 132.03ms   0.00ns 132.03ms         1 [ 62.50ms,  62.50ms]  62.50ms   0.00ns  62.50ms
                 'fj_short_perturb':         1 [120.25ms, 120.25ms] 120.25ms   0.00ns 120.25ms         1 [ 47.77ms,  47.77ms]  47.77ms   0.00ns  47.77ms
                  'fj_short_random':         1 [119.05ms, 119.05ms] 119.05ms   0.00ns 119.05ms         1 [ 62.79ms,  62.79ms]  62.79ms   0.00ns  62.79ms
                        'fs_random':         1 [ 25.92ms,  25.92ms]  25.92ms   0.00ns  25.92ms         1 [ 20.00ns,  20.00ns]  20.00ns   0.00ns  20.00ns
                        'fs_random':         1 [ 26.02ms,  26.02ms]  26.02ms   0.00ns  26.02ms         1 [ 20.00ns,  20.00ns]  20.00ns   0.00ns  20.00ns
                        'fs_random':         1 [ 29.00ms,  29.00ms]  29.00ms   0.00ns  29.00ms         1 [ 20.00ns,  20.00ns]  20.00ns   0.00ns  20.00ns
                        'fs_random':         1 [ 29.44ms,  29.44ms]  29.44ms   0.00ns  29.44ms         1 [ 20.00ns,  20.00ns]  20.00ns   0.00ns  20.00ns
                  'fs_random_no_lp':         1 [ 22.61ms,  22.61ms]  22.61ms   0.00ns  22.61ms         0 [  0.00ns,   0.00ns]   0.00ns   0.00ns   0.00ns
                  'fs_random_no_lp':         1 [ 23.55ms,  23.55ms]  23.55ms   0.00ns  23.55ms         0 [  0.00ns,   0.00ns]   0.00ns   0.00ns   0.00ns
                  'fs_random_no_lp':         1 [ 24.09ms,  24.09ms]  24.09ms   0.00ns  24.09ms         0 [  0.00ns,   0.00ns]   0.00ns   0.00ns   0.00ns
                  'fs_random_no_lp':         1 [ 25.80ms,  25.80ms]  25.80ms   0.00ns  25.80ms         0 [  0.00ns,   0.00ns]   0.00ns   0.00ns   0.00ns
          'fs_random_quick_restart':         1 [ 26.23ms,  26.23ms]  26.23ms   0.00ns  26.23ms         1 [ 20.00ns,  20.00ns]  20.00ns   0.00ns  20.00ns
          'fs_random_quick_restart':         1 [ 27.46ms,  27.46ms]  27.46ms   0.00ns  27.46ms         1 [ 20.00ns,  20.00ns]  20.00ns   0.00ns  20.00ns
          'fs_random_quick_restart':         1 [ 28.80ms,  28.80ms]  28.80ms   0.00ns  28.80ms         1 [ 20.00ns,  20.00ns]  20.00ns   0.00ns  20.00ns
          'fs_random_quick_restart':         1 [ 29.11ms,  29.11ms]  29.11ms   0.00ns  29.11ms         1 [ 20.00ns,  20.00ns]  20.00ns   0.00ns  20.00ns
    'fs_random_quick_restart_no_lp':         1 [ 22.38ms,  22.38ms]  22.38ms   0.00ns  22.38ms         0 [  0.00ns,   0.00ns]   0.00ns   0.00ns   0.00ns
    'fs_random_quick_restart_no_lp':         1 [ 25.73ms,  25.73ms]  25.73ms   0.00ns  25.73ms         0 [  0.00ns,   0.00ns]   0.00ns   0.00ns   0.00ns
    'fs_random_quick_restart_no_lp':         1 [ 26.19ms,  26.19ms]  26.19ms   0.00ns  26.19ms         0 [  0.00ns,   0.00ns]   0.00ns   0.00ns   0.00ns
                    'graph_arc_lns':       100 [  4.63ms,    2.60s] 946.81ms 594.10ms    1.58m        95 [ 10.00ns, 217.89ms]  66.13ms  43.63ms    6.28s
                    'graph_cst_lns':       100 [  1.60ms, 117.88ms]   4.60ms  12.63ms 460.39ms         0 [  0.00ns,   0.00ns]   0.00ns   0.00ns   0.00ns
                    'graph_dec_lns':       100 [  5.16ms,    2.30s] 816.99ms 562.28ms    1.36m        93 [ 10.00ns, 184.61ms]  58.36ms  44.96ms    5.43s
                    'graph_var_lns':       100 [  3.84ms,    2.66s] 827.28ms 585.43ms    1.38m        92 [ 10.00ns, 299.67ms]  62.32ms  52.93ms    5.73s
                   'lb_tree_search':         1 [  18.03s,   18.03s]   18.03s   0.00ns   18.03s         1 [   4.21s,    4.21s]    4.21s   0.00ns    4.21s
                           'max_lp':         1 [  18.03s,   18.03s]   18.03s   0.00ns   18.03s         1 [   2.89s,    2.89s]    2.89s   0.00ns    2.89s
                            'no_lp':         1 [  18.03s,   18.03s]   18.03s   0.00ns   18.03s         1 [   1.72s,    1.72s]    1.72s   0.00ns    1.72s
              'objective_lb_search':         1 [  18.03s,   18.03s]   18.03s   0.00ns   18.03s         1 [   1.96s,    1.96s]    1.96s   0.00ns    1.96s
       'objective_lb_search_max_lp':         1 [  18.03s,   18.03s]   18.03s   0.00ns   18.03s         1 [   3.63s,    3.63s]    3.63s   0.00ns    3.63s
        'objective_lb_search_no_lp':         1 [  18.03s,   18.03s]   18.03s   0.00ns   18.03s         1 [   1.39s,    1.39s]    1.39s   0.00ns    1.39s
  'objective_shaving_search_max_lp':        57 [  4.84ms,    1.16s] 312.76ms 278.58ms   17.83s        42 [ 16.23us, 158.98ms]  24.07ms  37.78ms    1.01s
   'objective_shaving_search_no_lp':        58 [  2.56ms,    1.15s] 307.67ms 279.57ms   17.84s        42 [518.96us, 110.01ms]  21.59ms  25.92ms 906.64ms
                          'probing':         1 [  18.03s,   18.03s]   18.03s   0.00ns   18.03s         1 [663.51ms, 663.51ms] 663.51ms   0.00ns 663.51ms
                   'probing_max_lp':         1 [  18.03s,   18.03s]   18.03s   0.00ns   18.03s         1 [931.16ms, 931.16ms] 931.16ms   0.00ns 931.16ms
                     'pseudo_costs':         1 [  18.03s,   18.03s]   18.03s   0.00ns   18.03s         1 [   2.80s,    2.80s]    2.80s   0.00ns    2.80s
                    'quick_restart':         1 [  18.03s,   18.03s]   18.03s   0.00ns   18.03s         1 [   2.54s,    2.54s]    2.54s   0.00ns    2.54s
              'quick_restart_no_lp':         1 [  18.03s,   18.03s]   18.03s   0.00ns   18.03s         1 [   1.52s,    1.52s]    1.52s   0.00ns    1.52s
                    'reduced_costs':         1 [  18.03s,   18.03s]   18.03s   0.00ns   18.03s         1 [   2.52s,    2.52s]    2.52s   0.00ns    2.52s
                        'rins/rens':       100 [152.99us,    2.35s] 708.92ms 593.46ms    1.18m        83 [ 10.00ns, 193.38ms]  68.32ms  43.13ms    5.67s
                      'rnd_cst_lns':       100 [  1.76ms,    2.68s] 789.53ms 589.45ms    1.32m        95 [ 10.00ns, 200.27ms]  56.01ms  46.02ms    5.32s
                      'rnd_var_lns':       100 [  3.50ms,    2.50s] 883.63ms 596.92ms    1.47m        96 [ 10.00ns, 204.67ms]  61.28ms  44.58ms    5.88s
                     'violation_ls':       100 [236.49us, 335.27ms] 117.13ms  74.49ms   11.71s       100 [430.00ns,  60.27ms]  45.77ms  20.36ms    4.58s
                     'violation_ls':       100 [250.01us, 314.39ms] 113.36ms  66.69ms   11.34s       100 [890.00ns,  60.24ms]  45.32ms  20.16ms    4.53s
                     'violation_ls':       100 [253.09us, 288.07ms] 124.65ms  74.67ms   12.47s       100 [860.00ns,  62.19ms]  45.40ms  21.50ms    4.54s
                     'violation_ls':       100 [260.68us, 363.97ms] 122.26ms  77.97ms   12.23s       100 [430.00ns,  62.33ms]  45.45ms  20.39ms    4.55s
                     'violation_ls':       100 [269.36us, 400.44ms] 134.04ms  90.09ms   13.40s       100 [890.00ns,  58.96ms]  42.47ms  19.18ms    4.25s

Search stats                        Bools  Conflicts  Branches  Restarts  BoolPropag  IntegerPropag
                           'core':  2'863      6'796    36'503    10'822   9'445'970      4'383'196
                     'default_lp':    349      4'056    22'249     4'048     460'417      3'103'523
                      'fs_random':     63          0       108       108          18          2'024
                      'fs_random':     63          0        62        62          18          1'041
                      'fs_random':     63          0        66        66          18          1'128
                      'fs_random':     63          0        98        98          18          1'821
                'fs_random_no_lp':     63          0         0         0           0              0
                'fs_random_no_lp':     63          0       108       108          18          2'024
                'fs_random_no_lp':     63          0        62        62          18          1'041
                'fs_random_no_lp':     63          0        80        80          18          1'419
        'fs_random_quick_restart':     63          0       108       108          18          2'024
        'fs_random_quick_restart':     63          0       108       108          18          2'024
        'fs_random_quick_restart':     63          0        66        66          18          1'128
        'fs_random_quick_restart':     63          0        70        70          18          1'219
  'fs_random_quick_restart_no_lp':     63          0       108       108          18          2'024
  'fs_random_quick_restart_no_lp':     63          0       108       108          18          2'024
  'fs_random_quick_restart_no_lp':     63          0        50        50          18            677
                 'lb_tree_search':     63         83    16'415     3'008      16'660        813'581
                         'max_lp':     63      2'348    29'296     6'304      82'353      2'990'865
                          'no_lp':    578     12'345    31'369     3'985   1'722'021      7'274'217
            'objective_lb_search':    101      3'062    24'975     6'899      95'081      2'993'996
     'objective_lb_search_max_lp':     87      1'752    16'343     4'373      54'352      2'049'604
      'objective_lb_search_no_lp':    178     10'970    26'762     3'105     249'671      6'223'116
                        'probing':    185         40       330       330       1'735         18'225
                 'probing_max_lp':    145         33       257       257         571          7'909
                   'pseudo_costs':    170      3'211    26'965     6'316     175'157      2'973'118
                  'quick_restart':    260      2'157    41'557    10'544     235'435      3'124'845
            'quick_restart_no_lp':  1'109      9'565    45'834     4'413   1'850'387      5'593'994
                  'reduced_costs':    480      2'927    26'038     4'618   1'075'580      2'957'578

SAT stats                           ClassicMinim  LitRemoved  LitLearned  LitForgotten  Subsumed  MClauses  MDecisions  MLitTrue  MSubsumed  MLitRemoved  MReused
                           'core':         5'851      33'387      32'899             0        37     5'031      25'063         0        191          616      103
                     'default_lp':         2'184       4'772      34'694             0       301     1'721      14'406         0        573        3'587      300
                      'fs_random':             0           0           0             0         0         0           0         0          0            0        0
                      'fs_random':             0           0           0             0         0         0           0         0          0            0        0
                      'fs_random':             0           0           0             0         0         0           0         0          0            0        0
                      'fs_random':             0           0           0             0         0         0           0         0          0            0        0
                'fs_random_no_lp':             0           0           0             0         0         0           0         0          0            0        0
                'fs_random_no_lp':             0           0           0             0         0         0           0         0          0            0        0
                'fs_random_no_lp':             0           0           0             0         0         0           0         0          0            0        0
                'fs_random_no_lp':             0           0           0             0         0         0           0         0          0            0        0
        'fs_random_quick_restart':             0           0           0             0         0         0           0         0          0            0        0
        'fs_random_quick_restart':             0           0           0             0         0         0           0         0          0            0        0
        'fs_random_quick_restart':             0           0           0             0         0         0           0         0          0            0        0
        'fs_random_quick_restart':             0           0           0             0         0         0           0         0          0            0        0
  'fs_random_quick_restart_no_lp':             0           0           0             0         0         0           0         0          0            0        0
  'fs_random_quick_restart_no_lp':             0           0           0             0         0         0           0         0          0            0        0
  'fs_random_quick_restart_no_lp':             0           0           0             0         0         0           0         0          0            0        0
                 'lb_tree_search':             1           1         307             0         3       915       4'610         0         19           76       79
                         'max_lp':         1'056       1'960      21'385             0       217     2'702      24'074         0        240        1'482      805
                          'no_lp':         8'559      24'828     118'881        27'640       331     1'336      11'138         2        460        3'131      175
            'objective_lb_search':         1'907       4'049      21'535             0       268     1'931      16'226         0        232        1'397      521
     'objective_lb_search_max_lp':         1'054       2'298      12'897             0       176     1'189      10'867         0         84          505      573
      'objective_lb_search_no_lp':         8'702      25'909      70'271             0       507     1'463      13'005         0        551        3'459      395
                        'probing':             0           0          40             0         0         0           0         0          0            0        0
                 'probing_max_lp':             0           0          33             0         0         0           0         0          0            0        0
                   'pseudo_costs':         1'625       3'741      31'377             0       239     2'063      17'992         0        195        1'310      376
                  'quick_restart':         1'134       2'832      22'993             0       155     3'086      25'860         4        338        2'020      418
            'quick_restart_no_lp':         6'556      21'934     103'910             0       248     1'533      13'556         1        547        3'479      192
                  'reduced_costs':         1'730       4'468      26'865             0       157     2'149      16'917         0        439        2'854      468

Lp stats                         Component  Iterations  AddedCuts  OPTIMAL  DUAL_F.  DUAL_U.
                  'default_lp':          1      36'329      3'344    4'869        1        0
                   'fs_random':          1           0          0        0        0        0
                   'fs_random':          1           0          0        0        0        0
                   'fs_random':          1           0          0        0        0        0
                   'fs_random':          1           0          0        0        0        0
     'fs_random_quick_restart':          1           0          0        0        0        0
     'fs_random_quick_restart':          1           0          0        0        0        0
     'fs_random_quick_restart':          1           0          0        0        0        0
     'fs_random_quick_restart':          1           0          0        0        0        0
              'lb_tree_search':          1     128'786      3'561    6'306    2'332        0
                      'max_lp':          1      59'465      3'926    3'569      902        0
         'objective_lb_search':          1      54'150      2'509    4'621        0        0
  'objective_lb_search_max_lp':          1      73'131      3'416    2'671      988        1
                     'probing':          1       5'501      2'907    1'105        0        1
              'probing_max_lp':          1       4'072      2'866      632       20        0
                'pseudo_costs':          1      69'423      3'753    4'505    1'424        7
               'quick_restart':          1      52'312      3'418    5'781        0        0
               'reduced_costs':          1      51'575      4'321    3'989      833        4

Lp dimension                                                                     Final dimension of first component
                  'default_lp':  474 rows, 210 columns, 1879 entries with magnitude in [4.145140e-04, 1.000000e+00]
                   'fs_random':       0 rows, 210 columns, 0 entries with magnitude in [0.000000e+00, 0.000000e+00]
                   'fs_random':       0 rows, 210 columns, 0 entries with magnitude in [0.000000e+00, 0.000000e+00]
                   'fs_random':       0 rows, 210 columns, 0 entries with magnitude in [0.000000e+00, 0.000000e+00]
                   'fs_random':       0 rows, 210 columns, 0 entries with magnitude in [0.000000e+00, 0.000000e+00]
     'fs_random_quick_restart':       0 rows, 210 columns, 0 entries with magnitude in [0.000000e+00, 0.000000e+00]
     'fs_random_quick_restart':       0 rows, 210 columns, 0 entries with magnitude in [0.000000e+00, 0.000000e+00]
     'fs_random_quick_restart':       0 rows, 210 columns, 0 entries with magnitude in [0.000000e+00, 0.000000e+00]
     'fs_random_quick_restart':       0 rows, 210 columns, 0 entries with magnitude in [0.000000e+00, 0.000000e+00]
              'lb_tree_search':  899 rows, 214 columns, 3615 entries with magnitude in [1.326488e-03, 1.000000e+00]
                      'max_lp':  555 rows, 214 columns, 2126 entries with magnitude in [1.946481e-03, 1.000000e+00]
         'objective_lb_search':  362 rows, 210 columns, 1564 entries with magnitude in [2.627869e-03, 1.000000e+00]
  'objective_lb_search_max_lp':  772 rows, 214 columns, 3190 entries with magnitude in [4.897640e-03, 1.000000e+00]
                     'probing':  339 rows, 210 columns, 1666 entries with magnitude in [1.010384e-03, 1.000000e+00]
              'probing_max_lp':  495 rows, 214 columns, 4875 entries with magnitude in [6.418770e-04, 1.000000e+00]
                'pseudo_costs':  519 rows, 214 columns, 1937 entries with magnitude in [9.043897e-03, 1.000000e+00]
               'quick_restart':  549 rows, 210 columns, 2448 entries with magnitude in [4.325152e-03, 1.000000e+00]
               'reduced_costs':  393 rows, 214 columns, 1407 entries with magnitude in [4.173311e-03, 1.000000e+00]

Lp debug                         CutPropag  CutEqPropag  Adjust  Overflow      Bad  BadScaling
                  'default_lp':          4            2   3'054         0   41'962           0
                   'fs_random':          0            0       0         0        0           0
                   'fs_random':          0            0       0         0        0           0
                   'fs_random':          0            0       0         0        0           0
                   'fs_random':          0            0       0         0        0           0
     'fs_random_quick_restart':          0            0       0         0        0           0
     'fs_random_quick_restart':          0            0       0         0        0           0
     'fs_random_quick_restart':          0            0       0         0        0           0
     'fs_random_quick_restart':          0            0       0         0        0           0
              'lb_tree_search':         24           20   4'543         0   28'305           0
                      'max_lp':          8            2   1'797         0   36'046           0
         'objective_lb_search':          5            8   2'976         0   53'923           0
  'objective_lb_search_max_lp':         16            3   2'048         0   42'636           0
                     'probing':          0           31   1'015         0  569'607           0
              'probing_max_lp':          6            2     641         0  344'053           0
                'pseudo_costs':         21            1   2'203         0   36'840           0
               'quick_restart':         34            7   3'946         0  119'039           0
               'reduced_costs':         38            9   2'481         0   52'152           0

Lp pool                          Constraints  Updates  Simplif  Merged  Shortened  Split  Strenghtened    Cuts/Call
                  'default_lp':        3'552      333   12'905      21      1'861    869         3'199  3'344/7'596
                   'fs_random':          229        0        0       0          0      0             0          0/0
                   'fs_random':          229        0        0       0          0      0             0          0/0
                   'fs_random':          229        0        0       0          0      0             0          0/0
                   'fs_random':          229        0        0       0          0      0             0          0/0
     'fs_random_quick_restart':          229        0        0       0          0      0             0          0/0
     'fs_random_quick_restart':          229        0        0       0          0      0             0          0/0
     'fs_random_quick_restart':          229        0        0       0          0      0             0          0/0
     'fs_random_quick_restart':          229        0        0       0          0      0             0          0/0
              'lb_tree_search':        5'599      294   23'640      20      3'287    296        18'942  3'561/9'035
                      'max_lp':        5'939      255   19'670      45        699    379        19'137  3'926/8'426
         'objective_lb_search':        2'731      346    6'176       7        610  1'146         2'025  2'509/5'747
  'objective_lb_search_max_lp':        5'469      318   22'859       5      1'975    597        21'890  3'416/7'036
                     'probing':        3'111      308      952      25        287    789         1'039  2'907/5'189
              'probing_max_lp':        4'919      184    4'943       5          0    410         7'023  2'866/5'851
                'pseudo_costs':        5'768      289   19'116      43      1'090    441        19'331  3'753/8'452
               'quick_restart':        3'636      462   17'976      11      1'008  4'271         2'857  3'418/8'439
               'reduced_costs':        6'354      284   27'644      25      1'206    839        20'100  4'321/9'539

Lp Cut            defaul  max_lp  quick_  reduce  pseudo  lb_tre  probin  object  probin  object
          CG_FF:     230     192     154     153     172     161     106     111     131      86
           CG_K:      91     122      69     120     120     108      45      61     107      47
          CG_KL:       -       -       -       -       -       -       -       -       -       1
           CG_R:      99     111     101     161     133     119      64      76     100      55
          CG_RB:     714     701     468     641     583     611     532     479     458     446
         CG_RBP:     101      75      81     104      92      80      69      81      72      50
         Clique:       -      17       -      22      18      23       -       -       9      22
             IB:     466     275     505     372     443     349     363     404     137     364
       MIR_1_FF:     154     233     193     219     179     199     147     137     172     193
        MIR_1_K:      26      26      21      44      30      40       7      13      19      27
       MIR_1_KL:       -       -       -       -       -       1       -       -       -       -
        MIR_1_R:      20      14      24      35      21      14      23      20      17      19
       MIR_1_RB:     261     377     278     442     323     325     236     177     226     329
      MIR_1_RBP:      15      69      15      55      57      39      21      10      45      41
      MIR_1_RLT:       -       3       -       2       2       2       -       -       3       1
       MIR_2_FF:      80     122     109     127     107     102      79      85      64      94
        MIR_2_K:      18      32      15      34      21      33       9      12      13      17
       MIR_2_KL:       -       -       3       1       -       -       -       2       -       1
        MIR_2_R:      20      55      39      59      46      49      32      31      38      53
       MIR_2_RB:     147     218     194     259     185     180     156     138     138     172
      MIR_2_RBP:      18      39      21      29      35      32      18      19      25      33
       MIR_3_FF:      54      70      57      93      85      74      48      37      38      71
        MIR_3_K:      23      35      13      29      17      30      12      11       8      22
       MIR_3_KL:       1       -       2       2       1       2       -       1       -       1
        MIR_3_R:      25      55      29      51      44      45      35      22      34      46
       MIR_3_RB:     107     128     129     157     134      93     110      82      95     133
      MIR_3_RBP:      16      19      17      24      23      15      17      14      15      13
       MIR_4_FF:      30      39      48      40      37      43      31      36      18      28
        MIR_4_K:      23      13      18      13      15      23      15      19       7      22
       MIR_4_KL:       -       -       2       1       -       3       -       -       1       3
        MIR_4_R:      33      26      36      32      32      27      30      19      20      40
       MIR_4_RB:      71      71      83      93      59      54      83      59      42      71
      MIR_4_RBP:       4       6       6      11      12      11       6       4       -      15
       MIR_5_FF:      20      27      26      25      15      28      18      19      15      20
        MIR_5_K:      11      14       9       7       9      10       4       4       4       8
       MIR_5_KL:       -       -       -       3       -       -       -       -       -       -
        MIR_5_R:      16      16      27      25      10      21      17       7      10      21
       MIR_5_RB:      37      46      64      66      29      35      43      33      29      42
      MIR_5_RBP:       7       5       7       8       1       8       4       4       5       7
       MIR_6_FF:       7      11       6      16      14      17       4       4      12       4
        MIR_6_K:       3       5       5       6       3       9       2       6       3       4
       MIR_6_KL:       1       -       2       -       -       -       -       -       -       -
        MIR_6_R:       6       6      10      12       8       8      10       7       5       8
       MIR_6_RB:      19      23      29      25      26      22      28      20       9      19
      MIR_6_RBP:       1       2       3       3       3       6       4       1       2       3
   ZERO_HALF_FF:      46      49      33      49      36      43      37      28      29      44
    ZERO_HALF_K:       9      19       9      10      12      17       7       8       3       4
    ZERO_HALF_R:     207     413     375     504     452     311     307     156     587     551
   ZERO_HALF_RB:      96     135      75     116     100     118     110      44      84     139
  ZERO_HALF_RBP:      11      12       8      21       9      21      18       8      17      26

LNS stats           Improv/Calls  Closed  Difficulty  TimeLimit
  'graph_arc_lns':         14/99     51%        0.96       0.10
  'graph_cst_lns':           0/0      0%        0.50       0.10
  'graph_dec_lns':         11/99     55%        0.99       0.10
  'graph_var_lns':         15/99     51%        0.97       0.10
      'rins/rens':         17/91     48%        0.81       0.10
    'rnd_cst_lns':         12/96     54%        0.98       0.10
    'rnd_var_lns':         14/99     53%        0.98       0.10

LS stats                   Batches  Restarts  LinMoves  GenMoves  CompoundMoves  WeightUpdates
       'fj_long_default':        1         1     9'674         0              0            326
       'fj_long_default':        1         1     9'678         0              0            322
   'fj_long_lin_default':        1         1         0     3'641            386              2
   'fj_long_lin_perturb':        1         1     8'159         0              0          1'841
    'fj_long_lin_random':        1         1     8'416         0              0          1'585
       'fj_long_perturb':        1         1         0     3'742            381              3
        'fj_long_random':        1         1     9'715         0              0            285
      'fj_short_default':        1         1         0     3'666            477              2
      'fj_short_default':        1         1     8'464         0              0          1'536
  'fj_short_lin_default':        1         1         0     3'645            333              2
  'fj_short_lin_default':        1         1         0     3'797            339              2
  'fj_short_lin_perturb':        1         1     9'684         0              0            316
   'fj_short_lin_random':        1         1         0     3'985            517              3
      'fj_short_perturb':        1         1     9'686         0              0            314
       'fj_short_random':        1         1         0     3'708            433              2
          'violation_ls':      100         0    14'908   550'895         16'192          7'227
          'violation_ls':      100         0    16'006   470'878         42'808          6'488
          'violation_ls':      100         0    43'195   433'908         39'717          7'330
          'violation_ls':      100         0     5'689   594'790         13'305          7'420
          'violation_ls':      100         0   799'776     4'546            316         29'193

Solutions (120)           Num      Rank
        'graph_dec_lns':    1   [72,72]
        'graph_var_lns':    2  [71,120]
                'no_lp':    9    [1,29]
  'quick_restart_no_lp':   29  [11,113]
        'rins_pump_lns':    1   [28,28]
          'rnd_cst_lns':    3  [56,114]
          'rnd_var_lns':    2   [83,84]
         'violation_ls':   73   [6,119]

Objective bounds                     Num
                       'bool_core':    1
                  'initial_domain':    1
             'objective_lb_search':    2
       'objective_lb_search_no_lp':   58
  'objective_shaving_search_no_lp':    3

Solution repositories    Added  Queried  Ignored  Synchro
  'feasible solutions':    636    1'972       10      593
        'lp solutions':    126       33        0      114
                'pump':  2'082       65

Improving bounds shared          Num
                        'core':   52
                  'default_lp':    7
              'lb_tree_search':   36
                      'max_lp':   11
                       'no_lp':  316
         'objective_lb_search':    4
  'objective_lb_search_max_lp':   14
                     'probing':   12
              'probing_max_lp':    2
                'pseudo_costs':   50
               'quick_restart':   56
         'quick_restart_no_lp':  831
               'reduced_costs':   72

Clauses shared                   Num
                  'default_lp':    3
              'lb_tree_search':   22
                      'max_lp':    4
                       'no_lp':   31
         'objective_lb_search':    4
  'objective_lb_search_max_lp':    2
   'objective_lb_search_no_lp':    3
                'pseudo_costs':    4
               'quick_restart':    7
         'quick_restart_no_lp':    5
               'reduced_costs':    2

CpSolverResponse summary:
status: OPTIMAL
objective: 712
best_bound: 712
integers: 211
booleans: 63
conflicts: 0
branches: 80
propagations: 18
integer_propagations: 1419
restarts: 80
lp_iterations: 0
walltime: 18.3246
usertime: 18.3246
deterministic_time: 95.7394
gap_integral: 332.745
solution_fingerprint: 0x710c904c70e97a9d


--- Simulation Gantt  partir du modle mathmatique ---
{'big':1, 'due_date':104, 'pos_time':5, 'status':0, 'blocked':0, 'operations':["{'type':0, 'processing_time':38}"]}
{'big':1, 'due_date':120, 'pos_time':5, 'status':0, 'blocked':0, 'operations':["{'type':0, 'processing_time':45}"]}
{'big':0, 'due_date':53, 'pos_time':5, 'status':0, 'blocked':0, 'operations':["{'type':0, 'processing_time':36}"]}
{'big':0, 'due_date':73, 'pos_time':5, 'status':0, 'blocked':0, 'operations':["{'type':1, 'processing_time':43}"]}
{'big':0, 'due_date':158, 'pos_time':5, 'status':0, 'blocked':0, 'operations':["{'type':0, 'processing_time':53}", "{'type':1, 'processing_time':55}"]}
{'big':0, 'due_date':184, 'pos_time':5, 'status':0, 'blocked':0, 'operations':["{'type':1, 'processing_time':11}", "{'type':0, 'processing_time':10}"]}
{'big':1, 'due_date':108, 'pos_time':5, 'status':0, 'blocked':0, 'operations':["{'type':1, 'processing_time':49}"]}
{'big':1, 'due_date':51, 'pos_time':5, 'status':0, 'blocked':0, 'operations':["{'type':1, 'processing_time':21}"]}
