created virtual environment CPython3.12.4.final.0-64 in 6660ms
  creator CPython3Posix(dest=/localscratch/aneumann.63390925.0/env, clear=False, no_vcs_ignore=False, global=False)
  seeder FromAppData(download=False, pip=bundle, via=copy, app_data_dir=/home/aneumann/.local/share/virtualenv)
    added seed packages: pip==25.1.1
  activators BashActivator,CShellActivator,FishActivator,NushellActivator,PowerShellActivator,PythonActivator
Looking in links: /cvmfs/soft.computecanada.ca/custom/python/wheelhouse/gentoo2023/x86-64-v3, /cvmfs/soft.computecanada.ca/custom/python/wheelhouse/gentoo2023/generic, /cvmfs/soft.computecanada.ca/custom/python/wheelhouse/generic
Requirement already satisfied: pip in /localscratch/aneumann.63390925.0/env/lib/python3.12/site-packages (25.1.1)
Looking in links: /cvmfs/soft.computecanada.ca/custom/python/wheelhouse/gentoo2023/x86-64-v3, /cvmfs/soft.computecanada.ca/custom/python/wheelhouse/gentoo2023/generic, /cvmfs/soft.computecanada.ca/custom/python/wheelhouse/generic
ERROR: protobuf-5.28.3-cp38-abi3-manylinux2014_x86_64.whl is not a supported wheel on this platform.
Looking in links: /cvmfs/soft.computecanada.ca/custom/python/wheelhouse/gentoo2023/x86-64-v3, /cvmfs/soft.computecanada.ca/custom/python/wheelhouse/gentoo2023/generic, /cvmfs/soft.computecanada.ca/custom/python/wheelhouse/generic
Processing /home/aneumann/projects/def-adhaj/aneumann/GNRS/wheels/immutabledict-4.2.0-py3-none-any.whl
Installing collected packages: immutabledict
Successfully installed immutabledict-4.2.0
Looking in links: /cvmfs/soft.computecanada.ca/custom/python/wheelhouse/gentoo2023/x86-64-v3, /cvmfs/soft.computecanada.ca/custom/python/wheelhouse/gentoo2023/generic, /cvmfs/soft.computecanada.ca/custom/python/wheelhouse/generic
Processing /cvmfs/soft.computecanada.ca/custom/python/wheelhouse/generic/ortools-9.10.4067+computecanada-cp312-cp312-linux_x86_64.whl (from -r /home/aneumann/projects/def-adhaj/aneumann/GNRS/requirements/or.txt (line 1))
Processing /cvmfs/soft.computecanada.ca/custom/python/wheelhouse/gentoo2023/x86-64-v3/matplotlib-3.10.0+computecanada-cp312-cp312-linux_x86_64.whl (from -r /home/aneumann/projects/def-adhaj/aneumann/GNRS/requirements/or.txt (line 2))
Processing /cvmfs/soft.computecanada.ca/custom/python/wheelhouse/gentoo2023/x86-64-v3/pandas-2.2.3+computecanada-cp312-cp312-linux_x86_64.whl (from -r /home/aneumann/projects/def-adhaj/aneumann/GNRS/requirements/or.txt (line 3))
Processing /cvmfs/soft.computecanada.ca/custom/python/wheelhouse/generic/absl_py-2.2.2+computecanada-py3-none-any.whl (from ortools<9.11,>=9.10->-r /home/aneumann/projects/def-adhaj/aneumann/GNRS/requirements/or.txt (line 1))
Processing /cvmfs/soft.computecanada.ca/custom/python/wheelhouse/gentoo2023/generic/numpy-2.2.2+computecanada-cp312-cp312-linux_x86_64.whl (from ortools<9.11,>=9.10->-r /home/aneumann/projects/def-adhaj/aneumann/GNRS/requirements/or.txt (line 1))
Processing /cvmfs/soft.computecanada.ca/custom/python/wheelhouse/gentoo2023/x86-64-v3/protobuf-6.30.2+computecanada-cp312-cp312-linux_x86_64.whl (from ortools<9.11,>=9.10->-r /home/aneumann/projects/def-adhaj/aneumann/GNRS/requirements/or.txt (line 1))
Requirement already satisfied: immutabledict>=3.0.0 in /localscratch/aneumann.63390925.0/env/lib/python3.12/site-packages (from ortools<9.11,>=9.10->-r /home/aneumann/projects/def-adhaj/aneumann/GNRS/requirements/or.txt (line 1)) (4.2.0)
Processing /cvmfs/soft.computecanada.ca/custom/python/wheelhouse/gentoo2023/generic/contourpy-1.3.1+computecanada-cp312-cp312-linux_x86_64.whl (from matplotlib->-r /home/aneumann/projects/def-adhaj/aneumann/GNRS/requirements/or.txt (line 2))
Processing /cvmfs/soft.computecanada.ca/custom/python/wheelhouse/generic/cycler-0.12.1+computecanada-py3-none-any.whl (from matplotlib->-r /home/aneumann/projects/def-adhaj/aneumann/GNRS/requirements/or.txt (line 2))
Processing /cvmfs/soft.computecanada.ca/custom/python/wheelhouse/generic/fonttools-4.58.2+computecanada-cp312-cp312-linux_x86_64.whl (from matplotlib->-r /home/aneumann/projects/def-adhaj/aneumann/GNRS/requirements/or.txt (line 2))
Processing /cvmfs/soft.computecanada.ca/custom/python/wheelhouse/gentoo2023/x86-64-v3/kiwisolver-1.4.8+computecanada-cp312-cp312-linux_x86_64.whl (from matplotlib->-r /home/aneumann/projects/def-adhaj/aneumann/GNRS/requirements/or.txt (line 2))
Processing /cvmfs/soft.computecanada.ca/custom/python/wheelhouse/generic/packaging-25.0+computecanada-py3-none-any.whl (from matplotlib->-r /home/aneumann/projects/def-adhaj/aneumann/GNRS/requirements/or.txt (line 2))
Processing /cvmfs/soft.computecanada.ca/custom/python/wheelhouse/gentoo2023/x86-64-v3/pillow-11.1.0+computecanada-cp312-cp312-linux_x86_64.whl (from matplotlib->-r /home/aneumann/projects/def-adhaj/aneumann/GNRS/requirements/or.txt (line 2))
Processing /cvmfs/soft.computecanada.ca/custom/python/wheelhouse/generic/pyparsing-3.2.1+computecanada-py3-none-any.whl (from matplotlib->-r /home/aneumann/projects/def-adhaj/aneumann/GNRS/requirements/or.txt (line 2))
Processing /cvmfs/soft.computecanada.ca/custom/python/wheelhouse/generic/python_dateutil-2.9.0.post0+computecanada-py2.py3-none-any.whl (from matplotlib->-r /home/aneumann/projects/def-adhaj/aneumann/GNRS/requirements/or.txt (line 2))
Processing /cvmfs/soft.computecanada.ca/custom/python/wheelhouse/generic/pytz-2025.2+computecanada-py2.py3-none-any.whl (from pandas->-r /home/aneumann/projects/def-adhaj/aneumann/GNRS/requirements/or.txt (line 3))
Processing /cvmfs/soft.computecanada.ca/custom/python/wheelhouse/generic/tzdata-2025.2+computecanada-py2.py3-none-any.whl (from pandas->-r /home/aneumann/projects/def-adhaj/aneumann/GNRS/requirements/or.txt (line 3))
Processing /cvmfs/soft.computecanada.ca/custom/python/wheelhouse/generic/six-1.17.0+computecanada-py2.py3-none-any.whl (from python-dateutil>=2.7->matplotlib->-r /home/aneumann/projects/def-adhaj/aneumann/GNRS/requirements/or.txt (line 2))
Installing collected packages: pytz, tzdata, six, pyparsing, protobuf, pillow, packaging, numpy, kiwisolver, fonttools, cycler, absl-py, python-dateutil, contourpy, pandas, matplotlib, ortools

Successfully installed absl-py-2.2.2+computecanada contourpy-1.3.1+computecanada cycler-0.12.1+computecanada fonttools-4.58.2+computecanada kiwisolver-1.4.8+computecanada matplotlib-3.10.0+computecanada numpy-2.2.2+computecanada ortools-9.10.4067+computecanada packaging-25.0+computecanada pandas-2.2.3+computecanada pillow-11.1.0+computecanada protobuf-6.30.2+computecanada pyparsing-3.2.1+computecanada python-dateutil-2.9.0.post0+computecanada pytz-2025.2+computecanada six-1.17.0+computecanada tzdata-2025.2+computecanada

Starting CP-SAT solver v9.10.4067
Parameters: max_time_in_seconds: 3600 max_memory_in_mb: 12000 log_search_progress: true enumerate_all_solutions: false absolute_gap_limit: 0 relative_gap_limit: 0
Setting number of workers to 48

Initial optimization model '': (model_fingerprint: 0x6f17fce2b9736ec4)
#Variables: 177 (#ints: 5 in objective)
  - 120 Booleans in [0,1]
  - 57 in [0,372]
#kLinear1: 20
#kLinear2: 225
#kLinear3: 70
#kLinearN: 685 (#terms: 6'352)

Starting presolve at 0.00s
  2.93e-04s  0.00e+00d  [DetectDominanceRelations] 
  9.82e-03s  0.00e+00d  [PresolveToFixPoint] #num_loops=6 #num_dual_strengthening=3 
  1.60e-05s  0.00e+00d  [ExtractEncodingFromLinear] #potential_supersets=4 
[Symmetry] Graph for symmetry has 1'056 nodes and 4'549 arcs.
[Symmetry] Symmetry computation done. time: 0.000552677 dtime: 0.00045743
[SAT presolve] num removable Booleans: 0 / 51
[SAT presolve] num trivial clauses: 0
[SAT presolve] [0s] clauses:9 literals:27 vars:16 one_side_vars:13 simple_definition:3 singleton_clauses:0
[SAT presolve] [3.8994e-05s] clauses:9 literals:27 vars:16 one_side_vars:13 simple_definition:3 singleton_clauses:0
[SAT presolve] [5.2096e-05s] clauses:9 literals:27 vars:16 one_side_vars:13 simple_definition:3 singleton_clauses:0
  2.91e-03s  3.41e-04d  [Probe] #probed=218 #fixed_bools=4 #new_bounds=6 #new_binary_clauses=47 
  2.27e-05s  0.00e+00d  [MaxClique] 
  2.84e-04s  0.00e+00d  [DetectDominanceRelations] 
  4.01e-03s  0.00e+00d  [PresolveToFixPoint] #num_loops=4 #num_dual_strengthening=3 
  9.51e-04s  0.00e+00d  [ProcessAtMostOneAndLinear] 
  7.41e-04s  0.00e+00d  [DetectDuplicateConstraints] #duplicates=170 #without_enforcements=57 
  2.49e-04s  9.41e-06d  [DetectDominatedLinearConstraints] #relevant_constraints=400 #num_inclusions=164 #num_redundant=3 
  1.38e-04s  0.00e+00d  [DetectDifferentVariables] #different=24 #cliques=1 #size=3 
  9.78e-05s  3.11e-06d  [ProcessSetPPC] #relevant_constraints=232 
  9.30e-06s  0.00e+00d  [FindAlmostIdenticalLinearConstraints] 
  7.13e-05s  4.55e-05d  [FindBigAtMostOneAndLinearOverlap] 
  6.32e-04s  2.14e-04d  [FindBigVerticalLinearOverlap] #blocks=4 #saved_nz=173 
  4.91e-05s  9.19e-06d  [FindBigHorizontalLinearOverlap] #linears=220 
  2.07e-05s  1.35e-07d  [MergeClauses] 
  2.69e-04s  0.00e+00d  [DetectDominanceRelations] 
  3.30e-03s  0.00e+00d  [PresolveToFixPoint] #num_loops=2 #num_dual_strengthening=1 
  2.65e-04s  0.00e+00d  [DetectDominanceRelations] 
  2.33e-03s  0.00e+00d  [PresolveToFixPoint] #num_loops=1 #num_dual_strengthening=1 
[SAT presolve] num removable Booleans: 0 / 47
[SAT presolve] num trivial clauses: 0
[SAT presolve] [0s] clauses:9 literals:27 vars:16 one_side_vars:13 simple_definition:3 singleton_clauses:0
[SAT presolve] [3.2082e-05s] clauses:9 literals:27 vars:16 one_side_vars:13 simple_definition:3 singleton_clauses:0
[SAT presolve] [4.4509e-05s] clauses:9 literals:27 vars:16 one_side_vars:13 simple_definition:3 singleton_clauses:0
  2.59e-03s  3.26e-04d  [Probe] #probed=210 #new_bounds=12 #new_binary_clauses=47 
  6.40e-06s  0.00e+00d  [MaxClique] 
  2.73e-04s  0.00e+00d  [DetectDominanceRelations] 
  4.06e-03s  0.00e+00d  [PresolveToFixPoint] #num_loops=2 #num_dual_strengthening=1 
  7.85e-04s  0.00e+00d  [ProcessAtMostOneAndLinear] 
  5.71e-04s  0.00e+00d  [DetectDuplicateConstraints] #without_enforcements=57 
  1.78e-04s  6.99e-06d  [DetectDominatedLinearConstraints] #relevant_constraints=320 #num_inclusions=29 
  5.81e-05s  0.00e+00d  [DetectDifferentVariables] 
  9.22e-05s  2.91e-06d  [ProcessSetPPC] #relevant_constraints=232 
  1.15e-05s  0.00e+00d  [FindAlmostIdenticalLinearConstraints] 
  7.05e-05s  4.27e-05d  [FindBigAtMostOneAndLinearOverlap] 
  5.64e-04s  1.97e-04d  [FindBigVerticalLinearOverlap] #blocks=3 #saved_nz=118 
  4.60e-05s  8.72e-06d  [FindBigHorizontalLinearOverlap] #linears=220 
  2.00e-05s  1.35e-07d  [MergeClauses] 
  2.58e-04s  0.00e+00d  [DetectDominanceRelations] 
  3.25e-03s  0.00e+00d  [PresolveToFixPoint] #num_loops=2 #num_dual_strengthening=1 
  2.55e-04s  0.00e+00d  [DetectDominanceRelations] 
  2.48e-03s  0.00e+00d  [PresolveToFixPoint] #num_loops=1 #num_dual_strengthening=1 
[SAT presolve] num removable Booleans: 0 / 47
[SAT presolve] num trivial clauses: 0
[SAT presolve] [0s] clauses:9 literals:27 vars:16 one_side_vars:13 simple_definition:3 singleton_clauses:0
[SAT presolve] [3.2712e-05s] clauses:9 literals:27 vars:16 one_side_vars:13 simple_definition:3 singleton_clauses:0
[SAT presolve] [4.4736e-05s] clauses:9 literals:27 vars:16 one_side_vars:13 simple_definition:3 singleton_clauses:0
  2.54e-03s  3.23e-04d  [Probe] #probed=210 #new_bounds=1 #new_binary_clauses=47 
  6.46e-06s  0.00e+00d  [MaxClique] 
  2.58e-04s  0.00e+00d  [DetectDominanceRelations] 
  2.87e-03s  0.00e+00d  [PresolveToFixPoint] #num_loops=2 #num_dual_strengthening=1 
  7.46e-04s  0.00e+00d  [ProcessAtMostOneAndLinear] 
  5.63e-04s  0.00e+00d  [DetectDuplicateConstraints] #without_enforcements=57 
  1.51e-04s  6.07e-06d  [DetectDominatedLinearConstraints] #relevant_constraints=290 #num_inclusions=3 
  5.74e-05s  0.00e+00d  [DetectDifferentVariables] 
  8.73e-05s  2.72e-06d  [ProcessSetPPC] #relevant_constraints=232 
  1.66e-05s  0.00e+00d  [FindAlmostIdenticalLinearConstraints] 
  6.36e-05s  4.09e-05d  [FindBigAtMostOneAndLinearOverlap] 
  4.37e-04s  1.84e-04d  [FindBigVerticalLinearOverlap] 
  4.47e-05s  8.72e-06d  [FindBigHorizontalLinearOverlap] #linears=220 
  1.94e-05s  1.35e-07d  [MergeClauses] 
  2.61e-04s  0.00e+00d  [DetectDominanceRelations] 
  2.49e-03s  0.00e+00d  [PresolveToFixPoint] #num_loops=1 #num_dual_strengthening=1 
  2.62e-05s  0.00e+00d  [ExpandObjective] #entries=44 #tight_variables=22 #tight_constraints=11 

Presolve summary:
  - 33 affine relations were detected.
  - rule 'TODO dual: only one blocking constraint?' was applied 423 times.
  - rule 'TODO dual: only one unspecified blocking constraint?' was applied 65 times.
  - rule 'TODO duplicate: identical constraint with different enforcements' was applied 171 times.
  - rule 'TODO linear2: contains a Boolean.' was applied 18 times.
  - rule 'TODO no_overlap: with task always last' was applied 1 time.
  - rule 'affine: new relation' was applied 33 times.
  - rule 'all_diff: inferred from x != y constraints' was applied 1 time.
  - rule 'at_most_one: removed literals' was applied 2 times.
  - rule 'at_most_one: size one' was applied 2 times.
  - rule 'deductions: 119 stored' was applied 1 time.
  - rule 'dual: fix variable' was applied 9 times.
  - rule 'dual: reduced domain' was applied 31 times.
  - rule 'duplicate: merged rhs of linear constraint' was applied 30 times.
  - rule 'duplicate: removed constraint' was applied 170 times.
  - rule 'enforcement: false literal' was applied 14 times.
  - rule 'enforcement: true literal' was applied 16 times.
  - rule 'incompatible linear: add implication' was applied 27 times.
  - rule 'linear inclusion: redundant containing constraint' was applied 2 times.
  - rule 'linear inclusion: redundant included constraint' was applied 1 time.
  - rule 'linear matrix: common vertical rectangle' was applied 7 times.
  - rule 'linear2: contains a Boolean.' was applied 13 times.
  - rule 'linear: always true' was applied 219 times.
  - rule 'linear: doubleton free' was applied 7 times.
  - rule 'linear: empty' was applied 16 times.
  - rule 'linear: extracted enforcement literal' was applied 1'282 times.
  - rule 'linear: fixed or dup variables' was applied 637 times.
  - rule 'linear: negative clause' was applied 9 times.
  - rule 'linear: positive equal one' was applied 4 times.
  - rule 'linear: reduced variable domains' was applied 70 times.
  - rule 'linear: remapped using affine relations' was applied 618 times.
  - rule 'linear: simplified rhs' was applied 2'192 times.
  - rule 'linear: variable substitution 1' was applied 7 times.
  - rule 'presolve: 49 unused variables removed.' was applied 1 time.
  - rule 'presolve: iteration' was applied 3 times.
  - rule 'probing: reduced enforced constraint to implication.' was applied 2 times.
  - rule 'probing: simplified enforcement list.' was applied 1 time.

Presolved optimization model '': (model_fingerprint: 0xf98905c21c1db141)
#Variables: 95 (#ints: 5 in objective)
  - 47 Booleans in [0,1]
  - 1 in [-2,309]
  - 1 in [-2,328]
  - 1 in [0,236]
  - 1 in [0,255]
  - 1 in [0,275]
  - 4 in [0,281]
  - 1 in [0,288]
  - 3 in [0,294]
  - 3 in [0,308]
  - 3 in [0,327]
  - 1 in [3,297]
  - 1 in [3,297][375,663]
  - 1 in [3,311]
  - 1 in [3,330]
  - 1 in [25,352]
  - 1 in [25,352][397,724]
  - 1 in [32,313]
  - 1 in [35,313][404,685]
  - 1 in [39,347]
  - 1 in [39,347][411,719]
  - 1 in [50,344]
  - 1 in [55,349]
  - 3 in [73,361]
  - 1 in [79,367]
  - 3 in [86,361]
  - 1 in [92,367]
  - 6 in [106,361]
  - 2 in [112,367]
  - 1 in [117,372]
#kAllDiff: 1
#kBoolOr: 9 (#literals: 27)
#kExactlyOne: 4 (#literals: 12)
#kLinear1: 20 (#enforced: 20 #multi: 9)
#kLinear2: 256 (#enforced: 220 #multi: 176)
#kLinear3: 31 (#enforced: 20)
#kLinearN: 223 (#enforced: 144) (#terms: 1'757)

Preloading model.
#Bound   0.06s best:inf   next:[117,1426] initial_domain
#Model   0.06s var:95/95 constraints:544/544

Starting search at 0.06s with 48 workers.
16 full problem subsolvers: [core, default_lp, lb_tree_search, max_lp, no_lp, objective_lb_search, objective_lb_search_max_lp, objective_lb_search_no_lp, objective_shaving_search_max_lp, objective_shaving_search_no_lp, probing, probing_max_lp, pseudo_costs, quick_restart, quick_restart_no_lp, reduced_costs]
30 first solution subsolvers: [fj_long_default(2), fj_long_lin_default, fj_long_lin_perturb, fj_long_lin_random, fj_long_perturb, fj_long_random, fj_short_default(2), fj_short_lin_default(2), fj_short_lin_perturb, fj_short_lin_random, fj_short_perturb, fj_short_random, fs_random(4), fs_random_no_lp(4), fs_random_quick_restart(4), fs_random_quick_restart_no_lp(3)]
13 incomplete subsolvers: [feasibility_pump, graph_arc_lns, graph_cst_lns, graph_dec_lns, graph_var_lns, rins/rens, rnd_cst_lns, rnd_var_lns, violation_ls(5)]
3 helper subsolvers: [neighborhood_helper, synchronization_agent, update_gap_integral]
#Bound   0.06s best:inf   next:[118,1426] bool_core (num_cores=1 [size:1 mw:1] a=5 d=0 fixed=0/70 clauses=25)
#1       0.07s best:782   next:[118,781]  no_lp (fixed_bools=0/86)
#2       0.07s best:767   next:[118,766]  quick_restart_no_lp (fixed_bools=0/86)
#Bound   0.07s best:767   next:[143,766]  objective_lb_search_no_lp
#3       0.07s best:766   next:[143,765]  violation_ls(batch:1 #solutions_imported:1 #lin_moves:7 #lin_evals:40 #weight_updates:6)
#4       0.07s best:716   next:[143,715]  quick_restart_no_lp (fixed_bools=0/96)
#5       0.07s best:715   next:[143,714]  violation_ls(batch:1 #solutions_imported:1 #lin_moves:0 #lin_evals:5 #gen_moves:3 #gen_evals:0 #comp_moves:3 #backtracks:0 #weight_updates:0)
#6       0.07s best:714   next:[143,713]  violation_ls(batch:1 #solutions_imported:1 #lin_moves:0 #lin_evals:30 #gen_moves:29 #gen_evals:4 #comp_moves:3 #backtracks:13 #weight_updates:0)
#7       0.07s best:710   next:[143,709]  quick_restart_no_lp (fixed_bools=0/100)
#Bound   0.07s best:710   next:[146,709]  objective_lb_search_no_lp
#Bound   0.07s best:710   next:[149,709]  objective_lb_search_no_lp
#8       0.07s best:709   next:[149,708]  violation_ls(batch:2 #solutions_imported:2 #lin_moves:0 #lin_evals:8 #gen_moves:4 #gen_evals:0 #comp_moves:4 #backtracks:0 #weight_updates:0)
#Bound   0.07s best:709   next:[151,708]  objective_lb_search_no_lp
#Bound   0.07s best:709   next:[153,708]  objective_lb_search_no_lp
#Bound   0.07s best:709   next:[155,708]  objective_lb_search_no_lp
#9       0.07s best:708   next:[155,707]  violation_ls(batch:2 #solutions_imported:2 #lin_moves:10 #lin_evals:54 #weight_updates:8)
#Bound   0.07s best:708   next:[157,707]  objective_lb_search_no_lp
#10      0.07s best:707   next:[157,706]  violation_ls(batch:2 #solutions_imported:2 #lin_moves:1 #lin_evals:414 #gen_moves:219 #gen_evals:25 #comp_moves:7 #backtracks:106 #weight_updates:1)
#Bound   0.07s best:707   next:[161,706]  objective_lb_search_no_lp
#11      0.07s best:706   next:[161,705]  violation_ls(batch:2 #solutions_imported:2 #lin_moves:20 #lin_evals:109 #gen_moves:29 #gen_evals:4 #comp_moves:3 #backtracks:13 #weight_updates:12)
#Bound   0.07s best:706   next:[199,705]  objective_lb_search_no_lp
#12      0.07s best:676   next:[199,675]  quick_restart_no_lp (fixed_bools=0/118)
#13      0.07s best:675   next:[199,674]  violation_ls(batch:3 #solutions_imported:3 #lin_moves:0 #lin_evals:24 #gen_moves:22 #gen_evals:3 #comp_moves:6 #backtracks:8 #weight_updates:0)
#Bound   0.07s best:675   next:[203,674]  objective_lb_search_no_lp
#14      0.07s best:662   next:[203,661]  no_lp (fixed_bools=0/100)
#15      0.08s best:661   next:[203,660]  violation_ls(batch:3 #solutions_imported:3 #lin_moves:8 #lin_evals:452 #gen_moves:219 #gen_evals:25 #comp_moves:7 #backtracks:106 #weight_updates:8)
#Bound   0.08s best:661   next:[204,660]  objective_lb_search_no_lp
#16      0.08s best:652   next:[204,651]  no_lp (fixed_bools=0/107)
#17      0.08s best:632   next:[204,631]  no_lp (fixed_bools=0/114)
#18      0.08s best:626   next:[204,625]  no_lp (fixed_bools=0/119)
#19      0.08s best:574   next:[204,573]  no_lp (fixed_bools=0/120)
#20      0.08s best:531   next:[204,530]  graph_arc_lns (d=0.71 s=55 t=0.10 p=1.00 stall=0 h=auto_l0)
#21      0.08s best:529   next:[204,528]  quick_restart_no_lp (fixed_bools=0/212)
#22      0.08s best:528   next:[204,527]  quick_restart_no_lp (fixed_bools=0/216)
#23      0.08s best:524   next:[204,523]  quick_restart_no_lp (fixed_bools=0/233)
#24      0.09s best:523   next:[204,522]  quick_restart_no_lp (fixed_bools=0/236)
#25      0.09s best:491   next:[204,490]  quick_restart_no_lp (fixed_bools=0/255)
#26      0.09s best:490   next:[204,489]  violation_ls(batch:4 #solutions_imported:4 #lin_moves:0 #lin_evals:27 #gen_moves:24 #gen_evals:3 #comp_moves:8 #backtracks:8 #weight_updates:0)
#27      0.09s best:488   next:[204,487]  violation_ls(batch:4 #solutions_imported:4 #lin_moves:11 #lin_evals:1'291 #gen_moves:744 #gen_evals:127 #comp_moves:12 #backtracks:366 #weight_updates:13)
#28      0.09s best:486   next:[204,485]  violation_ls(batch:4 #solutions_imported:4 #lin_moves:21 #lin_evals:310 #gen_moves:155 #gen_evals:23 #comp_moves:15 #backtracks:70 #weight_updates:12)
#29      0.09s best:485   next:[204,484]  violation_ls(batch:5 #solutions_imported:5 #lin_moves:0 #lin_evals:29 #gen_moves:25 #gen_evals:3 #comp_moves:9 #backtracks:8 #weight_updates:0)
#Bound   0.09s best:485   next:[205,484]  objective_lb_search_no_lp
#30      0.09s best:423   next:[205,422]  rnd_var_lns (d=0.88 s=82 t=0.10 p=1.00 stall=1 h=auto_l0) [presolve]
#31      0.10s best:422   next:[205,421]  violation_ls(batch:5 #solutions_imported:5 #lin_moves:24 #lin_evals:1'355 #gen_moves:744 #gen_evals:127 #comp_moves:12 #backtracks:366 #weight_updates:25)
#32      0.10s best:421   next:[205,420]  violation_ls(batch:5 #solutions_imported:5 #lin_moves:28 #lin_evals:341 #gen_moves:155 #gen_evals:23 #comp_moves:15 #backtracks:70 #weight_updates:17)
#Bound   0.11s best:421   next:[214,420]  objective_lb_search
#33      0.11s best:419   next:[214,418]  quick_restart_no_lp (fixed_bools=5/271)
#34      0.11s best:418   next:[214,417]  quick_restart_no_lp (fixed_bools=5/273)
#35      0.11s best:416   next:[214,415]  quick_restart_no_lp (fixed_bools=5/277)
#36      0.11s best:414   next:[214,413]  quick_restart_no_lp (fixed_bools=5/280)
#37      0.12s best:411   next:[214,410]  quick_restart_no_lp (fixed_bools=5/281)
#Bound   0.13s best:411   next:[215,410]  objective_lb_search_no_lp
#Bound   0.13s best:411   next:[217,410]  objective_lb_search_no_lp
#38      0.13s best:409   next:[217,408]  graph_arc_lns (d=0.88 s=101 t=0.10 p=1.00 stall=0 h=auto_l0)
#Bound   0.13s best:409   next:[272,408]  objective_lb_search_no_lp
#39      0.14s best:399   next:[272,398]  quick_restart_no_lp (fixed_bools=5/298)
#Bound   0.14s best:399   next:[276,398]  objective_lb_search_no_lp
#Bound   0.15s best:399   next:[279,398]  objective_lb_search_no_lp
#40      0.15s best:389   next:[279,388]  quick_restart_no_lp (fixed_bools=6/300)
#Bound   0.16s best:389   next:[283,388]  objective_lb_search_no_lp
#Model   0.34s var:94/95 constraints:500/544
#Model   0.41s var:92/95 constraints:490/544
#Model   0.49s var:90/95 constraints:464/544
#Done    0.56s no_lp
#Done    0.56s default_lp
#Model   0.56s var:83/95 constraints:363/544
#Done    0.56s core
#Done    0.56s objective_lb_search_max_lp
#Bound   0.56s best:389   next:[372,388]  objective_lb_search_no_lp [skipped_logs=26]

Task timing                                  n [     min,      max]      avg      dev     time         n [     min,      max]      avg      dev    dtime
                             'core':         1 [502.94ms, 502.94ms] 502.94ms   0.00ns 502.94ms         1 [ 78.48ms,  78.48ms]  78.48ms   0.00ns  78.48ms
                       'default_lp':         1 [501.96ms, 501.96ms] 501.96ms   0.00ns 501.96ms         1 [ 56.82ms,  56.82ms]  56.82ms   0.00ns  56.82ms
                 'feasibility_pump':        19 [  4.35ms,  32.98ms]  16.01ms   4.79ms 304.25ms        18 [  2.24ms,   3.18ms]   2.31ms 211.86us  41.61ms
                  'fj_long_default':         0 [  0.00ns,   0.00ns]   0.00ns   0.00ns   0.00ns         0 [  0.00ns,   0.00ns]   0.00ns   0.00ns   0.00ns
                  'fj_long_default':         0 [  0.00ns,   0.00ns]   0.00ns   0.00ns   0.00ns         0 [  0.00ns,   0.00ns]   0.00ns   0.00ns   0.00ns
              'fj_long_lin_default':         0 [  0.00ns,   0.00ns]   0.00ns   0.00ns   0.00ns         0 [  0.00ns,   0.00ns]   0.00ns   0.00ns   0.00ns
              'fj_long_lin_perturb':         0 [  0.00ns,   0.00ns]   0.00ns   0.00ns   0.00ns         0 [  0.00ns,   0.00ns]   0.00ns   0.00ns   0.00ns
               'fj_long_lin_random':         0 [  0.00ns,   0.00ns]   0.00ns   0.00ns   0.00ns         0 [  0.00ns,   0.00ns]   0.00ns   0.00ns   0.00ns
                  'fj_long_perturb':         0 [  0.00ns,   0.00ns]   0.00ns   0.00ns   0.00ns         0 [  0.00ns,   0.00ns]   0.00ns   0.00ns   0.00ns
                   'fj_long_random':         0 [  0.00ns,   0.00ns]   0.00ns   0.00ns   0.00ns         0 [  0.00ns,   0.00ns]   0.00ns   0.00ns   0.00ns
                 'fj_short_default':         0 [  0.00ns,   0.00ns]   0.00ns   0.00ns   0.00ns         0 [  0.00ns,   0.00ns]   0.00ns   0.00ns   0.00ns
                 'fj_short_default':         1 [ 32.35ms,  32.35ms]  32.35ms   0.00ns  32.35ms         1 [ 19.78ms,  19.78ms]  19.78ms   0.00ns  19.78ms
             'fj_short_lin_default':         0 [  0.00ns,   0.00ns]   0.00ns   0.00ns   0.00ns         0 [  0.00ns,   0.00ns]   0.00ns   0.00ns   0.00ns
             'fj_short_lin_default':         0 [  0.00ns,   0.00ns]   0.00ns   0.00ns   0.00ns         0 [  0.00ns,   0.00ns]   0.00ns   0.00ns   0.00ns
             'fj_short_lin_perturb':         0 [  0.00ns,   0.00ns]   0.00ns   0.00ns   0.00ns         0 [  0.00ns,   0.00ns]   0.00ns   0.00ns   0.00ns
              'fj_short_lin_random':         0 [  0.00ns,   0.00ns]   0.00ns   0.00ns   0.00ns         0 [  0.00ns,   0.00ns]   0.00ns   0.00ns   0.00ns
                 'fj_short_perturb':         0 [  0.00ns,   0.00ns]   0.00ns   0.00ns   0.00ns         0 [  0.00ns,   0.00ns]   0.00ns   0.00ns   0.00ns
                  'fj_short_random':         0 [  0.00ns,   0.00ns]   0.00ns   0.00ns   0.00ns         0 [  0.00ns,   0.00ns]   0.00ns   0.00ns   0.00ns
                        'fs_random':         1 [  4.89ms,   4.89ms]   4.89ms   0.00ns   4.89ms         0 [  0.00ns,   0.00ns]   0.00ns   0.00ns   0.00ns
                        'fs_random':         1 [  5.33ms,   5.33ms]   5.33ms   0.00ns   5.33ms         0 [  0.00ns,   0.00ns]   0.00ns   0.00ns   0.00ns
                        'fs_random':         1 [  5.66ms,   5.66ms]   5.66ms   0.00ns   5.66ms         0 [  0.00ns,   0.00ns]   0.00ns   0.00ns   0.00ns
                        'fs_random':         1 [  5.87ms,   5.87ms]   5.87ms   0.00ns   5.87ms         0 [  0.00ns,   0.00ns]   0.00ns   0.00ns   0.00ns
                  'fs_random_no_lp':         1 [  4.25ms,   4.25ms]   4.25ms   0.00ns   4.25ms         0 [  0.00ns,   0.00ns]   0.00ns   0.00ns   0.00ns
                  'fs_random_no_lp':         1 [  4.40ms,   4.40ms]   4.40ms   0.00ns   4.40ms         0 [  0.00ns,   0.00ns]   0.00ns   0.00ns   0.00ns
                  'fs_random_no_lp':         1 [  4.73ms,   4.73ms]   4.73ms   0.00ns   4.73ms         0 [  0.00ns,   0.00ns]   0.00ns   0.00ns   0.00ns
                  'fs_random_no_lp':         1 [  4.87ms,   4.87ms]   4.87ms   0.00ns   4.87ms         0 [  0.00ns,   0.00ns]   0.00ns   0.00ns   0.00ns
          'fs_random_quick_restart':         1 [  5.45ms,   5.45ms]   5.45ms   0.00ns   5.45ms         0 [  0.00ns,   0.00ns]   0.00ns   0.00ns   0.00ns
          'fs_random_quick_restart':         1 [  5.49ms,   5.49ms]   5.49ms   0.00ns   5.49ms         0 [  0.00ns,   0.00ns]   0.00ns   0.00ns   0.00ns
          'fs_random_quick_restart':         1 [  5.87ms,   5.87ms]   5.87ms   0.00ns   5.87ms         1 [ 20.00ns,  20.00ns]  20.00ns   0.00ns  20.00ns
          'fs_random_quick_restart':         1 [  6.01ms,   6.01ms]   6.01ms   0.00ns   6.01ms         0 [  0.00ns,   0.00ns]   0.00ns   0.00ns   0.00ns
    'fs_random_quick_restart_no_lp':         1 [  4.23ms,   4.23ms]   4.23ms   0.00ns   4.23ms         0 [  0.00ns,   0.00ns]   0.00ns   0.00ns   0.00ns
    'fs_random_quick_restart_no_lp':         1 [  4.83ms,   4.83ms]   4.83ms   0.00ns   4.83ms         0 [  0.00ns,   0.00ns]   0.00ns   0.00ns   0.00ns
    'fs_random_quick_restart_no_lp':         1 [  5.12ms,   5.12ms]   5.12ms   0.00ns   5.12ms         0 [  0.00ns,   0.00ns]   0.00ns   0.00ns   0.00ns
                    'graph_arc_lns':        19 [  2.57ms, 349.39ms]  90.66ms  93.87ms    1.72s        14 [  2.94us, 114.34ms]   9.55ms  29.12ms 133.74ms
                    'graph_cst_lns':        19 [495.21us,   5.99ms] 833.76us   1.22ms  15.84ms         0 [  0.00ns,   0.00ns]   0.00ns   0.00ns   0.00ns
                    'graph_dec_lns':        19 [  2.02ms, 367.32ms] 111.94ms 113.87ms    2.13s        13 [ 10.00ns, 121.27ms]  10.25ms  32.06ms 133.25ms
                    'graph_var_lns':        19 [  2.12ms, 336.22ms] 108.08ms 112.62ms    2.05s        14 [ 10.00ns,  94.24ms]  10.75ms  24.51ms 150.49ms
                   'lb_tree_search':         1 [503.99ms, 503.99ms] 503.99ms   0.00ns 503.99ms         1 [ 18.18ms,  18.18ms]  18.18ms   0.00ns  18.18ms
                           'max_lp':         1 [504.10ms, 504.10ms] 504.10ms   0.00ns 504.10ms         1 [ 15.65ms,  15.65ms]  15.65ms   0.00ns  15.65ms
                            'no_lp':         1 [501.53ms, 501.53ms] 501.53ms   0.00ns 501.53ms         1 [ 58.72ms,  58.72ms]  58.72ms   0.00ns  58.72ms
              'objective_lb_search':         1 [501.20ms, 501.20ms] 501.20ms   0.00ns 501.20ms         1 [ 57.89ms,  57.89ms]  57.89ms   0.00ns  57.89ms
       'objective_lb_search_max_lp':         1 [501.87ms, 501.87ms] 501.87ms   0.00ns 501.87ms         1 [ 33.66ms,  33.66ms]  33.66ms   0.00ns  33.66ms
        'objective_lb_search_no_lp':         1 [500.37ms, 500.37ms] 500.37ms   0.00ns 500.37ms         1 [ 63.70ms,  63.70ms]  63.70ms   0.00ns  63.70ms
  'objective_shaving_search_max_lp':        19 [935.78us,  90.91ms]  20.01ms  22.14ms 380.20ms        10 [209.90us,   1.03ms] 479.25us 262.60us   4.79ms
   'objective_shaving_search_no_lp':        19 [  1.29ms,  81.67ms]  23.46ms  22.11ms 445.65ms        11 [186.66us,   2.90ms] 902.88us 973.08us   9.93ms
                          'probing':         1 [504.98ms, 504.98ms] 504.98ms   0.00ns 504.98ms         1 [ 13.18ms,  13.18ms]  13.18ms   0.00ns  13.18ms
                   'probing_max_lp':         1 [502.41ms, 502.41ms] 502.41ms   0.00ns 502.41ms         1 [ 31.43ms,  31.43ms]  31.43ms   0.00ns  31.43ms
                     'pseudo_costs':         1 [504.14ms, 504.14ms] 504.14ms   0.00ns 504.14ms         1 [ 32.49ms,  32.49ms]  32.49ms   0.00ns  32.49ms
                    'quick_restart':         1 [502.05ms, 502.05ms] 502.05ms   0.00ns 502.05ms         1 [ 42.92ms,  42.92ms]  42.92ms   0.00ns  42.92ms
              'quick_restart_no_lp':         1 [502.15ms, 502.15ms] 502.15ms   0.00ns 502.15ms         1 [ 71.38ms,  71.38ms]  71.38ms   0.00ns  71.38ms
                    'reduced_costs':         1 [501.96ms, 501.96ms] 501.96ms   0.00ns 501.96ms         1 [ 31.55ms,  31.55ms]  31.55ms   0.00ns  31.55ms
                        'rins/rens':        19 [ 89.26us, 296.62ms] 108.73ms  87.44ms    2.07s        14 [ 53.41us,  74.44ms]  11.33ms  18.54ms 158.68ms
                      'rnd_cst_lns':        19 [655.02us, 226.35ms]  63.37ms  63.51ms    1.20s        15 [ 10.00ns,  40.30ms]   4.57ms   9.98ms  68.50ms
                      'rnd_var_lns':        19 [  2.20ms, 360.54ms] 100.96ms 111.96ms    1.92s        16 [ 10.00ns,  63.06ms]   7.54ms  16.16ms 120.58ms
                     'violation_ls':        10 [ 91.14us, 106.31ms]  43.81ms  45.03ms 438.07ms        10 [510.00ns,  43.01ms]  20.17ms  20.10ms 201.71ms
                     'violation_ls':        10 [121.35us, 100.34ms]  43.68ms  43.83ms 436.79ms        10 [540.00ns,  43.17ms]  20.54ms  20.59ms 205.40ms
                     'violation_ls':        10 [179.98us,  98.09ms]  43.64ms  43.68ms 436.43ms        10 [720.00ns,  43.76ms]  21.30ms  21.17ms 212.96ms
                     'violation_ls':        11 [ 95.21us,  91.50ms]  39.36ms  38.68ms 433.00ms        11 [510.00ns,  44.31ms]  20.91ms  20.12ms 230.00ms
                     'violation_ls':        11 [139.23us,  87.07ms]  40.95ms  36.73ms 450.46ms        11 [720.00ns,  44.89ms]  22.57ms  20.30ms 248.22ms

Search stats                        Bools  Conflicts  Branches  Restarts  BoolPropag  IntegerPropag
                           'core':    744        749     2'430       628     200'457        110'155
                     'default_lp':    180        875     3'345       673      34'459        159'734
                      'fs_random':     65          0         0         0           0              0
                      'fs_random':     65          0         0         0           0              0
                      'fs_random':     65          0         0         0           0              0
                      'fs_random':     65          0        40        40          43            215
                'fs_random_no_lp':     65          0         0         0           0              0
                'fs_random_no_lp':     65          0         0         0           0              0
                'fs_random_no_lp':     65          0         0         0           0              0
                'fs_random_no_lp':     65          0         0         0           0              0
        'fs_random_quick_restart':     65          0         0         0           0              0
        'fs_random_quick_restart':     65          0         0         0           0              0
        'fs_random_quick_restart':     65          0         0         0           0              0
        'fs_random_quick_restart':     65          0         0         0           0              0
  'fs_random_quick_restart_no_lp':     65          0         0         0           0              0
  'fs_random_quick_restart_no_lp':     65          0         0         0           0              0
  'fs_random_quick_restart_no_lp':     65          0         0         0           0              0
                 'lb_tree_search':     65          0       130       130         156            958
                         'max_lp':     65          0       130       130         155            977
                          'no_lp':    208      1'546     4'798       781      80'188        284'878
            'objective_lb_search':     75        513     3'546     1'215      12'603        110'161
     'objective_lb_search_max_lp':     80         63       615       272       2'202         12'038
      'objective_lb_search_no_lp':    123      1'840     4'833       947      32'074        318'442
                        'probing':    107         21       193       193         632          2'491
                 'probing_max_lp':     67          0       134       134         178            989
                   'pseudo_costs':     89         50       665       294       1'873         13'691
                  'quick_restart':    114        194     2'785       926      12'363         65'298
            'quick_restart_no_lp':    311      1'323     8'080     1'413     148'120        304'614
                  'reduced_costs':    146        149     1'273       466       9'122         37'388

SAT stats                           ClassicMinim  LitRemoved  LitLearned  LitForgotten  Subsumed  MClauses  MDecisions  MLitTrue  MSubsumed  MLitRemoved  MReused
                           'core':           508       1'865       2'462             0         9       102         556         0          1            5       28
                     'default_lp':           500       1'203       5'885             0        44       259       1'408         0        116          691       26
                      'fs_random':             0           0           0             0         0         0           0         0          0            0        0
                      'fs_random':             0           0           0             0         0         0           0         0          0            0        0
                      'fs_random':             0           0           0             0         0         0           0         0          0            0        0
                      'fs_random':             0           0           0             0         0         0           0         0          0            0        0
                'fs_random_no_lp':             0           0           0             0         0         0           0         0          0            0        0
                'fs_random_no_lp':             0           0           0             0         0         0           0         0          0            0        0
                'fs_random_no_lp':             0           0           0             0         0         0           0         0          0            0        0
                'fs_random_no_lp':             0           0           0             0         0         0           0         0          0            0        0
        'fs_random_quick_restart':             0           0           0             0         0         0           0         0          0            0        0
        'fs_random_quick_restart':             0           0           0             0         0         0           0         0          0            0        0
        'fs_random_quick_restart':             0           0           0             0         0         0           0         0          0            0        0
        'fs_random_quick_restart':             0           0           0             0         0         0           0         0          0            0        0
  'fs_random_quick_restart_no_lp':             0           0           0             0         0         0           0         0          0            0        0
  'fs_random_quick_restart_no_lp':             0           0           0             0         0         0           0         0          0            0        0
  'fs_random_quick_restart_no_lp':             0           0           0             0         0         0           0         0          0            0        0
                 'lb_tree_search':             0           0           0             0         0         0           0         0          0            0        0
                         'max_lp':             0           0           0             0         0         0           0         0          0            0        0
                          'no_lp':         1'084       2'688      10'664             0        76       236       1'318         0         65          319       46
            'objective_lb_search':           372         870       2'873             0        34       360       1'791         0         26          122       84
     'objective_lb_search_max_lp':            19          28         498             0         5        44         234         0          0            0       10
      'objective_lb_search_no_lp':         1'354       3'743      10'015             0        85       374       2'138         0        125          707       70
                        'probing':             0           0          21             0         0         0           0         0          0            0        0
                 'probing_max_lp':             0           0           0             0         0         0           0         0          0            0        0
                   'pseudo_costs':            14          23         375             0         6        48         240         0          5           22        8
                  'quick_restart':           117         211       1'272             0        16       262       1'431         0         34          174       44
            'quick_restart_no_lp':           791       1'703       8'843             0        46       569       2'999         0        249        1'224       56
                  'reduced_costs':            39          63         498             0        21       146         608         8         40          177       18

Lp stats                         Component  Iterations  AddedCuts  OPTIMAL  DUAL_F.  DUAL_U.
                  'default_lp':          1       2'917        788      974        0        0
                   'fs_random':          1           0          0        0        0        0
                   'fs_random':          1           0          0        0        0        0
                   'fs_random':          1           0          0        0        0        0
                   'fs_random':          1           0          0        0        0        0
     'fs_random_quick_restart':          1           0          0        0        0        0
     'fs_random_quick_restart':          1           0          0        0        0        0
     'fs_random_quick_restart':          1           0          0        0        0        0
     'fs_random_quick_restart':          1           0          0        0        0        0
              'lb_tree_search':          1         385        929        8        1        0
                      'max_lp':          1         376      1'003       11        1        0
         'objective_lb_search':          1       2'128        912      565        0        0
  'objective_lb_search_max_lp':          1       1'651        846      110       44        0
                     'probing':          1         261      1'080       80        0        0
              'probing_max_lp':          1         605      1'289       39        2        0
                'pseudo_costs':          1       1'247      1'004      115       23        0
               'quick_restart':          1       1'508      1'138      412        0        0
               'reduced_costs':          1         851      1'145      116        9        0

Lp dimension                                                                     Final dimension of first component
                  'default_lp':    157 rows, 87 columns, 778 entries with magnitude in [1.446204e-03, 1.000000e+00]
                   'fs_random':        0 rows, 87 columns, 0 entries with magnitude in [0.000000e+00, 0.000000e+00]
                   'fs_random':        0 rows, 87 columns, 0 entries with magnitude in [0.000000e+00, 0.000000e+00]
                   'fs_random':        0 rows, 87 columns, 0 entries with magnitude in [0.000000e+00, 0.000000e+00]
                   'fs_random':        0 rows, 87 columns, 0 entries with magnitude in [0.000000e+00, 0.000000e+00]
     'fs_random_quick_restart':        0 rows, 87 columns, 0 entries with magnitude in [0.000000e+00, 0.000000e+00]
     'fs_random_quick_restart':        0 rows, 87 columns, 0 entries with magnitude in [0.000000e+00, 0.000000e+00]
     'fs_random_quick_restart':        0 rows, 87 columns, 0 entries with magnitude in [0.000000e+00, 0.000000e+00]
     'fs_random_quick_restart':        0 rows, 87 columns, 0 entries with magnitude in [0.000000e+00, 0.000000e+00]
              'lb_tree_search':   743 rows, 95 columns, 4689 entries with magnitude in [3.016528e-03, 1.000000e+00]
                      'max_lp':   843 rows, 95 columns, 4917 entries with magnitude in [5.237460e-04, 1.000000e+00]
         'objective_lb_search':    141 rows, 87 columns, 780 entries with magnitude in [6.366785e-04, 1.000000e+00]
  'objective_lb_search_max_lp':   485 rows, 95 columns, 2060 entries with magnitude in [1.141359e-03, 1.000000e+00]
                     'probing':   506 rows, 87 columns, 5773 entries with magnitude in [4.760088e-05, 1.000000e+00]
              'probing_max_lp':  1011 rows, 95 columns, 6417 entries with magnitude in [1.213076e-03, 1.000000e+00]
                'pseudo_costs':   527 rows, 95 columns, 2498 entries with magnitude in [2.101702e-04, 1.000000e+00]
               'quick_restart':   246 rows, 87 columns, 1314 entries with magnitude in [5.224152e-04, 1.000000e+00]
               'reduced_costs':   541 rows, 95 columns, 2413 entries with magnitude in [8.840602e-04, 1.000000e+00]

Lp debug                         CutPropag  CutEqPropag  Adjust  Overflow    Bad  BadScaling
                  'default_lp':          0            0      29         0    717           0
                   'fs_random':          0            0       0         0      0           0
                   'fs_random':          0            0       0         0      0           0
                   'fs_random':          0            0       0         0      0           0
                   'fs_random':          0            0       0         0      0           0
     'fs_random_quick_restart':          0            0       0         0      0           0
     'fs_random_quick_restart':          0            0       0         0      0           0
     'fs_random_quick_restart':          0            0       0         0      0           0
     'fs_random_quick_restart':          0            0       0         0      0           0
              'lb_tree_search':          0            0       8         0    420           0
                      'max_lp':          0            0      11         0    907           0
         'objective_lb_search':          0            2       9         0  1'404           0
  'objective_lb_search_max_lp':          0            0     136         0    610           0
                     'probing':          0           24      32         0  3'558           0
              'probing_max_lp':          0            0      38         0  3'105           0
                'pseudo_costs':          0            0      96         0  1'110           0
               'quick_restart':          0            0      91         0  1'562           0
               'reduced_costs':          0            0     111         0  1'083           0

Lp pool                          Constraints  Updates  Simplif  Merged  Shortened  Split  Strenghtened    Cuts/Call
                  'default_lp':          911      220    1'238       7        156     46         1'156    788/1'377
                   'fs_random':          130        0        0       0          0      0             0          0/0
                   'fs_random':          130        0        0       0          0      0             0          0/0
                   'fs_random':          130        0        0       0          0      0             0          0/0
                   'fs_random':          130        0        0       0          0      0             0          0/0
     'fs_random_quick_restart':          130        0        0       0          0      0             0          0/0
     'fs_random_quick_restart':          130        0        0       0          0      0             0          0/0
     'fs_random_quick_restart':          130        0        0       0          0      0             0          0/0
     'fs_random_quick_restart':          130        0        0       0          0      0             0          0/0
              'lb_tree_search':        1'472        1        0       0          0      1           246    929/1'417
                      'max_lp':        1'544       93      725       2          0      3         2'059  1'003/1'675
         'objective_lb_search':        1'038      374      988       4        138    160         1'033    912/1'392
  'objective_lb_search_max_lp':        1'389      130    1'177       0          0      2         2'616    846/1'327
                     'probing':        1'199      173      153      11          0     18           442  1'080/1'475
              'probing_max_lp':        1'832        4        0       0          0     19           333  1'289/2'205
                'pseudo_costs':        1'544      129    1'497       3          0      3         3'225  1'004/1'532
               'quick_restart':        1'268      356    2'287       0        213    114         1'991  1'138/1'730
               'reduced_costs':        1'683      131    2'757       5        596      2         4'379  1'145/1'723

Lp Cut            defaul  max_lp  quick_  reduce  pseudo  lb_tre  probin  object  probin  object
          CG_FF:      68     120     111     123     110     113      63      87     131      79
           CG_K:      47      51      54      35      40      52      13      19      45      23
           CG_R:      62      73     117      36      43      67      69      68      66      43
          CG_RB:     139     194     243     309     238     227     409     222     267     164
         CG_RBP:      48      39      75      39      30      33      15      39      34      22
         Clique:       -       -       -       6       1       -       -       -       -       3
             IB:     132      76     123     129     128      84     114     112      77     136
       MIR_1_FF:      25      63      29      50      53      51      22      26      86      43
        MIR_1_K:      15       6      15       9       4       5       6      10       6       3
        MIR_1_R:       4       -       6       2       1       -       -       7       3       -
       MIR_1_RB:      29      57      27      70      67      55      32      43     108      54
      MIR_1_RBP:       6      16       8      24      24      12       6       6      20      11
      MIR_1_RLT:       -       1       -      13       9       2       -       -       3       9
       MIR_2_FF:      23      24      28      20      24      23      23      27      34      32
        MIR_2_K:       5       7      16       4       8       8       6      13       8       4
        MIR_2_R:       4       6       7      13      11       9       8       9      16      10
       MIR_2_RB:      24      26      40      37      30      25      42      35      51      37
      MIR_2_RBP:       3      13       9       9      10       9       5       7      15       7
       MIR_3_FF:      15      25      19      17      10      12      16      15      24      15
        MIR_3_K:      10       4       9       8       3       4       6       5       3       2
        MIR_3_R:      15      13      13       8       9       4      13      16      12       6
       MIR_3_RB:      23      21      31      22      15       8      34      24      27      16
      MIR_3_RBP:       5       4       7       3       4       5       4       6       4       4
       MIR_4_FF:       7      10      14       9       5      10      23      15       9       8
        MIR_4_K:       3       -       5       3       1       3       3       6       3       4
        MIR_4_R:       6       7       9       6       8       7      10      12       4       7
       MIR_4_RB:       7       7      25       8      11       3      30      15      13       6
      MIR_4_RBP:       1       1       2       3       3       2       -       4       3       5
       MIR_5_FF:       4       5      11       4       3       -       5       3       3       3
        MIR_5_K:       1       1       2       1       1       -       -       2       -       1
        MIR_5_R:       3       4       3       3       1       -       4       3       4       1
       MIR_5_RB:       6       5      17       6       1       -       7       6       4       2
      MIR_5_RBP:       -       -       1       -       2       -       1       1       1       1
       MIR_6_FF:       4       2       -       1       2       1       4       1       1       1
        MIR_6_K:       2       -       -       -       1       -       -       -       -       -
        MIR_6_R:       2       -       1       1       1       -       3       1       1       1
       MIR_6_RB:       3       1       3       1       -       1       4       1       1       1
   ZERO_HALF_FF:       9      29      13      17      16      24      11       8      29      18
    ZERO_HALF_K:       3       3       5       3       3       2       -       2       4       1
    ZERO_HALF_R:      14      52      21      50      42      28      37      19     117      33
   ZERO_HALF_RB:      10      26      15      32      22      26      28      13      36      25
  ZERO_HALF_RBP:       1      11       4      11       9      14       4       4      16       5

LNS stats           Improv/Calls  Closed  Difficulty  TimeLimit
  'graph_arc_lns':          5/19     74%        0.98       0.10
  'graph_cst_lns':           0/0      0%        0.50       0.10
  'graph_dec_lns':          5/19     63%        0.96       0.10
  'graph_var_lns':          4/19     74%        0.98       0.10
      'rins/rens':          4/18     78%        0.99       0.10
    'rnd_cst_lns':          1/17     82%        0.99       0.10
    'rnd_var_lns':          4/19     84%        0.99       0.10

LS stats                   Batches  Restarts  LinMoves  GenMoves  CompoundMoves  WeightUpdates
       'fj_long_default':        0         0         0         0              0              0
       'fj_long_default':        0         0         0         0              0              0
   'fj_long_lin_default':        0         0         0         0              0              0
   'fj_long_lin_perturb':        0         0         0         0              0              0
    'fj_long_lin_random':        0         0         0         0              0              0
       'fj_long_perturb':        0         0         0         0              0              0
        'fj_long_random':        0         0         0         0              0              0
      'fj_short_default':        0         0         0         0              0              0
      'fj_short_default':        1         1         0     2'104            320              4
  'fj_short_lin_default':        0         0         0         0              0              0
  'fj_short_lin_default':        0         0         0         0              0              0
  'fj_short_lin_perturb':        0         0         0         0              0              0
   'fj_short_lin_random':        0         0         0         0              0              0
      'fj_short_perturb':        0         0         0         0              0              0
       'fj_short_random':        0         0         0         0              0              0
          'violation_ls':       10         0         0    42'072            960            260
          'violation_ls':       10         0        28    40'934            912            266
          'violation_ls':       10         0    41'503       220              8          7'635
          'violation_ls':       11         0        24    39'590          2'555            178
          'violation_ls':       11         0     5'963    25'751          1'973          4'253

Solutions (40)            Num     Rank
        'graph_arc_lns':    2  [20,38]
                'no_lp':    6   [1,19]
  'quick_restart_no_lp':   16   [2,40]
          'rnd_var_lns':    1  [30,30]
         'violation_ls':   15   [3,32]

Objective bounds                Num
                  'bool_core':    1
             'initial_domain':    1
        'objective_lb_search':    2
  'objective_lb_search_no_lp':   44

Solution repositories    Added  Queried  Ignored  Synchro
  'feasible solutions':    136      330       11       99
        'lp solutions':      1        0        0        1
                'pump':    375       18

Improving bounds shared          Num
                        'core':   28
                  'default_lp':    3
                       'no_lp':   47
  'objective_lb_search_max_lp':    3
   'objective_lb_search_no_lp':   19
                'pseudo_costs':    2
               'quick_restart':   25
         'quick_restart_no_lp':  367
               'reduced_costs':   57

Clauses shared                  Num
                       'core':    1
                 'default_lp':   21
                      'no_lp':   46
        'objective_lb_search':   13
  'objective_lb_search_no_lp':    2
               'pseudo_costs':    2
              'quick_restart':    3
        'quick_restart_no_lp':   12
              'reduced_costs':    1

CpSolverResponse summary:
status: OPTIMAL
objective: 389
best_bound: 389
integers: 88
booleans: 65
conflicts: 0
branches: 40
propagations: 43
integer_propagations: 215
restarts: 40
lp_iterations: 0
walltime: 0.573612
usertime: 0.573612
deterministic_time: 2.54745
gap_integral: 5.80441
solution_fingerprint: 0x7ee274b891e9e48a


--- Simulation Gantt  partir du modle mathmatique ---
{'big':0, 'due_date':84, 'pos_time':5, 'status':1, 'blocked':2, 'operations':["{'type':0, 'processing_time':30}", "{'type':1, 'processing_time':20}"]}
{'big':0, 'due_date':117, 'pos_time':5, 'status':0, 'blocked':2, 'operations':["{'type':1, 'processing_time':46}", "{'type':0, 'processing_time':18}"]}
{'big':0, 'due_date':136, 'pos_time':5, 'status':3, 'blocked':1, 'operations':["{'type':0, 'processing_time':29}", "{'type':1, 'processing_time':54}"]}
{'big':0, 'due_date':97, 'pos_time':5, 'status':1, 'blocked':2, 'operations':["{'type':0, 'processing_time':16}", "{'type':1, 'processing_time':15}"]}
