created virtual environment CPython3.12.4.final.0-64 in 544ms
  creator CPython3Posix(dest=/localscratch/aneumann.47038292.0/env, clear=False, no_vcs_ignore=False, global=False)
  seeder FromAppData(download=False, pip=bundle, via=copy, app_data_dir=/home/aneumann/.local/share/virtualenv)
    added seed packages: pip==24.2+computecanada
  activators BashActivator,CShellActivator,FishActivator,NushellActivator,PowerShellActivator,PythonActivator
Looking in links: /cvmfs/soft.computecanada.ca/custom/python/wheelhouse/gentoo2023/x86-64-v3, /cvmfs/soft.computecanada.ca/custom/python/wheelhouse/gentoo2023/generic, /cvmfs/soft.computecanada.ca/custom/python/wheelhouse/generic
Requirement already satisfied: pip in /localscratch/aneumann.47038292.0/env/lib/python3.12/site-packages (24.2+computecanada)
Processing /cvmfs/soft.computecanada.ca/custom/python/wheelhouse/generic/pip-25.0+computecanada-py3-none-any.whl
Installing collected packages: pip
  Attempting uninstall: pip
    Found existing installation: pip 24.2+computecanada
    Uninstalling pip-24.2+computecanada:
      Successfully uninstalled pip-24.2+computecanada
Successfully installed pip-25.0+computecanada
Looking in links: /cvmfs/soft.computecanada.ca/custom/python/wheelhouse/gentoo2023/x86-64-v3, /cvmfs/soft.computecanada.ca/custom/python/wheelhouse/gentoo2023/generic, /cvmfs/soft.computecanada.ca/custom/python/wheelhouse/generic
ERROR: protobuf-5.28.3-cp38-abi3-manylinux2014_x86_64.whl is not a supported wheel on this platform.
Looking in links: /cvmfs/soft.computecanada.ca/custom/python/wheelhouse/gentoo2023/x86-64-v3, /cvmfs/soft.computecanada.ca/custom/python/wheelhouse/gentoo2023/generic, /cvmfs/soft.computecanada.ca/custom/python/wheelhouse/generic
Processing /home/aneumann/projects/def-adhaj/aneumann/GNRS/wheels/immutabledict-4.2.0-py3-none-any.whl
Installing collected packages: immutabledict
Successfully installed immutabledict-4.2.0
Looking in links: /cvmfs/soft.computecanada.ca/custom/python/wheelhouse/gentoo2023/x86-64-v3, /cvmfs/soft.computecanada.ca/custom/python/wheelhouse/gentoo2023/generic, /cvmfs/soft.computecanada.ca/custom/python/wheelhouse/generic
Processing /cvmfs/soft.computecanada.ca/custom/python/wheelhouse/generic/ortools-9.10.4067+computecanada-cp312-cp312-linux_x86_64.whl (from -r /home/aneumann/projects/def-adhaj/aneumann/GNRS/requirements/or.txt (line 1))
Processing /cvmfs/soft.computecanada.ca/custom/python/wheelhouse/gentoo2023/x86-64-v3/matplotlib-3.10.0+computecanada-cp312-cp312-linux_x86_64.whl (from -r /home/aneumann/projects/def-adhaj/aneumann/GNRS/requirements/or.txt (line 2))
Processing /cvmfs/soft.computecanada.ca/custom/python/wheelhouse/gentoo2023/x86-64-v3/pandas-2.2.3+computecanada-cp312-cp312-linux_x86_64.whl (from -r /home/aneumann/projects/def-adhaj/aneumann/GNRS/requirements/or.txt (line 3))
Processing /cvmfs/soft.computecanada.ca/custom/python/wheelhouse/generic/absl_py-2.3.0+computecanada-py3-none-any.whl (from ortools<9.11,>=9.10->-r /home/aneumann/projects/def-adhaj/aneumann/GNRS/requirements/or.txt (line 1))
Processing /cvmfs/soft.computecanada.ca/custom/python/wheelhouse/gentoo2023/generic/numpy-2.2.2+computecanada-cp312-cp312-linux_x86_64.whl (from ortools<9.11,>=9.10->-r /home/aneumann/projects/def-adhaj/aneumann/GNRS/requirements/or.txt (line 1))
Processing /cvmfs/soft.computecanada.ca/custom/python/wheelhouse/gentoo2023/x86-64-v3/protobuf-6.31.1+computecanada-cp312-cp312-linux_x86_64.whl (from ortools<9.11,>=9.10->-r /home/aneumann/projects/def-adhaj/aneumann/GNRS/requirements/or.txt (line 1))
Requirement already satisfied: immutabledict>=3.0.0 in /localscratch/aneumann.47038292.0/env/lib/python3.12/site-packages (from ortools<9.11,>=9.10->-r /home/aneumann/projects/def-adhaj/aneumann/GNRS/requirements/or.txt (line 1)) (4.2.0)
Processing /cvmfs/soft.computecanada.ca/custom/python/wheelhouse/gentoo2023/generic/contourpy-1.3.1+computecanada-cp312-cp312-linux_x86_64.whl (from matplotlib->-r /home/aneumann/projects/def-adhaj/aneumann/GNRS/requirements/or.txt (line 2))
Processing /cvmfs/soft.computecanada.ca/custom/python/wheelhouse/generic/cycler-0.12.1+computecanada-py3-none-any.whl (from matplotlib->-r /home/aneumann/projects/def-adhaj/aneumann/GNRS/requirements/or.txt (line 2))
Processing /cvmfs/soft.computecanada.ca/custom/python/wheelhouse/generic/fonttools-4.59.0+computecanada-cp312-cp312-linux_x86_64.whl (from matplotlib->-r /home/aneumann/projects/def-adhaj/aneumann/GNRS/requirements/or.txt (line 2))
Processing /cvmfs/soft.computecanada.ca/custom/python/wheelhouse/gentoo2023/x86-64-v3/kiwisolver-1.4.8+computecanada-cp312-cp312-linux_x86_64.whl (from matplotlib->-r /home/aneumann/projects/def-adhaj/aneumann/GNRS/requirements/or.txt (line 2))
Processing /cvmfs/soft.computecanada.ca/custom/python/wheelhouse/generic/packaging-25.0+computecanada-py3-none-any.whl (from matplotlib->-r /home/aneumann/projects/def-adhaj/aneumann/GNRS/requirements/or.txt (line 2))
Processing /cvmfs/soft.computecanada.ca/custom/python/wheelhouse/gentoo2023/x86-64-v3/pillow-11.1.0+computecanada-cp312-cp312-linux_x86_64.whl (from matplotlib->-r /home/aneumann/projects/def-adhaj/aneumann/GNRS/requirements/or.txt (line 2))
Processing /cvmfs/soft.computecanada.ca/custom/python/wheelhouse/generic/pyparsing-3.2.3+computecanada-py3-none-any.whl (from matplotlib->-r /home/aneumann/projects/def-adhaj/aneumann/GNRS/requirements/or.txt (line 2))
Processing /cvmfs/soft.computecanada.ca/custom/python/wheelhouse/generic/python_dateutil-2.9.0.post0+computecanada-py2.py3-none-any.whl (from matplotlib->-r /home/aneumann/projects/def-adhaj/aneumann/GNRS/requirements/or.txt (line 2))
Processing /cvmfs/soft.computecanada.ca/custom/python/wheelhouse/generic/pytz-2025.2+computecanada-py2.py3-none-any.whl (from pandas->-r /home/aneumann/projects/def-adhaj/aneumann/GNRS/requirements/or.txt (line 3))
Processing /cvmfs/soft.computecanada.ca/custom/python/wheelhouse/generic/tzdata-2025.2+computecanada-py2.py3-none-any.whl (from pandas->-r /home/aneumann/projects/def-adhaj/aneumann/GNRS/requirements/or.txt (line 3))
Processing /cvmfs/soft.computecanada.ca/custom/python/wheelhouse/generic/six-1.17.0+computecanada-py2.py3-none-any.whl (from python-dateutil>=2.7->matplotlib->-r /home/aneumann/projects/def-adhaj/aneumann/GNRS/requirements/or.txt (line 2))
Installing collected packages: pytz, tzdata, six, pyparsing, protobuf, pillow, packaging, numpy, kiwisolver, fonttools, cycler, absl-py, python-dateutil, contourpy, pandas, matplotlib, ortools
Successfully installed absl-py-2.3.0+computecanada contourpy-1.3.1+computecanada cycler-0.12.1+computecanada fonttools-4.59.0+computecanada kiwisolver-1.4.8+computecanada matplotlib-3.10.0+computecanada numpy-2.2.2+computecanada ortools-9.10.4067+computecanada packaging-25.0+computecanada pandas-2.2.3+computecanada pillow-11.1.0+computecanada protobuf-6.31.1+computecanada pyparsing-3.2.3+computecanada python-dateutil-2.9.0.post0+computecanada pytz-2025.2+computecanada six-1.17.0+computecanada tzdata-2025.2+computecanada

Starting CP-SAT solver v9.10.4067
Parameters: max_time_in_seconds: 86400 max_memory_in_mb: 185000 log_search_progress: true enumerate_all_solutions: false num_search_workers: 32 absolute_gap_limit: 0 relative_gap_limit: 0

Initial optimization model '': (model_fingerprint: 0x7f9237ec2163ad7e)
#Variables: 890 (#ints: 17 in objective)
  - 717 Booleans in [0,1]
  - 173 in [0,1214]
#kLinear1: 85
#kLinear2: 1'810
#kLinear3: 782
#kLinearN: 34'158 (#terms: 952'181)

Starting presolve at 0.02s
  4.21e-02s  0.00e+00d  [DetectDominanceRelations] 
  6.92e-01s  0.00e+00d  [PresolveToFixPoint] #num_loops=8 #num_dual_strengthening=3 
  3.30e-04s  0.00e+00d  [ExtractEncodingFromLinear] #potential_supersets=7 
[Symmetry] Graph for symmetry has 36'373 nodes and 831'849 arcs.
[Symmetry] Symmetry computation done. time: 0.0316231 dtime: 0.0596809
[Symmetry] #generators: 1, average support size: 46
[Symmetry] The model contains 860 duplicate constraints !
[Symmetry] 23 orbits with sizes: 2,2,2,2,2,2,2,2,2,2,...
[Symmetry] Num fixable by intersecting at_most_one with orbits: 1 largest_orbit: 2
  3.02e-01s  7.46e-02d  [Probe] #probed=1'168 #new_bounds=19 #equiv=1 
  3.33e-04s  0.00e+00d  [MaxClique] 
  4.23e-02s  0.00e+00d  [DetectDominanceRelations] 
  3.47e-01s  0.00e+00d  [PresolveToFixPoint] #num_loops=5 #num_dual_strengthening=3 
  1.71e-01s  0.00e+00d  [ProcessAtMostOneAndLinear] 
  4.21e-02s  0.00e+00d  [DetectDuplicateConstraints] #duplicates=1'123 #without_enforcements=110 
  9.27e-02s  7.37e-03d  [DetectDominatedLinearConstraints] #relevant_constraints=32'326 #num_inclusions=18'468 
  4.49e-03s  0.00e+00d  [DetectDifferentVariables] #different=85 #cliques=1 #size=11 
  1.65e-02s  1.46e-03d  [ProcessSetPPC] #relevant_constraints=31'344 
  5.06e-04s  0.00e+00d  [FindAlmostIdenticalLinearConstraints] 
  3.30e-03s  4.29e-03d  [FindBigAtMostOneAndLinearOverlap] 
  2.80e-01s  1.52e-01d  [FindBigVerticalLinearOverlap] #blocks=475 #saved_nz=203'120 
  7.75e-03s  2.92e-03d  [FindBigHorizontalLinearOverlap] #linears=30'516 
  2.33e-04s  0.00e+00d  [MergeClauses] 
  4.41e-02s  0.00e+00d  [DetectDominanceRelations] 
  3.81e-01s  0.00e+00d  [PresolveToFixPoint] #num_loops=3 #num_dual_strengthening=1 
  4.42e-02s  0.00e+00d  [DetectDominanceRelations] 
  2.28e-01s  0.00e+00d  [PresolveToFixPoint] #num_loops=1 #num_dual_strengthening=1 
[Symmetry] Graph for symmetry has 36'639 nodes and 625'385 arcs.
[Symmetry] Symmetry computation done. time: 0.0166381 dtime: 0.0332935
  2.70e-01s  5.83e-02d  [Probe] #probed=1'168 #new_bounds=343 
  2.42e-04s  0.00e+00d  [MaxClique] 
  4.32e-02s  0.00e+00d  [DetectDominanceRelations] 
  3.56e-01s  0.00e+00d  [PresolveToFixPoint] #num_loops=2 #num_dual_strengthening=1 
  1.59e-01s  0.00e+00d  [ProcessAtMostOneAndLinear] 
  3.83e-02s  0.00e+00d  [DetectDuplicateConstraints] #without_enforcements=110 
  5.89e-02s  4.62e-03d  [DetectDominatedLinearConstraints] #relevant_constraints=32'385 #num_inclusions=2'327 
  4.06e-03s  0.00e+00d  [DetectDifferentVariables] 
  1.35e-02s  1.04e-03d  [ProcessSetPPC] #relevant_constraints=30'517 
  4.87e-04s  3.02e-06d  [FindAlmostIdenticalLinearConstraints] #num_tested_pairs=188 
  1.53e-03s  1.65e-03d  [FindBigAtMostOneAndLinearOverlap] 
  2.19e-01s  9.73e-02d  [FindBigVerticalLinearOverlap] #blocks=2'125 #saved_nz=188'672 
  6.39e-03s  1.83e-03d  [FindBigHorizontalLinearOverlap] #linears=24'265 
  2.58e-04s  0.00e+00d  [MergeClauses] 
  3.14e-02s  0.00e+00d  [DetectDominanceRelations] 
  3.74e-01s  0.00e+00d  [PresolveToFixPoint] #num_loops=3 #num_dual_strengthening=1 
  3.15e-02s  0.00e+00d  [DetectDominanceRelations] 
  2.39e-01s  0.00e+00d  [PresolveToFixPoint] #num_loops=1 #num_dual_strengthening=1 
[Symmetry] Graph for symmetry has 42'247 nodes and 438'290 arcs.
[Symmetry] Symmetry computation done. time: 0.0126058 dtime: 0.0235235
  2.44e-01s  4.73e-02d  [Probe] #probed=1'168 #new_bounds=1'275 
  2.83e-04s  0.00e+00d  [MaxClique] 
  3.15e-02s  0.00e+00d  [DetectDominanceRelations] 
  3.58e-01s  0.00e+00d  [PresolveToFixPoint] #num_loops=2 #num_dual_strengthening=1 
  1.50e-01s  0.00e+00d  [ProcessAtMostOneAndLinear] 
  3.48e-02s  0.00e+00d  [DetectDuplicateConstraints] #without_enforcements=110 
  4.03e-02s  2.86e-03d  [DetectDominatedLinearConstraints] #relevant_constraints=33'646 #num_inclusions=263 
  4.01e-03s  0.00e+00d  [DetectDifferentVariables] 
  1.03e-02s  6.38e-04d  [ProcessSetPPC] #relevant_constraints=24'415 
  1.09e-03s  1.17e-04d  [FindAlmostIdenticalLinearConstraints] #num_tested_pairs=6'877 
  1.31e-03s  1.07e-03d  [FindBigAtMostOneAndLinearOverlap] 
  1.11e-01s  5.03e-02d  [FindBigVerticalLinearOverlap] #blocks=1'354 #saved_nz=108'245 
  4.89e-03s  1.17e-03d  [FindBigHorizontalLinearOverlap] #linears=18'019 
  2.79e-04s  0.00e+00d  [MergeClauses] 
  2.50e-02s  0.00e+00d  [DetectDominanceRelations] 
  3.62e-01s  0.00e+00d  [PresolveToFixPoint] #num_loops=3 #num_dual_strengthening=1 
  2.46e-03s  0.00e+00d  [ExpandObjective] #entries=15'992 #tight_variables=5'981 #tight_constraints=3'172 

Presolve summary:
  - 273 affine relations were detected.
  - rule 'TODO dual: only one blocking constraint?' was applied 2'354 times.
  - rule 'TODO dual: only one blocking enforced constraint?' was applied 182 times.
  - rule 'TODO dual: only one unspecified blocking constraint?' was applied 149 times.
  - rule 'TODO duplicate: identical constraint with different enforcements' was applied 330 times.
  - rule 'affine: new relation' was applied 273 times.
  - rule 'at_most_one: removed literals' was applied 3 times.
  - rule 'at_most_one: size one' was applied 3 times.
  - rule 'deductions: 2787 stored' was applied 1 time.
  - rule 'dual: fix variable' was applied 48 times.
  - rule 'dual: reduced domain' was applied 108 times.
  - rule 'duplicate: merged rhs of linear constraint' was applied 235 times.
  - rule 'duplicate: removed constraint' was applied 1'123 times.
  - rule 'enforcement: false literal' was applied 18 times.
  - rule 'exactly_one: x and not(x)' was applied 1 time.
  - rule 'incompatible linear: add implication' was applied 165 times.
  - rule 'linear matrix: common vertical rectangle' was applied 3'954 times.
  - rule 'linear: always true' was applied 2'273 times.
  - rule 'linear: doubleton free' was applied 23 times.
  - rule 'linear: empty' was applied 64 times.
  - rule 'linear: extracted enforcement literal' was applied 33'667 times.
  - rule 'linear: fixed or dup variables' was applied 34'550 times.
  - rule 'linear: positive equal one' was applied 7 times.
  - rule 'linear: reduced variable domains' was applied 3'441 times.
  - rule 'linear: remapped using affine relations' was applied 34'733 times.
  - rule 'linear: simplified rhs' was applied 124'060 times.
  - rule 'linear: tightened into equality' was applied 7 times.
  - rule 'linear: variable substitution 1' was applied 23 times.
  - rule 'linear: variable substitution 2' was applied 412 times.
  - rule 'linear: variable substitution 3' was applied 261 times.
  - rule 'no_overlap: inferred from x != y constraints' was applied 1 time.
  - rule 'presolve: 179 unused variables removed.' was applied 1 time.
  - rule 'presolve: iteration' was applied 3 times.
  - rule 'probing: reduced enforced constraint to implication.' was applied 3 times.
  - rule 'symmetry: fixed to false in general orbit' was applied 1 time.

Presolved optimization model '': (model_fingerprint: 0x1da943f516363754)
#Variables: 3'696 (#ints: 17 in objective)
  - 295 Booleans in [0,1]
  - 2'491 different domains in [-25384,27859] with a largest complexity of 25.
#kExactlyOne: 6 (#literals: 18)
#kInterval: 11
#kLinear2: 2'427 (#enforced: 2'322 #multi: 677)
#kLinear3: 9'494 (#enforced: 7'079 #multi: 17)
#kLinearN: 24'412 (#enforced: 22'903) (#terms: 259'991)
#kNoOverlap: 1 (#intervals: 11)

Preloading model.
#Bound   5.92s best:inf   next:[158,17962] initial_domain
[Symmetry] Graph for symmetry has 44'567 nodes and 330'958 arcs.
[Symmetry] Symmetry computation done. time: 0.0102843 dtime: 0.0180133
#Model   5.99s var:3696/3696 constraints:36351/36351

Starting search at 6.01s with 32 workers.
17 full problem subsolvers: [core, default_lp, fixed, lb_tree_search, max_lp, no_lp, objective_lb_search, objective_lb_search_max_lp, objective_lb_search_no_lp, objective_shaving_search_max_lp, objective_shaving_search_no_lp, probing, probing_max_lp, pseudo_costs, quick_restart, quick_restart_no_lp, reduced_costs]
13 first solution subsolvers: [fj_long_default, fj_long_lin_default, fj_long_random, fj_short_default, fj_short_lin_default, fj_short_lin_random, fj_short_random, fs_random(2), fs_random_no_lp, fs_random_quick_restart(2), fs_random_quick_restart_no_lp]
13 incomplete subsolvers: [feasibility_pump, graph_arc_lns, graph_cst_lns, graph_dec_lns, graph_var_lns, rins/rens, rnd_cst_lns, rnd_var_lns, scheduling_intervals_lns, scheduling_precedences_lns, scheduling_time_window_lns, violation_ls(2)]
3 helper subsolvers: [neighborhood_helper, synchronization_agent, update_gap_integral]
#Bound   6.97s best:inf   next:[159,17962] objective_shaving_search_no_lp (vars=3702 csts=36365)
#Bound   6.97s best:inf   next:[312,17962] no_lp (initial_propagation)
#Bound   7.52s best:inf   next:[329,17962] objective_lb_search_no_lp
#1       7.84s best:7711  next:[329,7710] no_lp (fixed_bools=0/361)
#Bound   8.47s best:7711  next:[675,7710] pseudo_costs
#Bound   8.57s best:7711  next:[1047,7710] pseudo_costs
#Bound   8.58s best:7711  next:[1048,7710] pseudo_costs
#Bound   8.69s best:7711  next:[1130,7710] pseudo_costs
#2       8.76s best:6751  next:[1130,6750] no_lp (fixed_bools=0/394)
#Bound   9.20s best:6751  next:[1134,6750] objective_lb_search_max_lp
#3       9.32s best:6743  next:[1134,6742] no_lp (fixed_bools=0/398)
#4       9.39s best:6708  next:[1134,6707] graph_var_lns (d=0.88 s=100 t=0.10 p=1.00 stall=3 h=auto_l0)
#Bound   9.73s best:6708  next:[1135,6707] objective_lb_search_max_lp
#5      10.85s best:6177  next:[1135,6176] quick_restart (fixed_bools=0/365)
#6      11.71s best:6159  next:[1135,6158] quick_restart_no_lp (fixed_bools=0/488)
#7      11.94s best:6150  next:[1135,6149] quick_restart_no_lp (fixed_bools=0/497)
#8      12.29s best:6009  next:[1135,6008] rins_lp_lns (d=0.91 s=129 t=0.10 p=1.00 stall=4 h=auto_l0)
#Bound  12.45s best:6009  next:[1167,6008] reduced_costs
#9      12.99s best:6000  next:[1167,5999] quick_restart_no_lp (fixed_bools=0/580)
#Bound  13.35s best:6000  next:[1168,5999] reduced_costs
#Bound  13.96s best:6000  next:[1169,5999] reduced_costs
#10     14.01s best:5999  next:[1169,5998] violation_ls(batch:8 #solutions_imported:4 #lin_moves:50'729 #lin_evals:200'897 #gen_moves:14'748 #gen_evals:1'666 #comp_moves:3'176 #backtracks:5'781 #weight_updates:1'717)
#11     14.09s best:5996  next:[1169,5995] quick_restart_no_lp (fixed_bools=0/606)
#Bound  14.56s best:5996  next:[1170,5995] reduced_costs
#12     14.60s best:5945  next:[1170,5944] rins_lp_lns (d=0.94 s=144 t=0.10 p=1.00 stall=0 h=auto_l0)
#Bound  14.65s best:5945  next:[1182,5944] objective_lb_search_max_lp
#13     15.07s best:5855  next:[1182,5854] rins_lp_lns (d=0.92 s=172 t=0.10 p=0.83 stall=0 h=auto_l0)
#Bound  15.40s best:5855  next:[1237,5854] objective_lb_search_max_lp
#Bound  17.08s best:5855  next:[1253,5854] objective_lb_search_max_lp
#Bound  19.96s best:5855  next:[1282,5854] objective_lb_search_max_lp
#14     20.36s best:5851  next:[1282,5850] graph_cst_lns (d=0.99 s=207 t=0.10 p=1.00 stall=10 h=folio_rnd)
#15     21.19s best:5672  next:[1282,5671] rins_lp_lns (d=0.94 s=212 t=0.10 p=0.78 stall=0 h=auto_l0)
#16     21.83s best:5618  next:[1282,5617] rins_pump_lns (d=0.92 s=226 t=0.10 p=0.70 stall=0 h=auto_l0)
#Bound  22.66s best:5618  next:[1287,5617] objective_lb_search_max_lp
#17     23.85s best:5591  next:[1287,5590] rnd_var_lns (d=0.99 s=229 t=0.10 p=1.00 stall=4 h=auto_l0)
#18     25.81s best:5571  next:[1287,5570] rnd_var_lns (d=0.99 s=243 t=0.10 p=1.00 stall=0 h=auto_l0)
#19     25.82s best:5570  next:[1287,5569] violation_ls(batch:15 #solutions_imported:10 #lin_moves:60'778 #lin_evals:393'000 #gen_moves:50'754 #gen_evals:6'139 #comp_moves:8'911 #backtracks:20'913 #weight_updates:10'040)
#20     25.83s best:5569  next:[1287,5568] violation_ls(batch:15 #solutions_imported:9 #lin_moves:109'121 #lin_evals:405'751 #gen_moves:14'748 #gen_evals:1'666 #comp_moves:3'176 #backtracks:5'781 #weight_updates:3'655)
#21     27.77s best:5568  next:[1287,5567] violation_ls(batch:16 #solutions_imported:11 #lin_moves:60'778 #lin_evals:402'723 #gen_moves:54'946 #gen_evals:6'606 #comp_moves:9'171 #backtracks:22'879 #weight_updates:10'110)
#22     28.08s best:5554  next:[1287,5553] graph_cst_lns (d=0.99 s=259 t=0.10 p=1.00 stall=0 h=auto_l0)
#23     28.26s best:5447  next:[1287,5446] graph_arc_lns (d=0.99 s=258 t=0.10 p=1.00 stall=0 h=auto_l0)
#24     28.42s best:5383  next:[1287,5382] graph_dec_lns (d=0.99 s=260 t=0.10 p=1.00 stall=2 h=auto_l0)
#Bound  29.67s best:5383  next:[1293,5382] objective_lb_search_max_lp
#25     30.90s best:5162  next:[1293,5161] rins_lp_lns (d=0.94 s=276 t=0.10 p=0.69 stall=0 h=auto_l0)
#26     31.88s best:5143  next:[1293,5142] quick_restart_no_lp (fixed_bools=0/1090)
#Bound  32.77s best:5143  next:[1298,5142] objective_lb_search_max_lp
#27     34.06s best:5140  next:[1298,5139] rnd_cst_lns (d=0.99 s=294 t=0.10 p=0.94 stall=0 h=auto_l0)
#28     34.49s best:5122  next:[1298,5121] graph_var_lns (d=0.99 s=295 t=0.10 p=0.88 stall=0 h=auto_l0)
#29     34.85s best:5121  next:[1298,5120] violation_ls(batch:19 #solutions_imported:14 #lin_moves:70'795 #lin_evals:464'021 #gen_moves:64'554 #gen_evals:7'329 #comp_moves:10'096 #backtracks:27'219 #weight_updates:11'278)
#30     36.43s best:5120  next:[1298,5119] quick_restart_no_lp (fixed_bools=0/1142)
#Bound  37.38s best:5120  next:[1308,5119] objective_lb_search_max_lp
#31     37.40s best:5106  next:[1308,5105] graph_arc_lns (d=1.00 s=298 t=0.10 p=1.00 stall=0 h=auto_l0)
#32     38.40s best:5101  next:[1308,5100] quick_restart_no_lp (fixed_bools=0/1242)
#33     39.04s best:5097  next:[1308,5096] quick_restart_no_lp (fixed_bools=0/1247)
#34     39.43s best:4999  next:[1308,4998] graph_dec_lns (d=1.00 s=312 t=0.10 p=1.00 stall=0 h=auto_l0)
#35     39.71s best:4998  next:[1308,4997] violation_ls(batch:21 #solutions_imported:15 #lin_moves:120'875 #lin_evals:512'197 #gen_moves:44'271 #gen_evals:4'773 #comp_moves:5'470 #backtracks:19'395 #weight_updates:4'586)
#36     40.57s best:4872  next:[1308,4871] rins_pump_lns (d=0.94 s=330 t=0.10 p=0.65 stall=2 h=auto_l0)
#Bound  41.08s best:4872  next:[1309,4871] objective_lb_search_max_lp
#37     42.23s best:4867  next:[1309,4866] quick_restart_no_lp (fixed_bools=0/1337)
#38     42.46s best:4862  next:[1309,4861] quick_restart_no_lp (fixed_bools=0/1342)
#39     42.84s best:4846  next:[1309,4845] quick_restart_no_lp (fixed_bools=0/1347)
#40     43.69s best:4845  next:[1309,4844] rnd_cst_lns (d=1.00 s=334 t=0.10 p=0.89 stall=0 h=auto_l0)
#41     44.05s best:4843  next:[1309,4842] quick_restart_no_lp (fixed_bools=0/1392)
#42     44.86s best:4842  next:[1309,4841] violation_ls(batch:23 #solutions_imported:18 #lin_moves:80'513 #lin_evals:532'685 #gen_moves:80'191 #gen_evals:9'413 #comp_moves:11'760 #backtracks:34'202 #weight_updates:11'757)
#43     44.87s best:4841  next:[1309,4840] violation_ls(batch:23 #solutions_imported:17 #lin_moves:120'900 #lin_evals:530'957 #gen_moves:52'075 #gen_evals:5'725 #comp_moves:6'170 #backtracks:22'945 #weight_updates:4'701)
#44     45.81s best:4774  next:[1309,4773] graph_cst_lns (d=1.00 s=351 t=0.10 p=0.90 stall=0 h=auto_l0)
#45     46.09s best:4516  next:[1309,4515] rins_pump_lns (d=0.94 s=356 t=0.10 p=0.63 stall=1 h=auto_l0)
#Bound  46.25s best:4516  next:[1337,4515] objective_lb_search_max_lp
#46     50.43s best:4508  next:[1337,4507] rnd_var_lns (d=1.00 s=373 t=0.10 p=0.86 stall=0 h=auto_l0)
#47     54.83s best:4463  next:[1337,4462] graph_arc_lns (d=1.00 s=388 t=0.10 p=0.87 stall=0 h=auto_l0)
#48     55.20s best:4462  next:[1337,4461] violation_ls(batch:27 #solutions_imported:21 #lin_moves:110'910 #lin_evals:666'593 #gen_moves:80'191 #gen_evals:9'413 #comp_moves:11'760 #backtracks:34'202 #weight_updates:16'615)
#49     55.26s best:4461  next:[1337,4460] violation_ls(batch:27 #solutions_imported:20 #lin_moves:138'353 #lin_evals:623'845 #gen_moves:61'572 #gen_evals:6'603 #comp_moves:6'392 #backtracks:27'582 #weight_updates:8'696)
#50     57.63s best:4458  next:[1337,4457] rnd_cst_lns (d=1.00 s=410 t=0.10 p=0.80 stall=1 h=auto_l0)
#51     57.91s best:4457  next:[1337,4456] violation_ls(batch:28 #solutions_imported:22 #lin_moves:118'385 #lin_evals:696'310 #gen_moves:80'191 #gen_evals:9'413 #comp_moves:11'760 #backtracks:34'202 #weight_updates:18'072)
#52     57.92s best:4456  next:[1337,4455] violation_ls(batch:28 #solutions_imported:21 #lin_moves:138'353 #lin_evals:624'073 #gen_moves:61'679 #gen_evals:6'611 #comp_moves:6'395 #backtracks:27'634 #weight_updates:8'696)
#53     59.82s best:4425  next:[1337,4424] rnd_var_lns (d=1.00 s=421 t=0.10 p=0.81 stall=0 h=auto_l0)
#54     60.63s best:4424  next:[1337,4423] violation_ls(batch:29 #solutions_imported:23 #lin_moves:119'163 #lin_evals:699'227 #gen_moves:80'191 #gen_evals:9'413 #comp_moves:11'760 #backtracks:34'202 #weight_updates:18'245)
#55     60.64s best:4423  next:[1337,4422] violation_ls(batch:29 #solutions_imported:22 #lin_moves:138'365 #lin_evals:624'157 #gen_moves:61'679 #gen_evals:6'611 #comp_moves:6'395 #backtracks:27'634 #weight_updates:8'707)
#56     63.83s best:4422  next:[1337,4421] violation_ls(batch:30 #solutions_imported:24 #lin_moves:119'163 #lin_evals:699'372 #gen_moves:80'267 #gen_evals:9'416 #comp_moves:11'762 #backtracks:34'239 #weight_updates:18'245)
#57     63.86s best:4421  next:[1337,4420] violation_ls(batch:30 #solutions_imported:23 #lin_moves:138'892 #lin_evals:626'229 #gen_moves:61'679 #gen_evals:6'611 #comp_moves:6'395 #backtracks:27'634 #weight_updates:8'833)
#58     66.85s best:4420  next:[1337,4419] violation_ls(batch:31 #solutions_imported:24 #lin_moves:145'829 #lin_evals:653'811 #gen_moves:61'679 #gen_evals:6'611 #comp_moves:6'395 #backtracks:27'634 #weight_updates:10'375)
#59     68.24s best:4384  next:[1337,4383] rnd_cst_lns (d=1.00 s=446 t=0.10 p=0.79 stall=0 h=auto_l0)
#60     68.74s best:4361  next:[1337,4360] graph_dec_lns (d=1.00 s=450 t=0.10 p=0.79 stall=0 h=auto_l0)
#61     69.29s best:4360  next:[1337,4359] violation_ls(batch:32 #solutions_imported:25 #lin_moves:150'406 #lin_evals:672'057 #gen_moves:61'679 #gen_evals:6'611 #comp_moves:6'395 #backtracks:27'634 #weight_updates:11'297)
#62     71.10s best:4333  next:[1337,4332] rins_lp_lns (d=0.91 s=479 t=0.10 p=0.55 stall=0 h=auto_l0)
#63     73.54s best:4329  next:[1337,4328] graph_var_lns (d=1.00 s=472 t=0.10 p=0.77 stall=0 h=auto_l0)
#64     74.82s best:4325  next:[1337,4324] graph_arc_lns (d=1.00 s=485 t=0.10 p=0.74 stall=0 h=auto_l0)
#65     75.60s best:4300  next:[1337,4299] graph_var_lns (d=1.00 s=484 t=0.10 p=0.77 stall=0 h=auto_l0)
#66     76.51s best:4296  next:[1337,4295] quick_restart_no_lp (fixed_bools=0/1745)
#67     77.03s best:4294  next:[1337,4293] violation_ls(batch:35 #solutions_imported:29 #lin_moves:145'622 #lin_evals:835'277 #gen_moves:90'759 #gen_evals:10'216 #comp_moves:11'975 #backtracks:39'378 #weight_updates:21'882)
#68     77.05s best:4292  next:[1337,4291] violation_ls(batch:35 #solutions_imported:28 #lin_moves:169'710 #lin_evals:737'305 #gen_moves:61'680 #gen_evals:6'611 #comp_moves:6'396 #backtracks:27'634 #weight_updates:11'993)
#69     78.94s best:4290  next:[1337,4289] violation_ls(batch:36 #solutions_imported:30 #lin_moves:145'623 #lin_evals:835'294 #gen_moves:90'759 #gen_evals:10'216 #comp_moves:11'975 #backtracks:39'378 #weight_updates:21'882)
#70     78.97s best:4289  next:[1337,4288] violation_ls(batch:36 #solutions_imported:29 #lin_moves:169'711 #lin_evals:737'321 #gen_moves:61'680 #gen_evals:6'611 #comp_moves:6'396 #backtracks:27'634 #weight_updates:11'993)
#71     79.22s best:4284  next:[1337,4283] rnd_var_lns (d=1.00 s=506 t=0.10 p=0.73 stall=0 h=auto_l0)
#72     80.19s best:4276  next:[1337,4275] quick_restart_no_lp (fixed_bools=0/1798)
#Bound  82.75s best:4276  next:[1339,4275] objective_lb_search_max_lp
#73     85.47s best:4243  next:[1339,4242] rnd_cst_lns (d=1.00 s=532 t=0.10 p=0.75 stall=1 h=auto_l0)
#Bound  95.41s best:4243  next:[1353,4242] objective_lb_search_max_lp
#74    101.90s best:4186  next:[1353,4185] rnd_var_lns (d=1.00 s=609 t=0.10 p=0.71 stall=0 h=auto_l0)
#75    103.81s best:4185  next:[1353,4184] violation_ls(batch:45 #solutions_imported:33 #lin_moves:165'230 #lin_evals:999'627 #gen_moves:121'128 #gen_evals:15'545 #comp_moves:16'554 #backtracks:52'268 #weight_updates:22'454)
#76    103.90s best:4184  next:[1353,4183] violation_ls(batch:45 #solutions_imported:32 #lin_moves:255'013 #lin_evals:1'129'303 #gen_moves:61'680 #gen_evals:6'611 #comp_moves:6'396 #backtracks:27'634 #weight_updates:13'614)
#77    104.66s best:4183  next:[1353,4182] quick_restart_no_lp (fixed_bools=0/2054)
#78    105.06s best:4181  next:[1353,4180] graph_dec_lns (d=1.00 s=627 t=0.10 p=0.70 stall=2 h=auto_l0)
#79    107.26s best:4180  next:[1353,4179] violation_ls(batch:46 #solutions_imported:33 #lin_moves:255'013 #lin_evals:1'151'270 #gen_moves:70'613 #gen_evals:7'293 #comp_moves:6'943 #backtracks:31'827 #weight_updates:13'736)
#80    108.13s best:4179  next:[1353,4178] quick_restart_no_lp (fixed_bools=0/2105)
#81    116.98s best:4159  next:[1353,4158] quick_restart_no_lp (fixed_bools=0/2156)
#82    117.68s best:4158  next:[1353,4157] violation_ls(batch:50 #solutions_imported:35 #lin_moves:289'540 #lin_evals:1'272'946 #gen_moves:70'613 #gen_evals:7'293 #comp_moves:6'943 #backtracks:31'827 #weight_updates:14'847)
#83    118.65s best:4157  next:[1353,4156] quick_restart_no_lp (fixed_bools=0/2166)
#84    120.26s best:4131  next:[1353,4130] rins_lp_lns (d=0.93 s=706 t=0.10 p=0.54 stall=5 h=auto_l0)
#85    122.22s best:4098  next:[1353,4097] graph_dec_lns (d=1.00 s=702 t=0.10 p=0.67 stall=0 h=auto_l0)
#86    123.03s best:4095  next:[1353,4094] quick_restart_no_lp (fixed_bools=0/2212)
#87    123.14s best:4094  next:[1353,4093] violation_ls(batch:52 #solutions_imported:38 #lin_moves:174'147 #lin_evals:1'143'311 #gen_moves:166'700 #gen_evals:19'494 #comp_moves:18'796 #backtracks:73'926 #weight_updates:25'209)
#88    123.15s best:4093  next:[1353,4092] violation_ls(batch:52 #solutions_imported:37 #lin_moves:297'922 #lin_evals:1'306'627 #gen_moves:70'670 #gen_evals:7'294 #comp_moves:6'946 #backtracks:31'854 #weight_updates:16'465)
#89    123.97s best:4012  next:[1353,4011] rins_pump_lns (d=0.94 s=718 t=0.10 p=0.55 stall=0 h=auto_l0)
#90    133.07s best:4000  next:[1353,3999] graph_arc_lns (d=1.00 s=749 t=0.10 p=0.67 stall=0 h=auto_l0)
#91    134.38s best:3975  next:[1353,3974] graph_dec_lns (d=1.00 s=764 t=0.10 p=0.66 stall=3 h=auto_l0)
#92    138.42s best:3966  next:[1353,3965] graph_dec_lns (d=1.00 s=776 t=0.10 p=0.65 stall=0 h=auto_l0)
#93    141.69s best:3965  next:[1353,3964] violation_ls(batch:59 #solutions_imported:42 #lin_moves:203'839 #lin_evals:1'319'907 #gen_moves:192'737 #gen_evals:20'942 #comp_moves:19'684 #backtracks:86'498 #weight_updates:35'759)
#94    141.70s best:3964  next:[1353,3963] violation_ls(batch:59 #solutions_imported:42 #lin_moves:307'705 #lin_evals:1'463'036 #gen_moves:113'645 #gen_evals:10'617 #comp_moves:10'562 #backtracks:51'522 #weight_updates:17'011)
#95    141.85s best:3960  next:[1353,3959] rins_pump_lns (d=0.93 s=805 t=0.10 p=0.54 stall=1 h=auto_l0)
#96    145.48s best:3956  next:[1353,3955] graph_arc_lns (d=1.00 s=811 t=0.10 p=0.64 stall=0 h=auto_l0)
#97    151.55s best:3952  next:[1353,3951] graph_var_lns (d=1.00 s=835 t=0.10 p=0.64 stall=1 h=auto_l0)
#98    152.95s best:3882  next:[1353,3881] rins_pump_lns (d=0.93 s=855 t=0.10 p=0.53 stall=3 h=auto_l0)
#Bound 153.63s best:3882  next:[1367,3881] objective_lb_search_max_lp
#Bound 296.59s best:3882  next:[1395,3881] objective_lb_search_max_lp
#Bound 311.55s best:3882  next:[1411,3881] objective_lb_search_max_lp
#Bound 334.84s best:3882  next:[1413,3881] objective_lb_search_max_lp
#Bound 359.28s best:3882  next:[1415,3881] objective_lb_search_max_lp
#Bound 381.33s best:3882  next:[1419,3881] objective_lb_search_max_lp
#Bound 435.84s best:3882  next:[1423,3881] objective_lb_search_max_lp
#Bound 439.07s best:3882  next:[1427,3881] objective_lb_search_max_lp
#Bound 457.56s best:3882  next:[1441,3881] objective_lb_search_max_lp
#Bound 501.62s best:3882  next:[1447,3881] objective_lb_search_max_lp
#Bound 572.38s best:3882  next:[1458,3881] objective_lb_search_max_lp
#Bound 944.36s best:3882  next:[1460,3881] objective_lb_search_max_lp
#Bound 1193.98s best:3882  next:[1465,3881] objective_lb_search_max_lp
#Bound 1250.94s best:3882  next:[1472,3881] objective_lb_search_max_lp
#Bound 1381.88s best:3882  next:[1474,3881] objective_lb_search_max_lp
#Bound 2377.78s best:3882  next:[1475,3881] objective_lb_search_max_lp
#Bound 2470.45s best:3882  next:[1480,3881] objective_lb_search_max_lp
#Bound 2526.95s best:3882  next:[1483,3881] objective_lb_search_max_lp
#Bound 2655.93s best:3882  next:[1487,3881] objective_lb_search_max_lp
#Bound 2878.85s best:3882  next:[1489,3881] objective_lb_search_max_lp
#Bound 3360.30s best:3882  next:[1490,3881] objective_lb_search_max_lp
#Bound 4160.89s best:3882  next:[1494,3881] objective_lb_search_max_lp
#Bound 4244.94s best:3882  next:[1496,3881] objective_lb_search_max_lp
#Bound 4277.64s best:3882  next:[1497,3881] objective_lb_search_max_lp
#Bound 4381.39s best:3882  next:[1500,3881] objective_lb_search_max_lp
#Bound 5085.55s best:3882  next:[1502,3881] objective_lb_search_max_lp
#Bound 5401.08s best:3882  next:[1503,3881] objective_lb_search_max_lp
#Bound 6112.95s best:3882  next:[1505,3881] objective_lb_search_max_lp
#Bound 6659.58s best:3882  next:[1506,3881] objective_lb_search_max_lp
#Bound 7347.52s best:3882  next:[1507,3881] objective_lb_search_max_lp
#Bound 8977.49s best:3882  next:[1508,3881] lb_tree_search (nodes=230599/230649 rc=150 decisions=1033320 @root=224 restarts=13) 
#Bound 9476.46s best:3882  next:[1509,3881] lb_tree_search (nodes=236666/236717 rc=153 decisions=1083614 @root=233 restarts=13) 
#Bound 10098.53s best:3882  next:[1510,3881] objective_lb_search_max_lp
#Bound 10397.38s best:3882  next:[1511,3881] objective_lb_search_max_lp
#Bound 11049.15s best:3882  next:[1512,3881] objective_lb_search_max_lp
#Bound 11742.26s best:3882  next:[1514,3881] objective_lb_search_max_lp
#Bound 12631.59s best:3882  next:[1516,3881] objective_lb_search_max_lp
#Bound 13837.71s best:3882  next:[1517,3881] lb_tree_search (nodes=276120/276180 rc=187 decisions=1455353 @root=309 restarts=13) 
#Bound 14345.12s best:3882  next:[1518,3881] objective_lb_search_max_lp
#Bound 15105.15s best:3882  next:[1520,3881] objective_lb_search_max_lp
#99    16036.07s best:3875  next:[1520,3874] rnd_var_lns (d=1.00 s=70274 t=0.10 p=0.50 stall=1 h=auto_l0)
#100   16039.45s best:3874  next:[1520,3873] violation_ls(batch:5641 #solutions_imported:47 #perturbations:55 #lin_moves:29'108'781 #lin_evals:226'988'021 #gen_moves:2'965'520 #gen_evals:3'115'856 #comp_moves:131'102 #backtracks:1'416'747 #weight_updates:250'105)
#101   16041.81s best:3836  next:[1520,3835] graph_arc_lns (d=1.00 s=70302 t=0.10 p=0.50 stall=1 h=auto_l0)
#Bound 16280.51s best:3836  next:[1521,3835] lb_tree_search (nodes=295931/295993 rc=209 decisions=1674658 @root=352 restarts=13) 
#Bound 16283.95s best:3836  next:[1522,3835] objective_lb_search_max_lp
#Bound 16414.37s best:3836  next:[1523,3835] objective_lb_search_max_lp
#102   16758.86s best:3825  next:[1523,3824] graph_cst_lns (d=1.00 s=73498 t=0.10 p=0.50 stall=3 h=auto_l0)
#103   16760.42s best:3754  next:[1523,3753] rins_lp_lns (d=0.93 s=73516 t=0.11 p=0.50 stall=4 h=auto_l0)
#104   16824.42s best:3752  next:[1523,3751] graph_dec_lns (d=1.00 s=73784 t=0.10 p=0.50 stall=3 h=auto_l0)
#105   17429.13s best:3711  next:[1523,3710] rins_lp_lns (d=0.93 s=76498 t=0.11 p=0.50 stall=21 h=auto_l0)
#106   17436.78s best:3697  next:[1523,3696] rnd_var_lns (d=1.00 s=76526 t=0.10 p=0.50 stall=6 h=auto_l0)
#107   17557.80s best:3693  next:[1523,3692] rnd_var_lns (d=1.00 s=77085 t=0.10 p=0.50 stall=1 h=auto_l0)
#Bound 17678.22s best:3693  next:[1524,3692] objective_lb_search_max_lp
#108   17699.59s best:3681  next:[1524,3680] rnd_var_lns (d=1.00 s=77733 t=0.10 p=0.50 stall=3 h=auto_l0)
#Bound 18440.27s best:3681  next:[1525,3680] objective_lb_search_max_lp
#Bound 19419.32s best:3681  next:[1526,3680] lb_tree_search (nodes=321946/322012 rc=244 decisions=1945210 @root=407 restarts=13) 
#Bound 19623.85s best:3681  next:[1527,3680] objective_lb_search_max_lp
#Bound 19990.49s best:3681  next:[1528,3680] objective_lb_search_max_lp
#Bound 21102.11s best:3681  next:[1530,3680] objective_lb_search_max_lp
#Bound 22343.50s best:3681  next:[1532,3680] objective_lb_search_max_lp
#Bound 22364.74s best:3681  next:[1535,3680] objective_lb_search_max_lp
#Bound 22489.95s best:3681  next:[1536,3680] objective_lb_search_max_lp
#Bound 22582.83s best:3681  next:[1541,3680] objective_lb_search_max_lp
#Bound 22663.22s best:3681  next:[1542,3680] objective_lb_search_max_lp
#Bound 22729.74s best:3681  next:[1544,3680] objective_lb_search_max_lp
#Bound 30000.73s best:3681  next:[1545,3680] lb_tree_search (nodes=299432/299432 rc=397 decisions=2999937 @root=617 restarts=14) 
#Bound 30751.94s best:3681  next:[1546,3680] lb_tree_search (nodes=308229/308230 rc=400 decisions=3069854 @root=632 restarts=14) 
#Bound 31542.66s best:3681  next:[1547,3680] lb_tree_search (nodes=316860/316861 rc=405 decisions=3143304 @root=645 restarts=14) 
#Bound 32416.33s best:3681  next:[1548,3680] lb_tree_search (nodes=325378/325380 rc=411 decisions=3219699 @root=660 restarts=14) 
#Bound 33256.74s best:3681  next:[1549,3680] lb_tree_search (nodes=332563/332567 rc=419 decisions=3292917 @root=675 restarts=14) 
#Bound 34174.69s best:3681  next:[1550,3680] lb_tree_search (nodes=341056/341060 rc=420 decisions=3373275 @root=690 restarts=14) 
#Bound 35136.72s best:3681  next:[1551,3680] lb_tree_search (nodes=349819/349823 rc=430 decisions=3455315 @root=707 restarts=14) 
#Bound 36147.01s best:3681  next:[1552,3680] lb_tree_search (nodes=358600/358604 rc=438 decisions=3538520 @root=724 restarts=14) 
#Bound 37140.33s best:3681  next:[1553,3680] lb_tree_search (nodes=367754/367758 rc=445 decisions=3622717 @root=743 restarts=14) 
#Bound 38198.00s best:3681  next:[1554,3680] lb_tree_search (nodes=376573/376577 rc=452 decisions=3708238 @root=760 restarts=14) 
#Bound 39129.03s best:3681  next:[1555,3680] lb_tree_search (nodes=384856/384860 rc=463 decisions=3791509 @root=777 restarts=14) 
#Bound 40079.21s best:3681  next:[1556,3680] lb_tree_search (nodes=392702/392706 rc=467 decisions=3876706 @root=794 restarts=14) 
#Bound 41201.15s best:3681  next:[1557,3680] lb_tree_search (nodes=401343/401347 rc=477 decisions=3969763 @root=815 restarts=14) 
#Bound 42293.21s best:3681  next:[1558,3680] lb_tree_search (nodes=409826/409830 rc=484 decisions=4060966 @root=832 restarts=14) 
#Bound 43415.82s best:3681  next:[1559,3680] lb_tree_search (nodes=418903/418907 rc=494 decisions=4153137 @root=849 restarts=14) 
#Bound 44457.14s best:3681  next:[1560,3680] lb_tree_search (nodes=427380/427384 rc=502 decisions=4242816 @root=868 restarts=14) 
#Bound 45540.88s best:3681  next:[1561,3680] lb_tree_search (nodes=435790/435794 rc=510 decisions=4333304 @root=885 restarts=14) 
#Bound 46667.24s best:3681  next:[1562,3680] lb_tree_search (nodes=444191/444195 rc=514 decisions=4426400 @root=904 restarts=14) 
#Bound 47814.53s best:3681  next:[1563,3680] lb_tree_search (nodes=451641/451645 rc=529 decisions=4520323 @root=921 restarts=14) 
#Bound 49007.04s best:3681  next:[1564,3680] lb_tree_search (nodes=460949/460954 rc=543 decisions=4625323 @root=942 restarts=14) 
#Bound 50192.77s best:3681  next:[1565,3680] lb_tree_search (nodes=470375/470380 rc=552 decisions=4728952 @root=961 restarts=14) 
#Bound 51436.69s best:3681  next:[1566,3680] lb_tree_search (nodes=479808/479813 rc=568 decisions=4832935 @root=982 restarts=14) 
#Bound 52622.64s best:3681  next:[1567,3680] lb_tree_search (nodes=488572/488577 rc=576 decisions=4932950 @root=1003 restarts=14) 
#Bound 54029.62s best:3681  next:[1568,3680] lb_tree_search (nodes=497909/497914 rc=596 decisions=5040640 @root=1024 restarts=14) 
#Bound 55400.97s best:3681  next:[1569,3680] lb_tree_search (nodes=507745/507750 rc=615 decisions=5156260 @root=1047 restarts=14) 
#Bound 56699.39s best:3681  next:[1570,3680] lb_tree_search (nodes=515729/515734 rc=626 decisions=5264915 @root=1068 restarts=14) 
#Bound 58084.89s best:3681  next:[1571,3680] lb_tree_search (nodes=525502/525507 rc=645 decisions=5380585 @root=1091 restarts=14) 
#Bound 59530.13s best:3681  next:[1572,3680] lb_tree_search (nodes=535207/535212 rc=662 decisions=5497423 @root=1114 restarts=14) 
#Bound 60915.29s best:3681  next:[1573,3680] lb_tree_search (nodes=544111/544116 rc=693 decisions=5610974 @root=1137 restarts=14) 
#Bound 62418.45s best:3681  next:[1574,3680] lb_tree_search (nodes=554054/554059 rc=714 decisions=5735795 @root=1162 restarts=14) 
#Bound 63960.17s best:3681  next:[1575,3680] lb_tree_search (nodes=564338/564343 rc=730 decisions=5858733 @root=1187 restarts=14) 
#Bound 65371.98s best:3681  next:[1576,3680] lb_tree_search (nodes=573603/573608 rc=756 decisions=5976645 @root=1210 restarts=14) 
#Bound 65962.67s best:3681  next:[1577,3680] objective_lb_search_max_lp
#Bound 67295.88s best:3681  next:[1578,3680] objective_lb_search_max_lp
#Bound 67553.98s best:3681  next:[1579,3680] objective_lb_search_max_lp
#Bound 68813.59s best:3681  next:[1580,3680] objective_lb_search_max_lp
#Bound 69219.46s best:3681  next:[1581,3680] objective_lb_search_max_lp
#Bound 69508.96s best:3681  next:[1582,3680] objective_lb_search_max_lp
#Bound 70216.21s best:3681  next:[1583,3680] objective_lb_search_max_lp
#Bound 70388.89s best:3681  next:[1586,3680] objective_lb_search_max_lp
#Bound 71643.42s best:3681  next:[1587,3680] objective_lb_search_max_lp
#Bound 72516.38s best:3681  next:[1588,3680] objective_lb_search_max_lp
#Bound 73903.26s best:3681  next:[1589,3680] objective_lb_search_max_lp
#Bound 76503.90s best:3681  next:[1590,3680] objective_lb_search_max_lp
#Bound 79253.20s best:3681  next:[1591,3680] lb_tree_search (nodes=709729/709770 rc=1165 decisions=7281289 @root=1470 restarts=14) 
#Bound 80835.62s best:3681  next:[1592,3680] lb_tree_search (nodes=718504/718547 rc=1188 decisions=7414582 @root=1497 restarts=14) 
#Bound 82406.66s best:3681  next:[1593,3680] lb_tree_search (nodes=726625/726669 rc=1214 decisions=7546465 @root=1522 restarts=14) 
#Bound 83946.60s best:3681  next:[1594,3680] lb_tree_search (nodes=734017/734061 rc=1231 decisions=7676499 @root=1549 restarts=14) 
#Bound 84070.28s best:3681  next:[1595,3680] objective_lb_search_max_lp
#Bound 85153.96s best:3681  next:[1596,3680] objective_lb_search_max_lp
#Bound 85681.93s best:3681  next:[1600,3680] objective_lb_search_max_lp

Task timing                                  n [     min,      max]      avg      dev     time         n [     min,      max]      avg      dev    dtime
                             'core':         1 [  24.00h,   24.00h]   24.00h   0.00ns   24.00h         1 [  11.61h,   11.61h]   11.61h   0.00ns   11.61h
                       'default_lp':         1 [  24.00h,   24.00h]   24.00h   0.00ns   24.00h         1 [   2.64h,    2.64h]    2.64h   0.00ns    2.64h
                 'feasibility_pump':     14061 [139.50ms,   56.57s]    6.14s 897.53ms   23.99h     14060 [ 32.08ms,   15.83s] 595.75ms 129.37ms    2.33h
                            'fixed':         1 [  24.00h,   24.00h]   24.00h   0.00ns   24.00h         1 [   1.74h,    1.74h]    1.74h   0.00ns    1.74h
                  'fj_long_default':         5 [155.03ms, 612.61ms] 261.81ms 176.04ms    1.31s         5 [178.81ms, 219.60ms] 191.15ms  14.79ms 955.77ms
              'fj_long_lin_default':         6 [147.57ms, 422.74ms] 217.84ms  96.31ms    1.31s         6 [183.15ms, 226.22ms] 208.90ms  14.10ms    1.25s
                   'fj_long_random':         4 [156.38ms, 776.06ms] 326.89ms 259.76ms    1.31s         4 [175.74ms, 233.20ms] 194.48ms  22.87ms 777.93ms
                 'fj_short_default':         8 [160.01ms, 521.52ms] 213.25ms 116.81ms    1.71s         8 [202.23ms, 217.86ms] 211.27ms   5.73ms    1.69s
             'fj_short_lin_default':         2 [240.51ms,    1.08s] 658.16ms 417.65ms    1.32s         2 [200.48ms, 245.81ms] 223.14ms  22.66ms 446.29ms
              'fj_short_lin_random':         2 [189.30ms,    1.03s] 611.52ms 422.22ms    1.22s         2 [202.65ms, 210.25ms] 206.45ms   3.80ms 412.90ms
                  'fj_short_random':         3 [166.73ms, 974.73ms] 439.42ms 378.54ms    1.32s         3 [193.82ms, 209.81ms] 203.37ms   6.89ms 610.11ms
                        'fs_random':         1 [   1.72s,    1.72s]    1.72s   0.00ns    1.72s         1 [ 24.73ms,  24.73ms]  24.73ms   0.00ns  24.73ms
                        'fs_random':         1 [   1.74s,    1.74s]    1.74s   0.00ns    1.74s         1 [  8.55ms,   8.55ms]   8.55ms   0.00ns   8.55ms
                  'fs_random_no_lp':         1 [   1.73s,    1.73s]    1.73s   0.00ns    1.73s         1 [ 17.39ms,  17.39ms]  17.39ms   0.00ns  17.39ms
          'fs_random_quick_restart':         1 [   1.72s,    1.72s]    1.72s   0.00ns    1.72s         1 [  3.57ms,   3.57ms]   3.57ms   0.00ns   3.57ms
          'fs_random_quick_restart':         1 [   1.73s,    1.73s]    1.73s   0.00ns    1.73s         1 [  8.65ms,   8.65ms]   8.65ms   0.00ns   8.65ms
    'fs_random_quick_restart_no_lp':         1 [   1.73s,    1.73s]    1.73s   0.00ns    1.73s         1 [ 16.49ms,  16.49ms]  16.49ms   0.00ns  16.49ms
                    'graph_arc_lns':     33005 [202.83ms,    9.62s]    3.68s 881.74ms   33.74h     32977 [ 18.73us, 200.81ms]  71.51ms  34.78ms   39.30m
                    'graph_cst_lns':     33005 [138.09ms,    9.47s]    3.79s 908.50ms   34.78h     32973 [ 10.00ns, 200.87ms]  69.79ms  36.63ms   38.35m
                    'graph_dec_lns':     33005 [186.31ms,    9.62s]    3.69s 869.49ms   33.80h     32972 [ 10.00ns, 201.34ms]  71.22ms  35.23ms   39.14m
                    'graph_var_lns':     33005 [138.00ms,    8.52s]    3.54s 920.38ms   32.45h     32975 [ 10.00ns, 201.39ms]  70.05ms  36.77ms   38.50m
                   'lb_tree_search':         1 [  24.00h,   24.00h]   24.00h   0.00ns   24.00h         1 [  11.83h,   11.83h]   11.83h   0.00ns   11.83h
                           'max_lp':         1 [  24.00h,   24.00h]   24.00h   0.00ns   24.00h         1 [   2.76h,    2.76h]    2.76h   0.00ns    2.76h
                            'no_lp':         1 [  24.00h,   24.00h]   24.00h   0.00ns   24.00h         1 [   1.50h,    1.50h]    1.50h   0.00ns    1.50h
              'objective_lb_search':         1 [  24.00h,   24.00h]   24.00h   0.00ns   24.00h         1 [   2.93h,    2.93h]    2.93h   0.00ns    2.93h
       'objective_lb_search_max_lp':         1 [  24.00h,   24.00h]   24.00h   0.00ns   24.00h         1 [   2.72h,    2.72h]    2.72h   0.00ns    2.72h
        'objective_lb_search_no_lp':         1 [  24.00h,   24.00h]   24.00h   0.00ns   24.00h         1 [  58.89m,   58.89m]   58.89m   0.00ns   58.89m
  'objective_shaving_search_max_lp':       127 [128.27ms,    2.02h]   11.34m   13.82m   24.00h       117 [ 32.67ms,    8.16m]   43.97s   56.24s    1.43h
   'objective_shaving_search_no_lp':       126 [126.61ms,    2.02h]   11.43m   13.84m   24.00h       117 [ 32.32ms,    2.76m]   17.61s   19.66s   34.33m
                          'probing':         1 [  24.00h,   24.00h]   24.00h   0.00ns   24.00h         1 [   4.56h,    4.56h]    4.56h   0.00ns    4.56h
                   'probing_max_lp':         1 [  24.00h,   24.00h]   24.00h   0.00ns   24.00h         1 [   3.26h,    3.26h]    3.26h   0.00ns    3.26h
                     'pseudo_costs':         1 [  24.00h,   24.00h]   24.00h   0.00ns   24.00h         1 [   2.18h,    2.18h]    2.18h   0.00ns    2.18h
                    'quick_restart':         1 [  24.00h,   24.00h]   24.00h   0.00ns   24.00h         1 [   4.03h,    4.03h]    4.03h   0.00ns    4.03h
              'quick_restart_no_lp':         1 [  24.00h,   24.00h]   24.00h   0.00ns   24.00h         1 [   1.78h,    1.78h]    1.78h   0.00ns    1.78h
                    'reduced_costs':         1 [  24.00h,   24.00h]   24.00h   0.00ns   24.00h         1 [   3.14h,    3.14h]    3.14h   0.00ns    3.14h
                        'rins/rens':     33005 [892.53us,    4.58s]    1.17s 774.48ms   10.71h     28877 [ 10.00ns, 161.71ms]  82.33ms  50.82ms   39.63m
                      'rnd_cst_lns':     33005 [161.92ms,    9.34s]    3.73s 888.24ms   34.20h     32967 [ 10.00ns, 200.97ms]  70.06ms  36.40ms   38.49m
                      'rnd_var_lns':     33005 [ 99.63ms,    9.09s]    3.61s 860.77ms   33.13h     32983 [ 10.00ns, 201.03ms]  70.33ms  35.89ms   38.66m
         'scheduling_intervals_lns':     33005 [   1.06s,    8.83s]    4.31s 510.34ms   39.47h     33000 [  3.90ms, 203.37ms] 101.12ms   1.38ms   55.62m
       'scheduling_precedences_lns':     33005 [736.89ms,   10.37s]    4.36s 516.45ms   40.00h     32999 [100.00ms, 202.98ms] 101.13ms   1.27ms   55.62m
       'scheduling_time_window_lns':     33005 [   1.05s,   11.49s]    4.31s 513.88ms   39.48h     33002 [100.00ms, 200.51ms] 101.12ms 822.44us   55.62m
                     'violation_ls':     33005 [  6.36ms, 696.83ms] 207.53ms  56.77ms    1.90h     33005 [970.00ns, 407.08ms] 192.90ms  41.55ms    1.77h
                     'violation_ls':     33005 [  8.34ms, 804.61ms] 223.78ms  64.24ms    2.05h     33005 [  1.43us, 491.11ms] 210.26ms  48.84ms    1.93h

Search stats                          Bools  Conflicts    Branches   Restarts      BoolPropag   IntegerPropag
                           'core':   22'256  3'020'626   5'265'194     67'920  19'150'370'265  21'732'147'233
                     'default_lp':   23'177  1'203'224  17'172'278    705'490   3'433'045'908  17'505'588'778
                          'fixed':    2'290  4'257'171  15'704'493      1'348   1'367'361'848  24'748'429'237
                      'fs_random':      295          0         593        590              36         165'135
                      'fs_random':      295          0         599        590              36         165'753
                'fs_random_no_lp':      328         23         630        590             816         247'574
        'fs_random_quick_restart':      295          0         590        590              36         164'395
        'fs_random_quick_restart':      295          0         593        590              36         165'605
  'fs_random_quick_restart_no_lp':      295          1         836        590              43         248'594
                 'lb_tree_search':      350        963  17'676'213  3'947'333      67'238'996  16'843'142'947
                         'max_lp':    8'447  1'174'878  17'526'371  1'336'816   1'836'984'557  20'391'342'211
                          'no_lp':    7'263  1'958'135  11'036'000    694'465   1'831'742'286  23'840'748'916
            'objective_lb_search':    8'627    437'136  13'164'175  1'369'723   1'106'375'494  15'827'882'704
     'objective_lb_search_max_lp':    1'746    524'871   6'698'754  1'162'098     237'662'150  15'757'810'015
      'objective_lb_search_no_lp':    1'435    768'875   3'751'571    679'702     130'297'904  14'916'325'968
                        'probing':    7'152      6'215      90'748     48'587       3'589'624      64'354'764
                 'probing_max_lp':    7'152      6'197     107'873     54'342       4'053'688      72'623'257
                   'pseudo_costs':      442    965'133   8'301'532  2'293'408     104'668'997  18'988'797'523
                  'quick_restart':   24'199    511'362  20'909'654    301'921   4'097'665'806  14'434'927'797
            'quick_restart_no_lp':   29'279  1'607'965  13'767'626    219'477   8'503'914'702  21'886'024'748
                  'reduced_costs':  140'213  1'894'993  17'703'121    327'305  27'069'499'830  19'784'760'354

SAT stats                           ClassicMinim  LitRemoved   LitLearned  LitForgotten  Subsumed   MClauses  MDecisions  MLitTrue  MSubsumed  MLitRemoved  MReused
                           'core':     2'899'753  55'428'166   51'448'073    38'127'168     5'150     30'242     150'023         0        841        3'416      385
                     'default_lp':     1'056'718  11'511'112   28'643'835    21'846'321     5'569    250'479   2'555'604         0     50'568      427'011   44'662
                          'fixed':     3'891'220   8'252'236  132'055'570   131'341'834       141         76         795         0         15           93       44
                      'fs_random':             0           0            0             0         0          0           0         0          0            0        0
                      'fs_random':             0           0            0             0         0          0           0         0          0            0        0
                'fs_random_no_lp':             1           3          251             0         0          0           0         0          0            0        0
        'fs_random_quick_restart':             0           0            0             0         0          0           0         0          0            0        0
        'fs_random_quick_restart':             0           0            0             0         0          0           0         0          0            0        0
  'fs_random_quick_restart_no_lp':             0           0            2             0         0          0           0         0          0            0        0
                 'lb_tree_search':             0           0        2'958             0         0  1'768'150   8'907'588         0        143          537  153'205
                         'max_lp':     1'025'167   8'946'460   25'037'928    20'857'222     6'777    413'364   3'688'053         0     31'078      249'586   59'747
                          'no_lp':     1'810'951  16'369'025   46'894'983    37'999'503     7'941    156'337   1'644'141         0     14'897      115'719   30'583
            'objective_lb_search':       395'087   3'171'042    7'640'650     3'392'934     3'488    387'164   3'068'266         0     12'999       91'641   89'347
     'objective_lb_search_max_lp':       473'196   3'141'172    6'871'771     2'070'416     4'695    222'568   2'622'967         0     13'996      110'149   52'496
      'objective_lb_search_no_lp':       712'964   7'147'737   15'490'250     7'577'655     5'187    232'307   1'632'735         0      3'078       23'857   35'079
                        'probing':             0           0        6'217             0         0          0           0         0          0            0        0
                 'probing_max_lp':             0           0        6'201             0         0          0           0         0          0            0        0
                   'pseudo_costs':       850'346   4'418'820   23'146'365    20'748'927     6'337    919'617   5'800'390         0      1'180        6'514   78'751
                  'quick_restart':       424'184   4'077'707   13'229'243     9'939'811     4'628    103'597   1'980'718         0     68'211      916'658   15'891
            'quick_restart_no_lp':     1'401'915  18'907'630   53'114'382    44'917'112     2'936     36'074     631'696         0     25'518      313'092    2'242
                  'reduced_costs':     1'598'037  15'304'143   60'988'699    55'818'144    14'006    171'752   1'766'149         3     51'931      397'968   47'944

Lp stats                         Component   Iterations  AddedCuts    OPTIMAL     DUAL_F.  DUAL_U.
                  'default_lp':          1   39'545'815  1'026'284  2'832'574       2'316      226
                       'fixed':          1    1'660'971      3'041  5'784'861           0        0
                   'fs_random':          1        1'709        628         17           0        0
                   'fs_random':          1        2'448        648         27           0        0
     'fs_random_quick_restart':          1        1'318        646         11           0        0
     'fs_random_quick_restart':          1        1'712        766         17           0        0
              'lb_tree_search':          1  126'856'342     74'235     32'314  10'070'003        0
                      'max_lp':          1   31'143'164    373'158    698'261   2'779'694       41
         'objective_lb_search':          1   49'290'672    714'773  1'824'833       6'044       45
  'objective_lb_search_max_lp':          1   24'791'141     51'839     21'262   2'106'261        0
                     'probing':          1   28'553'788  1'495'306    252'052      11'043        6
              'probing_max_lp':          1   10'400'980    517'806    179'308      72'452        0
                'pseudo_costs':          1   27'657'587    752'653  1'281'224   2'125'663       68
               'quick_restart':          1   70'162'083  2'415'746  2'335'787      20'921    1'075
               'reduced_costs':          1   22'779'002    787'313  1'963'533   1'731'475       98

Lp dimension                                                                        Final dimension of first component
                  'default_lp':  3406 rows, 3678 columns, 12449 entries with magnitude in [1.087229e-02, 1.000000e+00]
                       'fixed':  3271 rows, 3678 columns, 12035 entries with magnitude in [1.087229e-02, 1.000000e+00]
                   'fs_random':   1059 rows, 3678 columns, 4393 entries with magnitude in [2.870058e-02, 1.000000e+00]
                   'fs_random':   1359 rows, 3678 columns, 5432 entries with magnitude in [2.870058e-02, 1.000000e+00]
     'fs_random_quick_restart':   1109 rows, 3678 columns, 4582 entries with magnitude in [2.870058e-02, 1.000000e+00]
     'fs_random_quick_restart':    909 rows, 3678 columns, 3854 entries with magnitude in [2.870058e-02, 1.000000e+00]
              'lb_tree_search':  7208 rows, 3696 columns, 40088 entries with magnitude in [3.745174e-04, 1.000000e+00]
                      'max_lp':  3789 rows, 3696 columns, 14187 entries with magnitude in [9.130699e-04, 1.000000e+00]
         'objective_lb_search':  3775 rows, 3678 columns, 13984 entries with magnitude in [2.523443e-03, 1.000000e+00]
  'objective_lb_search_max_lp':  6195 rows, 3696 columns, 27660 entries with magnitude in [2.829091e-04, 1.000000e+00]
                     'probing':  6420 rows, 3678 columns, 32446 entries with magnitude in [4.828258e-04, 1.000000e+00]
              'probing_max_lp':  5957 rows, 3696 columns, 41004 entries with magnitude in [2.301159e-05, 1.000000e+00]
                'pseudo_costs':  4037 rows, 3696 columns, 16322 entries with magnitude in [1.180277e-04, 1.000000e+00]
               'quick_restart':  4855 rows, 3678 columns, 19245 entries with magnitude in [1.841408e-03, 1.000000e+00]
               'reduced_costs':  3538 rows, 3696 columns, 13343 entries with magnitude in [2.439105e-03, 1.000000e+00]

Lp debug                         CutPropag  CutEqPropag     Adjust  Overflow            Bad  BadScaling
                  'default_lp':          8          135    885'883         0     21'364'960           0
                       'fixed':          0            0          0         0         45'801           0
                   'fs_random':          1            0          0         0          4'119           0
                   'fs_random':          1            0          0         0          4'195           0
     'fs_random_quick_restart':          0            0          0         0          5'079           0
     'fs_random_quick_restart':          0            0          0         0          5'787           0
              'lb_tree_search':         84          238  8'561'053         0     56'944'374           0
                      'max_lp':        139          153  1'695'546         0     20'926'742           0
         'objective_lb_search':         36          133  1'177'954         0     30'501'525           0
  'objective_lb_search_max_lp':         24           48  1'514'218         0     16'895'763           0
                     'probing':        629        4'744     96'887         0  2'226'474'232           0
              'probing_max_lp':        388        3'841    251'738         0  2'105'636'901           0
                'pseudo_costs':        182          309  1'191'121         0     46'975'836           0
               'quick_restart':        303          280  1'186'826         0    148'546'801           0
               'reduced_costs':        126          165  1'085'873         0     43'881'923           0

Lp pool                          Constraints  Updates  Simplif  Merged  Shortened      Split  Strenghtened            Cuts/Call
                  'default_lp':       13'250    3'362   16'823      69          0     60'609        59'009  1'026'284/5'172'747
                       'fixed':        7'076        0       46       0          0          0           479         3'041/41'802
                   'fs_random':        4'663        0        0       0          0          0           335            628/2'138
                   'fs_random':        4'683        0        0       0          0          0           335            648/2'353
     'fs_random_quick_restart':        4'681        0        0       0          0          0           335            646/2'219
     'fs_random_quick_restart':        4'801        0        0       0          0          0           342            766/2'673
              'lb_tree_search':       45'558    5'555  380'095      16          0    353'599       389'184       74'235/187'752
                      'max_lp':       45'458    2'699  260'207      39          0    142'386       315'399      373'158/849'164
         'objective_lb_search':       13'786    4'259   15'505      22          0    256'587        52'656    714'773/3'238'569
  'objective_lb_search_max_lp':       46'090    1'655  397'124      88          0    324'095       389'594       51'839/126'922
                     'probing':       13'331  152'103   16'253      10          0  4'538'699       253'383  1'495'306/2'856'935
              'probing_max_lp':       46'127  101'496  318'566      18          0  1'069'816       411'900    517'806/1'372'072
                'pseudo_costs':       45'960    5'829  325'385      32          0    483'494       444'828    752'653/1'734'413
               'quick_restart':       13'668    8'878   16'570     113          0  1'503'947       104'469  2'415'746/7'237'728
               'reduced_costs':       45'536    4'958  359'154     116          0    537'652       445'155    787'313/1'915'837

Lp Cut                                                fs_ran  fs_ran  fs_ran  fs_ran   defaul  fixed   max_lp     quick_   reduce   pseudo  lb_tre   probin   object   probin  object
                                              CG_FF:      45      45      45      51   31'101    108   19'483     14'574   46'652   40'183   1'141   13'254   14'142    2'374   2'070
                                               CG_K:      38      38      38      48   26'185     90   23'122     11'385   52'814   43'646   1'252    7'242   12'247    1'725   2'468
                                              CG_KL:       -       -       -       -       66      -       12         43      166       67       -       82       60        5       6
                                               CG_R:      32      32      32      39   16'097     61   11'228     10'402   23'412   21'955   1'382   14'378   10'659    3'422   1'282
                                              CG_RB:      18      18      18      21   64'669    121   39'995     34'693   76'173   79'923   3'343   50'099   42'318    4'020   5'443
                                             CG_RBP:       1       1       1       1    7'971      2    7'744      4'239   13'916   15'649     576    4'103    5'004      681     800
                                             Clique:       -       -       -       -        -      -    3'957          -   10'784   11'867     189        -        -    1'010     193
                                                 IB:     126      69      97     108  719'546  1'593  133'611  2'030'195  276'374  238'183  10'519  361'449  502'291   70'961  11'131
                                           MIR_1_FF:     119     134     119     143   16'526    191   12'520     29'124   31'850   29'483   1'702   61'294   12'910   12'778   1'734
                                            MIR_1_K:      25      29      25      30    2'153     42    1'812      3'674    4'131    4'184     106    8'753    1'576    1'853     261
                                           MIR_1_KL:       -       -       -       -      786      -      692      1'030      910    1'475      26    3'314      109    1'916      35
                                            MIR_1_R:      27      33      27      35    3'663     46    1'930      5'526    5'674    4'941     538   18'832    2'446    3'588     522
                                           MIR_1_RB:      50      59      48      64   26'984    156   28'537     52'082   56'725   58'621   6'810  145'017   21'756   41'738   4'662
                                          MIR_1_RBP:       1       1       1       1    2'809      7    7'950      5'154   14'420   16'552   1'065    8'742    2'135    3'822     873
                                          MIR_1_RLT:       -       -       -       -        -      -      218          -      655      522      28        -        -      758      29
                                           MIR_2_FF:      32      36      31      43   11'750     80    6'734     16'646   17'165   17'874     987   29'633    7'638    8'279     972
                                            MIR_2_K:      21      24      24      31    2'253     35    1'368      2'433    3'179    3'462      80    4'216    1'328    1'347     273
                                           MIR_2_KL:       -       -       -       -      540      -      504        857      601      797      52    3'985       41    1'477      45
                                            MIR_2_R:       9       8       8       7    2'778     17    1'495      4'065    3'920    3'907     850   25'121    1'880    7'726     471
                                           MIR_2_RB:      36      47      38      49   18'227    130   12'614     38'389   26'743   28'394   2'980  109'986   14'971   23'280   2'336
                                          MIR_2_RBP:       2       2       2       1    2'200      7    3'119      4'124    5'965    7'152     370    7'144    1'893    2'304     354
                                           MIR_3_FF:       4       4       4       5    7'112     36    4'222     10'405   10'104   11'677     527   18'556    5'093    4'142     578
                                            MIR_3_K:       6       5       7       6    1'533     18    1'194      1'800    2'722    2'833      85    2'946      888    1'180     206
                                           MIR_3_KL:       -       -       -       -      370      -      306        759      473      536      66    3'670       39    1'406      41
                                            MIR_3_R:       1       1       1       1    1'788     12      988      3'277    2'281    2'553     809   16'540    1'431    7'248     551
                                           MIR_3_RB:       7      10       9      18   10'624     69    7'017     23'579   14'863   16'509   1'868   73'199    9'363   14'204   1'510
                                          MIR_3_RBP:       -       -       1       -    1'493      3    1'750      2'827    3'333    4'008     255    5'340    1'365    1'201     220
                                           MIR_4_FF:       2       4       2       3    4'149     23    2'141      6'231    5'357    6'208     323   13'068    3'262    2'100     335
                                            MIR_4_K:       1       5       1       1    1'370      6      808      1'139    1'790    1'784      74    2'287      775      935     131
                                           MIR_4_KL:       -       -       -       -      339      -      231        579      361      371      89    3'823       52    1'535      52
                                            MIR_4_R:       -       1       1       -    1'204      6      536      2'069    1'228    1'207     400    9'638    1'005    3'192     273
                                           MIR_4_RB:       8      11       4       9    6'665     38    3'719     13'822    7'655    8'407     865   49'372    5'785    6'844     755
                                          MIR_4_RBP:       1       1       -       1      712      1      819      1'486    1'419    1'743     165    3'540      671      826     116
                                           MIR_5_FF:       -       -       1       -    2'533     14    1'236      4'068    2'986    3'744     200    9'964    2'295    1'337     229
                                            MIR_5_K:       2       1       1       1      740      3      476        751      914    1'047      68    2'005      439      732     112
                                           MIR_5_KL:       -       -       -       -      260      -      186        570      394      296      85    4'222       48    1'595      71
                                            MIR_5_R:       -       -       1       -      651      3      303      1'144      564      639     274    6'107      759    1'790     230
                                           MIR_5_RB:       2       4       2       6    4'188     28    2'109      8'553    4'257    4'733     527   36'171    3'728    4'104     513
                                          MIR_5_RBP:       -       -       -       1      325      1      378        837      711      799     102    2'836      328      647     116
                                           MIR_6_FF:       -       -       -       -    1'695      8      729      2'619    1'682    2'209     221    7'102    1'618    1'073     182
                                            MIR_6_K:       -       -       1       1      473      -      317        678      701      709      69    1'913      377      761      82
                                           MIR_6_KL:       -       -       -       -      260      -      186        676      429      299     132    5'378       98    1'823      87
                                            MIR_6_R:       -       -       -       -      419      1      184        712      333      385     258    3'783      451    1'196     167
                                           MIR_6_RB:       1       2       3       5    2'749     12    1'284      6'256    2'710    3'036     408   29'659    2'695    3'301     358
                                          MIR_6_RBP:       -       -       -       -      187      -      190        610      449      492      77    2'439      210      602      99
   NoOverlapCompletionTimeExhaustiveMirror_weighted:       -       -       -       -        -      -        -          -        4        1       -        -        -        -       -
         NoOverlapCompletionTimeExhaustive_weighted:       -       -       -       -        -      -      100          -      287      309       2        -        -        -       9
  NoOverlapCompletionTimeExhaustive_weighted_lifted:       -       -       -       -        -      -      641          -    1'781    1'759       3        -        -        3      15
                    NoOverlapCompletionTimeQueyrane:       -       -       -       -        -      -      140          -      404      299       4        -        -        6      12
             NoOverlapCompletionTimeQueyrane_lifted:       -       -       -       -        -      -      174          -      505      465       5        -        -       18      11
                          NoOverlapDisjunctionOnEnd:       -       -       -       -        -      -        8          -       36        9       -        -        -        -       -
                        NoOverlapDisjunctionOnStart:       -       -       -       -        -      -      770          -    1'888    1'994       5        -        -        5      12
                                       ZERO_HALF_FF:      12       9      12      11    4'043     19    3'419      3'918    8'054    7'723     204    5'022    2'394      841     355
                                        ZERO_HALF_K:       2       2       4       5    1'514     14    1'535      1'295    3'892    3'839     148    1'398      830      626     167
                                       ZERO_HALF_KL:       -       -       -       -        9      -        6          6       28       21       -       12        3        1       1
                                        ZERO_HALF_R:       7       4       6       9    4'918     13    6'143     33'128   11'325   11'245  28'179  245'361    7'318  222'944   6'477
                                       ZERO_HALF_RB:       8       5      11       9    6'053     21    7'841      9'890   14'934   15'355   1'868   31'314    4'678   15'188   1'180
                                      ZERO_HALF_RBP:       2       1       2       2    1'604      6    2'427      3'427    4'230    4'573   1'874   21'997    1'371   19'336     626

LNS stats                        Improv/Calls  Closed  Difficulty  TimeLimit
               'graph_arc_lns':    9249/33004     50%        1.00       0.10
               'graph_cst_lns':   12477/33003     50%        1.00       0.10
               'graph_dec_lns':    9300/33004     50%        1.00       0.10
               'graph_var_lns':   14238/33004     50%        1.00       0.10
                   'rins/rens':    3641/30822     50%        0.93       0.15
                 'rnd_cst_lns':   11817/33004     50%        1.00       0.10
                 'rnd_var_lns':    9751/33004     50%        1.00       0.10
    'scheduling_intervals_lns':   33001/33004      0%        0.00       0.10
  'scheduling_precedences_lns':   33002/33003      0%        0.00       0.10
  'scheduling_time_window_lns':   33003/33003      0%        0.00       0.10

LS stats                   Batches  Restarts     LinMoves    GenMoves  CompoundMoves  WeightUpdates
       'fj_long_default':        5         1       49'858           0              0            142
   'fj_long_lin_default':        6         1            0      10'264          2'635              0
        'fj_long_random':        4         1       39'869           0              0            131
      'fj_short_default':        8         1            0      11'219          1'304              0
  'fj_short_lin_default':        2         1            0       4'409            515              0
   'fj_short_lin_random':        2         1            0       4'001            770              0
       'fj_short_random':        3         1            0       5'416            954              0
          'violation_ls':   33'005         0  157'624'275  17'191'457        708'493      2'636'890
          'violation_ls':   33'005         0  168'105'161  16'609'227        666'065      1'616'374

Solutions (108)           Num      Rank
        'graph_arc_lns':    7  [23,101]
        'graph_cst_lns':    4  [14,102]
        'graph_dec_lns':    8  [24,104]
        'graph_var_lns':    5    [4,97]
                'no_lp':    3     [1,3]
        'quick_restart':    1     [5,5]
  'quick_restart_no_lp':   19    [6,86]
          'rins_lp_lns':    9   [8,105]
        'rins_pump_lns':    6   [16,98]
          'rnd_cst_lns':    5   [27,73]
          'rnd_var_lns':   10  [17,108]
         'violation_ls':   31  [10,100]

Objective bounds                     Num
                  'initial_domain':    1
                  'lb_tree_search':   41
                           'no_lp':    1
      'objective_lb_search_max_lp':   79
       'objective_lb_search_no_lp':    1
  'objective_shaving_search_no_lp':    1
                    'pseudo_costs':    4
                   'reduced_costs':    4

Solution repositories      Added  Queried  Ignored  Synchro
  'feasible solutions':  158'563  750'814        0  155'804
        'lp solutions':   70'759   16'543        0   68'928
                'pump':  295'091   16'462

Improving bounds shared             Num
                  'default_lp':     544
                   'fs_random':       1
              'lb_tree_search':     367
                      'max_lp':     601
                       'no_lp':     796
         'objective_lb_search':      60
  'objective_lb_search_max_lp':      98
                     'probing':  42'514
              'probing_max_lp':  12'956
                'pseudo_costs':   1'363
               'quick_restart':   1'758
         'quick_restart_no_lp':   3'027
               'reduced_costs':   1'041

Clauses shared                      Num
                           'core':    3
                     'default_lp':   31
  'fs_random_quick_restart_no_lp':    1
                 'lb_tree_search':    8
                         'max_lp':   16
                          'no_lp':   12
            'objective_lb_search':   14
     'objective_lb_search_max_lp':    5
      'objective_lb_search_no_lp':    4
                   'pseudo_costs':   47
                  'quick_restart':    7
            'quick_restart_no_lp':   30
                  'reduced_costs':    2

CpSolverResponse summary:
status: FEASIBLE
objective: 3681
best_bound: 1600
integers: 3690
booleans: 295
conflicts: 0
branches: 599
propagations: 36
integer_propagations: 165753
restarts: 590
lp_iterations: 2448
walltime: 86401.4
usertime: 86401.4
deterministic_time: 262799
gap_integral: 2.01003e+06
solution_fingerprint: 0x7c6edd82dbcfd21


--- Simulation Gantt  partir du modle mathmatique ---
