created virtual environment CPython3.12.4.final.0-64 in 6237ms
  creator CPython3Posix(dest=/localscratch/aneumann.63393187.0/env, clear=False, no_vcs_ignore=False, global=False)
  seeder FromAppData(download=False, pip=bundle, via=copy, app_data_dir=/home/aneumann/.local/share/virtualenv)
    added seed packages: pip==25.1.1
  activators BashActivator,CShellActivator,FishActivator,NushellActivator,PowerShellActivator,PythonActivator
Looking in links: /cvmfs/soft.computecanada.ca/custom/python/wheelhouse/gentoo2023/x86-64-v3, /cvmfs/soft.computecanada.ca/custom/python/wheelhouse/gentoo2023/generic, /cvmfs/soft.computecanada.ca/custom/python/wheelhouse/generic
Requirement already satisfied: pip in /localscratch/aneumann.63393187.0/env/lib/python3.12/site-packages (25.1.1)
Looking in links: /cvmfs/soft.computecanada.ca/custom/python/wheelhouse/gentoo2023/x86-64-v3, /cvmfs/soft.computecanada.ca/custom/python/wheelhouse/gentoo2023/generic, /cvmfs/soft.computecanada.ca/custom/python/wheelhouse/generic
ERROR: protobuf-5.28.3-cp38-abi3-manylinux2014_x86_64.whl is not a supported wheel on this platform.
Looking in links: /cvmfs/soft.computecanada.ca/custom/python/wheelhouse/gentoo2023/x86-64-v3, /cvmfs/soft.computecanada.ca/custom/python/wheelhouse/gentoo2023/generic, /cvmfs/soft.computecanada.ca/custom/python/wheelhouse/generic
Processing /home/aneumann/projects/def-adhaj/aneumann/GNRS/wheels/immutabledict-4.2.0-py3-none-any.whl
Installing collected packages: immutabledict
Successfully installed immutabledict-4.2.0
Looking in links: /cvmfs/soft.computecanada.ca/custom/python/wheelhouse/gentoo2023/x86-64-v3, /cvmfs/soft.computecanada.ca/custom/python/wheelhouse/gentoo2023/generic, /cvmfs/soft.computecanada.ca/custom/python/wheelhouse/generic
Processing /cvmfs/soft.computecanada.ca/custom/python/wheelhouse/generic/ortools-9.10.4067+computecanada-cp312-cp312-linux_x86_64.whl (from -r /home/aneumann/projects/def-adhaj/aneumann/GNRS/requirements/or.txt (line 1))
Processing /cvmfs/soft.computecanada.ca/custom/python/wheelhouse/gentoo2023/x86-64-v3/matplotlib-3.10.0+computecanada-cp312-cp312-linux_x86_64.whl (from -r /home/aneumann/projects/def-adhaj/aneumann/GNRS/requirements/or.txt (line 2))
Processing /cvmfs/soft.computecanada.ca/custom/python/wheelhouse/gentoo2023/x86-64-v3/pandas-2.2.3+computecanada-cp312-cp312-linux_x86_64.whl (from -r /home/aneumann/projects/def-adhaj/aneumann/GNRS/requirements/or.txt (line 3))
Processing /cvmfs/soft.computecanada.ca/custom/python/wheelhouse/generic/absl_py-2.2.2+computecanada-py3-none-any.whl (from ortools<9.11,>=9.10->-r /home/aneumann/projects/def-adhaj/aneumann/GNRS/requirements/or.txt (line 1))
Processing /cvmfs/soft.computecanada.ca/custom/python/wheelhouse/gentoo2023/generic/numpy-2.2.2+computecanada-cp312-cp312-linux_x86_64.whl (from ortools<9.11,>=9.10->-r /home/aneumann/projects/def-adhaj/aneumann/GNRS/requirements/or.txt (line 1))
Processing /cvmfs/soft.computecanada.ca/custom/python/wheelhouse/gentoo2023/x86-64-v3/protobuf-6.30.2+computecanada-cp312-cp312-linux_x86_64.whl (from ortools<9.11,>=9.10->-r /home/aneumann/projects/def-adhaj/aneumann/GNRS/requirements/or.txt (line 1))
Requirement already satisfied: immutabledict>=3.0.0 in /localscratch/aneumann.63393187.0/env/lib/python3.12/site-packages (from ortools<9.11,>=9.10->-r /home/aneumann/projects/def-adhaj/aneumann/GNRS/requirements/or.txt (line 1)) (4.2.0)
Processing /cvmfs/soft.computecanada.ca/custom/python/wheelhouse/gentoo2023/generic/contourpy-1.3.1+computecanada-cp312-cp312-linux_x86_64.whl (from matplotlib->-r /home/aneumann/projects/def-adhaj/aneumann/GNRS/requirements/or.txt (line 2))
Processing /cvmfs/soft.computecanada.ca/custom/python/wheelhouse/generic/cycler-0.12.1+computecanada-py3-none-any.whl (from matplotlib->-r /home/aneumann/projects/def-adhaj/aneumann/GNRS/requirements/or.txt (line 2))
Processing /cvmfs/soft.computecanada.ca/custom/python/wheelhouse/generic/fonttools-4.58.2+computecanada-cp312-cp312-linux_x86_64.whl (from matplotlib->-r /home/aneumann/projects/def-adhaj/aneumann/GNRS/requirements/or.txt (line 2))
Processing /cvmfs/soft.computecanada.ca/custom/python/wheelhouse/gentoo2023/x86-64-v3/kiwisolver-1.4.8+computecanada-cp312-cp312-linux_x86_64.whl (from matplotlib->-r /home/aneumann/projects/def-adhaj/aneumann/GNRS/requirements/or.txt (line 2))
Processing /cvmfs/soft.computecanada.ca/custom/python/wheelhouse/generic/packaging-25.0+computecanada-py3-none-any.whl (from matplotlib->-r /home/aneumann/projects/def-adhaj/aneumann/GNRS/requirements/or.txt (line 2))
Processing /cvmfs/soft.computecanada.ca/custom/python/wheelhouse/gentoo2023/x86-64-v3/pillow-11.1.0+computecanada-cp312-cp312-linux_x86_64.whl (from matplotlib->-r /home/aneumann/projects/def-adhaj/aneumann/GNRS/requirements/or.txt (line 2))
Processing /cvmfs/soft.computecanada.ca/custom/python/wheelhouse/generic/pyparsing-3.2.1+computecanada-py3-none-any.whl (from matplotlib->-r /home/aneumann/projects/def-adhaj/aneumann/GNRS/requirements/or.txt (line 2))
Processing /cvmfs/soft.computecanada.ca/custom/python/wheelhouse/generic/python_dateutil-2.9.0.post0+computecanada-py2.py3-none-any.whl (from matplotlib->-r /home/aneumann/projects/def-adhaj/aneumann/GNRS/requirements/or.txt (line 2))
Processing /cvmfs/soft.computecanada.ca/custom/python/wheelhouse/generic/pytz-2025.2+computecanada-py2.py3-none-any.whl (from pandas->-r /home/aneumann/projects/def-adhaj/aneumann/GNRS/requirements/or.txt (line 3))
Processing /cvmfs/soft.computecanada.ca/custom/python/wheelhouse/generic/tzdata-2025.2+computecanada-py2.py3-none-any.whl (from pandas->-r /home/aneumann/projects/def-adhaj/aneumann/GNRS/requirements/or.txt (line 3))
Processing /cvmfs/soft.computecanada.ca/custom/python/wheelhouse/generic/six-1.17.0+computecanada-py2.py3-none-any.whl (from python-dateutil>=2.7->matplotlib->-r /home/aneumann/projects/def-adhaj/aneumann/GNRS/requirements/or.txt (line 2))
Installing collected packages: pytz, tzdata, six, pyparsing, protobuf, pillow, packaging, numpy, kiwisolver, fonttools, cycler, absl-py, python-dateutil, contourpy, pandas, matplotlib, ortools

Successfully installed absl-py-2.2.2+computecanada contourpy-1.3.1+computecanada cycler-0.12.1+computecanada fonttools-4.58.2+computecanada kiwisolver-1.4.8+computecanada matplotlib-3.10.0+computecanada numpy-2.2.2+computecanada ortools-9.10.4067+computecanada packaging-25.0+computecanada pandas-2.2.3+computecanada pillow-11.1.0+computecanada protobuf-6.30.2+computecanada pyparsing-3.2.1+computecanada python-dateutil-2.9.0.post0+computecanada pytz-2025.2+computecanada six-1.17.0+computecanada tzdata-2025.2+computecanada

Starting CP-SAT solver v9.10.4067
Parameters: max_time_in_seconds: 3600 max_memory_in_mb: 12000 log_search_progress: true enumerate_all_solutions: false absolute_gap_limit: 0 relative_gap_limit: 0
Setting number of workers to 48

Initial optimization model '': (model_fingerprint: 0x77d88b2f594ac89c)
#Variables: 238 (#ints: 8 in objective)
  - 159 Booleans in [0,1]
  - 79 in [0,488]
#kLinear1: 34
#kLinear2: 377
#kLinear3: 151
#kLinearN: 1'595 (#terms: 20'552)

Starting presolve at 0.00s
  1.07e-03s  0.00e+00d  [DetectDominanceRelations] 
  2.41e-02s  0.00e+00d  [PresolveToFixPoint] #num_loops=6 #num_dual_strengthening=3 
  2.30e-05s  0.00e+00d  [ExtractEncodingFromLinear] #potential_supersets=3 
[Symmetry] Graph for symmetry has 2'031 nodes and 14'906 arcs.
[Symmetry] Symmetry computation done. time: 0.00151211 dtime: 0.00141877
[Symmetry] #generators: 1, average support size: 20
[Symmetry] The model contains 193 duplicate constraints !
[Symmetry] 10 orbits with sizes: 2,2,2,2,2,2,2,2,2,2
[Symmetry] Num fixable by intersecting at_most_one with orbits: 1 largest_orbit: 2
  5.43e-03s  7.03e-04d  [Probe] #probed=206 #fixed_bools=2 #new_bounds=14 #equiv=1 
  5.52e-05s  0.00e+00d  [MaxClique] Merged 41(82 literals) into 12(24 literals) at_most_ones. 
  1.04e-03s  0.00e+00d  [DetectDominanceRelations] 
  1.10e-02s  0.00e+00d  [PresolveToFixPoint] #num_loops=4 #num_dual_strengthening=3 
  3.49e-03s  0.00e+00d  [ProcessAtMostOneAndLinear] 
  1.69e-03s  0.00e+00d  [DetectDuplicateConstraints] #duplicates=222 #without_enforcements=112 
  1.21e-03s  5.94e-05d  [DetectDominatedLinearConstraints] #relevant_constraints=1'182 #num_inclusions=767 #num_redundant=1 
  2.27e-04s  0.00e+00d  [DetectDifferentVariables] #different=25 
  3.20e-04s  1.58e-05d  [ProcessSetPPC] #relevant_constraints=824 
  1.64e-05s  0.00e+00d  [FindAlmostIdenticalLinearConstraints] 
  9.42e-05s  7.52e-05d  [FindBigAtMostOneAndLinearOverlap] 
  3.34e-03s  1.07e-03d  [FindBigVerticalLinearOverlap] #blocks=23 #saved_nz=1'766 
  1.60e-04s  3.85e-05d  [FindBigHorizontalLinearOverlap] #linears=799 
  8.55e-06s  0.00e+00d  [MergeClauses] 
  1.08e-03s  0.00e+00d  [DetectDominanceRelations] 
  1.35e-02s  0.00e+00d  [PresolveToFixPoint] #num_loops=2 #num_dual_strengthening=1 
  1.08e-03s  0.00e+00d  [DetectDominanceRelations] 
  8.06e-03s  0.00e+00d  [PresolveToFixPoint] #num_loops=1 #num_dual_strengthening=1 
[Symmetry] Graph for symmetry has 1'820 nodes and 11'987 arcs.
[Symmetry] Symmetry computation done. time: 0.000481791 dtime: 0.000669
  4.95e-03s  6.55e-04d  [Probe] #probed=202 #new_bounds=20 
  9.58e-06s  0.00e+00d  [MaxClique] 
  1.07e-03s  0.00e+00d  [DetectDominanceRelations] 
  1.21e-02s  0.00e+00d  [PresolveToFixPoint] #num_loops=2 #num_dual_strengthening=1 
  3.06e-03s  0.00e+00d  [ProcessAtMostOneAndLinear] 
  1.46e-03s  0.00e+00d  [DetectDuplicateConstraints] #without_enforcements=127 
  8.15e-04s  3.92e-05d  [DetectDominatedLinearConstraints] #relevant_constraints=1'042 #num_inclusions=364 
  2.36e-04s  0.00e+00d  [DetectDifferentVariables] #different=29 #cliques=1 #size=3 
  2.83e-04s  1.15e-05d  [ProcessSetPPC] #relevant_constraints=739 
  2.48e-05s  1.50e-08d  [FindAlmostIdenticalLinearConstraints] #num_tested_pairs=1 
  5.84e-05s  3.52e-05d  [FindBigAtMostOneAndLinearOverlap] 
  2.34e-03s  7.93e-04d  [FindBigVerticalLinearOverlap] #blocks=21 #saved_nz=1'300 
  1.48e-04s  2.83e-05d  [FindBigHorizontalLinearOverlap] #linears=665 
  8.20e-06s  0.00e+00d  [MergeClauses] 
  1.04e-03s  0.00e+00d  [DetectDominanceRelations] 
  1.21e-02s  0.00e+00d  [PresolveToFixPoint] #num_loops=2 #num_dual_strengthening=1 
  1.05e-03s  0.00e+00d  [DetectDominanceRelations] 
  8.31e-03s  0.00e+00d  [PresolveToFixPoint] #num_loops=1 #num_dual_strengthening=1 
  4.89e-03s  6.36e-04d  [Probe] #probed=202 #new_bounds=16 
  9.41e-06s  0.00e+00d  [MaxClique] 
  1.03e-03s  0.00e+00d  [DetectDominanceRelations] 
  1.09e-02s  0.00e+00d  [PresolveToFixPoint] #num_loops=2 #num_dual_strengthening=1 
  2.65e-03s  0.00e+00d  [ProcessAtMostOneAndLinear] 
  1.46e-03s  0.00e+00d  [DetectDuplicateConstraints] #without_enforcements=162 
  5.92e-04s  2.44e-05d  [DetectDominatedLinearConstraints] #relevant_constraints=897 #num_inclusions=155 
  1.41e-04s  0.00e+00d  [DetectDifferentVariables] 
  2.28e-04s  7.84e-06d  [ProcessSetPPC] #relevant_constraints=599 
  2.73e-05s  1.35e-07d  [FindAlmostIdenticalLinearConstraints] #num_tested_pairs=8 
  5.57e-05s  2.95e-05d  [FindBigAtMostOneAndLinearOverlap] 
  1.62e-03s  6.12e-04d  [FindBigVerticalLinearOverlap] #blocks=6 #saved_nz=361 
  1.24e-04s  2.37e-05d  [FindBigHorizontalLinearOverlap] #linears=587 
  7.88e-06s  0.00e+00d  [MergeClauses] 
  9.89e-04s  0.00e+00d  [DetectDominanceRelations] 
  9.36e-03s  0.00e+00d  [PresolveToFixPoint] #num_loops=2 #num_dual_strengthening=1 
  5.38e-05s  0.00e+00d  [ExpandObjective] #entries=172 #tight_variables=61 #tight_constraints=37 

Presolve summary:
  - 42 affine relations were detected.
  - rule 'TODO dual: only one blocking constraint?' was applied 572 times.
  - rule 'TODO dual: only one unspecified blocking constraint?' was applied 104 times.
  - rule 'TODO duplicate: identical constraint with different enforcements' was applied 401 times.
  - rule 'TODO no_overlap: with task always last' was applied 1 time.
  - rule 'affine: new relation' was applied 42 times.
  - rule 'all_diff: inferred from x != y constraints' was applied 1 time.
  - rule 'at_most_one: removed literals' was applied 12 times.
  - rule 'at_most_one: size one' was applied 12 times.
  - rule 'at_most_one: transformed into max clique.' was applied 1 time.
  - rule 'deductions: 151 stored' was applied 1 time.
  - rule 'dual: fix variable' was applied 21 times.
  - rule 'dual: reduced domain' was applied 36 times.
  - rule 'duplicate: merged rhs of linear constraint' was applied 31 times.
  - rule 'duplicate: removed constraint' was applied 222 times.
  - rule 'enforcement: false literal' was applied 17 times.
  - rule 'enforcement: true literal' was applied 9 times.
  - rule 'exactly_one: x and not(x)' was applied 1 time.
  - rule 'incompatible linear: add implication' was applied 18 times.
  - rule 'linear inclusion: redundant containing constraint' was applied 1 time.
  - rule 'linear matrix: common vertical rectangle' was applied 50 times.
  - rule 'linear: always true' was applied 489 times.
  - rule 'linear: doubleton free' was applied 9 times.
  - rule 'linear: empty' was applied 26 times.
  - rule 'linear: extracted enforcement literal' was applied 4'237 times.
  - rule 'linear: fixed or dup variables' was applied 1'636 times.
  - rule 'linear: positive equal one' was applied 3 times.
  - rule 'linear: reduced variable domains' was applied 144 times.
  - rule 'linear: remapped using affine relations' was applied 1'633 times.
  - rule 'linear: simplified rhs' was applied 5'310 times.
  - rule 'linear: variable substitution 1' was applied 9 times.
  - rule 'linear: variable substitution 2' was applied 4 times.
  - rule 'linear: variable substitution 3' was applied 1 time.
  - rule 'presolve: 76 unused variables removed.' was applied 1 time.
  - rule 'presolve: iteration' was applied 3 times.
  - rule 'probing: reduced enforced constraint to implication.' was applied 41 times.
  - rule 'symmetry: fixed to false in general orbit' was applied 1 time.

Presolved optimization model '': (model_fingerprint: 0xe28602c49cc9d135)
#Variables: 156 (#ints: 8 in objective)
  - 50 Booleans in [0,1]
  - 1 in [-2318,-1979][-1949,-1491][-1461,-1003][- ... 1,949][979,1437][1467,1925][1955,2413][2443,2800]
  - 1 in [-2270,-1979][-1949,-1491][-1461,-1003][- ... ][3,461][491,949][979,1437][1467,1925][1955,2347]
  - 1 in [-1886,-1534][-1466,-1046][-978,-558][-490,-70][-2,418][486,906][974,1394][1462,1781]
  - 1 in [-1883,-1491][-1461,-1003][-973,-515][-485,-27][3,461][491,949][979,1437][1467,1824]
  - 2 in [-1883,-1491][-1461,-1003][-973,-515][-485,-27][3,461][491,949][979,1437][1467,1859]
  - 1 in [-1879,-1480][-1461,-992][-973,-504][-485,-16][3,472][491,960][979,1448][1467,1835]
  - 1 in [-1411,-1026][-923,-538][-435,-50][53,438][541,926][1029,1414][1517,1836]
  - 1 in [-1395,-1003][-973,-515][-485,-27][3,461][491,949][979,1336]
  - 1 in [-1391,-992][-973,-504][-485,-16][3,472][491,960][979,1347]
  - 2 in [-923,-538][-435,-50][53,438][541,926][1029,1414][1517,1902][2005,2324]
  - 1 in [-910,-558][-490,-70][-2,418][486,805]
  - 1 in [-909,-540][-485,-52][3,436][491,924][979,1383]
  - 1 in [-908,-543][-490,-55][-2,363]
  - 1 in [-907,-515][-485,-27][3,461][491,949][979,1437][1467,1859]
  - 1 in [-905,-504][-485,-16][3,472][491,960][979,1448][1467,1868]
  - 2 in [-488,-55][0,433]
  - 3 in [-488,-30][0,458]
  - 1 in [-482,-52][3,436][491,895]
  - 1 in [-439,-41][14,447][502,834]
  - 1 in [-437,-55][-2,396]
  - 1 in [-435,-50][53,438][541,926][1029,1414][1517,1836]
  - 1 in [-434,-52][3,436][491,924][979,1383]
  - 1 in [-422,-70][-2,418][486,838]
  - 1 in [-419,-27][3,461][491,883]
  - 1 in [-417,-16][3,404]
  - 1 in [-417,-16][3,472][491,960][979,1448][1467,1868]
  - 1 in [-2,386]
  - 1 in [-2,418]
  - 1 in [-2,420]
  - 1 in [-2,420][486,838]
  - 1 in [-2,420][486,908][974,1326]
  - 1 in [-2,433]
  - 4 in [0,352]
  - 1 in [0,357]
  - 2 in [0,365]
  - 1 in [0,383]
  - 3 in [0,385]
  - 1 in [0,385][488,873]
  - 1 in [0,394]
  - 3 in [0,399]
  - 1 in [0,406]
  - 1 in [0,420]
  - 1 in [0,422]
  - 1 in [0,432]
  - 3 in [0,433]
  - 1 in [0,435]
  - 3 in [0,458]
  - 1 in [0,469]
  - 1 in [3,388]
  - 1 in [3,423]
  - 1 in [3,425]
  - 1 in [3,436]
  - 1 in [3,436][491,918]
  - 1 in [3,438]
  - 1 in [3,461]
  - 1 in [3,461][491,949]
  - 1 in [3,472]
  - 1 in [5,425]
  - 1 in [14,447]
  - 1 in [19,452]
  - 2 in [45,477]
  - 1 in [49,447][502,884]
  - 1 in [51,483]
  - 1 in [53,418][486,851]
  - 1 in [53,438]
  - 1 in [53,438][541,926][1029,1363]
  - 1 in [53,438][541,926][1029,1414][1517,1836]
  - 2 in [57,477]
  - 1 in [63,483]
  - 2 in [71,477]
  - 1 in [77,483]
  - 2 in [78,477]
  - 2 in [83,477]
  - 1 in [84,483]
  - 1 in [89,483]
  - 3 in [94,477]
  - 1 in [100,483]
  - 3 in [120,477]
  - 1 in [126,483]
  - 1 in [136,488]
#kAllDiff: 1
#kExactlyOne: 2 (#literals: 6)
#kLinear2: 589 (#enforced: 534 #multi: 476)
#kLinear3: 124 (#enforced: 72)
#kLinearN: 640 (#enforced: 586) (#terms: 4'759)

Preloading model.
#Bound   0.16s best:inf   next:[141,3284] initial_domain
#Model   0.16s var:156/156 constraints:1356/1356

Starting search at 0.17s with 48 workers.
16 full problem subsolvers: [core, default_lp, lb_tree_search, max_lp, no_lp, objective_lb_search, objective_lb_search_max_lp, objective_lb_search_no_lp, objective_shaving_search_max_lp, objective_shaving_search_no_lp, probing, probing_max_lp, pseudo_costs, quick_restart, quick_restart_no_lp, reduced_costs]
30 first solution subsolvers: [fj_long_default(2), fj_long_lin_default, fj_long_lin_perturb, fj_long_lin_random, fj_long_perturb, fj_long_random, fj_short_default(2), fj_short_lin_default(2), fj_short_lin_perturb, fj_short_lin_random, fj_short_perturb, fj_short_random, fs_random(4), fs_random_no_lp(4), fs_random_quick_restart(4), fs_random_quick_restart_no_lp(3)]
13 incomplete subsolvers: [feasibility_pump, graph_arc_lns, graph_cst_lns, graph_dec_lns, graph_var_lns, rins/rens, rnd_cst_lns, rnd_var_lns, violation_ls(5)]
3 helper subsolvers: [neighborhood_helper, synchronization_agent, update_gap_integral]
#Bound   0.18s best:inf   next:[166,3284] objective_lb_search_no_lp
#1       0.18s best:1303  next:[166,1302] no_lp (fixed_bools=0/78)
#Bound   0.19s best:1303  next:[168,1302] objective_lb_search_no_lp
#Bound   0.19s best:1303  next:[172,1302] objective_lb_search_no_lp
#Bound   0.19s best:1303  next:[173,1302] objective_lb_search_no_lp
#2       0.19s best:895   next:[173,894]  no_lp (fixed_bools=0/87)
#Bound   0.19s best:895   next:[210,894]  objective_lb_search_no_lp
#Bound   0.19s best:895   next:[211,894]  objective_lb_search_no_lp
#Bound   0.19s best:895   next:[216,894]  default_lp
#Bound   0.19s best:895   next:[225,894]  objective_lb_search_no_lp
#Bound   0.19s best:895   next:[248,894]  objective_lb_search_no_lp
#3       0.20s best:861   next:[248,860]  no_lp (fixed_bools=0/95)
#Bound   0.20s best:861   next:[249,860]  objective_lb_search_no_lp
#Bound   0.20s best:861   next:[255,860]  objective_lb_search_no_lp
#4       0.24s best:859   next:[255,858]  graph_dec_lns (d=0.88 s=70 t=0.10 p=1.00 stall=3 h=auto_l0)
#5       0.25s best:843   next:[255,842]  rnd_cst_lns (d=0.88 s=75 t=0.10 p=1.00 stall=3 h=auto_l0)
#Bound   0.26s best:843   next:[277,842]  objective_lb_search
#6       0.26s best:841   next:[277,840]  rnd_cst_lns (d=0.88 s=82 t=0.10 p=1.00 stall=3 h=auto_l0)
#7       0.28s best:833   next:[277,832]  quick_restart_no_lp (fixed_bools=0/125)
#8       0.29s best:832   next:[277,831]  violation_ls(batch:2 #solutions_imported:2 #lin_moves:1 #lin_evals:17'763 #gen_moves:8'514 #gen_evals:1'155 #comp_moves:472 #backtracks:4'013 #weight_updates:77)
#9       0.29s best:831   next:[277,830]  violation_ls(batch:3 #solutions_imported:3 #lin_moves:1 #lin_evals:17'796 #gen_moves:8'529 #gen_evals:1'157 #comp_moves:473 #backtracks:4'020 #weight_updates:77)
#Bound   0.29s best:831   next:[291,830]  objective_lb_search_no_lp
#10      0.29s best:830   next:[291,829]  violation_ls(batch:4 #solutions_imported:4 #lin_moves:1 #lin_evals:17'840 #gen_moves:8'550 #gen_evals:1'159 #comp_moves:474 #backtracks:4'030 #weight_updates:77)
#11      0.29s best:829   next:[291,828]  violation_ls(batch:5 #solutions_imported:5 #lin_moves:2 #lin_evals:17'848 #gen_moves:8'550 #gen_evals:1'159 #comp_moves:474 #backtracks:4'030 #weight_updates:77)
#12      0.29s best:828   next:[291,827]  violation_ls(batch:6 #solutions_imported:6 #lin_moves:3 #lin_evals:17'856 #gen_moves:8'550 #gen_evals:1'159 #comp_moves:474 #backtracks:4'030 #weight_updates:77)
#13      0.29s best:827   next:[291,826]  violation_ls(batch:7 #solutions_imported:7 #lin_moves:3 #lin_evals:17'860 #gen_moves:8'551 #gen_evals:1'159 #comp_moves:475 #backtracks:4'030 #weight_updates:77)
#Bound   0.29s best:827   next:[295,826]  objective_lb_search_no_lp
#Bound   0.30s best:827   next:[324,826]  objective_lb_search_no_lp
#14      0.30s best:783   next:[324,782]  quick_restart_no_lp (fixed_bools=0/129)
#Bound   0.30s best:783   next:[328,782]  objective_lb_search_no_lp
#Bound   0.33s best:783   next:[468,782]  objective_lb_search_no_lp
#Bound   0.35s best:783   next:[470,782]  objective_lb_search_no_lp
#15      0.35s best:782   next:[470,781]  rnd_var_lns (d=0.96 s=92 t=0.10 p=1.00 stall=6 h=auto_l0)
#Bound   0.36s best:782   next:[472,781]  objective_lb_search_no_lp
#Bound   0.39s best:782   next:[473,781]  objective_lb_search
#16      0.43s best:781   next:[479,780]  no_lp (fixed_bools=1/128)
#Bound   0.87s best:781   next:[560,780]  objective_lb_search_no_lp [skipped_logs=7]
#17      2.02s best:762   next:[603,761]  pseudo_costs (fixed_bools=0/91)
#Bound   1.85s best:781   next:[603,780]  objective_lb_search_no_lp [skipped_logs=8]
#18      2.05s best:756   next:[603,755]  rins_pump_lns (d=0.96 s=194 t=0.10 p=1.00 stall=6 h=auto_l0)
#Bound   3.00s best:756   next:[615,755]  objective_lb_search_no_lp [skipped_logs=5]
#Bound   3.75s best:756   next:[621,755]  objective_shaving_search_no_lp (vars=163 csts=1262) [skipped_logs=1]
#Model   4.66s var:155/156 constraints:1246/1356
#Model   4.82s var:154/156 constraints:1211/1356
#Bound   4.94s best:756   next:[672,755]  objective_lb_search_no_lp [skipped_logs=13]
#Model   5.29s var:153/156 constraints:1164/1356
#Model   5.35s var:152/156 constraints:1156/1356
#Model   5.42s var:151/156 constraints:1094/1356
#Done    5.55s no_lp
#Model   5.55s var:137/156 constraints:554/1356
#Done    5.55s core
#Done    5.55s lb_tree_search
#Bound   5.54s best:756   next:[686,755]  objective_lb_search_no_lp [skipped_logs=4]

Task timing                                  n [     min,      max]      avg      dev     time         n [     min,      max]      avg      dev    dtime
                             'core':         1 [   5.38s,    5.38s]    5.38s   0.00ns    5.38s         1 [   1.99s,    1.99s]    1.99s   0.00ns    1.99s
                       'default_lp':         1 [   5.38s,    5.38s]    5.38s   0.00ns    5.38s         1 [759.38ms, 759.38ms] 759.38ms   0.00ns 759.38ms
                 'feasibility_pump':        38 [  7.94ms, 154.37ms]  72.06ms  26.68ms    2.74s        37 [  4.76ms,  10.56ms]   7.01ms 693.11us 259.38ms
                  'fj_long_default':         0 [  0.00ns,   0.00ns]   0.00ns   0.00ns   0.00ns         0 [  0.00ns,   0.00ns]   0.00ns   0.00ns   0.00ns
                  'fj_long_default':         0 [  0.00ns,   0.00ns]   0.00ns   0.00ns   0.00ns         0 [  0.00ns,   0.00ns]   0.00ns   0.00ns   0.00ns
              'fj_long_lin_default':         0 [  0.00ns,   0.00ns]   0.00ns   0.00ns   0.00ns         0 [  0.00ns,   0.00ns]   0.00ns   0.00ns   0.00ns
              'fj_long_lin_perturb':         0 [  0.00ns,   0.00ns]   0.00ns   0.00ns   0.00ns         0 [  0.00ns,   0.00ns]   0.00ns   0.00ns   0.00ns
               'fj_long_lin_random':         0 [  0.00ns,   0.00ns]   0.00ns   0.00ns   0.00ns         0 [  0.00ns,   0.00ns]   0.00ns   0.00ns   0.00ns
                  'fj_long_perturb':         0 [  0.00ns,   0.00ns]   0.00ns   0.00ns   0.00ns         0 [  0.00ns,   0.00ns]   0.00ns   0.00ns   0.00ns
                   'fj_long_random':         0 [  0.00ns,   0.00ns]   0.00ns   0.00ns   0.00ns         0 [  0.00ns,   0.00ns]   0.00ns   0.00ns   0.00ns
                 'fj_short_default':         0 [  0.00ns,   0.00ns]   0.00ns   0.00ns   0.00ns         0 [  0.00ns,   0.00ns]   0.00ns   0.00ns   0.00ns
                 'fj_short_default':         1 [ 89.80ms,  89.80ms]  89.80ms   0.00ns  89.80ms         1 [ 58.22ms,  58.22ms]  58.22ms   0.00ns  58.22ms
             'fj_short_lin_default':         0 [  0.00ns,   0.00ns]   0.00ns   0.00ns   0.00ns         0 [  0.00ns,   0.00ns]   0.00ns   0.00ns   0.00ns
             'fj_short_lin_default':         0 [  0.00ns,   0.00ns]   0.00ns   0.00ns   0.00ns         0 [  0.00ns,   0.00ns]   0.00ns   0.00ns   0.00ns
             'fj_short_lin_perturb':         0 [  0.00ns,   0.00ns]   0.00ns   0.00ns   0.00ns         0 [  0.00ns,   0.00ns]   0.00ns   0.00ns   0.00ns
              'fj_short_lin_random':         0 [  0.00ns,   0.00ns]   0.00ns   0.00ns   0.00ns         0 [  0.00ns,   0.00ns]   0.00ns   0.00ns   0.00ns
                 'fj_short_perturb':         0 [  0.00ns,   0.00ns]   0.00ns   0.00ns   0.00ns         0 [  0.00ns,   0.00ns]   0.00ns   0.00ns   0.00ns
                  'fj_short_random':         0 [  0.00ns,   0.00ns]   0.00ns   0.00ns   0.00ns         0 [  0.00ns,   0.00ns]   0.00ns   0.00ns   0.00ns
                        'fs_random':         1 [ 10.52ms,  10.52ms]  10.52ms   0.00ns  10.52ms         1 [ 20.00ns,  20.00ns]  20.00ns   0.00ns  20.00ns
                        'fs_random':         1 [ 12.39ms,  12.39ms]  12.39ms   0.00ns  12.39ms         0 [  0.00ns,   0.00ns]   0.00ns   0.00ns   0.00ns
                        'fs_random':         1 [ 12.48ms,  12.48ms]  12.48ms   0.00ns  12.48ms         0 [  0.00ns,   0.00ns]   0.00ns   0.00ns   0.00ns
                        'fs_random':         1 [ 12.90ms,  12.90ms]  12.90ms   0.00ns  12.90ms         0 [  0.00ns,   0.00ns]   0.00ns   0.00ns   0.00ns
                  'fs_random_no_lp':         1 [  9.27ms,   9.27ms]   9.27ms   0.00ns   9.27ms         0 [  0.00ns,   0.00ns]   0.00ns   0.00ns   0.00ns
                  'fs_random_no_lp':         1 [  9.89ms,   9.89ms]   9.89ms   0.00ns   9.89ms         0 [  0.00ns,   0.00ns]   0.00ns   0.00ns   0.00ns
                  'fs_random_no_lp':         1 [ 11.10ms,  11.10ms]  11.10ms   0.00ns  11.10ms         0 [  0.00ns,   0.00ns]   0.00ns   0.00ns   0.00ns
                  'fs_random_no_lp':         1 [ 12.09ms,  12.09ms]  12.09ms   0.00ns  12.09ms         0 [  0.00ns,   0.00ns]   0.00ns   0.00ns   0.00ns
          'fs_random_quick_restart':         1 [  9.97ms,   9.97ms]   9.97ms   0.00ns   9.97ms         1 [ 20.00ns,  20.00ns]  20.00ns   0.00ns  20.00ns
          'fs_random_quick_restart':         1 [ 11.12ms,  11.12ms]  11.12ms   0.00ns  11.12ms         1 [ 20.00ns,  20.00ns]  20.00ns   0.00ns  20.00ns
          'fs_random_quick_restart':         1 [ 12.42ms,  12.42ms]  12.42ms   0.00ns  12.42ms         0 [  0.00ns,   0.00ns]   0.00ns   0.00ns   0.00ns
          'fs_random_quick_restart':         1 [ 12.58ms,  12.58ms]  12.58ms   0.00ns  12.58ms         0 [  0.00ns,   0.00ns]   0.00ns   0.00ns   0.00ns
    'fs_random_quick_restart_no_lp':         1 [  9.01ms,   9.01ms]   9.01ms   0.00ns   9.01ms         0 [  0.00ns,   0.00ns]   0.00ns   0.00ns   0.00ns
    'fs_random_quick_restart_no_lp':         1 [ 11.26ms,  11.26ms]  11.26ms   0.00ns  11.26ms         0 [  0.00ns,   0.00ns]   0.00ns   0.00ns   0.00ns
    'fs_random_quick_restart_no_lp':         1 [ 11.91ms,  11.91ms]  11.91ms   0.00ns  11.91ms         0 [  0.00ns,   0.00ns]   0.00ns   0.00ns   0.00ns
                    'graph_arc_lns':        37 [  3.89ms,    1.88s] 754.65ms 602.86ms   27.92s        32 [ 10.00ns, 156.01ms]  58.55ms  44.36ms    1.87s
                    'graph_cst_lns':        37 [  1.17ms,  31.27ms]   3.24ms   5.99ms 119.71ms         1 [ 10.00ns,  10.00ns]  10.00ns   0.00ns  10.00ns
                    'graph_dec_lns':        37 [  4.18ms,    1.73s] 619.76ms 551.15ms   22.93s        33 [ 10.00ns, 172.78ms]  49.21ms  48.23ms    1.62s
                    'graph_var_lns':        37 [  2.88ms,    1.86s] 533.66ms 559.09ms   19.75s        33 [ 10.00ns, 191.07ms]  42.77ms  51.77ms    1.41s
                   'lb_tree_search':         1 [   5.38s,    5.38s]    5.38s   0.00ns    5.38s         1 [930.14ms, 930.14ms] 930.14ms   0.00ns 930.14ms
                           'max_lp':         1 [   5.38s,    5.38s]    5.38s   0.00ns    5.38s         1 [   1.15s,    1.15s]    1.15s   0.00ns    1.15s
                            'no_lp':         1 [   5.38s,    5.38s]    5.38s   0.00ns    5.38s         1 [526.37ms, 526.37ms] 526.37ms   0.00ns 526.37ms
              'objective_lb_search':         1 [   5.38s,    5.38s]    5.38s   0.00ns    5.38s         1 [633.19ms, 633.19ms] 633.19ms   0.00ns 633.19ms
       'objective_lb_search_max_lp':         1 [   5.38s,    5.38s]    5.38s   0.00ns    5.38s         1 [   1.37s,    1.37s]    1.37s   0.00ns    1.37s
        'objective_lb_search_no_lp':         1 [   5.38s,    5.38s]    5.38s   0.00ns    5.38s         1 [476.99ms, 476.99ms] 476.99ms   0.00ns 476.99ms
  'objective_shaving_search_max_lp':        38 [  3.61ms, 438.13ms] 113.93ms 109.44ms    4.33s        26 [ 15.31us,  22.50ms]   4.37ms   6.50ms 113.67ms
   'objective_shaving_search_no_lp':        38 [  2.34ms, 442.99ms] 111.75ms 111.62ms    4.25s        24 [533.18us,  41.70ms]   7.15ms  10.51ms 171.68ms
                          'probing':         1 [   5.38s,    5.38s]    5.38s   0.00ns    5.38s         1 [194.01ms, 194.01ms] 194.01ms   0.00ns 194.01ms
                   'probing_max_lp':         1 [   5.39s,    5.39s]    5.39s   0.00ns    5.39s         1 [358.51ms, 358.51ms] 358.51ms   0.00ns 358.51ms
                     'pseudo_costs':         1 [   5.38s,    5.38s]    5.38s   0.00ns    5.38s         1 [841.04ms, 841.04ms] 841.04ms   0.00ns 841.04ms
                    'quick_restart':         1 [   5.38s,    5.38s]    5.38s   0.00ns    5.38s         1 [686.39ms, 686.39ms] 686.39ms   0.00ns 686.39ms
              'quick_restart_no_lp':         1 [   5.38s,    5.38s]    5.38s   0.00ns    5.38s         1 [467.73ms, 467.73ms] 467.73ms   0.00ns 467.73ms
                    'reduced_costs':         1 [   5.38s,    5.38s]    5.38s   0.00ns    5.38s         1 [729.58ms, 729.58ms] 729.58ms   0.00ns 729.58ms
                        'rins/rens':        38 [  1.02ms,    1.81s] 633.01ms 570.19ms   24.05s        30 [ 10.00ns, 200.26ms]  58.67ms  49.39ms    1.76s
                      'rnd_cst_lns':        37 [  1.32ms,    2.15s] 621.72ms 570.89ms   23.00s        33 [ 10.00ns, 100.10ms]  47.38ms  42.26ms    1.56s
                      'rnd_var_lns':        37 [  2.87ms,    2.36s] 724.75ms 693.89ms   26.82s        32 [ 10.00ns, 277.20ms]  54.01ms  59.38ms    1.73s
                     'violation_ls':        37 [ 17.18ms, 193.54ms]  92.14ms  38.88ms    3.41s        37 [  7.29ms,  56.67ms]  46.78ms  13.06ms    1.73s
                     'violation_ls':        37 [ 32.62ms, 187.11ms]  96.89ms  29.73ms    3.58s        37 [ 16.25ms,  81.24ms]  50.49ms  12.06ms    1.87s
                     'violation_ls':        37 [ 33.46ms, 222.93ms] 108.22ms  44.81ms    4.00s        37 [ 16.57ms,  58.86ms]  48.99ms  10.39ms    1.81s
                     'violation_ls':        37 [201.00us, 169.25ms]  69.08ms  45.12ms    2.56s        37 [  1.14us,  74.81ms]  36.94ms  23.40ms    1.37s
                     'violation_ls':        38 [ 35.74ms, 260.30ms] 111.22ms  51.09ms    4.23s        38 [ 16.76ms,  57.87ms]  47.39ms   9.49ms    1.80s

Search stats                        Bools  Conflicts  Branches  Restarts  BoolPropag  IntegerPropag
                           'core':  2'364      1'940    15'875     5'481   2'962'192      1'304'565
                     'default_lp':     50      2'710    12'996     2'459      53'017      1'344'760
                      'fs_random':     50          0         0         0           0              0
                      'fs_random':     50          0       100       100          12          1'258
                      'fs_random':     50          0       100       100          12          1'258
                      'fs_random':     50          0        28        28          12            196
                'fs_random_no_lp':     50          0         0         0           0              0
                'fs_random_no_lp':     50          0         0         0           0              0
                'fs_random_no_lp':     50          0       103       100          13          1'347
                'fs_random_no_lp':     50          0       119       100          12          1'653
        'fs_random_quick_restart':     50          0         0         0           0              0
        'fs_random_quick_restart':     50          0         0         0           0              0
        'fs_random_quick_restart':     50          0       100       100          12          1'258
        'fs_random_quick_restart':     50          0       100       100          12          1'258
  'fs_random_quick_restart_no_lp':     50          0         0         0           0              0
  'fs_random_quick_restart_no_lp':     50          0       122       100          14          1'542
  'fs_random_quick_restart_no_lp':     50          0        92        92          12          1'195
                 'lb_tree_search':     50         65     5'930       911       5'770        213'541
                         'max_lp':     50      1'307    12'687     3'095      42'038      1'092'169
                          'no_lp':    348      5'620    14'719     2'098     439'208      2'281'699
            'objective_lb_search':     83      1'555    12'947     4'545      40'361        969'682
     'objective_lb_search_max_lp':     71      1'018    10'615     3'105      33'403        815'016
      'objective_lb_search_no_lp':    147      6'467    14'850     2'013     119'210      2'255'868
                        'probing':    132         34       230       230         647          6'679
                 'probing_max_lp':    132         33       231       231         629          6'191
                   'pseudo_costs':    102      1'250    12'677     2'824      53'351      1'032'560
                  'quick_restart':    122        854    15'855     4'778      51'629        885'813
            'quick_restart_no_lp':    212      4'268    19'295     2'506     284'446      1'911'703
                  'reduced_costs':    229      1'229    11'776     2'349     198'612        887'873

SAT stats                           ClassicMinim  LitRemoved  LitLearned  LitForgotten  Subsumed  MClauses  MDecisions  MLitTrue  MSubsumed  MLitRemoved  MReused
                           'core':         1'443       5'214       6'097             0        20     2'442      12'163         0         41          125       16
                     'default_lp':         1'360       2'990      21'629             0       245     1'134       9'044         0        259        1'679      230
                      'fs_random':             0           0           0             0         0         0           0         0          0            0        0
                      'fs_random':             0           0           0             0         0         0           0         0          0            0        0
                      'fs_random':             0           0           0             0         0         0           0         0          0            0        0
                      'fs_random':             0           0           0             0         0         0           0         0          0            0        0
                'fs_random_no_lp':             0           0           0             0         0         0           0         0          0            0        0
                'fs_random_no_lp':             0           0           0             0         0         0           0         0          0            0        0
                'fs_random_no_lp':             0           0           0             0         0         0           0         0          0            0        0
                'fs_random_no_lp':             0           0           0             0         0         0           0         0          0            0        0
        'fs_random_quick_restart':             0           0           0             0         0         0           0         0          0            0        0
        'fs_random_quick_restart':             0           0           0             0         0         0           0         0          0            0        0
        'fs_random_quick_restart':             0           0           0             0         0         0           0         0          0            0        0
        'fs_random_quick_restart':             0           0           0             0         0         0           0         0          0            0        0
  'fs_random_quick_restart_no_lp':             0           0           0             0         0         0           0         0          0            0        0
  'fs_random_quick_restart_no_lp':             0           0           0             0         0         0           0         0          0            0        0
  'fs_random_quick_restart_no_lp':             0           0           0             0         0         0           0         0          0            0        0
                 'lb_tree_search':             1           1         254             0         3       270       1'330         0         23           97       30
                         'max_lp':           653       1'430       9'758             0       117     1'326       9'949         0        249        1'594      349
                          'no_lp':         4'160      12'205      43'036             0       227       762       6'301         0        250        1'560      114
            'objective_lb_search':           819       1'524       9'980             0       182     1'187       7'518         3        211        1'148      224
     'objective_lb_search_max_lp':           544       1'004       6'091             0       129       986       7'308         0        197        1'061      310
      'objective_lb_search_no_lp':         4'820      12'062      39'526             0       280       849       6'412         0        340        1'896      209
                        'probing':             0           0          34             0         0         0           0         0          0            0        0
                 'probing_max_lp':             0           0          33             0         0         0           0         0          0            0        0
                   'pseudo_costs':           489       1'043      10'487             0       168       976       9'639         0        156          980      179
                  'quick_restart':           320         713       8'689             0        75     1'336      10'242         0         93          551      176
            'quick_restart_no_lp':         2'583       7'361      40'226             0       261     1'008       8'780         0        340        2'248      162
                  'reduced_costs':           585       1'238       9'584             0        94       992       6'894         2        284        1'584      281

Lp stats                         Component  Iterations  AddedCuts  OPTIMAL  DUAL_F.  DUAL_U.
                  'default_lp':          1      24'198      2'064    3'578        0        0
                   'fs_random':          1           0          0        0        0        0
                   'fs_random':          1           0          0        0        0        0
                   'fs_random':          1           0          0        0        0        0
                   'fs_random':          1          43         50        3        0        0
     'fs_random_quick_restart':          1           0          0        0        0        0
     'fs_random_quick_restart':          1           0          0        0        0        0
     'fs_random_quick_restart':          1           0          0        0        0        0
     'fs_random_quick_restart':          1          43          0        2        0        0
              'lb_tree_search':          1      33'954      2'334    2'335      910        0
                      'max_lp':          1      26'105      2'232    1'633      519        1
         'objective_lb_search':          1      19'277      2'167    2'282        0        0
  'objective_lb_search_max_lp':          1      31'695      2'087    1'307      535        0
                     'probing':          1       2'147      1'454      558        0        1
              'probing_max_lp':          1       1'812      2'200      361       10        0
                'pseudo_costs':          1      23'005      2'614    1'585      446        0
               'quick_restart':          1      16'756      2'194    2'365        0        0
               'reduced_costs':          1      17'947      2'723    1'753      328        1

Lp dimension                                                                     Final dimension of first component
                  'default_lp':   265 rows, 153 columns, 920 entries with magnitude in [1.926261e-02, 1.000000e+00]
                   'fs_random':       0 rows, 153 columns, 0 entries with magnitude in [0.000000e+00, 0.000000e+00]
                   'fs_random':       0 rows, 153 columns, 0 entries with magnitude in [0.000000e+00, 0.000000e+00]
                   'fs_random':       0 rows, 153 columns, 0 entries with magnitude in [0.000000e+00, 0.000000e+00]
                   'fs_random':    45 rows, 153 columns, 177 entries with magnitude in [6.769126e-02, 1.000000e+00]
     'fs_random_quick_restart':       0 rows, 153 columns, 0 entries with magnitude in [0.000000e+00, 0.000000e+00]
     'fs_random_quick_restart':       0 rows, 153 columns, 0 entries with magnitude in [0.000000e+00, 0.000000e+00]
     'fs_random_quick_restart':       0 rows, 153 columns, 0 entries with magnitude in [0.000000e+00, 0.000000e+00]
     'fs_random_quick_restart':    44 rows, 153 columns, 175 entries with magnitude in [6.769126e-02, 1.000000e+00]
              'lb_tree_search':  554 rows, 156 columns, 2124 entries with magnitude in [1.688574e-03, 1.000000e+00]
                      'max_lp':  498 rows, 156 columns, 1918 entries with magnitude in [2.013805e-03, 1.000000e+00]
         'objective_lb_search':  329 rows, 153 columns, 1342 entries with magnitude in [2.094747e-03, 1.000000e+00]
  'objective_lb_search_max_lp':  630 rows, 156 columns, 2868 entries with magnitude in [2.602110e-03, 1.000000e+00]
                     'probing':   204 rows, 153 columns, 944 entries with magnitude in [4.637503e-03, 1.000000e+00]
              'probing_max_lp':  381 rows, 156 columns, 2412 entries with magnitude in [4.533049e-03, 1.000000e+00]
                'pseudo_costs':  515 rows, 156 columns, 2128 entries with magnitude in [9.515090e-03, 1.000000e+00]
               'quick_restart':  419 rows, 153 columns, 2089 entries with magnitude in [1.969295e-03, 1.000000e+00]
               'reduced_costs':  442 rows, 156 columns, 1706 entries with magnitude in [5.384063e-03, 1.000000e+00]

Lp debug                         CutPropag  CutEqPropag  Adjust  Overflow      Bad  BadScaling
                  'default_lp':          1           10   2'054         0   22'240           0
                   'fs_random':          0            0       0         0        0           0
                   'fs_random':          0            0       0         0        0           0
                   'fs_random':          0            0       0         0        0           0
                   'fs_random':          0            0       0         0        0           0
     'fs_random_quick_restart':          0            0       0         0        0           0
     'fs_random_quick_restart':          0            0       0         0        0           0
     'fs_random_quick_restart':          0            0       0         0        0           0
     'fs_random_quick_restart':          0            0       0         0        0           0
              'lb_tree_search':          7            0   1'344         0    6'546           0
                      'max_lp':         11            0     998         0   16'750           0
         'objective_lb_search':          0           92   1'493         0   26'342           0
  'objective_lb_search_max_lp':         23            0   1'052         0   21'471           0
                     'probing':          1            1     378         0  168'813           0
              'probing_max_lp':          9            2     278         0  136'790           0
                'pseudo_costs':         12            0     824         0   15'008           0
               'quick_restart':          1           11   1'342         0   35'899           0
               'reduced_costs':         17            0   1'071         0   18'711           0

Lp pool                          Constraints  Updates  Simplif  Merged  Shortened  Split  Strenghtened    Cuts/Call
                  'default_lp':        2'211      201    1'724      16        725    879           580  2'064/4'966
                   'fs_random':          163        0        0       0          0      0             0          0/0
                   'fs_random':          163        0        0       0          0      0             0          0/0
                   'fs_random':          163        0        0       0          0      0             0          0/0
                   'fs_random':          213        0        0       0          0      0             0        50/50
     'fs_random_quick_restart':          163        0        0       0          0      0             0          0/0
     'fs_random_quick_restart':          163        0        0       0          0      0             0          0/0
     'fs_random_quick_restart':          163        0        0       0          0      0             0          0/0
     'fs_random_quick_restart':          163        0        0       0          0      0             0          0/0
              'lb_tree_search':        3'662      128    6'014      27      1'274    132         8'371  2'334/4'891
                      'max_lp':        3'563      163    7'321      24        772    221        11'156  2'232/4'471
         'objective_lb_search':        2'330      200    1'579       0        661  1'336           681  2'167/4'408
  'objective_lb_search_max_lp':        3'438      174    8'139       4        597    449        11'004  2'087/4'086
                     'probing':        1'617      177       47       0          0    602           157  1'454/2'530
              'probing_max_lp':        3'548      142    1'612       7          0    362         2'693  2'200/3'921
                'pseudo_costs':        3'941      129    6'700      28        590    110         9'649  2'614/5'246
               'quick_restart':        2'356      200    1'252       1        240  1'351           731  2'194/4'634
               'reduced_costs':        4'058      162    8'532      20      1'041    303        11'890  2'723/5'639

Lp Cut            fs_ran  defaul  max_lp  quick_  reduce  pseudo  lb_tre  probin  object  probin  object
          CG_FF:       -     121     104      93     131     165     150      51     124     145      82
           CG_K:       -      68      78      35      85      66      63      26      55      45      31
           CG_R:       -      64      99      75      65      38      98      21      75      69      36
          CG_RB:       -     297     281     410     319     387     440     215     440     395     217
         CG_RBP:       -      44      51      56      25      35      63      39      63      42      18
         Clique:       -       -      18       -      18      17      27       -       -       2      23
             IB:      50     332     211     323     287     305     236     246     308     141     266
       MIR_1_FF:       -      97     176     113     154     160     168      75     115     155     124
        MIR_1_K:       -      18      22      12      18      24      34      13      18      21       8
        MIR_1_R:       -      16       9      21      18      20      11       8      19      11      10
       MIR_1_RB:       -     173     246     197     315     257     223     132     170     221     220
      MIR_1_RBP:       -      12      25      12      35      38      39       3      11      23      28
      MIR_1_RLT:       -       -       -       -       -       1       2       -       -       2       -
       MIR_2_FF:       -      57      84      58     103      93      80      31      84      82      77
        MIR_2_K:       -      13      20      15      25      18      19       4       9      10      17
       MIR_2_KL:       -       1       -       3       4       2       -       -       2       -       1
        MIR_2_R:       -      17      26      13      49      29      21      10      32      33      34
       MIR_2_RB:       -     108     146     114     177     161     110      73     117     131     113
      MIR_2_RBP:       -      12      20      10      39      33      21       5      13      19      24
       MIR_3_FF:       -      45      40      33      62      61      41      30      32      41      52
        MIR_3_K:       -      10      11      13      17      17      12       6      10      11       9
       MIR_3_KL:       -       2       -       2       -       1       -       -       2       2       1
        MIR_3_R:       -      21      12      20      26      27       6       9      19      17      29
       MIR_3_RB:       -      62      68      82      92      93      50      50      69      45      75
      MIR_3_RBP:       -      16      14       9      23      22      11       7      11       4      17
       MIR_4_FF:       -      25      27      23      26      37      28      21      25      17      20
        MIR_4_K:       -       5       5       7      12       8       9       7       5       5       7
       MIR_4_KL:       -       1       1       1       -       -       -       -       -       -       1
        MIR_4_R:       -      12       8      12      14      20       7       6      13       9      11
       MIR_4_RB:       -      47      41      48      45      54      36      26      45      22      31
      MIR_4_RBP:       -      10       9       1       9      11       6       -       5       2       2
       MIR_5_FF:       -      21      16      11      15       6       8       7      10       5       9
        MIR_5_K:       -       7       5       4      11       2       4       3       7       1       3
       MIR_5_KL:       -       -       -       1       1       -       -       -       2       -       -
        MIR_5_R:       -      12      11       5       9       3       3       3       8       1       7
       MIR_5_RB:       -      24      18      27      20      15      14      13      16      13      11
      MIR_5_RBP:       -       5       2       3      11       3       4       1       3       -       1
       MIR_6_FF:       -       7       5       7       3       7       3       3       3       2       2
        MIR_6_K:       -       3       2       2       2       1       -       2       1       1       -
       MIR_6_KL:       -       4       -       -       -       -       -       -       3       -       -
        MIR_6_R:       -       7       6       3       5       5       3       3       3       -       3
       MIR_6_RB:       -      12      12      16       9      12       3       9       9       3       2
      MIR_6_RBP:       -       4       2       3       4       1       2       1       -       -       -
   ZERO_HALF_FF:       -      28      29      28      57      42      40      19      22      32      30
    ZERO_HALF_K:       -       4       5       2       3       5      10       2       3       1       4
    ZERO_HALF_R:       -     173     183     208     270     225     129     228     132     341     337
   ZERO_HALF_RB:       -      42      67      57      88      74      69      37      46      56      72
  ZERO_HALF_RBP:       -       5      17       6      22      13      31       9       8      22      22

LNS stats           Improv/Calls  Closed  Difficulty  TimeLimit
  'graph_arc_lns':          1/37     57%        0.97       0.10
  'graph_cst_lns':           0/1    100%        0.71       0.10
  'graph_dec_lns':          2/37     57%        0.97       0.10
  'graph_var_lns':          3/37     59%        0.98       0.10
      'rins/rens':          7/36     56%        0.92       0.10
    'rnd_cst_lns':          3/36     61%        0.98       0.10
    'rnd_var_lns':          4/37     54%        0.97       0.10

LS stats                   Batches  Restarts  LinMoves  GenMoves  CompoundMoves  WeightUpdates
       'fj_long_default':        0         0         0         0              0              0
       'fj_long_default':        0         0         0         0              0              0
   'fj_long_lin_default':        0         0         0         0              0              0
   'fj_long_lin_perturb':        0         0         0         0              0              0
    'fj_long_lin_random':        0         0         0         0              0              0
       'fj_long_perturb':        0         0         0         0              0              0
        'fj_long_random':        0         0         0         0              0              0
      'fj_short_default':        0         0         0         0              0              0
      'fj_short_default':        1         1         0     4'113            533             10
  'fj_short_lin_default':        0         0         0         0              0              0
  'fj_short_lin_default':        0         0         0         0              0              0
  'fj_short_lin_perturb':        0         0         0         0              0              0
   'fj_short_lin_random':        0         0         0         0              0              0
      'fj_short_perturb':        0         0         0         0              0              0
       'fj_short_random':        0         0         0         0              0              0
          'violation_ls':       37         0    14'837   219'509         11'420         16'047
          'violation_ls':       37         0   187'596    17'312          1'013        102'565
          'violation_ls':       37         0   273'403    25'167          1'608         66'845
          'violation_ls':       37         0    31'058   167'359         13'776         21'600
          'violation_ls':       38         0   186'241    99'980         10'357         18'004

Solutions (18)            Num     Rank
        'graph_dec_lns':    1    [4,4]
                'no_lp':    4   [1,16]
         'pseudo_costs':    1  [17,17]
  'quick_restart_no_lp':    2   [7,14]
        'rins_pump_lns':    1  [18,18]
          'rnd_cst_lns':    2    [5,6]
          'rnd_var_lns':    1  [15,15]
         'violation_ls':    6   [8,13]

Objective bounds                     Num
                      'default_lp':    1
                  'initial_domain':    1
             'objective_lb_search':    4
      'objective_lb_search_max_lp':    1
       'objective_lb_search_no_lp':   56
  'objective_shaving_search_no_lp':    2

Solution repositories    Added  Queried  Ignored  Synchro
  'feasible solutions':    165      730       12      136
        'lp solutions':     56        9        0       52
                'pump':    766       28

Improving bounds shared          Num
                        'core':    8
                  'default_lp':   42
              'lb_tree_search':   58
                      'max_lp':   20
                       'no_lp':  246
         'objective_lb_search':   32
  'objective_lb_search_max_lp':   21
                     'probing':   61
              'probing_max_lp':   20
                'pseudo_costs':   15
               'quick_restart':   13
         'quick_restart_no_lp':   46
               'reduced_costs':   36

Clauses shared                   Num
                  'default_lp':   14
              'lb_tree_search':    1
                      'max_lp':   10
                       'no_lp':   28
         'objective_lb_search':   11
  'objective_lb_search_max_lp':    1
   'objective_lb_search_no_lp':    3
                'pseudo_costs':    1
               'quick_restart':    3
         'quick_restart_no_lp':   13
               'reduced_costs':   14

CpSolverResponse summary:
status: OPTIMAL
objective: 756
best_bound: 756
integers: 154
booleans: 50
conflicts: 0
branches: 100
propagations: 12
integer_propagations: 1258
restarts: 100
lp_iterations: 43
walltime: 5.57664
usertime: 5.57664
deterministic_time: 30.264
gap_integral: 92.1221
solution_fingerprint: 0x66aa212c9bd4de38


--- Simulation Gantt  partir du modle mathmatique ---
{'big':1, 'due_date':89, 'pos_time':5, 'status':0, 'blocked':0, 'operations':["{'type':0, 'processing_time':58}"]}
{'big':0, 'due_date':105, 'pos_time':5, 'status':0, 'blocked':0, 'operations':["{'type':0, 'processing_time':44}", "{'type':1, 'processing_time':45}"]}
{'big':1, 'due_date':63, 'pos_time':5, 'status':0, 'blocked':0, 'operations':["{'type':0, 'processing_time':60}"]}
{'big':0, 'due_date':82, 'pos_time':5, 'status':0, 'blocked':0, 'operations':["{'type':1, 'processing_time':22}"]}
{'big':1, 'due_date':56, 'pos_time':5, 'status':0, 'blocked':0, 'operations':["{'type':1, 'processing_time':11}"]}
{'big':0, 'due_date':131, 'pos_time':5, 'status':0, 'blocked':0, 'operations':["{'type':1, 'processing_time':10}", "{'type':0, 'processing_time':31}"]}
{'big':1, 'due_date':94, 'pos_time':5, 'status':0, 'blocked':0, 'operations':["{'type':0, 'processing_time':45}"]}
