created virtual environment CPython3.12.4.final.0-64 in 9078ms
  creator CPython3Posix(dest=/localscratch/aneumann.63393136.0/env, clear=False, no_vcs_ignore=False, global=False)
  seeder FromAppData(download=False, pip=bundle, via=copy, app_data_dir=/home/aneumann/.local/share/virtualenv)
    added seed packages: pip==25.1.1
  activators BashActivator,CShellActivator,FishActivator,NushellActivator,PowerShellActivator,PythonActivator
Looking in links: /cvmfs/soft.computecanada.ca/custom/python/wheelhouse/gentoo2023/x86-64-v3, /cvmfs/soft.computecanada.ca/custom/python/wheelhouse/gentoo2023/generic, /cvmfs/soft.computecanada.ca/custom/python/wheelhouse/generic
Requirement already satisfied: pip in /localscratch/aneumann.63393136.0/env/lib/python3.12/site-packages (25.1.1)
Looking in links: /cvmfs/soft.computecanada.ca/custom/python/wheelhouse/gentoo2023/x86-64-v3, /cvmfs/soft.computecanada.ca/custom/python/wheelhouse/gentoo2023/generic, /cvmfs/soft.computecanada.ca/custom/python/wheelhouse/generic
ERROR: protobuf-5.28.3-cp38-abi3-manylinux2014_x86_64.whl is not a supported wheel on this platform.
Looking in links: /cvmfs/soft.computecanada.ca/custom/python/wheelhouse/gentoo2023/x86-64-v3, /cvmfs/soft.computecanada.ca/custom/python/wheelhouse/gentoo2023/generic, /cvmfs/soft.computecanada.ca/custom/python/wheelhouse/generic
Processing /home/aneumann/projects/def-adhaj/aneumann/GNRS/wheels/immutabledict-4.2.0-py3-none-any.whl
Installing collected packages: immutabledict
Successfully installed immutabledict-4.2.0
Looking in links: /cvmfs/soft.computecanada.ca/custom/python/wheelhouse/gentoo2023/x86-64-v3, /cvmfs/soft.computecanada.ca/custom/python/wheelhouse/gentoo2023/generic, /cvmfs/soft.computecanada.ca/custom/python/wheelhouse/generic
Processing /cvmfs/soft.computecanada.ca/custom/python/wheelhouse/generic/ortools-9.10.4067+computecanada-cp312-cp312-linux_x86_64.whl (from -r /home/aneumann/projects/def-adhaj/aneumann/GNRS/requirements/or.txt (line 1))
Processing /cvmfs/soft.computecanada.ca/custom/python/wheelhouse/gentoo2023/x86-64-v3/matplotlib-3.10.0+computecanada-cp312-cp312-linux_x86_64.whl (from -r /home/aneumann/projects/def-adhaj/aneumann/GNRS/requirements/or.txt (line 2))
Processing /cvmfs/soft.computecanada.ca/custom/python/wheelhouse/gentoo2023/x86-64-v3/pandas-2.2.3+computecanada-cp312-cp312-linux_x86_64.whl (from -r /home/aneumann/projects/def-adhaj/aneumann/GNRS/requirements/or.txt (line 3))
Processing /cvmfs/soft.computecanada.ca/custom/python/wheelhouse/generic/absl_py-2.2.2+computecanada-py3-none-any.whl (from ortools<9.11,>=9.10->-r /home/aneumann/projects/def-adhaj/aneumann/GNRS/requirements/or.txt (line 1))
Processing /cvmfs/soft.computecanada.ca/custom/python/wheelhouse/gentoo2023/generic/numpy-2.2.2+computecanada-cp312-cp312-linux_x86_64.whl (from ortools<9.11,>=9.10->-r /home/aneumann/projects/def-adhaj/aneumann/GNRS/requirements/or.txt (line 1))
Processing /cvmfs/soft.computecanada.ca/custom/python/wheelhouse/gentoo2023/x86-64-v3/protobuf-6.30.2+computecanada-cp312-cp312-linux_x86_64.whl (from ortools<9.11,>=9.10->-r /home/aneumann/projects/def-adhaj/aneumann/GNRS/requirements/or.txt (line 1))
Requirement already satisfied: immutabledict>=3.0.0 in /localscratch/aneumann.63393136.0/env/lib/python3.12/site-packages (from ortools<9.11,>=9.10->-r /home/aneumann/projects/def-adhaj/aneumann/GNRS/requirements/or.txt (line 1)) (4.2.0)
Processing /cvmfs/soft.computecanada.ca/custom/python/wheelhouse/gentoo2023/generic/contourpy-1.3.1+computecanada-cp312-cp312-linux_x86_64.whl (from matplotlib->-r /home/aneumann/projects/def-adhaj/aneumann/GNRS/requirements/or.txt (line 2))
Processing /cvmfs/soft.computecanada.ca/custom/python/wheelhouse/generic/cycler-0.12.1+computecanada-py3-none-any.whl (from matplotlib->-r /home/aneumann/projects/def-adhaj/aneumann/GNRS/requirements/or.txt (line 2))
Processing /cvmfs/soft.computecanada.ca/custom/python/wheelhouse/generic/fonttools-4.58.2+computecanada-cp312-cp312-linux_x86_64.whl (from matplotlib->-r /home/aneumann/projects/def-adhaj/aneumann/GNRS/requirements/or.txt (line 2))
Processing /cvmfs/soft.computecanada.ca/custom/python/wheelhouse/gentoo2023/x86-64-v3/kiwisolver-1.4.8+computecanada-cp312-cp312-linux_x86_64.whl (from matplotlib->-r /home/aneumann/projects/def-adhaj/aneumann/GNRS/requirements/or.txt (line 2))
Processing /cvmfs/soft.computecanada.ca/custom/python/wheelhouse/generic/packaging-25.0+computecanada-py3-none-any.whl (from matplotlib->-r /home/aneumann/projects/def-adhaj/aneumann/GNRS/requirements/or.txt (line 2))
Processing /cvmfs/soft.computecanada.ca/custom/python/wheelhouse/gentoo2023/x86-64-v3/pillow-11.1.0+computecanada-cp312-cp312-linux_x86_64.whl (from matplotlib->-r /home/aneumann/projects/def-adhaj/aneumann/GNRS/requirements/or.txt (line 2))
Processing /cvmfs/soft.computecanada.ca/custom/python/wheelhouse/generic/pyparsing-3.2.1+computecanada-py3-none-any.whl (from matplotlib->-r /home/aneumann/projects/def-adhaj/aneumann/GNRS/requirements/or.txt (line 2))
Processing /cvmfs/soft.computecanada.ca/custom/python/wheelhouse/generic/python_dateutil-2.9.0.post0+computecanada-py2.py3-none-any.whl (from matplotlib->-r /home/aneumann/projects/def-adhaj/aneumann/GNRS/requirements/or.txt (line 2))
Processing /cvmfs/soft.computecanada.ca/custom/python/wheelhouse/generic/pytz-2025.2+computecanada-py2.py3-none-any.whl (from pandas->-r /home/aneumann/projects/def-adhaj/aneumann/GNRS/requirements/or.txt (line 3))
Processing /cvmfs/soft.computecanada.ca/custom/python/wheelhouse/generic/tzdata-2025.2+computecanada-py2.py3-none-any.whl (from pandas->-r /home/aneumann/projects/def-adhaj/aneumann/GNRS/requirements/or.txt (line 3))
Processing /cvmfs/soft.computecanada.ca/custom/python/wheelhouse/generic/six-1.17.0+computecanada-py2.py3-none-any.whl (from python-dateutil>=2.7->matplotlib->-r /home/aneumann/projects/def-adhaj/aneumann/GNRS/requirements/or.txt (line 2))
Installing collected packages: pytz, tzdata, six, pyparsing, protobuf, pillow, packaging, numpy, kiwisolver, fonttools, cycler, absl-py, python-dateutil, contourpy, pandas, matplotlib, ortools

Successfully installed absl-py-2.2.2+computecanada contourpy-1.3.1+computecanada cycler-0.12.1+computecanada fonttools-4.58.2+computecanada kiwisolver-1.4.8+computecanada matplotlib-3.10.0+computecanada numpy-2.2.2+computecanada ortools-9.10.4067+computecanada packaging-25.0+computecanada pandas-2.2.3+computecanada pillow-11.1.0+computecanada protobuf-6.30.2+computecanada pyparsing-3.2.1+computecanada python-dateutil-2.9.0.post0+computecanada pytz-2025.2+computecanada six-1.17.0+computecanada tzdata-2025.2+computecanada

Starting CP-SAT solver v9.10.4067
Parameters: max_time_in_seconds: 3600 max_memory_in_mb: 12000 log_search_progress: true enumerate_all_solutions: false absolute_gap_limit: 0 relative_gap_limit: 0
Setting number of workers to 48

Initial optimization model '': (model_fingerprint: 0x4c9089aedca2f2e8)
#Variables: 241 (#ints: 6 in objective)
  - 170 Booleans in [0,1]
  - 71 in [0,616]
#kLinear1: 35
#kLinear2: 355
#kLinear3: 85
#kLinearN: 1'365 (#terms: 15'609)

Starting presolve at 0.00s
  8.04e-04s  0.00e+00d  [DetectDominanceRelations] 
  1.92e-02s  0.00e+00d  [PresolveToFixPoint] #num_loops=6 #num_dual_strengthening=3 
  2.06e-05s  0.00e+00d  [ExtractEncodingFromLinear] #potential_supersets=2 
[Symmetry] Graph for symmetry has 1'761 nodes and 10'436 arcs.
[Symmetry] Symmetry computation done. time: 0.00121522 dtime: 0.00095456
[Symmetry] #generators: 1, average support size: 14
[Symmetry] The model contains 235 duplicate constraints !
[Symmetry] 7 orbits with sizes: 2,2,2,2,2,2,2
[Symmetry] Num fixable by intersecting at_most_one with orbits: 1 largest_orbit: 2
  4.69e-03s  5.90e-04d  [Probe] #probed=240 #fixed_bools=5 #new_bounds=18 #equiv=1 
  4.83e-05s  0.00e+00d  [MaxClique] Merged 26(52 literals) into 10(20 literals) at_most_ones. 
  7.56e-04s  0.00e+00d  [DetectDominanceRelations] 
  9.41e-03s  0.00e+00d  [PresolveToFixPoint] #num_loops=4 #num_dual_strengthening=3 
  2.22e-03s  0.00e+00d  [ProcessAtMostOneAndLinear] 
  1.39e-03s  0.00e+00d  [DetectDuplicateConstraints] #duplicates=271 #without_enforcements=117 
  6.59e-04s  2.92e-05d  [DetectDominatedLinearConstraints] #relevant_constraints=802 #num_inclusions=416 #num_redundant=3 
  1.96e-04s  0.00e+00d  [DetectDifferentVariables] #different=27 
  2.01e-04s  8.65e-06d  [ProcessSetPPC] #relevant_constraints=497 
  1.49e-05s  0.00e+00d  [FindAlmostIdenticalLinearConstraints] 
  4.55e-05s  2.74e-05d  [FindBigAtMostOneAndLinearOverlap] 
  1.84e-03s  6.05e-04d  [FindBigVerticalLinearOverlap] #blocks=14 #saved_nz=758 
  1.04e-04s  2.34e-05d  [FindBigHorizontalLinearOverlap] #linears=486 
  7.41e-06s  0.00e+00d  [MergeClauses] 
  7.57e-04s  0.00e+00d  [DetectDominanceRelations] 
  8.27e-03s  0.00e+00d  [PresolveToFixPoint] #num_loops=2 #num_dual_strengthening=1 
  7.53e-04s  0.00e+00d  [DetectDominanceRelations] 
  5.25e-03s  0.00e+00d  [PresolveToFixPoint] #num_loops=1 #num_dual_strengthening=1 
[Symmetry] Graph for symmetry has 1'468 nodes and 8'471 arcs.
[Symmetry] Symmetry computation done. time: 0.000356759 dtime: 0.00046635
  4.21e-03s  5.59e-04d  [Probe] #probed=230 #new_bounds=25 
  8.75e-06s  0.00e+00d  [MaxClique] 
  7.47e-04s  0.00e+00d  [DetectDominanceRelations] 
  9.66e-03s  0.00e+00d  [PresolveToFixPoint] #num_loops=4 #num_dual_strengthening=3 
  1.87e-03s  0.00e+00d  [ProcessAtMostOneAndLinear] 
  1.11e-03s  0.00e+00d  [DetectDuplicateConstraints] #without_enforcements=120 
  3.72e-04s  1.65e-05d  [DetectDominatedLinearConstraints] #relevant_constraints=609 #num_inclusions=10 
  1.95e-04s  0.00e+00d  [DetectDifferentVariables] #different=35 #cliques=3 #size=9 
  1.88e-04s  7.30e-06d  [ProcessSetPPC] #relevant_constraints=476 
  2.00e-05s  1.50e-08d  [FindAlmostIdenticalLinearConstraints] #num_tested_pairs=1 
  3.75e-05s  1.97e-05d  [FindBigAtMostOneAndLinearOverlap] 
  1.48e-03s  5.27e-04d  [FindBigVerticalLinearOverlap] #blocks=11 #saved_nz=545 
  1.02e-04s  2.00e-05d  [FindBigHorizontalLinearOverlap] #linears=470 
  7.42e-06s  0.00e+00d  [MergeClauses] 
  7.75e-04s  0.00e+00d  [DetectDominanceRelations] 
  7.91e-03s  0.00e+00d  [PresolveToFixPoint] #num_loops=2 #num_dual_strengthening=1 
  7.76e-04s  0.00e+00d  [DetectDominanceRelations] 
  5.89e-03s  0.00e+00d  [PresolveToFixPoint] #num_loops=1 #num_dual_strengthening=1 
  4.21e-03s  5.46e-04d  [Probe] #probed=230 #new_bounds=9 
  8.81e-06s  0.00e+00d  [MaxClique] 
  7.75e-04s  0.00e+00d  [DetectDominanceRelations] 
  7.41e-03s  0.00e+00d  [PresolveToFixPoint] #num_loops=2 #num_dual_strengthening=1 
  1.76e-03s  0.00e+00d  [ProcessAtMostOneAndLinear] 
  1.12e-03s  0.00e+00d  [DetectDuplicateConstraints] #without_enforcements=130 
  3.37e-04s  1.40e-05d  [DetectDominatedLinearConstraints] #relevant_constraints=591 #num_inclusions=10 
  1.09e-04s  0.00e+00d  [DetectDifferentVariables] 
  1.67e-04s  5.85e-06d  [ProcessSetPPC] #relevant_constraints=444 
  2.24e-05s  6.00e-08d  [FindAlmostIdenticalLinearConstraints] #num_tested_pairs=4 
  3.59e-05s  1.68e-05d  [FindBigAtMostOneAndLinearOverlap] 
  1.02e-03s  4.41e-04d  [FindBigVerticalLinearOverlap] #blocks=3 #saved_nz=118 
  9.50e-05s  1.84e-05d  [FindBigHorizontalLinearOverlap] #linears=444 
  7.03e-06s  0.00e+00d  [MergeClauses] 
  7.62e-04s  0.00e+00d  [DetectDominanceRelations] 
  6.37e-03s  0.00e+00d  [PresolveToFixPoint] #num_loops=2 #num_dual_strengthening=1 
  4.24e-05s  0.00e+00d  [ExpandObjective] #entries=84 #tight_variables=33 #tight_constraints=21 

Presolve summary:
  - 51 affine relations were detected.
  - rule 'TODO dual: only one blocking constraint?' was applied 447 times.
  - rule 'TODO dual: only one unspecified blocking constraint?' was applied 90 times.
  - rule 'TODO duplicate: identical constraint with different enforcements' was applied 367 times.
  - rule 'TODO no_overlap: with task always last' was applied 3 times.
  - rule 'affine: new relation' was applied 51 times.
  - rule 'all_diff: inferred from x != y constraints' was applied 3 times.
  - rule 'at_most_one: removed literals' was applied 10 times.
  - rule 'at_most_one: size one' was applied 10 times.
  - rule 'at_most_one: transformed into max clique.' was applied 1 time.
  - rule 'deductions: 180 stored' was applied 1 time.
  - rule 'dual: fix variable' was applied 15 times.
  - rule 'dual: reduced domain' was applied 42 times.
  - rule 'duplicate: merged rhs of linear constraint' was applied 42 times.
  - rule 'duplicate: removed constraint' was applied 271 times.
  - rule 'enforcement: false literal' was applied 29 times.
  - rule 'enforcement: true literal' was applied 22 times.
  - rule 'exactly_one: x and not(x)' was applied 1 time.
  - rule 'incompatible linear: add implication' was applied 30 times.
  - rule 'linear inclusion: redundant containing constraint' was applied 3 times.
  - rule 'linear matrix: common vertical rectangle' was applied 28 times.
  - rule 'linear: always true' was applied 440 times.
  - rule 'linear: doubleton free' was applied 10 times.
  - rule 'linear: empty' was applied 26 times.
  - rule 'linear: extracted enforcement literal' was applied 3'274 times.
  - rule 'linear: fixed or dup variables' was applied 1'392 times.
  - rule 'linear: positive equal one' was applied 2 times.
  - rule 'linear: reduced variable domains' was applied 118 times.
  - rule 'linear: remapped using affine relations' was applied 1'348 times.
  - rule 'linear: simplified rhs' was applied 4'613 times.
  - rule 'linear: variable substitution 1' was applied 10 times.
  - rule 'linear: variable substitution 2' was applied 2 times.
  - rule 'presolve: 75 unused variables removed.' was applied 1 time.
  - rule 'presolve: iteration' was applied 3 times.
  - rule 'probing: reduced enforced constraint to implication.' was applied 26 times.
  - rule 'symmetry: fixed to false in general orbit' was applied 1 time.

Presolved optimization model '': (model_fingerprint: 0x237dfb1ef4d5220e)
#Variables: 131 (#ints: 6 in objective)
  - 54 Booleans in [0,1]
  - 1 in [-1738,-1361][-1229,-745][-613,-129][3,487][619,1036]
  - 1 in [-1163,-680][-547,-64][69,552][685,1087]
  - 1 in [-1163,-680][-547,-64][69,552][685,1168][1301,1703]
  - 1 in [-616,-132][0,484]
  - 1 in [-610,-129][3,487][619,1097]
  - 1 in [-610,-106][3,510][619,1093]
  - 1 in [-552,-19][64,597][680,1166]
  - 1 in [-552,-19][64,597][680,1213][1296,1829][1912,2398]
  - 1 in [-551,-19][64,597][680,1213][1296,1781]
  - 1 in [-551,-17][32,599][648,1215][1264,1831][1880,2447][2496,3063][3112,3679][3728,4295][4344,4780]
  - 1 in [-547,-64][69,552][685,1087]
  - 1 in [-483,-106][3,510][619,1126][1235,1742][1851,2275]
  - 1 in [-2,484]
  - 1 in [-2,534]
  - 1 in [-2,568]
  - 4 in [0,401]
  - 2 in [0,435]
  - 1 in [0,451]
  - 1 in [0,463]
  - 1 in [0,468]
  - 1 in [0,483]
  - 3 in [0,484]
  - 1 in [0,485]
  - 3 in [0,507]
  - 1 in [0,507][616,1123]
  - 1 in [0,533]
  - 1 in [0,567]
  - 1 in [3,486]
  - 1 in [3,487]
  - 1 in [3,487][619,1097]
  - 1 in [3,510]
  - 1 in [3,510][619,1120]
  - 1 in [3,536]
  - 1 in [3,570]
  - 1 in [18,551]
  - 1 in [32,599]
  - 1 in [32,599][648,1215][1264,1750]
  - 1 in [57,564]
  - 1 in [62,569]
  - 1 in [64,548]
  - 1 in [64,597]
  - 1 in [64,597][680,1213][1296,1829][1912,2445][2528,3061]
  - 1 in [65,599][648,1215][1264,1831][1880,2447][2496,2932]
  - 1 in [69,552]
  - 1 in [69,552][685,1168]
  - 1 in [69,553]
  - 1 in [72,599][648,1215][1264,1831][1880,2366]
  - 1 in [72,599][648,1215][1264,1831][1880,2447][2496,2932]
  - 3 in [72,605]
  - 1 in [78,611]
  - 3 in [120,605]
  - 1 in [126,611]
  - 3 in [137,605]
  - 3 in [142,605]
  - 1 in [143,611]
  - 1 in [148,611]
  - 3 in [154,605]
  - 1 in [160,611]
  - 1 in [215,616]
#kAllDiff: 3
#kExactlyOne: 1 (#literals: 3)
#kLinear2: 461 (#enforced: 416 #multi: 341)
#kLinear3: 78 (#enforced: 48)
#kLinearN: 470 (#enforced: 436) (#terms: 3'784)

Preloading model.
#Bound   0.12s best:inf   next:[233,3034] initial_domain
#Model   0.12s var:131/131 constraints:1013/1013

Starting search at 0.12s with 48 workers.
16 full problem subsolvers: [core, default_lp, lb_tree_search, max_lp, no_lp, objective_lb_search, objective_lb_search_max_lp, objective_lb_search_no_lp, objective_shaving_search_max_lp, objective_shaving_search_no_lp, probing, probing_max_lp, pseudo_costs, quick_restart, quick_restart_no_lp, reduced_costs]
30 first solution subsolvers: [fj_long_default(2), fj_long_lin_default, fj_long_lin_perturb, fj_long_lin_random, fj_long_perturb, fj_long_random, fj_short_default(2), fj_short_lin_default(2), fj_short_lin_perturb, fj_short_lin_random, fj_short_perturb, fj_short_random, fs_random(4), fs_random_no_lp(4), fs_random_quick_restart(4), fs_random_quick_restart_no_lp(3)]
13 incomplete subsolvers: [feasibility_pump, graph_arc_lns, graph_cst_lns, graph_dec_lns, graph_var_lns, rins/rens, rnd_cst_lns, rnd_var_lns, violation_ls(5)]
3 helper subsolvers: [neighborhood_helper, synchronization_agent, update_gap_integral]
#1       0.13s best:1697  next:[233,1696] no_lp (fixed_bools=0/70)
#Bound   0.13s best:1697  next:[258,1696] objective_lb_search_no_lp
#Bound   0.14s best:1697  next:[260,1696] objective_lb_search_no_lp
#2       0.14s best:1687  next:[260,1686] no_lp (fixed_bools=0/74)
#Bound   0.14s best:1687  next:[264,1686] objective_lb_search_no_lp
#Bound   0.14s best:1687  next:[265,1686] objective_lb_search_no_lp
#Bound   0.14s best:1687  next:[302,1686] objective_lb_search_no_lp
#Bound   0.14s best:1687  next:[303,1686] objective_lb_search_no_lp
#Bound   0.14s best:1687  next:[317,1686] objective_lb_search_no_lp
#3       0.14s best:1648  next:[317,1647] no_lp (fixed_bools=0/76)
#Bound   0.14s best:1648  next:[340,1647] objective_lb_search_no_lp
#Bound   0.14s best:1648  next:[341,1647] objective_lb_search_no_lp
#Bound   0.14s best:1648  next:[347,1647] objective_lb_search_no_lp
#Bound   0.14s best:1648  next:[351,1647] objective_lb_search_no_lp
#4       0.14s best:1583  next:[351,1582] no_lp (fixed_bools=0/78)
#5       0.14s best:1494  next:[351,1493] no_lp (fixed_bools=0/81)
#6       0.14s best:1461  next:[351,1460] no_lp (fixed_bools=0/89)
#7       0.14s best:1371  next:[351,1370] no_lp (fixed_bools=0/95)
#8       0.15s best:1366  next:[351,1365] graph_arc_lns (d=0.50 s=71 t=0.10 p=0.00 stall=0 h=auto_l0) [hint]
#9       0.15s best:1212  next:[351,1211] no_lp (fixed_bools=0/110)
#10      0.16s best:1151  next:[351,1150] no_lp (fixed_bools=0/116)
#11      0.17s best:1124  next:[351,1123] no_lp (fixed_bools=0/123)
#12      0.18s best:1123  next:[351,1122] violation_ls(batch:2 #solutions_imported:2 #lin_moves:0 #lin_evals:4'694 #gen_moves:2'791 #gen_evals:1'396 #comp_moves:103 #backtracks:1'344 #weight_updates:35)
#Bound   0.18s best:1123  next:[352,1122] objective_shaving_search_max_lp (vars=133 csts=1016)
#13      0.18s best:1122  next:[352,1121] violation_ls(batch:3 #solutions_imported:3 #lin_moves:0 #lin_evals:4'709 #gen_moves:2'800 #gen_evals:1'399 #comp_moves:104 #backtracks:1'348 #weight_updates:35)
#14      0.18s best:1119  next:[352,1118] quick_restart_no_lp (fixed_bools=0/133)
#15      0.18s best:1116  next:[352,1115] quick_restart_no_lp (fixed_bools=0/138)
#16      0.18s best:1060  next:[352,1059] no_lp (fixed_bools=0/135)
#Bound   0.19s best:1060  next:[367,1059] objective_lb_search_no_lp
#17      0.19s best:1042  next:[367,1041] no_lp (fixed_bools=0/138)
#Bound   0.19s best:1042  next:[368,1041] objective_lb_search_no_lp
#18      0.20s best:1038  next:[368,1037] quick_restart_no_lp (fixed_bools=0/152)
#19      0.20s best:1037  next:[368,1036] quick_restart_no_lp (fixed_bools=0/153)
#20      0.20s best:1032  next:[368,1031] quick_restart_no_lp (fixed_bools=0/156)
#Bound   0.20s best:1032  next:[516,1031] objective_lb_search_no_lp
#21      0.22s best:1030  next:[516,1029] violation_ls(batch:3 #solutions_imported:3 #lin_moves:863 #lin_evals:11'517 #gen_moves:5'476 #gen_evals:1'964 #comp_moves:260 #backtracks:2'608 #weight_updates:250)
#22      0.22s best:1028  next:[516,1027] violation_ls(batch:2 #solutions_imported:2 #lin_moves:1 #lin_evals:10'735 #gen_moves:6'947 #gen_evals:2'065 #comp_moves:308 #backtracks:3'317 #weight_updates:53)
#23      0.22s best:1025  next:[516,1024] quick_restart_no_lp (fixed_bools=1/160)
#24      0.22s best:1023  next:[516,1022] violation_ls(batch:3 #solutions_imported:3 #lin_moves:2 #lin_evals:10'740 #gen_moves:6'947 #gen_evals:2'065 #comp_moves:308 #backtracks:3'317 #weight_updates:53)
#25      0.23s best:1021  next:[516,1020] violation_ls(batch:4 #solutions_imported:4 #lin_moves:3 #lin_evals:10'746 #gen_moves:6'947 #gen_evals:2'065 #comp_moves:308 #backtracks:3'317 #weight_updates:53)
#26      0.23s best:1019  next:[516,1018] violation_ls(batch:5 #solutions_imported:5 #lin_moves:3 #lin_evals:10'791 #gen_moves:6'970 #gen_evals:2'070 #comp_moves:309 #backtracks:3'328 #weight_updates:53)
#27      0.23s best:1017  next:[516,1016] violation_ls(batch:4 #solutions_imported:4 #lin_moves:864 #lin_evals:11'523 #gen_moves:5'476 #gen_evals:1'964 #comp_moves:260 #backtracks:2'608 #weight_updates:250)
#28      0.23s best:1001  next:[516,1000] no_lp (fixed_bools=1/145)
#29      0.24s best:996   next:[516,995]  quick_restart_no_lp (fixed_bools=2/171)
#30      0.24s best:994   next:[516,993]  violation_ls(batch:7 #solutions_imported:7 #lin_moves:4 #lin_evals:10'799 #gen_moves:6'971 #gen_evals:2'070 #comp_moves:310 #backtracks:3'328 #weight_updates:53)
#31      0.24s best:992   next:[516,991]  violation_ls(batch:8 #solutions_imported:8 #lin_moves:5 #lin_evals:10'805 #gen_moves:6'971 #gen_evals:2'070 #comp_moves:310 #backtracks:3'328 #weight_updates:53)
#32      0.24s best:991   next:[516,990]  violation_ls(batch:9 #solutions_imported:9 #lin_moves:6 #lin_evals:10'811 #gen_moves:6'971 #gen_evals:2'070 #comp_moves:310 #backtracks:3'328 #weight_updates:53)
#33      0.25s best:981   next:[516,980]  no_lp (fixed_bools=1/153)
#Bound   0.25s best:981   next:[525,980]  objective_lb_search_no_lp
#34      0.26s best:891   next:[525,890]  rnd_var_lns (d=0.97 s=127 t=0.10 p=1.00 stall=0 h=auto_l0)
#35      0.32s best:864   next:[525,863]  no_lp (fixed_bools=1/168)
#36      0.33s best:803   next:[525,802]  no_lp (fixed_bools=1/176)
#Bound   0.38s best:803   next:[527,802]  objective_lb_search_no_lp
#Bound   0.39s best:803   next:[528,802]  objective_lb_search_no_lp
#Bound   0.39s best:803   next:[530,802]  objective_lb_search_no_lp
#Bound   0.41s best:803   next:[531,802]  objective_lb_search_no_lp
#Bound   0.99s best:803   next:[608,802]  objective_lb_search_no_lp [skipped_logs=13]
#Model   1.55s var:130/131 constraints:931/1013
#Bound   1.89s best:803   next:[665,802]  objective_lb_search_max_lp [skipped_logs=13]
#Model   2.05s var:129/131 constraints:874/1013
#Model   2.17s var:127/131 constraints:837/1013
#Model   2.26s var:126/131 constraints:828/1013
#Model   2.29s var:118/131 constraints:593/1013
#Model   2.30s var:110/131 constraints:455/1013
#Done    2.30s quick_restart_no_lp
#Model   2.30s var:94/131 constraints:178/1013
#Done    2.30s no_lp
#Done    2.30s reduced_costs
#Model   2.30s var:87/131 constraints:148/1013
#Bound   2.23s best:803   next:[706,802]  objective_lb_search_no_lp [skipped_logs=5]

Task timing                                  n [     min,      max]      avg      dev     time         n [     min,      max]      avg      dev    dtime
                             'core':         1 [   2.18s,    2.18s]    2.18s   0.00ns    2.18s         1 [816.15ms, 816.15ms] 816.15ms   0.00ns 816.15ms
                       'default_lp':         1 [   2.18s,    2.18s]    2.18s   0.00ns    2.18s         1 [170.45ms, 170.45ms] 170.45ms   0.00ns 170.45ms
                 'feasibility_pump':        25 [  3.17ms, 152.40ms]  43.59ms  27.04ms    1.09s        24 [  4.70ms,   6.33ms]   4.82ms 317.85us 115.58ms
                  'fj_long_default':         0 [  0.00ns,   0.00ns]   0.00ns   0.00ns   0.00ns         0 [  0.00ns,   0.00ns]   0.00ns   0.00ns   0.00ns
                  'fj_long_default':         0 [  0.00ns,   0.00ns]   0.00ns   0.00ns   0.00ns         0 [  0.00ns,   0.00ns]   0.00ns   0.00ns   0.00ns
              'fj_long_lin_default':         0 [  0.00ns,   0.00ns]   0.00ns   0.00ns   0.00ns         0 [  0.00ns,   0.00ns]   0.00ns   0.00ns   0.00ns
              'fj_long_lin_perturb':         0 [  0.00ns,   0.00ns]   0.00ns   0.00ns   0.00ns         0 [  0.00ns,   0.00ns]   0.00ns   0.00ns   0.00ns
               'fj_long_lin_random':         0 [  0.00ns,   0.00ns]   0.00ns   0.00ns   0.00ns         0 [  0.00ns,   0.00ns]   0.00ns   0.00ns   0.00ns
                  'fj_long_perturb':         0 [  0.00ns,   0.00ns]   0.00ns   0.00ns   0.00ns         0 [  0.00ns,   0.00ns]   0.00ns   0.00ns   0.00ns
                   'fj_long_random':         0 [  0.00ns,   0.00ns]   0.00ns   0.00ns   0.00ns         0 [  0.00ns,   0.00ns]   0.00ns   0.00ns   0.00ns
                 'fj_short_default':         0 [  0.00ns,   0.00ns]   0.00ns   0.00ns   0.00ns         0 [  0.00ns,   0.00ns]   0.00ns   0.00ns   0.00ns
                 'fj_short_default':         0 [  0.00ns,   0.00ns]   0.00ns   0.00ns   0.00ns         0 [  0.00ns,   0.00ns]   0.00ns   0.00ns   0.00ns
             'fj_short_lin_default':         0 [  0.00ns,   0.00ns]   0.00ns   0.00ns   0.00ns         0 [  0.00ns,   0.00ns]   0.00ns   0.00ns   0.00ns
             'fj_short_lin_default':         0 [  0.00ns,   0.00ns]   0.00ns   0.00ns   0.00ns         0 [  0.00ns,   0.00ns]   0.00ns   0.00ns   0.00ns
             'fj_short_lin_perturb':         0 [  0.00ns,   0.00ns]   0.00ns   0.00ns   0.00ns         0 [  0.00ns,   0.00ns]   0.00ns   0.00ns   0.00ns
              'fj_short_lin_random':         0 [  0.00ns,   0.00ns]   0.00ns   0.00ns   0.00ns         0 [  0.00ns,   0.00ns]   0.00ns   0.00ns   0.00ns
                 'fj_short_perturb':         0 [  0.00ns,   0.00ns]   0.00ns   0.00ns   0.00ns         0 [  0.00ns,   0.00ns]   0.00ns   0.00ns   0.00ns
                  'fj_short_random':         0 [  0.00ns,   0.00ns]   0.00ns   0.00ns   0.00ns         0 [  0.00ns,   0.00ns]   0.00ns   0.00ns   0.00ns
                        'fs_random':         0 [  0.00ns,   0.00ns]   0.00ns   0.00ns   0.00ns         0 [  0.00ns,   0.00ns]   0.00ns   0.00ns   0.00ns
                        'fs_random':         1 [  3.83ms,   3.83ms]   3.83ms   0.00ns   3.83ms         0 [  0.00ns,   0.00ns]   0.00ns   0.00ns   0.00ns
                        'fs_random':         1 [  5.43ms,   5.43ms]   5.43ms   0.00ns   5.43ms         1 [ 20.00ns,  20.00ns]  20.00ns   0.00ns  20.00ns
                        'fs_random':         1 [  5.96ms,   5.96ms]   5.96ms   0.00ns   5.96ms         1 [ 20.00ns,  20.00ns]  20.00ns   0.00ns  20.00ns
                  'fs_random_no_lp':         0 [  0.00ns,   0.00ns]   0.00ns   0.00ns   0.00ns         0 [  0.00ns,   0.00ns]   0.00ns   0.00ns   0.00ns
                  'fs_random_no_lp':         0 [  0.00ns,   0.00ns]   0.00ns   0.00ns   0.00ns         0 [  0.00ns,   0.00ns]   0.00ns   0.00ns   0.00ns
                  'fs_random_no_lp':         1 [  4.14ms,   4.14ms]   4.14ms   0.00ns   4.14ms         0 [  0.00ns,   0.00ns]   0.00ns   0.00ns   0.00ns
                  'fs_random_no_lp':         1 [  4.87ms,   4.87ms]   4.87ms   0.00ns   4.87ms         0 [  0.00ns,   0.00ns]   0.00ns   0.00ns   0.00ns
          'fs_random_quick_restart':         0 [  0.00ns,   0.00ns]   0.00ns   0.00ns   0.00ns         0 [  0.00ns,   0.00ns]   0.00ns   0.00ns   0.00ns
          'fs_random_quick_restart':         1 [  3.53ms,   3.53ms]   3.53ms   0.00ns   3.53ms         0 [  0.00ns,   0.00ns]   0.00ns   0.00ns   0.00ns
          'fs_random_quick_restart':         1 [  5.70ms,   5.70ms]   5.70ms   0.00ns   5.70ms         0 [  0.00ns,   0.00ns]   0.00ns   0.00ns   0.00ns
          'fs_random_quick_restart':         1 [  6.09ms,   6.09ms]   6.09ms   0.00ns   6.09ms         0 [  0.00ns,   0.00ns]   0.00ns   0.00ns   0.00ns
    'fs_random_quick_restart_no_lp':         0 [  0.00ns,   0.00ns]   0.00ns   0.00ns   0.00ns         0 [  0.00ns,   0.00ns]   0.00ns   0.00ns   0.00ns
    'fs_random_quick_restart_no_lp':         1 [  4.10ms,   4.10ms]   4.10ms   0.00ns   4.10ms         0 [  0.00ns,   0.00ns]   0.00ns   0.00ns   0.00ns
    'fs_random_quick_restart_no_lp':         1 [  4.77ms,   4.77ms]   4.77ms   0.00ns   4.77ms         0 [  0.00ns,   0.00ns]   0.00ns   0.00ns   0.00ns
                    'graph_arc_lns':        24 [  2.93ms,    1.35s] 366.97ms 428.99ms    8.81s        19 [ 10.00ns, 204.05ms]  32.91ms  55.70ms 625.29ms
                    'graph_cst_lns':        24 [860.01us,  39.22ms]   5.65ms   9.82ms 135.65ms         0 [  0.00ns,   0.00ns]   0.00ns   0.00ns   0.00ns
                    'graph_dec_lns':        24 [  3.45ms,    1.61s] 399.18ms 472.31ms    9.58s        20 [ 10.00ns, 189.31ms]  35.61ms  59.76ms 712.22ms
                    'graph_var_lns':        24 [  2.88ms,    1.70s] 448.02ms 557.24ms   10.75s        21 [ 10.00ns, 233.83ms]  35.68ms  59.28ms 749.28ms
                   'lb_tree_search':         1 [   2.18s,    2.18s]    2.18s   0.00ns    2.18s         1 [414.93ms, 414.93ms] 414.93ms   0.00ns 414.93ms
                           'max_lp':         1 [   2.18s,    2.18s]    2.18s   0.00ns    2.18s         1 [392.82ms, 392.82ms] 392.82ms   0.00ns 392.82ms
                            'no_lp':         1 [   2.18s,    2.18s]    2.18s   0.00ns    2.18s         1 [184.96ms, 184.96ms] 184.96ms   0.00ns 184.96ms
              'objective_lb_search':         1 [   2.18s,    2.18s]    2.18s   0.00ns    2.18s         1 [202.12ms, 202.12ms] 202.12ms   0.00ns 202.12ms
       'objective_lb_search_max_lp':         1 [   2.18s,    2.18s]    2.18s   0.00ns    2.18s         1 [274.81ms, 274.81ms] 274.81ms   0.00ns 274.81ms
        'objective_lb_search_no_lp':         1 [   2.18s,    2.18s]    2.18s   0.00ns    2.18s         1 [198.60ms, 198.60ms] 198.60ms   0.00ns 198.60ms
  'objective_shaving_search_max_lp':        25 [  1.76ms, 283.07ms]  73.01ms  73.07ms    1.83s        16 [329.37us,  11.98ms]   1.52ms   2.73ms  24.34ms
   'objective_shaving_search_no_lp':        25 [  3.36ms, 272.35ms]  67.19ms  61.49ms    1.68s        15 [319.06us,  20.23ms]   2.41ms   4.83ms  36.19ms
                          'probing':         1 [   2.18s,    2.18s]    2.18s   0.00ns    2.18s         1 [ 62.38ms,  62.38ms]  62.38ms   0.00ns  62.38ms
                   'probing_max_lp':         1 [   2.19s,    2.19s]    2.19s   0.00ns    2.19s         1 [135.29ms, 135.29ms] 135.29ms   0.00ns 135.29ms
                     'pseudo_costs':         1 [   2.18s,    2.18s]    2.18s   0.00ns    2.18s         1 [238.47ms, 238.47ms] 238.47ms   0.00ns 238.47ms
                    'quick_restart':         1 [   2.18s,    2.18s]    2.18s   0.00ns    2.18s         1 [148.90ms, 148.90ms] 148.90ms   0.00ns 148.90ms
              'quick_restart_no_lp':         1 [   2.18s,    2.18s]    2.18s   0.00ns    2.18s         1 [214.89ms, 214.89ms] 214.89ms   0.00ns 214.89ms
                    'reduced_costs':         1 [   2.18s,    2.18s]    2.18s   0.00ns    2.18s         1 [ 75.27ms,  75.27ms]  75.27ms   0.00ns  75.27ms
                        'rins/rens':        25 [  1.90ms,    2.04s] 589.51ms 610.25ms   14.74s        20 [ 10.00ns, 302.76ms]  53.22ms  72.59ms    1.06s
                      'rnd_cst_lns':        24 [898.96us,    1.31s] 237.26ms 347.70ms    5.69s        16 [ 10.00ns, 224.59ms]  23.44ms  57.18ms 375.10ms
                      'rnd_var_lns':        24 [  2.44ms,    1.47s] 382.61ms 440.40ms    9.18s        19 [ 10.00ns, 255.36ms]  32.03ms  61.69ms 608.66ms
                     'violation_ls':        23 [255.99us, 129.19ms]  93.28ms  38.41ms    2.15s        23 [890.00ns,  61.40ms]  45.26ms  19.41ms    1.04s
                     'violation_ls':        23 [515.57us, 228.42ms]  93.16ms  49.11ms    2.14s        23 [ 47.14us,  62.60ms]  44.67ms  19.29ms    1.03s
                     'violation_ls':        24 [ 23.09ms, 177.42ms]  74.27ms  38.52ms    1.78s        24 [ 14.10ms,  84.85ms]  47.00ms  20.57ms    1.13s
                     'violation_ls':        25 [  1.34us, 120.75ms]  62.08ms  46.55ms    1.55s        24 [590.00ns,  57.41ms]  34.44ms  24.43ms 826.51ms
                     'violation_ls':        25 [ 13.12ms, 129.96ms]  78.97ms  31.49ms    1.97s        25 [  7.36ms, 100.62ms]  56.84ms  28.57ms    1.42s

Search stats                        Bools  Conflicts  Branches  Restarts  BoolPropag  IntegerPropag
                           'core':    583        425    11'727     4'492   1'572'287        972'376
                     'default_lp':     54        817     3'686       788      21'897        343'720
                      'fs_random':      0          0         0         0           0              0
                      'fs_random':     54          0         0         0           0              0
                      'fs_random':     54          0        60        60           6            562
                      'fs_random':     54          0        84        84           6            867
                'fs_random_no_lp':      0          0         0         0           0              0
                'fs_random_no_lp':      0          0         0         0           0              0
                'fs_random_no_lp':     54          0         0         0           0              0
                'fs_random_no_lp':     54          0        86        86           6            893
        'fs_random_quick_restart':      0          0         0         0           0              0
        'fs_random_quick_restart':     54          0         0         0           0              0
        'fs_random_quick_restart':     54          0        80        80           6            816
        'fs_random_quick_restart':     54          0        84        84           6            867
  'fs_random_quick_restart_no_lp':      0          0         0         0           0              0
  'fs_random_quick_restart_no_lp':     54          0         0         0           0              0
  'fs_random_quick_restart_no_lp':     54          0        84        84           6            867
                 'lb_tree_search':     54         15     1'416       259       3'482         47'523
                         'max_lp':     54        347     1'967       600      11'131        156'494
                          'no_lp':    262      2'430     7'812     1'397     184'431        830'863
            'objective_lb_search':     73        943     3'986     1'249      28'556        375'066
     'objective_lb_search_max_lp':     61        327     1'817       631      10'177        138'278
      'objective_lb_search_no_lp':    136      3'137     6'938     1'141      78'058        945'731
                        'probing':    136         38       234       234         685          5'048
                 'probing_max_lp':     96         18       174       174         629          4'798
                   'pseudo_costs':     54        404     2'181       727      10'667        155'874
                  'quick_restart':     97        431     4'849     1'802      20'391        231'188
            'quick_restart_no_lp':    232      2'106    11'160     1'895     201'358        917'269
                  'reduced_costs':    251        258     1'425       326      16'065         88'228

SAT stats                           ClassicMinim  LitRemoved  LitLearned  LitForgotten  Subsumed  MClauses  MDecisions  MLitTrue  MSubsumed  MLitRemoved  MReused
                           'core':           267         495         665             0         1     2'128      10'134         0        337        1'012       18
                     'default_lp':           481       1'060       6'096             0        63       315       2'376         0        107          631       60
                      'fs_random':             0           0           0             0         0         0           0         0          0            0        0
                      'fs_random':             0           0           0             0         0         0           0         0          0            0        0
                      'fs_random':             0           0           0             0         0         0           0         0          0            0        0
                      'fs_random':             0           0           0             0         0         0           0         0          0            0        0
                'fs_random_no_lp':             0           0           0             0         0         0           0         0          0            0        0
                'fs_random_no_lp':             0           0           0             0         0         0           0         0          0            0        0
                'fs_random_no_lp':             0           0           0             0         0         0           0         0          0            0        0
                'fs_random_no_lp':             0           0           0             0         0         0           0         0          0            0        0
        'fs_random_quick_restart':             0           0           0             0         0         0           0         0          0            0        0
        'fs_random_quick_restart':             0           0           0             0         0         0           0         0          0            0        0
        'fs_random_quick_restart':             0           0           0             0         0         0           0         0          0            0        0
        'fs_random_quick_restart':             0           0           0             0         0         0           0         0          0            0        0
  'fs_random_quick_restart_no_lp':             0           0           0             0         0         0           0         0          0            0        0
  'fs_random_quick_restart_no_lp':             0           0           0             0         0         0           0         0          0            0        0
  'fs_random_quick_restart_no_lp':             0           0           0             0         0         0           0         0          0            0        0
                 'lb_tree_search':             1           1         116             0         0        10          52         0          0            0        4
                         'max_lp':           216         597       2'349             0        28       179       1'121         0         61          323       17
                          'no_lp':         1'837       5'552      21'144             0        86       340       2'149         1        121          685       36
            'objective_lb_search':           708       2'017       5'859             0        58       330       1'769         0        108          550       81
     'objective_lb_search_max_lp':           210         497       1'947             0        26       134         780         0         46          244       20
      'objective_lb_search_no_lp':         2'522       7'649      18'174             0       111       401       2'709         0        175          967       98
                        'probing':             0           0          38             0         0         0           0         0          0            0        0
                 'probing_max_lp':             0           0          18             0         0         0           0         0          0            0        0
                   'pseudo_costs':           238         686       3'079             0        29       173       1'002         0         62          355       22
                  'quick_restart':           270         595       3'429             0        25       296       2'053         0         55          367       37
            'quick_restart_no_lp':         1'409       3'854      15'803             0       120       843       5'921         1        457        2'786       75
                  'reduced_costs':           129         198       1'590             0         7       122         581         0         82          467       17

Lp stats                         Component  Iterations  AddedCuts  OPTIMAL  DUAL_F.  DUAL_U.
                  'default_lp':          1       6'412      1'587      948        0        0
                   'fs_random':          1           0          0        0        0        0
                   'fs_random':          1           0          0        0        0        0
                   'fs_random':          1           0          0        0        0        0
     'fs_random_quick_restart':          1           0          0        0        0        0
     'fs_random_quick_restart':          1           0          0        0        0        0
     'fs_random_quick_restart':          1           0          0        0        0        0
              'lb_tree_search':          1      10'966      1'794      606      243        0
                      'max_lp':          1       7'740      1'743      435      125        0
         'objective_lb_search':          1       8'587      1'450    1'121        0        0
  'objective_lb_search_max_lp':          1       8'483      1'891      425      164        0
                     'probing':          1         936      1'072      452        0        0
              'probing_max_lp':          1       1'192      1'722       88        2        0
                'pseudo_costs':          1       7'201      2'128      528      135        0
               'quick_restart':          1       5'439      1'369      918        0        0
               'reduced_costs':          1       2'025      1'847      331       29        0

Lp dimension                                                                       Final dimension of first component
                  'default_lp':     311 rows, 122 columns, 291 entries with magnitude in [2.652234e-03, 1.000000e+00]
                   'fs_random':         0 rows, 122 columns, 0 entries with magnitude in [0.000000e+00, 0.000000e+00]
                   'fs_random':         0 rows, 122 columns, 0 entries with magnitude in [0.000000e+00, 0.000000e+00]
                   'fs_random':         0 rows, 122 columns, 0 entries with magnitude in [0.000000e+00, 0.000000e+00]
     'fs_random_quick_restart':         0 rows, 122 columns, 0 entries with magnitude in [0.000000e+00, 0.000000e+00]
     'fs_random_quick_restart':         0 rows, 122 columns, 0 entries with magnitude in [0.000000e+00, 0.000000e+00]
     'fs_random_quick_restart':         0 rows, 122 columns, 0 entries with magnitude in [0.000000e+00, 0.000000e+00]
              'lb_tree_search':    498 rows, 131 columns, 1607 entries with magnitude in [1.345360e-03, 1.000000e+00]
                      'max_lp':    372 rows, 131 columns, 1357 entries with magnitude in [3.456476e-03, 1.000000e+00]
         'objective_lb_search':     296 rows, 122 columns, 696 entries with magnitude in [1.709705e-03, 1.000000e+00]
  'objective_lb_search_max_lp':    505 rows, 131 columns, 1772 entries with magnitude in [2.603736e-03, 1.000000e+00]
                     'probing':     141 rows, 122 columns, 575 entries with magnitude in [2.564270e-03, 1.000000e+00]
              'probing_max_lp':  1702 rows, 131 columns, 11288 entries with magnitude in [9.891810e-04, 1.000000e+00]
                'pseudo_costs':    512 rows, 131 columns, 2084 entries with magnitude in [3.198187e-03, 1.000000e+00]
               'quick_restart':     209 rows, 122 columns, 509 entries with magnitude in [2.431083e-04, 1.000000e+00]
               'reduced_costs':    306 rows, 131 columns, 1132 entries with magnitude in [7.130972e-03, 1.000000e+00]

Lp debug                         CutPropag  CutEqPropag  Adjust  Overflow     Bad  BadScaling
                  'default_lp':          0            3     685         0   5'723           0
                   'fs_random':          0            0       0         0       0           0
                   'fs_random':          0            0       0         0       0           0
                   'fs_random':          0            0       0         0       0           0
     'fs_random_quick_restart':          0            0       0         0       0           0
     'fs_random_quick_restart':          0            0       0         0       0           0
     'fs_random_quick_restart':          0            0       0         0       0           0
              'lb_tree_search':          4            0     477         0   3'953           0
                      'max_lp':          4            0     305         0   4'202           0
         'objective_lb_search':          0            0     730         0   5'462           0
  'objective_lb_search_max_lp':         14            0     374         0   5'354           0
                     'probing':          0            0     416         0  68'112           0
              'probing_max_lp':          5            0      80         0  17'213           0
                'pseudo_costs':         13            1     397         0   8'151           0
               'quick_restart':          2            0     607         0   5'249           0
               'reduced_costs':          5            1     196         0   4'422           0

Lp pool                          Constraints  Updates  Simplif  Merged  Shortened  Split  Strenghtened    Cuts/Call
                  'default_lp':        1'693      307    3'772       4      1'899    294         1'058  1'587/2'940
                   'fs_random':          110        0        0       0          0      0             0          0/0
                   'fs_random':          110        0        0       0          0      0             2          0/0
                   'fs_random':          110        0        0       0          0      0             2          0/0
     'fs_random_quick_restart':          110        0        0       0          0      0             0          0/0
     'fs_random_quick_restart':          110        0        0       0          0      0             2          0/0
     'fs_random_quick_restart':          110        0        0       0          0      0             2          0/0
              'lb_tree_search':        2'801      144    4'609       3      1'700     31         6'054  1'794/3'202
                      'max_lp':        2'751      138    2'991       2        676     42         5'006  1'743/3'087
         'objective_lb_search':        1'560      260    3'333       0      1'433    206           903  1'450/2'974
  'objective_lb_search_max_lp':        2'899      166    4'224       2        955     14         6'170  1'891/3'455
                     'probing':        1'168      157      146      14          0    154           227  1'072/1'697
              'probing_max_lp':        2'731      110    1'202       1          0     83         3'143  1'722/3'277
                'pseudo_costs':        3'138      159    5'569       0      1'244     60         6'508  2'128/3'935
               'quick_restart':        1'467      368    4'968      12      1'214    518         1'247  1'369/2'516
               'reduced_costs':        2'842      176    3'359      15        567     30         6'534  1'847/3'222

Lp Cut            defaul  max_lp  quick_  reduce  pseudo  lb_tre  probin  object  probin  object
          CG_FF:      89      98      70     141     104     103      45      97      82     119
           CG_K:      39      58      32      29      32      68      10      36      56      36
           CG_R:      68      53      37      45      34      58      15      89      54      42
          CG_RB:     377     249     272     434     486     328     240     344     196     351
         CG_RBP:      45      38      20      38      51      24      27      36      16      26
         Clique:       -      33       -      41      37      41       -       -      15      46
             IB:     316     171     307     217     244     196     242     281     117     247
       MIR_1_FF:     151     140      92     125     121     144      61      78     142     131
        MIR_1_K:      15      26      17      15      15      37       8      17      28      23
        MIR_1_R:      22      11      21       4       8      16      16      16      11       9
       MIR_1_RB:      94     195      91     142     200     188      85     101     196     164
      MIR_1_RBP:       6      30       7      30      40      29       5       5      22      37
      MIR_1_RLT:       -       1       -       -       -       1       -       -       -       -
       MIR_2_FF:      27      34      23      42      50      38      22      20      41      55
        MIR_2_K:       4      14       3      12      15      17       1       6       6       6
       MIR_2_KL:       -       -       -       -       1       -       -       -       -       -
        MIR_2_R:      19      16       7      13      17       5      14       3       8      15
       MIR_2_RB:      54      64      50      67      91      44      53      52      66      74
      MIR_2_RBP:       6      10       2       9      16       5       6       2      10      13
       MIR_3_FF:      15      24      23      22      29      19      11      20      26      28
        MIR_3_K:       8      10       9      12      10      10       5       9      12       9
        MIR_3_R:       4       8      13      18      18       7       6       7      12      25
       MIR_3_RB:      28      46      40      42      55      39      30      38      37      48
      MIR_3_RBP:       8       4       4       8      12       3       3       1       5       3
       MIR_4_FF:       5      25      10      20      18      13       1      10      21      16
        MIR_4_K:       5      12       3      12      15       4       1       6      11       5
        MIR_4_R:       5       7      11       9      15       6       -       6      10      19
       MIR_4_RB:      16      43      22      31      38      25      18      23      42      29
      MIR_4_RBP:       -       1       2       4       6       -       2       3       3       3
       MIR_5_FF:       9      13      10       9       7      13       1       5      15       5
        MIR_5_K:       5       2       3       1       5       3       1       2       6       6
        MIR_5_R:       7       4      15       8       5       4       4       6       7       8
       MIR_5_RB:      18      14      23      17      16      17      10      16      23      21
      MIR_5_RBP:       1       -       3       2       1       -       -       2       3       2
       MIR_6_FF:       2       5       2       2       3       2       2       2       4       4
        MIR_6_K:       -       1       3       -       2       2       1       -       2       1
        MIR_6_R:       3       1      11       4       3       -       2       2       3       2
       MIR_6_RB:       3      10      16      10       8       6      12      10      12       7
      MIR_6_RBP:       1       -       4       -       1       -       -       -       2       -
   ZERO_HALF_FF:      24      34      20      34      30      45      20      19      40      38
    ZERO_HALF_K:       5       4       -       2       2      12       1       1       8       2
    ZERO_HALF_R:      61     147      42     125     186     129      64      46     255     160
   ZERO_HALF_RB:      21      65      27      41      70      75      26      31      83      48
  ZERO_HALF_RBP:       1      22       2      10      11      18       1       2      14       8

LNS stats           Improv/Calls  Closed  Difficulty  TimeLimit
  'graph_arc_lns':         11/24     67%        0.98       0.10
  'graph_cst_lns':           0/0      0%        0.50       0.10
  'graph_dec_lns':         12/24     67%        0.98       0.10
  'graph_var_lns':          8/24     67%        0.98       0.10
      'rins/rens':          7/23     52%        0.91       0.10
    'rnd_cst_lns':          3/20     70%        0.98       0.10
    'rnd_var_lns':          9/24     75%        0.99       0.10

LS stats                   Batches  Restarts  LinMoves  GenMoves  CompoundMoves  WeightUpdates
       'fj_long_default':        0         0         0         0              0              0
       'fj_long_default':        0         0         0         0              0              0
   'fj_long_lin_default':        0         0         0         0              0              0
   'fj_long_lin_perturb':        0         0         0         0              0              0
    'fj_long_lin_random':        0         0         0         0              0              0
       'fj_long_perturb':        0         0         0         0              0              0
        'fj_long_random':        0         0         0         0              0              0
      'fj_short_default':        0         0         0         0              0              0
      'fj_short_default':        0         0         0         0              0              0
  'fj_short_lin_default':        0         0         0         0              0              0
  'fj_short_lin_default':        0         0         0         0              0              0
  'fj_short_lin_perturb':        0         0         0         0              0              0
   'fj_short_lin_random':        0         0         0         0              0              0
      'fj_short_perturb':        0         0         0         0              0              0
       'fj_short_random':        0         0         0         0              0              0
          'violation_ls':       23         0   152'563    17'042            701         13'674
          'violation_ls':       23         0   172'498     5'476            260         10'696
          'violation_ls':       24         0   118'398    11'514            386         91'733
          'violation_ls':       24         0     9'346    97'236          1'973          1'228
          'violation_ls':       25         0   152'744     1'124             62         78'398

Solutions (36)            Num     Rank
        'graph_arc_lns':    1    [8,8]
                'no_lp':   16   [1,36]
  'quick_restart_no_lp':    7  [14,29]
          'rnd_var_lns':    1  [34,34]
         'violation_ls':   11  [12,32]

Objective bounds                      Num
                   'initial_domain':    1
       'objective_lb_search_max_lp':    1
        'objective_lb_search_no_lp':   51
  'objective_shaving_search_max_lp':    1
   'objective_shaving_search_no_lp':    1

Solution repositories    Added  Queried  Ignored  Synchro
  'feasible solutions':    160      474       12      134
        'lp solutions':     15        3        0       13
                'pump':    502       22

Improving bounds shared          Num
                        'core':    1
                  'default_lp':  106
              'lb_tree_search':    2
                      'max_lp':    1
                       'no_lp':  351
  'objective_lb_search_max_lp':    7
                     'probing':    7
              'probing_max_lp':   11
                'pseudo_costs':   26
               'quick_restart':   53
         'quick_restart_no_lp':  115
               'reduced_costs':   19

Clauses shared                   Num
                        'core':    2
                  'default_lp':    9
              'lb_tree_search':   19
                      'max_lp':    4
                       'no_lp':   42
         'objective_lb_search':    3
  'objective_lb_search_max_lp':    8
   'objective_lb_search_no_lp':    4
                'pseudo_costs':   12
               'quick_restart':   20
         'quick_restart_no_lp':   27

CpSolverResponse summary:
status: OPTIMAL
objective: 803
best_bound: 803
integers: 123
booleans: 54
conflicts: 0
branches: 86
propagations: 6
integer_propagations: 893
restarts: 86
lp_iterations: 0
walltime: 2.32658
usertime: 2.32658
deterministic_time: 13.2886
gap_integral: 43.8876
solution_fingerprint: 0x818a445aa20c8d6a


--- Simulation Gantt  partir du modle mathmatique ---
{'big':1, 'due_date':131, 'pos_time':5, 'status':0, 'blocked':0, 'operations':["{'type':0, 'processing_time':23}", "{'type':1, 'processing_time':12}"]}
{'big':1, 'due_date':65, 'pos_time':5, 'status':0, 'blocked':0, 'operations':["{'type':0, 'processing_time':55}", "{'type':1, 'processing_time':14}"]}
{'big':0, 'due_date':165, 'pos_time':5, 'status':0, 'blocked':0, 'operations':["{'type':1, 'processing_time':53}", "{'type':0, 'processing_time':42}"]}
{'big':1, 'due_date':153, 'pos_time':5, 'status':0, 'blocked':0, 'operations':["{'type':0, 'processing_time':60}", "{'type':1, 'processing_time':59}"]}
{'big':0, 'due_date':148, 'pos_time':5, 'status':0, 'blocked':0, 'operations':["{'type':1, 'processing_time':60}", "{'type':0, 'processing_time':58}"]}
