created virtual environment CPython3.12.4.final.0-64 in 12420ms
  creator CPython3Posix(dest=/localscratch/aneumann.63393203.0/env, clear=False, no_vcs_ignore=False, global=False)
  seeder FromAppData(download=False, pip=bundle, via=copy, app_data_dir=/home/aneumann/.local/share/virtualenv)
    added seed packages: pip==25.1.1
  activators BashActivator,CShellActivator,FishActivator,NushellActivator,PowerShellActivator,PythonActivator
Looking in links: /cvmfs/soft.computecanada.ca/custom/python/wheelhouse/gentoo2023/x86-64-v3, /cvmfs/soft.computecanada.ca/custom/python/wheelhouse/gentoo2023/generic, /cvmfs/soft.computecanada.ca/custom/python/wheelhouse/generic
Requirement already satisfied: pip in /localscratch/aneumann.63393203.0/env/lib/python3.12/site-packages (25.1.1)
Looking in links: /cvmfs/soft.computecanada.ca/custom/python/wheelhouse/gentoo2023/x86-64-v3, /cvmfs/soft.computecanada.ca/custom/python/wheelhouse/gentoo2023/generic, /cvmfs/soft.computecanada.ca/custom/python/wheelhouse/generic
ERROR: protobuf-5.28.3-cp38-abi3-manylinux2014_x86_64.whl is not a supported wheel on this platform.
Looking in links: /cvmfs/soft.computecanada.ca/custom/python/wheelhouse/gentoo2023/x86-64-v3, /cvmfs/soft.computecanada.ca/custom/python/wheelhouse/gentoo2023/generic, /cvmfs/soft.computecanada.ca/custom/python/wheelhouse/generic
Processing /home/aneumann/projects/def-adhaj/aneumann/GNRS/wheels/immutabledict-4.2.0-py3-none-any.whl
Installing collected packages: immutabledict
Successfully installed immutabledict-4.2.0
Looking in links: /cvmfs/soft.computecanada.ca/custom/python/wheelhouse/gentoo2023/x86-64-v3, /cvmfs/soft.computecanada.ca/custom/python/wheelhouse/gentoo2023/generic, /cvmfs/soft.computecanada.ca/custom/python/wheelhouse/generic
Processing /cvmfs/soft.computecanada.ca/custom/python/wheelhouse/generic/ortools-9.10.4067+computecanada-cp312-cp312-linux_x86_64.whl (from -r /home/aneumann/projects/def-adhaj/aneumann/GNRS/requirements/or.txt (line 1))
Processing /cvmfs/soft.computecanada.ca/custom/python/wheelhouse/gentoo2023/x86-64-v3/matplotlib-3.10.0+computecanada-cp312-cp312-linux_x86_64.whl (from -r /home/aneumann/projects/def-adhaj/aneumann/GNRS/requirements/or.txt (line 2))
Processing /cvmfs/soft.computecanada.ca/custom/python/wheelhouse/gentoo2023/x86-64-v3/pandas-2.2.3+computecanada-cp312-cp312-linux_x86_64.whl (from -r /home/aneumann/projects/def-adhaj/aneumann/GNRS/requirements/or.txt (line 3))
Processing /cvmfs/soft.computecanada.ca/custom/python/wheelhouse/generic/absl_py-2.2.2+computecanada-py3-none-any.whl (from ortools<9.11,>=9.10->-r /home/aneumann/projects/def-adhaj/aneumann/GNRS/requirements/or.txt (line 1))
Processing /cvmfs/soft.computecanada.ca/custom/python/wheelhouse/gentoo2023/generic/numpy-2.2.2+computecanada-cp312-cp312-linux_x86_64.whl (from ortools<9.11,>=9.10->-r /home/aneumann/projects/def-adhaj/aneumann/GNRS/requirements/or.txt (line 1))
Processing /cvmfs/soft.computecanada.ca/custom/python/wheelhouse/gentoo2023/x86-64-v3/protobuf-6.30.2+computecanada-cp312-cp312-linux_x86_64.whl (from ortools<9.11,>=9.10->-r /home/aneumann/projects/def-adhaj/aneumann/GNRS/requirements/or.txt (line 1))
Requirement already satisfied: immutabledict>=3.0.0 in /localscratch/aneumann.63393203.0/env/lib/python3.12/site-packages (from ortools<9.11,>=9.10->-r /home/aneumann/projects/def-adhaj/aneumann/GNRS/requirements/or.txt (line 1)) (4.2.0)
Processing /cvmfs/soft.computecanada.ca/custom/python/wheelhouse/gentoo2023/generic/contourpy-1.3.1+computecanada-cp312-cp312-linux_x86_64.whl (from matplotlib->-r /home/aneumann/projects/def-adhaj/aneumann/GNRS/requirements/or.txt (line 2))
Processing /cvmfs/soft.computecanada.ca/custom/python/wheelhouse/generic/cycler-0.12.1+computecanada-py3-none-any.whl (from matplotlib->-r /home/aneumann/projects/def-adhaj/aneumann/GNRS/requirements/or.txt (line 2))
Processing /cvmfs/soft.computecanada.ca/custom/python/wheelhouse/generic/fonttools-4.58.2+computecanada-cp312-cp312-linux_x86_64.whl (from matplotlib->-r /home/aneumann/projects/def-adhaj/aneumann/GNRS/requirements/or.txt (line 2))
Processing /cvmfs/soft.computecanada.ca/custom/python/wheelhouse/gentoo2023/x86-64-v3/kiwisolver-1.4.8+computecanada-cp312-cp312-linux_x86_64.whl (from matplotlib->-r /home/aneumann/projects/def-adhaj/aneumann/GNRS/requirements/or.txt (line 2))
Processing /cvmfs/soft.computecanada.ca/custom/python/wheelhouse/generic/packaging-25.0+computecanada-py3-none-any.whl (from matplotlib->-r /home/aneumann/projects/def-adhaj/aneumann/GNRS/requirements/or.txt (line 2))
Processing /cvmfs/soft.computecanada.ca/custom/python/wheelhouse/gentoo2023/x86-64-v3/pillow-11.1.0+computecanada-cp312-cp312-linux_x86_64.whl (from matplotlib->-r /home/aneumann/projects/def-adhaj/aneumann/GNRS/requirements/or.txt (line 2))
Processing /cvmfs/soft.computecanada.ca/custom/python/wheelhouse/generic/pyparsing-3.2.1+computecanada-py3-none-any.whl (from matplotlib->-r /home/aneumann/projects/def-adhaj/aneumann/GNRS/requirements/or.txt (line 2))
Processing /cvmfs/soft.computecanada.ca/custom/python/wheelhouse/generic/python_dateutil-2.9.0.post0+computecanada-py2.py3-none-any.whl (from matplotlib->-r /home/aneumann/projects/def-adhaj/aneumann/GNRS/requirements/or.txt (line 2))
Processing /cvmfs/soft.computecanada.ca/custom/python/wheelhouse/generic/pytz-2025.2+computecanada-py2.py3-none-any.whl (from pandas->-r /home/aneumann/projects/def-adhaj/aneumann/GNRS/requirements/or.txt (line 3))
Processing /cvmfs/soft.computecanada.ca/custom/python/wheelhouse/generic/tzdata-2025.2+computecanada-py2.py3-none-any.whl (from pandas->-r /home/aneumann/projects/def-adhaj/aneumann/GNRS/requirements/or.txt (line 3))
Processing /cvmfs/soft.computecanada.ca/custom/python/wheelhouse/generic/six-1.17.0+computecanada-py2.py3-none-any.whl (from python-dateutil>=2.7->matplotlib->-r /home/aneumann/projects/def-adhaj/aneumann/GNRS/requirements/or.txt (line 2))
Installing collected packages: pytz, tzdata, six, pyparsing, protobuf, pillow, packaging, numpy, kiwisolver, fonttools, cycler, absl-py, python-dateutil, contourpy, pandas, matplotlib, ortools

Successfully installed absl-py-2.2.2+computecanada contourpy-1.3.1+computecanada cycler-0.12.1+computecanada fonttools-4.58.2+computecanada kiwisolver-1.4.8+computecanada matplotlib-3.10.0+computecanada numpy-2.2.2+computecanada ortools-9.10.4067+computecanada packaging-25.0+computecanada pandas-2.2.3+computecanada pillow-11.1.0+computecanada protobuf-6.30.2+computecanada pyparsing-3.2.1+computecanada python-dateutil-2.9.0.post0+computecanada pytz-2025.2+computecanada six-1.17.0+computecanada tzdata-2025.2+computecanada

Starting CP-SAT solver v9.10.4067
Parameters: max_time_in_seconds: 3600 max_memory_in_mb: 12000 log_search_progress: true enumerate_all_solutions: false absolute_gap_limit: 0 relative_gap_limit: 0
Setting number of workers to 48

Initial optimization model '': (model_fingerprint: 0xde32cdf5d0246fb6)
#Variables: 294 (#ints: 8 in objective)
  - 207 Booleans in [0,1]
  - 87 in [0,606]
#kLinear1: 40
#kLinear2: 491
#kLinear3: 155
#kLinearN: 2'357 (#terms: 33'319)

Starting presolve at 0.00s
  1.95e-03s  0.00e+00d  [DetectDominanceRelations] 
  4.12e-02s  0.00e+00d  [PresolveToFixPoint] #num_loops=6 #num_dual_strengthening=3 
  2.85e-05s  0.00e+00d  [ExtractEncodingFromLinear] #potential_supersets=5 
[Symmetry] Graph for symmetry has 3'076 nodes and 27'365 arcs.
[Symmetry] Symmetry computation done. time: 0.00248389 dtime: 0.00272396
[Symmetry] #generators: 1, average support size: 24
[Symmetry] The model contains 295 duplicate constraints !
[Symmetry] 12 orbits with sizes: 2,2,2,2,2,2,2,2,2,2,...
[Symmetry] Num fixable by intersecting at_most_one with orbits: 1 largest_orbit: 2
  1.07e-02s  1.48e-03d  [Probe] #probed=304 #fixed_bools=4 #new_bounds=15 #equiv=1 
  4.69e-05s  0.00e+00d  [MaxClique] Merged 17(34 literals) into 8(16 literals) at_most_ones. 
  1.90e-03s  0.00e+00d  [DetectDominanceRelations] 
  2.11e-02s  0.00e+00d  [PresolveToFixPoint] #num_loops=4 #num_dual_strengthening=3 
  6.85e-03s  0.00e+00d  [ProcessAtMostOneAndLinear] 
  2.80e-03s  0.00e+00d  [DetectDuplicateConstraints] #duplicates=339 #without_enforcements=77 
  2.21e-03s  1.04e-04d  [DetectDominatedLinearConstraints] #relevant_constraints=1'969 #num_inclusions=1'111 #num_redundant=2 
  3.48e-04s  0.00e+00d  [DetectDifferentVariables] #different=31 
  6.32e-04s  3.64e-05d  [ProcessSetPPC] #relevant_constraints=1'615 
  2.28e-05s  0.00e+00d  [FindAlmostIdenticalLinearConstraints] 
  2.85e-04s  2.58e-04d  [FindBigAtMostOneAndLinearOverlap] 
  7.64e-03s  2.35e-03d  [FindBigVerticalLinearOverlap] #blocks=49 #saved_nz=4'502 
  3.19e-04s  8.24e-05d  [FindBigHorizontalLinearOverlap] #linears=1'518 
  1.34e-05s  0.00e+00d  [MergeClauses] 
  1.97e-03s  0.00e+00d  [DetectDominanceRelations] 
  2.31e-02s  0.00e+00d  [PresolveToFixPoint] #num_loops=2 #num_dual_strengthening=1 
  1.98e-03s  0.00e+00d  [DetectDominanceRelations] 
  1.31e-02s  0.00e+00d  [PresolveToFixPoint] #num_loops=1 #num_dual_strengthening=1 
[Symmetry] Graph for symmetry has 2'857 nodes and 21'612 arcs.
[Symmetry] Symmetry computation done. time: 0.000827094 dtime: 0.00124066
  1.03e-02s  1.42e-03d  [Probe] #probed=296 #new_bounds=44 
  1.26e-05s  0.00e+00d  [MaxClique] 
  1.97e-03s  0.00e+00d  [DetectDominanceRelations] 
  2.30e-02s  0.00e+00d  [PresolveToFixPoint] #num_loops=4 #num_dual_strengthening=3 
  6.08e-03s  0.00e+00d  [ProcessAtMostOneAndLinear] 
  2.39e-03s  0.00e+00d  [DetectDuplicateConstraints] #without_enforcements=104 
  1.29e-03s  6.05e-05d  [DetectDominatedLinearConstraints] #relevant_constraints=1'732 #num_inclusions=161 
  3.52e-04s  0.00e+00d  [DetectDifferentVariables] #different=38 #cliques=1 #size=3 
  5.43e-04s  2.53e-05d  [ProcessSetPPC] #relevant_constraints=1'404 
  3.43e-05s  1.65e-07d  [FindAlmostIdenticalLinearConstraints] #num_tested_pairs=11 
  1.59e-04s  1.11e-04d  [FindBigAtMostOneAndLinearOverlap] 
  4.98e-03s  1.66e-03d  [FindBigVerticalLinearOverlap] #blocks=36 #saved_nz=2'914 
  2.78e-04s  6.09e-05d  [FindBigHorizontalLinearOverlap] #linears=1'334 
  1.33e-05s  0.00e+00d  [MergeClauses] 
  1.76e-03s  0.00e+00d  [DetectDominanceRelations] 
  2.24e-02s  0.00e+00d  [PresolveToFixPoint] #num_loops=2 #num_dual_strengthening=1 
  1.75e-03s  0.00e+00d  [DetectDominanceRelations] 
  1.48e-02s  0.00e+00d  [PresolveToFixPoint] #num_loops=1 #num_dual_strengthening=1 
  9.92e-03s  1.32e-03d  [Probe] #probed=296 #new_bounds=32 
  1.30e-05s  0.00e+00d  [MaxClique] 
  1.74e-03s  0.00e+00d  [DetectDominanceRelations] 
  2.20e-02s  0.00e+00d  [PresolveToFixPoint] #num_loops=2 #num_dual_strengthening=1 
  5.51e-03s  0.00e+00d  [ProcessAtMostOneAndLinear] 
  2.31e-03s  0.00e+00d  [DetectDuplicateConstraints] #without_enforcements=119 
  1.01e-03s  4.59e-05d  [DetectDominatedLinearConstraints] #relevant_constraints=1'673 #num_inclusions=26 
  2.38e-04s  0.00e+00d  [DetectDifferentVariables] 
  4.57e-04s  1.86e-05d  [ProcessSetPPC] #relevant_constraints=1'297 
  4.20e-05s  1.60e-07d  [FindAlmostIdenticalLinearConstraints] #num_tested_pairs=10 
  1.40e-04s  8.68e-05d  [FindBigAtMostOneAndLinearOverlap] 
  3.44e-03s  1.20e-03d  [FindBigVerticalLinearOverlap] #blocks=32 #saved_nz=2'130 
  2.40e-04s  4.53e-05d  [FindBigHorizontalLinearOverlap] #linears=1'149 
  1.31e-05s  0.00e+00d  [MergeClauses] 
  1.56e-03s  0.00e+00d  [DetectDominanceRelations] 
  1.95e-02s  0.00e+00d  [PresolveToFixPoint] #num_loops=3 #num_dual_strengthening=1 
  1.07e-04s  0.00e+00d  [ExpandObjective] #entries=562 #tight_variables=166 #tight_constraints=99 

Presolve summary:
  - 62 affine relations were detected.
  - rule 'TODO dual: only one blocking constraint?' was applied 746 times.
  - rule 'TODO dual: only one unspecified blocking constraint?' was applied 120 times.
  - rule 'TODO duplicate: identical constraint with different enforcements' was applied 300 times.
  - rule 'TODO no_overlap: with task always last' was applied 1 time.
  - rule 'affine: new relation' was applied 62 times.
  - rule 'all_diff: inferred from x != y constraints' was applied 1 time.
  - rule 'at_most_one: removed literals' was applied 8 times.
  - rule 'at_most_one: size one' was applied 8 times.
  - rule 'at_most_one: transformed into max clique.' was applied 1 time.
  - rule 'deductions: 245 stored' was applied 1 time.
  - rule 'dual: fix variable' was applied 21 times.
  - rule 'dual: reduced domain' was applied 56 times.
  - rule 'duplicate: merged rhs of linear constraint' was applied 48 times.
  - rule 'duplicate: removed constraint' was applied 339 times.
  - rule 'enforcement: false literal' was applied 22 times.
  - rule 'enforcement: true literal' was applied 18 times.
  - rule 'exactly_one: x and not(x)' was applied 1 time.
  - rule 'incompatible linear: add implication' was applied 30 times.
  - rule 'linear inclusion: redundant containing constraint' was applied 2 times.
  - rule 'linear matrix: common vertical rectangle' was applied 117 times.
  - rule 'linear: always true' was applied 434 times.
  - rule 'linear: doubleton free' was applied 11 times.
  - rule 'linear: empty' was applied 26 times.
  - rule 'linear: extracted enforcement literal' was applied 4'530 times.
  - rule 'linear: fixed or dup variables' was applied 2'395 times.
  - rule 'linear: positive equal one' was applied 5 times.
  - rule 'linear: reduced variable domains' was applied 221 times.
  - rule 'linear: remapped using affine relations' was applied 2'376 times.
  - rule 'linear: simplified rhs' was applied 8'838 times.
  - rule 'linear: variable substitution 1' was applied 11 times.
  - rule 'linear: variable substitution 2' was applied 7 times.
  - rule 'presolve: 81 unused variables removed.' was applied 1 time.
  - rule 'presolve: iteration' was applied 3 times.
  - rule 'probing: reduced enforced constraint to implication.' was applied 17 times.
  - rule 'symmetry: fixed to false in general orbit' was applied 1 time.

Presolved optimization model '': (model_fingerprint: 0xdc4275de9de1e2d3)
#Variables: 250 (#ints: 8 in objective)
  - 75 Booleans in [0,1]
  - 137 different domains in [-5385,5281] with a largest complexity of 13.
#kAllDiff: 1
#kExactlyOne: 4 (#literals: 12)
#kLinear2: 602 (#enforced: 544 #multi: 447)
#kLinear3: 212 (#enforced: 138)
#kLinearN: 1'422 (#enforced: 1'298) (#terms: 10'155)

Preloading model.
#Bound   0.30s best:inf   next:[136,3893] initial_domain
#Model   0.30s var:250/250 constraints:2241/2241

Starting search at 0.30s with 48 workers.
16 full problem subsolvers: [core, default_lp, lb_tree_search, max_lp, no_lp, objective_lb_search, objective_lb_search_max_lp, objective_lb_search_no_lp, objective_shaving_search_max_lp, objective_shaving_search_no_lp, probing, probing_max_lp, pseudo_costs, quick_restart, quick_restart_no_lp, reduced_costs]
30 first solution subsolvers: [fj_long_default(2), fj_long_lin_default, fj_long_lin_perturb, fj_long_lin_random, fj_long_perturb, fj_long_random, fj_short_default(2), fj_short_lin_default(2), fj_short_lin_perturb, fj_short_lin_random, fj_short_perturb, fj_short_random, fs_random(4), fs_random_no_lp(4), fs_random_quick_restart(4), fs_random_quick_restart_no_lp(3)]
13 incomplete subsolvers: [feasibility_pump, graph_arc_lns, graph_cst_lns, graph_dec_lns, graph_var_lns, rins/rens, rnd_cst_lns, rnd_var_lns, violation_ls(5)]
3 helper subsolvers: [neighborhood_helper, synchronization_agent, update_gap_integral]
#Bound   0.34s best:inf   next:[137,3893] bool_core (num_cores=1 [size:1 mw:1] a=8 d=0 fixed=0/83 clauses=7)
#Bound   0.34s best:inf   next:[161,3893] objective_lb_search_no_lp
#Bound   0.35s best:inf   next:[183,3893] objective_lb_search_no_lp
#1       0.36s best:1720  next:[183,1719] no_lp (fixed_bools=0/96)
#Bound   0.36s best:1720  next:[238,1719] objective_lb_search_no_lp
#Bound   0.36s best:1720  next:[239,1719] objective_lb_search_no_lp
#Bound   0.36s best:1720  next:[245,1719] objective_lb_search_no_lp
#2       0.36s best:1636  next:[245,1635] quick_restart_no_lp (fixed_bools=0/110)
#Bound   0.37s best:1636  next:[249,1635] objective_lb_search_no_lp
#3       0.37s best:1358  next:[249,1357] no_lp (fixed_bools=0/118)
#4       0.38s best:1357  next:[249,1356] violation_ls(batch:2 #solutions_imported:2 #lin_moves:965 #lin_evals:3'202 #weight_updates:268)
#5       0.38s best:1338  next:[249,1337] no_lp (fixed_bools=0/127)
#6       0.39s best:1284  next:[249,1283] no_lp (fixed_bools=0/134)
#7       0.39s best:1225  next:[249,1224] no_lp (fixed_bools=0/140)
#8       0.40s best:1192  next:[249,1191] no_lp (fixed_bools=0/151)
#9       0.43s best:1187  next:[249,1186] graph_dec_lns (d=0.88 s=106 t=0.10 p=1.00 stall=3 h=auto_l0)
#10      0.45s best:1161  next:[249,1160] graph_var_lns (d=0.91 s=110 t=0.10 p=1.00 stall=4 h=auto_l0)
#11      0.46s best:1056  next:[249,1055] no_lp (fixed_bools=0/161)
#12      0.52s best:1051  next:[249,1050] quick_restart_no_lp (fixed_bools=0/152)
#13      0.52s best:1050  next:[249,1049] violation_ls(batch:3 #solutions_imported:3 #lin_moves:44 #lin_evals:28'202 #gen_moves:10'394 #gen_evals:901 #comp_moves:480 #backtracks:4'957 #weight_updates:189)
#14      0.52s best:1049  next:[249,1048] violation_ls(batch:4 #solutions_imported:4 #lin_moves:45 #lin_evals:28'210 #gen_moves:10'394 #gen_evals:901 #comp_moves:480 #backtracks:4'957 #weight_updates:189)
#Bound   0.52s best:1049  next:[262,1048] objective_lb_search_no_lp
#15      0.52s best:1046  next:[262,1045] quick_restart_no_lp (fixed_bools=0/157)
#16      0.52s best:1045  next:[262,1044] violation_ls(batch:6 #solutions_imported:6 #lin_moves:101 #lin_evals:28'467 #gen_moves:10'394 #gen_evals:901 #comp_moves:480 #backtracks:4'957 #weight_updates:216)
#17      0.52s best:1044  next:[262,1043] violation_ls(batch:7 #solutions_imported:7 #lin_moves:101 #lin_evals:28'491 #gen_moves:10'403 #gen_evals:901 #comp_moves:481 #backtracks:4'961 #weight_updates:216)
#18      0.53s best:1043  next:[262,1042] violation_ls(batch:8 #solutions_imported:8 #lin_moves:107 #lin_evals:28'521 #gen_moves:10'403 #gen_evals:901 #comp_moves:481 #backtracks:4'961 #weight_updates:219)
#19      0.53s best:1042  next:[262,1041] violation_ls(batch:9 #solutions_imported:9 #lin_moves:108 #lin_evals:28'529 #gen_moves:10'403 #gen_evals:901 #comp_moves:481 #backtracks:4'961 #weight_updates:219)
#20      0.53s best:1041  next:[262,1040] violation_ls(batch:10 #solutions_imported:10 #lin_moves:108 #lin_evals:28'570 #gen_moves:10'421 #gen_evals:901 #comp_moves:483 #backtracks:4'969 #weight_updates:219)
#Bound   0.53s best:1041  next:[268,1040] objective_lb_search_no_lp
#21      0.53s best:1026  next:[268,1025] rnd_var_lns (d=0.96 s=133 t=0.10 p=1.00 stall=0 h=auto_l0)
#Bound   0.53s best:1026  next:[282,1025] objective_lb_search_no_lp
#Bound   0.53s best:1026  next:[286,1025] objective_lb_search_no_lp
#Bound   0.54s best:1026  next:[315,1025] objective_lb_search_no_lp
#Bound   0.55s best:1026  next:[319,1025] objective_lb_search_no_lp
#22      0.56s best:983   next:[319,982]  no_lp (fixed_bools=0/189)
#23      0.59s best:975   next:[319,974]  no_lp (fixed_bools=0/197)
#24      0.60s best:953   next:[319,952]  no_lp (fixed_bools=0/204)
#25      0.62s best:945   next:[319,944]  no_lp (fixed_bools=0/210)
#26      0.65s best:944   next:[319,943]  quick_restart_no_lp (fixed_bools=0/174)
#27      0.67s best:942   next:[319,941]  violation_ls(batch:14 #solutions_imported:14 #lin_moves:5'126 #lin_evals:77'228 #gen_moves:19'924 #gen_evals:1'745 #comp_moves:1'353 #backtracks:9'285 #weight_updates:5'301)
#28      0.67s best:940   next:[319,939]  violation_ls(batch:15 #solutions_imported:15 #lin_moves:5'127 #lin_evals:77'236 #gen_moves:19'924 #gen_evals:1'745 #comp_moves:1'353 #backtracks:9'285 #weight_updates:5'301)
#29      0.67s best:938   next:[319,937]  violation_ls(batch:16 #solutions_imported:16 #lin_moves:5'128 #lin_evals:77'243 #gen_moves:19'924 #gen_evals:1'745 #comp_moves:1'353 #backtracks:9'285 #weight_updates:5'301)
#30      0.69s best:933   next:[319,932]  quick_restart_no_lp (fixed_bools=0/191)
#31      0.70s best:928   next:[319,927]  quick_restart_no_lp (fixed_bools=0/199)
#32      0.73s best:926   next:[319,925]  violation_ls(batch:7 #solutions_imported:7 #lin_moves:14'554 #lin_evals:115'187 #gen_moves:21'098 #gen_evals:2'338 #comp_moves:952 #backtracks:10'070 #weight_updates:5'764)
#33      0.73s best:925   next:[319,924]  violation_ls(batch:8 #solutions_imported:8 #lin_moves:14'554 #lin_evals:115'190 #gen_moves:21'100 #gen_evals:2'338 #comp_moves:954 #backtracks:10'070 #weight_updates:5'764)
#34      0.73s best:924   next:[319,923]  violation_ls(batch:9 #solutions_imported:9 #lin_moves:14'554 #lin_evals:115'214 #gen_moves:21'113 #gen_evals:2'338 #comp_moves:955 #backtracks:10'076 #weight_updates:5'764)
#35      0.73s best:923   next:[319,922]  violation_ls(batch:10 #solutions_imported:10 #lin_moves:14'554 #lin_evals:115'216 #gen_moves:21'115 #gen_evals:2'339 #comp_moves:957 #backtracks:10'076 #weight_updates:5'764)
#36      0.73s best:921   next:[319,920]  violation_ls(batch:11 #solutions_imported:11 #lin_moves:14'555 #lin_evals:115'222 #gen_moves:21'115 #gen_evals:2'339 #comp_moves:957 #backtracks:10'076 #weight_updates:5'764)
#37      0.74s best:920   next:[319,919]  violation_ls(batch:12 #solutions_imported:12 #lin_moves:14'556 #lin_evals:115'230 #gen_moves:21'115 #gen_evals:2'339 #comp_moves:957 #backtracks:10'076 #weight_updates:5'764)
#38      0.74s best:918   next:[319,917]  violation_ls(batch:13 #solutions_imported:13 #lin_moves:14'556 #lin_evals:115'252 #gen_moves:21'122 #gen_evals:2'339 #comp_moves:958 #backtracks:10'079 #weight_updates:5'764)
#39      0.74s best:916   next:[319,915]  violation_ls(batch:14 #solutions_imported:14 #lin_moves:14'557 #lin_evals:115'260 #gen_moves:21'122 #gen_evals:2'339 #comp_moves:958 #backtracks:10'079 #weight_updates:5'764)
#40      0.74s best:915   next:[319,914]  violation_ls(batch:15 #solutions_imported:15 #lin_moves:14'557 #lin_evals:115'329 #gen_moves:21'152 #gen_evals:2'341 #comp_moves:960 #backtracks:10'093 #weight_updates:5'764)
#41      0.74s best:914   next:[319,913]  violation_ls(batch:16 #solutions_imported:16 #lin_moves:14'557 #lin_evals:115'354 #gen_moves:21'165 #gen_evals:2'341 #comp_moves:961 #backtracks:10'099 #weight_updates:5'764)
#42      0.74s best:913   next:[319,912]  violation_ls(batch:17 #solutions_imported:17 #lin_moves:14'573 #lin_evals:115'442 #gen_moves:21'165 #gen_evals:2'341 #comp_moves:961 #backtracks:10'099 #weight_updates:5'779)
#Bound   0.84s best:913   next:[321,912]  objective_lb_search_no_lp
#Bound   0.85s best:913   next:[323,912]  objective_lb_search_no_lp
#Bound   0.86s best:913   next:[326,912]  objective_lb_search_no_lp
#Bound   0.87s best:913   next:[333,912]  objective_lb_search_no_lp
#43      0.88s best:886   next:[333,885]  rins_pump_lns (d=0.71 s=230 t=0.10 p=1.00 stall=0 h=auto_l0)
#Bound   0.89s best:886   next:[378,885]  objective_lb_search_no_lp
#Bound   0.99s best:886   next:[439,885]  objective_lb_search_no_lp
#44      1.08s best:880   next:[439,879]  quick_restart_no_lp (fixed_bools=1/243)
#Bound   1.36s best:880   next:[440,879]  objective_lb_search_no_lp
#Bound   1.57s best:880   next:[442,879]  objective_lb_search_no_lp
#45      1.65s best:878   next:[442,877]  graph_dec_lns (d=0.99 s=194 t=0.10 p=1.00 stall=0 h=auto_l0)
#Bound   2.16s best:878   next:[443,877]  objective_lb_search_no_lp
#Bound   2.95s best:878   next:[453,877]  objective_lb_search_no_lp [skipped_logs=4]
#46      3.41s best:875   next:[453,874]  rins_pump_lns (d=0.98 s=330 t=0.10 p=0.91 stall=0 h=auto_l0)
#47      3.59s best:874   next:[453,873]  quick_restart_no_lp (fixed_bools=6/370)
#48      3.60s best:827   next:[453,826]  graph_var_lns (d=1.00 s=323 t=0.10 p=1.00 stall=0 h=auto_l0)
#Bound   3.98s best:827   next:[455,826]  objective_lb_search_no_lp [skipped_logs=1]
#Bound   5.01s best:827   next:[483,826]  objective_lb_search_no_lp [skipped_logs=8]
#Bound   5.75s best:827   next:[487,826]  objective_lb_search_no_lp [skipped_logs=1]
#Bound   6.32s best:827   next:[488,826]  objective_lb_search_no_lp [skipped_logs=0]
#Bound   7.94s best:827   next:[489,826]  objective_shaving_search_no_lp (vars=261 csts=2159) [skipped_logs=0]
#Bound   9.19s best:827   next:[490,826]  objective_lb_search_no_lp
#Bound   9.97s best:827   next:[493,826]  objective_lb_search_no_lp [skipped_logs=1]
#Bound  10.35s best:827   next:[498,826]  objective_lb_search [skipped_logs=0]
#Bound  11.71s best:827   next:[500,826]  objective_lb_search_no_lp [skipped_logs=0]
#Bound  12.90s best:827   next:[501,826]  objective_lb_search [skipped_logs=0]
#Bound  13.71s best:827   next:[512,826]  objective_lb_search [skipped_logs=2]
#Bound  14.50s best:827   next:[516,826]  objective_lb_search_no_lp [skipped_logs=0]
#Bound  15.91s best:827   next:[517,826]  objective_lb_search_no_lp [skipped_logs=0]
#Bound  16.53s best:827   next:[520,826]  objective_lb_search_no_lp [skipped_logs=1]
#Bound  17.39s best:827   next:[523,826]  objective_lb_search_no_lp [skipped_logs=0]
#Bound  18.12s best:827   next:[530,826]  objective_lb_search_no_lp [skipped_logs=0]
#Bound  19.24s best:827   next:[532,826]  objective_lb_search [skipped_logs=0]
#Bound  20.81s best:827   next:[538,826]  objective_lb_search [skipped_logs=0]
#Bound  22.13s best:827   next:[542,826]  objective_lb_search_no_lp
#Bound  24.60s best:827   next:[543,826]  objective_shaving_search_no_lp (vars=268 csts=2166)
#Bound  28.88s best:827   next:[544,826]  objective_shaving_search_no_lp (vars=268 csts=2166)
#Bound  28.99s best:827   next:[545,826]  objective_lb_search_no_lp
#Bound  32.22s best:827   next:[552,826]  objective_lb_search_no_lp
#Bound  32.94s best:827   next:[554,826]  objective_lb_search_no_lp
#Bound  33.10s best:827   next:[556,826]  objective_lb_search_no_lp
#Bound  34.24s best:827   next:[557,826]  objective_lb_search_no_lp
#Bound  35.37s best:827   next:[558,826]  objective_lb_search_no_lp
#Bound  36.79s best:827   next:[560,826]  objective_lb_search_no_lp
#Bound  37.48s best:827   next:[573,826]  objective_lb_search_no_lp
#Bound  38.20s best:827   next:[574,826]  objective_lb_search_no_lp
#Bound  38.82s best:827   next:[578,826]  objective_lb_search_no_lp
#Bound  40.15s best:827   next:[589,826]  objective_lb_search_no_lp
#Bound  45.29s best:827   next:[590,826]  objective_shaving_search_no_lp (vars=265 csts=2163)
#Bound  46.17s best:827   next:[594,826]  objective_lb_search_no_lp
#Bound  47.39s best:827   next:[596,826]  objective_lb_search_no_lp
#Bound  48.27s best:827   next:[599,826]  objective_lb_search_no_lp
#Bound  48.98s best:827   next:[600,826]  objective_lb_search_no_lp
#Bound  49.60s best:827   next:[602,826]  objective_lb_search_no_lp
#Bound  50.41s best:827   next:[603,826]  objective_lb_search_no_lp
#Bound  51.69s best:827   next:[604,826]  objective_lb_search_no_lp
#Bound  52.31s best:827   next:[606,826]  objective_lb_search_no_lp
#Bound  56.73s best:827   next:[607,826]  objective_lb_search_no_lp
#Bound  57.02s best:827   next:[608,826]  objective_lb_search_no_lp
#Bound  58.94s best:827   next:[611,826]  objective_lb_search_no_lp
#Bound  59.25s best:827   next:[614,826]  objective_lb_search_no_lp
#Bound  60.00s best:827   next:[616,826]  objective_lb_search_no_lp
#Bound  68.71s best:827   next:[617,826]  objective_lb_search_no_lp
#Bound  72.31s best:827   next:[618,826]  objective_lb_search_no_lp
#Bound  73.88s best:827   next:[619,826]  objective_lb_search_no_lp
#Bound  77.84s best:827   next:[620,826]  objective_lb_search_no_lp
#Bound  82.82s best:827   next:[621,826]  objective_lb_search_no_lp
#Bound  90.78s best:827   next:[631,826]  objective_lb_search_no_lp
#Bound 100.31s best:827   next:[632,826]  objective_lb_search_no_lp
#Bound 104.77s best:827   next:[634,826]  objective_lb_search_no_lp
#Bound 107.68s best:827   next:[635,826]  objective_lb_search_no_lp
#Bound 110.08s best:827   next:[637,826]  objective_lb_search_no_lp
#Bound 113.96s best:827   next:[641,826]  objective_lb_search_no_lp
#Bound 121.22s best:827   next:[643,826]  objective_lb_search_no_lp
#Bound 128.86s best:827   next:[644,826]  objective_lb_search_no_lp
#Bound 132.47s best:827   next:[645,826]  objective_lb_search_no_lp
#Bound 135.83s best:827   next:[646,826]  objective_lb_search_no_lp
#Bound 137.44s best:827   next:[647,826]  objective_lb_search_no_lp
#Bound 140.21s best:827   next:[648,826]  objective_lb_search_no_lp
#Bound 143.63s best:827   next:[653,826]  objective_lb_search_no_lp
#Bound 146.79s best:827   next:[654,826]  objective_lb_search_no_lp
#Bound 149.24s best:827   next:[655,826]  objective_lb_search_no_lp
#Bound 150.17s best:827   next:[657,826]  objective_lb_search_no_lp
#Bound 155.70s best:827   next:[658,826]  objective_lb_search_no_lp
#Bound 158.15s best:827   next:[659,826]  objective_lb_search_no_lp
#Model 164.30s var:248/250 constraints:2068/2241
#Model 164.57s var:247/250 constraints:2058/2241
#Model 166.44s var:246/250 constraints:2020/2241
#Bound 167.41s best:827   next:[660,826]  objective_lb_search
#Model 168.57s var:245/250 constraints:2010/2241
#Model 170.21s var:239/250 constraints:1783/2241
#Bound 170.34s best:827   next:[664,826]  objective_lb_search
#Model 170.39s var:237/250 constraints:1730/2241
#Bound 170.45s best:827   next:[668,826]  objective_lb_search
#Model 170.55s var:236/250 constraints:1712/2241
#Bound 170.55s best:827   next:[671,826]  objective_lb_search
#Bound 170.68s best:827   next:[677,826]  objective_lb_search
#Model 170.73s var:229/250 constraints:1414/2241
#Bound 170.75s best:827   next:[679,826]  objective_lb_search
#Model 170.76s var:228/250 constraints:1335/2241
#Model 170.77s var:225/250 constraints:1161/2241
#Bound 170.79s best:827   next:[680,826]  objective_lb_search
#Model 170.83s var:224/250 constraints:1070/2241
#Bound 170.84s best:827   next:[699,826]  objective_lb_search
#Bound 170.88s best:827   next:[738,826]  objective_lb_search
#Bound 170.93s best:827   next:[782,826]  objective_lb_search
#Model 170.94s var:223/250 constraints:1030/2241
#Model 170.96s var:218/250 constraints:911/2241
#Model 170.98s var:202/250 constraints:346/2241
#Done  170.98s quick_restart_no_lp
#Done  170.98s core
#Done  170.98s pseudo_costs

Task timing                                  n [     min,      max]      avg      dev     time         n [     min,      max]      avg      dev    dtime
                             'core':         1 [   2.84m,    2.84m]    2.84m   0.00ns    2.84m         1 [   1.98m,    1.98m]    1.98m   0.00ns    1.98m
                       'default_lp':         1 [   2.84m,    2.84m]    2.84m   0.00ns    2.84m         1 [  24.50s,   24.50s]   24.50s   0.00ns   24.50s
                 'feasibility_pump':       655 [ 18.87ms, 575.30ms] 189.08ms  60.34ms    2.06m       654 [  8.26ms,  33.81ms]  15.16ms 782.11us    9.92s
                  'fj_long_default':         1 [ 70.71ms,  70.71ms]  70.71ms   0.00ns  70.71ms         1 [ 20.71ms,  20.71ms]  20.71ms   0.00ns  20.71ms
                  'fj_long_default':         1 [129.40ms, 129.40ms] 129.40ms   0.00ns 129.40ms         1 [ 47.99ms,  47.99ms]  47.99ms   0.00ns  47.99ms
              'fj_long_lin_default':         1 [116.50ms, 116.50ms] 116.50ms   0.00ns 116.50ms         1 [ 64.03ms,  64.03ms]  64.03ms   0.00ns  64.03ms
              'fj_long_lin_perturb':         1 [ 94.53ms,  94.53ms]  94.53ms   0.00ns  94.53ms         1 [ 33.22ms,  33.22ms]  33.22ms   0.00ns  33.22ms
               'fj_long_lin_random':         1 [111.10ms, 111.10ms] 111.10ms   0.00ns 111.10ms         1 [ 42.10ms,  42.10ms]  42.10ms   0.00ns  42.10ms
                  'fj_long_perturb':         1 [114.37ms, 114.37ms] 114.37ms   0.00ns 114.37ms         1 [ 62.96ms,  62.96ms]  62.96ms   0.00ns  62.96ms
                   'fj_long_random':         1 [ 79.52ms,  79.52ms]  79.52ms   0.00ns  79.52ms         1 [ 24.98ms,  24.98ms]  24.98ms   0.00ns  24.98ms
                 'fj_short_default':         1 [ 88.47ms,  88.47ms]  88.47ms   0.00ns  88.47ms         1 [ 30.57ms,  30.57ms]  30.57ms   0.00ns  30.57ms
                 'fj_short_default':         1 [107.31ms, 107.31ms] 107.31ms   0.00ns 107.31ms         1 [ 63.06ms,  63.06ms]  63.06ms   0.00ns  63.06ms
             'fj_short_lin_default':         1 [112.46ms, 112.46ms] 112.46ms   0.00ns 112.46ms         1 [ 62.60ms,  62.60ms]  62.60ms   0.00ns  62.60ms
             'fj_short_lin_default':         1 [113.31ms, 113.31ms] 113.31ms   0.00ns 113.31ms         1 [ 61.89ms,  61.89ms]  61.89ms   0.00ns  61.89ms
             'fj_short_lin_perturb':         1 [ 71.69ms,  71.69ms]  71.69ms   0.00ns  71.69ms         1 [ 21.17ms,  21.17ms]  21.17ms   0.00ns  21.17ms
              'fj_short_lin_random':         1 [116.19ms, 116.19ms] 116.19ms   0.00ns 116.19ms         1 [ 61.86ms,  61.86ms]  61.86ms   0.00ns  61.86ms
                 'fj_short_perturb':         1 [ 76.70ms,  76.70ms]  76.70ms   0.00ns  76.70ms         1 [ 23.25ms,  23.25ms]  23.25ms   0.00ns  23.25ms
                  'fj_short_random':         1 [117.27ms, 117.27ms] 117.27ms   0.00ns 117.27ms         1 [ 63.54ms,  63.54ms]  63.54ms   0.00ns  63.54ms
                        'fs_random':         1 [ 46.88ms,  46.88ms]  46.88ms   0.00ns  46.88ms         1 [  3.58us,   3.58us]   3.58us   0.00ns   3.58us
                        'fs_random':         1 [ 48.16ms,  48.16ms]  48.16ms   0.00ns  48.16ms         1 [  3.58us,   3.58us]   3.58us   0.00ns   3.58us
                        'fs_random':         1 [ 48.78ms,  48.78ms]  48.78ms   0.00ns  48.78ms         1 [  3.58us,   3.58us]   3.58us   0.00ns   3.58us
                        'fs_random':         1 [ 52.72ms,  52.72ms]  52.72ms   0.00ns  52.72ms         1 [  3.58us,   3.58us]   3.58us   0.00ns   3.58us
                  'fs_random_no_lp':         1 [ 46.97ms,  46.97ms]  46.97ms   0.00ns  46.97ms         1 [456.93us, 456.93us] 456.93us   0.00ns 456.93us
                  'fs_random_no_lp':         1 [ 47.87ms,  47.87ms]  47.87ms   0.00ns  47.87ms         1 [677.85us, 677.85us] 677.85us   0.00ns 677.85us
                  'fs_random_no_lp':         1 [ 48.77ms,  48.77ms]  48.77ms   0.00ns  48.77ms         1 [555.83us, 555.83us] 555.83us   0.00ns 555.83us
                  'fs_random_no_lp':         1 [ 51.30ms,  51.30ms]  51.30ms   0.00ns  51.30ms         1 [645.85us, 645.85us] 645.85us   0.00ns 645.85us
          'fs_random_quick_restart':         1 [ 46.77ms,  46.77ms]  46.77ms   0.00ns  46.77ms         1 [  3.58us,   3.58us]   3.58us   0.00ns   3.58us
          'fs_random_quick_restart':         1 [ 47.42ms,  47.42ms]  47.42ms   0.00ns  47.42ms         1 [  3.58us,   3.58us]   3.58us   0.00ns   3.58us
          'fs_random_quick_restart':         1 [ 48.12ms,  48.12ms]  48.12ms   0.00ns  48.12ms         1 [  3.58us,   3.58us]   3.58us   0.00ns   3.58us
          'fs_random_quick_restart':         1 [ 48.89ms,  48.89ms]  48.89ms   0.00ns  48.89ms         1 [  3.58us,   3.58us]   3.58us   0.00ns   3.58us
    'fs_random_quick_restart_no_lp':         1 [ 48.26ms,  48.26ms]  48.26ms   0.00ns  48.26ms         1 [358.10us, 358.10us] 358.10us   0.00ns 358.10us
    'fs_random_quick_restart_no_lp':         1 [ 52.25ms,  52.25ms]  52.25ms   0.00ns  52.25ms         1 [332.63us, 332.63us] 332.63us   0.00ns 332.63us
    'fs_random_quick_restart_no_lp':         1 [ 52.87ms,  52.87ms]  52.87ms   0.00ns  52.87ms         1 [404.51us, 404.51us] 404.51us   0.00ns 404.51us
                    'graph_arc_lns':       659 [  3.85ms,    3.13s]    1.10s 704.14ms   12.13m       646 [ 10.00ns, 234.42ms]  70.15ms  47.56ms   45.32s
                    'graph_cst_lns':       659 [  1.78ms,    2.60s]    1.06s 683.15ms   11.69m       621 [ 10.00ns, 128.12ms]  73.10ms  44.81ms   45.39s
                    'graph_dec_lns':       659 [  2.10ms,    2.83s]    1.10s 672.48ms   12.09m       647 [ 10.00ns, 243.83ms]  70.03ms  47.31ms   45.31s
                    'graph_var_lns':       659 [  6.00ms,    2.96s]    1.09s 659.00ms   11.98m       645 [ 10.00ns, 295.12ms]  70.68ms  46.12ms   45.59s
                   'lb_tree_search':         1 [   2.84m,    2.84m]    2.84m   0.00ns    2.84m         1 [  40.91s,   40.91s]   40.91s   0.00ns   40.91s
                           'max_lp':         1 [   2.84m,    2.84m]    2.84m   0.00ns    2.84m         1 [  32.13s,   32.13s]   32.13s   0.00ns   32.13s
                            'no_lp':         1 [   2.84m,    2.84m]    2.84m   0.00ns    2.84m         1 [  19.25s,   19.25s]   19.25s   0.00ns   19.25s
              'objective_lb_search':         1 [   2.84m,    2.84m]    2.84m   0.00ns    2.84m         1 [  27.64s,   27.64s]   27.64s   0.00ns   27.64s
       'objective_lb_search_max_lp':         1 [   2.84m,    2.84m]    2.84m   0.00ns    2.84m         1 [  30.65s,   30.65s]   30.65s   0.00ns   30.65s
        'objective_lb_search_no_lp':         1 [   2.84m,    2.84m]    2.84m   0.00ns    2.84m         1 [  14.77s,   14.77s]   14.77s   0.00ns   14.77s
  'objective_shaving_search_max_lp':       110 [  2.78ms,    9.53s]    1.55s    2.13s    2.84m        91 [ 24.48us,    1.18s] 179.27ms 268.75ms   16.31s
   'objective_shaving_search_no_lp':       107 [  5.96ms,    9.53s]    1.59s    2.14s    2.84m        92 [252.94us, 890.69ms] 138.02ms 209.41ms   12.70s
                          'probing':         1 [   2.84m,    2.84m]    2.84m   0.00ns    2.84m         1 [  20.44s,   20.44s]   20.44s   0.00ns   20.44s
                   'probing_max_lp':         1 [   2.84m,    2.84m]    2.84m   0.00ns    2.84m         1 [  19.14s,   19.14s]   19.14s   0.00ns   19.14s
                     'pseudo_costs':         1 [   2.84m,    2.84m]    2.84m   0.00ns    2.84m         1 [  27.81s,   27.81s]   27.81s   0.00ns   27.81s
                    'quick_restart':         1 [   2.84m,    2.84m]    2.84m   0.00ns    2.84m         1 [  28.84s,   28.84s]   28.84s   0.00ns   28.84s
              'quick_restart_no_lp':         1 [   2.84m,    2.84m]    2.84m   0.00ns    2.84m         1 [  29.08s,   29.08s]   29.08s   0.00ns   29.08s
                    'reduced_costs':         1 [   2.84m,    2.84m]    2.84m   0.00ns    2.84m         1 [  25.11s,   25.11s]   25.11s   0.00ns   25.11s
                        'rins/rens':       659 [164.05us,    2.75s] 773.15ms 645.95ms    8.49m       507 [ 10.00ns, 200.31ms]  73.04ms  37.22ms   37.03s
                      'rnd_cst_lns':       659 [  1.87ms,    3.01s]    1.12s 658.72ms   12.29m       649 [ 10.00ns, 239.31ms]  72.40ms  45.45ms   46.99s
                      'rnd_var_lns':       659 [  2.99ms,    2.77s]    1.04s 650.37ms   11.45m       649 [ 10.00ns, 244.07ms]  70.51ms  47.05ms   45.76s
                     'violation_ls':       655 [ 33.97ms, 329.92ms] 144.98ms  52.61ms    1.58m       655 [ 14.33ms, 113.99ms]  59.39ms  13.82ms   38.90s
                     'violation_ls':       655 [265.29us, 465.85ms] 139.80ms  53.96ms    1.53m       655 [750.00ns,  98.27ms]  51.29ms  12.42ms   33.59s
                     'violation_ls':       656 [  4.80ms, 372.34ms] 158.75ms  55.97ms    1.74m       656 [  1.11ms,  95.71ms]  54.71ms  12.74ms   35.89s
                     'violation_ls':       656 [ 13.12ms, 383.37ms] 157.18ms  54.57ms    1.72m       656 [  4.37ms, 102.54ms]  55.92ms  14.47ms   36.68s
                     'violation_ls':       656 [266.18us, 485.75ms] 155.68ms  63.74ms    1.70m       656 [710.00ns, 154.02ms]  61.61ms  22.19ms   40.42s

Search stats                        Bools  Conflicts  Branches  Restarts   BoolPropag  IntegerPropag
                           'core':  3'217     91'905   238'998    23'724  110'795'913     53'119'747
                     'default_lp':     75     35'688   182'774    23'681    1'067'497     33'809'012
                      'fs_random':     75          0       150       150           24          3'474
                      'fs_random':     75          0       150       150           24          3'474
                      'fs_random':     75          0       150       150           24          3'474
                      'fs_random':     75          0       150       150           24          3'474
                'fs_random_no_lp':     75          0       205       150           41          6'128
                'fs_random_no_lp':     75          7       200       150           81          5'669
                'fs_random_no_lp':     75          8       227       150           59          6'610
                'fs_random_no_lp':     75          9       205       150          117          6'402
        'fs_random_quick_restart':     75          0       150       150           24          3'474
        'fs_random_quick_restart':     75          0       150       150           24          3'474
        'fs_random_quick_restart':     75          0       150       150           24          3'474
        'fs_random_quick_restart':     75          0       150       150           24          3'474
  'fs_random_quick_restart_no_lp':     75          0       184       150           49          5'359
  'fs_random_quick_restart_no_lp':     75          0       195       150           27          5'059
  'fs_random_quick_restart_no_lp':     75          0       210       150           30          5'141
                 'lb_tree_search':     75        340   146'103    17'015      236'545     11'147'483
                         'max_lp':     75     22'826   218'193    33'026    1'055'155     31'455'277
                          'no_lp':    777    103'877   205'938    15'236   20'091'593     64'861'325
            'objective_lb_search':    234     28'635   233'666    39'796    1'778'987     36'841'254
     'objective_lb_search_max_lp':    178     13'807   238'290    44'475    1'280'979     31'415'380
      'objective_lb_search_no_lp':    332     89'465   205'005    15'756    3'022'404     61'051'859
                        'probing':    425        247     2'361     1'572       17'569        120'492
                 'probing_max_lp':    425        245     1'661     1'227       16'292        108'952
                   'pseudo_costs':     75     27'209   200'380    30'445      966'458     31'393'352
                  'quick_restart':     75      7'749   294'073    76'521      840'818     25'050'559
            'quick_restart_no_lp':  2'607     90'669   331'812    22'821   56'999'076     54'277'305
                  'reduced_costs':  2'742     26'228   175'366    22'173   25'048'059     23'460'005

SAT stats                           ClassicMinim  LitRemoved  LitLearned  LitForgotten  Subsumed  MClauses  MDecisions  MLitTrue  MSubsumed  MLitRemoved  MReused
                           'core':        83'194     493'177     748'592        59'207       366    11'031      54'305         0        434        1'711      124
                     'default_lp':        25'443      62'418     413'032       133'813     1'100    12'642     134'808         0      2'018       13'861    2'787
                      'fs_random':             0           0           0             0         0         0           0         0          0            0        0
                      'fs_random':             0           0           0             0         0         0           0         0          0            0        0
                      'fs_random':             0           0           0             0         0         0           0         0          0            0        0
                      'fs_random':             0           0           0             0         0         0           0         0          0            0        0
                'fs_random_no_lp':             0           0           0             0         0         0           0         0          0            0        0
                'fs_random_no_lp':             0           0          36             0         0         0           0         0          0            0        0
                'fs_random_no_lp':             0           0          40             0         0         0           0         0          0            0        0
                'fs_random_no_lp':             1           1          43             0         0         0           0         0          0            0        0
        'fs_random_quick_restart':             0           0           0             0         0         0           0         0          0            0        0
        'fs_random_quick_restart':             0           0           0             0         0         0           0         0          0            0        0
        'fs_random_quick_restart':             0           0           0             0         0         0           0         0          0            0        0
        'fs_random_quick_restart':             0           0           0             0         0         0           0         0          0            0        0
  'fs_random_quick_restart_no_lp':             0           0           0             0         0         0           0         0          0            0        0
  'fs_random_quick_restart_no_lp':             0           0           0             0         0         0           0         0          0            0        0
  'fs_random_quick_restart_no_lp':             0           0           0             0         0         0           0         0          0            0        0
                 'lb_tree_search':            18          31       1'614             0         4     7'327      37'095         0         70          289      437
                         'max_lp':        15'820      40'720     256'371        57'382       820    16'692     182'370         0      2'413       16'349    3'636
                          'no_lp':        82'663     359'075   1'422'239     1'005'001     1'134     7'715      65'644         5      2'636       17'492    1'042
            'objective_lb_search':        20'946      51'225     258'331         9'964     1'016    19'661     185'113         0      2'724       16'975    3'896
     'objective_lb_search_max_lp':         9'406      21'453     130'762         1'993       677    19'902     199'345         0      1'247        7'957    5'875
      'objective_lb_search_no_lp':        71'172     240'802     826'549       228'343     2'084     9'397      93'431         0      4'181       29'223    1'798
                        'probing':             0           0         247             0         0         0           0         0          0            0        0
                 'probing_max_lp':             0           0         245             0         0         0           0         0          0            0        0
                   'pseudo_costs':        17'618      42'790     333'226       107'529     1'005    15'045     158'868         7      1'809       13'079    2'761
                  'quick_restart':         4'576      10'298     104'276             0       265    33'134     247'695         0        284        1'559    3'086
            'quick_restart_no_lp':        74'527     399'592   1'119'534       704'916       890     9'729      77'580        25      5'948       41'346      957
                  'reduced_costs':        19'435      71'244     308'063       125'385       608    12'737     102'298         0      4'378       29'810    2'094

Lp stats                         Component  Iterations  AddedCuts  OPTIMAL  DUAL_F.  DUAL_U.
                  'default_lp':          1     297'941     23'306   47'406        0        0
                   'fs_random':          1          98         50        3        0        0
                   'fs_random':          1          98         57        3        0        0
                   'fs_random':          1          98         92        3        0        0
                   'fs_random':          1          98         94        3        0        0
     'fs_random_quick_restart':          1          98         50        3        0        0
     'fs_random_quick_restart':          1          98         50        3        0        0
     'fs_random_quick_restart':          1          98         58        3        0        0
     'fs_random_quick_restart':          1          98         87        3        0        0
              'lb_tree_search':          1   1'173'671      8'809   70'507   23'470        0
                      'max_lp':          1     561'007     19'251   35'009    8'323       23
         'objective_lb_search':          1     359'191     21'559   39'529        0        0
  'objective_lb_search_max_lp':          1     476'346     12'836   22'475    5'364        5
                     'probing':          1     135'089     29'342    7'953        0        0
              'probing_max_lp':          1     121'033     15'102    5'236      550        0
                'pseudo_costs':          1     522'491     22'879   40'433   11'791       15
               'quick_restart':          1     299'178     23'254   27'642        1        1
               'reduced_costs':          1     411'222     22'758   34'925    8'466        5

Lp dimension                                                                      Final dimension of first component
                  'default_lp':   277 rows, 243 columns, 1225 entries with magnitude in [1.179360e-03, 1.000000e+00]
                   'fs_random':     90 rows, 243 columns, 412 entries with magnitude in [9.083405e-02, 1.000000e+00]
                   'fs_random':     90 rows, 243 columns, 412 entries with magnitude in [9.083405e-02, 1.000000e+00]
                   'fs_random':     91 rows, 243 columns, 416 entries with magnitude in [4.062222e-02, 1.000000e+00]
                   'fs_random':     91 rows, 243 columns, 416 entries with magnitude in [4.062222e-02, 1.000000e+00]
     'fs_random_quick_restart':     90 rows, 243 columns, 412 entries with magnitude in [9.083405e-02, 1.000000e+00]
     'fs_random_quick_restart':     91 rows, 243 columns, 416 entries with magnitude in [4.062222e-02, 1.000000e+00]
     'fs_random_quick_restart':     91 rows, 243 columns, 416 entries with magnitude in [4.062222e-02, 1.000000e+00]
     'fs_random_quick_restart':     91 rows, 243 columns, 416 entries with magnitude in [4.062222e-02, 1.000000e+00]
              'lb_tree_search':   485 rows, 250 columns, 1913 entries with magnitude in [1.403438e-03, 1.000000e+00]
                      'max_lp':   732 rows, 250 columns, 2681 entries with magnitude in [6.107397e-04, 1.000000e+00]
         'objective_lb_search':   468 rows, 243 columns, 2007 entries with magnitude in [8.352526e-05, 1.000000e+00]
  'objective_lb_search_max_lp':  1207 rows, 250 columns, 2478 entries with magnitude in [6.102368e-04, 1.000000e+00]
                     'probing':   850 rows, 243 columns, 6176 entries with magnitude in [6.945110e-04, 1.000000e+00]
              'probing_max_lp':  1071 rows, 250 columns, 7403 entries with magnitude in [2.196958e-03, 1.000000e+00]
                'pseudo_costs':  1029 rows, 250 columns, 3077 entries with magnitude in [2.981834e-04, 1.000000e+00]
               'quick_restart':   923 rows, 243 columns, 3421 entries with magnitude in [4.353930e-05, 1.000000e+00]
               'reduced_costs':   744 rows, 250 columns, 2079 entries with magnitude in [2.727321e-03, 1.000000e+00]

Lp debug                         CutPropag  CutEqPropag  Adjust  Overflow        Bad  BadScaling
                  'default_lp':          8          137  18'521         0    219'665           0
                   'fs_random':          0            0       0         0          0           0
                   'fs_random':          0            0       0         0          1           0
                   'fs_random':          0            0       0         0         50           0
                   'fs_random':          0            0       0         0         79           0
     'fs_random_quick_restart':          0            0       0         0          0           0
     'fs_random_quick_restart':          0            0       0         0          0           0
     'fs_random_quick_restart':          0            0       0         0         19           0
     'fs_random_quick_restart':          0            0       0         0         59           0
              'lb_tree_search':         29           16  45'293         0     66'890           0
                      'max_lp':         58           49  18'704         0    235'046           0
         'objective_lb_search':         27           65  21'356         0    279'870           0
  'objective_lb_search_max_lp':         45          105  13'603         0    211'350           0
                     'probing':          8          233   5'954         0  3'239'027           0
              'probing_max_lp':         47          162   5'667         0  3'011'341           0
                'pseudo_costs':        110           50  23'532         0    236'386           0
               'quick_restart':         30           99  19'500         0    509'677           0
               'reduced_costs':         75           30  28'457         0    235'037           0

Lp pool                          Constraints  Updates  Simplif  Merged  Shortened   Split  Strenghtened      Cuts/Call
                  'default_lp':        9'382    1'936   32'215     184      6'179  28'225        11'474  23'306/54'105
                   'fs_random':          310        0        0       0          0       0             8          50/50
                   'fs_random':          317        0        0       0          0       0             8          57/58
                   'fs_random':          352        0        0       0          0       0            11         92/129
                   'fs_random':          354        0        0       0          0       0             8         94/130
     'fs_random_quick_restart':          310        0        0       0          0       0             8          50/50
     'fs_random_quick_restart':          310        0        0       0          0       0             8          50/50
     'fs_random_quick_restart':          318        0        0       0          0       0             9          58/70
     'fs_random_quick_restart':          347        0        0       0          0       0             8         87/118
              'lb_tree_search':       10'932      719   44'345     117          0     809        45'165   8'809/36'652
                      'max_lp':       11'332    1'620  147'270     159     15'674  12'767        74'522  19'251/48'958
         'objective_lb_search':        9'742    2'482  136'115      77     13'870  27'238        15'623  21'559/54'977
  'objective_lb_search_max_lp':       12'000    1'373   96'262      76     14'356   6'996        64'817  12'836/35'905
                     'probing':        9'557    3'676   87'983      45      4'726  47'471        17'270  29'342/53'531
              'probing_max_lp':       11'318    2'238   60'497      24          0  20'339        38'850  15'102/36'893
                'pseudo_costs':       11'820    1'555  155'725     299     16'640  13'102        83'287  22'879/55'927
               'quick_restart':        9'453    2'946  109'125      61     13'566  83'106        25'675  23'254/50'526
               'reduced_costs':       11'715    1'446  100'417     283     12'576  10'156        66'395  22'758/57'843

Lp Cut            fs_ran  fs_ran  fs_ran  fs_ran  fs_ran  fs_ran  fs_ran  fs_ran  defaul  max_lp  quick_  reduce  pseudo  lb_tre  probin  object  probin  object
          CG_FF:       -       -       -       -       -       -       -       -   1'326     959     948   1'295   1'168     503     805   1'144     276     467
           CG_K:       -       -       -       -       -       -       -       -     702     566     395   1'089     726     250     521     777     104     253
           CG_R:       -       -       -       -       -       -       -       -   1'825     747   1'908   1'190     985     315   2'703   2'098     268     425
          CG_RB:       -       -       -       -       -       -       -       -   7'487   2'869   8'828   3'240   3'396   2'038  11'670   7'917   1'171   2'157
         CG_RBP:       -       -       -       -       -       -       -       -   1'128     468   1'425     454     533     193   1'428     910      88     107
         Clique:       -       -       -       -       -       -       -       -       -      90       -     106     107      45       -       -      47      60
             IB:      50      50      50      50      50      50      50      50   2'315   1'162   1'488   1'659   1'690     638   1'049   1'740     388     689
       MIR_1_FF:      17      17      18       3       -       1       -       -     989     800     843     996   1'030     407     853     656     403     584
        MIR_1_K:       1       1       3       -       -       1       -       -     210     302     153     363     361     100     115     159      69     198
       MIR_1_KL:       -       -       -       -       -       -       -       -       3       -      10       3       4       -      12       -       -       -
        MIR_1_R:       5       3       3       1       -       1       -       -     249     139     202     230     223      50     284     209      78      93
       MIR_1_RB:      10      10      11       2       -       -       -       -   1'319   1'799   1'255   1'981   2'083     799   1'554   1'058   1'073   1'316
      MIR_1_RBP:       -       -       1       1       -       -       -       -      62     288      55     250     332     148      57      29      82      90
      MIR_1_RLT:       -       -       -       -       -       -       -       -       -      10       -      13      11       6       -       -       9       1
       MIR_2_FF:       3       2       2       1       -       -       -       -     452     488     369     650     657     209     357     317     243     362
        MIR_2_K:       2       1       1       -       -       -       -       -      94     184      91     196     221      63      81      84      63     111
       MIR_2_KL:       -       -       -       -       -       -       -       -       8       5       4       7       3       1      20       5       1       3
        MIR_2_R:       -       -       -       -       -       -       -       -     197     326     220     382     364     110     386     179     351     259
       MIR_2_RB:       2       2       1       -       -       -       -       -     791   1'046     793   1'202   1'332     435     859     648     676     802
      MIR_2_RBP:       -       -       -       -       -       -       -       -      80     259      76     194     270      86      69      43      59      59
       MIR_3_FF:       1       -       1       -       -       1       -       -     217     378     186     446     493     134     204     212     179     256
        MIR_3_K:       1       -       -       -       -       1       -       -      85     151      57     182     162      54      69      81      59     107
       MIR_3_KL:       -       -       -       -       -       -       -       -       4       4       9       8      13       3      10       1       3       3
        MIR_3_R:       1       -       -       -       -       1       -       -     147     319     127     286     288     105     205     152     241     210
       MIR_3_RB:       1       -       1       -       -       1       -       -     490     711     519     749     781     290     519     454     483     520
      MIR_3_RBP:       -       -       -       -       -       -       -       -      53     124      47     106     144      68      50      35      39      43
       MIR_4_FF:       -       -       -       -       -       -       -       -     132     220     113     248     276      79      98     115      81     115
        MIR_4_K:       -       -       -       -       -       -       -       -      50     107      32     128     125      28      24      40      28      51
       MIR_4_KL:       -       -       -       -       -       -       -       -       3       4       6       6       5       3       6       -       3       -
        MIR_4_R:       -       -       -       -       -       -       -       -     106     165     100     167     170      49      96      86      95     115
       MIR_4_RB:       -       -       -       -       -       -       -       -     318     378     353     408     422     114     335     286     242     210
      MIR_4_RBP:       -       -       -       -       -       -       -       -      42      67      40      83      93      26      40      27      25      17
       MIR_5_FF:       -       -       -       -       -       -       -       -      85     148      63     176     197      48      68      85      49      62
        MIR_5_K:       -       -       -       -       -       -       -       -      28      69      21     112      91      21      27      23      17      28
       MIR_5_KL:       -       -       -       -       -       -       -       -       1       1       1       3       5       -       8       -       1       -
        MIR_5_R:       -       -       -       -       -       -       -       -      78      85      72     111      95      20      68      63      44      48
       MIR_5_RB:       -       1       -       -       -       -       -       -     200     210     176     263     255      93     185     144     126     129
      MIR_5_RBP:       -       -       -       -       -       -       -       -      23      30      29      63      69      19      20      13      10      19
       MIR_6_FF:       -       -       -       -       -       -       -       -      73      88      47     109     101      31      60      50      23      42
        MIR_6_K:       -       -       -       -       -       -       -       -      23      52      19      61      44      10      18      29       7      21
       MIR_6_KL:       -       -       -       -       -       -       -       -       -       -       -       -       1       -       2       -       -       -
        MIR_6_R:       -       -       -       -       -       -       -       -      68      49      45      73      46      11      52      36      21      29
       MIR_6_RB:       -       -       -       -       -       -       -       -     120     125     111     180     143      58     107      92      49      67
      MIR_6_RBP:       -       -       -       -       -       -       -       -      16      38      16      44      37       6      19      20       3       6
   ZERO_HALF_FF:       -       -       -       -       -       -       -       -     235     248     130     291     277     117     130     152      74     129
    ZERO_HALF_K:       -       -       -       -       -       -       -       -      72      97      39     114     131      27      40      52      18      34
    ZERO_HALF_R:       -       -       -       -       -       -       -       -     935   2'121   1'293   2'099   2'048     695   3'198     900   7'140   2'121
   ZERO_HALF_RB:       -       -       -       -       -       -       -       -     393     613     450     615     676     257     741     380     418     383
  ZERO_HALF_RBP:       -       -       -       -       -       -       -       -      72     142      90     127     195      47     120      58     175      35

LNS stats           Improv/Calls  Closed  Difficulty  TimeLimit
  'graph_arc_lns':        20/659     51%        0.98       0.12
  'graph_cst_lns':         7/628     51%        0.98       0.13
  'graph_dec_lns':        13/657     51%        0.99       0.12
  'graph_var_lns':        19/656     51%        0.99       0.13
      'rins/rens':        64/564     50%        0.86       0.10
    'rnd_cst_lns':        11/656     51%        0.99       0.13
    'rnd_var_lns':        19/658     51%        0.98       0.13

LS stats                   Batches  Restarts   LinMoves   GenMoves  CompoundMoves  WeightUpdates
       'fj_long_default':        1         1      3'895          0              0             94
       'fj_long_default':        1         1      9'725          0              0            275
   'fj_long_lin_default':        1         1          0      3'834            383              2
   'fj_long_lin_perturb':        1         1      6'194          0              0            699
    'fj_long_lin_random':        1         1      7'997          0              0          2'003
       'fj_long_perturb':        1         1          0      3'763            581              2
        'fj_long_random':        1         1      4'601          0              0            110
      'fj_short_default':        1         1          0      3'739            602              3
      'fj_short_default':        1         1      5'533          0              0            778
  'fj_short_lin_default':        1         1          0      3'627            480              2
  'fj_short_lin_default':        1         1          0      3'854            496              2
  'fj_short_lin_perturb':        1         1      4'105          0              0            108
   'fj_short_lin_random':        1         1          0      3'534            514              2
      'fj_short_perturb':        1         1      4'655          0              0            136
       'fj_short_random':        1         1          0      3'769            470              1
          'violation_ls':      655         0  1'875'827  2'297'033        104'425        524'215
          'violation_ls':      655         0  3'113'985  1'743'719        144'036        266'875
          'violation_ls':      656         0  2'043'545  2'278'296        126'996        350'434
          'violation_ls':      656         0  3'649'353  1'460'043        124'864        473'706
          'violation_ls':      656         0  3'866'411  1'212'672         63'540        555'311

Solutions (48)            Num     Rank
        'graph_dec_lns':    2   [9,45]
        'graph_var_lns':    2  [10,48]
                'no_lp':   11   [1,25]
  'quick_restart_no_lp':    8   [2,47]
        'rins_pump_lns':    2  [43,46]
          'rnd_var_lns':    1  [21,21]
         'violation_ls':   22   [4,42]

Objective bounds                     Num
                       'bool_core':    1
                  'initial_domain':    1
             'objective_lb_search':   19
       'objective_lb_search_no_lp':   96
  'objective_shaving_search_no_lp':    4

Solution repositories     Added  Queried  Ignored  Synchro
  'feasible solutions':   4'381   12'998        6    4'215
        'lp solutions':   1'149      307        0    1'020
                'pump':  13'719      352

Improving bounds shared            Num
                        'core':    112
                  'default_lp':     38
              'lb_tree_search':     29
                      'max_lp':    159
                       'no_lp':     26
         'objective_lb_search':     46
  'objective_lb_search_max_lp':     42
                     'probing':    510
              'probing_max_lp':    305
                'pseudo_costs':    438
               'quick_restart':    138
         'quick_restart_no_lp':  1'970
               'reduced_costs':    184

Clauses shared                   Num
                  'default_lp':   10
             'fs_random_no_lp':    1
              'lb_tree_search':    6
                      'max_lp':   12
                       'no_lp':   18
         'objective_lb_search':    8
  'objective_lb_search_max_lp':    9
                'pseudo_costs':  167
               'quick_restart':   33
         'quick_restart_no_lp':   36
               'reduced_costs':   17

CpSolverResponse summary:
status: OPTIMAL
objective: 827
best_bound: 827
integers: 244
booleans: 75
conflicts: 0
branches: 150
propagations: 24
integer_propagations: 3474
restarts: 150
lp_iterations: 98
walltime: 171.059
usertime: 171.059
deterministic_time: 995.408
gap_integral: 2989.41
solution_fingerprint: 0x9ce1d5d1959f79a8


--- Simulation Gantt  partir du modle mathmatique ---
{'big':1, 'due_date':122, 'pos_time':5, 'status':0, 'blocked':0, 'operations':["{'type':1, 'processing_time':55}"]}
{'big':0, 'due_date':159, 'pos_time':5, 'status':0, 'blocked':0, 'operations':["{'type':1, 'processing_time':53}", "{'type':0, 'processing_time':25}"]}
{'big':1, 'due_date':173, 'pos_time':5, 'status':0, 'blocked':0, 'operations':["{'type':0, 'processing_time':30}", "{'type':1, 'processing_time':29}"]}
{'big':0, 'due_date':125, 'pos_time':5, 'status':0, 'blocked':0, 'operations':["{'type':0, 'processing_time':19}"]}
{'big':0, 'due_date':114, 'pos_time':5, 'status':0, 'blocked':0, 'operations':["{'type':0, 'processing_time':48}", "{'type':1, 'processing_time':53}"]}
{'big':0, 'due_date':188, 'pos_time':5, 'status':0, 'blocked':0, 'operations':["{'type':1, 'processing_time':34}", "{'type':0, 'processing_time':25}"]}
{'big':0, 'due_date':74, 'pos_time':5, 'status':0, 'blocked':0, 'operations':["{'type':0, 'processing_time':37}"]}
