created virtual environment CPython3.12.4.final.0-64 in 331ms
  creator CPython3Posix(dest=/localscratch/aneumann.46806187.0/env, clear=False, no_vcs_ignore=False, global=False)
  seeder FromAppData(download=False, pip=bundle, via=copy, app_data_dir=/home/aneumann/.local/share/virtualenv)
    added seed packages: pip==24.2+computecanada
  activators BashActivator,CShellActivator,FishActivator,NushellActivator,PowerShellActivator,PythonActivator
Looking in links: /cvmfs/soft.computecanada.ca/custom/python/wheelhouse/gentoo2023/x86-64-v3, /cvmfs/soft.computecanada.ca/custom/python/wheelhouse/gentoo2023/generic, /cvmfs/soft.computecanada.ca/custom/python/wheelhouse/generic
Requirement already satisfied: pip in /localscratch/aneumann.46806187.0/env/lib/python3.12/site-packages (24.2+computecanada)
Processing /cvmfs/soft.computecanada.ca/custom/python/wheelhouse/generic/pip-25.0+computecanada-py3-none-any.whl
Installing collected packages: pip
  Attempting uninstall: pip
    Found existing installation: pip 24.2+computecanada
    Uninstalling pip-24.2+computecanada:
      Successfully uninstalled pip-24.2+computecanada
Successfully installed pip-25.0+computecanada
Looking in links: /cvmfs/soft.computecanada.ca/custom/python/wheelhouse/gentoo2023/x86-64-v3, /cvmfs/soft.computecanada.ca/custom/python/wheelhouse/gentoo2023/generic, /cvmfs/soft.computecanada.ca/custom/python/wheelhouse/generic
ERROR: protobuf-5.28.3-cp38-abi3-manylinux2014_x86_64.whl is not a supported wheel on this platform.
Looking in links: /cvmfs/soft.computecanada.ca/custom/python/wheelhouse/gentoo2023/x86-64-v3, /cvmfs/soft.computecanada.ca/custom/python/wheelhouse/gentoo2023/generic, /cvmfs/soft.computecanada.ca/custom/python/wheelhouse/generic
Processing /home/aneumann/projects/def-adhaj/aneumann/GNRS/wheels/immutabledict-4.2.0-py3-none-any.whl
Installing collected packages: immutabledict
Successfully installed immutabledict-4.2.0
Looking in links: /cvmfs/soft.computecanada.ca/custom/python/wheelhouse/gentoo2023/x86-64-v3, /cvmfs/soft.computecanada.ca/custom/python/wheelhouse/gentoo2023/generic, /cvmfs/soft.computecanada.ca/custom/python/wheelhouse/generic
Processing /cvmfs/soft.computecanada.ca/custom/python/wheelhouse/generic/ortools-9.10.4067+computecanada-cp312-cp312-linux_x86_64.whl (from -r /home/aneumann/projects/def-adhaj/aneumann/GNRS/requirements/or.txt (line 1))
Processing /cvmfs/soft.computecanada.ca/custom/python/wheelhouse/gentoo2023/x86-64-v3/matplotlib-3.10.0+computecanada-cp312-cp312-linux_x86_64.whl (from -r /home/aneumann/projects/def-adhaj/aneumann/GNRS/requirements/or.txt (line 2))
Processing /cvmfs/soft.computecanada.ca/custom/python/wheelhouse/gentoo2023/x86-64-v3/pandas-2.2.3+computecanada-cp312-cp312-linux_x86_64.whl (from -r /home/aneumann/projects/def-adhaj/aneumann/GNRS/requirements/or.txt (line 3))
Processing /cvmfs/soft.computecanada.ca/custom/python/wheelhouse/generic/absl_py-2.3.0+computecanada-py3-none-any.whl (from ortools<9.11,>=9.10->-r /home/aneumann/projects/def-adhaj/aneumann/GNRS/requirements/or.txt (line 1))
Processing /cvmfs/soft.computecanada.ca/custom/python/wheelhouse/gentoo2023/generic/numpy-2.2.2+computecanada-cp312-cp312-linux_x86_64.whl (from ortools<9.11,>=9.10->-r /home/aneumann/projects/def-adhaj/aneumann/GNRS/requirements/or.txt (line 1))
Processing /cvmfs/soft.computecanada.ca/custom/python/wheelhouse/gentoo2023/x86-64-v3/protobuf-6.31.1+computecanada-cp312-cp312-linux_x86_64.whl (from ortools<9.11,>=9.10->-r /home/aneumann/projects/def-adhaj/aneumann/GNRS/requirements/or.txt (line 1))
Requirement already satisfied: immutabledict>=3.0.0 in /localscratch/aneumann.46806187.0/env/lib/python3.12/site-packages (from ortools<9.11,>=9.10->-r /home/aneumann/projects/def-adhaj/aneumann/GNRS/requirements/or.txt (line 1)) (4.2.0)
Processing /cvmfs/soft.computecanada.ca/custom/python/wheelhouse/gentoo2023/generic/contourpy-1.3.1+computecanada-cp312-cp312-linux_x86_64.whl (from matplotlib->-r /home/aneumann/projects/def-adhaj/aneumann/GNRS/requirements/or.txt (line 2))
Processing /cvmfs/soft.computecanada.ca/custom/python/wheelhouse/generic/cycler-0.12.1+computecanada-py3-none-any.whl (from matplotlib->-r /home/aneumann/projects/def-adhaj/aneumann/GNRS/requirements/or.txt (line 2))
Processing /cvmfs/soft.computecanada.ca/custom/python/wheelhouse/generic/fonttools-4.59.0+computecanada-cp312-cp312-linux_x86_64.whl (from matplotlib->-r /home/aneumann/projects/def-adhaj/aneumann/GNRS/requirements/or.txt (line 2))
Processing /cvmfs/soft.computecanada.ca/custom/python/wheelhouse/gentoo2023/x86-64-v3/kiwisolver-1.4.8+computecanada-cp312-cp312-linux_x86_64.whl (from matplotlib->-r /home/aneumann/projects/def-adhaj/aneumann/GNRS/requirements/or.txt (line 2))
Processing /cvmfs/soft.computecanada.ca/custom/python/wheelhouse/generic/packaging-25.0+computecanada-py3-none-any.whl (from matplotlib->-r /home/aneumann/projects/def-adhaj/aneumann/GNRS/requirements/or.txt (line 2))
Processing /cvmfs/soft.computecanada.ca/custom/python/wheelhouse/gentoo2023/x86-64-v3/pillow-11.1.0+computecanada-cp312-cp312-linux_x86_64.whl (from matplotlib->-r /home/aneumann/projects/def-adhaj/aneumann/GNRS/requirements/or.txt (line 2))
Processing /cvmfs/soft.computecanada.ca/custom/python/wheelhouse/generic/pyparsing-3.2.3+computecanada-py3-none-any.whl (from matplotlib->-r /home/aneumann/projects/def-adhaj/aneumann/GNRS/requirements/or.txt (line 2))
Processing /cvmfs/soft.computecanada.ca/custom/python/wheelhouse/generic/python_dateutil-2.9.0.post0+computecanada-py2.py3-none-any.whl (from matplotlib->-r /home/aneumann/projects/def-adhaj/aneumann/GNRS/requirements/or.txt (line 2))
Processing /cvmfs/soft.computecanada.ca/custom/python/wheelhouse/generic/pytz-2025.2+computecanada-py2.py3-none-any.whl (from pandas->-r /home/aneumann/projects/def-adhaj/aneumann/GNRS/requirements/or.txt (line 3))
Processing /cvmfs/soft.computecanada.ca/custom/python/wheelhouse/generic/tzdata-2025.2+computecanada-py2.py3-none-any.whl (from pandas->-r /home/aneumann/projects/def-adhaj/aneumann/GNRS/requirements/or.txt (line 3))
Processing /cvmfs/soft.computecanada.ca/custom/python/wheelhouse/generic/six-1.17.0+computecanada-py2.py3-none-any.whl (from python-dateutil>=2.7->matplotlib->-r /home/aneumann/projects/def-adhaj/aneumann/GNRS/requirements/or.txt (line 2))
Installing collected packages: pytz, tzdata, six, pyparsing, protobuf, pillow, packaging, numpy, kiwisolver, fonttools, cycler, absl-py, python-dateutil, contourpy, pandas, matplotlib, ortools
Successfully installed absl-py-2.3.0+computecanada contourpy-1.3.1+computecanada cycler-0.12.1+computecanada fonttools-4.59.0+computecanada kiwisolver-1.4.8+computecanada matplotlib-3.10.0+computecanada numpy-2.2.2+computecanada ortools-9.10.4067+computecanada packaging-25.0+computecanada pandas-2.2.3+computecanada pillow-11.1.0+computecanada protobuf-6.31.1+computecanada pyparsing-3.2.3+computecanada python-dateutil-2.9.0.post0+computecanada pytz-2025.2+computecanada six-1.17.0+computecanada tzdata-2025.2+computecanada

Starting CP-SAT solver v9.10.4067
Parameters: max_time_in_seconds: 86400 max_memory_in_mb: 185000 log_search_progress: true enumerate_all_solutions: false num_search_workers: 32 absolute_gap_limit: 0 relative_gap_limit: 0

Initial optimization model '': (model_fingerprint: 0x2804093cee9dc3f4)
#Variables: 445 (#ints: 10 in objective)
  - 339 Booleans in [0,1]
  - 106 in [0,776]
#kLinear1: 54
#kLinear2: 684
#kLinear3: 255
#kLinearN: 7'917 (#terms: 150'939)

Starting presolve at 0.00s
  6.54e-03s  0.00e+00d  [DetectDominanceRelations] 
  1.19e-01s  0.00e+00d  [PresolveToFixPoint] #num_loops=8 #num_dual_strengthening=3 
  5.37e-05s  0.00e+00d  [ExtractEncodingFromLinear] #potential_supersets=3 
[Symmetry] Graph for symmetry has 8'903 nodes and 123'220 arcs.
[Symmetry] Symmetry computation done. time: 0.00487518 dtime: 0.00855424
[Symmetry] #generators: 1, average support size: 24
[Symmetry] The model contains 360 duplicate constraints !
[Symmetry] 12 orbits with sizes: 2,2,2,2,2,2,2,2,2,2,...
[Symmetry] Num fixable by intersecting at_most_one with orbits: 1 largest_orbit: 2
  3.40e-02s  7.44e-03d  [Probe] #probed=512 #new_bounds=13 #equiv=1 
  6.90e-05s  0.00e+00d  [MaxClique] Merged 3(6 literals) into 2(4 literals) at_most_ones. 
  6.35e-03s  0.00e+00d  [DetectDominanceRelations] 
  5.56e-02s  0.00e+00d  [PresolveToFixPoint] #num_loops=5 #num_dual_strengthening=3 
  2.66e-02s  0.00e+00d  [ProcessAtMostOneAndLinear] 
  8.39e-03s  0.00e+00d  [DetectDuplicateConstraints] #duplicates=458 #without_enforcements=65 
  9.31e-03s  7.86e-04d  [DetectDominatedLinearConstraints] #relevant_constraints=7'151 #num_inclusions=4'410 
  8.30e-04s  0.00e+00d  [DetectDifferentVariables] #different=30 #cliques=1 #size=7 
  1.94e-03s  1.96e-04d  [ProcessSetPPC] #relevant_constraints=6'703 
  3.81e-05s  0.00e+00d  [FindAlmostIdenticalLinearConstraints] 
  2.16e-04s  3.28e-04d  [FindBigAtMostOneAndLinearOverlap] 
  2.09e-02s  1.38e-02d  [FindBigVerticalLinearOverlap] #blocks=87 #saved_nz=18'970 
  9.83e-04s  4.60e-04d  [FindBigHorizontalLinearOverlap] #linears=6'596 
  2.91e-05s  0.00e+00d  [MergeClauses] 
  8.10e-03s  0.00e+00d  [DetectDominanceRelations] 
  6.52e-02s  0.00e+00d  [PresolveToFixPoint] #num_loops=2 #num_dual_strengthening=1 
  6.93e-03s  0.00e+00d  [DetectDominanceRelations] 
  3.94e-02s  0.00e+00d  [PresolveToFixPoint] #num_loops=1 #num_dual_strengthening=1 
[Symmetry] Graph for symmetry has 8'707 nodes and 102'747 arcs.
[Symmetry] Symmetry computation done. time: 0.00245122 dtime: 0.00527063
  3.19e-02s  6.45e-03d  [Probe] #probed=512 #new_bounds=56 
  2.31e-05s  0.00e+00d  [MaxClique] 
  6.91e-03s  0.00e+00d  [DetectDominanceRelations] 
  5.66e-02s  0.00e+00d  [PresolveToFixPoint] #num_loops=2 #num_dual_strengthening=1 
  2.51e-02s  0.00e+00d  [ProcessAtMostOneAndLinear] 
  7.55e-03s  0.00e+00d  [DetectDuplicateConstraints] #without_enforcements=65 
  6.24e-03s  4.87e-04d  [DetectDominatedLinearConstraints] #relevant_constraints=7'075 #num_inclusions=1'096 
  6.94e-04s  0.00e+00d  [DetectDifferentVariables] 
  1.85e-03s  1.57e-04d  [ProcessSetPPC] #relevant_constraints=6'581 
  5.40e-05s  4.20e-07d  [FindAlmostIdenticalLinearConstraints] #num_tested_pairs=28 
  1.09e-04s  1.34e-04d  [FindBigAtMostOneAndLinearOverlap] 
  1.84e-02s  1.09e-02d  [FindBigVerticalLinearOverlap] #blocks=167 #saved_nz=18'349 
  9.20e-04s  3.60e-04d  [FindBigHorizontalLinearOverlap] #linears=6'296 
  2.58e-05s  0.00e+00d  [MergeClauses] 
  5.69e-03s  0.00e+00d  [DetectDominanceRelations] 
  7.69e-02s  0.00e+00d  [PresolveToFixPoint] #num_loops=2 #num_dual_strengthening=1 
  5.66e-03s  0.00e+00d  [DetectDominanceRelations] 
  4.29e-02s  0.00e+00d  [PresolveToFixPoint] #num_loops=1 #num_dual_strengthening=1 
[Symmetry] Graph for symmetry has 9'205 nodes and 84'562 arcs.
[Symmetry] Symmetry computation done. time: 0.00208116 dtime: 0.00444926
  3.08e-02s  5.77e-03d  [Probe] #probed=512 #new_bounds=124 
  2.38e-05s  0.00e+00d  [MaxClique] 
  5.74e-03s  0.00e+00d  [DetectDominanceRelations] 
  6.42e-02s  0.00e+00d  [PresolveToFixPoint] #num_loops=2 #num_dual_strengthening=1 
  2.28e-02s  0.00e+00d  [ProcessAtMostOneAndLinear] 
  7.20e-03s  0.00e+00d  [DetectDuplicateConstraints] #without_enforcements=65 
  4.32e-03s  3.29e-04d  [DetectDominatedLinearConstraints] #relevant_constraints=7'129 #num_inclusions=35 
  6.92e-04s  0.00e+00d  [DetectDifferentVariables] 
  1.58e-03s  1.18e-04d  [ProcessSetPPC] #relevant_constraints=6'268 
  8.37e-05s  4.91e-06d  [FindAlmostIdenticalLinearConstraints] #num_tested_pairs=291 
  1.01e-04s  1.06e-04d  [FindBigAtMostOneAndLinearOverlap] 
  1.21e-02s  7.30e-03d  [FindBigVerticalLinearOverlap] #blocks=170 #saved_nz=12'967 
  8.04e-04s  2.81e-04d  [FindBigHorizontalLinearOverlap] #linears=5'675 
  2.74e-05s  0.00e+00d  [MergeClauses] 
  4.87e-03s  0.00e+00d  [DetectDominanceRelations] 
  7.06e-02s  0.00e+00d  [PresolveToFixPoint] #num_loops=3 #num_dual_strengthening=1 
  2.28e-04s  0.00e+00d  [ExpandObjective] #entries=1'958 #tight_variables=690 #tight_constraints=383 

Presolve summary:
  - 123 affine relations were detected.
  - rule 'TODO dual: only one blocking constraint?' was applied 851 times.
  - rule 'TODO dual: only one blocking enforced constraint?' was applied 156 times.
  - rule 'TODO dual: only one unspecified blocking constraint?' was applied 39 times.
  - rule 'TODO duplicate: identical constraint with different enforcements' was applied 195 times.
  - rule 'affine: new relation' was applied 123 times.
  - rule 'at_most_one: removed literals' was applied 2 times.
  - rule 'at_most_one: size one' was applied 2 times.
  - rule 'at_most_one: transformed into max clique.' was applied 1 time.
  - rule 'deductions: 449 stored' was applied 1 time.
  - rule 'dual: fix variable' was applied 27 times.
  - rule 'dual: reduced domain' was applied 60 times.
  - rule 'duplicate: merged rhs of linear constraint' was applied 92 times.
  - rule 'duplicate: removed constraint' was applied 458 times.
  - rule 'enforcement: false literal' was applied 12 times.
  - rule 'exactly_one: x and not(x)' was applied 1 time.
  - rule 'incompatible linear: add implication' was applied 63 times.
  - rule 'linear matrix: common vertical rectangle' was applied 424 times.
  - rule 'linear: always true' was applied 834 times.
  - rule 'linear: doubleton free' was applied 15 times.
  - rule 'linear: empty' was applied 42 times.
  - rule 'linear: extracted enforcement literal' was applied 8'534 times.
  - rule 'linear: fixed or dup variables' was applied 8'141 times.
  - rule 'linear: positive equal one' was applied 3 times.
  - rule 'linear: reduced variable domains' was applied 541 times.
  - rule 'linear: remapped using affine relations' was applied 8'281 times.
  - rule 'linear: simplified rhs' was applied 24'547 times.
  - rule 'linear: tightened into equality' was applied 9 times.
  - rule 'linear: variable substitution 1' was applied 15 times.
  - rule 'linear: variable substitution 2' was applied 5 times.
  - rule 'linear: variable substitution 3' was applied 13 times.
  - rule 'no_overlap: inferred from x != y constraints' was applied 1 time.
  - rule 'presolve: 113 unused variables removed.' was applied 1 time.
  - rule 'presolve: iteration' was applied 3 times.
  - rule 'probing: reduced enforced constraint to implication.' was applied 3 times.
  - rule 'symmetry: fixed to false in general orbit' was applied 1 time.

Presolved optimization model '': (model_fingerprint: 0x5e126181d7c0515f)
#Variables: 600 (#ints: 10 in objective)
  - 127 Booleans in [0,1]
  - 396 different domains in [-9172,10715] with a largest complexity of 16.
#kExactlyOne: 2 (#literals: 6)
#kInterval: 7
#kLinear2: 637 (#enforced: 584 #multi: 347)
#kLinear3: 1'140 (#enforced: 775)
#kLinearN: 6'050 (#enforced: 5'838) (#terms: 57'773)
#kNoOverlap: 1 (#intervals: 7)

Preloading model.
#Bound   0.92s best:inf   next:[196,6640] initial_domain
[Symmetry] Graph for symmetry has 9'418 nodes and 71'748 arcs.
[Symmetry] Symmetry computation done. time: 0.00182485 dtime: 0.00384722
#Model   0.93s var:600/600 constraints:7837/7837

Starting search at 0.94s with 32 workers.
17 full problem subsolvers: [core, default_lp, fixed, lb_tree_search, max_lp, no_lp, objective_lb_search, objective_lb_search_max_lp, objective_lb_search_no_lp, objective_shaving_search_max_lp, objective_shaving_search_no_lp, probing, probing_max_lp, pseudo_costs, quick_restart, quick_restart_no_lp, reduced_costs]
13 first solution subsolvers: [fj_long_default, fj_long_lin_default, fj_long_random, fj_short_default, fj_short_lin_default, fj_short_lin_random, fj_short_random, fs_random(2), fs_random_no_lp, fs_random_quick_restart(2), fs_random_quick_restart_no_lp]
13 incomplete subsolvers: [feasibility_pump, graph_arc_lns, graph_cst_lns, graph_dec_lns, graph_var_lns, rins/rens, rnd_cst_lns, rnd_var_lns, scheduling_intervals_lns, scheduling_precedences_lns, scheduling_time_window_lns, violation_ls(2)]
3 helper subsolvers: [neighborhood_helper, synchronization_agent, update_gap_integral]
#Bound   1.18s best:inf   next:[197,6640] objective_shaving_search_no_lp (vars=600 csts=7844)
#Bound   1.19s best:inf   next:[201,6640] quick_restart
#Bound   1.21s best:inf   next:[206,6640] objective_lb_search_no_lp
#Bound   1.25s best:inf   next:[252,6640] quick_restart
#Bound   1.34s best:inf   next:[255,6640] quick_restart
#Bound   1.43s best:inf   next:[277,6640] fs_random_quick_restart
#Bound   1.52s best:inf   next:[392,6640] objective_lb_search_no_lp
#Bound   1.58s best:inf   next:[463,6640] objective_lb_search_no_lp
#1       1.74s best:2916  next:[463,2915] quick_restart (fixed_bools=0/168)
#2       1.92s best:2889  next:[463,2888] violation_ls(batch:1 #solutions_imported:1 #lin_moves:5'111 #lin_evals:16'390 #weight_updates:329)
#3       1.93s best:2887  next:[463,2886] violation_ls(batch:2 #solutions_imported:2 #lin_moves:5'111 #lin_evals:16'413 #gen_moves:11 #gen_evals:1 #comp_moves:1 #backtracks:5 #weight_updates:329)
#4       2.02s best:2885  next:[463,2884] violation_ls(batch:2 #solutions_imported:2 #lin_moves:0 #lin_evals:18'482 #gen_moves:7'606 #gen_evals:1'402 #comp_moves:1'224 #backtracks:3'190 #weight_updates:90)
#5       2.16s best:2884  next:[463,2883] violation_ls(batch:3 #solutions_imported:3 #lin_moves:0 #lin_evals:21'252 #gen_moves:8'825 #gen_evals:1'664 #comp_moves:1'413 #backtracks:3'705 #weight_updates:113)
#6       2.20s best:2883  next:[463,2882] violation_ls(batch:3 #solutions_imported:3 #lin_moves:5'187 #lin_evals:16'774 #gen_moves:11 #gen_evals:1 #comp_moves:1 #backtracks:5 #weight_updates:362)
#7       2.36s best:2882  next:[463,2881] violation_ls(batch:4 #solutions_imported:4 #lin_moves:6'007 #lin_evals:19'839 #gen_moves:11 #gen_evals:1 #comp_moves:1 #backtracks:5 #weight_updates:509)
#8       2.59s best:2881  next:[463,2880] quick_restart_no_lp (fixed_bools=0/183)
#9       2.65s best:2880  next:[463,2879] quick_restart_no_lp (fixed_bools=0/187)
#10      2.66s best:2879  next:[463,2878] graph_dec_lns (d=0.81 s=83 t=0.10 p=1.00 stall=2 h=auto_l0) [presolve]
#11      2.69s best:2848  next:[463,2847] fixed (fixed_bools=0/231)
#12      2.86s best:2377  next:[463,2376] no_lp (fixed_bools=0/168)
#13      2.92s best:2371  next:[463,2370] no_lp (fixed_bools=0/195)
#14      2.94s best:2304  next:[463,2303] no_lp (fixed_bools=0/197)
#15      2.96s best:2273  next:[463,2272] no_lp (fixed_bools=0/201)
#16      3.00s best:2223  next:[463,2222] no_lp (fixed_bools=0/212)
#17      3.03s best:2199  next:[463,2198] no_lp (fixed_bools=0/220)
#18      3.07s best:2183  next:[463,2182] no_lp (fixed_bools=0/230)
#19      3.18s best:2167  next:[463,2166] no_lp (fixed_bools=0/244)
#20      3.23s best:2111  next:[463,2110] no_lp (fixed_bools=0/255)
#21      3.27s best:2067  next:[463,2066] no_lp (fixed_bools=0/256)
#22      3.33s best:2057  next:[463,2056] no_lp (fixed_bools=0/264)
#23      3.36s best:1942  next:[463,1941] no_lp (fixed_bools=0/270)
#Bound   3.56s best:1942  next:[471,1941] objective_lb_search_max_lp
#Bound   3.97s best:1942  next:[475,1941] objective_lb_search_max_lp
#Bound   4.00s best:1942  next:[499,1941] objective_lb_search
#24      4.08s best:1839  next:[499,1838] scheduling_intervals_lns (d=0.50 s=69 t=0.10 p=0.00 stall=0 h=auto_l0)
#25      4.19s best:1642  next:[499,1641] scheduling_precedences_lns (d=0.50 s=71 t=0.10 p=0.00 stall=0 h=auto_l0)
#Bound   4.37s best:1642  next:[714,1641] objective_lb_search_no_lp
#26      4.68s best:1614  next:[714,1613] quick_restart_no_lp (fixed_bools=0/545)
#27      4.82s best:1584  next:[714,1583] quick_restart_no_lp (fixed_bools=0/588)
#28      4.85s best:1572  next:[714,1571] quick_restart_no_lp (fixed_bools=0/590)
#Bound   5.06s best:1572  next:[718,1571] objective_lb_search_no_lp
#Bound   5.98s best:1572  next:[739,1571] objective_lb_search_no_lp
#29      6.18s best:1527  next:[739,1526] graph_var_lns (d=0.98 s=168 t=0.10 p=1.00 stall=5 h=auto_l0)
#Bound   7.16s best:1527  next:[745,1526] objective_lb_search
#Bound   8.61s best:1527  next:[746,1526] objective_lb_search
#Bound   9.05s best:1527  next:[748,1526] objective_lb_search
#Bound   9.47s best:1527  next:[753,1526] objective_lb_search_no_lp
#Bound  10.44s best:1527  next:[754,1526] objective_lb_search_no_lp
#Bound  12.09s best:1527  next:[755,1526] objective_lb_search_no_lp
#Bound  12.49s best:1527  next:[760,1526] objective_lb_search_no_lp
#Bound  12.93s best:1527  next:[762,1526] objective_lb_search_no_lp
#Bound  14.54s best:1527  next:[763,1526] objective_lb_search_no_lp
#Bound  14.76s best:1527  next:[764,1526] objective_lb_search_no_lp
#Bound  14.98s best:1527  next:[765,1526] objective_lb_search
#Bound  15.23s best:1527  next:[766,1526] objective_lb_search_no_lp
#Bound  16.54s best:1527  next:[768,1526] objective_lb_search_no_lp
#Bound  18.27s best:1527  next:[779,1526] objective_lb_search
#Bound  20.24s best:1527  next:[780,1526] objective_lb_search_no_lp
#Bound  22.53s best:1527  next:[786,1526] objective_lb_search
#Bound  22.69s best:1527  next:[787,1526] objective_lb_search_max_lp
#Bound  23.93s best:1527  next:[788,1526] objective_lb_search
#Bound  25.65s best:1527  next:[789,1526] objective_lb_search_no_lp
#Bound  27.17s best:1527  next:[790,1526] objective_lb_search_max_lp
#Bound  27.26s best:1527  next:[852,1526] objective_lb_search
#Bound  38.38s best:1527  next:[853,1526] objective_shaving_search_max_lp (vars=696 csts=7860)
#Bound  39.54s best:1527  next:[856,1526] objective_lb_search_max_lp
#Bound  44.78s best:1527  next:[857,1526] objective_lb_search
#Bound  55.41s best:1527  next:[859,1526] objective_lb_search
#Bound  58.26s best:1527  next:[870,1526] objective_lb_search
#Bound  64.37s best:1527  next:[872,1526] objective_lb_search
#Bound  72.65s best:1527  next:[873,1526] objective_lb_search_no_lp
#Bound  80.84s best:1527  next:[874,1526] objective_lb_search
#Bound  85.81s best:1527  next:[877,1526] objective_lb_search_no_lp
#Bound  86.24s best:1527  next:[881,1526] objective_lb_search
#Bound  96.62s best:1527  next:[890,1526] objective_lb_search
#Bound 100.98s best:1527  next:[892,1526] objective_lb_search
#Bound 106.47s best:1527  next:[894,1526] objective_lb_search_no_lp
#Bound 108.81s best:1527  next:[901,1526] objective_lb_search
#Bound 115.65s best:1527  next:[902,1526] objective_lb_search_max_lp
#Bound 123.13s best:1527  next:[907,1526] objective_lb_search
#Bound 135.11s best:1527  next:[909,1526] objective_lb_search
#Bound 137.66s best:1527  next:[912,1526] objective_lb_search
#Bound 148.65s best:1527  next:[913,1526] objective_lb_search_no_lp
#Bound 152.13s best:1527  next:[915,1526] objective_lb_search_no_lp
#Bound 159.43s best:1527  next:[916,1526] objective_lb_search_no_lp
#Bound 160.51s best:1527  next:[917,1526] objective_lb_search_no_lp
#Bound 162.49s best:1527  next:[919,1526] objective_lb_search_no_lp
#Bound 167.18s best:1527  next:[921,1526] objective_lb_search_no_lp
#Bound 171.27s best:1527  next:[923,1526] objective_lb_search_no_lp
#Bound 175.02s best:1527  next:[925,1526] objective_lb_search_no_lp
#Bound 179.88s best:1527  next:[930,1526] objective_lb_search
#Bound 191.16s best:1527  next:[934,1526] objective_lb_search
#Bound 195.42s best:1527  next:[936,1526] objective_lb_search
#Bound 199.17s best:1527  next:[938,1526] objective_lb_search
#Bound 202.51s best:1527  next:[943,1526] objective_lb_search
#Bound 208.34s best:1527  next:[944,1526] lb_tree_search (nodes=2287/2287 rc=112 decisions=96633 @root=50 restarts=12) 
#Bound 210.72s best:1527  next:[945,1526] lb_tree_search (nodes=2304/2304 rc=113 decisions=96859 @root=51 restarts=12) 
#Bound 213.09s best:1527  next:[947,1526] objective_lb_search
#Bound 215.26s best:1527  next:[948,1526] objective_lb_search
#Bound 217.93s best:1527  next:[949,1526] objective_lb_search
#Bound 220.44s best:1527  next:[950,1526] objective_lb_search
#Bound 226.81s best:1527  next:[951,1526] lb_tree_search (nodes=2405/2405 rc=114 decisions=98196 @root=57 restarts=12) 
#Bound 229.77s best:1527  next:[952,1526] lb_tree_search (nodes=2428/2428 rc=114 decisions=98559 @root=58 restarts=12) 
#Bound 231.82s best:1527  next:[953,1526] objective_lb_search
#Bound 236.31s best:1527  next:[954,1526] lb_tree_search (nodes=2452/2452 rc=114 decisions=99081 @root=61 restarts=12) 
#Bound 237.68s best:1527  next:[955,1526] objective_lb_search
#Bound 243.77s best:1527  next:[956,1526] lb_tree_search (nodes=2492/2492 rc=114 decisions=99680 @root=64 restarts=12) 
#Bound 247.01s best:1527  next:[957,1526] lb_tree_search (nodes=2528/2528 rc=114 decisions=100152 @root=65 restarts=12) 
#Bound 249.92s best:1527  next:[958,1526] lb_tree_search (nodes=2540/2540 rc=114 decisions=100470 @root=66 restarts=12) 
#Bound 253.72s best:1527  next:[959,1526] lb_tree_search (nodes=2565/2565 rc=114 decisions=100858 @root=67 restarts=12) 
#Bound 256.06s best:1527  next:[960,1526] lb_tree_search (nodes=2578/2578 rc=115 decisions=101133 @root=68 restarts=12) 
#Bound 259.13s best:1527  next:[961,1526] lb_tree_search (nodes=2602/2602 rc=116 decisions=101498 @root=69 restarts=12) 
#Bound 262.16s best:1527  next:[962,1526] lb_tree_search (nodes=2618/2618 rc=116 decisions=101802 @root=70 restarts=12) 
#Bound 265.12s best:1527  next:[963,1526] lb_tree_search (nodes=2644/2644 rc=118 decisions=102185 @root=71 restarts=12) 
#Bound 267.78s best:1527  next:[964,1526] lb_tree_search (nodes=2668/2668 rc=118 decisions=102545 @root=72 restarts=12) 
#Bound 271.44s best:1527  next:[965,1526] lb_tree_search (nodes=2689/2689 rc=119 decisions=102863 @root=73 restarts=12) 
#Bound 274.27s best:1527  next:[966,1526] lb_tree_search (nodes=2710/2710 rc=119 decisions=103216 @root=74 restarts=12) 
#Bound 277.48s best:1527  next:[967,1526] lb_tree_search (nodes=2740/2740 rc=120 decisions=103597 @root=75 restarts=12) 
#Bound 279.99s best:1527  next:[968,1526] lb_tree_search (nodes=2758/2758 rc=120 decisions=103896 @root=76 restarts=12) 
#Bound 282.88s best:1527  next:[969,1526] lb_tree_search (nodes=2781/2781 rc=121 decisions=104218 @root=77 restarts=12) 
#Bound 285.58s best:1527  next:[970,1526] lb_tree_search (nodes=2805/2805 rc=121 decisions=104547 @root=78 restarts=12) 
#Bound 288.20s best:1527  next:[971,1526] lb_tree_search (nodes=2825/2825 rc=121 decisions=104879 @root=79 restarts=12) 
#Bound 290.70s best:1527  next:[972,1526] lb_tree_search (nodes=2851/2851 rc=121 decisions=105233 @root=80 restarts=12) 
#Bound 297.55s best:1527  next:[973,1526] lb_tree_search (nodes=2868/2868 rc=121 decisions=105654 @root=83 restarts=12) 
#Bound 300.52s best:1527  next:[974,1526] lb_tree_search (nodes=2892/2892 rc=121 decisions=106050 @root=84 restarts=12) 
#Bound 304.07s best:1527  next:[975,1526] lb_tree_search (nodes=2923/2923 rc=121 decisions=106528 @root=85 restarts=12) 
#Bound 306.54s best:1527  next:[976,1526] lb_tree_search (nodes=2942/2942 rc=121 decisions=106834 @root=86 restarts=12) 
#Bound 313.28s best:1527  next:[977,1526] lb_tree_search (nodes=2972/2972 rc=122 decisions=107303 @root=89 restarts=12) 
#Bound 317.53s best:1527  next:[978,1526] lb_tree_search (nodes=2983/2983 rc=122 decisions=107616 @root=91 restarts=12) 
#Bound 327.12s best:1527  next:[979,1526] lb_tree_search (nodes=3008/3008 rc=123 decisions=107999 @root=96 restarts=12) 
#Bound 329.78s best:1527  next:[980,1526] lb_tree_search (nodes=3019/3019 rc=124 decisions=108297 @root=97 restarts=12) 
#30    332.81s best:1520  next:[980,1519] pseudo_costs (fixed_bools=0/1142)
#Bound 333.05s best:1520  next:[981,1519] lb_tree_search (nodes=3037/3037 rc=124 decisions=108709 @root=98 restarts=12) 
#Bound 336.16s best:1520  next:[982,1519] lb_tree_search (nodes=3063/3063 rc=125 decisions=109172 @root=99 restarts=12) 
#Bound 342.59s best:1520  next:[983,1519] lb_tree_search (nodes=3086/3086 rc=125 decisions=109643 @root=102 restarts=12) 
#Bound 345.68s best:1520  next:[984,1519] lb_tree_search (nodes=3114/3114 rc=125 decisions=110106 @root=103 restarts=12) 
#Bound 350.02s best:1520  next:[985,1519] lb_tree_search (nodes=3131/3131 rc=125 decisions=110461 @root=105 restarts=12) 
#Bound 353.25s best:1520  next:[986,1519] lb_tree_search (nodes=3152/3152 rc=125 decisions=110908 @root=106 restarts=12) 
#Bound 356.43s best:1520  next:[987,1519] lb_tree_search (nodes=3168/3168 rc=125 decisions=111320 @root=107 restarts=12) 
#Bound 361.35s best:1520  next:[988,1519] lb_tree_search (nodes=3182/3182 rc=125 decisions=111705 @root=109 restarts=12) 
#Bound 364.44s best:1520  next:[989,1519] lb_tree_search (nodes=3199/3199 rc=126 decisions=112036 @root=110 restarts=12) 
#Bound 367.66s best:1520  next:[990,1519] lb_tree_search (nodes=3207/3207 rc=126 decisions=112401 @root=111 restarts=12) 
#Bound 370.82s best:1520  next:[991,1519] lb_tree_search (nodes=3232/3232 rc=126 decisions=112799 @root=112 restarts=12) 
#Bound 374.15s best:1520  next:[992,1519] lb_tree_search (nodes=3262/3262 rc=126 decisions=113274 @root=113 restarts=12) 
#Bound 377.68s best:1520  next:[993,1519] lb_tree_search (nodes=3287/3287 rc=127 decisions=113705 @root=114 restarts=12) 
#Bound 381.01s best:1520  next:[994,1519] lb_tree_search (nodes=3305/3305 rc=127 decisions=114109 @root=115 restarts=12) 
#Bound 384.89s best:1520  next:[995,1519] lb_tree_search (nodes=3341/3341 rc=127 decisions=114622 @root=116 restarts=12) 
#Bound 388.70s best:1520  next:[996,1519] lb_tree_search (nodes=3364/3364 rc=128 decisions=115069 @root=117 restarts=12) 
#Bound 392.67s best:1520  next:[997,1519] lb_tree_search (nodes=3409/3409 rc=128 decisions=115650 @root=118 restarts=12) 
#Bound 396.38s best:1520  next:[998,1519] lb_tree_search (nodes=3443/3443 rc=129 decisions=116146 @root=119 restarts=12) 
#Bound 400.34s best:1520  next:[999,1519] lb_tree_search (nodes=3475/3475 rc=129 decisions=116680 @root=120 restarts=12) 
#Bound 405.76s best:1520  next:[1000,1519] lb_tree_search (nodes=3506/3506 rc=129 decisions=117290 @root=122 restarts=12) 
#Bound 412.03s best:1520  next:[1001,1519] lb_tree_search (nodes=3550/3550 rc=130 decisions=117914 @root=124 restarts=12) 
#Bound 415.95s best:1520  next:[1002,1519] lb_tree_search (nodes=3614/3614 rc=131 decisions=118518 @root=125 restarts=12) 
#Bound 419.83s best:1520  next:[1003,1519] lb_tree_search (nodes=3650/3650 rc=132 decisions=119080 @root=126 restarts=12) 
#Bound 425.27s best:1520  next:[1004,1519] lb_tree_search (nodes=3594/3694 rc=132 decisions=119643 @root=128 restarts=12) 
#Bound 433.98s best:1520  next:[1005,1519] lb_tree_search (nodes=3170/3724 rc=133 decisions=120156 @root=132 restarts=12) 
#Bound 437.93s best:1520  next:[1006,1519] lb_tree_search (nodes=3075/3785 rc=133 decisions=120772 @root=133 restarts=12) 
#Bound 441.21s best:1520  next:[1007,1519] lb_tree_search (nodes=3102/3821 rc=133 decisions=121245 @root=134 restarts=12) 
#Bound 444.38s best:1520  next:[1008,1519] lb_tree_search (nodes=3130/3849 rc=133 decisions=121651 @root=135 restarts=12) 
#Bound 448.35s best:1520  next:[1009,1519] lb_tree_search (nodes=3171/3891 rc=133 decisions=122172 @root=136 restarts=12) 
#Bound 454.83s best:1520  next:[1010,1519] lb_tree_search (nodes=3184/3928 rc=133 decisions=122737 @root=138 restarts=12) 
#Bound 458.06s best:1520  next:[1011,1519] lb_tree_search (nodes=3204/3956 rc=133 decisions=123219 @root=139 restarts=12) 
#Bound 461.80s best:1520  next:[1012,1519] lb_tree_search (nodes=3232/3984 rc=133 decisions=123722 @root=140 restarts=12) 
#Bound 465.38s best:1520  next:[1013,1519] lb_tree_search (nodes=3245/4010 rc=133 decisions=124201 @root=141 restarts=12) 
#Bound 468.93s best:1520  next:[1014,1519] lb_tree_search (nodes=3268/4033 rc=133 decisions=124646 @root=142 restarts=12) 
#Bound 472.58s best:1520  next:[1015,1519] lb_tree_search (nodes=3302/4073 rc=133 decisions=125197 @root=143 restarts=12) 
#Bound 478.11s best:1520  next:[1016,1519] lb_tree_search (nodes=3329/4101 rc=134 decisions=125697 @root=145 restarts=12) 
#Bound 482.46s best:1520  next:[1017,1519] lb_tree_search (nodes=3364/4136 rc=136 decisions=126192 @root=146 restarts=12) 
#Bound 486.63s best:1520  next:[1018,1519] lb_tree_search (nodes=3415/4187 rc=136 decisions=126834 @root=147 restarts=12) 
#Bound 492.14s best:1520  next:[1019,1519] lb_tree_search (nodes=3446/4220 rc=136 decisions=127385 @root=149 restarts=12) 
#Bound 496.25s best:1520  next:[1020,1519] lb_tree_search (nodes=3486/4261 rc=137 decisions=128046 @root=150 restarts=12) 
#Bound 500.29s best:1520  next:[1021,1519] lb_tree_search (nodes=3518/4294 rc=138 decisions=128629 @root=151 restarts=12) 
#Bound 504.87s best:1520  next:[1022,1519] lb_tree_search (nodes=3550/4326 rc=138 decisions=129145 @root=152 restarts=12) 
#Bound 509.27s best:1520  next:[1023,1519] lb_tree_search (nodes=3577/4353 rc=139 decisions=129591 @root=153 restarts=12) 
#Bound 514.37s best:1520  next:[1024,1519] lb_tree_search (nodes=3602/4378 rc=139 decisions=130068 @root=155 restarts=12) 
#Bound 520.34s best:1520  next:[1025,1519] lb_tree_search (nodes=2769/4408 rc=139 decisions=130435 @root=158 restarts=12) 
#Bound 520.41s best:1520  next:[1030,1519] objective_lb_search_no_lp
#Bound 523.17s best:1520  next:[1037,1519] objective_lb_search_no_lp
#Bound 528.14s best:1520  next:[1058,1519] objective_lb_search_no_lp
#Bound 537.24s best:1520  next:[1059,1519] lb_tree_search (nodes=3364/5429 rc=143 decisions=136129 @root=160 restarts=12) 
#Bound 539.72s best:1520  next:[1060,1519] lb_tree_search (nodes=3393/5458 rc=143 decisions=136551 @root=161 restarts=12) 
#Bound 546.34s best:1520  next:[1061,1519] lb_tree_search (nodes=3418/5483 rc=143 decisions=137040 @root=164 restarts=12) 
#Bound 551.29s best:1520  next:[1062,1519] lb_tree_search (nodes=3384/5514 rc=143 decisions=137450 @root=166 restarts=12) 
#Bound 552.54s best:1520  next:[1063,1519] objective_lb_search_no_lp
#Bound 557.30s best:1520  next:[1064,1519] objective_lb_search
#Bound 559.75s best:1520  next:[1065,1519] objective_lb_search
#Bound 562.22s best:1520  next:[1066,1519] objective_lb_search
#Bound 563.09s best:1520  next:[1098,1519] objective_lb_search
#Bound 564.13s best:1520  next:[1109,1519] objective_lb_search
#Bound 566.16s best:1520  next:[1110,1519] objective_lb_search
#Model 582.48s var:596/600 constraints:7555/7837
#Model 583.68s var:594/600 constraints:7428/7837
#Bound 583.80s best:1520  next:[1111,1519] lb_tree_search (nodes=2796/2796 rc=158 decisions=147885 @root=175 restarts=13) 
#Bound 585.69s best:1520  next:[1112,1519] lb_tree_search (nodes=1843/2821 rc=159 decisions=148187 @root=176 restarts=13) 
#Bound 592.14s best:1520  next:[1113,1519] lb_tree_search (nodes=1457/2826 rc=159 decisions=148351 @root=180 restarts=13) 
#Bound 593.46s best:1520  next:[1114,1519] lb_tree_search (nodes=1452/2833 rc=159 decisions=148508 @root=181 restarts=13) 
#Bound 595.28s best:1520  next:[1115,1519] lb_tree_search (nodes=1456/2840 rc=159 decisions=148698 @root=182 restarts=13) 
#Bound 596.63s best:1520  next:[1116,1519] lb_tree_search (nodes=1458/2859 rc=159 decisions=148975 @root=183 restarts=13) 
#Bound 598.37s best:1520  next:[1117,1519] lb_tree_search (nodes=1457/2861 rc=159 decisions=149173 @root=184 restarts=13) 
#Bound 599.85s best:1520  next:[1118,1519] lb_tree_search (nodes=1467/2872 rc=159 decisions=149415 @root=185 restarts=13) 
#Bound 601.79s best:1520  next:[1119,1519] lb_tree_search (nodes=1468/2877 rc=159 decisions=149644 @root=186 restarts=13) 
#Bound 603.30s best:1520  next:[1120,1519] lb_tree_search (nodes=1479/2888 rc=159 decisions=149845 @root=187 restarts=13) 
#Bound 608.78s best:1520  next:[1121,1519] lb_tree_search (nodes=1478/2888 rc=159 decisions=150043 @root=190 restarts=13) 
#Bound 610.04s best:1520  next:[1122,1519] objective_lb_search_max_lp
#Bound 611.38s best:1520  next:[1126,1519] objective_lb_search
#Bound 614.02s best:1520  next:[1127,1519] lb_tree_search (nodes=1533/2943 rc=159 decisions=150930 @root=193 restarts=13) 
#Bound 616.04s best:1520  next:[1128,1519] lb_tree_search (nodes=1398/2958 rc=160 decisions=151118 @root=194 restarts=13) 
#Bound 617.88s best:1520  next:[1129,1519] lb_tree_search (nodes=1378/2965 rc=160 decisions=151274 @root=195 restarts=13) 
#Bound 620.07s best:1520  next:[1132,1519] objective_lb_search_max_lp
#Bound 623.23s best:1520  next:[1133,1519] lb_tree_search (nodes=1299/2986 rc=160 decisions=151714 @root=198 restarts=13) 
#Bound 624.56s best:1520  next:[1142,1519] objective_lb_search_no_lp
#Bound 624.88s best:1520  next:[1159,1519] objective_lb_search
#Bound 627.71s best:1520  next:[1160,1519] objective_lb_search_max_lp
#Bound 628.19s best:1520  next:[1161,1519] objective_lb_search
#Model 629.97s var:590/600 constraints:7185/7837
#Bound 631.12s best:1520  next:[1164,1519] objective_lb_search_max_lp
#Model 631.33s var:586/600 constraints:6915/7837
#Model 631.93s var:584/600 constraints:6718/7837
#Bound 631.93s best:1520  next:[1167,1519] objective_lb_search_max_lp
#Model 632.08s var:573/600 constraints:5869/7837
#Bound 632.08s best:1520  next:[1184,1519] objective_lb_search_max_lp
#Bound 632.80s best:1520  next:[1185,1519] objective_shaving_search_no_lp (vars=525 csts=5771)
#Bound 633.01s best:1520  next:[1223,1519] objective_lb_search
#Bound 633.50s best:1520  next:[1271,1519] objective_lb_search
#Model 633.58s var:572/600 constraints:5782/7837
#Model 634.41s var:571/600 constraints:5723/7837
#Bound 634.50s best:1520  next:[1306,1519] objective_lb_search
#Model 635.49s var:570/600 constraints:5580/7837
#Bound 635.55s best:1520  next:[1319,1519] objective_lb_search
#Model 635.60s var:569/600 constraints:5405/7837
#Model 635.68s var:568/600 constraints:5307/7837
#Bound 635.85s best:1520  next:[1334,1519] objective_lb_search_max_lp
#Bound 635.99s best:1520  next:[1338,1519] objective_lb_search_no_lp
#Model 635.99s var:567/600 constraints:5119/7837
#Model 636.07s var:566/600 constraints:5002/7837
#Model 636.09s var:565/600 constraints:4900/7837
#Bound 636.19s best:1520  next:[1340,1519] objective_lb_search_no_lp
#Bound 636.47s best:1520  next:[1342,1519] objective_lb_search_no_lp
#Model 636.51s var:564/600 constraints:4839/7837
#Model 636.52s var:562/600 constraints:4673/7837
#Model 636.62s var:561/600 constraints:4627/7837
#Model 636.68s var:557/600 constraints:4336/7837
#Bound 636.74s best:1520  next:[1346,1519] objective_lb_search_no_lp
#Model 636.75s var:555/600 constraints:4183/7837
#Bound 636.82s best:1520  next:[1347,1519] objective_lb_search_no_lp
#Bound 636.83s best:1520  next:[1419,1519] objective_lb_search
#Model 637.00s var:552/600 constraints:3967/7837
#Bound 637.11s best:1520  next:[1426,1519] objective_lb_search_no_lp
#Model 637.15s var:547/600 constraints:3475/7837
#Model 637.24s var:546/600 constraints:3361/7837
#Bound 637.25s best:1520  next:[1429,1519] objective_lb_search_no_lp
#Model 637.27s var:545/600 constraints:3301/7837
#Model 637.28s var:542/600 constraints:2912/7837
#Model 637.34s var:541/600 constraints:2870/7837
#Bound 637.44s best:1520  next:[1430,1519] objective_lb_search_no_lp
#Model 637.48s var:540/600 constraints:2827/7837
#Model 637.51s var:539/600 constraints:2745/7837
#Model 637.54s var:537/600 constraints:2677/7837
#Bound 637.54s best:1520  next:[1471,1519] objective_lb_search_no_lp
#Model 637.58s var:534/600 constraints:2495/7837
#Bound 637.60s best:1520  next:[1476,1519] objective_lb_search_no_lp
#Model 637.61s var:533/600 constraints:2391/7837
#Model 637.63s var:532/600 constraints:2265/7837
#Model 637.64s var:530/600 constraints:2166/7837
#Bound 637.67s best:1520  next:[1478,1519] objective_lb_search_no_lp
#Bound 637.68s best:1520  next:[1480,1519] objective_lb_search_no_lp
#Bound 637.69s best:1520  next:[1498,1519] objective_lb_search_no_lp
#Bound 637.70s best:1520  next:[1501,1519] objective_lb_search_no_lp
#Bound 637.71s best:1520  next:[1511,1519] objective_lb_search_no_lp
#Model 637.72s var:524/600 constraints:1707/7837
#Bound 637.72s best:1520  next:[1514,1519] objective_lb_search_no_lp
#Bound 637.73s best:1520  next:[1517,1519] objective_lb_search_no_lp
#Bound 637.73s best:1520  next:[1519,1519] objective_lb_search_no_lp
#Model 637.74s var:521/600 constraints:1526/7837
#Done  637.74s objective_lb_search_no_lp
#Done  637.74s quick_restart_no_lp
#Done  637.74s max_lp
#Done  637.74s core
#Model 637.75s var:519/600 constraints:1371/7837

Task timing                                  n [     min,      max]      avg      dev     time         n [     min,      max]      avg      dev    dtime
                             'core':         1 [  10.61m,   10.61m]   10.61m   0.00ns   10.61m         1 [   8.86m,    8.86m]    8.86m   0.00ns    8.86m
                       'default_lp':         1 [  10.61m,   10.61m]   10.61m   0.00ns   10.61m         1 [   2.12m,    2.12m]    2.12m   0.00ns    2.12m
                 'feasibility_pump':       821 [231.82ms,    1.69s] 376.27ms  72.62ms    5.15m       820 [ 51.42ms, 229.87ms]  70.45ms   5.71ms   57.76s
                            'fixed':         1 [  10.61m,   10.61m]   10.61m   0.00ns   10.61m         1 [   2.43m,    2.43m]    2.43m   0.00ns    2.43m
                  'fj_long_default':         1 [829.95ms, 829.95ms] 829.95ms   0.00ns 829.95ms         1 [125.11ms, 125.11ms] 125.11ms   0.00ns 125.11ms
              'fj_long_lin_default':         1 [416.83ms, 416.83ms] 416.83ms   0.00ns 416.83ms         1 [113.50ms, 113.50ms] 113.50ms   0.00ns 113.50ms
                   'fj_long_random':         1 [675.05ms, 675.05ms] 675.05ms   0.00ns 675.05ms         1 [133.20ms, 133.20ms] 133.20ms   0.00ns 133.20ms
                 'fj_short_default':         3 [ 90.16ms, 134.12ms] 114.70ms  18.31ms 344.10ms         3 [115.30ms, 116.72ms] 115.82ms 640.26us 347.47ms
             'fj_short_lin_default':         1 [397.04ms, 397.04ms] 397.04ms   0.00ns 397.04ms         1 [115.23ms, 115.23ms] 115.23ms   0.00ns 115.23ms
              'fj_short_lin_random':         2 [ 88.05ms, 196.31ms] 142.18ms  54.13ms 284.36ms         2 [109.74ms, 111.42ms] 110.58ms 839.21us 221.15ms
                  'fj_short_random':         2 [113.44ms, 217.16ms] 165.30ms  51.86ms 330.60ms         2 [108.96ms, 111.85ms] 110.41ms   1.44ms 220.81ms
                        'fs_random':         1 [757.78ms, 757.78ms] 757.78ms   0.00ns 757.78ms         1 [492.03us, 492.03us] 492.03us   0.00ns 492.03us
                        'fs_random':         1 [776.82ms, 776.82ms] 776.82ms   0.00ns 776.82ms         1 [  9.43ms,   9.43ms]   9.43ms   0.00ns   9.43ms
                  'fs_random_no_lp':         1 [787.82ms, 787.82ms] 787.82ms   0.00ns 787.82ms         0 [  0.00ns,   0.00ns]   0.00ns   0.00ns   0.00ns
          'fs_random_quick_restart':         1 [   1.32s,    1.32s]    1.32s   0.00ns    1.32s         1 [ 20.00ns,  20.00ns]  20.00ns   0.00ns  20.00ns
          'fs_random_quick_restart':         1 [748.05ms, 748.05ms] 748.05ms   0.00ns 748.05ms         1 [  8.25ms,   8.25ms]   8.25ms   0.00ns   8.25ms
    'fs_random_quick_restart_no_lp':         1 [   1.06s,    1.06s]    1.06s   0.00ns    1.06s         0 [  0.00ns,   0.00ns]   0.00ns   0.00ns   0.00ns
                    'graph_arc_lns':       835 [ 11.27ms,    2.70s]    1.07s 472.48ms   14.85m       791 [ 10.00ns, 126.34ms]  75.01ms  45.40ms   59.33s
                    'graph_cst_lns':       834 [ 10.76ms,    2.20s]    1.03s 490.77ms   14.26m       778 [ 10.00ns, 120.51ms]  71.95ms  45.93ms   55.97s
                    'graph_dec_lns':       834 [ 13.35ms,    2.37s]    1.10s 456.88ms   15.25m       789 [ 10.00ns, 120.67ms]  76.72ms  42.76ms    1.01m
                    'graph_var_lns':       835 [  5.51ms,    1.95s]    1.00s 474.61ms   13.92m       772 [ 10.00ns, 234.85ms]  71.47ms  46.81ms   55.18s
                   'lb_tree_search':         1 [  10.61m,   10.61m]   10.61m   0.00ns   10.61m         1 [   4.66m,    4.66m]    4.66m   0.00ns    4.66m
                           'max_lp':         1 [  10.61m,   10.61m]   10.61m   0.00ns   10.61m         1 [   2.40m,    2.40m]    2.40m   0.00ns    2.40m
                            'no_lp':         1 [  10.61m,   10.61m]   10.61m   0.00ns   10.61m         1 [   1.63m,    1.63m]    1.63m   0.00ns    1.63m
              'objective_lb_search':         1 [  10.61m,   10.61m]   10.61m   0.00ns   10.61m         1 [   2.56m,    2.56m]    2.56m   0.00ns    2.56m
       'objective_lb_search_max_lp':         1 [  10.61m,   10.61m]   10.61m   0.00ns   10.61m         1 [   3.43m,    3.43m]    3.43m   0.00ns    3.43m
        'objective_lb_search_no_lp':         1 [  10.61m,   10.61m]   10.61m   0.00ns   10.61m         1 [   1.26m,    1.26m]    1.26m   0.00ns    1.26m
  'objective_shaving_search_max_lp':       196 [ 31.71ms,   17.61s]    3.24s    2.68s   10.59m       183 [878.36us,    2.11s] 415.65ms 372.37ms    1.27m
   'objective_shaving_search_no_lp':       199 [ 11.67ms,   17.61s]    3.19s    2.69s   10.58m       182 [878.33us,    1.42s] 308.52ms 267.15ms   56.15s
                          'probing':         1 [  10.61m,   10.61m]   10.61m   0.00ns   10.61m         1 [   1.65m,    1.65m]    1.65m   0.00ns    1.65m
                   'probing_max_lp':         1 [  10.61m,   10.61m]   10.61m   0.00ns   10.61m         1 [   1.88m,    1.88m]    1.88m   0.00ns    1.88m
                     'pseudo_costs':         1 [  10.61m,   10.61m]   10.61m   0.00ns   10.61m         1 [   2.28m,    2.28m]    2.28m   0.00ns    2.28m
                    'quick_restart':         1 [  10.61m,   10.61m]   10.61m   0.00ns   10.61m         1 [   2.98m,    2.98m]    2.98m   0.00ns    2.98m
              'quick_restart_no_lp':         1 [  10.61m,   10.61m]   10.61m   0.00ns   10.61m         1 [   2.62m,    2.62m]    2.62m   0.00ns    2.62m
                    'reduced_costs':         1 [  10.61m,   10.61m]   10.61m   0.00ns   10.61m         1 [   2.41m,    2.41m]    2.41m   0.00ns    2.41m
                        'rins/rens':       835 [214.42us,    1.56s] 596.54ms 410.72ms    8.30m       705 [ 10.00ns, 124.00ms]  67.19ms  41.28ms   47.37s
                      'rnd_cst_lns':       835 [  9.21ms,    2.40s]    1.04s 486.98ms   14.52m       774 [ 10.00ns, 141.48ms]  75.51ms  45.48ms   58.45s
                      'rnd_var_lns':       835 [  6.69ms,    2.21s]    1.03s 466.98ms   14.39m       778 [ 10.00ns, 167.95ms]  73.39ms  45.11ms   57.10s
         'scheduling_intervals_lns':       834 [  3.77ms,    2.63s]    1.30s 553.73ms   18.10m       699 [100.01ms, 200.14ms] 113.88ms   9.46ms    1.33m
       'scheduling_precedences_lns':       834 [  3.90ms,    2.62s]    1.29s 547.55ms   17.92m       700 [100.00ms, 129.93ms] 113.71ms   8.91ms    1.33m
       'scheduling_time_window_lns':       834 [  3.55ms,    2.56s]    1.30s 554.66ms   18.06m       700 [100.00ms, 129.93ms] 113.72ms   8.91ms    1.33m
                     'violation_ls':       833 [  8.78ms, 372.94ms] 141.61ms  52.73ms    1.97m       833 [ 98.45us, 348.60ms] 143.57ms  58.12ms    1.99m
                     'violation_ls':       833 [ 19.25ms, 345.51ms] 128.69ms  40.05ms    1.79m       833 [  9.69ms, 324.95ms] 121.33ms  35.29ms    1.68m

Search stats                        Bools  Conflicts  Branches  Restarts   BoolPropag  IntegerPropag
                           'core':  8'352    107'769   206'782     9'509  291'206'514    204'230'852
                     'default_lp':  2'276     98'488   374'762    33'916   59'531'719    201'840'879
                          'fixed':  2'169    259'916   270'948     1'455  126'769'967    248'980'701
                      'fs_random':    127          0       254       254           12         13'243
                      'fs_random':    127          0       288       254           16         14'054
                'fs_random_no_lp':    127          0       150       150           12          7'637
        'fs_random_quick_restart':    127          0         0         0            0              0
        'fs_random_quick_restart':    127          0       261       255           12         13'425
  'fs_random_quick_restart_no_lp':    127          0         0         0            0              0
                 'lb_tree_search':    148        322   738'425   238'522    2'260'602    115'023'688
                         'max_lp':    127     74'735   388'277    67'562    3'491'224    207'506'214
                          'no_lp':  2'349    178'654   425'519    25'832   99'628'364    327'032'182
            'objective_lb_search':    417     53'193   315'039    42'983    5'401'790    187'682'887
     'objective_lb_search_max_lp':    366     29'621   418'042    80'216    5'027'702    179'163'060
      'objective_lb_search_no_lp':    541    124'781   275'163    22'586    6'888'771    264'657'687
                        'probing':  1'094        741     7'447     4'591      134'218      1'255'126
                 'probing_max_lp':  1'094        750     4'868     3'295      115'504      1'119'158
                   'pseudo_costs':  1'302     95'160   384'507    46'084   34'503'851    200'637'977
                  'quick_restart':  3'447     59'377   470'653    37'059   63'818'619    139'667'972
            'quick_restart_no_lp':  5'280    203'850   730'301    34'892  184'392'210    285'777'988
                  'reduced_costs':  5'149     88'977   451'866    38'172   78'553'327    194'145'136

SAT stats                           ClassicMinim  LitRemoved  LitLearned  LitForgotten  Subsumed  MClauses  MDecisions  MLitTrue  MSubsumed  MLitRemoved  MReused
                           'core':       102'170     764'882     872'926        14'829       405     3'898      19'407         0        123          574       89
                     'default_lp':        78'115     305'003   1'270'026       793'166     1'330    17'327     171'139       102      7'722       57'658    2'323
                          'fixed':       207'261   1'722'890   7'142'791       340'135       848       569       5'878         0        542        6'443        1
                      'fs_random':             0           0           0             0         0         0           0         0          0            0        0
                      'fs_random':             0           0           0             0         0         0           0         0          0            0        0
                'fs_random_no_lp':             0           0           0             0         0         0           0         0          0            0        0
        'fs_random_quick_restart':             0           0           0             0         0         0           0         0          0            0        0
        'fs_random_quick_restart':             0           0           0             0         0         0           0         0          0            0        0
  'fs_random_quick_restart_no_lp':             0           0           0             0         0         0           0         0          0            0        0
                 'lb_tree_search':             6           7       1'008             0         0   105'556     523'598         0         66          247   10'879
                         'max_lp':        47'290     124'835   1'054'934       673'904     2'376    29'252     275'520         2      1'623       12'791    3'184
                          'no_lp':       152'596     758'801   2'761'565     2'138'808     1'869    13'866     136'733         0      7'786       65'156    1'692
            'objective_lb_search':        41'640     132'790     468'860        44'387     1'671    20'985     235'445         0      4'836       32'970    4'588
     'objective_lb_search_max_lp':        20'681      55'845     267'257        14'042     1'264    33'261     342'632         0      3'025       19'445    6'828
      'objective_lb_search_no_lp':        97'500     308'740   1'202'256       321'418     2'606    11'081     113'487         1      4'498       33'201    2'111
                        'probing':             0           0         741             0         0         0           0         0          0            0        0
                 'probing_max_lp':             0           0         750             0         0         0           0         0          0            0        0
                   'pseudo_costs':        77'712     282'144   1'217'071       633'090     1'356    23'192     197'069         7      8'923       62'274    2'740
                  'quick_restart':        46'536     232'075     700'370       177'278       817    20'741     251'210        23     15'059      158'146    2'642
            'quick_restart_no_lp':       167'494   1'079'417   3'117'437     1'279'805       790     9'888     126'032        26      8'279       97'143      534
                  'reduced_costs':        69'231     269'985   1'150'938       656'176     1'137    17'963     187'333        18      6'419       44'927    3'355

Lp stats                         Component  Iterations  AddedCuts  OPTIMAL  DUAL_F.  DUAL_U.
                  'default_lp':          1   1'185'370    106'869  153'097        0        0
                       'fixed':          1     153'353      3'467  264'468        0        0
                   'fs_random':          1         302        324        7        0        0
                   'fs_random':          1         906        910       45        0        0
     'fs_random_quick_restart':          1           0          0        0        0        0
     'fs_random_quick_restart':          1         837      1'677       27        0        0
              'lb_tree_search':          1   3'315'494     35'986   87'363   70'931        0
                      'max_lp':          1   1'725'370     67'404   96'007  100'651       43
         'objective_lb_search':          1   1'678'157     47'021  105'890        0       12
  'objective_lb_search_max_lp':          1   2'014'315     30'429   51'346   20'542       40
                     'probing':          1     564'093     35'304   21'410        0        7
              'probing_max_lp':          1     508'423     24'260   11'907    1'984        0
                'pseudo_costs':          1   1'554'034    159'048  117'369   88'770       25
               'quick_restart':          1   1'690'265     55'099  105'092        0        2
               'reduced_costs':          1   1'577'970    126'581  111'395   91'463       17

Lp dimension                                                                      Final dimension of first component
                  'default_lp':   870 rows, 588 columns, 2439 entries with magnitude in [6.138773e-03, 1.000000e+00]
                       'fixed':   445 rows, 588 columns, 1713 entries with magnitude in [6.443299e-03, 1.000000e+00]
                   'fs_random':    247 rows, 588 columns, 980 entries with magnitude in [6.443299e-03, 1.000000e+00]
                   'fs_random':   702 rows, 588 columns, 2280 entries with magnitude in [5.179710e-03, 1.000000e+00]
     'fs_random_quick_restart':        0 rows, 588 columns, 0 entries with magnitude in [0.000000e+00, 0.000000e+00]
     'fs_random_quick_restart':   695 rows, 588 columns, 2422 entries with magnitude in [6.443299e-03, 1.000000e+00]
              'lb_tree_search':  2538 rows, 600 columns, 5158 entries with magnitude in [7.976804e-04, 1.000000e+00]
                      'max_lp':  1580 rows, 600 columns, 4173 entries with magnitude in [1.114099e-03, 1.000000e+00]
         'objective_lb_search':   670 rows, 588 columns, 2441 entries with magnitude in [3.391013e-05, 1.000000e+00]
  'objective_lb_search_max_lp':  1327 rows, 600 columns, 3926 entries with magnitude in [1.844043e-03, 1.000000e+00]
                     'probing':  1365 rows, 588 columns, 6791 entries with magnitude in [2.013861e-04, 1.000000e+00]
              'probing_max_lp':  1412 rows, 600 columns, 7022 entries with magnitude in [3.258051e-03, 1.000000e+00]
                'pseudo_costs':  1768 rows, 600 columns, 4961 entries with magnitude in [2.832566e-05, 1.000000e+00]
               'quick_restart':  1442 rows, 588 columns, 4039 entries with magnitude in [9.888758e-05, 1.000000e+00]
               'reduced_costs':  1014 rows, 600 columns, 3935 entries with magnitude in [1.260873e-03, 1.000000e+00]

Lp debug                         CutPropag  CutEqPropag   Adjust  Overflow         Bad  BadScaling
                  'default_lp':         49           30   67'502         0   2'060'415           0
                       'fixed':          0            1  131'418         0      22'421           0
                   'fs_random':          0            0        0         0         388           0
                   'fs_random':          0            0       10         0       1'009           0
     'fs_random_quick_restart':          0            0        0         0           0           0
     'fs_random_quick_restart':          0            0        4         0       9'073           0
              'lb_tree_search':        190           14   93'099         0   1'832'785           0
                      'max_lp':        247           39   78'301         0   1'306'810           0
         'objective_lb_search':        167           15   45'026         0   1'954'252           0
  'objective_lb_search_max_lp':        260            3   45'259         0   1'500'483           0
                     'probing':        118          156   18'841         0  31'498'334           0
              'probing_max_lp':        149           33   13'729         0  21'484'609           0
                'pseudo_costs':        457           51  113'250         0   2'189'382           0
               'quick_restart':        229           99   61'838         0   5'112'788           0
               'reduced_costs':        204           48   98'491         0   1'960'779           0

Lp pool                          Constraints  Updates  Simplif  Merged  Shortened    Split  Strenghtened        Cuts/Call
                  'default_lp':        9'438    3'744   38'501   1'063     10'308   48'375        27'247  106'869/292'812
                       'fixed':        4'080       69      513      19          0       45           849      3'467/9'259
                   'fs_random':        1'542        0        0       0          0        0            52        910/1'700
                   'fs_random':          956        0        0       0          0        0            38          324/614
     'fs_random_quick_restart':        2'309       14        0       0          0       11           206      1'677/2'629
     'fs_random_quick_restart':          632        0        0       0          0        0             0              0/0
              'lb_tree_search':       17'401    4'323  498'886     414     34'729   25'222       232'267   35'986/129'731
                      'max_lp':       16'310    3'405  429'707     923     30'545   21'796       206'136   67'404/172'974
         'objective_lb_search':        9'056    3'917  237'391     597     17'798   55'713        26'839   47'021/173'687
  'objective_lb_search_max_lp':       16'759    3'746  530'649     499     36'875   20'081       232'307    30'429/98'947
                     'probing':        9'880    7'509   96'700      56      1'835  288'128        16'873    35'304/88'563
              'probing_max_lp':       17'050    3'831  213'557      39      6'351   62'396       121'679    24'260/66'253
                'pseudo_costs':       15'437    4'773  620'628   1'440     33'474   36'013       264'517  159'048/350'595
               'quick_restart':        9'431    6'307  287'626     300     14'254  370'752        32'825   55'099/210'006
               'reduced_costs':       16'067    4'148  288'328   1'343     19'356   30'541       218'105  126'581/296'298

Lp Cut                                                fs_ran  fs_ran  fs_ran  defaul  fixed  max_lp  quick_  reduce  pseudo  lb_tre  probin  object  probin  object
                                              CG_FF:      22     109      44   3'789    275   2'578     711   6'057   6'913     589     620   1'004     332     630
                                               CG_K:      23      55      37   2'694    124   2'327     402   5'428   6'332     463     219     683     185     477
                                               CG_R:      13      28      23   4'085    137   1'992     680   5'507   6'396     414     454   1'041     233     411
                                              CG_RB:       5     277      27  10'702    604   8'106   2'010  15'136  19'281   3'325   2'184   4'174   1'637   2'481
                                             CG_RBP:       -      14       -   1'330     51     769     200   2'199   2'453     156     120     319      47     133
                                             Clique:       -       -       -       -      -     414       -   1'140   1'539     188       -       -     123     212
                                                 IB:     109     475     530  35'516    868  11'317  18'208  18'410  21'053   5'945   7'282  14'610   2'405   4'916
                                           MIR_1_FF:      51     114      78   4'784    222   3'338   2'127   6'767   8'755   1'832   1'595   2'130     803   1'540
                                            MIR_1_K:       2       7       2     688     14     650     413   1'396   1'871     313     320     331     136     305
                                           MIR_1_KL:       -       -       -     180      1      50      37      78     158       4     118      13      19       1
                                            MIR_1_R:      15      21      19   1'029     58     499     458   1'257   1'551     173     377     407      73     203
                                           MIR_1_RB:      29     142      36   8'126    257   6'979   4'827  12'799  16'507   3'981   3'358   4'117   2'036   3'416
                                          MIR_1_RBP:       3      16       5     483     29   1'191     204   1'893   2'471     450     158     215     279     350
                                          MIR_1_RLT:       -       -       -       -      -       5       -      14      18       5       -       -       -       1
                                           MIR_2_FF:       9      35      16   3'003     96   2'156   1'480   4'138   5'393   1'234     966   1'371     360   1'016
                                            MIR_2_K:       3       8       4     584     16     445     252   1'100   1'287     244     155     246      79     230
                                           MIR_2_KL:       -       -       -     117      -      50      28      71     127       3      90       9      19       -
                                            MIR_2_R:       3       6       5     823     28     560     477   1'073   1'519     360     561     403     251     301
                                           MIR_2_RB:      14      86      16   5'581    147   4'040   3'599   7'360   9'490   2'473   2'563   2'771     970   2'093
                                          MIR_2_RBP:       -      15       2     513     18     682     267   1'264   1'550     292     171     238     126     191
                                           MIR_3_FF:       2      13       7   1'763     55   1'490   1'041   2'754   3'692     746     551     929     263     694
                                            MIR_3_K:       2       6       3     445     10     345     200     785   1'002     169     135     163      46     169
                                           MIR_3_KL:       -       -       -     129      -      41      51      56      90       4      80      17       8       4
                                            MIR_3_R:       1       4       3     494     13     517     444     980   1'337     388     406     306     181     326
                                           MIR_3_RB:       3      41       3   3'539     78   2'538   2'504   4'573   6'028   1'540   1'896   1'887     577   1'206
                                          MIR_3_RBP:       -       2       -     332     10     444     161     776   1'056     166     119     123      63     144
                                           MIR_4_FF:       -       7       -   1'214     26     941     814   1'699   2'333     511     427     759     134     428
                                            MIR_4_K:       2       2       2     350      7     272     157     566     689     126     106     149      33     121
                                           MIR_4_KL:       -       -       -     104      -      26      42      62     106       3      51      15      11       2
                                            MIR_4_R:       -       4       -     468      9     407     340     733   1'035     303     203     303     142     234
                                           MIR_4_RB:       3      35       2   2'302     39   1'475   1'722   2'646   3'642     910   1'130   1'278     320     637
                                          MIR_4_RBP:       -       3       -     227      5     248     111     380     629      88      78      94      34      94
                                           MIR_5_FF:       1       7       3     758     15     574     562   1'007   1'456     294     231     477      68     252
                                            MIR_5_K:       -       4       -     250      5     162     125     408     488     101      72     115      27      94
                                           MIR_5_KL:       -       -       -      62      1      29      49      39      89       5      59      11       5       3
                                            MIR_5_R:       -       6       -     318      6     305     233     486     672     170     128     214      58     141
                                           MIR_5_RB:       2      32       2   1'454     28     859   1'001   1'531   2'304     452     682     743     168     356
                                          MIR_5_RBP:       -       3       -     136      3     131      62     228     364      47      32      47      13      33
                                           MIR_6_FF:       -       2       -     406      4     311     281     648     907     180     127     279      33     154
                                            MIR_6_K:       -       -       -     160      -     123     102     287     360      56      52      79      13      57
                                           MIR_6_KL:       -       -       -      60      -      23      48      37      55       5      38      17       3       2
                                            MIR_6_R:       -       1       -     206      3     175     120     336     410     101      52     128      17      85
                                           MIR_6_RB:       -       5       -     825     15     503     534   1'040   1'491     258     377     432      92     198
                                          MIR_6_RBP:       -       1       -      83      1      90      38     206     263      32      29      26      13      30
         NoOverlapCompletionTimeExhaustive_weighted:       -       -       -       -      -      64       -     182     241      22       -       -       2      25
  NoOverlapCompletionTimeExhaustive_weighted_lifted:       -       -       -       -      -      51       -     109     123       7       -       -       3      12
                        NoOverlapDisjunctionOnStart:       -       -       -       -      -      60       -     161     206      22       -       -       7      18
                                       ZERO_HALF_FF:       2      17      11     828     43     652     281   1'388   1'855     284     157     281      76     278
                                        ZERO_HALF_K:       1       7       6     252      8     261      99     635     786      85      61      92      24     107
                                       ZERO_HALF_KL:       -       -       -       1      -       -       -       1       -       -       1       1       -       -
                                        ZERO_HALF_R:       3      31      14   3'757     70   3'965   6'288   5'284   5'927   5'251   5'425   3'068  10'656   4'440
                                       ZERO_HALF_RB:       1      28       9   1'510     58   1'761     934   2'741   3'781     983     865     663     743     976
                                      ZERO_HALF_RBP:       -       8       1     409     10     413     375     730     967     233     423     243     314     202

LNS stats                        Improv/Calls  Closed  Difficulty  TimeLimit
               'graph_arc_lns':        86/834     53%        1.00       0.12
               'graph_cst_lns':        92/833     53%        1.00       0.12
               'graph_dec_lns':        68/834     53%        1.00       0.12
               'graph_var_lns':        85/829     52%        1.00       0.12
                   'rins/rens':       104/799     51%        0.92       0.10
                 'rnd_cst_lns':        88/832     53%        1.00       0.12
                 'rnd_var_lns':        79/835     52%        1.00       0.12
    'scheduling_intervals_lns':       134/829     16%        0.00       0.13
  'scheduling_precedences_lns':       134/829     16%        0.00       0.13
  'scheduling_time_window_lns':       134/829     16%        0.00       0.13

LS stats                   Batches  Restarts   LinMoves   GenMoves  CompoundMoves  WeightUpdates
       'fj_long_default':        1         1      9'900          0              0            100
   'fj_long_lin_default':        1         1          0      1'898            387              0
        'fj_long_random':        1         1      9'906          0              0             94
      'fj_short_default':        3         1          0      5'126            781              1
  'fj_short_lin_default':        1         1          0      1'827            299              0
   'fj_short_lin_random':        2         1          0      3'878            497              0
       'fj_short_random':        2         1          0      4'109            641              1
          'violation_ls':      833         0  4'295'984  1'094'860         57'673        772'168
          'violation_ls':      833         0  4'897'120    826'031         57'180        353'492

Solutions (30)                   Num     Rank
                       'fixed':    1  [11,11]
               'graph_dec_lns':    1  [10,10]
               'graph_var_lns':    1  [29,29]
                       'no_lp':   12  [12,23]
                'pseudo_costs':    1  [30,30]
               'quick_restart':    1    [1,1]
         'quick_restart_no_lp':    5   [8,28]
    'scheduling_intervals_lns':    1  [24,24]
  'scheduling_precedences_lns':    1  [25,25]
                'violation_ls':    6    [2,7]

Objective bounds                      Num
          'fs_random_quick_restart':    1
                   'initial_domain':    1
                   'lb_tree_search':   94
              'objective_lb_search':   46
       'objective_lb_search_max_lp':   13
        'objective_lb_search_no_lp':   51
  'objective_shaving_search_max_lp':    1
   'objective_shaving_search_no_lp':    2
                    'quick_restart':    3

Solution repositories     Added  Queried  Ignored  Synchro
  'feasible solutions':   7'289   18'977        0    6'974
        'lp solutions':   3'832      418        0    3'252
                'pump':  17'195      417

Improving bounds shared             Num
                        'core':     123
                  'default_lp':     351
              'lb_tree_search':     445
                      'max_lp':     412
                       'no_lp':      95
         'objective_lb_search':     238
  'objective_lb_search_max_lp':     430
   'objective_lb_search_no_lp':     468
                     'probing':   2'909
              'probing_max_lp':   1'674
                'pseudo_costs':   1'542
               'quick_restart':   1'027
         'quick_restart_no_lp':  11'925
               'reduced_costs':     679

Clauses shared                   Num
                        'core':    4
                  'default_lp':   62
              'lb_tree_search':   95
                      'max_lp':  101
                       'no_lp':   22
         'objective_lb_search':   67
  'objective_lb_search_max_lp':  130
   'objective_lb_search_no_lp':   68
                'pseudo_costs':  110
               'quick_restart':   40
         'quick_restart_no_lp':   21
               'reduced_costs':   37

CpSolverResponse summary:
status: OPTIMAL
objective: 1520
best_bound: 1520
integers: 595
booleans: 127
conflicts: 0
branches: 254
propagations: 12
integer_propagations: 13243
restarts: 254
lp_iterations: 302
walltime: 638.009
usertime: 638.009
deterministic_time: 3635.2
gap_integral: 6560.28
solution_fingerprint: 0xc04caf04de3103e4


--- Simulation Gantt  partir du modle mathmatique ---
