created virtual environment CPython3.12.4.final.0-64 in 3519ms
  creator CPython3Posix(dest=/localscratch/aneumann.63390843.0/env, clear=False, no_vcs_ignore=False, global=False)
  seeder FromAppData(download=False, pip=bundle, via=copy, app_data_dir=/home/aneumann/.local/share/virtualenv)
    added seed packages: pip==25.1.1
  activators BashActivator,CShellActivator,FishActivator,NushellActivator,PowerShellActivator,PythonActivator
Looking in links: /cvmfs/soft.computecanada.ca/custom/python/wheelhouse/gentoo2023/x86-64-v3, /cvmfs/soft.computecanada.ca/custom/python/wheelhouse/gentoo2023/generic, /cvmfs/soft.computecanada.ca/custom/python/wheelhouse/generic
Requirement already satisfied: pip in /localscratch/aneumann.63390843.0/env/lib/python3.12/site-packages (25.1.1)
Looking in links: /cvmfs/soft.computecanada.ca/custom/python/wheelhouse/gentoo2023/x86-64-v3, /cvmfs/soft.computecanada.ca/custom/python/wheelhouse/gentoo2023/generic, /cvmfs/soft.computecanada.ca/custom/python/wheelhouse/generic
ERROR: protobuf-5.28.3-cp38-abi3-manylinux2014_x86_64.whl is not a supported wheel on this platform.
Looking in links: /cvmfs/soft.computecanada.ca/custom/python/wheelhouse/gentoo2023/x86-64-v3, /cvmfs/soft.computecanada.ca/custom/python/wheelhouse/gentoo2023/generic, /cvmfs/soft.computecanada.ca/custom/python/wheelhouse/generic
Processing /home/aneumann/projects/def-adhaj/aneumann/GNRS/wheels/immutabledict-4.2.0-py3-none-any.whl
Installing collected packages: immutabledict
Successfully installed immutabledict-4.2.0
Looking in links: /cvmfs/soft.computecanada.ca/custom/python/wheelhouse/gentoo2023/x86-64-v3, /cvmfs/soft.computecanada.ca/custom/python/wheelhouse/gentoo2023/generic, /cvmfs/soft.computecanada.ca/custom/python/wheelhouse/generic
Processing /cvmfs/soft.computecanada.ca/custom/python/wheelhouse/generic/ortools-9.10.4067+computecanada-cp312-cp312-linux_x86_64.whl (from -r /home/aneumann/projects/def-adhaj/aneumann/GNRS/requirements/or.txt (line 1))
Processing /cvmfs/soft.computecanada.ca/custom/python/wheelhouse/gentoo2023/x86-64-v3/matplotlib-3.10.0+computecanada-cp312-cp312-linux_x86_64.whl (from -r /home/aneumann/projects/def-adhaj/aneumann/GNRS/requirements/or.txt (line 2))
Processing /cvmfs/soft.computecanada.ca/custom/python/wheelhouse/gentoo2023/x86-64-v3/pandas-2.2.3+computecanada-cp312-cp312-linux_x86_64.whl (from -r /home/aneumann/projects/def-adhaj/aneumann/GNRS/requirements/or.txt (line 3))
Processing /cvmfs/soft.computecanada.ca/custom/python/wheelhouse/generic/absl_py-2.2.2+computecanada-py3-none-any.whl (from ortools<9.11,>=9.10->-r /home/aneumann/projects/def-adhaj/aneumann/GNRS/requirements/or.txt (line 1))
Processing /cvmfs/soft.computecanada.ca/custom/python/wheelhouse/gentoo2023/generic/numpy-2.2.2+computecanada-cp312-cp312-linux_x86_64.whl (from ortools<9.11,>=9.10->-r /home/aneumann/projects/def-adhaj/aneumann/GNRS/requirements/or.txt (line 1))
Processing /cvmfs/soft.computecanada.ca/custom/python/wheelhouse/gentoo2023/x86-64-v3/protobuf-6.30.2+computecanada-cp312-cp312-linux_x86_64.whl (from ortools<9.11,>=9.10->-r /home/aneumann/projects/def-adhaj/aneumann/GNRS/requirements/or.txt (line 1))
Requirement already satisfied: immutabledict>=3.0.0 in /localscratch/aneumann.63390843.0/env/lib/python3.12/site-packages (from ortools<9.11,>=9.10->-r /home/aneumann/projects/def-adhaj/aneumann/GNRS/requirements/or.txt (line 1)) (4.2.0)
Processing /cvmfs/soft.computecanada.ca/custom/python/wheelhouse/gentoo2023/generic/contourpy-1.3.1+computecanada-cp312-cp312-linux_x86_64.whl (from matplotlib->-r /home/aneumann/projects/def-adhaj/aneumann/GNRS/requirements/or.txt (line 2))
Processing /cvmfs/soft.computecanada.ca/custom/python/wheelhouse/generic/cycler-0.12.1+computecanada-py3-none-any.whl (from matplotlib->-r /home/aneumann/projects/def-adhaj/aneumann/GNRS/requirements/or.txt (line 2))
Processing /cvmfs/soft.computecanada.ca/custom/python/wheelhouse/generic/fonttools-4.58.2+computecanada-cp312-cp312-linux_x86_64.whl (from matplotlib->-r /home/aneumann/projects/def-adhaj/aneumann/GNRS/requirements/or.txt (line 2))
Processing /cvmfs/soft.computecanada.ca/custom/python/wheelhouse/gentoo2023/x86-64-v3/kiwisolver-1.4.8+computecanada-cp312-cp312-linux_x86_64.whl (from matplotlib->-r /home/aneumann/projects/def-adhaj/aneumann/GNRS/requirements/or.txt (line 2))
Processing /cvmfs/soft.computecanada.ca/custom/python/wheelhouse/generic/packaging-25.0+computecanada-py3-none-any.whl (from matplotlib->-r /home/aneumann/projects/def-adhaj/aneumann/GNRS/requirements/or.txt (line 2))
Processing /cvmfs/soft.computecanada.ca/custom/python/wheelhouse/gentoo2023/x86-64-v3/pillow-11.1.0+computecanada-cp312-cp312-linux_x86_64.whl (from matplotlib->-r /home/aneumann/projects/def-adhaj/aneumann/GNRS/requirements/or.txt (line 2))
Processing /cvmfs/soft.computecanada.ca/custom/python/wheelhouse/generic/pyparsing-3.2.1+computecanada-py3-none-any.whl (from matplotlib->-r /home/aneumann/projects/def-adhaj/aneumann/GNRS/requirements/or.txt (line 2))
Processing /cvmfs/soft.computecanada.ca/custom/python/wheelhouse/generic/python_dateutil-2.9.0.post0+computecanada-py2.py3-none-any.whl (from matplotlib->-r /home/aneumann/projects/def-adhaj/aneumann/GNRS/requirements/or.txt (line 2))
Processing /cvmfs/soft.computecanada.ca/custom/python/wheelhouse/generic/pytz-2025.2+computecanada-py2.py3-none-any.whl (from pandas->-r /home/aneumann/projects/def-adhaj/aneumann/GNRS/requirements/or.txt (line 3))
Processing /cvmfs/soft.computecanada.ca/custom/python/wheelhouse/generic/tzdata-2025.2+computecanada-py2.py3-none-any.whl (from pandas->-r /home/aneumann/projects/def-adhaj/aneumann/GNRS/requirements/or.txt (line 3))
Processing /cvmfs/soft.computecanada.ca/custom/python/wheelhouse/generic/six-1.17.0+computecanada-py2.py3-none-any.whl (from python-dateutil>=2.7->matplotlib->-r /home/aneumann/projects/def-adhaj/aneumann/GNRS/requirements/or.txt (line 2))
Installing collected packages: pytz, tzdata, six, pyparsing, protobuf, pillow, packaging, numpy, kiwisolver, fonttools, cycler, absl-py, python-dateutil, contourpy, pandas, matplotlib, ortools

Successfully installed absl-py-2.2.2+computecanada contourpy-1.3.1+computecanada cycler-0.12.1+computecanada fonttools-4.58.2+computecanada kiwisolver-1.4.8+computecanada matplotlib-3.10.0+computecanada numpy-2.2.2+computecanada ortools-9.10.4067+computecanada packaging-25.0+computecanada pandas-2.2.3+computecanada pillow-11.1.0+computecanada protobuf-6.30.2+computecanada pyparsing-3.2.1+computecanada python-dateutil-2.9.0.post0+computecanada pytz-2025.2+computecanada six-1.17.0+computecanada tzdata-2025.2+computecanada

Starting CP-SAT solver v9.10.4067
Parameters: max_time_in_seconds: 3600 max_memory_in_mb: 12000 log_search_progress: true enumerate_all_solutions: false absolute_gap_limit: 0 relative_gap_limit: 0
Setting number of workers to 48

Initial optimization model '': (model_fingerprint: 0x13787f339f85b1d3)
#Variables: 189 (#ints: 6 in objective)
  - 126 Booleans in [0,1]
  - 63 in [0,414]
#kLinear1: 21
#kLinear2: 254
#kLinear3: 95
#kLinearN: 868 (#terms: 8'933)

Starting presolve at 0.00s
  4.93e-04s  0.00e+00d  [DetectDominanceRelations] 
  1.29e-02s  0.00e+00d  [PresolveToFixPoint] #num_loops=6 #num_dual_strengthening=3 
  1.93e-05s  0.00e+00d  [ExtractEncodingFromLinear] #potential_supersets=3 
[Symmetry] Graph for symmetry has 1'202 nodes and 5'814 arcs.
[Symmetry] Symmetry computation done. time: 0.000627312 dtime: 0.00051234
[SAT presolve] num removable Booleans: 0 / 48
[SAT presolve] num trivial clauses: 0
[SAT presolve] [0s] clauses:11 literals:29 vars:17 one_side_vars:14 simple_definition:3 singleton_clauses:0
[SAT presolve] [4.1217e-05s] clauses:11 literals:29 vars:17 one_side_vars:14 simple_definition:3 singleton_clauses:0
[SAT presolve] [5.6095e-05s] clauses:11 literals:29 vars:17 one_side_vars:14 simple_definition:3 singleton_clauses:0
  3.13e-03s  3.66e-04d  [Probe] #probed=208 #fixed_bools=3 #new_bounds=11 #new_binary_clauses=1 
  3.11e-05s  0.00e+00d  [MaxClique] 
  3.55e-04s  0.00e+00d  [DetectDominanceRelations] 
  5.20e-03s  0.00e+00d  [PresolveToFixPoint] #num_loops=4 #num_dual_strengthening=3 
  1.35e-03s  0.00e+00d  [ProcessAtMostOneAndLinear] 
  8.95e-04s  0.00e+00d  [DetectDuplicateConstraints] #duplicates=168 #without_enforcements=79 
  3.77e-04s  1.42e-05d  [DetectDominatedLinearConstraints] #relevant_constraints=528 #num_inclusions=296 #num_redundant=4 
  1.64e-04s  0.00e+00d  [DetectDifferentVariables] #different=23 #cliques=1 #size=4 
  1.31e-04s  4.29e-06d  [ProcessSetPPC] #relevant_constraints=296 
  1.30e-05s  0.00e+00d  [FindAlmostIdenticalLinearConstraints] 
  1.13e-04s  8.28e-05d  [FindBigAtMostOneAndLinearOverlap] 
  9.26e-04s  3.13e-04d  [FindBigVerticalLinearOverlap] #blocks=6 #saved_nz=311 
  6.51e-05s  1.18e-05d  [FindBigHorizontalLinearOverlap] #linears=279 
  2.05e-05s  1.05e-07d  [MergeClauses] 
  3.54e-04s  0.00e+00d  [DetectDominanceRelations] 
  4.57e-03s  0.00e+00d  [PresolveToFixPoint] #num_loops=2 #num_dual_strengthening=1 
  3.51e-04s  0.00e+00d  [DetectDominanceRelations] 
  3.25e-03s  0.00e+00d  [PresolveToFixPoint] #num_loops=1 #num_dual_strengthening=1 
[Symmetry] Graph for symmetry has 1'039 nodes and 5'025 arcs.
[Symmetry] Symmetry computation done. time: 0.000306037 dtime: 0.00039735
[SAT presolve] num removable Booleans: 0 / 45
[SAT presolve] num trivial clauses: 0
[SAT presolve] [0s] clauses:11 literals:29 vars:17 one_side_vars:14 simple_definition:3 singleton_clauses:0
[SAT presolve] [3.1187e-05s] clauses:11 literals:29 vars:17 one_side_vars:14 simple_definition:3 singleton_clauses:0
[SAT presolve] [4.5284e-05s] clauses:11 literals:29 vars:17 one_side_vars:14 simple_definition:3 singleton_clauses:0
  2.95e-03s  3.43e-04d  [Probe] #probed=200 #new_bounds=14 #new_binary_clauses=1 
  2.59e-05s  0.00e+00d  [MaxClique] 
  3.50e-04s  0.00e+00d  [DetectDominanceRelations] 
  5.73e-03s  0.00e+00d  [PresolveToFixPoint] #num_loops=2 #num_dual_strengthening=1 
  1.19e-03s  0.00e+00d  [ProcessAtMostOneAndLinear] 
  7.10e-04s  0.00e+00d  [DetectDuplicateConstraints] #without_enforcements=79 
  3.10e-04s  1.12e-05d  [DetectDominatedLinearConstraints] #relevant_constraints=474 #num_inclusions=187 
  7.02e-05s  0.00e+00d  [DetectDifferentVariables] 
  1.23e-04s  3.68e-06d  [ProcessSetPPC] #relevant_constraints=287 
  1.53e-05s  0.00e+00d  [FindAlmostIdenticalLinearConstraints] 
  1.08e-04s  7.48e-05d  [FindBigAtMostOneAndLinearOverlap] 
  7.91e-04s  2.68e-04d  [FindBigVerticalLinearOverlap] #blocks=5 #saved_nz=248 
  6.00e-05s  1.05e-05d  [FindBigHorizontalLinearOverlap] #linears=266 
  2.23e-05s  1.05e-07d  [MergeClauses] 
  3.54e-04s  0.00e+00d  [DetectDominanceRelations] 
  4.45e-03s  0.00e+00d  [PresolveToFixPoint] #num_loops=2 #num_dual_strengthening=1 
  3.53e-04s  0.00e+00d  [DetectDominanceRelations] 
  3.46e-03s  0.00e+00d  [PresolveToFixPoint] #num_loops=1 #num_dual_strengthening=1 
[Symmetry] Graph for symmetry has 1'049 nodes and 4'778 arcs.
[Symmetry] Symmetry computation done. time: 0.000298988 dtime: 0.00037043
[SAT presolve] num removable Booleans: 0 / 45
[SAT presolve] num trivial clauses: 0
[SAT presolve] [0s] clauses:11 literals:29 vars:17 one_side_vars:14 simple_definition:3 singleton_clauses:0
[SAT presolve] [3.0976e-05s] clauses:11 literals:29 vars:17 one_side_vars:14 simple_definition:3 singleton_clauses:0
[SAT presolve] [4.3114e-05s] clauses:11 literals:29 vars:17 one_side_vars:14 simple_definition:3 singleton_clauses:0
  2.87e-03s  3.26e-04d  [Probe] #probed=200 #new_bounds=3 #new_binary_clauses=1 
  2.57e-05s  0.00e+00d  [MaxClique] 
  3.52e-04s  0.00e+00d  [DetectDominanceRelations] 
  4.09e-03s  0.00e+00d  [PresolveToFixPoint] #num_loops=2 #num_dual_strengthening=1 
  1.07e-03s  0.00e+00d  [ProcessAtMostOneAndLinear] 
  7.16e-04s  0.00e+00d  [DetectDuplicateConstraints] #without_enforcements=85 
  2.24e-04s  8.15e-06d  [DetectDominatedLinearConstraints] #relevant_constraints=409 #num_inclusions=57 
  7.18e-05s  0.00e+00d  [DetectDifferentVariables] 
  1.14e-04s  3.11e-06d  [ProcessSetPPC] #relevant_constraints=266 
  1.56e-05s  0.00e+00d  [FindAlmostIdenticalLinearConstraints] 
  1.07e-04s  6.84e-05d  [FindBigAtMostOneAndLinearOverlap] 
  5.92e-04s  2.38e-04d  [FindBigVerticalLinearOverlap] #blocks=1 #saved_nz=30 
  5.69e-05s  9.80e-06d  [FindBigHorizontalLinearOverlap] #linears=250 
  2.01e-05s  1.05e-07d  [MergeClauses] 
  3.63e-04s  0.00e+00d  [DetectDominanceRelations] 
  3.53e-03s  0.00e+00d  [PresolveToFixPoint] #num_loops=2 #num_dual_strengthening=1 
  3.50e-05s  0.00e+00d  [ExpandObjective] #entries=41 #tight_variables=18 #tight_constraints=9 

Presolve summary:
  - 33 affine relations were detected.
  - rule 'TODO dual: only one blocking constraint?' was applied 447 times.
  - rule 'TODO dual: only one unspecified blocking constraint?' was applied 78 times.
  - rule 'TODO duplicate: identical constraint with different enforcements' was applied 243 times.
  - rule 'TODO linear2: contains a Boolean.' was applied 56 times.
  - rule 'affine: new relation' was applied 33 times.
  - rule 'at_most_one: removed literals' was applied 1 time.
  - rule 'at_most_one: size one' was applied 1 time.
  - rule 'bool_or: always true' was applied 3 times.
  - rule 'bool_or: implications' was applied 4 times.
  - rule 'deductions: 114 stored' was applied 1 time.
  - rule 'dual: fix variable' was applied 12 times.
  - rule 'dual: reduced domain' was applied 37 times.
  - rule 'duplicate: merged rhs of linear constraint' was applied 25 times.
  - rule 'duplicate: removed constraint' was applied 168 times.
  - rule 'enforcement: false literal' was applied 13 times.
  - rule 'enforcement: true literal' was applied 12 times.
  - rule 'incompatible linear: add implication' was applied 27 times.
  - rule 'linear inclusion: redundant containing constraint' was applied 2 times.
  - rule 'linear inclusion: redundant included constraint' was applied 2 times.
  - rule 'linear matrix: common vertical rectangle' was applied 12 times.
  - rule 'linear1: always true' was applied 4 times.
  - rule 'linear2: contains a Boolean.' was applied 13 times.
  - rule 'linear: always true' was applied 321 times.
  - rule 'linear: doubleton free' was applied 7 times.
  - rule 'linear: empty' was applied 20 times.
  - rule 'linear: extracted enforcement literal' was applied 1'894 times.
  - rule 'linear: fixed or dup variables' was applied 856 times.
  - rule 'linear: negative clause' was applied 12 times.
  - rule 'linear: positive clause' was applied 2 times.
  - rule 'linear: positive equal one' was applied 3 times.
  - rule 'linear: reduced variable domains' was applied 85 times.
  - rule 'linear: remapped using affine relations' was applied 788 times.
  - rule 'linear: simplified rhs' was applied 2'795 times.
  - rule 'linear: variable substitution 1' was applied 7 times.
  - rule 'linear: variable substitution 2' was applied 1 time.
  - rule 'linear: variable substitution 3' was applied 1 time.
  - rule 'no_overlap: inferred from x != y constraints' was applied 1 time.
  - rule 'presolve: 57 unused variables removed.' was applied 1 time.
  - rule 'presolve: iteration' was applied 3 times.
  - rule 'probing: reduced enforced constraint to implication.' was applied 1 time.
  - rule 'probing: simplified enforcement list.' was applied 1 time.

Presolved optimization model '': (model_fingerprint: 0x8718fdc5d17bd22f)
#Variables: 102 (#ints: 6 in objective)
  - 45 Booleans in [0,1]
  - 1 in [-803,-465][-389,-51][25,363][439,777]
  - 1 in [-793,-443][-411,-29][3,385][417,799][831,1213][1245,1627][1659,1959]
  - 1 in [-382,-51][25,363][439,732]
  - 1 in [-345,-29][3,385][417,799][831,1213][1245,1545]
  - 1 in [0,252]
  - 1 in [0,269]
  - 4 in [0,275]
  - 1 in [0,303]
  - 1 in [0,319]
  - 3 in [0,330]
  - 3 in [0,335]
  - 1 in [0,338]
  - 1 in [0,358]
  - 3 in [0,382]
  - 1 in [3,333]
  - 1 in [3,385]
  - 1 in [5,351]
  - 2 in [7,345]
  - 1 in [7,345][421,753]
  - 1 in [7,353]
  - 1 in [10,356]
  - 1 in [25,363]
  - 1 in [27,365]
  - 1 in [32,370]
  - 2 in [45,403]
  - 1 in [51,409]
  - 1 in [69,385][417,799][831,1154]
  - 1 in [69,385][417,799][831,1213][1245,1550]
  - 1 in [69,399]
  - 1 in [70,345][421,759][835,1110]
  - 3 in [84,403]
  - 1 in [90,409]
  - 2 in [100,403]
  - 1 in [106,409]
  - 6 in [128,403]
  - 2 in [134,409]
  - 1 in [139,414]
#kBoolAnd: 2 (#enforced: 2) (#literals: 6)
#kBoolOr: 7 (#literals: 21)
#kExactlyOne: 3 (#literals: 9)
#kInterval: 4
#kLinear1: 16 (#enforced: 16 #multi: 6)
#kLinear2: 272 (#enforced: 235 #multi: 193)
#kLinear3: 99 (#enforced: 84 #multi: 52)
#kLinearN: 273 (#enforced: 225) (#terms: 2'053)
#kNoOverlap: 1 (#intervals: 4)

Preloading model.
#Bound   0.07s best:inf   next:[139,1915] initial_domain
[Symmetry] Graph for symmetry has 947 nodes and 4'743 arcs.
[Symmetry] Symmetry computation done. time: 0.000288886 dtime: 0.00036124
#Model   0.08s var:102/102 constraints:677/677

Starting search at 0.08s with 48 workers.
17 full problem subsolvers: [core, default_lp, fixed, lb_tree_search, max_lp, no_lp, objective_lb_search, objective_lb_search_max_lp, objective_lb_search_no_lp, objective_shaving_search_max_lp, objective_shaving_search_no_lp, probing, probing_max_lp, pseudo_costs, quick_restart, quick_restart_no_lp, reduced_costs]
29 first solution subsolvers: [fj_long_default(2), fj_long_lin_default, fj_long_lin_perturb, fj_long_lin_random, fj_long_perturb, fj_long_random, fj_short_default(2), fj_short_lin_default(2), fj_short_lin_perturb, fj_short_lin_random, fj_short_perturb, fj_short_random, fs_random(4), fs_random_no_lp(3), fs_random_quick_restart(4), fs_random_quick_restart_no_lp(3)]
15 incomplete subsolvers: [feasibility_pump, graph_arc_lns, graph_cst_lns, graph_dec_lns, graph_var_lns, rins/rens, rnd_cst_lns, rnd_var_lns, scheduling_intervals_lns, scheduling_precedences_lns, scheduling_time_window_lns, violation_ls(4)]
3 helper subsolvers: [neighborhood_helper, synchronization_agent, update_gap_integral]
#1       0.09s best:1165  next:[139,1164] no_lp (fixed_bools=0/82)
#Bound   0.09s best:1165  next:[140,1164] bool_core (num_cores=1 [size:3 mw:1 d:2] a=4 d=2 fixed=0/67 clauses=24)
#Bound   0.09s best:1165  next:[144,1164] objective_lb_search_no_lp
#Bound   0.09s best:1165  next:[145,1164] bool_core (num_cores=1 [cover] a=4 d=2 fixed=4/92 clauses=54)
#Bound   0.09s best:1165  next:[146,1164] bool_core (num_cores=1 [cover] a=4 d=2 fixed=5/97 clauses=66)
#Bound   0.09s best:1165  next:[147,1164] bool_core (num_cores=1 [cover] a=4 d=2 fixed=6/102 clauses=80)
#2       0.09s best:1052  next:[147,1051] quick_restart_no_lp (fixed_bools=4/103)
#Bound   0.09s best:1052  next:[148,1051] bool_core (num_cores=1 [cover] a=4 d=2 fixed=7/107 clauses=96)
#Bound   0.09s best:1052  next:[149,1051] bool_core (num_cores=1 [cover] a=4 d=2 fixed=8/112 clauses=115)
#Bound   0.09s best:1052  next:[174,1051] default_lp
#3       0.09s best:1051  next:[174,1050] quick_restart_no_lp (fixed_bools=4/127)
#4       0.09s best:1050  next:[174,1049] violation_ls(batch:1 #solutions_imported:1 #lin_moves:0 #lin_evals:3 #gen_moves:1 #gen_evals:0 #comp_moves:1 #backtracks:0 #weight_updates:0)
#5       0.09s best:560   next:[174,559]  no_lp (fixed_bools=0/94)
#6       0.09s best:559   next:[174,558]  violation_ls(batch:1 #solutions_imported:1 #lin_moves:18 #lin_evals:84 #weight_updates:11)
#7       0.09s best:548   next:[174,547]  no_lp (fixed_bools=0/100)
#8       0.10s best:536   next:[174,535]  no_lp (fixed_bools=0/110)
#Bound   0.10s best:536   next:[183,535]  default_lp
#9       0.10s best:535   next:[183,534]  quick_restart_no_lp (fixed_bools=9/186)
#10      0.10s best:530   next:[183,529]  no_lp (fixed_bools=0/119)
#Bound   0.10s best:530   next:[330,529]  objective_lb_search_no_lp
#11      0.11s best:525   next:[330,524]  quick_restart_no_lp (fixed_bools=9/208)
#12      0.11s best:524   next:[330,523]  violation_ls(batch:2 #solutions_imported:2 #lin_moves:0 #lin_evals:12 #gen_moves:5 #gen_evals:0 #comp_moves:5 #backtracks:0 #weight_updates:0)
#13      0.11s best:523   next:[330,522]  rnd_cst_lns (d=0.50 s=52 t=0.10 p=0.00 stall=0 h=auto_l0) [presolve]
#14      0.11s best:519   next:[330,518]  rnd_var_lns (d=0.71 s=51 t=0.10 p=1.00 stall=1 h=auto_l0) [presolve]
#15      0.11s best:491   next:[330,490]  no_lp (fixed_bools=0/125)
#16      0.12s best:481   next:[330,480]  graph_dec_lns (d=0.71 s=60 t=0.10 p=1.00 stall=1 h=auto_l0)
#17      0.12s best:445   next:[330,444]  no_lp (fixed_bools=2/149)
#18      0.13s best:424   next:[330,423]  no_lp (fixed_bools=2/155)
#19      0.14s best:406   next:[330,405]  no_lp (fixed_bools=2/170)
#Bound   0.15s best:406   next:[331,405]  objective_lb_search_no_lp
#Bound   0.16s best:406   next:[333,405]  objective_lb_search_no_lp
#Bound   0.18s best:406   next:[341,405]  objective_lb_search_no_lp
#Model   0.19s var:101/102 constraints:560/677
#Bound   0.19s best:406   next:[342,405]  objective_lb_search_no_lp
#Bound   0.20s best:406   next:[345,405]  objective_lb_search_no_lp
#Model   0.20s var:100/102 constraints:548/677
#Bound   0.20s best:406   next:[346,405]  objective_lb_search_no_lp
#Bound   0.21s best:406   next:[350,405]  objective_lb_search_no_lp
#Bound   0.23s best:406   next:[351,405]  objective_lb_search_no_lp
#Bound   0.23s best:406   next:[356,405]  objective_lb_search_no_lp
#Bound   0.24s best:406   next:[358,405]  objective_lb_search_no_lp
#Model   0.25s var:99/102 constraints:535/677
#Model   0.25s var:98/102 constraints:514/677
#Model   0.26s var:93/102 constraints:422/677
#Done    0.27s no_lp
#Done    0.27s objective_lb_search_no_lp
#Done    0.27s quick_restart
#Done    0.27s default_lp
#Done    0.27s core
#Model   0.27s var:78/102 constraints:179/677
#Done    0.27s objective_lb_search
#Done    0.27s pseudo_costs
#Done    0.27s max_lp
#Bound   0.27s best:406   next:[393,405]  objective_lb_search_no_lp [skipped_logs=5]

Task timing                                  n [     min,      max]      avg      dev     time         n [     min,      max]      avg      dev    dtime
                             'core':         1 [194.52ms, 194.52ms] 194.52ms   0.00ns 194.52ms         1 [ 95.78ms,  95.78ms]  95.78ms   0.00ns  95.78ms
                       'default_lp':         1 [192.45ms, 192.45ms] 192.45ms   0.00ns 192.45ms         1 [ 12.31ms,  12.31ms]  12.31ms   0.00ns  12.31ms
                 'feasibility_pump':         5 [112.86us,  26.34ms]   6.52ms  10.14ms  32.58ms         4 [ 13.18us,   3.75ms] 966.72us   1.61ms   3.87ms
                            'fixed':         1 [194.42ms, 194.42ms] 194.42ms   0.00ns 194.42ms         1 [ 16.93ms,  16.93ms]  16.93ms   0.00ns  16.93ms
                  'fj_long_default':         0 [  0.00ns,   0.00ns]   0.00ns   0.00ns   0.00ns         0 [  0.00ns,   0.00ns]   0.00ns   0.00ns   0.00ns
                  'fj_long_default':         0 [  0.00ns,   0.00ns]   0.00ns   0.00ns   0.00ns         0 [  0.00ns,   0.00ns]   0.00ns   0.00ns   0.00ns
              'fj_long_lin_default':         0 [  0.00ns,   0.00ns]   0.00ns   0.00ns   0.00ns         0 [  0.00ns,   0.00ns]   0.00ns   0.00ns   0.00ns
              'fj_long_lin_perturb':         0 [  0.00ns,   0.00ns]   0.00ns   0.00ns   0.00ns         0 [  0.00ns,   0.00ns]   0.00ns   0.00ns   0.00ns
               'fj_long_lin_random':         0 [  0.00ns,   0.00ns]   0.00ns   0.00ns   0.00ns         0 [  0.00ns,   0.00ns]   0.00ns   0.00ns   0.00ns
                  'fj_long_perturb':         0 [  0.00ns,   0.00ns]   0.00ns   0.00ns   0.00ns         0 [  0.00ns,   0.00ns]   0.00ns   0.00ns   0.00ns
                   'fj_long_random':         0 [  0.00ns,   0.00ns]   0.00ns   0.00ns   0.00ns         0 [  0.00ns,   0.00ns]   0.00ns   0.00ns   0.00ns
                 'fj_short_default':         0 [  0.00ns,   0.00ns]   0.00ns   0.00ns   0.00ns         0 [  0.00ns,   0.00ns]   0.00ns   0.00ns   0.00ns
                 'fj_short_default':         1 [ 53.46ms,  53.46ms]  53.46ms   0.00ns  53.46ms         1 [ 31.41ms,  31.41ms]  31.41ms   0.00ns  31.41ms
             'fj_short_lin_default':         0 [  0.00ns,   0.00ns]   0.00ns   0.00ns   0.00ns         0 [  0.00ns,   0.00ns]   0.00ns   0.00ns   0.00ns
             'fj_short_lin_default':         0 [  0.00ns,   0.00ns]   0.00ns   0.00ns   0.00ns         0 [  0.00ns,   0.00ns]   0.00ns   0.00ns   0.00ns
             'fj_short_lin_perturb':         0 [  0.00ns,   0.00ns]   0.00ns   0.00ns   0.00ns         0 [  0.00ns,   0.00ns]   0.00ns   0.00ns   0.00ns
              'fj_short_lin_random':         0 [  0.00ns,   0.00ns]   0.00ns   0.00ns   0.00ns         0 [  0.00ns,   0.00ns]   0.00ns   0.00ns   0.00ns
                 'fj_short_perturb':         0 [  0.00ns,   0.00ns]   0.00ns   0.00ns   0.00ns         0 [  0.00ns,   0.00ns]   0.00ns   0.00ns   0.00ns
                  'fj_short_random':         0 [  0.00ns,   0.00ns]   0.00ns   0.00ns   0.00ns         0 [  0.00ns,   0.00ns]   0.00ns   0.00ns   0.00ns
                        'fs_random':         1 [  6.72ms,   6.72ms]   6.72ms   0.00ns   6.72ms         0 [  0.00ns,   0.00ns]   0.00ns   0.00ns   0.00ns
                        'fs_random':         1 [  7.15ms,   7.15ms]   7.15ms   0.00ns   7.15ms         1 [ 20.00ns,  20.00ns]  20.00ns   0.00ns  20.00ns
                        'fs_random':         1 [  7.35ms,   7.35ms]   7.35ms   0.00ns   7.35ms         0 [  0.00ns,   0.00ns]   0.00ns   0.00ns   0.00ns
                        'fs_random':         1 [  8.73ms,   8.73ms]   8.73ms   0.00ns   8.73ms         1 [ 20.00ns,  20.00ns]  20.00ns   0.00ns  20.00ns
                  'fs_random_no_lp':         1 [  5.49ms,   5.49ms]   5.49ms   0.00ns   5.49ms         0 [  0.00ns,   0.00ns]   0.00ns   0.00ns   0.00ns
                  'fs_random_no_lp':         1 [  6.38ms,   6.38ms]   6.38ms   0.00ns   6.38ms         0 [  0.00ns,   0.00ns]   0.00ns   0.00ns   0.00ns
                  'fs_random_no_lp':         1 [  7.06ms,   7.06ms]   7.06ms   0.00ns   7.06ms         0 [  0.00ns,   0.00ns]   0.00ns   0.00ns   0.00ns
          'fs_random_quick_restart':         1 [  7.05ms,   7.05ms]   7.05ms   0.00ns   7.05ms         1 [ 20.00ns,  20.00ns]  20.00ns   0.00ns  20.00ns
          'fs_random_quick_restart':         1 [  7.63ms,   7.63ms]   7.63ms   0.00ns   7.63ms         0 [  0.00ns,   0.00ns]   0.00ns   0.00ns   0.00ns
          'fs_random_quick_restart':         1 [  7.91ms,   7.91ms]   7.91ms   0.00ns   7.91ms         0 [  0.00ns,   0.00ns]   0.00ns   0.00ns   0.00ns
          'fs_random_quick_restart':         1 [  8.30ms,   8.30ms]   8.30ms   0.00ns   8.30ms         1 [ 20.00ns,  20.00ns]  20.00ns   0.00ns  20.00ns
    'fs_random_quick_restart_no_lp':         1 [  5.84ms,   5.84ms]   5.84ms   0.00ns   5.84ms         0 [  0.00ns,   0.00ns]   0.00ns   0.00ns   0.00ns
    'fs_random_quick_restart_no_lp':         1 [  6.27ms,   6.27ms]   6.27ms   0.00ns   6.27ms         0 [  0.00ns,   0.00ns]   0.00ns   0.00ns   0.00ns
    'fs_random_quick_restart_no_lp':         1 [  7.05ms,   7.05ms]   7.05ms   0.00ns   7.05ms         0 [  0.00ns,   0.00ns]   0.00ns   0.00ns   0.00ns
                    'graph_arc_lns':         5 [  2.96ms,  12.42ms]   5.03ms   3.70ms  25.17ms         3 [ 25.00ns, 260.83us] 100.38us 114.64us 301.13us
                    'graph_cst_lns':         5 [565.15us, 707.55us] 625.61us  45.92us   3.13ms         0 [  0.00ns,   0.00ns]   0.00ns   0.00ns   0.00ns
                    'graph_dec_lns':         5 [  2.65ms,   7.27ms]   4.66ms   1.75ms  23.28ms         4 [ 10.00ns,  38.49us]  24.14us  15.28us  96.56us
                    'graph_var_lns':         5 [  1.12ms,   2.58ms]   1.62ms 524.40us   8.11ms         2 [ 10.00ns,  10.00ns]  10.00ns   0.00ns  20.00ns
                   'lb_tree_search':         1 [193.75ms, 193.75ms] 193.75ms   0.00ns 193.75ms         1 [ 18.84ms,  18.84ms]  18.84ms   0.00ns  18.84ms
                           'max_lp':         1 [195.16ms, 195.16ms] 195.16ms   0.00ns 195.16ms         1 [ 10.92ms,  10.92ms]  10.92ms   0.00ns  10.92ms
                            'no_lp':         1 [190.65ms, 190.65ms] 190.65ms   0.00ns 190.65ms         1 [ 23.32ms,  23.32ms]  23.32ms   0.00ns  23.32ms
              'objective_lb_search':         1 [193.29ms, 193.29ms] 193.29ms   0.00ns 193.29ms         1 [ 18.14ms,  18.14ms]  18.14ms   0.00ns  18.14ms
       'objective_lb_search_max_lp':         1 [192.29ms, 192.29ms] 192.29ms   0.00ns 192.29ms         1 [ 14.96ms,  14.96ms]  14.96ms   0.00ns  14.96ms
        'objective_lb_search_no_lp':         1 [188.54ms, 188.54ms] 188.54ms   0.00ns 188.54ms         1 [ 20.81ms,  20.81ms]  20.81ms   0.00ns  20.81ms
  'objective_shaving_search_max_lp':         5 [  2.19ms,  19.64ms]  11.76ms   6.27ms  58.81ms         2 [236.77us, 253.85us] 245.31us   8.54us 490.62us
   'objective_shaving_search_no_lp':         5 [  2.11ms,  35.31ms]  15.08ms  11.38ms  75.39ms         2 [236.60us, 752.94us] 494.77us 258.17us 989.54us
                          'probing':         1 [197.34ms, 197.34ms] 197.34ms   0.00ns 197.34ms         1 [  8.98ms,   8.98ms]   8.98ms   0.00ns   8.98ms
                   'probing_max_lp':         1 [192.43ms, 192.43ms] 192.43ms   0.00ns 192.43ms         1 [ 12.55ms,  12.55ms]  12.55ms   0.00ns  12.55ms
                     'pseudo_costs':         1 [194.21ms, 194.21ms] 194.21ms   0.00ns 194.21ms         1 [ 12.06ms,  12.06ms]  12.06ms   0.00ns  12.06ms
                    'quick_restart':         1 [191.71ms, 191.71ms] 191.71ms   0.00ns 191.71ms         1 [ 10.60ms,  10.60ms]  10.60ms   0.00ns  10.60ms
              'quick_restart_no_lp':         1 [193.57ms, 193.57ms] 193.57ms   0.00ns 193.57ms         1 [ 24.94ms,  24.94ms]  24.94ms   0.00ns  24.94ms
                    'reduced_costs':         1 [194.53ms, 194.53ms] 194.53ms   0.00ns 194.53ms         1 [ 23.03ms,  23.03ms]  23.03ms   0.00ns  23.03ms
                        'rins/rens':         5 [ 77.49us,  20.79ms]  12.14ms   9.24ms  60.71ms         4 [ 10.00ns,   1.81ms] 913.49us 692.80us   3.65ms
                      'rnd_cst_lns':         5 [606.62us,   3.72ms]   1.79ms   1.09ms   8.97ms         1 [ 10.00ns,  10.00ns]  10.00ns   0.00ns  10.00ns
                      'rnd_var_lns':         5 [  1.89ms,  12.80ms]   4.46ms   4.19ms  22.28ms         3 [ 10.00ns, 373.86us] 126.74us 174.76us 380.22us
         'scheduling_intervals_lns':         5 [ 13.22ms, 169.54ms]  90.65ms  62.14ms 453.27ms         1 [ 40.97ms,  40.97ms]  40.97ms   0.00ns  40.97ms
       'scheduling_precedences_lns':         5 [ 12.73ms, 110.95ms]  67.19ms  37.14ms 335.95ms         3 [  6.35ms,  10.73ms]   8.64ms   1.79ms  25.91ms
       'scheduling_time_window_lns':         5 [ 12.33ms, 127.23ms]  72.81ms  43.26ms 364.05ms         3 [  6.52ms,  11.65ms]   9.57ms   2.20ms  28.70ms
                     'violation_ls':         3 [ 17.70ms,  85.36ms]  56.68ms  28.57ms 170.05ms         3 [ 10.81ms,  40.39ms]  26.95ms  12.22ms  80.84ms
                     'violation_ls':         3 [ 18.27ms,  82.68ms]  42.79ms  28.45ms 128.38ms         3 [ 11.28ms,  51.07ms]  24.79ms  18.58ms  74.38ms
                     'violation_ls':         3 [197.26us, 102.27ms]  34.36ms  48.02ms 103.08ms         3 [340.00ns,  48.36ms]  16.12ms  22.79ms  48.36ms
                     'violation_ls':         4 [423.60us,  89.38ms]  26.11ms  36.91ms 104.43ms         4 [ 86.65us,  46.72ms]  13.99ms  19.25ms  55.98ms

Search stats                        Bools  Conflicts  Branches  Restarts  BoolPropag  IntegerPropag
                           'core':  1'050        428     2'159       786     197'444         98'532
                     'default_lp':     92         59       634       293       1'624         15'761
                          'fixed':    179        167     1'382       338      10'579         45'294
                      'fs_random':     60          0         0         0           0              0
                      'fs_random':     60          0         0         0           0              0
                      'fs_random':     60          0         0         0           0              0
                      'fs_random':     60          0        34        34          31            173
                'fs_random_no_lp':     60          0         0         0           0              0
                'fs_random_no_lp':     60          0         0         0           0              0
                'fs_random_no_lp':     60          0         2         2           4              9
        'fs_random_quick_restart':     60          0         0         0           0              0
        'fs_random_quick_restart':     60          0         0         0           0              0
        'fs_random_quick_restart':     60          0         0         0           0              0
        'fs_random_quick_restart':     60          0         0         0           0              0
  'fs_random_quick_restart_no_lp':     60          0         0         0           0              0
  'fs_random_quick_restart_no_lp':     60          0         0         0           0              0
  'fs_random_quick_restart_no_lp':     60          0         0         0           0              0
                 'lb_tree_search':     66          1       145       132          77            937
                         'max_lp':     60          1       120       120         107            984
                          'no_lp':    176        493     2'461       647      24'903        117'035
            'objective_lb_search':     70        105       479       228       2'184         20'434
     'objective_lb_search_max_lp':     76         15       167       132         318          2'796
      'objective_lb_search_no_lp':     81        580     1'786       556      11'142        106'028
                        'probing':    108         22       195       195         585          2'947
                 'probing_max_lp':     68          1       136       136          94            894
                   'pseudo_costs':     71          3       137       121         152          1'239
                  'quick_restart':     61         13       636       358         986         10'383
            'quick_restart_no_lp':    298        551     3'285       724      41'638        112'982
                  'reduced_costs':    115         31       192       133         796          4'987

SAT stats                           ClassicMinim  LitRemoved  LitLearned  LitForgotten  Subsumed  MClauses  MDecisions  MLitTrue  MSubsumed  MLitRemoved  MReused
                           'core':           258         823         983             0         5       221       1'085         0         19           67        6
                     'default_lp':            18          29         355             0         5        27         127         0          5           24        2
                          'fixed':            96         184         910             0         5       129         362        11        104          698        2
                      'fs_random':             0           0           0             0         0         0           0         0          0            0        0
                      'fs_random':             0           0           0             0         0         0           0         0          0            0        0
                      'fs_random':             0           0           0             0         0         0           0         0          0            0        0
                      'fs_random':             0           0           0             0         0         0           0         0          0            0        0
                'fs_random_no_lp':             0           0           0             0         0         0           0         0          0            0        0
                'fs_random_no_lp':             0           0           0             0         0         0           0         0          0            0        0
                'fs_random_no_lp':             0           0           0             0         0         0           0         0          0            0        0
        'fs_random_quick_restart':             0           0           0             0         0         0           0         0          0            0        0
        'fs_random_quick_restart':             0           0           0             0         0         0           0         0          0            0        0
        'fs_random_quick_restart':             0           0           0             0         0         0           0         0          0            0        0
        'fs_random_quick_restart':             0           0           0             0         0         0           0         0          0            0        0
  'fs_random_quick_restart_no_lp':             0           0           0             0         0         0           0         0          0            0        0
  'fs_random_quick_restart_no_lp':             0           0           0             0         0         0           0         0          0            0        0
  'fs_random_quick_restart_no_lp':             0           0           0             0         0         0           0         0          0            0        0
                 'lb_tree_search':             0           0           1             0         0         0           0         0          0            0        0
                         'max_lp':             0           0           0             0         0         0           0         0          0            0        0
                          'no_lp':           370       1'023       3'365             0        25        99         527         0         16           89       15
            'objective_lb_search':            65         122         575             0         8        20          95         0          2            6        2
     'objective_lb_search_max_lp':             3           4         118             0         1         0           0         0          0            0        0
      'objective_lb_search_no_lp':           418       1'022       2'649             0        46       118         660         0         20          108       12
                        'probing':             0           0          22             0         0         0           0         0          0            0        0
                 'probing_max_lp':             0           0           1             0         0         0           0         0          0            0        0
                   'pseudo_costs':             0           0           6             0         0         0           0         0          0            0        0
                  'quick_restart':             0           0          14             0         0        42         202         0          2            6        4
            'quick_restart_no_lp':           326         924       3'381             0        11       136         679         1         45          230        9
                  'reduced_costs':            11          16         147             0         0         0           0         0          0            0        0

Lp stats                         Component  Iterations  AddedCuts  OPTIMAL  DUAL_F.  DUAL_U.
                  'default_lp':          1         465        772       99        0        0
                       'fixed':          1         449        722      189        0        0
                   'fs_random':          1           0          0        0        0        0
                   'fs_random':          1           0          0        0        0        0
                   'fs_random':          1           0          0        0        0        0
                   'fs_random':          1           0          0        0        0        0
     'fs_random_quick_restart':          1           0          0        0        0        0
     'fs_random_quick_restart':          1           0          0        0        0        0
     'fs_random_quick_restart':          1           0          0        0        0        0
     'fs_random_quick_restart':          1           0          0        0        0        0
              'lb_tree_search':          1         407      1'013       19        2        0
                      'max_lp':          1         270      1'101       11        0        0
         'objective_lb_search':          1         874        712      150        0        0
  'objective_lb_search_max_lp':          1         627      1'074       45        8        0
                     'probing':          1         320        899       57        0        0
              'probing_max_lp':          1         265      1'028       18        0        0
                'pseudo_costs':          1         525      1'021       34        2        0
               'quick_restart':          1         320        846       52        0        0
               'reduced_costs':          1         943        888       59       19        0

Lp dimension                                                                     Final dimension of first component
                  'default_lp':   397 rows, 96 columns, 1665 entries with magnitude in [8.191220e-05, 1.000000e+00]
                       'fixed':   242 rows, 96 columns, 1444 entries with magnitude in [1.436785e-03, 1.000000e+00]
                   'fs_random':        0 rows, 96 columns, 0 entries with magnitude in [0.000000e+00, 0.000000e+00]
                   'fs_random':        0 rows, 96 columns, 0 entries with magnitude in [0.000000e+00, 0.000000e+00]
                   'fs_random':        0 rows, 96 columns, 0 entries with magnitude in [0.000000e+00, 0.000000e+00]
                   'fs_random':        0 rows, 96 columns, 0 entries with magnitude in [0.000000e+00, 0.000000e+00]
     'fs_random_quick_restart':        0 rows, 96 columns, 0 entries with magnitude in [0.000000e+00, 0.000000e+00]
     'fs_random_quick_restart':        0 rows, 96 columns, 0 entries with magnitude in [0.000000e+00, 0.000000e+00]
     'fs_random_quick_restart':        0 rows, 96 columns, 0 entries with magnitude in [0.000000e+00, 0.000000e+00]
     'fs_random_quick_restart':        0 rows, 96 columns, 0 entries with magnitude in [0.000000e+00, 0.000000e+00]
              'lb_tree_search':  947 rows, 102 columns, 4913 entries with magnitude in [1.337587e-03, 1.000000e+00]
                      'max_lp':  926 rows, 102 columns, 5117 entries with magnitude in [1.263615e-03, 1.000000e+00]
         'objective_lb_search':   231 rows, 96 columns, 1130 entries with magnitude in [5.780313e-04, 1.000000e+00]
  'objective_lb_search_max_lp':  497 rows, 102 columns, 2312 entries with magnitude in [6.675573e-05, 1.000000e+00]
                     'probing':   476 rows, 96 columns, 3548 entries with magnitude in [5.395184e-04, 1.000000e+00]
              'probing_max_lp':  915 rows, 102 columns, 6010 entries with magnitude in [8.665501e-04, 1.000000e+00]
                'pseudo_costs':  542 rows, 102 columns, 2710 entries with magnitude in [8.366077e-04, 1.000000e+00]
               'quick_restart':   429 rows, 96 columns, 2019 entries with magnitude in [7.110788e-04, 1.000000e+00]
               'reduced_costs':  460 rows, 102 columns, 2274 entries with magnitude in [4.519733e-04, 1.000000e+00]

Lp debug                         CutPropag  CutEqPropag  Adjust  Overflow    Bad  BadScaling
                  'default_lp':          1            2      25         0  1'565           0
                       'fixed':          3            0      23         0  1'102           0
                   'fs_random':          0            0       0         0      0           0
                   'fs_random':          0            0       0         0      0           0
                   'fs_random':          0            0       0         0      0           0
                   'fs_random':          0            0       0         0      0           0
     'fs_random_quick_restart':          0            0       0         0      0           0
     'fs_random_quick_restart':          0            0       0         0      0           0
     'fs_random_quick_restart':          0            0       0         0      0           0
     'fs_random_quick_restart':          0            0       0         0      0           0
              'lb_tree_search':          2            0      18         0    733           0
                      'max_lp':          5           12      10         0    932           0
         'objective_lb_search':          4            0     104         0  1'273           0
  'objective_lb_search_max_lp':          9            0      43         0  1'101           0
                     'probing':          1            0      35         0  2'252           0
              'probing_max_lp':          4            0      10         0  1'443           0
                'pseudo_costs':          9            0      28         0  1'562           0
               'quick_restart':          3           11      43         0  2'076           0
               'reduced_costs':          4            0      65         0    976           0

Lp pool                          Constraints  Updates  Simplif  Merged  Shortened  Split  Strenghtened    Cuts/Call
                  'default_lp':          872      247      985       3        549     24           805    772/1'376
                       'fixed':          799      160      280      26          0      5           462    722/1'256
                   'fs_random':          103        0        0       0          0      0             0          0/0
                   'fs_random':          103        0        0       0          0      0             0          0/0
                   'fs_random':          103        0        0       0          0      0             0          0/0
                   'fs_random':          103        0        0       0          0      0             0          0/0
     'fs_random_quick_restart':          103        0        0       0          0      0             0          0/0
     'fs_random_quick_restart':          103        0        0       0          0      0             0          0/0
     'fs_random_quick_restart':          103        0        0       0          0      0             0          0/0
     'fs_random_quick_restart':          103        0        0       0          0      0             0          0/0
              'lb_tree_search':        1'678       77    1'139       9        240     17         1'834  1'013/1'701
                      'max_lp':        1'765       92      852      10          0     20         2'107  1'101/1'815
         'objective_lb_search':          811      154      294       4          0     48           421    712/1'269
  'objective_lb_search_max_lp':        1'724      127    1'609      24          0      3         3'108  1'074/1'759
                     'probing':        1'002      199      267       0          0     18           422    899/1'502
              'probing_max_lp':        1'696        7       66       6          0     18           350  1'028/1'655
                'pseudo_costs':        1'693      133    1'907       2        118      5         2'870  1'021/1'808
               'quick_restart':          946      283    1'128       3        649     47           728    846/1'467
               'reduced_costs':        1'560      105    1'314       2         97      0         2'266    888/1'554

Lp Cut                                         defaul  fixed  max_lp  quick_  reduce  pseudo  lb_tre  probin  object  probin  object
                                       CG_FF:      50     47     130     108      66      75     109      60      49     113      98
                                        CG_K:       2     15      27      16      22      29      17       7      12      19      41
                                        CG_R:      19     22      78      25      28      28      68      24      20      76      41
                                       CG_RB:     302    216     279     326     224     227     244     378     248     277     282
                                      CG_RBP:      33     31      52      28      18      16      36      42      25      35      51
                                      Clique:       -      -       -       -       5       2      13       -       -       -       9
                                          IB:     123    154      76     115     118     119      78     116     124      73     152
                                    MIR_1_FF:      39     34      62      27      64      71      59      31      35      53      67
                                     MIR_1_K:       5      7      13       9       4       7      16       7       5      13       8
                                     MIR_1_R:       3      4       8       4       8       9       8       2       4       5       8
                                    MIR_1_RB:      61     62      80      61      63      76      70      69      50      66      58
                                   MIR_1_RBP:       2      3      26       4      11      11      21       7       4      22      10
                                   MIR_1_RLT:       -      -       -       -       9       9       -       -       -       -       9
                                    MIR_2_FF:       7     11      14       7      36      40      22      10      11      20      30
                                     MIR_2_K:       2      5       8       2       8      13       5       3       2       8       8
                                     MIR_2_R:       3      4       7       3      15      16      10       4       4       8      13
                                    MIR_2_RB:      19     23      25      14      34      44      26      24      23      25      34
                                   MIR_2_RBP:       1      1      10       4       9      13      14       4       2      13       8
                                    MIR_3_FF:       2      4       8       4       7       9      12       6       3      12      11
                                     MIR_3_K:       -      -       7       -       5       6       6       2       1       5       5
                                     MIR_3_R:       2      -       7       5       9      18       6       5       2       5       5
                                    MIR_3_RB:       9      6      19      10      16      29      14      10      12      13      16
                                   MIR_3_RBP:       1      -       8       2       2       4       7       3       1       4       -
                                    MIR_4_FF:       2      2       8       -       4       7       7       1       3      11       4
                                     MIR_4_K:       1      1       2       -       -       5       -       -       -       3       2
                                     MIR_4_R:       2      1       4       1       3       7       1       -       1       2       3
                                    MIR_4_RB:       7      2      10       2       8      14       6       8       6      10       4
                                   MIR_4_RBP:       1      1       2       -       -       1       1       -       -       2       4
                                    MIR_5_FF:       1      2       7       -       2       2       5       1       3       6       1
                                     MIR_5_K:       -      1       3       -       1       -       2       -       -       2       -
                                     MIR_5_R:       -      1       5       -       1       -       2       1       1       3       1
                                    MIR_5_RB:       1      1       8       -       3       2       5       2       3       4       1
                                   MIR_5_RBP:       -      -       3       -       -       -       2       -       1       2       -
                                    MIR_6_FF:       1      -       3       -       -       1       3       -       2       5       -
                                     MIR_6_K:       -      -       1       -       -       1       -       -       -       -       -
                                     MIR_6_R:       -      -       3       -       -       2       2       -       1       2       -
                                    MIR_6_RB:       -      -       4       -       -       1       3       -       2       4       -
                                   MIR_6_RBP:       -      -       1       -       -       1       -       -       -       1       -
  NoOverlapCompletionTimeExhaustive_weighted:       -      -       2       -       -       -       2       -       -       2       -
                 NoOverlapDisjunctionOnStart:       -      -       2       -       -       1       2       -       -       2       1
                                ZERO_HALF_FF:      13     10      18       5      19      19      19      11      10      17      19
                                 ZERO_HALF_K:       2      1       3       1       3       2       5       3       2       7       4
                                 ZERO_HALF_R:      30     27      41      36      37      46      50      32      20      45      37
                                ZERO_HALF_RB:      20     18      19      23      24      34      23      22      17      22      24
                               ZERO_HALF_RBP:       6      5       8       4       2       4      12       4       3      11       5

LNS stats                        Improv/Calls  Closed  Difficulty  TimeLimit
               'graph_arc_lns':           3/5    100%        0.94       0.10
               'graph_cst_lns':           0/0      0%        0.50       0.10
               'graph_dec_lns':           3/5    100%        0.94       0.10
               'graph_var_lns':           4/5    100%        0.94       0.10
                   'rins/rens':           0/4    100%        0.91       0.10
                 'rnd_cst_lns':           4/4    100%        0.91       0.10
                 'rnd_var_lns':           3/5    100%        0.94       0.10
    'scheduling_intervals_lns':           2/4      0%        0.09       0.10
  'scheduling_precedences_lns':           2/4     50%        0.60       0.10
  'scheduling_time_window_lns':           2/4     50%        0.60       0.10

LS stats                   Batches  Restarts  LinMoves  GenMoves  CompoundMoves  WeightUpdates
       'fj_long_default':        0         0         0         0              0              0
       'fj_long_default':        0         0         0         0              0              0
   'fj_long_lin_default':        0         0         0         0              0              0
   'fj_long_lin_perturb':        0         0         0         0              0              0
    'fj_long_lin_random':        0         0         0         0              0              0
       'fj_long_perturb':        0         0         0         0              0              0
        'fj_long_random':        0         0         0         0              0              0
      'fj_short_default':        0         0         0         0              0              0
      'fj_short_default':        1         1         0     2'993            265              9
  'fj_short_lin_default':        0         0         0         0              0              0
  'fj_short_lin_default':        0         0         0         0              0              0
  'fj_short_lin_perturb':        0         0         0         0              0              0
   'fj_short_lin_random':        0         0         0         0              0              0
      'fj_short_perturb':        0         0         0         0              0              0
       'fj_short_random':        0         0         0         0              0              0
          'violation_ls':        3         0    14'443     1'367             31          1'664
          'violation_ls':        3         0     2'578     6'938            377            467
          'violation_ls':        3         0     9'130         5              5            870
          'violation_ls':        4         0        18     8'921            569             71

Solutions (19)            Num     Rank
        'graph_dec_lns':    1  [16,16]
                'no_lp':    9   [1,19]
  'quick_restart_no_lp':    4   [2,11]
          'rnd_cst_lns':    1  [13,13]
          'rnd_var_lns':    1  [14,14]
         'violation_ls':    3   [4,12]

Objective bounds                Num
                  'bool_core':    6
                 'default_lp':    2
             'initial_domain':    1
  'objective_lb_search_no_lp':   18

Solution repositories    Added  Queried  Ignored  Synchro
  'feasible solutions':     56      116        2       35
        'lp solutions':      0        0        0        0
                'pump':     26        4

Improving bounds shared          Num
                        'core':    8
                  'default_lp':   51
                       'fixed':   21
              'lb_tree_search':    1
                      'max_lp':    1
                       'no_lp':  185
         'objective_lb_search':   30
  'objective_lb_search_max_lp':    6
   'objective_lb_search_no_lp':   56
              'probing_max_lp':    1
                'pseudo_costs':    3
               'quick_restart':   78
         'quick_restart_no_lp':  171

Clauses shared                  Num
                 'default_lp':    5
                      'fixed':    5
                      'no_lp':   38
        'objective_lb_search':    6
  'objective_lb_search_no_lp':   10
              'quick_restart':   12
        'quick_restart_no_lp':   28

CpSolverResponse summary:
status: OPTIMAL
objective: 406
best_bound: 406
integers: 97
booleans: 60
conflicts: 0
branches: 34
propagations: 31
integer_propagations: 173
restarts: 34
lp_iterations: 0
walltime: 0.28896
usertime: 0.28896
deterministic_time: 0.722661
gap_integral: 2.36989
solution_fingerprint: 0x78084746abc2d7a4


--- Simulation Gantt  partir du modle mathmatique ---
{'big':0, 'due_date':162, 'pos_time':5, 'status':1, 'blocked':1, 'operations':["{'type':0, 'processing_time':60}", "{'type':1, 'processing_time':10}"]}
{'big':0, 'due_date':56, 'pos_time':5, 'status':0, 'blocked':1, 'operations':["{'type':1, 'processing_time':24}"]}
{'big':1, 'due_date':95, 'pos_time':5, 'status':3, 'blocked':0, 'operations':["{'type':1, 'processing_time':19}", "{'type':0, 'processing_time':39}"]}
{'big':1, 'due_date':111, 'pos_time':5, 'status':1, 'blocked':2, 'operations':["{'type':0, 'processing_time':53}"]}
{'big':0, 'due_date':145, 'pos_time':5, 'status':2, 'blocked':1, 'operations':["{'type':0, 'processing_time':19}", "{'type':1, 'processing_time':46}"]}
