created virtual environment CPython3.12.4.final.0-64 in 330ms
  creator CPython3Posix(dest=/localscratch/aneumann.46806169.0/env, clear=False, no_vcs_ignore=False, global=False)
  seeder FromAppData(download=False, pip=bundle, via=copy, app_data_dir=/home/aneumann/.local/share/virtualenv)
    added seed packages: pip==24.2+computecanada
  activators BashActivator,CShellActivator,FishActivator,NushellActivator,PowerShellActivator,PythonActivator
Looking in links: /cvmfs/soft.computecanada.ca/custom/python/wheelhouse/gentoo2023/x86-64-v3, /cvmfs/soft.computecanada.ca/custom/python/wheelhouse/gentoo2023/generic, /cvmfs/soft.computecanada.ca/custom/python/wheelhouse/generic
Requirement already satisfied: pip in /localscratch/aneumann.46806169.0/env/lib/python3.12/site-packages (24.2+computecanada)
Processing /cvmfs/soft.computecanada.ca/custom/python/wheelhouse/generic/pip-25.0+computecanada-py3-none-any.whl
Installing collected packages: pip
  Attempting uninstall: pip
    Found existing installation: pip 24.2+computecanada
    Uninstalling pip-24.2+computecanada:
      Successfully uninstalled pip-24.2+computecanada
Successfully installed pip-24.2+computecanada
Looking in links: /cvmfs/soft.computecanada.ca/custom/python/wheelhouse/gentoo2023/x86-64-v3, /cvmfs/soft.computecanada.ca/custom/python/wheelhouse/gentoo2023/generic, /cvmfs/soft.computecanada.ca/custom/python/wheelhouse/generic
ERROR: protobuf-5.28.3-cp38-abi3-manylinux2014_x86_64.whl is not a supported wheel on this platform.
Looking in links: /cvmfs/soft.computecanada.ca/custom/python/wheelhouse/gentoo2023/x86-64-v3, /cvmfs/soft.computecanada.ca/custom/python/wheelhouse/gentoo2023/generic, /cvmfs/soft.computecanada.ca/custom/python/wheelhouse/generic
Processing /home/aneumann/projects/def-adhaj/aneumann/GNRS/wheels/immutabledict-4.2.0-py3-none-any.whl
Installing collected packages: immutabledict
Successfully installed immutabledict-4.2.0
Looking in links: /cvmfs/soft.computecanada.ca/custom/python/wheelhouse/gentoo2023/x86-64-v3, /cvmfs/soft.computecanada.ca/custom/python/wheelhouse/gentoo2023/generic, /cvmfs/soft.computecanada.ca/custom/python/wheelhouse/generic
Processing /cvmfs/soft.computecanada.ca/custom/python/wheelhouse/generic/ortools-9.10.4067+computecanada-cp312-cp312-linux_x86_64.whl (from -r /home/aneumann/projects/def-adhaj/aneumann/GNRS/requirements/or.txt (line 1))
Processing /cvmfs/soft.computecanada.ca/custom/python/wheelhouse/gentoo2023/x86-64-v3/matplotlib-3.10.0+computecanada-cp312-cp312-linux_x86_64.whl (from -r /home/aneumann/projects/def-adhaj/aneumann/GNRS/requirements/or.txt (line 2))
Processing /cvmfs/soft.computecanada.ca/custom/python/wheelhouse/gentoo2023/x86-64-v3/pandas-2.2.3+computecanada-cp312-cp312-linux_x86_64.whl (from -r /home/aneumann/projects/def-adhaj/aneumann/GNRS/requirements/or.txt (line 3))
Processing /cvmfs/soft.computecanada.ca/custom/python/wheelhouse/generic/absl_py-2.3.0+computecanada-py3-none-any.whl (from ortools<9.11,>=9.10->-r /home/aneumann/projects/def-adhaj/aneumann/GNRS/requirements/or.txt (line 1))
Processing /cvmfs/soft.computecanada.ca/custom/python/wheelhouse/gentoo2023/generic/numpy-2.2.2+computecanada-cp312-cp312-linux_x86_64.whl (from ortools<9.11,>=9.10->-r /home/aneumann/projects/def-adhaj/aneumann/GNRS/requirements/or.txt (line 1))
Processing /cvmfs/soft.computecanada.ca/custom/python/wheelhouse/gentoo2023/x86-64-v3/protobuf-6.31.1+computecanada-cp312-cp312-linux_x86_64.whl (from ortools<9.11,>=9.10->-r /home/aneumann/projects/def-adhaj/aneumann/GNRS/requirements/or.txt (line 1))
Requirement already satisfied: immutabledict>=3.0.0 in /localscratch/aneumann.46806169.0/env/lib/python3.12/site-packages (from ortools<9.11,>=9.10->-r /home/aneumann/projects/def-adhaj/aneumann/GNRS/requirements/or.txt (line 1)) (4.2.0)
Processing /cvmfs/soft.computecanada.ca/custom/python/wheelhouse/gentoo2023/generic/contourpy-1.3.1+computecanada-cp312-cp312-linux_x86_64.whl (from matplotlib->-r /home/aneumann/projects/def-adhaj/aneumann/GNRS/requirements/or.txt (line 2))
Processing /cvmfs/soft.computecanada.ca/custom/python/wheelhouse/generic/cycler-0.12.1+computecanada-py3-none-any.whl (from matplotlib->-r /home/aneumann/projects/def-adhaj/aneumann/GNRS/requirements/or.txt (line 2))
Processing /cvmfs/soft.computecanada.ca/custom/python/wheelhouse/generic/fonttools-4.59.0+computecanada-cp312-cp312-linux_x86_64.whl (from matplotlib->-r /home/aneumann/projects/def-adhaj/aneumann/GNRS/requirements/or.txt (line 2))
Processing /cvmfs/soft.computecanada.ca/custom/python/wheelhouse/gentoo2023/x86-64-v3/kiwisolver-1.4.8+computecanada-cp312-cp312-linux_x86_64.whl (from matplotlib->-r /home/aneumann/projects/def-adhaj/aneumann/GNRS/requirements/or.txt (line 2))
Processing /cvmfs/soft.computecanada.ca/custom/python/wheelhouse/generic/packaging-25.0+computecanada-py3-none-any.whl (from matplotlib->-r /home/aneumann/projects/def-adhaj/aneumann/GNRS/requirements/or.txt (line 2))
Processing /cvmfs/soft.computecanada.ca/custom/python/wheelhouse/gentoo2023/x86-64-v3/pillow-11.1.0+computecanada-cp312-cp312-linux_x86_64.whl (from matplotlib->-r /home/aneumann/projects/def-adhaj/aneumann/GNRS/requirements/or.txt (line 2))
Processing /cvmfs/soft.computecanada.ca/custom/python/wheelhouse/generic/pyparsing-3.2.3+computecanada-py3-none-any.whl (from matplotlib->-r /home/aneumann/projects/def-adhaj/aneumann/GNRS/requirements/or.txt (line 2))
Processing /cvmfs/soft.computecanada.ca/custom/python/wheelhouse/generic/python_dateutil-2.9.0.post0+computecanada-py2.py3-none-any.whl (from matplotlib->-r /home/aneumann/projects/def-adhaj/aneumann/GNRS/requirements/or.txt (line 2))
Processing /cvmfs/soft.computecanada.ca/custom/python/wheelhouse/generic/pytz-2025.2+computecanada-py2.py3-none-any.whl (from pandas->-r /home/aneumann/projects/def-adhaj/aneumann/GNRS/requirements/or.txt (line 3))
Processing /cvmfs/soft.computecanada.ca/custom/python/wheelhouse/generic/tzdata-2025.2+computecanada-py2.py3-none-any.whl (from pandas->-r /home/aneumann/projects/def-adhaj/aneumann/GNRS/requirements/or.txt (line 3))
Processing /cvmfs/soft.computecanada.ca/custom/python/wheelhouse/generic/six-1.17.0+computecanada-py2.py3-none-any.whl (from python-dateutil>=2.7->matplotlib->-r /home/aneumann/projects/def-adhaj/aneumann/GNRS/requirements/or.txt (line 2))
Installing collected packages: pytz, tzdata, six, pyparsing, protobuf, pillow, packaging, numpy, kiwisolver, fonttools, cycler, absl-py, python-dateutil, contourpy, pandas, matplotlib, ortools
Successfully installed absl-py-2.3.0+computecanada contourpy-1.3.1+computecanada cycler-0.12.1+computecanada fonttools-4.59.0+computecanada kiwisolver-1.4.8+computecanada matplotlib-3.10.0+computecanada numpy-2.2.2+computecanada ortools-9.10.4067+computecanada packaging-25.0+computecanada pandas-2.2.3+computecanada pillow-11.1.0+computecanada protobuf-6.31.1+computecanada pyparsing-3.2.3+computecanada python-dateutil-2.9.0.post0+computecanada pytz-2025.2+computecanada six-1.17.0+computecanada tzdata-2025.2+computecanada

Starting CP-SAT solver v9.10.4067
Parameters: max_time_in_seconds: 86400 max_memory_in_mb: 185000 log_search_progress: true enumerate_all_solutions: false num_search_workers: 32 absolute_gap_limit: 0 relative_gap_limit: 0

Initial optimization model '': (model_fingerprint: 0xb57e07246917897c)
#Variables: 373 (#ints: 10 in objective)
  - 275 Booleans in [0,1]
  - 98 in [0,758]
#kLinear1: 48
#kLinear2: 572
#kLinear3: 251
#kLinearN: 5'717 (#terms: 92'526)

Starting presolve at 0.00s
  2.79e-03s  0.00e+00d  [DetectDominanceRelations] 
  4.15e-02s  0.00e+00d  [PresolveToFixPoint] #num_loops=8 #num_dual_strengthening=3 
  4.20e-05s  0.00e+00d  [ExtractEncodingFromLinear] #potential_supersets=7 
[Symmetry] Graph for symmetry has 6'607 nodes and 76'255 arcs.
[Symmetry] Symmetry computation done. time: 0.00261381 dtime: 0.00631178
[Symmetry] #generators: 1, average support size: 32
[Symmetry] The model contains 253 duplicate constraints !
[Symmetry] 16 orbits with sizes: 2,2,2,2,2,2,2,2,2,2,...
[Symmetry] Num fixable by intersecting at_most_one with orbits: 1 largest_orbit: 2
  1.67e-02s  4.14e-03d  [Probe] #probed=416 #new_bounds=5 #equiv=1 
  7.09e-05s  0.00e+00d  [MaxClique] 
  2.69e-03s  0.00e+00d  [DetectDominanceRelations] 
  1.85e-02s  0.00e+00d  [PresolveToFixPoint] #num_loops=5 #num_dual_strengthening=3 
  9.12e-03s  0.00e+00d  [ProcessAtMostOneAndLinear] 
  3.25e-03s  0.00e+00d  [DetectDuplicateConstraints] #duplicates=342 #without_enforcements=66 
  3.74e-03s  3.69e-04d  [DetectDominatedLinearConstraints] #relevant_constraints=5'176 #num_inclusions=3'087 
  5.12e-04s  0.00e+00d  [DetectDifferentVariables] #different=36 #cliques=1 #size=7 
  8.84e-04s  1.16e-04d  [ProcessSetPPC] #relevant_constraints=4'838 
  2.29e-05s  0.00e+00d  [FindAlmostIdenticalLinearConstraints] 
  3.74e-04s  6.72e-04d  [FindBigAtMostOneAndLinearOverlap] 
  1.09e-02s  7.64e-03d  [FindBigVerticalLinearOverlap] #blocks=88 #saved_nz=17'556 
  5.26e-04s  2.45e-04d  [FindBigHorizontalLinearOverlap] #linears=4'652 
  2.52e-05s  0.00e+00d  [MergeClauses] 
  2.81e-03s  0.00e+00d  [DetectDominanceRelations] 
  3.07e-02s  0.00e+00d  [PresolveToFixPoint] #num_loops=2 #num_dual_strengthening=1 
  2.80e-03s  0.00e+00d  [DetectDominanceRelations] 
  1.71e-02s  0.00e+00d  [PresolveToFixPoint] #num_loops=1 #num_dual_strengthening=1 
[Symmetry] Graph for symmetry has 6'563 nodes and 57'678 arcs.
[Symmetry] Symmetry computation done. time: 0.00117267 dtime: 0.00307656
  1.47e-02s  3.51e-03d  [Probe] #probed=416 #new_bounds=58 
  1.68e-05s  0.00e+00d  [MaxClique] 
  2.80e-03s  0.00e+00d  [DetectDominanceRelations] 
  2.71e-02s  0.00e+00d  [PresolveToFixPoint] #num_loops=2 #num_dual_strengthening=1 
  8.15e-03s  0.00e+00d  [ProcessAtMostOneAndLinear] 
  2.73e-03s  0.00e+00d  [DetectDuplicateConstraints] #without_enforcements=91 
  2.04e-03s  1.81e-04d  [DetectDominatedLinearConstraints] #relevant_constraints=4'904 #num_inclusions=52 
  3.58e-04s  0.00e+00d  [DetectDifferentVariables] 
  7.66e-04s  7.67e-05d  [ProcessSetPPC] #relevant_constraints=4'480 
  3.49e-05s  2.35e-07d  [FindAlmostIdenticalLinearConstraints] #num_tested_pairs=15 
  1.94e-04s  2.76e-04d  [FindBigAtMostOneAndLinearOverlap] 
  6.00e-03s  4.61e-03d  [FindBigVerticalLinearOverlap] #blocks=111 #saved_nz=7'554 
  4.50e-04s  1.91e-04d  [FindBigHorizontalLinearOverlap] #linears=4'180 
  1.59e-05s  0.00e+00d  [MergeClauses] 
  2.46e-03s  0.00e+00d  [DetectDominanceRelations] 
  2.92e-02s  0.00e+00d  [PresolveToFixPoint] #num_loops=2 #num_dual_strengthening=1 
  2.44e-03s  0.00e+00d  [DetectDominanceRelations] 
  1.90e-02s  0.00e+00d  [PresolveToFixPoint] #num_loops=1 #num_dual_strengthening=1 
[Symmetry] Graph for symmetry has 6'861 nodes and 50'203 arcs.
[Symmetry] Symmetry computation done. time: 0.00103368 dtime: 0.00287358
  1.32e-02s  3.10e-03d  [Probe] #probed=416 #new_bounds=84 
  1.79e-05s  0.00e+00d  [MaxClique] 
  2.45e-03s  0.00e+00d  [DetectDominanceRelations] 
  2.69e-02s  0.00e+00d  [PresolveToFixPoint] #num_loops=2 #num_dual_strengthening=1 
  7.66e-03s  0.00e+00d  [ProcessAtMostOneAndLinear] 
  2.59e-03s  0.00e+00d  [DetectDuplicateConstraints] #without_enforcements=91 
  1.76e-03s  1.47e-04d  [DetectDominatedLinearConstraints] #relevant_constraints=4'923 #num_inclusions=42 
  3.45e-04s  0.00e+00d  [DetectDifferentVariables] 
  6.61e-04s  5.94e-05d  [ProcessSetPPC] #relevant_constraints=4'137 
  5.32e-05s  2.45e-06d  [FindAlmostIdenticalLinearConstraints] #num_tested_pairs=153 
  1.63e-04s  2.11e-04d  [FindBigAtMostOneAndLinearOverlap] 
  4.02e-03s  3.34e-03d  [FindBigVerticalLinearOverlap] #blocks=55 #saved_nz=4'405 
  4.17e-04s  1.61e-04d  [FindBigHorizontalLinearOverlap] #linears=3'812 
  1.64e-05s  0.00e+00d  [MergeClauses] 
  2.25e-03s  0.00e+00d  [DetectDominanceRelations] 
  2.36e-02s  0.00e+00d  [PresolveToFixPoint] #num_loops=2 #num_dual_strengthening=1 
  1.16e-04s  0.00e+00d  [ExpandObjective] #entries=1'095 #tight_variables=382 #tight_constraints=221 

Presolve summary:
  - 91 affine relations were detected.
  - rule 'TODO dual: only one blocking constraint?' was applied 937 times.
  - rule 'TODO dual: only one blocking enforced constraint?' was applied 104 times.
  - rule 'TODO dual: only one unspecified blocking constraint?' was applied 67 times.
  - rule 'TODO duplicate: identical constraint with different enforcements' was applied 248 times.
  - rule 'affine: new relation' was applied 91 times.
  - rule 'at_most_one: removed literals' was applied 4 times.
  - rule 'at_most_one: size one' was applied 4 times.
  - rule 'deductions: 340 stored' was applied 1 time.
  - rule 'dual: fix variable' was applied 27 times.
  - rule 'dual: reduced domain' was applied 56 times.
  - rule 'duplicate: merged rhs of linear constraint' was applied 80 times.
  - rule 'duplicate: removed constraint' was applied 342 times.
  - rule 'enforcement: false literal' was applied 4 times.
  - rule 'exactly_one: x and not(x)' was applied 1 time.
  - rule 'incompatible linear: add implication' was applied 63 times.
  - rule 'linear matrix: common vertical rectangle' was applied 254 times.
  - rule 'linear: always true' was applied 668 times.
  - rule 'linear: doubleton free' was applied 13 times.
  - rule 'linear: empty' was applied 30 times.
  - rule 'linear: extracted enforcement literal' was applied 7'752 times.
  - rule 'linear: fixed or dup variables' was applied 5'795 times.
  - rule 'linear: positive equal one' was applied 7 times.
  - rule 'linear: reduced variable domains' was applied 352 times.
  - rule 'linear: remapped using affine relations' was applied 5'837 times.
  - rule 'linear: simplified rhs' was applied 17'625 times.
  - rule 'linear: tightened into equality' was applied 6 times.
  - rule 'linear: variable substitution 1' was applied 13 times.
  - rule 'linear: variable substitution 2' was applied 4 times.
  - rule 'linear: variable substitution 3' was applied 5 times.
  - rule 'no_overlap: inferred from x != y constraints' was applied 1 time.
  - rule 'presolve: 93 unused variables removed.' was applied 1 time.
  - rule 'presolve: iteration' was applied 3 times.
  - rule 'probing: reduced enforced constraint to implication.' was applied 4 times.
  - rule 'symmetry: fixed to false in general orbit' was applied 1 time.

Presolved optimization model '': (model_fingerprint: 0x31da7de74e0e0bc9)
#Variables: 421 (#ints: 10 in objective)
  - 110 Booleans in [0,1]
  - 256 different domains in [-7471,7430] with a largest complexity of 13.
#kExactlyOne: 6 (#literals: 18)
#kInterval: 7
#kLinear2: 795 (#enforced: 745 #multi: 533)
#kLinear3: 522 (#enforced: 337)
#kLinearN: 4'358 (#enforced: 4'124 #multi: 74) (#terms: 34'413)
#kNoOverlap: 1 (#intervals: 7)

Preloading model.
#Bound   0.38s best:inf   next:[150,6402] initial_domain
[Symmetry] Graph for symmetry has 6'803 nodes and 45'838 arcs.
[Symmetry] Symmetry computation done. time: 0.000974725 dtime: 0.00263051
#Model   0.38s var:421/421 constraints:5689/5689

Starting search at 0.38s with 32 workers.
17 full problem subsolvers: [core, default_lp, fixed, lb_tree_search, max_lp, no_lp, objective_lb_search, objective_lb_search_max_lp, objective_lb_search_no_lp, objective_shaving_search_max_lp, objective_shaving_search_no_lp, probing, probing_max_lp, pseudo_costs, quick_restart, quick_restart_no_lp, reduced_costs]
13 first solution subsolvers: [fj_long_default, fj_long_lin_default, fj_long_random, fj_short_default, fj_short_lin_default, fj_short_lin_random, fj_short_random, fs_random(2), fs_random_no_lp, fs_random_quick_restart(2), fs_random_quick_restart_no_lp]
13 incomplete subsolvers: [feasibility_pump, graph_arc_lns, graph_cst_lns, graph_dec_lns, graph_var_lns, rins/rens, rnd_cst_lns, rnd_var_lns, scheduling_intervals_lns, scheduling_precedences_lns, scheduling_time_window_lns, violation_ls(2)]
3 helper subsolvers: [neighborhood_helper, synchronization_agent, update_gap_integral]
#Bound   0.53s best:inf   next:[159,6402] objective_lb_search_no_lp
#Bound   0.54s best:inf   next:[160,6402] fs_random_quick_restart
#1       0.55s best:6402  next:[160,6401] quick_restart_no_lp (fixed_bools=0/191)
#2       0.56s best:2479  next:[160,2478] no_lp (fixed_bools=0/147)
#3       0.57s best:2478  next:[160,2477] violation_ls(batch:1 #solutions_imported:1 #lin_moves:826 #lin_evals:2'738 #weight_updates:154)
#Bound   0.57s best:2478  next:[182,2477] default_lp
#4       0.58s best:2098  next:[182,2097] no_lp (fixed_bools=0/174)
#5       0.58s best:2090  next:[182,2089] no_lp (fixed_bools=0/180)
#6       0.59s best:2088  next:[182,2087] no_lp (fixed_bools=0/186)
#Bound   0.59s best:2088  next:[183,2087] default_lp
#7       0.59s best:2048  next:[183,2047] no_lp (fixed_bools=0/188)
#8       0.60s best:2032  next:[183,2031] no_lp (fixed_bools=0/194)
#9       0.60s best:2024  next:[183,2023] no_lp (fixed_bools=0/203)
#Bound   0.61s best:2024  next:[186,2023] objective_lb_search
#10      0.61s best:1828  next:[186,1827] no_lp (fixed_bools=0/218)
#Bound   0.62s best:1828  next:[587,1827] max_lp
#11      0.66s best:1811  next:[587,1810] no_lp (fixed_bools=0/224)
#Bound   0.66s best:1811  next:[658,1810] reduced_costs
#12      0.67s best:1795  next:[658,1794] no_lp (fixed_bools=0/228)
#13      0.68s best:1763  next:[658,1762] no_lp (fixed_bools=0/240)
#14      0.70s best:1731  next:[658,1730] no_lp (fixed_bools=0/244)
#Bound   0.71s best:1731  next:[659,1730] reduced_costs
#15      0.72s best:1648  next:[659,1647] no_lp (fixed_bools=0/251)
#16      0.72s best:1643  next:[659,1642] quick_restart_no_lp (fixed_bools=0/283)
#17      0.73s best:1638  next:[659,1637] quick_restart_no_lp (fixed_bools=0/285)
#18      0.73s best:1635  next:[659,1634] no_lp (fixed_bools=0/257)
#19      0.74s best:1633  next:[659,1632] rins_lp_lns (d=0.71 s=64 t=0.10 p=1.00 stall=1 h=auto_l0)
#20      0.74s best:1565  next:[659,1564] no_lp (fixed_bools=0/266)
#Bound   0.80s best:1565  next:[660,1564] reduced_costs
#21      0.86s best:1560  next:[660,1559] quick_restart_no_lp (fixed_bools=0/384)
#Bound   0.87s best:1560  next:[661,1559] reduced_costs
#22      0.88s best:1559  next:[661,1558] violation_ls(batch:4 #solutions_imported:4 #lin_moves:0 #lin_evals:38'881 #gen_moves:16'729 #gen_evals:3'328 #comp_moves:944 #backtracks:7'892 #weight_updates:279)
#23      0.88s best:1558  next:[661,1557] violation_ls(batch:4 #solutions_imported:4 #lin_moves:826 #lin_evals:38'863 #gen_moves:15'443 #gen_evals:2'534 #comp_moves:1'518 #backtracks:6'962 #weight_updates:354)
#24      0.91s best:1554  next:[661,1553] quick_restart_no_lp (fixed_bools=0/409)
#Bound   0.92s best:1554  next:[662,1553] reduced_costs
#Bound   1.01s best:1554  next:[663,1553] objective_lb_search_max_lp
#Bound   1.02s best:1554  next:[683,1553] objective_lb_search_no_lp
#25      1.04s best:1553  next:[683,1552] violation_ls(batch:5 #solutions_imported:5 #lin_moves:27 #lin_evals:39'035 #gen_moves:16'729 #gen_evals:3'328 #comp_moves:944 #backtracks:7'892 #weight_updates:303)
#26      1.04s best:1552  next:[683,1551] violation_ls(batch:5 #solutions_imported:5 #lin_moves:1'448 #lin_evals:40'884 #gen_moves:15'443 #gen_evals:2'534 #comp_moves:1'518 #backtracks:6'962 #weight_updates:490)
#27      1.10s best:1540  next:[683,1539] graph_arc_lns (d=0.91 s=97 t=0.10 p=1.00 stall=4 h=auto_l0)
#Bound   1.11s best:1540  next:[691,1539] objective_lb_search_max_lp
#28      1.21s best:1535  next:[691,1534] quick_restart (fixed_bools=0/218)
#29      1.26s best:1396  next:[691,1395] scheduling_time_window_lns (d=0.50 s=43 t=0.10 p=0.00 stall=0 h=auto_l0)
#Bound   1.40s best:1396  next:[709,1395] objective_lb_search_max_lp
#Bound   1.83s best:1396  next:[710,1395] objective_lb_search_no_lp
#Bound   1.92s best:1396  next:[711,1395] objective_lb_search
#Bound   2.02s best:1396  next:[717,1395] objective_lb_search_no_lp
#Bound   2.04s best:1396  next:[745,1395] objective_lb_search_max_lp
#Bound   2.44s best:1396  next:[758,1395] objective_lb_search
#Bound   2.80s best:1396  next:[760,1395] objective_lb_search_no_lp
#Bound   2.90s best:1396  next:[771,1395] objective_lb_search_no_lp
#30      3.13s best:1369  next:[771,1368] rins_lp_lns (d=0.80 s=196 t=0.10 p=0.56 stall=3 h=auto_l0)
#Bound   3.23s best:1369  next:[775,1368] objective_lb_search_no_lp
#31      3.46s best:1352  next:[775,1351] graph_arc_lns (d=0.99 s=204 t=0.10 p=1.00 stall=6 h=auto_l0)
#32      3.51s best:1351  next:[775,1350] quick_restart_no_lp (fixed_bools=25/707)
#33      3.72s best:1350  next:[779,1349] violation_ls(batch:15 #solutions_imported:8 #lin_moves:5'218 #lin_evals:194'737 #gen_moves:81'520 #gen_evals:11'786 #comp_moves:2'443 #backtracks:39'521 #weight_updates:5'601)
#34      3.72s best:1349  next:[779,1348] violation_ls(batch:15 #solutions_imported:8 #lin_moves:1'488 #lin_evals:191'137 #gen_moves:87'086 #gen_evals:12'271 #comp_moves:3'458 #backtracks:41'787 #weight_updates:1'110)
#35      3.79s best:1339  next:[779,1338] graph_arc_lns (d=0.99 s=219 t=0.10 p=1.00 stall=6 h=auto_l0)
#36      3.83s best:1338  next:[779,1337] quick_restart_no_lp (fixed_bools=26/729)
#37      3.95s best:1336  next:[779,1335] quick_restart_no_lp (fixed_bools=33/794)
#38      3.99s best:1335  next:[779,1334] violation_ls(batch:16 #solutions_imported:9 #lin_moves:5'218 #lin_evals:194'741 #gen_moves:81'521 #gen_evals:11'786 #comp_moves:2'444 #backtracks:39'521 #weight_updates:5'601)
#Bound   3.55s best:1351  next:[779,1350] objective_lb_search_no_lp [skipped_logs=0]
#39      4.60s best:1309  next:[791,1308] rnd_var_lns (d=0.98 s=272 t=0.10 p=0.80 stall=15 h=auto_l0)
#Bound   4.56s best:1335  next:[791,1334] objective_lb_search_no_lp [skipped_logs=0]
#Bound   5.47s best:1309  next:[809,1308] objective_lb_search_no_lp [skipped_logs=0]
#40      6.35s best:1304  next:[809,1303] rnd_var_lns (d=0.99 s=328 t=0.10 p=0.79 stall=3 h=auto_l0)
#Bound   6.84s best:1304  next:[810,1303] objective_shaving_search_no_lp (vars=528 csts=5674) [skipped_logs=0]
#Bound   7.84s best:1304  next:[812,1303] objective_lb_search_no_lp [skipped_logs=1]
#Bound   8.06s best:1304  next:[818,1303] objective_lb_search_no_lp [skipped_logs=0]
#Bound   9.29s best:1304  next:[821,1303] objective_lb_search_no_lp [skipped_logs=1]
#Bound  10.99s best:1304  next:[822,1303] objective_lb_search_no_lp [skipped_logs=0]
#Bound  11.83s best:1304  next:[826,1303] objective_lb_search_no_lp [skipped_logs=2]
#Bound  12.63s best:1304  next:[829,1303] objective_lb_search_no_lp [skipped_logs=0]
#Bound  13.67s best:1304  next:[832,1303] objective_lb_search_no_lp [skipped_logs=1]
#Bound  14.68s best:1304  next:[836,1303] objective_lb_search_no_lp [skipped_logs=0]
#Bound  15.27s best:1304  next:[837,1303] objective_lb_search_no_lp [skipped_logs=0]
#Bound  16.87s best:1304  next:[844,1303] objective_lb_search [skipped_logs=2]
#Bound  18.03s best:1304  next:[848,1303] objective_lb_search_no_lp
#Bound  20.57s best:1304  next:[849,1303] objective_shaving_search_no_lp (vars=528 csts=5674)
#Bound  22.97s best:1304  next:[850,1303] objective_shaving_search_no_lp (vars=528 csts=5674)
#Bound  23.05s best:1304  next:[851,1303] objective_lb_search_no_lp
#Bound  23.94s best:1304  next:[852,1303] objective_lb_search_no_lp
#Bound  24.06s best:1304  next:[853,1303] objective_lb_search_no_lp
#Bound  24.32s best:1304  next:[855,1303] objective_lb_search_no_lp
#Bound  25.24s best:1304  next:[857,1303] objective_lb_search_no_lp
#Bound  27.00s best:1304  next:[858,1303] objective_lb_search_no_lp
#Bound  27.82s best:1304  next:[860,1303] objective_lb_search_no_lp
#Bound  28.98s best:1304  next:[861,1303] objective_lb_search_no_lp
#Bound  32.51s best:1304  next:[862,1303] objective_shaving_search_no_lp (vars=528 csts=5674)
#Bound  33.65s best:1304  next:[864,1303] objective_lb_search_no_lp
#Bound  36.04s best:1304  next:[866,1303] objective_lb_search_no_lp
#Bound  37.01s best:1304  next:[868,1303] objective_lb_search_no_lp
#Bound  40.06s best:1304  next:[870,1303] objective_lb_search_no_lp
#Bound  42.05s best:1304  next:[872,1303] objective_lb_search_no_lp
#Bound  43.85s best:1304  next:[874,1303] objective_lb_search_no_lp
#Bound  46.15s best:1304  next:[876,1303] objective_lb_search_no_lp
#Bound  50.95s best:1304  next:[877,1303] objective_shaving_search_no_lp (vars=520 csts=5680)
#Bound  54.93s best:1304  next:[878,1303] objective_shaving_search_no_lp (vars=520 csts=5680)
#Bound  56.37s best:1304  next:[879,1303] objective_lb_search
#Bound  58.30s best:1304  next:[881,1303] objective_lb_search_no_lp
#Bound  59.83s best:1304  next:[882,1303] objective_lb_search_no_lp
#Bound  61.12s best:1304  next:[884,1303] objective_lb_search_no_lp
#Bound  61.75s best:1304  next:[886,1303] objective_lb_search_no_lp
#Bound  64.39s best:1304  next:[887,1303] objective_lb_search_no_lp
#Bound  64.94s best:1304  next:[896,1303] objective_lb_search_no_lp
#Bound  66.61s best:1304  next:[897,1303] objective_lb_search_no_lp
#Bound  67.03s best:1304  next:[898,1303] objective_lb_search_no_lp
#Bound  68.06s best:1304  next:[903,1303] objective_lb_search_no_lp
#Bound  77.78s best:1304  next:[904,1303] objective_shaving_search_no_lp (vars=528 csts=5674)
#Bound  78.88s best:1304  next:[906,1303] objective_lb_search_no_lp
#Bound  82.72s best:1304  next:[908,1303] objective_lb_search_no_lp
#Bound  84.24s best:1304  next:[911,1303] objective_lb_search_no_lp
#Bound  85.72s best:1304  next:[913,1303] objective_lb_search_no_lp
#Bound  87.33s best:1304  next:[914,1303] objective_lb_search_no_lp
#Bound  89.94s best:1304  next:[915,1303] objective_lb_search_no_lp
#Bound  92.28s best:1304  next:[916,1303] objective_lb_search_no_lp
#Bound  95.57s best:1304  next:[918,1303] objective_lb_search_no_lp
#Bound 105.38s best:1304  next:[919,1303] objective_lb_search
#Bound 110.77s best:1304  next:[920,1303] objective_lb_search_no_lp
#Bound 115.05s best:1304  next:[921,1303] objective_lb_search
#Bound 116.62s best:1304  next:[922,1303] objective_lb_search_no_lp
#Bound 118.96s best:1304  next:[923,1303] objective_lb_search_no_lp
#Bound 124.68s best:1304  next:[924,1303] objective_lb_search_no_lp
#Bound 125.94s best:1304  next:[925,1303] objective_lb_search_no_lp
#Bound 128.02s best:1304  next:[930,1303] objective_lb_search_no_lp
#Bound 130.98s best:1304  next:[931,1303] objective_lb_search_no_lp
#Bound 136.49s best:1304  next:[933,1303] objective_lb_search_no_lp
#Bound 139.27s best:1304  next:[941,1303] objective_lb_search_no_lp
#Bound 141.79s best:1304  next:[943,1303] objective_lb_search_no_lp
#Bound 153.16s best:1304  next:[944,1303] objective_lb_search_no_lp
#Bound 156.68s best:1304  next:[945,1303] objective_lb_search_no_lp
#Bound 159.12s best:1304  next:[946,1303] objective_lb_search_no_lp
#Bound 161.01s best:1304  next:[947,1303] objective_lb_search_no_lp
#Bound 163.63s best:1304  next:[948,1303] objective_lb_search_no_lp
#Bound 170.29s best:1304  next:[949,1303] objective_lb_search_no_lp
#Bound 172.97s best:1304  next:[951,1303] objective_lb_search_no_lp
#Bound 173.27s best:1304  next:[952,1303] objective_lb_search_no_lp
#Bound 179.72s best:1304  next:[953,1303] objective_lb_search_no_lp
#Bound 190.92s best:1304  next:[954,1303] objective_lb_search_no_lp
#Bound 191.19s best:1304  next:[955,1303] objective_lb_search_no_lp
#Bound 191.75s best:1304  next:[956,1303] objective_lb_search_no_lp
#Bound 194.22s best:1304  next:[958,1303] objective_lb_search_no_lp
#Bound 204.63s best:1304  next:[960,1303] objective_lb_search_no_lp
#Bound 205.01s best:1304  next:[963,1303] objective_lb_search_no_lp
#Bound 206.88s best:1304  next:[965,1303] objective_lb_search_no_lp
#Bound 212.96s best:1304  next:[966,1303] objective_lb_search_no_lp
#Bound 214.26s best:1304  next:[968,1303] objective_lb_search_no_lp
#Bound 214.59s best:1304  next:[969,1303] objective_lb_search_no_lp
#Bound 215.94s best:1304  next:[973,1303] objective_lb_search_no_lp
#Bound 217.85s best:1304  next:[974,1303] objective_lb_search_no_lp
#Bound 220.72s best:1304  next:[975,1303] objective_lb_search_no_lp
#Bound 221.36s best:1304  next:[976,1303] objective_lb_search_no_lp
#Bound 221.65s best:1304  next:[980,1303] objective_lb_search_no_lp
#Bound 224.70s best:1304  next:[981,1303] objective_lb_search_no_lp
#Bound 228.56s best:1304  next:[982,1303] objective_lb_search_no_lp
#Bound 229.10s best:1304  next:[983,1303] objective_lb_search_no_lp
#Bound 235.21s best:1304  next:[986,1303] objective_lb_search_no_lp
#Bound 236.89s best:1304  next:[987,1303] objective_lb_search_no_lp
#Bound 240.27s best:1304  next:[989,1303] objective_lb_search_no_lp
#Bound 243.21s best:1304  next:[991,1303] objective_lb_search_no_lp
#Bound 245.41s best:1304  next:[993,1303] objective_lb_search_no_lp
#Bound 251.69s best:1304  next:[994,1303] objective_lb_search_no_lp
#Bound 262.70s best:1304  next:[996,1303] objective_lb_search_no_lp
#Bound 271.00s best:1304  next:[997,1303] objective_lb_search_no_lp
#Bound 286.19s best:1304  next:[998,1303] objective_lb_search_no_lp
#Bound 288.70s best:1304  next:[999,1303] objective_lb_search_no_lp
#Bound 302.46s best:1304  next:[1001,1303] objective_lb_search_no_lp
#Bound 309.68s best:1304  next:[1002,1303] objective_lb_search_no_lp
#Bound 315.40s best:1304  next:[1003,1303] objective_lb_search_no_lp
#Bound 320.47s best:1304  next:[1004,1303] objective_lb_search_no_lp
#Bound 326.43s best:1304  next:[1005,1303] objective_lb_search_no_lp
#Bound 331.39s best:1304  next:[1006,1303] objective_lb_search_no_lp
#Bound 333.96s best:1304  next:[1008,1303] objective_lb_search_no_lp
#Bound 347.53s best:1304  next:[1009,1303] objective_lb_search_no_lp
#Bound 391.52s best:1304  next:[1015,1303] objective_lb_search_no_lp
#Bound 449.02s best:1304  next:[1016,1303] objective_shaving_search_no_lp (vars=529 csts=5675)
#Bound 474.24s best:1304  next:[1017,1303] objective_lb_search_no_lp
#Bound 494.96s best:1304  next:[1018,1303] objective_lb_search_no_lp
#Bound 535.39s best:1304  next:[1019,1303] lb_tree_search (nodes=51926/52110 rc=518 decisions=382408 @root=91 restarts=13) 
#Bound 559.74s best:1304  next:[1020,1303] lb_tree_search (nodes=51705/52614 rc=546 decisions=394826 @root=92 restarts=13) 
#Bound 584.15s best:1304  next:[1021,1303] objective_lb_search_no_lp
#Bound 595.85s best:1304  next:[1022,1303] objective_lb_search_no_lp
#Bound 618.72s best:1304  next:[1023,1303] objective_lb_search_no_lp
#Bound 633.00s best:1304  next:[1024,1303] objective_lb_search_no_lp
#Bound 648.15s best:1304  next:[1025,1303] objective_lb_search_no_lp
#Bound 658.38s best:1304  next:[1026,1303] objective_lb_search_no_lp
#Bound 687.18s best:1304  next:[1027,1303] objective_lb_search_no_lp
#Bound 715.92s best:1304  next:[1029,1303] objective_lb_search_no_lp
#Bound 725.54s best:1304  next:[1030,1303] objective_lb_search_no_lp
#Bound 778.73s best:1304  next:[1031,1303] lb_tree_search (nodes=59429/60927 rc=784 decisions=514506 @root=114 restarts=13) 
#Bound 786.15s best:1304  next:[1033,1303] objective_lb_search_no_lp
#Bound 795.02s best:1304  next:[1034,1303] objective_lb_search_no_lp
#Bound 825.19s best:1304  next:[1035,1303] objective_lb_search_no_lp
#Bound 849.49s best:1304  next:[1036,1303] objective_lb_search_no_lp
#Bound 897.22s best:1304  next:[1037,1303] lb_tree_search (nodes=62960/65846 rc=917 decisions=581854 @root=127 restarts=13) 
#Bound 932.78s best:1304  next:[1038,1303] objective_lb_search_no_lp
#Bound 968.88s best:1304  next:[1039,1303] lb_tree_search (nodes=64572/67663 rc=992 decisions=616984 @root=135 restarts=13) 
#Bound 995.23s best:1304  next:[1040,1303] objective_lb_search_no_lp
#Bound 1033.86s best:1304  next:[1041,1303] objective_lb_search_no_lp
#Bound 1069.53s best:1304  next:[1042,1303] lb_tree_search (nodes=63696/70440 rc=1102 decisions=668469 @root=145 restarts=13) 
#Bound 1102.52s best:1304  next:[1043,1303] objective_lb_search_no_lp
#Bound 1134.90s best:1304  next:[1044,1303] lb_tree_search (nodes=62681/72152 rc=1178 decisions=700895 @root=153 restarts=13) 
#Bound 1166.98s best:1304  next:[1045,1303] lb_tree_search (nodes=62613/73092 rc=1225 decisions=717939 @root=156 restarts=13) 
#Bound 1191.24s best:1304  next:[1046,1303] objective_lb_search_no_lp
#Bound 1199.74s best:1304  next:[1047,1303] objective_lb_search_no_lp
#Bound 1227.55s best:1304  next:[1048,1303] objective_lb_search_no_lp
#Bound 1234.48s best:1304  next:[1049,1303] objective_lb_search_no_lp
#Bound 1251.83s best:1304  next:[1050,1303] objective_lb_search_no_lp
#Bound 1290.19s best:1304  next:[1051,1303] objective_lb_search_no_lp
#Bound 1314.50s best:1304  next:[1052,1303] objective_lb_search_no_lp
#Bound 1338.41s best:1304  next:[1053,1303] objective_lb_search_no_lp
#Bound 1374.93s best:1304  next:[1054,1303] objective_lb_search_no_lp
#Bound 1404.95s best:1304  next:[1055,1303] lb_tree_search (nodes=67319/83588 rc=1579 decisions=855956 @root=185 restarts=13) 
#Bound 1433.94s best:1304  next:[1056,1303] lb_tree_search (nodes=67455/84519 rc=1614 decisions=872349 @root=188 restarts=13) 
#Bound 1450.63s best:1304  next:[1057,1303] objective_lb_search_no_lp
#Bound 1486.69s best:1304  next:[1058,1303] lb_tree_search (nodes=69218/86640 rc=1725 decisions=903175 @root=193 restarts=13) 
#Bound 1518.44s best:1304  next:[1059,1303] objective_lb_search_no_lp
#Bound 1548.18s best:1304  next:[1060,1303] lb_tree_search (nodes=67277/88748 rc=1812 decisions=934818 @root=201 restarts=13) 
#Bound 1575.58s best:1304  next:[1061,1303] lb_tree_search (nodes=66043/89779 rc=1852 decisions=949671 @root=204 restarts=13) 
#Bound 1596.78s best:1304  next:[1062,1303] objective_lb_search_no_lp
#Bound 1618.62s best:1304  next:[1063,1303] objective_lb_search_no_lp
#Bound 1637.70s best:1304  next:[1064,1303] lb_tree_search (nodes=51536/92274 rc=1962 decisions=986105 @root=210 restarts=13) 
#Model 1637.71s var:419/421 constraints:5446/5689
#Model 1639.05s var:417/421 constraints:5346/5689
#Bound 1654.77s best:1304  next:[1065,1303] lb_tree_search (nodes=44554/92892 rc=1996 decisions=995800 @root=213 restarts=13) 
#Model 1659.79s var:416/421 constraints:5335/5689
#Bound 1670.54s best:1304  next:[1066,1303] lb_tree_search (nodes=43914/93630 rc=2040 decisions=1005644 @root=214 restarts=13) 
#Bound 1679.67s best:1304  next:[1075,1303] objective_lb_search_no_lp
#Bound 1716.17s best:1304  next:[1076,1303] objective_lb_search_no_lp
#Bound 1739.31s best:1304  next:[1089,1303] objective_lb_search_no_lp
#Model 1796.16s var:415/421 constraints:5323/5689
#Bound 1806.49s best:1304  next:[1090,1303] objective_lb_search_no_lp
#Bound 1833.25s best:1304  next:[1092,1303] objective_lb_search_no_lp
#Model 1837.47s var:414/421 constraints:5312/5689
#Bound 1853.64s best:1304  next:[1095,1303] objective_lb_search_no_lp
#Model 1872.30s var:412/421 constraints:5119/5689
#Bound 1875.52s best:1304  next:[1096,1303] objective_lb_search_no_lp
#Bound 1888.89s best:1304  next:[1099,1303] objective_lb_search_no_lp
#Model 1905.14s var:409/421 constraints:4986/5689
#Bound 1905.35s best:1304  next:[1100,1303] objective_lb_search_no_lp
#Bound 1914.07s best:1304  next:[1101,1303] objective_lb_search_no_lp
#Bound 1918.34s best:1304  next:[1104,1303] objective_lb_search_no_lp
#Bound 1922.24s best:1304  next:[1106,1303] objective_lb_search_no_lp
#Bound 1931.01s best:1304  next:[1107,1303] objective_lb_search_no_lp
#Bound 1934.68s best:1304  next:[1109,1303] objective_lb_search_no_lp
#Bound 1939.12s best:1304  next:[1111,1303] objective_lb_search_no_lp
#Bound 1953.13s best:1304  next:[1115,1303] objective_lb_search_no_lp
#Model 1954.51s var:407/421 constraints:4850/5689
#Bound 1955.08s best:1304  next:[1116,1303] objective_lb_search_no_lp
#Bound 1956.99s best:1304  next:[1118,1303] objective_lb_search_no_lp
#Bound 1957.93s best:1304  next:[1121,1303] objective_lb_search_no_lp
#Bound 1962.56s best:1304  next:[1123,1303] objective_lb_search_no_lp
#Model 1964.95s var:406/421 constraints:4692/5689
#Model 1965.26s var:405/421 constraints:4535/5689
#Bound 1965.38s best:1304  next:[1125,1303] objective_lb_search_no_lp
#Bound 1967.83s best:1304  next:[1127,1303] objective_lb_search_no_lp
#Model 1968.68s var:404/421 constraints:4497/5689
#Model 1969.39s var:403/421 constraints:4464/5689
#Bound 1970.65s best:1304  next:[1131,1303] objective_lb_search_no_lp
#Bound 1973.11s best:1304  next:[1133,1303] objective_lb_search_no_lp
#Bound 1980.88s best:1304  next:[1137,1303] objective_lb_search_no_lp
#Model 1983.79s var:402/421 constraints:4376/5689
#Bound 1984.53s best:1304  next:[1138,1303] objective_lb_search_no_lp
#Model 1985.51s var:397/421 constraints:4010/5689
#Model 1985.54s var:394/421 constraints:3711/5689
#Bound 1985.87s best:1304  next:[1144,1303] objective_lb_search_no_lp
#Bound 1986.79s best:1304  next:[1147,1303] objective_lb_search_no_lp
#Bound 1988.30s best:1304  next:[1148,1303] objective_lb_search_no_lp
#Model 1988.46s var:393/421 constraints:3686/5689
#Bound 1988.79s best:1304  next:[1150,1303] objective_lb_search_no_lp
#Model 1989.77s var:392/421 constraints:3651/5689
#Bound 1990.08s best:1304  next:[1157,1303] objective_lb_search_no_lp
#Bound 1991.01s best:1304  next:[1158,1303] objective_shaving_search_no_lp (vars=328 csts=3567)
#Bound 1991.22s best:1304  next:[1164,1303] objective_lb_search_no_lp
#Bound 1991.81s best:1304  next:[1174,1303] objective_lb_search
#Model 1992.13s var:390/421 constraints:3545/5689
#Bound 1993.40s best:1304  next:[1184,1303] objective_lb_search
#Bound 1993.49s best:1304  next:[1198,1303] objective_lb_search_no_lp
#Model 1993.77s var:389/421 constraints:3446/5689
#Model 1993.84s var:387/421 constraints:3128/5689
#Model 1993.91s var:385/421 constraints:2919/5689
#Model 1994.04s var:381/421 constraints:2738/5689
#Bound 1994.08s best:1304  next:[1199,1303] objective_lb_search_max_lp
#Done  1994.12s quick_restart_no_lp
#Model 1994.12s var:363/421 constraints:1410/5689
#Model 1994.12s var:362/421 constraints:1301/5689

Task timing                                  n [     min,      max]      avg      dev     time         n [     min,      max]      avg      dev    dtime
                             'core':         1 [  33.23m,   33.23m]   33.23m   0.00ns   33.23m         1 [   1.08h,    1.08h]    1.08h   0.00ns    1.08h
                       'default_lp':         1 [  33.23m,   33.23m]   33.23m   0.00ns   33.23m         1 [  13.12m,   13.12m]   13.12m   0.00ns   13.12m
                 'feasibility_pump':      3638 [ 40.64ms, 410.35ms] 161.89ms  13.38ms    9.82m      3637 [ 12.32ms, 123.81ms]  40.24ms   1.90ms    2.44m
                            'fixed':         1 [  33.23m,   33.23m]   33.23m   0.00ns   33.23m         1 [  17.29m,   17.29m]   17.29m   0.00ns   17.29m
                  'fj_long_default':         1 [154.37ms, 154.37ms] 154.37ms   0.00ns 154.37ms         1 [ 92.13ms,  92.13ms]  92.13ms   0.00ns  92.13ms
              'fj_long_lin_default':         1 [135.91ms, 135.91ms] 135.91ms   0.00ns 135.91ms         1 [ 94.12ms,  94.12ms]  94.12ms   0.00ns  94.12ms
                   'fj_long_random':         1 [133.08ms, 133.08ms] 133.08ms   0.00ns 133.08ms         1 [ 64.23ms,  64.23ms]  64.23ms   0.00ns  64.23ms
                 'fj_short_default':         3 [ 47.82ms, 101.71ms]  65.97ms  25.27ms 197.92ms         3 [ 92.99ms,  96.88ms]  95.32ms   1.68ms 285.97ms
             'fj_short_lin_default':         1 [137.94ms, 137.94ms] 137.94ms   0.00ns 137.94ms         1 [ 95.06ms,  95.06ms]  95.06ms   0.00ns  95.06ms
              'fj_short_lin_random':         1 [135.77ms, 135.77ms] 135.77ms   0.00ns 135.77ms         1 [ 92.01ms,  92.01ms]  92.01ms   0.00ns  92.01ms
                  'fj_short_random':         1 [138.29ms, 138.29ms] 138.29ms   0.00ns 138.29ms         1 [ 97.55ms,  97.55ms]  97.55ms   0.00ns  97.55ms
                        'fs_random':         1 [163.47ms, 163.47ms] 163.47ms   0.00ns 163.47ms         1 [  5.14us,   5.14us]   5.14us   0.00ns   5.14us
                        'fs_random':         1 [164.37ms, 164.37ms] 164.37ms   0.00ns 164.37ms         1 [202.21us, 202.21us] 202.21us   0.00ns 202.21us
                  'fs_random_no_lp':         1 [163.66ms, 163.66ms] 163.66ms   0.00ns 163.66ms         1 [  5.70ms,   5.70ms]   5.70ms   0.00ns   5.70ms
          'fs_random_quick_restart':         1 [163.43ms, 163.43ms] 163.43ms   0.00ns 163.43ms         1 [202.21us, 202.21us] 202.21us   0.00ns 202.21us
          'fs_random_quick_restart':         1 [164.37ms, 164.37ms] 164.37ms   0.00ns 164.37ms         1 [  2.68ms,   2.68ms]   2.68ms   0.00ns   2.68ms
    'fs_random_quick_restart_no_lp':         1 [168.42ms, 168.42ms] 168.42ms   0.00ns 168.42ms         1 [813.26us, 813.26us] 813.26us   0.00ns 813.26us
                    'graph_arc_lns':      3637 [  2.26ms,    2.14s] 773.07ms 455.28ms   46.86m      3615 [ 10.00ns, 522.54ms] 137.27ms 103.93ms    8.27m
                    'graph_cst_lns':      3637 [  2.27ms,    1.65s] 691.80ms 388.19ms   41.93m      3575 [ 10.00ns, 394.26ms] 118.01ms  85.73ms    7.03m
                    'graph_dec_lns':      3637 [  4.84ms,    2.11s] 782.10ms 454.15ms   47.41m      3612 [ 10.00ns, 392.79ms] 139.29ms 104.67ms    8.39m
                    'graph_var_lns':      3637 [  3.75ms,    1.96s] 755.60ms 480.83ms   45.80m      3597 [ 10.00ns, 635.78ms] 131.52ms 107.60ms    7.88m
                   'lb_tree_search':         1 [  33.23m,   33.23m]   33.23m   0.00ns   33.23m         1 [  22.04m,   22.04m]   22.04m   0.00ns   22.04m
                           'max_lp':         1 [  33.23m,   33.23m]   33.23m   0.00ns   33.23m         1 [  14.37m,   14.37m]   14.37m   0.00ns   14.37m
                            'no_lp':         1 [  33.23m,   33.23m]   33.23m   0.00ns   33.23m         1 [   9.76m,    9.76m]    9.76m   0.00ns    9.76m
              'objective_lb_search':         1 [  33.23m,   33.23m]   33.23m   0.00ns   33.23m         1 [  13.33m,   13.33m]   13.33m   0.00ns   13.33m
       'objective_lb_search_max_lp':         1 [  33.23m,   33.23m]   33.23m   0.00ns   33.23m         1 [  17.49m,   17.49m]   17.49m   0.00ns   17.49m
        'objective_lb_search_no_lp':         1 [  33.23m,   33.23m]   33.23m   0.00ns   33.23m         1 [   7.58m,    7.58m]    7.58m   0.00ns    7.58m
  'objective_shaving_search_max_lp':       219 [ 24.27ms,    1.12m]    9.10s   12.58s   33.21m       211 [  2.39ms,   19.61s]    2.74s    3.80s    9.64m
   'objective_shaving_search_no_lp':       219 [ 26.28ms,    1.12m]    9.10s   12.58s   33.21m       210 [  3.32ms,   14.21s]    1.89s    2.62s    6.61m
                          'probing':         1 [  33.23m,   33.23m]   33.23m   0.00ns   33.23m         1 [  19.68m,   19.68m]   19.68m   0.00ns   19.68m
                   'probing_max_lp':         1 [  33.23m,   33.23m]   33.23m   0.00ns   33.23m         1 [  19.96m,   19.96m]   19.96m   0.00ns   19.96m
                     'pseudo_costs':         1 [  33.23m,   33.23m]   33.23m   0.00ns   33.23m         1 [  13.05m,   13.05m]   13.05m   0.00ns   13.05m
                    'quick_restart':         1 [  33.23m,   33.23m]   33.23m   0.00ns   33.23m         1 [  23.00m,   23.00m]   23.00m   0.00ns   23.00m
              'quick_restart_no_lp':         1 [  33.23m,   33.23m]   33.23m   0.00ns   33.23m         1 [  27.40m,   27.40m]   27.40m   0.00ns   27.40m
                    'reduced_costs':         1 [  33.23m,   33.23m]   33.23m   0.00ns   33.23m         1 [  14.29m,   14.29m]   14.29m   0.00ns   14.29m
                        'rins/rens':      3638 [110.62us,    1.01s] 309.83ms 209.02ms   18.79m      2792 [ 10.00ns, 126.74ms]  82.62ms  29.86ms    3.84m
                      'rnd_cst_lns':      3637 [  3.86ms,    2.62s] 777.46ms 466.87ms   47.13m      3612 [ 10.00ns, 392.92ms] 137.57ms 105.87ms    8.28m
                      'rnd_var_lns':      3637 [  3.11ms,    1.93s] 748.06ms 445.69ms   45.34m      3620 [ 10.00ns, 378.76ms] 132.93ms 102.61ms    8.02m
         'scheduling_intervals_lns':      3637 [  2.85ms,    2.10s]    1.03s 302.57ms    1.04h      3622 [  1.78ms, 562.68ms] 205.41ms  78.36ms   12.40m
       'scheduling_precedences_lns':      3637 [  2.86ms,    2.50s]    1.04s 302.80ms    1.05h      3620 [  1.98ms, 563.06ms] 205.61ms  78.87ms   12.41m
       'scheduling_time_window_lns':      3637 [  2.86ms,    2.10s]    1.03s 300.91ms    1.04h      3622 [  1.78ms, 401.24ms] 205.19ms  77.93ms   12.39m
                     'violation_ls':      3638 [749.03us, 188.35ms]  65.11ms  16.33ms    3.95m      3638 [250.13us, 335.70ms] 124.68ms  49.71ms    7.56m
                     'violation_ls':      3638 [778.05us, 188.66ms]  62.53ms  14.63ms    3.79m      3638 [680.00ns, 311.49ms] 117.59ms  42.06ms    7.13m

Search stats                         Bools  Conflicts   Branches  Restarts     BoolPropag  IntegerPropag
                           'core':   9'899    623'635  1'578'207    79'182  1'905'247'248    913'933'046
                     'default_lp':   3'453    636'008  2'679'922   211'106    694'680'442    920'351'080
                          'fixed':   4'426  2'575'348  4'580'497     3'166  1'129'289'288  1'183'196'981
                      'fs_random':     110          0        220       220             36          6'197
                      'fs_random':     110          0        220       220             36          6'197
                'fs_random_no_lp':     153         50        635       448            784         25'013
        'fs_random_quick_restart':     110          0        220       220             36          6'197
        'fs_random_quick_restart':     110          0        227       221             40          6'256
  'fs_random_quick_restart_no_lp':     110          0        303       220             42          9'222
                 'lb_tree_search':     131        705  2'130'016   336'426      6'015'162    235'482'207
                         'max_lp':     110    390'230  2'763'443   367'586     19'083'330    899'364'257
                          'no_lp':   2'021  1'467'423  3'278'515   217'288    856'356'658  1'826'685'949
            'objective_lb_search':     449    428'176  3'158'212   465'758     48'945'767    955'007'905
     'objective_lb_search_max_lp':     424    182'459  4'114'320   775'889     49'124'365    817'030'578
      'objective_lb_search_no_lp':     510  1'172'219  2'741'339   195'090     54'783'646  1'657'710'556
                        'probing':     753        460     62'483    32'041        318'091      2'740'226
                 'probing_max_lp':     753        492     45'406    23'443        238'961      2'060'785
                   'pseudo_costs':     110    611'116  2'895'023   424'558     19'711'595    982'553'599
                  'quick_restart':   5'879    341'904  3'895'331   204'040    763'734'091    538'242'567
            'quick_restart_no_lp':   8'561  1'123'219  4'784'015   172'436  1'940'796'537    989'801'308
                  'reduced_costs':  19'721    661'400  4'559'619   230'892  1'670'081'141    977'651'800

SAT stats                           ClassicMinim  LitRemoved  LitLearned  LitForgotten  Subsumed  MClauses  MDecisions  MLitTrue  MSubsumed  MLitRemoved  MReused
                           'core':       601'384   8'086'906   7'358'695     1'006'297     1'494    37'397     184'254       574      1'516        9'866      524
                     'default_lp':       574'762   4'308'346   9'374'836     6'252'665     5'099   118'020   1'248'138         2     48'576      361'979   18'103
                          'fixed':     2'312'369  12'921'551  59'763'181    44'997'797     3'718     1'913      22'666         0        879        6'358      664
                      'fs_random':             0           0           0             0         0         0           0         0          0            0        0
                      'fs_random':             0           0           0             0         0         0           0         0          0            0        0
                'fs_random_no_lp':            22         127         673             0         0         7          43         0          0            0        0
        'fs_random_quick_restart':             0           0           0             0         0         0           0         0          0            0        0
        'fs_random_quick_restart':             0           0           0             0         0         0           0         0          0            0        0
  'fs_random_quick_restart_no_lp':             0           0           0             0         0         0           0         0          0            0        0
                 'lb_tree_search':            70         118       3'273             0         2   156'346     791'836         0        114          451   10'817
                         'max_lp':       342'225   1'717'164   5'853'252     3'562'316     4'672   187'761   2'240'740         0     14'480      112'267   38'383
                          'no_lp':     1'323'874   9'526'855  27'131'682    23'427'597     7'541   112'130   1'119'536        51     33'045      216'984   15'001
            'objective_lb_search':       396'023   2'202'805   5'512'625     1'713'624     4'223   235'580   2'506'079         0     20'936      156'903   46'892
     'objective_lb_search_max_lp':       167'807     905'413   2'377'161       438'069     1'931   357'418   3'588'629         5      7'378       56'007   82'695
      'objective_lb_search_no_lp':     1'083'952   6'658'022  15'756'188     8'189'572     8'914   105'453   1'277'676         0     25'724      203'138   19'383
                        'probing':             0           0         462             0         0         0           0         0          0            0        0
                 'probing_max_lp':             0           0         492             0         0         0           0         0          0            0        0
                   'pseudo_costs':       515'687   2'465'602   9'469'359     6'197'526     5'290   212'602   2'045'526        18     15'238      117'589   33'179
                  'quick_restart':       282'705   1'953'389   4'655'475     2'173'397     4'138   118'599   1'668'517         1     84'765      927'647   18'336
            'quick_restart_no_lp':       992'004   9'763'894  20'811'877    12'634'030     2'587    39'697     512'659         9     32'596      356'000    2'991
                  'reduced_costs':       586'812   4'138'804  12'554'645    10'413'151     3'284   107'335   1'192'337         6     20'439      139'134   15'279

Lp stats                         Component  Iterations  AddedCuts    OPTIMAL  DUAL_F.  DUAL_U.
                  'default_lp':          1   8'356'194    387'414  1'315'171        0        2
                       'fixed':          1     571'098      1'679  1'914'449        0        0
                   'fs_random':          1         156         61          3        0        0
                   'fs_random':          1         221        222          5        0        0
     'fs_random_quick_restart':          1         221        209          5        0        0
     'fs_random_quick_restart':          1         505        711         15        0        0
              'lb_tree_search':          1  25'129'118     40'811  1'220'720  496'955        0
                      'max_lp':          1  13'565'590    160'913    764'421  489'638      112
         'objective_lb_search':          1   9'297'960    189'830    996'934        0        0
  'objective_lb_search_max_lp':          1  12'856'308     75'553    510'493  127'831      146
                     'probing':          1   7'469'556    158'408    170'390       23        1
              'probing_max_lp':          1   4'599'140    348'542    121'271   12'694        1
                'pseudo_costs':          1  12'686'501    242'381    783'820  737'732      133
               'quick_restart':          1  12'243'794    168'632    691'186      186        4
               'reduced_costs':          1  10'881'132    281'665  1'058'216  637'342       28

Lp dimension                                                                      Final dimension of first component
                  'default_lp':   642 rows, 416 columns, 2910 entries with magnitude in [4.230804e-04, 1.000000e+00]
                       'fixed':    267 rows, 416 columns, 981 entries with magnitude in [3.632164e-02, 1.000000e+00]
                   'fs_random':    134 rows, 416 columns, 531 entries with magnitude in [5.206023e-02, 1.000000e+00]
                   'fs_random':    184 rows, 416 columns, 706 entries with magnitude in [3.632164e-02, 1.000000e+00]
     'fs_random_quick_restart':    184 rows, 416 columns, 706 entries with magnitude in [3.632164e-02, 1.000000e+00]
     'fs_random_quick_restart':   407 rows, 416 columns, 1388 entries with magnitude in [6.284269e-03, 1.000000e+00]
              'lb_tree_search':   693 rows, 421 columns, 2637 entries with magnitude in [7.267605e-04, 1.000000e+00]
                      'max_lp':   684 rows, 421 columns, 2578 entries with magnitude in [8.504434e-04, 1.000000e+00]
         'objective_lb_search':   526 rows, 416 columns, 1983 entries with magnitude in [4.632970e-04, 1.000000e+00]
  'objective_lb_search_max_lp':   981 rows, 421 columns, 2535 entries with magnitude in [1.499327e-03, 1.000000e+00]
                     'probing':  1417 rows, 416 columns, 7638 entries with magnitude in [1.109879e-05, 1.000000e+00]
              'probing_max_lp':  1309 rows, 421 columns, 8184 entries with magnitude in [2.058657e-04, 1.000000e+00]
                'pseudo_costs':   569 rows, 421 columns, 1836 entries with magnitude in [3.154401e-03, 1.000000e+00]
               'quick_restart':  1032 rows, 416 columns, 3072 entries with magnitude in [1.253153e-04, 1.000000e+00]
               'reduced_costs':   606 rows, 421 columns, 2236 entries with magnitude in [1.988991e-03, 1.000000e+00]

Lp debug                         CutPropag  CutEqPropag     Adjust  Overflow          Bad  BadScaling
                  'default_lp':         84          824    516'221         0    2'535'546           0
                       'fixed':          0            0      5'054         0        4'206           0
                   'fs_random':          0            0          0         0           19           0
                   'fs_random':          0            0          0         0          197           0
     'fs_random_quick_restart':          0            0          0         0        1'499           0
     'fs_random_quick_restart':          0            0          0         0          142           0
              'lb_tree_search':         73           47  1'142'989         0      975'725           0
                      'max_lp':        170          153    665'940         0    1'778'763           0
         'objective_lb_search':         34          499    605'484         0    2'597'290           0
  'objective_lb_search_max_lp':        178          134    400'614         0    1'982'228           0
                     'probing':         85        1'982    161'287         0  130'329'260           0
              'probing_max_lp':        298        5'601    104'881         0   76'335'299           0
                'pseudo_costs':        214          191    929'831         0    2'283'657           0
               'quick_restart':        165          577    374'961         0    5'511'744           0
               'reduced_costs':        158          238    917'858         0    2'324'554           0

Lp pool                          Constraints  Updates  Simplif  Merged  Shortened    Split  Strenghtened          Cuts/Call
                  'default_lp':        8'121   10'223  119'590   1'768     20'499  107'174        62'762  387'414/1'281'887
                       'fixed':        2'150       50       35       4          0       12           107        1'679/6'466
                   'fs_random':          536        0        0       0          0        0             5              61/73
                   'fs_random':          697        0        0       0          0        0             5            222/345
     'fs_random_quick_restart':        1'186        5        0       0          0        0            41          711/1'227
     'fs_random_quick_restart':          684        0        0       0          0        0             5            209/314
              'lb_tree_search':       15'106    5'638  303'662     386     19'469   39'491       271'733     40'811/392'906
                      'max_lp':       14'015    8'000  415'637   1'579     18'568  138'540       324'805    160'913/498'665
         'objective_lb_search':        8'983    9'794   60'505   1'322     18'631  141'836        41'280    189'830/761'623
  'objective_lb_search_max_lp':       14'413    9'234  466'829     821     25'417  248'942       330'184     75'553/296'491
                     'probing':        9'864   31'125  115'094      19     19'662  392'124        40'102    158'408/391'715
              'probing_max_lp':       15'211   75'369  448'693      12     34'930  517'601       290'199    348'542/946'938
                'pseudo_costs':       12'809    8'532  493'070   2'253     20'430  120'793       332'203    242'381/629'619
               'quick_restart':        9'601   15'263  293'823     506     20'837  806'299        68'086    168'632/691'571
               'reduced_costs':       13'146    8'004  459'311   2'200     13'988  112'979       337'781    281'665/728'768

Lp Cut                                                fs_ran  fs_ran  fs_ran  fs_ran   defaul  fixed  max_lp  quick_  reduce  pseudo  lb_tre  probin  object   probin  object
                                              CG_FF:      11      30       -      11   15'704    122   8'235   2'663  18'959  15'151   1'675   5'725   7'325    1'850   2'613
                                               CG_K:      10      23       -      10    9'999     76   6'776   1'013  17'764  15'778   1'445     678   5'415    1'089   2'439
                                              CG_KL:       -       -       -       -        1      -       3       -       -       1       1       -       -        -       -
                                               CG_R:       6      31       -       6   13'147     92   6'224   1'863  15'559  12'393   1'238   1'545   6'712    5'691   1'975
                                              CG_RB:       -       7       -       -   54'332    157  19'507  28'544  36'946  33'644   3'842  38'535  39'564    4'860   5'980
                                             CG_RBP:       -       -       -       -    8'554     21   3'559   4'173   8'586   6'046     701   8'628   4'757    1'427     748
                                             Clique:       -       -       -       -        -      -     583       -   1'545   1'716     246       -       -      550     309
                                                 IB:      91     290      50      91  172'334    592  36'015  71'257  46'997  34'702   6'341  20'797  60'038   17'742  13'503
                                           MIR_1_FF:      41      69       4      36   10'212     95   5'790   4'582  11'116   9'570   1'753   4'699   5'645    6'436   3'196
                                            MIR_1_K:       6       7       -       4    2'319     14   2'434     754   4'118   3'996     683     767   1'309    1'805   1'089
                                           MIR_1_KL:       -       -       -       -      300      -     158      88     293     150       8     139      12      356       8
                                            MIR_1_R:      15      24       -      12    2'749     37   1'354     969   3'038   2'460     313   1'360   1'566    3'036     720
                                           MIR_1_RB:      15      55       2      11   18'959    118  14'236  10'584  23'425  20'468   4'497  10'153  10'383   16'915   8'730
                                          MIR_1_RBP:       -       6       -       -      784      8   2'839     338   4'298   3'112     486     419     147    1'419     521
                                          MIR_1_RLT:       -       -       -       -        -      -      96       -     256     216      25       -       -      309      72
                                           MIR_2_FF:       3      31       2       8    7'267     51   4'183   2'862   8'226   7'488   1'292   2'987   4'101    4'602   2'419
                                            MIR_2_K:       2       7       -       2    2'002     15   1'315     596   2'574   2'343     366     785     985    1'056     568
                                           MIR_2_KL:       -       -       -       -      239      -     137      93     254     167      14     156      29      249      19
                                            MIR_2_R:       1       5       1       1    2'061     12   1'106     872   2'074   2'069     377   1'426   1'236    3'434     717
                                           MIR_2_RB:       9      39       1       4   12'564     66   7'409   6'981  12'428  11'333   2'032   6'960   7'562    8'820   4'084
                                          MIR_2_RBP:       -       3       -       -      980      7   1'254     415   2'168   1'538     194     533     257    1'312     220
                                           MIR_3_FF:       4      17       1       3    4'314     20   2'987   1'832   5'340   5'448     869   1'749   2'777    2'750   1'644
                                            MIR_3_K:       1       2       -       1    1'315     13     934     374   1'786   1'793     260     452     812      688     452
                                           MIR_3_KL:       -       -       -       -      191      -     105      81     192     134      26     176      42      191      28
                                            MIR_3_R:       2       7       -       -    1'317     11     872     633   1'578   1'671     343     825     911    2'616     647
                                           MIR_3_RB:       -       9       -       3    7'807     28   4'460   4'303   7'080   6'863   1'325   4'287   4'927    6'542   2'634
                                          MIR_3_RBP:       -       -       -       -      778      1     846     293   1'295   1'051     133     570     247    1'236     154
                                           MIR_4_FF:       1       2       -       -    2'650      7   1'625   1'158   2'717   2'903     465   1'126   1'903    1'582     976
                                            MIR_4_K:       -       2       -       -    1'066      3     567     296   1'148   1'162     171     351     587      505     297
                                           MIR_4_KL:       -       -       -       -      162      -      85      44     133     118      31     124      33      162      33
                                            MIR_4_R:       -       1       -       -    1'100      1     543     501     905   1'010     162     625     794    1'400     403
                                           MIR_4_RB:       1       8       -       -    4'792      9   2'617   2'562   3'803   3'872     753   2'555   3'153    4'215   1'598
                                          MIR_4_RBP:       -       1       -       -      568      -     443     216     760     620      81     383     189      719     126
                                           MIR_5_FF:       -       1       -       -    1'614      2     924     710   1'459   1'526     321     727   1'143      937     628
                                            MIR_5_K:       -       1       -       -      682      1     361     176     657     675     109     255     395      373     204
                                           MIR_5_KL:       -       -       -       -      134      -      62      77     102      79      20     163      25      152      28
                                            MIR_5_R:       -       1       -       -      712      2     311     373     477     582     118     380     622    1'003     273
                                           MIR_5_RB:       -       4       -       -    2'873      7   1'544   1'445   2'142   2'192     455   1'567   1'857    2'767     972
                                          MIR_5_RBP:       -       1       -       -      401      -     276     139     474     430      63     301     152      623      80
                                           MIR_6_FF:       -       1       -       -      843      3     524     408     789     888     207     554     702      740     340
                                            MIR_6_K:       -       -       -       -      460      -     242     116     426     492      90     197     261      304     164
                                           MIR_6_KL:       -       -       -       -      120      -      59      75      78      64      23     162      32      172      32
                                            MIR_6_R:       -       1       -       -      412      -     161     219     274     380      66     225     400      946     141
                                           MIR_6_RB:       -       1       -       -    1'706      4     906     841   1'313   1'358     276   1'063   1'052    1'871     586
                                          MIR_6_RBP:       -       -       -       -      280      1     201     109     332     311      47     288     122      603      63
   NoOverlapCompletionTimeExhaustiveMirror_weighted:       -       -       -       -        -      -       -       -       1       -       -       -       -        -       -
         NoOverlapCompletionTimeExhaustive_weighted:       -       -       -       -        -      -     508       -   1'028     807      68       -       -      131     235
  NoOverlapCompletionTimeExhaustive_weighted_lifted:       -       -       -       -        -      -      30       -      90      75       7       -       -        -       2
                          NoOverlapDisjunctionOnEnd:       -       -       -       -        -      -       3       -       4       -       -       -       -        -       -
                        NoOverlapDisjunctionOnStart:       -       -       -       -        -      -     169       -     521     512      21       -       -        8      47
                                       ZERO_HALF_FF:       -       8       -       2    2'571     21   1'664     752   3'638   3'106     419     444   1'354      376     753
                                        ZERO_HALF_K:       1       3       -       1      815      4     765     179   1'943   1'666     246     105     402      344     432
                                       ZERO_HALF_KL:       -       -       -       -        6      -       4       -       5       1       1       -       1        1       1
                                        ZERO_HALF_R:       1       8       -       2    7'518     33   7'929   8'787  10'412   9'567   4'627  26'701   4'878  214'109   8'873
                                       ZERO_HALF_RB:       1       5       -       1    4'653     19   3'826   2'825   6'287   5'379   1'273   5'085   2'680   11'648   2'481
                                      ZERO_HALF_RBP:       -       -       -       -    1'047      6   1'147     461   1'852   1'305     206     676     334    5'870     296

LNS stats                        Improv/Calls  Closed  Difficulty  TimeLimit
               'graph_arc_lns':       21/3636     51%        0.99       0.38
               'graph_cst_lns':       49/3608     51%        0.99       0.31
               'graph_dec_lns':       20/3637     51%        0.99       0.39
               'graph_var_lns':       35/3637     51%        0.99       0.38
                   'rins/rens':      454/3228     50%        0.89       0.10
                 'rnd_cst_lns':       25/3637     51%        0.99       0.39
                 'rnd_var_lns':       23/3637     51%        0.99       0.38
    'scheduling_intervals_lns':       19/3637      9%        0.00       0.40
  'scheduling_precedences_lns':       19/3637      8%        0.00       0.40
  'scheduling_time_window_lns':       19/3637      9%        0.00       0.40

LS stats                   Batches  Restarts    LinMoves   GenMoves  CompoundMoves  WeightUpdates
       'fj_long_default':        1         1       9'807          0              0            193
   'fj_long_lin_default':        1         1           0      1'970            401              0
        'fj_long_random':        1         1       7'213          0              0            172
      'fj_short_default':        3         1           0      5'951            835              2
  'fj_short_lin_default':        1         1           0      1'936            291              1
   'fj_short_lin_random':        1         1           0      1'948            385              0
       'fj_short_random':        1         1           0      2'311            281              0
          'violation_ls':    3'638         0  17'065'769  5'362'158        274'824      2'167'931
          'violation_ls':    3'638         0  18'788'251  4'978'783        292'386      2'423'263

Solutions (40)                   Num     Rank
               'graph_arc_lns':    3  [27,35]
                       'no_lp':   15   [2,20]
               'quick_restart':    1  [28,28]
         'quick_restart_no_lp':    8   [1,37]
                 'rins_lp_lns':    2  [19,30]
                 'rnd_var_lns':    2  [39,40]
  'scheduling_time_window_lns':    1  [29,29]
                'violation_ls':    8   [3,38]

Objective bounds                     Num
                      'default_lp':    2
         'fs_random_quick_restart':    1
                  'initial_domain':    1
                  'lb_tree_search':   16
                          'max_lp':    1
             'objective_lb_search':    9
      'objective_lb_search_max_lp':    5
       'objective_lb_search_no_lp':  180
  'objective_shaving_search_no_lp':    9
                   'reduced_costs':    5

Solution repositories     Added  Queried  Ignored  Synchro
  'feasible solutions':  35'279   82'738        2   34'393
        'lp solutions':  25'005    1'766        0   18'669
                'pump':  76'342    1'872

Improving bounds shared            Num
                        'core':     14
                  'default_lp':    805
                       'fixed':     26
              'lb_tree_search':     80
                      'max_lp':    359
                       'no_lp':    270
         'objective_lb_search':     42
  'objective_lb_search_max_lp':    390
   'objective_lb_search_no_lp':    250
                     'probing':  2'733
              'probing_max_lp':  1'687
                'pseudo_costs':    736
               'quick_restart':    971
         'quick_restart_no_lp':  9'674
               'reduced_costs':    998

Clauses shared                   Num
                        'core':    5
                  'default_lp':   79
              'lb_tree_search':   10
                      'max_lp':   82
                       'no_lp':   67
         'objective_lb_search':   34
  'objective_lb_search_max_lp':   89
   'objective_lb_search_no_lp':   73
                'pseudo_costs':  236
               'quick_restart':   15
         'quick_restart_no_lp':   30
               'reduced_costs':   21

CpSolverResponse summary:
status: OPTIMAL
objective: 1304
best_bound: 1304
integers: 418
booleans: 110
conflicts: 0
branches: 220
propagations: 36
integer_propagations: 6197
restarts: 220
lp_iterations: 221
walltime: 1994.52
usertime: 1994.52
deterministic_time: 25173.9
gap_integral: 54762.6
solution_fingerprint: 0x25e49d477af14ce0


--- Simulation Gantt  partir du modle mathmatique ---
