created virtual environment CPython3.12.4.final.0-64 in 4907ms
  creator CPython3Posix(dest=/localscratch/aneumann.63393179.0/env, clear=False, no_vcs_ignore=False, global=False)
  seeder FromAppData(download=False, pip=bundle, via=copy, app_data_dir=/home/aneumann/.local/share/virtualenv)
    added seed packages: pip==25.1.1
  activators BashActivator,CShellActivator,FishActivator,NushellActivator,PowerShellActivator,PythonActivator
Looking in links: /cvmfs/soft.computecanada.ca/custom/python/wheelhouse/gentoo2023/x86-64-v3, /cvmfs/soft.computecanada.ca/custom/python/wheelhouse/gentoo2023/generic, /cvmfs/soft.computecanada.ca/custom/python/wheelhouse/generic
Requirement already satisfied: pip in /localscratch/aneumann.63393179.0/env/lib/python3.12/site-packages (25.1.1)
Looking in links: /cvmfs/soft.computecanada.ca/custom/python/wheelhouse/gentoo2023/x86-64-v3, /cvmfs/soft.computecanada.ca/custom/python/wheelhouse/gentoo2023/generic, /cvmfs/soft.computecanada.ca/custom/python/wheelhouse/generic
ERROR: protobuf-5.28.3-cp38-abi3-manylinux2014_x86_64.whl is not a supported wheel on this platform.
Looking in links: /cvmfs/soft.computecanada.ca/custom/python/wheelhouse/gentoo2023/x86-64-v3, /cvmfs/soft.computecanada.ca/custom/python/wheelhouse/gentoo2023/generic, /cvmfs/soft.computecanada.ca/custom/python/wheelhouse/generic
Processing /home/aneumann/projects/def-adhaj/aneumann/GNRS/wheels/immutabledict-4.2.0-py3-none-any.whl
Installing collected packages: immutabledict
Successfully installed immutabledict-4.2.0
Looking in links: /cvmfs/soft.computecanada.ca/custom/python/wheelhouse/gentoo2023/x86-64-v3, /cvmfs/soft.computecanada.ca/custom/python/wheelhouse/gentoo2023/generic, /cvmfs/soft.computecanada.ca/custom/python/wheelhouse/generic
Processing /cvmfs/soft.computecanada.ca/custom/python/wheelhouse/generic/ortools-9.10.4067+computecanada-cp312-cp312-linux_x86_64.whl (from -r /home/aneumann/projects/def-adhaj/aneumann/GNRS/requirements/or.txt (line 1))
Processing /cvmfs/soft.computecanada.ca/custom/python/wheelhouse/gentoo2023/x86-64-v3/matplotlib-3.10.0+computecanada-cp312-cp312-linux_x86_64.whl (from -r /home/aneumann/projects/def-adhaj/aneumann/GNRS/requirements/or.txt (line 2))
Processing /cvmfs/soft.computecanada.ca/custom/python/wheelhouse/gentoo2023/x86-64-v3/pandas-2.2.3+computecanada-cp312-cp312-linux_x86_64.whl (from -r /home/aneumann/projects/def-adhaj/aneumann/GNRS/requirements/or.txt (line 3))
Processing /cvmfs/soft.computecanada.ca/custom/python/wheelhouse/generic/absl_py-2.2.2+computecanada-py3-none-any.whl (from ortools<9.11,>=9.10->-r /home/aneumann/projects/def-adhaj/aneumann/GNRS/requirements/or.txt (line 1))
Processing /cvmfs/soft.computecanada.ca/custom/python/wheelhouse/gentoo2023/generic/numpy-2.2.2+computecanada-cp312-cp312-linux_x86_64.whl (from ortools<9.11,>=9.10->-r /home/aneumann/projects/def-adhaj/aneumann/GNRS/requirements/or.txt (line 1))
Processing /cvmfs/soft.computecanada.ca/custom/python/wheelhouse/gentoo2023/x86-64-v3/protobuf-6.30.2+computecanada-cp312-cp312-linux_x86_64.whl (from ortools<9.11,>=9.10->-r /home/aneumann/projects/def-adhaj/aneumann/GNRS/requirements/or.txt (line 1))
Requirement already satisfied: immutabledict>=3.0.0 in /localscratch/aneumann.63393179.0/env/lib/python3.12/site-packages (from ortools<9.11,>=9.10->-r /home/aneumann/projects/def-adhaj/aneumann/GNRS/requirements/or.txt (line 1)) (4.2.0)
Processing /cvmfs/soft.computecanada.ca/custom/python/wheelhouse/gentoo2023/generic/contourpy-1.3.1+computecanada-cp312-cp312-linux_x86_64.whl (from matplotlib->-r /home/aneumann/projects/def-adhaj/aneumann/GNRS/requirements/or.txt (line 2))
Processing /cvmfs/soft.computecanada.ca/custom/python/wheelhouse/generic/cycler-0.12.1+computecanada-py3-none-any.whl (from matplotlib->-r /home/aneumann/projects/def-adhaj/aneumann/GNRS/requirements/or.txt (line 2))
Processing /cvmfs/soft.computecanada.ca/custom/python/wheelhouse/generic/fonttools-4.58.2+computecanada-cp312-cp312-linux_x86_64.whl (from matplotlib->-r /home/aneumann/projects/def-adhaj/aneumann/GNRS/requirements/or.txt (line 2))
Processing /cvmfs/soft.computecanada.ca/custom/python/wheelhouse/gentoo2023/x86-64-v3/kiwisolver-1.4.8+computecanada-cp312-cp312-linux_x86_64.whl (from matplotlib->-r /home/aneumann/projects/def-adhaj/aneumann/GNRS/requirements/or.txt (line 2))
Processing /cvmfs/soft.computecanada.ca/custom/python/wheelhouse/generic/packaging-25.0+computecanada-py3-none-any.whl (from matplotlib->-r /home/aneumann/projects/def-adhaj/aneumann/GNRS/requirements/or.txt (line 2))
Processing /cvmfs/soft.computecanada.ca/custom/python/wheelhouse/gentoo2023/x86-64-v3/pillow-11.1.0+computecanada-cp312-cp312-linux_x86_64.whl (from matplotlib->-r /home/aneumann/projects/def-adhaj/aneumann/GNRS/requirements/or.txt (line 2))
Processing /cvmfs/soft.computecanada.ca/custom/python/wheelhouse/generic/pyparsing-3.2.1+computecanada-py3-none-any.whl (from matplotlib->-r /home/aneumann/projects/def-adhaj/aneumann/GNRS/requirements/or.txt (line 2))
Processing /cvmfs/soft.computecanada.ca/custom/python/wheelhouse/generic/python_dateutil-2.9.0.post0+computecanada-py2.py3-none-any.whl (from matplotlib->-r /home/aneumann/projects/def-adhaj/aneumann/GNRS/requirements/or.txt (line 2))
Processing /cvmfs/soft.computecanada.ca/custom/python/wheelhouse/generic/pytz-2025.2+computecanada-py2.py3-none-any.whl (from pandas->-r /home/aneumann/projects/def-adhaj/aneumann/GNRS/requirements/or.txt (line 3))
Processing /cvmfs/soft.computecanada.ca/custom/python/wheelhouse/generic/tzdata-2025.2+computecanada-py2.py3-none-any.whl (from pandas->-r /home/aneumann/projects/def-adhaj/aneumann/GNRS/requirements/or.txt (line 3))
Processing /cvmfs/soft.computecanada.ca/custom/python/wheelhouse/generic/six-1.17.0+computecanada-py2.py3-none-any.whl (from python-dateutil>=2.7->matplotlib->-r /home/aneumann/projects/def-adhaj/aneumann/GNRS/requirements/or.txt (line 2))
Installing collected packages: pytz, tzdata, six, pyparsing, protobuf, pillow, packaging, numpy, kiwisolver, fonttools, cycler, absl-py, python-dateutil, contourpy, pandas, matplotlib, ortools

Successfully installed absl-py-2.2.2+computecanada contourpy-1.3.1+computecanada cycler-0.12.1+computecanada fonttools-4.58.2+computecanada kiwisolver-1.4.8+computecanada matplotlib-3.10.0+computecanada numpy-2.2.2+computecanada ortools-9.10.4067+computecanada packaging-25.0+computecanada pandas-2.2.3+computecanada pillow-11.1.0+computecanada protobuf-6.30.2+computecanada pyparsing-3.2.1+computecanada python-dateutil-2.9.0.post0+computecanada pytz-2025.2+computecanada six-1.17.0+computecanada tzdata-2025.2+computecanada

Starting CP-SAT solver v9.10.4067
Parameters: max_time_in_seconds: 3600 max_memory_in_mb: 12000 log_search_progress: true enumerate_all_solutions: false absolute_gap_limit: 0 relative_gap_limit: 0
Setting number of workers to 48

Initial optimization model '': (model_fingerprint: 0xb26e00044a734857)
#Variables: 166 (#ints: 6 in objective)
  - 107 Booleans in [0,1]
  - 59 in [0,333]
#kLinear1: 26
#kLinear2: 211
#kLinear3: 79
#kLinearN: 675 (#terms: 6'863)

Starting presolve at 0.00s
  2.74e-04s  0.00e+00d  [DetectDominanceRelations] 
  9.10e-03s  0.00e+00d  [PresolveToFixPoint] #num_loops=6 #num_dual_strengthening=3 
  1.61e-05s  0.00e+00d  [ExtractEncodingFromLinear] #potential_supersets=3 
[Symmetry] Graph for symmetry has 914 nodes and 4'212 arcs.
[Symmetry] Symmetry computation done. time: 0.000582054 dtime: 0.00046244
[Symmetry] #generators: 1, average support size: 16
[Symmetry] The model contains 111 duplicate constraints !
[Symmetry] 8 orbits with sizes: 2,2,2,2,2,2,2,2
[Symmetry] Num fixable by intersecting at_most_one with orbits: 1 largest_orbit: 2
  1.87e-03s  1.94e-04d  [Probe] #probed=136 #fixed_bools=2 #new_bounds=5 #equiv=1 
  3.09e-05s  0.00e+00d  [MaxClique] Merged 18(36 literals) into 4(8 literals) at_most_ones. 
  2.57e-04s  0.00e+00d  [DetectDominanceRelations] 
  3.14e-03s  0.00e+00d  [PresolveToFixPoint] #num_loops=4 #num_dual_strengthening=3 
  9.11e-04s  0.00e+00d  [ProcessAtMostOneAndLinear] 
  6.36e-04s  0.00e+00d  [DetectDuplicateConstraints] #duplicates=123 #without_enforcements=51 
  2.77e-04s  9.71e-06d  [DetectDominatedLinearConstraints] #relevant_constraints=399 #num_inclusions=231 #num_redundant=2 
  1.26e-04s  0.00e+00d  [DetectDifferentVariables] #different=16 
  8.75e-05s  2.65e-06d  [ProcessSetPPC] #relevant_constraints=188 
  9.97e-06s  0.00e+00d  [FindAlmostIdenticalLinearConstraints] 
  3.72e-05s  1.93e-05d  [FindBigAtMostOneAndLinearOverlap] 
  6.72e-04s  2.03e-04d  [FindBigVerticalLinearOverlap] #blocks=5 #saved_nz=246 
  4.52e-05s  7.44e-06d  [FindBigHorizontalLinearOverlap] #linears=178 
  5.00e-06s  0.00e+00d  [MergeClauses] 
  2.53e-04s  0.00e+00d  [DetectDominanceRelations] 
  3.41e-03s  0.00e+00d  [PresolveToFixPoint] #num_loops=2 #num_dual_strengthening=1 
  2.49e-04s  0.00e+00d  [DetectDominanceRelations] 
  2.26e-03s  0.00e+00d  [PresolveToFixPoint] #num_loops=1 #num_dual_strengthening=1 
[Symmetry] Graph for symmetry has 768 nodes and 3'398 arcs.
[Symmetry] Symmetry computation done. time: 0.000184548 dtime: 0.00022057
  1.61e-03s  1.81e-04d  [Probe] #probed=132 #new_bounds=13 
  5.31e-06s  0.00e+00d  [MaxClique] 
  2.51e-04s  0.00e+00d  [DetectDominanceRelations] 
  4.35e-03s  0.00e+00d  [PresolveToFixPoint] #num_loops=4 #num_dual_strengthening=3 
  7.29e-04s  0.00e+00d  [ProcessAtMostOneAndLinear] 
  5.09e-04s  0.00e+00d  [DetectDuplicateConstraints] #without_enforcements=56 
  1.76e-04s  6.02e-06d  [DetectDominatedLinearConstraints] #relevant_constraints=305 #num_inclusions=38 
  1.15e-04s  0.00e+00d  [DetectDifferentVariables] #different=18 
  8.04e-05s  2.21e-06d  [ProcessSetPPC] #relevant_constraints=173 
  1.20e-05s  0.00e+00d  [FindAlmostIdenticalLinearConstraints] 
  3.33e-05s  1.77e-05d  [FindBigAtMostOneAndLinearOverlap] 
  4.79e-04s  1.78e-04d  [FindBigVerticalLinearOverlap] #blocks=2 #saved_nz=67 
  4.19e-05s  6.82e-06d  [FindBigHorizontalLinearOverlap] #linears=171 
  4.60e-06s  0.00e+00d  [MergeClauses] 
  2.54e-04s  0.00e+00d  [DetectDominanceRelations] 
  2.90e-03s  0.00e+00d  [PresolveToFixPoint] #num_loops=2 #num_dual_strengthening=1 
  2.54e-04s  0.00e+00d  [DetectDominanceRelations] 
  2.22e-03s  0.00e+00d  [PresolveToFixPoint] #num_loops=1 #num_dual_strengthening=1 
[Symmetry] Graph for symmetry has 773 nodes and 3'332 arcs.
[Symmetry] Symmetry computation done. time: 0.000182263 dtime: 0.0002164
  1.59e-03s  1.79e-04d  [Probe] #probed=132 #new_bounds=2 
  5.40e-06s  0.00e+00d  [MaxClique] 
  2.57e-04s  0.00e+00d  [DetectDominanceRelations] 
  2.86e-03s  0.00e+00d  [PresolveToFixPoint] #num_loops=2 #num_dual_strengthening=1 
  7.00e-04s  0.00e+00d  [ProcessAtMostOneAndLinear] 
  5.17e-04s  0.00e+00d  [DetectDuplicateConstraints] #without_enforcements=60 
  1.69e-04s  5.57e-06d  [DetectDominatedLinearConstraints] #relevant_constraints=296 #num_inclusions=38 
  1.13e-04s  0.00e+00d  [DetectDifferentVariables] #different=18 
  7.83e-05s  1.95e-06d  [ProcessSetPPC] #relevant_constraints=162 
  1.24e-05s  0.00e+00d  [FindAlmostIdenticalLinearConstraints] 
  3.29e-05s  1.69e-05d  [FindBigAtMostOneAndLinearOverlap] 
  4.87e-04s  1.67e-04d  [FindBigVerticalLinearOverlap] #blocks=2 #saved_nz=82 
  3.88e-05s  5.99e-06d  [FindBigHorizontalLinearOverlap] #linears=160 
  4.66e-06s  0.00e+00d  [MergeClauses] 
  2.55e-04s  0.00e+00d  [DetectDominanceRelations] 
  2.67e-03s  0.00e+00d  [PresolveToFixPoint] #num_loops=2 #num_dual_strengthening=1 
  2.75e-05s  0.00e+00d  [ExpandObjective] #entries=36 #tight_variables=18 #tight_constraints=9 

Presolve summary:
  - 26 affine relations were detected.
  - rule 'TODO dual: only one blocking constraint?' was applied 491 times.
  - rule 'TODO dual: only one unspecified blocking constraint?' was applied 90 times.
  - rule 'TODO duplicate: identical constraint with different enforcements' was applied 167 times.
  - rule 'affine: new relation' was applied 26 times.
  - rule 'at_most_one: removed literals' was applied 4 times.
  - rule 'at_most_one: size one' was applied 4 times.
  - rule 'at_most_one: transformed into max clique.' was applied 1 time.
  - rule 'deductions: 76 stored' was applied 1 time.
  - rule 'dual: fix variable' was applied 15 times.
  - rule 'dual: reduced domain' was applied 40 times.
  - rule 'duplicate: merged rhs of linear constraint' was applied 16 times.
  - rule 'duplicate: removed constraint' was applied 123 times.
  - rule 'enforcement: false literal' was applied 12 times.
  - rule 'enforcement: true literal' was applied 8 times.
  - rule 'exactly_one: x and not(x)' was applied 1 time.
  - rule 'incompatible linear: add implication' was applied 9 times.
  - rule 'linear inclusion: redundant containing constraint' was applied 2 times.
  - rule 'linear matrix: common vertical rectangle' was applied 9 times.
  - rule 'linear: always true' was applied 318 times.
  - rule 'linear: doubleton free' was applied 7 times.
  - rule 'linear: empty' was applied 18 times.
  - rule 'linear: extracted enforcement literal' was applied 1'394 times.
  - rule 'linear: fixed or dup variables' was applied 676 times.
  - rule 'linear: positive equal one' was applied 3 times.
  - rule 'linear: reduced variable domains' was applied 70 times.
  - rule 'linear: remapped using affine relations' was applied 652 times.
  - rule 'linear: simplified rhs' was applied 1'892 times.
  - rule 'linear: variable substitution 1' was applied 7 times.
  - rule 'linear: variable substitution 2' was applied 1 time.
  - rule 'presolve: 55 unused variables removed.' was applied 1 time.
  - rule 'presolve: iteration' was applied 3 times.
  - rule 'probing: reduced enforced constraint to implication.' was applied 18 times.
  - rule 'symmetry: fixed to false in general orbit' was applied 1 time.

Presolved optimization model '': (model_fingerprint: 0xf4835abf2cec96fa)
#Variables: 86 (#ints: 6 in objective)
  - 33 Booleans in [0,1]
  - 1 in [-313,-30][3,303][336,619]
  - 1 in [-313,-30][3,303][336,636][669,911]
  - 1 in [-2,271]
  - 1 in [-2,312]
  - 1 in [0,174]
  - 1 in [0,223]
  - 3 in [0,237]
  - 1 in [0,239]
  - 1 in [0,246]
  - 1 in [0,247]
  - 4 in [0,252]
  - 1 in [0,273]
  - 3 in [0,282]
  - 3 in [0,300]
  - 1 in [0,314]
  - 1 in [3,240]
  - 1 in [3,276]
  - 1 in [3,285]
  - 1 in [3,303]
  - 1 in [3,317]
  - 1 in [22,304]
  - 1 in [22,304][355,637]
  - 1 in [22,304][355,637][688,970]
  - 1 in [45,282]
  - 1 in [45,282][378,615]
  - 1 in [45,282][378,615][711,890]
  - 2 in [75,322]
  - 2 in [76,322]
  - 1 in [81,328]
  - 1 in [82,328]
  - 2 in [83,322]
  - 1 in [89,328]
  - 6 in [92,322]
  - 2 in [98,328]
  - 1 in [103,333]
#kExactlyOne: 2 (#literals: 6)
#kLinear2: 208 (#enforced: 175 #multi: 151)
#kLinear3: 87 (#enforced: 74 #multi: 36)
#kLinearN: 178 (#enforced: 138) (#terms: 1'271)

Preloading model.
#Bound   0.05s best:inf   next:[103,1462] initial_domain
[Symmetry] Graph for symmetry has 685 nodes and 3'247 arcs.
[Symmetry] Symmetry computation done. time: 0.000176394 dtime: 0.00020396
#Model   0.05s var:86/86 constraints:475/475

Starting search at 0.05s with 48 workers.
16 full problem subsolvers: [core, default_lp, lb_tree_search, max_lp, no_lp, objective_lb_search, objective_lb_search_max_lp, objective_lb_search_no_lp, objective_shaving_search_max_lp, objective_shaving_search_no_lp, probing, probing_max_lp, pseudo_costs, quick_restart, quick_restart_no_lp, reduced_costs]
30 first solution subsolvers: [fj_long_default(2), fj_long_lin_default, fj_long_lin_perturb, fj_long_lin_random, fj_long_perturb, fj_long_random, fj_short_default(2), fj_short_lin_default(2), fj_short_lin_perturb, fj_short_lin_random, fj_short_perturb, fj_short_random, fs_random(4), fs_random_no_lp(4), fs_random_quick_restart(4), fs_random_quick_restart_no_lp(3)]
13 incomplete subsolvers: [feasibility_pump, graph_arc_lns, graph_cst_lns, graph_dec_lns, graph_var_lns, rins/rens, rnd_cst_lns, rnd_var_lns, violation_ls(5)]
3 helper subsolvers: [neighborhood_helper, synchronization_agent, update_gap_integral]
#Bound   0.06s best:inf   next:[104,1462] bool_core (num_cores=1 [size:1 mw:1] a=6 d=0 fixed=0/39 clauses=2)
#1       0.06s best:692   next:[104,691]  no_lp (fixed_bools=0/52)
#2       0.06s best:582   next:[104,581]  quick_restart_no_lp (fixed_bools=0/54)
#Bound   0.06s best:582   next:[105,581]  bool_core (num_cores=2 [size:1 mw:1] a=6 d=0 fixed=1/40 clauses=2)
#3       0.06s best:386   next:[105,385]  no_lp (fixed_bools=0/64)
#Bound   0.06s best:386   next:[114,385]  objective_lb_search_no_lp
#4       0.06s best:385   next:[114,384]  violation_ls(batch:1 #solutions_imported:1 #lin_moves:0 #lin_evals:114 #gen_moves:52 #gen_evals:0 #comp_moves:6 #backtracks:23 #weight_updates:1)
#5       0.06s best:376   next:[114,375]  no_lp (fixed_bools=0/70)
#6       0.06s best:370   next:[114,369]  no_lp (fixed_bools=0/76)
#Bound   0.06s best:370   next:[115,369]  bool_core (num_cores=3 [cover] a=5 d=1 fixed=10/68 clauses=49)
#Bound   0.06s best:370   next:[116,369]  bool_core (num_cores=3 [cover] a=5 d=1 fixed=11/71 clauses=59)
#Bound   0.06s best:370   next:[117,369]  bool_core (num_cores=3 [cover] a=5 d=1 fixed=12/74 clauses=70)
#Bound   0.06s best:370   next:[118,369]  bool_core (num_cores=3 [cover] a=5 d=1 fixed=13/77 clauses=82)
#Bound   0.06s best:370   next:[119,369]  bool_core (num_cores=3 [cover] a=5 d=1 fixed=14/80 clauses=95)
#7       0.06s best:316   next:[119,315]  no_lp (fixed_bools=0/83)
#Bound   0.06s best:316   next:[120,315]  bool_core (num_cores=3 [cover] a=5 d=1 fixed=15/83 clauses=109)
#Bound   0.06s best:316   next:[121,315]  bool_core (num_cores=3 [cover] a=5 d=1 fixed=16/86 clauses=124)
#Bound   0.06s best:316   next:[122,315]  bool_core (num_cores=3 [cover] a=5 d=1 fixed=17/89 clauses=140)
#8       0.06s best:315   next:[122,314]  violation_ls(batch:1 #solutions_imported:1 #lin_moves:21 #lin_evals:99 #weight_updates:12)
#Bound   0.06s best:315   next:[123,314]  bool_core (num_cores=3 [cover] a=5 d=1 fixed=18/92 clauses=157)
#Bound   0.06s best:315   next:[124,314]  bool_core (num_cores=3 [cover] a=5 d=1 fixed=19/95 clauses=175)
#9       0.06s best:314   next:[124,313]  violation_ls(batch:1 #solutions_imported:1 #lin_moves:0 #lin_evals:4 #gen_moves:1 #gen_evals:0 #comp_moves:1 #backtracks:0 #weight_updates:0)
#Bound   0.06s best:314   next:[125,313]  bool_core (num_cores=3 [cover] a=5 d=1 fixed=20/98 clauses=194)
#Bound   0.06s best:314   next:[126,313]  bool_core (num_cores=3 [cover] a=5 d=1 fixed=21/101 clauses=214)
#Bound   0.06s best:314   next:[127,313]  bool_core (num_cores=3 [cover] a=5 d=1 fixed=22/104 clauses=235)
#10      0.06s best:313   next:[127,312]  violation_ls(batch:1 #solutions_imported:1 #lin_moves:0 #lin_evals:12 #gen_moves:6 #gen_evals:0 #comp_moves:6 #backtracks:0 #weight_updates:0)
#Bound   0.06s best:313   next:[128,312]  bool_core (num_cores=3 [cover] a=5 d=1 fixed=23/107 clauses=257)
#Bound   0.06s best:313   next:[129,312]  bool_core (num_cores=3 [cover] a=5 d=1 fixed=24/110 clauses=280)
#Bound   0.06s best:313   next:[130,312]  bool_core (num_cores=3 [cover] a=5 d=1 fixed=25/113 clauses=304)
#Bound   0.06s best:313   next:[131,312]  bool_core (num_cores=3 [cover] a=5 d=1 fixed=26/116 clauses=329)
#11      0.06s best:312   next:[132,311]  violation_ls(batch:2 #solutions_imported:2 #lin_moves:1 #lin_evals:120 #gen_moves:52 #gen_evals:0 #comp_moves:6 #backtracks:23 #weight_updates:1)
#12      0.06s best:311   next:[132,310]  violation_ls(batch:2 #solutions_imported:2 #lin_moves:5 #lin_evals:29 #gen_moves:1 #gen_evals:0 #comp_moves:1 #backtracks:0 #weight_updates:4)
#13      0.06s best:310   next:[132,309]  violation_ls(batch:2 #solutions_imported:2 #lin_moves:1 #lin_evals:118 #gen_moves:52 #gen_evals:0 #comp_moves:6 #backtracks:23 #weight_updates:1)
#14      0.07s best:309   next:[132,308]  violation_ls(batch:2 #solutions_imported:2 #lin_moves:15 #lin_evals:89 #gen_moves:6 #gen_evals:0 #comp_moves:6 #backtracks:0 #weight_updates:9)
#15      0.07s best:308   next:[133,307]  violation_ls(batch:3 #solutions_imported:3 #lin_moves:2 #lin_evals:125 #gen_moves:52 #gen_evals:0 #comp_moves:6 #backtracks:23 #weight_updates:1)
#16      0.07s best:307   next:[133,306]  violation_ls(batch:3 #solutions_imported:3 #lin_moves:23 #lin_evals:225 #gen_moves:52 #gen_evals:0 #comp_moves:6 #backtracks:23 #weight_updates:14)
#17      0.07s best:306   next:[133,305]  violation_ls(batch:3 #solutions_imported:3 #lin_moves:15 #lin_evals:92 #gen_moves:7 #gen_evals:0 #comp_moves:7 #backtracks:0 #weight_updates:9)
#18      0.07s best:298   next:[139,297]  no_lp (fixed_bools=3/92)
#19      0.07s best:296   next:[146,295]  no_lp (fixed_bools=3/104)
#20      0.07s best:285   next:[150,284]  no_lp (fixed_bools=3/107)
#21      0.08s best:281   next:[189,280]  no_lp (fixed_bools=3/118)
#22      0.08s best:265   next:[191,264]  no_lp (fixed_bools=3/123)
#Model   0.10s var:85/86 constraints:367/475
#Model   0.10s var:84/86 constraints:355/475
#Model   0.11s var:80/86 constraints:294/475
#Model   0.11s var:78/86 constraints:261/475
#Done    0.11s objective_lb_search_no_lp
#Model   0.11s var:74/86 constraints:204/475
#Bound   0.11s best:265   next:[261,264]  objective_lb_search_no_lp [skipped_logs=39]

Task timing                                  n [     min,      max]      avg      dev     time         n [     min,      max]      avg      dev    dtime
                             'core':         1 [ 57.37ms,  57.37ms]  57.37ms   0.00ns  57.37ms         1 [  6.38ms,   6.38ms]   6.38ms   0.00ns   6.38ms
                       'default_lp':         1 [ 56.57ms,  56.57ms]  56.57ms   0.00ns  56.57ms         1 [  1.75ms,   1.75ms]   1.75ms   0.00ns   1.75ms
                 'feasibility_pump':         4 [  1.85ms,  19.02ms]  12.05ms   6.46ms  48.19ms         3 [  1.42ms,   2.75ms]   2.03ms 548.20us   6.09ms
                  'fj_long_default':         0 [  0.00ns,   0.00ns]   0.00ns   0.00ns   0.00ns         0 [  0.00ns,   0.00ns]   0.00ns   0.00ns   0.00ns
                  'fj_long_default':         0 [  0.00ns,   0.00ns]   0.00ns   0.00ns   0.00ns         0 [  0.00ns,   0.00ns]   0.00ns   0.00ns   0.00ns
              'fj_long_lin_default':         0 [  0.00ns,   0.00ns]   0.00ns   0.00ns   0.00ns         0 [  0.00ns,   0.00ns]   0.00ns   0.00ns   0.00ns
              'fj_long_lin_perturb':         0 [  0.00ns,   0.00ns]   0.00ns   0.00ns   0.00ns         0 [  0.00ns,   0.00ns]   0.00ns   0.00ns   0.00ns
               'fj_long_lin_random':         0 [  0.00ns,   0.00ns]   0.00ns   0.00ns   0.00ns         0 [  0.00ns,   0.00ns]   0.00ns   0.00ns   0.00ns
                  'fj_long_perturb':         0 [  0.00ns,   0.00ns]   0.00ns   0.00ns   0.00ns         0 [  0.00ns,   0.00ns]   0.00ns   0.00ns   0.00ns
                   'fj_long_random':         0 [  0.00ns,   0.00ns]   0.00ns   0.00ns   0.00ns         0 [  0.00ns,   0.00ns]   0.00ns   0.00ns   0.00ns
                 'fj_short_default':         0 [  0.00ns,   0.00ns]   0.00ns   0.00ns   0.00ns         0 [  0.00ns,   0.00ns]   0.00ns   0.00ns   0.00ns
                 'fj_short_default':         0 [  0.00ns,   0.00ns]   0.00ns   0.00ns   0.00ns         0 [  0.00ns,   0.00ns]   0.00ns   0.00ns   0.00ns
             'fj_short_lin_default':         0 [  0.00ns,   0.00ns]   0.00ns   0.00ns   0.00ns         0 [  0.00ns,   0.00ns]   0.00ns   0.00ns   0.00ns
             'fj_short_lin_default':         0 [  0.00ns,   0.00ns]   0.00ns   0.00ns   0.00ns         0 [  0.00ns,   0.00ns]   0.00ns   0.00ns   0.00ns
             'fj_short_lin_perturb':         0 [  0.00ns,   0.00ns]   0.00ns   0.00ns   0.00ns         0 [  0.00ns,   0.00ns]   0.00ns   0.00ns   0.00ns
              'fj_short_lin_random':         0 [  0.00ns,   0.00ns]   0.00ns   0.00ns   0.00ns         0 [  0.00ns,   0.00ns]   0.00ns   0.00ns   0.00ns
                 'fj_short_perturb':         0 [  0.00ns,   0.00ns]   0.00ns   0.00ns   0.00ns         0 [  0.00ns,   0.00ns]   0.00ns   0.00ns   0.00ns
                  'fj_short_random':         0 [  0.00ns,   0.00ns]   0.00ns   0.00ns   0.00ns         0 [  0.00ns,   0.00ns]   0.00ns   0.00ns   0.00ns
                        'fs_random':         0 [  0.00ns,   0.00ns]   0.00ns   0.00ns   0.00ns         0 [  0.00ns,   0.00ns]   0.00ns   0.00ns   0.00ns
                        'fs_random':         0 [  0.00ns,   0.00ns]   0.00ns   0.00ns   0.00ns         0 [  0.00ns,   0.00ns]   0.00ns   0.00ns   0.00ns
                        'fs_random':         1 [  2.25ms,   2.25ms]   2.25ms   0.00ns   2.25ms         1 [ 20.00ns,  20.00ns]  20.00ns   0.00ns  20.00ns
                        'fs_random':         1 [  2.60ms,   2.60ms]   2.60ms   0.00ns   2.60ms         1 [ 20.00ns,  20.00ns]  20.00ns   0.00ns  20.00ns
                  'fs_random_no_lp':         0 [  0.00ns,   0.00ns]   0.00ns   0.00ns   0.00ns         0 [  0.00ns,   0.00ns]   0.00ns   0.00ns   0.00ns
                  'fs_random_no_lp':         0 [  0.00ns,   0.00ns]   0.00ns   0.00ns   0.00ns         0 [  0.00ns,   0.00ns]   0.00ns   0.00ns   0.00ns
                  'fs_random_no_lp':         0 [  0.00ns,   0.00ns]   0.00ns   0.00ns   0.00ns         0 [  0.00ns,   0.00ns]   0.00ns   0.00ns   0.00ns
                  'fs_random_no_lp':         1 [  2.11ms,   2.11ms]   2.11ms   0.00ns   2.11ms         0 [  0.00ns,   0.00ns]   0.00ns   0.00ns   0.00ns
          'fs_random_quick_restart':         0 [  0.00ns,   0.00ns]   0.00ns   0.00ns   0.00ns         0 [  0.00ns,   0.00ns]   0.00ns   0.00ns   0.00ns
          'fs_random_quick_restart':         0 [  0.00ns,   0.00ns]   0.00ns   0.00ns   0.00ns         0 [  0.00ns,   0.00ns]   0.00ns   0.00ns   0.00ns
          'fs_random_quick_restart':         0 [  0.00ns,   0.00ns]   0.00ns   0.00ns   0.00ns         0 [  0.00ns,   0.00ns]   0.00ns   0.00ns   0.00ns
          'fs_random_quick_restart':         1 [  4.64ms,   4.64ms]   4.64ms   0.00ns   4.64ms         1 [ 20.00ns,  20.00ns]  20.00ns   0.00ns  20.00ns
    'fs_random_quick_restart_no_lp':         0 [  0.00ns,   0.00ns]   0.00ns   0.00ns   0.00ns         0 [  0.00ns,   0.00ns]   0.00ns   0.00ns   0.00ns
    'fs_random_quick_restart_no_lp':         0 [  0.00ns,   0.00ns]   0.00ns   0.00ns   0.00ns         0 [  0.00ns,   0.00ns]   0.00ns   0.00ns   0.00ns
    'fs_random_quick_restart_no_lp':         1 [  4.24ms,   4.24ms]   4.24ms   0.00ns   4.24ms         0 [  0.00ns,   0.00ns]   0.00ns   0.00ns   0.00ns
                    'graph_arc_lns':        11 [  1.50ms,  33.23ms]  14.53ms  10.87ms 159.86ms         7 [ 10.00ns, 589.27us] 180.82us 236.85us   1.27ms
                    'graph_cst_lns':        10 [536.32us,   7.16ms]   1.45ms   1.95ms  14.50ms         1 [ 10.00ns,  10.00ns]  10.00ns   0.00ns  10.00ns
                    'graph_dec_lns':        10 [  1.70ms,  31.74ms]  15.11ms  12.30ms 151.11ms         6 [ 10.00ns, 311.08us]  67.78us 110.91us 406.67us
                    'graph_var_lns':        11 [  1.75ms,  34.48ms]  11.98ms   9.53ms 131.80ms         9 [ 10.00ns, 378.41us]  53.00us 115.73us 477.02us
                   'lb_tree_search':         1 [ 55.97ms,  55.97ms]  55.97ms   0.00ns  55.97ms         1 [198.34us, 198.34us] 198.34us   0.00ns 198.34us
                           'max_lp':         1 [ 57.33ms,  57.33ms]  57.33ms   0.00ns  57.33ms         1 [ 43.12us,  43.12us]  43.12us   0.00ns  43.12us
                            'no_lp':         1 [ 56.74ms,  56.74ms]  56.74ms   0.00ns  56.74ms         1 [  5.37ms,   5.37ms]   5.37ms   0.00ns   5.37ms
              'objective_lb_search':         1 [ 55.35ms,  55.35ms]  55.35ms   0.00ns  55.35ms         1 [650.82us, 650.82us] 650.82us   0.00ns 650.82us
       'objective_lb_search_max_lp':         1 [ 54.26ms,  54.26ms]  54.26ms   0.00ns  54.26ms         1 [351.78us, 351.78us] 351.78us   0.00ns 351.78us
        'objective_lb_search_no_lp':         1 [ 52.80ms,  52.80ms]  52.80ms   0.00ns  52.80ms         1 [  5.34ms,   5.34ms]   5.34ms   0.00ns   5.34ms
  'objective_shaving_search_max_lp':         9 [706.93us,  13.57ms]   4.89ms   4.58ms  43.98ms         0 [  0.00ns,   0.00ns]   0.00ns   0.00ns   0.00ns
   'objective_shaving_search_no_lp':        11 [684.38us,   7.65ms]   3.41ms   2.64ms  37.53ms         0 [  0.00ns,   0.00ns]   0.00ns   0.00ns   0.00ns
                          'probing':         1 [ 55.35ms,  55.35ms]  55.35ms   0.00ns  55.35ms         1 [  1.40ms,   1.40ms]   1.40ms   0.00ns   1.40ms
                   'probing_max_lp':         1 [ 54.83ms,  54.83ms]  54.83ms   0.00ns  54.83ms         1 [ 43.14us,  43.14us]  43.14us   0.00ns  43.14us
                     'pseudo_costs':         1 [ 56.09ms,  56.09ms]  56.09ms   0.00ns  56.09ms         1 [390.69us, 390.69us] 390.69us   0.00ns 390.69us
                    'quick_restart':         1 [ 55.85ms,  55.85ms]  55.85ms   0.00ns  55.85ms         1 [  1.24ms,   1.24ms]   1.24ms   0.00ns   1.24ms
              'quick_restart_no_lp':         1 [ 56.04ms,  56.04ms]  56.04ms   0.00ns  56.04ms         1 [  6.31ms,   6.31ms]   6.31ms   0.00ns   6.31ms
                    'reduced_costs':         1 [ 56.08ms,  56.08ms]  56.08ms   0.00ns  56.08ms         1 [397.90us, 397.90us] 397.90us   0.00ns 397.90us
                        'rins/rens':        11 [ 79.29us,  28.66ms]   9.68ms   9.93ms 106.46ms         6 [ 97.10us,   1.42ms] 566.37us 414.13us   3.40ms
                      'rnd_cst_lns':        11 [538.81us,  33.31ms]  11.78ms   9.45ms 129.60ms         7 [ 10.00ns, 148.72us]  71.45us  49.70us 500.14us
                      'rnd_var_lns':        11 [  1.33ms,  30.41ms]  13.66ms  12.14ms 150.27ms         6 [ 10.00ns, 116.95us]  31.91us  40.18us 191.47us
                     'violation_ls':         4 [109.03us,  35.13ms]   9.14ms  15.01ms  36.56ms         4 [770.00ns,  12.88ms]   3.25ms   5.56ms  13.01ms
                     'violation_ls':         4 [128.25us,  34.71ms]   8.96ms  14.87ms  35.83ms         4 [960.00ns,  13.83ms]   3.47ms   5.98ms  13.88ms
                     'violation_ls':         4 [142.60us,  36.53ms]   9.59ms  15.57ms  38.34ms         4 [740.00ns,  13.36ms]   3.36ms   5.77ms  13.46ms
                     'violation_ls':         4 [176.53us,  35.57ms]   9.18ms  15.24ms  36.71ms         4 [  1.01us,  12.99ms]   3.29ms   5.60ms  13.16ms
                     'violation_ls':         4 [204.50us,  36.26ms]   9.45ms  15.48ms  37.81ms         4 [530.00ns,  16.65ms]   4.22ms   7.17ms  16.89ms

Search stats                        Bools  Conflicts  Branches  Restarts  BoolPropag  IntegerPropag
                           'core':    278        117       960       336      13'378         16'045
                     'default_lp':     33         15        88        66         155          2'518
                      'fs_random':      0          0         0         0           0              0
                      'fs_random':      0          0         0         0           0              0
                      'fs_random':     33          0         0         0           0              0
                      'fs_random':     33          0         0         0           0              0
                'fs_random_no_lp':      0          0         0         0           0              0
                'fs_random_no_lp':      0          0         0         0           0              0
                'fs_random_no_lp':      0          0         0         0           0              0
                'fs_random_no_lp':     33          0         0         0           0              0
        'fs_random_quick_restart':      0          0         0         0           0              0
        'fs_random_quick_restart':      0          0         0         0           0              0
        'fs_random_quick_restart':      0          0         0         0           0              0
        'fs_random_quick_restart':     33          0         0         0           0              0
  'fs_random_quick_restart_no_lp':      0          0         0         0           0              0
  'fs_random_quick_restart_no_lp':      0          0         0         0           0              0
  'fs_random_quick_restart_no_lp':     33          0         0         0           0              0
                 'lb_tree_search':     33          0        66        66          12            408
                         'max_lp':     33          0        66        66          12            408
                          'no_lp':    127        136     1'062       321       4'749         31'245
            'objective_lb_search':     34          2        68        67          58            816
     'objective_lb_search_max_lp':     33          0        66        66          12            410
      'objective_lb_search_no_lp':     51        213       578       240       2'795         31'254
                        'probing':     35          0        70        70          25            457
                 'probing_max_lp':     33          0        66        66          12            408
                   'pseudo_costs':     33          0        66        66          12            410
                  'quick_restart':     33          6        93        66          63          1'640
            'quick_restart_no_lp':    118        229     1'170       392       6'279         34'812
                  'reduced_costs':     33          0        66        66          12            409

SAT stats                           ClassicMinim  LitRemoved  LitLearned  LitForgotten  Subsumed  MClauses  MDecisions  MLitTrue  MSubsumed  MLitRemoved  MReused
                           'core':            43         162         184             0         2        15          73         0          1            4        0
                     'default_lp':             5           7         101             0         3         0           0         0          0            0        0
                      'fs_random':             0           0           0             0         0         0           0         0          0            0        0
                      'fs_random':             0           0           0             0         0         0           0         0          0            0        0
                      'fs_random':             0           0           0             0         0         0           0         0          0            0        0
                      'fs_random':             0           0           0             0         0         0           0         0          0            0        0
                'fs_random_no_lp':             0           0           0             0         0         0           0         0          0            0        0
                'fs_random_no_lp':             0           0           0             0         0         0           0         0          0            0        0
                'fs_random_no_lp':             0           0           0             0         0         0           0         0          0            0        0
                'fs_random_no_lp':             0           0           0             0         0         0           0         0          0            0        0
        'fs_random_quick_restart':             0           0           0             0         0         0           0         0          0            0        0
        'fs_random_quick_restart':             0           0           0             0         0         0           0         0          0            0        0
        'fs_random_quick_restart':             0           0           0             0         0         0           0         0          0            0        0
        'fs_random_quick_restart':             0           0           0             0         0         0           0         0          0            0        0
  'fs_random_quick_restart_no_lp':             0           0           0             0         0         0           0         0          0            0        0
  'fs_random_quick_restart_no_lp':             0           0           0             0         0         0           0         0          0            0        0
  'fs_random_quick_restart_no_lp':             0           0           0             0         0         0           0         0          0            0        0
                 'lb_tree_search':             0           0           0             0         0         0           0         0          0            0        0
                         'max_lp':             0           0           0             0         0         0           0         0          0            0        0
                          'no_lp':            73         168         715             0        12        11          57         0          3           12        0
            'objective_lb_search':             1           1           3             0         0         0           0         0          0            0        0
     'objective_lb_search_max_lp':             0           0           0             0         0         0           0         0          0            0        0
      'objective_lb_search_no_lp':           159         524         895             0        12        25         121         0         10           45        3
                        'probing':             0           0           0             0         0         0           0         0          0            0        0
                 'probing_max_lp':             0           0           0             0         0         0           0         0          0            0        0
                   'pseudo_costs':             0           0           0             0         0         0           0         0          0            0        0
                  'quick_restart':             0           0          50             0         1         0           0         0          0            0        0
            'quick_restart_no_lp':           113         228       1'424             0        16        33         150         3         12           60        0
                  'reduced_costs':             0           0           0             0         0         0           0         0          0            0        0

Lp stats                         Component  Iterations  AddedCuts  OPTIMAL  DUAL_F.  DUAL_U.
                  'default_lp':          1         207        281       39        0        0
                   'fs_random':          1           0          0        0        0        0
                   'fs_random':          1           0          0        0        0        0
     'fs_random_quick_restart':          1           0          0        0        0        0
              'lb_tree_search':          1          75        423        3        0        0
                      'max_lp':          1          74        321        3        0        0
         'objective_lb_search':          1          98        255       19        0        0
  'objective_lb_search_max_lp':          1          94        350        7        0        0
                     'probing':          1         165        356       29        0        0
              'probing_max_lp':          1          75        311        3        0        0
                'pseudo_costs':          1          99        356        7        0        0
               'quick_restart':          1         140        252       38        0        0
               'reduced_costs':          1          99        414        7        0        0

Lp dimension                                                                    Final dimension of first component
                  'default_lp':   144 rows, 83 columns, 533 entries with magnitude in [2.633210e-03, 1.000000e+00]
                   'fs_random':       0 rows, 83 columns, 0 entries with magnitude in [0.000000e+00, 0.000000e+00]
                   'fs_random':       0 rows, 83 columns, 0 entries with magnitude in [0.000000e+00, 0.000000e+00]
     'fs_random_quick_restart':       0 rows, 83 columns, 0 entries with magnitude in [0.000000e+00, 0.000000e+00]
              'lb_tree_search':  575 rows, 86 columns, 3509 entries with magnitude in [1.178620e-03, 1.000000e+00]
                      'max_lp':  525 rows, 86 columns, 3302 entries with magnitude in [1.126761e-02, 1.000000e+00]
         'objective_lb_search':   133 rows, 83 columns, 558 entries with magnitude in [2.726054e-03, 1.000000e+00]
  'objective_lb_search_max_lp':   135 rows, 86 columns, 451 entries with magnitude in [5.072565e-04, 1.000000e+00]
                     'probing':   185 rows, 83 columns, 921 entries with magnitude in [1.383996e-03, 1.000000e+00]
              'probing_max_lp':  525 rows, 86 columns, 3302 entries with magnitude in [1.126761e-02, 1.000000e+00]
                'pseudo_costs':   135 rows, 86 columns, 472 entries with magnitude in [2.236037e-03, 1.000000e+00]
               'quick_restart':   132 rows, 83 columns, 553 entries with magnitude in [2.651352e-03, 1.000000e+00]
               'reduced_costs':   134 rows, 86 columns, 463 entries with magnitude in [7.034208e-03, 1.000000e+00]

Lp debug                         CutPropag  CutEqPropag  Adjust  Overflow  Bad  BadScaling
                  'default_lp':          1            0      15         0  123           0
                   'fs_random':          0            0       0         0    0           0
                   'fs_random':          0            0       0         0    0           0
     'fs_random_quick_restart':          0            0       0         0    0           0
              'lb_tree_search':          0            0       2         0  159           0
                      'max_lp':          0            0       2         0  124           0
         'objective_lb_search':          0            0       8         0  170           0
  'objective_lb_search_max_lp':          2            0       0         0  117           0
                     'probing':          0            0      11         0  327           0
              'probing_max_lp':          0            0       2         0  124           0
                'pseudo_costs':          2            0       0         0   73           0
               'quick_restart':          0            0       6         0  135           0
               'reduced_costs':          1            0       0         0   95           0

Lp pool                          Constraints  Updates  Simplif  Merged  Shortened  Split  Strenghtened  Cuts/Call
                  'default_lp':          358       60      131      11          0      3           277    281/414
                   'fs_random':           88        0        0       0          0      0             0        0/0
                   'fs_random':           88        0        0       0          0      0             0        0/0
     'fs_random_quick_restart':           88        0        0       0          0      0             0        0/0
              'lb_tree_search':          898        8        0       0          0      5           135    423/667
                      'max_lp':          796        4        0       0          0      3           119    321/541
         'objective_lb_search':          333       67      119      10          0      0           251    255/384
  'objective_lb_search_max_lp':          825        0       10       0          0      0           139    350/569
                     'probing':          444       20        0       0          0      5            46    356/531
              'probing_max_lp':          786        4        0       0          0      3           119    311/515
                'pseudo_costs':          831        0       10       0          0      0           126    356/558
               'quick_restart':          331       62      115       9          0      1           250    252/385
               'reduced_costs':          889        1        6       0          0      0           119    414/647

Lp Cut            defaul  max_lp  quick_  reduce  pseudo  lb_tre  probin  object  probin  object
          CG_FF:      28      39      14      42      31      68      31      18      36      43
           CG_K:      16      21       6      24      23      34      16       9      21      17
           CG_R:      17      32       8      35      32      48      14      15      32      23
          CG_RB:      24      31      25      48      29      60      61      22      27      39
         CG_RBP:       8       2       5       8       6       6       9       6       2       1
             IB:      92      66     100      99      92      66      88      92      65      86
       MIR_1_FF:      12      39      11      35      34      39      14      14      40      32
        MIR_1_K:       5       2       4       2       1       2       2       5       2       -
        MIR_1_R:       3       8       3       6       6       8       1       4       8       6
       MIR_1_RB:      10      21      11      24      23      22      20      14      22      23
      MIR_1_RBP:       2       5       2       3       5       5       2       2       5       5
      MIR_1_RLT:       -       1       -       1       -       2       -       -       2       1
       MIR_2_FF:       6       9       8      11       9       8       8       4       8       7
        MIR_2_K:       1       3       2       1       1       3       4       -       3       -
        MIR_2_R:       6       4       5       8       7       2       5       1       2       6
       MIR_2_RB:       3       5      10       8      12       5      11       5       5      12
      MIR_2_RBP:       2       -       2       2       8       -       2       -       -       2
       MIR_3_FF:       3       2       1       3       2       4       4       3       4       3
        MIR_3_K:       2       1       2       1       1       1       1       2       -       -
        MIR_3_R:       3       3       1       2       3       3       4       3       2       2
       MIR_3_RB:       7       1       3       3       3       -      10       5       1       4
      MIR_3_RBP:       4       -       1       1       1       -       1       3       1       -
       MIR_4_FF:       1       1       1       2       -       2       2       2       1       -
        MIR_4_K:       1       1       2       1       -       1       -       -       1       -
        MIR_4_R:       1       -       1       1       -       -       -       3       -       2
       MIR_4_RB:       1       1       3       1       -       1       2       3       -       -
      MIR_4_RBP:       -       -       1       -       -       -       -       -       -       -
       MIR_5_FF:       -       2       -       -       -       -       -       -       -       -
        MIR_5_K:       1       -       -       -       -       -       -       -       -       -
        MIR_5_R:       1       1       -       -       -       1       1       -       1       -
       MIR_5_RB:       1       -       -       -       -       1       1       1       1       -
      MIR_5_RBP:       -       -       -       -       -       -       1       -       -       -
        MIR_6_R:       -       -       -       -       -       -       1       -       -       -
       MIR_6_RB:       -       -       -       -       -       -       1       -       -       -
      MIR_6_RBP:       -       -       -       -       -       -       1       -       -       -
   ZERO_HALF_FF:       5       7       5      15      11       9       8       4       7      13
    ZERO_HALF_K:       1       1       1       2       -       2       1       1       -       -
    ZERO_HALF_R:       8       3       6      14       8       8      10       7       4      10
   ZERO_HALF_RB:       4       7       5      10       7       7      13       4       7      11
  ZERO_HALF_RBP:       2       2       3       1       1       5       6       3       1       2

LNS stats           Improv/Calls  Closed  Difficulty  TimeLimit
  'graph_arc_lns':           3/7     86%        0.94       0.10
  'graph_cst_lns':           0/1    100%        0.71       0.10
  'graph_dec_lns':           3/7    100%        0.97       0.10
  'graph_var_lns':           3/9     89%        0.97       0.10
      'rins/rens':           3/7     86%        0.94       0.10
    'rnd_cst_lns':           0/7    100%        0.97       0.10
    'rnd_var_lns':           2/7    100%        0.97       0.10

LS stats                   Batches  Restarts  LinMoves  GenMoves  CompoundMoves  WeightUpdates
       'fj_long_default':        0         0         0         0              0              0
       'fj_long_default':        0         0         0         0              0              0
   'fj_long_lin_default':        0         0         0         0              0              0
   'fj_long_lin_perturb':        0         0         0         0              0              0
    'fj_long_lin_random':        0         0         0         0              0              0
       'fj_long_perturb':        0         0         0         0              0              0
        'fj_long_random':        0         0         0         0              0              0
      'fj_short_default':        0         0         0         0              0              0
      'fj_short_default':        0         0         0         0              0              0
  'fj_short_lin_default':        0         0         0         0              0              0
  'fj_short_lin_default':        0         0         0         0              0              0
  'fj_short_lin_perturb':        0         0         0         0              0              0
   'fj_short_lin_random':        0         0         0         0              0              0
      'fj_short_perturb':        0         0         0         0              0              0
       'fj_short_random':        0         0         0         0              0              0
          'violation_ls':        4         0         2     4'682            160             34
          'violation_ls':        4         0        23     4'499            105             51
          'violation_ls':        4         0     3'356         7              7            456
          'violation_ls':        4         0     4'028        92             14            517
          'violation_ls':        4         0         5     4'480             86             46

Solutions (22)            Num    Rank
                'no_lp':   10  [1,22]
  'quick_restart_no_lp':    1   [2,2]
         'violation_ls':   11  [4,17]

Objective bounds                Num
                  'bool_core':   46
             'initial_domain':    1
  'objective_lb_search_no_lp':   14

Solution repositories    Added  Queried  Ignored  Synchro
  'feasible solutions':     68      176        0       52
        'lp solutions':      0        0        0        0
                'pump':     42       10

Improving bounds shared         Num
                       'core':    3
                      'no_lp':  269
  'objective_lb_search_no_lp':   40
        'quick_restart_no_lp':  344
              'reduced_costs':    1

Clauses shared                  Num
                       'core':    3
                      'no_lp':   15
  'objective_lb_search_no_lp':    3
        'quick_restart_no_lp':   21

CpSolverResponse summary:
status: OPTIMAL
objective: 265
best_bound: 265
integers: 0
booleans: 0
conflicts: 0
branches: 0
propagations: 0
integer_propagations: 0
restarts: 0
lp_iterations: 0
walltime: 0.117687
usertime: 0.117687
deterministic_time: 0.113777
gap_integral: 0.260704
solution_fingerprint: 0xe194ec91ae08726c


--- Simulation Gantt  partir du modle mathmatique ---
{'big':0, 'due_date':159, 'pos_time':5, 'status':0, 'blocked':0, 'operations':["{'type':0, 'processing_time':13}", "{'type':1, 'processing_time':24}"]}
{'big':1, 'due_date':94, 'pos_time':5, 'status':0, 'blocked':0, 'operations':["{'type':0, 'processing_time':11}"]}
{'big':0, 'due_date':87, 'pos_time':5, 'status':0, 'blocked':0, 'operations':["{'type':1, 'processing_time':25}"]}
{'big':0, 'due_date':110, 'pos_time':5, 'status':0, 'blocked':0, 'operations':["{'type':0, 'processing_time':36}", "{'type':1, 'processing_time':46}"]}
{'big':1, 'due_date':86, 'pos_time':5, 'status':0, 'blocked':0, 'operations':["{'type':0, 'processing_time':52}"]}
