created virtual environment CPython3.12.4.final.0-64 in 360ms
  creator CPython3Posix(dest=/localscratch/aneumann.46806144.0/env, clear=False, no_vcs_ignore=False, global=False)
  seeder FromAppData(download=False, pip=bundle, via=copy, app_data_dir=/home/aneumann/.local/share/virtualenv)
    added seed packages: pip==24.2+computecanada
  activators BashActivator,CShellActivator,FishActivator,NushellActivator,PowerShellActivator,PythonActivator
Looking in links: /cvmfs/soft.computecanada.ca/custom/python/wheelhouse/gentoo2023/x86-64-v3, /cvmfs/soft.computecanada.ca/custom/python/wheelhouse/gentoo2023/generic, /cvmfs/soft.computecanada.ca/custom/python/wheelhouse/generic
Requirement already satisfied: pip in /localscratch/aneumann.46806144.0/env/lib/python3.12/site-packages (24.2+computecanada)
Processing /cvmfs/soft.computecanada.ca/custom/python/wheelhouse/generic/pip-25.0+computecanada-py3-none-any.whl
Installing collected packages: pip
  Attempting uninstall: pip
    Found existing installation: pip 24.2+computecanada
    Uninstalling pip-24.2+computecanada:
      Successfully uninstalled pip-24.2+computecanada
Successfully installed pip-24.2+computecanada
Looking in links: /cvmfs/soft.computecanada.ca/custom/python/wheelhouse/gentoo2023/x86-64-v3, /cvmfs/soft.computecanada.ca/custom/python/wheelhouse/gentoo2023/generic, /cvmfs/soft.computecanada.ca/custom/python/wheelhouse/generic
ERROR: protobuf-5.28.3-cp38-abi3-manylinux2014_x86_64.whl is not a supported wheel on this platform.
Looking in links: /cvmfs/soft.computecanada.ca/custom/python/wheelhouse/gentoo2023/x86-64-v3, /cvmfs/soft.computecanada.ca/custom/python/wheelhouse/gentoo2023/generic, /cvmfs/soft.computecanada.ca/custom/python/wheelhouse/generic
Processing /home/aneumann/projects/def-adhaj/aneumann/GNRS/wheels/immutabledict-4.2.0-py3-none-any.whl
Installing collected packages: immutabledict
Successfully installed immutabledict-4.2.0
Looking in links: /cvmfs/soft.computecanada.ca/custom/python/wheelhouse/gentoo2023/x86-64-v3, /cvmfs/soft.computecanada.ca/custom/python/wheelhouse/gentoo2023/generic, /cvmfs/soft.computecanada.ca/custom/python/wheelhouse/generic
Processing /cvmfs/soft.computecanada.ca/custom/python/wheelhouse/generic/ortools-9.10.4067+computecanada-cp312-cp312-linux_x86_64.whl (from -r /home/aneumann/projects/def-adhaj/aneumann/GNRS/requirements/or.txt (line 1))
Processing /cvmfs/soft.computecanada.ca/custom/python/wheelhouse/gentoo2023/x86-64-v3/matplotlib-3.10.0+computecanada-cp312-cp312-linux_x86_64.whl (from -r /home/aneumann/projects/def-adhaj/aneumann/GNRS/requirements/or.txt (line 2))
Processing /cvmfs/soft.computecanada.ca/custom/python/wheelhouse/gentoo2023/x86-64-v3/pandas-2.2.3+computecanada-cp312-cp312-linux_x86_64.whl (from -r /home/aneumann/projects/def-adhaj/aneumann/GNRS/requirements/or.txt (line 3))
Processing /cvmfs/soft.computecanada.ca/custom/python/wheelhouse/generic/absl_py-2.3.0+computecanada-py3-none-any.whl (from ortools<9.11,>=9.10->-r /home/aneumann/projects/def-adhaj/aneumann/GNRS/requirements/or.txt (line 1))
Processing /cvmfs/soft.computecanada.ca/custom/python/wheelhouse/gentoo2023/generic/numpy-2.2.2+computecanada-cp312-cp312-linux_x86_64.whl (from ortools<9.11,>=9.10->-r /home/aneumann/projects/def-adhaj/aneumann/GNRS/requirements/or.txt (line 1))
Processing /cvmfs/soft.computecanada.ca/custom/python/wheelhouse/gentoo2023/x86-64-v3/protobuf-6.31.1+computecanada-cp312-cp312-linux_x86_64.whl (from ortools<9.11,>=9.10->-r /home/aneumann/projects/def-adhaj/aneumann/GNRS/requirements/or.txt (line 1))
Requirement already satisfied: immutabledict>=3.0.0 in /localscratch/aneumann.46806144.0/env/lib/python3.12/site-packages (from ortools<9.11,>=9.10->-r /home/aneumann/projects/def-adhaj/aneumann/GNRS/requirements/or.txt (line 1)) (4.2.0)
Processing /cvmfs/soft.computecanada.ca/custom/python/wheelhouse/gentoo2023/generic/contourpy-1.3.1+computecanada-cp312-cp312-linux_x86_64.whl (from matplotlib->-r /home/aneumann/projects/def-adhaj/aneumann/GNRS/requirements/or.txt (line 2))
Processing /cvmfs/soft.computecanada.ca/custom/python/wheelhouse/generic/cycler-0.12.1+computecanada-py3-none-any.whl (from matplotlib->-r /home/aneumann/projects/def-adhaj/aneumann/GNRS/requirements/or.txt (line 2))
Processing /cvmfs/soft.computecanada.ca/custom/python/wheelhouse/generic/fonttools-4.59.0+computecanada-cp312-cp312-linux_x86_64.whl (from matplotlib->-r /home/aneumann/projects/def-adhaj/aneumann/GNRS/requirements/or.txt (line 2))
Processing /cvmfs/soft.computecanada.ca/custom/python/wheelhouse/gentoo2023/x86-64-v3/kiwisolver-1.4.8+computecanada-cp312-cp312-linux_x86_64.whl (from matplotlib->-r /home/aneumann/projects/def-adhaj/aneumann/GNRS/requirements/or.txt (line 2))
Processing /cvmfs/soft.computecanada.ca/custom/python/wheelhouse/generic/packaging-25.0+computecanada-py3-none-any.whl (from matplotlib->-r /home/aneumann/projects/def-adhaj/aneumann/GNRS/requirements/or.txt (line 2))
Processing /cvmfs/soft.computecanada.ca/custom/python/wheelhouse/gentoo2023/x86-64-v3/pillow-11.1.0+computecanada-cp312-cp312-linux_x86_64.whl (from matplotlib->-r /home/aneumann/projects/def-adhaj/aneumann/GNRS/requirements/or.txt (line 2))
Processing /cvmfs/soft.computecanada.ca/custom/python/wheelhouse/generic/pyparsing-3.2.3+computecanada-py3-none-any.whl (from matplotlib->-r /home/aneumann/projects/def-adhaj/aneumann/GNRS/requirements/or.txt (line 2))
Processing /cvmfs/soft.computecanada.ca/custom/python/wheelhouse/generic/python_dateutil-2.9.0.post0+computecanada-py2.py3-none-any.whl (from matplotlib->-r /home/aneumann/projects/def-adhaj/aneumann/GNRS/requirements/or.txt (line 2))
Processing /cvmfs/soft.computecanada.ca/custom/python/wheelhouse/generic/pytz-2025.2+computecanada-py2.py3-none-any.whl (from pandas->-r /home/aneumann/projects/def-adhaj/aneumann/GNRS/requirements/or.txt (line 3))
Processing /cvmfs/soft.computecanada.ca/custom/python/wheelhouse/generic/tzdata-2025.2+computecanada-py2.py3-none-any.whl (from pandas->-r /home/aneumann/projects/def-adhaj/aneumann/GNRS/requirements/or.txt (line 3))
Processing /cvmfs/soft.computecanada.ca/custom/python/wheelhouse/generic/six-1.17.0+computecanada-py2.py3-none-any.whl (from python-dateutil>=2.7->matplotlib->-r /home/aneumann/projects/def-adhaj/aneumann/GNRS/requirements/or.txt (line 2))
Installing collected packages: pytz, tzdata, six, pyparsing, protobuf, pillow, packaging, numpy, kiwisolver, fonttools, cycler, absl-py, python-dateutil, contourpy, pandas, matplotlib, ortools
Successfully installed absl-py-2.3.0+computecanada contourpy-1.3.1+computecanada cycler-0.12.1+computecanada fonttools-4.59.0+computecanada kiwisolver-1.4.8+computecanada matplotlib-3.10.0+computecanada numpy-2.2.2+computecanada ortools-9.10.4067+computecanada packaging-25.0+computecanada pandas-2.2.3+computecanada pillow-11.1.0+computecanada protobuf-6.31.1+computecanada pyparsing-3.2.3+computecanada python-dateutil-2.9.0.post0+computecanada pytz-2025.2+computecanada six-1.17.0+computecanada tzdata-2025.2+computecanada

Starting CP-SAT solver v9.10.4067
Parameters: max_time_in_seconds: 86400 max_memory_in_mb: 185000 log_search_progress: true enumerate_all_solutions: false num_search_workers: 32 absolute_gap_limit: 0 relative_gap_limit: 0

Initial optimization model '': (model_fingerprint: 0x6c5b040715ee56a0)
#Variables: 287 (#ints: 8 in objective)
  - 207 Booleans in [0,1]
  - 80 in [0,579]
#kLinear1: 40
#kLinear2: 382
#kLinear3: 155
#kLinearN: 3'099 (#terms: 46'931)

Starting presolve at 0.00s
  1.38e-03s  0.00e+00d  [DetectDominanceRelations] 
  2.17e-02s  0.00e+00d  [PresolveToFixPoint] #num_loops=8 #num_dual_strengthening=3 
  2.80e-05s  0.00e+00d  [ExtractEncodingFromLinear] #potential_supersets=2 
[Symmetry] Graph for symmetry has 3'682 nodes and 36'528 arcs.
[Symmetry] Symmetry computation done. time: 0.00141516 dtime: 0.00284708
[Symmetry] #generators: 1, average support size: 18
[Symmetry] The model contains 190 duplicate constraints !
[Symmetry] 9 orbits with sizes: 2,2,2,2,2,2,2,2,2
[Symmetry] Num fixable by intersecting at_most_one with orbits: 1 largest_orbit: 2
  8.03e-03s  1.88e-03d  [Probe] #probed=286 #new_bounds=11 #equiv=1 
  7.54e-05s  0.00e+00d  [MaxClique] Merged 13(26 literals) into 6(12 literals) at_most_ones. 
  1.27e-03s  0.00e+00d  [DetectDominanceRelations] 
  1.00e-02s  0.00e+00d  [PresolveToFixPoint] #num_loops=5 #num_dual_strengthening=3 
  4.28e-03s  0.00e+00d  [ProcessAtMostOneAndLinear] 
  1.61e-03s  0.00e+00d  [DetectDuplicateConstraints] #duplicates=238 #without_enforcements=93 
  1.93e-03s  2.09e-04d  [DetectDominatedLinearConstraints] #relevant_constraints=2'648 #num_inclusions=2'259 
  2.99e-04s  0.00e+00d  [DetectDifferentVariables] #different=17 #cliques=1 #size=5 
  4.08e-04s  5.04e-05d  [ProcessSetPPC] #relevant_constraints=2'311 
  1.19e-05s  0.00e+00d  [FindAlmostIdenticalLinearConstraints] 
  7.26e-05s  7.05e-05d  [FindBigAtMostOneAndLinearOverlap] 
  3.53e-03s  3.10e-03d  [FindBigVerticalLinearOverlap] #blocks=37 #saved_nz=4'710 
  2.49e-04s  1.24e-04d  [FindBigHorizontalLinearOverlap] #linears=2'251 
  1.48e-05s  0.00e+00d  [MergeClauses] 
  1.41e-03s  0.00e+00d  [DetectDominanceRelations] 
  1.34e-02s  0.00e+00d  [PresolveToFixPoint] #num_loops=2 #num_dual_strengthening=1 
  1.40e-03s  0.00e+00d  [DetectDominanceRelations] 
  7.92e-03s  0.00e+00d  [PresolveToFixPoint] #num_loops=1 #num_dual_strengthening=1 
[Symmetry] Graph for symmetry has 3'544 nodes and 30'921 arcs.
[Symmetry] Symmetry computation done. time: 0.000641345 dtime: 0.00173764
  7.28e-03s  1.79e-03d  [Probe] #probed=286 #new_bounds=24 
  9.49e-06s  0.00e+00d  [MaxClique] 
  1.41e-03s  0.00e+00d  [DetectDominanceRelations] 
  1.18e-02s  0.00e+00d  [PresolveToFixPoint] #num_loops=2 #num_dual_strengthening=1 
  3.93e-03s  0.00e+00d  [ProcessAtMostOneAndLinear] 
  1.42e-03s  0.00e+00d  [DetectDuplicateConstraints] #without_enforcements=123 
  1.18e-03s  1.14e-04d  [DetectDominatedLinearConstraints] #relevant_constraints=2'453 #num_inclusions=800 
  1.77e-04s  0.00e+00d  [DetectDifferentVariables] 
  3.85e-04s  3.90e-05d  [ProcessSetPPC] #relevant_constraints=2'124 
  1.89e-05s  2.10e-07d  [FindAlmostIdenticalLinearConstraints] #num_tested_pairs=14 
  3.33e-05s  3.34e-05d  [FindBigAtMostOneAndLinearOverlap] 
  2.62e-03s  2.43e-03d  [FindBigVerticalLinearOverlap] #blocks=33 #saved_nz=2'814 
  2.22e-04s  1.03e-04d  [FindBigHorizontalLinearOverlap] #linears=2'051 
  8.33e-06s  0.00e+00d  [MergeClauses] 
  1.37e-03s  0.00e+00d  [DetectDominanceRelations] 
  1.26e-02s  0.00e+00d  [PresolveToFixPoint] #num_loops=2 #num_dual_strengthening=1 
  1.36e-03s  0.00e+00d  [DetectDominanceRelations] 
  8.82e-03s  0.00e+00d  [PresolveToFixPoint] #num_loops=1 #num_dual_strengthening=1 
[Symmetry] Graph for symmetry has 3'645 nodes and 28'142 arcs.
[Symmetry] Symmetry computation done. time: 0.000590574 dtime: 0.00158966
  6.93e-03s  1.76e-03d  [Probe] #probed=286 #new_bounds=25 
  8.96e-06s  0.00e+00d  [MaxClique] 
  1.37e-03s  0.00e+00d  [DetectDominanceRelations] 
  1.15e-02s  0.00e+00d  [PresolveToFixPoint] #num_loops=2 #num_dual_strengthening=1 
  3.65e-03s  0.00e+00d  [ProcessAtMostOneAndLinear] 
  1.43e-03s  0.00e+00d  [DetectDuplicateConstraints] #without_enforcements=128 
  9.19e-04s  8.70e-05d  [DetectDominatedLinearConstraints] #relevant_constraints=2'380 #num_inclusions=277 
  1.71e-04s  0.00e+00d  [DetectDifferentVariables] 
  3.44e-04s  3.25e-05d  [ProcessSetPPC] #relevant_constraints=2'016 
  2.39e-05s  3.65e-07d  [FindAlmostIdenticalLinearConstraints] #num_tested_pairs=24 
  3.03e-05s  2.55e-05d  [FindBigAtMostOneAndLinearOverlap] 
  2.11e-03s  1.98e-03d  [FindBigVerticalLinearOverlap] #blocks=32 #saved_nz=2'019 
  2.08e-04s  8.86e-05d  [FindBigHorizontalLinearOverlap] #linears=1'883 
  8.93e-06s  0.00e+00d  [MergeClauses] 
  1.28e-03s  0.00e+00d  [DetectDominanceRelations] 
  1.12e-02s  0.00e+00d  [PresolveToFixPoint] #num_loops=2 #num_dual_strengthening=1 
  7.38e-05s  0.00e+00d  [ExpandObjective] #entries=406 #tight_variables=150 #tight_constraints=88 

Presolve summary:
  - 69 affine relations were detected.
  - rule 'TODO dual: only one blocking constraint?' was applied 485 times.
  - rule 'TODO dual: only one blocking enforced constraint?' was applied 104 times.
  - rule 'TODO dual: only one unspecified blocking constraint?' was applied 32 times.
  - rule 'TODO duplicate: identical constraint with different enforcements' was applied 344 times.
  - rule 'affine: new relation' was applied 69 times.
  - rule 'at_most_one: removed literals' was applied 6 times.
  - rule 'at_most_one: size one' was applied 6 times.
  - rule 'at_most_one: transformed into max clique.' was applied 1 time.
  - rule 'deductions: 250 stored' was applied 1 time.
  - rule 'dual: fix variable' was applied 21 times.
  - rule 'dual: reduced domain' was applied 41 times.
  - rule 'duplicate: merged rhs of linear constraint' was applied 46 times.
  - rule 'duplicate: removed constraint' was applied 238 times.
  - rule 'enforcement: false literal' was applied 10 times.
  - rule 'exactly_one: x and not(x)' was applied 1 time.
  - rule 'incompatible linear: add implication' was applied 30 times.
  - rule 'linear matrix: common vertical rectangle' was applied 102 times.
  - rule 'linear: always true' was applied 487 times.
  - rule 'linear: doubleton free' was applied 11 times.
  - rule 'linear: empty' was applied 32 times.
  - rule 'linear: extracted enforcement literal' was applied 5'558 times.
  - rule 'linear: fixed or dup variables' was applied 3'183 times.
  - rule 'linear: positive equal one' was applied 2 times.
  - rule 'linear: reduced variable domains' was applied 203 times.
  - rule 'linear: remapped using affine relations' was applied 3'270 times.
  - rule 'linear: simplified rhs' was applied 9'620 times.
  - rule 'linear: tightened into equality' was applied 7 times.
  - rule 'linear: variable substitution 1' was applied 11 times.
  - rule 'linear: variable substitution 2' was applied 1 time.
  - rule 'linear: variable substitution 3' was applied 1 time.
  - rule 'no_overlap: inferred from x != y constraints' was applied 1 time.
  - rule 'presolve: 86 unused variables removed.' was applied 1 time.
  - rule 'presolve: iteration' was applied 3 times.
  - rule 'probing: reduced enforced constraint to implication.' was applied 13 times.
  - rule 'symmetry: fixed to false in general orbit' was applied 1 time.

Presolved optimization model '': (model_fingerprint: 0x895085e0cb88cea9)
#Variables: 221 (#ints: 8 in objective)
  - 70 Booleans in [0,1]
  - 129 different domains in [-3379,5111] with a largest complexity of 13.
#kExactlyOne: 1 (#literals: 3)
#kInterval: 5
#kLinear2: 582 (#enforced: 543 #multi: 427)
#kLinear3: 296 (#enforced: 184)
#kLinearN: 2'037 (#enforced: 1'972 #multi: 57) (#terms: 18'348)
#kNoOverlap: 1 (#intervals: 5)

Preloading model.
#Bound   0.18s best:inf   next:[182,3791] initial_domain
[Symmetry] Graph for symmetry has 3'565 nodes and 26'148 arcs.
[Symmetry] Symmetry computation done. time: 0.000545364 dtime: 0.00148031
#Model   0.19s var:221/221 constraints:2922/2922

Starting search at 0.19s with 32 workers.
17 full problem subsolvers: [core, default_lp, fixed, lb_tree_search, max_lp, no_lp, objective_lb_search, objective_lb_search_max_lp, objective_lb_search_no_lp, objective_shaving_search_max_lp, objective_shaving_search_no_lp, probing, probing_max_lp, pseudo_costs, quick_restart, quick_restart_no_lp, reduced_costs]
13 first solution subsolvers: [fj_long_default, fj_long_lin_default, fj_long_random, fj_short_default, fj_short_lin_default, fj_short_lin_random, fj_short_random, fs_random(2), fs_random_no_lp, fs_random_quick_restart(2), fs_random_quick_restart_no_lp]
13 incomplete subsolvers: [feasibility_pump, graph_arc_lns, graph_cst_lns, graph_dec_lns, graph_var_lns, rins/rens, rnd_cst_lns, rnd_var_lns, scheduling_intervals_lns, scheduling_precedences_lns, scheduling_time_window_lns, violation_ls(2)]
3 helper subsolvers: [neighborhood_helper, synchronization_agent, update_gap_integral]
#Bound   0.27s best:inf   next:[185,3791] reduced_costs
#Bound   0.27s best:inf   next:[186,3791] reduced_costs
#Bound   0.29s best:inf   next:[205,3791] probing
#Bound   0.30s best:inf   next:[236,3791] reduced_costs
#Bound   0.30s best:inf   next:[237,3791] reduced_costs
#Bound   0.32s best:inf   next:[238,3791] reduced_costs
#Bound   0.33s best:inf   next:[239,3791] reduced_costs
#Bound   0.37s best:inf   next:[240,3791] reduced_costs
#Bound   0.37s best:inf   next:[246,3791] probing
#1       0.42s best:1717  next:[246,1716] no_lp (fixed_bools=0/99)
#Bound   0.42s best:1717  next:[255,1716] probing
#2       0.43s best:1577  next:[255,1576] no_lp (fixed_bools=0/105)
#3       0.44s best:1478  next:[255,1477] no_lp (fixed_bools=1/121)
#4       0.44s best:1467  next:[255,1466] no_lp (fixed_bools=1/124)
#5       0.44s best:1425  next:[255,1424] no_lp (fixed_bools=1/126)
#6       0.45s best:1358  next:[255,1357] no_lp (fixed_bools=1/128)
#7       0.45s best:1291  next:[255,1290] no_lp (fixed_bools=1/131)
#8       0.46s best:1252  next:[255,1251] no_lp (fixed_bools=1/137)
#9       0.47s best:1246  next:[255,1245] no_lp (fixed_bools=1/139)
#10      0.47s best:1207  next:[255,1206] quick_restart_no_lp (fixed_bools=0/152)
#11      0.48s best:1163  next:[255,1162] quick_restart_no_lp (fixed_bools=0/154)
#12      0.49s best:1153  next:[255,1152] quick_restart_no_lp (fixed_bools=0/164)
#Bound   0.49s best:1153  next:[534,1152] objective_lb_search_no_lp
#13      0.49s best:1139  next:[534,1138] no_lp (fixed_bools=1/156)
#14      0.50s best:1115  next:[534,1114] no_lp (fixed_bools=1/164)
#Bound   0.50s best:1115  next:[557,1114] objective_lb_search_no_lp
#Bound   0.54s best:1115  next:[561,1114] objective_lb_search_no_lp
#15      0.54s best:1114  next:[561,1113] quick_restart_no_lp (fixed_bools=0/233)
#16      0.56s best:1113  next:[561,1112] violation_ls(batch:3 #solutions_imported:3 #lin_moves:9'377 #lin_evals:49'747 #gen_moves:6'715 #gen_evals:1'493 #comp_moves:746 #backtracks:2'984 #weight_updates:694)
#Bound   0.58s best:1113  next:[625,1112] objective_lb_search_no_lp
#Bound   0.68s best:1113  next:[648,1112] objective_lb_search_no_lp
#17      0.71s best:1109  next:[648,1108] rins_lp_lns (d=0.50 s=61 t=0.10 p=0.00 stall=0 h=auto_l0)
#18      0.75s best:1085  next:[648,1084] rins_lp_lns (d=0.71 s=63 t=0.10 p=1.00 stall=0 h=auto_l0)
#Bound   0.76s best:1085  next:[682,1084] objective_lb_search_no_lp
#Bound   0.78s best:1085  next:[686,1084] objective_lb_search_no_lp
#Bound   0.84s best:1085  next:[687,1084] objective_lb_search_no_lp
#Bound   0.97s best:1085  next:[691,1084] objective_lb_search_no_lp
#19      1.09s best:1079  next:[691,1078] quick_restart_no_lp (fixed_bools=0/274)
#20      1.10s best:1078  next:[691,1077] violation_ls(batch:5 #solutions_imported:5 #lin_moves:9'485 #lin_evals:63'934 #gen_moves:12'885 #gen_evals:3'173 #comp_moves:1'403 #backtracks:5'737 #weight_updates:802)
#21      1.12s best:1077  next:[691,1076] violation_ls(batch:2 #solutions_imported:2 #lin_moves:1 #lin_evals:14'664 #gen_moves:6'856 #gen_evals:1'551 #comp_moves:606 #backtracks:3'125 #weight_updates:66)
#22      1.15s best:1075  next:[691,1074] violation_ls(batch:3 #solutions_imported:3 #lin_moves:1 #lin_evals:19'988 #gen_moves:9'352 #gen_evals:2'083 #comp_moves:884 #backtracks:4'234 #weight_updates:99)
#23      1.15s best:1073  next:[691,1072] violation_ls(batch:4 #solutions_imported:4 #lin_moves:204 #lin_evals:20'923 #gen_moves:9'352 #gen_evals:2'083 #comp_moves:884 #backtracks:4'234 #weight_updates:235)
#Bound   1.20s best:1073  next:[695,1072] objective_lb_search_no_lp
#24      1.20s best:1037  next:[695,1036] scheduling_time_window_lns (d=0.50 s=68 t=0.10 p=0.00 stall=0 h=auto_l0)
#25      1.29s best:1005  next:[695,1004] default_lp (fixed_bools=0/118)
#26      1.31s best:1003  next:[695,1002] quick_restart_no_lp (fixed_bools=2/389)
#27      1.33s best:1002  next:[695,1001] violation_ls(batch:6 #solutions_imported:6 #lin_moves:9'485 #lin_evals:66'716 #gen_moves:14'217 #gen_evals:3'291 #comp_moves:1'469 #backtracks:6'370 #weight_updates:823)
#28      1.34s best:1001  next:[695,1000] quick_restart_no_lp (fixed_bools=3/416)
#29      1.35s best:989   next:[695,988]  quick_restart_no_lp (fixed_bools=3/423)
#30      1.36s best:977   next:[695,976]  quick_restart_no_lp (fixed_bools=3/425)
#Bound   1.37s best:977   next:[699,976]  objective_lb_search_no_lp
#31      1.37s best:964   next:[699,963]  quick_restart_no_lp (fixed_bools=3/428)
#32      1.40s best:958   next:[699,957]  graph_dec_lns (d=0.94 s=115 t=0.10 p=1.00 stall=5 h=auto_l0)
#33      1.43s best:937   next:[699,936]  quick_restart_no_lp (fixed_bools=3/461)
#34      1.46s best:916   next:[699,915]  quick_restart_no_lp (fixed_bools=4/462)
#35      1.52s best:884   next:[701,883]  no_lp (fixed_bools=1/265)
#36      1.53s best:883   next:[701,882]  quick_restart_no_lp (fixed_bools=4/505)
#37      1.57s best:882   next:[701,881]  quick_restart_no_lp (fixed_bools=4/519)
#38      1.58s best:881   next:[701,880]  violation_ls(batch:8 #solutions_imported:8 #lin_moves:11'325 #lin_evals:103'276 #gen_moves:16'733 #gen_evals:3'256 #comp_moves:1'670 #backtracks:7'531 #weight_updates:990)
#39      1.58s best:880   next:[701,879]  violation_ls(batch:8 #solutions_imported:8 #lin_moves:19'039 #lin_evals:108'463 #gen_moves:14'948 #gen_evals:3'356 #comp_moves:1'504 #backtracks:6'718 #weight_updates:1'281)
#40      1.59s best:879   next:[701,878]  quick_restart_no_lp (fixed_bools=4/525)
#41      1.60s best:878   next:[725,877]  no_lp (fixed_bools=1/288)
#Bound   1.62s best:878   next:[750,877]  objective_lb_search [skipped_logs=2]
#Model   2.61s var:219/221 constraints:2832/2922
#Bound   2.94s best:878   next:[770,877]  objective_lb_search [skipped_logs=5]
#Model   3.23s var:199/221 constraints:1594/2922
#Model   3.28s var:198/221 constraints:1480/2922
#Model   3.30s var:195/221 constraints:1263/2922
#Model   3.30s var:194/221 constraints:1194/2922
#Done    3.31s no_lp
#Done    3.31s objective_lb_search_no_lp
#Done    3.31s default_lp
#Model   3.31s var:193/221 constraints:1148/2922
#Done    3.31s core
#Done    3.31s max_lp
#Done    3.31s lb_tree_search
#Model   3.31s var:177/221 constraints:470/2922
#Bound   3.28s best:878   next:[839,877]  objective_lb_search_no_lp [skipped_logs=7]

Task timing                                  n [     min,      max]      avg      dev     time         n [     min,      max]      avg      dev    dtime
                             'core':         1 [   3.12s,    3.12s]    3.12s   0.00ns    3.12s         1 [   1.10s,    1.10s]    1.10s   0.00ns    1.10s
                       'default_lp':         1 [   3.12s,    3.12s]    3.12s   0.00ns    3.12s         1 [652.76ms, 652.76ms] 652.76ms   0.00ns 652.76ms
                 'feasibility_pump':        18 [ 60.91ms, 577.72ms]  98.86ms 117.68ms    1.78s        17 [ 16.83ms,  28.12ms]  17.55ms   2.64ms 298.40ms
                            'fixed':         1 [   3.12s,    3.12s]    3.12s   0.00ns    3.12s         1 [485.15ms, 485.15ms] 485.15ms   0.00ns 485.15ms
                  'fj_long_default':         1 [412.08ms, 412.08ms] 412.08ms   0.00ns 412.08ms         1 [ 90.29ms,  90.29ms]  90.29ms   0.00ns  90.29ms
              'fj_long_lin_default':         1 [494.56ms, 494.56ms] 494.56ms   0.00ns 494.56ms         1 [ 80.34ms,  80.34ms]  80.34ms   0.00ns  80.34ms
                   'fj_long_random':         1 [374.59ms, 374.59ms] 374.59ms   0.00ns 374.59ms         1 [ 91.34ms,  91.34ms]  91.34ms   0.00ns  91.34ms
                 'fj_short_default':         1 [234.00ms, 234.00ms] 234.00ms   0.00ns 234.00ms         1 [ 82.06ms,  82.06ms]  82.06ms   0.00ns  82.06ms
             'fj_short_lin_default':         1 [260.79ms, 260.79ms] 260.79ms   0.00ns 260.79ms         1 [ 72.46ms,  72.46ms]  72.46ms   0.00ns  72.46ms
              'fj_short_lin_random':         1 [497.00ms, 497.00ms] 497.00ms   0.00ns 497.00ms         1 [ 75.40ms,  75.40ms]  75.40ms   0.00ns  75.40ms
                  'fj_short_random':         2 [ 41.81ms,  90.16ms]  65.99ms  24.18ms 131.97ms         2 [ 76.39ms,  81.76ms]  79.08ms   2.69ms 158.15ms
                        'fs_random':         1 [218.74ms, 218.74ms] 218.74ms   0.00ns 218.74ms         1 [140.52us, 140.52us] 140.52us   0.00ns 140.52us
                        'fs_random':         1 [219.51ms, 219.51ms] 219.51ms   0.00ns 219.51ms         1 [  4.85ms,   4.85ms]   4.85ms   0.00ns   4.85ms
                  'fs_random_no_lp':         1 [235.86ms, 235.86ms] 235.86ms   0.00ns 235.86ms         1 [495.56us, 495.56us] 495.56us   0.00ns 495.56us
          'fs_random_quick_restart':         1 [218.26ms, 218.26ms] 218.26ms   0.00ns 218.26ms         1 [  2.85ms,   2.85ms]   2.85ms   0.00ns   2.85ms
          'fs_random_quick_restart':         1 [219.08ms, 219.08ms] 219.08ms   0.00ns 219.08ms         1 [140.17us, 140.17us] 140.17us   0.00ns 140.17us
    'fs_random_quick_restart_no_lp':         1 [218.68ms, 218.68ms] 218.68ms   0.00ns 218.68ms         1 [622.53us, 622.53us] 622.53us   0.00ns 622.53us
                    'graph_arc_lns':        17 [  5.82ms, 545.94ms] 169.47ms 177.06ms    2.88s        17 [ 10.00ns, 100.13ms]  20.56ms  37.09ms 349.55ms
                    'graph_cst_lns':        17 [  1.07ms,  51.88ms]   4.39ms  11.89ms  74.60ms         1 [ 10.00ns,  10.00ns]  10.00ns   0.00ns  10.00ns
                    'graph_dec_lns':        17 [  8.08ms, 516.64ms] 153.93ms 159.86ms    2.62s        15 [ 10.00ns, 152.56ms]  24.28ms  44.24ms 364.19ms
                    'graph_var_lns':        18 [  5.01ms, 531.33ms] 149.04ms 174.68ms    2.68s        17 [ 10.00ns, 100.15ms]  21.24ms  36.96ms 361.00ms
                   'lb_tree_search':         1 [   3.11s,    3.11s]    3.11s   0.00ns    3.11s         1 [   1.38s,    1.38s]    1.38s   0.00ns    1.38s
                           'max_lp':         1 [   3.12s,    3.12s]    3.12s   0.00ns    3.12s         1 [   1.15s,    1.15s]    1.15s   0.00ns    1.15s
                            'no_lp':         1 [   3.12s,    3.12s]    3.12s   0.00ns    3.12s         1 [603.46ms, 603.46ms] 603.46ms   0.00ns 603.46ms
              'objective_lb_search':         1 [   3.11s,    3.11s]    3.11s   0.00ns    3.11s         1 [759.87ms, 759.87ms] 759.87ms   0.00ns 759.87ms
       'objective_lb_search_max_lp':         1 [   3.11s,    3.11s]    3.11s   0.00ns    3.11s         1 [837.68ms, 837.68ms] 837.68ms   0.00ns 837.68ms
        'objective_lb_search_no_lp':         1 [   3.10s,    3.10s]    3.10s   0.00ns    3.10s         1 [601.16ms, 601.16ms] 601.16ms   0.00ns 601.16ms
  'objective_shaving_search_max_lp':        18 [ 12.91ms, 556.23ms] 146.20ms 156.05ms    2.63s        13 [  1.59ms, 143.87ms]  20.69ms  38.57ms 268.96ms
   'objective_shaving_search_no_lp':        18 [ 12.56ms, 556.07ms] 135.59ms 153.44ms    2.44s        13 [ 59.02us,  92.64ms]  17.41ms  28.08ms 226.37ms
                          'probing':         1 [   3.11s,    3.11s]    3.11s   0.00ns    3.11s         1 [243.22ms, 243.22ms] 243.22ms   0.00ns 243.22ms
                   'probing_max_lp':         1 [   3.11s,    3.11s]    3.11s   0.00ns    3.11s         1 [770.72ms, 770.72ms] 770.72ms   0.00ns 770.72ms
                     'pseudo_costs':         1 [   3.11s,    3.11s]    3.11s   0.00ns    3.11s         1 [731.35ms, 731.35ms] 731.35ms   0.00ns 731.35ms
                    'quick_restart':         1 [   3.11s,    3.11s]    3.11s   0.00ns    3.11s         1 [629.04ms, 629.04ms] 629.04ms   0.00ns 629.04ms
              'quick_restart_no_lp':         1 [   3.11s,    3.11s]    3.11s   0.00ns    3.11s         1 [721.59ms, 721.59ms] 721.59ms   0.00ns 721.59ms
                    'reduced_costs':         1 [   3.11s,    3.11s]    3.11s   0.00ns    3.11s         1 [837.09ms, 837.09ms] 837.09ms   0.00ns 837.09ms
                        'rins/rens':        18 [153.01us, 522.29ms] 216.82ms 181.94ms    3.90s        15 [ 10.00ns, 100.07ms]  50.22ms  39.52ms 753.31ms
                      'rnd_cst_lns':        18 [  1.05ms, 533.57ms] 155.34ms 167.56ms    2.80s        15 [ 10.00ns, 100.13ms]  21.57ms  36.06ms 323.59ms
                      'rnd_var_lns':        18 [  3.40ms, 565.05ms] 130.74ms 159.68ms    2.35s        17 [ 10.00ns, 100.20ms]  14.11ms  31.52ms 239.86ms
         'scheduling_intervals_lns':        17 [142.73ms,    1.08s] 467.52ms 280.87ms    7.95s        16 [ 12.93ms, 100.34ms]  68.07ms  35.19ms    1.09s
       'scheduling_precedences_lns':        17 [  2.07ms, 995.32ms] 454.55ms 253.42ms    7.73s        16 [ 25.14ms, 100.66ms]  72.49ms  31.71ms    1.16s
       'scheduling_time_window_lns':        17 [131.43ms, 897.56ms] 326.45ms 191.86ms    5.55s        17 [ 10.76ms,  84.70ms]  32.50ms  17.69ms 552.53ms
                     'violation_ls':        18 [  1.26ms,  62.42ms]  28.28ms  19.65ms 509.13ms        18 [ 39.12us,  81.93ms]  35.11ms  26.33ms 631.92ms
                     'violation_ls':        18 [391.35us, 680.80ms]  72.02ms 149.94ms    1.30s        18 [940.00ns, 146.33ms]  63.80ms  52.29ms    1.15s

Search stats                        Bools  Conflicts  Branches  Restarts  BoolPropag  IntegerPropag
                           'core':    874        433    20'894     7'967   2'155'042      1'883'942
                     'default_lp':    146      1'242     7'062     2'606      58'119      1'044'678
                          'fixed':    783      4'057     5'893       383     455'012      1'306'438
                      'fs_random':     70          0       140       140           6          3'591
                      'fs_random':     70          2       158       140          12          4'047
                'fs_random_no_lp':     88          7       179       140         133          5'469
        'fs_random_quick_restart':     70          0       140       140           6          3'591
        'fs_random_quick_restart':     70          1       161       140           8          4'023
  'fs_random_quick_restart_no_lp':     76          0       214       140           8          6'068
                 'lb_tree_search':     80         50     5'984     1'676      11'814        370'970
                         'max_lp':     70        615     5'271     1'525      28'950        811'004
                          'no_lp':    397      2'662     9'667     1'682     341'233      2'102'880
            'objective_lb_search':     86      1'042     5'464     1'618      38'159      1'001'268
     'objective_lb_search_max_lp':     92        698     4'977     1'354      36'309        883'932
      'objective_lb_search_no_lp':    157      2'839     9'047     2'091      98'506      2'113'616
                        'probing':    162         30       294       294       1'615         18'650
                 'probing_max_lp':    122         19       225       225         601          8'957
                   'pseudo_costs':    102      1'177     5'476     1'573      38'347      1'003'969
                  'quick_restart':    283        932    10'917     2'676     249'012      1'188'188
            'quick_restart_no_lp':    851      3'589    14'216     1'911     912'258      2'151'909
                  'reduced_costs':    508      1'453    12'676     2'899     196'911      1'088'866

SAT stats                           ClassicMinim  LitRemoved  LitLearned  LitForgotten  Subsumed  MClauses  MDecisions  MLitTrue  MSubsumed  MLitRemoved  MReused
                           'core':           181         372         773             0         5     3'736      18'735         0         27          125       40
                     'default_lp':           829       2'206       9'968             0        51       360       1'872         0        114          725       34
                          'fixed':         1'243       4'750      52'202             0         2        46         310         0          8           45       11
                      'fs_random':             0           0           0             0         0         0           0         0          0            0        0
                      'fs_random':             0           0           6             0         0         0           0         0          0            0        0
                'fs_random_no_lp':             0           0          42             0         0         0           0         0          0            0        0
        'fs_random_quick_restart':             0           0           0             0         0         0           0         0          0            0        0
        'fs_random_quick_restart':             0           0           2             0         0         0           0         0          0            0        0
  'fs_random_quick_restart_no_lp':             0           0           0             0         0         0           0         0          0            0        0
                 'lb_tree_search':             1           1         158             0         0       253       1'260         0          4           14        2
                         'max_lp':           317         671       4'589             0        55       485       3'515         0        116          639      159
                          'no_lp':         1'882       5'144      24'794             0        91       686       3'999         9        428        2'676       65
            'objective_lb_search':           655       1'641       6'223             0        81       435       2'925         0        165          876       87
     'objective_lb_search_max_lp':           442         963       4'543             0        53       376       3'194         0         87          514      158
      'objective_lb_search_no_lp':         2'172       6'508      15'633             0       122       589       4'025         0        223        1'215      105
                        'probing':             0           0          30             0         0         0           0         0          0            0        0
                 'probing_max_lp':             0           0          19             0         0         0           0         0          0            0        0
                   'pseudo_costs':           634       1'427      10'938             0        50       478       2'909         0        218        1'356       60
                  'quick_restart':           426         833       5'901             0        84     1'088       8'070         0        443        2'698      205
            'quick_restart_no_lp':         1'967       6'516      30'507             0        69       753       4'370        56        431        3'327       72
                  'reduced_costs':           676       1'731      14'211             0        28       291       1'825         0        106          527       73

Lp stats                         Component  Iterations  AddedCuts  OPTIMAL  DUAL_F.  DUAL_U.
                  'default_lp':          1      15'264      3'077    2'166        0        0
                       'fixed':          1       3'386      1'638    4'111        0        0
                   'fs_random':          1         128        277        5        0        0
                   'fs_random':          1         491      1'055       28        0        0
     'fs_random_quick_restart':          1         128        288        5        0        0
     'fs_random_quick_restart':          1         369      1'027       18        0        0
              'lb_tree_search':          1      25'014      2'798    1'725      539        0
                      'max_lp':          1      13'454      2'817      875      242        1
         'objective_lb_search':          1      19'237      2'607    1'801        0        0
  'objective_lb_search_max_lp':          1      19'525      2'288    1'062      337        0
                     'probing':          1       2'376      2'563      521        0        0
              'probing_max_lp':          1       1'639      2'306      203        1        0
                'pseudo_costs':          1      18'456      2'109    1'545      642        1
               'quick_restart':          1       7'781      2'400      876        0        0
               'reduced_costs':          1      14'186      3'178    1'923      380        1

Lp dimension                                                                     Final dimension of first component
                  'default_lp':  330 rows, 217 columns, 1456 entries with magnitude in [1.729037e-03, 1.000000e+00]
                       'fixed':   124 rows, 217 columns, 427 entries with magnitude in [4.155858e-02, 1.000000e+00]
                   'fs_random':   124 rows, 217 columns, 421 entries with magnitude in [2.929382e-02, 1.000000e+00]
                   'fs_random':  411 rows, 217 columns, 1384 entries with magnitude in [2.747963e-03, 1.000000e+00]
     'fs_random_quick_restart':   124 rows, 217 columns, 422 entries with magnitude in [2.929382e-02, 1.000000e+00]
     'fs_random_quick_restart':  354 rows, 217 columns, 1146 entries with magnitude in [7.495753e-04, 1.000000e+00]
              'lb_tree_search':  598 rows, 221 columns, 1777 entries with magnitude in [1.589104e-03, 1.000000e+00]
                      'max_lp':  465 rows, 221 columns, 1095 entries with magnitude in [1.125752e-02, 1.000000e+00]
         'objective_lb_search':  435 rows, 217 columns, 1231 entries with magnitude in [7.941180e-03, 1.000000e+00]
  'objective_lb_search_max_lp':  592 rows, 221 columns, 1801 entries with magnitude in [6.949634e-05, 1.000000e+00]
                     'probing':  439 rows, 217 columns, 2211 entries with magnitude in [1.452610e-03, 1.000000e+00]
              'probing_max_lp':  758 rows, 221 columns, 8320 entries with magnitude in [8.146229e-04, 1.000000e+00]
                'pseudo_costs':  435 rows, 221 columns, 1696 entries with magnitude in [5.492057e-03, 1.000000e+00]
               'quick_restart':  488 rows, 217 columns, 2077 entries with magnitude in [2.846474e-03, 1.000000e+00]
               'reduced_costs':  393 rows, 221 columns, 1473 entries with magnitude in [4.533701e-03, 1.000000e+00]

Lp debug                         CutPropag  CutEqPropag  Adjust  Overflow      Bad  BadScaling
                  'default_lp':          3            0   1'072         0   39'126           0
                       'fixed':          0            0     320         0    3'279           0
                   'fs_random':          0            0       0         0      253           0
                   'fs_random':          0            0      13         0    1'751           0
     'fs_random_quick_restart':          0            0       0         0      263           0
     'fs_random_quick_restart':          0            0       4         0    1'792           0
              'lb_tree_search':         17            2   1'400         0   27'415           0
                      'max_lp':          3            2     547         0   18'782           0
         'objective_lb_search':         22            0     910         0   28'560           0
  'objective_lb_search_max_lp':         17           18     923         0   26'388           0
                     'probing':          6            2     462         0  265'813           0
              'probing_max_lp':          0            0     197         0   81'149           0
                'pseudo_costs':          0           12     935         0   17'479           0
               'quick_restart':          0            7     529         0   23'760           0
               'reduced_costs':          8            0   1'292         0   43'921           0

Lp pool                          Constraints  Updates  Simplif  Merged  Shortened  Split  Strenghtened    Cuts/Call
                  'default_lp':        3'254      235    3'625      40      1'078  1'093         1'590  3'077/6'249
                       'fixed':        1'855        7        1       0          0     13           126  1'638/2'780
                   'fs_random':        1'272        8        0       0          0      6            96  1'055/1'638
                   'fs_random':          494        0        0       0          0      0             4      277/435
     'fs_random_quick_restart':        1'244        9        0       0          0      3            98  1'027/1'561
     'fs_random_quick_restart':          505        0        0       0          0      0             3      288/447
              'lb_tree_search':        5'673      203   22'124      41      4'880    134        19'706  2'798/5'689
                      'max_lp':        5'704      202   17'356      29      6'311    117        16'550  2'817/5'350
         'objective_lb_search':        2'820      308    4'665       4      2'073    464         1'671  2'607/5'374
  'objective_lb_search_max_lp':        5'181      280   17'733      23      4'713    158        17'795  2'288/4'482
                     'probing':        2'780      299      174       0          0    998           492  2'563/4'448
              'probing_max_lp':        5'221      211      857       1          0    139         2'111  2'306/4'355
                'pseudo_costs':        5'022      132    5'891       3        766    162         9'679  2'109/4'137
               'quick_restart':        2'617      115      426       0          0    528           472  2'400/4'140
               'reduced_costs':        6'077      243    8'964      17        960    742        13'149  3'178/6'462

Lp Cut                                         fs_ran  fs_ran  fs_ran  fs_ran  defaul  fixed  max_lp  quick_  reduce  pseudo  lb_tre  probin  object  probin  object
                                       CG_FF:     100      24      21     104     173    180     126     121      98     101     104     161     160      87     123
                                        CG_K:      54      19      17      51     100     89     105      62      54      56      90      69      65      76      63
                                        CG_R:      53      16      14      53     138     80     105      72      84      39     113     105      79      91      43
                                       CG_RB:     171       9       6     176     469    333     424     404     394     316     301     474     433     298     291
                                      CG_RBP:      16       1       1      22      41     34      11      28      18       9      18      70      34      22      12
                                      Clique:       -       -       -       -       -      -      47       -      49      50      57       -       -      19      61
                                          IB:     249      95      95     228     724    316     397     470     437     482     466     373     566      93     520
                                    MIR_1_FF:      54      35      35      54     158     75     197     158     155     104     156     124     162     149     107
                                     MIR_1_K:       8       4       4       4      18     11      20      12      21      13      17       9      14      15      13
                                    MIR_1_KL:       -       -       -       -       2      1       -       1       3       -       -       -       1       -       -
                                     MIR_1_R:      11      11      11      11      31     13      12      19      14       8      15      24      26      10      10
                                    MIR_1_RB:      78      27      25      73     255    122     293     230     350     174     304     232     239     245     187
                                   MIR_1_RBP:       4       -       -       3      15      3      63      10      37      24      62      15       9      48      18
                                    MIR_2_FF:      30      14      14      35      72     40      69      70      79      39      69      55      59      57      65
                                     MIR_2_K:       1       -       1       4       5      9      14       9      24       9      11       8       7       2       6
                                    MIR_2_KL:       -       -       -       -       3      -       -       1       1       1       1       1       -       -       1
                                     MIR_2_R:       7       3       5       9      27     10      19      20      30      11      15      28      20      12       6
                                    MIR_2_RB:      42      11       9      46     149     63     112     112     192      84     115     127     126      74     106
                                   MIR_2_RBP:       7       -       -       6      17      6      12      17      19      10      12      12       8       9      12
                                    MIR_3_FF:      15       3       2      14      43     28      50      48      62      39      58      36      35      45      41
                                     MIR_3_K:       2       1       -       3       7      5      14       2       7       7       7       6      11       4       9
                                    MIR_3_KL:       -       -       -       -       1      -       -       1       1       1       -       4       -       -       -
                                     MIR_3_R:       5       -       -       6      19     13      12      17      36      12      18      22      24      23      15
                                    MIR_3_RB:      22       3       4      24      93     35      68      71     139      66      91      84      77      57      71
                                   MIR_3_RBP:       -       -       -       4       6      2      13       6      17       8      18       8       4       6       6
                                    MIR_4_FF:       6       2       -       6      28     13      44      18      46      22      37      24      22      35      29
                                     MIR_4_K:       4       2       1       2      11      5       7       6       9       9      13       9       8       7       5
                                    MIR_4_KL:       -       -       -       -       5      -       1       2       -       -       -       -       1       -       -
                                     MIR_4_R:       7       1       -       -      18      8      14      17      21      13      17      16      12      17      11
                                    MIR_4_RB:      13       5       3      13      58     27      57      58      92      41      62      61      41      42      39
                                   MIR_4_RBP:       2       -       -       -       4      -       6       4      14       1       6       7       3       5       5
                                    MIR_5_FF:       6       -       -       4      25      3      32      11      37      23      23      18      22      17      27
                                     MIR_5_K:       2       -       -       2       6      2       6       5       7       5       6       3       7       7       6
                                    MIR_5_KL:       -       -       -       -       2      -       -       1       -       -       -       -       4       -       -
                                     MIR_5_R:       2       1       1       2       9      -      18      10      20       3      13       7      16       8       5
                                    MIR_5_RB:       5       -       1       3      42      6      38      33      56      23      43      47      30      26      26
                                   MIR_5_RBP:       4       -       -       2       6      4       6       8       2       2       1       2       4       -       3
                                    MIR_6_FF:       3       -       -       3      16      1      14       5      19      12       8       6      12       7      21
                                     MIR_6_K:       3       -       -       3       8      2       3       2       4       1       1       3       3       1       2
                                    MIR_6_KL:       -       -       -       -       2      -       -       -       -       -       -       1       1       -       -
                                     MIR_6_R:       2       -       -       1      11      1       5       7      10       3       5       8       4       2       2
                                    MIR_6_RB:       3       1       1       4      29      4      24      11      29      13      15      22      13       6      14
                                   MIR_6_RBP:       4       -       -       3       6      1       4       4       2       -       1       2       2       -       1
  NoOverlapCompletionTimeExhaustive_weighted:       -       -       -       -       -      -       9       -       9       8       3       -       -       3       9
                 NoOverlapDisjunctionOnStart:       -       -       -       -       -      -      10       -       6       3       6       -       -       5       4
                                ZERO_HALF_FF:      13       -       3      10      26     24      30      26      34      27      38      26      25      32      24
                                 ZERO_HALF_K:       -       -       -       -       2      2      11       4       8       7      16       -       1       9       4
                                 ZERO_HALF_R:      23       -       -      22     142     35     209     135     335     168     275     189     153     465     203
                                ZERO_HALF_RB:      22       -       3      15      52     30      83      67      90      55      87      45      60      83      47
                               ZERO_HALF_RBP:       2       -       -       2       3      2       3       5       7       7       4      20       4      87      15

LNS stats                        Improv/Calls  Closed  Difficulty  TimeLimit
               'graph_arc_lns':          1/17     82%        0.99       0.10
               'graph_cst_lns':           0/1    100%        0.71       0.10
               'graph_dec_lns':          1/17     76%        0.98       0.10
               'graph_var_lns':          2/18     78%        0.99       0.10
                   'rins/rens':          5/16     69%        0.95       0.10
                 'rnd_cst_lns':          2/16     88%        0.99       0.10
                 'rnd_var_lns':          2/17     88%        0.99       0.10
    'scheduling_intervals_lns':          7/17     47%        0.16       0.10
  'scheduling_precedences_lns':          8/17     47%        0.18       0.10
  'scheduling_time_window_lns':          6/17     94%        1.00       0.10

LS stats                   Batches  Restarts  LinMoves  GenMoves  CompoundMoves  WeightUpdates
       'fj_long_default':        1         1     9'748         0              0            252
   'fj_long_lin_default':        1         1         0     1'979            362              0
        'fj_long_random':        1         1     9'747         0              0            253
      'fj_short_default':        1         1         0     2'164            228              0
  'fj_short_lin_default':        1         1         0     2'234            340              1
   'fj_short_lin_random':        1         1         0     2'314            366              1
       'fj_short_random':        2         1         0     4'121            377              0
          'violation_ls':       18         0    67'525    14'948          1'504         47'987
          'violation_ls':       18         0    70'367    16'733          1'670         36'952

Solutions (41)                   Num     Rank
                  'default_lp':    1  [25,25]
               'graph_dec_lns':    1  [32,32]
                       'no_lp':   13   [1,41]
         'quick_restart_no_lp':   15  [10,40]
                 'rins_lp_lns':    2  [17,18]
  'scheduling_time_window_lns':    1  [24,24]
                'violation_ls':    8  [16,39]

Objective bounds                 Num
              'initial_domain':    1
         'objective_lb_search':    7
  'objective_lb_search_max_lp':    1
   'objective_lb_search_no_lp':   20
                     'probing':    3
               'reduced_costs':    7

Solution repositories    Added  Queried  Ignored  Synchro
  'feasible solutions':    178      398        6      157
        'lp solutions':     55       11        0       45
                'pump':    349        7

Improving bounds shared          Num
                  'default_lp':   59
              'lb_tree_search':  210
                      'max_lp':  113
                       'no_lp':  357
         'objective_lb_search':   14
  'objective_lb_search_max_lp':   37
   'objective_lb_search_no_lp':  213
                     'probing':   35
              'probing_max_lp':    4
                'pseudo_costs':    4
         'quick_restart_no_lp':  292
               'reduced_costs':   63

Clauses shared                   Num
                        'core':    3
                  'default_lp':   30
     'fs_random_quick_restart':    1
              'lb_tree_search':   22
                      'max_lp':   32
                       'no_lp':   29
         'objective_lb_search':    5
  'objective_lb_search_max_lp':    2
   'objective_lb_search_no_lp':    6
                'pseudo_costs':   13
               'quick_restart':    2
         'quick_restart_no_lp':   15
               'reduced_costs':    2

CpSolverResponse summary:
status: OPTIMAL
objective: 878
best_bound: 878
integers: 218
booleans: 70
conflicts: 2
branches: 158
propagations: 12
integer_propagations: 4047
restarts: 140
lp_iterations: 491
walltime: 3.33875
usertime: 3.33875
deterministic_time: 19.9438
gap_integral: 47.2662
solution_fingerprint: 0xdf5908125d45e9b5


--- Simulation Gantt  partir du modle mathmatique ---
