created virtual environment CPython3.12.4.final.0-64 in 7578ms
  creator CPython3Posix(dest=/localscratch/aneumann.63390923.0/env, clear=False, no_vcs_ignore=False, global=False)
  seeder FromAppData(download=False, pip=bundle, via=copy, app_data_dir=/home/aneumann/.local/share/virtualenv)
    added seed packages: pip==25.1.1
  activators BashActivator,CShellActivator,FishActivator,NushellActivator,PowerShellActivator,PythonActivator
Looking in links: /cvmfs/soft.computecanada.ca/custom/python/wheelhouse/gentoo2023/x86-64-v3, /cvmfs/soft.computecanada.ca/custom/python/wheelhouse/gentoo2023/generic, /cvmfs/soft.computecanada.ca/custom/python/wheelhouse/generic
Requirement already satisfied: pip in /localscratch/aneumann.63390923.0/env/lib/python3.12/site-packages (25.1.1)
Looking in links: /cvmfs/soft.computecanada.ca/custom/python/wheelhouse/gentoo2023/x86-64-v3, /cvmfs/soft.computecanada.ca/custom/python/wheelhouse/gentoo2023/generic, /cvmfs/soft.computecanada.ca/custom/python/wheelhouse/generic
ERROR: protobuf-5.28.3-cp38-abi3-manylinux2014_x86_64.whl is not a supported wheel on this platform.
Looking in links: /cvmfs/soft.computecanada.ca/custom/python/wheelhouse/gentoo2023/x86-64-v3, /cvmfs/soft.computecanada.ca/custom/python/wheelhouse/gentoo2023/generic, /cvmfs/soft.computecanada.ca/custom/python/wheelhouse/generic
Processing /home/aneumann/projects/def-adhaj/aneumann/GNRS/wheels/immutabledict-4.2.0-py3-none-any.whl
Installing collected packages: immutabledict
Successfully installed immutabledict-4.2.0
Looking in links: /cvmfs/soft.computecanada.ca/custom/python/wheelhouse/gentoo2023/x86-64-v3, /cvmfs/soft.computecanada.ca/custom/python/wheelhouse/gentoo2023/generic, /cvmfs/soft.computecanada.ca/custom/python/wheelhouse/generic
Processing /cvmfs/soft.computecanada.ca/custom/python/wheelhouse/generic/ortools-9.10.4067+computecanada-cp312-cp312-linux_x86_64.whl (from -r /home/aneumann/projects/def-adhaj/aneumann/GNRS/requirements/or.txt (line 1))
Processing /cvmfs/soft.computecanada.ca/custom/python/wheelhouse/gentoo2023/x86-64-v3/matplotlib-3.10.0+computecanada-cp312-cp312-linux_x86_64.whl (from -r /home/aneumann/projects/def-adhaj/aneumann/GNRS/requirements/or.txt (line 2))
Processing /cvmfs/soft.computecanada.ca/custom/python/wheelhouse/gentoo2023/x86-64-v3/pandas-2.2.3+computecanada-cp312-cp312-linux_x86_64.whl (from -r /home/aneumann/projects/def-adhaj/aneumann/GNRS/requirements/or.txt (line 3))
Processing /cvmfs/soft.computecanada.ca/custom/python/wheelhouse/generic/absl_py-2.2.2+computecanada-py3-none-any.whl (from ortools<9.11,>=9.10->-r /home/aneumann/projects/def-adhaj/aneumann/GNRS/requirements/or.txt (line 1))
Processing /cvmfs/soft.computecanada.ca/custom/python/wheelhouse/gentoo2023/generic/numpy-2.2.2+computecanada-cp312-cp312-linux_x86_64.whl (from ortools<9.11,>=9.10->-r /home/aneumann/projects/def-adhaj/aneumann/GNRS/requirements/or.txt (line 1))
Processing /cvmfs/soft.computecanada.ca/custom/python/wheelhouse/gentoo2023/x86-64-v3/protobuf-6.30.2+computecanada-cp312-cp312-linux_x86_64.whl (from ortools<9.11,>=9.10->-r /home/aneumann/projects/def-adhaj/aneumann/GNRS/requirements/or.txt (line 1))
Requirement already satisfied: immutabledict>=3.0.0 in /localscratch/aneumann.63390923.0/env/lib/python3.12/site-packages (from ortools<9.11,>=9.10->-r /home/aneumann/projects/def-adhaj/aneumann/GNRS/requirements/or.txt (line 1)) (4.2.0)
Processing /cvmfs/soft.computecanada.ca/custom/python/wheelhouse/gentoo2023/generic/contourpy-1.3.1+computecanada-cp312-cp312-linux_x86_64.whl (from matplotlib->-r /home/aneumann/projects/def-adhaj/aneumann/GNRS/requirements/or.txt (line 2))
Processing /cvmfs/soft.computecanada.ca/custom/python/wheelhouse/generic/cycler-0.12.1+computecanada-py3-none-any.whl (from matplotlib->-r /home/aneumann/projects/def-adhaj/aneumann/GNRS/requirements/or.txt (line 2))
Processing /cvmfs/soft.computecanada.ca/custom/python/wheelhouse/generic/fonttools-4.58.2+computecanada-cp312-cp312-linux_x86_64.whl (from matplotlib->-r /home/aneumann/projects/def-adhaj/aneumann/GNRS/requirements/or.txt (line 2))
Processing /cvmfs/soft.computecanada.ca/custom/python/wheelhouse/gentoo2023/x86-64-v3/kiwisolver-1.4.8+computecanada-cp312-cp312-linux_x86_64.whl (from matplotlib->-r /home/aneumann/projects/def-adhaj/aneumann/GNRS/requirements/or.txt (line 2))
Processing /cvmfs/soft.computecanada.ca/custom/python/wheelhouse/generic/packaging-25.0+computecanada-py3-none-any.whl (from matplotlib->-r /home/aneumann/projects/def-adhaj/aneumann/GNRS/requirements/or.txt (line 2))
Processing /cvmfs/soft.computecanada.ca/custom/python/wheelhouse/gentoo2023/x86-64-v3/pillow-11.1.0+computecanada-cp312-cp312-linux_x86_64.whl (from matplotlib->-r /home/aneumann/projects/def-adhaj/aneumann/GNRS/requirements/or.txt (line 2))
Processing /cvmfs/soft.computecanada.ca/custom/python/wheelhouse/generic/pyparsing-3.2.1+computecanada-py3-none-any.whl (from matplotlib->-r /home/aneumann/projects/def-adhaj/aneumann/GNRS/requirements/or.txt (line 2))
Processing /cvmfs/soft.computecanada.ca/custom/python/wheelhouse/generic/python_dateutil-2.9.0.post0+computecanada-py2.py3-none-any.whl (from matplotlib->-r /home/aneumann/projects/def-adhaj/aneumann/GNRS/requirements/or.txt (line 2))
Processing /cvmfs/soft.computecanada.ca/custom/python/wheelhouse/generic/pytz-2025.2+computecanada-py2.py3-none-any.whl (from pandas->-r /home/aneumann/projects/def-adhaj/aneumann/GNRS/requirements/or.txt (line 3))
Processing /cvmfs/soft.computecanada.ca/custom/python/wheelhouse/generic/tzdata-2025.2+computecanada-py2.py3-none-any.whl (from pandas->-r /home/aneumann/projects/def-adhaj/aneumann/GNRS/requirements/or.txt (line 3))
Processing /cvmfs/soft.computecanada.ca/custom/python/wheelhouse/generic/six-1.17.0+computecanada-py2.py3-none-any.whl (from python-dateutil>=2.7->matplotlib->-r /home/aneumann/projects/def-adhaj/aneumann/GNRS/requirements/or.txt (line 2))
Installing collected packages: pytz, tzdata, six, pyparsing, protobuf, pillow, packaging, numpy, kiwisolver, fonttools, cycler, absl-py, python-dateutil, contourpy, pandas, matplotlib, ortools

Successfully installed absl-py-2.2.2+computecanada contourpy-1.3.1+computecanada cycler-0.12.1+computecanada fonttools-4.58.2+computecanada kiwisolver-1.4.8+computecanada matplotlib-3.10.0+computecanada numpy-2.2.2+computecanada ortools-9.10.4067+computecanada packaging-25.0+computecanada pandas-2.2.3+computecanada pillow-11.1.0+computecanada protobuf-6.30.2+computecanada pyparsing-3.2.1+computecanada python-dateutil-2.9.0.post0+computecanada pytz-2025.2+computecanada six-1.17.0+computecanada tzdata-2025.2+computecanada

Starting CP-SAT solver v9.10.4067
Parameters: max_time_in_seconds: 3600 max_memory_in_mb: 12000 log_search_progress: true enumerate_all_solutions: false absolute_gap_limit: 0 relative_gap_limit: 0
Setting number of workers to 48

Initial optimization model '': (model_fingerprint: 0xda13f3f34e030b76)
#Variables: 166 (#ints: 6 in objective)
  - 107 Booleans in [0,1]
  - 59 in [0,420]
#kLinear1: 19
#kLinear2: 212
#kLinear3: 91
#kLinearN: 669 (#terms: 5'808)

Starting presolve at 0.00s
  2.45e-04s  0.00e+00d  [DetectDominanceRelations] 
  8.54e-03s  0.00e+00d  [PresolveToFixPoint] #num_loops=6 #num_dual_strengthening=3 
  1.80e-05s  0.00e+00d  [ExtractEncodingFromLinear] #potential_supersets=3 
[Symmetry] Graph for symmetry has 924 nodes and 3'357 arcs.
[Symmetry] Symmetry computation done. time: 0.00044341 dtime: 0.00032183
[SAT presolve] num removable Booleans: 0 / 41
[SAT presolve] num trivial clauses: 0
[SAT presolve] [0s] clauses:14 literals:37 vars:18 one_side_vars:13 simple_definition:5 singleton_clauses:0
[SAT presolve] [3.985e-05s] clauses:14 literals:37 vars:18 one_side_vars:13 simple_definition:5 singleton_clauses:0
[SAT presolve] [5.4392e-05s] clauses:14 literals:37 vars:18 one_side_vars:13 simple_definition:5 singleton_clauses:0
  2.15e-03s  2.09e-04d  [Probe] #probed=180 #fixed_bools=2 #new_bounds=10 #new_binary_clauses=10 
  2.82e-05s  0.00e+00d  [MaxClique] 
  2.29e-04s  0.00e+00d  [DetectDominanceRelations] 
  3.03e-03s  0.00e+00d  [PresolveToFixPoint] #num_loops=4 #num_dual_strengthening=3 
  6.27e-04s  0.00e+00d  [ProcessAtMostOneAndLinear] 
  6.46e-04s  0.00e+00d  [DetectDuplicateConstraints] #duplicates=130 #without_enforcements=80 
  1.42e-04s  4.52e-06d  [DetectDominatedLinearConstraints] #relevant_constraints=232 #num_inclusions=20 #num_redundant=9 
  1.31e-04s  0.00e+00d  [DetectDifferentVariables] #different=21 #cliques=1 #size=3 
  7.32e-05s  1.81e-06d  [ProcessSetPPC] #relevant_constraints=167 
  1.03e-05s  0.00e+00d  [FindAlmostIdenticalLinearConstraints] 
  8.28e-05s  5.17e-05d  [FindBigAtMostOneAndLinearOverlap] 
  3.97e-04s  1.30e-04d  [FindBigVerticalLinearOverlap] #blocks=1 #saved_nz=37 
  3.60e-05s  5.57e-06d  [FindBigHorizontalLinearOverlap] #linears=154 
  2.04e-05s  1.35e-07d  [MergeClauses] 
  2.95e-04s  0.00e+00d  [DetectDominanceRelations] 
  2.26e-03s  0.00e+00d  [PresolveToFixPoint] #num_loops=2 #num_dual_strengthening=1 
  2.91e-04s  0.00e+00d  [DetectDominanceRelations] 
  1.90e-03s  0.00e+00d  [PresolveToFixPoint] #num_loops=1 #num_dual_strengthening=1 
[SAT presolve] num removable Booleans: 0 / 39
[SAT presolve] num trivial clauses: 0
[SAT presolve] [0s] clauses:14 literals:37 vars:18 one_side_vars:13 simple_definition:5 singleton_clauses:0
[SAT presolve] [3.4085e-05s] clauses:14 literals:37 vars:18 one_side_vars:13 simple_definition:5 singleton_clauses:0
[SAT presolve] [4.6187e-05s] clauses:14 literals:37 vars:18 one_side_vars:13 simple_definition:5 singleton_clauses:0
  1.83e-03s  1.89e-04d  [Probe] #probed=170 #new_bounds=7 #new_binary_clauses=10 
  2.48e-05s  0.00e+00d  [MaxClique] 
  2.97e-04s  0.00e+00d  [DetectDominanceRelations] 
  2.62e-03s  0.00e+00d  [PresolveToFixPoint] #num_loops=4 #num_dual_strengthening=3 
  5.67e-04s  0.00e+00d  [ProcessAtMostOneAndLinear] 
  5.06e-04s  0.00e+00d  [DetectDuplicateConstraints] #without_enforcements=80 
  1.18e-04s  4.17e-06d  [DetectDominatedLinearConstraints] #relevant_constraints=224 #num_inclusions=6 
  5.22e-05s  0.00e+00d  [DetectDifferentVariables] 
  7.11e-05s  1.73e-06d  [ProcessSetPPC] #relevant_constraints=167 
  1.10e-05s  0.00e+00d  [FindAlmostIdenticalLinearConstraints] 
  7.77e-05s  5.01e-05d  [FindBigAtMostOneAndLinearOverlap] 
  3.52e-04s  1.26e-04d  [FindBigVerticalLinearOverlap] 
  3.52e-05s  5.57e-06d  [FindBigHorizontalLinearOverlap] #linears=154 
  1.96e-05s  1.35e-07d  [MergeClauses] 
  3.00e-04s  0.00e+00d  [DetectDominanceRelations] 
  1.92e-03s  0.00e+00d  [PresolveToFixPoint] #num_loops=1 #num_dual_strengthening=1 
  2.93e-04s  0.00e+00d  [DetectDominanceRelations] 
  1.90e-03s  0.00e+00d  [PresolveToFixPoint] #num_loops=1 #num_dual_strengthening=1 
[SAT presolve] num removable Booleans: 0 / 39
[SAT presolve] num trivial clauses: 0
[SAT presolve] [0s] clauses:14 literals:37 vars:18 one_side_vars:13 simple_definition:5 singleton_clauses:0
[SAT presolve] [3.2847e-05s] clauses:14 literals:37 vars:18 one_side_vars:13 simple_definition:5 singleton_clauses:0
[SAT presolve] [4.5141e-05s] clauses:14 literals:37 vars:18 one_side_vars:13 simple_definition:5 singleton_clauses:0
  1.79e-03s  1.88e-04d  [Probe] #probed=170 #new_binary_clauses=10 
  2.47e-05s  0.00e+00d  [MaxClique] 
  2.98e-04s  0.00e+00d  [DetectDominanceRelations] 
  1.93e-03s  0.00e+00d  [PresolveToFixPoint] #num_loops=1 #num_dual_strengthening=1 
  5.69e-04s  0.00e+00d  [ProcessAtMostOneAndLinear] 
  5.04e-04s  0.00e+00d  [DetectDuplicateConstraints] #without_enforcements=80 
  1.19e-04s  4.17e-06d  [DetectDominatedLinearConstraints] #relevant_constraints=224 #num_inclusions=6 
  5.22e-05s  0.00e+00d  [DetectDifferentVariables] 
  7.12e-05s  1.73e-06d  [ProcessSetPPC] #relevant_constraints=167 
  1.08e-05s  0.00e+00d  [FindAlmostIdenticalLinearConstraints] 
  7.76e-05s  5.01e-05d  [FindBigAtMostOneAndLinearOverlap] 
  3.58e-04s  1.26e-04d  [FindBigVerticalLinearOverlap] 
  3.50e-05s  5.57e-06d  [FindBigHorizontalLinearOverlap] #linears=154 
  1.99e-05s  1.35e-07d  [MergeClauses] 
  2.99e-04s  0.00e+00d  [DetectDominanceRelations] 
  1.91e-03s  0.00e+00d  [PresolveToFixPoint] #num_loops=1 #num_dual_strengthening=1 
  2.39e-05s  0.00e+00d  [ExpandObjective] #entries=22 #tight_variables=11 #tight_constraints=4 

Presolve summary:
  - 24 affine relations were detected.
  - rule 'TODO dual: only one blocking constraint?' was applied 504 times.
  - rule 'TODO dual: only one unspecified blocking constraint?' was applied 90 times.
  - rule 'TODO duplicate: identical constraint with different enforcements' was applied 240 times.
  - rule 'TODO linear2: contains a Boolean.' was applied 30 times.
  - rule 'TODO no_overlap: with task always last' was applied 1 time.
  - rule 'affine: new relation' was applied 24 times.
  - rule 'all_diff: inferred from x != y constraints' was applied 1 time.
  - rule 'bool_or: always true' was applied 3 times.
  - rule 'bool_or: implications' was applied 6 times.
  - rule 'deductions: 70 stored' was applied 1 time.
  - rule 'dual: fix variable' was applied 9 times.
  - rule 'dual: reduced domain' was applied 30 times.
  - rule 'duplicate: merged rhs of linear constraint' was applied 36 times.
  - rule 'duplicate: removed constraint' was applied 130 times.
  - rule 'enforcement: false literal' was applied 8 times.
  - rule 'enforcement: true literal' was applied 8 times.
  - rule 'incompatible linear: add implication' was applied 39 times.
  - rule 'linear inclusion: redundant containing constraint' was applied 9 times.
  - rule 'linear matrix: common vertical rectangle' was applied 1 time.
  - rule 'linear1: always true' was applied 4 times.
  - rule 'linear2: contains a Boolean.' was applied 15 times.
  - rule 'linear: always true' was applied 304 times.
  - rule 'linear: doubleton free' was applied 6 times.
  - rule 'linear: empty' was applied 18 times.
  - rule 'linear: extracted enforcement literal' was applied 1'051 times.
  - rule 'linear: fixed or dup variables' was applied 699 times.
  - rule 'linear: negative clause' was applied 14 times.
  - rule 'linear: positive clause' was applied 4 times.
  - rule 'linear: positive equal one' was applied 3 times.
  - rule 'linear: reduced variable domains' was applied 68 times.
  - rule 'linear: remapped using affine relations' was applied 525 times.
  - rule 'linear: simplified rhs' was applied 1'728 times.
  - rule 'linear: variable substitution 1' was applied 6 times.
  - rule 'presolve: 52 unused variables removed.' was applied 1 time.
  - rule 'presolve: iteration' was applied 3 times.

Presolved optimization model '': (model_fingerprint: 0x525ff731060621d6)
#Variables: 85 (#ints: 6 in objective)
  - 39 Booleans in [0,1]
  - 2 in [0,8]
  - 2 in [0,258]
  - 1 in [0,285]
  - 3 in [0,302]
  - 1 in [0,305]
  - 1 in [0,310]
  - 1 in [0,324]
  - 1 in [0,367]
  - 3 in [0,369]
  - 1 in [0,372]
  - 4 in [0,396]
  - 1 in [16,386]
  - 1 in [16,389]
  - 1 in [16,389][436,809]
  - 1 in [19,307]
  - 1 in [22,310]
  - 1 in [36,324]
  - 2 in [42,409]
  - 1 in [48,415]
  - 1 in [53,358]
  - 1 in [84,372]
  - 2 in [85,409]
  - 1 in [91,415]
  - 2 in [99,409]
  - 1 in [105,415]
  - 3 in [121,409]
  - 3 in [124,409]
  - 1 in [127,415]
  - 1 in [130,415]
  - 1 in [164,420]
#kAllDiff: 1
#kBoolAnd: 3 (#enforced: 3) (#literals: 8)
#kBoolOr: 9 (#literals: 27)
#kExactlyOne: 3 (#literals: 9)
#kLinear1: 15 (#enforced: 15 #multi: 9)
#kLinear2: 263 (#enforced: 229 #multi: 191)
#kLinear3: 29 (#enforced: 15 #multi: 7)
#kLinearN: 161 (#enforced: 104) (#terms: 1'143)

Preloading model.
#Bound   0.04s best:inf   next:[200,2030] initial_domain
#Model   0.04s var:85/85 constraints:484/484

Starting search at 0.04s with 48 workers.
16 full problem subsolvers: [core, default_lp, lb_tree_search, max_lp, no_lp, objective_lb_search, objective_lb_search_max_lp, objective_lb_search_no_lp, objective_shaving_search_max_lp, objective_shaving_search_no_lp, probing, probing_max_lp, pseudo_costs, quick_restart, quick_restart_no_lp, reduced_costs]
30 first solution subsolvers: [fj_long_default(2), fj_long_lin_default, fj_long_lin_perturb, fj_long_lin_random, fj_long_perturb, fj_long_random, fj_short_default(2), fj_short_lin_default(2), fj_short_lin_perturb, fj_short_lin_random, fj_short_perturb, fj_short_random, fs_random(4), fs_random_no_lp(4), fs_random_quick_restart(4), fs_random_quick_restart_no_lp(3)]
13 incomplete subsolvers: [feasibility_pump, graph_arc_lns, graph_cst_lns, graph_dec_lns, graph_var_lns, rins/rens, rnd_cst_lns, rnd_var_lns, violation_ls(5)]
3 helper subsolvers: [neighborhood_helper, synchronization_agent, update_gap_integral]
#Bound   0.05s best:inf   next:[201,2030] bool_core (num_cores=1 [size:1 mw:1] a=6 d=0 fixed=0/59 clauses=21)
#1       0.05s best:814   next:[201,813]  no_lp (fixed_bools=0/78)
#Bound   0.05s best:814   next:[202,813]  objective_lb_search_no_lp
#Bound   0.05s best:814   next:[211,813]  objective_lb_search_no_lp
#Bound   0.05s best:814   next:[231,813]  default_lp
#2       0.05s best:781   next:[231,780]  no_lp (fixed_bools=0/82)
#3       0.05s best:762   next:[231,761]  quick_restart_no_lp (fixed_bools=0/97)
#4       0.05s best:760   next:[231,759]  violation_ls(batch:1 #solutions_imported:1 #lin_moves:0 #lin_evals:21 #gen_moves:19 #gen_evals:2 #comp_moves:1 #backtracks:9 #weight_updates:0)
#5       0.05s best:758   next:[231,757]  violation_ls(batch:1 #solutions_imported:1 #lin_moves:0 #lin_evals:2 #gen_moves:1 #gen_evals:0 #comp_moves:1 #backtracks:0 #weight_updates:0)
#6       0.05s best:753   next:[231,752]  quick_restart_no_lp (fixed_bools=0/105)
#7       0.06s best:617   next:[231,616]  no_lp (fixed_bools=1/89)
#8       0.06s best:616   next:[231,615]  violation_ls(batch:2 #solutions_imported:2 #lin_moves:0 #lin_evals:51 #gen_moves:44 #gen_evals:6 #comp_moves:8 #backtracks:18 #weight_updates:0)
#9       0.06s best:615   next:[231,614]  violation_ls(batch:2 #solutions_imported:2 #lin_moves:1 #lin_evals:27 #gen_moves:19 #gen_evals:2 #comp_moves:1 #backtracks:9 #weight_updates:0)
#10      0.06s best:607   next:[231,606]  no_lp (fixed_bools=1/91)
#Bound   0.06s best:607   next:[233,606]  default_lp
#11      0.06s best:456   next:[233,455]  objective_lb_search_no_lp (fixed_bools=1/78)
#Bound   0.06s best:456   next:[235,455]  objective_lb_search_no_lp
#Bound   0.06s best:456   next:[276,455]  objective_lb_search_no_lp
#Bound   0.06s best:456   next:[345,455]  objective_lb_search_no_lp
#Bound   0.06s best:456   next:[373,455]  objective_lb_search_no_lp
#Bound   0.06s best:456   next:[381,455]  objective_lb_search_no_lp
#12      0.06s best:455   next:[381,454]  violation_ls(batch:3 #solutions_imported:3 #lin_moves:701 #lin_evals:3'013 #gen_moves:19 #gen_evals:2 #comp_moves:1 #backtracks:9 #weight_updates:182)
#13      0.07s best:437   next:[381,436]  quick_restart_no_lp (fixed_bools=1/153)
#14      0.07s best:436   next:[381,435]  violation_ls(batch:4 #solutions_imported:4 #lin_moves:702 #lin_evals:3'019 #gen_moves:19 #gen_evals:2 #comp_moves:1 #backtracks:9 #weight_updates:182)
#15      0.07s best:435   next:[381,434]  violation_ls(batch:5 #solutions_imported:5 #lin_moves:703 #lin_evals:3'025 #gen_moves:19 #gen_evals:2 #comp_moves:1 #backtracks:9 #weight_updates:182)
#Bound   0.07s best:435   next:[393,434]  objective_lb_search_no_lp
#16      0.07s best:434   next:[393,433]  quick_restart_no_lp (fixed_bools=3/193)
#17      0.07s best:433   next:[393,432]  quick_restart_no_lp (fixed_bools=4/195)
#18      0.07s best:431   next:[393,430]  quick_restart_no_lp (fixed_bools=5/201)
#Bound   0.07s best:431   next:[400,430]  objective_lb_search_no_lp
#Model   0.07s var:84/85 constraints:356/484
#Model   0.07s var:83/85 constraints:350/484
#Model   0.07s var:82/85 constraints:344/484
#19      0.07s best:429   next:[400,428]  no_lp (fixed_bools=5/108)
#Model   0.07s var:80/85 constraints:322/484
#20      0.07s best:428   next:[400,427]  violation_ls(batch:6 #solutions_imported:6 #lin_moves:725 #lin_evals:3'115 #gen_moves:19 #gen_evals:2 #comp_moves:1 #backtracks:9 #weight_updates:195)
#Model   0.08s var:77/85 constraints:284/484
#21      0.08s best:427   next:[400,426]  violation_ls(batch:7 #solutions_imported:7 #lin_moves:728 #lin_evals:3'131 #gen_moves:19 #gen_evals:2 #comp_moves:1 #backtracks:9 #weight_updates:197)
#22      0.08s best:425   next:[400,424]  rnd_cst_lns (d=0.81 s=87 t=0.10 p=1.00 stall=2 h=auto_l0)
#Model   0.08s var:76/85 constraints:251/484
#23      0.08s best:423   next:[400,422]  rnd_cst_lns (d=0.81 s=76 t=0.10 p=1.00 stall=2 h=auto_l0)
#24      0.08s best:422   next:[400,421]  graph_arc_lns (d=0.91 s=89 t=0.10 p=1.00 stall=0 h=auto_l0)
#Bound   0.09s best:422   next:[410,421]  objective_lb_search_no_lp
#Model   0.09s var:68/85 constraints:171/484
#Bound   0.09s best:422   next:[416,421]  objective_lb_search_no_lp
#25      0.09s best:419   next:[416,418]  no_lp (fixed_bools=36/117)
#Bound   0.09s best:419   next:[418,418]  objective_lb_search_no_lp
#Done    0.09s objective_lb_search_no_lp
#Done    0.09s no_lp
#Model   0.09s var:66/85 constraints:135/484

Task timing                                  n [     min,      max]      avg      dev     time         n [     min,      max]      avg      dev    dtime
                             'core':         1 [ 44.64ms,  44.64ms]  44.64ms   0.00ns  44.64ms         1 [  9.62ms,   9.62ms]   9.62ms   0.00ns   9.62ms
                       'default_lp':         1 [ 42.61ms,  42.61ms]  42.61ms   0.00ns  42.61ms         1 [  3.18ms,   3.18ms]   3.18ms   0.00ns   3.18ms
                 'feasibility_pump':         4 [895.18us,  14.60ms]   6.77ms   5.67ms  27.09ms         3 [249.65us,   1.56ms]   1.05ms 574.59us   3.16ms
                  'fj_long_default':         0 [  0.00ns,   0.00ns]   0.00ns   0.00ns   0.00ns         0 [  0.00ns,   0.00ns]   0.00ns   0.00ns   0.00ns
                  'fj_long_default':         0 [  0.00ns,   0.00ns]   0.00ns   0.00ns   0.00ns         0 [  0.00ns,   0.00ns]   0.00ns   0.00ns   0.00ns
              'fj_long_lin_default':         0 [  0.00ns,   0.00ns]   0.00ns   0.00ns   0.00ns         0 [  0.00ns,   0.00ns]   0.00ns   0.00ns   0.00ns
              'fj_long_lin_perturb':         0 [  0.00ns,   0.00ns]   0.00ns   0.00ns   0.00ns         0 [  0.00ns,   0.00ns]   0.00ns   0.00ns   0.00ns
               'fj_long_lin_random':         0 [  0.00ns,   0.00ns]   0.00ns   0.00ns   0.00ns         0 [  0.00ns,   0.00ns]   0.00ns   0.00ns   0.00ns
                  'fj_long_perturb':         0 [  0.00ns,   0.00ns]   0.00ns   0.00ns   0.00ns         0 [  0.00ns,   0.00ns]   0.00ns   0.00ns   0.00ns
                   'fj_long_random':         0 [  0.00ns,   0.00ns]   0.00ns   0.00ns   0.00ns         0 [  0.00ns,   0.00ns]   0.00ns   0.00ns   0.00ns
                 'fj_short_default':         0 [  0.00ns,   0.00ns]   0.00ns   0.00ns   0.00ns         0 [  0.00ns,   0.00ns]   0.00ns   0.00ns   0.00ns
                 'fj_short_default':         0 [  0.00ns,   0.00ns]   0.00ns   0.00ns   0.00ns         0 [  0.00ns,   0.00ns]   0.00ns   0.00ns   0.00ns
             'fj_short_lin_default':         0 [  0.00ns,   0.00ns]   0.00ns   0.00ns   0.00ns         0 [  0.00ns,   0.00ns]   0.00ns   0.00ns   0.00ns
             'fj_short_lin_default':         0 [  0.00ns,   0.00ns]   0.00ns   0.00ns   0.00ns         0 [  0.00ns,   0.00ns]   0.00ns   0.00ns   0.00ns
             'fj_short_lin_perturb':         0 [  0.00ns,   0.00ns]   0.00ns   0.00ns   0.00ns         0 [  0.00ns,   0.00ns]   0.00ns   0.00ns   0.00ns
              'fj_short_lin_random':         0 [  0.00ns,   0.00ns]   0.00ns   0.00ns   0.00ns         0 [  0.00ns,   0.00ns]   0.00ns   0.00ns   0.00ns
                 'fj_short_perturb':         0 [  0.00ns,   0.00ns]   0.00ns   0.00ns   0.00ns         0 [  0.00ns,   0.00ns]   0.00ns   0.00ns   0.00ns
                  'fj_short_random':         0 [  0.00ns,   0.00ns]   0.00ns   0.00ns   0.00ns         0 [  0.00ns,   0.00ns]   0.00ns   0.00ns   0.00ns
                        'fs_random':         0 [  0.00ns,   0.00ns]   0.00ns   0.00ns   0.00ns         0 [  0.00ns,   0.00ns]   0.00ns   0.00ns   0.00ns
                        'fs_random':         0 [  0.00ns,   0.00ns]   0.00ns   0.00ns   0.00ns         0 [  0.00ns,   0.00ns]   0.00ns   0.00ns   0.00ns
                        'fs_random':         0 [  0.00ns,   0.00ns]   0.00ns   0.00ns   0.00ns         0 [  0.00ns,   0.00ns]   0.00ns   0.00ns   0.00ns
                        'fs_random':         1 [  1.77ms,   1.77ms]   1.77ms   0.00ns   1.77ms         1 [ 20.00ns,  20.00ns]  20.00ns   0.00ns  20.00ns
                  'fs_random_no_lp':         0 [  0.00ns,   0.00ns]   0.00ns   0.00ns   0.00ns         0 [  0.00ns,   0.00ns]   0.00ns   0.00ns   0.00ns
                  'fs_random_no_lp':         0 [  0.00ns,   0.00ns]   0.00ns   0.00ns   0.00ns         0 [  0.00ns,   0.00ns]   0.00ns   0.00ns   0.00ns
                  'fs_random_no_lp':         0 [  0.00ns,   0.00ns]   0.00ns   0.00ns   0.00ns         0 [  0.00ns,   0.00ns]   0.00ns   0.00ns   0.00ns
                  'fs_random_no_lp':         1 [  1.29ms,   1.29ms]   1.29ms   0.00ns   1.29ms         0 [  0.00ns,   0.00ns]   0.00ns   0.00ns   0.00ns
          'fs_random_quick_restart':         0 [  0.00ns,   0.00ns]   0.00ns   0.00ns   0.00ns         0 [  0.00ns,   0.00ns]   0.00ns   0.00ns   0.00ns
          'fs_random_quick_restart':         0 [  0.00ns,   0.00ns]   0.00ns   0.00ns   0.00ns         0 [  0.00ns,   0.00ns]   0.00ns   0.00ns   0.00ns
          'fs_random_quick_restart':         0 [  0.00ns,   0.00ns]   0.00ns   0.00ns   0.00ns         0 [  0.00ns,   0.00ns]   0.00ns   0.00ns   0.00ns
          'fs_random_quick_restart':         1 [  1.68ms,   1.68ms]   1.68ms   0.00ns   1.68ms         1 [ 20.00ns,  20.00ns]  20.00ns   0.00ns  20.00ns
    'fs_random_quick_restart_no_lp':         0 [  0.00ns,   0.00ns]   0.00ns   0.00ns   0.00ns         0 [  0.00ns,   0.00ns]   0.00ns   0.00ns   0.00ns
    'fs_random_quick_restart_no_lp':         0 [  0.00ns,   0.00ns]   0.00ns   0.00ns   0.00ns         0 [  0.00ns,   0.00ns]   0.00ns   0.00ns   0.00ns
    'fs_random_quick_restart_no_lp':         1 [  1.17ms,   1.17ms]   1.17ms   0.00ns   1.17ms         0 [  0.00ns,   0.00ns]   0.00ns   0.00ns   0.00ns
                    'graph_arc_lns':         6 [  2.10ms,  17.84ms]   7.86ms   5.55ms  47.17ms         6 [ 10.00ns, 586.43us] 196.46us 227.75us   1.18ms
                    'graph_cst_lns':         6 [562.37us,   2.28ms]   1.14ms 558.23us   6.84ms         1 [ 10.00ns,  10.00ns]  10.00ns   0.00ns  10.00ns
                    'graph_dec_lns':         6 [  2.28ms,  15.98ms]   8.57ms   5.54ms  51.43ms         5 [ 10.00ns, 647.44us] 231.80us 285.84us   1.16ms
                    'graph_var_lns':         7 [  1.60ms,  19.66ms]   7.82ms   5.67ms  54.75ms         4 [ 10.00ns, 869.39us] 225.18us 371.99us 900.74us
                   'lb_tree_search':         1 [ 41.71ms,  41.71ms]  41.71ms   0.00ns  41.71ms         1 [ 39.68us,  39.68us]  39.68us   0.00ns  39.68us
                           'max_lp':         1 [ 42.53ms,  42.53ms]  42.53ms   0.00ns  42.53ms         1 [ 37.51us,  37.51us]  37.51us   0.00ns  37.51us
                            'no_lp':         1 [ 41.93ms,  41.93ms]  41.93ms   0.00ns  41.93ms         1 [  5.01ms,   5.01ms]   5.01ms   0.00ns   5.01ms
              'objective_lb_search':         1 [ 41.07ms,  41.07ms]  41.07ms   0.00ns  41.07ms         1 [  1.44ms,   1.44ms]   1.44ms   0.00ns   1.44ms
       'objective_lb_search_max_lp':         1 [ 40.42ms,  40.42ms]  40.42ms   0.00ns  40.42ms         1 [  1.61ms,   1.61ms]   1.61ms   0.00ns   1.61ms
        'objective_lb_search_no_lp':         1 [ 39.87ms,  39.87ms]  39.87ms   0.00ns  39.87ms         1 [  4.38ms,   4.38ms]   4.38ms   0.00ns   4.38ms
  'objective_shaving_search_max_lp':         6 [737.22us,  14.11ms]   4.55ms   4.42ms  27.33ms         1 [318.96us, 318.96us] 318.96us   0.00ns 318.96us
   'objective_shaving_search_no_lp':         6 [  2.23ms,  14.12ms]   4.74ms   4.24ms  28.45ms         1 [212.64us, 212.64us] 212.64us   0.00ns 212.64us
                          'probing':         1 [ 44.31ms,  44.31ms]  44.31ms   0.00ns  44.31ms         1 [  1.45ms,   1.45ms]   1.45ms   0.00ns   1.45ms
                   'probing_max_lp':         1 [ 41.02ms,  41.02ms]  41.02ms   0.00ns  41.02ms         1 [ 39.73us,  39.73us]  39.73us   0.00ns  39.73us
                     'pseudo_costs':         1 [ 41.87ms,  41.87ms]  41.87ms   0.00ns  41.87ms         1 [  2.09ms,   2.09ms]   2.09ms   0.00ns   2.09ms
                    'quick_restart':         1 [ 42.04ms,  42.04ms]  42.04ms   0.00ns  42.04ms         1 [  1.77ms,   1.77ms]   1.77ms   0.00ns   1.77ms
              'quick_restart_no_lp':         1 [ 41.66ms,  41.66ms]  41.66ms   0.00ns  41.66ms         1 [  5.08ms,   5.08ms]   5.08ms   0.00ns   5.08ms
                    'reduced_costs':         1 [ 42.36ms,  42.36ms]  42.36ms   0.00ns  42.36ms         1 [  2.57ms,   2.57ms]   2.57ms   0.00ns   2.57ms
                        'rins/rens':         7 [ 67.50us,  14.65ms]   7.01ms   5.20ms  49.09ms         2 [666.26us,   1.21ms] 936.04us 269.79us   1.87ms
                      'rnd_cst_lns':         7 [431.95us,  14.94ms]   5.42ms   4.45ms  37.93ms         4 [ 10.00ns, 447.84us] 134.58us 184.59us 538.31us
                      'rnd_var_lns':         7 [  1.71ms,  19.97ms]   7.95ms   6.37ms  55.64ms         5 [ 10.00ns,   1.36ms] 278.68us 541.02us   1.39ms
                     'violation_ls':         3 [154.31us,  30.76ms]  10.52ms  14.31ms  31.57ms         3 [  9.40us,  17.74ms]   5.95ms   8.33ms  17.85ms
                     'violation_ls':         3 [257.04us,  31.10ms]  10.71ms  14.42ms  32.12ms         3 [ 19.68us,  16.80ms]   5.64ms   7.89ms  16.93ms
                     'violation_ls':         3 [537.90us,  29.81ms]  10.48ms  13.67ms  31.43ms         3 [370.00ns,  17.32ms]   5.90ms   8.08ms  17.70ms
                     'violation_ls':         3 [579.63us,  30.41ms]  10.70ms  13.94ms  32.10ms         3 [ 53.14us,  16.06ms]   5.50ms   7.47ms  16.50ms
                     'violation_ls':         7 [143.81us,   6.72ms]   1.22ms   2.26ms   8.54ms         7 [560.00ns,   3.23ms] 487.69us   1.12ms   3.41ms

Search stats                        Bools  Conflicts  Branches  Restarts  BoolPropag  IntegerPropag
                           'core':    742        122       747       368      22'494         18'360
                     'default_lp':     91         28       566       268       1'234          8'071
                      'fs_random':      0          0         0         0           0              0
                      'fs_random':      0          0         0         0           0              0
                      'fs_random':      0          0         0         0           0              0
                      'fs_random':     53          0         0         0           0              0
                'fs_random_no_lp':      0          0         0         0           0              0
                'fs_random_no_lp':      0          0         0         0           0              0
                'fs_random_no_lp':      0          0         0         0           0              0
                'fs_random_no_lp':     53          0         0         0           0              0
        'fs_random_quick_restart':      0          0         0         0           0              0
        'fs_random_quick_restart':      0          0         0         0           0              0
        'fs_random_quick_restart':      0          0         0         0           0              0
        'fs_random_quick_restart':     53          0         0         0           0              0
  'fs_random_quick_restart_no_lp':      0          0         0         0           0              0
  'fs_random_quick_restart_no_lp':      0          0         0         0           0              0
  'fs_random_quick_restart_no_lp':     53          0         0         0           0              0
                 'lb_tree_search':     53          0       106       106          79            505
                         'max_lp':     53          0       106       106          79            505
                          'no_lp':    117        121     1'292       428       4'656         27'730
            'objective_lb_search':     57          6       342       203         665          5'486
     'objective_lb_search_max_lp':     53          0       106       106          96            622
      'objective_lb_search_no_lp':     91        135       943       407       3'219         24'171
                        'probing':     95         19       173       173         570          2'417
                 'probing_max_lp':     53          0       106       106          79            505
                   'pseudo_costs':     53          0       106       106          98            638
                  'quick_restart':     90          8       337       204         494          3'943
            'quick_restart_no_lp':    201        115     1'710       459       7'505         26'190
                  'reduced_costs':     53          0       106       106          96            624

SAT stats                           ClassicMinim  LitRemoved  LitLearned  LitForgotten  Subsumed  MClauses  MDecisions  MLitTrue  MSubsumed  MLitRemoved  MReused
                           'core':            22          62         111             0         0        40         201         0          0            0        5
                     'default_lp':            11          15         147             0         2        35         168         0          3            9        3
                      'fs_random':             0           0           0             0         0         0           0         0          0            0        0
                      'fs_random':             0           0           0             0         0         0           0         0          0            0        0
                      'fs_random':             0           0           0             0         0         0           0         0          0            0        0
                      'fs_random':             0           0           0             0         0         0           0         0          0            0        0
                'fs_random_no_lp':             0           0           0             0         0         0           0         0          0            0        0
                'fs_random_no_lp':             0           0           0             0         0         0           0         0          0            0        0
                'fs_random_no_lp':             0           0           0             0         0         0           0         0          0            0        0
                'fs_random_no_lp':             0           0           0             0         0         0           0         0          0            0        0
        'fs_random_quick_restart':             0           0           0             0         0         0           0         0          0            0        0
        'fs_random_quick_restart':             0           0           0             0         0         0           0         0          0            0        0
        'fs_random_quick_restart':             0           0           0             0         0         0           0         0          0            0        0
        'fs_random_quick_restart':             0           0           0             0         0         0           0         0          0            0        0
  'fs_random_quick_restart_no_lp':             0           0           0             0         0         0           0         0          0            0        0
  'fs_random_quick_restart_no_lp':             0           0           0             0         0         0           0         0          0            0        0
  'fs_random_quick_restart_no_lp':             0           0           0             0         0         0           0         0          0            0        0
                 'lb_tree_search':             0           0           0             0         0         0           0         0          0            0        0
                         'max_lp':             0           0           0             0         0         0           0         0          0            0        0
                          'no_lp':            39          74         566             0        13        77         369         1          7           27        9
            'objective_lb_search':             1           2           8             0         0        27         130         0          1            3        2
     'objective_lb_search_max_lp':             0           0           0             0         0         0           0         0          0            0        0
      'objective_lb_search_no_lp':            53          82         610             0        28        74         364         0          3            9        8
                        'probing':             0           0          19             0         0         0           0         0          0            0        0
                 'probing_max_lp':             0           0           0             0         0         0           0         0          0            0        0
                   'pseudo_costs':             0           0           0             0         0         0           0         0          0            0        0
                  'quick_restart':             0           0          11             0         0         7          34         0          0            0        1
            'quick_restart_no_lp':            49          80         618             0         3        81         346         6         22          117        6
                  'reduced_costs':             0           0           0             0         0         0           0         0          0            0        0

Lp stats                         Component  Iterations  AddedCuts  OPTIMAL  DUAL_F.  DUAL_U.
                  'default_lp':          1         260        209       68        1        0
                   'fs_random':          1           0          0        0        0        0
     'fs_random_quick_restart':          1           0          0        0        0        0
              'lb_tree_search':          1          93        283        3        0        0
                      'max_lp':          1          88        352        3        0        0
         'objective_lb_search':          1          83        254       20        0        0
  'objective_lb_search_max_lp':          1         185        368       11        0        0
                     'probing':          1         116        266       39        0        0
              'probing_max_lp':          1          94        271        3        0        0
                'pseudo_costs':          1         177        354       11        0        0
               'quick_restart':          1         179        314       44        0        0
               'reduced_costs':          1         221        362       11        0        0

Lp dimension                                                                    Final dimension of first component
                  'default_lp':   130 rows, 82 columns, 479 entries with magnitude in [7.936118e-03, 1.000000e+00]
                   'fs_random':       0 rows, 82 columns, 0 entries with magnitude in [0.000000e+00, 0.000000e+00]
     'fs_random_quick_restart':       0 rows, 82 columns, 0 entries with magnitude in [0.000000e+00, 0.000000e+00]
              'lb_tree_search':  536 rows, 85 columns, 3001 entries with magnitude in [1.653823e-02, 1.000000e+00]
                      'max_lp':  535 rows, 85 columns, 2997 entries with magnitude in [1.473712e-02, 1.000000e+00]
         'objective_lb_search':   134 rows, 82 columns, 759 entries with magnitude in [4.388817e-03, 1.000000e+00]
  'objective_lb_search_max_lp':   228 rows, 85 columns, 344 entries with magnitude in [1.462899e-02, 1.000000e+00]
                     'probing':   152 rows, 82 columns, 808 entries with magnitude in [1.892644e-03, 1.000000e+00]
              'probing_max_lp':  536 rows, 85 columns, 3006 entries with magnitude in [1.653823e-02, 1.000000e+00]
                'pseudo_costs':   228 rows, 85 columns, 959 entries with magnitude in [6.578011e-04, 1.000000e+00]
               'quick_restart':   148 rows, 82 columns, 649 entries with magnitude in [3.644348e-04, 1.000000e+00]
               'reduced_costs':   231 rows, 85 columns, 395 entries with magnitude in [3.319608e-03, 1.000000e+00]

Lp debug                         CutPropag  CutEqPropag  Adjust  Overflow  Bad  BadScaling
                  'default_lp':          0            0      28         0  101           0
                   'fs_random':          0            0       0         0    0           0
     'fs_random_quick_restart':          0            0       0         0    0           0
              'lb_tree_search':          0            0       2         0   98           0
                      'max_lp':          0            0       2         0  186           0
         'objective_lb_search':          0            0       1         0  299           0
  'objective_lb_search_max_lp':          0            0       4         0  141           0
                     'probing':          0            0      23         0  327           0
              'probing_max_lp':          0            0       2         0  122           0
                'pseudo_costs':          0            0       4         0  163           0
               'quick_restart':          0            0       5         0  295           0
               'reduced_costs':          2            0       4         0  204           0

Lp pool                          Constraints  Updates  Simplif  Merged  Shortened  Split  Strenghtened  Cuts/Call
                  'default_lp':          317      115      229       0         25      5           467    209/295
                   'fs_random':          108        0        0       0          0      0             0        0/0
     'fs_random_quick_restart':          108        0        0       0          0      0             0        0/0
              'lb_tree_search':          768        3        0       0          0      2            77    283/438
                      'max_lp':          837        2        0       0          0      2            67    352/529
         'objective_lb_search':          353      191      260       9         24      9           541    254/345
  'objective_lb_search_max_lp':          852       77    1'177       1        579      1         1'401    368/565
                     'probing':          372       56      209       2        154      1           232    266/401
              'probing_max_lp':          756        3        0       0          0      3            77    271/415
                'pseudo_costs':          831       48      596       8          0      2         1'264    354/566
               'quick_restart':          414      179      395       8        154      8           583    314/421
               'reduced_costs':          844       77    1'175       3        568      2         1'415    362/574

Lp Cut            defaul  max_lp  quick_  reduce  pseudo  lb_tre  probin  object  probin  object
          CG_FF:      14      57      25      25      24      34      21      18      34      30
           CG_K:       6      30      15      14      17       8       6       6       8      12
           CG_R:       8      20      16      25      16      13      12       9      13      25
          CG_RB:      24      39      40      53      58      19      42      41      19      45
         CG_RBP:       -      10       8      12      10       1       -       -       1       8
             IB:      92      62      96      96      94      65      92      97      66      93
       MIR_1_FF:      17      28      19      31      34      20      15      19      22      30
        MIR_1_K:       4      10       3       3       4       8       1       4       9       4
        MIR_1_R:       4       -       3       3       2       -       3       4       -       2
       MIR_1_RB:      10      21      12      22      24      12      15      12      13      24
      MIR_1_RBP:       1       7       1       5       5       4       1       2       5       8
      MIR_1_RLT:       -       -       -       9       4       1       -       -       -      14
       MIR_2_FF:       4      10       6      10      13       7       7       4       3       8
        MIR_2_K:       1       4       3       1       3       5       -       1       2       1
        MIR_2_R:       2       2       3       3       6       1       2       1       1       2
       MIR_2_RB:       2       9       6       6      11       6       5       3       3       6
      MIR_2_RBP:       -       4       3       4       3       2       2       -       -       4
       MIR_3_FF:       3       5       4       5       2       3       1       4       5       3
        MIR_3_K:       1       2       3       1       -       2       -       3       2       2
        MIR_3_R:       3       2       4       3       -       6       2       4       5       2
       MIR_3_RB:       4       4       6       2       1       4       3       5       7       1
      MIR_3_RBP:       -       2       1       -       -       5       -       3       5       1
       MIR_4_FF:       -       -       -       1       1       1       -       -       1       1
        MIR_4_K:       -       -       -       -       -       1       1       -       1       -
        MIR_4_R:       -       -       -       -       2       1       -       -       -       -
       MIR_4_RB:       -       -       -       -       -       1       1       -       -       -
       MIR_5_FF:       -       -       -       1       -       -       -       -       -       -
        MIR_5_R:       -       1       -       -       1       -       -       -       -       -
       MIR_5_RB:       -       1       -       -       -       -       -       -       -       -
   ZERO_HALF_FF:       3       5       4       9       5      13       9       4       9      10
    ZERO_HALF_K:       -       3       7       1       1       7       -       1       6       -
    ZERO_HALF_R:       4       5      11       9       6      13      14       6      13      15
   ZERO_HALF_RB:       1       6       8       5       6      14       9       2      12      12
  ZERO_HALF_RBP:       1       3       7       3       1       6       2       1       6       5

LNS stats           Improv/Calls  Closed  Difficulty  TimeLimit
  'graph_arc_lns':           4/6    100%        0.96       0.10
  'graph_cst_lns':           0/1    100%        0.71       0.10
  'graph_dec_lns':           4/6     83%        0.91       0.10
  'graph_var_lns':           2/6     67%        0.83       0.10
      'rins/rens':           1/5     60%        0.75       0.10
    'rnd_cst_lns':           2/4    100%        0.91       0.10
    'rnd_var_lns':           2/6     67%        0.83       0.10

LS stats                   Batches  Restarts  LinMoves  GenMoves  CompoundMoves  WeightUpdates
       'fj_long_default':        0         0         0         0              0              0
       'fj_long_default':        0         0         0         0              0              0
   'fj_long_lin_default':        0         0         0         0              0              0
   'fj_long_lin_perturb':        0         0         0         0              0              0
    'fj_long_lin_random':        0         0         0         0              0              0
       'fj_long_perturb':        0         0         0         0              0              0
        'fj_long_random':        0         0         0         0              0              0
      'fj_short_default':        0         0         0         0              0              0
      'fj_short_default':        0         0         0         0              0              0
  'fj_short_lin_default':        0         0         0         0              0              0
  'fj_short_lin_default':        0         0         0         0              0              0
  'fj_short_lin_perturb':        0         0         0         0              0              0
   'fj_short_lin_random':        0         0         0         0              0              0
      'fj_short_perturb':        0         0         0         0              0              0
       'fj_short_random':        0         0         0         0              0              0
          'violation_ls':        3         0         0     3'045             55             21
          'violation_ls':        3         0       121     3'091             49             84
          'violation_ls':        3         0     4'192       126             14          3'618
          'violation_ls':        3         0     4'577         4              4          4'880
          'violation_ls':        7         0       728        19              1            197

Solutions (25)                  Num     Rank
              'graph_arc_lns':    1  [24,24]
                      'no_lp':    6   [1,25]
  'objective_lb_search_no_lp':    1  [11,11]
        'quick_restart_no_lp':    6   [3,18]
                'rnd_cst_lns':    2  [22,23]
               'violation_ls':    9   [4,21]

Objective bounds                Num
                  'bool_core':    1
                 'default_lp':    2
             'initial_domain':    1
  'objective_lb_search_no_lp':   12

Solution repositories    Added  Queried  Ignored  Synchro
  'feasible solutions':     61      116        3       40
        'lp solutions':      0        0        0        0
                'pump':     46        6

Improving bounds shared         Num
                       'core':    4
                 'default_lp':   70
                      'no_lp':  104
  'objective_lb_search_no_lp':   91
                    'probing':    5
              'quick_restart':   39
        'quick_restart_no_lp':  278

Clauses shared                  Num
                       'core':    2
                 'default_lp':   20
                      'no_lp':   15
        'objective_lb_search':   26
  'objective_lb_search_no_lp':   10
              'quick_restart':   10
        'quick_restart_no_lp':   18

CpSolverResponse summary:
status: OPTIMAL
objective: 419
best_bound: 419
integers: 83
booleans: 53
conflicts: 0
branches: 0
propagations: 0
integer_propagations: 0
restarts: 0
lp_iterations: 0
walltime: 0.098485
usertime: 0.0984851
deterministic_time: 0.122586
gap_integral: 0.152881
solution_fingerprint: 0x2446596173e80310


--- Simulation Gantt  partir du modle mathmatique ---
{'big':0, 'due_date':53, 'pos_time':5, 'status':2, 'blocked':0, 'operations':["{'type':1, 'processing_time':19}"]}
{'big':0, 'due_date':110, 'pos_time':5, 'status':2, 'blocked':1, 'operations':["{'type':1, 'processing_time':43}"]}
{'big':1, 'due_date':96, 'pos_time':5, 'status':1, 'blocked':1, 'operations':["{'type':0, 'processing_time':56}", "{'type':1, 'processing_time':43}"]}
{'big':0, 'due_date':135, 'pos_time':5, 'status':3, 'blocked':1, 'operations':["{'type':0, 'processing_time':50}", "{'type':1, 'processing_time':57}"]}
{'big':1, 'due_date':96, 'pos_time':5, 'status':2, 'blocked':1, 'operations':["{'type':1, 'processing_time':26}"]}
