created virtual environment CPython3.12.4.final.0-64 in 371ms
  creator CPython3Posix(dest=/localscratch/aneumann.46806161.0/env, clear=False, no_vcs_ignore=False, global=False)
  seeder FromAppData(download=False, pip=bundle, via=copy, app_data_dir=/home/aneumann/.local/share/virtualenv)
    added seed packages: pip==24.2+computecanada
  activators BashActivator,CShellActivator,FishActivator,NushellActivator,PowerShellActivator,PythonActivator
Looking in links: /cvmfs/soft.computecanada.ca/custom/python/wheelhouse/gentoo2023/x86-64-v3, /cvmfs/soft.computecanada.ca/custom/python/wheelhouse/gentoo2023/generic, /cvmfs/soft.computecanada.ca/custom/python/wheelhouse/generic
Requirement already satisfied: pip in /localscratch/aneumann.46806161.0/env/lib/python3.12/site-packages (24.2+computecanada)
Processing /cvmfs/soft.computecanada.ca/custom/python/wheelhouse/generic/pip-25.0+computecanada-py3-none-any.whl
Installing collected packages: pip
  Attempting uninstall: pip
    Found existing installation: pip 24.2+computecanada
    Uninstalling pip-24.2+computecanada:
      Successfully uninstalled pip-24.2+computecanada
Successfully installed pip-25.0+computecanada
Looking in links: /cvmfs/soft.computecanada.ca/custom/python/wheelhouse/gentoo2023/x86-64-v3, /cvmfs/soft.computecanada.ca/custom/python/wheelhouse/gentoo2023/generic, /cvmfs/soft.computecanada.ca/custom/python/wheelhouse/generic
ERROR: protobuf-5.28.3-cp38-abi3-manylinux2014_x86_64.whl is not a supported wheel on this platform.
Looking in links: /cvmfs/soft.computecanada.ca/custom/python/wheelhouse/gentoo2023/x86-64-v3, /cvmfs/soft.computecanada.ca/custom/python/wheelhouse/gentoo2023/generic, /cvmfs/soft.computecanada.ca/custom/python/wheelhouse/generic
Processing /home/aneumann/projects/def-adhaj/aneumann/GNRS/wheels/immutabledict-4.2.0-py3-none-any.whl
Installing collected packages: immutabledict
Successfully installed immutabledict-4.2.0
Looking in links: /cvmfs/soft.computecanada.ca/custom/python/wheelhouse/gentoo2023/x86-64-v3, /cvmfs/soft.computecanada.ca/custom/python/wheelhouse/gentoo2023/generic, /cvmfs/soft.computecanada.ca/custom/python/wheelhouse/generic
Processing /cvmfs/soft.computecanada.ca/custom/python/wheelhouse/generic/ortools-9.10.4067+computecanada-cp312-cp312-linux_x86_64.whl (from -r /home/aneumann/projects/def-adhaj/aneumann/GNRS/requirements/or.txt (line 1))
Processing /cvmfs/soft.computecanada.ca/custom/python/wheelhouse/gentoo2023/x86-64-v3/matplotlib-3.10.0+computecanada-cp312-cp312-linux_x86_64.whl (from -r /home/aneumann/projects/def-adhaj/aneumann/GNRS/requirements/or.txt (line 2))
Processing /cvmfs/soft.computecanada.ca/custom/python/wheelhouse/gentoo2023/x86-64-v3/pandas-2.2.3+computecanada-cp312-cp312-linux_x86_64.whl (from -r /home/aneumann/projects/def-adhaj/aneumann/GNRS/requirements/or.txt (line 3))
Processing /cvmfs/soft.computecanada.ca/custom/python/wheelhouse/generic/absl_py-2.3.0+computecanada-py3-none-any.whl (from ortools<9.11,>=9.10->-r /home/aneumann/projects/def-adhaj/aneumann/GNRS/requirements/or.txt (line 1))
Processing /cvmfs/soft.computecanada.ca/custom/python/wheelhouse/gentoo2023/generic/numpy-2.2.2+computecanada-cp312-cp312-linux_x86_64.whl (from ortools<9.11,>=9.10->-r /home/aneumann/projects/def-adhaj/aneumann/GNRS/requirements/or.txt (line 1))
Processing /cvmfs/soft.computecanada.ca/custom/python/wheelhouse/gentoo2023/x86-64-v3/protobuf-6.31.1+computecanada-cp312-cp312-linux_x86_64.whl (from ortools<9.11,>=9.10->-r /home/aneumann/projects/def-adhaj/aneumann/GNRS/requirements/or.txt (line 1))
Requirement already satisfied: immutabledict>=3.0.0 in /localscratch/aneumann.46806161.0/env/lib/python3.12/site-packages (from ortools<9.11,>=9.10->-r /home/aneumann/projects/def-adhaj/aneumann/GNRS/requirements/or.txt (line 1)) (4.2.0)
Processing /cvmfs/soft.computecanada.ca/custom/python/wheelhouse/gentoo2023/generic/contourpy-1.3.1+computecanada-cp312-cp312-linux_x86_64.whl (from matplotlib->-r /home/aneumann/projects/def-adhaj/aneumann/GNRS/requirements/or.txt (line 2))
Processing /cvmfs/soft.computecanada.ca/custom/python/wheelhouse/generic/cycler-0.12.1+computecanada-py3-none-any.whl (from matplotlib->-r /home/aneumann/projects/def-adhaj/aneumann/GNRS/requirements/or.txt (line 2))
Processing /cvmfs/soft.computecanada.ca/custom/python/wheelhouse/generic/fonttools-4.59.0+computecanada-cp312-cp312-linux_x86_64.whl (from matplotlib->-r /home/aneumann/projects/def-adhaj/aneumann/GNRS/requirements/or.txt (line 2))
Processing /cvmfs/soft.computecanada.ca/custom/python/wheelhouse/gentoo2023/x86-64-v3/kiwisolver-1.4.8+computecanada-cp312-cp312-linux_x86_64.whl (from matplotlib->-r /home/aneumann/projects/def-adhaj/aneumann/GNRS/requirements/or.txt (line 2))
Processing /cvmfs/soft.computecanada.ca/custom/python/wheelhouse/generic/packaging-25.0+computecanada-py3-none-any.whl (from matplotlib->-r /home/aneumann/projects/def-adhaj/aneumann/GNRS/requirements/or.txt (line 2))
Processing /cvmfs/soft.computecanada.ca/custom/python/wheelhouse/gentoo2023/x86-64-v3/pillow-11.1.0+computecanada-cp312-cp312-linux_x86_64.whl (from matplotlib->-r /home/aneumann/projects/def-adhaj/aneumann/GNRS/requirements/or.txt (line 2))
Processing /cvmfs/soft.computecanada.ca/custom/python/wheelhouse/generic/pyparsing-3.2.3+computecanada-py3-none-any.whl (from matplotlib->-r /home/aneumann/projects/def-adhaj/aneumann/GNRS/requirements/or.txt (line 2))
Processing /cvmfs/soft.computecanada.ca/custom/python/wheelhouse/generic/python_dateutil-2.9.0.post0+computecanada-py2.py3-none-any.whl (from matplotlib->-r /home/aneumann/projects/def-adhaj/aneumann/GNRS/requirements/or.txt (line 2))
Processing /cvmfs/soft.computecanada.ca/custom/python/wheelhouse/generic/pytz-2025.2+computecanada-py2.py3-none-any.whl (from pandas->-r /home/aneumann/projects/def-adhaj/aneumann/GNRS/requirements/or.txt (line 3))
Processing /cvmfs/soft.computecanada.ca/custom/python/wheelhouse/generic/tzdata-2025.2+computecanada-py2.py3-none-any.whl (from pandas->-r /home/aneumann/projects/def-adhaj/aneumann/GNRS/requirements/or.txt (line 3))
Processing /cvmfs/soft.computecanada.ca/custom/python/wheelhouse/generic/six-1.17.0+computecanada-py2.py3-none-any.whl (from python-dateutil>=2.7->matplotlib->-r /home/aneumann/projects/def-adhaj/aneumann/GNRS/requirements/or.txt (line 2))
Installing collected packages: pytz, tzdata, six, pyparsing, protobuf, pillow, packaging, numpy, kiwisolver, fonttools, cycler, absl-py, python-dateutil, contourpy, pandas, matplotlib, ortools
Successfully installed absl-py-2.3.0+computecanada contourpy-1.3.1+computecanada cycler-0.12.1+computecanada fonttools-4.59.0+computecanada kiwisolver-1.4.8+computecanada matplotlib-3.10.0+computecanada numpy-2.2.2+computecanada ortools-9.10.4067+computecanada packaging-25.0+computecanada pandas-2.2.3+computecanada pillow-11.1.0+computecanada protobuf-6.31.1+computecanada pyparsing-3.2.3+computecanada python-dateutil-2.9.0.post0+computecanada pytz-2025.2+computecanada six-1.17.0+computecanada tzdata-2025.2+computecanada

Starting CP-SAT solver v9.10.4067
Parameters: max_time_in_seconds: 86400 max_memory_in_mb: 185000 log_search_progress: true enumerate_all_solutions: false num_search_workers: 32 absolute_gap_limit: 0 relative_gap_limit: 0

Initial optimization model '': (model_fingerprint: 0xa9635afe18cfcb15)
#Variables: 309 (#ints: 10 in objective)
  - 219 Booleans in [0,1]
  - 90 in [0,556]
#kLinear1: 42
#kLinear2: 476
#kLinear3: 247
#kLinearN: 3'973 (#terms: 63'498)

Starting presolve at 0.00s
  1.90e-03s  0.00e+00d  [DetectDominanceRelations] 
  2.74e-02s  0.00e+00d  [PresolveToFixPoint] #num_loops=8 #num_dual_strengthening=3 
  3.59e-05s  0.00e+00d  [ExtractEncodingFromLinear] #potential_supersets=5 
[Symmetry] Graph for symmetry has 4'639 nodes and 50'571 arcs.
[Symmetry] Symmetry computation done. time: 0.00190167 dtime: 0.00406915
[Symmetry] #generators: 1, average support size: 28
[Symmetry] The model contains 181 duplicate constraints !
[Symmetry] 14 orbits with sizes: 2,2,2,2,2,2,2,2,2,2,...
[Symmetry] Num fixable by intersecting at_most_one with orbits: 1 largest_orbit: 2
  1.02e-02s  2.41e-03d  [Probe] #probed=304 #new_bounds=9 #equiv=1 
  7.16e-05s  0.00e+00d  [MaxClique] 
  1.79e-03s  0.00e+00d  [DetectDominanceRelations] 
  1.31e-02s  0.00e+00d  [PresolveToFixPoint] #num_loops=5 #num_dual_strengthening=3 
  6.03e-03s  0.00e+00d  [ProcessAtMostOneAndLinear] 
  2.18e-03s  0.00e+00d  [DetectDuplicateConstraints] #duplicates=244 #without_enforcements=74 
  2.48e-03s  2.42e-04d  [DetectDominatedLinearConstraints] #relevant_constraints=3'565 #num_inclusions=2'789 
  3.88e-04s  0.00e+00d  [DetectDifferentVariables] #different=19 #cliques=1 #size=5 
  5.81e-04s  7.39e-05d  [ProcessSetPPC] #relevant_constraints=3'176 
  1.74e-05s  0.00e+00d  [FindAlmostIdenticalLinearConstraints] 
  1.93e-04s  3.08e-04d  [FindBigAtMostOneAndLinearOverlap] 
  5.21e-03s  4.67e-03d  [FindBigVerticalLinearOverlap] #blocks=49 #saved_nz=6'853 
  3.47e-04s  1.81e-04d  [FindBigHorizontalLinearOverlap] #linears=3'112 
  1.98e-05s  0.00e+00d  [MergeClauses] 
  2.00e-03s  0.00e+00d  [DetectDominanceRelations] 
  1.77e-02s  0.00e+00d  [PresolveToFixPoint] #num_loops=2 #num_dual_strengthening=1 
  1.99e-03s  0.00e+00d  [DetectDominanceRelations] 
  1.11e-02s  0.00e+00d  [PresolveToFixPoint] #num_loops=1 #num_dual_strengthening=1 
[Symmetry] Graph for symmetry has 4'560 nodes and 42'907 arcs.
[Symmetry] Symmetry computation done. time: 0.000964987 dtime: 0.00238743
  9.32e-03s  2.21e-03d  [Probe] #probed=304 #new_bounds=28 
  1.27e-05s  0.00e+00d  [MaxClique] 
  2.00e-03s  0.00e+00d  [DetectDominanceRelations] 
  1.53e-02s  0.00e+00d  [PresolveToFixPoint] #num_loops=2 #num_dual_strengthening=1 
  5.69e-03s  0.00e+00d  [ProcessAtMostOneAndLinear] 
  1.96e-03s  0.00e+00d  [DetectDuplicateConstraints] #without_enforcements=84 
  1.91e-03s  1.89e-04d  [DetectDominatedLinearConstraints] #relevant_constraints=3'461 #num_inclusions=1'257 
  2.47e-04s  0.00e+00d  [DetectDifferentVariables] 
  5.54e-04s  5.92e-05d  [ProcessSetPPC] #relevant_constraints=3'074 
  2.44e-05s  9.00e-08d  [FindAlmostIdenticalLinearConstraints] #num_tested_pairs=6 
  9.87e-05s  1.38e-04d  [FindBigAtMostOneAndLinearOverlap] 
  4.52e-03s  3.64e-03d  [FindBigVerticalLinearOverlap] #blocks=48 #saved_nz=5'755 
  3.13e-04s  1.48e-04d  [FindBigHorizontalLinearOverlap] #linears=2'982 
  1.10e-05s  0.00e+00d  [MergeClauses] 
  1.78e-03s  0.00e+00d  [DetectDominanceRelations] 
  1.89e-02s  0.00e+00d  [PresolveToFixPoint] #num_loops=3 #num_dual_strengthening=1 
  1.77e-03s  0.00e+00d  [DetectDominanceRelations] 
  1.23e-02s  0.00e+00d  [PresolveToFixPoint] #num_loops=1 #num_dual_strengthening=1 
[Symmetry] Graph for symmetry has 4'693 nodes and 37'189 arcs.
[Symmetry] Symmetry computation done. time: 0.000805435 dtime: 0.00211877
  8.52e-03s  2.07e-03d  [Probe] #probed=304 #new_bounds=32 
  1.16e-05s  0.00e+00d  [MaxClique] 
  1.77e-03s  0.00e+00d  [DetectDominanceRelations] 
  1.70e-02s  0.00e+00d  [PresolveToFixPoint] #num_loops=2 #num_dual_strengthening=1 
  5.15e-03s  0.00e+00d  [ProcessAtMostOneAndLinear] 
  1.93e-03s  0.00e+00d  [DetectDuplicateConstraints] #without_enforcements=115 
  1.31e-03s  1.27e-04d  [DetectDominatedLinearConstraints] #relevant_constraints=3'263 #num_inclusions=328 
  2.35e-04s  0.00e+00d  [DetectDifferentVariables] 
  4.90e-04s  4.54e-05d  [ProcessSetPPC] #relevant_constraints=2'833 
  3.34e-05s  7.20e-07d  [FindAlmostIdenticalLinearConstraints] #num_tested_pairs=48 
  9.13e-05s  1.15e-04d  [FindBigAtMostOneAndLinearOverlap] 
  2.63e-03s  2.65e-03d  [FindBigVerticalLinearOverlap] #blocks=25 #saved_nz=1'801 
  2.90e-04s  1.31e-04d  [FindBigHorizontalLinearOverlap] #linears=2'743 
  1.13e-05s  0.00e+00d  [MergeClauses] 
  1.71e-03s  0.00e+00d  [DetectDominanceRelations] 
  1.51e-02s  0.00e+00d  [PresolveToFixPoint] #num_loops=2 #num_dual_strengthening=1 
  8.26e-05s  0.00e+00d  [ExpandObjective] #entries=471 #tight_variables=203 #tight_constraints=110 

Presolve summary:
  - 71 affine relations were detected.
  - rule 'TODO dual: only one blocking constraint?' was applied 674 times.
  - rule 'TODO dual: only one blocking enforced constraint?' was applied 52 times.
  - rule 'TODO dual: only one unspecified blocking constraint?' was applied 40 times.
  - rule 'TODO duplicate: identical constraint with different enforcements' was applied 273 times.
  - rule 'affine: new relation' was applied 71 times.
  - rule 'at_most_one: removed literals' was applied 4 times.
  - rule 'at_most_one: size one' was applied 4 times.
  - rule 'deductions: 214 stored' was applied 1 time.
  - rule 'dual: fix variable' was applied 27 times.
  - rule 'dual: reduced domain' was applied 50 times.
  - rule 'duplicate: merged rhs of linear constraint' was applied 48 times.
  - rule 'duplicate: removed constraint' was applied 244 times.
  - rule 'enforcement: false literal' was applied 8 times.
  - rule 'exactly_one: x and not(x)' was applied 1 time.
  - rule 'incompatible linear: add implication' was applied 30 times.
  - rule 'linear matrix: common vertical rectangle' was applied 122 times.
  - rule 'linear: always true' was applied 653 times.
  - rule 'linear: doubleton free' was applied 11 times.
  - rule 'linear: empty' was applied 30 times.
  - rule 'linear: extracted enforcement literal' was applied 6'107 times.
  - rule 'linear: fixed or dup variables' was applied 4'054 times.
  - rule 'linear: positive equal one' was applied 5 times.
  - rule 'linear: reduced variable domains' was applied 213 times.
  - rule 'linear: remapped using affine relations' was applied 4'153 times.
  - rule 'linear: simplified rhs' was applied 11'482 times.
  - rule 'linear: tightened into equality' was applied 9 times.
  - rule 'linear: variable substitution 1' was applied 11 times.
  - rule 'linear: variable substitution 3' was applied 2 times.
  - rule 'no_overlap: inferred from x != y constraints' was applied 1 time.
  - rule 'presolve: 89 unused variables removed.' was applied 1 time.
  - rule 'presolve: iteration' was applied 3 times.
  - rule 'probing: reduced enforced constraint to implication.' was applied 4 times.
  - rule 'symmetry: fixed to false in general orbit' was applied 1 time.

Presolved optimization model '': (model_fingerprint: 0xe68fd82723924094)
#Variables: 258 (#ints: 10 in objective)
  - 79 Booleans in [0,1]
  - 139 different domains in [-4341,4366] with a largest complexity of 12.
#kExactlyOne: 4 (#literals: 12)
#kInterval: 5
#kLinear2: 595 (#enforced: 553 #multi: 460)
#kLinear3: 351 (#enforced: 216 #multi: 27)
#kLinearN: 2'887 (#enforced: 2'678 #multi: 26) (#terms: 26'719)
#kNoOverlap: 1 (#intervals: 5)

Preloading model.
#Bound   0.24s best:inf   next:[174,4551] initial_domain
[Symmetry] Graph for symmetry has 4'583 nodes and 35'403 arcs.
[Symmetry] Symmetry computation done. time: 0.000716296 dtime: 0.00202222
#Model   0.25s var:258/258 constraints:3843/3843

Starting search at 0.25s with 32 workers.
17 full problem subsolvers: [core, default_lp, fixed, lb_tree_search, max_lp, no_lp, objective_lb_search, objective_lb_search_max_lp, objective_lb_search_no_lp, objective_shaving_search_max_lp, objective_shaving_search_no_lp, probing, probing_max_lp, pseudo_costs, quick_restart, quick_restart_no_lp, reduced_costs]
13 first solution subsolvers: [fj_long_default, fj_long_lin_default, fj_long_random, fj_short_default, fj_short_lin_default, fj_short_lin_random, fj_short_random, fs_random(2), fs_random_no_lp, fs_random_quick_restart(2), fs_random_quick_restart_no_lp]
13 incomplete subsolvers: [feasibility_pump, graph_arc_lns, graph_cst_lns, graph_dec_lns, graph_var_lns, rins/rens, rnd_cst_lns, rnd_var_lns, scheduling_intervals_lns, scheduling_precedences_lns, scheduling_time_window_lns, violation_ls(2)]
3 helper subsolvers: [neighborhood_helper, synchronization_agent, update_gap_integral]
#Bound   0.31s best:inf   next:[183,4551] objective_lb_search_no_lp
#1       0.32s best:1993  next:[183,1992] quick_restart_no_lp (fixed_bools=0/130)
#2       0.33s best:1625  next:[183,1624] no_lp (fixed_bools=0/117)
#Bound   0.34s best:1625  next:[218,1624] probing
#3       0.34s best:1255  next:[218,1254] no_lp (fixed_bools=0/138)
#4       0.35s best:1163  next:[218,1162] no_lp (fixed_bools=0/152)
#Bound   0.36s best:1163  next:[219,1162] fixed
#5       0.36s best:1153  next:[219,1152] no_lp (fixed_bools=0/153)
#6       0.37s best:1151  next:[219,1150] no_lp (fixed_bools=0/157)
#7       0.37s best:1148  next:[219,1147] quick_restart_no_lp (fixed_bools=0/177)
#Bound   0.37s best:1148  next:[228,1147] objective_lb_search
#Bound   0.37s best:1148  next:[229,1147] objective_lb_search
#8       0.38s best:1109  next:[229,1108] no_lp (fixed_bools=0/165)
#Bound   0.38s best:1109  next:[230,1108] objective_lb_search
#Bound   0.38s best:1109  next:[421,1108] objective_lb_search_no_lp
#Bound   0.40s best:1109  next:[422,1108] objective_lb_search_no_lp
#Bound   0.41s best:1109  next:[438,1108] objective_lb_search_no_lp
#9       0.42s best:1041  next:[438,1040] no_lp (fixed_bools=0/179)
#Bound   0.51s best:1041  next:[445,1040] objective_lb_search_no_lp
#Bound   0.52s best:1041  next:[452,1040] objective_lb_search_no_lp
#Bound   0.57s best:1041  next:[453,1040] objective_lb_search_no_lp
#Bound   0.60s best:1041  next:[462,1040] objective_lb_search_no_lp
#Bound   0.60s best:1041  next:[464,1040] objective_lb_search_no_lp
#Bound   0.61s best:1041  next:[465,1040] objective_lb_search_no_lp
#Bound   0.62s best:1041  next:[469,1040] objective_lb_search_no_lp
#Bound   0.66s best:1041  next:[472,1040] objective_lb_search_no_lp
#Bound   0.68s best:1041  next:[496,1040] objective_lb_search_no_lp
#Bound   0.69s best:1041  next:[497,1040] objective_lb_search_no_lp
#Bound   0.72s best:1041  next:[499,1040] objective_lb_search_no_lp
#10      0.74s best:971   next:[531,970]  no_lp (fixed_bools=0/195)
#11      0.88s best:950   next:[542,949]  no_lp (fixed_bools=0/202)
#12      0.89s best:888   next:[542,887]  no_lp (fixed_bools=0/203)
#Bound   0.88s best:971   next:[542,970]  objective_lb_search_no_lp [skipped_logs=6]
#13      1.29s best:887   next:[548,886]  no_lp (fixed_bools=0/226)
#14      1.29s best:886   next:[548,885]  no_lp (fixed_bools=0/226)
#15      1.30s best:885   next:[548,884]  no_lp (fixed_bools=0/226)
#16      1.30s best:884   next:[548,883]  no_lp (fixed_bools=0/226)
#17      1.31s best:883   next:[548,882]  no_lp (fixed_bools=0/226)
#18      1.32s best:882   next:[548,881]  no_lp (fixed_bools=0/226)
#19      1.32s best:878   next:[548,877]  no_lp (fixed_bools=0/232)
#20      1.33s best:877   next:[548,876]  no_lp (fixed_bools=0/232)
#21      1.33s best:876   next:[548,875]  no_lp (fixed_bools=0/232)
#22      1.33s best:875   next:[548,874]  no_lp (fixed_bools=0/232)
#23      1.34s best:874   next:[548,873]  no_lp (fixed_bools=0/232)
#24      1.81s best:865   next:[561,864]  no_lp (fixed_bools=1/290)
#25      1.82s best:864   next:[612,863]  no_lp (fixed_bools=1/290)
#26      1.82s best:857   next:[612,856]  no_lp (fixed_bools=1/305)
#27      1.91s best:853   next:[612,852]  no_lp (fixed_bools=1/313)
#Bound   1.82s best:865   next:[612,864]  objective_lb_search_no_lp [skipped_logs=4]
#Bound   2.97s best:853   next:[617,852]  objective_lb_search_no_lp [skipped_logs=3]
#Bound   3.87s best:853   next:[630,852]  objective_lb_search_no_lp [skipped_logs=4]
#Bound   4.70s best:853   next:[639,852]  objective_lb_search_no_lp [skipped_logs=2]
#Bound   5.14s best:853   next:[643,852]  objective_lb_search_no_lp [skipped_logs=1]
#Bound   6.81s best:853   next:[645,852]  objective_lb_search_no_lp [skipped_logs=0]
#Bound   7.93s best:853   next:[667,852]  objective_lb_search_no_lp [skipped_logs=6]
#Bound   8.39s best:853   next:[674,852]  objective_lb_search_no_lp [skipped_logs=1]
#Bound   9.44s best:853   next:[689,852]  objective_lb_search_no_lp [skipped_logs=0]
#Bound  11.54s best:853   next:[690,852]  objective_lb_search_no_lp
#Bound  11.69s best:853   next:[691,852]  objective_lb_search [skipped_logs=0]
#Bound  12.79s best:853   next:[694,852]  objective_lb_search_no_lp [skipped_logs=2]
#Bound  13.90s best:853   next:[699,852]  objective_lb_search_no_lp [skipped_logs=2]
#Bound  14.64s best:853   next:[706,852]  objective_lb_search_no_lp [skipped_logs=0]
#Model  15.10s var:257/258 constraints:3666/3843
#Bound  15.84s best:853   next:[711,852]  objective_lb_search_no_lp [skipped_logs=1]
#Model  16.06s var:256/258 constraints:3584/3843
#Bound  16.55s best:853   next:[716,852]  objective_lb_search_no_lp [skipped_logs=2]
#Bound  17.91s best:853   next:[717,852]  objective_shaving_search_no_lp (vars=289 csts=3614) [skipped_logs=0]
#Bound  18.86s best:853   next:[725,852]  objective_lb_search_no_lp [skipped_logs=3]
#Bound  19.52s best:853   next:[732,852]  objective_lb_search_no_lp [skipped_logs=3]
#Bound  20.74s best:853   next:[739,852]  objective_lb_search_no_lp [skipped_logs=2]
#Bound  21.65s best:853   next:[746,852]  objective_lb_search_no_lp [skipped_logs=1]
#Model  22.73s var:253/258 constraints:3460/3843
#Model  22.90s var:249/258 constraints:3196/3843
#Bound  22.93s best:853   next:[754,852]  objective_lb_search_no_lp [skipped_logs=2]
#Model  23.09s var:248/258 constraints:3040/3843
#Model  23.28s var:245/258 constraints:2860/3843
#Done   23.31s objective_lb_search_no_lp
#Model  23.32s var:232/258 constraints:1966/3843
#Done   23.32s core
#Done   23.32s default_lp
#Bound  23.31s best:853   next:[789,852]  objective_lb_search_no_lp [skipped_logs=4]

Task timing                                  n [     min,      max]      avg      dev     time         n [     min,      max]      avg      dev    dtime
                             'core':         1 [  23.06s,   23.06s]   23.06s   0.00ns   23.06s         1 [  34.95s,   34.95s]   34.95s   0.00ns   34.95s
                       'default_lp':         1 [  23.07s,   23.07s]   23.07s   0.00ns   23.07s         1 [   6.95s,    6.95s]    6.95s   0.00ns    6.95s
                 'feasibility_pump':        78 [ 39.07ms, 438.27ms]  92.24ms  40.46ms    7.19s        77 [ 24.42ms,  47.98ms]  26.76ms   2.53ms    2.06s
                            'fixed':         1 [  23.06s,   23.06s]   23.06s   0.00ns   23.06s         1 [   6.86s,    6.86s]    6.86s   0.00ns    6.86s
                  'fj_long_default':         1 [131.65ms, 131.65ms] 131.65ms   0.00ns 131.65ms         1 [ 71.23ms,  71.23ms]  71.23ms   0.00ns  71.23ms
              'fj_long_lin_default':         1 [ 93.09ms,  93.09ms]  93.09ms   0.00ns  93.09ms         1 [ 99.34ms,  99.34ms]  99.34ms   0.00ns  99.34ms
                   'fj_long_random':         1 [131.24ms, 131.24ms] 131.24ms   0.00ns 131.24ms         1 [ 97.90ms,  97.90ms]  97.90ms   0.00ns  97.90ms
                 'fj_short_default':         1 [121.10ms, 121.10ms] 121.10ms   0.00ns 121.10ms         1 [ 99.64ms,  99.64ms]  99.64ms   0.00ns  99.64ms
             'fj_short_lin_default':         1 [ 88.44ms,  88.44ms]  88.44ms   0.00ns  88.44ms         1 [ 97.07ms,  97.07ms]  97.07ms   0.00ns  97.07ms
              'fj_short_lin_random':         1 [ 86.68ms,  86.68ms]  86.68ms   0.00ns  86.68ms         1 [ 94.84ms,  94.84ms]  94.84ms   0.00ns  94.84ms
                  'fj_short_random':         1 [ 88.88ms,  88.88ms]  88.88ms   0.00ns  88.88ms         1 [ 97.91ms,  97.91ms]  97.91ms   0.00ns  97.91ms
                        'fs_random':         1 [ 64.87ms,  64.87ms]  64.87ms   0.00ns  64.87ms         1 [195.57us, 195.57us] 195.57us   0.00ns 195.57us
                        'fs_random':         1 [ 66.06ms,  66.06ms]  66.06ms   0.00ns  66.06ms         1 [160.42us, 160.42us] 160.42us   0.00ns 160.42us
                  'fs_random_no_lp':         1 [ 64.74ms,  64.74ms]  64.74ms   0.00ns  64.74ms         1 [451.49us, 451.49us] 451.49us   0.00ns 451.49us
          'fs_random_quick_restart':         1 [ 64.46ms,  64.46ms]  64.46ms   0.00ns  64.46ms         1 [195.57us, 195.57us] 195.57us   0.00ns 195.57us
          'fs_random_quick_restart':         1 [ 64.91ms,  64.91ms]  64.91ms   0.00ns  64.91ms         1 [160.42us, 160.42us] 160.42us   0.00ns 160.42us
    'fs_random_quick_restart_no_lp':         1 [ 64.76ms,  64.76ms]  64.76ms   0.00ns  64.76ms         1 [338.57us, 338.57us] 338.57us   0.00ns 338.57us
                    'graph_arc_lns':        78 [  3.65ms, 635.60ms] 361.41ms 224.20ms   28.19s        71 [ 10.00ns, 102.94ms]  62.57ms  42.26ms    4.44s
                    'graph_cst_lns':        78 [  1.36ms, 663.85ms] 298.26ms 242.08ms   23.26s        64 [ 10.00ns, 100.97ms]  54.92ms  44.56ms    3.51s
                    'graph_dec_lns':        77 [  5.56ms, 663.05ms] 359.37ms 210.11ms   27.67s        73 [ 10.00ns, 113.97ms]  57.84ms  41.37ms    4.22s
                    'graph_var_lns':        78 [  3.41ms, 641.37ms] 343.70ms 214.29ms   26.81s        72 [ 10.00ns, 102.23ms]  60.05ms  42.86ms    4.32s
                   'lb_tree_search':         1 [  23.06s,   23.06s]   23.06s   0.00ns   23.06s         1 [  12.39s,   12.39s]   12.39s   0.00ns   12.39s
                           'max_lp':         1 [  23.06s,   23.06s]   23.06s   0.00ns   23.06s         1 [   9.34s,    9.34s]    9.34s   0.00ns    9.34s
                            'no_lp':         1 [  23.06s,   23.06s]   23.06s   0.00ns   23.06s         1 [   5.86s,    5.86s]    5.86s   0.00ns    5.86s
              'objective_lb_search':         1 [  23.06s,   23.06s]   23.06s   0.00ns   23.06s         1 [   7.15s,    7.15s]    7.15s   0.00ns    7.15s
       'objective_lb_search_max_lp':         1 [  23.06s,   23.06s]   23.06s   0.00ns   23.06s         1 [  10.45s,   10.45s]   10.45s   0.00ns   10.45s
        'objective_lb_search_no_lp':         1 [  23.06s,   23.06s]   23.06s   0.00ns   23.06s         1 [   4.98s,    4.98s]    4.98s   0.00ns    4.98s
  'objective_shaving_search_max_lp':        65 [ 29.72ms,    2.12s] 341.63ms 368.24ms   22.21s        60 [  2.13ms, 580.46ms]  64.53ms 106.63ms    3.87s
   'objective_shaving_search_no_lp':        65 [ 14.31ms,    2.12s] 328.45ms 373.28ms   21.35s        59 [  2.16ms, 436.61ms]  52.25ms  78.98ms    3.08s
                          'probing':         1 [  23.06s,   23.06s]   23.06s   0.00ns   23.06s         1 [   2.49s,    2.49s]    2.49s   0.00ns    2.49s
                   'probing_max_lp':         1 [  23.06s,   23.06s]   23.06s   0.00ns   23.06s         1 [   3.28s,    3.28s]    3.28s   0.00ns    3.28s
                     'pseudo_costs':         1 [  23.06s,   23.06s]   23.06s   0.00ns   23.06s         1 [   9.25s,    9.25s]    9.25s   0.00ns    9.25s
                    'quick_restart':         1 [  23.06s,   23.06s]   23.06s   0.00ns   23.06s         1 [   8.37s,    8.37s]    8.37s   0.00ns    8.37s
              'quick_restart_no_lp':         1 [  23.07s,   23.07s]   23.07s   0.00ns   23.07s         1 [   5.93s,    5.93s]    5.93s   0.00ns    5.93s
                    'reduced_costs':         1 [  23.06s,   23.06s]   23.06s   0.00ns   23.06s         1 [   8.89s,    8.89s]    8.89s   0.00ns    8.89s
                        'rins/rens':        78 [ 81.99us,    1.24s] 346.51ms 232.12ms   27.03s        68 [ 10.00ns, 129.92ms]  73.62ms  37.85ms    5.01s
                      'rnd_cst_lns':        78 [  6.82ms, 695.76ms] 330.45ms 226.64ms   25.78s        74 [ 10.00ns, 102.98ms]  53.83ms  45.76ms    3.98s
                      'rnd_var_lns':        78 [  3.17ms, 603.75ms] 342.81ms 216.84ms   26.74s        71 [ 10.00ns, 102.37ms]  58.57ms  41.94ms    4.16s
         'scheduling_intervals_lns':        77 [264.13ms,    1.52s] 623.04ms 190.35ms   47.97s        76 [ 98.57ms, 102.56ms] 100.57ms 860.12us    7.64s
       'scheduling_precedences_lns':        77 [226.97ms,    1.50s] 600.88ms 152.35ms   46.27s        76 [ 96.54ms, 102.32ms] 100.58ms 969.64us    7.64s
       'scheduling_time_window_lns':        77 [264.30ms,    1.68s] 597.51ms 157.07ms   46.01s        76 [100.01ms, 105.58ms] 100.69ms   1.02ms    7.65s
                     'violation_ls':        78 [ 27.53ms, 111.31ms]  59.52ms  11.68ms    4.64s        78 [ 37.25ms, 124.92ms]  96.33ms  14.00ms    7.51s
                     'violation_ls':        78 [ 54.35ms, 134.26ms]  71.65ms  13.80ms    5.59s        78 [ 86.83ms, 133.67ms] 110.71ms  11.35ms    8.64s

Search stats                        Bools  Conflicts  Branches  Restarts  BoolPropag  IntegerPropag
                           'core':  4'085     20'020    44'791     8'570  29'368'796     12'100'624
                     'default_lp':    621     11'368    47'685     7'401   2'206'094      9'427'997
                          'fixed':  1'036     48'169   138'006       158   6'252'397     12'548'982
                      'fs_random':     79          0       158       158          24          3'192
                      'fs_random':     79          0       158       158          24          3'192
                'fs_random_no_lp':     97          0       195       158          83          4'730
        'fs_random_quick_restart':     79          0       158       158          24          3'192
        'fs_random_quick_restart':     79          0       158       158          24          3'192
  'fs_random_quick_restart_no_lp':     79          0       203       158          28          4'185
                 'lb_tree_search':     89        272    55'667    10'197      83'303      3'606'465
                         'max_lp':     79      6'310    45'049     8'813     219'336      7'489'256
                          'no_lp':    901     23'140    65'549     8'465   5'180'382     16'419'994
            'objective_lb_search':    148      8'058    45'768     9'709     280'285      8'403'961
     'objective_lb_search_max_lp':    143      4'633    51'631    15'789     234'557      7'034'419
      'objective_lb_search_no_lp':    246     22'526    50'820     5'457     564'182     14'978'752
                        'probing':    447        256     1'062       941      12'405         83'568
                 'probing_max_lp':    447        255       683       683      11'225         77'273
                   'pseudo_costs':     79      6'553    54'841    11'847     235'183      8'210'198
                  'quick_restart':    919      6'657    50'466     7'556   2'094'662      6'294'302
            'quick_restart_no_lp':  1'715     22'292    70'981     5'718   7'142'073     12'202'615
                  'reduced_costs':    679      7'351    57'328     9'478   2'245'776      7'747'373

SAT stats                           ClassicMinim  LitRemoved  LitLearned  LitForgotten  Subsumed  MClauses  MDecisions  MLitTrue  MSubsumed  MLitRemoved  MReused
                           'core':        17'792      82'702     125'137             0       140     3'979      19'647         0        225          955       62
                     'default_lp':         8'147      27'835     111'040             0       395     3'671      30'362         1      1'556       10'314      554
                          'fixed':        29'089      65'353     825'289       356'448        12         0           0         0          0            0        0
                      'fs_random':             0           0           0             0         0         0           0         0          0            0        0
                      'fs_random':             0           0           0             0         0         0           0         0          0            0        0
                'fs_random_no_lp':             0           0           0             0         0         0           0         0          0            0        0
        'fs_random_quick_restart':             0           0           0             0         0         0           0         0          0            0        0
        'fs_random_quick_restart':             0           0           0             0         0         0           0         0          0            0        0
  'fs_random_quick_restart_no_lp':             0           0           0             0         0         0           0         0          0            0        0
                 'lb_tree_search':            15          20       1'292             0         1     3'658      19'637         0         58          247      319
                         'max_lp':         3'906       9'468      60'432             0       365     4'313      35'682         0      1'156        7'197      696
                          'no_lp':        19'415      77'103     264'086        71'464       377     3'703      26'762        12      1'561        9'928      450
            'objective_lb_search':         5'992      15'803      63'738             0       343     3'535      30'482         0        730        4'433      752
     'objective_lb_search_max_lp':         3'043       7'242      36'879             0       260     4'604      35'165         0        501        2'975    1'072
      'objective_lb_search_no_lp':        18'223      61'332     173'356        19'757       656     2'864      22'379        24      1'368        8'733      567
                        'probing':             0           0         256             0         0         0           0         0          0            0        0
                 'probing_max_lp':             0           0         255             0         0         0           0         0          0            0        0
                   'pseudo_costs':         4'019       9'772      68'379             0       361     4'675      42'191         0        587        3'555      897
                  'quick_restart':         3'762      10'715      57'903             0       243     3'861      36'743        20      1'607       11'531      906
            'quick_restart_no_lp':        14'547      50'111     249'434             0       249     2'220      22'811         8      1'630       14'920      215
                  'reduced_costs':         4'744      13'862      81'995             0       250     4'246      33'193         0      1'159        7'358      766

Lp stats                         Component  Iterations  AddedCuts  OPTIMAL  DUAL_F.  DUAL_U.
                  'default_lp':          1     105'335      9'511   15'608        0        0
                       'fixed':          1      30'262        736   55'605        0        0
                   'fs_random':          1         131        163        5        0        0
                   'fs_random':          1         135        177        5        0        0
     'fs_random_quick_restart':          1         131        189        5        0        0
     'fs_random_quick_restart':          1         135        168        5        0        0
              'lb_tree_search':          1     313'617      6'259   20'417    6'768        0
                      'max_lp':          1     154'937      8'705    9'479    2'576        6
         'objective_lb_search':          1     128'949      7'112   13'535        0        0
  'objective_lb_search_max_lp':          1     170'391      7'635    8'039    1'934        1
                     'probing':          1      19'636      7'535    3'689        0        0
              'probing_max_lp':          1      10'170      6'564    2'170       58        0
                'pseudo_costs':          1     163'599      9'199   10'778    2'633        3
               'quick_restart':          1     128'253      8'626   12'187        0        0
               'reduced_costs':          1     142'243     12'590   11'156    2'281        3

Lp dimension                                                                     Final dimension of first component
                  'default_lp':  581 rows, 256 columns, 2334 entries with magnitude in [6.195076e-04, 1.000000e+00]
                       'fixed':   142 rows, 256 columns, 470 entries with magnitude in [4.240945e-02, 1.000000e+00]
                   'fs_random':   121 rows, 256 columns, 391 entries with magnitude in [3.405720e-02, 1.000000e+00]
                   'fs_random':   121 rows, 256 columns, 391 entries with magnitude in [3.405720e-02, 1.000000e+00]
     'fs_random_quick_restart':   121 rows, 256 columns, 391 entries with magnitude in [3.405720e-02, 1.000000e+00]
     'fs_random_quick_restart':   121 rows, 256 columns, 391 entries with magnitude in [3.405720e-02, 1.000000e+00]
              'lb_tree_search':  541 rows, 258 columns, 2061 entries with magnitude in [1.761674e-03, 1.000000e+00]
                      'max_lp':  781 rows, 258 columns, 3444 entries with magnitude in [8.171506e-04, 1.000000e+00]
         'objective_lb_search':  525 rows, 256 columns, 2198 entries with magnitude in [1.056136e-03, 1.000000e+00]
  'objective_lb_search_max_lp':  686 rows, 258 columns, 2460 entries with magnitude in [5.046078e-03, 1.000000e+00]
                     'probing':  599 rows, 256 columns, 4752 entries with magnitude in [1.589585e-04, 1.000000e+00]
              'probing_max_lp':  547 rows, 258 columns, 4854 entries with magnitude in [3.354852e-03, 1.000000e+00]
                'pseudo_costs':  978 rows, 258 columns, 4444 entries with magnitude in [1.417345e-03, 1.000000e+00]
               'quick_restart':  702 rows, 256 columns, 3319 entries with magnitude in [2.287491e-04, 1.000000e+00]
               'reduced_costs':  711 rows, 258 columns, 3125 entries with magnitude in [4.240646e-04, 1.000000e+00]

Lp debug                         CutPropag  CutEqPropag  Adjust  Overflow        Bad  BadScaling
                  'default_lp':         36           22  10'198         0    133'963           0
                       'fixed':          0            0   9'775         0        816           0
                   'fs_random':          0            0       0         0         28           0
                   'fs_random':          0            0       0         0         70           0
     'fs_random_quick_restart':          0            0       0         0        113           0
     'fs_random_quick_restart':          0            0       0         0         58           0
              'lb_tree_search':          6            4  16'957         0     49'600           0
                      'max_lp':         22            2   6'296         0     99'971           0
         'objective_lb_search':          8           20   8'806         0    143'663           0
  'objective_lb_search_max_lp':         20           16   5'613         0    107'036           0
                     'probing':         22          255   3'637         0  2'294'571           0
              'probing_max_lp':         70           31   2'196         0  1'787'923           0
                'pseudo_costs':          9            4   6'462         0     92'874           0
               'quick_restart':         69           34   9'254         0    381'414           0
               'reduced_costs':         52           25   7'832         0    142'931           0

Lp pool                          Constraints  Updates  Simplif  Merged  Shortened   Split  Strenghtened      Cuts/Call
                  'default_lp':        9'770    1'193   85'330     131     11'010   7'676        15'048   9'511/23'385
                       'fixed':        1'126        5        0       0          0       8           110      736/1'119
                   'fs_random':          553        0        0       0          0       0            65        163/241
                   'fs_random':          567        0        0       0          0       0            65        177/268
     'fs_random_quick_restart':          558        0        0       0          0       0            65        168/244
     'fs_random_quick_restart':          579        0        0       0          0       0            68        189/301
              'lb_tree_search':       10'019      531   31'370      77      2'071   1'026        37'664   6'259/17'207
                      'max_lp':       12'414      819   62'129     128      1'921   4'176        55'382   8'705/20'047
         'objective_lb_search':        7'452    1'022   29'403      50      4'996   8'896        12'937   7'112/17'326
  'objective_lb_search_max_lp':       11'428      992   69'421      44     10'218   4'229        67'986   7'635/16'963
                     'probing':        7'923    1'680   12'166       2        693  22'030         5'282   7'535/13'980
              'probing_max_lp':       10'389      832   55'449      12      2'562  12'293        40'112   6'564/14'234
                'pseudo_costs':       12'892      723   57'819     144      2'295   3'124        50'718   9'199/21'429
               'quick_restart':        8'989    1'817   93'554      27      8'610  53'133        19'638   8'626/19'875
               'reduced_costs':       13'213      937   79'065     214      6'305   5'971        64'683  12'590/29'046

Lp Cut                                         fs_ran  fs_ran  fs_ran  fs_ran  defaul  fixed  max_lp  quick_  reduce  pseudo  lb_tre  probin  object  probin  object
                                       CG_FF:       6       6       6       6     551     40     321     373     518     320     268     223     346     211     240
                                        CG_K:       6       6       6       6     316     18     181     174     395     196     139     107     188      77     109
                                        CG_R:       4       4       4       4     486     20     211     494     361     180     161     319     307     100     133
                                       CG_RB:       1       1       1       1   1'870     89   1'249   1'162   1'591   1'383     906   1'241   1'229     755   1'067
                                      CG_RBP:       1       1       1       1     276      7     172     112     219      90      90     123     217      82      85
                                      Clique:       -       -       -       -       -      -      42       -      49      36      32       -       -      22      49
                                          IB:      91      90      90      91     942    224     575     801     943     869     622     805     702     246     720
                                    MIR_1_FF:      27      33      27      29     339     49     458     370     582     425     313     335     313     308     362
                                     MIR_1_K:       1       2       1       1      81      6      91      52     155     114      47      34      38      29      60
                                    MIR_1_KL:       -       -       -       -       2      -       2       3       4       -       -       7       -       -       -
                                     MIR_1_R:      13      15      12      13      88     21      62      94      91      68      36      71      80      39      45
                                    MIR_1_RB:       6       6       5       7     750     59     860     667   1'268     940     593     544     603     617     830
                                   MIR_1_RBP:       -       1       -       -      63      3     161      34     198     162     139      26      30      77      97
                                   MIR_1_RLT:       -       -       -       -       -      -      12       -       5       5       5       -       -       4       1
                                    MIR_2_FF:       7       6       3       1     259     17     325     274     462     307     202     228     201     204     246
                                     MIR_2_K:       2       -       -       2      54      4      68      29     103      68      43      20      36      34      42
                                    MIR_2_KL:       -       -       -       -       4      -       -       2       4       2       2       8       2       -       1
                                     MIR_2_R:       3       2       1       -      83      4     150     159     174     126      71     118      97     155     134
                                    MIR_2_RB:       5       8       3       4     494     31     565     568     836     561     406     463     392     393     497
                                   MIR_2_RBP:       -       1       -       -      55      6      93      44     139      96      86      50      36      58      72
                                    MIR_3_FF:       -       3       2       -     189     12     216     175     320     225     141     146     165     113     169
                                     MIR_3_K:       -       1       -       -      50      6      56      42      97      70      41      30      37      21      34
                                    MIR_3_KL:       -       -       -       -       4      -       2       4       3       2       3       4       1       2       -
                                     MIR_3_R:       -       1       -       -      95      6     116     111     128     104      61      91      67      87      93
                                    MIR_3_RB:       2       -       -       1     386     18     370     454     511     353     259     384     282     243     266
                                   MIR_3_RBP:       1       -       -       -      42      1      67      38     104      50      53      49      20      38      47
                                    MIR_4_FF:       1       1       1       1     122      7     125     134     201     129      78      91     113      75     108
                                     MIR_4_K:       -       1       -       -      40      2      43      35      84      42      28      30      33      17      26
                                    MIR_4_KL:       -       -       -       -       3      -       2       4       2       2       4       -       4       -       1
                                     MIR_4_R:       -       -       -       -      67      3      75      83      95      65      34      60      49      57      71
                                    MIR_4_RB:       -       -       -       -     215      9     194     251     334     214     158     230     172     167     193
                                   MIR_4_RBP:       -       -       -       -      34      1      42       8      69      46      33      16      18      25      32
                                    MIR_5_FF:       -       -       -       -      98      1      89      76      93      92      60      55      75      39      64
                                     MIR_5_K:       -       -       -       -      35      1      29      29      41      36      26      25      29       7      27
                                    MIR_5_KL:       -       -       -       -       4      -       1       2       9       1       2       -       1       -       -
                                     MIR_5_R:       -       -       -       -      52      1      47      57      64      48      30      41      46      29      38
                                    MIR_5_RB:       -       -       -       -     148      4     138     168     194     127      95     125     113      80     104
                                   MIR_5_RBP:       -       -       -       -      20      2      22      14      55      33      21       7      19       9      25
                                    MIR_6_FF:       -       -       -       -      34      2      39      46      62      46      29      28      25      16      32
                                     MIR_6_K:       -       -       -       -      17      1      21      10      33      24       8       5      11       4      15
                                    MIR_6_KL:       -       -       -       -       -      -       3       -       3       1       1       2       2       2       1
                                     MIR_6_R:       -       -       -       -      30      3      22      29      48      42      19      27      24      10      21
                                    MIR_6_RB:       -       -       -       -      87      3      48      90     121      82      50      62      73      43      56
                                   MIR_6_RBP:       -       -       -       -       9      -      15       6      22      18      10      11      15       4      16
  NoOverlapCompletionTimeExhaustive_weighted:       -       -       -       -       -      -      13       -      20      10       8       -       -       5       8
                 NoOverlapDisjunctionOnStart:       -       -       -       -       -      -      13       -      13      11       6       -       -       6       9
                                ZERO_HALF_FF:       -       -       -       -     103      8     115      64     134     108      83      54      65      51      89
                                 ZERO_HALF_K:       -       -       -       -      21      1      30      15      63      32      29      12      13      21      26
                                 ZERO_HALF_R:       -       -       -       -     582     21     837     967   1'131     865     507     961     597   1'741     957
                                ZERO_HALF_RB:       -       -       -       -     261     16     256     246     358     305     175     207     197     195     259
                               ZERO_HALF_RBP:       -       -       -       -      50      9      61      56      81      68      46      60      29      46      58

LNS stats                        Improv/Calls  Closed  Difficulty  TimeLimit
               'graph_arc_lns':          7/78     56%        0.98       0.10
               'graph_cst_lns':          7/69     57%        0.98       0.10
               'graph_dec_lns':          2/77     61%        0.99       0.10
               'graph_var_lns':          5/77     56%        0.98       0.10
                   'rins/rens':          7/75     49%        0.77       0.10
                 'rnd_cst_lns':          5/78     56%        0.98       0.10
                 'rnd_var_lns':          6/78     59%        0.99       0.10
    'scheduling_intervals_lns':          5/77      0%        0.00       0.10
  'scheduling_precedences_lns':          4/77      0%        0.00       0.10
  'scheduling_time_window_lns':          4/77      0%        0.00       0.10

LS stats                   Batches  Restarts  LinMoves  GenMoves  CompoundMoves  WeightUpdates
       'fj_long_default':        1         1     6'666         0              0            195
   'fj_long_lin_default':        1         1         0     2'069            289              0
        'fj_long_random':        1         1     9'701         0              0            299
      'fj_short_default':        1         1         0     2'173            294              0
  'fj_short_lin_default':        1         1         0     2'226            257              0
   'fj_short_lin_random':        1         1         0     2'167            227              0
       'fj_short_random':        1         1         0     2'252            364              1
          'violation_ls':       78         0    24'591   278'655         24'351         15'818
          'violation_ls':       78         0     9'587   349'406         13'976          1'407

Solutions (27)            Num    Rank
                'no_lp':   25  [2,27]
  'quick_restart_no_lp':    2   [1,7]

Objective bounds                     Num
                           'fixed':    1
                  'initial_domain':    1
             'objective_lb_search':    6
      'objective_lb_search_max_lp':    2
       'objective_lb_search_no_lp':   82
  'objective_shaving_search_no_lp':    1
                         'probing':    1

Solution repositories    Added  Queried  Ignored  Synchro
  'feasible solutions':    697    1'773        4      641
        'lp solutions':    321       37        0      240
                'pump':  1'608       41

Improving bounds shared          Num
                  'default_lp':  402
              'lb_tree_search':    5
                      'max_lp':   76
                       'no_lp':   21
         'objective_lb_search':   18
  'objective_lb_search_max_lp':   42
   'objective_lb_search_no_lp':   29
                     'probing':  607
              'probing_max_lp':  248
                'pseudo_costs':   46
               'quick_restart':  638
         'quick_restart_no_lp':  982
               'reduced_costs':   94

Clauses shared                   Num
                        'core':    1
                  'default_lp':   18
              'lb_tree_search':    2
                      'max_lp':   18
                       'no_lp':   17
         'objective_lb_search':    3
  'objective_lb_search_max_lp':   26
   'objective_lb_search_no_lp':    4
                'pseudo_costs':   17
         'quick_restart_no_lp':    5
               'reduced_costs':    3

CpSolverResponse summary:
status: OPTIMAL
objective: 853
best_bound: 853
integers: 257
booleans: 79
conflicts: 0
branches: 158
propagations: 24
integer_propagations: 3192
restarts: 158
lp_iterations: 135
walltime: 23.3756
usertime: 23.3756
deterministic_time: 215.571
gap_integral: 470.512
solution_fingerprint: 0x97e7e025aca9809a


--- Simulation Gantt  partir du modle mathmatique ---
