created virtual environment CPython3.12.4.final.0-64 in 16902ms
  creator CPython3Posix(dest=/localscratch/aneumann.63393218.0/env, clear=False, no_vcs_ignore=False, global=False)
  seeder FromAppData(download=False, pip=bundle, via=copy, app_data_dir=/home/aneumann/.local/share/virtualenv)
    added seed packages: pip==25.1.1
  activators BashActivator,CShellActivator,FishActivator,NushellActivator,PowerShellActivator,PythonActivator
Looking in links: /cvmfs/soft.computecanada.ca/custom/python/wheelhouse/gentoo2023/x86-64-v3, /cvmfs/soft.computecanada.ca/custom/python/wheelhouse/gentoo2023/generic, /cvmfs/soft.computecanada.ca/custom/python/wheelhouse/generic
Requirement already satisfied: pip in /localscratch/aneumann.63393218.0/env/lib/python3.12/site-packages (25.1.1)
Looking in links: /cvmfs/soft.computecanada.ca/custom/python/wheelhouse/gentoo2023/x86-64-v3, /cvmfs/soft.computecanada.ca/custom/python/wheelhouse/gentoo2023/generic, /cvmfs/soft.computecanada.ca/custom/python/wheelhouse/generic
ERROR: protobuf-5.28.3-cp38-abi3-manylinux2014_x86_64.whl is not a supported wheel on this platform.
Looking in links: /cvmfs/soft.computecanada.ca/custom/python/wheelhouse/gentoo2023/x86-64-v3, /cvmfs/soft.computecanada.ca/custom/python/wheelhouse/gentoo2023/generic, /cvmfs/soft.computecanada.ca/custom/python/wheelhouse/generic
Processing /home/aneumann/projects/def-adhaj/aneumann/GNRS/wheels/immutabledict-4.2.0-py3-none-any.whl
Installing collected packages: immutabledict
Successfully installed immutabledict-4.2.0
Looking in links: /cvmfs/soft.computecanada.ca/custom/python/wheelhouse/gentoo2023/x86-64-v3, /cvmfs/soft.computecanada.ca/custom/python/wheelhouse/gentoo2023/generic, /cvmfs/soft.computecanada.ca/custom/python/wheelhouse/generic
Processing /cvmfs/soft.computecanada.ca/custom/python/wheelhouse/generic/ortools-9.10.4067+computecanada-cp312-cp312-linux_x86_64.whl (from -r /home/aneumann/projects/def-adhaj/aneumann/GNRS/requirements/or.txt (line 1))
Processing /cvmfs/soft.computecanada.ca/custom/python/wheelhouse/gentoo2023/x86-64-v3/matplotlib-3.10.0+computecanada-cp312-cp312-linux_x86_64.whl (from -r /home/aneumann/projects/def-adhaj/aneumann/GNRS/requirements/or.txt (line 2))
Processing /cvmfs/soft.computecanada.ca/custom/python/wheelhouse/gentoo2023/x86-64-v3/pandas-2.2.3+computecanada-cp312-cp312-linux_x86_64.whl (from -r /home/aneumann/projects/def-adhaj/aneumann/GNRS/requirements/or.txt (line 3))
Processing /cvmfs/soft.computecanada.ca/custom/python/wheelhouse/generic/absl_py-2.2.2+computecanada-py3-none-any.whl (from ortools<9.11,>=9.10->-r /home/aneumann/projects/def-adhaj/aneumann/GNRS/requirements/or.txt (line 1))
Processing /cvmfs/soft.computecanada.ca/custom/python/wheelhouse/gentoo2023/generic/numpy-2.2.2+computecanada-cp312-cp312-linux_x86_64.whl (from ortools<9.11,>=9.10->-r /home/aneumann/projects/def-adhaj/aneumann/GNRS/requirements/or.txt (line 1))
Processing /cvmfs/soft.computecanada.ca/custom/python/wheelhouse/gentoo2023/x86-64-v3/protobuf-6.30.2+computecanada-cp312-cp312-linux_x86_64.whl (from ortools<9.11,>=9.10->-r /home/aneumann/projects/def-adhaj/aneumann/GNRS/requirements/or.txt (line 1))
Requirement already satisfied: immutabledict>=3.0.0 in /localscratch/aneumann.63393218.0/env/lib/python3.12/site-packages (from ortools<9.11,>=9.10->-r /home/aneumann/projects/def-adhaj/aneumann/GNRS/requirements/or.txt (line 1)) (4.2.0)
Processing /cvmfs/soft.computecanada.ca/custom/python/wheelhouse/gentoo2023/generic/contourpy-1.3.1+computecanada-cp312-cp312-linux_x86_64.whl (from matplotlib->-r /home/aneumann/projects/def-adhaj/aneumann/GNRS/requirements/or.txt (line 2))
Processing /cvmfs/soft.computecanada.ca/custom/python/wheelhouse/generic/cycler-0.12.1+computecanada-py3-none-any.whl (from matplotlib->-r /home/aneumann/projects/def-adhaj/aneumann/GNRS/requirements/or.txt (line 2))
Processing /cvmfs/soft.computecanada.ca/custom/python/wheelhouse/generic/fonttools-4.58.2+computecanada-cp312-cp312-linux_x86_64.whl (from matplotlib->-r /home/aneumann/projects/def-adhaj/aneumann/GNRS/requirements/or.txt (line 2))
Processing /cvmfs/soft.computecanada.ca/custom/python/wheelhouse/gentoo2023/x86-64-v3/kiwisolver-1.4.8+computecanada-cp312-cp312-linux_x86_64.whl (from matplotlib->-r /home/aneumann/projects/def-adhaj/aneumann/GNRS/requirements/or.txt (line 2))
Processing /cvmfs/soft.computecanada.ca/custom/python/wheelhouse/generic/packaging-25.0+computecanada-py3-none-any.whl (from matplotlib->-r /home/aneumann/projects/def-adhaj/aneumann/GNRS/requirements/or.txt (line 2))
Processing /cvmfs/soft.computecanada.ca/custom/python/wheelhouse/gentoo2023/x86-64-v3/pillow-11.1.0+computecanada-cp312-cp312-linux_x86_64.whl (from matplotlib->-r /home/aneumann/projects/def-adhaj/aneumann/GNRS/requirements/or.txt (line 2))
Processing /cvmfs/soft.computecanada.ca/custom/python/wheelhouse/generic/pyparsing-3.2.1+computecanada-py3-none-any.whl (from matplotlib->-r /home/aneumann/projects/def-adhaj/aneumann/GNRS/requirements/or.txt (line 2))
Processing /cvmfs/soft.computecanada.ca/custom/python/wheelhouse/generic/python_dateutil-2.9.0.post0+computecanada-py2.py3-none-any.whl (from matplotlib->-r /home/aneumann/projects/def-adhaj/aneumann/GNRS/requirements/or.txt (line 2))
Processing /cvmfs/soft.computecanada.ca/custom/python/wheelhouse/generic/pytz-2025.2+computecanada-py2.py3-none-any.whl (from pandas->-r /home/aneumann/projects/def-adhaj/aneumann/GNRS/requirements/or.txt (line 3))
Processing /cvmfs/soft.computecanada.ca/custom/python/wheelhouse/generic/tzdata-2025.2+computecanada-py2.py3-none-any.whl (from pandas->-r /home/aneumann/projects/def-adhaj/aneumann/GNRS/requirements/or.txt (line 3))
Processing /cvmfs/soft.computecanada.ca/custom/python/wheelhouse/generic/six-1.17.0+computecanada-py2.py3-none-any.whl (from python-dateutil>=2.7->matplotlib->-r /home/aneumann/projects/def-adhaj/aneumann/GNRS/requirements/or.txt (line 2))
Installing collected packages: pytz, tzdata, six, pyparsing, protobuf, pillow, packaging, numpy, kiwisolver, fonttools, cycler, absl-py, python-dateutil, contourpy, pandas, matplotlib, ortools

Successfully installed absl-py-2.2.2+computecanada contourpy-1.3.1+computecanada cycler-0.12.1+computecanada fonttools-4.58.2+computecanada kiwisolver-1.4.8+computecanada matplotlib-3.10.0+computecanada numpy-2.2.2+computecanada ortools-9.10.4067+computecanada packaging-25.0+computecanada pandas-2.2.3+computecanada pillow-11.1.0+computecanada protobuf-6.30.2+computecanada pyparsing-3.2.1+computecanada python-dateutil-2.9.0.post0+computecanada pytz-2025.2+computecanada six-1.17.0+computecanada tzdata-2025.2+computecanada

Starting CP-SAT solver v9.10.4067
Parameters: max_time_in_seconds: 3600 max_memory_in_mb: 12000 log_search_progress: true enumerate_all_solutions: false absolute_gap_limit: 0 relative_gap_limit: 0
Setting number of workers to 48

Initial optimization model '': (model_fingerprint: 0x20d61c4deaffd29e)
#Variables: 370 (#ints: 9 in objective)
  - 269 Booleans in [0,1]
  - 101 in [0,688]
#kLinear1: 47
#kLinear2: 676
#kLinear3: 202
#kLinearN: 3'786 (#terms: 56'353)

Starting presolve at 0.00s
  3.16e-03s  0.00e+00d  [DetectDominanceRelations] 
  6.74e-02s  0.00e+00d  [PresolveToFixPoint] #num_loops=6 #num_dual_strengthening=3 
  4.85e-05s  0.00e+00d  [ExtractEncodingFromLinear] #potential_supersets=5 
[Symmetry] Graph for symmetry has 4'651 nodes and 45'174 arcs.
[Symmetry] Symmetry computation done. time: 0.00396978 dtime: 0.00438053
[Symmetry] #generators: 1, average support size: 26
[Symmetry] The model contains 408 duplicate constraints !
[Symmetry] 13 orbits with sizes: 2,2,2,2,2,2,2,2,2,2,...
[Symmetry] Num fixable by intersecting at_most_one with orbits: 1 largest_orbit: 2
  1.86e-02s  2.65e-03d  [Probe] #probed=404 #fixed_bools=5 #new_bounds=17 #equiv=1 
  9.25e-05s  0.00e+00d  [MaxClique] Merged 22(44 literals) into 9(18 literals) at_most_ones. 
  3.14e-03s  0.00e+00d  [DetectDominanceRelations] 
  3.33e-02s  0.00e+00d  [PresolveToFixPoint] #num_loops=4 #num_dual_strengthening=3 
  1.12e-02s  0.00e+00d  [ProcessAtMostOneAndLinear] 
  4.59e-03s  0.00e+00d  [DetectDuplicateConstraints] #duplicates=483 #without_enforcements=191 
  3.80e-03s  1.69e-04d  [DetectDominatedLinearConstraints] #relevant_constraints=3'147 #num_inclusions=2'094 #num_redundant=3 
  5.72e-04s  0.00e+00d  [DetectDifferentVariables] #different=46 
  1.03e-03s  6.08e-05d  [ProcessSetPPC] #relevant_constraints=2'625 
  3.89e-05s  0.00e+00d  [FindAlmostIdenticalLinearConstraints] 
  4.48e-04s  3.85e-04d  [FindBigAtMostOneAndLinearOverlap] 
  1.45e-02s  4.14e-03d  [FindBigVerticalLinearOverlap] #blocks=65 #saved_nz=8'190 
  5.88e-04s  1.36e-04d  [FindBigHorizontalLinearOverlap] #linears=2'569 
  3.53e-05s  0.00e+00d  [MergeClauses] 
  3.26e-03s  0.00e+00d  [DetectDominanceRelations] 
  3.97e-02s  0.00e+00d  [PresolveToFixPoint] #num_loops=2 #num_dual_strengthening=1 
  3.26e-03s  0.00e+00d  [DetectDominanceRelations] 
  2.28e-02s  0.00e+00d  [PresolveToFixPoint] #num_loops=1 #num_dual_strengthening=1 
[Symmetry] Graph for symmetry has 4'329 nodes and 35'232 arcs.
[Symmetry] Symmetry computation done. time: 0.00132262 dtime: 0.00197553
  1.70e-02s  2.34e-03d  [Probe] #probed=394 #new_bounds=66 
  4.03e-05s  0.00e+00d  [MaxClique] 
  3.24e-03s  0.00e+00d  [DetectDominanceRelations] 
  3.99e-02s  0.00e+00d  [PresolveToFixPoint] #num_loops=2 #num_dual_strengthening=1 
  9.98e-03s  0.00e+00d  [ProcessAtMostOneAndLinear] 
  3.92e-03s  0.00e+00d  [DetectDuplicateConstraints] #without_enforcements=227 
  2.32e-03s  9.86e-05d  [DetectDominatedLinearConstraints] #relevant_constraints=2'797 #num_inclusions=299 
  5.77e-04s  0.00e+00d  [DetectDifferentVariables] #different=55 #cliques=3 #size=9 
  9.27e-04s  4.26e-05d  [ProcessSetPPC] #relevant_constraints=2'457 
  5.89e-05s  1.35e-07d  [FindAlmostIdenticalLinearConstraints] #num_tested_pairs=9 
  2.70e-04s  1.77e-04d  [FindBigAtMostOneAndLinearOverlap] 
  8.15e-03s  2.64e-03d  [FindBigVerticalLinearOverlap] #blocks=64 #saved_nz=5'252 
  4.67e-04s  9.95e-05d  [FindBigHorizontalLinearOverlap] #linears=2'193 
  2.91e-05s  0.00e+00d  [MergeClauses] 
  2.87e-03s  0.00e+00d  [DetectDominanceRelations] 
  3.96e-02s  0.00e+00d  [PresolveToFixPoint] #num_loops=3 #num_dual_strengthening=1 
  2.88e-03s  0.00e+00d  [DetectDominanceRelations] 
  2.58e-02s  0.00e+00d  [PresolveToFixPoint] #num_loops=1 #num_dual_strengthening=1 
  1.63e-02s  2.13e-03d  [Probe] #probed=394 #new_bounds=46 
  4.43e-05s  0.00e+00d  [MaxClique] 
  2.85e-03s  0.00e+00d  [DetectDominanceRelations] 
  3.51e-02s  0.00e+00d  [PresolveToFixPoint] #num_loops=2 #num_dual_strengthening=1 
  9.17e-03s  0.00e+00d  [ProcessAtMostOneAndLinear] 
  3.79e-03s  0.00e+00d  [DetectDuplicateConstraints] #without_enforcements=227 
  1.90e-03s  7.66e-05d  [DetectDominatedLinearConstraints] #relevant_constraints=2'796 #num_inclusions=23 
  4.03e-04s  0.00e+00d  [DetectDifferentVariables] 
  7.61e-04s  3.10e-05d  [ProcessSetPPC] #relevant_constraints=2'197 
  7.51e-05s  9.15e-07d  [FindAlmostIdenticalLinearConstraints] #num_tested_pairs=36 
  2.11e-04s  1.24e-04d  [FindBigAtMostOneAndLinearOverlap] 
  6.51e-03s  1.99e-03d  [FindBigVerticalLinearOverlap] #blocks=43 #saved_nz=3'253 
  4.06e-04s  7.75e-05d  [FindBigHorizontalLinearOverlap] #linears=1'928 
  2.90e-05s  0.00e+00d  [MergeClauses] 
  2.60e-03s  0.00e+00d  [DetectDominanceRelations] 
  3.38e-02s  0.00e+00d  [PresolveToFixPoint] #num_loops=2 #num_dual_strengthening=1 
  1.56e-04s  0.00e+00d  [ExpandObjective] #entries=749 #tight_variables=226 #tight_constraints=134 

Presolve summary:
  - 85 affine relations were detected.
  - rule 'TODO dual: only one blocking constraint?' was applied 784 times.
  - rule 'TODO dual: only one unspecified blocking constraint?' was applied 117 times.
  - rule 'TODO duplicate: identical constraint with different enforcements' was applied 645 times.
  - rule 'TODO no_overlap: with task always last' was applied 3 times.
  - rule 'affine: new relation' was applied 85 times.
  - rule 'all_diff: inferred from x != y constraints' was applied 3 times.
  - rule 'at_most_one: removed literals' was applied 9 times.
  - rule 'at_most_one: size one' was applied 9 times.
  - rule 'at_most_one: transformed into max clique.' was applied 1 time.
  - rule 'deductions: 344 stored' was applied 1 time.
  - rule 'dual: fix variable' was applied 24 times.
  - rule 'dual: reduced domain' was applied 47 times.
  - rule 'duplicate: merged rhs of linear constraint' was applied 81 times.
  - rule 'duplicate: removed constraint' was applied 483 times.
  - rule 'enforcement: false literal' was applied 29 times.
  - rule 'enforcement: true literal' was applied 22 times.
  - rule 'exactly_one: x and not(x)' was applied 1 time.
  - rule 'incompatible linear: add implication' was applied 63 times.
  - rule 'linear inclusion: redundant containing constraint' was applied 3 times.
  - rule 'linear matrix: common vertical rectangle' was applied 172 times.
  - rule 'linear: always true' was applied 646 times.
  - rule 'linear: doubleton free' was applied 13 times.
  - rule 'linear: empty' was applied 32 times.
  - rule 'linear: extracted enforcement literal' was applied 7'015 times.
  - rule 'linear: fixed or dup variables' was applied 3'904 times.
  - rule 'linear: positive equal one' was applied 5 times.
  - rule 'linear: reduced variable domains' was applied 299 times.
  - rule 'linear: remapped using affine relations' was applied 3'792 times.
  - rule 'linear: simplified rhs' was applied 14'347 times.
  - rule 'linear: variable substitution 1' was applied 13 times.
  - rule 'linear: variable substitution 2' was applied 5 times.
  - rule 'linear: variable substitution 3' was applied 4 times.
  - rule 'presolve: 98 unused variables removed.' was applied 1 time.
  - rule 'presolve: iteration' was applied 3 times.
  - rule 'probing: reduced enforced constraint to implication.' was applied 22 times.
  - rule 'symmetry: fixed to false in general orbit' was applied 1 time.

Presolved optimization model '': (model_fingerprint: 0xe5a397f785e66879)
#Variables: 337 (#ints: 9 in objective)
  - 99 Booleans in [0,1]
  - 188 different domains in [-7492,6706] with a largest complexity of 13.
#kAllDiff: 3
#kExactlyOne: 4 (#literals: 12)
#kLinear2: 820 (#enforced: 744 #multi: 585)
#kLinear3: 430 (#enforced: 330)
#kLinearN: 2'307 (#enforced: 2'097) (#terms: 17'031)

Preloading model.
#Bound   0.50s best:inf   next:[198,5329] initial_domain
#Model   0.51s var:337/337 constraints:3564/3564

Starting search at 0.51s with 48 workers.
16 full problem subsolvers: [core, default_lp, lb_tree_search, max_lp, no_lp, objective_lb_search, objective_lb_search_max_lp, objective_lb_search_no_lp, objective_shaving_search_max_lp, objective_shaving_search_no_lp, probing, probing_max_lp, pseudo_costs, quick_restart, quick_restart_no_lp, reduced_costs]
30 first solution subsolvers: [fj_long_default(2), fj_long_lin_default, fj_long_lin_perturb, fj_long_lin_random, fj_long_perturb, fj_long_random, fj_short_default(2), fj_short_lin_default(2), fj_short_lin_perturb, fj_short_lin_random, fj_short_perturb, fj_short_random, fs_random(4), fs_random_no_lp(4), fs_random_quick_restart(4), fs_random_quick_restart_no_lp(3)]
13 incomplete subsolvers: [feasibility_pump, graph_arc_lns, graph_cst_lns, graph_dec_lns, graph_var_lns, rins/rens, rnd_cst_lns, rnd_var_lns, violation_ls(5)]
3 helper subsolvers: [neighborhood_helper, synchronization_agent, update_gap_integral]
#Bound   0.59s best:inf   next:[239,5329] objective_lb_search_no_lp
#1       0.60s best:2010  next:[239,2009] no_lp (fixed_bools=0/132)
#Bound   0.60s best:2010  next:[240,2009] objective_lb_search_no_lp
#Bound   0.60s best:2010  next:[277,2009] objective_lb_search_no_lp
#Bound   0.61s best:2010  next:[278,2009] objective_lb_search_no_lp
#2       0.62s best:1963  next:[278,1962] no_lp (fixed_bools=0/147)
#3       0.64s best:1959  next:[278,1958] no_lp (fixed_bools=0/151)
#4       0.66s best:1951  next:[278,1950] no_lp (fixed_bools=0/155)
#5       0.67s best:1887  next:[278,1886] no_lp (fixed_bools=0/160)
#6       0.68s best:1869  next:[278,1868] no_lp (fixed_bools=0/171)
#Bound   0.69s best:1869  next:[292,1868] objective_lb_search_no_lp
#Bound   0.69s best:1869  next:[315,1868] objective_lb_search_no_lp
#Bound   0.70s best:1869  next:[316,1868] objective_lb_search_no_lp
#7       0.70s best:1865  next:[316,1864] no_lp (fixed_bools=0/174)
#Bound   0.71s best:1865  next:[322,1864] objective_lb_search_no_lp
#Bound   0.72s best:1865  next:[326,1864] objective_lb_search_no_lp
#8       0.74s best:1853  next:[326,1852] no_lp (fixed_bools=0/178)
#9       0.76s best:1782  next:[326,1781] no_lp (fixed_bools=0/187)
#10      0.78s best:1755  next:[326,1754] no_lp (fixed_bools=0/189)
#11      0.79s best:1736  next:[326,1735] no_lp (fixed_bools=0/191)
#12      0.81s best:1735  next:[326,1734] no_lp (fixed_bools=0/194)
#Bound   0.82s best:1735  next:[500,1734] objective_lb_search_no_lp
#13      0.88s best:1660  next:[500,1659] no_lp (fixed_bools=0/206)
#Bound   0.89s best:1660  next:[556,1659] objective_lb_search_no_lp
#14      0.91s best:1495  next:[556,1494] no_lp (fixed_bools=0/223)
#15      0.94s best:1444  next:[556,1443] no_lp (fixed_bools=0/241)
#16      0.97s best:1397  next:[556,1396] no_lp (fixed_bools=0/254)
#17      1.03s best:1391  next:[556,1390] quick_restart_no_lp (fixed_bools=1/168)
#18      1.04s best:1389  next:[556,1388] violation_ls(batch:5 #solutions_imported:5 #lin_moves:24'326 #lin_evals:107'627 #gen_moves:6'195 #gen_evals:1'887 #comp_moves:264 #backtracks:2'963 #weight_updates:5'765)
#19      1.04s best:1387  next:[556,1386] violation_ls(batch:8 #solutions_imported:7 #lin_moves:22'166 #lin_evals:125'602 #gen_moves:14'283 #gen_evals:3'920 #comp_moves:742 #backtracks:6'767 #weight_updates:15'353)
#20      1.04s best:1385  next:[556,1384] violation_ls(batch:9 #solutions_imported:8 #lin_moves:22'167 #lin_evals:125'611 #gen_moves:14'283 #gen_evals:3'920 #comp_moves:742 #backtracks:6'767 #weight_updates:15'353)
#21      1.04s best:1383  next:[556,1382] violation_ls(batch:10 #solutions_imported:9 #lin_moves:22'168 #lin_evals:125'620 #gen_moves:14'283 #gen_evals:3'920 #comp_moves:742 #backtracks:6'767 #weight_updates:15'353)
#22      1.04s best:1381  next:[556,1380] violation_ls(batch:6 #solutions_imported:6 #lin_moves:24'327 #lin_evals:107'636 #gen_moves:6'195 #gen_evals:1'887 #comp_moves:264 #backtracks:2'963 #weight_updates:5'765)
#23      1.04s best:1379  next:[556,1378] violation_ls(batch:11 #solutions_imported:10 #lin_moves:22'169 #lin_evals:125'628 #gen_moves:14'283 #gen_evals:3'920 #comp_moves:742 #backtracks:6'767 #weight_updates:15'353)
#24      1.04s best:1377  next:[556,1376] violation_ls(batch:7 #solutions_imported:7 #lin_moves:24'327 #lin_evals:107'640 #gen_moves:6'196 #gen_evals:1'887 #comp_moves:265 #backtracks:2'963 #weight_updates:5'765)
#25      1.04s best:1375  next:[556,1374] violation_ls(batch:8 #solutions_imported:8 #lin_moves:24'328 #lin_evals:107'649 #gen_moves:6'196 #gen_evals:1'887 #comp_moves:265 #backtracks:2'963 #weight_updates:5'765)
#26      1.04s best:1374  next:[556,1373] violation_ls(batch:13 #solutions_imported:12 #lin_moves:22'170 #lin_evals:125'641 #gen_moves:14'284 #gen_evals:3'920 #comp_moves:743 #backtracks:6'767 #weight_updates:15'353)
#27      1.06s best:1305  next:[556,1304] no_lp (fixed_bools=0/269)
#28      1.20s best:1300  next:[556,1299] quick_restart_no_lp (fixed_bools=3/203)
#29      1.21s best:1284  next:[556,1283] no_lp (fixed_bools=0/278)
#30      1.22s best:1252  next:[556,1251] no_lp (fixed_bools=0/279)
#31      1.26s best:1239  next:[556,1238] no_lp (fixed_bools=0/290)
#32      1.28s best:1238  next:[556,1237] violation_ls(batch:13 #solutions_imported:9 #lin_moves:55'658 #lin_evals:279'864 #gen_moves:11'281 #gen_evals:2'933 #comp_moves:1'190 #backtracks:5'045 #weight_updates:44'465)
#33      1.29s best:1237  next:[556,1236] violation_ls(batch:8 #solutions_imported:8 #lin_moves:29'498 #lin_evals:160'816 #gen_moves:19'535 #gen_evals:4'978 #comp_moves:1'326 #backtracks:9'096 #weight_updates:10'772)
#34      1.29s best:1235  next:[556,1234] violation_ls(batch:14 #solutions_imported:10 #lin_moves:55'659 #lin_evals:279'872 #gen_moves:11'281 #gen_evals:2'933 #comp_moves:1'190 #backtracks:5'045 #weight_updates:44'465)
#35      1.29s best:1234  next:[556,1233] violation_ls(batch:9 #solutions_imported:9 #lin_moves:29'498 #lin_evals:160'820 #gen_moves:19'536 #gen_evals:4'978 #comp_moves:1'327 #backtracks:9'096 #weight_updates:10'772)
#36      1.29s best:1233  next:[556,1232] violation_ls(batch:16 #solutions_imported:12 #lin_moves:55'659 #lin_evals:279'878 #gen_moves:11'283 #gen_evals:2'933 #comp_moves:1'192 #backtracks:5'045 #weight_updates:44'465)
#37      1.29s best:1232  next:[556,1231] violation_ls(batch:17 #solutions_imported:13 #lin_moves:55'659 #lin_evals:279'890 #gen_moves:11'290 #gen_evals:2'935 #comp_moves:1'193 #backtracks:5'048 #weight_updates:44'465)
#38      1.29s best:1230  next:[556,1229] violation_ls(batch:18 #solutions_imported:14 #lin_moves:55'660 #lin_evals:279'899 #gen_moves:11'290 #gen_evals:2'935 #comp_moves:1'193 #backtracks:5'048 #weight_updates:44'465)
#39      1.29s best:1229  next:[556,1228] violation_ls(batch:11 #solutions_imported:11 #lin_moves:29'499 #lin_evals:160'853 #gen_moves:19'549 #gen_evals:4'978 #comp_moves:1'328 #backtracks:9'102 #weight_updates:10'772)
#40      1.29s best:1228  next:[556,1227] violation_ls(batch:19 #solutions_imported:15 #lin_moves:55'660 #lin_evals:279'915 #gen_moves:11'297 #gen_evals:2'935 #comp_moves:1'194 #backtracks:5'051 #weight_updates:44'465)
#41      1.29s best:1227  next:[556,1226] violation_ls(batch:12 #solutions_imported:12 #lin_moves:29'500 #lin_evals:160'860 #gen_moves:19'549 #gen_evals:4'978 #comp_moves:1'328 #backtracks:9'102 #weight_updates:10'772)
#42      1.29s best:1226  next:[556,1225] violation_ls(batch:13 #solutions_imported:13 #lin_moves:29'501 #lin_evals:160'869 #gen_moves:19'549 #gen_evals:4'978 #comp_moves:1'328 #backtracks:9'102 #weight_updates:10'772)
#43      1.30s best:1224  next:[556,1223] violation_ls(batch:14 #solutions_imported:14 #lin_moves:29'502 #lin_evals:160'878 #gen_moves:19'549 #gen_evals:4'978 #comp_moves:1'328 #backtracks:9'102 #weight_updates:10'772)
#44      1.30s best:1222  next:[556,1221] violation_ls(batch:15 #solutions_imported:15 #lin_moves:29'502 #lin_evals:160'909 #gen_moves:19'568 #gen_evals:4'980 #comp_moves:1'329 #backtracks:9'111 #weight_updates:10'772)
#45      1.30s best:1221  next:[556,1220] violation_ls(batch:16 #solutions_imported:16 #lin_moves:29'502 #lin_evals:160'913 #gen_moves:19'569 #gen_evals:4'980 #comp_moves:1'330 #backtracks:9'111 #weight_updates:10'772)
#46      1.30s best:1220  next:[556,1219] violation_ls(batch:17 #solutions_imported:17 #lin_moves:29'502 #lin_evals:160'917 #gen_moves:19'570 #gen_evals:4'980 #comp_moves:1'331 #backtracks:9'111 #weight_updates:10'772)
#47      1.32s best:1206  next:[556,1205] rins_pump_lns (d=0.50 s=241 t=0.10 p=0.00 stall=0 h=auto_l0) [presolve]
#Bound   1.32s best:1206  next:[559,1205] objective_lb_search_no_lp
#Bound   1.61s best:1206  next:[569,1205] objective_lb_search_no_lp
#48      2.25s best:1191  next:[569,1190] rins_pump_lns (d=0.81 s=246 t=0.10 p=1.00 stall=0 h=auto_l0)
#49      2.37s best:1181  next:[569,1180] rins_pump_lns (d=0.81 s=254 t=0.10 p=1.00 stall=0 h=auto_l0)
#Bound   2.47s best:1181  next:[570,1180] objective_shaving_search_no_lp (vars=374 csts=3459)
#50      2.51s best:1178  next:[570,1177] quick_restart_no_lp (fixed_bools=5/255)
#51      2.51s best:1176  next:[570,1175] violation_ls(batch:21 #solutions_imported:11 #lin_moves:133'110 #lin_evals:581'500 #gen_moves:19'965 #gen_evals:4'997 #comp_moves:2'339 #backtracks:8'812 #weight_updates:37'125)
#52      2.54s best:1175  next:[570,1174] quick_restart_no_lp (fixed_bools=5/260)
#Bound   2.60s best:1175  next:[600,1174] objective_lb_search
#53      3.10s best:1173  next:[600,1172] graph_dec_lns (d=0.99 s=316 t=0.10 p=0.88 stall=1 h=auto_l0)
#Bound   3.28s best:1173  next:[605,1172] objective_lb_search
#54      3.41s best:1119  next:[605,1118] rins_lp_lns (d=0.88 s=284 t=0.10 p=1.00 stall=1 h=auto_l0)
#Bound   3.71s best:1119  next:[607,1118] objective_lb_search_no_lp
#Bound   4.13s best:1119  next:[608,1118] objective_lb_search_no_lp
#Bound   4.13s best:1119  next:[627,1118] objective_lb_search_max_lp
#Bound   4.68s best:1119  next:[642,1118] objective_lb_search_no_lp
#55      4.74s best:1114  next:[642,1113] quick_restart_no_lp (fixed_bools=8/315)
#Bound   6.16s best:1114  next:[643,1113] objective_lb_search_no_lp
#Bound   6.21s best:1114  next:[644,1113] objective_lb_search_no_lp
#Bound   6.79s best:1114  next:[648,1113] objective_lb_search_no_lp
#Bound   6.85s best:1114  next:[650,1113] objective_lb_search_no_lp
#Bound   7.19s best:1114  next:[652,1113] objective_lb_search_no_lp
#Bound   7.19s best:1114  next:[660,1113] objective_lb_search_no_lp
#Bound   8.06s best:1114  next:[662,1113] objective_lb_search_no_lp
#Bound   8.57s best:1114  next:[664,1113] objective_lb_search_no_lp
#Bound   8.82s best:1114  next:[665,1113] objective_lb_search_no_lp [skipped_logs=0]
#Bound   9.86s best:1114  next:[669,1113] objective_lb_search_no_lp [skipped_logs=2]
#Bound  11.01s best:1114  next:[671,1113] objective_lb_search_no_lp
#Bound  11.97s best:1114  next:[674,1113] objective_lb_search_no_lp [skipped_logs=1]
#Bound  13.02s best:1114  next:[691,1113] objective_lb_search_no_lp [skipped_logs=3]
#Bound  14.07s best:1114  next:[693,1113] objective_lb_search_no_lp
#Bound  14.75s best:1114  next:[696,1113] objective_lb_search_no_lp [skipped_logs=0]
#Bound  15.28s best:1114  next:[697,1113] objective_lb_search_no_lp [skipped_logs=0]
#Bound  16.27s best:1114  next:[704,1113] objective_lb_search_no_lp [skipped_logs=0]
#Bound  19.11s best:1114  next:[708,1113] objective_lb_search_no_lp
#Bound  19.95s best:1114  next:[710,1113] objective_lb_search_no_lp
#Bound  20.79s best:1114  next:[712,1113] objective_lb_search_no_lp
#Bound  22.71s best:1114  next:[716,1113] objective_lb_search_no_lp
#Bound  24.17s best:1114  next:[724,1113] objective_lb_search_no_lp
#Bound  24.67s best:1114  next:[726,1113] objective_lb_search_no_lp
#Bound  26.42s best:1114  next:[727,1113] objective_lb_search_no_lp
#Bound  27.42s best:1114  next:[728,1113] objective_lb_search_no_lp
#Bound  32.56s best:1114  next:[746,1113] objective_lb_search_no_lp
#Bound  35.80s best:1114  next:[747,1113] objective_lb_search_no_lp
#Bound  36.08s best:1114  next:[748,1113] objective_lb_search_no_lp
#Bound  36.74s best:1114  next:[750,1113] objective_lb_search_no_lp
#Bound  37.33s best:1114  next:[753,1113] objective_lb_search_no_lp
#Bound  38.48s best:1114  next:[756,1113] objective_lb_search_no_lp
#Bound  39.24s best:1114  next:[757,1113] objective_lb_search_no_lp
#Bound  40.95s best:1114  next:[758,1113] objective_lb_search_no_lp
#Bound  41.76s best:1114  next:[759,1113] objective_lb_search_no_lp
#Bound  43.59s best:1114  next:[760,1113] objective_lb_search_no_lp
#Bound  43.93s best:1114  next:[761,1113] objective_lb_search_no_lp
#Bound  45.18s best:1114  next:[763,1113] objective_lb_search_no_lp
#Bound  48.99s best:1114  next:[765,1113] objective_lb_search_no_lp
#Bound  49.46s best:1114  next:[767,1113] objective_lb_search_no_lp
#Bound  50.42s best:1114  next:[769,1113] objective_lb_search_no_lp
#Bound  53.13s best:1114  next:[773,1113] objective_lb_search_no_lp
#Bound  54.73s best:1114  next:[785,1113] objective_lb_search_no_lp
#Bound  64.67s best:1114  next:[787,1113] objective_lb_search_no_lp
#Bound  67.33s best:1114  next:[790,1113] objective_lb_search_no_lp
#Bound  73.01s best:1114  next:[791,1113] objective_lb_search_no_lp
#Bound  80.84s best:1114  next:[792,1113] lb_tree_search (nodes=4594/4599 rc=21 decisions=29491 @root=20 restarts=10) 
#Bound  83.91s best:1114  next:[793,1113] lb_tree_search (nodes=4649/4654 rc=21 decisions=30236 @root=21 restarts=10) 
#Bound  84.03s best:1114  next:[795,1113] objective_lb_search_no_lp
#Bound  88.57s best:1114  next:[797,1113] objective_lb_search_no_lp
#Bound  94.60s best:1114  next:[798,1113] lb_tree_search (nodes=4897/4902 rc=21 decisions=33373 @root=23 restarts=10) 
#Bound  98.22s best:1114  next:[799,1113] lb_tree_search (nodes=4976/4981 rc=21 decisions=34319 @root=24 restarts=10) 
#Bound 102.06s best:1114  next:[800,1113] lb_tree_search (nodes=5049/5054 rc=22 decisions=35274 @root=25 restarts=10) 
#Bound 106.24s best:1114  next:[801,1113] lb_tree_search (nodes=5117/5122 rc=22 decisions=36302 @root=26 restarts=10) 
#Bound 109.63s best:1114  next:[802,1113] lb_tree_search (nodes=5156/5161 rc=22 decisions=37084 @root=27 restarts=10) 
#Bound 112.82s best:1114  next:[803,1113] lb_tree_search (nodes=5177/5182 rc=22 decisions=37762 @root=28 restarts=10) 
#Bound 116.53s best:1114  next:[804,1113] lb_tree_search (nodes=5199/5204 rc=22 decisions=38540 @root=29 restarts=10) 
#Bound 118.49s best:1114  next:[805,1113] objective_lb_search_no_lp
#Bound 122.97s best:1114  next:[806,1113] objective_lb_search_no_lp
#Bound 129.90s best:1114  next:[807,1113] lb_tree_search (nodes=5366/5371 rc=22 decisions=41246 @root=31 restarts=10) 
#Bound 134.90s best:1114  next:[808,1113] objective_lb_search_no_lp
#Bound 136.13s best:1114  next:[812,1113] objective_lb_search_no_lp
#Bound 138.05s best:1114  next:[813,1113] objective_lb_search_no_lp
#Bound 138.99s best:1114  next:[814,1113] objective_lb_search_no_lp
#Bound 142.20s best:1114  next:[815,1113] objective_lb_search_no_lp
#Bound 142.88s best:1114  next:[817,1113] objective_lb_search_no_lp
#Bound 143.91s best:1114  next:[818,1113] objective_lb_search_no_lp
#Bound 145.33s best:1114  next:[820,1113] objective_lb_search_no_lp
#Bound 146.03s best:1114  next:[821,1113] objective_lb_search_no_lp
#Bound 150.58s best:1114  next:[822,1113] objective_lb_search_no_lp
#Bound 154.30s best:1114  next:[823,1113] objective_lb_search_no_lp
#Bound 156.07s best:1114  next:[824,1113] objective_lb_search_no_lp
#Bound 158.15s best:1114  next:[825,1113] objective_lb_search_no_lp
#Bound 165.67s best:1114  next:[827,1113] objective_lb_search_no_lp
#Bound 169.37s best:1114  next:[828,1113] objective_lb_search_no_lp
#Bound 171.45s best:1114  next:[831,1113] objective_lb_search_no_lp
#Bound 183.30s best:1114  next:[832,1113] objective_lb_search_no_lp
#Bound 190.58s best:1114  next:[833,1113] lb_tree_search (nodes=7167/7173 rc=29 decisions=59098 @root=36 restarts=10) 
#Bound 191.42s best:1114  next:[836,1113] objective_lb_search_no_lp
#Bound 192.60s best:1114  next:[837,1113] objective_lb_search_no_lp
#Bound 193.46s best:1114  next:[838,1113] objective_lb_search_no_lp
#Bound 194.05s best:1114  next:[840,1113] objective_lb_search_no_lp
#Bound 196.35s best:1114  next:[841,1113] objective_lb_search_no_lp
#Bound 198.86s best:1114  next:[842,1113] objective_lb_search_no_lp
#Bound 199.30s best:1114  next:[843,1113] objective_lb_search_no_lp
#Bound 206.32s best:1114  next:[847,1113] objective_lb_search
#Bound 210.19s best:1114  next:[848,1113] objective_lb_search_no_lp
#Bound 211.58s best:1114  next:[851,1113] objective_lb_search
#Model 211.60s var:335/337 constraints:3332/3564
#Model 211.68s var:334/337 constraints:3306/3564
#Model 212.08s var:333/337 constraints:3265/3564
#Bound 212.88s best:1114  next:[855,1113] objective_lb_search_no_lp
#Model 212.95s var:328/337 constraints:2995/3564
#Model 212.96s var:319/337 constraints:2387/3564
#Bound 213.23s best:1114  next:[856,1113] objective_lb_search_no_lp
#Bound 213.42s best:1114  next:[858,1113] objective_lb_search_no_lp
#Bound 213.95s best:1114  next:[872,1113] objective_lb_search
#Bound 214.07s best:1114  next:[911,1113] objective_lb_search_no_lp
#Bound 214.67s best:1114  next:[940,1113] objective_lb_search_no_lp
#Bound 215.10s best:1114  next:[948,1113] objective_lb_search_no_lp
#Bound 216.26s best:1114  next:[987,1113] objective_lb_search
#Model 216.37s var:318/337 constraints:2363/3564
#Bound 216.39s best:1114  next:[1016,1113] objective_lb_search_no_lp
#Model 216.62s var:317/337 constraints:2352/3564
#Model 216.68s var:316/337 constraints:2324/3564
#Model 216.73s var:315/337 constraints:2314/3564
#Bound 217.06s best:1114  next:[1025,1113] objective_lb_search_no_lp
#Bound 217.22s best:1114  next:[1027,1113] objective_lb_search_no_lp
#Bound 217.38s best:1114  next:[1057,1113] objective_lb_search_no_lp
#Bound 217.60s best:1114  next:[1067,1113] objective_lb_search_no_lp
#Bound 217.73s best:1114  next:[1072,1113] objective_lb_search_no_lp
#Model 217.75s var:313/337 constraints:2202/3564
#Model 217.81s var:311/337 constraints:2129/3564
#Bound 217.83s best:1114  next:[1089,1113] objective_lb_search_no_lp
#Bound 217.90s best:1114  next:[1091,1113] objective_lb_search_no_lp
#Model 217.91s var:309/337 constraints:1982/3564
#Model 217.91s var:305/337 constraints:1864/3564
#Bound 217.93s best:1114  next:[1095,1113] objective_lb_search_no_lp
#Model 217.94s var:300/337 constraints:1674/3564
#Model 217.94s var:294/337 constraints:1375/3564
#Bound 217.95s best:1114  next:[1102,1113] objective_lb_search_no_lp
#Done  217.95s quick_restart_no_lp
#Done  217.95s no_lp
#Model 217.95s var:281/337 constraints:930/3564
#Done  217.96s core
#Done  217.96s default_lp
#Model 217.96s var:278/337 constraints:861/3564

Task timing                                  n [     min,      max]      avg      dev     time         n [     min,      max]      avg      dev    dtime
                             'core':         1 [   3.62m,    3.62m]    3.62m   0.00ns    3.62m         1 [   2.93m,    2.93m]    2.93m   0.00ns    2.93m
                       'default_lp':         1 [   3.62m,    3.62m]    3.62m   0.00ns    3.62m         1 [  25.04s,   25.04s]   25.04s   0.00ns   25.04s
                 'feasibility_pump':       577 [ 43.53ms,    1.16s] 372.97ms 187.65ms    3.59m       576 [ 21.75ms,  71.69ms]  26.35ms   1.91ms   15.18s
                  'fj_long_default':         1 [121.37ms, 121.37ms] 121.37ms   0.00ns 121.37ms         1 [ 35.56ms,  35.56ms]  35.56ms   0.00ns  35.56ms
                  'fj_long_default':         1 [213.70ms, 213.70ms] 213.70ms   0.00ns 213.70ms         1 [ 60.85ms,  60.85ms]  60.85ms   0.00ns  60.85ms
              'fj_long_lin_default':         1 [154.42ms, 154.42ms] 154.42ms   0.00ns 154.42ms         1 [ 77.80ms,  77.80ms]  77.80ms   0.00ns  77.80ms
              'fj_long_lin_perturb':         1 [295.50ms, 295.50ms] 295.50ms   0.00ns 295.50ms         1 [ 69.68ms,  69.68ms]  69.68ms   0.00ns  69.68ms
               'fj_long_lin_random':         1 [187.32ms, 187.32ms] 187.32ms   0.00ns 187.32ms         1 [ 65.55ms,  65.55ms]  65.55ms   0.00ns  65.55ms
                  'fj_long_perturb':         1 [266.05ms, 266.05ms] 266.05ms   0.00ns 266.05ms         1 [ 76.59ms,  76.59ms]  76.59ms   0.00ns  76.59ms
                   'fj_long_random':         1 [142.14ms, 142.14ms] 142.14ms   0.00ns 142.14ms         1 [ 54.56ms,  54.56ms]  54.56ms   0.00ns  54.56ms
                 'fj_short_default':         1 [109.55ms, 109.55ms] 109.55ms   0.00ns 109.55ms         1 [ 77.59ms,  77.59ms]  77.59ms   0.00ns  77.59ms
                 'fj_short_default':         1 [155.41ms, 155.41ms] 155.41ms   0.00ns 155.41ms         1 [ 72.71ms,  72.71ms]  72.71ms   0.00ns  72.71ms
             'fj_short_lin_default':         1 [121.36ms, 121.36ms] 121.36ms   0.00ns 121.36ms         1 [ 76.72ms,  76.72ms]  76.72ms   0.00ns  76.72ms
             'fj_short_lin_default':         1 [182.49ms, 182.49ms] 182.49ms   0.00ns 182.49ms         1 [ 78.04ms,  78.04ms]  78.04ms   0.00ns  78.04ms
             'fj_short_lin_perturb':         1 [119.59ms, 119.59ms] 119.59ms   0.00ns 119.59ms         1 [ 39.46ms,  39.46ms]  39.46ms   0.00ns  39.46ms
              'fj_short_lin_random':         1 [177.02ms, 177.02ms] 177.02ms   0.00ns 177.02ms         1 [ 77.37ms,  77.37ms]  77.37ms   0.00ns  77.37ms
                 'fj_short_perturb':         1 [153.33ms, 153.33ms] 153.33ms   0.00ns 153.33ms         1 [ 55.82ms,  55.82ms]  55.82ms   0.00ns  55.82ms
                  'fj_short_random':         1 [120.88ms, 120.88ms] 120.88ms   0.00ns 120.88ms         1 [ 77.11ms,  77.11ms]  77.11ms   0.00ns  77.11ms
                        'fs_random':         1 [ 79.20ms,  79.20ms]  79.20ms   0.00ns  79.20ms         1 [ 20.00ns,  20.00ns]  20.00ns   0.00ns  20.00ns
                        'fs_random':         1 [ 80.59ms,  80.59ms]  80.59ms   0.00ns  80.59ms         1 [ 20.00ns,  20.00ns]  20.00ns   0.00ns  20.00ns
                        'fs_random':         1 [ 82.82ms,  82.82ms]  82.82ms   0.00ns  82.82ms         1 [ 20.00ns,  20.00ns]  20.00ns   0.00ns  20.00ns
                        'fs_random':         1 [ 83.56ms,  83.56ms]  83.56ms   0.00ns  83.56ms         1 [ 20.00ns,  20.00ns]  20.00ns   0.00ns  20.00ns
                  'fs_random_no_lp':         1 [ 76.69ms,  76.69ms]  76.69ms   0.00ns  76.69ms         1 [314.84us, 314.84us] 314.84us   0.00ns 314.84us
                  'fs_random_no_lp':         1 [ 77.31ms,  77.31ms]  77.31ms   0.00ns  77.31ms         1 [246.12us, 246.12us] 246.12us   0.00ns 246.12us
                  'fs_random_no_lp':         1 [ 78.74ms,  78.74ms]  78.74ms   0.00ns  78.74ms         1 [824.29us, 824.29us] 824.29us   0.00ns 824.29us
                  'fs_random_no_lp':         1 [ 79.49ms,  79.49ms]  79.49ms   0.00ns  79.49ms         1 [471.23us, 471.23us] 471.23us   0.00ns 471.23us
          'fs_random_quick_restart':         1 [ 77.24ms,  77.24ms]  77.24ms   0.00ns  77.24ms         1 [ 20.00ns,  20.00ns]  20.00ns   0.00ns  20.00ns
          'fs_random_quick_restart':         1 [ 83.88ms,  83.88ms]  83.88ms   0.00ns  83.88ms         1 [ 20.00ns,  20.00ns]  20.00ns   0.00ns  20.00ns
          'fs_random_quick_restart':         1 [ 85.39ms,  85.39ms]  85.39ms   0.00ns  85.39ms         1 [ 20.00ns,  20.00ns]  20.00ns   0.00ns  20.00ns
          'fs_random_quick_restart':         1 [ 86.24ms,  86.24ms]  86.24ms   0.00ns  86.24ms         1 [ 20.00ns,  20.00ns]  20.00ns   0.00ns  20.00ns
    'fs_random_quick_restart_no_lp':         1 [ 77.24ms,  77.24ms]  77.24ms   0.00ns  77.24ms         1 [367.57us, 367.57us] 367.57us   0.00ns 367.57us
    'fs_random_quick_restart_no_lp':         1 [ 78.37ms,  78.37ms]  78.37ms   0.00ns  78.37ms         1 [365.71us, 365.71us] 365.71us   0.00ns 365.71us
    'fs_random_quick_restart_no_lp':         1 [ 79.31ms,  79.31ms]  79.31ms   0.00ns  79.31ms         1 [235.79us, 235.79us] 235.79us   0.00ns 235.79us
                    'graph_arc_lns':       661 [  3.40ms,    5.97s]    1.36s 987.26ms   14.97m       634 [ 10.00ns, 200.76ms]  69.34ms  47.31ms   43.96s
                    'graph_cst_lns':       660 [  2.88ms,    5.28s]    1.38s    1.01s   15.18m       616 [ 10.00ns, 325.84ms]  70.75ms  47.22ms   43.58s
                    'graph_dec_lns':       660 [  7.33ms,    4.67s]    1.45s 965.23ms   15.95m       636 [ 10.00ns, 297.78ms]  70.28ms  47.94ms   44.70s
                    'graph_var_lns':       661 [  2.81ms,    5.11s]    1.31s 899.82ms   14.41m       633 [ 10.00ns, 208.14ms]  71.72ms  45.96ms   45.40s
                   'lb_tree_search':         1 [   3.62m,    3.62m]    3.62m   0.00ns    3.62m         1 [   1.44m,    1.44m]    1.44m   0.00ns    1.44m
                           'max_lp':         1 [   3.62m,    3.62m]    3.62m   0.00ns    3.62m         1 [  50.39s,   50.39s]   50.39s   0.00ns   50.39s
                            'no_lp':         1 [   3.62m,    3.62m]    3.62m   0.00ns    3.62m         1 [  26.91s,   26.91s]   26.91s   0.00ns   26.91s
              'objective_lb_search':         1 [   3.62m,    3.62m]    3.62m   0.00ns    3.62m         1 [  35.73s,   35.73s]   35.73s   0.00ns   35.73s
       'objective_lb_search_max_lp':         1 [   3.62m,    3.62m]    3.62m   0.00ns    3.62m         1 [  38.81s,   38.81s]   38.81s   0.00ns   38.81s
        'objective_lb_search_no_lp':         1 [   3.62m,    3.62m]    3.62m   0.00ns    3.62m         1 [  18.80s,   18.80s]   18.80s   0.00ns   18.80s
  'objective_shaving_search_max_lp':       121 [ 16.40ms,   11.84s]    1.79s    2.18s    3.62m       100 [  1.65ms,    1.75s] 167.97ms 273.71ms   16.80s
   'objective_shaving_search_no_lp':       118 [ 19.95ms,   11.87s]    1.84s    2.19s    3.62m       101 [ 59.17us,    1.14s] 126.45ms 185.74ms   12.77s
                          'probing':         1 [   3.62m,    3.62m]    3.62m   0.00ns    3.62m         1 [  19.81s,   19.81s]   19.81s   0.00ns   19.81s
                   'probing_max_lp':         1 [   3.62m,    3.62m]    3.62m   0.00ns    3.62m         1 [  25.48s,   25.48s]   25.48s   0.00ns   25.48s
                     'pseudo_costs':         1 [   3.62m,    3.62m]    3.62m   0.00ns    3.62m         1 [  41.83s,   41.83s]   41.83s   0.00ns   41.83s
                    'quick_restart':         1 [   3.62m,    3.62m]    3.62m   0.00ns    3.62m         1 [  32.51s,   32.51s]   32.51s   0.00ns   32.51s
              'quick_restart_no_lp':         1 [   3.62m,    3.62m]    3.62m   0.00ns    3.62m         1 [  22.12s,   22.12s]   22.12s   0.00ns   22.12s
                    'reduced_costs':         1 [   3.62m,    3.62m]    3.62m   0.00ns    3.62m         1 [  45.34s,   45.34s]   45.34s   0.00ns   45.34s
                        'rins/rens':       661 [120.05us,    3.67s] 930.38ms 802.71ms   10.25m       537 [ 10.00ns, 157.84ms]  71.22ms  37.92ms   38.25s
                      'rnd_cst_lns':       661 [  3.08ms,    4.20s]    1.34s 939.01ms   14.79m       621 [ 10.00ns, 217.35ms]  72.30ms  45.67ms   44.90s
                      'rnd_var_lns':       661 [  4.85ms,    4.69s]    1.38s 967.18ms   15.22m       643 [ 10.00ns, 180.91ms]  69.92ms  46.14ms   44.96s
                     'violation_ls':       647 [434.40us, 622.96ms] 190.18ms  94.55ms    2.05m       647 [  1.50us, 154.77ms]  69.73ms  17.95ms   45.11s
                     'violation_ls':       653 [431.30us, 820.69ms] 209.81ms 116.27ms    2.28m       653 [  1.09us, 215.57ms]  73.65ms  37.73ms   48.10s
                     'violation_ls':       657 [427.55us, 709.95ms] 256.07ms 136.30ms    2.80m       657 [  1.03us, 165.98ms]  88.66ms  34.39ms   58.25s
                     'violation_ls':       661 [432.48us, 772.76ms] 196.14ms 106.51ms    2.16m       661 [  1.47us, 175.34ms]  72.69ms  26.23ms   48.05s
                     'violation_ls':       661 [645.59us, 534.80ms] 154.54ms  81.36ms    1.70m       661 [  1.51us,  76.69ms]  63.47ms   9.98ms   41.96s

Search stats                        Bools  Conflicts  Branches  Restarts   BoolPropag  IntegerPropag
                           'core':  5'538     64'053   125'023     7'766  120'753'421     56'209'820
                     'default_lp':     99     30'125   138'718    19'831    1'033'986     40'517'244
                      'fs_random':     99          0       198       198           24          5'040
                      'fs_random':     99          0       198       198           24          5'040
                      'fs_random':     99          0       198       198           24          5'040
                      'fs_random':     99          0       198       198           24          5'040
                'fs_random_no_lp':     99          0       230       198           29          6'002
                'fs_random_no_lp':     99          0       236       198           30          6'960
                'fs_random_no_lp':     99          4       236       198           33          6'297
                'fs_random_no_lp':     99          7       255       198           55          8'389
        'fs_random_quick_restart':     99          0       198       198           24          5'040
        'fs_random_quick_restart':     99          0       198       198           24          5'040
        'fs_random_quick_restart':     99          0       198       198           24          5'040
        'fs_random_quick_restart':     99          0       198       198           24          5'040
  'fs_random_quick_restart_no_lp':     99          0       242       198           28          5'939
  'fs_random_quick_restart_no_lp':     99          0       245       198           26          6'510
  'fs_random_quick_restart_no_lp':     99          0       251       198           26          6'558
                 'lb_tree_search':     99        179   110'239    17'090      204'298      9'127'574
                         'max_lp':     99     20'101   239'769    64'045    1'092'714     38'885'488
                          'no_lp':  1'181     87'396   202'259    17'150   25'360'122     96'350'726
            'objective_lb_search':    254     28'269   190'188    34'262    1'860'619     49'274'293
     'objective_lb_search_max_lp':    184     10'199    86'129    20'993      563'320     17'577'681
      'objective_lb_search_no_lp':    380     71'315   148'314    10'230    2'876'133     76'754'435
                        'probing':    575        353     3'645     2'340       34'618        232'420
                 'probing_max_lp':    575        351     2'385     1'712       29'816        196'352
                   'pseudo_costs':     99     30'652   201'704    34'141    1'267'131     48'740'087
                  'quick_restart':     99      8'796   234'527    56'582      854'711     31'125'962
            'quick_restart_no_lp':  2'891     61'254   250'553    17'712   41'352'003     55'597'125
                  'reduced_costs':  1'673     27'851   249'177    30'227   15'704'687     44'282'012

SAT stats                           ClassicMinim  LitRemoved  LitLearned  LitForgotten  Subsumed  MClauses  MDecisions  MLitTrue  MSubsumed  MLitRemoved  MReused
                           'core':        60'204     419'342     489'455         8'407       341     3'335      16'221         0        201          630       74
                     'default_lp':        19'860      46'215     358'674       105'128     1'114     9'440      95'268         0      1'007        7'235    1'934
                      'fs_random':             0           0           0             0         0         0           0         0          0            0        0
                      'fs_random':             0           0           0             0         0         0           0         0          0            0        0
                      'fs_random':             0           0           0             0         0         0           0         0          0            0        0
                      'fs_random':             0           0           0             0         0         0           0         0          0            0        0
                'fs_random_no_lp':             0           0           0             0         0         0           0         0          0            0        0
                'fs_random_no_lp':             0           0           0             0         0         0           0         0          0            0        0
                'fs_random_no_lp':             0           0          14             0         0         0           0         0          0            0        0
                'fs_random_no_lp':             0           0          27             0         0         0           0         0          0            0        0
        'fs_random_quick_restart':             0           0           0             0         0         0           0         0          0            0        0
        'fs_random_quick_restart':             0           0           0             0         0         0           0         0          0            0        0
        'fs_random_quick_restart':             0           0           0             0         0         0           0         0          0            0        0
        'fs_random_quick_restart':             0           0           0             0         0         0           0         0          0            0        0
  'fs_random_quick_restart_no_lp':             0           0           0             0         0         0           0         0          0            0        0
  'fs_random_quick_restart_no_lp':             0           0           0             0         0         0           0         0          0            0        0
  'fs_random_quick_restart_no_lp':             0           0           0             0         0         0           0         0          0            0        0
                 'lb_tree_search':             4           5         629             0         0     6'513      32'670         0         43          171      610
                         'max_lp':        11'086      25'271     267'639        58'956       933    25'631     184'885         0        182          974    2'123
                          'no_lp':        71'790     329'237   1'311'756       966'681     1'080     8'152      76'763         0      1'879       12'999    1'490
            'objective_lb_search':        22'198      64'680     256'700        18'479       976    14'637     134'977         0      2'236       14'042    3'685
     'objective_lb_search_max_lp':         6'764      16'596      98'632             0       552     5'872      50'420         0        257        1'573      885
      'objective_lb_search_no_lp':        60'343     223'108     620'886       150'001     1'390     5'342      58'656         0      2'121       14'986    1'274
                        'probing':             0           0         357             0         0         0           0         0          0            0        0
                 'probing_max_lp':             0           0         351             0         0         0           0         0          0            0        0
                   'pseudo_costs':        19'120      48'934     406'195       128'265     1'317    16'036     152'893         0      2'580       18'173    2'407
                  'quick_restart':         4'925      11'301     114'818             0       261    24'636     188'768         0        497        2'835    3'637
            'quick_restart_no_lp':        49'160     247'942     777'854       408'639       790     7'678      57'954         8      4'596       30'722      667
                  'reduced_costs':        21'486      78'197     350'777       111'356       750    14'970     147'704        31      3'619       28'028    2'771

Lp stats                         Component  Iterations  AddedCuts  OPTIMAL  DUAL_F.  DUAL_U.
                  'default_lp':          1     332'759     14'258   43'269        1        0
                   'fs_random':          1           0          0        0        0        0
                   'fs_random':          1           0          0        0        0        0
                   'fs_random':          1         146          0        2        0        0
                   'fs_random':          1         146          0        2        0        0
     'fs_random_quick_restart':          1           0          0        0        0        0
     'fs_random_quick_restart':          1         124          0        1        1        0
     'fs_random_quick_restart':          1          65          0        1        1        0
     'fs_random_quick_restart':          1          65          0        1        1        0
              'lb_tree_search':          1   1'643'614      9'967   57'214   15'827        0
                      'max_lp':          1     770'998     21'700   34'339    9'618       19
         'objective_lb_search':          1     528'900     10'967   46'056        0        0
  'objective_lb_search_max_lp':          1     619'401     10'711   18'322    5'491       13
                     'probing':          1     184'267     11'800   10'052        0        0
              'probing_max_lp':          1     169'031      9'671    5'983      870        0
                'pseudo_costs':          1     658'242     34'335   39'582   17'162       24
               'quick_restart':          1     380'581     14'687   34'991        0        2
               'reduced_costs':          1     699'466     36'241   39'037   15'441       10

Lp dimension                                                                       Final dimension of first component
                  'default_lp':    628 rows, 322 columns, 2411 entries with magnitude in [3.917572e-05, 1.000000e+00]
                   'fs_random':         0 rows, 322 columns, 0 entries with magnitude in [0.000000e+00, 0.000000e+00]
                   'fs_random':         0 rows, 322 columns, 0 entries with magnitude in [0.000000e+00, 0.000000e+00]
                   'fs_random':     123 rows, 322 columns, 542 entries with magnitude in [8.524929e-02, 1.000000e+00]
                   'fs_random':     123 rows, 322 columns, 542 entries with magnitude in [8.524929e-02, 1.000000e+00]
     'fs_random_quick_restart':         0 rows, 322 columns, 0 entries with magnitude in [0.000000e+00, 0.000000e+00]
     'fs_random_quick_restart':     123 rows, 322 columns, 542 entries with magnitude in [8.524929e-02, 1.000000e+00]
     'fs_random_quick_restart':     123 rows, 322 columns, 542 entries with magnitude in [8.524929e-02, 1.000000e+00]
     'fs_random_quick_restart':     123 rows, 322 columns, 542 entries with magnitude in [8.524929e-02, 1.000000e+00]
              'lb_tree_search':   1132 rows, 337 columns, 3905 entries with magnitude in [1.540691e-04, 1.000000e+00]
                      'max_lp':    884 rows, 337 columns, 3140 entries with magnitude in [2.582127e-03, 1.000000e+00]
         'objective_lb_search':    467 rows, 322 columns, 2041 entries with magnitude in [6.144871e-05, 1.000000e+00]
  'objective_lb_search_max_lp':    974 rows, 337 columns, 3257 entries with magnitude in [3.799416e-03, 1.000000e+00]
                     'probing':  1253 rows, 322 columns, 13478 entries with magnitude in [2.651670e-06, 1.000000e+00]
              'probing_max_lp':  1432 rows, 337 columns, 10888 entries with magnitude in [8.812940e-04, 1.000000e+00]
                'pseudo_costs':    553 rows, 337 columns, 1907 entries with magnitude in [3.453718e-03, 1.000000e+00]
               'quick_restart':    649 rows, 322 columns, 3027 entries with magnitude in [2.183913e-04, 1.000000e+00]
               'reduced_costs':    762 rows, 337 columns, 2390 entries with magnitude in [2.061562e-03, 1.000000e+00]

Lp debug                         CutPropag  CutEqPropag  Adjust  Overflow        Bad  BadScaling
                  'default_lp':         37           26  25'214         0    306'469           0
                   'fs_random':          0            0       0         0          0           0
                   'fs_random':          0            0       0         0          0           0
                   'fs_random':          0            0       0         0          0           0
                   'fs_random':          0            0       0         0          0           0
     'fs_random_quick_restart':          0            0       0         0          0           0
     'fs_random_quick_restart':          0            0       0         0          0           0
     'fs_random_quick_restart':          0            0       0         0          0           0
     'fs_random_quick_restart':          0            0       0         0          0           0
              'lb_tree_search':         57            6  45'792         0    155'779           0
                      'max_lp':        134           53  13'918         0    343'818           0
         'objective_lb_search':         13           55  19'568         0    411'572           0
  'objective_lb_search_max_lp':         59            7  10'370         0    232'326           0
                     'probing':         21          247   9'782         0  7'275'504           0
              'probing_max_lp':         45           76   6'804         0  5'461'352           0
                'pseudo_costs':        182           29  26'768         0    393'733           0
               'quick_restart':         81           97  20'118         0    957'420           0
               'reduced_costs':        219           36  28'299         0    450'587           0

Lp pool                          Constraints  Updates  Simplif  Merged  Shortened   Split  Strenghtened      Cuts/Call
                  'default_lp':        9'435    1'759   88'663     213     11'652  18'939        16'556  14'258/45'440
                   'fs_random':          390        0        0       0          0       0            32            0/0
                   'fs_random':          390        0        0       0          0       0            32            0/0
                   'fs_random':          390        0        0       0          0       0            32            0/0
                   'fs_random':          390        0        0       0          0       0            32            0/0
     'fs_random_quick_restart':          390        0        0       0          0       0            32            0/0
     'fs_random_quick_restart':          390        0        0       0          0       0            32            0/0
     'fs_random_quick_restart':          390        0        0       0          0       0            32            0/0
     'fs_random_quick_restart':          390        0        0       0          0       0            32            0/0
              'lb_tree_search':       13'406      963  176'473     122     10'841   1'790        76'529   9'967/51'813
                      'max_lp':       13'073    1'414  211'515     188     12'921  13'967       101'722  21'700/62'003
         'objective_lb_search':       10'278    1'765   84'387      79      9'088  25'536        17'405  10'967/44'789
  'objective_lb_search_max_lp':       13'201    1'137  106'349      71     11'192   5'349        96'883  10'711/32'534
                     'probing':       10'172    2'731   43'068      18      4'635  55'778         7'110  11'800/27'308
              'probing_max_lp':       13'230    1'810   45'675       2          0  20'583        58'088   9'671/23'435
                'pseudo_costs':       12'580    1'746  223'401     316     11'433  13'160       105'005  34'335/86'043
               'quick_restart':       10'018    2'665  233'632      59     12'163  93'935        23'100  14'687/52'240
               'reduced_costs':       12'396    2'160  286'964     406     13'937  17'129       121'763  36'241/96'480

Lp Cut            defaul  max_lp  quick_  reduce  pseudo  lb_tre  probin  object  probin  object
          CG_FF:     769     739     602   1'783   1'401     397     423     564     253     293
           CG_K:     492     534     348   1'415   1'150     318     344     369     131     174
          CG_KL:       2       -       -       -       -       -       -       1       -       -
           CG_R:     818     567     946   1'254   1'121     331     740     506     182     242
          CG_RB:   2'098   2'407   2'073   3'500   4'436   1'162   1'934   1'620     620   1'239
         CG_RBP:     295     260     379     549     592     104     141     198      73      66
         Clique:       -     137       -     263     245     109       -       -      69     151
             IB:   1'835   2'451   1'848   4'128   3'903   1'093   1'354   1'345     782   1'132
       MIR_1_FF:     723   1'294     755   1'989   1'839     728     514     569     561     684
        MIR_1_K:     153     264     124     483     467      99      87     110      58     121
       MIR_1_KL:       1       3      10      15       4       -       5       -       5       -
        MIR_1_R:     159     150     177     288     254      62     181     121      66      71
       MIR_1_RB:   1'279   2'454   1'038   3'657   3'351   1'017     908     964     783   1'153
      MIR_1_RBP:      48     326      42     541     515     178      27      32      84     131
      MIR_1_RLT:       -      10       -      25      13       4       -       -       7      10
       MIR_2_FF:     403     730     428   1'249   1'087     353     345     299     251     365
        MIR_2_K:     112     204      91     363     407      92      64      82      54      75
       MIR_2_KL:       1       4       8      10      17       1       5       3       3       -
        MIR_2_R:     135     256     183     407     444     120     183     122     109     128
       MIR_2_RB:     791   1'305     846   2'147   2'018     534     659     678     447     590
      MIR_2_RBP:      62     213      75     352     386      97      40      45      57      68
       MIR_3_FF:     287     450     268     839     696     212     246     222     118     207
        MIR_3_K:      96     139      61     264     235      57      47      55      31      48
       MIR_3_KL:       4      10       8      18      17       -       7       8       1       2
        MIR_3_R:     142     230     161     420     369      91     125      95      77     100
       MIR_3_RB:     490     787     527   1'262   1'217     325     486     441     241     335
      MIR_3_RBP:      46     111      42     217     244      38      31      31      30      44
       MIR_4_FF:     171     284     142     503     434     126     143     105      56     121
        MIR_4_K:      58      96      49     201     197      56      27      39      34      50
       MIR_4_KL:       5       5       5      17      14       2       6       2       7       2
        MIR_4_R:      87     139      81     331     312      56      64      56      37      56
       MIR_4_RB:     317     467     318     760     745     173     283     246     143     197
      MIR_4_RBP:      32      67      31     149     164      20      21      20      16      18
       MIR_5_FF:     111     132      88     298     235      76      58      89      37      56
        MIR_5_K:      39      48      26     111     107      37      16      30      14      24
       MIR_5_KL:       6       8       4       9       5       -       -       2       2       1
        MIR_5_R:      86      86      57     175     165      39      32      49      20      36
       MIR_5_RB:     202     238     174     435     399     108     101     157      88     110
      MIR_5_RBP:      23      23      15      95      92      18      20      11      10       3
       MIR_6_FF:      76      92      62     158     137      26      37      58      21      25
        MIR_6_K:      26      27      10      62      73      18       9      18      10      16
       MIR_6_KL:       3       4       5       5       4       -       1       1       -       -
        MIR_6_R:      61      62      34     100      91      14      29      43       6      16
       MIR_6_RB:     115     153     113     231     217      50      90      92      48      62
      MIR_6_RBP:      16      21       5      52      64      11      16      13       7       3
   ZERO_HALF_FF:     148     257     114     554     433     145      83     107      62     120
    ZERO_HALF_K:      32      70      26     157     124      21      20      28      10      36
   ZERO_HALF_KL:       -       1       -       -       -       -       -       -       -       -
    ZERO_HALF_R:   1'050   2'521   1'883   3'111   2'856   1'070   1'384     989   3'238   1'927
   ZERO_HALF_RB:     282     745     312   1'056     868     329     389     267     642     356
  ZERO_HALF_RBP:      71     119      93     233     171      50      75      65      70      47

LNS stats           Improv/Calls  Closed  Difficulty  TimeLimit
  'graph_arc_lns':        34/658     52%        0.99       0.12
  'graph_cst_lns':        26/645     52%        0.99       0.12
  'graph_dec_lns':        29/659     52%        0.99       0.12
  'graph_var_lns':        32/655     51%        0.99       0.12
      'rins/rens':        75/598     52%        0.89       0.10
    'rnd_cst_lns':        39/655     53%        1.00       0.12
    'rnd_var_lns':        31/661     52%        0.99       0.12

LS stats                   Batches  Restarts   LinMoves   GenMoves  CompoundMoves  WeightUpdates
       'fj_long_default':        1         1      6'014          0              0            124
       'fj_long_default':        1         1      9'826          0              0            174
   'fj_long_lin_default':        1         1          0      2'291            315              1
   'fj_long_lin_perturb':        1         1      9'202          0              0            798
    'fj_long_lin_random':        1         1      8'390          0              0          1'610
       'fj_long_perturb':        1         1          0      2'575            425              2
        'fj_long_random':        1         1      9'805          0              0            195
      'fj_short_default':        1         1          0      2'257            211              0
      'fj_short_default':        1         1      8'828          0              0          1'172
  'fj_short_lin_default':        1         1          0      2'172            520              2
  'fj_short_lin_default':        1         1          0      2'501            386              1
  'fj_short_lin_perturb':        1         1      6'595          0              0            149
   'fj_short_lin_random':        1         1          0      2'273            331              1
      'fj_short_perturb':        1         1      9'773          0              0            227
       'fj_short_random':        1         1          0      2'569            336              1
          'violation_ls':      647         0  3'065'617  1'317'234        106'677        220'322
          'violation_ls':      653         0  3'992'179    923'904         56'576        313'441
          'violation_ls':      657         0  5'850'149     33'995          2'577        598'801
          'violation_ls':      661         0  2'132'735  1'860'416         88'709         89'816
          'violation_ls':      661         0  3'609'131  1'099'601         45'447        460'749

Solutions (55)            Num     Rank
        'graph_dec_lns':    1  [53,53]
                'no_lp':   20   [1,31]
  'quick_restart_no_lp':    5  [17,55]
          'rins_lp_lns':    1  [54,54]
        'rins_pump_lns':    3  [47,49]
         'violation_ls':   25  [18,51]

Objective bounds                     Num
                  'initial_domain':    1
                  'lb_tree_search':   11
             'objective_lb_search':    6
      'objective_lb_search_max_lp':    1
       'objective_lb_search_no_lp':  112
  'objective_shaving_search_no_lp':    1

Solution repositories     Added  Queried  Ignored  Synchro
  'feasible solutions':   4'348   13'029        4    4'101
        'lp solutions':   1'178      325        0    1'076
                'pump':  12'086      332

Improving bounds shared            Num
                        'core':     30
                  'default_lp':    102
              'lb_tree_search':    111
                      'max_lp':    189
                       'no_lp':    292
         'objective_lb_search':     32
  'objective_lb_search_max_lp':     46
   'objective_lb_search_no_lp':    245
                     'probing':    953
              'probing_max_lp':    507
                'pseudo_costs':    276
               'quick_restart':    390
         'quick_restart_no_lp':  2'866
               'reduced_costs':    434

Clauses shared                   Num
                        'core':    3
                  'default_lp':   27
             'fs_random_no_lp':    1
              'lb_tree_search':   25
                      'max_lp':   38
                       'no_lp':   19
         'objective_lb_search':   25
  'objective_lb_search_max_lp':   45
   'objective_lb_search_no_lp':    1
                'pseudo_costs':  130
               'quick_restart':   78
         'quick_restart_no_lp':   36
               'reduced_costs':    9

CpSolverResponse summary:
status: OPTIMAL
objective: 1114
best_bound: 1114
integers: 323
booleans: 99
conflicts: 0
branches: 198
propagations: 24
integer_propagations: 5040
restarts: 198
lp_iterations: 146
walltime: 218.063
usertime: 218.063
deterministic_time: 1238.09
gap_integral: 3552.15
solution_fingerprint: 0x9dc4a5c90dcaa89c


--- Simulation Gantt  partir du modle mathmatique ---
{'big':0, 'due_date':154, 'pos_time':5, 'status':0, 'blocked':0, 'operations':["{'type':1, 'processing_time':53}", "{'type':0, 'processing_time':27}"]}
{'big':0, 'due_date':107, 'pos_time':5, 'status':0, 'blocked':0, 'operations':["{'type':1, 'processing_time':14}", "{'type':0, 'processing_time':47}"]}
{'big':0, 'due_date':88, 'pos_time':5, 'status':0, 'blocked':0, 'operations':["{'type':0, 'processing_time':32}", "{'type':1, 'processing_time':11}"]}
{'big':1, 'due_date':140, 'pos_time':5, 'status':0, 'blocked':0, 'operations':["{'type':0, 'processing_time':58}", "{'type':1, 'processing_time':46}"]}
{'big':0, 'due_date':135, 'pos_time':5, 'status':0, 'blocked':0, 'operations':["{'type':0, 'processing_time':33}"]}
{'big':1, 'due_date':91, 'pos_time':5, 'status':0, 'blocked':0, 'operations':["{'type':0, 'processing_time':51}", "{'type':1, 'processing_time':16}"]}
{'big':1, 'due_date':96, 'pos_time':5, 'status':0, 'blocked':0, 'operations':["{'type':1, 'processing_time':56}"]}
{'big':0, 'due_date':52, 'pos_time':5, 'status':0, 'blocked':0, 'operations':["{'type':1, 'processing_time':10}"]}
