created virtual environment CPython3.12.4.final.0-64 in 6996ms
  creator CPython3Posix(dest=/localscratch/aneumann.63393196.0/env, clear=False, no_vcs_ignore=False, global=False)
  seeder FromAppData(download=False, pip=bundle, via=copy, app_data_dir=/home/aneumann/.local/share/virtualenv)
    added seed packages: pip==25.1.1
  activators BashActivator,CShellActivator,FishActivator,NushellActivator,PowerShellActivator,PythonActivator
Looking in links: /cvmfs/soft.computecanada.ca/custom/python/wheelhouse/gentoo2023/x86-64-v3, /cvmfs/soft.computecanada.ca/custom/python/wheelhouse/gentoo2023/generic, /cvmfs/soft.computecanada.ca/custom/python/wheelhouse/generic
Requirement already satisfied: pip in /localscratch/aneumann.63393196.0/env/lib/python3.12/site-packages (25.1.1)
Looking in links: /cvmfs/soft.computecanada.ca/custom/python/wheelhouse/gentoo2023/x86-64-v3, /cvmfs/soft.computecanada.ca/custom/python/wheelhouse/gentoo2023/generic, /cvmfs/soft.computecanada.ca/custom/python/wheelhouse/generic
ERROR: protobuf-5.28.3-cp38-abi3-manylinux2014_x86_64.whl is not a supported wheel on this platform.
Looking in links: /cvmfs/soft.computecanada.ca/custom/python/wheelhouse/gentoo2023/x86-64-v3, /cvmfs/soft.computecanada.ca/custom/python/wheelhouse/gentoo2023/generic, /cvmfs/soft.computecanada.ca/custom/python/wheelhouse/generic
Processing /home/aneumann/projects/def-adhaj/aneumann/GNRS/wheels/immutabledict-4.2.0-py3-none-any.whl
Installing collected packages: immutabledict
Successfully installed immutabledict-4.2.0
Looking in links: /cvmfs/soft.computecanada.ca/custom/python/wheelhouse/gentoo2023/x86-64-v3, /cvmfs/soft.computecanada.ca/custom/python/wheelhouse/gentoo2023/generic, /cvmfs/soft.computecanada.ca/custom/python/wheelhouse/generic
Processing /cvmfs/soft.computecanada.ca/custom/python/wheelhouse/generic/ortools-9.10.4067+computecanada-cp312-cp312-linux_x86_64.whl (from -r /home/aneumann/projects/def-adhaj/aneumann/GNRS/requirements/or.txt (line 1))
Processing /cvmfs/soft.computecanada.ca/custom/python/wheelhouse/gentoo2023/x86-64-v3/matplotlib-3.10.0+computecanada-cp312-cp312-linux_x86_64.whl (from -r /home/aneumann/projects/def-adhaj/aneumann/GNRS/requirements/or.txt (line 2))
Processing /cvmfs/soft.computecanada.ca/custom/python/wheelhouse/gentoo2023/x86-64-v3/pandas-2.2.3+computecanada-cp312-cp312-linux_x86_64.whl (from -r /home/aneumann/projects/def-adhaj/aneumann/GNRS/requirements/or.txt (line 3))
Processing /cvmfs/soft.computecanada.ca/custom/python/wheelhouse/generic/absl_py-2.2.2+computecanada-py3-none-any.whl (from ortools<9.11,>=9.10->-r /home/aneumann/projects/def-adhaj/aneumann/GNRS/requirements/or.txt (line 1))
Processing /cvmfs/soft.computecanada.ca/custom/python/wheelhouse/gentoo2023/generic/numpy-2.2.2+computecanada-cp312-cp312-linux_x86_64.whl (from ortools<9.11,>=9.10->-r /home/aneumann/projects/def-adhaj/aneumann/GNRS/requirements/or.txt (line 1))
Processing /cvmfs/soft.computecanada.ca/custom/python/wheelhouse/gentoo2023/x86-64-v3/protobuf-6.30.2+computecanada-cp312-cp312-linux_x86_64.whl (from ortools<9.11,>=9.10->-r /home/aneumann/projects/def-adhaj/aneumann/GNRS/requirements/or.txt (line 1))
Requirement already satisfied: immutabledict>=3.0.0 in /localscratch/aneumann.63393196.0/env/lib/python3.12/site-packages (from ortools<9.11,>=9.10->-r /home/aneumann/projects/def-adhaj/aneumann/GNRS/requirements/or.txt (line 1)) (4.2.0)
Processing /cvmfs/soft.computecanada.ca/custom/python/wheelhouse/gentoo2023/generic/contourpy-1.3.1+computecanada-cp312-cp312-linux_x86_64.whl (from matplotlib->-r /home/aneumann/projects/def-adhaj/aneumann/GNRS/requirements/or.txt (line 2))
Processing /cvmfs/soft.computecanada.ca/custom/python/wheelhouse/generic/cycler-0.12.1+computecanada-py3-none-any.whl (from matplotlib->-r /home/aneumann/projects/def-adhaj/aneumann/GNRS/requirements/or.txt (line 2))
Processing /cvmfs/soft.computecanada.ca/custom/python/wheelhouse/generic/fonttools-4.58.2+computecanada-cp312-cp312-linux_x86_64.whl (from matplotlib->-r /home/aneumann/projects/def-adhaj/aneumann/GNRS/requirements/or.txt (line 2))
Processing /cvmfs/soft.computecanada.ca/custom/python/wheelhouse/gentoo2023/x86-64-v3/kiwisolver-1.4.8+computecanada-cp312-cp312-linux_x86_64.whl (from matplotlib->-r /home/aneumann/projects/def-adhaj/aneumann/GNRS/requirements/or.txt (line 2))
Processing /cvmfs/soft.computecanada.ca/custom/python/wheelhouse/generic/packaging-25.0+computecanada-py3-none-any.whl (from matplotlib->-r /home/aneumann/projects/def-adhaj/aneumann/GNRS/requirements/or.txt (line 2))
Processing /cvmfs/soft.computecanada.ca/custom/python/wheelhouse/gentoo2023/x86-64-v3/pillow-11.1.0+computecanada-cp312-cp312-linux_x86_64.whl (from matplotlib->-r /home/aneumann/projects/def-adhaj/aneumann/GNRS/requirements/or.txt (line 2))
Processing /cvmfs/soft.computecanada.ca/custom/python/wheelhouse/generic/pyparsing-3.2.1+computecanada-py3-none-any.whl (from matplotlib->-r /home/aneumann/projects/def-adhaj/aneumann/GNRS/requirements/or.txt (line 2))
Processing /cvmfs/soft.computecanada.ca/custom/python/wheelhouse/generic/python_dateutil-2.9.0.post0+computecanada-py2.py3-none-any.whl (from matplotlib->-r /home/aneumann/projects/def-adhaj/aneumann/GNRS/requirements/or.txt (line 2))
Processing /cvmfs/soft.computecanada.ca/custom/python/wheelhouse/generic/pytz-2025.2+computecanada-py2.py3-none-any.whl (from pandas->-r /home/aneumann/projects/def-adhaj/aneumann/GNRS/requirements/or.txt (line 3))
Processing /cvmfs/soft.computecanada.ca/custom/python/wheelhouse/generic/tzdata-2025.2+computecanada-py2.py3-none-any.whl (from pandas->-r /home/aneumann/projects/def-adhaj/aneumann/GNRS/requirements/or.txt (line 3))
Processing /cvmfs/soft.computecanada.ca/custom/python/wheelhouse/generic/six-1.17.0+computecanada-py2.py3-none-any.whl (from python-dateutil>=2.7->matplotlib->-r /home/aneumann/projects/def-adhaj/aneumann/GNRS/requirements/or.txt (line 2))
Installing collected packages: pytz, tzdata, six, pyparsing, protobuf, pillow, packaging, numpy, kiwisolver, fonttools, cycler, absl-py, python-dateutil, contourpy, pandas, matplotlib, ortools

Successfully installed absl-py-2.2.2+computecanada contourpy-1.3.1+computecanada cycler-0.12.1+computecanada fonttools-4.58.2+computecanada kiwisolver-1.4.8+computecanada matplotlib-3.10.0+computecanada numpy-2.2.2+computecanada ortools-9.10.4067+computecanada packaging-25.0+computecanada pandas-2.2.3+computecanada pillow-11.1.0+computecanada protobuf-6.30.2+computecanada pyparsing-3.2.1+computecanada python-dateutil-2.9.0.post0+computecanada pytz-2025.2+computecanada six-1.17.0+computecanada tzdata-2025.2+computecanada

Starting CP-SAT solver v9.10.4067
Parameters: max_time_in_seconds: 3600 max_memory_in_mb: 12000 log_search_progress: true enumerate_all_solutions: false absolute_gap_limit: 0 relative_gap_limit: 0
Setting number of workers to 48

Initial optimization model '': (model_fingerprint: 0xcff321ade5623046)
#Variables: 265 (#ints: 8 in objective)
  - 182 Booleans in [0,1]
  - 83 in [0,444]
#kLinear1: 37
#kLinear2: 431
#kLinear3: 153
#kLinearN: 1'955 (#terms: 25'297)

Starting presolve at 0.00s
  1.29e-03s  0.00e+00d  [DetectDominanceRelations] 
  2.86e-02s  0.00e+00d  [PresolveToFixPoint] #num_loops=6 #num_dual_strengthening=3 
  2.78e-05s  0.00e+00d  [ExtractEncodingFromLinear] #potential_supersets=3 
[Symmetry] Graph for symmetry has 2'388 nodes and 17'703 arcs.
[Symmetry] Symmetry computation done. time: 0.00179824 dtime: 0.00169623
[Symmetry] #generators: 1, average support size: 20
[Symmetry] The model contains 237 duplicate constraints !
[Symmetry] 10 orbits with sizes: 2,2,2,2,2,2,2,2,2,2
[Symmetry] Num fixable by intersecting at_most_one with orbits: 1 largest_orbit: 2
  7.04e-03s  9.32e-04d  [Probe] #probed=246 #fixed_bools=3 #new_bounds=14 #equiv=1 
  5.17e-05s  0.00e+00d  [MaxClique] Merged 27(54 literals) into 12(24 literals) at_most_ones. 
  1.25e-03s  0.00e+00d  [DetectDominanceRelations] 
  1.31e-02s  0.00e+00d  [PresolveToFixPoint] #num_loops=4 #num_dual_strengthening=3 
  4.16e-03s  0.00e+00d  [ProcessAtMostOneAndLinear] 
  2.09e-03s  0.00e+00d  [DetectDuplicateConstraints] #duplicates=276 #without_enforcements=178 
  1.47e-03s  6.51e-05d  [DetectDominatedLinearConstraints] #relevant_constraints=1'420 #num_inclusions=1'071 #num_redundant=2 
  2.62e-04s  0.00e+00d  [DetectDifferentVariables] #different=30 
  3.81e-04s  1.83e-05d  [ProcessSetPPC] #relevant_constraints=965 
  2.12e-05s  0.00e+00d  [FindAlmostIdenticalLinearConstraints] 
  1.04e-04s  7.94e-05d  [FindBigAtMostOneAndLinearOverlap] 
  3.83e-03s  1.24e-03d  [FindBigVerticalLinearOverlap] #blocks=26 #saved_nz=1'831 
  1.99e-04s  4.60e-05d  [FindBigHorizontalLinearOverlap] #linears=926 
  1.08e-05s  0.00e+00d  [MergeClauses] 
  1.33e-03s  0.00e+00d  [DetectDominanceRelations] 
  1.42e-02s  0.00e+00d  [PresolveToFixPoint] #num_loops=2 #num_dual_strengthening=1 
  1.33e-03s  0.00e+00d  [DetectDominanceRelations] 
  8.76e-03s  0.00e+00d  [PresolveToFixPoint] #num_loops=1 #num_dual_strengthening=1 
[Symmetry] Graph for symmetry has 2'153 nodes and 14'684 arcs.
[Symmetry] Symmetry computation done. time: 0.000589331 dtime: 0.00082459
  6.55e-03s  9.08e-04d  [Probe] #probed=240 #new_bounds=30 
  1.09e-05s  0.00e+00d  [MaxClique] 
  1.31e-03s  0.00e+00d  [DetectDominanceRelations] 
  1.42e-02s  0.00e+00d  [PresolveToFixPoint] #num_loops=2 #num_dual_strengthening=1 
  3.44e-03s  0.00e+00d  [ProcessAtMostOneAndLinear] 
  1.80e-03s  0.00e+00d  [DetectDuplicateConstraints] #without_enforcements=231 
  8.63e-04s  3.79e-05d  [DetectDominatedLinearConstraints] #relevant_constraints=1'117 #num_inclusions=297 
  2.60e-04s  0.00e+00d  [DetectDifferentVariables] #different=37 #cliques=1 #size=3 
  3.20e-04s  1.31e-05d  [ProcessSetPPC] #relevant_constraints=791 
  3.03e-05s  6.00e-08d  [FindAlmostIdenticalLinearConstraints] #num_tested_pairs=4 
  7.29e-05s  4.61e-05d  [FindBigAtMostOneAndLinearOverlap] 
  2.84e-03s  9.82e-04d  [FindBigVerticalLinearOverlap] #blocks=16 #saved_nz=1'255 
  1.65e-04s  3.44e-05d  [FindBigHorizontalLinearOverlap] #linears=769 
  1.05e-05s  0.00e+00d  [MergeClauses] 
  1.27e-03s  0.00e+00d  [DetectDominanceRelations] 
  1.31e-02s  0.00e+00d  [PresolveToFixPoint] #num_loops=2 #num_dual_strengthening=1 
  1.26e-03s  0.00e+00d  [DetectDominanceRelations] 
  9.45e-03s  0.00e+00d  [PresolveToFixPoint] #num_loops=1 #num_dual_strengthening=1 
  6.39e-03s  8.78e-04d  [Probe] #probed=240 #new_bounds=13 
  1.12e-05s  0.00e+00d  [MaxClique] 
  1.26e-03s  0.00e+00d  [DetectDominanceRelations] 
  1.24e-02s  0.00e+00d  [PresolveToFixPoint] #num_loops=2 #num_dual_strengthening=1 
  3.12e-03s  0.00e+00d  [ProcessAtMostOneAndLinear] 
  1.78e-03s  0.00e+00d  [DetectDuplicateConstraints] #without_enforcements=233 
  6.67e-04s  2.79e-05d  [DetectDominatedLinearConstraints] #relevant_constraints=994 #num_inclusions=51 
  1.69e-04s  0.00e+00d  [DetectDifferentVariables] 
  2.84e-04s  1.06e-05d  [ProcessSetPPC] #relevant_constraints=762 
  3.19e-05s  1.90e-07d  [FindAlmostIdenticalLinearConstraints] #num_tested_pairs=12 
  6.84e-05s  3.95e-05d  [FindBigAtMostOneAndLinearOverlap] 
  1.84e-03s  7.91e-04d  [FindBigVerticalLinearOverlap] #blocks=7 #saved_nz=449 
  1.61e-04s  3.10e-05d  [FindBigHorizontalLinearOverlap] #linears=717 
  1.10e-05s  0.00e+00d  [MergeClauses] 
  1.23e-03s  0.00e+00d  [DetectDominanceRelations] 
  1.01e-02s  0.00e+00d  [PresolveToFixPoint] #num_loops=2 #num_dual_strengthening=1 
  6.13e-05s  0.00e+00d  [ExpandObjective] #entries=175 #tight_variables=66 #tight_constraints=40 

Presolve summary:
  - 51 affine relations were detected.
  - rule 'TODO dual: only one blocking constraint?' was applied 563 times.
  - rule 'TODO dual: only one unspecified blocking constraint?' was applied 104 times.
  - rule 'TODO duplicate: identical constraint with different enforcements' was applied 642 times.
  - rule 'TODO no_overlap: with task always last' was applied 1 time.
  - rule 'affine: new relation' was applied 51 times.
  - rule 'all_diff: inferred from x != y constraints' was applied 1 time.
  - rule 'at_most_one: removed literals' was applied 12 times.
  - rule 'at_most_one: size one' was applied 12 times.
  - rule 'at_most_one: transformed into max clique.' was applied 1 time.
  - rule 'deductions: 190 stored' was applied 1 time.
  - rule 'dual: fix variable' was applied 21 times.
  - rule 'dual: reduced domain' was applied 51 times.
  - rule 'duplicate: merged rhs of linear constraint' was applied 43 times.
  - rule 'duplicate: removed constraint' was applied 276 times.
  - rule 'enforcement: false literal' was applied 22 times.
  - rule 'enforcement: true literal' was applied 13 times.
  - rule 'exactly_one: x and not(x)' was applied 1 time.
  - rule 'incompatible linear: add implication' was applied 30 times.
  - rule 'linear inclusion: redundant containing constraint' was applied 2 times.
  - rule 'linear matrix: common vertical rectangle' was applied 49 times.
  - rule 'linear: always true' was applied 590 times.
  - rule 'linear: doubleton free' was applied 10 times.
  - rule 'linear: empty' was applied 28 times.
  - rule 'linear: extracted enforcement literal' was applied 4'810 times.
  - rule 'linear: fixed or dup variables' was applied 2'010 times.
  - rule 'linear: positive equal one' was applied 3 times.
  - rule 'linear: reduced variable domains' was applied 149 times.
  - rule 'linear: remapped using affine relations' was applied 1'965 times.
  - rule 'linear: simplified rhs' was applied 6'510 times.
  - rule 'linear: variable substitution 1' was applied 10 times.
  - rule 'linear: variable substitution 2' was applied 2 times.
  - rule 'presolve: 82 unused variables removed.' was applied 1 time.
  - rule 'presolve: iteration' was applied 3 times.
  - rule 'probing: reduced enforced constraint to implication.' was applied 27 times.
  - rule 'symmetry: fixed to false in general orbit' was applied 1 time.

Presolved optimization model '': (model_fingerprint: 0x597ff6be12d7ac4)
#Variables: 169 (#ints: 8 in objective)
  - 59 Booleans in [0,1]
  - 1 in [-2217,-1822][-1773,-1378][-1329,-934][-8 ... 7,842][891,1286][1335,1730][1779,2174][2223,2618]
  - 1 in [-1741,-1359][-1297,-915][-853,-471][-409,-27][35,417][479,861][923,1305]
  - 3 in [-1299,-953][-866,-509][-422,-65][22,379][466,823][910,1267][1354,1651]
  - 1 in [-1297,-915][-853,-471][-409,-27][35,417][479,861][923,1220]
  - 1 in [-1297,-915][-853,-471][-409,-27][35,417][479,861][923,1305][1367,1749][1811,2152]
  - 1 in [-855,-509][-422,-65][22,379][466,823][910,1226]
  - 1 in [-853,-471][-409,-27][35,417][479,861][923,1264]
  - 1 in [-849,-464][-446,-20][-2,364]
  - 1 in [-844,-487][-441,-43][3,401][447,845][891,1289][1335,1709]
  - 1 in [-840,-490][-441,-46][3,398][447,842][891 ... 1730][1779,2174][2223,2618][2667,3062][3111,3421]
  - 1 in [-836,-490][-441,-46][3,398][447,842][891,1286][1335,1730][1779,2174][2223,2533]
  - 2 in [-444,-87][0,357]
  - 1 in [-444,-46][0,398]
  - 3 in [-444,-18][0,426]
  - 1 in [-441,-46][3,398][447,842][891,1286][1335,1730][1779,2174]
  - 1 in [-422,-65][22,379][466,782]
  - 1 in [-422,-65][22,379][466,823][910,1226]
  - 1 in [-409,-27][35,417][479,861][923,1264]
  - 1 in [-405,-21][25,382]
  - 1 in [-405,-21][25,423][469,826]
  - 1 in [-405,-21][25,423][469,867][913,1251]
  - 1 in [-405,-20][-2,383]
  - 1 in [-400,-43][3,401][447,821]
  - 1 in [-400,-43][3,401][447,845][891,1265]
  - 1 in [-400,-43][3,401][447,845][891,1289][1335,1690]
  - 1 in [-396,-46][3,398][447,842][891,1286][1335,1730][1779,2089]
  - 1 in [-377,-46][3,398][447,842][891,1286][1335,1730][1779,2110]
  - 1 in [-2,358]
  - 1 in [-2,383]
  - 1 in [-2,399]
  - 1 in [-2,424]
  - 1 in [0,253]
  - 1 in [0,262]
  - 1 in [0,293]
  - 2 in [0,331]
  - 2 in [0,334]
  - 1 in [0,335]
  - 2 in [0,337]
  - 2 in [0,347]
  - 1 in [0,356]
  - 3 in [0,357]
  - 1 in [0,359]
  - 1 in [0,361]
  - 1 in [0,382]
  - 1 in [0,395]
  - 3 in [0,398]
  - 1 in [0,398][444,842]
  - 1 in [0,401]
  - 1 in [0,411]
  - 3 in [0,426]
  - 1 in [3,360]
  - 1 in [3,385]
  - 1 in [3,398]
  - 1 in [3,398][447,842]
  - 1 in [3,401]
  - 1 in [3,401][447,839]
  - 1 in [3,404]
  - 1 in [3,414]
  - 1 in [3,429]
  - 1 in [14,404][442,827]
  - 1 in [17,404][442,848][886,1207]
  - 1 in [19,404][447,832]
  - 1 in [22,379]
  - 1 in [25,423]
  - 1 in [30,428]
  - 1 in [35,417]
  - 1 in [35,417][479,861][923,1289]
  - 1 in [47,398][447,842][891,1269]
  - 1 in [47,398][447,842][891,1286][1335,1645]
  - 1 in [67,398][447,842][891,1286][1335,1730][1779,2089]
  - 2 in [72,433]
  - 2 in [74,433]
  - 2 in [77,433]
  - 1 in [78,439]
  - 1 in [80,439]
  - 1 in [83,439]
  - 2 in [98,433]
  - 9 in [104,433]
  - 1 in [104,439]
  - 3 in [110,439]
  - 1 in [115,444]
#kAllDiff: 1
#kExactlyOne: 2 (#literals: 6)
#kLinear2: 675 (#enforced: 618 #multi: 546)
#kLinear3: 143 (#enforced: 86)
#kLinearN: 797 (#enforced: 720) (#terms: 6'517)

Preloading model.
#Bound   0.19s best:inf   next:[115,2663] initial_domain
#Model   0.19s var:169/169 constraints:1618/1618

Starting search at 0.19s with 48 workers.
16 full problem subsolvers: [core, default_lp, lb_tree_search, max_lp, no_lp, objective_lb_search, objective_lb_search_max_lp, objective_lb_search_no_lp, objective_shaving_search_max_lp, objective_shaving_search_no_lp, probing, probing_max_lp, pseudo_costs, quick_restart, quick_restart_no_lp, reduced_costs]
30 first solution subsolvers: [fj_long_default(2), fj_long_lin_default, fj_long_lin_perturb, fj_long_lin_random, fj_long_perturb, fj_long_random, fj_short_default(2), fj_short_lin_default(2), fj_short_lin_perturb, fj_short_lin_random, fj_short_perturb, fj_short_random, fs_random(4), fs_random_no_lp(4), fs_random_quick_restart(4), fs_random_quick_restart_no_lp(3)]
13 incomplete subsolvers: [feasibility_pump, graph_arc_lns, graph_cst_lns, graph_dec_lns, graph_var_lns, rins/rens, rnd_cst_lns, rnd_var_lns, violation_ls(5)]
3 helper subsolvers: [neighborhood_helper, synchronization_agent, update_gap_integral]
#Bound   0.22s best:inf   next:[116,2663] bool_core (num_cores=1 [size:1 mw:1] a=8 d=0 fixed=0/67 clauses=22)
#Bound   0.23s best:inf   next:[140,2663] objective_lb_search_no_lp
#1       0.23s best:1013  next:[140,1012] no_lp (fixed_bools=0/86)
#2       0.23s best:904   next:[140,903]  no_lp (fixed_bools=0/104)
#3       0.24s best:719   next:[140,718]  no_lp (fixed_bools=0/113)
#4       0.24s best:709   next:[140,708]  no_lp (fixed_bools=0/115)
#5       0.24s best:706   next:[140,705]  no_lp (fixed_bools=0/119)
#6       0.25s best:664   next:[140,663]  no_lp (fixed_bools=0/122)
#7       0.25s best:646   next:[140,645]  no_lp (fixed_bools=0/127)
#Bound   0.26s best:646   next:[141,645]  objective_shaving_search_max_lp (vars=169 csts=1619)
#8       0.26s best:643   next:[141,642]  quick_restart_no_lp (fixed_bools=0/130)
#9       0.27s best:642   next:[141,641]  violation_ls(batch:2 #solutions_imported:2 #lin_moves:0 #lin_evals:5'604 #gen_moves:2'466 #gen_evals:321 #comp_moves:144 #backtracks:1'161 #weight_updates:30)
#10      0.27s best:641   next:[141,640]  violation_ls(batch:3 #solutions_imported:3 #lin_moves:0 #lin_evals:5'623 #gen_moves:2'479 #gen_evals:321 #comp_moves:147 #backtracks:1'166 #weight_updates:30)
#11      0.27s best:640   next:[141,639]  violation_ls(batch:4 #solutions_imported:4 #lin_moves:3 #lin_evals:5'642 #gen_moves:2'479 #gen_evals:321 #comp_moves:147 #backtracks:1'166 #weight_updates:32)
#12      0.27s best:639   next:[141,638]  violation_ls(batch:5 #solutions_imported:5 #lin_moves:55 #lin_evals:5'876 #gen_moves:2'479 #gen_evals:321 #comp_moves:147 #backtracks:1'166 #weight_updates:56)
#13      0.28s best:638   next:[141,637]  violation_ls(batch:6 #solutions_imported:6 #lin_moves:60 #lin_evals:5'905 #gen_moves:2'479 #gen_evals:321 #comp_moves:147 #backtracks:1'166 #weight_updates:59)
#14      0.28s best:637   next:[141,636]  violation_ls(batch:7 #solutions_imported:7 #lin_moves:102 #lin_evals:6'146 #gen_moves:2'479 #gen_evals:321 #comp_moves:147 #backtracks:1'166 #weight_updates:96)
#15      0.28s best:619   next:[141,618]  no_lp (fixed_bools=0/136)
#Bound   0.29s best:619   next:[142,618]  objective_shaving_search_max_lp (vars=169 csts=1621)
#Bound   0.31s best:619   next:[143,618]  objective_shaving_search_max_lp (vars=169 csts=1625)
#Bound   0.33s best:619   next:[144,618]  objective_shaving_search_max_lp (vars=169 csts=1627)
#Bound   0.35s best:619   next:[147,618]  objective_lb_search_no_lp
#Bound   0.35s best:619   next:[149,618]  objective_lb_search_no_lp
#Bound   0.35s best:619   next:[151,618]  objective_lb_search_no_lp
#Bound   0.35s best:619   next:[152,618]  objective_lb_search_no_lp
#Bound   0.36s best:619   next:[173,618]  objective_lb_search_no_lp
#Bound   0.36s best:619   next:[174,618]  objective_lb_search_no_lp
#Bound   0.36s best:619   next:[180,618]  objective_lb_search_no_lp
#Bound   0.36s best:619   next:[195,618]  objective_lb_search_no_lp
#Bound   0.36s best:619   next:[196,618]  objective_lb_search_no_lp
#Bound   0.39s best:619   next:[236,618]  objective_lb_search_no_lp
#16      0.39s best:616   next:[236,615]  no_lp (fixed_bools=0/157)
#17      0.46s best:611   next:[236,610]  graph_var_lns (d=0.96 s=120 t=0.10 p=1.00 stall=6 h=auto_l0)
#18      0.47s best:609   next:[236,608]  violation_ls(batch:3 #solutions_imported:3 #lin_moves:9'443 #lin_evals:63'859 #gen_moves:9'145 #gen_evals:1'197 #comp_moves:539 #backtracks:4'301 #weight_updates:629)
#19      0.48s best:607   next:[236,606]  violation_ls(batch:4 #solutions_imported:4 #lin_moves:9'443 #lin_evals:63'911 #gen_moves:9'170 #gen_evals:1'199 #comp_moves:540 #backtracks:4'313 #weight_updates:629)
#Bound   0.49s best:607   next:[237,606]  objective_lb_search_no_lp
#Bound   0.49s best:607   next:[251,606]  objective_lb_search_no_lp
#20      0.51s best:569   next:[251,568]  rnd_cst_lns (d=0.91 s=159 t=0.10 p=1.00 stall=4 h=auto_l0)
#21      0.52s best:568   next:[251,567]  violation_ls(batch:11 #solutions_imported:10 #lin_moves:13'077 #lin_evals:94'904 #gen_moves:2'549 #gen_evals:323 #comp_moves:151 #backtracks:1'199 #weight_updates:7'327)
#22      0.52s best:543   next:[251,542]  quick_restart_no_lp (fixed_bools=4/181)
#Bound   0.52s best:543   next:[320,542]  objective_lb_search_no_lp
#Bound   0.60s best:543   next:[322,542]  objective_lb_search_no_lp
#23      0.80s best:540   next:[332,539]  no_lp (fixed_bools=1/191)
#Bound   0.74s best:543   next:[332,542]  objective_lb_search_no_lp [skipped_logs=1]
#Bound   1.85s best:540   next:[372,539]  objective_lb_search_no_lp [skipped_logs=7]
#24      2.20s best:532   next:[376,531]  graph_var_lns (d=0.99 s=227 t=0.10 p=1.00 stall=0 h=auto_l0)
#25      2.21s best:530   next:[376,529]  violation_ls(batch:17 #solutions_imported:6 #lin_moves:43'204 #lin_evals:491'431 #gen_moves:75'285 #gen_evals:8'847 #comp_moves:2'304 #backtracks:36'475 #weight_updates:17'224)
#26      2.22s best:528   next:[376,527]  violation_ls(batch:18 #solutions_imported:7 #lin_moves:43'205 #lin_evals:491'439 #gen_moves:75'285 #gen_evals:8'847 #comp_moves:2'304 #backtracks:36'475 #weight_updates:17'224)
#27      2.22s best:526   next:[376,525]  violation_ls(batch:19 #solutions_imported:8 #lin_moves:43'205 #lin_evals:491'442 #gen_moves:75'286 #gen_evals:8'847 #comp_moves:2'305 #backtracks:36'475 #weight_updates:17'224)
#28      2.22s best:524   next:[376,523]  violation_ls(batch:20 #solutions_imported:9 #lin_moves:43'206 #lin_evals:491'450 #gen_moves:75'286 #gen_evals:8'847 #comp_moves:2'305 #backtracks:36'475 #weight_updates:17'224)
#Bound   2.74s best:524   next:[387,523]  objective_lb_search_no_lp [skipped_logs=4]
#Bound   3.79s best:524   next:[393,523]  objective_lb_search_no_lp [skipped_logs=1]
#Bound   4.43s best:524   next:[395,523]  objective_lb_search_no_lp [skipped_logs=0]
#Bound   5.93s best:524   next:[410,523]  objective_lb_search_no_lp [skipped_logs=4]
#Bound   6.38s best:524   next:[418,523]  objective_lb_search_no_lp [skipped_logs=2]
#Bound   7.55s best:524   next:[420,523]  objective_lb_search_no_lp [skipped_logs=1]
#Bound   8.84s best:524   next:[424,523]  objective_lb_search_no_lp [skipped_logs=3]
#Bound  10.03s best:524   next:[425,523]  objective_shaving_search_no_lp (vars=183 csts=1430)
#Bound  10.68s best:524   next:[426,523]  objective_lb_search [skipped_logs=0]
#Bound  12.10s best:524   next:[429,523]  objective_lb_search
#Bound  12.94s best:524   next:[431,523]  objective_lb_search_no_lp [skipped_logs=0]
#Bound  14.11s best:524   next:[432,523]  objective_shaving_search_no_lp (vars=185 csts=1432)
#Bound  14.92s best:524   next:[433,523]  objective_lb_search_no_lp [skipped_logs=0]
#Bound  15.89s best:524   next:[437,523]  objective_lb_search_no_lp [skipped_logs=2]
#Bound  17.43s best:524   next:[439,523]  objective_lb_search_no_lp
#Bound  17.79s best:524   next:[448,523]  objective_lb_search_no_lp [skipped_logs=3]
#Bound  18.29s best:524   next:[453,523]  objective_lb_search_no_lp [skipped_logs=0]
#Bound  19.85s best:524   next:[466,523]  objective_lb_search_no_lp [skipped_logs=4]
#Model  20.71s var:168/169 constraints:1379/1618
#Bound  21.00s best:524   next:[468,523]  objective_lb_search_no_lp [skipped_logs=0]
#Model  21.86s var:166/169 constraints:1307/1618
#Bound  21.92s best:524   next:[496,523]  objective_lb_search_no_lp [skipped_logs=2]
#Model  22.09s var:162/169 constraints:1205/1618
#Model  22.11s var:160/169 constraints:1176/1618
#Model  22.27s var:159/169 constraints:1167/1618
#Model  22.34s var:149/169 constraints:780/1618
#Done   22.37s no_lp
#Done   22.37s quick_restart_no_lp
#Model  22.37s var:139/169 constraints:529/1618
#Done   22.37s core
#Model  22.37s var:138/169 constraints:497/1618
#Done   22.38s probing
#Model  22.38s var:134/169 constraints:361/1618
#Bound  22.29s best:524   next:[503,523]  objective_lb_search_no_lp [skipped_logs=1]

Task timing                                  n [     min,      max]      avg      dev     time         n [     min,      max]      avg      dev    dtime
                             'core':         1 [  22.18s,   22.18s]   22.18s   0.00ns   22.18s         1 [   6.67s,    6.67s]    6.67s   0.00ns    6.67s
                       'default_lp':         1 [  22.18s,   22.18s]   22.18s   0.00ns   22.18s         1 [   1.65s,    1.65s]    1.65s   0.00ns    1.65s
                 'feasibility_pump':       113 [ 17.60ms, 262.74ms]  80.83ms  34.20ms    9.13s       112 [  4.87ms,  13.29ms]   7.13ms 622.41us 798.59ms
                  'fj_long_default':         1 [153.04ms, 153.04ms] 153.04ms   0.00ns 153.04ms         1 [ 65.73ms,  65.73ms]  65.73ms   0.00ns  65.73ms
                  'fj_long_default':         1 [169.02ms, 169.02ms] 169.02ms   0.00ns 169.02ms         1 [ 72.68ms,  72.68ms]  72.68ms   0.00ns  72.68ms
              'fj_long_lin_default':         1 [118.03ms, 118.03ms] 118.03ms   0.00ns 118.03ms         1 [ 70.20ms,  70.20ms]  70.20ms   0.00ns  70.20ms
              'fj_long_lin_perturb':         1 [144.62ms, 144.62ms] 144.62ms   0.00ns 144.62ms         1 [ 81.95ms,  81.95ms]  81.95ms   0.00ns  81.95ms
               'fj_long_lin_random':         1 [162.09ms, 162.09ms] 162.09ms   0.00ns 162.09ms         1 [ 94.55ms,  94.55ms]  94.55ms   0.00ns  94.55ms
                  'fj_long_perturb':         1 [122.71ms, 122.71ms] 122.71ms   0.00ns 122.71ms         1 [ 72.68ms,  72.68ms]  72.68ms   0.00ns  72.68ms
                   'fj_long_random':         1 [157.72ms, 157.72ms] 157.72ms   0.00ns 157.72ms         1 [ 70.46ms,  70.46ms]  70.46ms   0.00ns  70.46ms
                 'fj_short_default':         1 [120.72ms, 120.72ms] 120.72ms   0.00ns 120.72ms         1 [ 75.64ms,  75.64ms]  75.64ms   0.00ns  75.64ms
                 'fj_short_default':         1 [186.44ms, 186.44ms] 186.44ms   0.00ns 186.44ms         1 [ 92.25ms,  92.25ms]  92.25ms   0.00ns  92.25ms
             'fj_short_lin_default':         1 [127.54ms, 127.54ms] 127.54ms   0.00ns 127.54ms         1 [ 72.45ms,  72.45ms]  72.45ms   0.00ns  72.45ms
             'fj_short_lin_default':         1 [152.92ms, 152.92ms] 152.92ms   0.00ns 152.92ms         1 [ 72.85ms,  72.85ms]  72.85ms   0.00ns  72.85ms
             'fj_short_lin_perturb':         1 [182.54ms, 182.54ms] 182.54ms   0.00ns 182.54ms         1 [ 66.08ms,  66.08ms]  66.08ms   0.00ns  66.08ms
              'fj_short_lin_random':         1 [124.80ms, 124.80ms] 124.80ms   0.00ns 124.80ms         1 [ 73.76ms,  73.76ms]  73.76ms   0.00ns  73.76ms
                 'fj_short_perturb':         1 [163.47ms, 163.47ms] 163.47ms   0.00ns 163.47ms         1 [ 73.92ms,  73.92ms]  73.92ms   0.00ns  73.92ms
                  'fj_short_random':         1 [125.13ms, 125.13ms] 125.13ms   0.00ns 125.13ms         1 [ 71.14ms,  71.14ms]  71.14ms   0.00ns  71.14ms
                        'fs_random':         1 [ 30.87ms,  30.87ms]  30.87ms   0.00ns  30.87ms         1 [ 20.00ns,  20.00ns]  20.00ns   0.00ns  20.00ns
                        'fs_random':         1 [ 31.85ms,  31.85ms]  31.85ms   0.00ns  31.85ms         1 [576.00ns, 576.00ns] 576.00ns   0.00ns 576.00ns
                        'fs_random':         1 [ 31.86ms,  31.86ms]  31.86ms   0.00ns  31.86ms         1 [ 20.00ns,  20.00ns]  20.00ns   0.00ns  20.00ns
                        'fs_random':         1 [ 32.79ms,  32.79ms]  32.79ms   0.00ns  32.79ms         1 [  1.92us,   1.92us]   1.92us   0.00ns   1.92us
                  'fs_random_no_lp':         1 [ 28.63ms,  28.63ms]  28.63ms   0.00ns  28.63ms         1 [ 41.40us,  41.40us]  41.40us   0.00ns  41.40us
                  'fs_random_no_lp':         1 [ 29.51ms,  29.51ms]  29.51ms   0.00ns  29.51ms         1 [ 56.74us,  56.74us]  56.74us   0.00ns  56.74us
                  'fs_random_no_lp':         1 [ 32.53ms,  32.53ms]  32.53ms   0.00ns  32.53ms         1 [100.74us, 100.74us] 100.74us   0.00ns 100.74us
                  'fs_random_no_lp':         1 [ 33.61ms,  33.61ms]  33.61ms   0.00ns  33.61ms         1 [142.75us, 142.75us] 142.75us   0.00ns 142.75us
          'fs_random_quick_restart':         1 [ 31.08ms,  31.08ms]  31.08ms   0.00ns  31.08ms         1 [ 20.00ns,  20.00ns]  20.00ns   0.00ns  20.00ns
          'fs_random_quick_restart':         1 [ 31.66ms,  31.66ms]  31.66ms   0.00ns  31.66ms         1 [ 20.00ns,  20.00ns]  20.00ns   0.00ns  20.00ns
          'fs_random_quick_restart':         1 [ 32.60ms,  32.60ms]  32.60ms   0.00ns  32.60ms         1 [ 20.00ns,  20.00ns]  20.00ns   0.00ns  20.00ns
          'fs_random_quick_restart':         1 [ 33.17ms,  33.17ms]  33.17ms   0.00ns  33.17ms         1 [ 20.00ns,  20.00ns]  20.00ns   0.00ns  20.00ns
    'fs_random_quick_restart_no_lp':         1 [ 29.09ms,  29.09ms]  29.09ms   0.00ns  29.09ms         1 [ 62.01us,  62.01us]  62.01us   0.00ns  62.01us
    'fs_random_quick_restart_no_lp':         1 [ 30.07ms,  30.07ms]  30.07ms   0.00ns  30.07ms         1 [131.65us, 131.65us] 131.65us   0.00ns 131.65us
    'fs_random_quick_restart_no_lp':         1 [ 32.81ms,  32.81ms]  32.81ms   0.00ns  32.81ms         1 [113.61us, 113.61us] 113.61us   0.00ns 113.61us
                    'graph_arc_lns':       112 [  3.58ms,    2.90s] 819.27ms 617.41ms    1.53m       107 [ 10.00ns, 195.74ms]  62.65ms  44.62ms    6.70s
                    'graph_cst_lns':       112 [  1.36ms,    2.61s] 513.66ms 676.03ms   57.53s        63 [ 10.00ns, 286.83ms]  60.97ms  50.85ms    3.84s
                    'graph_dec_lns':       112 [  4.86ms,    2.30s] 816.75ms 576.04ms    1.52m       111 [ 10.00ns, 103.30ms]  61.00ms  42.16ms    6.77s
                    'graph_var_lns':       112 [  4.36ms,    2.15s] 818.44ms 573.08ms    1.53m       107 [ 10.00ns, 219.81ms]  62.22ms  44.51ms    6.66s
                   'lb_tree_search':         1 [  22.18s,   22.18s]   22.18s   0.00ns   22.18s         1 [   4.31s,    4.31s]    4.31s   0.00ns    4.31s
                           'max_lp':         1 [  22.18s,   22.18s]   22.18s   0.00ns   22.18s         1 [   3.39s,    3.39s]    3.39s   0.00ns    3.39s
                            'no_lp':         1 [  22.17s,   22.17s]   22.17s   0.00ns   22.17s         1 [   3.06s,    3.06s]    3.06s   0.00ns    3.06s
              'objective_lb_search':         1 [  22.18s,   22.18s]   22.18s   0.00ns   22.18s         1 [   3.09s,    3.09s]    3.09s   0.00ns    3.09s
       'objective_lb_search_max_lp':         1 [  22.17s,   22.17s]   22.17s   0.00ns   22.17s         1 [   4.43s,    4.43s]    4.43s   0.00ns    4.43s
        'objective_lb_search_no_lp':         1 [  22.18s,   22.18s]   22.18s   0.00ns   22.18s         1 [   1.88s,    1.88s]    1.88s   0.00ns    1.88s
  'objective_shaving_search_max_lp':        65 [ 14.36ms,    1.55s] 334.67ms 363.81ms   21.75s        49 [746.44us, 233.57ms]  31.48ms  47.66ms    1.54s
   'objective_shaving_search_no_lp':        67 [ 11.60ms,    1.53s] 326.54ms 357.84ms   21.88s        49 [716.79us, 117.14ms]  26.28ms  34.16ms    1.29s
                          'probing':         1 [  22.18s,   22.18s]   22.18s   0.00ns   22.18s         1 [   1.21s,    1.21s]    1.21s   0.00ns    1.21s
                   'probing_max_lp':         1 [  22.19s,   22.19s]   22.19s   0.00ns   22.19s         1 [   1.55s,    1.55s]    1.55s   0.00ns    1.55s
                     'pseudo_costs':         1 [  22.18s,   22.18s]   22.18s   0.00ns   22.18s         1 [   4.23s,    4.23s]    4.23s   0.00ns    4.23s
                    'quick_restart':         1 [  22.18s,   22.18s]   22.18s   0.00ns   22.18s         1 [   3.41s,    3.41s]    3.41s   0.00ns    3.41s
              'quick_restart_no_lp':         1 [  22.18s,   22.18s]   22.18s   0.00ns   22.18s         1 [   2.30s,    2.30s]    2.30s   0.00ns    2.30s
                    'reduced_costs':         1 [  22.18s,   22.18s]   22.18s   0.00ns   22.18s         1 [   3.15s,    3.15s]    3.15s   0.00ns    3.15s
                        'rins/rens':       113 [137.22us,    2.51s] 763.55ms 597.44ms    1.44m        98 [ 10.00ns, 155.42ms]  73.74ms  39.00ms    7.23s
                      'rnd_cst_lns':       112 [  1.38ms,    2.71s] 785.26ms 643.36ms    1.47m       102 [ 10.00ns, 213.70ms]  59.62ms  44.17ms    6.08s
                      'rnd_var_lns':       112 [  3.76ms,    2.96s] 820.21ms 648.73ms    1.53m       107 [ 10.00ns, 247.78ms]  62.04ms  45.23ms    6.64s
                     'violation_ls':       111 [ 75.59ms, 817.70ms] 177.75ms  99.15ms   19.73s       111 [ 22.90ms, 115.82ms]  64.92ms   8.75ms    7.21s
                     'violation_ls':       112 [  9.77ms, 471.58ms] 153.54ms  65.19ms   17.20s       112 [  3.81ms,  72.29ms]  63.42ms   7.61ms    7.10s
                     'violation_ls':       112 [221.57us, 551.86ms] 165.32ms  93.91ms   18.52s       112 [390.00ns,  82.26ms]  65.84ms  14.52ms    7.37s
                     'violation_ls':       113 [230.61us, 579.48ms] 155.30ms  92.98ms   17.55s       113 [  2.29us, 137.67ms]  75.60ms  29.30ms    8.54s
                     'violation_ls':       113 [281.92us, 725.51ms] 187.94ms  97.08ms   21.24s       113 [  1.14us, 100.58ms]  63.78ms  12.79ms    7.21s

Search stats                        Bools  Conflicts  Branches  Restarts  BoolPropag  IntegerPropag
                           'core':  1'551     17'468    71'491    16'257  10'229'528      5'471'227
                     'default_lp':     59      6'275    25'731     3'822     120'113      2'942'496
                      'fs_random':     59          0       118       118          12          1'662
                      'fs_random':     59          0       118       118          12          1'662
                      'fs_random':     59          0       118       118          12          1'662
                      'fs_random':     59          0       118       118          12          1'662
                'fs_random_no_lp':     59          0       129       118          14          2'037
                'fs_random_no_lp':     59          0       134       118          14          1'879
                'fs_random_no_lp':     59          0       146       118          13          2'247
                'fs_random_no_lp':     59          2       134       118          16          1'846
        'fs_random_quick_restart':     59          0       118       118          12          1'662
        'fs_random_quick_restart':     59          0       118       118          12          1'662
        'fs_random_quick_restart':     59          0       118       118          12          1'662
        'fs_random_quick_restart':     59          0       118       118          12          1'662
  'fs_random_quick_restart_no_lp':     59          0       134       118          12          1'879
  'fs_random_quick_restart_no_lp':     59          0       138       118          13          2'205
  'fs_random_quick_restart_no_lp':     59          0       148       118          14          2'129
                 'lb_tree_search':     59        161    26'880     3'110      42'658      1'241'118
                         'max_lp':     59      4'419    37'744     7'527     151'569      3'412'430
                          'no_lp':    500     26'172    60'018     6'352   3'262'724      9'967'718
            'objective_lb_search':    118      8'621    42'921     7'547     247'491      4'807'677
     'objective_lb_search_max_lp':     98      4'350    28'446     7'902     121'515      2'611'866
      'objective_lb_search_no_lp':    325     18'481    44'366     5'191   1'033'957      7'355'544
                        'probing':    279        128       746       654       5'168         26'948
                 'probing_max_lp':    261        109       413       413       4'029         20'123
                   'pseudo_costs':     59      5'662    47'755     9'196     178'569      4'247'927
                  'quick_restart':    283      3'680    56'442    12'328     655'243      3'808'654
            'quick_restart_no_lp':    683     12'372    72'976     8'397   1'702'293      6'361'838
                  'reduced_costs':    877      5'842    47'272     7'447   2'692'342      3'545'354

SAT stats                           ClassicMinim  LitRemoved  LitLearned  LitForgotten  Subsumed  MClauses  MDecisions  MLitTrue  MSubsumed  MLitRemoved  MReused
                           'core':        13'545      40'558     103'639             0       522     7'683      39'348         0        503        2'461      221
                     'default_lp':         2'811       5'197      67'489             0       422     1'786      16'575         0        417        2'693      440
                      'fs_random':             0           0           0             0         0         0           0         0          0            0        0
                      'fs_random':             0           0           0             0         0         0           0         0          0            0        0
                      'fs_random':             0           0           0             0         0         0           0         0          0            0        0
                      'fs_random':             0           0           0             0         0         0           0         0          0            0        0
                'fs_random_no_lp':             0           0           0             0         0         0           0         0          0            0        0
                'fs_random_no_lp':             0           0           0             0         0         0           0         0          0            0        0
                'fs_random_no_lp':             0           0           0             0         0         0           0         0          0            0        0
                'fs_random_no_lp':             0           0           7             0         0         0           0         0          0            0        0
        'fs_random_quick_restart':             0           0           0             0         0         0           0         0          0            0        0
        'fs_random_quick_restart':             0           0           0             0         0         0           0         0          0            0        0
        'fs_random_quick_restart':             0           0           0             0         0         0           0         0          0            0        0
        'fs_random_quick_restart':             0           0           0             0         0         0           0         0          0            0        0
  'fs_random_quick_restart_no_lp':             0           0           0             0         0         0           0         0          0            0        0
  'fs_random_quick_restart_no_lp':             0           0           0             0         0         0           0         0          0            0        0
  'fs_random_quick_restart_no_lp':             0           0           0             0         0         0           0         0          0            0        0
                 'lb_tree_search':            23          29         971             0         3     1'035       5'504         0         19           83       88
                         'max_lp':         2'249       4'208      41'336             0       354     3'286      29'555         0        455        2'642      856
                          'no_lp':        20'318      65'640     296'838        86'300       565     2'814      21'861        11        997        6'460      350
            'objective_lb_search':         5'934      13'664      69'457             0       442     3'570      29'622         1        859        5'166      776
     'objective_lb_search_max_lp':         2'655       5'451      37'130             0       264     2'226      16'591         1        177        1'048      444
      'objective_lb_search_no_lp':        14'512      42'191     136'243         4'422       519     2'528      18'824         0      1'036        5'853      454
                        'probing':             0           0         128             0         0         0           0         0          0            0        0
                 'probing_max_lp':             0           0         109             0         0         0           0         0          0            0        0
                   'pseudo_costs':         2'739       5'247      59'193             0       403     4'088      37'602         0        476        2'868    1'099
                  'quick_restart':         2'049       4'438      35'838             0       227     4'298      38'605         0        659        3'837      787
            'quick_restart_no_lp':         7'996      23'936     122'489             0       450     4'090      39'270        27      1'526        9'914      543
                  'reduced_costs':         3'750      11'568      59'170             0       143     3'657      27'976         6      1'036        6'120      991

Lp stats                         Component  Iterations  AddedCuts  OPTIMAL  DUAL_F.  DUAL_U.
                  'default_lp':          1      37'967      3'486    7'523        0        0
                   'fs_random':          1           0          0        0        0        0
                   'fs_random':          1           0          0        0        0        0
                   'fs_random':          1          52          0        2        0        0
                   'fs_random':          1          52         50        3        0        0
     'fs_random_quick_restart':          1           0          0        0        0        0
     'fs_random_quick_restart':          1           0          0        0        0        0
     'fs_random_quick_restart':          1           0          0        0        0        0
     'fs_random_quick_restart':          1           0          0        0        0        0
              'lb_tree_search':          1     149'093      3'938   11'716    3'371        0
                      'max_lp':          1      79'418      5'216    5'941    1'431        3
         'objective_lb_search':          1      73'181      4'584   10'987        0        0
  'objective_lb_search_max_lp':          1     110'604      4'847    6'661    1'785        2
                     'probing':          1      11'540      7'444    2'845        0        0
              'probing_max_lp':          1       8'772      6'075    1'559       43        0
                'pseudo_costs':          1     100'528      5'884    8'147    1'851        1
               'quick_restart':          1      57'805      6'516    8'038        0        0
               'reduced_costs':          1      55'075      6'951    7'100    1'028        0

Lp dimension                                                                     Final dimension of first component
                  'default_lp':  304 rows, 162 columns, 1246 entries with magnitude in [1.890666e-03, 1.000000e+00]
                   'fs_random':       0 rows, 162 columns, 0 entries with magnitude in [0.000000e+00, 0.000000e+00]
                   'fs_random':       0 rows, 162 columns, 0 entries with magnitude in [0.000000e+00, 0.000000e+00]
                   'fs_random':    52 rows, 162 columns, 205 entries with magnitude in [1.061191e-01, 1.000000e+00]
                   'fs_random':    53 rows, 162 columns, 209 entries with magnitude in [4.745790e-02, 1.000000e+00]
     'fs_random_quick_restart':       0 rows, 162 columns, 0 entries with magnitude in [0.000000e+00, 0.000000e+00]
     'fs_random_quick_restart':       0 rows, 162 columns, 0 entries with magnitude in [0.000000e+00, 0.000000e+00]
     'fs_random_quick_restart':       0 rows, 162 columns, 0 entries with magnitude in [0.000000e+00, 0.000000e+00]
     'fs_random_quick_restart':       0 rows, 162 columns, 0 entries with magnitude in [0.000000e+00, 0.000000e+00]
              'lb_tree_search':  354 rows, 169 columns, 1456 entries with magnitude in [2.828456e-03, 1.000000e+00]
                      'max_lp':  550 rows, 169 columns, 2252 entries with magnitude in [1.419613e-03, 1.000000e+00]
         'objective_lb_search':   367 rows, 162 columns, 921 entries with magnitude in [9.738390e-03, 1.000000e+00]
  'objective_lb_search_max_lp':  714 rows, 169 columns, 2992 entries with magnitude in [8.843483e-04, 1.000000e+00]
                     'probing':   635 rows, 162 columns, 864 entries with magnitude in [2.079779e-04, 1.000000e+00]
              'probing_max_lp':  619 rows, 169 columns, 4887 entries with magnitude in [5.379225e-04, 1.000000e+00]
                'pseudo_costs':  370 rows, 169 columns, 1451 entries with magnitude in [1.199098e-03, 1.000000e+00]
               'quick_restart':  532 rows, 162 columns, 2654 entries with magnitude in [2.333800e-04, 1.000000e+00]
               'reduced_costs':  558 rows, 169 columns, 2320 entries with magnitude in [1.153063e-03, 1.000000e+00]

Lp debug                         CutPropag  CutEqPropag  Adjust  Overflow      Bad  BadScaling
                  'default_lp':          5           15   4'781         0   29'996           0
                   'fs_random':          0            0       0         0        0           0
                   'fs_random':          0            0       0         0        0           0
                   'fs_random':          0            0       0         0        0           0
                   'fs_random':          0            0       0         0        0           0
     'fs_random_quick_restart':          0            0       0         0        0           0
     'fs_random_quick_restart':          0            0       0         0        0           0
     'fs_random_quick_restart':          0            0       0         0        0           0
     'fs_random_quick_restart':          0            0       0         0        0           0
              'lb_tree_search':         10            1   8'119         0   12'789           0
                      'max_lp':         32           23   5'789         0   32'915           0
         'objective_lb_search':         13           10   7'353         0   48'063           0
  'objective_lb_search_max_lp':         41           16   5'480         0   45'042           0
                     'probing':          5          135   1'931         0  611'434           0
              'probing_max_lp':         19           20     996         0  418'196           0
                'pseudo_costs':         26            3   6'041         0   41'813           0
               'quick_restart':         15            7   3'610         0   78'484           0
               'reduced_costs':         38           39   5'951         0   51'148           0

Lp pool                          Constraints  Updates  Simplif  Merged  Shortened  Split  Strenghtened     Cuts/Call
                  'default_lp':        3'654      817    7'628      25      1'205  1'866         2'778   3'486/8'271
                   'fs_random':          193        0        0       0          0      0            11           0/0
                   'fs_random':          193        0        0       0          0      0            11           0/0
                   'fs_random':          193        0        0       0          0      0            11           0/0
                   'fs_random':          243        0        0       0          0      0            11         50/50
     'fs_random_quick_restart':          193        0        0       0          0      0            11           0/0
     'fs_random_quick_restart':          193        0        0       0          0      0            11           0/0
     'fs_random_quick_restart':          193        0        0       0          0      0            11           0/0
     'fs_random_quick_restart':          193        0        0       0          0      0            11           0/0
              'lb_tree_search':        5'529      448   17'437      26          0    260        21'552   3'938/9'914
                      'max_lp':        6'769      908   51'595      64      3'897  1'136        33'936  5'216/11'388
         'objective_lb_search':        4'759    1'037   18'090      18      5'522  4'085         5'237  4'584/12'684
  'objective_lb_search_max_lp':        6'438    1'138   42'923      26      3'815  1'493        36'843  4'847/11'641
                     'probing':        7'622    1'176   14'223      15      6'960  6'324         3'235  7'444/15'101
              'probing_max_lp':        7'689      882   39'739       3          0  3'120        16'332  6'075/14'338
                'pseudo_costs':        7'438      858   35'034      63        566  2'249        32'418  5'884/13'585
               'quick_restart':        6'682    1'219   19'365      27          0  9'869         3'423  6'516/15'060
               'reduced_costs':        8'466    1'080   52'220     102      1'383  1'845        40'049  6'951/15'607

Lp Cut            fs_ran  defaul  max_lp  quick_  reduce  pseudo  lb_tre  probin  object  probin  object
          CG_FF:       -     198     339     291     357     220     338     241     238     229     201
           CG_K:       -     135     237     206     251     209     189     155     181     219     145
           CG_R:       -     321     409     609     497     311     242     808     398     488     299
          CG_RB:       -     665     870   1'230   1'032     651     821   1'352     881     818     638
         CG_RBP:       -      91     100     142      98      53      86     232      95      90      44
         Clique:       -       -      36       -      38      29      23       -       -      17      41
             IB:      50     429     283     500     419     449     324     451     482     149     383
       MIR_1_FF:       -     120     211     240     263     252     160     255     161     182     205
        MIR_1_K:       -      26      37      34      80      63      20      27      22      22      38
       MIR_1_KL:       -       1       -       1       -       1       -       2       -       -       -
        MIR_1_R:       -      28      48      58      54      38      20      73      58      48      35
       MIR_1_RB:       -     212     407     463     565     523     303     483     277     360     390
      MIR_1_RBP:       -      15      90      19     103     115      87      20      13      54      68
      MIR_1_RLT:       -       -       -       -       1       2       2       -       -       1       1
       MIR_2_FF:       -      74     103     148     165     174      73     177      87     118     138
        MIR_2_K:       -      17      29      26      55      36      19      31      21      23      37
       MIR_2_KL:       -       1       2      10       3       1       2       5       7       1       2
        MIR_2_R:       -      30      57      88     103     104      46     102      42      98      91
       MIR_2_RB:       -     150     242     375     386     368     165     373     216     231     248
      MIR_2_RBP:       -      21      44      39      72      81      44      33      17      34      56
       MIR_3_FF:       -      42      77      91     134     142      68     112      57      81      91
        MIR_3_K:       -      14      19      22      36      38      18      26      21      20      20
       MIR_3_KL:       -       4       -       -       1       4       -       3       1       1       1
        MIR_3_R:       -      29      68      71     105     103      29     100      41      75      78
       MIR_3_RB:       -     105     145     256     252     257     103     263     155     125     160
      MIR_3_RBP:       -      15      39      37      66      56      25      28      16      20      39
       MIR_4_FF:       -      37      59      65      83      64      29      54      43      49      61
        MIR_4_K:       -      15      23      17      25      26       7      12      14      18      14
       MIR_4_KL:       -       -       1       2       2       2       1       2       3       1       1
        MIR_4_R:       -      27      61      59      62      59      21      63      43      53      58
       MIR_4_RB:       -      72     109     168     155     145      52     184     116      82      94
      MIR_4_RBP:       -      12      23      18      30      33      16      16      12      13      23
       MIR_5_FF:       -      23      57      32      60      47      20      47      30      36      37
        MIR_5_K:       -       6      22      15      24      16       9      14      10      12      18
       MIR_5_KL:       -       3       2       -       1       1       -       1       2       -       1
        MIR_5_R:       -      27      50      45      45      37      16      39      25      27      28
       MIR_5_RB:       -      65      77     105      97      96      38     117      89      53      47
      MIR_5_RBP:       -      13      19       8      18      20       7       9      11       6      12
       MIR_6_FF:       -      12      21      29      26      26      16      39      23      14       9
        MIR_6_K:       -       3       5       8      16      12       6      12      11       5       5
       MIR_6_KL:       -       1       -       1       -       2       -       -       -       -       -
        MIR_6_R:       -      17      15      25      26      20      14      25      15      14      11
       MIR_6_RB:       -      24      37      52      56      51      20      60      51      25      31
      MIR_6_RBP:       -       3       6       4       9       2       4       3       4       2       2
   ZERO_HALF_FF:       -      36      62      56      67      56      48      60      54      32      48
    ZERO_HALF_K:       -      13      17      14      36      18      15      15      16      15      22
    ZERO_HALF_R:       -     248     470     650     758     674     274   1'102     402   1'958     712
   ZERO_HALF_RB:       -      68     159     165     190     167     100     177     111     140     132
  ZERO_HALF_RBP:       -      18      29      22      29      30      18      41      12      16      32

LNS stats           Improv/Calls  Closed  Difficulty  TimeLimit
  'graph_arc_lns':         8/112     52%        0.96       0.10
  'graph_cst_lns':          0/67     52%        0.96       0.10
  'graph_dec_lns':         4/112     51%        0.97       0.10
  'graph_var_lns':        12/112     54%        0.99       0.10
      'rins/rens':        20/111     46%        0.77       0.10
    'rnd_cst_lns':         5/106     53%        0.97       0.10
    'rnd_var_lns':         9/112     53%        0.98       0.10

LS stats                   Batches  Restarts   LinMoves  GenMoves  CompoundMoves  WeightUpdates
       'fj_long_default':        1         1      9'579         0              0            421
       'fj_long_default':        1         1      9'606         0              0            394
   'fj_long_lin_default':        1         1          0     3'494            441              3
   'fj_long_lin_perturb':        1         1      8'351         0              0          1'649
    'fj_long_lin_random':        1         1      8'135         0              0          1'865
       'fj_long_perturb':        1         1          0     3'461            499              2
        'fj_long_random':        1         1      9'588         0              0            412
      'fj_short_default':        1         1          0     3'774            364              2
      'fj_short_default':        1         1      7'923         0              0          2'077
  'fj_short_lin_default':        1         1          0     3'112            256              1
  'fj_short_lin_default':        1         1          0     3'662            685              5
  'fj_short_lin_perturb':        1         1      9'569         0              0            431
   'fj_short_lin_random':        1         1          0     3'067            358              2
      'fj_short_perturb':        1         1      9'606         0              0            394
       'fj_short_random':        1         1          0     3'183            552              2
          'violation_ls':      111         0    976'295    45'978          1'299         77'845
          'violation_ls':      112         0    111'328   523'734         44'349         10'445
          'violation_ls':      112         0     43'206   602'077         14'369         18'626
          'violation_ls':      113         0  1'024'121     9'170            540         68'293
          'violation_ls':      113         0    681'920    59'772          3'785        252'545

Solutions (28)            Num     Rank
        'graph_var_lns':    2  [17,24]
                'no_lp':   10   [1,23]
  'quick_restart_no_lp':    2   [8,22]
          'rnd_cst_lns':    1  [20,20]
         'violation_ls':   13   [9,28]

Objective bounds                      Num
                        'bool_core':    1
                   'initial_domain':    1
              'objective_lb_search':    3
        'objective_lb_search_no_lp':   66
  'objective_shaving_search_max_lp':    4
   'objective_shaving_search_no_lp':    4

Solution repositories    Added  Queried  Ignored  Synchro
  'feasible solutions':    714    2'211       12      684
        'lp solutions':    271       44        0      234
                'pump':  2'341       69

Improving bounds shared          Num
                        'core':  129
                  'default_lp':   33
              'lb_tree_search':   10
                      'max_lp':  100
                       'no_lp':  424
         'objective_lb_search':   75
  'objective_lb_search_max_lp':   51
   'objective_lb_search_no_lp':   53
                     'probing':  264
              'probing_max_lp':   67
                'pseudo_costs':   52
               'quick_restart':  139
         'quick_restart_no_lp':  732
               'reduced_costs':  121

Clauses shared                   Num
                        'core':    5
                  'default_lp':    5
                      'max_lp':   31
                       'no_lp':   34
         'objective_lb_search':   31
  'objective_lb_search_max_lp':   23
   'objective_lb_search_no_lp':    3
         'quick_restart_no_lp':   21
               'reduced_costs':    4

CpSolverResponse summary:
status: OPTIMAL
objective: 524
best_bound: 524
integers: 163
booleans: 59
conflicts: 0
branches: 138
propagations: 13
integer_propagations: 2205
restarts: 118
lp_iterations: 0
walltime: 22.4109
usertime: 22.4109
deterministic_time: 130.467
gap_integral: 406.215
solution_fingerprint: 0x6e47280974a2958d


--- Simulation Gantt  partir du modle mathmatique ---
{'big':1, 'due_date':109, 'pos_time':5, 'status':0, 'blocked':0, 'operations':["{'type':0, 'processing_time':35}"]}
{'big':1, 'due_date':85, 'pos_time':5, 'status':0, 'blocked':0, 'operations':["{'type':1, 'processing_time':41}"]}
{'big':0, 'due_date':191, 'pos_time':5, 'status':0, 'blocked':0, 'operations':["{'type':1, 'processing_time':21}", "{'type':0, 'processing_time':11}"]}
{'big':0, 'due_date':151, 'pos_time':5, 'status':0, 'blocked':0, 'operations':["{'type':0, 'processing_time':13}", "{'type':1, 'processing_time':60}"]}
{'big':1, 'due_date':88, 'pos_time':5, 'status':0, 'blocked':0, 'operations':["{'type':1, 'processing_time':25}"]}
{'big':1, 'due_date':182, 'pos_time':5, 'status':0, 'blocked':0, 'operations':["{'type':0, 'processing_time':26}", "{'type':1, 'processing_time':22}"]}
{'big':0, 'due_date':83, 'pos_time':5, 'status':0, 'blocked':0, 'operations':["{'type':0, 'processing_time':10}"]}
