created virtual environment CPython3.12.4.final.0-64 in 4980ms
  creator CPython3Posix(dest=/localscratch/aneumann.63393184.0/env, clear=False, no_vcs_ignore=False, global=False)
  seeder FromAppData(download=False, pip=bundle, via=copy, app_data_dir=/home/aneumann/.local/share/virtualenv)
    added seed packages: pip==25.1.1
  activators BashActivator,CShellActivator,FishActivator,NushellActivator,PowerShellActivator,PythonActivator
Looking in links: /cvmfs/soft.computecanada.ca/custom/python/wheelhouse/gentoo2023/x86-64-v3, /cvmfs/soft.computecanada.ca/custom/python/wheelhouse/gentoo2023/generic, /cvmfs/soft.computecanada.ca/custom/python/wheelhouse/generic
Requirement already satisfied: pip in /localscratch/aneumann.63393184.0/env/lib/python3.12/site-packages (25.1.1)
Looking in links: /cvmfs/soft.computecanada.ca/custom/python/wheelhouse/gentoo2023/x86-64-v3, /cvmfs/soft.computecanada.ca/custom/python/wheelhouse/gentoo2023/generic, /cvmfs/soft.computecanada.ca/custom/python/wheelhouse/generic
ERROR: protobuf-5.28.3-cp38-abi3-manylinux2014_x86_64.whl is not a supported wheel on this platform.
Looking in links: /cvmfs/soft.computecanada.ca/custom/python/wheelhouse/gentoo2023/x86-64-v3, /cvmfs/soft.computecanada.ca/custom/python/wheelhouse/gentoo2023/generic, /cvmfs/soft.computecanada.ca/custom/python/wheelhouse/generic
Processing /home/aneumann/projects/def-adhaj/aneumann/GNRS/wheels/immutabledict-4.2.0-py3-none-any.whl
Installing collected packages: immutabledict
Successfully installed immutabledict-4.2.0
Looking in links: /cvmfs/soft.computecanada.ca/custom/python/wheelhouse/gentoo2023/x86-64-v3, /cvmfs/soft.computecanada.ca/custom/python/wheelhouse/gentoo2023/generic, /cvmfs/soft.computecanada.ca/custom/python/wheelhouse/generic
Processing /cvmfs/soft.computecanada.ca/custom/python/wheelhouse/generic/ortools-9.10.4067+computecanada-cp312-cp312-linux_x86_64.whl (from -r /home/aneumann/projects/def-adhaj/aneumann/GNRS/requirements/or.txt (line 1))
Processing /cvmfs/soft.computecanada.ca/custom/python/wheelhouse/gentoo2023/x86-64-v3/matplotlib-3.10.0+computecanada-cp312-cp312-linux_x86_64.whl (from -r /home/aneumann/projects/def-adhaj/aneumann/GNRS/requirements/or.txt (line 2))
Processing /cvmfs/soft.computecanada.ca/custom/python/wheelhouse/gentoo2023/x86-64-v3/pandas-2.2.3+computecanada-cp312-cp312-linux_x86_64.whl (from -r /home/aneumann/projects/def-adhaj/aneumann/GNRS/requirements/or.txt (line 3))
Processing /cvmfs/soft.computecanada.ca/custom/python/wheelhouse/generic/absl_py-2.2.2+computecanada-py3-none-any.whl (from ortools<9.11,>=9.10->-r /home/aneumann/projects/def-adhaj/aneumann/GNRS/requirements/or.txt (line 1))
Processing /cvmfs/soft.computecanada.ca/custom/python/wheelhouse/gentoo2023/generic/numpy-2.2.2+computecanada-cp312-cp312-linux_x86_64.whl (from ortools<9.11,>=9.10->-r /home/aneumann/projects/def-adhaj/aneumann/GNRS/requirements/or.txt (line 1))
Processing /cvmfs/soft.computecanada.ca/custom/python/wheelhouse/gentoo2023/x86-64-v3/protobuf-6.30.2+computecanada-cp312-cp312-linux_x86_64.whl (from ortools<9.11,>=9.10->-r /home/aneumann/projects/def-adhaj/aneumann/GNRS/requirements/or.txt (line 1))
Requirement already satisfied: immutabledict>=3.0.0 in /localscratch/aneumann.63393184.0/env/lib/python3.12/site-packages (from ortools<9.11,>=9.10->-r /home/aneumann/projects/def-adhaj/aneumann/GNRS/requirements/or.txt (line 1)) (4.2.0)
Processing /cvmfs/soft.computecanada.ca/custom/python/wheelhouse/gentoo2023/generic/contourpy-1.3.1+computecanada-cp312-cp312-linux_x86_64.whl (from matplotlib->-r /home/aneumann/projects/def-adhaj/aneumann/GNRS/requirements/or.txt (line 2))
Processing /cvmfs/soft.computecanada.ca/custom/python/wheelhouse/generic/cycler-0.12.1+computecanada-py3-none-any.whl (from matplotlib->-r /home/aneumann/projects/def-adhaj/aneumann/GNRS/requirements/or.txt (line 2))
Processing /cvmfs/soft.computecanada.ca/custom/python/wheelhouse/generic/fonttools-4.58.2+computecanada-cp312-cp312-linux_x86_64.whl (from matplotlib->-r /home/aneumann/projects/def-adhaj/aneumann/GNRS/requirements/or.txt (line 2))
Processing /cvmfs/soft.computecanada.ca/custom/python/wheelhouse/gentoo2023/x86-64-v3/kiwisolver-1.4.8+computecanada-cp312-cp312-linux_x86_64.whl (from matplotlib->-r /home/aneumann/projects/def-adhaj/aneumann/GNRS/requirements/or.txt (line 2))
Processing /cvmfs/soft.computecanada.ca/custom/python/wheelhouse/generic/packaging-25.0+computecanada-py3-none-any.whl (from matplotlib->-r /home/aneumann/projects/def-adhaj/aneumann/GNRS/requirements/or.txt (line 2))
Processing /cvmfs/soft.computecanada.ca/custom/python/wheelhouse/gentoo2023/x86-64-v3/pillow-11.1.0+computecanada-cp312-cp312-linux_x86_64.whl (from matplotlib->-r /home/aneumann/projects/def-adhaj/aneumann/GNRS/requirements/or.txt (line 2))
Processing /cvmfs/soft.computecanada.ca/custom/python/wheelhouse/generic/pyparsing-3.2.1+computecanada-py3-none-any.whl (from matplotlib->-r /home/aneumann/projects/def-adhaj/aneumann/GNRS/requirements/or.txt (line 2))
Processing /cvmfs/soft.computecanada.ca/custom/python/wheelhouse/generic/python_dateutil-2.9.0.post0+computecanada-py2.py3-none-any.whl (from matplotlib->-r /home/aneumann/projects/def-adhaj/aneumann/GNRS/requirements/or.txt (line 2))
Processing /cvmfs/soft.computecanada.ca/custom/python/wheelhouse/generic/pytz-2025.2+computecanada-py2.py3-none-any.whl (from pandas->-r /home/aneumann/projects/def-adhaj/aneumann/GNRS/requirements/or.txt (line 3))
Processing /cvmfs/soft.computecanada.ca/custom/python/wheelhouse/generic/tzdata-2025.2+computecanada-py2.py3-none-any.whl (from pandas->-r /home/aneumann/projects/def-adhaj/aneumann/GNRS/requirements/or.txt (line 3))
Processing /cvmfs/soft.computecanada.ca/custom/python/wheelhouse/generic/six-1.17.0+computecanada-py2.py3-none-any.whl (from python-dateutil>=2.7->matplotlib->-r /home/aneumann/projects/def-adhaj/aneumann/GNRS/requirements/or.txt (line 2))
Installing collected packages: pytz, tzdata, six, pyparsing, protobuf, pillow, packaging, numpy, kiwisolver, fonttools, cycler, absl-py, python-dateutil, contourpy, pandas, matplotlib, ortools

Successfully installed absl-py-2.2.2+computecanada contourpy-1.3.1+computecanada cycler-0.12.1+computecanada fonttools-4.58.2+computecanada kiwisolver-1.4.8+computecanada matplotlib-3.10.0+computecanada numpy-2.2.2+computecanada ortools-9.10.4067+computecanada packaging-25.0+computecanada pandas-2.2.3+computecanada pillow-11.1.0+computecanada protobuf-6.30.2+computecanada pyparsing-3.2.1+computecanada python-dateutil-2.9.0.post0+computecanada pytz-2025.2+computecanada six-1.17.0+computecanada tzdata-2025.2+computecanada

Starting CP-SAT solver v9.10.4067
Parameters: max_time_in_seconds: 3600 max_memory_in_mb: 12000 log_search_progress: true enumerate_all_solutions: false absolute_gap_limit: 0 relative_gap_limit: 0
Setting number of workers to 48

Initial optimization model '': (model_fingerprint: 0x19a278d238ffc347)
#Variables: 166 (#ints: 6 in objective)
  - 107 Booleans in [0,1]
  - 59 in [0,424]
#kLinear1: 26
#kLinear2: 211
#kLinear3: 79
#kLinearN: 675 (#terms: 6'361)

Starting presolve at 0.00s
  2.36e-04s  0.00e+00d  [DetectDominanceRelations] 
  8.68e-03s  0.00e+00d  [PresolveToFixPoint] #num_loops=6 #num_dual_strengthening=3 
  1.69e-05s  0.00e+00d  [ExtractEncodingFromLinear] #potential_supersets=2 
[Symmetry] Graph for symmetry has 831 nodes and 3'150 arcs.
[Symmetry] Symmetry computation done. time: 0.000482182 dtime: 0.00034131
[Symmetry] #generators: 1, average support size: 14
[Symmetry] The model contains 105 duplicate constraints !
[Symmetry] 7 orbits with sizes: 2,2,2,2,2,2,2
[Symmetry] Num fixable by intersecting at_most_one with orbits: 1 largest_orbit: 2
  1.61e-03s  1.32e-04d  [Probe] #probed=128 #fixed_bools=2 #new_bounds=7 #equiv=1 
  3.06e-05s  0.00e+00d  [MaxClique] Merged 7(14 literals) into 6(12 literals) at_most_ones. 
  2.16e-04s  0.00e+00d  [DetectDominanceRelations] 
  3.05e-03s  0.00e+00d  [PresolveToFixPoint] #num_loops=4 #num_dual_strengthening=3 
  6.69e-04s  0.00e+00d  [ProcessAtMostOneAndLinear] 
  5.66e-04s  0.00e+00d  [DetectDuplicateConstraints] #duplicates=123 #without_enforcements=43 
  1.74e-04s  5.53e-06d  [DetectDominatedLinearConstraints] #relevant_constraints=273 #num_inclusions=55 #num_redundant=2 
  1.29e-04s  0.00e+00d  [DetectDifferentVariables] #different=20 
  7.16e-05s  1.96e-06d  [ProcessSetPPC] #relevant_constraints=160 
  1.01e-05s  0.00e+00d  [FindAlmostIdenticalLinearConstraints] 
  2.44e-05s  7.48e-06d  [FindBigAtMostOneAndLinearOverlap] 
  4.29e-04s  1.34e-04d  [FindBigVerticalLinearOverlap] #blocks=2 #saved_nz=87 
  4.41e-05s  5.98e-06d  [FindBigHorizontalLinearOverlap] #linears=158 
  5.01e-06s  0.00e+00d  [MergeClauses] 
  2.05e-04s  0.00e+00d  [DetectDominanceRelations] 
  2.36e-03s  0.00e+00d  [PresolveToFixPoint] #num_loops=2 #num_dual_strengthening=1 
  2.01e-04s  0.00e+00d  [DetectDominanceRelations] 
  1.90e-03s  0.00e+00d  [PresolveToFixPoint] #num_loops=1 #num_dual_strengthening=1 
[Symmetry] Graph for symmetry has 686 nodes and 2'615 arcs.
[Symmetry] Symmetry computation done. time: 0.000146997 dtime: 0.00016859
  1.37e-03s  1.30e-04d  [Probe] #probed=124 #new_bounds=13 
  5.04e-06s  0.00e+00d  [MaxClique] 
  2.04e-04s  0.00e+00d  [DetectDominanceRelations] 
  3.20e-03s  0.00e+00d  [PresolveToFixPoint] #num_loops=2 #num_dual_strengthening=1 
  5.87e-04s  0.00e+00d  [ProcessAtMostOneAndLinear] 
  4.32e-04s  0.00e+00d  [DetectDuplicateConstraints] #without_enforcements=51 
  1.50e-04s  4.70e-06d  [DetectDominatedLinearConstraints] #relevant_constraints=259 #num_inclusions=37 
  1.11e-04s  0.00e+00d  [DetectDifferentVariables] #different=20 
  6.69e-05s  1.63e-06d  [ProcessSetPPC] #relevant_constraints=145 
  1.13e-05s  0.00e+00d  [FindAlmostIdenticalLinearConstraints] 
  2.00e-05s  6.60e-06d  [FindBigAtMostOneAndLinearOverlap] 
  3.78e-04s  1.20e-04d  [FindBigVerticalLinearOverlap] #blocks=1 #saved_nz=39 
  3.71e-05s  5.26e-06d  [FindBigHorizontalLinearOverlap] #linears=143 
  4.63e-06s  0.00e+00d  [MergeClauses] 
  2.06e-04s  0.00e+00d  [DetectDominanceRelations] 
  2.29e-03s  0.00e+00d  [PresolveToFixPoint] #num_loops=2 #num_dual_strengthening=1 
  2.05e-04s  0.00e+00d  [DetectDominanceRelations] 
  1.91e-03s  0.00e+00d  [PresolveToFixPoint] #num_loops=1 #num_dual_strengthening=1 
[Symmetry] Graph for symmetry has 687 nodes and 2'575 arcs.
[Symmetry] Symmetry computation done. time: 0.000149974 dtime: 0.00016603
  1.31e-03s  1.26e-04d  [Probe] #probed=124 
  5.04e-06s  0.00e+00d  [MaxClique] 
  2.06e-04s  0.00e+00d  [DetectDominanceRelations] 
  1.94e-03s  0.00e+00d  [PresolveToFixPoint] #num_loops=1 #num_dual_strengthening=1 
  5.86e-04s  0.00e+00d  [ProcessAtMostOneAndLinear] 
  4.32e-04s  0.00e+00d  [DetectDuplicateConstraints] #without_enforcements=51 
  1.48e-04s  4.55e-06d  [DetectDominatedLinearConstraints] #relevant_constraints=260 #num_inclusions=35 
  1.11e-04s  0.00e+00d  [DetectDifferentVariables] #different=20 
  6.51e-05s  1.54e-06d  [ProcessSetPPC] #relevant_constraints=144 
  1.19e-05s  0.00e+00d  [FindAlmostIdenticalLinearConstraints] 
  2.02e-05s  6.60e-06d  [FindBigAtMostOneAndLinearOverlap] 
  3.63e-04s  1.19e-04d  [FindBigVerticalLinearOverlap] #blocks=1 #saved_nz=32 
  3.50e-05s  5.09e-06d  [FindBigHorizontalLinearOverlap] #linears=143 
  4.57e-06s  0.00e+00d  [MergeClauses] 
  2.07e-04s  0.00e+00d  [DetectDominanceRelations] 
  2.20e-03s  0.00e+00d  [PresolveToFixPoint] #num_loops=2 #num_dual_strengthening=1 
  2.41e-05s  0.00e+00d  [ExpandObjective] #entries=16 #tight_variables=8 #tight_constraints=4 

Presolve summary:
  - 25 affine relations were detected.
  - rule 'TODO dual: only one blocking constraint?' was applied 352 times.
  - rule 'TODO dual: only one unspecified blocking constraint?' was applied 78 times.
  - rule 'TODO duplicate: identical constraint with different enforcements' was applied 145 times.
  - rule 'affine: new relation' was applied 25 times.
  - rule 'at_most_one: removed literals' was applied 6 times.
  - rule 'at_most_one: size one' was applied 6 times.
  - rule 'at_most_one: transformed into max clique.' was applied 1 time.
  - rule 'deductions: 76 stored' was applied 1 time.
  - rule 'dual: fix variable' was applied 15 times.
  - rule 'dual: reduced domain' was applied 35 times.
  - rule 'duplicate: merged rhs of linear constraint' was applied 22 times.
  - rule 'duplicate: removed constraint' was applied 123 times.
  - rule 'enforcement: false literal' was applied 14 times.
  - rule 'enforcement: true literal' was applied 8 times.
  - rule 'exactly_one: x and not(x)' was applied 1 time.
  - rule 'incompatible linear: add implication' was applied 18 times.
  - rule 'linear inclusion: redundant containing constraint' was applied 2 times.
  - rule 'linear matrix: common vertical rectangle' was applied 4 times.
  - rule 'linear: always true' was applied 396 times.
  - rule 'linear: doubleton free' was applied 7 times.
  - rule 'linear: empty' was applied 20 times.
  - rule 'linear: extracted enforcement literal' was applied 930 times.
  - rule 'linear: fixed or dup variables' was applied 703 times.
  - rule 'linear: positive equal one' was applied 2 times.
  - rule 'linear: reduced variable domains' was applied 69 times.
  - rule 'linear: remapped using affine relations' was applied 624 times.
  - rule 'linear: simplified rhs' was applied 1'778 times.
  - rule 'linear: variable substitution 1' was applied 7 times.
  - rule 'presolve: 59 unused variables removed.' was applied 1 time.
  - rule 'presolve: iteration' was applied 3 times.
  - rule 'probing: reduced enforced constraint to implication.' was applied 7 times.
  - rule 'symmetry: fixed to false in general orbit' was applied 1 time.

Presolved optimization model '': (model_fingerprint: 0x7f6114234839fcba)
#Variables: 79 (#ints: 6 in objective)
  - 30 Booleans in [0,1]
  - 1 in [-358,-25][3,399][427,823]
  - 1 in [0,249]
  - 2 in [0,253]
  - 2 in [0,254]
  - 2 in [0,256]
  - 1 in [0,314]
  - 1 in [0,320]
  - 1 in [0,321]
  - 1 in [0,322]
  - 1 in [0,328]
  - 3 in [0,336]
  - 1 in [0,358]
  - 1 in [0,359]
  - 3 in [0,396]
  - 1 in [3,324]
  - 1 in [3,339]
  - 1 in [3,361]
  - 1 in [3,361][427,785]
  - 1 in [3,362]
  - 1 in [3,399]
  - 1 in [3,399][427,823]
  - 1 in [41,377]
  - 1 in [54,375]
  - 1 in [70,361][427,785][851,1142]
  - 2 in [85,413]
  - 2 in [91,413]
  - 1 in [91,419]
  - 2 in [93,413]
  - 1 in [97,419]
  - 3 in [99,413]
  - 1 in [99,419]
  - 1 in [105,419]
  - 3 in [157,413]
  - 1 in [163,419]
  - 1 in [168,424]
#kExactlyOne: 1 (#literals: 3)
#kLinear2: 170 (#enforced: 139 #multi: 115)
#kLinear3: 68 (#enforced: 53 #multi: 25)
#kLinearN: 162 (#enforced: 122) (#terms: 1'094)

Preloading model.
#Bound   0.04s best:inf   next:[168,1957] initial_domain
[Symmetry] Graph for symmetry has 599 nodes and 2'544 arcs.
[Symmetry] Symmetry computation done. time: 0.000139076 dtime: 0.00015928
#Model   0.04s var:79/79 constraints:401/401

Starting search at 0.04s with 48 workers.
16 full problem subsolvers: [core, default_lp, lb_tree_search, max_lp, no_lp, objective_lb_search, objective_lb_search_max_lp, objective_lb_search_no_lp, objective_shaving_search_max_lp, objective_shaving_search_no_lp, probing, probing_max_lp, pseudo_costs, quick_restart, quick_restart_no_lp, reduced_costs]
30 first solution subsolvers: [fj_long_default(2), fj_long_lin_default, fj_long_lin_perturb, fj_long_lin_random, fj_long_perturb, fj_long_random, fj_short_default(2), fj_short_lin_default(2), fj_short_lin_perturb, fj_short_lin_random, fj_short_perturb, fj_short_random, fs_random(4), fs_random_no_lp(4), fs_random_quick_restart(4), fs_random_quick_restart_no_lp(3)]
13 incomplete subsolvers: [feasibility_pump, graph_arc_lns, graph_cst_lns, graph_dec_lns, graph_var_lns, rins/rens, rnd_cst_lns, rnd_var_lns, violation_ls(5)]
3 helper subsolvers: [neighborhood_helper, synchronization_agent, update_gap_integral]
#Bound   0.05s best:inf   next:[169,1957] bool_core (num_cores=1 [size:2 mw:1 d:1] a=5 d=1 fixed=0/36 clauses=2)
#Bound   0.05s best:inf   next:[170,1957] bool_core (num_cores=1 [cover] a=5 d=1 fixed=0/39 clauses=3)
#Bound   0.05s best:inf   next:[171,1957] bool_core (num_cores=1 [cover] a=5 d=1 fixed=1/42 clauses=5)
#Bound   0.05s best:inf   next:[172,1957] bool_core (num_cores=1 [cover] a=5 d=1 fixed=2/45 clauses=8)
#Bound   0.05s best:inf   next:[173,1957] bool_core (num_cores=1 [cover] a=5 d=1 fixed=3/48 clauses=12)
#Bound   0.05s best:inf   next:[174,1957] bool_core (num_cores=1 [cover] a=5 d=1 fixed=4/51 clauses=17)
#Bound   0.05s best:inf   next:[175,1957] bool_core (num_cores=1 [cover] a=5 d=1 fixed=5/54 clauses=23)
#Bound   0.05s best:inf   next:[176,1957] bool_core (num_cores=1 [cover] a=5 d=1 fixed=6/57 clauses=30)
#Bound   0.05s best:inf   next:[177,1957] bool_core (num_cores=1 [cover] a=5 d=1 fixed=7/60 clauses=38)
#Bound   0.05s best:inf   next:[178,1957] bool_core (num_cores=1 [cover] a=5 d=1 fixed=8/63 clauses=47)
#Bound   0.05s best:inf   next:[179,1957] bool_core (num_cores=1 [cover] a=5 d=1 fixed=9/66 clauses=57)
#Bound   0.05s best:inf   next:[180,1957] bool_core (num_cores=1 [cover] a=5 d=1 fixed=10/69 clauses=68)
#Bound   0.05s best:inf   next:[181,1957] bool_core (num_cores=1 [cover] a=5 d=1 fixed=11/72 clauses=80)
#Bound   0.05s best:inf   next:[182,1957] bool_core (num_cores=1 [cover] a=5 d=1 fixed=12/75 clauses=93)
#Bound   0.05s best:inf   next:[183,1957] bool_core (num_cores=1 [cover] a=5 d=1 fixed=13/78 clauses=107)
#Bound   0.05s best:inf   next:[184,1957] bool_core (num_cores=1 [cover] a=5 d=1 fixed=14/81 clauses=122)
#Bound   0.05s best:inf   next:[185,1957] bool_core (num_cores=1 [cover] a=5 d=1 fixed=15/84 clauses=138)
#Bound   0.05s best:inf   next:[186,1957] bool_core (num_cores=1 [cover] a=5 d=1 fixed=16/87 clauses=155)
#Bound   0.05s best:inf   next:[187,1957] bool_core (num_cores=1 [cover] a=5 d=1 fixed=17/90 clauses=173)
#Bound   0.05s best:inf   next:[188,1957] bool_core (num_cores=1 [cover] a=5 d=1 fixed=18/93 clauses=192)
#1       0.05s best:843   next:[197,842]  fs_random_no_lp (fixed_bools=0/45)
#2       0.05s best:749   next:[248,748]  no_lp (fixed_bools=0/56)
#3       0.05s best:707   next:[248,706]  no_lp (fixed_bools=0/58)
#4       0.06s best:706   next:[331,705]  violation_ls(batch:1 #solutions_imported:1 #lin_moves:0 #lin_evals:10 #gen_moves:4 #gen_evals:0 #comp_moves:4 #backtracks:0 #weight_updates:0)
#5       0.06s best:705   next:[331,704]  violation_ls(batch:1 #solutions_imported:1 #lin_moves:0 #lin_evals:2 #gen_moves:1 #gen_evals:0 #comp_moves:1 #backtracks:0 #weight_updates:0)
#6       0.06s best:704   next:[331,703]  violation_ls(batch:1 #solutions_imported:1 #lin_moves:0 #lin_evals:7 #gen_moves:3 #gen_evals:0 #comp_moves:3 #backtracks:0 #weight_updates:0)
#7       0.06s best:670   next:[331,669]  no_lp (fixed_bools=0/60)
#8       0.06s best:665   next:[333,664]  graph_arc_lns (d=0.50 s=35 t=0.10 p=0.00 stall=0 h=auto_l0) [presolve]
#9       0.06s best:647   next:[333,646]  quick_restart_no_lp (fixed_bools=1/96)
#10      0.06s best:646   next:[333,645]  violation_ls(batch:2 #solutions_imported:2 #lin_moves:0 #lin_evals:18 #gen_moves:9 #gen_evals:0 #comp_moves:9 #backtracks:0 #weight_updates:0)
#11      0.06s best:645   next:[333,644]  violation_ls(batch:2 #solutions_imported:2 #lin_moves:4 #lin_evals:45 #gen_moves:11 #gen_evals:0 #comp_moves:5 #backtracks:3 #weight_updates:3)
#12      0.06s best:643   next:[333,642]  violation_ls(batch:2 #solutions_imported:2 #lin_moves:1 #lin_evals:8 #gen_moves:1 #gen_evals:0 #comp_moves:1 #backtracks:0 #weight_updates:0)
#13      0.06s best:642   next:[333,641]  violation_ls(batch:2 #solutions_imported:2 #lin_moves:9 #lin_evals:52 #gen_moves:3 #gen_evals:0 #comp_moves:3 #backtracks:0 #weight_updates:4)
#14      0.06s best:641   next:[333,640]  violation_ls(batch:3 #solutions_imported:3 #lin_moves:9 #lin_evals:70 #gen_moves:11 #gen_evals:0 #comp_moves:5 #backtracks:3 #weight_updates:7)
#15      0.07s best:548   next:[333,547]  rins_pump_lns (d=0.50 s=41 t=0.10 p=0.00 stall=0 h=auto_l0)
#16      0.07s best:540   next:[333,539]  quick_restart_no_lp (fixed_bools=3/115)
#17      0.07s best:538   next:[334,537]  violation_ls(batch:4 #solutions_imported:4 #lin_moves:12 #lin_evals:74 #gen_moves:9 #gen_evals:0 #comp_moves:9 #backtracks:0 #weight_updates:6)
#18      0.07s best:537   next:[334,536]  violation_ls(batch:4 #solutions_imported:4 #lin_moves:10 #lin_evals:75 #gen_moves:11 #gen_evals:0 #comp_moves:5 #backtracks:3 #weight_updates:7)
#19      0.08s best:522   next:[383,521]  graph_dec_lns (d=0.81 s=66 t=0.10 p=1.00 stall=0 h=auto_l0)
#20      0.08s best:488   next:[443,487]  no_lp (fixed_bools=1/80)
#Model   0.08s var:78/79 constraints:348/401
#Model   0.09s var:76/79 constraints:307/401
#Model   0.09s var:71/79 constraints:227/401
#Done    0.10s quick_restart_no_lp
#Done    0.10s objective_lb_search_no_lp
#Done    0.10s objective_lb_search
#Model   0.11s var:63/79 constraints:108/401
#Bound   0.10s best:488   next:[472,487]  objective_lb_search_no_lp [skipped_logs=35]

Task timing                                  n [     min,      max]      avg      dev     time         n [     min,      max]      avg      dev    dtime
                             'core':         1 [ 61.06ms,  61.06ms]  61.06ms   0.00ns  61.06ms         1 [ 33.82ms,  33.82ms]  33.82ms   0.00ns  33.82ms
                       'default_lp':         1 [ 60.18ms,  60.18ms]  60.18ms   0.00ns  60.18ms         1 [  2.40ms,   2.40ms]   2.40ms   0.00ns   2.40ms
                 'feasibility_pump':         5 [783.41us,  12.19ms]   8.91ms   4.11ms  44.54ms         4 [  1.39ms,   1.83ms]   1.52ms 179.03us   6.07ms
                  'fj_long_default':         0 [  0.00ns,   0.00ns]   0.00ns   0.00ns   0.00ns         0 [  0.00ns,   0.00ns]   0.00ns   0.00ns   0.00ns
                  'fj_long_default':         0 [  0.00ns,   0.00ns]   0.00ns   0.00ns   0.00ns         0 [  0.00ns,   0.00ns]   0.00ns   0.00ns   0.00ns
              'fj_long_lin_default':         0 [  0.00ns,   0.00ns]   0.00ns   0.00ns   0.00ns         0 [  0.00ns,   0.00ns]   0.00ns   0.00ns   0.00ns
              'fj_long_lin_perturb':         0 [  0.00ns,   0.00ns]   0.00ns   0.00ns   0.00ns         0 [  0.00ns,   0.00ns]   0.00ns   0.00ns   0.00ns
               'fj_long_lin_random':         0 [  0.00ns,   0.00ns]   0.00ns   0.00ns   0.00ns         0 [  0.00ns,   0.00ns]   0.00ns   0.00ns   0.00ns
                  'fj_long_perturb':         0 [  0.00ns,   0.00ns]   0.00ns   0.00ns   0.00ns         0 [  0.00ns,   0.00ns]   0.00ns   0.00ns   0.00ns
                   'fj_long_random':         0 [  0.00ns,   0.00ns]   0.00ns   0.00ns   0.00ns         0 [  0.00ns,   0.00ns]   0.00ns   0.00ns   0.00ns
                 'fj_short_default':         0 [  0.00ns,   0.00ns]   0.00ns   0.00ns   0.00ns         0 [  0.00ns,   0.00ns]   0.00ns   0.00ns   0.00ns
                 'fj_short_default':         0 [  0.00ns,   0.00ns]   0.00ns   0.00ns   0.00ns         0 [  0.00ns,   0.00ns]   0.00ns   0.00ns   0.00ns
             'fj_short_lin_default':         0 [  0.00ns,   0.00ns]   0.00ns   0.00ns   0.00ns         0 [  0.00ns,   0.00ns]   0.00ns   0.00ns   0.00ns
             'fj_short_lin_default':         0 [  0.00ns,   0.00ns]   0.00ns   0.00ns   0.00ns         0 [  0.00ns,   0.00ns]   0.00ns   0.00ns   0.00ns
             'fj_short_lin_perturb':         0 [  0.00ns,   0.00ns]   0.00ns   0.00ns   0.00ns         0 [  0.00ns,   0.00ns]   0.00ns   0.00ns   0.00ns
              'fj_short_lin_random':         0 [  0.00ns,   0.00ns]   0.00ns   0.00ns   0.00ns         0 [  0.00ns,   0.00ns]   0.00ns   0.00ns   0.00ns
                 'fj_short_perturb':         0 [  0.00ns,   0.00ns]   0.00ns   0.00ns   0.00ns         0 [  0.00ns,   0.00ns]   0.00ns   0.00ns   0.00ns
                  'fj_short_random':         0 [  0.00ns,   0.00ns]   0.00ns   0.00ns   0.00ns         0 [  0.00ns,   0.00ns]   0.00ns   0.00ns   0.00ns
                        'fs_random':         0 [  0.00ns,   0.00ns]   0.00ns   0.00ns   0.00ns         0 [  0.00ns,   0.00ns]   0.00ns   0.00ns   0.00ns
                        'fs_random':         1 [  2.45ms,   2.45ms]   2.45ms   0.00ns   2.45ms         1 [ 20.00ns,  20.00ns]  20.00ns   0.00ns  20.00ns
                        'fs_random':         1 [  3.58ms,   3.58ms]   3.58ms   0.00ns   3.58ms         1 [418.00ns, 418.00ns] 418.00ns   0.00ns 418.00ns
                        'fs_random':         1 [  4.09ms,   4.09ms]   4.09ms   0.00ns   4.09ms         1 [418.00ns, 418.00ns] 418.00ns   0.00ns 418.00ns
                  'fs_random_no_lp':         0 [  0.00ns,   0.00ns]   0.00ns   0.00ns   0.00ns         0 [  0.00ns,   0.00ns]   0.00ns   0.00ns   0.00ns
                  'fs_random_no_lp':         0 [  0.00ns,   0.00ns]   0.00ns   0.00ns   0.00ns         0 [  0.00ns,   0.00ns]   0.00ns   0.00ns   0.00ns
                  'fs_random_no_lp':         1 [  2.90ms,   2.90ms]   2.90ms   0.00ns   2.90ms         1 [ 32.35us,  32.35us]  32.35us   0.00ns  32.35us
                  'fs_random_no_lp':         1 [  3.71ms,   3.71ms]   3.71ms   0.00ns   3.71ms         1 [ 68.11us,  68.11us]  68.11us   0.00ns  68.11us
          'fs_random_quick_restart':         0 [  0.00ns,   0.00ns]   0.00ns   0.00ns   0.00ns         0 [  0.00ns,   0.00ns]   0.00ns   0.00ns   0.00ns
          'fs_random_quick_restart':         1 [  2.07ms,   2.07ms]   2.07ms   0.00ns   2.07ms         1 [ 20.00ns,  20.00ns]  20.00ns   0.00ns  20.00ns
          'fs_random_quick_restart':         1 [  4.62ms,   4.62ms]   4.62ms   0.00ns   4.62ms         1 [ 20.00ns,  20.00ns]  20.00ns   0.00ns  20.00ns
          'fs_random_quick_restart':         1 [  5.15ms,   5.15ms]   5.15ms   0.00ns   5.15ms         1 [ 20.00ns,  20.00ns]  20.00ns   0.00ns  20.00ns
    'fs_random_quick_restart_no_lp':         0 [  0.00ns,   0.00ns]   0.00ns   0.00ns   0.00ns         0 [  0.00ns,   0.00ns]   0.00ns   0.00ns   0.00ns
    'fs_random_quick_restart_no_lp':         1 [  2.57ms,   2.57ms]   2.57ms   0.00ns   2.57ms         1 [ 22.63us,  22.63us]  22.63us   0.00ns  22.63us
    'fs_random_quick_restart_no_lp':         1 [  3.56ms,   3.56ms]   3.56ms   0.00ns   3.56ms         1 [ 46.94us,  46.94us]  46.94us   0.00ns  46.94us
                    'graph_arc_lns':         5 [  1.39ms,  18.59ms]   6.88ms   6.33ms  34.39ms         5 [ 10.00ns, 509.22us] 153.37us 203.99us 766.86us
                    'graph_cst_lns':         5 [410.03us, 723.93us] 546.13us 112.96us   2.73ms         0 [  0.00ns,   0.00ns]   0.00ns   0.00ns   0.00ns
                    'graph_dec_lns':         5 [  1.63ms,   7.21ms]   3.66ms   2.03ms  18.32ms         4 [ 10.00ns,  87.16us]  21.80us  37.74us  87.19us
                    'graph_var_lns':         6 [  1.22ms,   7.80ms]   5.34ms   2.73ms  32.01ms         5 [ 10.00ns, 205.38us]  74.58us  76.26us 372.90us
                   'lb_tree_search':         1 [ 59.26ms,  59.26ms]  59.26ms   0.00ns  59.26ms         1 [  4.06ms,   4.06ms]   4.06ms   0.00ns   4.06ms
                           'max_lp':         1 [ 59.82ms,  59.82ms]  59.82ms   0.00ns  59.82ms         1 [  2.66ms,   2.66ms]   2.66ms   0.00ns   2.66ms
                            'no_lp':         1 [ 59.52ms,  59.52ms]  59.52ms   0.00ns  59.52ms         1 [  7.23ms,   7.23ms]   7.23ms   0.00ns   7.23ms
              'objective_lb_search':         1 [ 56.93ms,  56.93ms]  56.93ms   0.00ns  56.93ms         1 [  1.17ms,   1.17ms]   1.17ms   0.00ns   1.17ms
       'objective_lb_search_max_lp':         1 [ 58.12ms,  58.12ms]  58.12ms   0.00ns  58.12ms         1 [  1.08ms,   1.08ms]   1.08ms   0.00ns   1.08ms
        'objective_lb_search_no_lp':         1 [ 56.31ms,  56.31ms]  56.31ms   0.00ns  56.31ms         1 [  6.08ms,   6.08ms]   6.08ms   0.00ns   6.08ms
  'objective_shaving_search_max_lp':         6 [760.62us,  13.57ms]   5.32ms   4.98ms  31.91ms         2 [ 90.42us, 180.83us] 135.63us  45.21us 271.25us
   'objective_shaving_search_no_lp':         6 [782.86us,  13.56ms]   5.48ms   4.97ms  32.88ms         2 [ 90.43us, 180.86us] 135.65us  45.22us 271.30us
                          'probing':         1 [ 58.79ms,  58.79ms]  58.79ms   0.00ns  58.79ms         1 [  1.16ms,   1.16ms]   1.16ms   0.00ns   1.16ms
                   'probing_max_lp':         1 [ 58.43ms,  58.43ms]  58.43ms   0.00ns  58.43ms         1 [  3.06ms,   3.06ms]   3.06ms   0.00ns   3.06ms
                     'pseudo_costs':         1 [ 59.08ms,  59.08ms]  59.08ms   0.00ns  59.08ms         1 [948.17us, 948.17us] 948.17us   0.00ns 948.17us
                    'quick_restart':         1 [ 59.38ms,  59.38ms]  59.38ms   0.00ns  59.38ms         1 [736.48us, 736.48us] 736.48us   0.00ns 736.48us
              'quick_restart_no_lp':         1 [ 56.40ms,  56.40ms]  56.40ms   0.00ns  56.40ms         1 [  6.79ms,   6.79ms]   6.79ms   0.00ns   6.79ms
                    'reduced_costs':         1 [ 59.51ms,  59.51ms]  59.51ms   0.00ns  59.51ms         1 [  1.55ms,   1.55ms]   1.55ms   0.00ns   1.55ms
                        'rins/rens':         6 [  4.24ms,  35.11ms]  10.92ms  11.04ms  65.52ms         4 [ 93.09us,   2.81ms] 806.01us   1.16ms   3.22ms
                      'rnd_cst_lns':         6 [517.88us,   9.34ms]   4.93ms   3.56ms  29.60ms         4 [ 10.00ns, 463.60us] 136.17us 191.92us 544.66us
                      'rnd_var_lns':         6 [  1.21ms,  15.37ms]   6.36ms   5.07ms  38.16ms         5 [ 10.00ns,   1.00ms] 208.64us 398.06us   1.04ms
                     'violation_ls':         3 [110.24us,  40.94ms]  13.83ms  19.17ms  41.48ms         3 [820.00ns,  13.92ms]   4.64ms   6.56ms  13.92ms
                     'violation_ls':         3 [147.72us,  39.16ms]  13.21ms  18.35ms  39.64ms         3 [  7.45us,  13.14ms]   4.39ms   6.18ms  13.17ms
                     'violation_ls':         3 [216.03us,  39.62ms]  13.44ms  18.51ms  40.32ms         3 [  7.41us,  13.56ms]   4.53ms   6.39ms  13.58ms
                     'violation_ls':         5 [ 89.79us,  20.62ms]   4.30ms   8.16ms  21.51ms         5 [530.00ns,  11.83ms]   2.38ms   4.73ms  11.88ms
                     'violation_ls':         5 [133.87us,  30.79ms]   6.37ms  12.21ms  31.85ms         5 [590.00ns,  10.74ms]   2.16ms   4.29ms  10.79ms

Search stats                        Bools  Conflicts  Branches  Restarts  BoolPropag  IntegerPropag
                           'core':    702        247     1'241       331      59'094         29'486
                     'default_lp':     57          2       114        61          36          1'421
                      'fs_random':      0          0         0         0           0              0
                      'fs_random':     30          0        60        60           6            320
                      'fs_random':     30          0        60        60           6            320
                      'fs_random':     30          0        60        60           6            320
                'fs_random_no_lp':      0          0         0         0           0              0
                'fs_random_no_lp':      0          0         0         0           0              0
                'fs_random_no_lp':     30          1        78        60          12            490
                'fs_random_no_lp':     45          0        94        61          17            739
        'fs_random_quick_restart':      0          0         0         0           0              0
        'fs_random_quick_restart':     30          0        60        60           6            320
        'fs_random_quick_restart':     30          0        60        60           6            320
        'fs_random_quick_restart':     30          0        60        60           6            320
  'fs_random_quick_restart_no_lp':      0          0         0         0           0              0
  'fs_random_quick_restart_no_lp':     30          0        71        60          11            441
  'fs_random_quick_restart_no_lp':     31          0        83        60          13            591
                 'lb_tree_search':     30          0        60        60          22            415
                         'max_lp':     30          0        60        60           6            333
                          'no_lp':     80        178     1'069       392       5'050         42'142
            'objective_lb_search':     31          1        61        61          26            480
     'objective_lb_search_max_lp':     30          0        60        60          22            458
      'objective_lb_search_no_lp':     47        258       680       291       2'960         36'628
                        'probing':     32          0        64        64           7            342
                 'probing_max_lp':     32          0        64        64           7            349
                   'pseudo_costs':     30          0        60        60          22            458
                  'quick_restart':     30          0        60        60          22            437
            'quick_restart_no_lp':    123        188     1'254       388       6'856         39'063
                  'reduced_costs':     30          0        60        60          22            478

SAT stats                           ClassicMinim  LitRemoved  LitLearned  LitForgotten  Subsumed  MClauses  MDecisions  MLitTrue  MSubsumed  MLitRemoved  MReused
                           'core':            53          94         236             0         0         4          26         0          0            0        0
                     'default_lp':             0           0          14             0         0         0           0         0          0            0        0
                      'fs_random':             0           0           0             0         0         0           0         0          0            0        0
                      'fs_random':             0           0           0             0         0         0           0         0          0            0        0
                      'fs_random':             0           0           0             0         0         0           0         0          0            0        0
                      'fs_random':             0           0           0             0         0         0           0         0          0            0        0
                'fs_random_no_lp':             0           0           0             0         0         0           0         0          0            0        0
                'fs_random_no_lp':             0           0           0             0         0         0           0         0          0            0        0
                'fs_random_no_lp':             0           0           0             0         0         0           0         0          0            0        0
                'fs_random_no_lp':             0           0           4             0         0         0           0         0          0            0        0
        'fs_random_quick_restart':             0           0           0             0         0         0           0         0          0            0        0
        'fs_random_quick_restart':             0           0           0             0         0         0           0         0          0            0        0
        'fs_random_quick_restart':             0           0           0             0         0         0           0         0          0            0        0
        'fs_random_quick_restart':             0           0           0             0         0         0           0         0          0            0        0
  'fs_random_quick_restart_no_lp':             0           0           0             0         0         0           0         0          0            0        0
  'fs_random_quick_restart_no_lp':             0           0           0             0         0         0           0         0          0            0        0
  'fs_random_quick_restart_no_lp':             0           0           0             0         0         0           0         0          0            0        0
                 'lb_tree_search':             0           0           0             0         0         0           0         0          0            0        0
                         'max_lp':             0           0           0             0         0         0           0         0          0            0        0
                          'no_lp':            84         138         898             0        18        81         310        18         40          295        6
            'objective_lb_search':             0           0           1             0         0         0           0         0          0            0        0
     'objective_lb_search_max_lp':             0           0           0             0         0         0           0         0          0            0        0
      'objective_lb_search_no_lp':           191         486         938             0        13        28         136         0          8           38       10
                        'probing':             0           0           0             0         0         0           0         0          0            0        0
                 'probing_max_lp':             0           0           0             0         0         0           0         0          0            0        0
                   'pseudo_costs':             0           0           0             0         0         0           0         0          0            0        0
                  'quick_restart':             0           0           0             0         0         0           0         0          0            0        0
            'quick_restart_no_lp':            70         120       1'020             0        15        48         194         4         25          136        4
                  'reduced_costs':             0           0           0             0         0         0           0         0          0            0        0

Lp stats                         Component  Iterations  AddedCuts  OPTIMAL  DUAL_F.  DUAL_U.
                  'default_lp':          1         215        392       38        0        0
                   'fs_random':          1           0          0        0        0        0
                   'fs_random':          1          11         50        3        0        0
                   'fs_random':          1          11         55        3        0        0
     'fs_random_quick_restart':          1           0          0        0        0        0
     'fs_random_quick_restart':          1           0          0        1        1        0
     'fs_random_quick_restart':          1          11          0        2        0        0
              'lb_tree_search':          1         172        443        7        0        0
                      'max_lp':          1         152        479        7        0        0
         'objective_lb_search':          1         131        372       22        0        0
  'objective_lb_search_max_lp':          1         132        470       11        0        0
                     'probing':          1         129        401       21        0        0
              'probing_max_lp':          1         155        442        7        0        0
                'pseudo_costs':          1         124        463       11        0        0
               'quick_restart':          1          99        401       17        0        0
               'reduced_costs':          1         158        479       13        0        0

Lp dimension                                                                    Final dimension of first component
                  'default_lp':   197 rows, 74 columns, 546 entries with magnitude in [2.513523e-03, 1.000000e+00]
                   'fs_random':       0 rows, 74 columns, 0 entries with magnitude in [0.000000e+00, 0.000000e+00]
                   'fs_random':     13 rows, 74 columns, 44 entries with magnitude in [3.295346e-01, 1.000000e+00]
                   'fs_random':     13 rows, 74 columns, 44 entries with magnitude in [3.295346e-01, 1.000000e+00]
     'fs_random_quick_restart':       0 rows, 74 columns, 0 entries with magnitude in [0.000000e+00, 0.000000e+00]
     'fs_random_quick_restart':     12 rows, 74 columns, 42 entries with magnitude in [3.295346e-01, 1.000000e+00]
     'fs_random_quick_restart':     12 rows, 74 columns, 42 entries with magnitude in [3.295346e-01, 1.000000e+00]
              'lb_tree_search':  537 rows, 79 columns, 2996 entries with magnitude in [2.352274e-03, 1.000000e+00]
                      'max_lp':  537 rows, 79 columns, 2972 entries with magnitude in [6.824534e-03, 1.000000e+00]
         'objective_lb_search':   189 rows, 74 columns, 244 entries with magnitude in [4.566903e-03, 1.000000e+00]
  'objective_lb_search_max_lp':   213 rows, 79 columns, 951 entries with magnitude in [2.819071e-03, 1.000000e+00]
                     'probing':   197 rows, 74 columns, 874 entries with magnitude in [2.326540e-03, 1.000000e+00]
              'probing_max_lp':  537 rows, 79 columns, 2962 entries with magnitude in [3.774906e-03, 1.000000e+00]
                'pseudo_costs':   209 rows, 79 columns, 839 entries with magnitude in [2.378666e-03, 1.000000e+00]
               'quick_restart':   177 rows, 74 columns, 817 entries with magnitude in [2.606652e-03, 1.000000e+00]
               'reduced_costs':  241 rows, 79 columns, 1097 entries with magnitude in [8.261360e-04, 1.000000e+00]

Lp debug                         CutPropag  CutEqPropag  Adjust  Overflow  Bad  BadScaling
                  'default_lp':          7            0      22         0  699           0
                   'fs_random':          0            0       0         0    0           0
                   'fs_random':          0            0       0         0    0           0
                   'fs_random':          0            0       0         0    0           0
     'fs_random_quick_restart':          0            0       0         0    0           0
     'fs_random_quick_restart':          0            0       0         0    0           0
     'fs_random_quick_restart':          0            0       0         0    0           0
              'lb_tree_search':          0            0       4         0  225           0
                      'max_lp':          0            0       6         0  221           0
         'objective_lb_search':          0            0       9         0  468           0
  'objective_lb_search_max_lp':          0            0       6         0  242           0
                     'probing':          0            0      14         0  584           0
              'probing_max_lp':          0            0       6         0  208           0
                'pseudo_costs':          0            0       6         0  294           0
               'quick_restart':          0            0      12         0  485           0
               'reduced_costs':          0            0       8         0  250           0

Lp pool                          Constraints  Updates  Simplif  Merged  Shortened  Split  Strenghtened  Cuts/Call
                  'default_lp':          476       68      525       3        285      8           189    392/689
                   'fs_random':          137        0        0       0          0      0             2      50/50
                   'fs_random':          142        0        0       0          0      0             2      55/61
                   'fs_random':           87        0        0       0          0      0             2        0/0
     'fs_random_quick_restart':           87        0        0       0          0      0             2        0/0
     'fs_random_quick_restart':           87        0        0       0          0      0             2        0/0
     'fs_random_quick_restart':           87        0        0       0          0      0             2        0/0
              'lb_tree_search':          843        6        0       1          0      3           124    443/807
                      'max_lp':          879        6        0       1          0      3           102    479/844
         'objective_lb_search':          459       51      423       0        367     13           203    372/687
  'objective_lb_search_max_lp':          861       35      272      10          0     11           692    470/730
                     'probing':          488       12        0       0          0     11            55    401/677
              'probing_max_lp':          842        6        0       1          0      3           100    442/818
                'pseudo_costs':          853       36      272      11          0      6           695    463/742
               'quick_restart':          488       16       24       0          0     13           112    401/702
               'reduced_costs':          869       40      435      11          0      6           990    479/767

Lp Cut            fs_ran  fs_ran  defaul  max_lp  quick_  reduce  pseudo  lb_tre  probin  object  probin  object
          CG_FF:       -       -      34      47      34      47      42      45      30      36      41      45
           CG_K:       -       -      16      42      13      21      18      39      15      13      38      17
           CG_R:       -       -      14      22      17      20      12      20       8      16      20      12
          CG_RB:       -       -     115      85     119     103      98      79     122      98      83      98
         CG_RBP:       -       -       8       3      17       2       1       3      18       9       5       1
             IB:      49      50      68      68      64      87      86      66      65      65      68      81
       MIR_1_FF:       2       -      20      43      20      43      36      44      20      17      40      38
        MIR_1_K:       -       -       1       4       -       1       4       3       1       1       2       3
        MIR_1_R:       1       -       6      13       5       8       9      12       4       4      12       9
       MIR_1_RB:       1       -      24      42      22      38      33      42      28      21      37      37
      MIR_1_RBP:       -       -       1       7       1       5      11       6       2       1       7       7
       MIR_2_FF:       1       -       7      11       7      10      14      11       6       5      11       8
        MIR_2_K:       -       -       1       2       1       1       1       3       -       1       3       3
        MIR_2_R:       1       -       7       6       5       9       9       6       6       6       7       7
       MIR_2_RB:       -       -       9      15      13      15      13      10      10       7      16      19
      MIR_2_RBP:       -       -       2       7       2       3       3       2       2       2       -       6
       MIR_3_FF:       -       -       5       8       1       2       5       6       6       4       8       5
        MIR_3_K:       -       -       1       2       -       -       2       -       -       1       -       3
        MIR_3_R:       -       -       5       5       1       -       3       2       2       3       2       3
       MIR_3_RB:       -       -       5       6       2       2       8       4       4       6       7      10
      MIR_3_RBP:       -       -       1       1       -       1       4       1       2       -       1       2
       MIR_4_FF:       -       -       3       3       1       2       1       3       1       1       4       2
        MIR_4_K:       -       -       1       -       -       -       -       -       -       -       -       -
        MIR_4_R:       -       -       4       2       3       1       1       -       3       3       -       1
       MIR_4_RB:       -       -       -       2       3       3       3       1       5       5       2       1
      MIR_4_RBP:       -       -       1       -       1       -       1       -       1       2       -       -
       MIR_5_FF:       -       -       1       2       -       -       -       -       -       -       1       2
        MIR_5_K:       -       -       -       -       1       -       -       -       1       1       -       -
        MIR_5_R:       -       -       1       2       1       -       -       -       1       1       -       1
       MIR_5_RB:       -       -       -       1       2       -       1       -       2       3       -       2
      MIR_5_RBP:       -       -       -       1       -       -       -       -       -       -       -       -
        MIR_6_R:       -       -       -       -       2       -       -       -       1       1       -       -
       MIR_6_RB:       -       -       -       -       2       -       -       -       1       2       -       -
   ZERO_HALF_FF:       -       -       8       6       9      15      11       7       8      11       4      10
    ZERO_HALF_K:       -       -       -       -       -       -       -       1       -       -       2       1
    ZERO_HALF_R:       -       -      12      15      16      25      19      18      12      14      15      22
   ZERO_HALF_RB:       -       -      10       6      14      13      12       9      11      10       6      12
  ZERO_HALF_RBP:       -       -       1       -       2       2       2       -       3       2       -       2

LNS stats           Improv/Calls  Closed  Difficulty  TimeLimit
  'graph_arc_lns':           2/5    100%        0.94       0.10
  'graph_cst_lns':           0/0      0%        0.50       0.10
  'graph_dec_lns':           3/5    100%        0.94       0.10
  'graph_var_lns':           1/5    100%        0.94       0.10
      'rins/rens':           3/6     67%        0.83       0.10
    'rnd_cst_lns':           1/5    100%        0.94       0.10
    'rnd_var_lns':           0/6     67%        0.83       0.10

LS stats                   Batches  Restarts  LinMoves  GenMoves  CompoundMoves  WeightUpdates
       'fj_long_default':        0         0         0         0              0              0
       'fj_long_default':        0         0         0         0              0              0
   'fj_long_lin_default':        0         0         0         0              0              0
   'fj_long_lin_perturb':        0         0         0         0              0              0
    'fj_long_lin_random':        0         0         0         0              0              0
       'fj_long_perturb':        0         0         0         0              0              0
        'fj_long_random':        0         0         0         0              0              0
      'fj_short_default':        0         0         0         0              0              0
      'fj_short_default':        0         0         0         0              0              0
  'fj_short_lin_default':        0         0         0         0              0              0
  'fj_short_lin_default':        0         0         0         0              0              0
  'fj_short_lin_perturb':        0         0         0         0              0              0
   'fj_short_lin_random':        0         0         0         0              0              0
      'fj_short_perturb':        0         0         0         0              0              0
       'fj_short_random':        0         0         0         0              0              0
          'violation_ls':        3         0         1     4'296             60             34
          'violation_ls':        3         0         8     3'998             74             40
          'violation_ls':        3         0         9     4'272             88             42
          'violation_ls':        5         0        12     3'416             76             34
          'violation_ls':        5         0     2'196        11              5          1'879

Solutions (20)            Num     Rank
      'fs_random_no_lp':    1    [1,1]
        'graph_arc_lns':    1    [8,8]
        'graph_dec_lns':    1  [19,19]
                'no_lp':    4   [2,20]
  'quick_restart_no_lp':    2   [9,16]
        'rins_pump_lns':    1  [15,15]
         'violation_ls':   10   [4,18]

Objective bounds                Num
                  'bool_core':   42
             'initial_domain':    1
  'objective_lb_search_no_lp':   14

Solution repositories    Added  Queried  Ignored  Synchro
  'feasible solutions':     57      102        2       38
        'lp solutions':      0        0        0        0
                'pump':     82        6

Improving bounds shared         Num
                       'core':    2
                 'default_lp':    5
                      'no_lp':   29
  'objective_lb_search_no_lp':   77
        'quick_restart_no_lp':  212

Clauses shared                  Num
                       'core':    1
                      'no_lp':   12
  'objective_lb_search_no_lp':   15
        'quick_restart_no_lp':   20

CpSolverResponse summary:
status: OPTIMAL
objective: 488
best_bound: 488
integers: 75
booleans: 30
conflicts: 0
branches: 60
propagations: 6
integer_propagations: 320
restarts: 60
lp_iterations: 11
walltime: 0.114184
usertime: 0.114185
deterministic_time: 0.149732
gap_integral: 0.349905
solution_fingerprint: 0x11a113557590e779


--- Simulation Gantt  partir du modle mathmatique ---
{'big':1, 'due_date':102, 'pos_time':5, 'status':0, 'blocked':0, 'operations':["{'type':1, 'processing_time':58}"]}
{'big':1, 'due_date':110, 'pos_time':5, 'status':0, 'blocked':0, 'operations':["{'type':0, 'processing_time':45}", "{'type':1, 'processing_time':44}"]}
{'big':0, 'due_date':175, 'pos_time':5, 'status':0, 'blocked':0, 'operations':["{'type':0, 'processing_time':32}", "{'type':1, 'processing_time':42}"]}
{'big':1, 'due_date':104, 'pos_time':5, 'status':0, 'blocked':0, 'operations':["{'type':0, 'processing_time':57}"]}
{'big':0, 'due_date':96, 'pos_time':5, 'status':0, 'blocked':0, 'operations':["{'type':1, 'processing_time':20}"]}
