created virtual environment CPython3.12.4.final.0-64 in 596ms
  creator CPython3Posix(dest=/localscratch/aneumann.47038323.0/env, clear=False, no_vcs_ignore=False, global=False)
  seeder FromAppData(download=False, pip=bundle, via=copy, app_data_dir=/home/aneumann/.local/share/virtualenv)
    added seed packages: pip==24.2+computecanada
  activators BashActivator,CShellActivator,FishActivator,NushellActivator,PowerShellActivator,PythonActivator
Looking in links: /cvmfs/soft.computecanada.ca/custom/python/wheelhouse/gentoo2023/x86-64-v3, /cvmfs/soft.computecanada.ca/custom/python/wheelhouse/gentoo2023/generic, /cvmfs/soft.computecanada.ca/custom/python/wheelhouse/generic
Requirement already satisfied: pip in /localscratch/aneumann.47038323.0/env/lib/python3.12/site-packages (24.2+computecanada)
Processing /cvmfs/soft.computecanada.ca/custom/python/wheelhouse/generic/pip-25.0+computecanada-py3-none-any.whl
Installing collected packages: pip
  Attempting uninstall: pip
    Found existing installation: pip 24.2+computecanada
    Uninstalling pip-24.2+computecanada:
      Successfully uninstalled pip-24.2+computecanada
Successfully installed pip-24.2+computecanada
Looking in links: /cvmfs/soft.computecanada.ca/custom/python/wheelhouse/gentoo2023/x86-64-v3, /cvmfs/soft.computecanada.ca/custom/python/wheelhouse/gentoo2023/generic, /cvmfs/soft.computecanada.ca/custom/python/wheelhouse/generic
ERROR: protobuf-5.28.3-cp38-abi3-manylinux2014_x86_64.whl is not a supported wheel on this platform.
Looking in links: /cvmfs/soft.computecanada.ca/custom/python/wheelhouse/gentoo2023/x86-64-v3, /cvmfs/soft.computecanada.ca/custom/python/wheelhouse/gentoo2023/generic, /cvmfs/soft.computecanada.ca/custom/python/wheelhouse/generic
Processing /home/aneumann/projects/def-adhaj/aneumann/GNRS/wheels/immutabledict-4.2.0-py3-none-any.whl
Installing collected packages: immutabledict
Successfully installed immutabledict-4.2.0
Looking in links: /cvmfs/soft.computecanada.ca/custom/python/wheelhouse/gentoo2023/x86-64-v3, /cvmfs/soft.computecanada.ca/custom/python/wheelhouse/gentoo2023/generic, /cvmfs/soft.computecanada.ca/custom/python/wheelhouse/generic
Processing /cvmfs/soft.computecanada.ca/custom/python/wheelhouse/generic/ortools-9.10.4067+computecanada-cp312-cp312-linux_x86_64.whl (from -r /home/aneumann/projects/def-adhaj/aneumann/GNRS/requirements/or.txt (line 1))
Processing /cvmfs/soft.computecanada.ca/custom/python/wheelhouse/gentoo2023/x86-64-v3/matplotlib-3.10.0+computecanada-cp312-cp312-linux_x86_64.whl (from -r /home/aneumann/projects/def-adhaj/aneumann/GNRS/requirements/or.txt (line 2))
Processing /cvmfs/soft.computecanada.ca/custom/python/wheelhouse/gentoo2023/x86-64-v3/pandas-2.2.3+computecanada-cp312-cp312-linux_x86_64.whl (from -r /home/aneumann/projects/def-adhaj/aneumann/GNRS/requirements/or.txt (line 3))
Processing /cvmfs/soft.computecanada.ca/custom/python/wheelhouse/generic/absl_py-2.3.0+computecanada-py3-none-any.whl (from ortools<9.11,>=9.10->-r /home/aneumann/projects/def-adhaj/aneumann/GNRS/requirements/or.txt (line 1))
Processing /cvmfs/soft.computecanada.ca/custom/python/wheelhouse/gentoo2023/generic/numpy-2.2.2+computecanada-cp312-cp312-linux_x86_64.whl (from ortools<9.11,>=9.10->-r /home/aneumann/projects/def-adhaj/aneumann/GNRS/requirements/or.txt (line 1))
Processing /cvmfs/soft.computecanada.ca/custom/python/wheelhouse/gentoo2023/x86-64-v3/protobuf-6.31.1+computecanada-cp312-cp312-linux_x86_64.whl (from ortools<9.11,>=9.10->-r /home/aneumann/projects/def-adhaj/aneumann/GNRS/requirements/or.txt (line 1))
Requirement already satisfied: immutabledict>=3.0.0 in /localscratch/aneumann.47038323.0/env/lib/python3.12/site-packages (from ortools<9.11,>=9.10->-r /home/aneumann/projects/def-adhaj/aneumann/GNRS/requirements/or.txt (line 1)) (4.2.0)
Processing /cvmfs/soft.computecanada.ca/custom/python/wheelhouse/gentoo2023/generic/contourpy-1.3.1+computecanada-cp312-cp312-linux_x86_64.whl (from matplotlib->-r /home/aneumann/projects/def-adhaj/aneumann/GNRS/requirements/or.txt (line 2))
Processing /cvmfs/soft.computecanada.ca/custom/python/wheelhouse/generic/cycler-0.12.1+computecanada-py3-none-any.whl (from matplotlib->-r /home/aneumann/projects/def-adhaj/aneumann/GNRS/requirements/or.txt (line 2))
Processing /cvmfs/soft.computecanada.ca/custom/python/wheelhouse/generic/fonttools-4.59.0+computecanada-cp312-cp312-linux_x86_64.whl (from matplotlib->-r /home/aneumann/projects/def-adhaj/aneumann/GNRS/requirements/or.txt (line 2))
Processing /cvmfs/soft.computecanada.ca/custom/python/wheelhouse/gentoo2023/x86-64-v3/kiwisolver-1.4.8+computecanada-cp312-cp312-linux_x86_64.whl (from matplotlib->-r /home/aneumann/projects/def-adhaj/aneumann/GNRS/requirements/or.txt (line 2))
Processing /cvmfs/soft.computecanada.ca/custom/python/wheelhouse/generic/packaging-25.0+computecanada-py3-none-any.whl (from matplotlib->-r /home/aneumann/projects/def-adhaj/aneumann/GNRS/requirements/or.txt (line 2))
Processing /cvmfs/soft.computecanada.ca/custom/python/wheelhouse/gentoo2023/x86-64-v3/pillow-11.1.0+computecanada-cp312-cp312-linux_x86_64.whl (from matplotlib->-r /home/aneumann/projects/def-adhaj/aneumann/GNRS/requirements/or.txt (line 2))
Processing /cvmfs/soft.computecanada.ca/custom/python/wheelhouse/generic/pyparsing-3.2.3+computecanada-py3-none-any.whl (from matplotlib->-r /home/aneumann/projects/def-adhaj/aneumann/GNRS/requirements/or.txt (line 2))
Processing /cvmfs/soft.computecanada.ca/custom/python/wheelhouse/generic/python_dateutil-2.9.0.post0+computecanada-py2.py3-none-any.whl (from matplotlib->-r /home/aneumann/projects/def-adhaj/aneumann/GNRS/requirements/or.txt (line 2))
Processing /cvmfs/soft.computecanada.ca/custom/python/wheelhouse/generic/pytz-2025.2+computecanada-py2.py3-none-any.whl (from pandas->-r /home/aneumann/projects/def-adhaj/aneumann/GNRS/requirements/or.txt (line 3))
Processing /cvmfs/soft.computecanada.ca/custom/python/wheelhouse/generic/tzdata-2025.2+computecanada-py2.py3-none-any.whl (from pandas->-r /home/aneumann/projects/def-adhaj/aneumann/GNRS/requirements/or.txt (line 3))
Processing /cvmfs/soft.computecanada.ca/custom/python/wheelhouse/generic/six-1.17.0+computecanada-py2.py3-none-any.whl (from python-dateutil>=2.7->matplotlib->-r /home/aneumann/projects/def-adhaj/aneumann/GNRS/requirements/or.txt (line 2))
Installing collected packages: pytz, tzdata, six, pyparsing, protobuf, pillow, packaging, numpy, kiwisolver, fonttools, cycler, absl-py, python-dateutil, contourpy, pandas, matplotlib, ortools
Successfully installed absl-py-2.3.0+computecanada contourpy-1.3.1+computecanada cycler-0.12.1+computecanada fonttools-4.59.0+computecanada kiwisolver-1.4.8+computecanada matplotlib-3.10.0+computecanada numpy-2.2.2+computecanada ortools-9.10.4067+computecanada packaging-25.0+computecanada pandas-2.2.3+computecanada pillow-11.1.0+computecanada protobuf-6.31.1+computecanada pyparsing-3.2.3+computecanada python-dateutil-2.9.0.post0+computecanada pytz-2025.2+computecanada six-1.17.0+computecanada tzdata-2025.2+computecanada

Starting CP-SAT solver v9.10.4067
Parameters: max_time_in_seconds: 86400 max_memory_in_mb: 185000 log_search_progress: true enumerate_all_solutions: false num_search_workers: 32 absolute_gap_limit: 0 relative_gap_limit: 0

Initial optimization model '': (model_fingerprint: 0x48c2a986f893b540)
#Variables: 901 (#ints: 18 in objective)
  - 723 Booleans in [0,1]
  - 178 in [0,1190]
#kLinear1: 86
#kLinear2: 1'908
#kLinear3: 879
#kLinearN: 35'909 (#terms: 888'999)

Starting presolve at 0.02s
  3.96e-02s  0.00e+00d  [DetectDominanceRelations] 
  6.39e-01s  0.00e+00d  [PresolveToFixPoint] #num_loops=8 #num_dual_strengthening=3 
  3.56e-04s  0.00e+00d  [ExtractEncodingFromLinear] #potential_supersets=8 
[Symmetry] Graph for symmetry has 38'084 nodes and 761'503 arcs.
[Symmetry] Symmetry computation done. time: 0.031493 dtime: 0.0574421
[Symmetry] #generators: 1, average support size: 50
[Symmetry] The model contains 788 duplicate constraints !
[Symmetry] 25 orbits with sizes: 2,2,2,2,2,2,2,2,2,2,...
[Symmetry] Num fixable by intersecting at_most_one with orbits: 1 largest_orbit: 2
  2.58e-01s  6.11e-02d  [Probe] #probed=1'170 #new_bounds=19 #equiv=1 
  3.29e-04s  0.00e+00d  [MaxClique] Merged 9(18 literals) into 7(14 literals) at_most_ones. 
  3.99e-02s  0.00e+00d  [DetectDominanceRelations] 
  3.25e-01s  0.00e+00d  [PresolveToFixPoint] #num_loops=5 #num_dual_strengthening=3 
  1.63e-01s  0.00e+00d  [ProcessAtMostOneAndLinear] 
  4.33e-02s  0.00e+00d  [DetectDuplicateConstraints] #duplicates=1'124 #without_enforcements=156 
  8.64e-02s  5.60e-03d  [DetectDominatedLinearConstraints] #relevant_constraints=33'912 #num_inclusions=15'756 
  4.57e-03s  0.00e+00d  [DetectDifferentVariables] #different=106 #cliques=1 #size=13 
  1.41e-02s  1.31e-03d  [ProcessSetPPC] #relevant_constraints=32'997 
  5.25e-04s  0.00e+00d  [FindAlmostIdenticalLinearConstraints] 
  3.34e-03s  4.24e-03d  [FindBigAtMostOneAndLinearOverlap] 
  2.13e-01s  1.16e-01d  [FindBigVerticalLinearOverlap] #blocks=392 #saved_nz=154'693 
  7.76e-03s  2.81e-03d  [FindBigHorizontalLinearOverlap] #linears=32'134 
  2.48e-04s  0.00e+00d  [MergeClauses] 
  4.25e-02s  0.00e+00d  [DetectDominanceRelations] 
  3.59e-01s  0.00e+00d  [PresolveToFixPoint] #num_loops=3 #num_dual_strengthening=1 
  4.24e-02s  0.00e+00d  [DetectDominanceRelations] 
  2.19e-01s  0.00e+00d  [PresolveToFixPoint] #num_loops=1 #num_dual_strengthening=1 
[Symmetry] Graph for symmetry has 38'096 nodes and 603'118 arcs.
[Symmetry] Symmetry computation done. time: 0.0167829 dtime: 0.032368
  2.36e-01s  4.97e-02d  [Probe] #probed=1'176 #new_bounds=246 
  2.46e-04s  0.00e+00d  [MaxClique] 
  4.18e-02s  0.00e+00d  [DetectDominanceRelations] 
  3.14e-01s  0.00e+00d  [PresolveToFixPoint] #num_loops=2 #num_dual_strengthening=1 
  1.53e-01s  0.00e+00d  [ProcessAtMostOneAndLinear] 
  4.00e-02s  0.00e+00d  [DetectDuplicateConstraints] #without_enforcements=156 
  6.36e-02s  4.36e-03d  [DetectDominatedLinearConstraints] #relevant_constraints=33'902 #num_inclusions=2'690 
  4.09e-03s  0.00e+00d  [DetectDifferentVariables] 
  1.27e-02s  9.93e-04d  [ProcessSetPPC] #relevant_constraints=32'161 
  5.26e-04s  2.25e-06d  [FindAlmostIdenticalLinearConstraints] #num_tested_pairs=147 
  1.59e-03s  1.75e-03d  [FindBigAtMostOneAndLinearOverlap] 
  1.78e-01s  8.39e-02d  [FindBigVerticalLinearOverlap] #blocks=1'266 #saved_nz=140'493 
  6.89e-03s  2.01e-03d  [FindBigHorizontalLinearOverlap] #linears=28'001 
  2.52e-04s  0.00e+00d  [MergeClauses] 
  3.27e-02s  0.00e+00d  [DetectDominanceRelations] 
  3.28e-01s  0.00e+00d  [PresolveToFixPoint] #num_loops=3 #num_dual_strengthening=1 
  3.31e-02s  0.00e+00d  [DetectDominanceRelations] 
  2.14e-01s  0.00e+00d  [PresolveToFixPoint] #num_loops=1 #num_dual_strengthening=1 
[Symmetry] Graph for symmetry has 41'463 nodes and 463'588 arcs.
[Symmetry] Symmetry computation done. time: 0.013581 dtime: 0.0250492
  2.12e-01s  4.03e-02d  [Probe] #probed=1'172 #new_bounds=836 
  2.68e-04s  0.00e+00d  [MaxClique] 
  3.29e-02s  0.00e+00d  [DetectDominanceRelations] 
  3.13e-01s  0.00e+00d  [PresolveToFixPoint] #num_loops=2 #num_dual_strengthening=1 
  1.42e-01s  0.00e+00d  [ProcessAtMostOneAndLinear] 
  3.63e-02s  0.00e+00d  [DetectDuplicateConstraints] #without_enforcements=156 
  4.55e-02s  2.90e-03d  [DetectDominatedLinearConstraints] #relevant_constraints=34'621 #num_inclusions=1'529 
  4.10e-03s  0.00e+00d  [DetectDifferentVariables] 
  1.05e-02s  6.92e-04d  [ProcessSetPPC] #relevant_constraints=28'066 
  7.81e-04s  6.10e-05d  [FindAlmostIdenticalLinearConstraints] #num_tested_pairs=3'897 
  1.44e-03s  1.22e-03d  [FindBigAtMostOneAndLinearOverlap] 
  1.15e-01s  5.18e-02d  [FindBigVerticalLinearOverlap] #blocks=1'205 #saved_nz=100'345 
  5.51e-03s  1.39e-03d  [FindBigHorizontalLinearOverlap] #linears=21'978 
  2.62e-04s  0.00e+00d  [MergeClauses] 
  2.66e-02s  0.00e+00d  [DetectDominanceRelations] 
  3.10e-01s  0.00e+00d  [PresolveToFixPoint] #num_loops=3 #num_dual_strengthening=1 
  1.97e-03s  0.00e+00d  [ExpandObjective] #entries=10'863 #tight_variables=4'460 #tight_constraints=2'365 

Presolve summary:
  - 271 affine relations were detected.
  - rule 'TODO dual: only one blocking constraint?' was applied 2'052 times.
  - rule 'TODO dual: only one blocking enforced constraint?' was applied 156 times.
  - rule 'TODO dual: only one unspecified blocking constraint?' was applied 158 times.
  - rule 'TODO duplicate: identical constraint with different enforcements' was applied 468 times.
  - rule 'affine: new relation' was applied 271 times.
  - rule 'at_most_one: removed literals' was applied 7 times.
  - rule 'at_most_one: size one' was applied 7 times.
  - rule 'at_most_one: transformed into max clique.' was applied 1 time.
  - rule 'deductions: 2096 stored' was applied 1 time.
  - rule 'dual: fix variable' was applied 51 times.
  - rule 'dual: reduced domain' was applied 107 times.
  - rule 'duplicate: merged rhs of linear constraint' was applied 280 times.
  - rule 'duplicate: removed constraint' was applied 1'124 times.
  - rule 'enforcement: false literal' was applied 18 times.
  - rule 'exactly_one: x and not(x)' was applied 1 time.
  - rule 'incompatible linear: add implication' was applied 232 times.
  - rule 'linear matrix: common vertical rectangle' was applied 2'863 times.
  - rule 'linear2: contains a Boolean.' was applied 1 time.
  - rule 'linear: always true' was applied 2'525 times.
  - rule 'linear: doubleton free' was applied 23 times.
  - rule 'linear: empty' was applied 64 times.
  - rule 'linear: extracted enforcement literal' was applied 35'209 times.
  - rule 'linear: fixed or dup variables' was applied 36'639 times.
  - rule 'linear: positive equal one' was applied 8 times.
  - rule 'linear: reduced variable domains' was applied 2'574 times.
  - rule 'linear: remapped using affine relations' was applied 36'389 times.
  - rule 'linear: simplified rhs' was applied 118'990 times.
  - rule 'linear: tightened into equality' was applied 7 times.
  - rule 'linear: variable substitution 1' was applied 23 times.
  - rule 'linear: variable substitution 2' was applied 215 times.
  - rule 'linear: variable substitution 3' was applied 227 times.
  - rule 'no_overlap: inferred from x != y constraints' was applied 1 time.
  - rule 'presolve: 184 unused variables removed.' was applied 1 time.
  - rule 'presolve: iteration' was applied 3 times.
  - rule 'probing: reduced enforced constraint to implication.' was applied 9 times.
  - rule 'symmetry: fixed to false in general orbit' was applied 1 time.

Presolved optimization model '': (model_fingerprint: 0xb789cdea480a25ce)
#Variables: 2'844 (#ints: 18 in objective)
  - 298 Booleans in [0,1]
  - 1'925 different domains in [-22541,23640] with a largest complexity of 22.
#kExactlyOne: 7 (#literals: 21)
#kInterval: 13
#kLinear1: 5 (#enforced: 5 #multi: 2)
#kLinear2: 2'472 (#enforced: 2'380 #multi: 746)
#kLinear3: 8'251 (#enforced: 6'271 #multi: 43)
#kLinearN: 26'434 (#enforced: 25'048) (#terms: 296'135)
#kNoOverlap: 1 (#intervals: 13)

Preloading model.
#Bound   5.37s best:inf   next:[165,18721] initial_domain
[Symmetry] Graph for symmetry has 43'719 nodes and 364'151 arcs.
[Symmetry] Symmetry computation done. time: 0.0114346 dtime: 0.0202401
#Model   5.44s var:2844/2844 constraints:37183/37183

Starting search at 5.46s with 32 workers.
17 full problem subsolvers: [core, default_lp, fixed, lb_tree_search, max_lp, no_lp, objective_lb_search, objective_lb_search_max_lp, objective_lb_search_no_lp, objective_shaving_search_max_lp, objective_shaving_search_no_lp, probing, probing_max_lp, pseudo_costs, quick_restart, quick_restart_no_lp, reduced_costs]
13 first solution subsolvers: [fj_long_default, fj_long_lin_default, fj_long_random, fj_short_default, fj_short_lin_default, fj_short_lin_random, fj_short_random, fs_random(2), fs_random_no_lp, fs_random_quick_restart(2), fs_random_quick_restart_no_lp]
13 incomplete subsolvers: [feasibility_pump, graph_arc_lns, graph_cst_lns, graph_dec_lns, graph_var_lns, rins/rens, rnd_cst_lns, rnd_var_lns, scheduling_intervals_lns, scheduling_precedences_lns, scheduling_time_window_lns, violation_ls(2)]
3 helper subsolvers: [neighborhood_helper, synchronization_agent, update_gap_integral]
#Bound   6.21s best:inf   next:[320,18721] core (initial_propagation)
#Bound   7.01s best:inf   next:[337,18721] objective_lb_search_no_lp
#Bound   7.16s best:inf   next:[452,18721] objective_lb_search_no_lp
#Bound   7.76s best:inf   next:[894,18721] pseudo_costs
#Bound   7.84s best:inf   next:[1353,18721] pseudo_costs
#1       7.99s best:7425  next:[1353,7424] fs_random_no_lp (fixed_bools=0/398)
#Bound   8.04s best:7425  next:[1428,7424] pseudo_costs
#Bound   8.12s best:7425  next:[1924,7424] pseudo_costs
#Bound   8.20s best:7425  next:[1925,7424] pseudo_costs
#2       8.53s best:6523  next:[1925,6522] no_lp (fixed_bools=0/359)
#3       9.35s best:6521  next:[1925,6520] no_lp (fixed_bools=0/410)
#4       9.54s best:6519  next:[1925,6518] graph_arc_lns (d=0.88 s=97 t=0.10 p=1.00 stall=3 h=auto_l0)
#5       9.75s best:6248  next:[1925,6247] rins_lp_lns (d=0.88 s=104 t=0.10 p=1.00 stall=3 h=auto_l0)
#6      10.21s best:5922  next:[1925,5921] no_lp (fixed_bools=0/431)
#Bound  10.34s best:5922  next:[1951,5921] reduced_costs
#Bound  10.59s best:5922  next:[1970,5921] reduced_costs
#7      10.66s best:5917  next:[1970,5916] quick_restart_no_lp (fixed_bools=0/555)
#Bound  10.87s best:5917  next:[1978,5916] reduced_costs
#Bound  11.18s best:5917  next:[1980,5916] reduced_costs
#8      11.60s best:5912  next:[1980,5911] quick_restart_no_lp (fixed_bools=0/558)
#9      11.65s best:5888  next:[1980,5887] no_lp (fixed_bools=0/443)
#10     13.91s best:5883  next:[1980,5882] quick_restart_no_lp (fixed_bools=0/611)
#11     14.05s best:5881  next:[1980,5880] violation_ls(batch:7 #solutions_imported:5 #lin_moves:19'767 #lin_evals:152'853 #gen_moves:26'725 #gen_evals:4'920 #comp_moves:4'348 #backtracks:11'180 #weight_updates:464)
#12     14.07s best:5879  next:[1980,5878] violation_ls(batch:7 #solutions_imported:5 #lin_moves:49'166 #lin_evals:217'402 #gen_moves:7'301 #gen_evals:1'315 #comp_moves:435 #backtracks:3'429 #weight_updates:930)
#13     14.51s best:5878  next:[1980,5877] rnd_var_lns (d=0.96 s=135 t=0.10 p=1.00 stall=6 h=auto_l0) [hint]
#Bound  15.39s best:5878  next:[1983,5877] lb_tree_search
#Bound  15.68s best:5878  next:[1993,5877] objective_lb_search_max_lp
#14     16.76s best:5421  next:[1993,5420] rins_lp_lns (d=0.91 s=144 t=0.10 p=1.00 stall=0 h=auto_l0)
#15     17.02s best:5393  next:[1993,5392] rins_pump_lns (d=0.83 s=159 t=0.10 p=0.67 stall=0 h=auto_l0)
#Bound  17.39s best:5393  next:[2017,5392] objective_lb_search_max_lp
#16     18.49s best:5381  next:[2017,5380] graph_arc_lns (d=0.98 s=165 t=0.10 p=1.00 stall=4 h=auto_l0)
#17     20.08s best:5359  next:[2017,5358] rins_lp_lns (d=0.91 s=185 t=0.10 p=0.75 stall=0 h=auto_l0)
#18     21.39s best:5351  next:[2017,5350] graph_dec_lns (d=0.99 s=193 t=0.10 p=1.00 stall=10 h=folio_rnd)
#19     21.73s best:5350  next:[2017,5349] violation_ls(batch:12 #solutions_imported:10 #lin_moves:58'974 #lin_evals:326'192 #gen_moves:30'615 #gen_evals:4'940 #comp_moves:2'865 #backtracks:13'864 #weight_updates:1'372)
#20     22.00s best:5341  next:[2017,5340] quick_restart_no_lp (fixed_bools=0/846)
#21     22.46s best:5340  next:[2017,5339] quick_restart_no_lp (fixed_bools=0/849)
#22     23.35s best:5339  next:[2017,5338] violation_ls(batch:13 #solutions_imported:11 #lin_moves:37'562 #lin_evals:275'897 #gen_moves:48'761 #gen_evals:8'638 #comp_moves:5'988 #backtracks:21'371 #weight_updates:2'915)
#23     23.36s best:5338  next:[2017,5337] violation_ls(batch:13 #solutions_imported:11 #lin_moves:58'974 #lin_evals:326'247 #gen_moves:30'644 #gen_evals:4'943 #comp_moves:2'868 #backtracks:13'877 #weight_updates:1'372)
#24     23.52s best:5336  next:[2017,5335] quick_restart_no_lp (fixed_bools=0/856)
#25     25.24s best:5331  next:[2017,5330] quick_restart_no_lp (fixed_bools=0/925)
#26     25.25s best:5328  next:[2017,5327] graph_var_lns (d=0.99 s=214 t=0.10 p=1.00 stall=2 h=auto_l0)
#27     25.32s best:5245  next:[2017,5244] graph_arc_lns (d=0.99 s=215 t=0.10 p=1.00 stall=0 h=auto_l0)
#28     25.37s best:5244  next:[2017,5243] violation_ls(batch:14 #solutions_imported:12 #lin_moves:37'562 #lin_evals:279'571 #gen_moves:50'721 #gen_evals:8'936 #comp_moves:6'108 #backtracks:22'291 #weight_updates:2'944)
#29     25.44s best:5243  next:[2017,5242] violation_ls(batch:14 #solutions_imported:12 #lin_moves:58'974 #lin_evals:331'884 #gen_moves:33'280 #gen_evals:5'361 #comp_moves:2'944 #backtracks:15'157 #weight_updates:1'406)
#30     26.43s best:5242  next:[2017,5241] quick_restart_no_lp (fixed_bools=0/985)
#31     27.38s best:5241  next:[2017,5240] violation_ls(batch:15 #solutions_imported:13 #lin_moves:37'563 #lin_evals:279'588 #gen_moves:50'721 #gen_evals:8'936 #comp_moves:6'108 #backtracks:22'291 #weight_updates:2'944)
#32     27.39s best:5240  next:[2017,5239] violation_ls(batch:15 #solutions_imported:13 #lin_moves:58'974 #lin_evals:331'890 #gen_moves:33'284 #gen_evals:5'361 #comp_moves:2'948 #backtracks:15'157 #weight_updates:1'406)
#33     27.63s best:5188  next:[2017,5187] rnd_cst_lns (d=0.99 s=225 t=0.10 p=1.00 stall=5 h=auto_l0)
#34     28.20s best:5187  next:[2017,5186] rins_lp_lns (d=0.91 s=233 t=0.10 p=0.67 stall=0 h=auto_l0)
#35     29.08s best:5114  next:[2017,5113] rins_lp_lns (d=0.88 s=245 t=0.10 p=0.62 stall=0 h=auto_l0)
#36     31.79s best:4911  next:[2017,4910] rins_lp_lns (d=0.91 s=257 t=0.10 p=0.64 stall=0 h=auto_l0)
#37     33.83s best:4905  next:[2017,4904] quick_restart (fixed_bools=0/555)
#38     34.74s best:4903  next:[2017,4902] rnd_cst_lns (d=0.99 s=261 t=0.10 p=0.93 stall=0 h=auto_l0)
#39     38.72s best:4836  next:[2017,4835] rins_lp_lns (d=0.89 s=293 t=0.10 p=0.59 stall=2 h=auto_l0)
#40     41.56s best:4819  next:[2017,4818] graph_arc_lns (d=0.99 s=299 t=0.10 p=0.83 stall=2 h=auto_l0)
#41     42.05s best:4788  next:[2017,4787] quick_restart_no_lp (fixed_bools=0/1529)
#42     42.92s best:4787  next:[2017,4786] violation_ls(batch:22 #solutions_imported:18 #lin_moves:75'900 #lin_evals:514'305 #gen_moves:63'241 #gen_evals:11'301 #comp_moves:8'787 #backtracks:27'211 #weight_updates:5'565)
#43     42.94s best:4786  next:[2017,4785] violation_ls(batch:22 #solutions_imported:18 #lin_moves:76'304 #lin_evals:461'161 #gen_moves:58'247 #gen_evals:10'143 #comp_moves:6'421 #backtracks:25'893 #weight_updates:4'264)
#44     43.26s best:4785  next:[2017,4784] quick_restart_no_lp (fixed_bools=0/1575)
#45     45.47s best:4784  next:[2017,4783] rnd_cst_lns (d=0.99 s=322 t=0.10 p=0.80 stall=0 h=auto_l0)
#46     45.50s best:4783  next:[2017,4782] violation_ls(batch:23 #solutions_imported:19 #lin_moves:75'900 #lin_evals:514'333 #gen_moves:63'264 #gen_evals:11'304 #comp_moves:8'788 #backtracks:27'222 #weight_updates:5'565)
#47     45.53s best:4782  next:[2017,4781] violation_ls(batch:23 #solutions_imported:19 #lin_moves:77'780 #lin_evals:466'657 #gen_moves:58'247 #gen_evals:10'143 #comp_moves:6'421 #backtracks:25'893 #weight_updates:4'412)
#48     46.94s best:4728  next:[2017,4727] graph_cst_lns (d=0.99 s=325 t=0.10 p=0.85 stall=2 h=auto_l0)
#49     47.56s best:4720  next:[2017,4719] quick_restart_no_lp (fixed_bools=0/1648)
#50     47.75s best:4719  next:[2017,4718] violation_ls(batch:24 #solutions_imported:20 #lin_moves:77'780 #lin_evals:471'073 #gen_moves:60'373 #gen_evals:10'395 #comp_moves:6'589 #backtracks:26'872 #weight_updates:4'451)
#51     49.10s best:4718  next:[2017,4717] quick_restart_no_lp (fixed_bools=0/1688)
#52     49.14s best:4133  next:[2017,4132] rins_lp_lns (d=0.91 s=342 t=0.10 p=0.60 stall=1 h=auto_l0)
#53     49.42s best:4131  next:[2017,4130] quick_restart_no_lp (fixed_bools=0/1759)
#54     50.27s best:4130  next:[2017,4129] violation_ls(batch:25 #solutions_imported:21 #lin_moves:80'495 #lin_evals:482'213 #gen_moves:60'373 #gen_evals:10'395 #comp_moves:6'589 #backtracks:26'872 #weight_updates:4'869)
#55     50.36s best:4033  next:[2017,4032] rins_lp_lns (d=0.89 s=355 t=0.10 p=0.57 stall=0 h=auto_l0)
#56     51.61s best:4017  next:[2017,4016] quick_restart_no_lp (fixed_bools=0/1815)
#57     52.97s best:4016  next:[2017,4015] violation_ls(batch:26 #solutions_imported:22 #lin_moves:75'900 #lin_evals:540'751 #gen_moves:76'851 #gen_evals:13'026 #comp_moves:9'467 #backtracks:33'676 #weight_updates:5'727)
#58     52.98s best:4015  next:[2017,4014] violation_ls(batch:26 #solutions_imported:22 #lin_moves:80'509 #lin_evals:482'289 #gen_moves:60'373 #gen_evals:10'395 #comp_moves:6'589 #backtracks:26'872 #weight_updates:4'876)
#59     53.71s best:3940  next:[2017,3939] graph_dec_lns (d=1.00 s=363 t=0.10 p=0.83 stall=0 h=auto_l0)
#60     54.43s best:3924  next:[2017,3923] quick_restart_no_lp (fixed_bools=0/1887)
#61     54.59s best:3923  next:[2017,3922] violation_ls(batch:27 #solutions_imported:23 #lin_moves:78'524 #lin_evals:549'926 #gen_moves:76'851 #gen_evals:13'026 #comp_moves:9'467 #backtracks:33'676 #weight_updates:5'927)
#62     54.60s best:3922  next:[2017,3921] violation_ls(batch:27 #solutions_imported:23 #lin_moves:80'510 #lin_evals:482'305 #gen_moves:60'373 #gen_evals:10'395 #comp_moves:6'589 #backtracks:26'872 #weight_updates:4'876)
#63     55.22s best:3917  next:[2017,3916] graph_arc_lns (d=0.99 s=374 t=0.10 p=0.75 stall=1 h=auto_l0)
#64     58.59s best:3882  next:[2017,3881] rins_lp_lns (d=0.91 s=393 t=0.10 p=0.58 stall=2 h=auto_l0)
#65     70.67s best:3867  next:[2017,3866] graph_arc_lns (d=0.99 s=449 t=0.10 p=0.71 stall=2 h=auto_l0)
#66     71.21s best:3859  next:[2017,3858] quick_restart_no_lp (fixed_bools=0/2065)
#67     71.28s best:3857  next:[2017,3856] violation_ls(batch:34 #solutions_imported:26 #lin_moves:128'186 #lin_evals:756'793 #gen_moves:84'910 #gen_evals:14'054 #comp_moves:10'345 #backtracks:37'266 #weight_updates:6'344)
#68     71.29s best:3855  next:[2017,3854] violation_ls(batch:34 #solutions_imported:26 #lin_moves:130'140 #lin_evals:717'283 #gen_moves:68'140 #gen_evals:11'524 #comp_moves:7'488 #backtracks:30'303 #weight_updates:5'321)
#69     73.20s best:3854  next:[2017,3853] quick_restart_no_lp (fixed_bools=0/2092)
#70     74.22s best:3852  next:[2017,3851] violation_ls(batch:35 #solutions_imported:27 #lin_moves:128'186 #lin_evals:756'846 #gen_moves:84'949 #gen_evals:14'055 #comp_moves:10'346 #backtracks:37'285 #weight_updates:6'344)
#71     74.24s best:3851  next:[2017,3850] violation_ls(batch:35 #solutions_imported:27 #lin_moves:130'140 #lin_evals:717'368 #gen_moves:68'201 #gen_evals:11'527 #comp_moves:7'489 #backtracks:30'333 #weight_updates:5'321)
#Bound  74.77s best:3851  next:[2018,3850] objective_lb_search_max_lp
#72     75.23s best:3850  next:[2018,3849] quick_restart_no_lp (fixed_bools=0/2134)
#Bound  77.72s best:3850  next:[2020,3849] objective_lb_search_max_lp
#73     79.89s best:3843  next:[2020,3842] rnd_var_lns (d=0.99 s=497 t=0.10 p=0.71 stall=0 h=auto_l0)
#74     81.10s best:3842  next:[2020,3841] violation_ls(batch:38 #solutions_imported:29 #lin_moves:150'782 #lin_evals:797'138 #gen_moves:68'201 #gen_evals:11'527 #comp_moves:7'489 #backtracks:30'333 #weight_updates:5'925)
#Bound  82.09s best:3842  next:[2021,3841] objective_lb_search_max_lp
#75     83.29s best:3841  next:[2021,3840] violation_ls(batch:39 #solutions_imported:30 #lin_moves:147'891 #lin_evals:839'097 #gen_moves:93'037 #gen_evals:15'155 #comp_moves:11'118 #backtracks:40'940 #weight_updates:6'711)
#76     83.52s best:3829  next:[2021,3828] rnd_cst_lns (d=0.99 s=525 t=0.10 p=0.67 stall=0 h=auto_l0)
#Bound  86.41s best:3829  next:[2029,3828] objective_lb_search_max_lp
#Bound  90.84s best:3829  next:[2038,3828] objective_lb_search_max_lp
#77     96.84s best:3810  next:[2038,3809] quick_restart_no_lp (fixed_bools=0/2346)
#78     97.99s best:3809  next:[2038,3808] violation_ls(batch:45 #solutions_imported:32 #lin_moves:147'891 #lin_evals:921'536 #gen_moves:122'271 #gen_evals:19'887 #comp_moves:16'179 #backtracks:53'009 #weight_updates:6'864)
#79     98.01s best:3808  next:[2038,3807] violation_ls(batch:45 #solutions_imported:32 #lin_moves:150'835 #lin_evals:895'373 #gen_moves:104'094 #gen_evals:17'096 #comp_moves:14'152 #backtracks:44'939 #weight_updates:6'186)
#80    100.20s best:3807  next:[2038,3806] violation_ls(batch:46 #solutions_imported:33 #lin_moves:147'898 #lin_evals:921'586 #gen_moves:122'271 #gen_evals:19'887 #comp_moves:16'179 #backtracks:53'009 #weight_updates:6'868)
#81    100.22s best:3806  next:[2038,3805] violation_ls(batch:46 #solutions_imported:33 #lin_moves:150'875 #lin_evals:895'548 #gen_moves:104'094 #gen_evals:17'096 #comp_moves:14'152 #backtracks:44'939 #weight_updates:6'206)
#82    100.32s best:3788  next:[2038,3787] rins_pump_lns (d=0.91 s=628 t=0.10 p=0.55 stall=2 h=auto_l0)
#83    103.98s best:3782  next:[2038,3781] graph_cst_lns (d=0.99 s=635 t=0.10 p=0.66 stall=3 h=auto_l0)
#Bound 105.88s best:3782  next:[2067,3781] objective_lb_search_max_lp
#84    121.22s best:3781  next:[2067,3780] graph_dec_lns (d=0.99 s=726 t=0.10 p=0.63 stall=4 h=auto_l0)
#85    125.99s best:3780  next:[2067,3779] rnd_var_lns (d=0.99 s=746 t=0.10 p=0.62 stall=3 h=auto_l0)
#86    127.49s best:3779  next:[2067,3778] violation_ls(batch:57 #solutions_imported:37 #lin_moves:148'648 #lin_evals:1'110'037 #gen_moves:207'853 #gen_evals:28'883 #comp_moves:23'336 #backtracks:92'208 #weight_updates:7'640)
#87    127.51s best:3778  next:[2067,3777] violation_ls(batch:57 #solutions_imported:37 #lin_moves:194'360 #lin_evals:1'152'177 #gen_moves:127'792 #gen_evals:19'556 #comp_moves:18'793 #backtracks:54'467 #weight_updates:32'902)
#88    128.01s best:3767  next:[2067,3766] rnd_var_lns (d=0.99 s=758 t=0.10 p=0.61 stall=0 h=auto_l0)
#89    129.93s best:3753  next:[2067,3752] rins_pump_lns (d=0.91 s=780 t=0.10 p=0.54 stall=0 h=auto_l0)
#90    129.95s best:3752  next:[2067,3751] violation_ls(batch:58 #solutions_imported:38 #lin_moves:149'782 #lin_evals:1'114'848 #gen_moves:207'853 #gen_evals:28'883 #comp_moves:23'336 #backtracks:92'208 #weight_updates:7'902)
#91    131.48s best:3750  next:[2067,3749] graph_var_lns (d=0.99 s=785 t=0.10 p=0.61 stall=1 h=auto_l0)
#92    132.03s best:3708  next:[2067,3707] rnd_var_lns (d=0.99 s=783 t=0.10 p=0.62 stall=0 h=auto_l0)
#93    132.08s best:3707  next:[2067,3706] violation_ls(batch:59 #solutions_imported:39 #lin_moves:150'590 #lin_evals:1'118'346 #gen_moves:207'853 #gen_evals:28'883 #comp_moves:23'336 #backtracks:92'208 #weight_updates:8'157)
#94    132.21s best:3706  next:[2067,3705] violation_ls(batch:59 #solutions_imported:39 #lin_moves:194'360 #lin_evals:1'184'200 #gen_moves:142'412 #gen_evals:21'012 #comp_moves:20'900 #backtracks:60'720 #weight_updates:33'027)
#95    132.57s best:3705  next:[2067,3704] quick_restart_no_lp (fixed_bools=0/3123)
#96    132.77s best:3704  next:[2067,3703] quick_restart_no_lp (fixed_bools=0/3133)
#97    134.47s best:3703  next:[2067,3702] violation_ls(batch:60 #solutions_imported:40 #lin_moves:151'194 #lin_evals:1'120'990 #gen_moves:207'853 #gen_evals:28'883 #comp_moves:23'336 #backtracks:92'208 #weight_updates:8'299)
#98    134.48s best:3702  next:[2067,3701] violation_ls(batch:60 #solutions_imported:40 #lin_moves:194'360 #lin_evals:1'184'225 #gen_moves:142'423 #gen_evals:21'016 #comp_moves:20'901 #backtracks:60'725 #weight_updates:33'027)
#99    135.31s best:3701  next:[2067,3700] quick_restart_no_lp (fixed_bools=0/3166)
#100   135.50s best:3699  next:[2067,3698] quick_restart_no_lp (fixed_bools=0/3173)
#101   135.70s best:3697  next:[2067,3696] quick_restart_no_lp (fixed_bools=0/3177)
#102   136.75s best:3695  next:[2067,3694] violation_ls(batch:61 #solutions_imported:41 #lin_moves:151'195 #lin_evals:1'121'008 #gen_moves:207'853 #gen_evals:28'883 #comp_moves:23'336 #backtracks:92'208 #weight_updates:8'299)
#103   136.76s best:3694  next:[2067,3693] violation_ls(batch:61 #solutions_imported:41 #lin_moves:194'360 #lin_evals:1'184'431 #gen_moves:142'522 #gen_evals:21'025 #comp_moves:20'906 #backtracks:60'772 #weight_updates:33'027)
#104   141.08s best:3693  next:[2067,3692] graph_dec_lns (d=1.00 s=825 t=0.10 p=0.63 stall=0 h=auto_l0)
#105   154.46s best:3690  next:[2067,3689] graph_cst_lns (d=0.99 s=899 t=0.10 p=0.60 stall=2 h=auto_l0)
#106   154.93s best:3684  next:[2067,3683] quick_restart_no_lp (fixed_bools=0/3414)
#107   155.76s best:3682  next:[2067,3681] quick_restart_no_lp (fixed_bools=0/3425)
#108   155.81s best:3678  next:[2067,3677] rins_lp_lns (d=0.88 s=917 t=0.10 p=0.52 stall=7 h=auto_l0)
#Bound 174.70s best:3678  next:[2085,3677] objective_lb_search_max_lp
#109   175.40s best:3676  next:[2085,3675] rnd_var_lns (d=0.99 s=1007 t=0.10 p=0.59 stall=0 h=auto_l0)
#110   180.30s best:3658  next:[2085,3657] graph_dec_lns (d=1.00 s=1027 t=0.10 p=0.60 stall=2 h=auto_l0)
#Bound 224.58s best:3658  next:[2088,3657] objective_lb_search_max_lp
#111   256.48s best:3656  next:[2088,3655] quick_restart_no_lp (fixed_bools=0/4043)
#112   258.45s best:3655  next:[2088,3654] violation_ls(batch:111 #solutions_imported:47 #lin_moves:274'539 #lin_evals:2'211'708 #gen_moves:304'315 #gen_evals:57'635 #comp_moves:34'270 #backtracks:134'960 #weight_updates:45'239)
#113   286.18s best:3639  next:[2088,3638] rins_lp_lns (d=0.90 s=1582 t=0.10 p=0.51 stall=1 h=auto_l0)
#114   292.12s best:3630  next:[2088,3629] graph_cst_lns (d=0.99 s=1602 t=0.10 p=0.56 stall=0 h=auto_l0)
#115   292.40s best:3629  next:[2088,3628] violation_ls(batch:125 #solutions_imported:50 #lin_moves:353'455 #lin_evals:2'578'789 #gen_moves:304'315 #gen_evals:57'635 #comp_moves:34'270 #backtracks:134'960 #weight_updates:96'823)
#116   292.47s best:3622  next:[2088,3621] rins_pump_lns (d=0.88 s=1619 t=0.10 p=0.50 stall=1 h=auto_l0)
#117   315.74s best:3621  next:[2088,3620] rnd_cst_lns (d=1.00 s=1724 t=0.10 p=0.56 stall=2 h=auto_l0)
#118   317.21s best:3620  next:[2088,3619] violation_ls(batch:135 #solutions_imported:52 #lin_moves:353'455 #lin_evals:2'774'038 #gen_moves:385'343 #gen_evals:65'529 #comp_moves:39'753 #backtracks:172'729 #weight_updates:97'552)
#119   317.23s best:3619  next:[2088,3618] violation_ls(batch:135 #solutions_imported:51 #lin_moves:530'971 #lin_evals:3'123'157 #gen_moves:335'483 #gen_evals:41'860 #comp_moves:31'583 #backtracks:151'902 #weight_updates:188'020)
#120   319.27s best:3615  next:[2088,3614] graph_dec_lns (d=0.99 s=1740 t=0.10 p=0.55 stall=0 h=auto_l0)
#121   322.82s best:3591  next:[2088,3590] rins_pump_lns (d=0.91 s=1770 t=0.10 p=0.52 stall=0 h=auto_l0)
#122   344.03s best:3585  next:[2088,3584] graph_var_lns (d=0.99 s=1863 t=0.10 p=0.55 stall=2 h=auto_l0)
#123   344.87s best:3584  next:[2088,3583] violation_ls(batch:146 #solutions_imported:54 #lin_moves:534'797 #lin_evals:3'323'955 #gen_moves:416'240 #gen_evals:50'394 #comp_moves:37'775 #backtracks:189'183 #weight_updates:188'950)
#124   347.09s best:3583  next:[2088,3582] violation_ls(batch:147 #solutions_imported:56 #lin_moves:462'388 #lin_evals:3'267'911 #gen_moves:385'343 #gen_evals:65'529 #comp_moves:39'753 #backtracks:172'729 #weight_updates:98'620)
#125   349.66s best:3575  next:[2088,3574] graph_arc_lns (d=0.99 s=1901 t=0.10 p=0.54 stall=1 h=auto_l0)
#Bound 356.06s best:3575  next:[2092,3574] objective_lb_search_max_lp
#Bound 434.17s best:3575  next:[2093,3574] objective_lb_search_max_lp
#Bound 577.22s best:3575  next:[2095,3574] objective_lb_search_max_lp
#Bound 636.45s best:3575  next:[2109,3574] objective_lb_search_max_lp
#Bound 697.30s best:3575  next:[2110,3574] objective_lb_search_max_lp
#Bound 812.89s best:3575  next:[2111,3574] objective_lb_search_max_lp
#Bound 1112.85s best:3575  next:[2112,3574] objective_lb_search_max_lp
#Bound 1180.73s best:3575  next:[2113,3574] objective_lb_search_max_lp
#Bound 1254.69s best:3575  next:[2114,3574] objective_lb_search_max_lp
#Bound 1349.14s best:3575  next:[2115,3574] objective_lb_search_max_lp
#Bound 1365.89s best:3575  next:[2119,3574] objective_lb_search_max_lp
#Bound 1692.07s best:3575  next:[2122,3574] objective_lb_search_max_lp
#Bound 1746.57s best:3575  next:[2125,3574] objective_lb_search_max_lp
#Bound 1913.31s best:3575  next:[2127,3574] objective_lb_search_max_lp
#Bound 2306.20s best:3575  next:[2128,3574] objective_lb_search_max_lp
#126   2616.23s best:3557  next:[2128,3556] rins_lp_lns (d=0.90 s=13640 t=0.10 p=0.50 stall=13 h=auto_l0)
#Bound 2801.43s best:3557  next:[2130,3556] objective_lb_search_max_lp
#Bound 2882.09s best:3557  next:[2131,3556] objective_lb_search_max_lp
#127   3339.26s best:3555  next:[2131,3554] rins_pump_lns (d=0.91 s=17526 t=0.10 p=0.50 stall=0 h=auto_l0)
#Bound 3356.79s best:3555  next:[2133,3554] objective_lb_search_max_lp
#128   3557.72s best:3533  next:[2133,3532] graph_arc_lns (d=0.99 s=18625 t=0.10 p=0.51 stall=1 h=auto_l0)
#Bound 3768.16s best:3533  next:[2134,3532] objective_lb_search_max_lp
#Bound 3929.39s best:3533  next:[2136,3532] objective_lb_search_max_lp
#Bound 4248.89s best:3533  next:[2137,3532] objective_lb_search_max_lp
#129   4395.20s best:3532  next:[2137,3531] quick_restart_no_lp (fixed_bools=9/8879)
#130   4395.51s best:3530  next:[2137,3529] quick_restart_no_lp (fixed_bools=9/8889)
#131   4397.11s best:3529  next:[2137,3528] violation_ls(batch:1832 #solutions_imported:61 #perturbations:15 #lin_moves:11'866'960 #lin_evals:88'568'551 #gen_moves:1'604'300 #gen_evals:704'042 #comp_moves:93'352 #backtracks:755'292 #weight_updates:208'111)
#132   4397.13s best:3528  next:[2137,3527] violation_ls(batch:1832 #solutions_imported:60 #perturbations:15 #lin_moves:6'583'685 #lin_evals:60'008'215 #gen_moves:2'799'898 #gen_evals:1'427'239 #comp_moves:118'269 #backtracks:1'340'576 #weight_updates:267'960)
#133   4397.78s best:3526  next:[2137,3525] quick_restart_no_lp (fixed_bools=9/8889)
#Bound 4778.55s best:3526  next:[2139,3525] objective_lb_search_max_lp
#Bound 5233.97s best:3526  next:[2140,3525] objective_lb_search_max_lp
#Bound 5413.08s best:3526  next:[2141,3525] objective_lb_search_max_lp
#Bound 6348.57s best:3526  next:[2142,3525] objective_lb_search_max_lp
#Bound 7213.59s best:3526  next:[2143,3525] objective_lb_search_max_lp
#Bound 7836.33s best:3526  next:[2144,3525] objective_lb_search_max_lp
#Bound 9203.70s best:3526  next:[2146,3525] objective_lb_search_max_lp
#Bound 9503.02s best:3526  next:[2148,3525] objective_lb_search_max_lp
#Bound 10435.89s best:3526  next:[2149,3525] objective_lb_search_max_lp
#Bound 10740.55s best:3526  next:[2150,3525] objective_lb_search_max_lp
#Bound 11723.69s best:3526  next:[2151,3525] objective_lb_search_max_lp
#Bound 12801.08s best:3526  next:[2152,3525] objective_lb_search_max_lp
#Bound 14340.78s best:3526  next:[2154,3525] objective_lb_search_max_lp
#Bound 14902.23s best:3526  next:[2155,3525] objective_lb_search_max_lp
#Bound 15666.80s best:3526  next:[2156,3525] objective_lb_search_max_lp
#Bound 16895.69s best:3526  next:[2157,3525] objective_lb_search_max_lp
#Bound 17211.93s best:3526  next:[2158,3525] objective_lb_search_max_lp
#Bound 18025.06s best:3526  next:[2159,3525] objective_lb_search_max_lp
#Bound 18264.96s best:3526  next:[2160,3525] objective_lb_search_max_lp
#Bound 18592.04s best:3526  next:[2161,3525] objective_lb_search_max_lp
#Bound 19663.95s best:3526  next:[2162,3525] objective_lb_search_max_lp
#Bound 20095.93s best:3526  next:[2163,3525] objective_lb_search_max_lp
#Bound 20210.28s best:3526  next:[2164,3525] objective_lb_search_max_lp
#Bound 22048.19s best:3526  next:[2165,3525] objective_lb_search_max_lp
#Bound 22984.56s best:3526  next:[2166,3525] objective_lb_search_max_lp
#Bound 24002.81s best:3526  next:[2167,3525] objective_lb_search_max_lp
#Bound 24055.14s best:3526  next:[2168,3525] objective_lb_search_max_lp
#Bound 24504.37s best:3526  next:[2169,3525] objective_lb_search_max_lp
#Bound 24855.19s best:3526  next:[2171,3525] objective_lb_search_max_lp
#Bound 25849.86s best:3526  next:[2172,3525] objective_lb_search_max_lp
#Bound 27010.27s best:3526  next:[2173,3525] objective_lb_search_max_lp
#Bound 28030.66s best:3526  next:[2174,3525] objective_lb_search_max_lp
#Bound 28200.46s best:3526  next:[2175,3525] objective_lb_search_max_lp
#Bound 29849.97s best:3526  next:[2176,3525] objective_lb_search_max_lp
#Bound 30726.20s best:3526  next:[2177,3525] objective_lb_search_max_lp
#Bound 30880.27s best:3526  next:[2179,3525] objective_lb_search_max_lp
#Bound 34009.03s best:3526  next:[2180,3525] objective_lb_search_max_lp
#Bound 36737.80s best:3526  next:[2181,3525] objective_lb_search_max_lp
#Bound 37438.98s best:3526  next:[2182,3525] objective_lb_search_max_lp
#Bound 38048.42s best:3526  next:[2183,3525] objective_lb_search_max_lp
#Bound 39173.20s best:3526  next:[2184,3525] objective_lb_search_max_lp
#Bound 40261.57s best:3526  next:[2185,3525] objective_lb_search_max_lp
#Bound 41778.91s best:3526  next:[2186,3525] objective_lb_search_max_lp
#Bound 42625.92s best:3526  next:[2188,3525] objective_lb_search_max_lp
#Bound 43803.64s best:3526  next:[2189,3525] objective_lb_search_max_lp
#Bound 44947.70s best:3526  next:[2190,3525] objective_lb_search_max_lp
#Bound 46975.77s best:3526  next:[2191,3525] objective_lb_search_max_lp
#Bound 50092.45s best:3526  next:[2202,3525] objective_lb_search_max_lp
#Bound 55610.95s best:3526  next:[2203,3525] objective_lb_search_max_lp
#Bound 55899.24s best:3526  next:[2204,3525] objective_lb_search_max_lp
#Bound 56852.82s best:3526  next:[2205,3525] objective_lb_search_max_lp
#Bound 60068.25s best:3526  next:[2206,3525] objective_lb_search_max_lp
#Bound 62274.74s best:3526  next:[2207,3525] objective_lb_search_max_lp
#Bound 62748.97s best:3526  next:[2208,3525] objective_lb_search_max_lp
#Bound 68412.56s best:3526  next:[2210,3525] objective_lb_search_max_lp
#Bound 73298.11s best:3526  next:[2211,3525] objective_lb_search_max_lp
#Bound 75883.91s best:3526  next:[2212,3525] objective_lb_search_max_lp
#Bound 76077.61s best:3526  next:[2213,3525] objective_lb_search_max_lp
#Bound 80510.36s best:3526  next:[2214,3525] lb_tree_search (nodes=1156180/1156382 rc=2370 decisions=11088118 @root=2226 restarts=15) 
#Bound 83543.48s best:3526  next:[2215,3525] lb_tree_search (nodes=1203869/1204085 rc=2442 decisions=11462475 @root=2301 restarts=15) 

Task timing                                  n [     min,      max]      avg      dev     time         n [     min,      max]      avg      dev    dtime
                             'core':         1 [  24.00h,   24.00h]   24.00h   0.00ns   24.00h         1 [  26.05h,   26.05h]   26.05h   0.00ns   26.05h
                       'default_lp':         1 [  24.00h,   24.00h]   24.00h   0.00ns   24.00h         1 [   3.02h,    3.02h]    3.02h   0.00ns    3.02h
                 'feasibility_pump':     20414 [257.11ms,   33.29s]    4.23s 426.76ms   23.99h     20413 [310.25ms,    7.66s] 587.88ms  53.17ms    3.33h
                            'fixed':         1 [  24.00h,   24.00h]   24.00h   0.00ns   24.00h         1 [   2.47h,    2.47h]    2.47h   0.00ns    2.47h
                  'fj_long_default':         2 [260.84ms,    1.15s] 707.42ms 446.59ms    1.41s         2 [221.14ms, 270.26ms] 245.70ms  24.56ms 491.40ms
              'fj_long_lin_default':         1 [   1.48s,    1.48s]    1.48s   0.00ns    1.48s         1 [207.87ms, 207.87ms] 207.87ms   0.00ns 207.87ms
                   'fj_long_random':         1 [   1.66s,    1.66s]    1.66s   0.00ns    1.66s         1 [270.97ms, 270.97ms] 270.97ms   0.00ns 270.97ms
                 'fj_short_default':         8 [168.41ms, 333.74ms] 209.70ms  53.58ms    1.68s         8 [208.44ms, 239.53ms] 227.28ms  11.91ms    1.82s
             'fj_short_lin_default':         1 [   1.54s,    1.54s]    1.54s   0.00ns    1.54s         1 [215.12ms, 215.12ms] 215.12ms   0.00ns 215.12ms
              'fj_short_lin_random':         4 [183.75ms, 822.05ms] 347.07ms 274.25ms    1.39s         4 [203.22ms, 249.30ms] 223.81ms  16.67ms 895.25ms
                  'fj_short_random':         6 [179.76ms, 420.26ms] 228.81ms  86.21ms    1.37s         6 [206.45ms, 244.48ms] 230.38ms  12.43ms    1.38s
                        'fs_random':         1 [   2.26s,    2.26s]    2.26s   0.00ns    2.26s         1 [ 49.69ms,  49.69ms]  49.69ms   0.00ns  49.69ms
                        'fs_random':         1 [   2.47s,    2.47s]    2.47s   0.00ns    2.47s         1 [129.17ms, 129.17ms] 129.17ms   0.00ns 129.17ms
                  'fs_random_no_lp':         1 [   2.49s,    2.49s]    2.49s   0.00ns    2.49s         1 [ 18.97ms,  18.97ms]  18.97ms   0.00ns  18.97ms
          'fs_random_quick_restart':         1 [   2.26s,    2.26s]    2.26s   0.00ns    2.26s         1 [131.75ms, 131.75ms] 131.75ms   0.00ns 131.75ms
          'fs_random_quick_restart':         1 [   2.50s,    2.50s]    2.50s   0.00ns    2.50s         1 [100.33ms, 100.33ms] 100.33ms   0.00ns 100.33ms
    'fs_random_quick_restart_no_lp':         1 [   2.36s,    2.36s]    2.36s   0.00ns    2.36s         1 [ 87.99ms,  87.99ms]  87.99ms   0.00ns  87.99ms
                    'graph_arc_lns':     37803 [304.82ms,    6.88s]    3.12s 605.24ms   32.75h     37788 [ 10.00ns, 199.18ms]  75.49ms  30.35ms   47.54m
                    'graph_cst_lns':     37803 [190.41ms,    6.50s]    3.10s 665.76ms   32.54h     37779 [ 10.00ns, 200.70ms]  71.72ms  34.37ms   45.16m
                    'graph_dec_lns':     37803 [234.50ms,    6.12s]    3.13s 620.11ms   32.83h     37788 [ 10.00ns, 200.12ms]  74.41ms  31.62ms   46.86m
                    'graph_var_lns':     37803 [268.01ms,    6.92s]    3.07s 716.50ms   32.25h     37778 [ 20.75us, 200.09ms]  71.45ms  33.99ms   44.98m
                   'lb_tree_search':         1 [  24.00h,   24.00h]   24.00h   0.00ns   24.00h         1 [   9.38h,    9.38h]    9.38h   0.00ns    9.38h
                           'max_lp':         1 [  24.00h,   24.00h]   24.00h   0.00ns   24.00h         1 [   5.00h,    5.00h]    5.00h   0.00ns    5.00h
                            'no_lp':         1 [  24.00h,   24.00h]   24.00h   0.00ns   24.00h         1 [   2.35h,    2.35h]    2.35h   0.00ns    2.35h
              'objective_lb_search':         1 [  24.00h,   24.00h]   24.00h   0.00ns   24.00h         1 [   3.21h,    3.21h]    3.21h   0.00ns    3.21h
       'objective_lb_search_max_lp':         1 [  24.00h,   24.00h]   24.00h   0.00ns   24.00h         1 [   4.31h,    4.31h]    4.31h   0.00ns    4.31h
        'objective_lb_search_no_lp':         1 [  24.00h,   24.00h]   24.00h   0.00ns   24.00h         1 [   2.15h,    2.15h]    2.15h   0.00ns    2.15h
  'objective_shaving_search_max_lp':        96 [246.64ms,    1.57h]   15.00m   19.93m   24.00h        93 [ 36.50ms,   13.22m]    1.61m    2.34m    2.49h
   'objective_shaving_search_no_lp':        99 [115.53ms,    1.57h]   14.54m   19.80m   24.00h        93 [ 36.64ms,    4.49m]   41.89s   56.46s    1.08h
                          'probing':         1 [  24.00h,   24.00h]   24.00h   0.00ns   24.00h         1 [   7.71h,    7.71h]    7.71h   0.00ns    7.71h
                   'probing_max_lp':         1 [  24.00h,   24.00h]   24.00h   0.00ns   24.00h         1 [   3.71h,    3.71h]    3.71h   0.00ns    3.71h
                     'pseudo_costs':         1 [  24.00h,   24.00h]   24.00h   0.00ns   24.00h         1 [   3.36h,    3.36h]    3.36h   0.00ns    3.36h
                    'quick_restart':         1 [  24.00h,   24.00h]   24.00h   0.00ns   24.00h         1 [   5.16h,    5.16h]    5.16h   0.00ns    5.16h
              'quick_restart_no_lp':         1 [  24.00h,   24.00h]   24.00h   0.00ns   24.00h         1 [   3.22h,    3.22h]    3.22h   0.00ns    3.22h
                    'reduced_costs':         1 [  24.00h,   24.00h]   24.00h   0.00ns   24.00h         1 [   4.23h,    4.23h]    4.23h   0.00ns    4.23h
                        'rins/rens':     37804 [665.21us,    4.78s]    1.28s 924.05ms   13.44h     33112 [ 10.00ns, 540.15ms] 127.38ms  90.92ms    1.17h
                      'rnd_cst_lns':     37803 [245.87ms,    6.36s]    3.10s 643.65ms   32.55h     37787 [ 10.00ns, 200.51ms]  72.53ms  33.58ms   45.68m
                      'rnd_var_lns':     37803 [148.06ms,    5.86s]    3.06s 636.72ms   32.17h     37791 [ 10.00ns, 200.22ms]  73.14ms  32.86ms   46.07m
         'scheduling_intervals_lns':     37803 [262.89ms,    6.27s]    3.85s 294.50ms   40.39h     37799 [100.00ms, 200.62ms] 100.20ms 753.58us    1.05h
       'scheduling_precedences_lns':     37803 [176.26ms,    7.01s]    3.93s 303.62ms   41.31h     37799 [100.00ms, 200.89ms] 100.20ms 754.62us    1.05h
       'scheduling_time_window_lns':     37803 [222.25ms,    7.35s]    3.85s 293.51ms   40.39h     37802 [  5.04ms, 100.73ms] 100.19ms 526.17us    1.05h
                     'violation_ls':     37803 [  4.56ms, 751.50ms] 237.00ms  67.81ms    2.49h     37803 [  1.48us, 773.70ms] 253.35ms  72.45ms    2.66h
                     'violation_ls':     37803 [  5.76ms, 896.26ms] 249.05ms  73.65ms    2.62h     37803 [  1.50us, 684.90ms] 261.99ms  71.73ms    2.75h

Search stats                          Bools  Conflicts    Branches   Restarts      BoolPropag   IntegerPropag
                           'core':   29'927  4'803'670   7'083'330     71'653  35'521'916'955  21'256'324'776
                     'default_lp':   31'392  2'320'547  22'082'101    424'069   9'214'117'498  19'931'908'493
                          'fixed':    3'197  7'785'130   7'796'704      1'583   2'835'155'324  27'168'374'603
                      'fs_random':      299          0         685        598              58         106'160
                      'fs_random':      313          1         612        598             280         118'918
                'fs_random_no_lp':      398          8         745        599             721         173'007
        'fs_random_quick_restart':      299          0         639        598              48         105'127
        'fs_random_quick_restart':      299          5         642        598              49         104'982
  'fs_random_quick_restart_no_lp':      352         21       1'810      1'225           1'186         401'402
                 'lb_tree_search':      377      1'219  31'645'419  7'938'468     102'021'870  17'545'878'700
                         'max_lp':    5'271  1'868'504  25'252'215  2'393'517   2'354'748'104  24'437'584'365
                          'no_lp':    9'273  3'544'505  20'743'170  1'075'167   4'489'571'897  31'476'641'133
            'objective_lb_search':    3'512  1'056'130  17'885'362  3'475'544   1'090'615'310  20'141'008'439
     'objective_lb_search_max_lp':    2'561  1'126'449  18'519'188  2'656'140     920'235'409  22'506'529'408
      'objective_lb_search_no_lp':    1'132  2'077'257  13'444'767  3'359'445     248'648'945  27'195'973'504
                        'probing':    5'469      4'483     187'569     79'546       4'627'677      58'333'914
                 'probing_max_lp':    5'469      4'512     193'125     81'356       4'724'393      59'816'116
                   'pseudo_costs':   17'731  2'606'228  31'371'216  1'211'920   7'710'291'621  23'738'933'351
                  'quick_restart':   31'109    824'051  36'817'890    420'511   7'774'499'560  14'987'212'912
            'quick_restart_no_lp':   34'272  3'030'811  24'951'004    381'118  18'929'281'984  27'264'309'459
                  'reduced_costs':  114'650  3'266'465  16'498'065    402'655  43'523'564'564  20'442'766'107

SAT stats                           ClassicMinim  LitRemoved   LitLearned  LitForgotten  Subsumed   MClauses  MDecisions  MLitTrue  MSubsumed  MLitRemoved  MReused
                           'core':     4'634'616  99'495'064  103'585'258    76'326'660     4'620     31'968     159'435         0        107          532      580
                     'default_lp':     2'087'146  25'966'602   68'510'669    54'233'740     7'052    143'227   2'212'842         0     48'684      657'933   30'328
                          'fixed':     5'978'086  26'970'777  264'559'470   262'444'040    23'756        285       2'644         0        192        1'735       34
                      'fs_random':             0           0            0             0         0          0           0         0          0            0        0
                      'fs_random':             0           0            9             0         0          0           0         0          0            0        0
                'fs_random_no_lp':             1           1           67             0         1          0           0         0          0            0        0
        'fs_random_quick_restart':             0           0            0             0         0          0           0         0          0            0        0
        'fs_random_quick_restart':             0           0           19             0         0          0           0         0          0            0        0
  'fs_random_quick_restart_no_lp':             5           8          135             0         0         28         138         0          0            0        2
                 'lb_tree_search':             3          24        3'867             0         0  3'643'995  18'374'639         0        174          692  348'353
                         'max_lp':     1'698'113  18'972'196   37'688'956    30'434'422    10'440    853'157   7'953'546         0     34'961      289'859  156'769
                          'no_lp':     3'250'090  36'433'611   81'743'972    71'242'499    17'476    195'185   2'493'543         0     47'277      533'758   50'355
            'objective_lb_search':     1'007'983  15'568'176   26'347'766    15'093'183     5'648  1'456'963   9'345'543         0      3'876       22'758  202'164
     'objective_lb_search_max_lp':     1'056'135  11'457'103   16'886'627     7'558'559     7'126    725'759   9'864'731         0     28'273      227'711  194'903
      'objective_lb_search_no_lp':     2'022'639  33'896'568   49'482'444    33'506'972     9'017  1'456'077   8'374'402         0        598        4'510  143'468
                        'probing':             0           0        4'503             0         0          0           0         0          0            0        0
                 'probing_max_lp':             0           0        4'536             0         0          0           0         0          0            0        0
                   'pseudo_costs':     2'111'061  13'730'885   62'907'240    56'942'657     5'676    331'909   3'436'604         0     39'846      253'904  156'469
                  'quick_restart':       697'988   7'015'514   23'335'096    18'840'564     8'134    132'456   2'849'638         0     66'233      934'736   24'096
            'quick_restart_no_lp':     2'701'268  34'734'298  101'434'903    86'056'048     6'798     44'581   1'084'554         0     29'620      431'628    4'189
                  'reduced_costs':     2'868'448  33'033'285  113'049'292   102'198'291    13'052    230'340   2'798'628         6     92'071      725'979   65'341

Lp stats                         Component   Iterations  AddedCuts    OPTIMAL     DUAL_F.  DUAL_U.
                  'default_lp':          1   38'432'830    970'246  5'666'864          90      125
                       'fixed':          1    7'029'009      2'068  8'361'186           0        0
                   'fs_random':          1        3'187        724         46           0        0
                   'fs_random':          1        5'110      1'497        122           0        0
     'fs_random_quick_restart':          1        4'677      1'194         81           0        0
     'fs_random_quick_restart':          1        5'271      1'330         86           0        0
              'lb_tree_search':          1  174'013'576    540'955    961'016  16'406'539        0
                      'max_lp':          1   76'189'340    402'719  1'080'854   7'076'369       15
         'objective_lb_search':          1   54'110'291    773'278  4'665'637         145       17
  'objective_lb_search_max_lp':          1   62'088'301    218'756    467'605   5'736'685       12
                     'probing':          1   72'620'257  1'814'575    410'080      30'946        6
              'probing_max_lp':          1   10'826'336    829'591    269'759     122'358        0
                'pseudo_costs':          1   26'636'848    808'020  3'790'107   1'729'695      557
               'quick_restart':          1  103'017'813  2'908'623  4'243'205      18'136       24
               'reduced_costs':          1   28'007'032    603'043  3'556'734   2'059'164      141

Lp dimension                                                                        Final dimension of first component
                  'default_lp':   2649 rows, 2832 columns, 9509 entries with magnitude in [8.622093e-03, 1.000000e+00]
                       'fixed':   2470 rows, 2832 columns, 8532 entries with magnitude in [1.103633e-02, 1.000000e+00]
                   'fs_random':   1596 rows, 2832 columns, 5677 entries with magnitude in [1.103633e-02, 1.000000e+00]
                   'fs_random':   2801 rows, 2832 columns, 9327 entries with magnitude in [1.103633e-02, 1.000000e+00]
     'fs_random_quick_restart':   2450 rows, 2832 columns, 8288 entries with magnitude in [1.103633e-02, 1.000000e+00]
     'fs_random_quick_restart':   2600 rows, 2832 columns, 8694 entries with magnitude in [1.103633e-02, 1.000000e+00]
              'lb_tree_search':  4567 rows, 2844 columns, 21417 entries with magnitude in [2.748496e-04, 1.000000e+00]
                      'max_lp':  4485 rows, 2844 columns, 21997 entries with magnitude in [3.975413e-04, 1.000000e+00]
         'objective_lb_search':  3132 rows, 2832 columns, 12098 entries with magnitude in [2.790967e-04, 1.000000e+00]
  'objective_lb_search_max_lp':  3896 rows, 2844 columns, 16846 entries with magnitude in [1.770988e-04, 1.000000e+00]
                     'probing':  4712 rows, 2832 columns, 29774 entries with magnitude in [1.084111e-04, 1.000000e+00]
              'probing_max_lp':  4088 rows, 2844 columns, 24259 entries with magnitude in [6.271390e-05, 1.000000e+00]
                'pseudo_costs':  3035 rows, 2844 columns, 12137 entries with magnitude in [1.017497e-04, 1.000000e+00]
               'quick_restart':  3867 rows, 2832 columns, 15754 entries with magnitude in [5.569945e-04, 1.000000e+00]
               'reduced_costs':  2972 rows, 2844 columns, 11354 entries with magnitude in [3.702729e-04, 1.000000e+00]

Lp debug                         CutPropag  CutEqPropag      Adjust  Overflow            Bad  BadScaling
                  'default_lp':         54          161     779'832         0     19'297'381           0
                       'fixed':          1            0           0         0         37'611           0
                   'fs_random':          0            0           0         0          1'911           0
                   'fs_random':          0            0          23         0          1'125           0
     'fs_random_quick_restart':          0            0           0         0          1'909           0
     'fs_random_quick_restart':          0            0           0         0          1'951           0
              'lb_tree_search':         49          318  16'851'280         0     58'331'933           0
                      'max_lp':         62          110   6'491'731         0     18'373'199           0
         'objective_lb_search':         61          268   2'117'811         0     23'758'459           0
  'objective_lb_search_max_lp':         43           69   6'048'676         0     21'094'117           0
                     'probing':        580       11'103     428'547         0  2'341'100'098           0
              'probing_max_lp':        170        5'387     392'116         0  2'360'523'551           0
                'pseudo_costs':        166          207   1'045'449         0     35'346'234           0
               'quick_restart':        262          370   2'283'530         0    104'592'569           0
               'reduced_costs':        212          180   2'707'748         0     32'992'582           0

Lp pool                          Constraints  Updates  Simplif  Merged  Shortened      Split  Strenghtened             Cuts/Call
                  'default_lp':       12'607    3'957   12'039     106          0    119'453        69'475     970'246/4'479'582
                       'fixed':        5'528        1       15       7          0          0           510          2'068/33'622
                   'fs_random':        4'191        0        0       0          0          0           400             724/1'935
                   'fs_random':        4'964        0        0       0          0          0           400           1'497/3'101
     'fs_random_quick_restart':        4'661        0        0       0          0          0           400           1'194/2'821
     'fs_random_quick_restart':        4'797        0        0       0          0          0           400           1'330/2'932
              'lb_tree_search':       47'065    6'413  340'733      59          0    473'418       326'859     540'955/1'441'537
                      'max_lp':       46'795    3'549  290'830      93          0    233'122       260'509     402'719/1'187'756
         'objective_lb_search':       12'714    5'261   14'343      31          0    172'882        80'870     773'278/4'810'239
  'objective_lb_search_max_lp':       46'884    3'129  375'826      41          0    555'411       295'926       218'756/620'685
                     'probing':       13'022  135'586   27'583      20          0  2'813'154       242'318   1'814'575/3'559'302
              'probing_max_lp':       46'722  173'912  319'451      38          0  1'017'872       334'476     829'591/2'035'552
                'pseudo_costs':       46'093    6'279  386'856      96          0    558'082       343'284     808'020/2'456'955
               'quick_restart':       12'898    9'429   11'765     192          0  1'536'563       124'777  2'908'623/10'060'626
               'reduced_costs':       46'108    5'552  368'007     104          0    559'458       322'201     603'043/1'731'671

Lp Cut                                                      fs_ran  fs_ran  fs_ran  fs_ran   defaul  fixed   max_lp     quick_   reduce   pseudo   lb_tre   probin   object   probin  object
                                                    CG_FF:      27      38      38      38   47'791     89   20'615     10'686   41'376   58'287   23'144   15'934   33'532    4'113  11'202
                                                     CG_K:      26      37      37      37   38'709     67   21'649      7'420   44'944   64'333   21'335    8'385   24'448    3'418   9'212
                                                    CG_KL:       -       -       -       -      235      -       27         39      158      199        3       37      174        3       1
                                                     CG_R:       9      16      16      16   20'599     33   10'806      5'906   19'699   28'913   16'379   25'898   17'631    3'147   6'329
                                                    CG_RB:       1       1       1       1   80'118    125   40'613     27'503   63'027   95'464   73'950   83'007   81'664   16'774  28'421
                                                   CG_RBP:       -       -       -       -    8'794      7    6'889      3'951   10'991   15'159   12'823   15'232    9'408    2'471   4'822
                                                   Clique:       -       -       -       -        -      -    3'982          -    7'577   13'562    2'243        -        -    1'572     934
                                                       IB:   1'294     919     446   1'048  534'691  1'224  169'967  2'481'031  177'280  248'506  183'983  474'528  418'132  104'041  77'938
                                                 MIR_1_FF:      56      75      74      76   26'420     99   12'520     33'595   25'988   35'731   14'090  132'784   18'597   22'582   6'116
                                                  MIR_1_K:       9      13      12      12    3'866     15    2'166      4'973    3'834    5'434    3'500   17'312    3'197    4'507   1'514
                                                 MIR_1_KL:       -       -       -       -    1'027      -      531      2'068      635      619      579    3'718    1'032    3'531     179
                                                  MIR_1_R:      16      24      24      24    6'160     23    2'318      8'236    4'849    6'070    3'248   96'737    4'101    7'839   1'509
                                                 MIR_1_RB:      11      14      13      15   39'451     89   26'971     64'785   47'953   53'333   41'191  156'376   30'678   51'439  15'866
                                                MIR_1_RBP:       2       2       2       2    3'991     17    6'592      7'802   10'105   10'716   10'271   11'158    4'307    5'364   3'687
                                                MIR_1_RLT:       -       -       -       -        -      -      285          -      551      792      239        -        -      671     116
                                                 MIR_2_FF:      11       9      10      11   17'075     15    6'329     16'715   13'780   18'422    7'748   33'836   10'565   18'851   3'244
                                                  MIR_2_K:      11      13      13      15    3'744     10    1'451      3'286    2'698    3'581    2'396    5'978    2'212    3'394   1'006
                                                 MIR_2_KL:       -       -       -       -      805      1      382      1'731      529      520      536    4'017      777    3'288     175
                                                  MIR_2_R:       5       4       5       4    4'695      7    1'762      5'045    3'872    4'821    3'366   31'780    2'942   10'928   1'321
                                                 MIR_2_RB:      11      18      18      18   24'706     42   11'459     41'142   20'874   24'422   18'680  100'132   18'720   27'997   7'110
                                                MIR_2_RBP:       -       -       -       -    3'223      5    2'565      6'173    4'047    4'831    3'783    9'302    3'568    4'189   1'395
                                                 MIR_3_FF:       1       -       -       2   11'111     15    3'827     10'644    8'480   11'148    4'845   18'291    7'963    9'247   1'703
                                                  MIR_3_K:       1       -       2       -    2'781      3    1'401      2'527    2'579    3'186    2'381    4'767    2'105    3'477     869
                                                 MIR_3_KL:       -       -       -       -      613      -      315      1'679      518      443      679    4'887      829    3'211     206
                                                  MIR_3_R:       1       -       -       -    2'918      2    1'148      3'995    2'159    2'506    2'291   15'867    2'442    6'993     734
                                                 MIR_3_RB:       2       1       2       3   14'707     21    5'983     24'546   11'217   13'452   10'096   65'949   11'764   19'962   3'700
                                                MIR_3_RBP:       -       -       -       -    2'174      3    1'356      4'549    2'057    2'677    2'034    8'393    2'830    2'282     749
                                                 MIR_4_FF:       -       -       -       -    6'778     19    2'101      6'927    4'569    5'867    2'806   11'655    4'847    5'416     952
                                                  MIR_4_K:       -       -       -       -    2'138      4      756      1'740    1'532    1'924    1'249    3'687    1'631    2'505     446
                                                 MIR_4_KL:       -       -       -       -      594      -      284      1'475      542      483      714    4'962      684    2'991     215
                                                  MIR_4_R:       -       -       -       -    1'789      4      666      2'750    1'078    1'195    1'259    7'952    1'671    3'858     380
                                                 MIR_4_RB:       -       -       -       -    9'015     19    3'198     14'929    6'061    6'834    5'411   39'715    7'228   11'007   1'967
                                                MIR_4_RBP:       -       -       -       -    1'215      6      664      3'051    1'124    1'315    1'098    5'757    1'623    1'543     391
                                                 MIR_5_FF:       -       -       -       -    3'946      2    1'136      4'165    2'402    3'322    1'704    8'181    2'848    3'188     589
                                                  MIR_5_K:       -       -       -       -    1'172      3      502      1'177      901    1'176      957    3'617      890    2'194     374
                                                 MIR_5_KL:       -       -       -       -      379      -      273      1'185      584      427      849    7'534      455    3'456     250
                                                  MIR_5_R:       -       -       -       -    1'097      -      336      1'698      564      709      711    4'576      897    1'885     269
                                                 MIR_5_RB:       -       -       -       -    5'330     10    1'832      9'159    3'315    4'048    3'114   27'314    4'314    7'780   1'079
                                                MIR_5_RBP:       -       -       -       -      648      -      340      1'858      637      824      754    5'403      840    1'106     247
                                                 MIR_6_FF:       -       -       -       -    2'269      2      741      2'596    1'457    1'865    1'223    6'311    1'794    1'896     377
                                                  MIR_6_K:       -       -       -       -      734      1      304        945      611      723      830    5'447      587    1'981     262
                                                 MIR_6_KL:       -       -       -       -      296      -      282      1'126      642      467    1'036   12'335      395    4'060     359
                                                  MIR_6_R:       -       -       -       -      562      2      232        977      343      412      442    2'786      484      878     128
                                                 MIR_6_RB:       -       -       -       -    3'217      3    1'095      5'970    1'933    2'376    2'295   25'333    2'886    5'541     790
                                                MIR_6_RBP:       -       -       -       -      390      -      214      1'222      433      532      652    7'146      512    1'094     183
         NoOverlapCompletionTimeExhaustiveMirror_weighted:       -       -       -       -        -      -        7          -       18       26        -        -        -        -       2
  NoOverlapCompletionTimeExhaustiveMirror_weighted_lifted:       -       -       -       -        -      -        -          -        4        1        -        -        -        -       -
               NoOverlapCompletionTimeExhaustive_weighted:       -       -       -       -        -      -       53          -       95       87      124        -        -        -      31
        NoOverlapCompletionTimeExhaustive_weighted_lifted:       -       -       -       -        -      -      646          -    1'384    2'482      479        -        -        3     112
                          NoOverlapCompletionTimeQueyrane:       -       -       -       -        -      -      206          -      444      414      198        -        -       45      53
                   NoOverlapCompletionTimeQueyrane_lifted:       -       -       -       -        -      -      581          -    1'263    1'283      235        -        -        3      61
                                NoOverlapDisjunctionOnEnd:       -       -       -       -        -      -       38          -      102      102       19        -        -        -       2
                              NoOverlapDisjunctionOnStart:       -       -       -       -        -      -      572          -    1'198    2'771        7        -        -        5      15
                                             ZERO_HALF_FF:       1       4       4       4    7'136     17    3'222      5'427    6'765    8'395    3'097    5'935    4'346    1'821   1'150
                                              ZERO_HALF_K:       -       1       1       -    2'276     11    1'762      1'815    3'672    4'689    2'371    1'571    1'697    1'161     904
                                             ZERO_HALF_KL:       -       -       -       -      188      -       26        171       62       74       37       30      231        5       4
                                              ZERO_HALF_R:       -       1       1       1    7'230     20    8'070     38'765   12'501   10'395   27'534  221'589    8'506  354'432  11'693
                                             ZERO_HALF_RB:       2       4       5       3    9'038     26    6'786     14'389   11'915   12'222   10'736   32'199    7'898   27'251   4'086
                                            ZERO_HALF_RBP:       -       -       -       -    2'405      7    1'885      5'079    3'115    3'453    3'201   19'235    2'396   37'195   1'327

LNS stats                        Improv/Calls  Closed  Difficulty  TimeLimit
               'graph_arc_lns':    7523/37802     50%        0.99       0.10
               'graph_cst_lns':   11114/37802     50%        0.99       0.10
               'graph_dec_lns':    8916/37802     50%        1.00       0.10
               'graph_var_lns':   11966/37802     50%        0.99       0.10
                   'rins/rens':    2609/35408     50%        0.91       0.30
                 'rnd_cst_lns':   10906/37802     50%        0.99       0.10
                 'rnd_var_lns':    9394/37802     50%        1.00       0.10
    'scheduling_intervals_lns':   37801/37801      0%        0.00       0.10
  'scheduling_precedences_lns':   37799/37801      0%        0.00       0.10
  'scheduling_time_window_lns':   37802/37802      0%        0.00       0.10

LS stats                   Batches  Restarts     LinMoves    GenMoves  CompoundMoves  WeightUpdates
       'fj_long_default':        2         1       19'916           0              0             84
   'fj_long_lin_default':        1         1            0       2'996            412              0
        'fj_long_random':        1         1        9'958           0              0             42
      'fj_short_default':        8         1            0      11'272          1'386              0
  'fj_short_lin_default':        1         1            0       2'876            309              0
   'fj_short_lin_random':        4         1            0       7'256          1'021              0
       'fj_short_random':        6         1            0      10'874          1'206              0
          'violation_ls':   37'803         0  192'742'011  20'398'864        783'645      2'820'628
          'violation_ls':   37'803         0  198'618'807  17'265'855        699'238      2'167'101

Solutions (133)           Num      Rank
      'fs_random_no_lp':    1     [1,1]
        'graph_arc_lns':    8   [4,128]
        'graph_cst_lns':    4  [48,114]
        'graph_dec_lns':    6  [18,120]
        'graph_var_lns':    3  [26,122]
                'no_lp':    4     [2,9]
        'quick_restart':    1   [37,37]
  'quick_restart_no_lp':   30   [7,133]
          'rins_lp_lns':   13   [5,126]
        'rins_pump_lns':    6  [15,127]
          'rnd_cst_lns':    5  [33,117]
          'rnd_var_lns':    6  [13,109]
         'violation_ls':   46  [11,132]

Objective bounds                 Num
                        'core':    1
              'initial_domain':    1
              'lb_tree_search':    3
  'objective_lb_search_max_lp':   89
   'objective_lb_search_no_lp':    2
                'pseudo_costs':    5
               'reduced_costs':    4

Solution repositories      Added  Queried  Ignored  Synchro
  'feasible solutions':  200'011  859'992        0  196'692
        'lp solutions':  127'167   18'921        0  121'292
                'pump':  428'516   18'883

Improving bounds shared             Num
                        'core':     509
                  'default_lp':     330
                       'fixed':       1
              'lb_tree_search':      45
                      'max_lp':     230
                       'no_lp':     129
         'objective_lb_search':      59
  'objective_lb_search_max_lp':      61
                     'probing':  28'147
              'probing_max_lp':   8'903
                'pseudo_costs':     318
               'quick_restart':   1'008
         'quick_restart_no_lp':   1'495
               'reduced_costs':   1'292

Clauses shared                      Num
                           'core':   12
                     'default_lp':   12
  'fs_random_quick_restart_no_lp':    1
                 'lb_tree_search':    2
                         'max_lp':   10
                          'no_lp':    7
            'objective_lb_search':    6
     'objective_lb_search_max_lp':    7
      'objective_lb_search_no_lp':   13
                   'pseudo_costs':   20
                  'quick_restart':   21
            'quick_restart_no_lp':   41

CpSolverResponse summary:
status: FEASIBLE
objective: 3526
best_bound: 2215
integers: 2839
booleans: 299
conflicts: 0
branches: 685
propagations: 58
integer_propagations: 106160
restarts: 598
lp_iterations: 5110
walltime: 86401.9
usertime: 86401.9
deterministic_time: 383648
gap_integral: 2.75593e+06
solution_fingerprint: 0xecfac0f13e6e9f67


--- Simulation Gantt  partir du modle mathmatique ---
