created virtual environment CPython3.12.4.final.0-64 in 537ms
  creator CPython3Posix(dest=/localscratch/aneumann.47038287.0/env, clear=False, no_vcs_ignore=False, global=False)
  seeder FromAppData(download=False, pip=bundle, via=copy, app_data_dir=/home/aneumann/.local/share/virtualenv)
    added seed packages: pip==24.2+computecanada
  activators BashActivator,CShellActivator,FishActivator,NushellActivator,PowerShellActivator,PythonActivator
Looking in links: /cvmfs/soft.computecanada.ca/custom/python/wheelhouse/gentoo2023/x86-64-v3, /cvmfs/soft.computecanada.ca/custom/python/wheelhouse/gentoo2023/generic, /cvmfs/soft.computecanada.ca/custom/python/wheelhouse/generic
Requirement already satisfied: pip in /localscratch/aneumann.47038287.0/env/lib/python3.12/site-packages (24.2+computecanada)
Processing /cvmfs/soft.computecanada.ca/custom/python/wheelhouse/generic/pip-25.0+computecanada-py3-none-any.whl
Installing collected packages: pip
  Attempting uninstall: pip
    Found existing installation: pip 24.2+computecanada
    Uninstalling pip-24.2+computecanada:
      Successfully uninstalled pip-24.2+computecanada
Successfully installed pip-24.2+computecanada
Looking in links: /cvmfs/soft.computecanada.ca/custom/python/wheelhouse/gentoo2023/x86-64-v3, /cvmfs/soft.computecanada.ca/custom/python/wheelhouse/gentoo2023/generic, /cvmfs/soft.computecanada.ca/custom/python/wheelhouse/generic
ERROR: protobuf-5.28.3-cp38-abi3-manylinux2014_x86_64.whl is not a supported wheel on this platform.
Looking in links: /cvmfs/soft.computecanada.ca/custom/python/wheelhouse/gentoo2023/x86-64-v3, /cvmfs/soft.computecanada.ca/custom/python/wheelhouse/gentoo2023/generic, /cvmfs/soft.computecanada.ca/custom/python/wheelhouse/generic
Processing /home/aneumann/projects/def-adhaj/aneumann/GNRS/wheels/immutabledict-4.2.0-py3-none-any.whl
Installing collected packages: immutabledict
Successfully installed immutabledict-4.2.0
Looking in links: /cvmfs/soft.computecanada.ca/custom/python/wheelhouse/gentoo2023/x86-64-v3, /cvmfs/soft.computecanada.ca/custom/python/wheelhouse/gentoo2023/generic, /cvmfs/soft.computecanada.ca/custom/python/wheelhouse/generic
Processing /cvmfs/soft.computecanada.ca/custom/python/wheelhouse/generic/ortools-9.10.4067+computecanada-cp312-cp312-linux_x86_64.whl (from -r /home/aneumann/projects/def-adhaj/aneumann/GNRS/requirements/or.txt (line 1))
Processing /cvmfs/soft.computecanada.ca/custom/python/wheelhouse/gentoo2023/x86-64-v3/matplotlib-3.10.0+computecanada-cp312-cp312-linux_x86_64.whl (from -r /home/aneumann/projects/def-adhaj/aneumann/GNRS/requirements/or.txt (line 2))
Processing /cvmfs/soft.computecanada.ca/custom/python/wheelhouse/gentoo2023/x86-64-v3/pandas-2.2.3+computecanada-cp312-cp312-linux_x86_64.whl (from -r /home/aneumann/projects/def-adhaj/aneumann/GNRS/requirements/or.txt (line 3))
Processing /cvmfs/soft.computecanada.ca/custom/python/wheelhouse/generic/absl_py-2.3.0+computecanada-py3-none-any.whl (from ortools<9.11,>=9.10->-r /home/aneumann/projects/def-adhaj/aneumann/GNRS/requirements/or.txt (line 1))
Processing /cvmfs/soft.computecanada.ca/custom/python/wheelhouse/gentoo2023/generic/numpy-2.2.2+computecanada-cp312-cp312-linux_x86_64.whl (from ortools<9.11,>=9.10->-r /home/aneumann/projects/def-adhaj/aneumann/GNRS/requirements/or.txt (line 1))
Processing /cvmfs/soft.computecanada.ca/custom/python/wheelhouse/gentoo2023/x86-64-v3/protobuf-6.31.1+computecanada-cp312-cp312-linux_x86_64.whl (from ortools<9.11,>=9.10->-r /home/aneumann/projects/def-adhaj/aneumann/GNRS/requirements/or.txt (line 1))
Requirement already satisfied: immutabledict>=3.0.0 in /localscratch/aneumann.47038287.0/env/lib/python3.12/site-packages (from ortools<9.11,>=9.10->-r /home/aneumann/projects/def-adhaj/aneumann/GNRS/requirements/or.txt (line 1)) (4.2.0)
Processing /cvmfs/soft.computecanada.ca/custom/python/wheelhouse/gentoo2023/generic/contourpy-1.3.1+computecanada-cp312-cp312-linux_x86_64.whl (from matplotlib->-r /home/aneumann/projects/def-adhaj/aneumann/GNRS/requirements/or.txt (line 2))
Processing /cvmfs/soft.computecanada.ca/custom/python/wheelhouse/generic/cycler-0.12.1+computecanada-py3-none-any.whl (from matplotlib->-r /home/aneumann/projects/def-adhaj/aneumann/GNRS/requirements/or.txt (line 2))
Processing /cvmfs/soft.computecanada.ca/custom/python/wheelhouse/generic/fonttools-4.59.0+computecanada-cp312-cp312-linux_x86_64.whl (from matplotlib->-r /home/aneumann/projects/def-adhaj/aneumann/GNRS/requirements/or.txt (line 2))
Processing /cvmfs/soft.computecanada.ca/custom/python/wheelhouse/gentoo2023/x86-64-v3/kiwisolver-1.4.8+computecanada-cp312-cp312-linux_x86_64.whl (from matplotlib->-r /home/aneumann/projects/def-adhaj/aneumann/GNRS/requirements/or.txt (line 2))
Processing /cvmfs/soft.computecanada.ca/custom/python/wheelhouse/generic/packaging-25.0+computecanada-py3-none-any.whl (from matplotlib->-r /home/aneumann/projects/def-adhaj/aneumann/GNRS/requirements/or.txt (line 2))
Processing /cvmfs/soft.computecanada.ca/custom/python/wheelhouse/gentoo2023/x86-64-v3/pillow-11.1.0+computecanada-cp312-cp312-linux_x86_64.whl (from matplotlib->-r /home/aneumann/projects/def-adhaj/aneumann/GNRS/requirements/or.txt (line 2))
Processing /cvmfs/soft.computecanada.ca/custom/python/wheelhouse/generic/pyparsing-3.2.3+computecanada-py3-none-any.whl (from matplotlib->-r /home/aneumann/projects/def-adhaj/aneumann/GNRS/requirements/or.txt (line 2))
Processing /cvmfs/soft.computecanada.ca/custom/python/wheelhouse/generic/python_dateutil-2.9.0.post0+computecanada-py2.py3-none-any.whl (from matplotlib->-r /home/aneumann/projects/def-adhaj/aneumann/GNRS/requirements/or.txt (line 2))
Processing /cvmfs/soft.computecanada.ca/custom/python/wheelhouse/generic/pytz-2025.2+computecanada-py2.py3-none-any.whl (from pandas->-r /home/aneumann/projects/def-adhaj/aneumann/GNRS/requirements/or.txt (line 3))
Processing /cvmfs/soft.computecanada.ca/custom/python/wheelhouse/generic/tzdata-2025.2+computecanada-py2.py3-none-any.whl (from pandas->-r /home/aneumann/projects/def-adhaj/aneumann/GNRS/requirements/or.txt (line 3))
Processing /cvmfs/soft.computecanada.ca/custom/python/wheelhouse/generic/six-1.17.0+computecanada-py2.py3-none-any.whl (from python-dateutil>=2.7->matplotlib->-r /home/aneumann/projects/def-adhaj/aneumann/GNRS/requirements/or.txt (line 2))
Installing collected packages: pytz, tzdata, six, pyparsing, protobuf, pillow, packaging, numpy, kiwisolver, fonttools, cycler, absl-py, python-dateutil, contourpy, pandas, matplotlib, ortools
Successfully installed absl-py-2.3.0+computecanada contourpy-1.3.1+computecanada cycler-0.12.1+computecanada fonttools-4.59.0+computecanada kiwisolver-1.4.8+computecanada matplotlib-3.10.0+computecanada numpy-2.2.2+computecanada ortools-9.10.4067+computecanada packaging-25.0+computecanada pandas-2.2.3+computecanada pillow-11.1.0+computecanada protobuf-6.31.1+computecanada pyparsing-3.2.3+computecanada python-dateutil-2.9.0.post0+computecanada pytz-2025.2+computecanada six-1.17.0+computecanada tzdata-2025.2+computecanada

Starting CP-SAT solver v9.10.4067
Parameters: max_time_in_seconds: 86400 max_memory_in_mb: 185000 log_search_progress: true enumerate_all_solutions: false num_search_workers: 32 absolute_gap_limit: 0 relative_gap_limit: 0

Initial optimization model '': (model_fingerprint: 0x94daed4688b99474)
#Variables: 890 (#ints: 17 in objective)
  - 717 Booleans in [0,1]
  - 173 in [0,1334]
#kLinear1: 85
#kLinear2: 1'810
#kLinear3: 782
#kLinearN: 34'158 (#terms: 894'765)

Starting presolve at 0.02s
  4.07e-02s  0.00e+00d  [DetectDominanceRelations] 
  6.60e-01s  0.00e+00d  [PresolveToFixPoint] #num_loops=8 #num_dual_strengthening=3 
  3.32e-04s  0.00e+00d  [ExtractEncodingFromLinear] #potential_supersets=8 
[Symmetry] Graph for symmetry has 36'359 nodes and 775'381 arcs.
[Symmetry] Symmetry computation done. time: 0.0290039 dtime: 0.054605
[Symmetry] #generators: 1, average support size: 48
[Symmetry] The model contains 826 duplicate constraints !
[Symmetry] 24 orbits with sizes: 2,2,2,2,2,2,2,2,2,2,...
[Symmetry] Num fixable by intersecting at_most_one with orbits: 1 largest_orbit: 2
  2.64e-01s  6.34e-02d  [Probe] #probed=1'172 #new_bounds=17 #equiv=1 
  3.12e-04s  0.00e+00d  [MaxClique] 
  4.01e-02s  0.00e+00d  [DetectDominanceRelations] 
  3.23e-01s  0.00e+00d  [PresolveToFixPoint] #num_loops=5 #num_dual_strengthening=3 
  1.63e-01s  0.00e+00d  [ProcessAtMostOneAndLinear] 
  4.22e-02s  0.00e+00d  [DetectDuplicateConstraints] #duplicates=1'123 #without_enforcements=132 
  8.34e-02s  5.56e-03d  [DetectDominatedLinearConstraints] #relevant_constraints=32'260 #num_inclusions=16'594 
  4.39e-03s  0.00e+00d  [DetectDifferentVariables] #different=86 #cliques=1 #size=12 
  1.49e-02s  1.35e-03d  [ProcessSetPPC] #relevant_constraints=31'331 
  5.06e-04s  0.00e+00d  [FindAlmostIdenticalLinearConstraints] 
  3.50e-03s  4.55e-03d  [FindBigAtMostOneAndLinearOverlap] 
  2.40e-01s  1.30e-01d  [FindBigVerticalLinearOverlap] #blocks=393 #saved_nz=175'390 
  8.05e-03s  2.78e-03d  [FindBigHorizontalLinearOverlap] #linears=30'761 
  2.27e-04s  0.00e+00d  [MergeClauses] 
  4.23e-02s  0.00e+00d  [DetectDominanceRelations] 
  3.56e-01s  0.00e+00d  [PresolveToFixPoint] #num_loops=3 #num_dual_strengthening=1 
  4.26e-02s  0.00e+00d  [DetectDominanceRelations] 
  2.17e-01s  0.00e+00d  [PresolveToFixPoint] #num_loops=1 #num_dual_strengthening=1 
[Symmetry] Graph for symmetry has 36'431 nodes and 596'633 arcs.
[Symmetry] Symmetry computation done. time: 0.0149246 dtime: 0.0307843
  2.35e-01s  4.91e-02d  [Probe] #probed=1'178 #new_bounds=274 
  2.46e-04s  0.00e+00d  [MaxClique] 
  4.21e-02s  0.00e+00d  [DetectDominanceRelations] 
  3.22e-01s  0.00e+00d  [PresolveToFixPoint] #num_loops=2 #num_dual_strengthening=1 
  1.53e-01s  0.00e+00d  [ProcessAtMostOneAndLinear] 
  3.77e-02s  0.00e+00d  [DetectDuplicateConstraints] #without_enforcements=132 
  5.76e-02s  4.07e-03d  [DetectDominatedLinearConstraints] #relevant_constraints=32'263 #num_inclusions=1'036 
  3.96e-03s  0.00e+00d  [DetectDifferentVariables] 
  1.25e-02s  9.91e-04d  [ProcessSetPPC] #relevant_constraints=30'776 
  4.93e-04s  2.50e-06d  [FindAlmostIdenticalLinearConstraints] #num_tested_pairs=157 
  1.55e-03s  1.72e-03d  [FindBigAtMostOneAndLinearOverlap] 
  1.83e-01s  8.57e-02d  [FindBigVerticalLinearOverlap] #blocks=1'678 #saved_nz=152'660 
  6.61e-03s  1.91e-03d  [FindBigHorizontalLinearOverlap] #linears=25'830 
  2.37e-04s  0.00e+00d  [MergeClauses] 
  3.22e-02s  0.00e+00d  [DetectDominanceRelations] 
  3.63e-01s  0.00e+00d  [PresolveToFixPoint] #num_loops=3 #num_dual_strengthening=1 
  3.23e-02s  0.00e+00d  [DetectDominanceRelations] 
  2.26e-01s  0.00e+00d  [PresolveToFixPoint] #num_loops=1 #num_dual_strengthening=1 
[Symmetry] Graph for symmetry has 40'865 nodes and 445'203 arcs.
[Symmetry] Symmetry computation done. time: 0.0121549 dtime: 0.0233471
  2.15e-01s  4.10e-02d  [Probe] #probed=1'174 #new_bounds=1'014 
  2.68e-04s  0.00e+00d  [MaxClique] 
  3.25e-02s  0.00e+00d  [DetectDominanceRelations] 
  3.32e-01s  0.00e+00d  [PresolveToFixPoint] #num_loops=2 #num_dual_strengthening=1 
  1.44e-01s  0.00e+00d  [ProcessAtMostOneAndLinear] 
  3.54e-02s  0.00e+00d  [DetectDuplicateConstraints] #without_enforcements=132 
  4.26e-02s  2.89e-03d  [DetectDominatedLinearConstraints] #relevant_constraints=33'343 #num_inclusions=654 
  4.02e-03s  0.00e+00d  [DetectDifferentVariables] 
  1.04e-02s  6.61e-04d  [ProcessSetPPC] #relevant_constraints=25'898 
  9.40e-04s  8.75e-05d  [FindAlmostIdenticalLinearConstraints] #num_tested_pairs=5'330 
  1.40e-03s  1.17e-03d  [FindBigAtMostOneAndLinearOverlap] 
  1.11e-01s  5.15e-02d  [FindBigVerticalLinearOverlap] #blocks=1'199 #saved_nz=100'804 
  5.27e-03s  1.29e-03d  [FindBigHorizontalLinearOverlap] #linears=20'234 
  2.78e-04s  0.00e+00d  [MergeClauses] 
  2.58e-02s  0.00e+00d  [DetectDominanceRelations] 
  3.41e-01s  0.00e+00d  [PresolveToFixPoint] #num_loops=3 #num_dual_strengthening=1 
  2.11e-03s  0.00e+00d  [ExpandObjective] #entries=12'959 #tight_variables=5'024 #tight_constraints=2'675 

Presolve summary:
  - 279 affine relations were detected.
  - rule 'TODO dual: only one blocking constraint?' was applied 2'104 times.
  - rule 'TODO dual: only one blocking enforced constraint?' was applied 182 times.
  - rule 'TODO dual: only one unspecified blocking constraint?' was applied 89 times.
  - rule 'TODO duplicate: identical constraint with different enforcements' was applied 396 times.
  - rule 'affine: new relation' was applied 279 times.
  - rule 'at_most_one: removed literals' was applied 3 times.
  - rule 'at_most_one: size one' was applied 3 times.
  - rule 'deductions: 2251 stored' was applied 1 time.
  - rule 'dual: fix variable' was applied 48 times.
  - rule 'dual: reduced domain' was applied 110 times.
  - rule 'duplicate: merged rhs of linear constraint' was applied 257 times.
  - rule 'duplicate: removed constraint' was applied 1'123 times.
  - rule 'enforcement: false literal' was applied 16 times.
  - rule 'exactly_one: x and not(x)' was applied 1 time.
  - rule 'incompatible linear: add implication' was applied 196 times.
  - rule 'linear matrix: common vertical rectangle' was applied 3'270 times.
  - rule 'linear1: always true' was applied 1 time.
  - rule 'linear2: contains a Boolean.' was applied 1 time.
  - rule 'linear: always true' was applied 2'291 times.
  - rule 'linear: doubleton free' was applied 23 times.
  - rule 'linear: empty' was applied 62 times.
  - rule 'linear: extracted enforcement literal' was applied 33'650 times.
  - rule 'linear: fixed or dup variables' was applied 34'557 times.
  - rule 'linear: positive equal one' was applied 8 times.
  - rule 'linear: reduced variable domains' was applied 2'922 times.
  - rule 'linear: remapped using affine relations' was applied 34'770 times.
  - rule 'linear: simplified rhs' was applied 114'249 times.
  - rule 'linear: tightened into equality' was applied 14 times.
  - rule 'linear: variable substitution 1' was applied 23 times.
  - rule 'linear: variable substitution 2' was applied 292 times.
  - rule 'linear: variable substitution 3' was applied 211 times.
  - rule 'no_overlap: inferred from x != y constraints' was applied 1 time.
  - rule 'presolve: 177 unused variables removed.' was applied 1 time.
  - rule 'presolve: iteration' was applied 3 times.
  - rule 'probing: reduced enforced constraint to implication.' was applied 3 times.
  - rule 'symmetry: fixed to false in general orbit' was applied 1 time.

Presolved optimization model '': (model_fingerprint: 0xf600982251f7e0af)
#Variables: 3'178 (#ints: 17 in objective)
  - 298 Booleans in [0,1]
  - 2'146 different domains in [-26558,27887] with a largest complexity of 23.
#kExactlyOne: 7 (#literals: 21)
#kInterval: 12
#kLinear1: 5 (#enforced: 5 #multi: 2)
#kLinear2: 2'254 (#enforced: 2'166 #multi: 751)
#kLinear3: 8'111 (#enforced: 5'985 #multi: 21)
#kLinearN: 25'427 (#enforced: 24'031) (#terms: 279'318)
#kNoOverlap: 1 (#intervals: 12)

Preloading model.
#Bound   5.50s best:inf   next:[215,20224] initial_domain
[Symmetry] Graph for symmetry has 42'982 nodes and 345'241 arcs.
[Symmetry] Symmetry computation done. time: 0.0102338 dtime: 0.0183579
#Model   5.57s var:3178/3178 constraints:35817/35817

Starting search at 5.59s with 32 workers.
17 full problem subsolvers: [core, default_lp, fixed, lb_tree_search, max_lp, no_lp, objective_lb_search, objective_lb_search_max_lp, objective_lb_search_no_lp, objective_shaving_search_max_lp, objective_shaving_search_no_lp, probing, probing_max_lp, pseudo_costs, quick_restart, quick_restart_no_lp, reduced_costs]
13 first solution subsolvers: [fj_long_default, fj_long_lin_default, fj_long_random, fj_short_default, fj_short_lin_default, fj_short_lin_random, fj_short_random, fs_random(2), fs_random_no_lp, fs_random_quick_restart(2), fs_random_quick_restart_no_lp]
13 incomplete subsolvers: [feasibility_pump, graph_arc_lns, graph_cst_lns, graph_dec_lns, graph_var_lns, rins/rens, rnd_cst_lns, rnd_var_lns, scheduling_intervals_lns, scheduling_precedences_lns, scheduling_time_window_lns, violation_ls(2)]
3 helper subsolvers: [neighborhood_helper, synchronization_agent, update_gap_integral]
#Bound   6.36s best:inf   next:[216,20224] objective_shaving_search_max_lp (vars=3178 csts=35821)
#Bound   7.61s best:inf   next:[232,20224] objective_lb_search
#Bound   8.17s best:inf   next:[249,20224] objective_lb_search_no_lp
#Bound   8.35s best:inf   next:[270,20224] objective_lb_search_no_lp
#Bound   8.36s best:inf   next:[271,20224] objective_lb_search_no_lp
#Bound   8.37s best:inf   next:[399,20224] objective_lb_search_no_lp
#1       8.92s best:9303  next:[399,9302] fs_random_no_lp (fixed_bools=0/378)
#Bound   9.35s best:9303  next:[723,9302] objective_lb_search_max_lp
#Bound   9.44s best:9303  next:[840,9302] objective_lb_search_max_lp
#Bound   9.58s best:9303  next:[841,9302] pseudo_costs
#Bound   9.61s best:9303  next:[842,9302] objective_lb_search_max_lp
#2       9.65s best:8538  next:[842,8537] no_lp (fixed_bools=0/378)
#Bound   9.69s best:8538  next:[1379,8537] pseudo_costs
#Bound   9.87s best:8538  next:[1412,8537] pseudo_costs
#Bound   9.90s best:8538  next:[1425,8537] objective_lb_search_max_lp
#3      10.62s best:7506  next:[1425,7505] no_lp (fixed_bools=0/419)
#4      10.91s best:7354  next:[1425,7353] no_lp (fixed_bools=0/443)
#5      11.23s best:7345  next:[1425,7344] no_lp (fixed_bools=0/462)
#6      11.77s best:7330  next:[1425,7329] no_lp (fixed_bools=0/466)
#Bound  11.92s best:7330  next:[1433,7329] max_lp
#7      12.11s best:7308  next:[1433,7307] quick_restart_no_lp (fixed_bools=0/466)
#Bound  12.65s best:7308  next:[1435,7307] max_lp
#8      12.73s best:7228  next:[1435,7227] no_lp (fixed_bools=0/478)
#Bound  13.10s best:7228  next:[1447,7227] objective_lb_search_max_lp
#Bound  13.44s best:7228  next:[1458,7227] objective_lb_search_max_lp
#9      13.47s best:7178  next:[1458,7177] quick_restart_no_lp (fixed_bools=0/511)
#10     13.50s best:7177  next:[1458,7176] violation_ls(batch:7 #solutions_imported:4 #lin_moves:1 #lin_evals:97'166 #gen_moves:36'903 #gen_evals:6'902 #comp_moves:6'948 #backtracks:14'967 #weight_updates:286)
#11     13.51s best:7176  next:[1458,7175] violation_ls(batch:7 #solutions_imported:4 #lin_moves:39'399 #lin_evals:173'030 #gen_moves:14'940 #gen_evals:2'480 #comp_moves:1'247 #backtracks:6'843 #weight_updates:770)
#12     13.90s best:7174  next:[1458,7173] rins_lp_lns (d=0.91 s=165 t=0.10 p=1.00 stall=4 h=auto_l0)
#13     14.10s best:7148  next:[1458,7147] rnd_cst_lns (d=0.96 s=183 t=0.10 p=1.00 stall=6 h=auto_l0)
#14     14.10s best:6463  next:[1458,6462] rins_lp_lns (d=0.91 s=179 t=0.10 p=1.00 stall=4 h=auto_l0)
#Bound  14.26s best:6463  next:[1460,6462] objective_lb_search_max_lp
#15     14.36s best:6462  next:[1460,6461] violation_ls(batch:8 #solutions_imported:5 #lin_moves:40'902 #lin_evals:179'197 #gen_moves:14'940 #gen_evals:2'480 #comp_moves:1'247 #backtracks:6'843 #weight_updates:1'025)
#16     14.79s best:6461  next:[1460,6460] quick_restart_no_lp (fixed_bools=0/639)
#Bound  14.85s best:6461  next:[1461,6460] objective_lb_search_max_lp
#17     14.92s best:6446  next:[1461,6445] rins_lp_lns (d=0.91 s=193 t=0.10 p=0.83 stall=0 h=auto_l0)
#18     15.59s best:6441  next:[1461,6440] quick_restart_no_lp (fixed_bools=0/685)
#19     15.92s best:6429  next:[1461,6428] quick_restart_no_lp (fixed_bools=0/706)
#20     16.19s best:6428  next:[1461,6427] quick_restart_no_lp (fixed_bools=0/709)
#Bound  16.19s best:6428  next:[1476,6427] pseudo_costs
#Bound  16.64s best:6428  next:[1479,6427] pseudo_costs
#21     16.87s best:6145  next:[1479,6144] graph_cst_lns (d=0.98 s=214 t=0.10 p=1.00 stall=0 h=auto_l0) [hint]
#22     17.24s best:6144  next:[1479,6143] violation_ls(batch:10 #solutions_imported:7 #lin_moves:8'640 #lin_evals:152'744 #gen_moves:45'033 #gen_evals:7'873 #comp_moves:7'419 #backtracks:18'796 #weight_updates:1'750)
#23     17.25s best:6143  next:[1479,6142] violation_ls(batch:10 #solutions_imported:7 #lin_moves:40'903 #lin_evals:198'453 #gen_moves:22'963 #gen_evals:3'610 #comp_moves:1'509 #backtracks:10'722 #weight_updates:1'122)
#24     17.48s best:6142  next:[1479,6141] graph_dec_lns (d=0.98 s=215 t=0.10 p=1.00 stall=0 h=auto_l0) [hint]
#25     18.21s best:6140  next:[1479,6139] rnd_var_lns (d=0.98 s=224 t=0.10 p=1.00 stall=9 h=auto_l0)
#26     18.90s best:6139  next:[1479,6138] violation_ls(batch:11 #solutions_imported:8 #lin_moves:8'640 #lin_evals:165'194 #gen_moves:50'533 #gen_evals:8'408 #comp_moves:7'769 #backtracks:21'371 #weight_updates:1'829)
#Bound  19.96s best:6139  next:[1491,6138] objective_lb_search_max_lp
#27     20.15s best:6135  next:[1491,6134] rnd_var_lns (d=0.99 s=236 t=0.10 p=1.00 stall=0 h=auto_l0)
#28     20.83s best:6134  next:[1491,6133] violation_ls(batch:12 #solutions_imported:9 #lin_moves:8'912 #lin_evals:166'591 #gen_moves:50'533 #gen_evals:8'408 #comp_moves:7'769 #backtracks:21'371 #weight_updates:1'969)
#29     20.93s best:6132  next:[1491,6131] graph_var_lns (d=0.98 s=238 t=0.10 p=1.00 stall=1 h=auto_l0)
#30     21.24s best:6090  next:[1491,6089] graph_arc_lns (d=0.99 s=239 t=0.10 p=1.00 stall=2 h=auto_l0)
#Bound  22.59s best:6090  next:[1492,6089] objective_lb_search_max_lp
#31     22.84s best:6089  next:[1492,6088] violation_ls(batch:13 #solutions_imported:10 #lin_moves:9'259 #lin_evals:168'136 #gen_moves:50'533 #gen_evals:8'408 #comp_moves:7'769 #backtracks:21'371 #weight_updates:2'062)
#32     22.84s best:6088  next:[1492,6087] violation_ls(batch:13 #solutions_imported:10 #lin_moves:40'905 #lin_evals:237'966 #gen_moves:38'690 #gen_evals:5'170 #comp_moves:3'963 #backtracks:17'357 #weight_updates:1'282)
#33     23.19s best:6086  next:[1492,6085] graph_cst_lns (d=0.99 s=254 t=0.10 p=1.00 stall=2 h=auto_l0)
#34     23.55s best:6035  next:[1492,6034] graph_arc_lns (d=0.99 s=253 t=0.10 p=1.00 stall=0 h=auto_l0)
#35     24.62s best:5765  next:[1492,5764] rins_pump_lns (d=0.92 s=259 t=0.10 p=0.70 stall=0 h=auto_l0)
#36     24.73s best:5749  next:[1492,5748] rins_lp_lns (d=0.86 s=273 t=0.10 p=0.58 stall=0 h=auto_l0)
#37     26.46s best:5740  next:[1492,5739] rins_pump_lns (d=0.89 s=285 t=0.10 p=0.62 stall=0 h=auto_l0)
#38     26.54s best:5658  next:[1492,5657] graph_var_lns (d=0.99 s=278 t=0.10 p=1.00 stall=0 h=auto_l0)
#Bound  27.47s best:5658  next:[1496,5657] objective_lb_search_max_lp
#39     28.20s best:5652  next:[1496,5651] rnd_var_lns (d=0.99 s=288 t=0.10 p=1.00 stall=0 h=auto_l0)
#40     28.49s best:5308  next:[1496,5307] rins_lp_lns (d=0.91 s=299 t=0.10 p=0.64 stall=0 h=auto_l0)
#41     29.27s best:5253  next:[1496,5252] quick_restart_no_lp (fixed_bools=0/945)
#42     29.98s best:5198  next:[1496,5197] quick_restart_no_lp (fixed_bools=0/958)
#43     31.67s best:5161  next:[1496,5160] graph_dec_lns (d=1.00 s=307 t=0.10 p=1.00 stall=0 h=auto_l0)
#44     32.82s best:5128  next:[1496,5127] rnd_cst_lns (d=1.00 s=315 t=0.10 p=1.00 stall=0 h=auto_l0)
#Bound  33.14s best:5128  next:[1506,5127] objective_lb_search_max_lp
#Bound  35.50s best:5128  next:[1513,5127] objective_lb_search_max_lp
#45     35.65s best:5070  next:[1513,5069] graph_cst_lns (d=0.99 s=333 t=0.10 p=0.94 stall=0 h=auto_l0)
#46     35.90s best:5069  next:[1513,5068] violation_ls(batch:19 #solutions_imported:16 #lin_moves:45'559 #lin_evals:363'021 #gen_moves:68'464 #gen_evals:10'140 #comp_moves:8'490 #backtracks:29'976 #weight_updates:5'966)
#47     36.32s best:5068  next:[1513,5067] quick_restart_no_lp (fixed_bools=0/1165)
#48     37.39s best:5067  next:[1513,5066] violation_ls(batch:20 #solutions_imported:17 #lin_moves:45'560 #lin_evals:363'038 #gen_moves:68'464 #gen_evals:10'140 #comp_moves:8'490 #backtracks:29'976 #weight_updates:5'966)
#49     39.64s best:4630  next:[1513,4629] graph_arc_lns (d=1.00 s=346 t=0.10 p=0.94 stall=0 h=auto_l0)
#50     40.16s best:4385  next:[1513,4384] rins_pump_lns (d=0.90 s=365 t=0.10 p=0.58 stall=2 h=auto_l0)
#51     43.34s best:4371  next:[1513,4370] rnd_var_lns (d=1.00 s=368 t=0.10 p=0.89 stall=0 h=auto_l0)
#52     43.68s best:4364  next:[1513,4363] quick_restart_no_lp (fixed_bools=0/1358)
#53     45.62s best:4363  next:[1513,4362] violation_ls(batch:23 #solutions_imported:19 #lin_moves:65'775 #lin_evals:458'591 #gen_moves:68'464 #gen_evals:10'140 #comp_moves:8'490 #backtracks:29'976 #weight_updates:6'385)
#54     45.62s best:4362  next:[1513,4361] violation_ls(batch:23 #solutions_imported:19 #lin_moves:50'486 #lin_evals:441'753 #gen_moves:106'444 #gen_evals:12'887 #comp_moves:8'682 #backtracks:48'864 #weight_updates:2'406)
#55     45.77s best:4356  next:[1513,4355] graph_arc_lns (d=0.99 s=384 t=0.10 p=0.85 stall=1 h=auto_l0)
#Bound  47.33s best:4356  next:[1579,4355] objective_lb_search_max_lp
#56     47.91s best:4352  next:[1579,4351] graph_var_lns (d=1.00 s=395 t=0.10 p=0.86 stall=0 h=auto_l0)
#57     48.35s best:4351  next:[1579,4350] violation_ls(batch:24 #solutions_imported:20 #lin_moves:71'037 #lin_evals:475'528 #gen_moves:68'464 #gen_evals:10'140 #comp_moves:8'490 #backtracks:29'976 #weight_updates:6'723)
#58     48.36s best:4349  next:[1579,4348] violation_ls(batch:24 #solutions_imported:20 #lin_moves:50'487 #lin_evals:441'770 #gen_moves:106'444 #gen_evals:12'887 #comp_moves:8'682 #backtracks:48'864 #weight_updates:2'406)
#59     48.71s best:4174  next:[1579,4173] rins_lp_lns (d=0.92 s=403 t=0.10 p=0.59 stall=0 h=auto_l0)
#60     49.03s best:4173  next:[1579,4172] quick_restart_no_lp (fixed_bools=0/1466)
#61     49.83s best:4172  next:[1579,4171] quick_restart_no_lp (fixed_bools=0/1474)
#62     51.16s best:4171  next:[1579,4170] violation_ls(batch:25 #solutions_imported:21 #lin_moves:52'386 #lin_evals:449'801 #gen_moves:106'444 #gen_evals:12'887 #comp_moves:8'682 #backtracks:48'864 #weight_updates:2'801)
#63     51.36s best:4170  next:[1579,4169] graph_arc_lns (d=0.99 s=409 t=0.10 p=0.82 stall=0 h=auto_l0)
#64     52.74s best:4168  next:[1579,4167] quick_restart_no_lp (fixed_bools=0/1521)
#65     53.12s best:4166  next:[1579,4165] graph_var_lns (d=1.00 s=422 t=0.10 p=0.83 stall=0 h=auto_l0)
#66     53.44s best:3982  next:[1579,3981] rins_lp_lns (d=0.92 s=429 t=0.10 p=0.58 stall=0 h=auto_l0)
#Bound  56.03s best:3982  next:[1582,3981] objective_lb_search_max_lp
#67     60.64s best:3974  next:[1582,3973] graph_arc_lns (d=0.99 s=462 t=0.10 p=0.77 stall=0 h=auto_l0)
#68     60.68s best:3973  next:[1582,3972] violation_ls(batch:29 #solutions_imported:24 #lin_moves:74'328 #lin_evals:551'295 #gen_moves:116'923 #gen_evals:13'651 #comp_moves:8'927 #backtracks:53'978 #weight_updates:3'590)
#69     62.04s best:3972  next:[1582,3971] violation_ls(batch:30 #solutions_imported:24 #lin_moves:71'037 #lin_evals:575'123 #gen_moves:113'134 #gen_evals:14'663 #comp_moves:10'840 #backtracks:51'131 #weight_updates:7'156)
#70     62.05s best:3971  next:[1582,3970] violation_ls(batch:30 #solutions_imported:25 #lin_moves:74'329 #lin_evals:551'301 #gen_moves:116'923 #gen_evals:13'651 #comp_moves:8'927 #backtracks:53'978 #weight_updates:3'590)
#71     62.92s best:3968  next:[1582,3967] rnd_cst_lns (d=1.00 s=473 t=0.10 p=0.78 stall=0 h=auto_l0)
#72     63.00s best:3966  next:[1582,3965] quick_restart_no_lp (fixed_bools=0/1692)
#Bound  64.03s best:3966  next:[1596,3965] objective_lb_search_max_lp
#73     64.70s best:3964  next:[1596,3963] violation_ls(batch:31 #solutions_imported:25 #lin_moves:71'037 #lin_evals:575'127 #gen_moves:113'135 #gen_evals:14'663 #comp_moves:10'841 #backtracks:51'131 #weight_updates:7'156)
#74     64.72s best:3963  next:[1596,3962] violation_ls(batch:31 #solutions_imported:26 #lin_moves:74'329 #lin_evals:551'337 #gen_moves:116'950 #gen_evals:13'651 #comp_moves:8'928 #backtracks:53'991 #weight_updates:3'590)
#75     65.08s best:3950  next:[1596,3949] quick_restart_no_lp (fixed_bools=0/1711)
#76     66.08s best:3947  next:[1596,3946] quick_restart_no_lp (fixed_bools=0/1727)
#77     66.57s best:3945  next:[1596,3944] graph_cst_lns (d=0.99 s=488 t=0.10 p=0.72 stall=0 h=auto_l0)
#78     67.26s best:3926  next:[1596,3925] graph_dec_lns (d=1.00 s=489 t=0.10 p=0.79 stall=4 h=auto_l0)
#Bound 101.71s best:3926  next:[1597,3925] objective_lb_search_max_lp
#Bound 116.71s best:3926  next:[1604,3925] objective_lb_search_max_lp
#79    131.36s best:3921  next:[1604,3920] quick_restart_no_lp (fixed_bools=0/2017)
#80    132.61s best:3920  next:[1604,3919] violation_ls(batch:58 #solutions_imported:27 #lin_moves:330'529 #lin_evals:1'617'049 #gen_moves:113'135 #gen_evals:14'663 #comp_moves:10'841 #backtracks:51'131 #weight_updates:7'760)
#81    132.62s best:3919  next:[1604,3918] violation_ls(batch:58 #solutions_imported:28 #lin_moves:74'329 #lin_evals:1'038'789 #gen_moves:332'108 #gen_evals:36'609 #comp_moves:20'247 #backtracks:155'901 #weight_updates:5'179)
#82    132.93s best:3916  next:[1604,3915] rins_pump_lns (d=0.92 s=835 t=0.10 p=0.54 stall=1 h=auto_l0)
#Bound 163.29s best:3916  next:[1608,3915] objective_lb_search_max_lp
#83    218.12s best:3871  next:[1608,3870] graph_cst_lns (d=1.00 s=1244 t=0.10 p=0.59 stall=5 h=auto_l0)
#84    248.20s best:3817  next:[1608,3816] rnd_var_lns (d=1.00 s=1377 t=0.10 p=0.58 stall=2 h=auto_l0)
#85    249.05s best:3816  next:[1608,3815] violation_ls(batch:103 #solutions_imported:30 #lin_moves:403'252 #lin_evals:2'490'835 #gen_moves:174'870 #gen_evals:40'544 #comp_moves:17'597 #backtracks:78'597 #weight_updates:54'901)
#86    249.06s best:3815  next:[1608,3814] violation_ls(batch:103 #solutions_imported:31 #lin_moves:284'568 #lin_evals:2'212'593 #gen_moves:370'931 #gen_evals:45'404 #comp_moves:26'272 #backtracks:172'299 #weight_updates:125'127)
#87    250.90s best:3813  next:[1608,3812] quick_restart_no_lp (fixed_bools=2/2565)
#88    252.73s best:3812  next:[1608,3811] violation_ls(batch:104 #solutions_imported:31 #lin_moves:403'252 #lin_evals:2'490'900 #gen_moves:174'906 #gen_evals:40'545 #comp_moves:17'599 #backtracks:78'614 #weight_updates:54'901)
#89    252.75s best:3811  next:[1608,3810] violation_ls(batch:104 #solutions_imported:32 #lin_moves:284'568 #lin_evals:2'212'672 #gen_moves:370'962 #gen_evals:45'407 #comp_moves:26'273 #backtracks:172'314 #weight_updates:125'127)
#90    254.41s best:3804  next:[1608,3803] quick_restart_no_lp (fixed_bools=2/2568)
#91    255.44s best:3777  next:[1608,3776] graph_dec_lns (d=1.00 s=1407 t=0.10 p=0.58 stall=4 h=auto_l0)
#Bound 260.55s best:3777  next:[1611,3776] objective_lb_search_max_lp
#92    308.01s best:3763  next:[1611,3762] rnd_var_lns (d=1.00 s=1667 t=0.10 p=0.57 stall=1 h=auto_l0)
#93    311.11s best:3761  next:[1611,3760] graph_arc_lns (d=1.00 s=1683 t=0.10 p=0.56 stall=0 h=auto_l0)
#Bound 334.71s best:3761  next:[1612,3760] objective_lb_search_max_lp
#94    339.26s best:3737  next:[1612,3736] quick_restart_no_lp (fixed_bools=4/2888)
#95    339.51s best:3720  next:[1612,3719] quick_restart_no_lp (fixed_bools=4/2890)
#96    339.99s best:3719  next:[1612,3718] violation_ls(batch:137 #solutions_imported:35 #lin_moves:412'827 #lin_evals:3'135'487 #gen_moves:400'196 #gen_evals:62'124 #comp_moves:38'642 #backtracks:180'721 #weight_updates:56'783)
#97    340.02s best:3718  next:[1612,3717] violation_ls(batch:137 #solutions_imported:36 #lin_moves:493'902 #lin_evals:3'242'452 #gen_moves:415'152 #gen_evals:53'524 #comp_moves:32'747 #backtracks:191'164 #weight_updates:126'117)
#98    342.26s best:3690  next:[1612,3689] rins_lp_lns (d=0.90 s=1841 t=0.10 p=0.51 stall=18 h=folio_rnd)
#Bound 377.23s best:3690  next:[1613,3689] objective_lb_search_max_lp
#99    406.86s best:3619  next:[1613,3618] graph_cst_lns (d=1.00 s=2113 t=0.10 p=0.55 stall=0 h=auto_l0)
#Bound 408.01s best:3619  next:[1620,3618] objective_lb_search_max_lp
#100   409.89s best:3587  next:[1620,3586] rins_pump_lns (d=0.92 s=2145 t=0.10 p=0.52 stall=0 h=auto_l0)
#Bound 477.90s best:3587  next:[1628,3586] objective_lb_search_max_lp
#Bound 554.60s best:3587  next:[1629,3586] objective_lb_search_max_lp
#Bound 650.51s best:3587  next:[1632,3586] objective_lb_search_max_lp
#Bound 667.81s best:3587  next:[1634,3586] objective_lb_search_max_lp
#Bound 687.14s best:3587  next:[1637,3586] objective_lb_search_max_lp
#Bound 707.75s best:3587  next:[1639,3586] objective_lb_search_max_lp
#Bound 710.48s best:3587  next:[1641,3586] objective_lb_search_max_lp
#Bound 713.99s best:3587  next:[1642,3586] objective_lb_search_max_lp
#Bound 718.36s best:3587  next:[1646,3586] objective_lb_search_max_lp
#Bound 751.94s best:3587  next:[1647,3586] objective_lb_search_max_lp
#Bound 782.71s best:3587  next:[1649,3586] objective_lb_search_max_lp
#Bound 885.15s best:3587  next:[1650,3586] objective_lb_search_max_lp
#Bound 914.31s best:3587  next:[1652,3586] objective_lb_search_max_lp
#Bound 926.70s best:3587  next:[1654,3586] objective_lb_search_max_lp
#Bound 990.91s best:3587  next:[1655,3586] objective_lb_search_max_lp
#Bound 1029.91s best:3587  next:[1657,3586] objective_lb_search_max_lp
#Bound 1071.21s best:3587  next:[1658,3586] objective_lb_search_max_lp
#Bound 1108.57s best:3587  next:[1665,3586] objective_lb_search_max_lp
#Bound 1164.97s best:3587  next:[1666,3586] objective_lb_search_max_lp
#Bound 1462.33s best:3587  next:[1668,3586] objective_lb_search_max_lp
#101   1598.57s best:3506  next:[1668,3505] graph_dec_lns (d=1.00 s=7454 t=0.10 p=0.52 stall=3 h=auto_l0)
#102   1599.43s best:3504  next:[1668,3503] quick_restart_no_lp (fixed_bools=10/6269)
#103   1599.62s best:3503  next:[1668,3502] violation_ls(batch:586 #solutions_imported:40 #perturbations:4 #lin_moves:1'619'367 #lin_evals:12'191'667 #gen_moves:752'046 #gen_evals:504'936 #comp_moves:46'995 #backtracks:352'404 #weight_updates:230'896)
#104   1599.71s best:3498  next:[1668,3497] rins_pump_lns (d=0.92 s=7470 t=0.10 p=0.50 stall=5 h=auto_l0)
#Bound 1670.93s best:3498  next:[1669,3497] objective_lb_search_max_lp
#105   1748.42s best:3461  next:[1669,3460] graph_dec_lns (d=1.00 s=8142 t=0.10 p=0.51 stall=1 h=auto_l0)
#Bound 1813.83s best:3461  next:[1672,3460] objective_lb_search_max_lp
#Bound 1908.04s best:3461  next:[1674,3460] objective_lb_search_max_lp
#Bound 1967.97s best:3461  next:[1680,3460] objective_lb_search_max_lp
#Bound 2289.10s best:3461  next:[1682,3460] objective_lb_search_max_lp
#Bound 2565.75s best:3461  next:[1683,3460] objective_lb_search_max_lp
#Bound 2687.84s best:3461  next:[1684,3460] objective_lb_search_max_lp
#Bound 2826.28s best:3461  next:[1685,3460] objective_lb_search_max_lp
#Bound 3030.58s best:3461  next:[1686,3460] objective_lb_search_max_lp
#Bound 3179.36s best:3461  next:[1693,3460] objective_lb_search_max_lp
#Bound 3319.24s best:3461  next:[1694,3460] objective_lb_search_max_lp
#Bound 4087.78s best:3461  next:[1695,3460] objective_lb_search_max_lp
#Bound 4570.88s best:3461  next:[1696,3460] objective_lb_search_max_lp
#Bound 4998.19s best:3461  next:[1705,3460] objective_lb_search_max_lp
#Bound 6302.09s best:3461  next:[1706,3460] objective_lb_search_max_lp
#Bound 6821.65s best:3461  next:[1707,3460] objective_lb_search_max_lp
#Bound 7026.63s best:3461  next:[1708,3460] objective_lb_search_max_lp
#Bound 7679.75s best:3461  next:[1710,3460] objective_lb_search_max_lp
#Bound 8856.47s best:3461  next:[1712,3460] objective_lb_search_max_lp
#Bound 9476.40s best:3461  next:[1713,3460] objective_lb_search_max_lp
#Bound 10003.01s best:3461  next:[1714,3460] objective_lb_search_max_lp
#Bound 10543.47s best:3461  next:[1715,3460] objective_lb_search_max_lp
#Bound 10940.18s best:3461  next:[1716,3460] objective_lb_search_max_lp
#Bound 11395.30s best:3461  next:[1717,3460] objective_lb_search_max_lp
#Bound 12957.99s best:3461  next:[1718,3460] lb_tree_search (nodes=230122/230150 rc=666 decisions=1491581 @root=306 restarts=14) 
#Bound 13555.99s best:3461  next:[1719,3460] lb_tree_search (nodes=238060/238093 rc=675 decisions=1551155 @root=317 restarts=14) 
#Bound 14148.19s best:3461  next:[1720,3460] lb_tree_search (nodes=245966/246000 rc=687 decisions=1610283 @root=328 restarts=14) 
#Bound 14813.28s best:3461  next:[1721,3460] lb_tree_search (nodes=253173/253209 rc=698 decisions=1668719 @root=339 restarts=14) 
#Bound 15475.44s best:3461  next:[1722,3460] lb_tree_search (nodes=260282/260318 rc=708 decisions=1728528 @root=352 restarts=14) 
#Bound 16107.52s best:3461  next:[1723,3460] lb_tree_search (nodes=267586/267622 rc=732 decisions=1790602 @root=365 restarts=14) 
#Bound 16785.74s best:3461  next:[1724,3460] lb_tree_search (nodes=275107/275146 rc=746 decisions=1854147 @root=378 restarts=14) 
#Bound 17512.90s best:3461  next:[1725,3460] lb_tree_search (nodes=283132/283171 rc=766 decisions=1920023 @root=391 restarts=14) 
#Bound 18205.23s best:3461  next:[1726,3460] lb_tree_search (nodes=290917/290956 rc=782 decisions=1987439 @root=404 restarts=14) 
#Bound 18856.33s best:3461  next:[1727,3460] lb_tree_search (nodes=297671/297711 rc=795 decisions=2052425 @root=417 restarts=14) 
#Bound 19542.84s best:3461  next:[1728,3460] lb_tree_search (nodes=305308/305349 rc=807 decisions=2121634 @root=430 restarts=14) 
#Bound 20241.86s best:3461  next:[1729,3460] lb_tree_search (nodes=312124/312166 rc=816 decisions=2189520 @root=443 restarts=14) 
#Bound 20988.84s best:3461  next:[1730,3460] lb_tree_search (nodes=318863/318906 rc=829 decisions=2257764 @root=456 restarts=14) 
#Bound 21711.51s best:3461  next:[1731,3460] lb_tree_search (nodes=325798/325842 rc=845 decisions=2328447 @root=469 restarts=14) 
#Bound 22433.75s best:3461  next:[1732,3460] lb_tree_search (nodes=332027/332072 rc=858 decisions=2394686 @root=482 restarts=14) 
#Bound 23221.21s best:3461  next:[1733,3460] lb_tree_search (nodes=338841/338891 rc=876 decisions=2467130 @root=499 restarts=14) 
#Bound 24077.12s best:3461  next:[1734,3460] lb_tree_search (nodes=346265/346315 rc=888 decisions=2543532 @root=514 restarts=14) 
#Bound 24871.86s best:3461  next:[1735,3460] lb_tree_search (nodes=353728/353778 rc=907 decisions=2620001 @root=529 restarts=14) 
#Bound 25649.89s best:3461  next:[1736,3460] lb_tree_search (nodes=361238/361290 rc=925 decisions=2696280 @root=544 restarts=14) 
#Bound 26473.90s best:3461  next:[1737,3460] lb_tree_search (nodes=368052/368104 rc=941 decisions=2771180 @root=559 restarts=14) 
#Bound 27286.28s best:3461  next:[1738,3460] lb_tree_search (nodes=375966/376019 rc=953 decisions=2852382 @root=574 restarts=14) 
#Bound 28159.00s best:3461  next:[1739,3460] lb_tree_search (nodes=383680/383733 rc=1000 decisions=2934659 @root=591 restarts=14) 
#Bound 29030.53s best:3461  next:[1740,3460] lb_tree_search (nodes=391529/391582 rc=1019 decisions=3017725 @root=608 restarts=14) 
#Bound 29932.62s best:3461  next:[1741,3460] lb_tree_search (nodes=400132/400189 rc=1049 decisions=3102501 @root=625 restarts=14) 
#Bound 30876.46s best:3461  next:[1742,3460] lb_tree_search (nodes=408337/408394 rc=1066 decisions=3189152 @root=642 restarts=14) 
#Bound 31732.38s best:3461  next:[1743,3460] lb_tree_search (nodes=415496/415553 rc=1087 decisions=3270579 @root=659 restarts=14) 
#Bound 32655.27s best:3461  next:[1744,3460] lb_tree_search (nodes=423601/423660 rc=1114 decisions=3358579 @root=676 restarts=14) 
#Bound 33552.68s best:3461  next:[1745,3460] lb_tree_search (nodes=430963/431023 rc=1134 decisions=3444209 @root=693 restarts=14) 
#Bound 34458.50s best:3461  next:[1746,3460] lb_tree_search (nodes=437720/437780 rc=1154 decisions=3531609 @root=712 restarts=14) 
#Bound 35382.85s best:3461  next:[1747,3460] lb_tree_search (nodes=445632/445692 rc=1174 decisions=3622779 @root=729 restarts=14) 
#Bound 36306.90s best:3461  next:[1748,3460] lb_tree_search (nodes=452879/452939 rc=1195 decisions=3716552 @root=746 restarts=14) 
#Bound 37248.56s best:3461  next:[1749,3460] lb_tree_search (nodes=460868/460929 rc=1217 decisions=3808926 @root=765 restarts=14) 
#Bound 38271.37s best:3461  next:[1750,3460] lb_tree_search (nodes=469389/469451 rc=1240 decisions=3905193 @root=784 restarts=14) 
#Bound 39268.84s best:3461  next:[1751,3460] lb_tree_search (nodes=477305/477367 rc=1261 decisions=4002741 @root=805 restarts=14) 
#Bound 40300.73s best:3461  next:[1752,3460] lb_tree_search (nodes=485382/485444 rc=1277 decisions=4100786 @root=824 restarts=14) 
#Bound 41336.35s best:3461  next:[1753,3460] lb_tree_search (nodes=493279/493342 rc=1297 decisions=4200098 @root=845 restarts=14) 
#Bound 42386.02s best:3461  next:[1754,3460] lb_tree_search (nodes=501388/501451 rc=1313 decisions=4302112 @root=864 restarts=14) 
#Bound 43472.29s best:3461  next:[1755,3460] lb_tree_search (nodes=509633/509696 rc=1342 decisions=4405716 @root=885 restarts=14) 
#Bound 44613.98s best:3461  next:[1756,3460] lb_tree_search (nodes=518603/518666 rc=1371 decisions=4510262 @root=904 restarts=14) 
#Bound 45736.18s best:3461  next:[1757,3460] lb_tree_search (nodes=527128/527192 rc=1403 decisions=4612742 @root=925 restarts=14) 
#Bound 46677.40s best:3461  next:[1758,3460] lb_tree_search (nodes=534052/534118 rc=1417 decisions=4710619 @root=944 restarts=14) 
#Bound 47735.33s best:3461  next:[1759,3460] lb_tree_search (nodes=541453/541521 rc=1440 decisions=4812826 @root=965 restarts=14) 
#Bound 48787.10s best:3461  next:[1760,3460] lb_tree_search (nodes=549160/549228 rc=1460 decisions=4917113 @root=984 restarts=14) 
#Bound 49914.29s best:3461  next:[1761,3460] lb_tree_search (nodes=557353/557422 rc=1475 decisions=5024628 @root=1007 restarts=14) 
#Bound 51046.72s best:3461  next:[1762,3460] lb_tree_search (nodes=565689/565758 rc=1498 decisions=5131836 @root=1028 restarts=14) 
#Bound 51409.36s best:3461  next:[1766,3460] objective_lb_search_max_lp
#Bound 54344.98s best:3461  next:[1767,3460] lb_tree_search (nodes=600889/600959 rc=1630 decisions=5490702 @root=1101 restarts=14) 
#Bound 55544.69s best:3461  next:[1768,3460] lb_tree_search (nodes=609820/609892 rc=1656 decisions=5605979 @root=1124 restarts=14) 
#Bound 56738.89s best:3461  next:[1769,3460] lb_tree_search (nodes=618257/618329 rc=1669 decisions=5721088 @root=1145 restarts=14) 
#Bound 57941.31s best:3461  next:[1770,3460] lb_tree_search (nodes=627039/627112 rc=1698 decisions=5840524 @root=1170 restarts=14) 
#Bound 59205.98s best:3461  next:[1771,3460] lb_tree_search (nodes=636827/636901 rc=1723 decisions=5967487 @root=1195 restarts=14) 
#Bound 60479.85s best:3461  next:[1772,3460] lb_tree_search (nodes=646562/646636 rc=1754 decisions=6095792 @root=1220 restarts=14) 
#Bound 61735.87s best:3461  next:[1773,3460] lb_tree_search (nodes=655332/655406 rc=1775 decisions=6223738 @root=1247 restarts=14) 
#Bound 63016.30s best:3461  next:[1774,3460] lb_tree_search (nodes=664089/664163 rc=1804 decisions=6349083 @root=1272 restarts=14) 
#Bound 64445.30s best:3461  next:[1775,3460] lb_tree_search (nodes=673774/673848 rc=1827 decisions=6482942 @root=1299 restarts=14) 
#Bound 64542.52s best:3461  next:[1776,3460] objective_lb_search_no_lp
#Bound 66638.78s best:3461  next:[1777,3460] lb_tree_search (nodes=690167/690241 rc=1884 decisions=6701469 @root=1342 restarts=14) 
#Bound 67844.44s best:3461  next:[1778,3460] lb_tree_search (nodes=699327/699403 rc=1913 decisions=6832669 @root=1369 restarts=14) 
#Bound 69039.96s best:3461  next:[1779,3460] lb_tree_search (nodes=708543/708619 rc=1940 decisions=6965213 @root=1396 restarts=14) 
#Bound 70265.95s best:3461  next:[1780,3460] lb_tree_search (nodes=717896/717972 rc=1958 decisions=7100380 @root=1423 restarts=14) 
#Bound 71544.38s best:3461  next:[1781,3460] lb_tree_search (nodes=727267/727343 rc=1995 decisions=7238278 @root=1450 restarts=14) 
#Bound 72829.94s best:3461  next:[1782,3460] objective_lb_search_max_lp
#Bound 73964.17s best:3461  next:[1784,3460] objective_lb_search_no_lp
#Bound 75034.46s best:3461  next:[1785,3460] objective_lb_search_max_lp
#Bound 75898.28s best:3461  next:[1786,3460] objective_lb_search_no_lp
#Bound 76858.51s best:3461  next:[1787,3460] objective_lb_search_no_lp
#Bound 77245.59s best:3461  next:[1788,3460] objective_lb_search_max_lp
#Bound 78715.96s best:3461  next:[1789,3460] objective_lb_search_no_lp
#Bound 79369.76s best:3461  next:[1790,3460] objective_lb_search_no_lp
#Bound 79779.44s best:3461  next:[1791,3460] objective_lb_search_no_lp
#Bound 82865.43s best:3461  next:[1793,3460] objective_lb_search_max_lp
#Bound 84041.17s best:3461  next:[1794,3460] objective_lb_search_no_lp
#Bound 84694.44s best:3461  next:[1795,3460] objective_lb_search_no_lp

Task timing                                  n [     min,      max]      avg      dev     time         n [     min,      max]      avg      dev    dtime
                             'core':         1 [  24.00h,   24.00h]   24.00h   0.00ns   24.00h         1 [  16.35h,   16.35h]   16.35h   0.00ns   16.35h
                       'default_lp':         1 [  24.00h,   24.00h]   24.00h   0.00ns   24.00h         1 [   2.35h,    2.35h]    2.35h   0.00ns    2.35h
                 'feasibility_pump':     17260 [231.48ms,   19.35s]    5.00s 550.91ms   23.99h     17259 [344.19ms,    7.19s] 652.17ms  55.95ms    3.13h
                            'fixed':         1 [  24.00h,   24.00h]   24.00h   0.00ns   24.00h         1 [   2.18h,    2.18h]    2.18h   0.00ns    2.18h
                  'fj_long_default':        12 [131.10ms, 709.47ms] 198.67ms 155.10ms    2.38s        12 [132.74ms, 231.73ms] 171.47ms  28.62ms    2.06s
              'fj_long_lin_default':         6 [163.61ms,    1.60s] 428.31ms 523.68ms    2.57s         6 [188.96ms, 221.68ms] 209.17ms  10.54ms    1.26s
                   'fj_long_random':        14 [131.20ms, 353.01ms] 172.17ms  51.89ms    2.41s        14 [144.09ms, 225.27ms] 180.13ms  21.26ms    2.52s
                 'fj_short_default':        15 [157.64ms, 600.52ms] 196.71ms 108.28ms    2.95s        15 [196.41ms, 228.42ms] 212.88ms   8.19ms    3.19s
             'fj_short_lin_default':         2 [166.81ms,    2.22s]    1.19s    1.03s    2.38s         2 [185.65ms, 191.09ms] 188.37ms   2.72ms 376.74ms
              'fj_short_lin_random':         5 [164.55ms,    1.71s] 483.71ms 615.36ms    2.42s         5 [189.23ms, 214.55ms] 204.99ms   9.17ms    1.02s
                  'fj_short_random':        12 [157.91ms, 583.59ms] 211.83ms 116.63ms    2.54s        12 [191.51ms, 230.36ms] 210.86ms  11.16ms    2.53s
                        'fs_random':         1 [   3.31s,    3.31s]    3.31s   0.00ns    3.31s         1 [ 52.37ms,  52.37ms]  52.37ms   0.00ns  52.37ms
                        'fs_random':         1 [   3.34s,    3.34s]    3.34s   0.00ns    3.34s         1 [ 68.82ms,  68.82ms]  68.82ms   0.00ns  68.82ms
                  'fs_random_no_lp':         1 [   3.31s,    3.31s]    3.31s   0.00ns    3.31s         1 [ 11.61ms,  11.61ms]  11.61ms   0.00ns  11.61ms
          'fs_random_quick_restart':         1 [   3.31s,    3.31s]    3.31s   0.00ns    3.31s         1 [ 39.67ms,  39.67ms]  39.67ms   0.00ns  39.67ms
          'fs_random_quick_restart':         1 [   3.33s,    3.33s]    3.33s   0.00ns    3.33s         1 [  2.13ms,   2.13ms]   2.13ms   0.00ns   2.13ms
    'fs_random_quick_restart_no_lp':         1 [   3.31s,    3.31s]    3.31s   0.00ns    3.31s         1 [ 72.80ms,  72.80ms]  72.80ms   0.00ns  72.80ms
                    'graph_arc_lns':     34872 [195.25ms,    7.63s]    3.38s 625.43ms   32.77h     34863 [ 10.00ns, 200.03ms]  78.48ms  26.94ms   45.60m
                    'graph_cst_lns':     34872 [142.79ms,    7.98s]    3.51s 688.50ms   33.99h     34858 [ 10.00ns, 200.24ms]  75.08ms  30.88ms   43.62m
                    'graph_dec_lns':     34872 [143.70ms,    7.50s]    3.51s 681.76ms   33.98h     34853 [ 10.00ns, 200.58ms]  75.89ms  30.04ms   44.08m
                    'graph_var_lns':     34872 [204.31ms,    7.55s]    3.28s 779.22ms   31.78h     34840 [ 22.00ns, 200.45ms]  74.23ms  31.15ms   43.11m
                   'lb_tree_search':         1 [  24.00h,   24.00h]   24.00h   0.00ns   24.00h         1 [  13.04h,   13.04h]   13.04h   0.00ns   13.04h
                           'max_lp':         1 [  24.00h,   24.00h]   24.00h   0.00ns   24.00h         1 [   3.03h,    3.03h]    3.03h   0.00ns    3.03h
                            'no_lp':         1 [  24.00h,   24.00h]   24.00h   0.00ns   24.00h         1 [   1.66h,    1.66h]    1.66h   0.00ns    1.66h
              'objective_lb_search':         1 [  24.00h,   24.00h]   24.00h   0.00ns   24.00h         1 [   3.57h,    3.57h]    3.57h   0.00ns    3.57h
       'objective_lb_search_max_lp':         1 [  24.00h,   24.00h]   24.00h   0.00ns   24.00h         1 [   3.67h,    3.67h]    3.67h   0.00ns    3.67h
        'objective_lb_search_no_lp':         1 [  24.00h,   24.00h]   24.00h   0.00ns   24.00h         1 [   1.08h,    1.08h]    1.08h   0.00ns    1.08h
  'objective_shaving_search_max_lp':       143 [ 90.56ms,   51.44m]   10.07m    9.44m   24.00h       135 [  1.84ms,    6.12m]   50.77s   52.06s    1.90h
   'objective_shaving_search_no_lp':       143 [222.86ms,   51.43m]   10.07m    9.44m   24.00h       135 [ 35.90ms,    1.36m]   15.83s   14.35s   35.63m
                          'probing':         1 [  24.00h,   24.00h]   24.00h   0.00ns   24.00h         1 [   8.92h,    8.92h]    8.92h   0.00ns    8.92h
                   'probing_max_lp':         1 [  24.00h,   24.00h]   24.00h   0.00ns   24.00h         1 [   3.06h,    3.06h]    3.06h   0.00ns    3.06h
                     'pseudo_costs':         1 [  24.00h,   24.00h]   24.00h   0.00ns   24.00h         1 [   3.04h,    3.04h]    3.04h   0.00ns    3.04h
                    'quick_restart':         1 [  24.00h,   24.00h]   24.00h   0.00ns   24.00h         1 [   4.97h,    4.97h]    4.97h   0.00ns    4.97h
              'quick_restart_no_lp':         1 [  24.00h,   24.00h]   24.00h   0.00ns   24.00h         1 [   2.49h,    2.49h]    2.49h   0.00ns    2.49h
                    'reduced_costs':         1 [  24.00h,   24.00h]   24.00h   0.00ns   24.00h         1 [   3.55h,    3.55h]    3.55h   0.00ns    3.55h
                        'rins/rens':     34872 [761.42us,    3.77s] 956.46ms 655.89ms    9.26h     30494 [ 10.00ns, 128.46ms]  70.83ms  47.18ms   36.00m
                      'rnd_cst_lns':     34872 [162.57ms,    7.76s]    3.50s 681.32ms   33.86h     34855 [ 10.00ns, 201.39ms]  75.43ms  30.54ms   43.82m
                      'rnd_var_lns':     34872 [101.22ms,    8.07s]    3.45s 687.60ms   33.42h     34852 [ 10.00ns, 200.45ms]  75.06ms  30.83ms   43.60m
         'scheduling_intervals_lns':     34871 [   1.86s,    8.87s]    4.23s 391.45ms   40.95h     34869 [100.00ms, 200.02ms] 100.41ms 637.43us   58.35m
       'scheduling_precedences_lns':     34871 [   1.73s,    9.10s]    4.17s 400.20ms   40.36h     34867 [ 94.88ms, 201.39ms] 100.42ms 993.58us   58.35m
       'scheduling_time_window_lns':     34871 [   1.81s,    8.67s]    4.23s 391.31ms   40.94h     34868 [100.00ms, 201.60ms] 100.42ms 838.40us   58.35m
                     'violation_ls':     34872 [  5.94ms, 855.87ms] 227.28ms  63.53ms    2.20h     34872 [  1.03us, 491.80ms] 229.10ms  57.00ms    2.22h
                     'violation_ls':     34872 [  6.42ms, 947.00ms] 229.21ms  67.20ms    2.22h     34872 [690.00ns, 601.51ms] 228.95ms  55.48ms    2.22h

Search stats                          Bools  Conflicts    Branches   Restarts      BoolPropag   IntegerPropag
                           'core':   29'033  3'672'241   5'509'108     96'432  23'931'589'681  21'112'460'223
                     'default_lp':   34'529  1'986'707  15'122'975    414'384   8'020'377'079  18'260'100'932
                          'fixed':    2'752  7'691'247  15'533'843      1'325   2'965'345'479  29'067'580'136
                      'fs_random':      299          0         623        598              50         123'002
                      'fs_random':      299          0         635        598              58         121'998
                'fs_random_no_lp':      378          3         723        599             392         175'936
        'fs_random_quick_restart':      299          0         598        598              44         118'140
        'fs_random_quick_restart':      299          1         618        598              46         125'804
  'fs_random_quick_restart_no_lp':      311         22       1'681      1'227             753         397'259
                 'lb_tree_search':      365      1'085  23'385'300  5'692'260      78'384'790  13'975'162'945
                         'max_lp':   21'774  2'094'847  20'777'533    626'269   6'518'147'918  22'416'683'177
                          'no_lp':    9'029  2'362'355  12'402'313    702'661   3'211'582'860  22'485'354'027
            'objective_lb_search':    3'098    479'116  10'658'144  1'703'581     442'420'500  15'830'139'190
     'objective_lb_search_max_lp':    1'469    891'058  10'856'853  2'019'612     338'951'942  19'605'006'641
      'objective_lb_search_no_lp':    1'386  1'002'410   4'302'113    672'865     175'684'002  15'066'541'237
                        'probing':    6'125      5'214     157'985     69'811       3'666'288      67'299'035
                 'probing_max_lp':    6'125      5'227     183'194     78'228       4'071'297      75'794'224
                   'pseudo_costs':    1'394  1'556'938  17'618'537  3'702'481     918'268'332  22'468'095'149
                  'quick_restart':   24'026    646'992  29'426'828    384'462   5'585'719'367  15'107'413'412
            'quick_restart_no_lp':   30'959  2'443'076  14'637'646    287'618  14'000'313'707  22'880'426'188
                  'reduced_costs':  203'499  1'851'231  15'621'609    497'782  34'264'551'076  20'706'215'355

SAT stats                           ClassicMinim  LitRemoved   LitLearned  LitForgotten  Subsumed   MClauses  MDecisions  MLitTrue  MSubsumed  MLitRemoved  MReused
                           'core':     3'570'171  94'138'212   59'046'823    27'265'711     3'194     43'651     214'978         0      1'237        4'317      791
                     'default_lp':     1'712'955  19'024'942   58'694'505    46'599'701     4'964    141'886   1'652'742         0     45'378      498'191   22'732
                          'fixed':     6'867'817  15'322'038  318'882'694   317'913'833       486         31         230         0          9           86        5
                      'fs_random':             0           0            0             0         0          0           0         0          0            0        0
                      'fs_random':             0           0            0             0         0          0           0         0          0            0        0
                'fs_random_no_lp':             2           2           35             0         0          0           0         0          0            0        0
        'fs_random_quick_restart':             0           0            0             0         0          0           0         0          0            0        0
        'fs_random_quick_restart':             0           0            2             0         0          0           0         0          0            0        0
  'fs_random_quick_restart_no_lp':             0           0           90             0         0         31         155         0          1            4       11
                 'lb_tree_search':             0           0        3'366             0         0  2'625'710  13'479'979         0        139          540  229'015
                         'max_lp':     1'865'974  21'174'672   48'114'576    39'479'438     9'237    200'794   2'403'812         0     71'157      645'387   34'609
                          'no_lp':     2'122'325  15'349'758   44'183'381    35'546'184    11'976    119'064   1'514'046         0     50'579      439'521   23'078
            'objective_lb_search':       438'474   3'317'579    7'845'257     3'049'125     3'124    506'077   4'511'837         0      9'316       77'232   93'806
     'objective_lb_search_max_lp':       806'429   4'471'490   12'335'808     4'052'369     8'474    451'818   5'289'105         0      6'816       55'027   96'999
      'objective_lb_search_no_lp':       908'974   6'667'657   16'403'899     6'599'092     5'648    209'876   1'755'546         0     10'405       84'870   35'068
                        'probing':             0           0        5'228             0         0          0           0         0          0            0        0
                 'probing_max_lp':             0           0        5'247             0         0          0           0         0          0            0        0
                   'pseudo_costs':     1'229'876   5'585'620   35'396'255    31'944'048    22'556  1'560'688  10'879'194         0      1'152        6'285  152'517
                  'quick_restart':       537'024   5'013'196   16'544'996    12'667'081     6'436    124'449   2'785'718         0     78'128    1'074'601   19'808
            'quick_restart_no_lp':     2'140'586  26'907'448   79'079'419    64'659'920     4'184     34'643     800'267         1     27'129      419'005    1'757
                  'reduced_costs':     1'584'176  15'900'906   55'369'324    51'488'627    12'179    257'872   2'128'689        12     48'939      291'639   71'560

Lp stats                         Component   Iterations  AddedCuts    OPTIMAL     DUAL_F.  DUAL_U.
                  'default_lp':          1   24'965'049  1'031'597  3'325'290         949      271
                       'fixed':          1      977'226      2'569  7'598'275           0        0
                   'fs_random':          1        3'506        767         51           0        0
                   'fs_random':          1        4'220      1'022         72           0        0
     'fs_random_quick_restart':          1        1'080        489          9           0        0
     'fs_random_quick_restart':          1        3'123        662         42           0        0
              'lb_tree_search':          1  148'692'256     51'392     19'356  11'361'245        0
                      'max_lp':          1   36'469'752    746'501    903'566   3'217'909       35
         'objective_lb_search':          1   67'460'505    852'795  2'112'573      10'955      147
  'objective_lb_search_max_lp':          1   34'952'980     36'234     12'088   2'848'593        0
                     'probing':          1   80'488'027    820'465    329'257      40'323        1
              'probing_max_lp':          1   10'238'587    427'259    235'666     118'956        2
                'pseudo_costs':          1   47'986'045    860'834  1'480'913   4'052'662      279
               'quick_restart':          1   90'016'378  2'317'684  2'780'991      25'132      246
               'reduced_costs':          1   31'613'628  1'021'949  2'490'892   2'321'594       95

Lp dimension                                                                        Final dimension of first component
                  'default_lp':  2969 rows, 3141 columns, 10881 entries with magnitude in [4.094310e-03, 1.000000e+00]
                       'fixed':   2791 rows, 3141 columns, 9933 entries with magnitude in [1.013020e-02, 1.000000e+00]
                   'fs_random':   1837 rows, 3141 columns, 6828 entries with magnitude in [2.737928e-02, 1.000000e+00]
                   'fs_random':   2338 rows, 3141 columns, 8380 entries with magnitude in [1.243527e-02, 1.000000e+00]
     'fs_random_quick_restart':   1588 rows, 3141 columns, 5976 entries with magnitude in [2.737928e-02, 1.000000e+00]
     'fs_random_quick_restart':    738 rows, 3141 columns, 3097 entries with magnitude in [2.737928e-02, 1.000000e+00]
              'lb_tree_search':  6836 rows, 3178 columns, 34311 entries with magnitude in [8.216197e-04, 1.000000e+00]
                      'max_lp':  3612 rows, 3178 columns, 13872 entries with magnitude in [3.222550e-04, 1.000000e+00]
         'objective_lb_search':  3328 rows, 3141 columns, 12772 entries with magnitude in [1.159941e-02, 1.000000e+00]
  'objective_lb_search_max_lp':  6525 rows, 3178 columns, 31203 entries with magnitude in [4.380334e-04, 1.000000e+00]
                     'probing':  5438 rows, 3141 columns, 35999 entries with magnitude in [4.313957e-04, 1.000000e+00]
              'probing_max_lp':  4397 rows, 3178 columns, 24182 entries with magnitude in [2.025522e-04, 1.000000e+00]
                'pseudo_costs':  3894 rows, 3178 columns, 16193 entries with magnitude in [4.961633e-04, 1.000000e+00]
               'quick_restart':  4487 rows, 3141 columns, 18505 entries with magnitude in [3.248756e-04, 1.000000e+00]
               'reduced_costs':  3457 rows, 3178 columns, 12748 entries with magnitude in [4.740890e-03, 1.000000e+00]

Lp debug                         CutPropag  CutEqPropag      Adjust  Overflow            Bad  BadScaling
                  'default_lp':         25          197     379'987         0     19'129'173           0
                       'fixed':          0            0           0         0         38'120           0
                   'fs_random':          0            0           0         0          2'245           0
                   'fs_random':          0            0           0         0          2'260           0
     'fs_random_quick_restart':          0            0           0         0          2'255           0
     'fs_random_quick_restart':          0            0           0         0          2'258           0
              'lb_tree_search':         64           90  11'182'861         0     50'277'386           0
                      'max_lp':         82           91   1'569'135         0     28'603'961           0
         'objective_lb_search':         57          156     982'093         0     28'105'311           0
  'objective_lb_search_max_lp':         69           41   2'840'382         0     12'193'660           0
                     'probing':        632        2'638     366'321         0  2'345'163'335           0
              'probing_max_lp':        252        1'768     354'621         0  2'500'235'685           0
                'pseudo_costs':        100          117   2'286'016         0     37'524'833           0
               'quick_restart':        240          293   1'563'437         0    103'286'447           0
               'reduced_costs':        180          187   1'674'283         0     37'217'126           0

Lp pool                          Constraints  Updates  Simplif  Merged  Shortened      Split  Strenghtened            Cuts/Call
                  'default_lp':       13'048    3'858   17'156     168          0     86'975        70'343  1'031'597/3'661'746
                       'fixed':        6'188        2        0       0          0          3           403         2'569/10'366
                   'fs_random':        4'386        0        0       0          0          0           288            767/2'434
                   'fs_random':        4'641        0        0       0          0          0           282          1'022/2'904
     'fs_random_quick_restart':        4'108        0        0       0          0          0           282            489/1'317
     'fs_random_quick_restart':        4'281        0        0       0          0          0           284            662/2'161
              'lb_tree_search':       45'166    3'879  368'674      30          0    332'128       364'413       51'392/122'695
                      'max_lp':       45'221    3'567  344'633      84          0    363'249       442'644    746'501/1'587'078
         'objective_lb_search':       13'380    3'438   15'767      34          0    205'769        58'422    852'795/3'586'313
  'objective_lb_search_max_lp':       45'016    1'480  386'379      22          0    249'130       377'318        36'234/86'467
                     'probing':       13'035   54'972   17'898      49          0  2'427'808        87'034    820'465/1'759'620
              'probing_max_lp':       44'957   54'552  329'176     106          0    786'233       388'805    427'259/1'135'222
                'pseudo_costs':       45'569    3'739  350'090      69          0    470'289       492'999    860'834/1'947'906
               'quick_restart':       13'138    6'446   18'372     165          0  1'546'372        75'925  2'317'684/7'733'984
               'reduced_costs':       45'592    4'810  368'680     161          0    444'909       498'986  1'021'949/2'484'908

Lp Cut                                                fs_ran  fs_ran  fs_ran  fs_ran   defaul  fixed   max_lp     quick_   reduce   pseudo  lb_tre   probin   object   probin  object
                                              CG_FF:      63      63      63      60   38'720    174   36'182      6'602   62'579   39'709   1'011    3'009   12'769    2'008   1'385
                                               CG_K:      63      63      63      60   28'656    124   37'494      3'865   65'648   41'312     827    1'618    9'607    1'489   1'271
                                              CG_KL:       -       -       -       -       52      -        4          5       86       37       -        8       17        3       3
                                               CG_R:      28      28      28      25   17'750     68   17'513      4'044   29'167   23'599     478    6'771    6'697    1'972     550
                                              CG_RB:       3       3       3       3   79'716    177   88'111     20'085  139'132  117'455   3'059   14'151   42'962    7'131   2'677
                                             CG_RBP:       -       -       -       -    6'964      5   10'407      1'957   17'763   15'372     342    1'331    4'193    1'637     317
                                             Clique:       -       -       -       -        -      -    7'243          -   17'140   11'332     207        -        -    1'077     190
                                                 IB:     253     339     615      73  604'516  1'047  256'787  2'016'574  297'172  195'481   5'603  296'231  594'868   94'317   5'955
                                           MIR_1_FF:      75      76      76      75   26'049    142   27'384     23'791   40'023   38'552   1'931   32'769   17'674   15'851   1'592
                                            MIR_1_K:      18      19      19      19    3'304     25    4'004      4'271    4'998    5'946     219   13'924    2'673    2'523     233
                                           MIR_1_KL:       -       -       -       -    1'111      -    1'271        890      718      723      41    1'130      496    2'183      19
                                            MIR_1_R:      25      25      25      25    5'480     38    3'991      7'895    6'566    5'734     404   32'162    3'855    6'974     364
                                           MIR_1_RB:      21      22      21      21   42'923    138   63'075     41'877   79'132   82'623   5'408   59'570   30'870   49'364   4'186
                                          MIR_1_RBP:       2       2       2       2    3'384      8   18'389      3'850   21'710   24'534     848    2'702    3'096    3'588     752
                                          MIR_1_RLT:       -       -       -       -        -      -      372          -      866      529      37        -        -      629      19
                                           MIR_2_FF:      25      23      19      23   18'532     82   15'000     13'105   22'749   23'269   1'195   12'313   10'749   10'363     983
                                            MIR_2_K:      17      17      17      23    3'105     30    2'953      1'962    4'322    4'458     184    2'477    1'892    2'098     227
                                           MIR_2_KL:       -       -       -       -      733      -      843        818      702      548      30    1'089      331    2'267      21
                                            MIR_2_R:      12       9      10      13    4'243     22    3'413      3'653    4'912    5'584     729    8'563    2'818    7'178     397
                                           MIR_2_RB:      24      26      24      25   29'568    120   26'819     29'214   36'886   39'867   2'629   41'158   19'955   25'333   1'931
                                          MIR_2_RBP:       -       -       -       -    2'718      3    5'997      2'985    7'744    9'165     275    2'226    2'336    2'394     260
                                           MIR_3_FF:       3       6       6       5   12'185     32    8'769      9'050   15'032   15'394     673    7'306    7'093    5'534     531
                                            MIR_3_K:       5       6       6       5    2'333     14    2'034      1'491    3'187    3'276     130    1'153    1'369    1'627     145
                                           MIR_3_KL:       -       -       -       -      556      -      625        607      490      440      42      905      257    1'953      20
                                            MIR_3_R:       1       2       3       2    2'965      8    2'086      2'790    3'186    3'627     638    5'223    1'932    4'161     306
                                           MIR_3_RB:       5      10       6       8   18'394     66   14'789     18'437   21'492   23'236   1'528   27'701   12'269   12'956   1'024
                                          MIR_3_RBP:       -       -       -       -    1'942      3    3'087      1'851    4'155    4'957     177    1'840    1'650    1'339     138
                                           MIR_4_FF:       -       -       -       -    7'229     23    4'834      5'888    7'781    8'868     410    4'994    4'835    2'783     324
                                            MIR_4_K:       -       3       1       -    1'702      1    1'382      1'074    1'975    2'176      89      838    1'020    1'220      72
                                           MIR_4_KL:       -       -       -       -      414      -      450        581      396      431      37    1'055      214    1'575      23
                                            MIR_4_R:       -       -       -       -    1'591      2    1'170      1'656    1'480    2'195     308    3'167    1'400    1'845     160
                                           MIR_4_RB:       -       2       -       -   11'733     34    8'276     11'405   11'726   13'040     852   18'082    7'709    7'147     546
                                          MIR_4_RBP:       -       -       -       -      952      2    1'459      1'069    1'925    2'362      86    1'085      921      852      80
                                           MIR_5_FF:       -       -       -       -    4'338     23    2'763      3'760    4'287    4'977     242    3'266    3'231    1'569     188
                                            MIR_5_K:       -       -       -       -    1'141      1      956        785    1'172    1'306      61      569      799      913      47
                                           MIR_5_KL:       -       -       -       -      382      -      419        745      363      384      61    1'073      322    1'706      22
                                            MIR_5_R:       -       -       -       -      917      4      639      1'045      788    1'341     177    1'867    1'070      794      84
                                           MIR_5_RB:       -       -       -       -    7'392     34    4'861      6'832    6'689    7'728     467   11'650    5'182    4'141     348
                                          MIR_5_RBP:       -       -       -       -      516      2      714        691      892    1'276      64      740      571      650      41
                                           MIR_6_FF:       -       -       -       -    2'688     19    1'676      2'280    2'536    3'240     171    2'197    2'065    1'164     115
                                            MIR_6_K:       -       1       -       -      777      3      611        819      744      873      49      594      745    1'196      44
                                           MIR_6_KL:       -       -       -       -      526      -      392      1'708      500      482      82    1'977      520    2'067      34
                                            MIR_6_R:       -       -       -       -      588      4      379        610      471      739      77    1'190      716      390      43
                                           MIR_6_RB:       -       -       -       -    4'932     19    3'136      4'595    4'092    4'745     255    8'558    3'348    3'354     197
                                          MIR_6_RBP:       -       -       -       -      298      -      494        433      538      815      45      697      379      495      43
   NoOverlapCompletionTimeExhaustiveMirror_weighted:       -       -       -       -        -      -        6          -        2        -       -        -        -        -       -
         NoOverlapCompletionTimeExhaustive_weighted:       -       -       -       -        -      -      585          -    1'289      850       1        -        -        1      15
  NoOverlapCompletionTimeExhaustive_weighted_lifted:       -       -       -       -        -      -      609          -      694      406       4        -        -        3      14
                    NoOverlapCompletionTimeQueyrane:       -       -       -       -        -      -      258          -      463      178       6        -        -       12      15
                          NoOverlapDisjunctionOnEnd:       -       -       -       -        -      -       20          -       26        4       -        -        -        -       -
                        NoOverlapDisjunctionOnStart:       -       -       -       -        -      -      918          -    2'190    1'614       5        -        -        5      11
                                       ZERO_HALF_FF:       6       7       5       6    6'874     16    8'240      2'531   12'866   10'338     245    1'508    3'299      913     310
                                        ZERO_HALF_K:       4       3       3       6    1'979      8    3'398      1'033    6'102    4'774      86      547    1'066      409     146
                                       ZERO_HALF_KL:       -       -       -       -       93      -       67         37      113      104       -        8       42        3       3
                                        ZERO_HALF_R:       4       7       3       4    7'519     18   16'763     34'344   14'299   18'898  16'400  146'740   11'749  104'584   6'331
                                       ZERO_HALF_RB:       4       5       3       5    8'998     25   16'774      9'000   20'959   22'029   1'522   22'384    7'113   10'935   1'034
                                      ZERO_HALF_RBP:       1       -       1       1    2'119      5    5'610      3'094    7'034    7'902     945    8'349    2'051    8'584     448

LNS stats                        Improv/Calls  Closed  Difficulty  TimeLimit
               'graph_arc_lns':    9784/34871     50%        1.00       0.10
               'graph_cst_lns':   12262/34870     50%        1.00       0.10
               'graph_dec_lns':   11179/34870     50%        1.00       0.10
               'graph_var_lns':   12302/34870     50%        1.00       0.10
                   'rins/rens':    6942/32691     50%        0.92       0.13
                 'rnd_cst_lns':   12087/34871     50%        1.00       0.10
                 'rnd_var_lns':   11434/34871     50%        1.00       0.10
    'scheduling_intervals_lns':   34869/34870      0%        0.00       0.10
  'scheduling_precedences_lns':   34869/34870      0%        0.00       0.10
  'scheduling_time_window_lns':   34870/34870      0%        0.00       0.10

LS stats                   Batches  Restarts     LinMoves    GenMoves  CompoundMoves  WeightUpdates
       'fj_long_default':       12         1      119'757           0              0            243
   'fj_long_lin_default':        6         1            0       8'784          1'084              0
        'fj_long_random':       14         1      139'715           0              0            285
      'fj_short_default':       15         1            0      17'328          1'668              1
  'fj_short_lin_default':        2         1            0       4'426            789              0
   'fj_short_lin_random':        5         1            0       7'670          1'233              0
       'fj_short_random':       12         1            0      16'563          1'609              1
          'violation_ls':   34'872         0  167'313'922  17'747'304        640'746      2'166'708
          'violation_ls':   34'872         0  179'251'025  17'182'266        671'809      1'913'160

Solutions (105)           Num      Rank
      'fs_random_no_lp':    1     [1,1]
        'graph_arc_lns':    7   [30,93]
        'graph_cst_lns':    6   [21,99]
        'graph_dec_lns':    6  [24,105]
        'graph_var_lns':    4   [29,65]
                'no_lp':    6     [2,8]
  'quick_restart_no_lp':   22   [7,102]
          'rins_lp_lns':    8   [12,98]
        'rins_pump_lns':    6  [35,104]
          'rnd_cst_lns':    3   [13,71]
          'rnd_var_lns':    6   [25,92]
         'violation_ls':   30  [10,103]

Objective bounds                      Num
                   'initial_domain':    1
                   'lb_tree_search':   59
                           'max_lp':    2
              'objective_lb_search':    1
       'objective_lb_search_max_lp':   72
        'objective_lb_search_no_lp':   13
  'objective_shaving_search_max_lp':    1
                     'pseudo_costs':    5

Solution repositories      Added  Queried  Ignored  Synchro
  'feasible solutions':  166'087  793'304        0  163'198
        'lp solutions':   92'986   17'388        0   89'690
                'pump':  361'973   17'484

Improving bounds shared             Num
                        'core':       2
                  'default_lp':     447
             'fs_random_no_lp':     546
              'lb_tree_search':     163
                      'max_lp':     537
                       'no_lp':     208
         'objective_lb_search':     120
  'objective_lb_search_max_lp':     289
                     'probing':  31'977
              'probing_max_lp':  11'154
                'pseudo_costs':     477
               'quick_restart':   5'361
         'quick_restart_no_lp':   6'449
               'reduced_costs':     687

Clauses shared                   Num
                        'core':    5
                  'default_lp':   19
     'fs_random_quick_restart':    1
              'lb_tree_search':    7
                      'max_lp':   12
                       'no_lp':    8
         'objective_lb_search':   23
  'objective_lb_search_max_lp':    1
   'objective_lb_search_no_lp':   10
                'pseudo_costs':   31
               'quick_restart':   13
         'quick_restart_no_lp':   39
               'reduced_costs':    6

CpSolverResponse summary:
status: FEASIBLE
objective: 3461
best_bound: 1795
integers: 3172
booleans: 299
conflicts: 1
branches: 618
propagations: 46
integer_propagations: 125804
restarts: 598
lp_iterations: 3123
walltime: 86401.3
usertime: 86401.3
deterministic_time: 327428
gap_integral: 2.43071e+06
solution_fingerprint: 0xcc361b9b68e70f5


--- Simulation Gantt  partir du modle mathmatique ---
