created virtual environment CPython3.12.4.final.0-64 in 9307ms
  creator CPython3Posix(dest=/localscratch/aneumann.63393225.0/env, clear=False, no_vcs_ignore=False, global=False)
  seeder FromAppData(download=False, pip=bundle, via=copy, app_data_dir=/home/aneumann/.local/share/virtualenv)
    added seed packages: pip==25.1.1
  activators BashActivator,CShellActivator,FishActivator,NushellActivator,PowerShellActivator,PythonActivator
Looking in links: /cvmfs/soft.computecanada.ca/custom/python/wheelhouse/gentoo2023/x86-64-v3, /cvmfs/soft.computecanada.ca/custom/python/wheelhouse/gentoo2023/generic, /cvmfs/soft.computecanada.ca/custom/python/wheelhouse/generic
Requirement already satisfied: pip in /localscratch/aneumann.63393225.0/env/lib/python3.12/site-packages (25.1.1)
Looking in links: /cvmfs/soft.computecanada.ca/custom/python/wheelhouse/gentoo2023/x86-64-v3, /cvmfs/soft.computecanada.ca/custom/python/wheelhouse/gentoo2023/generic, /cvmfs/soft.computecanada.ca/custom/python/wheelhouse/generic
ERROR: protobuf-5.28.3-cp38-abi3-manylinux2014_x86_64.whl is not a supported wheel on this platform.
Looking in links: /cvmfs/soft.computecanada.ca/custom/python/wheelhouse/gentoo2023/x86-64-v3, /cvmfs/soft.computecanada.ca/custom/python/wheelhouse/gentoo2023/generic, /cvmfs/soft.computecanada.ca/custom/python/wheelhouse/generic
Processing /home/aneumann/projects/def-adhaj/aneumann/GNRS/wheels/immutabledict-4.2.0-py3-none-any.whl
Installing collected packages: immutabledict
Successfully installed immutabledict-4.2.0
Looking in links: /cvmfs/soft.computecanada.ca/custom/python/wheelhouse/gentoo2023/x86-64-v3, /cvmfs/soft.computecanada.ca/custom/python/wheelhouse/gentoo2023/generic, /cvmfs/soft.computecanada.ca/custom/python/wheelhouse/generic
Processing /cvmfs/soft.computecanada.ca/custom/python/wheelhouse/generic/ortools-9.10.4067+computecanada-cp312-cp312-linux_x86_64.whl (from -r /home/aneumann/projects/def-adhaj/aneumann/GNRS/requirements/or.txt (line 1))
Processing /cvmfs/soft.computecanada.ca/custom/python/wheelhouse/gentoo2023/x86-64-v3/matplotlib-3.10.0+computecanada-cp312-cp312-linux_x86_64.whl (from -r /home/aneumann/projects/def-adhaj/aneumann/GNRS/requirements/or.txt (line 2))
Processing /cvmfs/soft.computecanada.ca/custom/python/wheelhouse/gentoo2023/x86-64-v3/pandas-2.2.3+computecanada-cp312-cp312-linux_x86_64.whl (from -r /home/aneumann/projects/def-adhaj/aneumann/GNRS/requirements/or.txt (line 3))
Processing /cvmfs/soft.computecanada.ca/custom/python/wheelhouse/generic/absl_py-2.2.2+computecanada-py3-none-any.whl (from ortools<9.11,>=9.10->-r /home/aneumann/projects/def-adhaj/aneumann/GNRS/requirements/or.txt (line 1))
Processing /cvmfs/soft.computecanada.ca/custom/python/wheelhouse/gentoo2023/generic/numpy-2.2.2+computecanada-cp312-cp312-linux_x86_64.whl (from ortools<9.11,>=9.10->-r /home/aneumann/projects/def-adhaj/aneumann/GNRS/requirements/or.txt (line 1))
Processing /cvmfs/soft.computecanada.ca/custom/python/wheelhouse/gentoo2023/x86-64-v3/protobuf-6.30.2+computecanada-cp312-cp312-linux_x86_64.whl (from ortools<9.11,>=9.10->-r /home/aneumann/projects/def-adhaj/aneumann/GNRS/requirements/or.txt (line 1))
Requirement already satisfied: immutabledict>=3.0.0 in /localscratch/aneumann.63393225.0/env/lib/python3.12/site-packages (from ortools<9.11,>=9.10->-r /home/aneumann/projects/def-adhaj/aneumann/GNRS/requirements/or.txt (line 1)) (4.2.0)
Processing /cvmfs/soft.computecanada.ca/custom/python/wheelhouse/gentoo2023/generic/contourpy-1.3.1+computecanada-cp312-cp312-linux_x86_64.whl (from matplotlib->-r /home/aneumann/projects/def-adhaj/aneumann/GNRS/requirements/or.txt (line 2))
Processing /cvmfs/soft.computecanada.ca/custom/python/wheelhouse/generic/cycler-0.12.1+computecanada-py3-none-any.whl (from matplotlib->-r /home/aneumann/projects/def-adhaj/aneumann/GNRS/requirements/or.txt (line 2))
Processing /cvmfs/soft.computecanada.ca/custom/python/wheelhouse/generic/fonttools-4.58.2+computecanada-cp312-cp312-linux_x86_64.whl (from matplotlib->-r /home/aneumann/projects/def-adhaj/aneumann/GNRS/requirements/or.txt (line 2))
Processing /cvmfs/soft.computecanada.ca/custom/python/wheelhouse/gentoo2023/x86-64-v3/kiwisolver-1.4.8+computecanada-cp312-cp312-linux_x86_64.whl (from matplotlib->-r /home/aneumann/projects/def-adhaj/aneumann/GNRS/requirements/or.txt (line 2))
Processing /cvmfs/soft.computecanada.ca/custom/python/wheelhouse/generic/packaging-25.0+computecanada-py3-none-any.whl (from matplotlib->-r /home/aneumann/projects/def-adhaj/aneumann/GNRS/requirements/or.txt (line 2))
Processing /cvmfs/soft.computecanada.ca/custom/python/wheelhouse/gentoo2023/x86-64-v3/pillow-11.1.0+computecanada-cp312-cp312-linux_x86_64.whl (from matplotlib->-r /home/aneumann/projects/def-adhaj/aneumann/GNRS/requirements/or.txt (line 2))
Processing /cvmfs/soft.computecanada.ca/custom/python/wheelhouse/generic/pyparsing-3.2.1+computecanada-py3-none-any.whl (from matplotlib->-r /home/aneumann/projects/def-adhaj/aneumann/GNRS/requirements/or.txt (line 2))
Processing /cvmfs/soft.computecanada.ca/custom/python/wheelhouse/generic/python_dateutil-2.9.0.post0+computecanada-py2.py3-none-any.whl (from matplotlib->-r /home/aneumann/projects/def-adhaj/aneumann/GNRS/requirements/or.txt (line 2))
Processing /cvmfs/soft.computecanada.ca/custom/python/wheelhouse/generic/pytz-2025.2+computecanada-py2.py3-none-any.whl (from pandas->-r /home/aneumann/projects/def-adhaj/aneumann/GNRS/requirements/or.txt (line 3))
Processing /cvmfs/soft.computecanada.ca/custom/python/wheelhouse/generic/tzdata-2025.2+computecanada-py2.py3-none-any.whl (from pandas->-r /home/aneumann/projects/def-adhaj/aneumann/GNRS/requirements/or.txt (line 3))
Processing /cvmfs/soft.computecanada.ca/custom/python/wheelhouse/generic/six-1.17.0+computecanada-py2.py3-none-any.whl (from python-dateutil>=2.7->matplotlib->-r /home/aneumann/projects/def-adhaj/aneumann/GNRS/requirements/or.txt (line 2))
Installing collected packages: pytz, tzdata, six, pyparsing, protobuf, pillow, packaging, numpy, kiwisolver, fonttools, cycler, absl-py, python-dateutil, contourpy, pandas, matplotlib, ortools

Successfully installed absl-py-2.2.2+computecanada contourpy-1.3.1+computecanada cycler-0.12.1+computecanada fonttools-4.58.2+computecanada kiwisolver-1.4.8+computecanada matplotlib-3.10.0+computecanada numpy-2.2.2+computecanada ortools-9.10.4067+computecanada packaging-25.0+computecanada pandas-2.2.3+computecanada pillow-11.1.0+computecanada protobuf-6.30.2+computecanada pyparsing-3.2.1+computecanada python-dateutil-2.9.0.post0+computecanada pytz-2025.2+computecanada six-1.17.0+computecanada tzdata-2025.2+computecanada

Starting CP-SAT solver v9.10.4067
Parameters: max_time_in_seconds: 3600 max_memory_in_mb: 12000 log_search_progress: true enumerate_all_solutions: false absolute_gap_limit: 0 relative_gap_limit: 0
Setting number of workers to 48

Initial optimization model '': (model_fingerprint: 0x9674f6624d3748cf)
#Variables: 265 (#ints: 8 in objective)
  - 182 Booleans in [0,1]
  - 83 in [0,530]
#kLinear1: 37
#kLinear2: 431
#kLinear3: 153
#kLinearN: 1'955 (#terms: 27'346)

Starting presolve at 0.00s
  1.62e-03s  0.00e+00d  [DetectDominanceRelations] 
  3.49e-02s  0.00e+00d  [PresolveToFixPoint] #num_loops=6 #num_dual_strengthening=3 
  2.60e-05s  0.00e+00d  [ExtractEncodingFromLinear] #potential_supersets=6 
[Symmetry] Graph for symmetry has 2'606 nodes and 22'822 arcs.
[Symmetry] Symmetry computation done. time: 0.00208926 dtime: 0.00238458
[Symmetry] #generators: 1, average support size: 26
[Symmetry] The model contains 245 duplicate constraints !
[Symmetry] 13 orbits with sizes: 2,2,2,2,2,2,2,2,2,2,...
[Symmetry] Num fixable by intersecting at_most_one with orbits: 1 largest_orbit: 2
  8.33e-03s  1.10e-03d  [Probe] #probed=266 #fixed_bools=3 #new_bounds=6 #equiv=1 
  4.33e-05s  0.00e+00d  [MaxClique] Merged 17(34 literals) into 8(16 literals) at_most_ones. 
  1.59e-03s  0.00e+00d  [DetectDominanceRelations] 
  1.49e-02s  0.00e+00d  [PresolveToFixPoint] #num_loops=4 #num_dual_strengthening=3 
  5.77e-03s  0.00e+00d  [ProcessAtMostOneAndLinear] 
  2.29e-03s  0.00e+00d  [DetectDuplicateConstraints] #duplicates=275 #without_enforcements=27 
  1.71e-03s  8.42e-05d  [DetectDominatedLinearConstraints] #relevant_constraints=1'675 #num_inclusions=676 #num_redundant=2 
  3.05e-04s  0.00e+00d  [DetectDifferentVariables] #different=25 
  5.39e-04s  3.09e-05d  [ProcessSetPPC] #relevant_constraints=1'396 
  1.84e-05s  0.00e+00d  [FindAlmostIdenticalLinearConstraints] 
  2.85e-04s  2.63e-04d  [FindBigAtMostOneAndLinearOverlap] 
  6.21e-03s  1.93e-03d  [FindBigVerticalLinearOverlap] #blocks=42 #saved_nz=3'614 
  2.74e-04s  7.14e-05d  [FindBigHorizontalLinearOverlap] #linears=1'312 
  1.13e-05s  0.00e+00d  [MergeClauses] 
  1.66e-03s  0.00e+00d  [DetectDominanceRelations] 
  1.93e-02s  0.00e+00d  [PresolveToFixPoint] #num_loops=2 #num_dual_strengthening=1 
  1.65e-03s  0.00e+00d  [DetectDominanceRelations] 
  1.09e-02s  0.00e+00d  [PresolveToFixPoint] #num_loops=1 #num_dual_strengthening=1 
[Symmetry] Graph for symmetry has 2'433 nodes and 18'164 arcs.
[Symmetry] Symmetry computation done. time: 0.000759021 dtime: 0.00105261
  8.02e-03s  1.06e-03d  [Probe] #probed=260 #new_bounds=33 
  1.10e-05s  0.00e+00d  [MaxClique] 
  1.65e-03s  0.00e+00d  [DetectDominanceRelations] 
  1.78e-02s  0.00e+00d  [PresolveToFixPoint] #num_loops=2 #num_dual_strengthening=1 
  5.34e-03s  0.00e+00d  [ProcessAtMostOneAndLinear] 
  1.98e-03s  0.00e+00d  [DetectDuplicateConstraints] #without_enforcements=51 
  1.12e-03s  5.44e-05d  [DetectDominatedLinearConstraints] #relevant_constraints=1'540 #num_inclusions=106 
  3.06e-04s  0.00e+00d  [DetectDifferentVariables] #different=31 #cliques=1 #size=3 
  4.83e-04s  2.24e-05d  [ProcessSetPPC] #relevant_constraints=1'244 
  2.87e-05s  1.05e-07d  [FindAlmostIdenticalLinearConstraints] #num_tested_pairs=7 
  1.59e-04s  1.10e-04d  [FindBigAtMostOneAndLinearOverlap] 
  3.77e-03s  1.38e-03d  [FindBigVerticalLinearOverlap] #blocks=30 #saved_nz=1'973 
  2.47e-04s  5.76e-05d  [FindBigHorizontalLinearOverlap] #linears=1'214 
  1.07e-05s  0.00e+00d  [MergeClauses] 
  1.54e-03s  0.00e+00d  [DetectDominanceRelations] 
  1.79e-02s  0.00e+00d  [PresolveToFixPoint] #num_loops=3 #num_dual_strengthening=1 
  1.56e-03s  0.00e+00d  [DetectDominanceRelations] 
  1.23e-02s  0.00e+00d  [PresolveToFixPoint] #num_loops=1 #num_dual_strengthening=1 
  7.69e-03s  9.76e-04d  [Probe] #probed=260 #new_bounds=26 
  1.13e-05s  0.00e+00d  [MaxClique] 
  1.56e-03s  0.00e+00d  [DetectDominanceRelations] 
  1.72e-02s  0.00e+00d  [PresolveToFixPoint] #num_loops=2 #num_dual_strengthening=1 
  5.04e-03s  0.00e+00d  [ProcessAtMostOneAndLinear] 
  1.96e-03s  0.00e+00d  [DetectDuplicateConstraints] #without_enforcements=63 
  9.77e-04s  4.53e-05d  [DetectDominatedLinearConstraints] #relevant_constraints=1'511 #num_inclusions=74 
  2.05e-04s  0.00e+00d  [DetectDifferentVariables] 
  4.30e-04s  1.79e-05d  [ProcessSetPPC] #relevant_constraints=1'193 
  3.62e-05s  2.55e-07d  [FindAlmostIdenticalLinearConstraints] #num_tested_pairs=14 
  1.33e-04s  8.72e-05d  [FindBigAtMostOneAndLinearOverlap] 
  2.88e-03s  1.07e-03d  [FindBigVerticalLinearOverlap] #blocks=18 #saved_nz=1'193 
  2.21e-04s  4.96e-05d  [FindBigHorizontalLinearOverlap] #linears=1'152 
  1.06e-05s  0.00e+00d  [MergeClauses] 
  1.42e-03s  0.00e+00d  [DetectDominanceRelations] 
  1.52e-02s  0.00e+00d  [PresolveToFixPoint] #num_loops=2 #num_dual_strengthening=1 
  7.84e-05s  0.00e+00d  [ExpandObjective] #entries=413 #tight_variables=140 #tight_constraints=79 

Presolve summary:
  - 52 affine relations were detected.
  - rule 'TODO dual: only one blocking constraint?' was applied 644 times.
  - rule 'TODO dual: only one unspecified blocking constraint?' was applied 104 times.
  - rule 'TODO duplicate: identical constraint with different enforcements' was applied 141 times.
  - rule 'TODO no_overlap: with task always last' was applied 1 time.
  - rule 'affine: new relation' was applied 52 times.
  - rule 'all_diff: inferred from x != y constraints' was applied 1 time.
  - rule 'at_most_one: removed literals' was applied 8 times.
  - rule 'at_most_one: size one' was applied 8 times.
  - rule 'at_most_one: transformed into max clique.' was applied 1 time.
  - rule 'deductions: 184 stored' was applied 1 time.
  - rule 'dual: fix variable' was applied 21 times.
  - rule 'dual: reduced domain' was applied 38 times.
  - rule 'duplicate: merged rhs of linear constraint' was applied 34 times.
  - rule 'duplicate: removed constraint' was applied 275 times.
  - rule 'enforcement: false literal' was applied 16 times.
  - rule 'enforcement: true literal' was applied 13 times.
  - rule 'exactly_one: x and not(x)' was applied 1 time.
  - rule 'incompatible linear: add implication' was applied 18 times.
  - rule 'linear inclusion: redundant containing constraint' was applied 2 times.
  - rule 'linear matrix: common vertical rectangle' was applied 90 times.
  - rule 'linear: always true' was applied 394 times.
  - rule 'linear: doubleton free' was applied 10 times.
  - rule 'linear: empty' was applied 22 times.
  - rule 'linear: extracted enforcement literal' was applied 3'112 times.
  - rule 'linear: fixed or dup variables' was applied 1'955 times.
  - rule 'linear: positive equal one' was applied 6 times.
  - rule 'linear: reduced variable domains' was applied 182 times.
  - rule 'linear: remapped using affine relations' was applied 1'985 times.
  - rule 'linear: simplified rhs' was applied 6'717 times.
  - rule 'linear: variable substitution 1' was applied 10 times.
  - rule 'linear: variable substitution 2' was applied 5 times.
  - rule 'presolve: 72 unused variables removed.' was applied 1 time.
  - rule 'presolve: iteration' was applied 3 times.
  - rule 'probing: reduced enforced constraint to implication.' was applied 17 times.
  - rule 'symmetry: fixed to false in general orbit' was applied 1 time.

Presolved optimization model '': (model_fingerprint: 0xb9dcdb4340a0fbf5)
#Variables: 216 (#ints: 8 in objective)
  - 68 Booleans in [0,1]
  - 105 different domains in [-4703,4152] with a largest complexity of 13.
#kAllDiff: 1
#kExactlyOne: 5 (#literals: 15)
#kLinear2: 395 (#enforced: 343 #multi: 267)
#kLinear3: 158 (#enforced: 95 #multi: 10)
#kLinearN: 1'315 (#enforced: 1'163) (#terms: 10'576)

Preloading model.
#Bound   0.24s best:inf   next:[128,3565] initial_domain
#Model   0.25s var:216/216 constraints:1874/1874

Starting search at 0.25s with 48 workers.
16 full problem subsolvers: [core, default_lp, lb_tree_search, max_lp, no_lp, objective_lb_search, objective_lb_search_max_lp, objective_lb_search_no_lp, objective_shaving_search_max_lp, objective_shaving_search_no_lp, probing, probing_max_lp, pseudo_costs, quick_restart, quick_restart_no_lp, reduced_costs]
30 first solution subsolvers: [fj_long_default(2), fj_long_lin_default, fj_long_lin_perturb, fj_long_lin_random, fj_long_perturb, fj_long_random, fj_short_default(2), fj_short_lin_default(2), fj_short_lin_perturb, fj_short_lin_random, fj_short_perturb, fj_short_random, fs_random(4), fs_random_no_lp(4), fs_random_quick_restart(4), fs_random_quick_restart_no_lp(3)]
13 incomplete subsolvers: [feasibility_pump, graph_arc_lns, graph_cst_lns, graph_dec_lns, graph_var_lns, rins/rens, rnd_cst_lns, rnd_var_lns, violation_ls(5)]
3 helper subsolvers: [neighborhood_helper, synchronization_agent, update_gap_integral]
#Bound   0.28s best:inf   next:[153,3565] objective_lb_search_no_lp
#1       0.28s best:1426  next:[153,1425] no_lp (fixed_bools=0/87)
#Bound   0.28s best:1426  next:[208,1425] objective_lb_search_no_lp
#Bound   0.28s best:1426  next:[209,1425] objective_lb_search_no_lp
#Bound   0.29s best:1426  next:[215,1425] objective_lb_search_no_lp
#Bound   0.29s best:1426  next:[219,1425] objective_lb_search_no_lp
#2       0.29s best:1425  next:[219,1424] violation_ls(batch:1 #solutions_imported:1 #lin_moves:0 #lin_evals:99 #gen_moves:55 #gen_evals:7 #comp_moves:9 #backtracks:23 #weight_updates:0)
#3       0.29s best:1410  next:[219,1409] no_lp (fixed_bools=0/95)
#4       0.30s best:1210  next:[219,1209] no_lp (fixed_bools=0/101)
#5       0.30s best:1148  next:[219,1147] no_lp (fixed_bools=0/107)
#6       0.31s best:1124  next:[219,1123] no_lp (fixed_bools=0/119)
#Bound   0.31s best:1124  next:[393,1123] objective_lb_search_no_lp
#7       0.32s best:911   next:[393,910]  no_lp (fixed_bools=0/141)
#8       0.37s best:901   next:[393,900]  no_lp (fixed_bools=0/146)
#Bound   0.40s best:901   next:[397,900]  objective_lb_search_no_lp
#9       0.41s best:896   next:[397,895]  quick_restart_no_lp (fixed_bools=0/145)
#10      0.42s best:895   next:[397,894]  quick_restart_no_lp (fixed_bools=0/150)
#11      0.42s best:894   next:[397,893]  violation_ls(batch:3 #solutions_imported:3 #lin_moves:9'538 #lin_evals:41'810 #gen_moves:1'565 #gen_evals:198 #comp_moves:115 #backtracks:725 #weight_updates:485)
#12      0.42s best:893   next:[397,892]  violation_ls(batch:4 #solutions_imported:4 #lin_moves:9'538 #lin_evals:41'824 #gen_moves:1'572 #gen_evals:200 #comp_moves:116 #backtracks:728 #weight_updates:485)
#13      0.43s best:892   next:[397,891]  violation_ls(batch:6 #solutions_imported:6 #lin_moves:10'094 #lin_evals:39'272 #gen_moves:1'606 #gen_evals:188 #comp_moves:70 #backtracks:768 #weight_updates:672)
#14      0.43s best:891   next:[397,890]  violation_ls(batch:5 #solutions_imported:5 #lin_moves:9'538 #lin_evals:41'845 #gen_moves:1'583 #gen_evals:202 #comp_moves:119 #backtracks:732 #weight_updates:485)
#15      0.44s best:890   next:[397,889]  violation_ls(batch:6 #solutions_imported:6 #lin_moves:9'538 #lin_evals:42'369 #gen_moves:1'805 #gen_evals:230 #comp_moves:135 #backtracks:835 #weight_updates:490)
#16      0.45s best:889   next:[397,888]  violation_ls(batch:7 #solutions_imported:7 #lin_moves:9'538 #lin_evals:42'408 #gen_moves:1'824 #gen_evals:232 #comp_moves:136 #backtracks:844 #weight_updates:490)
#17      0.45s best:888   next:[397,887]  violation_ls(batch:3 #solutions_imported:3 #lin_moves:248 #lin_evals:19'428 #gen_moves:7'919 #gen_evals:1'077 #comp_moves:256 #backtracks:3'825 #weight_updates:295)
#18      0.45s best:887   next:[397,886]  violation_ls(batch:4 #solutions_imported:4 #lin_moves:248 #lin_evals:19'432 #gen_moves:7'920 #gen_evals:1'077 #comp_moves:257 #backtracks:3'825 #weight_updates:295)
#19      0.45s best:861   next:[397,860]  rins_pump_lns (d=0.50 s=160 t=0.10 p=0.00 stall=0 h=auto_l0)
#20      0.46s best:860   next:[397,859]  violation_ls(batch:6 #solutions_imported:6 #lin_moves:14'785 #lin_evals:63'569 #gen_moves:446 #gen_evals:108 #comp_moves:28 #backtracks:209 #weight_updates:5'572)
#21      0.46s best:859   next:[397,858]  violation_ls(batch:7 #solutions_imported:7 #lin_moves:14'805 #lin_evals:63'661 #gen_moves:446 #gen_evals:108 #comp_moves:28 #backtracks:209 #weight_updates:5'582)
#22      0.47s best:858   next:[397,857]  violation_ls(batch:8 #solutions_imported:8 #lin_moves:10'094 #lin_evals:44'414 #gen_moves:3'688 #gen_evals:423 #comp_moves:236 #backtracks:1'726 #weight_updates:720)
#23      0.47s best:857   next:[397,856]  violation_ls(batch:9 #solutions_imported:9 #lin_moves:10'112 #lin_evals:44'507 #gen_moves:3'688 #gen_evals:423 #comp_moves:236 #backtracks:1'726 #weight_updates:731)
#24      0.47s best:856   next:[397,855]  violation_ls(batch:10 #solutions_imported:10 #lin_moves:10'349 #lin_evals:45'351 #gen_moves:3'688 #gen_evals:423 #comp_moves:236 #backtracks:1'726 #weight_updates:813)
#25      0.50s best:765   next:[397,764]  no_lp (fixed_bools=0/173)
#26      0.53s best:759   next:[397,758]  no_lp (fixed_bools=1/180)
#27      0.56s best:754   next:[397,753]  quick_restart_no_lp (fixed_bools=0/183)
#Bound   0.59s best:754   next:[417,753]  objective_lb_search_no_lp
#28      0.60s best:749   next:[417,748]  quick_restart_no_lp (fixed_bools=0/184)
#29      0.61s best:744   next:[417,743]  quick_restart_no_lp (fixed_bools=0/196)
#30      0.64s best:743   next:[417,742]  violation_ls(batch:8 #solutions_imported:8 #lin_moves:248 #lin_evals:44'651 #gen_moves:19'233 #gen_evals:2'457 #comp_moves:765 #backtracks:9'225 #weight_updates:440)
#31      0.65s best:739   next:[417,738]  no_lp (fixed_bools=1/199)
#Bound   0.73s best:739   next:[418,738]  objective_lb_search_no_lp
#32      0.73s best:734   next:[418,733]  quick_restart_no_lp (fixed_bools=0/223)
#33      0.74s best:732   next:[418,731]  violation_ls(batch:12 #solutions_imported:12 #lin_moves:19'863 #lin_evals:80'415 #gen_moves:3'689 #gen_evals:423 #comp_moves:237 #backtracks:1'726 #weight_updates:1'299)
#34      0.74s best:730   next:[418,729]  violation_ls(batch:13 #solutions_imported:13 #lin_moves:19'864 #lin_evals:80'423 #gen_moves:3'689 #gen_evals:423 #comp_moves:237 #backtracks:1'726 #weight_updates:1'299)
#35      0.75s best:729   next:[418,728]  violation_ls(batch:10 #solutions_imported:10 #lin_moves:9'799 #lin_evals:82'840 #gen_moves:19'233 #gen_evals:2'457 #comp_moves:765 #backtracks:9'225 #weight_updates:890)
#36      0.75s best:728   next:[418,727]  violation_ls(batch:11 #solutions_imported:11 #lin_moves:9'813 #lin_evals:82'923 #gen_moves:19'233 #gen_evals:2'457 #comp_moves:765 #backtracks:9'225 #weight_updates:903)
#37      0.75s best:727   next:[418,726]  violation_ls(batch:12 #solutions_imported:12 #lin_moves:9'814 #lin_evals:82'931 #gen_moves:19'233 #gen_evals:2'457 #comp_moves:765 #backtracks:9'225 #weight_updates:903)
#38      0.75s best:726   next:[418,725]  violation_ls(batch:13 #solutions_imported:13 #lin_moves:9'822 #lin_evals:82'973 #gen_moves:19'233 #gen_evals:2'457 #comp_moves:765 #backtracks:9'225 #weight_updates:910)
#39      0.75s best:725   next:[418,724]  violation_ls(batch:14 #solutions_imported:14 #lin_moves:19'878 #lin_evals:80'506 #gen_moves:3'689 #gen_evals:423 #comp_moves:237 #backtracks:1'726 #weight_updates:1'311)
#40      0.75s best:724   next:[418,723]  violation_ls(batch:14 #solutions_imported:14 #lin_moves:9'822 #lin_evals:82'985 #gen_moves:19'240 #gen_evals:2'457 #comp_moves:766 #backtracks:9'228 #weight_updates:910)
#41      0.76s best:723   next:[418,722]  violation_ls(batch:15 #solutions_imported:15 #lin_moves:19'878 #lin_evals:80'534 #gen_moves:3'701 #gen_evals:423 #comp_moves:239 #backtracks:1'731 #weight_updates:1'311)
#42      0.76s best:722   next:[418,721]  violation_ls(batch:15 #solutions_imported:15 #lin_moves:9'849 #lin_evals:83'110 #gen_moves:19'240 #gen_evals:2'457 #comp_moves:766 #backtracks:9'228 #weight_updates:924)
#43      0.76s best:721   next:[418,720]  violation_ls(batch:16 #solutions_imported:16 #lin_moves:9'865 #lin_evals:83'196 #gen_moves:19'240 #gen_evals:2'457 #comp_moves:766 #backtracks:9'228 #weight_updates:939)
#44      0.77s best:720   next:[418,719]  violation_ls(batch:17 #solutions_imported:17 #lin_moves:19'886 #lin_evals:80'622 #gen_moves:3'722 #gen_evals:423 #comp_moves:242 #backtracks:1'740 #weight_updates:1'318)
#45      0.77s best:719   next:[418,718]  violation_ls(batch:17 #solutions_imported:17 #lin_moves:9'865 #lin_evals:83'208 #gen_moves:19'248 #gen_evals:2'459 #comp_moves:774 #backtracks:9'228 #weight_updates:939)
#46      0.80s best:718   next:[418,717]  violation_ls(batch:18 #solutions_imported:18 #lin_moves:19'894 #lin_evals:80'665 #gen_moves:3'722 #gen_evals:423 #comp_moves:242 #backtracks:1'740 #weight_updates:1'325)
#47      0.80s best:717   next:[418,716]  violation_ls(batch:18 #solutions_imported:18 #lin_moves:9'865 #lin_evals:83'292 #gen_moves:19'284 #gen_evals:2'461 #comp_moves:778 #backtracks:9'244 #weight_updates:939)
#48      0.82s best:716   next:[418,715]  violation_ls(batch:11 #solutions_imported:11 #lin_moves:14'805 #lin_evals:108'162 #gen_moves:19'391 #gen_evals:2'009 #comp_moves:615 #backtracks:9'384 #weight_updates:5'802)
#49      0.82s best:715   next:[418,714]  violation_ls(batch:12 #solutions_imported:12 #lin_moves:14'851 #lin_evals:108'404 #gen_moves:19'391 #gen_evals:2'009 #comp_moves:615 #backtracks:9'384 #weight_updates:5'839)
#50      0.83s best:714   next:[418,713]  violation_ls(batch:13 #solutions_imported:13 #lin_moves:14'851 #lin_evals:108'410 #gen_moves:19'394 #gen_evals:2'009 #comp_moves:618 #backtracks:9'384 #weight_updates:5'839)
#Bound   0.96s best:714   next:[426,713]  objective_lb_search_no_lp
#Bound   0.99s best:714   next:[430,713]  objective_lb_search_no_lp
#Bound   1.04s best:714   next:[433,713]  objective_lb_search_no_lp
#Bound   1.08s best:714   next:[435,713]  objective_lb_search_no_lp
#Bound   1.13s best:714   next:[450,713]  objective_lb_search_no_lp
#Bound   1.17s best:714   next:[452,713]  objective_lb_search_no_lp
#Bound   1.24s best:714   next:[456,713]  objective_lb_search_no_lp
#Bound   1.27s best:714   next:[458,713]  objective_lb_search_no_lp
#Bound   1.39s best:714   next:[459,713]  objective_lb_search_no_lp
#Bound   1.46s best:714   next:[461,713]  objective_lb_search_no_lp
#Bound   1.93s best:714   next:[463,713]  objective_lb_search
#Bound   1.98s best:714   next:[465,713]  objective_lb_search_no_lp
#Bound   2.21s best:714   next:[486,713]  objective_lb_search_no_lp
#Bound   2.74s best:714   next:[488,713]  objective_lb_search_no_lp [skipped_logs=1]
#Bound   3.45s best:714   next:[495,713]  objective_lb_search_no_lp [skipped_logs=0]
#Bound   5.02s best:714   next:[507,713]  objective_lb_search_no_lp [skipped_logs=5]
#Bound   5.91s best:714   next:[514,713]  objective_lb_search_no_lp [skipped_logs=4]
#Bound   6.36s best:714   next:[521,713]  objective_lb_search_no_lp [skipped_logs=0]
#Bound   7.80s best:714   next:[525,713]  objective_lb_search_no_lp [skipped_logs=3]
#Bound   8.28s best:714   next:[527,713]  objective_lb_search_no_lp [skipped_logs=0]
#Bound   9.62s best:714   next:[528,713]  objective_shaving_search_no_lp (vars=231 csts=1835) [skipped_logs=0]
#Bound  10.81s best:714   next:[538,713]  objective_lb_search_no_lp [skipped_logs=5]
#Bound  11.90s best:714   next:[542,713]  objective_lb_search_no_lp [skipped_logs=1]
#Bound  12.86s best:714   next:[561,713]  objective_lb_search_no_lp [skipped_logs=4]
#Bound  13.66s best:714   next:[576,713]  objective_lb_search_no_lp [skipped_logs=2]
#Bound  14.78s best:714   next:[590,713]  objective_lb_search_no_lp [skipped_logs=4]
#Bound  15.79s best:714   next:[594,713]  objective_lb_search_no_lp [skipped_logs=2]
#Bound  16.96s best:714   next:[600,713]  objective_lb_search_no_lp [skipped_logs=2]
#Model  18.07s var:214/216 constraints:1802/1874
#Model  18.10s var:212/216 constraints:1704/1874
#Bound  19.46s best:714   next:[602,713]  objective_lb_search_no_lp
#Bound  19.60s best:714   next:[608,713]  objective_lb_search_no_lp
#Model  19.92s var:210/216 constraints:1668/1874
#Bound  19.94s best:714   next:[615,713]  objective_lb_search_no_lp [skipped_logs=2]
#Model  20.17s var:209/216 constraints:1659/1874
#Model  20.21s var:208/216 constraints:1651/1874
#Model  20.35s var:207/216 constraints:1641/1874
#Model  20.58s var:206/216 constraints:1612/1874
#Model  20.61s var:204/216 constraints:1534/1874
#Model  20.68s var:201/216 constraints:1300/1874
#Model  20.68s var:199/216 constraints:1161/1874
#Model  20.69s var:198/216 constraints:1143/1874
#Done   20.71s no_lp
#Done   20.71s objective_lb_search_no_lp
#Model  20.71s var:192/216 constraints:944/1874
#Done   20.71s core
#Done   20.71s probing_max_lp
#Model  20.71s var:183/216 constraints:750/1874
#Bound  20.67s best:714   next:[684,713]  objective_lb_search_no_lp [skipped_logs=7]

Task timing                                  n [     min,      max]      avg      dev     time         n [     min,      max]      avg      dev    dtime
                             'core':         1 [  20.46s,   20.46s]   20.46s   0.00ns   20.46s         1 [  11.34s,   11.34s]   11.34s   0.00ns   11.34s
                       'default_lp':         1 [  20.46s,   20.46s]   20.46s   0.00ns   20.46s         1 [   2.14s,    2.14s]    2.14s   0.00ns    2.14s
                 'feasibility_pump':        99 [ 12.18ms, 359.71ms] 157.83ms  54.44ms   15.62s        98 [  2.29ms,  26.31ms]  14.50ms   1.72ms    1.42s
                  'fj_long_default':         1 [ 49.02ms,  49.02ms]  49.02ms   0.00ns  49.02ms         1 [ 15.73ms,  15.73ms]  15.73ms   0.00ns  15.73ms
                  'fj_long_default':         1 [ 50.65ms,  50.65ms]  50.65ms   0.00ns  50.65ms         1 [ 15.09ms,  15.09ms]  15.09ms   0.00ns  15.09ms
              'fj_long_lin_default':         1 [115.97ms, 115.97ms] 115.97ms   0.00ns 115.97ms         1 [ 68.61ms,  68.61ms]  68.61ms   0.00ns  68.61ms
              'fj_long_lin_perturb':         1 [ 97.75ms,  97.75ms]  97.75ms   0.00ns  97.75ms         1 [ 47.36ms,  47.36ms]  47.36ms   0.00ns  47.36ms
               'fj_long_lin_random':         1 [ 72.09ms,  72.09ms]  72.09ms   0.00ns  72.09ms         1 [ 28.36ms,  28.36ms]  28.36ms   0.00ns  28.36ms
                  'fj_long_perturb':         1 [110.57ms, 110.57ms] 110.57ms   0.00ns 110.57ms         1 [ 64.65ms,  64.65ms]  64.65ms   0.00ns  64.65ms
                   'fj_long_random':         1 [ 45.14ms,  45.14ms]  45.14ms   0.00ns  45.14ms         1 [ 12.93ms,  12.93ms]  12.93ms   0.00ns  12.93ms
                 'fj_short_default':         1 [ 99.47ms,  99.47ms]  99.47ms   0.00ns  99.47ms         1 [ 47.00ms,  47.00ms]  47.00ms   0.00ns  47.00ms
                 'fj_short_default':         1 [106.24ms, 106.24ms] 106.24ms   0.00ns 106.24ms         1 [ 66.43ms,  66.43ms]  66.43ms   0.00ns  66.43ms
             'fj_short_lin_default':         1 [107.15ms, 107.15ms] 107.15ms   0.00ns 107.15ms         1 [ 69.31ms,  69.31ms]  69.31ms   0.00ns  69.31ms
             'fj_short_lin_default':         1 [111.30ms, 111.30ms] 111.30ms   0.00ns 111.30ms         1 [ 67.91ms,  67.91ms]  67.91ms   0.00ns  67.91ms
             'fj_short_lin_perturb':         1 [ 52.51ms,  52.51ms]  52.51ms   0.00ns  52.51ms         1 [ 17.19ms,  17.19ms]  17.19ms   0.00ns  17.19ms
              'fj_short_lin_random':         1 [112.69ms, 112.69ms] 112.69ms   0.00ns 112.69ms         1 [ 66.48ms,  66.48ms]  66.48ms   0.00ns  66.48ms
                 'fj_short_perturb':         1 [ 54.16ms,  54.16ms]  54.16ms   0.00ns  54.16ms         1 [ 17.35ms,  17.35ms]  17.35ms   0.00ns  17.35ms
                  'fj_short_random':         1 [112.67ms, 112.67ms] 112.67ms   0.00ns 112.67ms         1 [ 66.21ms,  66.21ms]  66.21ms   0.00ns  66.21ms
                        'fs_random':         1 [ 28.66ms,  28.66ms]  28.66ms   0.00ns  28.66ms         1 [ 20.00ns,  20.00ns]  20.00ns   0.00ns  20.00ns
                        'fs_random':         1 [ 30.43ms,  30.43ms]  30.43ms   0.00ns  30.43ms         1 [  2.67us,   2.67us]   2.67us   0.00ns   2.67us
                        'fs_random':         1 [ 31.09ms,  31.09ms]  31.09ms   0.00ns  31.09ms         1 [  2.67us,   2.67us]   2.67us   0.00ns   2.67us
                        'fs_random':         1 [ 33.69ms,  33.69ms]  33.69ms   0.00ns  33.69ms         1 [ 20.00ns,  20.00ns]  20.00ns   0.00ns  20.00ns
                  'fs_random_no_lp':         1 [ 28.22ms,  28.22ms]  28.22ms   0.00ns  28.22ms         1 [ 86.09us,  86.09us]  86.09us   0.00ns  86.09us
                  'fs_random_no_lp':         1 [ 29.02ms,  29.02ms]  29.02ms   0.00ns  29.02ms         1 [106.04us, 106.04us] 106.04us   0.00ns 106.04us
                  'fs_random_no_lp':         1 [ 30.64ms,  30.64ms]  30.64ms   0.00ns  30.64ms         1 [231.32us, 231.32us] 231.32us   0.00ns 231.32us
                  'fs_random_no_lp':         1 [ 33.98ms,  33.98ms]  33.98ms   0.00ns  33.98ms         1 [262.49us, 262.49us] 262.49us   0.00ns 262.49us
          'fs_random_quick_restart':         1 [ 30.24ms,  30.24ms]  30.24ms   0.00ns  30.24ms         1 [ 20.00ns,  20.00ns]  20.00ns   0.00ns  20.00ns
          'fs_random_quick_restart':         1 [ 33.42ms,  33.42ms]  33.42ms   0.00ns  33.42ms         1 [ 20.00ns,  20.00ns]  20.00ns   0.00ns  20.00ns
          'fs_random_quick_restart':         1 [ 34.75ms,  34.75ms]  34.75ms   0.00ns  34.75ms         1 [ 20.00ns,  20.00ns]  20.00ns   0.00ns  20.00ns
          'fs_random_quick_restart':         1 [ 34.91ms,  34.91ms]  34.91ms   0.00ns  34.91ms         1 [ 20.00ns,  20.00ns]  20.00ns   0.00ns  20.00ns
    'fs_random_quick_restart_no_lp':         1 [ 28.71ms,  28.71ms]  28.71ms   0.00ns  28.71ms         1 [181.02us, 181.02us] 181.02us   0.00ns 181.02us
    'fs_random_quick_restart_no_lp':         1 [ 29.76ms,  29.76ms]  29.76ms   0.00ns  29.76ms         1 [235.88us, 235.88us] 235.88us   0.00ns 235.88us
    'fs_random_quick_restart_no_lp':         1 [ 30.32ms,  30.32ms]  30.32ms   0.00ns  30.32ms         1 [153.65us, 153.65us] 153.65us   0.00ns 153.65us
                    'graph_arc_lns':        98 [  5.33ms,    2.08s] 841.79ms 618.08ms    1.37m        95 [ 10.00ns, 102.19ms]  58.38ms  44.43ms    5.55s
                    'graph_cst_lns':        98 [  1.64ms,    2.16s] 741.01ms 656.14ms    1.21m        76 [ 10.00ns, 109.39ms]  58.29ms  42.86ms    4.43s
                    'graph_dec_lns':        98 [  5.48ms,    2.11s] 919.19ms 679.65ms    1.50m        92 [ 10.00ns, 172.05ms]  58.55ms  45.28ms    5.39s
                    'graph_var_lns':        98 [  9.70ms,    2.08s] 859.20ms 601.36ms    1.40m        95 [ 10.00ns, 139.97ms]  59.82ms  43.20ms    5.68s
                   'lb_tree_search':         1 [  20.46s,   20.46s]   20.46s   0.00ns   20.46s         1 [   4.41s,    4.41s]    4.41s   0.00ns    4.41s
                           'max_lp':         1 [  20.46s,   20.46s]   20.46s   0.00ns   20.46s         1 [   3.41s,    3.41s]    3.41s   0.00ns    3.41s
                            'no_lp':         1 [  20.46s,   20.46s]   20.46s   0.00ns   20.46s         1 [   1.97s,    1.97s]    1.97s   0.00ns    1.97s
              'objective_lb_search':         1 [  20.46s,   20.46s]   20.46s   0.00ns   20.46s         1 [   2.93s,    2.93s]    2.93s   0.00ns    2.93s
       'objective_lb_search_max_lp':         1 [  20.46s,   20.46s]   20.46s   0.00ns   20.46s         1 [   4.59s,    4.59s]    4.59s   0.00ns    4.59s
        'objective_lb_search_no_lp':         1 [  20.46s,   20.46s]   20.46s   0.00ns   20.46s         1 [   2.00s,    2.00s]    2.00s   0.00ns    2.00s
  'objective_shaving_search_max_lp':        71 [  6.15ms,    2.50s] 284.76ms 366.48ms   20.22s        53 [ 23.68us, 324.98ms]  23.10ms  56.72ms    1.22s
   'objective_shaving_search_no_lp':        74 [  6.95ms,    2.50s] 273.31ms 362.30ms   20.23s        53 [727.50us, 182.74ms]  17.18ms  31.08ms 910.80ms
                          'probing':         1 [  20.46s,   20.46s]   20.46s   0.00ns   20.46s         1 [734.29ms, 734.29ms] 734.29ms   0.00ns 734.29ms
                   'probing_max_lp':         1 [  20.46s,   20.46s]   20.46s   0.00ns   20.46s         1 [995.73ms, 995.73ms] 995.73ms   0.00ns 995.73ms
                     'pseudo_costs':         1 [  20.46s,   20.46s]   20.46s   0.00ns   20.46s         1 [   2.55s,    2.55s]    2.55s   0.00ns    2.55s
                    'quick_restart':         1 [  20.46s,   20.46s]   20.46s   0.00ns   20.46s         1 [   3.13s,    3.13s]    3.13s   0.00ns    3.13s
              'quick_restart_no_lp':         1 [  20.46s,   20.46s]   20.46s   0.00ns   20.46s         1 [   1.76s,    1.76s]    1.76s   0.00ns    1.76s
                    'reduced_costs':         1 [  20.46s,   20.46s]   20.46s   0.00ns   20.46s         1 [   2.25s,    2.25s]    2.25s   0.00ns    2.25s
                        'rins/rens':        99 [145.52us,    2.18s] 780.01ms 621.38ms    1.29m        83 [ 10.00ns, 103.32ms]  69.35ms  37.07ms    5.76s
                      'rnd_cst_lns':        98 [  1.84ms,    2.23s] 837.12ms 674.82ms    1.37m        92 [ 10.00ns, 107.91ms]  57.09ms  44.21ms    5.25s
                      'rnd_var_lns':        98 [  5.86ms,    2.24s] 810.94ms 572.48ms    1.32m        93 [ 10.00ns, 201.56ms]  59.48ms  46.04ms    5.53s
                     'violation_ls':        97 [242.04us, 308.48ms] 117.18ms  70.04ms   11.37s        97 [780.00ns, 119.65ms]  58.54ms  30.15ms    5.68s
                     'violation_ls':        98 [  2.11ms, 329.02ms] 135.63ms  59.94ms   13.29s        98 [ 39.46us,  71.53ms]  54.44ms  15.75ms    5.33s
                     'violation_ls':        98 [360.87us, 289.39ms] 122.53ms  65.67ms   12.01s        98 [750.00ns,  64.01ms]  47.57ms  20.78ms    4.66s
                     'violation_ls':        98 [557.21us, 313.44ms] 142.51ms  69.45ms   13.97s        98 [  1.29us,  72.09ms]  54.03ms  18.51ms    5.29s
                     'violation_ls':        99 [  3.36ms, 231.88ms] 138.83ms  50.16ms   13.74s        99 [269.43us,  63.27ms]  42.13ms   9.26ms    4.17s

Search stats                        Bools  Conflicts  Branches  Restarts  BoolPropag  IntegerPropag
                           'core':  3'273      8'364    28'999     7'510  11'672'515      5'662'428
                     'default_lp':    131      5'542    22'437     3'788     179'711      3'723'903
                      'fs_random':     68          0       136       136          30          2'339
                      'fs_random':     68          0       136       136          30          2'339
                      'fs_random':     68          0       136       136          30          2'339
                      'fs_random':     68          0       136       136          30          2'339
                'fs_random_no_lp':     68          0       165       136          45          3'318
                'fs_random_no_lp':     68          2       158       136          39          2'648
                'fs_random_no_lp':     68          2       163       136          38          2'751
                'fs_random_no_lp':     68          4       158       136          52          3'460
        'fs_random_quick_restart':     68          0       136       136          30          2'339
        'fs_random_quick_restart':     68          0       136       136          30          2'339
        'fs_random_quick_restart':     68          0       136       136          30          2'339
        'fs_random_quick_restart':     68          0       136       136          30          2'339
  'fs_random_quick_restart_no_lp':     68          0       173       136          34          3'292
  'fs_random_quick_restart_no_lp':     68          0       174       136          33          3'083
  'fs_random_quick_restart_no_lp':     68          0       174       136          35          2'956
                 'lb_tree_search':     68         76    14'430     2'655      16'229        660'891
                         'max_lp':     68      2'474    26'242     4'634      89'628      2'945'585
                          'no_lp':    529     13'499    36'411     4'594   1'521'676      7'757'719
            'objective_lb_search':    123      5'362    34'251     8'668     149'415      4'272'336
     'objective_lb_search_max_lp':     93      2'900    13'755     3'962      66'362      1'740'260
      'objective_lb_search_no_lp':    220     15'777    38'542     4'608     388'805      8'195'751
                        'probing':    230         73       387       387       1'976         17'805
                 'probing_max_lp':    170         43       297       297         609          8'119
                   'pseudo_costs':     68      2'528    18'334     3'960      71'203      2'256'808
                  'quick_restart':     68      2'312    41'182    11'354     107'443      3'440'626
            'quick_restart_no_lp':    454      9'581    49'508     5'476   1'089'684      5'992'676
                  'reduced_costs':    552      2'613    33'275     5'317     958'652      2'464'566

SAT stats                           ClassicMinim  LitRemoved  LitLearned  LitForgotten  Subsumed  MClauses  MDecisions  MLitTrue  MSubsumed  MLitRemoved  MReused
                           'core':         7'381      36'643      42'626             0        73     3'435      16'981         0        113          352       73
                     'default_lp':         4'099       9'417      51'165             0       269     1'591      13'428         0        511        3'287      292
                      'fs_random':             0           0           0             0         0         0           0         0          0            0        0
                      'fs_random':             0           0           0             0         0         0           0         0          0            0        0
                      'fs_random':             0           0           0             0         0         0           0         0          0            0        0
                      'fs_random':             0           0           0             0         0         0           0         0          0            0        0
                'fs_random_no_lp':             0           0           0             0         0         0           0         0          0            0        0
                'fs_random_no_lp':             0           0          24             0         0         0           0         0          0            0        0
                'fs_random_no_lp':             0           0           4             0         0         0           0         0          0            0        0
                'fs_random_no_lp':             0           0           6             0         0         0           0         0          0            0        0
        'fs_random_quick_restart':             0           0           0             0         0         0           0         0          0            0        0
        'fs_random_quick_restart':             0           0           0             0         0         0           0         0          0            0        0
        'fs_random_quick_restart':             0           0           0             0         0         0           0         0          0            0        0
        'fs_random_quick_restart':             0           0           0             0         0         0           0         0          0            0        0
  'fs_random_quick_restart_no_lp':             0           0           0             0         0         0           0         0          0            0        0
  'fs_random_quick_restart_no_lp':             0           0           0             0         0         0           0         0          0            0        0
  'fs_random_quick_restart_no_lp':             0           0           0             0         0         0           0         0          0            0        0
                 'lb_tree_search':             6           8         315             0        11       725       3'633         0         12           51        8
                         'max_lp':         1'464       3'145      22'208             0       183     1'904      20'741         0        260        1'679      743
                          'no_lp':        10'981      37'695     134'515        10'079       309     1'768      13'817        18        584        3'776      210
            'objective_lb_search':         4'066       8'867      40'656             0       301     2'671      20'471         0        289        1'701      837
     'objective_lb_search_max_lp':         2'137       4'693      21'664             0       214       870       6'036         0        152          943      188
      'objective_lb_search_no_lp':        13'208      39'217     107'802             0       559     2'325      18'168         0      1'107        6'769      448
                        'probing':             0           0          73             0         0         0           0         0          0            0        0
                 'probing_max_lp':             0           0          43             0         0         0           0         0          0            0        0
                   'pseudo_costs':         1'237       2'529      24'611             0       234     1'329      12'689         0        121          764      300
                  'quick_restart':         1'213       2'583      26'493             0       159     3'954      28'682         0        196        1'016      692
            'quick_restart_no_lp':         6'692      20'914     105'952             0       311     2'393      21'704        16        818        5'402      317
                  'reduced_costs':         1'538       3'979      28'085             0        79     1'780      13'860         0        365        2'374      256

Lp stats                         Component  Iterations  AddedCuts  OPTIMAL  DUAL_F.  DUAL_U.
                  'default_lp':          1      43'776      4'015    7'128        0        0
                   'fs_random':          1          39          0        1        1        0
                   'fs_random':          1          75          0        2        0        0
                   'fs_random':          1          75         58        3        0        0
                   'fs_random':          1          75         58        3        0        0
     'fs_random_quick_restart':          1           0          0        0        0        0
     'fs_random_quick_restart':          1           0          0        1        1        0
     'fs_random_quick_restart':          1          65          0        1        1        0
     'fs_random_quick_restart':          1          75          0        2        0        0
              'lb_tree_search':          1     106'316      3'896    5'386    1'709        0
                      'max_lp':          1      70'510      3'934    3'505    1'126        2
         'objective_lb_search':          1      66'888      4'332    7'562        1        0
  'objective_lb_search_max_lp':          1     112'013      3'083    4'134    1'706        3
                     'probing':          1       5'311      4'314    1'126        0        0
              'probing_max_lp':          1       4'282      3'538      793       20        0
                'pseudo_costs':          1      63'716      4'069    3'695    1'074        2
               'quick_restart':          1      61'130      4'554    7'309        0        0
               'reduced_costs':          1      42'477      5'101    3'336      774        1

Lp dimension                                                                     Final dimension of first component
                  'default_lp':  435 rows, 211 columns, 2362 entries with magnitude in [5.058800e-04, 1.000000e+00]
                   'fs_random':    70 rows, 211 columns, 289 entries with magnitude in [2.024315e-02, 1.000000e+00]
                   'fs_random':    70 rows, 211 columns, 289 entries with magnitude in [2.024315e-02, 1.000000e+00]
                   'fs_random':    71 rows, 211 columns, 293 entries with magnitude in [2.024315e-02, 1.000000e+00]
                   'fs_random':    71 rows, 211 columns, 293 entries with magnitude in [2.024315e-02, 1.000000e+00]
     'fs_random_quick_restart':       0 rows, 211 columns, 0 entries with magnitude in [0.000000e+00, 0.000000e+00]
     'fs_random_quick_restart':    70 rows, 211 columns, 289 entries with magnitude in [2.024315e-02, 1.000000e+00]
     'fs_random_quick_restart':    70 rows, 211 columns, 289 entries with magnitude in [2.024315e-02, 1.000000e+00]
     'fs_random_quick_restart':    70 rows, 211 columns, 289 entries with magnitude in [2.024315e-02, 1.000000e+00]
              'lb_tree_search':  547 rows, 216 columns, 2063 entries with magnitude in [5.652798e-04, 1.000000e+00]
                      'max_lp':  633 rows, 216 columns, 2322 entries with magnitude in [2.621395e-03, 1.000000e+00]
         'objective_lb_search':  506 rows, 211 columns, 3029 entries with magnitude in [8.389392e-06, 1.000000e+00]
  'objective_lb_search_max_lp':  689 rows, 216 columns, 2702 entries with magnitude in [8.306083e-03, 1.000000e+00]
                     'probing':  320 rows, 211 columns, 1564 entries with magnitude in [7.089209e-03, 1.000000e+00]
              'probing_max_lp':   167 rows, 216 columns, 804 entries with magnitude in [1.441749e-02, 1.000000e+00]
                'pseudo_costs':  579 rows, 216 columns, 2168 entries with magnitude in [2.810740e-03, 1.000000e+00]
               'quick_restart':  708 rows, 211 columns, 3050 entries with magnitude in [1.589104e-04, 1.000000e+00]
               'reduced_costs':  554 rows, 216 columns, 2081 entries with magnitude in [1.791635e-03, 1.000000e+00]

Lp debug                         CutPropag  CutEqPropag  Adjust  Overflow      Bad  BadScaling
                  'default_lp':          2           12   4'277         0   50'607           0
                   'fs_random':          0            0       0         0        0           0
                   'fs_random':          0            0       0         0        0           0
                   'fs_random':          0            0       0         0       23           0
                   'fs_random':          0            0       0         0        7           0
     'fs_random_quick_restart':          0            0       0         0        0           0
     'fs_random_quick_restart':          0            0       0         0        0           0
     'fs_random_quick_restart':          0            0       0         0        0           0
     'fs_random_quick_restart':          0            0       0         0        0           0
              'lb_tree_search':          6            4   4'141         0   23'168           0
                      'max_lp':         32           23   2'141         0   34'713           0
         'objective_lb_search':         18           66   5'799         0   65'840           0
  'objective_lb_search_max_lp':         20           18   3'181         0   44'337           0
                     'probing':          2           11   1'097         0  617'032           0
              'probing_max_lp':         14            2     755         0  445'410           0
                'pseudo_costs':         21            3   2'213         0   41'579           0
               'quick_restart':         51           88   5'293         0  111'968           0
               'reduced_costs':         34            2   2'442         0   46'818           0

Lp pool                          Constraints  Updates  Simplif  Merged  Shortened  Split  Strenghtened     Cuts/Call
                  'default_lp':        4'272      626   11'466      15      2'396  2'668         3'592   4'015/9'288
                   'fs_random':          272        0        0       0          0      0            21           0/0
                   'fs_random':          272        0        0       0          0      0            21           0/0
                   'fs_random':          330        0        0       0          0      0            21         58/67
                   'fs_random':          330        0        0       0          0      0            21         58/70
     'fs_random_quick_restart':          272        0        0       0          0      0            21           0/0
     'fs_random_quick_restart':          272        0        0       0          0      0            21           0/0
     'fs_random_quick_restart':          272        0        0       0          0      0            21           0/0
     'fs_random_quick_restart':          272        0        0       0          0      0            21           0/0
              'lb_tree_search':        5'742      315   15'251      27      1'990    205        14'830   3'896/8'858
                      'max_lp':        5'778      455   24'943      29      4'056    481        19'659   3'934/8'266
         'objective_lb_search':        4'600      781   13'906       4      3'405  4'758         3'471  4'332/10'163
  'objective_lb_search_max_lp':        4'950      488   13'699       6      1'394    843        14'841   3'083/6'703
                     'probing':        4'566      526   11'831      20          0  3'752         2'930   4'314/7'492
              'probing_max_lp':        5'399      301    3'322      12          0  1'370         4'030   3'538/6'442
                'pseudo_costs':        5'925      396   14'547      17      2'055    814        15'412   4'069/8'548
               'quick_restart':        4'813    1'021   33'871      13      5'216  9'614         5'326  4'554/10'125
               'reduced_costs':        6'954      422   15'244      20      2'422    880        15'573  5'101/10'467

Lp Cut            fs_ran  fs_ran  defaul  max_lp  quick_  reduce  pseudo  lb_tre  probin  object  probin  object
          CG_FF:       -       -     238     173     212     316     223     197     240     277     171     135
           CG_K:       -       -     116      84     124     159      91      81     132     121      69      68
           CG_R:       -       -     146     149     155     184      90     136     120     167     134      80
          CG_RB:       -       -     934     798   1'320     807     834     771   1'748   1'488     597     447
         CG_RBP:       -       -     162      95     206     101      78     126     248     212     100      47
         Clique:       -       -       -      35       -      30      34      37       -       -       8      35
             IB:      50      50     511     322     580     435     428     316     322     513     163     406
       MIR_1_FF:       5       2     158     244     190     311     214     271     149     144     237     201
        MIR_1_K:       -       1      33      45      26      69      53      40      24      27      37      23
        MIR_1_R:       2       2      43      34      48      32      27      22      24      33      24      21
       MIR_1_RB:       1       -     256     365     242     487     344     378     219     192     371     269
      MIR_1_RBP:       -       -       4      47       9      50      47      49       8       6      46      45
      MIR_1_RLT:       -       -       -       6       -       4       4       5       -       -       4       9
       MIR_2_FF:       -       1     116     136     133     158     156     116      96      83     105     111
        MIR_2_K:       -       -      33      34      19      50      32      31      16      14      20      24
       MIR_2_KL:       -       -       -       -       -       -       -       2       -       -       -       -
        MIR_2_R:       -       -      32      36      46      65      60      47      32      30      63      51
       MIR_2_RB:       -       -     196     197     187     269     186     183     158     166     202     149
      MIR_2_RBP:       -       -      14      24      17      33      18      19      13      11      13      18
       MIR_3_FF:       -       1      83      86      87      97      84      77      44      75      54      54
        MIR_3_K:       -       -      26      33      12      34      30      24       9      22      18      16
       MIR_3_KL:       -       -       -       -       -       -       -       -       1       -       -       -
        MIR_3_R:       -       -      32      38      40      52      47      49      27      29      51      36
       MIR_3_RB:       -       -     121     108     157     148     133     113     114     128     109      95
      MIR_3_RBP:       -       1      10      15       9      21      18      12      10      11      13       5
       MIR_4_FF:       -       -      50      48      56      60      49      34      39      49      24      37
        MIR_4_K:       -       -      22      21      13      21      22      13      12       7      11      11
       MIR_4_KL:       -       -       -       -       -       -       -       -       -       1       -       -
        MIR_4_R:       -       -      20      21      24      31      27      27      18      17      14      18
       MIR_4_RB:       -       -      89      61     103      86      76      64      75      88      40      55
      MIR_4_RBP:       -       -       9      10       5       9       8       5      11       6       4      10
       MIR_5_FF:       -       -      34      27      35      37      29      33      28      26      17      20
        MIR_5_K:       -       -      13       6      11       9      10       8       7       9       4      10
        MIR_5_R:       -       -      19      12      24      12      19      20      13      17      12      13
       MIR_5_RB:       -       -      56      26      57      43      53      40      45      49      20      31
      MIR_5_RBP:       -       -      13       6       5       8       9       7       8       7       3       7
       MIR_6_FF:       -       -      16       8      18      18       7      10      10      16       6      13
        MIR_6_K:       -       -       6       -      14       5       3       7       2       5       1       4
        MIR_6_R:       -       -      13       2      13      16       4       6      11       8       3       8
       MIR_6_RB:       -       -      24      10      32      27      15      19      29      25      13      19
      MIR_6_RBP:       -       -       5       3       5       9       6       4       4       5       2       6
   ZERO_HALF_FF:       -       -      30      50      38      67      54      63      25      38      34      33
    ZERO_HALF_K:       -       -      10      17       3      20      13      15      12       4       7       7
    ZERO_HALF_R:       -       -     228     374     192     533     320     280     150     134     578     328
   ZERO_HALF_RB:       -       -      75     107      72     146      93     112      56      65     102      91
  ZERO_HALF_RBP:       -       -      19      21      15      32      21      27       5       7      34      17

LNS stats           Improv/Calls  Closed  Difficulty  TimeLimit
  'graph_arc_lns':         10/98     52%        0.97       0.10
  'graph_cst_lns':          2/79     56%        0.98       0.10
  'graph_dec_lns':          8/97     54%        0.99       0.10
  'graph_var_lns':          6/98     52%        0.98       0.10
      'rins/rens':         12/87     49%        0.86       0.10
    'rnd_cst_lns':          7/96     53%        0.98       0.10
    'rnd_var_lns':          8/97     52%        0.98       0.10

LS stats                   Batches  Restarts  LinMoves  GenMoves  CompoundMoves  WeightUpdates
       'fj_long_default':        1         1     3'004         0              0             84
       'fj_long_default':        1         1     3'085         0              0            101
   'fj_long_lin_default':        1         1         0     3'805            465              3
   'fj_long_lin_perturb':        1         1     8'181         0              0          1'819
    'fj_long_lin_random':        1         1     5'225         0              0          1'402
       'fj_long_perturb':        1         1         0     3'764            408              2
        'fj_long_random':        1         1     2'369         0              0             82
      'fj_short_default':        1         1         0     3'833            503              2
      'fj_short_default':        1         1     8'029         0              0          1'971
  'fj_short_lin_default':        1         1         0     3'598            461              3
  'fj_short_lin_default':        1         1         0     3'607            455              3
  'fj_short_lin_perturb':        1         1     3'556         0              0             83
   'fj_short_lin_random':        1         1         0     3'621            553              3
      'fj_short_perturb':        1         1     3'609         0              0            119
       'fj_short_random':        1         1         0     3'960            507              2
          'violation_ls':       97         0   586'129    19'284            778        212'959
          'violation_ls':       98         0    14'851   638'420         14'513          7'863
          'violation_ls':       98         0    19'080   606'773         18'440          2'455
          'violation_ls':       98         0    19'894   484'790         44'638          1'700
          'violation_ls':       99         0   883'311    35'842          1'907         29'001

Solutions (50)            Num     Rank
                'no_lp':   10   [1,31]
  'quick_restart_no_lp':    6   [9,32]
        'rins_pump_lns':    1  [19,19]
         'violation_ls':   33   [2,50]

Objective bounds                     Num
                  'initial_domain':    1
             'objective_lb_search':    2
       'objective_lb_search_no_lp':   78
  'objective_shaving_search_no_lp':    3

Solution repositories    Added  Queried  Ignored  Synchro
  'feasible solutions':    649    1'942       12      602
        'lp solutions':    134       46        0      124
                'pump':  2'038       53

Improving bounds shared          Num
                        'core':   21
                  'default_lp':   31
              'lb_tree_search':    8
                      'max_lp':   19
                       'no_lp':  366
         'objective_lb_search':   12
  'objective_lb_search_max_lp':   13
                     'probing':   50
              'probing_max_lp':    5
                'pseudo_costs':   67
               'quick_restart':  120
         'quick_restart_no_lp':  752
               'reduced_costs':   58

Clauses shared                   Num
                  'default_lp':   16
             'fs_random_no_lp':    1
              'lb_tree_search':    2
                      'max_lp':   10
                       'no_lp':   44
         'objective_lb_search':   33
  'objective_lb_search_max_lp':    1
   'objective_lb_search_no_lp':    1
                'pseudo_costs':    9
               'quick_restart':   20
         'quick_restart_no_lp':    9
               'reduced_costs':    1

CpSolverResponse summary:
status: OPTIMAL
objective: 714
best_bound: 714
integers: 212
booleans: 68
conflicts: 0
branches: 136
propagations: 30
integer_propagations: 2339
restarts: 136
lp_iterations: 75
walltime: 20.7694
usertime: 20.7694
deterministic_time: 111.168
gap_integral: 365.338
solution_fingerprint: 0xc0db4c0ca25d3f8a


--- Simulation Gantt  partir du modle mathmatique ---
{'big':0, 'due_date':151, 'pos_time':5, 'status':0, 'blocked':0, 'operations':["{'type':1, 'processing_time':19}", "{'type':0, 'processing_time':44}"]}
{'big':1, 'due_date':85, 'pos_time':5, 'status':0, 'blocked':0, 'operations':["{'type':0, 'processing_time':15}", "{'type':1, 'processing_time':35}"]}
{'big':0, 'due_date':104, 'pos_time':5, 'status':0, 'blocked':0, 'operations':["{'type':0, 'processing_time':58}"]}
{'big':0, 'due_date':120, 'pos_time':5, 'status':0, 'blocked':0, 'operations':["{'type':0, 'processing_time':56}", "{'type':1, 'processing_time':47}"]}
{'big':0, 'due_date':79, 'pos_time':5, 'status':0, 'blocked':0, 'operations':["{'type':1, 'processing_time':28}"]}
{'big':0, 'due_date':85, 'pos_time':5, 'status':0, 'blocked':0, 'operations':["{'type':0, 'processing_time':10}"]}
{'big':0, 'due_date':51, 'pos_time':5, 'status':0, 'blocked':0, 'operations':["{'type':0, 'processing_time':38}"]}
