created virtual environment CPython3.12.4.final.0-64 in 371ms
  creator CPython3Posix(dest=/localscratch/aneumann.46806173.0/env, clear=False, no_vcs_ignore=False, global=False)
  seeder FromAppData(download=False, pip=bundle, via=copy, app_data_dir=/home/aneumann/.local/share/virtualenv)
    added seed packages: pip==24.2+computecanada
  activators BashActivator,CShellActivator,FishActivator,NushellActivator,PowerShellActivator,PythonActivator
Looking in links: /cvmfs/soft.computecanada.ca/custom/python/wheelhouse/gentoo2023/x86-64-v3, /cvmfs/soft.computecanada.ca/custom/python/wheelhouse/gentoo2023/generic, /cvmfs/soft.computecanada.ca/custom/python/wheelhouse/generic
Requirement already satisfied: pip in /localscratch/aneumann.46806173.0/env/lib/python3.12/site-packages (24.2+computecanada)
Processing /cvmfs/soft.computecanada.ca/custom/python/wheelhouse/generic/pip-25.0+computecanada-py3-none-any.whl
Installing collected packages: pip
  Attempting uninstall: pip
    Found existing installation: pip 24.2+computecanada
    Uninstalling pip-24.2+computecanada:
      Successfully uninstalled pip-24.2+computecanada
Successfully installed pip-25.0+computecanada
Looking in links: /cvmfs/soft.computecanada.ca/custom/python/wheelhouse/gentoo2023/x86-64-v3, /cvmfs/soft.computecanada.ca/custom/python/wheelhouse/gentoo2023/generic, /cvmfs/soft.computecanada.ca/custom/python/wheelhouse/generic
ERROR: protobuf-5.28.3-cp38-abi3-manylinux2014_x86_64.whl is not a supported wheel on this platform.
Looking in links: /cvmfs/soft.computecanada.ca/custom/python/wheelhouse/gentoo2023/x86-64-v3, /cvmfs/soft.computecanada.ca/custom/python/wheelhouse/gentoo2023/generic, /cvmfs/soft.computecanada.ca/custom/python/wheelhouse/generic
Processing /home/aneumann/projects/def-adhaj/aneumann/GNRS/wheels/immutabledict-4.2.0-py3-none-any.whl
Installing collected packages: immutabledict
Successfully installed immutabledict-4.2.0
Looking in links: /cvmfs/soft.computecanada.ca/custom/python/wheelhouse/gentoo2023/x86-64-v3, /cvmfs/soft.computecanada.ca/custom/python/wheelhouse/gentoo2023/generic, /cvmfs/soft.computecanada.ca/custom/python/wheelhouse/generic
Processing /cvmfs/soft.computecanada.ca/custom/python/wheelhouse/generic/ortools-9.10.4067+computecanada-cp312-cp312-linux_x86_64.whl (from -r /home/aneumann/projects/def-adhaj/aneumann/GNRS/requirements/or.txt (line 1))
Processing /cvmfs/soft.computecanada.ca/custom/python/wheelhouse/gentoo2023/x86-64-v3/matplotlib-3.10.0+computecanada-cp312-cp312-linux_x86_64.whl (from -r /home/aneumann/projects/def-adhaj/aneumann/GNRS/requirements/or.txt (line 2))
Processing /cvmfs/soft.computecanada.ca/custom/python/wheelhouse/gentoo2023/x86-64-v3/pandas-2.2.3+computecanada-cp312-cp312-linux_x86_64.whl (from -r /home/aneumann/projects/def-adhaj/aneumann/GNRS/requirements/or.txt (line 3))
Processing /cvmfs/soft.computecanada.ca/custom/python/wheelhouse/generic/absl_py-2.3.0+computecanada-py3-none-any.whl (from ortools<9.11,>=9.10->-r /home/aneumann/projects/def-adhaj/aneumann/GNRS/requirements/or.txt (line 1))
Processing /cvmfs/soft.computecanada.ca/custom/python/wheelhouse/gentoo2023/generic/numpy-2.2.2+computecanada-cp312-cp312-linux_x86_64.whl (from ortools<9.11,>=9.10->-r /home/aneumann/projects/def-adhaj/aneumann/GNRS/requirements/or.txt (line 1))
Processing /cvmfs/soft.computecanada.ca/custom/python/wheelhouse/gentoo2023/x86-64-v3/protobuf-6.31.1+computecanada-cp312-cp312-linux_x86_64.whl (from ortools<9.11,>=9.10->-r /home/aneumann/projects/def-adhaj/aneumann/GNRS/requirements/or.txt (line 1))
Requirement already satisfied: immutabledict>=3.0.0 in /localscratch/aneumann.46806173.0/env/lib/python3.12/site-packages (from ortools<9.11,>=9.10->-r /home/aneumann/projects/def-adhaj/aneumann/GNRS/requirements/or.txt (line 1)) (4.2.0)
Processing /cvmfs/soft.computecanada.ca/custom/python/wheelhouse/gentoo2023/generic/contourpy-1.3.1+computecanada-cp312-cp312-linux_x86_64.whl (from matplotlib->-r /home/aneumann/projects/def-adhaj/aneumann/GNRS/requirements/or.txt (line 2))
Processing /cvmfs/soft.computecanada.ca/custom/python/wheelhouse/generic/cycler-0.12.1+computecanada-py3-none-any.whl (from matplotlib->-r /home/aneumann/projects/def-adhaj/aneumann/GNRS/requirements/or.txt (line 2))
Processing /cvmfs/soft.computecanada.ca/custom/python/wheelhouse/generic/fonttools-4.59.0+computecanada-cp312-cp312-linux_x86_64.whl (from matplotlib->-r /home/aneumann/projects/def-adhaj/aneumann/GNRS/requirements/or.txt (line 2))
Processing /cvmfs/soft.computecanada.ca/custom/python/wheelhouse/gentoo2023/x86-64-v3/kiwisolver-1.4.8+computecanada-cp312-cp312-linux_x86_64.whl (from matplotlib->-r /home/aneumann/projects/def-adhaj/aneumann/GNRS/requirements/or.txt (line 2))
Processing /cvmfs/soft.computecanada.ca/custom/python/wheelhouse/generic/packaging-25.0+computecanada-py3-none-any.whl (from matplotlib->-r /home/aneumann/projects/def-adhaj/aneumann/GNRS/requirements/or.txt (line 2))
Processing /cvmfs/soft.computecanada.ca/custom/python/wheelhouse/gentoo2023/x86-64-v3/pillow-11.1.0+computecanada-cp312-cp312-linux_x86_64.whl (from matplotlib->-r /home/aneumann/projects/def-adhaj/aneumann/GNRS/requirements/or.txt (line 2))
Processing /cvmfs/soft.computecanada.ca/custom/python/wheelhouse/generic/pyparsing-3.2.3+computecanada-py3-none-any.whl (from matplotlib->-r /home/aneumann/projects/def-adhaj/aneumann/GNRS/requirements/or.txt (line 2))
Processing /cvmfs/soft.computecanada.ca/custom/python/wheelhouse/generic/python_dateutil-2.9.0.post0+computecanada-py2.py3-none-any.whl (from matplotlib->-r /home/aneumann/projects/def-adhaj/aneumann/GNRS/requirements/or.txt (line 2))
Processing /cvmfs/soft.computecanada.ca/custom/python/wheelhouse/generic/pytz-2025.2+computecanada-py2.py3-none-any.whl (from pandas->-r /home/aneumann/projects/def-adhaj/aneumann/GNRS/requirements/or.txt (line 3))
Processing /cvmfs/soft.computecanada.ca/custom/python/wheelhouse/generic/tzdata-2025.2+computecanada-py2.py3-none-any.whl (from pandas->-r /home/aneumann/projects/def-adhaj/aneumann/GNRS/requirements/or.txt (line 3))
Processing /cvmfs/soft.computecanada.ca/custom/python/wheelhouse/generic/six-1.17.0+computecanada-py2.py3-none-any.whl (from python-dateutil>=2.7->matplotlib->-r /home/aneumann/projects/def-adhaj/aneumann/GNRS/requirements/or.txt (line 2))
Installing collected packages: pytz, tzdata, six, pyparsing, protobuf, pillow, packaging, numpy, kiwisolver, fonttools, cycler, absl-py, python-dateutil, contourpy, pandas, matplotlib, ortools
Successfully installed absl-py-2.3.0+computecanada contourpy-1.3.1+computecanada cycler-0.12.1+computecanada fonttools-4.59.0+computecanada kiwisolver-1.4.8+computecanada matplotlib-3.10.0+computecanada numpy-2.2.2+computecanada ortools-9.10.4067+computecanada packaging-25.0+computecanada pandas-2.2.3+computecanada pillow-11.1.0+computecanada protobuf-6.31.1+computecanada pyparsing-3.2.3+computecanada python-dateutil-2.9.0.post0+computecanada pytz-2025.2+computecanada six-1.17.0+computecanada tzdata-2025.2+computecanada

Starting CP-SAT solver v9.10.4067
Parameters: max_time_in_seconds: 86400 max_memory_in_mb: 185000 log_search_progress: true enumerate_all_solutions: false num_search_workers: 32 absolute_gap_limit: 0 relative_gap_limit: 0

Initial optimization model '': (model_fingerprint: 0xedae8eb6b1653e0)
#Variables: 386 (#ints: 8 in objective)
  - 294 Booleans in [0,1]
  - 92 in [0,789]
#kLinear1: 49
#kLinear2: 532
#kLinear3: 161
#kLinearN: 5'439 (#terms: 91'639)

Starting presolve at 0.00s
  3.89e-03s  0.00e+00d  [DetectDominanceRelations] 
  7.83e-02s  0.00e+00d  [PresolveToFixPoint] #num_loops=8 #num_dual_strengthening=3 
  3.67e-05s  0.00e+00d  [ExtractEncodingFromLinear] #potential_supersets=3 
[Symmetry] Graph for symmetry has 6'317 nodes and 74'707 arcs.
[Symmetry] Symmetry computation done. time: 0.00318281 dtime: 0.00530194
[Symmetry] #generators: 1, average support size: 20
[Symmetry] The model contains 308 duplicate constraints !
[Symmetry] 10 orbits with sizes: 2,2,2,2,2,2,2,2,2,2
[Symmetry] Num fixable by intersecting at_most_one with orbits: 1 largest_orbit: 2
  2.24e-02s  4.61e-03d  [Probe] #probed=450 #new_bounds=9 #equiv=1 
  6.04e-05s  0.00e+00d  [MaxClique] Merged 4(8 literals) into 2(4 literals) at_most_ones. 
  3.83e-03s  0.00e+00d  [DetectDominanceRelations] 
  3.44e-02s  0.00e+00d  [PresolveToFixPoint] #num_loops=5 #num_dual_strengthening=3 
  1.64e-02s  0.00e+00d  [ProcessAtMostOneAndLinear] 
  5.56e-03s  0.00e+00d  [DetectDuplicateConstraints] #duplicates=392 #without_enforcements=72 
  4.73e-03s  3.22e-04d  [DetectDominatedLinearConstraints] #relevant_constraints=4'815 #num_inclusions=3'088 
  5.79e-04s  0.00e+00d  [DetectDifferentVariables] #different=28 #cliques=1 #size=7 
  1.26e-03s  1.14e-04d  [ProcessSetPPC] #relevant_constraints=4'488 
  2.04e-05s  0.00e+00d  [FindAlmostIdenticalLinearConstraints] 
  1.80e-04s  2.46e-04d  [FindBigAtMostOneAndLinearOverlap] 
  1.34e-02s  7.58e-03d  [FindBigVerticalLinearOverlap] #blocks=81 #saved_nz=14'438 
  6.79e-04s  2.53e-04d  [FindBigHorizontalLinearOverlap] #linears=4'259 
  2.13e-05s  0.00e+00d  [MergeClauses] 
  4.04e-03s  0.00e+00d  [DetectDominanceRelations] 
  4.53e-02s  0.00e+00d  [PresolveToFixPoint] #num_loops=2 #num_dual_strengthening=1 
  4.02e-03s  0.00e+00d  [DetectDominanceRelations] 
  2.62e-02s  0.00e+00d  [PresolveToFixPoint] #num_loops=1 #num_dual_strengthening=1 
[Symmetry] Graph for symmetry has 6'189 nodes and 59'059 arcs.
[Symmetry] Symmetry computation done. time: 0.00139915 dtime: 0.00295138
  2.22e-02s  4.20e-03d  [Probe] #probed=450 #new_bounds=65 
  1.40e-05s  0.00e+00d  [MaxClique] 
  4.03e-03s  0.00e+00d  [DetectDominanceRelations] 
  4.23e-02s  0.00e+00d  [PresolveToFixPoint] #num_loops=2 #num_dual_strengthening=1 
  1.52e-02s  0.00e+00d  [ProcessAtMostOneAndLinear] 
  4.97e-03s  0.00e+00d  [DetectDuplicateConstraints] #without_enforcements=80 
  2.88e-03s  1.97e-04d  [DetectDominatedLinearConstraints] #relevant_constraints=4'637 #num_inclusions=259 
  4.96e-04s  0.00e+00d  [DetectDifferentVariables] 
  1.10e-03s  8.28e-05d  [ProcessSetPPC] #relevant_constraints=4'168 
  3.75e-05s  5.55e-07d  [FindAlmostIdenticalLinearConstraints] #num_tested_pairs=25 
  9.97e-05s  1.33e-04d  [FindBigAtMostOneAndLinearOverlap] 
  9.26e-03s  5.27e-03d  [FindBigVerticalLinearOverlap] #blocks=160 #saved_nz=11'013 
  5.33e-04s  1.79e-04d  [FindBigHorizontalLinearOverlap] #linears=3'414 
  1.77e-05s  0.00e+00d  [MergeClauses] 
  3.34e-03s  0.00e+00d  [DetectDominanceRelations] 
  4.71e-02s  0.00e+00d  [PresolveToFixPoint] #num_loops=2 #num_dual_strengthening=1 
  3.34e-03s  0.00e+00d  [DetectDominanceRelations] 
  3.04e-02s  0.00e+00d  [PresolveToFixPoint] #num_loops=1 #num_dual_strengthening=1 
[Symmetry] Graph for symmetry has 6'657 nodes and 48'198 arcs.
[Symmetry] Symmetry computation done. time: 0.00118293 dtime: 0.00251186
  2.15e-02s  3.88e-03d  [Probe] #probed=450 #new_bounds=123 
  1.51e-05s  0.00e+00d  [MaxClique] 
  3.42e-03s  0.00e+00d  [DetectDominanceRelations] 
  4.53e-02s  0.00e+00d  [PresolveToFixPoint] #num_loops=2 #num_dual_strengthening=1 
  1.37e-02s  0.00e+00d  [ProcessAtMostOneAndLinear] 
  4.73e-03s  0.00e+00d  [DetectDuplicateConstraints] #without_enforcements=80 
  2.26e-03s  1.45e-04d  [DetectDominatedLinearConstraints] #relevant_constraints=4'659 #num_inclusions=40 
  4.50e-04s  0.00e+00d  [DetectDifferentVariables] 
  8.72e-04s  5.76e-05d  [ProcessSetPPC] #relevant_constraints=3'393 
  7.48e-05s  4.96e-06d  [FindAlmostIdenticalLinearConstraints] #num_tested_pairs=232 
  7.76e-05s  7.30e-05d  [FindBigAtMostOneAndLinearOverlap] 
  6.62e-03s  3.63e-03d  [FindBigVerticalLinearOverlap] #blocks=127 #saved_nz=8'766 
  3.55e-04s  1.17e-04d  [FindBigHorizontalLinearOverlap] #linears=2'451 
  1.88e-05s  0.00e+00d  [MergeClauses] 
  2.78e-03s  0.00e+00d  [DetectDominanceRelations] 
  4.10e-02s  0.00e+00d  [PresolveToFixPoint] #num_loops=2 #num_dual_strengthening=1 
  1.84e-04s  0.00e+00d  [ExpandObjective] #entries=1'897 #tight_variables=528 #tight_constraints=306 

Presolve summary:
  - 106 affine relations were detected.
  - rule 'TODO dual: only one blocking constraint?' was applied 762 times.
  - rule 'TODO dual: only one blocking enforced constraint?' was applied 182 times.
  - rule 'TODO dual: only one unspecified blocking constraint?' was applied 30 times.
  - rule 'TODO duplicate: identical constraint with different enforcements' was applied 232 times.
  - rule 'affine: new relation' was applied 106 times.
  - rule 'at_most_one: removed literals' was applied 2 times.
  - rule 'at_most_one: size one' was applied 2 times.
  - rule 'at_most_one: transformed into max clique.' was applied 1 time.
  - rule 'deductions: 470 stored' was applied 1 time.
  - rule 'dual: fix variable' was applied 21 times.
  - rule 'dual: reduced domain' was applied 43 times.
  - rule 'duplicate: merged rhs of linear constraint' was applied 84 times.
  - rule 'duplicate: removed constraint' was applied 392 times.
  - rule 'enforcement: false literal' was applied 8 times.
  - rule 'exactly_one: x and not(x)' was applied 1 time.
  - rule 'incompatible linear: add implication' was applied 63 times.
  - rule 'linear matrix: common vertical rectangle' was applied 368 times.
  - rule 'linear: always true' was applied 552 times.
  - rule 'linear: doubleton free' was applied 14 times.
  - rule 'linear: empty' was applied 36 times.
  - rule 'linear: extracted enforcement literal' was applied 6'716 times.
  - rule 'linear: fixed or dup variables' was applied 5'604 times.
  - rule 'linear: positive equal one' was applied 3 times.
  - rule 'linear: reduced variable domains' was applied 489 times.
  - rule 'linear: remapped using affine relations' was applied 5'724 times.
  - rule 'linear: simplified rhs' was applied 18'499 times.
  - rule 'linear: tightened into equality' was applied 7 times.
  - rule 'linear: variable substitution 1' was applied 14 times.
  - rule 'linear: variable substitution 2' was applied 16 times.
  - rule 'linear: variable substitution 3' was applied 6 times.
  - rule 'no_overlap: inferred from x != y constraints' was applied 1 time.
  - rule 'presolve: 97 unused variables removed.' was applied 1 time.
  - rule 'presolve: iteration' was applied 3 times.
  - rule 'probing: reduced enforced constraint to implication.' was applied 4 times.
  - rule 'symmetry: fixed to false in general orbit' was applied 1 time.

Presolved optimization model '': (model_fingerprint: 0xf4e6fd3602c9e409)
#Variables: 515 (#ints: 8 in objective)
  - 112 Booleans in [0,1]
  - 351 different domains in [-8628,9347] with a largest complexity of 13.
#kExactlyOne: 2 (#literals: 6)
#kInterval: 7
#kLinear2: 836 (#enforced: 789 #multi: 384)
#kLinear3: 1'341 (#enforced: 1'080)
#kLinearN: 3'236 (#enforced: 3'082) (#terms: 26'496)
#kNoOverlap: 1 (#intervals: 7)

Preloading model.
#Bound   0.60s best:inf   next:[219,5401] initial_domain
[Symmetry] Graph for symmetry has 6'757 nodes and 39'519 arcs.
[Symmetry] Symmetry computation done. time: 0.00105778 dtime: 0.00212239
#Model   0.61s var:515/515 constraints:5423/5423

Starting search at 0.61s with 32 workers.
17 full problem subsolvers: [core, default_lp, fixed, lb_tree_search, max_lp, no_lp, objective_lb_search, objective_lb_search_max_lp, objective_lb_search_no_lp, objective_shaving_search_max_lp, objective_shaving_search_no_lp, probing, probing_max_lp, pseudo_costs, quick_restart, quick_restart_no_lp, reduced_costs]
13 first solution subsolvers: [fj_long_default, fj_long_lin_default, fj_long_random, fj_short_default, fj_short_lin_default, fj_short_lin_random, fj_short_random, fs_random(2), fs_random_no_lp, fs_random_quick_restart(2), fs_random_quick_restart_no_lp]
13 incomplete subsolvers: [feasibility_pump, graph_arc_lns, graph_cst_lns, graph_dec_lns, graph_var_lns, rins/rens, rnd_cst_lns, rnd_var_lns, scheduling_intervals_lns, scheduling_precedences_lns, scheduling_time_window_lns, violation_ls(2)]
3 helper subsolvers: [neighborhood_helper, synchronization_agent, update_gap_integral]
#Bound   0.74s best:inf   next:[228,5401] objective_lb_search_no_lp
#Bound   0.79s best:inf   next:[414,5401] objective_lb_search_no_lp
#1       0.91s best:2283  next:[414,2282] objective_lb_search_no_lp (fixed_bools=2/156)
#Bound   1.00s best:2283  next:[671,2282] reduced_costs
#2       1.06s best:2282  next:[671,2281] violation_ls(batch:1 #solutions_imported:1 #lin_moves:7'359 #lin_evals:21'242 #weight_updates:328)
#Bound   1.12s best:2282  next:[675,2281] reduced_costs
#3       1.13s best:2281  next:[675,2280] violation_ls(batch:2 #solutions_imported:2 #lin_moves:1 #lin_evals:18'268 #gen_moves:7'359 #gen_evals:1'036 #comp_moves:1'082 #backtracks:3'137 #weight_updates:70)
#4       1.16s best:2160  next:[675,2159] graph_var_lns (d=0.50 s=50 t=0.10 p=0.00 stall=0 h=auto_l0) [presolve]
#5       1.17s best:2130  next:[675,2129] graph_arc_lns (d=0.50 s=51 t=0.10 p=0.00 stall=0 h=auto_l0) [presolve]
#Bound   1.19s best:2130  next:[696,2129] objective_lb_search_no_lp
#6       1.21s best:2129  next:[696,2128] violation_ls(batch:3 #solutions_imported:3 #lin_moves:1 #lin_evals:21'910 #gen_moves:8'841 #gen_evals:1'217 #comp_moves:1'274 #backtracks:3'782 #weight_updates:96)
#7       1.22s best:2128  next:[696,2127] violation_ls(batch:3 #solutions_imported:3 #lin_moves:7'360 #lin_evals:24'078 #gen_moves:1'111 #gen_evals:79 #comp_moves:79 #backtracks:516 #weight_updates:353)
#8       1.30s best:2127  next:[696,2126] graph_var_lns (d=0.71 s=62 t=0.10 p=1.00 stall=0 h=auto_l0) [hint]
#Bound   1.33s best:2127  next:[698,2126] objective_lb_search_no_lp
#9       1.41s best:2126  next:[698,2125] violation_ls(batch:4 #solutions_imported:4 #lin_moves:8'220 #lin_evals:27'770 #gen_moves:1'111 #gen_evals:79 #comp_moves:79 #backtracks:516 #weight_updates:714)
#10      1.52s best:2072  next:[698,2071] quick_restart_no_lp (fixed_bools=0/316)
#11      1.53s best:2071  next:[698,2070] quick_restart_no_lp (fixed_bools=0/321)
#12      1.53s best:2066  next:[698,2065] quick_restart_no_lp (fixed_bools=0/327)
#13      1.57s best:2055  next:[698,2054] no_lp (fixed_bools=0/164)
#14      1.59s best:2042  next:[698,2041] no_lp (fixed_bools=0/169)
#15      1.62s best:2041  next:[698,2040] quick_restart_no_lp (fixed_bools=0/386)
#16      1.65s best:2017  next:[698,2016] no_lp (fixed_bools=0/177)
#17      1.66s best:1928  next:[698,1927] quick_restart_no_lp (fixed_bools=0/413)
#18      1.68s best:1919  next:[698,1918] quick_restart_no_lp (fixed_bools=0/419)
#Bound   1.69s best:1919  next:[703,1918] objective_lb_search_no_lp
#19      1.73s best:1917  next:[703,1916] quick_restart_no_lp (fixed_bools=0/423)
#Bound   1.74s best:1917  next:[706,1916] objective_lb_search_no_lp
#20      1.79s best:1910  next:[706,1909] rnd_cst_lns (d=0.88 s=85 t=0.10 p=1.00 stall=0 h=auto_l0) [presolve]
#Bound   2.08s best:1910  next:[707,1909] objective_lb_search_no_lp
#21      2.11s best:1905  next:[707,1904] no_lp (fixed_bools=0/215)
#Bound   2.28s best:1905  next:[709,1904] objective_lb_search_no_lp
#Bound   2.49s best:1905  next:[737,1904] objective_lb_search_no_lp
#Bound   2.52s best:1905  next:[738,1904] objective_lb_search_no_lp
#22      2.59s best:1804  next:[738,1803] no_lp (fixed_bools=0/254)
#23      2.61s best:1803  next:[738,1802] no_lp (fixed_bools=0/254)
#24      2.74s best:1798  next:[738,1797] no_lp (fixed_bools=0/295)
#25      2.76s best:1781  next:[738,1780] no_lp (fixed_bools=0/296)
#Bound   2.80s best:1781  next:[740,1780] objective_lb_search_max_lp
#26      2.96s best:1490  next:[740,1489] scheduling_precedences_lns (d=0.50 s=56 t=0.10 p=0.00 stall=0 h=auto_l0)
#Bound   2.97s best:1490  next:[831,1489] objective_lb_search_no_lp
#27      3.04s best:1488  next:[831,1487] scheduling_time_window_lns (d=0.50 s=67 t=0.10 p=0.00 stall=0 h=auto_l0)
#Bound   4.30s best:1488  next:[851,1487] objective_lb_search_max_lp
#Bound   5.00s best:1488  next:[855,1487] objective_lb_search_max_lp
#Bound   5.36s best:1488  next:[857,1487] objective_lb_search_no_lp
#Bound   5.58s best:1488  next:[871,1487] objective_lb_search_no_lp
#Bound   5.80s best:1488  next:[874,1487] objective_lb_search_no_lp
#Bound   6.19s best:1488  next:[877,1487] objective_lb_search_max_lp
#Bound   6.69s best:1488  next:[892,1487] objective_lb_search_no_lp
#Bound   8.06s best:1488  next:[896,1487] objective_lb_search_max_lp
#Bound   8.67s best:1488  next:[898,1487] objective_lb_search_no_lp
#Bound   9.10s best:1488  next:[900,1487] objective_lb_search_max_lp
#Bound  10.21s best:1488  next:[905,1487] objective_lb_search_no_lp
#Bound  10.75s best:1488  next:[907,1487] objective_lb_search_no_lp
#Bound  11.23s best:1488  next:[928,1487] objective_lb_search_no_lp
#Bound  11.90s best:1488  next:[930,1487] objective_lb_search_no_lp
#Bound  13.34s best:1488  next:[937,1487] objective_lb_search_no_lp
#Bound  15.52s best:1488  next:[940,1487] objective_lb_search_no_lp
#Bound  16.33s best:1488  next:[942,1487] objective_lb_search_no_lp
#Bound  16.45s best:1488  next:[946,1487] objective_lb_search_no_lp
#Bound  18.02s best:1488  next:[948,1487] objective_lb_search_no_lp
#Bound  19.27s best:1488  next:[954,1487] objective_lb_search
#Bound  19.51s best:1488  next:[956,1487] objective_lb_search_no_lp
#Bound  20.23s best:1488  next:[958,1487] objective_lb_search_no_lp
#Bound  21.65s best:1488  next:[959,1487] objective_lb_search_no_lp
#Bound  22.94s best:1488  next:[963,1487] objective_lb_search_no_lp
#Bound  26.31s best:1488  next:[966,1487] objective_lb_search
#Bound  26.47s best:1488  next:[981,1487] objective_lb_search_max_lp
#Bound  29.84s best:1488  next:[983,1487] objective_lb_search_max_lp
#Bound  32.87s best:1488  next:[984,1487] lb_tree_search (nodes=1287/1288 rc=10 decisions=19064 @root=18 restarts=11) 
#Bound  34.29s best:1488  next:[985,1487] lb_tree_search (nodes=1301/1302 rc=10 decisions=19325 @root=19 restarts=11) 
#Bound  35.46s best:1488  next:[986,1487] lb_tree_search (nodes=1318/1319 rc=11 decisions=19588 @root=20 restarts=11) 
#Bound  36.44s best:1488  next:[987,1487] lb_tree_search (nodes=1326/1327 rc=11 decisions=19737 @root=21 restarts=11) 
#Bound  37.87s best:1488  next:[988,1487] lb_tree_search (nodes=1338/1339 rc=11 decisions=20043 @root=22 restarts=11) 
#Bound  39.03s best:1488  next:[989,1487] lb_tree_search (nodes=1352/1353 rc=11 decisions=20284 @root=23 restarts=11) 
#Bound  40.19s best:1488  next:[990,1487] lb_tree_search (nodes=1362/1363 rc=12 decisions=20508 @root=24 restarts=11) 
#Bound  41.43s best:1488  next:[991,1487] lb_tree_search (nodes=1370/1372 rc=12 decisions=20759 @root=25 restarts=11) 
#Bound  42.37s best:1488  next:[992,1487] objective_lb_search_max_lp
#Bound  43.60s best:1488  next:[993,1487] lb_tree_search (nodes=1383/1385 rc=12 decisions=21162 @root=27 restarts=11) 
#Bound  44.83s best:1488  next:[994,1487] lb_tree_search (nodes=1390/1392 rc=12 decisions=21406 @root=28 restarts=11) 
#Bound  46.33s best:1488  next:[995,1487] lb_tree_search (nodes=1402/1404 rc=12 decisions=21665 @root=29 restarts=11) 
#Bound  47.68s best:1488  next:[996,1487] lb_tree_search (nodes=1416/1418 rc=12 decisions=21897 @root=30 restarts=11) 
#Bound  49.21s best:1488  next:[997,1487] lb_tree_search (nodes=1437/1439 rc=12 decisions=22237 @root=31 restarts=11) 
#Bound  50.36s best:1488  next:[998,1487] lb_tree_search (nodes=1441/1444 rc=13 decisions=22427 @root=32 restarts=11) 
#Bound  51.69s best:1488  next:[999,1487] lb_tree_search (nodes=1455/1458 rc=13 decisions=22638 @root=33 restarts=11) 
#Bound  52.93s best:1488  next:[1000,1487] lb_tree_search (nodes=1472/1475 rc=13 decisions=22897 @root=34 restarts=11) 
#Bound  54.70s best:1488  next:[1001,1487] lb_tree_search (nodes=1492/1495 rc=14 decisions=23262 @root=35 restarts=11) 
#Bound  56.05s best:1488  next:[1002,1487] lb_tree_search (nodes=1506/1509 rc=14 decisions=23532 @root=36 restarts=11) 
#Bound  57.41s best:1488  next:[1003,1487] lb_tree_search (nodes=1517/1520 rc=14 decisions=23794 @root=37 restarts=11) 
#Bound  58.37s best:1488  next:[1019,1487] objective_lb_search
#28     67.45s best:1485  next:[1019,1484] rins_lp_lns (d=0.91 s=1609 t=0.10 p=0.52 stall=8 h=auto_l0)
#Bound  67.75s best:1485  next:[1020,1484] lb_tree_search (nodes=1837/1837 rc=14 decisions=28828 @root=39 restarts=12) 
#Bound  69.25s best:1485  next:[1021,1484] lb_tree_search (nodes=1848/1848 rc=14 decisions=29144 @root=40 restarts=12) 
#Bound  71.05s best:1485  next:[1022,1484] lb_tree_search (nodes=1862/1862 rc=14 decisions=29475 @root=41 restarts=12) 
#Bound  72.65s best:1485  next:[1023,1484] lb_tree_search (nodes=1870/1872 rc=14 decisions=29777 @root=42 restarts=12) 
#Bound  74.65s best:1485  next:[1024,1484] lb_tree_search (nodes=1888/1891 rc=14 decisions=30146 @root=43 restarts=12) 
#Bound  76.22s best:1485  next:[1025,1484] lb_tree_search (nodes=1903/1906 rc=14 decisions=30434 @root=44 restarts=12) 
#Bound  77.82s best:1485  next:[1026,1484] lb_tree_search (nodes=1913/1916 rc=14 decisions=30714 @root=45 restarts=12) 
#Bound  78.90s best:1485  next:[1027,1484] objective_lb_search_no_lp
#Bound  79.89s best:1485  next:[1028,1484] objective_lb_search_no_lp
#Bound  82.26s best:1485  next:[1029,1484] objective_lb_search_no_lp
#Bound  83.95s best:1485  next:[1030,1484] lb_tree_search (nodes=1958/1962 rc=14 decisions=31745 @root=49 restarts=12) 
#Bound  85.53s best:1485  next:[1031,1484] lb_tree_search (nodes=1963/1967 rc=14 decisions=32028 @root=50 restarts=12) 
#Bound  87.00s best:1485  next:[1032,1484] lb_tree_search (nodes=1970/1974 rc=14 decisions=32252 @root=51 restarts=12) 
#Bound  88.74s best:1485  next:[1033,1484] lb_tree_search (nodes=1974/1978 rc=14 decisions=32520 @root=52 restarts=12) 
#Bound  90.46s best:1485  next:[1034,1484] lb_tree_search (nodes=1984/1988 rc=14 decisions=32791 @root=53 restarts=12) 
#Bound  92.29s best:1485  next:[1035,1484] lb_tree_search (nodes=2001/2005 rc=14 decisions=33134 @root=54 restarts=12) 
#Bound  93.85s best:1485  next:[1036,1484] lb_tree_search (nodes=2010/2014 rc=14 decisions=33374 @root=55 restarts=12) 
#Bound  95.93s best:1485  next:[1037,1484] lb_tree_search (nodes=2030/2034 rc=14 decisions=33711 @root=56 restarts=12) 
#Bound  97.79s best:1485  next:[1038,1484] lb_tree_search (nodes=2043/2047 rc=14 decisions=34010 @root=57 restarts=12) 
#Bound  99.98s best:1485  next:[1039,1484] lb_tree_search (nodes=2067/2071 rc=14 decisions=34397 @root=58 restarts=12) 
#Bound 101.93s best:1485  next:[1040,1484] lb_tree_search (nodes=2082/2086 rc=14 decisions=34746 @root=59 restarts=12) 
#Bound 103.60s best:1485  next:[1042,1484] objective_lb_search_no_lp
#Bound 106.05s best:1485  next:[1043,1484] lb_tree_search (nodes=2097/2101 rc=14 decisions=35474 @root=61 restarts=12) 
#Bound 107.99s best:1485  next:[1044,1484] lb_tree_search (nodes=2117/2121 rc=14 decisions=35826 @root=62 restarts=12) 
#Bound 109.91s best:1485  next:[1045,1484] lb_tree_search (nodes=2127/2131 rc=14 decisions=36138 @root=63 restarts=12) 
#Bound 111.24s best:1485  next:[1046,1484] objective_lb_search_no_lp
#Bound 113.49s best:1485  next:[1047,1484] lb_tree_search (nodes=2159/2163 rc=14 decisions=36668 @root=65 restarts=12) 
#Bound 115.35s best:1485  next:[1048,1484] lb_tree_search (nodes=2177/2181 rc=14 decisions=36964 @root=66 restarts=12) 
#Bound 117.54s best:1485  next:[1049,1484] lb_tree_search (nodes=2200/2204 rc=14 decisions=37327 @root=67 restarts=12) 
#Bound 119.07s best:1485  next:[1050,1484] objective_lb_search_no_lp
#Bound 120.81s best:1485  next:[1051,1484] objective_lb_search_no_lp
#Bound 121.60s best:1485  next:[1052,1484] objective_lb_search_no_lp
#Bound 124.62s best:1485  next:[1053,1484] lb_tree_search (nodes=2268/2272 rc=14 decisions=38599 @root=70 restarts=12) 
#Bound 126.84s best:1485  next:[1054,1484] lb_tree_search (nodes=2280/2284 rc=14 decisions=38970 @root=71 restarts=12) 
#Bound 127.40s best:1485  next:[1055,1484] objective_lb_search_no_lp
#Bound 128.68s best:1485  next:[1059,1484] objective_lb_search_no_lp
#Bound 132.32s best:1485  next:[1062,1484] objective_lb_search_no_lp
#Bound 138.40s best:1485  next:[1063,1484] lb_tree_search (nodes=2472/2477 rc=17 decisions=41448 @root=75 restarts=12) 
#Bound 140.48s best:1485  next:[1064,1484] lb_tree_search (nodes=2487/2492 rc=17 decisions=41817 @root=76 restarts=12) 
#Bound 142.86s best:1485  next:[1065,1484] lb_tree_search (nodes=2510/2515 rc=17 decisions=42253 @root=77 restarts=12) 
#Bound 145.40s best:1485  next:[1066,1484] lb_tree_search (nodes=2537/2542 rc=17 decisions=42751 @root=78 restarts=12) 
#Bound 147.26s best:1485  next:[1067,1484] lb_tree_search (nodes=2552/2557 rc=18 decisions=43095 @root=79 restarts=12) 
#Bound 149.37s best:1485  next:[1071,1484] objective_lb_search_no_lp
#Bound 153.38s best:1485  next:[1072,1484] objective_lb_search_no_lp
#Bound 154.02s best:1485  next:[1074,1484] objective_lb_search_no_lp
#Bound 154.83s best:1485  next:[1075,1484] objective_lb_search_no_lp
#Bound 156.08s best:1485  next:[1076,1484] objective_lb_search_no_lp
#Bound 160.81s best:1485  next:[1077,1484] lb_tree_search (nodes=2816/2821 rc=21 decisions=46292 @root=82 restarts=12) 
#Bound 163.57s best:1485  next:[1078,1484] lb_tree_search (nodes=2846/2851 rc=21 decisions=46800 @root=83 restarts=12) 
#Bound 165.87s best:1485  next:[1079,1484] objective_lb_search_no_lp
#Bound 168.34s best:1485  next:[1080,1484] objective_lb_search_no_lp
#Bound 172.06s best:1485  next:[1081,1484] lb_tree_search (nodes=2950/2956 rc=22 decisions=48326 @root=86 restarts=12) 
#Bound 174.46s best:1485  next:[1082,1484] objective_lb_search_no_lp
#Bound 177.68s best:1485  next:[1083,1484] lb_tree_search (nodes=3013/3019 rc=22 decisions=49285 @root=88 restarts=12) 
#29    179.22s best:1479  next:[1083,1478] pseudo_costs (fixed_bools=0/149)
#30    179.66s best:1467  next:[1083,1466] rnd_cst_lns (d=0.99 s=4087 t=0.11 p=0.52 stall=23 h=folio_rnd)
#Bound 181.28s best:1467  next:[1084,1466] lb_tree_search (nodes=3043/3049 rc=24 decisions=49861 @root=89 restarts=12) 
#Bound 184.50s best:1467  next:[1085,1466] lb_tree_search (nodes=3066/3073 rc=24 decisions=50455 @root=90 restarts=12) 
#Bound 187.24s best:1467  next:[1086,1466] lb_tree_search (nodes=3086/3093 rc=25 decisions=50951 @root=91 restarts=12) 
#Bound 189.13s best:1467  next:[1087,1466] objective_lb_search_no_lp
#Bound 192.56s best:1467  next:[1088,1466] lb_tree_search (nodes=3165/3173 rc=26 decisions=52157 @root=93 restarts=12) 
#Bound 195.39s best:1467  next:[1089,1466] lb_tree_search (nodes=3196/3204 rc=26 decisions=52706 @root=94 restarts=12) 
#Bound 198.34s best:1467  next:[1090,1466] lb_tree_search (nodes=3231/3239 rc=26 decisions=53293 @root=95 restarts=12) 
#Bound 199.94s best:1467  next:[1094,1466] objective_lb_search_no_lp
#Bound 208.13s best:1467  next:[1095,1466] lb_tree_search (nodes=3403/3411 rc=29 decisions=55297 @root=98 restarts=12) 
#31    211.20s best:1453  next:[1095,1452] rins_lp_lns (d=0.90 s=4686 t=0.10 p=0.51 stall=3 h=auto_l0)
#Bound 211.81s best:1453  next:[1096,1452] lb_tree_search (nodes=3454/3462 rc=31 decisions=55993 @root=99 restarts=12) 
#Bound 212.22s best:1453  next:[1098,1452] objective_lb_search_no_lp
#Bound 219.88s best:1453  next:[1099,1452] lb_tree_search (nodes=3584/3593 rc=31 decisions=57681 @root=101 restarts=12) 
#Bound 223.71s best:1453  next:[1100,1452] lb_tree_search (nodes=3620/3630 rc=32 decisions=58411 @root=102 restarts=12) 
#Bound 226.45s best:1453  next:[1101,1452] lb_tree_search (nodes=3641/3652 rc=32 decisions=58913 @root=103 restarts=12) 
#Bound 229.07s best:1453  next:[1102,1452] objective_lb_search_no_lp
#Bound 234.76s best:1453  next:[1103,1452] lb_tree_search (nodes=3706/3717 rc=32 decisions=60240 @root=106 restarts=12) 
#Bound 238.23s best:1453  next:[1104,1452] lb_tree_search (nodes=3744/3755 rc=33 decisions=60955 @root=107 restarts=12) 
#Bound 241.41s best:1453  next:[1105,1452] lb_tree_search (nodes=3766/3777 rc=33 decisions=61590 @root=108 restarts=12) 
#Bound 244.93s best:1453  next:[1106,1452] lb_tree_search (nodes=3811/3822 rc=35 decisions=62335 @root=109 restarts=12) 
#Bound 245.73s best:1453  next:[1107,1452] objective_lb_search_no_lp
#Bound 250.04s best:1453  next:[1108,1452] lb_tree_search (nodes=3870/3892 rc=36 decisions=63549 @root=110 restarts=12) 
#Bound 253.06s best:1453  next:[1109,1452] lb_tree_search (nodes=3677/3924 rc=37 decisions=64154 @root=111 restarts=12) 
#Bound 256.24s best:1453  next:[1110,1452] lb_tree_search (nodes=3702/3957 rc=38 decisions=64800 @root=112 restarts=12) 
#Bound 259.68s best:1453  next:[1111,1452] lb_tree_search (nodes=3524/4010 rc=39 decisions=65482 @root=113 restarts=12) 
#Bound 262.32s best:1453  next:[1112,1452] lb_tree_search (nodes=3525/4057 rc=41 decisions=66083 @root=114 restarts=12) 
#Bound 264.62s best:1453  next:[1113,1452] lb_tree_search (nodes=3533/4080 rc=41 decisions=66554 @root=115 restarts=12) 
#Bound 267.50s best:1453  next:[1114,1452] lb_tree_search (nodes=3559/4131 rc=44 decisions=67219 @root=116 restarts=12) 
#Bound 270.41s best:1453  next:[1115,1452] lb_tree_search (nodes=3604/4181 rc=44 decisions=67921 @root=117 restarts=12) 
#Bound 273.16s best:1453  next:[1116,1452] lb_tree_search (nodes=3619/4218 rc=45 decisions=68537 @root=118 restarts=12) 
#Bound 276.60s best:1453  next:[1117,1452] lb_tree_search (nodes=3668/4267 rc=47 decisions=69261 @root=119 restarts=12) 
#Bound 279.62s best:1453  next:[1118,1452] lb_tree_search (nodes=3705/4305 rc=47 decisions=69911 @root=120 restarts=12) 
#Bound 282.87s best:1453  next:[1119,1452] lb_tree_search (nodes=3736/4340 rc=48 decisions=70589 @root=121 restarts=12) 
#Bound 285.62s best:1453  next:[1120,1452] lb_tree_search (nodes=3758/4365 rc=48 decisions=71150 @root=122 restarts=12) 
#Bound 288.47s best:1453  next:[1121,1452] lb_tree_search (nodes=3801/4409 rc=49 decisions=71773 @root=123 restarts=12) 
#Bound 291.34s best:1453  next:[1122,1452] lb_tree_search (nodes=3842/4451 rc=52 decisions=72468 @root=124 restarts=12) 
#Bound 294.06s best:1453  next:[1123,1452] objective_lb_search_no_lp
#Bound 297.71s best:1453  next:[1124,1452] lb_tree_search (nodes=3930/4542 rc=54 decisions=73843 @root=126 restarts=12) 
#Bound 300.74s best:1453  next:[1125,1452] lb_tree_search (nodes=3966/4586 rc=57 decisions=74508 @root=127 restarts=12) 
#Bound 304.01s best:1453  next:[1126,1452] lb_tree_search (nodes=4007/4627 rc=57 decisions=75255 @root=128 restarts=12) 
#Bound 307.36s best:1453  next:[1127,1452] lb_tree_search (nodes=4015/4669 rc=57 decisions=76051 @root=129 restarts=12) 
#Bound 310.14s best:1453  next:[1128,1452] lb_tree_search (nodes=4034/4699 rc=57 decisions=76634 @root=130 restarts=12) 
#Bound 310.49s best:1453  next:[1129,1452] objective_lb_search
#Bound 314.62s best:1453  next:[1130,1452] lb_tree_search (nodes=4121/4789 rc=58 decisions=77951 @root=131 restarts=12) 
#Bound 317.57s best:1453  next:[1131,1452] lb_tree_search (nodes=4167/4837 rc=59 decisions=78628 @root=132 restarts=12) 
#Bound 320.42s best:1453  next:[1132,1452] lb_tree_search (nodes=4209/4879 rc=60 decisions=79296 @root=133 restarts=12) 
#Bound 323.72s best:1453  next:[1133,1452] lb_tree_search (nodes=4263/4935 rc=60 decisions=80135 @root=134 restarts=12) 
#Bound 327.05s best:1453  next:[1134,1452] lb_tree_search (nodes=4308/4980 rc=61 decisions=80916 @root=135 restarts=12) 
#Bound 329.69s best:1453  next:[1135,1452] lb_tree_search (nodes=4220/5018 rc=61 decisions=81532 @root=136 restarts=12) 
#Bound 332.73s best:1453  next:[1136,1452] lb_tree_search (nodes=4241/5047 rc=65 decisions=82178 @root=137 restarts=12) 
#Bound 336.97s best:1453  next:[1137,1452] lb_tree_search (nodes=4276/5116 rc=71 decisions=83107 @root=138 restarts=12) 
#Bound 341.83s best:1453  next:[1138,1452] lb_tree_search (nodes=4241/5195 rc=77 decisions=84154 @root=139 restarts=12) 
#Bound 346.36s best:1453  next:[1139,1452] lb_tree_search (nodes=4308/5310 rc=83 decisions=85223 @root=140 restarts=12) 
#Bound 348.29s best:1453  next:[1141,1452] objective_lb_search
#Bound 356.47s best:1453  next:[1142,1452] lb_tree_search (nodes=4400/5441 rc=91 decisions=87334 @root=143 restarts=12) 
#Bound 356.78s best:1453  next:[1148,1452] objective_lb_search
#Bound 364.97s best:1453  next:[1149,1452] objective_lb_search
#Bound 370.31s best:1453  next:[1150,1452] lb_tree_search (nodes=4661/5915 rc=98 decisions=91637 @root=147 restarts=12) 
#Bound 373.74s best:1453  next:[1151,1452] lb_tree_search (nodes=4716/5971 rc=99 decisions=92633 @root=148 restarts=12) 
#Bound 377.58s best:1453  next:[1152,1452] lb_tree_search (nodes=4760/6016 rc=99 decisions=93557 @root=149 restarts=12) 
#Bound 382.54s best:1453  next:[1153,1452] lb_tree_search (nodes=4804/6069 rc=101 decisions=94559 @root=151 restarts=12) 
#Bound 386.21s best:1453  next:[1154,1452] lb_tree_search (nodes=4872/6140 rc=101 decisions=95595 @root=152 restarts=12) 
#Model 388.28s var:514/515 constraints:5302/5423
#Bound 389.58s best:1453  next:[1155,1452] lb_tree_search (nodes=4931/6202 rc=102 decisions=96543 @root=153 restarts=12) 
#Bound 393.09s best:1453  next:[1156,1452] lb_tree_search (nodes=4953/6246 rc=104 decisions=97511 @root=154 restarts=12) 
#Bound 396.73s best:1453  next:[1157,1452] lb_tree_search (nodes=4984/6322 rc=109 decisions=98685 @root=155 restarts=12) 
#Bound 400.38s best:1453  next:[1158,1452] lb_tree_search (nodes=4870/6360 rc=111 decisions=99552 @root=156 restarts=12) 
#Bound 403.29s best:1453  next:[1159,1452] lb_tree_search (nodes=4817/6428 rc=115 decisions=100541 @root=157 restarts=12) 
#Bound 406.52s best:1453  next:[1160,1452] lb_tree_search (nodes=4778/6460 rc=117 decisions=101311 @root=158 restarts=12) 
#Model 410.40s var:510/515 constraints:5121/5423
#Bound 410.91s best:1453  next:[1161,1452] lb_tree_search (nodes=4695/6518 rc=121 decisions=102219 @root=160 restarts=12) 
#Bound 414.82s best:1453  next:[1162,1452] lb_tree_search (nodes=3903/6580 rc=124 decisions=103131 @root=162 restarts=12) 
#Bound 418.02s best:1453  next:[1163,1452] lb_tree_search (nodes=3534/6609 rc=128 decisions=103715 @root=164 restarts=12) 
#Bound 420.40s best:1453  next:[1164,1452] objective_lb_search_no_lp
#Bound 422.70s best:1453  next:[1165,1452] objective_lb_search_no_lp
#Bound 423.67s best:1453  next:[1167,1452] objective_lb_search_no_lp
#Bound 426.21s best:1453  next:[1170,1452] objective_lb_search_no_lp
#Bound 426.80s best:1453  next:[1171,1452] objective_lb_search_no_lp
#Bound 427.50s best:1453  next:[1175,1452] objective_lb_search_no_lp
#Bound 430.43s best:1453  next:[1177,1452] objective_lb_search_no_lp
#Bound 432.38s best:1453  next:[1179,1452] objective_lb_search_no_lp
#Bound 438.83s best:1453  next:[1182,1452] objective_lb_search_no_lp
#Bound 441.44s best:1453  next:[1183,1452] objective_lb_search_no_lp
#Model 444.51s var:502/515 constraints:4609/5423
#Bound 445.54s best:1453  next:[1185,1452] objective_lb_search_no_lp
#Bound 451.02s best:1453  next:[1186,1452] lb_tree_search (nodes=2922/4177 rc=152 decisions=118216 @root=178 restarts=13) 
#Model 452.42s var:500/515 constraints:4422/5423
#Model 453.77s var:498/515 constraints:4258/5423
#Model 453.85s var:494/515 constraints:3940/5423
#Bound 454.31s best:1453  next:[1187,1452] lb_tree_search (nodes=2914/4189 rc=152 decisions=118515 @root=181 restarts=13) 
#Bound 454.33s best:1453  next:[1212,1452] objective_lb_search_max_lp
#Model 454.67s var:491/515 constraints:3735/5423
#Model 455.00s var:482/515 constraints:2999/5423
#Model 455.02s var:481/515 constraints:2851/5423
#Model 455.69s var:480/515 constraints:2812/5423
#Bound 455.72s best:1453  next:[1263,1452] objective_lb_search_no_lp
#Model 456.25s var:479/515 constraints:2805/5423
#Bound 456.26s best:1453  next:[1264,1452] objective_lb_search_no_lp
#Bound 456.49s best:1453  next:[1270,1452] objective_lb_search_no_lp
#Bound 456.86s best:1453  next:[1273,1452] objective_lb_search_no_lp
#Model 456.90s var:478/515 constraints:2752/5423
#Model 457.33s var:477/515 constraints:2692/5423
#Bound 457.49s best:1453  next:[1274,1452] objective_shaving_search_no_lp (vars=307 csts=2576)
#Model 457.54s var:476/515 constraints:2683/5423
#Bound 457.89s best:1453  next:[1288,1452] objective_lb_search
#Bound 458.04s best:1453  next:[1340,1452] objective_lb_search_no_lp
#Model 458.19s var:475/515 constraints:2590/5423
#Model 458.24s var:474/515 constraints:2565/5423
#Model 458.30s var:472/515 constraints:2412/5423
#Model 458.31s var:469/515 constraints:2187/5423
#Model 458.32s var:465/515 constraints:1877/5423
#Model 458.33s var:459/515 constraints:1520/5423
#Bound 458.38s best:1453  next:[1371,1452] objective_lb_search_no_lp
#Model 458.40s var:457/515 constraints:1434/5423
#Model 458.42s var:453/515 constraints:1243/5423
#Model 458.42s var:452/515 constraints:1181/5423
#Model 458.43s var:442/515 constraints:801/5423
#Bound 458.44s best:1453  next:[1372,1452] objective_lb_search_no_lp
#Bound 458.46s best:1453  next:[1376,1452] objective_lb_search_no_lp
#Model 458.47s var:438/515 constraints:699/5423
#Bound 458.47s best:1453  next:[1381,1452] objective_lb_search_no_lp
#Model 458.47s var:433/515 constraints:650/5423
#Model 458.48s var:429/515 constraints:591/5423
#Bound 458.49s best:1453  next:[1383,1452] objective_lb_search_no_lp
#Done  458.49s quick_restart_no_lp
#Model 458.49s var:427/515 constraints:573/5423
#Done  458.49s objective_lb_search_no_lp
#Done  458.49s core
#Done  458.49s objective_lb_search
#Done  458.50s pseudo_costs
#Done  458.50s quick_restart

Task timing                                  n [     min,      max]      avg      dev     time         n [     min,      max]      avg      dev    dtime
                             'core':         1 [   7.63m,    7.63m]    7.63m   0.00ns    7.63m         1 [   7.79m,    7.79m]    7.79m   0.00ns    7.79m
                       'default_lp':         1 [   7.63m,    7.63m]    7.63m   0.00ns    7.63m         1 [   1.76m,    1.76m]    1.76m   0.00ns    1.76m
                 'feasibility_pump':       718 [ 44.97ms,    1.54s] 255.12ms  64.09ms    3.05m       717 [  8.14ms, 170.00ms]  43.50ms   4.92ms   31.19s
                            'fixed':         1 [   7.63m,    7.63m]    7.63m   0.00ns    7.63m         1 [   1.60m,    1.60m]    1.60m   0.00ns    1.60m
                  'fj_long_default':         1 [504.54ms, 504.54ms] 504.54ms   0.00ns 504.54ms         1 [ 81.80ms,  81.80ms]  81.80ms   0.00ns  81.80ms
              'fj_long_lin_default':         1 [228.97ms, 228.97ms] 228.97ms   0.00ns 228.97ms         1 [ 78.47ms,  78.47ms]  78.47ms   0.00ns  78.47ms
                   'fj_long_random':         1 [183.83ms, 183.83ms] 183.83ms   0.00ns 183.83ms         1 [ 75.65ms,  75.65ms]  75.65ms   0.00ns  75.65ms
                 'fj_short_default':         2 [ 86.02ms, 134.86ms] 110.44ms  24.42ms 220.88ms         2 [ 79.00ms,  80.29ms]  79.64ms 645.57us 159.28ms
             'fj_short_lin_default':         1 [135.74ms, 135.74ms] 135.74ms   0.00ns 135.74ms         1 [ 82.84ms,  82.84ms]  82.84ms   0.00ns  82.84ms
              'fj_short_lin_random':         1 [597.68ms, 597.68ms] 597.68ms   0.00ns 597.68ms         1 [ 80.48ms,  80.48ms]  80.48ms   0.00ns  80.48ms
                  'fj_short_random':         1 [203.39ms, 203.39ms] 203.39ms   0.00ns 203.39ms         1 [ 84.38ms,  84.38ms]  84.38ms   0.00ns  84.38ms
                        'fs_random':         1 [344.19ms, 344.19ms] 344.19ms   0.00ns 344.19ms         1 [ 20.00ns,  20.00ns]  20.00ns   0.00ns  20.00ns
                        'fs_random':         1 [551.94ms, 551.94ms] 551.94ms   0.00ns 551.94ms         1 [ 20.00ns,  20.00ns]  20.00ns   0.00ns  20.00ns
                  'fs_random_no_lp':         1 [344.56ms, 344.56ms] 344.56ms   0.00ns 344.56ms         1 [264.66us, 264.66us] 264.66us   0.00ns 264.66us
          'fs_random_quick_restart':         1 [318.57ms, 318.57ms] 318.57ms   0.00ns 318.57ms         1 [  1.30ms,   1.30ms]   1.30ms   0.00ns   1.30ms
          'fs_random_quick_restart':         1 [516.04ms, 516.04ms] 516.04ms   0.00ns 516.04ms         1 [ 20.00ns,  20.00ns]  20.00ns   0.00ns  20.00ns
    'fs_random_quick_restart_no_lp':         1 [518.18ms, 518.18ms] 518.18ms   0.00ns 518.18ms         0 [  0.00ns,   0.00ns]   0.00ns   0.00ns   0.00ns
                    'graph_arc_lns':       725 [  3.87ms,    1.92s] 827.16ms 404.41ms    9.99m       712 [ 10.00ns, 141.97ms]  71.79ms  45.98ms   51.11s
                    'graph_cst_lns':       725 [  3.74ms,    1.80s] 807.86ms 411.97ms    9.76m       708 [ 10.00ns, 134.82ms]  70.45ms  46.26ms   49.88s
                    'graph_dec_lns':       725 [  5.66ms,    2.07s] 840.67ms 385.04ms   10.16m       710 [ 10.00ns, 134.28ms]  73.41ms  44.70ms   52.12s
                    'graph_var_lns':       725 [  5.83ms,    2.27s] 834.69ms 387.52ms   10.09m       718 [ 10.00ns, 124.47ms]  71.16ms  43.94ms   51.09s
                   'lb_tree_search':         1 [   7.63m,    7.63m]    7.63m   0.00ns    7.63m         1 [   3.61m,    3.61m]    3.61m   0.00ns    3.61m
                           'max_lp':         1 [   7.63m,    7.63m]    7.63m   0.00ns    7.63m         1 [   1.91m,    1.91m]    1.91m   0.00ns    1.91m
                            'no_lp':         1 [   7.63m,    7.63m]    7.63m   0.00ns    7.63m         1 [   1.19m,    1.19m]    1.19m   0.00ns    1.19m
              'objective_lb_search':         1 [   7.63m,    7.63m]    7.63m   0.00ns    7.63m         1 [   2.12m,    2.12m]    2.12m   0.00ns    2.12m
       'objective_lb_search_max_lp':         1 [   7.63m,    7.63m]    7.63m   0.00ns    7.63m         1 [   2.53m,    2.53m]    2.53m   0.00ns    2.53m
        'objective_lb_search_no_lp':         1 [   7.63m,    7.63m]    7.63m   0.00ns    7.63m         1 [  59.43s,   59.43s]   59.43s   0.00ns   59.43s
  'objective_shaving_search_max_lp':       202 [  8.47ms,    9.39s]    2.26s    1.64s    7.59m       195 [105.42us,    1.64s] 343.19ms 278.50ms    1.12m
   'objective_shaving_search_no_lp':       203 [ 10.91ms,    9.39s]    2.25s    1.65s    7.60m       196 [105.42us, 959.80ms] 204.74ms 156.80ms   40.13s
                          'probing':         1 [   7.63m,    7.63m]    7.63m   0.00ns    7.63m         1 [   1.99m,    1.99m]    1.99m   0.00ns    1.99m
                   'probing_max_lp':         1 [   7.63m,    7.63m]    7.63m   0.00ns    7.63m         1 [   1.27m,    1.27m]    1.27m   0.00ns    1.27m
                     'pseudo_costs':         1 [   7.63m,    7.63m]    7.63m   0.00ns    7.63m         1 [   1.79m,    1.79m]    1.79m   0.00ns    1.79m
                    'quick_restart':         1 [   7.63m,    7.63m]    7.63m   0.00ns    7.63m         1 [   2.69m,    2.69m]    2.69m   0.00ns    2.69m
              'quick_restart_no_lp':         1 [   7.63m,    7.63m]    7.63m   0.00ns    7.63m         1 [   2.29m,    2.29m]    2.29m   0.00ns    2.29m
                    'reduced_costs':         1 [   7.63m,    7.63m]    7.63m   0.00ns    7.63m         1 [   1.76m,    1.76m]    1.76m   0.00ns    1.76m
                        'rins/rens':       725 [171.36us,    1.26s] 552.38ms 349.70ms    6.67m       621 [ 10.00ns, 107.04ms]  74.58ms  35.86ms   46.31s
                      'rnd_cst_lns':       725 [  4.06ms,    1.89s] 808.23ms 425.18ms    9.77m       712 [ 10.00ns, 176.22ms]  69.66ms  47.57ms   49.60s
                      'rnd_var_lns':       725 [  5.88ms,    1.87s] 811.83ms 381.74ms    9.81m       717 [ 10.00ns, 147.49ms]  69.89ms  44.60ms   50.11s
         'scheduling_intervals_lns':       725 [  1.79ms,    1.93s]    1.18s 270.87ms   14.20m       704 [ 25.50ms, 129.63ms] 107.93ms  15.64ms    1.27m
       'scheduling_precedences_lns':       725 [  1.62ms,    1.94s]    1.18s 268.88ms   14.22m       703 [ 28.15ms, 162.16ms] 108.58ms  15.04ms    1.27m
       'scheduling_time_window_lns':       725 [  2.36ms,    2.06s]    1.18s 278.32ms   14.23m       704 [ 17.35ms, 129.58ms] 107.87ms  15.71ms    1.27m
                     'violation_ls':       725 [  8.42ms, 212.66ms]  89.34ms  34.44ms    1.08m       725 [820.00ns, 172.08ms]  78.07ms  33.74ms   56.60s
                     'violation_ls':       725 [ 16.63ms, 215.91ms]  75.96ms  28.30ms   55.07s       725 [960.00ns, 165.98ms]  66.77ms  27.24ms   48.41s

Search stats                        Bools  Conflicts  Branches  Restarts   BoolPropag  IntegerPropag
                           'core':  6'553     95'180   195'541     9'963  224'377'044    192'539'489
                     'default_lp':  2'276     79'659   337'703    35'905   55'845'895    168'360'830
                          'fixed':  2'621    243'195   300'567     1'132   96'452'424    214'105'883
                      'fs_random':    112          0         0         0            0              0
                      'fs_random':    112          0       130       130           12          7'550
                'fs_random_no_lp':    115          1       227       224           60         13'649
        'fs_random_quick_restart':    112          0         0         0            0              0
        'fs_random_quick_restart':    112          0       224       224           12         12'592
  'fs_random_quick_restart_no_lp':    112          0         0         0            0              0
                 'lb_tree_search':    133        357   448'875   129'649    1'961'748     77'395'998
                         'max_lp':    112     56'586   331'763    43'518    3'137'895    169'926'245
                          'no_lp':  1'848    159'534   363'768    26'103   76'561'948    289'469'516
            'objective_lb_search':    316     38'173   404'225    71'521    4'853'677    171'262'214
     'objective_lb_search_max_lp':    307     23'778   497'648   104'025    4'729'902    163'968'420
      'objective_lb_search_no_lp':  1'081    128'654   289'553    25'212   29'233'011    249'730'330
                        'probing':    939        646     4'858     3'197       88'146        924'420
                 'probing_max_lp':    939        694     3'646     2'550       81'272        842'563
                   'pseudo_costs':    156     74'423   354'147    54'344    3'476'789    173'909'700
                  'quick_restart':  2'322     51'561   469'114    47'880   63'128'192    131'473'198
            'quick_restart_no_lp':  5'044    189'691   656'305    36'158  198'837'994    256'453'964
                  'reduced_costs':  1'909     85'270   414'320    44'784   52'059'050    165'998'894

SAT stats                           ClassicMinim  LitRemoved  LitLearned  LitForgotten  Subsumed  MClauses  MDecisions  MLitTrue  MSubsumed  MLitRemoved  MReused
                           'core':        91'534     914'664     834'778        13'531       248     4'235      20'682         0        585        1'760       32
                     'default_lp':        65'914     349'202     979'350       430'807     1'054    20'223     180'232         0      9'246       66'852    2'707
                          'fixed':       161'756   1'116'241   5'459'078       588'931       333       431       3'748         0        374        4'071       39
                      'fs_random':             0           0           0             0         0         0           0         0          0            0        0
                      'fs_random':             0           0           0             0         0         0           0         0          0            0        0
                'fs_random_no_lp':             0           0           2             0         0         0           0         0          0            0        0
        'fs_random_quick_restart':             0           0           0             0         0         0           0         0          0            0        0
        'fs_random_quick_restart':             0           0           0             0         0         0           0         0          0            0        0
  'fs_random_quick_restart_no_lp':             0           0           0             0         0         0           0         0          0            0        0
                 'lb_tree_search':            31          76       1'356             0         0    56'473     286'173         0         82          305    4'266
                         'max_lp':        44'600     180'938     691'938       289'634     1'214    22'279     255'642         0      4'193       31'343    3'565
                          'no_lp':       142'839     902'103   2'356'249     1'770'787     1'255    13'394     125'772         0      5'170       37'426    1'764
            'objective_lb_search':        33'291     152'647     362'857        25'900       732    35'624     336'355         0      4'110       28'318    6'612
     'objective_lb_search_max_lp':        20'246      88'432     228'190         4'194       526    42'709     411'890         0      2'558       16'406   10'193
      'objective_lb_search_no_lp':       118'857     739'364   1'219'877       227'684     1'022    15'303     126'461        13      9'926       70'629    1'756
                        'probing':             0           0         646             0         0         0           0         0          0            0        0
                 'probing_max_lp':             1           1         695             0         0         0           0         0          0            0        0
                   'pseudo_costs':        63'111     292'470   1'052'305       502'476     1'040    26'041     241'214         0      3'143       23'061    4'264
                  'quick_restart':        40'133     193'404     503'432        97'813     1'497    30'147     313'533         6     20'048      175'373    4'175
            'quick_restart_no_lp':       158'697   1'185'310   2'719'101     1'099'970       818    12'792     123'989         9     10'447      100'216      789
                  'reduced_costs':        73'560     436'362   1'252'719       690'587       932    20'055     176'354        39      9'041       61'942    2'320

Lp stats                         Component  Iterations  AddedCuts  OPTIMAL  DUAL_F.  DUAL_U.
                  'default_lp':          1   1'045'063    113'703  144'894        0        1
                       'fixed':          1     123'181      2'954  246'103        0        0
                   'fs_random':          1           0          0        0        0        0
                   'fs_random':          1           0          0        0        0        0
     'fs_random_quick_restart':          1           0          0        0        0        0
     'fs_random_quick_restart':          1         428        597        9        0        0
              'lb_tree_search':          1   3'010'413     26'085  118'629   40'784        0
                      'max_lp':          1   1'581'198     61'465   92'884   73'338       26
         'objective_lb_search':          1   1'471'269     44'600   97'601        0        0
  'objective_lb_search_max_lp':          1   1'720'008     27'754   59'006   16'846       32
                     'probing':          1     680'152     21'570   14'798        1        0
              'probing_max_lp':          1     241'698     63'573   12'048      555        0
                'pseudo_costs':          1   1'502'702    113'501  113'978   82'592       28
               'quick_restart':          1   1'441'503     29'885   76'193        0        1
               'reduced_costs':          1   1'322'272    117'523  116'476   72'503       15

Lp dimension                                                                      Final dimension of first component
                  'default_lp':   745 rows, 507 columns, 2254 entries with magnitude in [2.154060e-03, 1.000000e+00]
                       'fixed':   373 rows, 507 columns, 1614 entries with magnitude in [3.560094e-02, 1.000000e+00]
                   'fs_random':        0 rows, 507 columns, 0 entries with magnitude in [0.000000e+00, 0.000000e+00]
                   'fs_random':        0 rows, 507 columns, 0 entries with magnitude in [0.000000e+00, 0.000000e+00]
     'fs_random_quick_restart':        0 rows, 507 columns, 0 entries with magnitude in [0.000000e+00, 0.000000e+00]
     'fs_random_quick_restart':   322 rows, 507 columns, 1421 entries with magnitude in [3.560094e-02, 1.000000e+00]
              'lb_tree_search':   713 rows, 515 columns, 2527 entries with magnitude in [2.464175e-03, 1.000000e+00]
                      'max_lp':   671 rows, 515 columns, 2264 entries with magnitude in [5.201088e-03, 1.000000e+00]
         'objective_lb_search':   624 rows, 507 columns, 1233 entries with magnitude in [1.683465e-02, 1.000000e+00]
  'objective_lb_search_max_lp':   930 rows, 515 columns, 2774 entries with magnitude in [1.307287e-02, 1.000000e+00]
                     'probing':  1049 rows, 507 columns, 5382 entries with magnitude in [5.256215e-03, 1.000000e+00]
              'probing_max_lp':  1755 rows, 515 columns, 8571 entries with magnitude in [1.082431e-04, 1.000000e+00]
                'pseudo_costs':   670 rows, 515 columns, 1612 entries with magnitude in [5.549055e-03, 1.000000e+00]
               'quick_restart':  1011 rows, 507 columns, 2889 entries with magnitude in [2.194627e-05, 1.000000e+00]
               'reduced_costs':   545 rows, 515 columns, 1807 entries with magnitude in [1.109168e-02, 1.000000e+00]

Lp debug                         CutPropag  CutEqPropag   Adjust  Overflow         Bad  BadScaling
                  'default_lp':         48          135   93'371         0   1'715'858           0
                       'fixed':          0            0  159'499         0      12'908           0
                   'fs_random':          0            0        0         0           0           0
                   'fs_random':          0            0        0         0           0           0
     'fs_random_quick_restart':          0            0        0         0           0           0
     'fs_random_quick_restart':          0            0        0         0       1'490           0
              'lb_tree_search':         64           31  102'868         0   1'179'880           0
                      'max_lp':         39           22   88'054         0   1'222'706           0
         'objective_lb_search':         42           46   57'453         0   1'340'084           0
  'objective_lb_search_max_lp':         56           23   43'272         0   1'168'159           0
                     'probing':         91          129   14'263         0  20'760'407           0
              'probing_max_lp':        220          557    5'738         0  13'662'981           0
                'pseudo_costs':        122           91  107'228         0   1'903'906           0
               'quick_restart':        132           97   51'096         0   3'866'518           0
               'reduced_costs':         91           31  112'215         0   1'806'831           0

Lp pool                          Constraints  Updates  Simplif  Merged  Shortened    Split  Strenghtened        Cuts/Call
                  'default_lp':        9'006    4'174   92'361   1'161     15'281   31'470        34'942  113'703/312'493
                       'fixed':        3'416       65      677       2          0       33           832      2'954/9'868
                   'fs_random':          464        0        0       0          0        0             0              0/0
                   'fs_random':          464        0        0       0          0        0            10              0/0
     'fs_random_quick_restart':        1'061        0        0       0          0        0            41        597/1'153
     'fs_random_quick_restart':          464        0        0       0          0        0             0              0/0
              'lb_tree_search':       14'241    3'079  299'491     259     17'766   16'298       178'838   26'085/111'841
                      'max_lp':       14'082    2'851  233'234     798     15'865   25'527       173'579   61'465/166'744
         'objective_lb_search':        9'445    3'302   77'559     619     16'868   21'785        27'337   44'600/166'849
  'objective_lb_search_max_lp':       14'860    2'916  305'801     309     21'936   23'009       183'484    27'754/89'095
                     'probing':       10'015    4'192  210'174      19      7'889   71'311        13'787    21'570/60'025
              'probing_max_lp':       14'923   10'793  307'720      65     16'869   74'038       135'293   63'573/177'777
                'pseudo_costs':       13'651    3'468  387'796   1'265     25'681   29'104       206'703  113'501/277'009
               'quick_restart':       10'208    5'262  327'771     141     16'522  168'571        38'211   29'885/130'199
               'reduced_costs':       13'448    3'271  372'536   1'490     16'978   32'885       233'368  117'523/291'812

Lp Cut                                                fs_ran  defaul  fixed  max_lp  quick_  reduce  pseudo  lb_tre  probin  object  probin  object
                                              CG_FF:      55   4'317    274   2'664     388   7'224   5'946     632     454   1'112   1'085     613
                                               CG_K:      44   2'917    171   1'871     210   5'461   4'063     458     105     790     802     444
                                              CG_KL:       -       -      -       3       -       2       2       1       -       -       -       -
                                               CG_R:      32   3'184    150   1'416     308   5'106   3'746     372     144     679   1'327     411
                                              CG_RB:      18  11'244    437   5'738   1'904  14'449  12'790   1'305   1'458   2'982   1'204   1'213
                                             CG_RBP:       1   1'554     45     809     143   2'564   2'179     127     140     326     288     138
                                             Clique:       -       -      -     349       -     931     855     273       -       -     208     295
                                                 IB:     151  36'275    676  11'898   7'539  16'604  18'098   3'873   4'525  13'201   2'704   3'712
                                           MIR_1_FF:      92   5'555    212   2'908   1'610   6'593   5'474   1'409   1'047   2'695   1'646   1'583
                                            MIR_1_K:       6     967     18     889     201   1'555   1'787     346      93     427     413     399
                                           MIR_1_KL:       -     238      -     122      19     145     177      22      68       -      83       2
                                            MIR_1_R:      29   1'352     67     492     200   2'208   1'320     187      85     539     355     268
                                           MIR_1_RB:      38  10'132    199   8'051   2'903  12'868  13'385   4'101   1'578   4'705   5'404   4'500
                                          MIR_1_RBP:       2     475      9   1'287      53   1'645   1'788     487      42     119     593     421
                                          MIR_1_RLT:       -       -      -      21       -      52      18       8       -       -      15       6
                                           MIR_2_FF:      33   3'350    108   1'626     729   3'551   3'356     661     383   1'447     735     807
                                            MIR_2_K:       9     811     29     434     113     901     988     126      79     287     128     169
                                           MIR_2_KL:       -     177      -     105      16     101     195      25      45       6      46       5
                                            MIR_2_R:       9     823     41     320     141   1'159     893     139      93     334     338     169
                                           MIR_2_RB:      15   5'739    113   3'542   1'609   5'702   6'489   1'503     821   2'633   1'849   1'859
                                          MIR_2_RBP:       2     494     10     445      78     724     846     132      51     124     166     148
                                           MIR_3_FF:       8   1'982     38   1'070     468   2'252   2'222     505     196     875     476     581
                                            MIR_3_K:       2     631     17     349     114     763     754     144      72     251     182     166
                                           MIR_3_KL:       -     160      -      94      19      96     181      15      35       9      34       8
                                            MIR_3_R:       5     564     20     275     139     651     621     152      62     255     423     165
                                           MIR_3_RB:       8   3'502     52   2'077   1'038   3'342   3'674     966     525   1'497   1'312   1'090
                                          MIR_3_RBP:       2     321      3     280      65     448     524     121      42      78     159      97
                                           MIR_4_FF:       3   1'232     19     634     302   1'244   1'232     297     134     555     243     315
                                            MIR_4_K:       -     544      7     296      99     515     551     113      58     207     130     122
                                           MIR_4_KL:       -     174      2      97      40     102     183      21      28      23      37      23
                                            MIR_4_R:       1     469      9     153     109     344     352      86      47     200     173     108
                                           MIR_4_RB:       3   2'007     34   1'170     624   1'902   2'091     551     358     938     758     551
                                          MIR_4_RBP:       -     205      1     143      32     285     271      57      35      49      89      71
                                           MIR_5_FF:       2     673      9     393     190     647     750     214      93     344     207     187
                                            MIR_5_K:       3     340      4     210      58     340     369      78      33     119      89      92
                                           MIR_5_KL:       -     114      2      52      30      77     116      21      23      24      22      12
                                            MIR_5_R:       -     289      5     112      91     201     243      67      26     171     153      90
                                           MIR_5_RB:       1   1'284     16     751     416   1'122   1'216     317     214     548     463     334
                                          MIR_5_RBP:       2     145      1      91      31     120     145      32      14      31      47      29
                                           MIR_6_FF:       -     407      2     219     113     366     396     105      43     220     123     113
                                            MIR_6_K:       -     225      -     102      47     202     231      44      23      73      80      49
                                           MIR_6_KL:       -      86      -      30      31      58      68      13       9      25      18      12
                                            MIR_6_R:       -     203      2      64      47     127     129      36      23     103      87      42
                                           MIR_6_RB:       -     710      4     412     203     596     784     192     122     304     269     183
                                          MIR_6_RBP:       -     118      -      55      28      98     125      21      20      33      54      16
         NoOverlapCompletionTimeExhaustive_weighted:       -       -      -     196       -     478     407      47       -       -      44      76
  NoOverlapCompletionTimeExhaustive_weighted_lifted:       -       -      -       2       -       -       4       -       -       -       1       1
                        NoOverlapDisjunctionOnStart:       -       -      -      81       -     239     207      10       -       -      13      23
                                       ZERO_HALF_FF:       7     813     38     531     114   1'354   1'218     151      84     326     196     233
                                        ZERO_HALF_K:       1     185      5     202      25     472     402      71      10      77      52     106
                                       ZERO_HALF_KL:       -       1      -       -       -       -       -       -       -       -       -       -
                                        ZERO_HALF_R:       5   4'818     53   4'049   6'004   5'930   5'896   4'429   6'905   3'784  36'067   4'490
                                       ZERO_HALF_RB:       6   1'614     45   1'823   1'011   2'947   3'056     903     957     901   1'628   1'060
                                      ZERO_HALF_RBP:       2     283      7     462     233     660     688     119     168     174     555     147

LNS stats                        Improv/Calls  Closed  Difficulty  TimeLimit
               'graph_arc_lns':        17/724     52%        1.00       0.13
               'graph_cst_lns':        19/722     52%        1.00       0.12
               'graph_dec_lns':        17/725     52%        1.00       0.12
               'graph_var_lns':        13/725     52%        1.00       0.12
                   'rins/rens':        75/693     51%        0.93       0.10
                 'rnd_cst_lns':        13/724     52%        1.00       0.13
                 'rnd_var_lns':        12/725     52%        1.00       0.12
    'scheduling_intervals_lns':        25/724     22%        0.00       0.13
  'scheduling_precedences_lns':        25/724     20%        0.00       0.13
  'scheduling_time_window_lns':        26/724     23%        0.00       0.13

LS stats                   Batches  Restarts   LinMoves  GenMoves  CompoundMoves  WeightUpdates
       'fj_long_default':        1         1      9'917         0              0             83
   'fj_long_lin_default':        1         1          0     1'904            444              0
        'fj_long_random':        1         1      9'842         0              0            158
      'fj_short_default':        2         1          0     4'192            649              1
  'fj_short_lin_default':        1         1          0     1'854            376              0
   'fj_short_lin_random':        1         1          0     1'944            493              0
       'fj_short_random':        1         1          0     2'099            411              0
          'violation_ls':      725         0  3'058'323   828'931         50'020      1'192'542
          'violation_ls':      725         0  4'250'962   427'580         33'782      1'028'175

Solutions (31)                   Num     Rank
               'graph_arc_lns':    1    [5,5]
               'graph_var_lns':    2    [4,8]
                       'no_lp':    8  [13,25]
   'objective_lb_search_no_lp':    1    [1,1]
                'pseudo_costs':    1  [29,29]
         'quick_restart_no_lp':    7  [10,19]
                 'rins_lp_lns':    2  [28,31]
                 'rnd_cst_lns':    2  [20,30]
  'scheduling_precedences_lns':    1  [26,26]
  'scheduling_time_window_lns':    1  [27,27]
                'violation_ls':    5    [2,9]

Objective bounds                     Num
                  'initial_domain':    1
                  'lb_tree_search':  116
             'objective_lb_search':    8
      'objective_lb_search_max_lp':   10
       'objective_lb_search_no_lp':   75
  'objective_shaving_search_no_lp':    1
                   'reduced_costs':    2

Solution repositories     Added  Queried  Ignored  Synchro
  'feasible solutions':   6'961   16'484        4    6'666
        'lp solutions':   3'154      366        0    2'692
                'pump':  15'028      359

Improving bounds shared            Num
                        'core':      1
                  'default_lp':    702
              'lb_tree_search':    161
                      'max_lp':    326
                       'no_lp':    183
         'objective_lb_search':    488
  'objective_lb_search_max_lp':    218
   'objective_lb_search_no_lp':    229
                     'probing':  2'764
              'probing_max_lp':  1'417
                'pseudo_costs':  1'830
               'quick_restart':    836
         'quick_restart_no_lp':  7'200
               'reduced_costs':    598

Clauses shared                   Num
                        'core':    2
                  'default_lp':   55
              'lb_tree_search':   60
                      'max_lp':   56
                       'no_lp':   57
         'objective_lb_search':   32
  'objective_lb_search_max_lp':   42
   'objective_lb_search_no_lp':   20
              'probing_max_lp':    1
                'pseudo_costs':  188
               'quick_restart':   30
         'quick_restart_no_lp':   39
               'reduced_costs':  164

CpSolverResponse summary:
status: OPTIMAL
objective: 1453
best_bound: 1453
integers: 509
booleans: 112
conflicts: 0
branches: 224
propagations: 12
integer_propagations: 12592
restarts: 224
lp_iterations: 428
walltime: 458.693
usertime: 458.693
deterministic_time: 2939.63
gap_integral: 5440.05
solution_fingerprint: 0x454c89664b25eb2


--- Simulation Gantt  partir du modle mathmatique ---
