created virtual environment CPython3.12.4.final.0-64 in 405ms
  creator CPython3Posix(dest=/localscratch/aneumann.46806183.0/env, clear=False, no_vcs_ignore=False, global=False)
  seeder FromAppData(download=False, pip=bundle, via=copy, app_data_dir=/home/aneumann/.local/share/virtualenv)
    added seed packages: pip==24.2+computecanada
  activators BashActivator,CShellActivator,FishActivator,NushellActivator,PowerShellActivator,PythonActivator
Looking in links: /cvmfs/soft.computecanada.ca/custom/python/wheelhouse/gentoo2023/x86-64-v3, /cvmfs/soft.computecanada.ca/custom/python/wheelhouse/gentoo2023/generic, /cvmfs/soft.computecanada.ca/custom/python/wheelhouse/generic
Requirement already satisfied: pip in /localscratch/aneumann.46806183.0/env/lib/python3.12/site-packages (24.2+computecanada)
Processing /cvmfs/soft.computecanada.ca/custom/python/wheelhouse/generic/pip-25.0+computecanada-py3-none-any.whl
Installing collected packages: pip
  Attempting uninstall: pip
    Found existing installation: pip 24.2+computecanada
    Uninstalling pip-24.2+computecanada:
      Successfully uninstalled pip-24.2+computecanada
Successfully installed pip-24.2+computecanada
Looking in links: /cvmfs/soft.computecanada.ca/custom/python/wheelhouse/gentoo2023/x86-64-v3, /cvmfs/soft.computecanada.ca/custom/python/wheelhouse/gentoo2023/generic, /cvmfs/soft.computecanada.ca/custom/python/wheelhouse/generic
ERROR: protobuf-5.28.3-cp38-abi3-manylinux2014_x86_64.whl is not a supported wheel on this platform.
Looking in links: /cvmfs/soft.computecanada.ca/custom/python/wheelhouse/gentoo2023/x86-64-v3, /cvmfs/soft.computecanada.ca/custom/python/wheelhouse/gentoo2023/generic, /cvmfs/soft.computecanada.ca/custom/python/wheelhouse/generic
Processing /home/aneumann/projects/def-adhaj/aneumann/GNRS/wheels/immutabledict-4.2.0-py3-none-any.whl
Installing collected packages: immutabledict
Successfully installed immutabledict-4.2.0
Looking in links: /cvmfs/soft.computecanada.ca/custom/python/wheelhouse/gentoo2023/x86-64-v3, /cvmfs/soft.computecanada.ca/custom/python/wheelhouse/gentoo2023/generic, /cvmfs/soft.computecanada.ca/custom/python/wheelhouse/generic
Processing /cvmfs/soft.computecanada.ca/custom/python/wheelhouse/generic/ortools-9.10.4067+computecanada-cp312-cp312-linux_x86_64.whl (from -r /home/aneumann/projects/def-adhaj/aneumann/GNRS/requirements/or.txt (line 1))
Processing /cvmfs/soft.computecanada.ca/custom/python/wheelhouse/gentoo2023/x86-64-v3/matplotlib-3.10.0+computecanada-cp312-cp312-linux_x86_64.whl (from -r /home/aneumann/projects/def-adhaj/aneumann/GNRS/requirements/or.txt (line 2))
Processing /cvmfs/soft.computecanada.ca/custom/python/wheelhouse/gentoo2023/x86-64-v3/pandas-2.2.3+computecanada-cp312-cp312-linux_x86_64.whl (from -r /home/aneumann/projects/def-adhaj/aneumann/GNRS/requirements/or.txt (line 3))
Processing /cvmfs/soft.computecanada.ca/custom/python/wheelhouse/generic/absl_py-2.3.0+computecanada-py3-none-any.whl (from ortools<9.11,>=9.10->-r /home/aneumann/projects/def-adhaj/aneumann/GNRS/requirements/or.txt (line 1))
Processing /cvmfs/soft.computecanada.ca/custom/python/wheelhouse/gentoo2023/generic/numpy-2.2.2+computecanada-cp312-cp312-linux_x86_64.whl (from ortools<9.11,>=9.10->-r /home/aneumann/projects/def-adhaj/aneumann/GNRS/requirements/or.txt (line 1))
Processing /cvmfs/soft.computecanada.ca/custom/python/wheelhouse/gentoo2023/x86-64-v3/protobuf-6.31.1+computecanada-cp312-cp312-linux_x86_64.whl (from ortools<9.11,>=9.10->-r /home/aneumann/projects/def-adhaj/aneumann/GNRS/requirements/or.txt (line 1))
Requirement already satisfied: immutabledict>=3.0.0 in /localscratch/aneumann.46806183.0/env/lib/python3.12/site-packages (from ortools<9.11,>=9.10->-r /home/aneumann/projects/def-adhaj/aneumann/GNRS/requirements/or.txt (line 1)) (4.2.0)
Processing /cvmfs/soft.computecanada.ca/custom/python/wheelhouse/gentoo2023/generic/contourpy-1.3.1+computecanada-cp312-cp312-linux_x86_64.whl (from matplotlib->-r /home/aneumann/projects/def-adhaj/aneumann/GNRS/requirements/or.txt (line 2))
Processing /cvmfs/soft.computecanada.ca/custom/python/wheelhouse/generic/cycler-0.12.1+computecanada-py3-none-any.whl (from matplotlib->-r /home/aneumann/projects/def-adhaj/aneumann/GNRS/requirements/or.txt (line 2))
Processing /cvmfs/soft.computecanada.ca/custom/python/wheelhouse/generic/fonttools-4.59.0+computecanada-cp312-cp312-linux_x86_64.whl (from matplotlib->-r /home/aneumann/projects/def-adhaj/aneumann/GNRS/requirements/or.txt (line 2))
Processing /cvmfs/soft.computecanada.ca/custom/python/wheelhouse/gentoo2023/x86-64-v3/kiwisolver-1.4.8+computecanada-cp312-cp312-linux_x86_64.whl (from matplotlib->-r /home/aneumann/projects/def-adhaj/aneumann/GNRS/requirements/or.txt (line 2))
Processing /cvmfs/soft.computecanada.ca/custom/python/wheelhouse/generic/packaging-25.0+computecanada-py3-none-any.whl (from matplotlib->-r /home/aneumann/projects/def-adhaj/aneumann/GNRS/requirements/or.txt (line 2))
Processing /cvmfs/soft.computecanada.ca/custom/python/wheelhouse/gentoo2023/x86-64-v3/pillow-11.1.0+computecanada-cp312-cp312-linux_x86_64.whl (from matplotlib->-r /home/aneumann/projects/def-adhaj/aneumann/GNRS/requirements/or.txt (line 2))
Processing /cvmfs/soft.computecanada.ca/custom/python/wheelhouse/generic/pyparsing-3.2.3+computecanada-py3-none-any.whl (from matplotlib->-r /home/aneumann/projects/def-adhaj/aneumann/GNRS/requirements/or.txt (line 2))
Processing /cvmfs/soft.computecanada.ca/custom/python/wheelhouse/generic/python_dateutil-2.9.0.post0+computecanada-py2.py3-none-any.whl (from matplotlib->-r /home/aneumann/projects/def-adhaj/aneumann/GNRS/requirements/or.txt (line 2))
Processing /cvmfs/soft.computecanada.ca/custom/python/wheelhouse/generic/pytz-2025.2+computecanada-py2.py3-none-any.whl (from pandas->-r /home/aneumann/projects/def-adhaj/aneumann/GNRS/requirements/or.txt (line 3))
Processing /cvmfs/soft.computecanada.ca/custom/python/wheelhouse/generic/tzdata-2025.2+computecanada-py2.py3-none-any.whl (from pandas->-r /home/aneumann/projects/def-adhaj/aneumann/GNRS/requirements/or.txt (line 3))
Processing /cvmfs/soft.computecanada.ca/custom/python/wheelhouse/generic/six-1.17.0+computecanada-py2.py3-none-any.whl (from python-dateutil>=2.7->matplotlib->-r /home/aneumann/projects/def-adhaj/aneumann/GNRS/requirements/or.txt (line 2))
Installing collected packages: pytz, tzdata, six, pyparsing, protobuf, pillow, packaging, numpy, kiwisolver, fonttools, cycler, absl-py, python-dateutil, contourpy, pandas, matplotlib, ortools
Successfully installed absl-py-2.3.0+computecanada contourpy-1.3.1+computecanada cycler-0.12.1+computecanada fonttools-4.59.0+computecanada kiwisolver-1.4.8+computecanada matplotlib-3.10.0+computecanada numpy-2.2.2+computecanada ortools-9.10.4067+computecanada packaging-25.0+computecanada pandas-2.2.3+computecanada pillow-11.1.0+computecanada protobuf-6.31.1+computecanada pyparsing-3.2.3+computecanada python-dateutil-2.9.0.post0+computecanada pytz-2025.2+computecanada six-1.17.0+computecanada tzdata-2025.2+computecanada

Starting CP-SAT solver v9.10.4067
Parameters: max_time_in_seconds: 86400 max_memory_in_mb: 185000 log_search_progress: true enumerate_all_solutions: false num_search_workers: 32 absolute_gap_limit: 0 relative_gap_limit: 0

Initial optimization model '': (model_fingerprint: 0xa7179eca10270738)
#Variables: 362 (#ints: 9 in objective)
  - 269 Booleans in [0,1]
  - 93 in [0,762]
#kLinear1: 47
#kLinear2: 522
#kLinear3: 202
#kLinearN: 5'132 (#terms: 87'757)

Starting presolve at 0.00s
  2.53e-03s  0.00e+00d  [DetectDominanceRelations] 
  3.90e-02s  0.00e+00d  [PresolveToFixPoint] #num_loops=8 #num_dual_strengthening=3 
  3.68e-05s  0.00e+00d  [ExtractEncodingFromLinear] #potential_supersets=1 
[Symmetry] Graph for symmetry has 5'840 nodes and 68'793 arcs.
[Symmetry] Symmetry computation done. time: 0.00201525 dtime: 0.00474244
[Symmetry] #generators: 1, average support size: 18
[Symmetry] The model contains 268 duplicate constraints !
[Symmetry] 9 orbits with sizes: 2,2,2,2,2,2,2,2,2
[Symmetry] Num fixable by intersecting at_most_one with orbits: 1 largest_orbit: 2
  1.52e-02s  3.87e-03d  [Probe] #probed=382 #new_bounds=15 #equiv=1 
  8.02e-05s  0.00e+00d  [MaxClique] Merged 6(12 literals) into 3(6 literals) at_most_ones. 
  2.39e-03s  0.00e+00d  [DetectDominanceRelations] 
  1.86e-02s  0.00e+00d  [PresolveToFixPoint] #num_loops=5 #num_dual_strengthening=3 
  7.99e-03s  0.00e+00d  [ProcessAtMostOneAndLinear] 
  2.95e-03s  0.00e+00d  [DetectDuplicateConstraints] #duplicates=339 #without_enforcements=128 
  3.74e-03s  3.93e-04d  [DetectDominatedLinearConstraints] #relevant_constraints=4'516 #num_inclusions=3'505 
  4.60e-04s  0.00e+00d  [DetectDifferentVariables] #different=23 #cliques=1 #size=6 
  4.96e-04s  0.00e+00d  [ProcessSetPPC] #relevant_constraints=4'063 
  1.90e-05s  0.00e+00d  [FindAlmostIdenticalLinearConstraints] 
  1.80e-05s  0.00e+00d  [FindBigAtMostOneAndLinearOverlap] 
  8.01e-03s  6.94e-03d  [FindBigVerticalLinearOverlap] #blocks=63 #saved_nz=11'568 
  4.50e-04s  2.37e-04d  [FindBigHorizontalLinearOverlap] #linears=3'976 
  2.02e-05s  0.00e+00d  [MergeClauses] 
  2.61e-03s  0.00e+00d  [DetectDominanceRelations] 
  2.37e-02s  0.00e+00d  [PresolveToFixPoint] #num_loops=2 #num_dual_strengthening=1 
  2.59e-03s  0.00e+00d  [DetectDominanceRelations] 
  1.41e-02s  0.00e+00d  [PresolveToFixPoint] #num_loops=1 #num_dual_strengthening=1 
[Symmetry] Graph for symmetry has 5'702 nodes and 56'051 arcs.
[Symmetry] Symmetry computation done. time: 0.000999655 dtime: 0.00297125
  1.39e-02s  3.43e-03d  [Probe] #probed=382 #new_bounds=53 
  1.96e-05s  0.00e+00d  [MaxClique] 
  3.85e-03s  0.00e+00d  [DetectDominanceRelations] 
  2.81e-02s  0.00e+00d  [PresolveToFixPoint] #num_loops=2 #num_dual_strengthening=1 
  7.39e-03s  0.00e+00d  [ProcessAtMostOneAndLinear] 
  2.59e-03s  0.00e+00d  [DetectDuplicateConstraints] #without_enforcements=176 
  2.11e-03s  2.14e-04d  [DetectDominatedLinearConstraints] #relevant_constraints=4'129 #num_inclusions=522 
  3.10e-04s  0.00e+00d  [DetectDifferentVariables] 
  4.51e-04s  0.00e+00d  [ProcessSetPPC] #relevant_constraints=3'730 
  3.28e-05s  3.30e-07d  [FindAlmostIdenticalLinearConstraints] #num_tested_pairs=22 
  1.30e-05s  0.00e+00d  [FindBigAtMostOneAndLinearOverlap] 
  6.26e-03s  5.02e-03d  [FindBigVerticalLinearOverlap] #blocks=107 #saved_nz=8'457 
  3.96e-04s  1.78e-04d  [FindBigHorizontalLinearOverlap] #linears=3'462 
  1.41e-05s  0.00e+00d  [MergeClauses] 
  2.28e-03s  0.00e+00d  [DetectDominanceRelations] 
  2.40e-02s  0.00e+00d  [PresolveToFixPoint] #num_loops=2 #num_dual_strengthening=1 
  2.25e-03s  0.00e+00d  [DetectDominanceRelations] 
  1.58e-02s  0.00e+00d  [PresolveToFixPoint] #num_loops=1 #num_dual_strengthening=1 
[Symmetry] Graph for symmetry has 6'002 nodes and 47'680 arcs.
[Symmetry] Symmetry computation done. time: 0.000950764 dtime: 0.00257523
  1.24e-02s  3.13e-03d  [Probe] #probed=382 #new_bounds=81 
  1.55e-05s  0.00e+00d  [MaxClique] 
  2.26e-03s  0.00e+00d  [DetectDominanceRelations] 
  2.18e-02s  0.00e+00d  [PresolveToFixPoint] #num_loops=2 #num_dual_strengthening=1 
  6.40e-03s  0.00e+00d  [ProcessAtMostOneAndLinear] 
  2.42e-03s  0.00e+00d  [DetectDuplicateConstraints] #without_enforcements=176 
  1.62e-03s  1.54e-04d  [DetectDominatedLinearConstraints] #relevant_constraints=4'111 #num_inclusions=36 
  3.06e-04s  0.00e+00d  [DetectDifferentVariables] 
  3.92e-04s  0.00e+00d  [ProcessSetPPC] #relevant_constraints=3'422 
  4.50e-05s  3.05e-06d  [FindAlmostIdenticalLinearConstraints] #num_tested_pairs=168 
  1.54e-05s  0.00e+00d  [FindBigAtMostOneAndLinearOverlap] 
  3.96e-03s  3.52e-03d  [FindBigVerticalLinearOverlap] #blocks=64 #saved_nz=4'455 
  3.49e-04s  1.47e-04d  [FindBigHorizontalLinearOverlap] #linears=3'100 
  1.44e-05s  0.00e+00d  [MergeClauses] 
  2.09e-03s  0.00e+00d  [DetectDominanceRelations] 
  2.14e-02s  0.00e+00d  [PresolveToFixPoint] #num_loops=2 #num_dual_strengthening=1 
  1.07e-04s  0.00e+00d  [ExpandObjective] #entries=1'029 #tight_variables=348 #tight_constraints=204 

Presolve summary:
  - 94 affine relations were detected.
  - rule 'TODO dual: only one blocking constraint?' was applied 658 times.
  - rule 'TODO dual: only one blocking enforced constraint?' was applied 130 times.
  - rule 'TODO dual: only one unspecified blocking constraint?' was applied 26 times.
  - rule 'TODO duplicate: identical constraint with different enforcements' was applied 480 times.
  - rule 'affine: new relation' was applied 94 times.
  - rule 'at_most_one: removed literals' was applied 3 times.
  - rule 'at_most_one: size one' was applied 3 times.
  - rule 'at_most_one: transformed into max clique.' was applied 1 time.
  - rule 'deductions: 366 stored' was applied 1 time.
  - rule 'dual: fix variable' was applied 24 times.
  - rule 'dual: reduced domain' was applied 43 times.
  - rule 'duplicate: merged rhs of linear constraint' was applied 67 times.
  - rule 'duplicate: removed constraint' was applied 339 times.
  - rule 'enforcement: false literal' was applied 14 times.
  - rule 'exactly_one: x and not(x)' was applied 1 time.
  - rule 'incompatible linear: add implication' was applied 45 times.
  - rule 'linear matrix: common vertical rectangle' was applied 234 times.
  - rule 'linear: always true' was applied 699 times.
  - rule 'linear: doubleton free' was applied 13 times.
  - rule 'linear: empty' was applied 40 times.
  - rule 'linear: extracted enforcement literal' was applied 8'554 times.
  - rule 'linear: fixed or dup variables' was applied 5'308 times.
  - rule 'linear: positive equal one' was applied 1 time.
  - rule 'linear: reduced variable domains' was applied 348 times.
  - rule 'linear: remapped using affine relations' was applied 5'439 times.
  - rule 'linear: simplified rhs' was applied 16'419 times.
  - rule 'linear: tightened into equality' was applied 8 times.
  - rule 'linear: variable substitution 1' was applied 13 times.
  - rule 'linear: variable substitution 2' was applied 1 time.
  - rule 'linear: variable substitution 3' was applied 4 times.
  - rule 'no_overlap: inferred from x != y constraints' was applied 1 time.
  - rule 'presolve: 104 unused variables removed.' was applied 1 time.
  - rule 'presolve: iteration' was applied 3 times.
  - rule 'probing: reduced enforced constraint to implication.' was applied 6 times.
  - rule 'symmetry: fixed to false in general orbit' was applied 1 time.

Presolved optimization model '': (model_fingerprint: 0xe82be6a9736d3dc3)
#Variables: 380 (#ints: 9 in objective)
  - 92 Booleans in [0,1]
  - 256 different domains in [-6792,8251] with a largest complexity of 15.
#kInterval: 6
#kLinear2: 822 (#enforced: 779 #multi: 603)
#kLinear3: 783 (#enforced: 559)
#kLinearN: 3'322 (#enforced: 3'213) (#terms: 30'320)
#kNoOverlap: 1 (#intervals: 6)

Preloading model.
#Bound   0.33s best:inf   next:[250,5922] initial_domain
[Symmetry] Graph for symmetry has 5'962 nodes and 43'277 arcs.
[Symmetry] Symmetry computation done. time: 0.000807582 dtime: 0.00236926
#Model   0.34s var:380/380 constraints:4934/4934

Starting search at 0.34s with 32 workers.
17 full problem subsolvers: [core, default_lp, fixed, lb_tree_search, max_lp, no_lp, objective_lb_search, objective_lb_search_max_lp, objective_lb_search_no_lp, objective_shaving_search_max_lp, objective_shaving_search_no_lp, probing, probing_max_lp, pseudo_costs, quick_restart, quick_restart_no_lp, reduced_costs]
13 first solution subsolvers: [fj_long_default, fj_long_lin_default, fj_long_random, fj_short_default, fj_short_lin_default, fj_short_lin_random, fj_short_random, fs_random(2), fs_random_no_lp, fs_random_quick_restart(2), fs_random_quick_restart_no_lp]
13 incomplete subsolvers: [feasibility_pump, graph_arc_lns, graph_cst_lns, graph_dec_lns, graph_var_lns, rins/rens, rnd_cst_lns, rnd_var_lns, scheduling_intervals_lns, scheduling_precedences_lns, scheduling_time_window_lns, violation_ls(2)]
3 helper subsolvers: [neighborhood_helper, synchronization_agent, update_gap_integral]
#Bound   0.43s best:inf   next:[251,5922] objective_shaving_search_no_lp (vars=380 csts=4935)
#Bound   0.44s best:inf   next:[259,5922] objective_lb_search_no_lp
#Bound   0.47s best:inf   next:[303,5922] fs_random
#Bound   0.47s best:inf   next:[348,5922] fs_random
#Bound   0.49s best:inf   next:[358,5922] fs_random
#Bound   0.51s best:inf   next:[365,5922] fs_random_quick_restart
#Bound   0.51s best:inf   next:[366,5922] fs_random_quick_restart
#Bound   0.51s best:inf   next:[368,5922] fs_random
#Bound   0.53s best:inf   next:[378,5922] fs_random_quick_restart
#1       0.53s best:2599  next:[378,2598] fs_random_quick_restart_no_lp (fixed_bools=0/116)
#Bound   0.53s best:2599  next:[389,2598] probing
#2       0.55s best:2363  next:[389,2362] no_lp (fixed_bools=0/127)
#Bound   0.56s best:2363  next:[412,2362] probing
#Bound   0.57s best:2363  next:[416,2362] probing
#3       0.57s best:2362  next:[416,2361] violation_ls(batch:2 #solutions_imported:2 #lin_moves:656 #lin_evals:6'527 #gen_moves:1'774 #gen_evals:216 #comp_moves:220 #backtracks:777 #weight_updates:151)
#4       0.58s best:2318  next:[416,2317] no_lp (fixed_bools=1/135)
#Bound   0.59s best:2318  next:[427,2317] probing
#5       0.59s best:2267  next:[427,2266] no_lp (fixed_bools=1/137)
#6       0.60s best:2254  next:[427,2253] no_lp (fixed_bools=1/141)
#7       0.60s best:2226  next:[427,2225] no_lp (fixed_bools=1/145)
#Bound   0.60s best:2226  next:[555,2225] reduced_costs
#Bound   0.60s best:2226  next:[557,2225] reduced_costs
#8       0.64s best:2221  next:[557,2220] quick_restart_no_lp (fixed_bools=0/175)
#9       0.64s best:2198  next:[557,2197] no_lp (fixed_bools=1/147)
#10      0.65s best:2165  next:[557,2164] no_lp (fixed_bools=1/149)
#11      0.66s best:2143  next:[557,2142] no_lp (fixed_bools=1/151)
#12      0.66s best:2136  next:[557,2135] no_lp (fixed_bools=1/153)
#Bound   0.71s best:2136  next:[559,2135] pseudo_costs
#Bound   0.71s best:2136  next:[560,2135] pseudo_costs
#Bound   0.71s best:2136  next:[660,2135] objective_lb_search_max_lp
#13      0.73s best:2127  next:[660,2126] no_lp (fixed_bools=1/158)
#14      0.75s best:2122  next:[660,2121] no_lp (fixed_bools=1/162)
#15      0.76s best:2112  next:[660,2111] no_lp (fixed_bools=1/166)
#16      0.77s best:2087  next:[660,2086] no_lp (fixed_bools=1/167)
#Bound   0.80s best:2087  next:[674,2086] objective_lb_search_no_lp
#Bound   0.81s best:2087  next:[689,2086] objective_lb_search_no_lp
#17      0.88s best:2086  next:[761,2085] violation_ls(batch:4 #solutions_imported:4 #lin_moves:10'289 #lin_evals:47'140 #gen_moves:4'589 #gen_evals:695 #comp_moves:423 #backtracks:2'083 #weight_updates:566)
#18      0.92s best:2082  next:[781,2081] no_lp (fixed_bools=1/171)
#Bound   0.92s best:2086  next:[781,2085] objective_lb_search_no_lp [skipped_logs=2]
#19      1.09s best:1988  next:[781,1987] rins_pump_lns (d=0.81 s=76 t=0.10 p=1.00 stall=2 h=auto_l0)
#20      1.19s best:1800  next:[794,1799] scheduling_time_window_lns (d=0.50 s=45 t=0.10 p=0.00 stall=0 h=auto_l0)
#21      1.21s best:1730  next:[794,1729] scheduling_precedences_lns (d=0.50 s=46 t=0.10 p=0.00 stall=0 h=auto_l0)
#Bound   1.75s best:1730  next:[1167,1729] objective_lb_search_no_lp [skipped_logs=5]
#Bound   2.72s best:1730  next:[1170,1729] objective_lb_search_no_lp [skipped_logs=0]
#Bound   3.29s best:1730  next:[1172,1729] objective_lb_search_no_lp [skipped_logs=0]
#Bound   4.73s best:1730  next:[1174,1729] objective_lb_search_no_lp [skipped_logs=1]
#Bound   5.96s best:1730  next:[1180,1729] objective_lb_search_no_lp [skipped_logs=2]
#Bound   6.60s best:1730  next:[1189,1729] objective_lb_search_no_lp [skipped_logs=3]
#Bound   7.65s best:1730  next:[1197,1729] objective_lb_search_no_lp [skipped_logs=2]
#Bound   8.60s best:1730  next:[1210,1729] objective_lb_search [skipped_logs=1]
#Bound   9.28s best:1730  next:[1251,1729] objective_lb_search [skipped_logs=0]
#Bound  10.80s best:1730  next:[1279,1729] objective_lb_search [skipped_logs=0]
#Bound  13.08s best:1730  next:[1282,1729] objective_lb_search
#Bound  14.57s best:1730  next:[1290,1729] objective_lb_search
#Bound  16.55s best:1730  next:[1291,1729] lb_tree_search (nodes=610/610 rc=5 decisions=11546 @root=22 restarts=10) 
#Bound  16.59s best:1730  next:[1292,1729] lb_tree_search (nodes=612/612 rc=5 decisions=11570 @root=22 restarts=10) 
#Bound  16.89s best:1730  next:[1293,1729] lb_tree_search (nodes=616/616 rc=5 decisions=11626 @root=23 restarts=10) 
#Bound  17.12s best:1730  next:[1294,1729] lb_tree_search (nodes=615/617 rc=5 decisions=11650 @root=24 restarts=10) 
#Bound  17.90s best:1730  next:[1297,1729] objective_lb_search_no_lp [skipped_logs=2]
#Bound  18.87s best:1730  next:[1300,1729] lb_tree_search (nodes=636/646 rc=5 decisions=11959 @root=30 restarts=10)  [skipped_logs=2]
#Bound  19.82s best:1730  next:[1314,1729] objective_lb_search_no_lp [skipped_logs=2]
#Bound  20.78s best:1730  next:[1315,1729] lb_tree_search (nodes=645/702 rc=5 decisions=12376 @root=35 restarts=10)  [skipped_logs=0]
#Bound  21.71s best:1730  next:[1339,1729] objective_lb_search_max_lp [skipped_logs=1]
#Bound  22.91s best:1730  next:[1346,1729] objective_lb_search [skipped_logs=2]
#Bound  23.55s best:1730  next:[1348,1729] lb_tree_search (nodes=757/841 rc=10 decisions=13385 @root=40 restarts=10)  [skipped_logs=1]
#Model  24.28s var:376/380 constraints:4717/4934
#Bound  24.38s best:1730  next:[1352,1729] objective_lb_search_max_lp [skipped_logs=0]
#Bound  25.72s best:1730  next:[1375,1729] objective_lb_search_max_lp [skipped_logs=1]
#Bound  27.98s best:1730  next:[1376,1729] lb_tree_search (nodes=879/879 rc=12 decisions=16016 @root=48 restarts=11) 
#Model  28.06s var:375/380 constraints:4704/4934
#Bound  28.16s best:1730  next:[1379,1729] objective_lb_search
#Bound  28.81s best:1730  next:[1389,1729] objective_lb_search_no_lp [skipped_logs=0]
#Bound  29.96s best:1730  next:[1399,1729] objective_lb_search_no_lp [skipped_logs=2]
#Model  30.34s var:373/380 constraints:4574/4934
#Model  30.44s var:361/380 constraints:3737/4934
#Model  30.56s var:357/380 constraints:3460/4934
#Model  30.58s var:353/380 constraints:3304/4934
#Model  30.97s var:349/380 constraints:2923/4934
#Bound  30.95s best:1730  next:[1535,1729] objective_lb_search_no_lp [skipped_logs=11]
#Model  31.03s var:344/380 constraints:2424/4934
#Model  31.03s var:334/380 constraints:1600/4934
#Done   31.03s no_lp
#Done   31.03s objective_lb_search_no_lp
#Done   31.04s core
#Model  31.04s var:315/380 constraints:595/4934
#Bound  31.03s best:1730  next:[1664,1729] objective_lb_search_no_lp [skipped_logs=4]

Task timing                                  n [     min,      max]      avg      dev     time         n [     min,      max]      avg      dev    dtime
                             'core':         1 [  30.69s,   30.69s]   30.69s   0.00ns   30.69s         1 [  48.32s,   48.32s]   48.32s   0.00ns   48.32s
                       'default_lp':         1 [  30.69s,   30.69s]   30.69s   0.00ns   30.69s         1 [  10.08s,   10.08s]   10.08s   0.00ns   10.08s
                 'feasibility_pump':        95 [  7.49ms, 374.89ms] 124.31ms  29.67ms   11.81s        94 [  2.33ms, 109.63ms]  30.78ms   8.67ms    2.89s
                            'fixed':         1 [  30.69s,   30.69s]   30.69s   0.00ns   30.69s         1 [   6.81s,    6.81s]    6.81s   0.00ns    6.81s
                  'fj_long_default':         1 [173.84ms, 173.84ms] 173.84ms   0.00ns 173.84ms         1 [116.66ms, 116.66ms] 116.66ms   0.00ns 116.66ms
              'fj_long_lin_default':         1 [184.66ms, 184.66ms] 184.66ms   0.00ns 184.66ms         1 [ 91.32ms,  91.32ms]  91.32ms   0.00ns  91.32ms
                   'fj_long_random':         1 [159.89ms, 159.89ms] 159.89ms   0.00ns 159.89ms         1 [ 94.25ms,  94.25ms]  94.25ms   0.00ns  94.25ms
                 'fj_short_default':         2 [ 45.50ms, 180.87ms] 113.18ms  67.68ms 226.37ms         2 [ 91.21ms,  93.14ms]  92.18ms 963.65us 184.35ms
             'fj_short_lin_default':         1 [122.54ms, 122.54ms] 122.54ms   0.00ns 122.54ms         1 [ 91.22ms,  91.22ms]  91.22ms   0.00ns  91.22ms
              'fj_short_lin_random':         1 [192.62ms, 192.62ms] 192.62ms   0.00ns 192.62ms         1 [ 90.21ms,  90.21ms]  90.21ms   0.00ns  90.21ms
                  'fj_short_random':         1 [147.68ms, 147.68ms] 147.68ms   0.00ns 147.68ms         1 [ 89.68ms,  89.68ms]  89.68ms   0.00ns  89.68ms
                        'fs_random':         1 [182.89ms, 182.89ms] 182.89ms   0.00ns 182.89ms         1 [645.71us, 645.71us] 645.71us   0.00ns 645.71us
                        'fs_random':         1 [188.98ms, 188.98ms] 188.98ms   0.00ns 188.98ms         1 [  5.73ms,   5.73ms]   5.73ms   0.00ns   5.73ms
                  'fs_random_no_lp':         1 [188.63ms, 188.63ms] 188.63ms   0.00ns 188.63ms         1 [567.81us, 567.81us] 567.81us   0.00ns 567.81us
          'fs_random_quick_restart':         1 [182.87ms, 182.87ms] 182.87ms   0.00ns 182.87ms         1 [636.54us, 636.54us] 636.54us   0.00ns 636.54us
          'fs_random_quick_restart':         1 [183.56ms, 183.56ms] 183.56ms   0.00ns 183.56ms         1 [  3.48ms,   3.48ms]   3.48ms   0.00ns   3.48ms
    'fs_random_quick_restart_no_lp':         1 [183.41ms, 183.41ms] 183.41ms   0.00ns 183.41ms         1 [  1.09ms,   1.09ms]   1.09ms   0.00ns   1.09ms
                    'graph_arc_lns':        97 [  4.21ms, 724.49ms] 390.96ms 250.43ms   37.92s        91 [ 10.00ns, 102.21ms]  57.95ms  43.27ms    5.27s
                    'graph_cst_lns':        97 [  2.06ms, 721.78ms] 372.28ms 256.45ms   36.11s        86 [ 10.00ns, 102.30ms]  58.39ms  42.27ms    5.02s
                    'graph_dec_lns':        97 [  4.91ms, 777.18ms] 394.13ms 245.56ms   38.23s        91 [ 10.00ns, 102.34ms]  57.44ms  42.76ms    5.23s
                    'graph_var_lns':        98 [  3.59ms, 740.34ms] 372.46ms 249.76ms   36.50s        90 [ 10.00ns, 102.51ms]  56.19ms  43.67ms    5.06s
                   'lb_tree_search':         1 [  30.69s,   30.69s]   30.69s   0.00ns   30.69s         1 [  18.29s,   18.29s]   18.29s   0.00ns   18.29s
                           'max_lp':         1 [  30.69s,   30.69s]   30.69s   0.00ns   30.69s         1 [  11.20s,   11.20s]   11.20s   0.00ns   11.20s
                            'no_lp':         1 [  30.69s,   30.69s]   30.69s   0.00ns   30.69s         1 [   6.95s,    6.95s]    6.95s   0.00ns    6.95s
              'objective_lb_search':         1 [  30.69s,   30.69s]   30.69s   0.00ns   30.69s         1 [  11.67s,   11.67s]   11.67s   0.00ns   11.67s
       'objective_lb_search_max_lp':         1 [  30.69s,   30.69s]   30.69s   0.00ns   30.69s         1 [  13.55s,   13.55s]   13.55s   0.00ns   13.55s
        'objective_lb_search_no_lp':         1 [  30.69s,   30.69s]   30.69s   0.00ns   30.69s         1 [   5.74s,    5.74s]    5.74s   0.00ns    5.74s
  'objective_shaving_search_max_lp':        68 [ 26.80ms,    2.35s] 442.67ms 502.25ms   30.10s        61 [  1.12ms, 592.27ms]  91.32ms 131.63ms    5.57s
   'objective_shaving_search_no_lp':        68 [ 19.40ms,    2.35s] 440.07ms 503.46ms   29.92s        62 [  1.12ms, 371.33ms]  62.74ms  85.16ms    3.89s
                          'probing':         1 [  30.70s,   30.70s]   30.70s   0.00ns   30.70s         1 [   4.71s,    4.71s]    4.71s   0.00ns    4.71s
                   'probing_max_lp':         1 [  30.70s,   30.70s]   30.70s   0.00ns   30.70s         1 [   8.21s,    8.21s]    8.21s   0.00ns    8.21s
                     'pseudo_costs':         1 [  30.69s,   30.69s]   30.69s   0.00ns   30.69s         1 [  10.80s,   10.80s]   10.80s   0.00ns   10.80s
                    'quick_restart':         1 [  30.69s,   30.69s]   30.69s   0.00ns   30.69s         1 [  13.02s,   13.02s]   13.02s   0.00ns   13.02s
              'quick_restart_no_lp':         1 [  30.69s,   30.69s]   30.69s   0.00ns   30.69s         1 [   8.66s,    8.66s]    8.66s   0.00ns    8.66s
                    'reduced_costs':         1 [  30.69s,   30.69s]   30.69s   0.00ns   30.69s         1 [  10.31s,   10.31s]   10.31s   0.00ns   10.31s
                        'rins/rens':        98 [ 94.07us, 616.23ms] 325.93ms 240.11ms   31.94s        86 [ 10.00ns, 100.60ms]  64.02ms  41.19ms    5.51s
                      'rnd_cst_lns':        98 [  2.25ms, 694.80ms] 376.50ms 250.28ms   36.90s        91 [ 10.00ns, 102.23ms]  55.98ms  43.43ms    5.09s
                      'rnd_var_lns':        98 [  2.93ms, 822.78ms] 422.13ms 242.53ms   41.37s        90 [ 10.00ns, 164.86ms]  64.97ms  42.74ms    5.85s
         'scheduling_intervals_lns':        97 [  2.84ms, 810.60ms] 603.37ms 174.98ms   58.53s        90 [ 26.87ms, 102.54ms]  99.29ms   8.99ms    8.94s
       'scheduling_precedences_lns':        97 [  2.57ms, 854.76ms] 601.23ms 174.29ms   58.32s        90 [ 26.87ms, 102.54ms]  99.26ms   8.98ms    8.93s
       'scheduling_time_window_lns':        97 [  2.99ms, 726.28ms] 600.99ms 169.64ms   58.30s        90 [ 62.81ms, 102.54ms]  99.73ms   5.26ms    8.98s
                     'violation_ls':        96 [  5.15ms, 110.21ms]  31.64ms  17.02ms    3.04s        96 [  3.88ms, 230.19ms]  46.36ms  39.34ms    4.45s
                     'violation_ls':        98 [ 20.29ms,  96.79ms]  50.75ms   7.99ms    4.97s        98 [ 18.89ms, 100.85ms]  87.20ms  13.33ms    8.55s

Search stats                        Bools  Conflicts  Branches  Restarts  BoolPropag  IntegerPropag
                           'core':  6'494      9'824    25'579     4'324  26'415'870     14'388'741
                     'default_lp':  1'196     10'906    45'503     5'810   3'574'081     16'065'761
                          'fixed':  1'162     31'598    32'482       441   5'559'931     19'679'528
                      'fs_random':     92          0       184       184           0          7'117
                      'fs_random':     92          0       371       364           0         14'271
                'fs_random_no_lp':     99          2       206       184          87          9'533
        'fs_random_quick_restart':     92          0       184       184           0          7'117
        'fs_random_quick_restart':     92          0       186       184           1          7'199
  'fs_random_quick_restart_no_lp':    116          0       297       185           3         11'744
                 'lb_tree_search':    107        139    69'245    22'896     264'288      9'312'458
                         'max_lp':     92      7'792    43'103     5'851     319'280     14'706'726
                          'no_lp':    659     19'852    52'135     4'639   2'767'473     25'134'324
            'objective_lb_search':    173      5'831    48'834     9'446     446'026     13'853'064
     'objective_lb_search_max_lp':    167      4'284    60'063    17'458     425'100     13'177'716
      'objective_lb_search_no_lp':    241     16'697    42'377     5'675     584'670     21'971'563
                        'probing':    269         16       522       522       6'061         67'598
                 'probing_max_lp':    229         14       444       444       3'695         59'211
                   'pseudo_costs':    739     10'223    41'780     4'677   1'854'884     15'495'770
                  'quick_restart':  1'386      9'770    53'822     7'014   5'866'145     13'344'288
            'quick_restart_no_lp':  1'902     23'877    71'812     5'969  11'145'314     22'906'044
                  'reduced_costs':    755     10'543    59'718     8'280   3'080'400     15'593'741

SAT stats                           ClassicMinim  LitRemoved  LitLearned  LitForgotten  Subsumed  MClauses  MDecisions  MLitTrue  MSubsumed  MLitRemoved  MReused
                           'core':         8'745      54'299      44'851             0        23     1'539       7'502         0         65          195       36
                     'default_lp':         7'768      22'043     102'781             0       248     2'376      24'481         1        887        6'233      509
                          'fixed':        17'354      89'171     437'917             0         3        25         137         0          2           18        4
                      'fs_random':             0           0           0             0         0         0           0         0          0            0        0
                      'fs_random':             0           0           0             0         0         0           0         0          0            0        0
                'fs_random_no_lp':             0           0           9             0         0         0           0         0          0            0        0
        'fs_random_quick_restart':             0           0           0             0         0         0           0         0          0            0        0
        'fs_random_quick_restart':             0           0           0             0         0         0           0         0          0            0        0
  'fs_random_quick_restart_no_lp':             0           0           0             0         0         0           0         0          0            0        0
                 'lb_tree_search':            10          16         456             0         0     8'439      43'344         0         24           97      884
                         'max_lp':         4'670      10'807      74'865             0       328     2'476      31'514         0        423        3'046      640
                          'no_lp':        14'517      42'245     187'143        43'097       470     2'615      24'243         0      1'505       10'716      485
            'objective_lb_search':         4'106      10'088      39'289             0       275     4'165      38'371         0      1'197        7'146    1'051
     'objective_lb_search_max_lp':         2'768       6'369      28'558             0       274     5'723      44'797         0        772        4'601    1'589
      'objective_lb_search_no_lp':        12'135      30'913     119'244             0       499     2'378      19'217         0        800        4'925      521
                        'probing':             0           0          16             0         0         0           0         0          0            0        0
                 'probing_max_lp':             0           0          14             0         0         0           0         0          0            0        0
                   'pseudo_costs':         6'598      17'151     101'438             0       302     2'239      26'649         0        685        5'103      644
                  'quick_restart':         5'965      17'210      80'818             0       301     3'903      34'123        68      2'641       22'827      550
            'quick_restart_no_lp':        16'571      71'614     247'528        41'685       236     2'469      22'831         0      1'887       16'140      213
                  'reduced_costs':         7'425      20'822     100'671             0       190     3'346      23'830         8      1'677       10'854      460

Lp stats                         Component  Iterations  AddedCuts  OPTIMAL  DUAL_F.  DUAL_U.
                  'default_lp':          1     155'229      9'209   17'239        0        5
                       'fixed':          1      13'193      1'632   31'892        0        0
                   'fs_random':          1         262        350        7        0        0
                   'fs_random':          1         505        939       15        0        0
     'fs_random_quick_restart':          1         261        454        7        0        0
     'fs_random_quick_restart':          1         501        938       13        1        0
              'lb_tree_search':          1     276'963      7'263   10'774    4'670        0
                      'max_lp':          1     153'242      8'373   10'926    4'756       10
         'objective_lb_search':          1     187'271      6'320   10'567        0        4
  'objective_lb_search_max_lp':          1     180'544      5'895    6'537    2'140        2
                     'probing':          1      27'420      4'170    1'780        0        6
              'probing_max_lp':          1      16'821      5'805    1'306       68        0
                'pseudo_costs':          1     158'422      8'596   12'618    5'926        5
               'quick_restart':          1     181'961      5'455   12'177        0        2
               'reduced_costs':          1     148'850     12'636   12'554    6'644       10

Lp dimension                                                                       Final dimension of first component
                  'default_lp':    585 rows, 372 columns, 1865 entries with magnitude in [8.025946e-03, 1.000000e+00]
                       'fixed':     257 rows, 372 columns, 961 entries with magnitude in [6.274558e-02, 1.000000e+00]
                   'fs_random':     213 rows, 372 columns, 794 entries with magnitude in [3.149655e-02, 1.000000e+00]
                   'fs_random':    413 rows, 372 columns, 1498 entries with magnitude in [3.461096e-03, 1.000000e+00]
     'fs_random_quick_restart':     213 rows, 372 columns, 793 entries with magnitude in [3.149655e-02, 1.000000e+00]
     'fs_random_quick_restart':    413 rows, 372 columns, 1434 entries with magnitude in [3.416956e-03, 1.000000e+00]
              'lb_tree_search':    798 rows, 380 columns, 2779 entries with magnitude in [1.157786e-03, 1.000000e+00]
                      'max_lp':    721 rows, 380 columns, 2674 entries with magnitude in [2.221997e-03, 1.000000e+00]
         'objective_lb_search':    354 rows, 372 columns, 1156 entries with magnitude in [5.113938e-03, 1.000000e+00]
  'objective_lb_search_max_lp':    991 rows, 380 columns, 3448 entries with magnitude in [2.660395e-04, 1.000000e+00]
                     'probing':    771 rows, 372 columns, 5498 entries with magnitude in [1.667465e-03, 1.000000e+00]
              'probing_max_lp':  1144 rows, 380 columns, 14308 entries with magnitude in [2.245069e-03, 1.000000e+00]
                'pseudo_costs':    541 rows, 380 columns, 1931 entries with magnitude in [4.524448e-03, 1.000000e+00]
               'quick_restart':    743 rows, 372 columns, 3386 entries with magnitude in [7.647360e-03, 1.000000e+00]
               'reduced_costs':    669 rows, 380 columns, 2566 entries with magnitude in [2.845451e-04, 1.000000e+00]

Lp debug                         CutPropag  CutEqPropag  Adjust  Overflow        Bad  BadScaling
                  'default_lp':         16            1   4'122         0    172'860           0
                       'fixed':          0            0      17         0      6'576           0
                   'fs_random':          0            0       0         0        497           0
                   'fs_random':          0            0       3         0      1'945           0
     'fs_random_quick_restart':          0            0       0         0        852           0
     'fs_random_quick_restart':          0            0       3         0      2'595           0
              'lb_tree_search':         40            1   8'297         0    256'344           0
                      'max_lp':          0            1   5'168         0    142'175           0
         'objective_lb_search':         43            4   3'542         0    273'002           0
  'objective_lb_search_max_lp':         26            5   4'963         0    223'049           0
                     'probing':          2            1   1'708         0  2'514'137           0
              'probing_max_lp':          6           10   1'327         0  1'613'376           0
                'pseudo_costs':          2            2   6'406         0    135'664           0
               'quick_restart':          4            4   5'704         0    245'838           0
               'reduced_costs':          4            3   7'481         0    170'611           0

Lp pool                          Constraints  Updates  Simplif  Merged  Shortened  Split  Strenghtened      Cuts/Call
                  'default_lp':        9'545      327   34'019      40      6'648  3'106        13'577   9'209/29'606
                       'fixed':        2'008       10        0       0          0     32           196    1'632/2'630
                   'fs_random':        1'315        4        0       0          0      4            82      939/1'549
                   'fs_random':          726        1        0       0          0      0            34        350/608
     'fs_random_quick_restart':        1'314        3        0       0          0      5            87      938/1'658
     'fs_random_quick_restart':          830        2        0       0          0      0            44        454/827
              'lb_tree_search':       12'176      399   88'343      14     10'742  2'612        39'850   7'263/22'531
                      'max_lp':       13'278      208   21'460      22      2'671  1'956        17'946   8'373/22'380
         'objective_lb_search':        6'662      454   49'679      34      5'594  5'857        11'271   6'320/19'830
  'objective_lb_search_max_lp':       10'804      458   73'195      18     13'740  4'098        42'357   5'895/15'778
                     'probing':        4'546      462    1'274       0          0  1'369         1'031    4'170/8'092
              'probing_max_lp':       10'728    1'608    8'609       4      4'013    651         8'988   5'805/12'582
                'pseudo_costs':       13'473      267   20'406      50      3'399  1'755        21'663   8'596/24'108
               'quick_restart':        5'812      273   16'524      19        929  5'829         3'405   5'455/17'731
               'reduced_costs':       14'480      268   30'156      83      3'577  3'188        29'856  12'636/33'375

Lp Cut                                                fs_ran  fs_ran  fs_ran  fs_ran  defaul  fixed  max_lp  quick_  reduce  pseudo  lb_tre  probin  object  probin  object
                                              CG_FF:      75      18      30      77     368    105     452     140     707     434     213     126     177     138     185
                                               CG_K:      51      18      26      48     233     68     329      62     476     267     187      75     106     154      87
                                               CG_R:      36      10      17      37     297     45     289      52     366     198     170     118     113     137      83
                                              CG_RB:     130       7      23     109     895    309     973     500   1'765     991     706     396     450     386     451
                                             CG_RBP:       6       1       1      15      86     20      82      32     141      72      34      62      43      25      39
                                             Clique:       -       -       -       -       -      -      90       -     100     100     116       -       -      67     106
                                                 IB:     194     110     110     240   1'412    331     781   1'255   1'118   1'032     739     879   1'192     273     907
                                           MIR_1_FF:      87      58      60      79     538    127     460     336     594     443     378     278     417     261     325
                                            MIR_1_K:       8       4       6       9      72     14      56      22     111      58      41      24      30      19      30
                                           MIR_1_KL:       -       -       -       -       5      -       5       -       6       5       1       -       -       -       -
                                            MIR_1_R:      19      13      14      16      80     19      73      37     111      72      34      32      58      16      38
                                           MIR_1_RB:      89      31      43      67   1'065    138   1'011     665   1'413     955     826     445     708     607     617
                                          MIR_1_RBP:      15       7       9      14      89     24     203      38     265     210     172      29      59     138     131
                                           MIR_2_FF:      35      15      20      32     313     42     314     163     446     321     219      99     183     142     178
                                            MIR_2_K:       9       4       6       8      58      8      39      17      62      34      13      16      18      15      21
                                           MIR_2_KL:       -       -       -       -       5      -       2       -       9       4       1       -       -       -       -
                                            MIR_2_R:      10       5      11      13      94     11      51      50      91      71      39      36      51      24      31
                                           MIR_2_RB:      41      14      26      36     572     70     476     351     771     484     360     195     321     259     308
                                          MIR_2_RBP:       4       1       5      11      79     19      73      22     141      96      46      22      44      47      42
                                           MIR_3_FF:       9       2       3      10     226     18     197      90     335     197     156      62     106      70     132
                                            MIR_3_K:       2       -       1       3      45      3      26       7      56      39      28      14      20       5      33
                                           MIR_3_KL:       -       -       -       -       5      -       6       1       6      10       2       -       1       -       -
                                            MIR_3_R:       3       -       2       4      83      7      36      30      76      49      33      22      56      32      35
                                           MIR_3_RB:      21       5       6       7     367     36     292     190     488     310     240     158     221     146     202
                                          MIR_3_RBP:       2       -       2       -      52      4      41      11      80      44      36      16      24      37      31
                                           MIR_4_FF:       1       1       1       6     152     14     126      70     197     140      85      38      87      43      73
                                            MIR_4_K:       5       2       3       4      33      5      21       8      45      25       9       6      14       2      17
                                           MIR_4_KL:       -       -       -       -       7      -       5       -       7       4       3       1       -       -       -
                                            MIR_4_R:       1       1       1       2      48      3      41      26      77      55      45      18      45      29      24
                                           MIR_4_RB:      15       3       5      12     234     29     183     113     269     199     157      77     141      95     133
                                          MIR_4_RBP:       -       -       -       1      33      9      21       7      55      26      18       4      13      12      22
                                           MIR_5_FF:       3       -       -       6     102      9      93      36     119      71      63      22      80      22      47
                                            MIR_5_K:       4       -       1       2      32      5      21       8      34      18      11      12      15       6       7
                                           MIR_5_KL:       -       -       -       -       2      -       5       1       7       1       1       -       -       -       -
                                            MIR_5_R:       2       -       -       1      48      6      17      25      50      30      27      16      37      18      22
                                           MIR_5_RB:       4       1       1       5     167     15      96      94     164     109      94      65     136      51      85
                                          MIR_5_RBP:       1       1       1       -      15      5       9       8      25      23       9       2       8       4       7
                                           MIR_6_FF:       1       -       1       2      54      6      34      15      67      52      37       9      51       9      17
                                            MIR_6_K:       -       -       -       -      13      1       9       3      31      14       7       1      10       -       5
                                           MIR_6_KL:       -       -       -       -       -      -       -       -       3       1       -       1       -       1       -
                                            MIR_6_R:       -       -       1       1      35      5      13       9      32      30      13       5      23       5       9
                                           MIR_6_RB:       2       -       2       2     101     12      41      57     109      87      41      35      80      23      37
                                          MIR_6_RBP:       -       -       -       -       7      1       5       2      32      12       2       1      10       1       1
         NoOverlapCompletionTimeExhaustive_weighted:       -       -       -       -       -      -       7       -       8      11       8       -       -       -      13
  NoOverlapCompletionTimeExhaustive_weighted_lifted:       -       -       -       -       -      -      11       -      15      12       7       -       -       3       6
                        NoOverlapDisjunctionOnStart:       -       -       -       -       -      -      12       -      19      10      10       -       -       5      13
                                       ZERO_HALF_FF:      10       5       5      14     111     21     108      35     190     105      84      33      55      32      43
                                        ZERO_HALF_K:       2       1       1       2      19      1       9       4      45      14      12       9       6       2       5
                                        ZERO_HALF_R:      23       6       4      19     649     30     740     724     749     706   1'421     601     837   2'171   1'047
                                       ZERO_HALF_RB:      14       4       4      18     245     29     306     118     456     295     244      67     188     206     173
                                      ZERO_HALF_RBP:       4       2       2       7      63      8      83      21      97      50      65      43      86      67      77

LNS stats                        Improv/Calls  Closed  Difficulty  TimeLimit
               'graph_arc_lns':          6/96     59%        1.00       0.10
               'graph_cst_lns':          7/92     60%        0.99       0.10
               'graph_dec_lns':          5/96     58%        0.99       0.10
               'graph_var_lns':          7/97     61%        1.00       0.10
                   'rins/rens':          6/91     54%        0.92       0.10
                 'rnd_cst_lns':          6/96     58%        0.99       0.10
                 'rnd_var_lns':          5/97     59%        1.00       0.10
    'scheduling_intervals_lns':         10/97     15%        0.00       0.10
  'scheduling_precedences_lns':          9/97     15%        0.00       0.10
  'scheduling_time_window_lns':         11/97     15%        0.00       0.10

LS stats                   Batches  Restarts  LinMoves  GenMoves  CompoundMoves  WeightUpdates
       'fj_long_default':        1         1     9'884         0              0            116
   'fj_long_lin_default':        1         1         0     1'629            311              0
        'fj_long_random':        1         1     8'977         0              0            110
      'fj_short_default':        2         1         0     3'714            296              0
  'fj_short_lin_default':        1         1         0     2'182            292              0
   'fj_short_lin_random':        1         1         0     1'952            294              0
       'fj_short_random':        1         1         0     1'888            443              0
          'violation_ls':       96         0   476'047     4'589            423        445'280
          'violation_ls':       98         0    23'346   312'529         29'209         10'437

Solutions (21)                      Num     Rank
  'fs_random_quick_restart_no_lp':    1    [1,1]
                          'no_lp':   14   [2,18]
            'quick_restart_no_lp':    1    [8,8]
                  'rins_pump_lns':    1  [19,19]
     'scheduling_precedences_lns':    1  [21,21]
     'scheduling_time_window_lns':    1  [20,20]
                   'violation_ls':    2   [3,17]

Objective bounds                     Num
                       'fs_random':    4
         'fs_random_quick_restart':    3
                  'initial_domain':    1
                  'lb_tree_search':   15
             'objective_lb_search':   16
      'objective_lb_search_max_lp':    7
       'objective_lb_search_no_lp':   42
  'objective_shaving_search_no_lp':    1
                         'probing':    4
                    'pseudo_costs':    2
                   'reduced_costs':    2

Solution repositories    Added  Queried  Ignored  Synchro
  'feasible solutions':    907    2'210        0      846
        'lp solutions':    441       42        0      358
                'pump':  1'945       55

Improving bounds shared            Num
                        'core':     28
                  'default_lp':    127
              'lb_tree_search':     83
                      'max_lp':     66
                       'no_lp':  1'149
         'objective_lb_search':     57
  'objective_lb_search_max_lp':     90
                     'probing':     22
              'probing_max_lp':     10
                'pseudo_costs':     70
               'quick_restart':    276
         'quick_restart_no_lp':  1'531
               'reduced_costs':    162

Clauses shared                   Num
                  'default_lp':   27
             'fs_random_no_lp':    1
              'lb_tree_search':   39
                      'max_lp':    8
                       'no_lp':   45
  'objective_lb_search_max_lp':   24
   'objective_lb_search_no_lp':    6
                'pseudo_costs':   15
               'quick_restart':    1
         'quick_restart_no_lp':   27
               'reduced_costs':   44

CpSolverResponse summary:
status: OPTIMAL
objective: 1730
best_bound: 1730
integers: 376
booleans: 92
conflicts: 0
branches: 186
propagations: 1
integer_propagations: 7199
restarts: 184
lp_iterations: 501
walltime: 31.1068
usertime: 31.1068
deterministic_time: 278.33
gap_integral: 1341.5
solution_fingerprint: 0xb5a15de6f78763e6


--- Simulation Gantt  partir du modle mathmatique ---
