created virtual environment CPython3.12.4.final.0-64 in 5338ms
  creator CPython3Posix(dest=/localscratch/aneumann.63390721.0/env, clear=False, no_vcs_ignore=False, global=False)
  seeder FromAppData(download=False, pip=bundle, via=copy, app_data_dir=/home/aneumann/.local/share/virtualenv)
    added seed packages: pip==25.1.1
  activators BashActivator,CShellActivator,FishActivator,NushellActivator,PowerShellActivator,PythonActivator
Looking in links: /cvmfs/soft.computecanada.ca/custom/python/wheelhouse/gentoo2023/x86-64-v3, /cvmfs/soft.computecanada.ca/custom/python/wheelhouse/gentoo2023/generic, /cvmfs/soft.computecanada.ca/custom/python/wheelhouse/generic
Requirement already satisfied: pip in /localscratch/aneumann.63390721.0/env/lib/python3.12/site-packages (25.1.1)
Looking in links: /cvmfs/soft.computecanada.ca/custom/python/wheelhouse/gentoo2023/x86-64-v3, /cvmfs/soft.computecanada.ca/custom/python/wheelhouse/gentoo2023/generic, /cvmfs/soft.computecanada.ca/custom/python/wheelhouse/generic
ERROR: protobuf-5.28.3-cp38-abi3-manylinux2014_x86_64.whl is not a supported wheel on this platform.
Looking in links: /cvmfs/soft.computecanada.ca/custom/python/wheelhouse/gentoo2023/x86-64-v3, /cvmfs/soft.computecanada.ca/custom/python/wheelhouse/gentoo2023/generic, /cvmfs/soft.computecanada.ca/custom/python/wheelhouse/generic
Processing /home/aneumann/projects/def-adhaj/aneumann/GNRS/wheels/immutabledict-4.2.0-py3-none-any.whl
Installing collected packages: immutabledict
Successfully installed immutabledict-4.2.0
Looking in links: /cvmfs/soft.computecanada.ca/custom/python/wheelhouse/gentoo2023/x86-64-v3, /cvmfs/soft.computecanada.ca/custom/python/wheelhouse/gentoo2023/generic, /cvmfs/soft.computecanada.ca/custom/python/wheelhouse/generic
Processing /cvmfs/soft.computecanada.ca/custom/python/wheelhouse/generic/ortools-9.10.4067+computecanada-cp312-cp312-linux_x86_64.whl (from -r /home/aneumann/projects/def-adhaj/aneumann/GNRS/requirements/or.txt (line 1))
Processing /cvmfs/soft.computecanada.ca/custom/python/wheelhouse/gentoo2023/x86-64-v3/matplotlib-3.10.0+computecanada-cp312-cp312-linux_x86_64.whl (from -r /home/aneumann/projects/def-adhaj/aneumann/GNRS/requirements/or.txt (line 2))
Processing /cvmfs/soft.computecanada.ca/custom/python/wheelhouse/gentoo2023/x86-64-v3/pandas-2.2.3+computecanada-cp312-cp312-linux_x86_64.whl (from -r /home/aneumann/projects/def-adhaj/aneumann/GNRS/requirements/or.txt (line 3))
Processing /cvmfs/soft.computecanada.ca/custom/python/wheelhouse/generic/absl_py-2.2.2+computecanada-py3-none-any.whl (from ortools<9.11,>=9.10->-r /home/aneumann/projects/def-adhaj/aneumann/GNRS/requirements/or.txt (line 1))
Processing /cvmfs/soft.computecanada.ca/custom/python/wheelhouse/gentoo2023/generic/numpy-2.2.2+computecanada-cp312-cp312-linux_x86_64.whl (from ortools<9.11,>=9.10->-r /home/aneumann/projects/def-adhaj/aneumann/GNRS/requirements/or.txt (line 1))
Processing /cvmfs/soft.computecanada.ca/custom/python/wheelhouse/gentoo2023/x86-64-v3/protobuf-6.30.2+computecanada-cp312-cp312-linux_x86_64.whl (from ortools<9.11,>=9.10->-r /home/aneumann/projects/def-adhaj/aneumann/GNRS/requirements/or.txt (line 1))
Requirement already satisfied: immutabledict>=3.0.0 in /localscratch/aneumann.63390721.0/env/lib/python3.12/site-packages (from ortools<9.11,>=9.10->-r /home/aneumann/projects/def-adhaj/aneumann/GNRS/requirements/or.txt (line 1)) (4.2.0)
Processing /cvmfs/soft.computecanada.ca/custom/python/wheelhouse/gentoo2023/generic/contourpy-1.3.1+computecanada-cp312-cp312-linux_x86_64.whl (from matplotlib->-r /home/aneumann/projects/def-adhaj/aneumann/GNRS/requirements/or.txt (line 2))
Processing /cvmfs/soft.computecanada.ca/custom/python/wheelhouse/generic/cycler-0.12.1+computecanada-py3-none-any.whl (from matplotlib->-r /home/aneumann/projects/def-adhaj/aneumann/GNRS/requirements/or.txt (line 2))
Processing /cvmfs/soft.computecanada.ca/custom/python/wheelhouse/generic/fonttools-4.58.2+computecanada-cp312-cp312-linux_x86_64.whl (from matplotlib->-r /home/aneumann/projects/def-adhaj/aneumann/GNRS/requirements/or.txt (line 2))
Processing /cvmfs/soft.computecanada.ca/custom/python/wheelhouse/gentoo2023/x86-64-v3/kiwisolver-1.4.8+computecanada-cp312-cp312-linux_x86_64.whl (from matplotlib->-r /home/aneumann/projects/def-adhaj/aneumann/GNRS/requirements/or.txt (line 2))
Processing /cvmfs/soft.computecanada.ca/custom/python/wheelhouse/generic/packaging-25.0+computecanada-py3-none-any.whl (from matplotlib->-r /home/aneumann/projects/def-adhaj/aneumann/GNRS/requirements/or.txt (line 2))
Processing /cvmfs/soft.computecanada.ca/custom/python/wheelhouse/gentoo2023/x86-64-v3/pillow-11.1.0+computecanada-cp312-cp312-linux_x86_64.whl (from matplotlib->-r /home/aneumann/projects/def-adhaj/aneumann/GNRS/requirements/or.txt (line 2))
Processing /cvmfs/soft.computecanada.ca/custom/python/wheelhouse/generic/pyparsing-3.2.1+computecanada-py3-none-any.whl (from matplotlib->-r /home/aneumann/projects/def-adhaj/aneumann/GNRS/requirements/or.txt (line 2))
Processing /cvmfs/soft.computecanada.ca/custom/python/wheelhouse/generic/python_dateutil-2.9.0.post0+computecanada-py2.py3-none-any.whl (from matplotlib->-r /home/aneumann/projects/def-adhaj/aneumann/GNRS/requirements/or.txt (line 2))
Processing /cvmfs/soft.computecanada.ca/custom/python/wheelhouse/generic/pytz-2025.2+computecanada-py2.py3-none-any.whl (from pandas->-r /home/aneumann/projects/def-adhaj/aneumann/GNRS/requirements/or.txt (line 3))
Processing /cvmfs/soft.computecanada.ca/custom/python/wheelhouse/generic/tzdata-2025.2+computecanada-py2.py3-none-any.whl (from pandas->-r /home/aneumann/projects/def-adhaj/aneumann/GNRS/requirements/or.txt (line 3))
Processing /cvmfs/soft.computecanada.ca/custom/python/wheelhouse/generic/six-1.17.0+computecanada-py2.py3-none-any.whl (from python-dateutil>=2.7->matplotlib->-r /home/aneumann/projects/def-adhaj/aneumann/GNRS/requirements/or.txt (line 2))
Installing collected packages: pytz, tzdata, six, pyparsing, protobuf, pillow, packaging, numpy, kiwisolver, fonttools, cycler, absl-py, python-dateutil, contourpy, pandas, matplotlib, ortools

Successfully installed absl-py-2.2.2+computecanada contourpy-1.3.1+computecanada cycler-0.12.1+computecanada fonttools-4.58.2+computecanada kiwisolver-1.4.8+computecanada matplotlib-3.10.0+computecanada numpy-2.2.2+computecanada ortools-9.10.4067+computecanada packaging-25.0+computecanada pandas-2.2.3+computecanada pillow-11.1.0+computecanada protobuf-6.30.2+computecanada pyparsing-3.2.1+computecanada python-dateutil-2.9.0.post0+computecanada pytz-2025.2+computecanada six-1.17.0+computecanada tzdata-2025.2+computecanada

Starting CP-SAT solver v9.10.4067
Parameters: max_time_in_seconds: 3600 max_memory_in_mb: 12000 log_search_progress: true enumerate_all_solutions: false absolute_gap_limit: 0 relative_gap_limit: 0
Setting number of workers to 48

Initial optimization model '': (model_fingerprint: 0x54cb879a28581109)
#Variables: 177 (#ints: 5 in objective)
  - 120 Booleans in [0,1]
  - 57 in [0,445]
#kLinear1: 20
#kLinear2: 226
#kLinear3: 84
#kLinearN: 670 (#terms: 6'212)

Starting presolve at 0.00s
  3.25e-04s  0.00e+00d  [DetectDominanceRelations] 
  9.17e-03s  0.00e+00d  [PresolveToFixPoint] #num_loops=6 #num_dual_strengthening=3 
  1.62e-05s  0.00e+00d  [ExtractEncodingFromLinear] #potential_supersets=2 
[Symmetry] Graph for symmetry has 924 nodes and 3'327 arcs.
[Symmetry] Symmetry computation done. time: 0.0004887 dtime: 0.00031297
[SAT presolve] num removable Booleans: 0 / 44
[SAT presolve] num trivial clauses: 0
[SAT presolve] [0s] clauses:4 literals:10 vars:7 one_side_vars:6 simple_definition:1 singleton_clauses:0
[SAT presolve] [3.9441e-05s] clauses:4 literals:10 vars:7 one_side_vars:6 simple_definition:1 singleton_clauses:0
[SAT presolve] [5.1506e-05s] clauses:4 literals:10 vars:7 one_side_vars:6 simple_definition:1 singleton_clauses:0
  2.10e-03s  1.96e-04d  [Probe] #probed=190 #fixed_bools=4 #new_bounds=8 
  3.08e-05s  0.00e+00d  [MaxClique] 
  3.09e-04s  0.00e+00d  [DetectDominanceRelations] 
  3.22e-03s  0.00e+00d  [PresolveToFixPoint] #num_loops=4 #num_dual_strengthening=3 
  7.35e-04s  0.00e+00d  [ProcessAtMostOneAndLinear] 
  6.29e-04s  0.00e+00d  [DetectDuplicateConstraints] #duplicates=169 #without_enforcements=36 
  1.58e-04s  5.72e-06d  [DetectDominatedLinearConstraints] #relevant_constraints=272 #num_inclusions=28 #num_redundant=2 
  1.37e-04s  0.00e+00d  [DetectDifferentVariables] #different=29 #cliques=2 #size=6 
  7.67e-05s  2.25e-06d  [ProcessSetPPC] #relevant_constraints=180 
  8.83e-06s  0.00e+00d  [FindAlmostIdenticalLinearConstraints] 
  4.85e-05s  2.58e-05d  [FindBigAtMostOneAndLinearOverlap] 
  4.62e-04s  1.35e-04d  [FindBigVerticalLinearOverlap] #blocks=3 #saved_nz=113 
  4.09e-05s  6.69e-06d  [FindBigHorizontalLinearOverlap] #linears=176 
  1.73e-05s  3.00e-08d  [MergeClauses] 
  2.89e-04s  0.00e+00d  [DetectDominanceRelations] 
  3.18e-03s  0.00e+00d  [PresolveToFixPoint] #num_loops=2 #num_dual_strengthening=1 
  2.84e-04s  0.00e+00d  [DetectDominanceRelations] 
  2.15e-03s  0.00e+00d  [PresolveToFixPoint] #num_loops=1 #num_dual_strengthening=1 
[SAT presolve] num removable Booleans: 0 / 40
[SAT presolve] num trivial clauses: 0
[SAT presolve] [0s] clauses:4 literals:10 vars:7 one_side_vars:6 simple_definition:1 singleton_clauses:0
[SAT presolve] [3.2516e-05s] clauses:4 literals:10 vars:7 one_side_vars:6 simple_definition:1 singleton_clauses:0
[SAT presolve] [4.365e-05s] clauses:4 literals:10 vars:7 one_side_vars:6 simple_definition:1 singleton_clauses:0
  1.80e-03s  1.84e-04d  [Probe] #probed=180 #new_bounds=16 
  1.95e-05s  0.00e+00d  [MaxClique] 
  2.87e-04s  0.00e+00d  [DetectDominanceRelations] 
  4.16e-03s  0.00e+00d  [PresolveToFixPoint] #num_loops=4 #num_dual_strengthening=3 
  6.66e-04s  0.00e+00d  [ProcessAtMostOneAndLinear] 
  4.53e-04s  0.00e+00d  [DetectDuplicateConstraints] #without_enforcements=36 
  1.50e-04s  5.18e-06d  [DetectDominatedLinearConstraints] #relevant_constraints=273 #num_inclusions=26 
  5.70e-05s  0.00e+00d  [DetectDifferentVariables] 
  7.53e-05s  2.01e-06d  [ProcessSetPPC] #relevant_constraints=180 
  1.15e-05s  0.00e+00d  [FindAlmostIdenticalLinearConstraints] 
  4.49e-05s  2.44e-05d  [FindBigAtMostOneAndLinearOverlap] 
  3.32e-04s  1.23e-04d  [FindBigVerticalLinearOverlap] 
  3.80e-05s  6.69e-06d  [FindBigHorizontalLinearOverlap] #linears=176 
  1.62e-05s  3.00e-08d  [MergeClauses] 
  2.92e-04s  0.00e+00d  [DetectDominanceRelations] 
  2.17e-03s  0.00e+00d  [PresolveToFixPoint] #num_loops=1 #num_dual_strengthening=1 
  2.88e-04s  0.00e+00d  [DetectDominanceRelations] 
  2.15e-03s  0.00e+00d  [PresolveToFixPoint] #num_loops=1 #num_dual_strengthening=1 
[SAT presolve] num removable Booleans: 0 / 40
[SAT presolve] num trivial clauses: 0
[SAT presolve] [0s] clauses:4 literals:10 vars:7 one_side_vars:6 simple_definition:1 singleton_clauses:0
[SAT presolve] [3.1575e-05s] clauses:4 literals:10 vars:7 one_side_vars:6 simple_definition:1 singleton_clauses:0
[SAT presolve] [4.445e-05s] clauses:4 literals:10 vars:7 one_side_vars:6 simple_definition:1 singleton_clauses:0
  1.74e-03s  1.77e-04d  [Probe] #probed=180 
  1.89e-05s  0.00e+00d  [MaxClique] 
  2.90e-04s  0.00e+00d  [DetectDominanceRelations] 
  2.19e-03s  0.00e+00d  [PresolveToFixPoint] #num_loops=1 #num_dual_strengthening=1 
  6.72e-04s  0.00e+00d  [ProcessAtMostOneAndLinear] 
  4.47e-04s  0.00e+00d  [DetectDuplicateConstraints] #without_enforcements=36 
  1.50e-04s  5.18e-06d  [DetectDominatedLinearConstraints] #relevant_constraints=273 #num_inclusions=26 
  6.10e-05s  0.00e+00d  [DetectDifferentVariables] 
  7.45e-05s  2.01e-06d  [ProcessSetPPC] #relevant_constraints=180 
  1.03e-05s  0.00e+00d  [FindAlmostIdenticalLinearConstraints] 
  4.53e-05s  2.44e-05d  [FindBigAtMostOneAndLinearOverlap] 
  3.86e-04s  1.23e-04d  [FindBigVerticalLinearOverlap] #blocks=1 #saved_nz=43 
  3.80e-05s  6.46e-06d  [FindBigHorizontalLinearOverlap] #linears=176 
  1.63e-05s  3.00e-08d  [MergeClauses] 
  2.86e-04s  0.00e+00d  [DetectDominanceRelations] 
  2.61e-03s  0.00e+00d  [PresolveToFixPoint] #num_loops=2 #num_dual_strengthening=1 
  2.31e-05s  0.00e+00d  [ExpandObjective] #entries=24 #tight_variables=12 #tight_constraints=6 

Presolve summary:
  - 34 affine relations were detected.
  - rule 'TODO dual: only one blocking constraint?' was applied 395 times.
  - rule 'TODO dual: only one unspecified blocking constraint?' was applied 75 times.
  - rule 'TODO duplicate: identical constraint with different enforcements' was applied 108 times.
  - rule 'TODO linear2: contains a Boolean.' was applied 16 times.
  - rule 'TODO no_overlap: with task always last' was applied 2 times.
  - rule 'affine: new relation' was applied 34 times.
  - rule 'all_diff: inferred from x != y constraints' was applied 2 times.
  - rule 'at_most_one: removed literals' was applied 3 times.
  - rule 'at_most_one: size one' was applied 3 times.
  - rule 'bool_or: always true' was applied 2 times.
  - rule 'bool_or: implications' was applied 2 times.
  - rule 'deductions: 102 stored' was applied 1 time.
  - rule 'dual: fix variable' was applied 5 times.
  - rule 'dual: reduced domain' was applied 25 times.
  - rule 'duplicate: merged rhs of linear constraint' was applied 33 times.
  - rule 'duplicate: removed constraint' was applied 169 times.
  - rule 'enforcement: false literal' was applied 14 times.
  - rule 'enforcement: literal not used' was applied 2 times.
  - rule 'enforcement: true literal' was applied 16 times.
  - rule 'incompatible linear: add implication' was applied 39 times.
  - rule 'linear inclusion: redundant containing constraint' was applied 2 times.
  - rule 'linear matrix: common vertical rectangle' was applied 4 times.
  - rule 'linear1: always true' was applied 2 times.
  - rule 'linear2: contains a Boolean.' was applied 7 times.
  - rule 'linear: always true' was applied 317 times.
  - rule 'linear: doubleton free' was applied 6 times.
  - rule 'linear: empty' was applied 20 times.
  - rule 'linear: extracted enforcement literal' was applied 900 times.
  - rule 'linear: fixed or dup variables' was applied 675 times.
  - rule 'linear: negative clause' was applied 6 times.
  - rule 'linear: positive equal one' was applied 2 times.
  - rule 'linear: reduced variable domains' was applied 75 times.
  - rule 'linear: remapped using affine relations' was applied 615 times.
  - rule 'linear: simplified rhs' was applied 1'773 times.
  - rule 'linear: variable substitution 1' was applied 6 times.
  - rule 'presolve: 56 unused variables removed.' was applied 1 time.
  - rule 'presolve: iteration' was applied 3 times.
  - rule 'probing: reduced enforced constraint to implication.' was applied 3 times.

Presolved optimization model '': (model_fingerprint: 0xc24e526089a69d4a)
#Variables: 85 (#ints: 5 in objective)
  - 40 Booleans in [0,1]
  - 4 in [0,290]
  - 1 in [0,292]
  - 3 in [0,343]
  - 4 in [0,345]
  - 1 in [0,346]
  - 1 in [0,362]
  - 1 in [10,357]
  - 1 in [10,387]
  - 1 in [13,360]
  - 1 in [13,390]
  - 1 in [18,365]
  - 1 in [36,381]
  - 1 in [44,421]
  - 1 in [44,421][489,866]
  - 1 in [50,396]
  - 1 in [53,396][495,841]
  - 1 in [60,405]
  - 1 in [63,405][505,850]
  - 3 in [72,434]
  - 1 in [78,440]
  - 1 in [79,426]
  - 1 in [79,426][524,871]
  - 3 in [87,434]
  - 3 in [89,434]
  - 1 in [93,440]
  - 1 in [95,440]
  - 3 in [142,434]
  - 1 in [148,440]
  - 1 in [155,445]
#kAllDiff: 2
#kBoolAnd: 1 (#enforced: 1) (#literals: 3)
#kBoolOr: 2 (#literals: 6)
#kExactlyOne: 2 (#literals: 6)
#kLinear1: 9 (#enforced: 9 #multi: 6)
#kLinear2: 176 (#enforced: 144 #multi: 100)
#kLinear3: 60 (#enforced: 44 #multi: 22)
#kLinearN: 182 (#enforced: 164) (#terms: 1'316)

Preloading model.
#Bound   0.05s best:inf   next:[209,1845] initial_domain
#Model   0.05s var:85/85 constraints:434/434

Starting search at 0.05s with 48 workers.
16 full problem subsolvers: [core, default_lp, lb_tree_search, max_lp, no_lp, objective_lb_search, objective_lb_search_max_lp, objective_lb_search_no_lp, objective_shaving_search_max_lp, objective_shaving_search_no_lp, probing, probing_max_lp, pseudo_costs, quick_restart, quick_restart_no_lp, reduced_costs]
30 first solution subsolvers: [fj_long_default(2), fj_long_lin_default, fj_long_lin_perturb, fj_long_lin_random, fj_long_perturb, fj_long_random, fj_short_default(2), fj_short_lin_default(2), fj_short_lin_perturb, fj_short_lin_random, fj_short_perturb, fj_short_random, fs_random(4), fs_random_no_lp(4), fs_random_quick_restart(4), fs_random_quick_restart_no_lp(3)]
13 incomplete subsolvers: [feasibility_pump, graph_arc_lns, graph_cst_lns, graph_dec_lns, graph_var_lns, rins/rens, rnd_cst_lns, rnd_var_lns, violation_ls(5)]
3 helper subsolvers: [neighborhood_helper, synchronization_agent, update_gap_integral]
#1       0.05s best:1000  next:[209,999]  no_lp (fixed_bools=0/64)
#Bound   0.05s best:1000  next:[210,999]  bool_core (num_cores=1 [size:1 mw:1] a=5 d=0 fixed=0/52 clauses=10)
#2       0.06s best:999   next:[210,998]  violation_ls(batch:1 #solutions_imported:1 #lin_moves:0 #lin_evals:10 #gen_moves:5 #gen_evals:0 #comp_moves:5 #backtracks:0 #weight_updates:0)
#Bound   0.06s best:999   next:[212,998]  objective_lb_search_no_lp
#Bound   0.06s best:999   next:[221,998]  objective_lb_search_no_lp
#3       0.06s best:990   next:[221,989]  no_lp (fixed_bools=0/67)
#Bound   0.06s best:990   next:[273,989]  default_lp
#4       0.06s best:987   next:[273,986]  no_lp (fixed_bools=0/73)
#Bound   0.06s best:987   next:[274,986]  objective_lb_search_no_lp
#5       0.06s best:986   next:[274,985]  violation_ls(batch:1 #solutions_imported:1 #lin_moves:8 #lin_evals:41 #weight_updates:5)
#Bound   0.06s best:986   next:[280,985]  objective_lb_search_no_lp
#6       0.06s best:985   next:[280,984]  violation_ls(batch:1 #solutions_imported:1 #lin_moves:0 #lin_evals:12 #gen_moves:6 #gen_evals:0 #comp_moves:6 #backtracks:0 #weight_updates:0)
#Bound   0.06s best:985   next:[284,984]  objective_lb_search_no_lp
#7       0.06s best:984   next:[284,983]  violation_ls(batch:1 #solutions_imported:1 #lin_moves:0 #lin_evals:5 #gen_moves:3 #gen_evals:0 #comp_moves:3 #backtracks:0 #weight_updates:0)
#8       0.06s best:983   next:[284,982]  violation_ls(batch:1 #solutions_imported:1 #lin_moves:0 #lin_evals:19 #gen_moves:18 #gen_evals:5 #comp_moves:6 #backtracks:6 #weight_updates:0)
#9       0.06s best:963   next:[284,962]  no_lp (fixed_bools=0/80)
#Bound   0.06s best:963   next:[290,962]  quick_restart
#10      0.06s best:962   next:[290,961]  violation_ls(batch:2 #solutions_imported:2 #lin_moves:0 #lin_evals:21 #gen_moves:11 #gen_evals:0 #comp_moves:11 #backtracks:0 #weight_updates:0)
#11      0.06s best:961   next:[290,960]  violation_ls(batch:2 #solutions_imported:2 #lin_moves:0 #lin_evals:24 #gen_moves:14 #gen_evals:3 #comp_moves:14 #backtracks:0 #weight_updates:0)
#12      0.06s best:912   next:[290,911]  no_lp (fixed_bools=0/87)
#13      0.06s best:911   next:[290,910]  violation_ls(batch:2 #solutions_imported:2 #lin_moves:0 #lin_evals:69 #gen_moves:57 #gen_evals:17 #comp_moves:9 #backtracks:24 #weight_updates:0)
#14      0.06s best:880   next:[290,879]  no_lp (fixed_bools=0/92)
#Bound   0.06s best:880   next:[458,879]  objective_lb_search_no_lp
#15      0.06s best:838   next:[458,837]  no_lp (fixed_bools=0/104)
#16      0.06s best:775   next:[458,774]  no_lp (fixed_bools=0/114)
#Bound   0.06s best:775   next:[482,774]  objective_lb_search_no_lp
#17      0.07s best:770   next:[482,769]  quick_restart_no_lp (fixed_bools=0/133)
#18      0.07s best:767   next:[482,766]  quick_restart_no_lp (fixed_bools=0/136)
#19      0.07s best:760   next:[482,759]  rins_pump_lns (d=0.50 s=45 t=0.10 p=0.00 stall=0 h=auto_l0)
#Bound   0.07s best:760   next:[516,759]  objective_lb_search_no_lp
#20      0.07s best:759   next:[516,758]  violation_ls(batch:3 #solutions_imported:3 #lin_moves:315 #lin_evals:1'180 #gen_moves:14 #gen_evals:3 #comp_moves:14 #backtracks:0 #weight_updates:110)
#21      0.08s best:747   next:[516,746]  violation_ls(batch:3 #solutions_imported:3 #lin_moves:566 #lin_evals:2'262 #gen_moves:11 #gen_evals:0 #comp_moves:11 #backtracks:0 #weight_updates:142)
#22      0.08s best:731   next:[516,730]  graph_dec_lns (d=0.81 s=64 t=0.10 p=1.00 stall=0 h=auto_l0)
#23      0.08s best:730   next:[516,729]  violation_ls(batch:4 #solutions_imported:4 #lin_moves:331 #lin_evals:1'262 #gen_moves:14 #gen_evals:3 #comp_moves:14 #backtracks:0 #weight_updates:119)
#24      0.08s best:723   next:[516,722]  no_lp (fixed_bools=0/122)
#Bound   0.08s best:723   next:[517,722]  objective_lb_search_no_lp
#25      0.09s best:718   next:[517,717]  no_lp (fixed_bools=0/132)
#26      0.09s best:712   next:[517,711]  no_lp (fixed_bools=0/138)
#27      0.09s best:688   next:[517,687]  no_lp (fixed_bools=0/144)
#28      0.09s best:652   next:[517,651]  no_lp (fixed_bools=0/147)
#Bound   0.09s best:652   next:[519,651]  objective_lb_search_no_lp
#29      0.09s best:651   next:[519,650]  quick_restart_no_lp (fixed_bools=0/144)
#30      0.09s best:642   next:[519,641]  quick_restart_no_lp (fixed_bools=0/151)
#31      0.09s best:640   next:[519,639]  violation_ls(batch:4 #solutions_imported:4 #lin_moves:2'152 #lin_evals:10'130 #gen_moves:70 #gen_evals:23 #comp_moves:12 #backtracks:29 #weight_updates:315)
#32      0.09s best:638   next:[519,637]  violation_ls(batch:5 #solutions_imported:5 #lin_moves:2'153 #lin_evals:10'135 #gen_moves:70 #gen_evals:23 #comp_moves:12 #backtracks:29 #weight_updates:315)
#33      0.10s best:636   next:[519,635]  violation_ls(batch:6 #solutions_imported:6 #lin_moves:2'153 #lin_evals:10'148 #gen_moves:85 #gen_evals:26 #comp_moves:13 #backtracks:36 #weight_updates:315)
#34      0.10s best:635   next:[519,634]  violation_ls(batch:7 #solutions_imported:7 #lin_moves:2'153 #lin_evals:10'153 #gen_moves:88 #gen_evals:26 #comp_moves:16 #backtracks:36 #weight_updates:315)
#35      0.10s best:634   next:[519,633]  violation_ls(batch:8 #solutions_imported:8 #lin_moves:2'154 #lin_evals:10'158 #gen_moves:88 #gen_evals:26 #comp_moves:16 #backtracks:36 #weight_updates:315)
#36      0.10s best:630   next:[519,629]  quick_restart_no_lp (fixed_bools=0/171)
#37      0.10s best:629   next:[519,628]  violation_ls(batch:9 #solutions_imported:9 #lin_moves:2'175 #lin_evals:10'236 #gen_moves:88 #gen_evals:26 #comp_moves:16 #backtracks:36 #weight_updates:326)
#Bound   0.11s best:629   next:[531,628]  objective_lb_search_no_lp
#38      0.11s best:628   next:[531,627]  graph_dec_lns (d=0.88 s=120 t=0.10 p=1.00 stall=0 h=auto_l0)
#39      0.11s best:618   next:[531,617]  graph_var_lns (d=0.88 s=95 t=0.10 p=1.00 stall=0 h=auto_l0)
#40      0.12s best:617   next:[531,616]  violation_ls(batch:6 #solutions_imported:6 #lin_moves:4'432 #lin_evals:23'417 #gen_moves:412 #gen_evals:154 #comp_moves:24 #backtracks:194 #weight_updates:2'296)
#41      0.12s best:616   next:[531,615]  violation_ls(batch:7 #solutions_imported:7 #lin_moves:4'432 #lin_evals:23'419 #gen_moves:413 #gen_evals:154 #comp_moves:25 #backtracks:194 #weight_updates:2'296)
#42      0.12s best:615   next:[531,614]  violation_ls(batch:8 #solutions_imported:8 #lin_moves:4'433 #lin_evals:23'424 #gen_moves:413 #gen_evals:154 #comp_moves:25 #backtracks:194 #weight_updates:2'296)
#43      0.12s best:614   next:[531,613]  violation_ls(batch:9 #solutions_imported:9 #lin_moves:4'433 #lin_evals:23'443 #gen_moves:428 #gen_evals:159 #comp_moves:26 #backtracks:201 #weight_updates:2'296)
#Bound   0.12s best:614   next:[534,613]  objective_lb_search_no_lp
#44      0.12s best:613   next:[534,612]  violation_ls(batch:6 #solutions_imported:6 #lin_moves:567 #lin_evals:6'773 #gen_moves:3'481 #gen_evals:1'414 #comp_moves:95 #backtracks:1'693 #weight_updates:163)
#45      0.12s best:603   next:[534,602]  graph_var_lns (d=0.91 s=130 t=0.10 p=1.00 stall=1 h=auto_l0)
#46      0.12s best:567   next:[534,566]  no_lp (fixed_bools=0/178)
#Bound   0.13s best:567   next:[542,566]  objective_lb_search_no_lp
#Model   0.14s var:83/85 constraints:397/434
#Bound   0.14s best:567   next:[544,566]  objective_lb_search_no_lp
#Bound   0.14s best:567   next:[545,566]  objective_lb_search_no_lp
#Bound   0.14s best:567   next:[546,566]  objective_lb_search_no_lp
#Bound   0.15s best:567   next:[554,566]  objective_lb_search_no_lp
#Model   0.16s var:82/85 constraints:383/434
#Model   0.16s var:81/85 constraints:352/434
#Done    0.16s no_lp
#Done    0.16s objective_lb_search_no_lp
#Done    0.16s quick_restart_no_lp
#Model   0.16s var:78/85 constraints:316/434
#Done    0.16s core
#Bound   0.16s best:567   next:[560,566]  objective_lb_search_no_lp [skipped_logs=1]

Task timing                                  n [     min,      max]      avg      dev     time         n [     min,      max]      avg      dev    dtime
                             'core':         1 [109.84ms, 109.84ms] 109.84ms   0.00ns 109.84ms         1 [ 11.06ms,  11.06ms]  11.06ms   0.00ns  11.06ms
                       'default_lp':         1 [110.00ms, 110.00ms] 110.00ms   0.00ns 110.00ms         1 [  8.58ms,   8.58ms]   8.58ms   0.00ns   8.58ms
                 'feasibility_pump':        13 [  1.48ms,   9.45ms]   3.78ms   1.81ms  49.08ms        12 [465.55us, 786.05us] 496.91us  87.23us   5.96ms
                  'fj_long_default':         0 [  0.00ns,   0.00ns]   0.00ns   0.00ns   0.00ns         0 [  0.00ns,   0.00ns]   0.00ns   0.00ns   0.00ns
                  'fj_long_default':         0 [  0.00ns,   0.00ns]   0.00ns   0.00ns   0.00ns         0 [  0.00ns,   0.00ns]   0.00ns   0.00ns   0.00ns
              'fj_long_lin_default':         0 [  0.00ns,   0.00ns]   0.00ns   0.00ns   0.00ns         0 [  0.00ns,   0.00ns]   0.00ns   0.00ns   0.00ns
              'fj_long_lin_perturb':         0 [  0.00ns,   0.00ns]   0.00ns   0.00ns   0.00ns         0 [  0.00ns,   0.00ns]   0.00ns   0.00ns   0.00ns
               'fj_long_lin_random':         0 [  0.00ns,   0.00ns]   0.00ns   0.00ns   0.00ns         0 [  0.00ns,   0.00ns]   0.00ns   0.00ns   0.00ns
                  'fj_long_perturb':         0 [  0.00ns,   0.00ns]   0.00ns   0.00ns   0.00ns         0 [  0.00ns,   0.00ns]   0.00ns   0.00ns   0.00ns
                   'fj_long_random':         0 [  0.00ns,   0.00ns]   0.00ns   0.00ns   0.00ns         0 [  0.00ns,   0.00ns]   0.00ns   0.00ns   0.00ns
                 'fj_short_default':         0 [  0.00ns,   0.00ns]   0.00ns   0.00ns   0.00ns         0 [  0.00ns,   0.00ns]   0.00ns   0.00ns   0.00ns
                 'fj_short_default':         0 [  0.00ns,   0.00ns]   0.00ns   0.00ns   0.00ns         0 [  0.00ns,   0.00ns]   0.00ns   0.00ns   0.00ns
             'fj_short_lin_default':         0 [  0.00ns,   0.00ns]   0.00ns   0.00ns   0.00ns         0 [  0.00ns,   0.00ns]   0.00ns   0.00ns   0.00ns
             'fj_short_lin_default':         0 [  0.00ns,   0.00ns]   0.00ns   0.00ns   0.00ns         0 [  0.00ns,   0.00ns]   0.00ns   0.00ns   0.00ns
             'fj_short_lin_perturb':         0 [  0.00ns,   0.00ns]   0.00ns   0.00ns   0.00ns         0 [  0.00ns,   0.00ns]   0.00ns   0.00ns   0.00ns
              'fj_short_lin_random':         0 [  0.00ns,   0.00ns]   0.00ns   0.00ns   0.00ns         0 [  0.00ns,   0.00ns]   0.00ns   0.00ns   0.00ns
                 'fj_short_perturb':         0 [  0.00ns,   0.00ns]   0.00ns   0.00ns   0.00ns         0 [  0.00ns,   0.00ns]   0.00ns   0.00ns   0.00ns
                  'fj_short_random':         0 [  0.00ns,   0.00ns]   0.00ns   0.00ns   0.00ns         0 [  0.00ns,   0.00ns]   0.00ns   0.00ns   0.00ns
                        'fs_random':         0 [  0.00ns,   0.00ns]   0.00ns   0.00ns   0.00ns         0 [  0.00ns,   0.00ns]   0.00ns   0.00ns   0.00ns
                        'fs_random':         0 [  0.00ns,   0.00ns]   0.00ns   0.00ns   0.00ns         0 [  0.00ns,   0.00ns]   0.00ns   0.00ns   0.00ns
                        'fs_random':         1 [  1.98ms,   1.98ms]   1.98ms   0.00ns   1.98ms         0 [  0.00ns,   0.00ns]   0.00ns   0.00ns   0.00ns
                        'fs_random':         1 [  2.43ms,   2.43ms]   2.43ms   0.00ns   2.43ms         0 [  0.00ns,   0.00ns]   0.00ns   0.00ns   0.00ns
                  'fs_random_no_lp':         0 [  0.00ns,   0.00ns]   0.00ns   0.00ns   0.00ns         0 [  0.00ns,   0.00ns]   0.00ns   0.00ns   0.00ns
                  'fs_random_no_lp':         0 [  0.00ns,   0.00ns]   0.00ns   0.00ns   0.00ns         0 [  0.00ns,   0.00ns]   0.00ns   0.00ns   0.00ns
                  'fs_random_no_lp':         0 [  0.00ns,   0.00ns]   0.00ns   0.00ns   0.00ns         0 [  0.00ns,   0.00ns]   0.00ns   0.00ns   0.00ns
                  'fs_random_no_lp':         1 [  1.87ms,   1.87ms]   1.87ms   0.00ns   1.87ms         0 [  0.00ns,   0.00ns]   0.00ns   0.00ns   0.00ns
          'fs_random_quick_restart':         0 [  0.00ns,   0.00ns]   0.00ns   0.00ns   0.00ns         0 [  0.00ns,   0.00ns]   0.00ns   0.00ns   0.00ns
          'fs_random_quick_restart':         0 [  0.00ns,   0.00ns]   0.00ns   0.00ns   0.00ns         0 [  0.00ns,   0.00ns]   0.00ns   0.00ns   0.00ns
          'fs_random_quick_restart':         1 [  2.00ms,   2.00ms]   2.00ms   0.00ns   2.00ms         0 [  0.00ns,   0.00ns]   0.00ns   0.00ns   0.00ns
          'fs_random_quick_restart':         1 [  2.29ms,   2.29ms]   2.29ms   0.00ns   2.29ms         0 [  0.00ns,   0.00ns]   0.00ns   0.00ns   0.00ns
    'fs_random_quick_restart_no_lp':         0 [  0.00ns,   0.00ns]   0.00ns   0.00ns   0.00ns         0 [  0.00ns,   0.00ns]   0.00ns   0.00ns   0.00ns
    'fs_random_quick_restart_no_lp':         0 [  0.00ns,   0.00ns]   0.00ns   0.00ns   0.00ns         0 [  0.00ns,   0.00ns]   0.00ns   0.00ns   0.00ns
    'fs_random_quick_restart_no_lp':         1 [  1.66ms,   1.66ms]   1.66ms   0.00ns   1.66ms         0 [  0.00ns,   0.00ns]   0.00ns   0.00ns   0.00ns
                    'graph_arc_lns':        12 [  1.78ms,  68.49ms]  27.80ms  21.48ms 333.56ms        10 [ 10.00ns,   2.82ms] 712.12us 945.28us   7.12ms
                    'graph_cst_lns':        12 [419.45us,  16.05ms]   1.86ms   4.28ms  22.26ms         0 [  0.00ns,   0.00ns]   0.00ns   0.00ns   0.00ns
                    'graph_dec_lns':        12 [  1.72ms,  45.75ms]  18.75ms  13.02ms 225.04ms         7 [ 10.00ns,   1.27ms] 335.90us 422.48us   2.35ms
                    'graph_var_lns':        13 [  2.28ms,  42.64ms]  18.21ms  12.08ms 236.79ms        10 [  5.52us, 763.72us] 242.96us 222.15us   2.43ms
                   'lb_tree_search':         1 [108.63ms, 108.63ms] 108.63ms   0.00ns 108.63ms         1 [  2.32ms,   2.32ms]   2.32ms   0.00ns   2.32ms
                           'max_lp':         1 [109.52ms, 109.52ms] 109.52ms   0.00ns 109.52ms         1 [  2.30ms,   2.30ms]   2.30ms   0.00ns   2.30ms
                            'no_lp':         1 [106.58ms, 106.58ms] 106.58ms   0.00ns 106.58ms         1 [ 13.94ms,  13.94ms]  13.94ms   0.00ns  13.94ms
              'objective_lb_search':         1 [108.03ms, 108.03ms] 108.03ms   0.00ns 108.03ms         1 [  5.26ms,   5.26ms]   5.26ms   0.00ns   5.26ms
       'objective_lb_search_max_lp':         1 [106.96ms, 106.96ms] 106.96ms   0.00ns 106.96ms         1 [  2.94ms,   2.94ms]   2.94ms   0.00ns   2.94ms
        'objective_lb_search_no_lp':         1 [104.36ms, 104.36ms] 104.36ms   0.00ns 104.36ms         1 [ 11.06ms,  11.06ms]  11.06ms   0.00ns  11.06ms
  'objective_shaving_search_max_lp':        11 [  1.00ms,  17.41ms]   7.61ms   4.53ms  83.67ms         4 [125.56us, 277.65us] 170.21us  62.27us 680.82us
   'objective_shaving_search_no_lp':        10 [889.95us,  20.74ms]   8.41ms   6.45ms  84.07ms         1 [277.65us, 277.65us] 277.65us   0.00ns 277.65us
                          'probing':         1 [110.69ms, 110.69ms] 110.69ms   0.00ns 110.69ms         1 [  3.62ms,   3.62ms]   3.62ms   0.00ns   3.62ms
                   'probing_max_lp':         1 [107.92ms, 107.92ms] 107.92ms   0.00ns 107.92ms         1 [  2.19ms,   2.19ms]   2.19ms   0.00ns   2.19ms
                     'pseudo_costs':         1 [108.32ms, 108.32ms] 108.32ms   0.00ns 108.32ms         1 [  3.40ms,   3.40ms]   3.40ms   0.00ns   3.40ms
                    'quick_restart':         1 [109.07ms, 109.07ms] 109.07ms   0.00ns 109.07ms         1 [  8.95ms,   8.95ms]   8.95ms   0.00ns   8.95ms
              'quick_restart_no_lp':         1 [106.11ms, 106.11ms] 106.11ms   0.00ns 106.11ms         1 [ 10.49ms,  10.49ms]  10.49ms   0.00ns  10.49ms
                    'reduced_costs':         1 [108.78ms, 108.78ms] 108.78ms   0.00ns 108.78ms         1 [  3.47ms,   3.47ms]   3.47ms   0.00ns   3.47ms
                        'rins/rens':        13 [  3.74ms,  82.19ms]  30.91ms  25.77ms 401.81ms         8 [ 25.16us,   6.88ms]   1.76ms   2.28ms  14.08ms
                      'rnd_cst_lns':        13 [599.17us,  23.58ms]   9.35ms   8.45ms 121.54ms         6 [ 10.00ns, 277.53us] 120.78us 123.98us 724.66us
                      'rnd_var_lns':        13 [  1.58ms,  59.61ms]  18.24ms  15.98ms 237.12ms        10 [ 10.00ns,   1.49ms] 408.90us 498.18us   4.09ms
                     'violation_ls':         5 [174.32us,  66.91ms]  17.97ms  25.33ms  89.86ms         5 [ 10.84us,  43.08ms]  11.16ms  16.41ms  55.80ms
                     'violation_ls':         6 [  3.09us,  67.51ms]  11.94ms  24.87ms  71.65ms         5 [ 15.36us,  40.96ms]   8.44ms  16.26ms  42.21ms
                     'violation_ls':         8 [131.42us,  35.99ms]  10.21ms  14.35ms  81.70ms         8 [510.00ns,  24.37ms]   6.30ms   9.38ms  50.36ms
                     'violation_ls':        11 [101.34us,  25.78ms]   6.33ms   9.61ms  69.67ms        11 [330.00ns,  12.16ms]   3.08ms   4.76ms  33.89ms
                     'violation_ls':        11 [121.41us,  21.43ms]   4.11ms   7.95ms  45.26ms        11 [510.00ns,  16.52ms]   2.49ms   5.31ms  27.39ms

Search stats                        Bools  Conflicts  Branches  Restarts  BoolPropag  IntegerPropag
                           'core':    717        172     1'164       477      32'704         26'890
                     'default_lp':     92         46     1'048       472       2'140         22'630
                      'fs_random':      0          0         0         0           0              0
                      'fs_random':      0          0         0         0           0              0
                      'fs_random':     47          0         0         0           0              0
                      'fs_random':     47          0         0         0           0              0
                'fs_random_no_lp':      0          0         0         0           0              0
                'fs_random_no_lp':      0          0         0         0           0              0
                'fs_random_no_lp':      0          0         0         0           0              0
                'fs_random_no_lp':     47          0         0         0           0              0
        'fs_random_quick_restart':      0          0         0         0           0              0
        'fs_random_quick_restart':      0          0         0         0           0              0
        'fs_random_quick_restart':     47          0         0         0           0              0
        'fs_random_quick_restart':     47          0         0         0           0              0
  'fs_random_quick_restart_no_lp':      0          0         0         0           0              0
  'fs_random_quick_restart_no_lp':      0          0         0         0           0              0
  'fs_random_quick_restart_no_lp':     47          0         0         0           0              0
                 'lb_tree_search':     47          0        94        94          31            676
                         'max_lp':     47          0        94        94          24            606
                          'no_lp':    179        354     2'228       549      20'576         71'928
            'objective_lb_search':     58         37       331       187         943          7'505
     'objective_lb_search_max_lp':     51          0        99        94          31            673
      'objective_lb_search_no_lp':     70        355     1'244       487       6'307         61'093
                        'probing':     89         21       157       157         537          2'401
                 'probing_max_lp':     49          1        97        97          42            661
                   'pseudo_costs':     52          2       109        94          60            799
                  'quick_restart':     78         18       915       448       1'044         11'563
            'quick_restart_no_lp':    178        305     2'095       446      14'457         53'924
                  'reduced_costs':     56          6       109        94         112          1'059

SAT stats                           ClassicMinim  LitRemoved  LitLearned  LitForgotten  Subsumed  MClauses  MDecisions  MLitTrue  MSubsumed  MLitRemoved  MReused
                           'core':            18          90          89             0         1        43         263         0          0            1        6
                     'default_lp':            13          18         285             0         4        82         380         0         14           60        9
                      'fs_random':             0           0           0             0         0         0           0         0          0            0        0
                      'fs_random':             0           0           0             0         0         0           0         0          0            0        0
                      'fs_random':             0           0           0             0         0         0           0         0          0            0        0
                      'fs_random':             0           0           0             0         0         0           0         0          0            0        0
                'fs_random_no_lp':             0           0           0             0         0         0           0         0          0            0        0
                'fs_random_no_lp':             0           0           0             0         0         0           0         0          0            0        0
                'fs_random_no_lp':             0           0           0             0         0         0           0         0          0            0        0
                'fs_random_no_lp':             0           0           0             0         0         0           0         0          0            0        0
        'fs_random_quick_restart':             0           0           0             0         0         0           0         0          0            0        0
        'fs_random_quick_restart':             0           0           0             0         0         0           0         0          0            0        0
        'fs_random_quick_restart':             0           0           0             0         0         0           0         0          0            0        0
        'fs_random_quick_restart':             0           0           0             0         0         0           0         0          0            0        0
  'fs_random_quick_restart_no_lp':             0           0           0             0         0         0           0         0          0            0        0
  'fs_random_quick_restart_no_lp':             0           0           0             0         0         0           0         0          0            0        0
  'fs_random_quick_restart_no_lp':             0           0           0             0         0         0           0         0          0            0        0
                 'lb_tree_search':             0           0           0             0         0         0           0         0          0            0        0
                         'max_lp':             0           0           0             0         0         0           0         0          0            0        0
                          'no_lp':           194         375       1'867             0        34       100         439         3         39          179        9
            'objective_lb_search':            18          31         139             0         7        16          78         0          0            0        2
     'objective_lb_search_max_lp':             0           0           0             0         0         0           0         0          0            0        0
      'objective_lb_search_no_lp':           248         536       1'427             0        29        91         433         0         19           91       28
                        'probing':             0           0          21             0         0         0           0         0          0            0        0
                 'probing_max_lp':             0           0           1             0         0         0           0         0          0            0        0
                   'pseudo_costs':             0           0           7             0         0         0           0         0          0            0        0
                  'quick_restart':            11          28         161             0         0        46         224         0          0            0        6
            'quick_restart_no_lp':           141         243       1'988             0        20        78         434         0         17           98       15
                  'reduced_costs':             4           8          26             0         0         0           0         0          0            0        0

Lp stats                         Component  Iterations  AddedCuts  OPTIMAL  DUAL_F.  DUAL_U.
                  'default_lp':          1         369        428       84        0        0
                   'fs_random':          1           0          0        0        0        0
                   'fs_random':          1           0          0        0        0        0
     'fs_random_quick_restart':          1           0          0        0        0        0
     'fs_random_quick_restart':          1           0          0        0        0        0
              'lb_tree_search':          1         158        791        7        0        0
                      'max_lp':          1         159        817        7        0        0
         'objective_lb_search':          1         317        486       59        0        0
  'objective_lb_search_max_lp':          1         258        676       14        1        0
                     'probing':          1         186        578       70        0        0
              'probing_max_lp':          1         154        787        7        0        0
                'pseudo_costs':          1         286        662       18        2        0
               'quick_restart':          1         485        483      106        0        0
               'reduced_costs':          1         300        684       20        2        0

Lp dimension                                                                    Final dimension of first component
                  'default_lp':   222 rows, 79 columns, 412 entries with magnitude in [3.176094e-03, 1.000000e+00]
                   'fs_random':       0 rows, 79 columns, 0 entries with magnitude in [0.000000e+00, 0.000000e+00]
                   'fs_random':       0 rows, 79 columns, 0 entries with magnitude in [0.000000e+00, 0.000000e+00]
     'fs_random_quick_restart':       0 rows, 79 columns, 0 entries with magnitude in [0.000000e+00, 0.000000e+00]
     'fs_random_quick_restart':       0 rows, 79 columns, 0 entries with magnitude in [0.000000e+00, 0.000000e+00]
              'lb_tree_search':  584 rows, 85 columns, 3132 entries with magnitude in [4.811924e-03, 1.000000e+00]
                      'max_lp':  584 rows, 85 columns, 3165 entries with magnitude in [5.263485e-03, 1.000000e+00]
         'objective_lb_search':   245 rows, 79 columns, 512 entries with magnitude in [2.751909e-03, 1.000000e+00]
  'objective_lb_search_max_lp':  302 rows, 85 columns, 1201 entries with magnitude in [6.358544e-04, 1.000000e+00]
                     'probing':  251 rows, 79 columns, 1085 entries with magnitude in [4.800596e-04, 1.000000e+00]
              'probing_max_lp':  584 rows, 85 columns, 3154 entries with magnitude in [5.341383e-03, 1.000000e+00]
                'pseudo_costs':  301 rows, 85 columns, 1172 entries with magnitude in [1.175279e-03, 1.000000e+00]
               'quick_restart':   245 rows, 79 columns, 951 entries with magnitude in [2.108620e-03, 1.000000e+00]
               'reduced_costs':  302 rows, 85 columns, 1144 entries with magnitude in [6.137911e-04, 1.000000e+00]

Lp debug                         CutPropag  CutEqPropag  Adjust  Overflow  Bad  BadScaling
                  'default_lp':          0            0      58         0  311           0
                   'fs_random':          0            0       0         0    0           0
                   'fs_random':          0            0       0         0    0           0
     'fs_random_quick_restart':          0            0       0         0    0           0
     'fs_random_quick_restart':          0            0       0         0    0           0
              'lb_tree_search':          0            0       4         0  464           0
                      'max_lp':          0            0       6         0  429           0
         'objective_lb_search':          2            0      34         0  442           0
  'objective_lb_search_max_lp':          0            0       9         0  314           0
                     'probing':          0            0      59         0  515           0
              'probing_max_lp':          0            0       6         0  384           0
                'pseudo_costs':          0            0       9         0  325           0
               'quick_restart':          0            0      65         0  443           0
               'reduced_costs':          0            0      17         0  310           0

Lp pool                          Constraints  Updates  Simplif  Merged  Shortened  Split  Strenghtened  Cuts/Call
                  'default_lp':          496      105      418       0        271     14           183    428/738
                   'fs_random':           68        0        0       0          0      0             0        0/0
                   'fs_random':           68        0        0       0          0      0             0        0/0
     'fs_random_quick_restart':           68        0        0       0          0      0             0        0/0
     'fs_random_quick_restart':           68        0        0       0          0      0             0        0/0
              'lb_tree_search':        1'223        8        0       1          0     19           120  791/1'255
                      'max_lp':        1'249        9        0       1          0     19           128  817/1'300
         'objective_lb_search':          554       92      750       0        279      4           245    486/830
  'objective_lb_search_max_lp':        1'109        4       14       0          0      3            75  676/1'039
                     'probing':          646       12       17       0          0     11            27    578/947
              'probing_max_lp':        1'219        5        0       1          0     10           119  787/1'310
                'pseudo_costs':        1'095       12      106       0          0      0           303  662/1'040
               'quick_restart':          551       70       79       0         23      3            67    483/857
               'reduced_costs':        1'117       17      107       0          0      1           292  684/1'080

Lp Cut            defaul  max_lp  quick_  reduce  pseudo  lb_tre  probin  object  probin  object
          CG_FF:      44     132      55      79      67     130      62      56     133      69
           CG_K:      29      53      34      33      24      37      45      30      52      32
           CG_R:       4      57      21      21      21      56      19       4      55      19
          CG_RB:      73     177      98     149     143     172     151     111     171     158
         CG_RBP:       7      30       6      10      13      37      21      10      27      20
         Clique:       -       -       -       7       9       -       -       -       -       9
             IB:     140      92     135     123     120      91     131     133      93     121
       MIR_1_FF:      42      68      45      64      67      68      47      47      62      63
        MIR_1_K:       8      14      13       5       6      17      13       9      15       4
        MIR_1_R:       3       2       5       2       2       1       8       2       1       1
       MIR_1_RB:      24      41      24      51      52      35      19      27      38      53
      MIR_1_RBP:       -      11       -      13      12      10       -       -      12      13
      MIR_1_RLT:       -       2       -       3       3       2       -       -       1       3
       MIR_2_FF:       5      11      10      20      15      16      11      10      10      14
        MIR_2_K:       2       2       2       3       3       4       5       2       3       4
        MIR_2_R:       2       1       -       3       2       1       2       -       1       6
       MIR_2_RB:      10       5       9      13      19      13       9      13       3      13
      MIR_2_RBP:       1       2       -       -       1       2       1       -       3       1
       MIR_3_FF:       1      10       2       8       6       9       3       1       9       6
        MIR_3_K:       -       5       -       2       -       4       -       -       2       -
        MIR_3_R:       1       4       -       2       2       1       1       -       3       2
       MIR_3_RB:       3       3       3       9       7       5       3       -       3       5
      MIR_3_RBP:       -       5       -       -       -       4       -       -       5       -
       MIR_4_FF:       1       4       -       1       -       3       -       -       4       1
        MIR_4_R:       -       -       -       -       -       4       -       -       -       1
       MIR_4_RB:       1       2       1       1       1       -       1       1       4       1
      MIR_4_RBP:       -       1       -       -       -       3       -       -       -       -
       MIR_5_FF:       -       2       -       -       -       1       -       -       4       -
        MIR_5_R:       -       -       -       -       -       -       -       -       1       -
       MIR_5_RB:       -       1       -       -       -       -       -       -       1       -
      MIR_5_RBP:       -       1       -       -       -       -       -       -       2       -
       MIR_6_FF:       -       1       -       -       -       1       -       -       1       -
        MIR_6_R:       -       -       -       -       -       1       -       -       -       -
      MIR_6_RBP:       -       1       -       -       -       -       -       -       -       -
   ZERO_HALF_FF:       7      16       4      18      19      16       7       8      15      16
    ZERO_HALF_K:       1       9       3       -       -       6       1       1      11       -
    ZERO_HALF_R:      10      22       8      20      20      21       9      11      19      18
   ZERO_HALF_RB:       7      17       5      20      24      11       8      10      13      19
  ZERO_HALF_RBP:       2      13       -       4       4       9       1       -      10       4

LNS stats           Improv/Calls  Closed  Difficulty  TimeLimit
  'graph_arc_lns':          5/10     90%        0.98       0.10
  'graph_cst_lns':           0/0      0%        0.50       0.10
  'graph_dec_lns':          8/10     80%        0.96       0.10
  'graph_var_lns':          9/11     91%        0.98       0.10
      'rins/rens':          2/11     64%        0.90       0.10
    'rnd_cst_lns':           0/7    100%        0.97       0.10
    'rnd_var_lns':          6/10     90%        0.98       0.10

LS stats                   Batches  Restarts  LinMoves  GenMoves  CompoundMoves  WeightUpdates
       'fj_long_default':        0         0         0         0              0              0
       'fj_long_default':        0         0         0         0              0              0
   'fj_long_lin_default':        0         0         0         0              0              0
   'fj_long_lin_perturb':        0         0         0         0              0              0
    'fj_long_lin_random':        0         0         0         0              0              0
       'fj_long_perturb':        0         0         0         0              0              0
        'fj_long_random':        0         0         0         0              0              0
      'fj_short_default':        0         0         0         0              0              0
      'fj_short_default':        0         0         0         0              0              0
  'fj_short_lin_default':        0         0         0         0              0              0
  'fj_short_lin_default':        0         0         0         0              0              0
  'fj_short_lin_perturb':        0         0         0         0              0              0
   'fj_short_lin_random':        0         0         0         0              0              0
      'fj_short_perturb':        0         0         0         0              0              0
       'fj_short_random':        0         0         0         0              0              0
          'violation_ls':       11         0     2'175     1'338            118            330
          'violation_ls':       11         0     6'775       428             26          2'530
          'violation_ls':        5         0     2'560     5'927            164          2'260
          'violation_ls':        5         0       331     6'237            116            159
          'violation_ls':        8         0     4'327     3'481             95          2'738

Solutions (46)            Num     Rank
        'graph_dec_lns':    2  [22,38]
        'graph_var_lns':    2  [39,45]
                'no_lp':   14   [1,46]
  'quick_restart_no_lp':    5  [17,36]
        'rins_pump_lns':    1  [19,19]
         'violation_ls':   22   [2,44]

Objective bounds                Num
                  'bool_core':    1
                 'default_lp':    1
             'initial_domain':    1
  'objective_lb_search_no_lp':   19
              'quick_restart':    1

Solution repositories    Added  Queried  Ignored  Synchro
  'feasible solutions':    112      225        5       76
        'lp solutions':      0        0        0        0
                'pump':     84       13

Improving bounds shared         Num
                       'core':    6
                 'default_lp':    1
                      'no_lp':  122
        'objective_lb_search':   23
  'objective_lb_search_no_lp':    8
                    'probing':    2
              'quick_restart':    1
        'quick_restart_no_lp':   19

Clauses shared                  Num
                       'core':    2
                 'default_lp':    3
                      'no_lp':   27
        'objective_lb_search':    1
  'objective_lb_search_no_lp':    3
              'quick_restart':   11
        'quick_restart_no_lp':    5

CpSolverResponse summary:
status: OPTIMAL
objective: 567
best_bound: 567
integers: 0
booleans: 0
conflicts: 0
branches: 0
propagations: 0
integer_propagations: 0
restarts: 0
lp_iterations: 0
walltime: 0.169301
usertime: 0.169301
deterministic_time: 0.337987
gap_integral: 0.726542
solution_fingerprint: 0x89607c839f4a92cf


--- Simulation Gantt  partir du modle mathmatique ---
{'big':1, 'due_date':83, 'pos_time':5, 'status':1, 'blocked':2, 'operations':["{'type':0, 'processing_time':25}", "{'type':1, 'processing_time':19}"]}
{'big':1, 'due_date':80, 'pos_time':5, 'status':0, 'blocked':0, 'operations':["{'type':0, 'processing_time':60}", "{'type':1, 'processing_time':14}"]}
{'big':0, 'due_date':64, 'pos_time':5, 'status':3, 'blocked':2, 'operations':["{'type':0, 'processing_time':57}", "{'type':1, 'processing_time':35}"]}
{'big':0, 'due_date':153, 'pos_time':5, 'status':3, 'blocked':1, 'operations':["{'type':0, 'processing_time':47}", "{'type':1, 'processing_time':44}"]}
