created virtual environment CPython3.12.4.final.0-64 in 1760ms
  creator CPython3Posix(dest=/localscratch/aneumann.47038273.0/env, clear=False, no_vcs_ignore=False, global=False)
  seeder FromAppData(download=False, pip=bundle, via=copy, app_data_dir=/home/aneumann/.local/share/virtualenv)
    added seed packages: pip==24.2+computecanada
  activators BashActivator,CShellActivator,FishActivator,NushellActivator,PowerShellActivator,PythonActivator
Looking in links: /cvmfs/soft.computecanada.ca/custom/python/wheelhouse/gentoo2023/x86-64-v3, /cvmfs/soft.computecanada.ca/custom/python/wheelhouse/gentoo2023/generic, /cvmfs/soft.computecanada.ca/custom/python/wheelhouse/generic
Requirement already satisfied: pip in /localscratch/aneumann.47038273.0/env/lib/python3.12/site-packages (24.2+computecanada)
Processing /cvmfs/soft.computecanada.ca/custom/python/wheelhouse/generic/pip-25.0+computecanada-py3-none-any.whl
Installing collected packages: pip
  Attempting uninstall: pip
    Found existing installation: pip 24.2+computecanada
    Uninstalling pip-24.2+computecanada:
      Successfully uninstalled pip-24.2+computecanada
Successfully installed pip-25.0+computecanada
Looking in links: /cvmfs/soft.computecanada.ca/custom/python/wheelhouse/gentoo2023/x86-64-v3, /cvmfs/soft.computecanada.ca/custom/python/wheelhouse/gentoo2023/generic, /cvmfs/soft.computecanada.ca/custom/python/wheelhouse/generic
ERROR: protobuf-5.28.3-cp38-abi3-manylinux2014_x86_64.whl is not a supported wheel on this platform.
Looking in links: /cvmfs/soft.computecanada.ca/custom/python/wheelhouse/gentoo2023/x86-64-v3, /cvmfs/soft.computecanada.ca/custom/python/wheelhouse/gentoo2023/generic, /cvmfs/soft.computecanada.ca/custom/python/wheelhouse/generic
Processing /home/aneumann/projects/def-adhaj/aneumann/GNRS/wheels/immutabledict-4.2.0-py3-none-any.whl
Installing collected packages: immutabledict
Successfully installed immutabledict-4.2.0
Looking in links: /cvmfs/soft.computecanada.ca/custom/python/wheelhouse/gentoo2023/x86-64-v3, /cvmfs/soft.computecanada.ca/custom/python/wheelhouse/gentoo2023/generic, /cvmfs/soft.computecanada.ca/custom/python/wheelhouse/generic
Processing /cvmfs/soft.computecanada.ca/custom/python/wheelhouse/generic/ortools-9.10.4067+computecanada-cp312-cp312-linux_x86_64.whl (from -r /home/aneumann/projects/def-adhaj/aneumann/GNRS/requirements/or.txt (line 1))
Processing /cvmfs/soft.computecanada.ca/custom/python/wheelhouse/gentoo2023/x86-64-v3/matplotlib-3.10.0+computecanada-cp312-cp312-linux_x86_64.whl (from -r /home/aneumann/projects/def-adhaj/aneumann/GNRS/requirements/or.txt (line 2))
Processing /cvmfs/soft.computecanada.ca/custom/python/wheelhouse/gentoo2023/x86-64-v3/pandas-2.2.3+computecanada-cp312-cp312-linux_x86_64.whl (from -r /home/aneumann/projects/def-adhaj/aneumann/GNRS/requirements/or.txt (line 3))
Processing /cvmfs/soft.computecanada.ca/custom/python/wheelhouse/generic/absl_py-2.3.0+computecanada-py3-none-any.whl (from ortools<9.11,>=9.10->-r /home/aneumann/projects/def-adhaj/aneumann/GNRS/requirements/or.txt (line 1))
Processing /cvmfs/soft.computecanada.ca/custom/python/wheelhouse/gentoo2023/generic/numpy-2.2.2+computecanada-cp312-cp312-linux_x86_64.whl (from ortools<9.11,>=9.10->-r /home/aneumann/projects/def-adhaj/aneumann/GNRS/requirements/or.txt (line 1))
Processing /cvmfs/soft.computecanada.ca/custom/python/wheelhouse/gentoo2023/x86-64-v3/protobuf-6.31.1+computecanada-cp312-cp312-linux_x86_64.whl (from ortools<9.11,>=9.10->-r /home/aneumann/projects/def-adhaj/aneumann/GNRS/requirements/or.txt (line 1))
Requirement already satisfied: immutabledict>=3.0.0 in /localscratch/aneumann.47038273.0/env/lib/python3.12/site-packages (from ortools<9.11,>=9.10->-r /home/aneumann/projects/def-adhaj/aneumann/GNRS/requirements/or.txt (line 1)) (4.2.0)
Processing /cvmfs/soft.computecanada.ca/custom/python/wheelhouse/gentoo2023/generic/contourpy-1.3.1+computecanada-cp312-cp312-linux_x86_64.whl (from matplotlib->-r /home/aneumann/projects/def-adhaj/aneumann/GNRS/requirements/or.txt (line 2))
Processing /cvmfs/soft.computecanada.ca/custom/python/wheelhouse/generic/cycler-0.12.1+computecanada-py3-none-any.whl (from matplotlib->-r /home/aneumann/projects/def-adhaj/aneumann/GNRS/requirements/or.txt (line 2))
Processing /cvmfs/soft.computecanada.ca/custom/python/wheelhouse/generic/fonttools-4.59.0+computecanada-cp312-cp312-linux_x86_64.whl (from matplotlib->-r /home/aneumann/projects/def-adhaj/aneumann/GNRS/requirements/or.txt (line 2))
Processing /cvmfs/soft.computecanada.ca/custom/python/wheelhouse/gentoo2023/x86-64-v3/kiwisolver-1.4.8+computecanada-cp312-cp312-linux_x86_64.whl (from matplotlib->-r /home/aneumann/projects/def-adhaj/aneumann/GNRS/requirements/or.txt (line 2))
Processing /cvmfs/soft.computecanada.ca/custom/python/wheelhouse/generic/packaging-25.0+computecanada-py3-none-any.whl (from matplotlib->-r /home/aneumann/projects/def-adhaj/aneumann/GNRS/requirements/or.txt (line 2))
Processing /cvmfs/soft.computecanada.ca/custom/python/wheelhouse/gentoo2023/x86-64-v3/pillow-11.1.0+computecanada-cp312-cp312-linux_x86_64.whl (from matplotlib->-r /home/aneumann/projects/def-adhaj/aneumann/GNRS/requirements/or.txt (line 2))
Processing /cvmfs/soft.computecanada.ca/custom/python/wheelhouse/generic/pyparsing-3.2.3+computecanada-py3-none-any.whl (from matplotlib->-r /home/aneumann/projects/def-adhaj/aneumann/GNRS/requirements/or.txt (line 2))
Processing /cvmfs/soft.computecanada.ca/custom/python/wheelhouse/generic/python_dateutil-2.9.0.post0+computecanada-py2.py3-none-any.whl (from matplotlib->-r /home/aneumann/projects/def-adhaj/aneumann/GNRS/requirements/or.txt (line 2))
Processing /cvmfs/soft.computecanada.ca/custom/python/wheelhouse/generic/pytz-2025.2+computecanada-py2.py3-none-any.whl (from pandas->-r /home/aneumann/projects/def-adhaj/aneumann/GNRS/requirements/or.txt (line 3))
Processing /cvmfs/soft.computecanada.ca/custom/python/wheelhouse/generic/tzdata-2025.2+computecanada-py2.py3-none-any.whl (from pandas->-r /home/aneumann/projects/def-adhaj/aneumann/GNRS/requirements/or.txt (line 3))
Processing /cvmfs/soft.computecanada.ca/custom/python/wheelhouse/generic/six-1.17.0+computecanada-py2.py3-none-any.whl (from python-dateutil>=2.7->matplotlib->-r /home/aneumann/projects/def-adhaj/aneumann/GNRS/requirements/or.txt (line 2))
Installing collected packages: pytz, tzdata, six, pyparsing, protobuf, pillow, packaging, numpy, kiwisolver, fonttools, cycler, absl-py, python-dateutil, contourpy, pandas, matplotlib, ortools
Successfully installed absl-py-2.3.0+computecanada contourpy-1.3.1+computecanada cycler-0.12.1+computecanada fonttools-4.59.0+computecanada kiwisolver-1.4.8+computecanada matplotlib-3.10.0+computecanada numpy-2.2.2+computecanada ortools-9.10.4067+computecanada packaging-25.0+computecanada pandas-2.2.3+computecanada pillow-11.1.0+computecanada protobuf-6.31.1+computecanada pyparsing-3.2.3+computecanada python-dateutil-2.9.0.post0+computecanada pytz-2025.2+computecanada six-1.17.0+computecanada tzdata-2025.2+computecanada

Starting CP-SAT solver v9.10.4067
Parameters: max_time_in_seconds: 86400 max_memory_in_mb: 185000 log_search_progress: true enumerate_all_solutions: false num_search_workers: 32 absolute_gap_limit: 0 relative_gap_limit: 0

Initial optimization model '': (model_fingerprint: 0xfb1740b5b8c8a330)
#Variables: 991 (#ints: 16 in objective)
  - 815 Booleans in [0,1]
  - 176 in [0,1337]
#kLinear1: 90
#kLinear2: 1'910
#kLinear3: 695
#kLinearN: 39'335 (#terms: 1'222'130)

Starting presolve at 0.03s
  5.59e-02s  0.00e+00d  [DetectDominanceRelations] 
  9.06e-01s  0.00e+00d  [PresolveToFixPoint] #num_loops=8 #num_dual_strengthening=3 
  3.86e-04s  0.00e+00d  [ExtractEncodingFromLinear] #potential_supersets=9 
[Symmetry] Graph for symmetry has 41'994 nodes and 1'094'758 arcs.
[Symmetry] Symmetry computation done. time: 0.0379606 dtime: 0.0753485
[Symmetry] #generators: 1, average support size: 48
[Symmetry] The model contains 1063 duplicate constraints !
[Symmetry] 24 orbits with sizes: 2,2,2,2,2,2,2,2,2,2,...
[Symmetry] Num fixable by intersecting at_most_one with orbits: 1 largest_orbit: 2
  4.22e-01s  1.10e-01d  [Probe] #probed=1'380 #new_bounds=13 #equiv=1 
  3.95e-04s  0.00e+00d  [MaxClique] Merged 15(30 literals) into 8(16 literals) at_most_ones. 
  5.51e-02s  0.00e+00d  [DetectDominanceRelations] 
  4.23e-01s  0.00e+00d  [PresolveToFixPoint] #num_loops=5 #num_dual_strengthening=3 
  2.19e-01s  0.00e+00d  [ProcessAtMostOneAndLinear] 
  5.05e-02s  0.00e+00d  [DetectDuplicateConstraints] #duplicates=1'324 #without_enforcements=110 
  1.24e-01s  1.17e-02d  [DetectDominatedLinearConstraints] #relevant_constraints=37'330 #num_inclusions=23'664 
  5.36e-03s  0.00e+00d  [DetectDifferentVariables] #different=74 #cliques=1 #size=11 
  2.08e-02s  1.96e-03d  [ProcessSetPPC] #relevant_constraints=36'237 
  5.70e-04s  0.00e+00d  [FindAlmostIdenticalLinearConstraints] 
  5.55e-03s  7.88e-03d  [FindBigAtMostOneAndLinearOverlap] 
  3.41e-01s  2.15e-01d  [FindBigVerticalLinearOverlap] #blocks=499 #saved_nz=212'471 
  9.82e-03s  4.15e-03d  [FindBigHorizontalLinearOverlap] #linears=35'525 
  3.19e-04s  0.00e+00d  [MergeClauses] 
  6.07e-02s  0.00e+00d  [DetectDominanceRelations] 
  4.99e-01s  0.00e+00d  [PresolveToFixPoint] #num_loops=3 #num_dual_strengthening=1 
  6.18e-02s  0.00e+00d  [DetectDominanceRelations] 
  3.02e-01s  0.00e+00d  [PresolveToFixPoint] #num_loops=1 #num_dual_strengthening=1 
[Symmetry] Graph for symmetry has 42'121 nodes and 878'033 arcs.
[Symmetry] Symmetry computation done. time: 0.0203986 dtime: 0.0432781
  3.87e-01s  9.23e-02d  [Probe] #probed=1'380 #new_bounds=337 
  3.03e-04s  0.00e+00d  [MaxClique] 
  6.04e-02s  0.00e+00d  [DetectDominanceRelations] 
  4.62e-01s  0.00e+00d  [PresolveToFixPoint] #num_loops=2 #num_dual_strengthening=1 
  2.09e-01s  0.00e+00d  [ProcessAtMostOneAndLinear] 
  4.59e-02s  0.00e+00d  [DetectDuplicateConstraints] #without_enforcements=110 
  8.32e-02s  6.86e-03d  [DetectDominatedLinearConstraints] #relevant_constraints=37'371 #num_inclusions=3'476 
  4.87e-03s  0.00e+00d  [DetectDifferentVariables] 
  1.91e-02s  1.52e-03d  [ProcessSetPPC] #relevant_constraints=35'559 
  5.96e-04s  2.91e-06d  [FindAlmostIdenticalLinearConstraints] #num_tested_pairs=174 
  3.00e-03s  3.26e-03d  [FindBigAtMostOneAndLinearOverlap] 
  3.17e-01s  1.60e-01d  [FindBigVerticalLinearOverlap] #blocks=2'345 #saved_nz=253'979 
  8.50e-03s  2.76e-03d  [FindBigHorizontalLinearOverlap] #linears=30'867 
  3.31e-04s  0.00e+00d  [MergeClauses] 
  4.56e-02s  0.00e+00d  [DetectDominanceRelations] 
  4.86e-01s  0.00e+00d  [PresolveToFixPoint] #num_loops=3 #num_dual_strengthening=1 
  4.53e-02s  0.00e+00d  [DetectDominanceRelations] 
  3.11e-01s  0.00e+00d  [PresolveToFixPoint] #num_loops=1 #num_dual_strengthening=1 
[Symmetry] Graph for symmetry has 48'403 nodes and 625'828 arcs.
[Symmetry] Symmetry computation done. time: 0.0149852 dtime: 0.0304241
  3.47e-01s  7.30e-02d  [Probe] #probed=1'380 #new_bounds=1'582 
  3.29e-04s  0.00e+00d  [MaxClique] 
  4.56e-02s  0.00e+00d  [DetectDominanceRelations] 
  4.87e-01s  0.00e+00d  [PresolveToFixPoint] #num_loops=2 #num_dual_strengthening=1 
  2.00e-01s  0.00e+00d  [ProcessAtMostOneAndLinear] 
  4.25e-02s  0.00e+00d  [DetectDuplicateConstraints] #without_enforcements=110 
  5.90e-02s  4.29e-03d  [DetectDominatedLinearConstraints] #relevant_constraints=39'097 #num_inclusions=988 
  4.99e-03s  0.00e+00d  [DetectDifferentVariables] 
  1.49e-02s  9.84e-04d  [ProcessSetPPC] #relevant_constraints=31'027 
  1.26e-03s  1.31e-04d  [FindAlmostIdenticalLinearConstraints] #num_tested_pairs=7'701 
  2.52e-03s  2.08e-03d  [FindBigAtMostOneAndLinearOverlap] 
  1.75e-01s  8.69e-02d  [FindBigVerticalLinearOverlap] #blocks=1'929 #saved_nz=166'530 
  7.10e-03s  1.80e-03d  [FindBigHorizontalLinearOverlap] #linears=25'000 
  3.31e-04s  0.00e+00d  [MergeClauses] 
  3.61e-02s  0.00e+00d  [DetectDominanceRelations] 
  4.87e-01s  0.00e+00d  [PresolveToFixPoint] #num_loops=3 #num_dual_strengthening=1 
  3.00e-03s  0.00e+00d  [ExpandObjective] #entries=20'985 #tight_variables=7'017 #tight_constraints=3'763 

Presolve summary:
  - 328 affine relations were detected.
  - rule 'TODO dual: only one blocking constraint?' was applied 2'456 times.
  - rule 'TODO dual: only one blocking enforced constraint?' was applied 260 times.
  - rule 'TODO dual: only one unspecified blocking constraint?' was applied 77 times.
  - rule 'TODO duplicate: identical constraint with different enforcements' was applied 330 times.
  - rule 'TODO linear inclusion: superset is equality' was applied 1 time.
  - rule 'affine: new relation' was applied 328 times.
  - rule 'at_most_one: removed literals' was applied 8 times.
  - rule 'at_most_one: size one' was applied 8 times.
  - rule 'at_most_one: transformed into max clique.' was applied 1 time.
  - rule 'deductions: 2976 stored' was applied 1 time.
  - rule 'dual: fix variable' was applied 45 times.
  - rule 'dual: reduced domain' was applied 100 times.
  - rule 'duplicate: merged rhs of linear constraint' was applied 254 times.
  - rule 'duplicate: removed constraint' was applied 1'324 times.
  - rule 'enforcement: false literal' was applied 12 times.
  - rule 'exactly_one: x and not(x)' was applied 1 time.
  - rule 'incompatible linear: add implication' was applied 165 times.
  - rule 'linear matrix: common vertical rectangle' was applied 4'773 times.
  - rule 'linear: always true' was applied 2'060 times.
  - rule 'linear: doubleton free' was applied 25 times.
  - rule 'linear: empty' was applied 62 times.
  - rule 'linear: extracted enforcement literal' was applied 39'411 times.
  - rule 'linear: fixed or dup variables' was applied 39'820 times.
  - rule 'linear: positive equal one' was applied 9 times.
  - rule 'linear: reduced variable domains' was applied 3'924 times.
  - rule 'linear: reduced variable domains in derived constraint' was applied 1 time.
  - rule 'linear: remapped using affine relations' was applied 40'446 times.
  - rule 'linear: simplified rhs' was applied 138'018 times.
  - rule 'linear: tightened into equality' was applied 13 times.
  - rule 'linear: variable substitution 1' was applied 25 times.
  - rule 'linear: variable substitution 2' was applied 604 times.
  - rule 'linear: variable substitution 3' was applied 312 times.
  - rule 'no_overlap: inferred from x != y constraints' was applied 1 time.
  - rule 'presolve: 175 unused variables removed.' was applied 1 time.
  - rule 'presolve: iteration' was applied 3 times.
  - rule 'probing: reduced enforced constraint to implication.' was applied 15 times.
  - rule 'symmetry: fixed to false in general orbit' was applied 1 time.

Presolved optimization model '': (model_fingerprint: 0x820bdb124c81584e)
#Variables: 4'320 (#ints: 16 in objective)
  - 350 Booleans in [0,1]
  - 3'133 different domains in [-31989,34614] with a largest complexity of 29.
#kExactlyOne: 8 (#literals: 24)
#kInterval: 11
#kLinear2: 2'116 (#enforced: 2'016 #multi: 825)
#kLinear3: 7'533 (#enforced: 4'811 #multi: 71)
#kLinearN: 32'404 (#enforced: 30'764) (#terms: 389'608)
#kNoOverlap: 1 (#intervals: 11)

Preloading model.
#Bound   7.86s best:inf   next:[222,19188] initial_domain
[Symmetry] Graph for symmetry has 51'728 nodes and 460'506 arcs.
[Symmetry] Symmetry computation done. time: 0.0123747 dtime: 0.0225373
#Model   7.94s var:4320/4320 constraints:42073/42073

Starting search at 7.96s with 32 workers.
17 full problem subsolvers: [core, default_lp, fixed, lb_tree_search, max_lp, no_lp, objective_lb_search, objective_lb_search_max_lp, objective_lb_search_no_lp, objective_shaving_search_max_lp, objective_shaving_search_no_lp, probing, probing_max_lp, pseudo_costs, quick_restart, quick_restart_no_lp, reduced_costs]
13 first solution subsolvers: [fj_long_default, fj_long_lin_default, fj_long_random, fj_short_default, fj_short_lin_default, fj_short_lin_random, fj_short_random, fs_random(2), fs_random_no_lp, fs_random_quick_restart(2), fs_random_quick_restart_no_lp]
13 incomplete subsolvers: [feasibility_pump, graph_arc_lns, graph_cst_lns, graph_dec_lns, graph_var_lns, rins/rens, rnd_cst_lns, rnd_var_lns, scheduling_intervals_lns, scheduling_precedences_lns, scheduling_time_window_lns, violation_ls(2)]
3 helper subsolvers: [neighborhood_helper, synchronization_agent, update_gap_integral]
#Bound   9.32s best:inf   next:[239,19188] objective_lb_search_no_lp
#Bound   9.66s best:inf   next:[260,19188] objective_lb_search_no_lp
#Bound   9.68s best:inf   next:[261,19188] objective_lb_search_no_lp
#Bound   9.69s best:inf   next:[389,19188] objective_lb_search_no_lp
#Bound  10.58s best:inf   next:[493,19188] objective_lb_search
#Bound  11.73s best:inf   next:[503,19188] objective_lb_search_max_lp
#Bound  11.79s best:inf   next:[1246,19188] objective_lb_search_max_lp
#1      11.89s best:7667  next:[1246,7666] fs_random_quick_restart_no_lp (fixed_bools=0/407)
#Bound  12.07s best:7667  next:[1609,7666] pseudo_costs
#2      12.11s best:7666  next:[1609,7665] violation_ls(batch:2 #solutions_imported:1 #lin_moves:11'687 #lin_evals:38'053 #weight_updates:366)
#Bound  12.15s best:7666  next:[1656,7665] pseudo_costs
#3      12.31s best:7665  next:[1656,7664] violation_ls(batch:2 #solutions_imported:2 #lin_moves:0 #lin_evals:19'285 #gen_moves:7'621 #gen_evals:878 #comp_moves:1'325 #backtracks:3'143 #weight_updates:66)
#4      12.32s best:7664  next:[1656,7663] violation_ls(batch:3 #solutions_imported:3 #lin_moves:1 #lin_evals:19'298 #gen_moves:7'621 #gen_evals:878 #comp_moves:1'325 #backtracks:3'143 #weight_updates:66)
#5      12.46s best:7662  next:[1656,7661] rnd_var_lns (d=0.81 s=129 t=0.10 p=1.00 stall=2 h=auto_l0) [presolve]
#6      12.69s best:7661  next:[1656,7660] violation_ls(batch:4 #solutions_imported:4 #lin_moves:2 #lin_evals:19'314 #gen_moves:7'621 #gen_evals:878 #comp_moves:1'325 #backtracks:3'143 #weight_updates:66)
#7      13.08s best:7223  next:[1656,7222] no_lp (fixed_bools=0/446)
#8      13.66s best:7081  next:[1656,7080] no_lp (fixed_bools=0/467)
#9      14.45s best:7036  next:[1656,7035] no_lp (fixed_bools=0/476)
#10     15.19s best:7033  next:[1656,7032] no_lp (fixed_bools=0/485)
#11     16.29s best:6960  next:[1656,6959] no_lp (fixed_bools=0/495)
#Bound  16.76s best:6960  next:[1684,6959] reduced_costs
#12     18.24s best:6756  next:[1684,6755] rins_lp_lns (d=0.91 s=183 t=0.10 p=1.00 stall=4 h=auto_l0)
#Bound  18.25s best:6756  next:[1686,6755] reduced_costs
#Bound  21.43s best:6756  next:[1688,6755] objective_lb_search_max_lp
#Bound  21.71s best:6756  next:[1690,6755] objective_lb_search_max_lp
#Bound  21.96s best:6756  next:[1691,6755] objective_lb_search_max_lp
#13     22.25s best:6749  next:[1691,6748] no_lp (fixed_bools=0/512)
#Bound  24.48s best:6749  next:[1703,6748] reduced_costs
#14     25.46s best:6744  next:[1703,6743] graph_var_lns (d=0.98 s=233 t=0.10 p=1.00 stall=7 h=auto_l0)
#15     26.14s best:6671  next:[1703,6670] no_lp (fixed_bools=0/523)
#16     27.61s best:6666  next:[1703,6665] quick_restart_no_lp (fixed_bools=0/750)
#17     27.74s best:6543  next:[1703,6542] no_lp (fixed_bools=0/542)
#18     29.66s best:6540  next:[1703,6539] no_lp (fixed_bools=0/548)
#Bound  31.06s best:6540  next:[1704,6539] lb_tree_search
#19     31.92s best:6530  next:[1704,6529] graph_dec_lns (d=0.99 s=274 t=0.10 p=1.00 stall=9 h=auto_l0)
#20     32.07s best:6494  next:[1704,6493] graph_cst_lns (d=0.99 s=273 t=0.10 p=1.00 stall=8 h=auto_l0)
#21     32.25s best:6420  next:[1704,6419] graph_var_lns (d=0.99 s=271 t=0.10 p=1.00 stall=2 h=auto_l0)
#22     34.21s best:6419  next:[1704,6418] violation_ls(batch:15 #solutions_imported:12 #lin_moves:40'730 #lin_evals:276'037 #gen_moves:55'567 #gen_evals:5'797 #comp_moves:7'786 #backtracks:23'877 #weight_updates:2'504)
#23     36.68s best:6418  next:[1704,6417] violation_ls(batch:16 #solutions_imported:13 #lin_moves:40'994 #lin_evals:277'399 #gen_moves:55'567 #gen_evals:5'797 #comp_moves:7'786 #backtracks:23'877 #weight_updates:2'583)
#24     37.35s best:6415  next:[1704,6414] rnd_cst_lns (d=0.99 s=296 t=0.10 p=1.00 stall=12 h=auto_l0)
#Bound  38.57s best:6415  next:[1705,6414] objective_shaving_search_max_lp (vars=5211 csts=42888)
#25     39.14s best:6377  next:[1705,6376] graph_cst_lns (d=0.99 s=299 t=0.10 p=1.00 stall=0 h=auto_l0)
#26     39.32s best:6376  next:[1705,6375] violation_ls(batch:17 #solutions_imported:14 #lin_moves:49'217 #lin_evals:304'705 #gen_moves:55'567 #gen_evals:5'797 #comp_moves:7'786 #backtracks:23'877 #weight_updates:2'888)
#27     39.34s best:6375  next:[1705,6374] violation_ls(batch:17 #solutions_imported:13 #lin_moves:69'093 #lin_evals:364'753 #gen_moves:50'434 #gen_evals:4'599 #comp_moves:4'873 #backtracks:22'774 #weight_updates:4'562)
#28     39.43s best:6272  next:[1705,6271] rnd_var_lns (d=0.99 s=307 t=0.10 p=1.00 stall=11 h=folio_rnd)
#Bound  40.38s best:6272  next:[1773,6271] objective_lb_search_max_lp
#29     42.88s best:6271  next:[1773,6270] violation_ls(batch:18 #solutions_imported:14 #lin_moves:70'398 #lin_evals:369'571 #gen_moves:50'434 #gen_evals:4'599 #comp_moves:4'873 #backtracks:22'774 #weight_updates:4'712)
#30     44.08s best:6194  next:[1773,6193] graph_arc_lns (d=0.99 s=324 t=0.10 p=0.93 stall=0 h=auto_l0)
#31     48.36s best:6104  next:[1773,6103] graph_dec_lns (d=1.00 s=340 t=0.10 p=1.00 stall=1 h=auto_l0)
#32     48.88s best:6103  next:[1773,6102] violation_ls(batch:20 #solutions_imported:16 #lin_moves:70'829 #lin_evals:392'443 #gen_moves:58'831 #gen_evals:5'234 #comp_moves:6'529 #backtracks:26'137 #weight_updates:4'887)
#33     49.16s best:5827  next:[1773,5826] rins_pump_lns (d=0.92 s=356 t=0.10 p=0.62 stall=3 h=auto_l0)
#34     52.15s best:5826  next:[1773,5825] violation_ls(batch:21 #solutions_imported:17 #lin_moves:78'244 #lin_evals:421'970 #gen_moves:58'831 #gen_evals:5'234 #comp_moves:6'529 #backtracks:26'137 #weight_updates:5'608)
#35     53.88s best:5792  next:[1773,5791] rins_lp_lns (d=0.93 s=368 t=0.10 p=0.65 stall=0 h=auto_l0)
#36     55.58s best:5789  next:[1773,5788] quick_restart_no_lp (fixed_bools=0/1127)
#37     57.31s best:5725  next:[1773,5724] quick_restart_no_lp (fixed_bools=0/1137)
#38     58.09s best:5724  next:[1773,5723] violation_ls(batch:23 #solutions_imported:19 #lin_moves:80'726 #lin_evals:451'713 #gen_moves:66'778 #gen_evals:5'902 #comp_moves:7'907 #backtracks:29'421 #weight_updates:5'850)
#39     60.81s best:5723  next:[1773,5722] quick_restart_no_lp (fixed_bools=0/1219)
#40     61.72s best:5716  next:[1773,5715] quick_restart_no_lp (fixed_bools=0/1226)
#41     64.47s best:5709  next:[1773,5708] graph_arc_lns (d=0.99 s=410 t=0.10 p=0.82 stall=1 h=auto_l0)
#42     64.96s best:5636  next:[1773,5635] rnd_cst_lns (d=0.99 s=408 t=0.10 p=0.82 stall=0 h=auto_l0)
#43     66.95s best:5635  next:[1773,5634] violation_ls(batch:26 #solutions_imported:22 #lin_moves:100'363 #lin_evals:516'738 #gen_moves:66'778 #gen_evals:5'902 #comp_moves:7'907 #backtracks:29'421 #weight_updates:6'593)
#44     67.58s best:5554  next:[1773,5553] rins_lp_lns (d=0.92 s=428 t=0.10 p=0.59 stall=0 h=auto_l0)
#45     74.03s best:5552  next:[1773,5551] quick_restart_no_lp (fixed_bools=0/1477)
#46     74.74s best:5528  next:[1773,5527] graph_var_lns (d=1.00 s=445 t=0.10 p=0.81 stall=2 h=auto_l0)
#47     76.69s best:5527  next:[1773,5526] violation_ls(batch:29 #solutions_imported:25 #lin_moves:87'435 #lin_evals:601'467 #gen_moves:108'249 #gen_evals:9'230 #comp_moves:14'922 #backtracks:46'647 #weight_updates:6'377)
#48     77.55s best:5511  next:[1773,5510] graph_dec_lns (d=1.00 s=460 t=0.10 p=0.80 stall=0 h=auto_l0)
#49     78.01s best:5429  next:[1773,5428] graph_var_lns (d=1.00 s=457 t=0.10 p=0.81 stall=0 h=auto_l0)
#50     80.29s best:5428  next:[1773,5427] violation_ls(batch:30 #solutions_imported:26 #lin_moves:89'070 #lin_evals:608'136 #gen_moves:108'249 #gen_evals:9'230 #comp_moves:14'922 #backtracks:46'647 #weight_updates:6'645)
#51     80.29s best:5427  next:[1773,5426] violation_ls(batch:30 #solutions_imported:25 #lin_moves:100'364 #lin_evals:587'548 #gen_moves:97'324 #gen_evals:7'128 #comp_moves:10'356 #backtracks:43'463 #weight_updates:6'858)
#52     81.06s best:5121  next:[1773,5120] rins_lp_lns (d=0.92 s=476 t=0.10 p=0.58 stall=1 h=auto_l0)
#53     88.29s best:5120  next:[1773,5119] quick_restart_no_lp (fixed_bools=0/1697)
#54     89.93s best:5119  next:[1773,5118] violation_ls(batch:33 #solutions_imported:28 #lin_moves:89'071 #lin_evals:654'530 #gen_moves:125'627 #gen_evals:9'953 #comp_moves:18'272 #backtracks:53'661 #weight_updates:6'803)
#55     89.94s best:5118  next:[1773,5117] violation_ls(batch:33 #solutions_imported:27 #lin_moves:100'364 #lin_evals:634'378 #gen_moves:114'542 #gen_evals:8'070 #comp_moves:13'448 #backtracks:50'518 #weight_updates:6'981)
#56     92.16s best:5112  next:[1773,5111] graph_cst_lns (d=1.00 s=507 t=0.10 p=0.77 stall=2 h=auto_l0)
#57     93.49s best:5111  next:[1773,5110] violation_ls(batch:34 #solutions_imported:28 #lin_moves:100'955 #lin_evals:637'174 #gen_moves:114'542 #gen_evals:8'070 #comp_moves:13'448 #backtracks:50'518 #weight_updates:7'290)
#58     96.38s best:5092  next:[1773,5091] rins_lp_lns (d=0.92 s=536 t=0.10 p=0.57 stall=0 h=auto_l0)
#59     96.41s best:5091  next:[1773,5090] violation_ls(batch:35 #solutions_imported:30 #lin_moves:90'404 #lin_evals:686'649 #gen_moves:136'650 #gen_evals:10'251 #comp_moves:18'718 #backtracks:58'949 #weight_updates:7'223)
#60     96.42s best:5090  next:[1773,5089] violation_ls(batch:35 #solutions_imported:29 #lin_moves:101'040 #lin_evals:637'689 #gen_moves:114'542 #gen_evals:8'070 #comp_moves:13'448 #backtracks:50'518 #weight_updates:7'370)
#61     97.31s best:5089  next:[1773,5088] quick_restart_no_lp (fixed_bools=0/1819)
#62     99.32s best:5088  next:[1773,5087] violation_ls(batch:36 #solutions_imported:31 #lin_moves:90'404 #lin_evals:686'672 #gen_moves:136'657 #gen_evals:10'252 #comp_moves:18'719 #backtracks:58'952 #weight_updates:7'223)
#Bound 100.27s best:5088  next:[1777,5087] objective_lb_search_max_lp
#63    100.37s best:5061  next:[1777,5060] rins_lp_lns (d=0.93 s=548 t=0.10 p=0.59 stall=0 h=auto_l0)
#64    101.35s best:5051  next:[1777,5050] quick_restart_no_lp (fixed_bools=0/1893)
#65    103.10s best:5050  next:[1777,5049] violation_ls(batch:37 #solutions_imported:32 #lin_moves:90'427 #lin_evals:686'805 #gen_moves:136'657 #gen_evals:10'252 #comp_moves:18'719 #backtracks:58'952 #weight_updates:7'243)
#66    103.11s best:5049  next:[1777,5048] violation_ls(batch:37 #solutions_imported:31 #lin_moves:110'821 #lin_evals:696'567 #gen_moves:114'644 #gen_evals:8'073 #comp_moves:13'450 #backtracks:50'568 #weight_updates:7'589)
#67    104.23s best:4724  next:[1777,4723] rins_lp_lns (d=0.92 s=562 t=0.10 p=0.57 stall=0 h=auto_l0)
#68    111.10s best:4720  next:[1777,4719] graph_arc_lns (d=1.00 s=580 t=0.10 p=0.74 stall=0 h=auto_l0)
#Bound 115.51s best:4720  next:[1784,4719] objective_lb_search_max_lp
#69    118.98s best:4716  next:[1784,4715] graph_arc_lns (d=1.00 s=604 t=0.10 p=0.71 stall=0 h=auto_l0)
#70    119.75s best:4715  next:[1784,4714] violation_ls(batch:42 #solutions_imported:35 #lin_moves:110'646 #lin_evals:834'417 #gen_moves:157'454 #gen_evals:10'885 #comp_moves:19'849 #backtracks:68'784 #weight_updates:7'871)
#71    121.44s best:4700  next:[1784,4699] rins_lp_lns (d=0.93 s=624 t=0.10 p=0.57 stall=0 h=auto_l0)
#72    128.48s best:4672  next:[1784,4671] rnd_var_lns (d=1.00 s=639 t=0.10 p=0.71 stall=0 h=auto_l0)
#73    129.69s best:4671  next:[1784,4670] violation_ls(batch:45 #solutions_imported:37 #lin_moves:113'225 #lin_evals:891'693 #gen_moves:177'468 #gen_evals:11'740 #comp_moves:21'124 #backtracks:78'147 #weight_updates:8'670)
#74    129.71s best:4670  next:[1784,4669] violation_ls(batch:45 #solutions_imported:36 #lin_moves:146'596 #lin_evals:952'473 #gen_moves:143'484 #gen_evals:9'291 #comp_moves:17'080 #backtracks:63'148 #weight_updates:12'052)
#75    132.28s best:4669  next:[1784,4668] violation_ls(batch:46 #solutions_imported:38 #lin_moves:113'225 #lin_evals:891'716 #gen_moves:177'481 #gen_evals:11'741 #comp_moves:21'125 #backtracks:78'153 #weight_updates:8'670)
#76    132.29s best:4668  next:[1784,4667] violation_ls(batch:46 #solutions_imported:37 #lin_moves:146'597 #lin_evals:952'489 #gen_moves:143'484 #gen_evals:9'291 #comp_moves:17'080 #backtracks:63'148 #weight_updates:12'052)
#77    135.35s best:4667  next:[1784,4666] quick_restart_no_lp (fixed_bools=0/2190)
#78    135.51s best:4653  next:[1784,4652] graph_var_lns (d=1.00 s=665 t=0.10 p=0.67 stall=0 h=auto_l0)
#79    136.16s best:4652  next:[1784,4651] violation_ls(batch:47 #solutions_imported:39 #lin_moves:116'105 #lin_evals:903'413 #gen_moves:177'481 #gen_evals:11'741 #comp_moves:21'125 #backtracks:78'153 #weight_updates:9'137)
#80    136.19s best:4651  next:[1784,4650] violation_ls(batch:47 #solutions_imported:38 #lin_moves:146'598 #lin_evals:952'505 #gen_moves:143'484 #gen_evals:9'291 #comp_moves:17'080 #backtracks:63'148 #weight_updates:12'052)
#81    136.73s best:4631  next:[1784,4630] rins_lp_lns (d=0.93 s=684 t=0.10 p=0.56 stall=0 h=auto_l0)
#82    139.56s best:4603  next:[1784,4602] graph_arc_lns (d=1.00 s=690 t=0.10 p=0.67 stall=1 h=auto_l0)
#83    140.78s best:4588  next:[1784,4587] rins_lp_lns (d=0.94 s=696 t=0.10 p=0.57 stall=0 h=auto_l0)
#84    143.15s best:4584  next:[1784,4583] quick_restart_no_lp (fixed_bools=0/2306)
#85    144.36s best:4582  next:[1784,4581] rnd_var_lns (d=1.00 s=699 t=0.10 p=0.67 stall=0 h=auto_l0)
#86    148.51s best:4559  next:[1784,4558] graph_arc_lns (d=1.00 s=714 t=0.10 p=0.68 stall=0 h=auto_l0)
#87    154.84s best:4549  next:[1784,4548] rnd_cst_lns (d=0.99 s=736 t=0.10 p=0.63 stall=0 h=auto_l0)
#88    156.44s best:4539  next:[1784,4538] graph_var_lns (d=0.99 s=737 t=0.10 p=0.64 stall=0 h=auto_l0)
#89    170.16s best:4526  next:[1784,4525] graph_arc_lns (d=1.00 s=786 t=0.10 p=0.64 stall=1 h=auto_l0)
#Bound 170.36s best:4526  next:[1786,4525] objective_lb_search_max_lp
#90    172.30s best:4474  next:[1786,4473] rins_lp_lns (d=0.92 s=806 t=0.10 p=0.54 stall=3 h=auto_l0)
#91    183.26s best:4473  next:[1786,4472] quick_restart_no_lp (fixed_bools=0/2530)
#92    183.89s best:4452  next:[1786,4451] rins_lp_lns (d=0.94 s=842 t=0.10 p=0.56 stall=0 h=auto_l0)
#93    185.01s best:4449  next:[1786,4448] quick_restart_no_lp (fixed_bools=0/2606)
#94    185.22s best:4448  next:[1786,4447] violation_ls(batch:61 #solutions_imported:46 #lin_moves:195'723 #lin_evals:1'334'070 #gen_moves:218'227 #gen_evals:14'031 #comp_moves:26'566 #backtracks:95'804 #weight_updates:11'448)
#95    185.25s best:4447  next:[1786,4446] violation_ls(batch:61 #solutions_imported:45 #lin_moves:239'273 #lin_evals:1'389'664 #gen_moves:165'602 #gen_evals:10'219 #comp_moves:17'654 #backtracks:73'913 #weight_updates:31'866)
#96    188.74s best:4446  next:[1786,4445] graph_dec_lns (d=1.00 s=850 t=0.10 p=0.63 stall=1 h=auto_l0)
#97    190.20s best:4444  next:[1786,4443] rnd_var_lns (d=1.00 s=857 t=0.10 p=0.63 stall=0 h=auto_l0)
#98    192.89s best:4442  next:[1786,4441] quick_restart_no_lp (fixed_bools=0/2669)
#99    193.69s best:4441  next:[1786,4440] violation_ls(batch:63 #solutions_imported:48 #lin_moves:205'406 #lin_evals:1'365'712 #gen_moves:218'231 #gen_evals:14'031 #comp_moves:26'570 #backtracks:95'804 #weight_updates:11'765)
#100   193.70s best:4440  next:[1786,4439] violation_ls(batch:63 #solutions_imported:47 #lin_moves:249'015 #lin_evals:1'421'528 #gen_moves:165'640 #gen_evals:10'219 #comp_moves:17'658 #backtracks:73'930 #weight_updates:32'124)
#101   198.83s best:4434  next:[1786,4433] rnd_cst_lns (d=1.00 s=882 t=0.10 p=0.64 stall=0 h=auto_l0)
#102   207.50s best:4420  next:[1786,4419] quick_restart_no_lp (fixed_bools=0/2724)
#103   210.54s best:4419  next:[1786,4418] violation_ls(batch:68 #solutions_imported:51 #lin_moves:235'154 #lin_evals:1'535'326 #gen_moves:227'879 #gen_evals:14'604 #comp_moves:27'397 #backtracks:100'212 #weight_updates:12'098)
#104   210.57s best:4418  next:[1786,4417] violation_ls(batch:68 #solutions_imported:50 #lin_moves:272'567 #lin_evals:1'540'810 #gen_moves:174'784 #gen_evals:10'746 #comp_moves:18'790 #backtracks:77'936 #weight_updates:38'667)
#105   212.01s best:4390  next:[1786,4389] graph_arc_lns (d=1.00 s=932 t=0.10 p=0.62 stall=0 h=auto_l0)
#106   214.82s best:4388  next:[1786,4387] rnd_var_lns (d=1.00 s=941 t=0.10 p=0.61 stall=1 h=auto_l0)
#Bound 223.12s best:4388  next:[1791,4387] objective_lb_search_max_lp
#107   259.82s best:4384  next:[1791,4383] rins_lp_lns (d=0.92 s=1108 t=0.10 p=0.53 stall=1 h=auto_l0)
#108   354.34s best:4375  next:[1791,4374] graph_dec_lns (d=1.00 s=1429 t=0.10 p=0.58 stall=0 h=auto_l0)
#109   354.47s best:4374  next:[1791,4373] violation_ls(batch:110 #solutions_imported:55 #lin_moves:364'770 #lin_evals:2'561'506 #gen_moves:468'680 #gen_evals:32'346 #comp_moves:41'965 #backtracks:213'324 #weight_updates:14'391)
#110   354.69s best:4348  next:[1791,4347] rins_lp_lns (d=0.93 s=1445 t=0.10 p=0.52 stall=2 h=auto_l0)
#Bound 394.14s best:4348  next:[1797,4347] objective_lb_search_max_lp
#111   459.22s best:4309  next:[1797,4308] rnd_cst_lns (d=1.00 s=1811 t=0.10 p=0.55 stall=1 h=auto_l0)
#112   484.78s best:4274  next:[1797,4273] graph_var_lns (d=1.00 s=1896 t=0.10 p=0.56 stall=0 h=auto_l0)
#113   511.67s best:4242  next:[1797,4241] rins_lp_lns (d=0.93 s=1999 t=0.10 p=0.52 stall=0 h=auto_l0)
#114   516.04s best:4238  next:[1797,4237] rnd_var_lns (d=1.00 s=2014 t=0.10 p=0.55 stall=1 h=auto_l0)
#115   516.90s best:4237  next:[1797,4236] violation_ls(batch:158 #solutions_imported:59 #lin_moves:663'823 #lin_evals:3'874'865 #gen_moves:526'330 #gen_evals:29'374 #comp_moves:36'816 #backtracks:244'681 #weight_updates:182'627)
#116   520.44s best:4210  next:[1797,4209] rins_lp_lns (d=0.93 s=2035 t=0.10 p=0.52 stall=0 h=auto_l0)
#117   531.55s best:4190  next:[1797,4189] rins_lp_lns (d=0.93 s=2071 t=0.10 p=0.51 stall=2 h=auto_l0)
#118   537.55s best:4186  next:[1797,4185] graph_cst_lns (d=1.00 s=2078 t=0.10 p=0.55 stall=0 h=auto_l0)
#119   537.60s best:4185  next:[1797,4184] violation_ls(batch:164 #solutions_imported:63 #lin_moves:619'453 #lin_evals:3'908'410 #gen_moves:539'441 #gen_evals:37'096 #comp_moves:54'502 #backtracks:242'420 #weight_updates:191'832)
#120   537.61s best:4184  next:[1797,4183] violation_ls(batch:164 #solutions_imported:62 #lin_moves:693'222 #lin_evals:4'019'671 #gen_moves:535'141 #gen_evals:30'005 #comp_moves:37'709 #backtracks:248'638 #weight_updates:193'310)
#121   538.43s best:4183  next:[1797,4182] quick_restart_no_lp (fixed_bools=0/3775)
#122   539.31s best:4134  next:[1797,4133] graph_arc_lns (d=1.00 s=2089 t=0.10 p=0.55 stall=0 h=auto_l0)
#123   547.91s best:4112  next:[1797,4111] rins_lp_lns (d=0.93 s=2131 t=0.10 p=0.51 stall=2 h=auto_l0)
#124   550.16s best:4104  next:[1797,4103] graph_dec_lns (d=1.00 s=2127 t=0.10 p=0.55 stall=0 h=auto_l0)
#125   550.92s best:4103  next:[1797,4102] violation_ls(batch:168 #solutions_imported:65 #lin_moves:619'453 #lin_evals:3'993'839 #gen_moves:570'773 #gen_evals:39'149 #comp_moves:59'345 #backtracks:255'663 #weight_updates:192'127)
#126   550.94s best:4102  next:[1797,4101] violation_ls(batch:168 #solutions_imported:64 #lin_moves:694'172 #lin_evals:4'087'947 #gen_moves:558'326 #gen_evals:31'293 #comp_moves:42'092 #backtracks:258'039 #weight_updates:193'724)
#127   551.56s best:4087  next:[1797,4086] graph_arc_lns (d=1.00 s=2137 t=0.10 p=0.55 stall=0 h=auto_l0)
#128   582.11s best:4056  next:[1797,4055] rins_lp_lns (d=0.94 s=2251 t=0.10 p=0.52 stall=1 h=auto_l0)
#129   592.74s best:4049  next:[1797,4048] quick_restart_no_lp (fixed_bools=0/4042)
#Bound 651.86s best:4049  next:[1798,4048] objective_lb_search_max_lp
#130   662.70s best:4046  next:[1798,4045] graph_arc_lns (d=1.00 s=2523 t=0.10 p=0.55 stall=3 h=auto_l0)
#131   668.20s best:4034  next:[1798,4033] rins_lp_lns (d=0.92 s=2553 t=0.10 p=0.51 stall=5 h=auto_l0)
#Bound 897.37s best:4034  next:[1799,4033] objective_lb_search_max_lp
#Bound 917.46s best:4034  next:[1801,4033] objective_lb_search_max_lp
#Bound 1056.89s best:4034  next:[1802,4033] objective_lb_search_max_lp
#Bound 1193.04s best:4034  next:[1803,4033] objective_lb_search_max_lp
#Bound 1325.12s best:4034  next:[1804,4033] objective_lb_search_max_lp
#Bound 1469.84s best:4034  next:[1805,4033] objective_lb_search_max_lp
#Bound 1630.84s best:4034  next:[1807,4033] objective_lb_search_max_lp
#132   1780.87s best:4029  next:[1807,4028] graph_arc_lns (d=1.00 s=6574 t=0.10 p=0.52 stall=3 h=auto_l0)
#133   1789.61s best:4008  next:[1807,4007] graph_dec_lns (d=1.00 s=6613 t=0.10 p=0.52 stall=2 h=auto_l0)
#Bound 1897.43s best:4008  next:[1808,4007] objective_lb_search_max_lp
#Bound 1928.32s best:4008  next:[1809,4007] objective_lb_search_max_lp
#Bound 2179.67s best:4008  next:[1811,4007] objective_lb_search_max_lp
#Bound 2445.26s best:4008  next:[1813,4007] objective_lb_search_max_lp
#Bound 2469.08s best:4008  next:[1814,4007] objective_lb_search_max_lp
#Bound 2622.51s best:4008  next:[1815,4007] objective_lb_search_max_lp
#Bound 2794.47s best:4008  next:[1817,4007] objective_lb_search_max_lp
#Bound 3054.48s best:4008  next:[1819,4007] objective_lb_search_max_lp
#Bound 3996.71s best:4008  next:[1821,4007] objective_lb_search_max_lp
#Bound 4635.61s best:4008  next:[1823,4007] objective_lb_search_max_lp
#Bound 5297.53s best:4008  next:[1825,4007] objective_lb_search_max_lp
#Bound 5467.75s best:4008  next:[1826,4007] objective_lb_search_max_lp
#Bound 5894.08s best:4008  next:[1833,4007] objective_lb_search_max_lp
#Bound 6702.79s best:4008  next:[1835,4007] objective_lb_search_max_lp
#Bound 7625.09s best:4008  next:[1836,4007] objective_lb_search_max_lp
#Bound 8122.12s best:4008  next:[1837,4007] objective_lb_search_max_lp
#Bound 8691.84s best:4008  next:[1839,4007] objective_lb_search_max_lp
#Bound 10194.08s best:4008  next:[1840,4007] objective_lb_search_max_lp
#Bound 10311.13s best:4008  next:[1842,4007] objective_lb_search_max_lp
#Bound 10616.23s best:4008  next:[1843,4007] objective_lb_search_max_lp
#134   11193.92s best:3982  next:[1843,3981] rins_lp_lns (d=0.94 s=42228 t=0.10 p=0.50 stall=9 h=auto_l0)
#135   11202.66s best:3978  next:[1843,3977] rnd_cst_lns (d=1.00 s=42257 t=0.10 p=0.50 stall=5 h=auto_l0)
#136   11202.94s best:3974  next:[1843,3973] graph_dec_lns (d=1.00 s=42261 t=0.10 p=0.50 stall=0 h=auto_l0)
#137   11207.73s best:3970  next:[1843,3969] quick_restart_no_lp (fixed_bools=3/9024)
#138   11208.25s best:3969  next:[1843,3968] violation_ls(batch:3416 #solutions_imported:75 #perturbations:31 #lin_moves:14'792'078 #lin_evals:126'951'253 #gen_moves:3'335'425 #gen_evals:1'880'561 #comp_moves:178'812 #backtracks:1'577'945 #weight_updates:1'445'009)
#139   11208.26s best:3968  next:[1843,3967] violation_ls(batch:3416 #solutions_imported:74 #perturbations:31 #lin_moves:14'950'088 #lin_evals:120'849'201 #gen_moves:2'924'424 #gen_evals:1'819'802 #comp_moves:190'126 #backtracks:1'366'788 #weight_updates:810'884)
#140   11211.40s best:3967  next:[1843,3966] violation_ls(batch:3417 #solutions_imported:76 #perturbations:31 #lin_moves:14'792'078 #lin_evals:126'951'309 #gen_moves:3'335'458 #gen_evals:1'880'562 #comp_moves:178'813 #backtracks:1'577'961 #weight_updates:1'445'009)
#141   11211.40s best:3966  next:[1843,3965] violation_ls(batch:3417 #solutions_imported:75 #perturbations:31 #lin_moves:14'950'089 #lin_evals:120'849'217 #gen_moves:2'924'424 #gen_evals:1'819'802 #comp_moves:190'126 #backtracks:1'366'788 #weight_updates:810'884)
#142   11212.14s best:3962  next:[1843,3961] graph_cst_lns (d=1.00 s=42297 t=0.10 p=0.50 stall=1 h=auto_l0)
#Bound 11793.13s best:3962  next:[1844,3961] objective_lb_search_max_lp
#Bound 11923.11s best:3962  next:[1845,3961] objective_lb_search_max_lp
#Bound 12554.38s best:3962  next:[1847,3961] objective_lb_search_max_lp
#Bound 13863.99s best:3962  next:[1848,3961] objective_lb_search_max_lp
#Bound 15314.04s best:3962  next:[1849,3961] objective_lb_search_max_lp
#Bound 16293.78s best:3962  next:[1850,3961] objective_lb_search_max_lp
#Bound 18795.02s best:3962  next:[1851,3961] objective_lb_search_max_lp
#Bound 20747.60s best:3962  next:[1852,3961] objective_lb_search_max_lp
#Bound 23947.38s best:3962  next:[1855,3961] objective_lb_search_max_lp
#143   24014.20s best:3960  next:[1855,3959] graph_arc_lns (d=1.00 s=90791 t=0.10 p=0.50 stall=0 h=auto_l0)
#Bound 25077.63s best:3960  next:[1856,3959] objective_lb_search_max_lp
#144   26229.02s best:3939  next:[1856,3938] graph_dec_lns (d=1.00 s=99149 t=0.10 p=0.50 stall=1 h=auto_l0)
#145   26229.36s best:3938  next:[1856,3937] violation_ls(batch:8021 #solutions_imported:79 #perturbations:76 #lin_moves:39'696'017 #lin_evals:286'980'722 #gen_moves:6'352'016 #gen_evals:4'039'975 #comp_moves:317'472 #backtracks:3'016'777 #weight_updates:2'545'765)
#146   26229.46s best:3937  next:[1856,3936] violation_ls(batch:8021 #solutions_imported:78 #perturbations:76 #lin_moves:37'565'292 #lin_evals:281'072'604 #gen_moves:6'368'860 #gen_evals:4'316'407 #comp_moves:328'589 #backtracks:3'019'562 #weight_updates:961'060)
#147   26232.96s best:3927  next:[1856,3926] quick_restart_no_lp (fixed_bools=11/13337)
#Bound 31013.90s best:3927  next:[1857,3926] objective_lb_search_max_lp
#Bound 31376.26s best:3927  next:[1859,3926] objective_lb_search_max_lp
#Bound 32680.43s best:3927  next:[1861,3926] objective_lb_search_max_lp
#Bound 33732.28s best:3927  next:[1862,3926] objective_lb_search_max_lp
#Bound 38538.76s best:3927  next:[1863,3926] objective_lb_search_max_lp
#Bound 41183.06s best:3927  next:[1864,3926] objective_lb_search_max_lp
#Bound 45044.60s best:3927  next:[1865,3926] objective_lb_search_max_lp
#Bound 45166.99s best:3927  next:[1868,3926] objective_lb_search_max_lp
#Bound 45865.83s best:3927  next:[1869,3926] objective_lb_search_max_lp
#Bound 46358.22s best:3927  next:[1871,3926] objective_lb_search_max_lp
#Bound 47290.70s best:3927  next:[1872,3926] objective_lb_search_max_lp
#Bound 52271.05s best:3927  next:[1875,3926] objective_lb_search_max_lp
#Bound 54844.73s best:3927  next:[1876,3926] objective_lb_search_max_lp
#Bound 56231.49s best:3927  next:[1877,3926] objective_lb_search_max_lp
#Bound 57372.08s best:3927  next:[1878,3926] objective_lb_search_max_lp
#Bound 59693.17s best:3927  next:[1879,3926] objective_lb_search_max_lp
#Bound 65221.95s best:3927  next:[1880,3926] objective_lb_search_max_lp
#Bound 66782.34s best:3927  next:[1881,3926] objective_lb_search_max_lp
#Bound 74247.44s best:3927  next:[1882,3926] objective_lb_search_max_lp
#Bound 77687.79s best:3927  next:[1883,3926] objective_lb_search_max_lp
#Bound 80019.21s best:3927  next:[1884,3926] objective_lb_search_max_lp
#Bound 83202.26s best:3927  next:[1885,3926] objective_lb_search_max_lp

Task timing                                  n [     min,      max]      avg      dev     time         n [     min,      max]      avg      dev    dtime
                             'core':         1 [  24.00h,   24.00h]   24.00h   0.00ns   24.00h         1 [  12.98h,   12.98h]   12.98h   0.00ns   12.98h
                       'default_lp':         1 [  24.00h,   24.00h]   24.00h   0.00ns   24.00h         1 [   1.71h,    1.71h]    1.71h   0.00ns    1.71h
                 'feasibility_pump':      9451 [401.58ms,    7.33m]    9.14s    5.34s   23.99h      9450 [211.42ms,   37.97s] 848.91ms 529.61ms    2.23h
                            'fixed':         1 [  24.00h,   24.00h]   24.00h   0.00ns   24.00h         1 [   1.80h,    1.80h]    1.80h   0.00ns    1.80h
                  'fj_long_default':         9 [146.72ms,    1.82s] 351.16ms 519.63ms    3.16s         9 [153.84ms, 232.31ms] 189.96ms  25.62ms    1.71s
              'fj_long_lin_default':        11 [168.03ms,    1.44s] 291.41ms 364.62ms    3.21s        11 [206.08ms, 263.28ms] 244.25ms  14.51ms    2.69s
                   'fj_long_random':         5 [152.17ms,    2.47s] 630.67ms 919.08ms    3.15s         5 [179.57ms, 226.10ms] 202.57ms  17.42ms    1.01s
                 'fj_short_default':        18 [167.23ms, 868.58ms] 219.68ms 157.60ms    3.95s        18 [205.26ms, 268.41ms] 247.05ms  15.71ms    4.45s
             'fj_short_lin_default':        17 [162.06ms, 329.52ms] 185.12ms  38.63ms    3.15s        17 [216.23ms, 252.53ms] 236.50ms   9.02ms    4.02s
              'fj_short_lin_random':         9 [155.75ms,    1.71s] 349.11ms 483.21ms    3.14s         9 [194.37ms, 252.88ms] 229.21ms  17.76ms    2.06s
                  'fj_short_random':         5 [174.47ms,    2.40s] 630.47ms 884.16ms    3.15s         5 [207.19ms, 252.26ms] 235.91ms  15.23ms    1.18s
                        'fs_random':         1 [   3.94s,    3.94s]    3.94s   0.00ns    3.94s         1 [149.04ms, 149.04ms] 149.04ms   0.00ns 149.04ms
                        'fs_random':         1 [   3.97s,    3.97s]    3.97s   0.00ns    3.97s         1 [157.62ms, 157.62ms] 157.62ms   0.00ns 157.62ms
                  'fs_random_no_lp':         1 [   3.94s,    3.94s]    3.94s   0.00ns    3.94s         1 [141.02ms, 141.02ms] 141.02ms   0.00ns 141.02ms
          'fs_random_quick_restart':         1 [   3.87s,    3.87s]    3.87s   0.00ns    3.87s         1 [100.95ms, 100.95ms] 100.95ms   0.00ns 100.95ms
          'fs_random_quick_restart':         1 [   3.88s,    3.88s]    3.88s   0.00ns    3.88s         1 [140.96ms, 140.96ms] 140.96ms   0.00ns 140.96ms
    'fs_random_quick_restart_no_lp':         1 [   3.88s,    3.88s]    3.88s   0.00ns    3.88s         1 [ 28.67ms,  28.67ms]  28.67ms   0.00ns  28.67ms
                    'graph_arc_lns':     26957 [150.72ms,    8.81s]    4.34s    1.06s   32.51h     26931 [ 10.00ns, 200.48ms]  67.98ms  37.90ms   30.51m
                    'graph_cst_lns':     26957 [256.36ms,    9.02s]    4.75s 982.21ms   35.57h     26927 [ 10.00ns, 201.78ms]  71.82ms  35.02ms   32.23m
                    'graph_dec_lns':     26957 [178.48ms,   11.02s]    4.71s    1.02s   35.30h     26939 [ 10.00ns, 156.02ms]  71.74ms  35.01ms   32.21m
                    'graph_var_lns':     26957 [160.61ms,    8.65s]    4.22s    1.18s   31.60h     26919 [ 10.00ns, 201.12ms]  66.41ms  39.44ms   29.80m
                   'lb_tree_search':         1 [  24.00h,   24.00h]   24.00h   0.00ns   24.00h         1 [  12.77h,   12.77h]   12.77h   0.00ns   12.77h
                           'max_lp':         1 [  24.00h,   24.00h]   24.00h   0.00ns   24.00h         1 [   1.91h,    1.91h]    1.91h   0.00ns    1.91h
                            'no_lp':         1 [  24.00h,   24.00h]   24.00h   0.00ns   24.00h         1 [   1.29h,    1.29h]    1.29h   0.00ns    1.29h
              'objective_lb_search':         1 [  24.00h,   24.00h]   24.00h   0.00ns   24.00h         1 [   2.39h,    2.39h]    2.39h   0.00ns    2.39h
       'objective_lb_search_max_lp':         1 [  24.00h,   24.00h]   24.00h   0.00ns   24.00h         1 [   3.17h,    3.17h]    3.17h   0.00ns    3.17h
        'objective_lb_search_no_lp':         1 [  24.00h,   24.00h]   24.00h   0.00ns   24.00h         1 [  51.96m,   51.96m]   51.96m   0.00ns   51.96m
  'objective_shaving_search_max_lp':        78 [267.62ms,    2.07h]   18.46m   26.06m   24.00h        73 [ 55.78ms,    7.75m]    1.34m    1.85m    1.63h
   'objective_shaving_search_no_lp':        78 [130.40ms,    2.07h]   18.46m   26.06m   24.00h        73 [  2.43ms,    2.90m]   24.44s   34.14s   29.74m
                          'probing':         1 [  24.00h,   24.00h]   24.00h   0.00ns   24.00h         1 [   4.93h,    4.93h]    4.93h   0.00ns    4.93h
                   'probing_max_lp':         1 [  24.00h,   24.00h]   24.00h   0.00ns   24.00h         1 [   4.73h,    4.73h]    4.73h   0.00ns    4.73h
                     'pseudo_costs':         1 [  24.00h,   24.00h]   24.00h   0.00ns   24.00h         1 [   2.33h,    2.33h]    2.33h   0.00ns    2.33h
                    'quick_restart':         1 [  24.00h,   24.00h]   24.00h   0.00ns   24.00h         1 [   3.90h,    3.90h]    3.90h   0.00ns    3.90h
              'quick_restart_no_lp':         1 [  24.00h,   24.00h]   24.00h   0.00ns   24.00h         1 [   1.48h,    1.48h]    1.48h   0.00ns    1.48h
                    'reduced_costs':         1 [  24.00h,   24.00h]   24.00h   0.00ns   24.00h         1 [   3.11h,    3.11h]    3.11h   0.00ns    3.11h
                        'rins/rens':     26957 [  1.07ms,    4.70s]    1.35s 872.31ms   10.09h     23514 [ 10.00ns, 163.05ms]  84.04ms  50.96ms   32.94m
                      'rnd_cst_lns':     26957 [167.16ms,    9.81s]    4.71s 969.51ms   35.31h     26938 [ 10.00ns, 201.92ms]  72.14ms  34.80ms   32.39m
                      'rnd_var_lns':     26957 [107.46ms,    9.81s]    4.64s    1.03s   34.75h     26939 [ 10.00ns, 200.69ms]  71.04ms  35.65ms   31.90m
         'scheduling_intervals_lns':     26957 [140.76ms,    9.43s]    5.25s 386.17ms   39.28h     26954 [100.00ms, 200.13ms] 100.37ms 661.72us   45.09m
       'scheduling_precedences_lns':     26956 [   3.15s,    8.03s]    5.15s 378.41ms   38.54h     26956 [  6.93ms, 101.30ms] 100.35ms 627.61us   45.08m
       'scheduling_time_window_lns':     26956 [   3.45s,    8.19s]    5.24s 375.34ms   39.25h     26955 [100.00ms, 100.79ms] 100.37ms 261.62us   45.09m
                     'violation_ls':     26957 [  6.44ms, 900.57ms] 237.93ms  62.21ms    1.78h     26957 [  1.14us, 509.83ms] 241.87ms  59.25ms    1.81h
                     'violation_ls':     26957 [  6.50ms, 901.07ms] 238.58ms  71.22ms    1.79h     26957 [  1.30us, 533.56ms] 241.13ms  70.18ms    1.81h

Search stats                          Bools  Conflicts    Branches   Restarts      BoolPropag   IntegerPropag
                           'core':   23'560  3'961'925   5'327'522     54'073  21'529'078'372  24'144'770'678
                     'default_lp':   33'122  1'406'951   8'235'685    301'324   4'919'602'284  15'809'816'991
                          'fixed':    4'576  8'821'425  15'836'013        700   3'227'968'140  23'896'860'688
                      'fs_random':      350          2         746        700              51         224'654
                      'fs_random':      350          3         742        700              61         205'620
                'fs_random_no_lp':      420         53       1'708      1'401           3'023         780'223
        'fs_random_quick_restart':      350          3         741        700              51         224'739
        'fs_random_quick_restart':      372         10         723        701             505         253'199
  'fs_random_quick_restart_no_lp':      407          1       1'100        701              57         344'672
                 'lb_tree_search':      405      1'874  14'442'113  3'073'436      48'106'181  14'785'348'550
                         'max_lp':    4'980    707'207   7'373'898  1'552'867     307'393'854  15'239'721'135
                          'no_lp':    6'770  1'522'602   7'809'533    485'885   1'340'713'692  19'551'245'658
            'objective_lb_search':    3'602    387'801   7'391'287  1'409'564     272'212'650  14'078'593'047
     'objective_lb_search_max_lp':    1'291    549'257   8'347'402  1'423'569     231'600'294  16'444'857'523
      'objective_lb_search_no_lp':    1'236    596'441   3'367'830    694'785      80'488'692  12'285'135'989
                        'probing':    8'345      7'299      71'465     40'846       3'882'821      73'603'125
                 'probing_max_lp':    8'345      7'278      66'064     38'142       3'958'135      74'170'116
                   'pseudo_costs':      369    965'340   9'785'527  2'557'020      59'214'557  18'654'036'065
                  'quick_restart':   17'837    388'488  19'826'821    351'560   2'244'575'064  13'810'227'828
            'quick_restart_no_lp':   25'533  1'247'495  10'618'140    207'452   5'116'145'915  18'234'406'524
                  'reduced_costs':  120'479  1'525'628  15'304'657    310'978  19'665'567'144  17'573'615'194

SAT stats                           ClassicMinim   LitRemoved   LitLearned  LitForgotten  Subsumed   MClauses  MDecisions  MLitTrue  MSubsumed  MLitRemoved  MReused
                           'core':     3'866'661  102'897'765   86'144'194    42'743'684     3'142     24'426     123'310         0      1'694       10'118      630
                     'default_lp':     1'194'544   12'699'597   44'922'035    36'023'870     3'245    122'510   1'226'892         0     28'415      278'661   18'234
                          'fixed':     4'176'602    7'505'006  163'825'329   162'968'545    28'015          0           0         0          0            0        0
                      'fs_random':             0            0           11             0         0          0           0         0          0            0        0
                      'fs_random':             0            0            8             0         0          0           0         0          0            0        0
                'fs_random_no_lp':            35          117          936             0         2         13          86         0          1            7        0
        'fs_random_quick_restart':             0            0           23             0         0          0           0         0          0            0        0
        'fs_random_quick_restart':             5            5          108             0         0          0           0         0          0            0        0
  'fs_random_quick_restart_no_lp':             0            0            4             0         0          0           0         0          0            0        0
                 'lb_tree_search':             2            8        5'995             0         0  1'346'931   6'897'577         0        319        1'258   93'979
                         'max_lp':       521'649    2'358'359   17'900'499    16'751'289     8'690    628'522   4'199'536         0      5'780       33'862   51'354
                          'no_lp':     1'321'001   10'717'388   35'811'430    31'228'040     9'948    104'098     981'113         0     15'006      109'479   19'396
            'objective_lb_search':       344'434    2'556'334    6'642'896     3'218'791     4'087    457'044   3'023'342         0      7'204       51'744   74'136
     'objective_lb_search_max_lp':       483'225    2'939'252    7'729'010     3'437'322     7'014    277'516   4'046'469         0      8'857       70'573   91'474
      'objective_lb_search_no_lp':       533'484    4'966'073   13'840'932     7'952'720     6'016    256'948   1'591'701         0      1'190        7'413   31'380
                        'probing':             0            0        7'299             0         0          0           0         0          0            0        0
                 'probing_max_lp':             0            0        7'278             0         0          0           0         0          0            0        0
                   'pseudo_costs':       779'017    4'217'232   23'352'883    21'013'003    10'492  1'062'917   7'195'633         0      1'455        8'986   85'492
                  'quick_restart':       313'075    2'640'703    9'666'646     7'587'250     5'647    123'816   2'063'006         1     53'604      588'252   23'639
            'quick_restart_no_lp':     1'075'206   11'730'848   38'823'974    33'480'488     3'995     48'725     690'951         0     30'739      326'026    5'274
                  'reduced_costs':     1'258'010   14'303'205   47'023'610    43'571'336     7'901    163'456   1'821'790         4     44'688      328'704   64'448

Lp stats                         Component   Iterations  AddedCuts    OPTIMAL    DUAL_F.  DUAL_U.
                  'default_lp':          1   10'551'006    548'820  2'372'202         33      234
                       'fixed':          1      861'647      2'069  8'722'999          0        0
                   'fs_random':          1        6'348      1'120         78          0        0
                   'fs_random':          1        6'405      1'317         84          0        0
     'fs_random_quick_restart':          1        4'709      1'129         57          0        0
     'fs_random_quick_restart':          1        6'109      1'265         85          0        0
              'lb_tree_search':          1  107'877'407     57'211     19'690  7'372'036        0
                      'max_lp':          1   20'895'111    436'594    393'587  1'836'356       21
         'objective_lb_search':          1   34'225'128    941'256  1'645'941      1'846       23
  'objective_lb_search_max_lp':          1   22'794'008     39'401      8'017  1'793'176        1
                     'probing':          1   26'562'288  1'463'313    191'932     10'614        5
              'probing_max_lp':          1   11'954'088    408'396    125'590     40'362        2
                'pseudo_costs':          1   27'236'674    780'741  1'028'331  2'196'823      110
               'quick_restart':          1   61'308'499  3'043'291  1'950'939     16'679       13
               'reduced_costs':          1   23'183'407    721'493  1'324'191  1'880'925       24

Lp dimension                                                                        Final dimension of first component
                  'default_lp':  3939 rows, 4307 columns, 15576 entries with magnitude in [1.011315e-02, 1.000000e+00]
                       'fixed':  3874 rows, 4307 columns, 15338 entries with magnitude in [1.011315e-02, 1.000000e+00]
                   'fs_random':  2900 rows, 4307 columns, 12133 entries with magnitude in [1.011315e-02, 1.000000e+00]
                   'fs_random':  3050 rows, 4307 columns, 12585 entries with magnitude in [1.011315e-02, 1.000000e+00]
     'fs_random_quick_restart':  2350 rows, 4307 columns, 10195 entries with magnitude in [1.011315e-02, 1.000000e+00]
     'fs_random_quick_restart':  3100 rows, 4307 columns, 12764 entries with magnitude in [1.011315e-02, 1.000000e+00]
              'lb_tree_search':  8234 rows, 4320 columns, 44316 entries with magnitude in [3.737936e-04, 1.000000e+00]
                      'max_lp':  5954 rows, 4320 columns, 27935 entries with magnitude in [6.532369e-04, 1.000000e+00]
         'objective_lb_search':  4835 rows, 4307 columns, 19223 entries with magnitude in [5.311567e-04, 1.000000e+00]
  'objective_lb_search_max_lp':  7362 rows, 4320 columns, 36594 entries with magnitude in [1.936275e-04, 1.000000e+00]
                     'probing':  6018 rows, 4307 columns, 31225 entries with magnitude in [1.545687e-04, 1.000000e+00]
              'probing_max_lp':  5961 rows, 4320 columns, 42175 entries with magnitude in [3.978538e-05, 1.000000e+00]
                'pseudo_costs':  5191 rows, 4320 columns, 22317 entries with magnitude in [3.951847e-04, 1.000000e+00]
               'quick_restart':  4940 rows, 4307 columns, 20130 entries with magnitude in [1.038664e-02, 1.000000e+00]
               'reduced_costs':  4173 rows, 4320 columns, 16678 entries with magnitude in [1.275291e-03, 1.000000e+00]

Lp debug                         CutPropag  CutEqPropag     Adjust  Overflow            Bad  BadScaling
                  'default_lp':         22          140    120'549         0     14'689'427           0
                       'fixed':          0            0          0         0          7'163           0
                   'fs_random':          0            0          0         0          7'200           0
                   'fs_random':          0            0          0         0          7'223           0
     'fs_random_quick_restart':          0            0          1         0          9'767           0
     'fs_random_quick_restart':          0            0          6         0          7'237           0
              'lb_tree_search':         32          157  6'611'450         0     51'767'924           0
                      'max_lp':         60          111    596'757         0     20'900'546           0
         'objective_lb_search':         16          144    842'019         0     26'393'671           0
  'objective_lb_search_max_lp':          9           34  1'715'222         0     12'451'986           0
                     'probing':        606        5'652    200'817         0  2'236'711'170           0
              'probing_max_lp':        168        2'644    165'939         0  1'877'287'213           0
                'pseudo_costs':        104          138  1'049'629         0     41'724'890           0
               'quick_restart':        208          560  1'036'220         0    167'372'928           0
               'reduced_costs':        100          136  1'570'467         0     41'057'942           0

Lp pool                          Constraints  Updates  Simplif  Merged  Shortened      Split  Strenghtened            Cuts/Call
                  'default_lp':       14'238    2'543    9'178      52          0     34'478        35'860    548'820/1'811'257
                       'fixed':        6'539        0        0       0          0          0           136          2'069/5'940
                   'fs_random':        5'590        0        0       0          0          0           137          1'120/3'451
                   'fs_random':        5'787        0        0       0          0          0           140          1'317/3'596
     'fs_random_quick_restart':        5'599        0        0       0          0          0           139          1'129/3'088
     'fs_random_quick_restart':        5'735        0        0       0          0          0           142          1'265/3'674
              'lb_tree_search':       51'261    4'382  328'665      11          0    282'011       337'094       57'211/132'357
                      'max_lp':       51'608    2'992  269'920      47          0    219'865       323'062      436'594/942'640
         'objective_lb_search':       13'696    4'481   11'484      30          0    108'891        48'594    941'256/3'244'920
  'objective_lb_search_max_lp':       51'450    1'319  331'021      12          0    170'181       334'657        39'401/81'037
                     'probing':       13'780  152'401   17'883       3          0  4'554'313       222'577  1'463'313/2'669'548
              'probing_max_lp':       51'446   74'160  295'376      11          0    731'396       361'468    408'396/1'072'967
                'pseudo_costs':       51'768    5'146  319'520      34          0    438'893       426'287    780'741/1'756'307
               'quick_restart':       13'619   14'885   14'007     142          0  1'646'857       155'646  3'043'291/8'095'060
               'reduced_costs':       51'468    4'989  291'151      86          0    600'544       370'505    721'493/1'730'385

Lp Cut                                                      fs_ran  fs_ran  fs_ran  fs_ran   defaul  fixed   max_lp     quick_   reduce   pseudo  lb_tre   probin   object   probin  object
                                                    CG_FF:      59      58      57      57   24'841     58   28'470     17'843   51'953   49'061   1'298   21'859   22'674    2'473   1'192
                                                     CG_K:      55      55      55      55   18'425     55   26'370     10'605   46'605   49'704   1'270    8'936   13'928    2'115     840
                                                    CG_KL:       -       -       -       -       62      -       16        104       78       60       -      143       45        2       4
                                                     CG_R:      46      46      46      46   10'755     46   13'558      9'081   22'102   24'223   1'204   23'902   11'013    3'017     736
                                                    CG_RB:      13      13      13      13   54'388     13   63'439     55'365   96'877  120'294   6'936  111'898   62'904    8'224   8'636
                                                   CG_RBP:       4       4       4       4    5'408      4    8'865      4'216   16'120   17'144     949    6'757    4'962    2'403   2'038
                                                   Clique:       -       -       -       -        -      -    6'064          -   10'607   15'282     280        -        -    1'083     268
                                                       IB:     688     483     544     732  276'544  1'473  140'389  2'399'085  206'313  205'044   9'406  377'369  645'383   70'166   7'662
                                                 MIR_1_FF:     133     154     133     134   19'085    134   18'388     46'080   34'525   36'407   1'674   56'114   22'962   15'860   1'282
                                                  MIR_1_K:      46      51      48      47    2'143     47    2'409      6'063    4'630    4'345     212    6'852    2'541    1'944     222
                                                 MIR_1_KL:       -       -       -       -      225      -      570      1'249      684      356      22    5'443      112    2'080      22
                                                  MIR_1_R:      44      50      44      44    4'097     44    2'590      8'174    5'432    5'581     296   17'776    3'822    3'048     188
                                                 MIR_1_RB:      55      62      55      56   28'647     56   32'800    108'677   58'660   64'161   5'356  140'412   35'497   43'220   3'325
                                                MIR_1_RBP:       1       1       2       1    1'621      1    8'674      5'139   13'836   15'753     964    6'223    1'988    3'301     618
                                                MIR_1_RLT:       -       -       -       -        -      -      293          -      634      784      27        -        -      382      18
                                                 MIR_2_FF:      26      29      20      24   12'109     30    8'400     27'759   16'134   18'862     876   28'644   12'889    7'254     648
                                                  MIR_2_K:      14      17      12      17    1'940     13    1'483      3'276    2'770    2'906     117    4'481    1'884    1'328     144
                                                 MIR_2_KL:       -       -       -       -      170      -      447      1'067      541      249      25    5'458      126    1'615      16
                                                  MIR_2_R:      10      10      10       9    2'628      9    1'665      5'480    3'513    3'568     602   20'923    2'757    5'022     267
                                                 MIR_2_RB:      24      35      25      28   17'726     28   12'010     73'086   22'115   26'887   2'216   98'018   20'425   20'708   1'400
                                                MIR_2_RBP:       -       -       -       -    1'168      -    2'324      4'525    3'722    5'014     296    5'296    1'388    1'541     184
                                                 MIR_3_FF:       3       4       6       3    7'636      4    4'618     17'010    8'994   11'145     560   19'136    7'262    4'058     373
                                                  MIR_3_K:       2       2       2       2    1'465      3    1'245      2'233    2'231    2'603     120    3'807    1'252    1'135     111
                                                 MIR_3_KL:       -       -       -       -      139      -      304        960      430      258      31    4'423      106    1'335      18
                                                  MIR_3_R:       2       2       2       2    1'567      2      874      3'983    1'823    2'039     552   15'276    1'648    4'242     194
                                                 MIR_3_RB:       6       7       7       8   10'580      8    6'495     44'395   11'978   14'425   1'344   69'217   11'692   11'600     703
                                                MIR_3_RBP:       -       -       -       -      558      -    1'208      2'852    2'037    2'618     188    4'202      890    1'117     102
                                                 MIR_4_FF:       2       3       5       3    5'153      3    2'656     11'230    4'860    6'410     281   12'487    4'529    1'957     202
                                                  MIR_4_K:       7       5       4       4      994      7      926      1'493    1'445    1'673      78    2'518      813      650      80
                                                 MIR_4_KL:       -       -       -       -      107      -      232        801      462      228      26    3'202      110    1'210      21
                                                  MIR_4_R:       -       -       -       -    1'018      -      459      2'477      943      969     279    8'136    1'094    1'478     114
                                                 MIR_4_RB:       7       7       4       5    7'031      6    3'693     27'373    6'632    8'048     577   48'093    7'297    5'159     355
                                                MIR_4_RBP:       -       -       -       -      312      -      612      1'495    1'184    1'253     116    2'368      513      703      66
                                                 MIR_5_FF:       -       -       -       -    3'597      -    1'418      7'902    2'793    3'454     182    9'711    3'127    1'252      96
                                                  MIR_5_K:       1       1       1       1      626      2      434      1'072      829      885      46    2'148      545      481      42
                                                 MIR_5_KL:       -       -       -       -      154      -      189        994      406      214      37    3'181      165    1'103      21
                                                  MIR_5_R:       -       -       -       -      699      -      226      1'393      540      495     155    5'172      787      880      48
                                                 MIR_5_RB:       1       2       1       1    4'709      3    2'141     17'932    3'823    4'655     314   35'921    5'000    2'864     195
                                                MIR_5_RBP:       -       1       -       -      168      1      328        921      671      650      60    1'902      330      458      49
                                                 MIR_6_FF:       -       -       -       -    2'408      -      947      5'131    1'770    2'129     126    7'783    2'059      841      78
                                                  MIR_6_K:       -       -       -       -      437      -      302      1'098      574      526      29    2'371      391      309      30
                                                 MIR_6_KL:       -       -       -       -      182      -      207      1'435      544      304      43    4'531      270    1'177      25
                                                  MIR_6_R:       -       -       -       -      423      -      144        817      406      284      63    3'531      455      356      28
                                                 MIR_6_RB:       -       -       -       -    3'315      -    1'428     12'024    2'424    2'870     155   32'117    3'337    1'601     118
                                                MIR_6_RBP:       -       -       -       -      145      -      205        773      511      415      44    2'122      258      333      43
         NoOverlapCompletionTimeExhaustiveMirror_weighted:       -       -       -       -        -      -        2          -        3        1       -        -        -        -       1
  NoOverlapCompletionTimeExhaustiveMirror_weighted_lifted:       -       -       -       -        -      -        -          -        3        -       -        -        -        -       -
               NoOverlapCompletionTimeExhaustive_weighted:       -       -       -       -        -      -       56          -      147       82       1        -        -       49       7
        NoOverlapCompletionTimeExhaustive_weighted_lifted:       -       -       -       -        -      -      654          -    1'426    1'415       6        -        -        4      22
                          NoOverlapCompletionTimeQueyrane:       -       -       -       -        -      -      144          -      325      224       5        -        -       21      13
                   NoOverlapCompletionTimeQueyrane_lifted:       -       -       -       -        -      -      164          -      407      278       1        -        -        1       9
                                NoOverlapDisjunctionOnEnd:       -       -       -       -        -      -        5          -       19        6       -        -        -        -       4
                              NoOverlapDisjunctionOnStart:       -       -       -       -        -      -      596          -    1'170    1'315       6        -        -        9      23
                                             ZERO_HALF_FF:       6      13       9      10    3'366      9    4'202      4'489    7'379    7'326     281    5'062    3'205      618     157
                                              ZERO_HALF_K:       3       5       3       3      824      4    2'308      1'193    4'146    4'545     169      849      834      485     144
                                             ZERO_HALF_KL:       -       -       -       -        3      -        1          9        1        7       -        7        2        -       -
                                              ZERO_HALF_R:       4       4       3       5    4'033      2    8'383     63'950   14'351   13'563  15'255  141'040    8'783  140'360   5'103
                                             ZERO_HALF_RB:       3       5       4       3    4'385      4    7'249     14'114   12'574   13'467   1'134   52'286    5'874   14'236     701
                                            ZERO_HALF_RBP:       -       -       1       -      804      -    2'315      4'868    3'381    4'277     921   14'210    1'328    9'528     395

LNS stats                        Improv/Calls  Closed  Difficulty  TimeLimit
               'graph_arc_lns':   12550/26956     50%        1.00       0.10
               'graph_cst_lns':   12107/26955     50%        1.00       0.10
               'graph_dec_lns':   11198/26956     50%        1.00       0.10
               'graph_var_lns':   13115/26956     50%        1.00       0.10
                   'rins/rens':    2698/25426     50%        0.93       0.16
                 'rnd_cst_lns':   12044/26956     50%        1.00       0.10
                 'rnd_var_lns':   11154/26956     50%        1.00       0.10
    'scheduling_intervals_lns':   26955/26955      0%        0.00       0.10
  'scheduling_precedences_lns':   26955/26956      0%        0.00       0.10
  'scheduling_time_window_lns':   26955/26955      0%        0.00       0.10

LS stats                   Batches  Restarts     LinMoves    GenMoves  CompoundMoves  WeightUpdates
       'fj_long_default':        9         1       89'810           0              0            190
   'fj_long_lin_default':       11         1            0      13'952          2'364              0
        'fj_long_random':        5         1       49'854           0              0            146
      'fj_short_default':       18         1            0      26'028          2'989              1
  'fj_short_lin_default':       17         1            0      24'167          3'868              1
   'fj_short_lin_random':        9         1            0      15'321          2'441              1
       'fj_short_random':        5         1            0       7'056          1'582              0
          'violation_ls':   26'957         0  129'163'850  17'200'644        740'974      3'078'548
          'violation_ls':   26'957         0  131'738'165  16'595'171        752'769      2'148'795

Solutions (147)                     Num      Rank
  'fs_random_quick_restart_no_lp':    1     [1,1]
                  'graph_arc_lns':   13  [30,143]
                  'graph_cst_lns':    5  [20,142]
                  'graph_dec_lns':    9  [19,144]
                  'graph_var_lns':    7  [14,112]
                          'no_lp':    9    [7,18]
            'quick_restart_no_lp':   19  [16,147]
                    'rins_lp_lns':   21  [12,134]
                  'rins_pump_lns':    1   [33,33]
                    'rnd_cst_lns':    6  [24,135]
                    'rnd_var_lns':    7   [5,114]
                   'violation_ls':   49   [2,146]

Objective bounds                      Num
                   'initial_domain':    1
                   'lb_tree_search':    1
              'objective_lb_search':    1
       'objective_lb_search_max_lp':   71
        'objective_lb_search_no_lp':    4
  'objective_shaving_search_max_lp':    1
                     'pseudo_costs':    2
                    'reduced_costs':    3

Solution repositories      Added  Queried  Ignored  Synchro
  'feasible solutions':  112'535  613'189        0  111'089
        'lp solutions':   61'731   13'606        0   60'308
                'pump':  198'267   13'351

Improving bounds shared             Num
                        'core':       6
                  'default_lp':     184
              'lb_tree_search':      40
                      'max_lp':     573
                       'no_lp':      98
         'objective_lb_search':      14
  'objective_lb_search_max_lp':       7
                     'probing':  41'793
              'probing_max_lp':  13'856
                'pseudo_costs':     267
               'quick_restart':   1'331
         'quick_restart_no_lp':   2'829
               'reduced_costs':   1'319

Clauses shared                   Num
                        'core':    2
                  'default_lp':   33
                   'fs_random':    1
              'lb_tree_search':    9
                      'max_lp':   29
                       'no_lp':    9
         'objective_lb_search':   10
  'objective_lb_search_max_lp':    2
   'objective_lb_search_no_lp':    8
                'pseudo_costs':   27
               'quick_restart':   41
         'quick_restart_no_lp':   67
               'reduced_costs':    3

CpSolverResponse summary:
status: FEASIBLE
objective: 3927
best_bound: 1885
integers: 4311
booleans: 350
conflicts: 3
branches: 741
propagations: 51
integer_propagations: 224739
restarts: 700
lp_iterations: 6109
walltime: 86401.2
usertime: 86401.2
deterministic_time: 263925
gap_integral: 2.01254e+06
solution_fingerprint: 0xd2a4fe3beccc27df


--- Simulation Gantt  partir du modle mathmatique ---
