created virtual environment CPython3.12.4.final.0-64 in 23053ms
  creator CPython3Posix(dest=/localscratch/aneumann.63393229.0/env, clear=False, no_vcs_ignore=False, global=False)
  seeder FromAppData(download=False, pip=bundle, via=copy, app_data_dir=/home/aneumann/.local/share/virtualenv)
    added seed packages: pip==25.1.1
  activators BashActivator,CShellActivator,FishActivator,NushellActivator,PowerShellActivator,PythonActivator
Looking in links: /cvmfs/soft.computecanada.ca/custom/python/wheelhouse/gentoo2023/x86-64-v3, /cvmfs/soft.computecanada.ca/custom/python/wheelhouse/gentoo2023/generic, /cvmfs/soft.computecanada.ca/custom/python/wheelhouse/generic
Requirement already satisfied: pip in /localscratch/aneumann.63393229.0/env/lib/python3.12/site-packages (25.1.1)
Looking in links: /cvmfs/soft.computecanada.ca/custom/python/wheelhouse/gentoo2023/x86-64-v3, /cvmfs/soft.computecanada.ca/custom/python/wheelhouse/gentoo2023/generic, /cvmfs/soft.computecanada.ca/custom/python/wheelhouse/generic
ERROR: protobuf-5.28.3-cp38-abi3-manylinux2014_x86_64.whl is not a supported wheel on this platform.
Looking in links: /cvmfs/soft.computecanada.ca/custom/python/wheelhouse/gentoo2023/x86-64-v3, /cvmfs/soft.computecanada.ca/custom/python/wheelhouse/gentoo2023/generic, /cvmfs/soft.computecanada.ca/custom/python/wheelhouse/generic
Processing /home/aneumann/projects/def-adhaj/aneumann/GNRS/wheels/immutabledict-4.2.0-py3-none-any.whl
Installing collected packages: immutabledict
Successfully installed immutabledict-4.2.0
Looking in links: /cvmfs/soft.computecanada.ca/custom/python/wheelhouse/gentoo2023/x86-64-v3, /cvmfs/soft.computecanada.ca/custom/python/wheelhouse/gentoo2023/generic, /cvmfs/soft.computecanada.ca/custom/python/wheelhouse/generic
Processing /cvmfs/soft.computecanada.ca/custom/python/wheelhouse/generic/ortools-9.10.4067+computecanada-cp312-cp312-linux_x86_64.whl (from -r /home/aneumann/projects/def-adhaj/aneumann/GNRS/requirements/or.txt (line 1))
Processing /cvmfs/soft.computecanada.ca/custom/python/wheelhouse/gentoo2023/x86-64-v3/matplotlib-3.10.0+computecanada-cp312-cp312-linux_x86_64.whl (from -r /home/aneumann/projects/def-adhaj/aneumann/GNRS/requirements/or.txt (line 2))
Processing /cvmfs/soft.computecanada.ca/custom/python/wheelhouse/gentoo2023/x86-64-v3/pandas-2.2.3+computecanada-cp312-cp312-linux_x86_64.whl (from -r /home/aneumann/projects/def-adhaj/aneumann/GNRS/requirements/or.txt (line 3))
Processing /cvmfs/soft.computecanada.ca/custom/python/wheelhouse/generic/absl_py-2.2.2+computecanada-py3-none-any.whl (from ortools<9.11,>=9.10->-r /home/aneumann/projects/def-adhaj/aneumann/GNRS/requirements/or.txt (line 1))
Processing /cvmfs/soft.computecanada.ca/custom/python/wheelhouse/gentoo2023/generic/numpy-2.2.2+computecanada-cp312-cp312-linux_x86_64.whl (from ortools<9.11,>=9.10->-r /home/aneumann/projects/def-adhaj/aneumann/GNRS/requirements/or.txt (line 1))
Processing /cvmfs/soft.computecanada.ca/custom/python/wheelhouse/gentoo2023/x86-64-v3/protobuf-6.30.2+computecanada-cp312-cp312-linux_x86_64.whl (from ortools<9.11,>=9.10->-r /home/aneumann/projects/def-adhaj/aneumann/GNRS/requirements/or.txt (line 1))
Requirement already satisfied: immutabledict>=3.0.0 in /localscratch/aneumann.63393229.0/env/lib/python3.12/site-packages (from ortools<9.11,>=9.10->-r /home/aneumann/projects/def-adhaj/aneumann/GNRS/requirements/or.txt (line 1)) (4.2.0)
Processing /cvmfs/soft.computecanada.ca/custom/python/wheelhouse/gentoo2023/generic/contourpy-1.3.1+computecanada-cp312-cp312-linux_x86_64.whl (from matplotlib->-r /home/aneumann/projects/def-adhaj/aneumann/GNRS/requirements/or.txt (line 2))
Processing /cvmfs/soft.computecanada.ca/custom/python/wheelhouse/generic/cycler-0.12.1+computecanada-py3-none-any.whl (from matplotlib->-r /home/aneumann/projects/def-adhaj/aneumann/GNRS/requirements/or.txt (line 2))
Processing /cvmfs/soft.computecanada.ca/custom/python/wheelhouse/generic/fonttools-4.58.2+computecanada-cp312-cp312-linux_x86_64.whl (from matplotlib->-r /home/aneumann/projects/def-adhaj/aneumann/GNRS/requirements/or.txt (line 2))
Processing /cvmfs/soft.computecanada.ca/custom/python/wheelhouse/gentoo2023/x86-64-v3/kiwisolver-1.4.8+computecanada-cp312-cp312-linux_x86_64.whl (from matplotlib->-r /home/aneumann/projects/def-adhaj/aneumann/GNRS/requirements/or.txt (line 2))
Processing /cvmfs/soft.computecanada.ca/custom/python/wheelhouse/generic/packaging-25.0+computecanada-py3-none-any.whl (from matplotlib->-r /home/aneumann/projects/def-adhaj/aneumann/GNRS/requirements/or.txt (line 2))
Processing /cvmfs/soft.computecanada.ca/custom/python/wheelhouse/gentoo2023/x86-64-v3/pillow-11.1.0+computecanada-cp312-cp312-linux_x86_64.whl (from matplotlib->-r /home/aneumann/projects/def-adhaj/aneumann/GNRS/requirements/or.txt (line 2))
Processing /cvmfs/soft.computecanada.ca/custom/python/wheelhouse/generic/pyparsing-3.2.1+computecanada-py3-none-any.whl (from matplotlib->-r /home/aneumann/projects/def-adhaj/aneumann/GNRS/requirements/or.txt (line 2))
Processing /cvmfs/soft.computecanada.ca/custom/python/wheelhouse/generic/python_dateutil-2.9.0.post0+computecanada-py2.py3-none-any.whl (from matplotlib->-r /home/aneumann/projects/def-adhaj/aneumann/GNRS/requirements/or.txt (line 2))
Processing /cvmfs/soft.computecanada.ca/custom/python/wheelhouse/generic/pytz-2025.2+computecanada-py2.py3-none-any.whl (from pandas->-r /home/aneumann/projects/def-adhaj/aneumann/GNRS/requirements/or.txt (line 3))
Processing /cvmfs/soft.computecanada.ca/custom/python/wheelhouse/generic/tzdata-2025.2+computecanada-py2.py3-none-any.whl (from pandas->-r /home/aneumann/projects/def-adhaj/aneumann/GNRS/requirements/or.txt (line 3))
Processing /cvmfs/soft.computecanada.ca/custom/python/wheelhouse/generic/six-1.17.0+computecanada-py2.py3-none-any.whl (from python-dateutil>=2.7->matplotlib->-r /home/aneumann/projects/def-adhaj/aneumann/GNRS/requirements/or.txt (line 2))
Installing collected packages: pytz, tzdata, six, pyparsing, protobuf, pillow, packaging, numpy, kiwisolver, fonttools, cycler, absl-py, python-dateutil, contourpy, pandas, matplotlib, ortools

Successfully installed absl-py-2.2.2+computecanada contourpy-1.3.1+computecanada cycler-0.12.1+computecanada fonttools-4.58.2+computecanada kiwisolver-1.4.8+computecanada matplotlib-3.10.0+computecanada numpy-2.2.2+computecanada ortools-9.10.4067+computecanada packaging-25.0+computecanada pandas-2.2.3+computecanada pillow-11.1.0+computecanada protobuf-6.30.2+computecanada pyparsing-3.2.1+computecanada python-dateutil-2.9.0.post0+computecanada pytz-2025.2+computecanada six-1.17.0+computecanada tzdata-2025.2+computecanada

Starting CP-SAT solver v9.10.4067
Parameters: max_time_in_seconds: 3600 max_memory_in_mb: 12000 log_search_progress: true enumerate_all_solutions: false absolute_gap_limit: 0 relative_gap_limit: 0
Setting number of workers to 48

Initial optimization model '': (model_fingerprint: 0x3c9051428f062fb4)
#Variables: 277 (#ints: 9 in objective)
  - 188 Booleans in [0,1]
  - 89 in [0,534]
#kLinear1: 38
#kLinear2: 478
#kLinear3: 196
#kLinearN: 2'268 (#terms: 28'298)

Starting presolve at 0.00s
  1.46e-03s  0.00e+00d  [DetectDominanceRelations] 
  3.41e-02s  0.00e+00d  [PresolveToFixPoint] #num_loops=6 #num_dual_strengthening=3 
  2.99e-05s  0.00e+00d  [ExtractEncodingFromLinear] #potential_supersets=6 
[Symmetry] Graph for symmetry has 2'760 nodes and 20'778 arcs.
[Symmetry] Symmetry computation done. time: 0.00204573 dtime: 0.00216936
[Symmetry] #generators: 1, average support size: 28
[Symmetry] The model contains 228 duplicate constraints !
[Symmetry] 14 orbits with sizes: 2,2,2,2,2,2,2,2,2,2,...
[Symmetry] Num fixable by intersecting at_most_one with orbits: 1 largest_orbit: 2
  7.46e-03s  1.01e-03d  [Probe] #probed=262 #fixed_bools=2 #new_bounds=9 #equiv=1 
  6.15e-05s  0.00e+00d  [MaxClique] Merged 28(56 literals) into 12(24 literals) at_most_ones. 
  1.42e-03s  0.00e+00d  [DetectDominanceRelations] 
  1.39e-02s  0.00e+00d  [PresolveToFixPoint] #num_loops=4 #num_dual_strengthening=3 
  4.81e-03s  0.00e+00d  [ProcessAtMostOneAndLinear] 
  2.45e-03s  0.00e+00d  [DetectDuplicateConstraints] #duplicates=279 #without_enforcements=245 
  1.64e-03s  6.79e-05d  [DetectDominatedLinearConstraints] #relevant_constraints=1'745 #num_inclusions=1'258 #num_redundant=1 
  3.08e-04s  0.00e+00d  [DetectDifferentVariables] #different=38 
  4.47e-04s  2.18e-05d  [ProcessSetPPC] #relevant_constraints=1'234 
  2.33e-05s  0.00e+00d  [FindAlmostIdenticalLinearConstraints] 
  2.42e-04s  2.01e-04d  [FindBigAtMostOneAndLinearOverlap] 
  5.80e-03s  1.50e-03d  [FindBigVerticalLinearOverlap] #blocks=39 #saved_nz=3'598 
  2.29e-04s  4.74e-05d  [FindBigHorizontalLinearOverlap] #linears=1'113 
  1.26e-05s  0.00e+00d  [MergeClauses] 
  1.47e-03s  0.00e+00d  [DetectDominanceRelations] 
  2.08e-02s  0.00e+00d  [PresolveToFixPoint] #num_loops=2 #num_dual_strengthening=1 
  1.48e-03s  0.00e+00d  [DetectDominanceRelations] 
  1.16e-02s  0.00e+00d  [PresolveToFixPoint] #num_loops=1 #num_dual_strengthening=1 
[Symmetry] Graph for symmetry has 2'579 nodes and 16'079 arcs.
[Symmetry] Symmetry computation done. time: 0.000702822 dtime: 0.00100345
  6.94e-03s  9.39e-04d  [Probe] #probed=258 #new_bounds=29 
  1.20e-05s  0.00e+00d  [MaxClique] 
  1.46e-03s  0.00e+00d  [DetectDominanceRelations] 
  1.84e-02s  0.00e+00d  [PresolveToFixPoint] #num_loops=2 #num_dual_strengthening=1 
  4.02e-03s  0.00e+00d  [ProcessAtMostOneAndLinear] 
  2.14e-03s  0.00e+00d  [DetectDuplicateConstraints] #without_enforcements=310 
  8.62e-04s  3.56e-05d  [DetectDominatedLinearConstraints] #relevant_constraints=1'369 #num_inclusions=288 
  2.99e-04s  0.00e+00d  [DetectDifferentVariables] #different=45 #cliques=1 #size=3 
  3.58e-04s  1.32e-05d  [ProcessSetPPC] #relevant_constraints=1'018 
  3.34e-05s  1.05e-07d  [FindAlmostIdenticalLinearConstraints] #num_tested_pairs=7 
  1.68e-04s  1.03e-04d  [FindBigAtMostOneAndLinearOverlap] 
  2.56e-03s  9.44e-04d  [FindBigVerticalLinearOverlap] #blocks=18 #saved_nz=907 
  1.92e-04s  3.63e-05d  [FindBigHorizontalLinearOverlap] #linears=920 
  1.19e-05s  0.00e+00d  [MergeClauses] 
  1.40e-03s  0.00e+00d  [DetectDominanceRelations] 
  1.39e-02s  0.00e+00d  [PresolveToFixPoint] #num_loops=2 #num_dual_strengthening=1 
  1.40e-03s  0.00e+00d  [DetectDominanceRelations] 
  1.07e-02s  0.00e+00d  [PresolveToFixPoint] #num_loops=1 #num_dual_strengthening=1 
  6.68e-03s  9.04e-04d  [Probe] #probed=258 #new_bounds=12 
  1.19e-05s  0.00e+00d  [MaxClique] 
  1.40e-03s  0.00e+00d  [DetectDominanceRelations] 
  1.30e-02s  0.00e+00d  [PresolveToFixPoint] #num_loops=2 #num_dual_strengthening=1 
  3.91e-03s  0.00e+00d  [ProcessAtMostOneAndLinear] 
  2.10e-03s  0.00e+00d  [DetectDuplicateConstraints] #without_enforcements=310 
  8.09e-04s  3.21e-05d  [DetectDominatedLinearConstraints] #relevant_constraints=1'384 #num_inclusions=259 
  1.90e-04s  0.00e+00d  [DetectDifferentVariables] 
  3.18e-04s  1.09e-05d  [ProcessSetPPC] #relevant_constraints=925 
  3.71e-05s  2.00e-07d  [FindAlmostIdenticalLinearConstraints] #num_tested_pairs=12 
  1.49e-04s  8.53e-05d  [FindBigAtMostOneAndLinearOverlap] 
  2.05e-03s  8.29e-04d  [FindBigVerticalLinearOverlap] #blocks=6 #saved_nz=328 
  1.77e-04s  3.29e-05d  [FindBigHorizontalLinearOverlap] #linears=836 
  1.15e-05s  0.00e+00d  [MergeClauses] 
  1.38e-03s  0.00e+00d  [DetectDominanceRelations] 
  1.09e-02s  0.00e+00d  [PresolveToFixPoint] #num_loops=2 #num_dual_strengthening=1 
  6.99e-05s  0.00e+00d  [ExpandObjective] #entries=242 #tight_variables=97 #tight_constraints=52 

Presolve summary:
  - 50 affine relations were detected.
  - rule 'TODO dual: only one blocking constraint?' was applied 724 times.
  - rule 'TODO dual: only one unspecified blocking constraint?' was applied 117 times.
  - rule 'TODO duplicate: identical constraint with different enforcements' was applied 865 times.
  - rule 'TODO no_overlap: with task always last' was applied 1 time.
  - rule 'affine: new relation' was applied 50 times.
  - rule 'all_diff: inferred from x != y constraints' was applied 1 time.
  - rule 'at_most_one: removed literals' was applied 12 times.
  - rule 'at_most_one: size one' was applied 12 times.
  - rule 'at_most_one: transformed into max clique.' was applied 1 time.
  - rule 'deductions: 176 stored' was applied 1 time.
  - rule 'dual: fix variable' was applied 24 times.
  - rule 'dual: reduced domain' was applied 47 times.
  - rule 'duplicate: merged rhs of linear constraint' was applied 53 times.
  - rule 'duplicate: removed constraint' was applied 279 times.
  - rule 'enforcement: false literal' was applied 12 times.
  - rule 'enforcement: true literal' was applied 8 times.
  - rule 'exactly_one: x and not(x)' was applied 1 time.
  - rule 'incompatible linear: add implication' was applied 45 times.
  - rule 'linear inclusion: redundant containing constraint' was applied 1 time.
  - rule 'linear matrix: common vertical rectangle' was applied 63 times.
  - rule 'linear: always true' was applied 655 times.
  - rule 'linear: doubleton free' was applied 10 times.
  - rule 'linear: empty' was applied 24 times.
  - rule 'linear: extracted enforcement literal' was applied 5'356 times.
  - rule 'linear: fixed or dup variables' was applied 2'306 times.
  - rule 'linear: positive equal one' was applied 6 times.
  - rule 'linear: reduced variable domains' was applied 159 times.
  - rule 'linear: remapped using affine relations' was applied 2'211 times.
  - rule 'linear: simplified rhs' was applied 7'179 times.
  - rule 'linear: variable substitution 1' was applied 10 times.
  - rule 'linear: variable substitution 2' was applied 3 times.
  - rule 'presolve: 79 unused variables removed.' was applied 1 time.
  - rule 'presolve: iteration' was applied 3 times.
  - rule 'probing: reduced enforced constraint to implication.' was applied 28 times.
  - rule 'probing: simplified enforcement list.' was applied 1 time.
  - rule 'symmetry: fixed to false in general orbit' was applied 1 time.

Presolved optimization model '': (model_fingerprint: 0xd50ec3eae4449c7d)
#Variables: 198 (#ints: 9 in objective)
  - 69 Booleans in [0,1]
  - 1 in [-3135,-2728][-2667,-2194][-2133,-1660][- ... -1065,-592][-531,-58][3,476][537,1010][1071,1478]
  - 1 in [-2067,-1631][-1599,-1097][-1065,-563][-5 ... 3,505][537,1039][1071,1573][1605,2107][2139,2575]
  - 1 in [-1554,-1093][-1038,-559][-504,-25][30,509][564,1043][1098,1511]
  - 1 in [-1533,-1093][-1065,-559][-531,-25][3,509][537,1043][1071,1511]
  - 1 in [-1533,-1093][-1065,-559][-531,-25][3,509][537,1043][1071,1577][1605,2045]
  - 1 in [-1533,-1093][-1065,-559][-531,-25][3,509][537,1043][1071,1577][1605,2111][2139,2579]
  - 1 in [-1496,-1126][-1065,-592][-531,-58][3,476][537,1010][1071,1478]
  - 2 in [-1496,-1126][-1065,-592][-531,-58][3,476][537,1010][1071,1544][1605,2012]
  - 1 in [-1496,-1126][-1065,-592][-531,-58][3,476][537,1010][1071,1544][1605,2078][2139,2546]
  - 1 in [-1020,-559][-504,-25][30,509][564,1043][1098,1511]
  - 1 in [-1020,-559][-504,-25][30,509][564,1043][1098,1577][1632,2045]
  - 1 in [-999,-592][-531,-58][3,476][537,1010][1071,1478]
  - 1 in [-999,-559][-531,-25][3,509][537,1043][1071,1511]
  - 1 in [-962,-592][-531,-58][3,476][537,1010][1071,1478]
  - 3 in [-958,-563][-531,-29][3,505][537,1039][1071,1573][1605,2107][2139,2575]
  - 1 in [-958,-563][-531,-29][3,505][537,1039][1071,1573][1605,2107][2139,2641][2673,3109]
  - 3 in [-534,-68][0,466]
  - 3 in [-534,-61][0,473]
  - 3 in [-534,-55][0,479]
  - 1 in [-534,-41][0,493]
  - 3 in [-534,-40][0,494]
  - 3 in [-534,-28][0,506]
  - 1 in [-531,-102][3,432][537,966][1071,1500][1605,2028]
  - 1 in [-528,-25][3,443]
  - 1 in [-504,-25][30,509][564,1043][1098,1511]
  - 1 in [-470,-42][-2,426]
  - 1 in [-465,-102][3,432][537,966][1071,1500][1605,2028]
  - 1 in [-465,-58][3,476][537,1010][1071,1478]
  - 1 in [-465,-25][3,509][537,977]
  - 1 in [-424,-29][3,505][537,978]
  - 1 in [-424,-29][3,505][537,1039][1071,1573][1605,2041]
  - 1 in [-424,-29][3,505][537,1039][1071,1573][1605,2107][2139,2575]
  - 1 in [-2,464]
  - 1 in [-2,480]
  - 1 in [-2,492]
  - 1 in [0,343]
  - 4 in [0,395]
  - 1 in [0,423]
  - 1 in [0,425]
  - 1 in [0,426]
  - 1 in [0,429]
  - 1 in [0,445]
  - 1 in [0,460]
  - 3 in [0,466]
  - 3 in [0,473]
  - 4 in [0,479]
  - 1 in [0,483]
  - 3 in [0,493]
  - 1 in [0,493][534,1027]
  - 3 in [0,494]
  - 1 in [0,502]
  - 3 in [0,506]
  - 1 in [3,432]
  - 1 in [3,432][537,960]
  - 1 in [3,469]
  - 1 in [3,476]
  - 1 in [3,476][537,1010]
  - 1 in [3,482]
  - 1 in [3,496]
  - 1 in [3,497]
  - 1 in [3,505]
  - 1 in [3,505][537,1039]
  - 1 in [3,509]
  - 1 in [6,505][537,1039][1071,1520]
  - 1 in [30,509]
  - 1 in [30,509][564,1043][1098,1539]
  - 1 in [36,464][532,960]
  - 2 in [40,523]
  - 1 in [41,476][537,1010][1071,1506]
  - 1 in [41,505][537,1039][1071,1573][1605,2054]
  - 2 in [44,523]
  - 1 in [45,474]
  - 1 in [46,529]
  - 1 in [50,529]
  - 2 in [63,523]
  - 1 in [69,432][537,966][1071,1494]
  - 1 in [69,432][537,966][1071,1500][1605,2028]
  - 1 in [69,505][537,1039][1071,1573][1605,2107][2139,2575]
  - 1 in [69,529]
  - 2 in [78,523]
  - 1 in [84,529]
  - 2 in [97,523]
  - 2 in [98,523]
  - 3 in [100,523]
  - 1 in [103,529]
  - 1 in [104,529]
  - 1 in [106,529]
  - 3 in [128,523]
  - 1 in [134,529]
  - 1 in [139,534]
#kAllDiff: 1
#kExactlyOne: 5 (#literals: 15)
#kLinear2: 649 (#enforced: 591 #multi: 512)
#kLinear3: 255 (#enforced: 203 #multi: 104)
#kLinearN: 1'072 (#enforced: 905) (#terms: 7'537)

Preloading model.
#Bound   0.22s best:inf   next:[139,4018] initial_domain
#Model   0.22s var:198/198 constraints:1982/1982

Starting search at 0.23s with 48 workers.
16 full problem subsolvers: [core, default_lp, lb_tree_search, max_lp, no_lp, objective_lb_search, objective_lb_search_max_lp, objective_lb_search_no_lp, objective_shaving_search_max_lp, objective_shaving_search_no_lp, probing, probing_max_lp, pseudo_costs, quick_restart, quick_restart_no_lp, reduced_costs]
30 first solution subsolvers: [fj_long_default(2), fj_long_lin_default, fj_long_lin_perturb, fj_long_lin_random, fj_long_perturb, fj_long_random, fj_short_default(2), fj_short_lin_default(2), fj_short_lin_perturb, fj_short_lin_random, fj_short_perturb, fj_short_random, fs_random(4), fs_random_no_lp(4), fs_random_quick_restart(4), fs_random_quick_restart_no_lp(3)]
13 incomplete subsolvers: [feasibility_pump, graph_arc_lns, graph_cst_lns, graph_dec_lns, graph_var_lns, rins/rens, rnd_cst_lns, rnd_var_lns, violation_ls(5)]
3 helper subsolvers: [neighborhood_helper, synchronization_agent, update_gap_integral]
#Bound   0.24s best:inf   next:[140,4018] bool_core (num_cores=1 [size:1 mw:1] a=9 d=0 fixed=0/78 clauses=5)
#1       0.25s best:1551  next:[140,1550] no_lp (fixed_bools=0/90)
#Bound   0.25s best:1551  next:[165,1550] objective_lb_search_no_lp
#2       0.25s best:1234  next:[165,1233] quick_restart_no_lp (fixed_bools=0/106)
#3       0.26s best:1227  next:[165,1226] no_lp (fixed_bools=0/124)
#4       0.26s best:1221  next:[165,1220] no_lp (fixed_bools=0/131)
#Bound   0.26s best:1221  next:[260,1220] objective_lb_search_no_lp
#5       0.26s best:1207  next:[260,1206] rnd_var_lns (d=0.71 s=59 t=0.10 p=1.00 stall=1 h=auto_l0)
#Bound   0.27s best:1207  next:[288,1206] objective_lb_search_no_lp
#6       0.27s best:1197  next:[288,1196] no_lp (fixed_bools=0/160)
#Bound   0.28s best:1197  next:[296,1196] objective_lb_search_no_lp
#7       0.29s best:1189  next:[296,1188] no_lp (fixed_bools=0/174)
#8       0.29s best:1154  next:[296,1153] no_lp (fixed_bools=0/188)
#9       0.30s best:1148  next:[296,1147] no_lp (fixed_bools=0/198)
#10      0.30s best:1124  next:[296,1123] no_lp (fixed_bools=0/208)
#Bound   0.31s best:1124  next:[297,1123] objective_lb_search_no_lp
#11      0.31s best:1103  next:[297,1102] quick_restart_no_lp (fixed_bools=0/161)
#12      0.32s best:1098  next:[297,1097] quick_restart_no_lp (fixed_bools=0/165)
#13      0.32s best:1096  next:[297,1095] violation_ls(batch:2 #solutions_imported:2 #lin_moves:1 #lin_evals:11'146 #gen_moves:6'203 #gen_evals:611 #comp_moves:385 #backtracks:2'909 #weight_updates:54)
#14      0.32s best:1094  next:[297,1093] violation_ls(batch:3 #solutions_imported:3 #lin_moves:1 #lin_evals:11'192 #gen_moves:6'238 #gen_evals:612 #comp_moves:386 #backtracks:2'926 #weight_updates:54)
#15      0.33s best:1093  next:[297,1092] violation_ls(batch:4 #solutions_imported:4 #lin_moves:2 #lin_evals:11'201 #gen_moves:6'238 #gen_evals:612 #comp_moves:386 #backtracks:2'926 #weight_updates:54)
#Bound   0.33s best:1093  next:[377,1092] objective_lb_search_no_lp
#16      0.35s best:1092  next:[377,1091] quick_restart_no_lp (fixed_bools=0/186)
#17      0.35s best:1091  next:[377,1090] quick_restart_no_lp (fixed_bools=0/191)
#18      0.36s best:1090  next:[377,1089] violation_ls(batch:2 #solutions_imported:2 #lin_moves:0 #lin_evals:17'875 #gen_moves:10'052 #gen_evals:993 #comp_moves:568 #backtracks:4'742 #weight_updates:80)
#19      0.36s best:1089  next:[377,1088] violation_ls(batch:3 #solutions_imported:3 #lin_moves:0 #lin_evals:17'878 #gen_moves:10'053 #gen_evals:993 #comp_moves:569 #backtracks:4'742 #weight_updates:80)
#20      0.36s best:1088  next:[377,1087] violation_ls(batch:4 #solutions_imported:4 #lin_moves:0 #lin_evals:17'881 #gen_moves:10'055 #gen_evals:993 #comp_moves:571 #backtracks:4'742 #weight_updates:80)
#21      0.36s best:1087  next:[377,1086] violation_ls(batch:6 #solutions_imported:6 #lin_moves:5'952 #lin_evals:26'278 #gen_moves:2'193 #gen_evals:146 #comp_moves:71 #backtracks:1'061 #weight_updates:503)
#22      0.36s best:1085  next:[377,1084] violation_ls(batch:5 #solutions_imported:5 #lin_moves:1 #lin_evals:17'890 #gen_moves:10'055 #gen_evals:993 #comp_moves:571 #backtracks:4'742 #weight_updates:80)
#23      0.37s best:1084  next:[377,1083] violation_ls(batch:6 #solutions_imported:6 #lin_moves:2 #lin_evals:17'898 #gen_moves:10'055 #gen_evals:993 #comp_moves:571 #backtracks:4'742 #weight_updates:80)
#Bound   0.38s best:1084  next:[379,1083] objective_lb_search_no_lp
#24      0.38s best:1083  next:[379,1082] violation_ls(batch:7 #solutions_imported:7 #lin_moves:3 #lin_evals:17'907 #gen_moves:10'055 #gen_evals:993 #comp_moves:571 #backtracks:4'742 #weight_updates:80)
#25      0.39s best:1082  next:[379,1081] violation_ls(batch:9 #solutions_imported:9 #lin_moves:5'972 #lin_evals:26'502 #gen_moves:2'258 #gen_evals:146 #comp_moves:74 #backtracks:1'092 #weight_updates:521)
#26      0.42s best:1066  next:[379,1065] rnd_cst_lns (d=0.94 s=165 t=0.10 p=1.00 stall=5 h=auto_l0)
#27      0.42s best:1065  next:[379,1064] violation_ls(batch:11 #solutions_imported:11 #lin_moves:5'999 #lin_evals:31'970 #gen_moves:5'121 #gen_evals:279 #comp_moves:191 #backtracks:2'465 #weight_updates:565)
#28      0.42s best:1064  next:[379,1063] violation_ls(batch:12 #solutions_imported:12 #lin_moves:5'999 #lin_evals:31'987 #gen_moves:5'132 #gen_evals:281 #comp_moves:192 #backtracks:2'470 #weight_updates:565)
#29      0.43s best:1063  next:[379,1062] violation_ls(batch:13 #solutions_imported:13 #lin_moves:6'044 #lin_evals:32'239 #gen_moves:5'132 #gen_evals:281 #comp_moves:192 #backtracks:2'470 #weight_updates:609)
#30      0.43s best:1062  next:[379,1061] violation_ls(batch:14 #solutions_imported:14 #lin_moves:6'045 #lin_evals:32'244 #gen_moves:5'132 #gen_evals:281 #comp_moves:192 #backtracks:2'470 #weight_updates:609)
#31      0.43s best:1021  next:[379,1020] graph_var_lns (d=0.96 s=112 t=0.10 p=1.00 stall=4 h=auto_l0)
#32      0.46s best:1015  next:[379,1014] quick_restart_no_lp (fixed_bools=0/245)
#33      0.46s best:1009  next:[379,1008] quick_restart_no_lp (fixed_bools=0/249)
#34      0.46s best:1008  next:[379,1007] violation_ls(batch:15 #solutions_imported:15 #lin_moves:6'045 #lin_evals:32'279 #gen_moves:5'156 #gen_evals:283 #comp_moves:194 #backtracks:2'481 #weight_updates:609)
#35      0.48s best:1007  next:[379,1006] violation_ls(batch:11 #solutions_imported:11 #lin_moves:5'318 #lin_evals:52'032 #gen_moves:13'600 #gen_evals:1'141 #comp_moves:774 #backtracks:6'413 #weight_updates:5'173)
#36      0.48s best:1006  next:[379,1005] violation_ls(batch:12 #solutions_imported:12 #lin_moves:5'318 #lin_evals:52'120 #gen_moves:13'648 #gen_evals:1'143 #comp_moves:776 #backtracks:6'436 #weight_updates:5'173)
#37      0.48s best:1005  next:[379,1004] violation_ls(batch:13 #solutions_imported:13 #lin_moves:5'318 #lin_evals:52'124 #gen_moves:13'649 #gen_evals:1'143 #comp_moves:777 #backtracks:6'436 #weight_updates:5'173)
#38      0.48s best:1004  next:[379,1003] violation_ls(batch:14 #solutions_imported:14 #lin_moves:5'352 #lin_evals:52'262 #gen_moves:13'649 #gen_evals:1'143 #comp_moves:777 #backtracks:6'436 #weight_updates:5'190)
#39      0.48s best:1003  next:[379,1002] violation_ls(batch:15 #solutions_imported:15 #lin_moves:5'353 #lin_evals:52'271 #gen_moves:13'649 #gen_evals:1'143 #comp_moves:777 #backtracks:6'436 #weight_updates:5'190)
#40      0.50s best:1002  next:[379,1001] violation_ls(batch:9 #solutions_imported:9 #lin_moves:9'797 #lin_evals:60'964 #gen_moves:8'759 #gen_evals:752 #comp_moves:471 #backtracks:4'144 #weight_updates:721)
#41      0.51s best:1001  next:[379,1000] violation_ls(batch:10 #solutions_imported:10 #lin_moves:10'086 #lin_evals:62'330 #gen_moves:8'759 #gen_evals:752 #comp_moves:471 #backtracks:4'144 #weight_updates:940)
#42      0.53s best:1000  next:[379,999]  violation_ls(batch:11 #solutions_imported:11 #lin_moves:10'086 #lin_evals:63'449 #gen_moves:9'307 #gen_evals:784 #comp_moves:493 #backtracks:4'407 #weight_updates:946)
#43      0.54s best:999   next:[379,998]  violation_ls(batch:12 #solutions_imported:12 #lin_moves:10'086 #lin_evals:64'972 #gen_moves:10'019 #gen_evals:869 #comp_moves:509 #backtracks:4'755 #weight_updates:954)
#44      0.55s best:998   next:[379,997]  violation_ls(batch:13 #solutions_imported:13 #lin_moves:10'124 #lin_evals:65'131 #gen_moves:10'019 #gen_evals:869 #comp_moves:509 #backtracks:4'755 #weight_updates:974)
#45      0.55s best:997   next:[379,996]  violation_ls(batch:14 #solutions_imported:14 #lin_moves:10'150 #lin_evals:65'267 #gen_moves:10'019 #gen_evals:869 #comp_moves:509 #backtracks:4'755 #weight_updates:999)
#46      0.56s best:768   next:[379,767]  rnd_cst_lns (d=0.97 s=188 t=0.10 p=1.00 stall=1 h=auto_l0)
#47      0.56s best:767   next:[379,766]  violation_ls(batch:16 #solutions_imported:16 #lin_moves:5'380 #lin_evals:52'392 #gen_moves:13'649 #gen_evals:1'143 #comp_moves:777 #backtracks:6'436 #weight_updates:5'203)
#48      0.56s best:766   next:[379,765]  violation_ls(batch:16 #solutions_imported:16 #lin_moves:6'045 #lin_evals:32'328 #gen_moves:5'185 #gen_evals:285 #comp_moves:197 #backtracks:2'494 #weight_updates:609)
#49      0.58s best:765   next:[379,764]  violation_ls(batch:16 #solutions_imported:16 #lin_moves:10'150 #lin_evals:69'875 #gen_moves:12'324 #gen_evals:1'045 #comp_moves:632 #backtracks:5'846 #weight_updates:1'026)
#50      0.60s best:764   next:[379,763]  violation_ls(batch:9 #solutions_imported:9 #lin_moves:9'607 #lin_evals:76'457 #gen_moves:18'043 #gen_evals:1'579 #comp_moves:931 #backtracks:8'556 #weight_updates:894)
#Bound   0.61s best:764   next:[396,763]  objective_lb_search_no_lp
#Bound   0.70s best:764   next:[405,763]  objective_lb_search_no_lp
#Bound   0.85s best:764   next:[424,763]  objective_lb_search
#Bound   1.13s best:764   next:[484,763]  objective_lb_search_no_lp
#Bound   1.40s best:764   next:[485,763]  objective_lb_search_no_lp
#51      1.42s best:730   next:[485,729]  rnd_var_lns (d=0.96 s=102 t=0.10 p=1.00 stall=3 h=auto_l0)
#Bound   1.58s best:730   next:[487,729]  objective_lb_search_no_lp
#52      1.78s best:725   next:[487,724]  graph_dec_lns (d=0.99 s=231 t=0.10 p=1.00 stall=0 h=auto_l0)
#53      1.80s best:724   next:[487,723]  violation_ls(batch:21 #solutions_imported:19 #lin_moves:20'821 #lin_evals:157'663 #gen_moves:22'995 #gen_evals:1'807 #comp_moves:1'337 #backtracks:10'825 #weight_updates:19'832)
#54      1.86s best:723   next:[487,722]  violation_ls(batch:18 #solutions_imported:12 #lin_moves:9'760 #lin_evals:231'647 #gen_moves:90'454 #gen_evals:7'195 #comp_moves:3'105 #backtracks:43'663 #weight_updates:1'461)
#55      1.86s best:722   next:[487,721]  violation_ls(batch:19 #solutions_imported:13 #lin_moves:9'869 #lin_evals:232'154 #gen_moves:90'454 #gen_evals:7'195 #comp_moves:3'105 #backtracks:43'663 #weight_updates:1'545)
#56      2.37s best:707   next:[487,706]  pseudo_costs (fixed_bools=0/147)
#Bound   2.43s best:707   next:[488,706]  objective_shaving_search_no_lp (vars=207 csts=1675)
#57      2.50s best:697   next:[488,696]  graph_dec_lns (d=0.99 s=284 t=0.10 p=1.00 stall=0 h=auto_l0)
#Bound   2.61s best:697   next:[489,696]  objective_lb_search_no_lp
#Bound   2.67s best:697   next:[490,696]  objective_lb_search_no_lp
#Bound   2.76s best:697   next:[498,696]  objective_lb_search_no_lp
#Bound   2.97s best:697   next:[500,696]  objective_lb_search_no_lp
#Bound   3.03s best:697   next:[501,696]  objective_lb_search_no_lp
#Bound   3.11s best:697   next:[503,696]  objective_lb_search_no_lp
#Bound   3.59s best:697   next:[506,696]  objective_lb_search_no_lp
#Bound   3.86s best:697   next:[511,696]  objective_lb_search_no_lp
#Bound   4.16s best:697   next:[512,696]  objective_lb_search_no_lp
#Bound   4.99s best:697   next:[513,696]  objective_shaving_search_no_lp (vars=210 csts=1678) [skipped_logs=0]
#Bound   5.76s best:697   next:[517,696]  objective_lb_search_no_lp [skipped_logs=1]
#Bound   6.39s best:697   next:[535,696]  objective_lb_search_no_lp [skipped_logs=1]
#Bound   7.88s best:697   next:[541,696]  objective_lb_search_no_lp [skipped_logs=2]
#Model   8.37s var:197/198 constraints:1644/1982
#Model   8.44s var:195/198 constraints:1557/1982
#Bound   8.88s best:697   next:[552,696]  objective_lb_search_no_lp [skipped_logs=3]
#Bound   9.86s best:697   next:[562,696]  objective_lb_search_no_lp [skipped_logs=2]
#Bound  10.24s best:697   next:[565,696]  objective_lb_search_no_lp [skipped_logs=1]
#Bound  12.39s best:697   next:[566,696]  objective_lb_search_no_lp
#Bound  12.73s best:697   next:[567,696]  objective_lb_search_no_lp [skipped_logs=0]
#Model  13.96s var:194/198 constraints:1538/1982
#Bound  13.83s best:697   next:[581,696]  objective_lb_search_no_lp [skipped_logs=4]
#Bound  14.85s best:697   next:[589,696]  objective_lb_search_no_lp [skipped_logs=4]
#Bound  16.09s best:697   next:[590,696]  objective_lb_search_no_lp
#Bound  16.38s best:697   next:[594,696]  objective_lb_search_no_lp [skipped_logs=1]
#Bound  17.95s best:697   next:[599,696]  objective_lb_search_no_lp [skipped_logs=1]
#Model  18.46s var:193/198 constraints:1460/1982
#Model  19.34s var:192/198 constraints:1442/1982
#Model  19.42s var:191/198 constraints:1434/1982
#Bound  20.02s best:697   next:[600,696]  objective_lb_search_no_lp
#Bound  20.08s best:697   next:[604,696]  objective_lb_search_no_lp
#Model  20.28s var:188/198 constraints:1319/1982
#Model  20.35s var:187/198 constraints:1313/1982
#Model  20.58s var:186/198 constraints:1311/1982
#Model  20.79s var:185/198 constraints:1290/1982
#Model  20.88s var:181/198 constraints:1188/1982
#Model  20.89s var:179/198 constraints:1096/1982
#Model  20.93s var:177/198 constraints:1063/1982
#Done   20.96s no_lp
#Done   20.96s objective_lb_search_no_lp
#Model  20.96s var:161/198 constraints:487/1982
#Done   20.96s core
#Bound  20.96s best:697   next:[691,696]  objective_lb_search_no_lp [skipped_logs=10]

Task timing                                  n [     min,      max]      avg      dev     time         n [     min,      max]      avg      dev    dtime
                             'core':         1 [  20.74s,   20.74s]   20.74s   0.00ns   20.74s         1 [   9.46s,    9.46s]    9.46s   0.00ns    9.46s
                       'default_lp':         1 [  20.74s,   20.74s]   20.74s   0.00ns   20.74s         1 [   2.20s,    2.20s]    2.20s   0.00ns    2.20s
                 'feasibility_pump':       112 [ 14.62ms, 356.78ms] 103.73ms  43.24ms   11.62s       111 [  8.79ms,  18.97ms]  10.07ms 868.22us    1.12s
                  'fj_long_default':         0 [  0.00ns,   0.00ns]   0.00ns   0.00ns   0.00ns         0 [  0.00ns,   0.00ns]   0.00ns   0.00ns   0.00ns
                  'fj_long_default':         0 [  0.00ns,   0.00ns]   0.00ns   0.00ns   0.00ns         0 [  0.00ns,   0.00ns]   0.00ns   0.00ns   0.00ns
              'fj_long_lin_default':         0 [  0.00ns,   0.00ns]   0.00ns   0.00ns   0.00ns         0 [  0.00ns,   0.00ns]   0.00ns   0.00ns   0.00ns
              'fj_long_lin_perturb':         0 [  0.00ns,   0.00ns]   0.00ns   0.00ns   0.00ns         0 [  0.00ns,   0.00ns]   0.00ns   0.00ns   0.00ns
               'fj_long_lin_random':         0 [  0.00ns,   0.00ns]   0.00ns   0.00ns   0.00ns         0 [  0.00ns,   0.00ns]   0.00ns   0.00ns   0.00ns
                  'fj_long_perturb':         0 [  0.00ns,   0.00ns]   0.00ns   0.00ns   0.00ns         0 [  0.00ns,   0.00ns]   0.00ns   0.00ns   0.00ns
                   'fj_long_random':         0 [  0.00ns,   0.00ns]   0.00ns   0.00ns   0.00ns         0 [  0.00ns,   0.00ns]   0.00ns   0.00ns   0.00ns
                 'fj_short_default':         0 [  0.00ns,   0.00ns]   0.00ns   0.00ns   0.00ns         0 [  0.00ns,   0.00ns]   0.00ns   0.00ns   0.00ns
                 'fj_short_default':         1 [113.03ms, 113.03ms] 113.03ms   0.00ns 113.03ms         1 [ 72.80ms,  72.80ms]  72.80ms   0.00ns  72.80ms
             'fj_short_lin_default':         0 [  0.00ns,   0.00ns]   0.00ns   0.00ns   0.00ns         0 [  0.00ns,   0.00ns]   0.00ns   0.00ns   0.00ns
             'fj_short_lin_default':         0 [  0.00ns,   0.00ns]   0.00ns   0.00ns   0.00ns         0 [  0.00ns,   0.00ns]   0.00ns   0.00ns   0.00ns
             'fj_short_lin_perturb':         0 [  0.00ns,   0.00ns]   0.00ns   0.00ns   0.00ns         0 [  0.00ns,   0.00ns]   0.00ns   0.00ns   0.00ns
              'fj_short_lin_random':         0 [  0.00ns,   0.00ns]   0.00ns   0.00ns   0.00ns         0 [  0.00ns,   0.00ns]   0.00ns   0.00ns   0.00ns
                 'fj_short_perturb':         0 [  0.00ns,   0.00ns]   0.00ns   0.00ns   0.00ns         0 [  0.00ns,   0.00ns]   0.00ns   0.00ns   0.00ns
                  'fj_short_random':         0 [  0.00ns,   0.00ns]   0.00ns   0.00ns   0.00ns         0 [  0.00ns,   0.00ns]   0.00ns   0.00ns   0.00ns
                        'fs_random':         1 [ 17.12ms,  17.12ms]  17.12ms   0.00ns  17.12ms         1 [ 20.00ns,  20.00ns]  20.00ns   0.00ns  20.00ns
                        'fs_random':         1 [ 17.99ms,  17.99ms]  17.99ms   0.00ns  17.99ms         1 [ 20.00ns,  20.00ns]  20.00ns   0.00ns  20.00ns
                        'fs_random':         1 [ 18.69ms,  18.69ms]  18.69ms   0.00ns  18.69ms         1 [ 20.00ns,  20.00ns]  20.00ns   0.00ns  20.00ns
                        'fs_random':         1 [ 19.45ms,  19.45ms]  19.45ms   0.00ns  19.45ms         1 [ 20.00ns,  20.00ns]  20.00ns   0.00ns  20.00ns
                  'fs_random_no_lp':         1 [ 14.24ms,  14.24ms]  14.24ms   0.00ns  14.24ms         0 [  0.00ns,   0.00ns]   0.00ns   0.00ns   0.00ns
                  'fs_random_no_lp':         1 [ 15.05ms,  15.05ms]  15.05ms   0.00ns  15.05ms         0 [  0.00ns,   0.00ns]   0.00ns   0.00ns   0.00ns
                  'fs_random_no_lp':         1 [ 15.73ms,  15.73ms]  15.73ms   0.00ns  15.73ms         0 [  0.00ns,   0.00ns]   0.00ns   0.00ns   0.00ns
                  'fs_random_no_lp':         1 [ 16.45ms,  16.45ms]  16.45ms   0.00ns  16.45ms         0 [  0.00ns,   0.00ns]   0.00ns   0.00ns   0.00ns
          'fs_random_quick_restart':         1 [ 16.99ms,  16.99ms]  16.99ms   0.00ns  16.99ms         1 [ 20.00ns,  20.00ns]  20.00ns   0.00ns  20.00ns
          'fs_random_quick_restart':         1 [ 17.82ms,  17.82ms]  17.82ms   0.00ns  17.82ms         1 [ 20.00ns,  20.00ns]  20.00ns   0.00ns  20.00ns
          'fs_random_quick_restart':         1 [ 18.50ms,  18.50ms]  18.50ms   0.00ns  18.50ms         1 [ 20.00ns,  20.00ns]  20.00ns   0.00ns  20.00ns
          'fs_random_quick_restart':         1 [ 19.35ms,  19.35ms]  19.35ms   0.00ns  19.35ms         1 [ 20.00ns,  20.00ns]  20.00ns   0.00ns  20.00ns
    'fs_random_quick_restart_no_lp':         1 [ 14.78ms,  14.78ms]  14.78ms   0.00ns  14.78ms         0 [  0.00ns,   0.00ns]   0.00ns   0.00ns   0.00ns
    'fs_random_quick_restart_no_lp':         1 [ 15.62ms,  15.62ms]  15.62ms   0.00ns  15.62ms         0 [  0.00ns,   0.00ns]   0.00ns   0.00ns   0.00ns
    'fs_random_quick_restart_no_lp':         1 [ 16.46ms,  16.46ms]  16.46ms   0.00ns  16.46ms         0 [  0.00ns,   0.00ns]   0.00ns   0.00ns   0.00ns
                    'graph_arc_lns':       111 [  2.91ms,    1.98s] 767.49ms 559.06ms    1.42m       108 [ 10.00ns, 102.22ms]  58.17ms  42.14ms    6.28s
                    'graph_cst_lns':       111 [  1.42ms,    1.93s] 391.56ms 571.74ms   43.46s        57 [ 10.00ns, 101.28ms]  54.24ms  43.42ms    3.09s
                    'graph_dec_lns':       111 [  4.92ms,    2.10s] 818.55ms 567.35ms    1.51m       108 [ 10.00ns, 187.58ms]  58.95ms  43.87ms    6.37s
                    'graph_var_lns':       111 [  5.12ms,    2.10s] 793.46ms 550.40ms    1.47m       110 [ 10.00ns, 106.81ms]  58.70ms  42.06ms    6.46s
                   'lb_tree_search':         1 [  20.74s,   20.74s]   20.74s   0.00ns   20.74s         1 [   4.56s,    4.56s]    4.56s   0.00ns    4.56s
                           'max_lp':         1 [  20.74s,   20.74s]   20.74s   0.00ns   20.74s         1 [   3.06s,    3.06s]    3.06s   0.00ns    3.06s
                            'no_lp':         1 [  20.73s,   20.73s]   20.73s   0.00ns   20.73s         1 [   2.06s,    2.06s]    2.06s   0.00ns    2.06s
              'objective_lb_search':         1 [  20.73s,   20.73s]   20.73s   0.00ns   20.73s         1 [   2.50s,    2.50s]    2.50s   0.00ns    2.50s
       'objective_lb_search_max_lp':         1 [  20.73s,   20.73s]   20.73s   0.00ns   20.73s         1 [   3.91s,    3.91s]    3.91s   0.00ns    3.91s
        'objective_lb_search_no_lp':         1 [  20.73s,   20.73s]   20.73s   0.00ns   20.73s         1 [   1.94s,    1.94s]    1.94s   0.00ns    1.94s
  'objective_shaving_search_max_lp':        62 [  2.40ms,    2.17s] 331.19ms 432.87ms   20.53s        48 [ 19.77us, 310.13ms]  30.03ms  64.89ms    1.44s
   'objective_shaving_search_no_lp':        62 [ 10.44ms,    2.17s] 330.94ms 430.22ms   20.52s        47 [639.94us, 144.11ms]  23.59ms  38.26ms    1.11s
                          'probing':         1 [  20.74s,   20.74s]   20.74s   0.00ns   20.74s         1 [   1.20s,    1.20s]    1.20s   0.00ns    1.20s
                   'probing_max_lp':         1 [  20.74s,   20.74s]   20.74s   0.00ns   20.74s         1 [752.65ms, 752.65ms] 752.65ms   0.00ns 752.65ms
                     'pseudo_costs':         1 [  20.74s,   20.74s]   20.74s   0.00ns   20.74s         1 [   3.10s,    3.10s]    3.10s   0.00ns    3.10s
                    'quick_restart':         1 [  20.73s,   20.73s]   20.73s   0.00ns   20.73s         1 [   2.87s,    2.87s]    2.87s   0.00ns    2.87s
              'quick_restart_no_lp':         1 [  20.74s,   20.74s]   20.74s   0.00ns   20.74s         1 [   2.11s,    2.11s]    2.11s   0.00ns    2.11s
                    'reduced_costs':         1 [  20.74s,   20.74s]   20.74s   0.00ns   20.74s         1 [   2.62s,    2.62s]    2.62s   0.00ns    2.62s
                        'rins/rens':       112 [140.21us,    2.00s] 695.76ms 509.79ms    1.30m        94 [ 10.00ns, 149.72ms]  71.05ms  36.15ms    6.68s
                      'rnd_cst_lns':       112 [  1.66ms,    2.10s] 767.50ms 559.93ms    1.43m       102 [ 10.00ns, 200.21ms]  61.55ms  44.08ms    6.28s
                      'rnd_var_lns':       112 [  3.29ms,    1.98s] 779.09ms 600.58ms    1.45m       107 [ 10.00ns, 200.24ms]  55.67ms  47.73ms    5.96s
                     'violation_ls':       107 [370.63us, 371.69ms] 171.53ms  92.45ms   18.35s       107 [950.00ns,  90.01ms]  64.36ms  28.32ms    6.89s
                     'violation_ls':       108 [234.27us, 287.90ms] 167.02ms  88.00ms   18.04s       108 [370.00ns,  85.74ms]  63.34ms  27.63ms    6.84s
                     'violation_ls':       111 [  1.30ms, 297.36ms] 143.54ms  61.09ms   15.93s       111 [149.23us,  80.36ms]  66.73ms  18.27ms    7.41s
                     'violation_ls':       111 [ 75.22ms, 312.29ms] 167.20ms  51.66ms   18.56s       111 [ 28.48ms,  79.85ms]  71.32ms   6.21ms    7.92s
                     'violation_ls':       112 [414.18us, 351.97ms] 144.23ms  75.50ms   16.15s       112 [610.00ns, 157.98ms]  83.82ms  40.80ms    9.39s

Search stats                        Bools  Conflicts  Branches  Restarts  BoolPropag  IntegerPropag
                           'core':  3'393      8'783    13'992     1'480  10'065'738      3'858'413
                     'default_lp':    112      6'852    30'795     5'704     200'440      4'029'301
                      'fs_random':     69          0       138       138          30          1'603
                      'fs_random':     69          0        54        54          30            426
                      'fs_random':     69          0        62        62          30            569
                      'fs_random':     69          0        94        94          30            999
                'fs_random_no_lp':     69          0       100       100          30          1'088
                'fs_random_no_lp':     69          0       146       138          30          1'713
                'fs_random_no_lp':     69          0        38        38          30            186
                'fs_random_no_lp':     69          0        68        68          30            652
        'fs_random_quick_restart':     69          0       138       138          30          1'603
        'fs_random_quick_restart':     69          0        94        94          30            999
        'fs_random_quick_restart':     69          0        94        94          30            999
        'fs_random_quick_restart':     69          0        98        98          30          1'043
  'fs_random_quick_restart_no_lp':     69          0       100       100          30          1'088
  'fs_random_quick_restart_no_lp':     69          0       106       106          30          1'195
  'fs_random_quick_restart_no_lp':     69          0       106       106          30          1'195
                 'lb_tree_search':     69        163    33'875     6'046      44'997      1'275'580
                         'max_lp':     69      4'762    23'386     5'662     110'981      2'683'259
                          'no_lp':    593     14'511    42'398     5'255   2'321'156      7'467'654
            'objective_lb_search':    120      6'460    33'310     6'806     177'679      4'264'092
     'objective_lb_search_max_lp':    107      4'190    33'406     9'181     140'230      3'373'835
      'objective_lb_search_no_lp':    201     17'155    43'493     5'352     411'627      8'051'659
                        'probing':    311        140       482       482       3'277         19'602
                 'probing_max_lp':    271        103       439       439       2'476         15'850
                   'pseudo_costs':    289      4'183    38'373     8'555     486'036      3'723'288
                  'quick_restart':    348      2'969    37'916     7'521     411'216      3'175'718
            'quick_restart_no_lp':  1'109     14'494    63'860     5'527   2'233'295      6'813'840
                  'reduced_costs':    654      4'214    40'403     5'843   1'519'203      3'342'651

SAT stats                           ClassicMinim  LitRemoved  LitLearned  LitForgotten  Subsumed  MClauses  MDecisions  MLitTrue  MSubsumed  MLitRemoved  MReused
                           'core':         7'723      41'252      58'339             0        37       341       1'717         0          1            4        3
                     'default_lp':         4'411      13'092      60'007             0       383     2'513      20'291        19        770        4'863      384
                      'fs_random':             0           0           0             0         0         0           0         0          0            0        0
                      'fs_random':             0           0           0             0         0         0           0         0          0            0        0
                      'fs_random':             0           0           0             0         0         0           0         0          0            0        0
                      'fs_random':             0           0           0             0         0         0           0         0          0            0        0
                'fs_random_no_lp':             0           0           0             0         0         0           0         0          0            0        0
                'fs_random_no_lp':             0           0           0             0         0         0           0         0          0            0        0
                'fs_random_no_lp':             0           0           0             0         0         0           0         0          0            0        0
                'fs_random_no_lp':             0           0           0             0         0         0           0         0          0            0        0
        'fs_random_quick_restart':             0           0           0             0         0         0           0         0          0            0        0
        'fs_random_quick_restart':             0           0           0             0         0         0           0         0          0            0        0
        'fs_random_quick_restart':             0           0           0             0         0         0           0         0          0            0        0
        'fs_random_quick_restart':             0           0           0             0         0         0           0         0          0            0        0
  'fs_random_quick_restart_no_lp':             0           0           0             0         0         0           0         0          0            0        0
  'fs_random_quick_restart_no_lp':             0           0           0             0         0         0           0         0          0            0        0
  'fs_random_quick_restart_no_lp':             0           0           0             0         0         0           0         0          0            0        0
                 'lb_tree_search':            11          11         703             0         1     2'161      11'071         0         34          139       56
                         'max_lp':         3'466      10'596      50'003             0       208     2'010      14'326         0        531        3'323      192
                          'no_lp':        10'650      38'328     137'715        19'521       317     2'503      19'736         0      1'098        7'255      407
            'objective_lb_search':         4'340      10'569      53'063             0       373     2'666      21'737         0        631        3'770      563
     'objective_lb_search_max_lp':         2'986       7'412      34'593             0       241     2'962      21'544         0        435        2'533      609
      'objective_lb_search_no_lp':        13'465      42'098     131'078        21'714       531     2'700      21'314         0      1'204        7'487      547
                        'probing':             0           0         140             0         0         0           0         0          0            0        0
                 'probing_max_lp':             0           0         103             0         0         0           0         0          0            0        0
                   'pseudo_costs':         2'443       5'856      41'429             0       227     3'069      24'538         0        550        3'497      534
                  'quick_restart':         1'910       5'409      30'401             0       149     2'754      23'636        24        514        3'178      576
            'quick_restart_no_lp':        10'257      33'788     161'227        61'921       341     1'753      15'635         4        583        3'637      157
                  'reduced_costs':         2'764       7'457      44'143             0       172     2'539      20'875         1        705        4'353      530

Lp stats                         Component  Iterations  AddedCuts  OPTIMAL  DUAL_F.  DUAL_U.
                  'default_lp':          1      46'730      4'805    8'880        0        0
                   'fs_random':          1           0          0        0        0        0
                   'fs_random':          1           0          0        0        0        0
                   'fs_random':          1           0          0        0        0        0
                   'fs_random':          1           0          0        0        0        0
     'fs_random_quick_restart':          1           0          0        0        0        0
     'fs_random_quick_restart':          1           0          0        0        0        0
     'fs_random_quick_restart':          1           0          0        0        0        0
     'fs_random_quick_restart':          1           0          0        0        0        0
              'lb_tree_search':          1     166'519      3'866   11'755    4'047        0
                      'max_lp':          1      88'879      4'669    6'560    1'938        2
         'objective_lb_search':          1      57'486      4'993    8'247        0        1
  'objective_lb_search_max_lp':          1     107'824      4'238    6'129    1'865        6
                     'probing':          1      10'775      5'054    1'799        0        1
              'probing_max_lp':          1       3'773      2'853    1'282       38        1
                'pseudo_costs':          1      85'534      4'456    5'762    1'758        2
               'quick_restart':          1      61'742      5'372    7'453        0        0
               'reduced_costs':          1      57'196      5'579    5'757      997        0

Lp dimension                                                                     Final dimension of first component
                  'default_lp':  373 rows, 193 columns, 1718 entries with magnitude in [2.945887e-04, 1.000000e+00]
                   'fs_random':       0 rows, 193 columns, 0 entries with magnitude in [0.000000e+00, 0.000000e+00]
                   'fs_random':       0 rows, 193 columns, 0 entries with magnitude in [0.000000e+00, 0.000000e+00]
                   'fs_random':       0 rows, 193 columns, 0 entries with magnitude in [0.000000e+00, 0.000000e+00]
                   'fs_random':       0 rows, 193 columns, 0 entries with magnitude in [0.000000e+00, 0.000000e+00]
     'fs_random_quick_restart':       0 rows, 193 columns, 0 entries with magnitude in [0.000000e+00, 0.000000e+00]
     'fs_random_quick_restart':       0 rows, 193 columns, 0 entries with magnitude in [0.000000e+00, 0.000000e+00]
     'fs_random_quick_restart':       0 rows, 193 columns, 0 entries with magnitude in [0.000000e+00, 0.000000e+00]
     'fs_random_quick_restart':       0 rows, 193 columns, 0 entries with magnitude in [0.000000e+00, 0.000000e+00]
              'lb_tree_search':  342 rows, 198 columns, 1268 entries with magnitude in [1.026587e-03, 1.000000e+00]
                      'max_lp':  398 rows, 198 columns, 1397 entries with magnitude in [1.308000e-02, 1.000000e+00]
         'objective_lb_search':  402 rows, 193 columns, 1587 entries with magnitude in [4.076427e-04, 1.000000e+00]
  'objective_lb_search_max_lp':  457 rows, 198 columns, 1594 entries with magnitude in [8.823472e-03, 1.000000e+00]
                     'probing':  589 rows, 193 columns, 5029 entries with magnitude in [1.280251e-04, 1.000000e+00]
              'probing_max_lp':  305 rows, 198 columns, 2147 entries with magnitude in [2.450783e-03, 1.000000e+00]
                'pseudo_costs':  997 rows, 198 columns, 3696 entries with magnitude in [1.800256e-03, 1.000000e+00]
               'quick_restart':  637 rows, 193 columns, 2293 entries with magnitude in [4.229980e-04, 1.000000e+00]
               'reduced_costs':  782 rows, 198 columns, 2488 entries with magnitude in [1.444354e-03, 1.000000e+00]

Lp debug                         CutPropag  CutEqPropag  Adjust  Overflow      Bad  BadScaling
                  'default_lp':         15            8   4'606         0   39'937           0
                   'fs_random':          0            0       0         0        0           0
                   'fs_random':          0            0       0         0        0           0
                   'fs_random':          0            0       0         0        0           0
                   'fs_random':          0            0       0         0        0           0
     'fs_random_quick_restart':          0            0       0         0        0           0
     'fs_random_quick_restart':          0            0       0         0        0           0
     'fs_random_quick_restart':          0            0       0         0        0           0
     'fs_random_quick_restart':          0            0       0         0        0           0
              'lb_tree_search':         15            7   7'665         0   25'191           0
                      'max_lp':         19            2   3'372         0   29'658           0
         'objective_lb_search':         18           43   4'961         0   42'760           0
  'objective_lb_search_max_lp':         43           10   4'033         0   54'843           0
                     'probing':         12          119   1'614         0  590'096           0
              'probing_max_lp':         14           27   1'230         0  605'561           0
                'pseudo_costs':         34           21   3'598         0   49'983           0
               'quick_restart':         26           22   5'458         0   84'257           0
               'reduced_costs':         26           12   3'437         0   49'215           0

Lp pool                          Constraints  Updates  Simplif  Merged  Shortened   Split  Strenghtened     Cuts/Call
                  'default_lp':        5'038      897   32'530      49      6'502   3'917         8'156  4'805/10'604
                   'fs_random':          282        0        0       0          0       0             0           0/0
                   'fs_random':          282        0        0       0          0       0             0           0/0
                   'fs_random':          282        0        0       0          0       0             0           0/0
                   'fs_random':          282        0        0       0          0       0             0           0/0
     'fs_random_quick_restart':          282        0        0       0          0       0             0           0/0
     'fs_random_quick_restart':          282        0        0       0          0       0             0           0/0
     'fs_random_quick_restart':          282        0        0       0          0       0             0           0/0
     'fs_random_quick_restart':          282        0        0       0          0       0             0           0/0
              'lb_tree_search':        5'796      431   28'116      51      1'646     719        16'802  3'866/10'470
                      'max_lp':        6'586      586   40'418      64      4'551     755        23'990  4'669/10'830
         'objective_lb_search':        5'254      925   43'292      21      7'137   3'656        13'498  4'993/11'446
  'objective_lb_search_max_lp':        6'172      783   70'473      47      5'842   1'800        31'786  4'238/10'352
                     'probing':        5'301      958   17'515      35      3'073   6'614         5'227   5'054/9'696
              'probing_max_lp':        4'813      613   24'841      21      1'458   2'896        14'987   2'853/5'644
                'pseudo_costs':        6'392      922   83'673      45      6'049   2'010        32'051  4'456/10'288
               'quick_restart':        5'641    1'410   82'923      13      8'202  12'436        14'253  5'372/10'961
               'reduced_costs':        7'500      726   68'010      60      5'733   1'423        33'774  5'579/12'727

Lp Cut            defaul  max_lp  quick_  reduce  pseudo  lb_tre  probin  object  probin  object
          CG_FF:     257     246     268     327     226     199     212     319     132     218
           CG_K:     153     130     201     200     124     134     124     207      71     102
           CG_R:     259     168     398     209     122     163     419     425     123     112
          CG_RB:   1'160     842   1'232     788     586     654   1'468   1'562     470     667
         CG_RBP:     178     143     188      88      79      78     174     153      44      62
         Clique:       -      43       -      62      74      43       -       -      14      64
             IB:     521     290     448     394     370     328     332     376     198     372
       MIR_1_FF:     180     291     216     343     316     243     208     171     181     258
        MIR_1_K:      27      45      36      58      57      27      17      19      24      50
       MIR_1_KL:       1       1       -       2       -       -       -       -       -       -
        MIR_1_R:      53      43      72      44      48      37      56      52      30      29
       MIR_1_RB:     308     440     259     508     404     323     225     226     219     338
      MIR_1_RBP:      18      65      13      88      65      59       8       9      39      45
      MIR_1_RLT:       -       7       -       4       6       5       -       -       7       5
       MIR_2_FF:     132     190     152     180     180     142     109     115      90     151
        MIR_2_K:      24      44      34      52      32      36      21      29      18      27
       MIR_2_KL:       -       -       -       -       -       1       -       -       -       1
        MIR_2_R:      49      66      66      90      82      64      92      52      49      78
       MIR_2_RB:     236     248     274     293     214     181     223     207     118     196
      MIR_2_RBP:      15      27      20      44      33      35      10       5      27      23
       MIR_3_FF:      91      94     101     177     115      99      74      84      50      99
        MIR_3_K:      26      29      16      46      27      23      12      23      15      21
       MIR_3_KL:       -       -       -       1       -       -       -       -       -       -
        MIR_3_R:      47      40      71      85      76      40      65      54      25      55
       MIR_3_RB:     196     154     216     199     139     116     155     135      64     133
      MIR_3_RBP:      18      21      20      30      19      15       9      10      10      12
       MIR_4_FF:      51      58      77      64      73      35      57      66      34      57
        MIR_4_K:      20      28      21      34      17      14      18      25       6      22
       MIR_4_KL:       1       -       -       1       1       -       -       -       -       -
        MIR_4_R:      36      36      61      42      44      25      68      41      21      54
       MIR_4_RB:     124      90     162     119      92      55     100     102      42      80
      MIR_4_RBP:       9      10      14      19      10       5       8       4       5       8
       MIR_5_FF:      27      19      48      27      31      18      29      36       6      22
        MIR_5_K:      10      10       7       9      10      13       8      11       4       7
       MIR_5_KL:       1       -       -       -       -       -       -       -       -       1
        MIR_5_R:      19      21      54      24      20      18      35      22      14      23
       MIR_5_RB:      45      36      92      58      47      33      54      48      13      31
      MIR_5_RBP:       5       6       6       9       7      13       6       6       8       6
       MIR_6_FF:      14      13      24      12      11      12      22      10       3       9
        MIR_6_K:       7       5       3       2       3       6       5       4       4       4
       MIR_6_KL:       1       -       -       -       -       -       -       -       -       -
        MIR_6_R:      10       6      32      13       9      10      20       7       6       5
       MIR_6_RB:      15      18      33      22      12      15      23      11       7      14
      MIR_6_RBP:       5       3       5       2       7       4       2       4       3       7
   ZERO_HALF_FF:      61      69      41      71      59      72      26      53      36      48
    ZERO_HALF_K:      11      16      16      22      16      13       8      16       7      13
    ZERO_HALF_R:     244     386     272     534     426     297     444     193     357     529
   ZERO_HALF_RB:     127     147      88     148     143     130      93      89     233     156
  ZERO_HALF_RBP:      13      25      15      35      24      33      15      12      26      24

LNS stats           Improv/Calls  Closed  Difficulty  TimeLimit
  'graph_arc_lns':        15/111     55%        0.98       0.10
  'graph_cst_lns':          4/61     56%        0.98       0.10
  'graph_dec_lns':        15/111     52%        0.98       0.10
  'graph_var_lns':        12/111     54%        0.99       0.10
      'rins/rens':        16/100     49%        0.84       0.10
    'rnd_cst_lns':         9/106     53%        0.98       0.10
    'rnd_var_lns':        16/111     51%        0.97       0.10

LS stats                   Batches  Restarts  LinMoves  GenMoves  CompoundMoves  WeightUpdates
       'fj_long_default':        0         0         0         0              0              0
       'fj_long_default':        0         0         0         0              0              0
   'fj_long_lin_default':        0         0         0         0              0              0
   'fj_long_lin_perturb':        0         0         0         0              0              0
    'fj_long_lin_random':        0         0         0         0              0              0
       'fj_long_perturb':        0         0         0         0              0              0
        'fj_long_random':        0         0         0         0              0              0
      'fj_short_default':        0         0         0         0              0              0
      'fj_short_default':        1         1         0     4'689            667              9
  'fj_short_lin_default':        0         0         0         0              0              0
  'fj_short_lin_default':        0         0         0         0              0              0
  'fj_short_lin_perturb':        0         0         0         0              0              0
   'fj_short_lin_random':        0         0         0         0              0              0
      'fj_short_perturb':        0         0         0         0              0              0
       'fj_short_random':        0         0         0         0              0              0
          'violation_ls':      107         0   853'487    15'023            472         53'215
          'violation_ls':      108         0   840'942    31'663          2'024         52'851
          'violation_ls':      111         0   115'351   525'652         44'560          5'340
          'violation_ls':      111         0     9'869   575'680         42'751          2'206
          'violation_ls':      112         0   701'745    49'947          1'708        223'802

Solutions (57)            Num     Rank
        'graph_dec_lns':    2  [52,57]
        'graph_var_lns':    1  [31,31]
                'no_lp':    8   [1,10]
         'pseudo_costs':    1  [56,56]
  'quick_restart_no_lp':    7   [2,33]
          'rnd_cst_lns':    2  [26,46]
          'rnd_var_lns':    2   [5,51]
         'violation_ls':   34  [13,55]

Objective bounds                     Num
                       'bool_core':    1
                  'initial_domain':    1
             'objective_lb_search':    1
       'objective_lb_search_no_lp':   67
  'objective_shaving_search_no_lp':    2

Solution repositories    Added  Queried  Ignored  Synchro
  'feasible solutions':    682    2'194        9      628
        'lp solutions':    220       51        0      202
                'pump':  2'323       58

Improving bounds shared            Num
                        'core':     40
                  'default_lp':     84
              'lb_tree_search':     41
                      'max_lp':     67
                       'no_lp':    496
         'objective_lb_search':     23
  'objective_lb_search_max_lp':     53
   'objective_lb_search_no_lp':      3
                     'probing':    141
              'probing_max_lp':     36
                'pseudo_costs':    141
               'quick_restart':     96
         'quick_restart_no_lp':  1'001
               'reduced_costs':     75

Clauses shared                   Num
                  'default_lp':   31
              'lb_tree_search':   12
                      'max_lp':   21
                       'no_lp':   61
         'objective_lb_search':   56
  'objective_lb_search_max_lp':   17
   'objective_lb_search_no_lp':    4
                'pseudo_costs':   14
               'quick_restart':    4
         'quick_restart_no_lp':   50
               'reduced_costs':   10

CpSolverResponse summary:
status: OPTIMAL
objective: 697
best_bound: 697
integers: 194
booleans: 69
conflicts: 0
branches: 146
propagations: 30
integer_propagations: 1713
restarts: 138
lp_iterations: 0
walltime: 21.0142
usertime: 21.0142
deterministic_time: 125.625
gap_integral: 418.71
solution_fingerprint: 0x43d41772dc08ef05


--- Simulation Gantt  partir du modle mathmatique ---
{'big':1, 'due_date':111, 'pos_time':5, 'status':0, 'blocked':0, 'operations':["{'type':1, 'processing_time':36}", "{'type':0, 'processing_time':55}"]}
{'big':1, 'due_date':74, 'pos_time':5, 'status':0, 'blocked':0, 'operations':["{'type':1, 'processing_time':24}"]}
{'big':0, 'due_date':51, 'pos_time':5, 'status':0, 'blocked':0, 'operations':["{'type':1, 'processing_time':33}"]}
{'big':0, 'due_date':109, 'pos_time':5, 'status':0, 'blocked':0, 'operations':["{'type':0, 'processing_time':60}"]}
{'big':0, 'due_date':191, 'pos_time':5, 'status':0, 'blocked':0, 'operations':["{'type':0, 'processing_time':21}", "{'type':1, 'processing_time':20}"]}
{'big':0, 'due_date':108, 'pos_time':5, 'status':0, 'blocked':0, 'operations':["{'type':1, 'processing_time':53}"]}
{'big':0, 'due_date':89, 'pos_time':5, 'status':0, 'blocked':0, 'operations':["{'type':1, 'processing_time':20}"]}
{'big':0, 'due_date':55, 'pos_time':5, 'status':0, 'blocked':0, 'operations':["{'type':0, 'processing_time':32}"]}
