created virtual environment CPython3.12.4.final.0-64 in 6434ms
  creator CPython3Posix(dest=/localscratch/aneumann.63447127.0/env, clear=False, no_vcs_ignore=False, global=False)
  seeder FromAppData(download=False, pip=bundle, via=copy, app_data_dir=/home/aneumann/.local/share/virtualenv)
    added seed packages: pip==25.1.1
  activators BashActivator,CShellActivator,FishActivator,NushellActivator,PowerShellActivator,PythonActivator
Looking in links: /cvmfs/soft.computecanada.ca/custom/python/wheelhouse/gentoo2023/x86-64-v3, /cvmfs/soft.computecanada.ca/custom/python/wheelhouse/gentoo2023/generic, /cvmfs/soft.computecanada.ca/custom/python/wheelhouse/generic
Requirement already satisfied: pip in /localscratch/aneumann.63447127.0/env/lib/python3.12/site-packages (25.1.1)
Looking in links: /cvmfs/soft.computecanada.ca/custom/python/wheelhouse/gentoo2023/x86-64-v3, /cvmfs/soft.computecanada.ca/custom/python/wheelhouse/gentoo2023/generic, /cvmfs/soft.computecanada.ca/custom/python/wheelhouse/generic
ERROR: protobuf-5.28.3-cp38-abi3-manylinux2014_x86_64.whl is not a supported wheel on this platform.
Looking in links: /cvmfs/soft.computecanada.ca/custom/python/wheelhouse/gentoo2023/x86-64-v3, /cvmfs/soft.computecanada.ca/custom/python/wheelhouse/gentoo2023/generic, /cvmfs/soft.computecanada.ca/custom/python/wheelhouse/generic
Processing /home/aneumann/projects/def-adhaj/aneumann/GNRS/wheels/immutabledict-4.2.0-py3-none-any.whl
Installing collected packages: immutabledict
Successfully installed immutabledict-4.2.0
Looking in links: /cvmfs/soft.computecanada.ca/custom/python/wheelhouse/gentoo2023/x86-64-v3, /cvmfs/soft.computecanada.ca/custom/python/wheelhouse/gentoo2023/generic, /cvmfs/soft.computecanada.ca/custom/python/wheelhouse/generic
Processing /cvmfs/soft.computecanada.ca/custom/python/wheelhouse/generic/ortools-9.10.4067+computecanada-cp312-cp312-linux_x86_64.whl (from -r /home/aneumann/projects/def-adhaj/aneumann/GNRS/requirements/or.txt (line 1))
Processing /cvmfs/soft.computecanada.ca/custom/python/wheelhouse/gentoo2023/x86-64-v3/matplotlib-3.10.0+computecanada-cp312-cp312-linux_x86_64.whl (from -r /home/aneumann/projects/def-adhaj/aneumann/GNRS/requirements/or.txt (line 2))
Processing /cvmfs/soft.computecanada.ca/custom/python/wheelhouse/gentoo2023/x86-64-v3/pandas-2.2.3+computecanada-cp312-cp312-linux_x86_64.whl (from -r /home/aneumann/projects/def-adhaj/aneumann/GNRS/requirements/or.txt (line 3))
Processing /cvmfs/soft.computecanada.ca/custom/python/wheelhouse/generic/absl_py-2.2.2+computecanada-py3-none-any.whl (from ortools<9.11,>=9.10->-r /home/aneumann/projects/def-adhaj/aneumann/GNRS/requirements/or.txt (line 1))
Processing /cvmfs/soft.computecanada.ca/custom/python/wheelhouse/gentoo2023/generic/numpy-2.2.2+computecanada-cp312-cp312-linux_x86_64.whl (from ortools<9.11,>=9.10->-r /home/aneumann/projects/def-adhaj/aneumann/GNRS/requirements/or.txt (line 1))
Processing /cvmfs/soft.computecanada.ca/custom/python/wheelhouse/gentoo2023/x86-64-v3/protobuf-6.30.2+computecanada-cp312-cp312-linux_x86_64.whl (from ortools<9.11,>=9.10->-r /home/aneumann/projects/def-adhaj/aneumann/GNRS/requirements/or.txt (line 1))
Requirement already satisfied: immutabledict>=3.0.0 in /localscratch/aneumann.63447127.0/env/lib/python3.12/site-packages (from ortools<9.11,>=9.10->-r /home/aneumann/projects/def-adhaj/aneumann/GNRS/requirements/or.txt (line 1)) (4.2.0)
Processing /cvmfs/soft.computecanada.ca/custom/python/wheelhouse/gentoo2023/generic/contourpy-1.3.1+computecanada-cp312-cp312-linux_x86_64.whl (from matplotlib->-r /home/aneumann/projects/def-adhaj/aneumann/GNRS/requirements/or.txt (line 2))
Processing /cvmfs/soft.computecanada.ca/custom/python/wheelhouse/generic/cycler-0.12.1+computecanada-py3-none-any.whl (from matplotlib->-r /home/aneumann/projects/def-adhaj/aneumann/GNRS/requirements/or.txt (line 2))
Processing /cvmfs/soft.computecanada.ca/custom/python/wheelhouse/generic/fonttools-4.58.2+computecanada-cp312-cp312-linux_x86_64.whl (from matplotlib->-r /home/aneumann/projects/def-adhaj/aneumann/GNRS/requirements/or.txt (line 2))
Processing /cvmfs/soft.computecanada.ca/custom/python/wheelhouse/gentoo2023/x86-64-v3/kiwisolver-1.4.8+computecanada-cp312-cp312-linux_x86_64.whl (from matplotlib->-r /home/aneumann/projects/def-adhaj/aneumann/GNRS/requirements/or.txt (line 2))
Processing /cvmfs/soft.computecanada.ca/custom/python/wheelhouse/generic/packaging-25.0+computecanada-py3-none-any.whl (from matplotlib->-r /home/aneumann/projects/def-adhaj/aneumann/GNRS/requirements/or.txt (line 2))
Processing /cvmfs/soft.computecanada.ca/custom/python/wheelhouse/gentoo2023/x86-64-v3/pillow-11.1.0+computecanada-cp312-cp312-linux_x86_64.whl (from matplotlib->-r /home/aneumann/projects/def-adhaj/aneumann/GNRS/requirements/or.txt (line 2))
Processing /cvmfs/soft.computecanada.ca/custom/python/wheelhouse/generic/pyparsing-3.2.1+computecanada-py3-none-any.whl (from matplotlib->-r /home/aneumann/projects/def-adhaj/aneumann/GNRS/requirements/or.txt (line 2))
Processing /cvmfs/soft.computecanada.ca/custom/python/wheelhouse/generic/python_dateutil-2.9.0.post0+computecanada-py2.py3-none-any.whl (from matplotlib->-r /home/aneumann/projects/def-adhaj/aneumann/GNRS/requirements/or.txt (line 2))
Processing /cvmfs/soft.computecanada.ca/custom/python/wheelhouse/generic/pytz-2025.2+computecanada-py2.py3-none-any.whl (from pandas->-r /home/aneumann/projects/def-adhaj/aneumann/GNRS/requirements/or.txt (line 3))
Processing /cvmfs/soft.computecanada.ca/custom/python/wheelhouse/generic/tzdata-2025.2+computecanada-py2.py3-none-any.whl (from pandas->-r /home/aneumann/projects/def-adhaj/aneumann/GNRS/requirements/or.txt (line 3))
Processing /cvmfs/soft.computecanada.ca/custom/python/wheelhouse/generic/six-1.17.0+computecanada-py2.py3-none-any.whl (from python-dateutil>=2.7->matplotlib->-r /home/aneumann/projects/def-adhaj/aneumann/GNRS/requirements/or.txt (line 2))
Installing collected packages: pytz, tzdata, six, pyparsing, protobuf, pillow, packaging, numpy, kiwisolver, fonttools, cycler, absl-py, python-dateutil, contourpy, pandas, matplotlib, ortools

Successfully installed absl-py-2.2.2+computecanada contourpy-1.3.1+computecanada cycler-0.12.1+computecanada fonttools-4.58.2+computecanada kiwisolver-1.4.8+computecanada matplotlib-3.10.0+computecanada numpy-2.2.2+computecanada ortools-9.10.4067+computecanada packaging-25.0+computecanada pandas-2.2.3+computecanada pillow-11.1.0+computecanada protobuf-6.30.2+computecanada pyparsing-3.2.1+computecanada python-dateutil-2.9.0.post0+computecanada pytz-2025.2+computecanada six-1.17.0+computecanada tzdata-2025.2+computecanada

Starting CP-SAT solver v9.10.4067
Parameters: max_time_in_seconds: 3600 max_memory_in_mb: 12000 log_search_progress: true enumerate_all_solutions: false absolute_gap_limit: 0 relative_gap_limit: 0
Setting number of workers to 32

Initial optimization model '': (model_fingerprint: 0x4ae330e0e8dd30c9)
#Variables: 1'006 (#ints: 16 in objective)
  - 815 Booleans in [0,1]
  - 191 in [0,1225]
#kLinear1: 90
#kLinear2: 2'505
#kLinear3: 695
#kLinearN: 26'995 (#terms: 724'404)

Starting presolve at 0.02s
  3.75e-02s  0.00e+00d  [DetectDominanceRelations] 
  7.24e-01s  0.00e+00d  [PresolveToFixPoint] #num_loops=6 #num_dual_strengthening=3 
  2.19e-04s  0.00e+00d  [ExtractEncodingFromLinear] #potential_supersets=4 
[Symmetry] Graph for symmetry has 29'565 nodes and 621'847 arcs.
[Symmetry] Symmetry computation done. time: 0.0350809 dtime: 0.0502614
[Symmetry] #generators: 1, average support size: 38
[Symmetry] The model contains 1609 duplicate constraints !
[Symmetry] 19 orbits with sizes: 2,2,2,2,2,2,2,2,2,2,...
[Symmetry] Num fixable by intersecting at_most_one with orbits: 1 largest_orbit: 2
  3.52e-01s  5.70e-02d  [Probe] #probed=1'346 #fixed_bools=10 #new_bounds=38 #equiv=1 
  1.62e-04s  0.00e+00d  [MaxClique] Merged 5(10 literals) into 3(6 literals) at_most_ones. 
  3.75e-02s  0.00e+00d  [DetectDominanceRelations] 
  4.06e-01s  0.00e+00d  [PresolveToFixPoint] #num_loops=4 #num_dual_strengthening=3 
  1.43e-01s  0.00e+00d  [ProcessAtMostOneAndLinear] 
  3.88e-02s  0.00e+00d  [DetectDuplicateConstraints] #duplicates=1'906 #without_enforcements=156 
  7.36e-02s  3.84e-03d  [DetectDominatedLinearConstraints] #relevant_constraints=24'620 #num_inclusions=4'498 #num_redundant=5 
  4.35e-03s  0.00e+00d  [DetectDifferentVariables] #different=126 
  1.47e-02s  1.08e-03d  [ProcessSetPPC] #relevant_constraints=23'559 
  1.87e-04s  0.00e+00d  [FindAlmostIdenticalLinearConstraints] 
  2.39e-03s  2.39e-03d  [FindBigAtMostOneAndLinearOverlap] 
  3.14e-01s  1.12e-01d  [FindBigVerticalLinearOverlap] #blocks=381 #saved_nz=153'077 
  5.42e-03s  2.15e-03d  [FindBigHorizontalLinearOverlap] #linears=23'275 
  1.61e-04s  0.00e+00d  [MergeClauses] 
  3.81e-02s  0.00e+00d  [DetectDominanceRelations] 
  3.32e-01s  0.00e+00d  [PresolveToFixPoint] #num_loops=3 #num_dual_strengthening=1 
  3.82e-02s  0.00e+00d  [DetectDominanceRelations] 
  2.03e-01s  0.00e+00d  [PresolveToFixPoint] #num_loops=1 #num_dual_strengthening=1 
[Symmetry] Graph for symmetry has 28'721 nodes and 462'811 arcs.
[Symmetry] Symmetry computation done. time: 0.0172379 dtime: 0.0254823
  2.83e-01s  4.21e-02d  [Probe] #probed=1'328 #new_bounds=385 
  1.31e-04s  0.00e+00d  [MaxClique] 
  4.17e-02s  0.00e+00d  [DetectDominanceRelations] 
  3.56e-01s  0.00e+00d  [PresolveToFixPoint] #num_loops=3 #num_dual_strengthening=1 
  1.30e-01s  0.00e+00d  [ProcessAtMostOneAndLinear] 
  3.25e-02s  0.00e+00d  [DetectDuplicateConstraints] #without_enforcements=156 
  4.81e-02s  2.68e-03d  [DetectDominatedLinearConstraints] #relevant_constraints=24'562 #num_inclusions=264 
  3.97e-03s  0.00e+00d  [DetectDifferentVariables] #different=148 #cliques=5 #size=15 
  1.20e-02s  7.67e-04d  [ProcessSetPPC] #relevant_constraints=23'279 
  2.65e-04s  2.44e-06d  [FindAlmostIdenticalLinearConstraints] #num_tested_pairs=140 
  1.04e-03s  9.19e-04d  [FindBigAtMostOneAndLinearOverlap] 
  1.56e-01s  6.14e-02d  [FindBigVerticalLinearOverlap] #blocks=1'029 #saved_nz=155'653 
  4.53e-03s  1.31e-03d  [FindBigHorizontalLinearOverlap] #linears=20'552 
  1.70e-04s  0.00e+00d  [MergeClauses] 
  2.56e-02s  0.00e+00d  [DetectDominanceRelations] 
  3.50e-01s  0.00e+00d  [PresolveToFixPoint] #num_loops=3 #num_dual_strengthening=1 
  2.56e-02s  0.00e+00d  [DetectDominanceRelations] 
  2.33e-01s  0.00e+00d  [PresolveToFixPoint] #num_loops=1 #num_dual_strengthening=1 
  2.25e-01s  2.93e-02d  [Probe] #probed=1'328 #new_bounds=612 
  1.31e-04s  0.00e+00d  [MaxClique] 
  2.56e-02s  0.00e+00d  [DetectDominanceRelations] 
  3.28e-01s  0.00e+00d  [PresolveToFixPoint] #num_loops=2 #num_dual_strengthening=1 
  1.07e-01s  0.00e+00d  [ProcessAtMostOneAndLinear] 
  3.08e-02s  0.00e+00d  [DetectDuplicateConstraints] #without_enforcements=156 
  3.21e-02s  1.64e-03d  [DetectDominatedLinearConstraints] #relevant_constraints=25'200 #num_inclusions=103 
  3.59e-03s  0.00e+00d  [DetectDifferentVariables] 
  8.51e-03s  4.43e-04d  [ProcessSetPPC] #relevant_constraints=20'656 
  6.19e-04s  5.73e-05d  [FindAlmostIdenticalLinearConstraints] #num_tested_pairs=1'957 
  8.31e-04s  5.78e-04d  [FindBigAtMostOneAndLinearOverlap] 
  9.66e-02s  3.06e-02d  [FindBigVerticalLinearOverlap] #blocks=814 #saved_nz=83'438 
  4.11e-03s  8.33e-04d  [FindBigHorizontalLinearOverlap] #linears=17'597 
  1.76e-04s  0.00e+00d  [MergeClauses] 
  2.16e-02s  0.00e+00d  [DetectDominanceRelations] 
  4.22e-01s  0.00e+00d  [PresolveToFixPoint] #num_loops=3 #num_dual_strengthening=1 
  1.38e-03s  0.00e+00d  [ExpandObjective] #entries=12'048 #tight_variables=2'947 #tight_constraints=1'586 

Presolve summary:
  - 313 affine relations were detected.
  - rule 'TODO dual: only one blocking constraint?' was applied 2'417 times.
  - rule 'TODO dual: only one unspecified blocking constraint?' was applied 208 times.
  - rule 'TODO duplicate: identical constraint with different enforcements' was applied 468 times.
  - rule 'TODO no_overlap: with task always last' was applied 5 times.
  - rule 'affine: new relation' was applied 313 times.
  - rule 'all_diff: inferred from x != y constraints' was applied 5 times.
  - rule 'at_most_one: removed literals' was applied 3 times.
  - rule 'at_most_one: size one' was applied 3 times.
  - rule 'at_most_one: transformed into max clique.' was applied 1 time.
  - rule 'deductions: 2281 stored' was applied 1 time.
  - rule 'dual: fix variable' was applied 45 times.
  - rule 'dual: reduced domain' was applied 104 times.
  - rule 'duplicate: merged rhs of linear constraint' was applied 307 times.
  - rule 'duplicate: removed constraint' was applied 1'906 times.
  - rule 'enforcement: false literal' was applied 67 times.
  - rule 'enforcement: true literal' was applied 45 times.
  - rule 'exactly_one: x and not(x)' was applied 1 time.
  - rule 'incompatible linear: add implication' was applied 234 times.
  - rule 'linear inclusion: redundant containing constraint' was applied 5 times.
  - rule 'linear matrix: common vertical rectangle' was applied 2'224 times.
  - rule 'linear: always true' was applied 2'410 times.
  - rule 'linear: doubleton free' was applied 25 times.
  - rule 'linear: empty' was applied 72 times.
  - rule 'linear: extracted enforcement literal' was applied 26'644 times.
  - rule 'linear: fixed or dup variables' was applied 27'741 times.
  - rule 'linear: positive equal one' was applied 4 times.
  - rule 'linear: reduced variable domains' was applied 1'785 times.
  - rule 'linear: remapped using affine relations' was applied 27'402 times.
  - rule 'linear: simplified rhs' was applied 113'267 times.
  - rule 'linear: variable substitution 1' was applied 25 times.
  - rule 'linear: variable substitution 2' was applied 370 times.
  - rule 'linear: variable substitution 3' was applied 118 times.
  - rule 'presolve: 202 unused variables removed.' was applied 1 time.
  - rule 'presolve: iteration' was applied 3 times.
  - rule 'probing: reduced enforced constraint to implication.' was applied 5 times.
  - rule 'symmetry: fixed to false in general orbit' was applied 1 time.

Presolved optimization model '': (model_fingerprint: 0x33615a1e22b3461f)
#Variables: 2'202 (#ints: 16 in objective)
  - 325 Booleans in [0,1]
  - 1'492 different domains in [-25624,25553] with a largest complexity of 25.
#kAllDiff: 5
#kExactlyOne: 3 (#literals: 9)
#kLinear1: 1 (#enforced: 1 #multi: 1)
#kLinear2: 1'946 (#enforced: 1'808 #multi: 736)
#kLinear3: 5'480 (#enforced: 4'618)
#kLinearN: 19'788 (#enforced: 18'552) (#terms: 175'904)

Preloading model.
#Bound   5.79s best:inf   next:[183,17356] initial_domain
#Model   5.84s var:2202/2202 constraints:27223/27223

Starting search at 5.86s with 32 workers.
16 full problem subsolvers: [core, default_lp, lb_tree_search, max_lp, no_lp, objective_lb_search, objective_lb_search_max_lp, objective_lb_search_no_lp, objective_shaving_search_max_lp, objective_shaving_search_no_lp, probing, probing_max_lp, pseudo_costs, quick_restart, quick_restart_no_lp, reduced_costs]
14 first solution subsolvers: [fj_long_default, fj_long_lin_default, fj_long_random, fj_short_default, fj_short_lin_default, fj_short_lin_random, fj_short_random, fs_random(2), fs_random_no_lp(2), fs_random_quick_restart(2), fs_random_quick_restart_no_lp]
11 incomplete subsolvers: [feasibility_pump, graph_arc_lns, graph_cst_lns, graph_dec_lns, graph_var_lns, rins/rens, rnd_cst_lns, rnd_var_lns, violation_ls(3)]
3 helper subsolvers: [neighborhood_helper, synchronization_agent, update_gap_integral]
#1       6.52s best:6610  next:[183,6609] fs_random_no_lp (fixed_bools=0/365)
#Bound   6.53s best:6610  next:[184,6609] objective_shaving_search_no_lp (vars=2202 csts=27228)
#Bound   6.56s best:6610  next:[288,6609] objective_lb_search_no_lp
#2       6.68s best:6609  next:[288,6608] violation_ls(batch:1 #solutions_imported:1 #lin_moves:7'481 #lin_evals:23'056 #weight_updates:340)
#3       6.68s best:6608  next:[288,6607] violation_ls(batch:2 #solutions_imported:2 #lin_moves:7'491 #lin_evals:23'113 #weight_updates:345)
#4       6.69s best:6607  next:[288,6606] violation_ls(batch:3 #solutions_imported:3 #lin_moves:7'491 #lin_evals:23'117 #gen_moves:1 #gen_evals:0 #comp_moves:1 #backtracks:0 #weight_updates:345)
#5       6.69s best:6606  next:[288,6605] violation_ls(batch:4 #solutions_imported:4 #lin_moves:7'493 #lin_evals:23'139 #gen_moves:1 #gen_evals:0 #comp_moves:1 #backtracks:0 #weight_updates:346)
#6       6.70s best:6605  next:[288,6604] violation_ls(batch:2 #solutions_imported:2 #lin_moves:0 #lin_evals:18'950 #gen_moves:5'808 #gen_evals:1'439 #comp_moves:730 #backtracks:2'535 #weight_updates:62)
#7       6.70s best:6604  next:[288,6603] violation_ls(batch:3 #solutions_imported:3 #lin_moves:0 #lin_evals:18'954 #gen_moves:5'810 #gen_evals:1'439 #comp_moves:732 #backtracks:2'535 #weight_updates:62)
#8       6.70s best:6603  next:[288,6602] violation_ls(batch:4 #solutions_imported:4 #lin_moves:0 #lin_evals:19'016 #gen_moves:5'835 #gen_evals:1'444 #comp_moves:733 #backtracks:2'547 #weight_updates:62)
#9       6.71s best:6602  next:[288,6601] violation_ls(batch:5 #solutions_imported:5 #lin_moves:1 #lin_evals:19'032 #gen_moves:5'835 #gen_evals:1'444 #comp_moves:733 #backtracks:2'547 #weight_updates:62)
#10      6.72s best:6601  next:[288,6600] violation_ls(batch:2 #solutions_imported:2 #lin_moves:2 #lin_evals:19'122 #gen_moves:5'858 #gen_evals:1'461 #comp_moves:664 #backtracks:2'595 #weight_updates:60)
#11      6.73s best:6600  next:[288,6599] violation_ls(batch:3 #solutions_imported:3 #lin_moves:3 #lin_evals:19'138 #gen_moves:5'858 #gen_evals:1'461 #comp_moves:664 #backtracks:2'595 #weight_updates:60)
#12      6.73s best:6599  next:[288,6598] violation_ls(batch:4 #solutions_imported:4 #lin_moves:3 #lin_evals:19'240 #gen_moves:5'900 #gen_evals:1'472 #comp_moves:666 #backtracks:2'615 #weight_updates:60)
#13      6.73s best:6598  next:[288,6597] violation_ls(batch:5 #solutions_imported:5 #lin_moves:3 #lin_evals:19'267 #gen_moves:5'910 #gen_evals:1'475 #comp_moves:668 #backtracks:2'619 #weight_updates:60)
#14      6.74s best:6597  next:[288,6596] violation_ls(batch:6 #solutions_imported:6 #lin_moves:1 #lin_evals:19'098 #gen_moves:5'862 #gen_evals:1'450 #comp_moves:734 #backtracks:2'560 #weight_updates:62)
#15      6.74s best:6596  next:[288,6595] violation_ls(batch:6 #solutions_imported:6 #lin_moves:3 #lin_evals:19'349 #gen_moves:5'940 #gen_evals:1'484 #comp_moves:670 #backtracks:2'633 #weight_updates:60)
#16      6.81s best:6595  next:[288,6594] violation_ls(batch:7 #solutions_imported:7 #lin_moves:1 #lin_evals:19'103 #gen_moves:5'864 #gen_evals:1'450 #comp_moves:736 #backtracks:2'560 #weight_updates:62)
#17      6.81s best:6594  next:[288,6593] violation_ls(batch:7 #solutions_imported:7 #lin_moves:7'495 #lin_evals:23'286 #gen_moves:52 #gen_evals:5 #comp_moves:2 #backtracks:25 #weight_updates:346)
#18      6.82s best:6593  next:[288,6592] violation_ls(batch:7 #solutions_imported:7 #lin_moves:3 #lin_evals:19'371 #gen_moves:5'948 #gen_evals:1'486 #comp_moves:672 #backtracks:2'636 #weight_updates:60)
#19      6.84s best:6590  next:[288,6589] rnd_var_lns (d=0.81 s=86 t=0.10 p=1.00 stall=2 h=auto_l0) [presolve]
#20      6.88s best:6589  next:[288,6588] violation_ls(batch:8 #solutions_imported:8 #lin_moves:43 #lin_evals:19'339 #gen_moves:5'864 #gen_evals:1'450 #comp_moves:736 #backtracks:2'560 #weight_updates:101)
#21      6.88s best:6588  next:[288,6587] violation_ls(batch:8 #solutions_imported:8 #lin_moves:7'655 #lin_evals:24'191 #gen_moves:52 #gen_evals:5 #comp_moves:2 #backtracks:25 #weight_updates:461)
#22      6.93s best:6587  next:[288,6586] violation_ls(batch:8 #solutions_imported:8 #lin_moves:3 #lin_evals:23'906 #gen_moves:7'610 #gen_evals:1'941 #comp_moves:734 #backtracks:3'436 #weight_updates:84)
#Bound   6.95s best:6587  next:[368,6586] objective_lb_search_no_lp
#23      6.99s best:6586  next:[368,6585] violation_ls(batch:9 #solutions_imported:9 #lin_moves:7'796 #lin_evals:24'817 #gen_moves:52 #gen_evals:5 #comp_moves:2 #backtracks:25 #weight_updates:503)
#24      7.00s best:6549  next:[368,6548] no_lp (fixed_bools=0/368)
#Bound   7.16s best:6549  next:[370,6548] objective_lb_search_no_lp
#Bound   7.31s best:6549  next:[410,6548] objective_lb_search_no_lp
#25      7.32s best:6484  next:[410,6483] rins_lp_lns (d=0.81 s=149 t=0.10 p=1.00 stall=2 h=auto_l0)
#26      7.68s best:6483  next:[410,6482] violation_ls(batch:12 #solutions_imported:11 #lin_moves:28'423 #lin_evals:93'078 #gen_moves:52 #gen_evals:5 #comp_moves:2 #backtracks:25 #weight_updates:3'594)
#Bound   7.88s best:6483  next:[411,6482] objective_lb_search_no_lp
#27      8.02s best:6482  next:[411,6481] violation_ls(batch:13 #solutions_imported:12 #lin_moves:14'793 #lin_evals:107'878 #gen_moves:11'733 #gen_evals:2'840 #comp_moves:1'459 #backtracks:5'129 #weight_updates:7'565)
#28      8.02s best:6481  next:[411,6480] violation_ls(batch:13 #solutions_imported:12 #lin_moves:28'423 #lin_evals:93'188 #gen_moves:92 #gen_evals:14 #comp_moves:4 #backtracks:44 #weight_updates:3'594)
#Bound   8.10s best:6481  next:[412,6480] objective_lb_search_no_lp
#Bound   8.25s best:6481  next:[413,6480] objective_lb_search_no_lp
#29      8.26s best:6469  next:[413,6468] graph_var_lns (d=0.97 s=165 t=0.10 p=1.00 stall=2 h=auto_l0) [hint]
#30      8.36s best:6452  next:[413,6451] graph_arc_lns (d=0.98 s=166 t=0.10 p=1.00 stall=0 h=auto_l0)
#Bound   8.40s best:6452  next:[416,6451] objective_lb_search_max_lp
#31      8.60s best:6451  next:[416,6450] violation_ls(batch:14 #solutions_imported:13 #lin_moves:14'793 #lin_evals:121'456 #gen_moves:15'924 #gen_evals:3'797 #comp_moves:1'756 #backtracks:7'076 #weight_updates:7'633)
#32      8.60s best:6450  next:[416,6449] violation_ls(batch:14 #solutions_imported:13 #lin_moves:30'042 #lin_evals:166'619 #gen_moves:9'613 #gen_evals:2'573 #comp_moves:885 #backtracks:4'362 #weight_updates:10'077)
#Bound   8.93s best:6450  next:[425,6449] objective_lb_search_no_lp
#Bound   9.12s best:6450  next:[427,6449] objective_lb_search_no_lp
#Bound   9.32s best:6450  next:[443,6449] objective_lb_search_no_lp
#33      9.42s best:6449  next:[443,6448] violation_ls(batch:15 #solutions_imported:14 #lin_moves:36'686 #lin_evals:184'767 #gen_moves:9'613 #gen_evals:2'573 #comp_moves:885 #backtracks:4'362 #weight_updates:10'437)
#34      9.43s best:6427  next:[443,6426] no_lp (fixed_bools=0/399)
#35     10.18s best:6426  next:[443,6425] violation_ls(batch:16 #solutions_imported:15 #lin_moves:21'054 #lin_evals:165'585 #gen_moves:22'479 #gen_evals:4'610 #comp_moves:3'313 #backtracks:9'574 #weight_updates:8'033)
#36     10.19s best:6425  next:[443,6424] violation_ls(batch:16 #solutions_imported:15 #lin_moves:28'459 #lin_evals:131'449 #gen_moves:12'446 #gen_evals:3'016 #comp_moves:767 #backtracks:5'835 #weight_updates:3'764)
#37     10.19s best:6424  next:[443,6423] violation_ls(batch:16 #solutions_imported:15 #lin_moves:36'687 #lin_evals:184'783 #gen_moves:9'613 #gen_evals:2'573 #comp_moves:885 #backtracks:4'362 #weight_updates:10'437)
#38     10.41s best:6362  next:[443,6361] no_lp (fixed_bools=0/413)
#Bound  10.77s best:6362  next:[446,6361] objective_lb_search_max_lp
#39     11.17s best:6357  next:[446,6356] quick_restart_no_lp (fixed_bools=0/400)
#40     11.30s best:6354  next:[446,6353] no_lp (fixed_bools=0/417)
#41     11.44s best:6302  next:[446,6301] rnd_cst_lns (d=0.99 s=218 t=0.10 p=1.00 stall=0 h=auto_l0)
#42     11.46s best:6285  next:[446,6284] quick_restart (fixed_bools=0/372)
#Bound  11.51s best:6285  next:[497,6284] objective_lb_search
#43     11.82s best:6092  next:[497,6091] graph_var_lns (d=0.99 s=203 t=0.10 p=1.00 stall=0 h=auto_l0)
#Bound  12.27s best:6092  next:[498,6091] objective_lb_search_no_lp
#44     13.22s best:5952  next:[498,5951] rnd_var_lns (d=0.99 s=227 t=0.10 p=1.00 stall=0 h=auto_l0)
#45     13.34s best:5951  next:[498,5950] violation_ls(batch:18 #solutions_imported:17 #lin_moves:28'984 #lin_evals:152'249 #gen_moves:18'253 #gen_evals:4'549 #comp_moves:1'210 #backtracks:8'517 #weight_updates:3'922)
#46     13.35s best:5950  next:[498,5949] violation_ls(batch:18 #solutions_imported:17 #lin_moves:36'688 #lin_evals:204'085 #gen_moves:15'664 #gen_evals:3'882 #comp_moves:1'600 #backtracks:7'028 #weight_updates:10'495)
#Bound  13.58s best:5950  next:[500,5949] objective_lb_search
#Bound  13.62s best:5950  next:[536,5949] objective_lb_search_no_lp
#47     14.05s best:5718  next:[536,5717] rnd_cst_lns (d=0.99 s=228 t=0.10 p=1.00 stall=0 h=auto_l0)
#48     14.21s best:5717  next:[536,5716] violation_ls(batch:19 #solutions_imported:18 #lin_moves:29'252 #lin_evals:153'785 #gen_moves:18'253 #gen_evals:4'549 #comp_moves:1'210 #backtracks:8'517 #weight_updates:4'109)
#49     14.31s best:5716  next:[536,5715] violation_ls(batch:19 #solutions_imported:18 #lin_moves:36'688 #lin_evals:222'857 #gen_moves:21'258 #gen_evals:4'956 #comp_moves:2'096 #backtracks:9'577 #weight_updates:10'561)
#50     15.90s best:5509  next:[536,5508] rins_lp_lns (d=0.88 s=261 t=0.10 p=0.58 stall=0 h=auto_l0)
#51     17.19s best:5409  next:[536,5408] rins_lp_lns (d=0.84 s=281 t=0.10 p=0.53 stall=1 h=auto_l0)
#52     19.18s best:5389  next:[536,5388] graph_cst_lns (d=0.99 s=289 t=0.10 p=1.00 stall=0 h=auto_l0)
#53     19.44s best:5060  next:[536,5059] rins_lp_lns (d=0.87 s=291 t=0.10 p=0.56 stall=0 h=auto_l0)
#Bound  20.57s best:5060  next:[538,5059] objective_lb_search_max_lp
#Bound  20.91s best:5060  next:[560,5059] objective_lb_search_no_lp
#54     21.38s best:5056  next:[560,5055] graph_dec_lns (d=0.99 s=300 t=0.10 p=0.83 stall=0 h=auto_l0)
#55     22.56s best:5027  next:[560,5026] graph_arc_lns (d=0.99 s=308 t=0.10 p=0.81 stall=0 h=auto_l0)
#56     22.57s best:5026  next:[560,5025] violation_ls(batch:25 #solutions_imported:23 #lin_moves:58'251 #lin_evals:409'724 #gen_moves:40'793 #gen_evals:8'552 #comp_moves:5'249 #backtracks:17'757 #weight_updates:21'262)
#57     22.57s best:5025  next:[560,5024] violation_ls(batch:25 #solutions_imported:23 #lin_moves:38'901 #lin_evals:269'048 #gen_moves:43'579 #gen_evals:9'270 #comp_moves:3'234 #backtracks:20'163 #weight_updates:4'801)
#58     23.69s best:5024  next:[560,5023] violation_ls(batch:26 #solutions_imported:24 #lin_moves:39'518 #lin_evals:272'009 #gen_moves:43'579 #gen_evals:9'270 #comp_moves:3'234 #backtracks:20'163 #weight_updates:5'008)
#59     23.70s best:5023  next:[560,5022] violation_ls(batch:26 #solutions_imported:24 #lin_moves:49'457 #lin_evals:362'962 #gen_moves:44'631 #gen_evals:10'362 #comp_moves:4'850 #backtracks:19'883 #weight_updates:18'079)
#60     24.29s best:4961  next:[560,4960] rins_lp_lns (d=0.85 s=335 t=0.10 p=0.53 stall=2 h=auto_l0)
#61     24.86s best:4897  next:[560,4896] rins_lp_lns (d=0.84 s=345 t=0.10 p=0.52 stall=0 h=auto_l0)
#Bound  26.30s best:4897  next:[566,4896] objective_lb_search_no_lp
#62     28.01s best:4863  next:[566,4862] rins_lp_lns (d=0.87 s=356 t=0.10 p=0.55 stall=0 h=auto_l0)
#Bound  28.97s best:4863  next:[597,4862] objective_lb_search_no_lp
#Bound  29.56s best:4863  next:[679,4862] objective_lb_search_max_lp
#63     31.00s best:4819  next:[679,4818] graph_dec_lns (d=0.99 s=376 t=0.10 p=0.74 stall=2 h=auto_l0)
#64     31.42s best:4799  next:[679,4798] rnd_var_lns (d=0.99 s=361 t=0.10 p=0.77 stall=0 h=auto_l0)
#65     37.06s best:4688  next:[679,4687] graph_var_lns (d=0.99 s=417 t=0.10 p=0.72 stall=1 h=auto_l0)
#66     37.39s best:4687  next:[679,4686] violation_ls(batch:35 #solutions_imported:28 #lin_moves:91'378 #lin_evals:650'174 #gen_moves:69'749 #gen_evals:15'217 #comp_moves:7'830 #backtracks:30'939 #weight_updates:33'785)
#67     37.40s best:4686  next:[679,4685] violation_ls(batch:35 #solutions_imported:28 #lin_moves:69'229 #lin_evals:467'775 #gen_moves:69'655 #gen_evals:14'783 #comp_moves:8'008 #backtracks:30'806 #weight_updates:5'903)
#68     37.41s best:4685  next:[679,4684] violation_ls(batch:35 #solutions_imported:28 #lin_moves:68'688 #lin_evals:562'274 #gen_moves:74'862 #gen_evals:16'790 #comp_moves:7'518 #backtracks:33'663 #weight_updates:29'954)
#69     37.48s best:4684  next:[679,4683] quick_restart_no_lp (fixed_bools=0/688)
#70     37.85s best:4583  next:[679,4582] rins_lp_lns (d=0.87 s=432 t=0.10 p=0.54 stall=3 h=auto_l0)
#71     42.25s best:4527  next:[679,4526] rnd_cst_lns (d=0.99 s=447 t=0.10 p=0.69 stall=2 h=auto_l0)
#72     42.91s best:4526  next:[679,4525] violation_ls(batch:39 #solutions_imported:30 #lin_moves:99'322 #lin_evals:574'361 #gen_moves:69'655 #gen_evals:14'783 #comp_moves:8'008 #backtracks:30'806 #weight_updates:6'439)
#73     43.31s best:4525  next:[679,4524] violation_ls(batch:40 #solutions_imported:31 #lin_moves:100'965 #lin_evals:581'450 #gen_moves:69'655 #gen_evals:14'783 #comp_moves:8'008 #backtracks:30'806 #weight_updates:6'865)
#74     43.32s best:4524  next:[679,4523] violation_ls(batch:40 #solutions_imported:31 #lin_moves:68'688 #lin_evals:647'896 #gen_moves:98'081 #gen_evals:21'597 #comp_moves:11'590 #backtracks:43'232 #weight_updates:30'174)
#75     45.45s best:4523  next:[679,4522] violation_ls(batch:41 #solutions_imported:32 #lin_moves:110'851 #lin_evals:797'312 #gen_moves:84'474 #gen_evals:18'689 #comp_moves:11'223 #backtracks:36'602 #weight_updates:34'413)
#76     45.45s best:4522  next:[679,4521] violation_ls(batch:41 #solutions_imported:32 #lin_moves:100'972 #lin_evals:581'492 #gen_moves:69'655 #gen_evals:14'783 #comp_moves:8'008 #backtracks:30'806 #weight_updates:6'869)
#77     45.46s best:4521  next:[679,4520] violation_ls(batch:41 #solutions_imported:32 #lin_moves:68'710 #lin_evals:648'031 #gen_moves:98'081 #gen_evals:21'597 #comp_moves:11'590 #backtracks:43'232 #weight_updates:30'194)
#78     45.89s best:4518  next:[679,4517] graph_dec_lns (d=1.00 s=482 t=0.10 p=0.69 stall=0 h=auto_l0)
#79     46.09s best:4504  next:[679,4503] graph_var_lns (d=0.99 s=479 t=0.10 p=0.69 stall=1 h=auto_l0)
#80     46.88s best:4495  next:[679,4494] graph_cst_lns (d=0.99 s=491 t=0.10 p=0.71 stall=3 h=auto_l0)
#81     46.95s best:4494  next:[679,4493] violation_ls(batch:42 #solutions_imported:33 #lin_moves:110'851 #lin_evals:797'424 #gen_moves:84'507 #gen_evals:18'695 #comp_moves:11'228 #backtracks:36'616 #weight_updates:34'413)
#82     46.95s best:4493  next:[679,4492] violation_ls(batch:42 #solutions_imported:33 #lin_moves:100'972 #lin_evals:581'700 #gen_moves:69'713 #gen_evals:14'792 #comp_moves:8'012 #backtracks:30'833 #weight_updates:6'869)
#83     48.37s best:4492  next:[679,4491] violation_ls(batch:43 #solutions_imported:34 #lin_moves:103'298 #lin_evals:591'802 #gen_moves:69'713 #gen_evals:14'792 #comp_moves:8'012 #backtracks:30'833 #weight_updates:7'567)
#84     50.27s best:4436  next:[679,4435] graph_dec_lns (d=0.99 s=503 t=0.10 p=0.68 stall=0 h=auto_l0)
#Bound  50.59s best:4436  next:[681,4435] objective_lb_search_no_lp
#85     50.68s best:4435  next:[681,4434] violation_ls(batch:44 #solutions_imported:35 #lin_moves:111'420 #lin_evals:820'540 #gen_moves:90'540 #gen_evals:20'119 #comp_moves:11'548 #backtracks:39'470 #weight_updates:34'688)
#86     50.91s best:4434  next:[681,4433] violation_ls(batch:44 #solutions_imported:35 #lin_moves:68'710 #lin_evals:708'707 #gen_moves:116'050 #gen_evals:25'791 #comp_moves:12'584 #backtracks:51'716 #weight_updates:30'440)
#87     51.89s best:4169  next:[681,4168] rins_lp_lns (d=0.87 s=537 t=0.10 p=0.53 stall=0 h=auto_l0)
#88     54.00s best:4159  next:[681,4158] graph_var_lns (d=0.99 s=543 t=0.10 p=0.64 stall=1 h=auto_l0)
#89     54.04s best:4158  next:[681,4157] violation_ls(batch:46 #solutions_imported:37 #lin_moves:105'078 #lin_evals:623'581 #gen_moves:76'303 #gen_evals:15'624 #comp_moves:9'378 #backtracks:33'442 #weight_updates:7'970)
#90     55.46s best:4157  next:[681,4156] violation_ls(batch:47 #solutions_imported:38 #lin_moves:107'538 #lin_evals:634'093 #gen_moves:76'303 #gen_evals:15'624 #comp_moves:9'378 #backtracks:33'442 #weight_updates:8'663)
#91     55.47s best:4156  next:[681,4155] violation_ls(batch:47 #solutions_imported:38 #lin_moves:78'333 #lin_evals:765'314 #gen_moves:122'728 #gen_evals:27'054 #comp_moves:12'822 #backtracks:54'936 #weight_updates:30'919)
#92     56.30s best:4118  next:[681,4117] rnd_var_lns (d=0.99 s=552 t=0.10 p=0.64 stall=0 h=auto_l0)
#93     58.67s best:4030  next:[681,4029] rnd_var_lns (d=0.99 s=572 t=0.10 p=0.63 stall=0 h=auto_l0)
#94     60.10s best:4029  next:[681,4028] violation_ls(batch:51 #solutions_imported:40 #lin_moves:111'335 #lin_evals:864'401 #gen_moves:122'728 #gen_evals:27'054 #comp_moves:12'822 #backtracks:54'936 #weight_updates:32'379)
#95     60.66s best:4024  next:[681,4023] quick_restart_no_lp (fixed_bools=0/1011)
#96     60.89s best:4019  next:[681,4018] quick_restart_no_lp (fixed_bools=0/1017)
#Bound  61.13s best:4019  next:[687,4018] objective_lb_search_no_lp
#97     61.58s best:4009  next:[687,4008] rins_pump_lns (d=0.83 s=611 t=0.10 p=0.50 stall=1 h=auto_l0)
#98     61.59s best:4008  next:[687,4007] violation_ls(batch:52 #solutions_imported:41 #lin_moves:121'038 #lin_evals:988'175 #gen_moves:130'525 #gen_evals:27'535 #comp_moves:13'626 #backtracks:58'420 #weight_updates:35'566)
#99     61.76s best:4007  next:[687,4006] violation_ls(batch:52 #solutions_imported:41 #lin_moves:111'536 #lin_evals:865'529 #gen_moves:122'728 #gen_evals:27'054 #comp_moves:12'822 #backtracks:54'936 #weight_updates:32'513)
#100    63.16s best:4006  next:[687,4005] violation_ls(batch:53 #solutions_imported:42 #lin_moves:121'039 #lin_evals:988'191 #gen_moves:130'525 #gen_evals:27'535 #comp_moves:13'626 #backtracks:58'420 #weight_updates:35'566)
#101    63.26s best:3984  next:[687,3983] rins_lp_lns (d=0.85 s=622 t=0.10 p=0.51 stall=0 h=auto_l0)
#102    68.14s best:3914  next:[687,3913] graph_dec_lns (d=0.99 s=631 t=0.10 p=0.64 stall=2 h=auto_l0)
#103    68.19s best:3913  next:[687,3912] violation_ls(batch:56 #solutions_imported:44 #lin_moves:120'267 #lin_evals:852'493 #gen_moves:125'658 #gen_evals:22'909 #comp_moves:11'518 #backtracks:57'038 #weight_updates:10'311)
#104    68.19s best:3912  next:[687,3911] violation_ls(batch:56 #solutions_imported:43 #lin_moves:111'537 #lin_evals:938'790 #gen_moves:143'695 #gen_evals:30'335 #comp_moves:13'744 #backtracks:64'957 #weight_updates:32'777)
#105    69.25s best:3907  next:[687,3906] quick_restart_no_lp (fixed_bools=0/1112)
#106    69.62s best:3906  next:[687,3905] violation_ls(batch:57 #solutions_imported:44 #lin_moves:121'089 #lin_evals:1'067'198 #gen_moves:149'983 #gen_evals:29'854 #comp_moves:18'177 #backtracks:65'872 #weight_updates:35'747)
#107    69.62s best:3905  next:[687,3904] violation_ls(batch:57 #solutions_imported:45 #lin_moves:120'268 #lin_evals:852'508 #gen_moves:125'658 #gen_evals:22'909 #comp_moves:11'518 #backtracks:57'038 #weight_updates:10'311)
#108    69.63s best:3904  next:[687,3903] violation_ls(batch:57 #solutions_imported:44 #lin_moves:111'551 #lin_evals:938'869 #gen_moves:143'695 #gen_evals:30'335 #comp_moves:13'744 #backtracks:64'957 #weight_updates:32'784)
#109    71.00s best:3892  next:[687,3891] quick_restart_no_lp (fixed_bools=0/1127)
#110    71.24s best:3891  next:[687,3890] violation_ls(batch:58 #solutions_imported:45 #lin_moves:121'090 #lin_evals:1'067'214 #gen_moves:149'983 #gen_evals:29'854 #comp_moves:18'177 #backtracks:65'872 #weight_updates:35'747)
#111    71.24s best:3890  next:[687,3889] violation_ls(batch:58 #solutions_imported:46 #lin_moves:120'268 #lin_evals:852'662 #gen_moves:125'714 #gen_evals:22'915 #comp_moves:11'520 #backtracks:57'065 #weight_updates:10'311)
#112    71.53s best:3886  next:[687,3885] quick_restart_no_lp (fixed_bools=0/1134)
#113    72.02s best:3885  next:[687,3884] violation_ls(batch:59 #solutions_imported:46 #lin_moves:121'090 #lin_evals:1'067'333 #gen_moves:150'026 #gen_evals:29'856 #comp_moves:18'178 #backtracks:65'893 #weight_updates:35'747)
#114    72.64s best:3881  next:[687,3880] rnd_cst_lns (d=1.00 s=668 t=0.10 p=0.64 stall=2 h=auto_l0)
#115    72.69s best:3845  next:[687,3844] rins_pump_lns (d=0.89 s=684 t=0.10 p=0.53 stall=0 h=auto_l0)
#116    76.32s best:3827  next:[687,3826] graph_cst_lns (d=0.99 s=702 t=0.10 p=0.65 stall=0 h=auto_l0)
#117    78.40s best:3806  next:[687,3805] rnd_cst_lns (d=0.99 s=709 t=0.10 p=0.63 stall=0 h=auto_l0)
#118    84.92s best:3798  next:[687,3797] graph_arc_lns (d=0.99 s=753 t=0.10 p=0.60 stall=4 h=auto_l0)
#Bound  91.98s best:3798  next:[738,3797] objective_lb_search_no_lp
#Bound 100.09s best:3798  next:[743,3797] objective_lb_search_no_lp
#119   105.76s best:3793  next:[743,3792] rins_lp_lns (d=0.87 s=915 t=0.10 p=0.51 stall=7 h=auto_l0)
#120   106.94s best:3775  next:[743,3774] graph_var_lns (d=0.99 s=911 t=0.10 p=0.60 stall=5 h=auto_l0)
#Bound 107.11s best:3775  next:[763,3774] objective_lb_search_max_lp
#Bound 123.39s best:3775  next:[764,3774] objective_lb_search_no_lp
#Bound 131.94s best:3775  next:[766,3774] objective_lb_search_max_lp
#Bound 135.40s best:3775  next:[774,3774] objective_lb_search_no_lp
#121   152.87s best:3765  next:[774,3764] graph_dec_lns (d=0.99 s=1222 t=0.10 p=0.57 stall=0 h=auto_l0)
#Bound 186.55s best:3765  next:[775,3764] objective_shaving_search_no_lp (vars=2499 csts=27305)
#Bound 191.97s best:3765  next:[777,3764] objective_lb_search_no_lp
#Bound 204.00s best:3765  next:[778,3764] objective_lb_search_no_lp
#Bound 213.64s best:3765  next:[780,3764] objective_lb_search_no_lp
#Bound 225.67s best:3765  next:[781,3764] objective_lb_search_no_lp
#Bound 233.76s best:3765  next:[784,3764] objective_lb_search_no_lp
#122   238.49s best:3755  next:[784,3754] graph_cst_lns (d=0.99 s=1801 t=0.10 p=0.55 stall=1 h=auto_l0)
#Bound 250.02s best:3755  next:[878,3754] objective_lb_search
#Bound 302.71s best:3755  next:[879,3754] objective_lb_search_no_lp
#Bound 307.85s best:3755  next:[882,3754] objective_lb_search
#Bound 384.98s best:3755  next:[883,3754] objective_shaving_search_no_lp (vars=2498 csts=27304)
#123   424.51s best:3720  next:[883,3719] graph_dec_lns (d=1.00 s=3050 t=0.10 p=0.53 stall=6 h=auto_l0)
#124   425.44s best:3719  next:[883,3718] violation_ls(batch:288 #solutions_imported:55 #perturbations:1 #lin_moves:984'294 #lin_evals:8'902'663 #gen_moves:467'827 #gen_evals:121'130 #comp_moves:52'170 #backtracks:207'760 #weight_updates:383'264)
#125   425.44s best:3718  next:[883,3717] violation_ls(batch:288 #solutions_imported:56 #perturbations:1 #lin_moves:206'677 #lin_evals:6'254'241 #gen_moves:1'469'634 #gen_evals:180'140 #comp_moves:82'448 #backtracks:693'395 #weight_updates:90'632)
#126   425.45s best:3717  next:[883,3716] violation_ls(batch:288 #solutions_imported:55 #perturbations:1 #lin_moves:2'303'219 #lin_evals:10'659'399 #gen_moves:204'636 #gen_evals:41'109 #comp_moves:21'230 #backtracks:91'667 #weight_updates:41'671)
#127   426.83s best:3703  next:[883,3702] rins_pump_lns (d=0.86 s=3092 t=0.10 p=0.50 stall=2 h=auto_l0)
#128   427.11s best:3698  next:[883,3697] graph_dec_lns (d=1.00 s=3081 t=0.10 p=0.52 stall=0 h=auto_l0)
#129   427.76s best:3688  next:[883,3687] graph_var_lns (d=0.99 s=3088 t=0.10 p=0.53 stall=5 h=auto_l0)
#Bound 447.06s best:3688  next:[889,3687] objective_lb_search_no_lp
#Bound 481.14s best:3688  next:[903,3687] objective_lb_search
#Bound 597.26s best:3688  next:[904,3687] objective_shaving_search_no_lp (vars=2498 csts=27304)
#Bound 598.46s best:3688  next:[912,3687] objective_lb_search_max_lp
#Bound 655.73s best:3688  next:[913,3687] objective_lb_search
#Bound 723.92s best:3688  next:[914,3687] objective_shaving_search_no_lp (vars=2490 csts=27296)
#Bound 726.21s best:3688  next:[915,3687] objective_lb_search
#Bound 735.64s best:3688  next:[921,3687] objective_lb_search
#Bound 801.19s best:3688  next:[934,3687] objective_lb_search
#Bound 837.53s best:3688  next:[936,3687] objective_lb_search
#Bound 881.15s best:3688  next:[947,3687] objective_lb_search
#Bound 952.01s best:3688  next:[949,3687] objective_lb_search
#Bound 1004.56s best:3688  next:[950,3687] objective_lb_search
#Bound 1107.22s best:3688  next:[951,3687] objective_lb_search
#Bound 1154.45s best:3688  next:[955,3687] objective_lb_search
#Bound 1244.23s best:3688  next:[958,3687] objective_lb_search
#Bound 1295.81s best:3688  next:[964,3687] objective_lb_search
#Bound 1405.67s best:3688  next:[969,3687] objective_lb_search
#Bound 1441.61s best:3688  next:[976,3687] objective_lb_search
#Bound 1510.20s best:3688  next:[977,3687] objective_lb_search
#Bound 1518.31s best:3688  next:[981,3687] objective_lb_search
#Bound 1569.45s best:3688  next:[983,3687] objective_lb_search
#Bound 1615.04s best:3688  next:[1003,3687] objective_lb_search
#Bound 1668.27s best:3688  next:[1008,3687] objective_lb_search
#Bound 1769.52s best:3688  next:[1010,3687] objective_lb_search
#130   1837.43s best:3678  next:[1010,3677] rins_lp_lns (d=0.88 s=12497 t=0.10 p=0.50 stall=0 h=auto_l0)
#131   1837.98s best:3677  next:[1010,3676] quick_restart_no_lp (fixed_bools=19/5756)
#132   1838.56s best:3676  next:[1010,3675] violation_ls(batch:1195 #solutions_imported:58 #perturbations:10 #lin_moves:5'927'520 #lin_evals:69'777'082 #gen_moves:1'076'519 #gen_evals:642'771 #comp_moves:78'830 #backtracks:498'692 #weight_updates:490'168)
#133   1838.57s best:3675  next:[1010,3674] violation_ls(batch:1195 #solutions_imported:59 #perturbations:10 #lin_moves:4'191'507 #lin_evals:49'620'123 #gen_moves:2'259'596 #gen_evals:852'170 #comp_moves:139'067 #backtracks:1'059'946 #weight_updates:165'995)
#134   1838.57s best:3674  next:[1010,3673] violation_ls(batch:1195 #solutions_imported:58 #perturbations:10 #lin_moves:4'359'469 #lin_evals:31'639'821 #gen_moves:1'246'984 #gen_evals:932'647 #comp_moves:87'625 #backtracks:579'335 #weight_updates:45'618)
#135   1842.37s best:3653  next:[1010,3652] graph_dec_lns (d=0.99 s=12517 t=0.10 p=0.51 stall=4 h=auto_l0)
#Bound 1846.10s best:3653  next:[1011,3652] objective_lb_search_no_lp
#136   1921.36s best:3628  next:[1011,3627] graph_var_lns (d=0.99 s=13043 t=0.10 p=0.51 stall=0 h=auto_l0)
#137   1924.20s best:3623  next:[1011,3622] graph_var_lns (d=0.99 s=13074 t=0.10 p=0.51 stall=0 h=auto_l0)
#138   1933.18s best:3610  next:[1011,3609] rnd_cst_lns (d=1.00 s=13135 t=0.10 p=0.51 stall=1 h=auto_l0)
#Bound 1978.87s best:3610  next:[1012,3609] objective_lb_search
#Bound 2003.08s best:3610  next:[1014,3609] objective_lb_search_no_lp
#139   2037.33s best:3597  next:[1014,3596] rins_lp_lns (d=0.87 s=13848 t=0.10 p=0.50 stall=25 h=auto_l0)
#Bound 2042.00s best:3597  next:[1026,3596] objective_lb_search
#Bound 2122.65s best:3597  next:[1034,3596] objective_lb_search
#Bound 2198.24s best:3597  next:[1036,3596] objective_lb_search
#Bound 2348.93s best:3597  next:[1037,3596] objective_lb_search
#Bound 2408.55s best:3597  next:[1038,3596] objective_lb_search
#Bound 2441.95s best:3597  next:[1039,3596] objective_lb_search
#Bound 2531.89s best:3597  next:[1042,3596] objective_lb_search
#Bound 2565.64s best:3597  next:[1043,3596] objective_lb_search
#Bound 2648.87s best:3597  next:[1044,3596] objective_lb_search
#Bound 2690.07s best:3597  next:[1046,3596] objective_lb_search
#Bound 2775.70s best:3597  next:[1061,3596] objective_lb_search
#Bound 2819.05s best:3597  next:[1064,3596] objective_lb_search
#Bound 3350.56s best:3597  next:[1065,3596] objective_lb_search
#Bound 3509.66s best:3597  next:[1067,3596] objective_lb_search
#Bound 3572.98s best:3597  next:[1068,3596] objective_lb_search

Task timing                                  n [     min,      max]      avg      dev     time         n [     min,      max]      avg      dev    dtime
                             'core':         1 [  59.91m,   59.91m]   59.91m   0.00ns   59.91m         1 [  14.82m,   14.82m]   14.82m   0.00ns   14.82m
                       'default_lp':         1 [  59.90m,   59.90m]   59.90m   0.00ns   59.90m         1 [   3.61m,    3.61m]    3.61m   0.00ns    3.61m
                 'feasibility_pump':       813 [104.02us,   28.26s]    4.42s    1.26s   59.90m       780 [233.84ms,    5.60s] 411.72ms 186.15ms    5.35m
                  'fj_long_default':         2 [227.25ms, 358.02ms] 292.63ms  65.38ms 585.26ms         2 [184.73ms, 241.75ms] 213.24ms  28.51ms 426.48ms
              'fj_long_lin_default':         4 [155.84ms, 206.63ms] 172.62ms  20.19ms 690.47ms         4 [146.67ms, 159.67ms] 154.03ms   4.91ms 616.14ms
                   'fj_long_random':         2 [217.38ms, 342.43ms] 279.91ms  62.53ms 559.81ms         2 [181.74ms, 232.48ms] 207.11ms  25.37ms 414.22ms
                 'fj_short_default':         4 [139.93ms, 237.24ms] 168.78ms  39.71ms 675.12ms         4 [145.97ms, 158.59ms] 150.79ms   4.71ms 603.18ms
             'fj_short_lin_default':         3 [170.59ms, 227.50ms] 190.53ms  26.17ms 571.60ms         3 [160.18ms, 160.92ms] 160.52ms 303.83us 481.55ms
              'fj_short_lin_random':         4 [138.95ms, 211.41ms] 160.79ms  29.41ms 643.16ms         4 [150.08ms, 159.09ms] 155.15ms   3.41ms 620.61ms
                  'fj_short_random':         4 [149.71ms, 210.53ms] 168.79ms  24.47ms 675.15ms         4 [146.56ms, 150.10ms] 148.38ms   1.61ms 593.53ms
                        'fs_random':         1 [665.11ms, 665.11ms] 665.11ms   0.00ns 665.11ms         1 [ 20.78ms,  20.78ms]  20.78ms   0.00ns  20.78ms
                        'fs_random':         1 [701.74ms, 701.74ms] 701.74ms   0.00ns 701.74ms         1 [ 21.73ms,  21.73ms]  21.73ms   0.00ns  21.73ms
                  'fs_random_no_lp':         1 [664.73ms, 664.73ms] 664.73ms   0.00ns 664.73ms         1 [ 20.91ms,  20.91ms]  20.91ms   0.00ns  20.91ms
                  'fs_random_no_lp':         1 [672.92ms, 672.92ms] 672.92ms   0.00ns 672.92ms         1 [ 33.80ms,  33.80ms]  33.80ms   0.00ns  33.80ms
          'fs_random_quick_restart':         1 [655.34ms, 655.34ms] 655.34ms   0.00ns 655.34ms         1 [ 23.45ms,  23.45ms]  23.45ms   0.00ns  23.45ms
          'fs_random_quick_restart':         1 [655.87ms, 655.87ms] 655.87ms   0.00ns 655.87ms         1 [ 21.95ms,  21.95ms]  21.95ms   0.00ns  21.95ms
    'fs_random_quick_restart_no_lp':         1 [655.57ms, 655.57ms] 655.57ms   0.00ns 655.57ms         1 [ 41.42ms,  41.42ms]  41.42ms   0.00ns  41.42ms
                    'graph_arc_lns':      2326 [108.27ms,    7.77s]    3.55s 984.78ms    2.29h      2314 [ 10.00ns, 201.09ms]  66.16ms  39.09ms    2.55m
                    'graph_cst_lns':      2326 [ 27.58ms,    6.37s]    3.55s 980.75ms    2.29h      2311 [ 10.00ns, 198.78ms]  66.53ms  38.70ms    2.56m
                    'graph_dec_lns':      2326 [111.80ms,    6.38s]    3.72s 879.69ms    2.40h      2317 [ 10.00ns, 172.58ms]  70.29ms  35.89ms    2.71m
                    'graph_var_lns':      2327 [ 77.51ms,    6.23s]    3.25s 968.20ms    2.10h      2319 [ 10.00ns, 200.26ms]  65.87ms  39.79ms    2.55m
                   'lb_tree_search':         1 [  59.90m,   59.90m]   59.90m   0.00ns   59.90m         1 [  23.35m,   23.35m]   23.35m   0.00ns   23.35m
                           'max_lp':         1 [  59.90m,   59.90m]   59.90m   0.00ns   59.90m         1 [   5.33m,    5.33m]    5.33m   0.00ns    5.33m
                            'no_lp':         1 [  59.90m,   59.90m]   59.90m   0.00ns   59.90m         1 [   2.84m,    2.84m]    2.84m   0.00ns    2.84m
              'objective_lb_search':         1 [  59.90m,   59.90m]   59.90m   0.00ns   59.90m         1 [   7.05m,    7.05m]    7.05m   0.00ns    7.05m
       'objective_lb_search_max_lp':         1 [  59.90m,   59.90m]   59.90m   0.00ns   59.90m         1 [   9.80m,    9.80m]    9.80m   0.00ns    9.80m
        'objective_lb_search_no_lp':         1 [  59.90m,   59.90m]   59.90m   0.00ns   59.90m         1 [   2.25m,    2.25m]    2.25m   0.00ns    2.25m
  'objective_shaving_search_max_lp':        83 [ 95.49ms,    8.86m]   43.30s    1.10m   59.90m        65 [ 17.99ms,   22.91s]    2.17s    2.99s    2.36m
   'objective_shaving_search_no_lp':        83 [ 56.16ms,    8.86m]   43.30s    1.10m   59.90m        65 [ 17.35ms,   16.25s]    1.62s    2.15s    1.75m
                          'probing':         1 [  59.90m,   59.90m]   59.90m   0.00ns   59.90m         1 [   3.98m,    3.98m]    3.98m   0.00ns    3.98m
                   'probing_max_lp':         1 [  59.91m,   59.91m]   59.91m   0.00ns   59.91m         1 [   9.86m,    9.86m]    9.86m   0.00ns    9.86m
                     'pseudo_costs':         1 [  59.90m,   59.90m]   59.90m   0.00ns   59.90m         1 [   5.23m,    5.23m]    5.23m   0.00ns    5.23m
                    'quick_restart':         1 [  59.90m,   59.90m]   59.90m   0.00ns   59.90m         1 [   7.50m,    7.50m]    7.50m   0.00ns    7.50m
              'quick_restart_no_lp':         1 [  59.90m,   59.90m]   59.90m   0.00ns   59.90m         1 [   3.23m,    3.23m]    3.23m   0.00ns    3.23m
                    'reduced_costs':         1 [  59.90m,   59.90m]   59.90m   0.00ns   59.90m         1 [   6.07m,    6.07m]    6.07m   0.00ns    6.07m
                        'rins/rens':      2327 [772.59us,    3.56s]    1.16s 793.11ms   45.10m      2042 [ 10.00ns, 126.90ms]  66.18ms  41.75ms    2.25m
                      'rnd_cst_lns':      2327 [ 28.41ms,    7.48s]    3.62s 919.20ms    2.34h      2322 [ 10.00ns, 127.72ms]  69.28ms  36.67ms    2.68m
                      'rnd_var_lns':      2327 [ 60.08ms,    6.61s]    3.60s 909.59ms    2.33h      2320 [ 10.00ns, 127.81ms]  67.94ms  37.39ms    2.63m
                     'violation_ls':      2327 [  3.43ms, 886.18ms] 257.54ms 122.38ms    9.99m      2327 [710.00ns, 557.72ms] 209.78ms 111.74ms    8.14m
                     'violation_ls':      2327 [  3.51ms, 526.92ms] 233.06ms  85.02ms    9.04m      2327 [  1.63us, 481.97ms] 186.49ms  76.56ms    7.23m
                     'violation_ls':      2327 [  3.60ms, 614.51ms] 228.06ms  96.09ms    8.84m      2327 [500.00ns, 523.42ms] 189.40ms  87.88ms    7.35m

Search stats                         Bools  Conflicts  Branches  Restarts   BoolPropag  IntegerPropag
                           'core':   7'400    160'487   467'336    37'076  467'641'142    775'306'379
                     'default_lp':   1'373     58'420   417'666   105'332   11'123'170    577'845'512
                      'fs_random':     326          0       654       652           18         79'891
                      'fs_random':     327          0       654       652           90         85'285
                'fs_random_no_lp':     326         25       945       652          457        208'252
                'fs_random_no_lp':     365          0       923       653          112        169'419
        'fs_random_quick_restart':     326          0       654       652           18         79'748
        'fs_random_quick_restart':     326          0       654       652           18         79'827
  'fs_random_quick_restart_no_lp':     326         10     1'672     1'135           56        240'344
                 'lb_tree_search':     326        464   705'571   111'966    1'833'440    438'638'043
                         'max_lp':     363     59'006   648'753   209'454    4'836'596    686'902'430
                          'no_lp':   2'741     86'457   364'797    54'002   34'565'206    706'473'054
            'objective_lb_search':     485     22'390   204'865    42'223    3'982'160    446'349'570
     'objective_lb_search_max_lp':     493     18'671   365'899   107'721    4'149'920    510'409'713
      'objective_lb_search_no_lp':     695     52'994   135'634    18'958    6'620'548    458'265'739
                        'probing':   2'288      1'480     3'096     3'096      325'202      4'663'320
                 'probing_max_lp':     848         88     1'608     1'608       41'035        963'496
                   'pseudo_costs':     395     66'967   681'940   210'507    4'863'136    696'226'266
                  'quick_restart':   4'700     16'052   847'106    84'192   40'090'007    434'396'202
            'quick_restart_no_lp':   7'168     80'600   896'001    32'785  106'781'601    728'011'812
                  'reduced_costs':  17'742     88'003   951'590    53'133  205'242'188    693'533'867

SAT stats                           ClassicMinim  LitRemoved  LitLearned  LitForgotten  Subsumed  MClauses  MDecisions  MLitTrue  MSubsumed  MLitRemoved  MReused
                           'core':       149'049     967'027   1'312'827        39'589       683    17'080      84'309         0        443        1'780      227
                     'default_lp':        36'269      79'836   1'371'774       937'062     1'039    44'285     261'507         0        613        2'834    3'822
                      'fs_random':             0           0           0             0         0         0           0         0          0            0        0
                      'fs_random':             0           0           0             0         0         0           0         0          0            0        0
                'fs_random_no_lp':             0           0           0             0         0         0           0         0          0            0        0
                'fs_random_no_lp':             2           2         171             0         0         0           0         0          0            0        0
        'fs_random_quick_restart':             0           0           0             0         0         0           0         0          0            0        0
        'fs_random_quick_restart':             0           0           0             0         0         0           0         0          0            0        0
  'fs_random_quick_restart_no_lp':             0           0          30             0         0         0           0         0          0            0        0
                 'lb_tree_search':             0           0       1'544             0         0    41'624     223'680         0        105          424    2'597
                         'max_lp':        38'319      96'427   1'498'098       983'116     1'281    90'294     506'854         0        564        2'462    5'462
                          'no_lp':        69'438     297'967   2'010'763     1'612'986       649    16'225     101'385         0        448        2'317    1'755
            'objective_lb_search':        17'837      57'548     182'725        14'666       649     9'978     129'173         0      2'742       18'785    2'480
     'objective_lb_search_max_lp':        13'035      32'242     170'479         6'623       732    28'945     240'518         8      1'522       10'259    5'571
      'objective_lb_search_no_lp':        41'074     117'986     501'362        74'178     1'239     4'430      45'811         0      1'958       13'695      835
                        'probing':             0           0       1'480             0         0         0           0         0          0            0        0
                 'probing_max_lp':             0           0          88             0         0         0           0         0          0            0        0
                   'pseudo_costs':        45'050     122'421   1'281'179       944'708     2'311    90'634     502'083         0        318        1'323    7'081
                  'quick_restart':        10'651      40'209     297'679        98'963       402    28'515     270'556         3      1'466       10'857    5'008
            'quick_restart_no_lp':        61'254     327'437   1'729'951     1'325'810     1'085     9'936      92'554        15      3'553       26'159    1'589
                  'reduced_costs':        65'454     293'162   1'772'325     1'406'440     1'434    17'180     142'214        40      2'100       11'583    4'313

Lp stats                         Component  Iterations  AddedCuts  OPTIMAL  DUAL_F.  DUAL_U.
                  'default_lp':          1     888'313     75'442   96'647       10        5
                   'fs_random':          1       1'814        863       10        0        0
                   'fs_random':          1       1'834        870       11        0        0
     'fs_random_quick_restart':          1       1'902        853       11        1        0
     'fs_random_quick_restart':          1       1'932        866       11        1        0
              'lb_tree_search':          1   6'111'225     37'410    7'098  325'411        0
                      'max_lp':          1   1'429'959     79'377   51'305  104'351       25
         'objective_lb_search':          1   2'807'815     47'064   62'822      389       32
  'objective_lb_search_max_lp':          1   1'900'506     27'579    3'485   28'345        2
                     'probing':          1     247'368     85'873   11'417       47        0
              'probing_max_lp':          1     216'568     88'493    6'787      353        0
                'pseudo_costs':          1   1'405'481    118'929   65'363   94'896       21
               'quick_restart':          1   2'797'718    124'912  102'430      342        3
               'reduced_costs':          1   1'356'256    126'610  101'016   91'873        9

Lp dimension                                                                        Final dimension of first component
                  'default_lp':  2586 rows, 2152 columns, 12949 entries with magnitude in [1.096080e-03, 1.000000e+00]
                   'fs_random':   1029 rows, 2152 columns, 5880 entries with magnitude in [2.857143e-02, 1.000000e+00]
                   'fs_random':   1029 rows, 2152 columns, 5880 entries with magnitude in [2.857143e-02, 1.000000e+00]
     'fs_random_quick_restart':   1079 rows, 2152 columns, 6093 entries with magnitude in [2.857143e-02, 1.000000e+00]
     'fs_random_quick_restart':   1079 rows, 2152 columns, 6096 entries with magnitude in [2.857143e-02, 1.000000e+00]
              'lb_tree_search':  5017 rows, 2202 columns, 22362 entries with magnitude in [2.497397e-03, 1.000000e+00]
                      'max_lp':  2546 rows, 2202 columns, 12148 entries with magnitude in [4.082037e-03, 1.000000e+00]
         'objective_lb_search':  3522 rows, 2152 columns, 16820 entries with magnitude in [1.855454e-03, 1.000000e+00]
  'objective_lb_search_max_lp':  5154 rows, 2202 columns, 23469 entries with magnitude in [1.258855e-03, 1.000000e+00]
                     'probing':  1904 rows, 2152 columns, 10111 entries with magnitude in [1.274874e-02, 1.000000e+00]
              'probing_max_lp':  3029 rows, 2202 columns, 28342 entries with magnitude in [6.246574e-04, 1.000000e+00]
                'pseudo_costs':  2267 rows, 2202 columns, 10939 entries with magnitude in [5.827956e-03, 1.000000e+00]
               'quick_restart':  3045 rows, 2152 columns, 14893 entries with magnitude in [9.337068e-04, 1.000000e+00]
               'reduced_costs':  3129 rows, 2202 columns, 15011 entries with magnitude in [1.404305e-03, 1.000000e+00]

Lp debug                         CutPropag  CutEqPropag   Adjust  Overflow          Bad  BadScaling
                  'default_lp':          4           46    9'498         0    2'749'685           0
                   'fs_random':          0            0        0         0        6'112           0
                   'fs_random':          0            0        0         0        6'215           0
     'fs_random_quick_restart':          0            0        0         0        6'129           0
     'fs_random_quick_restart':          0            0        0         0        6'235           0
              'lb_tree_search':         39            3  205'045         0    2'397'243           0
                      'max_lp':         42           21   27'933         0    2'604'738           0
         'objective_lb_search':          6           21   28'598         0    3'361'922           0
  'objective_lb_search_max_lp':         31           10   23'844         0    1'291'367           0
                     'probing':         57          609   10'992         0  105'611'124           0
              'probing_max_lp':        134          139    7'132         0   48'112'328           0
                'pseudo_costs':         50           22   35'002         0    4'131'031           0
               'quick_restart':         11          139   50'018         0   10'903'923           0
               'reduced_costs':         78           48   54'472         0    3'932'765           0

Lp pool                          Constraints  Updates  Simplif  Merged  Shortened    Split  Strenghtened        Cuts/Call
                  'default_lp':       11'626      498    5'550      55          0   11'356        14'045   75'442/195'404
                   'fs_random':        3'102        0        0       0          0        0           121        863/2'208
                   'fs_random':        3'109        0        0       0          0        0           119        870/2'235
     'fs_random_quick_restart':        3'092        0        0       0          0        0           119        853/2'243
     'fs_random_quick_restart':        3'105        0        0       0          0        0           119        866/2'253
              'lb_tree_search':       36'624      286   51'893       4          0    6'376        63'800    37'410/83'742
                      'max_lp':       36'577      343   39'732      18          0   11'683        62'631   79'377/170'181
         'objective_lb_search':       11'285      635    4'565      18          0   19'355        10'915   47'064/188'235
  'objective_lb_search_max_lp':       36'794      139   46'548       3          0    3'702        53'762    27'579/61'673
                     'probing':       12'108    7'518    5'078       4          0  464'054        22'872   85'873/167'116
              'probing_max_lp':       36'705    5'689   37'763       6          0   12'634        62'743   88'493/225'403
                'pseudo_costs':       37'117      583   50'541      30          0   21'693        84'299  118'929/238'627
               'quick_restart':       12'134    1'785    5'896      17          0  132'133        24'349  124'912/358'460
               'reduced_costs':       36'791      539   41'324      37          0   18'411        71'342  126'610/283'666

Lp Cut            fs_ran  fs_ran  fs_ran  fs_ran  defaul  max_lp  quick_  reduce  pseudo  lb_tre  probin  object  probin  object
          CG_FF:      63      63      63      63   4'610   3'380   2'541   7'503   5'412     759   2'519   1'202     934   1'110
           CG_K:      37      37      37      37   3'176   2'837   1'176   7'467   4'744     369   1'198     749     494     951
          CG_KL:       -       -       -       -       2       -       1       3       2       1       2       5       -       -
           CG_R:      29      29      29      29   2'380   1'655   2'128   3'546   3'045     376   2'959     503     527     425
          CG_RB:      29      29      29      29  10'247   9'778   9'575  16'431  15'563   3'005  12'707   3'871   3'906   3'369
         CG_RBP:       4       4       4       4     997     817     824   1'868   1'456     155   1'008     284     286     214
         Clique:       -       -       -       -       -   1'064       -   2'713   1'873     314       -       -     428     300
             IB:     128     128     132     124  25'819  13'264  58'573  25'040  20'801   4'498   9'263  19'706   2'825   3'226
       MIR_1_FF:     257     257     256     258   3'173   2'967   4'271   5'152   4'902   1'200   5'129   1'825   2'709   1'383
        MIR_1_K:      53      53      53      53     539     415     485     886     839     113     398     231     209     169
       MIR_1_KL:       -       -       -       -      43      39      52      30      53       3      13      13      18       3
        MIR_1_R:      56      56      56      56     854     426     911   1'041     819     119   1'814     327     404     225
       MIR_1_RB:      61      59      59      60   5'745   9'851  10'074  12'334  13'668   4'991   8'201   3'898   8'744   3'267
      MIR_1_RBP:       -       -       -       -     660   3'585     787   3'903   4'687   1'360     576     419   1'991     827
      MIR_1_RLT:       -       -       -       -       -       9       -      12      19       4       -       -       8       -
       MIR_2_FF:      38      42      35      35   1'643   1'522   1'949   2'876   2'606     598   1'776     785   1'226     774
        MIR_2_K:      24      24      23      24     363     314     279     699     577      87     283     137     177     152
       MIR_2_KL:       -       -       -       -      20      50      86      47      91       9      69      19      15       6
        MIR_2_R:       4       6       7       6     424     542     526     741     737     601   1'191     191   1'706     359
       MIR_2_RB:      27      36      25      22   2'847   4'651   5'890   6'076   6'591   2'343   4'979   2'107   4'291   1'725
      MIR_2_RBP:       -       -       1       -     467   1'525     603   1'823   2'112     539     421     272     923     412
       MIR_3_FF:      11      11      13      15     742     846   1'019   1'568   1'446     401     787     430     649     369
        MIR_3_K:       1       1       2       2     212     225     257     460     413      75     199     102     151      93
       MIR_3_KL:       -       -       -       -      43      58     214     105     109       7     253      57      27       6
        MIR_3_R:       1       1       1       2     246     406     439     523     627     574     707     202   1'225     266
       MIR_3_RB:       9       6      12      10   1'461   2'419   3'248   3'167   3'377   1'318   2'807   1'198   2'219     885
      MIR_3_RBP:       -       -       -       -     243     813     356     975   1'049     295     294     159     447     205
       MIR_4_FF:       3       2       1       7     456     423     551     727     758     199     454     241     341     172
        MIR_4_K:       1       2       2       4     162     120     231     284     288      49     187      76      90      58
       MIR_4_KL:       -       -       -       -      59      56     246     123     110      13     344      81      23       9
        MIR_4_R:       -       -       -       -     152     185     293     236     348     275     407     106     558     151
       MIR_4_RB:       3       6       5       7     928   1'136   1'711   1'549   1'743     658   1'572     701   1'056     440
      MIR_4_RBP:       -       -       -       -     190     329     210     434     542     147     199     110     203      89
       MIR_5_FF:       -       -       -       1     340     245     381     469     417     134     310     229     216     106
        MIR_5_K:       -       1       -       -     172     140     198     275     303      44     210     114      72      36
       MIR_5_KL:       -       -       -       -      60      58     194     113     101      11     284      76      28      10
        MIR_5_R:       -       -       -       -     134     129     194     201     221     142     218      90     335      61
       MIR_5_RB:       1       2       -       1     576     669   1'071     862   1'066     346   1'030     516     613     241
      MIR_5_RBP:       -       -       -       -      92     144     157     241     283      67     149      76      95      36
       MIR_6_FF:       -       -       -       -     215     164     226     287     292      73     220     146     101      49
        MIR_6_K:       -       -       -       -     123     108     132     184     205      23     164      95      33      25
       MIR_6_KL:       -       -       -       -      38      24     138     109      74      10     276      49      24      12
        MIR_6_R:       -       -       -       -     100      86     111     126     173      65     140      93     156      39
       MIR_6_RB:       1       -       2       1     343     382     596     542     698     170     747     320     327     153
      MIR_6_RBP:       -       -       -       -      56     110      93     186     224      38     158      53      87      31
   ZERO_HALF_FF:       4       6       9       6     696     977     595   1'579   1'437     388     584     325     567     341
    ZERO_HALF_K:       3       2       5       2     240     382     116   1'020     669      51      98      59     102     145
   ZERO_HALF_KL:       -       -       -       -       -       -       -       -       -       -       -       1       -       -
    ZERO_HALF_R:       2       -       3       1   1'883   5'202   8'438   4'320   5'198   8'524  14'749   3'699  40'900   3'423
   ZERO_HALF_RB:       2       3       6       4   1'207   3'697   2'334   4'303   4'600   1'419   2'807     878   3'711     986
  ZERO_HALF_RBP:       1       -       -       -     264   1'153     432   1'451   1'561     450   1'013     238   2'316     245

LNS stats           Improv/Calls  Closed  Difficulty  TimeLimit
  'graph_arc_lns':      716/2325     50%        0.99       0.10
  'graph_cst_lns':      648/2315     50%        0.99       0.10
  'graph_dec_lns':      688/2323     50%        1.00       0.10
  'graph_var_lns':      499/2324     50%        0.99       0.10
      'rins/rens':      325/2183     50%        0.87       0.10
    'rnd_cst_lns':      647/2323     50%        0.99       0.10
    'rnd_var_lns':      683/2324     50%        1.00       0.10

LS stats                   Batches  Restarts    LinMoves   GenMoves  CompoundMoves  WeightUpdates
       'fj_long_default':        2         1      19'923          0              0             77
   'fj_long_lin_default':        4         1           0      7'044          1'491              1
        'fj_long_random':        2         1      19'923          0              0             77
      'fj_short_default':        4         1           0      5'500            857              0
  'fj_short_lin_default':        3         1           0      4'928            746              0
   'fj_short_lin_random':        4         1           0      5'563            883              0
       'fj_short_random':        4         1           0      7'262          1'507              1
          'violation_ls':    2'327         0  12'126'317  2'206'840        113'104        899'371
          'violation_ls':    2'327         0   8'381'297  3'654'033        236'467        510'936
          'violation_ls':    2'327         0   9'944'810  2'157'156        139'977        130'864

Solutions (139)           Num      Rank
      'fs_random_no_lp':    1     [1,1]
        'graph_arc_lns':    3  [30,118]
        'graph_cst_lns':    4  [52,122]
        'graph_dec_lns':    9  [54,135]
        'graph_var_lns':    9  [29,137]
                'no_lp':    4   [24,40]
        'quick_restart':    1   [42,42]
  'quick_restart_no_lp':    8  [39,131]
          'rins_lp_lns':   13  [25,139]
        'rins_pump_lns':    3  [97,127]
          'rnd_cst_lns':    6  [41,138]
          'rnd_var_lns':    5   [19,93]
         'violation_ls':   73   [2,134]

Objective bounds                     Num
                  'initial_domain':    1
             'objective_lb_search':   41
      'objective_lb_search_max_lp':    7
       'objective_lb_search_no_lp':   30
  'objective_shaving_search_no_lp':    5

Solution repositories     Added  Queried  Ignored  Synchro
  'feasible solutions':  12'181   41'324        0   11'882
        'lp solutions':   4'104    1'179        0    3'975
                'pump':  16'270    1'148

Improving bounds shared            Num
                        'core':      5
                  'default_lp':     43
              'lb_tree_search':     58
                      'max_lp':    350
                       'no_lp':     92
         'objective_lb_search':      8
  'objective_lb_search_max_lp':     34
                     'probing':  6'949
              'probing_max_lp':    229
                'pseudo_costs':    277
               'quick_restart':    178
         'quick_restart_no_lp':    389
               'reduced_costs':    233

Clauses shared                      Num
                           'core':    7
                     'default_lp':   46
                'fs_random_no_lp':    1
  'fs_random_quick_restart_no_lp':    3
                 'lb_tree_search':    9
                         'max_lp':   22
                          'no_lp':   11
            'objective_lb_search':    5
     'objective_lb_search_max_lp':    5
      'objective_lb_search_no_lp':    9
                   'pseudo_costs':   52
                  'quick_restart':   33
            'quick_restart_no_lp':   95
                  'reduced_costs':    1

CpSolverResponse summary:
status: FEASIBLE
objective: 3597
best_bound: 1068
integers: 2153
booleans: 326
conflicts: 0
branches: 654
propagations: 18
integer_propagations: 79827
restarts: 652
lp_iterations: 1902
walltime: 3600.95
usertime: 3600.95
deterministic_time: 9305.94
gap_integral: 73087.9
solution_fingerprint: 0x347b069b7e198845


--- Simulation Gantt  partir du modle mathmatique ---
{'big':0, 'due_date':128, 'pos_time':5, 'status':0, 'blocked':0, 'operations':["{'type':0, 'processing_time':12}", "{'type':1, 'processing_time':39}"]}
{'big':1, 'due_date':160, 'pos_time':5, 'status':0, 'blocked':0, 'operations':["{'type':1, 'processing_time':11}", "{'type':0, 'processing_time':38}"]}
{'big':1, 'due_date':223, 'pos_time':5, 'status':0, 'blocked':0, 'operations':["{'type':1, 'processing_time':39}", "{'type':0, 'processing_time':35}"]}
{'big':1, 'due_date':118, 'pos_time':5, 'status':0, 'blocked':0, 'operations':["{'type':1, 'processing_time':56}"]}
{'big':1, 'due_date':120, 'pos_time':5, 'status':0, 'blocked':0, 'operations':["{'type':0, 'processing_time':22}", "{'type':1, 'processing_time':27}"]}
{'big':1, 'due_date':151, 'pos_time':5, 'status':0, 'blocked':0, 'operations':["{'type':1, 'processing_time':25}", "{'type':0, 'processing_time':12}"]}
{'big':0, 'due_date':251, 'pos_time':5, 'status':0, 'blocked':0, 'operations':["{'type':0, 'processing_time':59}", "{'type':1, 'processing_time':57}"]}
{'big':0, 'due_date':153, 'pos_time':5, 'status':0, 'blocked':0, 'operations':["{'type':0, 'processing_time':25}", "{'type':1, 'processing_time':18}"]}
{'big':1, 'due_date':108, 'pos_time':5, 'status':0, 'blocked':0, 'operations':["{'type':1, 'processing_time':37}"]}
{'big':1, 'due_date':160, 'pos_time':5, 'status':0, 'blocked':0, 'operations':["{'type':1, 'processing_time':20}", "{'type':0, 'processing_time':53}"]}
{'big':1, 'due_date':110, 'pos_time':5, 'status':0, 'blocked':0, 'operations':["{'type':0, 'processing_time':57}", "{'type':1, 'processing_time':25}"]}
{'big':1, 'due_date':117, 'pos_time':5, 'status':0, 'blocked':0, 'operations':["{'type':0, 'processing_time':17}"]}
{'big':1, 'due_date':172, 'pos_time':5, 'status':0, 'blocked':0, 'operations':["{'type':1, 'processing_time':22}", "{'type':0, 'processing_time':29}"]}
{'big':1, 'due_date':86, 'pos_time':5, 'status':0, 'blocked':0, 'operations':["{'type':1, 'processing_time':11}"]}
{'big':0, 'due_date':187, 'pos_time':5, 'status':0, 'blocked':0, 'operations':["{'type':0, 'processing_time':29}"]}
