created virtual environment CPython3.12.4.final.0-64 in 11269ms
  creator CPython3Posix(dest=/localscratch/aneumann.63393162.0/env, clear=False, no_vcs_ignore=False, global=False)
  seeder FromAppData(download=False, pip=bundle, via=copy, app_data_dir=/home/aneumann/.local/share/virtualenv)
    added seed packages: pip==25.1.1
  activators BashActivator,CShellActivator,FishActivator,NushellActivator,PowerShellActivator,PythonActivator
Looking in links: /cvmfs/soft.computecanada.ca/custom/python/wheelhouse/gentoo2023/x86-64-v3, /cvmfs/soft.computecanada.ca/custom/python/wheelhouse/gentoo2023/generic, /cvmfs/soft.computecanada.ca/custom/python/wheelhouse/generic
Requirement already satisfied: pip in /localscratch/aneumann.63393162.0/env/lib/python3.12/site-packages (25.1.1)
Looking in links: /cvmfs/soft.computecanada.ca/custom/python/wheelhouse/gentoo2023/x86-64-v3, /cvmfs/soft.computecanada.ca/custom/python/wheelhouse/gentoo2023/generic, /cvmfs/soft.computecanada.ca/custom/python/wheelhouse/generic
ERROR: protobuf-5.28.3-cp38-abi3-manylinux2014_x86_64.whl is not a supported wheel on this platform.
Looking in links: /cvmfs/soft.computecanada.ca/custom/python/wheelhouse/gentoo2023/x86-64-v3, /cvmfs/soft.computecanada.ca/custom/python/wheelhouse/gentoo2023/generic, /cvmfs/soft.computecanada.ca/custom/python/wheelhouse/generic
Processing /home/aneumann/projects/def-adhaj/aneumann/GNRS/wheels/immutabledict-4.2.0-py3-none-any.whl
Installing collected packages: immutabledict
Successfully installed immutabledict-4.2.0
Looking in links: /cvmfs/soft.computecanada.ca/custom/python/wheelhouse/gentoo2023/x86-64-v3, /cvmfs/soft.computecanada.ca/custom/python/wheelhouse/gentoo2023/generic, /cvmfs/soft.computecanada.ca/custom/python/wheelhouse/generic
Processing /cvmfs/soft.computecanada.ca/custom/python/wheelhouse/generic/ortools-9.10.4067+computecanada-cp312-cp312-linux_x86_64.whl (from -r /home/aneumann/projects/def-adhaj/aneumann/GNRS/requirements/or.txt (line 1))
Processing /cvmfs/soft.computecanada.ca/custom/python/wheelhouse/gentoo2023/x86-64-v3/matplotlib-3.10.0+computecanada-cp312-cp312-linux_x86_64.whl (from -r /home/aneumann/projects/def-adhaj/aneumann/GNRS/requirements/or.txt (line 2))
Processing /cvmfs/soft.computecanada.ca/custom/python/wheelhouse/gentoo2023/x86-64-v3/pandas-2.2.3+computecanada-cp312-cp312-linux_x86_64.whl (from -r /home/aneumann/projects/def-adhaj/aneumann/GNRS/requirements/or.txt (line 3))
Processing /cvmfs/soft.computecanada.ca/custom/python/wheelhouse/generic/absl_py-2.2.2+computecanada-py3-none-any.whl (from ortools<9.11,>=9.10->-r /home/aneumann/projects/def-adhaj/aneumann/GNRS/requirements/or.txt (line 1))
Processing /cvmfs/soft.computecanada.ca/custom/python/wheelhouse/gentoo2023/generic/numpy-2.2.2+computecanada-cp312-cp312-linux_x86_64.whl (from ortools<9.11,>=9.10->-r /home/aneumann/projects/def-adhaj/aneumann/GNRS/requirements/or.txt (line 1))
Processing /cvmfs/soft.computecanada.ca/custom/python/wheelhouse/gentoo2023/x86-64-v3/protobuf-6.30.2+computecanada-cp312-cp312-linux_x86_64.whl (from ortools<9.11,>=9.10->-r /home/aneumann/projects/def-adhaj/aneumann/GNRS/requirements/or.txt (line 1))
Requirement already satisfied: immutabledict>=3.0.0 in /localscratch/aneumann.63393162.0/env/lib/python3.12/site-packages (from ortools<9.11,>=9.10->-r /home/aneumann/projects/def-adhaj/aneumann/GNRS/requirements/or.txt (line 1)) (4.2.0)
Processing /cvmfs/soft.computecanada.ca/custom/python/wheelhouse/gentoo2023/generic/contourpy-1.3.1+computecanada-cp312-cp312-linux_x86_64.whl (from matplotlib->-r /home/aneumann/projects/def-adhaj/aneumann/GNRS/requirements/or.txt (line 2))
Processing /cvmfs/soft.computecanada.ca/custom/python/wheelhouse/generic/cycler-0.12.1+computecanada-py3-none-any.whl (from matplotlib->-r /home/aneumann/projects/def-adhaj/aneumann/GNRS/requirements/or.txt (line 2))
Processing /cvmfs/soft.computecanada.ca/custom/python/wheelhouse/generic/fonttools-4.58.2+computecanada-cp312-cp312-linux_x86_64.whl (from matplotlib->-r /home/aneumann/projects/def-adhaj/aneumann/GNRS/requirements/or.txt (line 2))
Processing /cvmfs/soft.computecanada.ca/custom/python/wheelhouse/gentoo2023/x86-64-v3/kiwisolver-1.4.8+computecanada-cp312-cp312-linux_x86_64.whl (from matplotlib->-r /home/aneumann/projects/def-adhaj/aneumann/GNRS/requirements/or.txt (line 2))
Processing /cvmfs/soft.computecanada.ca/custom/python/wheelhouse/generic/packaging-25.0+computecanada-py3-none-any.whl (from matplotlib->-r /home/aneumann/projects/def-adhaj/aneumann/GNRS/requirements/or.txt (line 2))
Processing /cvmfs/soft.computecanada.ca/custom/python/wheelhouse/gentoo2023/x86-64-v3/pillow-11.1.0+computecanada-cp312-cp312-linux_x86_64.whl (from matplotlib->-r /home/aneumann/projects/def-adhaj/aneumann/GNRS/requirements/or.txt (line 2))
Processing /cvmfs/soft.computecanada.ca/custom/python/wheelhouse/generic/pyparsing-3.2.1+computecanada-py3-none-any.whl (from matplotlib->-r /home/aneumann/projects/def-adhaj/aneumann/GNRS/requirements/or.txt (line 2))
Processing /cvmfs/soft.computecanada.ca/custom/python/wheelhouse/generic/python_dateutil-2.9.0.post0+computecanada-py2.py3-none-any.whl (from matplotlib->-r /home/aneumann/projects/def-adhaj/aneumann/GNRS/requirements/or.txt (line 2))
Processing /cvmfs/soft.computecanada.ca/custom/python/wheelhouse/generic/pytz-2025.2+computecanada-py2.py3-none-any.whl (from pandas->-r /home/aneumann/projects/def-adhaj/aneumann/GNRS/requirements/or.txt (line 3))
Processing /cvmfs/soft.computecanada.ca/custom/python/wheelhouse/generic/tzdata-2025.2+computecanada-py2.py3-none-any.whl (from pandas->-r /home/aneumann/projects/def-adhaj/aneumann/GNRS/requirements/or.txt (line 3))
Processing /cvmfs/soft.computecanada.ca/custom/python/wheelhouse/generic/six-1.17.0+computecanada-py2.py3-none-any.whl (from python-dateutil>=2.7->matplotlib->-r /home/aneumann/projects/def-adhaj/aneumann/GNRS/requirements/or.txt (line 2))
Installing collected packages: pytz, tzdata, six, pyparsing, protobuf, pillow, packaging, numpy, kiwisolver, fonttools, cycler, absl-py, python-dateutil, contourpy, pandas, matplotlib, ortools

Successfully installed absl-py-2.2.2+computecanada contourpy-1.3.1+computecanada cycler-0.12.1+computecanada fonttools-4.58.2+computecanada kiwisolver-1.4.8+computecanada matplotlib-3.10.0+computecanada numpy-2.2.2+computecanada ortools-9.10.4067+computecanada packaging-25.0+computecanada pandas-2.2.3+computecanada pillow-11.1.0+computecanada protobuf-6.30.2+computecanada pyparsing-3.2.1+computecanada python-dateutil-2.9.0.post0+computecanada pytz-2025.2+computecanada six-1.17.0+computecanada tzdata-2025.2+computecanada

Starting CP-SAT solver v9.10.4067
Parameters: max_time_in_seconds: 3600 max_memory_in_mb: 12000 log_search_progress: true enumerate_all_solutions: false absolute_gap_limit: 0 relative_gap_limit: 0
Setting number of workers to 48

Initial optimization model '': (model_fingerprint: 0xd026e42c5e3b2123)
#Variables: 166 (#ints: 6 in objective)
  - 107 Booleans in [0,1]
  - 59 in [0,350]
#kLinear1: 26
#kLinear2: 211
#kLinear3: 79
#kLinearN: 675 (#terms: 6'863)

Starting presolve at 0.00s
  2.50e-04s  0.00e+00d  [DetectDominanceRelations] 
  8.72e-03s  0.00e+00d  [PresolveToFixPoint] #num_loops=6 #num_dual_strengthening=3 
  1.56e-05s  0.00e+00d  [ExtractEncodingFromLinear] #potential_supersets=2 
[Symmetry] Graph for symmetry has 867 nodes and 3'697 arcs.
[Symmetry] Symmetry computation done. time: 0.00052153 dtime: 0.00037522
[Symmetry] #generators: 1, average support size: 14
[Symmetry] The model contains 111 duplicate constraints !
[Symmetry] 7 orbits with sizes: 2,2,2,2,2,2,2
[Symmetry] Num fixable by intersecting at_most_one with orbits: 1 largest_orbit: 2
  1.74e-03s  1.72e-04d  [Probe] #probed=130 #fixed_bools=2 #new_bounds=7 #equiv=1 
  2.44e-05s  0.00e+00d  [MaxClique] Merged 4(8 literals) into 2(4 literals) at_most_ones. 
  2.37e-04s  0.00e+00d  [DetectDominanceRelations] 
  3.13e-03s  0.00e+00d  [PresolveToFixPoint] #num_loops=4 #num_dual_strengthening=3 
  8.05e-04s  0.00e+00d  [ProcessAtMostOneAndLinear] 
  5.95e-04s  0.00e+00d  [DetectDuplicateConstraints] #duplicates=123 #without_enforcements=48 
  2.37e-04s  8.07e-06d  [DetectDominatedLinearConstraints] #relevant_constraints=357 #num_inclusions=180 #num_redundant=2 
  1.21e-04s  0.00e+00d  [DetectDifferentVariables] #different=16 
  8.54e-05s  2.30e-06d  [ProcessSetPPC] #relevant_constraints=163 
  1.01e-05s  0.00e+00d  [FindAlmostIdenticalLinearConstraints] 
  2.39e-05s  7.88e-06d  [FindBigAtMostOneAndLinearOverlap] 
  5.87e-04s  1.77e-04d  [FindBigVerticalLinearOverlap] #blocks=5 #saved_nz=226 
  3.85e-05s  6.31e-06d  [FindBigHorizontalLinearOverlap] #linears=153 
  4.81e-06s  0.00e+00d  [MergeClauses] 
  2.26e-04s  0.00e+00d  [DetectDominanceRelations] 
  2.67e-03s  0.00e+00d  [PresolveToFixPoint] #num_loops=2 #num_dual_strengthening=1 
  2.22e-04s  0.00e+00d  [DetectDominanceRelations] 
  1.95e-03s  0.00e+00d  [PresolveToFixPoint] #num_loops=1 #num_dual_strengthening=1 
[Symmetry] Graph for symmetry has 729 nodes and 3'014 arcs.
[Symmetry] Symmetry computation done. time: 0.000157996 dtime: 0.0001876
  1.49e-03s  1.56e-04d  [Probe] #probed=126 #new_bounds=15 
  5.48e-06s  0.00e+00d  [MaxClique] 
  2.30e-04s  0.00e+00d  [DetectDominanceRelations] 
  3.63e-03s  0.00e+00d  [PresolveToFixPoint] #num_loops=4 #num_dual_strengthening=3 
  6.08e-04s  0.00e+00d  [ProcessAtMostOneAndLinear] 
  4.73e-04s  0.00e+00d  [DetectDuplicateConstraints] #without_enforcements=64 
  1.51e-04s  5.02e-06d  [DetectDominatedLinearConstraints] #relevant_constraints=262 #num_inclusions=36 
  1.09e-04s  0.00e+00d  [DetectDifferentVariables] #different=18 
  6.73e-05s  1.71e-06d  [ProcessSetPPC] #relevant_constraints=131 
  1.15e-05s  0.00e+00d  [FindAlmostIdenticalLinearConstraints] 
  1.98e-05s  7.53e-06d  [FindBigAtMostOneAndLinearOverlap] 
  3.60e-04s  1.47e-04d  [FindBigVerticalLinearOverlap] 
  3.35e-05s  5.54e-06d  [FindBigHorizontalLinearOverlap] #linears=130 
  4.42e-06s  0.00e+00d  [MergeClauses] 
  2.23e-04s  0.00e+00d  [DetectDominanceRelations] 
  1.81e-03s  0.00e+00d  [PresolveToFixPoint] #num_loops=1 #num_dual_strengthening=1 
  2.18e-04s  0.00e+00d  [DetectDominanceRelations] 
  1.80e-03s  0.00e+00d  [PresolveToFixPoint] #num_loops=1 #num_dual_strengthening=1 
[Symmetry] Graph for symmetry has 729 nodes and 3'014 arcs.
[Symmetry] Symmetry computation done. time: 0.000157034 dtime: 0.00018639
  1.42e-03s  1.54e-04d  [Probe] #probed=126 
  5.22e-06s  0.00e+00d  [MaxClique] 
  2.24e-04s  0.00e+00d  [DetectDominanceRelations] 
  1.83e-03s  0.00e+00d  [PresolveToFixPoint] #num_loops=1 #num_dual_strengthening=1 
  6.12e-04s  0.00e+00d  [ProcessAtMostOneAndLinear] 
  4.65e-04s  0.00e+00d  [DetectDuplicateConstraints] #without_enforcements=64 
  1.51e-04s  5.02e-06d  [DetectDominatedLinearConstraints] #relevant_constraints=262 #num_inclusions=36 
  1.08e-04s  0.00e+00d  [DetectDifferentVariables] #different=18 
  6.88e-05s  1.71e-06d  [ProcessSetPPC] #relevant_constraints=131 
  1.15e-05s  0.00e+00d  [FindAlmostIdenticalLinearConstraints] 
  1.96e-05s  7.53e-06d  [FindBigAtMostOneAndLinearOverlap] 
  4.04e-04s  1.47e-04d  [FindBigVerticalLinearOverlap] #blocks=1 #saved_nz=38 
  3.40e-05s  5.33e-06d  [FindBigHorizontalLinearOverlap] #linears=130 
  4.46e-06s  0.00e+00d  [MergeClauses] 
  2.30e-04s  0.00e+00d  [DetectDominanceRelations] 
  2.26e-03s  0.00e+00d  [PresolveToFixPoint] #num_loops=2 #num_dual_strengthening=1 
  2.43e-05s  0.00e+00d  [ExpandObjective] #entries=22 #tight_variables=11 #tight_constraints=5 

Presolve summary:
  - 26 affine relations were detected.
  - rule 'TODO dual: only one blocking constraint?' was applied 442 times.
  - rule 'TODO dual: only one unspecified blocking constraint?' was applied 90 times.
  - rule 'TODO duplicate: identical constraint with different enforcements' was applied 176 times.
  - rule 'affine: new relation' was applied 26 times.
  - rule 'at_most_one: removed literals' was applied 2 times.
  - rule 'at_most_one: size one' was applied 2 times.
  - rule 'at_most_one: transformed into max clique.' was applied 1 time.
  - rule 'deductions: 83 stored' was applied 1 time.
  - rule 'dual: fix variable' was applied 15 times.
  - rule 'dual: reduced domain' was applied 46 times.
  - rule 'duplicate: merged rhs of linear constraint' was applied 16 times.
  - rule 'duplicate: removed constraint' was applied 123 times.
  - rule 'enforcement: false literal' was applied 15 times.
  - rule 'enforcement: true literal' was applied 8 times.
  - rule 'exactly_one: x and not(x)' was applied 1 time.
  - rule 'incompatible linear: add implication' was applied 9 times.
  - rule 'linear inclusion: redundant containing constraint' was applied 2 times.
  - rule 'linear matrix: common vertical rectangle' was applied 6 times.
  - rule 'linear: always true' was applied 363 times.
  - rule 'linear: doubleton free' was applied 7 times.
  - rule 'linear: empty' was applied 20 times.
  - rule 'linear: extracted enforcement literal' was applied 1'197 times.
  - rule 'linear: fixed or dup variables' was applied 689 times.
  - rule 'linear: positive equal one' was applied 2 times.
  - rule 'linear: reduced variable domains' was applied 68 times.
  - rule 'linear: remapped using affine relations' was applied 668 times.
  - rule 'linear: simplified rhs' was applied 1'813 times.
  - rule 'linear: variable substitution 1' was applied 7 times.
  - rule 'linear: variable substitution 3' was applied 1 time.
  - rule 'presolve: 58 unused variables removed.' was applied 1 time.
  - rule 'presolve: iteration' was applied 3 times.
  - rule 'probing: reduced enforced constraint to implication.' was applied 4 times.
  - rule 'symmetry: fixed to false in general orbit' was applied 1 time.

Presolved optimization model '': (model_fingerprint: 0xf97f6dcaa0230161)
#Variables: 80 (#ints: 6 in objective)
  - 30 Booleans in [0,1]
  - 1 in [-291,-49][3,301][353,595]
  - 1 in [-291,-49][3,301][353,651][703,945]
  - 1 in [-2,290]
  - 1 in [-2,301]
  - 1 in [0,177]
  - 1 in [0,211]
  - 4 in [0,232]
  - 2 in [0,239]
  - 1 in [0,246]
  - 1 in [0,255]
  - 1 in [0,273]
  - 1 in [0,288]
  - 3 in [0,292]
  - 1 in [0,293]
  - 3 in [0,298]
  - 1 in [0,303]
  - 1 in [3,291]
  - 1 in [3,295]
  - 1 in [3,296]
  - 1 in [3,301]
  - 1 in [3,306]
  - 1 in [25,318]
  - 1 in [29,317]
  - 1 in [29,317][379,667]
  - 2 in [66,339]
  - 1 in [72,345]
  - 2 in [84,339]
  - 1 in [90,345]
  - 2 in [93,339]
  - 1 in [99,345]
  - 6 in [107,339]
  - 2 in [113,345]
  - 1 in [118,350]
#kExactlyOne: 1 (#literals: 3)
#kLinear2: 205 (#enforced: 172 #multi: 148)
#kLinear3: 82 (#enforced: 68 #multi: 26)
#kLinearN: 148 (#enforced: 116) (#terms: 1'139)

Preloading model.
#Bound   0.04s best:inf   next:[118,1512] initial_domain
[Symmetry] Graph for symmetry has 638 nodes and 2'975 arcs.
[Symmetry] Symmetry computation done. time: 0.000159236 dtime: 0.00017874
#Model   0.05s var:80/80 constraints:436/436

Starting search at 0.05s with 48 workers.
16 full problem subsolvers: [core, default_lp, lb_tree_search, max_lp, no_lp, objective_lb_search, objective_lb_search_max_lp, objective_lb_search_no_lp, objective_shaving_search_max_lp, objective_shaving_search_no_lp, probing, probing_max_lp, pseudo_costs, quick_restart, quick_restart_no_lp, reduced_costs]
30 first solution subsolvers: [fj_long_default(2), fj_long_lin_default, fj_long_lin_perturb, fj_long_lin_random, fj_long_perturb, fj_long_random, fj_short_default(2), fj_short_lin_default(2), fj_short_lin_perturb, fj_short_lin_random, fj_short_perturb, fj_short_random, fs_random(4), fs_random_no_lp(4), fs_random_quick_restart(4), fs_random_quick_restart_no_lp(3)]
13 incomplete subsolvers: [feasibility_pump, graph_arc_lns, graph_cst_lns, graph_dec_lns, graph_var_lns, rins/rens, rnd_cst_lns, rnd_var_lns, violation_ls(5)]
3 helper subsolvers: [neighborhood_helper, synchronization_agent, update_gap_integral]
#1       0.05s best:736   next:[118,735]  no_lp (fixed_bools=0/49)
#Bound   0.05s best:736   next:[119,735]  bool_core (num_cores=1 [size:3 mw:1 d:2] a=4 d=2 fixed=0/37 clauses=5)
#Bound   0.05s best:736   next:[120,735]  bool_core (num_cores=1 [cover] a=4 d=2 fixed=0/42 clauses=7)
#Bound   0.05s best:736   next:[121,735]  bool_core (num_cores=1 [cover] a=4 d=2 fixed=1/47 clauses=11)
#2       0.05s best:537   next:[121,536]  quick_restart_no_lp (fixed_bools=0/55)
#Bound   0.05s best:537   next:[122,536]  bool_core (num_cores=1 [cover] a=4 d=2 fixed=2/52 clauses=17)
#Bound   0.05s best:537   next:[123,536]  bool_core (num_cores=1 [cover] a=4 d=2 fixed=3/57 clauses=25)
#Bound   0.05s best:537   next:[124,536]  bool_core (num_cores=1 [cover] a=4 d=2 fixed=4/62 clauses=35)
#Bound   0.05s best:537   next:[125,536]  bool_core (num_cores=1 [cover] a=4 d=2 fixed=5/67 clauses=47)
#Bound   0.05s best:537   next:[126,536]  bool_core (num_cores=1 [cover] a=4 d=2 fixed=6/72 clauses=62)
#Bound   0.05s best:537   next:[127,536]  bool_core (num_cores=1 [cover] a=4 d=2 fixed=7/77 clauses=79)
#Bound   0.05s best:537   next:[128,536]  bool_core (num_cores=1 [cover] a=4 d=2 fixed=8/82 clauses=98)
#Bound   0.05s best:537   next:[129,536]  bool_core (num_cores=1 [cover] a=4 d=2 fixed=9/87 clauses=119)
#Bound   0.05s best:537   next:[130,536]  bool_core (num_cores=1 [cover] a=4 d=2 fixed=10/92 clauses=142)
#Bound   0.05s best:537   next:[131,536]  bool_core (num_cores=1 [cover] a=4 d=2 fixed=11/97 clauses=167)
#Bound   0.05s best:537   next:[132,536]  bool_core (num_cores=1 [cover] a=4 d=2 fixed=12/102 clauses=194)
#Bound   0.05s best:537   next:[133,536]  bool_core (num_cores=1 [cover] a=4 d=2 fixed=13/107 clauses=222)
#Bound   0.06s best:537   next:[142,536]  objective_lb_search_no_lp
#Bound   0.06s best:537   next:[167,536]  objective_lb_search_no_lp
#3       0.06s best:519   next:[167,518]  quick_restart_no_lp (fixed_bools=0/59)
#4       0.06s best:515   next:[167,514]  quick_restart_no_lp (fixed_bools=0/78)
#5       0.06s best:495   next:[167,494]  quick_restart_no_lp (fixed_bools=0/86)
#Bound   0.06s best:495   next:[250,494]  objective_lb_search_no_lp
#6       0.06s best:494   next:[250,493]  rnd_var_lns (d=0.71 s=43 t=0.10 p=1.00 stall=1 h=auto_l0) [presolve]
#7       0.06s best:493   next:[250,492]  quick_restart_no_lp (fixed_bools=0/98)
#8       0.07s best:492   next:[250,491]  violation_ls(batch:2 #solutions_imported:2 #lin_moves:709 #lin_evals:2'921 #weight_updates:209)
#9       0.07s best:491   next:[250,490]  quick_restart_no_lp (fixed_bools=0/109)
#10      0.07s best:369   next:[250,368]  rins_pump_lns (d=0.50 s=46 t=0.10 p=0.00 stall=0 h=auto_l0)
#Bound   0.07s best:369   next:[262,368]  objective_lb_search_no_lp
#11      0.07s best:368   next:[262,367]  quick_restart_no_lp (fixed_bools=3/123)
#12      0.08s best:367   next:[262,366]  violation_ls(batch:3 #solutions_imported:3 #lin_moves:717 #lin_evals:2'962 #weight_updates:216)
#13      0.09s best:355   next:[262,354]  no_lp (fixed_bools=1/137)
#14      0.09s best:354   next:[262,353]  violation_ls(batch:4 #solutions_imported:4 #lin_moves:717 #lin_evals:2'971 #gen_moves:5 #gen_evals:0 #comp_moves:5 #backtracks:0 #weight_updates:216)
#15      0.09s best:345   next:[262,344]  graph_arc_lns (d=0.81 s=54 t=0.10 p=1.00 stall=0 h=auto_l0)
#Bound   0.10s best:345   next:[270,344]  objective_lb_search_no_lp
#16      0.10s best:338   next:[270,337]  no_lp (fixed_bools=1/147)
#17      0.10s best:333   next:[270,332]  quick_restart_no_lp (fixed_bools=6/161)
#18      0.10s best:328   next:[275,327]  quick_restart_no_lp (fixed_bools=6/163)
#19      0.10s best:323   next:[275,322]  quick_restart_no_lp (fixed_bools=6/164)
#20      0.11s best:318   next:[275,317]  quick_restart_no_lp (fixed_bools=10/170)
#Done    0.15s no_lp
#Done    0.15s core
#Done    0.15s max_lp
#Done    0.15s probing
#Model   0.15s var:63/80 constraints:131/436
#Bound   0.14s best:318   next:[284,317]  objective_lb_search_no_lp [skipped_logs=3]

Task timing                                  n [     min,      max]      avg      dev     time         n [     min,      max]      avg      dev    dtime
                             'core':         1 [100.74ms, 100.74ms] 100.74ms   0.00ns 100.74ms         1 [ 26.96ms,  26.96ms]  26.96ms   0.00ns  26.96ms
                       'default_lp':         1 [101.14ms, 101.14ms] 101.14ms   0.00ns 101.14ms         1 [  5.76ms,   5.76ms]   5.76ms   0.00ns   5.76ms
                 'feasibility_pump':         6 [  1.27ms,  19.53ms]  11.97ms   5.46ms  71.82ms         5 [  1.72ms,   2.06ms]   1.80ms 130.44us   8.98ms
                  'fj_long_default':         0 [  0.00ns,   0.00ns]   0.00ns   0.00ns   0.00ns         0 [  0.00ns,   0.00ns]   0.00ns   0.00ns   0.00ns
                  'fj_long_default':         0 [  0.00ns,   0.00ns]   0.00ns   0.00ns   0.00ns         0 [  0.00ns,   0.00ns]   0.00ns   0.00ns   0.00ns
              'fj_long_lin_default':         0 [  0.00ns,   0.00ns]   0.00ns   0.00ns   0.00ns         0 [  0.00ns,   0.00ns]   0.00ns   0.00ns   0.00ns
              'fj_long_lin_perturb':         0 [  0.00ns,   0.00ns]   0.00ns   0.00ns   0.00ns         0 [  0.00ns,   0.00ns]   0.00ns   0.00ns   0.00ns
               'fj_long_lin_random':         0 [  0.00ns,   0.00ns]   0.00ns   0.00ns   0.00ns         0 [  0.00ns,   0.00ns]   0.00ns   0.00ns   0.00ns
                  'fj_long_perturb':         0 [  0.00ns,   0.00ns]   0.00ns   0.00ns   0.00ns         0 [  0.00ns,   0.00ns]   0.00ns   0.00ns   0.00ns
                   'fj_long_random':         0 [  0.00ns,   0.00ns]   0.00ns   0.00ns   0.00ns         0 [  0.00ns,   0.00ns]   0.00ns   0.00ns   0.00ns
                 'fj_short_default':         0 [  0.00ns,   0.00ns]   0.00ns   0.00ns   0.00ns         0 [  0.00ns,   0.00ns]   0.00ns   0.00ns   0.00ns
                 'fj_short_default':         0 [  0.00ns,   0.00ns]   0.00ns   0.00ns   0.00ns         0 [  0.00ns,   0.00ns]   0.00ns   0.00ns   0.00ns
             'fj_short_lin_default':         0 [  0.00ns,   0.00ns]   0.00ns   0.00ns   0.00ns         0 [  0.00ns,   0.00ns]   0.00ns   0.00ns   0.00ns
             'fj_short_lin_default':         0 [  0.00ns,   0.00ns]   0.00ns   0.00ns   0.00ns         0 [  0.00ns,   0.00ns]   0.00ns   0.00ns   0.00ns
             'fj_short_lin_perturb':         0 [  0.00ns,   0.00ns]   0.00ns   0.00ns   0.00ns         0 [  0.00ns,   0.00ns]   0.00ns   0.00ns   0.00ns
              'fj_short_lin_random':         0 [  0.00ns,   0.00ns]   0.00ns   0.00ns   0.00ns         0 [  0.00ns,   0.00ns]   0.00ns   0.00ns   0.00ns
                 'fj_short_perturb':         0 [  0.00ns,   0.00ns]   0.00ns   0.00ns   0.00ns         0 [  0.00ns,   0.00ns]   0.00ns   0.00ns   0.00ns
                  'fj_short_random':         0 [  0.00ns,   0.00ns]   0.00ns   0.00ns   0.00ns         0 [  0.00ns,   0.00ns]   0.00ns   0.00ns   0.00ns
                        'fs_random':         0 [  0.00ns,   0.00ns]   0.00ns   0.00ns   0.00ns         0 [  0.00ns,   0.00ns]   0.00ns   0.00ns   0.00ns
                        'fs_random':         0 [  0.00ns,   0.00ns]   0.00ns   0.00ns   0.00ns         0 [  0.00ns,   0.00ns]   0.00ns   0.00ns   0.00ns
                        'fs_random':         1 [  2.30ms,   2.30ms]   2.30ms   0.00ns   2.30ms         1 [ 20.00ns,  20.00ns]  20.00ns   0.00ns  20.00ns
                        'fs_random':         1 [  2.57ms,   2.57ms]   2.57ms   0.00ns   2.57ms         1 [ 20.00ns,  20.00ns]  20.00ns   0.00ns  20.00ns
                  'fs_random_no_lp':         0 [  0.00ns,   0.00ns]   0.00ns   0.00ns   0.00ns         0 [  0.00ns,   0.00ns]   0.00ns   0.00ns   0.00ns
                  'fs_random_no_lp':         0 [  0.00ns,   0.00ns]   0.00ns   0.00ns   0.00ns         0 [  0.00ns,   0.00ns]   0.00ns   0.00ns   0.00ns
                  'fs_random_no_lp':         0 [  0.00ns,   0.00ns]   0.00ns   0.00ns   0.00ns         0 [  0.00ns,   0.00ns]   0.00ns   0.00ns   0.00ns
                  'fs_random_no_lp':         1 [  2.00ms,   2.00ms]   2.00ms   0.00ns   2.00ms         0 [  0.00ns,   0.00ns]   0.00ns   0.00ns   0.00ns
          'fs_random_quick_restart':         0 [  0.00ns,   0.00ns]   0.00ns   0.00ns   0.00ns         0 [  0.00ns,   0.00ns]   0.00ns   0.00ns   0.00ns
          'fs_random_quick_restart':         0 [  0.00ns,   0.00ns]   0.00ns   0.00ns   0.00ns         0 [  0.00ns,   0.00ns]   0.00ns   0.00ns   0.00ns
          'fs_random_quick_restart':         1 [  2.59ms,   2.59ms]   2.59ms   0.00ns   2.59ms         1 [ 20.00ns,  20.00ns]  20.00ns   0.00ns  20.00ns
          'fs_random_quick_restart':         1 [  4.23ms,   4.23ms]   4.23ms   0.00ns   4.23ms         1 [ 20.00ns,  20.00ns]  20.00ns   0.00ns  20.00ns
    'fs_random_quick_restart_no_lp':         0 [  0.00ns,   0.00ns]   0.00ns   0.00ns   0.00ns         0 [  0.00ns,   0.00ns]   0.00ns   0.00ns   0.00ns
    'fs_random_quick_restart_no_lp':         0 [  0.00ns,   0.00ns]   0.00ns   0.00ns   0.00ns         0 [  0.00ns,   0.00ns]   0.00ns   0.00ns   0.00ns
    'fs_random_quick_restart_no_lp':         1 [  5.04ms,   5.04ms]   5.04ms   0.00ns   5.04ms         0 [  0.00ns,   0.00ns]   0.00ns   0.00ns   0.00ns
                    'graph_arc_lns':         5 [  1.20ms,  13.56ms]   7.66ms   4.82ms  38.30ms         5 [ 10.00ns, 305.37us] 164.51us 123.07us 822.57us
                    'graph_cst_lns':         5 [474.13us, 603.93us] 515.84us  46.82us   2.58ms         0 [  0.00ns,   0.00ns]   0.00ns   0.00ns   0.00ns
                    'graph_dec_lns':         5 [  1.67ms,  17.04ms]   8.37ms   6.12ms  41.86ms         4 [ 10.00ns, 427.20us] 156.66us 176.14us 626.63us
                    'graph_var_lns':         5 [  1.23ms,  13.62ms]   5.38ms   4.36ms  26.89ms         5 [ 10.00ns, 365.56us]  73.12us 146.22us 365.60us
                   'lb_tree_search':         1 [ 99.47ms,  99.47ms]  99.47ms   0.00ns  99.47ms         1 [  9.30ms,   9.30ms]   9.30ms   0.00ns   9.30ms
                           'max_lp':         1 [100.64ms, 100.64ms] 100.64ms   0.00ns 100.64ms         1 [  7.77ms,   7.77ms]   7.77ms   0.00ns   7.77ms
                            'no_lp':         1 [ 98.33ms,  98.33ms]  98.33ms   0.00ns  98.33ms         1 [ 13.71ms,  13.71ms]  13.71ms   0.00ns  13.71ms
              'objective_lb_search':         1 [ 99.27ms,  99.27ms]  99.27ms   0.00ns  99.27ms         1 [  5.12ms,   5.12ms]   5.12ms   0.00ns   5.12ms
       'objective_lb_search_max_lp':         1 [ 98.80ms,  98.80ms]  98.80ms   0.00ns  98.80ms         1 [ 18.55ms,  18.55ms]  18.55ms   0.00ns  18.55ms
        'objective_lb_search_no_lp':         1 [ 98.42ms,  98.42ms]  98.42ms   0.00ns  98.42ms         1 [ 11.17ms,  11.17ms]  11.17ms   0.00ns  11.17ms
  'objective_shaving_search_max_lp':         6 [  4.30ms,  16.95ms]   9.46ms   4.41ms  56.79ms         3 [121.62us, 364.87us] 243.25us  99.30us 729.74us
   'objective_shaving_search_no_lp':         6 [  1.09ms,  17.02ms]   8.18ms   5.40ms  49.06ms         2 [243.25us, 243.25us] 243.25us   0.00ns 486.49us
                          'probing':         1 [ 99.80ms,  99.80ms]  99.80ms   0.00ns  99.80ms         1 [  2.98ms,   2.98ms]   2.98ms   0.00ns   2.98ms
                   'probing_max_lp':         1 [ 99.34ms,  99.34ms]  99.34ms   0.00ns  99.34ms         1 [  4.85ms,   4.85ms]   4.85ms   0.00ns   4.85ms
                     'pseudo_costs':         1 [100.16ms, 100.16ms] 100.16ms   0.00ns 100.16ms         1 [  9.53ms,   9.53ms]   9.53ms   0.00ns   9.53ms
                    'quick_restart':         1 [100.31ms, 100.31ms] 100.31ms   0.00ns 100.31ms         1 [  5.12ms,   5.12ms]   5.12ms   0.00ns   5.12ms
              'quick_restart_no_lp':         1 [ 99.81ms,  99.81ms]  99.81ms   0.00ns  99.81ms         1 [ 12.87ms,  12.87ms]  12.87ms   0.00ns  12.87ms
                    'reduced_costs':         1 [100.38ms, 100.38ms] 100.38ms   0.00ns 100.38ms         1 [  6.56ms,   6.56ms]   6.56ms   0.00ns   6.56ms
                        'rins/rens':         6 [  4.90ms,  53.58ms]  17.07ms  17.86ms 102.42ms         4 [187.49us,   2.32ms]   1.09ms 903.12us   4.34ms
                      'rnd_cst_lns':         5 [599.60us,   9.10ms]   3.90ms   2.99ms  19.50ms         4 [ 10.00ns, 105.11us]  29.17us  44.09us 116.68us
                      'rnd_var_lns':         6 [  1.21ms,  20.07ms]   8.21ms   7.17ms  49.27ms         4 [ 10.00ns, 502.88us] 180.60us 206.50us 722.38us
                     'violation_ls':         1 [ 92.78ms,  92.78ms]  92.78ms   0.00ns  92.78ms         1 [ 32.22ms,  32.22ms]  32.22ms   0.00ns  32.22ms
                     'violation_ls':         1 [ 94.44ms,  94.44ms]  94.44ms   0.00ns  94.44ms         1 [ 33.19ms,  33.19ms]  33.19ms   0.00ns  33.19ms
                     'violation_ls':         1 [ 94.49ms,  94.49ms]  94.49ms   0.00ns  94.49ms         1 [ 32.74ms,  32.74ms]  32.74ms   0.00ns  32.74ms
                     'violation_ls':         2 [ 23.18ms,  65.21ms]  44.20ms  21.02ms  88.39ms         2 [  8.54ms,  22.64ms]  15.59ms   7.05ms  31.19ms
                     'violation_ls':         5 [177.58us,  53.35ms]  12.12ms  20.76ms  60.61ms         5 [  4.71us,  14.74ms]   3.51ms   5.71ms  17.55ms

Search stats                        Bools  Conflicts  Branches  Restarts  BoolPropag  IntegerPropag
                           'core':    448        223     2'132       804      73'058         65'021
                     'default_lp':     54         26       326       164         425          8'420
                      'fs_random':      0          0         0         0           0              0
                      'fs_random':      0          0         0         0           0              0
                      'fs_random':     30          0         0         0           0              0
                      'fs_random':     30          0         0         0           0              0
                'fs_random_no_lp':      0          0         0         0           0              0
                'fs_random_no_lp':      0          0         0         0           0              0
                'fs_random_no_lp':      0          0         0         0           0              0
                'fs_random_no_lp':     30          0         0         0           0              0
        'fs_random_quick_restart':      0          0         0         0           0              0
        'fs_random_quick_restart':      0          0         0         0           0              0
        'fs_random_quick_restart':     30          0         0         0           0              0
        'fs_random_quick_restart':     30          0         0         0           0              0
  'fs_random_quick_restart_no_lp':      0          0         0         0           0              0
  'fs_random_quick_restart_no_lp':      0          0         0         0           0              0
  'fs_random_quick_restart_no_lp':     30          0         0         0           0              0
                 'lb_tree_search':     30          0        66        60          13            433
                         'max_lp':     30          1        60        60          30            501
                          'no_lp':    150        348     1'642       450      17'959         70'811
            'objective_lb_search':     32         58       198       103         564          8'409
     'objective_lb_search_max_lp':     31         52       122        61         588          6'859
      'objective_lb_search_no_lp':     43        428     1'178       431       5'618         64'325
                        'probing':     33          2        66        66          50            689
                 'probing_max_lp':     32          0        64        64          15            372
                   'pseudo_costs':     55         23       132        61         162          3'617
                  'quick_restart':     49         21       320       197         332          6'088
            'quick_restart_no_lp':    173        314     2'477       564      15'734         67'146
                  'reduced_costs':     85         50       283        61         572          5'040

SAT stats                           ClassicMinim  LitRemoved  LitLearned  LitForgotten  Subsumed  MClauses  MDecisions  MLitTrue  MSubsumed  MLitRemoved  MReused
                           'core':            92         295         447             0         4       292       1'480         0         18           60       14
                     'default_lp':             5          11         141             0         2        12          72         0          2           10        1
                      'fs_random':             0           0           0             0         0         0           0         0          0            0        0
                      'fs_random':             0           0           0             0         0         0           0         0          0            0        0
                      'fs_random':             0           0           0             0         0         0           0         0          0            0        0
                      'fs_random':             0           0           0             0         0         0           0         0          0            0        0
                'fs_random_no_lp':             0           0           0             0         0         0           0         0          0            0        0
                'fs_random_no_lp':             0           0           0             0         0         0           0         0          0            0        0
                'fs_random_no_lp':             0           0           0             0         0         0           0         0          0            0        0
                'fs_random_no_lp':             0           0           0             0         0         0           0         0          0            0        0
        'fs_random_quick_restart':             0           0           0             0         0         0           0         0          0            0        0
        'fs_random_quick_restart':             0           0           0             0         0         0           0         0          0            0        0
        'fs_random_quick_restart':             0           0           0             0         0         0           0         0          0            0        0
        'fs_random_quick_restart':             0           0           0             0         0         0           0         0          0            0        0
  'fs_random_quick_restart_no_lp':             0           0           0             0         0         0           0         0          0            0        0
  'fs_random_quick_restart_no_lp':             0           0           0             0         0         0           0         0          0            0        0
  'fs_random_quick_restart_no_lp':             0           0           0             0         0         0           0         0          0            0        0
                 'lb_tree_search':             0           0           0             0         0         0           0         0          0            0        0
                         'max_lp':             0           0           0             0         0         0           0         0          0            0        0
                          'no_lp':           171         313       2'163             0        37        88         513         1         31          169       18
            'objective_lb_search':            24          37         337             0         5         7          23         0          5           20        0
     'objective_lb_search_max_lp':            35          69         294             0         9         0           0         0          0            0        0
      'objective_lb_search_no_lp':           297         696       1'870             0        37        89         356         0         59          264       14
                        'probing':             0           0           1             0         0         0           0         0          0            0        0
                 'probing_max_lp':             0           0           0             0         0         0           0         0          0            0        0
                   'pseudo_costs':             5           9         166             0         2         0           0         0          0            0        0
                  'quick_restart':             6           9         139             0         1         8          33         0          4           14        2
            'quick_restart_no_lp':           161         346       2'055             0        20        86         466         1         52          305        1
                  'reduced_costs':            17          33         329             0         0         0           0         0          0            0        0

Lp stats                         Component  Iterations  AddedCuts  OPTIMAL  DUAL_F.  DUAL_U.
                  'default_lp':          1         387        510       88        0        0
                   'fs_random':          1           0          0        0        0        0
                   'fs_random':          1           0          0        0        0        0
     'fs_random_quick_restart':          1           0          0        0        0        0
     'fs_random_quick_restart':          1           0          0        0        0        0
              'lb_tree_search':          1         282        654       13        2        0
                      'max_lp':          1         236        600       10        1        0
         'objective_lb_search':          1         452        449       92        0        0
  'objective_lb_search_max_lp':          1       1'154        435       75       33        0
                     'probing':          1         226        526       45        0        0
              'probing_max_lp':          1         176        617       11        0        0
                'pseudo_costs':          1         525        554       58        8        0
               'quick_restart':          1         366        529       88        0        0
               'reduced_costs':          1         384        600       69        5        0

Lp dimension                                                                    Final dimension of first component
                  'default_lp':  253 rows, 77 columns, 1038 entries with magnitude in [2.782692e-03, 1.000000e+00]
                   'fs_random':       0 rows, 77 columns, 0 entries with magnitude in [0.000000e+00, 0.000000e+00]
                   'fs_random':       0 rows, 77 columns, 0 entries with magnitude in [0.000000e+00, 0.000000e+00]
     'fs_random_quick_restart':       0 rows, 77 columns, 0 entries with magnitude in [0.000000e+00, 0.000000e+00]
     'fs_random_quick_restart':       0 rows, 77 columns, 0 entries with magnitude in [0.000000e+00, 0.000000e+00]
              'lb_tree_search':  693 rows, 80 columns, 3548 entries with magnitude in [1.589104e-04, 1.000000e+00]
                      'max_lp':  650 rows, 80 columns, 3286 entries with magnitude in [3.487442e-04, 1.000000e+00]
         'objective_lb_search':   229 rows, 77 columns, 531 entries with magnitude in [2.983838e-03, 1.000000e+00]
  'objective_lb_search_max_lp':  307 rows, 80 columns, 1287 entries with magnitude in [9.317733e-04, 1.000000e+00]
                     'probing':  276 rows, 77 columns, 1222 entries with magnitude in [3.308245e-03, 1.000000e+00]
              'probing_max_lp':  667 rows, 80 columns, 3976 entries with magnitude in [5.274688e-04, 1.000000e+00]
                'pseudo_costs':  347 rows, 80 columns, 1652 entries with magnitude in [2.074000e-04, 1.000000e+00]
               'quick_restart':  276 rows, 77 columns, 1206 entries with magnitude in [4.746387e-04, 1.000000e+00]
               'reduced_costs':  312 rows, 80 columns, 1346 entries with magnitude in [4.051677e-03, 1.000000e+00]

Lp debug                         CutPropag  CutEqPropag  Adjust  Overflow    Bad  BadScaling
                  'default_lp':          6            0      17         0    851           0
                   'fs_random':          0            0       0         0      0           0
                   'fs_random':          0            0       0         0      0           0
     'fs_random_quick_restart':          0            0       0         0      0           0
     'fs_random_quick_restart':          0            0       0         0      0           0
              'lb_tree_search':          0            0       7         0    357           0
                      'max_lp':          0            0       8         0    550           0
         'objective_lb_search':          0            0      30         0    736           0
  'objective_lb_search_max_lp':          4            0      79         0    300           0
                     'probing':          2            0      14         0  1'224           0
              'probing_max_lp':          0            0       4         0    757           0
                'pseudo_costs':          0            0      41         0    556           0
               'quick_restart':          5            0      39         0    806           0
               'reduced_costs':         10            0      61         0    410           0

Lp pool                          Constraints  Updates  Simplif  Merged  Shortened  Split  Strenghtened  Cuts/Call
                  'default_lp':          585      192      123       5          0     15           320    510/984
                   'fs_random':           80        0        0       0          0      0             0        0/0
                   'fs_random':           80        0        0       0          0      0             0        0/0
     'fs_random_quick_restart':           80        0        0       0          0      0             0        0/0
     'fs_random_quick_restart':           80        0        0       0          0      0             0        0/0
              'lb_tree_search':        1'090       60      489       0          0      6         1'016  654/1'085
                      'max_lp':        1'030       61      336       6          0      8           827    600/977
         'objective_lb_search':          529      253      525       0        354      7           484    449/885
  'objective_lb_search_max_lp':          868       87      588       3          0      1         1'249    435/739
                     'probing':          605       39       33       1          0      1            93  526/1'062
              'probing_max_lp':        1'053        2        0       0          0      8           130  617/1'064
                'pseudo_costs':          984      120      700       6          0      0         1'434    554/971
               'quick_restart':          605      331      194       4          0      6           441    529/982
               'reduced_costs':        1'036       96      715       0          0      1         1'389  600/1'042

Lp Cut            defaul  max_lp  quick_  reduce  pseudo  lb_tre  probin  object  probin  object
          CG_FF:      64      62      64      62      51      76      57      52      95      44
           CG_K:      26      68      38      49      29      59      27      29      52      28
           CG_R:      43      63      45      65      44      68      50      49      55      38
          CG_RB:      99     114     113     101      99     119     108      78     118      52
         CG_RBP:       8      18      14       5       9      19       6       7       9       3
         Clique:       -       -       -       5       7       5       -       -       -       7
             IB:      80      46      78      80      79      46      78      76      43      84
       MIR_1_FF:      29      41      22      43      50      42      43      22      52      36
        MIR_1_K:       5       -       5       1       1       2       4       4       2       1
        MIR_1_R:       6       4       6       3       6       6       4       3       7       5
       MIR_1_RB:      32      43      26      48      45      45      38      21      45      41
      MIR_1_RBP:       3      11       4      14      12      14       5       3      12      11
       MIR_2_FF:      16      12      12      18      17      17      13       9       9      14
        MIR_2_K:       3       3       4       5       2       4       6       2       2       2
        MIR_2_R:       8      11       7      10       9      14       7       6       4       9
       MIR_2_RB:      15      15      17      14      16      16      14       7      16      12
      MIR_2_RBP:       4       5       3       3       3       5       4       1       2       3
       MIR_3_FF:       3       1       6      12      10       8       5       7       6       5
        MIR_3_K:       1       1       2       2       1       7       2       3       1       1
        MIR_3_R:       3       7       6       7       6       9       4       9       8       6
       MIR_3_RB:       7       9       9       7      11       9       8       5       9       6
      MIR_3_RBP:       1       2       3       -       4       2       1       1       4       2
       MIR_4_FF:       7       3       2       6       3       4       3       3       4       3
        MIR_4_K:       2       3       2       -       2       -       3       3       -       -
        MIR_4_R:       2       4       4       5       4       2       4       2       2       3
       MIR_4_RB:       3       5       3       3       3       2       3       4       2       2
      MIR_4_RBP:       -       2       2       -       -       -       1       1       -       -
       MIR_5_FF:       3       1       1       4       -       2       2       1       3       2
        MIR_5_K:       2       2       2       -       2       1       1       3       1       1
        MIR_5_R:       1       1       1       4       -       2       1       2       1       -
       MIR_5_RB:       1       1       -       1       -       2       -       1       1       -
      MIR_5_RBP:       -       -       -       -       -       1       -       -       -       -
       MIR_6_FF:       -       -       -       -       1       -       -       2       1       -
        MIR_6_K:       -       -       1       -       -       -       -       -       -       -
        MIR_6_R:       -       -       -       -       -       -       -       1       1       -
       MIR_6_RB:       -       -       -       -       -       -       -       -       1       -
   ZERO_HALF_FF:       7       7       4       4       4       8       3       7       8       3
    ZERO_HALF_K:       2       1       1       -       -       2       1       2       3       -
    ZERO_HALF_R:      16      21      13      13      15      21      16      14      26       7
   ZERO_HALF_RB:       7      11       8       5       8      12       4       8       9       3
  ZERO_HALF_RBP:       1       2       1       1       1       3       -       1       3       1

LNS stats           Improv/Calls  Closed  Difficulty  TimeLimit
  'graph_arc_lns':           2/5    100%        0.94       0.10
  'graph_cst_lns':           0/0      0%        0.50       0.10
  'graph_dec_lns':           0/5    100%        0.94       0.10
  'graph_var_lns':           1/5    100%        0.94       0.10
      'rins/rens':           5/5     80%        0.88       0.10
    'rnd_cst_lns':           1/4    100%        0.91       0.10
    'rnd_var_lns':           2/5    100%        0.94       0.10

LS stats                   Batches  Restarts  LinMoves  GenMoves  CompoundMoves  WeightUpdates
       'fj_long_default':        0         0         0         0              0              0
       'fj_long_default':        0         0         0         0              0              0
   'fj_long_lin_default':        0         0         0         0              0              0
   'fj_long_lin_perturb':        0         0         0         0              0              0
    'fj_long_lin_random':        0         0         0         0              0              0
       'fj_long_perturb':        0         0         0         0              0              0
        'fj_long_random':        0         0         0         0              0              0
      'fj_short_default':        0         0         0         0              0              0
      'fj_short_default':        0         0         0         0              0              0
  'fj_short_lin_default':        0         0         0         0              0              0
  'fj_short_lin_default':        0         0         0         0              0              0
  'fj_short_lin_perturb':        0         0         0         0              0              0
   'fj_short_lin_random':        0         0         0         0              0              0
      'fj_short_perturb':        0         0         0         0              0              0
       'fj_short_random':        0         0         0         0              0              0
          'violation_ls':        1         0         0    12'029            341             71
          'violation_ls':        1         0         0    12'165            435             67
          'violation_ls':        1         0         0    12'427            183             88
          'violation_ls':        2         0         0    10'698            364             73
          'violation_ls':        5         0       717     4'445            145            246

Solutions (20)            Num     Rank
        'graph_arc_lns':    1  [15,15]
                'no_lp':    3   [1,16]
  'quick_restart_no_lp':   11   [2,20]
        'rins_pump_lns':    1  [10,10]
          'rnd_var_lns':    1    [6,6]
         'violation_ls':    3   [8,14]

Objective bounds                Num
                  'bool_core':   15
             'initial_domain':    1
  'objective_lb_search_no_lp':    9

Solution repositories    Added  Queried  Ignored  Synchro
  'feasible solutions':     50       89        1       30
        'lp solutions':      2        0        0        1
                'pump':    104        6

Improving bounds shared         Num
                       'core':    4
                      'no_lp':  241
        'objective_lb_search':    6
  'objective_lb_search_no_lp':   27
              'quick_restart':   28
        'quick_restart_no_lp':  252

Clauses shared                  Num
                       'core':    1
                 'default_lp':    2
                      'no_lp':   11
        'objective_lb_search':   12
  'objective_lb_search_no_lp':    7
              'quick_restart':    5
        'quick_restart_no_lp':   10

CpSolverResponse summary:
status: OPTIMAL
objective: 318
best_bound: 318
integers: 0
booleans: 0
conflicts: 0
branches: 0
propagations: 0
integer_propagations: 0
restarts: 0
lp_iterations: 0
walltime: 0.155826
usertime: 0.155826
deterministic_time: 0.305338
gap_integral: 1.09763
solution_fingerprint: 0xa116b53c892f5c56


--- Simulation Gantt  partir du modle mathmatique ---
{'big':0, 'due_date':104, 'pos_time':5, 'status':0, 'blocked':0, 'operations':["{'type':0, 'processing_time':50}"]}
{'big':0, 'due_date':95, 'pos_time':5, 'status':0, 'blocked':0, 'operations':["{'type':1, 'processing_time':44}"]}
{'big':1, 'due_date':77, 'pos_time':5, 'status':0, 'blocked':0, 'operations':["{'type':0, 'processing_time':39}"]}
{'big':1, 'due_date':139, 'pos_time':5, 'status':0, 'blocked':0, 'operations':["{'type':0, 'processing_time':20}", "{'type':1, 'processing_time':28}"]}
{'big':1, 'due_date':173, 'pos_time':5, 'status':0, 'blocked':0, 'operations':["{'type':0, 'processing_time':16}", "{'type':1, 'processing_time':27}"]}
