created virtual environment CPython3.12.4.final.0-64 in 618ms
  creator CPython3Posix(dest=/localscratch/aneumann.47038281.0/env, clear=False, no_vcs_ignore=False, global=False)
  seeder FromAppData(download=False, pip=bundle, via=copy, app_data_dir=/home/aneumann/.local/share/virtualenv)
    added seed packages: pip==24.2+computecanada
  activators BashActivator,CShellActivator,FishActivator,NushellActivator,PowerShellActivator,PythonActivator
Looking in links: /cvmfs/soft.computecanada.ca/custom/python/wheelhouse/gentoo2023/x86-64-v3, /cvmfs/soft.computecanada.ca/custom/python/wheelhouse/gentoo2023/generic, /cvmfs/soft.computecanada.ca/custom/python/wheelhouse/generic
Requirement already satisfied: pip in /localscratch/aneumann.47038281.0/env/lib/python3.12/site-packages (24.2+computecanada)
Processing /cvmfs/soft.computecanada.ca/custom/python/wheelhouse/generic/pip-25.0+computecanada-py3-none-any.whl
Installing collected packages: pip
  Attempting uninstall: pip
    Found existing installation: pip 24.2+computecanada
    Uninstalling pip-24.2+computecanada:
      Successfully uninstalled pip-24.2+computecanada
Successfully installed pip-25.0+computecanada
Looking in links: /cvmfs/soft.computecanada.ca/custom/python/wheelhouse/gentoo2023/x86-64-v3, /cvmfs/soft.computecanada.ca/custom/python/wheelhouse/gentoo2023/generic, /cvmfs/soft.computecanada.ca/custom/python/wheelhouse/generic
ERROR: protobuf-5.28.3-cp38-abi3-manylinux2014_x86_64.whl is not a supported wheel on this platform.
Looking in links: /cvmfs/soft.computecanada.ca/custom/python/wheelhouse/gentoo2023/x86-64-v3, /cvmfs/soft.computecanada.ca/custom/python/wheelhouse/gentoo2023/generic, /cvmfs/soft.computecanada.ca/custom/python/wheelhouse/generic
Processing /home/aneumann/projects/def-adhaj/aneumann/GNRS/wheels/immutabledict-4.2.0-py3-none-any.whl
Installing collected packages: immutabledict
Successfully installed immutabledict-4.2.0
Looking in links: /cvmfs/soft.computecanada.ca/custom/python/wheelhouse/gentoo2023/x86-64-v3, /cvmfs/soft.computecanada.ca/custom/python/wheelhouse/gentoo2023/generic, /cvmfs/soft.computecanada.ca/custom/python/wheelhouse/generic
Processing /cvmfs/soft.computecanada.ca/custom/python/wheelhouse/generic/ortools-9.10.4067+computecanada-cp312-cp312-linux_x86_64.whl (from -r /home/aneumann/projects/def-adhaj/aneumann/GNRS/requirements/or.txt (line 1))
Processing /cvmfs/soft.computecanada.ca/custom/python/wheelhouse/gentoo2023/x86-64-v3/matplotlib-3.10.0+computecanada-cp312-cp312-linux_x86_64.whl (from -r /home/aneumann/projects/def-adhaj/aneumann/GNRS/requirements/or.txt (line 2))
Processing /cvmfs/soft.computecanada.ca/custom/python/wheelhouse/gentoo2023/x86-64-v3/pandas-2.2.3+computecanada-cp312-cp312-linux_x86_64.whl (from -r /home/aneumann/projects/def-adhaj/aneumann/GNRS/requirements/or.txt (line 3))
Processing /cvmfs/soft.computecanada.ca/custom/python/wheelhouse/generic/absl_py-2.3.0+computecanada-py3-none-any.whl (from ortools<9.11,>=9.10->-r /home/aneumann/projects/def-adhaj/aneumann/GNRS/requirements/or.txt (line 1))
Processing /cvmfs/soft.computecanada.ca/custom/python/wheelhouse/gentoo2023/generic/numpy-2.2.2+computecanada-cp312-cp312-linux_x86_64.whl (from ortools<9.11,>=9.10->-r /home/aneumann/projects/def-adhaj/aneumann/GNRS/requirements/or.txt (line 1))
Processing /cvmfs/soft.computecanada.ca/custom/python/wheelhouse/gentoo2023/x86-64-v3/protobuf-6.31.1+computecanada-cp312-cp312-linux_x86_64.whl (from ortools<9.11,>=9.10->-r /home/aneumann/projects/def-adhaj/aneumann/GNRS/requirements/or.txt (line 1))
Requirement already satisfied: immutabledict>=3.0.0 in /localscratch/aneumann.47038281.0/env/lib/python3.12/site-packages (from ortools<9.11,>=9.10->-r /home/aneumann/projects/def-adhaj/aneumann/GNRS/requirements/or.txt (line 1)) (4.2.0)
Processing /cvmfs/soft.computecanada.ca/custom/python/wheelhouse/gentoo2023/generic/contourpy-1.3.1+computecanada-cp312-cp312-linux_x86_64.whl (from matplotlib->-r /home/aneumann/projects/def-adhaj/aneumann/GNRS/requirements/or.txt (line 2))
Processing /cvmfs/soft.computecanada.ca/custom/python/wheelhouse/generic/cycler-0.12.1+computecanada-py3-none-any.whl (from matplotlib->-r /home/aneumann/projects/def-adhaj/aneumann/GNRS/requirements/or.txt (line 2))
Processing /cvmfs/soft.computecanada.ca/custom/python/wheelhouse/generic/fonttools-4.59.0+computecanada-cp312-cp312-linux_x86_64.whl (from matplotlib->-r /home/aneumann/projects/def-adhaj/aneumann/GNRS/requirements/or.txt (line 2))
Processing /cvmfs/soft.computecanada.ca/custom/python/wheelhouse/gentoo2023/x86-64-v3/kiwisolver-1.4.8+computecanada-cp312-cp312-linux_x86_64.whl (from matplotlib->-r /home/aneumann/projects/def-adhaj/aneumann/GNRS/requirements/or.txt (line 2))
Processing /cvmfs/soft.computecanada.ca/custom/python/wheelhouse/generic/packaging-25.0+computecanada-py3-none-any.whl (from matplotlib->-r /home/aneumann/projects/def-adhaj/aneumann/GNRS/requirements/or.txt (line 2))
Processing /cvmfs/soft.computecanada.ca/custom/python/wheelhouse/gentoo2023/x86-64-v3/pillow-11.1.0+computecanada-cp312-cp312-linux_x86_64.whl (from matplotlib->-r /home/aneumann/projects/def-adhaj/aneumann/GNRS/requirements/or.txt (line 2))
Processing /cvmfs/soft.computecanada.ca/custom/python/wheelhouse/generic/pyparsing-3.2.3+computecanada-py3-none-any.whl (from matplotlib->-r /home/aneumann/projects/def-adhaj/aneumann/GNRS/requirements/or.txt (line 2))
Processing /cvmfs/soft.computecanada.ca/custom/python/wheelhouse/generic/python_dateutil-2.9.0.post0+computecanada-py2.py3-none-any.whl (from matplotlib->-r /home/aneumann/projects/def-adhaj/aneumann/GNRS/requirements/or.txt (line 2))
Processing /cvmfs/soft.computecanada.ca/custom/python/wheelhouse/generic/pytz-2025.2+computecanada-py2.py3-none-any.whl (from pandas->-r /home/aneumann/projects/def-adhaj/aneumann/GNRS/requirements/or.txt (line 3))
Processing /cvmfs/soft.computecanada.ca/custom/python/wheelhouse/generic/tzdata-2025.2+computecanada-py2.py3-none-any.whl (from pandas->-r /home/aneumann/projects/def-adhaj/aneumann/GNRS/requirements/or.txt (line 3))
Processing /cvmfs/soft.computecanada.ca/custom/python/wheelhouse/generic/six-1.17.0+computecanada-py2.py3-none-any.whl (from python-dateutil>=2.7->matplotlib->-r /home/aneumann/projects/def-adhaj/aneumann/GNRS/requirements/or.txt (line 2))
Installing collected packages: pytz, tzdata, six, pyparsing, protobuf, pillow, packaging, numpy, kiwisolver, fonttools, cycler, absl-py, python-dateutil, contourpy, pandas, matplotlib, ortools
Successfully installed absl-py-2.3.0+computecanada contourpy-1.3.1+computecanada cycler-0.12.1+computecanada fonttools-4.59.0+computecanada kiwisolver-1.4.8+computecanada matplotlib-3.10.0+computecanada numpy-2.2.2+computecanada ortools-9.10.4067+computecanada packaging-25.0+computecanada pandas-2.2.3+computecanada pillow-11.1.0+computecanada protobuf-6.31.1+computecanada pyparsing-3.2.3+computecanada python-dateutil-2.9.0.post0+computecanada pytz-2025.2+computecanada six-1.17.0+computecanada tzdata-2025.2+computecanada

Starting CP-SAT solver v9.10.4067
Parameters: max_time_in_seconds: 86400 max_memory_in_mb: 185000 log_search_progress: true enumerate_all_solutions: false num_search_workers: 32 absolute_gap_limit: 0 relative_gap_limit: 0

Initial optimization model '': (model_fingerprint: 0x8267689fe1dbe98b)
#Variables: 1'083 (#ints: 19 in objective)
  - 888 Booleans in [0,1]
  - 195 in [0,1444]
#kLinear1: 96
#kLinear2: 2'306
#kLinear3: 988
#kLinearN: 49'690 (#terms: 1'575'388)

Starting presolve at 0.02s
  4.93e-02s  0.00e+00d  [DetectDominanceRelations] 
  6.45e-01s  0.00e+00d  [PresolveToFixPoint] #num_loops=8 #num_dual_strengthening=3 
  3.45e-04s  0.00e+00d  [ExtractEncodingFromLinear] #potential_supersets=10 
[Symmetry] Graph for symmetry has 52'528 nodes and 1'403'024 arcs.
[Symmetry] Symmetry computation done. time: 0.0342267 dtime: 0.0961913
[Symmetry] #generators: 1, average support size: 56
[Symmetry] The model contains 1112 duplicate constraints !
[Symmetry] 28 orbits with sizes: 2,2,2,2,2,2,2,2,2,2,...
[Symmetry] Num fixable by intersecting at_most_one with orbits: 1 largest_orbit: 2
  5.08e-01s  1.35e-01d  [Probe] #probed=1'490 #new_bounds=17 #equiv=1 
  3.53e-04s  0.00e+00d  [MaxClique] Merged 11(22 literals) into 9(18 literals) at_most_ones. 
  4.92e-02s  0.00e+00d  [DetectDominanceRelations] 
  3.19e-01s  0.00e+00d  [PresolveToFixPoint] #num_loops=5 #num_dual_strengthening=3 
  1.60e-01s  0.00e+00d  [ProcessAtMostOneAndLinear] 
  3.60e-02s  0.00e+00d  [DetectDuplicateConstraints] #duplicates=1'444 #without_enforcements=132 
  1.24e-01s  1.42e-02d  [DetectDominatedLinearConstraints] #relevant_constraints=47'418 #num_inclusions=27'367 
  5.16e-03s  0.00e+00d  [DetectDifferentVariables] #different=95 #cliques=1 #size=12 
  1.70e-02s  2.51e-03d  [ProcessSetPPC] #relevant_constraints=46'147 
  5.43e-04s  0.00e+00d  [FindAlmostIdenticalLinearConstraints] 
  4.72e-03s  8.85e-03d  [FindBigAtMostOneAndLinearOverlap] 
  2.93e-01s  2.79e-01d  [FindBigVerticalLinearOverlap] #blocks=609 #saved_nz=272'873 
  9.20e-03s  5.34e-03d  [FindBigHorizontalLinearOverlap] #linears=45'146 
  2.32e-04s  0.00e+00d  [MergeClauses] 
  5.63e-02s  0.00e+00d  [DetectDominanceRelations] 
  3.64e-01s  0.00e+00d  [PresolveToFixPoint] #num_loops=3 #num_dual_strengthening=1 
  5.58e-02s  0.00e+00d  [DetectDominanceRelations] 
  2.29e-01s  0.00e+00d  [PresolveToFixPoint] #num_loops=1 #num_dual_strengthening=1 
[Symmetry] Graph for symmetry has 52'828 nodes and 1'125'459 arcs.
[Symmetry] Symmetry computation done. time: 0.0182741 dtime: 0.0546595
  4.63e-01s  1.07e-01d  [Probe] #probed=1'490 #new_bounds=396 
  3.05e-04s  0.00e+00d  [MaxClique] 
  5.62e-02s  0.00e+00d  [DetectDominanceRelations] 
  3.30e-01s  0.00e+00d  [PresolveToFixPoint] #num_loops=2 #num_dual_strengthening=1 
  1.51e-01s  0.00e+00d  [ProcessAtMostOneAndLinear] 
  3.30e-02s  0.00e+00d  [DetectDuplicateConstraints] #without_enforcements=132 
  9.06e-02s  1.04e-02d  [DetectDominatedLinearConstraints] #relevant_constraints=47'493 #num_inclusions=5'370 
  4.61e-03s  0.00e+00d  [DetectDifferentVariables] 
  1.57e-02s  1.95e-03d  [ProcessSetPPC] #relevant_constraints=45'189 
  6.19e-04s  3.67e-06d  [FindAlmostIdenticalLinearConstraints] #num_tested_pairs=234 
  2.33e-03s  3.50e-03d  [FindBigAtMostOneAndLinearOverlap] 
  2.88e-01s  2.10e-01d  [FindBigVerticalLinearOverlap] #blocks=2'697 #saved_nz=310'990 
  8.34e-03s  3.65e-03d  [FindBigHorizontalLinearOverlap] #linears=40'057 
  2.60e-04s  0.00e+00d  [MergeClauses] 
  4.15e-02s  0.00e+00d  [DetectDominanceRelations] 
  3.64e-01s  0.00e+00d  [PresolveToFixPoint] #num_loops=3 #num_dual_strengthening=1 
  4.14e-02s  0.00e+00d  [DetectDominanceRelations] 
  2.36e-01s  0.00e+00d  [PresolveToFixPoint] #num_loops=1 #num_dual_strengthening=1 
[Symmetry] Graph for symmetry has 59'936 nodes and 816'465 arcs.
[Symmetry] Symmetry computation done. time: 0.0155608 dtime: 0.0401973
  3.57e-01s  8.74e-02d  [Probe] #probed=1'490 #new_bounds=1'645 
  3.26e-04s  0.00e+00d  [MaxClique] 
  4.13e-02s  0.00e+00d  [DetectDominanceRelations] 
  3.55e-01s  0.00e+00d  [PresolveToFixPoint] #num_loops=2 #num_dual_strengthening=1 
  1.46e-01s  0.00e+00d  [ProcessAtMostOneAndLinear] 
  2.93e-02s  0.00e+00d  [DetectDuplicateConstraints] #without_enforcements=132 
  5.96e-02s  6.17e-03d  [DetectDominatedLinearConstraints] #relevant_constraints=49'366 #num_inclusions=966 
  4.51e-03s  0.00e+00d  [DetectDifferentVariables] 
  1.18e-02s  1.30e-03d  [ProcessSetPPC] #relevant_constraints=40'199 
  1.15e-03s  1.61e-04d  [FindAlmostIdenticalLinearConstraints] #num_tested_pairs=9'915 
  1.68e-03s  2.06e-03d  [FindBigAtMostOneAndLinearOverlap] 
  1.83e-01s  1.21e-01d  [FindBigVerticalLinearOverlap] #blocks=2'576 #saved_nz=225'976 
  6.79e-03s  2.35e-03d  [FindBigHorizontalLinearOverlap] #linears=32'406 
  2.84e-04s  0.00e+00d  [MergeClauses] 
  3.11e-02s  0.00e+00d  [DetectDominanceRelations] 
  3.58e-01s  0.00e+00d  [PresolveToFixPoint] #num_loops=3 #num_dual_strengthening=1 
  2.34e-03s  0.00e+00d  [ExpandObjective] #entries=23'565 #tight_variables=9'074 #tight_constraints=4'752 

Presolve summary:
  - 352 affine relations were detected.
  - rule 'TODO dual: only one blocking constraint?' was applied 2'664 times.
  - rule 'TODO dual: only one blocking enforced constraint?' was applied 208 times.
  - rule 'TODO dual: only one unspecified blocking constraint?' was applied 130 times.
  - rule 'TODO duplicate: identical constraint with different enforcements' was applied 396 times.
  - rule 'TODO linear2: contains a Boolean.' was applied 72 times.
  - rule 'affine: new relation' was applied 352 times.
  - rule 'at_most_one: removed literals' was applied 9 times.
  - rule 'at_most_one: size one' was applied 9 times.
  - rule 'at_most_one: transformed into max clique.' was applied 1 time.
  - rule 'deductions: 3675 stored' was applied 1 time.
  - rule 'dual: fix variable' was applied 54 times.
  - rule 'dual: reduced domain' was applied 121 times.
  - rule 'duplicate: merged rhs of linear constraint' was applied 292 times.
  - rule 'duplicate: removed constraint' was applied 1'444 times.
  - rule 'enforcement: false literal' was applied 16 times.
  - rule 'exactly_one: x and not(x)' was applied 1 time.
  - rule 'incompatible linear: add implication' was applied 198 times.
  - rule 'linear matrix: common vertical rectangle' was applied 5'882 times.
  - rule 'linear: always true' was applied 2'835 times.
  - rule 'linear: doubleton free' was applied 26 times.
  - rule 'linear: empty' was applied 68 times.
  - rule 'linear: extracted enforcement literal' was applied 49'208 times.
  - rule 'linear: fixed or dup variables' was applied 50'383 times.
  - rule 'linear: positive equal one' was applied 10 times.
  - rule 'linear: reduced variable domains' was applied 4'980 times.
  - rule 'linear: remapped using affine relations' was applied 50'725 times.
  - rule 'linear: simplified rhs' was applied 169'062 times.
  - rule 'linear: tightened into equality' was applied 12 times.
  - rule 'linear: variable substitution 1' was applied 26 times.
  - rule 'linear: variable substitution 2' was applied 554 times.
  - rule 'linear: variable substitution 3' was applied 479 times.
  - rule 'no_overlap: inferred from x != y constraints' was applied 1 time.
  - rule 'presolve: 195 unused variables removed.' was applied 1 time.
  - rule 'presolve: iteration' was applied 3 times.
  - rule 'probing: reduced enforced constraint to implication.' was applied 11 times.
  - rule 'symmetry: fixed to false in general orbit' was applied 1 time.

Presolved optimization model '': (model_fingerprint: 0x558da230c3ff5390)
#Variables: 5'359 (#ints: 19 in objective)
  - 379 Booleans in [0,1]
  - 3'656 different domains in [-35976,37408] with a largest complexity of 29.
#kExactlyOne: 9 (#literals: 27)
#kInterval: 12
#kLinear2: 2'565 (#enforced: 2'458 #multi: 916)
#kLinear3: 11'239 (#enforced: 7'593 #multi: 21)
#kLinearN: 39'364 (#enforced: 37'355) (#terms: 498'557)
#kNoOverlap: 1 (#intervals: 12)

Preloading model.
#Bound   6.55s best:inf   next:[212,24051] initial_domain
[Symmetry] Graph for symmetry has 64'945 nodes and 592'288 arcs.
[Symmetry] Symmetry computation done. time: 0.0116682 dtime: 0.0293901
#Model   6.61s var:5359/5359 constraints:53190/53190

Starting search at 6.64s with 32 workers.
17 full problem subsolvers: [core, default_lp, fixed, lb_tree_search, max_lp, no_lp, objective_lb_search, objective_lb_search_max_lp, objective_lb_search_no_lp, objective_shaving_search_max_lp, objective_shaving_search_no_lp, probing, probing_max_lp, pseudo_costs, quick_restart, quick_restart_no_lp, reduced_costs]
13 first solution subsolvers: [fj_long_default, fj_long_lin_default, fj_long_random, fj_short_default, fj_short_lin_default, fj_short_lin_random, fj_short_random, fs_random(2), fs_random_no_lp, fs_random_quick_restart(2), fs_random_quick_restart_no_lp]
13 incomplete subsolvers: [feasibility_pump, graph_arc_lns, graph_cst_lns, graph_dec_lns, graph_var_lns, rins/rens, rnd_cst_lns, rnd_var_lns, scheduling_intervals_lns, scheduling_precedences_lns, scheduling_time_window_lns, violation_ls(2)]
3 helper subsolvers: [neighborhood_helper, synchronization_agent, update_gap_integral]
#Bound   8.31s best:inf   next:[248,24051] fs_random_no_lp (initial_propagation)
#Bound   8.44s best:inf   next:[265,24051] objective_lb_search_no_lp
#Bound  10.48s best:inf   next:[426,24051] objective_lb_search
#1      10.66s best:8655  next:[426,8654] fs_random_quick_restart_no_lp (fixed_bools=0/456)
#Bound  11.00s best:8655  next:[989,8654] objective_lb_search_max_lp
#Bound  11.05s best:8655  next:[1052,8654] objective_lb_search_max_lp
#Bound  11.10s best:8655  next:[1109,8654] objective_lb_search_max_lp
#Bound  11.55s best:8655  next:[1112,8654] objective_lb_search_max_lp
#2      12.31s best:7043  next:[1112,7042] no_lp (fixed_bools=0/503)
#3      13.44s best:7039  next:[1112,7038] no_lp (fixed_bools=0/507)
#Bound  13.65s best:7039  next:[1163,7038] reduced_costs
#4      14.75s best:7027  next:[1163,7026] no_lp (fixed_bools=0/513)
#5      15.55s best:7023  next:[1163,7022] graph_arc_lns (d=0.94 s=152 t=0.10 p=1.00 stall=5 h=auto_l0)
#6      16.01s best:7020  next:[1163,7019] no_lp (fixed_bools=0/516)
#7      17.73s best:7011  next:[1163,7010] graph_arc_lns (d=0.97 s=178 t=0.10 p=1.00 stall=1 h=auto_l0)
#Bound  17.73s best:7011  next:[1164,7010] lb_tree_search
#8      18.84s best:6374  next:[1164,6373] rins_lp_lns (d=0.94 s=185 t=0.10 p=1.00 stall=5 h=auto_l0)
#Bound  20.82s best:6374  next:[1165,6373] max_lp
#Bound  21.24s best:6374  next:[1214,6373] lb_tree_search
#Bound  22.46s best:6374  next:[1217,6373] lb_tree_search
#9      23.38s best:6369  next:[1217,6368] graph_var_lns (d=0.99 s=219 t=0.10 p=1.00 stall=10 h=folio_rnd)
#Bound  24.21s best:6369  next:[1218,6368] lb_tree_search
#10     25.02s best:6364  next:[1218,6363] graph_cst_lns (d=0.99 s=235 t=0.10 p=1.00 stall=10 h=folio_rnd)
#11     25.08s best:6363  next:[1218,6362] violation_ls(batch:13 #solutions_imported:6 #lin_moves:17'347 #lin_evals:254'899 #gen_moves:60'663 #gen_evals:8'824 #comp_moves:13'632 #backtracks:23'479 #weight_updates:3'119)
#12     25.10s best:6362  next:[1218,6361] violation_ls(batch:13 #solutions_imported:6 #lin_moves:60'587 #lin_evals:335'482 #gen_moves:40'379 #gen_evals:5'629 #comp_moves:8'942 #backtracks:15'701 #weight_updates:1'563)
#Bound  25.14s best:6362  next:[1220,6361] max_lp
#Bound  25.49s best:6362  next:[1224,6361] objective_lb_search_max_lp
#Bound  25.99s best:6362  next:[1237,6361] objective_lb_search_max_lp
#13     26.82s best:6357  next:[1237,6356] graph_var_lns (d=0.99 s=247 t=0.10 p=1.00 stall=1 h=auto_l0)
#14     27.03s best:6356  next:[1237,6355] violation_ls(batch:14 #solutions_imported:7 #lin_moves:20'225 #lin_evals:264'768 #gen_moves:60'663 #gen_evals:8'824 #comp_moves:13'632 #backtracks:23'479 #weight_updates:3'306)
#15     28.63s best:6344  next:[1237,6343] quick_restart_no_lp (fixed_bools=0/700)
#16     28.93s best:6342  next:[1237,6341] violation_ls(batch:15 #solutions_imported:8 #lin_moves:20'226 #lin_evals:264'784 #gen_moves:60'663 #gen_evals:8'824 #comp_moves:13'632 #backtracks:23'479 #weight_updates:3'306)
#17     28.94s best:6341  next:[1237,6340] violation_ls(batch:15 #solutions_imported:8 #lin_moves:60'587 #lin_evals:346'087 #gen_moves:44'998 #gen_evals:6'249 #comp_moves:9'321 #backtracks:17'821 #weight_updates:1'630)
#18     29.66s best:6186  next:[1237,6185] rins_lp_lns (d=0.94 s=272 t=0.10 p=0.78 stall=0 h=auto_l0)
#19     31.50s best:6135  next:[1237,6134] quick_restart_no_lp (fixed_bools=0/767)
#20     32.47s best:6131  next:[1237,6130] quick_restart_no_lp (fixed_bools=0/779)
#21     33.12s best:6129  next:[1237,6128] violation_ls(batch:17 #solutions_imported:10 #lin_moves:29'480 #lin_evals:302'099 #gen_moves:60'680 #gen_evals:8'826 #comp_moves:13'633 #backtracks:23'487 #weight_updates:4'052)
#22     33.13s best:6127  next:[1237,6126] violation_ls(batch:17 #solutions_imported:10 #lin_moves:60'587 #lin_evals:363'555 #gen_moves:52'308 #gen_evals:7'451 #comp_moves:9'604 #backtracks:21'334 #weight_updates:1'721)
#Bound  33.34s best:6127  next:[1238,6126] objective_shaving_search_max_lp (vars=7031 csts=54465)
#23     34.04s best:5751  next:[1238,5750] graph_var_lns (d=0.99 s=289 t=0.10 p=1.00 stall=0 h=auto_l0)
#24     34.76s best:5283  next:[1238,5282] rins_lp_lns (d=0.92 s=310 t=0.10 p=0.67 stall=1 h=auto_l0)
#25     37.66s best:5226  next:[1238,5225] rnd_var_lns (d=1.00 s=313 t=0.10 p=1.00 stall=1 h=auto_l0)
#26     37.96s best:5223  next:[1238,5222] rnd_cst_lns (d=1.00 s=314 t=0.10 p=1.00 stall=1 h=auto_l0)
#27     40.04s best:5204  next:[1238,5203] graph_arc_lns (d=1.00 s=316 t=0.10 p=1.00 stall=0 h=auto_l0)
#28     40.50s best:5203  next:[1238,5202] violation_ls(batch:20 #solutions_imported:13 #lin_moves:86'141 #lin_evals:459'876 #gen_moves:52'308 #gen_evals:7'451 #comp_moves:9'604 #backtracks:21'334 #weight_updates:3'788)
#29     41.99s best:5202  next:[1238,5201] quick_restart_no_lp (fixed_bools=0/886)
#30     42.68s best:5197  next:[1238,5196] quick_restart_no_lp (fixed_bools=0/891)
#Bound  42.89s best:5197  next:[1248,5196] objective_lb_search_max_lp
#31     43.59s best:5196  next:[1248,5195] quick_restart_no_lp (fixed_bools=0/897)
#32     43.82s best:5195  next:[1248,5194] graph_arc_lns (d=1.00 s=340 t=0.10 p=0.89 stall=0 h=auto_l0)
#33     43.93s best:5180  next:[1248,5179] rnd_cst_lns (d=1.00 s=338 t=0.10 p=1.00 stall=0 h=auto_l0)
#34     44.36s best:5138  next:[1248,5137] rnd_var_lns (d=1.00 s=337 t=0.10 p=0.95 stall=0 h=auto_l0)
#35     44.56s best:5124  next:[1248,5123] graph_cst_lns (d=1.00 s=341 t=0.10 p=1.00 stall=1 h=auto_l0)
#36     45.36s best:5123  next:[1248,5122] violation_ls(batch:22 #solutions_imported:15 #lin_moves:49'025 #lin_evals:452'951 #gen_moves:80'902 #gen_evals:10'234 #comp_moves:14'945 #backtracks:32'941 #weight_updates:4'661)
#37     45.37s best:5122  next:[1248,5121] violation_ls(batch:22 #solutions_imported:15 #lin_moves:95'775 #lin_evals:490'976 #gen_moves:52'308 #gen_evals:7'451 #comp_moves:9'604 #backtracks:21'334 #weight_updates:4'243)
#38     48.78s best:5019  next:[1248,5018] rnd_var_lns (d=1.00 s=363 t=0.10 p=0.95 stall=0 h=auto_l0)
#39     50.88s best:4959  next:[1248,4958] graph_var_lns (d=1.00 s=377 t=0.10 p=0.86 stall=2 h=auto_l0)
#40     51.05s best:4958  next:[1248,4957] violation_ls(batch:24 #solutions_imported:17 #lin_moves:49'450 #lin_evals:458'404 #gen_moves:82'742 #gen_evals:10'361 #comp_moves:14'985 #backtracks:33'841 #weight_updates:4'910)
#41     51.06s best:4957  next:[1248,4956] violation_ls(batch:24 #solutions_imported:17 #lin_moves:95'776 #lin_evals:510'977 #gen_moves:62'271 #gen_evals:8'088 #comp_moves:10'106 #backtracks:26'064 #weight_updates:4'310)
#42     51.12s best:4873  next:[1248,4872] rins_lp_lns (d=0.92 s=384 t=0.10 p=0.61 stall=1 h=auto_l0)
#43     54.67s best:4868  next:[1248,4867] rnd_cst_lns (d=1.00 s=388 t=0.10 p=0.86 stall=0 h=auto_l0)
#44     56.37s best:4843  next:[1248,4842] graph_cst_lns (d=1.00 s=391 t=0.10 p=0.90 stall=0 h=auto_l0)
#Bound  57.96s best:4843  next:[1249,4842] objective_shaving_search_max_lp (vars=7031 csts=54465)
#45     61.34s best:4838  next:[1249,4837] graph_cst_lns (d=1.00 s=416 t=0.10 p=0.87 stall=0 h=auto_l0)
#46     62.31s best:4821  next:[1249,4820] graph_var_lns (d=1.00 s=427 t=0.10 p=0.80 stall=0 h=auto_l0)
#47     68.56s best:4810  next:[1249,4809] graph_arc_lns (d=1.00 s=452 t=0.10 p=0.81 stall=0 h=auto_l0)
#48     71.54s best:4806  next:[1249,4805] rins_lp_lns (d=0.94 s=470 t=0.10 p=0.60 stall=6 h=auto_l0)
#49     72.14s best:4805  next:[1249,4804] graph_dec_lns (d=1.00 s=466 t=0.10 p=0.82 stall=3 h=auto_l0)
#50     73.26s best:4790  next:[1249,4789] rnd_cst_lns (d=1.00 s=474 t=0.10 p=0.79 stall=1 h=auto_l0)
#Bound  74.09s best:4790  next:[1250,4789] objective_shaving_search_max_lp (vars=7031 csts=54465)
#51     75.06s best:4770  next:[1250,4769] graph_dec_lns (d=1.00 s=478 t=0.10 p=0.79 stall=0 h=auto_l0)
#Bound  89.27s best:4770  next:[1251,4769] objective_shaving_search_max_lp (vars=7031 csts=54465)
#Bound 106.55s best:4770  next:[1252,4769] objective_shaving_search_max_lp (vars=7031 csts=54465)
#Bound 122.57s best:4770  next:[1253,4769] objective_shaving_search_max_lp (vars=7031 csts=54465)
#Bound 134.79s best:4770  next:[1254,4769] objective_shaving_search_max_lp (vars=7031 csts=54465)
#52    143.33s best:4727  next:[1254,4726] graph_arc_lns (d=1.00 s=776 t=0.10 p=0.64 stall=0 h=auto_l0)
#53    145.84s best:4628  next:[1254,4627] rins_lp_lns (d=0.93 s=806 t=0.10 p=0.54 stall=9 h=auto_l0)
#Bound 154.41s best:4628  next:[1255,4627] objective_shaving_search_max_lp (vars=7031 csts=54465)
#Bound 165.46s best:4628  next:[1256,4627] objective_shaving_search_max_lp (vars=7031 csts=54465)
#Bound 178.53s best:4628  next:[1257,4627] objective_shaving_search_max_lp (vars=7031 csts=54465)
#54    183.05s best:4557  next:[1257,4556] rins_pump_lns (d=0.94 s=969 t=0.10 p=0.55 stall=0 h=auto_l0)
#55    193.65s best:4529  next:[1257,4528] graph_dec_lns (d=1.00 s=1002 t=0.10 p=0.63 stall=4 h=auto_l0)
#56    195.70s best:4528  next:[1257,4527] violation_ls(batch:76 #solutions_imported:28 #lin_moves:163'674 #lin_evals:1'839'123 #gen_moves:307'446 #gen_evals:27'303 #comp_moves:41'532 #backtracks:132'871 #weight_updates:14'186)
#57    195.71s best:4527  next:[1257,4526] violation_ls(batch:76 #solutions_imported:29 #lin_moves:459'609 #lin_evals:2'259'939 #gen_moves:158'029 #gen_evals:13'165 #comp_moves:14'290 #backtracks:71'832 #weight_updates:61'167)
#58    196.74s best:4521  next:[1257,4520] graph_arc_lns (d=1.00 s=1024 t=0.10 p=0.59 stall=3 h=auto_l0)
#59    196.75s best:4397  next:[1257,4396] rins_pump_lns (d=0.94 s=1030 t=0.10 p=0.55 stall=0 h=auto_l0)
#60    202.04s best:4386  next:[1257,4385] graph_arc_lns (d=1.00 s=1049 t=0.10 p=0.60 stall=0 h=auto_l0)
#Bound 203.83s best:4386  next:[1258,4385] objective_shaving_search_max_lp (vars=7031 csts=54465)
#Bound 208.71s best:4386  next:[1265,4385] objective_lb_search_max_lp
#Bound 227.72s best:4386  next:[1273,4385] objective_lb_search_max_lp
#61    231.21s best:4372  next:[1273,4371] graph_var_lns (d=1.00 s=1175 t=0.10 p=0.59 stall=1 h=auto_l0)
#Bound 247.64s best:4372  next:[1274,4371] objective_lb_search_max_lp
#Bound 256.90s best:4372  next:[1324,4371] objective_lb_search_max_lp
#Bound 273.77s best:4372  next:[1364,4371] objective_lb_search_max_lp
#Bound 321.15s best:4372  next:[1366,4371] objective_lb_search_max_lp
#Bound 464.42s best:4372  next:[1367,4371] objective_lb_search_max_lp
#62    632.72s best:4345  next:[1367,4344] graph_arc_lns (d=1.00 s=2952 t=0.10 p=0.54 stall=0 h=auto_l0)
#Bound 687.30s best:4345  next:[1369,4344] objective_lb_search_max_lp
#Bound 704.87s best:4345  next:[1373,4344] objective_lb_search_max_lp
#63    739.71s best:4341  next:[1373,4340] graph_cst_lns (d=1.00 s=3423 t=0.10 p=0.53 stall=0 h=auto_l0)
#Bound 910.83s best:4341  next:[1377,4340] objective_lb_search_max_lp
#Bound 1108.29s best:4341  next:[1378,4340] objective_lb_search_max_lp
#Bound 1121.77s best:4341  next:[1389,4340] objective_lb_search_max_lp
#Bound 1154.49s best:4341  next:[1390,4340] objective_lb_search_max_lp
#Bound 1165.88s best:4341  next:[1391,4340] objective_lb_search_max_lp
#Bound 1208.87s best:4341  next:[1392,4340] objective_lb_search_max_lp
#Bound 1240.95s best:4341  next:[1398,4340] objective_lb_search_max_lp
#Bound 1290.83s best:4341  next:[1408,4340] objective_lb_search_max_lp
#Bound 2693.17s best:4341  next:[1410,4340] objective_lb_search_max_lp
#64    2771.07s best:4340  next:[1410,4339] graph_var_lns (d=1.00 s=12388 t=0.10 p=0.51 stall=6 h=auto_l0)
#65    2779.80s best:4318  next:[1410,4317] rnd_cst_lns (d=1.00 s=12436 t=0.10 p=0.51 stall=0 h=auto_l0)
#Bound 2937.39s best:4318  next:[1412,4317] objective_lb_search_max_lp
#Bound 3394.58s best:4318  next:[1413,4317] objective_lb_search_max_lp
#Bound 4000.71s best:4318  next:[1414,4317] objective_lb_search_max_lp
#Bound 4689.80s best:4318  next:[1415,4317] objective_lb_search_max_lp
#Bound 5316.80s best:4318  next:[1417,4317] objective_lb_search_max_lp
#Bound 5474.10s best:4318  next:[1419,4317] objective_lb_search_max_lp
#Bound 5511.31s best:4318  next:[1421,4317] objective_lb_search_max_lp
#Bound 5548.56s best:4318  next:[1425,4317] objective_lb_search_max_lp
#Bound 6218.68s best:4318  next:[1426,4317] objective_lb_search_max_lp
#Bound 8013.03s best:4318  next:[1428,4317] objective_lb_search_max_lp
#Bound 8989.05s best:4318  next:[1429,4317] objective_lb_search_max_lp
#Bound 9612.30s best:4318  next:[1430,4317] objective_lb_search_max_lp
#Bound 9904.06s best:4318  next:[1431,4317] objective_lb_search_max_lp
#Bound 11880.74s best:4318  next:[1432,4317] lb_tree_search (nodes=337811/337863 rc=540 decisions=1336781 @root=277 restarts=12) 
#Bound 12220.82s best:4318  next:[1433,4317] objective_lb_search_max_lp
#Bound 13006.58s best:4318  next:[1434,4317] lb_tree_search (nodes=351766/351821 rc=558 decisions=1446731 @root=300 restarts=12) 
#Bound 13465.48s best:4318  next:[1436,4317] objective_lb_search_max_lp
#Bound 13572.91s best:4318  next:[1438,4317] objective_lb_search_max_lp
#Bound 14518.40s best:4318  next:[1441,4317] objective_lb_search_max_lp
#Bound 15064.66s best:4318  next:[1443,4317] objective_lb_search_max_lp
#Bound 16284.71s best:4318  next:[1445,4317] objective_lb_search_max_lp
#Bound 16601.59s best:4318  next:[1447,4317] objective_lb_search_max_lp
#Bound 17232.30s best:4318  next:[1449,4317] objective_lb_search_max_lp
#Bound 18456.59s best:4318  next:[1450,4317] objective_lb_search_max_lp
#Bound 19774.31s best:4318  next:[1451,4317] objective_lb_search
#Bound 20130.14s best:4318  next:[1452,4317] objective_lb_search
#Bound 21698.09s best:4318  next:[1455,4317] objective_lb_search_max_lp
#Bound 21985.88s best:4318  next:[1456,4317] bool_core (num_cores=362 [size:1 mw:1] a=1 d=10 fixed=930/18370 clauses=2'331'031)
#Bound 22481.06s best:4318  next:[1457,4317] bool_core (num_cores=363 [size:1 mw:1] a=1 d=10 fixed=931/18408 clauses=2'346'191)
#Bound 23052.73s best:4318  next:[1458,4317] objective_lb_search_max_lp
#Bound 23858.95s best:4318  next:[1459,4317] bool_core (num_cores=365 [size:1 mw:1] a=1 d=10 fixed=934/18487 clauses=2'365'171)
#Bound 24508.71s best:4318  next:[1460,4317] bool_core (num_cores=366 [size:1 mw:1] a=1 d=10 fixed=935/18529 clauses=2'386'008)
#Bound 25346.05s best:4318  next:[1461,4317] bool_core (num_cores=367 [size:1 mw:1] a=1 d=10 fixed=936/18572 clauses=2'403'278)
#Bound 25526.92s best:4318  next:[1462,4317] bool_core (num_cores=368 [size:1 mw:1] a=1 d=10 fixed=937/18610 clauses=2'397'176)
#Bound 25634.66s best:4318  next:[1463,4317] bool_core (num_cores=369 [size:1 mw:1] a=1 d=10 fixed=938/18647 clauses=2'404'529)
#Bound 25808.68s best:4318  next:[1464,4317] bool_core (num_cores=370 [size:1 mw:1] a=1 d=10 fixed=939/18684 clauses=2'412'029)
#Bound 25919.88s best:4318  next:[1465,4317] bool_core (num_cores=371 [size:1 mw:1] a=1 d=10 fixed=940/18721 clauses=2'421'583)
#Bound 26017.15s best:4318  next:[1466,4317] bool_core (num_cores=372 [size:1 mw:1] a=1 d=10 fixed=941/18758 clauses=2'431'527)
#Bound 26112.85s best:4318  next:[1467,4317] bool_core (num_cores=373 [size:1 mw:1] a=1 d=10 fixed=942/18795 clauses=2'441'485)
#Bound 26405.20s best:4318  next:[1468,4317] bool_core (num_cores=374 [size:1 mw:1] a=1 d=10 fixed=943/18832 clauses=2'451'298)
#Bound 26510.05s best:4318  next:[1469,4317] bool_core (num_cores=375 [size:1 mw:1] a=1 d=10 fixed=944/18869 clauses=2'458'705)
#Bound 26651.74s best:4318  next:[1470,4317] bool_core (num_cores=376 [size:1 mw:1] a=1 d=10 fixed=945/18907 clauses=2'469'803)
#Bound 26866.94s best:4318  next:[1471,4317] bool_core (num_cores=377 [size:1 mw:1] a=1 d=10 fixed=946/18944 clauses=2'477'464)
#Bound 27180.47s best:4318  next:[1472,4317] bool_core (num_cores=378 [size:1 mw:1] a=1 d=10 fixed=947/18981 clauses=2'485'179)
#Bound 27297.40s best:4318  next:[1473,4317] bool_core (num_cores=379 [size:1 mw:1] a=1 d=10 fixed=948/19018 clauses=2'493'362)
#Bound 27407.28s best:4318  next:[1474,4317] bool_core (num_cores=380 [size:1 mw:1] a=1 d=10 fixed=949/19055 clauses=2'503'607)
#Bound 28357.11s best:4318  next:[1475,4317] bool_core (num_cores=381 [size:1 mw:1] a=1 d=10 fixed=950/19093 clauses=2'517'337)
#Bound 28693.59s best:4318  next:[1476,4317] objective_lb_search_max_lp
#Bound 29611.07s best:4318  next:[1477,4317] bool_core (num_cores=383 [size:1 mw:1] a=1 d=10 fixed=953/19178 clauses=2'550'722)
#Bound 30107.93s best:4318  next:[1478,4317] bool_core (num_cores=384 [size:1 mw:1] a=1 d=10 fixed=954/19221 clauses=2'550'049)
#Bound 30259.53s best:4318  next:[1479,4317] bool_core (num_cores=385 [size:1 mw:1] a=1 d=10 fixed=955/19258 clauses=2'555'069)
#Bound 30918.92s best:4318  next:[1480,4317] bool_core (num_cores=386 [size:1 mw:1] a=1 d=10 fixed=956/19303 clauses=2'573'824)
#Bound 31638.86s best:4318  next:[1481,4317] bool_core (num_cores=387 [size:1 mw:1] a=1 d=10 fixed=958/19342 clauses=2'583'844)
#Bound 31992.56s best:4318  next:[1482,4317] bool_core (num_cores=388 [size:1 mw:1] a=1 d=10 fixed=959/19379 clauses=2'589'052)
#Bound 32464.12s best:4318  next:[1483,4317] bool_core (num_cores=389 [size:1 mw:1] a=1 d=10 fixed=960/19418 clauses=2'601'130)
#Bound 32671.23s best:4318  next:[1484,4317] bool_core (num_cores=390 [size:1 mw:1] a=1 d=10 fixed=961/19455 clauses=2'603'004)
#Bound 32796.28s best:4318  next:[1485,4317] bool_core (num_cores=391 [size:1 mw:1] a=1 d=10 fixed=963/19492 clauses=2'612'675)
#Bound 33128.18s best:4318  next:[1486,4317] bool_core (num_cores=392 [size:1 mw:1] a=1 d=10 fixed=964/19529 clauses=2'627'259)
#Bound 33868.90s best:4318  next:[1487,4317] bool_core (num_cores=393 [size:1 mw:1] a=1 d=10 fixed=965/19571 clauses=2'644'214)
#Bound 34578.01s best:4318  next:[1488,4317] bool_core (num_cores=394 [size:1 mw:1] a=1 d=10 fixed=966/19620 clauses=2'653'683)
#Bound 35110.43s best:4318  next:[1489,4317] bool_core (num_cores=395 [size:1 mw:1] a=1 d=10 fixed=967/19659 clauses=2'663'440)
#Bound 36326.98s best:4318  next:[1490,4317] bool_core (num_cores=396 [size:1 mw:1] a=1 d=10 fixed=968/19707 clauses=2'680'502)
#Bound 36974.29s best:4318  next:[1491,4317] bool_core (num_cores=397 [size:1 mw:1] a=1 d=10 fixed=969/19746 clauses=2'687'723)
#Bound 37564.07s best:4318  next:[1492,4317] bool_core (num_cores=398 [size:1 mw:1] a=1 d=10 fixed=971/19783 clauses=2'690'591)
#Bound 37789.78s best:4318  next:[1493,4317] bool_core (num_cores=399 [size:1 mw:1] a=1 d=10 fixed=972/19820 clauses=2'699'295)
#Bound 38000.48s best:4318  next:[1494,4317] bool_core (num_cores=400 [size:1 mw:1] a=1 d=10 fixed=973/19862 clauses=2'707'173)
#Bound 38204.18s best:4318  next:[1495,4317] bool_core (num_cores=401 [size:1 mw:1] a=1 d=10 fixed=974/19899 clauses=2'718'241)
#Bound 39117.48s best:4318  next:[1496,4317] bool_core (num_cores=402 [size:1 mw:1] a=1 d=10 fixed=976/19950 clauses=2'741'451)
#Bound 39710.70s best:4318  next:[1497,4317] bool_core (num_cores=403 [size:1 mw:1] a=1 d=10 fixed=977/19992 clauses=2'740'333)
#Bound 40395.63s best:4318  next:[1498,4317] bool_core (num_cores=404 [size:1 mw:1] a=1 d=10 fixed=978/20029 clauses=2'756'184)
#Bound 41362.71s best:4318  next:[1499,4317] bool_core (num_cores=405 [size:1 mw:1] a=1 d=10 fixed=979/20071 clauses=2'763'233)
#Bound 42278.84s best:4318  next:[1500,4317] bool_core (num_cores=406 [size:1 mw:1] a=1 d=10 fixed=980/20112 clauses=2'776'845)
#Bound 42661.00s best:4318  next:[1501,4317] bool_core (num_cores=407 [size:1 mw:1] a=1 d=10 fixed=981/20150 clauses=2'779'811)
#Bound 42875.83s best:4318  next:[1502,4317] bool_core (num_cores=408 [size:1 mw:1] a=1 d=10 fixed=982/20187 clauses=2'789'498)
#Bound 43486.96s best:4318  next:[1503,4317] bool_core (num_cores=409 [size:1 mw:1] a=1 d=10 fixed=984/20226 clauses=2'805'020)
#Bound 44274.51s best:4318  next:[1504,4317] bool_core (num_cores=410 [size:1 mw:1] a=1 d=10 fixed=985/20263 clauses=2'819'861)
#Bound 44697.13s best:4318  next:[1505,4317] bool_core (num_cores=411 [size:1 mw:1] a=1 d=10 fixed=986/20300 clauses=2'823'192)
#Bound 45955.64s best:4318  next:[1506,4317] bool_core (num_cores=412 [size:1 mw:1] a=1 d=10 fixed=987/20343 clauses=2'851'755)
#Bound 46718.47s best:4318  next:[1507,4317] bool_core (num_cores=413 [size:1 mw:1] a=1 d=10 fixed=988/20382 clauses=2'850'328)
#Bound 46957.08s best:4318  next:[1508,4317] bool_core (num_cores=414 [size:1 mw:1] a=1 d=10 fixed=989/20419 clauses=2'852'317)
#Bound 47531.98s best:4318  next:[1509,4317] bool_core (num_cores=415 [size:1 mw:1] a=1 d=10 fixed=990/20456 clauses=2'867'617)
#Bound 47796.02s best:4318  next:[1510,4317] bool_core (num_cores=416 [size:1 mw:1] a=1 d=10 fixed=991/20493 clauses=2'872'631)
#Bound 48029.93s best:4318  next:[1511,4317] bool_core (num_cores=417 [size:1 mw:1] a=1 d=10 fixed=993/20530 clauses=2'883'872)
#66    48036.21s best:4278  next:[1511,4277] graph_cst_lns (d=1.00 s=217636 t=0.10 p=0.50 stall=0 h=auto_l0)
#67    48036.98s best:4276  next:[1511,4275] quick_restart_no_lp (fixed_bools=175/17343)
#68    48038.62s best:4275  next:[1511,4274] violation_ls(batch:17794 #solutions_imported:37 #perturbations:175 #lin_moves:78'228'869 #lin_evals:595'985'631 #gen_moves:10'122'414 #gen_evals:11'995'917 #comp_moves:363'994 #backtracks:4'877'840 #weight_updates:1'689'145)
#69    48040.22s best:4272  next:[1511,4271] graph_dec_lns (d=1.00 s=217661 t=0.10 p=0.50 stall=0 h=auto_l0)
#70    48077.25s best:4266  next:[1511,4265] rnd_var_lns (d=1.00 s=217827 t=0.10 p=0.50 stall=0 h=auto_l0)
#71    48096.10s best:4259  next:[1511,4258] graph_var_lns (d=1.00 s=217914 t=0.10 p=0.50 stall=0 h=auto_l0)
#72    48194.11s best:4234  next:[1511,4233] graph_dec_lns (d=1.00 s=218379 t=0.10 p=0.50 stall=1 h=auto_l0)
#73    48195.09s best:4233  next:[1511,4232] violation_ls(batch:17854 #solutions_imported:40 #perturbations:175 #lin_moves:97'640'047 #lin_evals:710'447'677 #gen_moves:7'610'724 #gen_evals:9'050'680 #comp_moves:388'991 #backtracks:3'609'894 #weight_updates:1'500'002)
#74    48197.35s best:4232  next:[1511,4231] violation_ls(batch:17855 #solutions_imported:41 #perturbations:175 #lin_moves:78'794'869 #lin_evals:598'272'773 #gen_moves:10'140'064 #gen_evals:11'996'793 #comp_moves:364'630 #backtracks:4'886'347 #weight_updates:1'713'307)
#75    48198.54s best:4228  next:[1511,4227] rnd_var_lns (d=1.00 s=218399 t=0.10 p=0.50 stall=0 h=auto_l0)
#76    48199.92s best:4227  next:[1511,4226] violation_ls(batch:17856 #solutions_imported:42 #perturbations:175 #lin_moves:97'645'416 #lin_evals:710'492'206 #gen_moves:7'621'075 #gen_evals:9'051'314 #comp_moves:389'206 #backtracks:3'614'957 #weight_updates:1'500'676)
#77    48199.92s best:4226  next:[1511,4225] violation_ls(batch:17856 #solutions_imported:42 #perturbations:175 #lin_moves:78'794'869 #lin_evals:598'272'798 #gen_moves:10'140'074 #gen_evals:11'996'794 #comp_moves:364'632 #backtracks:4'886'351 #weight_updates:1'713'307)
#78    48200.51s best:4204  next:[1511,4203] rins_pump_lns (d=0.94 s=218420 t=0.10 p=0.50 stall=0 h=auto_l0)
#Bound 48303.79s best:4204  next:[1512,4203] bool_core (num_cores=418 [size:1 mw:1] a=1 d=10 fixed=994/20567 clauses=2'892'763)
#Bound 48556.34s best:4204  next:[1513,4203] bool_core (num_cores=419 [size:1 mw:1] a=1 d=10 fixed=995/20604 clauses=2'899'828)
#Bound 48873.16s best:4204  next:[1514,4203] bool_core (num_cores=420 [size:1 mw:1] a=1 d=10 fixed=996/20641 clauses=2'914'831)
#Bound 49135.62s best:4204  next:[1515,4203] bool_core (num_cores=421 [size:1 mw:1] a=1 d=10 fixed=997/20678 clauses=2'922'115)
#79    49347.86s best:4192  next:[1515,4191] graph_var_lns (d=1.00 s=223661 t=0.10 p=0.50 stall=4 h=auto_l0)
#Bound 49352.53s best:4192  next:[1516,4191] bool_core (num_cores=422 [size:1 mw:1] a=1 d=10 fixed=999/20715 clauses=2'927'455)
#80    49359.37s best:4187  next:[1516,4186] rnd_var_lns (d=1.00 s=223710 t=0.10 p=0.50 stall=1 h=auto_l0)
#Bound 49597.05s best:4187  next:[1517,4186] bool_core (num_cores=423 [size:1 mw:1] a=1 d=10 fixed=1000/20752 clauses=2'940'693)
#Bound 49880.96s best:4187  next:[1518,4186] bool_core (num_cores=424 [size:1 mw:1] a=1 d=10 fixed=1001/20789 clauses=2'949'324)
#Bound 51284.67s best:4187  next:[1519,4186] bool_core (num_cores=425 [size:1 mw:1] a=1 d=10 fixed=1002/20827 clauses=2'971'078)
#Bound 52382.54s best:4187  next:[1520,4186] bool_core (num_cores=426 [size:1 mw:1] a=1 d=10 fixed=1004/20872 clauses=2'976'243)
#Bound 52983.96s best:4187  next:[1521,4186] bool_core (num_cores=427 [size:1 mw:1] a=1 d=10 fixed=1005/20910 clauses=2'987'372)
#Bound 54250.76s best:4187  next:[1522,4186] bool_core (num_cores=428 [size:1 mw:1] a=1 d=10 fixed=1006/20950 clauses=3'000'738)
#Bound 54925.69s best:4187  next:[1523,4186] bool_core (num_cores=429 [size:1 mw:1] a=1 d=10 fixed=1007/20988 clauses=3'005'111)
#Bound 56928.05s best:4187  next:[1524,4186] bool_core (num_cores=430 [size:1 mw:1] a=1 d=10 fixed=1008/21033 clauses=3'026'882)
#Bound 57816.53s best:4187  next:[1525,4186] bool_core (num_cores=431 [size:1 mw:1] a=1 d=10 fixed=1009/21071 clauses=3'035'328)
#Bound 59491.37s best:4187  next:[1526,4186] bool_core (num_cores=432 [size:1 mw:1] a=1 d=10 fixed=1011/21125 clauses=3'055'048)
#Bound 59905.14s best:4187  next:[1527,4186] bool_core (num_cores=433 [size:1 mw:1] a=1 d=10 fixed=1013/21162 clauses=3'046'734)
#Bound 60258.71s best:4187  next:[1528,4186] bool_core (num_cores=434 [size:1 mw:1] a=1 d=10 fixed=1014/21199 clauses=3'062'551)
#Bound 62104.93s best:4187  next:[1529,4186] bool_core (num_cores=435 [size:1 mw:1] a=1 d=10 fixed=1015/21254 clauses=3'082'026)
#Bound 63513.34s best:4187  next:[1530,4186] bool_core (num_cores=436 [size:1 mw:1] a=1 d=10 fixed=1016/21299 clauses=3'092'783)
#Bound 65243.76s best:4187  next:[1531,4186] bool_core (num_cores=437 [size:1 mw:1] a=1 d=10 fixed=1017/21343 clauses=3'105'602)
#Bound 65628.77s best:4187  next:[1532,4186] bool_core (num_cores=438 [size:1 mw:1] a=1 d=10 fixed=1018/21381 clauses=3'103'859)
#Bound 66733.12s best:4187  next:[1533,4186] bool_core (num_cores=439 [size:1 mw:1] a=1 d=10 fixed=1019/21422 clauses=3'125'953)
#Bound 68170.01s best:4187  next:[1534,4186] bool_core (num_cores=440 [size:1 mw:1] a=1 d=10 fixed=1020/21467 clauses=3'137'003)
#Bound 69330.69s best:4187  next:[1535,4186] bool_core (num_cores=441 [size:1 mw:1] a=1 d=10 fixed=1022/21512 clauses=3'139'356)
#Bound 69912.05s best:4187  next:[1536,4186] bool_core (num_cores=442 [size:1 mw:1] a=1 d=10 fixed=1024/21549 clauses=3'149'470)
#Bound 70212.62s best:4187  next:[1537,4186] bool_core (num_cores=443 [size:1 mw:1] a=1 d=10 fixed=1025/21586 clauses=3'155'955)
#Bound 70542.81s best:4187  next:[1538,4186] bool_core (num_cores=444 [size:1 mw:1] a=1 d=10 fixed=1026/21623 clauses=3'165'520)
#Bound 70824.84s best:4187  next:[1539,4186] bool_core (num_cores=445 [size:1 mw:1] a=1 d=10 fixed=1027/21660 clauses=3'173'806)
#Bound 73081.02s best:4187  next:[1540,4186] bool_core (num_cores=446 [size:1 mw:1] a=1 d=10 fixed=1029/21708 clauses=3'199'928)
#Bound 73760.58s best:4187  next:[1541,4186] bool_core (num_cores=447 [size:1 mw:1] a=1 d=10 fixed=1030/21747 clauses=3'206'089)
#Bound 75083.83s best:4187  next:[1542,4186] bool_core (num_cores=448 [size:1 mw:1] a=1 d=10 fixed=1031/21788 clauses=3'216'346)
#Bound 76701.76s best:4187  next:[1543,4186] bool_core (num_cores=449 [size:1 mw:1] a=1 d=10 fixed=1032/21827 clauses=3'230'641)
#Bound 78236.01s best:4187  next:[1544,4186] bool_core (num_cores=450 [size:1 mw:1] a=1 d=10 fixed=1033/21877 clauses=3'245'134)
#Bound 79498.08s best:4187  next:[1545,4186] bool_core (num_cores=451 [size:1 mw:1] a=1 d=10 fixed=1034/21921 clauses=3'251'153)
#Bound 80304.44s best:4187  next:[1546,4186] bool_core (num_cores=452 [size:1 mw:1] a=1 d=10 fixed=1035/21963 clauses=3'261'042)
#Bound 80682.64s best:4187  next:[1547,4186] bool_core (num_cores=453 [size:1 mw:1] a=1 d=10 fixed=1036/22000 clauses=3'268'747)
#Bound 80804.75s best:4187  next:[1550,4186] objective_lb_search
#Bound 82326.14s best:4187  next:[1551,4186] objective_lb_search
#Bound 85199.67s best:4187  next:[1552,4186] objective_lb_search
#Bound 85914.57s best:4187  next:[1553,4186] objective_lb_search

Task timing                                  n [     min,      max]      avg      dev     time         n [     min,      max]      avg      dev    dtime
                             'core':         1 [  24.00h,   24.00h]   24.00h   0.00ns   24.00h         1 [   8.57h,    8.57h]    8.57h   0.00ns    8.57h
                       'default_lp':         1 [  24.00h,   24.00h]   24.00h   0.00ns   24.00h         1 [   1.85h,    1.85h]    1.85h   0.00ns    1.85h
                 'feasibility_pump':      6846 [137.21us,    1.85m]   12.62s    2.86s   24.00h      6664 [510.47ms,   23.47s]    1.17s 314.69ms    2.16h
                            'fixed':         1 [  24.00h,   24.00h]   24.00h   0.00ns   24.00h         1 [   1.84h,    1.84h]    1.84h   0.00ns    1.84h
                  'fj_long_default':         7 [111.43ms,    2.76s] 513.65ms 919.39ms    3.60s         7 [180.19ms, 250.15ms] 204.95ms  21.22ms    1.43s
              'fj_long_lin_default':         2 [137.08ms,    3.47s]    1.81s    1.67s    3.61s         2 [191.23ms, 226.90ms] 209.06ms  17.83ms 418.12ms
                   'fj_long_random':         7 [104.53ms,    2.85s] 512.98ms 953.39ms    3.59s         7 [183.40ms, 249.69ms] 202.72ms  21.87ms    1.42s
                 'fj_short_default':        20 [116.53ms,    1.22s] 186.61ms 236.55ms    3.73s        20 [214.97ms, 285.43ms] 247.99ms  17.67ms    4.96s
             'fj_short_lin_default':         2 [128.15ms,    3.49s]    1.81s    1.68s    3.62s         2 [207.73ms, 232.83ms] 220.28ms  12.55ms 440.56ms
              'fj_short_lin_random':         2 [141.35ms,    3.46s]    1.80s    1.66s    3.60s         2 [204.12ms, 232.99ms] 218.55ms  14.43ms 437.11ms
                  'fj_short_random':         8 [114.46ms,    2.63s] 440.69ms 826.74ms    3.53s         8 [210.32ms, 265.34ms] 243.20ms  16.93ms    1.95s
                        'fs_random':         1 [   4.01s,    4.01s]    4.01s   0.00ns    4.01s         1 [152.71ms, 152.71ms] 152.71ms   0.00ns 152.71ms
                        'fs_random':         1 [   4.06s,    4.06s]    4.06s   0.00ns    4.06s         1 [ 56.89ms,  56.89ms]  56.89ms   0.00ns  56.89ms
                  'fs_random_no_lp':         1 [   4.08s,    4.08s]    4.08s   0.00ns    4.08s         1 [ 55.52ms,  55.52ms]  55.52ms   0.00ns  55.52ms
          'fs_random_quick_restart':         1 [   4.03s,    4.03s]    4.03s   0.00ns    4.03s         1 [ 68.02ms,  68.02ms]  68.02ms   0.00ns  68.02ms
          'fs_random_quick_restart':         1 [   4.03s,    4.03s]    4.03s   0.00ns    4.03s         1 [111.15ms, 111.15ms] 111.15ms   0.00ns 111.15ms
    'fs_random_quick_restart_no_lp':         1 [   4.03s,    4.03s]    4.03s   0.00ns    4.03s         1 [ 41.05ms,  41.05ms]  41.05ms   0.00ns  41.05ms
                    'graph_arc_lns':     32641 [160.56ms,    8.27s]    3.79s 716.78ms   34.40h     32626 [ 10.00ns, 201.34ms]  76.89ms  29.68ms   41.81m
                    'graph_cst_lns':     32641 [ 34.37ms,    8.66s]    3.81s 794.80ms   34.53h     32613 [ 10.00ns, 190.75ms]  73.25ms  33.35ms   39.81m
                    'graph_dec_lns':     32641 [170.16ms,    9.16s]    3.79s 770.84ms   34.32h     32614 [ 10.00ns, 200.85ms]  74.41ms  32.16ms   40.45m
                    'graph_var_lns':     32641 [186.50ms,    8.64s]    3.61s 920.17ms   32.69h     32594 [ 10.00ns, 189.08ms]  72.25ms  34.30ms   39.25m
                   'lb_tree_search':         1 [  24.00h,   24.00h]   24.00h   0.00ns   24.00h         1 [  17.21h,   17.21h]   17.21h   0.00ns   17.21h
                           'max_lp':         1 [  24.00h,   24.00h]   24.00h   0.00ns   24.00h         1 [   1.90h,    1.90h]    1.90h   0.00ns    1.90h
                            'no_lp':         1 [  24.00h,   24.00h]   24.00h   0.00ns   24.00h         1 [   1.48h,    1.48h]    1.48h   0.00ns    1.48h
              'objective_lb_search':         1 [  24.00h,   24.00h]   24.00h   0.00ns   24.00h         1 [   2.57h,    2.57h]    2.57h   0.00ns    2.57h
       'objective_lb_search_max_lp':         1 [  24.00h,   24.00h]   24.00h   0.00ns   24.00h         1 [   3.39h,    3.39h]    3.39h   0.00ns    3.39h
        'objective_lb_search_no_lp':         1 [  24.00h,   24.00h]   24.00h   0.00ns   24.00h         1 [   1.05h,    1.05h]    1.05h   0.00ns    1.05h
  'objective_shaving_search_max_lp':       166 [166.78ms,   47.92m]    8.67m    9.06m   24.00h       158 [ 70.61ms,    2.26m]   26.42s   29.12s    1.16h
   'objective_shaving_search_no_lp':       167 [115.69ms,   47.90m]    8.62m    9.06m   24.00h       158 [ 71.11ms,    1.26m]   13.09s   13.08s   34.48m
                          'probing':         1 [  24.00h,   24.00h]   24.00h   0.00ns   24.00h         1 [   5.32h,    5.32h]    5.32h   0.00ns    5.32h
                   'probing_max_lp':         1 [  24.00h,   24.00h]   24.00h   0.00ns   24.00h         1 [   6.69h,    6.69h]    6.69h   0.00ns    6.69h
                     'pseudo_costs':         1 [  24.00h,   24.00h]   24.00h   0.00ns   24.00h         1 [   2.42h,    2.42h]    2.42h   0.00ns    2.42h
                    'quick_restart':         1 [  24.00h,   24.00h]   24.00h   0.00ns   24.00h         1 [   4.25h,    4.25h]    4.25h   0.00ns    4.25h
              'quick_restart_no_lp':         1 [  24.00h,   24.00h]   24.00h   0.00ns   24.00h         1 [   1.58h,    1.58h]    1.58h   0.00ns    1.58h
                    'reduced_costs':         1 [  24.00h,   24.00h]   24.00h   0.00ns   24.00h         1 [   3.22h,    3.22h]    3.22h   0.00ns    3.22h
                        'rins/rens':     32642 [  1.03ms,    3.46s]    1.01s 616.66ms    9.18h     28552 [ 10.00ns, 106.31ms]  68.74ms  40.25ms   32.71m
                      'rnd_cst_lns':     32641 [189.49ms,    8.67s]    3.79s 786.72ms   34.36h     32610 [ 10.00ns, 202.11ms]  73.60ms  33.09ms   40.00m
                      'rnd_var_lns':     32641 [ 79.26ms,    8.06s]    3.74s 776.58ms   33.89h     32614 [ 10.00ns, 200.94ms]  73.89ms  32.62ms   40.16m
         'scheduling_intervals_lns':     32641 [134.06ms,    8.36s]    4.39s 286.70ms   39.80h     32638 [100.01ms, 102.67ms] 100.75ms 706.11us   54.81m
       'scheduling_precedences_lns':     32641 [147.53ms,    7.64s]    4.40s 276.86ms   39.94h     32636 [100.01ms, 202.75ms] 100.76ms   1.06ms   54.81m
       'scheduling_time_window_lns':     32641 [ 96.76ms,    8.53s]    4.39s 278.43ms   39.79h     32636 [100.01ms, 203.60ms] 100.76ms   1.06ms   54.81m
                     'violation_ls':     32641 [  5.69ms, 505.25ms] 163.06ms  41.14ms    1.48h     32641 [790.00ns, 467.09ms] 250.77ms  56.71ms    2.27h
                     'violation_ls':     32642 [  6.10ms, 526.66ms] 165.20ms  45.34ms    1.50h     32642 [  1.59us, 514.85ms] 254.17ms  67.01ms    2.30h

Search stats                          Bools  Conflicts    Branches   Restarts      BoolPropag   IntegerPropag
                           'core':   22'206  2'602'319   3'550'527     65'759  15'444'084'391  24'628'324'386
                     'default_lp':   28'217    890'844   6'501'623    354'905   2'341'334'451  16'227'865'084
                          'fixed':    2'867  2'386'787   2'393'419      1'713     926'608'544  23'021'641'863
                      'fs_random':      379          0         772        758              54         268'239
                      'fs_random':      379          0         791        758              72         260'465
                'fs_random_no_lp':      441         23         841        758           1'629         507'450
        'fs_random_quick_restart':      379          0         778        758              55         261'148
        'fs_random_quick_restart':      379          0         786        758              72         258'090
  'fs_random_quick_restart_no_lp':      456          2       1'207        759              65         470'968
                 'lb_tree_search':      445        848  19'651'184  4'447'091      50'735'488  19'442'462'867
                         'max_lp':    3'670    663'379   6'456'881  1'147'306     305'311'113  16'810'982'565
                          'no_lp':    6'220  1'340'122   6'957'515    469'998     904'161'412  21'451'072'273
            'objective_lb_search':    3'085    330'090   5'458'842    913'459     213'497'843  14'642'162'017
     'objective_lb_search_max_lp':    1'561    417'048   6'161'584  1'472'697     137'407'301  17'261'318'243
      'objective_lb_search_no_lp':    1'342    524'395   2'347'631    418'589      85'632'048  14'448'036'685
                        'probing':   10'405      9'148      75'024     43'779       5'384'683     104'529'282
                 'probing_max_lp':   10'405      9'122      56'660     34'597       4'935'645      97'909'516
                   'pseudo_costs':   22'034  1'266'433  15'327'402    611'617   2'765'737'660  21'695'871'353
                  'quick_restart':   23'336    327'818  17'868'778    312'165   2'497'113'294  15'166'345'649
            'quick_restart_no_lp':   24'830  1'075'835  10'038'602    173'290   4'155'637'401  21'036'037'363
                  'reduced_costs':  113'204  1'641'401  10'771'593    273'785  19'713'649'525  20'437'938'002

SAT stats                           ClassicMinim  LitRemoved  LitLearned  LitForgotten  Subsumed   MClauses  MDecisions  MLitTrue  MSubsumed  MLitRemoved  MReused
                           'core':     2'524'984  64'737'612  46'304'531    26'719'667     2'034     30'042     149'804         0      2'002       11'775      435
                     'default_lp':       751'092   6'220'908  27'429'002    23'249'429     3'370    103'864     967'893         0     18'527      135'767   20'341
                          'fixed':     1'958'786   8'792'001  90'443'902    89'197'243     3'200        115       1'369         0         43          346       22
                      'fs_random':             0           0           0             0         0          0           0         0          0            0        0
                      'fs_random':             0           0           0             0         0          0           0         0          0            0        0
                'fs_random_no_lp':             1           3         207             0         0          0           0         0          0            0        0
        'fs_random_quick_restart':             0           0           0             0         0          0           0         0          0            0        0
        'fs_random_quick_restart':             0           0           0             0         0          0           0         0          0            0        0
  'fs_random_quick_restart_no_lp':             0           0           4             0         0          0           0         0          0            0        0
                 'lb_tree_search':             0           0       2'646             0         0  1'888'682   9'507'861         0        138          534  212'667
                         'max_lp':       507'046   3'081'280  18'163'134    17'109'482     6'981    412'696   2'582'272         0      5'316       29'955   38'882
                          'no_lp':     1'167'841   6'777'783  27'955'767    22'210'164     8'493     86'517     839'165         0     12'306       89'050   14'955
            'objective_lb_search':       295'344   2'331'485   5'325'581     2'284'769     2'709    167'677   1'361'836         0     15'840      128'131   32'496
     'objective_lb_search_max_lp':       354'531   1'825'157   6'000'241     2'124'280     5'219    182'269   2'152'180         0      5'148       41'339   37'726
      'objective_lb_search_no_lp':       477'261   4'336'751   8'783'555     3'257'470     3'427     75'429     688'295         0      4'088       36'328   14'235
                        'probing':             0           0       9'148             0         0          0           0         0          0            0        0
                 'probing_max_lp':             0           0       9'122             0         0          0           0         0          0            0        0
                   'pseudo_costs':     1'026'837   5'734'509  32'383'519    30'668'420     3'656    177'236   1'625'989         0      8'965       56'003   65'688
                  'quick_restart':       271'551   2'662'899   9'056'000     6'996'463     3'433    100'470   1'572'234         0     46'669      493'435   18'406
            'quick_restart_no_lp':       929'505  11'223'331  34'510'113    29'115'549     2'766     35'898     495'642         0     25'612      282'169    2'420
                  'reduced_costs':     1'384'112  12'931'842  55'179'577    50'921'380     8'461    151'282   1'634'196        65     56'119      407'750   50'335

Lp stats                         Component   Iterations  AddedCuts    OPTIMAL    DUAL_F.  DUAL_U.
                  'default_lp':          1   14'479'809    879'745  1'776'582      1'392      279
                       'fixed':          1    4'067'743      3'617  3'400'261          0        0
                   'fs_random':          1        3'783        896         38          0        0
                   'fs_random':          1        6'559        959         73          1        0
     'fs_random_quick_restart':          1        4'332        920         45          0        0
     'fs_random_quick_restart':          1        5'575        913         61          0        0
              'lb_tree_search':          1  122'029'447     88'115     15'807  9'972'106        0
                      'max_lp':          1   16'900'091    425'329    570'348  1'386'744       28
         'objective_lb_search':          1   32'215'867  1'043'858  1'343'714      5'717       33
  'objective_lb_search_max_lp':          1   17'630'123     29'984      2'580  1'257'234        0
                     'probing':          1   20'788'909  2'440'621    217'878      6'773        4
              'probing_max_lp':          1   11'287'130    638'897    117'157     32'925        0
                'pseudo_costs':          1   12'800'537  1'071'184  1'482'075    861'489      162
               'quick_restart':          1   55'957'493  3'463'724  1'916'132     19'774    1'542
               'reduced_costs':          1   15'572'203    973'434  1'572'106  1'116'923       42

Lp dimension                                                                        Final dimension of first component
                  'default_lp':  5063 rows, 5344 columns, 18583 entries with magnitude in [7.532982e-04, 1.000000e+00]
                       'fixed':  4783 rows, 5344 columns, 17237 entries with magnitude in [9.545740e-03, 1.000000e+00]
                   'fs_random':   1873 rows, 5344 columns, 7477 entries with magnitude in [9.545740e-03, 1.000000e+00]
                   'fs_random':  2773 rows, 5344 columns, 10502 entries with magnitude in [9.545740e-03, 1.000000e+00]
     'fs_random_quick_restart':   2023 rows, 5344 columns, 7980 entries with magnitude in [9.545740e-03, 1.000000e+00]
     'fs_random_quick_restart':   2423 rows, 5344 columns, 9297 entries with magnitude in [9.545740e-03, 1.000000e+00]
              'lb_tree_search':  9113 rows, 5359 columns, 52695 entries with magnitude in [1.398668e-04, 1.000000e+00]
                      'max_lp':  5203 rows, 5359 columns, 19050 entries with magnitude in [4.833027e-03, 1.000000e+00]
         'objective_lb_search':  6142 rows, 5344 columns, 23877 entries with magnitude in [2.002348e-04, 1.000000e+00]
  'objective_lb_search_max_lp':  8771 rows, 5359 columns, 41662 entries with magnitude in [4.240072e-05, 1.000000e+00]
                     'probing':  7752 rows, 5344 columns, 38669 entries with magnitude in [1.296816e-04, 1.000000e+00]
              'probing_max_lp':  6762 rows, 5359 columns, 37997 entries with magnitude in [3.911839e-04, 1.000000e+00]
                'pseudo_costs':  5230 rows, 5359 columns, 19077 entries with magnitude in [1.573210e-03, 1.000000e+00]
               'quick_restart':  5824 rows, 5344 columns, 21811 entries with magnitude in [4.069293e-03, 1.000000e+00]
               'reduced_costs':  5317 rows, 5359 columns, 19977 entries with magnitude in [2.902119e-03, 1.000000e+00]

Lp debug                         CutPropag  CutEqPropag     Adjust  Overflow            Bad  BadScaling
                  'default_lp':         20          194    206'242         0     31'613'530           0
                       'fixed':          0            0          0         0         74'082           0
                   'fs_random':          0            0          0         0          4'311           0
                   'fs_random':          0            0          0         0          4'363           0
     'fs_random_quick_restart':          0            0          0         0          4'312           0
     'fs_random_quick_restart':          0            0          0         0          4'329           0
              'lb_tree_search':         63          266  9'123'914         0     83'947'530           0
                      'max_lp':        109          120    262'778         0     29'369'253           0
         'objective_lb_search':         50          232    639'451         0     43'800'856           0
  'objective_lb_search_max_lp':         12           44  1'218'210         0      9'203'807           0
                     'probing':        723        8'660    222'889         0  2'966'473'973           0
              'probing_max_lp':        341        1'733    150'079         0  2'021'997'627           0
                'pseudo_costs':        196          237    255'600         0     67'551'902           0
               'quick_restart':        254          698  1'076'858         0    267'868'299           0
               'reduced_costs':        117          255    682'079         0     62'265'306           0

Lp pool                          Constraints  Updates  Simplif  Merged  Shortened      Split  Strenghtened            Cuts/Call
                  'default_lp':       15'475    4'259   13'951      41          0    127'964        75'661    879'745/2'665'635
                       'fixed':        9'388        4       82       0          0          4           363        3'617/117'024
                   'fs_random':        6'667        0        0       0          0          0           162            896/2'712
                   'fs_random':        6'730        0        0       0          0          0           162            959/3'618
     'fs_random_quick_restart':        6'684        0        0       0          0          0           162            913/3'313
     'fs_random_quick_restart':        6'691        0        0       0          0          0           163            920/2'919
              'lb_tree_search':       62'277    5'309  487'188      15          0    429'455       498'624       88'115/198'783
                      'max_lp':       62'481    3'365  402'152      25          0    221'506       465'128      425'329/928'177
         'objective_lb_search':       15'579    5'109   16'958      50          0    177'830       103'385  1'043'858/3'507'072
  'objective_lb_search_max_lp':       63'136    1'051  466'609      25          0     71'385       470'044        29'984/60'545
                     'probing':       15'366  251'125    9'311      26          0  4'944'244       488'911  2'440'621/4'313'137
              'probing_max_lp':       63'063   75'083  432'914      11          0  1'037'179       527'084    638'897/1'444'085
                'pseudo_costs':       62'301    7'338  438'947      60          0    634'694       580'351  1'071'184/2'245'153
               'quick_restart':       15'345   20'764   14'905     150          0  2'049'921       292'162  3'463'724/8'243'982
               'reduced_costs':       62'521    7'132  437'113      90          0    955'788       555'414    973'434/1'995'714

Lp Cut                                                fs_ran  fs_ran  fs_ran  fs_ran   defaul  fixed   max_lp     quick_   reduce   pseudo  lb_tre   probin   object   probin  object
                                              CG_FF:      60      59      60      59   42'661    114   26'507     34'778   63'057   66'802   2'262   38'463   22'688    3'539   1'448
                                               CG_K:      58      58      58      58   30'839    103   26'115     22'707   66'709   71'120   1'425   20'717   16'109    2'418     689
                                              CG_KL:       -       -       -       -      193      -       45        110      117      208       -      212      106        8       -
                                               CG_R:      56      56      56      56   20'102     84   12'872     19'091   30'172   35'821   1'591   31'482   12'798    2'471     528
                                              CG_RB:       6       6       6       6   84'784     92   57'535     86'099  125'721  152'169   6'971  130'022   69'083    5'320   3'158
                                             CG_RBP:       1       1       1       1    8'526      4    7'412      8'256   19'205   21'007   1'192   10'378    6'135    1'056     737
                                             Clique:       -       -       -       -        -      -    5'691          -   16'670   18'523     283        -        -    1'782     238
                                                 IB:     320     279     291     271  409'452  2'106  116'707  2'434'661  251'390  262'372  10'586  533'709  691'360   78'027   5'389
                                           MIR_1_FF:     150     150     149     149   31'755    241   16'504     72'044   43'936   47'833   3'186   96'039   20'014   21'150   1'319
                                            MIR_1_K:      38      38      38      38    3'685     49    2'179     10'620    5'293    5'625     496   12'796    2'719    3'619     216
                                           MIR_1_KL:       -       -       -       -      922      2      532      3'185    1'069      450      48   10'943    1'005    2'022      32
                                            MIR_1_R:      38      38      38      38    6'192     59    2'679     14'724    7'328    8'600     721   42'757    3'865    6'155     278
                                           MIR_1_RB:      46      45      44      44   47'234    170   35'232    161'531   79'674   81'930   9'522  229'816   36'889   66'195   3'571
                                          MIR_1_RBP:       2       2       2       2    3'533     10    9'705     15'765   20'266   18'628   1'360   21'013    4'624    5'732     686
                                          MIR_1_RLT:       -       -       -       -        -      -      329          -      803      979      39        -        -      642      27
                                           MIR_2_FF:      22      28      24      28   20'455     73    9'260     44'675   23'895   27'712   1'704   53'966   12'943   11'813     770
                                            MIR_2_K:      27      27      25      24    3'361     37    1'605      7'352    4'177    4'480     224    7'179    2'250    1'870     176
                                           MIR_2_KL:       -       -       -       -      672      -      451      2'937      829      409      37    8'704      636    1'628      20
                                            MIR_2_R:       9      11       7      11    4'402     16    1'956     11'197    4'940    6'056   1'109   45'850    3'388    9'028     290
                                           MIR_2_RB:      46      50      47      46   31'377    130   15'672    103'930   35'187   42'863   3'945  172'398   24'732   32'119   1'506
                                          MIR_2_RBP:       -       2       1       -    2'684      7    3'690     11'777    7'396    7'896     545   18'280    3'243    3'457     237
                                           MIR_3_FF:      10       8       6       7   12'860     30    5'989     28'709   14'551   18'560     862   37'512    8'806    6'321     458
                                            MIR_3_K:      11      10      10       9    2'393     21    1'326      5'206    3'116    3'426     173    5'756    1'775    1'459     119
                                           MIR_3_KL:       -       -       -       -      676      -      338      2'892      750      419      51    7'698      700    1'009      37
                                            MIR_3_R:       2       2       2       1    2'615      8    1'278      8'437    2'988    3'566   1'076   30'900    2'415    7'600     267
                                           MIR_3_RB:      18      19      12       8   19'131     55    8'861     63'002   20'201   25'428   2'173  122'540   15'347   17'782     746
                                          MIR_3_RBP:       1       1       -       1    1'968      3    2'036      8'108    4'389    4'862     324   13'659    2'767    2'042     171
                                           MIR_4_FF:       1       1       1       1    8'204      6    3'234     18'790    8'365   10'942     392   25'806    5'658    3'329     233
                                            MIR_4_K:       -       1       2       3    1'977      6      865      3'908    2'078    2'581      98    4'330    1'394    1'047      87
                                           MIR_4_KL:       -       -       -       -      545      -      278      2'455      691      361      45    5'927      550      790      33
                                            MIR_4_R:       -       -       1       -    1'735      2      645      5'518    1'601    1'902     390   17'501    1'698    3'173     105
                                           MIR_4_RB:       3       3       3       6   12'747     25    4'821     38'540   10'877   15'055     955   81'110    9'779    8'900     351
                                          MIR_4_RBP:       -       -       -       -    1'269      2      940      4'829    2'109    2'421     163    7'722    1'681    1'434     112
                                           MIR_5_FF:       3       2       2       3    5'247     10    1'824     12'638    4'685    6'074     265   19'286    4'054    1'955     152
                                            MIR_5_K:       1       1       1       1    1'298      5      526      3'395    1'209    1'363      72    3'921    1'052      779      50
                                           MIR_5_KL:       -       -       -       -      504      -      290      2'762      667      362      57    7'116      580      802      38
                                            MIR_5_R:       3       1       1       4    1'136      4      350      3'752      844      929     243   10'490    1'450    1'682      64
                                           MIR_5_RB:       3       1       2       4    8'002     12    2'825     24'516    6'161    8'286     555   59'302    6'641    5'239     213
                                          MIR_5_RBP:       -       -       -       -      783      -      515      3'929    1'167    1'120      86    6'230    1'186      818      51
                                           MIR_6_FF:       2       1       1       -    3'439     12    1'075      8'500    2'941    3'590     172   15'186    2'583    1'286      87
                                            MIR_6_K:       2       1       -       -      945      3      334      2'771      839      821      52    4'464      869      582      54
                                           MIR_6_KL:       -       -       -       -      506      1      309      3'008      795      436      70    9'429      696      940      34
                                            MIR_6_R:       2       1       -       -      751      1      249      2'558      588      557     115    7'151      919      896      36
                                           MIR_6_RB:       2       1       1       -    5'130     14    1'706     16'956    4'039    4'979     301   48'724    4'530    3'360     117
                                          MIR_6_RBP:       -       -       -       -      628      1      329      3'711      910      741      75    7'018    1'073      619      40
   NoOverlapCompletionTimeExhaustiveMirror_weighted:       -       -       -       -        -      -        -          -        1        1       -        -        -        -       -
         NoOverlapCompletionTimeExhaustive_weighted:       -       -       -       -        -      -      425          -    1'236    1'710       3        -        -        1       7
  NoOverlapCompletionTimeExhaustive_weighted_lifted:       -       -       -       -        -      -      576          -    1'384    1'995       4        -        -        4      12
                    NoOverlapCompletionTimeQueyrane:       -       -       -       -        -      -       99          -      359      309       6        -        -        3       8
             NoOverlapCompletionTimeQueyrane_lifted:       -       -       -       -        -      -      148          -      462      433       2        -        -        2       5
                          NoOverlapDisjunctionOnEnd:       -       -       -       -        -      -        1          -       19       14       -        -        -        -       1
                        NoOverlapDisjunctionOnStart:       -       -       -       -        -      -      716          -    1'806    2'543       5        -        -        5      11
                                       ZERO_HALF_FF:       5       6       9       6    7'773     25    4'770     11'725   11'731   12'752     283   12'755    4'892    1'661     198
                                        ZERO_HALF_K:       3       2       3       3    3'143     13    2'939      4'424    7'339    7'520     234    4'231    1'959    1'270     135
                                       ZERO_HALF_KL:       -       -       -       -      196      -       25        340      120       64       -      361      233        6       -
                                        ZERO_HALF_R:       4       3       4       3    8'510     26    9'402     60'520   18'158   16'713  27'818  269'668   11'141  270'287   3'663
                                       ZERO_HALF_RB:       4       5       5       5   10'524     27    9'841     32'354   21'441   21'235   2'539   66'657   10'089   14'816     730
                                      ZERO_HALF_RBP:       -       -       -       -    2'281      8    2'766     10'032    4'983    5'631   1'210   43'447    2'754   16'947     244

LNS stats                        Improv/Calls  Closed  Difficulty  TimeLimit
               'graph_arc_lns':   12156/32639     50%        1.00       0.10
               'graph_cst_lns':   14045/32638     50%        1.00       0.10
               'graph_dec_lns':   12952/32639     50%        1.00       0.10
               'graph_var_lns':   14260/32640     50%        1.00       0.10
                   'rins/rens':    7572/30277     50%        0.94       0.10
                 'rnd_cst_lns':   13861/32639     50%        1.00       0.10
                 'rnd_var_lns':   12982/32639     50%        1.00       0.10
    'scheduling_intervals_lns':   32638/32638      0%        0.00       0.10
  'scheduling_precedences_lns':   32638/32638      0%        0.00       0.10
  'scheduling_time_window_lns':   32638/32638      0%        0.00       0.10

LS stats                   Batches  Restarts     LinMoves    GenMoves  CompoundMoves  WeightUpdates
       'fj_long_default':        7         1       69'848           0              0            152
   'fj_long_lin_default':        2         1            0       4'559            795              0
        'fj_long_random':        7         1       69'844           0              0            156
      'fj_short_default':       20         1            0      28'175          3'953              3
  'fj_short_lin_default':        2         1            0       3'951            974              0
   'fj_short_lin_random':        2         1            0       3'915            959              0
       'fj_short_random':        8         1            0      10'863          1'878              0
          'violation_ls':   32'641         0  148'522'464  19'231'186        682'091      2'996'639
          'violation_ls':   32'642         0  160'724'554  16'149'347        710'676      3'237'702

Solutions (80)                      Num     Rank
  'fs_random_quick_restart_no_lp':    1    [1,1]
                  'graph_arc_lns':    9   [5,62]
                  'graph_cst_lns':    6  [10,66]
                  'graph_dec_lns':    5  [49,72]
                  'graph_var_lns':    9   [9,79]
                          'no_lp':    4    [2,6]
            'quick_restart_no_lp':    7  [15,67]
                    'rins_lp_lns':    6   [8,53]
                  'rins_pump_lns':    3  [54,78]
                    'rnd_cst_lns':    5  [26,65]
                    'rnd_var_lns':    6  [25,80]
                   'violation_ls':   19  [11,77]

Objective bounds                      Num
                        'bool_core':   90
                  'fs_random_no_lp':    1
                   'initial_domain':    1
                   'lb_tree_search':    6
                           'max_lp':    2
              'objective_lb_search':    7
       'objective_lb_search_max_lp':   50
        'objective_lb_search_no_lp':    1
  'objective_shaving_search_max_lp':   11
                    'reduced_costs':    1

Solution repositories      Added  Queried  Ignored  Synchro
  'feasible solutions':  138'418  742'572        0  135'942
        'lp solutions':   67'066   16'405        0   65'532
                'pump':  139'675   16'237

Improving bounds shared             Num
                        'core':       2
                  'default_lp':     259
             'fs_random_no_lp':   1'166
              'lb_tree_search':      92
                      'max_lp':     429
                       'no_lp':     544
         'objective_lb_search':      48
  'objective_lb_search_max_lp':      28
                     'probing':  66'797
              'probing_max_lp':  18'723
                'pseudo_costs':     608
               'quick_restart':   3'291
         'quick_restart_no_lp':   3'027
               'reduced_costs':   9'980

Clauses shared                      Num
                           'core':    8
                     'default_lp':   29
  'fs_random_quick_restart_no_lp':    2
                 'lb_tree_search':    9
                         'max_lp':   30
                          'no_lp':   14
            'objective_lb_search':   12
     'objective_lb_search_max_lp':    7
      'objective_lb_search_no_lp':   12
                   'pseudo_costs':   44
                  'quick_restart':   23
            'quick_restart_no_lp':   37
                  'reduced_costs':    1

CpSolverResponse summary:
status: FEASIBLE
objective: 4187
best_bound: 1553
integers: 5352
booleans: 379
conflicts: 0
branches: 791
propagations: 72
integer_propagations: 260465
restarts: 758
lp_iterations: 6559
walltime: 86401.1
usertime: 86401.1
deterministic_time: 284839
gap_integral: 2.24628e+06
solution_fingerprint: 0x37ea377c0ec5ca34


--- Simulation Gantt  partir du modle mathmatique ---
