created virtual environment CPython3.12.4.final.0-64 in 14361ms
  creator CPython3Posix(dest=/localscratch/aneumann.63393111.0/env, clear=False, no_vcs_ignore=False, global=False)
  seeder FromAppData(download=False, pip=bundle, via=copy, app_data_dir=/home/aneumann/.local/share/virtualenv)
    added seed packages: pip==25.1.1
  activators BashActivator,CShellActivator,FishActivator,NushellActivator,PowerShellActivator,PythonActivator
Looking in links: /cvmfs/soft.computecanada.ca/custom/python/wheelhouse/gentoo2023/x86-64-v3, /cvmfs/soft.computecanada.ca/custom/python/wheelhouse/gentoo2023/generic, /cvmfs/soft.computecanada.ca/custom/python/wheelhouse/generic
Requirement already satisfied: pip in /localscratch/aneumann.63393111.0/env/lib/python3.12/site-packages (25.1.1)
Looking in links: /cvmfs/soft.computecanada.ca/custom/python/wheelhouse/gentoo2023/x86-64-v3, /cvmfs/soft.computecanada.ca/custom/python/wheelhouse/gentoo2023/generic, /cvmfs/soft.computecanada.ca/custom/python/wheelhouse/generic
ERROR: protobuf-5.28.3-cp38-abi3-manylinux2014_x86_64.whl is not a supported wheel on this platform.
Looking in links: /cvmfs/soft.computecanada.ca/custom/python/wheelhouse/gentoo2023/x86-64-v3, /cvmfs/soft.computecanada.ca/custom/python/wheelhouse/gentoo2023/generic, /cvmfs/soft.computecanada.ca/custom/python/wheelhouse/generic
Processing /home/aneumann/projects/def-adhaj/aneumann/GNRS/wheels/immutabledict-4.2.0-py3-none-any.whl
Installing collected packages: immutabledict
Successfully installed immutabledict-4.2.0
Looking in links: /cvmfs/soft.computecanada.ca/custom/python/wheelhouse/gentoo2023/x86-64-v3, /cvmfs/soft.computecanada.ca/custom/python/wheelhouse/gentoo2023/generic, /cvmfs/soft.computecanada.ca/custom/python/wheelhouse/generic
Processing /cvmfs/soft.computecanada.ca/custom/python/wheelhouse/generic/ortools-9.10.4067+computecanada-cp312-cp312-linux_x86_64.whl (from -r /home/aneumann/projects/def-adhaj/aneumann/GNRS/requirements/or.txt (line 1))
Processing /cvmfs/soft.computecanada.ca/custom/python/wheelhouse/gentoo2023/x86-64-v3/matplotlib-3.10.0+computecanada-cp312-cp312-linux_x86_64.whl (from -r /home/aneumann/projects/def-adhaj/aneumann/GNRS/requirements/or.txt (line 2))
Processing /cvmfs/soft.computecanada.ca/custom/python/wheelhouse/gentoo2023/x86-64-v3/pandas-2.2.3+computecanada-cp312-cp312-linux_x86_64.whl (from -r /home/aneumann/projects/def-adhaj/aneumann/GNRS/requirements/or.txt (line 3))
Processing /cvmfs/soft.computecanada.ca/custom/python/wheelhouse/generic/absl_py-2.2.2+computecanada-py3-none-any.whl (from ortools<9.11,>=9.10->-r /home/aneumann/projects/def-adhaj/aneumann/GNRS/requirements/or.txt (line 1))
Processing /cvmfs/soft.computecanada.ca/custom/python/wheelhouse/gentoo2023/generic/numpy-2.2.2+computecanada-cp312-cp312-linux_x86_64.whl (from ortools<9.11,>=9.10->-r /home/aneumann/projects/def-adhaj/aneumann/GNRS/requirements/or.txt (line 1))
Processing /cvmfs/soft.computecanada.ca/custom/python/wheelhouse/gentoo2023/x86-64-v3/protobuf-6.30.2+computecanada-cp312-cp312-linux_x86_64.whl (from ortools<9.11,>=9.10->-r /home/aneumann/projects/def-adhaj/aneumann/GNRS/requirements/or.txt (line 1))
Requirement already satisfied: immutabledict>=3.0.0 in /localscratch/aneumann.63393111.0/env/lib/python3.12/site-packages (from ortools<9.11,>=9.10->-r /home/aneumann/projects/def-adhaj/aneumann/GNRS/requirements/or.txt (line 1)) (4.2.0)
Processing /cvmfs/soft.computecanada.ca/custom/python/wheelhouse/gentoo2023/generic/contourpy-1.3.1+computecanada-cp312-cp312-linux_x86_64.whl (from matplotlib->-r /home/aneumann/projects/def-adhaj/aneumann/GNRS/requirements/or.txt (line 2))
Processing /cvmfs/soft.computecanada.ca/custom/python/wheelhouse/generic/cycler-0.12.1+computecanada-py3-none-any.whl (from matplotlib->-r /home/aneumann/projects/def-adhaj/aneumann/GNRS/requirements/or.txt (line 2))
Processing /cvmfs/soft.computecanada.ca/custom/python/wheelhouse/generic/fonttools-4.58.2+computecanada-cp312-cp312-linux_x86_64.whl (from matplotlib->-r /home/aneumann/projects/def-adhaj/aneumann/GNRS/requirements/or.txt (line 2))
Processing /cvmfs/soft.computecanada.ca/custom/python/wheelhouse/gentoo2023/x86-64-v3/kiwisolver-1.4.8+computecanada-cp312-cp312-linux_x86_64.whl (from matplotlib->-r /home/aneumann/projects/def-adhaj/aneumann/GNRS/requirements/or.txt (line 2))
Processing /cvmfs/soft.computecanada.ca/custom/python/wheelhouse/generic/packaging-25.0+computecanada-py3-none-any.whl (from matplotlib->-r /home/aneumann/projects/def-adhaj/aneumann/GNRS/requirements/or.txt (line 2))
Processing /cvmfs/soft.computecanada.ca/custom/python/wheelhouse/gentoo2023/x86-64-v3/pillow-11.1.0+computecanada-cp312-cp312-linux_x86_64.whl (from matplotlib->-r /home/aneumann/projects/def-adhaj/aneumann/GNRS/requirements/or.txt (line 2))
Processing /cvmfs/soft.computecanada.ca/custom/python/wheelhouse/generic/pyparsing-3.2.1+computecanada-py3-none-any.whl (from matplotlib->-r /home/aneumann/projects/def-adhaj/aneumann/GNRS/requirements/or.txt (line 2))
Processing /cvmfs/soft.computecanada.ca/custom/python/wheelhouse/generic/python_dateutil-2.9.0.post0+computecanada-py2.py3-none-any.whl (from matplotlib->-r /home/aneumann/projects/def-adhaj/aneumann/GNRS/requirements/or.txt (line 2))
Processing /cvmfs/soft.computecanada.ca/custom/python/wheelhouse/generic/pytz-2025.2+computecanada-py2.py3-none-any.whl (from pandas->-r /home/aneumann/projects/def-adhaj/aneumann/GNRS/requirements/or.txt (line 3))
Processing /cvmfs/soft.computecanada.ca/custom/python/wheelhouse/generic/tzdata-2025.2+computecanada-py2.py3-none-any.whl (from pandas->-r /home/aneumann/projects/def-adhaj/aneumann/GNRS/requirements/or.txt (line 3))
Processing /cvmfs/soft.computecanada.ca/custom/python/wheelhouse/generic/six-1.17.0+computecanada-py2.py3-none-any.whl (from python-dateutil>=2.7->matplotlib->-r /home/aneumann/projects/def-adhaj/aneumann/GNRS/requirements/or.txt (line 2))
Installing collected packages: pytz, tzdata, six, pyparsing, protobuf, pillow, packaging, numpy, kiwisolver, fonttools, cycler, absl-py, python-dateutil, contourpy, pandas, matplotlib, ortools

Successfully installed absl-py-2.2.2+computecanada contourpy-1.3.1+computecanada cycler-0.12.1+computecanada fonttools-4.58.2+computecanada kiwisolver-1.4.8+computecanada matplotlib-3.10.0+computecanada numpy-2.2.2+computecanada ortools-9.10.4067+computecanada packaging-25.0+computecanada pandas-2.2.3+computecanada pillow-11.1.0+computecanada protobuf-6.30.2+computecanada pyparsing-3.2.1+computecanada python-dateutil-2.9.0.post0+computecanada pytz-2025.2+computecanada six-1.17.0+computecanada tzdata-2025.2+computecanada

Starting CP-SAT solver v9.10.4067
Parameters: max_time_in_seconds: 3600 max_memory_in_mb: 12000 log_search_progress: true enumerate_all_solutions: false absolute_gap_limit: 0 relative_gap_limit: 0
Setting number of workers to 48

Initial optimization model '': (model_fingerprint: 0xe0859ededde9b93b)
#Variables: 166 (#ints: 6 in objective)
  - 107 Booleans in [0,1]
  - 59 in [0,463]
#kLinear1: 26
#kLinear2: 211
#kLinear3: 79
#kLinearN: 675 (#terms: 6'406)

Starting presolve at 0.00s
  2.37e-04s  0.00e+00d  [DetectDominanceRelations] 
  8.59e-03s  0.00e+00d  [PresolveToFixPoint] #num_loops=6 #num_dual_strengthening=3 
  1.69e-05s  0.00e+00d  [ExtractEncodingFromLinear] #potential_supersets=2 
[Symmetry] Graph for symmetry has 834 nodes and 3'214 arcs.
[Symmetry] Symmetry computation done. time: 0.000479144 dtime: 0.00033656
[Symmetry] #generators: 1, average support size: 14
[Symmetry] The model contains 105 duplicate constraints !
[Symmetry] 7 orbits with sizes: 2,2,2,2,2,2,2
[Symmetry] Num fixable by intersecting at_most_one with orbits: 1 largest_orbit: 2
  1.67e-03s  1.43e-04d  [Probe] #probed=128 #fixed_bools=2 #new_bounds=14 #equiv=1 
  2.82e-05s  0.00e+00d  [MaxClique] Merged 6(12 literals) into 4(8 literals) at_most_ones. 
  2.22e-04s  0.00e+00d  [DetectDominanceRelations] 
  3.38e-03s  0.00e+00d  [PresolveToFixPoint] #num_loops=4 #num_dual_strengthening=3 
  6.89e-04s  0.00e+00d  [ProcessAtMostOneAndLinear] 
  5.68e-04s  0.00e+00d  [DetectDuplicateConstraints] #duplicates=126 #without_enforcements=39 
  2.43e-04s  6.43e-06d  [DetectDominatedLinearConstraints] #relevant_constraints=285 #num_inclusions=84 #num_redundant=1 
  1.26e-04s  0.00e+00d  [DetectDifferentVariables] #different=21 
  7.56e-05s  2.13e-06d  [ProcessSetPPC] #relevant_constraints=164 
  1.07e-05s  0.00e+00d  [FindAlmostIdenticalLinearConstraints] 
  2.48e-05s  8.37e-06d  [FindBigAtMostOneAndLinearOverlap] 
  4.54e-04s  1.41e-04d  [FindBigVerticalLinearOverlap] #blocks=2 #saved_nz=93 
  4.01e-05s  6.40e-06d  [FindBigHorizontalLinearOverlap] #linears=161 
  4.75e-06s  0.00e+00d  [MergeClauses] 
  2.15e-04s  0.00e+00d  [DetectDominanceRelations] 
  2.42e-03s  0.00e+00d  [PresolveToFixPoint] #num_loops=2 #num_dual_strengthening=1 
  2.11e-04s  0.00e+00d  [DetectDominanceRelations] 
  1.92e-03s  0.00e+00d  [PresolveToFixPoint] #num_loops=1 #num_dual_strengthening=1 
[Symmetry] Graph for symmetry has 688 nodes and 2'668 arcs.
[Symmetry] Symmetry computation done. time: 0.000147614 dtime: 0.00016948
  1.40e-03s  1.34e-04d  [Probe] #probed=124 #new_bounds=8 
  5.13e-06s  0.00e+00d  [MaxClique] 
  2.13e-04s  0.00e+00d  [DetectDominanceRelations] 
  2.81e-03s  0.00e+00d  [PresolveToFixPoint] #num_loops=2 #num_dual_strengthening=1 
  6.11e-04s  0.00e+00d  [ProcessAtMostOneAndLinear] 
  4.36e-04s  0.00e+00d  [DetectDuplicateConstraints] #without_enforcements=47 
  2.04e-04s  5.59e-06d  [DetectDominatedLinearConstraints] #relevant_constraints=269 #num_inclusions=70 
  1.11e-04s  0.00e+00d  [DetectDifferentVariables] #different=21 
  7.71e-05s  1.76e-06d  [ProcessSetPPC] #relevant_constraints=145 
  1.18e-05s  0.00e+00d  [FindAlmostIdenticalLinearConstraints] 
  2.11e-05s  7.62e-06d  [FindBigAtMostOneAndLinearOverlap] 
  4.34e-04s  1.30e-04d  [FindBigVerticalLinearOverlap] #blocks=2 #saved_nz=93 
  3.54e-05s  5.27e-06d  [FindBigHorizontalLinearOverlap] #linears=142 
  4.53e-06s  0.00e+00d  [MergeClauses] 
  2.15e-04s  0.00e+00d  [DetectDominanceRelations] 
  2.43e-03s  0.00e+00d  [PresolveToFixPoint] #num_loops=2 #num_dual_strengthening=1 
  2.08e-04s  0.00e+00d  [DetectDominanceRelations] 
  1.93e-03s  0.00e+00d  [PresolveToFixPoint] #num_loops=1 #num_dual_strengthening=1 
[Symmetry] Graph for symmetry has 692 nodes and 2'575 arcs.
[Symmetry] Symmetry computation done. time: 0.000144982 dtime: 0.00016405
  1.38e-03s  1.35e-04d  [Probe] #probed=124 #new_bounds=1 
  4.76e-06s  0.00e+00d  [MaxClique] 
  2.14e-04s  0.00e+00d  [DetectDominanceRelations] 
  2.25e-03s  0.00e+00d  [PresolveToFixPoint] #num_loops=2 #num_dual_strengthening=1 
  5.75e-04s  0.00e+00d  [ProcessAtMostOneAndLinear] 
  4.34e-04s  0.00e+00d  [DetectDuplicateConstraints] #without_enforcements=55 
  1.58e-04s  4.78e-06d  [DetectDominatedLinearConstraints] #relevant_constraints=254 #num_inclusions=57 
  1.09e-04s  0.00e+00d  [DetectDifferentVariables] #different=21 
  6.26e-05s  1.38e-06d  [ProcessSetPPC] #relevant_constraints=126 
  1.30e-05s  1.50e-08d  [FindAlmostIdenticalLinearConstraints] #num_tested_pairs=1 
  1.95e-05s  6.87e-06d  [FindBigAtMostOneAndLinearOverlap] 
  3.28e-04s  1.16e-04d  [FindBigVerticalLinearOverlap] 
  3.28e-05s  4.67e-06d  [FindBigHorizontalLinearOverlap] #linears=125 
  4.38e-06s  0.00e+00d  [MergeClauses] 
  2.08e-04s  0.00e+00d  [DetectDominanceRelations] 
  1.83e-03s  0.00e+00d  [PresolveToFixPoint] #num_loops=1 #num_dual_strengthening=1 
  2.43e-05s  0.00e+00d  [ExpandObjective] #entries=14 #tight_variables=7 #tight_constraints=3 

Presolve summary:
  - 25 affine relations were detected.
  - rule 'TODO dual: only one blocking constraint?' was applied 352 times.
  - rule 'TODO dual: only one unspecified blocking constraint?' was applied 78 times.
  - rule 'TODO duplicate: identical constraint with different enforcements' was applied 141 times.
  - rule 'affine: new relation' was applied 25 times.
  - rule 'at_most_one: removed literals' was applied 4 times.
  - rule 'at_most_one: size one' was applied 4 times.
  - rule 'at_most_one: transformed into max clique.' was applied 1 time.
  - rule 'deductions: 79 stored' was applied 1 time.
  - rule 'dual: fix variable' was applied 15 times.
  - rule 'dual: reduced domain' was applied 27 times.
  - rule 'duplicate: merged rhs of linear constraint' was applied 23 times.
  - rule 'duplicate: removed constraint' was applied 126 times.
  - rule 'enforcement: false literal' was applied 14 times.
  - rule 'enforcement: true literal' was applied 8 times.
  - rule 'exactly_one: x and not(x)' was applied 1 time.
  - rule 'incompatible linear: add implication' was applied 18 times.
  - rule 'linear inclusion: redundant containing constraint' was applied 1 time.
  - rule 'linear matrix: common vertical rectangle' was applied 4 times.
  - rule 'linear: always true' was applied 396 times.
  - rule 'linear: doubleton free' was applied 7 times.
  - rule 'linear: empty' was applied 20 times.
  - rule 'linear: extracted enforcement literal' was applied 1'023 times.
  - rule 'linear: fixed or dup variables' was applied 701 times.
  - rule 'linear: positive equal one' was applied 2 times.
  - rule 'linear: reduced variable domains' was applied 70 times.
  - rule 'linear: remapped using affine relations' was applied 630 times.
  - rule 'linear: simplified rhs' was applied 1'730 times.
  - rule 'linear: variable substitution 1' was applied 7 times.
  - rule 'presolve: 59 unused variables removed.' was applied 1 time.
  - rule 'presolve: iteration' was applied 3 times.
  - rule 'probing: reduced enforced constraint to implication.' was applied 6 times.
  - rule 'symmetry: fixed to false in general orbit' was applied 1 time.

Presolved optimization model '': (model_fingerprint: 0x8103aa9ccc23ed61)
#Variables: 79 (#ints: 6 in objective)
  - 30 Booleans in [0,1]
  - 1 in [-410,-62][3,401][466,814]
  - 2 in [0,287]
  - 4 in [0,290]
  - 1 in [0,311]
  - 1 in [0,357]
  - 3 in [0,365]
  - 1 in [0,366]
  - 1 in [0,367]
  - 1 in [0,394]
  - 1 in [0,395]
  - 1 in [0,398]
  - 3 in [0,411]
  - 1 in [3,360]
  - 1 in [3,368]
  - 1 in [3,398]
  - 1 in [3,398][466,861]
  - 1 in [3,401]
  - 1 in [3,401][466,864]
  - 1 in [3,414]
  - 1 in [28,393]
  - 1 in [44,409]
  - 1 in [53,398][466,861][929,1274]
  - 2 in [58,452]
  - 1 in [64,458]
  - 1 in [67,424]
  - 2 in [85,452]
  - 2 in [86,452]
  - 3 in [87,452]
  - 1 in [91,458]
  - 1 in [92,458]
  - 1 in [93,458]
  - 3 in [141,452]
  - 1 in [147,458]
  - 1 in [173,463]
#kExactlyOne: 1 (#literals: 3)
#kLinear2: 177 (#enforced: 145 #multi: 122)
#kLinear3: 81 (#enforced: 64 #multi: 34)
#kLinearN: 141 (#enforced: 99) (#terms: 999)

Preloading model.
#Bound   0.04s best:inf   next:[201,2294] initial_domain
[Symmetry] Graph for symmetry has 599 nodes and 2'573 arcs.
[Symmetry] Symmetry computation done. time: 0.000139704 dtime: 0.0001559
#Model   0.04s var:79/79 constraints:400/400

Starting search at 0.04s with 48 workers.
16 full problem subsolvers: [core, default_lp, lb_tree_search, max_lp, no_lp, objective_lb_search, objective_lb_search_max_lp, objective_lb_search_no_lp, objective_shaving_search_max_lp, objective_shaving_search_no_lp, probing, probing_max_lp, pseudo_costs, quick_restart, quick_restart_no_lp, reduced_costs]
30 first solution subsolvers: [fj_long_default(2), fj_long_lin_default, fj_long_lin_perturb, fj_long_lin_random, fj_long_perturb, fj_long_random, fj_short_default(2), fj_short_lin_default(2), fj_short_lin_perturb, fj_short_lin_random, fj_short_perturb, fj_short_random, fs_random(4), fs_random_no_lp(4), fs_random_quick_restart(4), fs_random_quick_restart_no_lp(3)]
13 incomplete subsolvers: [feasibility_pump, graph_arc_lns, graph_cst_lns, graph_dec_lns, graph_var_lns, rins/rens, rnd_cst_lns, rnd_var_lns, violation_ls(5)]
3 helper subsolvers: [neighborhood_helper, synchronization_agent, update_gap_integral]
#1       0.05s best:990   next:[201,989]  no_lp (fixed_bools=0/49)
#Bound   0.05s best:990   next:[202,989]  bool_core (num_cores=1 [size:2 mw:1 d:1] a=5 d=1 fixed=0/36 clauses=3)
#Bound   0.05s best:990   next:[203,989]  bool_core (num_cores=1 [cover] a=5 d=1 fixed=0/39 clauses=4)
#Bound   0.05s best:990   next:[204,989]  bool_core (num_cores=1 [cover] a=5 d=1 fixed=1/42 clauses=6)
#Bound   0.05s best:990   next:[205,989]  bool_core (num_cores=1 [cover] a=5 d=1 fixed=2/45 clauses=9)
#Bound   0.05s best:990   next:[206,989]  bool_core (num_cores=1 [cover] a=5 d=1 fixed=3/48 clauses=13)
#Bound   0.05s best:990   next:[207,989]  bool_core (num_cores=1 [cover] a=5 d=1 fixed=4/51 clauses=18)
#Bound   0.05s best:990   next:[208,989]  bool_core (num_cores=1 [cover] a=5 d=1 fixed=5/54 clauses=24)
#2       0.05s best:984   next:[208,983]  no_lp (fixed_bools=0/60)
#3       0.05s best:873   next:[208,872]  no_lp (fixed_bools=0/65)
#Bound   0.05s best:873   next:[209,872]  bool_core (num_cores=2 [size:1 mw:1] a=5 d=1 fixed=7/57 clauses=1)
#Bound   0.05s best:873   next:[218,872]  objective_lb_search_no_lp
#4       0.06s best:868   next:[218,867]  quick_restart_no_lp (fixed_bools=0/67)
#Bound   0.06s best:868   next:[219,867]  bool_core (num_cores=3 [cover] a=4 d=1 fixed=15/85 clauses=47)
#Bound   0.06s best:868   next:[223,867]  objective_lb_search_no_lp
#Bound   0.06s best:868   next:[224,867]  bool_core (num_cores=3 [cover] a=4 d=1 fixed=20/100 clauses=107)
#Bound   0.06s best:868   next:[225,867]  bool_core (num_cores=3 [cover] a=4 d=1 fixed=21/103 clauses=122)
#Bound   0.06s best:868   next:[226,867]  bool_core (num_cores=3 [cover] a=4 d=1 fixed=22/106 clauses=138)
#Bound   0.06s best:868   next:[227,867]  bool_core (num_cores=3 [cover] a=4 d=1 fixed=23/109 clauses=155)
#Bound   0.06s best:868   next:[228,867]  bool_core (num_cores=3 [cover] a=4 d=1 fixed=24/112 clauses=173)
#Bound   0.06s best:868   next:[229,867]  bool_core (num_cores=3 [cover] a=4 d=1 fixed=25/115 clauses=192)
#Bound   0.06s best:868   next:[230,867]  bool_core (num_cores=3 [cover] a=4 d=1 fixed=26/118 clauses=212)
#5       0.06s best:867   next:[230,866]  violation_ls(batch:1 #solutions_imported:1 #lin_moves:0 #lin_evals:18 #gen_moves:8 #gen_evals:0 #comp_moves:8 #backtracks:0 #weight_updates:0)
#Bound   0.06s best:867   next:[231,866]  bool_core (num_cores=3 [cover] a=4 d=1 fixed=27/121 clauses=233)
#Bound   0.06s best:867   next:[274,866]  quick_restart
#6       0.06s best:866   next:[274,865]  violation_ls(batch:1 #solutions_imported:1 #lin_moves:1 #lin_evals:6 #weight_updates:0)
#7       0.06s best:844   next:[274,843]  no_lp (fixed_bools=0/76)
#8       0.06s best:843   next:[274,842]  violation_ls(batch:1 #solutions_imported:1 #lin_moves:0 #lin_evals:37 #gen_moves:18 #gen_evals:0 #comp_moves:8 #backtracks:5 #weight_updates:0)
#9       0.06s best:842   next:[473,841]  graph_var_lns (d=0.50 s=36 t=0.10 p=0.00 stall=0 h=auto_l0) [presolve]
#10      0.06s best:841   next:[473,840]  violation_ls(batch:2 #solutions_imported:2 #lin_moves:0 #lin_evals:29 #gen_moves:14 #gen_evals:0 #comp_moves:14 #backtracks:0 #weight_updates:0)
#11      0.06s best:840   next:[473,839]  violation_ls(batch:2 #solutions_imported:2 #lin_moves:1 #lin_evals:8 #gen_moves:1 #gen_evals:0 #comp_moves:1 #backtracks:0 #weight_updates:0)
#12      0.06s best:839   next:[473,838]  violation_ls(batch:2 #solutions_imported:2 #lin_moves:0 #lin_evals:59 #gen_moves:33 #gen_evals:0 #comp_moves:13 #backtracks:10 #weight_updates:0)
#13      0.06s best:838   next:[474,837]  rnd_cst_lns (d=0.50 s=49 t=0.10 p=0.00 stall=0 h=auto_l0) [presolve]
#14      0.06s best:837   next:[474,836]  violation_ls(batch:3 #solutions_imported:3 #lin_moves:0 #lin_evals:32 #gen_moves:16 #gen_evals:0 #comp_moves:16 #backtracks:0 #weight_updates:0)
#15      0.06s best:836   next:[474,835]  violation_ls(batch:3 #solutions_imported:3 #lin_moves:1 #lin_evals:51 #gen_moves:23 #gen_evals:0 #comp_moves:7 #backtracks:8 #weight_updates:0)
#16      0.06s best:834   next:[474,833]  graph_dec_lns (d=0.71 s=55 t=0.10 p=1.00 stall=0 h=auto_l0) [presolve]
#17      0.06s best:824   next:[474,823]  no_lp (fixed_bools=0/81)
#18      0.07s best:769   next:[476,768]  rins_pump_lns (d=0.50 s=51 t=0.10 p=0.00 stall=0 h=auto_l0)
#19      0.07s best:718   next:[478,717]  quick_restart_no_lp (fixed_bools=1/96)
#20      0.08s best:714   next:[489,713]  quick_restart_no_lp (fixed_bools=1/109)
#21      0.08s best:705   next:[489,704]  quick_restart_no_lp (fixed_bools=1/115)
#22      0.08s best:684   next:[491,683]  no_lp (fixed_bools=0/107)
#23      0.09s best:683   next:[492,682]  violation_ls(batch:4 #solutions_imported:4 #lin_moves:0 #lin_evals:82 #gen_moves:42 #gen_evals:0 #comp_moves:18 #backtracks:12 #weight_updates:0)
#24      0.09s best:664   next:[492,663]  quick_restart_no_lp (fixed_bools=2/131)
#25      0.09s best:663   next:[492,662]  violation_ls(batch:5 #solutions_imported:5 #lin_moves:0 #lin_evals:85 #gen_moves:43 #gen_evals:0 #comp_moves:19 #backtracks:12 #weight_updates:0)
#26      0.12s best:648   next:[567,647]  rins_pump_lns (d=0.81 s=84 t=0.10 p=1.00 stall=0 h=auto_l0)
#Model   0.15s var:78/79 constraints:372/400
#Model   0.15s var:76/79 constraints:338/400
#Done    0.16s no_lp
#Done    0.16s objective_lb_search_no_lp
#Model   0.16s var:61/79 constraints:101/400
#Done    0.16s objective_lb_search_max_lp
#Done    0.16s core
#Done    0.16s pseudo_costs
#Bound   0.16s best:648   next:[641,647]  objective_lb_search_no_lp [skipped_logs=17]

Task timing                                  n [     min,      max]      avg      dev     time         n [     min,      max]      avg      dev    dtime
                             'core':         1 [116.47ms, 116.47ms] 116.47ms   0.00ns 116.47ms         1 [ 63.76ms,  63.76ms]  63.76ms   0.00ns  63.76ms
                       'default_lp':         1 [116.36ms, 116.36ms] 116.36ms   0.00ns 116.36ms         1 [  8.43ms,   8.43ms]   8.43ms   0.00ns   8.43ms
                 'feasibility_pump':         8 [805.37us,  12.69ms]   9.82ms   3.46ms  78.54ms         7 [  1.56ms,   1.87ms]   1.61ms 106.56us  11.28ms
                  'fj_long_default':         0 [  0.00ns,   0.00ns]   0.00ns   0.00ns   0.00ns         0 [  0.00ns,   0.00ns]   0.00ns   0.00ns   0.00ns
                  'fj_long_default':         0 [  0.00ns,   0.00ns]   0.00ns   0.00ns   0.00ns         0 [  0.00ns,   0.00ns]   0.00ns   0.00ns   0.00ns
              'fj_long_lin_default':         0 [  0.00ns,   0.00ns]   0.00ns   0.00ns   0.00ns         0 [  0.00ns,   0.00ns]   0.00ns   0.00ns   0.00ns
              'fj_long_lin_perturb':         0 [  0.00ns,   0.00ns]   0.00ns   0.00ns   0.00ns         0 [  0.00ns,   0.00ns]   0.00ns   0.00ns   0.00ns
               'fj_long_lin_random':         0 [  0.00ns,   0.00ns]   0.00ns   0.00ns   0.00ns         0 [  0.00ns,   0.00ns]   0.00ns   0.00ns   0.00ns
                  'fj_long_perturb':         0 [  0.00ns,   0.00ns]   0.00ns   0.00ns   0.00ns         0 [  0.00ns,   0.00ns]   0.00ns   0.00ns   0.00ns
                   'fj_long_random':         0 [  0.00ns,   0.00ns]   0.00ns   0.00ns   0.00ns         0 [  0.00ns,   0.00ns]   0.00ns   0.00ns   0.00ns
                 'fj_short_default':         0 [  0.00ns,   0.00ns]   0.00ns   0.00ns   0.00ns         0 [  0.00ns,   0.00ns]   0.00ns   0.00ns   0.00ns
                 'fj_short_default':         0 [  0.00ns,   0.00ns]   0.00ns   0.00ns   0.00ns         0 [  0.00ns,   0.00ns]   0.00ns   0.00ns   0.00ns
             'fj_short_lin_default':         0 [  0.00ns,   0.00ns]   0.00ns   0.00ns   0.00ns         0 [  0.00ns,   0.00ns]   0.00ns   0.00ns   0.00ns
             'fj_short_lin_default':         0 [  0.00ns,   0.00ns]   0.00ns   0.00ns   0.00ns         0 [  0.00ns,   0.00ns]   0.00ns   0.00ns   0.00ns
             'fj_short_lin_perturb':         0 [  0.00ns,   0.00ns]   0.00ns   0.00ns   0.00ns         0 [  0.00ns,   0.00ns]   0.00ns   0.00ns   0.00ns
              'fj_short_lin_random':         0 [  0.00ns,   0.00ns]   0.00ns   0.00ns   0.00ns         0 [  0.00ns,   0.00ns]   0.00ns   0.00ns   0.00ns
                 'fj_short_perturb':         0 [  0.00ns,   0.00ns]   0.00ns   0.00ns   0.00ns         0 [  0.00ns,   0.00ns]   0.00ns   0.00ns   0.00ns
                  'fj_short_random':         0 [  0.00ns,   0.00ns]   0.00ns   0.00ns   0.00ns         0 [  0.00ns,   0.00ns]   0.00ns   0.00ns   0.00ns
                        'fs_random':         0 [  0.00ns,   0.00ns]   0.00ns   0.00ns   0.00ns         0 [  0.00ns,   0.00ns]   0.00ns   0.00ns   0.00ns
                        'fs_random':         1 [  2.74ms,   2.74ms]   2.74ms   0.00ns   2.74ms         1 [ 20.00ns,  20.00ns]  20.00ns   0.00ns  20.00ns
                        'fs_random':         1 [  3.09ms,   3.09ms]   3.09ms   0.00ns   3.09ms         1 [ 20.00ns,  20.00ns]  20.00ns   0.00ns  20.00ns
                        'fs_random':         1 [  6.05ms,   6.05ms]   6.05ms   0.00ns   6.05ms         1 [ 20.00ns,  20.00ns]  20.00ns   0.00ns  20.00ns
                  'fs_random_no_lp':         0 [  0.00ns,   0.00ns]   0.00ns   0.00ns   0.00ns         0 [  0.00ns,   0.00ns]   0.00ns   0.00ns   0.00ns
                  'fs_random_no_lp':         1 [  2.05ms,   2.05ms]   2.05ms   0.00ns   2.05ms         0 [  0.00ns,   0.00ns]   0.00ns   0.00ns   0.00ns
                  'fs_random_no_lp':         1 [  2.48ms,   2.48ms]   2.48ms   0.00ns   2.48ms         0 [  0.00ns,   0.00ns]   0.00ns   0.00ns   0.00ns
                  'fs_random_no_lp':         1 [  5.71ms,   5.71ms]   5.71ms   0.00ns   5.71ms         0 [  0.00ns,   0.00ns]   0.00ns   0.00ns   0.00ns
          'fs_random_quick_restart':         0 [  0.00ns,   0.00ns]   0.00ns   0.00ns   0.00ns         0 [  0.00ns,   0.00ns]   0.00ns   0.00ns   0.00ns
          'fs_random_quick_restart':         1 [  2.67ms,   2.67ms]   2.67ms   0.00ns   2.67ms         1 [ 20.00ns,  20.00ns]  20.00ns   0.00ns  20.00ns
          'fs_random_quick_restart':         1 [  3.03ms,   3.03ms]   3.03ms   0.00ns   3.03ms         1 [ 20.00ns,  20.00ns]  20.00ns   0.00ns  20.00ns
          'fs_random_quick_restart':         1 [  5.88ms,   5.88ms]   5.88ms   0.00ns   5.88ms         1 [ 20.00ns,  20.00ns]  20.00ns   0.00ns  20.00ns
    'fs_random_quick_restart_no_lp':         1 [  1.78ms,   1.78ms]   1.78ms   0.00ns   1.78ms         0 [  0.00ns,   0.00ns]   0.00ns   0.00ns   0.00ns
    'fs_random_quick_restart_no_lp':         1 [  2.59ms,   2.59ms]   2.59ms   0.00ns   2.59ms         0 [  0.00ns,   0.00ns]   0.00ns   0.00ns   0.00ns
    'fs_random_quick_restart_no_lp':         1 [  2.80ms,   2.80ms]   2.80ms   0.00ns   2.80ms         0 [  0.00ns,   0.00ns]   0.00ns   0.00ns   0.00ns
                    'graph_arc_lns':         8 [  2.37ms,  19.44ms]  11.22ms   6.48ms  89.78ms         6 [ 14.24us, 902.71us] 310.83us 315.90us   1.86ms
                    'graph_cst_lns':         7 [445.45us, 581.49us] 499.61us  46.00us   3.50ms         0 [  0.00ns,   0.00ns]   0.00ns   0.00ns   0.00ns
                    'graph_dec_lns':         7 [  1.71ms,  12.25ms]   7.05ms   4.01ms  49.32ms         6 [ 10.00ns, 458.68us] 113.21us 160.40us 679.25us
                    'graph_var_lns':         8 [  1.43ms,  55.87ms]  13.22ms  16.86ms 105.72ms         7 [ 10.00ns,   5.01ms] 756.71us   1.74ms   5.30ms
                   'lb_tree_search':         1 [116.36ms, 116.36ms] 116.36ms   0.00ns 116.36ms         1 [  5.76ms,   5.76ms]   5.76ms   0.00ns   5.76ms
                           'max_lp':         1 [116.39ms, 116.39ms] 116.39ms   0.00ns 116.39ms         1 [  6.31ms,   6.31ms]   6.31ms   0.00ns   6.31ms
                            'no_lp':         1 [115.09ms, 115.09ms] 115.09ms   0.00ns 115.09ms         1 [ 14.58ms,  14.58ms]  14.58ms   0.00ns  14.58ms
              'objective_lb_search':         1 [115.23ms, 115.23ms] 115.23ms   0.00ns 115.23ms         1 [ 17.38ms,  17.38ms]  17.38ms   0.00ns  17.38ms
       'objective_lb_search_max_lp':         1 [114.33ms, 114.33ms] 114.33ms   0.00ns 114.33ms         1 [ 19.00ms,  19.00ms]  19.00ms   0.00ns  19.00ms
        'objective_lb_search_no_lp':         1 [113.45ms, 113.45ms] 113.45ms   0.00ns 113.45ms         1 [ 12.62ms,  12.62ms]  12.62ms   0.00ns  12.62ms
  'objective_shaving_search_max_lp':         8 [  1.66ms,  25.57ms]   9.25ms   6.86ms  74.03ms         5 [101.33us, 447.10us] 181.33us 133.44us 906.65us
   'objective_shaving_search_no_lp':         8 [  3.23ms,  11.83ms]   6.19ms   2.86ms  49.51ms         1 [127.71us, 127.71us] 127.71us   0.00ns 127.71us
                          'probing':         1 [115.05ms, 115.05ms] 115.05ms   0.00ns 115.05ms         1 [  3.32ms,   3.32ms]   3.32ms   0.00ns   3.32ms
                   'probing_max_lp':         1 [115.02ms, 115.02ms] 115.02ms   0.00ns 115.02ms         1 [  5.65ms,   5.65ms]   5.65ms   0.00ns   5.65ms
                     'pseudo_costs':         1 [116.26ms, 116.26ms] 116.26ms   0.00ns 116.26ms         1 [ 11.50ms,  11.50ms]  11.50ms   0.00ns  11.50ms
                    'quick_restart':         1 [116.40ms, 116.40ms] 116.40ms   0.00ns 116.40ms         1 [  8.71ms,   8.71ms]   8.71ms   0.00ns   8.71ms
              'quick_restart_no_lp':         1 [115.54ms, 115.54ms] 115.54ms   0.00ns 115.54ms         1 [ 16.40ms,  16.40ms]  16.40ms   0.00ns  16.40ms
                    'reduced_costs':         1 [116.24ms, 116.24ms] 116.24ms   0.00ns 116.24ms         1 [ 12.29ms,  12.29ms]  12.29ms   0.00ns  12.29ms
                        'rins/rens':         8 [142.14us,  39.70ms]  14.31ms  12.37ms 114.45ms         5 [ 96.88us,   3.57ms]   1.41ms   1.58ms   7.06ms
                      'rnd_cst_lns':         8 [691.35us,  19.71ms]   8.63ms   6.34ms  69.05ms         7 [ 10.00ns, 427.48us] 181.52us 163.21us   1.27ms
                      'rnd_var_lns':         8 [  1.06ms,  26.20ms]   9.93ms   8.07ms  79.40ms         7 [ 10.00ns, 745.25us] 214.42us 256.54us   1.50ms
                     'violation_ls':         3 [156.53us,  96.45ms]  32.30ms  45.36ms  96.91ms         3 [590.00ns,  33.15ms]  11.05ms  15.63ms  33.16ms
                     'violation_ls':         3 [254.34us,  96.02ms]  32.54ms  44.89ms  97.63ms         3 [ 66.00us,  31.69ms]  10.69ms  14.85ms  32.07ms
                     'violation_ls':         3 [272.21us,  96.27ms]  32.35ms  45.20ms  97.04ms         3 [ 22.40us,  30.58ms]  10.22ms  14.40ms  30.65ms
                     'violation_ls':         6 [111.00us,  57.92ms]   9.87ms  21.49ms  59.20ms         6 [340.00ns,  20.42ms]   3.42ms   7.60ms  20.51ms
                     'violation_ls':         6 [176.06us,  35.49ms]  11.14ms  15.41ms  66.85ms         6 [860.00ns,  15.52ms]   4.21ms   6.17ms  25.29ms

Search stats                        Bools  Conflicts  Branches  Restarts  BoolPropag  IntegerPropag
                           'core':    984        325       766       332     129'830         59'449
                     'default_lp':     30         17       147        90         200          3'819
                      'fs_random':      0          0         0         0           0              0
                      'fs_random':     30          0         0         0           0              0
                      'fs_random':     30          0         0         0           0              0
                      'fs_random':     30          0         0         0           0              0
                'fs_random_no_lp':      0          0         0         0           0              0
                'fs_random_no_lp':     30          0         0         0           0              0
                'fs_random_no_lp':     30          0         0         0           0              0
                'fs_random_no_lp':     30          0         0         0           0              0
        'fs_random_quick_restart':      0          0         0         0           0              0
        'fs_random_quick_restart':     30          0         0         0           0              0
        'fs_random_quick_restart':     30          0         0         0           0              0
        'fs_random_quick_restart':     30          0         0         0           0              0
  'fs_random_quick_restart_no_lp':     30          0         0         0           0              0
  'fs_random_quick_restart_no_lp':     30          0         0         0           0              0
  'fs_random_quick_restart_no_lp':     30          0         0         0           0              0
                 'lb_tree_search':     30          1        61        61          18            386
                         'max_lp':     30          0        60        60           9            398
                          'no_lp':    118        361     1'886       466      14'790         83'560
            'objective_lb_search':     32         29       162        96         358          5'605
     'objective_lb_search_max_lp':     31         27       101        61         309          4'630
      'objective_lb_search_no_lp':     58        478     1'440       588       5'876         76'228
                        'probing':     32          1        63        63          18            419
                 'probing_max_lp':     32          1        63        63          18            425
                   'pseudo_costs':     30         27       106        61         216          3'904
                  'quick_restart':     54          2       216       134         116          2'498
            'quick_restart_no_lp':    132        354     2'484       656      20'752         89'246
                  'reduced_costs':     81         50       118        61         568          5'677

SAT stats                           ClassicMinim  LitRemoved  LitLearned  LitForgotten  Subsumed  MClauses  MDecisions  MLitTrue  MSubsumed  MLitRemoved  MReused
                           'core':           146         502         434             0         5         6          28         0          0            0        2
                     'default_lp':             7           8          92             0         1         2           8         0          0            0        2
                      'fs_random':             0           0           0             0         0         0           0         0          0            0        0
                      'fs_random':             0           0           0             0         0         0           0         0          0            0        0
                      'fs_random':             0           0           0             0         0         0           0         0          0            0        0
                      'fs_random':             0           0           0             0         0         0           0         0          0            0        0
                'fs_random_no_lp':             0           0           0             0         0         0           0         0          0            0        0
                'fs_random_no_lp':             0           0           0             0         0         0           0         0          0            0        0
                'fs_random_no_lp':             0           0           0             0         0         0           0         0          0            0        0
                'fs_random_no_lp':             0           0           0             0         0         0           0         0          0            0        0
        'fs_random_quick_restart':             0           0           0             0         0         0           0         0          0            0        0
        'fs_random_quick_restart':             0           0           0             0         0         0           0         0          0            0        0
        'fs_random_quick_restart':             0           0           0             0         0         0           0         0          0            0        0
        'fs_random_quick_restart':             0           0           0             0         0         0           0         0          0            0        0
  'fs_random_quick_restart_no_lp':             0           0           0             0         0         0           0         0          0            0        0
  'fs_random_quick_restart_no_lp':             0           0           0             0         0         0           0         0          0            0        0
  'fs_random_quick_restart_no_lp':             0           0           0             0         0         0           0         0          0            0        0
                 'lb_tree_search':             0           0           1             0         0         0           0         0          0            0        0
                         'max_lp':             0           0           0             0         0         0           0         0          0            0        0
                          'no_lp':           148         253       2'125             0        46        92         596         0         37          213       14
            'objective_lb_search':            14          29          92             0         6         2           8         0          0            0        2
     'objective_lb_search_max_lp':             6          10         128             0         5         0           0         0          0            0        0
      'objective_lb_search_no_lp':           351         773       1'732             0        53        60         311         0         18           78       16
                        'probing':             0           0           1             0         0         0           0         0          0            0        0
                 'probing_max_lp':             0           0           1             0         0         0           0         0          0            0        0
                   'pseudo_costs':             7           8         208             0         4         0           0         0          0            0        0
                  'quick_restart':             0           0           3             0         0         2           8         0          0            0        2
            'quick_restart_no_lp':           174         328       1'929             0        36       229       1'126         3        132          656       19
                  'reduced_costs':            13          19         321             0         0         0           0         0          0            0        0

Lp stats                         Component  Iterations  AddedCuts  OPTIMAL  DUAL_F.  DUAL_U.
                  'default_lp':          1         464        544       55        1        0
                   'fs_random':          1           0          0        0        0        0
                   'fs_random':          1           0          0        0        0        0
                   'fs_random':          1           0          0        0        0        0
     'fs_random_quick_restart':          1           0          0        0        0        0
     'fs_random_quick_restart':          1           0          0        0        0        0
     'fs_random_quick_restart':          1           0          0        0        0        0
              'lb_tree_search':          1         209        769       11        0        0
                      'max_lp':          1         237        766       11        1        0
         'objective_lb_search':          1         935        509       71        0        1
  'objective_lb_search_max_lp':          1         929        599       46       22        0
                     'probing':          1         198        591       29        0        0
              'probing_max_lp':          1         219        740       13        1        0
                'pseudo_costs':          1         652        621       53       14        0
               'quick_restart':          1         421        532       57        1        0
               'reduced_costs':          1         626        641       73       11        0

Lp dimension                                                                    Final dimension of first component
                  'default_lp':  327 rows, 76 columns, 1248 entries with magnitude in [6.840571e-04, 1.000000e+00]
                   'fs_random':       0 rows, 76 columns, 0 entries with magnitude in [0.000000e+00, 0.000000e+00]
                   'fs_random':       0 rows, 76 columns, 0 entries with magnitude in [0.000000e+00, 0.000000e+00]
                   'fs_random':       0 rows, 76 columns, 0 entries with magnitude in [0.000000e+00, 0.000000e+00]
     'fs_random_quick_restart':       0 rows, 76 columns, 0 entries with magnitude in [0.000000e+00, 0.000000e+00]
     'fs_random_quick_restart':       0 rows, 76 columns, 0 entries with magnitude in [0.000000e+00, 0.000000e+00]
     'fs_random_quick_restart':       0 rows, 76 columns, 0 entries with magnitude in [0.000000e+00, 0.000000e+00]
              'lb_tree_search':  614 rows, 79 columns, 3264 entries with magnitude in [2.225604e-04, 1.000000e+00]
                      'max_lp':  635 rows, 79 columns, 3107 entries with magnitude in [8.930182e-04, 1.000000e+00]
         'objective_lb_search':  289 rows, 76 columns, 1188 entries with magnitude in [4.190206e-04, 1.000000e+00]
  'objective_lb_search_max_lp':  322 rows, 79 columns, 1352 entries with magnitude in [2.575988e-04, 1.000000e+00]
                     'probing':  313 rows, 76 columns, 1524 entries with magnitude in [1.403191e-04, 1.000000e+00]
              'probing_max_lp':  640 rows, 79 columns, 3665 entries with magnitude in [2.225604e-04, 1.000000e+00]
                'pseudo_costs':  308 rows, 79 columns, 1332 entries with magnitude in [3.751659e-04, 1.000000e+00]
               'quick_restart':  298 rows, 76 columns, 1325 entries with magnitude in [6.237810e-04, 1.000000e+00]
               'reduced_costs':  339 rows, 79 columns, 1465 entries with magnitude in [3.653165e-04, 1.000000e+00]

Lp debug                         CutPropag  CutEqPropag  Adjust  Overflow    Bad  BadScaling
                  'default_lp':          1            0      33         0    844           0
                   'fs_random':          0            0       0         0      0           0
                   'fs_random':          0            0       0         0      0           0
                   'fs_random':          0            0       0         0      0           0
     'fs_random_quick_restart':          0            0       0         0      0           0
     'fs_random_quick_restart':          0            0       0         0      0           0
     'fs_random_quick_restart':          0            0       0         0      0           0
              'lb_tree_search':          0            1      10         0    657           0
                      'max_lp':          0            0       9         0    676           0
         'objective_lb_search':          0            0      47         0    697           0
  'objective_lb_search_max_lp':          0            0      45         0    328           0
                     'probing':          0            0      16         0  1'436           0
              'probing_max_lp':          0            0      11         0    915           0
                'pseudo_costs':          0            0      38         0    462           0
               'quick_restart':          0            0      45         0  1'618           0
               'reduced_costs':          0            0      71         0    614           0

Lp pool                          Constraints  Updates  Simplif  Merged  Shortened  Split  Strenghtened  Cuts/Call
                  'default_lp':          635       35      393       1        299     10           262  544/1'009
                   'fs_random':           92        0        0       0          0      0             0        0/0
                   'fs_random':           92        0        0       0          0      0             0        0/0
                   'fs_random':           92        0        0       0          0      0             0        0/0
     'fs_random_quick_restart':           92        0        0       0          0      0             0        0/0
     'fs_random_quick_restart':           92        0        0       0          0      0             0        0/0
     'fs_random_quick_restart':           92        0        0       0          0      0             0        0/0
              'lb_tree_search':        1'166       19      239       3        105     24           440  769/1'212
                      'max_lp':        1'163       20      418       3        307     18           502  766/1'233
         'objective_lb_search':          601       10        9       0          0      0            57    509/939
  'objective_lb_search_max_lp':          997        7       56       2          0      4           233    599/919
                     'probing':          683        3        0       0          0      0            74  591/1'116
              'probing_max_lp':        1'139        6        0       1          0     22            92  740/1'210
                'pseudo_costs':        1'019        9       86       2          0      5           297    621/919
               'quick_restart':          623       47      253       1        176     18           169    532/992
               'reduced_costs':        1'039       21      352       2        220      9           488    641/998

Lp Cut            defaul  max_lp  quick_  reduce  pseudo  lb_tre  probin  object  probin  object
          CG_FF:      33      93      33      64      63      93      51      48      73      66
           CG_K:       7      31       7      12      12      31      10      10      31      11
           CG_R:      14      32      19      12      12      29      13      11      31      12
          CG_RB:     150     196     134     164     173     200     160     132     183     158
         CG_RBP:      10      50      11      18      18      52      17      17      42      17
         Clique:       -       -       -       4       6       5       -       -       -       8
             IB:     113      84     110     106     104      82     106     109      84     106
       MIR_1_FF:      39      57      40      54      55      55      42      41      59      49
        MIR_1_K:       2       8       1       1       1       8       1       -      10       -
        MIR_1_R:       7       8       9       7       6       8       6       7       8       6
       MIR_1_RB:      53      39      51      37      34      39      38      36      40      27
      MIR_1_RBP:       2       5       1       6       7       5       -       1       7       4
       MIR_2_FF:       8      23       9      21      12      20      12       7      19      17
        MIR_2_K:       2       9       1       3       3       8       3       2       7       3
        MIR_2_R:       3       2       4       4       4       4       6       4       6       6
       MIR_2_RB:      18      16      17      27      18      20      18      12      20      18
      MIR_2_RBP:       3       3       2       8       6       3       2       3       5       6
       MIR_3_FF:       7      12       5       9       9      12       8       2      12       3
        MIR_3_K:       -       4       -       2       4       1       1       1       1       4
        MIR_3_R:       6       2       6       4       5       1       7       6       3       2
       MIR_3_RB:       9       6      13       9      12       7      13       6       9       8
      MIR_3_RBP:       1       1       1       1       4       2       3       2       1       1
       MIR_4_FF:       1       2       -       3       2       2       4       3       3       4
        MIR_4_K:       -       1       -       1       1       1       -       -       1       1
        MIR_4_R:       1       1       1       1       -       1       3       1       2       1
       MIR_4_RB:       6       1       4       4       2       1       7       5       1       2
      MIR_4_RBP:       -       -       -       -       -       -       1       1       1       -
       MIR_5_FF:       4       2       -       -       -       2       2       -       -       -
        MIR_5_R:       2       -       1       1       -       -       3       1       -       -
       MIR_5_RB:       2       -       2       1       2       1       2       -       1       -
      MIR_5_RBP:       1       -       -       -       -       -       -       -       -       -
       MIR_6_FF:       1       -       1       -       -       1       -       1       2       -
        MIR_6_K:       -       -       -       -       -       1       -       -       2       -
        MIR_6_R:       1       -       1       -       -       1       1       2       2       -
       MIR_6_RB:       1       -       -       -       -       -       -       -       1       -
   ZERO_HALF_FF:       6      13       9       6       7      14       8       9      13      11
    ZERO_HALF_K:       -       3       1       -       -       4       -       1       4       -
    ZERO_HALF_R:      19      38      28      29      22      34      31      20      35      25
   ZERO_HALF_RB:      10      20       9      21      16      17      12       8      18      17
  ZERO_HALF_RBP:       2       4       1       1       1       4       -       -       3       6

LNS stats           Improv/Calls  Closed  Difficulty  TimeLimit
  'graph_arc_lns':           3/7    100%        0.97       0.10
  'graph_cst_lns':           0/0      0%        0.50       0.10
  'graph_dec_lns':           3/7    100%        0.97       0.10
  'graph_var_lns':           2/7    100%        0.97       0.10
      'rins/rens':           3/7     71%        0.89       0.10
    'rnd_cst_lns':           1/7    100%        0.97       0.10
    'rnd_var_lns':           0/7    100%        0.97       0.10

LS stats                   Batches  Restarts  LinMoves  GenMoves  CompoundMoves  WeightUpdates
       'fj_long_default':        0         0         0         0              0              0
       'fj_long_default':        0         0         0         0              0              0
   'fj_long_lin_default':        0         0         0         0              0              0
   'fj_long_lin_perturb':        0         0         0         0              0              0
    'fj_long_lin_random':        0         0         0         0              0              0
       'fj_long_perturb':        0         0         0         0              0              0
        'fj_long_random':        0         0         0         0              0              0
      'fj_short_default':        0         0         0         0              0              0
      'fj_short_default':        0         0         0         0              0              0
  'fj_short_lin_default':        0         0         0         0              0              0
  'fj_short_lin_default':        0         0         0         0              0              0
  'fj_short_lin_perturb':        0         0         0         0              0              0
   'fj_short_lin_random':        0         0         0         0              0              0
      'fj_short_perturb':        0         0         0         0              0              0
       'fj_short_random':        0         0         0         0              0              0
          'violation_ls':        3         0         0    12'396            232             93
          'violation_ls':        3         0         1    12'514            224             96
          'violation_ls':        3         0        22    13'005            527             90
          'violation_ls':        6         0         0     6'384            238             45
          'violation_ls':        6         0     3'455     2'989             63            494

Solutions (26)            Num     Rank
        'graph_dec_lns':    1  [16,16]
        'graph_var_lns':    1    [9,9]
                'no_lp':    6   [1,22]
  'quick_restart_no_lp':    5   [4,24]
        'rins_pump_lns':    2  [18,26]
          'rnd_cst_lns':    1  [13,13]
         'violation_ls':   10   [5,25]

Objective bounds                Num
                  'bool_core':   17
             'initial_domain':    1
  'objective_lb_search_no_lp':   20
              'quick_restart':    1

Solution repositories    Added  Queried  Ignored  Synchro
  'feasible solutions':     72      135        0       55
        'lp solutions':      0        0        0        0
                'pump':    147        7

Improving bounds shared         Num
                       'core':    2
                 'default_lp':   29
                      'no_lp':  106
        'objective_lb_search':    1
  'objective_lb_search_no_lp':   12
                    'probing':    1
              'quick_restart':   16
        'quick_restart_no_lp':    8

Clauses shared                  Num
                 'default_lp':    6
                      'no_lp':   18
        'objective_lb_search':    9
  'objective_lb_search_no_lp':    3
              'quick_restart':    9
        'quick_restart_no_lp':   18

CpSolverResponse summary:
status: OPTIMAL
objective: 648
best_bound: 648
integers: 0
booleans: 0
conflicts: 0
branches: 0
propagations: 0
integer_propagations: 0
restarts: 0
lp_iterations: 0
walltime: 0.171515
usertime: 0.171515
deterministic_time: 0.378231
gap_integral: 0.275271
solution_fingerprint: 0xfc83c57426405244


--- Simulation Gantt  partir du modle mathmatique ---
{'big':1, 'due_date':152, 'pos_time':5, 'status':0, 'blocked':0, 'operations':["{'type':0, 'processing_time':58}", "{'type':1, 'processing_time':34}"]}
{'big':0, 'due_date':70, 'pos_time':5, 'status':0, 'blocked':0, 'operations':["{'type':1, 'processing_time':35}", "{'type':0, 'processing_time':49}"]}
{'big':1, 'due_date':96, 'pos_time':5, 'status':0, 'blocked':0, 'operations':["{'type':1, 'processing_time':60}"]}
{'big':0, 'due_date':97, 'pos_time':5, 'status':0, 'blocked':0, 'operations':["{'type':0, 'processing_time':44}"]}
{'big':1, 'due_date':69, 'pos_time':5, 'status':0, 'blocked':0, 'operations':["{'type':1, 'processing_time':57}"]}
