created virtual environment CPython3.12.4.final.0-64 in 15091ms
  creator CPython3Posix(dest=/localscratch/aneumann.63393237.0/env, clear=False, no_vcs_ignore=False, global=False)
  seeder FromAppData(download=False, pip=bundle, via=copy, app_data_dir=/home/aneumann/.local/share/virtualenv)
    added seed packages: pip==25.1.1
  activators BashActivator,CShellActivator,FishActivator,NushellActivator,PowerShellActivator,PythonActivator
Looking in links: /cvmfs/soft.computecanada.ca/custom/python/wheelhouse/gentoo2023/x86-64-v3, /cvmfs/soft.computecanada.ca/custom/python/wheelhouse/gentoo2023/generic, /cvmfs/soft.computecanada.ca/custom/python/wheelhouse/generic
Requirement already satisfied: pip in /localscratch/aneumann.63393237.0/env/lib/python3.12/site-packages (25.1.1)
Looking in links: /cvmfs/soft.computecanada.ca/custom/python/wheelhouse/gentoo2023/x86-64-v3, /cvmfs/soft.computecanada.ca/custom/python/wheelhouse/gentoo2023/generic, /cvmfs/soft.computecanada.ca/custom/python/wheelhouse/generic
ERROR: protobuf-5.28.3-cp38-abi3-manylinux2014_x86_64.whl is not a supported wheel on this platform.
Looking in links: /cvmfs/soft.computecanada.ca/custom/python/wheelhouse/gentoo2023/x86-64-v3, /cvmfs/soft.computecanada.ca/custom/python/wheelhouse/gentoo2023/generic, /cvmfs/soft.computecanada.ca/custom/python/wheelhouse/generic
Processing /home/aneumann/projects/def-adhaj/aneumann/GNRS/wheels/immutabledict-4.2.0-py3-none-any.whl
Installing collected packages: immutabledict
Successfully installed immutabledict-4.2.0
Looking in links: /cvmfs/soft.computecanada.ca/custom/python/wheelhouse/gentoo2023/x86-64-v3, /cvmfs/soft.computecanada.ca/custom/python/wheelhouse/gentoo2023/generic, /cvmfs/soft.computecanada.ca/custom/python/wheelhouse/generic
Processing /cvmfs/soft.computecanada.ca/custom/python/wheelhouse/generic/ortools-9.10.4067+computecanada-cp312-cp312-linux_x86_64.whl (from -r /home/aneumann/projects/def-adhaj/aneumann/GNRS/requirements/or.txt (line 1))
Processing /cvmfs/soft.computecanada.ca/custom/python/wheelhouse/gentoo2023/x86-64-v3/matplotlib-3.10.0+computecanada-cp312-cp312-linux_x86_64.whl (from -r /home/aneumann/projects/def-adhaj/aneumann/GNRS/requirements/or.txt (line 2))
Processing /cvmfs/soft.computecanada.ca/custom/python/wheelhouse/gentoo2023/x86-64-v3/pandas-2.2.3+computecanada-cp312-cp312-linux_x86_64.whl (from -r /home/aneumann/projects/def-adhaj/aneumann/GNRS/requirements/or.txt (line 3))
Processing /cvmfs/soft.computecanada.ca/custom/python/wheelhouse/generic/absl_py-2.2.2+computecanada-py3-none-any.whl (from ortools<9.11,>=9.10->-r /home/aneumann/projects/def-adhaj/aneumann/GNRS/requirements/or.txt (line 1))
Processing /cvmfs/soft.computecanada.ca/custom/python/wheelhouse/gentoo2023/generic/numpy-2.2.2+computecanada-cp312-cp312-linux_x86_64.whl (from ortools<9.11,>=9.10->-r /home/aneumann/projects/def-adhaj/aneumann/GNRS/requirements/or.txt (line 1))
Processing /cvmfs/soft.computecanada.ca/custom/python/wheelhouse/gentoo2023/x86-64-v3/protobuf-6.30.2+computecanada-cp312-cp312-linux_x86_64.whl (from ortools<9.11,>=9.10->-r /home/aneumann/projects/def-adhaj/aneumann/GNRS/requirements/or.txt (line 1))
Requirement already satisfied: immutabledict>=3.0.0 in /localscratch/aneumann.63393237.0/env/lib/python3.12/site-packages (from ortools<9.11,>=9.10->-r /home/aneumann/projects/def-adhaj/aneumann/GNRS/requirements/or.txt (line 1)) (4.2.0)
Processing /cvmfs/soft.computecanada.ca/custom/python/wheelhouse/gentoo2023/generic/contourpy-1.3.1+computecanada-cp312-cp312-linux_x86_64.whl (from matplotlib->-r /home/aneumann/projects/def-adhaj/aneumann/GNRS/requirements/or.txt (line 2))
Processing /cvmfs/soft.computecanada.ca/custom/python/wheelhouse/generic/cycler-0.12.1+computecanada-py3-none-any.whl (from matplotlib->-r /home/aneumann/projects/def-adhaj/aneumann/GNRS/requirements/or.txt (line 2))
Processing /cvmfs/soft.computecanada.ca/custom/python/wheelhouse/generic/fonttools-4.58.2+computecanada-cp312-cp312-linux_x86_64.whl (from matplotlib->-r /home/aneumann/projects/def-adhaj/aneumann/GNRS/requirements/or.txt (line 2))
Processing /cvmfs/soft.computecanada.ca/custom/python/wheelhouse/gentoo2023/x86-64-v3/kiwisolver-1.4.8+computecanada-cp312-cp312-linux_x86_64.whl (from matplotlib->-r /home/aneumann/projects/def-adhaj/aneumann/GNRS/requirements/or.txt (line 2))
Processing /cvmfs/soft.computecanada.ca/custom/python/wheelhouse/generic/packaging-25.0+computecanada-py3-none-any.whl (from matplotlib->-r /home/aneumann/projects/def-adhaj/aneumann/GNRS/requirements/or.txt (line 2))
Processing /cvmfs/soft.computecanada.ca/custom/python/wheelhouse/gentoo2023/x86-64-v3/pillow-11.1.0+computecanada-cp312-cp312-linux_x86_64.whl (from matplotlib->-r /home/aneumann/projects/def-adhaj/aneumann/GNRS/requirements/or.txt (line 2))
Processing /cvmfs/soft.computecanada.ca/custom/python/wheelhouse/generic/pyparsing-3.2.1+computecanada-py3-none-any.whl (from matplotlib->-r /home/aneumann/projects/def-adhaj/aneumann/GNRS/requirements/or.txt (line 2))
Processing /cvmfs/soft.computecanada.ca/custom/python/wheelhouse/generic/python_dateutil-2.9.0.post0+computecanada-py2.py3-none-any.whl (from matplotlib->-r /home/aneumann/projects/def-adhaj/aneumann/GNRS/requirements/or.txt (line 2))
Processing /cvmfs/soft.computecanada.ca/custom/python/wheelhouse/generic/pytz-2025.2+computecanada-py2.py3-none-any.whl (from pandas->-r /home/aneumann/projects/def-adhaj/aneumann/GNRS/requirements/or.txt (line 3))
Processing /cvmfs/soft.computecanada.ca/custom/python/wheelhouse/generic/tzdata-2025.2+computecanada-py2.py3-none-any.whl (from pandas->-r /home/aneumann/projects/def-adhaj/aneumann/GNRS/requirements/or.txt (line 3))
Processing /cvmfs/soft.computecanada.ca/custom/python/wheelhouse/generic/six-1.17.0+computecanada-py2.py3-none-any.whl (from python-dateutil>=2.7->matplotlib->-r /home/aneumann/projects/def-adhaj/aneumann/GNRS/requirements/or.txt (line 2))
Installing collected packages: pytz, tzdata, six, pyparsing, protobuf, pillow, packaging, numpy, kiwisolver, fonttools, cycler, absl-py, python-dateutil, contourpy, pandas, matplotlib, ortools

Successfully installed absl-py-2.2.2+computecanada contourpy-1.3.1+computecanada cycler-0.12.1+computecanada fonttools-4.58.2+computecanada kiwisolver-1.4.8+computecanada matplotlib-3.10.0+computecanada numpy-2.2.2+computecanada ortools-9.10.4067+computecanada packaging-25.0+computecanada pandas-2.2.3+computecanada pillow-11.1.0+computecanada protobuf-6.30.2+computecanada pyparsing-3.2.1+computecanada python-dateutil-2.9.0.post0+computecanada pytz-2025.2+computecanada six-1.17.0+computecanada tzdata-2025.2+computecanada

Starting CP-SAT solver v9.10.4067
Parameters: max_time_in_seconds: 3600 max_memory_in_mb: 12000 log_search_progress: true enumerate_all_solutions: false absolute_gap_limit: 0 relative_gap_limit: 0
Setting number of workers to 48

Initial optimization model '': (model_fingerprint: 0x51502a9a5014fb75)
#Variables: 337 (#ints: 9 in objective)
  - 240 Booleans in [0,1]
  - 97 in [0,671]
#kLinear1: 44
#kLinear2: 604
#kLinear3: 200
#kLinearN: 3'232 (#terms: 51'744)

Starting presolve at 0.00s
  3.18e-03s  0.00e+00d  [DetectDominanceRelations] 
  6.66e-02s  0.00e+00d  [PresolveToFixPoint] #num_loops=6 #num_dual_strengthening=3 
  3.89e-05s  0.00e+00d  [ExtractEncodingFromLinear] #potential_supersets=2 
[Symmetry] Graph for symmetry has 3'969 nodes and 40'374 arcs.
[Symmetry] Symmetry computation done. time: 0.00364183 dtime: 0.00352917
[Symmetry] #generators: 1, average support size: 20
[Symmetry] The model contains 360 duplicate constraints !
[Symmetry] 10 orbits with sizes: 2,2,2,2,2,2,2,2,2,2
[Symmetry] Num fixable by intersecting at_most_one with orbits: 1 largest_orbit: 2
  1.75e-02s  2.18e-03d  [Probe] #probed=336 #fixed_bools=4 #new_bounds=20 #equiv=1 
  4.12e-05s  0.00e+00d  [MaxClique] 
  3.11e-03s  0.00e+00d  [DetectDominanceRelations] 
  3.47e-02s  0.00e+00d  [PresolveToFixPoint] #num_loops=4 #num_dual_strengthening=3 
  1.15e-02s  0.00e+00d  [ProcessAtMostOneAndLinear] 
  4.33e-03s  0.00e+00d  [DetectDuplicateConstraints] #duplicates=409 #without_enforcements=84 
  3.75e-03s  1.72e-04d  [DetectDominatedLinearConstraints] #relevant_constraints=2'713 #num_inclusions=1'393 #num_redundant=2 
  5.22e-04s  0.00e+00d  [DetectDifferentVariables] #different=33 
  1.04e-03s  5.68e-05d  [ProcessSetPPC] #relevant_constraints=2'271 
  3.31e-05s  0.00e+00d  [FindAlmostIdenticalLinearConstraints] 
  1.16e-04s  8.66e-05d  [FindBigAtMostOneAndLinearOverlap] 
  1.47e-02s  4.06e-03d  [FindBigVerticalLinearOverlap] #blocks=65 #saved_nz=7'793 
  5.23e-04s  1.25e-04d  [FindBigHorizontalLinearOverlap] #linears=2'227 
  2.01e-05s  0.00e+00d  [MergeClauses] 
  3.17e-03s  0.00e+00d  [DetectDominanceRelations] 
  4.10e-02s  0.00e+00d  [PresolveToFixPoint] #num_loops=2 #num_dual_strengthening=1 
  3.18e-03s  0.00e+00d  [DetectDominanceRelations] 
  2.32e-02s  0.00e+00d  [PresolveToFixPoint] #num_loops=1 #num_dual_strengthening=1 
[Symmetry] Graph for symmetry has 3'715 nodes and 31'193 arcs.
[Symmetry] Symmetry computation done. time: 0.00134746 dtime: 0.001875
  1.63e-02s  2.00e-03d  [Probe] #probed=328 #new_bounds=69 
  1.98e-05s  0.00e+00d  [MaxClique] 
  3.17e-03s  0.00e+00d  [DetectDominanceRelations] 
  4.09e-02s  0.00e+00d  [PresolveToFixPoint] #num_loops=2 #num_dual_strengthening=1 
  9.83e-03s  0.00e+00d  [ProcessAtMostOneAndLinear] 
  3.72e-03s  0.00e+00d  [DetectDuplicateConstraints] #without_enforcements=115 
  2.36e-03s  1.02e-04d  [DetectDominatedLinearConstraints] #relevant_constraints=2'487 #num_inclusions=365 
  5.20e-04s  0.00e+00d  [DetectDifferentVariables] #different=43 #cliques=1 #size=3 
  9.00e-04s  3.90e-05d  [ProcessSetPPC] #relevant_constraints=2'091 
  5.02e-05s  2.40e-07d  [FindAlmostIdenticalLinearConstraints] #num_tested_pairs=16 
  5.92e-05s  2.51e-05d  [FindBigAtMostOneAndLinearOverlap] 
  7.87e-03s  2.51e-03d  [FindBigVerticalLinearOverlap] #blocks=58 #saved_nz=5'386 
  4.49e-04s  8.75e-05d  [FindBigHorizontalLinearOverlap] #linears=1'906 
  2.01e-05s  0.00e+00d  [MergeClauses] 
  2.68e-03s  0.00e+00d  [DetectDominanceRelations] 
  3.95e-02s  0.00e+00d  [PresolveToFixPoint] #num_loops=2 #num_dual_strengthening=1 
  2.69e-03s  0.00e+00d  [DetectDominanceRelations] 
  2.69e-02s  0.00e+00d  [PresolveToFixPoint] #num_loops=1 #num_dual_strengthening=1 
  1.55e-02s  1.80e-03d  [Probe] #probed=328 #new_bounds=49 
  2.67e-05s  0.00e+00d  [MaxClique] 
  2.66e-03s  0.00e+00d  [DetectDominanceRelations] 
  3.81e-02s  0.00e+00d  [PresolveToFixPoint] #num_loops=2 #num_dual_strengthening=1 
  8.74e-03s  0.00e+00d  [ProcessAtMostOneAndLinear] 
  3.53e-03s  0.00e+00d  [DetectDuplicateConstraints] #without_enforcements=123 
  2.02e-03s  8.05e-05d  [DetectDominatedLinearConstraints] #relevant_constraints=2'489 #num_inclusions=328 
  3.87e-04s  0.00e+00d  [DetectDifferentVariables] 
  7.06e-04s  2.68e-05d  [ProcessSetPPC] #relevant_constraints=1'870 
  7.10e-05s  1.46e-06d  [FindAlmostIdenticalLinearConstraints] #num_tested_pairs=53 
  5.75e-05s  2.23e-05d  [FindBigAtMostOneAndLinearOverlap] 
  4.86e-03s  1.65e-03d  [FindBigVerticalLinearOverlap] #blocks=26 #saved_nz=2'151 
  4.19e-04s  7.23e-05d  [FindBigHorizontalLinearOverlap] #linears=1'720 
  2.00e-05s  0.00e+00d  [MergeClauses] 
  2.46e-03s  0.00e+00d  [DetectDominanceRelations] 
  3.25e-02s  0.00e+00d  [PresolveToFixPoint] #num_loops=2 #num_dual_strengthening=1 
  1.38e-04s  0.00e+00d  [ExpandObjective] #entries=692 #tight_variables=171 #tight_constraints=106 

Presolve summary:
  - 74 affine relations were detected.
  - rule 'TODO dual: only one blocking constraint?' was applied 733 times.
  - rule 'TODO dual: only one unspecified blocking constraint?' was applied 117 times.
  - rule 'TODO duplicate: identical constraint with different enforcements' was applied 322 times.
  - rule 'TODO no_overlap: with task always last' was applied 1 time.
  - rule 'affine: new relation' was applied 74 times.
  - rule 'all_diff: inferred from x != y constraints' was applied 1 time.
  - rule 'at_most_one: removed literals' was applied 3 times.
  - rule 'at_most_one: size one' was applied 3 times.
  - rule 'deductions: 323 stored' was applied 1 time.
  - rule 'dual: fix variable' was applied 24 times.
  - rule 'dual: reduced domain' was applied 54 times.
  - rule 'duplicate: merged rhs of linear constraint' was applied 53 times.
  - rule 'duplicate: removed constraint' was applied 409 times.
  - rule 'enforcement: false literal' was applied 30 times.
  - rule 'enforcement: true literal' was applied 18 times.
  - rule 'exactly_one: x and not(x)' was applied 1 time.
  - rule 'incompatible linear: add implication' was applied 30 times.
  - rule 'linear inclusion: redundant containing constraint' was applied 2 times.
  - rule 'linear matrix: common vertical rectangle' was applied 149 times.
  - rule 'linear: always true' was applied 639 times.
  - rule 'linear: doubleton free' was applied 12 times.
  - rule 'linear: empty' was applied 36 times.
  - rule 'linear: extracted enforcement literal' was applied 5'593 times.
  - rule 'linear: fixed or dup variables' was applied 3'369 times.
  - rule 'linear: positive equal one' was applied 2 times.
  - rule 'linear: reduced variable domains' was applied 271 times.
  - rule 'linear: remapped using affine relations' was applied 3'342 times.
  - rule 'linear: simplified rhs' was applied 12'898 times.
  - rule 'linear: variable substitution 1' was applied 12 times.
  - rule 'linear: variable substitution 2' was applied 10 times.
  - rule 'linear: variable substitution 3' was applied 1 time.
  - rule 'presolve: 100 unused variables removed.' was applied 1 time.
  - rule 'presolve: iteration' was applied 3 times.
  - rule 'probing: reduced enforced constraint to implication.' was applied 3 times.
  - rule 'symmetry: fixed to false in general orbit' was applied 1 time.

Presolved optimization model '': (model_fingerprint: 0xb75bf917a68e0f99)
#Variables: 289 (#ints: 9 in objective)
  - 78 Booleans in [0,1]
  - 172 different domains in [-7916,7894] with a largest complexity of 15.
#kAllDiff: 1
#kExactlyOne: 1 (#literals: 3)
#kLinear2: 635 (#enforced: 566 #multi: 440)
#kLinear3: 456 (#enforced: 361 #multi: 19)
#kLinearN: 1'921 (#enforced: 1'797) (#terms: 15'275)

Preloading model.
#Bound   0.50s best:inf   next:[184,5191] initial_domain
#Model   0.51s var:289/289 constraints:3014/3014

Starting search at 0.51s with 48 workers.
16 full problem subsolvers: [core, default_lp, lb_tree_search, max_lp, no_lp, objective_lb_search, objective_lb_search_max_lp, objective_lb_search_no_lp, objective_shaving_search_max_lp, objective_shaving_search_no_lp, probing, probing_max_lp, pseudo_costs, quick_restart, quick_restart_no_lp, reduced_costs]
30 first solution subsolvers: [fj_long_default(2), fj_long_lin_default, fj_long_lin_perturb, fj_long_lin_random, fj_long_perturb, fj_long_random, fj_short_default(2), fj_short_lin_default(2), fj_short_lin_perturb, fj_short_lin_random, fj_short_perturb, fj_short_random, fs_random(4), fs_random_no_lp(4), fs_random_quick_restart(4), fs_random_quick_restart_no_lp(3)]
13 incomplete subsolvers: [feasibility_pump, graph_arc_lns, graph_cst_lns, graph_dec_lns, graph_var_lns, rins/rens, rnd_cst_lns, rnd_var_lns, violation_ls(5)]
3 helper subsolvers: [neighborhood_helper, synchronization_agent, update_gap_integral]
#Bound   0.56s best:inf   next:[225,5191] objective_lb_search_no_lp
#Bound   0.58s best:inf   next:[228,5191] objective_lb_search_no_lp
#1       0.58s best:2355  next:[228,2354] no_lp (fixed_bools=0/103)
#2       0.60s best:2264  next:[228,2263] no_lp (fixed_bools=0/113)
#3       0.60s best:2129  next:[228,2128] no_lp (fixed_bools=0/123)
#4       0.65s best:2126  next:[228,2125] objective_lb_search_no_lp (fixed_bools=2/112)
#5       0.66s best:2031  next:[228,2030] no_lp (fixed_bools=0/140)
#Bound   0.66s best:2031  next:[233,2030] objective_lb_search_no_lp
#6       0.68s best:1848  next:[233,1847] no_lp (fixed_bools=0/154)
#Bound   0.69s best:1848  next:[270,1847] default_lp
#Bound   0.69s best:1848  next:[272,1847] default_lp
#7       0.74s best:1840  next:[272,1839] no_lp (fixed_bools=0/157)
#8       0.75s best:1812  next:[272,1811] no_lp (fixed_bools=0/160)
#9       0.76s best:1802  next:[272,1801] no_lp (fixed_bools=0/163)
#10      0.77s best:1758  next:[272,1757] no_lp (fixed_bools=0/165)
#Bound   0.77s best:1758  next:[297,1757] default_lp
#Bound   0.78s best:1758  next:[317,1757] default_lp
#11      0.79s best:1724  next:[317,1723] no_lp (fixed_bools=0/169)
#Bound   0.80s best:1724  next:[319,1723] objective_lb_search_no_lp
#12      0.80s best:1708  next:[319,1707] no_lp (fixed_bools=0/171)
#Bound   0.81s best:1708  next:[320,1707] objective_lb_search_no_lp
#Bound   0.81s best:1708  next:[321,1707] objective_lb_search_no_lp
#13      0.81s best:1672  next:[321,1671] no_lp (fixed_bools=0/173)
#Bound   0.82s best:1672  next:[336,1671] default_lp
#14      0.84s best:1652  next:[336,1651] no_lp (fixed_bools=0/178)
#15      0.85s best:1650  next:[336,1649] no_lp (fixed_bools=0/180)
#16      0.92s best:1649  next:[336,1648] quick_restart_no_lp (fixed_bools=0/149)
#17      0.93s best:1641  next:[336,1640] quick_restart_no_lp (fixed_bools=0/171)
#Bound   0.93s best:1641  next:[348,1640] default_lp
#Bound   0.93s best:1641  next:[349,1640] default_lp
#18      0.97s best:1640  next:[349,1639] violation_ls(batch:5 #solutions_imported:5 #lin_moves:17'655 #lin_evals:97'111 #gen_moves:11'023 #gen_evals:242 #comp_moves:415 #backtracks:5'299 #weight_updates:5'869)
#19      0.97s best:1639  next:[349,1638] violation_ls(batch:6 #solutions_imported:6 #lin_moves:17'655 #lin_evals:97'134 #gen_moves:11'032 #gen_evals:245 #comp_moves:416 #backtracks:5'303 #weight_updates:5'869)
#20      0.98s best:1638  next:[349,1637] violation_ls(batch:7 #solutions_imported:7 #lin_moves:17'655 #lin_evals:97'164 #gen_moves:11'047 #gen_evals:248 #comp_moves:417 #backtracks:5'310 #weight_updates:5'869)
#21      0.98s best:1637  next:[349,1636] violation_ls(batch:8 #solutions_imported:8 #lin_moves:17'655 #lin_evals:97'218 #gen_moves:11'074 #gen_evals:248 #comp_moves:420 #backtracks:5'322 #weight_updates:5'869)
#22      0.98s best:1636  next:[349,1635] violation_ls(batch:4 #solutions_imported:4 #lin_moves:29 #lin_evals:56'945 #gen_moves:21'503 #gen_evals:1'297 #comp_moves:1'641 #backtracks:9'930 #weight_updates:259)
#Bound   1.00s best:1636  next:[358,1635] default_lp
#23      1.00s best:1635  next:[358,1634] violation_ls(batch:9 #solutions_imported:9 #lin_moves:17'655 #lin_evals:97'239 #gen_moves:11'085 #gen_evals:251 #comp_moves:423 #backtracks:5'326 #weight_updates:5'869)
#24      1.00s best:1634  next:[358,1633] violation_ls(batch:5 #solutions_imported:5 #lin_moves:4'792 #lin_evals:80'718 #gen_moves:22'833 #gen_evals:1'648 #comp_moves:1'225 #backtracks:10'799 #weight_updates:597)
#25      1.01s best:1620  next:[358,1619] no_lp (fixed_bools=0/189)
#Bound   1.04s best:1620  next:[360,1619] default_lp
#26      1.06s best:1615  next:[360,1614] quick_restart_no_lp (fixed_bools=0/195)
#27      1.08s best:1614  next:[360,1613] violation_ls(batch:12 #solutions_imported:12 #lin_moves:17'725 #lin_evals:107'854 #gen_moves:14'975 #gen_evals:604 #comp_moves:795 #backtracks:7'085 #weight_updates:5'967)
#28      1.08s best:1613  next:[360,1612] violation_ls(batch:13 #solutions_imported:13 #lin_moves:17'725 #lin_evals:107'885 #gen_moves:14'990 #gen_evals:604 #comp_moves:796 #backtracks:7'092 #weight_updates:5'967)
#29      1.08s best:1612  next:[360,1611] violation_ls(batch:14 #solutions_imported:14 #lin_moves:17'725 #lin_evals:107'999 #gen_moves:15'042 #gen_evals:607 #comp_moves:798 #backtracks:7'117 #weight_updates:5'967)
#30      1.08s best:1611  next:[360,1610] violation_ls(batch:15 #solutions_imported:15 #lin_moves:17'725 #lin_evals:108'019 #gen_moves:15'051 #gen_evals:607 #comp_moves:799 #backtracks:7'121 #weight_updates:5'967)
#31      1.09s best:1610  next:[360,1609] violation_ls(batch:16 #solutions_imported:16 #lin_moves:17'725 #lin_evals:108'115 #gen_moves:15'095 #gen_evals:610 #comp_moves:801 #backtracks:7'142 #weight_updates:5'967)
#32      1.09s best:1519  next:[360,1518] graph_dec_lns (d=0.98 s=162 t=0.10 p=1.00 stall=8 h=auto_l0)
#33      1.13s best:1433  next:[360,1432] rins_pump_lns (d=0.71 s=223 t=0.10 p=1.00 stall=1 h=auto_l0)
#Bound   1.15s best:1433  next:[366,1432] default_lp
#Bound   1.19s best:1433  next:[373,1432] objective_lb_search_no_lp
#Bound   1.19s best:1433  next:[382,1432] objective_lb_search_no_lp
#Bound   1.25s best:1433  next:[453,1432] objective_lb_search_max_lp
#Bound   1.28s best:1433  next:[479,1432] objective_lb_search_no_lp
#Bound   1.29s best:1433  next:[481,1432] objective_lb_search_no_lp
#34      1.85s best:1429  next:[656,1428] quick_restart_no_lp (fixed_bools=0/233)
#35      1.87s best:1428  next:[656,1427] quick_restart_no_lp (fixed_bools=0/236)
#36      1.88s best:1427  next:[656,1426] quick_restart_no_lp (fixed_bools=0/239)
#Bound   1.95s best:1427  next:[658,1426] objective_lb_search_no_lp [skipped_logs=8]
#37      2.18s best:1414  next:[718,1413] pseudo_costs (fixed_bools=0/106)
#Bound   2.89s best:1414  next:[732,1413] objective_lb_search [skipped_logs=4]
#38      3.04s best:1406  next:[732,1405] graph_dec_lns (d=1.00 s=328 t=0.10 p=1.00 stall=0 h=auto_l0)
#Bound   3.89s best:1406  next:[790,1405] objective_lb_search_no_lp [skipped_logs=3]
#Bound   4.13s best:1406  next:[818,1405] objective_lb_search_no_lp [skipped_logs=0]
#Bound   5.69s best:1406  next:[834,1405] objective_lb_search [skipped_logs=1]
#Bound   6.95s best:1406  next:[855,1405] objective_lb_search_max_lp [skipped_logs=0]
#Bound   7.99s best:1406  next:[874,1405] objective_lb_search_no_lp [skipped_logs=1]
#Bound   8.91s best:1406  next:[903,1405] objective_lb_search [skipped_logs=1]
#Bound  10.31s best:1406  next:[916,1405] objective_lb_search_max_lp
#Bound  11.18s best:1406  next:[921,1405] objective_lb_search
#Bound  12.12s best:1406  next:[922,1405] objective_lb_search_no_lp
#Bound  13.58s best:1406  next:[923,1405] objective_lb_search_no_lp
#Bound  14.44s best:1406  next:[927,1405] objective_lb_search_max_lp
#Bound  16.32s best:1406  next:[931,1405] objective_lb_search
#Bound  16.77s best:1406  next:[943,1405] objective_lb_search_max_lp
#Bound  17.74s best:1406  next:[948,1405] objective_lb_search
#Bound  20.20s best:1406  next:[949,1405] objective_shaving_search_no_lp (vars=314 csts=3040)
#Bound  21.42s best:1406  next:[951,1405] objective_lb_search_max_lp
#Bound  22.82s best:1406  next:[954,1405] objective_lb_search
#Bound  24.45s best:1406  next:[955,1405] lb_tree_search (nodes=351/351 rc=2 decisions=5691 @root=19 restarts=5) 
#Bound  25.82s best:1406  next:[956,1405] objective_shaving_search_no_lp (vars=314 csts=3040)
#Bound  27.25s best:1406  next:[957,1405] lb_tree_search (nodes=339/339 rc=2 decisions=6548 @root=22 restarts=6) 
#Bound  27.42s best:1406  next:[958,1405] objective_lb_search_no_lp
#Bound  27.56s best:1406  next:[971,1405] objective_lb_search
#Bound  28.47s best:1406  next:[1011,1405] objective_lb_search
#Bound  30.37s best:1406  next:[1013,1405] objective_lb_search
#Bound  32.27s best:1406  next:[1014,1405] objective_lb_search
#Bound  32.57s best:1406  next:[1015,1405] objective_lb_search
#Bound  32.66s best:1406  next:[1021,1405] objective_lb_search
#Bound  32.91s best:1406  next:[1025,1405] objective_lb_search
#Bound  32.98s best:1406  next:[1041,1405] objective_lb_search
#Bound  33.50s best:1406  next:[1048,1405] objective_lb_search
#Bound  33.80s best:1406  next:[1051,1405] objective_lb_search [skipped_logs=0]
#Bound  34.70s best:1406  next:[1078,1405] objective_lb_search [skipped_logs=0]
#Bound  36.81s best:1406  next:[1083,1405] objective_lb_search
#Bound  39.11s best:1406  next:[1085,1405] objective_lb_search
#Bound  40.81s best:1406  next:[1087,1405] objective_lb_search
#Bound  43.71s best:1406  next:[1088,1405] lb_tree_search (nodes=1465/1465 rc=12 decisions=14092 @root=29 restarts=10) 
#Bound  44.60s best:1406  next:[1089,1405] lb_tree_search (nodes=1467/1468 rc=12 decisions=14238 @root=30 restarts=10) 
#Bound  45.19s best:1406  next:[1090,1405] objective_lb_search
#Bound  46.49s best:1406  next:[1091,1405] lb_tree_search (nodes=1502/1503 rc=13 decisions=14663 @root=31 restarts=10) 
#Bound  46.69s best:1406  next:[1095,1405] objective_lb_search
#Bound  48.36s best:1406  next:[1097,1405] objective_lb_search
#Bound  50.86s best:1406  next:[1098,1405] lb_tree_search (nodes=1631/1632 rc=17 decisions=15955 @root=33 restarts=10) 
#Bound  51.99s best:1406  next:[1099,1405] lb_tree_search (nodes=1656/1657 rc=17 decisions=16267 @root=34 restarts=10) 
#Bound  53.02s best:1406  next:[1100,1405] lb_tree_search (nodes=1673/1674 rc=19 decisions=16514 @root=35 restarts=10) 
#Bound  54.05s best:1406  next:[1101,1405] lb_tree_search (nodes=1689/1690 rc=20 decisions=16721 @root=36 restarts=10) 
#Bound  55.06s best:1406  next:[1102,1405] lb_tree_search (nodes=1714/1715 rc=22 decisions=16989 @root=37 restarts=10) 
#Bound  56.21s best:1406  next:[1103,1405] lb_tree_search (nodes=1723/1724 rc=25 decisions=17207 @root=38 restarts=10) 
#Bound  56.72s best:1406  next:[1104,1405] objective_lb_search
#Bound  58.54s best:1406  next:[1105,1405] lb_tree_search (nodes=1763/1764 rc=25 decisions=17772 @root=40 restarts=10) 
#Bound  59.65s best:1406  next:[1106,1405] lb_tree_search (nodes=1785/1786 rc=26 decisions=18073 @root=41 restarts=10) 
#Bound  61.03s best:1406  next:[1107,1405] lb_tree_search (nodes=1817/1818 rc=29 decisions=18432 @root=42 restarts=10) 
#Bound  62.25s best:1406  next:[1109,1405] objective_lb_search
#Bound  63.47s best:1406  next:[1114,1405] objective_lb_search
#Bound  66.50s best:1406  next:[1115,1405] lb_tree_search (nodes=1927/1930 rc=34 decisions=19848 @root=45 restarts=10) 
#Bound  67.21s best:1406  next:[1122,1405] objective_lb_search_no_lp
#Bound  67.64s best:1406  next:[1127,1405] objective_lb_search_no_lp
#Bound  68.37s best:1406  next:[1128,1405] objective_lb_search_no_lp
#Bound  69.29s best:1406  next:[1129,1405] objective_lb_search_no_lp
#Bound  69.29s best:1406  next:[1134,1405] objective_lb_search_no_lp
#Model  69.35s var:288/289 constraints:2973/3014
#Bound  69.39s best:1406  next:[1140,1405] objective_lb_search_no_lp
#Bound  72.99s best:1406  next:[1142,1405] objective_lb_search_no_lp
#Bound  75.39s best:1406  next:[1143,1405] lb_tree_search (nodes=2347/2411 rc=55 decisions=23954 @root=48 restarts=10) 
#Bound  76.47s best:1406  next:[1144,1405] objective_lb_search_no_lp
#Bound  76.94s best:1406  next:[1149,1405] objective_lb_search_no_lp
#Bound  77.41s best:1406  next:[1153,1405] objective_lb_search_no_lp
#Bound  78.40s best:1406  next:[1163,1405] objective_lb_search
#Model  78.91s var:286/289 constraints:2850/3014
#Bound  79.59s best:1406  next:[1164,1405] objective_lb_search_no_lp
#Bound  80.12s best:1406  next:[1165,1405] objective_lb_search_no_lp
#Bound  81.67s best:1406  next:[1166,1405] objective_lb_search_no_lp
#Bound  82.10s best:1406  next:[1168,1405] objective_lb_search_no_lp
#Bound  82.60s best:1406  next:[1182,1405] objective_lb_search_no_lp
#Model  83.04s var:284/289 constraints:2791/3014
#Bound  83.08s best:1406  next:[1184,1405] objective_lb_search_no_lp
#Bound  83.62s best:1406  next:[1185,1405] objective_lb_search_no_lp
#Bound  83.86s best:1406  next:[1197,1405] objective_lb_search_no_lp
#Bound  84.57s best:1406  next:[1199,1405] objective_lb_search_no_lp
#Model  84.57s var:282/289 constraints:2715/3014
#Model  84.62s var:281/289 constraints:2644/3014
#Model  84.70s var:280/289 constraints:2623/3014
#Bound  84.79s best:1406  next:[1205,1405] objective_lb_search_no_lp
#Model  85.00s var:269/289 constraints:1986/3014
#Bound  85.01s best:1406  next:[1208,1405] objective_lb_search_no_lp
#Bound  85.12s best:1406  next:[1216,1405] objective_lb_search_no_lp
#Model  85.17s var:258/289 constraints:1404/3014
#Bound  85.19s best:1406  next:[1218,1405] objective_lb_search_no_lp
#Done   85.20s no_lp
#Model  85.20s var:253/289 constraints:1101/3014
#Model  85.20s var:249/289 constraints:923/3014
#Done   85.20s core

Task timing                                  n [     min,      max]      avg      dev     time         n [     min,      max]      avg      dev    dtime
                             'core':         1 [   1.41m,    1.41m]    1.41m   0.00ns    1.41m         1 [   1.17m,    1.17m]    1.17m   0.00ns    1.17m
                       'default_lp':         1 [   1.41m,    1.41m]    1.41m   0.00ns    1.41m         1 [  10.67s,   10.67s]   10.67s   0.00ns   10.67s
                 'feasibility_pump':       229 [ 19.15ms,    1.46s] 364.72ms 227.09ms    1.39m       228 [  7.74ms,  63.19ms]  22.30ms   2.88ms    5.08s
                  'fj_long_default':         1 [145.38ms, 145.38ms] 145.38ms   0.00ns 145.38ms         1 [ 54.58ms,  54.58ms]  54.58ms   0.00ns  54.58ms
                  'fj_long_default':         1 [181.27ms, 181.27ms] 181.27ms   0.00ns 181.27ms         1 [ 81.64ms,  81.64ms]  81.64ms   0.00ns  81.64ms
              'fj_long_lin_default':         1 [143.54ms, 143.54ms] 143.54ms   0.00ns 143.54ms         1 [ 72.66ms,  72.66ms]  72.66ms   0.00ns  72.66ms
              'fj_long_lin_perturb':         1 [176.49ms, 176.49ms] 176.49ms   0.00ns 176.49ms         1 [ 86.45ms,  86.45ms]  86.45ms   0.00ns  86.45ms
               'fj_long_lin_random':         1 [181.72ms, 181.72ms] 181.72ms   0.00ns 181.72ms         1 [ 91.60ms,  91.60ms]  91.60ms   0.00ns  91.60ms
                  'fj_long_perturb':         1 [144.56ms, 144.56ms] 144.56ms   0.00ns 144.56ms         1 [ 73.75ms,  73.75ms]  73.75ms   0.00ns  73.75ms
                   'fj_long_random':         1 [162.54ms, 162.54ms] 162.54ms   0.00ns 162.54ms         1 [ 68.92ms,  68.92ms]  68.92ms   0.00ns  68.92ms
                 'fj_short_default':         1 [131.94ms, 131.94ms] 131.94ms   0.00ns 131.94ms         1 [ 74.94ms,  74.94ms]  74.94ms   0.00ns  74.94ms
                 'fj_short_default':         1 [166.11ms, 166.11ms] 166.11ms   0.00ns 166.11ms         1 [ 84.00ms,  84.00ms]  84.00ms   0.00ns  84.00ms
             'fj_short_lin_default':         1 [137.36ms, 137.36ms] 137.36ms   0.00ns 137.36ms         1 [ 75.40ms,  75.40ms]  75.40ms   0.00ns  75.40ms
             'fj_short_lin_default':         1 [149.17ms, 149.17ms] 149.17ms   0.00ns 149.17ms         1 [ 75.53ms,  75.53ms]  75.53ms   0.00ns  75.53ms
             'fj_short_lin_perturb':         1 [186.75ms, 186.75ms] 186.75ms   0.00ns 186.75ms         1 [ 82.66ms,  82.66ms]  82.66ms   0.00ns  82.66ms
              'fj_short_lin_random':         1 [149.95ms, 149.95ms] 149.95ms   0.00ns 149.95ms         1 [ 75.97ms,  75.97ms]  75.97ms   0.00ns  75.97ms
                 'fj_short_perturb':         1 [168.98ms, 168.98ms] 168.98ms   0.00ns 168.98ms         1 [ 73.59ms,  73.59ms]  73.59ms   0.00ns  73.59ms
                  'fj_short_random':         1 [149.56ms, 149.56ms] 149.56ms   0.00ns 149.56ms         1 [ 76.45ms,  76.45ms]  76.45ms   0.00ns  76.45ms
                        'fs_random':         1 [ 51.68ms,  51.68ms]  51.68ms   0.00ns  51.68ms         1 [  5.31us,   5.31us]   5.31us   0.00ns   5.31us
                        'fs_random':         1 [ 54.12ms,  54.12ms]  54.12ms   0.00ns  54.12ms         1 [  5.31us,   5.31us]   5.31us   0.00ns   5.31us
                        'fs_random':         1 [ 55.48ms,  55.48ms]  55.48ms   0.00ns  55.48ms         1 [  5.31us,   5.31us]   5.31us   0.00ns   5.31us
                        'fs_random':         1 [ 68.07ms,  68.07ms]  68.07ms   0.00ns  68.07ms         1 [  5.31us,   5.31us]   5.31us   0.00ns   5.31us
                  'fs_random_no_lp':         1 [ 52.96ms,  52.96ms]  52.96ms   0.00ns  52.96ms         1 [508.89us, 508.89us] 508.89us   0.00ns 508.89us
                  'fs_random_no_lp':         1 [ 53.43ms,  53.43ms]  53.43ms   0.00ns  53.43ms         1 [811.80us, 811.80us] 811.80us   0.00ns 811.80us
                  'fs_random_no_lp':         1 [ 55.12ms,  55.12ms]  55.12ms   0.00ns  55.12ms         1 [404.70us, 404.70us] 404.70us   0.00ns 404.70us
                  'fs_random_no_lp':         1 [ 66.11ms,  66.11ms]  66.11ms   0.00ns  66.11ms         1 [475.01us, 475.01us] 475.01us   0.00ns 475.01us
          'fs_random_quick_restart':         1 [ 53.22ms,  53.22ms]  53.22ms   0.00ns  53.22ms         1 [  5.31us,   5.31us]   5.31us   0.00ns   5.31us
          'fs_random_quick_restart':         1 [ 59.48ms,  59.48ms]  59.48ms   0.00ns  59.48ms         1 [ 20.00ns,  20.00ns]  20.00ns   0.00ns  20.00ns
          'fs_random_quick_restart':         1 [ 64.95ms,  64.95ms]  64.95ms   0.00ns  64.95ms         1 [ 20.00ns,  20.00ns]  20.00ns   0.00ns  20.00ns
          'fs_random_quick_restart':         1 [ 66.44ms,  66.44ms]  66.44ms   0.00ns  66.44ms         1 [ 20.00ns,  20.00ns]  20.00ns   0.00ns  20.00ns
    'fs_random_quick_restart_no_lp':         1 [ 52.87ms,  52.87ms]  52.87ms   0.00ns  52.87ms         1 [363.40us, 363.40us] 363.40us   0.00ns 363.40us
    'fs_random_quick_restart_no_lp':         1 [ 66.46ms,  66.46ms]  66.46ms   0.00ns  66.46ms         1 [415.00us, 415.00us] 415.00us   0.00ns 415.00us
    'fs_random_quick_restart_no_lp':         1 [ 68.33ms,  68.33ms]  68.33ms   0.00ns  68.33ms         1 [450.28us, 450.28us] 450.28us   0.00ns 450.28us
                    'graph_arc_lns':       288 [  9.06ms,    9.45s]    1.46s    1.27s    7.00m       274 [ 10.00ns, 252.01ms]  65.49ms  46.83ms   17.94s
                    'graph_cst_lns':       288 [  2.51ms, 239.00ms]   5.57ms  16.07ms    1.60s         0 [  0.00ns,   0.00ns]   0.00ns   0.00ns   0.00ns
                    'graph_dec_lns':       288 [  4.65ms,    9.16s]    1.41s    1.20s    6.74m       279 [ 10.00ns, 214.70ms]  64.34ms  43.86ms   17.95s
                    'graph_var_lns':       288 [  5.71ms,    4.95s]    1.36s 898.98ms    6.52m       278 [ 10.00ns, 306.86ms]  68.18ms  43.75ms   18.95s
                   'lb_tree_search':         1 [   1.41m,    1.41m]    1.41m   0.00ns    1.41m         1 [  19.83s,   19.83s]   19.83s   0.00ns   19.83s
                           'max_lp':         1 [   1.41m,    1.41m]    1.41m   0.00ns    1.41m         1 [  11.24s,   11.24s]   11.24s   0.00ns   11.24s
                            'no_lp':         1 [   1.41m,    1.41m]    1.41m   0.00ns    1.41m         1 [   7.48s,    7.48s]    7.48s   0.00ns    7.48s
              'objective_lb_search':         1 [   1.41m,    1.41m]    1.41m   0.00ns    1.41m         1 [  11.05s,   11.05s]   11.05s   0.00ns   11.05s
       'objective_lb_search_max_lp':         1 [   1.41m,    1.41m]    1.41m   0.00ns    1.41m         1 [   9.30s,    9.30s]    9.30s   0.00ns    9.30s
        'objective_lb_search_no_lp':         1 [   1.41m,    1.41m]    1.41m   0.00ns    1.41m         1 [   6.27s,    6.27s]    6.27s   0.00ns    6.27s
  'objective_shaving_search_max_lp':       103 [  4.43ms,    3.56s] 808.17ms 759.75ms    1.39m        78 [ 57.56us, 233.95ms]  48.84ms  60.87ms    3.81s
   'objective_shaving_search_no_lp':       104 [  4.58ms,    3.56s] 800.70ms 758.54ms    1.39m        73 [  1.13ms, 198.67ms]  41.18ms  45.42ms    3.01s
                          'probing':         1 [   1.41m,    1.41m]    1.41m   0.00ns    1.41m         1 [   2.81s,    2.81s]    2.81s   0.00ns    2.81s
                   'probing_max_lp':         1 [   1.41m,    1.41m]    1.41m   0.00ns    1.41m         1 [   4.39s,    4.39s]    4.39s   0.00ns    4.39s
                     'pseudo_costs':         1 [   1.41m,    1.41m]    1.41m   0.00ns    1.41m         1 [   6.46s,    6.46s]    6.46s   0.00ns    6.46s
                    'quick_restart':         1 [   1.41m,    1.41m]    1.41m   0.00ns    1.41m         1 [  12.18s,   12.18s]   12.18s   0.00ns   12.18s
              'quick_restart_no_lp':         1 [   1.41m,    1.41m]    1.41m   0.00ns    1.41m         1 [   8.52s,    8.52s]    8.52s   0.00ns    8.52s
                    'reduced_costs':         1 [   1.41m,    1.41m]    1.41m   0.00ns    1.41m         1 [   6.81s,    6.81s]    6.81s   0.00ns    6.81s
                        'rins/rens':       288 [239.93us,    5.68s]    1.14s 945.11ms    5.46m       254 [ 10.00ns, 200.42ms]  71.04ms  41.36ms   18.04s
                      'rnd_cst_lns':       288 [ 10.56ms,    9.66s]    1.37s    1.16s    6.59m       276 [ 10.00ns, 212.31ms]  66.35ms  45.71ms   18.31s
                      'rnd_var_lns':       288 [  5.93ms,    9.37s]    1.32s    1.12s    6.33m       279 [ 10.00ns, 200.06ms]  65.03ms  43.33ms   18.14s
                     'violation_ls':       280 [ 32.48ms,    1.13s] 175.21ms 130.75ms   49.06s       280 [ 14.24ms,  89.65ms]  50.88ms  18.74ms   14.25s
                     'violation_ls':       283 [  1.45ms,    1.23s] 224.43ms 157.15ms    1.06m       283 [162.19us,  86.53ms]  63.93ms  13.00ms   18.09s
                     'violation_ls':       284 [468.05us,    1.13s] 229.88ms 163.61ms    1.09m       284 [ 30.32us, 203.21ms]  80.54ms  39.20ms   22.87s
                     'violation_ls':       288 [  1.01ms, 928.41ms] 186.22ms 116.39ms   53.63s       288 [ 53.81us,  94.19ms]  63.62ms  12.57ms   18.32s
                     'violation_ls':       288 [420.49us, 961.66ms] 206.51ms 125.78ms   59.47s       287 [  3.05us,  79.02ms]  63.00ms   7.65ms   18.08s

Search stats                        Bools  Conflicts  Branches  Restarts  BoolPropag  IntegerPropag
                           'core':  6'906     15'091    33'907     3'027  38'067'492     15'005'365
                     'default_lp':     78     14'936    62'533     8'702     473'311     17'850'731
                      'fs_random':     78          0       156       156           6          4'708
                      'fs_random':     78          0       156       156           6          4'708
                      'fs_random':     78          0       156       156           6          4'708
                      'fs_random':     78          0       156       156           6          4'708
                'fs_random_no_lp':     78          0       192       156          18          6'401
                'fs_random_no_lp':     78         10       193       156          23          6'757
                'fs_random_no_lp':     78          5       229       156          52          8'037
                'fs_random_no_lp':     78          9       191       156          36          6'898
        'fs_random_quick_restart':     78          0       156       156           6          4'708
        'fs_random_quick_restart':     78          0       156       156           6          4'708
        'fs_random_quick_restart':     78          0       156       156           6          4'708
        'fs_random_quick_restart':     78          0       156       156           6          4'708
  'fs_random_quick_restart_no_lp':     78          0       190       156           8          6'527
  'fs_random_quick_restart_no_lp':     78          0       196       156           6          6'280
  'fs_random_quick_restart_no_lp':     78          0       204       156           7          6'413
                 'lb_tree_search':     78        150    75'468    20'137     159'748      6'880'348
                         'max_lp':     78      9'403    56'487     9'631     340'391     13'578'159
                          'no_lp':    878     31'471    79'748     9'322   5'389'326     29'861'736
            'objective_lb_search':    185      9'372    64'070    12'240     547'017     15'705'452
     'objective_lb_search_max_lp':    138      3'687    54'488    12'803     297'603     10'357'892
      'objective_lb_search_no_lp':    369     26'036    66'030     9'120   1'157'429     26'543'708
                        'probing':    500        274       866       866      23'912        150'089
                 'probing_max_lp':    320         81       559       559       9'302         78'642
                   'pseudo_costs':    278      6'091    37'070     6'365     498'261      8'902'379
                  'quick_restart':     78      4'844   103'813    30'137     356'418     13'097'291
            'quick_restart_no_lp':  2'339     26'445   106'808     8'535  13'785'583     24'882'505
                  'reduced_costs':    591      7'015    57'732     8'290   2'568'330     10'751'287

SAT stats                           ClassicMinim  LitRemoved  LitLearned  LitForgotten  Subsumed  MClauses  MDecisions  MLitTrue  MSubsumed  MLitRemoved  MReused
                           'core':        13'552      80'503      75'451             0        72       928       4'347         0         73          222       39
                     'default_lp':         9'614      24'137     142'756        30'452       658     4'623      43'252        10      1'696       11'312      815
                      'fs_random':             0           0           0             0         0         0           0         0          0            0        0
                      'fs_random':             0           0           0             0         0         0           0         0          0            0        0
                      'fs_random':             0           0           0             0         0         0           0         0          0            0        0
                      'fs_random':             0           0           0             0         0         0           0         0          0            0        0
                'fs_random_no_lp':             0           0           0             0         0         0           0         0          0            0        0
                'fs_random_no_lp':             0           0          20             0         0         0           0         0          0            0        0
                'fs_random_no_lp':             0           0          26             0         0         0           0         0          0            0        0
                'fs_random_no_lp':             0           0          28             0         0         0           0         0          0            0        0
        'fs_random_quick_restart':             0           0           0             0         0         0           0         0          0            0        0
        'fs_random_quick_restart':             0           0           0             0         0         0           0         0          0            0        0
        'fs_random_quick_restart':             0           0           0             0         0         0           0         0          0            0        0
        'fs_random_quick_restart':             0           0           0             0         0         0           0         0          0            0        0
  'fs_random_quick_restart_no_lp':             0           0           0             0         0         0           0         0          0            0        0
  'fs_random_quick_restart_no_lp':             0           0           0             0         0         0           0         0          0            0        0
  'fs_random_quick_restart_no_lp':             0           0           0             0         0         0           0         0          0            0        0
                 'lb_tree_search':             3           4         498             0         0     7'981      40'122         0         23           89      694
                         'max_lp':         5'507      13'028     103'239             0       372     4'063      41'324         0        356        2'511    1'156
                          'no_lp':        25'034      82'073     345'509       101'590       559     4'100      30'240        12        935        6'038      524
            'objective_lb_search':         6'842      17'133      61'621             0       440     5'467      47'936         0      1'370        8'184    1'472
     'objective_lb_search_max_lp':         2'194       4'414      29'402             0       255     4'554      42'601         1        453        2'768    1'227
      'objective_lb_search_no_lp':        21'223      59'740     197'403         8'263       671     3'847      30'008         0      1'072        6'583      725
                        'probing':             0           0         274             0         0         0           0         0          0            0        0
                 'probing_max_lp':             0           0          81             0         0         0           0         0          0            0        0
                   'pseudo_costs':         3'579       7'839      67'905             0       257     2'362      25'184         5        291        2'121      464
                  'quick_restart':         2'596       5'189      57'295             0       143    11'819      79'891         0        285        1'553      973
            'quick_restart_no_lp':        20'090      77'201     291'223        56'034       470     3'725      31'780         8      2'055       14'595      413
                  'reduced_costs':         4'315      10'007      66'032             0       299     4'642      40'001         0      2'000       13'766      807

Lp stats                         Component  Iterations  AddedCuts  OPTIMAL  DUAL_F.  DUAL_U.
                  'default_lp':          1     183'019      7'518   21'001        0        3
                   'fs_random':          1         126         50        3        0        0
                   'fs_random':          1         126         50        3        0        0
                   'fs_random':          1         126         61        3        0        0
                   'fs_random':          1         126         74        3        0        0
     'fs_random_quick_restart':          1         126          0        2        0        0
     'fs_random_quick_restart':          1         126          0        2        0        0
     'fs_random_quick_restart':          1         126         53        3        0        0
     'fs_random_quick_restart':          1          76          0        1        1        0
              'lb_tree_search':          1     414'527      6'260   21'461    5'810        0
                      'max_lp':          1     200'308      6'996   13'773    3'703       10
         'objective_lb_search':          1     205'898      4'608   16'177        1       19
  'objective_lb_search_max_lp':          1     144'939      4'823    5'770    1'762        5
                     'probing':          1      21'499      4'149    3'018        0        0
              'probing_max_lp':          1      14'841      4'640    1'968      124        0
                'pseudo_costs':          1     121'497      6'674    8'674    2'267        5
               'quick_restart':          1     203'091      5'573   17'126        0        7
               'reduced_costs':          1      97'557     10'011    7'965    1'875        8

Lp dimension                                                                      Final dimension of first component
                  'default_lp':   586 rows, 282 columns, 3112 entries with magnitude in [2.928566e-03, 1.000000e+00]
                   'fs_random':    122 rows, 282 columns, 615 entries with magnitude in [1.696067e-02, 1.000000e+00]
                   'fs_random':    122 rows, 282 columns, 615 entries with magnitude in [1.696067e-02, 1.000000e+00]
                   'fs_random':    122 rows, 282 columns, 615 entries with magnitude in [1.696067e-02, 1.000000e+00]
                   'fs_random':    122 rows, 282 columns, 615 entries with magnitude in [1.696067e-02, 1.000000e+00]
     'fs_random_quick_restart':    122 rows, 282 columns, 615 entries with magnitude in [1.696067e-02, 1.000000e+00]
     'fs_random_quick_restart':    122 rows, 282 columns, 615 entries with magnitude in [1.696067e-02, 1.000000e+00]
     'fs_random_quick_restart':    122 rows, 282 columns, 615 entries with magnitude in [1.696067e-02, 1.000000e+00]
     'fs_random_quick_restart':    122 rows, 282 columns, 615 entries with magnitude in [1.696067e-02, 1.000000e+00]
              'lb_tree_search':   640 rows, 289 columns, 2526 entries with magnitude in [2.495755e-03, 1.000000e+00]
                      'max_lp':   462 rows, 289 columns, 1798 entries with magnitude in [1.478281e-02, 1.000000e+00]
         'objective_lb_search':   611 rows, 282 columns, 2883 entries with magnitude in [1.151320e-03, 1.000000e+00]
  'objective_lb_search_max_lp':   885 rows, 289 columns, 3668 entries with magnitude in [1.609974e-03, 1.000000e+00]
                     'probing':   646 rows, 282 columns, 3953 entries with magnitude in [4.358518e-03, 1.000000e+00]
              'probing_max_lp':   477 rows, 289 columns, 2257 entries with magnitude in [8.782164e-03, 1.000000e+00]
                'pseudo_costs':   706 rows, 289 columns, 2947 entries with magnitude in [9.563659e-04, 1.000000e+00]
               'quick_restart':   716 rows, 282 columns, 2549 entries with magnitude in [4.878689e-03, 1.000000e+00]
               'reduced_costs':  1125 rows, 289 columns, 4957 entries with magnitude in [5.192171e-05, 1.000000e+00]

Lp debug                         CutPropag  CutEqPropag  Adjust  Overflow        Bad  BadScaling
                  'default_lp':          7           11   5'449         0    158'886           0
                   'fs_random':          0            0       0         0          0           0
                   'fs_random':          0            0       0         0          0           0
                   'fs_random':          0            0       0         0         14           0
                   'fs_random':          0            0       0         0         62           0
     'fs_random_quick_restart':          0            0       0         0          0           0
     'fs_random_quick_restart':          0            0       0         0          0           0
     'fs_random_quick_restart':          0            0       0         0          0           0
     'fs_random_quick_restart':          0            0       0         0         12           0
              'lb_tree_search':          4            3  13'559         0    117'127           0
                      'max_lp':         14            1   6'547         0     95'043           0
         'objective_lb_search':          3            1   5'133         0    185'333           0
  'objective_lb_search_max_lp':          9            2   3'723         0    131'061           0
                     'probing':          2           14   2'536         0  2'501'738           0
              'probing_max_lp':         16            1   1'965         0  1'727'252           0
                'pseudo_costs':         13            1   3'116         0     82'408           0
               'quick_restart':         13           14   6'856         0    346'694           0
               'reduced_costs':         20            3   3'724         0    115'643           0

Lp pool                          Constraints  Updates  Simplif  Merged  Shortened   Split  Strenghtened      Cuts/Call
                  'default_lp':        7'754      305   17'981      53      1'868   4'140         5'243   7'518/31'867
                   'fs_random':          339        0        0       0          0       0             3          50/50
                   'fs_random':          339        0        0       0          0       0             3          50/50
                   'fs_random':          350        0        0       0          0       0             5          61/70
                   'fs_random':          363        0        0       0          0       0             5          74/91
     'fs_random_quick_restart':          289        0        0       0          0       0             3            0/0
     'fs_random_quick_restart':          289        0        0       0          0       0             3            0/0
     'fs_random_quick_restart':          289        0        0       0          0       0             3            0/0
     'fs_random_quick_restart':          342        0        0       0          0       0             3          53/55
              'lb_tree_search':        9'264      144   11'529       9        469   1'014        17'972   6'260/28'128
                      'max_lp':        9'998      163   14'123      11        551   1'912        19'494   6'996/22'815
         'objective_lb_search':        4'862      230   12'921      35      1'335   3'158         3'629   4'608/20'474
  'objective_lb_search_max_lp':        7'827      207   27'723       9      4'477   2'659        29'385   4'823/12'886
                     'probing':        4'426      323    7'725      12         84   5'530         2'055    4'149/8'847
              'probing_max_lp':        7'638      327   12'332      15      1'508   2'875        13'485   4'640/11'066
                'pseudo_costs':        9'652      179   18'312      35      1'711   1'642        22'374   6'674/18'883
               'quick_restart':        5'841      471   43'966      21      3'798  16'012         6'330   5'573/27'261
               'reduced_costs':       11'976      232   31'873      48      6'886   2'681        32'980  10'011/27'565

Lp Cut            fs_ran  fs_ran  fs_ran  fs_ran  fs_ran  defaul  max_lp  quick_  reduce  pseudo  lb_tre  probin  object  probin  object
          CG_FF:       -       -       -       -       -     342     232     150     524     291     190     126     139     122     138
           CG_K:       -       -       -       -       -     196     156      84     367     187     122      66      49      91      76
           CG_R:       -       -       -       -       -     193     163     115     275     157     125      56      79     105      82
          CG_RB:       -       -       -       -       -     636     766     324   1'150     634     498     271     260     413     354
         CG_RBP:       -       -       -       -       -      55      50      39     106      78      40      27      20      31      19
         Clique:       -       -       -       -       -       -      65       -      77      64      63       -       -      57      78
             IB:      50      50      50      50      50   1'095     650   1'382     804     794     647     954     925     344     673
       MIR_1_FF:       8       6       2       -       -     502     441     332     606     387     435     317     367     347     296
        MIR_1_K:       3       2       -       -       -     102      73      48     103      66      42      34      51      23      26
       MIR_1_KL:       -       -       -       -       -       6       -       5       2       1       2       7       -       -       -
        MIR_1_R:       2       2       1       -       -      94      32      30      91      52      23      27      34      17      33
       MIR_1_RB:       7       1       -       -       -     878     874     677   1'144     834     774     464     553     500     511
      MIR_1_RBP:       -       -       -       -       -      62     137      42     212     157     125      22      42      79      93
      MIR_1_RLT:       -       -       -       -       -       -       -       -       -       1       -       -       -       1       -
       MIR_2_FF:       2       -       -       -       -     274     198     133     306     215     183     109     145     113     165
        MIR_2_K:       -       -       -       -       -      57      51      19      84      45      30      14      28      20      35
       MIR_2_KL:       -       -       -       -       -       3       1       7       -       1       2       5       -       1       -
        MIR_2_R:       1       -       -       -       -      74      76      40     124      82      60      24      45      39      71
       MIR_2_RB:       1       -       -       -       -     385     467     322     640     452     463     222     254     185     319
      MIR_2_RBP:       -       -       -       -       -      62      78      18     143      91      54      18      24      27      53
       MIR_3_FF:       -       -       -       -       -     133     112     111     197     129     106      55      81      67      72
        MIR_3_K:       -       -       -       -       -      36      30      32      46      25      32      13      23      15      12
       MIR_3_KL:       -       -       -       -       -       -       -       3       1       -       1       4       2       -       -
        MIR_3_R:       -       -       -       -       -      39      88      38      90      65      49      24      25      40      57
       MIR_3_RB:       -       -       -       -       -     248     250     197     355     247     243     126     138     129     157
      MIR_3_RBP:       -       -       -       -       -      31      52      27      73      53      42      12      17      20      30
       MIR_4_FF:       -       -       -       -       -     117      92      56     133      73      69      41      56      54      45
        MIR_4_K:       -       -       -       -       -      38      29      15      55      20      29      18      13      20      14
       MIR_4_KL:       -       -       -       -       -       5       -       7       2       1       1       4       1       -       -
        MIR_4_R:       -       -       -       -       -      44      52      29      64      46      43      25      19      25      36
       MIR_4_RB:       -       -       -       -       -     176     178     126     228     133     148      85     110      92      99
      MIR_4_RBP:       -       -       -       -       -      28      20      18      45      26      24      13      11       6      16
       MIR_5_FF:       -       -       -       -       -      85      41      34      85      44      46      27      40      32      24
        MIR_5_K:       -       -       -       -       -      28      20      15      48      13      17       7      12      12       9
       MIR_5_KL:       -       -       -       -       -       -       1       2       -       -       -       -       -       -       -
        MIR_5_R:       -       -       -       -       -      50      25      15      58      41      25      12      13      21      16
       MIR_5_RB:       -       -       -       -       -     125      82      79     144      94      88      48      87      51      54
      MIR_5_RBP:       -       -       -       -       -      17      20      12      21      11      22       6       5       5       6
       MIR_6_FF:       -       -       -       -       -      40      34      14      47      26      16      16      22       6      19
        MIR_6_K:       -       -       -       -       -      16      15       5      28       9       9       6      11       8       8
        MIR_6_R:       -       -       -       -       -      34      23      10      30      19      17       7       4       2      11
       MIR_6_RB:       -       -       -       -       -      65      62      42      80      37      49      27      39      20      22
      MIR_6_RBP:       -       -       -       -       -      10      12       5      12      11       9       2       2       3       2
   ZERO_HALF_FF:       -       -       -       -       -      85     114      49     116      85      77      45      42      62      38
    ZERO_HALF_K:       -       -       -       -       -      22      28      10      23      22      17       8       3       7      10
    ZERO_HALF_R:       -       -       -       -       -     829     861     737     908     642   1'037     642     712   1'280     922
   ZERO_HALF_RB:       -       -       -       -       -     165     205      83     312     188     136      97      93     122     109
  ZERO_HALF_RBP:       -       -       -       -       -      36      40      35      52      25      30      16      12      26      13

LNS stats           Improv/Calls  Closed  Difficulty  TimeLimit
  'graph_arc_lns':        15/287     52%        0.98       0.11
  'graph_cst_lns':           1/1    100%        0.71       0.10
  'graph_dec_lns':        20/288     53%        0.99       0.11
  'graph_var_lns':        18/287     53%        0.99       0.11
      'rins/rens':        35/286     50%        0.87       0.10
    'rnd_cst_lns':        14/287     52%        0.99       0.11
    'rnd_var_lns':        20/287     52%        0.99       0.11

LS stats                   Batches  Restarts   LinMoves   GenMoves  CompoundMoves  WeightUpdates
       'fj_long_default':        1         1      8'140          0              0            220
       'fj_long_default':        1         1      9'835          0              0            165
   'fj_long_lin_default':        1         1          0      3'296            517              2
   'fj_long_lin_perturb':        1         1      8'847          0              0          1'153
    'fj_long_lin_random':        1         1      8'881          0              0          1'119
       'fj_long_perturb':        1         1          0      3'281            426              1
        'fj_long_random':        1         1      8'781          0              0            152
      'fj_short_default':        1         1          0      3'266            409              1
      'fj_short_default':        1         1      8'432          0              0          1'568
  'fj_short_lin_default':        1         1          0      2'993            308              1
  'fj_short_lin_default':        1         1          0      3'332            351              1
  'fj_short_lin_perturb':        1         1      9'830          0              0            170
   'fj_short_lin_random':        1         1          0      3'507            367              2
      'fj_short_perturb':        1         1      9'811          0              0            189
       'fj_short_random':        1         1          0      3'411            517              2
          'violation_ls':      280         0    497'570  1'330'181         52'319        557'235
          'violation_ls':      283         0    683'535  1'377'405         65'077         74'766
          'violation_ls':      284         0    527'678  1'084'927         65'081        127'995
          'violation_ls':      287         0     43'966  1'981'930         72'532         10'904
          'violation_ls':      288         0  1'043'232    867'780         46'612         78'118

Solutions (38)                  Num     Rank
              'graph_dec_lns':    2  [32,38]
                      'no_lp':   15   [1,25]
  'objective_lb_search_no_lp':    1    [4,4]
               'pseudo_costs':    1  [37,37]
        'quick_restart_no_lp':    6  [16,36]
              'rins_pump_lns':    1  [33,33]
               'violation_ls':   12  [18,31]

Objective bounds                     Num
                      'default_lp':   10
                  'initial_domain':    1
                  'lb_tree_search':   16
             'objective_lb_search':   31
      'objective_lb_search_max_lp':    8
       'objective_lb_search_no_lp':   53
  'objective_shaving_search_no_lp':    2

Solution repositories    Added  Queried  Ignored  Synchro
  'feasible solutions':  1'672    5'681        5    1'576
        'lp solutions':    341      155        0      320
                'pump':  4'741      133

Improving bounds shared          Num
                        'core':    3
                  'default_lp':   69
              'lb_tree_search':   59
                      'max_lp':   22
                       'no_lp':  677
         'objective_lb_search':  175
  'objective_lb_search_max_lp':   53
   'objective_lb_search_no_lp':    1
                     'probing':  492
              'probing_max_lp':   77
                'pseudo_costs':   29
               'quick_restart':  175
         'quick_restart_no_lp':  876
               'reduced_costs':   84

Clauses shared                   Num
                        'core':    4
                  'default_lp':   49
             'fs_random_no_lp':    3
              'lb_tree_search':    3
                      'max_lp':    4
                       'no_lp':   38
         'objective_lb_search':   20
  'objective_lb_search_max_lp':   11
   'objective_lb_search_no_lp':    4
                'pseudo_costs':    2
               'quick_restart':   22
         'quick_restart_no_lp':   23
               'reduced_costs':    7

CpSolverResponse summary:
status: OPTIMAL
objective: 1406
best_bound: 1406
integers: 283
booleans: 78
conflicts: 0
branches: 156
propagations: 6
integer_propagations: 4708
restarts: 156
lp_iterations: 126
walltime: 85.3251
usertime: 85.3251
deterministic_time: 401.335
gap_integral: 1290.98
solution_fingerprint: 0xe0fe4f3209218cd1


--- Simulation Gantt  partir du modle mathmatique ---
{'big':1, 'due_date':135, 'pos_time':5, 'status':0, 'blocked':0, 'operations':["{'type':1, 'processing_time':51}", "{'type':0, 'processing_time':31}"]}
{'big':1, 'due_date':82, 'pos_time':5, 'status':0, 'blocked':0, 'operations':["{'type':0, 'processing_time':55}"]}
{'big':1, 'due_date':52, 'pos_time':5, 'status':0, 'blocked':0, 'operations':["{'type':0, 'processing_time':33}"]}
{'big':1, 'due_date':98, 'pos_time':5, 'status':0, 'blocked':0, 'operations':["{'type':0, 'processing_time':54}"]}
{'big':0, 'due_date':142, 'pos_time':5, 'status':0, 'blocked':0, 'operations':["{'type':0, 'processing_time':15}", "{'type':1, 'processing_time':18}"]}
{'big':1, 'due_date':168, 'pos_time':5, 'status':0, 'blocked':0, 'operations':["{'type':1, 'processing_time':32}", "{'type':0, 'processing_time':40}"]}
{'big':0, 'due_date':76, 'pos_time':5, 'status':0, 'blocked':0, 'operations':["{'type':1, 'processing_time':52}"]}
{'big':1, 'due_date':95, 'pos_time':5, 'status':0, 'blocked':0, 'operations':["{'type':0, 'processing_time':27}", "{'type':1, 'processing_time':47}"]}
