created virtual environment CPython3.12.4.final.0-64 in 5762ms
  creator CPython3Posix(dest=/localscratch/aneumann.63390784.0/env, clear=False, no_vcs_ignore=False, global=False)
  seeder FromAppData(download=False, pip=bundle, via=copy, app_data_dir=/home/aneumann/.local/share/virtualenv)
    added seed packages: pip==25.1.1
  activators BashActivator,CShellActivator,FishActivator,NushellActivator,PowerShellActivator,PythonActivator
Looking in links: /cvmfs/soft.computecanada.ca/custom/python/wheelhouse/gentoo2023/x86-64-v3, /cvmfs/soft.computecanada.ca/custom/python/wheelhouse/gentoo2023/generic, /cvmfs/soft.computecanada.ca/custom/python/wheelhouse/generic
Requirement already satisfied: pip in /localscratch/aneumann.63390784.0/env/lib/python3.12/site-packages (25.1.1)
Looking in links: /cvmfs/soft.computecanada.ca/custom/python/wheelhouse/gentoo2023/x86-64-v3, /cvmfs/soft.computecanada.ca/custom/python/wheelhouse/gentoo2023/generic, /cvmfs/soft.computecanada.ca/custom/python/wheelhouse/generic
ERROR: protobuf-5.28.3-cp38-abi3-manylinux2014_x86_64.whl is not a supported wheel on this platform.
Looking in links: /cvmfs/soft.computecanada.ca/custom/python/wheelhouse/gentoo2023/x86-64-v3, /cvmfs/soft.computecanada.ca/custom/python/wheelhouse/gentoo2023/generic, /cvmfs/soft.computecanada.ca/custom/python/wheelhouse/generic
Processing /home/aneumann/projects/def-adhaj/aneumann/GNRS/wheels/immutabledict-4.2.0-py3-none-any.whl
Installing collected packages: immutabledict
Successfully installed immutabledict-4.2.0
Looking in links: /cvmfs/soft.computecanada.ca/custom/python/wheelhouse/gentoo2023/x86-64-v3, /cvmfs/soft.computecanada.ca/custom/python/wheelhouse/gentoo2023/generic, /cvmfs/soft.computecanada.ca/custom/python/wheelhouse/generic
Processing /cvmfs/soft.computecanada.ca/custom/python/wheelhouse/generic/ortools-9.10.4067+computecanada-cp312-cp312-linux_x86_64.whl (from -r /home/aneumann/projects/def-adhaj/aneumann/GNRS/requirements/or.txt (line 1))
Processing /cvmfs/soft.computecanada.ca/custom/python/wheelhouse/gentoo2023/x86-64-v3/matplotlib-3.10.0+computecanada-cp312-cp312-linux_x86_64.whl (from -r /home/aneumann/projects/def-adhaj/aneumann/GNRS/requirements/or.txt (line 2))
Processing /cvmfs/soft.computecanada.ca/custom/python/wheelhouse/gentoo2023/x86-64-v3/pandas-2.2.3+computecanada-cp312-cp312-linux_x86_64.whl (from -r /home/aneumann/projects/def-adhaj/aneumann/GNRS/requirements/or.txt (line 3))
Processing /cvmfs/soft.computecanada.ca/custom/python/wheelhouse/generic/absl_py-2.2.2+computecanada-py3-none-any.whl (from ortools<9.11,>=9.10->-r /home/aneumann/projects/def-adhaj/aneumann/GNRS/requirements/or.txt (line 1))
Processing /cvmfs/soft.computecanada.ca/custom/python/wheelhouse/gentoo2023/generic/numpy-2.2.2+computecanada-cp312-cp312-linux_x86_64.whl (from ortools<9.11,>=9.10->-r /home/aneumann/projects/def-adhaj/aneumann/GNRS/requirements/or.txt (line 1))
Processing /cvmfs/soft.computecanada.ca/custom/python/wheelhouse/gentoo2023/x86-64-v3/protobuf-6.30.2+computecanada-cp312-cp312-linux_x86_64.whl (from ortools<9.11,>=9.10->-r /home/aneumann/projects/def-adhaj/aneumann/GNRS/requirements/or.txt (line 1))
Requirement already satisfied: immutabledict>=3.0.0 in /localscratch/aneumann.63390784.0/env/lib/python3.12/site-packages (from ortools<9.11,>=9.10->-r /home/aneumann/projects/def-adhaj/aneumann/GNRS/requirements/or.txt (line 1)) (4.2.0)
Processing /cvmfs/soft.computecanada.ca/custom/python/wheelhouse/gentoo2023/generic/contourpy-1.3.1+computecanada-cp312-cp312-linux_x86_64.whl (from matplotlib->-r /home/aneumann/projects/def-adhaj/aneumann/GNRS/requirements/or.txt (line 2))
Processing /cvmfs/soft.computecanada.ca/custom/python/wheelhouse/generic/cycler-0.12.1+computecanada-py3-none-any.whl (from matplotlib->-r /home/aneumann/projects/def-adhaj/aneumann/GNRS/requirements/or.txt (line 2))
Processing /cvmfs/soft.computecanada.ca/custom/python/wheelhouse/generic/fonttools-4.58.2+computecanada-cp312-cp312-linux_x86_64.whl (from matplotlib->-r /home/aneumann/projects/def-adhaj/aneumann/GNRS/requirements/or.txt (line 2))
Processing /cvmfs/soft.computecanada.ca/custom/python/wheelhouse/gentoo2023/x86-64-v3/kiwisolver-1.4.8+computecanada-cp312-cp312-linux_x86_64.whl (from matplotlib->-r /home/aneumann/projects/def-adhaj/aneumann/GNRS/requirements/or.txt (line 2))
Processing /cvmfs/soft.computecanada.ca/custom/python/wheelhouse/generic/packaging-25.0+computecanada-py3-none-any.whl (from matplotlib->-r /home/aneumann/projects/def-adhaj/aneumann/GNRS/requirements/or.txt (line 2))
Processing /cvmfs/soft.computecanada.ca/custom/python/wheelhouse/gentoo2023/x86-64-v3/pillow-11.1.0+computecanada-cp312-cp312-linux_x86_64.whl (from matplotlib->-r /home/aneumann/projects/def-adhaj/aneumann/GNRS/requirements/or.txt (line 2))
Processing /cvmfs/soft.computecanada.ca/custom/python/wheelhouse/generic/pyparsing-3.2.1+computecanada-py3-none-any.whl (from matplotlib->-r /home/aneumann/projects/def-adhaj/aneumann/GNRS/requirements/or.txt (line 2))
Processing /cvmfs/soft.computecanada.ca/custom/python/wheelhouse/generic/python_dateutil-2.9.0.post0+computecanada-py2.py3-none-any.whl (from matplotlib->-r /home/aneumann/projects/def-adhaj/aneumann/GNRS/requirements/or.txt (line 2))
Processing /cvmfs/soft.computecanada.ca/custom/python/wheelhouse/generic/pytz-2025.2+computecanada-py2.py3-none-any.whl (from pandas->-r /home/aneumann/projects/def-adhaj/aneumann/GNRS/requirements/or.txt (line 3))
Processing /cvmfs/soft.computecanada.ca/custom/python/wheelhouse/generic/tzdata-2025.2+computecanada-py2.py3-none-any.whl (from pandas->-r /home/aneumann/projects/def-adhaj/aneumann/GNRS/requirements/or.txt (line 3))
Processing /cvmfs/soft.computecanada.ca/custom/python/wheelhouse/generic/six-1.17.0+computecanada-py2.py3-none-any.whl (from python-dateutil>=2.7->matplotlib->-r /home/aneumann/projects/def-adhaj/aneumann/GNRS/requirements/or.txt (line 2))
Installing collected packages: pytz, tzdata, six, pyparsing, protobuf, pillow, packaging, numpy, kiwisolver, fonttools, cycler, absl-py, python-dateutil, contourpy, pandas, matplotlib, ortools

Successfully installed absl-py-2.2.2+computecanada contourpy-1.3.1+computecanada cycler-0.12.1+computecanada fonttools-4.58.2+computecanada kiwisolver-1.4.8+computecanada matplotlib-3.10.0+computecanada numpy-2.2.2+computecanada ortools-9.10.4067+computecanada packaging-25.0+computecanada pandas-2.2.3+computecanada pillow-11.1.0+computecanada protobuf-6.30.2+computecanada pyparsing-3.2.1+computecanada python-dateutil-2.9.0.post0+computecanada pytz-2025.2+computecanada six-1.17.0+computecanada tzdata-2025.2+computecanada

Starting CP-SAT solver v9.10.4067
Parameters: max_time_in_seconds: 3600 max_memory_in_mb: 12000 log_search_progress: true enumerate_all_solutions: false absolute_gap_limit: 0 relative_gap_limit: 0
Setting number of workers to 48

Initial optimization model '': (model_fingerprint: 0x8ac7c3b37211da30)
#Variables: 177 (#ints: 5 in objective)
  - 120 Booleans in [0,1]
  - 57 in [0,428]
#kLinear1: 20
#kLinear2: 225
#kLinear3: 70
#kLinearN: 685 (#terms: 6'443)

Starting presolve at 0.00s
  3.86e-04s  0.00e+00d  [DetectDominanceRelations] 
  9.44e-03s  0.00e+00d  [PresolveToFixPoint] #num_loops=6 #num_dual_strengthening=3 
  1.77e-05s  0.00e+00d  [ExtractEncodingFromLinear] #potential_supersets=2 
[Symmetry] Graph for symmetry has 1'005 nodes and 4'110 arcs.
[Symmetry] Symmetry computation done. time: 0.000896409 dtime: 0.00036712
[SAT presolve] num removable Booleans: 0 / 45
[SAT presolve] num trivial clauses: 0
[SAT presolve] [0s] clauses:4 literals:12 vars:9 one_side_vars:8 simple_definition:1 singleton_clauses:0
[SAT presolve] [3.9797e-05s] clauses:4 literals:12 vars:9 one_side_vars:8 simple_definition:1 singleton_clauses:0
[SAT presolve] [5.2931e-05s] clauses:4 literals:12 vars:9 one_side_vars:8 simple_definition:1 singleton_clauses:0
  2.57e-03s  2.67e-04d  [Probe] #probed=194 #fixed_bools=4 #new_bounds=18 #new_binary_clauses=8 
  1.83e-05s  0.00e+00d  [MaxClique] 
  3.61e-04s  0.00e+00d  [DetectDominanceRelations] 
  4.67e-03s  0.00e+00d  [PresolveToFixPoint] #num_loops=4 #num_dual_strengthening=3 
  8.41e-04s  0.00e+00d  [ProcessAtMostOneAndLinear] 
  7.11e-04s  0.00e+00d  [DetectDuplicateConstraints] #duplicates=177 #without_enforcements=48 
  2.40e-04s  8.21e-06d  [DetectDominatedLinearConstraints] #relevant_constraints=334 #num_inclusions=141 #num_redundant=4 
  1.38e-04s  0.00e+00d  [DetectDifferentVariables] #different=24 #cliques=1 #size=3 
  8.68e-05s  2.49e-06d  [ProcessSetPPC] #relevant_constraints=181 
  1.08e-05s  0.00e+00d  [FindAlmostIdenticalLinearConstraints] 
  4.04e-05s  2.17e-05d  [FindBigAtMostOneAndLinearOverlap] 
  5.39e-04s  1.86e-04d  [FindBigVerticalLinearOverlap] #blocks=3 #saved_nz=114 
  4.30e-05s  7.40e-06d  [FindBigHorizontalLinearOverlap] #linears=168 
  1.84e-05s  6.00e-08d  [MergeClauses] 
  3.43e-04s  0.00e+00d  [DetectDominanceRelations] 
  2.71e-03s  0.00e+00d  [PresolveToFixPoint] #num_loops=2 #num_dual_strengthening=1 
  3.40e-04s  0.00e+00d  [DetectDominanceRelations] 
  2.11e-03s  0.00e+00d  [PresolveToFixPoint] #num_loops=1 #num_dual_strengthening=1 
[SAT presolve] num removable Booleans: 0 / 41
[SAT presolve] num trivial clauses: 0
[SAT presolve] [0s] clauses:4 literals:12 vars:9 one_side_vars:8 simple_definition:1 singleton_clauses:0
[SAT presolve] [3.2847e-05s] clauses:4 literals:12 vars:9 one_side_vars:8 simple_definition:1 singleton_clauses:0
[SAT presolve] [4.4636e-05s] clauses:4 literals:12 vars:9 one_side_vars:8 simple_definition:1 singleton_clauses:0
  2.12e-03s  2.38e-04d  [Probe] #probed=184 #new_bounds=1 #new_binary_clauses=8 
  5.44e-06s  0.00e+00d  [MaxClique] 
  3.45e-04s  0.00e+00d  [DetectDominanceRelations] 
  2.44e-03s  0.00e+00d  [PresolveToFixPoint] #num_loops=2 #num_dual_strengthening=1 
  6.92e-04s  0.00e+00d  [ProcessAtMostOneAndLinear] 
  5.26e-04s  0.00e+00d  [DetectDuplicateConstraints] #without_enforcements=48 
  1.75e-04s  6.24e-06d  [DetectDominatedLinearConstraints] #relevant_constraints=277 #num_inclusions=42 
  5.67e-05s  0.00e+00d  [DetectDifferentVariables] 
  8.33e-05s  2.33e-06d  [ProcessSetPPC] #relevant_constraints=172 
  1.27e-05s  0.00e+00d  [FindAlmostIdenticalLinearConstraints] 
  3.68e-05s  2.06e-05d  [FindBigAtMostOneAndLinearOverlap] 
  4.60e-04s  1.76e-04d  [FindBigVerticalLinearOverlap] #blocks=1 #saved_nz=43 
  4.08e-05s  7.17e-06d  [FindBigHorizontalLinearOverlap] #linears=168 
  1.72e-05s  6.00e-08d  [MergeClauses] 
  3.44e-04s  0.00e+00d  [DetectDominanceRelations] 
  2.63e-03s  0.00e+00d  [PresolveToFixPoint] #num_loops=2 #num_dual_strengthening=1 
  3.38e-04s  0.00e+00d  [DetectDominanceRelations] 
  2.23e-03s  0.00e+00d  [PresolveToFixPoint] #num_loops=1 #num_dual_strengthening=1 
[SAT presolve] num removable Booleans: 0 / 41
[SAT presolve] num trivial clauses: 0
[SAT presolve] [0s] clauses:4 literals:12 vars:9 one_side_vars:8 simple_definition:1 singleton_clauses:0
[SAT presolve] [3.2782e-05s] clauses:4 literals:12 vars:9 one_side_vars:8 simple_definition:1 singleton_clauses:0
[SAT presolve] [4.5994e-05s] clauses:4 literals:12 vars:9 one_side_vars:8 simple_definition:1 singleton_clauses:0
  2.12e-03s  2.39e-04d  [Probe] #probed=184 #new_bounds=1 #new_binary_clauses=8 
  5.59e-06s  0.00e+00d  [MaxClique] 
  3.39e-04s  0.00e+00d  [DetectDominanceRelations] 
  2.66e-03s  0.00e+00d  [PresolveToFixPoint] #num_loops=2 #num_dual_strengthening=1 
  7.02e-04s  0.00e+00d  [ProcessAtMostOneAndLinear] 
  5.21e-04s  0.00e+00d  [DetectDuplicateConstraints] #without_enforcements=48 
  1.76e-04s  6.02e-06d  [DetectDominatedLinearConstraints] #relevant_constraints=278 #num_inclusions=42 
  5.72e-05s  0.00e+00d  [DetectDifferentVariables] 
  8.24e-05s  2.24e-06d  [ProcessSetPPC] #relevant_constraints=172 
  1.27e-05s  0.00e+00d  [FindAlmostIdenticalLinearConstraints] 
  3.67e-05s  2.01e-05d  [FindBigAtMostOneAndLinearOverlap] 
  4.34e-04s  1.70e-04d  [FindBigVerticalLinearOverlap] #blocks=1 #saved_nz=37 
  4.05e-05s  7.05e-06d  [FindBigHorizontalLinearOverlap] #linears=165 
  1.74e-05s  6.00e-08d  [MergeClauses] 
  3.39e-04s  0.00e+00d  [DetectDominanceRelations] 
  2.38e-03s  0.00e+00d  [PresolveToFixPoint] #num_loops=2 #num_dual_strengthening=1 
  2.71e-05s  0.00e+00d  [ExpandObjective] #entries=28 #tight_variables=14 #tight_constraints=7 

Presolve summary:
  - 33 affine relations were detected.
  - rule 'TODO dual: only one blocking constraint?' was applied 339 times.
  - rule 'TODO dual: only one unspecified blocking constraint?' was applied 65 times.
  - rule 'TODO duplicate: identical constraint with different enforcements' was applied 144 times.
  - rule 'TODO linear2: contains a Boolean.' was applied 50 times.
  - rule 'TODO no_overlap: with task always last' was applied 1 time.
  - rule 'affine: new relation' was applied 33 times.
  - rule 'all_diff: inferred from x != y constraints' was applied 1 time.
  - rule 'at_most_one: removed literals' was applied 1 time.
  - rule 'at_most_one: size one' was applied 1 time.
  - rule 'deductions: 108 stored' was applied 1 time.
  - rule 'dual: fix variable' was applied 9 times.
  - rule 'dual: reduced domain' was applied 35 times.
  - rule 'duplicate: merged rhs of linear constraint' was applied 35 times.
  - rule 'duplicate: removed constraint' was applied 177 times.
  - rule 'enforcement: false literal' was applied 18 times.
  - rule 'enforcement: true literal' was applied 17 times.
  - rule 'incompatible linear: add implication' was applied 27 times.
  - rule 'linear inclusion: redundant containing constraint' was applied 1 time.
  - rule 'linear inclusion: redundant included constraint' was applied 3 times.
  - rule 'linear matrix: common vertical rectangle' was applied 5 times.
  - rule 'linear2: contains a Boolean.' was applied 11 times.
  - rule 'linear: always true' was applied 260 times.
  - rule 'linear: doubleton free' was applied 7 times.
  - rule 'linear: empty' was applied 20 times.
  - rule 'linear: extracted enforcement literal' was applied 1'267 times.
  - rule 'linear: fixed or dup variables' was applied 683 times.
  - rule 'linear: negative clause' was applied 4 times.
  - rule 'linear: positive equal one' was applied 2 times.
  - rule 'linear: reduced variable domains' was applied 71 times.
  - rule 'linear: remapped using affine relations' was applied 609 times.
  - rule 'linear: simplified rhs' was applied 2'047 times.
  - rule 'linear: variable substitution 1' was applied 7 times.
  - rule 'presolve: 55 unused variables removed.' was applied 1 time.
  - rule 'presolve: iteration' was applied 3 times.
  - rule 'probing: reduced enforced constraint to implication.' was applied 1 time.
  - rule 'probing: simplified enforcement list.' was applied 2 times.

Presolved optimization model '': (model_fingerprint: 0xce300ef278e03586)
#Variables: 87 (#ints: 5 in objective)
  - 41 Booleans in [0,1]
  - 4 in [0,230]
  - 1 in [0,272]
  - 1 in [0,275]
  - 1 in [0,276]
  - 1 in [0,293]
  - 2 in [0,316]
  - 3 in [0,338]
  - 1 in [0,344]
  - 4 in [0,383]
  - 1 in [3,341]
  - 1 in [3,347]
  - 1 in [3,347][431,769]
  - 1 in [20,403]
  - 1 in [25,408]
  - 1 in [27,371]
  - 1 in [32,376]
  - 1 in [55,371]
  - 1 in [58,371][483,799]
  - 1 in [59,397]
  - 1 in [64,402]
  - 3 in [124,417]
  - 1 in [130,423]
  - 3 in [141,417]
  - 3 in [142,417]
  - 3 in [145,417]
  - 1 in [147,423]
  - 1 in [148,423]
  - 1 in [151,423]
  - 1 in [198,428]
#kAllDiff: 1
#kBoolOr: 4 (#literals: 12)
#kExactlyOne: 2 (#literals: 6)
#kLinear1: 11 (#enforced: 11 #multi: 6)
#kLinear2: 252 (#enforced: 216 #multi: 168)
#kLinear3: 37 (#enforced: 22)
#kLinearN: 179 (#enforced: 146) (#terms: 1'466)

Preloading model.
#Bound   0.05s best:inf   next:[198,1544] initial_domain
#Model   0.05s var:87/87 constraints:486/486

Starting search at 0.05s with 48 workers.
16 full problem subsolvers: [core, default_lp, lb_tree_search, max_lp, no_lp, objective_lb_search, objective_lb_search_max_lp, objective_lb_search_no_lp, objective_shaving_search_max_lp, objective_shaving_search_no_lp, probing, probing_max_lp, pseudo_costs, quick_restart, quick_restart_no_lp, reduced_costs]
30 first solution subsolvers: [fj_long_default(2), fj_long_lin_default, fj_long_lin_perturb, fj_long_lin_random, fj_long_perturb, fj_long_random, fj_short_default(2), fj_short_lin_default(2), fj_short_lin_perturb, fj_short_lin_random, fj_short_perturb, fj_short_random, fs_random(4), fs_random_no_lp(4), fs_random_quick_restart(4), fs_random_quick_restart_no_lp(3)]
13 incomplete subsolvers: [feasibility_pump, graph_arc_lns, graph_cst_lns, graph_dec_lns, graph_var_lns, rins/rens, rnd_cst_lns, rnd_var_lns, violation_ls(5)]
3 helper subsolvers: [neighborhood_helper, synchronization_agent, update_gap_integral]
#Bound   0.06s best:inf   next:[223,1544] objective_lb_search_no_lp
#1       0.06s best:736   next:[223,735]  no_lp (fixed_bools=0/66)
#Bound   0.06s best:736   next:[224,735]  objective_lb_search_no_lp
#Bound   0.06s best:736   next:[225,735]  objective_lb_search_no_lp
#Bound   0.06s best:736   next:[226,735]  objective_lb_search_no_lp
#Bound   0.06s best:736   next:[227,735]  bool_core (num_cores=1 [cover] a=4 d=1 fixed=27/141 clauses=423)
#Bound   0.06s best:736   next:[228,735]  bool_core (num_cores=1 [cover] a=4 d=1 fixed=28/144 clauses=452)
#Bound   0.06s best:736   next:[229,735]  bool_core (num_cores=1 [cover] a=4 d=1 fixed=29/147 clauses=482)
#Bound   0.06s best:736   next:[230,735]  bool_core (num_cores=1 [cover] a=4 d=1 fixed=30/150 clauses=513)
#Bound   0.06s best:736   next:[243,735]  default_lp
#2       0.07s best:726   next:[243,725]  no_lp (fixed_bools=0/68)
#3       0.07s best:725   next:[243,724]  violation_ls(batch:1 #solutions_imported:1 #lin_moves:0 #lin_evals:153 #gen_moves:95 #gen_evals:12 #comp_moves:19 #backtracks:38 #weight_updates:0)
#4       0.07s best:721   next:[243,720]  quick_restart_no_lp (fixed_bools=0/82)
#5       0.07s best:715   next:[243,714]  quick_restart_no_lp (fixed_bools=0/88)
#6       0.07s best:457   next:[243,456]  objective_lb_search_no_lp (fixed_bools=4/72)
#Bound   0.07s best:457   next:[293,456]  objective_lb_search_no_lp
#7       0.07s best:456   next:[293,455]  quick_restart_no_lp (fixed_bools=0/105)
#8       0.07s best:455   next:[293,454]  violation_ls(batch:2 #solutions_imported:2 #lin_moves:136 #lin_evals:489 #weight_updates:72)
#9       0.07s best:454   next:[293,453]  violation_ls(batch:2 #solutions_imported:2 #lin_moves:0 #lin_evals:361 #gen_moves:241 #gen_evals:35 #comp_moves:21 #backtracks:110 #weight_updates:2)
#10      0.07s best:453   next:[293,452]  violation_ls(batch:2 #solutions_imported:2 #lin_moves:0 #lin_evals:53 #gen_moves:40 #gen_evals:4 #comp_moves:6 #backtracks:17 #weight_updates:0)
#11      0.07s best:452   next:[293,451]  violation_ls(batch:2 #solutions_imported:2 #lin_moves:0 #lin_evals:163 #gen_moves:101 #gen_evals:12 #comp_moves:25 #backtracks:38 #weight_updates:0)
#Bound   0.07s best:452   next:[297,451]  objective_lb_search_no_lp
#12      0.07s best:451   next:[297,450]  violation_ls(batch:2 #solutions_imported:2 #lin_moves:1 #lin_evals:961 #gen_moves:664 #gen_evals:92 #comp_moves:20 #backtracks:322 #weight_updates:6)
#13      0.07s best:449   next:[297,448]  graph_arc_lns (d=0.71 s=55 t=0.10 p=1.00 stall=1 h=auto_l0) [presolve]
#14      0.07s best:442   next:[297,441]  no_lp (fixed_bools=1/80)
#15      0.08s best:437   next:[297,436]  quick_restart_no_lp (fixed_bools=1/123)
#Model   0.08s var:86/87 constraints:393/486
#16      0.08s best:435   next:[297,434]  violation_ls(batch:3 #solutions_imported:3 #lin_moves:1 #lin_evals:963 #gen_moves:665 #gen_evals:92 #comp_moves:21 #backtracks:322 #weight_updates:6)
#17      0.08s best:433   next:[297,432]  violation_ls(batch:3 #solutions_imported:3 #lin_moves:136 #lin_evals:493 #gen_moves:1 #gen_evals:0 #comp_moves:1 #backtracks:0 #weight_updates:72)
#18      0.08s best:432   next:[297,431]  violation_ls(batch:3 #solutions_imported:3 #lin_moves:1 #lin_evals:366 #gen_moves:241 #gen_evals:35 #comp_moves:21 #backtracks:110 #weight_updates:2)
#19      0.08s best:431   next:[297,430]  violation_ls(batch:3 #solutions_imported:3 #lin_moves:0 #lin_evals:98 #gen_moves:72 #gen_evals:6 #comp_moves:8 #backtracks:32 #weight_updates:0)
#20      0.08s best:430   next:[297,429]  violation_ls(batch:3 #solutions_imported:3 #lin_moves:1 #lin_evals:168 #gen_moves:101 #gen_evals:12 #comp_moves:25 #backtracks:38 #weight_updates:0)
#21      0.08s best:427   next:[297,426]  rnd_var_lns (d=0.81 s=68 t=0.10 p=1.00 stall=0 h=auto_l0) [presolve]
#Bound   0.08s best:427   next:[310,426]  objective_lb_search_no_lp
#22      0.09s best:422   next:[310,421]  default_lp (fixed_bools=1/73)
#Bound   0.10s best:422   next:[321,421]  objective_lb_search_no_lp
#Bound   0.11s best:422   next:[333,421]  objective_lb_search_no_lp
#Bound   0.12s best:422   next:[336,421]  objective_lb_search_no_lp
#Bound   0.13s best:422   next:[340,421]  objective_lb_search_no_lp
#Model   0.13s var:85/87 constraints:386/486
#Bound   0.14s best:422   next:[350,421]  objective_lb_search_no_lp
#Bound   0.15s best:422   next:[365,421]  objective_lb_search_no_lp
#Bound   0.16s best:422   next:[367,421]  objective_lb_search_no_lp
#Bound   0.17s best:422   next:[368,421]  objective_lb_search_no_lp
#Model   0.17s var:82/87 constraints:341/486
#Done    0.18s quick_restart_no_lp
#Model   0.18s var:67/87 constraints:140/486

Task timing                                  n [     min,      max]      avg      dev     time         n [     min,      max]      avg      dev    dtime
                             'core':         1 [123.34ms, 123.34ms] 123.34ms   0.00ns 123.34ms         1 [ 31.54ms,  31.54ms]  31.54ms   0.00ns  31.54ms
                       'default_lp':         1 [123.27ms, 123.27ms] 123.27ms   0.00ns 123.27ms         1 [ 10.59ms,  10.59ms]  10.59ms   0.00ns  10.59ms
                 'feasibility_pump':         6 [  5.66ms,  17.03ms]  13.71ms   3.74ms  82.27ms         5 [  1.76ms,   2.17ms]   1.90ms 162.28us   9.48ms
                  'fj_long_default':         0 [  0.00ns,   0.00ns]   0.00ns   0.00ns   0.00ns         0 [  0.00ns,   0.00ns]   0.00ns   0.00ns   0.00ns
                  'fj_long_default':         0 [  0.00ns,   0.00ns]   0.00ns   0.00ns   0.00ns         0 [  0.00ns,   0.00ns]   0.00ns   0.00ns   0.00ns
              'fj_long_lin_default':         0 [  0.00ns,   0.00ns]   0.00ns   0.00ns   0.00ns         0 [  0.00ns,   0.00ns]   0.00ns   0.00ns   0.00ns
              'fj_long_lin_perturb':         0 [  0.00ns,   0.00ns]   0.00ns   0.00ns   0.00ns         0 [  0.00ns,   0.00ns]   0.00ns   0.00ns   0.00ns
               'fj_long_lin_random':         0 [  0.00ns,   0.00ns]   0.00ns   0.00ns   0.00ns         0 [  0.00ns,   0.00ns]   0.00ns   0.00ns   0.00ns
                  'fj_long_perturb':         0 [  0.00ns,   0.00ns]   0.00ns   0.00ns   0.00ns         0 [  0.00ns,   0.00ns]   0.00ns   0.00ns   0.00ns
                   'fj_long_random':         0 [  0.00ns,   0.00ns]   0.00ns   0.00ns   0.00ns         0 [  0.00ns,   0.00ns]   0.00ns   0.00ns   0.00ns
                 'fj_short_default':         0 [  0.00ns,   0.00ns]   0.00ns   0.00ns   0.00ns         0 [  0.00ns,   0.00ns]   0.00ns   0.00ns   0.00ns
                 'fj_short_default':         1 [ 37.21ms,  37.21ms]  37.21ms   0.00ns  37.21ms         1 [ 18.60ms,  18.60ms]  18.60ms   0.00ns  18.60ms
             'fj_short_lin_default':         0 [  0.00ns,   0.00ns]   0.00ns   0.00ns   0.00ns         0 [  0.00ns,   0.00ns]   0.00ns   0.00ns   0.00ns
             'fj_short_lin_default':         0 [  0.00ns,   0.00ns]   0.00ns   0.00ns   0.00ns         0 [  0.00ns,   0.00ns]   0.00ns   0.00ns   0.00ns
             'fj_short_lin_perturb':         0 [  0.00ns,   0.00ns]   0.00ns   0.00ns   0.00ns         0 [  0.00ns,   0.00ns]   0.00ns   0.00ns   0.00ns
              'fj_short_lin_random':         0 [  0.00ns,   0.00ns]   0.00ns   0.00ns   0.00ns         0 [  0.00ns,   0.00ns]   0.00ns   0.00ns   0.00ns
                 'fj_short_perturb':         0 [  0.00ns,   0.00ns]   0.00ns   0.00ns   0.00ns         0 [  0.00ns,   0.00ns]   0.00ns   0.00ns   0.00ns
                  'fj_short_random':         0 [  0.00ns,   0.00ns]   0.00ns   0.00ns   0.00ns         0 [  0.00ns,   0.00ns]   0.00ns   0.00ns   0.00ns
                        'fs_random':         1 [  6.16ms,   6.16ms]   6.16ms   0.00ns   6.16ms         0 [  0.00ns,   0.00ns]   0.00ns   0.00ns   0.00ns
                        'fs_random':         1 [  6.67ms,   6.67ms]   6.67ms   0.00ns   6.67ms         1 [ 20.00ns,  20.00ns]  20.00ns   0.00ns  20.00ns
                        'fs_random':         1 [  7.02ms,   7.02ms]   7.02ms   0.00ns   7.02ms         0 [  0.00ns,   0.00ns]   0.00ns   0.00ns   0.00ns
                        'fs_random':         1 [  7.87ms,   7.87ms]   7.87ms   0.00ns   7.87ms         0 [  0.00ns,   0.00ns]   0.00ns   0.00ns   0.00ns
                  'fs_random_no_lp':         1 [  5.64ms,   5.64ms]   5.64ms   0.00ns   5.64ms         0 [  0.00ns,   0.00ns]   0.00ns   0.00ns   0.00ns
                  'fs_random_no_lp':         1 [  6.05ms,   6.05ms]   6.05ms   0.00ns   6.05ms         0 [  0.00ns,   0.00ns]   0.00ns   0.00ns   0.00ns
                  'fs_random_no_lp':         1 [  6.27ms,   6.27ms]   6.27ms   0.00ns   6.27ms         0 [  0.00ns,   0.00ns]   0.00ns   0.00ns   0.00ns
                  'fs_random_no_lp':         1 [  6.60ms,   6.60ms]   6.60ms   0.00ns   6.60ms         0 [  0.00ns,   0.00ns]   0.00ns   0.00ns   0.00ns
          'fs_random_quick_restart':         1 [  6.61ms,   6.61ms]   6.61ms   0.00ns   6.61ms         1 [ 20.00ns,  20.00ns]  20.00ns   0.00ns  20.00ns
          'fs_random_quick_restart':         1 [  6.82ms,   6.82ms]   6.82ms   0.00ns   6.82ms         0 [  0.00ns,   0.00ns]   0.00ns   0.00ns   0.00ns
          'fs_random_quick_restart':         1 [  6.89ms,   6.89ms]   6.89ms   0.00ns   6.89ms         1 [ 20.00ns,  20.00ns]  20.00ns   0.00ns  20.00ns
          'fs_random_quick_restart':         1 [  7.19ms,   7.19ms]   7.19ms   0.00ns   7.19ms         0 [  0.00ns,   0.00ns]   0.00ns   0.00ns   0.00ns
    'fs_random_quick_restart_no_lp':         1 [  5.69ms,   5.69ms]   5.69ms   0.00ns   5.69ms         0 [  0.00ns,   0.00ns]   0.00ns   0.00ns   0.00ns
    'fs_random_quick_restart_no_lp':         1 [  5.75ms,   5.75ms]   5.75ms   0.00ns   5.75ms         0 [  0.00ns,   0.00ns]   0.00ns   0.00ns   0.00ns
    'fs_random_quick_restart_no_lp':         1 [  5.91ms,   5.91ms]   5.91ms   0.00ns   5.91ms         0 [  0.00ns,   0.00ns]   0.00ns   0.00ns   0.00ns
                    'graph_arc_lns':         8 [  1.90ms,  33.76ms]  15.74ms  10.14ms 125.95ms         7 [ 10.00ns,   1.95ms] 660.82us 639.79us   4.63ms
                    'graph_cst_lns':         7 [490.23us, 627.78us] 540.24us  48.76us   3.78ms         0 [  0.00ns,   0.00ns]   0.00ns   0.00ns   0.00ns
                    'graph_dec_lns':         7 [  1.51ms,  35.43ms]  12.17ms  10.24ms  85.16ms         7 [ 10.00ns,   2.27ms] 470.52us 750.10us   3.29ms
                    'graph_var_lns':         8 [  1.62ms,  36.78ms]  11.76ms  10.70ms  94.05ms         7 [ 10.00ns,   2.36ms] 495.05us 784.25us   3.47ms
                   'lb_tree_search':         1 [122.13ms, 122.13ms] 122.13ms   0.00ns 122.13ms         1 [  8.48ms,   8.48ms]   8.48ms   0.00ns   8.48ms
                           'max_lp':         1 [123.79ms, 123.79ms] 123.79ms   0.00ns 123.79ms         1 [  7.88ms,   7.88ms]   7.88ms   0.00ns   7.88ms
                            'no_lp':         1 [122.82ms, 122.82ms] 122.82ms   0.00ns 122.82ms         1 [ 15.37ms,  15.37ms]  15.37ms   0.00ns  15.37ms
              'objective_lb_search':         1 [122.26ms, 122.26ms] 122.26ms   0.00ns 122.26ms         1 [ 11.74ms,  11.74ms]  11.74ms   0.00ns  11.74ms
       'objective_lb_search_max_lp':         1 [121.26ms, 121.26ms] 121.26ms   0.00ns 121.26ms         1 [ 15.41ms,  15.41ms]  15.41ms   0.00ns  15.41ms
        'objective_lb_search_no_lp':         1 [121.34ms, 121.34ms] 121.34ms   0.00ns 121.34ms         1 [ 14.36ms,  14.36ms]  14.36ms   0.00ns  14.36ms
  'objective_shaving_search_max_lp':         8 [  1.25ms,  12.96ms]   7.68ms   3.74ms  61.45ms         3 [139.79us, 165.75us] 149.84us  11.38us 449.51us
   'objective_shaving_search_no_lp':         8 [  1.37ms,  19.40ms]   8.73ms   5.06ms  69.85ms         3 [139.85us, 287.94us] 197.85us  64.58us 593.54us
                          'probing':         1 [122.85ms, 122.85ms] 122.85ms   0.00ns 122.85ms         1 [  3.35ms,   3.35ms]   3.35ms   0.00ns   3.35ms
                   'probing_max_lp':         1 [121.93ms, 121.93ms] 121.93ms   0.00ns 121.93ms         1 [  9.29ms,   9.29ms]   9.29ms   0.00ns   9.29ms
                     'pseudo_costs':         1 [122.68ms, 122.68ms] 122.68ms   0.00ns 122.68ms         1 [ 13.48ms,  13.48ms]  13.48ms   0.00ns  13.48ms
                    'quick_restart':         1 [122.58ms, 122.58ms] 122.58ms   0.00ns 122.58ms         1 [ 12.18ms,  12.18ms]  12.18ms   0.00ns  12.18ms
              'quick_restart_no_lp':         1 [122.00ms, 122.00ms] 122.00ms   0.00ns 122.00ms         1 [ 15.88ms,  15.88ms]  15.88ms   0.00ns  15.88ms
                    'reduced_costs':         1 [123.00ms, 123.00ms] 123.00ms   0.00ns 123.00ms         1 [  6.72ms,   6.72ms]   6.72ms   0.00ns   6.72ms
                        'rins/rens':         8 [181.27us,  44.98ms]  15.61ms  13.10ms 124.91ms         5 [ 10.00ns,   4.51ms]   2.02ms   1.63ms  10.11ms
                      'rnd_cst_lns':         8 [  2.76ms,  26.84ms]  15.25ms   9.17ms 122.03ms         7 [ 13.62us,   1.64ms] 553.12us 624.42us   3.87ms
                      'rnd_var_lns':         8 [  2.30ms,  16.91ms]   9.32ms   5.64ms  74.55ms         6 [ 10.00ns, 543.06us] 179.32us 233.66us   1.08ms
                     'violation_ls':         4 [121.37us,  77.74ms]  19.80ms  33.46ms  79.19ms         4 [480.00ns,  33.48ms]   8.44ms  14.45ms  33.77ms
                     'violation_ls':         4 [134.42us,  87.26ms]  22.29ms  37.51ms  89.17ms         4 [780.00ns,  39.91ms]  10.09ms  17.21ms  40.37ms
                     'violation_ls':         4 [144.34us,  77.89ms]  20.17ms  33.34ms  80.69ms         4 [600.00ns,  32.48ms]   8.30ms  13.97ms  33.19ms
                     'violation_ls':         5 [140.49us,  87.98ms]  19.36ms  34.37ms  96.81ms         5 [480.00ns,  42.68ms]   9.19ms  16.76ms  45.96ms
                     'violation_ls':         5 [158.15us,  51.86ms]  15.64ms  20.13ms  78.18ms         5 [390.00ns,  31.30ms]   7.98ms  12.10ms  39.89ms

Search stats                        Bools  Conflicts  Branches  Restarts  BoolPropag  IntegerPropag
                           'core':    275        230     3'446     1'492     110'381         73'729
                     'default_lp':    133        249       823       266       7'396         38'479
                      'fs_random':     52          0         0         0           0              0
                      'fs_random':     52          0         0         0           0              0
                      'fs_random':     52          0         0         0           0              0
                      'fs_random':     52          0        72        72          24            451
                'fs_random_no_lp':     52          0         0         0           0              0
                'fs_random_no_lp':     52          0         0         0           0              0
                'fs_random_no_lp':     52          0         0         0           0              0
                'fs_random_no_lp':     52          0        50        50          22            301
        'fs_random_quick_restart':     52          0         0         0           0              0
        'fs_random_quick_restart':     52          0         0         0           0              0
        'fs_random_quick_restart':     52          0         0         0           0              0
        'fs_random_quick_restart':     52          0         8         8          12             28
  'fs_random_quick_restart_no_lp':     52          0         0         0           0              0
  'fs_random_quick_restart_no_lp':     52          0         0         0           0              0
  'fs_random_quick_restart_no_lp':     52          0         2         2           4             10
                 'lb_tree_search':     52          0       104       104          50            664
                         'max_lp':     52          0       104       104          70            746
                          'no_lp':    115        479     1'870       516      15'520         83'091
            'objective_lb_search':     62        182       888       305       4'147         36'376
     'objective_lb_search_max_lp':     63         21       148       104         544          3'974
      'objective_lb_search_no_lp':     88        524     1'636       520       9'741         77'427
                        'probing':     94         19       169       169         498          2'360
                 'probing_max_lp':     54          0       108       108          49            631
                   'pseudo_costs':     61         45       184       104         450          5'781
                  'quick_restart':     75        127     1'196       417       4'386         33'534
            'quick_restart_no_lp':    146        601     2'492       510      20'089         76'000
                  'reduced_costs':     54          2       106       105         130          1'040

SAT stats                           ClassicMinim  LitRemoved  LitLearned  LitForgotten  Subsumed  MClauses  MDecisions  MLitTrue  MSubsumed  MLitRemoved  MReused
                           'core':            49          75         353             0         2       829       2'145       509         74        1'774        6
                     'default_lp':           196         782       1'427             0         5        40         186         0         18           96        2
                      'fs_random':             0           0           0             0         0         0           0         0          0            0        0
                      'fs_random':             0           0           0             0         0         0           0         0          0            0        0
                      'fs_random':             0           0           0             0         0         0           0         0          0            0        0
                      'fs_random':             0           0           0             0         0         0           0         0          0            0        0
                'fs_random_no_lp':             0           0           0             0         0         0           0         0          0            0        0
                'fs_random_no_lp':             0           0           0             0         0         0           0         0          0            0        0
                'fs_random_no_lp':             0           0           0             0         0         0           0         0          0            0        0
                'fs_random_no_lp':             0           0           0             0         0         0           0         0          0            0        0
        'fs_random_quick_restart':             0           0           0             0         0         0           0         0          0            0        0
        'fs_random_quick_restart':             0           0           0             0         0         0           0         0          0            0        0
        'fs_random_quick_restart':             0           0           0             0         0         0           0         0          0            0        0
        'fs_random_quick_restart':             0           0           0             0         0         0           0         0          0            0        0
  'fs_random_quick_restart_no_lp':             0           0           0             0         0         0           0         0          0            0        0
  'fs_random_quick_restart_no_lp':             0           0           0             0         0         0           0         0          0            0        0
  'fs_random_quick_restart_no_lp':             0           0           0             0         0         0           0         0          0            0        0
                 'lb_tree_search':             0           0           0             0         0         0           0         0          0            0        0
                         'max_lp':             0           0           0             0         0         0           0         0          0            0        0
                          'no_lp':           318         830       2'857             0        25        78         434         0         10           51       11
            'objective_lb_search':           126         302       1'053             0        11        89         493         0         42          249       11
     'objective_lb_search_max_lp':            13          35         117             0         1         0           0         0          0            0        0
      'objective_lb_search_no_lp':           390       1'245       2'672             0        24       102         490         5         29          155       10
                        'probing':             0           0          19             0         0         0           0         0          0            0        0
                 'probing_max_lp':             0           0           0             0         0         0           0         0          0            0        0
                   'pseudo_costs':            28          53         321             0         1         0           0         0          0            0        0
                  'quick_restart':            83         168         717             0         7       105         595         0         22          112       20
            'quick_restart_no_lp':           418       1'508       4'806             0        20        77         405         0         13           62       10
                  'reduced_costs':             0           0           3             0         0         0           0         0          0            0        0

Lp stats                         Component  Iterations  AddedCuts  OPTIMAL  DUAL_F.  DUAL_U.
                  'default_lp':          1         485        299      284        0        0
                   'fs_random':          1           0          0        0        0        0
                   'fs_random':          1           0          0        0        0        0
                   'fs_random':          1           0          0        0        0        0
                   'fs_random':          1           0          0        0        0        0
     'fs_random_quick_restart':          1           0          0        0        0        0
     'fs_random_quick_restart':          1           0          0        0        0        0
     'fs_random_quick_restart':          1           0          0        0        0        0
     'fs_random_quick_restart':          1           0          0        0        0        0
              'lb_tree_search':          1         227        708        9        0        0
                      'max_lp':          1         243        737        9        0        0
         'objective_lb_search':          1         522        314      158        0        0
  'objective_lb_search_max_lp':          1         664        615       54       11        0
                     'probing':          1         160        276      200        0        0
              'probing_max_lp':          1         262        709        9        0        0
                'pseudo_costs':          1         559        577       86        6        0
               'quick_restart':          1         628        294      214        1        0
               'reduced_costs':          1         365        750       24        1        0

Lp dimension                                                                    Final dimension of first component
                  'default_lp':   114 rows, 80 columns, 436 entries with magnitude in [4.263754e-04, 1.000000e+00]
                   'fs_random':       0 rows, 80 columns, 0 entries with magnitude in [0.000000e+00, 0.000000e+00]
                   'fs_random':       0 rows, 80 columns, 0 entries with magnitude in [0.000000e+00, 0.000000e+00]
                   'fs_random':       0 rows, 80 columns, 0 entries with magnitude in [0.000000e+00, 0.000000e+00]
                   'fs_random':       0 rows, 80 columns, 0 entries with magnitude in [0.000000e+00, 0.000000e+00]
     'fs_random_quick_restart':       0 rows, 80 columns, 0 entries with magnitude in [0.000000e+00, 0.000000e+00]
     'fs_random_quick_restart':       0 rows, 80 columns, 0 entries with magnitude in [0.000000e+00, 0.000000e+00]
     'fs_random_quick_restart':       0 rows, 80 columns, 0 entries with magnitude in [0.000000e+00, 0.000000e+00]
     'fs_random_quick_restart':       0 rows, 80 columns, 0 entries with magnitude in [0.000000e+00, 0.000000e+00]
              'lb_tree_search':  730 rows, 87 columns, 3681 entries with magnitude in [3.604222e-04, 1.000000e+00]
                      'max_lp':  685 rows, 87 columns, 3715 entries with magnitude in [3.868827e-04, 1.000000e+00]
         'objective_lb_search':   120 rows, 80 columns, 591 entries with magnitude in [2.121466e-03, 1.000000e+00]
  'objective_lb_search_max_lp':  418 rows, 87 columns, 1952 entries with magnitude in [1.361492e-03, 1.000000e+00]
                     'probing':    50 rows, 80 columns, 191 entries with magnitude in [9.478779e-04, 1.000000e+00]
              'probing_max_lp':  686 rows, 87 columns, 4170 entries with magnitude in [4.340448e-04, 1.000000e+00]
                'pseudo_costs':  408 rows, 87 columns, 2022 entries with magnitude in [8.748912e-04, 1.000000e+00]
               'quick_restart':    85 rows, 80 columns, 249 entries with magnitude in [2.421825e-02, 1.000000e+00]
               'reduced_costs':  426 rows, 87 columns, 2000 entries with magnitude in [8.441063e-04, 1.000000e+00]

Lp debug                         CutPropag  CutEqPropag  Adjust  Overflow  Bad  BadScaling
                  'default_lp':          0            0       8         0  237           0
                   'fs_random':          0            0       0         0    0           0
                   'fs_random':          0            0       0         0    0           0
                   'fs_random':          0            0       0         0    0           0
                   'fs_random':          0            0       0         0    0           0
     'fs_random_quick_restart':          0            0       0         0    0           0
     'fs_random_quick_restart':          0            0       0         0    0           0
     'fs_random_quick_restart':          0            0       0         0    0           0
     'fs_random_quick_restart':          0            0       0         0    0           0
              'lb_tree_search':          0            6       5         0  623           0
                      'max_lp':          4            0       8         0  671           0
         'objective_lb_search':          0            0      60         0  277           0
  'objective_lb_search_max_lp':          0            0      49         0  522           0
                     'probing':          0            0     166         0  276           0
              'probing_max_lp':          0            0       8         0  548           0
                'pseudo_costs':          0            0      44         0  474           0
               'quick_restart':         10            0      74         0  244           0
               'reduced_costs':          3            0      16         0  792           0

Lp pool                          Constraints  Updates  Simplif  Merged  Shortened  Split  Strenghtened  Cuts/Call
                  'default_lp':          380      230      453       5        135     19           492    299/652
                   'fs_random':           86        0        0       0          0      0             0        0/0
                   'fs_random':           86        0        0       0          0      0             0        0/0
                   'fs_random':           86        0        0       0          0      0             0        0/0
                   'fs_random':           86        0        0       0          0      0             0        0/0
     'fs_random_quick_restart':           86        0        0       0          0      0             0        0/0
     'fs_random_quick_restart':           86        0        0       0          0      0             0        0/0
     'fs_random_quick_restart':           86        0        0       0          0      0             0        0/0
     'fs_random_quick_restart':           86        0        0       0          0      0             0        0/0
              'lb_tree_search':        1'192       70      694       1        336      9         1'106  708/1'240
                      'max_lp':        1'221       82      417       1          0     14         1'178  737/1'275
         'objective_lb_search':          394      182      257       6         17     15           335    314/561
  'objective_lb_search_max_lp':        1'090      113    1'504      10         50      3         3'309    615/966
                     'probing':          360       99       59       2         18      2            78    276/466
              'probing_max_lp':        1'194        6        0       0          0      8           203  709/1'246
                'pseudo_costs':        1'053      119    1'493       9         50      1         3'277    577/925
               'quick_restart':          375      267      531       5        115     35           518    294/521
               'reduced_costs':        1'227      155    2'014       8         50     20         3'932  750/1'195

Lp Cut            defaul  max_lp  quick_  reduce  pseudo  lb_tre  probin  object  probin  object
          CG_FF:      27      95      27      33      27      80      31      30      89      22
           CG_K:       8      25      10      16      19      19       6      12      21      12
           CG_R:      12      70      14      27       8      59      14      21      64       7
          CG_RB:      54     144      54     147     116     150      61      59     150     125
         CG_RBP:       7      39       5      36       9      23       8       8      21      16
         Clique:       -       -       -       6       7       -       -       -       -       8
             IB:      79      58      76      90      97      59      69      77      55     103
       MIR_1_FF:      12      52      13      46      36      55      14      12      51      37
        MIR_1_K:       1       6       4       8       2       4       1       2       5       7
        MIR_1_R:       2       4       2       2       2       5       1       3       3       2
       MIR_1_RB:      17      38      16      66      53      37      15      15      34      59
      MIR_1_RBP:       -       8       3      12       8       7       2       1       9      12
      MIR_1_RLT:       -       -       -       3       5       1       -       -       1       3
       MIR_2_FF:       7      18      10      20      15      21       5      10      24      20
        MIR_2_K:       4       3       4       1       4       4       2       4       7       5
        MIR_2_R:       4       5       7       7       4       3       -       6       6       8
       MIR_2_RB:       9      12       7      25      18      22      12      10      17      18
      MIR_2_RBP:       3       2       2      11       8       6       3       2       3      12
       MIR_3_FF:       5      14       3      13       9      13       2       2      15       5
        MIR_3_K:       1       3       -       4       4       3       1       -       3       2
        MIR_3_R:       1      16       1      13      10       7       1       2       7       4
       MIR_3_RB:       4      18       2      17      14       6       3       3      12       8
      MIR_3_RBP:       -      10       1       7       3       1       1       -       3       3
       MIR_4_FF:       3      13       2       4       3       8       -       3      10       8
        MIR_4_K:       2       -       1       1       1       1       -       1       1       4
        MIR_4_R:       1       8       2       8       4       1       -       2       4       5
       MIR_4_RB:       4       6       2      11       5       3       1       3       4       5
      MIR_4_RBP:       1       4       2       1       -       1       -       1       3       2
       MIR_5_FF:       -       4       1       3       2       6       2       -       4       3
        MIR_5_K:       -       -       -       2       2       2       2       -       1       -
        MIR_5_R:       2       5       -       2       2       5       2       -       4       3
       MIR_5_RB:       1       3       -       6       3       3       2       -       5       3
      MIR_5_RBP:       -       -       -       -       2       -       2       -       1       -
       MIR_6_FF:       1       -       1       -       -       1       -       1       2       3
        MIR_6_K:       -       -       -       -       -       -       -       -       1       1
        MIR_6_R:       1       1       -       2       1       2       -       1       2       3
       MIR_6_RB:       -       1       -       -       2       -       -       1       1       2
      MIR_6_RBP:       -       1       -       -       -       -       -       -       1       2
   ZERO_HALF_FF:       6      12       6      17      14      21       3       7      14      15
    ZERO_HALF_K:       1       1       1       4       -       1       -       1       1       1
    ZERO_HALF_R:       7      18       7      42      30      33       5       7      26      28
   ZERO_HALF_RB:       9      14       6      28      22      25       4       5      15      25
  ZERO_HALF_RBP:       3       6       2       9       6      10       1       2       9       4

LNS stats           Improv/Calls  Closed  Difficulty  TimeLimit
  'graph_arc_lns':           2/7    100%        0.97       0.10
  'graph_cst_lns':           0/0      0%        0.50       0.10
  'graph_dec_lns':           0/7     86%        0.94       0.10
  'graph_var_lns':           1/7     86%        0.94       0.10
      'rins/rens':           2/6     83%        0.92       0.10
    'rnd_cst_lns':           1/7    100%        0.97       0.10
    'rnd_var_lns':           3/7    100%        0.97       0.10

LS stats                   Batches  Restarts  LinMoves  GenMoves  CompoundMoves  WeightUpdates
       'fj_long_default':        0         0         0         0              0              0
       'fj_long_default':        0         0         0         0              0              0
   'fj_long_lin_default':        0         0         0         0              0              0
   'fj_long_lin_perturb':        0         0         0         0              0              0
    'fj_long_lin_random':        0         0         0         0              0              0
       'fj_long_perturb':        0         0         0         0              0              0
        'fj_long_random':        0         0         0         0              0              0
      'fj_short_default':        0         0         0         0              0              0
      'fj_short_default':        1         1         0     2'977            231             12
  'fj_short_lin_default':        0         0         0         0              0              0
  'fj_short_lin_default':        0         0         0         0              0              0
  'fj_short_lin_perturb':        0         0         0         0              0              0
   'fj_short_lin_random':        0         0         0         0              0              0
      'fj_short_perturb':        0         0         0         0              0              0
       'fj_short_random':        0         0         0         0              0              0
          'violation_ls':        4         0         1     8'390            300             59
          'violation_ls':        4         0         1     8'819            331             57
          'violation_ls':        4         0     8'872         1              1          1'336
          'violation_ls':        5         0     7'151        72              8          6'927
          'violation_ls':        5         0     9'126       665             21          1'258

Solutions (22)                  Num     Rank
                 'default_lp':    1  [22,22]
              'graph_arc_lns':    1  [13,13]
                      'no_lp':    3   [1,14]
  'objective_lb_search_no_lp':    1    [6,6]
        'quick_restart_no_lp':    4   [4,15]
                'rnd_var_lns':    1  [21,21]
               'violation_ls':   11   [3,20]

Objective bounds                Num
                  'bool_core':    4
                 'default_lp':    1
             'initial_domain':    1
  'objective_lb_search_no_lp':   15

Solution repositories    Added  Queried  Ignored  Synchro
  'feasible solutions':     63      134        1       41
        'lp solutions':      0        0        0        0
                'pump':     80        8

Improving bounds shared         Num
                       'core':   13
                 'default_lp':   46
                      'no_lp':  153
        'objective_lb_search':   59
  'objective_lb_search_no_lp':  160
                    'probing':   44
              'quick_restart':   93
        'quick_restart_no_lp':  318
              'reduced_costs':   18

Clauses shared                  Num
                       'core':    1
                 'default_lp':   26
                      'no_lp':   34
        'objective_lb_search':    1
  'objective_lb_search_no_lp':   11
              'quick_restart':    8
        'quick_restart_no_lp':   10
              'reduced_costs':    2

CpSolverResponse summary:
status: OPTIMAL
objective: 422
best_bound: 422
integers: 85
booleans: 52
conflicts: 0
branches: 72
propagations: 24
integer_propagations: 451
restarts: 72
lp_iterations: 0
walltime: 0.1848
usertime: 0.1848
deterministic_time: 0.426423
gap_integral: 1.69398
solution_fingerprint: 0x49550adbcf9c9699


--- Simulation Gantt  partir du modle mathmatique ---
{'big':1, 'due_date':153, 'pos_time':5, 'status':0, 'blocked':2, 'operations':["{'type':1, 'processing_time':23}", "{'type':0, 'processing_time':47}"]}
{'big':0, 'due_date':156, 'pos_time':5, 'status':1, 'blocked':2, 'operations':["{'type':1, 'processing_time':55}", "{'type':0, 'processing_time':21}"]}
{'big':1, 'due_date':152, 'pos_time':5, 'status':3, 'blocked':0, 'operations':["{'type':0, 'processing_time':52}", "{'type':1, 'processing_time':52}"]}
{'big':0, 'due_date':135, 'pos_time':5, 'status':2, 'blocked':0, 'operations':["{'type':1, 'processing_time':19}", "{'type':0, 'processing_time':15}"]}
