created virtual environment CPython3.12.4.final.0-64 in 1070ms
  creator CPython3Posix(dest=/localscratch/aneumann.47038305.0/env, clear=False, no_vcs_ignore=False, global=False)
  seeder FromAppData(download=False, pip=bundle, via=copy, app_data_dir=/home/aneumann/.local/share/virtualenv)
    added seed packages: pip==24.2+computecanada
  activators BashActivator,CShellActivator,FishActivator,NushellActivator,PowerShellActivator,PythonActivator
Looking in links: /cvmfs/soft.computecanada.ca/custom/python/wheelhouse/gentoo2023/x86-64-v3, /cvmfs/soft.computecanada.ca/custom/python/wheelhouse/gentoo2023/generic, /cvmfs/soft.computecanada.ca/custom/python/wheelhouse/generic
Requirement already satisfied: pip in /localscratch/aneumann.47038305.0/env/lib/python3.12/site-packages (24.2+computecanada)
Processing /cvmfs/soft.computecanada.ca/custom/python/wheelhouse/generic/pip-25.0+computecanada-py3-none-any.whl
Installing collected packages: pip
  Attempting uninstall: pip
    Found existing installation: pip 24.2+computecanada
    Uninstalling pip-24.2+computecanada:
      Successfully uninstalled pip-24.2+computecanada
Successfully installed pip-25.0+computecanada
Looking in links: /cvmfs/soft.computecanada.ca/custom/python/wheelhouse/gentoo2023/x86-64-v3, /cvmfs/soft.computecanada.ca/custom/python/wheelhouse/gentoo2023/generic, /cvmfs/soft.computecanada.ca/custom/python/wheelhouse/generic
ERROR: protobuf-5.28.3-cp38-abi3-manylinux2014_x86_64.whl is not a supported wheel on this platform.
Looking in links: /cvmfs/soft.computecanada.ca/custom/python/wheelhouse/gentoo2023/x86-64-v3, /cvmfs/soft.computecanada.ca/custom/python/wheelhouse/gentoo2023/generic, /cvmfs/soft.computecanada.ca/custom/python/wheelhouse/generic
Processing /home/aneumann/projects/def-adhaj/aneumann/GNRS/wheels/immutabledict-4.2.0-py3-none-any.whl
Installing collected packages: immutabledict
Successfully installed immutabledict-4.2.0
Looking in links: /cvmfs/soft.computecanada.ca/custom/python/wheelhouse/gentoo2023/x86-64-v3, /cvmfs/soft.computecanada.ca/custom/python/wheelhouse/gentoo2023/generic, /cvmfs/soft.computecanada.ca/custom/python/wheelhouse/generic
Processing /cvmfs/soft.computecanada.ca/custom/python/wheelhouse/generic/ortools-9.10.4067+computecanada-cp312-cp312-linux_x86_64.whl (from -r /home/aneumann/projects/def-adhaj/aneumann/GNRS/requirements/or.txt (line 1))
Processing /cvmfs/soft.computecanada.ca/custom/python/wheelhouse/gentoo2023/x86-64-v3/matplotlib-3.10.0+computecanada-cp312-cp312-linux_x86_64.whl (from -r /home/aneumann/projects/def-adhaj/aneumann/GNRS/requirements/or.txt (line 2))
Processing /cvmfs/soft.computecanada.ca/custom/python/wheelhouse/gentoo2023/x86-64-v3/pandas-2.2.3+computecanada-cp312-cp312-linux_x86_64.whl (from -r /home/aneumann/projects/def-adhaj/aneumann/GNRS/requirements/or.txt (line 3))
Processing /cvmfs/soft.computecanada.ca/custom/python/wheelhouse/generic/absl_py-2.3.0+computecanada-py3-none-any.whl (from ortools<9.11,>=9.10->-r /home/aneumann/projects/def-adhaj/aneumann/GNRS/requirements/or.txt (line 1))
Processing /cvmfs/soft.computecanada.ca/custom/python/wheelhouse/gentoo2023/generic/numpy-2.2.2+computecanada-cp312-cp312-linux_x86_64.whl (from ortools<9.11,>=9.10->-r /home/aneumann/projects/def-adhaj/aneumann/GNRS/requirements/or.txt (line 1))
Processing /cvmfs/soft.computecanada.ca/custom/python/wheelhouse/gentoo2023/x86-64-v3/protobuf-6.31.1+computecanada-cp312-cp312-linux_x86_64.whl (from ortools<9.11,>=9.10->-r /home/aneumann/projects/def-adhaj/aneumann/GNRS/requirements/or.txt (line 1))
Requirement already satisfied: immutabledict>=3.0.0 in /localscratch/aneumann.47038305.0/env/lib/python3.12/site-packages (from ortools<9.11,>=9.10->-r /home/aneumann/projects/def-adhaj/aneumann/GNRS/requirements/or.txt (line 1)) (4.2.0)
Processing /cvmfs/soft.computecanada.ca/custom/python/wheelhouse/gentoo2023/generic/contourpy-1.3.1+computecanada-cp312-cp312-linux_x86_64.whl (from matplotlib->-r /home/aneumann/projects/def-adhaj/aneumann/GNRS/requirements/or.txt (line 2))
Processing /cvmfs/soft.computecanada.ca/custom/python/wheelhouse/generic/cycler-0.12.1+computecanada-py3-none-any.whl (from matplotlib->-r /home/aneumann/projects/def-adhaj/aneumann/GNRS/requirements/or.txt (line 2))
Processing /cvmfs/soft.computecanada.ca/custom/python/wheelhouse/generic/fonttools-4.59.0+computecanada-cp312-cp312-linux_x86_64.whl (from matplotlib->-r /home/aneumann/projects/def-adhaj/aneumann/GNRS/requirements/or.txt (line 2))
Processing /cvmfs/soft.computecanada.ca/custom/python/wheelhouse/gentoo2023/x86-64-v3/kiwisolver-1.4.8+computecanada-cp312-cp312-linux_x86_64.whl (from matplotlib->-r /home/aneumann/projects/def-adhaj/aneumann/GNRS/requirements/or.txt (line 2))
Processing /cvmfs/soft.computecanada.ca/custom/python/wheelhouse/generic/packaging-25.0+computecanada-py3-none-any.whl (from matplotlib->-r /home/aneumann/projects/def-adhaj/aneumann/GNRS/requirements/or.txt (line 2))
Processing /cvmfs/soft.computecanada.ca/custom/python/wheelhouse/gentoo2023/x86-64-v3/pillow-11.1.0+computecanada-cp312-cp312-linux_x86_64.whl (from matplotlib->-r /home/aneumann/projects/def-adhaj/aneumann/GNRS/requirements/or.txt (line 2))
Processing /cvmfs/soft.computecanada.ca/custom/python/wheelhouse/generic/pyparsing-3.2.3+computecanada-py3-none-any.whl (from matplotlib->-r /home/aneumann/projects/def-adhaj/aneumann/GNRS/requirements/or.txt (line 2))
Processing /cvmfs/soft.computecanada.ca/custom/python/wheelhouse/generic/python_dateutil-2.9.0.post0+computecanada-py2.py3-none-any.whl (from matplotlib->-r /home/aneumann/projects/def-adhaj/aneumann/GNRS/requirements/or.txt (line 2))
Processing /cvmfs/soft.computecanada.ca/custom/python/wheelhouse/generic/pytz-2025.2+computecanada-py2.py3-none-any.whl (from pandas->-r /home/aneumann/projects/def-adhaj/aneumann/GNRS/requirements/or.txt (line 3))
Processing /cvmfs/soft.computecanada.ca/custom/python/wheelhouse/generic/tzdata-2025.2+computecanada-py2.py3-none-any.whl (from pandas->-r /home/aneumann/projects/def-adhaj/aneumann/GNRS/requirements/or.txt (line 3))
Processing /cvmfs/soft.computecanada.ca/custom/python/wheelhouse/generic/six-1.17.0+computecanada-py2.py3-none-any.whl (from python-dateutil>=2.7->matplotlib->-r /home/aneumann/projects/def-adhaj/aneumann/GNRS/requirements/or.txt (line 2))
Installing collected packages: pytz, tzdata, six, pyparsing, protobuf, pillow, packaging, numpy, kiwisolver, fonttools, cycler, absl-py, python-dateutil, contourpy, pandas, matplotlib, ortools
Successfully installed absl-py-2.3.0+computecanada contourpy-1.3.1+computecanada cycler-0.12.1+computecanada fonttools-4.59.0+computecanada kiwisolver-1.4.8+computecanada matplotlib-3.10.0+computecanada numpy-2.2.2+computecanada ortools-9.10.4067+computecanada packaging-25.0+computecanada pandas-2.2.3+computecanada pillow-11.1.0+computecanada protobuf-6.31.1+computecanada pyparsing-3.2.3+computecanada python-dateutil-2.9.0.post0+computecanada pytz-2025.2+computecanada six-1.17.0+computecanada tzdata-2025.2+computecanada

Starting CP-SAT solver v9.10.4067
Parameters: max_time_in_seconds: 86400 max_memory_in_mb: 185000 log_search_progress: true enumerate_all_solutions: false num_search_workers: 32 absolute_gap_limit: 0 relative_gap_limit: 0

Initial optimization model '': (model_fingerprint: 0x2556416676b8911e)
#Variables: 1'218 (#ints: 20 in objective)
  - 1'010 Booleans in [0,1]
  - 208 in [0,1492]
#kLinear1: 103
#kLinear2: 2'632
#kLinear3: 1'101
#kLinearN: 61'457 (#terms: 1'967'380)

Starting presolve at 0.04s
  9.07e-02s  0.00e+00d  [DetectDominanceRelations] 
  1.44e+00s  0.00e+00d  [PresolveToFixPoint] #num_loops=8 #num_dual_strengthening=3 
  8.04e-04s  0.00e+00d  [ExtractEncodingFromLinear] #potential_supersets=13 
[Symmetry] Graph for symmetry has 64'852 nodes and 1'770'919 arcs.
[Symmetry] Symmetry computation done. time: 0.0666999 dtime: 0.130599
[Symmetry] #generators: 1, average support size: 64
[Symmetry] The model contains 1272 duplicate constraints !
[Symmetry] 32 orbits with sizes: 2,2,2,2,2,2,2,2,2,2,...
[Symmetry] Num fixable by intersecting at_most_one with orbits: 1 largest_orbit: 2
  7.40e-01s  1.81e-01d  [Probe] #probed=1'728 #new_bounds=13 #equiv=1 
  6.10e-04s  0.00e+00d  [MaxClique] Merged 19(38 literals) into 12(24 literals) at_most_ones. 
  9.11e-02s  0.00e+00d  [DetectDominanceRelations] 
  6.77e-01s  0.00e+00d  [PresolveToFixPoint] #num_loops=5 #num_dual_strengthening=3 
  3.64e-01s  0.00e+00d  [ProcessAtMostOneAndLinear] 
  8.34e-02s  0.00e+00d  [DetectDuplicateConstraints] #duplicates=1'681 #without_enforcements=182 
  2.42e-01s  1.97e-02d  [DetectDominatedLinearConstraints] #relevant_constraints=58'816 #num_inclusions=31'674 
  8.64e-03s  0.00e+00d  [DetectDifferentVariables] #different=122 #cliques=1 #size=14 
  3.54e-02s  3.19e-03d  [ProcessSetPPC] #relevant_constraints=57'524 
  1.05e-03s  0.00e+00d  [FindAlmostIdenticalLinearConstraints] 
  1.10e-02s  1.55e-02d  [FindBigAtMostOneAndLinearOverlap] 
  6.92e-01s  3.69e-01d  [FindBigVerticalLinearOverlap] #blocks=640 #saved_nz=402'724 
  1.59e-02s  6.46e-03d  [FindBigHorizontalLinearOverlap] #linears=56'006 
  6.28e-04s  0.00e+00d  [MergeClauses] 
  9.46e-02s  0.00e+00d  [DetectDominanceRelations] 
  7.78e-01s  0.00e+00d  [PresolveToFixPoint] #num_loops=3 #num_dual_strengthening=1 
  9.57e-02s  0.00e+00d  [DetectDominanceRelations] 
  4.71e-01s  0.00e+00d  [PresolveToFixPoint] #num_loops=1 #num_dual_strengthening=1 
[Symmetry] Graph for symmetry has 65'110 nodes and 1'362'781 arcs.
[Symmetry] Symmetry computation done. time: 0.0351169 dtime: 0.0693326
  6.45e-01s  1.43e-01d  [Probe] #probed=1'732 #new_bounds=463 
  5.31e-04s  0.00e+00d  [MaxClique] 
  9.48e-02s  0.00e+00d  [DetectDominanceRelations] 
  7.26e-01s  0.00e+00d  [PresolveToFixPoint] #num_loops=2 #num_dual_strengthening=1 
  3.43e-01s  0.00e+00d  [ProcessAtMostOneAndLinear] 
  7.44e-02s  0.00e+00d  [DetectDuplicateConstraints] #without_enforcements=182 
  1.66e-01s  1.39e-02d  [DetectDominatedLinearConstraints] #relevant_constraints=58'830 #num_inclusions=4'884 
  7.91e-03s  0.00e+00d  [DetectDifferentVariables] 
  2.99e-02s  2.36e-03d  [ProcessSetPPC] #relevant_constraints=56'039 
  1.04e-03s  5.53e-06d  [FindAlmostIdenticalLinearConstraints] #num_tested_pairs=345 
  5.90e-03s  6.15e-03d  [FindBigAtMostOneAndLinearOverlap] 
  6.04e-01s  2.52e-01d  [FindBigVerticalLinearOverlap] #blocks=3'422 #saved_nz=422'056 
  1.32e-02s  4.10e-03d  [FindBigHorizontalLinearOverlap] #linears=45'701 
  6.45e-04s  0.00e+00d  [MergeClauses] 
  6.86e-02s  0.00e+00d  [DetectDominanceRelations] 
  7.54e-01s  0.00e+00d  [PresolveToFixPoint] #num_loops=3 #num_dual_strengthening=1 
  6.83e-02s  0.00e+00d  [DetectDominanceRelations] 
  4.80e-01s  0.00e+00d  [PresolveToFixPoint] #num_loops=1 #num_dual_strengthening=1 
[Symmetry] Graph for symmetry has 74'217 nodes and 943'276 arcs.
[Symmetry] Symmetry computation done. time: 0.0251036 dtime: 0.0479944
  5.71e-01s  1.11e-01d  [Probe] #probed=1'732 #new_bounds=2'234 #new_binary_clauses=53 
  6.08e-04s  0.00e+00d  [MaxClique] 
  6.89e-02s  0.00e+00d  [DetectDominanceRelations] 
  7.39e-01s  0.00e+00d  [PresolveToFixPoint] #num_loops=2 #num_dual_strengthening=1 
  3.23e-01s  0.00e+00d  [ProcessAtMostOneAndLinear] 
  6.80e-02s  0.00e+00d  [DetectDuplicateConstraints] #without_enforcements=182 
  1.13e-01s  8.91e-03d  [DetectDominatedLinearConstraints] #relevant_constraints=61'022 #num_inclusions=416 
  8.16e-03s  0.00e+00d  [DetectDifferentVariables] 
  2.31e-02s  1.46e-03d  [ProcessSetPPC] #relevant_constraints=45'865 
  2.06e-03s  2.41e-04d  [FindAlmostIdenticalLinearConstraints] #num_tested_pairs=14'460 
  5.08e-03s  3.85e-03d  [FindBigAtMostOneAndLinearOverlap] 
  3.30e-01s  1.30e-01d  [FindBigVerticalLinearOverlap] #blocks=2'702 #saved_nz=260'137 
  9.90e-03s  2.55e-03d  [FindBigHorizontalLinearOverlap] #linears=33'169 
  6.69e-04s  0.00e+00d  [MergeClauses] 
  5.34e-02s  0.00e+00d  [DetectDominanceRelations] 
  7.26e-01s  0.00e+00d  [PresolveToFixPoint] #num_loops=3 #num_dual_strengthening=1 
  4.41e-03s  0.00e+00d  [ExpandObjective] #entries=28'608 #tight_variables=10'615 #tight_constraints=5'598 

Presolve summary:
  - 405 affine relations were detected.
  - rule 'TODO dual: only one blocking constraint?' was applied 3'093 times.
  - rule 'TODO dual: only one blocking enforced constraint?' was applied 234 times.
  - rule 'TODO dual: only one unspecified blocking constraint?' was applied 140 times.
  - rule 'TODO duplicate: identical constraint with different enforcements' was applied 546 times.
  - rule 'TODO linear2: contains a Boolean.' was applied 24 times.
  - rule 'affine: new relation' was applied 405 times.
  - rule 'at_most_one: removed literals' was applied 12 times.
  - rule 'at_most_one: size one' was applied 12 times.
  - rule 'at_most_one: transformed into max clique.' was applied 1 time.
  - rule 'deductions: 4436 stored' was applied 1 time.
  - rule 'dual: fix variable' was applied 57 times.
  - rule 'dual: reduced domain' was applied 130 times.
  - rule 'duplicate: merged rhs of linear constraint' was applied 369 times.
  - rule 'duplicate: removed constraint' was applied 1'681 times.
  - rule 'enforcement: false literal' was applied 12 times.
  - rule 'exactly_one: x and not(x)' was applied 1 time.
  - rule 'incompatible linear: add implication' was applied 271 times.
  - rule 'linear matrix: common vertical rectangle' was applied 6'764 times.
  - rule 'linear1: always true' was applied 2 times.
  - rule 'linear: always true' was applied 3'016 times.
  - rule 'linear: doubleton free' was applied 28 times.
  - rule 'linear: empty' was applied 68 times.
  - rule 'linear: extracted enforcement literal' was applied 60'853 times.
  - rule 'linear: fixed or dup variables' was applied 62'123 times.
  - rule 'linear: positive equal one' was applied 13 times.
  - rule 'linear: reduced variable domains' was applied 5'771 times.
  - rule 'linear: remapped using affine relations' was applied 62'594 times.
  - rule 'linear: simplified rhs' was applied 209'684 times.
  - rule 'linear: tightened into equality' was applied 12 times.
  - rule 'linear: variable substitution 1' was applied 28 times.
  - rule 'linear: variable substitution 2' was applied 684 times.
  - rule 'linear: variable substitution 3' was applied 381 times.
  - rule 'no_overlap: inferred from x != y constraints' was applied 1 time.
  - rule 'presolve: 202 unused variables removed.' was applied 1 time.
  - rule 'presolve: iteration' was applied 3 times.
  - rule 'probing: reduced enforced constraint to implication.' was applied 19 times.
  - rule 'symmetry: fixed to false in general orbit' was applied 1 time.

Presolved optimization model '': (model_fingerprint: 0x5915ceeb3c6e83dd)
#Variables: 6'282 (#ints: 20 in objective)
  - 443 Booleans in [0,1]
  - 4'170 different domains in [-40281,37223] with a largest complexity of 32.
#kExactlyOne: 12 (#literals: 36)
#kInterval: 14
#kLinear1: 6 (#enforced: 6 #multi: 3)
#kLinear2: 3'900 (#enforced: 3'777 #multi: 1'210)
#kLinear3: 15'037 (#enforced: 10'787)
#kLinearN: 46'806 (#enforced: 43'839) (#terms: 564'672)
#kNoOverlap: 1 (#intervals: 14)

Preloading model.
#Bound  12.94s best:inf   next:[188,26481] initial_domain
[Symmetry] Graph for symmetry has 79'447 nodes and 684'961 arcs.
[Symmetry] Symmetry computation done. time: 0.0209128 dtime: 0.0361543
#Model  13.07s var:6282/6282 constraints:65776/65776

Starting search at 13.10s with 32 workers.
17 full problem subsolvers: [core, default_lp, fixed, lb_tree_search, max_lp, no_lp, objective_lb_search, objective_lb_search_max_lp, objective_lb_search_no_lp, objective_shaving_search_max_lp, objective_shaving_search_no_lp, probing, probing_max_lp, pseudo_costs, quick_restart, quick_restart_no_lp, reduced_costs]
13 first solution subsolvers: [fj_long_default, fj_long_lin_default, fj_long_random, fj_short_default, fj_short_lin_default, fj_short_lin_random, fj_short_random, fs_random(2), fs_random_no_lp, fs_random_quick_restart(2), fs_random_quick_restart_no_lp]
13 incomplete subsolvers: [feasibility_pump, graph_arc_lns, graph_cst_lns, graph_dec_lns, graph_var_lns, rins/rens, rnd_cst_lns, rnd_var_lns, scheduling_intervals_lns, scheduling_precedences_lns, scheduling_time_window_lns, violation_ls(2)]
3 helper subsolvers: [neighborhood_helper, synchronization_agent, update_gap_integral]
#Bound  15.07s best:inf   next:[189,26481] objective_shaving_search_max_lp (vars=6294 csts=65791)
#Bound  15.34s best:inf   next:[248,26481] no_lp (initial_propagation)
#Bound  15.61s best:inf   next:[265,26481] objective_lb_search_no_lp
#Bound  16.09s best:inf   next:[461,26481] objective_lb_search_no_lp
#Bound  16.10s best:inf   next:[465,26481] objective_lb_search_no_lp
#1      16.45s best:9663  next:[465,9662] fs_random_quick_restart_no_lp (fixed_bools=0/524)
#Bound  16.58s best:9663  next:[1458,9662] reduced_costs
#2      16.70s best:9662  next:[1458,9661] violation_ls(batch:1 #solutions_imported:1 #lin_moves:0 #lin_evals:11'318 #gen_moves:4'786 #gen_evals:595 #comp_moves:426 #backtracks:2'180 #weight_updates:51)
#3      16.78s best:9660  next:[1458,9659] violation_ls(batch:2 #solutions_imported:2 #lin_moves:7'152 #lin_evals:39'667 #gen_moves:4'786 #gen_evals:595 #comp_moves:426 #backtracks:2'180 #weight_updates:948)
#4      16.88s best:9659  next:[1458,9658] violation_ls(batch:3 #solutions_imported:3 #lin_moves:19'032 #lin_evals:80'060 #weight_updates:1'052)
#Bound  16.98s best:9659  next:[1653,9658] objective_lb_search_max_lp
#Bound  17.05s best:9659  next:[1865,9658] objective_lb_search_max_lp
#Bound  17.12s best:9659  next:[1868,9658] objective_lb_search_max_lp
#5      17.18s best:9658  next:[1868,9657] violation_ls(batch:4 #solutions_imported:4 #lin_moves:18'056 #lin_evals:78'239 #gen_moves:4'786 #gen_evals:595 #comp_moves:426 #backtracks:2'180 #weight_updates:1'288)
#6      17.19s best:9657  next:[1868,9656] violation_ls(batch:4 #solutions_imported:4 #lin_moves:19'032 #lin_evals:80'127 #gen_moves:28 #gen_evals:3 #comp_moves:2 #backtracks:13 #weight_updates:1'052)
#Bound  17.48s best:9657  next:[1869,9656] reduced_costs
#7      17.83s best:9656  next:[1869,9655] violation_ls(batch:5 #solutions_imported:5 #lin_moves:18'056 #lin_evals:85'766 #gen_moves:8'031 #gen_evals:980 #comp_moves:641 #backtracks:3'695 #weight_updates:1'346)
#8      17.84s best:9655  next:[1869,9654] violation_ls(batch:5 #solutions_imported:5 #lin_moves:19'434 #lin_evals:82'039 #gen_moves:28 #gen_evals:3 #comp_moves:2 #backtracks:13 #weight_updates:1'158)
#9      17.85s best:9521  next:[1869,9520] rins_lp_lns (d=0.91 s=119 t=0.10 p=1.00 stall=4 h=auto_l0)
#10     18.74s best:9485  next:[1869,9484] graph_var_lns (d=0.91 s=124 t=0.10 p=1.00 stall=0 h=auto_l0)
#11     19.15s best:9459  next:[1869,9458] quick_restart_no_lp (fixed_bools=0/613)
#12     19.77s best:9455  next:[1869,9454] quick_restart_no_lp (fixed_bools=0/636)
#Bound  24.28s best:9455  next:[1906,9454] reduced_costs
#13     24.38s best:9453  next:[1906,9452] violation_ls(batch:6 #solutions_imported:6 #lin_moves:18'056 #lin_evals:85'769 #gen_moves:8'032 #gen_evals:980 #comp_moves:642 #backtracks:3'695 #weight_updates:1'346)
#Bound  24.63s best:9453  next:[1908,9452] reduced_costs
#14     25.10s best:9042  next:[1908,9041] rnd_var_lns (d=0.94 s=137 t=0.10 p=1.00 stall=5 h=auto_l0) [hint]
#15     25.81s best:9041  next:[1908,9040] violation_ls(batch:7 #solutions_imported:7 #lin_moves:19'658 #lin_evals:83'246 #gen_moves:28 #gen_evals:3 #comp_moves:2 #backtracks:13 #weight_updates:1'268)
#16     27.11s best:9018  next:[1908,9017] rins_lp_lns (d=0.92 s=163 t=0.10 p=0.83 stall=0 h=auto_l0)
#17     30.58s best:9013  next:[1908,9012] quick_restart_no_lp (fixed_bools=0/670)
#18     32.93s best:8882  next:[1908,8881] rins_lp_lns (d=0.92 s=189 t=0.10 p=0.75 stall=1 h=auto_l0)
#19     34.00s best:8857  next:[1908,8856] quick_restart_no_lp (fixed_bools=0/707)
#20     36.78s best:8832  next:[1908,8831] quick_restart_no_lp (fixed_bools=0/728)
#21     39.06s best:8831  next:[1908,8830] violation_ls(batch:12 #solutions_imported:12 #lin_moves:27'326 #lin_evals:193'067 #gen_moves:38'488 #gen_evals:4'674 #comp_moves:3'244 #backtracks:17'619 #weight_updates:2'458)
#22     39.07s best:8830  next:[1908,8829] violation_ls(batch:12 #solutions_imported:11 #lin_moves:39'331 #lin_evals:193'174 #gen_moves:17'541 #gen_evals:1'535 #comp_moves:1'728 #backtracks:7'903 #weight_updates:1'814)
#23     40.25s best:8807  next:[1908,8806] graph_dec_lns (d=0.99 s=210 t=0.10 p=1.00 stall=4 h=auto_l0) [hint]
#24     42.28s best:8776  next:[1908,8775] rnd_var_lns (d=0.99 s=217 t=0.10 p=1.00 stall=5 h=auto_l0)
#25     43.38s best:8775  next:[1908,8774] violation_ls(batch:13 #solutions_imported:12 #lin_moves:41'767 #lin_evals:201'716 #gen_moves:17'541 #gen_evals:1'535 #comp_moves:1'728 #backtracks:7'903 #weight_updates:1'998)
#26     43.62s best:7815  next:[1908,7814] rins_lp_lns (d=0.94 s=226 t=0.10 p=0.73 stall=0 h=auto_l0)
#27     48.26s best:7740  next:[1908,7739] graph_dec_lns (d=0.99 s=234 t=0.10 p=1.00 stall=0 h=auto_l0)
#28     48.80s best:7735  next:[1908,7734] quick_restart_no_lp (fixed_bools=0/875)
#29     50.34s best:7721  next:[1908,7720] quick_restart_no_lp (fixed_bools=0/905)
#30     50.80s best:7720  next:[1908,7719] violation_ls(batch:15 #solutions_imported:15 #lin_moves:36'857 #lin_evals:251'294 #gen_moves:46'448 #gen_evals:5'396 #comp_moves:5'062 #backtracks:20'690 #weight_updates:2'992)
#31     50.81s best:7719  next:[1908,7718] violation_ls(batch:15 #solutions_imported:14 #lin_moves:51'037 #lin_evals:238'356 #gen_moves:17'544 #gen_evals:1'535 #comp_moves:1'731 #backtracks:7'903 #weight_updates:2'728)
#32     51.64s best:7394  next:[1908,7393] graph_arc_lns (d=0.99 s=244 t=0.10 p=1.00 stall=1 h=auto_l0)
#33     52.39s best:7374  next:[1908,7373] quick_restart_no_lp (fixed_bools=0/980)
#34     54.60s best:7369  next:[1908,7368] quick_restart_no_lp (fixed_bools=0/1002)
#35     55.60s best:7169  next:[1908,7168] graph_cst_lns (d=0.99 s=257 t=0.10 p=1.00 stall=2 h=auto_l0)
#36     55.63s best:7038  next:[1908,7037] graph_dec_lns (d=0.99 s=258 t=0.10 p=1.00 stall=0 h=auto_l0)
#37     57.83s best:7037  next:[1908,7036] violation_ls(batch:17 #solutions_imported:17 #lin_moves:36'873 #lin_evals:265'288 #gen_moves:52'575 #gen_evals:5'927 #comp_moves:5'509 #backtracks:23'530 #weight_updates:3'100)
#38     57.85s best:7036  next:[1908,7035] violation_ls(batch:17 #solutions_imported:16 #lin_moves:60'848 #lin_evals:271'298 #gen_moves:17'544 #gen_evals:1'535 #comp_moves:1'731 #backtracks:7'903 #weight_updates:2'950)
#39     59.15s best:6554  next:[1908,6553] rins_lp_lns (d=0.94 s=274 t=0.10 p=0.67 stall=0 h=auto_l0)
#40     63.87s best:6433  next:[1908,6432] graph_dec_lns (d=1.00 s=282 t=0.10 p=1.00 stall=0 h=auto_l0)
#Bound  66.96s best:6433  next:[1965,6432] objective_lb_search_max_lp
#41     70.28s best:6430  next:[1965,6429] graph_var_lns (d=1.00 s=291 t=0.10 p=1.00 stall=0 h=auto_l0)
#42     71.17s best:6429  next:[1965,6428] violation_ls(batch:20 #solutions_imported:20 #lin_moves:52'460 #lin_evals:342'858 #gen_moves:60'103 #gen_evals:6'740 #comp_moves:6'653 #backtracks:26'719 #weight_updates:4'002)
#43     71.18s best:6428  next:[1965,6427] violation_ls(batch:20 #solutions_imported:19 #lin_moves:70'115 #lin_evals:328'402 #gen_moves:26'184 #gen_evals:2'446 #comp_moves:2'261 #backtracks:11'957 #weight_updates:3'792)
#44     72.80s best:6311  next:[1965,6310] graph_var_lns (d=1.00 s=303 t=0.10 p=0.94 stall=0 h=auto_l0)
#45     77.90s best:6257  next:[1965,6256] graph_cst_lns (d=1.00 s=319 t=0.10 p=0.94 stall=0 h=auto_l0)
#46     79.74s best:6256  next:[1965,6255] violation_ls(batch:22 #solutions_imported:21 #lin_moves:71'252 #lin_evals:355'701 #gen_moves:36'475 #gen_evals:3'072 #comp_moves:2'612 #backtracks:16'921 #weight_updates:4'031)
#47     83.58s best:6159  next:[1965,6158] graph_dec_lns (d=1.00 s=332 t=0.10 p=0.89 stall=0 h=auto_l0)
#48     83.98s best:6158  next:[1965,6157] violation_ls(batch:23 #solutions_imported:23 #lin_moves:72'946 #lin_evals:416'787 #gen_moves:60'103 #gen_evals:6'740 #comp_moves:6'653 #backtracks:26'719 #weight_updates:5'726)
#49     86.07s best:6157  next:[1965,6156] quick_restart_no_lp (fixed_bools=0/1387)
#50     86.67s best:6156  next:[1965,6155] quick_restart_no_lp (fixed_bools=0/1393)
#51     86.82s best:6134  next:[1965,6133] graph_arc_lns (d=1.00 s=342 t=0.10 p=0.90 stall=0 h=auto_l0)
#52     88.87s best:6132  next:[1965,6131] rnd_cst_lns (d=1.00 s=352 t=0.10 p=0.86 stall=1 h=auto_l0)
#53     92.62s best:6129  next:[1965,6128] rins_lp_lns (d=0.91 s=372 t=0.10 p=0.57 stall=0 h=auto_l0)
#54     92.70s best:6128  next:[1965,6127] violation_ls(batch:25 #solutions_imported:25 #lin_moves:78'889 #lin_evals:462'703 #gen_moves:70'250 #gen_evals:7'289 #comp_moves:7'141 #backtracks:31'547 #weight_updates:6'059)
#55     92.71s best:6127  next:[1965,6126] violation_ls(batch:25 #solutions_imported:24 #lin_moves:71'252 #lin_evals:398'621 #gen_moves:52'209 #gen_evals:4'378 #comp_moves:4'914 #backtracks:23'633 #weight_updates:4'170)
#56     94.40s best:6055  next:[1965,6054] rnd_var_lns (d=1.00 s=363 t=0.10 p=0.86 stall=0 h=auto_l0)
#57     94.56s best:6028  next:[1965,6027] graph_var_lns (d=1.00 s=365 t=0.10 p=0.86 stall=0 h=auto_l0)
#Bound  97.09s best:6028  next:[1971,6027] objective_lb_search_max_lp
#58     97.31s best:5578  next:[1971,5577] rins_lp_lns (d=0.92 s=384 t=0.10 p=0.58 stall=0 h=auto_l0)
#59    102.10s best:5412  next:[1971,5411] rins_lp_lns (d=0.94 s=397 t=0.10 p=0.60 stall=0 h=auto_l0)
#60    102.12s best:5411  next:[1971,5410] violation_ls(batch:27 #solutions_imported:27 #lin_moves:79'498 #lin_evals:485'930 #gen_moves:78'724 #gen_evals:8'027 #comp_moves:8'269 #backtracks:35'220 #weight_updates:6'276)
#61    107.18s best:5407  next:[1971,5406] rnd_var_lns (d=1.00 s=400 t=0.10 p=0.84 stall=0 h=auto_l0)
#62    115.58s best:5406  next:[1971,5405] violation_ls(batch:30 #solutions_imported:27 #lin_moves:71'252 #lin_evals:500'202 #gen_moves:92'428 #gen_evals:7'421 #comp_moves:10'326 #backtracks:41'032 #weight_updates:4'593)
#63    120.56s best:5392  next:[1971,5391] rins_pump_lns (d=0.91 s=446 t=0.10 p=0.55 stall=0 h=auto_l0)
#64    120.97s best:5376  next:[1971,5375] graph_var_lns (d=1.00 s=439 t=0.10 p=0.76 stall=2 h=auto_l0)
#65    121.29s best:5374  next:[1971,5373] graph_arc_lns (d=0.99 s=440 t=0.10 p=0.72 stall=1 h=auto_l0)
#66    125.38s best:5373  next:[1971,5372] violation_ls(batch:32 #solutions_imported:29 #lin_moves:80'870 #lin_evals:543'704 #gen_moves:97'518 #gen_evals:7'869 #comp_moves:10'762 #backtracks:43'359 #weight_updates:5'052)
#67    128.57s best:5322  next:[1971,5321] graph_cst_lns (d=1.00 s=453 t=0.10 p=0.79 stall=2 h=auto_l0)
#68    129.23s best:4986  next:[1971,4985] rins_lp_lns (d=0.91 s=470 t=0.10 p=0.55 stall=0 h=auto_l0)
#69    140.16s best:4938  next:[1971,4937] graph_var_lns (d=1.00 s=487 t=0.10 p=0.73 stall=2 h=auto_l0)
#70    146.35s best:4831  next:[1971,4830] graph_var_lns (d=1.00 s=499 t=0.10 p=0.74 stall=0 h=auto_l0)
#71    153.91s best:4787  next:[1971,4786] graph_var_lns (d=1.00 s=523 t=0.10 p=0.74 stall=0 h=auto_l0)
#72    161.07s best:4774  next:[1971,4773] graph_cst_lns (d=1.00 s=537 t=0.10 p=0.74 stall=0 h=auto_l0)
#73    189.74s best:4730  next:[1971,4729] rnd_var_lns (d=1.00 s=605 t=0.10 p=0.69 stall=0 h=auto_l0)
#74    211.00s best:4686  next:[1971,4685] graph_var_lns (d=1.00 s=667 t=0.10 p=0.68 stall=1 h=auto_l0)
#Bound 251.74s best:4686  next:[1972,4685] objective_shaving_search_max_lp (vars=8031 csts=67502)
#75    266.37s best:4642  next:[1972,4641] graph_var_lns (d=0.99 s=813 t=0.10 p=0.61 stall=1 h=auto_l0)
#76    275.80s best:4586  next:[1972,4585] rnd_var_lns (d=1.00 s=835 t=0.10 p=0.62 stall=0 h=auto_l0)
#77    285.39s best:4542  next:[1972,4541] rnd_cst_lns (d=1.00 s=860 t=0.10 p=0.63 stall=0 h=auto_l0)
#78    291.97s best:4540  next:[1972,4539] graph_arc_lns (d=1.00 s=874 t=0.10 p=0.62 stall=0 h=auto_l0)
#79    340.55s best:4523  next:[1972,4522] rnd_var_lns (d=1.00 s=1003 t=0.10 p=0.60 stall=0 h=auto_l0)
#80    344.26s best:4522  next:[1972,4521] violation_ls(batch:79 #solutions_imported:44 #lin_moves:305'065 #lin_evals:1'938'339 #gen_moves:281'693 #gen_evals:24'500 #comp_moves:24'766 #backtracks:128'443 #weight_updates:52'674)
#81    344.28s best:4521  next:[1972,4520] violation_ls(batch:79 #solutions_imported:41 #lin_moves:321'902 #lin_evals:1'902'386 #gen_moves:217'937 #gen_evals:21'570 #comp_moves:26'163 #backtracks:95'854 #weight_updates:45'058)
#82    344.58s best:4479  next:[1972,4478] rins_lp_lns (d=0.93 s=1024 t=0.10 p=0.53 stall=11 h=auto_l0)
#83    350.38s best:4465  next:[1972,4464] rnd_cst_lns (d=1.00 s=1028 t=0.10 p=0.61 stall=3 h=auto_l0)
#84    443.05s best:4443  next:[1972,4442] graph_dec_lns (d=1.00 s=1274 t=0.10 p=0.60 stall=0 h=auto_l0)
#85    448.32s best:4421  next:[1972,4420] rnd_cst_lns (d=1.00 s=1294 t=0.10 p=0.59 stall=0 h=auto_l0)
#86    500.04s best:4380  next:[1972,4379] graph_arc_lns (d=1.00 s=1428 t=0.10 p=0.57 stall=0 h=auto_l0)
#87    520.08s best:4344  next:[1972,4343] graph_var_lns (d=1.00 s=1487 t=0.10 p=0.57 stall=1 h=auto_l0)
#88    532.58s best:4333  next:[1972,4332] graph_cst_lns (d=1.00 s=1513 t=0.10 p=0.57 stall=1 h=auto_l0)
#Bound 751.60s best:4333  next:[1978,4332] objective_lb_search_max_lp
#89    867.48s best:4331  next:[1978,4330] rnd_var_lns (d=1.00 s=2389 t=0.10 p=0.54 stall=1 h=auto_l0)
#90    917.72s best:4313  next:[1978,4312] rnd_var_lns (d=1.00 s=2524 t=0.10 p=0.54 stall=0 h=auto_l0)
#91    922.54s best:4304  next:[1978,4303] quick_restart_no_lp (fixed_bools=0/3421)
#Bound 1009.91s best:4304  next:[1989,4303] objective_lb_search_max_lp
#Bound 1185.55s best:4304  next:[1990,4303] objective_lb_search_max_lp
#Bound 1344.47s best:4304  next:[1991,4303] objective_lb_search_max_lp
#Bound 1457.10s best:4304  next:[1994,4303] objective_lb_search_max_lp
#92    1472.59s best:4303  next:[1994,4302] graph_dec_lns (d=1.00 s=3993 t=0.10 p=0.53 stall=3 h=auto_l0)
#93    1479.66s best:4302  next:[1994,4301] quick_restart (fixed_bools=0/2304)
#94    1482.85s best:4301  next:[1994,4300] violation_ls(batch:326 #solutions_imported:56 #perturbations:1 #lin_moves:662'978 #lin_evals:7'556'419 #gen_moves:2'039'242 #gen_evals:158'844 #comp_moves:103'395 #backtracks:967'844 #weight_updates:64'714)
#95    1482.88s best:4300  next:[1994,4299] violation_ls(batch:326 #solutions_imported:53 #perturbations:1 #lin_moves:696'601 #lin_evals:7'126'067 #gen_moves:1'050'459 #gen_evals:157'215 #comp_moves:94'527 #backtracks:477'857 #weight_updates:65'066)
#96    1488.07s best:4297  next:[1994,4296] rins_lp_lns (d=0.93 s=4046 t=0.10 p=0.51 stall=1 h=auto_l0)
#Bound 1577.60s best:4297  next:[1995,4296] objective_lb_search_max_lp
#Bound 1658.88s best:4297  next:[1996,4296] objective_lb_search_max_lp
#Bound 1779.16s best:4297  next:[1997,4296] objective_lb_search_max_lp
#Bound 1814.06s best:4297  next:[2000,4296] objective_lb_search_max_lp
#97    2105.66s best:4287  next:[2000,4286] rnd_var_lns (d=1.00 s=5673 t=0.10 p=0.52 stall=2 h=auto_l0)
#Bound 2249.97s best:4287  next:[2003,4286] objective_lb_search_max_lp
#Bound 2426.00s best:4287  next:[2007,4286] objective_lb_search_max_lp
#Bound 2462.48s best:4287  next:[2011,4286] objective_lb_search_max_lp
#Bound 2770.81s best:4287  next:[2013,4286] objective_lb_search_max_lp
#Bound 3188.36s best:4287  next:[2021,4286] objective_lb_search_max_lp
#Bound 3509.47s best:4287  next:[2022,4286] objective_lb_search_max_lp
#98    3702.96s best:4225  next:[2022,4224] rins_lp_lns (d=0.94 s=9866 t=0.10 p=0.50 stall=3 h=auto_l0)
#99    3708.32s best:4217  next:[2022,4216] graph_var_lns (d=1.00 s=9871 t=0.10 p=0.51 stall=0 h=auto_l0)
#100   3720.34s best:4209  next:[2022,4208] graph_cst_lns (d=1.00 s=9898 t=0.10 p=0.51 stall=0 h=auto_l0)
#101   3720.96s best:4208  next:[2022,4207] violation_ls(batch:805 #solutions_imported:62 #perturbations:5 #lin_moves:2'591'707 #lin_evals:22'585'959 #gen_moves:2'604'469 #gen_evals:338'343 #comp_moves:157'005 #backtracks:1'223'571 #weight_updates:549'402)
#102   3720.98s best:4207  next:[2022,4206] violation_ls(batch:805 #solutions_imported:59 #perturbations:5 #lin_moves:1'653'022 #lin_evals:16'790'672 #gen_moves:1'508'399 #gen_evals:420'213 #comp_moves:171'817 #backtracks:668'060 #weight_updates:539'188)
#103   3725.89s best:4193  next:[2022,4192] rins_pump_lns (d=0.94 s=9927 t=0.10 p=0.50 stall=0 h=auto_l0)
#Bound 3903.02s best:4193  next:[2027,4192] objective_lb_search_max_lp
#Bound 4201.99s best:4193  next:[2028,4192] objective_lb_search_max_lp
#Bound 4719.99s best:4193  next:[2029,4192] objective_lb_search_max_lp
#Bound 5082.11s best:4193  next:[2031,4192] objective_lb_search_max_lp
#Bound 5225.70s best:4193  next:[2033,4192] objective_lb_search_max_lp
#Bound 5229.17s best:4193  next:[2034,4192] objective_lb_search_max_lp
#Bound 5491.61s best:4193  next:[2036,4192] objective_lb_search_max_lp
#Bound 5677.97s best:4193  next:[2038,4192] objective_lb_search_max_lp
#Bound 6196.48s best:4193  next:[2042,4192] objective_lb_search_max_lp
#104   6492.86s best:4184  next:[2042,4183] rnd_var_lns (d=1.00 s=17150 t=0.10 p=0.51 stall=0 h=auto_l0)
#Bound 6549.73s best:4184  next:[2053,4183] objective_lb_search_max_lp
#105   8770.29s best:4178  next:[2053,4177] graph_dec_lns (d=1.00 s=22970 t=0.10 p=0.51 stall=2 h=auto_l0)
#Bound 9076.55s best:4178  next:[2055,4177] objective_lb_search_max_lp
#Bound 9992.31s best:4178  next:[2056,4177] objective_lb_search_max_lp
#Bound 11178.70s best:4178  next:[2057,4177] objective_lb_search_max_lp
#Bound 11460.75s best:4178  next:[2058,4177] objective_lb_search_max_lp
#Bound 13030.35s best:4178  next:[2062,4177] objective_lb_search_max_lp
#Bound 13620.69s best:4178  next:[2069,4177] objective_lb_search_max_lp
#Bound 14999.06s best:4178  next:[2072,4177] objective_lb_search_max_lp
#Bound 16485.75s best:4178  next:[2073,4177] objective_lb_search_max_lp
#Bound 16644.81s best:4178  next:[2074,4177] objective_lb_search_max_lp
#Bound 21681.97s best:4178  next:[2076,4177] objective_lb_search_max_lp
#Bound 23197.65s best:4178  next:[2078,4177] objective_lb_search_max_lp
#Bound 28950.61s best:4178  next:[2080,4177] objective_lb_search_max_lp
#Bound 29873.50s best:4178  next:[2081,4177] objective_lb_search_max_lp
#Bound 30429.89s best:4178  next:[2082,4177] objective_lb_search_max_lp
#Bound 33875.18s best:4178  next:[2083,4177] objective_lb_search_max_lp
#Bound 34046.16s best:4178  next:[2084,4177] objective_lb_search_max_lp
#Bound 37376.46s best:4178  next:[2085,4177] objective_lb_search_max_lp
#Bound 39237.57s best:4178  next:[2086,4177] objective_lb_search_max_lp
#Bound 40100.29s best:4178  next:[2087,4177] objective_lb_search_max_lp
#Bound 45823.79s best:4178  next:[2090,4177] objective_lb_search_max_lp
#Bound 47884.81s best:4178  next:[2092,4177] objective_lb_search_max_lp
#106   49785.43s best:4175  next:[2092,4174] rnd_cst_lns (d=1.00 s=127078 t=0.10 p=0.50 stall=0 h=auto_l0)
#107   49789.46s best:4161  next:[2092,4160] rins_pump_lns (d=0.94 s=127098 t=0.10 p=0.50 stall=7 h=auto_l0)
#Bound 50242.16s best:4161  next:[2094,4160] objective_lb_search_max_lp
#108   50583.18s best:4159  next:[2094,4158] quick_restart (fixed_bools=11/10990)
#109   50665.50s best:4156  next:[2094,4155] rins_pump_lns (d=0.94 s=129399 t=0.10 p=0.50 stall=6 h=auto_l0)
#Bound 58985.96s best:4156  next:[2095,4155] objective_lb_search_max_lp
#110   59548.99s best:4132  next:[2095,4131] graph_dec_lns (d=1.00 s=152469 t=0.10 p=0.50 stall=0 h=auto_l0)
#Bound 60932.09s best:4132  next:[2096,4131] objective_lb_search_max_lp
#Bound 61643.92s best:4132  next:[2097,4131] objective_lb_search_max_lp
#Bound 63653.45s best:4132  next:[2098,4131] objective_lb_search_max_lp
#Bound 67805.18s best:4132  next:[2099,4131] objective_lb_search_max_lp
#Bound 77850.16s best:4132  next:[2101,4131] objective_lb_search_max_lp

Task timing                                  n [     min,      max]      avg      dev     time         n [     min,      max]      avg      dev    dtime
                             'core':         1 [  24.00h,   24.00h]   24.00h   0.00ns   24.00h         1 [  11.24h,   11.24h]   11.24h   0.00ns   11.24h
                       'default_lp':         1 [  24.00h,   24.00h]   24.00h   0.00ns   24.00h         1 [   1.61h,    1.61h]    1.61h   0.00ns    1.61h
                 'feasibility_pump':      4510 [446.53ms,    6.73m]   19.15s    7.70s   23.99h      4509 [722.65ms,   48.89s]    1.68s 981.54ms    2.10h
                            'fixed':         1 [  24.00h,   24.00h]   24.00h   0.00ns   24.00h         1 [   1.59h,    1.59h]    1.59h   0.00ns    1.59h
                  'fj_long_default':         5 [179.94ms,    1.03s] 365.71ms 333.18ms    1.83s         5 [186.16ms, 278.61ms] 219.65ms  32.64ms    1.10s
              'fj_long_lin_default':         5 [198.84ms, 979.30ms] 370.36ms 304.88ms    1.85s         5 [234.33ms, 277.67ms] 263.56ms  15.14ms    1.32s
                   'fj_long_random':         5 [172.90ms,    1.00s] 372.52ms 317.98ms    1.86s         5 [169.77ms, 252.86ms] 206.01ms  26.90ms    1.03s
                 'fj_short_default':         5 [191.97ms,    2.46s] 662.28ms 900.29ms    3.31s         5 [225.08ms, 262.96ms] 251.45ms  13.96ms    1.26s
             'fj_short_lin_default':         4 [203.74ms,    1.10s] 457.06ms 373.46ms    1.83s         4 [229.36ms, 251.48ms] 243.26ms   8.34ms 973.04ms
              'fj_short_lin_random':         5 [203.14ms, 989.98ms] 365.48ms 312.30ms    1.83s         5 [237.10ms, 258.98ms] 252.20ms   7.72ms    1.26s
                  'fj_short_random':         7 [201.29ms, 491.12ms] 258.64ms  96.99ms    1.81s         7 [238.13ms, 270.85ms] 257.82ms  11.85ms    1.80s
                        'fs_random':         1 [   3.27s,    3.27s]    3.27s   0.00ns    3.27s         1 [ 11.27ms,  11.27ms]  11.27ms   0.00ns  11.27ms
                        'fs_random':         1 [   3.33s,    3.33s]    3.33s   0.00ns    3.33s         1 [ 47.94ms,  47.94ms]  47.94ms   0.00ns  47.94ms
                  'fs_random_no_lp':         1 [   3.28s,    3.28s]    3.28s   0.00ns    3.28s         1 [117.63ms, 117.63ms] 117.63ms   0.00ns 117.63ms
          'fs_random_quick_restart':         1 [   3.28s,    3.28s]    3.28s   0.00ns    3.28s         1 [ 15.05ms,  15.05ms]  15.05ms   0.00ns  15.05ms
          'fs_random_quick_restart':         1 [   3.33s,    3.33s]    3.33s   0.00ns    3.33s         1 [ 19.20ms,  19.20ms]  19.20ms   0.00ns  19.20ms
    'fs_random_quick_restart_no_lp':         1 [   3.27s,    3.27s]    3.27s   0.00ns    3.27s         1 [ 70.92ms,  70.92ms]  70.92ms   0.00ns  70.92ms
                    'graph_arc_lns':     18202 [325.00ms,   15.18s]    6.04s    1.16s   30.56h     18200 [ 10.00ns, 201.14ms]  77.22ms  29.26ms   23.42m
                    'graph_cst_lns':     18202 [179.91ms,   16.18s]    6.43s    1.29s   32.51h     18192 [ 10.00ns, 200.67ms]  75.53ms  31.43ms   22.90m
                    'graph_dec_lns':     18202 [242.31ms,   15.56s]    6.36s    1.19s   32.13h     18196 [ 10.00ns, 135.94ms]  76.21ms  30.47ms   23.11m
                    'graph_var_lns':     18202 [336.00ms,   15.18s]    5.82s    1.50s   29.44h     18194 [ 10.00ns, 184.62ms]  72.76ms  34.04ms   22.06m
                   'lb_tree_search':         1 [  24.00h,   24.00h]   24.00h   0.00ns   24.00h         1 [  10.72h,   10.72h]   10.72h   0.00ns   10.72h
                           'max_lp':         1 [  24.00h,   24.00h]   24.00h   0.00ns   24.00h         1 [   3.10h,    3.10h]    3.10h   0.00ns    3.10h
                            'no_lp':         1 [  24.00h,   24.00h]   24.00h   0.00ns   24.00h         1 [  42.98m,   42.98m]   42.98m   0.00ns   42.98m
              'objective_lb_search':         1 [  24.00h,   24.00h]   24.00h   0.00ns   24.00h         1 [   1.91h,    1.91h]    1.91h   0.00ns    1.91h
       'objective_lb_search_max_lp':         1 [  24.00h,   24.00h]   24.00h   0.00ns   24.00h         1 [   3.01h,    3.01h]    3.01h   0.00ns    3.01h
        'objective_lb_search_no_lp':         1 [  24.00h,   24.00h]   24.00h   0.00ns   24.00h         1 [  51.90m,   51.90m]   51.90m   0.00ns   51.90m
  'objective_shaving_search_max_lp':        64 [242.42ms,    2.79h]   22.50m   36.62m   24.00h        58 [ 78.90ms,   11.88m]    1.41m    2.27m    1.36h
   'objective_shaving_search_no_lp':        63 [187.39ms,    2.79h]   22.85m   36.80m   24.00h        58 [ 78.53ms,    3.46m]   25.73s   41.42s   24.87m
                          'probing':         1 [  24.00h,   24.00h]   24.00h   0.00ns   24.00h         1 [   2.45h,    2.45h]    2.45h   0.00ns    2.45h
                   'probing_max_lp':         1 [  24.00h,   24.00h]   24.00h   0.00ns   24.00h         1 [   3.18h,    3.18h]    3.18h   0.00ns    3.18h
                     'pseudo_costs':         1 [  24.00h,   24.00h]   24.00h   0.00ns   24.00h         1 [   1.86h,    1.86h]    1.86h   0.00ns    1.86h
                    'quick_restart':         1 [  24.00h,   24.00h]   24.00h   0.00ns   24.00h         1 [   2.90h,    2.90h]    2.90h   0.00ns    2.90h
              'quick_restart_no_lp':         1 [  24.00h,   24.00h]   24.00h   0.00ns   24.00h         1 [   1.10h,    1.10h]    1.10h   0.00ns    1.10h
                    'reduced_costs':         1 [  24.00h,   24.00h]   24.00h   0.00ns   24.00h         1 [   2.42h,    2.42h]    2.42h   0.00ns    2.42h
                        'rins/rens':     18202 [  1.53ms,    6.89s]    1.40s 907.16ms    7.07h     15829 [ 10.00ns, 111.97ms]  66.20ms  43.77ms   17.47m
                      'rnd_cst_lns':     18202 [272.73ms,   17.57s]    6.42s    1.31s   32.48h     18189 [ 10.00ns, 200.60ms]  75.49ms  31.43ms   22.88m
                      'rnd_var_lns':     18202 [279.70ms,   13.47s]    6.31s    1.21s   31.90h     18196 [ 10.00ns, 182.61ms]  75.55ms  31.10ms   22.91m
         'scheduling_intervals_lns':     18202 [317.11ms,   19.18s]    9.04s 516.74ms   45.72h     18201 [  6.21ms, 102.30ms] 100.44ms 753.24us   30.47m
       'scheduling_precedences_lns':     18202 [  2.80us,   18.12s]    9.02s 559.83ms   45.60h     18197 [ 77.15ms, 200.72ms] 100.46ms   1.32ms   30.47m
       'scheduling_time_window_lns':     18202 [176.12ms,   19.05s]    9.06s 526.83ms   45.80h     18200 [ 88.25ms, 102.30ms] 100.45ms 296.03us   30.47m
                     'violation_ls':     18202 [  9.68ms, 827.72ms] 261.25ms  65.64ms    1.32h     18202 [780.00ns, 739.00ms] 256.91ms  62.03ms    1.30h
                     'violation_ls':     18202 [ 10.02ms, 758.86ms] 263.07ms  69.87ms    1.33h     18202 [  1.42us, 508.32ms] 261.84ms  66.73ms    1.32h

Search stats                          Bools   Conflicts    Branches   Restarts      BoolPropag   IntegerPropag
                           'core':   28'649   2'204'022   3'367'683     46'201  13'646'404'294  20'165'234'638
                     'default_lp':   21'979     562'477   4'923'708    325'424   1'094'910'593  11'996'561'057
                          'fixed':    5'499  10'652'542  29'849'196        890   4'114'905'843   8'339'044'388
                      'fs_random':      445           0         896        890             233         316'966
                      'fs_random':      445           1         907        890             178         321'597
                'fs_random_no_lp':      512          50       1'422      1'245           2'366         744'929
        'fs_random_quick_restart':      450           0         895        890             288         327'411
        'fs_random_quick_restart':      450           2         895        890             308         321'477
  'fs_random_quick_restart_no_lp':      524           6       1'549        891             274         668'638
                 'lb_tree_search':      536       1'259  12'599'384  2'958'498      39'714'790  14'581'309'297
                         'max_lp':    2'007     609'881   7'381'944  1'255'838     217'120'636  16'654'692'256
                          'no_lp':    3'914     461'585   3'403'327    512'528     287'733'759  11'636'192'891
            'objective_lb_search':    1'533     270'480   6'590'010  1'955'830     104'452'124  12'133'740'253
     'objective_lb_search_max_lp':    1'343     349'623   4'610'000  1'118'417      96'701'555  14'768'159'732
      'objective_lb_search_no_lp':    1'059     393'404   3'512'997  1'015'864      46'878'582  12'281'741'884
                        'probing':   12'214      10'883      13'629     13'629       4'627'848     113'844'355
                 'probing_max_lp':   12'214      10'903      30'023     22'259       4'942'399     119'701'459
                   'pseudo_costs':    6'675     568'457   7'695'007    936'257     396'825'707  15'601'353'071
                  'quick_restart':   15'493     197'657  11'134'212    209'733   1'036'828'886  10'925'639'352
            'quick_restart_no_lp':   20'629     611'605   6'530'563    112'668   1'863'201'563  15'053'318'943
                  'reduced_costs':  102'520     936'725   6'551'642    255'325  10'625'311'493  15'680'377'629

SAT stats                           ClassicMinim  LitRemoved   LitLearned  LitForgotten  Subsumed   MClauses  MDecisions  MLitTrue  MSubsumed  MLitRemoved  MReused
                           'core':     2'082'487  42'727'799   47'215'901    33'397'830     2'689     15'653      78'886         0        135          520      434
                     'default_lp':       479'741   4'319'465   20'034'180    16'858'295     3'187     99'680     882'346         0      6'403       50'162   21'196
                          'fixed':    10'386'989  95'666'853  252'345'869   251'977'282         0          0           0         0          0            0        0
                      'fs_random':             0           0            0             0         0          0           0         0          0            0        0
                      'fs_random':             0           0            3             0         0          0           0         0          0            0        0
                'fs_random_no_lp':            40         169          569             0         0          0           0         0          0            0        0
        'fs_random_quick_restart':             0           0            0             0         0          0           0         0          0            0        0
        'fs_random_quick_restart':             1           3           15             0         0          0           0         0          0            0        0
  'fs_random_quick_restart_no_lp':             0           0           24             0         0          0           0         0          0            0        0
                 'lb_tree_search':             2          12        4'118             0         0  1'239'341   6'318'403         0        210          853  102'986
                         'max_lp':       520'305   3'617'054   13'918'660    10'560'711    11'021    374'358   3'119'795         0      5'116       35'291   55'242
                          'no_lp':       380'975   2'407'071   14'724'715    13'553'386     3'719    110'890     805'623         0      3'209       19'311   17'197
            'objective_lb_search':       247'406   3'044'441    6'557'063     3'179'371     3'127    748'598   3'999'700         0        602        2'959   83'700
     'objective_lb_search_max_lp':       331'027   6'377'336    7'505'776     3'514'852     2'520    120'021   1'549'632         0      8'607       86'484   34'384
      'objective_lb_search_no_lp':       375'901   5'527'435   10'896'163     6'773'735     2'840    394'288   2'116'118         0        349        2'149   40'558
                        'probing':             0           0       10'883             0         0          0           0         0          0            0        0
                 'probing_max_lp':             0           0       10'903             0         0          0           0         0          0            0        0
                   'pseudo_costs':       478'521   3'395'175   18'936'473    17'536'679     2'117    295'178   2'138'612         0      3'042       15'824   34'756
                  'quick_restart':       147'315   1'195'538    5'866'143     4'549'080     2'226     36'891     987'939         0     15'683      227'267    7'578
            'quick_restart_no_lp':       490'891   4'826'918   20'724'655    17'382'798     3'242     18'102     337'628         0     10'022      118'404    1'724
                  'reduced_costs':       713'553   6'577'233   32'170'881    30'166'234    18'706    136'142   1'252'350         1     36'784      241'682   45'902

Lp stats                         Component  Iterations  AddedCuts    OPTIMAL    DUAL_F.  DUAL_U.
                  'default_lp':          1  14'066'461    526'182  1'390'981        109       72
                       'fixed':          1     196'713      2'218  9'570'302          0        0
                   'fs_random':          1       2'193        453         18          0        0
                   'fs_random':          1       3'893        537         42          0        0
     'fs_random_quick_restart':          1       2'340        455         20          0        0
     'fs_random_quick_restart':          1       2'609        481         24          0        0
              'lb_tree_search':          1  75'127'172     94'322     57'823  6'591'777        0
                      'max_lp':          1  25'849'807    345'907    170'264  2'374'026        3
         'objective_lb_search':          1  19'434'636  1'087'933  1'079'297        774        2
  'objective_lb_search_max_lp':          1  20'847'393     65'151     30'017  1'823'723        1
                     'probing':          1   1'215'103    532'072     40'833        290        5
              'probing_max_lp':          1   1'584'200    268'447     71'623     10'931        0
                'pseudo_costs':          1  12'369'669  1'238'526    674'665    888'471       21
               'quick_restart':          1  34'417'928  5'432'143  1'316'023      9'168        1
               'reduced_costs':          1  13'633'254    796'456    861'823  1'000'716        8

Lp dimension                                                                         Final dimension of first component
                  'default_lp':   5843 rows, 6269 columns, 21512 entries with magnitude in [9.314475e-03, 1.000000e+00]
                       'fixed':   5741 rows, 6269 columns, 21158 entries with magnitude in [1.392839e-02, 1.000000e+00]
                   'fs_random':    1400 rows, 6269 columns, 5995 entries with magnitude in [1.392839e-02, 1.000000e+00]
                   'fs_random':    2000 rows, 6269 columns, 8098 entries with magnitude in [1.392839e-02, 1.000000e+00]
     'fs_random_quick_restart':    1450 rows, 6269 columns, 6170 entries with magnitude in [1.392839e-02, 1.000000e+00]
     'fs_random_quick_restart':    1550 rows, 6269 columns, 6510 entries with magnitude in [1.392839e-02, 1.000000e+00]
              'lb_tree_search':  10860 rows, 6282 columns, 63302 entries with magnitude in [1.379864e-04, 1.000000e+00]
                      'max_lp':   7182 rows, 6282 columns, 29615 entries with magnitude in [3.355855e-04, 1.000000e+00]
         'objective_lb_search':   6946 rows, 6269 columns, 26986 entries with magnitude in [2.018633e-04, 1.000000e+00]
  'objective_lb_search_max_lp':   8831 rows, 6282 columns, 39752 entries with magnitude in [2.449047e-04, 1.000000e+00]
                     'probing':   7627 rows, 6269 columns, 43808 entries with magnitude in [1.551390e-03, 1.000000e+00]
              'probing_max_lp':   8090 rows, 6282 columns, 45129 entries with magnitude in [1.886557e-04, 1.000000e+00]
                'pseudo_costs':   5967 rows, 6282 columns, 22009 entries with magnitude in [2.227852e-03, 1.000000e+00]
               'quick_restart':   6635 rows, 6269 columns, 25861 entries with magnitude in [9.370484e-04, 1.000000e+00]
               'reduced_costs':   6086 rows, 6282 columns, 22777 entries with magnitude in [7.253961e-04, 1.000000e+00]

Lp debug                         CutPropag  CutEqPropag     Adjust  Overflow            Bad  BadScaling
                  'default_lp':         12          122    117'731         0     16'366'000           0
                       'fixed':          1            0          0         0          2'205           0
                   'fs_random':          1            0          0         0          2'209           0
                   'fs_random':          1            0          0         0          2'242           0
     'fs_random_quick_restart':          1            0          0         0          2'178           0
     'fs_random_quick_restart':          1            0          0         0          2'199           0
              'lb_tree_search':        167          360  6'577'315         0     75'490'239           0
                      'max_lp':        124          158  1'992'667         0     35'694'480           0
         'objective_lb_search':         61          452    347'992         0     50'057'629           0
  'objective_lb_search_max_lp':          9           93  1'803'763         0     23'193'231           0
                     'probing':        492        2'175      5'213         0  1'294'915'818           0
              'probing_max_lp':      1'189        1'702     82'553         0  1'782'712'451           0
                'pseudo_costs':        325          534    364'878         0    103'965'001           0
               'quick_restart':        679        1'848    569'250         0    450'769'082           0
               'reduced_costs':        256          390    985'612         0     85'533'650           0

Lp pool                          Constraints  Updates  Simplif  Merged  Shortened      Split  Strenghtened            Cuts/Call
                  'default_lp':       16'439    2'822   15'586      97          0     50'533        48'703    526'182/1'999'061
                       'fixed':        9'572        0        2       0          0          0           683         2'218/17'803
                   'fs_random':        7'807        0        2       0          0          0           681            453/1'390
                   'fs_random':        7'891        0        2       0          0          0           683            537/2'008
     'fs_random_quick_restart':        7'809        0        2       0          0          0           678            455/1'498
     'fs_random_quick_restart':        7'835        0        2       0          0          0           682            481/1'566
              'lb_tree_search':       75'049    6'056  554'303      34          0    478'206       569'154       94'322/240'212
                      'max_lp':       75'635    4'093  474'910      33          0    373'081       522'960      345'907/678'416
         'objective_lb_search':       17'225    9'735   20'938      62          0    228'534        97'515  1'087'933/2'792'616
  'objective_lb_search_max_lp':       74'890    2'215  547'030      22          0    221'821       557'484       65'151/145'894
                     'probing':       16'422   50'875   15'903       4          0  1'027'118       114'768      532'072/980'117
              'probing_max_lp':       75'191   48'594  552'528      17          0  5'661'106       605'172      268'447/602'680
                'pseudo_costs':       75'250   10'874  545'852      37          0  1'161'010       719'092  1'238'526/2'307'627
               'quick_restart':       16'418   48'092   18'614      79          0  3'367'239       561'582  5'432'143/9'731'511
               'reduced_costs':       75'164   10'698  430'153      53          0  1'321'113       543'773    796'456/1'609'936

Lp Cut                                                      fs_ran  fs_ran  fs_ran  fs_ran   defaul  fixed   max_lp     quick_   reduce   pseudo  lb_tre  probin   object  probin  object
                                                    CG_FF:      37      37      37      37   25'330     37   16'489    157'797   41'547   70'619   2'128  17'424   38'829   3'223   1'665
                                                     CG_K:      28      28      28      28   19'808     28   18'482    111'071   50'988   81'140   5'976   9'008   35'614   2'345   1'991
                                                    CG_KL:       -       -       -       -      280      -       19      1'844      115      278       -     120      565       4       2
                                                     CG_R:      24      24      24      24   12'406     24    9'913     97'664   22'136   35'311   2'085  12'292   21'915   2'827   2'892
                                                    CG_RB:      12      12      12      12   50'292     12   36'555    529'757   83'907  153'824   6'243  67'581  126'967   6'589   5'556
                                                   CG_RBP:       4       4       4       4    4'533      4    6'866     45'005   16'250   22'984   1'463   4'494   11'181   1'107   1'099
                                                   Clique:       -       -       -       -        -      -    3'595          -    8'941   19'620     353       -        -   1'338     400
                                                       IB:     116     107     194     138  262'720  1'873  106'647  2'669'702  207'259  303'190  18'398  48'891  568'977  32'823  15'996
                                                 MIR_1_FF:      74      76      76      76   15'911     75   13'367    165'201   34'744   55'848   3'164  25'027   27'397  11'377   2'385
                                                  MIR_1_K:      23      23      23      23    1'933     23    2'269     28'369    5'842    7'524     354   1'902    3'264   1'380     362
                                                 MIR_1_KL:       -       -       -       -      211      -      753      8'244    1'407    1'147     132     685      710   1'137     133
                                                  MIR_1_R:      20      21      21      20    2'882     20    1'998     35'539    6'079    9'102     838   7'028    4'336   3'409     567
                                                 MIR_1_RB:      26      26      26      25   23'933     25   31'411    324'610   78'122  109'196   9'159  63'273   47'110  29'041   7'006
                                                MIR_1_RBP:       3       3       3       3    1'545      3    8'231     29'506   20'508   26'031   1'530   4'311    4'306   3'070   1'480
                                                MIR_1_RLT:       -       -       -       -        -      -      397          -    1'010    1'779      79       -        -     355      68
                                                 MIR_2_FF:      11      11      10      10   11'400     12    7'654    101'924   20'212   33'521   1'871  13'673   18'984   7'063   1'433
                                                  MIR_2_K:       6       8       7       7    1'821      6    1'598     16'328    3'928    5'928     350   1'360    2'752   1'066     296
                                                 MIR_2_KL:       -       -       -       -      212      -      580      5'935    1'022      884     118     583      541   1'096      92
                                                  MIR_2_R:       5       5       5       5    2'543      6    1'600     23'726    4'311    6'950   1'174   9'241    3'855   5'042     555
                                                 MIR_2_RB:      17      19      18      17   17'129     20   13'135    221'233   32'981   52'527   4'523  43'982   33'559  15'766   2'951
                                                MIR_2_RBP:       1       2       1       1    1'435      1    2'863     23'885    6'940   10'455     750   3'641    3'545   2'167     609
                                                 MIR_3_FF:       1       4       3       3    7'466      2    4'822     66'604   11'968   20'712   1'243   8'055   12'530   4'181     958
                                                  MIR_3_K:       5       3       5       4    1'591      7    1'442     12'017    3'503    5'396     277   1'018    2'270     986     246
                                                 MIR_3_KL:       -       -       -       -      180      -      423      5'553      858      841     116     532      530     888      75
                                                  MIR_3_R:       1       1       -       -    1'744      -    1'087     16'964    2'729    4'320   1'102   5'996    2'842   4'034     456
                                                 MIR_3_RB:       9      11      11      12   11'195     14    7'187    137'343   18'180   29'431   2'632  26'172   21'466   9'136   1'647
                                                MIR_3_RBP:       2       2       2       2    1'090      2    1'487     16'350    3'564    5'123     404   2'563    2'625   1'297     339
                                                 MIR_4_FF:       2       3       3       3    4'681      3    2'590     42'813    6'532   12'291     609   5'206    8'232   2'155     436
                                                  MIR_4_K:       -       -       -       -    1'044      -      858      8'396    2'016    3'130     173     770    1'574     693     143
                                                 MIR_4_KL:       -       -       -       -      129      -      356      4'253      687      656     133     521      387     862      97
                                                  MIR_4_R:       -       -       -       -    1'055      -      578     11'882    1'478    2'414     478   3'485    2'036   1'996     210
                                                 MIR_4_RB:       1       1       3       2    7'087      1    3'791     86'567    9'318   16'802   1'240  15'343   13'626   4'688     794
                                                MIR_4_RBP:       -       -       -       -      532      -      751      9'162    1'643    2'339     263   1'622    1'440     853     188
                                                 MIR_5_FF:       1       2       1       1    3'118      2    1'571     28'703    3'807    8'053     412   3'720    5'479   1'671     267
                                                  MIR_5_K:       1       1       -       -      588      1      546      6'328    1'171    1'863     102     627    1'060     503      93
                                                 MIR_5_KL:       -       -       -       -      128      -      339      4'610      698      633     145     689      466     937      99
                                                  MIR_5_R:       -       -       -       -      685      -      296      7'006      829    1'450     237   2'017    1'174   1'208     117
                                                 MIR_5_RB:       -       -       -       1    4'608      1    2'262     60'314    5'529   10'475     640  10'368    9'152   2'890     438
                                                MIR_5_RBP:       -       -       -       -      324      -      397      6'065      899    1'339     177     943      900     712     127
                                                 MIR_6_FF:       1       2       1       1    2'196      -      991     20'267    2'465    5'511     321   2'748    3'766     959     215
                                                  MIR_6_K:       -       -       -       -      455      -      339      5'004      854    1'202     106     671      834     385      61
                                                 MIR_6_KL:       -       -       -       -      141      -      335      4'826      800      827     173   1'137      542   1'032     103
                                                  MIR_6_R:       -       -       -       -      489      -      229      4'369      608    1'117     157   1'258      754     670      83
                                                 MIR_6_RB:       1       -       1       1    3'303      1    1'561     46'684    3'606    7'023     436   8'778    7'276   2'152     294
                                                MIR_6_RBP:       -       -       -       -      230      -      259      4'719      729      879     158     834      692     592     101
         NoOverlapCompletionTimeExhaustiveMirror_weighted:       -       -       -       -        -      -        4          -        9       22       -       -        -       -       1
  NoOverlapCompletionTimeExhaustiveMirror_weighted_lifted:       -       -       -       -        -      -        2          -        -        4       -       -        -       -       -
               NoOverlapCompletionTimeExhaustive_weighted:       -       -       -       -        -      -      287          -      889    1'841       1       -        -       1      25
        NoOverlapCompletionTimeExhaustive_weighted_lifted:       -       -       -       -        -      -      365          -    1'120    2'241       4       -        -       4      27
                          NoOverlapCompletionTimeQueyrane:       -       -       -       -        -      -      106          -      364      441      13       -        -       5      14
                   NoOverlapCompletionTimeQueyrane_lifted:       -       -       -       -        -      -       75          -      251      424       1       -        -       1       9
                                NoOverlapDisjunctionOnEnd:       -       -       -       -        -      -       11          -       48       60       -       -        -       -       3
                              NoOverlapDisjunctionOnStart:       -       -       -       -        -      -      444          -    1'247    2'705       5       -        -       5      42
                                             ZERO_HALF_FF:       6       5       6       6    4'116      5    3'359     31'535    8'346   14'178     456   4'332    6'284   1'159     376
                                              ZERO_HALF_K:       4       4       3       4    1'292      2    2'335      9'032    6'510    9'405     397     938    2'012     816     336
                                             ZERO_HALF_KL:       -       -       -       -       37      -       24      1'104       76       98       3      70      198      16       5
                                              ZERO_HALF_R:       6       6       5       7    3'948      5   10'344     90'206   20'775   21'980  17'340  63'600    9'584  74'485   6'962
                                             ZERO_HALF_RB:       2       1       1       1    5'400      -    7'574     67'758   19'321   26'569   2'339  16'678   11'083   7'284   1'561
                                            ZERO_HALF_RBP:       3       3       3       3    1'006      3    2'058     18'369    4'780    6'873   1'341   6'865    2'712   6'966     665

LNS stats                        Improv/Calls  Closed  Difficulty  TimeLimit
               'graph_arc_lns':    6583/18201     50%        1.00       0.10
               'graph_cst_lns':    7391/18200     50%        1.00       0.10
               'graph_dec_lns':    6906/18200     50%        1.00       0.10
               'graph_var_lns':    8016/18201     50%        1.00       0.10
                   'rins/rens':    2885/16954     50%        0.94       0.11
                 'rnd_cst_lns':    7206/18201     50%        1.00       0.10
                 'rnd_var_lns':    6927/18201     50%        1.00       0.10
    'scheduling_intervals_lns':   18201/18201      0%        0.00       0.10
  'scheduling_precedences_lns':   18200/18200      0%        0.00       0.10
  'scheduling_time_window_lns':   18200/18200      0%        0.00       0.10

LS stats                   Batches  Restarts    LinMoves    GenMoves  CompoundMoves  WeightUpdates
       'fj_long_default':        5         1      49'889           0              0            111
   'fj_long_lin_default':        5         1           0       6'621          1'693              0
        'fj_long_random':        5         1      49'892           0              0            108
      'fj_short_default':        5         1           0       8'216          1'605              0
  'fj_short_lin_default':        4         1           0       7'324          1'616              0
   'fj_short_lin_random':        5         1           0       7'485          1'934              0
       'fj_short_random':        7         1           0       9'809          1'958              0
          'violation_ls':   18'202         0  85'414'725  11'530'981        480'927      3'748'098
          'violation_ls':   18'202         0  88'644'814  11'361'272        588'423      2'784'351

Solutions (110)                     Num      Rank
  'fs_random_quick_restart_no_lp':    1     [1,1]
                  'graph_arc_lns':    5   [32,86]
                  'graph_cst_lns':    6  [35,100]
                  'graph_dec_lns':    9  [23,110]
                  'graph_var_lns':   12   [10,99]
                  'quick_restart':    2  [93,108]
            'quick_restart_no_lp':   12   [11,91]
                    'rins_lp_lns':   12    [9,98]
                  'rins_pump_lns':    4  [63,109]
                    'rnd_cst_lns':    5  [52,106]
                    'rnd_var_lns':   11  [14,104]
                   'violation_ls':   31   [2,102]

Objective bounds                      Num
                   'initial_domain':    1
                            'no_lp':    1
       'objective_lb_search_max_lp':   58
        'objective_lb_search_no_lp':    3
  'objective_shaving_search_max_lp':    2
                    'reduced_costs':    4

Solution repositories     Added  Queried  Ignored  Synchro
  'feasible solutions':  80'433  414'173        0   79'407
        'lp solutions':  38'260    9'331        0   37'664
                'pump':  93'451    8'871

Improving bounds shared             Num
                  'default_lp':      67
              'lb_tree_search':     277
                      'max_lp':     363
                       'no_lp':   1'004
         'objective_lb_search':      91
  'objective_lb_search_max_lp':       6
                     'probing':  18'566
              'probing_max_lp':  82'717
                'pseudo_costs':     880
               'quick_restart':   1'316
         'quick_restart_no_lp':   2'638
               'reduced_costs':   1'044

Clauses shared                   Num
                        'core':    2
                  'default_lp':   41
              'lb_tree_search':    4
                      'max_lp':   21
                       'no_lp':   10
         'objective_lb_search':   13
  'objective_lb_search_max_lp':   11
   'objective_lb_search_no_lp':   11
                'pseudo_costs':   49
               'quick_restart':   20
         'quick_restart_no_lp':   60
               'reduced_costs':    1

CpSolverResponse summary:
status: FEASIBLE
objective: 4132
best_bound: 2101
integers: 6274
booleans: 445
conflicts: 0
branches: 896
propagations: 233
integer_propagations: 316966
restarts: 890
lp_iterations: 2193
walltime: 86402.8
usertime: 86402.8
deterministic_time: 213367
gap_integral: 1.6261e+06
solution_fingerprint: 0x3ef0942cd134c860


--- Simulation Gantt  partir du modle mathmatique ---
