created virtual environment CPython3.12.4.final.0-64 in 15776ms
  creator CPython3Posix(dest=/localscratch/aneumann.63393220.0/env, clear=False, no_vcs_ignore=False, global=False)
  seeder FromAppData(download=False, pip=bundle, via=copy, app_data_dir=/home/aneumann/.local/share/virtualenv)
    added seed packages: pip==25.1.1
  activators BashActivator,CShellActivator,FishActivator,NushellActivator,PowerShellActivator,PythonActivator
Looking in links: /cvmfs/soft.computecanada.ca/custom/python/wheelhouse/gentoo2023/x86-64-v3, /cvmfs/soft.computecanada.ca/custom/python/wheelhouse/gentoo2023/generic, /cvmfs/soft.computecanada.ca/custom/python/wheelhouse/generic
Requirement already satisfied: pip in /localscratch/aneumann.63393220.0/env/lib/python3.12/site-packages (25.1.1)
Looking in links: /cvmfs/soft.computecanada.ca/custom/python/wheelhouse/gentoo2023/x86-64-v3, /cvmfs/soft.computecanada.ca/custom/python/wheelhouse/gentoo2023/generic, /cvmfs/soft.computecanada.ca/custom/python/wheelhouse/generic
ERROR: protobuf-5.28.3-cp38-abi3-manylinux2014_x86_64.whl is not a supported wheel on this platform.
Looking in links: /cvmfs/soft.computecanada.ca/custom/python/wheelhouse/gentoo2023/x86-64-v3, /cvmfs/soft.computecanada.ca/custom/python/wheelhouse/gentoo2023/generic, /cvmfs/soft.computecanada.ca/custom/python/wheelhouse/generic
Processing /home/aneumann/projects/def-adhaj/aneumann/GNRS/wheels/immutabledict-4.2.0-py3-none-any.whl
Installing collected packages: immutabledict
Successfully installed immutabledict-4.2.0
Looking in links: /cvmfs/soft.computecanada.ca/custom/python/wheelhouse/gentoo2023/x86-64-v3, /cvmfs/soft.computecanada.ca/custom/python/wheelhouse/gentoo2023/generic, /cvmfs/soft.computecanada.ca/custom/python/wheelhouse/generic
Processing /cvmfs/soft.computecanada.ca/custom/python/wheelhouse/generic/ortools-9.10.4067+computecanada-cp312-cp312-linux_x86_64.whl (from -r /home/aneumann/projects/def-adhaj/aneumann/GNRS/requirements/or.txt (line 1))
Processing /cvmfs/soft.computecanada.ca/custom/python/wheelhouse/gentoo2023/x86-64-v3/matplotlib-3.10.0+computecanada-cp312-cp312-linux_x86_64.whl (from -r /home/aneumann/projects/def-adhaj/aneumann/GNRS/requirements/or.txt (line 2))
Processing /cvmfs/soft.computecanada.ca/custom/python/wheelhouse/gentoo2023/x86-64-v3/pandas-2.2.3+computecanada-cp312-cp312-linux_x86_64.whl (from -r /home/aneumann/projects/def-adhaj/aneumann/GNRS/requirements/or.txt (line 3))
Processing /cvmfs/soft.computecanada.ca/custom/python/wheelhouse/generic/absl_py-2.2.2+computecanada-py3-none-any.whl (from ortools<9.11,>=9.10->-r /home/aneumann/projects/def-adhaj/aneumann/GNRS/requirements/or.txt (line 1))
Processing /cvmfs/soft.computecanada.ca/custom/python/wheelhouse/gentoo2023/generic/numpy-2.2.2+computecanada-cp312-cp312-linux_x86_64.whl (from ortools<9.11,>=9.10->-r /home/aneumann/projects/def-adhaj/aneumann/GNRS/requirements/or.txt (line 1))
Processing /cvmfs/soft.computecanada.ca/custom/python/wheelhouse/gentoo2023/x86-64-v3/protobuf-6.30.2+computecanada-cp312-cp312-linux_x86_64.whl (from ortools<9.11,>=9.10->-r /home/aneumann/projects/def-adhaj/aneumann/GNRS/requirements/or.txt (line 1))
Requirement already satisfied: immutabledict>=3.0.0 in /localscratch/aneumann.63393220.0/env/lib/python3.12/site-packages (from ortools<9.11,>=9.10->-r /home/aneumann/projects/def-adhaj/aneumann/GNRS/requirements/or.txt (line 1)) (4.2.0)
Processing /cvmfs/soft.computecanada.ca/custom/python/wheelhouse/gentoo2023/generic/contourpy-1.3.1+computecanada-cp312-cp312-linux_x86_64.whl (from matplotlib->-r /home/aneumann/projects/def-adhaj/aneumann/GNRS/requirements/or.txt (line 2))
Processing /cvmfs/soft.computecanada.ca/custom/python/wheelhouse/generic/cycler-0.12.1+computecanada-py3-none-any.whl (from matplotlib->-r /home/aneumann/projects/def-adhaj/aneumann/GNRS/requirements/or.txt (line 2))
Processing /cvmfs/soft.computecanada.ca/custom/python/wheelhouse/generic/fonttools-4.58.2+computecanada-cp312-cp312-linux_x86_64.whl (from matplotlib->-r /home/aneumann/projects/def-adhaj/aneumann/GNRS/requirements/or.txt (line 2))
Processing /cvmfs/soft.computecanada.ca/custom/python/wheelhouse/gentoo2023/x86-64-v3/kiwisolver-1.4.8+computecanada-cp312-cp312-linux_x86_64.whl (from matplotlib->-r /home/aneumann/projects/def-adhaj/aneumann/GNRS/requirements/or.txt (line 2))
Processing /cvmfs/soft.computecanada.ca/custom/python/wheelhouse/generic/packaging-25.0+computecanada-py3-none-any.whl (from matplotlib->-r /home/aneumann/projects/def-adhaj/aneumann/GNRS/requirements/or.txt (line 2))
Processing /cvmfs/soft.computecanada.ca/custom/python/wheelhouse/gentoo2023/x86-64-v3/pillow-11.1.0+computecanada-cp312-cp312-linux_x86_64.whl (from matplotlib->-r /home/aneumann/projects/def-adhaj/aneumann/GNRS/requirements/or.txt (line 2))
Processing /cvmfs/soft.computecanada.ca/custom/python/wheelhouse/generic/pyparsing-3.2.1+computecanada-py3-none-any.whl (from matplotlib->-r /home/aneumann/projects/def-adhaj/aneumann/GNRS/requirements/or.txt (line 2))
Processing /cvmfs/soft.computecanada.ca/custom/python/wheelhouse/generic/python_dateutil-2.9.0.post0+computecanada-py2.py3-none-any.whl (from matplotlib->-r /home/aneumann/projects/def-adhaj/aneumann/GNRS/requirements/or.txt (line 2))
Processing /cvmfs/soft.computecanada.ca/custom/python/wheelhouse/generic/pytz-2025.2+computecanada-py2.py3-none-any.whl (from pandas->-r /home/aneumann/projects/def-adhaj/aneumann/GNRS/requirements/or.txt (line 3))
Processing /cvmfs/soft.computecanada.ca/custom/python/wheelhouse/generic/tzdata-2025.2+computecanada-py2.py3-none-any.whl (from pandas->-r /home/aneumann/projects/def-adhaj/aneumann/GNRS/requirements/or.txt (line 3))
Processing /cvmfs/soft.computecanada.ca/custom/python/wheelhouse/generic/six-1.17.0+computecanada-py2.py3-none-any.whl (from python-dateutil>=2.7->matplotlib->-r /home/aneumann/projects/def-adhaj/aneumann/GNRS/requirements/or.txt (line 2))
Installing collected packages: pytz, tzdata, six, pyparsing, protobuf, pillow, packaging, numpy, kiwisolver, fonttools, cycler, absl-py, python-dateutil, contourpy, pandas, matplotlib, ortools

Successfully installed absl-py-2.2.2+computecanada contourpy-1.3.1+computecanada cycler-0.12.1+computecanada fonttools-4.58.2+computecanada kiwisolver-1.4.8+computecanada matplotlib-3.10.0+computecanada numpy-2.2.2+computecanada ortools-9.10.4067+computecanada packaging-25.0+computecanada pandas-2.2.3+computecanada pillow-11.1.0+computecanada protobuf-6.30.2+computecanada pyparsing-3.2.1+computecanada python-dateutil-2.9.0.post0+computecanada pytz-2025.2+computecanada six-1.17.0+computecanada tzdata-2025.2+computecanada

Starting CP-SAT solver v9.10.4067
Parameters: max_time_in_seconds: 3600 max_memory_in_mb: 12000 log_search_progress: true enumerate_all_solutions: false absolute_gap_limit: 0 relative_gap_limit: 0
Setting number of workers to 48

Initial optimization model '': (model_fingerprint: 0x7cd8576d01b75108)
#Variables: 358 (#ints: 8 in objective)
  - 263 Booleans in [0,1]
  - 95 in [0,794]
#kLinear1: 46
#kLinear2: 629
#kLinear3: 159
#kLinearN: 3'287 (#terms: 47'263)

Starting presolve at 0.00s
  2.66e-03s  0.00e+00d  [DetectDominanceRelations] 
  5.64e-02s  0.00e+00d  [PresolveToFixPoint] #num_loops=6 #num_dual_strengthening=3 
  3.75e-05s  0.00e+00d  [ExtractEncodingFromLinear] #potential_supersets=4 
[Symmetry] Graph for symmetry has 4'135 nodes and 37'906 arcs.
[Symmetry] Symmetry computation done. time: 0.00335898 dtime: 0.00353749
[Symmetry] #generators: 1, average support size: 22
[Symmetry] The model contains 407 duplicate constraints !
[Symmetry] 11 orbits with sizes: 2,2,2,2,2,2,2,2,2,2,...
[Symmetry] Num fixable by intersecting at_most_one with orbits: 1 largest_orbit: 2
  1.64e-02s  2.26e-03d  [Probe] #probed=398 #fixed_bools=6 #new_bounds=24 #equiv=1 
  6.70e-05s  0.00e+00d  [MaxClique] Merged 18(36 literals) into 11(22 literals) at_most_ones. 
  2.61e-03s  0.00e+00d  [DetectDominanceRelations] 
  3.10e-02s  0.00e+00d  [PresolveToFixPoint] #num_loops=4 #num_dual_strengthening=3 
  9.36e-03s  0.00e+00d  [ProcessAtMostOneAndLinear] 
  3.86e-03s  0.00e+00d  [DetectDuplicateConstraints] #duplicates=485 #without_enforcements=133 
  2.89e-03s  1.30e-04d  [DetectDominatedLinearConstraints] #relevant_constraints=2'647 #num_inclusions=1'462 #num_redundant=2 
  4.59e-04s  0.00e+00d  [DetectDifferentVariables] #different=46 
  8.74e-04s  5.06e-05d  [ProcessSetPPC] #relevant_constraints=2'233 
  3.39e-05s  0.00e+00d  [FindAlmostIdenticalLinearConstraints] 
  3.12e-04s  2.70e-04d  [FindBigAtMostOneAndLinearOverlap] 
  1.03e-02s  3.25e-03d  [FindBigVerticalLinearOverlap] #blocks=56 #saved_nz=6'000 
  4.55e-04s  1.17e-04d  [FindBigHorizontalLinearOverlap] #linears=2'125 
  1.95e-05s  0.00e+00d  [MergeClauses] 
  2.79e-03s  0.00e+00d  [DetectDominanceRelations] 
  3.09e-02s  0.00e+00d  [PresolveToFixPoint] #num_loops=2 #num_dual_strengthening=1 
  2.78e-03s  0.00e+00d  [DetectDominanceRelations] 
  1.79e-02s  0.00e+00d  [PresolveToFixPoint] #num_loops=1 #num_dual_strengthening=1 
[Symmetry] Graph for symmetry has 3'768 nodes and 30'152 arcs.
[Symmetry] Symmetry computation done. time: 0.0011501 dtime: 0.00174438
  1.49e-02s  2.04e-03d  [Probe] #probed=386 #new_bounds=55 
  1.83e-05s  0.00e+00d  [MaxClique] 
  2.77e-03s  0.00e+00d  [DetectDominanceRelations] 
  2.92e-02s  0.00e+00d  [PresolveToFixPoint] #num_loops=2 #num_dual_strengthening=1 
  8.45e-03s  0.00e+00d  [ProcessAtMostOneAndLinear] 
  3.24e-03s  0.00e+00d  [DetectDuplicateConstraints] #without_enforcements=165 
  1.75e-03s  8.04e-05d  [DetectDominatedLinearConstraints] #relevant_constraints=2'364 #num_inclusions=28 
  4.74e-04s  0.00e+00d  [DetectDifferentVariables] #different=55 #cliques=2 #size=6 
  7.77e-04s  3.72e-05d  [ProcessSetPPC] #relevant_constraints=2'051 
  4.57e-05s  7.50e-08d  [FindAlmostIdenticalLinearConstraints] #num_tested_pairs=5 
  1.65e-04s  1.15e-04d  [FindBigAtMostOneAndLinearOverlap] 
  7.67e-03s  2.43e-03d  [FindBigVerticalLinearOverlap] #blocks=68 #saved_nz=5'426 
  3.80e-04s  8.07e-05d  [FindBigHorizontalLinearOverlap] #linears=1'791 
  1.99e-05s  0.00e+00d  [MergeClauses] 
  2.40e-03s  0.00e+00d  [DetectDominanceRelations] 
  3.29e-02s  0.00e+00d  [PresolveToFixPoint] #num_loops=3 #num_dual_strengthening=1 
  2.39e-03s  0.00e+00d  [DetectDominanceRelations] 
  2.14e-02s  0.00e+00d  [PresolveToFixPoint] #num_loops=1 #num_dual_strengthening=1 
  1.41e-02s  1.80e-03d  [Probe] #probed=386 #new_bounds=64 
  1.90e-05s  0.00e+00d  [MaxClique] 
  2.37e-03s  0.00e+00d  [DetectDominanceRelations] 
  3.21e-02s  0.00e+00d  [PresolveToFixPoint] #num_loops=2 #num_dual_strengthening=1 
  7.51e-03s  0.00e+00d  [ProcessAtMostOneAndLinear] 
  3.12e-03s  0.00e+00d  [DetectDuplicateConstraints] #without_enforcements=172 
  1.47e-03s  6.18e-05d  [DetectDominatedLinearConstraints] #relevant_constraints=2'309 #num_inclusions=28 
  3.33e-04s  0.00e+00d  [DetectDifferentVariables] 
  6.05e-04s  2.41e-05d  [ProcessSetPPC] #relevant_constraints=1'719 
  6.53e-05s  8.55e-07d  [FindAlmostIdenticalLinearConstraints] #num_tested_pairs=38 
  1.45e-04s  8.74e-05d  [FindBigAtMostOneAndLinearOverlap] 
  4.60e-03s  1.53e-03d  [FindBigVerticalLinearOverlap] #blocks=49 #saved_nz=3'183 
  2.95e-04s  5.40e-05d  [FindBigHorizontalLinearOverlap] #linears=1'316 
  1.96e-05s  0.00e+00d  [MergeClauses] 
  2.13e-03s  0.00e+00d  [DetectDominanceRelations] 
  2.63e-02s  0.00e+00d  [PresolveToFixPoint] #num_loops=2 #num_dual_strengthening=1 
  1.36e-04s  0.00e+00d  [ExpandObjective] #entries=931 #tight_variables=241 #tight_constraints=140 

Presolve summary:
  - 85 affine relations were detected.
  - rule 'TODO dual: only one blocking constraint?' was applied 666 times.
  - rule 'TODO dual: only one unspecified blocking constraint?' was applied 104 times.
  - rule 'TODO duplicate: identical constraint with different enforcements' was applied 470 times.
  - rule 'TODO no_overlap: with task always last' was applied 2 times.
  - rule 'affine: new relation' was applied 85 times.
  - rule 'all_diff: inferred from x != y constraints' was applied 2 times.
  - rule 'at_most_one: removed literals' was applied 11 times.
  - rule 'at_most_one: size one' was applied 11 times.
  - rule 'at_most_one: transformed into max clique.' was applied 1 time.
  - rule 'deductions: 366 stored' was applied 1 time.
  - rule 'dual: fix variable' was applied 21 times.
  - rule 'dual: reduced domain' was applied 45 times.
  - rule 'duplicate: merged rhs of linear constraint' was applied 82 times.
  - rule 'duplicate: removed constraint' was applied 485 times.
  - rule 'enforcement: false literal' was applied 32 times.
  - rule 'enforcement: true literal' was applied 28 times.
  - rule 'exactly_one: x and not(x)' was applied 1 time.
  - rule 'incompatible linear: add implication' was applied 63 times.
  - rule 'linear inclusion: redundant containing constraint' was applied 2 times.
  - rule 'linear matrix: common vertical rectangle' was applied 173 times.
  - rule 'linear: always true' was applied 554 times.
  - rule 'linear: doubleton free' was applied 13 times.
  - rule 'linear: empty' was applied 32 times.
  - rule 'linear: extracted enforcement literal' was applied 5'957 times.
  - rule 'linear: fixed or dup variables' was applied 3'409 times.
  - rule 'linear: positive equal one' was applied 4 times.
  - rule 'linear: reduced variable domains' was applied 303 times.
  - rule 'linear: remapped using affine relations' was applied 3'307 times.
  - rule 'linear: simplified rhs' was applied 12'913 times.
  - rule 'linear: variable substitution 1' was applied 13 times.
  - rule 'linear: variable substitution 2' was applied 11 times.
  - rule 'presolve: 96 unused variables removed.' was applied 1 time.
  - rule 'presolve: iteration' was applied 3 times.
  - rule 'probing: reduced enforced constraint to implication.' was applied 18 times.
  - rule 'symmetry: fixed to false in general orbit' was applied 1 time.

Presolved optimization model '': (model_fingerprint: 0x2a14103ea47a0a9f)
#Variables: 326 (#ints: 8 in objective)
  - 95 Booleans in [0,1]
  - 181 different domains in [-7013,7752] with a largest complexity of 13.
#kAllDiff: 2
#kExactlyOne: 3 (#literals: 9)
#kLinear2: 841 (#enforced: 770 #multi: 544)
#kLinear3: 513 (#enforced: 433)
#kLinearN: 1'705 (#enforced: 1'547) (#terms: 12'368)

Preloading model.
#Bound   0.42s best:inf   next:[188,5436] initial_domain
#Model   0.42s var:326/326 constraints:3064/3064

Starting search at 0.42s with 48 workers.
16 full problem subsolvers: [core, default_lp, lb_tree_search, max_lp, no_lp, objective_lb_search, objective_lb_search_max_lp, objective_lb_search_no_lp, objective_shaving_search_max_lp, objective_shaving_search_no_lp, probing, probing_max_lp, pseudo_costs, quick_restart, quick_restart_no_lp, reduced_costs]
30 first solution subsolvers: [fj_long_default(2), fj_long_lin_default, fj_long_lin_perturb, fj_long_lin_random, fj_long_perturb, fj_long_random, fj_short_default(2), fj_short_lin_default(2), fj_short_lin_perturb, fj_short_lin_random, fj_short_perturb, fj_short_random, fs_random(4), fs_random_no_lp(4), fs_random_quick_restart(4), fs_random_quick_restart_no_lp(3)]
13 incomplete subsolvers: [feasibility_pump, graph_arc_lns, graph_cst_lns, graph_dec_lns, graph_var_lns, rins/rens, rnd_cst_lns, rnd_var_lns, violation_ls(5)]
3 helper subsolvers: [neighborhood_helper, synchronization_agent, update_gap_integral]
#Bound   0.48s best:inf   next:[229,5436] objective_lb_search_no_lp
#Bound   0.49s best:inf   next:[258,5436] objective_lb_search_no_lp
#Bound   0.49s best:inf   next:[280,5436] objective_lb_search_no_lp
#1       0.50s best:2505  next:[280,2504] no_lp (fixed_bools=0/121)
#Bound   0.51s best:2505  next:[335,2504] objective_lb_search_no_lp
#Bound   0.51s best:2505  next:[336,2504] objective_lb_search_no_lp
#2       0.52s best:2504  next:[336,2503] violation_ls(batch:1 #solutions_imported:1 #lin_moves:819 #lin_evals:2'620 #weight_updates:164)
#3       0.53s best:2344  next:[336,2343] no_lp (fixed_bools=0/138)
#4       0.54s best:2320  next:[336,2319] no_lp (fixed_bools=0/144)
#Bound   0.55s best:2320  next:[350,2319] objective_lb_search_no_lp
#Bound   0.55s best:2320  next:[354,2319] objective_lb_search_no_lp
#5       0.56s best:2281  next:[354,2280] no_lp (fixed_bools=0/147)
#Bound   0.57s best:2281  next:[528,2280] objective_lb_search_no_lp
#6       0.57s best:2267  next:[528,2266] no_lp (fixed_bools=0/152)
#7       0.60s best:2262  next:[528,2261] graph_var_lns (d=0.88 s=101 t=0.10 p=1.00 stall=2 h=auto_l0)
#8       0.60s best:2260  next:[528,2259] violation_ls(batch:2 #solutions_imported:2 #lin_moves:0 #lin_evals:16'911 #gen_moves:6'637 #gen_evals:1'373 #comp_moves:787 #backtracks:2'925 #weight_updates:83)
#9       0.60s best:2258  next:[528,2257] violation_ls(batch:3 #solutions_imported:3 #lin_moves:1 #lin_evals:16'919 #gen_moves:6'637 #gen_evals:1'373 #comp_moves:787 #backtracks:2'925 #weight_updates:83)
#10      0.60s best:2256  next:[528,2255] violation_ls(batch:4 #solutions_imported:4 #lin_moves:2 #lin_evals:16'926 #gen_moves:6'637 #gen_evals:1'373 #comp_moves:787 #backtracks:2'925 #weight_updates:83)
#11      0.61s best:2254  next:[528,2253] violation_ls(batch:5 #solutions_imported:5 #lin_moves:2 #lin_evals:16'929 #gen_moves:6'638 #gen_evals:1'373 #comp_moves:788 #backtracks:2'925 #weight_updates:83)
#12      0.61s best:2252  next:[528,2251] violation_ls(batch:6 #solutions_imported:6 #lin_moves:2 #lin_evals:16'933 #gen_moves:6'639 #gen_evals:1'373 #comp_moves:789 #backtracks:2'925 #weight_updates:83)
#13      0.61s best:2250  next:[528,2249] violation_ls(batch:7 #solutions_imported:7 #lin_moves:3 #lin_evals:16'939 #gen_moves:6'639 #gen_evals:1'373 #comp_moves:789 #backtracks:2'925 #weight_updates:83)
#14      0.61s best:2249  next:[528,2248] violation_ls(batch:8 #solutions_imported:8 #lin_moves:4 #lin_evals:16'947 #gen_moves:6'639 #gen_evals:1'373 #comp_moves:789 #backtracks:2'925 #weight_updates:83)
#15      0.61s best:2248  next:[528,2247] violation_ls(batch:9 #solutions_imported:9 #lin_moves:4 #lin_evals:16'962 #gen_moves:6'646 #gen_evals:1'373 #comp_moves:790 #backtracks:2'928 #weight_updates:83)
#16      0.61s best:2247  next:[528,2246] violation_ls(batch:10 #solutions_imported:10 #lin_moves:5 #lin_evals:16'970 #gen_moves:6'646 #gen_evals:1'373 #comp_moves:790 #backtracks:2'928 #weight_updates:83)
#17      0.61s best:2246  next:[528,2245] violation_ls(batch:2 #solutions_imported:2 #lin_moves:137 #lin_evals:14'427 #gen_moves:5'572 #gen_evals:1'025 #comp_moves:284 #backtracks:2'644 #weight_updates:150)
#18      0.61s best:2245  next:[528,2244] violation_ls(batch:3 #solutions_imported:3 #lin_moves:138 #lin_evals:14'435 #gen_moves:5'572 #gen_evals:1'025 #comp_moves:284 #backtracks:2'644 #weight_updates:150)
#19      0.61s best:2243  next:[528,2242] no_lp (fixed_bools=0/162)
#20      0.62s best:1968  next:[528,1967] no_lp (fixed_bools=0/173)
#Bound   0.62s best:1968  next:[584,1967] objective_lb_search_no_lp
#21      0.63s best:1919  next:[584,1918] no_lp (fixed_bools=0/182)
#22      0.66s best:1825  next:[584,1824] no_lp (fixed_bools=0/193)
#23      0.68s best:1816  next:[584,1815] quick_restart_no_lp (fixed_bools=0/148)
#24      0.68s best:1815  next:[584,1814] violation_ls(batch:3 #solutions_imported:3 #lin_moves:2 #lin_evals:33'581 #gen_moves:13'978 #gen_evals:2'805 #comp_moves:1'178 #backtracks:6'397 #weight_updates:181)
#25      0.68s best:1814  next:[584,1813] violation_ls(batch:4 #solutions_imported:4 #lin_moves:2 #lin_evals:33'606 #gen_moves:13'991 #gen_evals:2'805 #comp_moves:1'179 #backtracks:6'403 #weight_updates:181)
#26      0.68s best:1813  next:[584,1812] violation_ls(batch:5 #solutions_imported:5 #lin_moves:2 #lin_evals:33'653 #gen_moves:14'013 #gen_evals:2'806 #comp_moves:1'181 #backtracks:6'413 #weight_updates:181)
#27      0.69s best:1811  next:[584,1810] violation_ls(batch:6 #solutions_imported:6 #lin_moves:3 #lin_evals:33'660 #gen_moves:14'013 #gen_evals:2'806 #comp_moves:1'181 #backtracks:6'413 #weight_updates:181)
#28      0.70s best:1809  next:[584,1808] violation_ls(batch:7 #solutions_imported:7 #lin_moves:4 #lin_evals:33'668 #gen_moves:14'013 #gen_evals:2'806 #comp_moves:1'181 #backtracks:6'413 #weight_updates:181)
#29      0.70s best:1807  next:[584,1806] violation_ls(batch:8 #solutions_imported:8 #lin_moves:4 #lin_evals:33'687 #gen_moves:14'022 #gen_evals:2'806 #comp_moves:1'182 #backtracks:6'417 #weight_updates:181)
#30      0.70s best:1790  next:[584,1789] no_lp (fixed_bools=0/203)
#31      0.71s best:1786  next:[584,1785] no_lp (fixed_bools=0/209)
#32      0.72s best:1730  next:[584,1729] no_lp (fixed_bools=0/217)
#33      0.73s best:1635  next:[584,1634] no_lp (fixed_bools=0/227)
#34      0.75s best:1614  next:[584,1613] no_lp (fixed_bools=0/235)
#35      0.78s best:1599  next:[584,1598] rnd_var_lns (d=0.97 s=178 t=0.10 p=1.00 stall=0 h=auto_l0)
#36      0.80s best:1598  next:[584,1597] violation_ls(batch:10 #solutions_imported:10 #lin_moves:9'759 #lin_evals:70'044 #gen_moves:14'022 #gen_evals:2'806 #comp_moves:1'182 #backtracks:6'417 #weight_updates:654)
#37      0.81s best:1597  next:[584,1596] violation_ls(batch:11 #solutions_imported:11 #lin_moves:9'759 #lin_evals:71'095 #gen_moves:14'507 #gen_evals:2'818 #comp_moves:1'201 #backtracks:6'650 #weight_updates:661)
#38      0.81s best:1596  next:[584,1595] violation_ls(batch:16 #solutions_imported:16 #lin_moves:11'093 #lin_evals:90'801 #gen_moves:16'579 #gen_evals:2'546 #comp_moves:1'779 #backtracks:7'400 #weight_updates:10'307)
#39      0.81s best:1566  next:[584,1565] no_lp (fixed_bools=0/248)
#40      0.83s best:1557  next:[584,1556] no_lp (fixed_bools=0/250)
#41      0.84s best:1552  next:[584,1551] quick_restart_no_lp (fixed_bools=0/257)
#Bound   0.85s best:1552  next:[586,1551] objective_lb_search_no_lp
#42      0.92s best:1521  next:[586,1520] no_lp (fixed_bools=0/257)
#Bound   0.92s best:1521  next:[601,1520] objective_lb_search_no_lp
#43      0.92s best:1516  next:[601,1515] quick_restart_no_lp (fixed_bools=0/273)
#44      0.92s best:1512  next:[601,1511] rins_pump_lns (d=0.71 s=221 t=0.10 p=1.00 stall=1 h=auto_l0)
#45      0.95s best:1506  next:[601,1505] rins_pump_lns (d=0.71 s=224 t=0.10 p=1.00 stall=1 h=auto_l0)
#Bound   0.96s best:1506  next:[606,1505] objective_lb_search_no_lp
#46      0.97s best:1427  next:[606,1426] graph_var_lns (d=0.98 s=211 t=0.10 p=1.00 stall=0 h=auto_l0)
#47      0.98s best:1425  next:[606,1424] violation_ls(batch:9 #solutions_imported:9 #lin_moves:21'232 #lin_evals:155'880 #gen_moves:22'181 #gen_evals:3'411 #comp_moves:1'710 #backtracks:10'229 #weight_updates:20'063)
#48      0.99s best:1423  next:[606,1422] violation_ls(batch:8 #solutions_imported:8 #lin_moves:5'061 #lin_evals:114'596 #gen_moves:37'493 #gen_evals:5'491 #comp_moves:3'762 #backtracks:16'862 #weight_updates:5'428)
#49      0.99s best:1422  next:[606,1421] violation_ls(batch:9 #solutions_imported:9 #lin_moves:34'061 #lin_evals:147'491 #gen_moves:6'607 #gen_evals:1'241 #comp_moves:351 #backtracks:3'128 #weight_updates:6'251)
#50      0.99s best:1421  next:[606,1420] violation_ls(batch:10 #solutions_imported:10 #lin_moves:34'061 #lin_evals:147'495 #gen_moves:6'608 #gen_evals:1'241 #comp_moves:352 #backtracks:3'128 #weight_updates:6'251)
#51      0.99s best:1420  next:[606,1419] violation_ls(batch:11 #solutions_imported:11 #lin_moves:34'063 #lin_evals:147'513 #gen_moves:6'608 #gen_evals:1'241 #comp_moves:352 #backtracks:3'128 #weight_updates:6'252)
#52      0.99s best:1419  next:[606,1418] violation_ls(batch:12 #solutions_imported:12 #lin_moves:34'063 #lin_evals:147'516 #gen_moves:6'609 #gen_evals:1'241 #comp_moves:353 #backtracks:3'128 #weight_updates:6'252)
#53      0.99s best:1418  next:[606,1417] violation_ls(batch:13 #solutions_imported:13 #lin_moves:21'233 #lin_evals:155'930 #gen_moves:22'206 #gen_evals:3'411 #comp_moves:1'715 #backtracks:10'239 #weight_updates:20'063)
#54      0.99s best:1417  next:[606,1416] violation_ls(batch:13 #solutions_imported:13 #lin_moves:34'078 #lin_evals:147'606 #gen_moves:6'609 #gen_evals:1'241 #comp_moves:353 #backtracks:3'128 #weight_updates:6'266)
#55      1.00s best:1416  next:[606,1415] violation_ls(batch:13 #solutions_imported:13 #lin_moves:5'125 #lin_evals:114'894 #gen_moves:37'497 #gen_evals:5'491 #comp_moves:3'766 #backtracks:16'862 #weight_updates:5'457)
#56      1.00s best:1415  next:[606,1414] violation_ls(batch:14 #solutions_imported:14 #lin_moves:5'164 #lin_evals:115'101 #gen_moves:37'497 #gen_evals:5'491 #comp_moves:3'766 #backtracks:16'862 #weight_updates:5'491)
#57      1.00s best:1414  next:[606,1413] violation_ls(batch:14 #solutions_imported:14 #lin_moves:21'295 #lin_evals:156'229 #gen_moves:22'206 #gen_evals:3'411 #comp_moves:1'715 #backtracks:10'239 #weight_updates:20'111)
#58      1.00s best:1413  next:[606,1412] violation_ls(batch:14 #solutions_imported:14 #lin_moves:34'113 #lin_evals:147'759 #gen_moves:6'609 #gen_evals:1'241 #comp_moves:353 #backtracks:3'128 #weight_updates:6'283)
#Bound   1.00s best:1413  next:[621,1412] objective_lb_search_no_lp
#59      1.02s best:1382  next:[621,1381] rnd_cst_lns (d=0.99 s=188 t=0.10 p=1.00 stall=0 h=auto_l0)
#60      1.03s best:1381  next:[621,1380] violation_ls(batch:15 #solutions_imported:15 #lin_moves:19'488 #lin_evals:107'668 #gen_moves:14'827 #gen_evals:2'830 #comp_moves:1'221 #backtracks:6'800 #weight_updates:1'086)
#61      1.03s best:1380  next:[621,1379] violation_ls(batch:15 #solutions_imported:15 #lin_moves:34'157 #lin_evals:147'976 #gen_moves:6'609 #gen_evals:1'241 #comp_moves:353 #backtracks:3'128 #weight_updates:6'315)
#62      1.04s best:1379  next:[621,1378] violation_ls(batch:16 #solutions_imported:16 #lin_moves:26'463 #lin_evals:180'163 #gen_moves:22'206 #gen_evals:3'411 #comp_moves:1'715 #backtracks:10'239 #weight_updates:25'097)
#63      1.04s best:1378  next:[621,1377] violation_ls(batch:16 #solutions_imported:16 #lin_moves:10'222 #lin_evals:138'651 #gen_moves:37'497 #gen_evals:5'491 #comp_moves:3'766 #backtracks:16'862 #weight_updates:10'434)
#64      1.04s best:1377  next:[621,1376] violation_ls(batch:17 #solutions_imported:17 #lin_moves:10'222 #lin_evals:139'204 #gen_moves:37'737 #gen_evals:5'496 #comp_moves:3'782 #backtracks:16'974 #weight_updates:10'439)
#65      1.05s best:1376  next:[621,1375] violation_ls(batch:17 #solutions_imported:17 #lin_moves:34'452 #lin_evals:149'307 #gen_moves:6'609 #gen_evals:1'241 #comp_moves:353 #backtracks:3'128 #weight_updates:6'484)
#66      1.05s best:1375  next:[621,1374] violation_ls(batch:18 #solutions_imported:18 #lin_moves:34'453 #lin_evals:149'315 #gen_moves:6'609 #gen_evals:1'241 #comp_moves:353 #backtracks:3'128 #weight_updates:6'484)
#67      1.06s best:1374  next:[621,1373] violation_ls(batch:18 #solutions_imported:18 #lin_moves:20'704 #lin_evals:125'779 #gen_moves:16'603 #gen_evals:2'548 #comp_moves:1'783 #backtracks:7'410 #weight_updates:10'696)
#Bound   1.14s best:1374  next:[639,1373] objective_lb_search_no_lp
#Bound   1.52s best:1374  next:[662,1373] objective_lb_search_no_lp
#68      1.83s best:1367  next:[662,1366] default_lp (fixed_bools=0/124)
#Bound   2.07s best:1367  next:[690,1366] objective_lb_search_no_lp
#69      2.17s best:1353  next:[690,1352] quick_restart_no_lp (fixed_bools=7/375)
#70      2.18s best:1352  next:[690,1351] violation_ls(batch:22 #solutions_imported:20 #lin_moves:26'463 #lin_evals:241'099 #gen_moves:42'195 #gen_evals:7'459 #comp_moves:4'256 #backtracks:18'952 #weight_updates:25'243)
#71      2.19s best:1351  next:[690,1350] violation_ls(batch:22 #solutions_imported:18 #lin_moves:44'051 #lin_evals:235'680 #gen_moves:18'046 #gen_evals:3'081 #comp_moves:1'558 #backtracks:8'241 #weight_updates:26'625)
#72      2.19s best:1350  next:[690,1349] violation_ls(batch:22 #solutions_imported:20 #lin_moves:49'407 #lin_evals:222'100 #gen_moves:6'705 #gen_evals:1'253 #comp_moves:357 #backtracks:3'174 #weight_updates:21'530)
#73      2.19s best:1349  next:[690,1348] violation_ls(batch:22 #solutions_imported:20 #lin_moves:35'668 #lin_evals:198'219 #gen_moves:16'636 #gen_evals:2'550 #comp_moves:1'786 #backtracks:7'425 #weight_updates:25'732)
#74      2.34s best:1344  next:[690,1343] quick_restart_no_lp (fixed_bools=7/386)
#75      2.37s best:1339  next:[690,1338] quick_restart_no_lp (fixed_bools=7/390)
#76      2.38s best:1338  next:[690,1337] violation_ls(batch:23 #solutions_imported:22 #lin_moves:15'682 #lin_evals:207'935 #gen_moves:56'823 #gen_evals:7'307 #comp_moves:4'362 #backtracks:26'222 #weight_updates:15'857)
#77      2.38s best:1337  next:[690,1336] violation_ls(batch:23 #solutions_imported:19 #lin_moves:44'051 #lin_evals:235'728 #gen_moves:18'071 #gen_evals:3'083 #comp_moves:1'559 #backtracks:8'253 #weight_updates:26'625)
#78      2.38s best:1336  next:[690,1335] violation_ls(batch:23 #solutions_imported:21 #lin_moves:49'523 #lin_evals:222'665 #gen_moves:6'705 #gen_evals:1'253 #comp_moves:357 #backtracks:3'174 #weight_updates:21'621)
#79      2.38s best:1335  next:[690,1334] violation_ls(batch:23 #solutions_imported:21 #lin_moves:35'668 #lin_evals:198'258 #gen_moves:16'655 #gen_evals:2'552 #comp_moves:1'787 #backtracks:7'434 #weight_updates:25'732)
#Bound   2.41s best:1335  next:[691,1334] objective_lb_search_no_lp
#80      2.59s best:1334  next:[691,1333] violation_ls(batch:24 #solutions_imported:23 #lin_moves:15'682 #lin_evals:213'402 #gen_moves:59'045 #gen_evals:7'543 #comp_moves:4'572 #backtracks:27'228 #weight_updates:15'891)
#81      2.59s best:1333  next:[691,1332] violation_ls(batch:24 #solutions_imported:20 #lin_moves:44'051 #lin_evals:235'745 #gen_moves:18'078 #gen_evals:3'085 #comp_moves:1'560 #backtracks:8'256 #weight_updates:26'625)
#82      2.67s best:1329  next:[691,1328] quick_restart_no_lp (fixed_bools=7/410)
#83      2.70s best:1325  next:[691,1324] quick_restart_no_lp (fixed_bools=7/411)
#Bound   3.40s best:1325  next:[693,1324] objective_lb_search_no_lp
#Bound   3.52s best:1325  next:[701,1324] objective_lb_search_no_lp
#Bound   4.03s best:1325  next:[703,1324] objective_lb_search_no_lp
#Bound   4.10s best:1325  next:[704,1324] objective_lb_search_no_lp
#Bound   4.25s best:1325  next:[711,1324] objective_lb_search_no_lp
#84      6.19s best:1302  next:[711,1301] graph_arc_lns (d=0.98 s=442 t=0.10 p=0.67 stall=0 h=auto_l0)
#85      6.19s best:1301  next:[711,1300] violation_ls(batch:37 #solutions_imported:24 #lin_moves:49'533 #lin_evals:474'816 #gen_moves:118'315 #gen_evals:11'309 #comp_moves:2'729 #backtracks:57'772 #weight_updates:22'425)
#86      6.22s best:1300  next:[711,1299] violation_ls(batch:37 #solutions_imported:24 #lin_moves:26'463 #lin_evals:516'968 #gen_moves:169'207 #gen_evals:17'044 #comp_moves:6'714 #backtracks:81'209 #weight_updates:26'119)
#Bound   6.31s best:1300  next:[722,1299] objective_lb_search_no_lp
#Bound   6.48s best:1300  next:[725,1299] objective_lb_search_no_lp
#Bound   6.99s best:1300  next:[769,1299] objective_lb_search_max_lp
#Bound   9.87s best:1300  next:[772,1299] objective_lb_search
#Bound  10.21s best:1300  next:[773,1299] objective_lb_search_no_lp
#Bound  11.24s best:1300  next:[774,1299] objective_lb_search_max_lp
#Bound  11.84s best:1300  next:[776,1299] objective_lb_search_no_lp
#Bound  12.51s best:1300  next:[784,1299] objective_lb_search_no_lp
#Bound  14.45s best:1300  next:[786,1299] objective_lb_search
#Bound  16.17s best:1300  next:[804,1299] objective_lb_search_no_lp
#Bound  16.75s best:1300  next:[810,1299] objective_lb_search
#Bound  17.89s best:1300  next:[811,1299] objective_lb_search_no_lp
#Bound  19.58s best:1300  next:[818,1299] objective_lb_search
#Bound  22.09s best:1300  next:[821,1299] objective_lb_search
#Bound  22.63s best:1300  next:[827,1299] objective_lb_search
#Bound  24.69s best:1300  next:[831,1299] objective_lb_search_no_lp
#Bound  26.93s best:1300  next:[834,1299] objective_lb_search_no_lp
#Bound  28.81s best:1300  next:[839,1299] objective_lb_search_no_lp
#Bound  29.67s best:1300  next:[840,1299] objective_lb_search_no_lp
#Bound  30.94s best:1300  next:[847,1299] objective_lb_search_no_lp
#Bound  31.63s best:1300  next:[850,1299] objective_lb_search_no_lp
#Bound  33.01s best:1300  next:[854,1299] objective_lb_search_no_lp
#Bound  37.68s best:1300  next:[856,1299] objective_lb_search
#Bound  40.04s best:1300  next:[858,1299] objective_lb_search_no_lp
#Bound  40.51s best:1300  next:[859,1299] objective_lb_search_no_lp
#Bound  41.72s best:1300  next:[861,1299] objective_lb_search_no_lp
#Bound  44.06s best:1300  next:[863,1299] objective_lb_search_no_lp
#Bound  44.59s best:1300  next:[872,1299] objective_lb_search_no_lp
#Bound  45.43s best:1300  next:[873,1299] objective_lb_search_no_lp
#Bound  46.85s best:1300  next:[875,1299] objective_lb_search_no_lp
#Bound  49.55s best:1300  next:[876,1299] objective_lb_search_no_lp
#Bound  50.61s best:1300  next:[878,1299] objective_lb_search_no_lp
#Bound  50.78s best:1300  next:[880,1299] objective_lb_search_no_lp
#Bound  51.04s best:1300  next:[881,1299] objective_lb_search_no_lp
#Bound  51.47s best:1300  next:[882,1299] objective_lb_search_no_lp
#Bound  51.79s best:1300  next:[883,1299] objective_lb_search_no_lp
#Bound  52.19s best:1300  next:[884,1299] objective_lb_search_no_lp
#Bound  53.15s best:1300  next:[886,1299] objective_lb_search_no_lp
#Bound  54.95s best:1300  next:[888,1299] objective_lb_search_no_lp
#Bound  56.61s best:1300  next:[889,1299] objective_lb_search_no_lp
#Bound  58.35s best:1300  next:[891,1299] objective_lb_search_no_lp
#Bound  62.13s best:1300  next:[892,1299] objective_lb_search_no_lp
#Bound  64.66s best:1300  next:[899,1299] objective_lb_search_no_lp
#Bound  65.55s best:1300  next:[901,1299] objective_lb_search_no_lp
#Bound  68.42s best:1300  next:[905,1299] objective_lb_search_no_lp
#Bound  71.21s best:1300  next:[910,1299] objective_lb_search_no_lp
#Bound  71.76s best:1300  next:[913,1299] objective_lb_search_no_lp
#Bound  72.68s best:1300  next:[915,1299] objective_lb_search_no_lp
#Bound  81.97s best:1300  next:[918,1299] objective_lb_search_no_lp
#Bound  84.94s best:1300  next:[919,1299] objective_lb_search_no_lp
#Bound  86.10s best:1300  next:[920,1299] objective_lb_search_no_lp
#Bound  89.40s best:1300  next:[921,1299] objective_lb_search_no_lp
#Bound  90.63s best:1300  next:[923,1299] objective_lb_search_no_lp
#Bound  91.90s best:1300  next:[925,1299] objective_lb_search_no_lp
#Bound  93.99s best:1300  next:[926,1299] objective_lb_search_no_lp
#Bound  98.60s best:1300  next:[927,1299] objective_lb_search_no_lp
#Bound  99.22s best:1300  next:[928,1299] objective_lb_search_no_lp
#Bound 100.89s best:1300  next:[930,1299] objective_lb_search_no_lp
#Bound 105.99s best:1300  next:[932,1299] objective_lb_search_no_lp
#Bound 108.95s best:1300  next:[936,1299] objective_lb_search_no_lp
#Bound 118.16s best:1300  next:[937,1299] objective_lb_search_no_lp
#Bound 118.51s best:1300  next:[939,1299] objective_lb_search_no_lp
#Bound 120.30s best:1300  next:[940,1299] objective_lb_search_no_lp
#Bound 120.90s best:1300  next:[941,1299] objective_lb_search_no_lp
#Bound 122.00s best:1300  next:[942,1299] objective_lb_search_no_lp
#Bound 123.90s best:1300  next:[943,1299] objective_lb_search_no_lp
#Bound 134.42s best:1300  next:[955,1299] objective_lb_search_no_lp
#Bound 139.39s best:1300  next:[982,1299] objective_lb_search_no_lp
#Model 145.61s var:322/326 constraints:2773/3064
#Model 145.76s var:318/326 constraints:2587/3064
#Bound 145.93s best:1300  next:[983,1299] objective_lb_search_no_lp
#Bound 147.13s best:1300  next:[985,1299] objective_lb_search_no_lp
#Model 147.75s var:316/326 constraints:2466/3064
#Bound 148.52s best:1300  next:[986,1299] objective_lb_search_no_lp
#Bound 149.50s best:1300  next:[999,1299] objective_lb_search
#Bound 151.37s best:1300  next:[1001,1299] objective_lb_search
#Bound 153.79s best:1300  next:[1002,1299] objective_lb_search
#Model 158.33s var:315/326 constraints:2423/3064
#Bound 159.64s best:1300  next:[1003,1299] objective_lb_search_no_lp
#Bound 160.03s best:1300  next:[1008,1299] objective_lb_search_max_lp
#Bound 162.94s best:1300  next:[1010,1299] objective_lb_search
#Bound 167.05s best:1300  next:[1012,1299] objective_lb_search
#Bound 167.28s best:1300  next:[1014,1299] objective_lb_search
#Bound 170.47s best:1300  next:[1015,1299] lb_tree_search (nodes=3249/3899 rc=97 decisions=63418 @root=25 restarts=11) 
#Bound 170.94s best:1300  next:[1016,1299] objective_lb_search
#Model 171.17s var:314/326 constraints:2395/3064
#Bound 171.59s best:1300  next:[1017,1299] objective_lb_search_no_lp
#Bound 172.36s best:1300  next:[1020,1299] objective_lb_search
#Bound 174.00s best:1300  next:[1021,1299] objective_lb_search
#Bound 174.63s best:1300  next:[1022,1299] objective_lb_search_no_lp
#Bound 175.78s best:1300  next:[1052,1299] objective_lb_search_max_lp
#Bound 177.39s best:1300  next:[1058,1299] objective_lb_search_max_lp
#Model 180.86s var:313/326 constraints:2286/3064
#Bound 181.04s best:1300  next:[1063,1299] objective_lb_search_max_lp
#Bound 183.50s best:1300  next:[1064,1299] objective_lb_search_max_lp
#Bound 185.15s best:1300  next:[1067,1299] objective_lb_search_max_lp
#Model 187.90s var:308/326 constraints:2070/3064
#Model 188.27s var:307/326 constraints:1988/3064
#Bound 188.38s best:1300  next:[1068,1299] objective_shaving_search_max_lp (vars=311 csts=2256)
#Bound 188.59s best:1300  next:[1077,1299] objective_lb_search_no_lp
#Bound 188.91s best:1300  next:[1090,1299] objective_lb_search_no_lp
#Bound 189.37s best:1300  next:[1101,1299] objective_lb_search_no_lp
#Model 189.74s var:305/326 constraints:1898/3064
#Bound 189.87s best:1300  next:[1112,1299] objective_lb_search_no_lp
#Bound 190.45s best:1300  next:[1116,1299] objective_lb_search_no_lp
#Bound 190.80s best:1300  next:[1120,1299] objective_lb_search_no_lp
#Model 190.91s var:304/326 constraints:1860/3064
#Bound 191.13s best:1300  next:[1122,1299] objective_lb_search_no_lp
#Model 191.20s var:303/326 constraints:1849/3064
#Bound 191.25s best:1300  next:[1123,1299] objective_lb_search_no_lp
#Bound 191.64s best:1300  next:[1140,1299] objective_lb_search_no_lp
#Bound 191.70s best:1300  next:[1148,1299] objective_lb_search
#Bound 192.17s best:1300  next:[1151,1299] objective_lb_search_no_lp
#Bound 192.25s best:1300  next:[1153,1299] objective_lb_search
#Model 192.41s var:302/326 constraints:1809/3064
#Bound 192.71s best:1300  next:[1155,1299] objective_lb_search_no_lp
#Bound 192.77s best:1300  next:[1156,1299] objective_lb_search_no_lp
#Model 192.80s var:299/326 constraints:1726/3064
#Bound 192.80s best:1300  next:[1157,1299] objective_lb_search_no_lp
#Model 192.81s var:280/326 constraints:1041/3064
#Bound 192.83s best:1300  next:[1158,1299] objective_lb_search_no_lp
#Bound 192.84s best:1300  next:[1161,1299] objective_lb_search_max_lp
#Model 192.85s var:278/326 constraints:979/3064
#Model 192.86s var:277/326 constraints:945/3064
#Bound 192.87s best:1300  next:[1178,1299] objective_lb_search
#Model 192.87s var:276/326 constraints:944/3064
#Bound 192.89s best:1300  next:[1197,1299] objective_lb_search_no_lp
#Model 192.92s var:275/326 constraints:897/3064
#Bound 192.94s best:1300  next:[1198,1299] objective_lb_search_no_lp
#Model 192.95s var:274/326 constraints:875/3064
#Model 192.97s var:271/326 constraints:821/3064
#Bound 192.97s best:1300  next:[1202,1299] objective_lb_search_no_lp
#Done  192.97s objective_lb_search_no_lp
#Done  192.97s core
#Done  192.98s pseudo_costs
#Done  192.98s probing_max_lp
#Done  192.98s reduced_costs

Task timing                                  n [     min,      max]      avg      dev     time         n [     min,      max]      avg      dev    dtime
                             'core':         1 [   3.21m,    3.21m]    3.21m   0.00ns    3.21m         1 [   2.55m,    2.55m]    2.55m   0.00ns    2.55m
                       'default_lp':         1 [   3.21m,    3.21m]    3.21m   0.00ns    3.21m         1 [  25.33s,   25.33s]   25.33s   0.00ns   25.33s
                 'feasibility_pump':       657 [ 34.49ms, 647.84ms] 283.44ms 106.51ms    3.10m       656 [  4.44ms,  55.54ms]  21.93ms   1.53ms   14.38s
                  'fj_long_default':         1 [107.81ms, 107.81ms] 107.81ms   0.00ns 107.81ms         1 [ 37.28ms,  37.28ms]  37.28ms   0.00ns  37.28ms
                  'fj_long_default':         1 [150.30ms, 150.30ms] 150.30ms   0.00ns 150.30ms         1 [ 52.56ms,  52.56ms]  52.56ms   0.00ns  52.56ms
              'fj_long_lin_default':         1 [117.29ms, 117.29ms] 117.29ms   0.00ns 117.29ms         1 [ 68.63ms,  68.63ms]  68.63ms   0.00ns  68.63ms
              'fj_long_lin_perturb':         1 [141.43ms, 141.43ms] 141.43ms   0.00ns 141.43ms         1 [ 56.82ms,  56.82ms]  56.82ms   0.00ns  56.82ms
               'fj_long_lin_random':         1 [144.68ms, 144.68ms] 144.68ms   0.00ns 144.68ms         1 [ 60.87ms,  60.87ms]  60.87ms   0.00ns  60.87ms
                  'fj_long_perturb':         1 [116.00ms, 116.00ms] 116.00ms   0.00ns 116.00ms         1 [ 70.39ms,  70.39ms]  70.39ms   0.00ns  70.39ms
                   'fj_long_random':         1 [147.49ms, 147.49ms] 147.49ms   0.00ns 147.49ms         1 [ 54.18ms,  54.18ms]  54.18ms   0.00ns  54.18ms
                 'fj_short_default':         1 [109.53ms, 109.53ms] 109.53ms   0.00ns 109.53ms         1 [ 70.75ms,  70.75ms]  70.75ms   0.00ns  70.75ms
                 'fj_short_default':         1 [136.77ms, 136.77ms] 136.77ms   0.00ns 136.77ms         1 [ 53.47ms,  53.47ms]  53.47ms   0.00ns  53.47ms
             'fj_short_lin_default':         1 [116.24ms, 116.24ms] 116.24ms   0.00ns 116.24ms         1 [ 68.89ms,  68.89ms]  68.89ms   0.00ns  68.89ms
             'fj_short_lin_default':         1 [123.58ms, 123.58ms] 123.58ms   0.00ns 123.58ms         1 [ 69.75ms,  69.75ms]  69.75ms   0.00ns  69.75ms
             'fj_short_lin_perturb':         1 [151.88ms, 151.88ms] 151.88ms   0.00ns 151.88ms         1 [ 55.34ms,  55.34ms]  55.34ms   0.00ns  55.34ms
              'fj_short_lin_random':         1 [120.46ms, 120.46ms] 120.46ms   0.00ns 120.46ms         1 [ 69.33ms,  69.33ms]  69.33ms   0.00ns  69.33ms
                 'fj_short_perturb':         1 [151.54ms, 151.54ms] 151.54ms   0.00ns 151.54ms         1 [ 54.15ms,  54.15ms]  54.15ms   0.00ns  54.15ms
                  'fj_short_random':         1 [120.94ms, 120.94ms] 120.94ms   0.00ns 120.94ms         1 [ 71.85ms,  71.85ms]  71.85ms   0.00ns  71.85ms
                        'fs_random':         1 [ 76.39ms,  76.39ms]  76.39ms   0.00ns  76.39ms         1 [  5.07us,   5.07us]   5.07us   0.00ns   5.07us
                        'fs_random':         1 [ 77.45ms,  77.45ms]  77.45ms   0.00ns  77.45ms         1 [ 20.00ns,  20.00ns]  20.00ns   0.00ns  20.00ns
                        'fs_random':         1 [ 78.57ms,  78.57ms]  78.57ms   0.00ns  78.57ms         1 [  5.07us,   5.07us]   5.07us   0.00ns   5.07us
                        'fs_random':         1 [ 80.28ms,  80.28ms]  80.28ms   0.00ns  80.28ms         1 [ 24.47us,  24.47us]  24.47us   0.00ns  24.47us
                  'fs_random_no_lp':         1 [ 76.07ms,  76.07ms]  76.07ms   0.00ns  76.07ms         1 [609.08us, 609.08us] 609.08us   0.00ns 609.08us
                  'fs_random_no_lp':         1 [ 77.07ms,  77.07ms]  77.07ms   0.00ns  77.07ms         1 [765.63us, 765.63us] 765.63us   0.00ns 765.63us
                  'fs_random_no_lp':         1 [ 79.58ms,  79.58ms]  79.58ms   0.00ns  79.58ms         1 [971.67us, 971.67us] 971.67us   0.00ns 971.67us
                  'fs_random_no_lp':         1 [ 80.76ms,  80.76ms]  80.76ms   0.00ns  80.76ms         1 [  1.08ms,   1.08ms]   1.08ms   0.00ns   1.08ms
          'fs_random_quick_restart':         1 [ 77.31ms,  77.31ms]  77.31ms   0.00ns  77.31ms         1 [ 20.00ns,  20.00ns]  20.00ns   0.00ns  20.00ns
          'fs_random_quick_restart':         1 [ 78.26ms,  78.26ms]  78.26ms   0.00ns  78.26ms         1 [ 20.00ns,  20.00ns]  20.00ns   0.00ns  20.00ns
          'fs_random_quick_restart':         1 [ 79.06ms,  79.06ms]  79.06ms   0.00ns  79.06ms         1 [  5.07us,   5.07us]   5.07us   0.00ns   5.07us
          'fs_random_quick_restart':         1 [ 80.07ms,  80.07ms]  80.07ms   0.00ns  80.07ms         1 [  5.07us,   5.07us]   5.07us   0.00ns   5.07us
    'fs_random_quick_restart_no_lp':         1 [ 74.78ms,  74.78ms]  74.78ms   0.00ns  74.78ms         1 [664.48us, 664.48us] 664.48us   0.00ns 664.48us
    'fs_random_quick_restart_no_lp':         1 [ 76.35ms,  76.35ms]  76.35ms   0.00ns  76.35ms         1 [410.14us, 410.14us] 410.14us   0.00ns 410.14us
    'fs_random_quick_restart_no_lp':         1 [ 79.56ms,  79.56ms]  79.56ms   0.00ns  79.56ms         1 [740.13us, 740.13us] 740.13us   0.00ns 740.13us
                    'graph_arc_lns':       674 [  2.73ms,    4.08s]    1.19s 811.36ms   13.39m       652 [ 10.00ns, 200.11ms]  69.89ms  47.85ms   45.57s
                    'graph_cst_lns':       673 [  2.48ms,    4.41s]    1.01s 889.29ms   11.31m       531 [ 10.00ns, 122.09ms]  69.77ms  44.48ms   37.05s
                    'graph_dec_lns':       673 [  5.81ms,    4.01s]    1.28s 834.11ms   14.38m       655 [ 10.00ns, 204.56ms]  70.19ms  46.87ms   45.97s
                    'graph_var_lns':       674 [  4.35ms,    3.80s]    1.23s 824.96ms   13.80m       652 [ 10.00ns, 171.62ms]  71.45ms  46.07ms   46.59s
                   'lb_tree_search':         1 [   3.21m,    3.21m]    3.21m   0.00ns    3.21m         1 [  46.59s,   46.59s]   46.59s   0.00ns   46.59s
                           'max_lp':         1 [   3.21m,    3.21m]    3.21m   0.00ns    3.21m         1 [  29.85s,   29.85s]   29.85s   0.00ns   29.85s
                            'no_lp':         1 [   3.21m,    3.21m]    3.21m   0.00ns    3.21m         1 [  22.50s,   22.50s]   22.50s   0.00ns   22.50s
              'objective_lb_search':         1 [   3.21m,    3.21m]    3.21m   0.00ns    3.21m         1 [  28.30s,   28.30s]   28.30s   0.00ns   28.30s
       'objective_lb_search_max_lp':         1 [   3.21m,    3.21m]    3.21m   0.00ns    3.21m         1 [  42.81s,   42.81s]   42.81s   0.00ns   42.81s
        'objective_lb_search_no_lp':         1 [   3.21m,    3.21m]    3.21m   0.00ns    3.21m         1 [  17.40s,   17.40s]   17.40s   0.00ns   17.40s
  'objective_shaving_search_max_lp':       128 [  3.73ms,   10.52s]    1.50s    1.83s    3.20m       109 [513.69us, 838.23ms] 129.13ms 169.44ms   14.07s
   'objective_shaving_search_no_lp':       128 [ 11.38ms,   10.51s]    1.50s    1.83s    3.20m       108 [488.42us, 916.23ms] 100.89ms 146.22ms   10.90s
                          'probing':         1 [   3.21m,    3.21m]    3.21m   0.00ns    3.21m         1 [   8.92s,    8.92s]    8.92s   0.00ns    8.92s
                   'probing_max_lp':         1 [   3.21m,    3.21m]    3.21m   0.00ns    3.21m         1 [  11.07s,   11.07s]   11.07s   0.00ns   11.07s
                     'pseudo_costs':         1 [   3.21m,    3.21m]    3.21m   0.00ns    3.21m         1 [  29.14s,   29.14s]   29.14s   0.00ns   29.14s
                    'quick_restart':         1 [   3.21m,    3.21m]    3.21m   0.00ns    3.21m         1 [  23.10s,   23.10s]   23.10s   0.00ns   23.10s
              'quick_restart_no_lp':         1 [   3.21m,    3.21m]    3.21m   0.00ns    3.21m         1 [  26.45s,   26.45s]   26.45s   0.00ns   26.45s
                    'reduced_costs':         1 [   3.21m,    3.21m]    3.21m   0.00ns    3.21m         1 [  29.82s,   29.82s]   29.82s   0.00ns   29.82s
                        'rins/rens':       674 [192.70us,    2.83s] 882.87ms 683.77ms    9.92m       553 [ 10.00ns, 140.46ms]  73.31ms  35.91ms   40.54s
                      'rnd_cst_lns':       674 [  2.84ms,    4.42s]    1.19s 789.01ms   13.42m       651 [ 10.00ns, 221.05ms]  70.70ms  46.32ms   46.02s
                      'rnd_var_lns':       674 [  4.34ms,    3.38s]    1.17s 761.15ms   13.18m       655 [ 10.00ns, 190.74ms]  69.59ms  46.29ms   45.58s
                     'violation_ls':       665 [345.37us, 403.52ms] 160.34ms  70.69ms    1.78m       665 [420.00ns,  68.41ms]  54.73ms  10.52ms   36.40s
                     'violation_ls':       665 [376.02us, 470.92ms] 154.49ms  70.18ms    1.71m       665 [450.00ns, 148.52ms]  61.48ms  16.68ms   40.88s
                     'violation_ls':       669 [355.10us, 704.02ms] 204.83ms 102.14ms    2.28m       669 [780.00ns, 220.25ms]  89.66ms  36.99ms    1.00m
                     'violation_ls':       669 [439.18us, 505.85ms] 163.14ms  84.59ms    1.82m       669 [750.00ns, 184.98ms]  68.06ms  24.58ms   45.53s
                     'violation_ls':       671 [ 58.61us, 509.01ms] 177.06ms  82.15ms    1.98m       670 [420.00ns, 276.92ms]  88.74ms  39.69ms   59.46s

Search stats                        Bools  Conflicts  Branches  Restarts  BoolPropag  IntegerPropag
                           'core':  5'091     56'510   118'750     6'869  89'892'027     47'266'129
                     'default_lp':    945     39'694   161'343    21'721   9'113'264     47'604'982
                      'fs_random':     95          0       190       190          18          5'132
                      'fs_random':     95          0       190       190          18          5'132
                      'fs_random':     95          0       190       190          18          5'132
                      'fs_random':     95          0       190       190          18          5'132
                'fs_random_no_lp':     95          0       249       190          53          8'965
                'fs_random_no_lp':     95         14       255       190         101          9'970
                'fs_random_no_lp':     95         18       276       190         113         10'280
                'fs_random_no_lp':     95          5       239       190          79          7'981
        'fs_random_quick_restart':     95          0       190       190          18          5'132
        'fs_random_quick_restart':     95          0       190       190          18          5'132
        'fs_random_quick_restart':     95          0       190       190          18          5'132
        'fs_random_quick_restart':     95          0       190       190          18          5'132
  'fs_random_quick_restart_no_lp':     95          0       236       190          25          7'044
  'fs_random_quick_restart_no_lp':     95          0       271       190          22          8'407
  'fs_random_quick_restart_no_lp':     97          0       280       190          25          8'866
                 'lb_tree_search':     95        217   108'669    12'941     244'158     10'469'573
                         'max_lp':     95     20'014   171'429    27'864   1'143'821     36'368'132
                          'no_lp':  1'394     84'375   199'173    19'923  28'524'418     82'652'420
            'objective_lb_search':    293     31'088   170'045    27'008   1'958'357     49'428'014
     'objective_lb_search_max_lp':    213     14'380   189'168    40'876   1'355'085     37'245'151
      'objective_lb_search_no_lp':    426     77'201   158'832    11'632   3'080'184     78'269'777
                        'probing':    557        352     2'501     1'744      30'439        223'314
                 'probing_max_lp':    557        345     1'125     1'051      23'633        160'482
                   'pseudo_costs':     95     25'731   171'594    27'390   1'128'843     39'357'476
                  'quick_restart':     95      9'746   197'506    47'628     835'815     26'387'355
            'quick_restart_no_lp':  2'958     76'998   278'392    19'506  53'221'703     66'422'531
                  'reduced_costs':  3'114     28'611   172'528    18'365  27'656'687     34'240'331

SAT stats                           ClassicMinim  LitRemoved  LitLearned  LitForgotten  Subsumed  MClauses  MDecisions  MLitTrue  MSubsumed  MLitRemoved  MReused
                           'core':        52'436     388'324     414'032        13'450       268     2'778      13'573         0        181          580       24
                     'default_lp':        29'146      94'118     474'783       169'985       814    11'039      98'507         8      2'301       14'741    2'068
                      'fs_random':             0           0           0             0         0         0           0         0          0            0        0
                      'fs_random':             0           0           0             0         0         0           0         0          0            0        0
                      'fs_random':             0           0           0             0         0         0           0         0          0            0        0
                      'fs_random':             0           0           0             0         0         0           0         0          0            0        0
                'fs_random_no_lp':             0           0           0             0         0         0           0         0          0            0        0
                'fs_random_no_lp':             0           0          25             0         0         0           0         0          0            0        0
                'fs_random_no_lp':             1           1          52             0         0         0           0         0          0            0        0
                'fs_random_no_lp':             1           1          78             0         0         0           0         0          0            0        0
        'fs_random_quick_restart':             0           0           0             0         0         0           0         0          0            0        0
        'fs_random_quick_restart':             0           0           0             0         0         0           0         0          0            0        0
        'fs_random_quick_restart':             0           0           0             0         0         0           0         0          0            0        0
        'fs_random_quick_restart':             0           0           0             0         0         0           0         0          0            0        0
  'fs_random_quick_restart_no_lp':             0           0           0             0         0         0           0         0          0            0        0
  'fs_random_quick_restart_no_lp':             0           0           0             0         0         0           0         0          0            0        0
  'fs_random_quick_restart_no_lp':             0           0           0             0         0         0           0         0          0            0        0
                 'lb_tree_search':            13          21         825             0         1     5'380      27'105         0         45          180      511
                         'max_lp':        13'452      38'263     233'443        48'392       686    13'325     138'246         0      1'280        8'280    1'807
                          'no_lp':        70'337     372'175   1'294'836       965'063       863    10'162      74'785         0      2'622       15'063    1'381
            'objective_lb_search':        25'541      80'784     256'407         8'581       924    12'801     118'741         1      2'548       16'123    2'682
     'objective_lb_search_max_lp':        10'165      26'792     126'682         2'297       667    17'002     141'964         0      1'508        9'086    3'977
      'objective_lb_search_no_lp':        63'749     220'593     661'804       123'729     1'639     6'627      63'066         0      3'068       21'255    1'388
                        'probing':             1           1         353             0         0         0           0         0          0            0        0
                 'probing_max_lp':             0           0         345             0         0         0           0         0          0            0        0
                   'pseudo_costs':        15'494      38'797     301'307        64'372       983    13'511     130'960         3      2'353       16'510    2'271
                  'quick_restart':         5'913      13'487     124'903             0       314    20'839     154'014         2        507        2'721    1'884
            'quick_restart_no_lp':        64'149     371'495     947'304       480'621       823     8'404      64'477        22      5'789       40'439      591
                  'reduced_costs':        20'443      84'625     329'197        83'625       773    10'483      86'564         6      4'314       28'720    1'897

Lp stats                         Component  Iterations  AddedCuts  OPTIMAL  DUAL_F.  DUAL_U.
                  'default_lp':          1     304'373     22'559   51'092        0        0
                   'fs_random':          1         137        112        3        0        0
                   'fs_random':          1         137        115        3        0        0
                   'fs_random':          1         137         87        3        0        0
                   'fs_random':          1          65          0        1        1        0
     'fs_random_quick_restart':          1         137          0        2        0        0
     'fs_random_quick_restart':          1         137        112        3        0        0
     'fs_random_quick_restart':          1         137        118        3        0        0
     'fs_random_quick_restart':          1          65          0        1        1        0
              'lb_tree_search':          1   1'135'485     11'063   52'035   20'530        0
                      'max_lp':          1     492'368     17'509   27'411   12'505       17
         'objective_lb_search':          1     444'082     12'915   43'599        0        0
  'objective_lb_search_max_lp':          1     659'031     13'048   22'474    6'793       18
                     'probing':          1      93'139      8'191    6'884        0        0
              'probing_max_lp':          1      41'076     11'570    3'895      276        0
                'pseudo_costs':          1     513'643     23'814   32'702   15'171       16
               'quick_restart':          1     326'651     15'599   33'933        0        1
               'reduced_costs':          1     472'709     34'996   36'053   12'056        5

Lp dimension                                                                     Final dimension of first component
                  'default_lp':   244 rows, 315 columns, 893 entries with magnitude in [1.152939e-02, 1.000000e+00]
                   'fs_random':   125 rows, 315 columns, 605 entries with magnitude in [7.935508e-02, 1.000000e+00]
                   'fs_random':   125 rows, 315 columns, 605 entries with magnitude in [7.935508e-02, 1.000000e+00]
                   'fs_random':   125 rows, 315 columns, 605 entries with magnitude in [7.935508e-02, 1.000000e+00]
                   'fs_random':   175 rows, 315 columns, 781 entries with magnitude in [2.197378e-02, 1.000000e+00]
     'fs_random_quick_restart':   125 rows, 315 columns, 605 entries with magnitude in [7.935508e-02, 1.000000e+00]
     'fs_random_quick_restart':   125 rows, 315 columns, 605 entries with magnitude in [7.935508e-02, 1.000000e+00]
     'fs_random_quick_restart':   125 rows, 315 columns, 605 entries with magnitude in [7.935508e-02, 1.000000e+00]
     'fs_random_quick_restart':   125 rows, 315 columns, 605 entries with magnitude in [7.935508e-02, 1.000000e+00]
              'lb_tree_search':  460 rows, 326 columns, 1585 entries with magnitude in [5.586248e-03, 1.000000e+00]
                      'max_lp':  525 rows, 326 columns, 1020 entries with magnitude in [1.852594e-03, 1.000000e+00]
         'objective_lb_search':  539 rows, 315 columns, 1652 entries with magnitude in [7.780338e-05, 1.000000e+00]
  'objective_lb_search_max_lp':  796 rows, 326 columns, 1603 entries with magnitude in [1.448819e-03, 1.000000e+00]
                     'probing':  503 rows, 315 columns, 2245 entries with magnitude in [4.831864e-04, 1.000000e+00]
              'probing_max_lp':  930 rows, 326 columns, 4556 entries with magnitude in [4.337491e-03, 1.000000e+00]
                'pseudo_costs':  638 rows, 326 columns, 2400 entries with magnitude in [1.306097e-03, 1.000000e+00]
               'quick_restart':  641 rows, 315 columns, 2877 entries with magnitude in [3.707067e-04, 1.000000e+00]
               'reduced_costs':  586 rows, 326 columns, 1952 entries with magnitude in [9.392915e-03, 1.000000e+00]

Lp debug                         CutPropag  CutEqPropag  Adjust  Overflow        Bad  BadScaling
                  'default_lp':         52          136  24'935         0    379'193           0
                   'fs_random':          0            0       0         0          0           0
                   'fs_random':          0            0       0         0        165           0
                   'fs_random':          0            0       0         0        167           0
                   'fs_random':          0            0       0         0         65           0
     'fs_random_quick_restart':          0            0       0         0          0           0
     'fs_random_quick_restart':          0            0       0         0          0           0
     'fs_random_quick_restart':          0            0       0         0        158           0
     'fs_random_quick_restart':          0            0       0         0        159           0
              'lb_tree_search':         33           15  32'753         0    124'905           0
                      'max_lp':         85           13  13'353         0    324'815           0
         'objective_lb_search':         72          149  19'731         0    519'307           0
  'objective_lb_search_max_lp':        126           27  15'904         0    366'373           0
                     'probing':         43           85   6'394         0  5'883'783           0
              'probing_max_lp':         68           56   3'885         0  3'988'474           0
                'pseudo_costs':        145           55  17'254         0    382'285           0
               'quick_restart':        126           96  19'182         0  1'041'685           0
               'reduced_costs':        183           35  19'802         0    416'306           0

Lp pool                          Constraints  Updates  Simplif  Merged  Shortened   Split  Strenghtened      Cuts/Call
                  'default_lp':        9'385    1'857  131'770     486     12'264  19'528        25'597  22'559/72'771
                   'fs_random':          312        0        0       0          0       0             7            0/0
                   'fs_random':          399        0        0       0          0       0            10         87/113
                   'fs_random':          424        0        0       0          0       0            10        112/158
                   'fs_random':          427        0        0       0          0       0            10        115/174
     'fs_random_quick_restart':          312        0        0       0          0       0             7            0/0
     'fs_random_quick_restart':          312        0        0       0          0       0             7            0/0
     'fs_random_quick_restart':          424        0        0       0          0       0            10        112/160
     'fs_random_quick_restart':          430        0        0       0          0       0            10        118/170
              'lb_tree_search':       11'904    1'144  155'869     221      9'736   1'685        66'774  11'063/43'755
                      'max_lp':       12'296    1'559  225'215     275     18'533   8'629       107'988  17'509/49'148
         'objective_lb_search':       10'129    2'367  414'256      98     16'516  24'258        31'592  12'915/49'179
  'objective_lb_search_max_lp':       11'976    1'927  349'502     134     21'606   8'498       115'859  13'048/41'085
                     'probing':        8'479    1'391  182'558      24      4'430  23'338         9'366   8'191/23'405
              'probing_max_lp':       12'589    1'106   69'851      43      6'959   8'114        42'167  11'570/27'728
                'pseudo_costs':       12'501    1'788  325'889     375     15'245   8'728       107'676  23'814/64'847
               'quick_restart':        9'856    2'951  639'289      55     15'619  79'300        47'704  15'599/55'250
               'reduced_costs':       12'601    1'954  285'361     457     15'925  11'811       106'395  34'996/94'717

Lp Cut            fs_ran  fs_ran  fs_ran  fs_ran  fs_ran  defaul  max_lp  quick_  reduce  pseudo  lb_tre  probin  object  probin  object
          CG_FF:       -       4       4       4       4   1'336     802     345   1'796     760     498     237     622     291     286
           CG_K:       -       4       4       4       4     936     537     152   1'277     530     230     103     391     142     160
           CG_R:       -       3       3       3       3     982     464     501   1'261     496     208     254     670     152     178
          CG_RB:       -       -       -       -       -   3'752   2'314   3'186   3'975   2'748   1'570     978   1'966   1'055     878
         CG_RBP:       -       -       -       -       -     502     238     507     610     256     166      86     189      70      67
         Clique:       -       -       -       -       -       -     187       -     325     206     166       -       -     105     184
             IB:      50      50      50      50      50   3'332   1'442   2'528   3'154   2'219   1'052   1'581   1'365     689   1'032
       MIR_1_FF:      13      20      22      21      22   1'112   1'100     756   2'055   1'628     745     605     758     692   1'026
        MIR_1_K:       3       4       4       4       4     336     259     147     691     493     171      89     216      91     225
       MIR_1_KL:       -       -       -       -       -      10      12      29       3      16       2      20       -       8       -
        MIR_1_R:       5       7       7       7       7     289     137     109     334     198      68      67     181      44      95
       MIR_1_RB:       7       6       8       7       8   1'954   1'841   1'222   3'628   2'701   1'188     770   1'018   1'134   1'563
      MIR_1_RBP:       1       1       1       1       1      71     245      74     414     294     209      23      27      94     126
      MIR_1_RLT:       -       -       -       -       -       -       9       -      21      11       3       -       -       4       3
       MIR_2_FF:       2       4       3       5       2     651     589     433   1'180     858     355     268     435     249     485
        MIR_2_K:       2       2       1       2       2     219     145      94     419     252     108      64     137      55     146
       MIR_2_KL:       -       -       -       -       -      25      10      24      27      22       9      23      12       4       7
        MIR_2_R:       1       3       1       2       1     188     175     117     374     284     112      52     119      84     130
       MIR_2_RB:       2       1       1       2       3   1'185     930     964   1'966   1'454     519     475     707     489     751
      MIR_2_RBP:       -       -       -       -       -      99     107      66     271     191      97      20      37      50      68
       MIR_3_FF:       -       1       -       2       -     352     372     248     733     540     240     168     249     151     310
        MIR_3_K:       1       1       1       1       1     152     147      69     335     221     126      45     104      56     130
       MIR_3_KL:       -       -       -       -       -      22       5      23      16      10       4      10       2       3       7
        MIR_3_R:       -       -       -       -       -     129     162      86     316     234      95      56     107      62     117
       MIR_3_RB:       -       1       -       3       -     749     553     585   1'154     839     328     274     464     326     442
      MIR_3_RBP:       -       -       -       -       -      65      71      60     166      94      69      18      29      25      36
       MIR_4_FF:       -       -       -       -       -     251     222     183     520     316     158     124     197      88     207
        MIR_4_K:       -       -       -       -       -     104      92      73     262     146      79      28      88      53     113
       MIR_4_KL:       -       -       -       -       -      16       4      10       9       7       2       7       7       1       2
        MIR_4_R:       -       -       -       -       -     120     113      78     265     160      63      46      77      31      85
       MIR_4_RB:       -       1       -       -       -     422     310     437     703     491     172     182     333     193     259
      MIR_4_RBP:       -       -       -       -       -      39      33      50     110      67      34      19      14      18      22
       MIR_5_FF:       -       -       -       -       -     164     138     115     288     214      76      76     139      56     131
        MIR_5_K:       -       -       -       -       -      62      58      54     158      98      50      26      63      23      76
       MIR_5_KL:       -       -       -       -       -       8       1       4       3       7       -       3       4       2       -
        MIR_5_R:       -       -       -       -       -      87      67      59     145     101      41      33      79      29      50
       MIR_5_RB:       -       -       -       -       -     312     204     207     390     337     125     111     198     106     153
      MIR_5_RBP:       -       -       -       -       -      30      12      30      62      39      23       5       8       9      14
       MIR_6_FF:       -       -       -       -       -     108      82      77     189     139      52      61     104      34      67
        MIR_6_K:       -       -       -       -       -      36      32      27      99      58      30      23      36       9      37
       MIR_6_KL:       -       -       -       -       -       8       1       5       2       1       -       -       1       -       -
        MIR_6_R:       -       -       -       -       -      56      46      39     102      65      27      24      58      24      29
       MIR_6_RB:       -       -       -       -       -     176      94     148     252     184      56      55      94      55      83
      MIR_6_RBP:       -       -       -       -       -      26      11      46      51      36      19      12      11       4      13
   ZERO_HALF_FF:       -       1       1       -       -     305     266     110     571     386     223      66     156      82     172
    ZERO_HALF_K:       -       -       -       -       -      91      62      30     182      91      51      16      38      13      33
    ZERO_HALF_R:       -       -       -       -       -   1'125   2'051   1'142   2'778   2'311     926     754   1'070   4'241   2'507
   ZERO_HALF_RB:       -       1       1       -       -     468     613     286   1'097     834     432     215     311     312     467
  ZERO_HALF_RBP:       -       -       -       -       -      97     144      64     257     171      86      19      24      62      76

LNS stats           Improv/Calls  Closed  Difficulty  TimeLimit
  'graph_arc_lns':        32/673     52%        0.99       0.12
  'graph_cst_lns':        15/547     53%        0.99       0.12
  'graph_dec_lns':        25/673     51%        0.99       0.13
  'graph_var_lns':        32/673     52%        0.99       0.13
      'rins/rens':        65/615     51%        0.92       0.10
    'rnd_cst_lns':        30/671     52%        0.99       0.12
    'rnd_var_lns':        22/674     52%        0.99       0.12

LS stats                   Batches  Restarts   LinMoves   GenMoves  CompoundMoves  WeightUpdates
       'fj_long_default':        1         1      6'406          0              0            109
       'fj_long_default':        1         1      9'865          0              0            135
   'fj_long_lin_default':        1         1          0      2'746            351              1
   'fj_long_lin_perturb':        1         1      9'219          0              0            781
    'fj_long_lin_random':        1         1      9'231          0              0            769
       'fj_long_perturb':        1         1          0      2'655            387              1
        'fj_long_random':        1         1      9'848          0              0            152
      'fj_short_default':        1         1          0      2'856            389              1
      'fj_short_default':        1         1      8'746          0              0          1'254
  'fj_short_lin_default':        1         1          0      2'786            377              1
  'fj_short_lin_default':        1         1          0      2'861            340              1
  'fj_short_lin_perturb':        1         1      9'829          0              0            171
   'fj_short_lin_random':        1         1          0      3'069            367              2
      'fj_short_perturb':        1         1      9'840          0              0            160
       'fj_short_random':        1         1          0      2'660            422              1
          'violation_ls':      665         0  1'988'717  2'192'397        154'916        341'943
          'violation_ls':      665         0  3'281'016  1'752'453         79'569         70'294
          'violation_ls':      669         0  2'141'657  2'127'113        116'363        362'822
          'violation_ls':      669         0  3'542'188  1'092'184         68'574        814'226
          'violation_ls':      670         0  3'181'476  1'229'715         80'537      1'000'857

Solutions (86)            Num     Rank
           'default_lp':    1  [68,68]
        'graph_arc_lns':    1  [84,84]
        'graph_var_lns':    2   [7,46]
                'no_lp':   17   [1,42]
  'quick_restart_no_lp':    8  [23,83]
        'rins_pump_lns':    2  [44,45]
          'rnd_cst_lns':    1  [59,59]
          'rnd_var_lns':    1  [35,35]
         'violation_ls':   53   [2,86]

Objective bounds                      Num
                   'initial_domain':    1
                   'lb_tree_search':    1
              'objective_lb_search':   19
       'objective_lb_search_max_lp':    9
        'objective_lb_search_no_lp':  104
  'objective_shaving_search_max_lp':    1

Solution repositories     Added  Queried  Ignored  Synchro
  'feasible solutions':   4'466   13'288       12    4'251
        'lp solutions':   1'190      319        0    1'079
                'pump':  13'749      354

Improving bounds shared            Num
                        'core':      3
                  'default_lp':    185
              'lb_tree_search':     44
                      'max_lp':    167
                       'no_lp':     38
         'objective_lb_search':    206
  'objective_lb_search_max_lp':    175
   'objective_lb_search_no_lp':     43
                     'probing':  1'002
              'probing_max_lp':    350
                'pseudo_costs':    267
               'quick_restart':    460
         'quick_restart_no_lp':  2'763
               'reduced_costs':    416

Clauses shared                   Num
                        'core':    4
                  'default_lp':   41
             'fs_random_no_lp':    2
              'lb_tree_search':   11
                      'max_lp':   49
                       'no_lp':   11
         'objective_lb_search':   25
  'objective_lb_search_max_lp':   59
   'objective_lb_search_no_lp':   14
                'pseudo_costs':  108
               'quick_restart':  161
         'quick_restart_no_lp':   51
               'reduced_costs':   50

CpSolverResponse summary:
status: OPTIMAL
objective: 1300
best_bound: 1300
integers: 316
booleans: 95
conflicts: 0
branches: 249
propagations: 53
integer_propagations: 8965
restarts: 190
lp_iterations: 0
walltime: 193.073
usertime: 193.073
deterministic_time: 1084.38
gap_integral: 3557.34
solution_fingerprint: 0x2fd06473700e098f


--- Simulation Gantt  partir du modle mathmatique ---
{'big':1, 'due_date':115, 'pos_time':5, 'status':0, 'blocked':0, 'operations':["{'type':1, 'processing_time':41}", "{'type':0, 'processing_time':41}"]}
{'big':1, 'due_date':143, 'pos_time':5, 'status':0, 'blocked':0, 'operations':["{'type':0, 'processing_time':57}", "{'type':1, 'processing_time':22}"]}
{'big':0, 'due_date':188, 'pos_time':5, 'status':0, 'blocked':0, 'operations':["{'type':1, 'processing_time':59}", "{'type':0, 'processing_time':59}"]}
{'big':0, 'due_date':75, 'pos_time':5, 'status':0, 'blocked':0, 'operations':["{'type':1, 'processing_time':40}"]}
{'big':1, 'due_date':125, 'pos_time':5, 'status':0, 'blocked':0, 'operations':["{'type':1, 'processing_time':56}", "{'type':0, 'processing_time':19}"]}
{'big':0, 'due_date':119, 'pos_time':5, 'status':0, 'blocked':0, 'operations':["{'type':0, 'processing_time':59}", "{'type':1, 'processing_time':46}"]}
{'big':0, 'due_date':151, 'pos_time':5, 'status':0, 'blocked':0, 'operations':["{'type':1, 'processing_time':19}", "{'type':0, 'processing_time':42}"]}
