created virtual environment CPython3.12.4.final.0-64 in 8697ms
  creator CPython3Posix(dest=/localscratch/aneumann.63390702.0/env, clear=False, no_vcs_ignore=False, global=False)
  seeder FromAppData(download=False, pip=bundle, via=copy, app_data_dir=/home/aneumann/.local/share/virtualenv)
    added seed packages: pip==25.1.1
  activators BashActivator,CShellActivator,FishActivator,NushellActivator,PowerShellActivator,PythonActivator
Looking in links: /cvmfs/soft.computecanada.ca/custom/python/wheelhouse/gentoo2023/x86-64-v3, /cvmfs/soft.computecanada.ca/custom/python/wheelhouse/gentoo2023/generic, /cvmfs/soft.computecanada.ca/custom/python/wheelhouse/generic
Requirement already satisfied: pip in /localscratch/aneumann.63390702.0/env/lib/python3.12/site-packages (25.1.1)
Looking in links: /cvmfs/soft.computecanada.ca/custom/python/wheelhouse/gentoo2023/x86-64-v3, /cvmfs/soft.computecanada.ca/custom/python/wheelhouse/gentoo2023/generic, /cvmfs/soft.computecanada.ca/custom/python/wheelhouse/generic
ERROR: protobuf-5.28.3-cp38-abi3-manylinux2014_x86_64.whl is not a supported wheel on this platform.
Looking in links: /cvmfs/soft.computecanada.ca/custom/python/wheelhouse/gentoo2023/x86-64-v3, /cvmfs/soft.computecanada.ca/custom/python/wheelhouse/gentoo2023/generic, /cvmfs/soft.computecanada.ca/custom/python/wheelhouse/generic
Processing /home/aneumann/projects/def-adhaj/aneumann/GNRS/wheels/immutabledict-4.2.0-py3-none-any.whl
Installing collected packages: immutabledict
Successfully installed immutabledict-4.2.0
Looking in links: /cvmfs/soft.computecanada.ca/custom/python/wheelhouse/gentoo2023/x86-64-v3, /cvmfs/soft.computecanada.ca/custom/python/wheelhouse/gentoo2023/generic, /cvmfs/soft.computecanada.ca/custom/python/wheelhouse/generic
Processing /cvmfs/soft.computecanada.ca/custom/python/wheelhouse/generic/ortools-9.10.4067+computecanada-cp312-cp312-linux_x86_64.whl (from -r /home/aneumann/projects/def-adhaj/aneumann/GNRS/requirements/or.txt (line 1))
Processing /cvmfs/soft.computecanada.ca/custom/python/wheelhouse/gentoo2023/x86-64-v3/matplotlib-3.10.0+computecanada-cp312-cp312-linux_x86_64.whl (from -r /home/aneumann/projects/def-adhaj/aneumann/GNRS/requirements/or.txt (line 2))
Processing /cvmfs/soft.computecanada.ca/custom/python/wheelhouse/gentoo2023/x86-64-v3/pandas-2.2.3+computecanada-cp312-cp312-linux_x86_64.whl (from -r /home/aneumann/projects/def-adhaj/aneumann/GNRS/requirements/or.txt (line 3))
Processing /cvmfs/soft.computecanada.ca/custom/python/wheelhouse/generic/absl_py-2.2.2+computecanada-py3-none-any.whl (from ortools<9.11,>=9.10->-r /home/aneumann/projects/def-adhaj/aneumann/GNRS/requirements/or.txt (line 1))
Processing /cvmfs/soft.computecanada.ca/custom/python/wheelhouse/gentoo2023/generic/numpy-2.2.2+computecanada-cp312-cp312-linux_x86_64.whl (from ortools<9.11,>=9.10->-r /home/aneumann/projects/def-adhaj/aneumann/GNRS/requirements/or.txt (line 1))
Processing /cvmfs/soft.computecanada.ca/custom/python/wheelhouse/gentoo2023/x86-64-v3/protobuf-6.30.2+computecanada-cp312-cp312-linux_x86_64.whl (from ortools<9.11,>=9.10->-r /home/aneumann/projects/def-adhaj/aneumann/GNRS/requirements/or.txt (line 1))
Requirement already satisfied: immutabledict>=3.0.0 in /localscratch/aneumann.63390702.0/env/lib/python3.12/site-packages (from ortools<9.11,>=9.10->-r /home/aneumann/projects/def-adhaj/aneumann/GNRS/requirements/or.txt (line 1)) (4.2.0)
Processing /cvmfs/soft.computecanada.ca/custom/python/wheelhouse/gentoo2023/generic/contourpy-1.3.1+computecanada-cp312-cp312-linux_x86_64.whl (from matplotlib->-r /home/aneumann/projects/def-adhaj/aneumann/GNRS/requirements/or.txt (line 2))
Processing /cvmfs/soft.computecanada.ca/custom/python/wheelhouse/generic/cycler-0.12.1+computecanada-py3-none-any.whl (from matplotlib->-r /home/aneumann/projects/def-adhaj/aneumann/GNRS/requirements/or.txt (line 2))
Processing /cvmfs/soft.computecanada.ca/custom/python/wheelhouse/generic/fonttools-4.58.2+computecanada-cp312-cp312-linux_x86_64.whl (from matplotlib->-r /home/aneumann/projects/def-adhaj/aneumann/GNRS/requirements/or.txt (line 2))
Processing /cvmfs/soft.computecanada.ca/custom/python/wheelhouse/gentoo2023/x86-64-v3/kiwisolver-1.4.8+computecanada-cp312-cp312-linux_x86_64.whl (from matplotlib->-r /home/aneumann/projects/def-adhaj/aneumann/GNRS/requirements/or.txt (line 2))
Processing /cvmfs/soft.computecanada.ca/custom/python/wheelhouse/generic/packaging-25.0+computecanada-py3-none-any.whl (from matplotlib->-r /home/aneumann/projects/def-adhaj/aneumann/GNRS/requirements/or.txt (line 2))
Processing /cvmfs/soft.computecanada.ca/custom/python/wheelhouse/gentoo2023/x86-64-v3/pillow-11.1.0+computecanada-cp312-cp312-linux_x86_64.whl (from matplotlib->-r /home/aneumann/projects/def-adhaj/aneumann/GNRS/requirements/or.txt (line 2))
Processing /cvmfs/soft.computecanada.ca/custom/python/wheelhouse/generic/pyparsing-3.2.1+computecanada-py3-none-any.whl (from matplotlib->-r /home/aneumann/projects/def-adhaj/aneumann/GNRS/requirements/or.txt (line 2))
Processing /cvmfs/soft.computecanada.ca/custom/python/wheelhouse/generic/python_dateutil-2.9.0.post0+computecanada-py2.py3-none-any.whl (from matplotlib->-r /home/aneumann/projects/def-adhaj/aneumann/GNRS/requirements/or.txt (line 2))
Processing /cvmfs/soft.computecanada.ca/custom/python/wheelhouse/generic/pytz-2025.2+computecanada-py2.py3-none-any.whl (from pandas->-r /home/aneumann/projects/def-adhaj/aneumann/GNRS/requirements/or.txt (line 3))
Processing /cvmfs/soft.computecanada.ca/custom/python/wheelhouse/generic/tzdata-2025.2+computecanada-py2.py3-none-any.whl (from pandas->-r /home/aneumann/projects/def-adhaj/aneumann/GNRS/requirements/or.txt (line 3))
Processing /cvmfs/soft.computecanada.ca/custom/python/wheelhouse/generic/six-1.17.0+computecanada-py2.py3-none-any.whl (from python-dateutil>=2.7->matplotlib->-r /home/aneumann/projects/def-adhaj/aneumann/GNRS/requirements/or.txt (line 2))
Installing collected packages: pytz, tzdata, six, pyparsing, protobuf, pillow, packaging, numpy, kiwisolver, fonttools, cycler, absl-py, python-dateutil, contourpy, pandas, matplotlib, ortools

Successfully installed absl-py-2.2.2+computecanada contourpy-1.3.1+computecanada cycler-0.12.1+computecanada fonttools-4.58.2+computecanada kiwisolver-1.4.8+computecanada matplotlib-3.10.0+computecanada numpy-2.2.2+computecanada ortools-9.10.4067+computecanada packaging-25.0+computecanada pandas-2.2.3+computecanada pillow-11.1.0+computecanada protobuf-6.30.2+computecanada pyparsing-3.2.1+computecanada python-dateutil-2.9.0.post0+computecanada pytz-2025.2+computecanada six-1.17.0+computecanada tzdata-2025.2+computecanada

Starting CP-SAT solver v9.10.4067
Parameters: max_time_in_seconds: 3600 max_memory_in_mb: 12000 log_search_progress: true enumerate_all_solutions: false absolute_gap_limit: 0 relative_gap_limit: 0
Setting number of workers to 48

Initial optimization model '': (model_fingerprint: 0x3be907eadfe9c1d2)
#Variables: 154 (#ints: 5 in objective)
  - 101 Booleans in [0,1]
  - 53 in [0,390]
#kLinear1: 18
#kLinear2: 183
#kLinear3: 66
#kLinearN: 524 (#terms: 4'821)

Starting presolve at 0.00s
  3.37e-04s  0.00e+00d  [DetectDominanceRelations] 
  8.17e-03s  0.00e+00d  [PresolveToFixPoint] #num_loops=6 #num_dual_strengthening=3 
  1.58e-05s  0.00e+00d  [ExtractEncodingFromLinear] #potential_supersets=4 
[Symmetry] Graph for symmetry has 890 nodes and 3'832 arcs.
[Symmetry] Symmetry computation done. time: 0.000464101 dtime: 0.00038803
[SAT presolve] num removable Booleans: 0 / 44
[SAT presolve] num trivial clauses: 0
[SAT presolve] [0s] clauses:12 literals:36 vars:18 one_side_vars:12 simple_definition:6 singleton_clauses:0
[SAT presolve] [3.768e-05s] clauses:12 literals:36 vars:18 one_side_vars:12 simple_definition:6 singleton_clauses:0
[SAT presolve] [5.0511e-05s] clauses:12 literals:36 vars:18 one_side_vars:12 simple_definition:6 singleton_clauses:0
  2.63e-03s  2.95e-04d  [Probe] #probed=194 #fixed_bools=3 #new_bounds=13 #new_binary_clauses=46 
  1.75e-05s  0.00e+00d  [MaxClique] 
  2.38e-04s  0.00e+00d  [DetectDominanceRelations] 
  3.76e-03s  0.00e+00d  [PresolveToFixPoint] #num_loops=4 #num_dual_strengthening=3 
  7.74e-04s  0.00e+00d  [ProcessAtMostOneAndLinear] 
  6.13e-04s  0.00e+00d  [DetectDuplicateConstraints] #duplicates=136 #without_enforcements=36 
  2.28e-04s  8.13e-06d  [DetectDominatedLinearConstraints] #relevant_constraints=308 #num_inclusions=144 #num_redundant=3 
  1.27e-04s  0.00e+00d  [DetectDifferentVariables] #different=20 #cliques=1 #size=3 
  8.59e-05s  2.77e-06d  [ProcessSetPPC] #relevant_constraints=198 
  8.66e-06s  0.00e+00d  [FindAlmostIdenticalLinearConstraints] 
  5.71e-05s  4.05e-05d  [FindBigAtMostOneAndLinearOverlap] 
  5.79e-04s  1.84e-04d  [FindBigVerticalLinearOverlap] #blocks=5 #saved_nz=194 
  4.11e-05s  7.60e-06d  [FindBigHorizontalLinearOverlap] #linears=179 
  2.04e-05s  1.80e-07d  [MergeClauses] 
  2.25e-04s  0.00e+00d  [DetectDominanceRelations] 
  2.62e-03s  0.00e+00d  [PresolveToFixPoint] #num_loops=2 #num_dual_strengthening=1 
  2.21e-04s  0.00e+00d  [DetectDominanceRelations] 
  1.72e-03s  0.00e+00d  [PresolveToFixPoint] #num_loops=1 #num_dual_strengthening=1 
[SAT presolve] num removable Booleans: 0 / 41
[SAT presolve] num trivial clauses: 0
[SAT presolve] [0s] clauses:12 literals:36 vars:18 one_side_vars:12 simple_definition:6 singleton_clauses:0
[SAT presolve] [3.2274e-05s] clauses:12 literals:36 vars:18 one_side_vars:12 simple_definition:6 singleton_clauses:0
[SAT presolve] [4.4313e-05s] clauses:12 literals:36 vars:18 one_side_vars:12 simple_definition:6 singleton_clauses:0
  2.22e-03s  2.80e-04d  [Probe] #probed=188 #new_bounds=2 #new_binary_clauses=46 
  5.02e-06s  0.00e+00d  [MaxClique] 
  2.27e-04s  0.00e+00d  [DetectDominanceRelations] 
  2.24e-03s  0.00e+00d  [PresolveToFixPoint] #num_loops=2 #num_dual_strengthening=1 
  6.31e-04s  0.00e+00d  [ProcessAtMostOneAndLinear] 
  4.67e-04s  0.00e+00d  [DetectDuplicateConstraints] #without_enforcements=36 
  1.36e-04s  5.29e-06d  [DetectDominatedLinearConstraints] #relevant_constraints=247 #num_inclusions=8 
  4.91e-05s  0.00e+00d  [DetectDifferentVariables] 
  8.11e-05s  2.47e-06d  [ProcessSetPPC] #relevant_constraints=194 
  1.06e-05s  0.00e+00d  [FindAlmostIdenticalLinearConstraints] 
  5.28e-05s  3.73e-05d  [FindBigAtMostOneAndLinearOverlap] 
  3.60e-04s  1.64e-04d  [FindBigVerticalLinearOverlap] 
  3.85e-05s  7.60e-06d  [FindBigHorizontalLinearOverlap] #linears=179 
  1.91e-05s  1.80e-07d  [MergeClauses] 
  2.29e-04s  0.00e+00d  [DetectDominanceRelations] 
  1.74e-03s  0.00e+00d  [PresolveToFixPoint] #num_loops=1 #num_dual_strengthening=1 
  2.23e-04s  0.00e+00d  [DetectDominanceRelations] 
  1.72e-03s  0.00e+00d  [PresolveToFixPoint] #num_loops=1 #num_dual_strengthening=1 
[SAT presolve] num removable Booleans: 0 / 41
[SAT presolve] num trivial clauses: 0
[SAT presolve] [0s] clauses:12 literals:36 vars:18 one_side_vars:12 simple_definition:6 singleton_clauses:0
[SAT presolve] [3.3183e-05s] clauses:12 literals:36 vars:18 one_side_vars:12 simple_definition:6 singleton_clauses:0
[SAT presolve] [4.5111e-05s] clauses:12 literals:36 vars:18 one_side_vars:12 simple_definition:6 singleton_clauses:0
  2.21e-03s  2.78e-04d  [Probe] #probed=188 #new_binary_clauses=46 
  5.00e-06s  0.00e+00d  [MaxClique] 
  2.26e-04s  0.00e+00d  [DetectDominanceRelations] 
  1.75e-03s  0.00e+00d  [PresolveToFixPoint] #num_loops=1 #num_dual_strengthening=1 
  6.26e-04s  0.00e+00d  [ProcessAtMostOneAndLinear] 
  4.69e-04s  0.00e+00d  [DetectDuplicateConstraints] #without_enforcements=36 
  1.35e-04s  5.29e-06d  [DetectDominatedLinearConstraints] #relevant_constraints=247 #num_inclusions=8 
  4.97e-05s  0.00e+00d  [DetectDifferentVariables] 
  8.10e-05s  2.47e-06d  [ProcessSetPPC] #relevant_constraints=194 
  1.06e-05s  0.00e+00d  [FindAlmostIdenticalLinearConstraints] 
  5.30e-05s  3.73e-05d  [FindBigAtMostOneAndLinearOverlap] 
  3.68e-04s  1.64e-04d  [FindBigVerticalLinearOverlap] 
  3.84e-05s  7.60e-06d  [FindBigHorizontalLinearOverlap] #linears=179 
  1.75e-05s  1.80e-07d  [MergeClauses] 
  2.28e-04s  0.00e+00d  [DetectDominanceRelations] 
  1.74e-03s  0.00e+00d  [PresolveToFixPoint] #num_loops=1 #num_dual_strengthening=1 
  2.58e-05s  0.00e+00d  [ExpandObjective] #entries=40 #tight_variables=20 #tight_constraints=9 

Presolve summary:
  - 26 affine relations were detected.
  - rule 'TODO dual: only one blocking constraint?' was applied 416 times.
  - rule 'TODO dual: only one unspecified blocking constraint?' was applied 65 times.
  - rule 'TODO duplicate: identical constraint with different enforcements' was applied 108 times.
  - rule 'TODO linear2: contains a Boolean.' was applied 24 times.
  - rule 'TODO no_overlap: with task always last' was applied 1 time.
  - rule 'affine: new relation' was applied 26 times.
  - rule 'all_diff: inferred from x != y constraints' was applied 1 time.
  - rule 'at_most_one: removed literals' was applied 1 time.
  - rule 'at_most_one: size one' was applied 1 time.
  - rule 'deductions: 91 stored' was applied 1 time.
  - rule 'dual: fix variable' was applied 8 times.
  - rule 'dual: reduced domain' was applied 27 times.
  - rule 'duplicate: merged rhs of linear constraint' was applied 26 times.
  - rule 'duplicate: removed constraint' was applied 136 times.
  - rule 'enforcement: false literal' was applied 9 times.
  - rule 'enforcement: true literal' was applied 13 times.
  - rule 'incompatible linear: add implication' was applied 15 times.
  - rule 'linear inclusion: redundant included constraint' was applied 3 times.
  - rule 'linear matrix: common vertical rectangle' was applied 5 times.
  - rule 'linear2: contains a Boolean.' was applied 16 times.
  - rule 'linear: always true' was applied 143 times.
  - rule 'linear: doubleton free' was applied 6 times.
  - rule 'linear: empty' was applied 14 times.
  - rule 'linear: extracted enforcement literal' was applied 1'085 times.
  - rule 'linear: fixed or dup variables' was applied 478 times.
  - rule 'linear: negative clause' was applied 12 times.
  - rule 'linear: positive equal one' was applied 4 times.
  - rule 'linear: reduced variable domains' was applied 62 times.
  - rule 'linear: remapped using affine relations' was applied 480 times.
  - rule 'linear: simplified rhs' was applied 1'702 times.
  - rule 'linear: variable substitution 1' was applied 6 times.
  - rule 'presolve: 42 unused variables removed.' was applied 1 time.
  - rule 'presolve: iteration' was applied 3 times.
  - rule 'probing: reduced enforced constraint to implication.' was applied 1 time.
  - rule 'probing: simplified enforcement list.' was applied 1 time.

Presolved optimization model '': (model_fingerprint: 0x8886015c3b4f671)
#Variables: 85 (#ints: 5 in objective)
  - 41 Booleans in [0,1]
  - 1 in [-2,331]
  - 1 in [0,273]
  - 1 in [0,280]
  - 4 in [0,291]
  - 6 in [0,314]
  - 3 in [0,333]
  - 1 in [2,335]
  - 2 in [3,317]
  - 1 in [3,317][393,701]
  - 1 in [3,336]
  - 1 in [13,327]
  - 1 in [22,336]
  - 1 in [27,341]
  - 2 in [46,379]
  - 1 in [49,363]
  - 1 in [52,385]
  - 1 in [54,368]
  - 1 in [57,348]
  - 1 in [60,348][447,738]
  - 3 in [65,379]
  - 1 in [71,385]
  - 3 in [99,379]
  - 3 in [103,379]
  - 1 in [105,385]
  - 1 in [109,385]
  - 1 in [114,390]
#kAllDiff: 1
#kBoolOr: 12 (#literals: 36)
#kExactlyOne: 4 (#literals: 12)
#kLinear1: 24 (#enforced: 24 #multi: 12)
#kLinear2: 204 (#enforced: 171 #multi: 141)
#kLinear3: 32 (#enforced: 22)
#kLinearN: 182 (#enforced: 123) (#terms: 1'532)

Preloading model.
#Bound   0.04s best:inf   next:[129,1605] initial_domain
#Model   0.04s var:85/85 constraints:459/459

Starting search at 0.04s with 48 workers.
16 full problem subsolvers: [core, default_lp, lb_tree_search, max_lp, no_lp, objective_lb_search, objective_lb_search_max_lp, objective_lb_search_no_lp, objective_shaving_search_max_lp, objective_shaving_search_no_lp, probing, probing_max_lp, pseudo_costs, quick_restart, quick_restart_no_lp, reduced_costs]
30 first solution subsolvers: [fj_long_default(2), fj_long_lin_default, fj_long_lin_perturb, fj_long_lin_random, fj_long_perturb, fj_long_random, fj_short_default(2), fj_short_lin_default(2), fj_short_lin_perturb, fj_short_lin_random, fj_short_perturb, fj_short_random, fs_random(4), fs_random_no_lp(4), fs_random_quick_restart(4), fs_random_quick_restart_no_lp(3)]
13 incomplete subsolvers: [feasibility_pump, graph_arc_lns, graph_cst_lns, graph_dec_lns, graph_var_lns, rins/rens, rnd_cst_lns, rnd_var_lns, violation_ls(5)]
3 helper subsolvers: [neighborhood_helper, synchronization_agent, update_gap_integral]
#Bound   0.05s best:inf   next:[130,1605] bool_core (num_cores=1 [size:2 mw:1 d:1] a=4 d=1 fixed=0/67 clauses=28)
#Bound   0.05s best:inf   next:[131,1605] bool_core (num_cores=1 [cover] a=4 d=1 fixed=0/70 clauses=29)
#Bound   0.05s best:inf   next:[132,1605] bool_core (num_cores=1 [cover] a=4 d=1 fixed=1/73 clauses=31)
#Bound   0.05s best:inf   next:[133,1605] bool_core (num_cores=1 [cover] a=4 d=1 fixed=2/76 clauses=34)
#Bound   0.05s best:inf   next:[134,1605] bool_core (num_cores=1 [cover] a=4 d=1 fixed=3/79 clauses=38)
#1       0.05s best:811   next:[134,810]  no_lp (fixed_bools=0/83)
#Bound   0.05s best:811   next:[143,810]  objective_lb_search_no_lp
#Bound   0.06s best:811   next:[144,810]  bool_core (num_cores=1 [cover] a=4 d=1 fixed=13/109 clauses=133)
#Bound   0.06s best:811   next:[145,810]  bool_core (num_cores=1 [cover] a=4 d=1 fixed=14/112 clauses=148)
#Bound   0.06s best:811   next:[146,810]  bool_core (num_cores=1 [cover] a=4 d=1 fixed=15/115 clauses=164)
#Bound   0.06s best:811   next:[147,810]  bool_core (num_cores=1 [cover] a=4 d=1 fixed=16/118 clauses=181)
#Bound   0.06s best:811   next:[148,810]  bool_core (num_cores=1 [cover] a=4 d=1 fixed=17/121 clauses=199)
#Bound   0.06s best:811   next:[149,810]  bool_core (num_cores=1 [cover] a=4 d=1 fixed=18/124 clauses=218)
#Bound   0.06s best:811   next:[150,810]  bool_core (num_cores=1 [cover] a=4 d=1 fixed=19/127 clauses=238)
#Bound   0.06s best:811   next:[151,810]  bool_core (num_cores=1 [cover] a=4 d=1 fixed=20/130 clauses=259)
#Bound   0.06s best:811   next:[152,810]  bool_core (num_cores=1 [cover] a=4 d=1 fixed=21/133 clauses=281)
#Bound   0.06s best:811   next:[153,810]  bool_core (num_cores=1 [cover] a=4 d=1 fixed=22/136 clauses=304)
#Bound   0.06s best:811   next:[154,810]  bool_core (num_cores=1 [cover] a=4 d=1 fixed=23/139 clauses=328)
#Bound   0.06s best:811   next:[155,810]  bool_core (num_cores=1 [cover] a=4 d=1 fixed=24/142 clauses=353)
#2       0.06s best:810   next:[155,809]  violation_ls(batch:1 #solutions_imported:1 #lin_moves:0 #lin_evals:30 #gen_moves:26 #gen_evals:3 #comp_moves:8 #backtracks:9 #weight_updates:0)
#Bound   0.06s best:810   next:[156,809]  bool_core (num_cores=1 [cover] a=4 d=1 fixed=25/145 clauses=379)
#Bound   0.06s best:810   next:[184,809]  objective_lb_search
#3       0.06s best:809   next:[186,808]  violation_ls(batch:1 #solutions_imported:1 #lin_moves:2 #lin_evals:10 #weight_updates:1)
#4       0.06s best:808   next:[190,807]  violation_ls(batch:1 #solutions_imported:1 #lin_moves:0 #lin_evals:21 #gen_moves:20 #gen_evals:2 #comp_moves:4 #backtracks:8 #weight_updates:0)
#5       0.06s best:802   next:[234,801]  rnd_var_lns (d=0.50 s=38 t=0.10 p=0.00 stall=0 h=auto_l0)
#6       0.06s best:786   next:[238,785]  no_lp (fixed_bools=0/88)
#7       0.06s best:774   next:[239,773]  no_lp (fixed_bools=0/92)
#8       0.06s best:624   next:[239,623]  no_lp (fixed_bools=0/98)
#9       0.06s best:623   next:[239,622]  violation_ls(batch:2 #solutions_imported:2 #lin_moves:6 #lin_evals:29 #weight_updates:4)
#10      0.06s best:622   next:[239,621]  violation_ls(batch:2 #solutions_imported:2 #lin_moves:0 #lin_evals:37 #gen_moves:30 #gen_evals:2 #comp_moves:14 #backtracks:8 #weight_updates:0)
#11      0.06s best:621   next:[239,620]  no_lp (fixed_bools=0/104)
#12      0.06s best:620   next:[239,619]  violation_ls(batch:3 #solutions_imported:3 #lin_moves:1 #lin_evals:74 #gen_moves:58 #gen_evals:6 #comp_moves:12 #backtracks:23 #weight_updates:0)
#13      0.06s best:619   next:[239,618]  violation_ls(batch:3 #solutions_imported:3 #lin_moves:16 #lin_evals:74 #weight_updates:13)
#14      0.06s best:618   next:[239,617]  violation_ls(batch:3 #solutions_imported:3 #lin_moves:0 #lin_evals:43 #gen_moves:34 #gen_evals:2 #comp_moves:18 #backtracks:8 #weight_updates:0)
#15      0.06s best:617   next:[239,616]  violation_ls(batch:3 #solutions_imported:3 #lin_moves:2 #lin_evals:47 #gen_moves:26 #gen_evals:2 #comp_moves:16 #backtracks:5 #weight_updates:1)
#16      0.06s best:613   next:[239,612]  no_lp (fixed_bools=0/112)
#17      0.07s best:611   next:[239,610]  graph_dec_lns (d=0.71 s=57 t=0.10 p=1.00 stall=1 h=auto_l0) [presolve]
#18      0.07s best:609   next:[239,608]  graph_var_lns (d=0.71 s=54 t=0.10 p=1.00 stall=1 h=auto_l0)
#19      0.07s best:607   next:[239,606]  violation_ls(batch:4 #solutions_imported:4 #lin_moves:17 #lin_evals:76 #weight_updates:13)
#20      0.07s best:606   next:[239,605]  violation_ls(batch:4 #solutions_imported:4 #lin_moves:51 #lin_evals:223 #gen_moves:46 #gen_evals:5 #comp_moves:12 #backtracks:17 #weight_updates:26)
#21      0.07s best:604   next:[239,603]  violation_ls(batch:4 #solutions_imported:4 #lin_moves:1 #lin_evals:48 #gen_moves:34 #gen_evals:2 #comp_moves:18 #backtracks:8 #weight_updates:0)
#22      0.07s best:602   next:[239,601]  violation_ls(batch:4 #solutions_imported:4 #lin_moves:3 #lin_evals:52 #gen_moves:26 #gen_evals:2 #comp_moves:16 #backtracks:5 #weight_updates:1)
#23      0.07s best:574   next:[239,573]  rins_pump_lns (d=0.50 s=78 t=0.10 p=0.00 stall=0 h=auto_l0)
#24      0.07s best:573   next:[239,572]  quick_restart_no_lp (fixed_bools=0/159)
#25      0.07s best:572   next:[379,571]  violation_ls(batch:5 #solutions_imported:5 #lin_moves:127 #lin_evals:509 #gen_moves:46 #gen_evals:5 #comp_moves:12 #backtracks:17 #weight_updates:63)
#26      0.07s best:571   next:[379,570]  violation_ls(batch:5 #solutions_imported:5 #lin_moves:3 #lin_evals:56 #gen_moves:27 #gen_evals:2 #comp_moves:17 #backtracks:5 #weight_updates:1)
#27      0.07s best:542   next:[379,541]  no_lp (fixed_bools=0/123)
#28      0.08s best:541   next:[381,540]  violation_ls(batch:6 #solutions_imported:6 #lin_moves:139 #lin_evals:563 #gen_moves:46 #gen_evals:5 #comp_moves:12 #backtracks:17 #weight_updates:72)
#29      0.08s best:534   next:[381,533]  quick_restart_no_lp (fixed_bools=0/194)
#30      0.08s best:532   next:[381,531]  violation_ls(batch:6 #solutions_imported:6 #lin_moves:17 #lin_evals:1'478 #gen_moves:899 #gen_evals:100 #comp_moves:11 #backtracks:444 #weight_updates:19)
#31      0.08s best:530   next:[381,529]  violation_ls(batch:6 #solutions_imported:6 #lin_moves:1 #lin_evals:933 #gen_moves:521 #gen_evals:80 #comp_moves:47 #backtracks:237 #weight_updates:9)
#32      0.08s best:528   next:[381,527]  violation_ls(batch:6 #solutions_imported:6 #lin_moves:3 #lin_evals:59 #gen_moves:28 #gen_evals:2 #comp_moves:18 #backtracks:5 #weight_updates:1)
#33      0.08s best:524   next:[381,523]  graph_dec_lns (d=0.81 s=98 t=0.10 p=1.00 stall=0 h=auto_l0)
#34      0.08s best:523   next:[381,522]  violation_ls(batch:6 #solutions_imported:6 #lin_moves:10 #lin_evals:2'115 #gen_moves:1'366 #gen_evals:204 #comp_moves:48 #backtracks:659 #weight_updates:18)
#35      0.09s best:522   next:[381,521]  violation_ls(batch:7 #solutions_imported:7 #lin_moves:15 #lin_evals:2'136 #gen_moves:1'366 #gen_evals:204 #comp_moves:48 #backtracks:659 #weight_updates:21)
#36      0.09s best:521   next:[381,520]  violation_ls(batch:7 #solutions_imported:7 #lin_moves:17 #lin_evals:1'480 #gen_moves:900 #gen_evals:100 #comp_moves:12 #backtracks:444 #weight_updates:19)
#37      0.09s best:520   next:[381,519]  violation_ls(batch:7 #solutions_imported:7 #lin_moves:139 #lin_evals:571 #gen_moves:57 #gen_evals:8 #comp_moves:15 #backtracks:21 #weight_updates:72)
#38      0.09s best:519   next:[381,518]  violation_ls(batch:7 #solutions_imported:7 #lin_moves:3 #lin_evals:71 #gen_moves:35 #gen_evals:2 #comp_moves:25 #backtracks:5 #weight_updates:1)
#39      0.09s best:518   next:[381,517]  violation_ls(batch:8 #solutions_imported:8 #lin_moves:18 #lin_evals:2'151 #gen_moves:1'366 #gen_evals:204 #comp_moves:48 #backtracks:659 #weight_updates:23)
#40      0.09s best:517   next:[381,516]  violation_ls(batch:8 #solutions_imported:8 #lin_moves:139 #lin_evals:575 #gen_moves:62 #gen_evals:11 #comp_moves:20 #backtracks:21 #weight_updates:72)
#41      0.09s best:516   next:[381,515]  violation_ls(batch:8 #solutions_imported:8 #lin_moves:11 #lin_evals:983 #gen_moves:522 #gen_evals:80 #comp_moves:48 #backtracks:237 #weight_updates:17)
#42      0.10s best:515   next:[381,514]  violation_ls(batch:8 #solutions_imported:8 #lin_moves:3 #lin_evals:144 #gen_moves:80 #gen_evals:6 #comp_moves:32 #backtracks:24 #weight_updates:1)
#43      0.10s best:512   next:[381,511]  no_lp (fixed_bools=0/137)
#44      0.10s best:484   next:[381,483]  graph_arc_lns (d=0.91 s=109 t=0.10 p=1.00 stall=0 h=auto_l0)
#45      0.10s best:483   next:[381,482]  graph_cst_lns (d=0.50 s=136 t=0.10 p=0.00 stall=0 h=auto_l0) [presolve]
#46      0.10s best:482   next:[381,481]  violation_ls(batch:9 #solutions_imported:9 #lin_moves:24 #lin_evals:1'550 #gen_moves:930 #gen_evals:103 #comp_moves:14 #backtracks:458 #weight_updates:25)
#47      0.11s best:481   next:[381,480]  violation_ls(batch:9 #solutions_imported:9 #lin_moves:139 #lin_evals:577 #gen_moves:63 #gen_evals:11 #comp_moves:21 #backtracks:21 #weight_updates:72)
#48      0.11s best:480   next:[381,479]  violation_ls(batch:9 #solutions_imported:9 #lin_moves:3 #lin_evals:197 #gen_moves:118 #gen_evals:9 #comp_moves:34 #backtracks:42 #weight_updates:1)
#49      0.12s best:479   next:[401,478]  violation_ls(batch:10 #solutions_imported:10 #lin_moves:80 #lin_evals:2'390 #gen_moves:1'391 #gen_evals:205 #comp_moves:49 #backtracks:671 #weight_updates:54)
#50      0.13s best:475   next:[401,474]  rnd_var_lns (d=0.91 s=119 t=0.10 p=1.00 stall=0 h=auto_l0)
#51      0.13s best:467   next:[420,466]  no_lp (fixed_bools=0/157)
#52      0.14s best:465   next:[426,464]  no_lp (fixed_bools=0/169)
#53      0.15s best:451   next:[426,450]  no_lp (fixed_bools=0/201)
#Model   0.17s var:84/85 constraints:428/459
#Model   0.17s var:75/85 constraints:253/459
#Done    0.17s objective_lb_search_no_lp
#Done    0.17s quick_restart_no_lp
#Done    0.17s no_lp
#Done    0.17s max_lp
#Model   0.18s var:71/85 constraints:212/459
#Done    0.18s objective_lb_search_max_lp
#Model   0.18s var:70/85 constraints:205/459
#Bound   0.17s best:451   next:[450,450]  objective_lb_search_no_lp [skipped_logs=27]

Task timing                                  n [     min,      max]      avg      dev     time         n [     min,      max]      avg      dev    dtime
                             'core':         1 [132.81ms, 132.81ms] 132.81ms   0.00ns 132.81ms         1 [ 81.59ms,  81.59ms]  81.59ms   0.00ns  81.59ms
                       'default_lp':         1 [132.82ms, 132.82ms] 132.82ms   0.00ns 132.82ms         1 [ 10.53ms,  10.53ms]  10.53ms   0.00ns  10.53ms
                 'feasibility_pump':         7 [  3.85ms,  18.59ms]  11.93ms   4.09ms  83.49ms         6 [  1.57ms,   2.67ms]   1.86ms 405.06us  11.15ms
                  'fj_long_default':         0 [  0.00ns,   0.00ns]   0.00ns   0.00ns   0.00ns         0 [  0.00ns,   0.00ns]   0.00ns   0.00ns   0.00ns
                  'fj_long_default':         0 [  0.00ns,   0.00ns]   0.00ns   0.00ns   0.00ns         0 [  0.00ns,   0.00ns]   0.00ns   0.00ns   0.00ns
              'fj_long_lin_default':         0 [  0.00ns,   0.00ns]   0.00ns   0.00ns   0.00ns         0 [  0.00ns,   0.00ns]   0.00ns   0.00ns   0.00ns
              'fj_long_lin_perturb':         0 [  0.00ns,   0.00ns]   0.00ns   0.00ns   0.00ns         0 [  0.00ns,   0.00ns]   0.00ns   0.00ns   0.00ns
               'fj_long_lin_random':         0 [  0.00ns,   0.00ns]   0.00ns   0.00ns   0.00ns         0 [  0.00ns,   0.00ns]   0.00ns   0.00ns   0.00ns
                  'fj_long_perturb':         0 [  0.00ns,   0.00ns]   0.00ns   0.00ns   0.00ns         0 [  0.00ns,   0.00ns]   0.00ns   0.00ns   0.00ns
                   'fj_long_random':         0 [  0.00ns,   0.00ns]   0.00ns   0.00ns   0.00ns         0 [  0.00ns,   0.00ns]   0.00ns   0.00ns   0.00ns
                 'fj_short_default':         0 [  0.00ns,   0.00ns]   0.00ns   0.00ns   0.00ns         0 [  0.00ns,   0.00ns]   0.00ns   0.00ns   0.00ns
                 'fj_short_default':         1 [ 25.81ms,  25.81ms]  25.81ms   0.00ns  25.81ms         1 [ 15.13ms,  15.13ms]  15.13ms   0.00ns  15.13ms
             'fj_short_lin_default':         0 [  0.00ns,   0.00ns]   0.00ns   0.00ns   0.00ns         0 [  0.00ns,   0.00ns]   0.00ns   0.00ns   0.00ns
             'fj_short_lin_default':         0 [  0.00ns,   0.00ns]   0.00ns   0.00ns   0.00ns         0 [  0.00ns,   0.00ns]   0.00ns   0.00ns   0.00ns
             'fj_short_lin_perturb':         0 [  0.00ns,   0.00ns]   0.00ns   0.00ns   0.00ns         0 [  0.00ns,   0.00ns]   0.00ns   0.00ns   0.00ns
              'fj_short_lin_random':         0 [  0.00ns,   0.00ns]   0.00ns   0.00ns   0.00ns         0 [  0.00ns,   0.00ns]   0.00ns   0.00ns   0.00ns
                 'fj_short_perturb':         0 [  0.00ns,   0.00ns]   0.00ns   0.00ns   0.00ns         0 [  0.00ns,   0.00ns]   0.00ns   0.00ns   0.00ns
                  'fj_short_random':         0 [  0.00ns,   0.00ns]   0.00ns   0.00ns   0.00ns         0 [  0.00ns,   0.00ns]   0.00ns   0.00ns   0.00ns
                        'fs_random':         1 [  4.80ms,   4.80ms]   4.80ms   0.00ns   4.80ms         0 [  0.00ns,   0.00ns]   0.00ns   0.00ns   0.00ns
                        'fs_random':         1 [  4.99ms,   4.99ms]   4.99ms   0.00ns   4.99ms         1 [ 20.00ns,  20.00ns]  20.00ns   0.00ns  20.00ns
                        'fs_random':         1 [  5.02ms,   5.02ms]   5.02ms   0.00ns   5.02ms         0 [  0.00ns,   0.00ns]   0.00ns   0.00ns   0.00ns
                        'fs_random':         1 [  5.64ms,   5.64ms]   5.64ms   0.00ns   5.64ms         1 [ 20.00ns,  20.00ns]  20.00ns   0.00ns  20.00ns
                  'fs_random_no_lp':         1 [  3.56ms,   3.56ms]   3.56ms   0.00ns   3.56ms         0 [  0.00ns,   0.00ns]   0.00ns   0.00ns   0.00ns
                  'fs_random_no_lp':         1 [  3.67ms,   3.67ms]   3.67ms   0.00ns   3.67ms         0 [  0.00ns,   0.00ns]   0.00ns   0.00ns   0.00ns
                  'fs_random_no_lp':         1 [  4.32ms,   4.32ms]   4.32ms   0.00ns   4.32ms         0 [  0.00ns,   0.00ns]   0.00ns   0.00ns   0.00ns
                  'fs_random_no_lp':         1 [  5.92ms,   5.92ms]   5.92ms   0.00ns   5.92ms         0 [  0.00ns,   0.00ns]   0.00ns   0.00ns   0.00ns
          'fs_random_quick_restart':         1 [  3.86ms,   3.86ms]   3.86ms   0.00ns   3.86ms         0 [  0.00ns,   0.00ns]   0.00ns   0.00ns   0.00ns
          'fs_random_quick_restart':         1 [  4.91ms,   4.91ms]   4.91ms   0.00ns   4.91ms         0 [  0.00ns,   0.00ns]   0.00ns   0.00ns   0.00ns
          'fs_random_quick_restart':         1 [  5.11ms,   5.11ms]   5.11ms   0.00ns   5.11ms         0 [  0.00ns,   0.00ns]   0.00ns   0.00ns   0.00ns
          'fs_random_quick_restart':         1 [  5.40ms,   5.40ms]   5.40ms   0.00ns   5.40ms         1 [ 20.00ns,  20.00ns]  20.00ns   0.00ns  20.00ns
    'fs_random_quick_restart_no_lp':         1 [  3.62ms,   3.62ms]   3.62ms   0.00ns   3.62ms         0 [  0.00ns,   0.00ns]   0.00ns   0.00ns   0.00ns
    'fs_random_quick_restart_no_lp':         1 [  4.08ms,   4.08ms]   4.08ms   0.00ns   4.08ms         0 [  0.00ns,   0.00ns]   0.00ns   0.00ns   0.00ns
    'fs_random_quick_restart_no_lp':         1 [  5.72ms,   5.72ms]   5.72ms   0.00ns   5.72ms         0 [  0.00ns,   0.00ns]   0.00ns   0.00ns   0.00ns
                    'graph_arc_lns':         9 [  2.40ms,  78.02ms]  23.32ms  23.55ms 209.86ms         9 [  3.81us,   7.85ms]   1.52ms   2.36ms  13.70ms
                    'graph_cst_lns':         9 [447.12us,   1.36ms] 584.85us 275.26us   5.26ms         1 [ 10.00ns,  10.00ns]  10.00ns   0.00ns  10.00ns
                    'graph_dec_lns':         9 [  1.66ms,  59.49ms]  17.56ms  17.38ms 158.04ms         7 [ 10.00ns,   5.59ms]   1.32ms   1.86ms   9.24ms
                    'graph_var_lns':         9 [  1.62ms,  86.96ms]  16.56ms  25.27ms 149.08ms         9 [ 10.00ns,   9.55ms]   1.20ms   2.96ms  10.84ms
                   'lb_tree_search':         1 [131.32ms, 131.32ms] 131.32ms   0.00ns 131.32ms         1 [ 10.11ms,  10.11ms]  10.11ms   0.00ns  10.11ms
                           'max_lp':         1 [127.58ms, 127.58ms] 127.58ms   0.00ns 127.58ms         1 [  6.20ms,   6.20ms]   6.20ms   0.00ns   6.20ms
                            'no_lp':         1 [125.30ms, 125.30ms] 125.30ms   0.00ns 125.30ms         1 [ 18.07ms,  18.07ms]  18.07ms   0.00ns  18.07ms
              'objective_lb_search':         1 [131.04ms, 131.04ms] 131.04ms   0.00ns 131.04ms         1 [ 17.21ms,  17.21ms]  17.21ms   0.00ns  17.21ms
       'objective_lb_search_max_lp':         1 [130.86ms, 130.86ms] 130.86ms   0.00ns 130.86ms         1 [ 22.24ms,  22.24ms]  22.24ms   0.00ns  22.24ms
        'objective_lb_search_no_lp':         1 [120.46ms, 120.46ms] 120.46ms   0.00ns 120.46ms         1 [ 15.94ms,  15.94ms]  15.94ms   0.00ns  15.94ms
  'objective_shaving_search_max_lp':         8 [  3.25ms,  40.76ms]  12.86ms  10.98ms 102.84ms         5 [163.70us, 718.22us] 283.91us 217.31us   1.42ms
   'objective_shaving_search_no_lp':         8 [  4.11ms,  40.70ms]  12.34ms  11.09ms  98.71ms         5 [173.27us,   3.40ms] 856.94us   1.27ms   4.28ms
                          'probing':         1 [134.38ms, 134.38ms] 134.38ms   0.00ns 134.38ms         1 [  6.44ms,   6.44ms]   6.44ms   0.00ns   6.44ms
                   'probing_max_lp':         1 [131.10ms, 131.10ms] 131.10ms   0.00ns 131.10ms         1 [  6.14ms,   6.14ms]   6.14ms   0.00ns   6.14ms
                     'pseudo_costs':         1 [131.39ms, 131.39ms] 131.39ms   0.00ns 131.39ms         1 [  7.99ms,   7.99ms]   7.99ms   0.00ns   7.99ms
                    'quick_restart':         1 [131.78ms, 131.78ms] 131.78ms   0.00ns 131.78ms         1 [  7.53ms,   7.53ms]   7.53ms   0.00ns   7.53ms
              'quick_restart_no_lp':         1 [121.72ms, 121.72ms] 121.72ms   0.00ns 121.72ms         1 [ 17.04ms,  17.04ms]  17.04ms   0.00ns  17.04ms
                    'reduced_costs':         1 [132.27ms, 132.27ms] 132.27ms   0.00ns 132.27ms         1 [  4.65ms,   4.65ms]   4.65ms   0.00ns   4.65ms
                        'rins/rens':        10 [ 67.38us,  78.62ms]  21.67ms  26.84ms 216.68ms         6 [  2.24us,   9.17ms]   3.10ms   4.04ms  18.58ms
                      'rnd_cst_lns':         9 [775.19us,  30.10ms]  11.05ms  10.16ms  99.42ms         8 [  4.98us,   1.84ms] 476.35us 685.85us   3.81ms
                      'rnd_var_lns':         9 [  1.45ms,  69.04ms]  19.57ms  20.60ms 176.11ms         9 [ 10.00ns,   7.22ms]   1.34ms   2.18ms  12.04ms
                     'violation_ls':         9 [ 92.54us, 516.15us] 248.12us 151.39us   2.23ms         9 [570.00ns, 109.13us]  29.06us  36.82us 261.56us
                     'violation_ls':        10 [ 78.23us,  52.44ms]   5.73ms  15.60ms  57.26ms        10 [450.00ns,  26.91ms]   2.86ms   8.03ms  28.60ms
                     'violation_ls':        10 [ 91.54us,   6.55ms] 884.47us   1.90ms   8.84ms        10 [240.00ns,   2.65ms] 275.40us 793.08us   2.75ms
                     'violation_ls':        10 [104.51us,   9.68ms]   1.31ms   2.81ms  13.15ms        10 [720.00ns,   4.09ms] 448.72us   1.21ms   4.49ms
                     'violation_ls':        10 [115.70us, 790.40us] 390.91us 225.41us   3.91ms        10 [600.00ns, 204.63us]  55.64us  64.88us 556.43us

Search stats                        Bools  Conflicts  Branches  Restarts  BoolPropag  IntegerPropag
                           'core':    423        197     3'210     1'076     179'032         82'471
                     'default_lp':     95         40       675       275       1'438         10'904
                      'fs_random':     62          0         0         0           0              0
                      'fs_random':     62          0         0         0           0              0
                      'fs_random':     62          0         0         0           0              0
                      'fs_random':     62          0        44        44          50            267
                'fs_random_no_lp':     62          0         0         0           0              0
                'fs_random_no_lp':     62          0         0         0           0              0
                'fs_random_no_lp':     62          0         0         0           0              0
                'fs_random_no_lp':     62          0        72        72          60            498
        'fs_random_quick_restart':     62          0         0         0           0              0
        'fs_random_quick_restart':     62          0         0         0           0              0
        'fs_random_quick_restart':     62          0         0         0           0              0
        'fs_random_quick_restart':     62          0         2         2           4             11
  'fs_random_quick_restart_no_lp':     62          0         0         0           0              0
  'fs_random_quick_restart_no_lp':     62          0         0         0           0              0
  'fs_random_quick_restart_no_lp':     62          0        48        48          52            301
                 'lb_tree_search':     62          0       124       124         159            867
                         'max_lp':     62          0       124       124         158            832
                          'no_lp':    206        497     2'777       589      22'894         89'848
            'objective_lb_search':     87        122     1'048       328       4'109         30'935
     'objective_lb_search_max_lp':     76         53       209       125       1'110          6'276
      'objective_lb_search_no_lp':     97        492     1'870       540       8'601         85'560
                        'probing':    104         21       187       187         685          2'549
                 'probing_max_lp':     64          0       128       128         174            902
                   'pseudo_costs':     74          5       350       209         706          6'236
                  'quick_restart':     64         17       795       383       1'560         12'379
            'quick_restart_no_lp':    265        390     3'260       649      29'612         82'508
                  'reduced_costs':     63          1       126       125         190            999

SAT stats                           ClassicMinim  LitRemoved  LitLearned  LitForgotten  Subsumed  MClauses  MDecisions  MLitTrue  MSubsumed  MLitRemoved  MReused
                           'core':            69         316         329             0         2       404       1'837         0         42          128       22
                     'default_lp':             7           8         295             0         2        50         244         0          2            9       10
                      'fs_random':             0           0           0             0         0         0           0         0          0            0        0
                      'fs_random':             0           0           0             0         0         0           0         0          0            0        0
                      'fs_random':             0           0           0             0         0         0           0         0          0            0        0
                      'fs_random':             0           0           0             0         0         0           0         0          0            0        0
                'fs_random_no_lp':             0           0           0             0         0         0           0         0          0            0        0
                'fs_random_no_lp':             0           0           0             0         0         0           0         0          0            0        0
                'fs_random_no_lp':             0           0           0             0         0         0           0         0          0            0        0
                'fs_random_no_lp':             0           0           0             0         0         0           0         0          0            0        0
        'fs_random_quick_restart':             0           0           0             0         0         0           0         0          0            0        0
        'fs_random_quick_restart':             0           0           0             0         0         0           0         0          0            0        0
        'fs_random_quick_restart':             0           0           0             0         0         0           0         0          0            0        0
        'fs_random_quick_restart':             0           0           0             0         0         0           0         0          0            0        0
  'fs_random_quick_restart_no_lp':             0           0           0             0         0         0           0         0          0            0        0
  'fs_random_quick_restart_no_lp':             0           0           0             0         0         0           0         0          0            0        0
  'fs_random_quick_restart_no_lp':             0           0           0             0         0         0           0         0          0            0        0
                 'lb_tree_search':             0           0           0             0         0         0           0         0          0            0        0
                         'max_lp':             0           0           0             0         0         0           0         0          0            0        0
                          'no_lp':           273         607       3'411             0        42       176         904         0         41          214       37
            'objective_lb_search':            62         109         878             0         7        91         607         0         19          121       28
     'objective_lb_search_max_lp':            26          38         405             0         3         0           0         0          0            0        0
      'objective_lb_search_no_lp':           310         688       2'243             0        41       166         886         0         27          150       37
                        'probing':             0           0          21             0         0         0           0         0          0            0        0
                 'probing_max_lp':             0           0           0             0         0         0           0         0          0            0        0
                   'pseudo_costs':             0           0           8             0         0        15          73         0          0            0        1
                  'quick_restart':             8          10         126             0         0        81         388         0          1            3       17
            'quick_restart_no_lp':           206         437       2'741             0        20       184       1'077         0         35          192       42
                  'reduced_costs':             0           0           1             0         0         0           0         0          0            0        0

Lp stats                         Component  Iterations  AddedCuts  OPTIMAL  DUAL_F.  DUAL_U.
                  'default_lp':          1         516        871      108        0        0
                   'fs_random':          1           0          0        0        0        0
                   'fs_random':          1           0          0        0        0        0
                   'fs_random':          1           0          0        0        0        0
                   'fs_random':          1           0          0        0        0        0
     'fs_random_quick_restart':          1           0          0        0        0        0
     'fs_random_quick_restart':          1           0          0        0        0        0
     'fs_random_quick_restart':          1           0          0        0        0        0
     'fs_random_quick_restart':          1           0          0        0        0        0
              'lb_tree_search':          1         319        854        9        1        0
                      'max_lp':          1         246        856        8        0        0
         'objective_lb_search':          1         832        528      147        0        0
  'objective_lb_search_max_lp':          1       1'257        702       82       33        0
                     'probing':          1         270        832       50        0        0
              'probing_max_lp':          1         237        915        7        0        0
                'pseudo_costs':          1         424        809       27        2        0
               'quick_restart':          1         337        980       59        0        0
               'reduced_costs':          1         335      1'069       19        0        0

Lp dimension                                                                    Final dimension of first component
                  'default_lp':  334 rows, 78 columns, 1554 entries with magnitude in [1.013339e-03, 1.000000e+00]
                   'fs_random':       0 rows, 78 columns, 0 entries with magnitude in [0.000000e+00, 0.000000e+00]
                   'fs_random':       0 rows, 78 columns, 0 entries with magnitude in [0.000000e+00, 0.000000e+00]
                   'fs_random':       0 rows, 78 columns, 0 entries with magnitude in [0.000000e+00, 0.000000e+00]
                   'fs_random':       0 rows, 78 columns, 0 entries with magnitude in [0.000000e+00, 0.000000e+00]
     'fs_random_quick_restart':       0 rows, 78 columns, 0 entries with magnitude in [0.000000e+00, 0.000000e+00]
     'fs_random_quick_restart':       0 rows, 78 columns, 0 entries with magnitude in [0.000000e+00, 0.000000e+00]
     'fs_random_quick_restart':       0 rows, 78 columns, 0 entries with magnitude in [0.000000e+00, 0.000000e+00]
     'fs_random_quick_restart':       0 rows, 78 columns, 0 entries with magnitude in [0.000000e+00, 0.000000e+00]
              'lb_tree_search':  686 rows, 85 columns, 3863 entries with magnitude in [4.612651e-03, 1.000000e+00]
                      'max_lp':  652 rows, 85 columns, 4016 entries with magnitude in [6.627825e-03, 1.000000e+00]
         'objective_lb_search':   166 rows, 78 columns, 533 entries with magnitude in [3.079078e-03, 1.000000e+00]
  'objective_lb_search_max_lp':  352 rows, 85 columns, 1282 entries with magnitude in [3.368962e-03, 1.000000e+00]
                     'probing':  313 rows, 78 columns, 2486 entries with magnitude in [8.544778e-05, 1.000000e+00]
              'probing_max_lp':  609 rows, 85 columns, 3896 entries with magnitude in [5.407381e-04, 1.000000e+00]
                'pseudo_costs':  398 rows, 85 columns, 1741 entries with magnitude in [1.860626e-03, 1.000000e+00]
               'quick_restart':  383 rows, 78 columns, 1815 entries with magnitude in [9.932341e-04, 1.000000e+00]
               'reduced_costs':   396 rows, 85 columns, 635 entries with magnitude in [4.249271e-03, 1.000000e+00]

Lp debug                         CutPropag  CutEqPropag  Adjust  Overflow    Bad  BadScaling
                  'default_lp':          0            0      67         0    591           0
                   'fs_random':          0            0       0         0      0           0
                   'fs_random':          0            0       0         0      0           0
                   'fs_random':          0            0       0         0      0           0
                   'fs_random':          0            0       0         0      0           0
     'fs_random_quick_restart':          0            0       0         0      0           0
     'fs_random_quick_restart':          0            0       0         0      0           0
     'fs_random_quick_restart':          0            0       0         0      0           0
     'fs_random_quick_restart':          0            0       0         0      0           0
              'lb_tree_search':          0            0       9         0    777           0
                      'max_lp':          0            0       7         0    600           0
         'objective_lb_search':          0            0      80         0    263           0
  'objective_lb_search_max_lp':          1            0      73         0    368           0
                     'probing':          0            9      37         0  1'150           0
              'probing_max_lp':          0            0       6         0    565           0
                'pseudo_costs':          0            0      20         0    782           0
               'quick_restart':          0            8      47         0    691           0
               'reduced_costs':          1            2      10         0    751           0

Lp pool                          Constraints  Updates  Simplif  Merged  Shortened  Split  Strenghtened    Cuts/Call
                  'default_lp':          976       68      155       1          0     16           285    871/1'372
                   'fs_random':          106        0        0       0          0      0             0          0/0
                   'fs_random':          106        0        0       0          0      0             0          0/0
                   'fs_random':          106        0        0       0          0      0             0          0/0
                   'fs_random':          106        0        0       0          0      0             0          0/0
     'fs_random_quick_restart':          106        0        0       0          0      0             0          0/0
     'fs_random_quick_restart':          106        0        0       0          0      0             0          0/0
     'fs_random_quick_restart':          106        0        0       0          0      0             0          0/0
     'fs_random_quick_restart':          106        0        0       0          0      0             0          0/0
              'lb_tree_search':        1'309       50      589       3        279      9         1'113    854/1'327
                      'max_lp':        1'314        5        0       0          0      8           130    856/1'378
         'objective_lb_search':          634        9       35       0          0      0            73      528/926
  'objective_lb_search_max_lp':        1'160       13       80       0          0      6           391    702/1'102
                     'probing':          935       60       38       3          0     15           174    832/1'333
              'probing_max_lp':        1'373        4        0       0          0      4            96    915/1'477
                'pseudo_costs':        1'267       37      392       0          0     10         1'142    809/1'353
               'quick_restart':        1'084       46      145       2          0      9           238    980/1'522
               'reduced_costs':        1'526       77    2'622       1      1'234      4         1'008  1'069/1'770

Lp Cut            defaul  max_lp  quick_  reduce  pseudo  lb_tre  probin  object  probin  object
          CG_FF:     136     119     137     132     103     108      83      59     128      84
           CG_K:      30      41      44      83      53      34      43      28      40      49
           CG_R:      76     111      74      75      30     100      50      43     112      39
          CG_RB:     193     155     207     234     148     165     250      67     202     121
         CG_RBP:      60      55      84      51      19      59      37      11      58      12
         Clique:       -       -       -       -       -       -       -       -       -       2
             IB:     145      91     135     138     124      95     123     134      90     129
       MIR_1_FF:      44      49      57      72      64      58      35      31      57      43
        MIR_1_K:      19       6      30      17       9       8      11      21       6       8
        MIR_1_R:      19       1      30       7       2       1       4      21       2       2
       MIR_1_RB:      24      31      35      44      52      43      26      22      34      39
      MIR_1_RBP:       3       9       3       8      10       5       3       1       4       8
      MIR_1_RLT:       -       4       -      20      13       4       -       -       4      14
       MIR_2_FF:      15      15      12      17      22      23      20      12      17      10
        MIR_2_K:       1       3       3       2       3       6       4       5       6       5
        MIR_2_R:       2       2       1       2       5       1       6       7       2       3
       MIR_2_RB:      11      12      15      15      17      20      17       6      14      15
      MIR_2_RBP:       1       2       -       2       1       2       3       -       -       5
       MIR_3_FF:      13      15      11      12      11      13       8       4      18      11
        MIR_3_K:       4       3       -       4       3       4       3       1       4       3
        MIR_3_R:       5       4       6       7       5       5       6       4       7       1
       MIR_3_RB:       9      13       8      13      10      14      13       8       7      11
      MIR_3_RBP:       1       1       1       7       2       1       4       1       -       3
       MIR_4_FF:       3      10       3      10       6       7      10       2      12       4
        MIR_4_K:       -       1       -       2       1       2       4       -       -       1
       MIR_4_KL:       -       -       -       1       -       -       -       -       -       -
        MIR_4_R:       -       5       1       2       2       2       6       2       1       2
       MIR_4_RB:       1      10       2       6       9       4       7       1       6       8
      MIR_4_RBP:       -       1       -       1       2       -       2       1       3       1
       MIR_5_FF:       2       7       -       1       -       3       -       1       5       2
        MIR_5_K:       1       3       -       -       -       -       -       -       1       -
        MIR_5_R:       -       1       -       -       1       1       1       1       -       -
       MIR_5_RB:       2       4       -       2       -       1       4       1       3       -
      MIR_5_RBP:       -       -       -       -       -       -       1       -       1       -
       MIR_6_FF:       1       2       -       -       -       -       -       -       1       1
        MIR_6_K:       -       1       -       -       -       -       -       -       1       -
        MIR_6_R:       -       2       -       -       -       -       1       -       1       -
       MIR_6_RB:       2       2       -       -       -       -       1       -       2       -
      MIR_6_RBP:       -       1       -       -       -       -       1       -       -       -
   ZERO_HALF_FF:      10      19      16      26      16      20       8       7      24      21
    ZERO_HALF_K:       2       3       4       4       3       1       3       1       3       3
    ZERO_HALF_R:      17      20      30      25      34      24      17      12      20      19
   ZERO_HALF_RB:      14      13      22      23      24      14      15      11       8      21
  ZERO_HALF_RBP:       5       9       9       4       5       6       2       2      11       2

LNS stats           Improv/Calls  Closed  Difficulty  TimeLimit
  'graph_arc_lns':           9/9     89%        0.97       0.10
  'graph_cst_lns':           1/1    100%        0.71       0.10
  'graph_dec_lns':           8/9     89%        0.97       0.10
  'graph_var_lns':           6/9     89%        0.97       0.10
      'rins/rens':           5/9    100%        0.98       0.10
    'rnd_cst_lns':           6/8    100%        0.98       0.10
    'rnd_var_lns':           9/9     89%        0.97       0.10

LS stats                   Batches  Restarts  LinMoves  GenMoves  CompoundMoves  WeightUpdates
       'fj_long_default':        0         0         0         0              0              0
       'fj_long_default':        0         0         0         0              0              0
   'fj_long_lin_default':        0         0         0         0              0              0
   'fj_long_lin_perturb':        0         0         0         0              0              0
    'fj_long_lin_random':        0         0         0         0              0              0
       'fj_long_perturb':        0         0         0         0              0              0
        'fj_long_random':        0         0         0         0              0              0
      'fj_short_default':        0         0         0         0              0              0
      'fj_short_default':        1         1         0     1'919            231              4
  'fj_short_lin_default':        0         0         0         0              0              0
  'fj_short_lin_default':        0         0         0         0              0              0
  'fj_short_lin_perturb':        0         0         0         0              0              0
   'fj_short_lin_random':        0         0         0         0              0              0
      'fj_short_perturb':        0         0         0         0              0              0
       'fj_short_random':        0         0         0         0              0              0
          'violation_ls':       10         0        12     5'961            157             61
          'violation_ls':       10         0       141        63             21             73
          'violation_ls':       10         0        25       930             14             25
          'violation_ls':       10         0        80     1'391             49             54
          'violation_ls':        9         0         3       118             34              1

Solutions (53)            Num     Rank
        'graph_arc_lns':    1  [44,44]
        'graph_cst_lns':    1  [45,45]
        'graph_dec_lns':    2  [17,33]
        'graph_var_lns':    1  [18,18]
                'no_lp':   11   [1,53]
  'quick_restart_no_lp':    2  [24,29]
        'rins_pump_lns':    1  [23,23]
          'rnd_var_lns':    2   [5,50]
         'violation_ls':   32   [2,49]

Objective bounds                Num
                  'bool_core':   18
             'initial_domain':    1
        'objective_lb_search':    1
  'objective_lb_search_no_lp':   29

Solution repositories    Added  Queried  Ignored  Synchro
  'feasible solutions':    125      182        3       90
        'lp solutions':      0        0        0        0
                'pump':    107        9

Improving bounds shared          Num
                        'core':    2
                  'default_lp':    4
                       'no_lp':   35
  'objective_lb_search_max_lp':    1
   'objective_lb_search_no_lp':   53
                'pseudo_costs':    6
               'quick_restart':    1
         'quick_restart_no_lp':   94
               'reduced_costs':   14

Clauses shared                  Num
                 'default_lp':    1
                      'no_lp':   16
  'objective_lb_search_no_lp':    2
               'pseudo_costs':   19
              'quick_restart':   27
        'quick_restart_no_lp':    1
              'reduced_costs':    2

CpSolverResponse summary:
status: OPTIMAL
objective: 451
best_bound: 451
integers: 81
booleans: 62
conflicts: 0
branches: 44
propagations: 50
integer_propagations: 267
restarts: 44
lp_iterations: 0
walltime: 0.189811
usertime: 0.189811
deterministic_time: 0.370066
gap_integral: 0.468901
solution_fingerprint: 0x3f3e4aa79d5c0f56


--- Simulation Gantt  partir du modle mathmatique ---
{'big':0, 'due_date':55, 'pos_time':5, 'status':1, 'blocked':0, 'operations':["{'type':0, 'processing_time':49}"]}
{'big':0, 'due_date':117, 'pos_time':5, 'status':3, 'blocked':1, 'operations':["{'type':0, 'processing_time':54}", "{'type':1, 'processing_time':37}"]}
{'big':0, 'due_date':110, 'pos_time':5, 'status':1, 'blocked':0, 'operations':["{'type':1, 'processing_time':18}", "{'type':0, 'processing_time':44}"]}
{'big':0, 'due_date':63, 'pos_time':5, 'status':1, 'blocked':1, 'operations':["{'type':1, 'processing_time':45}", "{'type':0, 'processing_time':17}"]}
