created virtual environment CPython3.12.4.final.0-64 in 1145ms
  creator CPython3Posix(dest=/localscratch/aneumann.46806141.0/env, clear=False, no_vcs_ignore=False, global=False)
  seeder FromAppData(download=False, pip=bundle, via=copy, app_data_dir=/home/aneumann/.local/share/virtualenv)
    added seed packages: pip==24.2+computecanada
  activators BashActivator,CShellActivator,FishActivator,NushellActivator,PowerShellActivator,PythonActivator
Looking in links: /cvmfs/soft.computecanada.ca/custom/python/wheelhouse/gentoo2023/x86-64-v3, /cvmfs/soft.computecanada.ca/custom/python/wheelhouse/gentoo2023/generic, /cvmfs/soft.computecanada.ca/custom/python/wheelhouse/generic
Requirement already satisfied: pip in /localscratch/aneumann.46806141.0/env/lib/python3.12/site-packages (24.2+computecanada)
Processing /cvmfs/soft.computecanada.ca/custom/python/wheelhouse/generic/pip-25.0+computecanada-py3-none-any.whl
Installing collected packages: pip
  Attempting uninstall: pip
    Found existing installation: pip 24.2+computecanada
    Uninstalling pip-24.2+computecanada:
      Successfully uninstalled pip-24.2+computecanada
Successfully installed pip-25.0+computecanada
Looking in links: /cvmfs/soft.computecanada.ca/custom/python/wheelhouse/gentoo2023/x86-64-v3, /cvmfs/soft.computecanada.ca/custom/python/wheelhouse/gentoo2023/generic, /cvmfs/soft.computecanada.ca/custom/python/wheelhouse/generic
ERROR: protobuf-5.28.3-cp38-abi3-manylinux2014_x86_64.whl is not a supported wheel on this platform.
Looking in links: /cvmfs/soft.computecanada.ca/custom/python/wheelhouse/gentoo2023/x86-64-v3, /cvmfs/soft.computecanada.ca/custom/python/wheelhouse/gentoo2023/generic, /cvmfs/soft.computecanada.ca/custom/python/wheelhouse/generic
Processing /home/aneumann/projects/def-adhaj/aneumann/GNRS/wheels/immutabledict-4.2.0-py3-none-any.whl
Installing collected packages: immutabledict
Successfully installed immutabledict-4.2.0
Looking in links: /cvmfs/soft.computecanada.ca/custom/python/wheelhouse/gentoo2023/x86-64-v3, /cvmfs/soft.computecanada.ca/custom/python/wheelhouse/gentoo2023/generic, /cvmfs/soft.computecanada.ca/custom/python/wheelhouse/generic
Processing /cvmfs/soft.computecanada.ca/custom/python/wheelhouse/generic/ortools-9.10.4067+computecanada-cp312-cp312-linux_x86_64.whl (from -r /home/aneumann/projects/def-adhaj/aneumann/GNRS/requirements/or.txt (line 1))
Processing /cvmfs/soft.computecanada.ca/custom/python/wheelhouse/gentoo2023/x86-64-v3/matplotlib-3.10.0+computecanada-cp312-cp312-linux_x86_64.whl (from -r /home/aneumann/projects/def-adhaj/aneumann/GNRS/requirements/or.txt (line 2))
Processing /cvmfs/soft.computecanada.ca/custom/python/wheelhouse/gentoo2023/x86-64-v3/pandas-2.2.3+computecanada-cp312-cp312-linux_x86_64.whl (from -r /home/aneumann/projects/def-adhaj/aneumann/GNRS/requirements/or.txt (line 3))
Processing /cvmfs/soft.computecanada.ca/custom/python/wheelhouse/generic/absl_py-2.3.0+computecanada-py3-none-any.whl (from ortools<9.11,>=9.10->-r /home/aneumann/projects/def-adhaj/aneumann/GNRS/requirements/or.txt (line 1))
Processing /cvmfs/soft.computecanada.ca/custom/python/wheelhouse/gentoo2023/generic/numpy-2.2.2+computecanada-cp312-cp312-linux_x86_64.whl (from ortools<9.11,>=9.10->-r /home/aneumann/projects/def-adhaj/aneumann/GNRS/requirements/or.txt (line 1))
Processing /cvmfs/soft.computecanada.ca/custom/python/wheelhouse/gentoo2023/x86-64-v3/protobuf-6.31.1+computecanada-cp312-cp312-linux_x86_64.whl (from ortools<9.11,>=9.10->-r /home/aneumann/projects/def-adhaj/aneumann/GNRS/requirements/or.txt (line 1))
Requirement already satisfied: immutabledict>=3.0.0 in /localscratch/aneumann.46806141.0/env/lib/python3.12/site-packages (from ortools<9.11,>=9.10->-r /home/aneumann/projects/def-adhaj/aneumann/GNRS/requirements/or.txt (line 1)) (4.2.0)
Processing /cvmfs/soft.computecanada.ca/custom/python/wheelhouse/gentoo2023/generic/contourpy-1.3.1+computecanada-cp312-cp312-linux_x86_64.whl (from matplotlib->-r /home/aneumann/projects/def-adhaj/aneumann/GNRS/requirements/or.txt (line 2))
Processing /cvmfs/soft.computecanada.ca/custom/python/wheelhouse/generic/cycler-0.12.1+computecanada-py3-none-any.whl (from matplotlib->-r /home/aneumann/projects/def-adhaj/aneumann/GNRS/requirements/or.txt (line 2))
Processing /cvmfs/soft.computecanada.ca/custom/python/wheelhouse/generic/fonttools-4.59.0+computecanada-cp312-cp312-linux_x86_64.whl (from matplotlib->-r /home/aneumann/projects/def-adhaj/aneumann/GNRS/requirements/or.txt (line 2))
Processing /cvmfs/soft.computecanada.ca/custom/python/wheelhouse/gentoo2023/x86-64-v3/kiwisolver-1.4.8+computecanada-cp312-cp312-linux_x86_64.whl (from matplotlib->-r /home/aneumann/projects/def-adhaj/aneumann/GNRS/requirements/or.txt (line 2))
Processing /cvmfs/soft.computecanada.ca/custom/python/wheelhouse/generic/packaging-25.0+computecanada-py3-none-any.whl (from matplotlib->-r /home/aneumann/projects/def-adhaj/aneumann/GNRS/requirements/or.txt (line 2))
Processing /cvmfs/soft.computecanada.ca/custom/python/wheelhouse/gentoo2023/x86-64-v3/pillow-11.1.0+computecanada-cp312-cp312-linux_x86_64.whl (from matplotlib->-r /home/aneumann/projects/def-adhaj/aneumann/GNRS/requirements/or.txt (line 2))
Processing /cvmfs/soft.computecanada.ca/custom/python/wheelhouse/generic/pyparsing-3.2.3+computecanada-py3-none-any.whl (from matplotlib->-r /home/aneumann/projects/def-adhaj/aneumann/GNRS/requirements/or.txt (line 2))
Processing /cvmfs/soft.computecanada.ca/custom/python/wheelhouse/generic/python_dateutil-2.9.0.post0+computecanada-py2.py3-none-any.whl (from matplotlib->-r /home/aneumann/projects/def-adhaj/aneumann/GNRS/requirements/or.txt (line 2))
Processing /cvmfs/soft.computecanada.ca/custom/python/wheelhouse/generic/pytz-2025.2+computecanada-py2.py3-none-any.whl (from pandas->-r /home/aneumann/projects/def-adhaj/aneumann/GNRS/requirements/or.txt (line 3))
Processing /cvmfs/soft.computecanada.ca/custom/python/wheelhouse/generic/tzdata-2025.2+computecanada-py2.py3-none-any.whl (from pandas->-r /home/aneumann/projects/def-adhaj/aneumann/GNRS/requirements/or.txt (line 3))
Processing /cvmfs/soft.computecanada.ca/custom/python/wheelhouse/generic/six-1.17.0+computecanada-py2.py3-none-any.whl (from python-dateutil>=2.7->matplotlib->-r /home/aneumann/projects/def-adhaj/aneumann/GNRS/requirements/or.txt (line 2))
Installing collected packages: pytz, tzdata, six, pyparsing, protobuf, pillow, packaging, numpy, kiwisolver, fonttools, cycler, absl-py, python-dateutil, contourpy, pandas, matplotlib, ortools
Successfully installed absl-py-2.3.0+computecanada contourpy-1.3.1+computecanada cycler-0.12.1+computecanada fonttools-4.59.0+computecanada kiwisolver-1.4.8+computecanada matplotlib-3.10.0+computecanada numpy-2.2.2+computecanada ortools-9.10.4067+computecanada packaging-25.0+computecanada pandas-2.2.3+computecanada pillow-11.1.0+computecanada protobuf-6.31.1+computecanada pyparsing-3.2.3+computecanada python-dateutil-2.9.0.post0+computecanada pytz-2025.2+computecanada six-1.17.0+computecanada tzdata-2025.2+computecanada

Starting CP-SAT solver v9.10.4067
Parameters: max_time_in_seconds: 86400 max_memory_in_mb: 185000 log_search_progress: true enumerate_all_solutions: false num_search_workers: 32 absolute_gap_limit: 0 relative_gap_limit: 0

Initial optimization model '': (model_fingerprint: 0x45f6304ad630febd)
#Variables: 362 (#ints: 9 in objective)
  - 269 Booleans in [0,1]
  - 93 in [0,677]
#kLinear1: 47
#kLinear2: 522
#kLinear3: 202
#kLinearN: 5'132 (#terms: 81'107)

Starting presolve at 0.00s
  2.33e-03s  0.00e+00d  [DetectDominanceRelations] 
  3.71e-02s  0.00e+00d  [PresolveToFixPoint] #num_loops=8 #num_dual_strengthening=3 
  3.76e-05s  0.00e+00d  [ExtractEncodingFromLinear] #potential_supersets=3 
[Symmetry] Graph for symmetry has 5'887 nodes and 63'945 arcs.
[Symmetry] Symmetry computation done. time: 0.00220954 dtime: 0.00473065
[Symmetry] #generators: 1, average support size: 22
[Symmetry] The model contains 256 duplicate constraints !
[Symmetry] 11 orbits with sizes: 2,2,2,2,2,2,2,2,2,2,...
[Symmetry] Num fixable by intersecting at_most_one with orbits: 1 largest_orbit: 2
  1.45e-02s  3.68e-03d  [Probe] #probed=392 #new_bounds=11 #equiv=1 
  8.83e-05s  0.00e+00d  [MaxClique] Merged 15(30 literals) into 7(14 literals) at_most_ones. 
  2.21e-03s  0.00e+00d  [DetectDominanceRelations] 
  1.71e-02s  0.00e+00d  [PresolveToFixPoint] #num_loops=5 #num_dual_strengthening=3 
  7.52e-03s  0.00e+00d  [ProcessAtMostOneAndLinear] 
  2.76e-03s  0.00e+00d  [DetectDuplicateConstraints] #duplicates=339 #without_enforcements=182 
  3.42e-03s  3.37e-04d  [DetectDominatedLinearConstraints] #relevant_constraints=4'502 #num_inclusions=3'731 
  4.52e-04s  0.00e+00d  [DetectDifferentVariables] #different=33 #cliques=1 #size=7 
  7.18e-04s  9.13e-05d  [ProcessSetPPC] #relevant_constraints=4'019 
  1.93e-05s  0.00e+00d  [FindAlmostIdenticalLinearConstraints] 
  1.38e-04s  1.92e-04d  [FindBigAtMostOneAndLinearOverlap] 
  6.76e-03s  5.75e-03d  [FindBigVerticalLinearOverlap] #blocks=52 #saved_nz=9'136 
  4.73e-04s  2.21e-04d  [FindBigHorizontalLinearOverlap] #linears=3'958 
  2.37e-05s  0.00e+00d  [MergeClauses] 
  2.53e-03s  0.00e+00d  [DetectDominanceRelations] 
  2.35e-02s  0.00e+00d  [PresolveToFixPoint] #num_loops=2 #num_dual_strengthening=1 
  2.51e-03s  0.00e+00d  [DetectDominanceRelations] 
  1.43e-02s  0.00e+00d  [PresolveToFixPoint] #num_loops=1 #num_dual_strengthening=1 
[Symmetry] Graph for symmetry has 5'710 nodes and 53'585 arcs.
[Symmetry] Symmetry computation done. time: 0.00109885 dtime: 0.00279153
  1.32e-02s  3.22e-03d  [Probe] #probed=392 #new_bounds=33 
  1.56e-05s  0.00e+00d  [MaxClique] 
  2.53e-03s  0.00e+00d  [DetectDominanceRelations] 
  2.06e-02s  0.00e+00d  [PresolveToFixPoint] #num_loops=2 #num_dual_strengthening=1 
  6.91e-03s  0.00e+00d  [ProcessAtMostOneAndLinear] 
  2.46e-03s  0.00e+00d  [DetectDuplicateConstraints] #without_enforcements=212 
  2.16e-03s  2.08e-04d  [DetectDominatedLinearConstraints] #relevant_constraints=4'162 #num_inclusions=892 
  3.11e-04s  0.00e+00d  [DetectDifferentVariables] 
  6.72e-04s  7.07e-05d  [ProcessSetPPC] #relevant_constraints=3'805 
  2.97e-05s  2.35e-07d  [FindAlmostIdenticalLinearConstraints] #num_tested_pairs=15 
  7.47e-05s  9.91e-05d  [FindBigAtMostOneAndLinearOverlap] 
  5.20e-03s  4.40e-03d  [FindBigVerticalLinearOverlap] #blocks=75 #saved_nz=6'384 
  4.13e-04s  1.78e-04d  [FindBigHorizontalLinearOverlap] #linears=3'598 
  1.45e-05s  0.00e+00d  [MergeClauses] 
  2.31e-03s  0.00e+00d  [DetectDominanceRelations] 
  2.39e-02s  0.00e+00d  [PresolveToFixPoint] #num_loops=2 #num_dual_strengthening=1 
  2.30e-03s  0.00e+00d  [DetectDominanceRelations] 
  1.57e-02s  0.00e+00d  [PresolveToFixPoint] #num_loops=1 #num_dual_strengthening=1 
[Symmetry] Graph for symmetry has 5'920 nodes and 47'263 arcs.
[Symmetry] Symmetry computation done. time: 0.000955857 dtime: 0.00252498
  1.20e-02s  2.92e-03d  [Probe] #probed=392 #new_bounds=58 
  1.54e-05s  0.00e+00d  [MaxClique] 
  2.30e-03s  0.00e+00d  [DetectDominanceRelations] 
  2.27e-02s  0.00e+00d  [PresolveToFixPoint] #num_loops=2 #num_dual_strengthening=1 
  6.55e-03s  0.00e+00d  [ProcessAtMostOneAndLinear] 
  2.42e-03s  0.00e+00d  [DetectDuplicateConstraints] #without_enforcements=212 
  1.84e-03s  1.63e-04d  [DetectDominatedLinearConstraints] #relevant_constraints=4'227 #num_inclusions=722 
  2.95e-04s  0.00e+00d  [DetectDifferentVariables] 
  6.04e-04s  5.67e-05d  [ProcessSetPPC] #relevant_constraints=3'600 
  3.78e-05s  1.00e-06d  [FindAlmostIdenticalLinearConstraints] #num_tested_pairs=65 
  6.41e-05s  7.49e-05d  [FindBigAtMostOneAndLinearOverlap] 
  4.74e-03s  3.55e-03d  [FindBigVerticalLinearOverlap] #blocks=85 #saved_nz=6'449 
  3.72e-04s  1.38e-04d  [FindBigHorizontalLinearOverlap] #linears=3'223 
  1.52e-05s  0.00e+00d  [MergeClauses] 
  2.03e-03s  0.00e+00d  [DetectDominanceRelations] 
  2.40e-02s  0.00e+00d  [PresolveToFixPoint] #num_loops=2 #num_dual_strengthening=1 
  1.05e-04s  0.00e+00d  [ExpandObjective] #entries=982 #tight_variables=348 #tight_constraints=199 

Presolve summary:
  - 91 affine relations were detected.
  - rule 'TODO dual: only one blocking constraint?' was applied 681 times.
  - rule 'TODO dual: only one blocking enforced constraint?' was applied 130 times.
  - rule 'TODO dual: only one unspecified blocking constraint?' was applied 60 times.
  - rule 'TODO duplicate: identical constraint with different enforcements' was applied 606 times.
  - rule 'affine: new relation' was applied 91 times.
  - rule 'at_most_one: removed literals' was applied 7 times.
  - rule 'at_most_one: size one' was applied 7 times.
  - rule 'at_most_one: transformed into max clique.' was applied 1 time.
  - rule 'deductions: 326 stored' was applied 1 time.
  - rule 'dual: fix variable' was applied 24 times.
  - rule 'dual: reduced domain' was applied 58 times.
  - rule 'duplicate: merged rhs of linear constraint' was applied 79 times.
  - rule 'duplicate: removed constraint' was applied 339 times.
  - rule 'enforcement: false literal' was applied 10 times.
  - rule 'exactly_one: x and not(x)' was applied 1 time.
  - rule 'incompatible linear: add implication' was applied 63 times.
  - rule 'linear matrix: common vertical rectangle' was applied 212 times.
  - rule 'linear: always true' was applied 659 times.
  - rule 'linear: doubleton free' was applied 13 times.
  - rule 'linear: empty' was applied 36 times.
  - rule 'linear: extracted enforcement literal' was applied 8'624 times.
  - rule 'linear: fixed or dup variables' was applied 5'305 times.
  - rule 'linear: positive equal one' was applied 3 times.
  - rule 'linear: reduced variable domains' was applied 317 times.
  - rule 'linear: remapped using affine relations' was applied 5'288 times.
  - rule 'linear: simplified rhs' was applied 16'275 times.
  - rule 'linear: tightened into equality' was applied 6 times.
  - rule 'linear: variable substitution 1' was applied 13 times.
  - rule 'linear: variable substitution 2' was applied 1 time.
  - rule 'linear: variable substitution 3' was applied 6 times.
  - rule 'no_overlap: inferred from x != y constraints' was applied 1 time.
  - rule 'presolve: 99 unused variables removed.' was applied 1 time.
  - rule 'presolve: iteration' was applied 3 times.
  - rule 'probing: reduced enforced constraint to implication.' was applied 15 times.
  - rule 'symmetry: fixed to false in general orbit' was applied 1 time.

Presolved optimization model '': (model_fingerprint: 0x993d902690625547)
#Variables: 364 (#ints: 9 in objective)
  - 98 Booleans in [0,1]
  - 224 different domains in [-6674,6624] with a largest complexity of 13.
#kExactlyOne: 2 (#literals: 6)
#kInterval: 7
#kLinear2: 798 (#enforced: 756 #multi: 602)
#kLinear3: 721 (#enforced: 533 #multi: 47)
#kLinearN: 3'424 (#enforced: 3'298 #multi: 85) (#terms: 28'157)
#kNoOverlap: 1 (#intervals: 7)

Preloading model.
#Bound   0.32s best:inf   next:[171,5011] initial_domain
[Symmetry] Graph for symmetry has 5'945 nodes and 40'882 arcs.
[Symmetry] Symmetry computation done. time: 0.000821966 dtime: 0.00222964
#Model   0.33s var:364/364 constraints:4953/4953

Starting search at 0.33s with 32 workers.
17 full problem subsolvers: [core, default_lp, fixed, lb_tree_search, max_lp, no_lp, objective_lb_search, objective_lb_search_max_lp, objective_lb_search_no_lp, objective_shaving_search_max_lp, objective_shaving_search_no_lp, probing, probing_max_lp, pseudo_costs, quick_restart, quick_restart_no_lp, reduced_costs]
13 first solution subsolvers: [fj_long_default, fj_long_lin_default, fj_long_random, fj_short_default, fj_short_lin_default, fj_short_lin_random, fj_short_random, fs_random(2), fs_random_no_lp, fs_random_quick_restart(2), fs_random_quick_restart_no_lp]
13 incomplete subsolvers: [feasibility_pump, graph_arc_lns, graph_cst_lns, graph_dec_lns, graph_var_lns, rins/rens, rnd_cst_lns, rnd_var_lns, scheduling_intervals_lns, scheduling_precedences_lns, scheduling_time_window_lns, violation_ls(2)]
3 helper subsolvers: [neighborhood_helper, synchronization_agent, update_gap_integral]
#Bound   0.37s best:inf   next:[180,5011] objective_lb_search_no_lp
#1       0.39s best:2164  next:[180,2163] fs_random_no_lp (fixed_bools=0/141)
#2       0.39s best:1804  next:[180,1803] no_lp (fixed_bools=0/135)
#3       0.40s best:1803  next:[180,1802] violation_ls(batch:1 #solutions_imported:1 #lin_moves:0 #lin_evals:1'241 #gen_moves:539 #gen_evals:93 #comp_moves:41 #backtracks:249 #weight_updates:10)
#4       0.41s best:1654  next:[180,1653] no_lp (fixed_bools=0/144)
#5       0.41s best:1592  next:[180,1591] no_lp (fixed_bools=0/167)
#Bound   0.42s best:1592  next:[366,1591] objective_lb_search_no_lp
#6       0.42s best:1514  next:[366,1513] no_lp (fixed_bools=0/175)
#7       0.43s best:1508  next:[366,1507] no_lp (fixed_bools=0/186)
#Bound   0.44s best:1508  next:[417,1507] probing_max_lp
#8       0.44s best:1492  next:[417,1491] no_lp (fixed_bools=0/197)
#9       0.45s best:1484  next:[417,1483] no_lp (fixed_bools=0/207)
#10      0.46s best:1460  next:[417,1459] no_lp (fixed_bools=0/216)
#11      0.52s best:1440  next:[417,1439] no_lp (fixed_bools=1/237)
#Bound   0.53s best:1440  next:[436,1439] objective_lb_search_no_lp
#12      0.54s best:1398  next:[436,1397] no_lp (fixed_bools=1/242)
#13      0.55s best:1392  next:[436,1391] no_lp (fixed_bools=1/245)
#14      0.56s best:1376  next:[436,1375] no_lp (fixed_bools=1/249)
#Bound   0.62s best:1376  next:[565,1375] objective_lb_search_no_lp
#Bound   0.71s best:1376  next:[570,1375] objective_lb_search_no_lp
#15      0.71s best:1327  next:[570,1326] quick_restart_no_lp (fixed_bools=0/254)
#Bound   0.82s best:1327  next:[588,1326] objective_lb_search_no_lp
#16      1.00s best:1307  next:[588,1306] no_lp (fixed_bools=1/272)
#17      1.01s best:1305  next:[588,1304] no_lp (fixed_bools=1/283)
#18      1.02s best:1304  next:[588,1303] no_lp (fixed_bools=1/283)
#19      1.05s best:1278  next:[588,1277] no_lp (fixed_bools=1/295)
#Bound   1.06s best:1278  next:[661,1277] objective_lb_search_no_lp
#20      1.10s best:1277  next:[661,1276] violation_ls(batch:5 #solutions_imported:5 #lin_moves:9'670 #lin_evals:70'403 #gen_moves:15'695 #gen_evals:3'022 #comp_moves:783 #backtracks:7'452 #weight_updates:551)
#21      1.10s best:1273  next:[661,1272] quick_restart_no_lp (fixed_bools=0/398)
#22      1.10s best:1272  next:[661,1271] violation_ls(batch:5 #solutions_imported:5 #lin_moves:692 #lin_evals:55'478 #gen_moves:23'118 #gen_evals:3'325 #comp_moves:2'400 #backtracks:10'353 #weight_updates:378)
#23      1.13s best:1271  next:[661,1270] no_lp (fixed_bools=1/298)
#24      1.14s best:1270  next:[661,1269] no_lp (fixed_bools=1/298)
#25      1.16s best:1269  next:[661,1268] no_lp (fixed_bools=1/298)
#26      1.16s best:1260  next:[661,1259] no_lp (fixed_bools=1/301)
#27      1.17s best:1259  next:[661,1258] no_lp (fixed_bools=1/301)
#28      1.22s best:1241  next:[661,1240] scheduling_time_window_lns (d=0.50 s=41 t=0.10 p=0.00 stall=0 h=auto_l0)
#Bound   1.29s best:1241  next:[685,1240] objective_lb_search_no_lp
#Bound   1.72s best:1241  next:[698,1240] objective_lb_search
#Bound   2.31s best:1241  next:[709,1240] objective_lb_search_no_lp
#29      2.34s best:1234  next:[709,1233] rins_lp_lns (d=0.82 s=134 t=0.10 p=0.67 stall=3 h=auto_l0)
#30      2.59s best:1188  next:[709,1187] rins_pump_lns (d=0.82 s=147 t=0.10 p=0.67 stall=3 h=auto_l0)
#Bound   2.77s best:1188  next:[710,1187] objective_lb_search_no_lp
#Bound   2.84s best:1188  next:[716,1187] objective_lb_search_no_lp
#Bound   3.03s best:1188  next:[719,1187] objective_lb_search_no_lp
#Bound   3.12s best:1188  next:[720,1187] objective_lb_search_no_lp
#Bound   3.23s best:1188  next:[735,1187] objective_lb_search_no_lp
#31      3.31s best:1184  next:[735,1183] rnd_cst_lns (d=0.99 s=212 t=0.10 p=1.00 stall=10 h=auto_l0)
#Bound   3.43s best:1184  next:[760,1183] objective_lb_search_no_lp
#Bound   3.59s best:1184  next:[761,1183] objective_lb_search_no_lp
#Bound   4.43s best:1184  next:[763,1183] objective_lb_search_max_lp
#Bound   5.02s best:1184  next:[764,1183] objective_lb_search
#Bound   5.72s best:1184  next:[766,1183] objective_lb_search_no_lp
#Bound   6.04s best:1184  next:[767,1183] objective_lb_search_no_lp
#Bound   6.39s best:1184  next:[771,1183] objective_lb_search_no_lp
#Bound   6.70s best:1184  next:[772,1183] objective_lb_search_no_lp
#Bound   7.35s best:1184  next:[773,1183] objective_lb_search_no_lp
#Bound   7.98s best:1184  next:[776,1183] objective_lb_search_no_lp
#Bound   8.37s best:1184  next:[777,1183] objective_lb_search_no_lp
#Bound   8.54s best:1184  next:[778,1183] objective_lb_search
#Bound   8.81s best:1184  next:[779,1183] objective_lb_search [skipped_logs=0]
#Bound   9.84s best:1184  next:[788,1183] objective_lb_search_no_lp [skipped_logs=1]
#Bound  10.33s best:1184  next:[789,1183] objective_lb_search_no_lp [skipped_logs=0]
#Bound  11.33s best:1184  next:[792,1183] objective_lb_search_no_lp [skipped_logs=2]
#Bound  12.24s best:1184  next:[808,1183] objective_lb_search_no_lp [skipped_logs=0]
#Bound  13.60s best:1184  next:[811,1183] objective_lb_search_no_lp [skipped_logs=1]
#Bound  15.25s best:1184  next:[812,1183] objective_lb_search_no_lp
#Bound  16.23s best:1184  next:[814,1183] objective_lb_search_max_lp
#Bound  16.86s best:1184  next:[817,1183] objective_lb_search_no_lp [skipped_logs=1]
#Bound  17.24s best:1184  next:[818,1183] objective_lb_search_no_lp [skipped_logs=0]
#Bound  18.86s best:1184  next:[829,1183] objective_lb_search_no_lp [skipped_logs=0]
#Bound  22.44s best:1184  next:[837,1183] objective_lb_search
#Bound  23.48s best:1184  next:[843,1183] objective_lb_search
#Bound  25.43s best:1184  next:[846,1183] objective_lb_search
#Bound  26.17s best:1184  next:[847,1183] objective_lb_search
#Bound  28.44s best:1184  next:[848,1183] objective_lb_search_no_lp
#Bound  28.64s best:1184  next:[849,1183] objective_lb_search
#Bound  31.15s best:1184  next:[850,1183] lb_tree_search (nodes=3082/3090 rc=6 decisions=22921 @root=23 restarts=10) 
#Bound  31.45s best:1184  next:[851,1183] objective_lb_search_no_lp
#Bound  33.42s best:1184  next:[852,1183] lb_tree_search (nodes=3143/3152 rc=7 decisions=23954 @root=24 restarts=10) 
#Bound  34.81s best:1184  next:[853,1183] lb_tree_search (nodes=3172/3182 rc=8 decisions=24536 @root=25 restarts=10) 
#Bound  36.71s best:1184  next:[854,1183] lb_tree_search (nodes=3233/3243 rc=10 decisions=25375 @root=26 restarts=10) 
#Bound  38.32s best:1184  next:[855,1183] lb_tree_search (nodes=3269/3279 rc=11 decisions=26038 @root=27 restarts=10) 
#Bound  39.77s best:1184  next:[856,1183] lb_tree_search (nodes=3310/3320 rc=11 decisions=26598 @root=28 restarts=10) 
#Bound  41.31s best:1184  next:[857,1183] lb_tree_search (nodes=3349/3359 rc=11 decisions=27209 @root=29 restarts=10) 
#Bound  41.82s best:1184  next:[859,1183] objective_lb_search_no_lp
#Bound  43.71s best:1184  next:[860,1183] objective_lb_search_no_lp
#Bound  46.09s best:1184  next:[861,1183] lb_tree_search (nodes=3534/3545 rc=14 decisions=29427 @root=31 restarts=10) 
#Bound  47.66s best:1184  next:[862,1183] lb_tree_search (nodes=3592/3603 rc=16 decisions=30120 @root=32 restarts=10) 
#Bound  48.93s best:1184  next:[863,1183] objective_lb_search_no_lp
#Bound  50.59s best:1184  next:[864,1183] objective_lb_search_no_lp
#Bound  51.55s best:1184  next:[865,1183] objective_lb_search_no_lp
#Bound  53.26s best:1184  next:[866,1183] objective_lb_search_no_lp
#Bound  54.68s best:1184  next:[867,1183] objective_lb_search_no_lp
#Bound  55.97s best:1184  next:[868,1183] objective_lb_search_no_lp
#Bound  56.21s best:1184  next:[869,1183] objective_lb_search_no_lp
#Bound  57.54s best:1184  next:[871,1183] objective_lb_search_no_lp
#Bound  59.39s best:1184  next:[873,1183] objective_lb_search_no_lp
#Bound  60.88s best:1184  next:[874,1183] objective_lb_search_no_lp
#Bound  62.09s best:1184  next:[876,1183] objective_lb_search_no_lp
#Bound  65.96s best:1184  next:[877,1183] lb_tree_search (nodes=4515/4531 rc=29 decisions=39893 @root=38 restarts=10) 
#Bound  67.91s best:1184  next:[878,1183] lb_tree_search (nodes=4560/4576 rc=30 decisions=40681 @root=39 restarts=10) 
#Bound  69.88s best:1184  next:[879,1183] lb_tree_search (nodes=4637/4653 rc=31 decisions=41568 @root=40 restarts=10) 
#Bound  70.34s best:1184  next:[880,1183] objective_lb_search_no_lp
#Bound  72.65s best:1184  next:[884,1183] objective_lb_search_no_lp
#Bound  75.06s best:1184  next:[885,1183] objective_lb_search_no_lp
#Bound  77.45s best:1184  next:[887,1183] objective_lb_search_no_lp
#Bound  79.76s best:1184  next:[889,1183] objective_lb_search_no_lp
#Bound  83.65s best:1184  next:[890,1183] lb_tree_search (nodes=5399/5419 rc=56 decisions=49350 @root=44 restarts=10) 
#Bound  85.26s best:1184  next:[896,1183] objective_lb_search_no_lp
#Bound  91.61s best:1184  next:[897,1183] lb_tree_search (nodes=6049/6071 rc=70 decisions=54686 @root=46 restarts=10) 
#Bound  94.50s best:1184  next:[898,1183] lb_tree_search (nodes=6176/6198 rc=76 decisions=56191 @root=47 restarts=10) 
#Bound  96.00s best:1184  next:[900,1183] objective_lb_search_no_lp
#32     97.53s best:1183  next:[900,1182] reduced_costs (fixed_bools=3/2928)
#Bound  98.99s best:1183  next:[901,1182] objective_lb_search_no_lp
#Bound  99.59s best:1183  next:[903,1182] objective_lb_search_no_lp
#Bound 103.11s best:1183  next:[905,1182] objective_lb_search_no_lp
#Bound 104.74s best:1183  next:[906,1182] objective_lb_search_no_lp
#Bound 109.32s best:1183  next:[907,1182] objective_lb_search_no_lp
#Bound 112.41s best:1183  next:[910,1182] objective_lb_search_no_lp
#Bound 117.20s best:1183  next:[915,1182] objective_lb_search_no_lp
#Bound 118.73s best:1183  next:[916,1182] objective_lb_search_no_lp
#Bound 121.25s best:1183  next:[917,1182] objective_lb_search_no_lp
#Bound 124.00s best:1183  next:[918,1182] objective_lb_search_no_lp
#Bound 124.68s best:1183  next:[920,1182] objective_lb_search_no_lp
#Bound 127.58s best:1183  next:[921,1182] objective_lb_search_no_lp
#Bound 129.06s best:1183  next:[923,1182] objective_lb_search_no_lp
#Bound 136.89s best:1183  next:[928,1182] objective_lb_search_no_lp
#Bound 141.66s best:1183  next:[929,1182] objective_lb_search_no_lp
#Bound 142.66s best:1183  next:[931,1182] objective_lb_search_no_lp
#Bound 144.30s best:1183  next:[933,1182] objective_lb_search_no_lp
#Bound 145.18s best:1183  next:[935,1182] objective_lb_search_no_lp
#Bound 150.62s best:1183  next:[937,1182] objective_lb_search_no_lp
#Bound 153.01s best:1183  next:[938,1182] objective_lb_search_no_lp
#Bound 156.80s best:1183  next:[940,1182] objective_lb_search_no_lp
#Bound 166.78s best:1183  next:[941,1182] objective_lb_search_no_lp
#Bound 168.53s best:1183  next:[942,1182] objective_lb_search_no_lp
#Bound 171.37s best:1183  next:[944,1182] objective_lb_search_no_lp
#Bound 180.54s best:1183  next:[945,1182] lb_tree_search (nodes=13189/13216 rc=353 decisions=119306 @root=62 restarts=10) 
#Bound 185.88s best:1183  next:[946,1182] lb_tree_search (nodes=13377/13404 rc=365 decisions=122256 @root=63 restarts=10) 
#Bound 191.20s best:1183  next:[947,1182] lb_tree_search (nodes=13293/13601 rc=378 decisions=125060 @root=64 restarts=10) 
#Bound 196.42s best:1183  next:[948,1182] lb_tree_search (nodes=12747/13824 rc=394 decisions=128341 @root=65 restarts=10) 
#Bound 199.09s best:1183  next:[950,1182] objective_lb_search_no_lp
#Bound 201.62s best:1183  next:[952,1182] objective_lb_search_no_lp
#Bound 205.73s best:1183  next:[953,1182] objective_lb_search_no_lp
#Bound 210.86s best:1183  next:[954,1182] objective_lb_search_no_lp
#Bound 213.06s best:1183  next:[955,1182] objective_lb_search_no_lp
#Bound 215.08s best:1183  next:[956,1182] objective_lb_search_no_lp
#Bound 215.75s best:1183  next:[957,1182] objective_lb_search_no_lp
#Bound 217.34s best:1183  next:[959,1182] objective_lb_search_no_lp
#Bound 222.52s best:1183  next:[960,1182] objective_lb_search_no_lp
#Bound 222.82s best:1183  next:[961,1182] objective_lb_search_no_lp
#Bound 223.78s best:1183  next:[962,1182] objective_lb_search_no_lp
#Bound 224.64s best:1183  next:[963,1182] objective_lb_search_no_lp
#Bound 227.76s best:1183  next:[964,1182] objective_lb_search_no_lp
#Bound 234.26s best:1183  next:[965,1182] objective_lb_search_no_lp
#Bound 235.33s best:1183  next:[967,1182] objective_lb_search_no_lp
#Bound 239.65s best:1183  next:[969,1182] objective_lb_search_no_lp
#Bound 239.85s best:1183  next:[970,1182] objective_lb_search_no_lp
#Model 241.38s var:360/364 constraints:4492/4953
#Model 243.35s var:356/364 constraints:4209/4953
#Bound 243.48s best:1183  next:[972,1182] objective_lb_search_no_lp
#Bound 246.78s best:1183  next:[973,1182] objective_lb_search_no_lp
#Bound 248.64s best:1183  next:[975,1182] objective_lb_search_no_lp
#Bound 249.70s best:1183  next:[976,1182] objective_lb_search_no_lp
#Bound 252.06s best:1183  next:[977,1182] objective_lb_search_no_lp
#Bound 256.75s best:1183  next:[978,1182] objective_lb_search_no_lp
#Bound 257.45s best:1183  next:[979,1182] objective_lb_search_no_lp
#Bound 259.73s best:1183  next:[980,1182] objective_lb_search_no_lp
#Bound 260.60s best:1183  next:[981,1182] objective_lb_search_no_lp
#Bound 261.22s best:1183  next:[983,1182] objective_lb_search_no_lp
#Bound 261.97s best:1183  next:[984,1182] objective_lb_search_no_lp
#Bound 263.83s best:1183  next:[986,1182] objective_lb_search_no_lp
#Bound 267.33s best:1183  next:[987,1182] objective_lb_search_no_lp
#Model 269.38s var:355/364 constraints:4080/4953
#Bound 270.28s best:1183  next:[988,1182] objective_lb_search_no_lp
#Bound 270.95s best:1183  next:[992,1182] objective_lb_search_no_lp
#Bound 272.87s best:1183  next:[993,1182] objective_lb_search_no_lp
#Model 273.65s var:353/364 constraints:3960/4953
#Bound 278.07s best:1183  next:[995,1182] objective_lb_search_no_lp
#Bound 280.78s best:1183  next:[996,1182] objective_lb_search_no_lp
#Bound 282.66s best:1183  next:[997,1182] objective_lb_search
#Bound 285.49s best:1183  next:[998,1182] lb_tree_search (nodes=11287/24378 rc=851 decisions=220705 @root=85 restarts=10) 
#Bound 286.86s best:1183  next:[999,1182] objective_lb_search_no_lp
#Bound 287.45s best:1183  next:[1001,1182] objective_lb_search_no_lp
#Bound 287.81s best:1183  next:[1002,1182] objective_lb_search_no_lp
#Bound 289.89s best:1183  next:[1004,1182] objective_lb_search_no_lp
#Bound 290.72s best:1183  next:[1007,1182] objective_lb_search_no_lp
#Bound 291.87s best:1183  next:[1009,1182] objective_lb_search_no_lp
#Model 293.15s var:352/364 constraints:3892/4953
#Bound 293.91s best:1183  next:[1011,1182] objective_lb_search_no_lp
#Bound 294.50s best:1183  next:[1013,1182] objective_lb_search_no_lp
#Bound 295.20s best:1183  next:[1018,1182] objective_lb_search_no_lp
#Bound 296.42s best:1183  next:[1021,1182] objective_lb_search_no_lp
#Model 297.69s var:350/364 constraints:3753/4953
#Bound 298.20s best:1183  next:[1023,1182] objective_lb_search_no_lp
#Model 298.56s var:349/364 constraints:3742/4953
#Bound 298.61s best:1183  next:[1025,1182] objective_lb_search_no_lp
#Bound 299.48s best:1183  next:[1026,1182] objective_lb_search_no_lp
#Model 300.18s var:348/364 constraints:3641/4953
#Bound 300.28s best:1183  next:[1028,1182] objective_lb_search
#Bound 300.60s best:1183  next:[1034,1182] objective_lb_search_no_lp
#Model 300.97s var:347/364 constraints:3596/4953
#Bound 301.05s best:1183  next:[1037,1182] objective_lb_search_no_lp
#Model 301.92s var:345/364 constraints:3539/4953
#Model 302.25s var:344/364 constraints:3488/4953
#Bound 302.75s best:1183  next:[1040,1182] objective_lb_search_no_lp
#Bound 302.91s best:1183  next:[1042,1182] objective_lb_search_no_lp
#Bound 303.08s best:1183  next:[1053,1182] objective_lb_search_no_lp
#Model 303.19s var:343/364 constraints:3402/4953
#Model 303.32s var:341/364 constraints:3347/4953
#Model 303.65s var:339/364 constraints:3275/4953
#Model 303.71s var:338/364 constraints:3244/4953
#Bound 303.88s best:1183  next:[1055,1182] objective_lb_search_no_lp
#Model 303.93s var:337/364 constraints:3200/4953
#Model 304.01s var:336/364 constraints:3153/4953
#Bound 304.08s best:1183  next:[1062,1182] objective_lb_search_no_lp
#Bound 304.10s best:1183  next:[1080,1182] objective_lb_search_no_lp
#Bound 304.13s best:1183  next:[1088,1182] objective_lb_search_no_lp
#Model 304.29s var:308/364 constraints:1171/4953 compo:307,1
#Done  304.30s quick_restart_no_lp
#Done  304.30s core
#Model 304.30s var:302/364 constraints:745/4953 compo:301,1

Task timing                                  n [     min,      max]      avg      dev     time         n [     min,      max]      avg      dev    dtime
                             'core':         1 [   5.07m,    5.07m]    5.07m   0.00ns    5.07m         1 [   6.32m,    6.32m]    6.32m   0.00ns    6.32m
                       'default_lp':         1 [   5.07m,    5.07m]    5.07m   0.00ns    5.07m         1 [   1.65m,    1.65m]    1.65m   0.00ns    1.65m
                 'feasibility_pump':       914 [  5.67ms, 289.38ms] 129.26ms  12.21ms    1.97m       913 [  1.69ms,  61.08ms]  30.31ms   1.48ms   27.68s
                            'fixed':         1 [   5.07m,    5.07m]    5.07m   0.00ns    5.07m         1 [   2.13m,    2.13m]    2.13m   0.00ns    2.13m
                  'fj_long_default':         1 [ 86.19ms,  86.19ms]  86.19ms   0.00ns  86.19ms         1 [ 71.96ms,  71.96ms]  71.96ms   0.00ns  71.96ms
              'fj_long_lin_default':         1 [ 92.91ms,  92.91ms]  92.91ms   0.00ns  92.91ms         1 [ 97.56ms,  97.56ms]  97.56ms   0.00ns  97.56ms
                   'fj_long_random':         1 [ 79.72ms,  79.72ms]  79.72ms   0.00ns  79.72ms         1 [ 68.88ms,  68.88ms]  68.88ms   0.00ns  68.88ms
                 'fj_short_default':         1 [ 66.24ms,  66.24ms]  66.24ms   0.00ns  66.24ms         1 [ 93.30ms,  93.30ms]  93.30ms   0.00ns  93.30ms
             'fj_short_lin_default':         1 [ 89.24ms,  89.24ms]  89.24ms   0.00ns  89.24ms         1 [ 93.20ms,  93.20ms]  93.20ms   0.00ns  93.20ms
              'fj_short_lin_random':         1 [ 87.57ms,  87.57ms]  87.57ms   0.00ns  87.57ms         1 [ 95.92ms,  95.92ms]  95.92ms   0.00ns  95.92ms
                  'fj_short_random':         1 [ 90.58ms,  90.58ms]  90.58ms   0.00ns  90.58ms         1 [ 94.80ms,  94.80ms]  94.80ms   0.00ns  94.80ms
                        'fs_random':         1 [ 52.13ms,  52.13ms]  52.13ms   0.00ns  52.13ms         1 [247.99us, 247.99us] 247.99us   0.00ns 247.99us
                        'fs_random':         1 [ 52.51ms,  52.51ms]  52.51ms   0.00ns  52.51ms         1 [248.00us, 248.00us] 248.00us   0.00ns 248.00us
                  'fs_random_no_lp':         1 [ 52.45ms,  52.45ms]  52.45ms   0.00ns  52.45ms         1 [800.51us, 800.51us] 800.51us   0.00ns 800.51us
          'fs_random_quick_restart':         1 [ 51.47ms,  51.47ms]  51.47ms   0.00ns  51.47ms         1 [247.96us, 247.96us] 247.96us   0.00ns 247.96us
          'fs_random_quick_restart':         1 [ 52.19ms,  52.19ms]  52.19ms   0.00ns  52.19ms         1 [248.00us, 248.00us] 248.00us   0.00ns 248.00us
    'fs_random_quick_restart_no_lp':         1 [ 51.91ms,  51.91ms]  51.91ms   0.00ns  51.91ms         1 [  1.11ms,   1.11ms]   1.11ms   0.00ns   1.11ms
                    'graph_arc_lns':       913 [  4.09ms, 909.32ms] 473.95ms 240.73ms    7.21m       895 [ 10.00ns, 221.25ms]  73.78ms  48.88ms    1.10m
                    'graph_cst_lns':       913 [  1.75ms, 846.54ms] 452.68ms 238.78ms    6.89m       868 [ 10.00ns, 139.47ms]  71.41ms  45.62ms    1.03m
                    'graph_dec_lns':       913 [  4.62ms, 911.93ms] 490.32ms 237.29ms    7.46m       895 [ 10.00ns, 258.43ms]  76.05ms  48.89ms    1.13m
                    'graph_var_lns':       913 [  4.16ms, 906.34ms] 484.25ms 245.98ms    7.37m       905 [ 10.00ns, 139.59ms]  72.93ms  50.30ms    1.10m
                   'lb_tree_search':         1 [   5.07m,    5.07m]    5.07m   0.00ns    5.07m         1 [   2.87m,    2.87m]    2.87m   0.00ns    2.87m
                           'max_lp':         1 [   5.07m,    5.07m]    5.07m   0.00ns    5.07m         1 [   1.93m,    1.93m]    1.93m   0.00ns    1.93m
                            'no_lp':         1 [   5.07m,    5.07m]    5.07m   0.00ns    5.07m         1 [   1.45m,    1.45m]    1.45m   0.00ns    1.45m
              'objective_lb_search':         1 [   5.07m,    5.07m]    5.07m   0.00ns    5.07m         1 [   1.79m,    1.79m]    1.79m   0.00ns    1.79m
       'objective_lb_search_max_lp':         1 [   5.07m,    5.07m]    5.07m   0.00ns    5.07m         1 [   2.34m,    2.34m]    2.34m   0.00ns    2.34m
        'objective_lb_search_no_lp':         1 [   5.07m,    5.07m]    5.07m   0.00ns    5.07m         1 [   1.08m,    1.08m]    1.08m   0.00ns    1.08m
  'objective_shaving_search_max_lp':       168 [ 54.86ms,    9.99s]    1.81s    1.74s    5.05m       162 [  2.70ms,    2.64s] 452.97ms 470.58ms    1.22m
   'objective_shaving_search_no_lp':       169 [ 27.74ms,    9.98s]    1.79s    1.75s    5.05m       163 [  2.67ms,    1.68s] 295.10ms 302.92ms   48.10s
                          'probing':         1 [   5.07m,    5.07m]    5.07m   0.00ns    5.07m         1 [   1.78m,    1.78m]    1.78m   0.00ns    1.78m
                   'probing_max_lp':         1 [   5.07m,    5.07m]    5.07m   0.00ns    5.07m         1 [   1.90m,    1.90m]    1.90m   0.00ns    1.90m
                     'pseudo_costs':         1 [   5.07m,    5.07m]    5.07m   0.00ns    5.07m         1 [   1.90m,    1.90m]    1.90m   0.00ns    1.90m
                    'quick_restart':         1 [   5.07m,    5.07m]    5.07m   0.00ns    5.07m         1 [   2.50m,    2.50m]    2.50m   0.00ns    2.50m
              'quick_restart_no_lp':         1 [   5.07m,    5.07m]    5.07m   0.00ns    5.07m         1 [   2.76m,    2.76m]    2.76m   0.00ns    2.76m
                    'reduced_costs':         1 [   5.07m,    5.07m]    5.07m   0.00ns    5.07m         1 [   1.99m,    1.99m]    1.99m   0.00ns    1.99m
                        'rins/rens':       913 [100.01us,    1.03s] 288.91ms 201.85ms    4.40m       700 [ 10.00ns, 156.81ms]  78.15ms  32.29ms   54.70s
                      'rnd_cst_lns':       913 [  2.49ms,    1.13s] 470.27ms 243.25ms    7.16m       889 [ 10.00ns, 132.39ms]  73.97ms  48.55ms    1.10m
                      'rnd_var_lns':       913 [  1.87ms, 880.68ms] 474.96ms 232.14ms    7.23m       897 [ 10.00ns, 134.92ms]  74.35ms  47.19ms    1.11m
         'scheduling_intervals_lns':       913 [  2.90ms,    1.23s] 530.94ms 223.15ms    8.08m       859 [  2.03ms, 184.49ms]  89.18ms  33.11ms    1.28m
       'scheduling_precedences_lns':       913 [  1.32ms,    1.42s] 530.61ms 221.13ms    8.07m       860 [  1.98ms, 170.95ms]  89.58ms  32.60ms    1.28m
       'scheduling_time_window_lns':       913 [  2.75ms,    1.21s] 528.19ms 224.59ms    8.04m       861 [  1.98ms, 137.41ms]  88.07ms  32.65ms    1.26m
                     'violation_ls':       913 [ 12.13ms, 187.49ms]  64.50ms  12.47ms   58.89s       913 [ 56.43us, 276.69ms] 105.70ms  32.28ms    1.61m
                     'violation_ls':       913 [738.30us, 117.93ms]  61.93ms  14.34ms   56.54s       913 [  1.16us, 360.26ms] 109.72ms  43.19ms    1.67m

Search stats                        Bools  Conflicts   Branches  Restarts   BoolPropag  IntegerPropag
                           'core':  4'485    190'887    484'047    45'111  244'071'299    182'660'258
                     'default_lp':     98    105'832    400'890    44'878    3'207'536    155'592'967
                          'fixed':  2'883    581'831  1'030'185     1'898  227'125'844    171'309'785
                      'fs_random':     98          0        196       196           12          6'059
                      'fs_random':     98          0        196       196           12          6'059
                'fs_random_no_lp':    141          4        262       197          158          9'390
        'fs_random_quick_restart':     98          0        196       196           12          6'059
        'fs_random_quick_restart':     98          0        196       196           12          6'059
  'fs_random_quick_restart_no_lp':    114          0        308       196           14         10'758
                 'lb_tree_search':    119        411    385'906    56'905    1'114'064     45'998'280
                         'max_lp':     98     75'674    404'333    47'054    3'308'587    137'768'560
                          'no_lp':  1'636    251'728    548'511    39'544  111'816'655    277'513'706
            'objective_lb_search':    334     60'966    470'883    74'803    5'083'834    138'312'503
     'objective_lb_search_max_lp':    309     36'002    585'912   114'508    5'686'891    128'187'187
      'objective_lb_search_no_lp':    420    174'174    393'615    29'355    7'490'607    238'379'296
                        'probing':    651        404     12'852     7'045      108'058        830'580
                 'probing_max_lp':    651        415      7'514     4'334       76'688        570'657
                   'pseudo_costs':     98     96'077    442'546    59'745    3'144'580    140'235'565
                  'quick_restart':  3'423     77'699    507'082    46'057   92'288'804     98'202'935
            'quick_restart_no_lp':  4'735    245'979    803'319    43'953  228'815'084    193'707'380
                  'reduced_costs':  4'068    107'275    551'532    44'646  108'715'148    139'052'417

SAT stats                           ClassicMinim  LitRemoved  LitLearned  LitForgotten  Subsumed  MClauses  MDecisions  MLitTrue  MSubsumed  MLitRemoved  MReused
                           'core':       175'069   1'164'059   1'722'265       310'473       594    20'992      99'907       534      1'211        6'357      228
                     'default_lp':        77'988     260'739   1'396'003       834'293     2'604    23'073     261'893         0      5'916       46'283    3'565
                          'fixed':       479'961   3'375'616  14'957'055    11'276'739       667     1'195      10'576         0        904       12'803       64
                      'fs_random':             0           0           0             0         0         0           0         0          0            0        0
                      'fs_random':             0           0           0             0         0         0           0         0          0            0        0
                'fs_random_no_lp':             0           0          20             0         0         0           0         0          0            0        0
        'fs_random_quick_restart':             0           0           0             0         0         0           0         0          0            0        0
        'fs_random_quick_restart':             0           0           0             0         0         0           0         0          0            0        0
  'fs_random_quick_restart_no_lp':             0           0           0             0         0         0           0         0          0            0        0
                 'lb_tree_search':            61         108       2'083             0         0    23'765     121'198         0         85          330    1'280
                         'max_lp':        55'659     192'324     960'741       504'376     2'130    25'194     307'115         1      5'009       36'409    5'069
                          'no_lp':       221'495   1'322'515   4'078'259     3'421'595     1'897    19'127     177'016         0      5'532       37'402    2'643
            'objective_lb_search':        49'552     190'937     640'811        43'230     1'299    35'751     369'138        15      3'786       26'552    7'616
     'objective_lb_search_max_lp':        28'771     113'612     370'805        19'815       927    49'267     489'347         0      2'989       20'477   11'949
      'objective_lb_search_no_lp':       153'732     725'786   1'725'924       507'677     2'101    17'204     181'203        29      7'987       60'211    3'109
                        'probing':             1           1         406             0         0         0           0         0          0            0        0
                 'probing_max_lp':             1           1         416             0         0         0           0         0          0            0        0
                   'pseudo_costs':        76'818     298'387   1'326'084       691'333     1'709    30'286     297'479         0      5'163       39'773    4'695
                  'quick_restart':        59'698     307'741     832'676       231'602     1'075    26'657     276'599        30     19'119      173'088    2'900
            'quick_restart_no_lp':       203'485   1'685'170   3'592'934     1'567'784       773    14'474     153'007         3     11'766      114'122    1'005
                  'reduced_costs':        88'255     415'190   1'553'452       965'441     1'279    23'977     235'938        10      8'476       59'896    3'984

Lp stats                         Component  Iterations  AddedCuts  OPTIMAL  DUAL_F.  DUAL_U.
                  'default_lp':          1   1'192'792     63'479  207'615        0        0
                       'fixed':          1     237'028      1'573  573'999        0        0
                   'fs_random':          1         198        190        5        0        0
                   'fs_random':          1         198        191        5        0        0
     'fs_random_quick_restart':          1         198        188        5        0        0
     'fs_random_quick_restart':          1         198        223        5        0        0
              'lb_tree_search':          1   3'470'792     14'401  209'298   82'320        0
                      'max_lp':          1   1'860'627     45'965  139'974   66'716       26
         'objective_lb_search':          1   1'421'369     43'133  145'305        0        1
  'objective_lb_search_max_lp':          1   1'879'680     25'692   89'332   20'895       18
                     'probing':          1     868'296     29'559   34'889        0        0
              'probing_max_lp':          1     503'490     66'831   20'658    2'213        0
                'pseudo_costs':          1   1'715'811     80'259  152'411   65'595       39
               'quick_restart':          1   1'707'037     44'718  142'942        0        1
               'reduced_costs':          1   1'628'904     86'010  161'446   66'932       13

Lp dimension                                                                      Final dimension of first component
                  'default_lp':   444 rows, 358 columns, 2018 entries with magnitude in [4.013331e-03, 1.000000e+00]
                       'fixed':    242 rows, 358 columns, 881 entries with magnitude in [7.385524e-03, 1.000000e+00]
                   'fs_random':    164 rows, 358 columns, 630 entries with magnitude in [7.385524e-03, 1.000000e+00]
                   'fs_random':    164 rows, 358 columns, 630 entries with magnitude in [7.385524e-03, 1.000000e+00]
     'fs_random_quick_restart':    164 rows, 358 columns, 630 entries with magnitude in [7.385524e-03, 1.000000e+00]
     'fs_random_quick_restart':    193 rows, 358 columns, 715 entries with magnitude in [7.385524e-03, 1.000000e+00]
              'lb_tree_search':   595 rows, 364 columns, 2194 entries with magnitude in [4.058967e-03, 1.000000e+00]
                      'max_lp':   711 rows, 364 columns, 2595 entries with magnitude in [2.094268e-03, 1.000000e+00]
         'objective_lb_search':   508 rows, 358 columns, 2099 entries with magnitude in [3.490554e-03, 1.000000e+00]
  'objective_lb_search_max_lp':   681 rows, 364 columns, 2312 entries with magnitude in [3.332384e-03, 1.000000e+00]
                     'probing':   872 rows, 358 columns, 4398 entries with magnitude in [2.568244e-04, 1.000000e+00]
              'probing_max_lp':  1403 rows, 364 columns, 6686 entries with magnitude in [3.935429e-04, 1.000000e+00]
                'pseudo_costs':   401 rows, 364 columns, 1412 entries with magnitude in [6.656804e-03, 1.000000e+00]
               'quick_restart':   834 rows, 358 columns, 3519 entries with magnitude in [5.024047e-04, 1.000000e+00]
               'reduced_costs':   636 rows, 364 columns, 2390 entries with magnitude in [4.229638e-04, 1.000000e+00]

Lp debug                         CutPropag  CutEqPropag   Adjust  Overflow         Bad  BadScaling
                  'default_lp':         36           81  107'374         0     706'675           0
                       'fixed':          0            0   44'749         0       4'767           0
                   'fs_random':          0            0        0         0         145           0
                   'fs_random':          0            0        0         0         159           0
     'fs_random_quick_restart':          0            0        0         0         145           0
     'fs_random_quick_restart':          0            0        0         0         145           0
              'lb_tree_search':         19           14  159'766         0     337'091           0
                      'max_lp':         62           29  102'571         0     699'425           0
         'objective_lb_search':         29           70   82'474         0   1'019'336           0
  'objective_lb_search_max_lp':         45           18   65'288         0     820'728           0
                     'probing':         76          330   33'533         0  25'958'548           0
              'probing_max_lp':        105          681   12'986         0  14'369'112           0
                'pseudo_costs':         90           51  114'961         0   1'054'576           0
               'quick_restart':        176          145   82'348         0   2'944'043           0
               'reduced_costs':        131           89  128'648         0   1'043'209           0

Lp pool                          Constraints  Updates  Simplif  Merged  Shortened    Split  Strenghtened       Cuts/Call
                  'default_lp':        8'901    3'354   98'712     936      8'574   26'764        34'997  63'479/208'066
                       'fixed':        1'916       59      339      15          0       13           596     1'573/5'838
                   'fs_random':          548        0        0       0          0        0            25         190/328
                   'fs_random':          549        0        0       0          0        0            25         191/319
     'fs_random_quick_restart':          546        0        0       0          0        0            25         188/318
     'fs_random_quick_restart':          581        0        0       0          0        0            28         223/388
              'lb_tree_search':       14'132    2'132  214'743     214     12'117    2'560       166'834  14'401/108'139
                      'max_lp':       14'232    2'844  285'260     678     15'081   21'803       189'328  45'965/133'948
         'objective_lb_search':        8'903    3'863  141'670     588      9'495   38'271        45'509  43'133/154'053
  'objective_lb_search_max_lp':       14'294    3'224  374'910     343     13'512   22'388       234'077   25'692/89'178
                     'probing':        9'880    8'406  342'723      37      8'325  186'910        26'156   29'559/90'041
              'probing_max_lp':       14'758   12'004  381'510      18     21'068   67'576       140'899  66'831/196'392
                'pseudo_costs':       13'205    3'379  380'075     999     12'854   30'644       236'091  80'259/193'711
               'quick_restart':        9'768    6'348  380'930     308     10'792  321'572        80'533  44'718/179'076
               'reduced_costs':       12'821    3'487  414'164   1'134     13'003   24'474       228'279  86'010/218'254

Lp Cut                                         fs_ran  fs_ran  fs_ran  fs_ran  defaul  fixed  max_lp  quick_  reduce  pseudo  lb_tre  probin  object  probin  object
                                       CG_FF:      10      19      10      10   3'852    131   2'394   1'454   5'472   4'333     670     750   2'294     380     880
                                        CG_K:      10      20      10      10   2'602     68   2'220     602   5'067   4'399     568     366   1'736     235     851
                                       CG_KL:       -       -       -       -       -      -       -       -       -       1       -       -       -       -       -
                                        CG_R:       9      13       9       9   4'057     61   1'874   1'070   5'013   3'859     509     916   2'443     514     510
                                       CG_RB:       -       -       -       -   8'465    297   5'285   4'869  11'092  10'638   1'555   2'992   6'317     799   1'951
                                      CG_RBP:       -       1       -       -   1'325     15     825     624   2'373   1'717     201     338     592     108     297
                                      Clique:       -       -       -       -       -      -     257       -     686     594     186       -       -     183     225
                                          IB:      83      83      83      83  16'431    485   8'519  11'395  13'244  12'444   1'942   4'388   9'347   2'779   3'141
                                    MIR_1_FF:      30      29      29      29   2'159     63   1'730   1'824   3'400   3'185     768   1'002   1'646   1'333   1'119
                                     MIR_1_K:       4       3       4       4     537     13     742     332   1'352   1'358     232     153     417     526     464
                                    MIR_1_KL:       -       -       -       -      53      -      36      24      58      68       3      53       -      72       3
                                     MIR_1_R:       7       7       7       7     636     16     326     394     775     670      88     183     434     241     164
                                    MIR_1_RB:      12      12      12      13   4'030     99   4'373   3'248   7'211   7'079   1'653   1'907   2'999   3'847   3'057
                                   MIR_1_RBP:       -       -       -       -     223      3     726     138   1'188   1'045     241     110     103     290     282
                                   MIR_1_RLT:       -       -       -       -       -      -       9       -      18      12       4       -       -      17      11
                                    MIR_2_FF:       8       9       8       8   1'549     40   1'093   1'268   2'094   2'073     384     617   1'081     823     720
                                     MIR_2_K:       4       5       6       6     425     10     379     204     766     703     110     128     274     197     181
                                    MIR_2_KL:       -       -       -       -      48      -      62      26      62      88       9      43       2      50       1
                                     MIR_2_R:       4       5       4       5     519     15     344     461     709     677     108     290     460     407     253
                                    MIR_2_RB:       4       5       5       3   2'802     52   2'137   2'541   3'894   3'884     621   1'599   2'078   1'545   1'392
                                   MIR_2_RBP:       -       -       -       -     277      6     297     160     626     576      79     132     126     154     120
                                    MIR_3_FF:       2       2       -       -   1'015     15     720     996   1'431   1'474     249     488     774     393     490
                                     MIR_3_K:       -       -       -       -     329      5     258     165     557     507      87      84     196     143     130
                                    MIR_3_KL:       -       -       -       -      66      1      41      25      70      83       7      45      15      30       9
                                     MIR_3_R:       1       1       -       -     406      6     237     388     469     477      88     241     300     249     211
                                    MIR_3_RB:       -       -       -       -   1'884     32   1'274   1'856   2'179   2'300     365   1'123   1'410     898     799
                                   MIR_3_RBP:       -       -       -       -     156      3     185     109     338     344      64      70     103      74      95
                                    MIR_4_FF:       1       1       -       -     789     11     461     669     950     990     141     321     542     221     321
                                     MIR_4_K:       -       -       -       -     275      3     162     162     371     351      60      93     169      80     112
                                    MIR_4_KL:       -       1       -       -      44      -      44      51      69      70       5      30      17      15      12
                                     MIR_4_R:       -       -       -       -     361      6     158     325     326     365      57     181     281     129     147
                                    MIR_4_RB:       -       -       -       -   1'253     19     783   1'211   1'409   1'478     223     769     912     556     522
                                   MIR_4_RBP:       -       -       -       -     110      2     111      58     216     174      29      46      75      53      55
                                    MIR_5_FF:       -       -       -       -     480      2     285     431     575     517     102     178     391     174     227
                                     MIR_5_K:       -       -       -       -     209      2     155     124     319     278      51      82     126      79      90
                                    MIR_5_KL:       -       -       1       1      43      1      35      31      76      64       5      31      18      25      14
                                     MIR_5_R:       -       -       -       -     251      -      95     215     186     207      28     107     248     100      91
                                    MIR_5_RB:       -       -       -       -     818      5     501     736     901     927     166     492     557     361     306
                                   MIR_5_RBP:       -       -       -       -      88      2      60      38     148     105      11      38      48      20      27
                                    MIR_6_FF:       -       -       -       -     278      3     191     260     359     350      62     136     264     114     156
                                     MIR_6_K:       -       -       -       -     130      2      87      78     158     168      29      42      74      51      56
                                    MIR_6_KL:       -       -       -       -      26      -      24      19      36      33       6      25      15      25       8
                                     MIR_6_R:       -       -       -       -     163      1      60     124     128     116      25      75     148      72      48
                                    MIR_6_RB:       -       -       -       -     494      6     333     464     586     624      75     320     379     234     218
                                   MIR_6_RBP:       -       -       -       -      48      1      34      24      91      78      11      26      23      31      25
  NoOverlapCompletionTimeExhaustive_weighted:       -       -       -       -       -      -     182       -     427     348      25       -       -      15      48
                 NoOverlapDetectedPrecedence:       -       -       -       -       -      -       1       -       -       -       -       -       -       -       -
                 NoOverlapDisjunctionOnStart:       -       -       -       -       -      -      80       -     228     183       8       -       -       5       8
                                ZERO_HALF_FF:       1       3       1       -     543     18     413     250     846     741     135     114     314     175     226
                                 ZERO_HALF_K:       -       -       -       -     170      1     293      48     611     482      83      38     115     125     172
                                 ZERO_HALF_R:       -       1       -       -   2'034     32   3'656   3'975   4'481   4'755   1'832   6'668   2'518  44'848   4'481
                                ZERO_HALF_RB:       1       3       1       -     838     19   1'249     902   1'942   1'911     401   1'241     634   1'578     857
                               ZERO_HALF_RBP:       -       -       -       -     188      1     169     350     427     356      40     488     118   1'458     109

LNS stats                        Improv/Calls  Closed  Difficulty  TimeLimit
               'graph_arc_lns':        17/912     52%        0.99       0.13
               'graph_cst_lns':        26/885     52%        0.99       0.12
               'graph_dec_lns':        14/913     51%        0.99       0.14
               'graph_var_lns':        10/913     52%        0.99       0.14
                   'rins/rens':       161/851     51%        0.92       0.10
                 'rnd_cst_lns':        24/911     52%        0.99       0.13
                 'rnd_var_lns':        17/912     52%        0.99       0.13
    'scheduling_intervals_lns':        55/913     43%        0.00       0.14
  'scheduling_precedences_lns':        55/912     43%        0.00       0.14
  'scheduling_time_window_lns':        54/913     44%        0.00       0.14

LS stats                   Batches  Restarts   LinMoves   GenMoves  CompoundMoves  WeightUpdates
       'fj_long_default':        1         1      6'241          0              0            122
   'fj_long_lin_default':        1         1          0      2'071            295              0
        'fj_long_random':        1         1      6'292          0              0            113
      'fj_short_default':        1         1          0      2'185            372              0
  'fj_short_lin_default':        1         1          0      1'756            319              0
   'fj_short_lin_random':        1         1          0      1'875            227              0
       'fj_short_random':        1         1          0      1'941            301              0
          'violation_ls':      913         0  4'005'841  1'645'113         85'960        426'154
          'violation_ls':      913         0  4'058'841  2'412'346         80'241        408'102

Solutions (32)                   Num     Rank
             'fs_random_no_lp':    1    [1,1]
                       'no_lp':   21   [2,27]
         'quick_restart_no_lp':    2  [15,21]
               'reduced_costs':    1  [32,32]
                 'rins_lp_lns':    1  [29,29]
               'rins_pump_lns':    1  [30,30]
                 'rnd_cst_lns':    1  [31,31]
  'scheduling_time_window_lns':    1  [28,28]
                'violation_ls':    3   [3,22]

Objective bounds                 Num
              'initial_domain':    1
              'lb_tree_search':   20
         'objective_lb_search':   13
  'objective_lb_search_max_lp':    2
   'objective_lb_search_no_lp':  138
              'probing_max_lp':    1

Solution repositories     Added  Queried  Ignored  Synchro
  'feasible solutions':   8'628   20'739        3    8'283
        'lp solutions':   4'375      448        0    3'408
                'pump':  19'149      465

Improving bounds shared            Num
                        'core':     57
                  'default_lp':     89
              'lb_tree_search':    110
                      'max_lp':    188
                       'no_lp':    170
         'objective_lb_search':     22
  'objective_lb_search_max_lp':     57
   'objective_lb_search_no_lp':      3
                     'probing':  2'013
              'probing_max_lp':  1'002
                'pseudo_costs':    691
               'quick_restart':  1'334
         'quick_restart_no_lp':  7'041
               'reduced_costs':    326

Clauses shared                   Num
                        'core':   14
                  'default_lp':   39
              'lb_tree_search':   12
                      'max_lp':  103
                       'no_lp':   30
         'objective_lb_search':   26
  'objective_lb_search_max_lp':   21
   'objective_lb_search_no_lp':   10
                     'probing':    2
              'probing_max_lp':    1
                'pseudo_costs':   83
               'quick_restart':   20
         'quick_restart_no_lp':   34
               'reduced_costs':   56

CpSolverResponse summary:
status: OPTIMAL
objective: 1183
best_bound: 1183
integers: 360
booleans: 98
conflicts: 0
branches: 196
propagations: 12
integer_propagations: 6059
restarts: 196
lp_iterations: 198
walltime: 304.38
usertime: 304.38
deterministic_time: 3088.26
gap_integral: 12865
solution_fingerprint: 0xde1de42e8388ba1f


--- Simulation Gantt  partir du modle mathmatique ---
