created virtual environment CPython3.12.4.final.0-64 in 844ms
  creator CPython3Posix(dest=/localscratch/aneumann.46806185.0/env, clear=False, no_vcs_ignore=False, global=False)
  seeder FromAppData(download=False, pip=bundle, via=copy, app_data_dir=/home/aneumann/.local/share/virtualenv)
    added seed packages: pip==24.2+computecanada
  activators BashActivator,CShellActivator,FishActivator,NushellActivator,PowerShellActivator,PythonActivator
Looking in links: /cvmfs/soft.computecanada.ca/custom/python/wheelhouse/gentoo2023/x86-64-v3, /cvmfs/soft.computecanada.ca/custom/python/wheelhouse/gentoo2023/generic, /cvmfs/soft.computecanada.ca/custom/python/wheelhouse/generic
Requirement already satisfied: pip in /localscratch/aneumann.46806185.0/env/lib/python3.12/site-packages (24.2+computecanada)
Processing /cvmfs/soft.computecanada.ca/custom/python/wheelhouse/generic/pip-25.0+computecanada-py3-none-any.whl
Installing collected packages: pip
  Attempting uninstall: pip
    Found existing installation: pip 24.2+computecanada
    Uninstalling pip-24.2+computecanada:
      Successfully uninstalled pip-24.2+computecanada
Successfully installed pip-24.2+computecanada
Looking in links: /cvmfs/soft.computecanada.ca/custom/python/wheelhouse/gentoo2023/x86-64-v3, /cvmfs/soft.computecanada.ca/custom/python/wheelhouse/gentoo2023/generic, /cvmfs/soft.computecanada.ca/custom/python/wheelhouse/generic
ERROR: protobuf-5.28.3-cp38-abi3-manylinux2014_x86_64.whl is not a supported wheel on this platform.
Looking in links: /cvmfs/soft.computecanada.ca/custom/python/wheelhouse/gentoo2023/x86-64-v3, /cvmfs/soft.computecanada.ca/custom/python/wheelhouse/gentoo2023/generic, /cvmfs/soft.computecanada.ca/custom/python/wheelhouse/generic
Processing /home/aneumann/projects/def-adhaj/aneumann/GNRS/wheels/immutabledict-4.2.0-py3-none-any.whl
Installing collected packages: immutabledict
Successfully installed immutabledict-4.2.0
Looking in links: /cvmfs/soft.computecanada.ca/custom/python/wheelhouse/gentoo2023/x86-64-v3, /cvmfs/soft.computecanada.ca/custom/python/wheelhouse/gentoo2023/generic, /cvmfs/soft.computecanada.ca/custom/python/wheelhouse/generic
Processing /cvmfs/soft.computecanada.ca/custom/python/wheelhouse/generic/ortools-9.10.4067+computecanada-cp312-cp312-linux_x86_64.whl (from -r /home/aneumann/projects/def-adhaj/aneumann/GNRS/requirements/or.txt (line 1))
Processing /cvmfs/soft.computecanada.ca/custom/python/wheelhouse/gentoo2023/x86-64-v3/matplotlib-3.10.0+computecanada-cp312-cp312-linux_x86_64.whl (from -r /home/aneumann/projects/def-adhaj/aneumann/GNRS/requirements/or.txt (line 2))
Processing /cvmfs/soft.computecanada.ca/custom/python/wheelhouse/gentoo2023/x86-64-v3/pandas-2.2.3+computecanada-cp312-cp312-linux_x86_64.whl (from -r /home/aneumann/projects/def-adhaj/aneumann/GNRS/requirements/or.txt (line 3))
Processing /cvmfs/soft.computecanada.ca/custom/python/wheelhouse/generic/absl_py-2.3.0+computecanada-py3-none-any.whl (from ortools<9.11,>=9.10->-r /home/aneumann/projects/def-adhaj/aneumann/GNRS/requirements/or.txt (line 1))
Processing /cvmfs/soft.computecanada.ca/custom/python/wheelhouse/gentoo2023/generic/numpy-2.2.2+computecanada-cp312-cp312-linux_x86_64.whl (from ortools<9.11,>=9.10->-r /home/aneumann/projects/def-adhaj/aneumann/GNRS/requirements/or.txt (line 1))
Processing /cvmfs/soft.computecanada.ca/custom/python/wheelhouse/gentoo2023/x86-64-v3/protobuf-6.31.1+computecanada-cp312-cp312-linux_x86_64.whl (from ortools<9.11,>=9.10->-r /home/aneumann/projects/def-adhaj/aneumann/GNRS/requirements/or.txt (line 1))
Requirement already satisfied: immutabledict>=3.0.0 in /localscratch/aneumann.46806185.0/env/lib/python3.12/site-packages (from ortools<9.11,>=9.10->-r /home/aneumann/projects/def-adhaj/aneumann/GNRS/requirements/or.txt (line 1)) (4.2.0)
Processing /cvmfs/soft.computecanada.ca/custom/python/wheelhouse/gentoo2023/generic/contourpy-1.3.1+computecanada-cp312-cp312-linux_x86_64.whl (from matplotlib->-r /home/aneumann/projects/def-adhaj/aneumann/GNRS/requirements/or.txt (line 2))
Processing /cvmfs/soft.computecanada.ca/custom/python/wheelhouse/generic/cycler-0.12.1+computecanada-py3-none-any.whl (from matplotlib->-r /home/aneumann/projects/def-adhaj/aneumann/GNRS/requirements/or.txt (line 2))
Processing /cvmfs/soft.computecanada.ca/custom/python/wheelhouse/generic/fonttools-4.59.0+computecanada-cp312-cp312-linux_x86_64.whl (from matplotlib->-r /home/aneumann/projects/def-adhaj/aneumann/GNRS/requirements/or.txt (line 2))
Processing /cvmfs/soft.computecanada.ca/custom/python/wheelhouse/gentoo2023/x86-64-v3/kiwisolver-1.4.8+computecanada-cp312-cp312-linux_x86_64.whl (from matplotlib->-r /home/aneumann/projects/def-adhaj/aneumann/GNRS/requirements/or.txt (line 2))
Processing /cvmfs/soft.computecanada.ca/custom/python/wheelhouse/generic/packaging-25.0+computecanada-py3-none-any.whl (from matplotlib->-r /home/aneumann/projects/def-adhaj/aneumann/GNRS/requirements/or.txt (line 2))
Processing /cvmfs/soft.computecanada.ca/custom/python/wheelhouse/gentoo2023/x86-64-v3/pillow-11.1.0+computecanada-cp312-cp312-linux_x86_64.whl (from matplotlib->-r /home/aneumann/projects/def-adhaj/aneumann/GNRS/requirements/or.txt (line 2))
Processing /cvmfs/soft.computecanada.ca/custom/python/wheelhouse/generic/pyparsing-3.2.3+computecanada-py3-none-any.whl (from matplotlib->-r /home/aneumann/projects/def-adhaj/aneumann/GNRS/requirements/or.txt (line 2))
Processing /cvmfs/soft.computecanada.ca/custom/python/wheelhouse/generic/python_dateutil-2.9.0.post0+computecanada-py2.py3-none-any.whl (from matplotlib->-r /home/aneumann/projects/def-adhaj/aneumann/GNRS/requirements/or.txt (line 2))
Processing /cvmfs/soft.computecanada.ca/custom/python/wheelhouse/generic/pytz-2025.2+computecanada-py2.py3-none-any.whl (from pandas->-r /home/aneumann/projects/def-adhaj/aneumann/GNRS/requirements/or.txt (line 3))
Processing /cvmfs/soft.computecanada.ca/custom/python/wheelhouse/generic/tzdata-2025.2+computecanada-py2.py3-none-any.whl (from pandas->-r /home/aneumann/projects/def-adhaj/aneumann/GNRS/requirements/or.txt (line 3))
Processing /cvmfs/soft.computecanada.ca/custom/python/wheelhouse/generic/six-1.17.0+computecanada-py2.py3-none-any.whl (from python-dateutil>=2.7->matplotlib->-r /home/aneumann/projects/def-adhaj/aneumann/GNRS/requirements/or.txt (line 2))
Installing collected packages: pytz, tzdata, six, pyparsing, protobuf, pillow, packaging, numpy, kiwisolver, fonttools, cycler, absl-py, python-dateutil, contourpy, pandas, matplotlib, ortools
Successfully installed absl-py-2.3.0+computecanada contourpy-1.3.1+computecanada cycler-0.12.1+computecanada fonttools-4.59.0+computecanada kiwisolver-1.4.8+computecanada matplotlib-3.10.0+computecanada numpy-2.2.2+computecanada ortools-9.10.4067+computecanada packaging-25.0+computecanada pandas-2.2.3+computecanada pillow-11.1.0+computecanada protobuf-6.31.1+computecanada pyparsing-3.2.3+computecanada python-dateutil-2.9.0.post0+computecanada pytz-2025.2+computecanada six-1.17.0+computecanada tzdata-2025.2+computecanada

Starting CP-SAT solver v9.10.4067
Parameters: max_time_in_seconds: 86400 max_memory_in_mb: 185000 log_search_progress: true enumerate_all_solutions: false num_search_workers: 32 absolute_gap_limit: 0 relative_gap_limit: 0

Initial optimization model '': (model_fingerprint: 0x3910cd5c6aac412e)
#Variables: 329 (#ints: 9 in objective)
  - 240 Booleans in [0,1]
  - 89 in [0,671]
#kLinear1: 44
#kLinear2: 472
#kLinear3: 200
#kLinearN: 4'280 (#terms: 72'528)

Starting presolve at 0.00s
  2.97e-03s  0.00e+00d  [DetectDominanceRelations] 
  5.72e-02s  0.00e+00d  [PresolveToFixPoint] #num_loops=8 #num_dual_strengthening=3 
  3.37e-05s  0.00e+00d  [ExtractEncodingFromLinear] #potential_supersets=2 
[Symmetry] Graph for symmetry has 4'939 nodes and 57'105 arcs.
[Symmetry] Symmetry computation done. time: 0.00251304 dtime: 0.00405867
[Symmetry] #generators: 1, average support size: 20
[Symmetry] The model contains 231 duplicate constraints !
[Symmetry] 10 orbits with sizes: 2,2,2,2,2,2,2,2,2,2
[Symmetry] Num fixable by intersecting at_most_one with orbits: 1 largest_orbit: 2
  1.51e-02s  3.04e-03d  [Probe] #probed=336 #new_bounds=13 #equiv=1 
  5.91e-05s  0.00e+00d  [MaxClique] 
  2.91e-03s  0.00e+00d  [DetectDominanceRelations] 
  2.73e-02s  0.00e+00d  [PresolveToFixPoint] #num_loops=5 #num_dual_strengthening=3 
  1.22e-02s  0.00e+00d  [ProcessAtMostOneAndLinear] 
  4.30e-03s  0.00e+00d  [DetectDuplicateConstraints] #duplicates=287 #without_enforcements=84 
  3.94e-03s  2.78e-04d  [DetectDominatedLinearConstraints] #relevant_constraints=3'767 #num_inclusions=2'988 
  4.67e-04s  0.00e+00d  [DetectDifferentVariables] #different=18 #cliques=1 #size=5 
  8.96e-04s  8.47e-05d  [ProcessSetPPC] #relevant_constraints=3'355 
  2.24e-05s  0.00e+00d  [FindAlmostIdenticalLinearConstraints] 
  8.90e-05s  8.66e-05d  [FindBigAtMostOneAndLinearOverlap] 
  1.09e-02s  5.92e-03d  [FindBigVerticalLinearOverlap] #blocks=69 #saved_nz=11'297 
  4.73e-04s  1.88e-04d  [FindBigHorizontalLinearOverlap] #linears=3'300 
  1.88e-05s  0.00e+00d  [MergeClauses] 
  2.95e-03s  0.00e+00d  [DetectDominanceRelations] 
  3.78e-02s  0.00e+00d  [PresolveToFixPoint] #num_loops=2 #num_dual_strengthening=1 
  2.94e-03s  0.00e+00d  [DetectDominanceRelations] 
  2.14e-02s  0.00e+00d  [PresolveToFixPoint] #num_loops=1 #num_dual_strengthening=1 
[Symmetry] Graph for symmetry has 4'863 nodes and 44'841 arcs.
[Symmetry] Symmetry computation done. time: 0.00124943 dtime: 0.00236603
  1.42e-02s  2.67e-03d  [Probe] #probed=336 #new_bounds=55 
  1.15e-05s  0.00e+00d  [MaxClique] 
  2.96e-03s  0.00e+00d  [DetectDominanceRelations] 
  3.46e-02s  0.00e+00d  [PresolveToFixPoint] #num_loops=2 #num_dual_strengthening=1 
  1.09e-02s  0.00e+00d  [ProcessAtMostOneAndLinear] 
  3.81e-03s  0.00e+00d  [DetectDuplicateConstraints] #without_enforcements=106 
  2.04e-03s  1.50e-04d  [DetectDominatedLinearConstraints] #relevant_constraints=3'511 #num_inclusions=324 
  3.37e-04s  0.00e+00d  [DetectDifferentVariables] 
  8.34e-04s  6.00e-05d  [ProcessSetPPC] #relevant_constraints=3'183 
  3.22e-05s  2.75e-07d  [FindAlmostIdenticalLinearConstraints] #num_tested_pairs=17 
  3.87e-05s  2.48e-05d  [FindBigAtMostOneAndLinearOverlap] 
  6.75e-03s  3.87e-03d  [FindBigVerticalLinearOverlap] #blocks=104 #saved_nz=7'379 
  3.98e-04s  1.38e-04d  [FindBigHorizontalLinearOverlap] #linears=2'874 
  1.44e-05s  0.00e+00d  [MergeClauses] 
  2.52e-03s  0.00e+00d  [DetectDominanceRelations] 
  4.08e-02s  0.00e+00d  [PresolveToFixPoint] #num_loops=2 #num_dual_strengthening=1 
  2.60e-03s  0.00e+00d  [DetectDominanceRelations] 
  2.58e-02s  0.00e+00d  [PresolveToFixPoint] #num_loops=1 #num_dual_strengthening=1 
[Symmetry] Graph for symmetry has 5'162 nodes and 37'553 arcs.
[Symmetry] Symmetry computation done. time: 0.000988263 dtime: 0.00203434
  1.36e-02s  2.50e-03d  [Probe] #probed=336 #new_bounds=73 
  1.19e-05s  0.00e+00d  [MaxClique] 
  2.69e-03s  0.00e+00d  [DetectDominanceRelations] 
  3.67e-02s  0.00e+00d  [PresolveToFixPoint] #num_loops=2 #num_dual_strengthening=1 
  1.00e-02s  0.00e+00d  [ProcessAtMostOneAndLinear] 
  3.77e-03s  0.00e+00d  [DetectDuplicateConstraints] #without_enforcements=122 
  1.62e-03s  1.09e-04d  [DetectDominatedLinearConstraints] #relevant_constraints=3'514 #num_inclusions=41 
  3.33e-04s  0.00e+00d  [DetectDifferentVariables] 
  6.53e-04s  4.31e-05d  [ProcessSetPPC] #relevant_constraints=2'812 
  5.79e-05s  3.90e-06d  [FindAlmostIdenticalLinearConstraints] #num_tested_pairs=191 
  4.01e-05s  2.19e-05d  [FindBigAtMostOneAndLinearOverlap] 
  3.30e-03s  2.48e-03d  [FindBigVerticalLinearOverlap] #blocks=33 #saved_nz=2'035 
  3.67e-04s  1.22e-04d  [FindBigHorizontalLinearOverlap] #linears=2'633 
  1.46e-05s  0.00e+00d  [MergeClauses] 
  2.49e-03s  0.00e+00d  [DetectDominanceRelations] 
  2.88e-02s  0.00e+00d  [PresolveToFixPoint] #num_loops=2 #num_dual_strengthening=1 
  1.19e-04s  0.00e+00d  [ExpandObjective] #entries=956 #tight_variables=322 #tight_constraints=187 

Presolve summary:
  - 82 affine relations were detected.
  - rule 'TODO dual: only one blocking constraint?' was applied 698 times.
  - rule 'TODO dual: only one blocking enforced constraint?' was applied 104 times.
  - rule 'TODO dual: only one unspecified blocking constraint?' was applied 36 times.
  - rule 'TODO duplicate: identical constraint with different enforcements' was applied 312 times.
  - rule 'affine: new relation' was applied 82 times.
  - rule 'at_most_one: removed literals' was applied 3 times.
  - rule 'at_most_one: size one' was applied 3 times.
  - rule 'deductions: 302 stored' was applied 1 time.
  - rule 'dual: fix variable' was applied 24 times.
  - rule 'dual: reduced domain' was applied 51 times.
  - rule 'duplicate: merged rhs of linear constraint' was applied 51 times.
  - rule 'duplicate: removed constraint' was applied 287 times.
  - rule 'enforcement: false literal' was applied 12 times.
  - rule 'exactly_one: x and not(x)' was applied 1 time.
  - rule 'incompatible linear: add implication' was applied 30 times.
  - rule 'linear matrix: common vertical rectangle' was applied 206 times.
  - rule 'linear: always true' was applied 637 times.
  - rule 'linear: doubleton free' was applied 12 times.
  - rule 'linear: empty' was applied 36 times.
  - rule 'linear: extracted enforcement literal' was applied 6'614 times.
  - rule 'linear: fixed or dup variables' was applied 4'427 times.
  - rule 'linear: positive equal one' was applied 2 times.
  - rule 'linear: reduced variable domains' was applied 314 times.
  - rule 'linear: remapped using affine relations' was applied 4'562 times.
  - rule 'linear: simplified rhs' was applied 13'890 times.
  - rule 'linear: tightened into equality' was applied 8 times.
  - rule 'linear: variable substitution 1' was applied 12 times.
  - rule 'linear: variable substitution 3' was applied 1 time.
  - rule 'no_overlap: inferred from x != y constraints' was applied 1 time.
  - rule 'presolve: 96 unused variables removed.' was applied 1 time.
  - rule 'presolve: iteration' was applied 3 times.
  - rule 'probing: reduced enforced constraint to implication.' was applied 3 times.
  - rule 'symmetry: fixed to false in general orbit' was applied 1 time.

Presolved optimization model '': (model_fingerprint: 0xb6b8ba6bfb513b9b)
#Variables: 344 (#ints: 9 in objective)
  - 82 Booleans in [0,1]
  - 230 different domains in [-7912,7204] with a largest complexity of 15.
#kExactlyOne: 1 (#literals: 3)
#kInterval: 5
#kLinear2: 652 (#enforced: 603 #multi: 460)
#kLinear3: 654 (#enforced: 464)
#kLinearN: 2'825 (#enforced: 2'710) (#terms: 25'249)
#kNoOverlap: 1 (#intervals: 5)

Preloading model.
#Bound   0.46s best:inf   next:[180,5191] initial_domain
[Symmetry] Graph for symmetry has 5'068 nodes and 35'550 arcs.
[Symmetry] Symmetry computation done. time: 0.00093344 dtime: 0.00192499
#Model   0.47s var:344/344 constraints:4138/4138

Starting search at 0.47s with 32 workers.
17 full problem subsolvers: [core, default_lp, fixed, lb_tree_search, max_lp, no_lp, objective_lb_search, objective_lb_search_max_lp, objective_lb_search_no_lp, objective_shaving_search_max_lp, objective_shaving_search_no_lp, probing, probing_max_lp, pseudo_costs, quick_restart, quick_restart_no_lp, reduced_costs]
13 first solution subsolvers: [fj_long_default, fj_long_lin_default, fj_long_random, fj_short_default, fj_short_lin_default, fj_short_lin_random, fj_short_random, fs_random(2), fs_random_no_lp, fs_random_quick_restart(2), fs_random_quick_restart_no_lp]
13 incomplete subsolvers: [feasibility_pump, graph_arc_lns, graph_cst_lns, graph_dec_lns, graph_var_lns, rins/rens, rnd_cst_lns, rnd_var_lns, scheduling_intervals_lns, scheduling_precedences_lns, scheduling_time_window_lns, violation_ls(2)]
3 helper subsolvers: [neighborhood_helper, synchronization_agent, update_gap_integral]
#Bound   0.65s best:inf   next:[181,5191] objective_shaving_search_no_lp (vars=344 csts=4139)
#Bound   0.70s best:inf   next:[182,5191] objective_shaving_search_no_lp (vars=345 csts=4163)
#1       0.72s best:2317  next:[182,2316] quick_restart_no_lp (fixed_bools=0/124)
#Bound   0.74s best:2317  next:[216,2316] quick_restart
#2       0.74s best:2203  next:[216,2202] quick_restart_no_lp (fixed_bools=0/146)
#3       0.75s best:2168  next:[216,2167] quick_restart_no_lp (fixed_bools=0/158)
#4       0.78s best:2146  next:[216,2145] quick_restart_no_lp (fixed_bools=0/198)
#Bound   0.80s best:2146  next:[221,2145] default_lp
#Bound   0.84s best:2146  next:[265,2145] default_lp
#5       0.85s best:2142  next:[265,2141] quick_restart_no_lp (fixed_bools=0/226)
#6       0.85s best:2140  next:[265,2139] violation_ls(batch:1 #solutions_imported:1 #lin_moves:1 #lin_evals:9 #weight_updates:0)
#7       0.86s best:2139  next:[265,2138] violation_ls(batch:2 #solutions_imported:2 #lin_moves:1 #lin_evals:12 #gen_moves:1 #gen_evals:0 #comp_moves:1 #backtracks:0 #weight_updates:0)
#8       0.88s best:2137  next:[265,2136] violation_ls(batch:2 #solutions_imported:2 #lin_moves:1 #lin_evals:17'082 #gen_moves:7'356 #gen_evals:1'161 #comp_moves:1'309 #backtracks:3'023 #weight_updates:79)
#9       0.88s best:1921  next:[265,1920] graph_dec_lns (d=0.50 s=43 t=0.10 p=0.00 stall=0 h=auto_l0) [presolve]
#Bound   0.88s best:1921  next:[273,1920] default_lp
#10      0.90s best:1920  next:[273,1919] quick_restart_no_lp (fixed_bools=0/250)
#Bound   0.93s best:1920  next:[274,1919] objective_lb_search_no_lp
#11      0.97s best:1919  next:[274,1918] violation_ls(batch:3 #solutions_imported:3 #lin_moves:28 #lin_evals:17'213 #gen_moves:7'356 #gen_evals:1'161 #comp_moves:1'309 #backtracks:3'023 #weight_updates:92)
#Bound   0.98s best:1919  next:[279,1918] objective_lb_search
#Bound   0.99s best:1919  next:[280,1918] objective_lb_search
#Bound   0.99s best:1919  next:[372,1918] objective_lb_search_no_lp
#Bound   1.00s best:1919  next:[373,1918] objective_lb_search_no_lp
#Bound   1.02s best:1919  next:[383,1918] objective_lb_search_no_lp
#Bound   1.04s best:1919  next:[429,1918] objective_lb_search_no_lp
#12      1.08s best:1918  next:[429,1917] violation_ls(batch:4 #solutions_imported:4 #lin_moves:28 #lin_evals:19'867 #gen_moves:8'435 #gen_evals:1'242 #comp_moves:1'360 #backtracks:3'537 #weight_updates:113)
#13      1.08s best:1917  next:[429,1916] violation_ls(batch:4 #solutions_imported:4 #lin_moves:250 #lin_evals:1'035 #gen_moves:1 #gen_evals:0 #comp_moves:1 #backtracks:0 #weight_updates:77)
#14      1.20s best:1763  next:[429,1762] rins_pump_lns (d=0.71 s=77 t=0.10 p=1.00 stall=1 h=auto_l0)
#Bound   1.36s best:1763  next:[444,1762] objective_lb_search_no_lp
#15      1.42s best:1650  next:[444,1649] rins_pump_lns (d=0.81 s=78 t=0.10 p=1.00 stall=0 h=auto_l0)
#16      1.49s best:1649  next:[444,1648] quick_restart_no_lp (fixed_bools=0/261)
#Bound   1.49s best:1649  next:[568,1648] objective_lb_search_no_lp
#17      1.50s best:1642  next:[568,1641] quick_restart_no_lp (fixed_bools=0/275)
#18      1.50s best:1641  next:[568,1640] quick_restart_no_lp (fixed_bools=0/278)
#Bound   1.51s best:1641  next:[571,1640] objective_lb_search_no_lp
#19      1.53s best:1625  next:[571,1624] quick_restart_no_lp (fixed_bools=0/283)
#Bound   1.54s best:1625  next:[579,1624] objective_lb_search_no_lp
#20      1.56s best:1624  next:[579,1623] violation_ls(batch:5 #solutions_imported:5 #lin_moves:29 #lin_evals:19'876 #gen_moves:8'435 #gen_evals:1'242 #comp_moves:1'360 #backtracks:3'537 #weight_updates:113)
#21      1.57s best:1623  next:[579,1622] violation_ls(batch:5 #solutions_imported:5 #lin_moves:250 #lin_evals:1'070 #gen_moves:14 #gen_evals:0 #comp_moves:2 #backtracks:6 #weight_updates:77)
#Bound   1.57s best:1623  next:[583,1622] objective_lb_search_no_lp
#22      1.62s best:1609  next:[583,1608] quick_restart_no_lp (fixed_bools=1/325)
#Bound   1.63s best:1609  next:[681,1608] objective_lb_search_no_lp
#23      1.65s best:1599  next:[681,1598] quick_restart_no_lp (fixed_bools=1/327)
#24      1.68s best:1598  next:[681,1597] quick_restart_no_lp (fixed_bools=1/355)
#Bound   1.70s best:1598  next:[688,1597] objective_lb_search_no_lp
#25      1.75s best:1417  next:[688,1416] rins_pump_lns (d=0.88 s=87 t=0.10 p=1.00 stall=0 h=auto_l0)
#Bound   1.77s best:1417  next:[758,1416] objective_lb_search_no_lp
#26      1.93s best:1415  next:[759,1414] quick_restart_no_lp (fixed_bools=1/440)
#Bound   2.00s best:1415  next:[760,1414] objective_lb_search_no_lp [skipped_logs=1]
#Bound   2.83s best:1415  next:[788,1414] objective_lb_search [skipped_logs=3]
#Bound   3.97s best:1415  next:[881,1414] objective_lb_search_no_lp [skipped_logs=10]
#Bound   4.95s best:1415  next:[926,1414] objective_lb_search_no_lp [skipped_logs=6]
#Bound   5.68s best:1415  next:[940,1414] objective_lb_search_no_lp [skipped_logs=1]
#Bound   6.65s best:1415  next:[956,1414] objective_lb_search [skipped_logs=1]
#Bound   7.83s best:1415  next:[958,1414] objective_lb_search [skipped_logs=0]
#Bound   8.86s best:1415  next:[990,1414] objective_lb_search [skipped_logs=1]
#Bound   9.75s best:1415  next:[992,1414] objective_lb_search_no_lp [skipped_logs=0]
#Bound  10.84s best:1415  next:[1002,1414] objective_lb_search [skipped_logs=1]
#Bound  11.08s best:1415  next:[1027,1414] objective_lb_search [skipped_logs=0]
#Bound  12.89s best:1415  next:[1036,1414] objective_lb_search [skipped_logs=2]
#Bound  13.17s best:1415  next:[1039,1414] objective_lb_search [skipped_logs=0]
#Bound  14.86s best:1415  next:[1041,1414] objective_lb_search [skipped_logs=1]
#Bound  15.90s best:1415  next:[1064,1414] objective_lb_search [skipped_logs=2]
#Bound  17.09s best:1415  next:[1070,1414] objective_lb_search
#Bound  18.02s best:1415  next:[1074,1414] objective_lb_search
#Bound  18.74s best:1415  next:[1089,1414] objective_lb_search [skipped_logs=2]
#Bound  19.94s best:1415  next:[1091,1414] objective_lb_search [skipped_logs=0]
#Bound  20.58s best:1415  next:[1093,1414] objective_lb_search [skipped_logs=0]
#Bound  21.84s best:1415  next:[1096,1414] objective_lb_search [skipped_logs=1]
#Bound  24.14s best:1415  next:[1097,1414] objective_lb_search
#Bound  24.33s best:1415  next:[1101,1414] objective_lb_search
#Bound  24.59s best:1415  next:[1109,1414] objective_lb_search [skipped_logs=0]
#Bound  25.42s best:1415  next:[1120,1414] objective_lb_search [skipped_logs=0]
#Bound  26.85s best:1415  next:[1123,1414] objective_lb_search [skipped_logs=0]
#Bound  28.28s best:1415  next:[1128,1414] objective_lb_search
#Bound  29.80s best:1415  next:[1131,1414] objective_lb_search
#Bound  36.25s best:1415  next:[1132,1414] objective_shaving_search_max_lp (vars=368 csts=4140)
#Bound  37.15s best:1415  next:[1135,1414] objective_lb_search
#Bound  38.40s best:1415  next:[1136,1414] objective_lb_search
#Bound  38.49s best:1415  next:[1137,1414] objective_lb_search
#Bound  38.55s best:1415  next:[1138,1414] objective_lb_search
#Bound  39.40s best:1415  next:[1144,1414] objective_lb_search
#Model  44.00s var:342/344 constraints:4039/4138
#Bound  44.32s best:1415  next:[1146,1414] objective_lb_search
#Bound  45.56s best:1415  next:[1170,1414] objective_lb_search_no_lp
#Model  52.13s var:341/344 constraints:4004/4138
#Bound  52.52s best:1415  next:[1171,1414] objective_lb_search_no_lp
#Bound  53.05s best:1415  next:[1173,1414] objective_lb_search_no_lp
#Bound  53.38s best:1415  next:[1174,1414] objective_lb_search_no_lp
#Model  56.33s var:340/344 constraints:3969/4138
#Model  56.68s var:338/344 constraints:3805/4138
#Bound  57.00s best:1415  next:[1189,1414] objective_lb_search_no_lp
#Bound  57.38s best:1415  next:[1194,1414] objective_lb_search_no_lp
#Model  57.56s var:328/344 constraints:3101/4138
#Model  57.63s var:325/344 constraints:2895/4138
#Bound  57.95s best:1415  next:[1371,1414] max_lp
#Model  57.96s var:323/344 constraints:2660/4138
#Bound  57.98s best:1415  next:[1372,1414] max_lp
#Model  57.98s var:321/344 constraints:2415/4138
#Done   57.98s quick_restart_no_lp
#Model  57.98s var:304/344 constraints:1239/4138
#Model  57.99s var:290/344 constraints:590/4138

Task timing                                  n [     min,      max]      avg      dev     time         n [     min,      max]      avg      dev    dtime
                             'core':         1 [  57.61s,   57.61s]   57.61s   0.00ns   57.61s         1 [  25.43s,   25.43s]   25.43s   0.00ns   25.43s
                       'default_lp':         1 [  57.51s,   57.51s]   57.51s   0.00ns   57.51s         1 [   6.90s,    6.90s]    6.90s   0.00ns    6.90s
                 'feasibility_pump':        95 [ 10.46ms, 686.35ms] 171.14ms 102.70ms   16.26s        94 [  3.14ms,  67.48ms]  23.49ms   5.03ms    2.21s
                            'fixed':         1 [  57.51s,   57.51s]   57.51s   0.00ns   57.51s         1 [   6.82s,    6.82s]    6.82s   0.00ns    6.82s
                  'fj_long_default':         1 [474.05ms, 474.05ms] 474.05ms   0.00ns 474.05ms         1 [ 80.44ms,  80.44ms]  80.44ms   0.00ns  80.44ms
              'fj_long_lin_default':         1 [674.69ms, 674.69ms] 674.69ms   0.00ns 674.69ms         1 [ 88.15ms,  88.15ms]  88.15ms   0.00ns  88.15ms
                   'fj_long_random':         1 [281.90ms, 281.90ms] 281.90ms   0.00ns 281.90ms         1 [ 70.86ms,  70.86ms]  70.86ms   0.00ns  70.86ms
                 'fj_short_default':         1 [271.99ms, 271.99ms] 271.99ms   0.00ns 271.99ms         1 [ 83.06ms,  83.06ms]  83.06ms   0.00ns  83.06ms
             'fj_short_lin_default':         2 [129.29ms, 148.64ms] 138.97ms   9.67ms 277.93ms         2 [ 84.70ms,  87.19ms]  85.95ms   1.24ms 171.90ms
              'fj_short_lin_random':         1 [281.95ms, 281.95ms] 281.95ms   0.00ns 281.95ms         1 [ 85.78ms,  85.78ms]  85.78ms   0.00ns  85.78ms
                  'fj_short_random':         2 [137.63ms, 140.30ms] 138.96ms   1.33ms 277.93ms         2 [ 86.31ms,  88.75ms]  87.53ms   1.22ms 175.06ms
                        'fs_random':         1 [313.36ms, 313.36ms] 313.36ms   0.00ns 313.36ms         1 [ 20.00ns,  20.00ns]  20.00ns   0.00ns  20.00ns
                        'fs_random':         1 [698.70ms, 698.70ms] 698.70ms   0.00ns 698.70ms         1 [ 20.00ns,  20.00ns]  20.00ns   0.00ns  20.00ns
                  'fs_random_no_lp':         1 [217.67ms, 217.67ms] 217.67ms   0.00ns 217.67ms         1 [268.55us, 268.55us] 268.55us   0.00ns 268.55us
          'fs_random_quick_restart':         1 [335.81ms, 335.81ms] 335.81ms   0.00ns 335.81ms         1 [ 20.00ns,  20.00ns]  20.00ns   0.00ns  20.00ns
          'fs_random_quick_restart':         1 [536.66ms, 536.66ms] 536.66ms   0.00ns 536.66ms         1 [ 20.00ns,  20.00ns]  20.00ns   0.00ns  20.00ns
    'fs_random_quick_restart_no_lp':         1 [336.71ms, 336.71ms] 336.71ms   0.00ns 336.71ms         1 [424.56us, 424.56us] 424.56us   0.00ns 424.56us
                    'graph_arc_lns':        96 [  5.47ms,    2.96s] 774.64ms 656.39ms    1.24m        91 [ 10.00ns, 102.27ms]  58.31ms  44.10ms    5.31s
                    'graph_cst_lns':        96 [  2.74ms,    3.44s] 777.39ms 761.26ms    1.24m        78 [ 10.00ns, 102.42ms]  58.38ms  41.47ms    4.55s
                    'graph_dec_lns':        96 [  7.07ms,    2.92s] 708.04ms 630.97ms    1.13m        92 [ 10.00ns, 102.31ms]  53.13ms  44.98ms    4.89s
                    'graph_var_lns':        96 [  5.62ms,    3.13s] 730.73ms 688.15ms    1.17m        90 [ 10.00ns, 102.46ms]  53.69ms  45.92ms    4.83s
                   'lb_tree_search':         1 [  57.50s,   57.50s]   57.50s   0.00ns   57.50s         1 [  10.83s,   10.83s]   10.83s   0.00ns   10.83s
                           'max_lp':         1 [  57.51s,   57.51s]   57.51s   0.00ns   57.51s         1 [  13.37s,   13.37s]   13.37s   0.00ns   13.37s
                            'no_lp':         1 [  57.51s,   57.51s]   57.51s   0.00ns   57.51s         1 [   7.42s,    7.42s]    7.42s   0.00ns    7.42s
              'objective_lb_search':         1 [  57.49s,   57.49s]   57.49s   0.00ns   57.49s         1 [  10.76s,   10.76s]   10.76s   0.00ns   10.76s
       'objective_lb_search_max_lp':         1 [  57.48s,   57.48s]   57.48s   0.00ns   57.48s         1 [   8.93s,    8.93s]    8.93s   0.00ns    8.93s
        'objective_lb_search_no_lp':         1 [  57.48s,   57.48s]   57.48s   0.00ns   57.48s         1 [   6.41s,    6.41s]    6.41s   0.00ns    6.41s
  'objective_shaving_search_max_lp':        62 [ 22.83ms,    6.90s] 845.51ms    1.34s   52.42s        50 [ 97.18us,    1.33s] 118.22ms 253.56ms    5.91s
   'objective_shaving_search_no_lp':        62 [  9.19ms,    6.90s] 855.12ms    1.34s   53.02s        52 [  2.02ms, 929.26ms]  79.41ms 153.66ms    4.13s
                          'probing':         1 [  57.52s,   57.52s]   57.52s   0.00ns   57.52s         1 [   2.61s,    2.61s]    2.61s   0.00ns    2.61s
                   'probing_max_lp':         1 [  57.50s,   57.50s]   57.50s   0.00ns   57.50s         1 [   6.01s,    6.01s]    6.01s   0.00ns    6.01s
                     'pseudo_costs':         1 [  57.51s,   57.51s]   57.51s   0.00ns   57.51s         1 [  15.79s,   15.79s]   15.79s   0.00ns   15.79s
                    'quick_restart':         1 [  57.52s,   57.52s]   57.52s   0.00ns   57.52s         1 [   8.47s,    8.47s]    8.47s   0.00ns    8.47s
              'quick_restart_no_lp':         1 [  57.51s,   57.51s]   57.51s   0.00ns   57.51s         1 [   9.31s,    9.31s]    9.31s   0.00ns    9.31s
                    'reduced_costs':         1 [  57.51s,   57.51s]   57.51s   0.00ns   57.51s         1 [   9.96s,    9.96s]    9.96s   0.00ns    9.96s
                        'rins/rens':        96 [157.97us,    2.85s] 590.56ms 567.27ms   56.69s        81 [ 10.00ns, 100.61ms]  64.41ms  39.94ms    5.22s
                      'rnd_cst_lns':        96 [  5.56ms,    2.28s] 622.03ms 454.47ms   59.72s        89 [ 10.00ns, 102.66ms]  57.12ms  43.48ms    5.08s
                      'rnd_var_lns':        96 [  5.32ms,    2.61s] 762.79ms 571.43ms    1.22m        93 [ 10.00ns, 102.38ms]  58.75ms  40.44ms    5.46s
         'scheduling_intervals_lns':        96 [  2.40ms,    3.28s]    1.22s 646.59ms    1.96m        91 [ 68.98ms, 102.58ms] 100.54ms   3.47ms    9.15s
       'scheduling_precedences_lns':        95 [  2.43ms,    3.52s]    1.11s 544.13ms    1.76m        91 [ 59.29ms, 102.62ms] 100.45ms   4.45ms    9.14s
       'scheduling_time_window_lns':        95 [  2.48ms,    3.73s]    1.30s 704.44ms    2.06m        91 [  3.83ms, 102.64ms]  99.84ms  10.17ms    9.09s
                     'violation_ls':        95 [531.53us, 320.43ms] 100.19ms  51.13ms    9.52s        95 [630.00ns, 101.79ms]  80.57ms  20.06ms    7.65s
                     'violation_ls':        96 [877.64us, 458.02ms] 126.50ms  69.11ms   12.14s        96 [  1.11us, 107.43ms]  84.81ms  18.88ms    8.14s

Search stats                        Bools  Conflicts  Branches  Restarts  BoolPropag  IntegerPropag
                           'core':  6'161      6'934    18'692     3'184  16'900'636      8'179'628
                     'default_lp':    527      8'201    35'128     4'904   1'260'320     11'726'312
                          'fixed':  1'130     30'011    41'531     1'350   8'443'701     18'213'941
                      'fs_random':     82          0         0         0           0              0
                      'fs_random':     82          0       164       164           6          6'085
                'fs_random_no_lp':     86          1       168       164          58          7'077
        'fs_random_quick_restart':     82          0         0         0           0              0
        'fs_random_quick_restart':     82          0         0         0           0              0
  'fs_random_quick_restart_no_lp':     82          0       206       164           7          7'663
                 'lb_tree_search':     92        149    48'221    13'088     133'996      6'344'851
                         'max_lp':     82      9'861    56'664     7'791     374'434     17'428'868
                          'no_lp':     82     26'387    61'895     5'104     559'338     30'230'405
            'objective_lb_search':    190      7'377    50'348    11'020     426'380     14'257'667
     'objective_lb_search_max_lp':    130      3'276    43'805    12'200     227'175      8'676'247
      'objective_lb_search_no_lp':    268     22'403    53'751     5'780     670'779     25'233'258
                        'probing':    374        149       599       599      13'079        128'121
                 'probing_max_lp':    374        137       611       611      13'399        131'288
                   'pseudo_costs':     82     10'918    66'574     9'225     443'372     20'067'639
                  'quick_restart':    681      6'337    46'922     6'452   2'139'820      9'906'713
            'quick_restart_no_lp':  1'983     28'135    87'931     6'964  12'095'053     24'449'690
                  'reduced_costs':    438      9'017    60'995     9'175   2'542'686     14'355'291

SAT stats                           ClassicMinim  LitRemoved  LitLearned  LitForgotten  Subsumed  MClauses  MDecisions  MLitTrue  MSubsumed  MLitRemoved  MReused
                           'core':         5'983      31'045      27'298             0        36     1'054       5'224         0        176          542       10
                     'default_lp':         5'619      14'269      78'116             0       265     2'191      21'414         0        930        6'827      412
                          'fixed':        19'026     138'730     468'034             0        76       841       9'076         0        586        5'550      278
                      'fs_random':             0           0           0             0         0         0           0         0          0            0        0
                      'fs_random':             0           0           0             0         0         0           0         0          0            0        0
                'fs_random_no_lp':             0           0           4             0         0         0           0         0          0            0        0
        'fs_random_quick_restart':             0           0           0             0         0         0           0         0          0            0        0
        'fs_random_quick_restart':             0           0           0             0         0         0           0         0          0            0        0
  'fs_random_quick_restart_no_lp':             0           0           0             0         0         0           0         0          0            0        0
                 'lb_tree_search':             6           7         493             0         0     4'771      24'325         0         26          106      314
                         'max_lp':         6'499      16'216     101'699             0       405     4'062      43'416         0      1'190        8'419      976
                          'no_lp':        19'577      60'263     257'520        75'017       730     2'874      28'864         0      1'199        8'728      548
            'objective_lb_search':         5'129      12'454      47'932             0       403     4'793      37'182        22      1'475        8'648    1'218
     'objective_lb_search_max_lp':         2'082       4'540      23'584             0       209     4'078      32'700         0        321        1'929    1'106
      'objective_lb_search_no_lp':        16'384      41'256     173'984         8'201       770     2'814      24'177         0      1'013        6'462      646
                        'probing':             0           0         149             0         0         0           0         0          0            0        0
                 'probing_max_lp':             0           0         137             0         0         0           0         0          0            0        0
                   'pseudo_costs':         7'222      17'503     108'815             0       496     4'741      51'593         0      1'022        7'111    1'294
                  'quick_restart':         3'937      10'667      55'865             0       272     3'511      34'522         7      1'763       13'897      764
            'quick_restart_no_lp':        20'658      93'525     317'092        56'822       290     2'889      26'785         2      2'121       17'959      298
                  'reduced_costs':         6'413      18'046      93'940             0       273     4'406      37'607         0      1'933       13'268      588

Lp stats                         Component  Iterations  AddedCuts  OPTIMAL  DUAL_F.  DUAL_U.
                  'default_lp':          1     107'567      7'622   13'105        0        3
                       'fixed':          1      17'926      1'448   29'440        0        0
                   'fs_random':          1           0          0        0        0        0
                   'fs_random':          1           0          0        0        0        0
     'fs_random_quick_restart':          1           0          0        0        0        0
     'fs_random_quick_restart':          1           0          0        0        0        0
              'lb_tree_search':          1     205'469      5'500   10'734    5'261        0
                      'max_lp':          1     194'249      7'893   14'433    5'111       14
         'objective_lb_search':          1     173'983      6'405   13'691        1       11
  'objective_lb_search_max_lp':          1     134'528      4'767    5'427    1'780        2
                     'probing':          1      14'320      4'360    1'853        0        1
              'probing_max_lp':          1      14'962      5'462    1'939      136        0
                'pseudo_costs':          1     249'051      9'395   16'724    5'496       11
               'quick_restart':          1     125'985      6'047   10'380        0        0
               'reduced_costs':          1     141'166      8'965   10'999    4'762        2

Lp dimension                                                                      Final dimension of first component
                  'default_lp':   621 rows, 339 columns, 2734 entries with magnitude in [5.357852e-03, 1.000000e+00]
                       'fixed':    234 rows, 339 columns, 867 entries with magnitude in [3.152050e-02, 1.000000e+00]
                   'fs_random':        0 rows, 339 columns, 0 entries with magnitude in [0.000000e+00, 0.000000e+00]
                   'fs_random':        0 rows, 339 columns, 0 entries with magnitude in [0.000000e+00, 0.000000e+00]
     'fs_random_quick_restart':        0 rows, 339 columns, 0 entries with magnitude in [0.000000e+00, 0.000000e+00]
     'fs_random_quick_restart':        0 rows, 339 columns, 0 entries with magnitude in [0.000000e+00, 0.000000e+00]
              'lb_tree_search':  1228 rows, 344 columns, 5437 entries with magnitude in [3.471539e-03, 1.000000e+00]
                      'max_lp':  1044 rows, 344 columns, 2745 entries with magnitude in [9.950362e-05, 1.000000e+00]
         'objective_lb_search':   620 rows, 339 columns, 2476 entries with magnitude in [4.139830e-03, 1.000000e+00]
  'objective_lb_search_max_lp':   734 rows, 344 columns, 2727 entries with magnitude in [7.124725e-03, 1.000000e+00]
                     'probing':   324 rows, 339 columns, 1588 entries with magnitude in [7.514804e-03, 1.000000e+00]
              'probing_max_lp':   625 rows, 344 columns, 3880 entries with magnitude in [2.539462e-03, 1.000000e+00]
                'pseudo_costs':   690 rows, 344 columns, 2555 entries with magnitude in [7.839741e-03, 1.000000e+00]
               'quick_restart':   780 rows, 339 columns, 3008 entries with magnitude in [5.517494e-05, 1.000000e+00]
               'reduced_costs':   578 rows, 344 columns, 2187 entries with magnitude in [7.908964e-03, 1.000000e+00]

Lp debug                         CutPropag  CutEqPropag  Adjust  Overflow        Bad  BadScaling
                  'default_lp':          8            7   3'527         0    170'170           0
                       'fixed':          0            1       7         0      5'513           0
                   'fs_random':          0            0       0         0          0           0
                   'fs_random':          0            0       0         0          0           0
     'fs_random_quick_restart':          0            0       0         0          0           0
     'fs_random_quick_restart':          0            0       0         0          0           0
              'lb_tree_search':         14            0   6'868         0    126'070           0
                      'max_lp':         93            1   6'321         0    180'497           0
         'objective_lb_search':          5           26   5'084         0    244'026           0
  'objective_lb_search_max_lp':         13            0   3'947         0    142'216           0
                     'probing':         11           13   1'221         0  2'321'925           0
              'probing_max_lp':         46            3   1'955         0  2'445'633           0
                'pseudo_costs':          8            2   7'893         0    201'495           0
               'quick_restart':         31           48   5'062         0    321'898           0
               'reduced_costs':         32            0   6'544         0    149'693           0

Lp pool                          Constraints  Updates  Simplif  Merged  Shortened  Split  Strenghtened     Cuts/Call
                  'default_lp':        7'905      329    9'947      72        758  4'622         5'434  7'622/23'016
                       'fixed':        1'801       28       32       2          0     26           202   1'448/2'873
                   'fs_random':          355        0        0       0          0      0             0           0/0
                   'fs_random':          355        0        0       0          0      0             0           0/0
     'fs_random_quick_restart':          355        0        0       0          0      0             0           0/0
     'fs_random_quick_restart':          355        0        0       0          0      0             0           0/0
              'lb_tree_search':        9'588      274   26'571      44      4'057  1'026        31'104  5'500/18'042
                      'max_lp':       11'943      612  107'745      82     17'016  2'474        57'149  7'893/24'633
         'objective_lb_search':        6'742      466   10'812      18        498  6'383         4'607  6'405/21'602
  'objective_lb_search_max_lp':        8'881      273   21'675      18      1'888  2'236        30'470  4'767/13'492
                     'probing':        4'709      536   10'002       6        480  9'960         2'253   4'360/8'479
              'probing_max_lp':        9'576      437   24'487      18      2'116  8'546        20'707  5'462/12'402
                'pseudo_costs':       13'420      320   43'995     107      5'548  3'098        40'781  9'395/31'481
               'quick_restart':        6'383      663   39'680      19      4'289  8'611         9'150  6'047/18'668
               'reduced_costs':       13'062      306   22'280      35      1'729  3'519        25'672  8'965/24'811

Lp Cut                                         defaul  fixed  max_lp  quick_  reduce  pseudo  lb_tre  probin  object  probin  object
                                       CG_FF:     341     99     289     145     435     310     287     160     269     221     168
                                        CG_K:     164     75     229      67     355     247     158      79     115     115     103
                                        CG_R:     200    105     238     123     286     189     135      99     185     109     108
                                       CG_RB:     971    185     719     534     980     642     317     607     880     316     322
                                      CG_RBP:      96     26      46      57     133      87      28      47      76      13      31
                                      Clique:       -      -      84       -      67      76      70       -       -      60      73
                                          IB:   1'262    388     736   1'212     863   1'047     681     815   1'113     326     738
                                    MIR_1_FF:     486    101     479     381     458     558     343     262     402     328     296
                                     MIR_1_K:      55     11      71      54      65     101      34      18      45      22      25
                                    MIR_1_KL:       9      -       4       -       1       3       2       1       -       -       -
                                     MIR_1_R:      71     23      35      45      73      70      30      40      53      23      28
                                    MIR_1_RB:     840     87     949     639   1'011   1'076     676     424     762     608     490
                                   MIR_1_RBP:      78     18     197      39     193     181     145      28      45     106      83
                                   MIR_1_RLT:       -      -       -       -       -       1       -       -       -       -       -
                                    MIR_2_FF:     251     52     286     187     295     361     162     121     175     147     162
                                     MIR_2_K:      42      9      39      25      47      72      27      22      24      17      27
                                    MIR_2_KL:       3      -       2       1       -       3       1       -       -       -       -
                                     MIR_2_R:      82     12      64      53      89      88      57      50      48      47      49
                                    MIR_2_RB:     445     61     495     336     526     645     266     243     388     215     249
                                   MIR_2_RBP:      53      7      86      27     111     100      45      21      43      38      45
                                    MIR_3_FF:     144     20     163     114     209     203      88      74     108      77      71
                                     MIR_3_K:      19      5      37      16      40      41      12      12      15      15      14
                                    MIR_3_KL:       2      -       3       3       -       -       1       -       1       -       -
                                     MIR_3_R:      43      9      50      38      80      59      32      32      38      35      38
                                    MIR_3_RB:     272     19     257     254     340     368     165     159     213     119     130
                                   MIR_3_RBP:      39      2      50      27      84      48      42      14      28      14      28
                                    MIR_4_FF:      93     13     121      95     129     145      79      68      98      79      58
                                     MIR_4_K:      22      2      30      16      33      44      24       4      15      19      11
                                    MIR_4_KL:       2      -       1       4       1       2       2       3       2       -       -
                                     MIR_4_R:      48      8      42      39      53      77      32      29      47      18      33
                                    MIR_4_RB:     190     16     166     161     211     257     135     128     170      73      81
                                   MIR_4_RBP:      23      2      26      13      38      41      23      13      18       5      13
                                    MIR_5_FF:      95      7      81      56      87     101      46      42      50      36      45
                                     MIR_5_K:      13      1      28      18      37      32      15       4       9      11      10
                                    MIR_5_KL:       6      -       3       1       2       1       -       1       3       -       1
                                     MIR_5_R:      60      1      40      41      46      62      27      27      36      21      24
                                    MIR_5_RB:     153     10      97     112     142     175      84      74     115      41      62
                                   MIR_5_RBP:      17      2      25      13      22      30      12       4      14       6      14
                                    MIR_6_FF:      38      2      37      45      45      52      28      24      21       8      18
                                     MIR_6_K:       2      -      14       6      17      16      10       4       -       3       5
                                    MIR_6_KL:       -      -       1       -       3       -       -       3       1       -       -
                                     MIR_6_R:      31      2      22      22      27      28      14      10      11       6       7
                                    MIR_6_RB:      62      6      53      69      90     100      33      39      69      16      25
                                   MIR_6_RBP:       5      -      13       7      21      18       9       5       3       4      10
  NoOverlapCompletionTimeExhaustive_weighted:       -      -      12       -       9      18       9       -       -       6       8
                 NoOverlapDisjunctionOnStart:       -      -       8       -       6       7       7       -       -       5       6
                                ZERO_HALF_FF:      79     16     109      30     106     129      69      21      53      53      42
                                 ZERO_HALF_K:      12      1      27      10      25      27      22       -      13      13      11
                                 ZERO_HALF_R:     518     22   1'021     735     796   1'105     803     416     497   1'896     867
                                ZERO_HALF_RB:     136     16     249     117     250     284     192      74     116     144     111
                               ZERO_HALF_RBP:      49      7      59      60      28      68      21      39      18      28      27

LNS stats                        Improv/Calls  Closed  Difficulty  TimeLimit
               'graph_arc_lns':          7/96     57%        0.99       0.10
               'graph_cst_lns':          6/83     59%        0.99       0.10
               'graph_dec_lns':          4/95     57%        0.99       0.10
               'graph_var_lns':          7/96     56%        0.99       0.10
                   'rins/rens':         13/90     53%        0.93       0.10
                 'rnd_cst_lns':          8/96     58%        0.99       0.10
                 'rnd_var_lns':          4/95     59%        1.00       0.10
    'scheduling_intervals_lns':          5/91      1%        0.00       0.10
  'scheduling_precedences_lns':          4/91      1%        0.00       0.10
  'scheduling_time_window_lns':          5/91      0%        0.00       0.10

LS stats                   Batches  Restarts  LinMoves  GenMoves  CompoundMoves  WeightUpdates
       'fj_long_default':        1         1     9'848         0              0            152
   'fj_long_lin_default':        1         1         0     2'255            331              1
        'fj_long_random':        1         1     8'405         0              0            130
      'fj_short_default':        1         1         0     2'072            336              0
  'fj_short_lin_default':        2         1         0     4'541            586              2
   'fj_short_lin_random':        1         1         0     2'001            262              0
       'fj_short_random':        2         1         0     4'221            532              1
          'violation_ls':       95         0       250   465'437         15'209          1'240
          'violation_ls':       96         0        29   530'904         16'127          1'822

Solutions (26)            Num     Rank
        'graph_dec_lns':    1    [9,9]
  'quick_restart_no_lp':   14   [1,26]
        'rins_pump_lns':    3  [14,25]
         'violation_ls':    8   [6,21]

Objective bounds                      Num
                       'default_lp':    3
                   'initial_domain':    1
                           'max_lp':    2
              'objective_lb_search':   42
       'objective_lb_search_max_lp':    1
        'objective_lb_search_no_lp':   44
  'objective_shaving_search_max_lp':    1
   'objective_shaving_search_no_lp':    2
                    'quick_restart':    1

Solution repositories    Added  Queried  Ignored  Synchro
  'feasible solutions':    892    2'179        0      855
        'lp solutions':    412       45        0      355
                'pump':  1'951       51

Improving bounds shared            Num
                        'core':      2
                  'default_lp':     93
             'fs_random_no_lp':     17
              'lb_tree_search':    107
                      'max_lp':    424
                       'no_lp':     57
         'objective_lb_search':      4
  'objective_lb_search_max_lp':     15
   'objective_lb_search_no_lp':      1
                     'probing':    344
              'probing_max_lp':    177
                'pseudo_costs':    192
               'quick_restart':    117
         'quick_restart_no_lp':  1'874
               'reduced_costs':     75

Clauses shared                   Num
                        'core':    3
                  'default_lp':   16
              'lb_tree_search':   18
                      'max_lp':   11
                       'no_lp':   41
         'objective_lb_search':    1
  'objective_lb_search_max_lp':    3
   'objective_lb_search_no_lp':    5
                'pseudo_costs':   18
               'quick_restart':    4
         'quick_restart_no_lp':   13
               'reduced_costs':    5

CpSolverResponse summary:
status: OPTIMAL
objective: 1415
best_bound: 1415
integers: 341
booleans: 86
conflicts: 1
branches: 168
propagations: 58
integer_propagations: 7077
restarts: 164
lp_iterations: 0
walltime: 58.1869
usertime: 58.1869
deterministic_time: 240.547
gap_integral: 561.002
solution_fingerprint: 0xb1007e12758b053


--- Simulation Gantt  partir du modle mathmatique ---
