created virtual environment CPython3.12.4.final.0-64 in 8129ms
  creator CPython3Posix(dest=/localscratch/aneumann.63393176.0/env, clear=False, no_vcs_ignore=False, global=False)
  seeder FromAppData(download=False, pip=bundle, via=copy, app_data_dir=/home/aneumann/.local/share/virtualenv)
    added seed packages: pip==25.1.1
  activators BashActivator,CShellActivator,FishActivator,NushellActivator,PowerShellActivator,PythonActivator
Looking in links: /cvmfs/soft.computecanada.ca/custom/python/wheelhouse/gentoo2023/x86-64-v3, /cvmfs/soft.computecanada.ca/custom/python/wheelhouse/gentoo2023/generic, /cvmfs/soft.computecanada.ca/custom/python/wheelhouse/generic
Requirement already satisfied: pip in /localscratch/aneumann.63393176.0/env/lib/python3.12/site-packages (25.1.1)
Looking in links: /cvmfs/soft.computecanada.ca/custom/python/wheelhouse/gentoo2023/x86-64-v3, /cvmfs/soft.computecanada.ca/custom/python/wheelhouse/gentoo2023/generic, /cvmfs/soft.computecanada.ca/custom/python/wheelhouse/generic
ERROR: protobuf-5.28.3-cp38-abi3-manylinux2014_x86_64.whl is not a supported wheel on this platform.
Looking in links: /cvmfs/soft.computecanada.ca/custom/python/wheelhouse/gentoo2023/x86-64-v3, /cvmfs/soft.computecanada.ca/custom/python/wheelhouse/gentoo2023/generic, /cvmfs/soft.computecanada.ca/custom/python/wheelhouse/generic
Processing /home/aneumann/projects/def-adhaj/aneumann/GNRS/wheels/immutabledict-4.2.0-py3-none-any.whl
Installing collected packages: immutabledict
Successfully installed immutabledict-4.2.0
Looking in links: /cvmfs/soft.computecanada.ca/custom/python/wheelhouse/gentoo2023/x86-64-v3, /cvmfs/soft.computecanada.ca/custom/python/wheelhouse/gentoo2023/generic, /cvmfs/soft.computecanada.ca/custom/python/wheelhouse/generic
Processing /cvmfs/soft.computecanada.ca/custom/python/wheelhouse/generic/ortools-9.10.4067+computecanada-cp312-cp312-linux_x86_64.whl (from -r /home/aneumann/projects/def-adhaj/aneumann/GNRS/requirements/or.txt (line 1))
Processing /cvmfs/soft.computecanada.ca/custom/python/wheelhouse/gentoo2023/x86-64-v3/matplotlib-3.10.0+computecanada-cp312-cp312-linux_x86_64.whl (from -r /home/aneumann/projects/def-adhaj/aneumann/GNRS/requirements/or.txt (line 2))
Processing /cvmfs/soft.computecanada.ca/custom/python/wheelhouse/gentoo2023/x86-64-v3/pandas-2.2.3+computecanada-cp312-cp312-linux_x86_64.whl (from -r /home/aneumann/projects/def-adhaj/aneumann/GNRS/requirements/or.txt (line 3))
Processing /cvmfs/soft.computecanada.ca/custom/python/wheelhouse/generic/absl_py-2.2.2+computecanada-py3-none-any.whl (from ortools<9.11,>=9.10->-r /home/aneumann/projects/def-adhaj/aneumann/GNRS/requirements/or.txt (line 1))
Processing /cvmfs/soft.computecanada.ca/custom/python/wheelhouse/gentoo2023/generic/numpy-2.2.2+computecanada-cp312-cp312-linux_x86_64.whl (from ortools<9.11,>=9.10->-r /home/aneumann/projects/def-adhaj/aneumann/GNRS/requirements/or.txt (line 1))
Processing /cvmfs/soft.computecanada.ca/custom/python/wheelhouse/gentoo2023/x86-64-v3/protobuf-6.30.2+computecanada-cp312-cp312-linux_x86_64.whl (from ortools<9.11,>=9.10->-r /home/aneumann/projects/def-adhaj/aneumann/GNRS/requirements/or.txt (line 1))
Requirement already satisfied: immutabledict>=3.0.0 in /localscratch/aneumann.63393176.0/env/lib/python3.12/site-packages (from ortools<9.11,>=9.10->-r /home/aneumann/projects/def-adhaj/aneumann/GNRS/requirements/or.txt (line 1)) (4.2.0)
Processing /cvmfs/soft.computecanada.ca/custom/python/wheelhouse/gentoo2023/generic/contourpy-1.3.1+computecanada-cp312-cp312-linux_x86_64.whl (from matplotlib->-r /home/aneumann/projects/def-adhaj/aneumann/GNRS/requirements/or.txt (line 2))
Processing /cvmfs/soft.computecanada.ca/custom/python/wheelhouse/generic/cycler-0.12.1+computecanada-py3-none-any.whl (from matplotlib->-r /home/aneumann/projects/def-adhaj/aneumann/GNRS/requirements/or.txt (line 2))
Processing /cvmfs/soft.computecanada.ca/custom/python/wheelhouse/generic/fonttools-4.58.2+computecanada-cp312-cp312-linux_x86_64.whl (from matplotlib->-r /home/aneumann/projects/def-adhaj/aneumann/GNRS/requirements/or.txt (line 2))
Processing /cvmfs/soft.computecanada.ca/custom/python/wheelhouse/gentoo2023/x86-64-v3/kiwisolver-1.4.8+computecanada-cp312-cp312-linux_x86_64.whl (from matplotlib->-r /home/aneumann/projects/def-adhaj/aneumann/GNRS/requirements/or.txt (line 2))
Processing /cvmfs/soft.computecanada.ca/custom/python/wheelhouse/generic/packaging-25.0+computecanada-py3-none-any.whl (from matplotlib->-r /home/aneumann/projects/def-adhaj/aneumann/GNRS/requirements/or.txt (line 2))
Processing /cvmfs/soft.computecanada.ca/custom/python/wheelhouse/gentoo2023/x86-64-v3/pillow-11.1.0+computecanada-cp312-cp312-linux_x86_64.whl (from matplotlib->-r /home/aneumann/projects/def-adhaj/aneumann/GNRS/requirements/or.txt (line 2))
Processing /cvmfs/soft.computecanada.ca/custom/python/wheelhouse/generic/pyparsing-3.2.1+computecanada-py3-none-any.whl (from matplotlib->-r /home/aneumann/projects/def-adhaj/aneumann/GNRS/requirements/or.txt (line 2))
Processing /cvmfs/soft.computecanada.ca/custom/python/wheelhouse/generic/python_dateutil-2.9.0.post0+computecanada-py2.py3-none-any.whl (from matplotlib->-r /home/aneumann/projects/def-adhaj/aneumann/GNRS/requirements/or.txt (line 2))
Processing /cvmfs/soft.computecanada.ca/custom/python/wheelhouse/generic/pytz-2025.2+computecanada-py2.py3-none-any.whl (from pandas->-r /home/aneumann/projects/def-adhaj/aneumann/GNRS/requirements/or.txt (line 3))
Processing /cvmfs/soft.computecanada.ca/custom/python/wheelhouse/generic/tzdata-2025.2+computecanada-py2.py3-none-any.whl (from pandas->-r /home/aneumann/projects/def-adhaj/aneumann/GNRS/requirements/or.txt (line 3))
Processing /cvmfs/soft.computecanada.ca/custom/python/wheelhouse/generic/six-1.17.0+computecanada-py2.py3-none-any.whl (from python-dateutil>=2.7->matplotlib->-r /home/aneumann/projects/def-adhaj/aneumann/GNRS/requirements/or.txt (line 2))
Installing collected packages: pytz, tzdata, six, pyparsing, protobuf, pillow, packaging, numpy, kiwisolver, fonttools, cycler, absl-py, python-dateutil, contourpy, pandas, matplotlib, ortools

Successfully installed absl-py-2.2.2+computecanada contourpy-1.3.1+computecanada cycler-0.12.1+computecanada fonttools-4.58.2+computecanada kiwisolver-1.4.8+computecanada matplotlib-3.10.0+computecanada numpy-2.2.2+computecanada ortools-9.10.4067+computecanada packaging-25.0+computecanada pandas-2.2.3+computecanada pillow-11.1.0+computecanada protobuf-6.30.2+computecanada pyparsing-3.2.1+computecanada python-dateutil-2.9.0.post0+computecanada pytz-2025.2+computecanada six-1.17.0+computecanada tzdata-2025.2+computecanada

Starting CP-SAT solver v9.10.4067
Parameters: max_time_in_seconds: 3600 max_memory_in_mb: 12000 log_search_progress: true enumerate_all_solutions: false absolute_gap_limit: 0 relative_gap_limit: 0
Setting number of workers to 48

Initial optimization model '': (model_fingerprint: 0x867b4ddc812c1fb8)
#Variables: 189 (#ints: 6 in objective)
  - 126 Booleans in [0,1]
  - 63 in [0,354]
#kLinear1: 29
#kLinear2: 253
#kLinear3: 81
#kLinearN: 875 (#terms: 9'138)

Starting presolve at 0.00s
  5.12e-04s  0.00e+00d  [DetectDominanceRelations] 
  1.23e-02s  0.00e+00d  [PresolveToFixPoint] #num_loops=6 #num_dual_strengthening=3 
  1.80e-05s  0.00e+00d  [ExtractEncodingFromLinear] #potential_supersets=3 
[Symmetry] Graph for symmetry has 1'217 nodes and 6'355 arcs.
[Symmetry] Symmetry computation done. time: 0.000770875 dtime: 0.00067243
[Symmetry] #generators: 1, average support size: 16
[Symmetry] The model contains 145 duplicate constraints !
[Symmetry] 8 orbits with sizes: 2,2,2,2,2,2,2,2
[Symmetry] Num fixable by intersecting at_most_one with orbits: 1 largest_orbit: 2
  2.78e-03s  3.20e-04d  [Probe] #probed=168 #fixed_bools=3 #new_bounds=21 #equiv=1 
  4.11e-05s  0.00e+00d  [MaxClique] Merged 23(46 literals) into 10(20 literals) at_most_ones. 
  3.61e-04s  0.00e+00d  [DetectDominanceRelations] 
  6.14e-03s  0.00e+00d  [PresolveToFixPoint] #num_loops=4 #num_dual_strengthening=3 
  1.33e-03s  0.00e+00d  [ProcessAtMostOneAndLinear] 
  8.90e-04s  0.00e+00d  [DetectDuplicateConstraints] #duplicates=173 #without_enforcements=66 
  4.31e-04s  1.49e-05d  [DetectDominatedLinearConstraints] #relevant_constraints=519 #num_inclusions=278 
  1.48e-04s  0.00e+00d  [DetectDifferentVariables] #different=23 
  1.27e-04s  4.63e-06d  [ProcessSetPPC] #relevant_constraints=298 
  1.14e-05s  0.00e+00d  [FindAlmostIdenticalLinearConstraints] 
  5.06e-05s  3.21e-05d  [FindBigAtMostOneAndLinearOverlap] 
  1.03e-03s  3.36e-04d  [FindBigVerticalLinearOverlap] #blocks=8 #saved_nz=398 
  6.14e-05s  1.26e-05d  [FindBigHorizontalLinearOverlap] #linears=277 
  5.84e-06s  0.00e+00d  [MergeClauses] 
  3.57e-04s  0.00e+00d  [DetectDominanceRelations] 
  4.97e-03s  0.00e+00d  [PresolveToFixPoint] #num_loops=2 #num_dual_strengthening=1 
  3.54e-04s  0.00e+00d  [DetectDominanceRelations] 
  3.11e-03s  0.00e+00d  [PresolveToFixPoint] #num_loops=1 #num_dual_strengthening=1 
[Symmetry] Graph for symmetry has 1'013 nodes and 5'153 arcs.
[Symmetry] Symmetry computation done. time: 0.000251702 dtime: 0.00032584
  2.45e-03s  3.05e-04d  [Probe] #probed=162 #new_bounds=9 
  6.21e-06s  0.00e+00d  [MaxClique] 
  3.60e-04s  0.00e+00d  [DetectDominanceRelations] 
  4.88e-03s  0.00e+00d  [PresolveToFixPoint] #num_loops=4 #num_dual_strengthening=3 
  1.11e-03s  0.00e+00d  [ProcessAtMostOneAndLinear] 
  7.02e-04s  0.00e+00d  [DetectDuplicateConstraints] #without_enforcements=66 
  2.55e-04s  1.03e-05d  [DetectDominatedLinearConstraints] #relevant_constraints=418 #num_inclusions=77 
  1.45e-04s  0.00e+00d  [DetectDifferentVariables] #different=27 
  1.17e-04s  3.88e-06d  [ProcessSetPPC] #relevant_constraints=277 
  1.41e-05s  0.00e+00d  [FindAlmostIdenticalLinearConstraints] 
  4.71e-05s  2.88e-05d  [FindBigAtMostOneAndLinearOverlap] 
  7.00e-04s  2.85e-04d  [FindBigVerticalLinearOverlap] #blocks=3 #saved_nz=148 
  5.94e-05s  1.16e-05d  [FindBigHorizontalLinearOverlap] #linears=267 
  5.74e-06s  0.00e+00d  [MergeClauses] 
  3.67e-04s  0.00e+00d  [DetectDominanceRelations] 
  3.44e-03s  0.00e+00d  [PresolveToFixPoint] #num_loops=2 #num_dual_strengthening=1 
  3.64e-04s  0.00e+00d  [DetectDominanceRelations] 
  3.12e-03s  0.00e+00d  [PresolveToFixPoint] #num_loops=1 #num_dual_strengthening=1 
[Symmetry] Graph for symmetry has 1'018 nodes and 5'004 arcs.
[Symmetry] Symmetry computation done. time: 0.00024879 dtime: 0.00032048
  2.44e-03s  3.00e-04d  [Probe] #probed=162 #new_bounds=2 
  6.24e-06s  0.00e+00d  [MaxClique] 
  3.68e-04s  0.00e+00d  [DetectDominanceRelations] 
  3.31e-03s  0.00e+00d  [PresolveToFixPoint] #num_loops=2 #num_dual_strengthening=1 
  1.04e-03s  0.00e+00d  [ProcessAtMostOneAndLinear] 
  7.04e-04s  0.00e+00d  [DetectDuplicateConstraints] #without_enforcements=66 
  2.17e-04s  8.56e-06d  [DetectDominatedLinearConstraints] #relevant_constraints=383 #num_inclusions=19 
  1.46e-04s  0.00e+00d  [DetectDifferentVariables] #different=29 
  1.12e-04s  3.57e-06d  [ProcessSetPPC] #relevant_constraints=263 
  1.49e-05s  0.00e+00d  [FindAlmostIdenticalLinearConstraints] 
  5.23e-05s  2.77e-05d  [FindBigAtMostOneAndLinearOverlap] 
  6.86e-04s  2.72e-04d  [FindBigVerticalLinearOverlap] #blocks=3 #saved_nz=123 
  5.67e-05s  1.07e-05d  [FindBigHorizontalLinearOverlap] #linears=255 
  5.58e-06s  0.00e+00d  [MergeClauses] 
  3.68e-04s  0.00e+00d  [DetectDominanceRelations] 
  4.03e-03s  0.00e+00d  [PresolveToFixPoint] #num_loops=2 #num_dual_strengthening=1 
  3.34e-05s  0.00e+00d  [ExpandObjective] #entries=68 #tight_variables=27 #tight_constraints=14 

Presolve summary:
  - 33 affine relations were detected.
  - rule 'TODO dual: only one blocking constraint?' was applied 491 times.
  - rule 'TODO dual: only one unspecified blocking constraint?' was applied 90 times.
  - rule 'TODO duplicate: identical constraint with different enforcements' was applied 198 times.
  - rule 'affine: new relation' was applied 33 times.
  - rule 'at_most_one: removed literals' was applied 10 times.
  - rule 'at_most_one: size one' was applied 10 times.
  - rule 'at_most_one: transformed into max clique.' was applied 1 time.
  - rule 'deductions: 115 stored' was applied 1 time.
  - rule 'dual: fix variable' was applied 15 times.
  - rule 'dual: reduced domain' was applied 43 times.
  - rule 'duplicate: merged rhs of linear constraint' was applied 28 times.
  - rule 'duplicate: removed constraint' was applied 173 times.
  - rule 'enforcement: false literal' was applied 16 times.
  - rule 'enforcement: true literal' was applied 13 times.
  - rule 'exactly_one: x and not(x)' was applied 1 time.
  - rule 'incompatible linear: add implication' was applied 18 times.
  - rule 'linear matrix: common vertical rectangle' was applied 14 times.
  - rule 'linear: always true' was applied 314 times.
  - rule 'linear: doubleton free' was applied 8 times.
  - rule 'linear: empty' was applied 20 times.
  - rule 'linear: extracted enforcement literal' was applied 1'975 times.
  - rule 'linear: fixed or dup variables' was applied 884 times.
  - rule 'linear: positive equal one' was applied 3 times.
  - rule 'linear: reduced variable domains' was applied 84 times.
  - rule 'linear: remapped using affine relations' was applied 844 times.
  - rule 'linear: simplified rhs' was applied 2'832 times.
  - rule 'linear: variable substitution 1' was applied 8 times.
  - rule 'presolve: 61 unused variables removed.' was applied 1 time.
  - rule 'presolve: iteration' was applied 3 times.
  - rule 'probing: reduced enforced constraint to implication.' was applied 23 times.
  - rule 'probing: simplified enforcement list.' was applied 2 times.
  - rule 'symmetry: fixed to false in general orbit' was applied 1 time.

Presolved optimization model '': (model_fingerprint: 0xdaf95e99197daa2b)
#Variables: 101 (#ints: 6 in objective)
  - 40 Booleans in [0,1]
  - 1 in [-1329,-1094][-1059,-740][-705,-386][-351,-32][3,322][357,676][711,1030][1065,1384][1419,1674]
  - 1 in [-975,-740][-705,-386][-351,-32][3,322][357,612]
  - 1 in [-705,-418][-351,-64][3,290][357,644][711,998][1065,1352][1419,1700]
  - 1 in [-288,-32][3,322][357,676][711,1010]
  - 1 in [-2,333]
  - 1 in [0,231]
  - 1 in [0,251]
  - 4 in [0,256]
  - 2 in [0,266]
  - 3 in [0,268]
  - 3 in [0,287]
  - 1 in [0,293]
  - 1 in [0,319]
  - 3 in [0,335]
  - 1 in [1,288]
  - 1 in [3,271]
  - 1 in [3,271][357,619]
  - 1 in [3,290]
  - 1 in [3,290][357,638]
  - 1 in [3,296]
  - 1 in [3,296][357,650]
  - 1 in [3,322]
  - 1 in [3,322][357,676]
  - 1 in [3,338]
  - 1 in [18,286]
  - 1 in [20,290][357,644][711,992]
  - 1 in [23,291]
  - 1 in [33,320]
  - 1 in [37,330]
  - 1 in [38,325]
  - 1 in [42,335]
  - 3 in [56,343]
  - 1 in [62,349]
  - 1 in [66,322][357,676][711,1010]
  - 4 in [77,343]
  - 2 in [83,349]
  - 3 in [92,343]
  - 1 in [98,349]
  - 3 in [105,343]
  - 1 in [111,349]
  - 1 in [116,354]
#kExactlyOne: 2 (#literals: 6)
#kLinear2: 319 (#enforced: 278 #multi: 230)
#kLinear3: 58 (#enforced: 42)
#kLinearN: 286 (#enforced: 252) (#terms: 2'266)

Preloading model.
#Bound   0.07s best:inf   next:[117,1656] initial_domain
[Symmetry] Graph for symmetry has 924 nodes and 4'883 arcs.
[Symmetry] Symmetry computation done. time: 0.000240328 dtime: 0.00030746
#Model   0.07s var:101/101 constraints:665/665

Starting search at 0.07s with 48 workers.
16 full problem subsolvers: [core, default_lp, lb_tree_search, max_lp, no_lp, objective_lb_search, objective_lb_search_max_lp, objective_lb_search_no_lp, objective_shaving_search_max_lp, objective_shaving_search_no_lp, probing, probing_max_lp, pseudo_costs, quick_restart, quick_restart_no_lp, reduced_costs]
30 first solution subsolvers: [fj_long_default(2), fj_long_lin_default, fj_long_lin_perturb, fj_long_lin_random, fj_long_perturb, fj_long_random, fj_short_default(2), fj_short_lin_default(2), fj_short_lin_perturb, fj_short_lin_random, fj_short_perturb, fj_short_random, fs_random(4), fs_random_no_lp(4), fs_random_quick_restart(4), fs_random_quick_restart_no_lp(3)]
13 incomplete subsolvers: [feasibility_pump, graph_arc_lns, graph_cst_lns, graph_dec_lns, graph_var_lns, rins/rens, rnd_cst_lns, rnd_var_lns, violation_ls(5)]
3 helper subsolvers: [neighborhood_helper, synchronization_agent, update_gap_integral]
#Bound   0.08s best:inf   next:[118,1656] bool_core (num_cores=1 [size:1 mw:1] a=6 d=0 fixed=0/46 clauses=3)
#1       0.08s best:677   next:[118,676]  no_lp (fixed_bools=0/61)
#Bound   0.08s best:677   next:[143,676]  objective_lb_search_no_lp
#2       0.08s best:675   next:[143,674]  no_lp (fixed_bools=0/70)
#3       0.08s best:665   next:[143,664]  no_lp (fixed_bools=0/73)
#4       0.08s best:567   next:[143,566]  quick_restart_no_lp (fixed_bools=0/72)
#5       0.09s best:566   next:[143,565]  violation_ls(batch:1 #solutions_imported:1 #lin_moves:0 #lin_evals:94 #gen_moves:60 #gen_evals:0 #comp_moves:6 #backtracks:27 #weight_updates:0)
#6       0.09s best:565   next:[143,564]  violation_ls(batch:1 #solutions_imported:1 #lin_moves:1 #lin_evals:6 #weight_updates:0)
#7       0.09s best:562   next:[143,561]  quick_restart_no_lp (fixed_bools=0/95)
#8       0.09s best:560   next:[143,559]  violation_ls(batch:1 #solutions_imported:1 #lin_moves:0 #lin_evals:23 #gen_moves:17 #gen_evals:0 #comp_moves:1 #backtracks:8 #weight_updates:0)
#9       0.09s best:558   next:[143,557]  violation_ls(batch:1 #solutions_imported:1 #lin_moves:0 #lin_evals:12 #gen_moves:7 #gen_evals:0 #comp_moves:1 #backtracks:3 #weight_updates:0)
#10      0.09s best:556   next:[143,555]  rnd_var_lns (d=0.50 s=37 t=0.10 p=0.00 stall=0 h=auto_l0) [presolve]
#11      0.09s best:553   next:[143,552]  quick_restart_no_lp (fixed_bools=0/104)
#12      0.09s best:547   next:[143,546]  quick_restart_no_lp (fixed_bools=0/106)
#13      0.09s best:546   next:[143,545]  violation_ls(batch:2 #solutions_imported:2 #lin_moves:1 #lin_evals:100 #gen_moves:60 #gen_evals:0 #comp_moves:6 #backtracks:27 #weight_updates:0)
#14      0.09s best:545   next:[143,544]  violation_ls(batch:2 #solutions_imported:2 #lin_moves:1 #lin_evals:22 #gen_moves:13 #gen_evals:0 #comp_moves:1 #backtracks:6 #weight_updates:0)
#15      0.09s best:544   next:[143,543]  violation_ls(batch:2 #solutions_imported:2 #lin_moves:1 #lin_evals:29 #gen_moves:17 #gen_evals:0 #comp_moves:1 #backtracks:8 #weight_updates:0)
#16      0.09s best:543   next:[143,542]  violation_ls(batch:2 #solutions_imported:2 #lin_moves:0 #lin_evals:40 #gen_moves:22 #gen_evals:0 #comp_moves:2 #backtracks:10 #weight_updates:0)
#17      0.09s best:536   next:[143,535]  no_lp (fixed_bools=0/92)
#Bound   0.09s best:536   next:[144,535]  bool_core (num_cores=4 [cover] a=4 d=2 fixed=24/162 clauses=536)
#Bound   0.09s best:536   next:[145,535]  bool_core (num_cores=4 [cover] a=4 d=2 fixed=25/167 clauses=583)
#Bound   0.09s best:536   next:[146,535]  bool_core (num_cores=4 [cover] a=4 d=2 fixed=26/172 clauses=632)
#Bound   0.09s best:536   next:[147,535]  bool_core (num_cores=4 [cover] a=4 d=2 fixed=27/177 clauses=683)
#Bound   0.09s best:536   next:[148,535]  bool_core (num_cores=4 [cover] a=4 d=2 fixed=28/182 clauses=736)
#Bound   0.09s best:536   next:[149,535]  bool_core (num_cores=4 [cover] a=4 d=2 fixed=29/187 clauses=791)
#Bound   0.09s best:536   next:[150,535]  bool_core (num_cores=4 [cover] a=4 d=2 fixed=30/192 clauses=848)
#18      0.09s best:531   next:[150,530]  quick_restart_no_lp (fixed_bools=0/116)
#Bound   0.09s best:531   next:[151,530]  bool_core (num_cores=4 [cover] a=4 d=2 fixed=31/197 clauses=907)
#Bound   0.09s best:531   next:[152,530]  bool_core (num_cores=4 [cover] a=4 d=2 fixed=32/202 clauses=968)
#Bound   0.09s best:531   next:[153,530]  bool_core (num_cores=4 [cover] a=4 d=2 fixed=33/207 clauses=1'031)
#19      0.09s best:530   next:[153,529]  violation_ls(batch:3 #solutions_imported:3 #lin_moves:38 #lin_evals:178 #gen_moves:13 #gen_evals:0 #comp_moves:1 #backtracks:6 #weight_updates:20)
#Bound   0.09s best:530   next:[154,529]  bool_core (num_cores=4 [cover] a=4 d=2 fixed=34/212 clauses=1'096)
#20      0.09s best:529   next:[154,528]  violation_ls(batch:3 #solutions_imported:3 #lin_moves:5 #lin_evals:50 #gen_moves:17 #gen_evals:0 #comp_moves:1 #backtracks:8 #weight_updates:3)
#Bound   0.09s best:529   next:[155,528]  bool_core (num_cores=4 [cover] a=4 d=2 fixed=35/217 clauses=1'163)
#Bound   0.10s best:529   next:[156,528]  bool_core (num_cores=4 [cover] a=4 d=2 fixed=36/222 clauses=1'232)
#Bound   0.10s best:529   next:[157,528]  bool_core (num_cores=4 [cover] a=4 d=2 fixed=37/227 clauses=1'303)
#21      0.10s best:528   next:[157,527]  violation_ls(batch:3 #solutions_imported:3 #lin_moves:0 #lin_evals:101 #gen_moves:65 #gen_evals:0 #comp_moves:3 #backtracks:31 #weight_updates:0)
#Bound   0.10s best:528   next:[158,527]  bool_core (num_cores=4 [cover] a=4 d=2 fixed=38/232 clauses=1'376)
#Bound   0.10s best:528   next:[159,527]  bool_core (num_cores=4 [cover] a=4 d=2 fixed=39/237 clauses=1'451)
#Bound   0.10s best:528   next:[160,527]  bool_core (num_cores=4 [cover] a=4 d=2 fixed=40/242 clauses=1'528)
#Bound   0.10s best:528   next:[161,527]  bool_core (num_cores=4 [cover] a=4 d=2 fixed=41/247 clauses=1'607)
#22      0.10s best:503   next:[171,502]  rins_pump_lns (d=0.50 s=67 t=0.10 p=0.00 stall=0 h=auto_l0)
#23      0.10s best:491   next:[174,490]  rins_pump_lns (d=0.50 s=70 t=0.10 p=0.00 stall=0 h=auto_l0)
#24      0.11s best:486   next:[177,485]  no_lp (fixed_bools=1/103)
#25      0.11s best:474   next:[178,473]  no_lp (fixed_bools=1/105)
#26      0.11s best:473   next:[214,472]  quick_restart_no_lp (fixed_bools=0/143)
#27      0.12s best:472   next:[214,471]  violation_ls(batch:4 #solutions_imported:4 #lin_moves:3 #lin_evals:4'085 #gen_moves:2'205 #gen_evals:0 #comp_moves:85 #backtracks:1'060 #weight_updates:20)
#28      0.12s best:471   next:[214,470]  violation_ls(batch:4 #solutions_imported:4 #lin_moves:5 #lin_evals:53 #gen_moves:18 #gen_evals:0 #comp_moves:2 #backtracks:8 #weight_updates:3)
#29      0.12s best:470   next:[214,469]  violation_ls(batch:4 #solutions_imported:4 #lin_moves:0 #lin_evals:103 #gen_moves:66 #gen_evals:0 #comp_moves:4 #backtracks:31 #weight_updates:0)
#30      0.12s best:469   next:[214,468]  violation_ls(batch:5 #solutions_imported:5 #lin_moves:3 #lin_evals:4'086 #gen_moves:2'206 #gen_evals:0 #comp_moves:86 #backtracks:1'060 #weight_updates:20)
#31      0.12s best:468   next:[214,467]  violation_ls(batch:5 #solutions_imported:5 #lin_moves:20 #lin_evals:197 #gen_moves:66 #gen_evals:0 #comp_moves:4 #backtracks:31 #weight_updates:18)
#32      0.12s best:465   next:[214,464]  rnd_var_lns (d=0.88 s=82 t=0.10 p=1.00 stall=1 h=auto_l0)
#33      0.13s best:464   next:[214,463]  no_lp (fixed_bools=1/110)
#34      0.14s best:435   next:[214,434]  no_lp (fixed_bools=1/114)
#35      0.15s best:434   next:[245,433]  violation_ls(batch:6 #solutions_imported:6 #lin_moves:229 #lin_evals:963 #gen_moves:66 #gen_evals:0 #comp_moves:4 #backtracks:31 #weight_updates:113)
#36      0.16s best:433   next:[245,432]  violation_ls(batch:5 #solutions_imported:5 #lin_moves:5'155 #lin_evals:38'550 #gen_moves:72 #gen_evals:0 #comp_moves:10 #backtracks:31 #weight_updates:4'853)
#37      0.16s best:432   next:[245,431]  violation_ls(batch:6 #solutions_imported:6 #lin_moves:5'155 #lin_evals:38'571 #gen_moves:87 #gen_evals:0 #comp_moves:13 #backtracks:37 #weight_updates:4'853)
#38      0.16s best:417   next:[245,416]  no_lp (fixed_bools=1/130)
#39      0.16s best:414   next:[245,413]  no_lp (fixed_bools=1/131)
#40      0.18s best:406   next:[327,405]  no_lp (fixed_bools=2/179)
#Model   0.46s var:100/101 constraints:511/665
#Model   0.49s var:99/101 constraints:491/665
#Model   0.70s var:96/101 constraints:422/665
#Model   0.72s var:95/101 constraints:396/665
#Model   0.73s var:90/101 constraints:310/665
#Model   0.77s var:89/101 constraints:291/665
#Model   0.78s var:84/101 constraints:248/665
#Model   0.81s var:83/101 constraints:235/665
#Model   0.82s var:74/101 constraints:136/665
#Done    0.83s objective_lb_search_no_lp
#Model   0.83s var:71/101 constraints:95/665 compo:67,4
#Done    0.83s max_lp
#Model   0.83s var:69/101 constraints:86/665 compo:65,4
#Bound   0.83s best:406   next:[404,405]  objective_lb_search_no_lp [skipped_logs=51]

Task timing                                  n [     min,      max]      avg      dev     time         n [     min,      max]      avg      dev    dtime
                             'core':         1 [758.66ms, 758.66ms] 758.66ms   0.00ns 758.66ms         1 [883.67ms, 883.67ms] 883.67ms   0.00ns 883.67ms
                       'default_lp':         1 [758.61ms, 758.61ms] 758.61ms   0.00ns 758.61ms         1 [ 78.06ms,  78.06ms]  78.06ms   0.00ns  78.06ms
                 'feasibility_pump':        20 [  4.36ms,  59.76ms]  13.73ms  13.17ms 274.65ms        19 [868.22us,   3.16ms]   1.56ms 906.65us  29.70ms
                  'fj_long_default':         0 [  0.00ns,   0.00ns]   0.00ns   0.00ns   0.00ns         0 [  0.00ns,   0.00ns]   0.00ns   0.00ns   0.00ns
                  'fj_long_default':         0 [  0.00ns,   0.00ns]   0.00ns   0.00ns   0.00ns         0 [  0.00ns,   0.00ns]   0.00ns   0.00ns   0.00ns
              'fj_long_lin_default':         0 [  0.00ns,   0.00ns]   0.00ns   0.00ns   0.00ns         0 [  0.00ns,   0.00ns]   0.00ns   0.00ns   0.00ns
              'fj_long_lin_perturb':         0 [  0.00ns,   0.00ns]   0.00ns   0.00ns   0.00ns         0 [  0.00ns,   0.00ns]   0.00ns   0.00ns   0.00ns
               'fj_long_lin_random':         0 [  0.00ns,   0.00ns]   0.00ns   0.00ns   0.00ns         0 [  0.00ns,   0.00ns]   0.00ns   0.00ns   0.00ns
                  'fj_long_perturb':         0 [  0.00ns,   0.00ns]   0.00ns   0.00ns   0.00ns         0 [  0.00ns,   0.00ns]   0.00ns   0.00ns   0.00ns
                   'fj_long_random':         0 [  0.00ns,   0.00ns]   0.00ns   0.00ns   0.00ns         0 [  0.00ns,   0.00ns]   0.00ns   0.00ns   0.00ns
                 'fj_short_default':         0 [  0.00ns,   0.00ns]   0.00ns   0.00ns   0.00ns         0 [  0.00ns,   0.00ns]   0.00ns   0.00ns   0.00ns
                 'fj_short_default':         0 [  0.00ns,   0.00ns]   0.00ns   0.00ns   0.00ns         0 [  0.00ns,   0.00ns]   0.00ns   0.00ns   0.00ns
             'fj_short_lin_default':         0 [  0.00ns,   0.00ns]   0.00ns   0.00ns   0.00ns         0 [  0.00ns,   0.00ns]   0.00ns   0.00ns   0.00ns
             'fj_short_lin_default':         0 [  0.00ns,   0.00ns]   0.00ns   0.00ns   0.00ns         0 [  0.00ns,   0.00ns]   0.00ns   0.00ns   0.00ns
             'fj_short_lin_perturb':         0 [  0.00ns,   0.00ns]   0.00ns   0.00ns   0.00ns         0 [  0.00ns,   0.00ns]   0.00ns   0.00ns   0.00ns
              'fj_short_lin_random':         0 [  0.00ns,   0.00ns]   0.00ns   0.00ns   0.00ns         0 [  0.00ns,   0.00ns]   0.00ns   0.00ns   0.00ns
                 'fj_short_perturb':         0 [  0.00ns,   0.00ns]   0.00ns   0.00ns   0.00ns         0 [  0.00ns,   0.00ns]   0.00ns   0.00ns   0.00ns
                  'fj_short_random':         0 [  0.00ns,   0.00ns]   0.00ns   0.00ns   0.00ns         0 [  0.00ns,   0.00ns]   0.00ns   0.00ns   0.00ns
                        'fs_random':         1 [  5.72ms,   5.72ms]   5.72ms   0.00ns   5.72ms         1 [ 20.00ns,  20.00ns]  20.00ns   0.00ns  20.00ns
                        'fs_random':         1 [  5.73ms,   5.73ms]   5.73ms   0.00ns   5.73ms         0 [  0.00ns,   0.00ns]   0.00ns   0.00ns   0.00ns
                        'fs_random':         1 [  6.24ms,   6.24ms]   6.24ms   0.00ns   6.24ms         0 [  0.00ns,   0.00ns]   0.00ns   0.00ns   0.00ns
                        'fs_random':         1 [  7.03ms,   7.03ms]   7.03ms   0.00ns   7.03ms         0 [  0.00ns,   0.00ns]   0.00ns   0.00ns   0.00ns
                  'fs_random_no_lp':         1 [  5.03ms,   5.03ms]   5.03ms   0.00ns   5.03ms         0 [  0.00ns,   0.00ns]   0.00ns   0.00ns   0.00ns
                  'fs_random_no_lp':         1 [  5.43ms,   5.43ms]   5.43ms   0.00ns   5.43ms         0 [  0.00ns,   0.00ns]   0.00ns   0.00ns   0.00ns
                  'fs_random_no_lp':         1 [  5.86ms,   5.86ms]   5.86ms   0.00ns   5.86ms         0 [  0.00ns,   0.00ns]   0.00ns   0.00ns   0.00ns
                  'fs_random_no_lp':         1 [  6.02ms,   6.02ms]   6.02ms   0.00ns   6.02ms         0 [  0.00ns,   0.00ns]   0.00ns   0.00ns   0.00ns
          'fs_random_quick_restart':         1 [  5.56ms,   5.56ms]   5.56ms   0.00ns   5.56ms         1 [ 20.00ns,  20.00ns]  20.00ns   0.00ns  20.00ns
          'fs_random_quick_restart':         1 [  5.88ms,   5.88ms]   5.88ms   0.00ns   5.88ms         0 [  0.00ns,   0.00ns]   0.00ns   0.00ns   0.00ns
          'fs_random_quick_restart':         1 [  6.36ms,   6.36ms]   6.36ms   0.00ns   6.36ms         0 [  0.00ns,   0.00ns]   0.00ns   0.00ns   0.00ns
          'fs_random_quick_restart':         1 [  6.48ms,   6.48ms]   6.48ms   0.00ns   6.48ms         1 [ 20.00ns,  20.00ns]  20.00ns   0.00ns  20.00ns
    'fs_random_quick_restart_no_lp':         1 [  5.21ms,   5.21ms]   5.21ms   0.00ns   5.21ms         0 [  0.00ns,   0.00ns]   0.00ns   0.00ns   0.00ns
    'fs_random_quick_restart_no_lp':         1 [  5.28ms,   5.28ms]   5.28ms   0.00ns   5.28ms         0 [  0.00ns,   0.00ns]   0.00ns   0.00ns   0.00ns
    'fs_random_quick_restart_no_lp':         1 [  5.83ms,   5.83ms]   5.83ms   0.00ns   5.83ms         0 [  0.00ns,   0.00ns]   0.00ns   0.00ns   0.00ns
                    'graph_arc_lns':        19 [  1.84ms, 501.24ms] 134.35ms 162.65ms    2.55s        14 [ 10.00ns,  96.63ms]  14.47ms  25.40ms 202.55ms
                    'graph_cst_lns':        19 [574.31us,   2.18ms] 871.93us 375.36us  16.57ms         1 [ 10.00ns,  10.00ns]  10.00ns   0.00ns  10.00ns
                    'graph_dec_lns':        19 [  1.85ms, 604.41ms] 126.84ms 152.22ms    2.41s        13 [ 10.00ns, 168.05ms]  15.98ms  44.25ms 207.72ms
                    'graph_var_lns':        19 [  1.61ms, 555.47ms] 129.23ms 149.05ms    2.46s        16 [ 10.00ns,  82.97ms]   9.35ms  19.98ms 149.56ms
                   'lb_tree_search':         1 [756.73ms, 756.73ms] 756.73ms   0.00ns 756.73ms         1 [186.47ms, 186.47ms] 186.47ms   0.00ns 186.47ms
                           'max_lp':         1 [758.62ms, 758.62ms] 758.62ms   0.00ns 758.62ms         1 [151.69ms, 151.69ms] 151.69ms   0.00ns 151.69ms
                            'no_lp':         1 [758.18ms, 758.18ms] 758.18ms   0.00ns 758.18ms         1 [ 75.84ms,  75.84ms]  75.84ms   0.00ns  75.84ms
              'objective_lb_search':         1 [756.71ms, 756.71ms] 756.71ms   0.00ns 756.71ms         1 [ 91.96ms,  91.96ms]  91.96ms   0.00ns  91.96ms
       'objective_lb_search_max_lp':         1 [756.19ms, 756.19ms] 756.19ms   0.00ns 756.19ms         1 [145.81ms, 145.81ms] 145.81ms   0.00ns 145.81ms
        'objective_lb_search_no_lp':         1 [755.45ms, 755.45ms] 755.45ms   0.00ns 755.45ms         1 [ 87.48ms,  87.48ms]  87.48ms   0.00ns  87.48ms
  'objective_shaving_search_max_lp':        20 [  1.02ms, 137.25ms]  34.56ms  34.25ms 691.11ms        15 [ 43.89us,   6.64ms] 737.32us   1.59ms  11.06ms
   'objective_shaving_search_no_lp':        20 [  1.20ms,  80.11ms]  31.07ms  23.14ms 621.39ms        12 [ 87.80us,   6.39ms]   1.21ms   1.65ms  14.51ms
                          'probing':         1 [758.86ms, 758.86ms] 758.86ms   0.00ns 758.86ms         1 [ 23.12ms,  23.12ms]  23.12ms   0.00ns  23.12ms
                   'probing_max_lp':         1 [760.84ms, 760.84ms] 760.84ms   0.00ns 760.84ms         1 [ 69.79ms,  69.79ms]  69.79ms   0.00ns  69.79ms
                     'pseudo_costs':         1 [758.03ms, 758.03ms] 758.03ms   0.00ns 758.03ms         1 [ 72.84ms,  72.84ms]  72.84ms   0.00ns  72.84ms
                    'quick_restart':         1 [757.91ms, 757.91ms] 757.91ms   0.00ns 757.91ms         1 [ 98.88ms,  98.88ms]  98.88ms   0.00ns  98.88ms
              'quick_restart_no_lp':         1 [757.85ms, 757.85ms] 757.85ms   0.00ns 757.85ms         1 [ 71.98ms,  71.98ms]  71.98ms   0.00ns  71.98ms
                    'reduced_costs':         1 [758.21ms, 758.21ms] 758.21ms   0.00ns 758.21ms         1 [ 54.27ms,  54.27ms]  54.27ms   0.00ns  54.27ms
                        'rins/rens':        20 [ 82.47us, 536.01ms] 175.05ms 155.36ms    3.50s        12 [168.80us, 119.00ms]  22.30ms  30.87ms 267.66ms
                      'rnd_cst_lns':        19 [650.70us, 425.45ms] 121.85ms 123.84ms    2.32s        15 [ 10.00ns,  56.75ms]   8.80ms  14.92ms 131.99ms
                      'rnd_var_lns':        19 [  1.50ms, 533.64ms] 148.78ms 163.02ms    2.83s        16 [ 10.00ns,  75.87ms]  13.94ms  21.38ms 223.09ms
                     'violation_ls':        12 [112.48us, 141.18ms]  52.60ms  53.29ms 631.24ms        12 [310.00ns,  42.87ms]  17.85ms  19.34ms 214.20ms
                     'violation_ls':        12 [133.96us, 151.60ms]  57.97ms  51.66ms 695.63ms        12 [250.00ns,  42.23ms]  20.46ms  18.17ms 245.55ms
                     'violation_ls':        12 [173.47us, 123.76ms]  58.40ms  52.99ms 700.77ms        12 [590.00ns,  44.11ms]  20.79ms  18.39ms 249.44ms
                     'violation_ls':        13 [ 97.66us, 119.71ms]  49.11ms  52.80ms 638.39ms        13 [620.00ns,  41.84ms]  18.28ms  19.60ms 237.64ms
                     'violation_ls':        18 [142.67us,  91.52ms]  35.01ms  29.61ms 630.13ms        18 [620.00ns,  67.39ms]  19.60ms  19.24ms 352.86ms

Search stats                        Bools  Conflicts  Branches  Restarts  BoolPropag  IntegerPropag
                           'core':    477        384    19'570     7'546   1'758'092        417'896
                     'default_lp':     40        920     2'156       395       9'941        203'632
                      'fs_random':     40          0         0         0           0              0
                      'fs_random':     40          0         0         0           0              0
                      'fs_random':     40          0         0         0           0              0
                      'fs_random':     40          0        26        26          12            119
                'fs_random_no_lp':     40          0         0         0           0              0
                'fs_random_no_lp':     40          0         0         0           0              0
                'fs_random_no_lp':     40          0         0         0           0              0
                'fs_random_no_lp':     40          0         0         0           0              0
        'fs_random_quick_restart':     40          0         0         0           0              0
        'fs_random_quick_restart':     40          0         0         0           0              0
        'fs_random_quick_restart':     40          0         0         0           0              0
        'fs_random_quick_restart':     40          0        62        62          12            517
  'fs_random_quick_restart_no_lp':     40          0         0         0           0              0
  'fs_random_quick_restart_no_lp':     40          0         0         0           0              0
  'fs_random_quick_restart_no_lp':     40          0         0         0           0              0
                 'lb_tree_search':     40         16     1'792       185       2'453         45'274
                         'max_lp':     40         53       152        81         705         10'847
                          'no_lp':    218      1'572     4'540       790      93'647        376'985
            'objective_lb_search':     50        446     2'540       849       8'581        161'120
     'objective_lb_search_max_lp':     46        196       889       386       2'898         51'688
      'objective_lb_search_no_lp':     82      2'122     4'461       771      26'843        478'216
                        'probing':     82         20       144       144         444          2'440
                 'probing_max_lp':     82         21       143       143         534          3'127
                   'pseudo_costs':     40        136       820       294       2'266         45'467
                  'quick_restart':     71        220     4'811     2'337       8'644        128'133
            'quick_restart_no_lp':    200      1'634     6'182       856      74'463        341'792
                  'reduced_costs':    132        169       932       330       5'469         40'002

SAT stats                           ClassicMinim  LitRemoved  LitLearned  LitForgotten  Subsumed  MClauses  MDecisions  MLitTrue  MSubsumed  MLitRemoved  MReused
                           'core':           182         430         907             0         6     3'672      18'247         0         91          320       54
                     'default_lp':           418         947       6'788             0        58       124         851         0         34          186       22
                      'fs_random':             0           0           0             0         0         0           0         0          0            0        0
                      'fs_random':             0           0           0             0         0         0           0         0          0            0        0
                      'fs_random':             0           0           0             0         0         0           0         0          0            0        0
                      'fs_random':             0           0           0             0         0         0           0         0          0            0        0
                'fs_random_no_lp':             0           0           0             0         0         0           0         0          0            0        0
                'fs_random_no_lp':             0           0           0             0         0         0           0         0          0            0        0
                'fs_random_no_lp':             0           0           0             0         0         0           0         0          0            0        0
                'fs_random_no_lp':             0           0           0             0         0         0           0         0          0            0        0
        'fs_random_quick_restart':             0           0           0             0         0         0           0         0          0            0        0
        'fs_random_quick_restart':             0           0           0             0         0         0           0         0          0            0        0
        'fs_random_quick_restart':             0           0           0             0         0         0           0         0          0            0        0
        'fs_random_quick_restart':             0           0           0             0         0         0           0         0          0            0        0
  'fs_random_quick_restart_no_lp':             0           0           0             0         0         0           0         0          0            0        0
  'fs_random_quick_restart_no_lp':             0           0           0             0         0         0           0         0          0            0        0
  'fs_random_quick_restart_no_lp':             0           0           0             0         0         0           0         0          0            0        0
                 'lb_tree_search':             2           3          70             0         0        19          95         0          3           13        0
                         'max_lp':            20          26         314             0         5         0           0         0          0            0        0
                          'no_lp':         1'014       2'829      10'917             0        62       171       1'131         0         62          356       27
            'objective_lb_search':           295         695       2'423             0        38       219       1'258         0         79          412       57
     'objective_lb_search_max_lp':           128         321         921             0        18        44         188         0         13           65        6
      'objective_lb_search_no_lp':         1'642       4'674      12'095             0       111       281       1'520         0        134          716       47
                        'probing':             0           0          20             0         0         0           0         0          0            0        0
                 'probing_max_lp':             0           0          21             0         0         0           0         0          0            0        0
                   'pseudo_costs':            66         136         839             0         7        59         396         0         14           75        8
                  'quick_restart':            99         187       1'461             0        20       328       1'836         0         26          120       39
            'quick_restart_no_lp':           999       2'317      12'084             0        59       157       1'183         0         45          253       35
                  'reduced_costs':            66         218         548             0        22        77         242         2         38          151        2

Lp stats                         Component  Iterations  AddedCuts  OPTIMAL  DUAL_F.  DUAL_U.
                  'default_lp':          1       3'878        874      954        0        0
                   'fs_random':          1           0          0        0        0        0
                   'fs_random':          1           0          0        0        0        0
                   'fs_random':          1           0          0        0        0        0
                   'fs_random':          1           0          0        0        0        0
     'fs_random_quick_restart':          1           0          0        0        0        0
     'fs_random_quick_restart':          1           0          0        0        0        0
     'fs_random_quick_restart':          1           0          0        0        0        0
     'fs_random_quick_restart':          1           0          0        0        0        0
              'lb_tree_search':          1       8'010      1'479      756      219        0
                      'max_lp':          1       2'128      1'363       98       19        0
         'objective_lb_search':          1       3'053      1'435      564        0        0
  'objective_lb_search_max_lp':          1       4'380      1'924      285       72        0
                     'probing':          1         539      1'253      174        0        0
              'probing_max_lp':          1         861      1'844       60        1        0
                'pseudo_costs':          1       2'687      1'479      228       50        2
               'quick_restart':          1       2'928      1'788      533        0        1
               'reduced_costs':          1       1'276      1'541      182        8        0

Lp dimension                                                                      Final dimension of first component
                  'default_lp':     182 rows, 95 columns, 313 entries with magnitude in [4.909380e-04, 1.000000e+00]
                   'fs_random':         0 rows, 95 columns, 0 entries with magnitude in [0.000000e+00, 0.000000e+00]
                   'fs_random':         0 rows, 95 columns, 0 entries with magnitude in [0.000000e+00, 0.000000e+00]
                   'fs_random':         0 rows, 95 columns, 0 entries with magnitude in [0.000000e+00, 0.000000e+00]
                   'fs_random':         0 rows, 95 columns, 0 entries with magnitude in [0.000000e+00, 0.000000e+00]
     'fs_random_quick_restart':         0 rows, 95 columns, 0 entries with magnitude in [0.000000e+00, 0.000000e+00]
     'fs_random_quick_restart':         0 rows, 95 columns, 0 entries with magnitude in [0.000000e+00, 0.000000e+00]
     'fs_random_quick_restart':         0 rows, 95 columns, 0 entries with magnitude in [0.000000e+00, 0.000000e+00]
     'fs_random_quick_restart':         0 rows, 95 columns, 0 entries with magnitude in [0.000000e+00, 0.000000e+00]
              'lb_tree_search':    145 rows, 101 columns, 464 entries with magnitude in [3.456506e-02, 1.000000e+00]
                      'max_lp':  1156 rows, 101 columns, 6760 entries with magnitude in [2.006136e-03, 1.000000e+00]
         'objective_lb_search':     177 rows, 95 columns, 586 entries with magnitude in [1.905395e-04, 1.000000e+00]
  'objective_lb_search_max_lp':   454 rows, 101 columns, 1273 entries with magnitude in [8.200992e-04, 1.000000e+00]
                     'probing':     109 rows, 95 columns, 524 entries with magnitude in [7.346206e-04, 1.000000e+00]
              'probing_max_lp':  1370 rows, 101 columns, 6965 entries with magnitude in [2.175531e-04, 1.000000e+00]
                'pseudo_costs':    535 rows, 101 columns, 416 entries with magnitude in [1.690050e-03, 1.000000e+00]
               'quick_restart':     338 rows, 95 columns, 659 entries with magnitude in [2.779127e-04, 1.000000e+00]
               'reduced_costs':   619 rows, 101 columns, 1586 entries with magnitude in [1.122977e-03, 1.000000e+00]

Lp debug                         CutPropag  CutEqPropag  Adjust  Overflow     Bad  BadScaling
                  'default_lp':          1            0     369         0   1'105           0
                   'fs_random':          0            0       0         0       0           0
                   'fs_random':          0            0       0         0       0           0
                   'fs_random':          0            0       0         0       0           0
                   'fs_random':          0            0       0         0       0           0
     'fs_random_quick_restart':          0            0       0         0       0           0
     'fs_random_quick_restart':          0            0       0         0       0           0
     'fs_random_quick_restart':          0            0       0         0       0           0
     'fs_random_quick_restart':          0            0       0         0       0           0
              'lb_tree_search':          3            0     623         0   1'422           0
                      'max_lp':          9            0      97         0   2'072           0
         'objective_lb_search':          5           24     338         0   3'077           0
  'objective_lb_search_max_lp':          8            1     320         0   4'219           0
                     'probing':          0            7     150         0  10'918           0
              'probing_max_lp':          5            0      58         0   8'198           0
                'pseudo_costs':          2            2     210         0   2'371           0
               'quick_restart':          8            0     295         0   5'297           0
               'reduced_costs':         14            2     182         0   3'566           0

Lp pool                          Constraints  Updates  Simplif  Merged  Shortened  Split  Strenghtened    Cuts/Call
                  'default_lp':          952       98    1'272      15        716     20           488    874/1'756
                   'fs_random':           93        0        0       0          0      0             0          0/0
                   'fs_random':           93        0        0       0          0      0             0          0/0
                   'fs_random':           93        0        0       0          0      0             0          0/0
                   'fs_random':           93        0        0       0          0      0             0          0/0
     'fs_random_quick_restart':           93        0        0       0          0      0             0          0/0
     'fs_random_quick_restart':           93        0        0       0          0      0             0          0/0
     'fs_random_quick_restart':           93        0        0       0          0      0             0          0/0
     'fs_random_quick_restart':           93        0        0       0          0      0             0          0/0
              'lb_tree_search':        2'133      153    4'036      11      1'190     22         3'800  1'479/2'527
                      'max_lp':        2'027      131    1'223       1          0     72         2'367  1'363/2'137
         'objective_lb_search':        1'528      451    7'887       0      1'612    141         1'751  1'435/2'641
  'objective_lb_search_max_lp':        2'582      250    9'926       7      2'950     76         6'033  1'924/3'180
                     'probing':        1'346      166      264       0          0     72           457  1'253/2'278
              'probing_max_lp':        2'509      166    3'682       0      1'055     91         2'143  1'844/3'065
                'pseudo_costs':        2'135      203    4'685       9      2'287     43         3'336  1'479/2'497
               'quick_restart':        1'875      827   20'089       6      2'182    380         2'960  1'788/3'137
               'reduced_costs':        2'201      278    7'585       5      2'161     72         5'079  1'541/2'608

Lp Cut            defaul  max_lp  quick_  reduce  pseudo  lb_tre  probin  object  probin  object
          CG_FF:      97     118     178     115      87     152     107     137     110     147
           CG_K:      44      32     102      42      54      87      46      57      44      41
           CG_R:      51      46     146      89      88      98      66      84      64      95
          CG_RB:     161     368     448     424     409     320     402     335     527     513
         CG_RBP:      19      67      74      46      35      49      40      48      90      89
         Clique:       -       9       -      10       7      20       -       -       5      22
             IB:     174     111     161     149     164     157     118     136      96     169
       MIR_1_FF:      59      80      63      82      67      78      46      54     103      86
        MIR_1_K:       4       9      12      11      14      15       6       5      12      10
        MIR_1_R:       5      14      20      10       4      17       3       6      21       6
       MIR_1_RB:      62     113     111     120      96      92      92      94     134     132
      MIR_1_RBP:       1      26       1      17      18      19       3       1      30      21
      MIR_1_RLT:       -       2       -       2       2       2       -       -       4       -
       MIR_2_FF:      32      42      42      24      27      37      36      61      47      38
        MIR_2_K:       5       8       7       5       3       6      10       8       4       8
       MIR_2_KL:       -       -       -       -       -       -       -       1       -       -
        MIR_2_R:      14      14      25       9      11      13      11      37      30      12
       MIR_2_RB:      43      51      66      58      55      39      55      53      71      86
      MIR_2_RBP:       2      13       6      16      10       7       3       -      16      13
       MIR_3_FF:       6      20      24      24      23      19      14      26      27      22
        MIR_3_K:       1       3       6       8       8       4       4       8       9       5
        MIR_3_R:       5      11      24      21      14      12       7      26      21      16
       MIR_3_RB:       6      29      45      25      38      20      23      26      52      44
      MIR_3_RBP:       -       9       2       5       7       5       3       2       8       1
       MIR_4_FF:       3       2      11      19      11       6      10      11      15      20
        MIR_4_K:       3       -       5       4       4       3       4       2       2       6
       MIR_4_KL:       1       -       -       -       -       -       -       -       -       -
        MIR_4_R:       5       2      10      11       8       4      11      21      13      16
       MIR_4_RB:       5      12      15      14      20       8      20      21      23      33
      MIR_4_RBP:       -       2       2       2       3       1       2       2       3       3
       MIR_5_FF:       4       6       8       7       5       4       3      14      11      14
        MIR_5_K:       1       3       4       1       3       3       4       4       3       4
        MIR_5_R:       2       2      10       4       3       4       3      12       6       4
       MIR_5_RB:       3       3       6       7       5       7       7       8       8       7
      MIR_5_RBP:       -       -       3       1       1       3       -       -       3       1
       MIR_6_FF:       1       3       2       3       2       3       2       7       1       2
        MIR_6_K:       1       -       3       3       1       5       -       2       2       4
        MIR_6_R:       1       1       4       1       3       1       1       7       4       2
       MIR_6_RB:       -       1       3       -       1       2       2       3       3       3
   ZERO_HALF_FF:      11      25      20      25      33      31      15      18      30      24
    ZERO_HALF_K:       1       1       4       6       7       4       3       5       3       2
    ZERO_HALF_R:      25      61      74      84      68      58      39      54     125     123
   ZERO_HALF_RB:      13      25      37      34      45      46      28      31      53      70
  ZERO_HALF_RBP:       3      19       4       3      15      18       4       8      11      10

LNS stats           Improv/Calls  Closed  Difficulty  TimeLimit
  'graph_arc_lns':          4/19     79%        0.99       0.10
  'graph_cst_lns':           0/1    100%        0.71       0.10
  'graph_dec_lns':          1/19     68%        0.98       0.10
  'graph_var_lns':          3/19     79%        0.99       0.10
      'rins/rens':          3/19     63%        0.96       0.10
    'rnd_cst_lns':          2/18     78%        0.99       0.10
    'rnd_var_lns':          6/19     84%        0.99       0.10

LS stats                   Batches  Restarts  LinMoves  GenMoves  CompoundMoves  WeightUpdates
       'fj_long_default':        0         0         0         0              0              0
       'fj_long_default':        0         0         0         0              0              0
   'fj_long_lin_default':        0         0         0         0              0              0
   'fj_long_lin_perturb':        0         0         0         0              0              0
    'fj_long_lin_random':        0         0         0         0              0              0
       'fj_long_perturb':        0         0         0         0              0              0
        'fj_long_random':        0         0         0         0              0              0
      'fj_short_default':        0         0         0         0              0              0
      'fj_short_default':        0         0         0         0              0              0
  'fj_short_lin_default':        0         0         0         0              0              0
  'fj_short_lin_default':        0         0         0         0              0              0
  'fj_short_lin_perturb':        0         0         0         0              0              0
   'fj_short_lin_random':        0         0         0         0              0              0
      'fj_short_perturb':        0         0         0         0              0              0
       'fj_short_random':        0         0         0         0              0              0
          'violation_ls':       12         0    13'413    39'958          3'654          1'620
          'violation_ls':       12         0    48'490        66              4          4'672
          'violation_ls':       12         0     5'155    72'795          1'677          5'432
          'violation_ls':       13         0         6    52'982          4'701            168
          'violation_ls':       18         0    61'239     1'067             37         52'605

Solutions (40)            Num     Rank
                'no_lp':   11   [1,40]
  'quick_restart_no_lp':    6   [4,26]
        'rins_pump_lns':    2  [22,23]
          'rnd_var_lns':    2  [10,32]
         'violation_ls':   19   [5,37]

Objective bounds                Num
                  'bool_core':   41
             'initial_domain':    1
  'objective_lb_search_no_lp':   31

Solution repositories    Added  Queried  Ignored  Synchro
  'feasible solutions':    132      351       16      101
        'lp solutions':      4        6        0        4
                'pump':    228       13

Improving bounds shared          Num
                        'core':    4
              'lb_tree_search':    2
                      'max_lp':   17
                       'no_lp':  167
         'objective_lb_search':    4
  'objective_lb_search_max_lp':   59
   'objective_lb_search_no_lp':  132
                     'probing':    2
                'pseudo_costs':   36
               'quick_restart':   53
         'quick_restart_no_lp':  345
               'reduced_costs':   36

Clauses shared                   Num
                        'core':    1
                  'default_lp':   11
              'lb_tree_search':    6
                       'no_lp':   19
         'objective_lb_search':   18
  'objective_lb_search_max_lp':    6
   'objective_lb_search_no_lp':    9
                'pseudo_costs':    5
               'quick_restart':   33
         'quick_restart_no_lp':   23
               'reduced_costs':    1

CpSolverResponse summary:
status: OPTIMAL
objective: 406
best_bound: 406
integers: 102
booleans: 40
conflicts: 0
branches: 26
propagations: 12
integer_propagations: 119
restarts: 26
lp_iterations: 0
walltime: 0.847837
usertime: 0.847837
deterministic_time: 4.63136
gap_integral: 7.51708
solution_fingerprint: 0x41f6ebe5d5d41820


--- Simulation Gantt  partir du modle mathmatique ---
{'big':0, 'due_date':66, 'pos_time':5, 'status':0, 'blocked':0, 'operations':["{'type':1, 'processing_time':29}", "{'type':0, 'processing_time':24}"]}
{'big':0, 'due_date':103, 'pos_time':5, 'status':0, 'blocked':0, 'operations':["{'type':1, 'processing_time':14}", "{'type':0, 'processing_time':58}"]}
{'big':0, 'due_date':88, 'pos_time':5, 'status':0, 'blocked':0, 'operations':["{'type':0, 'processing_time':11}"]}
{'big':1, 'due_date':88, 'pos_time':5, 'status':0, 'blocked':0, 'operations':["{'type':1, 'processing_time':27}"]}
{'big':1, 'due_date':123, 'pos_time':5, 'status':0, 'blocked':0, 'operations':["{'type':1, 'processing_time':33}", "{'type':0, 'processing_time':14}"]}
