created virtual environment CPython3.12.4.final.0-64 in 6345ms
  creator CPython3Posix(dest=/localscratch/aneumann.63393210.0/env, clear=False, no_vcs_ignore=False, global=False)
  seeder FromAppData(download=False, pip=bundle, via=copy, app_data_dir=/home/aneumann/.local/share/virtualenv)
    added seed packages: pip==25.1.1
  activators BashActivator,CShellActivator,FishActivator,NushellActivator,PowerShellActivator,PythonActivator
Looking in links: /cvmfs/soft.computecanada.ca/custom/python/wheelhouse/gentoo2023/x86-64-v3, /cvmfs/soft.computecanada.ca/custom/python/wheelhouse/gentoo2023/generic, /cvmfs/soft.computecanada.ca/custom/python/wheelhouse/generic
Requirement already satisfied: pip in /localscratch/aneumann.63393210.0/env/lib/python3.12/site-packages (25.1.1)
Looking in links: /cvmfs/soft.computecanada.ca/custom/python/wheelhouse/gentoo2023/x86-64-v3, /cvmfs/soft.computecanada.ca/custom/python/wheelhouse/gentoo2023/generic, /cvmfs/soft.computecanada.ca/custom/python/wheelhouse/generic
ERROR: protobuf-5.28.3-cp38-abi3-manylinux2014_x86_64.whl is not a supported wheel on this platform.
Looking in links: /cvmfs/soft.computecanada.ca/custom/python/wheelhouse/gentoo2023/x86-64-v3, /cvmfs/soft.computecanada.ca/custom/python/wheelhouse/gentoo2023/generic, /cvmfs/soft.computecanada.ca/custom/python/wheelhouse/generic
Processing /home/aneumann/projects/def-adhaj/aneumann/GNRS/wheels/immutabledict-4.2.0-py3-none-any.whl
Installing collected packages: immutabledict
Successfully installed immutabledict-4.2.0
Looking in links: /cvmfs/soft.computecanada.ca/custom/python/wheelhouse/gentoo2023/x86-64-v3, /cvmfs/soft.computecanada.ca/custom/python/wheelhouse/gentoo2023/generic, /cvmfs/soft.computecanada.ca/custom/python/wheelhouse/generic
Processing /cvmfs/soft.computecanada.ca/custom/python/wheelhouse/generic/ortools-9.10.4067+computecanada-cp312-cp312-linux_x86_64.whl (from -r /home/aneumann/projects/def-adhaj/aneumann/GNRS/requirements/or.txt (line 1))
Processing /cvmfs/soft.computecanada.ca/custom/python/wheelhouse/gentoo2023/x86-64-v3/matplotlib-3.10.0+computecanada-cp312-cp312-linux_x86_64.whl (from -r /home/aneumann/projects/def-adhaj/aneumann/GNRS/requirements/or.txt (line 2))
Processing /cvmfs/soft.computecanada.ca/custom/python/wheelhouse/gentoo2023/x86-64-v3/pandas-2.2.3+computecanada-cp312-cp312-linux_x86_64.whl (from -r /home/aneumann/projects/def-adhaj/aneumann/GNRS/requirements/or.txt (line 3))
Processing /cvmfs/soft.computecanada.ca/custom/python/wheelhouse/generic/absl_py-2.2.2+computecanada-py3-none-any.whl (from ortools<9.11,>=9.10->-r /home/aneumann/projects/def-adhaj/aneumann/GNRS/requirements/or.txt (line 1))
Processing /cvmfs/soft.computecanada.ca/custom/python/wheelhouse/gentoo2023/generic/numpy-2.2.2+computecanada-cp312-cp312-linux_x86_64.whl (from ortools<9.11,>=9.10->-r /home/aneumann/projects/def-adhaj/aneumann/GNRS/requirements/or.txt (line 1))
Processing /cvmfs/soft.computecanada.ca/custom/python/wheelhouse/gentoo2023/x86-64-v3/protobuf-6.30.2+computecanada-cp312-cp312-linux_x86_64.whl (from ortools<9.11,>=9.10->-r /home/aneumann/projects/def-adhaj/aneumann/GNRS/requirements/or.txt (line 1))
Requirement already satisfied: immutabledict>=3.0.0 in /localscratch/aneumann.63393210.0/env/lib/python3.12/site-packages (from ortools<9.11,>=9.10->-r /home/aneumann/projects/def-adhaj/aneumann/GNRS/requirements/or.txt (line 1)) (4.2.0)
Processing /cvmfs/soft.computecanada.ca/custom/python/wheelhouse/gentoo2023/generic/contourpy-1.3.1+computecanada-cp312-cp312-linux_x86_64.whl (from matplotlib->-r /home/aneumann/projects/def-adhaj/aneumann/GNRS/requirements/or.txt (line 2))
Processing /cvmfs/soft.computecanada.ca/custom/python/wheelhouse/generic/cycler-0.12.1+computecanada-py3-none-any.whl (from matplotlib->-r /home/aneumann/projects/def-adhaj/aneumann/GNRS/requirements/or.txt (line 2))
Processing /cvmfs/soft.computecanada.ca/custom/python/wheelhouse/generic/fonttools-4.58.2+computecanada-cp312-cp312-linux_x86_64.whl (from matplotlib->-r /home/aneumann/projects/def-adhaj/aneumann/GNRS/requirements/or.txt (line 2))
Processing /cvmfs/soft.computecanada.ca/custom/python/wheelhouse/gentoo2023/x86-64-v3/kiwisolver-1.4.8+computecanada-cp312-cp312-linux_x86_64.whl (from matplotlib->-r /home/aneumann/projects/def-adhaj/aneumann/GNRS/requirements/or.txt (line 2))
Processing /cvmfs/soft.computecanada.ca/custom/python/wheelhouse/generic/packaging-25.0+computecanada-py3-none-any.whl (from matplotlib->-r /home/aneumann/projects/def-adhaj/aneumann/GNRS/requirements/or.txt (line 2))
Processing /cvmfs/soft.computecanada.ca/custom/python/wheelhouse/gentoo2023/x86-64-v3/pillow-11.1.0+computecanada-cp312-cp312-linux_x86_64.whl (from matplotlib->-r /home/aneumann/projects/def-adhaj/aneumann/GNRS/requirements/or.txt (line 2))
Processing /cvmfs/soft.computecanada.ca/custom/python/wheelhouse/generic/pyparsing-3.2.1+computecanada-py3-none-any.whl (from matplotlib->-r /home/aneumann/projects/def-adhaj/aneumann/GNRS/requirements/or.txt (line 2))
Processing /cvmfs/soft.computecanada.ca/custom/python/wheelhouse/generic/python_dateutil-2.9.0.post0+computecanada-py2.py3-none-any.whl (from matplotlib->-r /home/aneumann/projects/def-adhaj/aneumann/GNRS/requirements/or.txt (line 2))
Processing /cvmfs/soft.computecanada.ca/custom/python/wheelhouse/generic/pytz-2025.2+computecanada-py2.py3-none-any.whl (from pandas->-r /home/aneumann/projects/def-adhaj/aneumann/GNRS/requirements/or.txt (line 3))
Processing /cvmfs/soft.computecanada.ca/custom/python/wheelhouse/generic/tzdata-2025.2+computecanada-py2.py3-none-any.whl (from pandas->-r /home/aneumann/projects/def-adhaj/aneumann/GNRS/requirements/or.txt (line 3))
Processing /cvmfs/soft.computecanada.ca/custom/python/wheelhouse/generic/six-1.17.0+computecanada-py2.py3-none-any.whl (from python-dateutil>=2.7->matplotlib->-r /home/aneumann/projects/def-adhaj/aneumann/GNRS/requirements/or.txt (line 2))
Installing collected packages: pytz, tzdata, six, pyparsing, protobuf, pillow, packaging, numpy, kiwisolver, fonttools, cycler, absl-py, python-dateutil, contourpy, pandas, matplotlib, ortools

Successfully installed absl-py-2.2.2+computecanada contourpy-1.3.1+computecanada cycler-0.12.1+computecanada fonttools-4.58.2+computecanada kiwisolver-1.4.8+computecanada matplotlib-3.10.0+computecanada numpy-2.2.2+computecanada ortools-9.10.4067+computecanada packaging-25.0+computecanada pandas-2.2.3+computecanada pillow-11.1.0+computecanada protobuf-6.30.2+computecanada pyparsing-3.2.1+computecanada python-dateutil-2.9.0.post0+computecanada pytz-2025.2+computecanada six-1.17.0+computecanada tzdata-2025.2+computecanada

Starting CP-SAT solver v9.10.4067
Parameters: max_time_in_seconds: 3600 max_memory_in_mb: 12000 log_search_progress: true enumerate_all_solutions: false absolute_gap_limit: 0 relative_gap_limit: 0
Setting number of workers to 48

Initial optimization model '': (model_fingerprint: 0x20b49c3aa13ad464)
#Variables: 265 (#ints: 8 in objective)
  - 182 Booleans in [0,1]
  - 83 in [0,530]
#kLinear1: 37
#kLinear2: 431
#kLinear3: 153
#kLinearN: 1'955 (#terms: 23'128)

Starting presolve at 0.00s
  1.11e-03s  0.00e+00d  [DetectDominanceRelations] 
  2.67e-02s  0.00e+00d  [PresolveToFixPoint] #num_loops=6 #num_dual_strengthening=3 
  2.70e-05s  0.00e+00d  [ExtractEncodingFromLinear] #potential_supersets=5 
[Symmetry] Graph for symmetry has 2'261 nodes and 14'947 arcs.
[Symmetry] Symmetry computation done. time: 0.00171536 dtime: 0.00166244
[Symmetry] #generators: 1, average support size: 24
[Symmetry] The model contains 227 duplicate constraints !
[Symmetry] 12 orbits with sizes: 2,2,2,2,2,2,2,2,2,2,...
[Symmetry] Num fixable by intersecting at_most_one with orbits: 1 largest_orbit: 2
  5.77e-03s  7.39e-04d  [Probe] #probed=256 #fixed_bools=3 #new_bounds=5 #equiv=1 
  4.56e-05s  0.00e+00d  [MaxClique] Merged 25(50 literals) into 7(14 literals) at_most_ones. 
  1.07e-03s  0.00e+00d  [DetectDominanceRelations] 
  9.60e-03s  0.00e+00d  [PresolveToFixPoint] #num_loops=4 #num_dual_strengthening=3 
  3.51e-03s  0.00e+00d  [ProcessAtMostOneAndLinear] 
  1.89e-03s  0.00e+00d  [DetectDuplicateConstraints] #duplicates=272 #without_enforcements=152 
  9.99e-04s  4.27e-05d  [DetectDominatedLinearConstraints] #relevant_constraints=1'293 #num_inclusions=645 #num_redundant=3 
  2.51e-04s  0.00e+00d  [DetectDifferentVariables] #different=35 
  3.30e-04s  1.50e-05d  [ProcessSetPPC] #relevant_constraints=911 
  2.07e-05s  0.00e+00d  [FindAlmostIdenticalLinearConstraints] 
  1.77e-04s  1.30e-04d  [FindBigAtMostOneAndLinearOverlap] 
  4.02e-03s  1.00e-03d  [FindBigVerticalLinearOverlap] #blocks=32 #saved_nz=2'500 
  1.70e-04s  3.32e-05d  [FindBigHorizontalLinearOverlap] #linears=841 
  1.04e-05s  0.00e+00d  [MergeClauses] 
  1.10e-03s  0.00e+00d  [DetectDominanceRelations] 
  1.66e-02s  0.00e+00d  [PresolveToFixPoint] #num_loops=2 #num_dual_strengthening=1 
  1.10e-03s  0.00e+00d  [DetectDominanceRelations] 
  9.56e-03s  0.00e+00d  [PresolveToFixPoint] #num_loops=1 #num_dual_strengthening=1 
[Symmetry] Graph for symmetry has 2'058 nodes and 11'414 arcs.
[Symmetry] Symmetry computation done. time: 0.000580726 dtime: 0.00072499
  5.46e-03s  6.82e-04d  [Probe] #probed=250 #new_bounds=40 
  1.22e-05s  0.00e+00d  [MaxClique] 
  1.08e-03s  0.00e+00d  [DetectDominanceRelations] 
  1.80e-02s  0.00e+00d  [PresolveToFixPoint] #num_loops=4 #num_dual_strengthening=3 
  3.07e-03s  0.00e+00d  [ProcessAtMostOneAndLinear] 
  1.59e-03s  0.00e+00d  [DetectDuplicateConstraints] #without_enforcements=178 
  6.57e-04s  2.61e-05d  [DetectDominatedLinearConstraints] #relevant_constraints=1'097 #num_inclusions=158 
  2.57e-04s  0.00e+00d  [DetectDifferentVariables] #different=39 #cliques=1 #size=3 
  2.76e-04s  9.33e-06d  [ProcessSetPPC] #relevant_constraints=783 
  2.81e-05s  4.50e-08d  [FindAlmostIdenticalLinearConstraints] #num_tested_pairs=3 
  1.11e-04s  6.73e-05d  [FindBigAtMostOneAndLinearOverlap] 
  2.25e-03s  6.45e-04d  [FindBigVerticalLinearOverlap] #blocks=20 #saved_nz=1'133 
  1.42e-04s  2.38e-05d  [FindBigHorizontalLinearOverlap] #linears=699 
  1.01e-05s  0.00e+00d  [MergeClauses] 
  1.01e-03s  0.00e+00d  [DetectDominanceRelations] 
  1.24e-02s  0.00e+00d  [PresolveToFixPoint] #num_loops=2 #num_dual_strengthening=1 
  1.01e-03s  0.00e+00d  [DetectDominanceRelations] 
  8.77e-03s  0.00e+00d  [PresolveToFixPoint] #num_loops=1 #num_dual_strengthening=1 
  5.13e-03s  6.28e-04d  [Probe] #probed=250 #new_bounds=13 
  1.14e-05s  0.00e+00d  [MaxClique] 
  1.00e-03s  0.00e+00d  [DetectDominanceRelations] 
  1.08e-02s  0.00e+00d  [PresolveToFixPoint] #num_loops=2 #num_dual_strengthening=1 
  2.77e-03s  0.00e+00d  [ProcessAtMostOneAndLinear] 
  1.53e-03s  0.00e+00d  [DetectDuplicateConstraints] #without_enforcements=184 
  5.31e-04s  1.99e-05d  [DetectDominatedLinearConstraints] #relevant_constraints=1'020 #num_inclusions=82 
  1.51e-04s  0.00e+00d  [DetectDifferentVariables] 
  2.20e-04s  6.53e-06d  [ProcessSetPPC] #relevant_constraints=679 
  3.17e-05s  6.00e-08d  [FindAlmostIdenticalLinearConstraints] #num_tested_pairs=3 
  9.00e-05s  4.90e-05d  [FindBigAtMostOneAndLinearOverlap] 
  1.39e-03s  4.96e-04d  [FindBigVerticalLinearOverlap] #blocks=2 #saved_nz=116 
  1.34e-04s  2.26e-05d  [FindBigHorizontalLinearOverlap] #linears=674 
  9.62e-06s  0.00e+00d  [MergeClauses] 
  9.74e-04s  0.00e+00d  [DetectDominanceRelations] 
  8.64e-03s  0.00e+00d  [PresolveToFixPoint] #num_loops=2 #num_dual_strengthening=1 
  6.03e-05s  0.00e+00d  [ExpandObjective] #entries=185 #tight_variables=77 #tight_constraints=45 

Presolve summary:
  - 50 affine relations were detected.
  - rule 'TODO dual: only one blocking constraint?' was applied 717 times.
  - rule 'TODO dual: only one unspecified blocking constraint?' was applied 120 times.
  - rule 'TODO duplicate: identical constraint with different enforcements' was applied 514 times.
  - rule 'TODO no_overlap: with task always last' was applied 1 time.
  - rule 'affine: new relation' was applied 50 times.
  - rule 'all_diff: inferred from x != y constraints' was applied 1 time.
  - rule 'at_most_one: removed literals' was applied 7 times.
  - rule 'at_most_one: size one' was applied 7 times.
  - rule 'at_most_one: transformed into max clique.' was applied 1 time.
  - rule 'deductions: 165 stored' was applied 1 time.
  - rule 'dual: fix variable' was applied 21 times.
  - rule 'dual: reduced domain' was applied 40 times.
  - rule 'duplicate: merged rhs of linear constraint' was applied 51 times.
  - rule 'duplicate: removed constraint' was applied 272 times.
  - rule 'enforcement: false literal' was applied 17 times.
  - rule 'enforcement: true literal' was applied 12 times.
  - rule 'exactly_one: x and not(x)' was applied 1 time.
  - rule 'incompatible linear: add implication' was applied 45 times.
  - rule 'linear inclusion: redundant containing constraint' was applied 3 times.
  - rule 'linear matrix: common vertical rectangle' was applied 54 times.
  - rule 'linear: always true' was applied 716 times.
  - rule 'linear: doubleton free' was applied 10 times.
  - rule 'linear: empty' was applied 24 times.
  - rule 'linear: extracted enforcement literal' was applied 3'653 times.
  - rule 'linear: fixed or dup variables' was applied 1'998 times.
  - rule 'linear: positive equal one' was applied 5 times.
  - rule 'linear: reduced variable domains' was applied 152 times.
  - rule 'linear: remapped using affine relations' was applied 1'890 times.
  - rule 'linear: simplified rhs' was applied 5'574 times.
  - rule 'linear: variable substitution 1' was applied 10 times.
  - rule 'linear: variable substitution 2' was applied 5 times.
  - rule 'linear: variable substitution 3' was applied 2 times.
  - rule 'presolve: 77 unused variables removed.' was applied 1 time.
  - rule 'presolve: iteration' was applied 3 times.
  - rule 'probing: reduced enforced constraint to implication.' was applied 25 times.
  - rule 'symmetry: fixed to false in general orbit' was applied 1 time.

Presolved optimization model '': (model_fingerprint: 0xd3b39cef069eab)
#Variables: 175 (#ints: 8 in objective)
  - 65 Booleans in [0,1]
  - 1 in [-1533,-1092][-1057,-562][-527,-32][3,498][533,1028][1063,1558][1593,2088][2123,2511]
  - 1 in [-1054,-562][-527,-32][3,498][533,1028][1063,1444]
  - 2 in [-1054,-562][-527,-32][3,498][533,1028][1063,1558][1593,1974]
  - 1 in [-1054,-562][-527,-32][3,498][533,1028][1063,1558][1593,2088][2123,2618][2653,3034]
  - 1 in [-1054,-551][-527,-21][3,509][533,1039][1063,1569][1593,1985]
  - 1 in [-1013,-592][-483,-62][47,468][577,884]
  - 1 in [-1013,-592][-483,-62][47,468][577,944]
  - 2 in [-1004,-590][-474,-60][56,470][586,1000][1116,1423]
  - 1 in [-1003,-562][-527,-32][3,498][533,1028][1063,1451]
  - 1 in [-889,-551][-527,-21][3,509][533,1039][1063,1569][1593,2099][2123,2629][2653,3052]
  - 3 in [-530,-116][0,414]
  - 3 in [-530,-109][0,421]
  - 1 in [-530,-49][0,481]
  - 6 in [-530,-35][0,495]
  - 1 in [-524,-32][3,498][533,1028][1063,1558][1593,1981]
  - 1 in [-483,-62][47,468][577,951]
  - 1 in [-474,-60][56,470][586,946]
  - 1 in [-474,-60][56,470][586,1000][1116,1423]
  - 1 in [-473,-32][3,498][533,1028][1063,1451]
  - 1 in [-473,-32][3,498][533,1028][1063,1558][1593,1974]
  - 1 in [-469,-21][3,509][533,1039][1063,1569][1593,1985]
  - 1 in [-469,-21][3,509][533,1039][1063,1569][1593,1992]
  - 1 in [-2,415]
  - 1 in [-2,422]
  - 1 in [-2,472]
  - 1 in [-2,482]
  - 1 in [0,352]
  - 3 in [0,414]
  - 1 in [0,417]
  - 3 in [0,421]
  - 1 in [0,426]
  - 1 in [0,430]
  - 1 in [0,435]
  - 1 in [0,441]
  - 4 in [0,448]
  - 1 in [0,474]
  - 3 in [0,481]
  - 1 in [0,481][530,1011]
  - 6 in [0,495]
  - 1 in [0,506]
  - 1 in [3,417]
  - 1 in [3,424]
  - 1 in [3,477]
  - 1 in [3,484]
  - 2 in [3,498]
  - 1 in [3,509]
  - 1 in [6,498][533,1028][1063,1444]
  - 1 in [6,498][533,1028][1063,1451]
  - 1 in [29,510]
  - 1 in [29,510][559,1040][1089,1456]
  - 1 in [29,510][559,1040][1089,1570][1619,1986]
  - 1 in [29,510][559,1040][1089,1570][1619,2100]
  - 1 in [29,510][559,1040][1089,1570][1619,2100][2149,2516]
  - 1 in [44,465]
  - 1 in [47,468]
  - 1 in [56,470]
  - 1 in [57,498][533,1028][1063,1558][1593,1974]
  - 1 in [61,509][533,1039][1063,1511]
  - 1 in [61,509][533,1039][1063,1569][1593,2099][2123,2515]
  - 2 in [78,519]
  - 2 in [84,519]
  - 1 in [84,525]
  - 2 in [89,519]
  - 1 in [90,525]
  - 2 in [93,519]
  - 1 in [95,525]
  - 3 in [98,519]
  - 1 in [99,525]
  - 3 in [102,519]
  - 1 in [104,525]
  - 1 in [108,525]
  - 3 in [159,519]
  - 1 in [165,525]
  - 1 in [170,530]
#kAllDiff: 1
#kExactlyOne: 4 (#literals: 12)
#kLinear2: 588 (#enforced: 536 #multi: 464)
#kLinear3: 80 (#enforced: 41)
#kLinearN: 834 (#enforced: 735) (#terms: 5'166)

Preloading model.
#Bound   0.18s best:inf   next:[214,3496] initial_domain
#Model   0.18s var:175/175 constraints:1507/1507

Starting search at 0.18s with 48 workers.
16 full problem subsolvers: [core, default_lp, lb_tree_search, max_lp, no_lp, objective_lb_search, objective_lb_search_max_lp, objective_lb_search_no_lp, objective_shaving_search_max_lp, objective_shaving_search_no_lp, probing, probing_max_lp, pseudo_costs, quick_restart, quick_restart_no_lp, reduced_costs]
30 first solution subsolvers: [fj_long_default(2), fj_long_lin_default, fj_long_lin_perturb, fj_long_lin_random, fj_long_perturb, fj_long_random, fj_short_default(2), fj_short_lin_default(2), fj_short_lin_perturb, fj_short_lin_random, fj_short_perturb, fj_short_random, fs_random(4), fs_random_no_lp(4), fs_random_quick_restart(4), fs_random_quick_restart_no_lp(3)]
13 incomplete subsolvers: [feasibility_pump, graph_arc_lns, graph_cst_lns, graph_dec_lns, graph_var_lns, rins/rens, rnd_cst_lns, rnd_var_lns, violation_ls(5)]
3 helper subsolvers: [neighborhood_helper, synchronization_agent, update_gap_integral]
#1       0.20s best:1856  next:[214,1855] no_lp (fixed_bools=0/92)
#Bound   0.20s best:1856  next:[239,1855] objective_lb_search_no_lp
#Bound   0.21s best:1856  next:[267,1855] objective_lb_search_no_lp
#2       0.21s best:1397  next:[267,1396] no_lp (fixed_bools=0/113)
#Bound   0.21s best:1397  next:[275,1396] objective_lb_search_no_lp
#3       0.21s best:1394  next:[275,1393] no_lp (fixed_bools=0/123)
#4       0.21s best:1071  next:[275,1070] quick_restart_no_lp (fixed_bools=0/99)
#5       0.21s best:1056  next:[275,1055] quick_restart_no_lp (fixed_bools=0/102)
#6       0.22s best:996   next:[275,995]  quick_restart_no_lp (fixed_bools=0/111)
#7       0.24s best:981   next:[275,980]  quick_restart_no_lp (fixed_bools=1/119)
#Bound   0.25s best:981   next:[278,980]  objective_lb_search
#8       0.26s best:977   next:[278,976]  graph_arc_lns (d=0.81 s=62 t=0.10 p=1.00 stall=2 h=auto_l0)
#9       0.26s best:973   next:[278,972]  graph_arc_lns (d=0.81 s=69 t=0.10 p=1.00 stall=2 h=auto_l0)
#10      0.27s best:972   next:[278,971]  violation_ls(batch:2 #solutions_imported:2 #lin_moves:39 #lin_evals:10'310 #gen_moves:4'898 #gen_evals:288 #comp_moves:340 #backtracks:2'279 #weight_updates:80)
#11      0.27s best:971   next:[278,970]  violation_ls(batch:3 #solutions_imported:3 #lin_moves:406 #lin_evals:9'555 #gen_moves:3'691 #gen_evals:284 #comp_moves:207 #backtracks:1'742 #weight_updates:198)
#12      0.27s best:970   next:[278,969]  violation_ls(batch:4 #solutions_imported:4 #lin_moves:407 #lin_evals:9'563 #gen_moves:3'691 #gen_evals:284 #comp_moves:207 #backtracks:1'742 #weight_updates:198)
#13      0.28s best:969   next:[278,968]  violation_ls(batch:4 #solutions_imported:4 #lin_moves:129 #lin_evals:10'699 #gen_moves:4'898 #gen_evals:288 #comp_moves:340 #backtracks:2'279 #weight_updates:125)
#14      0.29s best:968   next:[278,967]  violation_ls(batch:5 #solutions_imported:5 #lin_moves:129 #lin_evals:10'703 #gen_moves:4'900 #gen_evals:288 #comp_moves:342 #backtracks:2'279 #weight_updates:125)
#15      0.30s best:967   next:[278,966]  violation_ls(batch:6 #solutions_imported:6 #lin_moves:407 #lin_evals:11'792 #gen_moves:4'725 #gen_evals:337 #comp_moves:247 #backtracks:2'239 #weight_updates:213)
#16      0.30s best:966   next:[278,965]  violation_ls(batch:6 #solutions_imported:6 #lin_moves:170 #lin_evals:10'923 #gen_moves:4'900 #gen_evals:288 #comp_moves:342 #backtracks:2'279 #weight_updates:163)
#Bound   0.32s best:966   next:[423,965]  objective_lb_search_no_lp
#17      0.32s best:965   next:[423,964]  quick_restart_no_lp (fixed_bools=1/130)
#18      0.32s best:964   next:[423,963]  violation_ls(batch:2 #solutions_imported:2 #lin_moves:1 #lin_evals:20'706 #gen_moves:9'918 #gen_evals:811 #comp_moves:271 #backtracks:4'823 #weight_updates:99)
#19      0.32s best:954   next:[423,953]  rnd_var_lns (d=0.91 s=92 t=0.10 p=1.00 stall=4 h=auto_l0)
#20      0.33s best:951   next:[423,950]  graph_var_lns (d=0.91 s=85 t=0.10 p=1.00 stall=4 h=auto_l0)
#21      0.34s best:950   next:[423,949]  violation_ls(batch:3 #solutions_imported:3 #lin_moves:9'330 #lin_evals:42'582 #gen_moves:744 #gen_evals:48 #comp_moves:26 #backtracks:359 #weight_updates:745)
#22      0.34s best:949   next:[423,948]  violation_ls(batch:5 #solutions_imported:5 #lin_moves:1'301 #lin_evals:27'191 #gen_moves:10'789 #gen_evals:854 #comp_moves:330 #backtracks:5'229 #weight_updates:364)
#23      0.35s best:947   next:[423,946]  quick_restart_no_lp (fixed_bools=1/161)
#24      0.35s best:938   next:[423,937]  quick_restart_no_lp (fixed_bools=1/174)
#25      0.36s best:936   next:[423,935]  violation_ls(batch:4 #solutions_imported:4 #lin_moves:9'313 #lin_evals:46'720 #gen_moves:3'989 #gen_evals:247 #comp_moves:229 #backtracks:1'880 #weight_updates:742)
#26      0.36s best:934   next:[423,933]  violation_ls(batch:5 #solutions_imported:5 #lin_moves:9'313 #lin_evals:46'723 #gen_moves:3'990 #gen_evals:247 #comp_moves:230 #backtracks:1'880 #weight_updates:742)
#27      0.36s best:932   next:[423,931]  violation_ls(batch:6 #solutions_imported:6 #lin_moves:9'330 #lin_evals:43'956 #gen_moves:1'346 #gen_evals:48 #comp_moves:52 #backtracks:647 #weight_updates:754)
#28      0.36s best:930   next:[423,929]  violation_ls(batch:6 #solutions_imported:6 #lin_moves:1'302 #lin_evals:27'199 #gen_moves:10'789 #gen_evals:854 #comp_moves:330 #backtracks:5'229 #weight_updates:364)
#29      0.36s best:929   next:[423,928]  violation_ls(batch:6 #solutions_imported:6 #lin_moves:9'313 #lin_evals:46'727 #gen_moves:3'992 #gen_evals:247 #comp_moves:232 #backtracks:1'880 #weight_updates:742)
#30      0.37s best:927   next:[423,926]  violation_ls(batch:7 #solutions_imported:7 #lin_moves:9'331 #lin_evals:43'964 #gen_moves:1'346 #gen_evals:48 #comp_moves:52 #backtracks:647 #weight_updates:754)
#31      0.37s best:925   next:[423,924]  violation_ls(batch:7 #solutions_imported:7 #lin_moves:408 #lin_evals:11'800 #gen_moves:4'725 #gen_evals:337 #comp_moves:247 #backtracks:2'239 #weight_updates:213)
#32      0.37s best:923   next:[423,922]  violation_ls(batch:7 #solutions_imported:7 #lin_moves:1'302 #lin_evals:27'220 #gen_moves:10'800 #gen_evals:854 #comp_moves:331 #backtracks:5'234 #weight_updates:364)
#33      0.37s best:887   next:[423,886]  quick_restart_no_lp (fixed_bools=1/195)
#34      0.39s best:881   next:[423,880]  quick_restart_no_lp (fixed_bools=1/205)
#35      0.40s best:880   next:[423,879]  quick_restart_no_lp (fixed_bools=1/217)
#36      0.40s best:878   next:[423,877]  violation_ls(batch:8 #solutions_imported:8 #lin_moves:9'331 #lin_evals:43'967 #gen_moves:1'347 #gen_evals:48 #comp_moves:53 #backtracks:647 #weight_updates:754)
#37      0.41s best:877   next:[423,876]  violation_ls(batch:8 #solutions_imported:8 #lin_moves:9'313 #lin_evals:46'738 #gen_moves:3'999 #gen_evals:247 #comp_moves:239 #backtracks:1'880 #weight_updates:742)
#38      0.41s best:876   next:[423,875]  violation_ls(batch:9 #solutions_imported:9 #lin_moves:9'331 #lin_evals:43'969 #gen_moves:1'348 #gen_evals:48 #comp_moves:54 #backtracks:647 #weight_updates:754)
#39      0.42s best:823   next:[423,822]  quick_restart_no_lp (fixed_bools=1/231)
#40      0.42s best:822   next:[423,821]  violation_ls(batch:9 #solutions_imported:9 #lin_moves:409 #lin_evals:11'822 #gen_moves:4'734 #gen_evals:338 #comp_moves:248 #backtracks:2'243 #weight_updates:213)
#41      0.42s best:698   next:[423,697]  graph_dec_lns (d=0.94 s=107 t=0.10 p=1.00 stall=0 h=auto_l0)
#Bound   0.54s best:698   next:[424,697]  objective_shaving_search_no_lp (vars=178 csts=1367)
#Bound   0.62s best:698   next:[425,697]  objective_lb_search_no_lp
#Bound   0.68s best:698   next:[437,697]  objective_lb_search_no_lp
#Bound   0.71s best:698   next:[439,697]  objective_lb_search_no_lp
#42      0.74s best:665   next:[439,664]  graph_dec_lns (d=0.94 s=138 t=0.10 p=1.00 stall=0 h=auto_l0)
#Bound   0.75s best:665   next:[446,664]  objective_lb_search_no_lp
#43      0.76s best:664   next:[446,663]  violation_ls(batch:13 #solutions_imported:10 #lin_moves:35'007 #lin_evals:297'366 #gen_moves:4'547 #gen_evals:266 #comp_moves:267 #backtracks:2'140 #weight_updates:15'058)
#44      0.77s best:663   next:[446,662]  violation_ls(batch:14 #solutions_imported:11 #lin_moves:35'007 #lin_evals:299'522 #gen_moves:5'402 #gen_evals:330 #comp_moves:344 #backtracks:2'529 #weight_updates:15'073)
#45      0.78s best:654   next:[446,653]  quick_restart_no_lp (fixed_bools=12/300)
#46      0.82s best:653   next:[446,652]  quick_restart_no_lp (fixed_bools=12/303)
#47      0.82s best:652   next:[446,651]  violation_ls(batch:14 #solutions_imported:11 #lin_moves:26'809 #lin_evals:284'183 #gen_moves:4'734 #gen_evals:338 #comp_moves:248 #backtracks:2'243 #weight_updates:13'875)
#48      0.82s best:651   next:[446,650]  violation_ls(batch:13 #solutions_imported:11 #lin_moves:9'331 #lin_evals:102'506 #gen_moves:29'116 #gen_evals:2'746 #comp_moves:615 #backtracks:14'240 #weight_updates:983)
#49      0.82s best:650   next:[446,649]  violation_ls(batch:15 #solutions_imported:12 #lin_moves:26'810 #lin_evals:284'191 #gen_moves:4'734 #gen_evals:338 #comp_moves:248 #backtracks:2'243 #weight_updates:13'875)
#50      0.93s best:625   next:[446,624]  graph_dec_lns (d=0.98 s=233 t=0.10 p=1.00 stall=1 h=auto_l0)
#Bound   1.05s best:625   next:[447,624]  objective_shaving_search_no_lp (vars=178 csts=1367)
#Bound   1.06s best:625   next:[450,624]  objective_lb_search_no_lp
#Bound   1.08s best:625   next:[451,624]  objective_lb_search_no_lp
#Bound   1.34s best:625   next:[452,624]  objective_shaving_search_no_lp (vars=178 csts=1367)
#Bound   1.50s best:625   next:[462,624]  objective_lb_search_no_lp
#Bound   1.54s best:625   next:[463,624]  objective_lb_search_no_lp
#Bound   1.64s best:625   next:[469,624]  objective_lb_search_no_lp
#Bound   1.71s best:625   next:[473,624]  objective_lb_search_no_lp
#Bound   1.82s best:625   next:[475,624]  objective_lb_search_no_lp
#Bound   1.94s best:625   next:[478,624]  objective_lb_search_no_lp
#Bound   2.02s best:625   next:[481,624]  objective_lb_search_no_lp
#Bound   2.12s best:625   next:[483,624]  objective_lb_search_no_lp
#Bound   2.98s best:625   next:[497,624]  objective_lb_search_no_lp [skipped_logs=6]
#Model   3.67s var:174/175 constraints:1354/1507
#Bound   3.92s best:625   next:[508,624]  objective_lb_search_no_lp [skipped_logs=3]
#Bound   4.99s best:625   next:[525,624]  objective_lb_search_no_lp [skipped_logs=7]
#Bound   5.74s best:625   next:[535,624]  objective_lb_search_no_lp [skipped_logs=4]
#Model   6.62s var:173/175 constraints:1345/1507
#Bound   6.65s best:625   next:[551,624]  objective_lb_search_no_lp [skipped_logs=5]
#Model   7.52s var:172/175 constraints:1313/1507
#Model   7.90s var:171/175 constraints:1266/1507
#Bound   7.94s best:625   next:[576,624]  objective_lb_search_no_lp [skipped_logs=3]
#Model   8.06s var:170/175 constraints:1236/1507
#Model   8.18s var:168/175 constraints:1154/1507
#Model   8.19s var:162/175 constraints:1024/1507
#Done    8.20s no_lp
#Model   8.20s var:157/175 constraints:886/1507
#Done    8.20s core
#Model   8.20s var:154/175 constraints:810/1507
#Bound   8.18s best:625   next:[580,624]  objective_lb_search_no_lp [skipped_logs=0]

Task timing                                  n [     min,      max]      avg      dev     time         n [     min,      max]      avg      dev    dtime
                             'core':         1 [   8.02s,    8.02s]    8.02s   0.00ns    8.02s         1 [   2.09s,    2.09s]    2.09s   0.00ns    2.09s
                       'default_lp':         1 [   8.02s,    8.02s]    8.02s   0.00ns    8.02s         1 [986.52ms, 986.52ms] 986.52ms   0.00ns 986.52ms
                 'feasibility_pump':        53 [ 15.91ms, 163.16ms]  78.14ms  28.22ms    4.14s        52 [  3.01ms,  11.35ms]   7.82ms 827.97us 406.62ms
                  'fj_long_default':         0 [  0.00ns,   0.00ns]   0.00ns   0.00ns   0.00ns         0 [  0.00ns,   0.00ns]   0.00ns   0.00ns   0.00ns
                  'fj_long_default':         0 [  0.00ns,   0.00ns]   0.00ns   0.00ns   0.00ns         0 [  0.00ns,   0.00ns]   0.00ns   0.00ns   0.00ns
              'fj_long_lin_default':         0 [  0.00ns,   0.00ns]   0.00ns   0.00ns   0.00ns         0 [  0.00ns,   0.00ns]   0.00ns   0.00ns   0.00ns
              'fj_long_lin_perturb':         0 [  0.00ns,   0.00ns]   0.00ns   0.00ns   0.00ns         0 [  0.00ns,   0.00ns]   0.00ns   0.00ns   0.00ns
               'fj_long_lin_random':         0 [  0.00ns,   0.00ns]   0.00ns   0.00ns   0.00ns         0 [  0.00ns,   0.00ns]   0.00ns   0.00ns   0.00ns
                  'fj_long_perturb':         0 [  0.00ns,   0.00ns]   0.00ns   0.00ns   0.00ns         0 [  0.00ns,   0.00ns]   0.00ns   0.00ns   0.00ns
                   'fj_long_random':         0 [  0.00ns,   0.00ns]   0.00ns   0.00ns   0.00ns         0 [  0.00ns,   0.00ns]   0.00ns   0.00ns   0.00ns
                 'fj_short_default':         0 [  0.00ns,   0.00ns]   0.00ns   0.00ns   0.00ns         0 [  0.00ns,   0.00ns]   0.00ns   0.00ns   0.00ns
                 'fj_short_default':         1 [104.73ms, 104.73ms] 104.73ms   0.00ns 104.73ms         1 [ 61.48ms,  61.48ms]  61.48ms   0.00ns  61.48ms
             'fj_short_lin_default':         0 [  0.00ns,   0.00ns]   0.00ns   0.00ns   0.00ns         0 [  0.00ns,   0.00ns]   0.00ns   0.00ns   0.00ns
             'fj_short_lin_default':         0 [  0.00ns,   0.00ns]   0.00ns   0.00ns   0.00ns         0 [  0.00ns,   0.00ns]   0.00ns   0.00ns   0.00ns
             'fj_short_lin_perturb':         0 [  0.00ns,   0.00ns]   0.00ns   0.00ns   0.00ns         0 [  0.00ns,   0.00ns]   0.00ns   0.00ns   0.00ns
              'fj_short_lin_random':         0 [  0.00ns,   0.00ns]   0.00ns   0.00ns   0.00ns         0 [  0.00ns,   0.00ns]   0.00ns   0.00ns   0.00ns
                 'fj_short_perturb':         0 [  0.00ns,   0.00ns]   0.00ns   0.00ns   0.00ns         0 [  0.00ns,   0.00ns]   0.00ns   0.00ns   0.00ns
                  'fj_short_random':         0 [  0.00ns,   0.00ns]   0.00ns   0.00ns   0.00ns         0 [  0.00ns,   0.00ns]   0.00ns   0.00ns   0.00ns
                        'fs_random':         1 [ 17.61ms,  17.61ms]  17.61ms   0.00ns  17.61ms         1 [ 20.00ns,  20.00ns]  20.00ns   0.00ns  20.00ns
                        'fs_random':         1 [ 18.11ms,  18.11ms]  18.11ms   0.00ns  18.11ms         1 [ 20.00ns,  20.00ns]  20.00ns   0.00ns  20.00ns
                        'fs_random':         1 [ 18.81ms,  18.81ms]  18.81ms   0.00ns  18.81ms         1 [ 20.00ns,  20.00ns]  20.00ns   0.00ns  20.00ns
                        'fs_random':         1 [ 19.56ms,  19.56ms]  19.56ms   0.00ns  19.56ms         1 [ 20.00ns,  20.00ns]  20.00ns   0.00ns  20.00ns
                  'fs_random_no_lp':         1 [ 15.34ms,  15.34ms]  15.34ms   0.00ns  15.34ms         0 [  0.00ns,   0.00ns]   0.00ns   0.00ns   0.00ns
                  'fs_random_no_lp':         1 [ 16.01ms,  16.01ms]  16.01ms   0.00ns  16.01ms         0 [  0.00ns,   0.00ns]   0.00ns   0.00ns   0.00ns
                  'fs_random_no_lp':         1 [ 16.76ms,  16.76ms]  16.76ms   0.00ns  16.76ms         0 [  0.00ns,   0.00ns]   0.00ns   0.00ns   0.00ns
                  'fs_random_no_lp':         1 [ 17.33ms,  17.33ms]  17.33ms   0.00ns  17.33ms         0 [  0.00ns,   0.00ns]   0.00ns   0.00ns   0.00ns
          'fs_random_quick_restart':         1 [ 17.31ms,  17.31ms]  17.31ms   0.00ns  17.31ms         1 [ 20.00ns,  20.00ns]  20.00ns   0.00ns  20.00ns
          'fs_random_quick_restart':         1 [ 17.95ms,  17.95ms]  17.95ms   0.00ns  17.95ms         1 [ 20.00ns,  20.00ns]  20.00ns   0.00ns  20.00ns
          'fs_random_quick_restart':         1 [ 18.73ms,  18.73ms]  18.73ms   0.00ns  18.73ms         1 [ 20.00ns,  20.00ns]  20.00ns   0.00ns  20.00ns
          'fs_random_quick_restart':         1 [ 19.32ms,  19.32ms]  19.32ms   0.00ns  19.32ms         1 [ 20.00ns,  20.00ns]  20.00ns   0.00ns  20.00ns
    'fs_random_quick_restart_no_lp':         1 [ 16.16ms,  16.16ms]  16.16ms   0.00ns  16.16ms         0 [  0.00ns,   0.00ns]   0.00ns   0.00ns   0.00ns
    'fs_random_quick_restart_no_lp':         1 [ 16.34ms,  16.34ms]  16.34ms   0.00ns  16.34ms         0 [  0.00ns,   0.00ns]   0.00ns   0.00ns   0.00ns
    'fs_random_quick_restart_no_lp':         1 [ 17.11ms,  17.11ms]  17.11ms   0.00ns  17.11ms         0 [  0.00ns,   0.00ns]   0.00ns   0.00ns   0.00ns
                    'graph_arc_lns':        52 [  3.24ms,    1.88s] 785.11ms 534.31ms   40.83s        48 [ 10.00ns, 125.03ms]  60.98ms  42.16ms    2.93s
                    'graph_cst_lns':        52 [  1.16ms,  97.78ms]   4.46ms  13.87ms 231.73ms         1 [ 10.00ns,  10.00ns]  10.00ns   0.00ns  10.00ns
                    'graph_dec_lns':        52 [  3.87ms,    2.05s] 726.51ms 565.23ms   37.78s        47 [ 10.00ns, 130.41ms]  56.48ms  46.05ms    2.65s
                    'graph_var_lns':        52 [  2.95ms,    1.75s] 646.43ms 550.10ms   33.61s        48 [ 10.00ns, 148.78ms]  49.92ms  46.15ms    2.40s
                   'lb_tree_search':         1 [   8.01s,    8.01s]    8.01s   0.00ns    8.01s         1 [   1.36s,    1.36s]    1.36s   0.00ns    1.36s
                           'max_lp':         1 [   8.02s,    8.02s]    8.02s   0.00ns    8.02s         1 [   1.37s,    1.37s]    1.37s   0.00ns    1.37s
                            'no_lp':         1 [   8.01s,    8.01s]    8.01s   0.00ns    8.01s         1 [849.56ms, 849.56ms] 849.56ms   0.00ns 849.56ms
              'objective_lb_search':         1 [   8.01s,    8.01s]    8.01s   0.00ns    8.01s         1 [824.23ms, 824.23ms] 824.23ms   0.00ns 824.23ms
       'objective_lb_search_max_lp':         1 [   8.01s,    8.01s]    8.01s   0.00ns    8.01s         1 [   1.56s,    1.56s]    1.56s   0.00ns    1.56s
        'objective_lb_search_no_lp':         1 [   8.01s,    8.01s]    8.01s   0.00ns    8.01s         1 [774.49ms, 774.49ms] 774.49ms   0.00ns 774.49ms
  'objective_shaving_search_max_lp':        50 [ 16.42ms, 631.75ms] 144.52ms 134.40ms    7.23s        31 [453.33us,  60.68ms]   6.86ms  12.08ms 212.65ms
   'objective_shaving_search_no_lp':        50 [ 16.78ms, 644.96ms] 142.48ms 137.26ms    7.12s        33 [ 15.68us,  39.10ms]   8.00ms   9.80ms 264.04ms
                          'probing':         1 [   8.02s,    8.02s]    8.02s   0.00ns    8.02s         1 [471.29ms, 471.29ms] 471.29ms   0.00ns 471.29ms
                   'probing_max_lp':         1 [   8.02s,    8.02s]    8.02s   0.00ns    8.02s         1 [658.15ms, 658.15ms] 658.15ms   0.00ns 658.15ms
                     'pseudo_costs':         1 [   8.02s,    8.02s]    8.02s   0.00ns    8.02s         1 [   1.28s,    1.28s]    1.28s   0.00ns    1.28s
                    'quick_restart':         1 [   8.02s,    8.02s]    8.02s   0.00ns    8.02s         1 [   1.07s,    1.07s]    1.07s   0.00ns    1.07s
              'quick_restart_no_lp':         1 [   8.02s,    8.02s]    8.02s   0.00ns    8.02s         1 [818.00ms, 818.00ms] 818.00ms   0.00ns 818.00ms
                    'reduced_costs':         1 [   8.02s,    8.02s]    8.02s   0.00ns    8.02s         1 [832.29ms, 832.29ms] 832.29ms   0.00ns 832.29ms
                        'rins/rens':        53 [182.05us,    1.73s] 714.64ms 532.94ms   37.88s        45 [ 10.00ns, 153.74ms]  67.96ms  42.56ms    3.06s
                      'rnd_cst_lns':        52 [  1.27ms,    1.57s] 646.55ms 491.02ms   33.62s        43 [ 10.00ns, 189.38ms]  55.93ms  46.95ms    2.40s
                      'rnd_var_lns':        52 [  2.87ms,    1.65s] 662.06ms 524.76ms   34.43s        48 [ 10.00ns, 198.09ms]  54.88ms  47.86ms    2.63s
                     'violation_ls':        51 [227.31us, 235.67ms] 131.62ms  70.50ms    6.71s        51 [810.00ns,  71.12ms]  48.28ms  22.27ms    2.46s
                     'violation_ls':        52 [195.12us, 245.44ms]  91.61ms  58.46ms    4.76s        52 [450.00ns, 113.92ms]  52.76ms  33.14ms    2.74s
                     'violation_ls':        52 [205.67us, 277.02ms] 108.78ms  70.09ms    5.66s        52 [780.00ns,  90.97ms]  56.92ms  32.79ms    2.96s
                     'violation_ls':        52 [254.29us, 205.39ms] 101.75ms  54.81ms    5.29s        52 [450.00ns,  59.47ms]  45.41ms  20.66ms    2.36s
                     'violation_ls':        52 [289.00us, 258.28ms]  99.51ms  58.79ms    5.17s        52 [710.00ns, 106.14ms]  55.21ms  33.10ms    2.87s

Search stats                        Bools  Conflicts  Branches  Restarts  BoolPropag  IntegerPropag
                           'core':  1'670      4'169    28'440     8'152   3'828'644      2'189'773
                     'default_lp':     65      3'407    16'729     3'579      88'112      1'803'922
                      'fs_random':     65          0         2         2           0              6
                      'fs_random':     65          0         2         2           0              6
                      'fs_random':     65          0        58        58          24            471
                      'fs_random':     65          0        78        78          24            719
                'fs_random_no_lp':     65          0       104       104          24          1'057
                'fs_random_no_lp':     65          0       104       104          24          1'057
                'fs_random_no_lp':     65          0         2         2           0              6
                'fs_random_no_lp':     65          0        38        38          24            201
        'fs_random_quick_restart':     65          0       130       130          24          1'343
        'fs_random_quick_restart':     65          0        44        44          24            283
        'fs_random_quick_restart':     65          0        44        44          24            283
        'fs_random_quick_restart':     65          0         8         8           6             30
  'fs_random_quick_restart_no_lp':     65          0       143       130          28          1'414
  'fs_random_quick_restart_no_lp':     65          0        44        44          24            283
  'fs_random_quick_restart_no_lp':     65          0        78        78          24            719
                 'lb_tree_search':     65         36     6'994     1'437      10'084        200'552
                         'max_lp':     65      1'262    12'422     3'207      44'629      1'026'135
                          'no_lp':    252      9'212    24'280     3'865     593'707      3'559'570
            'objective_lb_search':     92      2'020     9'934     3'130      50'104        899'419
     'objective_lb_search_max_lp':     78      1'159     6'241     1'885      30'998        575'997
      'objective_lb_search_no_lp':    160     10'077    21'538     2'440     231'168      3'472'284
                        'probing':    147         33       261       261         614          5'231
                 'probing_max_lp':    147         39       255       255         790          6'622
                   'pseudo_costs':     65      1'692    10'876     2'673      47'704      1'007'472
                  'quick_restart':     65        576    20'461     7'377      46'935      1'107'208
            'quick_restart_no_lp':    461      7'828    34'196     3'325     801'507      2'824'075
                  'reduced_costs':    770      1'621    13'429     2'911     503'287        918'218

SAT stats                           ClassicMinim  LitRemoved  LitLearned  LitForgotten  Subsumed  MClauses  MDecisions  MLitTrue  MSubsumed  MLitRemoved  MReused
                           'core':         3'173      11'343      18'204             0       107     3'600      17'703         0        263          804       56
                     'default_lp':         2'154       4'306      28'313             0       187     1'673      11'397         0        518        2'922      231
                      'fs_random':             0           0           0             0         0         0           0         0          0            0        0
                      'fs_random':             0           0           0             0         0         0           0         0          0            0        0
                      'fs_random':             0           0           0             0         0         0           0         0          0            0        0
                      'fs_random':             0           0           0             0         0         0           0         0          0            0        0
                'fs_random_no_lp':             0           0           0             0         0         0           0         0          0            0        0
                'fs_random_no_lp':             0           0           0             0         0         0           0         0          0            0        0
                'fs_random_no_lp':             0           0           0             0         0         0           0         0          0            0        0
                'fs_random_no_lp':             0           0           0             0         0         0           0         0          0            0        0
        'fs_random_quick_restart':             0           0           0             0         0         0           0         0          0            0        0
        'fs_random_quick_restart':             0           0           0             0         0         0           0         0          0            0        0
        'fs_random_quick_restart':             0           0           0             0         0         0           0         0          0            0        0
        'fs_random_quick_restart':             0           0           0             0         0         0           0         0          0            0        0
  'fs_random_quick_restart_no_lp':             0           0           0             0         0         0           0         0          0            0        0
  'fs_random_quick_restart_no_lp':             0           0           0             0         0         0           0         0          0            0        0
  'fs_random_quick_restart_no_lp':             0           0           0             0         0         0           0         0          0            0        0
                 'lb_tree_search':             8          10         197             0         1       230       1'172         0          5           21        2
                         'max_lp':           684       1'588      12'195             0        92     1'053       8'666         0        120          703      273
                          'no_lp':         7'198      23'658      71'730             0       297     1'990      10'791         1      1'154        7'061      191
            'objective_lb_search':         1'535       3'622      14'720             0       115       657       4'395         0        115          641      159
     'objective_lb_search_max_lp':           783       1'746       8'740             0        80       361       2'771         0         55          352       82
      'objective_lb_search_no_lp':         8'120      26'296      66'494             0       353     1'040       7'703         0        424        2'472      226
                        'probing':             0           0          33             0         0         0           0         0          0            0        0
                 'probing_max_lp':             0           0          39             0         0         0           0         0          0            0        0
                   'pseudo_costs':           991       2'725      16'570             0       103       862       6'928         0        100          611      216
                  'quick_restart':           235         378       5'298             0        52     2'357      14'460         0         61          295      576
            'quick_restart_no_lp':         5'404      18'420      84'076             0       187     1'133       9'746         0        336        2'184      113
                  'reduced_costs':           987       2'214      11'954             0        43     1'281       7'402         0        422        2'188      283

Lp stats                         Component  Iterations  AddedCuts  OPTIMAL  DUAL_F.  DUAL_U.
                  'default_lp':          1      22'552      4'083    4'092        0        0
                   'fs_random':          1           0          0        0        0        0
                   'fs_random':          1           0          0        0        0        0
                   'fs_random':          1           0          0        0        0        0
                   'fs_random':          1           0          0        0        0        0
     'fs_random_quick_restart':          1           0          0        0        0        0
     'fs_random_quick_restart':          1           0          0        0        0        0
     'fs_random_quick_restart':          1           0          0        0        0        0
     'fs_random_quick_restart':          1           0          0        0        0        0
              'lb_tree_search':          1      40'812      3'721    2'577      853        0
                      'max_lp':          1      29'372      4'453    1'893      423        0
         'objective_lb_search':          1      20'421      4'102    2'620        0        0
  'objective_lb_search_max_lp':          1      38'172      3'425    1'748      594        1
                     'probing':          1       2'201      5'131      453        0        0
              'probing_max_lp':          1       3'230      3'925      566        6        0
                'pseudo_costs':          1      35'256      3'847    2'486      623        1
               'quick_restart':          1      14'921      6'832    1'631        0        0
               'reduced_costs':          1      14'243      4'208    1'812      276        0

Lp dimension                                                                     Final dimension of first component
                  'default_lp':  427 rows, 163 columns, 3064 entries with magnitude in [4.243656e-04, 1.000000e+00]
                   'fs_random':       0 rows, 163 columns, 0 entries with magnitude in [0.000000e+00, 0.000000e+00]
                   'fs_random':       0 rows, 163 columns, 0 entries with magnitude in [0.000000e+00, 0.000000e+00]
                   'fs_random':       0 rows, 163 columns, 0 entries with magnitude in [0.000000e+00, 0.000000e+00]
                   'fs_random':       0 rows, 163 columns, 0 entries with magnitude in [0.000000e+00, 0.000000e+00]
     'fs_random_quick_restart':       0 rows, 163 columns, 0 entries with magnitude in [0.000000e+00, 0.000000e+00]
     'fs_random_quick_restart':       0 rows, 163 columns, 0 entries with magnitude in [0.000000e+00, 0.000000e+00]
     'fs_random_quick_restart':       0 rows, 163 columns, 0 entries with magnitude in [0.000000e+00, 0.000000e+00]
     'fs_random_quick_restart':       0 rows, 163 columns, 0 entries with magnitude in [0.000000e+00, 0.000000e+00]
              'lb_tree_search':  651 rows, 175 columns, 2634 entries with magnitude in [5.799719e-04, 1.000000e+00]
                      'max_lp':  783 rows, 175 columns, 3697 entries with magnitude in [7.609722e-04, 1.000000e+00]
         'objective_lb_search':  513 rows, 163 columns, 3194 entries with magnitude in [1.590632e-04, 1.000000e+00]
  'objective_lb_search_max_lp':  625 rows, 175 columns, 2778 entries with magnitude in [5.659439e-04, 1.000000e+00]
                     'probing':  509 rows, 163 columns, 6506 entries with magnitude in [1.196936e-05, 1.000000e+00]
              'probing_max_lp':  459 rows, 175 columns, 5137 entries with magnitude in [1.251460e-03, 1.000000e+00]
                'pseudo_costs':  633 rows, 175 columns, 2721 entries with magnitude in [1.895314e-03, 1.000000e+00]
               'quick_restart':  480 rows, 163 columns, 2941 entries with magnitude in [6.079875e-04, 1.000000e+00]
               'reduced_costs':  442 rows, 175 columns, 2122 entries with magnitude in [1.719823e-03, 1.000000e+00]

Lp debug                         CutPropag  CutEqPropag  Adjust  Overflow      Bad  BadScaling
                  'default_lp':          2            7   1'445         0   16'478           0
                   'fs_random':          0            0       0         0        0           0
                   'fs_random':          0            0       0         0        0           0
                   'fs_random':          0            0       0         0        0           0
                   'fs_random':          0            0       0         0        0           0
     'fs_random_quick_restart':          0            0       0         0        0           0
     'fs_random_quick_restart':          0            0       0         0        0           0
     'fs_random_quick_restart':          0            0       0         0        0           0
     'fs_random_quick_restart':          0            0       0         0        0           0
              'lb_tree_search':         26            1   2'038         0   13'282           0
                      'max_lp':         30            0   1'342         0   22'950           0
         'objective_lb_search':          1           28   1'198         0   19'142           0
  'objective_lb_search_max_lp':         28            1   1'369         0   20'377           0
                     'probing':          0           13     383         0  138'923           0
              'probing_max_lp':         24           27     523         0  164'556           0
                'pseudo_costs':         21            1   1'747         0   18'945           0
               'quick_restart':         16           48   1'082         0   36'851           0
               'reduced_costs':         29            1   1'061         0   28'334           0

Lp pool                          Constraints  Updates  Simplif  Merged  Shortened  Split  Strenghtened     Cuts/Call
                  'default_lp':        4'234      555    3'412      43        596  1'011         1'599   4'083/7'715
                   'fs_random':          194        0        0       0          0      0             0           0/0
                   'fs_random':          194        0        0       0          0      0             0           0/0
                   'fs_random':          194        0        0       0          0      0             7           0/0
                   'fs_random':          194        0        0       0          0      0             7           0/0
     'fs_random_quick_restart':          194        0        0       0          0      0             0           0/0
     'fs_random_quick_restart':          194        0        0       0          0      0             0           0/0
     'fs_random_quick_restart':          194        0        0       0          0      0             0           0/0
     'fs_random_quick_restart':          194        0        0       0          0      0             7           0/0
              'lb_tree_search':        5'214      442   11'568      13      1'675    181        11'718   3'721/7'332
                      'max_lp':        5'946      667   19'049      13      2'431    573        14'771   4'453/8'476
         'objective_lb_search':        4'294      809    3'145       2        786  1'330         1'834   4'102/7'345
  'objective_lb_search_max_lp':        4'922      516   16'283       9      1'838    307        12'317   3'425/6'484
                     'probing':        5'323      321      129       2          0  1'353           325   5'131/8'355
              'probing_max_lp':        5'428      394    7'642       3          0    776         6'740   3'925/7'772
                'pseudo_costs':        5'326      500   12'950      27        729    301        11'560   3'847/6'908
               'quick_restart':        7'015    1'618    5'886      11      1'811  2'502         2'646  6'832/10'116
               'reduced_costs':        5'690      615   18'136      24      1'628    539        14'309   4'208/8'164

Lp Cut            defaul  max_lp  quick_  reduce  pseudo  lb_tre  probin  object  probin  object
          CG_FF:     311     348     598     262     265     339     250     377     285     183
           CG_K:     155     142     354     116      69     109     212     270      98      45
           CG_R:     258     221     862     160      82     181     433     375     200      70
          CG_RB:   1'178   1'058   1'792     790     678   1'031   1'601   1'024     777     638
         CG_RBP:     176     121     762      68      54      89     293      74      75      62
         Clique:       -      30       -      31      26      29       -       -       2      32
             IB:     354     164     314     255     257     170     207     300      89     258
       MIR_1_FF:     134     265     250     263     260     233     152     194     208     244
        MIR_1_K:      46      51      65      63      44      60      12      46      19      42
       MIR_1_KL:       -       -       1       -       -       -       -       -       -       -
        MIR_1_R:      50      23      87      30      14      14      81      54      28      21
       MIR_1_RB:     224     361     232     398     395     292     335     197     276     348
      MIR_1_RBP:      15      38      74      44      69      38      66       4      48      45
      MIR_1_RLT:       -       4       -       3       3       1       -       -       3       1
       MIR_2_FF:      85     131     142     138     129     109     108     115      94      99
        MIR_2_K:      28      35      40      34      37      28      35      28      28      22
        MIR_2_R:      41      85      67      74      60      51      79      46      76      64
       MIR_2_RB:     157     186     148     166     160     137     251     132     132     135
      MIR_2_RBP:      15      17      35      22      41      15      50       7      19      20
       MIR_3_FF:      67      77      81      85      86      58      80      79      45      73
        MIR_3_K:      27      33      31      29      35      29      29      24      21      26
        MIR_3_R:      57      40      68      52      46      28      58      50      38      38
       MIR_3_RB:     101      99     132     105     108      70     133     107      70     109
      MIR_3_RBP:      11      16      30      11      25       5      24       7      15      13
       MIR_4_FF:      35      45      67      47      48      29      51      46      20      34
        MIR_4_K:      15      17      23      11      23      11      26      17      10      10
        MIR_4_R:      25      28      52      29      23      19      38      35      12      25
       MIR_4_RB:      63      48      77      58      71      32      79      70      33      39
      MIR_4_RBP:       4       4      13       6      10       5      14       2       7       6
       MIR_5_FF:      15      21      31      14      16      12      26      23       6      15
        MIR_5_K:       8       3      12       8      16      10      11       7       5       5
        MIR_5_R:      16      13      25      12       8       2      20      24      11       4
       MIR_5_RB:      36      25      35      26      21      12      28      38       9      23
      MIR_5_RBP:       7       3      13       6       8       1       7       7       4       -
       MIR_6_FF:       9       5       7       6      10       4      19      15       2       3
        MIR_6_K:       2       2       4       1       -       5      15       8       -       3
        MIR_6_R:      18       2       9       5       7       -      12      13       1       1
       MIR_6_RB:      16       9      22      10      11       4      22      23       6       8
      MIR_6_RBP:       3       1       4       3       4       1       2       4       -       -
   ZERO_HALF_FF:      48      57      38      60      67      67      31      46      44      51
    ZERO_HALF_K:       8      13       7      13       6      19      11      19       8      13
    ZERO_HALF_R:     158     461     137     510     372     241      89     129     956     439
   ZERO_HALF_RB:      92     131      62     146     139     114     112      55     129     132
  ZERO_HALF_RBP:      15      20      29      38      44      17      29      11      16      26

LNS stats           Improv/Calls  Closed  Difficulty  TimeLimit
  'graph_arc_lns':          9/52     54%        0.97       0.10
  'graph_cst_lns':           0/1    100%        0.71       0.10
  'graph_dec_lns':          6/51     53%        0.97       0.10
  'graph_var_lns':          8/51     57%        0.98       0.10
      'rins/rens':         11/50     52%        0.94       0.10
    'rnd_cst_lns':          3/47     55%        0.97       0.10
    'rnd_var_lns':          7/52     56%        0.98       0.10

LS stats                   Batches  Restarts  LinMoves  GenMoves  CompoundMoves  WeightUpdates
       'fj_long_default':        0         0         0         0              0              0
       'fj_long_default':        0         0         0         0              0              0
   'fj_long_lin_default':        0         0         0         0              0              0
   'fj_long_lin_perturb':        0         0         0         0              0              0
    'fj_long_lin_random':        0         0         0         0              0              0
       'fj_long_perturb':        0         0         0         0              0              0
        'fj_long_random':        0         0         0         0              0              0
      'fj_short_default':        0         0         0         0              0              0
      'fj_short_default':        1         1         0     4'187            430              3
  'fj_short_lin_default':        0         0         0         0              0              0
  'fj_short_lin_default':        0         0         0         0              0              0
  'fj_short_lin_perturb':        0         0         0         0              0              0
   'fj_short_lin_random':        0         0         0         0              0              0
      'fj_short_perturb':        0         0         0         0              0              0
       'fj_short_random':        0         0         0         0              0              0
          'violation_ls':       51         0   380'707    13'463            442         38'087
          'violation_ls':       52         0   258'701    50'586          2'175        121'970
          'violation_ls':       52         0   281'997     7'122            486        138'107
          'violation_ls':       52         0   294'472    14'152            917        102'963
          'violation_ls':       52         0     9'331   242'559         17'307          1'380

Solutions (50)            Num     Rank
        'graph_arc_lns':    2    [8,9]
        'graph_dec_lns':    3  [41,50]
        'graph_var_lns':    1  [20,20]
                'no_lp':    3    [1,3]
  'quick_restart_no_lp':   13   [4,46]
          'rnd_var_lns':    1  [19,19]
         'violation_ls':   27  [10,49]

Objective bounds                     Num
                  'initial_domain':    1
             'objective_lb_search':    1
       'objective_lb_search_no_lp':   52
  'objective_shaving_search_no_lp':    4

Solution repositories    Added  Queried  Ignored  Synchro
  'feasible solutions':    316    1'027        4      268
        'lp solutions':     71       25        0       65
                'pump':  1'077       27

Improving bounds shared            Num
                        'core':     80
                  'default_lp':     22
              'lb_tree_search':     13
                      'max_lp':     91
                       'no_lp':    276
         'objective_lb_search':      2
  'objective_lb_search_max_lp':     49
   'objective_lb_search_no_lp':    215
                     'probing':      3
              'probing_max_lp':     20
                'pseudo_costs':     49
               'quick_restart':     21
         'quick_restart_no_lp':  2'029
               'reduced_costs':     71

Clauses shared                   Num
                        'core':    1
                  'default_lp':   21
              'lb_tree_search':    6
                       'no_lp':   69
         'objective_lb_search':    7
  'objective_lb_search_max_lp':    9
                'pseudo_costs':    9
               'quick_restart':    3
         'quick_restart_no_lp':   13
               'reduced_costs':    2

CpSolverResponse summary:
status: OPTIMAL
objective: 625
best_bound: 625
integers: 164
booleans: 65
conflicts: 0
branches: 104
propagations: 24
integer_propagations: 1057
restarts: 104
lp_iterations: 0
walltime: 8.22798
usertime: 8.22798
deterministic_time: 45.3621
gap_integral: 140.129
solution_fingerprint: 0x7bcd5dea66c4ee2a


--- Simulation Gantt  partir du modle mathmatique ---
{'big':0, 'due_date':113, 'pos_time':5, 'status':0, 'blocked':0, 'operations':["{'type':0, 'processing_time':20}", "{'type':1, 'processing_time':15}"]}
{'big':1, 'due_date':100, 'pos_time':5, 'status':0, 'blocked':0, 'operations':["{'type':1, 'processing_time':16}"]}
{'big':0, 'due_date':89, 'pos_time':5, 'status':0, 'blocked':0, 'operations':["{'type':1, 'processing_time':27}"]}
{'big':1, 'due_date':104, 'pos_time':5, 'status':0, 'blocked':0, 'operations':["{'type':0, 'processing_time':48}"]}
{'big':0, 'due_date':95, 'pos_time':5, 'status':0, 'blocked':0, 'operations':["{'type':1, 'processing_time':27}"]}
{'big':0, 'due_date':178, 'pos_time':5, 'status':0, 'blocked':0, 'operations':["{'type':0, 'processing_time':47}", "{'type':1, 'processing_time':55}"]}
{'big':0, 'due_date':65, 'pos_time':5, 'status':0, 'blocked':0, 'operations':["{'type':0, 'processing_time':38}", "{'type':1, 'processing_time':57}"]}
