created virtual environment CPython3.12.4.final.0-64 in 9549ms
  creator CPython3Posix(dest=/localscratch/aneumann.63393212.0/env, clear=False, no_vcs_ignore=False, global=False)
  seeder FromAppData(download=False, pip=bundle, via=copy, app_data_dir=/home/aneumann/.local/share/virtualenv)
    added seed packages: pip==25.1.1
  activators BashActivator,CShellActivator,FishActivator,NushellActivator,PowerShellActivator,PythonActivator
Looking in links: /cvmfs/soft.computecanada.ca/custom/python/wheelhouse/gentoo2023/x86-64-v3, /cvmfs/soft.computecanada.ca/custom/python/wheelhouse/gentoo2023/generic, /cvmfs/soft.computecanada.ca/custom/python/wheelhouse/generic
Requirement already satisfied: pip in /localscratch/aneumann.63393212.0/env/lib/python3.12/site-packages (25.1.1)
Looking in links: /cvmfs/soft.computecanada.ca/custom/python/wheelhouse/gentoo2023/x86-64-v3, /cvmfs/soft.computecanada.ca/custom/python/wheelhouse/gentoo2023/generic, /cvmfs/soft.computecanada.ca/custom/python/wheelhouse/generic
ERROR: protobuf-5.28.3-cp38-abi3-manylinux2014_x86_64.whl is not a supported wheel on this platform.
Looking in links: /cvmfs/soft.computecanada.ca/custom/python/wheelhouse/gentoo2023/x86-64-v3, /cvmfs/soft.computecanada.ca/custom/python/wheelhouse/gentoo2023/generic, /cvmfs/soft.computecanada.ca/custom/python/wheelhouse/generic
Processing /home/aneumann/projects/def-adhaj/aneumann/GNRS/wheels/immutabledict-4.2.0-py3-none-any.whl
Installing collected packages: immutabledict
Successfully installed immutabledict-4.2.0
Looking in links: /cvmfs/soft.computecanada.ca/custom/python/wheelhouse/gentoo2023/x86-64-v3, /cvmfs/soft.computecanada.ca/custom/python/wheelhouse/gentoo2023/generic, /cvmfs/soft.computecanada.ca/custom/python/wheelhouse/generic
Processing /cvmfs/soft.computecanada.ca/custom/python/wheelhouse/generic/ortools-9.10.4067+computecanada-cp312-cp312-linux_x86_64.whl (from -r /home/aneumann/projects/def-adhaj/aneumann/GNRS/requirements/or.txt (line 1))
Processing /cvmfs/soft.computecanada.ca/custom/python/wheelhouse/gentoo2023/x86-64-v3/matplotlib-3.10.0+computecanada-cp312-cp312-linux_x86_64.whl (from -r /home/aneumann/projects/def-adhaj/aneumann/GNRS/requirements/or.txt (line 2))
Processing /cvmfs/soft.computecanada.ca/custom/python/wheelhouse/gentoo2023/x86-64-v3/pandas-2.2.3+computecanada-cp312-cp312-linux_x86_64.whl (from -r /home/aneumann/projects/def-adhaj/aneumann/GNRS/requirements/or.txt (line 3))
Processing /cvmfs/soft.computecanada.ca/custom/python/wheelhouse/generic/absl_py-2.2.2+computecanada-py3-none-any.whl (from ortools<9.11,>=9.10->-r /home/aneumann/projects/def-adhaj/aneumann/GNRS/requirements/or.txt (line 1))
Processing /cvmfs/soft.computecanada.ca/custom/python/wheelhouse/gentoo2023/generic/numpy-2.2.2+computecanada-cp312-cp312-linux_x86_64.whl (from ortools<9.11,>=9.10->-r /home/aneumann/projects/def-adhaj/aneumann/GNRS/requirements/or.txt (line 1))
Processing /cvmfs/soft.computecanada.ca/custom/python/wheelhouse/gentoo2023/x86-64-v3/protobuf-6.30.2+computecanada-cp312-cp312-linux_x86_64.whl (from ortools<9.11,>=9.10->-r /home/aneumann/projects/def-adhaj/aneumann/GNRS/requirements/or.txt (line 1))
Requirement already satisfied: immutabledict>=3.0.0 in /localscratch/aneumann.63393212.0/env/lib/python3.12/site-packages (from ortools<9.11,>=9.10->-r /home/aneumann/projects/def-adhaj/aneumann/GNRS/requirements/or.txt (line 1)) (4.2.0)
Processing /cvmfs/soft.computecanada.ca/custom/python/wheelhouse/gentoo2023/generic/contourpy-1.3.1+computecanada-cp312-cp312-linux_x86_64.whl (from matplotlib->-r /home/aneumann/projects/def-adhaj/aneumann/GNRS/requirements/or.txt (line 2))
Processing /cvmfs/soft.computecanada.ca/custom/python/wheelhouse/generic/cycler-0.12.1+computecanada-py3-none-any.whl (from matplotlib->-r /home/aneumann/projects/def-adhaj/aneumann/GNRS/requirements/or.txt (line 2))
Processing /cvmfs/soft.computecanada.ca/custom/python/wheelhouse/generic/fonttools-4.58.2+computecanada-cp312-cp312-linux_x86_64.whl (from matplotlib->-r /home/aneumann/projects/def-adhaj/aneumann/GNRS/requirements/or.txt (line 2))
Processing /cvmfs/soft.computecanada.ca/custom/python/wheelhouse/gentoo2023/x86-64-v3/kiwisolver-1.4.8+computecanada-cp312-cp312-linux_x86_64.whl (from matplotlib->-r /home/aneumann/projects/def-adhaj/aneumann/GNRS/requirements/or.txt (line 2))
Processing /cvmfs/soft.computecanada.ca/custom/python/wheelhouse/generic/packaging-25.0+computecanada-py3-none-any.whl (from matplotlib->-r /home/aneumann/projects/def-adhaj/aneumann/GNRS/requirements/or.txt (line 2))
Processing /cvmfs/soft.computecanada.ca/custom/python/wheelhouse/gentoo2023/x86-64-v3/pillow-11.1.0+computecanada-cp312-cp312-linux_x86_64.whl (from matplotlib->-r /home/aneumann/projects/def-adhaj/aneumann/GNRS/requirements/or.txt (line 2))
Processing /cvmfs/soft.computecanada.ca/custom/python/wheelhouse/generic/pyparsing-3.2.1+computecanada-py3-none-any.whl (from matplotlib->-r /home/aneumann/projects/def-adhaj/aneumann/GNRS/requirements/or.txt (line 2))
Processing /cvmfs/soft.computecanada.ca/custom/python/wheelhouse/generic/python_dateutil-2.9.0.post0+computecanada-py2.py3-none-any.whl (from matplotlib->-r /home/aneumann/projects/def-adhaj/aneumann/GNRS/requirements/or.txt (line 2))
Processing /cvmfs/soft.computecanada.ca/custom/python/wheelhouse/generic/pytz-2025.2+computecanada-py2.py3-none-any.whl (from pandas->-r /home/aneumann/projects/def-adhaj/aneumann/GNRS/requirements/or.txt (line 3))
Processing /cvmfs/soft.computecanada.ca/custom/python/wheelhouse/generic/tzdata-2025.2+computecanada-py2.py3-none-any.whl (from pandas->-r /home/aneumann/projects/def-adhaj/aneumann/GNRS/requirements/or.txt (line 3))
Processing /cvmfs/soft.computecanada.ca/custom/python/wheelhouse/generic/six-1.17.0+computecanada-py2.py3-none-any.whl (from python-dateutil>=2.7->matplotlib->-r /home/aneumann/projects/def-adhaj/aneumann/GNRS/requirements/or.txt (line 2))
Installing collected packages: pytz, tzdata, six, pyparsing, protobuf, pillow, packaging, numpy, kiwisolver, fonttools, cycler, absl-py, python-dateutil, contourpy, pandas, matplotlib, ortools

Successfully installed absl-py-2.2.2+computecanada contourpy-1.3.1+computecanada cycler-0.12.1+computecanada fonttools-4.58.2+computecanada kiwisolver-1.4.8+computecanada matplotlib-3.10.0+computecanada numpy-2.2.2+computecanada ortools-9.10.4067+computecanada packaging-25.0+computecanada pandas-2.2.3+computecanada pillow-11.1.0+computecanada protobuf-6.30.2+computecanada pyparsing-3.2.1+computecanada python-dateutil-2.9.0.post0+computecanada pytz-2025.2+computecanada six-1.17.0+computecanada tzdata-2025.2+computecanada

Starting CP-SAT solver v9.10.4067
Parameters: max_time_in_seconds: 3600 max_memory_in_mb: 12000 log_search_progress: true enumerate_all_solutions: false absolute_gap_limit: 0 relative_gap_limit: 0
Setting number of workers to 48

Initial optimization model '': (model_fingerprint: 0x633510ea1c4f83c5)
#Variables: 265 (#ints: 8 in objective)
  - 182 Booleans in [0,1]
  - 83 in [0,651]
#kLinear1: 37
#kLinear2: 431
#kLinear3: 153
#kLinearN: 1'955 (#terms: 23'368)

Starting presolve at 0.00s
  1.13e-03s  0.00e+00d  [DetectDominanceRelations] 
  2.69e-02s  0.00e+00d  [PresolveToFixPoint] #num_loops=6 #num_dual_strengthening=3 
  2.79e-05s  0.00e+00d  [ExtractEncodingFromLinear] #potential_supersets=3 
[Symmetry] Graph for symmetry has 2'285 nodes and 15'093 arcs.
[Symmetry] Symmetry computation done. time: 0.00165899 dtime: 0.00146522
[Symmetry] #generators: 1, average support size: 20
[Symmetry] The model contains 227 duplicate constraints !
[Symmetry] 10 orbits with sizes: 2,2,2,2,2,2,2,2,2,2
[Symmetry] Num fixable by intersecting at_most_one with orbits: 1 largest_orbit: 2
  6.20e-03s  7.80e-04d  [Probe] #probed=244 #fixed_bools=3 #new_bounds=17 #equiv=1 
  5.67e-05s  0.00e+00d  [MaxClique] Merged 38(76 literals) into 13(26 literals) at_most_ones. 
  7.93e-04s  0.00e+00d  [DetectDominanceRelations] 
  1.23e-02s  0.00e+00d  [PresolveToFixPoint] #num_loops=4 #num_dual_strengthening=3 
  3.38e-03s  0.00e+00d  [ProcessAtMostOneAndLinear] 
  1.93e-03s  0.00e+00d  [DetectDuplicateConstraints] #duplicates=278 #without_enforcements=183 
  1.11e-03s  4.18e-05d  [DetectDominatedLinearConstraints] #relevant_constraints=1'214 #num_inclusions=695 #num_redundant=1 
  2.53e-04s  0.00e+00d  [DetectDifferentVariables] #different=37 
  3.14e-04s  1.41e-05d  [ProcessSetPPC] #relevant_constraints=833 
  2.32e-05s  0.00e+00d  [FindAlmostIdenticalLinearConstraints] 
  9.60e-05s  6.97e-05d  [FindBigAtMostOneAndLinearOverlap] 
  3.08e-03s  9.69e-04d  [FindBigVerticalLinearOverlap] #blocks=19 #saved_nz=1'489 
  1.76e-04s  3.56e-05d  [FindBigHorizontalLinearOverlap] #linears=805 
  9.98e-06s  0.00e+00d  [MergeClauses] 
  1.13e-03s  0.00e+00d  [DetectDominanceRelations] 
  1.42e-02s  0.00e+00d  [PresolveToFixPoint] #num_loops=2 #num_dual_strengthening=1 
  1.13e-03s  0.00e+00d  [DetectDominanceRelations] 
  8.99e-03s  0.00e+00d  [PresolveToFixPoint] #num_loops=1 #num_dual_strengthening=1 
[Symmetry] Graph for symmetry has 2'011 nodes and 12'386 arcs.
[Symmetry] Symmetry computation done. time: 0.000525499 dtime: 0.00072617
  5.68e-03s  7.32e-04d  [Probe] #probed=238 #new_bounds=20 
  1.06e-05s  0.00e+00d  [MaxClique] 
  1.12e-03s  0.00e+00d  [DetectDominanceRelations] 
  1.37e-02s  0.00e+00d  [PresolveToFixPoint] #num_loops=2 #num_dual_strengthening=1 
  3.10e-03s  0.00e+00d  [ProcessAtMostOneAndLinear] 
  1.64e-03s  0.00e+00d  [DetectDuplicateConstraints] #without_enforcements=205 
  8.97e-04s  3.34e-05d  [DetectDominatedLinearConstraints] #relevant_constraints=1'122 #num_inclusions=494 
  2.49e-04s  0.00e+00d  [DetectDifferentVariables] #different=39 #cliques=1 #size=3 
  2.96e-04s  1.04e-05d  [ProcessSetPPC] #relevant_constraints=752 
  2.75e-05s  0.00e+00d  [FindAlmostIdenticalLinearConstraints] 
  7.71e-05s  4.70e-05d  [FindBigAtMostOneAndLinearOverlap] 
  2.47e-03s  7.60e-04d  [FindBigVerticalLinearOverlap] #blocks=15 #saved_nz=1'113 
  1.47e-04s  2.75e-05d  [FindBigHorizontalLinearOverlap] #linears=702 
  9.68e-06s  0.00e+00d  [MergeClauses] 
  1.11e-03s  0.00e+00d  [DetectDominanceRelations] 
  1.31e-02s  0.00e+00d  [PresolveToFixPoint] #num_loops=2 #num_dual_strengthening=1 
  1.11e-03s  0.00e+00d  [DetectDominanceRelations] 
  9.24e-03s  0.00e+00d  [PresolveToFixPoint] #num_loops=1 #num_dual_strengthening=1 
  5.71e-03s  7.31e-04d  [Probe] #probed=238 #new_bounds=9 
  1.05e-05s  0.00e+00d  [MaxClique] 
  1.11e-03s  0.00e+00d  [DetectDominanceRelations] 
  1.14e-02s  0.00e+00d  [PresolveToFixPoint] #num_loops=2 #num_dual_strengthening=1 
  2.76e-03s  0.00e+00d  [ProcessAtMostOneAndLinear] 
  1.62e-03s  0.00e+00d  [DetectDuplicateConstraints] #without_enforcements=209 
  6.08e-04s  2.29e-05d  [DetectDominatedLinearConstraints] #relevant_constraints=988 #num_inclusions=176 
  1.52e-04s  0.00e+00d  [DetectDifferentVariables] 
  2.51e-04s  8.10e-06d  [ProcessSetPPC] #relevant_constraints=693 
  2.94e-05s  4.50e-08d  [FindAlmostIdenticalLinearConstraints] #num_tested_pairs=3 
  6.68e-05s  3.57e-05d  [FindBigAtMostOneAndLinearOverlap] 
  1.59e-03s  5.93e-04d  [FindBigVerticalLinearOverlap] #blocks=5 #saved_nz=307 
  1.40e-04s  2.53e-05d  [FindBigHorizontalLinearOverlap] #linears=659 
  9.75e-06s  0.00e+00d  [MergeClauses] 
  1.08e-03s  0.00e+00d  [DetectDominanceRelations] 
  9.88e-03s  0.00e+00d  [PresolveToFixPoint] #num_loops=2 #num_dual_strengthening=1 
  5.52e-05s  0.00e+00d  [ExpandObjective] #entries=132 #tight_variables=56 #tight_constraints=34 

Presolve summary:
  - 50 affine relations were detected.
  - rule 'TODO dual: only one blocking constraint?' was applied 544 times.
  - rule 'TODO dual: only one unspecified blocking constraint?' was applied 104 times.
  - rule 'TODO duplicate: identical constraint with different enforcements' was applied 597 times.
  - rule 'TODO no_overlap: with task always last' was applied 1 time.
  - rule 'affine: new relation' was applied 50 times.
  - rule 'all_diff: inferred from x != y constraints' was applied 1 time.
  - rule 'at_most_one: removed literals' was applied 13 times.
  - rule 'at_most_one: size one' was applied 13 times.
  - rule 'at_most_one: transformed into max clique.' was applied 1 time.
  - rule 'deductions: 195 stored' was applied 1 time.
  - rule 'dual: fix variable' was applied 21 times.
  - rule 'dual: reduced domain' was applied 39 times.
  - rule 'duplicate: merged rhs of linear constraint' was applied 53 times.
  - rule 'duplicate: removed constraint' was applied 278 times.
  - rule 'enforcement: false literal' was applied 20 times.
  - rule 'enforcement: true literal' was applied 12 times.
  - rule 'exactly_one: x and not(x)' was applied 1 time.
  - rule 'incompatible linear: add implication' was applied 45 times.
  - rule 'linear inclusion: redundant containing constraint' was applied 1 time.
  - rule 'linear matrix: common vertical rectangle' was applied 39 times.
  - rule 'linear: always true' was applied 696 times.
  - rule 'linear: doubleton free' was applied 10 times.
  - rule 'linear: empty' was applied 28 times.
  - rule 'linear: extracted enforcement literal' was applied 4'192 times.
  - rule 'linear: fixed or dup variables' was applied 2'016 times.
  - rule 'linear: positive equal one' was applied 3 times.
  - rule 'linear: reduced variable domains' was applied 136 times.
  - rule 'linear: remapped using affine relations' was applied 1'897 times.
  - rule 'linear: simplified rhs' was applied 6'159 times.
  - rule 'linear: variable substitution 1' was applied 10 times.
  - rule 'linear: variable substitution 2' was applied 1 time.
  - rule 'presolve: 83 unused variables removed.' was applied 1 time.
  - rule 'presolve: iteration' was applied 3 times.
  - rule 'probing: reduced enforced constraint to implication.' was applied 38 times.
  - rule 'probing: simplified enforcement list.' was applied 2 times.
  - rule 'symmetry: fixed to false in general orbit' was applied 1 time.

Presolved optimization model '': (model_fingerprint: 0x4e0650b3420097d)
#Variables: 160 (#ints: 8 in objective)
  - 59 Booleans in [0,1]
  - 1 in [-1864,-1362][-1299,-711][-648,-60][3,591 ... 1242][1305,1893][1956,2544][2607,3195][3258,3722]
  - 1 in [-1226,-732][-648,-81][3,570][654,1221][1305,1782]
  - 1 in [-1226,-715][-648,-64][3,587][654,1238][1305,1765]
  - 1 in [-1217,-715][-648,-64][3,587][654,1238][1305,1765]
  - 1 in [-1203,-714][-648,-63][3,588][654,1239][1305,1890][1956,2541][2607,3192][3258,3719]
  - 3 in [-651,-75][0,576]
  - 3 in [-651,-66][0,585]
  - 1 in [-645,-81][3,570][654,1131]
  - 1 in [-586,-61][65,590][716,1241][1367,1892][2018,2543][2669,3194][3320,3783]
  - 1 in [-582,-81][3,570][654,1221][1305,1782]
  - 1 in [-575,-64][3,587][654,1238][1305,1823]
  - 1 in [-562,-60][3,591][654,1242][1305,1893][1956,2544][2607,3195][3258,3846][3909,4463]
  - 1 in [-2,526]
  - 1 in [-2,585]
  - 1 in [0,460]
  - 1 in [0,469]
  - 4 in [0,498]
  - 2 in [0,501]
  - 2 in [0,502]
  - 1 in [0,515]
  - 3 in [0,525]
  - 1 in [0,525][651,1176]
  - 2 in [0,567]
  - 3 in [0,576]
  - 1 in [0,584]
  - 3 in [0,585]
  - 1 in [0,587]
  - 1 in [0,588]
  - 1 in [3,528]
  - 1 in [3,570]
  - 1 in [3,570][654,1215]
  - 1 in [3,579]
  - 1 in [3,579][654,1224]
  - 1 in [3,587]
  - 1 in [3,587][654,1238]
  - 1 in [3,588]
  - 1 in [3,588][654,1239]
  - 1 in [3,590]
  - 1 in [3,591]
  - 1 in [3,591][654,1242]
  - 1 in [8,593]
  - 1 in [14,601]
  - 1 in [15,591]
  - 1 in [15,599]
  - 1 in [20,596]
  - 1 in [46,613]
  - 1 in [51,618]
  - 2 in [53,640]
  - 2 in [55,640]
  - 2 in [56,640]
  - 1 in [59,646]
  - 1 in [61,646]
  - 1 in [62,646]
  - 1 in [65,579][654,1230][1305,1875]
  - 1 in [65,590]
  - 1 in [65,590][716,1241][1367,1830]
  - 1 in [65,590][716,1241][1367,1892][2018,2481]
  - 1 in [65,590][716,1241][1367,1892][2018,2543][2669,3132]
  - 1 in [69,587][654,1238][1305,1823]
  - 2 in [73,640]
  - 1 in [79,646]
  - 1 in [85,579][654,1230][1305,1881][1956,2526]
  - 1 in [85,588][654,1239][1305,1856]
  - 1 in [85,588][654,1239][1305,1890][1956,2479]
  - 1 in [85,588][654,1239][1305,1890][1956,2541][2607,3130]
  - 1 in [89,591][654,1242][1305,1859]
  - 1 in [89,591][654,1242][1305,1893][1956,2478]
  - 1 in [89,591][654,1242][1305,1893][1956,2544][2607,3071]
  - 3 in [125,640]
  - 1 in [131,646]
  - 6 in [142,640]
  - 2 in [148,646]
  - 1 in [153,651]
#kAllDiff: 1
#kExactlyOne: 2 (#literals: 6)
#kLinear2: 626 (#enforced: 571 #multi: 490)
#kLinear3: 122 (#enforced: 64)
#kLinearN: 743 (#enforced: 689) (#terms: 5'391)

Preloading model.
#Bound   0.18s best:inf   next:[190,4455] initial_domain
#Model   0.18s var:160/160 constraints:1494/1494

Starting search at 0.18s with 48 workers.
16 full problem subsolvers: [core, default_lp, lb_tree_search, max_lp, no_lp, objective_lb_search, objective_lb_search_max_lp, objective_lb_search_no_lp, objective_shaving_search_max_lp, objective_shaving_search_no_lp, probing, probing_max_lp, pseudo_costs, quick_restart, quick_restart_no_lp, reduced_costs]
30 first solution subsolvers: [fj_long_default(2), fj_long_lin_default, fj_long_lin_perturb, fj_long_lin_random, fj_long_perturb, fj_long_random, fj_short_default(2), fj_short_lin_default(2), fj_short_lin_perturb, fj_short_lin_random, fj_short_perturb, fj_short_random, fs_random(4), fs_random_no_lp(4), fs_random_quick_restart(4), fs_random_quick_restart_no_lp(3)]
13 incomplete subsolvers: [feasibility_pump, graph_arc_lns, graph_cst_lns, graph_dec_lns, graph_var_lns, rins/rens, rnd_cst_lns, rnd_var_lns, violation_ls(5)]
3 helper subsolvers: [neighborhood_helper, synchronization_agent, update_gap_integral]
#Bound   0.20s best:inf   next:[191,4455] bool_core (num_cores=1 [size:1 mw:1] a=8 d=0 fixed=0/67 clauses=2)
#Bound   0.20s best:inf   next:[192,4455] objective_lb_search_no_lp
#1       0.20s best:2007  next:[192,2006] no_lp (fixed_bools=0/83)
#Bound   0.21s best:2007  next:[233,2006] objective_lb_search_no_lp
#2       0.21s best:1828  next:[233,1827] no_lp (fixed_bools=0/96)
#Bound   0.21s best:1828  next:[235,1827] objective_lb_search_no_lp
#Bound   0.21s best:1828  next:[239,1827] objective_lb_search_no_lp
#Bound   0.21s best:1828  next:[240,1827] objective_lb_search_no_lp
#Bound   0.21s best:1828  next:[277,1827] objective_lb_search_no_lp
#Bound   0.21s best:1828  next:[278,1827] objective_lb_search_no_lp
#Bound   0.21s best:1828  next:[292,1827] objective_lb_search_no_lp
#3       0.21s best:1820  next:[292,1819] no_lp (fixed_bools=0/107)
#Bound   0.21s best:1820  next:[315,1819] objective_lb_search_no_lp
#Bound   0.22s best:1820  next:[316,1819] objective_lb_search_no_lp
#4       0.22s best:1817  next:[316,1816] no_lp (fixed_bools=0/113)
#Bound   0.22s best:1817  next:[322,1816] objective_lb_search_no_lp
#Bound   0.22s best:1817  next:[326,1816] objective_lb_search_no_lp
#5       0.22s best:1804  next:[326,1803] no_lp (fixed_bools=0/119)
#6       0.22s best:1750  next:[326,1749] quick_restart_no_lp (fixed_bools=0/114)
#7       0.22s best:1749  next:[326,1748] violation_ls(batch:2 #solutions_imported:2 #lin_moves:24 #lin_evals:2'960 #gen_moves:1'459 #gen_evals:158 #comp_moves:97 #backtracks:681 #weight_updates:38)
#Bound   0.22s best:1749  next:[500,1748] objective_lb_search_no_lp
#8       0.23s best:1748  next:[500,1747] violation_ls(batch:3 #solutions_imported:3 #lin_moves:24 #lin_evals:3'349 #gen_moves:1'652 #gen_evals:167 #comp_moves:106 #backtracks:773 #weight_updates:38)
#9       0.23s best:1747  next:[500,1746] violation_ls(batch:4 #solutions_imported:4 #lin_moves:32 #lin_evals:3'392 #gen_moves:1'652 #gen_evals:167 #comp_moves:106 #backtracks:773 #weight_updates:45)
#10      0.23s best:1740  next:[500,1739] no_lp (fixed_bools=0/126)
#11      0.23s best:1739  next:[500,1738] violation_ls(batch:5 #solutions_imported:5 #lin_moves:95 #lin_evals:3'679 #gen_moves:1'652 #gen_evals:167 #comp_moves:106 #backtracks:773 #weight_updates:75)
#12      0.23s best:1738  next:[500,1737] violation_ls(batch:6 #solutions_imported:6 #lin_moves:95 #lin_evals:4'174 #gen_moves:1'913 #gen_evals:214 #comp_moves:113 #backtracks:900 #weight_updates:78)
#13      0.23s best:1737  next:[500,1736] violation_ls(batch:7 #solutions_imported:7 #lin_moves:95 #lin_evals:4'218 #gen_moves:1'934 #gen_evals:216 #comp_moves:114 #backtracks:910 #weight_updates:78)
#14      0.24s best:1725  next:[500,1724] no_lp (fixed_bools=0/137)
#15      0.24s best:1704  next:[500,1703] rnd_var_lns (d=0.88 s=87 t=0.10 p=1.00 stall=3 h=auto_l0)
#16      0.25s best:1579  next:[500,1578] no_lp (fixed_bools=0/165)
#17      0.27s best:1555  next:[500,1554] no_lp (fixed_bools=0/182)
#Bound   0.28s best:1555  next:[502,1554] objective_lb_search_no_lp
#Bound   0.28s best:1555  next:[510,1554] objective_lb_search_no_lp
#18      0.29s best:1542  next:[510,1541] no_lp (fixed_bools=0/192)
#Bound   0.30s best:1542  next:[565,1541] objective_lb_search_no_lp
#19      0.36s best:1538  next:[565,1537] no_lp (fixed_bools=0/207)
#20      0.36s best:1532  next:[565,1531] no_lp (fixed_bools=0/217)
#21      0.37s best:1494  next:[565,1493] no_lp (fixed_bools=0/229)
#22      0.40s best:1493  next:[565,1492] no_lp (fixed_bools=0/256)
#23      0.41s best:1492  next:[565,1491] quick_restart_no_lp (fixed_bools=0/226)
#24      0.41s best:1490  next:[565,1489] violation_ls(batch:3 #solutions_imported:3 #lin_moves:0 #lin_evals:36'693 #gen_moves:18'773 #gen_evals:1'969 #comp_moves:876 #backtracks:8'947 #weight_updates:186)
#25      0.41s best:1489  next:[565,1488] violation_ls(batch:4 #solutions_imported:4 #lin_moves:0 #lin_evals:36'697 #gen_moves:18'775 #gen_evals:1'969 #comp_moves:878 #backtracks:8'947 #weight_updates:186)
#26      0.41s best:1488  next:[565,1487] violation_ls(batch:5 #solutions_imported:5 #lin_moves:0 #lin_evals:36'699 #gen_moves:18'776 #gen_evals:1'969 #comp_moves:879 #backtracks:8'947 #weight_updates:186)
#27      0.41s best:1486  next:[565,1485] violation_ls(batch:6 #solutions_imported:6 #lin_moves:0 #lin_evals:36'703 #gen_moves:18'777 #gen_evals:1'969 #comp_moves:880 #backtracks:8'947 #weight_updates:186)
#28      0.41s best:1484  next:[565,1483] violation_ls(batch:7 #solutions_imported:7 #lin_moves:1 #lin_evals:36'711 #gen_moves:18'777 #gen_evals:1'969 #comp_moves:880 #backtracks:8'947 #weight_updates:186)
#29      0.41s best:1483  next:[565,1482] violation_ls(batch:8 #solutions_imported:8 #lin_moves:1 #lin_evals:36'716 #gen_moves:18'779 #gen_evals:1'969 #comp_moves:882 #backtracks:8'947 #weight_updates:186)
#30      0.41s best:1482  next:[565,1481] violation_ls(batch:9 #solutions_imported:9 #lin_moves:2 #lin_evals:36'723 #gen_moves:18'779 #gen_evals:1'969 #comp_moves:882 #backtracks:8'947 #weight_updates:186)
#31      0.41s best:1480  next:[565,1479] violation_ls(batch:10 #solutions_imported:10 #lin_moves:2 #lin_evals:36'725 #gen_moves:18'780 #gen_evals:1'969 #comp_moves:883 #backtracks:8'947 #weight_updates:186)
#32      0.41s best:1478  next:[565,1477] violation_ls(batch:11 #solutions_imported:11 #lin_moves:3 #lin_evals:36'733 #gen_moves:18'780 #gen_evals:1'969 #comp_moves:883 #backtracks:8'947 #weight_updates:186)
#33      0.41s best:1476  next:[565,1475] violation_ls(batch:12 #solutions_imported:12 #lin_moves:3 #lin_evals:36'736 #gen_moves:18'781 #gen_evals:1'969 #comp_moves:884 #backtracks:8'947 #weight_updates:186)
#34      0.41s best:1474  next:[565,1473] violation_ls(batch:13 #solutions_imported:13 #lin_moves:4 #lin_evals:36'743 #gen_moves:18'781 #gen_evals:1'969 #comp_moves:884 #backtracks:8'947 #weight_updates:186)
#35      0.41s best:1473  next:[565,1472] violation_ls(batch:14 #solutions_imported:14 #lin_moves:4 #lin_evals:36'757 #gen_moves:18'789 #gen_evals:1'969 #comp_moves:886 #backtracks:8'950 #weight_updates:186)
#36      0.43s best:1377  next:[565,1376] graph_cst_lns (d=0.50 s=189 t=0.10 p=0.00 stall=0 h=auto_l0) [presolve]
#37      0.46s best:1376  next:[565,1375] quick_restart_no_lp (fixed_bools=0/242)
#38      0.46s best:1375  next:[565,1374] violation_ls(batch:10 #solutions_imported:10 #lin_moves:9'453 #lin_evals:69'530 #gen_moves:10'771 #gen_evals:1'253 #comp_moves:570 #backtracks:5'096 #weight_updates:789)
#39      0.46s best:1374  next:[565,1373] violation_ls(batch:11 #solutions_imported:11 #lin_moves:9'454 #lin_evals:69'537 #gen_moves:10'771 #gen_evals:1'253 #comp_moves:570 #backtracks:5'096 #weight_updates:789)
#40      0.47s best:1373  next:[565,1372] violation_ls(batch:12 #solutions_imported:12 #lin_moves:9'539 #lin_evals:69'959 #gen_moves:10'771 #gen_evals:1'253 #comp_moves:570 #backtracks:5'096 #weight_updates:865)
#41      0.47s best:1372  next:[565,1371] violation_ls(batch:13 #solutions_imported:13 #lin_moves:9'539 #lin_evals:69'963 #gen_moves:10'772 #gen_evals:1'253 #comp_moves:571 #backtracks:5'096 #weight_updates:865)
#42      0.47s best:1371  next:[565,1370] violation_ls(batch:14 #solutions_imported:14 #lin_moves:9'539 #lin_evals:70'019 #gen_moves:10'806 #gen_evals:1'253 #comp_moves:573 #backtracks:5'112 #weight_updates:865)
#43      0.47s best:1370  next:[565,1369] violation_ls(batch:15 #solutions_imported:15 #lin_moves:9'539 #lin_evals:70'022 #gen_moves:10'807 #gen_evals:1'253 #comp_moves:574 #backtracks:5'112 #weight_updates:865)
#44      0.48s best:1369  next:[565,1368] violation_ls(batch:15 #solutions_imported:15 #lin_moves:4 #lin_evals:36'830 #gen_moves:18'825 #gen_evals:1'972 #comp_moves:888 #backtracks:8'967 #weight_updates:186)
#45      0.48s best:1335  next:[565,1334] quick_restart_no_lp (fixed_bools=0/251)
#46      0.52s best:1330  next:[565,1329] quick_restart_no_lp (fixed_bools=0/263)
#47      0.52s best:1329  next:[565,1328] quick_restart_no_lp (fixed_bools=0/266)
#Bound   0.53s best:1329  next:[581,1328] objective_lb_search_no_lp
#48      0.53s best:1324  next:[581,1323] quick_restart_no_lp (fixed_bools=0/268)
#49      0.53s best:1322  next:[581,1321] violation_ls(batch:6 #solutions_imported:6 #lin_moves:10'073 #lin_evals:90'783 #gen_moves:21'112 #gen_evals:1'807 #comp_moves:555 #backtracks:10'275 #weight_updates:10'154)
#50      0.54s best:1320  next:[581,1319] violation_ls(batch:7 #solutions_imported:7 #lin_moves:10'074 #lin_evals:90'791 #gen_moves:21'112 #gen_evals:1'807 #comp_moves:555 #backtracks:10'275 #weight_updates:10'154)
#51      0.54s best:1319  next:[581,1318] violation_ls(batch:8 #solutions_imported:8 #lin_moves:10'075 #lin_evals:90'799 #gen_moves:21'112 #gen_evals:1'807 #comp_moves:555 #backtracks:10'275 #weight_updates:10'154)
#52      0.54s best:1318  next:[581,1317] violation_ls(batch:9 #solutions_imported:9 #lin_moves:10'117 #lin_evals:90'957 #gen_moves:21'112 #gen_evals:1'807 #comp_moves:555 #backtracks:10'275 #weight_updates:10'175)
#Bound   0.55s best:1318  next:[597,1317] objective_lb_search_no_lp
#53      0.55s best:1317  next:[597,1316] violation_ls(batch:10 #solutions_imported:10 #lin_moves:10'117 #lin_evals:90'961 #gen_moves:21'113 #gen_evals:1'807 #comp_moves:556 #backtracks:10'275 #weight_updates:10'175)
#54      0.56s best:1316  next:[597,1315] violation_ls(batch:11 #solutions_imported:11 #lin_moves:10'225 #lin_evals:91'464 #gen_moves:21'113 #gen_evals:1'807 #comp_moves:556 #backtracks:10'275 #weight_updates:10'276)
#Bound   0.57s best:1316  next:[598,1315] objective_lb_search_no_lp
#55      0.57s best:1315  next:[598,1314] violation_ls(batch:12 #solutions_imported:12 #lin_moves:10'225 #lin_evals:91'481 #gen_moves:21'122 #gen_evals:1'810 #comp_moves:557 #backtracks:10'279 #weight_updates:10'276)
#56      0.57s best:1314  next:[598,1313] violation_ls(batch:13 #solutions_imported:13 #lin_moves:10'225 #lin_evals:91'486 #gen_moves:21'124 #gen_evals:1'810 #comp_moves:559 #backtracks:10'279 #weight_updates:10'276)
#57      0.57s best:1313  next:[598,1312] violation_ls(batch:14 #solutions_imported:14 #lin_moves:10'226 #lin_evals:91'494 #gen_moves:21'124 #gen_evals:1'810 #comp_moves:559 #backtracks:10'279 #weight_updates:10'276)
#58      0.57s best:1312  next:[598,1311] violation_ls(batch:15 #solutions_imported:15 #lin_moves:10'226 #lin_evals:91'543 #gen_moves:21'154 #gen_evals:1'813 #comp_moves:561 #backtracks:10'293 #weight_updates:10'276)
#59      0.59s best:1311  next:[598,1310] violation_ls(batch:6 #solutions_imported:6 #lin_moves:5'553 #lin_evals:86'808 #gen_moves:27'806 #gen_evals:2'480 #comp_moves:1'021 #backtracks:13'387 #weight_updates:5'331)
#60      0.60s best:1310  next:[598,1309] violation_ls(batch:7 #solutions_imported:7 #lin_moves:5'553 #lin_evals:86'841 #gen_moves:27'824 #gen_evals:2'484 #comp_moves:1'023 #backtracks:13'395 #weight_updates:5'331)
#61      0.60s best:1309  next:[598,1308] violation_ls(batch:8 #solutions_imported:8 #lin_moves:5'554 #lin_evals:86'848 #gen_moves:27'824 #gen_evals:2'484 #comp_moves:1'023 #backtracks:13'395 #weight_updates:5'331)
#62      0.60s best:1308  next:[598,1307] violation_ls(batch:9 #solutions_imported:9 #lin_moves:5'636 #lin_evals:87'228 #gen_moves:27'824 #gen_evals:2'484 #comp_moves:1'023 #backtracks:13'395 #weight_updates:5'406)
#63      0.60s best:1307  next:[598,1306] violation_ls(batch:10 #solutions_imported:10 #lin_moves:5'636 #lin_evals:87'245 #gen_moves:27'833 #gen_evals:2'487 #comp_moves:1'024 #backtracks:13'399 #weight_updates:5'406)
#64      0.60s best:1306  next:[598,1305] violation_ls(batch:11 #solutions_imported:11 #lin_moves:5'688 #lin_evals:87'493 #gen_moves:27'833 #gen_evals:2'487 #comp_moves:1'024 #backtracks:13'399 #weight_updates:5'455)
#65      0.60s best:1305  next:[598,1304] violation_ls(batch:12 #solutions_imported:12 #lin_moves:5'689 #lin_evals:87'501 #gen_moves:27'833 #gen_evals:2'487 #comp_moves:1'024 #backtracks:13'399 #weight_updates:5'455)
#66      0.60s best:1304  next:[598,1303] violation_ls(batch:13 #solutions_imported:13 #lin_moves:5'689 #lin_evals:87'504 #gen_moves:27'835 #gen_evals:2'487 #comp_moves:1'026 #backtracks:13'399 #weight_updates:5'455)
#67      0.60s best:1303  next:[598,1302] violation_ls(batch:14 #solutions_imported:14 #lin_moves:5'690 #lin_evals:87'512 #gen_moves:27'835 #gen_evals:2'487 #comp_moves:1'026 #backtracks:13'399 #weight_updates:5'455)
#68      0.61s best:1302  next:[598,1301] violation_ls(batch:15 #solutions_imported:15 #lin_moves:5'690 #lin_evals:87'548 #gen_moves:27'853 #gen_evals:2'491 #comp_moves:1'028 #backtracks:13'407 #weight_updates:5'455)
#69      0.61s best:1301  next:[598,1300] violation_ls(batch:16 #solutions_imported:16 #lin_moves:10'226 #lin_evals:91'577 #gen_moves:21'171 #gen_evals:1'813 #comp_moves:562 #backtracks:10'301 #weight_updates:10'276)
#70      0.61s best:1300  next:[598,1299] violation_ls(batch:16 #solutions_imported:16 #lin_moves:5'690 #lin_evals:87'607 #gen_moves:27'887 #gen_evals:2'495 #comp_moves:1'030 #backtracks:13'423 #weight_updates:5'455)
#71      0.61s best:1299  next:[598,1298] violation_ls(batch:16 #solutions_imported:16 #lin_moves:9'540 #lin_evals:70'030 #gen_moves:10'807 #gen_evals:1'253 #comp_moves:574 #backtracks:5'112 #weight_updates:865)
#72      0.61s best:1298  next:[598,1297] violation_ls(batch:16 #solutions_imported:16 #lin_moves:90 #lin_evals:37'170 #gen_moves:18'825 #gen_evals:1'972 #comp_moves:888 #backtracks:8'967 #weight_updates:226)
#73      0.62s best:1297  next:[598,1296] violation_ls(batch:6 #solutions_imported:6 #lin_moves:28'181 #lin_evals:151'918 #gen_moves:5'504 #gen_evals:418 #comp_moves:320 #backtracks:2'592 #weight_updates:1'896)
#74      0.62s best:1296  next:[598,1295] violation_ls(batch:7 #solutions_imported:7 #lin_moves:28'181 #lin_evals:151'954 #gen_moves:5'528 #gen_evals:418 #comp_moves:322 #backtracks:2'603 #weight_updates:1'896)
#75      0.62s best:1295  next:[598,1294] violation_ls(batch:8 #solutions_imported:8 #lin_moves:28'181 #lin_evals:151'983 #gen_moves:5'545 #gen_evals:418 #comp_moves:323 #backtracks:2'611 #weight_updates:1'896)
#76      0.62s best:1294  next:[600,1293] violation_ls(batch:9 #solutions_imported:9 #lin_moves:28'181 #lin_evals:152'023 #gen_moves:5'573 #gen_evals:422 #comp_moves:325 #backtracks:2'624 #weight_updates:1'896)
#77      0.64s best:1293  next:[600,1292] violation_ls(batch:10 #solutions_imported:10 #lin_moves:28'181 #lin_evals:152'027 #gen_moves:5'574 #gen_evals:422 #comp_moves:326 #backtracks:2'624 #weight_updates:1'896)
#78      0.66s best:1292  next:[602,1291] violation_ls(batch:11 #solutions_imported:11 #lin_moves:28'183 #lin_evals:152'041 #gen_moves:5'574 #gen_evals:422 #comp_moves:326 #backtracks:2'624 #weight_updates:1'897)
#79      0.66s best:1291  next:[602,1290] violation_ls(batch:12 #solutions_imported:12 #lin_moves:28'183 #lin_evals:152'045 #gen_moves:5'575 #gen_evals:422 #comp_moves:327 #backtracks:2'624 #weight_updates:1'897)
#80      0.67s best:1290  next:[602,1289] violation_ls(batch:13 #solutions_imported:13 #lin_moves:28'183 #lin_evals:152'114 #gen_moves:5'615 #gen_evals:426 #comp_moves:329 #backtracks:2'643 #weight_updates:1'897)
#81      0.67s best:1289  next:[602,1288] violation_ls(batch:14 #solutions_imported:14 #lin_moves:28'184 #lin_evals:152'122 #gen_moves:5'615 #gen_evals:426 #comp_moves:329 #backtracks:2'643 #weight_updates:1'897)
#82      0.67s best:1288  next:[602,1287] violation_ls(batch:15 #solutions_imported:15 #lin_moves:28'184 #lin_evals:152'201 #gen_moves:5'655 #gen_evals:430 #comp_moves:331 #backtracks:2'662 #weight_updates:1'897)
#83      0.68s best:1287  next:[602,1286] violation_ls(batch:16 #solutions_imported:16 #lin_moves:28'185 #lin_evals:152'207 #gen_moves:5'655 #gen_evals:430 #comp_moves:331 #backtracks:2'662 #weight_updates:1'897)
#84      0.73s best:1280  next:[629,1279] quick_restart_no_lp (fixed_bools=0/270)
#85      0.74s best:1183  next:[629,1182] graph_var_lns (d=0.99 s=209 t=0.10 p=1.00 stall=1 h=auto_l0)
#86      0.96s best:1106  next:[704,1105] graph_arc_lns (d=0.99 s=253 t=0.10 p=1.00 stall=1 h=auto_l0)
#87      0.97s best:1105  next:[704,1104] violation_ls(batch:17 #solutions_imported:17 #lin_moves:90 #lin_evals:37'363 #gen_moves:18'909 #gen_evals:1'980 #comp_moves:892 #backtracks:9'007 #weight_updates:226)
#88      0.97s best:1104  next:[704,1103] violation_ls(batch:17 #solutions_imported:17 #lin_moves:28'188 #lin_evals:152'225 #gen_moves:5'655 #gen_evals:430 #comp_moves:331 #backtracks:2'662 #weight_updates:1'899)
#Bound   0.98s best:1104  next:[706,1103] objective_lb_search_no_lp [skipped_logs=13]
#89      1.07s best:1103  next:[729,1102] violation_ls(batch:18 #solutions_imported:18 #lin_moves:15'213 #lin_evals:115'023 #gen_moves:21'171 #gen_evals:1'813 #comp_moves:562 #backtracks:10'301 #weight_updates:15'370)
#90      1.07s best:1102  next:[729,1101] violation_ls(batch:18 #solutions_imported:18 #lin_moves:15'137 #lin_evals:139'172 #gen_moves:27'924 #gen_evals:2'498 #comp_moves:1'033 #backtracks:13'440 #weight_updates:6'008)
#91      1.07s best:1101  next:[729,1100] violation_ls(batch:18 #solutions_imported:18 #lin_moves:142 #lin_evals:37'616 #gen_moves:18'909 #gen_evals:1'980 #comp_moves:892 #backtracks:9'007 #weight_updates:276)
#92      1.07s best:1100  next:[729,1099] violation_ls(batch:18 #solutions_imported:18 #lin_moves:28'203 #lin_evals:152'292 #gen_moves:5'655 #gen_evals:430 #comp_moves:331 #backtracks:2'662 #weight_updates:1'907)
#93      1.14s best:1099  next:[735,1098] violation_ls(batch:18 #solutions_imported:18 #lin_moves:9'540 #lin_evals:92'734 #gen_moves:21'847 #gen_evals:2'106 #comp_moves:877 #backtracks:10'480 #weight_updates:992)
#94      1.17s best:1098  next:[745,1097] violation_ls(batch:19 #solutions_imported:19 #lin_moves:15'230 #lin_evals:115'110 #gen_moves:21'171 #gen_evals:1'813 #comp_moves:562 #backtracks:10'301 #weight_updates:15'385)
#95      1.17s best:1097  next:[745,1096] violation_ls(batch:19 #solutions_imported:19 #lin_moves:15'137 #lin_evals:139'374 #gen_moves:28'016 #gen_evals:2'506 #comp_moves:1'037 #backtracks:13'484 #weight_updates:6'008)
#96      1.17s best:1096  next:[745,1095] violation_ls(batch:19 #solutions_imported:19 #lin_moves:9'561 #lin_evals:92'817 #gen_moves:21'847 #gen_evals:2'106 #comp_moves:877 #backtracks:10'480 #weight_updates:1'003)
#97      1.18s best:1095  next:[745,1094] violation_ls(batch:19 #solutions_imported:19 #lin_moves:142 #lin_evals:39'430 #gen_moves:19'821 #gen_evals:2'078 #comp_moves:928 #backtracks:9'445 #weight_updates:291)
#98      1.24s best:1091  next:[745,1090] rnd_cst_lns (d=0.99 s=274 t=0.10 p=1.00 stall=2 h=auto_l0)
#Bound   1.83s best:1091  next:[827,1090] objective_lb_search_no_lp [skipped_logs=11]
#Model   2.92s var:158/160 constraints:1305/1494
#Bound   2.41s best:1091  next:[872,1090] objective_lb_search_no_lp [skipped_logs=1]
#Model   3.66s var:157/160 constraints:1274/1494
#Bound   4.00s best:1091  next:[934,1090] objective_lb_search_no_lp [skipped_logs=6]
#Model   4.04s var:156/160 constraints:1253/1494
#Model   4.40s var:155/160 constraints:1243/1494
#Model   4.79s var:153/160 constraints:1172/1494
#Model   4.85s var:152/160 constraints:1069/1494
#Model   4.89s var:150/160 constraints:1021/1494
#Model   4.93s var:149/160 constraints:1007/1494
#Model   4.94s var:147/160 constraints:977/1494
#Model   4.98s var:146/160 constraints:934/1494
#Bound   4.99s best:1091  next:[976,1090] objective_lb_search_no_lp [skipped_logs=9]
#Model   5.15s var:142/160 constraints:759/1494
#Model   5.21s var:141/160 constraints:707/1494
#Model   5.27s var:136/160 constraints:586/1494
#Done    5.27s objective_lb_search_no_lp
#Done    5.27s objective_lb_search_max_lp
#Model   5.28s var:135/160 constraints:556/1494
#Done    5.28s core
#Done    5.28s reduced_costs
#Model   5.28s var:126/160 constraints:385/1494
#Bound   5.27s best:1091  next:[1060,1090] objective_lb_search_no_lp [skipped_logs=6]

Task timing                                  n [     min,      max]      avg      dev     time         n [     min,      max]      avg      dev    dtime
                             'core':         1 [   5.09s,    5.09s]    5.09s   0.00ns    5.09s         1 [972.58ms, 972.58ms] 972.58ms   0.00ns 972.58ms
                       'default_lp':         1 [   5.09s,    5.09s]    5.09s   0.00ns    5.09s         1 [582.36ms, 582.36ms] 582.36ms   0.00ns 582.36ms
                 'feasibility_pump':        40 [ 13.63ms,  62.19ms]  22.37ms  10.55ms 894.88ms        39 [  2.30ms,   4.83ms]   2.37ms 399.17us  92.55ms
                  'fj_long_default':         0 [  0.00ns,   0.00ns]   0.00ns   0.00ns   0.00ns         0 [  0.00ns,   0.00ns]   0.00ns   0.00ns   0.00ns
                  'fj_long_default':         0 [  0.00ns,   0.00ns]   0.00ns   0.00ns   0.00ns         0 [  0.00ns,   0.00ns]   0.00ns   0.00ns   0.00ns
              'fj_long_lin_default':         0 [  0.00ns,   0.00ns]   0.00ns   0.00ns   0.00ns         0 [  0.00ns,   0.00ns]   0.00ns   0.00ns   0.00ns
              'fj_long_lin_perturb':         0 [  0.00ns,   0.00ns]   0.00ns   0.00ns   0.00ns         0 [  0.00ns,   0.00ns]   0.00ns   0.00ns   0.00ns
               'fj_long_lin_random':         0 [  0.00ns,   0.00ns]   0.00ns   0.00ns   0.00ns         0 [  0.00ns,   0.00ns]   0.00ns   0.00ns   0.00ns
                  'fj_long_perturb':         0 [  0.00ns,   0.00ns]   0.00ns   0.00ns   0.00ns         0 [  0.00ns,   0.00ns]   0.00ns   0.00ns   0.00ns
                   'fj_long_random':         0 [  0.00ns,   0.00ns]   0.00ns   0.00ns   0.00ns         0 [  0.00ns,   0.00ns]   0.00ns   0.00ns   0.00ns
                 'fj_short_default':         0 [  0.00ns,   0.00ns]   0.00ns   0.00ns   0.00ns         0 [  0.00ns,   0.00ns]   0.00ns   0.00ns   0.00ns
                 'fj_short_default':         1 [102.71ms, 102.71ms] 102.71ms   0.00ns 102.71ms         1 [ 62.63ms,  62.63ms]  62.63ms   0.00ns  62.63ms
             'fj_short_lin_default':         0 [  0.00ns,   0.00ns]   0.00ns   0.00ns   0.00ns         0 [  0.00ns,   0.00ns]   0.00ns   0.00ns   0.00ns
             'fj_short_lin_default':         0 [  0.00ns,   0.00ns]   0.00ns   0.00ns   0.00ns         0 [  0.00ns,   0.00ns]   0.00ns   0.00ns   0.00ns
             'fj_short_lin_perturb':         0 [  0.00ns,   0.00ns]   0.00ns   0.00ns   0.00ns         0 [  0.00ns,   0.00ns]   0.00ns   0.00ns   0.00ns
              'fj_short_lin_random':         0 [  0.00ns,   0.00ns]   0.00ns   0.00ns   0.00ns         0 [  0.00ns,   0.00ns]   0.00ns   0.00ns   0.00ns
                 'fj_short_perturb':         0 [  0.00ns,   0.00ns]   0.00ns   0.00ns   0.00ns         0 [  0.00ns,   0.00ns]   0.00ns   0.00ns   0.00ns
                  'fj_short_random':         0 [  0.00ns,   0.00ns]   0.00ns   0.00ns   0.00ns         0 [  0.00ns,   0.00ns]   0.00ns   0.00ns   0.00ns
                        'fs_random':         1 [ 18.70ms,  18.70ms]  18.70ms   0.00ns  18.70ms         1 [ 20.00ns,  20.00ns]  20.00ns   0.00ns  20.00ns
                        'fs_random':         1 [ 19.96ms,  19.96ms]  19.96ms   0.00ns  19.96ms         1 [ 20.00ns,  20.00ns]  20.00ns   0.00ns  20.00ns
                        'fs_random':         1 [ 20.39ms,  20.39ms]  20.39ms   0.00ns  20.39ms         1 [ 20.00ns,  20.00ns]  20.00ns   0.00ns  20.00ns
                        'fs_random':         1 [ 21.06ms,  21.06ms]  21.06ms   0.00ns  21.06ms         1 [ 20.00ns,  20.00ns]  20.00ns   0.00ns  20.00ns
                  'fs_random_no_lp':         1 [ 17.26ms,  17.26ms]  17.26ms   0.00ns  17.26ms         0 [  0.00ns,   0.00ns]   0.00ns   0.00ns   0.00ns
                  'fs_random_no_lp':         1 [ 17.38ms,  17.38ms]  17.38ms   0.00ns  17.38ms         0 [  0.00ns,   0.00ns]   0.00ns   0.00ns   0.00ns
                  'fs_random_no_lp':         1 [ 17.95ms,  17.95ms]  17.95ms   0.00ns  17.95ms         0 [  0.00ns,   0.00ns]   0.00ns   0.00ns   0.00ns
                  'fs_random_no_lp':         1 [ 18.48ms,  18.48ms]  18.48ms   0.00ns  18.48ms         0 [  0.00ns,   0.00ns]   0.00ns   0.00ns   0.00ns
          'fs_random_quick_restart':         1 [ 18.59ms,  18.59ms]  18.59ms   0.00ns  18.59ms         1 [ 20.00ns,  20.00ns]  20.00ns   0.00ns  20.00ns
          'fs_random_quick_restart':         1 [ 19.78ms,  19.78ms]  19.78ms   0.00ns  19.78ms         1 [ 20.00ns,  20.00ns]  20.00ns   0.00ns  20.00ns
          'fs_random_quick_restart':         1 [ 20.26ms,  20.26ms]  20.26ms   0.00ns  20.26ms         1 [ 20.00ns,  20.00ns]  20.00ns   0.00ns  20.00ns
          'fs_random_quick_restart':         1 [ 21.90ms,  21.90ms]  21.90ms   0.00ns  21.90ms         1 [ 20.00ns,  20.00ns]  20.00ns   0.00ns  20.00ns
    'fs_random_quick_restart_no_lp':         1 [ 16.71ms,  16.71ms]  16.71ms   0.00ns  16.71ms         0 [  0.00ns,   0.00ns]   0.00ns   0.00ns   0.00ns
    'fs_random_quick_restart_no_lp':         1 [ 18.74ms,  18.74ms]  18.74ms   0.00ns  18.74ms         0 [  0.00ns,   0.00ns]   0.00ns   0.00ns   0.00ns
    'fs_random_quick_restart_no_lp':         1 [ 19.28ms,  19.28ms]  19.28ms   0.00ns  19.28ms         0 [  0.00ns,   0.00ns]   0.00ns   0.00ns   0.00ns
                    'graph_arc_lns':        40 [  5.09ms,    1.61s] 581.63ms 486.25ms   23.27s        34 [ 10.00ns, 219.52ms]  51.79ms  50.67ms    1.76s
                    'graph_cst_lns':        39 [  1.05ms,  56.16ms]   5.38ms  11.11ms 209.84ms         1 [ 10.00ns,  10.00ns]  10.00ns   0.00ns  10.00ns
                    'graph_dec_lns':        39 [  5.41ms,    1.84s] 628.52ms 533.07ms   24.51s        35 [ 10.00ns, 100.21ms]  55.15ms  43.63ms    1.93s
                    'graph_var_lns':        40 [  2.45ms,    1.81s] 605.12ms 559.69ms   24.20s        35 [ 10.00ns, 229.99ms]  46.26ms  53.07ms    1.62s
                   'lb_tree_search':         1 [   5.09s,    5.09s]    5.09s   0.00ns    5.09s         1 [726.07ms, 726.07ms] 726.07ms   0.00ns 726.07ms
                           'max_lp':         1 [   5.09s,    5.09s]    5.09s   0.00ns    5.09s         1 [862.95ms, 862.95ms] 862.95ms   0.00ns 862.95ms
                            'no_lp':         1 [   5.09s,    5.09s]    5.09s   0.00ns    5.09s         1 [392.54ms, 392.54ms] 392.54ms   0.00ns 392.54ms
              'objective_lb_search':         1 [   5.09s,    5.09s]    5.09s   0.00ns    5.09s         1 [468.54ms, 468.54ms] 468.54ms   0.00ns 468.54ms
       'objective_lb_search_max_lp':         1 [   5.09s,    5.09s]    5.09s   0.00ns    5.09s         1 [863.93ms, 863.93ms] 863.93ms   0.00ns 863.93ms
        'objective_lb_search_no_lp':         1 [   5.09s,    5.09s]    5.09s   0.00ns    5.09s         1 [406.10ms, 406.10ms] 406.10ms   0.00ns 406.10ms
  'objective_shaving_search_max_lp':        40 [  3.08ms, 846.35ms] 124.30ms 164.42ms    4.97s        25 [302.76us, 118.35ms]   9.04ms  24.18ms 225.91ms
   'objective_shaving_search_no_lp':        40 [  2.03ms, 843.30ms] 111.93ms 153.35ms    4.48s        22 [314.51us,  61.11ms]   7.39ms  13.68ms 162.60ms
                          'probing':         1 [   5.10s,    5.10s]    5.10s   0.00ns    5.10s         1 [205.19ms, 205.19ms] 205.19ms   0.00ns 205.19ms
                   'probing_max_lp':         1 [   5.09s,    5.09s]    5.09s   0.00ns    5.09s         1 [215.76ms, 215.76ms] 215.76ms   0.00ns 215.76ms
                     'pseudo_costs':         1 [   5.09s,    5.09s]    5.09s   0.00ns    5.09s         1 [472.63ms, 472.63ms] 472.63ms   0.00ns 472.63ms
                    'quick_restart':         1 [   5.09s,    5.09s]    5.09s   0.00ns    5.09s         1 [501.79ms, 501.79ms] 501.79ms   0.00ns 501.79ms
              'quick_restart_no_lp':         1 [   5.09s,    5.09s]    5.09s   0.00ns    5.09s         1 [471.93ms, 471.93ms] 471.93ms   0.00ns 471.93ms
                    'reduced_costs':         1 [   5.09s,    5.09s]    5.09s   0.00ns    5.09s         1 [453.38ms, 453.38ms] 453.38ms   0.00ns 453.38ms
                        'rins/rens':        40 [126.14us,    1.83s] 595.35ms 535.24ms   23.81s        30 [ 10.00ns, 300.19ms]  64.41ms  60.22ms    1.93s
                      'rnd_cst_lns':        40 [  1.49ms,    1.93s] 607.57ms 553.10ms   24.30s        36 [ 10.00ns, 170.83ms]  50.81ms  45.88ms    1.83s
                      'rnd_var_lns':        40 [  2.69ms,    1.81s] 598.12ms 509.40ms   23.92s        34 [ 10.00ns, 285.66ms]  50.83ms  58.85ms    1.73s
                     'violation_ls':        38 [197.16us, 352.31ms]  75.78ms  73.89ms    2.88s        38 [480.00ns,  62.26ms]  33.61ms  27.54ms    1.28s
                     'violation_ls':        39 [179.65us, 208.54ms]  67.69ms  67.11ms    2.64s        39 [360.00ns,  98.34ms]  40.09ms  38.47ms    1.56s
                     'violation_ls':        39 [289.16us, 208.67ms]  76.51ms  65.88ms    2.98s        39 [450.00ns,  88.42ms]  38.23ms  32.85ms    1.49s
                     'violation_ls':        40 [181.41us, 335.99ms]  88.33ms  76.19ms    3.53s        40 [600.00ns,  64.72ms]  34.62ms  26.22ms    1.38s
                     'violation_ls':        40 [210.02us, 258.24ms]  93.99ms  83.74ms    3.76s        40 [450.00ns,  77.26ms]  39.42ms  32.48ms    1.58s

Search stats                        Bools  Conflicts  Branches  Restarts  BoolPropag  IntegerPropag
                           'core':  2'200        971    14'837     5'317   2'126'102      1'264'335
                     'default_lp':     59      2'686     9'831     1'906      50'560      1'242'313
                      'fs_random':     59          0         0         0           0              0
                      'fs_random':     59          0        36        36          12            289
                      'fs_random':     59          0        82        82          12          1'004
                      'fs_random':     59          0        84        84          12          1'018
                'fs_random_no_lp':     59          0        10        10           8             36
                'fs_random_no_lp':     59          0         4         4           2             12
                'fs_random_no_lp':     59          0         4         4           2             12
                'fs_random_no_lp':     59          0        84        84          12          1'018
        'fs_random_quick_restart':     59          0         4         4           2             12
        'fs_random_quick_restart':     59          0         4         4           2             12
        'fs_random_quick_restart':     59          0        82        82          12          1'004
        'fs_random_quick_restart':     59          0        82        82          12          1'004
  'fs_random_quick_restart_no_lp':     59          0        24        24          12            137
  'fs_random_quick_restart_no_lp':     59          0        40        40          12            341
  'fs_random_quick_restart_no_lp':     59          0        82        82          12          1'004
                 'lb_tree_search':     59         47     4'313       836       7'779        164'105
                         'max_lp':     59      1'155     6'490     1'763      28'323        609'567
                          'no_lp':    569      4'002    11'298     1'633     610'891      1'649'764
            'objective_lb_search':     84      1'447     8'436     2'565      37'041        771'791
     'objective_lb_search_max_lp':     72        623     5'229     1'735      19'297        415'053
      'objective_lb_search_no_lp':    171      5'047    11'351     1'753      96'710      1'791'879
                        'probing':    141         28       254       254       1'285          9'911
                 'probing_max_lp':    101         20       182       182         361          3'573
                   'pseudo_costs':     59        950     4'118     1'171      19'909        425'760
                  'quick_restart':     59        568    12'647     4'849      24'713        589'206
            'quick_restart_no_lp':    442      4'520    20'063     2'230     498'706      1'785'609
                  'reduced_costs':    415        896     8'214     1'739     201'388        535'648

SAT stats                           ClassicMinim  LitRemoved  LitLearned  LitForgotten  Subsumed  MClauses  MDecisions  MLitTrue  MSubsumed  MLitRemoved  MReused
                           'core':           540       2'003       1'957             0         2     2'277      11'000         0        117          355        9
                     'default_lp':         1'304       2'669      22'744             0       157       841       5'785        11        259        1'500      177
                      'fs_random':             0           0           0             0         0         0           0         0          0            0        0
                      'fs_random':             0           0           0             0         0         0           0         0          0            0        0
                      'fs_random':             0           0           0             0         0         0           0         0          0            0        0
                      'fs_random':             0           0           0             0         0         0           0         0          0            0        0
                'fs_random_no_lp':             0           0           0             0         0         0           0         0          0            0        0
                'fs_random_no_lp':             0           0           0             0         0         0           0         0          0            0        0
                'fs_random_no_lp':             0           0           0             0         0         0           0         0          0            0        0
                'fs_random_no_lp':             0           0           0             0         0         0           0         0          0            0        0
        'fs_random_quick_restart':             0           0           0             0         0         0           0         0          0            0        0
        'fs_random_quick_restart':             0           0           0             0         0         0           0         0          0            0        0
        'fs_random_quick_restart':             0           0           0             0         0         0           0         0          0            0        0
        'fs_random_quick_restart':             0           0           0             0         0         0           0         0          0            0        0
  'fs_random_quick_restart_no_lp':             0           0           0             0         0         0           0         0          0            0        0
  'fs_random_quick_restart_no_lp':             0           0           0             0         0         0           0         0          0            0        0
  'fs_random_quick_restart_no_lp':             0           0           0             0         0         0           0         0          0            0        0
                 'lb_tree_search':             1           1         160             0         1       237       1'167         0         10           37       30
                         'max_lp':           554       1'077       9'181             0        67       630       3'769         4        228        1'343       73
                          'no_lp':         2'876       8'659      36'742             0        84       468       2'544         1        236        1'533       34
            'objective_lb_search':           983       2'088       9'861             0        81       741       4'588         0        216        1'142      167
     'objective_lb_search_max_lp':           356         671       3'838             0        54       484       2'955         0        129          655      134
      'objective_lb_search_no_lp':         3'724       8'914      31'326             0       213       684       4'382         0        318        1'641      138
                        'probing':             0           0          28             0         0         0           0         0          0            0        0
                 'probing_max_lp':             0           0          20             0         0         0           0         0          0            0        0
                   'pseudo_costs':           427         819       8'425             0        56       380       2'082         0        111          613       58
                  'quick_restart':           307         563       5'188             0        26     1'114       6'676         1         58          294      159
            'quick_restart_no_lp':         2'964       9'412      46'483             0       134       702       5'705         0        191        1'265      125
                  'reduced_costs':           545       1'350       6'982             0        44       618       3'749         0        226        1'107       86

Lp stats                         Component  Iterations  AddedCuts  OPTIMAL  DUAL_F.  DUAL_U.
                  'default_lp':          1      18'509      2'757    3'386        0        0
                   'fs_random':          1           0          0        0        0        0
                   'fs_random':          1           0          0        0        0        0
                   'fs_random':          1           0          0        0        0        0
                   'fs_random':          1           0          0        0        0        0
     'fs_random_quick_restart':          1           0          0        0        0        0
     'fs_random_quick_restart':          1           0          0        0        0        0
     'fs_random_quick_restart':          1           0          0        0        0        0
     'fs_random_quick_restart':          1           0          0        0        0        0
              'lb_tree_search':          1      22'820      2'562    1'446      499        0
                      'max_lp':          1      22'145      3'555    1'581      409        1
         'objective_lb_search':          1      15'137      2'075    2'024        0        0
  'objective_lb_search_max_lp':          1      20'735      3'277      872      312        1
                     'probing':          1       2'432      2'153      486        0        1
              'probing_max_lp':          1       1'239      2'078      197        3        0
                'pseudo_costs':          1      17'186      2'392    1'342      391        0
               'quick_restart':          1      13'336      2'746    1'632        0        1
               'reduced_costs':          1      10'540      4'110    1'075      161        1

Lp dimension                                                                     Final dimension of first component
                  'default_lp':   141 rows, 155 columns, 359 entries with magnitude in [1.340141e-02, 1.000000e+00]
                   'fs_random':       0 rows, 155 columns, 0 entries with magnitude in [0.000000e+00, 0.000000e+00]
                   'fs_random':       0 rows, 155 columns, 0 entries with magnitude in [0.000000e+00, 0.000000e+00]
                   'fs_random':       0 rows, 155 columns, 0 entries with magnitude in [0.000000e+00, 0.000000e+00]
                   'fs_random':       0 rows, 155 columns, 0 entries with magnitude in [0.000000e+00, 0.000000e+00]
     'fs_random_quick_restart':       0 rows, 155 columns, 0 entries with magnitude in [0.000000e+00, 0.000000e+00]
     'fs_random_quick_restart':       0 rows, 155 columns, 0 entries with magnitude in [0.000000e+00, 0.000000e+00]
     'fs_random_quick_restart':       0 rows, 155 columns, 0 entries with magnitude in [0.000000e+00, 0.000000e+00]
     'fs_random_quick_restart':       0 rows, 155 columns, 0 entries with magnitude in [0.000000e+00, 0.000000e+00]
              'lb_tree_search':   263 rows, 160 columns, 840 entries with magnitude in [1.198605e-02, 1.000000e+00]
                      'max_lp':  538 rows, 160 columns, 1750 entries with magnitude in [1.077118e-03, 1.000000e+00]
         'objective_lb_search':   225 rows, 155 columns, 523 entries with magnitude in [5.787777e-03, 1.000000e+00]
  'objective_lb_search_max_lp':  575 rows, 160 columns, 1463 entries with magnitude in [5.071990e-03, 1.000000e+00]
                     'probing':  476 rows, 155 columns, 3110 entries with magnitude in [9.277814e-04, 1.000000e+00]
              'probing_max_lp':   202 rows, 160 columns, 966 entries with magnitude in [6.042897e-03, 1.000000e+00]
                'pseudo_costs':  593 rows, 160 columns, 2268 entries with magnitude in [8.462920e-04, 1.000000e+00]
               'quick_restart':  408 rows, 155 columns, 1188 entries with magnitude in [1.990228e-03, 1.000000e+00]
               'reduced_costs':  564 rows, 160 columns, 1808 entries with magnitude in [8.593794e-04, 1.000000e+00]

Lp debug                         CutPropag  CutEqPropag  Adjust  Overflow      Bad  BadScaling
                  'default_lp':          7           11   1'325         0   15'188           0
                   'fs_random':          0            0       0         0        0           0
                   'fs_random':          0            0       0         0        0           0
                   'fs_random':          0            0       0         0        0           0
                   'fs_random':          0            0       0         0        0           0
     'fs_random_quick_restart':          0            0       0         0        0           0
     'fs_random_quick_restart':          0            0       0         0        0           0
     'fs_random_quick_restart':          0            0       0         0        0           0
     'fs_random_quick_restart':          0            0       0         0        0           0
              'lb_tree_search':          3            1     790         0    7'220           0
                      'max_lp':          1            4     541         0   16'637           0
         'objective_lb_search':         13            4     805         0   22'280           0
  'objective_lb_search_max_lp':          5            0     557         0   16'088           0
                     'probing':          3           38     319         0  146'544           0
              'probing_max_lp':          1            1     172         0   68'584           0
                'pseudo_costs':          1            0     369         0    8'082           0
               'quick_restart':         30            2     711         0   31'146           0
               'reduced_costs':         10            3     513         0   18'939           0

Lp pool                          Constraints  Updates  Simplif  Merged  Shortened  Split  Strenghtened    Cuts/Call
                  'default_lp':        2'897      424   28'233      29      4'115    451         3'780  2'757/6'139
                   'fs_random':          169        0        0       0          0      0             0          0/0
                   'fs_random':          169        0        0       0          0      0             0          0/0
                   'fs_random':          169        0        0       0          0      0             0          0/0
                   'fs_random':          169        0        0       0          0      0             0          0/0
     'fs_random_quick_restart':          169        0        0       0          0      0             0          0/0
     'fs_random_quick_restart':          169        0        0       0          0      0             0          0/0
     'fs_random_quick_restart':          169        0        0       0          0      0             0          0/0
     'fs_random_quick_restart':          169        0        0       0          0      0             0          0/0
              'lb_tree_search':        4'046       89    8'169       9      1'816    127         6'352  2'562/4'732
                      'max_lp':        5'040      194   29'839       8      5'947    290        13'795  3'555/6'454
         'objective_lb_search':        2'240      182   13'841       4      2'086    517         2'285  2'075/4'341
  'objective_lb_search_max_lp':        4'766      174   15'364       4      5'259    224        10'250  3'277/6'210
                     'probing':        2'320      165      101       2          0    178           433  2'153/3'918
              'probing_max_lp':        3'568       49      208       3          0    193           513  2'078/3'540
                'pseudo_costs':        3'877       96    7'225       8      2'172    173         7'231  2'392/4'585
               'quick_restart':        2'911      298   17'483       4      3'199  1'054         4'029  2'746/5'211
               'reduced_costs':        5'584      234   39'305      19      7'344    430        16'668  4'110/8'155

Lp Cut            defaul  max_lp  quick_  reduce  pseudo  lb_tre  probin  object  probin  object
          CG_FF:     172     228     150     279     117     140      92     105     150     234
           CG_K:      88     104      82     122      61      77      22      56      59     154
           CG_R:      95     134      64     105      49      82      49      51      78     116
          CG_RB:     556     663     503     910     322     545     322     336     353     592
         CG_RBP:      63      63      60     101      47      49      50      20      41      33
         Clique:       -      60       -      66      33      56       -       -       6      41
             IB:     508     298     459     371     332     358     285     362     164     349
       MIR_1_FF:     176     234     176     284     183     177     109     135     186     220
        MIR_1_K:      30      29      29      38      18      23      10      18      15      25
       MIR_1_KL:       -       -       1       -       -       -       -       -       -       -
        MIR_1_R:      13      21      12      20       8      16      14      21      15      10
       MIR_1_RB:     206     334     234     350     266     222     228     176     247     298
      MIR_1_RBP:       7      53       7      56      42      53       7       6      33      57
      MIR_1_RLT:       -       2       -       1       1       2       -       -       1       -
       MIR_2_FF:      81     112     103     124      69      75      73      66      65      95
        MIR_2_K:      27      29      18      27      19      21      19      20      11      19
       MIR_2_KL:       2       -       2       1       1       1       -       -       -       -
        MIR_2_R:      24      42      31      37      26      18      42      19      22      37
       MIR_2_RB:     111     155     118     163     128      82     125      93     110     136
      MIR_2_RBP:       7      27      11      28      18      14       7       7      16      27
       MIR_3_FF:      49      76      57      69      56      45      39      47      27      48
        MIR_3_K:      15      17      16      20      18      13       9      11      11      14
       MIR_3_KL:       2       -       1       -       -       -       -       -       -       -
        MIR_3_R:      14      21      20      33      23      11      27       7      20      23
       MIR_3_RB:      49      80      73      85      72      40     105      59      43      87
      MIR_3_RBP:       5      16       5      10      12       3      10       7       6      14
       MIR_4_FF:      36      39      27      48      16      24      17      21      16      26
        MIR_4_K:      10      17      11      19       4       7       4       6       8      15
       MIR_4_KL:       -       -       4       1       -       -       2       -       -       -
        MIR_4_R:      11      14      14      15       9       9      17       7       7      16
       MIR_4_RB:      35      48      46      57      31      23      42      40      21      38
      MIR_4_RBP:       1       5       6       8       2       -       1       4       -       6
       MIR_5_FF:      12      22      21      18      11      13      20      14       8      14
        MIR_5_K:       5       8      12       9       1       6       6       8       1       7
       MIR_5_KL:       -       -       -       -       -       -       1       1       -       1
        MIR_5_R:       7       7       4       6       3       9      14       6       3      10
       MIR_5_RB:      25      21      25      22      16       4      32      20       6      20
      MIR_5_RBP:       1       4       4       4       2       1       6       -       -       4
       MIR_6_FF:      17      14      12      17       6       6      10      18       1       9
        MIR_6_K:       4       3       9       7       4       5       3       8       -       3
       MIR_6_KL:       -       -       1       -       -       -       -       -       -       -
        MIR_6_R:      14       1      10       3       6       4       5       6       -       4
       MIR_6_RB:      15      11      11      23      14       8      13      15       2      11
      MIR_6_RBP:       -       2       2       1       2       3       1       1       -       1
   ZERO_HALF_FF:      37      59      40      68      41      45      23      31      24      66
    ZERO_HALF_K:       5      14       4       7       4       8       -       5       6      11
    ZERO_HALF_R:     143     291     171     325     198     159     220     170     215     265
   ZERO_HALF_RB:      76     147      73     139      93      88      61      64      66     104
  ZERO_HALF_RBP:       3      30       7      13       8      17      11       8      15      17

LNS stats           Improv/Calls  Closed  Difficulty  TimeLimit
  'graph_arc_lns':         13/39     62%        0.98       0.10
  'graph_cst_lns':           1/1    100%        0.71       0.10
  'graph_dec_lns':         13/39     56%        0.98       0.10
  'graph_var_lns':         10/39     59%        0.98       0.10
      'rins/rens':         10/34     53%        0.90       0.10
    'rnd_cst_lns':         10/38     63%        0.99       0.10
    'rnd_var_lns':         15/40     57%        0.98       0.10

LS stats                   Batches  Restarts  LinMoves  GenMoves  CompoundMoves  WeightUpdates
       'fj_long_default':        0         0         0         0              0              0
       'fj_long_default':        0         0         0         0              0              0
   'fj_long_lin_default':        0         0         0         0              0              0
   'fj_long_lin_perturb':        0         0         0         0              0              0
    'fj_long_lin_random':        0         0         0         0              0              0
       'fj_long_perturb':        0         0         0         0              0              0
        'fj_long_random':        0         0         0         0              0              0
      'fj_short_default':        0         0         0         0              0              0
      'fj_short_default':        1         1         0     3'438            511              2
  'fj_short_lin_default':        0         0         0         0              0              0
  'fj_short_lin_default':        0         0         0         0              0              0
  'fj_short_lin_perturb':        0         0         0         0              0              0
   'fj_short_lin_random':        0         0         0         0              0              0
      'fj_short_perturb':        0         0         0         0              0              0
       'fj_short_random':        0         0         0         0              0              0
          'violation_ls':       38         0    15'230   107'474          9'317         15'543
          'violation_ls':       39         0   141'065    19'821            928         57'433
          'violation_ls':       39         0   176'701     6'965            417         53'313
          'violation_ls':       40         0    15'137   231'451          4'587          7'050
          'violation_ls':       40         0   203'689    21'847            877         10'216

Solutions (98)            Num     Rank
        'graph_arc_lns':    1  [86,86]
        'graph_cst_lns':    1  [36,36]
        'graph_var_lns':    1  [85,85]
                'no_lp':   14   [1,22]
  'quick_restart_no_lp':    8   [6,84]
          'rnd_cst_lns':    1  [98,98]
          'rnd_var_lns':    1  [15,15]
         'violation_ls':   71   [7,97]

Objective bounds                Num
                  'bool_core':    1
             'initial_domain':    1
        'objective_lb_search':    2
  'objective_lb_search_no_lp':   69

Solution repositories    Added  Queried  Ignored  Synchro
  'feasible solutions':    303      777       13      270
        'lp solutions':     40       12        0       38
                'pump':    270       28

Improving bounds shared          Num
                        'core':    3
                  'default_lp':  230
              'lb_tree_search':    2
                      'max_lp':   72
                       'no_lp':   43
         'objective_lb_search':   28
  'objective_lb_search_max_lp':   74
   'objective_lb_search_no_lp':    1
                     'probing':   23
              'probing_max_lp':    1
                'pseudo_costs':    6
               'quick_restart':   13
         'quick_restart_no_lp':  130
               'reduced_costs':  100

Clauses shared                   Num
                  'default_lp':   42
              'lb_tree_search':    9
                      'max_lp':   36
                       'no_lp':   17
         'objective_lb_search':   27
  'objective_lb_search_max_lp':   18
   'objective_lb_search_no_lp':    4
                'pseudo_costs':   16
               'quick_restart':   22
         'quick_restart_no_lp':   19
               'reduced_costs':   24

CpSolverResponse summary:
status: OPTIMAL
objective: 1091
best_bound: 1091
integers: 156
booleans: 59
conflicts: 0
branches: 84
propagations: 12
integer_propagations: 1018
restarts: 84
lp_iterations: 0
walltime: 5.30933
usertime: 5.30933
deterministic_time: 26.2376
gap_integral: 98.7361
solution_fingerprint: 0x13f33b20dd317ef4


--- Simulation Gantt  partir du modle mathmatique ---
{'big':1, 'due_date':84, 'pos_time':5, 'status':0, 'blocked':0, 'operations':["{'type':1, 'processing_time':55}"]}
{'big':0, 'due_date':136, 'pos_time':5, 'status':0, 'blocked':0, 'operations':["{'type':0, 'processing_time':56}", "{'type':1, 'processing_time':56}"]}
{'big':0, 'due_date':58, 'pos_time':5, 'status':0, 'blocked':0, 'operations':["{'type':1, 'processing_time':58}"]}
{'big':0, 'due_date':191, 'pos_time':5, 'status':0, 'blocked':0, 'operations':["{'type':1, 'processing_time':11}", "{'type':0, 'processing_time':50}"]}
{'big':1, 'due_date':182, 'pos_time':5, 'status':0, 'blocked':0, 'operations':["{'type':1, 'processing_time':42}", "{'type':0, 'processing_time':28}"]}
{'big':1, 'due_date':52, 'pos_time':5, 'status':0, 'blocked':0, 'operations':["{'type':1, 'processing_time':59}"]}
{'big':1, 'due_date':50, 'pos_time':5, 'status':0, 'blocked':0, 'operations':["{'type':0, 'processing_time':56}"]}
