created virtual environment CPython3.12.4.final.0-64 in 10287ms
  creator CPython3Posix(dest=/localscratch/aneumann.63393195.0/env, clear=False, no_vcs_ignore=False, global=False)
  seeder FromAppData(download=False, pip=bundle, via=copy, app_data_dir=/home/aneumann/.local/share/virtualenv)
    added seed packages: pip==25.1.1
  activators BashActivator,CShellActivator,FishActivator,NushellActivator,PowerShellActivator,PythonActivator
Looking in links: /cvmfs/soft.computecanada.ca/custom/python/wheelhouse/gentoo2023/x86-64-v3, /cvmfs/soft.computecanada.ca/custom/python/wheelhouse/gentoo2023/generic, /cvmfs/soft.computecanada.ca/custom/python/wheelhouse/generic
Requirement already satisfied: pip in /localscratch/aneumann.63393195.0/env/lib/python3.12/site-packages (25.1.1)
Looking in links: /cvmfs/soft.computecanada.ca/custom/python/wheelhouse/gentoo2023/x86-64-v3, /cvmfs/soft.computecanada.ca/custom/python/wheelhouse/gentoo2023/generic, /cvmfs/soft.computecanada.ca/custom/python/wheelhouse/generic
ERROR: protobuf-5.28.3-cp38-abi3-manylinux2014_x86_64.whl is not a supported wheel on this platform.
Looking in links: /cvmfs/soft.computecanada.ca/custom/python/wheelhouse/gentoo2023/x86-64-v3, /cvmfs/soft.computecanada.ca/custom/python/wheelhouse/gentoo2023/generic, /cvmfs/soft.computecanada.ca/custom/python/wheelhouse/generic
Processing /home/aneumann/projects/def-adhaj/aneumann/GNRS/wheels/immutabledict-4.2.0-py3-none-any.whl
Installing collected packages: immutabledict
Successfully installed immutabledict-4.2.0
Looking in links: /cvmfs/soft.computecanada.ca/custom/python/wheelhouse/gentoo2023/x86-64-v3, /cvmfs/soft.computecanada.ca/custom/python/wheelhouse/gentoo2023/generic, /cvmfs/soft.computecanada.ca/custom/python/wheelhouse/generic
Processing /cvmfs/soft.computecanada.ca/custom/python/wheelhouse/generic/ortools-9.10.4067+computecanada-cp312-cp312-linux_x86_64.whl (from -r /home/aneumann/projects/def-adhaj/aneumann/GNRS/requirements/or.txt (line 1))
Processing /cvmfs/soft.computecanada.ca/custom/python/wheelhouse/gentoo2023/x86-64-v3/matplotlib-3.10.0+computecanada-cp312-cp312-linux_x86_64.whl (from -r /home/aneumann/projects/def-adhaj/aneumann/GNRS/requirements/or.txt (line 2))
Processing /cvmfs/soft.computecanada.ca/custom/python/wheelhouse/gentoo2023/x86-64-v3/pandas-2.2.3+computecanada-cp312-cp312-linux_x86_64.whl (from -r /home/aneumann/projects/def-adhaj/aneumann/GNRS/requirements/or.txt (line 3))
Processing /cvmfs/soft.computecanada.ca/custom/python/wheelhouse/generic/absl_py-2.2.2+computecanada-py3-none-any.whl (from ortools<9.11,>=9.10->-r /home/aneumann/projects/def-adhaj/aneumann/GNRS/requirements/or.txt (line 1))
Processing /cvmfs/soft.computecanada.ca/custom/python/wheelhouse/gentoo2023/generic/numpy-2.2.2+computecanada-cp312-cp312-linux_x86_64.whl (from ortools<9.11,>=9.10->-r /home/aneumann/projects/def-adhaj/aneumann/GNRS/requirements/or.txt (line 1))
Processing /cvmfs/soft.computecanada.ca/custom/python/wheelhouse/gentoo2023/x86-64-v3/protobuf-6.30.2+computecanada-cp312-cp312-linux_x86_64.whl (from ortools<9.11,>=9.10->-r /home/aneumann/projects/def-adhaj/aneumann/GNRS/requirements/or.txt (line 1))
Requirement already satisfied: immutabledict>=3.0.0 in /localscratch/aneumann.63393195.0/env/lib/python3.12/site-packages (from ortools<9.11,>=9.10->-r /home/aneumann/projects/def-adhaj/aneumann/GNRS/requirements/or.txt (line 1)) (4.2.0)
Processing /cvmfs/soft.computecanada.ca/custom/python/wheelhouse/gentoo2023/generic/contourpy-1.3.1+computecanada-cp312-cp312-linux_x86_64.whl (from matplotlib->-r /home/aneumann/projects/def-adhaj/aneumann/GNRS/requirements/or.txt (line 2))
Processing /cvmfs/soft.computecanada.ca/custom/python/wheelhouse/generic/cycler-0.12.1+computecanada-py3-none-any.whl (from matplotlib->-r /home/aneumann/projects/def-adhaj/aneumann/GNRS/requirements/or.txt (line 2))
Processing /cvmfs/soft.computecanada.ca/custom/python/wheelhouse/generic/fonttools-4.58.2+computecanada-cp312-cp312-linux_x86_64.whl (from matplotlib->-r /home/aneumann/projects/def-adhaj/aneumann/GNRS/requirements/or.txt (line 2))
Processing /cvmfs/soft.computecanada.ca/custom/python/wheelhouse/gentoo2023/x86-64-v3/kiwisolver-1.4.8+computecanada-cp312-cp312-linux_x86_64.whl (from matplotlib->-r /home/aneumann/projects/def-adhaj/aneumann/GNRS/requirements/or.txt (line 2))
Processing /cvmfs/soft.computecanada.ca/custom/python/wheelhouse/generic/packaging-25.0+computecanada-py3-none-any.whl (from matplotlib->-r /home/aneumann/projects/def-adhaj/aneumann/GNRS/requirements/or.txt (line 2))
Processing /cvmfs/soft.computecanada.ca/custom/python/wheelhouse/gentoo2023/x86-64-v3/pillow-11.1.0+computecanada-cp312-cp312-linux_x86_64.whl (from matplotlib->-r /home/aneumann/projects/def-adhaj/aneumann/GNRS/requirements/or.txt (line 2))
Processing /cvmfs/soft.computecanada.ca/custom/python/wheelhouse/generic/pyparsing-3.2.1+computecanada-py3-none-any.whl (from matplotlib->-r /home/aneumann/projects/def-adhaj/aneumann/GNRS/requirements/or.txt (line 2))
Processing /cvmfs/soft.computecanada.ca/custom/python/wheelhouse/generic/python_dateutil-2.9.0.post0+computecanada-py2.py3-none-any.whl (from matplotlib->-r /home/aneumann/projects/def-adhaj/aneumann/GNRS/requirements/or.txt (line 2))
Processing /cvmfs/soft.computecanada.ca/custom/python/wheelhouse/generic/pytz-2025.2+computecanada-py2.py3-none-any.whl (from pandas->-r /home/aneumann/projects/def-adhaj/aneumann/GNRS/requirements/or.txt (line 3))
Processing /cvmfs/soft.computecanada.ca/custom/python/wheelhouse/generic/tzdata-2025.2+computecanada-py2.py3-none-any.whl (from pandas->-r /home/aneumann/projects/def-adhaj/aneumann/GNRS/requirements/or.txt (line 3))
Processing /cvmfs/soft.computecanada.ca/custom/python/wheelhouse/generic/six-1.17.0+computecanada-py2.py3-none-any.whl (from python-dateutil>=2.7->matplotlib->-r /home/aneumann/projects/def-adhaj/aneumann/GNRS/requirements/or.txt (line 2))
Installing collected packages: pytz, tzdata, six, pyparsing, protobuf, pillow, packaging, numpy, kiwisolver, fonttools, cycler, absl-py, python-dateutil, contourpy, pandas, matplotlib, ortools

Successfully installed absl-py-2.2.2+computecanada contourpy-1.3.1+computecanada cycler-0.12.1+computecanada fonttools-4.58.2+computecanada kiwisolver-1.4.8+computecanada matplotlib-3.10.0+computecanada numpy-2.2.2+computecanada ortools-9.10.4067+computecanada packaging-25.0+computecanada pandas-2.2.3+computecanada pillow-11.1.0+computecanada protobuf-6.30.2+computecanada pyparsing-3.2.1+computecanada python-dateutil-2.9.0.post0+computecanada pytz-2025.2+computecanada six-1.17.0+computecanada tzdata-2025.2+computecanada

Starting CP-SAT solver v9.10.4067
Parameters: max_time_in_seconds: 3600 max_memory_in_mb: 12000 log_search_progress: true enumerate_all_solutions: false absolute_gap_limit: 0 relative_gap_limit: 0
Setting number of workers to 32

Initial optimization model '': (model_fingerprint: 0xf7b05374641b6caa)
#Variables: 213 (#ints: 8 in objective)
  - 138 Booleans in [0,1]
  - 75 in [0,467]
#kLinear1: 31
#kLinear2: 329
#kLinear3: 149
#kLinearN: 1'277 (#terms: 13'969)

Starting presolve at 0.00s
  6.90e-04s  0.00e+00d  [DetectDominanceRelations] 
  1.72e-02s  0.00e+00d  [PresolveToFixPoint] #num_loops=6 #num_dual_strengthening=3 
  2.71e-05s  0.00e+00d  [ExtractEncodingFromLinear] #potential_supersets=6 
[Symmetry] Graph for symmetry has 1'607 nodes and 9'694 arcs.
[Symmetry] Symmetry computation done. time: 0.00100278 dtime: 0.00117033
[Symmetry] #generators: 1, average support size: 26
[Symmetry] The model contains 139 duplicate constraints !
[Symmetry] 13 orbits with sizes: 2,2,2,2,2,2,2,2,2,2,...
[Symmetry] Num fixable by intersecting at_most_one with orbits: 1 largest_orbit: 2
  3.62e-03s  4.57e-04d  [Probe] #probed=184 #fixed_bools=1 #new_bounds=7 #equiv=1 
  4.07e-05s  0.00e+00d  [MaxClique] Merged 15(30 literals) into 6(12 literals) at_most_ones. 
  4.84e-04s  0.00e+00d  [DetectDominanceRelations] 
  6.51e-03s  0.00e+00d  [PresolveToFixPoint] #num_loops=4 #num_dual_strengthening=3 
  2.02e-03s  0.00e+00d  [ProcessAtMostOneAndLinear] 
  1.32e-03s  0.00e+00d  [DetectDuplicateConstraints] #duplicates=174 #without_enforcements=161 
  5.78e-04s  2.59e-05d  [DetectDominatedLinearConstraints] #relevant_constraints=863 #num_inclusions=476 
  1.87e-04s  0.00e+00d  [DetectDifferentVariables] #different=30 
  2.04e-04s  8.97e-06d  [ProcessSetPPC] #relevant_constraints=594 
  1.64e-05s  0.00e+00d  [FindAlmostIdenticalLinearConstraints] 
  1.31e-04s  1.04e-04d  [FindBigAtMostOneAndLinearOverlap] 
  2.15e-03s  6.24e-04d  [FindBigVerticalLinearOverlap] #blocks=16 #saved_nz=1'290 
  1.03e-04s  2.15e-05d  [FindBigHorizontalLinearOverlap] #linears=569 
  1.11e-05s  0.00e+00d  [MergeClauses] 
  4.83e-04s  0.00e+00d  [DetectDominanceRelations] 
  9.13e-03s  0.00e+00d  [PresolveToFixPoint] #num_loops=2 #num_dual_strengthening=1 
  4.83e-04s  0.00e+00d  [DetectDominanceRelations] 
  5.53e-03s  0.00e+00d  [PresolveToFixPoint] #num_loops=1 #num_dual_strengthening=1 
[Symmetry] Graph for symmetry has 1'452 nodes and 7'759 arcs.
[Symmetry] Symmetry computation done. time: 0.000339976 dtime: 0.00055433
  3.22e-03s  4.33e-04d  [Probe] #probed=182 #new_bounds=12 
  9.28e-06s  0.00e+00d  [MaxClique] 
  5.37e-04s  0.00e+00d  [DetectDominanceRelations] 
  9.75e-03s  0.00e+00d  [PresolveToFixPoint] #num_loops=2 #num_dual_strengthening=1 
  1.90e-03s  0.00e+00d  [ProcessAtMostOneAndLinear] 
  1.19e-03s  0.00e+00d  [DetectDuplicateConstraints] #without_enforcements=170 
  4.50e-04s  1.76e-05d  [DetectDominatedLinearConstraints] #relevant_constraints=754 #num_inclusions=284 
  1.73e-04s  0.00e+00d  [DetectDifferentVariables] #different=31 
  1.85e-04s  5.84e-06d  [ProcessSetPPC] #relevant_constraints=524 
  2.09e-05s  1.50e-08d  [FindAlmostIdenticalLinearConstraints] #num_tested_pairs=1 
  1.22e-04s  8.19e-05d  [FindBigAtMostOneAndLinearOverlap] 
  1.06e-03s  4.13e-04d  [FindBigVerticalLinearOverlap] #blocks=6 #saved_nz=240 
  9.16e-05s  1.82e-05d  [FindBigHorizontalLinearOverlap] #linears=509 
  1.01e-05s  0.00e+00d  [MergeClauses] 
  5.32e-04s  0.00e+00d  [DetectDominanceRelations] 
  7.09e-03s  0.00e+00d  [PresolveToFixPoint] #num_loops=2 #num_dual_strengthening=1 
  5.33e-04s  0.00e+00d  [DetectDominanceRelations] 
  5.97e-03s  0.00e+00d  [PresolveToFixPoint] #num_loops=1 #num_dual_strengthening=1 
[Symmetry] Graph for symmetry has 1'461 nodes and 7'516 arcs.
[Symmetry] Symmetry computation done. time: 0.000341244 dtime: 0.00053875
  3.32e-03s  4.27e-04d  [Probe] #probed=182 #new_bounds=4 
  8.87e-06s  0.00e+00d  [MaxClique] 
  5.35e-04s  0.00e+00d  [DetectDominanceRelations] 
  6.62e-03s  0.00e+00d  [PresolveToFixPoint] #num_loops=2 #num_dual_strengthening=1 
  1.87e-03s  0.00e+00d  [ProcessAtMostOneAndLinear] 
  1.19e-03s  0.00e+00d  [DetectDuplicateConstraints] #without_enforcements=170 
  4.34e-04s  1.68e-05d  [DetectDominatedLinearConstraints] #relevant_constraints=759 #num_inclusions=282 
  1.70e-04s  0.00e+00d  [DetectDifferentVariables] #different=31 
  1.86e-04s  5.29e-06d  [ProcessSetPPC] #relevant_constraints=514 
  2.24e-05s  1.50e-08d  [FindAlmostIdenticalLinearConstraints] #num_tested_pairs=1 
  1.14e-04s  7.83e-05d  [FindBigAtMostOneAndLinearOverlap] 
  9.55e-04s  3.80e-04d  [FindBigVerticalLinearOverlap] #blocks=3 #saved_nz=143 
  8.86e-05s  1.75e-05d  [FindBigHorizontalLinearOverlap] #linears=503 
  1.04e-05s  0.00e+00d  [MergeClauses] 
  5.21e-04s  0.00e+00d  [DetectDominanceRelations] 
  6.16e-03s  0.00e+00d  [PresolveToFixPoint] #num_loops=2 #num_dual_strengthening=1 
  4.34e-05s  0.00e+00d  [ExpandObjective] #entries=98 #tight_variables=42 #tight_constraints=22 

Presolve summary:
  - 32 affine relations were detected.
  - rule 'TODO dual: only one blocking constraint?' was applied 707 times.
  - rule 'TODO dual: only one unspecified blocking constraint?' was applied 104 times.
  - rule 'TODO duplicate: identical constraint with different enforcements' was applied 501 times.
  - rule 'affine: new relation' was applied 32 times.
  - rule 'at_most_one: removed literals' was applied 6 times.
  - rule 'at_most_one: size one' was applied 6 times.
  - rule 'at_most_one: transformed into max clique.' was applied 1 time.
  - rule 'deductions: 119 stored' was applied 1 time.
  - rule 'dual: fix variable' was applied 21 times.
  - rule 'dual: reduced domain' was applied 37 times.
  - rule 'duplicate: merged rhs of linear constraint' was applied 35 times.
  - rule 'duplicate: removed constraint' was applied 174 times.
  - rule 'enforcement: false literal' was applied 6 times.
  - rule 'enforcement: true literal' was applied 4 times.
  - rule 'exactly_one: x and not(x)' was applied 1 time.
  - rule 'incompatible linear: add implication' was applied 30 times.
  - rule 'linear matrix: common vertical rectangle' was applied 25 times.
  - rule 'linear: always true' was applied 513 times.
  - rule 'linear: doubleton free' was applied 8 times.
  - rule 'linear: empty' was applied 18 times.
  - rule 'linear: extracted enforcement literal' was applied 2'708 times.
  - rule 'linear: fixed or dup variables' was applied 1'287 times.
  - rule 'linear: positive equal one' was applied 6 times.
  - rule 'linear: reduced variable domains' was applied 98 times.
  - rule 'linear: remapped using affine relations' was applied 1'218 times.
  - rule 'linear: simplified rhs' was applied 3'787 times.
  - rule 'linear: variable substitution 1' was applied 8 times.
  - rule 'linear: variable substitution 2' was applied 1 time.
  - rule 'presolve: 63 unused variables removed.' was applied 1 time.
  - rule 'presolve: iteration' was applied 3 times.
  - rule 'probing: reduced enforced constraint to implication.' was applied 15 times.
  - rule 'symmetry: fixed to false in general orbit' was applied 1 time.

Presolved optimization model '': (model_fingerprint: 0x8e19779937d27f78)
#Variables: 134 (#ints: 8 in objective)
  - 51 Booleans in [0,1]
  - 1 in [-1343,-996][-931,-529][-464,-62][3,405][470,872][937,1339][1404,1751]
  - 1 in [-1320,-992][-931,-525][-464,-58][3,409][470,876][937,1288]
  - 1 in [-1304,-992][-931,-525][-464,-58][3,409][470,876][937,1343][1404,1755]
  - 1 in [-915,-520][-464,-53][3,414][470,881][937,1348][1404,1799]
  - 1 in [-876,-529][-464,-62][3,405][470,872][937,1339][1404,1751]
  - 1 in [-853,-525][-464,-58][3,409][470,876][937,1288]
  - 1 in [-461,-77][3,390][470,849]
  - 1 in [-448,-53][3,414][470,881][937,1293]
  - 1 in [-430,-53][3,414][470,881][937,1348][1404,1760]
  - 1 in [-409,-62][3,405][470,817]
  - 1 in [-409,-62][3,405][470,872][937,1284]
  - 1 in [-409,-62][3,405][470,872][937,1339][1404,1751]
  - 1 in [-409,-58][3,409][470,876][937,1288]
  - 1 in [-409,-45][3,422][470,834]
  - 1 in [-386,-45][3,422][470,889][937,1301]
  - 1 in [-386,-45][3,422][470,889][937,1356][1404,1768]
  - 1 in [-2,408]
  - 1 in [0,370]
  - 1 in [0,378]
  - 1 in [0,386]
  - 3 in [0,387]
  - 1 in [0,390]
  - 3 in [0,402]
  - 1 in [0,404]
  - 3 in [0,406]
  - 3 in [0,410]
  - 3 in [0,411]
  - 1 in [0,414]
  - 3 in [0,419]
  - 3 in [0,449]
  - 1 in [2,404]
  - 1 in [3,390]
  - 1 in [3,390][470,851]
  - 1 in [3,405]
  - 1 in [3,409]
  - 1 in [3,409][470,876]
  - 1 in [3,413]
  - 1 in [3,414]
  - 1 in [3,422]
  - 1 in [3,422][470,889]
  - 1 in [3,452]
  - 1 in [6,414][470,865]
  - 1 in [19,409][470,876][937,1327]
  - 1 in [19,414][470,881][937,1332]
  - 1 in [29,416]
  - 1 in [34,421]
  - 2 in [42,456]
  - 1 in [48,462]
  - 2 in [52,456]
  - 2 in [54,456]
  - 1 in [58,462]
  - 1 in [60,462]
  - 2 in [66,456]
  - 2 in [70,456]
  - 1 in [72,462]
  - 1 in [76,462]
  - 2 in [78,456]
  - 1 in [84,462]
  - 3 in [86,456]
  - 1 in [92,462]
  - 1 in [124,467]
#kExactlyOne: 5 (#literals: 15)
#kLinear2: 374 (#enforced: 328 #multi: 285)
#kLinear3: 122 (#enforced: 100 #multi: 58)
#kLinearN: 543 (#enforced: 402) (#terms: 3'669)

Preloading model.
#Bound   0.11s best:inf   next:[126,3213] initial_domain
[Symmetry] Graph for symmetry has 1'365 nodes and 7'375 arcs.
[Symmetry] Symmetry computation done. time: 0.000325399 dtime: 0.00052716
#Model   0.11s var:134/134 constraints:1044/1044

Starting search at 0.11s with 32 workers.
16 full problem subsolvers: [core, default_lp, lb_tree_search, max_lp, no_lp, objective_lb_search, objective_lb_search_max_lp, objective_lb_search_no_lp, objective_shaving_search_max_lp, objective_shaving_search_no_lp, probing, probing_max_lp, pseudo_costs, quick_restart, quick_restart_no_lp, reduced_costs]
14 first solution subsolvers: [fj_long_default, fj_long_lin_default, fj_long_random, fj_short_default, fj_short_lin_default, fj_short_lin_random, fj_short_random, fs_random(2), fs_random_no_lp(2), fs_random_quick_restart(2), fs_random_quick_restart_no_lp]
11 incomplete subsolvers: [feasibility_pump, graph_arc_lns, graph_cst_lns, graph_dec_lns, graph_var_lns, rins/rens, rnd_cst_lns, rnd_var_lns, violation_ls(3)]
3 helper subsolvers: [neighborhood_helper, synchronization_agent, update_gap_integral]
#1       0.12s best:1471  next:[126,1470] no_lp (fixed_bools=0/77)
#2       0.12s best:1435  next:[126,1434] quick_restart_no_lp (fixed_bools=0/83)
#Bound   0.13s best:1435  next:[151,1434] objective_lb_search_no_lp
#3       0.13s best:1340  next:[151,1339] no_lp (fixed_bools=0/97)
#Bound   0.13s best:1340  next:[174,1339] objective_lb_search_no_lp
#Bound   0.13s best:1340  next:[175,1339] objective_lb_search_no_lp
#4       0.13s best:1225  next:[175,1224] no_lp (fixed_bools=0/112)
#Bound   0.13s best:1225  next:[181,1224] objective_lb_search_no_lp
#Bound   0.13s best:1225  next:[185,1224] objective_lb_search_no_lp
#Bound   0.13s best:1225  next:[359,1224] objective_lb_search_no_lp
#5       0.13s best:1216  next:[359,1215] no_lp (fixed_bools=0/126)
#Bound   0.13s best:1216  next:[383,1215] objective_lb_search_no_lp
#6       0.13s best:1208  next:[383,1207] no_lp (fixed_bools=0/132)
#Bound   0.14s best:1208  next:[453,1207] objective_lb_search_no_lp
#7       0.14s best:1191  next:[453,1190] quick_restart_no_lp (fixed_bools=0/125)
#8       0.15s best:1180  next:[453,1179] no_lp (fixed_bools=1/138)
#9       0.16s best:1177  next:[453,1176] quick_restart_no_lp (fixed_bools=0/144)
#10      0.16s best:1156  next:[453,1155] no_lp (fixed_bools=1/150)
#Bound   0.16s best:1156  next:[466,1155] objective_lb_search_no_lp
#Bound   0.17s best:1156  next:[473,1155] objective_lb_search_no_lp
#11      0.17s best:1128  next:[473,1127] no_lp (fixed_bools=1/165)
#12      0.17s best:1061  next:[473,1060] rnd_var_lns (d=0.91 s=68 t=0.10 p=1.00 stall=4 h=auto_l0)
#Bound   0.18s best:1061  next:[476,1060] objective_lb_search_no_lp
#13      0.18s best:1057  next:[476,1056] quick_restart_no_lp (fixed_bools=0/226)
#14      0.18s best:1042  next:[476,1041] quick_restart_no_lp (fixed_bools=0/237)
#Bound   0.18s best:1042  next:[479,1041] objective_lb_search_no_lp
#15      0.20s best:1040  next:[479,1039] violation_ls(batch:4 #solutions_imported:4 #lin_moves:10'131 #lin_evals:50'789 #gen_moves:1'121 #gen_evals:0 #comp_moves:61 #backtracks:530 #weight_updates:9'885)
#16      0.20s best:1038  next:[479,1037] violation_ls(batch:5 #solutions_imported:5 #lin_moves:10'131 #lin_evals:50'792 #gen_moves:1'122 #gen_evals:0 #comp_moves:62 #backtracks:530 #weight_updates:9'885)
#17      0.20s best:1037  next:[479,1036] violation_ls(batch:6 #solutions_imported:6 #lin_moves:10'131 #lin_evals:50'820 #gen_moves:1'139 #gen_evals:0 #comp_moves:63 #backtracks:538 #weight_updates:9'885)
#Bound   0.20s best:1037  next:[531,1036] objective_lb_search_no_lp
#18      0.20s best:1036  next:[531,1035] violation_ls(batch:7 #solutions_imported:7 #lin_moves:11'011 #lin_evals:53'399 #gen_moves:1'139 #gen_evals:0 #comp_moves:63 #backtracks:538 #weight_updates:10'081)
#19      0.20s best:1034  next:[531,1033] violation_ls(batch:8 #solutions_imported:8 #lin_moves:11'012 #lin_evals:53'406 #gen_moves:1'139 #gen_evals:0 #comp_moves:63 #backtracks:538 #weight_updates:10'081)
#20      0.20s best:959   next:[531,958]  graph_var_lns (d=0.96 s=85 t=0.10 p=1.00 stall=6 h=auto_l0)
#21      0.21s best:958   next:[531,957]  quick_restart_no_lp (fixed_bools=0/270)
#22      0.21s best:957   next:[531,956]  quick_restart_no_lp (fixed_bools=0/271)
#23      0.21s best:956   next:[531,955]  quick_restart_no_lp (fixed_bools=0/280)
#Bound   0.22s best:956   next:[538,955]  objective_lb_search_no_lp
#24      0.22s best:955   next:[538,954]  violation_ls(batch:3 #solutions_imported:3 #lin_moves:9'077 #lin_evals:36'137 #gen_moves:1'132 #gen_evals:0 #comp_moves:38 #backtracks:547 #weight_updates:952)
#25      0.22s best:954   next:[538,953]  violation_ls(batch:4 #solutions_imported:4 #lin_moves:9'077 #lin_evals:36'139 #gen_moves:1'133 #gen_evals:0 #comp_moves:39 #backtracks:547 #weight_updates:952)
#26      0.22s best:953   next:[538,952]  violation_ls(batch:5 #solutions_imported:5 #lin_moves:9'077 #lin_evals:36'144 #gen_moves:1'135 #gen_evals:0 #comp_moves:41 #backtracks:547 #weight_updates:952)
#27      0.22s best:952   next:[538,951]  violation_ls(batch:6 #solutions_imported:6 #lin_moves:9'079 #lin_evals:36'158 #gen_moves:1'135 #gen_evals:0 #comp_moves:41 #backtracks:547 #weight_updates:953)
#28      0.22s best:951   next:[538,950]  violation_ls(batch:7 #solutions_imported:7 #lin_moves:9'079 #lin_evals:36'221 #gen_moves:1'173 #gen_evals:0 #comp_moves:43 #backtracks:565 #weight_updates:953)
#29      0.22s best:950   next:[538,949]  violation_ls(batch:8 #solutions_imported:8 #lin_moves:9'115 #lin_evals:36'417 #gen_moves:1'173 #gen_evals:0 #comp_moves:43 #backtracks:565 #weight_updates:987)
#30      0.22s best:949   next:[538,948]  violation_ls(batch:9 #solutions_imported:9 #lin_moves:9'173 #lin_evals:36'640 #gen_moves:1'173 #gen_evals:0 #comp_moves:43 #backtracks:565 #weight_updates:1'016)
#31      0.22s best:948   next:[538,947]  quick_restart_no_lp (fixed_bools=0/290)
#32      0.22s best:947   next:[538,946]  violation_ls(batch:10 #solutions_imported:10 #lin_moves:11'013 #lin_evals:54'427 #gen_moves:1'669 #gen_evals:0 #comp_moves:77 #backtracks:796 #weight_updates:10'087)
#33      0.23s best:905   next:[538,904]  quick_restart_no_lp (fixed_bools=0/300)
#34      0.24s best:904   next:[538,903]  quick_restart_no_lp (fixed_bools=0/302)
#Bound   0.25s best:904   next:[556,903]  objective_lb_search_no_lp
#Bound   0.27s best:904   next:[561,903]  objective_lb_search_no_lp
#Bound   0.29s best:904   next:[569,903]  objective_lb_search_no_lp
#35      0.29s best:885   next:[569,884]  rnd_var_lns (d=0.96 s=118 t=0.10 p=1.00 stall=0 h=auto_l0)
#36      0.31s best:884   next:[569,883]  violation_ls(batch:11 #solutions_imported:11 #lin_moves:18'479 #lin_evals:73'978 #gen_moves:1'173 #gen_evals:0 #comp_moves:43 #backtracks:565 #weight_updates:1'782)
#37      0.33s best:883   next:[569,882]  violation_ls(batch:3 #solutions_imported:3 #lin_moves:23 #lin_evals:47'232 #gen_moves:25'639 #gen_evals:0 #comp_moves:1'521 #backtracks:12'058 #weight_updates:200)
#38      0.33s best:882   next:[569,881]  violation_ls(batch:4 #solutions_imported:4 #lin_moves:45 #lin_evals:47'322 #gen_moves:25'639 #gen_evals:0 #comp_moves:1'521 #backtracks:12'058 #weight_updates:211)
#Bound   0.36s best:882   next:[570,881]  objective_lb_search_no_lp
#Bound   0.41s best:882   next:[573,881]  objective_lb_search_no_lp
#Bound   0.49s best:882   next:[574,881]  objective_lb_search
#39      0.72s best:880   next:[588,879]  default_lp (fixed_bools=0/107)
#Bound   1.00s best:880   next:[635,879]  objective_lb_search_no_lp [skipped_logs=12]
#Model   1.10s var:133/134 constraints:1027/1044
#Model   1.52s var:132/134 constraints:956/1044
#Bound   1.99s best:880   next:[703,879]  objective_lb_search_no_lp [skipped_logs=18]
#Bound   3.00s best:880   next:[735,879]  objective_lb_search_no_lp [skipped_logs=9]
#Model   3.60s var:128/134 constraints:851/1044
#Model   3.68s var:127/134 constraints:823/1044
#Model   3.89s var:123/134 constraints:638/1044
#Model   3.90s var:118/134 constraints:474/1044
#Done    3.90s no_lp
#Done    3.90s objective_lb_search_no_lp
#Model   3.90s var:117/134 constraints:451/1044
#Done    3.90s core
#Model   3.90s var:114/134 constraints:396/1044
#Model   3.90s var:110/134 constraints:293/1044
#Bound   3.90s best:880   next:[831,879]  objective_lb_search_no_lp [skipped_logs=13]

Task timing                                  n [     min,      max]      avg      dev     time         n [     min,      max]      avg      dev    dtime
                             'core':         1 [   3.79s,    3.79s]    3.79s   0.00ns    3.79s         1 [   5.22s,    5.22s]    5.22s   0.00ns    5.22s
                       'default_lp':         1 [   3.79s,    3.79s]    3.79s   0.00ns    3.79s         1 [666.04ms, 666.04ms] 666.04ms   0.00ns 666.04ms
                 'feasibility_pump':        31 [  5.62ms,  16.33ms]   8.61ms   1.51ms 267.00ms        30 [  1.71ms,   4.83ms]   1.86ms 551.83us  55.78ms
                  'fj_long_default':         0 [  0.00ns,   0.00ns]   0.00ns   0.00ns   0.00ns         0 [  0.00ns,   0.00ns]   0.00ns   0.00ns   0.00ns
              'fj_long_lin_default':         0 [  0.00ns,   0.00ns]   0.00ns   0.00ns   0.00ns         0 [  0.00ns,   0.00ns]   0.00ns   0.00ns   0.00ns
                   'fj_long_random':         0 [  0.00ns,   0.00ns]   0.00ns   0.00ns   0.00ns         0 [  0.00ns,   0.00ns]   0.00ns   0.00ns   0.00ns
                 'fj_short_default':         1 [ 60.80ms,  60.80ms]  60.80ms   0.00ns  60.80ms         1 [ 32.09ms,  32.09ms]  32.09ms   0.00ns  32.09ms
             'fj_short_lin_default':         0 [  0.00ns,   0.00ns]   0.00ns   0.00ns   0.00ns         0 [  0.00ns,   0.00ns]   0.00ns   0.00ns   0.00ns
              'fj_short_lin_random':         0 [  0.00ns,   0.00ns]   0.00ns   0.00ns   0.00ns         0 [  0.00ns,   0.00ns]   0.00ns   0.00ns   0.00ns
                  'fj_short_random':         0 [  0.00ns,   0.00ns]   0.00ns   0.00ns   0.00ns         0 [  0.00ns,   0.00ns]   0.00ns   0.00ns   0.00ns
                        'fs_random':         1 [  6.04ms,   6.04ms]   6.04ms   0.00ns   6.04ms         0 [  0.00ns,   0.00ns]   0.00ns   0.00ns   0.00ns
                        'fs_random':         1 [  7.84ms,   7.84ms]   7.84ms   0.00ns   7.84ms         1 [ 20.00ns,  20.00ns]  20.00ns   0.00ns  20.00ns
                  'fs_random_no_lp':         1 [  4.97ms,   4.97ms]   4.97ms   0.00ns   4.97ms         0 [  0.00ns,   0.00ns]   0.00ns   0.00ns   0.00ns
                  'fs_random_no_lp':         1 [  5.55ms,   5.55ms]   5.55ms   0.00ns   5.55ms         0 [  0.00ns,   0.00ns]   0.00ns   0.00ns   0.00ns
          'fs_random_quick_restart':         1 [  6.97ms,   6.97ms]   6.97ms   0.00ns   6.97ms         1 [ 20.00ns,  20.00ns]  20.00ns   0.00ns  20.00ns
          'fs_random_quick_restart':         1 [  7.62ms,   7.62ms]   7.62ms   0.00ns   7.62ms         1 [ 20.00ns,  20.00ns]  20.00ns   0.00ns  20.00ns
    'fs_random_quick_restart_no_lp':         1 [  5.43ms,   5.43ms]   5.43ms   0.00ns   5.43ms         0 [  0.00ns,   0.00ns]   0.00ns   0.00ns   0.00ns
                    'graph_arc_lns':        30 [  2.24ms, 727.54ms] 346.10ms 285.27ms   10.38s        29 [ 10.00ns, 100.24ms]  47.04ms  42.10ms    1.36s
                    'graph_cst_lns':        30 [790.05us,   3.86ms]   1.01ms 568.31us  30.21ms         0 [  0.00ns,   0.00ns]   0.00ns   0.00ns   0.00ns
                    'graph_dec_lns':        30 [  2.54ms, 783.27ms] 311.84ms 297.35ms    9.36s        27 [ 10.00ns, 168.90ms]  44.27ms  49.68ms    1.20s
                    'graph_var_lns':        30 [  2.75ms, 714.52ms] 266.77ms 274.39ms    8.00s        27 [ 10.00ns, 178.99ms]  38.93ms  49.35ms    1.05s
                   'lb_tree_search':         1 [   3.78s,    3.78s]    3.78s   0.00ns    3.78s         1 [   1.25s,    1.25s]    1.25s   0.00ns    1.25s
                           'max_lp':         1 [   3.79s,    3.79s]    3.79s   0.00ns    3.79s         1 [918.65ms, 918.65ms] 918.65ms   0.00ns 918.65ms
                            'no_lp':         1 [   3.79s,    3.79s]    3.79s   0.00ns    3.79s         1 [640.60ms, 640.60ms] 640.60ms   0.00ns 640.60ms
              'objective_lb_search':         1 [   3.78s,    3.78s]    3.78s   0.00ns    3.78s         1 [679.91ms, 679.91ms] 679.91ms   0.00ns 679.91ms
       'objective_lb_search_max_lp':         1 [   3.78s,    3.78s]    3.78s   0.00ns    3.78s         1 [   1.08s,    1.08s]    1.08s   0.00ns    1.08s
        'objective_lb_search_no_lp':         1 [   3.78s,    3.78s]    3.78s   0.00ns    3.78s         1 [555.11ms, 555.11ms] 555.11ms   0.00ns 555.11ms
  'objective_shaving_search_max_lp':        31 [  2.19ms, 230.00ms]  58.26ms  59.73ms    1.81s        20 [298.57us,  34.44ms]   7.23ms  10.11ms 144.61ms
   'objective_shaving_search_no_lp':        31 [  2.72ms, 238.24ms]  64.36ms  67.01ms    2.00s        21 [420.43us,  26.76ms]   6.99ms   8.85ms 146.88ms
                          'probing':         1 [   3.79s,    3.79s]    3.79s   0.00ns    3.79s         1 [128.01ms, 128.01ms] 128.01ms   0.00ns 128.01ms
                   'probing_max_lp':         1 [   3.79s,    3.79s]    3.79s   0.00ns    3.79s         1 [204.01ms, 204.01ms] 204.01ms   0.00ns 204.01ms
                     'pseudo_costs':         1 [   3.79s,    3.79s]    3.79s   0.00ns    3.79s         1 [877.52ms, 877.52ms] 877.52ms   0.00ns 877.52ms
                    'quick_restart':         1 [   3.79s,    3.79s]    3.79s   0.00ns    3.79s         1 [751.55ms, 751.55ms] 751.55ms   0.00ns 751.55ms
              'quick_restart_no_lp':         1 [   3.79s,    3.79s]    3.79s   0.00ns    3.79s         1 [756.03ms, 756.03ms] 756.03ms   0.00ns 756.03ms
                    'reduced_costs':         1 [   3.79s,    3.79s]    3.79s   0.00ns    3.79s         1 [777.44ms, 777.44ms] 777.44ms   0.00ns 777.44ms
                        'rins/rens':        31 [105.36us, 736.99ms] 382.32ms 297.75ms   11.85s        27 [ 10.00ns, 100.28ms]  62.86ms  42.26ms    1.70s
                      'rnd_cst_lns':        30 [808.58us, 786.81ms] 289.41ms 290.03ms    8.68s        27 [ 10.00ns, 100.26ms]  42.53ms  43.30ms    1.15s
                      'rnd_var_lns':        30 [  1.72ms, 767.44ms] 275.29ms 287.75ms    8.26s        29 [ 10.00ns, 100.32ms]  36.17ms  43.63ms    1.05s
                     'violation_ls':        31 [132.12us, 124.08ms]  72.75ms  48.63ms    2.26s        31 [390.00ns,  63.55ms]  36.22ms  24.74ms    1.12s
                     'violation_ls':        31 [133.59us, 118.80ms]  72.76ms  50.04ms    2.26s        31 [390.00ns,  66.21ms]  36.52ms  25.68ms    1.13s
                     'violation_ls':        31 [221.59us, 114.19ms]  86.99ms  28.91ms    2.70s        31 [ 24.94us,  57.24ms]  46.10ms  15.32ms    1.43s

Search stats                        Bools  Conflicts  Branches  Restarts  BoolPropag  IntegerPropag
                           'core':  3'434      4'767    18'655     4'259   7'187'466      1'653'023
                     'default_lp':    124      3'438    15'536     2'452      88'805      1'343'347
                      'fs_random':     51          0        14        14          12             26
                      'fs_random':     51          0        48        48          30            264
                'fs_random_no_lp':     51          0         0         0           0              0
                'fs_random_no_lp':     51          0        40        40          30            134
        'fs_random_quick_restart':     51          0         0         0           0              0
        'fs_random_quick_restart':     51          0        46        46          30            217
  'fs_random_quick_restart_no_lp':     51          0        38        38          30            103
                 'lb_tree_search':     51         70     9'402     1'588       8'055        276'565
                         'max_lp':     51      1'451    17'838     3'538      42'009      1'030'007
                          'no_lp':    337      8'193    21'732     2'969     661'188      2'701'803
            'objective_lb_search':     87      2'611    15'705     3'189      52'417      1'291'555
     'objective_lb_search_max_lp':     72      1'383    14'671     3'624      36'571        921'889
      'objective_lb_search_no_lp':    185      8'801    20'396     3'370     126'834      2'666'660
                        'probing':    173         56       290       290       1'993         10'988
                 'probing_max_lp':    133         32       234       234       1'214          7'809
                   'pseudo_costs':     86      1'678    18'056     3'900      54'738      1'061'520
                  'quick_restart':    180      1'291    19'879     4'485     108'018        898'989
            'quick_restart_no_lp':    500      7'476    38'795     4'290   1'018'766      2'529'754
                  'reduced_costs':    777      2'836    17'948     2'629     922'867      1'015'242

SAT stats                           ClassicMinim  LitRemoved  LitLearned  LitForgotten  Subsumed  MClauses  MDecisions  MLitTrue  MSubsumed  MLitRemoved  MReused
                           'core':         3'859      16'559      20'386             0        38     1'872       8'518         0        216          653       34
                     'default_lp':         1'616       3'349      26'972             0       224       998      10'052         0        254        1'710      204
                      'fs_random':             0           0           0             0         0         0           0         0          0            0        0
                      'fs_random':             0           0           0             0         0         0           0         0          0            0        0
                'fs_random_no_lp':             0           0           0             0         0         0           0         0          0            0        0
                'fs_random_no_lp':             0           0           0             0         0         0           0         0          0            0        0
        'fs_random_quick_restart':             0           0           0             0         0         0           0         0          0            0        0
        'fs_random_quick_restart':             0           0           0             0         0         0           0         0          0            0        0
  'fs_random_quick_restart_no_lp':             0           0           0             0         0         0           0         0          0            0        0
                 'lb_tree_search':             0           0         253             0         0       504       2'571         0         13           53       28
                         'max_lp':           524         904      10'804             0       161     1'646      15'055         0        286        1'663      475
                          'no_lp':         5'358      13'189      62'856             0       331     1'447       9'340         5        687        3'865      193
            'objective_lb_search':         1'424       2'561      16'488             0       230     1'283      10'912         0        243        1'433      509
     'objective_lb_search_max_lp':           874       1'605       8'198             0       101     1'372      10'869         0        189        1'025      491
      'objective_lb_search_no_lp':         5'940      12'901      50'742             0       474     1'357       8'092         8        561        3'003      219
                        'probing':             0           0          56             0         0         0           0         0          0            0        0
                 'probing_max_lp':             0           0          32             0         0         0           0         0          0            0        0
                   'pseudo_costs':           678       1'147      13'479             0       152     1'514      14'225         0        309        1'931      342
                  'quick_restart':           608       1'245      12'678             0       108     1'375      12'828         2        144          924      382
            'quick_restart_no_lp':         4'385      10'904      76'887             0       356     1'845      15'636         4        873        5'738      219
                  'reduced_costs':         1'468       3'496      22'285             0       111     1'601      12'917         0        806        5'469      375

Lp stats                         Component  Iterations  AddedCuts  OPTIMAL  DUAL_F.  DUAL_U.
                  'default_lp':          1      20'659      2'284    4'054        0        0
                   'fs_random':          1           0          0        0        0        0
                   'fs_random':          1           0          0        0        0        0
     'fs_random_quick_restart':          1           0          0        0        0        0
     'fs_random_quick_restart':          1           0          0        0        0        0
              'lb_tree_search':          1      52'094      2'332    3'308    1'423        0
                      'max_lp':          1      23'992      2'768    1'766      521        1
         'objective_lb_search':          1      23'488      2'030    3'335        0        0
  'objective_lb_search_max_lp':          1      35'581      1'879    1'732      832        0
                     'probing':          1       1'560      1'483      727        0        0
              'probing_max_lp':          1       1'584      1'659      495       17        0
                'pseudo_costs':          1      27'299      2'376    2'092      631        1
               'quick_restart':          1      21'497      2'414    3'135        0        0
               'reduced_costs':          1      20'128      3'238    2'742      500        0

Lp dimension                                                                     Final dimension of first component
                  'default_lp':   203 rows, 134 columns, 370 entries with magnitude in [2.109691e-03, 1.000000e+00]
                   'fs_random':       0 rows, 134 columns, 0 entries with magnitude in [0.000000e+00, 0.000000e+00]
                   'fs_random':       0 rows, 134 columns, 0 entries with magnitude in [0.000000e+00, 0.000000e+00]
     'fs_random_quick_restart':       0 rows, 134 columns, 0 entries with magnitude in [0.000000e+00, 0.000000e+00]
     'fs_random_quick_restart':       0 rows, 134 columns, 0 entries with magnitude in [0.000000e+00, 0.000000e+00]
              'lb_tree_search':   214 rows, 134 columns, 782 entries with magnitude in [1.471767e-02, 1.000000e+00]
                      'max_lp':  320 rows, 134 columns, 1233 entries with magnitude in [5.576426e-03, 1.000000e+00]
         'objective_lb_search':   290 rows, 134 columns, 857 entries with magnitude in [3.286495e-03, 1.000000e+00]
  'objective_lb_search_max_lp':  413 rows, 134 columns, 1618 entries with magnitude in [7.592584e-04, 1.000000e+00]
                     'probing':  209 rows, 134 columns, 1015 entries with magnitude in [6.414904e-04, 1.000000e+00]
              'probing_max_lp':   180 rows, 134 columns, 963 entries with magnitude in [8.309499e-03, 1.000000e+00]
                'pseudo_costs':  402 rows, 134 columns, 1562 entries with magnitude in [4.071410e-03, 1.000000e+00]
               'quick_restart':  437 rows, 134 columns, 2884 entries with magnitude in [1.140113e-04, 1.000000e+00]
               'reduced_costs':  639 rows, 134 columns, 2990 entries with magnitude in [6.032530e-04, 1.000000e+00]

Lp debug                         CutPropag  CutEqPropag  Adjust  Overflow      Bad  BadScaling
                  'default_lp':          7            5   1'954         0   13'581           0
                   'fs_random':          0            0       0         0        0           0
                   'fs_random':          0            0       0         0        0           0
     'fs_random_quick_restart':          0            0       0         0        0           0
     'fs_random_quick_restart':          0            0       0         0        0           0
              'lb_tree_search':          2            0   1'881         0    6'358           0
                      'max_lp':          5            0     810         0   11'901           0
         'objective_lb_search':          1            4   2'094         0   22'650           0
  'objective_lb_search_max_lp':          5            0   1'275         0   15'415           0
                     'probing':          0            3     686         0  191'172           0
              'probing_max_lp':          2            0     353         0  136'487           0
                'pseudo_costs':          6            3     955         0   14'796           0
               'quick_restart':          6            4   1'680         0   30'973           0
               'reduced_costs':         11            2   1'214         0   20'461           0

Lp pool                          Constraints  Updates  Simplif  Merged  Shortened  Split  Strenghtened    Cuts/Call
                  'default_lp':        2'490      243    9'249       8      2'543    638         2'534  2'284/5'201
                   'fs_random':          214        0        0       0          0      0             0          0/0
                   'fs_random':          214        0        0       0          0      0             0          0/0
     'fs_random_quick_restart':          214        0        0       0          0      0             0          0/0
     'fs_random_quick_restart':          214        0        0       0          0      0             0          0/0
              'lb_tree_search':        3'336      107    3'239      40        426    238         4'096  2'332/5'349
                      'max_lp':        3'794      204    9'355      18      1'999    528         7'579  2'768/6'044
         'objective_lb_search':        2'234      294    8'890      10      1'768    802         2'488  2'030/4'467
  'objective_lb_search_max_lp':        2'915      214   12'000       8      1'552    591         7'617  1'879/3'852
                     'probing':        1'688      126    1'176       9        762    316           845  1'483/2'701
              'probing_max_lp':        2'693       97      488      10          0    149         1'584  1'659/3'086
                'pseudo_costs':        3'412      200   13'399       8      1'961    599         8'147  2'376/4'980
               'quick_restart':        2'624      256   14'503       4      1'284  1'803         2'644  2'414/5'481
               'reduced_costs':        4'264      245   26'697      18      2'242    778         9'541  3'238/7'281

Lp Cut            defaul  max_lp  quick_  reduce  pseudo  lb_tre  probin  object  probin  object
          CG_FF:     207     190     164     221     146     134     133     142     103     113
           CG_K:      94     101      95     109      67      74      67      88      52      62
           CG_R:     149     141     127     145      51      78      45      86      80      59
          CG_RB:     377     461     344     462     378     496     281     295     297     243
         CG_RBP:      56      62      36      73      41      43      31      40      68      21
         Clique:       -      21       -      32      22      16       -       -       4      25
             IB:     286     188     264     229     248     216     207     276     119     241
       MIR_1_FF:     128     192     140     214     161     178      82     141     118     141
        MIR_1_K:      17      26       8      21      15      26      11      11      13      11
       MIR_1_KL:       1       -       -       1       -       -       -       -       -       -
        MIR_1_R:      25      23      28      16      13      23      18      18      21       4
       MIR_1_RB:     172     259     172     345     238     219     127     182     137     166
      MIR_1_RBP:      10      21       6      40      38      29       5       6      15      24
      MIR_1_RLT:       -      11       -       9       4       6       -       -       8       3
       MIR_2_FF:      72     100      97     114      88      85      47      66      50      61
        MIR_2_K:      18      21      13      23      21      14       8      12      13      15
       MIR_2_KL:       1       -       1       1       -       -       -       2       -       -
        MIR_2_R:      34      30      41      50      38      25       7      11      14      20
       MIR_2_RB:      87     137     123     173     103     112      50      92      77      84
      MIR_2_RBP:       7      16      14      28      14      18       5       8       7      15
       MIR_3_FF:      45      68      83      53      46      37      25      44      24      35
        MIR_3_K:      15      17      12      18      13       9       8       8       4      13
       MIR_3_KL:       -       -       -       -       -       -       -       -       1       -
        MIR_3_R:      28      22      50      23      25      12       9      12      13      13
       MIR_3_RB:      65      94      87      93      72      60      40      62      32      48
      MIR_3_RBP:       4      11      12      11       6       7       5       9       2       7
       MIR_4_FF:      22      19      48      27      27      20      15      17      15      22
        MIR_4_K:       4       8      13       2      10       2       3       7       5       -
        MIR_4_R:      13       8      26      13       7       4       5       8       5       7
       MIR_4_RB:      34      43      38      51      31      24      23      33      25      27
      MIR_4_RBP:       1       2       3       3       2       2       5       5       4       1
       MIR_5_FF:      10      11      17      21       7       8       5      16      10      13
        MIR_5_K:       5       1       5       6       2       1       1       5       4       6
        MIR_5_R:       4       7       7       8       5       1       2       3       1       2
       MIR_5_RB:      14      15      17      29       8       6       8      20      10       8
      MIR_5_RBP:       1       1       3       5       1       1       -       5       2       -
       MIR_6_FF:       6       4      11       6       6       4       4       7       3       6
        MIR_6_K:       2       1       2       2       1       1       -       3       -       3
        MIR_6_R:       1       2       5       5       3       3       -       -       -       -
       MIR_6_RB:       6       5       6      17       4       8       2       9       3       3
      MIR_6_RBP:       1       1       3       1       2       -       -       1       1       -
   ZERO_HALF_FF:      37      38      33      74      44      43      27      40      30      30
    ZERO_HALF_K:       2       7       1       9       4      10       5       4       4       3
    ZERO_HALF_R:     170     288     195     329     294     170     113     170     209     251
   ZERO_HALF_RB:      46      80      50     107      60      94      49      52      47      59
  ZERO_HALF_RBP:       7      15      14      19      10      13       5      14       9      14

LNS stats           Improv/Calls  Closed  Difficulty  TimeLimit
  'graph_arc_lns':          3/30     60%        0.97       0.10
  'graph_cst_lns':           0/0      0%        0.50       0.10
  'graph_dec_lns':          7/30     60%        0.97       0.10
  'graph_var_lns':          4/30     63%        0.98       0.10
      'rins/rens':         10/28     46%        0.82       0.10
    'rnd_cst_lns':          4/27     63%        0.98       0.10
    'rnd_var_lns':          6/30     70%        0.99       0.10

LS stats                   Batches  Restarts  LinMoves  GenMoves  CompoundMoves  WeightUpdates
       'fj_long_default':        0         0         0         0              0              0
   'fj_long_lin_default':        0         0         0         0              0              0
        'fj_long_random':        0         0         0         0              0              0
      'fj_short_default':        1         1         0     3'981            499              6
  'fj_short_lin_default':        0         0         0         0              0              0
   'fj_short_lin_random':        0         0         0         0              0              0
       'fj_short_random':        0         0         0         0              0              0
          'violation_ls':       31         0    18'479   175'576          6'744          2'601
          'violation_ls':       31         0    20'267   173'897          6'584         11'471
          'violation_ls':       31         0        45   222'847         19'220            584

Solutions (39)            Num     Rank
           'default_lp':    1  [39,39]
        'graph_var_lns':    1  [20,20]
                'no_lp':    8   [1,11]
  'quick_restart_no_lp':   11   [2,34]
          'rnd_var_lns':    2  [12,35]
         'violation_ls':   16  [15,38]

Objective bounds                Num
             'initial_domain':    1
        'objective_lb_search':    3
  'objective_lb_search_no_lp':   73

Solution repositories    Added  Queried  Ignored  Synchro
  'feasible solutions':    197      539        4      175
        'lp solutions':     83        7        0       62
                'pump':    209       23

Improving bounds shared          Num
                        'core':    3
                  'default_lp':   28
                      'max_lp':    5
                       'no_lp':  293
  'objective_lb_search_max_lp':    4
   'objective_lb_search_no_lp':   10
                     'probing':   45
              'probing_max_lp':   17
                'pseudo_costs':   16
               'quick_restart':  229
         'quick_restart_no_lp':   96
               'reduced_costs':   30

Clauses shared                   Num
                        'core':    1
                  'default_lp':   18
                      'max_lp':    4
                       'no_lp':   75
  'objective_lb_search_max_lp':    5
   'objective_lb_search_no_lp':    8
                'pseudo_costs':    6
               'quick_restart':    3
         'quick_restart_no_lp':    2
               'reduced_costs':    1

CpSolverResponse summary:
status: OPTIMAL
objective: 880
best_bound: 880
integers: 135
booleans: 51
conflicts: 0
branches: 40
propagations: 30
integer_propagations: 134
restarts: 40
lp_iterations: 0
walltime: 3.92885
usertime: 3.92885
deterministic_time: 26.0736
gap_integral: 66.6963
solution_fingerprint: 0xcdec73ca604511e2


--- Simulation Gantt  partir du modle mathmatique ---
{'big':0, 'due_date':89, 'pos_time':5, 'status':0, 'blocked':0, 'operations':["{'type':0, 'processing_time':49}"]}
{'big':0, 'due_date':63, 'pos_time':5, 'status':0, 'blocked':0, 'operations':["{'type':1, 'processing_time':48}"]}
{'big':0, 'due_date':53, 'pos_time':5, 'status':0, 'blocked':0, 'operations':["{'type':1, 'processing_time':40}"]}
{'big':1, 'due_date':63, 'pos_time':5, 'status':0, 'blocked':0, 'operations':["{'type':1, 'processing_time':57}"]}
{'big':0, 'due_date':97, 'pos_time':5, 'status':0, 'blocked':0, 'operations':["{'type':1, 'processing_time':25}", "{'type':0, 'processing_time':41}"]}
{'big':0, 'due_date':81, 'pos_time':5, 'status':0, 'blocked':0, 'operations':["{'type':1, 'processing_time':53}"]}
{'big':0, 'due_date':77, 'pos_time':5, 'status':0, 'blocked':0, 'operations':["{'type':0, 'processing_time':10}"]}
