created virtual environment CPython3.12.4.final.0-64 in 9233ms
  creator CPython3Posix(dest=/localscratch/aneumann.46806195.0/env, clear=False, no_vcs_ignore=False, global=False)
  seeder FromAppData(download=False, pip=bundle, via=copy, app_data_dir=/home/aneumann/.local/share/virtualenv)
    added seed packages: pip==24.2+computecanada
  activators BashActivator,CShellActivator,FishActivator,NushellActivator,PowerShellActivator,PythonActivator
Looking in links: /cvmfs/soft.computecanada.ca/custom/python/wheelhouse/gentoo2023/x86-64-v3, /cvmfs/soft.computecanada.ca/custom/python/wheelhouse/gentoo2023/generic, /cvmfs/soft.computecanada.ca/custom/python/wheelhouse/generic
Requirement already satisfied: pip in /localscratch/aneumann.46806195.0/env/lib/python3.12/site-packages (24.2+computecanada)
Processing /cvmfs/soft.computecanada.ca/custom/python/wheelhouse/generic/pip-25.0+computecanada-py3-none-any.whl
Installing collected packages: pip
  Attempting uninstall: pip
    Found existing installation: pip 24.2+computecanada
    Uninstalling pip-24.2+computecanada:
      Successfully uninstalled pip-24.2+computecanada
Successfully installed pip-24.2+computecanada
Looking in links: /cvmfs/soft.computecanada.ca/custom/python/wheelhouse/gentoo2023/x86-64-v3, /cvmfs/soft.computecanada.ca/custom/python/wheelhouse/gentoo2023/generic, /cvmfs/soft.computecanada.ca/custom/python/wheelhouse/generic
ERROR: protobuf-5.28.3-cp38-abi3-manylinux2014_x86_64.whl is not a supported wheel on this platform.
Looking in links: /cvmfs/soft.computecanada.ca/custom/python/wheelhouse/gentoo2023/x86-64-v3, /cvmfs/soft.computecanada.ca/custom/python/wheelhouse/gentoo2023/generic, /cvmfs/soft.computecanada.ca/custom/python/wheelhouse/generic
Processing /home/aneumann/projects/def-adhaj/aneumann/GNRS/wheels/immutabledict-4.2.0-py3-none-any.whl
Installing collected packages: immutabledict
Successfully installed immutabledict-4.2.0
Looking in links: /cvmfs/soft.computecanada.ca/custom/python/wheelhouse/gentoo2023/x86-64-v3, /cvmfs/soft.computecanada.ca/custom/python/wheelhouse/gentoo2023/generic, /cvmfs/soft.computecanada.ca/custom/python/wheelhouse/generic
Processing /cvmfs/soft.computecanada.ca/custom/python/wheelhouse/generic/ortools-9.10.4067+computecanada-cp312-cp312-linux_x86_64.whl (from -r /home/aneumann/projects/def-adhaj/aneumann/GNRS/requirements/or.txt (line 1))
Processing /cvmfs/soft.computecanada.ca/custom/python/wheelhouse/gentoo2023/x86-64-v3/matplotlib-3.10.0+computecanada-cp312-cp312-linux_x86_64.whl (from -r /home/aneumann/projects/def-adhaj/aneumann/GNRS/requirements/or.txt (line 2))
Processing /cvmfs/soft.computecanada.ca/custom/python/wheelhouse/gentoo2023/x86-64-v3/pandas-2.2.3+computecanada-cp312-cp312-linux_x86_64.whl (from -r /home/aneumann/projects/def-adhaj/aneumann/GNRS/requirements/or.txt (line 3))
Processing /cvmfs/soft.computecanada.ca/custom/python/wheelhouse/generic/absl_py-2.3.0+computecanada-py3-none-any.whl (from ortools<9.11,>=9.10->-r /home/aneumann/projects/def-adhaj/aneumann/GNRS/requirements/or.txt (line 1))
Processing /cvmfs/soft.computecanada.ca/custom/python/wheelhouse/gentoo2023/generic/numpy-2.2.2+computecanada-cp312-cp312-linux_x86_64.whl (from ortools<9.11,>=9.10->-r /home/aneumann/projects/def-adhaj/aneumann/GNRS/requirements/or.txt (line 1))
Processing /cvmfs/soft.computecanada.ca/custom/python/wheelhouse/gentoo2023/x86-64-v3/protobuf-6.31.1+computecanada-cp312-cp312-linux_x86_64.whl (from ortools<9.11,>=9.10->-r /home/aneumann/projects/def-adhaj/aneumann/GNRS/requirements/or.txt (line 1))
Requirement already satisfied: immutabledict>=3.0.0 in /localscratch/aneumann.46806195.0/env/lib/python3.12/site-packages (from ortools<9.11,>=9.10->-r /home/aneumann/projects/def-adhaj/aneumann/GNRS/requirements/or.txt (line 1)) (4.2.0)
Processing /cvmfs/soft.computecanada.ca/custom/python/wheelhouse/gentoo2023/generic/contourpy-1.3.1+computecanada-cp312-cp312-linux_x86_64.whl (from matplotlib->-r /home/aneumann/projects/def-adhaj/aneumann/GNRS/requirements/or.txt (line 2))
Processing /cvmfs/soft.computecanada.ca/custom/python/wheelhouse/generic/cycler-0.12.1+computecanada-py3-none-any.whl (from matplotlib->-r /home/aneumann/projects/def-adhaj/aneumann/GNRS/requirements/or.txt (line 2))
Processing /cvmfs/soft.computecanada.ca/custom/python/wheelhouse/generic/fonttools-4.59.0+computecanada-cp312-cp312-linux_x86_64.whl (from matplotlib->-r /home/aneumann/projects/def-adhaj/aneumann/GNRS/requirements/or.txt (line 2))
Processing /cvmfs/soft.computecanada.ca/custom/python/wheelhouse/gentoo2023/x86-64-v3/kiwisolver-1.4.8+computecanada-cp312-cp312-linux_x86_64.whl (from matplotlib->-r /home/aneumann/projects/def-adhaj/aneumann/GNRS/requirements/or.txt (line 2))
Processing /cvmfs/soft.computecanada.ca/custom/python/wheelhouse/generic/packaging-25.0+computecanada-py3-none-any.whl (from matplotlib->-r /home/aneumann/projects/def-adhaj/aneumann/GNRS/requirements/or.txt (line 2))
Processing /cvmfs/soft.computecanada.ca/custom/python/wheelhouse/gentoo2023/x86-64-v3/pillow-11.1.0+computecanada-cp312-cp312-linux_x86_64.whl (from matplotlib->-r /home/aneumann/projects/def-adhaj/aneumann/GNRS/requirements/or.txt (line 2))
Processing /cvmfs/soft.computecanada.ca/custom/python/wheelhouse/generic/pyparsing-3.2.3+computecanada-py3-none-any.whl (from matplotlib->-r /home/aneumann/projects/def-adhaj/aneumann/GNRS/requirements/or.txt (line 2))
Processing /cvmfs/soft.computecanada.ca/custom/python/wheelhouse/generic/python_dateutil-2.9.0.post0+computecanada-py2.py3-none-any.whl (from matplotlib->-r /home/aneumann/projects/def-adhaj/aneumann/GNRS/requirements/or.txt (line 2))
Processing /cvmfs/soft.computecanada.ca/custom/python/wheelhouse/generic/pytz-2025.2+computecanada-py2.py3-none-any.whl (from pandas->-r /home/aneumann/projects/def-adhaj/aneumann/GNRS/requirements/or.txt (line 3))
Processing /cvmfs/soft.computecanada.ca/custom/python/wheelhouse/generic/tzdata-2025.2+computecanada-py2.py3-none-any.whl (from pandas->-r /home/aneumann/projects/def-adhaj/aneumann/GNRS/requirements/or.txt (line 3))
Processing /cvmfs/soft.computecanada.ca/custom/python/wheelhouse/generic/six-1.17.0+computecanada-py2.py3-none-any.whl (from python-dateutil>=2.7->matplotlib->-r /home/aneumann/projects/def-adhaj/aneumann/GNRS/requirements/or.txt (line 2))
Installing collected packages: pytz, tzdata, six, pyparsing, protobuf, pillow, packaging, numpy, kiwisolver, fonttools, cycler, absl-py, python-dateutil, contourpy, pandas, matplotlib, ortools
Successfully installed absl-py-2.3.0+computecanada contourpy-1.3.1+computecanada cycler-0.12.1+computecanada fonttools-4.59.0+computecanada kiwisolver-1.4.8+computecanada matplotlib-3.10.0+computecanada numpy-2.2.2+computecanada ortools-9.10.4067+computecanada packaging-25.0+computecanada pandas-2.2.3+computecanada pillow-11.1.0+computecanada protobuf-6.31.1+computecanada pyparsing-3.2.3+computecanada python-dateutil-2.9.0.post0+computecanada pytz-2025.2+computecanada six-1.17.0+computecanada tzdata-2025.2+computecanada

Starting CP-SAT solver v9.10.4067
Parameters: max_time_in_seconds: 86400 max_memory_in_mb: 185000 log_search_progress: true enumerate_all_solutions: false num_search_workers: 32 absolute_gap_limit: 0 relative_gap_limit: 0

Initial optimization model '': (model_fingerprint: 0xd685d0cc7bf8b9cc)
#Variables: 408 (#ints: 10 in objective)
  - 306 Booleans in [0,1]
  - 102 in [0,666]
#kLinear1: 51
#kLinear2: 626
#kLinear3: 253
#kLinearN: 6'757 (#terms: 109'392)

Starting presolve at 0.00s
  3.08e-03s  0.00e+00d  [DetectDominanceRelations] 
  4.78e-02s  0.00e+00d  [PresolveToFixPoint] #num_loops=8 #num_dual_strengthening=3 
  4.67e-05s  0.00e+00d  [ExtractEncodingFromLinear] #potential_supersets=4 
[Symmetry] Graph for symmetry has 7'552 nodes and 85'620 arcs.
[Symmetry] Symmetry computation done. time: 0.00300837 dtime: 0.00647574
[Symmetry] #generators: 1, average support size: 26
[Symmetry] The model contains 286 duplicate constraints !
[Symmetry] 13 orbits with sizes: 2,2,2,2,2,2,2,2,2,2,...
[Symmetry] Num fixable by intersecting at_most_one with orbits: 1 largest_orbit: 2
  1.89e-02s  4.88e-03d  [Probe] #probed=454 #new_bounds=11 #equiv=1 
  9.90e-05s  0.00e+00d  [MaxClique] Merged 14(28 literals) into 6(12 literals) at_most_ones. 
  2.96e-03s  0.00e+00d  [DetectDominanceRelations] 
  2.19e-02s  0.00e+00d  [PresolveToFixPoint] #num_loops=5 #num_dual_strengthening=3 
  9.92e-03s  0.00e+00d  [ProcessAtMostOneAndLinear] 
  3.58e-03s  0.00e+00d  [DetectDuplicateConstraints] #duplicates=397 #without_enforcements=347 
  4.58e-03s  4.24e-04d  [DetectDominatedLinearConstraints] #relevant_constraints=5'938 #num_inclusions=5'171 
  5.66e-04s  0.00e+00d  [DetectDifferentVariables] #different=37 #cliques=1 #size=8 
  9.55e-04s  1.22e-04d  [ProcessSetPPC] #relevant_constraints=5'244 
  2.68e-05s  0.00e+00d  [FindAlmostIdenticalLinearConstraints] 
  2.30e-04s  3.65e-04d  [FindBigAtMostOneAndLinearOverlap] 
  1.05e-02s  8.10e-03d  [FindBigVerticalLinearOverlap] #blocks=68 #saved_nz=15'177 
  5.95e-04s  2.80e-04d  [FindBigHorizontalLinearOverlap] #linears=5'166 
  2.93e-05s  0.00e+00d  [MergeClauses] 
  3.21e-03s  0.00e+00d  [DetectDominanceRelations] 
  3.33e-02s  0.00e+00d  [PresolveToFixPoint] #num_loops=2 #num_dual_strengthening=1 
  3.20e-03s  0.00e+00d  [DetectDominanceRelations] 
  1.96e-02s  0.00e+00d  [PresolveToFixPoint] #num_loops=1 #num_dual_strengthening=1 
[Symmetry] Graph for symmetry has 7'362 nodes and 69'066 arcs.
[Symmetry] Symmetry computation done. time: 0.00132621 dtime: 0.00365386
  1.67e-02s  4.10e-03d  [Probe] #probed=454 #new_bounds=49 
  2.29e-05s  0.00e+00d  [MaxClique] 
  3.17e-03s  0.00e+00d  [DetectDominanceRelations] 
  3.08e-02s  0.00e+00d  [PresolveToFixPoint] #num_loops=2 #num_dual_strengthening=1 
  9.17e-03s  0.00e+00d  [ProcessAtMostOneAndLinear] 
  3.16e-03s  0.00e+00d  [DetectDuplicateConstraints] #without_enforcements=378 
  2.96e-03s  2.57e-04d  [DetectDominatedLinearConstraints] #relevant_constraints=5'639 #num_inclusions=1'740 
  4.04e-04s  0.00e+00d  [DetectDifferentVariables] 
  8.81e-04s  8.95e-05d  [ProcessSetPPC] #relevant_constraints=5'063 
  4.01e-05s  2.30e-07d  [FindAlmostIdenticalLinearConstraints] #num_tested_pairs=15 
  1.31e-04s  1.72e-04d  [FindBigAtMostOneAndLinearOverlap] 
  8.18e-03s  5.68e-03d  [FindBigVerticalLinearOverlap] #blocks=115 #saved_nz=9'730 
  5.49e-04s  2.18e-04d  [FindBigHorizontalLinearOverlap] #linears=4'704 
  1.80e-05s  0.00e+00d  [MergeClauses] 
  2.83e-03s  0.00e+00d  [DetectDominanceRelations] 
  3.33e-02s  0.00e+00d  [PresolveToFixPoint] #num_loops=2 #num_dual_strengthening=1 
  2.84e-03s  0.00e+00d  [DetectDominanceRelations] 
  2.13e-02s  0.00e+00d  [PresolveToFixPoint] #num_loops=1 #num_dual_strengthening=1 
[Symmetry] Graph for symmetry has 7'683 nodes and 59'429 arcs.
[Symmetry] Symmetry computation done. time: 0.00123535 dtime: 0.00331088
  1.56e-02s  3.68e-03d  [Probe] #probed=454 #new_bounds=59 
  2.06e-05s  0.00e+00d  [MaxClique] 
  2.83e-03s  0.00e+00d  [DetectDominanceRelations] 
  2.86e-02s  0.00e+00d  [PresolveToFixPoint] #num_loops=2 #num_dual_strengthening=1 
  8.35e-03s  0.00e+00d  [ProcessAtMostOneAndLinear] 
  3.04e-03s  0.00e+00d  [DetectDuplicateConstraints] #without_enforcements=378 
  2.17e-03s  1.79e-04d  [DetectDominatedLinearConstraints] #relevant_constraints=5'549 #num_inclusions=406 
  3.91e-04s  0.00e+00d  [DetectDifferentVariables] 
  7.60e-04s  6.83e-05d  [ProcessSetPPC] #relevant_constraints=4'703 
  5.25e-05s  2.31e-06d  [FindAlmostIdenticalLinearConstraints] #num_tested_pairs=135 
  1.14e-04s  1.23e-04d  [FindBigAtMostOneAndLinearOverlap] 
  5.27e-03s  4.15e-03d  [FindBigVerticalLinearOverlap] #blocks=80 #saved_nz=5'989 
  4.64e-04s  1.79e-04d  [FindBigHorizontalLinearOverlap] #linears=4'234 
  2.32e-05s  0.00e+00d  [MergeClauses] 
  2.65e-03s  0.00e+00d  [DetectDominanceRelations] 
  2.98e-02s  0.00e+00d  [PresolveToFixPoint] #num_loops=2 #num_dual_strengthening=1 
  1.22e-04s  0.00e+00d  [ExpandObjective] #entries=1'217 #tight_variables=442 #tight_constraints=240 

Presolve summary:
  - 107 affine relations were detected.
  - rule 'TODO dual: only one blocking constraint?' was applied 838 times.
  - rule 'TODO dual: only one blocking enforced constraint?' was applied 130 times.
  - rule 'TODO dual: only one unspecified blocking constraint?' was applied 40 times.
  - rule 'TODO duplicate: identical constraint with different enforcements' was applied 1'103 times.
  - rule 'affine: new relation' was applied 107 times.
  - rule 'at_most_one: removed literals' was applied 6 times.
  - rule 'at_most_one: size one' was applied 6 times.
  - rule 'at_most_one: transformed into max clique.' was applied 1 time.
  - rule 'deductions: 370 stored' was applied 1 time.
  - rule 'dual: fix variable' was applied 27 times.
  - rule 'dual: reduced domain' was applied 60 times.
  - rule 'duplicate: merged rhs of linear constraint' was applied 99 times.
  - rule 'duplicate: removed constraint' was applied 397 times.
  - rule 'enforcement: false literal' was applied 10 times.
  - rule 'exactly_one: x and not(x)' was applied 1 time.
  - rule 'incompatible linear: add implication' was applied 84 times.
  - rule 'linear matrix: common vertical rectangle' was applied 263 times.
  - rule 'linear: always true' was applied 880 times.
  - rule 'linear: doubleton free' was applied 14 times.
  - rule 'linear: empty' was applied 38 times.
  - rule 'linear: extracted enforcement literal' was applied 11'102 times.
  - rule 'linear: fixed or dup variables' was applied 6'924 times.
  - rule 'linear: positive equal one' was applied 4 times.
  - rule 'linear: reduced variable domains' was applied 371 times.
  - rule 'linear: remapped using affine relations' was applied 6'952 times.
  - rule 'linear: simplified rhs' was applied 19'319 times.
  - rule 'linear: tightened into equality' was applied 9 times.
  - rule 'linear: variable substitution 1' was applied 14 times.
  - rule 'linear: variable substitution 2' was applied 4 times.
  - rule 'linear: variable substitution 3' was applied 3 times.
  - rule 'no_overlap: inferred from x != y constraints' was applied 1 time.
  - rule 'presolve: 107 unused variables removed.' was applied 1 time.
  - rule 'presolve: iteration' was applied 3 times.
  - rule 'probing: reduced enforced constraint to implication.' was applied 14 times.
  - rule 'symmetry: fixed to false in general orbit' was applied 1 time.

Presolved optimization model '': (model_fingerprint: 0xd006a3e6f8f9ee57)
#Variables: 436 (#ints: 10 in objective)
  - 115 Booleans in [0,1]
  - 257 different domains in [-5247,6513] with a largest complexity of 13.
#kExactlyOne: 3 (#literals: 9)
#kInterval: 8
#kLinear2: 939 (#enforced: 897 #multi: 691)
#kLinear3: 848 (#enforced: 624 #multi: 78)
#kLinearN: 4'693 (#enforced: 4'505 #multi: 82) (#terms: 37'570)
#kNoOverlap: 1 (#intervals: 8)

Preloading model.
#Bound   0.43s best:inf   next:[209,5299] initial_domain
[Symmetry] Graph for symmetry has 7'677 nodes and 53'510 arcs.
[Symmetry] Symmetry computation done. time: 0.00109323 dtime: 0.00299747
#Model   0.44s var:436/436 constraints:6492/6492

Starting search at 0.44s with 32 workers.
17 full problem subsolvers: [core, default_lp, fixed, lb_tree_search, max_lp, no_lp, objective_lb_search, objective_lb_search_max_lp, objective_lb_search_no_lp, objective_shaving_search_max_lp, objective_shaving_search_no_lp, probing, probing_max_lp, pseudo_costs, quick_restart, quick_restart_no_lp, reduced_costs]
13 first solution subsolvers: [fj_long_default, fj_long_lin_default, fj_long_random, fj_short_default, fj_short_lin_default, fj_short_lin_random, fj_short_random, fs_random(2), fs_random_no_lp, fs_random_quick_restart(2), fs_random_quick_restart_no_lp]
13 incomplete subsolvers: [feasibility_pump, graph_arc_lns, graph_cst_lns, graph_dec_lns, graph_var_lns, rins/rens, rnd_cst_lns, rnd_var_lns, scheduling_intervals_lns, scheduling_precedences_lns, scheduling_time_window_lns, violation_ls(2)]
3 helper subsolvers: [neighborhood_helper, synchronization_agent, update_gap_integral]
#Bound   0.55s best:inf   next:[218,5299] objective_lb_search_no_lp
#Bound   0.59s best:inf   next:[220,5299] objective_lb_search_no_lp
#Bound   0.59s best:inf   next:[283,5299] objective_lb_search_no_lp
#1       0.62s best:2013  next:[283,2012] fs_random_no_lp (fixed_bools=0/169)
#Bound   0.64s best:2013  next:[293,2012] objective_lb_search_no_lp
#Bound   0.66s best:2013  next:[339,2012] objective_lb_search_no_lp
#2       0.71s best:1996  next:[339,1995] quick_restart_no_lp (fixed_bools=0/183)
#3       0.72s best:1995  next:[339,1994] violation_ls(batch:2 #solutions_imported:2 #lin_moves:1 #lin_evals:14'441 #gen_moves:5'952 #gen_evals:1'702 #comp_moves:972 #backtracks:2'490 #weight_updates:70)
#4       0.74s best:1994  next:[339,1993] violation_ls(batch:3 #solutions_imported:3 #lin_moves:2 #lin_evals:14'450 #gen_moves:5'952 #gen_evals:1'702 #comp_moves:972 #backtracks:2'490 #weight_updates:70)
#5       0.76s best:1956  next:[339,1955] quick_restart_no_lp (fixed_bools=0/194)
#6       0.79s best:1911  next:[339,1910] rnd_var_lns (d=0.81 s=55 t=0.10 p=1.00 stall=2 h=auto_l0) [presolve]
#7       0.80s best:1788  next:[339,1787] no_lp (fixed_bools=0/167)
#8       0.80s best:1778  next:[339,1777] no_lp (fixed_bools=0/168)
#9       0.81s best:1772  next:[339,1771] no_lp (fixed_bools=0/175)
#10      0.81s best:1752  next:[339,1751] no_lp (fixed_bools=0/178)
#11      0.83s best:1719  next:[339,1718] no_lp (fixed_bools=0/184)
#12      0.84s best:1578  next:[339,1577] no_lp (fixed_bools=0/194)
#13      0.90s best:1291  next:[339,1290] no_lp (fixed_bools=0/208)
#14      0.91s best:1260  next:[339,1259] no_lp (fixed_bools=0/224)
#15      0.97s best:1251  next:[339,1250] quick_restart_no_lp (fixed_bools=0/331)
#16      1.00s best:1244  next:[339,1243] quick_restart_no_lp (fixed_bools=0/333)
#17      1.06s best:1212  next:[339,1211] no_lp (fixed_bools=0/239)
#18      1.08s best:1169  next:[339,1168] no_lp (fixed_bools=0/256)
#19      1.11s best:1151  next:[339,1150] no_lp (fixed_bools=0/271)
#Bound   1.15s best:1151  next:[398,1150] objective_lb_search_no_lp
#Bound   1.20s best:1151  next:[400,1150] objective_lb_search_no_lp
#Bound   1.26s best:1151  next:[401,1150] objective_lb_search_no_lp
#Bound   1.32s best:1151  next:[405,1150] objective_lb_search_no_lp
#Bound   1.39s best:1151  next:[407,1150] objective_lb_search_no_lp
#Bound   1.44s best:1151  next:[410,1150] objective_lb_search_no_lp
#Bound   1.71s best:1151  next:[416,1150] objective_lb_search
#20      2.02s best:1149  next:[416,1148] quick_restart_no_lp (fixed_bools=2/492)
#Bound   2.12s best:1149  next:[426,1148] objective_lb_search_no_lp
#Bound   2.21s best:1149  next:[446,1148] objective_lb_search_no_lp
#Bound   2.27s best:1149  next:[452,1148] objective_lb_search_no_lp
#21      2.31s best:1145  next:[452,1144] quick_restart_no_lp (fixed_bools=2/532)
#22      2.33s best:1133  next:[452,1132] no_lp (fixed_bools=0/323)
#23      2.36s best:1130  next:[452,1129] no_lp (fixed_bools=0/329)
#24      2.39s best:1129  next:[452,1128] quick_restart_no_lp (fixed_bools=2/589)
#25      2.44s best:1128  next:[452,1127] quick_restart_no_lp (fixed_bools=2/596)
#26      2.49s best:1127  next:[452,1126] no_lp (fixed_bools=0/345)
#27      2.50s best:1126  next:[452,1125] no_lp (fixed_bools=0/345)
#28      2.51s best:1124  next:[452,1123] no_lp (fixed_bools=0/346)
#29      2.52s best:1123  next:[452,1122] no_lp (fixed_bools=0/346)
#30      2.64s best:1013  next:[452,1012] scheduling_time_window_lns (d=0.50 s=51 t=0.10 p=0.00 stall=0 h=auto_l0)
#Bound   2.70s best:1013  next:[476,1012] objective_lb_search_no_lp
#31      2.92s best:970   next:[476,969]  quick_restart_no_lp (fixed_bools=164/870)
#32      3.05s best:969   next:[476,968]  graph_arc_lns (d=0.96 s=125 t=0.10 p=1.00 stall=6 h=auto_l0)
#Bound   3.21s best:969   next:[485,968]  objective_lb_search
#33      3.55s best:901   next:[485,900]  rins_lp_lns (d=0.91 s=118 t=0.10 p=1.00 stall=4 h=auto_l0)
#34      3.80s best:900   next:[485,899]  rnd_var_lns (d=0.98 s=163 t=0.10 p=1.00 stall=6 h=auto_l0)
#35      3.85s best:899   next:[485,898]  violation_ls(batch:11 #solutions_imported:9 #lin_moves:39'028 #lin_evals:218'132 #gen_moves:24'797 #gen_evals:5'912 #comp_moves:3'263 #backtracks:10'762 #weight_updates:1'443)
#Bound   3.93s best:899   next:[575,898]  objective_lb_search_no_lp
#36      4.07s best:842   next:[575,841]  graph_arc_lns (d=0.99 s=179 t=0.10 p=1.00 stall=3 h=auto_l0)
#37      4.79s best:811   next:[575,810]  rnd_cst_lns (d=0.99 s=192 t=0.10 p=1.00 stall=0 h=auto_l0)
#Bound   5.23s best:811   next:[578,810]  objective_lb_search_no_lp
#Bound   7.62s best:811   next:[579,810]  objective_lb_search
#Bound   7.91s best:811   next:[580,810]  objective_lb_search_max_lp
#Bound  12.19s best:811   next:[581,810]  objective_lb_search_max_lp
#Bound  12.43s best:811   next:[582,810]  objective_lb_search_max_lp
#Bound  13.44s best:811   next:[585,810]  objective_lb_search
#Bound  16.00s best:811   next:[586,810]  objective_lb_search_max_lp
#Bound  17.35s best:811   next:[589,810]  objective_lb_search_max_lp
#Bound  19.72s best:811   next:[591,810]  objective_lb_search_no_lp
#Bound  21.72s best:811   next:[593,810]  objective_lb_search_no_lp
#Bound  22.57s best:811   next:[595,810]  objective_lb_search_no_lp
#Bound  24.31s best:811   next:[597,810]  objective_lb_search_no_lp
#Bound  27.32s best:811   next:[598,810]  objective_lb_search
#Bound  27.92s best:811   next:[599,810]  objective_lb_search_no_lp
#Bound  30.40s best:811   next:[601,810]  objective_lb_search_no_lp
#Bound  31.05s best:811   next:[602,810]  objective_lb_search_no_lp
#Bound  31.79s best:811   next:[603,810]  objective_lb_search_no_lp
#Bound  33.48s best:811   next:[608,810]  objective_lb_search_no_lp
#Bound  37.55s best:811   next:[610,810]  objective_lb_search_no_lp
#Bound  42.74s best:811   next:[612,810]  objective_lb_search_no_lp
#Bound  43.60s best:811   next:[614,810]  objective_lb_search_no_lp
#Bound  45.31s best:811   next:[616,810]  objective_lb_search_no_lp
#Bound  46.36s best:811   next:[617,810]  objective_lb_search_no_lp
#Bound  49.63s best:811   next:[618,810]  objective_lb_search_no_lp
#Bound  50.17s best:811   next:[620,810]  objective_lb_search_no_lp
#Bound  51.02s best:811   next:[622,810]  objective_lb_search_no_lp
#Bound  55.79s best:811   next:[626,810]  objective_lb_search_no_lp
#Bound  65.12s best:811   next:[627,810]  objective_lb_search_no_lp
#Bound  66.49s best:811   next:[628,810]  objective_lb_search_no_lp
#Bound  71.82s best:811   next:[630,810]  objective_lb_search_no_lp
#Model  78.20s var:434/436 constraints:6110/6492
#Bound  78.86s best:811   next:[633,810]  objective_lb_search_no_lp
#Bound  83.51s best:811   next:[634,810]  objective_lb_search
#Model  87.41s var:430/436 constraints:5870/6492
#Bound  88.45s best:811   next:[636,810]  objective_lb_search_no_lp
#Bound  89.13s best:811   next:[637,810]  objective_lb_search_no_lp
#Bound  91.07s best:811   next:[639,810]  objective_lb_search_no_lp
#Model  91.36s var:426/436 constraints:5530/6492
#Bound  91.95s best:811   next:[642,810]  objective_lb_search_no_lp
#Bound  93.50s best:811   next:[643,810]  objective_lb_search_no_lp
#Bound  93.76s best:811   next:[645,810]  objective_lb_search_no_lp
#Bound  94.46s best:811   next:[646,810]  objective_lb_search_no_lp
#Bound  96.96s best:811   next:[647,810]  objective_lb_search_no_lp
#Bound  97.49s best:811   next:[648,810]  objective_lb_search_no_lp
#Bound  98.37s best:811   next:[649,810]  objective_lb_search_no_lp
#Model 100.22s var:425/436 constraints:5463/6492
#Bound 101.65s best:811   next:[650,810]  objective_lb_search_no_lp
#Bound 102.89s best:811   next:[655,810]  objective_lb_search_no_lp
#Bound 104.05s best:811   next:[656,810]  objective_lb_search_no_lp
#Bound 108.16s best:811   next:[659,810]  objective_lb_search_no_lp
#Bound 112.30s best:811   next:[660,810]  objective_lb_search_no_lp
#Bound 113.38s best:811   next:[661,810]  objective_lb_search_no_lp
#Bound 114.65s best:811   next:[662,810]  objective_lb_search_no_lp
#Bound 116.38s best:811   next:[665,810]  objective_lb_search_no_lp
#Bound 119.55s best:811   next:[666,810]  objective_lb_search_no_lp
#Bound 120.32s best:811   next:[668,810]  objective_lb_search_no_lp
#Bound 120.88s best:811   next:[669,810]  objective_lb_search_no_lp
#Bound 124.27s best:811   next:[670,810]  objective_lb_search_no_lp
#Bound 129.60s best:811   next:[671,810]  objective_lb_search_no_lp
#Bound 131.94s best:811   next:[673,810]  objective_lb_search_no_lp
#Model 133.63s var:424/436 constraints:5227/6492
#Bound 135.24s best:811   next:[674,810]  objective_lb_search_no_lp
#Model 135.26s var:423/436 constraints:5186/6492
#Model 136.66s var:422/436 constraints:5136/6492
#Bound 138.28s best:811   next:[675,810]  objective_lb_search_no_lp
#Model 138.58s var:421/436 constraints:5084/6492
#Bound 139.36s best:811   next:[676,810]  objective_lb_search_no_lp
#Model 140.06s var:420/436 constraints:5072/6492
#Bound 145.13s best:811   next:[678,810]  objective_lb_search_no_lp
#Bound 148.31s best:811   next:[680,810]  objective_lb_search_no_lp
#Bound 149.49s best:811   next:[681,810]  objective_lb_search_no_lp
#Model 152.42s var:419/436 constraints:4970/6492
#Bound 154.16s best:811   next:[682,810]  objective_shaving_search_no_lp (vars=408 csts=4796)
#Bound 154.99s best:811   next:[683,810]  objective_lb_search_no_lp
#Bound 155.76s best:811   next:[684,810]  objective_lb_search_no_lp
#Bound 157.45s best:811   next:[685,810]  objective_lb_search
#Bound 157.71s best:811   next:[690,810]  objective_lb_search_no_lp
#Bound 158.63s best:811   next:[696,810]  objective_lb_search_no_lp
#Bound 159.43s best:811   next:[700,810]  objective_lb_search_no_lp
#Bound 160.07s best:811   next:[703,810]  objective_lb_search_no_lp
#Model 160.40s var:418/436 constraints:4904/6492
#Model 160.64s var:417/436 constraints:4819/6492
#Bound 160.74s best:811   next:[705,810]  objective_lb_search_no_lp
#Model 160.74s var:414/436 constraints:4587/6492
#Model 160.99s var:410/436 constraints:4258/6492
#Bound 161.30s best:811   next:[712,810]  objective_lb_search_no_lp
#Model 161.74s var:407/436 constraints:4031/6492
#Bound 161.76s best:811   next:[720,810]  objective_lb_search_no_lp
#Model 161.88s var:399/436 constraints:3586/6492
#Model 161.91s var:395/436 constraints:3127/6492
#Model 161.94s var:394/436 constraints:2967/6492 compo:393,1
#Model 161.96s var:393/436 constraints:2931/6492 compo:392,1
#Model 161.99s var:391/436 constraints:2732/6492 compo:390,1
#Model 162.01s var:383/436 constraints:2229/6492 compo:382,1
#Done  162.01s no_lp
#Model 162.02s var:373/436 constraints:1461/6492 compo:371,1,1
#Done  162.02s core

Task timing                                  n [     min,      max]      avg      dev     time         n [     min,      max]      avg      dev    dtime
                             'core':         1 [   2.69m,    2.69m]    2.69m   0.00ns    2.69m         1 [   1.82m,    1.82m]    1.82m   0.00ns    1.82m
                       'default_lp':         1 [   2.69m,    2.69m]    2.69m   0.00ns    2.69m         1 [  48.94s,   48.94s]   48.94s   0.00ns   48.94s
                 'feasibility_pump':       445 [ 87.51ms,    1.51s] 175.00ms  64.17ms    1.30m       444 [ 39.63ms, 101.38ms]  41.77ms   3.00ms   18.55s
                            'fixed':         1 [   2.69m,    2.69m]    2.69m   0.00ns    2.69m         1 [  41.58s,   41.58s]   41.58s   0.00ns   41.58s
                  'fj_long_default':         1 [360.80ms, 360.80ms] 360.80ms   0.00ns 360.80ms         1 [126.23ms, 126.23ms] 126.23ms   0.00ns 126.23ms
              'fj_long_lin_default':         1 [287.98ms, 287.98ms] 287.98ms   0.00ns 287.98ms         1 [103.70ms, 103.70ms] 103.70ms   0.00ns 103.70ms
                   'fj_long_random':         1 [109.94ms, 109.94ms] 109.94ms   0.00ns 109.94ms         1 [102.37ms, 102.37ms] 102.37ms   0.00ns 102.37ms
                 'fj_short_default':         2 [ 53.74ms, 159.45ms] 106.59ms  52.85ms 213.18ms         2 [100.91ms, 105.68ms] 103.30ms   2.38ms 206.59ms
             'fj_short_lin_default':         1 [329.78ms, 329.78ms] 329.78ms   0.00ns 329.78ms         1 [ 98.66ms,  98.66ms]  98.66ms   0.00ns  98.66ms
              'fj_short_lin_random':         1 [413.55ms, 413.55ms] 413.55ms   0.00ns 413.55ms         1 [101.35ms, 101.35ms] 101.35ms   0.00ns 101.35ms
                  'fj_short_random':         1 [460.23ms, 460.23ms] 460.23ms   0.00ns 460.23ms         1 [104.21ms, 104.21ms] 104.21ms   0.00ns 104.21ms
                        'fs_random':         1 [182.04ms, 182.04ms] 182.04ms   0.00ns 182.04ms         1 [690.02us, 690.02us] 690.02us   0.00ns 690.02us
                        'fs_random':         1 [183.03ms, 183.03ms] 183.03ms   0.00ns 183.03ms         1 [394.24us, 394.24us] 394.24us   0.00ns 394.24us
                  'fs_random_no_lp':         1 [182.39ms, 182.39ms] 182.39ms   0.00ns 182.39ms         1 [  1.39ms,   1.39ms]   1.39ms   0.00ns   1.39ms
          'fs_random_quick_restart':         1 [175.72ms, 175.72ms] 175.72ms   0.00ns 175.72ms         1 [388.37us, 388.37us] 388.37us   0.00ns 388.37us
          'fs_random_quick_restart':         1 [177.02ms, 177.02ms] 177.02ms   0.00ns 177.02ms         1 [394.26us, 394.26us] 394.26us   0.00ns 394.26us
    'fs_random_quick_restart_no_lp':         1 [217.36ms, 217.36ms] 217.36ms   0.00ns 217.36ms         1 [755.72us, 755.72us] 755.72us   0.00ns 755.72us
                    'graph_arc_lns':       445 [  5.15ms, 908.15ms] 499.94ms 233.17ms    3.71m       427 [ 10.00ns, 125.00ms]  67.34ms  41.82ms   28.76s
                    'graph_cst_lns':       445 [  2.56ms, 891.26ms] 499.64ms 236.32ms    3.71m       430 [ 10.00ns, 124.28ms]  66.66ms  42.25ms   28.66s
                    'graph_dec_lns':       444 [  6.27ms, 961.27ms] 505.71ms 232.35ms    3.74m       432 [ 10.00ns, 127.30ms]  67.00ms  42.36ms   28.94s
                    'graph_var_lns':       445 [  6.16ms, 897.21ms] 516.10ms 231.94ms    3.83m       429 [ 10.00ns, 153.56ms]  67.20ms  41.82ms   28.83s
                   'lb_tree_search':         1 [   2.69m,    2.69m]    2.69m   0.00ns    2.69m         1 [   1.13m,    1.13m]    1.13m   0.00ns    1.13m
                           'max_lp':         1 [   2.69m,    2.69m]    2.69m   0.00ns    2.69m         1 [  57.75s,   57.75s]   57.75s   0.00ns   57.75s
                            'no_lp':         1 [   2.69m,    2.69m]    2.69m   0.00ns    2.69m         1 [  40.41s,   40.41s]   40.41s   0.00ns   40.41s
              'objective_lb_search':         1 [   2.69m,    2.69m]    2.69m   0.00ns    2.69m         1 [  53.19s,   53.19s]   53.19s   0.00ns   53.19s
       'objective_lb_search_max_lp':         1 [   2.69m,    2.69m]    2.69m   0.00ns    2.69m         1 [   1.16m,    1.16m]    1.16m   0.00ns    1.16m
        'objective_lb_search_no_lp':         1 [   2.69m,    2.69m]    2.69m   0.00ns    2.69m         1 [  33.01s,   33.01s]   33.01s   0.00ns   33.01s
  'objective_shaving_search_max_lp':        81 [208.21ms,    9.41s]    1.99s    1.80s    2.69m        79 [  3.61ms,    2.26s] 455.91ms 461.48ms   36.02s
   'objective_shaving_search_no_lp':        80 [245.10ms,    9.40s]    2.02s    1.80s    2.69m        78 [  4.85ms,    1.51s] 313.15ms 307.59ms   24.43s
                          'probing':         1 [   2.69m,    2.69m]    2.69m   0.00ns    2.69m         1 [  28.03s,   28.03s]   28.03s   0.00ns   28.03s
                   'probing_max_lp':         1 [   2.69m,    2.69m]    2.69m   0.00ns    2.69m         1 [  41.31s,   41.31s]   41.31s   0.00ns   41.31s
                     'pseudo_costs':         1 [   2.69m,    2.69m]    2.69m   0.00ns    2.69m         1 [   1.01m,    1.01m]    1.01m   0.00ns    1.01m
                    'quick_restart':         1 [   2.69m,    2.69m]    2.69m   0.00ns    2.69m         1 [   1.08m,    1.08m]    1.08m   0.00ns    1.08m
              'quick_restart_no_lp':         1 [   2.69m,    2.69m]    2.69m   0.00ns    2.69m         1 [   1.05m,    1.05m]    1.05m   0.00ns    1.05m
                    'reduced_costs':         1 [   2.69m,    2.69m]    2.69m   0.00ns    2.69m         1 [   1.02m,    1.02m]    1.02m   0.00ns    1.02m
                        'rins/rens':       445 [105.10us, 661.72ms] 342.54ms 233.01ms    2.54m       342 [ 10.00ns, 121.46ms]  75.87ms  32.77ms   25.95s
                      'rnd_cst_lns':       445 [  6.37ms, 874.33ms] 508.74ms 226.56ms    3.77m       430 [ 10.00ns, 160.68ms]  68.60ms  40.85ms   29.50s
                      'rnd_var_lns':       445 [  3.57ms, 835.83ms] 495.35ms 230.23ms    3.67m       438 [ 10.00ns, 122.17ms]  66.34ms  42.91ms   29.06s
         'scheduling_intervals_lns':       444 [ 28.51ms,    2.14s] 579.30ms 249.78ms    4.29m       424 [  1.95ms, 115.12ms]  79.01ms  32.25ms   33.50s
       'scheduling_precedences_lns':       444 [  3.92ms,    2.15s] 577.10ms 249.18ms    4.27m       423 [  2.24ms, 147.14ms]  78.79ms  32.29ms   33.33s
       'scheduling_time_window_lns':       444 [ 28.12ms,    2.08s] 573.24ms 244.23ms    4.24m       421 [  1.23ms, 166.50ms]  78.99ms  32.31ms   33.26s
                     'violation_ls':       445 [  1.67ms, 134.83ms]  78.97ms  21.52ms   35.14s       445 [  1.28us, 394.97ms] 167.62ms  79.99ms    1.24m
                     'violation_ls':       445 [  1.91ms,    1.19s]  83.74ms  56.96ms   37.27s       445 [  1.16ms, 390.95ms] 178.34ms  80.13ms    1.32m

Search stats                        Bools  Conflicts   Branches  Restarts   BoolPropag  IntegerPropag
                           'core':  3'240    115'716    273'159    28'200  105'844'243    101'913'154
                     'default_lp':    115     46'314    200'223    31'714    1'734'431     68'187'859
                          'fixed':  1'973    177'082  2'035'060       529   71'548'700     88'459'204
                      'fs_random':    115          0        230       230           18          6'258
                      'fs_random':    115          0        230       230           18          6'259
                'fs_random_no_lp':    169         16        310       231          318         12'428
        'fs_random_quick_restart':    115          0        230       230           18          6'258
        'fs_random_quick_restart':    115          0        230       230           18          6'258
  'fs_random_quick_restart_no_lp':    115          0        316       230           21          8'915
                 'lb_tree_search':    143        823    198'607    28'752      713'832     25'619'884
                         'max_lp':    115     26'611    197'752    30'717    1'563'687     56'107'607
                          'no_lp':  1'230    123'219    250'660    17'518   35'568'896    128'978'244
            'objective_lb_search':    245     31'801    222'015    42'225    2'259'077     65'817'988
     'objective_lb_search_max_lp':    243     18'900    278'809    62'691    2'529'246     62'054'437
      'objective_lb_search_no_lp':    296     91'419    202'355    17'444    3'746'313    115'564'861
                        'probing':    785        516      5'412     3'380       68'865        588'202
                 'probing_max_lp':    785        494      2'349     1'839       47'514        394'666
                   'pseudo_costs':    115     33'977    214'003    35'176    1'704'832     63'413'733
                  'quick_restart':  1'767     29'070    234'838    28'667   22'956'007     44'588'907
            'quick_restart_no_lp':  3'726    124'921    384'550    24'767   81'618'744    101'162'855
                  'reduced_costs':  1'228     42'259    235'804    27'655   20'679'569     63'723'714

SAT stats                           ClassicMinim  LitRemoved  LitLearned  LitForgotten  Subsumed  MClauses  MDecisions  MLitTrue  MSubsumed  MLitRemoved  MReused
                           'core':       102'331     549'416   1'118'444       316'035       598    13'186      67'123        32      1'103        7'789      131
                     'default_lp':        33'077     104'265     606'460       244'170     1'300    15'388     132'848        65      2'688       18'722    2'402
                          'fixed':       155'082     600'275   3'424'634     2'552'943        30        31         216         0          5           27        6
                      'fs_random':             0           0           0             0         0         0           0         0          0            0        0
                      'fs_random':             0           0           0             0         0         0           0         0          0            0        0
                'fs_random_no_lp':             4           4         229             0         2         0           0         0          0            0        0
        'fs_random_quick_restart':             0           0           0             0         0         0           0         0          0            0        0
        'fs_random_quick_restart':             0           0           0             0         0         0           0         0          0            0        0
  'fs_random_quick_restart_no_lp':             0           0           0             0         0         0           0         0          0            0        0
                 'lb_tree_search':           167         255       6'322             0         1    10'975      56'786         0         70          286      602
                         'max_lp':        18'962      54'141     308'376        67'324       959    15'730     159'194         0      2'616       17'670    3'382
                          'no_lp':       109'024     623'123   1'526'324       872'951     1'272     9'760      79'301         0      6'216       45'042      995
            'objective_lb_search':        25'854      87'697     315'475        10'505       745    18'416     161'896         0      2'926       19'437    3'658
     'objective_lb_search_max_lp':        14'956      50'709     185'625         3'385       501    21'331     209'299         1      1'669       10'877    5'106
      'objective_lb_search_no_lp':        78'249     326'456     860'544       229'331     1'222     9'146      85'579         5      3'979       27'709    1'764
                        'probing':             2           4         518             0         0         0           0         0          0            0        0
                 'probing_max_lp':             0           0         494             0         0         0           0         0          0            0        0
                   'pseudo_costs':        24'416      72'995     411'885       107'494     1'116    17'662     164'576        13      4'337       30'609    2'989
                  'quick_restart':        20'148      80'407     283'562        34'697       656    16'194     161'355       146      8'036       67'177    2'858
            'quick_restart_no_lp':        99'159     714'925   1'736'788       593'685       473     8'188      83'378        11      6'118       58'869      609
                  'reduced_costs':        33'562     131'479     533'021       208'670       825    14'373     138'355         0      4'874       34'672    2'556

Lp stats                         Component  Iterations  AddedCuts  OPTIMAL  DUAL_F.  DUAL_U.
                  'default_lp':          1     611'375     47'947   89'733        0        0
                       'fixed':          1     124'199      1'312  183'486        0        0
                   'fs_random':          1         245        205        7        0        0
                   'fs_random':          1         296        454        9        0        0
     'fs_random_quick_restart':          1         244        200        7        0        0
     'fs_random_quick_restart':          1         245        201        7        0        0
              'lb_tree_search':          1   1'339'322     12'942   66'053   59'717        0
                      'max_lp':          1     791'481     28'858   42'843   21'772        6
         'objective_lb_search':          1     681'431     34'381   69'370        0        1
  'objective_lb_search_max_lp':          1     884'869     20'326   37'480   12'351       12
                     'probing':          1     192'508     78'928   16'816        0        0
              'probing_max_lp':          1     148'066     40'333    8'036      442        0
                'pseudo_costs':          1     858'104     40'289   50'742   28'475        7
               'quick_restart':          1     720'773     59'753   58'234        0        0
               'reduced_costs':          1     826'081     47'770   57'524   35'964        3

Lp dimension                                                                       Final dimension of first component
                  'default_lp':    627 rows, 418 columns, 2670 entries with magnitude in [2.502512e-06, 1.000000e+00]
                       'fixed':     273 rows, 418 columns, 987 entries with magnitude in [2.550479e-02, 1.000000e+00]
                   'fs_random':     210 rows, 418 columns, 758 entries with magnitude in [2.550479e-02, 1.000000e+00]
                   'fs_random':     260 rows, 418 columns, 920 entries with magnitude in [2.550479e-02, 1.000000e+00]
     'fs_random_quick_restart':     210 rows, 418 columns, 758 entries with magnitude in [2.550479e-02, 1.000000e+00]
     'fs_random_quick_restart':     210 rows, 418 columns, 758 entries with magnitude in [2.550479e-02, 1.000000e+00]
              'lb_tree_search':    585 rows, 436 columns, 2292 entries with magnitude in [4.088380e-03, 1.000000e+00]
                      'max_lp':    877 rows, 436 columns, 3648 entries with magnitude in [1.253875e-03, 1.000000e+00]
         'objective_lb_search':    940 rows, 418 columns, 3899 entries with magnitude in [6.154246e-06, 1.000000e+00]
  'objective_lb_search_max_lp':   1202 rows, 436 columns, 4947 entries with magnitude in [4.249980e-04, 1.000000e+00]
                     'probing':   1194 rows, 418 columns, 7424 entries with magnitude in [9.162579e-05, 1.000000e+00]
              'probing_max_lp':  2446 rows, 436 columns, 17714 entries with magnitude in [3.738638e-04, 1.000000e+00]
                'pseudo_costs':    834 rows, 436 columns, 3264 entries with magnitude in [1.118593e-03, 1.000000e+00]
               'quick_restart':   1448 rows, 418 columns, 6759 entries with magnitude in [2.610975e-05, 1.000000e+00]
               'reduced_costs':    814 rows, 436 columns, 3260 entries with magnitude in [6.673731e-04, 1.000000e+00]

Lp debug                         CutPropag  CutEqPropag  Adjust  Overflow         Bad  BadScaling
                  'default_lp':        138          120  39'077         0     698'723           0
                       'fixed':          0            0  26'600         0       4'664           0
                   'fs_random':          0            0       0         0       1'210           0
                   'fs_random':          0            0       0         0         343           0
     'fs_random_quick_restart':          0            0       0         0         324           0
     'fs_random_quick_restart':          0            0       0         0         325           0
              'lb_tree_search':        138           51  74'905         0     236'704           0
                      'max_lp':        227           44  37'411         0     574'880           0
         'objective_lb_search':        186          155  32'267         0     785'286           0
  'objective_lb_search_max_lp':        197           70  31'795         0     545'356           0
                     'probing':        195          925   9'175         0  14'473'820           0
              'probing_max_lp':        328          271   5'009         0   9'111'766           0
                'pseudo_costs':        242          125  48'421         0     730'911           0
               'quick_restart':        306          435  27'645         0   2'124'981           0
               'reduced_costs':        300          103  66'780         0     824'065           0

Lp pool                          Constraints  Updates  Simplif  Merged  Shortened    Split  Strenghtened       Cuts/Call
                  'default_lp':        9'790    3'661  122'827     614     13'935   45'503        46'248  47'947/119'914
                       'fixed':        1'769       11        4       0          0       12           104     1'312/3'523
                   'fs_random':          662        0        0       0          0        0            10         205/366
                   'fs_random':          911        1        0       0          0        1            41         454/826
     'fs_random_quick_restart':          657        0        0       0          0        0             8         200/351
     'fs_random_quick_restart':          658        0        0       0          0        0             6         201/343
              'lb_tree_search':       16'245    1'383  173'250     180     14'751    3'692       140'914   12'942/52'596
                      'max_lp':       16'061    2'690  437'225     280     18'839   21'664       241'182   28'858/74'319
         'objective_lb_search':        9'549    4'486  196'150     289     20'402   56'464        46'706   34'381/95'868
  'objective_lb_search_max_lp':       15'647    2'718  465'244     162     18'184   17'523       243'315   20'326/60'961
                     'probing':       10'351   13'438  119'185      34     11'160  219'738        26'645  78'928/155'028
              'probing_max_lp':       15'754    5'038  335'718      62     20'487   76'308       126'737   40'333/92'327
                'pseudo_costs':       15'411    3'031  517'154     361     24'194   23'259       268'001   40'289/98'213
               'quick_restart':       10'072    8'755  200'840     138     14'615  382'118        59'454  59'753/129'527
               'reduced_costs':       15'637    3'132  533'481     616     25'920   34'135       265'562  47'770/117'865

Lp Cut                                                      fs_ran  fs_ran  fs_ran  fs_ran  defaul  fixed  max_lp  quick_  reduce  pseudo  lb_tre  probin  object  probin  object
                                                    CG_FF:       6       6       6      41   2'778     90   1'503   2'656   2'746   2'080     595   2'592   2'015     718     938
                                                     CG_K:       4       4       4      20   1'675     36   1'385   1'536   2'537   1'822     550   1'751   1'481     599     876
                                                    CG_KL:       -       -       -       -       2      -       -       -       2       -       -       -       1       -       -
                                                     CG_R:       4       4       4      24   3'341     46   1'270   4'232   2'649   1'654     429   6'502   2'481   1'154     836
                                                    CG_RB:       6       6       6      29   8'945    239   4'077  10'317   7'272   5'467   1'920  15'644   7'029   2'435   2'250
                                                   CG_RBP:       -       -       -       1   1'214     12     491   1'317     993     642     239   1'816     636     596     189
                                                   Clique:       -       -       -       -       -      -     267       -     323     307     162       -       -     163     204
                                                       IB:     115     115     115     157   6'913    422   2'255   6'205   4'633   3'500   1'131   4'041   3'760   1'207   1'539
                                                 MIR_1_FF:      30      30      30      58   1'871     84   1'135   2'438   1'831   1'476     521   2'433   1'376   1'290     869
                                                  MIR_1_K:       2       2       2       4     313      5     263     381     512     449     139     262     245     163     179
                                                 MIR_1_KL:       -       -       -       -       8      -       4      14      17      19       3      62       4      16       2
                                                  MIR_1_R:      10      10      10      14     515     19     209     649     374     328      83     821     344     307     182
                                                 MIR_1_RB:       4       3       3      21   3'130     65   2'513   3'843   3'596   3'420   1'216   4'919   2'132   2'973   1'813
                                                MIR_1_RBP:       1       -       -       1     143      8     319     199     397     465     227     158      56     271     133
                                                MIR_1_RLT:       -       -       -       -       -      -       9       -      20      12       -       -       -      21       3
                                                 MIR_2_FF:       -       1       2      13   1'404     42     858   1'650   1'414   1'238     333   1'736     960     831     617
                                                  MIR_2_K:       -       -       1       2     260      5     181     302     380     361     100     273     158     161     120
                                                 MIR_2_KL:       -       -       -       -      15      -       8      19      21      13       2      57       8      10       2
                                                  MIR_2_R:       1       -       1       4     502     12     389     838     561     513     133   1'301     405     856     318
                                                 MIR_2_RB:       4       4       6      13   2'412     47   1'685   3'366   2'512   2'445     726   4'278   1'658   2'129   1'185
                                                MIR_2_RBP:       1       1       2       4     196      2     237     321     335     402     140     267      59     287      80
                                                 MIR_3_FF:       1       -       1       8     955     12     583   1'221   1'018     982     260   1'005     670     594     460
                                                  MIR_3_K:       -       -       -       1     218      2     184     208     335     310      73     210     135     153     126
                                                 MIR_3_KL:       -       -       1       -      34      -      10      43      20      22       2      57      21      10       1
                                                  MIR_3_R:       -       1       -       3     393      5     303     749     451     416     110     981     351     641     273
                                                 MIR_3_RB:       1       2       2       3   1'686     20   1'102   2'658   1'657   1'562     482   3'261   1'255   1'543     784
                                                MIR_3_RBP:       -       -       1       1     152      -     141     232     214     269      70     208      45     169      63
                                                 MIR_4_FF:       -       -       -       1     659      9     319     848     649     607     176     703     513     382     259
                                                  MIR_4_K:       -       -       -       1     168      2     126     177     250     192      44     206     117     109      68
                                                 MIR_4_KL:       1       1       -       1      32      1      21      72      34      25       7      57      31      16       9
                                                  MIR_4_R:       -       -       -       1     307      3     233     473     291     302      90     596     279     437     168
                                                 MIR_4_RB:       1       1       1       5   1'053      9     640   1'699   1'022     947     258   2'085     885     951     498
                                                MIR_4_RBP:       -       -       -       -      91      3      70     139     112     128      49     136      49      97      36
                                                 MIR_5_FF:       -       -       -       -     489      6     207     525     398     338      78     476     342     193     140
                                                  MIR_5_K:       -       -       -       -     131      -      78     154     179     138      46     195      79      72      58
                                                 MIR_5_KL:       -       -       -       -      42      -      19      82      41      28      16      76      38      10      19
                                                  MIR_5_R:       -       -       -       -     241      3     118     410     191     187      37     450     224     237      92
                                                 MIR_5_RB:       -       -       -       1     700      8     386   1'035     631     543     178   1'238     593     494     271
                                                MIR_5_RBP:       -       -       -       -      73      -      47      97      94     101      27     114      35      96      18
                                                 MIR_6_FF:       -       -       -       -     286      5     122     332     223     192      52     290     252     116      96
                                                  MIR_6_K:       -       -       -       -      89      2      49     125     108      99      30     154      79      52      52
                                                 MIR_6_KL:       -       -       -       -      34      -      18      46      27      18      12      60      21      16      13
                                                  MIR_6_R:       -       -       -       -     149      2      65     227     101     110      27     317     136     149      64
                                                 MIR_6_RB:       -       -       -       1     468      5     279     667     377     401     133     853     385     291     164
                                                MIR_6_RBP:       -       -       -       -      57      1      43      86      72      80      27      89      25      84      41
         NoOverlapCompletionTimeExhaustiveMirror_weighted:       -       -       -       -       -      -       -       -       1       -       -       -       -       -       -
  NoOverlapCompletionTimeExhaustiveMirror_weighted_lifted:       -       -       -       -       -      -       -       -       1       -       -       -       -       -       -
               NoOverlapCompletionTimeExhaustive_weighted:       -       -       -       -       -      -      53       -      94      79      11       -       -      27      29
        NoOverlapCompletionTimeExhaustive_weighted_lifted:       -       -       -       -       -      -      17       -      46      29       7       -       -       5      16
                          NoOverlapCompletionTimeQueyrane:       -       -       -       -       -      -       7       -      11      11       1       -       -       2       4
                              NoOverlapDetectedPrecedence:       -       -       -       -       -      -       -       -       1       -       -       -       -       1       -
                                NoOverlapDisjunctionOnEnd:       -       -       -       -       -      -       -       -       2       -       -       -       -       -       -
                              NoOverlapDisjunctionOnStart:       -       -       -       -       -      -      24       -      67      33      12       -       -      13      13
                                             ZERO_HALF_FF:       2       2       1       5     435     26     289     412     456     387     129     439     303     141     176
                                              ZERO_HALF_K:       1       1       -       3      97      3     154     113     254     185      95     108      80      61     124
                                             ZERO_HALF_KL:       -       -       -       -       -      -       1       2       1       1       -       5       3       -       -
                                              ZERO_HALF_R:       2       2       2       7   2'041     28   3'199   4'855   3'911   3'686   1'315  12'705   1'818  14'446   3'195
                                             ZERO_HALF_RB:       2       2       2       4     986     17     750   1'445   1'109   1'075     379   2'134     687   1'739     588
                                            ZERO_HALF_RBP:       2       2       2       2     244      6     143     338     196     193      60     807     122     799      73

LNS stats                        Improv/Calls  Closed  Difficulty  TimeLimit
               'graph_arc_lns':        20/444     54%        1.00       0.11
               'graph_cst_lns':        15/442     53%        1.00       0.11
               'graph_dec_lns':        13/444     52%        0.99       0.11
               'graph_var_lns':        17/444     54%        1.00       0.11
                   'rins/rens':        60/396     52%        0.94       0.10
                 'rnd_cst_lns':        18/444     54%        1.00       0.11
                 'rnd_var_lns':        14/445     53%        1.00       0.11
    'scheduling_intervals_lns':        24/444     53%        0.00       0.12
  'scheduling_precedences_lns':        25/444     54%        0.01       0.12
  'scheduling_time_window_lns':        24/444     53%        0.00       0.11

LS stats                   Batches  Restarts   LinMoves  GenMoves  CompoundMoves  WeightUpdates
       'fj_long_default':        1         1      9'852         0              0            148
   'fj_long_lin_default':        1         1          0     1'735            404              0
        'fj_long_random':        1         1      7'561         0              0            137
      'fj_short_default':        2         1          0     3'321            551              0
  'fj_short_lin_default':        1         1          0     1'767            434              0
   'fj_short_lin_random':        1         1          0     1'723            445              0
       'fj_short_random':        1         1          0     1'827            402              0
          'violation_ls':      445         0  1'942'401   668'364         59'375        468'382
          'violation_ls':      445         0  2'829'354   378'976         32'188        551'237

Solutions (37)                   Num     Rank
             'fs_random_no_lp':    1    [1,1]
               'graph_arc_lns':    2  [32,36]
                       'no_lp':   17   [7,29]
         'quick_restart_no_lp':    9   [2,31]
                 'rins_lp_lns':    1  [33,33]
                 'rnd_cst_lns':    1  [37,37]
                 'rnd_var_lns':    2   [6,34]
  'scheduling_time_window_lns':    1  [30,30]
                'violation_ls':    3   [3,35]

Objective bounds                     Num
                  'initial_domain':    1
             'objective_lb_search':    7
      'objective_lb_search_max_lp':    5
       'objective_lb_search_no_lp':   78
  'objective_shaving_search_no_lp':    1

Solution repositories    Added  Queried  Ignored  Synchro
  'feasible solutions':  4'175   10'117        3    3'938
        'lp solutions':  1'569      227        0    1'302
                'pump':  9'308      218

Improving bounds shared            Num
                        'core':    139
                  'default_lp':    301
              'lb_tree_search':    181
                      'max_lp':    379
                       'no_lp':  1'413
         'objective_lb_search':    234
  'objective_lb_search_max_lp':    182
   'objective_lb_search_no_lp':     12
                     'probing':  2'008
              'probing_max_lp':    800
                'pseudo_costs':    669
               'quick_restart':  1'096
         'quick_restart_no_lp':  8'747
               'reduced_costs':    804

Clauses shared                   Num
                        'core':    5
                  'default_lp':   94
              'lb_tree_search':    9
                      'max_lp':   60
                       'no_lp':  120
         'objective_lb_search':   20
  'objective_lb_search_max_lp':   29
   'objective_lb_search_no_lp':   57
                     'probing':    2
                'pseudo_costs':  115
               'quick_restart':   49
         'quick_restart_no_lp':   33
               'reduced_costs':   19

CpSolverResponse summary:
status: OPTIMAL
objective: 811
best_bound: 811
integers: 432
booleans: 115
conflicts: 0
branches: 230
propagations: 18
integer_propagations: 6258
restarts: 230
lp_iterations: 245
walltime: 162.105
usertime: 162.105
deterministic_time: 1374.44
gap_integral: 3223.36
solution_fingerprint: 0x8e3db9e0eb748d2e


--- Simulation Gantt  partir du modle mathmatique ---
