created virtual environment CPython3.12.4.final.0-64 in 20404ms
  creator CPython3Posix(dest=/localscratch/aneumann.63390822.0/env, clear=False, no_vcs_ignore=False, global=False)
  seeder FromAppData(download=False, pip=bundle, via=copy, app_data_dir=/home/aneumann/.local/share/virtualenv)
    added seed packages: pip==25.1.1
  activators BashActivator,CShellActivator,FishActivator,NushellActivator,PowerShellActivator,PythonActivator
Looking in links: /cvmfs/soft.computecanada.ca/custom/python/wheelhouse/gentoo2023/x86-64-v3, /cvmfs/soft.computecanada.ca/custom/python/wheelhouse/gentoo2023/generic, /cvmfs/soft.computecanada.ca/custom/python/wheelhouse/generic
Requirement already satisfied: pip in /localscratch/aneumann.63390822.0/env/lib/python3.12/site-packages (25.1.1)
Looking in links: /cvmfs/soft.computecanada.ca/custom/python/wheelhouse/gentoo2023/x86-64-v3, /cvmfs/soft.computecanada.ca/custom/python/wheelhouse/gentoo2023/generic, /cvmfs/soft.computecanada.ca/custom/python/wheelhouse/generic
ERROR: protobuf-5.28.3-cp38-abi3-manylinux2014_x86_64.whl is not a supported wheel on this platform.
Looking in links: /cvmfs/soft.computecanada.ca/custom/python/wheelhouse/gentoo2023/x86-64-v3, /cvmfs/soft.computecanada.ca/custom/python/wheelhouse/gentoo2023/generic, /cvmfs/soft.computecanada.ca/custom/python/wheelhouse/generic
Processing /home/aneumann/projects/def-adhaj/aneumann/GNRS/wheels/immutabledict-4.2.0-py3-none-any.whl
Installing collected packages: immutabledict
Successfully installed immutabledict-4.2.0
Looking in links: /cvmfs/soft.computecanada.ca/custom/python/wheelhouse/gentoo2023/x86-64-v3, /cvmfs/soft.computecanada.ca/custom/python/wheelhouse/gentoo2023/generic, /cvmfs/soft.computecanada.ca/custom/python/wheelhouse/generic
Processing /cvmfs/soft.computecanada.ca/custom/python/wheelhouse/generic/ortools-9.10.4067+computecanada-cp312-cp312-linux_x86_64.whl (from -r /home/aneumann/projects/def-adhaj/aneumann/GNRS/requirements/or.txt (line 1))
Processing /cvmfs/soft.computecanada.ca/custom/python/wheelhouse/gentoo2023/x86-64-v3/matplotlib-3.10.0+computecanada-cp312-cp312-linux_x86_64.whl (from -r /home/aneumann/projects/def-adhaj/aneumann/GNRS/requirements/or.txt (line 2))
Processing /cvmfs/soft.computecanada.ca/custom/python/wheelhouse/gentoo2023/x86-64-v3/pandas-2.2.3+computecanada-cp312-cp312-linux_x86_64.whl (from -r /home/aneumann/projects/def-adhaj/aneumann/GNRS/requirements/or.txt (line 3))
Processing /cvmfs/soft.computecanada.ca/custom/python/wheelhouse/generic/absl_py-2.2.2+computecanada-py3-none-any.whl (from ortools<9.11,>=9.10->-r /home/aneumann/projects/def-adhaj/aneumann/GNRS/requirements/or.txt (line 1))
Processing /cvmfs/soft.computecanada.ca/custom/python/wheelhouse/gentoo2023/generic/numpy-2.2.2+computecanada-cp312-cp312-linux_x86_64.whl (from ortools<9.11,>=9.10->-r /home/aneumann/projects/def-adhaj/aneumann/GNRS/requirements/or.txt (line 1))
Processing /cvmfs/soft.computecanada.ca/custom/python/wheelhouse/gentoo2023/x86-64-v3/protobuf-6.30.2+computecanada-cp312-cp312-linux_x86_64.whl (from ortools<9.11,>=9.10->-r /home/aneumann/projects/def-adhaj/aneumann/GNRS/requirements/or.txt (line 1))
Requirement already satisfied: immutabledict>=3.0.0 in /localscratch/aneumann.63390822.0/env/lib/python3.12/site-packages (from ortools<9.11,>=9.10->-r /home/aneumann/projects/def-adhaj/aneumann/GNRS/requirements/or.txt (line 1)) (4.2.0)
Processing /cvmfs/soft.computecanada.ca/custom/python/wheelhouse/gentoo2023/generic/contourpy-1.3.1+computecanada-cp312-cp312-linux_x86_64.whl (from matplotlib->-r /home/aneumann/projects/def-adhaj/aneumann/GNRS/requirements/or.txt (line 2))
Processing /cvmfs/soft.computecanada.ca/custom/python/wheelhouse/generic/cycler-0.12.1+computecanada-py3-none-any.whl (from matplotlib->-r /home/aneumann/projects/def-adhaj/aneumann/GNRS/requirements/or.txt (line 2))
Processing /cvmfs/soft.computecanada.ca/custom/python/wheelhouse/generic/fonttools-4.58.2+computecanada-cp312-cp312-linux_x86_64.whl (from matplotlib->-r /home/aneumann/projects/def-adhaj/aneumann/GNRS/requirements/or.txt (line 2))
Processing /cvmfs/soft.computecanada.ca/custom/python/wheelhouse/gentoo2023/x86-64-v3/kiwisolver-1.4.8+computecanada-cp312-cp312-linux_x86_64.whl (from matplotlib->-r /home/aneumann/projects/def-adhaj/aneumann/GNRS/requirements/or.txt (line 2))
Processing /cvmfs/soft.computecanada.ca/custom/python/wheelhouse/generic/packaging-25.0+computecanada-py3-none-any.whl (from matplotlib->-r /home/aneumann/projects/def-adhaj/aneumann/GNRS/requirements/or.txt (line 2))
Processing /cvmfs/soft.computecanada.ca/custom/python/wheelhouse/gentoo2023/x86-64-v3/pillow-11.1.0+computecanada-cp312-cp312-linux_x86_64.whl (from matplotlib->-r /home/aneumann/projects/def-adhaj/aneumann/GNRS/requirements/or.txt (line 2))
Processing /cvmfs/soft.computecanada.ca/custom/python/wheelhouse/generic/pyparsing-3.2.1+computecanada-py3-none-any.whl (from matplotlib->-r /home/aneumann/projects/def-adhaj/aneumann/GNRS/requirements/or.txt (line 2))
Processing /cvmfs/soft.computecanada.ca/custom/python/wheelhouse/generic/python_dateutil-2.9.0.post0+computecanada-py2.py3-none-any.whl (from matplotlib->-r /home/aneumann/projects/def-adhaj/aneumann/GNRS/requirements/or.txt (line 2))
Processing /cvmfs/soft.computecanada.ca/custom/python/wheelhouse/generic/pytz-2025.2+computecanada-py2.py3-none-any.whl (from pandas->-r /home/aneumann/projects/def-adhaj/aneumann/GNRS/requirements/or.txt (line 3))
Processing /cvmfs/soft.computecanada.ca/custom/python/wheelhouse/generic/tzdata-2025.2+computecanada-py2.py3-none-any.whl (from pandas->-r /home/aneumann/projects/def-adhaj/aneumann/GNRS/requirements/or.txt (line 3))
Processing /cvmfs/soft.computecanada.ca/custom/python/wheelhouse/generic/six-1.17.0+computecanada-py2.py3-none-any.whl (from python-dateutil>=2.7->matplotlib->-r /home/aneumann/projects/def-adhaj/aneumann/GNRS/requirements/or.txt (line 2))
Installing collected packages: pytz, tzdata, six, pyparsing, protobuf, pillow, packaging, numpy, kiwisolver, fonttools, cycler, absl-py, python-dateutil, contourpy, pandas, matplotlib, ortools

Successfully installed absl-py-2.2.2+computecanada contourpy-1.3.1+computecanada cycler-0.12.1+computecanada fonttools-4.58.2+computecanada kiwisolver-1.4.8+computecanada matplotlib-3.10.0+computecanada numpy-2.2.2+computecanada ortools-9.10.4067+computecanada packaging-25.0+computecanada pandas-2.2.3+computecanada pillow-11.1.0+computecanada protobuf-6.30.2+computecanada pyparsing-3.2.1+computecanada python-dateutil-2.9.0.post0+computecanada pytz-2025.2+computecanada six-1.17.0+computecanada tzdata-2025.2+computecanada

Starting CP-SAT solver v9.10.4067
Parameters: max_time_in_seconds: 3600 max_memory_in_mb: 12000 log_search_progress: true enumerate_all_solutions: false absolute_gap_limit: 0 relative_gap_limit: 0
Setting number of workers to 48

Initial optimization model '': (model_fingerprint: 0xcb5d66ebf654def5)
#Variables: 214 (#ints: 6 in objective)
  - 147 Booleans in [0,1]
  - 67 in [0,418]
#kLinear1: 23
#kLinear2: 304
#kLinear3: 122
#kLinearN: 1'072 (#terms: 11'245)

Starting presolve at 0.00s
  6.40e-04s  0.00e+00d  [DetectDominanceRelations] 
  1.58e-02s  0.00e+00d  [PresolveToFixPoint] #num_loops=5 #num_dual_strengthening=3 
  2.15e-05s  0.00e+00d  [ExtractEncodingFromLinear] #potential_supersets=3 
[Symmetry] Graph for symmetry has 1'529 nodes and 7'928 arcs.
[Symmetry] Symmetry computation done. time: 0.000893098 dtime: 0.00069866
[SAT presolve] num removable Booleans: 0 / 59
[SAT presolve] num trivial clauses: 0
[SAT presolve] [0s] clauses:13 literals:38 vars:24 one_side_vars:21 simple_definition:3 singleton_clauses:0
[SAT presolve] [4.3242e-05s] clauses:13 literals:38 vars:24 one_side_vars:21 simple_definition:3 singleton_clauses:0
[SAT presolve] [5.8838e-05s] clauses:13 literals:38 vars:24 one_side_vars:21 simple_definition:3 singleton_clauses:0
  4.51e-03s  5.54e-04d  [Probe] #probed=250 #fixed_bools=4 #new_bounds=19 #new_binary_clauses=1 
  3.44e-05s  0.00e+00d  [MaxClique] 
  6.22e-04s  0.00e+00d  [DetectDominanceRelations] 
  8.01e-03s  0.00e+00d  [PresolveToFixPoint] #num_loops=4 #num_dual_strengthening=3 
  1.75e-03s  0.00e+00d  [ProcessAtMostOneAndLinear] 
  1.17e-03s  0.00e+00d  [DetectDuplicateConstraints] #duplicates=224 #without_enforcements=98 
  5.39e-04s  2.05e-05d  [DetectDominatedLinearConstraints] #relevant_constraints=662 #num_inclusions=346 #num_redundant=10 
  1.94e-04s  0.00e+00d  [DetectDifferentVariables] #different=31 #cliques=1 #size=5 
  1.76e-04s  6.44e-06d  [ProcessSetPPC] #relevant_constraints=416 
  1.53e-05s  0.00e+00d  [FindAlmostIdenticalLinearConstraints] 
  8.90e-05s  6.78e-05d  [FindBigAtMostOneAndLinearOverlap] 
  1.38e-03s  4.45e-04d  [FindBigVerticalLinearOverlap] #blocks=10 #saved_nz=559 
  8.24e-05s  1.73e-05d  [FindBigHorizontalLinearOverlap] #linears=396 
  2.41e-05s  1.80e-07d  [MergeClauses] 
  5.95e-04s  0.00e+00d  [DetectDominanceRelations] 
  6.89e-03s  0.00e+00d  [PresolveToFixPoint] #num_loops=2 #num_dual_strengthening=1 
  5.98e-04s  0.00e+00d  [DetectDominanceRelations] 
  4.48e-03s  0.00e+00d  [PresolveToFixPoint] #num_loops=1 #num_dual_strengthening=1 
[Symmetry] Graph for symmetry has 1'314 nodes and 6'719 arcs.
[Symmetry] Symmetry computation done. time: 0.00044064 dtime: 0.00053512
[SAT presolve] num removable Booleans: 0 / 55
[SAT presolve] num trivial clauses: 0
[SAT presolve] [0s] clauses:13 literals:38 vars:24 one_side_vars:21 simple_definition:3 singleton_clauses:0
[SAT presolve] [3.3002e-05s] clauses:13 literals:38 vars:24 one_side_vars:21 simple_definition:3 singleton_clauses:0
[SAT presolve] [4.7802e-05s] clauses:13 literals:38 vars:24 one_side_vars:21 simple_definition:3 singleton_clauses:0
  4.36e-03s  5.24e-04d  [Probe] #probed=240 #new_bounds=12 #new_binary_clauses=22 
  2.52e-05s  0.00e+00d  [MaxClique] 
  5.94e-04s  0.00e+00d  [DetectDominanceRelations] 
  7.46e-03s  0.00e+00d  [PresolveToFixPoint] #num_loops=4 #num_dual_strengthening=3 
  1.48e-03s  0.00e+00d  [ProcessAtMostOneAndLinear] 
  9.24e-04s  0.00e+00d  [DetectDuplicateConstraints] #without_enforcements=104 
  3.42e-04s  1.38e-05d  [DetectDominatedLinearConstraints] #relevant_constraints=530 #num_inclusions=128 
  9.68e-05s  0.00e+00d  [DetectDifferentVariables] 
  1.56e-04s  5.31e-06d  [ProcessSetPPC] #relevant_constraints=398 
  1.86e-05s  1.50e-08d  [FindAlmostIdenticalLinearConstraints] #num_tested_pairs=1 
  8.19e-05s  5.96e-05d  [FindBigAtMostOneAndLinearOverlap] 
  9.74e-04s  3.68e-04d  [FindBigVerticalLinearOverlap] #blocks=5 #saved_nz=226 
  7.95e-05s  1.57e-05d  [FindBigHorizontalLinearOverlap] #linears=377 
  2.49e-05s  1.80e-07d  [MergeClauses] 
  5.96e-04s  0.00e+00d  [DetectDominanceRelations] 
  5.78e-03s  0.00e+00d  [PresolveToFixPoint] #num_loops=2 #num_dual_strengthening=1 
  5.93e-04s  0.00e+00d  [DetectDominanceRelations] 
  4.68e-03s  0.00e+00d  [PresolveToFixPoint] #num_loops=1 #num_dual_strengthening=1 
[Symmetry] Graph for symmetry has 1'317 nodes and 6'486 arcs.
[Symmetry] Symmetry computation done. time: 0.000415067 dtime: 0.00052395
[SAT presolve] num removable Booleans: 0 / 55
[SAT presolve] num trivial clauses: 0
[SAT presolve] [0s] clauses:13 literals:38 vars:24 one_side_vars:21 simple_definition:3 singleton_clauses:0
[SAT presolve] [3.1632e-05s] clauses:13 literals:38 vars:24 one_side_vars:21 simple_definition:3 singleton_clauses:0
[SAT presolve] [4.4975e-05s] clauses:13 literals:38 vars:24 one_side_vars:21 simple_definition:3 singleton_clauses:0
  4.31e-03s  5.19e-04d  [Probe] #probed=240 #new_bounds=4 #new_binary_clauses=22 
  1.98e-05s  0.00e+00d  [MaxClique] 
  5.95e-04s  0.00e+00d  [DetectDominanceRelations] 
  5.49e-03s  0.00e+00d  [PresolveToFixPoint] #num_loops=2 #num_dual_strengthening=1 
  1.38e-03s  0.00e+00d  [ProcessAtMostOneAndLinear] 
  9.18e-04s  0.00e+00d  [DetectDuplicateConstraints] #without_enforcements=104 
  2.67e-04s  1.06e-05d  [DetectDominatedLinearConstraints] #relevant_constraints=482 #num_inclusions=5 
  9.71e-05s  0.00e+00d  [DetectDifferentVariables] 
  1.55e-04s  4.85e-06d  [ProcessSetPPC] #relevant_constraints=386 
  1.85e-05s  0.00e+00d  [FindAlmostIdenticalLinearConstraints] 
  8.19e-05s  5.67e-05d  [FindBigAtMostOneAndLinearOverlap] 
  7.78e-04s  3.40e-04d  [FindBigVerticalLinearOverlap] #blocks=1 #saved_nz=58 
  8.25e-05s  1.52e-05d  [FindBigHorizontalLinearOverlap] #linears=373 
  2.33e-05s  1.80e-07d  [MergeClauses] 
  5.85e-04s  0.00e+00d  [DetectDominanceRelations] 
  4.89e-03s  0.00e+00d  [PresolveToFixPoint] #num_loops=2 #num_dual_strengthening=1 
  4.08e-05s  0.00e+00d  [ExpandObjective] #entries=60 #tight_variables=25 #tight_constraints=15 

Presolve summary:
  - 43 affine relations were detected.
  - rule 'TODO dual: only one blocking constraint?' was applied 540 times.
  - rule 'TODO dual: only one unspecified blocking constraint?' was applied 90 times.
  - rule 'TODO duplicate: identical constraint with different enforcements' was applied 306 times.
  - rule 'TODO linear2: contains a Boolean.' was applied 20 times.
  - rule 'affine: new relation' was applied 43 times.
  - rule 'at_most_one: removed literals' was applied 1 time.
  - rule 'at_most_one: size one' was applied 1 time.
  - rule 'bool_or: implications' was applied 1 time.
  - rule 'deductions: 139 stored' was applied 1 time.
  - rule 'dual: fix variable' was applied 10 times.
  - rule 'dual: reduced domain' was applied 50 times.
  - rule 'duplicate: merged rhs of linear constraint' was applied 40 times.
  - rule 'duplicate: removed constraint' was applied 224 times.
  - rule 'enforcement: false literal' was applied 17 times.
  - rule 'enforcement: true literal' was applied 17 times.
  - rule 'incompatible linear: add implication' was applied 57 times.
  - rule 'linear inclusion: redundant containing constraint' was applied 7 times.
  - rule 'linear inclusion: redundant included constraint' was applied 3 times.
  - rule 'linear matrix: common vertical rectangle' was applied 16 times.
  - rule 'linear1: always true' was applied 1 time.
  - rule 'linear2: contains a Boolean.' was applied 21 times.
  - rule 'linear: always true' was applied 334 times.
  - rule 'linear: doubleton free' was applied 6 times.
  - rule 'linear: empty' was applied 22 times.
  - rule 'linear: extracted enforcement literal' was applied 2'453 times.
  - rule 'linear: fixed or dup variables' was applied 1'048 times.
  - rule 'linear: negative clause' was applied 12 times.
  - rule 'linear: positive clause' was applied 1 time.
  - rule 'linear: positive equal one' was applied 3 times.
  - rule 'linear: reduced variable domains' was applied 95 times.
  - rule 'linear: remapped using affine relations' was applied 1'002 times.
  - rule 'linear: simplified rhs' was applied 3'568 times.
  - rule 'linear: variable substitution 1' was applied 6 times.
  - rule 'linear: variable substitution 2' was applied 2 times.
  - rule 'no_overlap: inferred from x != y constraints' was applied 1 time.
  - rule 'presolve: 61 unused variables removed.' was applied 1 time.
  - rule 'presolve: iteration' was applied 3 times.
  - rule 'probing: reduced enforced constraint to implication.' was applied 1 time.
  - rule 'probing: simplified enforcement list.' was applied 2 times.

Presolved optimization model '': (model_fingerprint: 0xb590debbdab40eae)
#Variables: 118 (#ints: 6 in objective)
  - 55 Booleans in [0,1]
  - 1 in [-411,-20][7,398][425,816][843,1234][1261,1652]
  - 1 in [-375,-20][7,398][425,816][843,1234][1261,1577]
  - 1 in [-361,-17][57,401][475,775]
  - 1 in [-361,-17][57,401][475,819][893,1201]
  - 1 in [-5,342]
  - 1 in [0,263]
  - 1 in [0,284]
  - 1 in [0,318]
  - 1 in [0,323]
  - 4 in [0,332]
  - 1 in [0,339]
  - 4 in [0,343]
  - 4 in [0,344]
  - 4 in [0,346]
  - 1 in [0,346][418,758]
  - 1 in [0,351]
  - 1 in [0,354]
  - 1 in [0,354][418,766]
  - 1 in [0,354][418,772][836,1159]
  - 2 in [7,398]
  - 1 in [16,370]
  - 1 in [21,375]
  - 1 in [35,378]
  - 1 in [40,383]
  - 1 in [41,387]
  - 1 in [43,398][425,816][843,1198]
  - 1 in [46,392]
  - 1 in [49,398][425,816][843,1234][1261,1616]
  - 1 in [57,401]
  - 3 in [68,407]
  - 1 in [74,413]
  - 1 in [76,346][418,764][836,1173]
  - 3 in [84,407]
  - 2 in [89,407]
  - 1 in [90,413]
  - 1 in [95,413]
  - 6 in [104,407]
  - 2 in [110,413]
  - 1 in [115,418]
#kBoolAnd: 1 (#enforced: 1) (#literals: 2)
#kBoolOr: 12 (#literals: 36)
#kExactlyOne: 3 (#literals: 9)
#kInterval: 5
#kLinear1: 21 (#enforced: 21 #multi: 10)
#kLinear2: 402 (#enforced: 358 #multi: 283)
#kLinear3: 40 (#enforced: 14)
#kLinearN: 398 (#enforced: 340) (#terms: 3'147)
#kNoOverlap: 1 (#intervals: 5)

Preloading model.
#Bound   0.10s best:inf   next:[115,1945] initial_domain
[Symmetry] Graph for symmetry has 1'204 nodes and 6'425 arcs.
[Symmetry] Symmetry computation done. time: 0.000392719 dtime: 0.00051301
#Model   0.10s var:118/118 constraints:883/883

Starting search at 0.10s with 48 workers.
17 full problem subsolvers: [core, default_lp, fixed, lb_tree_search, max_lp, no_lp, objective_lb_search, objective_lb_search_max_lp, objective_lb_search_no_lp, objective_shaving_search_max_lp, objective_shaving_search_no_lp, probing, probing_max_lp, pseudo_costs, quick_restart, quick_restart_no_lp, reduced_costs]
29 first solution subsolvers: [fj_long_default(2), fj_long_lin_default, fj_long_lin_perturb, fj_long_lin_random, fj_long_perturb, fj_long_random, fj_short_default(2), fj_short_lin_default(2), fj_short_lin_perturb, fj_short_lin_random, fj_short_perturb, fj_short_random, fs_random(4), fs_random_no_lp(3), fs_random_quick_restart(4), fs_random_quick_restart_no_lp(3)]
15 incomplete subsolvers: [feasibility_pump, graph_arc_lns, graph_cst_lns, graph_dec_lns, graph_var_lns, rins/rens, rnd_cst_lns, rnd_var_lns, scheduling_intervals_lns, scheduling_precedences_lns, scheduling_time_window_lns, violation_ls(4)]
3 helper subsolvers: [neighborhood_helper, synchronization_agent, update_gap_integral]
#Bound   0.11s best:inf   next:[116,1945] bool_core (num_cores=1 [size:1 mw:1] a=6 d=0 fixed=0/77 clauses=25)
#1       0.11s best:934   next:[116,933]  no_lp (fixed_bools=0/93)
#Bound   0.11s best:934   next:[117,933]  objective_lb_search_no_lp
#Bound   0.11s best:934   next:[122,933]  objective_lb_search_no_lp
#2       0.12s best:929   next:[122,928]  rnd_var_lns (d=0.50 s=28 t=0.10 p=0.00 stall=0 h=auto_l0) [presolve]
#3       0.12s best:924   next:[122,923]  quick_restart_no_lp (fixed_bools=5/111)
#4       0.12s best:914   next:[122,913]  no_lp (fixed_bools=0/98)
#5       0.12s best:894   next:[122,893]  no_lp (fixed_bools=0/102)
#6       0.12s best:864   next:[122,863]  no_lp (fixed_bools=0/105)
#Bound   0.12s best:864   next:[123,863]  bool_core (num_cores=3 [cover] a=5 d=1 fixed=6/92 clauses=29)
#Bound   0.12s best:864   next:[124,863]  bool_core (num_cores=3 [cover] a=5 d=1 fixed=7/95 clauses=34)
#Bound   0.12s best:864   next:[125,863]  bool_core (num_cores=3 [cover] a=5 d=1 fixed=8/98 clauses=41)
#7       0.13s best:824   next:[125,823]  no_lp (fixed_bools=0/114)
#8       0.13s best:812   next:[125,811]  no_lp (fixed_bools=0/118)
#9       0.13s best:736   next:[125,735]  quick_restart_no_lp (fixed_bools=10/170)
#10      0.13s best:734   next:[125,733]  violation_ls(batch:2 #solutions_imported:2 #lin_moves:1 #lin_evals:1'673 #gen_moves:1'110 #gen_evals:256 #comp_moves:48 #backtracks:531 #weight_updates:14)
#11      0.13s best:732   next:[125,731]  violation_ls(batch:2 #solutions_imported:2 #lin_moves:1'048 #lin_evals:3'590 #weight_updates:261)
#12      0.13s best:711   next:[125,710]  quick_restart_no_lp (fixed_bools=12/186)
#Bound   0.13s best:711   next:[126,710]  bool_core (num_cores=4 [size:2 mw:1 d:2] a=4 d=2 fixed=9/101 clauses=48)
#Bound   0.13s best:711   next:[127,710]  bool_core (num_cores=4 [cover] a=4 d=2 fixed=9/106 clauses=57)
#Bound   0.13s best:711   next:[128,710]  bool_core (num_cores=4 [cover] a=4 d=2 fixed=10/111 clauses=68)
#Bound   0.13s best:711   next:[129,710]  bool_core (num_cores=4 [cover] a=4 d=2 fixed=11/116 clauses=81)
#13      0.13s best:704   next:[129,703]  quick_restart_no_lp (fixed_bools=14/198)
#Bound   0.13s best:704   next:[130,703]  bool_core (num_cores=4 [cover] a=4 d=2 fixed=12/121 clauses=96)
#14      0.13s best:702   next:[130,701]  no_lp (fixed_bools=0/130)
#Bound   0.13s best:702   next:[131,701]  bool_core (num_cores=4 [cover] a=4 d=2 fixed=13/126 clauses=113)
#Bound   0.13s best:702   next:[132,701]  bool_core (num_cores=4 [cover] a=4 d=2 fixed=14/131 clauses=132)
#15      0.13s best:668   next:[132,667]  quick_restart_no_lp (fixed_bools=14/225)
#Bound   0.13s best:668   next:[133,667]  bool_core (num_cores=4 [cover] a=4 d=2 fixed=15/136 clauses=153)
#Bound   0.13s best:668   next:[134,667]  bool_core (num_cores=4 [cover] a=4 d=2 fixed=16/141 clauses=176)
#Bound   0.13s best:668   next:[135,667]  bool_core (num_cores=4 [cover] a=4 d=2 fixed=17/146 clauses=201)
#16      0.13s best:617   next:[135,616]  quick_restart_no_lp (fixed_bools=14/230)
#Bound   0.13s best:617   next:[136,616]  bool_core (num_cores=4 [cover] a=4 d=2 fixed=18/151 clauses=228)
#17      0.13s best:616   next:[136,615]  violation_ls(batch:4 #solutions_imported:4 #lin_moves:0 #lin_evals:1'798 #gen_moves:1'159 #gen_evals:277 #comp_moves:53 #backtracks:553 #weight_updates:15)
#18      0.13s best:614   next:[136,613]  violation_ls(batch:4 #solutions_imported:4 #lin_moves:1 #lin_evals:1'679 #gen_moves:1'112 #gen_evals:256 #comp_moves:50 #backtracks:531 #weight_updates:14)
#Bound   0.13s best:614   next:[137,613]  bool_core (num_cores=4 [cover] a=4 d=2 fixed=19/156 clauses=257)
#Bound   0.13s best:614   next:[138,613]  bool_core (num_cores=4 [cover] a=4 d=2 fixed=20/161 clauses=288)
#Bound   0.13s best:614   next:[139,613]  bool_core (num_cores=4 [cover] a=4 d=2 fixed=21/166 clauses=321)
#19      0.14s best:613   next:[141,612]  violation_ls(batch:5 #solutions_imported:5 #lin_moves:0 #lin_evals:1'801 #gen_moves:1'160 #gen_evals:277 #comp_moves:54 #backtracks:553 #weight_updates:15)
#20      0.14s best:607   next:[142,606]  quick_restart_no_lp (fixed_bools=14/254)
#21      0.14s best:606   next:[150,605]  quick_restart_no_lp (fixed_bools=14/262)
#22      0.14s best:603   next:[211,602]  quick_restart_no_lp (fixed_bools=14/289)
#23      0.15s best:601   next:[213,600]  violation_ls(batch:6 #solutions_imported:6 #lin_moves:0 #lin_evals:1'805 #gen_moves:1'161 #gen_evals:277 #comp_moves:55 #backtracks:553 #weight_updates:15)
#24      0.15s best:589   next:[213,588]  rnd_var_lns (d=0.81 s=82 t=0.10 p=1.00 stall=1 h=auto_l0)
#25      0.15s best:569   next:[213,568]  graph_var_lns (d=0.81 s=72 t=0.10 p=1.00 stall=2 h=auto_l0)
#26      0.15s best:568   next:[213,567]  quick_restart_no_lp (fixed_bools=14/301)
#27      0.15s best:557   next:[215,556]  graph_arc_lns (d=0.81 s=97 t=0.10 p=1.00 stall=0 h=auto_l0) [presolve]
#28      0.16s best:556   next:[225,555]  violation_ls(batch:7 #solutions_imported:7 #lin_moves:1'115 #lin_evals:3'945 #gen_moves:39 #gen_evals:5 #comp_moves:3 #backtracks:18 #weight_updates:306)
#29      0.16s best:555   next:[225,554]  violation_ls(batch:7 #solutions_imported:7 #lin_moves:1 #lin_evals:1'715 #gen_moves:1'136 #gen_evals:260 #comp_moves:54 #backtracks:541 #weight_updates:14)
#30      0.17s best:541   next:[225,540]  rins_pump_lns (d=0.50 s=107 t=0.10 p=0.00 stall=0 h=auto_l0)
#31      0.20s best:500   next:[245,499]  no_lp (fixed_bools=0/165)
#32      0.22s best:484   next:[250,483]  quick_restart_no_lp (fixed_bools=16/325)
#33      0.22s best:482   next:[250,481]  violation_ls(batch:8 #solutions_imported:8 #lin_moves:2 #lin_evals:1'721 #gen_moves:1'136 #gen_evals:260 #comp_moves:54 #backtracks:541 #weight_updates:14)
#34      0.23s best:467   next:[250,466]  quick_restart_no_lp (fixed_bools=16/330)
#35      0.23s best:466   next:[254,465]  no_lp (fixed_bools=1/177)
#36      0.24s best:458   next:[261,457]  no_lp (fixed_bools=1/192)
#37      0.25s best:457   next:[261,456]  no_lp (fixed_bools=1/202)
#38      0.25s best:448   next:[261,447]  no_lp (fixed_bools=1/210)
#39      0.27s best:445   next:[261,444]  quick_restart_no_lp (fixed_bools=19/362)
#40      0.27s best:440   next:[267,439]  quick_restart_no_lp (fixed_bools=19/369)
#41      0.27s best:433   next:[267,432]  no_lp (fixed_bools=1/226)
#42      0.27s best:428   next:[267,427]  quick_restart_no_lp (fixed_bools=19/379)
#43      0.28s best:423   next:[267,422]  no_lp (fixed_bools=1/228)
#44      0.28s best:417   next:[267,416]  no_lp (fixed_bools=1/243)
#45      0.28s best:414   next:[267,413]  no_lp (fixed_bools=1/244)
#46      0.29s best:411   next:[270,410]  quick_restart_no_lp (fixed_bools=19/400)
#47      0.32s best:408   next:[270,407]  quick_restart_no_lp (fixed_bools=19/402)
#48      0.32s best:406   next:[270,405]  quick_restart_no_lp (fixed_bools=19/412)
#49      0.41s best:405   next:[308,404]  no_lp (fixed_bools=3/257)
#50      0.41s best:402   next:[308,401]  no_lp (fixed_bools=3/263)
#51      0.42s best:399   next:[308,398]  no_lp (fixed_bools=3/264)
#Model   0.74s var:117/118 constraints:732/883
#Model   0.89s var:115/118 constraints:664/883
#Model   0.96s var:112/118 constraints:608/883
#Model   0.98s var:111/118 constraints:601/883
#Done    0.98s no_lp
#Done    0.98s pseudo_costs
#Done    0.98s reduced_costs
#Model   0.99s var:105/118 constraints:465/883
#Done    0.99s probing_max_lp
#Bound   0.95s best:399   next:[363,398]  objective_lb_search_no_lp [skipped_logs=37]

Task timing                                  n [     min,      max]      avg      dev     time         n [     min,      max]      avg      dev    dtime
                             'core':         1 [880.36ms, 880.36ms] 880.36ms   0.00ns 880.36ms         1 [414.45ms, 414.45ms] 414.45ms   0.00ns 414.45ms
                       'default_lp':         1 [880.69ms, 880.69ms] 880.69ms   0.00ns 880.69ms         1 [ 35.58ms,  35.58ms]  35.58ms   0.00ns  35.58ms
                 'feasibility_pump':        11 [  1.94ms,  55.03ms]  32.24ms  13.01ms 354.67ms        10 [  3.63ms,   5.20ms]   3.81ms 464.65us  38.08ms
                            'fixed':         1 [879.99ms, 879.99ms] 879.99ms   0.00ns 879.99ms         1 [ 37.91ms,  37.91ms]  37.91ms   0.00ns  37.91ms
                  'fj_long_default':         0 [  0.00ns,   0.00ns]   0.00ns   0.00ns   0.00ns         0 [  0.00ns,   0.00ns]   0.00ns   0.00ns   0.00ns
                  'fj_long_default':         0 [  0.00ns,   0.00ns]   0.00ns   0.00ns   0.00ns         0 [  0.00ns,   0.00ns]   0.00ns   0.00ns   0.00ns
              'fj_long_lin_default':         0 [  0.00ns,   0.00ns]   0.00ns   0.00ns   0.00ns         0 [  0.00ns,   0.00ns]   0.00ns   0.00ns   0.00ns
              'fj_long_lin_perturb':         0 [  0.00ns,   0.00ns]   0.00ns   0.00ns   0.00ns         0 [  0.00ns,   0.00ns]   0.00ns   0.00ns   0.00ns
               'fj_long_lin_random':         0 [  0.00ns,   0.00ns]   0.00ns   0.00ns   0.00ns         0 [  0.00ns,   0.00ns]   0.00ns   0.00ns   0.00ns
                  'fj_long_perturb':         0 [  0.00ns,   0.00ns]   0.00ns   0.00ns   0.00ns         0 [  0.00ns,   0.00ns]   0.00ns   0.00ns   0.00ns
                   'fj_long_random':         0 [  0.00ns,   0.00ns]   0.00ns   0.00ns   0.00ns         0 [  0.00ns,   0.00ns]   0.00ns   0.00ns   0.00ns
                 'fj_short_default':         0 [  0.00ns,   0.00ns]   0.00ns   0.00ns   0.00ns         0 [  0.00ns,   0.00ns]   0.00ns   0.00ns   0.00ns
                 'fj_short_default':         0 [  0.00ns,   0.00ns]   0.00ns   0.00ns   0.00ns         0 [  0.00ns,   0.00ns]   0.00ns   0.00ns   0.00ns
             'fj_short_lin_default':         0 [  0.00ns,   0.00ns]   0.00ns   0.00ns   0.00ns         0 [  0.00ns,   0.00ns]   0.00ns   0.00ns   0.00ns
             'fj_short_lin_default':         0 [  0.00ns,   0.00ns]   0.00ns   0.00ns   0.00ns         0 [  0.00ns,   0.00ns]   0.00ns   0.00ns   0.00ns
             'fj_short_lin_perturb':         0 [  0.00ns,   0.00ns]   0.00ns   0.00ns   0.00ns         0 [  0.00ns,   0.00ns]   0.00ns   0.00ns   0.00ns
              'fj_short_lin_random':         0 [  0.00ns,   0.00ns]   0.00ns   0.00ns   0.00ns         0 [  0.00ns,   0.00ns]   0.00ns   0.00ns   0.00ns
                 'fj_short_perturb':         0 [  0.00ns,   0.00ns]   0.00ns   0.00ns   0.00ns         0 [  0.00ns,   0.00ns]   0.00ns   0.00ns   0.00ns
                  'fj_short_random':         0 [  0.00ns,   0.00ns]   0.00ns   0.00ns   0.00ns         0 [  0.00ns,   0.00ns]   0.00ns   0.00ns   0.00ns
                        'fs_random':         0 [  0.00ns,   0.00ns]   0.00ns   0.00ns   0.00ns         0 [  0.00ns,   0.00ns]   0.00ns   0.00ns   0.00ns
                        'fs_random':         0 [  0.00ns,   0.00ns]   0.00ns   0.00ns   0.00ns         0 [  0.00ns,   0.00ns]   0.00ns   0.00ns   0.00ns
                        'fs_random':         1 [  4.39ms,   4.39ms]   4.39ms   0.00ns   4.39ms         1 [ 20.00ns,  20.00ns]  20.00ns   0.00ns  20.00ns
                        'fs_random':         1 [  5.25ms,   5.25ms]   5.25ms   0.00ns   5.25ms         1 [ 20.00ns,  20.00ns]  20.00ns   0.00ns  20.00ns
                  'fs_random_no_lp':         0 [  0.00ns,   0.00ns]   0.00ns   0.00ns   0.00ns         0 [  0.00ns,   0.00ns]   0.00ns   0.00ns   0.00ns
                  'fs_random_no_lp':         0 [  0.00ns,   0.00ns]   0.00ns   0.00ns   0.00ns         0 [  0.00ns,   0.00ns]   0.00ns   0.00ns   0.00ns
                  'fs_random_no_lp':         1 [  4.84ms,   4.84ms]   4.84ms   0.00ns   4.84ms         0 [  0.00ns,   0.00ns]   0.00ns   0.00ns   0.00ns
          'fs_random_quick_restart':         0 [  0.00ns,   0.00ns]   0.00ns   0.00ns   0.00ns         0 [  0.00ns,   0.00ns]   0.00ns   0.00ns   0.00ns
          'fs_random_quick_restart':         0 [  0.00ns,   0.00ns]   0.00ns   0.00ns   0.00ns         0 [  0.00ns,   0.00ns]   0.00ns   0.00ns   0.00ns
          'fs_random_quick_restart':         1 [  2.73ms,   2.73ms]   2.73ms   0.00ns   2.73ms         0 [  0.00ns,   0.00ns]   0.00ns   0.00ns   0.00ns
          'fs_random_quick_restart':         1 [  5.02ms,   5.02ms]   5.02ms   0.00ns   5.02ms         1 [ 20.00ns,  20.00ns]  20.00ns   0.00ns  20.00ns
    'fs_random_quick_restart_no_lp':         0 [  0.00ns,   0.00ns]   0.00ns   0.00ns   0.00ns         0 [  0.00ns,   0.00ns]   0.00ns   0.00ns   0.00ns
    'fs_random_quick_restart_no_lp':         0 [  0.00ns,   0.00ns]   0.00ns   0.00ns   0.00ns         0 [  0.00ns,   0.00ns]   0.00ns   0.00ns   0.00ns
    'fs_random_quick_restart_no_lp':         1 [  4.57ms,   4.57ms]   4.57ms   0.00ns   4.57ms         0 [  0.00ns,   0.00ns]   0.00ns   0.00ns   0.00ns
                    'graph_arc_lns':        11 [  3.38ms, 374.00ms] 117.55ms 137.97ms    1.29s         9 [ 10.00ns,  28.04ms]   6.70ms  10.70ms  60.32ms
                    'graph_cst_lns':        10 [723.12us,   2.87ms]   1.22ms 669.46us  12.19ms         0 [  0.00ns,   0.00ns]   0.00ns   0.00ns   0.00ns
                    'graph_dec_lns':        10 [  3.38ms, 281.37ms]  93.44ms 105.14ms 934.39ms        10 [ 10.00ns,  24.59ms]   5.24ms   8.48ms  52.44ms
                    'graph_var_lns':        11 [  3.62ms, 173.40ms]  46.58ms  52.69ms 512.36ms        10 [ 10.00ns,   7.50ms]   1.51ms   2.32ms  15.12ms
                   'lb_tree_search':         1 [879.50ms, 879.50ms] 879.50ms   0.00ns 879.50ms         1 [ 75.71ms,  75.71ms]  75.71ms   0.00ns  75.71ms
                           'max_lp':         1 [880.11ms, 880.11ms] 880.11ms   0.00ns 880.11ms         1 [156.23ms, 156.23ms] 156.23ms   0.00ns 156.23ms
                            'no_lp':         1 [879.70ms, 879.70ms] 879.70ms   0.00ns 879.70ms         1 [113.82ms, 113.82ms] 113.82ms   0.00ns 113.82ms
              'objective_lb_search':         1 [879.10ms, 879.10ms] 879.10ms   0.00ns 879.10ms         1 [ 67.60ms,  67.60ms]  67.60ms   0.00ns  67.60ms
       'objective_lb_search_max_lp':         1 [877.79ms, 877.79ms] 877.79ms   0.00ns 877.79ms         1 [ 89.39ms,  89.39ms]  89.39ms   0.00ns  89.39ms
        'objective_lb_search_no_lp':         1 [878.29ms, 878.29ms] 878.29ms   0.00ns 878.29ms         1 [ 94.30ms,  94.30ms]  94.30ms   0.00ns  94.30ms
  'objective_shaving_search_max_lp':        11 [  6.34ms,  94.63ms]  36.42ms  32.38ms 400.64ms         1 [  1.01ms,   1.01ms]   1.01ms   0.00ns   1.01ms
   'objective_shaving_search_no_lp':        11 [  6.76ms, 113.08ms]  48.17ms  36.11ms 529.86ms         5 [349.39us,   1.03ms] 691.13us 300.04us   3.46ms
                          'probing':         1 [883.39ms, 883.39ms] 883.39ms   0.00ns 883.39ms         1 [ 20.25ms,  20.25ms]  20.25ms   0.00ns  20.25ms
                   'probing_max_lp':         1 [880.07ms, 880.07ms] 880.07ms   0.00ns 880.07ms         1 [ 58.08ms,  58.08ms]  58.08ms   0.00ns  58.08ms
                     'pseudo_costs':         1 [880.02ms, 880.02ms] 880.02ms   0.00ns 880.02ms         1 [ 88.48ms,  88.48ms]  88.48ms   0.00ns  88.48ms
                    'quick_restart':         1 [879.48ms, 879.48ms] 879.48ms   0.00ns 879.48ms         1 [ 25.79ms,  25.79ms]  25.79ms   0.00ns  25.79ms
              'quick_restart_no_lp':         1 [879.39ms, 879.39ms] 879.39ms   0.00ns 879.39ms         1 [108.24ms, 108.24ms] 108.24ms   0.00ns 108.24ms
                    'reduced_costs':         1 [880.50ms, 880.50ms] 880.50ms   0.00ns 880.50ms         1 [ 30.46ms,  30.46ms]  30.46ms   0.00ns  30.46ms
                        'rins/rens':        11 [  4.18ms, 656.55ms] 157.55ms 226.10ms    1.73s         7 [ 16.21us,  99.54ms]  21.47ms  35.99ms 150.26ms
                      'rnd_cst_lns':        11 [697.61us,  47.38ms]   7.11ms  13.24ms  78.24ms         2 [ 10.00ns,  10.00ns]  10.00ns   0.00ns  20.00ns
                      'rnd_var_lns':        11 [  2.81ms, 573.52ms] 149.22ms 203.05ms    1.64s        10 [ 10.00ns,  54.05ms]  12.47ms  20.03ms 124.71ms
         'scheduling_intervals_lns':        10 [241.21ms, 868.40ms] 733.58ms 201.33ms    7.34s         1 [590.63ms, 590.63ms] 590.63ms   0.00ns 590.63ms
       'scheduling_precedences_lns':        10 [188.65ms, 868.19ms] 667.56ms 242.45ms    6.68s         3 [ 29.06ms, 479.25ms] 202.83ms 197.60ms 608.48ms
       'scheduling_time_window_lns':        10 [121.91ms, 855.21ms] 457.29ms 290.52ms    4.57s         8 [  4.54ms, 116.31ms]  31.85ms  33.70ms 254.77ms
                     'violation_ls':        10 [ 12.15ms, 189.54ms]  85.75ms  53.51ms 857.49ms        10 [  6.40ms,  62.60ms]  38.44ms  19.95ms 384.38ms
                     'violation_ls':        11 [129.58us, 209.79ms]  37.50ms  65.79ms 412.54ms        11 [400.00ns,  52.94ms]  11.85ms  19.97ms 130.35ms
                     'violation_ls':        11 [176.63us, 150.69ms]  30.26ms  47.23ms 332.87ms        11 [370.00ns,  55.42ms]  12.43ms  18.20ms 136.71ms
                     'violation_ls':        11 [228.55us, 169.46ms]  42.11ms  59.59ms 463.24ms        11 [590.00ns,  56.24ms]  16.07ms  21.89ms 176.81ms

Search stats                        Bools  Conflicts  Branches  Restarts  BoolPropag  IntegerPropag
                           'core':    431        425    11'549     4'354     840'445        338'039
                     'default_lp':    111        109     1'602       679       5'728         44'456
                          'fixed':    302        259     1'888       541      14'664         62'771
                      'fs_random':      0          0         0         0           0              0
                      'fs_random':      0          0         0         0           0              0
                      'fs_random':     71          0        54        54          45            437
                      'fs_random':     71          0        74        74          45            605
                'fs_random_no_lp':      0          0         0         0           0              0
                'fs_random_no_lp':      0          0         0         0           0              0
                'fs_random_no_lp':     71          0        68        68          45            551
        'fs_random_quick_restart':      0          0         0         0           0              0
        'fs_random_quick_restart':      0          0         0         0           0              0
        'fs_random_quick_restart':     71          0         0         0           0              0
        'fs_random_quick_restart':     71          0        66        66          45            527
  'fs_random_quick_restart_no_lp':      0          0         0         0           0              0
  'fs_random_quick_restart_no_lp':      0          0         0         0           0              0
  'fs_random_quick_restart_no_lp':     71          0        58        58          45            466
                 'lb_tree_search':     81          3       179       163         199          1'788
                         'max_lp':     80         33       199       142         831          7'464
                          'no_lp':    314      1'733     7'113     1'309     140'183        494'118
            'objective_lb_search':     76        307     1'983       777       8'211         90'253
     'objective_lb_search_max_lp':     87         57       550       300       2'473         18'958
      'objective_lb_search_no_lp':    123      1'950     4'943     1'049      43'500        441'717
                        'probing':    123         24       224       224         770          3'304
                 'probing_max_lp':     83          3       165       165         183          1'761
                   'pseudo_costs':     83         50       541       274       1'812         17'682
                  'quick_restart':    147         23     1'564       665       3'932         29'738
            'quick_restart_no_lp':    562      1'259     8'563     1'558     245'786        436'981
                  'reduced_costs':    131         50       576       309       2'438         13'236

SAT stats                           ClassicMinim  LitRemoved  LitLearned  LitForgotten  Subsumed  MClauses  MDecisions  MLitTrue  MSubsumed  MLitRemoved  MReused
                           'core':           301       1'629       1'369             0         1     2'014       9'997         0         68          266       14
                     'default_lp':            59         116         696             0         2       131         647         0         16           76       17
                          'fixed':           110         157       1'678             0         4       118         568         0         36          202       12
                      'fs_random':             0           0           0             0         0         0           0         0          0            0        0
                      'fs_random':             0           0           0             0         0         0           0         0          0            0        0
                      'fs_random':             0           0           0             0         0         0           0         0          0            0        0
                      'fs_random':             0           0           0             0         0         0           0         0          0            0        0
                'fs_random_no_lp':             0           0           0             0         0         0           0         0          0            0        0
                'fs_random_no_lp':             0           0           0             0         0         0           0         0          0            0        0
                'fs_random_no_lp':             0           0           0             0         0         0           0         0          0            0        0
        'fs_random_quick_restart':             0           0           0             0         0         0           0         0          0            0        0
        'fs_random_quick_restart':             0           0           0             0         0         0           0         0          0            0        0
        'fs_random_quick_restart':             0           0           0             0         0         0           0         0          0            0        0
        'fs_random_quick_restart':             0           0           0             0         0         0           0         0          0            0        0
  'fs_random_quick_restart_no_lp':             0           0           0             0         0         0           0         0          0            0        0
  'fs_random_quick_restart_no_lp':             0           0           0             0         0         0           0         0          0            0        0
  'fs_random_quick_restart_no_lp':             0           0           0             0         0         0           0         0          0            0        0
                 'lb_tree_search':             0           0           4             0         0         0           0         0          0            0        0
                         'max_lp':            26          75         171             0         1         0           0         0          0            0        0
                          'no_lp':         1'359       4'951      16'012             0        34       423       2'199         3        158          854       42
            'objective_lb_search':           236         603       1'972             0        12       192         926         0         32          156       17
     'objective_lb_search_max_lp':            35         107         275             0         4        31         151         0          1            3        2
      'objective_lb_search_no_lp':         1'673       5'925      11'036             0        59       336       1'784         0        105          499       55
                        'probing':             0           0          24             0         0         0           0         0          0            0        0
                 'probing_max_lp':             0           0           3             0         0         0           0         0          0            0        0
                   'pseudo_costs':            41         123         378             0         2        34         166         0          0            0        4
                  'quick_restart':             7          17          66             0         2       108         518         0          6           27       11
            'quick_restart_no_lp':           824       2'436       8'380             0        36       666       3'441        11        387        2'322       37
                  'reduced_costs':            10          10         177             0         0        34         166         0          0            0        4

Lp stats                         Component  Iterations  AddedCuts  OPTIMAL  DUAL_F.  DUAL_U.
                  'default_lp':          1       1'077      1'174      190        0        0
                       'fixed':          1         913      1'413      242        0        0
                   'fs_random':          1           0          0        0        0        0
                   'fs_random':          1           0          0        0        0        0
     'fs_random_quick_restart':          1           0          0        0        0        0
     'fs_random_quick_restart':          1           0          0        0        0        0
              'lb_tree_search':          1       1'015      1'950       29        4        0
                      'max_lp':          1       1'993      2'018       97       10        0
         'objective_lb_search':          1       2'579      1'063      395        0        0
  'objective_lb_search_max_lp':          1       2'827      1'908      115       44        0
                     'probing':          1         362      1'182      126        0        0
              'probing_max_lp':          1         780      1'790       41        0        0
                'pseudo_costs':          1       2'365      1'979      116       28        0
               'quick_restart':          1         835      1'180      137        0        0
               'reduced_costs':          1         847      2'011       75        2        0

Lp dimension                                                                      Final dimension of first component
                  'default_lp':   385 rows, 116 columns, 1276 entries with magnitude in [5.153870e-04, 1.000000e+00]
                       'fixed':   434 rows, 116 columns, 2110 entries with magnitude in [1.346170e-04, 1.000000e+00]
                   'fs_random':        0 rows, 116 columns, 0 entries with magnitude in [0.000000e+00, 0.000000e+00]
                   'fs_random':        0 rows, 116 columns, 0 entries with magnitude in [0.000000e+00, 0.000000e+00]
     'fs_random_quick_restart':        0 rows, 116 columns, 0 entries with magnitude in [0.000000e+00, 0.000000e+00]
     'fs_random_quick_restart':        0 rows, 116 columns, 0 entries with magnitude in [0.000000e+00, 0.000000e+00]
              'lb_tree_search':  1356 rows, 118 columns, 6885 entries with magnitude in [1.108770e-03, 1.000000e+00]
                      'max_lp':  1507 rows, 118 columns, 8518 entries with magnitude in [2.772862e-04, 1.000000e+00]
         'objective_lb_search':    163 rows, 116 columns, 511 entries with magnitude in [1.646132e-03, 1.000000e+00]
  'objective_lb_search_max_lp':   887 rows, 118 columns, 3873 entries with magnitude in [9.670981e-05, 1.000000e+00]
                     'probing':   558 rows, 116 columns, 3404 entries with magnitude in [7.780279e-05, 1.000000e+00]
              'probing_max_lp':  1457 rows, 118 columns, 5846 entries with magnitude in [7.599219e-03, 1.000000e+00]
                'pseudo_costs':   805 rows, 118 columns, 3833 entries with magnitude in [3.149978e-04, 1.000000e+00]
               'quick_restart':   605 rows, 116 columns, 2462 entries with magnitude in [3.739831e-04, 1.000000e+00]
               'reduced_costs':   625 rows, 118 columns, 2759 entries with magnitude in [1.584105e-04, 1.000000e+00]

Lp debug                         CutPropag  CutEqPropag  Adjust  Overflow    Bad  BadScaling
                  'default_lp':         14            6      85         0  1'979           0
                       'fixed':          6            0      61         0  2'121           0
                   'fs_random':          0            0       0         0      0           0
                   'fs_random':          0            0       0         0      0           0
     'fs_random_quick_restart':          0            0       0         0      0           0
     'fs_random_quick_restart':          0            0       0         0      0           0
              'lb_tree_search':          4            0      30         0  2'185           0
                      'max_lp':         14            2      95         0  4'225           0
         'objective_lb_search':          4            5     196         0  1'478           0
  'objective_lb_search_max_lp':         15            0     136         0  4'062           0
                     'probing':          9            0     115         0  6'807           0
              'probing_max_lp':         15            0      38         0  5'761           0
                'pseudo_costs':          9            2     117         0  3'442           0
               'quick_restart':          3            0      65         0  1'885           0
               'reduced_costs':         13            0      66         0  2'412           0

Lp pool                          Constraints  Updates  Simplif  Merged  Shortened  Split  Strenghtened    Cuts/Call
                  'default_lp':        1'303      245    2'141       2        707     47         1'174  1'174/1'963
                       'fixed':        1'544      327    3'207       0        448     77         1'334  1'413/2'487
                   'fs_random':          131        0        0       0          0      0             7          0/0
                   'fs_random':          131        0        0       0          0      0             7          0/0
     'fs_random_quick_restart':          131        0        0       0          0      0             0          0/0
     'fs_random_quick_restart':          131        0        0       0          0      0             7          0/0
              'lb_tree_search':        2'824      174    2'642       3        539     50         4'654  1'950/3'119
                      'max_lp':        2'890      247    2'716       5          0     72         4'956  2'018/3'400
         'objective_lb_search':        1'194      200    1'686       0        389     43           930  1'063/1'789
  'objective_lb_search_max_lp':        2'773      226    5'410      12      1'117     23         5'833  1'908/3'331
                     'probing':        1'313      167      384       0          0     42           523  1'182/1'990
              'probing_max_lp':        2'666      190    3'054       1      1'193     70         4'602  1'790/3'224
                'pseudo_costs':        2'837      196    2'549      19          0     38         4'550  1'979/3'363
               'quick_restart':        1'310      381    2'782       1        244     24         1'408  1'180/2'011
               'reduced_costs':        2'872      200    3'698      16        726     37         5'287  2'011/3'237

Lp Cut                                         defaul  fixed  max_lp  quick_  reduce  pseudo  lb_tre  probin  object  probin  object
                                       CG_FF:     106    106     111     120     163     165     117     114      89      95     161
                                        CG_K:      56     76      42      73      99      69      38      49      43      19     109
                                        CG_R:      80    121      37     111     129      96      41      62      78      28     119
                                       CG_RB:     311    321     446     275     409     446     507     294     213     350     332
                                      CG_RBP:      44     52      57      27      64      47      30      37      37      30      36
                                      Clique:       -      -      13       -       7      17      10       -       -       -       9
                                          IB:     168    180     108     175     173     173      83     149     189      85     199
                                    MIR_1_FF:      54     57     126      40     109     116     106      56      59      93     101
                                     MIR_1_K:      12     18      31      12      33      19      32       9      14      22      24
                                     MIR_1_R:      13     15       6      16       8       7       6       2       8       9      10
                                    MIR_1_RB:      69     68     176      63     156     156     165      57      56     163     136
                                   MIR_1_RBP:       5      8      64       4      30      24      60       4       4      59      29
                                   MIR_1_RLT:       -      -       -       -      22      13       1       -       -       2      17
                                    MIR_2_FF:      23     30      59      16      38      53      59      28      25      61      67
                                     MIR_2_K:       7      7      26       5      11      17      26      12       6      21      26
                                     MIR_2_R:       9     12      19      12      21      23      11      15       8      24      21
                                    MIR_2_RB:      39     41      73      27      66      69      74      53      27      91      67
                                   MIR_2_RBP:       2      4      27       -      12       7      19       3       2      26      18
                                    MIR_3_FF:      15     24      31      20      31      31      35      15      17      28      37
                                     MIR_3_K:       5      3      18       5      14      10      15       7       9       7      11
                                     MIR_3_R:      11     20      15      11      25      18      12      14      10      18      15
                                    MIR_3_RB:      20     37      46      16      41      43      43      37      20      47      47
                                   MIR_3_RBP:       3      7      15       2       8       6      14       1       3      14       6
                                    MIR_4_FF:       9     20      25      11      18      14      25       6      11      24      14
                                     MIR_4_K:       6      3       8       2       7       5       8       5       3       4       1
                                     MIR_4_R:       7     15      12      10       7      10      10       8      10      13      14
                                    MIR_4_RB:      13     22      28      14      23      19      25      19      15      31      27
                                   MIR_4_RBP:       1      3      10       -       2       4      12       1       1       8       3
                                    MIR_5_FF:       9     14      16      10       7      13      11       5      10      16      10
                                     MIR_5_K:       3      -       6       1       3       5       6       3       1       4       1
                                     MIR_5_R:       4      6      10      10       2      11       8       3       2       3       5
                                    MIR_5_RB:       9     10      19      10       8      24      14      14       9      17      12
                                   MIR_5_RBP:       1      -       6       2       1       1       4       -       -       2       1
                                    MIR_6_FF:       5      6       8       9       5       4       9       6       3       9       3
                                     MIR_6_K:       -      -       2       3       2       1       3       2       1       1       1
                                     MIR_6_R:       1      1       4       3       2       3       2       3       2       4       1
                                    MIR_6_RB:       4      4       8       4       4       8       7       4       2       7       3
                                   MIR_6_RBP:       -      -       2       -       1       -       4       -       -       5       -
  NoOverlapCompletionTimeExhaustive_weighted:       -      -       2       -       5       4       2       -       -       2       3
                 NoOverlapDisjunctionOnStart:       -      -       1       -       5       5       1       -       -       1       6
                                ZERO_HALF_FF:       9     14      41      14      41      30      44      14      15      31      29
                                 ZERO_HALF_K:       2      4      12       3       5       1      21       -       7       7      11
                                 ZERO_HALF_R:      19     52     145      30     104     129     120      47      37     222     118
                                ZERO_HALF_RB:      17     28      71      14      78      59      79      23      17      64      43
                               ZERO_HALF_RBP:       3      4      36       -      12       4      31       1       -      23       5

LNS stats                        Improv/Calls  Closed  Difficulty  TimeLimit
               'graph_arc_lns':          6/10    100%        0.99       0.10
               'graph_cst_lns':           0/0      0%        0.50       0.10
               'graph_dec_lns':          5/10     90%        0.98       0.10
               'graph_var_lns':          3/10    100%        0.99       0.10
                   'rins/rens':          7/11     73%        0.95       0.10
                 'rnd_cst_lns':           1/3    100%        0.88       0.10
                 'rnd_var_lns':          6/10     90%        0.98       0.10
    'scheduling_intervals_lns':          7/10      0%        0.01       0.10
  'scheduling_precedences_lns':          6/10     10%        0.04       0.10
  'scheduling_time_window_lns':          8/10     70%        0.93       0.10

LS stats                   Batches  Restarts  LinMoves  GenMoves  CompoundMoves  WeightUpdates
       'fj_long_default':        0         0         0         0              0              0
       'fj_long_default':        0         0         0         0              0              0
   'fj_long_lin_default':        0         0         0         0              0              0
   'fj_long_lin_perturb':        0         0         0         0              0              0
    'fj_long_lin_random':        0         0         0         0              0              0
       'fj_long_perturb':        0         0         0         0              0              0
        'fj_long_random':        0         0         0         0              0              0
      'fj_short_default':        0         0         0         0              0              0
      'fj_short_default':        0         0         0         0              0              0
  'fj_short_lin_default':        0         0         0         0              0              0
  'fj_short_lin_default':        0         0         0         0              0              0
  'fj_short_lin_perturb':        0         0         0         0              0              0
   'fj_short_lin_random':        0         0         0         0              0              0
      'fj_short_perturb':        0         0         0         0              0              0
       'fj_short_random':        0         0         0         0              0              0
          'violation_ls':       10         0     7'508    41'368            966          1'058
          'violation_ls':       11         0    11'166     9'221            231          5'489
          'violation_ls':       11         0    15'283    11'011            350          6'207
          'violation_ls':       11         0    21'605     1'136             54          1'758

Solutions (51)            Num     Rank
        'graph_arc_lns':    1  [27,27]
        'graph_var_lns':    1  [25,25]
                'no_lp':   19   [1,51]
  'quick_restart_no_lp':   18   [3,48]
        'rins_pump_lns':    1  [30,30]
          'rnd_var_lns':    2   [2,24]
         'violation_ls':    9  [10,33]

Objective bounds                Num
                  'bool_core':   21
             'initial_domain':    1
  'objective_lb_search_no_lp':   37

Solution repositories    Added  Queried  Ignored  Synchro
  'feasible solutions':    139      261       18      116
        'lp solutions':      0        0        0        0
                'pump':    206       11

Improving bounds shared          Num
                        'core':    4
                  'default_lp':   35
                       'fixed':   21
              'lb_tree_search':   33
                      'max_lp':   10
                       'no_lp':  391
  'objective_lb_search_max_lp':   17
                     'probing':   11
              'probing_max_lp':    1
                'pseudo_costs':   18
               'quick_restart':   60
         'quick_restart_no_lp':  393
               'reduced_costs':    5

Clauses shared                   Num
                        'core':    1
                  'default_lp':    7
                       'fixed':    3
              'lb_tree_search':    3
                       'no_lp':   25
         'objective_lb_search':    6
  'objective_lb_search_max_lp':    1
   'objective_lb_search_no_lp':   10
               'quick_restart':   13
         'quick_restart_no_lp':   17

CpSolverResponse summary:
status: OPTIMAL
objective: 399
best_bound: 399
integers: 0
booleans: 0
conflicts: 0
branches: 0
propagations: 0
integer_propagations: 0
restarts: 0
lp_iterations: 0
walltime: 1.00216
usertime: 1.00216
deterministic_time: 4.14686
gap_integral: 6.01214
solution_fingerprint: 0xf3268204ad0ea2ac


--- Simulation Gantt  partir du modle mathmatique ---
{'big':1, 'due_date':155, 'pos_time':5, 'status':2, 'blocked':1, 'operations':["{'type':1, 'processing_time':15}", "{'type':0, 'processing_time':38}"]}
{'big':1, 'due_date':100, 'pos_time':5, 'status':3, 'blocked':2, 'operations':["{'type':1, 'processing_time':15}"]}
{'big':0, 'due_date':134, 'pos_time':5, 'status':3, 'blocked':0, 'operations':["{'type':1, 'processing_time':40}", "{'type':0, 'processing_time':21}"]}
{'big':0, 'due_date':79, 'pos_time':5, 'status':2, 'blocked':0, 'operations':["{'type':0, 'processing_time':51}", "{'type':1, 'processing_time':12}"]}
{'big':0, 'due_date':95, 'pos_time':5, 'status':3, 'blocked':0, 'operations':["{'type':1, 'processing_time':34}", "{'type':0, 'processing_time':30}"]}
