created virtual environment CPython3.12.4.final.0-64 in 2480ms
  creator CPython3Posix(dest=/localscratch/aneumann.63447042.0/env, clear=False, no_vcs_ignore=False, global=False)
  seeder FromAppData(download=False, pip=bundle, via=copy, app_data_dir=/home/aneumann/.local/share/virtualenv)
    added seed packages: pip==25.1.1
  activators BashActivator,CShellActivator,FishActivator,NushellActivator,PowerShellActivator,PythonActivator
Looking in links: /cvmfs/soft.computecanada.ca/custom/python/wheelhouse/gentoo2023/x86-64-v3, /cvmfs/soft.computecanada.ca/custom/python/wheelhouse/gentoo2023/generic, /cvmfs/soft.computecanada.ca/custom/python/wheelhouse/generic
Requirement already satisfied: pip in /localscratch/aneumann.63447042.0/env/lib/python3.12/site-packages (25.1.1)
Looking in links: /cvmfs/soft.computecanada.ca/custom/python/wheelhouse/gentoo2023/x86-64-v3, /cvmfs/soft.computecanada.ca/custom/python/wheelhouse/gentoo2023/generic, /cvmfs/soft.computecanada.ca/custom/python/wheelhouse/generic
ERROR: protobuf-5.28.3-cp38-abi3-manylinux2014_x86_64.whl is not a supported wheel on this platform.
Looking in links: /cvmfs/soft.computecanada.ca/custom/python/wheelhouse/gentoo2023/x86-64-v3, /cvmfs/soft.computecanada.ca/custom/python/wheelhouse/gentoo2023/generic, /cvmfs/soft.computecanada.ca/custom/python/wheelhouse/generic
Processing /home/aneumann/projects/def-adhaj/aneumann/GNRS/wheels/immutabledict-4.2.0-py3-none-any.whl
Installing collected packages: immutabledict
Successfully installed immutabledict-4.2.0
Looking in links: /cvmfs/soft.computecanada.ca/custom/python/wheelhouse/gentoo2023/x86-64-v3, /cvmfs/soft.computecanada.ca/custom/python/wheelhouse/gentoo2023/generic, /cvmfs/soft.computecanada.ca/custom/python/wheelhouse/generic
Processing /cvmfs/soft.computecanada.ca/custom/python/wheelhouse/generic/ortools-9.10.4067+computecanada-cp312-cp312-linux_x86_64.whl (from -r /home/aneumann/projects/def-adhaj/aneumann/GNRS/requirements/or.txt (line 1))
Processing /cvmfs/soft.computecanada.ca/custom/python/wheelhouse/gentoo2023/x86-64-v3/matplotlib-3.10.0+computecanada-cp312-cp312-linux_x86_64.whl (from -r /home/aneumann/projects/def-adhaj/aneumann/GNRS/requirements/or.txt (line 2))
Processing /cvmfs/soft.computecanada.ca/custom/python/wheelhouse/gentoo2023/x86-64-v3/pandas-2.2.3+computecanada-cp312-cp312-linux_x86_64.whl (from -r /home/aneumann/projects/def-adhaj/aneumann/GNRS/requirements/or.txt (line 3))
Processing /cvmfs/soft.computecanada.ca/custom/python/wheelhouse/generic/absl_py-2.2.2+computecanada-py3-none-any.whl (from ortools<9.11,>=9.10->-r /home/aneumann/projects/def-adhaj/aneumann/GNRS/requirements/or.txt (line 1))
Processing /cvmfs/soft.computecanada.ca/custom/python/wheelhouse/gentoo2023/generic/numpy-2.2.2+computecanada-cp312-cp312-linux_x86_64.whl (from ortools<9.11,>=9.10->-r /home/aneumann/projects/def-adhaj/aneumann/GNRS/requirements/or.txt (line 1))
Processing /cvmfs/soft.computecanada.ca/custom/python/wheelhouse/gentoo2023/x86-64-v3/protobuf-6.30.2+computecanada-cp312-cp312-linux_x86_64.whl (from ortools<9.11,>=9.10->-r /home/aneumann/projects/def-adhaj/aneumann/GNRS/requirements/or.txt (line 1))
Requirement already satisfied: immutabledict>=3.0.0 in /localscratch/aneumann.63447042.0/env/lib/python3.12/site-packages (from ortools<9.11,>=9.10->-r /home/aneumann/projects/def-adhaj/aneumann/GNRS/requirements/or.txt (line 1)) (4.2.0)
Processing /cvmfs/soft.computecanada.ca/custom/python/wheelhouse/gentoo2023/generic/contourpy-1.3.1+computecanada-cp312-cp312-linux_x86_64.whl (from matplotlib->-r /home/aneumann/projects/def-adhaj/aneumann/GNRS/requirements/or.txt (line 2))
Processing /cvmfs/soft.computecanada.ca/custom/python/wheelhouse/generic/cycler-0.12.1+computecanada-py3-none-any.whl (from matplotlib->-r /home/aneumann/projects/def-adhaj/aneumann/GNRS/requirements/or.txt (line 2))
Processing /cvmfs/soft.computecanada.ca/custom/python/wheelhouse/generic/fonttools-4.58.2+computecanada-cp312-cp312-linux_x86_64.whl (from matplotlib->-r /home/aneumann/projects/def-adhaj/aneumann/GNRS/requirements/or.txt (line 2))
Processing /cvmfs/soft.computecanada.ca/custom/python/wheelhouse/gentoo2023/x86-64-v3/kiwisolver-1.4.8+computecanada-cp312-cp312-linux_x86_64.whl (from matplotlib->-r /home/aneumann/projects/def-adhaj/aneumann/GNRS/requirements/or.txt (line 2))
Processing /cvmfs/soft.computecanada.ca/custom/python/wheelhouse/generic/packaging-25.0+computecanada-py3-none-any.whl (from matplotlib->-r /home/aneumann/projects/def-adhaj/aneumann/GNRS/requirements/or.txt (line 2))
Processing /cvmfs/soft.computecanada.ca/custom/python/wheelhouse/gentoo2023/x86-64-v3/pillow-11.1.0+computecanada-cp312-cp312-linux_x86_64.whl (from matplotlib->-r /home/aneumann/projects/def-adhaj/aneumann/GNRS/requirements/or.txt (line 2))
Processing /cvmfs/soft.computecanada.ca/custom/python/wheelhouse/generic/pyparsing-3.2.1+computecanada-py3-none-any.whl (from matplotlib->-r /home/aneumann/projects/def-adhaj/aneumann/GNRS/requirements/or.txt (line 2))
Processing /cvmfs/soft.computecanada.ca/custom/python/wheelhouse/generic/python_dateutil-2.9.0.post0+computecanada-py2.py3-none-any.whl (from matplotlib->-r /home/aneumann/projects/def-adhaj/aneumann/GNRS/requirements/or.txt (line 2))
Processing /cvmfs/soft.computecanada.ca/custom/python/wheelhouse/generic/pytz-2025.2+computecanada-py2.py3-none-any.whl (from pandas->-r /home/aneumann/projects/def-adhaj/aneumann/GNRS/requirements/or.txt (line 3))
Processing /cvmfs/soft.computecanada.ca/custom/python/wheelhouse/generic/tzdata-2025.2+computecanada-py2.py3-none-any.whl (from pandas->-r /home/aneumann/projects/def-adhaj/aneumann/GNRS/requirements/or.txt (line 3))
Processing /cvmfs/soft.computecanada.ca/custom/python/wheelhouse/generic/six-1.17.0+computecanada-py2.py3-none-any.whl (from python-dateutil>=2.7->matplotlib->-r /home/aneumann/projects/def-adhaj/aneumann/GNRS/requirements/or.txt (line 2))
Installing collected packages: pytz, tzdata, six, pyparsing, protobuf, pillow, packaging, numpy, kiwisolver, fonttools, cycler, absl-py, python-dateutil, contourpy, pandas, matplotlib, ortools

Successfully installed absl-py-2.2.2+computecanada contourpy-1.3.1+computecanada cycler-0.12.1+computecanada fonttools-4.58.2+computecanada kiwisolver-1.4.8+computecanada matplotlib-3.10.0+computecanada numpy-2.2.2+computecanada ortools-9.10.4067+computecanada packaging-25.0+computecanada pandas-2.2.3+computecanada pillow-11.1.0+computecanada protobuf-6.30.2+computecanada pyparsing-3.2.1+computecanada python-dateutil-2.9.0.post0+computecanada pytz-2025.2+computecanada six-1.17.0+computecanada tzdata-2025.2+computecanada

Starting CP-SAT solver v9.10.4067
Parameters: max_time_in_seconds: 3600 max_memory_in_mb: 12000 log_search_progress: true enumerate_all_solutions: false absolute_gap_limit: 0 relative_gap_limit: 0
Setting number of workers to 32

Initial optimization model '': (model_fingerprint: 0xc3d1ec5f8ab25435)
#Variables: 906 (#ints: 17 in objective)
  - 717 Booleans in [0,1]
  - 189 in [0,1175]
#kLinear1: 85
#kLinear2: 2'318
#kLinear3: 782
#kLinearN: 24'470 (#terms: 662'689)

Starting presolve at 0.01s
  3.49e-02s  0.00e+00d  [DetectDominanceRelations] 
  6.62e-01s  0.00e+00d  [PresolveToFixPoint] #num_loops=6 #num_dual_strengthening=3 
  1.94e-04s  0.00e+00d  [ExtractEncodingFromLinear] #potential_supersets=7 
[Symmetry] Graph for symmetry has 26'940 nodes and 577'396 arcs.
[Symmetry] Symmetry computation done. time: 0.0332705 dtime: 0.0494642
[Symmetry] #generators: 1, average support size: 46
[Symmetry] The model contains 1378 duplicate constraints !
[Symmetry] 23 orbits with sizes: 2,2,2,2,2,2,2,2,2,2,...
[Symmetry] Num fixable by intersecting at_most_one with orbits: 1 largest_orbit: 2
  3.12e-01s  4.86e-02d  [Probe] #probed=1'168 #fixed_bools=7 #new_bounds=40 #equiv=1 
  1.50e-04s  0.00e+00d  [MaxClique] Merged 8(16 literals) into 6(12 literals) at_most_ones. 
  3.47e-02s  0.00e+00d  [DetectDominanceRelations] 
  3.71e-01s  0.00e+00d  [PresolveToFixPoint] #num_loops=4 #num_dual_strengthening=3 
  1.28e-01s  0.00e+00d  [ProcessAtMostOneAndLinear] 
  3.47e-02s  0.00e+00d  [DetectDuplicateConstraints] #duplicates=1'614 #without_enforcements=110 
  6.81e-02s  3.66e-03d  [DetectDominatedLinearConstraints] #relevant_constraints=22'625 #num_inclusions=5'344 #num_redundant=2 
  3.99e-03s  0.00e+00d  [DetectDifferentVariables] #different=103 
  1.34e-02s  1.01e-03d  [ProcessSetPPC] #relevant_constraints=21'595 
  1.71e-04s  0.00e+00d  [FindAlmostIdenticalLinearConstraints] 
  4.05e-03s  4.08e-03d  [FindBigAtMostOneAndLinearOverlap] 
  3.38e-01s  1.11e-01d  [FindBigVerticalLinearOverlap] #blocks=412 #saved_nz=173'878 
  4.93e-03s  1.84e-03d  [FindBigHorizontalLinearOverlap] #linears=21'186 
  1.51e-04s  0.00e+00d  [MergeClauses] 
  3.31e-02s  0.00e+00d  [DetectDominanceRelations] 
  3.00e-01s  0.00e+00d  [PresolveToFixPoint] #num_loops=3 #num_dual_strengthening=1 
  3.30e-02s  0.00e+00d  [DetectDominanceRelations] 
  1.75e-01s  0.00e+00d  [PresolveToFixPoint] #num_loops=1 #num_dual_strengthening=1 
[Symmetry] Graph for symmetry has 26'526 nodes and 398'524 arcs.
[Symmetry] Symmetry computation done. time: 0.0147089 dtime: 0.0226561
  2.40e-01s  3.49e-02d  [Probe] #probed=1'154 #new_bounds=383 
  1.13e-04s  0.00e+00d  [MaxClique] 
  3.26e-02s  0.00e+00d  [DetectDominanceRelations] 
  3.28e-01s  0.00e+00d  [PresolveToFixPoint] #num_loops=4 #num_dual_strengthening=3 
  1.12e-01s  0.00e+00d  [ProcessAtMostOneAndLinear] 
  2.92e-02s  0.00e+00d  [DetectDuplicateConstraints] #without_enforcements=110 
  3.83e-02s  2.13e-03d  [DetectDominatedLinearConstraints] #relevant_constraints=22'615 #num_inclusions=206 
  3.76e-03s  0.00e+00d  [DetectDifferentVariables] #different=126 #cliques=2 #size=6 
  9.42e-03s  6.51e-04d  [ProcessSetPPC] #relevant_constraints=21'171 
  2.60e-04s  3.32e-06d  [FindAlmostIdenticalLinearConstraints] #num_tested_pairs=207 
  1.67e-03s  1.49e-03d  [FindBigAtMostOneAndLinearOverlap] 
  1.38e-01s  5.02e-02d  [FindBigVerticalLinearOverlap] #blocks=1'273 #saved_nz=143'007 
  3.91e-03s  1.06e-03d  [FindBigHorizontalLinearOverlap] #linears=18'650 
  1.67e-04s  0.00e+00d  [MergeClauses] 
  2.12e-02s  0.00e+00d  [DetectDominanceRelations] 
  3.09e-01s  0.00e+00d  [PresolveToFixPoint] #num_loops=3 #num_dual_strengthening=1 
  2.29e-02s  0.00e+00d  [DetectDominanceRelations] 
  1.96e-01s  0.00e+00d  [PresolveToFixPoint] #num_loops=1 #num_dual_strengthening=1 
  1.93e-01s  2.41e-02d  [Probe] #probed=1'154 #new_bounds=729 
  1.14e-04s  0.00e+00d  [MaxClique] 
  2.10e-02s  0.00e+00d  [DetectDominanceRelations] 
  2.91e-01s  0.00e+00d  [PresolveToFixPoint] #num_loops=2 #num_dual_strengthening=1 
  1.02e-01s  0.00e+00d  [ProcessAtMostOneAndLinear] 
  2.76e-02s  0.00e+00d  [DetectDuplicateConstraints] #without_enforcements=110 
  2.45e-02s  1.18e-03d  [DetectDominatedLinearConstraints] #relevant_constraints=23'339 #num_inclusions=172 
  3.22e-03s  0.00e+00d  [DetectDifferentVariables] 
  7.06e-03s  3.51e-04d  [ProcessSetPPC] #relevant_constraints=18'835 
  6.64e-04s  5.17e-05d  [FindAlmostIdenticalLinearConstraints] #num_tested_pairs=2'196 
  1.23e-03s  8.69e-04d  [FindBigAtMostOneAndLinearOverlap] 
  7.35e-02s  2.25e-02d  [FindBigVerticalLinearOverlap] #blocks=749 #saved_nz=58'012 
  3.42e-03s  7.24e-04d  [FindBigHorizontalLinearOverlap] #linears=16'483 
  1.71e-04s  0.00e+00d  [MergeClauses] 
  1.72e-02s  0.00e+00d  [DetectDominanceRelations] 
  3.32e-01s  0.00e+00d  [PresolveToFixPoint] #num_loops=3 #num_dual_strengthening=1 
  1.24e-03s  0.00e+00d  [ExpandObjective] #entries=10'913 #tight_variables=3'110 #tight_constraints=1'690 

Presolve summary:
  - 266 affine relations were detected.
  - rule 'TODO dual: only one blocking constraint?' was applied 2'716 times.
  - rule 'TODO dual: only one unspecified blocking constraint?' was applied 255 times.
  - rule 'TODO duplicate: identical constraint with different enforcements' was applied 330 times.
  - rule 'TODO no_overlap: with task always last' was applied 2 times.
  - rule 'affine: new relation' was applied 266 times.
  - rule 'all_diff: inferred from x != y constraints' was applied 2 times.
  - rule 'at_most_one: removed literals' was applied 6 times.
  - rule 'at_most_one: size one' was applied 6 times.
  - rule 'at_most_one: transformed into max clique.' was applied 1 time.
  - rule 'deductions: 2245 stored' was applied 1 time.
  - rule 'dual: fix variable' was applied 48 times.
  - rule 'dual: reduced domain' was applied 113 times.
  - rule 'duplicate: merged rhs of linear constraint' was applied 240 times.
  - rule 'duplicate: removed constraint' was applied 1'614 times.
  - rule 'enforcement: false literal' was applied 48 times.
  - rule 'enforcement: true literal' was applied 33 times.
  - rule 'exactly_one: x and not(x)' was applied 1 time.
  - rule 'incompatible linear: add implication' was applied 165 times.
  - rule 'linear inclusion: redundant containing constraint' was applied 2 times.
  - rule 'linear matrix: common vertical rectangle' was applied 2'434 times.
  - rule 'linear: always true' was applied 2'275 times.
  - rule 'linear: doubleton free' was applied 23 times.
  - rule 'linear: empty' was applied 64 times.
  - rule 'linear: extracted enforcement literal' was applied 24'367 times.
  - rule 'linear: fixed or dup variables' was applied 25'068 times.
  - rule 'linear: positive equal one' was applied 7 times.
  - rule 'linear: reduced variable domains' was applied 1'781 times.
  - rule 'linear: remapped using affine relations' was applied 24'767 times.
  - rule 'linear: simplified rhs' was applied 106'286 times.
  - rule 'linear: variable substitution 1' was applied 23 times.
  - rule 'linear: variable substitution 2' was applied 488 times.
  - rule 'linear: variable substitution 3' was applied 119 times.
  - rule 'presolve: 186 unused variables removed.' was applied 1 time.
  - rule 'presolve: iteration' was applied 3 times.
  - rule 'probing: reduced enforced constraint to implication.' was applied 8 times.
  - rule 'symmetry: fixed to false in general orbit' was applied 1 time.

Presolved optimization model '': (model_fingerprint: 0x31d917347733194a)
#Variables: 2'258 (#ints: 17 in objective)
  - 288 Booleans in [0,1]
  - 1'593 different domains in [-23380,22239] with a largest complexity of 25.
#kAllDiff: 2
#kExactlyOne: 6 (#literals: 18)
#kLinear2: 1'808 (#enforced: 1'651 #multi: 703)
#kLinear3: 4'210 (#enforced: 3'231)
#kLinearN: 19'158 (#enforced: 17'985) (#terms: 155'859)

Preloading model.
#Bound   5.13s best:inf   next:[232,17617] initial_domain
#Model   5.17s var:2258/2258 constraints:25184/25184

Starting search at 5.18s with 32 workers.
16 full problem subsolvers: [core, default_lp, lb_tree_search, max_lp, no_lp, objective_lb_search, objective_lb_search_max_lp, objective_lb_search_no_lp, objective_shaving_search_max_lp, objective_shaving_search_no_lp, probing, probing_max_lp, pseudo_costs, quick_restart, quick_restart_no_lp, reduced_costs]
14 first solution subsolvers: [fj_long_default, fj_long_lin_default, fj_long_random, fj_short_default, fj_short_lin_default, fj_short_lin_random, fj_short_random, fs_random(2), fs_random_no_lp(2), fs_random_quick_restart(2), fs_random_quick_restart_no_lp]
11 incomplete subsolvers: [feasibility_pump, graph_arc_lns, graph_cst_lns, graph_dec_lns, graph_var_lns, rins/rens, rnd_cst_lns, rnd_var_lns, violation_ls(3)]
3 helper subsolvers: [neighborhood_helper, synchronization_agent, update_gap_integral]
#Bound   5.55s best:inf   next:[337,17617] objective_lb_search_no_lp
#1       5.61s best:7268  next:[337,7267] fs_random_quick_restart_no_lp (fixed_bools=0/336)
#2       5.74s best:7267  next:[337,7266] violation_ls(batch:1 #solutions_imported:1 #lin_moves:0 #lin_evals:14'018 #gen_moves:4'696 #gen_evals:426 #comp_moves:412 #backtracks:2'142 #weight_updates:49)
#3       5.76s best:7266  next:[337,7265] violation_ls(batch:2 #solutions_imported:2 #lin_moves:0 #lin_evals:17'532 #gen_moves:5'524 #gen_evals:479 #comp_moves:490 #backtracks:2'517 #weight_updates:68)
#4       5.86s best:7265  next:[337,7264] violation_ls(batch:2 #solutions_imported:2 #lin_moves:1'486 #lin_evals:33'235 #gen_moves:7'388 #gen_evals:474 #comp_moves:1'571 #backtracks:2'907 #weight_updates:443)
#5       5.86s best:7264  next:[337,7263] violation_ls(batch:3 #solutions_imported:3 #lin_moves:1'526 #lin_evals:33'456 #gen_moves:7'388 #gen_evals:474 #comp_moves:1'571 #backtracks:2'907 #weight_updates:481)
#6       5.99s best:7263  next:[337,7262] violation_ls(batch:4 #solutions_imported:4 #lin_moves:12'738 #lin_evals:71'322 #gen_moves:5'524 #gen_evals:479 #comp_moves:490 #backtracks:2'517 #weight_updates:514)
#7       6.00s best:7262  next:[337,7261] violation_ls(batch:5 #solutions_imported:5 #lin_moves:12'738 #lin_evals:71'326 #gen_moves:5'526 #gen_evals:479 #comp_moves:492 #backtracks:2'517 #weight_updates:514)
#8       6.00s best:7261  next:[337,7260] violation_ls(batch:3 #solutions_imported:3 #lin_moves:9'779 #lin_evals:66'418 #gen_moves:7'865 #gen_evals:766 #comp_moves:956 #backtracks:3'453 #weight_updates:300)
#9       6.00s best:7260  next:[337,7259] violation_ls(batch:4 #solutions_imported:4 #lin_moves:9'779 #lin_evals:66'487 #gen_moves:7'897 #gen_evals:769 #comp_moves:958 #backtracks:3'468 #weight_updates:300)
#10      6.01s best:7259  next:[337,7258] violation_ls(batch:5 #solutions_imported:5 #lin_moves:9'799 #lin_evals:66'590 #gen_moves:7'897 #gen_evals:769 #comp_moves:958 #backtracks:3'468 #weight_updates:310)
#11      6.01s best:7258  next:[337,7257] violation_ls(batch:6 #solutions_imported:6 #lin_moves:9'811 #lin_evals:66'655 #gen_moves:7'897 #gen_evals:769 #comp_moves:958 #backtracks:3'468 #weight_updates:316)
#12      6.02s best:7257  next:[337,7256] violation_ls(batch:7 #solutions_imported:7 #lin_moves:9'996 #lin_evals:67'705 #gen_moves:7'897 #gen_evals:769 #comp_moves:958 #backtracks:3'468 #weight_updates:439)
#13      6.03s best:6800  next:[337,6799] graph_var_lns (d=0.71 s=68 t=0.10 p=1.00 stall=1 h=auto_l0)
#14      6.06s best:6799  next:[337,6798] violation_ls(batch:8 #solutions_imported:8 #lin_moves:11'445 #lin_evals:73'040 #gen_moves:7'897 #gen_evals:769 #comp_moves:958 #backtracks:3'468 #weight_updates:696)
#15      6.20s best:6798  next:[337,6797] violation_ls(batch:9 #solutions_imported:9 #lin_moves:21'883 #lin_evals:98'197 #gen_moves:5'560 #gen_evals:482 #comp_moves:494 #backtracks:2'533 #weight_updates:1'047)
#16      6.21s best:6797  next:[337,6796] violation_ls(batch:6 #solutions_imported:6 #lin_moves:21'024 #lin_evals:113'763 #gen_moves:7'388 #gen_evals:474 #comp_moves:1'571 #backtracks:2'907 #weight_updates:984)
#17      6.22s best:6796  next:[337,6795] violation_ls(batch:7 #solutions_imported:7 #lin_moves:21'024 #lin_evals:113'801 #gen_moves:7'404 #gen_evals:477 #comp_moves:1'573 #backtracks:2'914 #weight_updates:984)
#18      6.23s best:6795  next:[337,6794] violation_ls(batch:8 #solutions_imported:8 #lin_moves:21'024 #lin_evals:113'838 #gen_moves:7'419 #gen_evals:480 #comp_moves:1'574 #backtracks:2'921 #weight_updates:984)
#19      6.25s best:6794  next:[337,6793] violation_ls(batch:9 #solutions_imported:9 #lin_moves:21'024 #lin_evals:113'846 #gen_moves:7'423 #gen_evals:480 #comp_moves:1'578 #backtracks:2'921 #weight_updates:984)
#20      6.31s best:6793  next:[337,6792] violation_ls(batch:10 #solutions_imported:10 #lin_moves:21'911 #lin_evals:98'377 #gen_moves:5'560 #gen_evals:482 #comp_moves:494 #backtracks:2'533 #weight_updates:1'073)
#21      6.34s best:6637  next:[337,6636] no_lp (fixed_bools=0/369)
#Bound   6.47s best:6637  next:[342,6636] objective_lb_search_max_lp
#22      6.54s best:6314  next:[342,6313] graph_var_lns (d=0.91 s=109 t=0.10 p=1.00 stall=0 h=auto_l0)
#23      6.55s best:6313  next:[342,6312] violation_ls(batch:11 #solutions_imported:11 #lin_moves:21'604 #lin_evals:116'557 #gen_moves:7'425 #gen_evals:480 #comp_moves:1'580 #backtracks:2'921 #weight_updates:1'199)
#24      6.67s best:6210  next:[342,6209] rins_lp_lns (d=0.81 s=147 t=0.10 p=1.00 stall=2 h=auto_l0)
#Bound   6.77s best:6210  next:[545,6209] objective_lb_search_no_lp
#25      6.82s best:6209  next:[545,6208] violation_ls(batch:12 #solutions_imported:11 #lin_moves:25'937 #lin_evals:163'251 #gen_moves:15'654 #gen_evals:1'552 #comp_moves:2'018 #backtracks:6'815 #weight_updates:7'961)
#26      6.93s best:5603  next:[545,5602] rins_lp_lns (d=0.88 s=151 t=0.10 p=1.00 stall=3 h=auto_l0)
#27      6.96s best:5548  next:[545,5547] rins_lp_lns (d=0.88 s=149 t=0.10 p=1.00 stall=3 h=auto_l0)
#28      6.96s best:4964  next:[545,4963] no_lp (fixed_bools=0/416)
#Bound   7.17s best:4964  next:[547,4963] objective_lb_search_no_lp
#Bound   8.41s best:4964  next:[574,4963] objective_lb_search_max_lp
#29      8.41s best:4959  next:[574,4958] graph_var_lns (d=0.99 s=174 t=0.10 p=1.00 stall=1 h=auto_l0)
#30      8.55s best:4827  next:[574,4826] graph_arc_lns (d=0.99 s=175 t=0.10 p=1.00 stall=1 h=auto_l0)
#31      9.02s best:4826  next:[574,4825] violation_ls(batch:16 #solutions_imported:14 #lin_moves:32'013 #lin_evals:244'546 #gen_moves:38'935 #gen_evals:3'337 #comp_moves:2'975 #backtracks:17'977 #weight_updates:1'777)
#32      9.16s best:4825  next:[574,4824] violation_ls(batch:16 #solutions_imported:14 #lin_moves:51'174 #lin_evals:251'920 #gen_moves:16'527 #gen_evals:1'473 #comp_moves:2'764 #backtracks:6'880 #weight_updates:1'740)
#Bound   9.80s best:4825  next:[584,4824] objective_lb_search_max_lp
#33     10.12s best:4794  next:[584,4793] no_lp (fixed_bools=0/450)
#34     10.19s best:4793  next:[584,4792] violation_ls(batch:17 #solutions_imported:15 #lin_moves:51'174 #lin_evals:263'653 #gen_moves:20'056 #gen_evals:1'992 #comp_moves:2'927 #backtracks:8'563 #weight_updates:1'802)
#35     11.80s best:4761  next:[584,4760] rnd_var_lns (d=0.99 s=206 t=0.10 p=1.00 stall=1 h=auto_l0)
#36     12.09s best:4760  next:[584,4759] violation_ls(batch:19 #solutions_imported:17 #lin_moves:48'886 #lin_evals:316'086 #gen_moves:40'693 #gen_evals:3'371 #comp_moves:3'119 #backtracks:18'784 #weight_updates:4'945)
#37     12.12s best:4759  next:[584,4758] violation_ls(batch:19 #solutions_imported:16 #lin_moves:25'937 #lin_evals:310'358 #gen_moves:56'994 #gen_evals:5'880 #comp_moves:9'653 #backtracks:23'662 #weight_updates:8'357)
#Bound  12.34s best:4759  next:[591,4758] objective_lb_search_max_lp
#38     12.49s best:4744  next:[591,4743] no_lp (fixed_bools=0/483)
#39     13.37s best:4739  next:[591,4738] quick_restart_no_lp (fixed_bools=0/573)
#Bound  13.43s best:4739  next:[722,4738] objective_lb_search_no_lp
#40     13.63s best:4673  next:[722,4672] rins_lp_lns (d=0.90 s=234 t=0.10 p=0.64 stall=0 h=auto_l0)
#41     13.83s best:4511  next:[722,4510] rins_lp_lns (d=0.84 s=248 t=0.10 p=0.54 stall=0 h=auto_l0)
#42     15.50s best:4508  next:[722,4507] rins_lp_lns (d=0.88 s=258 t=0.10 p=0.57 stall=0 h=auto_l0)
#43     15.80s best:4438  next:[722,4437] quick_restart_no_lp (fixed_bools=0/635)
#44     16.97s best:4431  next:[722,4430] graph_arc_lns (d=0.99 s=265 t=0.10 p=0.78 stall=1 h=auto_l0)
#45     17.01s best:4430  next:[722,4429] violation_ls(batch:22 #solutions_imported:19 #lin_moves:51'153 #lin_evals:378'589 #gen_moves:54'901 #gen_evals:4'432 #comp_moves:6'488 #backtracks:24'196 #weight_updates:5'307)
#46     17.01s best:4429  next:[722,4428] violation_ls(batch:22 #solutions_imported:18 #lin_moves:25'957 #lin_evals:359'689 #gen_moves:69'827 #gen_evals:7'077 #comp_moves:11'816 #backtracks:28'992 #weight_updates:8'469)
#47     17.07s best:4428  next:[722,4427] violation_ls(batch:22 #solutions_imported:20 #lin_moves:79'859 #lin_evals:415'016 #gen_moves:27'873 #gen_evals:2'928 #comp_moves:3'288 #backtracks:12'289 #weight_updates:8'593)
#48     17.45s best:4385  next:[722,4384] rnd_cst_lns (d=0.99 s=253 t=0.10 p=0.94 stall=0 h=auto_l0)
#49     17.58s best:4275  next:[722,4274] rnd_var_lns (d=1.00 s=252 t=0.10 p=0.94 stall=0 h=auto_l0)
#50     17.65s best:4274  next:[722,4273] violation_ls(batch:23 #solutions_imported:20 #lin_moves:51'153 #lin_evals:387'057 #gen_moves:56'918 #gen_evals:4'549 #comp_moves:6'631 #backtracks:25'133 #weight_updates:5'347)
#51     17.66s best:4273  next:[722,4272] violation_ls(batch:23 #solutions_imported:21 #lin_moves:80'084 #lin_evals:416'349 #gen_moves:27'873 #gen_evals:2'928 #comp_moves:3'288 #backtracks:12'289 #weight_updates:8'743)
#52     18.70s best:4272  next:[722,4271] violation_ls(batch:24 #solutions_imported:21 #lin_moves:51'153 #lin_evals:395'551 #gen_moves:59'019 #gen_evals:4'654 #comp_moves:6'784 #backtracks:26'107 #weight_updates:5'391)
#53     18.97s best:4220  next:[722,4219] rnd_cst_lns (d=0.99 s=283 t=0.10 p=0.76 stall=0 h=auto_l0)
#54     19.29s best:4218  next:[722,4217] violation_ls(batch:25 #solutions_imported:22 #lin_moves:51'153 #lin_evals:395'563 #gen_moves:59'026 #gen_evals:4'654 #comp_moves:6'785 #backtracks:26'110 #weight_updates:5'391)
#55     19.29s best:4216  next:[722,4215] violation_ls(batch:25 #solutions_imported:21 #lin_moves:35'718 #lin_evals:434'819 #gen_moves:78'088 #gen_evals:7'665 #comp_moves:12'961 #backtracks:32'550 #weight_updates:8'793)
#56     19.30s best:4214  next:[722,4213] violation_ls(batch:25 #solutions_imported:23 #lin_moves:80'084 #lin_evals:444'869 #gen_moves:35'920 #gen_evals:3'542 #comp_moves:4'548 #backtracks:15'682 #weight_updates:8'834)
#57     19.79s best:4182  next:[722,4181] quick_restart_no_lp (fixed_bools=0/702)
#58     19.97s best:4142  next:[722,4141] rins_lp_lns (d=0.88 s=288 t=0.10 p=0.56 stall=1 h=auto_l0)
#Bound  20.07s best:4142  next:[732,4141] objective_lb_search_no_lp
#Bound  20.40s best:4142  next:[761,4141] objective_lb_search
#59     22.33s best:4091  next:[761,4090] graph_arc_lns (d=0.99 s=305 t=0.10 p=0.74 stall=1 h=auto_l0)
#60     22.35s best:4053  next:[761,4052] graph_var_lns (d=0.99 s=318 t=0.10 p=0.76 stall=1 h=auto_l0)
#61     22.77s best:4052  next:[761,4051] violation_ls(batch:28 #solutions_imported:23 #lin_moves:36'700 #lin_evals:491'364 #gen_moves:93'864 #gen_evals:9'129 #comp_moves:14'030 #backtracks:39'902 #weight_updates:9'184)
#62     22.78s best:4051  next:[761,4050] violation_ls(batch:28 #solutions_imported:25 #lin_moves:93'414 #lin_evals:507'051 #gen_moves:35'928 #gen_evals:3'542 #comp_moves:4'550 #backtracks:15'685 #weight_updates:15'504)
#63     22.82s best:3796  next:[761,3795] rins_lp_lns (d=0.88 s=332 t=0.10 p=0.55 stall=3 h=auto_l0)
#64     24.61s best:3751  next:[761,3750] graph_var_lns (d=0.99 s=338 t=0.10 p=0.75 stall=0 h=auto_l0)
#65     24.74s best:3750  next:[761,3749] violation_ls(batch:30 #solutions_imported:25 #lin_moves:36'700 #lin_evals:522'731 #gen_moves:104'017 #gen_evals:10'286 #comp_moves:14'576 #backtracks:44'701 #weight_updates:9'320)
#66     24.99s best:3721  next:[761,3720] rins_lp_lns (d=0.90 s=342 t=0.10 p=0.57 stall=0 h=auto_l0)
#67     25.67s best:3713  next:[761,3712] rins_lp_lns (d=0.90 s=352 t=0.10 p=0.57 stall=0 h=auto_l0)
#68     25.87s best:3707  next:[761,3706] rins_lp_lns (d=0.88 s=362 t=0.10 p=0.55 stall=0 h=auto_l0)
#69     29.51s best:3615  next:[761,3614] rnd_cst_lns (d=0.99 s=377 t=0.10 p=0.75 stall=0 h=auto_l0)
#70     29.74s best:3575  next:[761,3574] rins_lp_lns (d=0.88 s=392 t=0.10 p=0.54 stall=2 h=auto_l0)
#71     30.92s best:3571  next:[761,3570] quick_restart_no_lp (fixed_bools=0/956)
#Bound  31.05s best:3571  next:[767,3570] objective_lb_search_no_lp
#72     32.24s best:3570  next:[767,3569] violation_ls(batch:36 #solutions_imported:31 #lin_moves:120'278 #lin_evals:732'774 #gen_moves:75'850 #gen_evals:7'494 #comp_moves:6'936 #backtracks:34'448 #weight_updates:19'114)
#73     33.19s best:3554  next:[767,3553] rnd_var_lns (d=0.99 s=396 t=0.10 p=0.73 stall=0 h=auto_l0)
#74     33.21s best:3553  next:[767,3552] violation_ls(batch:37 #solutions_imported:32 #lin_moves:110'716 #lin_evals:771'104 #gen_moves:91'062 #gen_evals:7'965 #comp_moves:9'771 #backtracks:40'626 #weight_updates:16'217)
#75     33.22s best:3552  next:[767,3551] violation_ls(batch:37 #solutions_imported:30 #lin_moves:85'826 #lin_evals:725'962 #gen_moves:110'400 #gen_evals:11'160 #comp_moves:15'870 #backtracks:47'245 #weight_updates:10'294)
#76     34.20s best:3551  next:[767,3550] violation_ls(batch:38 #solutions_imported:33 #lin_moves:110'716 #lin_evals:776'161 #gen_moves:92'499 #gen_evals:8'142 #comp_moves:9'908 #backtracks:41'276 #weight_updates:16'243)
#77     34.20s best:3550  next:[767,3549] violation_ls(batch:38 #solutions_imported:31 #lin_moves:85'826 #lin_evals:726'043 #gen_moves:110'435 #gen_evals:11'161 #comp_moves:15'871 #backtracks:47'262 #weight_updates:10'294)
#78     35.35s best:3541  next:[767,3540] rnd_cst_lns (d=1.00 s=419 t=0.10 p=0.73 stall=0 h=auto_l0)
#79     35.37s best:3540  next:[767,3539] violation_ls(batch:39 #solutions_imported:34 #lin_moves:112'133 #lin_evals:781'315 #gen_moves:92'499 #gen_evals:8'142 #comp_moves:9'908 #backtracks:41'276 #weight_updates:16'475)
#80     35.39s best:3539  next:[767,3538] violation_ls(batch:39 #solutions_imported:32 #lin_moves:87'245 #lin_evals:732'176 #gen_moves:110'435 #gen_evals:11'161 #comp_moves:15'871 #backtracks:47'262 #weight_updates:10'546)
#81     36.35s best:3538  next:[767,3537] violation_ls(batch:40 #solutions_imported:35 #lin_moves:116'351 #lin_evals:794'699 #gen_moves:92'499 #gen_evals:8'142 #comp_moves:9'908 #backtracks:41'276 #weight_updates:16'855)
#82     36.39s best:3537  next:[767,3536] violation_ls(batch:40 #solutions_imported:33 #lin_moves:87'245 #lin_evals:741'511 #gen_moves:113'341 #gen_evals:11'422 #comp_moves:16'029 #backtracks:48'636 #weight_updates:10'599)
#83     36.42s best:3536  next:[767,3535] violation_ls(batch:40 #solutions_imported:35 #lin_moves:132'653 #lin_evals:818'438 #gen_moves:83'225 #gen_evals:8'318 #comp_moves:8'014 #backtracks:37'596 #weight_updates:20'027)
#84     37.45s best:3516  next:[767,3515] rins_lp_lns (d=0.86 s=464 t=0.10 p=0.52 stall=1 h=auto_l0)
#85     38.32s best:3497  next:[767,3496] graph_var_lns (d=0.99 s=460 t=0.10 p=0.68 stall=1 h=auto_l0)
#86     39.50s best:3482  next:[767,3481] rins_lp_lns (d=0.88 s=474 t=0.10 p=0.53 stall=0 h=auto_l0)
#Bound  40.10s best:3482  next:[768,3481] objective_lb_search_max_lp
#87     42.53s best:3394  next:[768,3393] rnd_var_lns (d=1.00 s=478 t=0.10 p=0.69 stall=0 h=auto_l0)
#Bound  48.11s best:3394  next:[769,3393] objective_lb_search_no_lp
#88     48.40s best:3391  next:[769,3390] rnd_cst_lns (d=0.99 s=521 t=0.10 p=0.65 stall=1 h=auto_l0)
#89     49.87s best:3349  next:[769,3348] rins_lp_lns (d=0.88 s=548 t=0.10 p=0.53 stall=2 h=auto_l0)
#90     53.93s best:3280  next:[769,3279] rnd_var_lns (d=0.99 s=562 t=0.10 p=0.62 stall=0 h=auto_l0)
#91     54.49s best:3275  next:[769,3274] quick_restart_no_lp (fixed_bools=0/1257)
#92     55.22s best:3274  next:[769,3273] violation_ls(batch:53 #solutions_imported:42 #lin_moves:167'515 #lin_evals:1'147'356 #gen_moves:130'196 #gen_evals:11'249 #comp_moves:16'854 #backtracks:56'648 #weight_updates:36'014)
#93     55.23s best:3273  next:[769,3272] violation_ls(batch:53 #solutions_imported:40 #lin_moves:166'058 #lin_evals:1'117'999 #gen_moves:145'652 #gen_evals:14'037 #comp_moves:19'477 #backtracks:63'057 #weight_updates:12'206)
#94     55.23s best:3272  next:[769,3271] violation_ls(batch:53 #solutions_imported:42 #lin_moves:152'461 #lin_evals:1'155'907 #gen_moves:150'644 #gen_evals:14'010 #comp_moves:20'060 #backtracks:65'264 #weight_updates:20'827)
#95     55.60s best:3271  next:[769,3270] graph_var_lns (d=0.99 s=584 t=0.10 p=0.62 stall=2 h=auto_l0)
#96     55.82s best:3269  next:[769,3268] quick_restart_no_lp (fixed_bools=0/1305)
#97     56.19s best:3268  next:[769,3267] violation_ls(batch:54 #solutions_imported:43 #lin_moves:167'537 #lin_evals:1'147'469 #gen_moves:130'196 #gen_evals:11'249 #comp_moves:16'854 #backtracks:56'648 #weight_updates:36'025)
#98     56.20s best:3267  next:[769,3266] violation_ls(batch:54 #solutions_imported:41 #lin_moves:166'058 #lin_evals:1'118'027 #gen_moves:145'667 #gen_evals:14'037 #comp_moves:19'480 #backtracks:63'063 #weight_updates:12'206)
#99     56.20s best:3266  next:[769,3265] violation_ls(batch:54 #solutions_imported:43 #lin_moves:152'462 #lin_evals:1'155'924 #gen_moves:150'644 #gen_evals:14'010 #comp_moves:20'060 #backtracks:65'264 #weight_updates:20'827)
#100    57.36s best:3189  next:[769,3188] rins_lp_lns (d=0.89 s=599 t=0.10 p=0.53 stall=0 h=auto_l0)
#101    58.19s best:3129  next:[769,3128] rins_pump_lns (d=0.88 s=609 t=0.10 p=0.52 stall=0 h=auto_l0)
#Bound  63.03s best:3129  next:[775,3128] objective_lb_search_no_lp
#Bound  71.97s best:3129  next:[776,3128] objective_lb_search_max_lp
#Bound  77.71s best:3129  next:[781,3128] objective_lb_search_no_lp
#Bound  83.13s best:3129  next:[782,3128] objective_lb_search_no_lp
#Bound  90.63s best:3129  next:[783,3128] objective_lb_search_no_lp
#Bound  98.70s best:3129  next:[784,3128] objective_lb_search_no_lp
#Bound 108.06s best:3129  next:[848,3128] objective_lb_search
#102   113.26s best:3128  next:[848,3127] rnd_var_lns (d=0.99 s=996 t=0.10 p=0.57 stall=1 h=auto_l0)
#103   113.28s best:3127  next:[848,3126] violation_ls(batch:93 #solutions_imported:44 #lin_moves:545'829 #lin_evals:2'602'921 #gen_moves:145'667 #gen_evals:14'037 #comp_moves:19'480 #backtracks:63'063 #weight_updates:13'587)
#104   113.29s best:3126  next:[848,3125] violation_ls(batch:93 #solutions_imported:46 #lin_moves:152'462 #lin_evals:2'054'002 #gen_moves:265'115 #gen_evals:30'154 #comp_moves:39'244 #backtracks:112'848 #weight_updates:21'100)
#105   114.76s best:3125  next:[848,3124] violation_ls(batch:94 #solutions_imported:46 #lin_moves:546'670 #lin_evals:2'727'534 #gen_moves:139'081 #gen_evals:11'760 #comp_moves:17'540 #backtracks:60'746 #weight_updates:37'086)
#106   114.91s best:3124  next:[848,3123] violation_ls(batch:94 #solutions_imported:47 #lin_moves:152'462 #lin_evals:2'067'714 #gen_moves:268'809 #gen_evals:30'429 #comp_moves:39'412 #backtracks:114'611 #weight_updates:21'157)
#107   116.89s best:3123  next:[848,3122] violation_ls(batch:95 #solutions_imported:48 #lin_moves:152'462 #lin_evals:2'092'089 #gen_moves:276'190 #gen_evals:30'708 #comp_moves:40'199 #backtracks:117'908 #weight_updates:21'238)
#108   117.93s best:3122  next:[848,3121] violation_ls(batch:96 #solutions_imported:48 #lin_moves:546'670 #lin_evals:2'770'485 #gen_moves:153'023 #gen_evals:12'470 #comp_moves:18'302 #backtracks:67'335 #weight_updates:37'244)
#109   117.96s best:3121  next:[848,3120] violation_ls(batch:96 #solutions_imported:47 #lin_moves:557'961 #lin_evals:2'665'093 #gen_moves:155'405 #gen_evals:14'646 #comp_moves:19'769 #backtracks:67'787 #weight_updates:14'240)
#110   117.97s best:3120  next:[848,3119] violation_ls(batch:96 #solutions_imported:49 #lin_moves:152'462 #lin_evals:2'092'093 #gen_moves:276'191 #gen_evals:30'708 #comp_moves:40'200 #backtracks:117'908 #weight_updates:21'238)
#Bound 123.89s best:3120  next:[862,3119] objective_lb_search
#Bound 130.57s best:3120  next:[867,3119] objective_lb_search_max_lp
#Bound 150.57s best:3120  next:[871,3119] objective_lb_search_no_lp
#Bound 166.65s best:3120  next:[879,3119] objective_lb_search_no_lp
#Bound 212.80s best:3120  next:[881,3119] objective_lb_search_no_lp
#Bound 232.25s best:3120  next:[882,3119] objective_lb_search
#Bound 255.86s best:3120  next:[885,3119] objective_lb_search
#Bound 300.56s best:3120  next:[886,3119] objective_lb_search_no_lp
#Bound 315.25s best:3120  next:[890,3119] objective_lb_search_no_lp
#Bound 324.99s best:3120  next:[907,3119] objective_lb_search
#Bound 330.35s best:3120  next:[909,3119] objective_lb_search
#Bound 351.57s best:3120  next:[914,3119] objective_lb_search_no_lp
#111   369.90s best:3078  next:[914,3077] graph_var_lns (d=0.99 s=2829 t=0.10 p=0.53 stall=4 h=auto_l0)
#112   369.93s best:3077  next:[914,3076] violation_ls(batch:269 #solutions_imported:51 #perturbations:1 #lin_moves:659'378 #lin_evals:6'304'779 #gen_moves:849'853 #gen_evals:52'965 #comp_moves:55'369 #backtracks:397'140 #weight_updates:519'307)
#113   370.91s best:3076  next:[914,3075] violation_ls(batch:270 #solutions_imported:49 #perturbations:1 #lin_moves:1'435'584 #lin_evals:7'016'785 #gen_moves:155'405 #gen_evals:14'646 #comp_moves:19'769 #backtracks:67'787 #weight_updates:869'473)
#114   370.96s best:3075  next:[914,3074] violation_ls(batch:270 #solutions_imported:52 #perturbations:1 #lin_moves:663'622 #lin_evals:6'322'317 #gen_moves:849'853 #gen_evals:52'965 #comp_moves:55'369 #backtracks:397'140 #weight_updates:520'700)
#115   372.29s best:3074  next:[914,3073] violation_ls(batch:271 #solutions_imported:51 #perturbations:1 #lin_moves:2'282'998 #lin_evals:10'189'929 #gen_moves:153'023 #gen_evals:12'470 #comp_moves:18'302 #backtracks:67'335 #weight_updates:40'917)
#116   372.29s best:3073  next:[914,3072] violation_ls(batch:271 #solutions_imported:50 #perturbations:1 #lin_moves:1'435'630 #lin_evals:7'017'024 #gen_moves:155'405 #gen_evals:14'646 #comp_moves:19'769 #backtracks:67'787 #weight_updates:869'496)
#117   372.29s best:3072  next:[914,3071] violation_ls(batch:271 #solutions_imported:53 #perturbations:1 #lin_moves:663'622 #lin_evals:6'322'368 #gen_moves:849'871 #gen_evals:52'965 #comp_moves:55'371 #backtracks:397'148 #weight_updates:520'700)
#118   373.51s best:3064  next:[914,3063] graph_var_lns (d=0.99 s=2860 t=0.10 p=0.52 stall=0 h=auto_l0)
#119   374.08s best:3063  next:[914,3062] violation_ls(batch:272 #solutions_imported:54 #perturbations:1 #lin_moves:663'622 #lin_evals:6'343'542 #gen_moves:856'720 #gen_evals:53'301 #comp_moves:55'634 #backtracks:400'441 #weight_updates:520'791)
#120   375.12s best:3004  next:[914,3003] rins_lp_lns (d=0.89 s=2875 t=0.10 p=0.50 stall=1 h=auto_l0)
#121   376.12s best:3003  next:[914,3002] violation_ls(batch:274 #solutions_imported:55 #perturbations:1 #lin_moves:663'622 #lin_evals:6'380'481 #gen_moves:867'337 #gen_evals:53'821 #comp_moves:57'015 #backtracks:405'059 #weight_updates:520'901)
#122   377.07s best:2978  next:[914,2977] rnd_cst_lns (d=0.99 s=2890 t=0.10 p=0.53 stall=0 h=auto_l0)
#Bound 406.91s best:2978  next:[916,2977] objective_lb_search
#Bound 439.25s best:2978  next:[925,2977] objective_lb_search_no_lp
#Bound 469.42s best:2978  next:[929,2977] objective_lb_search_no_lp
#Bound 506.90s best:2978  next:[931,2977] objective_lb_search_no_lp
#Bound 515.73s best:2978  next:[935,2977] objective_lb_search
#Bound 551.31s best:2978  next:[940,2977] objective_lb_search_max_lp
#Bound 572.07s best:2978  next:[975,2977] objective_lb_search_no_lp
#Bound 605.21s best:2978  next:[976,2977] objective_lb_search_no_lp
#Bound 608.44s best:2978  next:[977,2977] objective_lb_search_no_lp
#Bound 614.37s best:2978  next:[978,2977] objective_lb_search_no_lp
#Bound 621.53s best:2978  next:[979,2977] objective_lb_search_no_lp
#Bound 684.74s best:2978  next:[981,2977] objective_lb_search_no_lp
#Bound 719.82s best:2978  next:[986,2977] objective_lb_search_no_lp
#Bound 743.42s best:2978  next:[990,2977] objective_lb_search_no_lp
#Bound 762.32s best:2978  next:[991,2977] objective_lb_search_no_lp
#Bound 813.14s best:2978  next:[994,2977] objective_lb_search_no_lp
#Bound 853.49s best:2978  next:[1003,2977] objective_lb_search
#Bound 908.45s best:2978  next:[1016,2977] objective_lb_search_no_lp
#Bound 941.00s best:2978  next:[1018,2977] objective_lb_search_no_lp
#Bound 963.03s best:2978  next:[1019,2977] objective_lb_search_no_lp
#Bound 967.79s best:2978  next:[1023,2977] objective_lb_search_no_lp
#Bound 972.88s best:2978  next:[1025,2977] objective_lb_search_no_lp
#Bound 987.53s best:2978  next:[1027,2977] objective_lb_search_no_lp
#Bound 1042.24s best:2978  next:[1029,2977] objective_lb_search_no_lp
#Bound 1067.78s best:2978  next:[1031,2977] objective_lb_search_no_lp
#Bound 1105.82s best:2978  next:[1033,2977] objective_lb_search_no_lp
#Bound 1130.74s best:2978  next:[1035,2977] objective_lb_search_no_lp
#Bound 1175.90s best:2978  next:[1037,2977] objective_lb_search_no_lp
#Bound 1183.91s best:2978  next:[1038,2977] objective_lb_search_no_lp
#Bound 1298.01s best:2978  next:[1040,2977] objective_lb_search_no_lp
#Bound 1321.09s best:2978  next:[1041,2977] objective_lb_search
#Bound 1474.38s best:2978  next:[1048,2977] objective_lb_search
#Bound 1502.08s best:2978  next:[1053,2977] objective_lb_search_no_lp
#Bound 1524.73s best:2978  next:[1055,2977] objective_lb_search_no_lp
#Bound 1537.85s best:2978  next:[1062,2977] objective_lb_search_no_lp
#Bound 1547.77s best:2978  next:[1064,2977] objective_lb_search
#Bound 1581.19s best:2978  next:[1065,2977] objective_lb_search
#Bound 1676.25s best:2978  next:[1066,2977] objective_lb_search
#Bound 1721.69s best:2978  next:[1068,2977] objective_lb_search_no_lp
#Bound 1776.77s best:2978  next:[1070,2977] objective_lb_search_no_lp
#Bound 1884.03s best:2978  next:[1073,2977] objective_lb_search
#Bound 1967.24s best:2978  next:[1074,2977] objective_lb_search
#Bound 2000.31s best:2978  next:[1075,2977] objective_lb_search_no_lp
#Bound 2112.27s best:2978  next:[1076,2977] objective_lb_search_max_lp
#Bound 2181.41s best:2978  next:[1078,2977] objective_lb_search_no_lp
#Bound 2248.88s best:2978  next:[1080,2977] objective_lb_search_no_lp
#Bound 2325.31s best:2978  next:[1082,2977] objective_lb_search_no_lp
#Bound 2412.09s best:2978  next:[1083,2977] objective_lb_search_no_lp
#Bound 2436.42s best:2978  next:[1084,2977] objective_lb_search_no_lp
#Bound 2481.86s best:2978  next:[1086,2977] objective_lb_search_no_lp
#Bound 2578.48s best:2978  next:[1087,2977] objective_lb_search_no_lp
#Bound 2594.16s best:2978  next:[1088,2977] objective_lb_search
#Bound 2650.67s best:2978  next:[1089,2977] objective_lb_search_no_lp
#Bound 2669.32s best:2978  next:[1091,2977] objective_lb_search_no_lp
#Bound 2778.92s best:2978  next:[1094,2977] objective_lb_search_no_lp
#Bound 2811.01s best:2978  next:[1096,2977] objective_lb_search_no_lp
#Bound 2866.17s best:2978  next:[1098,2977] objective_lb_search
#Bound 2889.68s best:2978  next:[1100,2977] objective_lb_search_no_lp
#Bound 3032.44s best:2978  next:[1102,2977] objective_lb_search_no_lp
#Bound 3194.80s best:2978  next:[1103,2977] objective_lb_search
#Bound 3327.82s best:2978  next:[1105,2977] objective_lb_search
#Bound 3350.34s best:2978  next:[1107,2977] objective_lb_search
#Bound 3383.74s best:2978  next:[1114,2977] objective_lb_search_no_lp
#Bound 3391.68s best:2978  next:[1135,2977] objective_lb_search_no_lp
#Bound 3428.60s best:2978  next:[1136,2977] objective_lb_search_no_lp
#Bound 3445.85s best:2978  next:[1139,2977] objective_lb_search_no_lp
#Bound 3461.91s best:2978  next:[1143,2977] objective_lb_search_no_lp
#Bound 3558.54s best:2978  next:[1146,2977] objective_lb_search_no_lp

Task timing                                  n [     min,      max]      avg      dev     time         n [     min,      max]      avg      dev    dtime
                             'core':         1 [  59.91m,   59.91m]   59.91m   0.00ns   59.91m         1 [  12.73m,   12.73m]   12.73m   0.00ns   12.73m
                       'default_lp':         1 [  59.91m,   59.91m]   59.91m   0.00ns   59.91m         1 [   3.36m,    3.36m]    3.36m   0.00ns    3.36m
                 'feasibility_pump':       965 [107.93us,   49.52s]    3.73s    2.86s   59.91m       673 [155.68ms,    6.04s] 428.62ms 219.16ms    4.81m
                  'fj_long_default':         2 [177.68ms, 274.19ms] 225.94ms  48.26ms 451.88ms         2 [126.26ms, 170.80ms] 148.53ms  22.27ms 297.05ms
              'fj_long_lin_default':         2 [181.74ms, 221.35ms] 201.54ms  19.81ms 403.09ms         2 [142.02ms, 156.94ms] 149.48ms   7.46ms 298.96ms
                   'fj_long_random':         2 [178.41ms, 263.97ms] 221.19ms  42.78ms 442.38ms         2 [125.43ms, 160.52ms] 142.97ms  17.54ms 285.95ms
                 'fj_short_default':         3 [168.28ms, 245.08ms] 196.94ms  34.25ms 590.81ms         3 [135.69ms, 144.53ms] 140.40ms   3.63ms 421.21ms
             'fj_short_lin_default':         2 [166.53ms, 219.38ms] 192.96ms  26.43ms 385.91ms         2 [138.86ms, 148.25ms] 143.56ms   4.70ms 287.11ms
              'fj_short_lin_random':         2 [162.96ms, 207.41ms] 185.19ms  22.23ms 370.37ms         2 [134.90ms, 141.07ms] 137.98ms   3.08ms 275.97ms
                  'fj_short_random':         2 [163.82ms, 209.64ms] 186.73ms  22.91ms 373.47ms         2 [132.89ms, 146.19ms] 139.54ms   6.65ms 279.08ms
                        'fs_random':         1 [428.49ms, 428.49ms] 428.49ms   0.00ns 428.49ms         1 [  3.85ms,   3.85ms]   3.85ms   0.00ns   3.85ms
                        'fs_random':         1 [429.10ms, 429.10ms] 429.10ms   0.00ns 429.10ms         1 [  3.85ms,   3.85ms]   3.85ms   0.00ns   3.85ms
                  'fs_random_no_lp':         1 [428.77ms, 428.77ms] 428.77ms   0.00ns 428.77ms         1 [ 17.07ms,  17.07ms]  17.07ms   0.00ns  17.07ms
                  'fs_random_no_lp':         1 [441.52ms, 441.52ms] 441.52ms   0.00ns 441.52ms         1 [ 13.02ms,  13.02ms]  13.02ms   0.00ns  13.02ms
          'fs_random_quick_restart':         1 [428.29ms, 428.29ms] 428.29ms   0.00ns 428.29ms         1 [  3.86ms,   3.86ms]   3.86ms   0.00ns   3.86ms
          'fs_random_quick_restart':         1 [428.84ms, 428.84ms] 428.84ms   0.00ns 428.84ms         1 [  3.85ms,   3.85ms]   3.85ms   0.00ns   3.85ms
    'fs_random_quick_restart_no_lp':         1 [441.35ms, 441.35ms] 441.35ms   0.00ns 441.35ms         1 [ 15.09ms,  15.09ms]  15.09ms   0.00ns  15.09ms
                    'graph_arc_lns':      2392 [ 65.59ms,    5.79s]    3.40s 896.92ms    2.26h      2386 [ 10.00ns, 148.97ms]  68.68ms  36.75ms    2.73m
                    'graph_cst_lns':      2392 [ 24.87ms,    5.61s]    3.37s 954.74ms    2.24h      2360 [ 10.00ns, 132.85ms]  68.17ms  37.17ms    2.68m
                    'graph_dec_lns':      2392 [ 84.87ms,    6.15s]    3.59s 841.36ms    2.38h      2382 [ 10.00ns, 169.82ms]  70.80ms  34.98ms    2.81m
                    'graph_var_lns':      2392 [ 77.41ms,    6.13s]    3.37s 896.47ms    2.24h      2379 [ 10.00ns, 170.19ms]  72.25ms  34.49ms    2.86m
                   'lb_tree_search':         1 [  59.91m,   59.91m]   59.91m   0.00ns   59.91m         1 [  17.91m,   17.91m]   17.91m   0.00ns   17.91m
                           'max_lp':         1 [  59.91m,   59.91m]   59.91m   0.00ns   59.91m         1 [   4.10m,    4.10m]    4.10m   0.00ns    4.10m
                            'no_lp':         1 [  59.91m,   59.91m]   59.91m   0.00ns   59.91m         1 [   2.78m,    2.78m]    2.78m   0.00ns    2.78m
              'objective_lb_search':         1 [  59.91m,   59.91m]   59.91m   0.00ns   59.91m         1 [   6.19m,    6.19m]    6.19m   0.00ns    6.19m
       'objective_lb_search_max_lp':         1 [  59.91m,   59.91m]   59.91m   0.00ns   59.91m         1 [   9.44m,    9.44m]    9.44m   0.00ns    9.44m
        'objective_lb_search_no_lp':         1 [  59.91m,   59.91m]   59.91m   0.00ns   59.91m         1 [   2.07m,    2.07m]    2.07m   0.00ns    2.07m
  'objective_shaving_search_max_lp':       101 [216.77ms,    2.71m]   35.59s   36.20s   59.91m        94 [ 14.90ms,    5.64s]    1.32s    1.32s    2.07m
   'objective_shaving_search_no_lp':       103 [ 85.26ms,    2.71m]   34.90s   36.16s   59.91m        94 [ 14.86ms,    4.36s]    1.00s 980.87ms    1.57m
                          'probing':         1 [  59.92m,   59.92m]   59.92m   0.00ns   59.92m         1 [   3.63m,    3.63m]    3.63m   0.00ns    3.63m
                   'probing_max_lp':         1 [  59.92m,   59.92m]   59.92m   0.00ns   59.92m         1 [  20.13m,   20.13m]   20.13m   0.00ns   20.13m
                     'pseudo_costs':         1 [  59.91m,   59.91m]   59.91m   0.00ns   59.91m         1 [   4.99m,    4.99m]    4.99m   0.00ns    4.99m
                    'quick_restart':         1 [  59.91m,   59.91m]   59.91m   0.00ns   59.91m         1 [   6.60m,    6.60m]    6.60m   0.00ns    6.60m
              'quick_restart_no_lp':         1 [  59.92m,   59.92m]   59.92m   0.00ns   59.92m         1 [   2.79m,    2.79m]    2.79m   0.00ns    2.79m
                    'reduced_costs':         1 [  59.91m,   59.91m]   59.91m   0.00ns   59.91m         1 [   5.87m,    5.87m]    5.87m   0.00ns    5.87m
                        'rins/rens':      2392 [852.74us,    3.52s]    1.15s 831.57ms   46.00m      2087 [ 10.00ns, 200.31ms]  64.74ms  43.03ms    2.25m
                      'rnd_cst_lns':      2392 [ 73.84ms,    6.03s]    3.50s 856.94ms    2.32h      2383 [ 10.00ns, 139.34ms]  71.02ms  34.85ms    2.82m
                      'rnd_var_lns':      2392 [ 52.22ms,    6.42s]    3.53s 865.09ms    2.34h      2378 [ 10.00ns, 200.63ms]  69.43ms  36.17ms    2.75m
                     'violation_ls':      2392 [  2.55ms, 428.10ms] 206.46ms  62.37ms    8.23m      2392 [750.00ns, 291.57ms] 139.77ms  46.74ms    5.57m
                     'violation_ls':      2392 [  2.86ms, 498.07ms] 202.98ms  82.88ms    8.09m      2392 [  1.68us, 351.39ms] 142.98ms  64.08ms    5.70m
                     'violation_ls':      2392 [  3.35ms, 485.70ms] 215.68ms  40.87ms    8.60m      2392 [770.00ns, 263.01ms] 147.89ms  36.32ms    5.90m

Search stats                         Bools  Conflicts   Branches  Restarts   BoolPropag  IntegerPropag
                           'core':   7'860    201'045    449'582    28'583  414'024'830    927'385'487
                     'default_lp':   1'439     52'301    292'706    46'844   12'093'274    529'206'683
                      'fs_random':     288          0        576       576           36         83'457
                      'fs_random':     288          0        576       576           36         83'457
                'fs_random_no_lp':     288          0        759       576           69        143'469
                'fs_random_no_lp':     288         15        747       576           70        157'983
        'fs_random_quick_restart':     288          0        576       576           36         83'457
        'fs_random_quick_restart':     288          0        576       576           36         83'457
  'fs_random_quick_restart_no_lp':     336          1        908       577           43        158'845
                 'lb_tree_search':     288        615    968'060   190'972    2'001'612    647'676'346
                         'max_lp':     611     48'957    483'092   135'361    7'000'748    596'281'858
                          'no_lp':   3'138     86'331    389'507    52'177   45'895'967    729'354'340
            'objective_lb_search':     491     27'843    230'795    54'086    3'922'472    478'365'801
     'objective_lb_search_max_lp':     473     22'345    486'111   156'278    3'897'687    562'158'665
      'objective_lb_search_no_lp':     609     55'653    134'677    16'635    5'035'482    466'238'379
                        'probing':   1'650        892      2'408     2'408      202'924      3'585'183
                 'probing_max_lp':     730         34      1'426     1'426       32'381      1'020'191
                   'pseudo_costs':   3'886     91'604    813'948   152'020   71'342'566    691'303'811
                  'quick_restart':   3'564     18'677    685'127    97'950   33'397'675    451'803'759
            'quick_restart_no_lp':   5'960     73'253    732'873    28'972   83'170'735    677'475'321
                  'reduced_costs':  20'078     77'272  1'284'668    67'094  181'668'748    673'008'192

SAT stats                           ClassicMinim  LitRemoved  LitLearned  LitForgotten  Subsumed  MClauses  MDecisions  MLitTrue  MSubsumed  MLitRemoved  MReused
                           'core':       174'980     908'524   1'773'734       243'713     1'471    12'605      62'920         0        146          544      126
                     'default_lp':        33'870      72'106   1'226'248       911'265       779    16'955     151'895         0        972        6'023    3'028
                      'fs_random':             0           0           0             0         0         0           0         0          0            0        0
                      'fs_random':             0           0           0             0         0         0           0         0          0            0        0
                'fs_random_no_lp':             0           0           0             0         0         0           0         0          0            0        0
                'fs_random_no_lp':             0           0          63             0         0         0           0         0          0            0        0
        'fs_random_quick_restart':             0           0           0             0         0         0           0         0          0            0        0
        'fs_random_quick_restart':             0           0           0             0         0         0           0         0          0            0        0
  'fs_random_quick_restart_no_lp':             0           0           3             0         0         0           0         0          0            0        0
                 'lb_tree_search':             1           3       1'997             0         0    79'041     418'121         0         84          334    5'631
                         'max_lp':        26'481      56'765   1'205'134       723'242     1'159    56'006     352'972         0        458        2'108    7'236
                          'no_lp':        63'627     267'041   1'875'463     1'516'898       887    16'137     118'537         0        929        5'409    2'017
            'objective_lb_search':        19'544      47'617     234'233        25'847     1'132    14'320     142'891         0      2'957       20'042    3'365
     'objective_lb_search_max_lp':        12'635      24'654     207'708        11'064     1'054    48'128     332'972         0      1'486        9'469    6'476
      'objective_lb_search_no_lp':        41'377     115'233     459'451        74'466     1'452     4'861      46'066         0      2'793       19'675      881
                        'probing':             0           0         892             0         0         0           0         0          0            0        0
                 'probing_max_lp':             0           0          34             0         0         0           0         0          0            0        0
                   'pseudo_costs':        40'257      83'022   1'652'060     1'438'608       844    60'698     407'465         0        702        3'596    8'978
                  'quick_restart':        12'276      65'824     436'767       125'929       378    33'660     272'835        11      1'728       11'908    5'407
            'quick_restart_no_lp':        54'645     385'642   1'795'620     1'243'563       943     8'132      77'659         0      2'898       21'876    1'049
                  'reduced_costs':        53'645     311'695   1'607'533     1'260'067     1'508    24'280     227'785        25      2'543       14'479    6'863

Lp stats                         Component  Iterations  AddedCuts  OPTIMAL  DUAL_F.  DUAL_U.
                  'default_lp':          1     896'357     75'964   95'833        7        3
                   'fs_random':          1       1'201        276        5        0        0
                   'fs_random':          1       1'201        286        5        0        0
     'fs_random_quick_restart':          1       1'201        264        5        0        0
     'fs_random_quick_restart':          1       1'201        277        5        0        0
              'lb_tree_search':          1   4'893'258     35'944    3'708  370'528        0
                      'max_lp':          1   1'055'535     41'157   22'755   82'963        3
         'objective_lb_search':          1   2'369'293     57'048   74'681      227       39
  'objective_lb_search_max_lp':          1   1'736'921     27'441    3'576   33'875        2
                     'probing':          1     247'453     81'206   10'188       42        4
              'probing_max_lp':          1     600'527    136'602    6'500      308        0
                'pseudo_costs':          1   1'083'408    110'427   87'426   73'605       18
               'quick_restart':          1   2'508'696    141'011  123'822      122        5
               'reduced_costs':          1   1'466'589    126'405   77'918  105'403       38

Lp dimension                                                                        Final dimension of first component
                  'default_lp':   2082 rows, 2239 columns, 9773 entries with magnitude in [2.406724e-02, 1.000000e+00]
                   'fs_random':    867 rows, 2239 columns, 5109 entries with magnitude in [2.917300e-02, 1.000000e+00]
                   'fs_random':    867 rows, 2239 columns, 5109 entries with magnitude in [2.917300e-02, 1.000000e+00]
     'fs_random_quick_restart':    867 rows, 2239 columns, 5109 entries with magnitude in [2.917300e-02, 1.000000e+00]
     'fs_random_quick_restart':    867 rows, 2239 columns, 5109 entries with magnitude in [2.917300e-02, 1.000000e+00]
              'lb_tree_search':  5012 rows, 2258 columns, 22893 entries with magnitude in [1.947110e-03, 1.000000e+00]
                      'max_lp':   2127 rows, 2258 columns, 9900 entries with magnitude in [7.612471e-03, 1.000000e+00]
         'objective_lb_search':  3451 rows, 2239 columns, 16851 entries with magnitude in [1.037751e-03, 1.000000e+00]
  'objective_lb_search_max_lp':  5212 rows, 2258 columns, 22957 entries with magnitude in [2.087212e-03, 1.000000e+00]
                     'probing':  2030 rows, 2239 columns, 10023 entries with magnitude in [1.103157e-02, 1.000000e+00]
              'probing_max_lp':  6473 rows, 2258 columns, 88430 entries with magnitude in [8.433117e-04, 1.000000e+00]
                'pseudo_costs':  2173 rows, 2258 columns, 10635 entries with magnitude in [2.811550e-03, 1.000000e+00]
               'quick_restart':  3004 rows, 2239 columns, 14534 entries with magnitude in [2.083602e-03, 1.000000e+00]
               'reduced_costs':  2512 rows, 2258 columns, 11794 entries with magnitude in [8.176980e-04, 1.000000e+00]

Lp debug                         CutPropag  CutEqPropag   Adjust  Overflow         Bad  BadScaling
                  'default_lp':          4           39    9'942         0   3'822'397           0
                   'fs_random':          0            0        0         0       1'729           0
                   'fs_random':          0            0        0         0       1'740           0
     'fs_random_quick_restart':          0            0        0         0       1'476           0
     'fs_random_quick_restart':          0            0        0         0       1'591           0
              'lb_tree_search':         21           10  150'599         0   2'998'678           0
                      'max_lp':          6            5   22'906         0   1'661'852           0
         'objective_lb_search':          5           58   24'125         0   4'501'330           0
  'objective_lb_search_max_lp':         37            6   19'612         0   1'768'448           0
                     'probing':         74          844    9'628         0  92'826'584           0
              'probing_max_lp':        113          246    6'616         0  45'273'151           0
                'pseudo_costs':         23           28   42'755         0   4'488'340           0
               'quick_restart':         13           96   48'937         0  11'927'268           0
               'reduced_costs':         57           12   55'233         0   4'993'597           0

Lp pool                          Constraints  Updates  Simplif  Merged  Shortened    Split  Strenghtened        Cuts/Call
                  'default_lp':       12'262      922    2'812      17          0   23'047        12'952   75'964/186'926
                   'fs_random':        2'591        0        0       0          0        0            19          276/472
                   'fs_random':        2'601        0        0       0          0        0            19          286/473
     'fs_random_quick_restart':        2'579        0        0       0          0        0            20          264/431
     'fs_random_quick_restart':        2'592        0        0       0          0        0            21          277/450
              'lb_tree_search':       35'115      442   56'471      11          0    9'669        72'384    35'944/73'588
                      'max_lp':       34'317      313   44'387      22          0    7'045        57'891    41'157/81'572
         'objective_lb_search':       11'350    1'234    5'034      13          0   45'665        12'222   57'048/199'312
  'objective_lb_search_max_lp':       34'613      250   57'205      10          0    6'852        65'930    27'441/60'275
                     'probing':       11'499    9'363    1'324      22          0  482'649        18'170   81'206/161'962
              'probing_max_lp':       34'773    8'683   36'069      11          0   14'297        79'460  136'602/341'600
                'pseudo_costs':       34'587      685   59'915      22          0   21'890        88'112  110'427/229'569
               'quick_restart':       12'307    2'054    2'656      19          0  156'279        21'832  141'011/393'053
               'reduced_costs':       34'571      759   60'039      16          0   27'963        89'730  126'405/272'422

Lp Cut            fs_ran  fs_ran  fs_ran  fs_ran  defaul  max_lp  quick_  reduce  pseudo  lb_tre  probin  object  probin  object
          CG_FF:      16      16      16      16   4'722   1'553   3'569   7'461   6'231     759   2'756   1'404     787     678
           CG_K:      10      10      10      10   3'175   1'124   1'978   7'070   5'422     377   1'598     875     374     521
          CG_KL:       -       -       -       -       3       -       3      15       5       -       8       6       -       -
           CG_R:      13      13      13      13   2'893     715   2'599   3'905   3'262     342   3'653     780     363     261
          CG_RB:       3       3       3       3   8'790   4'882  10'038  14'189  11'578   2'079   9'635   3'999   2'414   2'676
         CG_RBP:       -       -       -       -   1'018     324   1'067   1'718   1'333     138   1'160     404     167     276
         Clique:       -       -       -       -       -     314       -   1'425   1'387     184       -       -     329     178
             IB:      77      77      77      77  23'585   5'836  64'942  24'650  20'323   3'119   8'198  25'195   3'129   3'281
       MIR_1_FF:      64      56      64      57   3'295   1'807   4'527   5'828   5'439   1'399   3'715   1'866   3'573   1'049
        MIR_1_K:      16      17      19      17     563     212     529     885     774      99     337     260     190     119
       MIR_1_KL:       -       -       -       -      58      14      67      18      59       1      10       2       2       1
        MIR_1_R:      14      15      16      15     906     245   1'266   1'080   1'077     149   1'480     482     498     133
       MIR_1_RB:      16      13      18      14   6'155   5'569  10'553  13'628  12'501   4'950   7'375   4'476  11'608   3'861
      MIR_1_RBP:       3       3       3       2     560   1'818     910   3'857   3'383   1'186     440     404   1'541     838
      MIR_1_RLT:       -       -       -       -       -      17       -     102      88      14       -       -      48       5
       MIR_2_FF:       9       9       8       9   1'793   1'009   2'317   3'213   3'019     779   1'734     934   1'785     722
        MIR_2_K:       6       5       5       4     330     170     387     686     609      60     256     152     151     119
       MIR_2_KL:       -       -       -       -      33      11      75      22      41       5      26      17       4       3
        MIR_2_R:       4       4       4       4     516     461     778   1'069   1'039     945   1'319     324   3'144     591
       MIR_2_RB:      12      10      11      12   3'624   2'667   6'663   6'677   6'402   2'696   4'711   2'674   5'977   2'159
      MIR_2_RBP:       -       -       -       1     464     874     777   1'875   1'784     666     447     336   1'033     507
       MIR_3_FF:       1       1       1       2     866     588   1'344   1'847   1'688     482     882     506     998     447
        MIR_3_K:       -       1       1       1     195     108     280     498     369      71     157     102     134      91
       MIR_3_KL:       -       -       -       -      55      19     203      76      76      10     116      77       9       7
        MIR_3_R:       -       -       1       1     410     346     660     699     676     824     835     310   2'348     429
       MIR_3_RB:       2       -       3       1   1'833   1'367   3'899   3'268   3'050   1'505   2'854   1'553   3'304   1'134
      MIR_3_RBP:       -       -       -       -     314     444     510     941     935     386     254     274     549     270
       MIR_4_FF:       -       -       -       -     464     263     772     929     893     244     495     343     498     184
        MIR_4_K:       -       -       -       -     157      89     281     373     334      39     199     123      78      51
       MIR_4_KL:       -       -       -       -      85      33     429     153     109      14     324     207      21      17
        MIR_4_R:       -       -       -       -     270     179     495     351     421     371     520     273   1'168     188
       MIR_4_RB:       -       1       -       -   1'039     630   2'252   1'651   1'504     678   1'752   1'015   1'462     501
      MIR_4_RBP:       -       -       -       -     154     205     367     439     431     180     196     183     290     116
       MIR_5_FF:       -       -       -       2     318     176     474     534     482     137     287     227     273      85
        MIR_5_K:       -       -       -       -     184      76     245     314     256      42     207     146      72      36
       MIR_5_KL:       -       -       -       -      79      48     311     160     134      32     318     148      22      17
        MIR_5_R:       -       -       -       2     183     100     278     258     211     145     240     155     587      78
       MIR_5_RB:       -       -       -       2     726     389   1'369   1'016     936     298   1'086     672     738     243
      MIR_5_RBP:       -       -       -       1     109     106     197     242     229      71     152     128     172      64
       MIR_6_FF:       -       1       1       -     157      95     251     310     255      82     162     141     146      80
        MIR_6_K:       -       1       -       -     118      56     188     216     181      35     218     109      51      39
       MIR_6_KL:       -       -       -       -      67      46     235     136     132      26     341     126      34      18
        MIR_6_R:       -       -       -       -      85      88     143     200     158      99     132      95     371      68
       MIR_6_RB:       -       -       -       -     380     242     887     655     592     183     799     424     395     162
      MIR_6_RBP:       -       -       -       -      70      82     153     177     161      54     165      75     146      48
   ZERO_HALF_FF:       3       3       4       4     783     570     750   1'488   1'394     310     532     367     416     277
    ZERO_HALF_K:       -       -       1       1     247     157     157   1'090     656      58     154      90      97      99
   ZERO_HALF_KL:       -       -       -       -       -       -       -       -       2       -       -       -       -       1
    ZERO_HALF_R:       3       2       3       3   2'304   2'916   7'731   4'061   4'025   7'914  15'663   3'212  76'144   3'566
   ZERO_HALF_RB:       1       -       1       1   1'490   1'626   2'583   3'768   3'358   1'197   2'397   1'110   3'336     861
  ZERO_HALF_RBP:       3       3       3       2     339     491     522   1'182   1'023     510     911     267   5'626     286

LNS stats           Improv/Calls  Closed  Difficulty  TimeLimit
  'graph_arc_lns':      771/2390     50%        0.99       0.10
  'graph_cst_lns':      712/2365     50%        0.99       0.10
  'graph_dec_lns':      752/2390     50%        1.00       0.10
  'graph_var_lns':      586/2389     50%        0.99       0.10
      'rins/rens':      294/2199     50%        0.89       0.10
    'rnd_cst_lns':      647/2390     50%        0.99       0.10
    'rnd_var_lns':      738/2390     50%        0.99       0.10

LS stats                   Batches  Restarts    LinMoves   GenMoves  CompoundMoves  WeightUpdates
       'fj_long_default':        2         1      19'905          0              0             95
   'fj_long_lin_default':        2         1           0      4'901            916              0
        'fj_long_random':        2         1      19'910          0              0             90
      'fj_short_default':        3         1           0      8'910          1'812              2
  'fj_short_lin_default':        2         1           0      4'943            929              0
   'fj_short_lin_random':        2         1           0      5'312          1'300              1
       'fj_short_random':        2         1           0      4'797            819              0
          'violation_ls':    2'392         0  10'036'778  3'334'191        147'554      1'470'338
          'violation_ls':    2'392         0  14'256'279  2'254'450        110'502      1'103'922
          'violation_ls':    2'392         0  16'176'094  1'742'407        108'347        148'378

Solutions (122)                     Num       Rank
  'fs_random_quick_restart_no_lp':    1      [1,1]
                  'graph_arc_lns':    3    [30,59]
                  'graph_var_lns':    9   [13,118]
                          'no_lp':    4    [21,38]
            'quick_restart_no_lp':    6    [39,96]
                    'rins_lp_lns':   17   [24,120]
                  'rins_pump_lns':    1  [101,101]
                    'rnd_cst_lns':    6   [48,122]
                    'rnd_var_lns':    6   [35,102]
                   'violation_ls':   69    [2,121]

Objective bounds                 Num
              'initial_domain':    1
         'objective_lb_search':   22
  'objective_lb_search_max_lp':    9
   'objective_lb_search_no_lp':   69

Solution repositories     Added  Queried  Ignored  Synchro
  'feasible solutions':  12'257   42'471        0   11'959
        'lp solutions':   4'233    1'256        0    4'070
                'pump':  14'326    1'136

Improving bounds shared            Num
                        'core':     41
                  'default_lp':     16
             'fs_random_no_lp':    226
              'lb_tree_search':    394
                      'max_lp':      8
                       'no_lp':    194
         'objective_lb_search':      8
  'objective_lb_search_max_lp':     76
                     'probing':  6'559
              'probing_max_lp':    213
                'pseudo_costs':    240
               'quick_restart':    661
         'quick_restart_no_lp':    648
               'reduced_costs':    188

Clauses shared                   Num
                        'core':    7
                  'default_lp':   20
              'lb_tree_search':   12
                      'max_lp':    9
                       'no_lp':    7
         'objective_lb_search':    4
  'objective_lb_search_max_lp':    2
   'objective_lb_search_no_lp':    1
                'pseudo_costs':   30
               'quick_restart':   32
         'quick_restart_no_lp':   53
               'reduced_costs':    1

CpSolverResponse summary:
status: FEASIBLE
objective: 2978
best_bound: 1146
integers: 2240
booleans: 288
conflicts: 0
branches: 576
propagations: 36
integer_propagations: 83457
restarts: 576
lp_iterations: 1201
walltime: 3600.74
usertime: 3600.74
deterministic_time: 8829.14
gap_integral: 66505.4
solution_fingerprint: 0xc1595bad5619a4c1


--- Simulation Gantt  partir du modle mathmatique ---
{'big':1, 'due_date':207, 'pos_time':5, 'status':0, 'blocked':0, 'operations':["{'type':0, 'processing_time':37}", "{'type':1, 'processing_time':20}"]}
{'big':1, 'due_date':77, 'pos_time':5, 'status':0, 'blocked':0, 'operations':["{'type':1, 'processing_time':46}"]}
{'big':1, 'due_date':99, 'pos_time':5, 'status':0, 'blocked':0, 'operations':["{'type':1, 'processing_time':40}"]}
{'big':0, 'due_date':178, 'pos_time':5, 'status':0, 'blocked':0, 'operations':["{'type':1, 'processing_time':37}", "{'type':0, 'processing_time':42}"]}
{'big':1, 'due_date':269, 'pos_time':5, 'status':0, 'blocked':0, 'operations':["{'type':1, 'processing_time':12}", "{'type':0, 'processing_time':25}"]}
{'big':0, 'due_date':112, 'pos_time':5, 'status':0, 'blocked':0, 'operations':["{'type':0, 'processing_time':20}", "{'type':1, 'processing_time':29}"]}
{'big':0, 'due_date':107, 'pos_time':5, 'status':0, 'blocked':0, 'operations':["{'type':1, 'processing_time':15}"]}
{'big':1, 'due_date':105, 'pos_time':5, 'status':0, 'blocked':0, 'operations':["{'type':1, 'processing_time':40}"]}
{'big':0, 'due_date':169, 'pos_time':5, 'status':0, 'blocked':0, 'operations':["{'type':0, 'processing_time':30}"]}
{'big':0, 'due_date':139, 'pos_time':5, 'status':0, 'blocked':0, 'operations':["{'type':1, 'processing_time':18}", "{'type':0, 'processing_time':25}"]}
{'big':1, 'due_date':99, 'pos_time':5, 'status':0, 'blocked':0, 'operations':["{'type':1, 'processing_time':60}", "{'type':0, 'processing_time':50}"]}
{'big':1, 'due_date':147, 'pos_time':5, 'status':0, 'blocked':0, 'operations':["{'type':1, 'processing_time':15}", "{'type':0, 'processing_time':52}"]}
{'big':1, 'due_date':98, 'pos_time':5, 'status':0, 'blocked':0, 'operations':["{'type':0, 'processing_time':17}"]}
{'big':1, 'due_date':172, 'pos_time':5, 'status':0, 'blocked':0, 'operations':["{'type':0, 'processing_time':24}"]}
{'big':0, 'due_date':177, 'pos_time':5, 'status':0, 'blocked':0, 'operations':["{'type':0, 'processing_time':53}"]}
{'big':0, 'due_date':203, 'pos_time':5, 'status':0, 'blocked':0, 'operations':["{'type':0, 'processing_time':54}"]}
