created virtual environment CPython3.12.4.final.0-64 in 9022ms
  creator CPython3Posix(dest=/localscratch/aneumann.63390797.0/env, clear=False, no_vcs_ignore=False, global=False)
  seeder FromAppData(download=False, pip=bundle, via=copy, app_data_dir=/home/aneumann/.local/share/virtualenv)
    added seed packages: pip==25.1.1
  activators BashActivator,CShellActivator,FishActivator,NushellActivator,PowerShellActivator,PythonActivator
Looking in links: /cvmfs/soft.computecanada.ca/custom/python/wheelhouse/gentoo2023/x86-64-v3, /cvmfs/soft.computecanada.ca/custom/python/wheelhouse/gentoo2023/generic, /cvmfs/soft.computecanada.ca/custom/python/wheelhouse/generic
Requirement already satisfied: pip in /localscratch/aneumann.63390797.0/env/lib/python3.12/site-packages (25.1.1)
Looking in links: /cvmfs/soft.computecanada.ca/custom/python/wheelhouse/gentoo2023/x86-64-v3, /cvmfs/soft.computecanada.ca/custom/python/wheelhouse/gentoo2023/generic, /cvmfs/soft.computecanada.ca/custom/python/wheelhouse/generic
ERROR: protobuf-5.28.3-cp38-abi3-manylinux2014_x86_64.whl is not a supported wheel on this platform.
Looking in links: /cvmfs/soft.computecanada.ca/custom/python/wheelhouse/gentoo2023/x86-64-v3, /cvmfs/soft.computecanada.ca/custom/python/wheelhouse/gentoo2023/generic, /cvmfs/soft.computecanada.ca/custom/python/wheelhouse/generic
Processing /home/aneumann/projects/def-adhaj/aneumann/GNRS/wheels/immutabledict-4.2.0-py3-none-any.whl
Installing collected packages: immutabledict
Successfully installed immutabledict-4.2.0
Looking in links: /cvmfs/soft.computecanada.ca/custom/python/wheelhouse/gentoo2023/x86-64-v3, /cvmfs/soft.computecanada.ca/custom/python/wheelhouse/gentoo2023/generic, /cvmfs/soft.computecanada.ca/custom/python/wheelhouse/generic
Processing /cvmfs/soft.computecanada.ca/custom/python/wheelhouse/generic/ortools-9.10.4067+computecanada-cp312-cp312-linux_x86_64.whl (from -r /home/aneumann/projects/def-adhaj/aneumann/GNRS/requirements/or.txt (line 1))
Processing /cvmfs/soft.computecanada.ca/custom/python/wheelhouse/gentoo2023/x86-64-v3/matplotlib-3.10.0+computecanada-cp312-cp312-linux_x86_64.whl (from -r /home/aneumann/projects/def-adhaj/aneumann/GNRS/requirements/or.txt (line 2))
Processing /cvmfs/soft.computecanada.ca/custom/python/wheelhouse/gentoo2023/x86-64-v3/pandas-2.2.3+computecanada-cp312-cp312-linux_x86_64.whl (from -r /home/aneumann/projects/def-adhaj/aneumann/GNRS/requirements/or.txt (line 3))
Processing /cvmfs/soft.computecanada.ca/custom/python/wheelhouse/generic/absl_py-2.2.2+computecanada-py3-none-any.whl (from ortools<9.11,>=9.10->-r /home/aneumann/projects/def-adhaj/aneumann/GNRS/requirements/or.txt (line 1))
Processing /cvmfs/soft.computecanada.ca/custom/python/wheelhouse/gentoo2023/generic/numpy-2.2.2+computecanada-cp312-cp312-linux_x86_64.whl (from ortools<9.11,>=9.10->-r /home/aneumann/projects/def-adhaj/aneumann/GNRS/requirements/or.txt (line 1))
Processing /cvmfs/soft.computecanada.ca/custom/python/wheelhouse/gentoo2023/x86-64-v3/protobuf-6.30.2+computecanada-cp312-cp312-linux_x86_64.whl (from ortools<9.11,>=9.10->-r /home/aneumann/projects/def-adhaj/aneumann/GNRS/requirements/or.txt (line 1))
Requirement already satisfied: immutabledict>=3.0.0 in /localscratch/aneumann.63390797.0/env/lib/python3.12/site-packages (from ortools<9.11,>=9.10->-r /home/aneumann/projects/def-adhaj/aneumann/GNRS/requirements/or.txt (line 1)) (4.2.0)
Processing /cvmfs/soft.computecanada.ca/custom/python/wheelhouse/gentoo2023/generic/contourpy-1.3.1+computecanada-cp312-cp312-linux_x86_64.whl (from matplotlib->-r /home/aneumann/projects/def-adhaj/aneumann/GNRS/requirements/or.txt (line 2))
Processing /cvmfs/soft.computecanada.ca/custom/python/wheelhouse/generic/cycler-0.12.1+computecanada-py3-none-any.whl (from matplotlib->-r /home/aneumann/projects/def-adhaj/aneumann/GNRS/requirements/or.txt (line 2))
Processing /cvmfs/soft.computecanada.ca/custom/python/wheelhouse/generic/fonttools-4.58.2+computecanada-cp312-cp312-linux_x86_64.whl (from matplotlib->-r /home/aneumann/projects/def-adhaj/aneumann/GNRS/requirements/or.txt (line 2))
Processing /cvmfs/soft.computecanada.ca/custom/python/wheelhouse/gentoo2023/x86-64-v3/kiwisolver-1.4.8+computecanada-cp312-cp312-linux_x86_64.whl (from matplotlib->-r /home/aneumann/projects/def-adhaj/aneumann/GNRS/requirements/or.txt (line 2))
Processing /cvmfs/soft.computecanada.ca/custom/python/wheelhouse/generic/packaging-25.0+computecanada-py3-none-any.whl (from matplotlib->-r /home/aneumann/projects/def-adhaj/aneumann/GNRS/requirements/or.txt (line 2))
Processing /cvmfs/soft.computecanada.ca/custom/python/wheelhouse/gentoo2023/x86-64-v3/pillow-11.1.0+computecanada-cp312-cp312-linux_x86_64.whl (from matplotlib->-r /home/aneumann/projects/def-adhaj/aneumann/GNRS/requirements/or.txt (line 2))
Processing /cvmfs/soft.computecanada.ca/custom/python/wheelhouse/generic/pyparsing-3.2.1+computecanada-py3-none-any.whl (from matplotlib->-r /home/aneumann/projects/def-adhaj/aneumann/GNRS/requirements/or.txt (line 2))
Processing /cvmfs/soft.computecanada.ca/custom/python/wheelhouse/generic/python_dateutil-2.9.0.post0+computecanada-py2.py3-none-any.whl (from matplotlib->-r /home/aneumann/projects/def-adhaj/aneumann/GNRS/requirements/or.txt (line 2))
Processing /cvmfs/soft.computecanada.ca/custom/python/wheelhouse/generic/pytz-2025.2+computecanada-py2.py3-none-any.whl (from pandas->-r /home/aneumann/projects/def-adhaj/aneumann/GNRS/requirements/or.txt (line 3))
Processing /cvmfs/soft.computecanada.ca/custom/python/wheelhouse/generic/tzdata-2025.2+computecanada-py2.py3-none-any.whl (from pandas->-r /home/aneumann/projects/def-adhaj/aneumann/GNRS/requirements/or.txt (line 3))
Processing /cvmfs/soft.computecanada.ca/custom/python/wheelhouse/generic/six-1.17.0+computecanada-py2.py3-none-any.whl (from python-dateutil>=2.7->matplotlib->-r /home/aneumann/projects/def-adhaj/aneumann/GNRS/requirements/or.txt (line 2))
Installing collected packages: pytz, tzdata, six, pyparsing, protobuf, pillow, packaging, numpy, kiwisolver, fonttools, cycler, absl-py, python-dateutil, contourpy, pandas, matplotlib, ortools

Successfully installed absl-py-2.2.2+computecanada contourpy-1.3.1+computecanada cycler-0.12.1+computecanada fonttools-4.58.2+computecanada kiwisolver-1.4.8+computecanada matplotlib-3.10.0+computecanada numpy-2.2.2+computecanada ortools-9.10.4067+computecanada packaging-25.0+computecanada pandas-2.2.3+computecanada pillow-11.1.0+computecanada protobuf-6.30.2+computecanada pyparsing-3.2.1+computecanada python-dateutil-2.9.0.post0+computecanada pytz-2025.2+computecanada six-1.17.0+computecanada tzdata-2025.2+computecanada

Starting CP-SAT solver v9.10.4067
Parameters: max_time_in_seconds: 3600 max_memory_in_mb: 12000 log_search_progress: true enumerate_all_solutions: false absolute_gap_limit: 0 relative_gap_limit: 0
Setting number of workers to 48

Initial optimization model '': (model_fingerprint: 0x8896cc85209383f7)
#Variables: 189 (#ints: 6 in objective)
  - 126 Booleans in [0,1]
  - 63 in [0,415]
#kLinear1: 29
#kLinear2: 253
#kLinear3: 81
#kLinearN: 875 (#terms: 9'743)

Starting presolve at 0.00s
  6.00e-04s  0.00e+00d  [DetectDominanceRelations] 
  1.34e-02s  0.00e+00d  [PresolveToFixPoint] #num_loops=6 #num_dual_strengthening=3 
  1.75e-05s  0.00e+00d  [ExtractEncodingFromLinear] #potential_supersets=4 
[Symmetry] Graph for symmetry has 1'306 nodes and 7'648 arcs.
[Symmetry] Symmetry computation done. time: 0.0006879 dtime: 0.00068054
[SAT presolve] num removable Booleans: 0 / 50
[SAT presolve] num trivial clauses: 0
[SAT presolve] [0s] clauses:7 literals:20 vars:14 one_side_vars:13 simple_definition:1 singleton_clauses:0
[SAT presolve] [4.1888e-05s] clauses:7 literals:20 vars:14 one_side_vars:13 simple_definition:1 singleton_clauses:0
[SAT presolve] [5.4813e-05s] clauses:7 literals:20 vars:14 one_side_vars:13 simple_definition:1 singleton_clauses:0
  3.50e-03s  4.43e-04d  [Probe] #probed=202 #fixed_bools=3 #new_bounds=6 
  2.01e-05s  0.00e+00d  [MaxClique] 
  5.84e-04s  0.00e+00d  [DetectDominanceRelations] 
  5.66e-03s  0.00e+00d  [PresolveToFixPoint] #num_loops=4 #num_dual_strengthening=3 
  1.84e-03s  0.00e+00d  [ProcessAtMostOneAndLinear] 
  9.79e-04s  0.00e+00d  [DetectDuplicateConstraints] #duplicates=166 #without_enforcements=44 
  5.91e-04s  2.50e-05d  [DetectDominatedLinearConstraints] #relevant_constraints=678 #num_inclusions=454 #num_redundant=2 
  1.60e-04s  0.00e+00d  [DetectDifferentVariables] #different=17 
  1.70e-04s  7.49e-06d  [ProcessSetPPC] #relevant_constraints=434 
  1.09e-05s  0.00e+00d  [FindAlmostIdenticalLinearConstraints] 
  1.27e-04s  9.85e-05d  [FindBigAtMostOneAndLinearOverlap] 
  1.11e-03s  4.64e-04d  [FindBigVerticalLinearOverlap] #blocks=4 #saved_nz=316 
  8.13e-05s  2.16e-05d  [FindBigHorizontalLinearOverlap] #linears=415 
  2.04e-05s  9.00e-08d  [MergeClauses] 
  4.17e-04s  0.00e+00d  [DetectDominanceRelations] 
  4.41e-03s  0.00e+00d  [PresolveToFixPoint] #num_loops=2 #num_dual_strengthening=1 
  4.14e-04s  0.00e+00d  [DetectDominanceRelations] 
  3.18e-03s  0.00e+00d  [PresolveToFixPoint] #num_loops=1 #num_dual_strengthening=1 
[Symmetry] Graph for symmetry has 1'127 nodes and 6'820 arcs.
[Symmetry] Symmetry computation done. time: 0.000370391 dtime: 0.00056388
[SAT presolve] num removable Booleans: 0 / 47
[SAT presolve] num trivial clauses: 0
[SAT presolve] [0s] clauses:7 literals:20 vars:14 one_side_vars:13 simple_definition:1 singleton_clauses:0
[SAT presolve] [3.0236e-05s] clauses:7 literals:20 vars:14 one_side_vars:13 simple_definition:1 singleton_clauses:0
[SAT presolve] [4.2408e-05s] clauses:7 literals:20 vars:14 one_side_vars:13 simple_definition:1 singleton_clauses:0
  3.23e-03s  4.33e-04d  [Probe] #probed=196 #new_bounds=12 
  1.82e-05s  0.00e+00d  [MaxClique] 
  4.18e-04s  0.00e+00d  [DetectDominanceRelations] 
  5.48e-03s  0.00e+00d  [PresolveToFixPoint] #num_loops=4 #num_dual_strengthening=3 
  1.56e-03s  0.00e+00d  [ProcessAtMostOneAndLinear] 
  8.07e-04s  0.00e+00d  [DetectDuplicateConstraints] #without_enforcements=44 
  3.69e-04s  1.66e-05d  [DetectDominatedLinearConstraints] #relevant_constraints=551 #num_inclusions=104 
  1.57e-04s  0.00e+00d  [DetectDifferentVariables] #different=22 #cliques=1 #size=3 
  1.66e-04s  7.07e-06d  [ProcessSetPPC] #relevant_constraints=426 
  1.18e-05s  0.00e+00d  [FindAlmostIdenticalLinearConstraints] 
  1.27e-04s  9.36e-05d  [FindBigAtMostOneAndLinearOverlap] 
  1.14e-03s  4.47e-04d  [FindBigVerticalLinearOverlap] #blocks=7 #saved_nz=350 
  8.68e-05s  1.99e-05d  [FindBigHorizontalLinearOverlap] #linears=415 
  2.17e-05s  9.00e-08d  [MergeClauses] 
  4.27e-04s  0.00e+00d  [DetectDominanceRelations] 
  5.66e-03s  0.00e+00d  [PresolveToFixPoint] #num_loops=2 #num_dual_strengthening=1 
  4.25e-04s  0.00e+00d  [DetectDominanceRelations] 
  3.95e-03s  0.00e+00d  [PresolveToFixPoint] #num_loops=1 #num_dual_strengthening=1 
[SAT presolve] num removable Booleans: 0 / 47
[SAT presolve] num trivial clauses: 0
[SAT presolve] [0s] clauses:7 literals:20 vars:14 one_side_vars:13 simple_definition:1 singleton_clauses:0
[SAT presolve] [3.5153e-05s] clauses:7 literals:20 vars:14 one_side_vars:13 simple_definition:1 singleton_clauses:0
[SAT presolve] [4.7659e-05s] clauses:7 literals:20 vars:14 one_side_vars:13 simple_definition:1 singleton_clauses:0
  3.25e-03s  4.22e-04d  [Probe] #probed=196 #new_bounds=5 
  1.88e-05s  0.00e+00d  [MaxClique] 
  4.27e-04s  0.00e+00d  [DetectDominanceRelations] 
  5.06e-03s  0.00e+00d  [PresolveToFixPoint] #num_loops=2 #num_dual_strengthening=1 
  1.40e-03s  0.00e+00d  [ProcessAtMostOneAndLinear] 
  8.13e-04s  0.00e+00d  [DetectDuplicateConstraints] #without_enforcements=62 
  2.83e-04s  1.26e-05d  [DetectDominatedLinearConstraints] #relevant_constraints=481 #num_inclusions=14 
  8.62e-05s  0.00e+00d  [DetectDifferentVariables] 
  1.50e-04s  5.92e-06d  [ProcessSetPPC] #relevant_constraints=390 
  1.45e-05s  1.50e-08d  [FindAlmostIdenticalLinearConstraints] #num_tested_pairs=1 
  1.12e-04s  8.20e-05d  [FindBigAtMostOneAndLinearOverlap] 
  9.72e-04s  3.95e-04d  [FindBigVerticalLinearOverlap] #blocks=6 #saved_nz=276 
  7.51e-05s  1.69e-05d  [FindBigHorizontalLinearOverlap] #linears=379 
  1.93e-05s  9.00e-08d  [MergeClauses] 
  4.39e-04s  0.00e+00d  [DetectDominanceRelations] 
  4.75e-03s  0.00e+00d  [PresolveToFixPoint] #num_loops=2 #num_dual_strengthening=1 
  3.52e-05s  0.00e+00d  [ExpandObjective] #entries=86 #tight_variables=34 #tight_constraints=17 

Presolve summary:
  - 33 affine relations were detected.
  - rule 'TODO dual: only one blocking constraint?' was applied 576 times.
  - rule 'TODO dual: only one unspecified blocking constraint?' was applied 90 times.
  - rule 'TODO duplicate: identical constraint with different enforcements' was applied 150 times.
  - rule 'TODO linear2: contains a Boolean.' was applied 14 times.
  - rule 'TODO no_overlap: with task always last' was applied 1 time.
  - rule 'affine: new relation' was applied 33 times.
  - rule 'all_diff: inferred from x != y constraints' was applied 1 time.
  - rule 'bool_or: implications' was applied 1 time.
  - rule 'deductions: 122 stored' was applied 1 time.
  - rule 'dual: fix variable' was applied 13 times.
  - rule 'dual: reduced domain' was applied 33 times.
  - rule 'duplicate: merged rhs of linear constraint' was applied 19 times.
  - rule 'duplicate: removed constraint' was applied 166 times.
  - rule 'enforcement: false literal' was applied 15 times.
  - rule 'enforcement: true literal' was applied 13 times.
  - rule 'incompatible linear: add implication' was applied 9 times.
  - rule 'linear inclusion: redundant containing constraint' was applied 2 times.
  - rule 'linear matrix: common vertical rectangle' was applied 17 times.
  - rule 'linear1: always true' was applied 1 time.
  - rule 'linear2: contains a Boolean.' was applied 7 times.
  - rule 'linear: always true' was applied 229 times.
  - rule 'linear: doubleton free' was applied 8 times.
  - rule 'linear: empty' was applied 18 times.
  - rule 'linear: extracted enforcement literal' was applied 1'855 times.
  - rule 'linear: fixed or dup variables' was applied 812 times.
  - rule 'linear: negative clause' was applied 6 times.
  - rule 'linear: positive clause' was applied 1 time.
  - rule 'linear: positive equal one' was applied 4 times.
  - rule 'linear: reduced variable domains' was applied 85 times.
  - rule 'linear: remapped using affine relations' was applied 832 times.
  - rule 'linear: simplified rhs' was applied 2'917 times.
  - rule 'linear: variable substitution 1' was applied 8 times.
  - rule 'linear: variable substitution 2' was applied 1 time.
  - rule 'presolve: 54 unused variables removed.' was applied 1 time.
  - rule 'presolve: iteration' was applied 3 times.

Presolved optimization model '': (model_fingerprint: 0xce6dd3d17051b69e)
#Variables: 110 (#ints: 6 in objective)
  - 47 Booleans in [0,1]
  - 1 in [-1242,-887][-827,-472][-412,-57][3,358][418,773][833,1182]
  - 1 in [-1220,-871][-805,-456][-390,-41][25,374][440,789][855,1204][1270,1619][1685,2034][2100,2449]
  - 1 in [-774,-468][-413,-53][2,324]
  - 1 in [-409,-57][3,358][418,764]
  - 1 in [-390,-41][25,374][440,789][855,1204][1270,1619]
  - 1 in [-359,-53][2,333]
  - 1 in [-351,-48][64,367][479,782]
  - 1 in [-351,-48][64,367][479,782][894,1197]
  - 1 in [-2,304]
  - 1 in [-2,350]
  - 1 in [-2,373]
  - 1 in [0,259]
  - 1 in [0,287]
  - 3 in [0,303]
  - 1 in [0,330]
  - 3 in [0,349]
  - 3 in [0,355]
  - 1 in [0,357]
  - 2 in [0,360]
  - 3 in [0,375]
  - 1 in [2,362]
  - 2 in [3,306]
  - 1 in [3,352]
  - 1 in [3,358]
  - 1 in [3,358][418,767]
  - 1 in [3,378]
  - 1 in [4,364]
  - 1 in [7,367]
  - 1 in [25,374]
  - 1 in [27,382]
  - 1 in [32,387]
  - 1 in [35,374][440,789][855,1175]
  - 2 in [47,404]
  - 1 in [53,410]
  - 1 in [64,367]
  - 1 in [64,367][479,782]
  - 2 in [74,404]
  - 1 in [80,410]
  - 3 in [101,404]
  - 1 in [107,410]
  - 6 in [113,404]
  - 2 in [119,410]
  - 1 in [124,415]
#kAllDiff: 1
#kBoolAnd: 1 (#enforced: 1) (#literals: 2)
#kBoolOr: 6 (#literals: 18)
#kExactlyOne: 4 (#literals: 12)
#kLinear1: 12 (#enforced: 12 #multi: 6)
#kLinear2: 313 (#enforced: 274 #multi: 231)
#kLinear3: 55 (#enforced: 42)
#kLinearN: 391 (#enforced: 318) (#terms: 3'422)

Preloading model.
#Bound   0.08s best:inf   next:[127,1954] initial_domain
#Model   0.08s var:110/110 constraints:783/783

Starting search at 0.08s with 48 workers.
16 full problem subsolvers: [core, default_lp, lb_tree_search, max_lp, no_lp, objective_lb_search, objective_lb_search_max_lp, objective_lb_search_no_lp, objective_shaving_search_max_lp, objective_shaving_search_no_lp, probing, probing_max_lp, pseudo_costs, quick_restart, quick_restart_no_lp, reduced_costs]
30 first solution subsolvers: [fj_long_default(2), fj_long_lin_default, fj_long_lin_perturb, fj_long_lin_random, fj_long_perturb, fj_long_random, fj_short_default(2), fj_short_lin_default(2), fj_short_lin_perturb, fj_short_lin_random, fj_short_perturb, fj_short_random, fs_random(4), fs_random_no_lp(4), fs_random_quick_restart(4), fs_random_quick_restart_no_lp(3)]
13 incomplete subsolvers: [feasibility_pump, graph_arc_lns, graph_cst_lns, graph_dec_lns, graph_var_lns, rins/rens, rnd_cst_lns, rnd_var_lns, violation_ls(5)]
3 helper subsolvers: [neighborhood_helper, synchronization_agent, update_gap_integral]
#Bound   0.09s best:inf   next:[128,1954] bool_core (num_cores=1 [size:1 mw:1] a=6 d=0 fixed=0/63 clauses=19)
#1       0.09s best:934   next:[128,933]  no_lp (fixed_bools=0/80)
#Bound   0.10s best:934   next:[129,933]  objective_lb_search_no_lp
#Bound   0.10s best:934   next:[138,933]  objective_lb_search_no_lp
#Bound   0.10s best:934   next:[189,933]  default_lp
#Bound   0.10s best:934   next:[196,933]  default_lp
#2       0.10s best:919   next:[196,918]  no_lp (fixed_bools=0/89)
#Bound   0.10s best:919   next:[198,918]  objective_lb_search_no_lp
#Bound   0.10s best:919   next:[222,918]  objective_lb_search_no_lp
#3       0.10s best:908   next:[222,907]  no_lp (fixed_bools=0/101)
#Bound   0.10s best:908   next:[269,907]  objective_lb_search_no_lp
#Bound   0.11s best:908   next:[270,907]  objective_lb_search_no_lp
#4       0.11s best:907   next:[270,906]  quick_restart_no_lp (fixed_bools=0/123)
#Bound   0.11s best:907   next:[271,906]  objective_lb_search_no_lp
#5       0.11s best:903   next:[271,902]  quick_restart_no_lp (fixed_bools=0/135)
#Bound   0.11s best:903   next:[272,902]  objective_lb_search_no_lp
#6       0.11s best:896   next:[272,895]  quick_restart_no_lp (fixed_bools=0/166)
#7       0.11s best:891   next:[272,890]  quick_restart_no_lp (fixed_bools=0/177)
#8       0.11s best:845   next:[272,844]  no_lp (fixed_bools=0/113)
#9       0.11s best:701   next:[272,700]  rins_pump_lns (d=0.50 s=49 t=0.10 p=0.00 stall=0 h=auto_l0)
#10      0.11s best:696   next:[272,695]  quick_restart_no_lp (fixed_bools=0/202)
#11      0.12s best:628   next:[272,627]  no_lp (fixed_bools=0/129)
#12      0.12s best:621   next:[272,620]  no_lp (fixed_bools=0/136)
#13      0.12s best:608   next:[272,607]  no_lp (fixed_bools=0/146)
#Bound   0.14s best:608   next:[354,607]  objective_lb_search_no_lp
#14      0.14s best:598   next:[354,597]  no_lp (fixed_bools=0/157)
#15      0.14s best:593   next:[354,592]  no_lp (fixed_bools=0/164)
#16      0.15s best:588   next:[354,587]  quick_restart_no_lp (fixed_bools=9/244)
#17      0.15s best:540   next:[354,539]  no_lp (fixed_bools=0/174)
#18      0.15s best:535   next:[354,534]  quick_restart_no_lp (fixed_bools=9/260)
#19      0.15s best:530   next:[354,529]  quick_restart_no_lp (fixed_bools=9/265)
#20      0.16s best:525   next:[354,524]  quick_restart_no_lp (fixed_bools=9/266)
#21      0.16s best:515   next:[354,514]  quick_restart_no_lp (fixed_bools=10/268)
#22      0.17s best:508   next:[354,507]  no_lp (fixed_bools=0/193)
#23      0.18s best:507   next:[354,506]  quick_restart_no_lp (fixed_bools=10/292)
#24      0.18s best:505   next:[354,504]  quick_restart_no_lp (fixed_bools=10/295)
#25      0.19s best:498   next:[354,497]  quick_restart_no_lp (fixed_bools=10/296)
#26      0.19s best:496   next:[354,495]  violation_ls(batch:2 #solutions_imported:2 #lin_moves:1 #lin_evals:15'643 #gen_moves:9'336 #gen_evals:1'439 #comp_moves:432 #backtracks:4'451 #weight_updates:78)
#27      0.20s best:491   next:[354,490]  quick_restart_no_lp (fixed_bools=10/312)
#28      0.20s best:490   next:[354,489]  violation_ls(batch:3 #solutions_imported:3 #lin_moves:2 #lin_evals:15'648 #gen_moves:9'336 #gen_evals:1'439 #comp_moves:432 #backtracks:4'451 #weight_updates:78)
#29      0.20s best:489   next:[354,488]  violation_ls(batch:3 #solutions_imported:3 #lin_moves:2 #lin_evals:15'660 #gen_moves:9'504 #gen_evals:1'426 #comp_moves:553 #backtracks:4'468 #weight_updates:78)
#30      0.20s best:487   next:[354,486]  violation_ls(batch:3 #solutions_imported:3 #lin_moves:1 #lin_evals:16'282 #gen_moves:9'753 #gen_evals:1'357 #comp_moves:213 #backtracks:4'768 #weight_updates:99)
#31      0.20s best:481   next:[354,480]  quick_restart_no_lp (fixed_bools=10/314)
#32      0.20s best:480   next:[354,479]  violation_ls(batch:4 #solutions_imported:4 #lin_moves:2 #lin_evals:15'699 #gen_moves:9'524 #gen_evals:1'427 #comp_moves:555 #backtracks:4'477 #weight_updates:78)
#33      0.20s best:479   next:[354,478]  violation_ls(batch:5 #solutions_imported:5 #lin_moves:3 #lin_evals:15'659 #gen_moves:9'337 #gen_evals:1'439 #comp_moves:433 #backtracks:4'451 #weight_updates:78)
#34      0.20s best:478   next:[354,477]  violation_ls(batch:5 #solutions_imported:5 #lin_moves:4 #lin_evals:15'712 #gen_moves:9'524 #gen_evals:1'427 #comp_moves:555 #backtracks:4'477 #weight_updates:79)
#35      0.20s best:477   next:[354,476]  violation_ls(batch:6 #solutions_imported:6 #lin_moves:4 #lin_evals:15'717 #gen_moves:9'525 #gen_evals:1'427 #comp_moves:556 #backtracks:4'477 #weight_updates:79)
#36      0.20s best:476   next:[354,475]  violation_ls(batch:6 #solutions_imported:6 #lin_moves:19 #lin_evals:16'419 #gen_moves:9'773 #gen_evals:1'358 #comp_moves:215 #backtracks:4'777 #weight_updates:115)
#37      0.20s best:474   next:[354,473]  graph_dec_lns (d=0.97 s=120 t=0.10 p=1.00 stall=0 h=auto_l0)
#Bound   0.21s best:474   next:[355,473]  objective_lb_search_no_lp
#38      0.22s best:471   next:[355,470]  quick_restart_no_lp (fixed_bools=10/342)
#39      0.23s best:470   next:[355,469]  violation_ls(batch:3 #solutions_imported:3 #lin_moves:0 #lin_evals:21'025 #gen_moves:12'554 #gen_evals:1'897 #comp_moves:385 #backtracks:6'083 #weight_updates:126)
#40      0.23s best:469   next:[355,468]  violation_ls(batch:4 #solutions_imported:4 #lin_moves:0 #lin_evals:21'029 #gen_moves:12'555 #gen_evals:1'897 #comp_moves:386 #backtracks:6'083 #weight_updates:126)
#41      0.23s best:468   next:[355,467]  violation_ls(batch:5 #solutions_imported:5 #lin_moves:1 #lin_evals:21'035 #gen_moves:12'555 #gen_evals:1'897 #comp_moves:386 #backtracks:6'083 #weight_updates:126)
#42      0.24s best:467   next:[355,466]  violation_ls(batch:6 #solutions_imported:6 #lin_moves:2 #lin_evals:21'041 #gen_moves:12'555 #gen_evals:1'897 #comp_moves:386 #backtracks:6'083 #weight_updates:126)
#43      0.24s best:466   next:[355,465]  violation_ls(batch:7 #solutions_imported:7 #lin_moves:2 #lin_evals:21'045 #gen_moves:12'557 #gen_evals:1'897 #comp_moves:388 #backtracks:6'083 #weight_updates:126)
#44      0.24s best:465   next:[355,464]  violation_ls(batch:8 #solutions_imported:8 #lin_moves:2 #lin_evals:21'064 #gen_moves:12'568 #gen_evals:1'897 #comp_moves:391 #backtracks:6'087 #weight_updates:126)
#45      0.24s best:464   next:[355,463]  violation_ls(batch:9 #solutions_imported:9 #lin_moves:2 #lin_evals:22'043 #gen_moves:13'032 #gen_evals:1'947 #comp_moves:419 #backtracks:6'305 #weight_updates:134)
#Bound   0.25s best:464   next:[388,463]  objective_lb_search_no_lp
#Bound   0.29s best:464   next:[392,463]  objective_lb_search_no_lp
#Bound   0.33s best:464   next:[393,463]  objective_lb_search_no_lp
#Bound   0.51s best:464   next:[396,463]  objective_lb_search_no_lp
#Model   0.52s var:108/110 constraints:698/783
#Bound   0.52s best:464   next:[401,463]  objective_lb_search_no_lp
#Bound   0.56s best:464   next:[402,463]  objective_lb_search_no_lp
#Bound   0.57s best:464   next:[408,463]  objective_lb_search_no_lp
#Model   0.77s var:107/110 constraints:692/783
#Model   0.81s var:105/110 constraints:621/783
#Done    0.82s no_lp
#Done    0.82s objective_lb_search_no_lp
#Model   0.82s var:100/110 constraints:480/783
#Done    0.82s core
#Bound   0.82s best:464   next:[456,463]  objective_lb_search_no_lp [skipped_logs=9]

Task timing                                  n [     min,      max]      avg      dev     time         n [     min,      max]      avg      dev    dtime
                             'core':         1 [738.97ms, 738.97ms] 738.97ms   0.00ns 738.97ms         1 [ 72.18ms,  72.18ms]  72.18ms   0.00ns  72.18ms
                       'default_lp':         1 [739.05ms, 739.05ms] 739.05ms   0.00ns 739.05ms         1 [ 89.34ms,  89.34ms]  89.34ms   0.00ns  89.34ms
                 'feasibility_pump':        19 [  5.05ms,  75.28ms]  27.01ms  12.84ms 513.19ms        18 [  3.35ms,   4.07ms]   3.40ms 161.98us  61.24ms
                  'fj_long_default':         0 [  0.00ns,   0.00ns]   0.00ns   0.00ns   0.00ns         0 [  0.00ns,   0.00ns]   0.00ns   0.00ns   0.00ns
                  'fj_long_default':         0 [  0.00ns,   0.00ns]   0.00ns   0.00ns   0.00ns         0 [  0.00ns,   0.00ns]   0.00ns   0.00ns   0.00ns
              'fj_long_lin_default':         0 [  0.00ns,   0.00ns]   0.00ns   0.00ns   0.00ns         0 [  0.00ns,   0.00ns]   0.00ns   0.00ns   0.00ns
              'fj_long_lin_perturb':         0 [  0.00ns,   0.00ns]   0.00ns   0.00ns   0.00ns         0 [  0.00ns,   0.00ns]   0.00ns   0.00ns   0.00ns
               'fj_long_lin_random':         0 [  0.00ns,   0.00ns]   0.00ns   0.00ns   0.00ns         0 [  0.00ns,   0.00ns]   0.00ns   0.00ns   0.00ns
                  'fj_long_perturb':         0 [  0.00ns,   0.00ns]   0.00ns   0.00ns   0.00ns         0 [  0.00ns,   0.00ns]   0.00ns   0.00ns   0.00ns
                   'fj_long_random':         0 [  0.00ns,   0.00ns]   0.00ns   0.00ns   0.00ns         0 [  0.00ns,   0.00ns]   0.00ns   0.00ns   0.00ns
                 'fj_short_default':         0 [  0.00ns,   0.00ns]   0.00ns   0.00ns   0.00ns         0 [  0.00ns,   0.00ns]   0.00ns   0.00ns   0.00ns
                 'fj_short_default':         1 [ 74.85ms,  74.85ms]  74.85ms   0.00ns  74.85ms         1 [ 50.42ms,  50.42ms]  50.42ms   0.00ns  50.42ms
             'fj_short_lin_default':         0 [  0.00ns,   0.00ns]   0.00ns   0.00ns   0.00ns         0 [  0.00ns,   0.00ns]   0.00ns   0.00ns   0.00ns
             'fj_short_lin_default':         0 [  0.00ns,   0.00ns]   0.00ns   0.00ns   0.00ns         0 [  0.00ns,   0.00ns]   0.00ns   0.00ns   0.00ns
             'fj_short_lin_perturb':         0 [  0.00ns,   0.00ns]   0.00ns   0.00ns   0.00ns         0 [  0.00ns,   0.00ns]   0.00ns   0.00ns   0.00ns
              'fj_short_lin_random':         0 [  0.00ns,   0.00ns]   0.00ns   0.00ns   0.00ns         0 [  0.00ns,   0.00ns]   0.00ns   0.00ns   0.00ns
                 'fj_short_perturb':         0 [  0.00ns,   0.00ns]   0.00ns   0.00ns   0.00ns         0 [  0.00ns,   0.00ns]   0.00ns   0.00ns   0.00ns
                  'fj_short_random':         0 [  0.00ns,   0.00ns]   0.00ns   0.00ns   0.00ns         0 [  0.00ns,   0.00ns]   0.00ns   0.00ns   0.00ns
                        'fs_random':         1 [  6.74ms,   6.74ms]   6.74ms   0.00ns   6.74ms         0 [  0.00ns,   0.00ns]   0.00ns   0.00ns   0.00ns
                        'fs_random':         1 [  7.17ms,   7.17ms]   7.17ms   0.00ns   7.17ms         0 [  0.00ns,   0.00ns]   0.00ns   0.00ns   0.00ns
                        'fs_random':         1 [  7.19ms,   7.19ms]   7.19ms   0.00ns   7.19ms         1 [ 20.00ns,  20.00ns]  20.00ns   0.00ns  20.00ns
                        'fs_random':         1 [  7.72ms,   7.72ms]   7.72ms   0.00ns   7.72ms         1 [ 20.00ns,  20.00ns]  20.00ns   0.00ns  20.00ns
                  'fs_random_no_lp':         1 [  5.09ms,   5.09ms]   5.09ms   0.00ns   5.09ms         0 [  0.00ns,   0.00ns]   0.00ns   0.00ns   0.00ns
                  'fs_random_no_lp':         1 [  5.64ms,   5.64ms]   5.64ms   0.00ns   5.64ms         0 [  0.00ns,   0.00ns]   0.00ns   0.00ns   0.00ns
                  'fs_random_no_lp':         1 [  5.83ms,   5.83ms]   5.83ms   0.00ns   5.83ms         0 [  0.00ns,   0.00ns]   0.00ns   0.00ns   0.00ns
                  'fs_random_no_lp':         1 [  6.68ms,   6.68ms]   6.68ms   0.00ns   6.68ms         0 [  0.00ns,   0.00ns]   0.00ns   0.00ns   0.00ns
          'fs_random_quick_restart':         1 [  6.73ms,   6.73ms]   6.73ms   0.00ns   6.73ms         0 [  0.00ns,   0.00ns]   0.00ns   0.00ns   0.00ns
          'fs_random_quick_restart':         1 [  7.00ms,   7.00ms]   7.00ms   0.00ns   7.00ms         1 [ 20.00ns,  20.00ns]  20.00ns   0.00ns  20.00ns
          'fs_random_quick_restart':         1 [  7.15ms,   7.15ms]   7.15ms   0.00ns   7.15ms         0 [  0.00ns,   0.00ns]   0.00ns   0.00ns   0.00ns
          'fs_random_quick_restart':         1 [  7.67ms,   7.67ms]   7.67ms   0.00ns   7.67ms         1 [ 20.00ns,  20.00ns]  20.00ns   0.00ns  20.00ns
    'fs_random_quick_restart_no_lp':         1 [  5.93ms,   5.93ms]   5.93ms   0.00ns   5.93ms         0 [  0.00ns,   0.00ns]   0.00ns   0.00ns   0.00ns
    'fs_random_quick_restart_no_lp':         1 [  5.94ms,   5.94ms]   5.94ms   0.00ns   5.94ms         0 [  0.00ns,   0.00ns]   0.00ns   0.00ns   0.00ns
    'fs_random_quick_restart_no_lp':         1 [  7.84ms,   7.84ms]   7.84ms   0.00ns   7.84ms         0 [  0.00ns,   0.00ns]   0.00ns   0.00ns   0.00ns
                    'graph_arc_lns':        18 [  2.78ms, 589.16ms] 161.16ms 174.09ms    2.90s        14 [ 10.00ns, 117.94ms]  11.65ms  29.89ms 163.03ms
                    'graph_cst_lns':        18 [670.34us,  16.19ms]   2.07ms   3.61ms  37.26ms         0 [  0.00ns,   0.00ns]   0.00ns   0.00ns   0.00ns
                    'graph_dec_lns':        18 [  2.87ms, 621.88ms] 188.24ms 205.38ms    3.39s        12 [ 10.00ns, 160.58ms]  19.73ms  43.73ms 236.75ms
                    'graph_var_lns':        18 [  1.46ms, 395.74ms] 128.34ms 122.47ms    2.31s        16 [ 10.00ns,  49.78ms]   6.95ms  12.30ms 111.13ms
                   'lb_tree_search':         1 [738.43ms, 738.43ms] 738.43ms   0.00ns 738.43ms         1 [ 46.88ms,  46.88ms]  46.88ms   0.00ns  46.88ms
                           'max_lp':         1 [739.18ms, 739.18ms] 739.18ms   0.00ns 739.18ms         1 [ 37.37ms,  37.37ms]  37.37ms   0.00ns  37.37ms
                            'no_lp':         1 [737.96ms, 737.96ms] 737.96ms   0.00ns 737.96ms         1 [ 89.22ms,  89.22ms]  89.22ms   0.00ns  89.22ms
              'objective_lb_search':         1 [736.65ms, 736.65ms] 736.65ms   0.00ns 736.65ms         1 [ 66.63ms,  66.63ms]  66.63ms   0.00ns  66.63ms
       'objective_lb_search_max_lp':         1 [736.68ms, 736.68ms] 736.68ms   0.00ns 736.68ms         1 [ 60.26ms,  60.26ms]  60.26ms   0.00ns  60.26ms
        'objective_lb_search_no_lp':         1 [735.54ms, 735.54ms] 735.54ms   0.00ns 735.54ms         1 [ 78.76ms,  78.76ms]  78.76ms   0.00ns  78.76ms
  'objective_shaving_search_max_lp':        16 [  3.58ms, 198.98ms]  44.33ms  44.43ms 709.30ms         8 [373.73us,   1.20ms] 713.44us 295.66us   5.71ms
   'objective_shaving_search_no_lp':        19 [  1.12ms, 189.86ms]  36.25ms  41.21ms 688.67ms        13 [347.85us,  17.25ms]   2.11ms   4.39ms  27.47ms
                          'probing':         1 [741.41ms, 741.41ms] 741.41ms   0.00ns 741.41ms         1 [ 15.50ms,  15.50ms]  15.50ms   0.00ns  15.50ms
                   'probing_max_lp':         1 [736.31ms, 736.31ms] 736.31ms   0.00ns 736.31ms         1 [ 38.83ms,  38.83ms]  38.83ms   0.00ns  38.83ms
                     'pseudo_costs':         1 [739.01ms, 739.01ms] 739.01ms   0.00ns 739.01ms         1 [ 27.98ms,  27.98ms]  27.98ms   0.00ns  27.98ms
                    'quick_restart':         1 [738.46ms, 738.46ms] 738.46ms   0.00ns 738.46ms         1 [ 52.50ms,  52.50ms]  52.50ms   0.00ns  52.50ms
              'quick_restart_no_lp':         1 [738.22ms, 738.22ms] 738.22ms   0.00ns 738.22ms         1 [ 66.70ms,  66.70ms]  66.70ms   0.00ns  66.70ms
                    'reduced_costs':         1 [738.24ms, 738.24ms] 738.24ms   0.00ns 738.24ms         1 [ 49.87ms,  49.87ms]  49.87ms   0.00ns  49.87ms
                        'rins/rens':        19 [ 97.02us, 683.31ms] 248.76ms 229.22ms    4.73s        12 [ 13.99us, 235.31ms]  32.27ms  63.20ms 387.20ms
                      'rnd_cst_lns':        19 [797.65us, 361.89ms] 109.95ms 120.50ms    2.09s        15 [  4.24us,  47.32ms]   5.57ms  12.14ms  83.53ms
                      'rnd_var_lns':        19 [  1.84ms, 610.59ms] 142.15ms 163.77ms    2.70s        16 [ 10.00ns,  94.90ms]   8.94ms  22.88ms 142.97ms
                     'violation_ls':        13 [  5.71ms, 112.83ms]  54.56ms  26.52ms 709.30ms        13 [  2.03ms,  55.82ms]  33.40ms  17.34ms 434.26ms
                     'violation_ls':        13 [353.34us, 102.84ms]  54.21ms  42.95ms 704.77ms        13 [490.00ns,  49.74ms]  28.13ms  22.40ms 365.70ms
                     'violation_ls':        14 [275.90us, 102.02ms]  50.69ms  41.37ms 709.70ms        14 [860.00ns,  53.52ms]  27.08ms  22.88ms 379.13ms
                     'violation_ls':        14 [296.20us, 116.84ms]  49.67ms  44.67ms 695.31ms        14 [700.00ns,  52.26ms]  25.11ms  22.50ms 351.60ms
                     'violation_ls':        16 [166.08us, 122.22ms]  43.61ms  41.76ms 697.82ms        16 [830.00ns,  49.22ms]  22.98ms  22.07ms 367.62ms

Search stats                        Bools  Conflicts  Branches  Restarts  BoolPropag  IntegerPropag
                           'core':    909        439     2'005       660     137'865         90'915
                     'default_lp':    103        520     3'998     1'262      18'468        174'494
                      'fs_random':     57          0         0         0           0              0
                      'fs_random':     57          0         0         0           0              0
                      'fs_random':     57          0         0         0           0              0
                      'fs_random':     57          0        32        32          30            138
                'fs_random_no_lp':     57          0         0         0           0              0
                'fs_random_no_lp':     57          0         0         0           0              0
                'fs_random_no_lp':     57          0         0         0           0              0
                'fs_random_no_lp':     57          0         0         0           0              0
        'fs_random_quick_restart':     57          0         0         0           0              0
        'fs_random_quick_restart':     57          0         0         0           0              0
        'fs_random_quick_restart':     57          0         0         0           0              0
        'fs_random_quick_restart':     57          0         4         4           5             13
  'fs_random_quick_restart_no_lp':     57          0         0         0           0              0
  'fs_random_quick_restart_no_lp':     57          0         0         0           0              0
  'fs_random_quick_restart_no_lp':     57          0         0         0           0              0
                 'lb_tree_search':     57          0       393       230         357          3'321
                         'max_lp':     73          2       144       114          92          1'444
                          'no_lp':    259      1'847     6'215     1'171     111'957        400'733
            'objective_lb_search':     74        547     2'706       927       9'533        123'772
     'objective_lb_search_max_lp':     71         76       790       362       1'821         18'606
      'objective_lb_search_no_lp':     96      1'901     4'633       977      28'478        359'545
                        'probing':     99         17       181       181         431          2'892
                 'probing_max_lp':     59          0       118       118          52          1'018
                   'pseudo_costs':     86         37       222       115         415          7'499
                  'quick_restart':    144         75     3'521     1'310       9'157         61'197
            'quick_restart_no_lp':    376      1'238     7'123       988     115'226        269'969
                  'reduced_costs':    135        158     2'216       698      18'642         73'483

SAT stats                           ClassicMinim  LitRemoved  LitLearned  LitForgotten  Subsumed  MClauses  MDecisions  MLitTrue  MSubsumed  MLitRemoved  MReused
                           'core':           229         677         800             0         0        94         476         0         11           46       11
                     'default_lp':           283         506       3'461             0        60       381       2'257         0         78          465       70
                      'fs_random':             0           0           0             0         0         0           0         0          0            0        0
                      'fs_random':             0           0           0             0         0         0           0         0          0            0        0
                      'fs_random':             0           0           0             0         0         0           0         0          0            0        0
                      'fs_random':             0           0           0             0         0         0           0         0          0            0        0
                'fs_random_no_lp':             0           0           0             0         0         0           0         0          0            0        0
                'fs_random_no_lp':             0           0           0             0         0         0           0         0          0            0        0
                'fs_random_no_lp':             0           0           0             0         0         0           0         0          0            0        0
                'fs_random_no_lp':             0           0           0             0         0         0           0         0          0            0        0
        'fs_random_quick_restart':             0           0           0             0         0         0           0         0          0            0        0
        'fs_random_quick_restart':             0           0           0             0         0         0           0         0          0            0        0
        'fs_random_quick_restart':             0           0           0             0         0         0           0         0          0            0        0
        'fs_random_quick_restart':             0           0           0             0         0         0           0         0          0            0        0
  'fs_random_quick_restart_no_lp':             0           0           0             0         0         0           0         0          0            0        0
  'fs_random_quick_restart_no_lp':             0           0           0             0         0         0           0         0          0            0        0
  'fs_random_quick_restart_no_lp':             0           0           0             0         0         0           0         0          0            0        0
                 'lb_tree_search':             0           0           0             0         0        28         134         0          0            0        6
                         'max_lp':             0           0           7             0         0         0           0         0          0            0        0
                          'no_lp':         1'367       2'986      14'259             0        69       264       1'341         0         17           87       70
            'objective_lb_search':           297         646       3'440             0        50       251       1'292         0         34          174       45
     'objective_lb_search_max_lp':            25          44         675             0         7        58         284         0          0            0       12
      'objective_lb_search_no_lp':         1'507       3'586      10'434             0        91       304       1'710         0         91          463       66
                        'probing':             0           0          17             0         0         0           0         0          0            0        0
                 'probing_max_lp':             0           0           0             0         0         0           0         0          0            0        0
                   'pseudo_costs':             8          10         354             0         1         0           0         0          0            0        0
                  'quick_restart':            42          73         512             0         9       269       1'368         0         16           81       51
            'quick_restart_no_lp':           742       1'777      10'679             0        46       196       1'261         0         31          173       26
                  'reduced_costs':            39          71         932             0        14       241       1'308         0         68          362       45

Lp stats                         Component  Iterations  AddedCuts  OPTIMAL  DUAL_F.  DUAL_U.
                  'default_lp':          1       3'061      1'073      601        0        0
                   'fs_random':          1           0          0        0        0        0
                   'fs_random':          1           0          0        0        0        0
                   'fs_random':          1           0          0        0        0        0
                   'fs_random':          1           0          0        0        0        0
     'fs_random_quick_restart':          1           0          0        0        0        0
     'fs_random_quick_restart':          1           0          0        0        0        0
     'fs_random_quick_restart':          1           0          0        0        0        0
     'fs_random_quick_restart':          1           0          0        0        0        0
              'lb_tree_search':          1         712      1'348       42        2        0
                      'max_lp':          1         587      1'363       38        1        0
         'objective_lb_search':          1       2'934      1'126      595        0        0
  'objective_lb_search_max_lp':          1       2'390      1'155      149       50        1
                     'probing':          1         374      1'252       83        0        0
              'probing_max_lp':          1         561      1'485       26        1        0
                'pseudo_costs':          1       1'167      1'117      108       16        0
               'quick_restart':          1       1'449      1'289      263        0        0
               'reduced_costs':          1         994      1'399      132        8        0

Lp dimension                                                                      Final dimension of first component
                  'default_lp':    165 rows, 105 columns, 647 entries with magnitude in [3.499357e-03, 1.000000e+00]
                   'fs_random':        0 rows, 105 columns, 0 entries with magnitude in [0.000000e+00, 0.000000e+00]
                   'fs_random':        0 rows, 105 columns, 0 entries with magnitude in [0.000000e+00, 0.000000e+00]
                   'fs_random':        0 rows, 105 columns, 0 entries with magnitude in [0.000000e+00, 0.000000e+00]
                   'fs_random':        0 rows, 105 columns, 0 entries with magnitude in [0.000000e+00, 0.000000e+00]
     'fs_random_quick_restart':        0 rows, 105 columns, 0 entries with magnitude in [0.000000e+00, 0.000000e+00]
     'fs_random_quick_restart':        0 rows, 105 columns, 0 entries with magnitude in [0.000000e+00, 0.000000e+00]
     'fs_random_quick_restart':        0 rows, 105 columns, 0 entries with magnitude in [0.000000e+00, 0.000000e+00]
     'fs_random_quick_restart':        0 rows, 105 columns, 0 entries with magnitude in [0.000000e+00, 0.000000e+00]
              'lb_tree_search':  1153 rows, 110 columns, 7010 entries with magnitude in [8.191625e-04, 1.000000e+00]
                      'max_lp':  1225 rows, 110 columns, 7558 entries with magnitude in [1.363113e-03, 1.000000e+00]
         'objective_lb_search':   264 rows, 105 columns, 1480 entries with magnitude in [2.674753e-04, 1.000000e+00]
  'objective_lb_search_max_lp':   642 rows, 110 columns, 2446 entries with magnitude in [4.314508e-04, 1.000000e+00]
                     'probing':   616 rows, 105 columns, 5888 entries with magnitude in [3.917797e-05, 1.000000e+00]
              'probing_max_lp':  1255 rows, 110 columns, 8849 entries with magnitude in [9.510878e-04, 1.000000e+00]
                'pseudo_costs':   616 rows, 110 columns, 3396 entries with magnitude in [1.124072e-04, 1.000000e+00]
               'quick_restart':   359 rows, 105 columns, 2845 entries with magnitude in [9.575540e-05, 1.000000e+00]
               'reduced_costs':   510 rows, 110 columns, 2929 entries with magnitude in [6.214305e-04, 1.000000e+00]

Lp debug                         CutPropag  CutEqPropag  Adjust  Overflow    Bad  BadScaling
                  'default_lp':          4            4     173         0  2'872           0
                   'fs_random':          0            0       0         0      0           0
                   'fs_random':          0            0       0         0      0           0
                   'fs_random':          0            0       0         0      0           0
                   'fs_random':          0            0       0         0      0           0
     'fs_random_quick_restart':          0            0       0         0      0           0
     'fs_random_quick_restart':          0            0       0         0      0           0
     'fs_random_quick_restart':          0            0       0         0      0           0
     'fs_random_quick_restart':          0            0       0         0      0           0
              'lb_tree_search':          1            0      38         0  1'426           0
                      'max_lp':          6            0      29         0  2'195           0
         'objective_lb_search':          1            2     291         0  2'251           0
  'objective_lb_search_max_lp':          8            1     170         0  2'494           0
                     'probing':          0            0      65         0  4'220           0
              'probing_max_lp':          6            0      22         0  2'793           0
                'pseudo_costs':          4            3      84         0  2'221           0
               'quick_restart':          0            6     161         0  4'050           0
               'reduced_costs':          6            0     126         0  2'931           0

Lp pool                          Constraints  Updates  Simplif  Merged  Shortened  Split  Strenghtened    Cuts/Call
                  'default_lp':        1'202      390      610       0         33    201           795  1'073/1'818
                   'fs_random':          129        0        0       0          0      0             0          0/0
                   'fs_random':          129        0        0       0          0      0             0          0/0
                   'fs_random':          129        0        0       0          0      0             0          0/0
                   'fs_random':          129        0        0       0          0      0             0          0/0
     'fs_random_quick_restart':          129        0        0       0          0      0             0          0/0
     'fs_random_quick_restart':          129        0        0       0          0      0             0          0/0
     'fs_random_quick_restart':          129        0        0       0          0      0             0          0/0
     'fs_random_quick_restart':          129        0        0       0          0      0             0          0/0
              'lb_tree_search':        2'127      129    1'948       3        425     13         4'068  1'348/2'160
                      'max_lp':        2'145      117    1'899       0        404     27         4'835  1'363/2'283
         'objective_lb_search':        1'255      262      557       0         51    113           910  1'126/2'073
  'objective_lb_search_max_lp':        1'930      229    3'773       7      1'126     31         6'755  1'155/1'948
                     'probing':        1'381      123       86       0          0     61           452  1'252/1'954
              'probing_max_lp':        2'267       22        1       0          0     30           313  1'485/2'494
                'pseudo_costs':        1'896       90    1'269       3          0     59         3'298  1'117/1'762
               'quick_restart':        1'413      453    1'273       5        244    223         1'327  1'289/2'028
               'reduced_costs':        2'174      181    2'775       7        333     37         5'209  1'399/2'269

Lp Cut            defaul  max_lp  quick_  reduce  pseudo  lb_tre  probin  object  probin  object
          CG_FF:      94     116     116     139      63     135     111     113     125      77
           CG_K:      47      38      36      43      26      43      32      44      41      25
           CG_R:      46      86      69      51      40      98      61      44      89      34
          CG_RB:     212     397     385     340     278     414     412     265     435     257
         CG_RBP:      38      57      57      38      24      52      45      39      47      18
         Clique:       -       1       -       5       2      11       -       -       -       5
             IB:     182      99     172     151     136      91     129     166      91     155
       MIR_1_FF:      52      91      48      81      63      94      37      61      79      71
        MIR_1_K:      17      23      17      11       9      22       9      10      24      13
        MIR_1_R:       9       6       6       4       5       6       3       5       9       5
       MIR_1_RB:      59      86      67     111     101      91      68      80     111     100
      MIR_1_RBP:       6      20       5      17      19      20       8       2      24      18
      MIR_1_RLT:       -       2       -       9      10       1       -       -       1      12
       MIR_2_FF:      29      21      26      36      15      31      13      29      42      23
        MIR_2_K:       8       5       6       5       5       8       3       8      10       4
        MIR_2_R:      15      10       8      21      13       6       6       8      15       9
       MIR_2_RB:      35      33      30      50      42      32      36      36      48      49
      MIR_2_RBP:       5       3       4       8      11       7       8       4       9      12
       MIR_3_FF:      14      21      13      12      17      15      11      19      21      20
        MIR_3_K:       4      14       5       5       3       6       2       4      13       7
        MIR_3_R:      11      11      10      13      12       4      12       9      14      12
       MIR_3_RB:      19      14      16      28      27      17      24      23      25      23
      MIR_3_RBP:       2       5       1       3       3       1       8       -       9       5
       MIR_4_FF:      12       9       8       8       5       5      15       9      12       8
        MIR_4_K:       6       7       2       2       -       4       4       5       4       1
        MIR_4_R:      11       6       8       7       8       2      13       4       6       8
       MIR_4_RB:       9       7      17      12       9       4      20      13      11      10
      MIR_4_RBP:       3       3       1       2       3       -       2       -       5       1
       MIR_5_FF:       6       6       1       4       2       7       7      10       4       1
        MIR_5_K:       1       3       -       -       -       2       -       1       2       -
        MIR_5_R:       6       -       1       1       2       2       6       2       1       2
       MIR_5_RB:       3       4       3       1       3       3      13      11       3       2
      MIR_5_RBP:       2       -       1       -       -       -       5       1       1       -
       MIR_6_FF:       3       3       2       -       2       2       2       5       -       2
        MIR_6_K:       3       -       -       -       -       -       -       -       -       2
        MIR_6_R:       3       2       2       -       2       -       3       -       -       2
       MIR_6_RB:       2       1       3       2       3       1       2       6       -       2
      MIR_6_RBP:       2       -       -       -       -       -       2       -       -       -
   ZERO_HALF_FF:      21      22      30      25      15      24      19      21      23      32
    ZERO_HALF_K:       2       6       5       2       1       6       3       2       4       2
    ZERO_HALF_R:      43      78      53     100      83      49      53      37      83      81
   ZERO_HALF_RB:      26      37      42      44      45      26      34      26      36      38
  ZERO_HALF_RBP:       5      10      13       8      10       6      11       4       8       7

LNS stats           Improv/Calls  Closed  Difficulty  TimeLimit
  'graph_arc_lns':         10/18     72%        0.98       0.10
  'graph_cst_lns':           0/0      0%        0.50       0.10
  'graph_dec_lns':         10/18     72%        0.98       0.10
  'graph_var_lns':          6/18     89%        0.99       0.10
      'rins/rens':          5/18     67%        0.97       0.10
    'rnd_cst_lns':          7/16     81%        0.99       0.10
    'rnd_var_lns':          9/19     79%        0.99       0.10

LS stats                   Batches  Restarts  LinMoves  GenMoves  CompoundMoves  WeightUpdates
       'fj_long_default':        0         0         0         0              0              0
       'fj_long_default':        0         0         0         0              0              0
   'fj_long_lin_default':        0         0         0         0              0              0
   'fj_long_lin_perturb':        0         0         0         0              0              0
    'fj_long_lin_random':        0         0         0         0              0              0
       'fj_long_perturb':        0         0         0         0              0              0
        'fj_long_random':        0         0         0         0              0              0
      'fj_short_default':        0         0         0         0              0              0
      'fj_short_default':        1         1         0     4'050            461              5
  'fj_short_lin_default':        0         0         0         0              0              0
  'fj_short_lin_default':        0         0         0         0              0              0
  'fj_short_lin_perturb':        0         0         0         0              0              0
   'fj_short_lin_random':        0         0         0         0              0              0
      'fj_short_perturb':        0         0         0         0              0              0
       'fj_short_random':        0         0         0         0              0              0
          'violation_ls':       13         0         3    58'677          1'858            357
          'violation_ls':       13         0    59'177    12'741            240         50'228
          'violation_ls':       14         0     4'882    48'445          2'103          5'395
          'violation_ls':       14         0     4'884    51'903          1'541          5'427
          'violation_ls':       16         0         2    47'653          3'384            225

Solutions (45)            Num     Rank
        'graph_dec_lns':    1  [37,37]
                'no_lp':   11   [1,22]
  'quick_restart_no_lp':   16   [4,38]
        'rins_pump_lns':    1    [9,9]
         'violation_ls':   16  [26,45]

Objective bounds                Num
                  'bool_core':    1
                 'default_lp':    2
             'initial_domain':    1
        'objective_lb_search':    1
  'objective_lb_search_no_lp':   26

Solution repositories    Added  Queried  Ignored  Synchro
  'feasible solutions':    157      339       15      119
        'lp solutions':      3        4        0        3
                'pump':    378       14

Improving bounds shared          Num
                        'core':   23
                  'default_lp':   41
                      'max_lp':    4
                       'no_lp':  133
         'objective_lb_search':   23
  'objective_lb_search_max_lp':   26
   'objective_lb_search_no_lp':    6
              'probing_max_lp':    1
                'pseudo_costs':    1
               'quick_restart':   34
         'quick_restart_no_lp':  206
               'reduced_costs':    8

Clauses shared                  Num
                 'default_lp':    4
                      'no_lp':   31
        'objective_lb_search':    2
  'objective_lb_search_no_lp':    3
              'quick_restart':    1
        'quick_restart_no_lp':   10
              'reduced_costs':    3

CpSolverResponse summary:
status: OPTIMAL
objective: 464
best_bound: 464
integers: 106
booleans: 57
conflicts: 0
branches: 32
propagations: 30
integer_propagations: 138
restarts: 32
lp_iterations: 0
walltime: 0.840919
usertime: 0.840919
deterministic_time: 3.9628
gap_integral: 10.008
solution_fingerprint: 0xaca83fa3e345c4e6


--- Simulation Gantt  partir du modle mathmatique ---
{'big':0, 'due_date':58, 'pos_time':5, 'status':0, 'blocked':1, 'operations':["{'type':0, 'processing_time':32}"]}
{'big':0, 'due_date':128, 'pos_time':5, 'status':0, 'blocked':1, 'operations':["{'type':0, 'processing_time':16}", "{'type':1, 'processing_time':36}"]}
{'big':0, 'due_date':109, 'pos_time':5, 'status':1, 'blocked':2, 'operations':["{'type':0, 'processing_time':55}", "{'type':1, 'processing_time':43}"]}
{'big':0, 'due_date':156, 'pos_time':5, 'status':1, 'blocked':1, 'operations':["{'type':1, 'processing_time':23}", "{'type':0, 'processing_time':23}"]}
{'big':1, 'due_date':85, 'pos_time':5, 'status':0, 'blocked':0, 'operations':["{'type':0, 'processing_time':43}"]}
