created virtual environment CPython3.12.4.final.0-64 in 3964ms
  creator CPython3Posix(dest=/localscratch/aneumann.63390841.0/env, clear=False, no_vcs_ignore=False, global=False)
  seeder FromAppData(download=False, pip=bundle, via=copy, app_data_dir=/home/aneumann/.local/share/virtualenv)
    added seed packages: pip==25.1.1
  activators BashActivator,CShellActivator,FishActivator,NushellActivator,PowerShellActivator,PythonActivator
Looking in links: /cvmfs/soft.computecanada.ca/custom/python/wheelhouse/gentoo2023/x86-64-v3, /cvmfs/soft.computecanada.ca/custom/python/wheelhouse/gentoo2023/generic, /cvmfs/soft.computecanada.ca/custom/python/wheelhouse/generic
Requirement already satisfied: pip in /localscratch/aneumann.63390841.0/env/lib/python3.12/site-packages (25.1.1)
Looking in links: /cvmfs/soft.computecanada.ca/custom/python/wheelhouse/gentoo2023/x86-64-v3, /cvmfs/soft.computecanada.ca/custom/python/wheelhouse/gentoo2023/generic, /cvmfs/soft.computecanada.ca/custom/python/wheelhouse/generic
ERROR: protobuf-5.28.3-cp38-abi3-manylinux2014_x86_64.whl is not a supported wheel on this platform.
Looking in links: /cvmfs/soft.computecanada.ca/custom/python/wheelhouse/gentoo2023/x86-64-v3, /cvmfs/soft.computecanada.ca/custom/python/wheelhouse/gentoo2023/generic, /cvmfs/soft.computecanada.ca/custom/python/wheelhouse/generic
Processing /home/aneumann/projects/def-adhaj/aneumann/GNRS/wheels/immutabledict-4.2.0-py3-none-any.whl
Installing collected packages: immutabledict
Successfully installed immutabledict-4.2.0
Looking in links: /cvmfs/soft.computecanada.ca/custom/python/wheelhouse/gentoo2023/x86-64-v3, /cvmfs/soft.computecanada.ca/custom/python/wheelhouse/gentoo2023/generic, /cvmfs/soft.computecanada.ca/custom/python/wheelhouse/generic
Processing /cvmfs/soft.computecanada.ca/custom/python/wheelhouse/generic/ortools-9.10.4067+computecanada-cp312-cp312-linux_x86_64.whl (from -r /home/aneumann/projects/def-adhaj/aneumann/GNRS/requirements/or.txt (line 1))
Processing /cvmfs/soft.computecanada.ca/custom/python/wheelhouse/gentoo2023/x86-64-v3/matplotlib-3.10.0+computecanada-cp312-cp312-linux_x86_64.whl (from -r /home/aneumann/projects/def-adhaj/aneumann/GNRS/requirements/or.txt (line 2))
Processing /cvmfs/soft.computecanada.ca/custom/python/wheelhouse/gentoo2023/x86-64-v3/pandas-2.2.3+computecanada-cp312-cp312-linux_x86_64.whl (from -r /home/aneumann/projects/def-adhaj/aneumann/GNRS/requirements/or.txt (line 3))
Processing /cvmfs/soft.computecanada.ca/custom/python/wheelhouse/generic/absl_py-2.2.2+computecanada-py3-none-any.whl (from ortools<9.11,>=9.10->-r /home/aneumann/projects/def-adhaj/aneumann/GNRS/requirements/or.txt (line 1))
Processing /cvmfs/soft.computecanada.ca/custom/python/wheelhouse/gentoo2023/generic/numpy-2.2.2+computecanada-cp312-cp312-linux_x86_64.whl (from ortools<9.11,>=9.10->-r /home/aneumann/projects/def-adhaj/aneumann/GNRS/requirements/or.txt (line 1))
Processing /cvmfs/soft.computecanada.ca/custom/python/wheelhouse/gentoo2023/x86-64-v3/protobuf-6.30.2+computecanada-cp312-cp312-linux_x86_64.whl (from ortools<9.11,>=9.10->-r /home/aneumann/projects/def-adhaj/aneumann/GNRS/requirements/or.txt (line 1))
Requirement already satisfied: immutabledict>=3.0.0 in /localscratch/aneumann.63390841.0/env/lib/python3.12/site-packages (from ortools<9.11,>=9.10->-r /home/aneumann/projects/def-adhaj/aneumann/GNRS/requirements/or.txt (line 1)) (4.2.0)
Processing /cvmfs/soft.computecanada.ca/custom/python/wheelhouse/gentoo2023/generic/contourpy-1.3.1+computecanada-cp312-cp312-linux_x86_64.whl (from matplotlib->-r /home/aneumann/projects/def-adhaj/aneumann/GNRS/requirements/or.txt (line 2))
Processing /cvmfs/soft.computecanada.ca/custom/python/wheelhouse/generic/cycler-0.12.1+computecanada-py3-none-any.whl (from matplotlib->-r /home/aneumann/projects/def-adhaj/aneumann/GNRS/requirements/or.txt (line 2))
Processing /cvmfs/soft.computecanada.ca/custom/python/wheelhouse/generic/fonttools-4.58.2+computecanada-cp312-cp312-linux_x86_64.whl (from matplotlib->-r /home/aneumann/projects/def-adhaj/aneumann/GNRS/requirements/or.txt (line 2))
Processing /cvmfs/soft.computecanada.ca/custom/python/wheelhouse/gentoo2023/x86-64-v3/kiwisolver-1.4.8+computecanada-cp312-cp312-linux_x86_64.whl (from matplotlib->-r /home/aneumann/projects/def-adhaj/aneumann/GNRS/requirements/or.txt (line 2))
Processing /cvmfs/soft.computecanada.ca/custom/python/wheelhouse/generic/packaging-25.0+computecanada-py3-none-any.whl (from matplotlib->-r /home/aneumann/projects/def-adhaj/aneumann/GNRS/requirements/or.txt (line 2))
Processing /cvmfs/soft.computecanada.ca/custom/python/wheelhouse/gentoo2023/x86-64-v3/pillow-11.1.0+computecanada-cp312-cp312-linux_x86_64.whl (from matplotlib->-r /home/aneumann/projects/def-adhaj/aneumann/GNRS/requirements/or.txt (line 2))
Processing /cvmfs/soft.computecanada.ca/custom/python/wheelhouse/generic/pyparsing-3.2.1+computecanada-py3-none-any.whl (from matplotlib->-r /home/aneumann/projects/def-adhaj/aneumann/GNRS/requirements/or.txt (line 2))
Processing /cvmfs/soft.computecanada.ca/custom/python/wheelhouse/generic/python_dateutil-2.9.0.post0+computecanada-py2.py3-none-any.whl (from matplotlib->-r /home/aneumann/projects/def-adhaj/aneumann/GNRS/requirements/or.txt (line 2))
Processing /cvmfs/soft.computecanada.ca/custom/python/wheelhouse/generic/pytz-2025.2+computecanada-py2.py3-none-any.whl (from pandas->-r /home/aneumann/projects/def-adhaj/aneumann/GNRS/requirements/or.txt (line 3))
Processing /cvmfs/soft.computecanada.ca/custom/python/wheelhouse/generic/tzdata-2025.2+computecanada-py2.py3-none-any.whl (from pandas->-r /home/aneumann/projects/def-adhaj/aneumann/GNRS/requirements/or.txt (line 3))
Processing /cvmfs/soft.computecanada.ca/custom/python/wheelhouse/generic/six-1.17.0+computecanada-py2.py3-none-any.whl (from python-dateutil>=2.7->matplotlib->-r /home/aneumann/projects/def-adhaj/aneumann/GNRS/requirements/or.txt (line 2))
Installing collected packages: pytz, tzdata, six, pyparsing, protobuf, pillow, packaging, numpy, kiwisolver, fonttools, cycler, absl-py, python-dateutil, contourpy, pandas, matplotlib, ortools

Successfully installed absl-py-2.2.2+computecanada contourpy-1.3.1+computecanada cycler-0.12.1+computecanada fonttools-4.58.2+computecanada kiwisolver-1.4.8+computecanada matplotlib-3.10.0+computecanada numpy-2.2.2+computecanada ortools-9.10.4067+computecanada packaging-25.0+computecanada pandas-2.2.3+computecanada pillow-11.1.0+computecanada protobuf-6.30.2+computecanada pyparsing-3.2.1+computecanada python-dateutil-2.9.0.post0+computecanada pytz-2025.2+computecanada six-1.17.0+computecanada tzdata-2025.2+computecanada

Starting CP-SAT solver v9.10.4067
Parameters: max_time_in_seconds: 3600 max_memory_in_mb: 12000 log_search_progress: true enumerate_all_solutions: false absolute_gap_limit: 0 relative_gap_limit: 0
Setting number of workers to 48

Initial optimization model '': (model_fingerprint: 0xaa476d85d6f13ea4)
#Variables: 166 (#ints: 6 in objective)
  - 107 Booleans in [0,1]
  - 59 in [0,378]
#kLinear1: 19
#kLinear2: 211
#kLinear3: 79
#kLinearN: 682 (#terms: 7'004)

Starting presolve at 0.00s
  3.17e-04s  0.00e+00d  [DetectDominanceRelations] 
  9.99e-03s  0.00e+00d  [PresolveToFixPoint] #num_loops=6 #num_dual_strengthening=3 
  1.59e-05s  0.00e+00d  [ExtractEncodingFromLinear] #potential_supersets=3 
[Symmetry] Graph for symmetry has 997 nodes and 4'851 arcs.
[Symmetry] Symmetry computation done. time: 0.00051297 dtime: 0.00041965
[SAT presolve] num removable Booleans: 0 / 39
[SAT presolve] num trivial clauses: 0
[SAT presolve] [0s] clauses:4 literals:12 vars:9 one_side_vars:8 simple_definition:1 singleton_clauses:0
[SAT presolve] [3.7481e-05s] clauses:4 literals:12 vars:9 one_side_vars:8 simple_definition:1 singleton_clauses:0
[SAT presolve] [4.9648e-05s] clauses:4 literals:12 vars:9 one_side_vars:8 simple_definition:1 singleton_clauses:0
  2.49e-03s  2.92e-04d  [Probe] #probed=166 #fixed_bools=2 #new_bounds=16 #new_binary_clauses=10 
  6.69e-06s  0.00e+00d  [MaxClique] 
  2.93e-04s  0.00e+00d  [DetectDominanceRelations] 
  4.56e-03s  0.00e+00d  [PresolveToFixPoint] #num_loops=4 #num_dual_strengthening=3 
  1.05e-03s  0.00e+00d  [ProcessAtMostOneAndLinear] 
  7.37e-04s  0.00e+00d  [DetectDuplicateConstraints] #duplicates=131 #without_enforcements=53 
  3.42e-04s  1.34e-05d  [DetectDominatedLinearConstraints] #relevant_constraints=433 #num_inclusions=252 #num_redundant=4 
  1.33e-04s  0.00e+00d  [DetectDifferentVariables] #different=17 
  1.07e-04s  3.55e-06d  [ProcessSetPPC] #relevant_constraints=227 
  1.01e-05s  0.00e+00d  [FindAlmostIdenticalLinearConstraints] 
  5.92e-05s  3.95e-05d  [FindBigAtMostOneAndLinearOverlap] 
  7.55e-04s  2.62e-04d  [FindBigVerticalLinearOverlap] #blocks=5 #saved_nz=239 
  5.05e-05s  9.92e-06d  [FindBigHorizontalLinearOverlap] #linears=215 
  2.02e-05s  6.00e-08d  [MergeClauses] 
  3.87e-04s  0.00e+00d  [DetectDominanceRelations] 
  3.55e-03s  0.00e+00d  [PresolveToFixPoint] #num_loops=2 #num_dual_strengthening=1 
  3.86e-04s  0.00e+00d  [DetectDominanceRelations] 
  2.45e-03s  0.00e+00d  [PresolveToFixPoint] #num_loops=1 #num_dual_strengthening=1 
[Symmetry] Graph for symmetry has 853 nodes and 4'194 arcs.
[Symmetry] Symmetry computation done. time: 0.000260432 dtime: 0.00032975
[SAT presolve] num removable Booleans: 0 / 37
[SAT presolve] num trivial clauses: 0
[SAT presolve] [0s] clauses:4 literals:12 vars:9 one_side_vars:8 simple_definition:1 singleton_clauses:0
[SAT presolve] [2.948e-05s] clauses:4 literals:12 vars:9 one_side_vars:8 simple_definition:1 singleton_clauses:0
[SAT presolve] [4.2538e-05s] clauses:4 literals:12 vars:9 one_side_vars:8 simple_definition:1 singleton_clauses:0
  2.15e-03s  2.63e-04d  [Probe] #probed=160 #new_bounds=3 
  5.65e-06s  0.00e+00d  [MaxClique] 
  3.82e-04s  0.00e+00d  [DetectDominanceRelations] 
  3.05e-03s  0.00e+00d  [PresolveToFixPoint] #num_loops=2 #num_dual_strengthening=1 
  9.14e-04s  0.00e+00d  [ProcessAtMostOneAndLinear] 
  5.81e-04s  0.00e+00d  [DetectDuplicateConstraints] #without_enforcements=53 
  2.43e-04s  9.55e-06d  [DetectDominatedLinearConstraints] #relevant_constraints=360 #num_inclusions=118 
  1.25e-04s  0.00e+00d  [DetectDifferentVariables] #different=19 
  1.00e-04s  3.11e-06d  [ProcessSetPPC] #relevant_constraints=218 
  1.23e-05s  0.00e+00d  [FindAlmostIdenticalLinearConstraints] 
  5.47e-05s  3.62e-05d  [FindBigAtMostOneAndLinearOverlap] 
  6.06e-04s  2.31e-04d  [FindBigVerticalLinearOverlap] #blocks=3 #saved_nz=149 
  4.68e-05s  9.13e-06d  [FindBigHorizontalLinearOverlap] #linears=211 
  1.71e-05s  6.00e-08d  [MergeClauses] 
  3.79e-04s  0.00e+00d  [DetectDominanceRelations] 
  3.22e-03s  0.00e+00d  [PresolveToFixPoint] #num_loops=2 #num_dual_strengthening=1 
  3.77e-04s  0.00e+00d  [DetectDominanceRelations] 
  2.55e-03s  0.00e+00d  [PresolveToFixPoint] #num_loops=1 #num_dual_strengthening=1 
[Symmetry] Graph for symmetry has 854 nodes and 4'040 arcs.
[Symmetry] Symmetry computation done. time: 0.000249869 dtime: 0.00032176
[SAT presolve] num removable Booleans: 0 / 37
[SAT presolve] num trivial clauses: 0
[SAT presolve] [0s] clauses:4 literals:12 vars:9 one_side_vars:8 simple_definition:1 singleton_clauses:0
[SAT presolve] [2.9018e-05s] clauses:4 literals:12 vars:9 one_side_vars:8 simple_definition:1 singleton_clauses:0
[SAT presolve] [4.6176e-05s] clauses:4 literals:12 vars:9 one_side_vars:8 simple_definition:1 singleton_clauses:0
  2.13e-03s  2.60e-04d  [Probe] #probed=160 #new_bounds=2 
  5.32e-06s  0.00e+00d  [MaxClique] 
  3.79e-04s  0.00e+00d  [DetectDominanceRelations] 
  3.05e-03s  0.00e+00d  [PresolveToFixPoint] #num_loops=2 #num_dual_strengthening=1 
  8.49e-04s  0.00e+00d  [ProcessAtMostOneAndLinear] 
  5.74e-04s  0.00e+00d  [DetectDuplicateConstraints] #without_enforcements=53 
  2.02e-04s  7.57e-06d  [DetectDominatedLinearConstraints] #relevant_constraints=325 #num_inclusions=45 
  1.23e-04s  0.00e+00d  [DetectDifferentVariables] #different=20 
  9.54e-05s  2.83e-06d  [ProcessSetPPC] #relevant_constraints=214 
  1.20e-05s  0.00e+00d  [FindAlmostIdenticalLinearConstraints] 
  5.24e-05s  3.40e-05d  [FindBigAtMostOneAndLinearOverlap] 
  5.21e-04s  2.13e-04d  [FindBigVerticalLinearOverlap] #blocks=1 #saved_nz=48 
  4.55e-05s  8.91e-06d  [FindBigHorizontalLinearOverlap] #linears=207 
  1.74e-05s  6.00e-08d  [MergeClauses] 
  3.68e-04s  0.00e+00d  [DetectDominanceRelations] 
  2.70e-03s  0.00e+00d  [PresolveToFixPoint] #num_loops=2 #num_dual_strengthening=1 
  2.69e-05s  0.00e+00d  [ExpandObjective] #entries=38 #tight_variables=19 #tight_constraints=9 

Presolve summary:
  - 25 affine relations were detected.
  - rule 'TODO dual: only one blocking constraint?' was applied 460 times.
  - rule 'TODO dual: only one unspecified blocking constraint?' was applied 78 times.
  - rule 'TODO duplicate: identical constraint with different enforcements' was applied 159 times.
  - rule 'TODO linear2: contains a Boolean.' was applied 16 times.
  - rule 'affine: new relation' was applied 25 times.
  - rule 'bool_or: always true' was applied 6 times.
  - rule 'bool_or: implications' was applied 2 times.
  - rule 'deductions: 91 stored' was applied 1 time.
  - rule 'dual: fix variable' was applied 13 times.
  - rule 'dual: reduced domain' was applied 31 times.
  - rule 'duplicate: merged rhs of linear constraint' was applied 17 times.
  - rule 'duplicate: removed constraint' was applied 131 times.
  - rule 'enforcement: false literal' was applied 11 times.
  - rule 'enforcement: true literal' was applied 8 times.
  - rule 'incompatible linear: add implication' was applied 9 times.
  - rule 'linear inclusion: redundant containing constraint' was applied 1 time.
  - rule 'linear inclusion: redundant included constraint' was applied 3 times.
  - rule 'linear matrix: common vertical rectangle' was applied 9 times.
  - rule 'linear1: always true' was applied 2 times.
  - rule 'linear2: contains a Boolean.' was applied 14 times.
  - rule 'linear: always true' was applied 247 times.
  - rule 'linear: doubleton free' was applied 7 times.
  - rule 'linear: empty' was applied 18 times.
  - rule 'linear: extracted enforcement literal' was applied 1'447 times.
  - rule 'linear: fixed or dup variables' was applied 662 times.
  - rule 'linear: negative clause' was applied 11 times.
  - rule 'linear: positive clause' was applied 1 time.
  - rule 'linear: positive equal one' was applied 3 times.
  - rule 'linear: reduced variable domains' was applied 71 times.
  - rule 'linear: remapped using affine relations' was applied 612 times.
  - rule 'linear: simplified rhs' was applied 2'103 times.
  - rule 'linear: variable substitution 1' was applied 7 times.
  - rule 'linear: variable substitution 2' was applied 1 time.
  - rule 'presolve: 52 unused variables removed.' was applied 1 time.
  - rule 'presolve: iteration' was applied 3 times.
  - rule 'probing: simplified enforcement list.' was applied 2 times.

Presolved optimization model '': (model_fingerprint: 0x202aa3ac1ee67f7a)
#Variables: 90 (#ints: 6 in objective)
  - 37 Booleans in [0,1]
  - 1 in [-343,-58][7,320][385,654]
  - 1 in [-5,319]
  - 1 in [0,264]
  - 4 in [0,279]
  - 1 in [0,285]
  - 1 in [0,288]
  - 4 in [0,299]
  - 1 in [0,299][378,671]
  - 3 in [0,306]
  - 1 in [0,310]
  - 4 in [0,324]
  - 1 in [2,344]
  - 1 in [4,317]
  - 1 in [4,346]
  - 1 in [6,309]
  - 1 in [6,309][384,681]
  - 1 in [7,320]
  - 1 in [7,349]
  - 1 in [12,311]
  - 1 in [15,328]
  - 1 in [17,316]
  - 1 in [27,330]
  - 1 in [32,335]
  - 1 in [41,320][385,698][763,1076][1141,1454][1519,1769]
  - 2 in [54,367]
  - 2 in [57,367]
  - 1 in [60,373]
  - 1 in [63,373]
  - 3 in [79,367]
  - 2 in [82,367]
  - 1 in [85,373]
  - 1 in [88,373]
  - 3 in [103,367]
  - 1 in [109,373]
  - 1 in [123,378]
#kBoolOr: 4 (#literals: 12)
#kExactlyOne: 3 (#literals: 9)
#kLinear1: 13 (#enforced: 13 #multi: 6)
#kLinear2: 266 (#enforced: 230 #multi: 198)
#kLinear3: 40 (#enforced: 22)
#kLinearN: 220 (#enforced: 186) (#terms: 1'833)

Preloading model.
#Bound   0.06s best:inf   next:[138,1853] initial_domain
[Symmetry] Graph for symmetry has 770 nodes and 3'991 arcs.
[Symmetry] Symmetry computation done. time: 0.000242677 dtime: 0.00031395
#Model   0.06s var:90/90 constraints:546/546

Starting search at 0.06s with 48 workers.
16 full problem subsolvers: [core, default_lp, lb_tree_search, max_lp, no_lp, objective_lb_search, objective_lb_search_max_lp, objective_lb_search_no_lp, objective_shaving_search_max_lp, objective_shaving_search_no_lp, probing, probing_max_lp, pseudo_costs, quick_restart, quick_restart_no_lp, reduced_costs]
30 first solution subsolvers: [fj_long_default(2), fj_long_lin_default, fj_long_lin_perturb, fj_long_lin_random, fj_long_perturb, fj_long_random, fj_short_default(2), fj_short_lin_default(2), fj_short_lin_perturb, fj_short_lin_random, fj_short_perturb, fj_short_random, fs_random(4), fs_random_no_lp(4), fs_random_quick_restart(4), fs_random_quick_restart_no_lp(3)]
13 incomplete subsolvers: [feasibility_pump, graph_arc_lns, graph_cst_lns, graph_dec_lns, graph_var_lns, rins/rens, rnd_cst_lns, rnd_var_lns, violation_ls(5)]
3 helper subsolvers: [neighborhood_helper, synchronization_agent, update_gap_integral]
#1       0.06s best:880   next:[138,879]  no_lp (fixed_bools=0/67)
#Bound   0.06s best:880   next:[139,879]  bool_core (num_cores=1 [size:2 mw:1 d:1] a=5 d=1 fixed=0/54 clauses=13)
#Bound   0.06s best:880   next:[140,879]  bool_core (num_cores=1 [cover] a=5 d=1 fixed=0/57 clauses=14)
#Bound   0.06s best:880   next:[141,879]  bool_core (num_cores=1 [cover] a=5 d=1 fixed=1/60 clauses=16)
#Bound   0.06s best:880   next:[142,879]  bool_core (num_cores=1 [cover] a=5 d=1 fixed=2/63 clauses=19)
#Bound   0.06s best:880   next:[143,879]  bool_core (num_cores=1 [cover] a=5 d=1 fixed=3/66 clauses=23)
#Bound   0.07s best:880   next:[144,879]  bool_core (num_cores=1 [cover] a=5 d=1 fixed=4/69 clauses=28)
#Bound   0.07s best:880   next:[153,879]  objective_lb_search_no_lp
#Bound   0.07s best:880   next:[160,879]  quick_restart
#2       0.07s best:759   next:[160,758]  no_lp (fixed_bools=0/76)
#3       0.07s best:668   next:[160,667]  no_lp (fixed_bools=0/92)
#Bound   0.07s best:668   next:[283,667]  objective_lb_search_no_lp
#4       0.07s best:662   next:[283,661]  quick_restart_no_lp (fixed_bools=0/98)
#5       0.07s best:661   next:[283,660]  violation_ls(batch:1 #solutions_imported:1 #lin_moves:0 #lin_evals:6 #gen_moves:4 #gen_evals:0 #comp_moves:4 #backtracks:0 #weight_updates:0)
#Bound   0.07s best:661   next:[284,660]  objective_lb_search_no_lp
#6       0.07s best:660   next:[284,659]  violation_ls(batch:2 #solutions_imported:2 #lin_moves:14 #lin_evals:65 #gen_moves:4 #gen_evals:0 #comp_moves:4 #backtracks:0 #weight_updates:8)
#7       0.07s best:643   next:[284,642]  quick_restart_no_lp (fixed_bools=0/129)
#8       0.08s best:565   next:[284,564]  no_lp (fixed_bools=0/113)
#Bound   0.08s best:565   next:[318,564]  objective_lb_search_no_lp
#9       0.08s best:522   next:[318,521]  no_lp (fixed_bools=0/121)
#Bound   0.08s best:522   next:[349,521]  objective_lb_search_no_lp
#Bound   0.10s best:522   next:[354,521]  objective_lb_search_no_lp
#10      0.11s best:520   next:[354,519]  no_lp (fixed_bools=1/141)
#11      0.11s best:517   next:[354,516]  no_lp (fixed_bools=1/147)
#12      0.11s best:507   next:[354,506]  no_lp (fixed_bools=1/149)
#Bound   0.12s best:507   next:[381,506]  objective_lb_search_no_lp
#Bound   0.13s best:507   next:[414,506]  objective_lb_search_no_lp
#13      0.14s best:477   next:[414,476]  no_lp (fixed_bools=1/165)
#14      0.14s best:471   next:[414,470]  no_lp (fixed_bools=1/173)
#15      0.14s best:453   next:[414,452]  no_lp (fixed_bools=1/178)
#Bound   0.15s best:453   next:[416,452]  objective_lb_search_no_lp
#Bound   0.17s best:453   next:[419,452]  objective_lb_search_no_lp
#Bound   0.20s best:453   next:[427,452]  objective_lb_search_no_lp
#Bound   0.21s best:453   next:[436,452]  objective_lb_search_no_lp
#Model   0.22s var:89/90 constraints:453/546
#Model   0.22s var:87/90 constraints:377/546
#Model   0.22s var:83/90 constraints:300/546
#Model   0.22s var:79/90 constraints:242/546
#Done    0.22s quick_restart
#Model   0.22s var:78/90 constraints:229/546
#Done    0.22s core

Task timing                                  n [     min,      max]      avg      dev     time         n [     min,      max]      avg      dev    dtime
                             'core':         1 [162.54ms, 162.54ms] 162.54ms   0.00ns 162.54ms         1 [ 13.29ms,  13.29ms]  13.29ms   0.00ns  13.29ms
                       'default_lp':         1 [162.23ms, 162.23ms] 162.23ms   0.00ns 162.23ms         1 [ 15.36ms,  15.36ms]  15.36ms   0.00ns  15.36ms
                 'feasibility_pump':        10 [969.72us,  23.09ms]  13.22ms   6.21ms 132.24ms         9 [262.16us,   2.17ms]   1.74ms 532.85us  15.69ms
                  'fj_long_default':         0 [  0.00ns,   0.00ns]   0.00ns   0.00ns   0.00ns         0 [  0.00ns,   0.00ns]   0.00ns   0.00ns   0.00ns
                  'fj_long_default':         0 [  0.00ns,   0.00ns]   0.00ns   0.00ns   0.00ns         0 [  0.00ns,   0.00ns]   0.00ns   0.00ns   0.00ns
              'fj_long_lin_default':         0 [  0.00ns,   0.00ns]   0.00ns   0.00ns   0.00ns         0 [  0.00ns,   0.00ns]   0.00ns   0.00ns   0.00ns
              'fj_long_lin_perturb':         0 [  0.00ns,   0.00ns]   0.00ns   0.00ns   0.00ns         0 [  0.00ns,   0.00ns]   0.00ns   0.00ns   0.00ns
               'fj_long_lin_random':         0 [  0.00ns,   0.00ns]   0.00ns   0.00ns   0.00ns         0 [  0.00ns,   0.00ns]   0.00ns   0.00ns   0.00ns
                  'fj_long_perturb':         0 [  0.00ns,   0.00ns]   0.00ns   0.00ns   0.00ns         0 [  0.00ns,   0.00ns]   0.00ns   0.00ns   0.00ns
                   'fj_long_random':         0 [  0.00ns,   0.00ns]   0.00ns   0.00ns   0.00ns         0 [  0.00ns,   0.00ns]   0.00ns   0.00ns   0.00ns
                 'fj_short_default':         0 [  0.00ns,   0.00ns]   0.00ns   0.00ns   0.00ns         0 [  0.00ns,   0.00ns]   0.00ns   0.00ns   0.00ns
                 'fj_short_default':         0 [  0.00ns,   0.00ns]   0.00ns   0.00ns   0.00ns         0 [  0.00ns,   0.00ns]   0.00ns   0.00ns   0.00ns
             'fj_short_lin_default':         0 [  0.00ns,   0.00ns]   0.00ns   0.00ns   0.00ns         0 [  0.00ns,   0.00ns]   0.00ns   0.00ns   0.00ns
             'fj_short_lin_default':         0 [  0.00ns,   0.00ns]   0.00ns   0.00ns   0.00ns         0 [  0.00ns,   0.00ns]   0.00ns   0.00ns   0.00ns
             'fj_short_lin_perturb':         0 [  0.00ns,   0.00ns]   0.00ns   0.00ns   0.00ns         0 [  0.00ns,   0.00ns]   0.00ns   0.00ns   0.00ns
              'fj_short_lin_random':         0 [  0.00ns,   0.00ns]   0.00ns   0.00ns   0.00ns         0 [  0.00ns,   0.00ns]   0.00ns   0.00ns   0.00ns
                 'fj_short_perturb':         0 [  0.00ns,   0.00ns]   0.00ns   0.00ns   0.00ns         0 [  0.00ns,   0.00ns]   0.00ns   0.00ns   0.00ns
                  'fj_short_random':         0 [  0.00ns,   0.00ns]   0.00ns   0.00ns   0.00ns         0 [  0.00ns,   0.00ns]   0.00ns   0.00ns   0.00ns
                        'fs_random':         0 [  0.00ns,   0.00ns]   0.00ns   0.00ns   0.00ns         0 [  0.00ns,   0.00ns]   0.00ns   0.00ns   0.00ns
                        'fs_random':         1 [  3.25ms,   3.25ms]   3.25ms   0.00ns   3.25ms         1 [ 20.00ns,  20.00ns]  20.00ns   0.00ns  20.00ns
                        'fs_random':         1 [  3.74ms,   3.74ms]   3.74ms   0.00ns   3.74ms         1 [ 20.00ns,  20.00ns]  20.00ns   0.00ns  20.00ns
                        'fs_random':         1 [  3.91ms,   3.91ms]   3.91ms   0.00ns   3.91ms         1 [ 20.00ns,  20.00ns]  20.00ns   0.00ns  20.00ns
                  'fs_random_no_lp':         0 [  0.00ns,   0.00ns]   0.00ns   0.00ns   0.00ns         0 [  0.00ns,   0.00ns]   0.00ns   0.00ns   0.00ns
                  'fs_random_no_lp':         0 [  0.00ns,   0.00ns]   0.00ns   0.00ns   0.00ns         0 [  0.00ns,   0.00ns]   0.00ns   0.00ns   0.00ns
                  'fs_random_no_lp':         1 [  2.74ms,   2.74ms]   2.74ms   0.00ns   2.74ms         0 [  0.00ns,   0.00ns]   0.00ns   0.00ns   0.00ns
                  'fs_random_no_lp':         1 [  2.77ms,   2.77ms]   2.77ms   0.00ns   2.77ms         0 [  0.00ns,   0.00ns]   0.00ns   0.00ns   0.00ns
          'fs_random_quick_restart':         0 [  0.00ns,   0.00ns]   0.00ns   0.00ns   0.00ns         0 [  0.00ns,   0.00ns]   0.00ns   0.00ns   0.00ns
          'fs_random_quick_restart':         1 [  2.49ms,   2.49ms]   2.49ms   0.00ns   2.49ms         1 [ 20.00ns,  20.00ns]  20.00ns   0.00ns  20.00ns
          'fs_random_quick_restart':         1 [  3.18ms,   3.18ms]   3.18ms   0.00ns   3.18ms         1 [ 20.00ns,  20.00ns]  20.00ns   0.00ns  20.00ns
          'fs_random_quick_restart':         1 [  3.36ms,   3.36ms]   3.36ms   0.00ns   3.36ms         1 [ 20.00ns,  20.00ns]  20.00ns   0.00ns  20.00ns
    'fs_random_quick_restart_no_lp':         0 [  0.00ns,   0.00ns]   0.00ns   0.00ns   0.00ns         0 [  0.00ns,   0.00ns]   0.00ns   0.00ns   0.00ns
    'fs_random_quick_restart_no_lp':         1 [  2.57ms,   2.57ms]   2.57ms   0.00ns   2.57ms         0 [  0.00ns,   0.00ns]   0.00ns   0.00ns   0.00ns
    'fs_random_quick_restart_no_lp':         1 [  2.81ms,   2.81ms]   2.81ms   0.00ns   2.81ms         0 [  0.00ns,   0.00ns]   0.00ns   0.00ns   0.00ns
                    'graph_arc_lns':        15 [  2.05ms,  85.81ms]  37.30ms  21.45ms 559.54ms        12 [ 10.00ns,   3.25ms] 780.74us 992.08us   9.37ms
                    'graph_cst_lns':        15 [514.40us,   1.16ms] 651.80us 190.51us   9.78ms         0 [  0.00ns,   0.00ns]   0.00ns   0.00ns   0.00ns
                    'graph_dec_lns':        15 [  1.71ms,  93.10ms]  37.70ms  25.24ms 565.47ms        11 [ 10.00ns,   6.50ms] 798.70us   1.84ms   8.79ms
                    'graph_var_lns':        16 [  5.70us, 112.90ms]  36.59ms  31.80ms 585.49ms        11 [ 10.00ns,  10.78ms]   2.04ms   3.85ms  22.44ms
                   'lb_tree_search':         1 [161.93ms, 161.93ms] 161.93ms   0.00ns 161.93ms         1 [ 51.48us,  51.48us]  51.48us   0.00ns  51.48us
                           'max_lp':         1 [162.44ms, 162.44ms] 162.44ms   0.00ns 162.44ms         1 [ 52.89us,  52.89us]  52.89us   0.00ns  52.89us
                            'no_lp':         1 [162.21ms, 162.21ms] 162.21ms   0.00ns 162.21ms         1 [ 19.10ms,  19.10ms]  19.10ms   0.00ns  19.10ms
              'objective_lb_search':         1 [161.08ms, 161.08ms] 161.08ms   0.00ns 161.08ms         1 [ 12.16ms,  12.16ms]  12.16ms   0.00ns  12.16ms
       'objective_lb_search_max_lp':         1 [160.41ms, 160.41ms] 160.41ms   0.00ns 160.41ms         1 [  6.51ms,   6.51ms]   6.51ms   0.00ns   6.51ms
        'objective_lb_search_no_lp':         1 [160.20ms, 160.20ms] 160.20ms   0.00ns 160.20ms         1 [ 16.82ms,  16.82ms]  16.82ms   0.00ns  16.82ms
  'objective_shaving_search_max_lp':         9 [994.33us,  46.91ms]  15.69ms  13.50ms 141.23ms         4 [  3.96us, 408.90us] 202.08us 143.31us 808.31us
   'objective_shaving_search_no_lp':         8 [  3.62ms,  48.87ms]  18.07ms  16.09ms 144.57ms         4 [196.39us, 616.43us] 452.66us 176.35us   1.81ms
                          'probing':         1 [163.91ms, 163.91ms] 163.91ms   0.00ns 163.91ms         1 [  3.24ms,   3.24ms]   3.24ms   0.00ns   3.24ms
                   'probing_max_lp':         1 [160.83ms, 160.83ms] 160.83ms   0.00ns 160.83ms         1 [ 52.40us,  52.40us]  52.40us   0.00ns  52.40us
                     'pseudo_costs':         1 [161.35ms, 161.35ms] 161.35ms   0.00ns 161.35ms         1 [  4.80ms,   4.80ms]   4.80ms   0.00ns   4.80ms
                    'quick_restart':         1 [161.16ms, 161.16ms] 161.16ms   0.00ns 161.16ms         1 [ 16.97ms,  16.97ms]  16.97ms   0.00ns  16.97ms
              'quick_restart_no_lp':         1 [161.61ms, 161.61ms] 161.61ms   0.00ns 161.61ms         1 [ 15.70ms,  15.70ms]  15.70ms   0.00ns  15.70ms
                    'reduced_costs':         1 [163.17ms, 163.17ms] 163.17ms   0.00ns 163.17ms         1 [  5.17ms,   5.17ms]   5.17ms   0.00ns   5.17ms
                        'rins/rens':        16 [  1.59ms, 129.94ms]  61.36ms  43.65ms 981.77ms        10 [  3.38us,  23.56ms]   4.99ms   6.87ms  49.86ms
                      'rnd_cst_lns':        16 [490.47us,  43.78ms]  13.97ms  12.75ms 223.52ms         9 [ 10.00ns, 886.07us] 232.71us 289.42us   2.09ms
                      'rnd_var_lns':        16 [  1.28ms,  92.61ms]  25.98ms  22.23ms 415.64ms        13 [ 10.00ns,   3.74ms] 701.26us   1.03ms   9.12ms
                     'violation_ls':         2 [ 47.30ms, 102.31ms]  74.81ms  27.51ms 149.61ms         2 [ 17.05ms,  36.51ms]  26.78ms   9.73ms  53.55ms
                     'violation_ls':         2 [ 61.13ms,  89.52ms]  75.33ms  14.20ms 150.66ms         2 [ 27.86ms,  32.56ms]  30.21ms   2.35ms  60.42ms
                     'violation_ls':         4 [103.82us, 113.47ms]  34.24ms  46.35ms 136.96ms         4 [  6.09us,  40.88ms]  12.67ms  16.62ms  50.69ms
                     'violation_ls':         4 [239.53us, 104.99ms]  36.39ms  42.73ms 145.58ms         4 [  6.65us,  40.11ms]  14.10ms  16.41ms  56.38ms
                     'violation_ls':         5 [388.20us,  69.88ms]  29.78ms  22.71ms 148.90ms         5 [103.35us,  25.29ms]  11.03ms   8.44ms  55.15ms

Search stats                        Bools  Conflicts  Branches  Restarts  BoolPropag  IntegerPropag
                           'core':    865        138       688       352      34'919         23'973
                     'default_lp':     80        197     1'118       402       3'316         45'415
                      'fs_random':      0          0         0         0           0              0
                      'fs_random':     48          0         0         0           0              0
                      'fs_random':     48          0         0         0           0              0
                      'fs_random':     48          0        28        28          25            132
                'fs_random_no_lp':      0          0         0         0           0              0
                'fs_random_no_lp':      0          0         0         0           0              0
                'fs_random_no_lp':     48          0         0         0           0              0
                'fs_random_no_lp':     48          0         0         0           0              0
        'fs_random_quick_restart':      0          0         0         0           0              0
        'fs_random_quick_restart':     48          0         0         0           0              0
        'fs_random_quick_restart':     48          0         0         0           0              0
        'fs_random_quick_restart':     48          0         0         0           0              0
  'fs_random_quick_restart_no_lp':      0          0         0         0           0              0
  'fs_random_quick_restart_no_lp':     48          0         0         0           0              0
  'fs_random_quick_restart_no_lp':     48          0         0         0           0              0
                 'lb_tree_search':     48          0        96        96          36            606
                         'max_lp':     48          0        96        96          36            606
                          'no_lp':    180        277     2'547       700      17'668        102'244
            'objective_lb_search':     63        108       837       378       1'961         28'206
     'objective_lb_search_max_lp':     56          4       112        96         113          1'301
      'objective_lb_search_no_lp':     63        506     1'714       611       6'331         92'846
                        'probing':     90         16       164       164         456          2'475
                 'probing_max_lp':     48          0        96        96          36            606
                   'pseudo_costs':     56          1       116        96          71          1'148
                  'quick_restart':     59         92     1'445       673       2'307         29'671
            'quick_restart_no_lp':    166        385     2'233       544      17'208         81'075
                  'reduced_costs':     49          1        97        97          52            759

SAT stats                           ClassicMinim  LitRemoved  LitLearned  LitForgotten  Subsumed  MClauses  MDecisions  MLitTrue  MSubsumed  MLitRemoved  MReused
                           'core':            24          58          62             0         0        22         108         0          0            0        2
                     'default_lp':           123         332       1'434             0        12        74         441         0          7           43        9
                      'fs_random':             0           0           0             0         0         0           0         0          0            0        0
                      'fs_random':             0           0           0             0         0         0           0         0          0            0        0
                      'fs_random':             0           0           0             0         0         0           0         0          0            0        0
                      'fs_random':             0           0           0             0         0         0           0         0          0            0        0
                'fs_random_no_lp':             0           0           0             0         0         0           0         0          0            0        0
                'fs_random_no_lp':             0           0           0             0         0         0           0         0          0            0        0
                'fs_random_no_lp':             0           0           0             0         0         0           0         0          0            0        0
                'fs_random_no_lp':             0           0           0             0         0         0           0         0          0            0        0
        'fs_random_quick_restart':             0           0           0             0         0         0           0         0          0            0        0
        'fs_random_quick_restart':             0           0           0             0         0         0           0         0          0            0        0
        'fs_random_quick_restart':             0           0           0             0         0         0           0         0          0            0        0
        'fs_random_quick_restart':             0           0           0             0         0         0           0         0          0            0        0
  'fs_random_quick_restart_no_lp':             0           0           0             0         0         0           0         0          0            0        0
  'fs_random_quick_restart_no_lp':             0           0           0             0         0         0           0         0          0            0        0
  'fs_random_quick_restart_no_lp':             0           0           0             0         0         0           0         0          0            0        0
                 'lb_tree_search':             0           0           0             0         0         0           0         0          0            0        0
                         'max_lp':             0           0           0             0         0         0           0         0          0            0        0
                          'no_lp':           158         321       1'750             0        27       185         877         0         70          351       11
            'objective_lb_search':            67         127         480             0        11        80         380         0         18           87        9
     'objective_lb_search_max_lp':             3          11          25             0         0         0           0         0          0            0        0
      'objective_lb_search_no_lp':           371         828       2'194             0        32       120         616         0         11           46       12
                        'probing':             0           0          16             0         0         0           0         0          0            0        0
                 'probing_max_lp':             0           0           0             0         0         0           0         0          0            0        0
                   'pseudo_costs':             1           1           8             0         0         0           0         0          0            0        0
                  'quick_restart':            54          85         743             0         2       129         611         5          5           38        9
            'quick_restart_no_lp':           203         431       2'952             0        20       112         665         0         29          155       19
                  'reduced_costs':             0           0           1             0         0         0           0         0          0            0        0

Lp stats                         Component  Iterations  AddedCuts  OPTIMAL  DUAL_F.  DUAL_U.
                  'default_lp':          1         882        294      260        0        0
                   'fs_random':          1           0          0        0        0        0
                   'fs_random':          1           0          0        0        0        0
                   'fs_random':          1           0          0        0        0        0
     'fs_random_quick_restart':          1           0          0        0        0        0
     'fs_random_quick_restart':          1           0          0        0        0        0
     'fs_random_quick_restart':          1           0          0        0        0        0
              'lb_tree_search':          1         101        374        3        0        0
                      'max_lp':          1         149        473        3        0        0
         'objective_lb_search':          1         771        322      126        0        0
  'objective_lb_search_max_lp':          1         437        661       22        8        0
                     'probing':          1         164        397      101        0        0
              'probing_max_lp':          1         115        375        3        0        0
                'pseudo_costs':          1         307        595       29        3        0
               'quick_restart':          1         940        375      226        0        0
               'reduced_costs':          1         315        775       17        0        0

Lp dimension                                                                    Final dimension of first component
                  'default_lp':   128 rows, 86 columns, 476 entries with magnitude in [1.832832e-02, 1.000000e+00]
                   'fs_random':       0 rows, 86 columns, 0 entries with magnitude in [0.000000e+00, 0.000000e+00]
                   'fs_random':       0 rows, 86 columns, 0 entries with magnitude in [0.000000e+00, 0.000000e+00]
                   'fs_random':       0 rows, 86 columns, 0 entries with magnitude in [0.000000e+00, 0.000000e+00]
     'fs_random_quick_restart':       0 rows, 86 columns, 0 entries with magnitude in [0.000000e+00, 0.000000e+00]
     'fs_random_quick_restart':       0 rows, 86 columns, 0 entries with magnitude in [0.000000e+00, 0.000000e+00]
     'fs_random_quick_restart':       0 rows, 86 columns, 0 entries with magnitude in [0.000000e+00, 0.000000e+00]
              'lb_tree_search':  596 rows, 90 columns, 4076 entries with magnitude in [6.602860e-03, 1.000000e+00]
                      'max_lp':  596 rows, 90 columns, 4066 entries with magnitude in [6.602860e-03, 1.000000e+00]
         'objective_lb_search':   198 rows, 86 columns, 724 entries with magnitude in [2.131066e-03, 1.000000e+00]
  'objective_lb_search_max_lp':  329 rows, 90 columns, 1405 entries with magnitude in [3.243746e-04, 1.000000e+00]
                     'probing':  206 rows, 86 columns, 1263 entries with magnitude in [2.318844e-04, 1.000000e+00]
              'probing_max_lp':  596 rows, 90 columns, 4082 entries with magnitude in [6.602860e-03, 1.000000e+00]
                'pseudo_costs':  312 rows, 90 columns, 1309 entries with magnitude in [1.697954e-04, 1.000000e+00]
               'quick_restart':   175 rows, 86 columns, 994 entries with magnitude in [1.326928e-03, 1.000000e+00]
               'reduced_costs':  372 rows, 90 columns, 1463 entries with magnitude in [1.462776e-04, 1.000000e+00]

Lp debug                         CutPropag  CutEqPropag  Adjust  Overflow  Bad  BadScaling
                  'default_lp':          5            0      77         0  176           0
                   'fs_random':          0            0       0         0    0           0
                   'fs_random':          0            0       0         0    0           0
                   'fs_random':          0            0       0         0    0           0
     'fs_random_quick_restart':          0            0       0         0    0           0
     'fs_random_quick_restart':          0            0       0         0    0           0
     'fs_random_quick_restart':          0            0       0         0    0           0
              'lb_tree_search':          0            0       2         0  130           0
                      'max_lp':          0            0       2         0  183           0
         'objective_lb_search':          1            0      72         0  193           0
  'objective_lb_search_max_lp':          1            0      21         0  337           0
                     'probing':          0            0      23         0  257           0
              'probing_max_lp':          0            0       2         0  161           0
                'pseudo_costs':          1            0      22         0  315           0
               'quick_restart':          0            0     144         0  385           0
               'reduced_costs':          1            0      10         0  680           0

Lp pool                          Constraints  Updates  Simplif  Merged  Shortened  Split  Strenghtened  Cuts/Call
                  'default_lp':          385      109      351       0         60     56           292    294/460
                   'fs_random':           91        0        0       0          0      0             0        0/0
                   'fs_random':           91        0        0       0          0      0             0        0/0
                   'fs_random':           91        0        0       0          0      0             0        0/0
     'fs_random_quick_restart':           91        0        0       0          0      0             0        0/0
     'fs_random_quick_restart':           91        0        0       0          0      0             0        0/0
     'fs_random_quick_restart':           91        0        0       0          0      0             0        0/0
              'lb_tree_search':          918        0        0       2          0      0            96    374/622
                      'max_lp':        1'017        2        0       2          0      2           139    473/760
         'objective_lb_search':          413       66      166       0         48     22           210    322/525
  'objective_lb_search_max_lp':        1'207       14       25       0          0      3           106  661/1'009
                     'probing':          487       90        6       1          0      9            90    397/584
              'probing_max_lp':          919        0        0       2          0      0            98    375/634
                'pseudo_costs':        1'141        4        6       0          0      2           109    595/948
               'quick_restart':          466       48       44       0          0     44           105    375/613
               'reduced_costs':        1'317       45    1'011       4        578      8         1'345  775/1'278

Lp Cut            defaul  max_lp  quick_  reduce  pseudo  lb_tre  probin  object  probin  object
          CG_FF:      26      44      36      74      68      30      28      36      30      64
           CG_K:       7      11      11      33      26       6       8      15       6      25
           CG_R:      12      40      16      34      34      25      12      12      25      27
          CG_RB:      46      83      80     169     125      48      82      51      48     129
         CG_RBP:       8      12      13      16      14       6      19       8       6      24
         Clique:       -       -       -       3       3       -       -       -       -       7
             IB:     114      69     115     126     119      66     111     117      65     121
       MIR_1_FF:      15      39      19      43      37      34      18      14      35      36
        MIR_1_K:       5       9       4       5       5       7       7       4       9       4
        MIR_1_R:       5       2       3       -       4       2       4       3       4       2
       MIR_1_RB:      14      32      14      42      36      27      15      11      30      43
      MIR_1_RBP:       4      13       2      10       7       9       5       3       7      11
      MIR_1_RLT:       -       1       -       4       2       1       -       -       1       2
       MIR_2_FF:       4      15       8      14       7      11       8       7      10       9
        MIR_2_K:       3       2       3       2       1       4       5       3       1       3
        MIR_2_R:       3       3       3       8       5       3       5       3       4       8
       MIR_2_RB:       5      10       9      30      15      13       8       6       9      14
      MIR_2_RBP:       2       6       2       9       2       5       6       1       1       7
       MIR_3_FF:       1       9       2      12       3       5       5       2       8       8
        MIR_3_K:       -       2       1       -       -       3       5       1       2       1
        MIR_3_R:       1       4       2      10       3       3       6       1       4       6
       MIR_3_RB:       1       6       6      21       7       4       5       4       6       9
      MIR_3_RBP:       2       4       -       6       1       3       3       1       2       4
       MIR_4_FF:       1       5       1       2       1       3       2       -       4       2
        MIR_4_K:       -       1       1       -       1       1       2       -       -       -
        MIR_4_R:       2       3       1       2       2       1       2       -       -       3
       MIR_4_RB:       2       3       1       4       4       1       2       2       4       5
      MIR_4_RBP:       -       1       -       -       -       -       1       -       -       -
       MIR_5_FF:       -       3       2       -       -       4       1       1       1       -
        MIR_5_K:       -       1       -       -       1       1       -       -       -       -
        MIR_5_R:       -       3       1       -       -       4       1       -       1       2
       MIR_5_RB:       1       1       1       -       -       2       1       1       1       2
      MIR_5_RBP:       -       -       -       -       -       -       -       -       -       1
       MIR_6_FF:       -       -       -       -       -       -       1       -       2       -
        MIR_6_K:       -       -       -       -       -       1       -       -       2       -
        MIR_6_R:       -       -       -       -       -       1       1       -       2       -
       MIR_6_RB:       -       -       -       -       -       1       1       -       2       -
      MIR_6_RBP:       -       -       -       -       -       -       -       -       1       -
   ZERO_HALF_FF:       1      10       5      18      15      10       3       3      10      19
    ZERO_HALF_K:       -       4       -       2       3       2       1       -       3       3
    ZERO_HALF_R:       5      10       7      38      21      10       6       6       9      26
   ZERO_HALF_RB:       3       6       5      29      17       9       5       5      10      24
  ZERO_HALF_RBP:       1       6       1       9       6       8       2       1      10      10

LNS stats           Improv/Calls  Closed  Difficulty  TimeLimit
  'graph_arc_lns':          3/14     79%        0.98       0.10
  'graph_cst_lns':           0/0      0%        0.50       0.10
  'graph_dec_lns':          3/14     71%        0.96       0.10
  'graph_var_lns':          2/14     79%        0.98       0.10
      'rins/rens':          5/15     67%        0.95       0.10
    'rnd_cst_lns':           1/9     89%        0.97       0.10
    'rnd_var_lns':          2/14     93%        0.99       0.10

LS stats                   Batches  Restarts  LinMoves  GenMoves  CompoundMoves  WeightUpdates
       'fj_long_default':        0         0         0         0              0              0
       'fj_long_default':        0         0         0         0              0              0
   'fj_long_lin_default':        0         0         0         0              0              0
   'fj_long_lin_perturb':        0         0         0         0              0              0
    'fj_long_lin_random':        0         0         0         0              0              0
       'fj_long_perturb':        0         0         0         0              0              0
        'fj_long_random':        0         0         0         0              0              0
      'fj_short_default':        0         0         0         0              0              0
      'fj_short_default':        0         0         0         0              0              0
  'fj_short_lin_default':        0         0         0         0              0              0
  'fj_short_lin_default':        0         0         0         0              0              0
  'fj_short_lin_perturb':        0         0         0         0              0              0
   'fj_short_lin_random':        0         0         0         0              0              0
      'fj_short_perturb':        0         0         0         0              0              0
       'fj_short_random':        0         0         0         0              0              0
          'violation_ls':        2         0         0    19'158            618            144
          'violation_ls':        2         0     6'862    11'369            417            968
          'violation_ls':        4         0     3'975    14'008            273          4'002
          'violation_ls':        4         0     4'034    12'164            638            624
          'violation_ls':        5         0    11'731     8'670            264         12'335

Solutions (15)            Num    Rank
                'no_lp':   11  [1,15]
  'quick_restart_no_lp':    2   [4,7]
         'violation_ls':    2   [5,6]

Objective bounds                Num
                  'bool_core':    6
             'initial_domain':    1
  'objective_lb_search_no_lp':   12
              'quick_restart':    1

Solution repositories    Added  Queried  Ignored  Synchro
  'feasible solutions':     88      245        6       70
        'lp solutions':      0        0        0        0
                'pump':    143       16

Improving bounds shared          Num
                        'core':    1
                  'default_lp':   21
                       'no_lp':    2
  'objective_lb_search_max_lp':    1
   'objective_lb_search_no_lp':   69
                     'probing':    5
               'quick_restart':  118
         'quick_restart_no_lp':    1
               'reduced_costs':    1

Clauses shared                  Num
                 'default_lp':    5
                      'no_lp':    9
  'objective_lb_search_no_lp':    9
              'quick_restart':    2
        'quick_restart_no_lp':    7

CpSolverResponse summary:
status: OPTIMAL
objective: 453
best_bound: 453
integers: 0
booleans: 0
conflicts: 0
branches: 0
propagations: 0
integer_propagations: 0
restarts: 0
lp_iterations: 0
walltime: 0.231623
usertime: 0.231623
deterministic_time: 0.527147
gap_integral: 1.04655
solution_fingerprint: 0x669c655b404a40db


--- Simulation Gantt  partir du modle mathmatique ---
{'big':0, 'due_date':114, 'pos_time':5, 'status':0, 'blocked':0, 'operations':["{'type':1, 'processing_time':20}", "{'type':0, 'processing_time':38}"]}
{'big':1, 'due_date':50, 'pos_time':5, 'status':1, 'blocked':1, 'operations':["{'type':1, 'processing_time':53}"]}
{'big':1, 'due_date':93, 'pos_time':5, 'status':1, 'blocked':1, 'operations':["{'type':0, 'processing_time':24}"]}
{'big':0, 'due_date':90, 'pos_time':5, 'status':2, 'blocked':0, 'operations':["{'type':1, 'processing_time':11}", "{'type':0, 'processing_time':57}"]}
{'big':0, 'due_date':68, 'pos_time':5, 'status':2, 'blocked':2, 'operations':["{'type':0, 'processing_time':49}"]}
